key,date,article_daily_id,title,text
20020507-0,20020507,0,四成官吏減薪或變加薪未能大削公務員薪酬　阿松失敗了,四成官吏減薪或變加薪 未能大削公務員薪酬　阿松失敗了 【本報訊】財政司司長梁錦松向公務員開刀大幅減薪遇到阻力。政府昨日公布，根據現行機制，以調查私人機構薪酬作比較，得出的公務員減薪指標，中低級分別減百分之一點六四及一點五八，高級減百分之四點四二，比財政司司長梁錦松在兩個月前財政預算案中，假設公務員一律減百分之四點七五的預算少了很多。 工會代表及學者承認，倘政府完全根據調查結果調薪，約有四成即七萬未達原職級頂薪點的公務員，更有在逆市中獲得輕微加薪的可能。　記者：黎國剛 早餐派立法會議員李家祥批評政府雷聲大雨點小，梁錦松在現行調薪機制下根本無能為力；民主黨議員張文光則以大跌眼鏡來形容公務員的減薪指標。商界代表的立法會議員田北俊也大歎「肯定唔可以減四點七五啦！」  不過，政府消息人士強調，現階段不應排除公務員要大幅減薪的可能，一切要視乎政府高層的政治決心有幾大。     實際減幅五月決定   政府昨日公布，薪酬趨勢調查委員會調查九十一間私人機構的薪酬調整，結果出現中低級員工減薪不足百分之一，高級也只減百分之三點幾。委員會根據現行機制，再扣減公務員每年自動增加的一個薪級點，得出十八萬公務員和十五萬資助機構員工減薪指標是百分之一點五八至四點四二。 調查顯示梁錦松第一回合失敗了，但政務司司長曾蔭權對記者說，這是初步數據，政府會按慣常機制，考慮本港經濟狀況、政府開支預算、生活費用變動、員工要求和士氣等，希望在五月之內作決定。梁錦松昨日仍放假，曾蔭權對記者問梁錦松曾訂下四點七五的預算減幅，只是說政府多次聲明這是一個假設。  薪酬趨勢調查委員會成員張炳良接受查詢時承認，倘政府完全根據薪酬趨勢調查結果減薪，理論上部份公務員今年反而會獲得加薪。  張炳良說，一般來說，公務員每年會自動獲得一個增薪點，約加薪百分之三，但個別不同職級會略有不同。假如政府按照調查結果，中低級公務員減薪約一個半百分點，獲得增薪點的公務員，薪酬來回之後反而會獲得加薪超過百分之一。  公務員工會聯合會主席梁籌庭表示，目前約有四成即七萬多名公務員可獲增薪點，他們在今次減薪後，仍可獲得實質加薪。  他舉例說，以一名薪級點零點、月入八千三百二十元的員工為例，若其跳升一個薪級點，應該月入多出五百一十五元，達八千八百三十五元；換言之，扣除一點五八的減薪幅度，仍可獲加薪三百多元。     三成人指減幅過少   本報昨晚以音頻電話成功訪問二百九十一名市民，近三成七人認為薪酬趨勢調查結果的公務員減薪幅度合理，約三成三人則指減得太少，只有不足一成人指減得太多。對於調查結果減幅較財政司司長梁錦松在預算案中預計的為少，逾二成人認為薪酬調查機制有問題，近三成人則相信梁當初計數時掌握資料有誤或胡亂計算。
20020507-1,20020507,1,自言「三點不露」為見選民李國寶：永遠不答婚外情,自言「三點不露」為見選民 李國寶：永遠不答婚外情 被傳媒揭出涉婚外情的東亞銀行主席李國寶在漢城被記者追訪三日兩夜後，終表明永遠不會就他的婚外情等私生活問題作答，但卻主動對「三點不露」的稱號作出解釋。李國寶昨日接受記者專訪時又透露，東亞銀行正考慮在內地設立後勤支援中心，減省成本。  被立法會同僚冠以「三點不露」稱號的議員李國寶，啞忍了這個外號多年。昨在漢城朝鮮酒店內的韓國餐廳接受記者訪問時，終於主動向記者透露原委，又強調自己「並唔係去偷懶」。他說，每逢周三立法會大會當日，他都會預留下午四時及以後時間，會見銀行界的選民，接受他們的投訴，落實他作為立法會議員的職責。「我平時好忙，但每逢星期三同星期五，都會reserve（預留）畀佢哋（選民）……所以，我唔係去咗偷懶㗎！」他解釋，周三的立法會會議，由下午二時半至四時左右，是答問時間，所以他會在議事堂內開會；至於其後的條例草案或動議辯論部份，他認為在需要投票時，才會返回立會。  「好多（立法會）同僚都唔明白㗎！」李國寶有點慨歎的說。記者又問他為甚麼到今時今日才出來述明原因，他說：「總之我覺得問心無愧，對得住自己，使乜同人哋解釋！」  另一方面，李國寶至今仍對自己的私生活實行封嘴，記者問他是否永不回應，他說：「係吖，永遠都唔會答。」     東亞工種或將北移   前赴漢城參加一個全球政經望會議的李國寶在談到東亞的業務時表示，正考慮在內地設立後勤支援中心，「香港同廣州嘅人工，係一對五，成本差好遠！」不過，他強調，東亞是香港人的銀行，「北移」會影響很多員工的工作，因此管理層必須審慎考慮；但相信北移會是遲早的事，因內地的工資遠較香港低，可減省成本。  東亞銀行今年一月曾裁減二百人，上月與第一太平銀行合併後出現人手重叠。李國寶表示，正留意未來兩個月經濟能否復甦，但現時對整體情況不樂觀，不排除六月時要裁減約一百人。他又承認管理層已有一份裁員名單，主要是一些評核報告不理想的員工。  記者漢城專電
20020507-2,20020507,2,人物素描：愛揚帆回望香港的女規劃師,人物素描： 愛揚帆回望香港的女規劃師 「出海嗰陣從海中心望番去陸地，睇到維多利亞港嘅海岸線，覺得好靚。嗰陣我會諗，自己做規劃一定要做得好啲，我一定要珍惜佢哋！」拓展署高級城市規劃師廖懿珍算是刻板的政府部門內較活躍的女性，每逢周末定與一班船友出海，當她從海中遙看陸地時，每每提醒了她要好好規劃香港這丁點土地。     最愛西貢沙田   外形有點高大、擁有健康膚色的廖懿珍笑着說：「我鍾意玩帆船，尤其係揸船，因為我享受嗰種主導性，同埋有更大嘅挑戰！」廖懿珍現時負責統籌各類相關的研究報告，進行規劃最大難處是要迎合多方面需求及希望，但同時又要堅持一定原則及標準；一如玩帆船一樣，要配合船上各人的工作，又要顧及自己崗位，若有丁點出錯，整個航程便受影響。  作為資深的城市規劃師，廖懿珍自然對香港這片彈丸之地有感情。記者問她最喜歡哪個地區，她認真地想了好幾分鐘才正式答道：「我好鍾意西貢，因為呢度有好好嘅計劃去控制，唔會畀啲樓亂咁起，令佢盡量保持原貌，好有大自然嘅感覺，有啲地方甚至畀我別有洞天嘅感受！」而沙田則是她最愛的新市鎮，該區地積比率佳，每一樣設施的比例恰到好處，符合居民的多項需要，令她留下深刻印象。 廖懿珍目前居於山頂的政府宿舍，之前在愉景灣租屋住了七年。她表示，若有機會買樓，西貢必是首選。至於買樓貼士，廖懿珍建議欲置業的市民應想清楚自己需要，因為不同地區有其不同的規劃及特質，而她認為所有新市鎮的規劃十分完備，無論交通及配套設施均以人為本，最適合喜愛方便的市民。  面對善用土地資源這個重擔，她有時難免感到很大壓力，揚帆出海便成為她的最佳紓緩方法。「成個星期積積埋埋嘅壓力，出海就可以無晒。以前潛水都一樣，放完星期六、日再返工搏殺過！」  原本她十分喜愛潛水，最難忘在澳洲潛水時，被三、四條鯊魚包圍，幸好事前獲知這些鯊魚不會襲擊人類，所以沒有影響潛水興致。她前年在朋友影響下，漸漸愛上帆船活動，加上自己沒有「暈船浪」，在船上可以很享受整個旅程，立定決心考取船主牌及大偈牌。     帆船賽與規劃   她去年更先後參加過三次帆船比賽，其中環球帆船大賽共有十二艘參賽帆船，每艘船共有十八名來自世界各地的船員，那種目標一致的群體合作精神令她着迷。「其實好似做土地規劃咁，好多人一齊參與，但係大家嘅目標都一樣，就係希望做到最好！」  記者：簡慧茵
20020507-3,20020507,3,糾紛忽然平息　過程卻未交代鮮豬肉今復市,糾紛忽然平息　過程卻未交代 鮮豬肉今復市 【本報訊】本港的「豬肉糾紛」昨日終於結束，豬肉買手及肉商代表與五豐行達成初步共識，給予五豐行一周時間，要其盡快與百佳及惠康超級市場開會將豬肉售價提升。但發起豬肉減價戰的百佳重申，堅守永久把豬肉降價的承諾，看來今次糾紛似仍未完全平息。　記者：簡慧茵、梁洵瑜、馮永堅 昨日是本港三十多年來首次沒有新鮮豬肉供應，港人吃新鮮豬肉的權利，變成今次談判桌上的籌碼，雖然肉商和供應商達成共識，但過程卻未有向市民作出完整交代。市民胡小姐更歎道：「雞有禽流感，又冇豬肉賣，搞到好似冇啖好食！」  科技大學經濟系教授雷鼎鳴認為，局外人難以得悉供應商與肉商的商談內容，但相信超市長期減價最後或會成為「大贏家」。  署理財政司司長葉澍堃說，新鮮豬肉的價錢一直由市場決定，當局須確保新鮮和經檢疫合乎衞生的豬肉在市場上有穩定供應。     設法突出街市優點   競爭政策諮詢委員會成員之一的消費者委員會總幹事陳黃穗說，消委會正聯絡各方了解事件是否涉及寡頭壟斷；事件反映超市有意擴大濕貨市場，但上月該會調查發現，七成受訪市民選擇在街市買餸，故街市商販應設法突出街市優點。  華創主席寧高寧強調，旗下五豐行沒有低價出售豬肉予百佳，現時五豐行每日供應五千至六千頭豬予本地市場，其中百分之五供應予百佳，其餘給其他零售商。擁有百佳超級市場的和黃董事總經理霍建寧在回應百佳「以本傷人」一事時說：「以我嘅理解，加價至係壟斷，但𠵱家集團減價又被指為壟斷，咁我𠵱家都唔知道壟斷係點解！」  約二十名豬肉買手及肉商代表昨午與五豐行副總經理范國光開會，會後香港肉行守義堂買手會理事長許堅表示，由於五豐行承諾會與超市商討，建議將肉價由現時每斤十九元升至二十二元，故他們會以一周時間留意事態發展，但暫未決定一周後行動；而昨晨上水屠房的豬肉批發價與日前沒有分別。     買手即時恢復買豬   「豬肉糾紛」的高峯期為昨日凌晨，四十多部掛上抗議橫額的私家車及貨車，先後堵塞上水、荃灣屠房及上水嘉富坊百佳超市凍倉，多名買手和肉商的代表與五豐行代表通宵開會後達成共識；而買手代表稱，會即時恢復向五豐行購買生豬，盡快令肉檔豬肉供應正常。
20020507-4,20020507,4,醒目檔主存貨做獨市,醒目檔主存貨做獨市 豬肉買手與五豐行談判破裂及堵截屠房行動，令香港昨日出現三十多年來首次全港沒有新鮮豬肉應市局面，全港街市肉檔及超市都沒有新鮮豬肉供應，但有醒目商販預先入貨做獨市生意。至於食環署發現兩名商販把冰鮮豬肉充當鮮豬肉出售，但只向有關商販發出嚴重警告。  將軍澳厚德街市內共有六個肉檔，其中一個肉檔東主周先生說：「兩日前已經留起三百斤新鮮豬肉，留番今日賣，如果唔係點養妻活兒呀！」雖然是獨市生意，招來不少主婦排隊輪購，但周先生沒有因而坐地起價。  以豬肉做各式點心、菜式的酒樓也沒有受到太大影響，將軍澳新雅海鮮酒家經理麥擎天表示，酒樓有一、兩日鮮肉存貨，故可繼續做蝦餃、燒賣、叉燒包及肉片炒河等食物。有食客也稱，食急凍或新鮮豬肉製成的食品都「冇所謂」。     兩檔用冰鮮豬頂包   食環署昨日派出二百四十人巡查全港肉檔，並無發現有人出售走私豬肉，但卻揭發兩宗把冰鮮豬肉充當新鮮豬肉出售，違反發牌條件，有關東主已被嚴重警告及即時作出改善。消委會總幹事陳黃穗認為，肉商應以誠實手法經營。  不少市民均表示，支持肉商。其中黎太稱：「我會繼續到街市買豬肉，如果唔提出反對意見，遲啲街市乜嘢都冇得賣啦！」生豬業買手會理事長何汝發說，對上一次全港無豬肉供應是六六至六七年之際，當時業內因反對港英政府迫害工人而全港罷市。  記者：梁洵瑜
20020507-5,20020507,5,10歲童因偷聽電話被砸頭死,10歲童因偷聽電話被砸頭死 【本報訊】十九歲表兄涉嫌割喉、砸爆頭謀殺十歲表弟，昨日在荃灣裁判法院提訊。控方庭上透露，涉案被告警誡下承認因表弟在寓所偷聽他講電話，憤然以𠝹刀割破對方喉嚨，按其頭顱狂砸地板，再以膠袋藏屍，並將屍體從高處丟棄毗鄰菜館及士多房的天台。  被告孔嘉俊，七．十一便利店助理員，被控一項謀殺罪；控罪指他於本月一日，在東涌下嶺皮村寓所內謀殺十歲男童楊宇恒。記者庭上所見，身形瘦削、蓄短髮的被告稚氣未除，表現鎮定近乎冷漠，並沒專注聆聽控罪，眼睛經常向右方斜視。  控方透露，本月四日，位於死者寓所附近的泰國菜館工人，聞到店外傳來臭味，追蹤至菜館士多房天台，尋獲被綑綁的垃圾袋，打開赫然發現一具開始腐爛的屍體，並認出是村中居住的十歲男童，馬上報警。警方發現屍體的頸項有五厘米長的傷痕，頭顱亦有骨折情況，相信是致死原因，估計男童死去兩至三日。     警誡下承認殺人   控方續稱，警方追查發現，士多房天台並非第一案發現場，相信屍體是由菜館天台丟下。警方亦查出死者家人曾於同月一日晚上十時許，在寓所屢尋不獲死者報警，而當晚最後與死者一起是同屋的表兄。  被告在警方警誡下，承認殺死男童。他表示，案發當日下午，因表弟在寓所偷聽他講電話，雙方發生口角，於是手執𠝹刀割破表弟的頸項，繼而將他的頭顱多次撞向地下致昏迷。當被告剛將屍體裝入袋中藏於寓所天台後，死者母親剛回來，被告於是將屍體拋往毗鄰菜館天台。翌晨七時許，他又將屍體從菜館的天台，再拋往七米遠的士多房天台。  控方鑑於案情複雜，要求將案件押後以徵詢律政司意見，以及警方進一步調查，進行深入的科學鑑證。裁判官遂將案件押至下月十七日再訊，被告還押懲教署看管。  案件編號：TWCC1192/02
20020507-6,20020507,6,與友相聚最開心　僅三成愛家庭樂港青年快樂取向與別不同,與友相聚最開心　僅三成愛家庭樂 港青年快樂取向與別不同 【本報訊】由聯合國兒童基金會進行的一項調查顯示，香港青少年對自己感到滿意的比率偏低，在東亞及太平洋十七個地區中，排在第十六位；對老人家及權威人士的尊敬程度亦同樣排名尾二。雖然大多數青少年仍認為與父母的關係良好，但以「很好」來形容該關係的比例，卻比鄰近地區為低，排在尾二、尾三位置。從事家長教育的學者指出，這反映青少年自我形象低落，同時權威典範的失落，值得香港社會反思。　記者：譚秀嫺、陳倩雯、倪清江 聯合國兒童基金會去年完成的一項調查，訪問了十七個國家及地方共一萬名九至十七歲的兒童及青少年，香港共有三百人受訪。聯合國將由明日起，在美國紐約召開一連三日的兒童問題特別會議，這是聯合國大會有史以來第一次討論世界兒童及青少年問題的會議。  調查結果顯示，香港只有三成二青少年表示整體滿意自己，比率較新加坡、中國和澳門等都低，在十七個地方中排尾二，僅高於南韓；幸而，本港只有一成二青少年認為自己無可值得驕傲，較整體的一成六略低。     家庭聯繫遜色   在家庭聯繫方面，本港青少年似乎亦較其他地方遜色。亞太區其他青年，最多人認為與家人一起便快樂；但香港相反，五成四青年認為與朋友一起才快樂，三成半人會因為成績好而快樂，只有三成認為與家人一起覺得快樂。  區內十七個地方，全部逾九成青年認為與母親關係好；與父親關係則較差。本港僅八成一青少年認為與父親關係好，區內排名尾二。至於以「很好」來形容與母親、父親關係的比率，也分別排在尾二或尾三。     忽略情感溝通   亞太區青少年最欣賞的人首推為母親，佔兩成一；其次為父親，佔一成九；再次則為歌星?音樂組合及朋友?鄰居，各佔百分之八。可是，香港最多人選的是「沒有」，佔兩成，選父親或母親的合共僅兩成八，在區內排第十五，即尾三。  臻善家長教育資源中心總監陳呂令意認為，調查結果反映本港青少年的自我形象較低，其中一個原因是社會及父母均過份着重學校成績，「返屋企一扭鎖匙就問仔女做晒功課未，傾偈又問讀書，放假又去上特別課程。」忽略了與子女情感上的溝通。
20020507-7,20020507,7,食家常飯看演唱會都是機會親子溝通似難實易,食家常飯看演唱會都是機會 親子溝通似難實易 聯合國兒童基金的調查顯示，認為與父母關係十分良好的本港兒童，相對較其他國家的兒童少。父母與子女應如何溝通，似乎難度甚高，但據一些與家人相處樂也融融的快樂人所言，只要雙方付出誠意，即使家常便飯已是最佳的溝通機會。　  「未打波前，我淨係掛住讀書，有事會搵同學或老師傾，好少同家人講，但打波後，接觸社會多咗，自己逐漸成熟，明白到家人係最值得信任。」本港高爾夫球壇最具潛質的新秀、十七歲的女球手游凱寧坦言，自五年前練習高球後，與家人的關係更親密。  凱寧特別珍惜一家人一同吃飯的時間：「我哋一路食飯都會有傾有講，有時傾到好開心會笑到噴飯㖭！」凱寧經常要出外比賽，父母親都會陪伴左右。凱寧的父親認為這是應份做的。     嚴管增加摩擦   中三女生吳穎湘是母親口中的乖乖女，吳太說，過去她是以傳統嚴厲的方法教導子女，但反而增加兩代的摩擦；其後她改以較寬鬆的方法，多與子女談話。今年初，穎湘的偶像王力宏來港開演唱會，吳太主動提出陪愛女一起看，穎湘坦言：「好感動，其他同學阿媽都唔會陪佢哋去睇！」  本報記者
20020507-8,20020507,8,聯合國兒童基金會調查點滴,聯合國兒童基金會調查點滴 想改善教育   香港教育制度一向為人所詬病，一成九受訪的本港青少年認為，政府最應該做的事情是改善教育制度，比率更是十七地之最，較馬來西亞（15%）及新加坡（14%）為高：而香港青少年第二樣最希望政府做的，是興建兒童露天遊樂場（15%）。     希望當醫生   亞太區最受青少年歡迎的職業，依次為教師（15%）、醫生（14%）和警察（8%）；但在香港，最多青少年希望當醫生（15%），其次才是教師（11%）及警察（9%）。     認識安全套   九成三香港青少年表示知道安全套是甚麼一回事，較區內總體的六成為高；但似乎流於知而不用，因只有百分之二表示曾經使用安全套，較區內總計的百分之六為低，三成八人更以為自己不可以購買安全套。     知兒童權利   香港八成三的受訪青少年認為，兒童與成年人一樣，應享有各項權利，比率之高，僅次於澳洲和南韓；但只有一成半人表示，對兒童權利認識得很多。     最識表達權   對於兒童權利，香港最多青少年認識的是表達意見的權利（58%），其次為受教育的權利（38%）；不過，認識得最深的權利，則是享有健康食物的權利（90%）。     14%人曾被劫   對青少年而言，香港不算是一個十分安全的地方，一成四受訪者表示曾經被劫，較總體的一成為高；但曾受性侵犯、打鬥及威嚇的比例，則低於總體的一成、兩成二及一成半，分別為百分之一、百分之十二及百分之四。
20020507-9,20020507,9,兩名校區學額過剩,兩名校區學額過剩 【本報訊】教育署公布各區學額空缺統計顯示，名校林立的中西區及九龍城區，合共近三千個學額「無人吼」，主要是小一及初中級別，而全港學額空缺共有約三萬個。由於今年準小一學生較應屆學生少一千人，教署正研究縮減部份地區的班數。  十八區共有約一萬四千個小學學額空缺，以北區最嚴重，有二千零二十七個；其次是大埔、屯門及元朗，三區空出三千多個學額。而全港中學學額空缺有一萬六千六百多個，最多是專門接收區外新生的沙田區，佔二千多個。  教育署副署長李慶煇昨日出席一項活動時說，小學學額過剩問題不算嚴重。他又稱，在新學年將削減大約一千個小一學額，但天水圍等地區的小學須加班。
20020507-10,20020507,10,問題面霜用家求助,問題面霜用家求助 【本報訊】衞生署截至昨日共收到九百五十五個有關使用「柔絲滴/柔迪」（TheRosedew）及LaRoseBlanche美白面霜，並安排了一百九十三人接受水銀測試，但至今未有人需要入院接受治療。  該署首席醫生鍾偉雄醫生昨日表示，自上周四證實「柔絲滴/柔迪」及LaRoseBlanche美白面霜的水銀含量超出安全標準後設立熱線，讓曾經使用該兩款面霜的市民致電查詢，經醫護人員了解求助人使用情況後，至昨日中午已有一百九十三人需要轉介接受水銀含量測試。  曾使用上述美白面霜的市民，可致電該署熱線查詢，電話為2961-8968。
20020507-11,20020507,11,阿松跌眼鏡　改革難推行,阿松跌眼鏡　改革難推行 薪酬趨勢調查結果，與梁錦松在預算案的估計相距極遠，立法會議員李家祥說：「無論梁錦松幾想做嘢，有所為，但面對公務員的機制，都會感到無奈。而公務員悠久的傳統，也需要一段時間才可逐步改革。」     應按機制減公僕薪   李家祥批評昨日公布的薪酬趨勢調查完全不能反映商界各項控制成本的措施，包括裁員、減花紅、增加工作量。面對調查結果，他相信即使梁錦松也難推行改革。  事實上，有支持董建華的人士私下認為，即使前政務司司長陳方安生已經離開，但董建華眼前的公務員制度，仍如一座大山，對董的改革造成障礙。  民主黨立法會議員張文光指出，在平衡社會及公務員利益，最妥善的方法是按機制辦事，依調查結果去減薪，當局亦毋須另行立法。但令張文光「驚」的，是當大家都以為梁錦松掌握最新數據而開價減百分之四點七五，誰不知調查結果卻相差甚遠，「連財政司都唔準，令人難以想像」。他又指出，三月距離現時只是接近兩個月，但出現如此大的偏差，不禁令人擔憂他對整體財政的預算也會繼續跌眼鏡。     為日後削開支鋪路   科技大學社會科學部助理教授馬嶽則認為梁錦松三月「開天索價」，結果減幅比原先溫和時，公務員團體相對可以接受，減少反對的阻力和震盪；雖說減幅較原先溫和，但特區政府至少可以開創減薪先河，為日後進一步削減政府開支鋪路。  本報記者
