key,date,article_daily_id,title,text
20020507-141,20020507,141,盈保投資債券回報高,盈保投資債券回報高 【本報訊】盈科保險（065）主席袁天凡表示，該公司於今年首4個月的投資回報高於原本預期的7%，原因是盈保仍然將大部份資金投放在債券市場。另外，他指出基於會計準則公司尚有一億多累計虧損，所以最快要待明年才可派息予股東。     03年才會派息   袁天凡於股東會後表示，由於未有跟隨市場大多數分析員建議將資金投入股票市場，令盈保首4個月的投資回報表現較原本預期高。他更強調，盈保不會在前景還未有清晰前改變投資策略。現時盈保仍是將資金投放在定息債券為主。  有關派息的問題，袁天凡指該公司亦很想向股東派息，惟基於還有億多元累計虧損，起碼都要到03年才可向股東派息，而公司目前亦開始討論派息率。另外，他亦表示，整體上盈保目前並不積極求售，而向滙豐出售強積金業務的洽談則進展順利。
20020507-142,20020507,142,財話短說,財話短說 中煤16億投資武漢市   ▲湖北省和山東省分別正在港進行招商活動，中華煤氣（003）並與湖北省簽署協議，在武漢市投資天燃氣管道改造工程，總投資金額2.1億美元（16.38億元）。湖北省副省長韓忠學預期在港招商可簽署120個項目，涉及總投資30億美元。而山東省省長張高麗則指出，是次重點推出127個項目，涉及總投資金額170億美元。  ▲華潤創業（291）董事長寧高寧表示，集團近期累計以1億7000萬元，收購國內6間紡織廠。對於早前有報道指其母公司買入台灣東帝士大廈，他指無中生有。     中遠獲注入船舶業務   ▲中遠國際（517）正式獲母公司中遠集團總公司注入船舶業務。中遠國際宣布，以5940萬元現金購入母公司旗下中遠國際船舶貿易公司60%權益，其餘40%仍由中遠國際貿易公司持有。中遠國際表示，有足夠資金完成交易，故不會有集資行動。  ▲香港中旅（308）主席車書劍表示，正洽商收購7家福建省旅行社，現時正進行細節討論階段。內地勞動節期間，該集團的旅遊業務表現良好，目前仍進行統計工作，未清楚增長幅度。他又表示現階段無意出售或分拆渭河電廠。     盈富無意引入莊家制   ▲港交所（388）副營運總裁霍廣文認為，盈富基金(2800)流通量不俗。暗示無意為此引入莊家制。他又指出，該所撤銷日轉期滙交易，是考慮其成本效益，非只因為流通量低，故雖然近年部份新產品流通量不高，亦無意在短時間內撤銷交易，他認為這些新產品亦要時間適應。  ▲寶源投資管理（香港）宣布推出以3.9年為期限的保本基金，若投資者能持有基金至到期日，投資者最少可得8%回報，而有關回報將會於期內分4次分派。另外，CitigroupAssetManagement及花旗銀行亦宣布，合作推出主要投資於環球「藍薵股」的基金產品，本月30日截止認購。 寶福小股東不滿收購   ▲寶福集團（021）一群小股東向證監會及港交所發出公開信，不滿寶福以1.05倍高溢價向新海康（119）收購保興（263）29.5%股權，同時新海康卻以市價折讓20%配售保興17%股份予第三者，令寶福在這項投資即時受損，他們要求監管機構嚴格審理企圖剝削小股東權益的交易。證監會發言人回應稱，有關交易符合收購及合併守則，該會無意干預其商業決定。  ▲世茂中國（649）宣布，位於上海市浦東的上海世茂湖濱花園首批40個意向單位，在上海2002年度春季房地產展銷會中，獲約30倍超額認購。該項目將於今年9月正式預售，高層住宅單位呎價1000元人民幣，低層半獨立屋及獨立屋呎價約2000元人民幣。     越秀籌組28億貸款   ▲據《基點》報道，中銀香港與滙豐銀行正就越秀投資（123）一項28億元5年期貸款在市場探盤。越秀去年以50億元收購廣州城建股權，該筆貸款正是作為部分代價。  ▲聯交所資料顯示，SCMP（583）非執行董事邱繼炳申報，於今年4月29日及5月2日減持35萬股，每股作價由5.346元至5.408元，中間價計套現188萬元。邱繼炳持股量降至1.05億股。  ▲偉仕控股（856）宣布，其公開發售的新股獲133倍認購，配售股份則獲全數認購。該公司將於本周四掛牌。
20020507-143,20020507,143,醫療保險新招無索償有回贈,"醫療保險新招無索償有回贈 在眾多保險計劃當中，除了一些具儲蓄成份的險種（如人壽保險）以外，其他大部份保險，都屬於「有事則賠，無事報銷」的產品。不論期間曾否索償，投保人在保障期過後，保費都不獲退還。然而，市場競爭劇烈，保險公司的招數層出不窮，並不惜以保費回贈來吸引新客，留住舊客。 暫時來說，保費回贈最常見用於醫療住院計劃上。簡單來說，是將汽車保險常用的「無索償折扣」（NoClaimBonus,NCB）概念，引用到醫療保障之中；只要投保人連續投保達指定年期，其間並沒有提出過索償，保險公司便會回贈部份保費予投保人，通常不同的保險公司，會有不同的回贈條文。     回贈有助減低索償   對於大部份人而言，購買醫療住院保障計劃，都是「以防萬一」之舉，藉此避免因突如其來的病患，而需要大筆的醫療開支。因此，若沒有作任何索償的話，有回贈保費優惠的保障計劃，會較傳統的「無事報銷」來得吸引。  滙豐銀行個人理財業務保險產品主管潘雅思指出：「醫療住院保障並非新產品，但隨着投保人數，以及市場競爭不斷增加，計劃亦要加入新的元素。推出保費回贈可以吸引新舊客之餘，亦有助減低索償率。」事實上，索償率減少的話，保費調升的壓力亦會降低。  現時，滙豐銀行要求客戶，連續5年沒有作出任何索償，便會回贈已繳總保費的30%予客戶；而恒生則需3年，回贈已付保費的25%。有別於前兩者，國衛保險雖有同樣優惠，但回贈的15%折扣（以前一年度之保費計算），必須於第4年續保時方可享有，可說只是續保優惠。  除了保費回贈以外，滙豐銀行的保費計算，亦有別於市場同類保障。潘雅思表示：「我們會以投保人初次投保的年齡，作為定額保費，只要投保人一直續保，保費都不會因年齡增加，而有所改變。」 主動提出優惠要求   舉例說，若果於39歲投保，揀選住院計劃A，保費為每月88元，只要投保人沒有中途斷保，保費會一直維持在88元。  雖然市面上大部份的保險公司，都有提供相關的住院醫療保障，但有明確條文推介其保費回贈優惠的卻不多。之不過，不少保險公司，為了留住客戶，都會願意給予長期客戶一些保費優惠。所以，投保人不妨向相關的保險公司查問一下，說不定可以獲得額外優惠。  記者：丹琍"
20020507-144,20020507,144,父母一同投保方可享折扣,父母一同投保方可享折扣 時下的醫療保障計劃，若果與家庭成員一齊投保，大都會提供保費折扣，一般約為總額的10%（如恒生及滙豐銀行）；然而，投保人宜先問清楚，是否必須連同配偶及子女投保，才可享有優惠；若只得一個成人連同子女投保，會否不符折扣資格？  此外，與父母一同投保的子女，只可以跟隨父母揀選同一種計劃。潘雅思說：「父母一同投保，所有子女都可以受惠，子女的保費約為成人的50%。」現時，21歲以下的子女（若子女為全日制學生，則年齡上限為23歲），都可享有半費優惠，惟保障額亦只及成人的一半。  此外，大部份醫療保障都涵蓋全球，但當中部份地區（如中國）的索償額及賠償日期，或會有限制。
20020507-145,20020507,145,積弱多年萬事得背城借一,積弱多年萬事得背城借一 去年年底，萬事得車廠駐法蘭克福的高級工程師廣高金沢接到日本總公司的一個壞消息──新設計的Mazda6房車的懸掛系統出了問題，需要他兼程趕回廣島基地提供解決方法。經過11小時的大手術後，問題終於迎刃而解，此款新房車可以在3個月內付運，但事件已使管理層抹了一額汗。 萬事得管理層對此款新車如此緊張，當然有其道理。作為日本第5大車廠，萬事得近年來的表現一直每況愈下，去年在本土市場的市場佔有率只有4.6%，較1990年高峯期的7.7%倒退甚多；在美國，萬事得的市場佔有率更只有微不足道的1.6%。業績表現欠佳，與車款缺乏吸引力有關。除了勁力十足的MX-5跑車外，萬事得的車款一直被指過時，未能緊貼潮流，今次的Mazda6乃萬事得過去19個月來努力鑽研下的首架新產品，堪稱背城借一，其成敗對公司業績影響深遠。     車款過時缺乏賣點   過去十多年，萬事得的業績一直浮浮沉沉，前年才錄得12億美元虧損，去年的全年業績將於本月15日公布，雖然預期會有6500萬美元的盈利，但相比起161億美元的銷售總額，這個成績自然難言理想。何況由虧轉盈的主要誘因是日圓轉弱所致，估計萬事得因日圓貶值而得以多賺2.5億美元的營運利潤，否則，去年業績一樣見紅。  眾所周知，美國福特汽車是萬事得的最大單一股東，當年向萬事得購入控制性股權，是作為打入亞洲市場的跳板。想不到福特車廠現時亦自顧不暇，在美國本土要面對競爭對手的嚴峻挑戰，進軍亞洲的鴻圖大計只好暫時擱置，而所購入的萬事得股權則成為大包袱。為了挽救萬事得於水深火熱，福特在過去6年已四度為萬事得易帥，自1999年執政的現任社長馬克．菲特（MarkField）將於6月離職，由效力福特已有24載的劉易斯．保夫（LewisBooth）接替。  菲特在任3年期間，已進行了連串改革措施，包括關閉日本的一間廠房、削減了1800職位，並把生產力切掉25%。為了對沖外滙波動的風險，萬事得更計劃在2003年開始，每年會有10萬架車移師福特在西班牙的廠房生產。 削減成本人才流失   不過，連串削減成本的措施，所收到的成果可能適得其反，尤其是去年所推行的提早退休計劃，更導致萬事得大量人才流失。譬如設計部門主管川岡法彥便跳槽至鈴木汽車（SuzukiMotorCorp.），據聞其他日本車廠更不惜在萬事得的根據地廣島設立臨時辦事處，以吸納萬事得的人才。  由此可見，萬事得本身人才不缺，所欠缺的只是研製新車款的資金。為了節省成本，萬事得被迫與福特共用發展平台，以其中一款以省油為主的小房車Demio為例，便與福特Fiesta的特徵差不多。共用資源雖有好處，但亦非全無風險。萬事得在2000年推出的跑車Tribute甚為滯銷，原因是設計與福特的Escape相若，後者的目標乃一些要求不高的歐美顧客，故汽車內櫳設計較為粗糙，想不到卻令萬事得在顧客品味較高的日本市場慘遭滑鐵盧。     追求獨特設計分家   針對以上弊病，福特和萬事得的設計隊伍終於分家，萬事得今次推出的Mazda6亦刻意標榜其設計上的獨特性，譬如故意收窄表板的距離，令駕駛者有置身飛機的感覺，並分別配套了容量為2300c.c.150匹馬力或3000c.c219匹馬力的不同車偈，務求讓駕駛者享受飛騰的樂趣。萬事得不諱言，Mazda6的設計構思來自子彈火車，就算在停頓的時候，亦會予人正在奔馳的動感。  Mazda6在本月20日便會先行在日本本土以Atenza的名稱推出，售價約為2萬美元左右。雖然不少汽車雜誌皆在熱談此部精心傑作，但基於日本市場日漸萎縮，美國市場亦已飽和，加上來自其他車廠的競爭，成敗仍然難卜。一旦失敗，萬事得今年的業績可能會再度見紅，此家日本車廠亦走不脫只是為福特車廠訓練行政人員營地的笑柄。
20020507-146,20020507,146,夥娃哈哈發展童裝股路縱橫：達利業績可改善,夥娃哈哈發展童裝 股路縱橫：達利業績可改善 大市調整，但承接力之強，有目共睹，恒指最低11671，跌126點，收11736，僅跌61點，成交93億元，期指平水。  藍籌股個別發展，中小型股則成為尋寶和追捧對象，雖未致百花齊放，但氣氛已趨熾熱。噚日以紡織和成衣股表現最突出，國企中的公路股亦不俗，江蘇寧滬（177）收2.2元，升0.1元；滬杭甬（576）升7.5仙。公路股盈利有穩定增長，係中長線持有的穩健對象。  紡織成衣股中的福田實業（420）和同得仕（518）都大幅上揚，呢兩隻乃高息股，本欄之前已屢作推介。福田收2.425元，大升29.6%，成交更大增至2728萬股；同得仕高收2.125元，升11.8%；佑威國際（627）走勢再現突破，衝破0.76元的高位阻力後，短線上升目標指向0.85元，中線可見1.0元水平。  本欄1月底推介嘅達利國際（608），噚日亦受惠成衣股升浪，水漲船高，推介時股價1.7元，昨高收2.025元，上升8.8%，雖有約20%的升幅，但相比福田等仍遠為落後，短期內應會跟番貼，再上層樓。     已有2千家專賣店   達利發行3.12億股，大股東雖只持有37.8%的股權，但餘下股份多由基金和實力大戶持有，街外流通貨量極少，就以噚日為例，股價急升而成交亦僅97萬股，可以得見。  達利截至去年9月止年度盈利雖現倒退，賺1.01億元，減23.9%，每股盈利32.7仙。由於現年度不會再有網上業務虧蝕，以及三商行（990）業務會有改善，盈利可望改善，估計回升20%至1.2億元，每股盈利34仙。  達利與娃哈哈合作進軍童裝及休閒服，今年8月可開業，初期已有2000家專賣店（比目前任何一家內地成衣品牌都多），由於娃哈哈在內地有極高知名度，相信可成功打開市場，保守估計下年度開始為達利提供3至4千萬元盈利貢獻，則達利可賺1.5億元，每股盈利50仙，以預測PE6倍計，年底前股價可見3.0元。  郭兆誠
20020507-147,20020507,147,匯豐恆生暫無意仿效,匯豐恆生暫無意仿效 【本報訊】對於中信嘉華銀行（183）推出140%的負資產轉按計劃，滙豐銀行總經理柯清輝表示，滙豐暫無意跟隨，該產品是否具吸引力，還需視乎銀行收取的保險費用水平。不過，滙豐保險仍研究按揭證券公司的140%按揭保險計劃。  柯清輝昨日出席旅遊發展局活動後表示，這類140%的負資產轉按計劃，通常要支付一筆保險費用，但客戶未必接受。滙豐目前的負資產轉按政策，仍然是以個別情況處理，無意推出上述服務，也不擔心因此會導致客戶流失。     渣打：留意市場發展   恒生銀行（011）副董事長鄭海泉也表示，不會向負資產人士提供樓價的140%再融資服務，因為面對的風險較大，但會利用其他好的方法解決風險。  渣打銀行按揭及汽車貸款總監韓克強表示，目前主要是幫助現有負資產客戶，並非欲爭取新客戶，但該銀行會密切留意市場發展，若市場有需要，渣打也會考慮。  銀行界人士指出，銀行對140%負資產按揭貸款客戶的要求很高，包括沒有逾期還款紀錄、收入穩定，而樓宇質素及位置也會在考慮之列，相信能符合上述各種要求的負資產轉按人士並不會太多。
20020507-148,20020507,148,點股壇：旭日落後　跟勢短炒,點股壇：旭日落後　跟勢短炒 製衣零售股均有相當升幅，其中以福田實業（420）、同得仕（518）及佑威國際（627）為然，而冷門股旭日企業（393）亦已轉活，且有相當升勢，同類股份輪流炒，先由佐丹奴（709）及德永佳（321）開路，其餘亦被帶起。  昨日旭日急升8.5%，高於過去52周高價，走勢已明顯轉好，雖然旭日中期業績較差，而且當時展望平平，但經過一個季度的轉變，情勢已較前為佳，旭日的業務不限於零售，於國內及澳洲經營，亦出口至美國，而美國經濟已在復甦，近期澳元滙價上升，對旭日而言，是有利因素。  國內零售點528個，是一項潛力，截至去年9月止的半年，國內市場也非好景，亦錄得8%的盈利增幅，該期間內整體盈利下跌30%，主要是美國及澳洲的影響，當時美國經濟在放緩中，而澳洲的開徵銷售稅以及滙率下跌，對業務打擊頗大，甚至帶來虧損。旭日已作出快速整頓，集中於核心品牌業務，營運虧損已大減，可望於短期內轉虧為盈。  市場環境轉好，或許對3月結的旭日業績幫助不太大，而展望轉佳則毫無疑問，值得注意的，旭日中期息雖因業績減退而降低，而盈利降30%，股息只減18%，本欄曾估計至3月止年度每股盈利下跌18%，情況的改變，相信減幅只有15%，每股盈利15.5仙，股息只減10%，每股約9.7仙，旭日手頭現金達4.88億元，財政寬裕，可以負擔估計中的派息率62%。     息率較同類股高   旭日突升至1.54元，成交近600萬股，以上述估計，PE約10倍，息率6.25厘，與同業比較，仍有相當距離，佐丹奴的近20倍PE及1.7厘息率雖不能作準，但以福田、德永佳、佑威及佐丹奴平均計算，PE約14倍，平均息率為2.7厘，則旭日仍有迴旋的餘地，事實上，上望阻力是1.8元水平，估計仍有5.5厘息率支持，而PE只是11.6倍，可以跟進作短線活動。  齊　明
20020507-149,20020507,149,期指戰況：短期回吐壓力未消除,期指戰況：短期回吐壓力未消除 期指經過連日急升後，昨日稍作調整，以11750開市，彈上11810見即市高位，其後反覆回軟。  港股近幾周升幅頗大，已追回美股在911事件後的升幅，期指市場保持活躍，未平倉量高企。期指在11656止跌回穩，反彈上11735收市，跌53點，成交達1.2萬張。  期指受制於11925第1級阻力位，短期會有反覆，在上周升破250日線後，可能作小型調整至11600水平，不過仍可守於第2裂口位之上，因為牛市第1期初段，成交量會有一段時間急升，然後平穩發展。在推動浪時成交大增，調整浪時成交將下降，此現象視為有利訊號。9RSI略為下調至76，以第3浪特性而言，在超買區內可能出現2至3個背馳形態，目前仍未形成，難以估計頂區位置。  期指仍有回吐可能，以11600為吸納區，上周四的上升裂口位為主要支持位，於11566有明顯支持。在美國議息前，大市會傾向橫行鞏固，成交將稍為下降，期指可望在周五前發力上衝。  寶　維
20020507-150,20020507,150,一味窩輪：買9044博反彈,一味窩輪：買9044博反彈 中移動（941）GSM頻普使用費提高，3年少賺10億元，每年影響唔夠1%。股價一度散落25.65元，跌90仙，埋單25.85元，仍然唔見70仙，1日之間市值130億元化為烏有，相等於成40年嘅增收頻普費。  股價反應過度，不過都好，最低之時啱啱填補上禮拜四上升裂口。挫一挫，有機會更上層樓。中移動Call輪要摷隻嚟博反彈。  短炒，當然喺9029同9044兩者之中搵1件。9029昨日跌3.5仙，9044跌夠5.5仙，自然要揀9044埋手。  9044（8月到期）現價41.5仙，溢價得3.5%，槓桿率6.2倍，條件好靚。炒落去，唔使點怕蝕溢價。上禮拜五最高50仙，有機會三扒兩撥上番呢個價。  4大地產集團，是日最風騷嘅係新世界發展（017），收7字齊頭，升15仙。新世界有得睇，揀新世界Call輪炒炒。     新世界輪吼9172   新世界Call輪最正路係9172（10月到期），現價18.1仙，冇錯槓桿率3.9倍唔算爆炸，但溢價3%夠吸引，同埋買賣最易嘅係呢件。  章　盛
20020507-151,20020507,151,連環炮：津發蓄勢破2.35元阻力,連環炮：津發蓄勢破2.35元阻力 港股昨日承接上周五美股之跌勢回落，恒指反覆下挫61點收市，報11736，中段指數曾跌至11671低位，但該水平已現支持，收市前跌幅逐步收窄。  跌市之中成交顯著縮減至少於100億元，算是偏好現象，但港股技術走勢開始轉弱，若美股無法穩住跌勢，杜指再跌穿10000點關，則港股難免要再下試低位。  短線而言，恒指有機會回補部份介乎11498至11578的上升裂口，由於250日平均線位處11489，令該裂口的支持力甚強，除非美股跌勢持續且急驟，否則，暫時恒指仍會維持在高位徘徊的走勢。     老牌紅籌走勢偏強   中資股趨個別發展，國企指數逆市攀升，紅籌指數下跌，但老牌紅籌股走勢偏強，中信泰富（267）早段升上17.55元高位，收市雖倒跌1個價位，但整體強勢未改，昨日推介之華創（291），則升1.2%，收8.2元，將伺機上破8.5元關。光控（165）走勢最為強勁，上升4.0%收市，報5.10元，相信稍後可上試5.3至5.5元區域。  兗煤（1171）在3.3元附近拉鋸，收3.325元，升1個價位，按原策略持有。  中海發展（1138）升後整固，報收1.62元，將計數位推上1.56元持有。  天津發展（882）3月中旬開展之跌浪，於上周3試2.125元低位後企穩，開始回復升勢，股價重返10日、20日及50日平均線之上，現正逼近3月中高位2.35元，成交正在增加，若能以大成交上破該位，相信會向2.6至2.8元推進，現價買入，以2.175元作止蝕位，上破2.4元可加1注。  海　歌
20020507-152,20020507,152,看圖捕先機：港股以時間消化升幅,看圖捕先機：港股以時間消化升幅 港股在高位鞏固，恒指在中移動（941）及地產股下跌的拖累下，一度低見11671，不過低位見承接，尾市收復部份失地，收報11736，跌幅收窄至61點，成交亦略為減少至93億元；跌市成交縮，可見沽壓並不太大。現月期指收報11735，跌53點，平水。  恒指日線圖呈陀螺，在下降軌附近爭持不下，不幸的是收在下降軌之下，未能造好。從移動平均線分析來看，10日線將上破250日線，並升至裂口支持區，為後市主要支持所在。另外，上升軌與10日線重叠，可見該位支持的重要性。  大市近日的調整幅度並不大，可能是以時間消化最近的升幅，屬強勢調整，如果可升破下降軌阻力，約在11820，升勢將加快，恒指可借勢升破浪頂部阻力11958。  近日的大市火車頭地產類股份，昨日的調整並不深，與之前的預期相近，美中不足的是滙豐（005）等未能接力，推高大市，加上電訊類股份亦偏軟，所以恒指出現高位鞏固的局面。  中資股個別發展，紅籌指數在裂口區前見支持，日線圖呈十字，待變。國企指數反彈，企穩在10日線及50日線之上，暫見受制於20日線。   是日建議：   高寶綠色（274）：陽燭，以裂口升破下降軌阻力，成交大增，配合走勢。現價買入，目標2.2元，全面回補裂口，即1.88元止蝕。  中鋁（2600）：陽燭升破10日線，暫受制於下降軌阻力，MACD由低位回升，將出現買入訊號，可在上破1.5元追入，目標1.66元，1.4元止蝕。  佑威（627）：以光頭陽燭升破三角形頂部，DMI的+DI上止-DI，ADX回升，利好。現價買入，目標價0.84元，10日線止蝕。  東　尼
