key,date,article_daily_id,title,text
20020721-104,20020721,104,吸大麻曾是嬉皮士象徵,吸大麻曾是嬉皮士象徵 在六十年代成長的美國前總統克林頓曾很賴皮地說過，他抽過大麻煙，但沒有「吸入肺」。克林頓的答案說明了大麻在美國如何盛行，但又如何富爭議性。  美國在二十世紀初開始湧現吸大麻消遣的現象，當時輿論指吸大麻會引發暴力傾向和失常，聯邦政府在三十年代立法禁止使用大麻。但到了六十年代，嬉皮士文化強調反建制和藉藥物探索「另類意識」經驗，吸大麻成為和平及有型士的象徵。像嬉皮士年代的代表樂隊「披頭四」推出的《披頭四文集》就記載，他們早在六○年已第一次抽大麻，是從「利物浦一個年長鼓手那裏弄到的」。  嬉皮士年代過去，美國人抽大麻依然眾多。美國官方前年的調查顯示，十二歲以上人口有三分一曾服用大麻。但至今環繞大麻仍有三大爭議：     ‧大麻對健康的影響   支持大麻者認為，大麻短暫效力像喝醉酒，長期效應和吸煙相若，既然煙酒都不是毒品，大麻就不應禁制。醫學界有研究卻指出，長期吸食大麻會有損生殖能力、記憶。     ‧大麻應否合法化   荷蘭實施這政策多時，英國早前也將藏有大麻非刑事化，以免禁之不絕，反而製造更多「罪犯」。反對者則指吸大麻是吸毒的踏腳石，要禁毒就要禁大麻。     ‧大麻應否用在醫療用途   支持者指大麻可助癌和愛滋等病患者紓緩痛楚，美國最高法院去年裁定這不足以構成放寬管制大麻的理據。  本報記者
20020721-105,20020721,105,雷劈科索沃電廠33死傷,雷劈科索沃電廠33死傷 南斯拉夫聯邦科索沃一間發電廠上周五晚遭雷電擊中，引發爆炸和大火，導致一死三十二人受傷。傷者有些吸入濃煙，有些則嚴重燒傷，全部須送院治療。  被雷電擊中的發電廠，位於科索沃首府普里什蒂納市以北約十五公里的小鎮。上周五晚被雷電擊中後發生爆炸和火警，大火到周末清晨仍未撲熄。除了消防員和警察外，連駐守科索沃的北約維和部隊，也出動配備探射燈及直升機協助拯救。     大火困夜班工人   當地電視台報道，發電廠約有三十多名夜班工人被困，他們多被困在屋頂，全被送院治療，其中一人送院後死亡。大火使科索沃首府電力中斷。  科索沃是南斯拉夫聯邦少數阿爾巴尼亞族人聚居的地方，佔南國人口多數的塞爾維亞族人部隊九九年在科索沃血腥鎮壓阿裔人，北約和聯合國空襲南國後派出維和部隊進駐科索沃。	綜合外電報道
20020721-106,20020721,106,以國圖驅逐人肉彈親屬,以國圖驅逐人肉彈親屬 巴勒斯坦人激進分子上周接連兩天向以色列人發動襲擊後，以色列政府決定要將巴人「人肉炸彈」的親屬驅逐到加薩地帶，以株連手法阻嚇巴人激進分子不敢造次。但這個「株連」策略卻引起國際社會抨擊，連美國也反對。     國際群起炮轟株連   美國國務院發言人包潤石表示，美國希望以色列只因人定罪，不要株連施襲者的親屬。聯合國秘書長安南炮轟，這是「集體懲罰」的政策。法國、國際特赦組織以至以色列人權組織Betselem也批評，這是違反日內瓦公約。  對於以色列要以株連手法遏止巴人施襲，出過不少「人肉炸彈」的激進組織哈馬斯揚言，一旦以色列驅逐巴人，它將發動「特別」的自殺式炸彈襲擊。由於「人肉炸彈」的親屬往往得到哈馬斯及伊拉克的援助金，以色列政府認為，株連策略會使巴人失去當「人肉炸彈」的誘因。  綜合外電報道
20020721-107,20020721,107,中國減肥藥奪4命,中國減肥藥奪4命 日本厚生勞動省周末表示，多種由中國入口的減肥藥至今已造成四人死亡及逾一百二十人不適。其中「御芝堂減肥膠囊」及「纖之素膠囊」導致六十九人肝臟出問題，十六人甲狀腺受損；另一隻「茶素膠囊」亦導致七人肝臟出問題，兩人甲狀腺失調。  德新社
20020721-108,20020721,108,公路墜機,公路墜機 印尼耶加達周末發生墜機意外，一架單引擎小型飛機緊急降落時，墜落在繁忙公路，印尼籍機師死亡、三名外籍乘客及地面上兩人受傷。  路透社
20020721-109,20020721,109,北約撤換最高司令,北約撤換最高司令 北約應美國總統喬治布殊的要求，上周五宣布將會委任美國海軍陸戰隊司令官瓊斯，代替美國空軍司令官羅斯爾頓，出任北約歐洲盟軍最高司令一職，但未有解釋羅斯爾頓被解職的原因。這次任命令瓊斯成為首位擔任這個職位的海軍陸戰隊軍官。  路透社
20020721-110,20020721,110,跳舞籌款,跳舞籌款 美國前司法部長雷諾（右）代表民主黨角逐佛羅里達州州長，她上周五在邁阿密灘出席一個競選籌款活動時，跟數百名支持者一同跳舞。  路透社
20020721-111,20020721,111,北韓機首直航南韓,北韓機首直航南韓 南、北韓為紓緩兩國緊張關係，開闢了首條飛機直通航道，周末更進行試飛，一架北韓官方航空公司的圖134型飛機，載着十四名機員由北韓東部善德市飛往南韓東部的襄陽。由於南北韓均禁止國民踏足對方國土，這航線不會讓兩國平民使用。  英國廣播公司
20020721-112,20020721,112,巴黎塞納河畔變人造沙灘,巴黎塞納河畔變人造沙灘 法國首都巴黎位處內陸，居民和遊客一向與沙灘樂無緣。巴黎市長德拉諾埃為了建設新景點，不惜動用一百五十萬歐元（約一千二百萬港元）公帑，將市中心塞納河畔的一段高速公路，修築成人工沙灘。 這個於今日正式開放的巴黎人工沙灘，本是塞納河右岸一段三點二公里長的高速公路，現在那兒鋪滿細沙和種植了棕櫚樹，未來一個月遊人可一邊玩樂，一邊觀賞羅浮宮、巴黎聖母院和市政廳等沿岸名勝。     只准灘上玩　嚴禁暢泳   為增加遊樂興致，該人工沙灘設置了三百張藍色躺椅、一百五十把太陽傘、四間舊式咖啡舞廳、一道攀石牆和一個撞球場，又有小丑、樂手和劇團，每日為遊人提供娛樂至晚上十一時。  這人工沙灘雖樣樣俱全，卻禁止遊人下水暢泳，因為即使塞納河的水質已有改善，但水流危險，不宜游泳。  這計劃創意十足，卻惹來巴黎各方批評。市議會內反對派指計劃浪費公帑，居民憂慮人工沙灘會惹來嚴重的狗糞問題，駕車者則擔心屆時情況會像德拉諾埃去年夏天首次封閉塞納河高速公路一樣，導致巴黎市中心交通嚴重擠塞。  德拉諾埃也承認這計劃「有點瘋狂」，但他嘗試向質疑者派「定心丸」，包括保證狗兒不得進入人工沙灘、該地區會每日清潔兩次，以及市政府會採取措施疏導市中心交通。  英國《泰晤士報》
20020721-113,20020721,113,阿根廷陷困老妓女湧現,阿根廷陷困老妓女湧現 阿根廷近年經濟陷入困境，電視台拍攝了一齣紀錄片，揭示當地一些已屆祖母級的年長婦女為了一家人的生計，如何被迫賣肉維生。     九成客是年輕人   這紀錄片由當地「美國電視台」在首都布宜諾斯艾利斯攝製。製作人格拉納表示：「部份成熟妓女年輕時曾賣淫，但很多以往從未做過這樣的事。」  片中訪問了十人，包括六十多歲的艾麗西亞。她說：「我每次收費不會逾二十披索（四十四港元），否則客人馬上離開。我的客人九成是年輕人。」  格拉納說：「她們一無所有，沒有退休金。她們腦海中唯一想着的，是如何克服尷尬心理，做好賣淫工作。」  英國廣播公司
20020721-114,20020721,114,英女皇嚴禁僕人白制服,英女皇嚴禁僕人白制服 英國白金漢宮的僕人為了工作時更涼快，最近穿了較輕便的白色褸制服。但女皇伊利莎伯二世指他們「看似賣雪糕的人」，要他們穿回原來的制服。     指像賣雪糕的人   白金漢宮最近花了超過六萬二千港元購買了一種較輕便的白色褸制服，但女皇對於這款有紅色肩章及金色鈕的新制服非常不滿，下令六十名僕人穿回原本紅色羊毛燕尾制服。  一名僕人無奈地說：「由於英女皇認為我們像賣雪糕的人，我們只好繼續流着汗工作。」  白金漢宮一名高級職員強調，僕人雖不可在白金漢宮的花園派對中穿新制服，卻可平日穿這種制服在宮內工作。  英國《太陽報》
20020721-115,20020721,115,美50萬青年越戰時逃加,美50萬青年越戰時逃加 美國人找加拿大當避難所，早在六十年代越戰時期已曾發生過。那時，超過五十萬名美國年輕男女，為了逃避服兵役，遠走加拿大；有學者說，這次是美國內戰以來最大規模的「政治放逐」。     加國曾阻美青年入境   面對這一群逃避服兵役的美國年輕小伙子，加拿大政府本來要將他們擋在國境外，更試過下令移民官員阻止他們進入加拿大境內。  後來，包括教會及民權組織等多個體團陸續施壓，加拿大政府才開放邊境，收留美國「不知國家為何而戰」的反戰人士和逃兵。     逃兵役者77年獲特赦   到越戰變成美國的泥沼，被輿論口誅筆伐評為非正義之戰，加拿大政府才引收容這些美國青年為榮。  那麼一大批違令出跑的年輕人，一直不敢返回自己的祖家——美國。到越戰結束後，當時的美國總統卡特終於在七七年宣布特赦所有逃兵役人士，但最後還是有不少人寧願選擇留居加拿大。  本報記者
20020721-116,20020721,116,迪士尼世界不再放白鴿,迪士尼世界不再放白鴿 美國佛羅里達州主題公園「迪士尼世界」上周二起結束三十年來的傳統，不再在表演節目中放鴿子，因為附近的紅尾鷹往往趁機捕食牠們。     常成紅尾鷹點心   三十年來，公園為搞氣氛，在部份節目中會放二百隻鴿子。理論上牠們會自動返回鳥巢，可是很多在途中卻被飢餓的紅尾鷹吃掉。  公園方面都是最近才發現有鴿子被紅尾鷹吃掉，曾試過多種解決辦法，包括利用塑膠貓頭鷹來嚇走紅尾鷹，可惜都無效。那些紅尾鷹彷彿已知道公園每日放鴿子，到時到候便前來獵食。  園方將送鴿子到動物園，以保證牠們有良好的生活環境。  法新社
20020721-117,20020721,117,Wow,"Wow ""Whenreportersaskedtheex-Bondgirlwhatitwaslikemakingherownfilm,herfirstresponsewasjust:'  Wow  !'""    「當記者問飾演過占士邦女郎的楊紫瓊拍自己的電影有何感受，她第一個反應就是：好吖！」    「好吖」、「嘩」這些在香港人口裏表達興奮情緒的詞兒，在英語就是""Wow""。    "
20020721-118,20020721,118,有求必應印人把英軍荒墳當神拜,有求必應印人把英軍荒墳當神拜 中國有關公從將軍變成神祇，印度北方邦也有一名於一百四十五年前死去的英國軍人，被指有神力替人消災解困，為人脫罪和解決性問題，儼然是有求必應的「印度黃大仙」。 下葬在北方邦首府勒克瑙附近的瓦勒上尉，原是英軍第一錫克騎兵部隊的指揮官，在一八五七年印度民族大起義中死去，他的墳墓原本一直荒廢。     重犯墳前禱告可脫罪   但近期當地盛傳，很多被控嚴重刑事罪行的人，只要在他的墓前禱告，都可成功脫罪。  瓦勒迅即成為膜拜對象，信眾紛紛拿鮮花、水果、肉食和煙酒到他的墓前拜祭，又編寫禱文和讚歌，形容他是「聖人上尉」、「白聖人」和「白人神」等。     有人求與女鄰居上床   自發打理瓦勒墳墓的薩金娜說，由於瓦勒據說「嗜好煙、酒、色」，因此信眾多會帶同煙、酒拜祭，求他幫助解決各種性問題。  居民普拉薩德帶了肉食、香煙和啤酒來拜祭，希望「白聖人」助他實現和心儀的女鄰居發生性關係的願望。一些不育的婦女，也攜帶椰子來求子。  Sify.com網站
20020721-119,20020721,119,電視遊戲摸獅虎獎名車,電視遊戲摸獅虎獎名車 智利一個電視有獎遊戲節目提出瘋狂要求，竟要參加者在毫無保護情況下，與獅子、老虎等猛獸共處一籠，還要伸手撫摸牠們。一名女子為了贏取一輛汽車，不惜以身犯險，結果被猛虎襲擊，身受重傷。     女參加者遭虎噬重傷   三十歲的貝里奧斯，只要與兩隻獅子和兩隻老虎共處籠裏三分鐘，並用手撫摸其中一隻猛獸，就可贏得夢想中的座駕。可是，當貝里奧斯走近其中一隻老虎時，老虎突然發難，抓着她的腿並向她狂噬。在旁的馴獸師見狀，立即將老虎拉開，但貝里奧斯頭部及腿部已嚴重受傷，需送院。  警方稍後拘捕馬戲團老闆，控以疏忽罪名。電視台也炮轟節目監製不負責任。	ananova網站
20020721-120,20020721,120,街頭雜技團驟變劫車強盜,街頭雜技團驟變劫車強盜 雜技藝人的靈活身手，常教觀眾看得佩服又入神，可惜智利一個雜技團卻利用他們的靈活身手為非作歹，幹起強盜的勾當。  該個雜技團近日在智利康塞普西翁市街頭表演，一名駕車經過的女子大為欣賞，於是停車開窗，打算賞些金錢給他們。     憑靈活身手作案   豈料該群藝人突然發難，其中一名表演手技雜耍的藝人迅速亮出尖刺，刺穿其車胎。一名雜技藝人隨即滾過車頂，以迅雷不及掩耳的速度，從窗外伸手搶去女子的金鏈，另一名藝人則打破後座玻璃窗，搶去其手袋。而一名吞火藝人喝止受害人呼救，威脅會向她的臉噴火。  幸而一名休班消防員剛好經過，趕走了該群雜技強盜。受害人說，若非有人介入，相信甚麼都會被該群雜技藝人搶得一乾二淨。  ananova網站
20020721-121,20020721,121,爛木屋叫價74萬,爛木屋叫價74萬 英國薩福克郡一棟搖搖欲墜的殘破木屋，沒水沒電供應，雖然標榜是「海濱度假屋」，但其實離海灘足足兩小時腳程，竟開價六萬英鎊（約七十四萬港元）求售。  該棟位於伍德布里奇附近的殘破木屋，建於一九四七年，面積只有七點三公尺乘三點六公尺左右，一房一廳，沒水電也沒排水設施，鄰近的公廁在三百公尺外。     海濱度假屋遠離沙灘   雖然聲稱是「海濱度假屋」，但木屋旁只有一條小河，最近的沙灘約在十公里外。  地產代理商指小屋賣六萬英鎊乃物有所值，因小屋位置可眺望「田園風光，景色壯麗」。但其他地產代理則譏諷：「那破棚只值三百英鎊（約三千七百港元），六萬鎊可度假多次了。」  綜合外電報道
20020721-122,20020721,122,淨化神龕,淨化神龕 日本茅崎市周末慶祝一年一度的濱降祭，居民將一座神龕抬往海中，讓被視為神聖的海水淨化神龕。  美聯社
20020721-123,20020721,123,蔥頂雙球,蔥頂雙球 俄羅斯古城謝爾吉耶波薩特上周五起舉行熱氣球節，各式各樣的熱氣球飄浮空中，與教堂的「洋葱頂」相映成趣。  路透社
20020721-124,20020721,124,玲瓏集,玲瓏集 AguaDoce在巴西聖保羅時裝周展出的明夏泳衣系列，色彩奪目。  路透社
20020721-125,20020721,125,美兵高呼：讓我們消滅薩達姆,美兵高呼：讓我們消滅薩達姆 美英兩國攻打伊拉克的風聲近期再傳得緊，更有報道指華府在連串企業醜聞下或會對外用武以轉移國人視線。上周五，美國總統喬治布殊在紐約州鼓堡向第十山地師官兵發表講話時，強調美軍「要完成未完成的工作」，準備打好下一場反恐戰爭。     布殊強調須做好準備   喬治布殊在講話中「不點名」地指出，美國現正面臨一些擁有大規模殺傷力武器國家的威脅，美國「會在可能的時候使用外交手段，在必要的時候使用武力」，以保證國人安全、以及未來和平不受「邪惡和破壞勢力」威脅。他更強調：「身為你們的總司令，我向你們發出這樣的訊息──要驕傲、堅強和做好準備。」但軍事行動仍不是一觸即發。  喬治布殊曾多次公開表示，伊拉克是要擁有大殺傷力武器、危害世界的「邪惡軸心」國，必須推翻其總統侯賽因。雖然他在鼓堡講話沒有明確點明美軍下場戰爭的槍口對準伊拉克，但含意呼之欲出。  台下穿上迷彩軍服的官兵中有一人就大叫：「讓我們消滅薩達姆（侯賽因）！」第十山地師是陸軍精銳部隊，在阿富汗反恐戰中，是第一支被派出的部隊。  美英傳媒近日已多番引述消息人士報道，華府堅決要推翻侯賽因，可能於明年初出兵。其中《紐約時報》本月初更引述消息人士，指國防部已草擬軍事方案，要從海陸空三方展開行動，更會從八國部署的戰機空襲數以千計的伊拉克目標。     防長徹查攻伊方案外洩事   針對《紐約時報》的報道，美國國防部長拉姆斯菲爾德除日前警告部內官員洩密是刑事罪行外，更已下令徹查軍事方案遭洩漏的原因。國防部官員說，空軍特別調查組展開了內部調查，更已向多名國防部高官問話。  另外，為了加強反恐能力，美國中央情報局（CIA）宣布，前線情報人員在不用得到總部批准下，可錄用犯罪分子作線人。新措施推翻九五年眾議院限制CIA人員錄用犯罪分子作線人的指引。  綜合外電報道
20020721-126,20020721,126,英、美攻擊伊拉克計劃近日發展,英、美攻擊伊拉克計劃近日發展 05/07/2002   美國《紐約時報》指美國計劃發動25萬大軍，從海陸空三方進攻伊拉克，並會出動部署在8國的戰機空襲伊拉克數以千計的設施     08/07/2002   美國總統喬治布殊聲稱要採取一切手段推翻侯賽因政權，強調變更伊拉克政權是美國國策之一     12/07/2002   美國籌劃在明年初出動五個裝甲師、兩個海軍陸戰師進侵伊拉克；英軍會出動特種部隊，以及加緊培訓「震撼部隊」助戰     16/07/2002   英國首相貝理雅稱攻打伊拉克無可避免     17/07/2002   伊拉克總統侯賽因號召人民作好隨時戰鬥準備，抗擊和消滅入侵者     19/07/2002   喬治布殊要求士兵們要準備好打下一場反恐戰爭，暗示可能向伊拉克發動襲擊  資料來源：美聯社/人民網
20020721-127,20020721,127,香港碼頭業風光不再,香港碼頭業風光不再 香港的碼頭業務將是「夕陽工業」？美資大行高盛證券的答案是肯定的，但東方海外（316）主席兼物流發展局基建小組召集人董建成認為香港碼頭業仍有可為；滙豐證券分析員鄭碧海則稱香港正處於壯年期，增長當然不及成長中的內地市場，但投資者仍可得到合理回報。　撰文：羅綺萍 以高盛董事總經理胡祖六為首的4名分析員，日前發表報告，預期香港港口貨運業將是下一個夕陽工業，最大的困擾是香港港口於廣東省貨運出口中喪失競爭力。報告指本港港口平均每個標準貨箱運費比鹽田及寧波港高出1.2倍，相較珠江三角洲港口的運費更高出1.4倍。  現時透過本港港口處理的內地貨物，已由5年前佔中國外貿總額55%降至35%，反映愈來愈多出入口商，將貨物直接運往內地港口。     收費差距收窄   董建成接受本報訪問時說：「我不會以夕陽工業來形容香港碼頭業，香港一向是市場經濟，價錢貴，客人便去別處，服務好，貴啲也有人來。3年前深圳鹽田的收費是香港50%，現時已拉近到75%，鹽田逐漸加價，香港則逐漸減價。」所以葵涌最近3個月的處理量漸漸回升。  他又說，深圳碼頭仍難以取代香港，所以香港如果在收費上競爭力再強些，陸上運輸的成本再減些，會搶回不少生意。不過，現時加上陸上運輸費，鹽田與香港的收費差距仍達40%。  鄭碧海則對本報表示，以外貿貨值作為依據是重大謬誤，因為這對碼頭經營者來說沒有意義，關鍵是香港處理的貨箱數量，葵通6月份的箱量單月上升9.4%，是連續3個月的上升，已成功追回首季的跌幅，半年有1%的升幅，雖與深圳的逾五成升幅不可同日而語，但已較他預期為佳。 增長空間有限   「香港等如一個成年人，再長高的空間有限，深圳則是發育中的青少年，你不能因此便說香港已風燭殘年。」他說，出口跌而箱量仍升，原因可能是中國入世後不再需要用香港的配額，但貨箱仍經香港運送。  鄭碧海說現時香港碼頭處理每個箱仍有200至300元的利潤，即使面對減價壓力，也有利可圖，只是內地碼頭的發展機會更大，港商才逐鹿中原。  董建成補充說，其實今年上半年香港碼頭的營運狀況良好，去年同期有部份馬士基的貨箱由新加坡轉交香港處理，今年則交由馬來西亞處理，撇除這項特別因素，香港上半年的處理箱量升幅更大。     深碼頭近飽和   深圳市交通局兼港務管理局港航分局周天麟較早時接受路透社訪問時說：「深圳的處理能力只是香港的三分之一，需要擴建才能追上更大的需求。」故此他預期下半年隨着三個碼頭都接近飽和，吞吐量增幅會放緩，全年總量只為600萬箱，增長20%。  他又稱，香港是自由港，不需要拆貨，但深圳港口因反走私需要拆貨，拆貨率一般為3至5%之間，成本會因此增加，加上香港的結算和清關效率較高，付貨人的實際支出差距會縮小。
20020721-128,20020721,128,選中「獵物」,選中「獵物」 數碼通行政總裁黎大鈞可能睇得廣告多，攞住部有攝影功能嘅手提電話，即刻四圍影靚女，女記者被選中為「獵物」，照單全收。  梁鑑章攝
20020721-129,20020721,129,切合主題,切合主題 吳旭苿（右）年紀輕輕，即有以她英文名《Jessica》命名的雜誌及上市公司，弟弟吳旭生（左）第日唔知會唔會開間「旭生（郁身）Disco」？	  程志遠攝
20020721-130,20020721,130,電燈膽,電燈膽 在中華電力一個宣傳活動上，常務董事阮蘇少湄（中）手執鮮花，與營運總裁邵達誠（左）喁喁細語，令身邊的市場及客戶服務業務總監潘瑞祥即成「電燈膽」，非常點題。  李潤芳攝
20020721-131,20020721,131,再來一次？,再來一次？ 創業板上市委員會主席羅嘉瑞（左）當年主動要求李嘉誠將tom.com上創業板，未知今次是否向李澤鉅（右）提議將長科上市，刺激吓靜咗好耐嘅創業板。  程志遠攝
20020721-132,20020721,132,老闆娘出場,老闆娘出場 今時今日女人去芬蘭浴室已經係平常事，何況係走慣江湖嘅何鴻燊四太梁安琪？四太不單止有幫趁，重係呢間大班芬蘭浴嘅剪綵嘉賓同老闆娘。  李潤芳攝
