key,date,article_daily_id,title,text
20020317-0,20020317,0,電盈速遞外判協青社李澤楷搶救邊緣青少年,電盈速遞外判協青社 李澤楷搶救邊緣青少年 【本報訊】本港失業率攀至歷史高位，青少年失業更嚴重，協助邊緣青少年重回正軌的工作更顯得困難。電訊盈科主席李澤楷最近加入拯救邊青的行列，將在一個多星期後，批出速遞服務合約給協助邊青的協青社，為邊青創造就業機會。　記者︰馮永堅、陳沛敏 原來，李澤楷早於九三年已親身投入協助邊緣青少年的服務，曾義務為他們補習英文，還與他們一起去「大牌檔」吃魚蛋粉、雲吞麵。     傳授英語結緣   專責邊緣夜青工作的協青社總幹事李文烈神父接受訪問時透露，李澤楷在九三年左右，曾主動接觸協青社，希望能為這群青年出一點力，於是在九三年初開始，每逢星期六下午，義務替一群邊青補習英語，希望可提高他們的英語水平，找工作前先充實自己。  有熟識李澤楷的人士憶述，當時年僅二十六歲的李澤楷正擔任衞星電視主席，那時候李澤楷見到衞視一些同事參與義務工作，引發他投身義工的興趣。  由於李澤楷十分關注年輕人的情況，又聽過協青社李神父「從黑社會手上救回邊青」的故事，於是接觸李神父，做起邊青的補習老師，每星期六自己駕駛座駕Camry去上課。  當時，十多名一起上課的邊青都不知道李澤楷是誰，與他打成一片，課後還一起到大牌檔吃魚蛋粉、雲吞麵，感情融洽。更令李澤楷欣慰的是，後來這批學生都沒有誤入歧途，部分在事業上更有不錯的表現。  鑑於本身工作繁忙，李澤楷只當了半年英文補習老師，但仍十分關心他們的生活，與李神父保持聯絡，又多次向協青社捐贈電腦、影印機和電器等，希望可改善寄居在協青社宿舍的一群青少年的生活。九四年，他私人捐了二百多萬元，予協青社購買這些器材。  李澤楷今年一月出席青年協會義工網站啟用儀式時，曾透露他參與義工工作感受，他說，就業的目標不能單為追求財富，還要盡可能關注社會利益，務求對社會有貢獻。他又說，有為青年應遵守「義利兼顧」的原則，除謀求個人成功，也要為社會服務，保持健全正面的人生觀。 極力協助就業   另外，協青社去年四月展開一個名為就業速遞計劃，安排邊青在協青社開設的速遞公司擔任速遞員工作，月薪四千元，每人最多可做一年。李神父透露：「我哋𠵱家同李澤楷傾緊，希望電盈外判啲速遞工作畀協青社做。」據熟識李澤楷的人士說，他已答允提供服務合約給協青社，先以試驗方式試行，預計一個多星期後開始。  李神父又說，現時青少年失業率高企，有近二十萬名十五至十九歲的青年加入失業大軍，主要原因是私人機構着重應徵者的工作經驗，但青少年根本沒有工作經驗。他說：「計劃目的唔係養呢班人，而係畀一個工作經驗佢哋，同時學埋禮貌、衣着整潔及守時嘅基本要求，第二時真係搵工都易啲啦！」  李神父表示，至今已有十六名夜青完成計劃後找到工作，現在仍有約二十名十五歲至二十二歲的夜青擔任速遞員，他希望日後可增加至五十人。李神父認為，計劃的成績暫未算十分理想，但他仍堅持「見一個幫一個」的信念，因為「無年輕人想失業」。     獲得邊青讚賞   對於電訊盈科主席李澤楷準備將部分速遞服務合約外判給協青社，本報記者昨晚到邊青流連勝地的尖沙嘴文化中心走廊訪問一些邊青，大部分邊青讚賞李澤楷的建議，認為四千元月薪的工資雖然不算很理想，但可以考慮一試，其中一人更說：「有工做總好過流連街頭啦！」
20020317-1,20020317,1,友人代駕跑車　高速掟彎失控19歲少年車神車禍命危,友人代駕跑車　高速掟彎失控 19歲少年車神車禍命危 【本報訊】一名十三歲便「揸大膽車」、被友儕稱為「少年車神」的十九歲年輕車房東主，昨與三男二女友人遣興後，由當中一名剛相識的友人駕駛其房跑車送返家途經何文田公主道時，疑高速掟彎失控掃欄再「擺尾」，狂撼前面一輛食環署洗街車車尾。司機肇事後與兩名女乘客不顧而去，車主與其中一名友人重創昏迷被困車內，由消防員救出送院，兩人均情況危殆，另一人僅受輕傷。警方現正尋找肇事司機及兩名女乘客助查。     三成機會救回性命   重創的「少年車神」余銓儀（十九歲），其父母趕至醫院時憂心忡忡，神情哀傷。余父覆述主診醫生表示，兒子接受腦部掃描檢查後，證實頭部受到猛烈撞擊腫脹，目前不省人事；他眼睛瞪大猶如植物人般毫無反應，只剩三成機會能救回性命。余父指兒子兩年前亦曾遇上嚴重車禍，當年他身受重傷也能「大步檻過」，不料他前晚十時外出飲酒，並將購買數個月的房跑車借予友人駕駛送返家途中發生意外，故希望他今次能吉人天相。  至於另一名被困傷者陳炳能（三十歲）同樣頭部重傷，性命垂危，須留醫深切治療部。陳的家人事後向余父歉意地說：「真係唔好意思，不過搞成咁大家都唔想嘅！」  另外，受輕傷男子姓朱（二十一歲）敷治無礙，他事後指當時車速很快，各人又曾飲酒，只知肇事司機叫「阿俊」，是陳炳能的朋友，他與余銓儀於前晚才認識對方，並不知道其住址及聯絡電話。 司機與兩女客無蹤   事發於昨日凌晨二時許，該輛載着四男二女懷疑超載的豐田Altezza房跑車，沿公主道慢線往紅磡南行，途經愛護動物協會舊址對開一個左彎時，疑高速拐彎失控掃毀左邊十五米鐵欄後「擺尾」打「白鴿轉」，車尾猛撼前面一輛食環署的洗街車車尾，再反彈橫亙路中。房跑車車牌、泵把及多樣機件飛脫四散路面，右前輪拗曲，車尾嚴重損毀，殘軀摺曲插入洗街車內。  現場消息稱，司機肇事後匆忙與兩名女乘客下車，並登上一輛的士逃去無蹤。坐在右後座的朱姓男子僅受輕傷自行爬出，頭破血流坐在路邊待援，後座中間位的余銓儀及陳炳能昏迷被困，滿身鮮血，消防員到場拯救十多分鐘才將兩人抬出送院。姓陳洗街車司機接受酒精測試證實無飲酒。  肇事的豐田Altezza房跑車為水貨版，於九九年出廠，引擎容積2000cc，六前速手動波箱，馬力高達二百一十匹，深受飆車一族歡迎，新車價約三十萬元，歌星謝霆鋒亦曾擁有同款房跑車。
20020317-2,20020317,2,13歲無師自通學識駕駛,13歲無師自通學識駕駛 「呢個仔真係好鍾意車，就算𠵱家將架十個轆咁大型嘅車拆散晒，佢都識得砌番埋呀！」重傷的「少年車神」余銓儀已十九歲，為家中孻仔，因耳濡目染，十三歲那年便無師自通學懂駕駛，現時更懂得維修各式各樣的車輛。在兒子出事後一直在醫院陪伴的余父，透露兒子與車結下不解之緣。     兩兄在泰國賽車   余銓儀與父母同住將軍澳寶林邨，父親於區內南豐廣場經營報檔，母親是泰國人，有兩姊兩兄身在外地。他中一輟學後曾往泰國升學，惟不久便返港工作，近日與三名友人於牛池灣合資經營車房。余父形容兒子可能深受在泰國賽車的兩名胞兄影響，極度熱愛汽車。  余父稱，雖然兒子仍未考獲車牌，但在兒子多次央求下，終於數個月前以妻子名義購入一輛豐田Altezza房跑車，並聘請司機用來送貨。而兒子近日打算排期考車牌，他間中會將車借予友人駕駛一同出外消遣。  本報記者
20020317-3,20020317,3,元朗兇案死者非黑漢,元朗兇案死者非黑漢 【本報訊】元朗西菁街一間酒吧外前日凌晨發生的兇殺案，姓陳（四十九歲）男子在酒吧內消遣，懷疑被人偷去銀包，折返與涉嫌男子理論，被三名男子圍毆致死。法醫官昨日驗屍證實他是腹部受創引致動脈破裂內出血致死，警方正追緝三名兇徒。  姓陳死者有妻子及一對子女，住在屯門區，他生前任職廚師，亦曾做過的士司機。死者兒子表示，其父沒有黑社會背景，而且沒有坐過監。  事發前日凌晨三時許，死者在西菁街一間酒吧買醉，被人偷去銀包，他與對方理論不果後報警。事主被人挾出酒吧，在街頭至少被三名男子狂毆，他胸腹、背部有大片瘀傷，口吐鮮血昏迷地上，警方將他尋獲送院搶救，延至早上九時五十七分不治。
20020317-4,20020317,4,11企業助青少年就業,11企業助青少年就業 【本報訊】為十五至二十四歲青年而設的青少年見習就業計劃，陸續有大型機構答允提供見習空缺，當中包括機場保安有限公司、中國旅行社、康泰旅行社、滙豐保險集團（亞太）有限公司、怡和保安、縱橫二千有限公司及恒基兆業等十一間企業。  就業專責小組明日舉行會議，屆時將會討論財政預算案提出有關的就業措施。據小組最新文件指出，當局將會鼓勵參加該計劃的學員在受訓期內修讀適合的課程，例如外遊領隊證書課程等，藉以取得認可的資格，學員修讀課程如達九成出席率，政府會支付課程的費用。計劃將於七月推行，名額一萬個。  另外，為進一步推動本土經濟發展，由財政司司長主持的一個跨部門小組已舉行會議，小組成員已探討了多個促進經濟的範疇。
20020317-5,20020317,5,曾蔭培籲冷靜看減薪,曾蔭培籲冷靜看減薪 【本報訊】公務員事務局局長王永平表示，政府在調整公務員薪酬時，一定會做到合法、合情及合理，相信政府若按有關原則處理，將會得到公務員的支持，不擔心公務員會採取工業行動，而警務處處長曾蔭培則強調理解員工的憂慮，呼籲冷靜處理減薪問題。  王永平昨出席一個公開場合時指出，紀律部隊職方團體聯席會議日前雖然提出連串抗議減薪行動，但由於表明不打算罷工，故認為聯席的決定是理智及理性。他表示，五月份的薪酬趨勢調查報告，會做到公平及公正。另外，警務處處長曾蔭培昨日出席警察訓練學校結業會操後表示，他理解紀律部隊員方就可能減薪而感到憂慮，他希望紀律部隊員方冷靜處理該問題。
20020317-6,20020317,6,摑警事件主角　兩度離家出走練智偉童院打架咬福利官,摑警事件主角　兩度離家出走 練智偉童院打架咬福利官 【本報訊】一句「HappyNewYear」引發元旦警民衝突的十四歲男童練智偉，因兩度離家出走被法庭轉介入住鰂魚涌的培志男童院，他昨日傍晚在院內與另一名院童打架被福利官制止，其間福利官被咬傷手臂，眼鏡被打破，練亦手部受傷，一同送院敷治，警方對事件已展開調查。　記者：黃偉民 消息稱，練智偉去年底第一次離家出走，其後母親在旺角發現他，於是報警，警方事後將練帶署調查，其後經送上兒童法庭聆訊，認為有需要將他送入兒童院管教，為期二十八日，練在十二月中期滿離開兒童院，但仍須接受社工監管，豈料至一月一日元旦日凌晨即發生「HappyNewYear」事件。     住院為期28日   當日他與一班同學在尖沙嘴文化中心廣場狂歡時，被電視台攝得他與警員「互摑」的鏡頭，在新聞片段曝光後，市民議論紛紛，但警方事後卻稱，練智偉當時只是用手輕拍在場維持秩序警員的面頰，說了句「HappyNewYear」，但練母在傳媒追訪下指警方說謊，並表示會向投訴警察課投訴，事件一時成了「羅生門」，哄動全城。  練智偉「成名」後一個月，在二月初第二次離家出走，母親再次報警，警方在二月十一日找到練智偉，在家人及社工的同意下再交上法庭處理，練第二度入住鰂魚涌的培志男童院，為期二十八日，至三月十一日再上庭聆訊，決定是否有需要繼續留在男童院，但由於當日福利官的感化報告尚未完成，法庭下令練需再留男院多三星期，至下月再行定奪。     眼鏡打破傷眼   昨傍晚六時許，練在男童院的飯堂內，因小故與一名院童爭執追逐打鬥，一名四十歲姓楊的福利官上前制止時，與練發生糾纏，混亂中，老師手臂被咬傷，練左手揮拳打向楊的面部時，楊眼鏡被打破，左眼受傷；練亦左手受傷，事後被其他職員制服報警，雙雙送院敷治，警方正展開調查。練智偉出事前在深水埗一間中學就讀中三，在校操行一向欠佳，曾被記過兩次大過。
20020317-7,20020317,7,會用笑容處理HappyNewYear事件俏師姐棄文從戎冠同袍,會用笑容處理HappyNewYear事件 俏師姐棄文從戎冠同袍 「我會以禮貌，同埋會依法去處理呢啲情緒較大嘅市民，盡量避免不必要嘅爭拗。」剛獲警校選為新一屆最優秀結業學員的新紮俏師姐譚欣羚直言，會用「以柔制剛」的方式，處理類似今年元旦日凌晨發生的「HappyNewYear」（新年快樂）警民衝突事件，減少不必要的警民摩擦。     每日練體能   現年二十二歲，身形嬌小的譚欣羚擊敗其餘七十八名學員，在昨日的警校結業禮中，獲頒最優秀結業學員獎，譚欣羚表示，自小立志當警員，但由於父母擔心危險而反對，所以中學畢業後她改為選讀秘書課程，考得行政秘書文憑，其後做了一年多文職工作，但她始終對當警員念念不忘，最後決定實踐理想去投考警隊。  她說：「雖然文職工作穩定，但警察可以接觸唔同階層嘅人同事物，可以滿足好奇心，同埋學到好多嘢！」她坦言，因身形嬌小，所以她每日放學後仍勤練體能，將勤補拙。  被問及如何處理今年元旦日凌晨發生的「新年快樂」警民衝突事件，笑容燦爛、充滿陽光氣息的譚欣羚說：「每個人情緒都唔同，我相信只有少數人嘅情緒較大，到時我會以禮貌，同埋會依法去處理呢啲情緒較大嘅市民。」     須自我增值   這位新紮俏師姐更指出，面對不斷湧現的社會挑戰，她認為警務人員均須自我增值，加強裝備自己，所以她會繼續進修語文及電腦課程。  今屆共有七十九名警員結業，其中十二人擁有大學學士學位的資歷，曾任職會計的周偉華，本身於浸會大學工商管理會計系畢業，他表示，雖然可能要面對減薪問題，但「最緊要睇興趣，如果唔係，幾多錢都冇用！」這次結業禮由香港總商會主席鄭維志擔任主禮嘉賓。  本報記者
20020317-8,20020317,8,不滿被指揑造欠債入稟陳綺薇控姚樂碧誹謗索償,不滿被指揑造欠債入稟 陳綺薇控姚樂碧誹謗索償 【本報訊】社交名媛姚樂碧遭昔日好友陳綺薇追債十二萬一事餘波未了。陳綺薇指姚樂碧遭登報追債後，向傳媒揚言「根本冇欠佢錢」，反指陳揑造欠債。  陳綺薇指姚樂碧在傳媒的的言論內容蓄意誹謗，昨日入稟高等法院，要求對方賠償損失。     昔日同窗兼密友   金英證券執行董事陳綺薇，洋名Emily，與名媛姚樂碧，曾經是昔日同窗兼密友。陳於上月十八日在報章刊登啟事，限令Ruby姚樂碧須於二十一天內清還十二萬元，否則會遭申請破產。  陳綺薇在入稟狀中透露，區域法院於去年十二月十九日判令姚支付兩筆一萬零三百元及十萬元的款項連利息及堂費，遂於今年二月四日透過律師要求姚付款十一萬九千多元。姚的律師於二月底發出支票付款。但陳再透過律師向對方表示尚有額外利息要支付。  陳綺薇表示在採取進一步行動之前，姚樂碧已向傳媒發表言論，嚴重誹謗她。陳綺薇指二月二十八日《壹週刊》一篇題為「姚樂碧還債避是非」的文章中，姚聲言她利用九九年的一張入數紙揑造欠債一事。另於三月一日《蘋果日報》一篇「還錢唔收貨要加碼，姚樂碧斥陳綺薇：好絕好高招」的訪問中，姚再指她故意拖欠錢債糾紛以申請姚破產。陳綺薇在入稟狀中強調姚樂碧的指控完全錯誤兼失實，誣揑她向法庭說謊及濫用法律程序，言論構成嚴重誹謗。     律師不知姚去向   陳於三月五日即時透過律師致信予姚的代表律師，要求姚樂碧在報章刊澄清啟事，撤回誹謗言論，簽署協議承諾不再發布誹謗言論及作出賠償。但對方律師回應指未有指示代姚處理此事，更指姚原本在渣甸山的地址已非其住所及通訊地址。原訴人表示姚不知去向，將以其他方法送達入稟狀。現要求姚賠償損失連訟費利息。  案件編號：HCA1027?2002
20020317-9,20020317,9,華人特重面子人情,華人特重面子人情 【本報訊】香港中文大學心理學系經過十年的研究發現，中國華人具備有別於西方人的獨特性格特質，包括重面子、人情、注重和諧及節儉等特徵，反映中國人社會較注重人際間的關係。  中大心理學系系主任張妙清昨出席該系二十周年紀念的一項演講活動時表示，過去心理學一直沿用西方的理論分析個人性格特質，但有關理論未能完全切合分析華人社會的情況。該系在過去十年，分別於九三年及去年，先後向約二千名本港及內地人進行問卷調查，成功建立首套分析中國人性格特徵的學術理論。  張妙清強調，調查結果發現本港及內地華人具備重面子、人情、注重和諧及節儉等特徵；而以同樣問卷在新加坡華人中進行調查，他們亦同樣具備相關性格特質。該系將再進行調查，以確定其他華人社會或亞洲地方的人士，是否具備相關性格特點。
20020317-10,20020317,10,種金案20苦主抗議,種金案20苦主抗議 【本報訊】二十多名報稱墮下種金計劃陷阱的市民，昨日手持橫額到位於尖沙嘴的投資公司抗議，要求投資公司盡快發還拖欠的投資金額，請願人士當中包括多名聾啞殘障人士。請願代表指出，受影響市民約一千多人，遭拖欠總金額為數達七千萬元。  據請願代表盧先生表示，他們整批受害人參加該投資計劃多年，至去年投資公司遭警方調查，警方一度凍結公司一千多萬元資產，可是其後法院頒令解封該批資產，但投資公司卻隱瞞消息，更以資產遭凍結拖欠會員的投資金額。會員經過數月追討，公司方面竟要求會員以代用劵兌換貨物作補償。  但會員發現可供兌換貨物不太值錢，拒絕換領，並進行抗議追討行動。至於受影響會員中包括七十名聾啞人士，他們是互相介紹參加計劃，其中一人更疑受困擾，去年跳樓自殺死亡。
20020317-11,20020317,11,協青社與黑社會「搶仔」,協青社與黑社會「搶仔」 【本報訊】「我們也跟黑社會一樣，整夜在街上搜獵。但我們是尋覓需要幫助的青少年，協助他們解決問題或提供住宿服務。……我們設法在黑社會未接觸他們前，以兄弟般關懷和誠意與他們溝通，令他們感到我們的關心！」     外展車隊黑夜巡邏   以上一段介紹協青社的文字，貼切地描述了他們與黑社會「搶仔」的工作。協青社的社工在晚上十時至翌日六時，會派出外展車隊在街頭巡察，接觸不能或不願回家的青少年，將他們帶返家庭式寄住的危機中心，再協助他們和家人解決問題，讓他們可盡早回家。協青社又設有在職青年過渡期宿舍，協助青少年就業及自立。  社會福利署今年七月會在觀塘開辦全港首個通宵青少年中心，由協青社運作。中心設有網吧、卡拉OK房、燒烤場等，招待二十二歲以下「夜青」使用，同時讓外展社工作輔導。
20020317-12,20020317,12,港生普通話水平差,港生普通話水平差 【本報訊】不少本港大專生均希望畢業後北上發展，令學好普通話變得更重要。不過，有學者坦言，本港大專生普通話水平不足，有青年團體代表更批評，行政長官董建華在提升本港普通話水平方面工作緩慢，建議司長及局長級官員，帶頭說普通話，推動本港學習普通話的風氣。  香港青年聯會副主席張明敏，昨出席一項大專學校聯校普通話朗誦比賽後批評，董特首在推動本港普通話水平方面，工作成效不足。他指出，雖然近年不少學校都設有普通話課程，惟有關課程只局限於中三以下；而撇開學術層面，社會採用普通話的情況更是少之又少。他認為，港府司長及局長級官員，應帶頭說普通話。  香港中文大學普通話教育研究及發展中心主任何偉傑也指出，本港大專學生的普通話水平不足。他批評，部分學生甚至仍然抱着普通話是「新移民語言」的錯誤觀念，成為學習普通話的障礙。
20020317-13,20020317,13,小三評估基本能力,小三評估基本能力 【本報訊】教育署將於六月份在三十四間小學的小三試行「基本能力評估」，測試學生的中、英及數能力，經檢討後，明年將擴至所有小學的三至六年級，以便學校了解學生的強項及弱項，從而推行「拔尖補底」措施。  教育署署長張建宗昨出席一項活動後，強調「基本能力評估」不會影響學生升中的結果，家長毋須擔心，「就好似量吓血壓、睇吓有冇爛牙！」應試時，電腦會根據學生的能力調校問題深淺，從而測度出學生水平。至二○○五/○六，有關評估將推行至中三的學生。  教育評議會副主席蔡國光擔心，該項評估系統會變質，成為學校用來篩選學生升學的工具，家長為了子女成績，將會迫子女操練。教育統籌委員會委員戴希立則認為，即使學生操練也只會加強他們該三科能力，並非學能測驗時那種機械式操練。
20020317-14,20020317,14,涉盜公司2690萬元潛逃遭通緝英發國際前主席在美被捕,涉盜公司2690萬元潛逃遭通緝 英發國際前主席在美被捕 【本報訊】上巿公司英發國際前主席兼行政總裁馮建源，涉嫌在九六至九八年間挪用公司二千六百九十萬元資金，前日在美國波士頓被拘捕，本港警方正準備將他引渡返港審訊。　記者：黎國強 據外電報道，三十四歲的馮建源，洋名Kenneth或Edward，美國時間周五在美國麻省東部的劍橋市（Cambridge）寓所內，被聯邦密探拘捕。本港警方去年十二月二十一日發出通緝令，並要求美國警方協助將他拘捕。當地法院下令將馮建源暫時收押，等候進一步聆訊。  本港警方發言人表示，商業罪案調查科在九八年十一月接獲舉報後，通緝一名姓馮男子，他涉嫌在九六至九八年期間，盜用一家上巿公司二千六百九十萬元，當中涉及十二次盜竊及七次偽造帳目，其後警方調查得知他逃往美國，遂要求美國警方協助將之拘捕，目前正申請將馮建源引渡回港審訊。     擴充過急債台高築   英發國際的主要業務為生產製造文儀商品輸往歐美市場，由馮建源的伯父馮廣發於一九五五年創立，馮建源的父親馮廣恩其後加盟，兩兄弟合力擴展英發業務，並於九二年上市，馮廣發其後因出任董事職位問題不咬弦，最後以賣股解決，由馮廣恩以高出市價三成一的價格收購其兄馮廣發家族所持三成六股權，全面操控英發。  直至九七年馮廣恩將主席一職讓予馮建源，在九七至九八年間，英發在中國建立分銷網絡經銷產品，由於業務擴充過急，導致債台高築，總借款高達五億九千萬元，加上出售物業並未如期完成，令集團資金緊絀。  英發業績自九七年由盈轉虧，加上金融風暴影響，九八年業績更勁蝕四億八千萬元，當時核數師已對部分帳目提出疑問。馮廣恩九八年再度披甲上陣，重掌集團主席一職，但由於債台高築，返魂乏術。直至去年一月，英發重組債務，由盛世控股入主，簡肇昌出任主席。而馮氏家族亦失去其上市王國。
