key,date,article_daily_id,title,text
20020317-53,20020317,53,名人校友話當年--下苦功趕上英語程度,名人校友話當年-- 下苦功趕上英語程度 蘇澤光--地鐵公司主席兼行政總裁   入讀喇沙小學是很困難的。六十年代，蘇澤光的媽媽為了索取喇沙入讀申請表，不惜排隊數小時。  其後剛從內地來港的蘇澤光入讀喇沙小學六年班，但他連英文字母也不懂，但很多課堂都用英文授課，他下了一番苦功才追得上。     校風令學生更勇敢開放   有人批評喇沙學生涉獵很多東西，因此不能像聖保羅男女中學的學生般集中學業和音樂，又或是拔萃般集中體育運動。蘇澤光則認為喇沙的培育，成就出獨特的畢業生──更勇敢、更開放，少些自我拘束、多些接受新事物。  蘇澤光在七十周年校刊中說：「今天，當我仰視校門的雕塑時，我看見一個偉大的教育聖徒張開兩臂，讓兩位明顯是來自貧苦背景的小男孩進入喇沙的家庭，他們必定會獲得良好的教育，並成為社會上有所建樹的人，四十年前，我就是其中一名男孩子。」
20020317-54,20020317,54,名人校友話當年--男扮女裝「喇沙小姐」,名人校友話當年-- 男扮女裝「喇沙小姐」 何文亮--英國喇沙舊生會召集人   第一屆亦是最後一屆「喇沙小姐」選舉於一九七三年十二月在喇沙舊址舉行，由當年的總領袖生何文亮領導的領袖生委員會統籌；何文亮在校刊撰文重提這個當年玩得相當狂放的派對。當日是聖誕節假期前夕，課堂都提早結束，讓學生可以參加聖誕派對。盛事的序幕是由一眾「佳麗」上台亮相展開，「她們」都是經過精心挑選──最娘娘腔、最上鏡的男學生。  跟着是民族服裝與泳衣環節，盡情顯露同學的玲瓏曲線。到了答問環節，更把整個派對推到極端鄙俗的高峯。司儀問一位「佳麗」有甚麼閒餘愛好，「佳麗」竟回答：「我想做雞……蛋糕！」台下觀眾登時高聲狂笑，學校禮堂的地板幾乎被如同暴徒的同學踩得毀爛不堪，很多教師和修士都反感地離開會場。     同學開心修士反感   該次活動是在校長Raphael修士不知情下獲准舉辦的，當何文亮走到辦公室請他向得獎「佳麗」頒獎時，修士說：「Brian（何文亮），我不想再看到你的臉！」其後無人敢再提出重辦選美大會了。
20020317-55,20020317,55,否認地產商與政府「鬥劈價」何鴻燊：下半年大量平樓賣,否認地產商與政府「鬥劈價」 何鴻燊：下半年大量平樓賣 【本報訊】對於有房委會成員建議政府毋須全港居屋補地價便可轉售，可能令大量平價房屋湧出市場，地產建設商會主席何鴻燊，昨日回應表示支持有關建議，並表示地產商一早已有應變方案，將在下半年推出大量平價單位，但他否認今次是地產商和政府「鬥劈價」，並預計香港樓市會在今年底復甦。　記者：莫劍弦、劉碧思、湯家明 何鴻燊昨日出席女童軍同步創明天活動後稱，對於有房委建議豁免居屋業主補地價，其實地產商已知道政府會有類似行動，他們亦會支持有關建議：「佢（政府）呢個行動事實上係對買居屋嘅人好好，我哋唔會因為咁少少去反對！」他又說，有關措施無礙發展商推新盤的安排，因為一早已作好準備。「事實上我哋地產界已經準備好晒，即係我哋手上有好多平樓，預算今年幾時幾時會推出，準備晒喇！」     「料下半年會好番」   不過，何鴻燊否認地產商是「劈價」售樓，反而顯示地產商看好下半年物業市道的表現，他相信地產市道會平穩上升。「地產商對政府呢個所作所為係可以接受，第一我哋認為個市會穩定，穩定之後會慢慢好番少少，我相信過咗下半年（樓市）會好番！」  對於下半年將有大量平價盤供應，長實執行董事趙國雄認為對樓市影響不大。他指出，現時也有好多平價樓賣，主要是迎合一批負擔能力較低人士。由於樓市現處於穩定狀態，加上今日賣樓，利潤較以往低，發展商之間推售新盤時未必會鬥平出貨，定價高低主要視乎樓盤本身質素、配套及條件，平價樓供應多也未必令中下價樓受壓。  美聯物業執行董事張錦成認為，發展商平價賣樓與否，最緊要市場有承接力。「今日樓價已好平，每月維持約七千宗買賣成交，若平價樓湧現，只會造成旺市不旺價，未必拖低樓價。」 樓盤積存有待消化   對於居屋免補地價的建議，恒隆集團主席陳啟宗昨日在出席亞洲企業領袖協會成立記者會後亦有回應。他說，由於房委會仍就有關建議進行討論，未知何時落實，故現時不方便評論。  不過，陳啟宗表示，現時公營房屋面對兩個問題，包括居屋是否免補地價，及是否將公營樓宇出售，他贊成長遠出售公營房屋的建議，甚至認為公屋亦應出售予所有私人住戶。  對於最近推出的新樓盤同時出現加價及減價情況，是否意味地產市道仍欠缺方向。陳啟宗表示，樓盤調整價格與地點及定價有關，故加價及減價同時出現屬正常現象，不過他亦同意，現時仍難看清地產市道前景。  陳啟宗指出，現時市場仍積存大量樓盤，相信要一段日子才能消化，加上續有大量土地供應，故買家亦不急着入市，所以「現時的樓市認真麻麻。」
20020317-56,20020317,56,爆英皇食水深霆鋒荷蘭抽大麻冇王管,爆英皇食水深 霆鋒荷蘭抽大麻冇王管 謝霆鋒花了九個月時間裝修、投資過五百萬元的私人Band房，日前終於落成。前日霆鋒在Band房內接受訪問時，表示Band房每一件大小物品，皆是他用血和汗賺取，更透露現時英皇抽佣是天文數字。昨日霆鋒又自爆曾在荷蘭抽大麻。 事業篇：用疤痕紀念成就   年年僅二十一歲的謝霆鋒，入行短短四年，已擁有兩輛法拉利、兩間約值六百三十五萬及七百八十萬元的豪宅，甚至總投資超過五百萬港元的私人Band房，這些都是他努力的結果。雖然在此期間，是非、批評和緋聞不斷纏身，但霆鋒仍覺得自己十分好彩。  昨日謝霆鋒在黃埔宣傳電影《戀愛行星》，被問到有藝人服用軟性毒品增加創作靈感時，他認真地說：「Sorry呀，你哋可以問埋我啲朋友，謝霆鋒有冇攞過啲大麻出嚟。」     荷蘭合法見識   不過，霆鋒卻承認曾在荷蘭阿姆斯特丹抽大麻，他說：「我去阿姆斯特丹旅行就試過食（大麻），嗰啲係合法國產，有醫生證明可以醫嚴重頭痛，係藥嚟嘅，有護膚品都有用，我只係見識，我都唔鍾意嗰種味，我唔係推廣，我最終強調我冇（再食）。」  早前有報道指霆鋒返加拿大戒毒，他說：「本雜誌最後總結完之後話唔係（戒毒）喎，咁你講晒啦，你搵嗰個人（記者）嚟講吖笨！成日聽聞完又嚟問，你搵到人指證我至算吖笨！你叫嗰個人夠膽寫呢篇嘢，就用自己嘅真名，我唔用律師告佢我唔姓謝，我夠據聞佢老竇強姦佢個女咯。」  其實荷蘭早在七十年代，已將吸食及銷售大麻合法化，並設立合法的大麻咖啡店出售含有大麻成分的香煙。現時荷蘭全國約有二千間大麻咖啡店，而首都阿姆斯特丹更是其門如市。     垃圾袋包傷口   而前日霆鋒在其中環雲咸街新落成的私人Band房接受訪問時，看着自己足足花了九個月精心設計的「私竇」，他一臉滿足地說：「我覺得自己好好彩，但唔可以抹殺我呢啲嘢（Band房）嘅背後，係用咗我幾多血、幾多傷痕去換番嚟。呢間Band房成五百幾萬嘅投資，每一件物件，都係我背脊骨嘅傷，同埋對腳縫幾多針去換取。」 說罷，霆鋒捲起褲腳展示他過往的「戰績」，單是膝蓋至腳眼位置，已有六、七道疤痕之多。  霆鋒說：「我第一部戲《新古惑仔之少年激鬥篇》有一場地盤劈友戲，嗰日我腳眼位置唔小心俾嘢𠝹開咗，見到骨兼且成鞋血，我唔想第一次拍戲就阻住進度，於是攞個垃圾袋包住隻腳，再劈多三個鐘，之後先至入醫院，隔籬爆晒缸嗰啲都要行埋一邊呀！  「醫生話我過咗六個鐘頭先至走嚟縫針，啲破傷風菌可能走勻全身，會死人，結果要我簽張生死狀先至同我做手術。」      謝霆鋒：謝　記者：記      記：  你簽咗十年賣身契畀英皇，年期咁長後唔後悔？    謝：  冇話後唔後悔嘅，其實我初時簽四年之嘛，後來我同公司嗌交，偷走返加拿大，坐食山崩，咪求番公司畀我返嚟囉，結果返嚟嘅條件就係加多六年合約，由四年變十年，跟住再變嘅就係抽佣嗰啲嘢，乜嘢都變咗一個天文數字。  記：  當年點解同公司嗌交？點解又要求公司畀你返去？     高佣金換尊重     謝：  我唔想做一啲我覺得唔係我做嘅嘢，但環境經濟迫成，我返加拿大之後坐食山崩，我要諗屋企經濟，爹哋同媽咪又離咗婚，我要諗個妹（謝婷婷），要諗嫲嫲，諗吓我自己，我係咪留喺加拿大就得呢？    記：  公司抽佣唔係一開始抽幾多就幾多㗎咩？    謝：  初頭抽好少㗎咋，但𠵱家──唔使講啦！不過，相對嚟講，我亦得到公司嘅尊重，可以畀我做自己鍾意做嘅嘢。  採訪：戴彩煥、何永寧  攝影：仇志德
20020317-57,20020317,57,陳文媛維護同門師妹,陳文媛維護同門師妹 陳文媛（BoBo）昨日到尖沙嘴，出席「Cosmogirl!BoBoK-fun大派對」，數十名歌迷參加。  早前有周刊報道指唱片公司力捧新人李蘢怡（Tiffany），忽略了BoBo，BoBo聽後反應頗激動地說：「我嗰日同嗰個記者做訪問時，都傾得好哋哋，我覺得佢咁樣作嘢好有問題，所以我冇嘢需要回應。」     離間計失敗   問BoBo會否拒絕再接受該名記者訪問，她說：「今次可以話係唯一嘅一次，我對佢公司嘅人都會有戒心，佢咁做好冇專業守則。而佢呢一個離間我哋（李蘢怡）嘅計劃，亦做得好差，佢係唔會成功㗎。」
20020317-58,20020317,58,河村隆一來港會MaggieQ,河村隆一來港會MaggieQ 日本男歌手河村隆一，昨日下午抵港為MaggieQ有份演出的日劇《相約在九龍》取景，同行還有此劇女主角石田百合子，但卻沒有任何fans到場接機。  一身黑衫黑褲甚cool的河村，被問到對MaggieQ的印象，他即說：「MaggieQ？冇乜印象喎！吖！我記得見過佢張相，好靚女㗎喎！」     約拍攝一星期   《相》劇在港的拍攝地點，全由香港旅遊發展局協助選景，預定拍攝地點為機場國泰城、山頂、海旁及天星碼頭，為期大約一星期。但其實河村最想去的地方卻是澳門，他表示曾到澳門旅遊，感覺很特別。  採訪：汪正文
20020317-59,20020317,59,楊思琦曾做童軍領袖,楊思琦曾做童軍領袖 楊思琦昨日往尖沙嘴為香港童軍總會，任童軍獎券抽獎嘉賓，並獲大會頒發紀念品。楊思琦小時候希望做童軍，但一直未有機會，直至考入教育學院，才與同學一起做童軍領袖。     工作接踵而來   楊思琦說：「我細個已經好想做童軍，因為我覺得好有意義，不過一直都冇咁嘅機會。」  目前受到無綫力捧的楊思琦，工作接踵而來，她說：「拍完《LovingYou我愛你II》之後，我會主持一個叫《瘦身一百分》嘅節目，跟住再開拍一套古裝劇。」
20020317-60,20020317,60,林嘉欣喜獲張國榮賞識,林嘉欣喜獲張國榮賞識 林嘉欣、余文樂和譚俊彥昨日往銅鑼灣，宣傳「第廿六屆香港國際電影節」。     獲哥哥賞識   林嘉欣對於自己兩套電影分別與張國榮（哥哥）和張學友合作，她說：「有傳公司指定搵我拍戲，其實選角要經過導演、副導演同哥哥，唔係外傳咁樣。」  此外，林嘉欣昨早與謝霆鋒往黃埔宣傳電影《戀愛行星》時，她動手打霆鋒屁股，她說：「要估佢着幾號鞋，我話唔知，佢話『梗係啦，你又唔係我嗰個（女友）。」
20020317-61,20020317,61,柏芝借霆鋒過橋避東東,柏芝借霆鋒過橋避東東 昨日一班環球歌手齊齊為「女童軍同步創明天」活動做嘉賓，陳曉東亦有出席活動，但其前女友張柏芝卻沒有出席，而日前柏芝才大方的在謝霆鋒的音樂會上做嘉賓，柏芝似有不想與東東同台演出之嫌。 環球唱片公司旗下一班歌手陳曉東、張燊悅及黃伊汶等昨日出席於旺角大球場舉行的「女童軍同步創明天」活動，而譚詠麟、張國榮及張柏芝都沒有出席，柏芝大前晚曾出席謝霆鋒的音樂會，但昨日卻缺席此活動，似有刻意避開前男友陳曉東之嫌。  陳曉東（東東）昨日以一頭短髮新形象示人，他被問及可知柏芝未有出席該活動，東東坦言：「吓，我唔知㗎！我淨係知我要嚟呢個活動。」     東東避談柏芝緋聞   問到東東可有與柏芝聯絡？他說：「冇聯絡，總之大家都好咪好囉。」柏芝日前在電台訪問中說現時只能與東東在電話中聯絡，不可以出來吃飯覺得很可惜，東東有否也覺得可惜呢？他說：「唔好計較呢啲嘢，大家朋友會明白㗎！」至於最近柏芝與霆鋒的緋聞，他只說：「人哋嘅嘢你問番人哋啦！我唔講啦！」 佯稱與霆鋒拍廣告   記者就張柏芝缺席一事，問到環球唱片香港區總裁陳少寶，他說：「唔齊人係因為有啲人有嘢做，柏芝唔嚟唔係因為避東東，呢啲係公司嘢唔會避，佢唔嚟係因為佢好似要同謝霆鋒拍個廣告，都有度過期，但係度唔到。」  但霆鋒昨日下午二時才為電影《戀愛行星》在黃埔做宣傳，而「女童軍同步創明天」活動亦是於二時開始，何以霆鋒可以出席電影宣傳，而柏芝卻未能出席活動呢？  採訪：胡比  攝影：仇志德
20020317-62,20020317,62,陳彥行遲到是非當宣傳,陳彥行遲到是非當宣傳 陳彥行（行姐）、趙學而和梅小惠昨日在清水灣電視城為《皆大歡喜》拍攝一場逛街買布戲。日前有報道指由於《皆》劇演員遲到情況嚴重，製作部副總監曾勵珍開會時更點名指趙學而、行姐都在遲到之列。     相信有人報料   對於被指遲到一事，行姐說：「我唔信開會嘅內容會有人知，可能有人講。」有冇懷疑劇中藝人報料？她說：「梗係冇懷疑啦，但係我相信有人講。其實我哋一班演員合作得好開心，大家都好準時，冇人遲到。總之娛樂圈就多是非，咪當係宣傳。」  採訪、攝影：駱華齡
20020317-63,20020317,63,歐陽妙芝高溫瑜伽瘦身,歐陽妙芝高溫瑜伽瘦身 昨日本地設計師周明於九龍奧海城商場舉行「周明2002春夏時裝展」，請來歐陽妙芝及蒙嘉慧（Yoyo）等穿上具中國特色的時裝行catwalk。     蒙嘉慧險撞板   歐陽妙芝穿上性感中國特色的bratop展示其美好身段，她說：「因為前排新年食咗好多嘢，肥咗好多，所以走去學高溫瑜伽，勁瘦十磅，發覺下身都瘦埋，手腳都靈活咗，所以做show時着上bratop特別有信心。」  另外，Yoyo表演時顯得十分着急，她說：「我喺綵排時重緊張，差啲撞埋塊板度！」
20020317-64,20020317,64,Rosemary護愛郎公開頂撞阿媽,Rosemary護愛郎公開頂撞阿媽 名模Rosemary一向順從母親Julie，她前晚得知男友Gordan向她發表愛的宣言後，要等母親離開身邊才敢回應。不過當她聽到母親指摘男友後，罕有地在公開場合駁嘴。 名模Rosemary前晚偕母親Julie到銅鑼灣吉列島香港遊艇會，出席「TheMacallan1951LaunchParty」，周啟邦夫婦及陳敏之等都有出席。     指女兒自討麻煩   日前Rosemary男友Gordan公開發表愛的宣言，Rosemary聽到記者複述Gordan的說話後，先警覺地望一望旁邊的母親，然後以英文說：「我唔知，我寧願佢同我講而唔係同傳媒講。」後來，Rosemary見母親行開，便暢所欲言地說：「其實呢啲係私人嘢，我哋有聯絡，佢咁講我覺得好touching，佢係個niceguy。」不過Rosemary一見母親折返，又隨即收口。     見母扯火即收口   問Julie對Gordan的宣言有何看法，她說：「我覺得呢啲問題係私人事，我唔鍾意佢開口講，咁高調，（拍拖）唔會長㗎，自己攞麻煩。」她又教訓Rosemary，她說：「呢句說話唔係淨係話你，你要同佢（指Gordan）講呀。」Rosemary聞言後，即時駁嘴說：「傳媒問你嘢你都唔係全部唔答啦，佢（指Gordan）都唔係特登講嘢，佢只係答問題。」  Julie此時顯得有點憤怒，她說：「總之私人嘢唔使公開。」而身為女兒的Rosemary見狀，立即低聲說：「係囉，我會同佢講，我都贊成唔係有乜都要同傳媒講。」  其後Julie對記者說：「我唔係反對佢哋，但都唔係咁快成日講sunshine、sweetheart嘛，有乜意思啫？」兩母女繼而重展歡顏拍照。  另外，前晚大會介紹一隻1951年份的純麥芽威士忌，全球只得六百三十二瓶，香港配售十八瓶，每瓶售價二萬二千元。
20020317-65,20020317,65,胡楓個唱黎明喧賓奪主,胡楓個唱黎明喧賓奪主 黎明（Leon）、Twins、黃霑、陳寶珠、楊天經、羅嘉良和李香琴等，前晚齊齊為胡楓（修哥）的「楓Show人生七十年胡楓演唱會」擔任嘉賓，當晚入座率高達九成，其中單是入場的Leonfans，便多達三百人，當Leon一出場時，全場fans高聲吶喊，搶盡他契爺修哥的風頭。     林建岳後台現身   Leon在台上表示，前晚他所穿的七十年代款式的黑白皮鞋，乃是專程為出席修哥演唱會而設，以配合現場懷舊氣氛，至於修哥介紹Twins出場時，更笑言連金舖也要落閘，免被Twins的熱情fans推倒。此外，林建岳前晚亦在後台出現，但他逗留大約十分鐘便匆匆離去。  採訪：王崇穎　攝影：馬啟然
20020317-66,20020317,66,肥姐為愛女笑到肚痛,肥姐為愛女笑到肚痛 沈殿霞（肥姐）割掉三十六粒膽石後，日前已經出院，昨晨她在女兒欣宜的陪同下，往威爾斯醫院覆診，並表示已逐漸康復。     燕窩補身   昨日有記者謂快高長大的欣宜已高過母親，肥姐聞言後高興得捧腹大笑，但因動作太大，令傷口感痛楚，她說：「啊！好痛啊！我唔可以笑得太大力，但係我阿BB（指欣宜）真係高得好快！」  肥姐說：「我好得好快，體重回升番，今日返醫院抽血同洗傷口，因為我有糖尿病，傷口埋得好慢，每日朝早就麥皮鮮奶加燕窩，夜晚就食燕窩粥，鮑魚煲雞。」  採訪、攝影：楊潔雯
20020317-67,20020317,67,愛情篇：與王菲互相信任,愛情篇：與王菲互相信任 談音樂、談工作，霆鋒可以滔滔不絕，但一提到感情，他卻有所保留。    記：  你之前幾位女朋友年紀都比你大，你係咪特別鍾意年長啲嘅女性？    謝：  唔係呀，年紀冇關係㗎，我入行嗰陣已經係最細嘅一個，又何來搵個比我細嘅呢？連Twins嘅鍾欣桐都比我大啦。    記：  你咁多緋聞，王菲唔擔心咩？    謝：  有啲嘢係互相信任嘅。    記：  點維繫你同女朋友嘅感情？    謝：  好難講，好難形容。    記：  兩個人相處有冇拗撬？    謝：  有邊個冇拗撬吖？我同爹哋、媽咪同普通朋友都有拗撬啦，咪一人讓一步囉。    記：  你自問係咪一個細心體貼嘅人？    謝：  細心嘅時候會好細心嘅。     自認非好情人     記：  點細心法？    謝：  講咗好「糯」（意指瘀）㗎。    記：  你自問係咪一個好好嘅男朋友？    謝：  我唔係一個好男朋友，因為我太多嘢顧，又有好多嗜好，我對屋企有責任，我有爹哋、媽咪，我有細妹，我有嫲嫲；我有Band房，我有六十幾支結他；我有幾部車要去錫，要去顧；我有咁多朋友；我有我嘅音樂。一日得二十四小時，又何來咁多時間陪女朋友呢？  冇錯，有一次我係專登返嚟同女朋友過生日，我返嚟一日，第二朝就即刻上機，OK，咁又如何呢？係咪送咗小小禮物就代表啲乜嘢呢？係咪就可以維持到幾年？    記：  你有冇計劃過將來？    謝：  每個人都有夢想，但今日唔知聽日事，我愈嚟愈覺得，眼前就係最開心。？ 條命似足謝賢     謝：  有人話我彈結他唔好，但我從來冇話過我彈結他好喎，呢個世界，有冇一個全能音樂人攞「最受歡迎男歌手」之餘，重係一個好男朋友，好乖嘅仔，好好嘅朋友？我就唔信會有，神都顧唔到咁多嘢，更何況係人！  儘管霆鋒口口聲聲指自己不是一個好男朋友，不是一個十全十美的人，他卻自言對感情絕對專一，從未試過一腳踏兩船。  霆鋒說：「我爹哋以前好多緋聞，同我條命一樣，但我媽咪話我爹哋其實係一個好專一嘅人，我覺得我非常似佢。坦白講，我從來冇試過同一時間有兩個女朋友。」     「我好容易錫人」   就正如近日他與張柏芝的緋聞一樣。霆鋒表示在他心目中，柏芝只是一個他疼錫的妹妹，雖然實際上柏芝年紀比他還大。  霆鋒說：「我好容易會疼錫一個人，當係妹妹咁看待，大家鍾意點寫就點寫，冇所謂。」  而霆鋒的父親謝賢雖然在娛樂圈身經百戰，但卻未有特別教兒子如何面對這個是非圈，霆鋒說：「佢淨係送過兩隻字畀我，就係『執生』！」
20020317-68,20020317,68,Swing拆夥惹桃花陳淑蘭飛擒大咬啜雙王,Swing拆夥惹桃花 陳淑蘭飛擒大咬啜雙王 二人組合Swing前晚在港台舉行告別音樂會，一班港台DJ陳淑蘭、胡諾言及周國豐都有出席。只見陳淑蘭甫上台飛身向Jerald及Eric獻吻，二人對這突如其來的豔福感到手足無措。 二人組合Swing隊員Jerald因另謀發展，故決定與Eric分道揚鑣，解散Swing。前晚二人在港台舉行告別音樂會，作拆夥前最後一次同場演出，一班港台DJ都有出席支持，其中一向為人熱情的陳淑蘭，上台時竟突然飛身獻吻，分別在Jerald及Eric的臉頰各親一吻，二人被嚇得手足無措，且表現尷尬。     轉做行政工作   Swing二人由合組Snowman開始至今已合作四年，他們在台上獻唱時，難掩離愁別緒，邊唱邊眼泛淚光，事後Jerald說：「我會轉行做行政工作，幫一位uncle做projectmanagement，可能都會做同音樂有關嘅嘢，例如搞演唱會，𠵱家未知幾時返工。」  Jerald表示他想轉行非突然決定，因為他有感在香港當實力派歌手不易，唱片銷量不佳，又沒有廣告及剪綵等其他的收入，很難堅持下去，Jerald說：「我都就嚟三十歲，𠵱家睇唔到前景，我知好多歌手捱咗好耐先成功，但我唔想對音樂有灰嘅感覺，所以轉行。我知咁嘅決定好自私，但我睇好Eric，佢咁有天分，做幕後都會成功。」     不想強人所難   而Eric則說：「其實Jerald都唔係第一次話想拆夥，霆鋒同Eason（陳奕迅）都叫過佢睇開啲，但我都唔想強人所難。」  採訪、攝影：陳梅香
20020317-69,20020317,69,方力申爆粗適可而止,方力申爆粗適可而止 方力申（Alex）、何韻詩及鄧健泓，昨日到商台出席「無煙無掛新一代」記者會。方力申對於有雜誌指他在大學內抽煙及講粗口，他坦率地直認自己在發脾氣時都會講粗口，但卻從不抽煙。  Alex說：「我都唔食煙，但遇到慶祝場合都會飲少少酒，唔會避忌。」至於有否講粗口，Alex則說：「粗口我識講，但我喺學校冇講過。我試過情緒激動時講過粗口，但都係講粗俗少少嘅說話，唔會問候人祖宗十八代，我唔會刻意做完美大男孩㗎。」     何韻詩請食飯   而何韻詩最近推出新碟，不到一星期已有金唱片銷量，賣出二萬五千張，她表示要請唱片公司同事吃飯，她謂如果賣出五萬張，則會請大家環遊世界，但只是到深圳的世界之窗。
20020317-70,20020317,70,薛家燕痛哭傷身,薛家燕痛哭傷身 薛家燕、鄧萃雯及鍾景輝，昨日在北角為無綫新劇《LovingYou我愛你II》拍攝一場車禍戲。     靈魂出竅   劇中鍾景輝因中了六合彩，彩票不慎被風吹出馬路，鍾慘遭車死。靈魂出竅之際，見到老婆薛家燕及女兒鄧萃雯當街痛哭。  鄧萃雯正式拍攝時，眼淚收放自如，家燕姐則需用眼藥水協助拍攝。家燕姐說：「前幾日同鄭嘉穎拍完一場喊戲，返到屋企個心口痛咗一晚。我覺得成日諗啲唔開心嘅嘢，好易有病，所以我一直保持心境開朗。」
