key,date,article_daily_id,title,text
20020721-53,20020721,53,維修唱慢板房署漠視人命,維修唱慢板房署漠視人命 寶明苑牆磚半年未修   連小姐為將軍澳寶明苑業戶，今年二月起，其所住單位的走廊牆磚呈現隆起，管理公司只於該處張貼危險告示及表示會安排修葺，惟迄今已逾半年，尚未動工，曾向管理處查詢維修進度，只回覆「安排中」。     決定先安排維修   她指出，房屋署及管理公司應清楚若工程再拖延，隨時會發生意外，對住戶構成潛在危險。  房屋署新聞組稱，年初接獲投訴後，已轉介該屋苑辦事處跟進，由於房署認為牆磚剝落可能屬建築潛在問題，故一直要求負責興建的承建商承擔責任，因而花多了時間。不過，房署已決定不再為有關問題令維修進度膠着，會先安排維修，再向承建商追究責任。  發言人強調，房署過去曾評估上址情況，認為並無危險，才將維修工程暫時擱置。（○七一二○九）     山景邨爆喉滴水三月   屯門山景邨景富樓租戶葉先生稱，其單位門外的洗地水喉，於三個月前爆裂而引致滴水，令單位門外長期積水，出入甚為不便，他曾多次向房屋署投訴，但均未獲安排維修。  早前房署終於派員維修，但只是將爆喉位置塗上石屎，暫時將滴水阻截，並未徹底維修，他不滿房署馬虎了事。 等候批核安排工程   房屋署發言人回覆，由於外判公司需就有關維修工程等候批核，所以需時較長，有關工程現已獲批核，短期內可展開。而日前以石屎封閉爆喉，只是臨時性質，房署已安排維修工程。（○六一○五二）     麗安邨地磚凸起逾年   陳先生投訴，深水埗麗安邨麗榮樓地下大堂的地磚凸起已有兩年，房署不但不作維修，只於過年前以「掩耳盜鈴」的方法，用紙皮將該部分蓋着，由於屋邨長者甚多，此方法反而容易令不留神的長者絆倒。     研究重鋪地台需時   房屋署新聞組回覆，據紀錄，上址地磚凸起「冇兩年咁耐，最多只係一年」，房署一直有跟進，由於過程涉及交由屋邨管理委員會商討，研究是否重鋪地台及揀選地磚顏色等，故需時較長，不過現已落實為麗安邨全邨共五座樓宇的大堂重鋪地台及地磚。（○七一七○一）     盛強樓磁磚剝落半年   李小姐投訴葵盛東邨盛強樓十六樓大堂磁磚剝落逾半年，房署仍未安排維修，威脅居民安全。 承諾七月底前完工   房屋署回覆，調查顯示，盛強樓走廊磁磚最早出現剝落約於五個月前，當時因為「只係鬆鬆哋」，須作觀察，以及揀選顏色相近的磁磚重鋪，所以未即時維修。  房署表示，已督促負責管理的富寧物業管理公司盡快維修，管理公司亦承諾在七月底前會完工。（○六二五六一）     意見：官僚制度導致拖延   房委會委員兼公屋聯會主席王坤批評，房屋署將建築外判，但制度官僚，不以用家（居民）的角度出發，只在保護自己利益，只顧向承建商追究責任，但其間雙方往往就責任問題「有排拗」，而將維修工程擱置，同時也將居民安全問題擱置。他認為，房署日後應在建築合約上訂明，當遇上有關情況，房署應先行維修，才再追究責任，以堵塞現時漏洞。    服務熱線  電話:29908288  傳真:23702192  電郵: sservice@appledaily.com 
20020721-54,20020721,54,荃德巴士站缺上蓋,荃德巴士站缺上蓋 早前有荃灣荃德花園居民投訴，指青山公路近荃德花園一帶，以及近荃灣港安醫院的巴士站均未有加設上蓋，令候車乘客受苦。     研究斜坡擱置興建   投訴刊出後，九巴回應表示，根據紀錄，該公司分別於九六年及九八年向運輸署申請於上址位置的巴士站興建上蓋，惟當時運輸署回覆稱，上述巴士站處於一個未經評估的斜坡之下，土力工程處需對斜坡的安全進行研究，故上蓋興建計劃暫時擱置。  九巴過去兩年再跟進有關情況時，運輸署回覆指荃德花園的分站附近將有道路工程，而港安醫院分站附近則正進行斜坡工程，因此興建上蓋計劃仍須暫時擱置。    服務熱線  電話:29908288  傳真:23702192  電郵: sservice@appledaily.com 
20020721-55,20020721,55,父子半年無糧出　靠日借幾元度日「做工人好慘」追欠薪者圖跳樓,父子半年無糧出　靠日借幾元度日 「做工人好慘」追欠薪者圖跳樓 【本報訊】打工仔難做！失業率高企，有工做亦不等於有糧出。繼前日追薪爆發警民衝突後，昨日再傳出有兩個建築地盤拖欠員工薪金，加上兩間食肆結業，近三百名打工仔度過了一個黑色星期六。其中被拖欠半年薪金的建築工人，昨懷着滿腔怒火，到勞工處追討六萬元欠薪救急，見「二判」後更激動得欲跳樓；硬漢子含淚訴說現時靠賒借度日，每晚都在地盤借宿，身家只有口袋裏的數個硬幣。　記者：梁偉權、林榮海、盧文烈 前日發生警民衝突的油塘鯉魚門道地盤數十名工人，昨日在觀塘勞工處與兩間總承建商商討補償問題時，突然見「二判」蔡氏兄弟油漆公司東主之一的蔡東福出現，工人曾先生立時情緒激動，撲上前與對方爭論，大叫：「我哋做工人好慘㗎，你知唔知呀！」蔡大驚馬上離開現場。曾先生情緒仍然激動，衝出露台企圖跳樓，工友立即將他拉住，在場警員亦上前勸阻，事主終平復下來。     爛褲一條地盤留宿   年齡五十餘歲的曾先生從口袋掏出數個硬幣，邊展示邊向記者說：「我副身家就得呢幾蚊，全屋得呢條爛褲着到𠵱家……」說着不禁老淚縱橫。他又表示已半年沒有出糧，公司共欠他六萬元薪金，其十九歲兒子和他在同一地盤工作，結果同被欠薪，要賒借度日，十元八塊都要向朋友借，晚上要在地盤裏睡。  曾先生又說：「我老婆喺深圳大咗肚，每日只得十蚊看門口，𠵱家自己惟有努力搵工做，如果再搵唔到，只有寫定遺書去自殺，其實好多工人都就嚟要自殺啦！」  至於「二判」蔡東福，事後自稱是受害人，拖欠薪金失蹤的是他兄長，他自己也是打工仔，公司欠他七個月薪金，所以昨日才出現向總承建商要求補償。 欠薪個案每周三宗   建築地盤職工總會總幹事宋治德透露，該會昨日新接獲兩宗建築地盤員工求助個案，指遭承建商拖欠約兩個月薪金，合共三百萬。其中一個地盤是位於南丫島的港燈發電廠，約一百名員工被拖欠二百萬元，另一個建築地盤則是紅磡國際都會，四十名水喉工遭拖欠一百萬元，工會現時正為員工搜集工時紀錄，計劃下周向勞工處求助。  宋治德形容，今年自農曆年後，工會處理工人欠薪個案「冇停過」，每星期平均接獲三宗涉及多於三十名工人的建築地盤欠薪投訴，每宗涉款達五十萬至一百萬元。他表示，若政府不正視建造業「判上判」的問題，會愈來愈多欠薪事件出現。而該會會務主任吳恩光更說：「𠵱家啲打工仔真係好慘，一係就冇工做，一係就有工做冇糧出，呢個係乜嘢社會，政府高官應該諗清楚。」  另外，本報昨接獲投訴，指一間資訊公司由於競投教育署的合約失敗，近日裁減了百多名員工，年資均不多於兩年，並以給予通知期形式裁員，做法不近人情。
20020721-56,20020721,56,行人路修車阻途人,行人路修車阻途人 本報早前報道元朗宏業西街及富業街居民投訴，行人路經常有人修車，阻礙途人。  警方發出定額告票  警方回覆：上址有三家汽車服務公司，車輛偶然會停泊在行人路等候修理或其他汽車服務，而這些工作通常會在公司內進行。警方早前亦有到上址巡查，並發出定額罰款告票，情況已改善。    服務熱線  電話:29908288  傳真:23702192  電郵: sservice@appledaily.com 
20020721-57,20020721,57,工會促監管分判層數,工會促監管分判層數 【本報訊】建造業欠薪情況嚴重，政府正急謀對策解決，經濟發展及勞工局常任秘書長（勞工）張建宗明日將會晤商會及工會，尋求解決方法。工會促請政府加強監管分判商質素，限制每項工程的分判層數至最多三至四層，以防工人血汗錢被搾取。  瑞安建業的油塘居屋地盤前日爆發「二判」油漆工人因追討欠薪釀成警民衝突，三十多名工人昨到觀塘勞工處與兩間總承建商核對開工紀錄，追討「二判」拖欠的薪金，部份達成協議的工人，日內可取回不超過兩個月的薪金。牽涉的工人約九十名，經蔡氏兄弟油漆公司間接受聘於「保華」及「瑞安」兩間建築公司，被拖欠半年薪金約一千萬元。     瑞安承建申請禁制令   而瑞安旗下瑞安承建有限公司昨入稟高院申請禁制令，要求禁止八名工人闖入油塘地盤破壞該公司物品、阻塞通道或滋擾職員，亦不得到公司位於灣仔瑞安中心及大角嘴的辦事處生事，並就公司物品受損索償。工業傷亡權益會則去信警務處處長，批評警方處理事件失當。  建造業總工會理事長蔡振華稱，明日與張建宗會面時將要求政府嚴管分判商，「部份判頭根本未夠班，淨係識得將工程再判落去從中取利。」  建築地盤職工總會總幹事宋治德促請成立分判商註冊制度，「𠵱家好多工程閒閒哋去到六、七判，根本就好唔健康，我哋認為最多只係可以去到三至四判。」他提醒工人若被欠薪多於兩個月，應向工會及勞工處求助，根據法例，總承建商只會為分判商墊支兩個月欠薪。
20020721-58,20020721,58,飲食業黑暗歲月　料每月淘汰百店兩酒樓執笠130員工失業,飲食業黑暗歲月　料每月淘汰百店 兩酒樓執笠130員工失業 【本報訊】飲食業市道低迷，昨日再有兩間食肆結業，一百三十名員工頓失「飯碗」。業界指出，經營日見困難之下，過往飲食業「一雞死、一雞鳴」的現象不復再；有僱主更估計，下半年每月將有約一百間肆結業，每月約有二千人加入失業大軍行列。  位於葵涌、開業只有七個多月的喜運海鮮酒家昨日突然結業，拖欠八十多名員工五十日薪金共一百三十萬元，員工計劃明日向勞工處求助。大圍的中檔食肆貴妃雞昨日也拉閘結業，雖然僱主已向四十多名員工發放薪金，但部份年資較長的員工仍被拖欠遣散費或長期服務金。     業內勞資糾紛增近一倍   飲食業職工總會主席顏振雄表示，工會在過去一年接獲一百一十宗勞資糾紛，涉及二千六百名員工及八千三百萬欠薪，較前年增加近一倍。他指出，隨着本港經濟愈來愈差，飲食業前景非常灰暗，估計酒樓結業及欠薪事件將陸續發生。「以前執一間、開一間，但係𠵱家執一間，都唔知幾時再開番，好似敦煌上次一次過執咗十幾間，但係𠵱家只係得一間開番。」  香港餐飲聯業協會主席伍德良謂，過往但凡有食肆結業，同址很快會出現另一間食肆，但近期情況有變。「以前一百間執笠，隔一陣就開番一百一十間，𠵱家一百間執笠，隔幾個月先開番八、九十間。」     中式酒樓更是腹背受敵   他慨歎，市民消費意欲低迷，「慳得就慳」，他從事飲食業十多年，以今年的經營環境最差，尤其中式酒樓更是腹背受敵。「快餐店賣埋飯，茶餐廳又推出特價茶餐，再加上酒店搶晒酒樓嘅酒席，𠵱家飲食業已變成殺戮戰場，真係愈來愈難做。」他謂，現時全港約有一萬間持牌食肆，僱用二十萬僱員，估計下半年每個月平均會有一百間食肆遭淘汰，每月二千員工失業。
20020721-59,20020721,59,加強捉黑工　一周拘170人,加強捉黑工　一周拘170人 【本報訊】入境事務處處長黎棟國強調，在本港目前失業率高企下，當局會加強力度打擊各行業的非法勞工，過去一星期已拘捕一百七十名非法勞工及聘用他們的僱主。但他認為，被捕黑工人數上升，惟佔內地旅客的比例不變，因此放寬內地旅客來港不構成問題。     上半年共拘四千黑工   今年上半年入境處拘捕近四千名黑工，為去年全年總數的七成；黑工來自街市攤檔、中醫院和殯儀館各行各業。黎棟國昨日出席電台節目時指出，入境處在遣送非法勞工回內地時，會將資料通報內地部門；日後他們若再申請來港，內地部門會考慮他們以往的來港紀錄。  不過，有聽眾指現時有持雙程證人士以日薪一百元的工資，擔任家庭傭工；又有聽眾指元朗不少丁屋地盤僱用黑工。對於居港權案敗訴人遣返的進度，黎棟國指自今年三月底寬限期後，至今已有一千一百多人返回內地，目前仍有千多人在港，預計今年內可解決問題。
20020721-60,20020721,60,「我忍唔到佢嘅嗜好至離婚」反擊！章小蕙哭數阿B五宗罪,「我忍唔到佢嘅嗜好至離婚」 反擊！章小蕙哭數阿B五宗罪 鍾鎮濤（阿B）在昨日出版的周刊訪問中，大爆當年欠下裕泰興債務期間，前妻章小蕙曾找陳曜旻做擔保人，並要求阿B寫欠單給對方，阿B為此十分扯火，即時堅拒簽名。章小蕙昨日隨即召開記者會反擊阿B，力數阿B的五宗罪。 鍾鎮濤（阿B）在昨日出版的周刊訪問中，透露當年自己的理財觀念很「矇」，任何文件只要前妻章小蕙要他簽名，他便會照簽如儀，而他們在欠下裕泰興二億五千萬期間，有次因為借貸到期，章小蕙便拿着一張由她手寫的欠單，對他說由於陳曜旻（Edmund）是其中一份貸款的擔保人，故此阿B需要寫下欠單給陳曜旻，那時候已知道婚姻出現第三者的阿B十分氣憤，即時堅拒在欠單上簽名。     「成日要我食死貓」   對於以上指控，章小蕙昨午四時許在其時裝店門外舉行記者會，力數前夫五大罪行，包括要她執拾爛攤子、難以接受的嗜好、經常裝作可憐、買淺水灣豪宅是他的主意及與范姜先「另起爐灶」，其間章小蕙更當場灑淚。章小蕙說：「佢嘅爛攤子次次都要我執手尾，又要我食死貓，佢嘅嗜好同有啲習慣我忍受唔到，我受夠啦，所以至決定離婚。」其實章小蕙早於兩年前已在電台訪問中提過難忍阿B的嗜好，但至昨日她仍不願透露這些嗜好是甚麼。  而章小蕙亦大爆阿B在九六年時已跟范姜在一起，同時他們所購下的淺水灣三十七號豪宅，也是阿B的意見，章小蕙稱由始至終她也不贊成這宗交易，至於所欠下的二億五千萬債務，她自稱連一毫子亦未用過。     買豪宅非她主意   章小蕙說：「希望佢（阿B）記得自己做過乜，佢暴露咗自己嘅所作所為，話畫上句號同劃清界線嘅都係佢，佢踩完又揼，驚我唔死得，重插多我兩刀，好彩呢一刀揭露咗佢嘅狐狸尾巴，九七年有個經紀話淺水灣呢層樓好抵買，當時我唔喺香港，我喺電話度推咗佢，我重即刻打畀阿B同埋我媽咪，叫佢哋唔好買，之後阿B冇知會我，佢開咗張五十萬嘅支票做買樓首期，但十日後要再畀十個巴仙嘅大定，我哋冇能力咁做，阿B就叫我諗辦法，我硬住頭皮問Edmund借，我問過律師，佢話情理上我哋要寫欠單畀Edmund，筆錢分三份當做生意，阿B係知㗎，而我係有簽到，但阿B冇。」對於阿B在訪問中稱很信任家人，章小蕙即說：「唔使『隊』啦，我已經夠㷫啦。」 章小蕙續道：「九六年時，工人已經同我講，話鍾先生有個女朋友喺台灣，佢哋一齊開畫廊，我有佢哋嘅機票存根同護照，重親耳聽過佢哋講電話，時間上係佢先另起爐灶，佢成日畀個慘樣人哋睇，好似好偉大、聖人咁，佢係一個藝人，二十四小時都做緊戲㗎啦。」     阿B：真假天會知   對於所負的債務，章小蕙說：「嗰二億五千萬，借嘅係一千六百萬，之前喺嗰筆錢賺到嘅二百六十萬，鍾先生用嚟開咗錄音室，我一個仙都冇用過……以前我以為有少奶奶生活，點解做到隻狗咁……」這時她說到Edmund給她的愛，便忍不住當場落淚，要暫停訪問。章小蕙表示當初眼見Edmund對亡妻情深義重，令她非常欣賞。  對於前妻在記者會上的種種指控，阿Ｂ昨晚在電話中回應說：「過去咗嘅嘢，你哋返報館查重清楚過我啦，是非真假天會知嘅，我都係嗰句啦，金錢破產並非末路，人格破產至係絕境，無論有乜是非都唔好再問我，我唔識得編織故事，只想專心做嘢。」  此外，章小蕙前晚收工後，曾偕同兩名外籍女性朋友前往蘭桂坊的KeeClub開會，繼而三人同往位於灣仔的「橋底辣蟹」用膳，接着再轉去跑馬地的「滿屋甜品」歎西米芒果撈，有途人見到章小蕙更說：「掂埋去即刻破產呀！」事後記者問到章小蕙時，她即說：「我唔理啲途人嘅反應，alright？」三人其後步往隔籬的腳底按摩店做按摩，直至凌晨一時，章小蕙才自行乘搭的士返回寓所。  採訪、攝影：王連連、林德雄、蔡如玉、娛樂突發組
20020721-61,20020721,61,黃霑彈駕駛技術差霆鋒獲上海Fans贈符保平安,黃霑彈駕駛技術差 霆鋒獲上海Fans贈符保平安 謝霆鋒近日的負面新聞不絕，可是無損歌迷對他的擁戴。霆鋒前晚在上海出席一個晚會時，在台上被兩名男女歌迷攬住不放，歌迷更送平安符給霆鋒，希望他以後小心駕駛，不過黃霑前晚在飯局上，則批評霆鋒的駕駛技術差。 謝霆鋒前晚在上海出席「上海中路視藝術學校」的晚會，他似乎並未受近期的負面新聞影響，內地歌迷對他仍然愛護有加，並且十分接受他跟王菲的戀情。     支持跟王菲拍拖   霆鋒前晚的表演，現場氣氛熱鬧，吸引了約四百位歌迷往捧場。霆鋒見到歌迷的熱情支持，在台上以普通話說：「近日發生很多的事情，是我意料之外。我看到大家這樣的支持，為了你們（指歌迷），我會做好音樂，不會放棄。」  台下歌迷還不時高舉寫上「音樂與我同在，霆鋒無可取代」的標語。當霆鋒抽中一男一女歌迷上台時，二人都先後擁抱着霆鋒，霆鋒亦照單全收，並沒有抗拒。  問內地歌迷支持霆鋒跟王菲，抑或與張栢芝拍拖，有女歌迷以普通話說：「我只聽過霆鋒鍾意某某，沒有聽過他喜歡某某某。」歌迷口中的「某某」應是指王菲，而「某某某」應是指張栢芝。女歌迷又說：「他跟王菲姐姐本來是很幸福，是傳媒弄成現在這樣。」歌迷又表示已送了平安符給霆鋒，希望他可以小心駕駛。  霆鋒昨日從上海回港後便馬上回家休息，記者在赤鱲角機場問他會否因近日的負面新聞而改形象，他說：「我從來冇形象，形象去死啦。我喺上海冇搵栢芝，俾人專心做嘢啦。」     「撞完一架又一架」   此外，黃霑前晚在灣仔出席一個飯局，他批評霆鋒近日撞車和涉嫌在台灣打記者的新聞。黃霑說：「佢𡃁仔，有名，有利，有水，有女仔，重有壓力。佢靚車撞完一架又一架，佢唔好命，啲技術差少少，我技術好啲。」至於霆鋒涉嫌打記者，黃霑又說：「邊個郁手都係笨，人人都有難處，要搵食，大家只要為對方諗吓就冇事，佢（指霆鋒）唔係教師，佢都好大壓力。」  記者陳梅香、陳烱威上海直擊
20020721-62,20020721,62,Cookies歌迷為取簽名受傷,Cookies歌迷為取簽名受傷 女子組合Cookies及男子組合Shine昨日於港台出席「倫住嚟試SchoolTour」簽名會，有數百名歌迷到場。一名十五歲的Cookies女歌迷由於遲到未能索取簽名，故她一發現有保母車從港台駛出時，即跑上前而被車撞倒，後來由唱片公司的職員陪同下前往伊利沙伯醫院，幸好只是頭部輕傷。     籲歌迷小心   Cookies對於有歌迷被車撞倒，表現得十分擔心，她們說：「我哋見到有咁多人支持都覺得好開心，不過希望佢哋唔好罔顧安全，其實我哋盡可能都會停低畀佢哋影相。」  此外，Shine對於早前有報道指他們拍攝港姐外景時全程黑面，Shine表示：「我哋只不過係太攰，所以先冇乜笑容。」  採訪、攝影：胡比、李珮洳
20020721-63,20020721,63,梁詠琪玉手成目標,梁詠琪玉手成目標 梁詠琪（GiGi）、名模Rosemary和歐陽妙芝，昨日在馬鞍山新港城中心出席「舞動歐洲嘉年華」開幕典禮。活動上的外籍小丑跟GiGi同台演出時，他想輕吻伊人的玉手，令GiGi十分尷尬。     義賣音樂會門票   外籍男士扮的小丑昨日欲挽GiGi玉手及輕吻手背，GiGi都醒目地避開，她說：「個小丑幾熱情，外國人係咁啩，我都有少少驚。」GiGi表示昨日的活動是慈善性質，她都有送出替新城表演的音樂會門票作義賣籌款。  採訪：汪正文  攝影：馬啟然
20020721-64,20020721,64,瘦身全攻略：容祖兒時肥時瘦,瘦身全攻略：容祖兒時肥時瘦 由入行至今，我曾經試過好肥，亦試過好瘦似人乾，但對現在的身材我就最滿意。  初出道時，我不算太胖，但臉蛋沒有輪廓又A字膊，那時候我比較多運動，會去跑步及健身，早上我會做獨行俠，一個人走去吃白粥炒麵，待至晚上才吃飯。     女助手為食   自從我有個女性肥助手後，因為她很為食，常常要找好吃的東西，結果連我也開始變肥，但當時可能年紀尚小，我才十多歲，為食不致於對我有太大影響。不過當我過了二十歲後，一肥就較難收身，所以我便馬上跑步減肥，沒多久也就消瘦了。  拍電視劇《新鮮人》之前，我已經回復適當體重，豈料在拍攝期間，我又開始肥。拍劇的日子裏，許多時候都要捱通宵，而TVB的飯堂食物太好味，我最喜歡吃那兒的糭，但那時最肥的不是我，而是同劇演出的馮德倫。  《新鮮人》拍完之後，我又要減肥了。早上吃一點兒東西如生果，下午戒吃，晚上再吃少許食物，基本上我已全日戒飯。其實我一向對白飯都沒有興趣，正好趁着減肥把飯戒掉。  （五之一）  口述：容祖兒  筆錄：朱芷瑩
20020721-65,20020721,65,星級教室：西位種花今年嫁得出蘇民峰教你擺桃花陣催姻緣,星級教室：西位種花今年嫁得出 蘇民峰教你擺桃花陣催姻緣 識得我蘇民峰嘅朋友，都知我出去蒲嘅時候，唔鍾意俾人哋叫我贈兩句，但唔代表我孤寒，只係唔想將工作同娛樂撈埋一齊啫！我會一連五日講吓點樣喺屋企擺比較簡單嘅風水陣，而黃卓玲就借咗佢間屋出嚟作示範。第一日要講嘅梗係男女都好有興趣嘅桃花陣啦！ 今年嘅桃花位喺東北，最簡單嘅就係喺屋企嘅東北位擺音樂盒同一杯水，咁就可以催桃花，桃花亦代表人緣，除咗可以識到異性密友之外，亦可以識到多啲朋友。但記住，音樂盒一定要係上鏈嗰隻，時不時等佢唱吓歌仔。     佩戴合適飾物   想快啲結婚嘅朋友，今年嘅姻緣位喺正西，喺正西放四棵綠色嘅植物，另加九朵紅色嘅花，咁就好快可以心想事成，但只想拍拖唔想結婚住嘅，就淨係擺四棵綠色植物就得。  風水當然唔係咁簡單嘅事，每一年嘅流年桃花位都唔同，但每間屋其實都有一個永久桃花位、財位同埋凶位(亦即係病位)，今次就同大家一次過講晒（見附圖），記得keep住個表，嚟緊幾日都會有用。用屋企嘅大門位嚟作指標，好似黃卓玲間屋咁，大門口向東北，桃花位就喺正南，喺桃花位擺四棵綠色嘅植物就得。  想催旺桃花，除咗風水之外，佩戴飾物都有幫助，知道自己嘅生肖，就知戴乜嘢同生肖相配嘅飾物旺自己（見備註）。記住我蘇民峰講「桃花多多都唔怕，最怕個人心多多！」  備註：鼠配兔、豬配龍、蛇配狗、馬配雞、羊配猴、虎配牛	  (五之一)  口述：蘇民峰　筆錄：張止寒  攝影：馬啟然　住宅提供：黃卓玲
