key,date,article_daily_id,title,text
20020317-149,20020317,149,滌濤山　紅樹林為伴,滌濤山　紅樹林為伴 滌濤山是大埔滘一帶罕有的大規模住宅發展，物業毗鄰大埔滘自然護理區，及濕地紅樹林，自然環境優勝。 滌濤山佔地80萬方呎，規劃設計完全融入大自然環境中，單位動輒逾1000方呎，樓價最平要400萬元。發展商嘉里建設（683）有意保留部分優質單位收租，目前只推出分層單位，及28間複式洋房（議價洽售）。不過，由於該盤內購銷情不俗，發展商近日已開始「吹風」，可能推售更多洋房。     最平單位要400萬   分層大廈位於整個物業的西面，圍繞會所呈半圓形而建，由於前方是低矮的洋房，皆可享海景，不過，部分座數只可側望海景，買家宜實地觀察。  由於分層大廈最近大埔公路，在設計上已作出遷就，廚房設於後方向馬路，令廳房不受車聲影響。此外，分層大廈後方山坡散布着已荒廢的村落，個別低層單位望山，景觀欠佳。     主題會所設計獨特   該盤的住客會所亦值得一提，各項設施如健身室、宴會廳及桌球室等，採用7間獨立小屋式設計，予人度假村的感覺，比較罕見。如此「浪費」空間的設計，只能在低密度豪宅出現。  記者：何應龍  攝影：梁袓彝
20020317-150,20020317,150,自然景色不易改變,自然景色不易改變 大埔與沙田之間的一段大埔公路，是政府着力保護的地段，一切物業發展均受限制，致力維持低密度的居住環境。  滌濤山位處在康樂優先區內，當年發展商承諾會負責為公眾提供一處可進行康樂旅遊等活動的地方，才獲政府批准在此作有限度發展。現時康樂優先區的外圍規劃為綠化地帶的叢林、樹林及山坡等，而綠化地內有零星的住宅用地。  滌濤山背靠大埔滘自然護理區，前望東鐵、吐露港公路及吐露港，目前吐露港公路正進行道路擴闊工程，涉及小面積填海，故對滌濤山景觀影響不大。  記者：林志光
20020317-151,20020317,151,樓盤之星：港島區屋苑成交價,樓盤之星：港島區屋苑成交價
20020317-152,20020317,152,港基：息口見底佳績難再現,港基：息口見底佳績難再現 擁有27年財資市場經驗、剛從大新金融（440）轉到港基國際銀行（636）擔任財資部主管的范上欽認為，去年本地銀行在減息期間透過出售債券在財資市場賺大錢，但由於息口已見底，今年肯定不會有去年的佳績。不過，中小型銀行加強財資部的發展卻是大勢所趨，相信本地銀行的財資市場部仍有很大發展空間。  去年中范上欽決定退休，離開工作了27年的大新銀行，轉到大新金融旗下的豐明銀行作過渡工作，但港基力邀他接掌港基財資部。  范上欽說：「最初希望可以退休，不過朋友認為唔使咁早，所以決定加盟港基。」范上欽直言：「希望能夠在退休前，為港基build-up好財資部。」  「以前普通銀行業務競爭不算激烈，按揭貸款可以做到最優惠利率加1厘，客戶都肯借錢。不過現在按揭要做到最優惠利率減2.5厘，息率得番2.625厘，1宗20年的貨款，假設同業拆息的資金成本係2厘，銀行的息差得番0.625厘。銀行息差大幅收窄，重要可能做撥備。」他續說：「本港銀行普遍很cashrich（資金充裕），銀行應該怎樣處置資金呢？好似以前咁放在同業拆息市場根本無錢賺，因此要想辦法怎樣將資金為銀行帶來利潤。」他相信，本地銀行的財資市場部仍有很大發展空間，但要成功發展財資部，便要靠整體銀行配合，有完善的風險管理及穩健的管理層。
20020317-153,20020317,153,公司專訪：福茂覬覦澳門30億生意,公司專訪：福茂覬覦澳門30億生意 由IFPI台灣分會首任董事長張人鳳創辦的福茂工程，經過半個世紀的發展，從普通的音響貿易商，發展為音響、燈光設備設計及安裝的專業公司，客戶包括中正紀念堂及台北國際會議中心，本地新城及商業電台亦使用其發射器。踏入2000年，福茂更參與台灣設計主題公園，未來更會為澳門開放賭權衍生出來、投資額達30億元的主題公園生意作好競投準備。據悉，該公司還希望上半年在本港上市。　撰文：高淑嫻 福茂工程財務董事周堅銘接受訪問時表示，在1958年成立的福茂由經營音響貿易、安裝，到主題公園設計，都是希望做到專業化，因為只經營消費品，最終惟有在價錢上競爭，因此福茂決定向要求「靚」音響的劇院、展覽館等客戶埋手，走專業化路線。現時該公司在台灣音響安裝市場佔有率高達80%，成為行內「一哥」。     請數百學生測音響效果   他指出，安裝音響設備「唔簡單」，福茂曾經為台灣一個可容納1000人的劇院安裝設備，而請來數百名小學生，製造座無虛席和「小貓三四」的環境，又要他們穿上厚身衣服，來測試音響效果。  建成多年的台北國際會議中心是福茂「最值得自豪」的重要工程之一，當年為讓1200人可以同時開會及發言，福茂便替該會場安裝了1200個咪，並設有六種語言即時傳譯。他相信現時中港兩地的展覽中心，還沒有這種規模的音響設備。 投澳門主題公園具勝算   台灣的成功經驗促使張人鳳長子張翼宇接手福茂後，於92年開始參與其他種類的工程及拓展海外市場。2000年初便接下首個主題公園設計工程──台中探索樂園。整個項目總值3300萬美元。福茂主要為該樂園設計6個主題表演項目，由設計、內容、場館設備安裝一手包辦，當中包括近年流行的花車巡遊表演。  今年適逢澳門賭權三分天下，3個經營者都矢言會落重本發展賭場及相關的娛樂設施，福茂正好「食住條水」，競投有關項目。周堅銘保守估計，假設3個經營者共投資300億元，其中10%撥作興建主題公園，這個「餅」也有30億元，福茂當然希望能夠分享。  福茂在競投澳門主題公園工程亦有王牌在手。周堅銘透露，福茂副總裁馬天宗當年曾替獲得其中一個澳門賭牌的美國賭王StephenWynn，在拉斯維加斯製作著名的金銀島及相關表演。雙方既然早有聯繫，福茂自然平添勝算，至於另外兩個經營者，周堅銘直言「要努力啲sell吓」，他都希望今年內有「眉目」。
20020317-154,20020317,154,張人鳳：退而不休再闖礦業,張人鳳：退而不休再闖礦業 現年80歲的福茂工程創辦人張人鳳，在五十年代從香港轉到台灣發展。據悉，由於他對音樂有濃厚興趣，所以開展音響貿易及安裝生意，他家族亦擁有台灣福茂唱片40%股權，香港歌手有蘇永康及陳慧琳；台灣歌手范曉萱均曾經效力福茂。     推動台灣音樂   隨着影音工程及唱片業務漸上軌道，張人鳳在78年將福茂工程交予長子張翼宇打理，再在84年由次子張耕宇接手福茂唱片。  但熱衷音樂的他，並沒有真正退下來，在86年積極參與籌組IFPI台灣分會。當年，福茂、寶麗金、滾石等11家已加入國際IFPI的台灣唱片公司，成功組織IFPI台灣分會，張人鳳獲推舉為首任董事長，推動台灣的音樂事業。  另外，在87至88年他更轉而發展大理石開採生意，至今業務遍及菲律賓、馬來西亞和中國，果然魄力十足。
20020317-155,20020317,155,新盤將推　貨尾受壓,新盤將推　貨尾受壓 【本報訊】各區新盤部署開售，貨尾盤割價傾銷提升競爭力，但反應一般。3個減價貨尾盤包括小欖漣山、馬鞍山迎濤灣及紅磡半島豪庭，昨日共售出20伙，較前日僅得5宗理想，但仍未見踴躍。當中以劈價平均一成半的漣山銷情較佳。業內人士指出，復活節假期在即，發展商均部署推售新盤攻勢，預料貨尾盤減價潮持續。 永泰亞洲減價發售的中價盤漣山，繼日前錄得4宗成交後，昨日銷情躍進。中原地產副營業董事黃澤文表示，該盤昨單日錄得逾10宗成交，平均呎價介乎2500至3000元。其中，Cedar1座2樓F室，面積1088方呎，以288萬元售出，平均呎價2647元，較前平10%。  其他減價盤銷情則一般，華懋集團擴大優惠幅度，變相減價8%促銷的迎濤灣終於開齋，發展商昨日推出16伙，減價後平均呎價3625元，市場僅錄得8宗成交。採取個別單位減價策略的半島豪庭，昨錄得2宗成交，反應未算突出。  業內人士表示，是次減價發售貨尾盤，主要位於將有新盤供應的地區，如馬鞍山及青山公路一帶，為加強競爭力，遂要割價出貨。美聯物業執行董事張錦成指出，第二季將有數個新盤排隊推售，預料貨尾盤之間，鬥優惠或減價情況更激烈。  至於未有劈價的市區盤銷情反而較佳。長江實業（001）旗下尖沙嘴港景峯昨日以平均呎價4282元推出第2座10個單位。發言人表示，該批單位昨午2時售罄，即場原價加推，整日累售23伙，套現1.3億元。今日增加10個名額，繼續獲半價購家具連裝修優惠。     長實兩盤昨售56伙   至於同系的長沙灣泓景臺，長實營業經理黃思聰表示，該盤截至下午5時，售出33伙，套現逾7億元。2房單位造價170至210萬元，3房單位造價280至310萬元。今日首度推出3座18樓及58樓16伙。  九龍倉（004）九龍站擎天半島，昨日則售出9伙，今日按原價平均呎價4100元加推6伙。系內的鑽石山星河明居，昨售出A座頂層2號室複式，面積1600方呎，成交價750萬元，平均呎價4688元。
20020317-156,20020317,156,海典灣傳本周開放,海典灣傳本周開放 【本報訊】信和置業（083）執行董事李智康昨日表示，馬鞍山海典灣將於一個月內推出，定價會參考同區海典居及其他屋苑，每平方呎3100至3400元。不過，市傳本周開放示範單位。  對於房協馬鞍山77區夾屋轉私樓項目，亦有計劃第2季推出。李智康稱不擔心構成競爭，因為各有市場。倘房協此項目以低價開售，亦只是新盤慣用的銷售策略，藉優惠價推廣，吸引買家。若推出單位數量以少量單位作宣傳，尚未反映整體定價。  近期多個貨尾盤掀起割價潮，而信和位於大角嘴的帝柏海灣及柏景灣尚餘貨尾單位，但李智康揚言，由於所餘單位數量不多，加上屬優質單位，故沒有減價促銷的壓力。另外，京士柏前陸軍醫院重建項目，計劃在下半年推出。
20020317-157,20020317,157,挪用寶盈公款2.74億元羅慧端告分居丈夫,挪用寶盈公款2.74億元 羅慧端告分居丈夫 【本報訊】鷹君集團（041）創辦人兼主席羅鷹石的女兒羅慧端，前日以JunestarInvestmentCorporation名義入稟，控告分居丈夫陳紹勣，多次在未經董事會授權的情況下，挪用Junestar持有的寶盈建築的公司資金，要求法庭頒令多宗由陳氏主理的交易為非法及無效，又要求陳氏向寶盈償還合共2.74億元。  入稟狀指出，Junestar由羅慧端擁有，陳紹勣在99年8月9日以後不再是Junestar的受託代表人。而Junestar持有寶盈建築的六成股權。     要求法院頒令交易無效   Junestar稱，陳紹勣在未經董事會授權下，給予自己約2350萬元花紅。又指陳紹勣未有寶盈及董事會授權，將兩筆合共4009萬元的定期存款，挪用至私人公司，用來還款予證券公司等，合共挪用了寶盈2.74億元，故入稟要求法院頒令該等交易無效及要求陳氏償還寶盈巨款。  其實，羅慧端與前夫的恩怨並非始自今朝。羅氏99年因懷疑陳紹勣不忠而決定分居。去年2月，羅氏指陳氏涉嫌挪用寶盈款項，於是興訟以公司董事身分要求查帳。去年9月，羅氏成功獲法院批准查帳。陳紹勣不服，在去年12月上訴，但今年2月初，法院判其敗訴。
20020317-158,20020317,158,兒童天地：春夏童裝　喱士花邊大熱,兒童天地：春夏童裝　喱士花邊大熱 濕𣲷𣲷的天氣迎接着春日的來臨，春夏裝已紛紛出籠，大人忙着換新裝之際，勿忘記也須為你的小寶寶添置春夏新衣。今季的童裝潮流與大人的不遑多讓，特別是女童服裝，同樣走喱士、荷葉邊的花巧路線，迎合春日百花盛放的暖暖季節。   記者：區佩嫦　攝影：林栢鈞　ImageGirl：廖睿哲 夏威夷裙褲    棉質的上身衫，領口位以闊身的布喱士點綴，加上袖口位的荷葉花邊，充滿優雅的女性味道。下身不妨配襯一條綑上花邊的裙褲仔，質料選用棉及麻，其前幅有極富夏威夷色彩的印花，裙邊綑上蝴蝶形的布喱士，夠晒特別。    衫尺碼：適合4至12歲  售價：$219  褲尺碼：適合4至12歲  售價：$239  （CHICKEEDUCK） 層層叠傘裙    衫裙用上Polyester及Rayon製成，上身的設計較簡潔，襟前更有由閃珠片鑲成的花花圖案，夠晒可愛。不過全套衫的重點當然落在極富層次感的半截裙身上，層層叠叠的蓬鬆感，更顯隆重感覺，這套衫裙更有粉黃色及白色以供選擇。    衫尺碼：適合4至12歲  售價：$179  裙尺碼：適合4至10歲  售價：$239  （CHICKEEDUCK） 薄針織背心紗裙    這套粉綠色的連身裙，裙的上身為薄針織，前襟有大大小小的布花點綴，領口及手袖有波浪形花邊，設計夠精細，另外，下半身則以棉及Polyester製成，外層再配上薄薄的同色紗，令裙身更顯華麗。另備有白色及粉紅色，極具春日氣氛。    尺碼：適合4至14歲  售價：$369  （Kingkow） 紅玫瑰Tee    這件Parrot的棉質Tee，衫身印上紅玫瑰圖案，玫瑰的形態活靈活現，而袖口縫上同色的喱士，配襯着火紅的玫瑰，極為鮮豔奪目。    尺碼：適合6至16歲  售價：$420  （COZCOZ） 綁帶小背心    小小吊帶背心感覺特別活潑，這件棉質的綁帶背心，領口及衫腳均布滿荷葉邊，配襯着大花的圖案，春日味極濃。配襯埋同以荷葉邊作賣點的四個骨褲，予人活潑開朗的感覺。    衫尺碼：適合4至14歲  售價：$159  褲尺碼：適合4至14歲  售價：$179  （Kingkow） 常青牛仔套裝    小記最鍾意這套牛仔裝束，襯得小妹妹甚有形格。牛仔褸與褲以兩層的荷葉花作賣點，牛仔布給人的感覺較硬，配上軟軟的荷葉邊，兩者發揮了極佳的化學效果。    衫尺碼：適合2至12歲  售價：$209  褲尺碼：適合2至12歲  售價：$169  （AlexandraZ） 純白繡花喱士背心裙    今年特別流行白色的打扮，小女孩不妨從「白」入手。這條背心短裙仔，設計簡單，衫身上只有簡單的藍色及綠色繡花點綴，裙邊的喱士，可以增加整條裙的飄逸感覺，更顯得活潑嬌俏。此外，裙身用了麻及棉製成，質地舒服又夠柔軟。    尺碼：適合6個月至6歲  售價：$229  （Kingkow） 雙色棉外套    春天天氣還是乍暖還寒，相信很多父母都會為子女帶件外套出街以備不時之需，小女孩永遠都貪靚，不妨選擇這件藍色襯綠色的棉質雙色外套。外套同樣用了今年極流行的荷葉邊作點綴，加上胸前的小花，試問小女孩見到怎會捨得放手呢？另有粉紅色、橙色和綠色選擇。    尺碼：適合3個月至6歲  售價：$169  （Kingkow） 店舖資料      CHICKEEDUCK（26283469）  旺角新世紀廣場5樓506號舖    Kingkow（29157988）  銅鑼灣恩平道2-38號嘉蘭中心102-103號舖    COZCOZ（28823570）  銅鑼灣恩平道2-38號嘉蘭中心128號舖    AlexandraZ（25063919）  銅鑼灣時代廣場903A號舖
20020317-159,20020317,159,34萬買二手法拉利Mondialt,"34萬買二手法拉利Mondialt 九十年代初已有半自動波配搭嘅法拉利Mondialt開篷跑車，毋須踏離合器轉波，省卻咗上兩代法拉利跑車操作沉重嘅麻煩，𠵱家呢部1993年落地嘅一手車，二手叫價只係33萬8千元，吸引力甚強；另一部實用非常嘅歐寶Vectra，二手叫價亦只係3萬9千元，實在超值。   資料提供：Auto22.com 法拉利Mondialt    推介指數：★★★★　二手叫價：$338,000  車款：開篷車	  製造年份：1992年  首次登記年份：1993年	  傳動：半自動波  引擎容積：3405cc	  顏色：紅  行車里數：13,543km	  牌費：2002年10月  手數：1  配備：備有車門電窗、真皮座位、音響、門邊電鏡及半自動波箱。  備註：超級跑車，貴氣十足。     有何賣點：  90年代初經典法拉利開篷跑車，罕有二手市場放盤。   有何優點：  已配備有半自動波箱，容易操作，二手叫價亦見合理。   有何缺點：  名字不及同廠348及355等車系顯赫。   推介原因：  呢個價錢已可坐擁法拉利跑車，可謂機會難逢。 歐寶Vectra    推介指數：★★★　二手叫價：$39,000  車款：四門房車	  製造年份：1996年  首次登記年份：1996年	  傳動：自動波  引擎容積：1998cc	  顏色：黑  行車里數：45,274km	  牌費：2002年10月  手數：1  配備：有天窗、雙安全氣袋、車門電窗、真皮座位、ABS、防盜系統、合金胎軨、CD音響、門邊電鏡及霧燈。  備註：超值歐洲小房車，更備有環保引擎，既經濟又慳油。     有何賣點：  操控靈活紮實嘅歐洲中型房車。   有何優點：  車齡尚新兼且設備豐富，價錢平過日本車。   有何缺點：  屬冷門車款，零件供應及維修保養問題不及日本車方便。   推介原因：  牌費特長，如想用經濟價錢一試擁有歐洲車的話，值得考慮。 越野路華DiscoveryXS    推介指數：★★★　二手叫價：$145,000  車款：四驅越野車	  製造年份：1997年  首次登記年份：1997年  傳動：自動波  引擎容積：3950cc	  顏色：紅  行車里數：37,000km  牌費：2002年6月  手數：1  配備：備有雙天窗、雙安全氣袋、ABS、防盜系統、合金胎軨、VCD/CD音響、門邊電鏡及門邊腳踏。  備註：四驅之王，越野車首選。 豐田CamryGracia（水貨）    推介指數：★★★　二手叫價：$148,000  車款：旅行車	  製造年份：2000年  首次登記年份：2001年  傳動：自動波  引擎容積：2500cc	  顏色：白  行車里數：19,926km  牌費：2002年3月  手數：0  配備：有齊天窗、雙安全氣袋、車門電窗、真皮座位、ABS、防盜系統及門邊雨擋。  備註：除為日本進口車外，兼屬罕有旅行車版。 日產200SX    推介指數：★★★　二手叫價：$50,000  車款：雙門房跑車	  製造年份：1995年  首次登記年份：1996年	  傳動：自動波  引擎容積：1998cc	  顏色：綠  行車里數：53,077km	  牌費：2002年12月  手數：2  配備：有齊天窗、雙安全氣袋、車門電窗、ABS、合金胎軨、CD音響、尾翼、門邊電鏡、恒溫冷氣及霧燈。  備註：除屬行貨之餘，性能表現亦見強勁。 最近成交紀錄（成交日期：2002年2月27日至3月12日）    雖然最近只有一部1997年嘅2手福特Ka，以$19,000成交；但相比起當年$119,800嘅新車價，已有84%嘅折舊率，可謂十分超值。  年份：1997	  型號：福特Ka  手數：2  當年新車價：$119,800  成交價：$19,000  折舊率：84%        Auto22.com查詢    電話：60202022  電郵： service@auto22.com   網址： www.auto22.com "
