key,date,article_daily_id,title,text
20020721-0,20020721,0,黃蓉桃花島新經歷　小龍女墮崖補情節金庸重寫經典武俠小說,黃蓉桃花島新經歷　小龍女墮崖補情節 金庸重寫經典武俠小說 【本報訊】在全世界擁有最多華人讀者的作家金庸（查良鏞），正大規模全面修訂他十四部武俠小說作品的文字及內容，陪伴了三代中國人讀者的小說主角部份遭遇將會改寫，例如《射鵰英雄傳》女主角黃蓉在桃花島的經歷會稍有不同，而《神鵰俠侶》的小龍女如何在絕情谷底生活十六年亦會補加幾筆，添上新情節。　記者：李慧玲、冼麗婷 文化界認為，金庸小說陪伴了老、中、青三代香港人甚至中國人成長，加上電視和電影多次改編，其作品情節和主角已成家喻戶曉人物，任何修訂預料在文化界及社會上都會掀起一番討論。而一部小說有三個不同內容版本，亦屬罕有。     《書劍恩仇錄》已推出   金庸對本報記者表示，他去年開始動筆「逐字逐句」重新修訂自己的武俠小說，經過約半年時間首先完成了《書劍恩仇錄》的修訂版本，並在本月正式推出市場。他現時每日在家工作五、六個小時，按出版先後次序逐一修訂其他小說。由於每部小說修改幅度不同，而他本人有時會外遊、有時要處理其他事情，所以難以預料全部小說完成修訂的時間。但新版本面世後，舊版本即不再出。  以《書劍恩仇錄》為例，金庸說修訂不算多，主要改動是主角陳家洛對伊斯蘭教《可蘭經》的理解。他表示自己近年才全文看過《可蘭經》，對此增加了認識和體會。  但他透露第二本修訂的小說《碧血劍》則有大幅改動。他說，他在《神鵰俠侶》以楊過對小龍女的一段情，表達一個男人一條心的愛情，所以他準備在《碧血劍》，用男主角袁承志徘徊在兩位女主角阿九（長平公主）和溫青青的三角關係，寫一個三心兩意的男人的矛盾。在《碧血劍》現有版本，袁承志對溫青青並無二心。 不會改變小說結局   金庸解釋，他今次重新修訂作品是希望文字和內容「更加好」。他說，過去數十年，他經常收到外界對小說文字、內容的意見，而他個人隨着年月過去，看事物亦有不同，所以把握現階段較清閒，便着手進行修訂。  他說：「我翻看自己的小說，好多地方都見到無巧不成書。有時情節上太多巧合了，人生不會有這樣多的巧合，我希望改得自然一些。」  在《天龍八部》中，女主角阿朱易容後被男主角喬峰錯手殺死，是金庸小說讀者最傷心的情節之一。記者問他修訂時會否令阿朱復生，逗讀者開心？金庸斬釘截鐵說不會。他強調，他不會改動小說的結局，但會令過程中某些情節「更加合理」、「更加完整」。  他舉例，在《射鵰英雄傳》中，女主角黃蓉在桃花島發現被他父親黃藥師殺死的人的屍體，但以此推算時間，會發現黃蓉年紀比男主角郭靖大得多，所以這段原本對其後故事有大影響的黃蓉發現屍體情節，便要改動。  他笑說：「有人亦曾經反映意見，小龍女為甚麼掉在冰潭十六年，不用換衣服，身上穿的衣服又沒有爛？」他表示今次修訂時會加入一些情節，「處理掉」這些事情。 正開筆撰寫中國歷史   今次是金庸在二十年前完成修訂他十四部武俠小說後，首次動筆再次大規模修訂自己的作品。  金庸在五五年開始寫武俠小說，第一部武俠小說《書劍恩仇錄》在《新晚報》連載，最後一部《鹿鼎記》則於七二年於《明報》連載完畢。他同年開始修訂全部武俠小說作品，至一九八二年完成。  七十八歲的金庸說，他現階段並沒有計劃要寫新的小說，但以後的事「現在說不準」。不過，他透露，現時除了修訂武俠小說外，亦開筆撰寫中國歷史，結合文學把三千年歷史細說重頭，紀錄事實。     歡迎讀者提意見   金庸說，歡迎讀者向他提出意見，他在修訂作品過程中會處理。不過，他補充：「如果只是想誰與誰好、誰與誰一對，就不必了！我並非想大改情節。但如果覺得有錯誤、情節有犯駁，我一定會研究修正。」  （讀者有意見可電郵或寫信給本報，轉交金庸。）  電郵： siringli@appledaily.com 
20020721-1,20020721,1,昨入稟高院　控告何鴻燊十姑娘由律師代表報警,昨入稟高院　控告何鴻燊 十姑娘由律師代表報警 【本報訊】澳門旅遊娛樂有限公司前董事「十姑娘」何婉琪與胞兄「賭王」何鴻燊決裂，在澳門連番興訟後，戰線伸延至本港，「十姑娘」昨日入稟高等法院，指控何鴻燊違反誠信責任，擅自結束由「十姑娘」佔百分之五股份的雅景地產投資有限公司，又拒絕向她交出公司文件。另外，「十姑娘」較早前亦向海傍警署報案，懷疑有人違反公司正常程序將雅景地產投資公司結束，要求警方調查，警方已將案列作求警調查案處理。 昨日的入稟狀由莫超權律師行代表，這份「十姑娘」在香港向何鴻燊興訟的首張入稟狀指出，「十姑娘」與何鴻燊均為雅景地產投資有限公司的董事及股東，公司實際由何鴻燊管理，「十姑娘」指胞兄因此有責任保障她的權益。根據公司註冊資料，「十姑娘」擁有雅景百分之五股份，何鴻燊佔一成七股份，大股東為信德船務有限公司。     帳目存信德船務   「十姑娘」指何鴻燊未事先知會便申請撤銷「雅景」的公司註冊，公司於今年三月結束，何鴻燊並發出函件表示全體股東同意此舉，「十姑娘」稱她完全沒有同意，亦未出席過有關股東會，她只獲告知公司仍有五十多萬元款項，並收到一張二萬五千多元的支票。  「十姑娘」何婉琪強調，公司突然結束令她蒙受損失，因此要求何鴻燊提交公司帳目等文件，但對方卻指文件存於信德船務有限公司，沒有作出交代。     要胞兄賠償損失   「十姑娘」強調有關文件對她衡量公司應否撤銷註冊結束十分重要，指何鴻燊有責任從信德船務取回文件供她查閱，但對方沒有辦到，因此要求法庭頒令何鴻燊交代文件，並索償損失。  另外，警方證實今年五月三十日，「十姑娘」何婉琪由律師代表，帶同她一份聲明到港島海傍警署報案，指她作為股東的雅景地產投資有限公司被結束的事件中，疑有人違反公司正常程序，要求警方展開調查。案件現正由海傍警署刑事偵緝隊調查。  案件編號：HCA2798/2002
20020721-2,20020721,2,楊永強巡街市　被讚態度友善李國章聞歌淌下男兒淚,楊永強巡街市　被讚態度友善 李國章聞歌淌下男兒淚 【本報訊】尚有十日便正式上任教育統籌局局長的李國章，昨日大打溫情牌，他上港台節目《清談一點鐘》時，在中大學生會會歌伴隨下，「開了山，闢了地，我們的神聖工作是拓荒……」，想起當年中文大學醫學院的艱苦日子，又捨不得一班同事及學生，黯然流下男兒淚，下月一日上任後，標誌着他正式結束在中大二十年的歲月。  不過，中大學生會副會長周峻任在預先錄音的給校長的信中，不滿他未能履行承諾，在五年校長任期屆滿前中途離任。     回憶醫學院日子   李國章在節目中，回憶起八二年回港到中大醫學院任職時，感觸良多，「嗰時返嚟係一片雄心，但睇到喺中大工作實在好辛苦、好艱難，當時冇人支持，政府又冇幫助，又冇教學醫院，學生要走去聯合醫院上課，教師要喺聯合醫院草地開個貨櫃教書」；然而他感到欣慰是，中大醫學院沒有出失德醫生。  他又再次提起，早於九六年他上任中大校長不久，曾與科技大學前任校長吳家瑋商議合併，當時更向他建議，由吳校長任合併後的新校長，自己則回醫學院任教授，「佢聽到後反應好開心！」  李國章坦言，他是向特首董建華負責，「如果董生叫我走就會走」；但被主持人問及若是立法會罷免他時，他則回應說：「我會憑自己良心做事！」  另邊廂，衞生福利及食物局局長楊永強昨日早上微服巡視深水埗一帶街市，了解衞生情況，此次是楊永強上任後第二度出巡，但比上次低調得多，沒有通知新聞界採訪。     舊式街市應存在   楊永強參觀後表示，舊式街市有衞生不足問題，包括空氣不流通，人多擠迫等需要改善，他會多聽取意見，但他認為舊式街市仍然有存在價值。一些商戶向他訴說經濟不好，生意難做，而他用了七十多元買生果，檔主稱讚楊永強態度友善。  另外，楊永強承認，現時失業率高企，很多失業人士需要援助，但現行綜援制度不夠彈性，未能夠切合需要，政府已初步構思透過資源調配設立救濟金，但他強調政府無意削減綜援開支。  他又透露，今個財政年度內會完成綜援制度的檢討，訂出未來路向，稍後會諮詢公眾。
20020721-3,20020721,3,美回收1900萬磅污染牛肉,美回收1900萬磅污染牛肉 【本報訊】美國農業部下令回收一千九百萬磅受O157:H7大腸桿菌污染的免治牛肉，美國有十九人進食受污染的牛肉而染病，本港食物環境衞生署則表示，須回收的美國牛肉並無進口香港；但本港有食品公司入口生產有問題牛肉公司的其他牛肉產品，暫未知有否受影響。  據《華盛頓郵報》及英國廣播公司報道，懷疑受O157:H7大腸桿菌污染的免治牛肉由ConAgra食品公司生產，該公司是美國三大食品生產商之一，今次回收亦是美國有史以來第二大規模的牛肉回收行動。  事件始於本月初，美國科羅拉多州多人染上O157:H7大腸桿菌，美國農業部追查源頭，發現四月十二日至本月十一日期間生產的ConAgra免治牛肉，其中有部份對O157:H7大腸桿菌的測試呈陽性反應，於是當局決定回收所有該公司在上述期間生產的牛肉。     大昌代理同廠凍肉   O157:H7大腸桿菌可引致病者腹瀉、嘔吐及肝臟受損，抵抗力較弱的兒童及老人更可以致命。  本港食物環境衞生署發言人接受查詢時表示，經初步了解，須回收的美國牛肉並無進口本港。  有經營食品業務的本港大昌貿易行有限公司的網頁資料則顯示，大昌行有代理ConAgra的牛肉產品，其中一種是ConAgra急凍極品肥牛，本報昨日未能聯絡上大昌行，暫未知該款牛肉是否受回收影響。
20020721-4,20020721,4,保時捷與三菱相撞毀車頭,保時捷與三菱相撞毀車頭 【本報訊】一名與香港首席女網球手湯嘉寶同名同姓的女子，昨凌晨隨友人乘坐保時捷跑車在港島大潭道失事，與一輛三菱EvolutionVII迎面猛撼，兩車均告損毀，對方私家車右前胎更飛脫，湯嘉寶腳部輕傷送院治理。在醫院時有人說她酷似網球手湯嘉寶。意外後，記者致電湯嘉寶查詢，她只謂「呢件事我冇嘢好回應」，便立即掛線。     兩司機無飲酒   事發於昨日凌晨零時，二十一歲湯嘉寶乘坐由黃姓男子駕駛的保時捷911Carrera跑車沿大潭道往赤柱，駛至水壩一個左彎，多輛私家車在逆線高速飛馳，保時捷與最尾的一輛三菱EvolutionVII迎頭猛撼，兩車右邊車頭均告損毀，三菱私家車的右前胎飛脫彈開數米，湯嘉寶腳部受傷送院檢驗，兩車司機無恙，經測試證實均無飲酒。  現場消息稱，出事路段十分狹窄僅容兩車經過，懷疑其中一方高速行駛時越過「火位」導致相撞，警方現正展開調查。  肇事保時捷911Carrera開篷跑車，九五年出廠，五前速自動波，三百二十匹，引擎排量三六○○c.c.，極速達二百八十公里，由零至一百公里，每小時只需五點七秒，當年新車車價一百三十七萬元。至於相撞的三菱EvolutionVII亦屬辣車一族，一九九七c.c.，二百八十匹。
20020721-5,20020721,5,團體投訴警方濫權,團體投訴警方濫權 【本報訊】於上月三十日向出席回歸晚宴的國家主席江澤民請願、並遭警方沒收揚聲器的四個民間團體，其十多名代表昨早到中區警署抗議，要求警方發還被沒收的揚聲器，但警方以案件仍在調查為理由，拒絕發還揚聲器，有關代表聲言將於本周向投訴警察課投訴警方濫權。  該四個民間團體包括四五行動、基層發展中心、香港職工會聯盟及香港市民支援愛國民主運動聯合會等十多名代表，在昨日早上十一時到中區警署請願。  四五行動發言人梁國雄指出，上月三十日警方制止擬向江澤民請願的團體示威，並以接獲投訴為理由，禁止示威者使用揚聲器，最後更沒收四個揚聲器，但至今警方以「保存證物」為理由，拒絕歸還揚聲器。
20020721-6,20020721,6,燒屍疑兇夫婦提堂,燒屍疑兇夫婦提堂 【本報訊】警方日前偵破土瓜灣福星大廈女時裝設計師被燒屍兇殺案，涉嫌被捕的年輕夫婦昨日被解往九龍城裁判法院提堂，兩名被告同被控一項謀殺罪，暫毋須答辯，控方申請將案押後，待警方進一步調查及進行認人手續，裁判官將案押後至八月二日再提訊，兩名被告還押懲教署監管。  首被告容家倫，二十五歲；懷有身孕的次被告王燕群，二十四歲，兩人均無業，為夫婦關係。控罪指兩人於本年七月八日，在土瓜灣馬頭圍道九十三號福星大廈一單位房間謀殺女子區美蓮。
20020721-7,20020721,7,教署升學就業展覽,教署升學就業展覽 【本報訊】為協助失學及失業青少年，教育署及勞工處昨日開始舉辦升學就業巡迴展覽，吸引不少應屆會考生、家長及「雙失」青少年前往索取資料。其中，前年在會考後不能升讀中六的蕭小姐，昨日由母親陪同前往參觀，以了解政府新推出的「青少年就業見習計劃」，希望透過報讀該計劃脫離雙失行列。  「搵工好難，令人好灰心，可能係僱主要求高咗，𠵱家係人搵工，唔係工搵人！」蕭小姐已「雙失」兩年，其間找過十多份文職工作，但連面試機會也沒有，她估計是自己沒有工作經驗所致。  副學士課程是另一升學途徑，如浸會大學首批畢業的二百三十七名副學士學生中，超過半數獲外國大學取錄讀學士課程，另一成也升讀本地院校，校方昨日為他們舉行畢業禮。
20020721-8,20020721,8,莽漢涉傷同居女友,莽漢涉傷同居女友 【本報訊】何文田一名莽漢懷疑同居女友夜會第三者，醋意大發，昨清晨時分，趁女方返家即大興問罪之師，有人盛怒下涉嫌用生果刀狂刺女友胸腹，再自插腹部自殺意圖同歸於盡。莽漢負傷報警求救，送院搶救後二人情況嚴重，警方暫列作傷人案處理。  涉嫌傷人的男子姓朱（三十八歲）與姓薛女友（三十九歲）在太平道六號太平居一單位同住。據悉，近日二人情海翻波，男事主懷疑女友有第三者，雙方多次爭執。  稍後警方在單位內撿走一把六吋長染血生果刀及有關證物，亦向大廈住客了解事發前是否聽到爭吵聲。  目前兩名男女傷者仍需留醫，男傷者由警員看守，至於女傷者已施手術，她欲言卻開不到聲，有待她康復才能錄取口供。
20020721-9,20020721,9,持刀攤牌斬情敵　挾女友對峙青年遭轟斃父向警索償千萬,持刀攤牌斬情敵　挾女友對峙 青年遭轟斃父向警索償千萬 【本報訊】喪妻青年於四年前疑捲入三角戀愛，攜刀相約已分手女友及情敵在茶餐廳「攤牌」，情緒激動，先斬傷情敵，復挾持女友與一名交通警員對峙，結果遭警員鳴槍兩響轟斃。死者老父指警員開槍不合理，令其痛失愛子，孫兒喪失父親，昨入稟高等法院向開槍警員索償一千萬元，以作兒子殮葬費及遺孤日後的讀書和生活費。　記者：陳浩義 死者陳崇謙，死時二十五歲，任職侍應，其妻已過身，兩人育有一名兒子，現已八歲。與訟人為香港警務人員蘇樹坤，事發時任職交通警員。  原訴人陳茂懷在入稟狀指稱，他養育兒子陳崇謙二十多年，但在香港回歸不足一年，兒子被警員開槍打死，令其痛失兒子，年幼孫兒喪失父親變成孤兒，事件亦使家庭傷心。     終日驚恐夜夜失眠   陳茂懷結婚二十八年的妻子，因兒子遭警員開槍轟斃後，精神失常，終日驚恐，夜夜失眠，最後她因不想再在香港生活，與其離婚返回台灣的娘家。他亦因喪子之痛曾兩度需入院留醫。  陳茂懷昨在家中表示，兒子與案中女友已認識多年，當日她做「和事佬」調解事件，其時有人情緒激動，警員以為其子有攻擊行為而開槍，但他質疑警員當時開槍是否合理。  陳茂懷續說，事發之後曾致信行政長官董建華、律政司及警察投訴課投訴，但各部門的回覆均表示事件仍在調查中，他最後惟有自行撰寫入稟狀索償。  開槍案發生於九八年五月九日，死者陳崇謙與拍拖三年的女友梁紫欣（現年二十四歲）因三角戀情問題，相約在馬頭圍道聯華茶餐廳會面，陳並要求她即時致電找情敵曾燕雄出來見面。  其後，三人在茶餐廳內，因感情問題發生爭吵，陳突從懷中取出一把約十六吋長的牛肉刀襲擊情敵，斬傷對方的頸、臉、腰間及腋窩以下位置，女友以身阻擋陳再揮刀，糾纏間雙雙倒地。     再舉刀被轟第二槍   此時，交通警員蘇樹坤抵場，目睹陳蹲在地上，用左手箍着女事主。  警員上前欲制止時，他突舉高持刀的右手，並朝向女事主的胸口，警員喝止無效拔出佩槍，鳴槍一響擊中他的胸部，當警員再度喝令他停手時，他再次舉刀而被警員開第二槍轟倒地上。死因庭於同年十二月召開聆訊，裁定死者死於合法被殺。  案件編號：HCA2812/2002
20020721-10,20020721,10,北京客撿10美元　回頭失10萬巨款行騙得手南美雌雄賊成擒,北京客撿10美元　回頭失10萬巨款 行騙得手南美雌雄賊成擒 【本報訊】為撿拾十元美金，一名來自北京的商人昨中午在尖沙嘴一間酒店對開落的士時，墮入一對南美雌雄賊的跌錢陷阱，他俯身撿起地上十張一元美鈔時，被對方趁機掠去放於的士上裝有近十萬元巨款的手袋，兩匪得手後乘的士逃走，一直在附近監視的警方刑事情報科人員（俗稱狗仔隊）迅速截停的士拘獲兩人，但沒起回贓物，相信已交予同黨，並懷疑兩疑人與上月中區一宗五百一十萬元跌錢黨騙案有關，交港島總區重案組調查。     掌握目標人物資料   被捕兩匪徒年約五十歲及四十八歲，哥倫比亞籍，事後警方曾押同他們搜查尖沙嘴多個地點，包括兩人的住處，但無發現。  消息稱被捕兩疑匪相信屬於一個國際扒竊集團，警方已掌握多名目標人物的可靠資料，相信稍後會有更多人被捕。  消息又稱，自上月十八日本港一間上市公司的三名職員，被兩名南美跌錢黨男女騙徒，利用二十張二十元港幣引開職員的注意力，偷去逾五百萬元的巨款後，接手調查的港島區重案組人員，懷疑案件與一個以遊客身份來港的南美匪幫有關，他們主要活躍尖沙嘴及中環遊客區，並以弄污事主衣服及掉下鈔票引誘事主執拾乘機偷竊。  警方經一番調查，掌握多名可疑人資料，連日來派出「狗仔隊」在尖沙嘴重慶大廈一帶多南美人出入的地方監視目標人物。     聲東擊西偷走手袋   昨日落入跌錢陷阱男事主姓黃（三十五歲），失去的手袋十吋乘六吋，內有八萬元港幣、二千美元、多張信用卡及一部手提電話。據悉事主為北京人，日前由內地來港，下榻尖沙嘴一間酒店，昨晨十一時許，事主乘的士抵尖沙嘴新世界萬麗酒店外落車時，一名外籍女子趨近，笑問跌於的士路旁的十張一元面額美鈔是否他的，事主俯身察看時，一名外籍男子乘機從的士另一端拉開車門，偷走事主仍放在的士座位的手袋，然後截乘的士逃去，事主發覺手袋失去，疑被該對外籍男女偷去，立刻返回酒店報警。  與此同時，一直在附近監視南美幫可疑目標人物的警方刑事情報科人員，即包抄兜截該兩名犯案逃去的雌雄賊，於中午十二時十分許，在加連威道截停的士，當場拘捕兩匪，但在車上及兩匪身上沒搜獲贓物，懷疑途中已將贓物交與同黨避開警方，事後將兩匪連同的士司機，一併帶返警署。
20020721-11,20020721,11,鄧小平亦是金庸迷,鄧小平亦是金庸迷 金庸武俠小說的讀者群，橫跨三代中國人，而且被繙譯為多國語言，已故中國領導人鄧小平亦喜歡閱讀，在香港家喻戶曉，多年來不斷被改編為電影及電視劇。有評論甚至形容金庸可能是中國歷史上最偉大的小說家，他的小說幾乎影響每一個中國人，甚至影響世界上每一個能讀中文的人。倪匡曾說：「有中國人的地方，就有金庸的小說。」  金庸小說人物例如油腔滑調的韋小寶、癡情的楊過、外表君子內裏奸險的岳不群，以至小龍女，黃蓉等，都是深入民心的經典人物，甚至可以影響讀者行為，幾乎由虛構的人物變成真實的歷史人物；金庸的小說寫到武當山之處也很多，對推廣當地旅遊也很有幫助。  按本年四月康樂文化署的電腦借書數據，過去八年來累積借閱數字，金庸小說囊括前十名。  本報記者
20020721-12,20020721,12,公安報料澳警緝獲軍火,公安報料澳警緝獲軍火 【本報訊】繼本港前日在屯門搗破械劫集團，廣東省公安廳另外提供可靠情報，導致澳門警方昨日亦撿獲軍火，包括一個菠蘿形手榴彈，一支黑星曲尺和五發子彈，事件無人被捕，初步相信香港和澳門兩宗軍火案有關連。  澳門治安警察局情報廳早於三日前已憑線索到來埋伏，撿獲軍火現場為黑沙環順風巷均興大廈二樓某單位，警員不動聲色等候該單位住客出入，惟一直沒有動靜，警員在昨日下午決定「收網」，破門入屋在一個廁紙格內發現手榴彈，手槍與子彈則收藏在牆邊的魚網內，軍火事後已送往化驗。  至於本港警方前日出動王牌「飛虎隊」，成功在屯門慧豐園碼頭圍剿一個擁有重型武器的「省港旗兵」械劫集團，拘捕五名男子後，偵騎四出，全力搜捕多名在逃集團成員。警方西九龍總區重案組人員，昨日凌晨先後將兩名被捕疑犯押至深水埗及旺角兩個單位搜查，追緝漏網人士。  五名被捕械劫集團成員，包括三名來自黑龍江內地男子及兩名本地男子，前日被捕後隨即被押回警方西九龍總區重案組總部調查。     港警押疑犯搜兩屋   至昨日凌晨零時許，探員將一名疑犯押至深水埗醫局街一單位搜查，在屋內逗留十多分鐘後離開。至凌晨一時許，探員再押解另一名疑犯到旺角彌敦道一單位搜查，再押回九龍城警署繼續拘柙。
20020721-13,20020721,13,「348」忽變傳播福音場,「348」忽變傳播福音場 【本報訊】曾經是青少年勁舞「啪丸」、黑幫橫行廝殺的佐敦「348」的士高，忽然成為傳播福音的場所，六個宗教團體首創的士高福音派對，在五光十色的射燈及強勁的音樂節奏中，向邊緣青少年「講耶穌」。  「348」的士高上月因不獲酒牌局續牌而需暫停營業，現時由六個基督教團體借用至八月底，每逢周六晚免費招待青少年入場，在他們跳舞之餘，工作人員會藉機會向他們傳福音。  昨晚的士高有百多人入場跳舞，活動負責人之一倪翰生指出，活動上月舉辦至今有二千名青少年入場，其中二百人信了教，但亦有不少人只是貪小便宜來跳舞，他們也不介意。     計劃申請續牌   「348」的士高負責人洪漢義表示，正計劃申請續牌，但否認是利用宗教活動增加續牌機會，他說：「如果係咁，我會對唔住我自己！」  曾因販毒而入獄，現已信教的洪漢義承認，他說：「娛樂場所一定要有江湖背景至可以經營，而且場裏面有百幾個員工，大部份係釋囚同重犯，佢哋喺其他地方搵唔到嘢做，我要照顧啲兄弟。講真呢種生意喺宗教入面係一種魔鬼生意，但希望大家為我祈禱！」
