key,date,article_daily_id,title,text
20020507-185,20020507,185,樓市精點,樓市精點 LaHacienda2700萬易手   ▲山頂及南區豪宅分別錄得成交，利嘉閣陳安娜說，山頂加列山道29號LaHacienda單數洋房，3200方呎，剛以2700萬元易手，呎價8438元，造價合理。另大潭紅山半島A型81號屋，亦以1778萬元易手，洋房面積約2900方呎，呎價6131元。  ▲中半山花園台3座13樓A室，3307方呎，剛以1820萬元成交，呎價5503元；另同區帝景園4座3樓A室，1970方呎，成交價1230萬元，呎價6244元。  ▲鴻運地產馬慶祥表示，西半山帝豪閣在過去10天內，連續錄得4宗成交。最新一宗為高層3室，屬銀主盤，面積1289方呎，成交價600萬元，呎價4655元，價錢合理。  ▲將軍澳維景灣畔一期錄得日籍租客承租個案。利嘉閣地產馬步成表示，2座高層G室，1045方呎，擁全海景，一般月租1.6萬至1.7萬元，日前卻以月租2.1萬元租出，呎租20元，創下屋苑租金新高。     第一城蝕127萬沽   ▲利嘉閣地產鄭雄雯表示，沙田第一城26座中低層G室，剛以103萬元成交，面積395方呎，呎價2608元，屬合理價錢。原業主於97年以約230多萬元購入，現帳面蝕讓127多萬元。買家是荃灣區上車客。  ▲鴻運地產林明輝表示，柴灣杏花邨錄得一租轉買個案。該屋苑一租客，日前以243萬元買入同屋苑41座高層6室，766方呎，呎價3172元。  ▲屋之島物業顧問行董事總經理黃志強表示，甲級商廈價格回落，不少買家趁低吸納。該行剛促成尖東永安廣場2宗買賣，其中，一新加坡投資者斥資約530萬元購入3樓6室及7B室，面積2250方呎，呎價2356元。另一宗為3樓7A室，1080方呎，270萬元成交，呎價2500元。
20020507-186,20020507,186,黃竹山新村　地勢高　風光好,黃竹山新村　地勢高　風光好 距西貢市中心約5至10分鐘車程的菠蘿輋，是區內主要村屋集中地，物業分布於菠蘿輋路及分支小路上，密密麻麻遍布整個山頭。其中坐落地勢較高兼背靠馬鞍山郊野公園的黃竹山新村，居高臨下，俯瞰西貢南面島嶼及海灣，風景優美。 黃竹山新村合共10多幢村屋，規模不算大，特色是物業全部靠山呈一字排列，享單邊獨立幽靜的居住環境。現時全幢放售的單數屋，由於業主尚未搬離，內櫳及花園均保養極佳。門前700方呎入契私家花園，建有假山瀑布及水池，周邊草木茂密整齊，形成天然屏風。  村屋樓高3層，地下為客飯廳及廚房，樓上2層共設5房，其中於2樓的套房，連浴室足有500方呎，中央以大屏風分隔闢出偏廳，裝修簡單平實。  利嘉閣匡湖居分行黃富傑說，近期該處錄得多宗全幢村屋成交，如位於菠蘿輋路的柳濤軒8號屋，2100方呎，4月份以490萬元易手，呎價2333元。  記者：蔡家儀  攝影：梁祖彝
20020507-187,20020507,187,住西貢好口福,住西貢好口福 選擇村屋居住往往以有車人士較方便，但在西貢，即使無私家車代步，出入問題亦不大。全靠往返地鐵彩虹站至西貢碼頭的通宵專線小巴，令該區不少居民，均可享有交通之便。尤其坐落小巴途經的南圍、北圍、井欄樹、西貢市中心一帶，村屋租務特別活躍。  西貢區最為人津津樂道的是食肆選擇包羅萬有，除最經典的海旁一整列海鮮酒家外，市內特色餐廳亦琳瑯滿目，不同國家的地道食品店、滿有情調的酒吧、以至熟食檔或糖水舖應有盡有，區內街坊可謂口福不淺。
20020507-188,20020507,188,財經人物素描：王維基拒絕逃避壓力,財經人物素描： 王維基拒絕逃避壓力 本港經濟未見起色，企業裁員之聲此起彼落，家庭糾紛增加，不少人更不堪壓力自殺。城市電訊（1137）主席王維基認為，香港人要學習面對壓力，不要逃避在壓力下成長。  「一個7歲嘅細路仔，若果承受唔到讀書壓力自殺，雖然好可惜，但若果咁少嘅挫折都承受唔到，日後點面對生命的考驗……你17歲可能會考試『肥佬』；27歲可能被炒；37歲或出現家庭糾紛；47歲可能破產。」他認為港人不應害怕壓力，應從挫折、失敗中吸取經驗，繼續壯茁成長。  最近，他在公司推行新政策，員工每隔一段時間就要變換工作崗位、學習新的工作，以及承擔更大責任。不過，此舉引來員工極大不滿，認為管理層於目前經濟環境下引入新制度，無形中增加了工作負擔。 安於逸樂羅馬亡國   王維基解釋：「綜觀過往歷史，中古時代的羅馬帝國、近代歐洲諸國的發展，以至二次大戰後日本工業發展由盛轉衰，歸根究柢，便是欠缺危機感，安於逸樂。」他更進一步指出，美國近百年的興旺，也是因政府不斷向國民灌輸危機意識，所以今日城市電訊作出的種種轉變，只希望同事維持危機感。  王氏於92年在港成立城市電訊，當時只有18名職員，其後生意愈做愈大，到員工增至46人時，他已覺得員工生產力需不斷檢討，不可安於現狀。97年底公司上市，員工人數已多達800人，現時更逾1200人。為改善公司架構，令其更組織化，最近向地鐵「挖角」，聘請了一名管理層人員，專責新設立的組織發展部門。  他稱：「以前間公司幾百人，個個都識，如兄弟班；𠵱家公司幾千人，跟本識唔晒……人愈多，風險愈大，現時每月資本投資已達2000萬……一定要計數。」王維基承認，落實問責制度後，給中、高層員工好大壓力、令他們好辛苦。     不斷轉型適應轉變   近期，一位網絡營運部職員被炒，因其負責的長途電話客戶，「三千蚊creditline（信貸額），打爆咗萬幾蚊都無停佢個戶口，其間又無作出滙報或解釋，所以炒咗。」  王維基承認，有關改革確引起同事不滿，他們多數不理解。「可能自己表達得唔好，但問心嗰句，我真係為佢地好。IDD業務已賺咗十年錢，試問有邊一行能賺二十年、三十年？所以一定要裝備自己，不斷轉型以適應轉變，若一個人同一份工做咗二十年、三十年，對本身發展唔係幾好。」  記者：黃偉強
20020507-189,20020507,189,建議修例代港交所掌審查資訊權證監可查控發假消息公司,建議修例代港交所掌審查資訊權 證監可查控發假消息公司 【本報訊】證監會及港交所（388）昨日分別發出權力重整的建議文件，確立證監會對訊息披露的執法權力，可以調查故意發放虛假或誤導性資料的上市公司或上市申請者，並對他們提出檢控；港交所則重組上市委員會架構，將審批上市公司的權力收歸內部的上市科。 證監會股東權益小組成員DavidWebb認為，今次做法未能解決港交所角色衝突的問題，故建議該所應專注交易及結算等工作，將所有審批及監管上市公司的權力，交回證監會負責。  證監會昨日就打擊在招股書及上市公司公告中說謊或誤導公眾的行為，建議制訂規則。以往，這方面由港交所負責，但該所沒有執法及調查權力，只能對違反上市規則者公開譴責或將公司停牌。  今次諮詢文件建議，上市公司及正申請上市的公司向聯交所呈交的披露資料，會同時交予證監會備案，若發現故意或罔顧後果地提供虛假或誤導性資料，證監會可進行調查及搜集證據，對違法者提出檢控；或者將案件移交商業罪案調查科，或日後成立的市場失當行為審裁處處理。 重組上市委員會   投資者學會主席譚紹興指出，此建議是證監會因應美國爆發安然事件，跟隨國際市場加強監管訊息披露的做法，證監會或多或少會擴大權力，但對保障投資者有好處。證監會發言人則強調，新建議沒有賦予該會任何新的執法權力，以往只是授權港交所負責，港交所會繼續作為上市公司及上市申請的前線監管機構，證監會反對上市的權力只屬保留權力。  另外，港交所昨日公布重組上市委員會的決定，預計下半年落實。現時上市申請或除牌會先由港交所的上市科處理，再交由有公眾人士參與的上市委員會或創業板上市委員會審批；若有上訴，則由相關的上訴委員會處理。新公布指出日後審批上市申請及除牌事宜，將由港交所行政總裁鄺其志及上市科人員組成的內部小組處理，調查及裁決工作則分別由上市科及新設的裁決科負責。文件又建議成立由公眾組成的上市事宜委員會及使用者上訴委員會，只處理上訴問題。  港交所指出，新做法可更有效率處理上市事宜，該所又會成立衝突事宜委員會，避免利益衝突的問題。
20020507-190,20020507,190,國威海外上市拓市場,國威海外上市拓市場 【本報訊】運用微波等離子應用技術，製造特種材料──金剛石（即鑽石）膜裝置及相關產品的湖北民企國威高科技，不但在99年的相關高科技成果鑒定中，擊敗中國科學院、清華大學及北京大學等國家級科研機構及高等學府，還準備在海外上市，以提高公司知名度及發展國際市場。  國威今天將與星光生物科技（1051）簽訂換股合約，成立兩家合資公司，製造可用於改變紡織品及紙張高分子結構的微波等離子體設備。星光將發行1.3億新股，換取兩合資公司約21%及50%股權。  只持有公司32%股份，其餘股權都用作留住頂尖等離子科學家的國威董事長陳建質說，等離子國防及商用科技水平以美、日最高，但美國不准出口；而國威的技術已超越英、法，產品價格只是美國一成，且已合資1.01億元人民幣在咸陽設廠作規模化生產，每年可生產300台。
20020507-191,20020507,191,霸菱睇好港股建議增持,霸菱睇好港股建議增持 【本報訊】受到外圍市況轉弱，及金管局總裁任志剛預期，年底前出售餘下總值285億元的盈富基金（2800）等消息影響，港股昨日明顯出現獲利回吐，恒指跌61點。但證券界普遍認為，港股調整後可以有力再上，ING霸菱更調高港股投資評級至「增持」，恒指目標價為13500點。  ING霸菱亞洲首席策略員樂志勤昨日表示，由於市場已經完全消化本地瀰漫的悲觀氣氛，並預期本港經濟在去年底已經見底，所以把港股投資評級，由「減持」調高至「增持」，恒指目標價則維持在13500水平，建議吸納銀行、地產及消費股，減持電訊股，推介股份包括：滙豐控股（005）、太古（019）、恒基地產（012）、佐丹奴（709）、電視廣播（511）及港交所（388）。     廣電擬港美上市籌117億   此外，市場消息透露，中國銀行積極爭取在今年第三季初上市，集資20億美元（156億港元）。另有報道指出，廣東廣電電網計劃在港、美兩地上市，集資15億美元（117億港元），保薦人及全球協調人為摩根士丹利及中金，美林和德意志銀行也會擔任主要角色。該公司的估值達100億美元，集資所得將用作擴充及更新電網設備。  港股昨日跟隨外圍弱勢，低開26點，其後輾轉向下調整，一度跌穿11700水平，中移動（941）及新鴻基地產（016）沽壓較大，分別跌2.6%及1.8%。恒指收市報11736，跌61點，成交94億元。即月期指收11735，接近平水，成交合約1.2萬張。  市場資金再由落後藍籌股，換馬到工業及國企公路股，其中福田實業（420）收2.425元，升近30%。瑞士第一波士頓亦發表研究報告預期，福田中期純利增長20%，前景理想，維持買入建議，目標價調高至3.2元。
20020507-192,20020507,192,新南威爾斯中央海岸捉蟹擦鮮蠔,"新南威爾斯中央海岸捉蟹擦鮮蠔 夏天，應該要揚帆出海擦海鮮。無奈，我們的海港已經不再湛藍不再潔淨。惟有飛往近期人氣熱點澳洲悉尼近郊的中央海岸，吹着微涼的秋風，嗅着兩岸清草的芳香，吃着最鮮甜最肥美的泥蟹和鮮蠔。然後駕着「暫借」的遊艇，暢遊於最平靜碧綠的HawkesburyRiver，細看黃昏日落，也細意回味最清新自由無污染的一個假期。   記者、攝影：李莉 鳴謝：新南威爾斯旅遊局、澳洲航空 開蠔四部曲    一上船，美麗的船長太太已先準備好了茶和咖啡預備開始清晨的遊船河。但大家還未呷下一口熱咖啡，肥伯伯已經急不及待要教我們開獨有鮮甜的SydneyRock生蠔竅門。我們也聽到自己肚子的呼喚，二話不說飛奔上頂層，預備學兩招開蠔方法，但最期待的當然是開完蠔後大快朵頤的時間喇。    1先對正蠔殼7點鐘位置用刀「拮」入去；  2沿着蠔殼邊慢慢鏟，直至蠔殼分開為止；  3用刀平放於蠔肉底，慢慢切出來，然後倒吊；  4成功沒破損的話，洗好另一邊的空殼，把肥美鮮蠔放在乾淨的空殼上便大功告成！ SydneyRock蠔小知識    SydneyRock蠔雖然體積較小，但由於生長的HawkesburyRiver是出名無污染且河水的礦物質含量高，因為河的源頭正是藍山山頂的山水，因此，蠔不但新鮮而且乾淨甘甜，非常受歡迎！ 鮮甜生蠔泥蟹擦餐飽    坦白說，於中央海岸坐船遊HawkesburyRiver兼擦生蠔吃肥蟹不是甚麼新奇玩意。但沒有親身試過，我可不知道一面迎着拂面的清風，享受鮮蠔靚蟹，原來真的這麼過癮好玩。  由悉尼驅車前往HawkesburyRiver坐遊艇，車程才不過1個小時左右，短得想打個瞌睡也嫌不夠。在這個風和日麗的秋日早晨，第一次踏足中央海岸，感覺蠻不錯。  當我還在閉目享受這宜人的空氣時，HawkesburyPrincess的捉蟹肥伯伯已經跟我們打招呼，以熱情帶點卡通片的笑容揮着手，大家突然行徑一致，朝着遊艇方向邁進。 親手捕泥蟹    擦完鮮甜無比的鮮蠔，還以為可以歇吓。殊不知，還未來得及停下來欣賞兩岸沙石因風化形成出奇妙的山峯異色，肥伯伯便說：「是時候捕你們香港人最愛的泥蟹了。」嘩！大家立即眼前一亮，又衝到船頭，預備再拋開體重問題，瘋狂擦泥蟹。泥蟹雖然在HawkesburyRiver並非罕見，但放下的籠子也非次次「蟹」從人願，能夠輕易引蟹入籠。但我們似乎受到上天的眷顧，拉籠上來時，已可清晰見到兩隻中等的泥蟹，大家自然笑逐顏開。在船上即食泥蟹的方法通常是白烚，只有這樣才能保持泥蟹的鮮味。其實，試問又有哪一位會顧及烹調的方法呢，只要可以開懷大嚼一頓肥美的泥蟹宴，肥伯伯再說甚麼也沒有人會聽得入耳了。  Crab&OysterCruiseHawkesburyPrincess    地址：CatherinePigneguy,HawkesburyPrincess5,BridgeStreet,BrooklyNSW2083Australia  電話：(61)299858237　傳真：(61)299857330  網址： www.hawkesburyprincess.com.au   價錢：1小時morning/afternoontea  生蠔連捉蟹價錢：每位52澳元  交通：可於悉尼乘火車至Hawkesbury站約50分鐘，於車站前報名，有專車接送來回碼頭至火車站。 揸HouseBoat暢遊河岸風光    忙着品嘗鮮甜肥美的泥蟹，原來一小時的遊船河早已夠鐘。大家也真夠失禮，但船上各人也並無催促之意。只是，我突然有點失落，為了「吃」就連河岸風光也白白錯過了……  滿懷好意的船主也就介紹了Hawkesbury著名的HouseBoat，說我們大可三五知己租下一艘有廳有房有廚房的HouseBoat，自己操作，駛出HawkesburyRiver，那就可以逐分逐秒的去欣賞此處無盡旖旎的風光了。  HouseBoat在澳洲其實也蠻普通，最大的特色是你就算完全無揸船牌照，也可以操作HouseBoat，隨心意縱橫河上每個美麗的角落。當然，船公司首先會介紹操作的細節，讓你有足夠信心以後才正式開始自己扮富豪般的遊艇之旅。我雖然是機械白癡，但原來操作起來也真的一點不困難，很容易上手。而且每艘HouseBoat的設計又各有不同，有些更儼如五星級酒店，一大班人湊少少錢就可以暫時擁有一艘富豪級遊艇，就算時間只有一兩天也夠滿足我的虛榮心了。  HolidayAfloatHouseboats    地址：65-67BrooklyRoad,（P.O.Box56）BrooklynNSW2083  網址： www.holidaysafloat.com.au   電話：(61)299857368  傳真：(61)299857758  租船費用：4至10人船Luxury45  星期五至日（三日兩夜）1,195澳元  星期六至日（二日一夜）1,065澳元  平日（三日兩夜）995澳元（二日一夜）835澳元  註：以上為4月29日至9月29日價錢，價錢以每艘船計  出門提一提    簽證：不論持BNO、特區護照或CI均須簽證。查詢：28278881（澳洲領事館）    套餐：澳航假期最新推出$6,230來回悉尼連四晚悉尼麗晶酒店套餐（回程可選擇其他澳洲航行目的地），機票有效期14天，查詢：27376798（澳航假期）"
20020507-193,20020507,193,購物焦點：胸墊搞花臣新季內衣,購物焦點： 胸墊搞花臣新季內衣 夏天是最具活力的季節，想感染這股無限的活力，不妨向大自然學習，將鮮豔奪目且極富活力的花卉放上身，特別是由內出發。今年夏季的內衣大部份以花為主，不過最有驚喜的，是連胸墊都有新噱頭，非常有創意！重未為貼身衣物換新裝的你，一定要留意！ 記者：區佩嫦 攝影：林栢鈞 Model：YoYo 啫喱胸墊搞鬼過癮    小記比較鍾情碎花圖案，好似這套粉紅色的內衣，四分三的杯位上布滿碎花圖案，散發着活潑動人的一面。背部的肩帶可以拆除，讓肩帶變成交叉帶，夠晒靈活。而小記最愛的便是內衣附送的啫喱胸墊，放入內衣可達PushUp效果，能凸顯胸部的線條美。   花Pad拆除變透視    若然你一時愛穿SeeThrough，一時又愛穿厚墊內衣的話，小記就推介這套內衣給你。全套用輕柔的尼龍纖維製造，胸墊位有若隱若現的棗紅色花紋圖案，感覺夠簡約。不過小記最欣賞是花紋的胸墊可以拆除，搖身一變成為富誘惑的SeeThroughBra，靈活過癮。  售價：  $380（胸圍）  $110（內褲）  （CalvinKleinUnderwear） 其他大熱花款     大膽印花顯活潑    小記覺得喱士內衣雖然靚，但夏天一着貼身衫就現晒形，並非夏日內衣的首選。所以印花圖案較得小記歡心，好似這套PrincessTamTam的內衣，用了尼龍纖維及棉質製造，舒服又吸汗，最適合炎熱的夏季穿着。大花的圖案配襯粉紫色，夠晒突出，雙肩帶的設計感覺活潑，配埋同款TBack內褲，你話點忍得手？     富青春味精巧碎花    碎花充滿青春年輕的感覺，這套白色內衣套裝，尼龍纖維的質料輕巧柔軟兼富彈性。其二分一杯位的胸墊上布滿粉藍色的碎花，杯邊更縫上小花邊，手工精巧細緻，最能配合年輕人的活潑性格。 波浪花邊見心思    有啲人鍾情淨色的內衣，相信你見到這套內衣可能會有所改變。尼龍纖維的質料夠舒適，純白色的內衣上更繡上一朵朵深藍色的小花，活潑中又不失優雅。不過小記最欣賞內衣上的波浪形花邊，與小花互相配搭，絕對是相得益彰。  售價：  $170（胸圍）  $58（內褲）  （UneNanaCool） 質料柔軟滑溜    熱情大膽絕對是這套Maidenform內衣給小記的感覺，尼龍混合Lycra的質料，感覺如泳衣般柔軟滑溜。水彩畫般的桃紅底色上印有紫藍色的圖案，較其他內衣特別，而四分三杯位的無縫胸圍，即使穿上貼身衫都唔怕「原形畢露」。另外，杯底設有鋼絲，且內附PushUp胸墊，穿上後最能凸顯胸部線條。  售價：  $329（胸圍）  $139（內褲）  （PrivateShop） 奪目太陽花    小記覺得這套來自法國lejaby的內衣，極富陽光感。胸圍用了粉紅色的通花喱士做成，喱士上有粉紫色的太陽花圖案，顏色奪目。此外，花邊的肩帶有立體的喱士花點綴，散發着活潑開朗的一面。  售價：  $569（胸圍）  $399（內褲）  （PrivateShop） 花巧喱士繡花    小記與一般女士一樣，對白色情有獨鍾，而你又會唔會好似小記咁鍾意呢款內衣呢？這套PrincessTamTam的內衣用棉及尼龍纖維製造，質料輕柔軟熟，四分三的杯罩縫上蝦肉色的大花喱士，簡單見心思。不過小記最喜愛雙肩帶的設計，感覺優雅靈活。  售價：  $449（胸圍）  $249（內褲）  （PrivateShop） 成熟深色大花    自問性格成熟，抗拒碎花圖案的話，不妨選擇這套Wacoal黑色喱士內衣套裝！黑色喱士上有深紅色及杏色的繡花喱士，圖案鮮豔大膽，極富成熟韻味。四分三杯位的底部設有鋼絲，給胸部極佳的承托力，配上同款T-Back，更能凸顯女性線條。  售價：  $480（胸圍）  $248（內褲）  （Wacoal）  店舖資料：    PrivateShop  （25061011）  銅鑼灣時代廣場531號舖    CalvinKleinUnderwear  （21160602）  尖沙嘴海港城2129號舖    UneNanaCool  （28953311）  銅鑼灣世貿中心P213-5號舖    Wacoal  （28810864）  銅鑼灣三越百貨B1專櫃
