key,date,article_daily_id,title,text
20030318-153,20030318,153,財話短說,財話短說 亞洲人壽入股內地民生壽險   ▲新加坡亞洲人壽表示，入股中國民生人壽保險5%股權，但就未有透露入股金額。該公司副總經理TanKahHo表示，有關交易於去年簽訂，目前正等待中國保監會的最後批准。  ▲長春達興(8067）更正02年度每股盈利為7.2分，而非72分。     一太3.3億拓印度手機網絡   ▲第一太平（142）持有49%股權的印度流動電話公司EscotelMobile負責人接受外電訪問時表示，將於4月開始的年度投資20億印度盧比（約3.3億元），以提升其網絡。該公司現有57.8萬用戶。  ▲建滔化工（148）宣布，已簽訂一項8.5億元可轉讓銀團貸款。該項融資原先為8億元，但因反應踴躍而加碼至8.5億元。貸款為期4年，息率為香港同業拆息加0.62厘。     證監會撤梁婉兒交易商註冊   ▲證監會宣布，已撤銷梁婉兒的證券交易商代表註冊，因其在受僱於道亨證券期間行為失當，曾將其較早時透過其父親的帳戶以較高價格購入的股票，在該等股票價格下跌之後，分配到其客戶的帳戶之內。  ▲新加坡上市的基建公司IPCO證實，已與中國燃氣（384）大股東恒鋒集團(185）達成協議，斥資3.04億元購入恒鋒持有的26.4%中國燃氣控股權。IPCO股價曾升7.14%，其後「打回原形」。 中電信深圳新頻段影響對手   ▲據內地《國際金融報》報道，中國電信（728）屬下的深圳電信於本月15日起，將逐步把其「市話通」市內固網無線電話頻段，由原先的1895-1900兆赫/1975-1980兆赫，改為925-1175兆赫，新客戶已開始用新頻段。由於中移動（941）及中國聯通（762）目前GSM網絡使用的頻率在885-915兆赫及930-960兆赫，若深圳電信的市話通使用到925及950兆赫兩個頻段，就可能會影響到中移動及聯通。     中華藥業半年少賺逾五成   ▲中華藥業（8120）公布，截至今年1月底止半年純利474萬元，較去年同期下跌51.49%，每股盈利0.93仙，不派中期息。期內，集團營業額為6261萬元，經營溢利1071萬元。  ▲國新集團（1215）宣布，截至去年12月底止半年股東應佔虧損為754萬元，上年度同期盈利為1.29億元；不派息。     萬達以每股0.35元上創板   ▲軟件方案開發商及供應商萬達資訊科技（8213）宣布，股份配售獲得全數認購，今日（18日）正式掛牌買賣。集團主席李信漢表示，供認購及配售的股份合共1.37億股，每股作價0.35元，集資所得淨額估計為3000萬港元，將用作招聘員工及擴展銷售渠道。
20030318-154,20030318,154,港資金未見有異動,港資金未見有異動 雖然美伊戰事一觸即發，但金融管理局副總裁簡達恒表示，未發現有不尋常資金流動。他又說，本月底正式向銀行發出有關防止洗黑錢及協助恐怖分子融資的補充文件，當中會包括收緊對銀行使用中介人推薦客戶的安排。  簡達恒昨日出席一研討會後表示，曾多次接獲警方報告稱，部份為銀行介紹生意的中介人，沒有正當地履行向客戶進行盡忠審查的工作，金管局也在大約一年前就此通知銀行。他說，在最新給予業界的補充文件中，會收緊有關規定，要求銀行嚴格監控中介人評核客戶機制之質量，以及要向銀行提交文件以供銀行判斷中介人是否合適地進行該項職務。目前，金管局正待銀行界就補充文件提交意見，料本月底可以落實，其後會有半年寬限期，讓銀行更改現有系統作配合。     暫毋須發新指引   他又表示，近期未有因戰爭在即，而向銀行發出意外事故應變措施的指引，相信數月前向銀行方面發出的指引已足夠。  有關正面信貸庫的指引，他說，最主要兩項目，會是有系統保障客戶私隱，以及銀行全心全意參與提供資料。
20030318-155,20030318,155,往績穩前景佳股路縱橫：瑩輝升勢再現,往績穩前景佳 股路縱橫：瑩輝升勢再現 美伊隨時開戰，股市聞聲，又再跌過。恒指低開後，就在約100點的範圍內上落，收市8804，跌152點，成交縮到只得42億元。雖然恒生銀行（011）已除息，但期指低水幅度又再擴大，現貨月收8690，低水114點，市場看淡者仍眾。由於未來1個月係大藍籌公司的除息期，且今次多數派高息，所以，期指大低水的情況，暫時唔會有改善。  逆市而升的股票（不計認股證）有110隻，瑩輝集團（1163）高收1.22元，升3仙，中期調整已完成，升勢再現，2月底高位1.42元，今個升浪可以舊地重遊。  瑩輝已定下周二（25日）宣布02年（12月年結）末期業績。去年上半年，營業額2.61億元，增長20%，獲利4011萬元，則減少6.5%，每股盈利8.7仙，中期息派6仙。盈利倒退，主要是上市時曾作出稅務撥備，01年的上半年回撥1100萬元，但02年上半年則並無此項目，若不計此數，中期盈利應約有逾25%的增長。     拓展中國市場具優勢   集團主要設計和產銷照明產品，美國是最主要市場，佔營業額9成，其他地區包括歐洲和日本，中國市場正在開拓中，進度理想。  瑩輝往績穩定，近年開始進軍的內地市場，對公司而言，係一個「金礦」。中國入世和辦奧，大興土木，高級商業樓宇、豪華酒店、機場及運動場館設施的需求大增，瑩輝是全球從事照明產品公司市值5大之一，拓展中國市場，佔有極大優勢。集團計劃透過收購，以垂直發展方式加快步伐，主力發展內地商務工程和家居照明連鎖店。  目前公司手頭現金超過1億元，並無負債，在拓展業務上沒有壓力，而且亦有能力派高息。  估計02年盈利9200萬元，由於去年4月曾配售4050萬新股，每股盈利攤薄計為19.4仙，估計全年派息不會少於10仙，現價PE6.3倍，息率8.2厘，好有吸引力。03年，中國市場提供盈利增長來源，盤數會更靚。  全球同業之平均PE在10倍以上，瑩輝就算以8倍計，股價亦可見1.55元。  郭兆誠
20030318-156,20030318,156,連環炮：寧滬皖通轉強可跟炒,連環炮：寧滬皖通轉強可跟炒 港股上周五隨美股顯著反彈1天，昨天又打回原形，幾跌去上日反彈之全部升幅，裂口而上又裂口而下的走勢，令港股之技術走勢更差。  布殊與英國及西班牙領導人開峯會後發言，已把昨天定為國際就伊拉克問題的最後斡旋日，意味美國隨時會向伊拉克開戰，可能連一個早已預期的最後通牒也欠奉。聯合國調查團提前於昨晚向聯合國提交最新工作報告，相信仍會建議讓調查團有更多時間繼續調查，但相信不會獲美國同意，亦不會降低美國日內開戰的機會。  美伊一旦開戰，股市是否會如不少人所估計般大幅上升？結果料取決於開戰前的市況，若股市先行回落至低位（杜指低於7400），則反彈的機會將頗大，反之則開戰可能是新一輪沽壓的開展。  至於戰事會否拖延，則只宜走着瞧，不能靠估，因為連美國也須採取這態度，更何況無法左右軍事變化的投資者？軍事變化是互動的，戰果亦然，金融市場所受的影響就更難預估了。     大成交突破50日線   從樂觀的角度看，戰事或可速戰速決，但美國的經濟是否就能在戰爭後重拾升軌，卻不無疑問。自年前聯儲局不斷減息至今，美國整體的經濟發展是向下的，看不出戰事速戰速決有令經濟起死回生的作用。港股受美股帶動，經濟條件比美國更差，短線難寄厚望。  公路股昨天整體表現頗佳，但以成交及技術走勢而言，只有寧滬高速（177）及安徽皖通（995）有較大上升空間，前者大成交突破位處2.58元的50日平均線，高收2.675元，有機會推向2.875元，後者突破50日線位，將上試1.98元，破位可向2.125元推進，兩股可作短炒之選。  海歌
20030318-157,20030318,157,一味窩輪：匯豐除息9588可得益,一味窩輪：匯豐除息9588可得益 上周五恒指升幅，幾乎冇晒。滙豐（005）相對比較穩定，收82.50元，跌50仙。滙豐呢兩日「強勢」，但大勢欠佳，市場喺度等美伊事件發展，滙豐亦難獨善其身，不妨諗少少滙豐Put輪做吓世界。  滙豐Put輪對象係9588。滙豐末期息2.535元，明日除息對Put輪有利。恒生（011）昨日除息3.30元，實際只微升5仙，收82元。滙豐除息，估計亦難有實際升幅。  9588喺5月6日到期，現價89仙，溢價3.2%，槓桿率9.3倍，滙豐明日除息後，假設調整落79.97元之理論價，隻輪即時變成幾乎平水。滙豐除息則對Call輪不利，例如Call輪9725，8月到期，溢價5.2%，槓桿率22倍，兩日後，假如正股同隻Call輪價格冇乜變化，則溢價即時升上8.5%，會俾人覺得貴咗。     9299有投機價值   上周五美國油價散咗，中海油（883）由10.45元跌落10.20元，25仙跌幅唔算大，但Call輪9299則散晒，收1.2仙，唔見52%。下周五夠鐘，行使價10.29元，如果幾日內正股升唔夠30仙，隻輪就係咁先。若然美伊局勢亂過亂世佳人，油價亂升，正股起5%，則隻末日輪可急升3倍，呢隻輪有一定嘅投機價值，但落注當然要預咗冇晒。  章盛
20030318-158,20030318,158,點股壇：永亨難有突出表現,點股壇：永亨難有突出表現 恒生銀行（011）及永隆銀行（096）為紀念70周年而加派特別股息，永亨銀行（302）亦加派特別股息，但非紀念性紅利，只是因循同業的息率趨勢而派發。  永亨去年盈利6.8億元，減少12.6%，每股盈利2.32元，末期息79仙，全年共1.16元，減4.9%，股息佔盈利比率由46%升至50%，另派特別股息66仙，則股息佔盈利比率升至78.4%。  永亨存款減少0.8%，發行存款證則增76%，貸款減少3.1%，平均流動資金比率由45.3%降至42.4%，淨息差收窄15個基點至2.62%（中期息差2.66%），淨利息收入減少3%，非利息收入微升0.7%，營業收入仍減2.3%。     股價較資產溢價23%   營業支出增1.2%，成本對收入比率由31.3%升至32.4%，永亨並無減省人手，支出難以減少，加以推出新產品亦需宣傳，支出激增，對成本已加以控制。  呆壞帳增加10.6%或4500萬元，其中信用卡撇帳率為14.3%，高於同業平均數的13.25%，由於收緊審批，去年底信用卡貸款下降32.9%至3.1億元。  重估及出售固定資產由盈轉虧至1517萬元，出售證券利潤及準備調撥淨額減15.5%至3029萬元。  永亨於澳門有相當業務，雖然總貸款下降，而澳門貸款則增5.8%，澳門的稅前盈利1.43億元，仍較上年增加3%，由於佔盈利比重只是18%，對整體業績幫助不大，但對於穩定業績亦有若干貢獻。  永亨的策略，較為偏向於高收益業務，因而一般住宅按揭減少11.6%，佔比重由30.4%降至27.7%，運輸及運輸設備貸款則增21.5%，息差仍未能提高，面對市場疲弱，已致力於推廣財富管理，傳統業務於澳門及國內，因形勢有別，可以獲得稍佳的發展。  今年展望不易突出，大抵與一般銀行相似，現價26.45元，於除息後約為25元，PE10.7倍，息率4.6厘（不計特別股息），而股價較資產溢價23%，已較同類銀行為佳，亦反映市場較為看好，亦因為已存在溢價，股價表現將較為反覆，只宜於中線持有。  齊明
20030318-159,20030318,159,期指戰況：料試8616宜吼位沽空,期指戰況：料試8616宜吼位沽空 期指昨日出現急跌，早段以8790裂口低開，反彈乏力，隨即向下回補上周五的裂口位，下跌深度高於預期，原因是美伊局勢漸漸明朗，開戰的機會大為增加，令投資者再度看淡。期指昨日的跌幅已抵銷上周五的升幅，一度跌至8682，以8690收市，下挫180點，低水114點，日線圖呈下跌陰燭，並出現「島形轉向」形態，上周五的反彈可能已完成，並回復主流下跌走勢。  期指距離低位不足100點，小時圖及日線圖迅速轉弱，已失守8745之下，破底的機會頗大，有機會下試8500心理支持位。雖然上周五反彈頗為強勁，但昨日下跌加速，即市四度空間呈主動性沽盤，更出現沽出訊號，在8800水平已遇阻力，淡友順勢追沽，對沖力量亦大為增加，預計認沽期權成交及未平倉量亦會上升。  港股市底單薄，壞消息眾多，結算前將呈拉鋸下跌，開戰後或有一次快速反彈，惟在9100水平前有強大阻力，到時可能再次吸引淡友開倉再沽。  期指弱勢再現，在10日及20日線力壓下，即市將下試8616或8500水平，宜順勢沽空，但跌近目標位之上可能喘定，然後借消息反彈，淡友沽空時提防開戰消息後挾倉。  寶維
20030318-160,20030318,160,看圖捕先機：未破9100弱勢難扭轉,看圖捕先機：未破9100弱勢難扭轉 港股反彈只是曇花一現，受美伊隨時開戰影響，港股率先下跌，恒指收報8804，跌152點，成交減至42億元。現貨月期指收報8690，大跌180點，低水114點。  日線圖再現大陰燭，大市仍受制於9000心理關口及10日線，投資者可視之為即市阻力，一日未能升破，港股一日未能擺脫淡勢，只是恒指已貼近長線升軌支持8700所在，應該有不錯支持，就算輕微下破，預期在裂口支持區（8527至8737）前可回升。阻力方面，除了上述的即市阻力外，20日線與降軌相當接近，約在9100附近，為短線阻力所在，只有上企該阻力，才可扭轉目前向淡的局面。  技術指標方面，昨日之跌，令稍見改善的指標再度轉壞，DMI的-DI與+DI的差距重新擴大，MACD熊差亦見增加，均顯示大市轉差，短線指標回落，RSI及STC雙雙向下，顯示後市危機未過。  本周為關鍵的一周，多方數據集中在一起，今日應知聯合國的決議案，最快美國可能於今日動武。另外，中移動（941）今日公布業績，如果出現驚喜，或者派高息，均可能扭轉近期的跌勢，而周四的多間公司大滙演，將會是港股的轉捩點。  紅籌指數走勢與大市相若，國企指數微跌，只是日線圖呈黃昏之星的利淡走勢，偏淡，看來將受制於成交密集區2200。    是日建議：    渣打（2888，現價84.75元）：陽燭，重回10日線及20日線之上，日線圖呈V形底，利好，RSI由低位回升，同時升破降軌，亦利好，可在上破85.25元追入，初步看90元，50日線止蝕。  華能（902，現價7.05元）：終上破7元阻力，MACD初見牛差距，利好，已破7元可追入，目標7.6元，50日線止蝕。  深高速（548，現價1.68元）：陽燭，上破10日線及降軌阻力，MACD將發出買入訊號，利好，現價買入，目標1.8元，10日線止蝕。  東尼
20030318-161,20030318,161,基金常舞動上車落車：中航信低買高賣,基金常舞動 上車落車：中航信低買高賣 中國民航信息網絡（696）末期業績略遜預期，上周四宣布業績前，股價先行急跌至4.70元低位，隨後急速反彈至5.65元，彈幅逾2成。現價5.20元，短期料呈反覆。  ■中航信的業務主要分為：1電子旅遊分銷；2機場旅客處理；3數據網絡服務等。3大民航集團南方航空（1055）、東方航空（670）與中國航空，各持10%以上權益。  ■02年（12月年結），中航信營業額9.45億元（人民幣．下同），增18%；純利4.53億元，增11.1%，每股盈利由0.48元微升至0.51元。全年盈利增長率11.1%，遜於上半年增長率（14%），顯見02年下半年增長放緩。  中航信去年3大環節業務中，數據網絡業務增長最速，營業額由1.15億元增長至1.62億元；其次機場旅客處理由2.04億元增至2.43億元；佔比重最大的電子旅遊分銷由4.60億元增至5.25億元。     稅務優惠告一段落   ■中航信本身享有中關村科技園新技術企業免繳所得稅的優惠，優惠期至02年12月底，而附屬公司則仍有數年優惠。最低者是正常稅率的23%。01年，中航信只付所得稅319萬元，02年亦只付315萬元。  ■03年，美國反恐戰爭與石油價格波動等因素，可能影響全球航空旅遊業，但國內航空業務所受影響較小。中國經濟增長強勁、航空旅遊企業進一步整合、北京舉辦08年奧運、上海舉辦2010年世博等，有利推動中國航空業務的發展，中航信亦得益，03年稅前盈利預測增長12%，但稅項支出大增，預測純利反降6%。現價往績PE10.8倍，預測升至11.4倍。  ■中航信手上現金非常充裕，02年底有18.93億元。例牌中期股息欠奉，末期由0.184元增至0.192元，其實可派更高。  ●中航信業務幾近壟斷性，值得享有較高PE。股價在基金舞動下，波幅不小。宜採取短炒策略，低買高賣，在5元邊緣上車，升至接近6元則落車，暫時避免中長線持有。  何車
20030318-162,20030318,162,股海實戰錄：亂局最好暫離場,股海實戰錄：亂局最好暫離場 炒股方法五花八門，有人喜歡基本分析，有人鍾意技術分析，亦有人兩者兼用。趙飛雲識得一位前輩，炒股主要靠經驗靠感覺，好似漁民唔識天文學，憑經驗可知「日暈而風，月暈而雨」。  趙飛雲炒股主要睇技術走勢，但有時都信感覺。近排雖然刻意少睇報紙，少聽新聞，但仍然有一種「亂」嘅感覺，所以近期睇市偏淡為主。  近年各國更換領導人，都似乎新不如舊，較大影響係以色列鷹派沙龍當選總理，結果令稍現曙光的中東和平重新進入黑暗時代，布殊當選美國總統，更是火上加油，其後發生的911事件、攻打阿富汗，以及即將爆發的美伊戰事，基本上是事件的延續。美國近年戰事得利，已忘記越戰的教訓，日後將更易開啟戰端，今次美國繞過聯合國亦要攻打伊拉克，對日後的世界秩序造成極壞影響。股市的發展主調在於和平安定，一旦戰亂頻生，破壞經濟，股市如何會好？     後市偏淡為主   今次美國若不獲聯合國授權而出兵伊拉克，就算戰事順利，股市亦只會在開戰初期反彈，之後則視乎國際局勢發展，估計將以偏淡為主。  香港近日更是一波未平一波又起，梁錦松偷步買車事件愈演愈政治化，董建華政權又醞釀新危機；非典型肺炎肆虐可大可小，處理不當可能釀成大災難，議員官員忙於「杜松」及「護松」，怎能讓人不擔心？如此氣氛下，股市易跌難升，散戶最好暫離場。  趙飛雲
20030318-163,20030318,163,701收料站：亞鋁有冇得炒睇業績,701收料站：亞鋁有冇得炒睇業績 小初前日提過華瀚生物製藥（587）及TCL國際（1070）可以炒業績，噚日華瀚股價微升1%，收0.98元，TCL則平收1.90元，未見大幅炒上。經紀陳話，港股噚日跌成152點，兩隻股有咁表現，已經好有交代。小初即管睇吓今日兩股公布業績後，短期內會否有表現。  至於亦係今日公布中期業績嘅亞洲鋁業（930），經紀陳話，隻股業績應該唔錯，或可借機炒一轉。  亞鋁噚日表現好靚仔，逆市升5.1%，收0.82元，又升近今個月高位，成交金額亦有797萬元。  雖然亞鋁上次公布全年業績平平，但有人估今次中期業績會好到你唔信，皆因過往嘅收購項目，終於為公司帶來盈利，今次據聞賺超過1.50億元，而且傳聞會派高息利誘股民。  小初知道公司近年極為努力搞好與投資者關係，早排有芬佬捧場攞貨，若然今次業績對辦，相信有機短炒一轉。  慕容小初
20030318-164,20030318,164,股壇瀏覽器：中移動升跌睇派息,股壇瀏覽器：中移動升跌睇派息 阿虎早就預咗阿董一定攬實阿松，不過佢挺松嘅方法怪誕之極，唔通阿董真係可憐到身邊一個謀臣都冇，否則又點會一方面批評阿松嚴重失責，卻又要出手挽留？其實阿董大可堅持相信阿松係無心之失，反正有心定無意根本好難證實，咁簡單嘅事，阿董竟處理到前後矛盾兼破綻百出，簡直羞家死人，破壞晒香港國際金融中心嘅形象。  市場傳出本周美伊開戰，投資者計數離場，港股當然偏軟無力，恒指收報8804，跌152點，成交42.81億元，亞洲股市更是全面下挫。  國泰（293）受到油價高企及非典型肺炎雙重打擊，股價大跌近4%，收報10.90元。  今次非典型肺炎相當惡搞，暫時冇藥物可以根治，連藥物股都冇得炒。新加坡及台灣來港旅行團有約10%取消，有10%押後，為本港經濟復甦再添陰影，香港呢排都可算衰到貼地。  聯通（762）跟隨中移動（941）喺成都搞單向收費，結果股價跌4.4%，收報4.325元，成交達4285萬元。中移動亦難以幸免，股價跌3.1%，收15.70元，成交達2.5億元。中移動今日能否反彈，主要視乎派息能否滿足投資者。  錦興集團（275）噚日通過併股，40股合併為1股，股價隨即再大跌23%，跌至「跌無可跌」嘅1仙收市。     錦興併股料再跌   今日併股正式生效，換言之，又提供下跌空間，股價再大跌絕不為奇。公司管理層表示冇集資需要，不過公司手頭現金只得1.56億元，而今年要還債6億元，財政壓力不小，相信併股後，供股配股會陸續有來。  阿虎
20030318-165,20030318,165,美元回落　金油彈升,美元回落　金油彈升 美國很大機會繞過聯合國攻打伊拉克，令美元昨日受壓，黃金和美國國庫券再受追捧。市場憂慮伊拉克軍隊會燒毀油田，以及戰事會影響波斯灣石油付運，令國際油價一度飆升逾4%。不過，有分析員認為，戰事若能速戰速決，黃金和石油價格不易衝破2月所創的高峯。     歐元重上1.08美元   歐元兌美元上周錄得2.4%的7個月來最大跌幅後，昨日曾彈升1.08美仙（1.01%），升至1.0844美元。美元兌日圓一度挫0.72日圓（0.61%），下跌至117.60。紐約早市，歐元報1.0808美元，升0.68美仙；美元報117.66日圓，跌0.66日圓。分析員說，倘聯合國否決授權出兵，美國將要承擔龐大軍費，這對美元最不利；但因日本當局可能大規模干預滙市，故圓滙的反彈力度料不及歐元。  受惠於美元下跌降低美國境外投資者買金的成本，及伊拉克總統侯賽因威脅戰事不會局限在該國境內，倫敦現貨金昨日最多升9.05美元（2.69%），高見每盎斯345.40美元。香港九九金升56元（1.79%），每両收報3187元。有金市策略員說，倘倫敦金突破346美元，將有力挑戰360美元，甚至370美元，但不易重見400美元。 歐美亞債券受追捧   另外，美國、歐洲及亞洲政府債券也有買盤支持。為了紓緩戰爭對經濟的衝擊，全球利率在短期內料會繼續處於低水平。  至於紐約原油4月期貨一度升1.57美元（4.44%），高見每桶36.95美元。倫敦布蘭特原油5月期貨曾升1.29美元（4.28%），升至每桶31.42美元。一些分析員說，若美軍能夠在開戰初期成功保護伊拉克油井，油價應不會漲至40美元。
