key,date,article_daily_id,title,text
20030925-206,20030925,206,國基會斥美外匯政策,國基會斥美外匯政策 【本報綜合報道】國際貨幣基金組織（IMF）總幹事科勒（HorstKoehler）昨天警告，某些國家政府不要藉批評別國實行外滙管制來為自己撈取在本國的政治資本。  科勒表示，某些國家政府應停止出於本國政治理由而玩弄短視的把戲，外滙市場走勢不應受公眾情緒和有組織的壓力所驅動。  七大工業國（G7）上周末發表聲明要求各國採納更具彈性滙率政策，矛頭明顯針對中國和日本，該聲明導致外滙市場本周連日動盪，美元兌日圓前天曾滑落至3年低位。科勒警告，投資者不宜高估外滙市場近日對G7聲明的激烈反應，市場過度上升或下跌是常有的事，但終會穩定下來。  科勒承認大幅調整滙率或有助糾正美國的經濟失衡，如巨額貿易赤字。但他認為華府與其要求別國放棄本身的滙率制度，倒不如着眼於其他貿易夥伴能否取得更強勁經濟增長令美國受惠，這比指指點點和怪責他人來得重要。  美元昨天曾再次回落至111日圓邊緣，迫使日本官員出口術拖慢圓滙升勢。日本傳媒透露，日本考慮在110日圓附近干預滙市，並認為此舉不會招致美國和歐洲的強烈反對。  美元一度跌見111.24日圓，跌1.00日圓（0.89%）。至於歐元兌美元升勢相對較溫和，最多升0.38美仙（0.33%），至1.1484美元。紐約早市，美元報111.72日圓，跌0.52日圓；歐元報1.1463美元，升0.17美仙。     日或於110水平干預   日本新任財務相谷垣禎一說，G7要求各國採納彈性滙率政策，不表示會阻止日本必要時干預滙市。《日經英文新聞》報道，日本計劃當美元挫見110日圓左右採取行動，認為這是拋售日圓最佳時機，並可望獲得歐美的諒解，因為美元進一步下滑恐引發資金撤離美元資產。該報稱，倘日本在110日圓入市干預，這意味該國可容忍美元下跌的底線，將由115日圓調整為110日圓。有關報道未有引述消息來源。
20030925-207,20030925,207,國際視野：小泉得勢改革有望,國際視野：小泉得勢改革有望 日本首相小泉純一郎以壓倒票數在自民黨黨魁選舉中獲勝連任後，隨即宣布成立新領導班子，為將於11月舉行的大選作好準備，如無意外，小泉將繼續出任首相，大有可能成為日本近年在位時間最長的領導人。  從這次黨魁選舉中可以看到，小泉得到黨內強硬派的全面支持，凸顯其出色的政治手腕和頭腦。日本根深柢固的派系利益若不能得到平衡，在推行經濟改革方面將遇上重重障礙，小泉以其過人之魅力率先進行政治改革，得到大比數的支持和共識後才大力推行經改，乃屬有智慧的部署。  至於經濟方面，小泉被保守派批評根本沒有作出太大貢獻，通縮揮之不去，失業率高企，在改革過程中導致不少企業倒閉，財赤則逼近GDP的8%，在在暴露其差勁的領導能力。事實擺在眼前，就算小泉如何狡辯，實在也有點難辭其咎。     置諸死地而後生   然而正如本欄多番強調，日本由來已久、錯綜複雜的所謂「三角戀」這個結若無法解，日本經濟要加速復甦談何容易，相信小泉必也意識到問題根本，故此首先着力於擺平黨內利益集團頑固的勢力，同時任命有膽識兼有魄力的竹中平藏為金融兼經濟財政相，致力推動銀行業清除窒礙經濟發展的壞帳，縱使引來更多公司破產亦在所不惜，然這是唯一置諸死地而後生的方法，不然個個揹住沉重包袱，如何起飛？  小泉慧劍一揮，經濟便開始漸見起色，第2季經濟錄得3.9%增長，比美國還要「棒」，希望這次內閣改組後，能將日本經濟推上更高層樓。  王冠一
20030925-208,20030925,208,東涌貨量多　免重掀減價戰長實擬協調行家賣樓,東涌貨量多　免重掀減價戰 長實擬協調行家賣樓 【本報訊】樓市交投熾熱，令重災區東涌現貨逐漸減少，有見市況好轉，香港興業（480）即惜售藍天海岸，擱置重推全新第2及5座的計劃，待善價而沽。至於長江實業（001），有意與區內其他發展商聯手支持樓市，提出協調方案，如有秩序賣樓及合力舉辦推廣活動。 長實高級營業經理郭子威說，將於短期內先聯絡香港興業，商討協調計劃。他指出，主要希望東涌樓盤能有秩序推出，以免同期賣樓，引發競爭甚至衝突，從而穩定區內樓價；並且有意協辦推廣活動，為東涌整個地區進行推廣，以達致雙贏局面。     藍天兩幢擱置開盤   香港興業發展及市務部總經理陳子明說，近期市況變化急速，集團看好後市，加上東涌現樓供應不多，故惜售旗下的藍天海岸。  原定本月發售全新的第2及5座，亦決定擱置，最快待明年才推出。     映灣貨尾呎價1970   藍天海岸亦夥拍中國銀行，提供新的付款安排，買家可獲發展商及銀行，分別提供7成按揭額4%及3%的現金回贈，選用此付款安排，樓價需加3%，按揭利率為首3年P（優惠利率，現為5厘），並獲贈全屋家具。  陳子明續說，藍天海岸現時集中重推第1、3及6座貨尾，首批20伙，平均呎價1826元。他表示，雖然近期市況理想，但該批單位仍以原價推出。他說：「現時唔應該用加價嘅策略，要用減售嘅策略。」他認為貿然加價會嚇怕買家。  不過，映灣園卻趁勢推出一期現樓貨尾，長實高級營業經理劉啟文說，首批共8伙，平均呎價1970元，單位售價148萬至252.5萬元。  周六、日入市買家獲送8000元電器禮券，透過滙豐銀行承造按揭，可獲贈8000元或貸款額0.75%的簽帳額。
20030925-209,20030925,209,業績轉好代理發放花紅,業績轉好代理發放花紅 【本報訊】內地放寬自由行限制之後，港樓市急速升溫，一手及二手成交大幅增加，有牛市重臨之勢。美聯物業主席黃建業表示，公司第3季業績是今年以來最理想的一季，所以向後勤員工派發最高一個月的特別花紅。  黃建業指出，本月公司生意額超過100萬元的分行逾30間，打破98年以來紀錄。第3季業績更扭轉上半年艱難局面，預期第4季進一步好轉。他補充，決定向美聯集團（包括香港置業）約300名後勤員工及前線文員，派發最高一個月月薪作特別花紅。  據美聯方面表示，若年底時業績理想，會再發放花紅。  資料顯示，美聯去年慶祝30周年，在8月份曾派發三分一個月月薪予員工作花紅。  另外，中原地產表示，若本月住宅及商舖部佣金逾1億元，會送出獎金予促成佣金超過100萬元的組別，金額5000元；150萬元以上的組別為1萬元，200萬元以上有2萬元。所有後勤員工會獲發500元利是，代替慶功宴。至於年底時計算，全年錄得盈利，集團主席施永青會實踐年中曾說「絕不手軟」派送花紅的承諾。     利嘉閣佣金2年新高   至於利嘉閣地產執行董事廖偉強表示，公司在第4季完結前，會公布派發花紅安排。  他補充，公司今年開始錄得盈利，本月佣金收入是2年來的新高紀錄。他預計後勤員工應可獲得一個月花紅。
20030925-210,20030925,210,逸樺園新貨下周定價,逸樺園新貨下周定價 【本報訊】太古地產鰂魚涌逸樺園，將於下周公布新一批單位售價，同時承認接受洽購以來，依個別單位情況調整售價。  太古地產高級營業經理馬淑貞表示，逸樺園至今售出約110個單位，套現約5億元。接受洽購期間，曾調高或調低個別單位售價，但拒絕透露調整幅度。不過，市場指該盤是「有加無減」。     推出中低層單位   她說，現時1座高層16個向海的B室已售罄，昨日剛售出的最後一個1座高層B室，面積947方呎，成交價560萬元，呎價5913元。太古下周會公布新一批中低層單位售價，但拒絕透露單位數目及定價水平。本周六正式開放示範單位，但要預約。  由於太古在逸樺園策劃、興建至落成的整個過程中，採取多項環保措施，令物業除了是一個環保項目外，亦盡量減少對周圍環境造成傷害，因此獲香港環保建築協會評定為「優秀」級別的首個市區住宅項目。
20030925-211,20030925,211,深灣軒押後開售,深灣軒押後開售 【本報訊】市況轉旺，新鴻基地產（016）近期推銷的鴨脷洲深灣軒，配合推廣策略，延至下月中以後才公開發售。發展商聯同新地會舉辦買樓抽獎活動，下月15日前認購該盤，可參加抽獎，獎品為香港仔遊艇會會籍及22吋液晶體電視。  新地代理總經理周國賢表示，未來兩三周展開深灣軒推廣活動，待推廣完結後，即10月中，才公布銷售詳情。該盤早前內購，累計售出逾40伙，主要是中高層單位，呎價由山景4000元至海景4800元。項目建有3幢住宅，新地計劃先推第1及2座688伙。  目前擁有近18萬名會員的新地會，會員於下月15日前認購該盤，可參加抽獎，頭獎10名，送遊艇會會籍、1年年費及部份餐飲費，每位價值3萬元。二獎14名，送1.5萬元22吋電視。  鄰區的薄扶林貝沙灣二期，電盈（008）市務及營業總監顏金施表示，新加推的第7座售罄，套現7億元，連同1至3座300伙，套現逾32億元。     貝沙灣擬保留第6座   由於集團對後市樂觀，除第5及8座計劃聖誕節檔期開賣之外，考慮保留第6座稍後推出。不過，市場消息指出，發展商接受市場洽購第6座。  中原地產高級營業董事何兆棠表示，昨日售出貝沙灣二期第7座頂層B室複式，3002方呎，連895方呎平台花園及雙車位，買家為中港商人，以2500萬元承接，呎價8328元。同座52樓B室，1700方呎，連車位，以950萬元售出，呎價5588元，買家為印巴籍商人。
20030925-212,20030925,212,刺激網上行　上客增三成now寬頻現擁4萬客,刺激網上行　上客增三成 now寬頻現擁4萬客 【本報訊】在取得收費電視服務牌照後，電訊盈科（008）旗下now寬頻電視昨正式公布收費詳情，本周五推出的兩個成人頻道月費50元，成為最昂貴的頻道；其他頻道則維持9至21元不等。電盈個人客戶市務及業務管理處首席副總裁梁德昇表示，now寬頻至今已上客4萬戶，不會減價招徠。 梁德昇指出，網上行用戶受now寬頻刺激，增近30%至約50萬；而now日後將為非網上行用戶提供服務，屆時會制訂月費計劃。     目前無意減價招徠   梁氏指出，now現有25條頻道，日後會因應客戶喜好陸續增加，至於下月中推出的足球頻道，現已取得法國聯賽、西班牙盃、意大利盃、德國盃及歐洲足協盃的直播權，暫定在決賽或總決賽才按場收費，他預期可激刺用戶增長。     對手擬售自製節目   另一家收費電視商——香港寬頻主席王維基昨日也表示，現已覆蓋10萬用戶，但仍拒披露上客數字。他說香港寬頻現有11條頻道，當中一半屬自製內容，並考慮將部份出售予內地的收費電視營辦商。由於收費電視競爭剛開始，他認為短時間內也不會出現減價的問題。  至於即將推出收費電視服務、電視廣播（511）旗下的銀河衛視，其常務總裁鄧思田昨否認有意向政府申請縮減投資，重申50億元的投資額維持不變。他解釋，由於服務較原定時間延遲推出，令各項成本均有所下降，故外界錯覺縮減投資額；並以機頂盒價格由220美元降至80美元為例，若以取得30萬客可收支平衡計算，預期機頂盒的支出可節省4200萬美元（3.28億元）。     銀河維持50億投資   他說數萬個機頂盒已付運到港，系統及節目系統測試正在進行中，仍維持於第4季全面推出服務；收費模式現仍未有定案，初期擬推出30條頻道，明年會增至不少於40條。銀河正與160萬戶家庭洽商入屋，預期到今年底可覆蓋50萬戶，1年內增至100萬戶，保守估計市場佔有率為8%。
20030925-213,20030925,213,藍澄送金月海加價,藍澄送金月海加價 【本報訊】長和系青衣藍澄灣，為內地買家提供十‧一黃金周置業優惠，每名買家獲贈3両足金。集團舉辦首個內地客來港睇樓團，將於10月初抵港；信和置業（083）葵涌月海灣加價4%，代理送旅遊優惠。  和記黃埔地產副董事經理徐建東表示，10月1至7日，內地人士購買藍澄灣，獲贈足金3両。樓盤9月至今售出150伙，每方呎2400至2500元，兩成為投資者，部份為內地人士。物業累售1250伙，套現逾21億元。  至於長江實業（001）與和黃合作的內地客來港睇樓團，首團下月4日到港，將逗留兩日一夜，名額30個，全部為深圳黃埔雅苑業主，每人團費250元，若成功購入單位，款項可獲退還。  另外，利嘉閣地產將安排購買藍澄灣內地買家，按揭利率全期為P（最優惠利率，現為5厘）減2.65厘，最長年期20年，樓按最多六成。  加價發售的信和葵涌月海灣，有約20個貨尾，每方呎2800至3000元，發展商並會加推4個頂層單位，面積600至607方呎，每方呎3200至3500元。黃金周假期間買樓人士，美聯物業送出北京五天雙人旅遊優惠，或數碼相機及MP3。
20030925-214,20030925,214,恆基貴重豪宅滬推銷,恆基貴重豪宅滬推銷 【本報訊】恒基地產（012）為旗下四個豪宅樓盤，進行歷來最大規模的內地推廣活動，委託金豐易居．鴻運國際為上海銷售推廣代理，為期2年。是次推廣共50個單位，總值超過15億元。     50戶總值15億元   恒基營業部總經理張炳強說，該4個樓盤包括中半山富滙豪庭、何文田京士柏山、九龍塘對衡道9號及大埔比華利山別墅。其中比華利山別墅在港尚未正式發售，預計推出20伙予上海買家，率先安排有興趣人士10月底來港參觀，樓價1000萬元起。另富滙豪庭全新示範單位11月完工，上海買家可優先參觀，餘貨不足20個。  至於京士柏山共10戶，最低消費3000萬元，而對衡道9號的4座洋房，每座1億元，買家可獲贈雙人106天環遊世界，價值70萬元，不設限額。至於來港參觀人士，發展商將安排入住旗下尖沙嘴美麗華酒店。  金豐鴻運執行董事黃燦浩說，該公司特別為恒基一系列樓盤，於盧灣區打浦橋成立分行，作為上述樓盤長期展銷廳。     兩住宅盤下季發售   恒基除在內地銷售豪宅外，年底前將在港開售兩個全新住宅項目，包括屯門藍地及西灣河碼頭，兩盤共提供近3600個單位，連同年初至今已售出2000餘伙，料全年可售出4000個單位。
20030925-215,20030925,215,地產多聲道：外籍遊客購物變置業,地產多聲道：外籍遊客購物變置業 尖沙嘴真係豪客集中地，不時都聽到原本只係行街購物嘅人士，轉過頭就去咗買豪宅。香港置業啱啱就喺海港城商場，撈到一對美國遊客，介紹佢哋買咗尖沙嘴擎天半島一期，三座高層H室九百九十八方呎單位，成交價四百一十萬。  香港置業高級區域經理馮智賢講，公司同事喺商場見到呢對夫婦一身貴氣，於是上前游說佢哋參觀擎天嘅示範單位，跟住好快就決定買樓。原來呢對買家，喺美國開科技公司，好鍾意中國文化，每年都會嚟香港旅行幾次，所以索性買個住宅當度假屋。呢個客喺美國住六千呎大屋。  另外，美聯分行經理黃少明話，將軍澳維景灣畔一名日籍租客，因租期差唔多滿，有見供平過租，所以用二百四十萬，買咗屋苑十二座中層七百一十四方呎單位。佢細佬第二日到訪，順便睇示範單位，問完喺東京嘅家人後，就用二百二十萬，買咗十五座中層六百八十方呎單位，實行兩姊弟住埋同屋苑，互相照應。     金豐‧鴻運上海生意直迫十億   9月份上海嘅樓市同香港一樣咁暢旺，龍頭地產代理金豐‧鴻運嘅生意額重破晒紀錄㖭，聽行政總裁田國強講，截至二十號，金豐‧鴻運喺上海嘅生意額已直迫十億元，其中有六億來自淮海路非常熱賣嘅商場舖位，上個禮拜五吸引六百人通宵排隊搶購，單日賣出近四百四十個舖位，佔總數九成。  至於成立銷售點唔夠一年嘅香港，本月份嘅生意額只係上海嘅十分之一，即係一億左右。 經紀曉鄉下話多條財路   中國幅員廣闊，除普通話外重有唔少「鄉下話」，下個禮拜十．一黃金周，將會有好多來自唔同省分嘅內地人嚟香港，利嘉閣就派出五名能操不同中國方言嘅員工，駐守青衣藍澄灣售樓處。  呢幾名代理噚日重即場示範講普通話、褔建話、圍頭話、上海話同客家話，介紹樓盤位置、環境、設計，同提供嘅服務。買家去到異地，遇到識講自己話嘅人，打破語言隔膜，倍感親切，買樓時話唔定會更爽手！     新地記者會遠赴熨波洲   標榜擁有無敵遊艇會海景嘅鴨脷洲深灣軒，享有先天地利，發展商自然就地取材，送買家遊艇會會籍。唔單止咁，市務總監林寶彤重話，呢個盤同其他中細價盤唔同，有明確嘅市場定位，就係新派豪宅，明顯迎合新一代追求居住質素嘅客群。  為令傳媒親身感受擁有遊艇會會籍嘅樂趣，噚日新地專程帶傳媒由香港仔遊艇會出發，乘船到淺水灣對開嘅熨波洲，喺清涼海風下舉行記者會，新地重話，深灣軒嘅海景達國際級水準，媲美澳洲嘅達令港同三藩市嘅梭塞里多。係咪真係咁國際級就見仁見智，不過，難得遊艇會提供消閒設施畀住客用，都幾吸引。 高密度建築環境評估香港成指標   由地產建設商會支持成立嘅香港環保建築協會，從97年開始推行嘅建築環境評估法以來，唔經唔覺已經有八十五幢樓被評分，或做緊評核，樓面計有成五百五十萬方呎，共二萬一千個住宅單位，其中住宅有二十一幢。  聽商界環保協會陳志強講，到目前為止，只有四個住宅項目可以攞到「優秀」級別。𠵱家評核緊嘅，有置地西環綠意居，同恒基西灣河碼頭項目。  香港環保建築協會秘書長譚安德話，由於香港市區物業都係以高密度發展，加上人口密度高，所以喺全世界評估此類建築上，成為重要指標。  蘭西  電郵地址： nancy@appledaily.com 
20030925-216,20030925,216,雅賓利貨尾2100萬沽,雅賓利貨尾2100萬沽 【本報訊】最近樓市暢旺，豪宅及大手買賣頻現。其中太古地產本周已售出第3個中半山雅賓利貨尾，最新一個為14樓A室，成交價2100萬元，面積2500方呎，呎價8400元，之前成交的兩個單位分別是28樓A室及7樓A室。     帝景園1500萬易手   同位於中半山的帝景園4座34樓B室，面積1970方呎，成交價1500萬元，較日前中國銀行以銀主身份售出，同座35樓B室高45萬元。  另市場消息透露，港島東半山玫瑰新邨B座頂層1室，2300方呎，成交價1033萬元，呎價4491元。大潭浪琴園4座高層B室，1906方呎，成交價990萬元，呎價5194元。  此外香港置業區域經理曹仲康表示，日前一買家斥資930萬元，分別購入大角嘴柏景灣及帝柏海灣各一戶。  另外，市傳何文田君頤峰獲一名本地投資者，以2億元洽購20至30伙。
20030925-217,20030925,217,嘉華豪宅送平治促銷,嘉華豪宅送平治促銷 【本報訊】市況雖然轉旺，發展商不忘添加優惠促銷。嘉華地產的何文田嘉多利豪園及汀九嘉御龍庭，下月7日前選購相連單位或獨立洋房，可獲贈價值50萬元平治E-240房車一部。中原地產並贈送1年價值1.8萬元汽車美容優惠。兩盤餘貨售清，料套現約2億元。  嘉華地產物業助理總經理方俊表示，現時，嘉多利豪園尚餘11套相連單位待售，分別為1874方呎的A及B室及2609方呎的C及D室。本月加價3%，呎價4800至5500元。分層單位尚餘8至9伙，該盤8月至今累售15伙。     嘉御龍庭尚餘4洋房   汀九的嘉御龍庭，尚餘4幢2889方呎獨立洋房，本月已加價3至5%，呎價4050元。  另外，同系的郝德傑道豪宅項目，因應近期市道轉活，近60幢逾2000方呎獨立洋房，意向呎價將提高5%，同時，計劃保留三分之一洋房予內地買家選購。
20030925-218,20030925,218,翠擁華庭連家具車位　會所設施多,翠擁華庭連家具車位　會所設施多 馬鞍山翠擁華庭，位置偏離區內市中心，加上毗鄰正進行基建工程，環境及景觀受影響，因而拖低樓價，在同區新樓盤中以平價見稱，200餘萬元已可選購3房大單位，並附有車位，對於經濟條件有限，需要換樓又想住新屋的家庭，尤具吸引力，今次介紹的正是這類尺碼的單位。  單位位處高層，897方呎，連車位開價230萬元。內櫳裝修不俗，屋主住得企理，並連家具放售，買家可省回不少開支。  客飯廳建假天花燈槽，訂做大櫃及飾櫃，配白色梳化及餐桌，效果清雅。兩間細房均建組合家具，其中一間利用窗台建睡床，慳位實用。  中原余志文表示，這個單位呎價2564元，雖高於市價一成，但扣除裝修、車位及全屋家具，叫價仍然合理，並有3至5%議價空間。其他放盤呎價2350元。  他說，近期成交有1座中層B室，面積1071方呎，8月作價228萬元，呎價2129元。  記者：溫潤潔　攝影：司徒世華
20030925-219,20030925,219,樓市精點,樓市精點 寶翠園蝕200萬轉手   ▲世紀21曾應豐稱，西半山寶翠園一期3座極高層G室，面積957方呎，成交價480萬元，呎價5016元，買家為投資者，作收租之用。原業主於去年以680萬元購入，是次成交蝕200萬元。  ▲世紀21鄭智鐘說，柴灣杏花邨上周錄得4宗成交，其中5座中層2室，面積732方呎，以200萬元易手，呎價2732元。另一宗為低價成交，15座低層3室，面積709方呎，成交價175萬元，呎價2468元。  ▲中原張栢華表示，馬鞍山海典灣連續錄得兩宗成交，3座中層B室1048方呎以322.8萬元易手，呎價3080元，另外2座高層C室，面積1045方呎，成交價345萬元，呎價3301元。     加州花園投資者掃兩屋   ▲中原黃春華說，一名居於元朗錦綉花園的投資者，3天內連購兩間同區加州花園獨立屋，芙蓉徑雙號屋，1463方呎連600餘方呎花園，260萬元，呎價1777元，該名買家日前已斥378萬元，購入翠柏路單號屋，面積1768方呎，呎價2138元。  ▲卓先市場研究部指出，今年第三季港島商廈交投活躍，過去3個月港島區共錄得163宗商廈成交，較去年同期158宗上升3%，總成交金額由9.36億元，增至逾22.4億元，升近一倍半。     美孚新邨交投增近九成   ▲利嘉閣譚麗芳表示，荔枝角美孚新邨本月至今錄得39宗成交，較上同期21宗升約86%，平均呎價上升約3%至1800元。剛成交的六期蘭秀道46號中層H室，面積760方呎，成交價115萬元，呎價1513元。  ▲利嘉閣資料顯示，今年截至本月15日，全港舖位買賣登記有1544宗，較去年同期1413宗升約9.3%。交易總額約98.6億元，較去年同期增約25%。  
20030925-220,20030925,220,城電促先解決互連問題,城電促先解決互連問題 就電盈（008）申請撤銷商業固網電話主導者地位一事，城市電訊（1137）兼香港寬頻主席王維基認為，電訊管理局應先解決固網第2類互連的問題，然後才審核是否撤銷電盈的主導者地位。  他表示，電管局在審批電盈的申請，應作出公平判決，因為縱然電盈的固網市場佔有率跌至低於80%，該公司未來亦可利用其他的減價手段，令市場佔有率回升。     否認覆蓋率達83%   他希望電盈在提供減價優惠時，應該全面給予全港用戶，而非選擇性進行。另外，他又否認城電目前的話音服務覆蓋率已達83%，並認為若取消第2類互連，對消費者及整個行業都不利。
