key,date,article_daily_id,title,text
20031202-0,20031202,0,廢鐵內人叠人　消防劏車搶救房車狂撼櫃車3死,廢鐵內人叠人　消防劏車搶救 房車狂撼櫃車3死 【本報訊】沙田大埔公路昨傍晚發生「炮彈飛車」奪命車禍，一部載有三名裝修工人的私家車在拐彎時懷疑高速下失控，越過對面行車線與一部四十呎長的貨櫃車迎頭相撞。由於衝力猛烈，私家車如「以卵擊石」被夾在鐵欄與貨櫃車之間，遭拖行二十呎始停下。車禍中，私家車內三人被困在毀爛不堪的車廂中，毫無反應「人叠人」壓在一起，消防要剪開車身始能將三人救出，但三名傷者送抵醫院證實不治。　記者：黎家駒　陳偉良　薛家傑 在車禍中同時罹難的三名男子包括司機鄭尚賢，三十四歲，前座乘客葉偉林，三十九歲及後座乘客林育輝，四十歲。據稱，三名死者均從事裝修工作，事發時剛在馬鞍山收工，由鄭尚賢駕車首先送住在九龍城的林育輝回家，但中途卻遇上車禍同告喪生。三名死者的家人及工友接獲噩耗趕至醫院，各人均黯然神傷。  肇事私家車為九五年出廠、俗稱「掃把佬」的富士牌（SUBARU）私家車，型號為ImprezaWRX，引擎容積2000cc，當年車價約值三十五萬，為駕車男子鄭尚賢所有。     被拖行20呎   事發昨傍晚六時許，該部載有三名男子的富士私家車沿沙田大埔公路出九龍，途經大旗嶺段近沙田花園對開時，突然失控越過對面行車線，與一部迎頭駛至落斜的四十呎長貨櫃車相撞。目擊者稱，當時肇事私家車車速頗高，先撞向貨櫃車的右邊車頭，然後撞斷路邊兩截鐵欄，「攝」入貨櫃車與鐵欄之間形同「三文治」。兩車相撞後，由於貨櫃車落斜關係一直衝前，將私家車拖行二十呎外始停下。  私家車肇事後全車毀爛不堪，車上三人重傷被困更互相叠着，貨櫃車司機則幸告無恙，由路經的司機協助報案。消防到場發現私家車兩邊車門凹陷，夾於鐵欄與貨櫃車之間，一時無法將傷者救出，惟有利用工具首先將車頂剪開救出第一名傷者，另亦分別撬開擋風玻璃將其餘兩人抬出，整個拯救過程約為二十分鐘。三名傷者獲救時已無吸呼及反應，經送院搶救均證實不治。 非交通黑點   據貨櫃車五十歲姓江司機事後指出，事發時他正將一個貨櫃送往沙頭角，發現一部私家車迎面衝來已即時煞掣，但仍撞到對方車輛及拖行二十呎。他表示，自己擁有車牌已多年，駕貨櫃車亦超過十年，從未發生過如此嚴重的交通意外，警方事後為江進行酒精測試，證實他並未有飲酒。  警方透露，奪命車禍現場並非交通黑點，車速限制為五十公里，由於肇事私家車並無煞車痕迹，警方調查後懷疑私家車在高速下入彎失控，而釀成今次的嚴重車禍，事後將兩部出事車輛拖走等候檢驗。
20031202-1,20031202,1,擲8600萬購豪宅　「上海首富」響名堂開燉品店稱年賺千萬,擲8600萬購豪宅　「上海首富」響名堂 開燉品店稱年賺千萬 周正毅與毛玉萍這對由上海來港掘金的是非男女，發迹過程離奇，由大富大貴到被扣押拘控，經過更是峯迴路轉。     周正毅列富豪榜49位   自言在上海開雲吞麵店賺到第一桶金的周正毅，曾被《福布斯》雜誌列為中國富豪榜第四十九位，他為港人認識始於九九年以八千六百萬元超高價購入渣甸山白建時道巨宅，由於出手豪爽令地產界嘩然，「上海首富」之名亦不脛而走，加上他與多名娛樂及社交圈名女人包括章小蕙、張東琳及楊恭如等友好，令其經常成為各報章娛樂版焦點人物。     利用貸款作多項收購   周正毅平日愛戴名表亮相，其座駕亦盡顯暴發身價，他是上海第一架名車法拉利的車主，在香港出入不是坐賓利便是林寶堅尼。至於他如何致富，外間相信主要得力於毛玉萍，因為毛玉萍在上海人脈甚豐，與中銀香港前任總裁劉金寶早建立了交情，帶挈周正毅可獲貸款在港進行多項收購，高峯期集團有四家分別在香港及上海上市的公司，資產值報稱高達一百五十億元。  毛玉萍九四年在上海開設阿毛燉品店，她經常強調燉品店生意極好，每年可賺逾千萬元，成為兩人進軍股市的本錢，透過炒作股票及收購國企職工股令兩人身家更上層樓，根據資料，兩人早在九二年已在港置業，購入北角海峯閣一單位，後來透過把單位按揭籌措本錢做生意。     毛曾戴11卡鑽戒亮相   在兩人愈來愈富貴之時，毛玉萍在香港社交圈亦日趨活躍，每逢有香水、名表或珠寶首飾展覽的派對，她總是座上客，例必一身名牌時裝、手袋再配上價值連城的珠寶現身，最誇張一次是戴上一枚十一卡重的鑽石戒指到場，氣派十足，○一年四月她又投資六百萬元，在銅鑼灣開設三層的美容中心，但自六月初她被廉署邀請助查，即絕迹Ball場，昨日正式遭控告，周、毛兩人的發達神話終於破滅。  本報記者
20031202-2,20031202,2,上地5300萬元遭人調走,上地5300萬元遭人調走 【本報訊】上海地產主席周正毅今年中在內地被捕後，該公司的帳目問題逐步浮現，今次周氏紅顏知己毛玉萍的親信、上地董事龔倍穎被控盜竊及偽造帳目罪名，涉及五千三百萬元，其實早在上地較早前的通告中已略見端倪。     股價曾高位徘徊   周正毅出事後，上地於六月被安永會計師事務所合夥人廖耀強及楊文安接管，開始審查公司帳目。今年七月中，接管人入稟高院，向一家在英屬處女島註冊的離岸公司GreatCenterLimited（簡稱GCL）追討五千三百一十五萬元。及後公布指出，三月底上地通過出售旗下無線技術公司，於四月一日收取一億零一百六十八萬元，但三日後其中五千三百一十五萬元卻在沒有合適理由下被轉滙予GCL。  GCL已於上月初被英屬處女島法院頒令清盤。不過，由於周正毅已透過律師，要求撤去上地接管令的訴訟尚未解決，令GCL的清盤工作受阻延。  至於今次毛玉萍被指與其私人助理鍾秀玲及兩名經紀，於去年六月至今年五月期間操控上地股價，資料顯示上地在期間的股價大部份時間都在高位徘徊，以去年六月至十月初而言，股價介乎八角至九角，其中七月十二日收市價更達九點三角的新高，但今年初開始逐步回落，之後股份停牌至今。
20031202-3,20031202,3,周正毅與女星屢傳緋聞,周正毅與女星屢傳緋聞 周正毅和密友毛玉萍來港不久，便在名人圈和娛樂界大受歡迎，先是經英皇老闆楊受成介紹，認識不少娛樂圈中人，周正毅二人先後與張東琳和陳雅倫結拜為契妹，跟富豪劉鑾雄、何柱國、名媛榮文蔚、章小蕙等亦稔熟。     楊恭如遭少婦掌摑   周正毅今年年中被內地政府扣查後，毛玉萍亦在六月一日被本港廉署拘捕，四十八小時後，獲准以五百萬現金和五百萬人事擔保外出。毛玉萍在保釋期間，富商好友劉鑾雄曾五次到其位於渣甸山的寓所探訪，劉鑾雄表示只是往探朋友，他跟周正毅二人並沒有生意上往來，之後契妹陳雅倫曾公開力撐，表示無論發生任何情況都會支持毛玉萍。  周正毅自高調出席公開場合後，緋聞亦隨之增加，先後跟章小蕙、陳雅倫和張東琳傳緋聞，其中周正毅和楊恭如的緋聞傳得最盛，去年十月楊恭如曾被一少婦在銅鑼灣一咖啡店內掌摑，毛玉萍在事件發生後表示不介意周正毅結交異性，指只是生意應酬。當周正毅被捕後，楊恭如即跟他劃清界線。  毛玉萍昨日被廉署落案起訴後，身為她契妹的張東琳，昨日接受本報電話訪問時說：「我啱啱喺上海返嚟，都唔知乜嘢事，如果件事係真，喺呢個時間都唔應該打去煩佢，或者遲啲先打電話問候佢。」  本報記者
20031202-4,20031202,4,削減31職位　荃灣區亦擬合併深水埗三警署縮併兩個,削減31職位　荃灣區亦擬合併 深水埗三警署縮併兩個 【本報訊】警隊面對未來五年需節省百分之十一開支的壓力，決定擱置興建大角嘴警署，並計劃在明年重組深水埗警區，將區內的三個分區警署併為兩個。按計劃，石硤尾分區將會合併到長沙灣和深水埗兩間分區警署，預期可削減十七個來自警司級、督察級及警署警長的職位，但同時需增加十名警員。　記者：譚暉　林社炳 深水埗警區指揮官孔百德昨日在深水埗區撲滅罪行委員會會議上，解釋重組警區的安排，但委員憂慮合併警區後，警隊能否維持足夠警力，打擊深水埗區嚴重的賣淫問題。不少大角嘴住戶也對取消興建大角嘴警署，感到失望。     報案室仍會運作   據警方向委員會提交的文件顯示，石硤尾分區警署併入另外兩間警署後，石硤尾警署的報案室會繼續運作，而警署則會供警察機動部隊及總區總部不同單位使用。另外，該區會提供一隊區青少年及學校隊，針對犯案或受害的青少年。  據安排，合併後警隊可削減十七個紀律人員職位，督導級人員（特別是分區指揮官和助理分區指揮官）的工作量將增加；同時可削減十四個文書職位。  因為削減職位而節省的資源，則會用以增設其他區的巡邏警員、加強特別任務隊，增加區內交通隊以應付西鐵通車及西九龍填海區的發展。     旺角警區受影響   文件又指出，自九八年港府推行資源增值計劃後，警隊即透過警察分區合併計劃，減少行政上的「尾巴」，但又同時保持行動上的「牙齒」。至今屯門、沙田、九龍城及東區警署已落實分區合併，警隊正考慮荃灣作合併警區安排。  另外，由於西九龍填海區不斷發展，原定興建一個新的、連同西九龍總區總部在內的大角嘴警署，並增設超過三百個職位的計劃，亦已被削減。文件承認，這項安排對旺角警區的地方使用，構成非常嚴重的問題，因為該警區現時除容納警區人員之外，還有警察機動部隊及衝鋒隊。 憂妓女問題嚴重   深水埗撲滅罪行委員會委員黃鑑權說，委員最擔心的是合併計劃會否令到石硤尾區居民，要報案時更不方便，因此委員會歡迎警方決定繼續使用石硤尾警署的報案中心。另外，他憂慮合併後的深水埗警區，未必能維持足夠的警力，打擊區內猖獗的妓女賣淫問題。另外，他指有委員在會上質疑，削減了警隊管理層的職位，能否維持應有的服務質素。
20031202-5,20031202,5,四區落實合併計劃,四區落實合併計劃 現時全港共有二十二個警區、共五十四個分區，歸納在香港島、九龍東、九龍西、新界南、新界北及水警六個總區管轄之下。個別分區的警員編制及實際人數，取決於區內人口、分區工作量和整體罪案情況而定。  警隊早在四年前推出警署合併計劃，至今分別在屯門、東區、沙田、九龍城區落實。深水埗及荃灣警區將分別在明年及○七年落實計劃。
20031202-6,20031202,6,曾達成和解協議　指銀行拒認權益塑膠大王兩子爭五百萬存款,曾達成和解協議　指銀行拒認權益 塑膠大王兩子爭五百萬存款 【本報訊】上市的開達集團有限公司創辦人「塑膠大王」丁熊照於七六年去世，遺下六名子女，其子丁介壽去年離世後，兩名兄弟為了二十多年前一筆五百多萬元銀行存款爭訟，昨日並入稟高等法院，要求頒令聲明戶口中結存為三兄弟平均擁有，各持三分之一權益。     一人去年離世   原訴人分別為丁眉壽和丁烱壽，被告人為上海商業銀行（下稱「上商」）、丁強愛娣及丁介壽的遺產。入稟狀指出，開達實業有限公司創辦人丁熊照與妻子丁強愛娣育有六名子女，包括午壽、鶴壽、眉壽、烱壽及介壽及女兒月壽，丁強愛娣已於八六年去世，丁介壽則於去年十月離世。  入稟狀續指出，丁強愛娣與三名兒子眉壽、烱壽和介壽共同擁有一個在「上商」的聯名戶口，規定必須四人簽署，才能操作帳戶。八○年五月，銀行結存約共五百一十多萬元；至八一年初，介壽與眉壽及烱壽雙方，為母親是否獨自擁有該帳戶起爭議。  雙方最終於八一年三月由丁母簽訂和解協議，並將協議內容知會「上商」，訂明將存款戶口的結存分成三份，每份約一百七十萬元，由介壽、眉壽和烱壽分別擁有，根據和解協議，丁強愛娣並無得益，上述三子以帳戶持有人身份，均分帳戶內金錢，惟銀行方面錯誤地拒絕接受眉壽和烱壽各獨立擁有至少三分之一的帳戶權益。     要求銀行賠償   入稟狀又稱，即使和解協議不獲接納，根據該戶口的原有條款，丁母及介壽去世後，兩人在戶口的權益，亦應依法終止，戶口結存的權益應由眉壽和烱壽共同擁有，但銀行卻錯誤地拒絕原訴兄弟的申索，兩人因此蒙受財政損失，故現向銀行興訟，要求法院聲明兩人各持有三分之一的權益，或戶口中結存全歸兩人，並作出有關賠償。  案件編號：HCA4392/03
20031202-7,20031202,7,丁熊照創「一條龍」生產,丁熊照創「一條龍」生產 有「塑膠大王」之稱的開達實業集團創辦人丁熊照，早年在內地從事塑膠電筒生產業務，其後遭逢戰亂，於五十年代帶同資金及技術來港開廠，轉營生產模型火車等。公司漸趨多元化，創製塑膠工模配合大規模生產的「一條龍」生產模式，奠定塑膠王國的基業，於玩具業內具有領導地位。  祖籍無錫的丁熊照，於七六年去世，由兒子接掌家族生意。遺孀丁強愛娣曾因家事告上法庭，於開庭前獲友好調停，和解收場。     椰菜娃娃暢銷   開達於八十年代生產椰菜娃娃，令營業額更上一層樓，公司並於八四年上市。  年屆七旬的丁鶴壽，現為開達集團主席，其弟午壽憑功能界晉身立法會，亦打理家族玩具廠生意。  本報記者
20031202-8,20031202,8,救出不省人事　懷疑有人衝燈男子騎萬元單車捲輕鐵底拖17米,救出不省人事　懷疑有人衝燈 男子騎萬元單車捲輕鐵底拖17米 【本報訊】屯門青山公路與五柳路交滙處，昨午發生輕鐵與單車相撞意外，騎着價值逾萬元落山單車男子連人帶車被輕鐵撞倒後，復被捲入車底推前十七米重傷昏迷，經救出送院急救情況危殆，輕鐵上無人受傷。警方正調查是否有人衝交通燈肇禍。  由於發生車禍的關係，輕鐵洪水橋至藍地站一段（共四個車站）服務受阻約一小時，輕鐵四條行車線需要改道，並迅速派出接駁巴士，疏導受影響乘客。  車禍受重傷男子姓林（五十一歲），頭部受重創，被救出時已不省人事，單車損毀不大嚴重。     與輕鐵同方向行   據現場消息稱，事主騎乘的為英國牌子GT組合式落山單車，波速前三後九合共二十七個波，頭尾車輪俱配置碟形「啤叻」，兼備落山及上山功能，新車售價至少逾萬元。  事發昨午三時四十六分，一輛編號六一四號線的輕鐵列車，沿屯門蝴蝶邨對開青山公路向元朗行駛，一名男子則騎着一輛落山單車，與輕鐵同一方向而行，當駛至五柳路交界處時，據輕鐵姓林司機（四十歲）表示，當時行車燈號為綠燈，該名男子突騎着單車由青山公路左轉駛入五柳路，輕鐵司機立刻緊急煞掣，車頭仍將男子連人帶車撞倒及捲入車底。     四百人候接駁車   警員及消防救護員到場，將被困輕鐵車頭下男子救出，男子頭部受重傷，救護員為他初步急救後，用救護車將他送院救治。  警員在場調查意外起因，並將夾於輕鐵車底的落山單車取出查驗。由於現場為交通樞紐，意外發生後，附近一段輕鐵服務受阻，輕鐵要調派多輛接駁巴士，穿梭行走於洪天路緊急月台與西鐵兆康站之間，疏導受影響的乘客，其中在兆康站，一度聚集四百多名等候乘搭接駁巴士的乘客，但很快被疏導。直至下午四時四十分，輕鐵服務才恢復正常。
20031202-9,20031202,9,車主眼前　賊搶HH4444平治,車主眼前　賊搶HH4444平治 【本報訊】一輛配上特別車牌「HH4444」的平治房車，昨凌晨在何文田窩打老道疑因車主貪方便，落車提款沒有拔去車匙，就在他背轉身的數分鐘內被獨行賊伺機偷車逃去，車主一度乘的士追截，但瞬間失去蹤影報警求助。     「發發世世世世」   運輸署發言人稱，「HH4444」屬於特別車牌不能轉讓一類，最後一次公開拍賣為九七年十一月八日，成交價六萬一千元。  根據車牌登記資料顯示，現時配上「HH4444」車牌的藍色平治CLK200款房車的車主，是九龍集郵中心有限公司於○○年以四十一萬元購入。  九龍集郵中心有限公司負責人蔡芳祥是集郵發燒友，其後寓工作於娛樂，發展郵票業務，至今累積超過二十年經驗，是資深郵票專家；案發時，平治房車由其子蔡名業（二十四歲）駕駛。據蔡名業事後表示，家人選購該個特別車牌，在於「H」是英文字母中排行第八，而他們是福建人，「4」字發音為「世」，車牌寓意為「發發世世世世」。     下車提款未拔匙   警方稱，昨凌晨零時，事主駕駛平治房車載同女友在窩打老道與培正道交界處的銀行外停下，疑他貪方便沒有拔去車匙，結伴落車在路邊的提款機提款。此時，一名年約二十歲的青年火速跳上車，啟動引擎離去。  事主大驚慌忙乘的士追截，但追出二百多米便失去對方蹤影，只好折返現場致電報警求助。事主與女友兩部共值四千元的手提電話，與及女友的手袋也在車上一併被偷去。
20031202-10,20031202,10,長期拒絕進食　暴瘦大量脫髮80磅重厭食症女子病危,長期拒絕進食　暴瘦大量脫髮 80磅重厭食症女子病危 【本報訊】潮流興瘦身，女士們都以為「瘦身就是美」。北角一名患上厭食症、體重只有八十磅，體形儼如「火柴人」般暴瘦二十八歲女子，昨日疑身體極度虛弱在睡夢中昏迷不醒，幸父親及時發現報警送院搶救後已經甦醒，但脆弱生命危在旦夕。　記者：梁偉權 關注本港厭食問題的中文大學精神科學系教授李誠醫生昨日指出，瘦身減肥成為社會風氣，事件已敲響進食失調問題的警鐘，其實近年瘦身纖體廣告鋪天蓋地而來，青少年最易受到瘦身文化影響，月前一項調查發現近年患上厭食症個案激增，現時本港約有一成年輕人出現厭食或暴食傾向，最年幼厭食症患者更只得十歲。他強調，節食或吃藥減肥並不健康，呼籲市民瘦身之餘更要顧及健康。     氣溫急降誘發病情   李誠醫生補充，厭食症患者會拒絕進食達致減肥效果，結果出現心跳、血糖、體溫及身體電解質降低現象，引致生理機能失調，加上過去兩日氣溫急降，病情嚴重者可能因身體虛弱休克昏迷，而長期嚴重營養不良患者更可能引致骨質疏鬆，甚至有生命危險。  李誠解釋，六成厭食症患者都可能同時患上抑鬱症，所以患者應即時求醫，由精神科醫生安排治療。  患上厭食症命懸一線女事主姓黃，二十八歲，與家人居於丹拿花園一座一單位，其父事後到達醫院，一直憂心忡忡守候女兒病榻旁陪伴，希望女兒吉人天相早日康復。     遲未起床父揭昏迷   據知，女事主本身不算肥胖，但年前體重暴跌，經醫生檢驗證實患上厭食症，由於她長期拒絕進食致營養不良，身體極度虛弱，本來嬌小身軀更顯得瘦削，外形如同「火柴人」，不但體重暴跌，而且面容枯槁，暴瘦面頰凹陷致顴骨凸現、頭髮更大量脫落變得稀疏、估計體重不足八十磅。  昨晨八時許，女事主遲遲仍未起床，其六十歲父親擔心女兒安危入房查看，赫見女事主昏迷倒卧床上毫無反應，慌忙報警求救。救護員趕至替女事主急救後，女事主漸漸恢復知覺甦醒，發出微弱呻吟聲，隨即送院搶救，現時情況危殆，留醫深切治療部搶救。  近年不少女星受聘擔任纖體廣告代言人，其實瘦身風早已吹襲娛樂圈，女星袁潔瑩於一九九四年曾因減肥患上厭食症，病情最嚴重時體重跌至只得七十磅，對於再有婦女患上厭食症，袁潔瑩以過來人身份呼籲「當日以為減肥瘦身就是靚，其實大錯特錯，為此患上厭食症更是不值得！」
20031202-11,20031202,11,三死者都是家庭支柱,三死者都是家庭支柱 【本報訊】一宗交通意外粉碎三個家庭的經濟支柱，在沙田威爾斯親王醫院內及急症室外，瀰漫一片愁雲慘霧，有家人拿着死者的遺物，苦思良久沒有甚麼反應。  三名死者包括車主兼司機鄭尚賢、乘客林育輝及葉偉林，其中以鄭尚賢的家人最為傷心。他的父母、兄長和妻子很早趕到醫院，鄭妻聞夫死訊不斷飲泣，不時以禦寒頸巾拭淚。  「我哋嘅心情好差，唔好再問我嘢。」白頭人送黑頭人的鄭父，語氣變得更為無力，及後鄭父接回亡兒的一袋遺物，包括血衣、銀包、背囊等，他拿住遺物托頭沉思，記者再問他一些問題，已沒有甚麼反應。  鄭母縮於一旁滿眼通紅，由其他親友安慰，想不到鄭尚賢在世上走過三十四年的人生，生命就此結束。     工友感慨人生「化學」   至於林育輝則有一名胞叔到醫院了解，他說：「育輝嘅一家大細全部喺大陸，細節就唔方便講，但佢的確係家庭經濟支柱，唉……」林的胞叔看完屍體出來，不斷搖頭，稍後領回姪兒的一袋遺物，雖未落淚，但亦非常難過。  另一死者葉偉林，由其胞兄認屍，他出來後特別煩惱，記者問他亡弟家庭狀況，他欲言又止，忽然說：「我冇嘢同你哋講嘞。」  與三名死者共事約十名工友，先後趕來醫院。部份人向死者家人慰問，部份人站於醫院門外商討後事，他們知道當時是由司機鄭尚賢接送林育輝和葉偉林返家，豈料途中出事。部份工友感慨說，人生很「化學」，白天時仍看到三人「活生生」，晚上已人天永隔。及至晚上十時半，死者家人及工友全部離開醫院。  近期，大埔公路沙田嶺段幾乎沒有發生嚴重交通意外，但昨日一次意外就奪去三人寶貴生命。
20031202-12,20031202,12,過度瘦身節食致病,過度瘦身節食致病 中文大學精神科學系教授李誠醫生指出，厭食症（Anorexianervosa）屬於進食失調問題，患者主要因瘦身節食而引起，加上受到其他壓力影響引致，部份患者更會出現「暴食型厭食症」，在進食後扣喉嘔出食物。他警告，長期厭食症患者會因營養不良，出現貧血、心跳及血壓降低，情況嚴重者更可能致命。  李誠續稱，厭食症患者發病年齡由十二至二十歲，女性患者比例更是男性十倍，有需要市民可致電香港進食失調中心，電話：21445838求助。
