key,date,article_daily_id,title,text
20031119-0,20031119,0,准存人民幣　准換人民幣　准匯人民幣　准刷人民幣卡人民幣救港,准存人民幣　准換人民幣　准匯人民幣　准刷人民幣卡 人民幣救港 【本報訊】中央再次送大禮給香港，以支持特區經濟。特首董建華昨日正式公布，本港銀行可於明年元旦前後開辦個人人民幣業務，到時本港市民可以在銀行開戶口存人民幣，又可到銀行把人民幣兌換回港元，可把人民幣直接滙到內地，既方便又安全。內地人則可在港刷卡消費。　記者：劉美儀、丘倩瑜 新措施對本地商戶利益更大，除了可以無限量將收取的人民幣兌換外，中央批准五億張內地扣帳卡及信用卡的持有人，可在港刷卡消費，勢必帶來大量生意，令內地人每年在香港的四百億消費額，隨時可望翻一番。     本港商戶受惠較大   根據中港今日簽訂的諒解備忘錄，本港市民明年開始，可透過銀行享用一連串人民幣服務，包括存款、兌換、滙兌及申請人民幣卡。銀行公會主席柯清輝昨日表示，今次公布的方案「比想像中重好」，譬如人民幣存款不設上限，令他感到「好驚訝」，因這是很重要發展，他相信本地對人民幣服務需求量會很大。  到底這些新措施對本港市民有多大好處呢？有銀行界及學者認為，在本港極低息的環境下，人民幣存款無疑可讓消費者多一個息率略高的選擇，但吸引力只屬一般；商戶則受惠較大。學者認為，本港獲准試辦人民幣個人業務，對提升本港作為國際金融中心地位、中港之間資金融通橋樑，以至刺激本地個人消費，都是重要及非常好的開始。     人民幣存款息率高   人民幣存款息率較港元高，根據滙豐銀行在內地提供的息率，人民幣活期儲蓄存款利率零點七二厘，三個月和六個月定期存款則分別為一點七一和一點八九厘，至於更長達一年、兩年、三年及五年期存款息率，則順序為一點九八厘或以上。不過，柯清輝表示，香港銀行可提供的息率無疑較內地低，因為涉及較多的手續，但也要視乎市場競爭。  美國運通財資市場主管陸庭龍表示，人民幣利率無疑比港元的接近零息率存款高，但是與澳紐貨幣存款息率高至五厘半相比，仍有距離。雖然有投資者可能會炒人民幣升值，但是他提醒投資者，必須考慮人民幣尚未全面兌換，而且升值概念最終未必能兌現。 新措施另一項好處則是剌激內地居民來港消費，特首董建華及財政司司長唐英年也強調此點，但數量有多大呢？經濟學者普遍認為不能作出預測，但金管局總裁任志剛昨日估計，「初期供求量應不會太多」，目前粗略估計，內地居民在港消費每年約四百億元，而本港居民在內地消費需求亦達三百億元。     八百億人民幣流通   此外，受惠者當然包括銀行，銀行界稱，若只開辦有關四項服務，賺取的收益很有限，關鍵是上述提及的人民幣存款、兌換及滙款的推行，前提是先由人民銀行先透過金管局挑選，並委任出一間本港銀行，擔任人民幣清算行，時間則要今年底才落實。  渣打銀行董事王冬勝則估計，目前人民幣在港流通的數量介乎五百至八百億元間。因此，有業界指出若擔任清算行，賺取的利息雖不高，但因基數較大，故三大銀行（滙豐、中銀香港、渣打）俱力爭此項職務，盛傳是大熱門的中銀香港股價昨日更創上市以來新高。  至於負面影響，有學者指日後人民幣業務做得更佳，未來業務範圍再擴張，可能影響中港兩個金融體系政策的發展；但任志剛昨日指出，包括滙率穩定等因素，是長線的考慮，但目前他不認為有關推出的人民幣業務會對人民幣滙率構成影響。
20031119-1,20031119,1,變相撤現鈔限制　料刺激消費市道准許刷卡消費零售業叫好,變相撤現鈔限制　料刺激消費市道 准許刷卡消費零售業叫好 【本報訊】對於人民幣新政策，本港零售商均表示歡迎。除了可令商戶無限額地把收到的人民幣兌換回港幣，准許內地人在港刷卡消費，更將帶來大量生意。目前，內地人來港自由行，只准帶六千元人民幣，限制了消費力，他們只有極少數人可用內地銀行發的國際信用卡在港簽帳，但新政策下，一般內地人持有的內地信用卡及扣帳卡（估計達五億張），也可在港使用，絕對有利港商。據估計，內地人一年在港的消費額達四百億元。　記者：陳健文 今次獲批准試辦的人民幣業務，其中容許商戶享受人民幣兌換服務，據悉這是港方成功爭取的一項重要優惠。消息人士稱，本港商戶到銀行兌換的人民幣金額，沒有如個人客戶般設置上限，原因是此舉對刺激消費市道有幫助，因為政府發現在自由行開始後，餐飲、住宿及提供購物等消費服務的商戶，每日都可能收到大量人民幣現鈔，若規定他們與銀行的兌換上限，可能珠寶店舖售出一件首飾所收的人民幣，已超出規限，因此力爭有關服務及不設限。     研究配合人民幣信用卡   在本港擁有逾七十間分店的服裝連鎖集團佐丹奴，其主席助理羅翠妍表示，雖然集團每日只收到很少量人民幣，但有關政策簡化了在本港兌換人民幣的程序，將能增加集團效率，集團亦會開始研究怎樣配合日後人民幣信用卡的使用。  從事鞋類產品銷售的美麗寶，其董事副總經理吳民傑亦認同，有關政策將能為本港零售業帶來極大的便利。  他表示，開放在本港使用人民幣信用卡的政策，將能間接地增加內地旅客在本港之高消費額，整體零售業都可受惠。目前，美麗寶於本港總共有近百間店舖。 擁有及經營逾百間OK便利店的利亞零售，其行政總裁楊立彬亦對新政策表示歡迎，因為新政策可省卻了集團要自行將人民幣兌換成港幣的工作，亦可盡量減少因兌換而出現的不必要的滙兌損失。人民幣信用卡方面，他指由於便利店一般的交易金額較細，料對業務沒有影響。  於本港有逾十年經營歷史的崇光百貨，其發言人指集團歡迎有關政策。發言人表示，雖然集團早已在百貨店內設有人民幣兌換櫃位為顧客提供兌換服務，但放寬可使用人民幣信用卡，將對營業額造成刺激，再者以信用卡進行交易亦較為安全。  經營Wanko及Veeko兩個品牌的威高國際，其主席鄭鐘文表示，有關政策對本港零售業絕對是一件好事，因為放寬在港使用人民幣信用卡，即代表增加內地旅客在本港的消費上限。  他表示，集團在個多星期前經已開始著手研究，於本港使用內地信用卡的可能性。     可減少兌換現鈔上損失   以金廁所而聞名的恒豐金業科技，每日收取的人民幣收入數以十萬元計，其總裁伍綺媚指本港銀行可容許兌換人民幣，除了為本港業務帶來經營上的便利外，更可增加了集團調配資金往內地的靈活性，亦可減少因兌換而出現的滙兌損失。  另一珠寶行連鎖集團、六福集團董事兼財務總監羅添福則預料，本港銀行經營人民幣業務後，有助集團明年營業額增加超過一成。
20031119-2,20031119,2,一念之間,一念之間 香港政策透視 邵家臻 就算是最迂腐無能的官員都不敢說天水圍官立中學在兩年內有四名學生輕生，是件個別事件，毋須急迫作出反應。雖然我們努力迴避，但事情明顯沒有好轉，「自殺」已成為香港社會的特有議題，是存在於社會筋骨肌理裏頭的一根刺。當我們仍貪生怕死，怕得不敢正視生與死，未有勇氣實踐死亡教育的時候，人們對死亡的迷思，只會不斷蔓延、擴散，而我們只是軟弱得無法招架。     正視死亡慾望   悲劇發生，愁雲慘霧。心理學專家紛紛走出來說世上真有一種自殺徵象，要用上最緊密的偵察工具，如問卷要找出潛在個案，相信有自殺傾向的青少年，在填寫一格格的問卷時，自會將輕生念頭走了光。我不知道問卷是否如此力大無窮；我更懷疑「潛在的自殺念頭」是否一種客觀特質，清晰而穩定地存在。 我自己知自己事，「輕生」於我是種常設的想法，一生一滅，都在瞬間，於是乎人人都是潛在自殺者；人人都不是潛在自殺者，要圈定「誰」來專門治理，我怕只是圈來圈去，愈圈愈大，圈了等於沒圈。  這是兩層的黑箱。第一層是對死亡的忌諱，只講生命色彩，不講「死亡慾望」；強調生命意義，忽視死亡也有其引誘。第二層是對「自殺念頭」的誤認，看不見「念頭」本身是種流動、易變的東西，一念而至，一念而逝。一念之間，究竟是怎樣的一回事？     分享個人經驗   一念之間，應該是你我他共同經歷過的事，人生不如意事十常八九，曾經想垂手放棄，但後來因為一種執念而重拾信心，這不是甚麼奇迹的怪東西，而是你我他都在營役中出現過的事。若果我們可以放下專家、放低問卷、放開心中的忌諱，分享一下一人一個「死過翻生」的故事：「我差點放棄，不過……」，至少它聽起來是人味多了，掙扎多了，血肉經驗多了，而不是一味的活力陽光，永遠樂觀，天塌下來當被蓋。  如果生命真的有「天使」這種東西，那一定是見過試探、走過試探、掙扎對試探的一類人。
20031119-3,20031119,3,和記寬頻上網頻斷線求助無門,和記寬頻上網頻斷線求助無門 本報過去兩個月共接獲二十四宗針對和記環球寬頻服務投訴，包括寬頻上網速度極不穩定、經常斷線，動輒一斷數日，由於已簽定合約，若中途終止使用會被視為毀約，惟有向客戶熱線求助，但熱線不是無人接聽，便是「十問九唔應」，有冤無路訴。由於投訴人居住地區不盡相同，顯示並非個別地區線路問題。 其中居於元朗朗庭園的李先生向本報投訴時稱，「我算好彩只係停咗三、四日，我個鄰居成兩禮拜上唔到網，打去客戶服務熱線，起碼等半個鐘至有人聽，聽電話嗰個又乜都唔識答。」  他指出，斷線情況其實時有出現，他留意不少網友在互聯網上留言，十居其八都對和記寬頻服務有不滿。  馬鞍山海栢花園住戶王先生，今年九月才開始使用和記寬頻，「足足十四日上唔到網，打去熱線一個星期後至有人覆」。  本報將其投訴轉介和記後，終獲回覆，解釋是「機樓甩線」。「佢哋服務真係好離譜」。     「一日斷線四次」   居於荔景荔欣苑的高先生，一口氣向本報訴說使用和記寬頻的「激氣」事：「成日斷線，最誇張係一日斷四次，一停就四個鐘，不斷打去熱線投訴，佢哋有派人來整，但係整完無幾耐又係咁。」  和記環球發言人的解釋，一如過往答覆同類投訴：公司近日進行系統提升工程，並於不同時段在各區進行，其間可能會對用戶造成影響，但因「唔係個個都影響到，而且影響好細」，故不會在網頁或以其他方式向用戶發出通告。  大部份用戶的電腦會於提升工程後自動設定，部份則可能不會自動設定而出現向本報投訴的讀者情況：速度不穩定及經常斷線，公司會派員到有關用戶的機樓調校，情況應已獲得改善。  至於和記寬頻上網用戶反映其客戶服務熱線服務未如理想，發言人稱已增聘人手，祈能改善。  消費者委員會發言人表示，若互聯網供應商在進行任何可預期對客戶造成影響的工程，應透過網頁或其他途徑預先通知客戶。 應增聘人手應對   一般客戶在使用或帳目上有任可問題，均會致電客戶服務熱線，尋求協助，故作為負責任及提供應有服務水平的公司，便應增加人手應對，若客戶服務熱線不斷「冇人聽」情況，反會為客戶增添不便，有關公司有需要作出改善。     依牌照條款監管   電訊管理局發言人指，該局今年一月至十月共收到四百七十五宗有關市民對寬頻服務的投訴。  該局一向根據牌照條款及電訊條例監管電訊營辦商，如發現有電訊持牌商違反發牌條款，會作出調查。市民如使用服務時感不滿，可向電訊局投訴，不過為加快理有關投訴，市民最好先向營辦商投訴，若對處理結果仍感不滿，再向該局求助。  （一○二一○○三、一○二八○○一、一○二八○○二、一○二八○○五）    服務熱線  電話:29908288  傳真:23702192  電郵: sservice@appledaily.com 
20031119-4,20031119,4,回收商鐵籠阻馬路,回收商鐵籠阻馬路 居於土瓜灣道下鄉道及炮仗街居民投訴，炮仗街近上鄉道一廢物回收公司，經常在行人路甚至在馬路上處理回收廢物，影響附近居民及行人。     「啲車要過對面線」   居民又指，該店並將數個盛載廢物鐵籠，擺放出馬路，收集廢物，以對路面造成阻塞；加上店前馬路經常泊有數輛大貨車，造成整條路面雙線泊車，不少行經車輛須逆線行車，遇上繁忙時段，便會出現「對頭車」情況，非常危險。  「間舖真係佔咗太多地方，而且佢將鐵籠擺到出晒馬路，搞到有啲車要駛過對面線。容乜易被前面架車阻一阻，睇唔到對頭車而迎頭相撞，咁樣好危險㗎。」  本報已將投訴轉介食物環境衞生署及警方跟進。	（一一一四○四二）    服務熱線  電話:29908288  傳真:23702192  電郵: sservice@appledaily.com 
20031119-5,20031119,5,電梯故障3個月未維修,電梯故障3個月未維修 大埔大元邨居民投訴，大元邨街市二樓的美食廣場扶手電梯損壞三個月，但至今仍未維修好。  居民稱，由安祥路通往美食廣場的扶手電梯於數月前已損壞，但管理公司總稱未有合適零件維修，居民只可步行樓梯級，「附近有好多老人家居住，睇住佢哋咁樣行上行落，我都替佢哋覺得辛苦。」     零件損壞有待維修   由安祥路通往大元邨美食廣場的扶手電梯現已被封，並張貼通告，表示零件損壞，有待維修。其間，有長者向記者表示，沒有扶手電梯令長者不便。她們只可選擇行樓梯，否則便須繞個大圈，至附近翠屏花園出入口乘搭扶手電梯上美食廣場。本報已將投訴轉介房屋署跟進。	（一一○四○二六）    服務熱線  電話:29908288  傳真:23702192  電郵: sservice@appledaily.com 
20031119-6,20031119,6,私廈天台僭建致漏水,私廈天台僭建致漏水 佐敦柯士甸道百安大廈頂樓單位戶主廖太投訴，一年前其單位天花開始出現滲漏，發現乃其單位對上天台有僭建鐵皮屋，懷疑天花滲水與僭建鐵皮屋有關，向屋宇署投訴，但該署遲遲未有行動，故向本報求助。  屋宇署回覆本報稱，屋宇署早已向天台業主發出清拆令，要求清拆該搭建物。若天台業主未有履行命令之要求，屋宇署會考慮提出檢控。	﹙一○二○八一九﹚    服務熱線  電話:29908288  傳真:23702192  電郵: sservice@appledaily.com 
20031119-7,20031119,7,找換店以優惠兌換競爭,找換店以優惠兌換競爭 【本報訊】中央容許本港銀行經營人民幣業務，市民可透過銀行兌換人民幣，也可申請人民幣信用卡在內地消費，本港人民幣找換店可謂首當其衝，部份店舖憂慮生意受影響，也有店舖認為，若能提供優惠的兌換價，找換店仍具競爭力。     料行內結業者眾   位於尖沙嘴的富泰（同源）找換店負責人黃先生表示，中央昨日公布的人民幣措施，對找換店的業務一定有影響，起碼內地人來港消費，可以用信用卡結帳，而不一定要換錢。  他指出，自開放自由行後，行內已增加了三十多間找換店，但中央容許本港銀行經營人民幣業務後，相信未來一、兩年內，找換店數目將陸續減少，尤其是旺角、荃灣等主要經營人民幣兌換的店舖，所受影響將會較大。  旺角一間大型人民幣找換店的職員亦表示，銀行遍布港九新界，市民在銀行兌換人民幣將會更方便，自然會影響找換店的生意，日後惟有利用更優惠的兌換價吸引顧客。  不過，位於旺角的中港人民幣找換行負責人鄧先生則仍感樂觀。他表示，香港人一向可以在內地開人民幣戶口，只是現在大張旗鼓，將措施擴張至本地銀行而已；由於找換店已經深入民心，並以很優惠的價格做街坊生意，所以估計影響不大。     銀行滙價有出入   他指出，即使內地人可以用信用卡消費，但「冇咁大隻蛤乸隨街跳，滙價肯定有出入嘅。銀行始終唔會蝕滙價」，最終消費者會發現，用信用卡不如帶現金。
20031119-8,20031119,8,香港開戶蝕匯水不著數,香港開戶蝕匯水不著數 深圳消息；港人可以在香港開設人民幣戶口，對於經常中港兩地走的港人是否方便及着數呢；大部份北上消費或居住深圳的港人均認為是方便，但並不太着數。     由港帶錢北上供樓   在港從事裝修的港人李先生（三十二歲），五年前返內地娶了一名四川女子為妻，去年他在深圳華僑城買了一個七百五十呎的單位作為安樂窩，從此每月都會從香港帶錢北上交付供樓款項。  李先生說：「層樓要四十五萬元人民幣，由農業銀行做按揭，分期二十年，月供二千元；我每個月從香港帶錢到大陸，然後去黑市換錢再存入供款銀行帳戶」，他又說：「如果可以喺香港開人民幣戶口，將來可以直接過戶，但蝕咗黑市滙水，現時如果按銀行牌價，一百約蝕一蚊，二千元就是蝕二十蚊，夠我太太買一餐餸了」。  李先生又表示，港人在內地買樓，大部份樓盤的按揭銀行都是指定的內地銀行，以後可以從香港人民幣戶口轉帳；對於並不經常北上的港人更加方便，當中包括可以利用在港開的人民幣戶口交水電費以及供款等。     做生意港人較方便   李先生補充，如果是在內地做生意的港人，那就很方便了，起碼可以在香港提款，不用帶大量現金過關及被海關查處了。  本報記者
20031119-9,20031119,9,隱瞞病情　激走妻兒　獨承苦楚絕症好爸自焚命危,隱瞞病情　激走妻兒　獨承苦楚 絕症好爸自焚命危 【本報訊】「老婆、仔仔對唔住，我好愛妳，可惜我有咗一個病，你哋唔好再返嚟！」一名罹患肝癌絕症的二十三歲青年，為免連累妻兒及家人，寧隱瞞病情，獨自忍受痛楚，更設法將愛妻激走讓她早日另覓好歸宿。一切部署妥當後，他昨凌晨在天水圍住所淋天拿水放火自殺，其間難抵濃煙嗆喉冒險攀窗爬上一層向街坊求救，目前性命垂危，但愛妻仍懵然不知錯怪丈夫。　記者：鄧偉明、杜建彬、姜偉康、譚健文 對妻子情深義重的好丈夫蘇海輝，二十三歲，居住天恒邨恒輝樓二十八樓一單位。他面部熏黑，吸入過量濃煙，送院後仍然昏迷不醒，情況危殆，需留醫深切治療部。阿輝的雙親事後到醫院探望兒子，哭得雙眼通紅；之後二人到兒子家中察看，只見單位嚴重焚毀，母親只能執拾數件衣服讓兒子替換，黯然離開。  據蘇母透露，阿輝十八歲時與同齡妻子「阿燕」奉子成婚，育有兩名四歲及五歲的兒子，一家四口遷住上址兩年。兒子過去曾任地盤維修、酒樓散工，雖然收入微薄，但生活樂也融融。     「親家奶奶好絕情」   今年初，阿輝驗出患上肝癌後，一直隱瞞病情。他為設法令妻子死心曾失蹤一個月，妻子忍無可忍，兩個月前終帶同兩子返娘家，更向他提出離婚而阿輝因病無法工作需向父借錢接濟，父親不清楚真相，還以為他不務正業，每次碰面便喝罵「不肖子」。  蘇母續稱，兒子近日再向父借錢醫病被罵，才講出真相。雙親知悉錯怪愛子，痛得心如刀割，從沒想過兒子竟如此用心良苦。蘇母還拿出阿輝寫給她和妻兒的兩封遺書向記者哭說：「個仔係因為有病先搞成咁，我今日想將件事話畀阿燕聽，但係佢阿媽唔肯通傳，重嫌棄我個仔，親家奶奶真係狠心、好絕情！」 「你哋唔好咁傷心」   阿輝以署名「一個永遠掛念妳、你的罪人」寫給愛妻及兩子的遺書上說：「對唔住，其實嗰個月我冇返嚟係我已經知道我個肚有事，我又唔知點同妳講，不過我聽到妳話要同我離婚我先敢返嚟見妳，我咁同妳講嘢係突（特）登等妳唔好理我……我𠵱家成日想住你哋，我好愛妳，可惜我有咗一個病肝癌，你哋唔好再返嚟，就算我死咗都會保護你哋！」  他又以「不肖子」來向母親道別及透露病況：「我係妳的一個不肖子，現在23歲人都唔識得去諗，妳幫我同爸爸講一聲對唔住，唔係我去都去得唔安樂。媽媽妳知唔知我𠵱家一日比一日差，以前就話一兩個月至痛一次半次，但𠵱家係一日比一日痛，個肚好似比（俾）火燒咁……還有時吐血好辛苦，你哋唔好咁傷心，就算我唔自殺，我個病都冇得醫……我𠵱家落去陪細佬……對不起，我真係好想醫好個病！」  事發昨近凌晨零時，阿輝在家中留下兩封遺書後，淋天拿水放火燒屋企圖自殺，其間痛苦難耐，於是從房間攀出窗外，沿水渠爬上一層向街坊周太的兒子求救。對方打開窗框讓他入屋並報警。阿輝當時倒地呻吟，神志不清，消防員到場將他送院，其間數十名居民需疏散到地下。
20031119-10,20031119,10,家人知真相更難受,家人知真相更難受 「好多人以為死只係自己一個人嘅事，其實唔係嘅，真相係你嘅家人都會受到好深影響！」社會福利署總臨床心理學家劉家祖表示，末期病症患者要承受身心痛楚，確實很辛苦，但家人的內心會比病者更難受。     「哀傷好難復原」   劉家祖指出，因為家人知道病者快將病逝，多數會在其臨終前盡量抽空陪伴在側，想助他完成心願，如果家人在病者死後才得悉被蒙在鼓裏，將更加痛苦。「若知道當日被激走嘅真相係想為佢（家人）好，嗰個家人事後一定會好內疚！佢嘅哀傷亦都會好難復原！」  劉家祖建議，病者應坦白將病情告訴親人，與家人一同跟病魔搏鬥，透過情緒支援及關懷呵護，可幫助延長壽命。加上一個人臨死前，通常會替自己作個人生總結，但他獨自緬懷過去，可能只會想到負面事情，「諗埋一邊」，導致心灰意冷而做出儍事。若與家人或朋友傾訴，則可得到更多的鼓勵與支持。  本報記者
20031119-11,20031119,11,早期肝癌通常無病徵,早期肝癌通常無病徵 肝癌為本港第二號癌症殺手，大部份病者是由肝炎引發，亦有人因飲酒過多導致肝硬化引致，歌星羅文去年亦因肝癌病逝。  早期病人通常都沒有任何病徵，所以多數人在病發時已屬末期。初期病徵包括身體疲倦及體重下降；到了後期則有惡心、嘔吐、發燒、黃疸（即皮膚和眼白變黃，尿液呈茶色）、腹部腫脹和右上腹腹痛。  患者可以進行較為有效的切除手術醫治，亦可透過靜脈注射於血管中進行化療，但已接受切除手術的病人，仍有復發可能。最好的預防方法是注射乙型肝炎疫苗及少沾煙酒。
