key,date,article_daily_id,title,text
20031202-217,20031202,217,綠庭園剩500伙或再加價,綠庭園剩500伙或再加價 【本報訊】西鐵即將通車，恒基地產（012）及新世界發展（017）的元朗綠庭園，趁機夥中原地產推出優惠。項目尚餘不足500伙，發展商將視乎情況，考慮再加價。  新世界發展營業及市務經理陳偉強表示，綠庭園迄今累售逾1200伙，套現24億元，兩周前已提價1至3%。餘下單位可套現8億元。月底前透過中原地產買2房單位，送8.8萬元新婚攝影及旅遊優惠，名額3個，3房買家再額外獲贈子女教育基金，價值10.8萬元，名額3個。     嘉多利豪園餘20戶   另外，嘉華地產營業經理顏景鳳表示，將何文田嘉多利豪園8個1874至2609方呎相連戶，委託中原地產代售。該盤過去3個月累積加價5至8%，尚餘20伙待售，當中8伙為相連戶，意向呎價已調升5%至5800至6800元；12個分層呎價5500至6500元，沽清可套現2億元。  中原向相連戶買家送半年水電煤氣費或腕表，價值4.8萬元，名額3個。
20031202-218,20031202,218,樓市精點,樓市精點 港景峯遭業主入稟   ▲由長江實業附屬公司康利時投資發展的尖沙嘴港景峯，遭業主入稟高院，控告貨不對辦。  根據控狀指出，原訴人黃永麟及黃美鳳，在01年12月10日，以668.3萬元，購入港景峯2座10樓B室，當日售樓書顯示，單位實用面積為982方呎，另平台1014方呎，而平台並沒有附連任何建築物。但最後原訴人發現單位平台中央竟建有兩個鐵籠，內藏喉管，而與毗鄰C單位的分隔牆亦建於平台，結果原訴人單位平台可使用的面積只得約262.3方呎。  原訴人要求判決買賣合約無效，退回樓價款項；或發展商負責拆除平台上的建築物，兼一切損失。另需支付堂費。  ▲韋堅信測量師行許偉國表示，灣仔道83號地下A及B舖，連1及2樓全層，合共7694方呎，以及同廈6至9樓及27樓全層寫字樓，總面積8824方呎，連命權標售，04年1月7日截標。     觀瀾雅軒深圳客235萬購   ▲美聯梁美愛表示，一深圳自由行客斥資235萬元，購入馬鞍山觀瀾雅軒4座高層F室，面積790方呎，呎價2975元，原業主00年以303萬元購入，現帳面蝕68萬元。  ▲中原李淑筠說，大圍順景工業大廈4及5樓全層，6.27萬方呎，連5個車位一併標售，04年3月3日截標。上述兩層樓面，其中一層連租約出售，每月收12萬租，另一層交吉出售，估計市值3500萬元。  ▲世紀21曾應豐指出，中半山住宅上月整體買賣約35宗，較10月的60宗跌42%，總值跌44%至約3.7億元。相反該區上月住宅租賃成交則較10月升20%，達65宗。  ▲美聯陳耀明說，紅磡黃埔花園十一期4座高層B室，面積750方呎，日前在炒家及用家競爭下，終由用家以188萬元購入，呎價2507元。原業主90年以85萬元買入。     雅典居相連戶670萬沽   ▲中原余志文透露，馬鞍山雅典居日前錄得一宗相連單位成交，為5座高層C及D室，面積2011方呎，成交價670萬元，呎價3332元。另同區聽濤雅苑11座低層E室，面積978方呎，連車位以270萬元售出，呎價2761元。
20031202-219,20031202,219,呎價低市場6%海典居　飽覽公園海景,呎價低市場6% 海典居　飽覽公園海景 馬鞍山海典居樓齡尚淺，物業仍簇新，是次介紹的單位內櫳新淨外，更予人一種不一樣的觀感，全屋改鋪淺色地磚，廚房換上款式典雅的新廚櫃，浴室及玄關加設併花雲石地台，以該屋苑同類放盤單位而言，如此落本的裝修並不常見。  戶主將原裝長條櫸木地板，改鋪色調較淡雅地磚，方便清潔。廚房亦由黑色地磚配白色廚櫃，改為藍色地磚配綠色廚櫃，牆磚更添圖案腰線，歐陸式設計。浴室設備大致不變，地台由原裝深色麻石，改為淺色地磚配併花雲石地台。整體配搭偏向清爽典雅，家居感覺更加舒適。     附設靚裝修   利嘉閣宋良安表示，該屋苑放盤量不足20個，是次介紹的單位裝修水準較高。另外，其更可飽覽馬鞍山公園和海景，及附靚裝修，呎價3184元，仍停留在10月份的市價，較現水平則低6%。同類景觀放盤單位呎價高達3400元。  至於，同類景觀的單位已有長時間未有成交，8月份6座中層D室，只望海景，1240方呎，以370萬元易手，呎價2984元。  記者?攝影：伍志輝
20031202-220,20031202,220,樓市點擊,樓市點擊 匯景花園業主一年蝕近20萬   ▲藍田匯景花園1座高層E室，原業主因換樓而沽售單位，成交價225萬元，1年帳面損失近20萬元，單位783方呎，呎價2874元，造價合理。利嘉閣陳延春稱，屋苑現有100個放售單位，叫價每方呎約3000元。  ▲將軍澳新寶城連錄得2宗買賣，世紀21鄺志輝指出，1座高層B室，面積528方呎，以126.3萬元售出，呎價2392元，而3座低層H室，884方呎，易手價182萬元，每方呎2059元。     大埔中心兩個月短炒賺逾20萬   ▲大埔中心錄得短炒獲利，21座中層G單位，431方呎，剛以約85萬元轉手，2個月帳面賺逾20萬元。利嘉閣陳清義指出，屋苑11月共有16宗買賣，較10月多2宗。平均呎價升約3%至1800元。  ▲美聯鄭文偉透露，火炭駿景園11座高層C室，剛以412萬元售出，單位1127方呎，呎價3656元。屋苑11月錄得16宗成交，較10月多3宗，平均呎價3420元，升4.7%。     美孚新邨低層兩個月升值23.3%   ▲荔枝角美孚新邨4期百老匯街87號低層A室，面積1000方呎，以185萬元沽出，原業主持貨2個月，帳面獲利35萬元離場，升值23.3%。美聯吳志輝表示，11月屋苑共有逾90宗成交，較10月多逾一成，因西鐵本月通車，估計全月成交量可保持11月水平。  ▲香港置業禤啟豪透露，一名外國回流商人，斥資150萬元，購入東涌東堤灣畔一個748方呎中層兩房單位，呎價2005元，並以一次過付款方式入市。  ▲利嘉閣齊文輝表示，鰂魚涌太古城海星閣高層B室，757方呎，由同屋苑換樓客以269萬元承接，呎價3554元，造價理想。原業主90年購入價近140萬元，帳面獲利約129萬元，13年升值約92%。屋苑11月共有58宗買賣，較10月減少6%。現有放售單位300個，叫價每方呎3800至4000元。
20031202-221,20031202,221,恆地明年售樓料套200億,恆地明年售樓料套200億 【本報訊】樓市有好轉迹象，恒基地產（012）主席李兆基預期明年樓價上升一成。他說，恒地多個住宅樓盤會在明年推售，預計全年推出8333個住宅單位，可望套現約200億元。 展望明年樓市，李兆基昨出席恒基系股東會後說：「上半年升5%，下半年升5%，每個月升1%，一年都有一成升幅。」而恒地明年將推售14個樓盤，總樓面508萬方呎，以每方呎3000餘元計算，全部推售將套現150億至200億元。李氏稱，雖然市道好轉，但旗下商場暫未有加租計劃，相信亦不會太快。     全年推8333戶   另外，政府將於明年恢復土地拍賣，李兆基表示，希望能把不同種類的土地放進勾地表，供發展商選擇，但要避免加入重災區如將軍澳及西九龍的地皮。至於恒地，他說會選擇吸納一般住宅用地、興建單位面積500至1000方呎的分層住宅。  對於政府公布的2030年規劃中，建議降低物業地積比率至5倍，李氏認為，條例實施仍需一段時間，相信對於已入則及發展中物業不會構成影響，同時，此舉有助減低密度及改善空氣污染，對樓市反而有利。 降地積比利樓市   雖然樓市升溫，但恒地的補地價步伐未有加快，副主席林高演解釋，由於多個發展商都申請補地價，故政府要詳細考慮。  不過，他說，預計明年上半年可完成3個住宅項目，涉及金額數億元。  另外，恒地已就旗下工廠地改作酒店用途，與政府商討補地價金額，預計兩個月內落實。  林高演表示，旗下有10個工廠項目申請更改作酒店用途，會先做2至4個，估計可提供1500個房間，預計每間房建築費40萬至50萬元。     主力發展賓館   受惠於自由行，多個發展商都表示會興建酒店，林高演承認，這會令酒店業競爭激烈，故酒店的定位很重要，故建議政府區別酒店與賓館。  恒地本身則集中發展以招待自由行旅客為主的賓館項目。  被問到備受爭議的西九龍文娛藝術區發展項目時，李兆基表示，以財力而言，恒地有足夠能力獨資競投，但設計及經營文娛藝術則需要專門人才，該集團正物色國際藝術從業員。  他又稱，對是否拆細該項目持開放態度，但暫時並沒有與其他人商討合資入標。
20031202-222,20031202,222,恆中沽滬項目補收入,恆中沽滬項目補收入 【本報訊】恒基中國（246）03年度業績轉盈為虧，旗下發展項目最快要到05年才有盈利貢獻。該公司董事長及總裁李家傑表示，會將上海閘北區發展中的地盤，以「批發」形式售予其他投資者，估計可收回18億元（人民幣．下同），填補04年度出現的盈利真空期。  李家傑昨日在恒基系股東會後表示，該公司於06至07年度將推出北京奧運項目京澳中心，有37億元預計在07年度入帳；05年度則推出廣州芳村區果子廠的住宅及商場項目，預期可套現10億元；至於04年度未有新項目落成，只能依靠租金收入，故現正考慮不等待上海閘北區兩三幅小型地皮發展完成，便將之整幢，甚至整個項目出售，提早套回資金。兩項目已有買家洽談。     物色夥伴北京建酒店   李家傑又稱，正與置地商談合作在京澳中心興建商場，至於會否興建酒店，則要視乎是否找到合作夥伴，若落實發展酒店，估計有約500個房間。
20031202-223,20031202,223,按揭債券認購額已達9億,按揭債券認購額已達9億 【本報訊】按揭公司第5批零售債券將於今日下午截止申請，認購總額截至上周六已達9億元。該公司副總裁（庫務部）廖志強相信，最終發售額可達10億元，若認購額超過此數目亦不排除「照單全收」。是次債券分四部份，以3及7年期最受歡迎，各佔已認購總額三成；2年期佔兩成；3年可續兩年部份佔一成半。  鑑於7年期債券反應理想，他指出，按揭公司會研究日後發行7年以上零售債的可行性，此舉亦配合該公司所購入的按揭資產，平均年期較前延長的趨勢。以往客戶換樓的平均年期短至2、3年，但目前資產組合，平均年期延長到5至7年。  在是次發售中，7年期債券的平均認購額為40萬、50萬元，不少投資者屬已退休人士及高資產值客戶。
20031202-224,20031202,224,財話短說,財話短說 滙豐調高經濟預測   ▲滙豐銀行公布，將本港今年經濟增長預測，由1.5%調高至3%，明年經濟預測則為4.2%。原因是本港第3季經濟復甦較預期快，加上內部需求及消費信心逐步加強。  ▲聯想集團（992）公布，為專於發展電腦製造、手機製造及提供資訊科技服務，集團擬出售電腦主機板及相關配件業務50%權益，作價1250萬元，另加於10月底之備考綜合資產值。買家為記憶科技。     REITs短期難發行   ▲證監會投資產品科副總監麥淑貞表示，由於地產信託投資基金（REITs）涉及的資產龐大，有興趣發行的地產公司也會深思熟慮才進行，故首隻REITs未必可在短期內推出。  ▲財政司司長唐英年表示，為便利市場活動，證監會及港交所（388）研究放寬限價賣空規則，豁免與其他莊家作對沖交易的賣空價限制，以及再放寬指數套戥交易的限制。  ▲據德國報章報道，歐洲流動電話公司正尋求奧地利政府退回過去數年3Ｇ牌照費用。六家電訊商包括德國電訊旗下公司、和黃（013）、Telefonica、ConnectAustria及Telering。     信置籌10億元貸款   ▲《基點》透露，信和置業（083）透過中銀香港（2388）籌組一項10億元3年期的貸款，這筆一次過償還的融資，分為5億元定期貸款及5億元循環信貸，息率連費用為港元同業拆息加約60點子。  ▲漢寶集團（228）宣布，控權股東漢寶投資出售股權一事告吹，因其不欲延長買方的審核期限。該公司今日恢復買賣。     燕啤增惠泉啤收購價   ▲北京控股（392）屬下燕京啤酒昨宣布，收到國資委的要求，須將收購內地A股福建惠泉啤酒38.148%股權的收購價提高3.95%，由原來的每股3.8元（人民幣．下同）調高至3.95元，涉及收購金額亦因而增至3.7671億元，該公司會以內部資源撥付。
20031202-225,20031202,225,健康前線：淋巴脹而不痛有彈性須即求醫,健康前線： 淋巴脹而不痛有彈性須即求醫 躋身癌症殺手榜第九位的淋巴癌，近日林振強因淋巴癌病逝才再度引起關注。淋巴系統覆蓋範圍廣，任何地方也可以出現病變，病情亦可以很快由第一期發展至第四期，乍聽覺得很可怖，在了解它的真面目後，原來並不太可怕，可怕的只是對這個病缺乏認識，更甚的是病者諱疾忌醫吧。   記者：邵超　攝影：蔡鴻雯　模特兒：Yoko  醫生金句    「淋巴癌普遍嘅存活率高達50-60%，患者應該聽從醫生嘅吩咐接受治療，更唔應該半途而廢，就算病情稍有起色都唔可以停藥。」    血液及血液腫瘤科專科	麥耀光醫生 本港每年淋巴癌的新增個案超過六百宗，跟亞洲區其他地方一樣，普遍為非何傑金氏淋巴瘤病例，主要於成年人身上發病，45-60歲的人士更佔大多數，但血液及血液腫瘤科專科麥耀光醫生說，只要遵從醫生吩咐接受適當治療，存活的機會很高。 懷疑同環境污染有關    麥耀光醫生說：「淋巴癌新症嘅數字正在上升，病因不明。懷疑同輻射、污染問題有關，但暫無數字支持。不過正常細胞受刺激先會病變，現時周圍污染同輻射問題嚴重，呢啲致癌物質會令人體細胞產生病變，誘發癌症。」至於慢性病毒帶菌者，由於身體長期催谷淋巴細胞抗炎，慢慢地抗炎細胞發展到自主階段，不受正常新陳代謝的模式規限，自我膨脹，癌症問題便出現了。 淋巴核?腺腫脹圖    淋巴系統通達身體各個器官（綠點），靠它擊退外來病菌襲擊，但亦是病變所在。 淋巴細胞病變4個可能    淋巴癌是淋巴細胞的一種疾病。淋巴細胞為何發生病變，到現時仍是一個謎，但有四個較強的相關因素。  1.愛滋病患者  2.EB病毒帶菌者  3.HTLV-1型病毒帶菌者  4.幽門螺旋菌帶菌者 無故消瘦發熱要注意    發病初期患者可能誤會是一般疾病。淋巴腺腫脹是較為明顯的症狀。在頸部、腋下或腹股溝淋巴腺腫脹，是自己能摸得到的地方，但發生在身體內部、胸部縱隔腔或腹部主動脈兩側的淋巴腺，或淋巴腺以外的淋巴組織，如胃腸道、脾臟、頭頸、鼻咽等淋巴組織衍生出來的惡性淋巴癌，這時便取決於個人的警覺性，有懷疑便要看醫生。當然亦不能排除是普通發炎而腫大。      患淋巴癌前症狀    1.淋巴癌的淋巴腺腫脹通常脹而不痛，觸手富彈性。相反如果是硬邦邦的，可能是其他固體腫瘤轉移到淋巴腺的徵兆。  2.無故地體重下降  3.無故地發熱、晚間流汗  4.嚴重痕癢 「神奇子彈」花費過十萬    淋巴癌的病情雖有四期之分，但當中的差別並不明顯，其擴散方式亦很特別，分辨的方法是依賴不同部位的淋巴腺腫大情況而決定。慢性和急性淋巴癌的病徵和治療方法亦有很大差別。      慢性淋巴癌    淋巴腺在體內分裂及增加的速度緩慢。病人的存活期比較長，但預期復發的機會很大。  治療：現時慢性淋巴癌的治療方法較為積極，麥耀光醫生說：「從前缺乏效力好嘅藥……𠵱家有咗神奇子彈（MabThera），呢類針對性嘅抗體針藥，可以快速打散癌細胞，副作用較少，但藥費動輒過十萬。」  急性淋巴癌    淋巴癌在體內迅速分裂並以倍數增加，很快便到第四期癌症，如果不及早醫治，可以在數月內死亡，早期治療治愈機會則大增。  治療：急性淋巴癌的治療方法，仍然依賴傳統化療藥（CHOP）。不過最近歐洲的研究報告發現，如果早期用MabThera配合傳統化療藥，治愈率能由40%提升至接近60%。雖然癌症復發仍然是最頭痛的問題，但醫生還可以採用自體或近親骨髓?外周血幹細胞移植手術去幫助患者，成功率會多40%。
20031202-226,20031202,226,派對創意小食意粉壽司唔怕滯,派對創意小食意粉壽司唔怕滯 還不夠一個月便是聖誕節，是時候要開始為聖誕節作準備了。無論打算在家跟親人還是好朋友一起慶祝，搞大食會幾乎是指定節目，特色的食品又怎可缺少？而飽肚又容易處理的意粉是一種不錯的材料。今次便介紹兩個特色意粉做法給大家，學定聖誕節用。   記者：謝翠玲　攝影：陳陶鈞　示範：ChefLeoYu 平日經常用到的意粉，別以為食法很少，不是加番茄醬汁便是用白汁來拌勻便算，其實意粉無論種類和食法也有很多種，只是一般人沒有想過種種特別的做法而已。今次ChefLeo便示範了兩個跟傳統有別的意粉食譜。     自創配搭    意粉壽司其實是脫胎自日式蕎麥麵壽司的食法，加入了不同的材料，創製出別出心裁的口味。而以泰國常用香料金不換作調味的鈕扣粉，口感完全不同，更帶有東方色彩。這些另類食譜均來自一個意粉班的主導師設計的，果然是專業大廚，別有創意。 意大利粉壽司    壽司都是用米飯來做，但這個小食則創新地改用了意大利粉來代替飯，同樣飽肚，卻沒有米飯的滯口。而配上現成的番茄雜菜意粉醬來代醬油青芥，口感和味道也更清新。  用咩料：    意大利實心粉　1包  番茄雜菜意粉醬　半樽  紫菜　8塊  牛油果　1個  蟹柳　8條  小貼士：    １.牛油果皮愈深色便愈熟，做這個壽司適宜用剛熟的牛油果肉。  ２.意大利粉可烚得腍一點，會比較有黏性，易壓實，捲起便不會容易散開。 泰式大蝦鈕扣粉    這個則是用了形狀別致的鈕扣粉來做的特色食法。細細粒的鈕扣粉用上番荽炒香，伴上以大番茄盛着的番茄香草意粉醬，加上沙樂美腸和大蝦，色香味俱全，作為派對小食也很適合。  用咩料：    鈕扣粉　100克  番茄香草意粉醬　200克  大蝦　8隻  沙樂美腸　8片  大番茄　2個  指天椒　8隻  金不換葉　2片  橄欖油　10克  番荽碎　少許  小貼士：    想鈕扣粉更香口，可把沙樂美腸放入同炒。     意粉烹飪班資料：    由即日至十六日期間，將會舉辦新一期的意粉烹飪課程，共五堂，每堂會教兩個意粉菜式，包括海鮮意粉煲、日式上湯火雞意粉等，學定聖誕派對便可大展身手了！    課程查詢電話：27393700  費用：$140（贈送精美禮品一份）  上課地址：九龍油麻地彌敦道498-500號泰盛商業大廈20樓2001室  材料提供：百迪斯牌（Agnesi）意粉
20031202-227,20031202,227,短線遊：小心跌落坑元朗大棠搵神仙轍,短線遊： 小心跌落坑元朗大棠搵神仙轍 近排入到元朗，除咗探吓南生圍嗰條鱷魚仔之外，大家又知唔知喺元朗南面嘅大棠有條坑都好出名？人人叫呢條坑做「神仙轍」，莫非真係神仙嚟過留下嘅痕迹？今日我就要去睇睇，解開呢個謎。 記者：陳震霖 攝影：陳智良 Model：Cindy、Yuko（Space2） 鄉村風情     靚蕉搶鏡    整個行程係喺大棠一帶圍繞山行一圈，所以起點同終點都喺大棠村附近。喺大棠村村口落車後，從大棠村牌坊左面嘅路向楊家古村的方向進發。一路上，見得最多嘅係香蕉樹，上面都掛滿香蕉。原來香蕉花個樣相當趣致，而且據村民講，香蕉花尾端重可以餵豬。 蘆薈田咪動手    楊家古村已逾百年歷史，古老建築固然唔少，不過最搶眼係村前面有個蘆薈田。「嘩！好多蘆薈呀！」一見到咁多蘆薈，靚女們就差啲想摘返屋企做Facial。咪亂嚟呀，因為呢片蘆薈田係私人財產。再加上有幾隻惡狗喺度巡邏，相信你一入田，佢哋實撲過嚟咬你！ 尋找神仙足迹     先賞元朗全貌    從右邊小路繞過楊家古村後，就會見到指示上山嘅路牌。按路牌指示，向黃泥墩水塘方向前進。走二十多分鐘，沿途夾雜石屎路同泥濘山路，不過總算好走。愈接近山頂，樹木逐漸稀少，這裏係俯瞰元朗市嘅好地方。 右邊有神仙？    沿着山路上坡下坡，又一個小時，傳聞中嘅「神仙轍」終於出現喺眼前。呢度完全冇指示牌，大家記住要留意右面。原來「神仙轍」係兩條十多二十米長嘅深坑，十足古時馬車壓過留下嘅痕迹，其實只係水土流失嘅自然現象，哪來神仙！但坑早就給野草填滿，走近看，原來有六、七呎深，唔小心跌落去都幾傷。 水塘吹吹風    路程行到一半，我哋就會到達「黃泥墩」水塘。你唔好以為呢度冇乜遮掩，企喺度就好熱，但係事實剛剛相反。如果你已經有啲累，我建議你走上堤壩，陣陣涼風就會撲面而嚟，到時個人就會立即爽晒，走多幾個鐘頭都冇問題。 夜晚搵到佢    而呢度最出名就係本港獨有、全球最細嘅兩棲類動物盧文氏樹蛙。呢隻樹蛙夜間先會出現，如果大家有幸見到，千祈唔好傷害佢哋呀，係犯法㗎！ 漢堡包拜神？    走咗幾個鐘，雙腳有啲軟，所以我哋決定過門不入，只係參觀一下大欖自然教育徑入口處嘅古廟。呢間睇落似爛屋嘅廟叫伯公廟，以前係村民去大坑村嘅必經之路。走進廟內，原來依然香火不絕，不過啲祭品就有啲騎呢，竟然連漢堡包都有！ 玩樂時間     燒烤好去處    繼續向大棠方向進發，沿住公路行多一個鐘。就會到達大欖郊野公園。呢個公園因為燒烤爐夠多，環境都幾大，假日都擠滿遊人。咦？乜有班年輕人唔用燒烤叉燒嘢食？我走近啲，先發現佢哋原來喺度打緊麻雀。 度假村釣蝦    過咗公園後，我哋發現咗呢個營地。原來唔使預約，隨時都可以入去參加日營，裏面踩單車，滾軸溜冰、繩網等活動樣樣齊，不過最特別嘅地方就係有得釣蝦。釣嘅唔係普通蝦，而係龍蝦。池中嘅蝦有成五、六十隻，最正係一釣到就可以攞去微波爐叮嚟食，原汁原味咁享受。 隨時玩得    有駕駛執照嘅朋友又可以去租架高爾夫球車喺營舍附近兜吓風。喺呢間度假村玩餐飽，作為行程結束都唔錯。  保良局賽馬會大棠度假村    地址：新界元朗大棠2411號地段  電話：24781332  收費：  入營：$25（平日）、$38（星期六、日及公眾假期）  釣蝦：$25/半小時  高爾夫球車：$50/1小時（另按金$200） 搵食好去處：起點補給站    今日呢段路都幾長，走成五個鐘頭，沿路唔少地方樹唔多，所以要預先準備水同食物，兩手空空嘅話，就要認住呢度啦！喺大棠村牌坊附近呢間培記士多就可以做你嘅補給站。雖然話冇乜特別嘢賣，但係食水同零食就已經幫到你。      交通    去程：由觀塘碼頭乘269C於元朗大棠路落車（$16.5），再去千色廣場附近轉搭往大棠的紅色小巴到大棠村落車。（$4）  回程：回到先前下車的大棠村乘紅色小巴回元朗市中心。（$4）
