key,date,article_daily_id,title,text
20031119-60,20031119,60,市值漲69億元　帶動港股回升清算行大熱中銀股價飆升,市值漲69億元　帶動港股回升 清算行大熱中銀股價飆升 【本報訊】特首董建華昨日下午港股開市後半小時宣布，所有本地持牌銀行可於明年元旦前後經營四項人民幣業務，極有機會成為清算行的中銀香港應聲上揚，股價曾經飆升近百分之八，單日市值暴漲六十九億元，連帶其他本地中小型銀行股也相繼造好，刺激港股止跌回升，恒指重上萬二關口。　記者：高淑嫻、丘倩瑜 金管局總裁任志剛昨日在北京表示，能否在年底前委任結算行，「恐怕急一點」，但會爭取在短時間內委任該行，因為此舉會決定其他服務推出的快慢，結算行要求方面，他說行方本身需有結算經驗、網絡充裕，最重要是了解本地及內地金融政策的法規。     消息令銀行股扳升   他指原則上人行授權結算行擔任清算服務後，其他銀行便可與該結算行，按商業合約原則，決定服務細則，換言之，人民幣個人業務的推出時間可以很彈性，只要參與行前期準備工作做好，與結算行訂立好商業合約後，便可逐步推出服務，毋須再就各項服務向監管機構申請經營權。  市場一直憧憬中銀香港日後會成為人民幣清算行，昨日有關香港銀行可以經營人民幣業務的消息一出，市場即時有反應，中銀股價一度升上十四點五元，創上市以來新高，收報十四點一元，漲百分之四點八。中銀的市值在一日間暴升六十九億元，至一千四百九十億元。  中銀香港總裁和廣北表示，有信心可成為清算行，但對「呼聲最高」則不便評論。渣打銀行董事王冬勝及滙豐銀行總經理柯清輝均表示，將全力爭取成為清算行。  消息也令其他本地中小型銀行股受到追捧，永隆及永亨銀行分別上漲百分之四及百分之三點六，工銀亞洲升近百分之二。至於海外業務比重較大的滙豐控股及渣打，升幅並不顯著，滙控微升零點五元，渣打甚至逆市下跌一點五元。 不過，有銀行股分析員相信，雖然今次公布的新業務，對一向在外幣存款擁有較大市場比重、網絡較多的銀行較有利，但新業務相信對銀行整體收入，以致利潤幫助極為有限，因為新業務只屬存款，人民幣將由人行深圳市中心支行接收，銀行只賺取中間的利息差距，扣除成本後收入有限，相信要待日後容許本港銀行，可直接將人民幣存款轉作本身的人民幣貸款，賺取的淨利息收入才較顯著。  他相信，新業務只對最終獲批為清算行的本港銀行最有利，這導致被視為大熱的中銀香港，昨天股價勁升。他認為，若按目前走勢，若該行正式被委任，將有進一步上升的動力。     信用卡業務最吸引   另外，銀行業明年將正式試辦人民幣業務，本港多家銀行均表示有興趣參與，並作出研究。其中一家受惠的持牌海外註冊銀行花旗銀行、其香港區總經理廖禮芳指出，是次開放的業務，花旗均有興趣參與，尤其是信用卡。  廖創興銀行高級經理張南中也指出，銀行業本身受惠情況，要視乎在港吸納的人民幣存款，能否用於在內地提供貸款，若只能透過結算行處理，則銀行可獲利潤有限。  目前，銀行界已有辦理滙兌及找換人民幣的業務，但可說是無利可圖。
20031119-61,20031119,61,少女遇劫慘遭𠝹頸,少女遇劫慘遭𠝹頸 【本報訊】昨日下午二時三十分，二十二歲姓陳士多女少東，身懷一萬二千八百元營業額準備往銀行存款，途經大埔運頭角遊樂場時，被獨行賊箍頸及以𠝹刀架頸行劫，掠去她一萬多元後逃去，事主（圖）頸項被𠝹輕傷，須送院敷治。  文兆麟攝
20031119-62,20031119,62,跟蹤逾千米終擒扒手,跟蹤逾千米終擒扒手 【本報訊】三名扒手昨午在油麻地以碰撞手法扒竊一名男子的手機，事主怯於對方人多，由加士居道暗中跟蹤三扒手至伊利沙伯醫院附近，見其中兩男子分開，他繼續尾隨向他扒竊男子，終在逾千米外的衛理道近何文田山道一間小學對開，召警將一名疑犯拘捕，另兩匪逃脫。  被捕疑犯姓陳（四十三歲），警員在其身上未有搜出事主的手機，相信已交予同黨，但搜出一粒毒品，涉嫌藏毒被捕。事主姓何（二十一歲），昨午二時許他與一名友人在油麻地彌敦道與眾坊街交界橫過馬路時，與三名男子相遇，其中一人曾俟碰他，未幾他發現放於孭袋的手機失去，疑對方偷去。
20031119-63,20031119,63,議員辦事處　涉商業行為蔡素玉疑領公帑做生意,議員辦事處　涉商業行為 蔡素玉疑領公帑做生意 【本報訊】正值區議會選舉拉票衝刺時刻，今屆區選焦點選區之一的北角錦屏選區兩名候選人──民建聯蔡素玉及「四五行動」梁國雄均被醜聞纏身。蔡素玉被租戶投訴其私人公司承辦的歡躍維園嘉年華貨不對辦外，其公司又被揭發以議員辦事處名義，向立法會申領公帑交電費及電話費，據悉北角警區重案組已接手調查，蔡素玉指遭人中傷，不擔心影響選舉形勢。　記者：羅偉光、莫劍弦 蔡素玉開設的東偉業務促進公司被揭發佔用公帑，一切始於由「東偉」承辦的歡躍維園嘉年華遭租戶投訴貨不對辦，多名租戶昨日更直接向特首董建華遞交請願信要求追究，有份遞信的租戶蔡先生稱，董建華表示已知悉事件，會交有關部門跟進。     帳項沒有分開處理   歡躍維園嘉年華已結束，但蔡素玉面對的醜聞卻愈演愈烈。她開設的東偉公司與其議員辦事處使用同一樓層辦公室及相同電話號碼，蔡素玉卻沒有把兩者電費及電話費帳項分開處理，有歡躍維園租戶稱，致電「東偉」時職員報稱是「蔡素玉議員辦事處」，一些商業文件亦是經議員辦傳真機發出。  雖然「東偉」與議員辦共用資源，但根據立法會秘書處紀錄，「東偉」並無攤分費用，只以蔡素玉議員辦事處名義申領公帑支付全層辦公室的電費及其中一條電話線費用，蔡素玉說是因為職員疏忽，才誤把「東偉」開支當作議辦開支向秘書處申領費用，又說已指示職員向立法會退回約八千元。     似承包商分租檔位   有立法會議員徵詢立法會法律顧問意見，獲回覆稱立法會難以追究，但若有市民舉報，執法機構可調查是否有人涉嫌詐騙公帑。另一方面，多名歡躍維園租戶已報警求助，北角警區重案組已接手調查。  歡躍維園爛攤子難以收科，最初康文署以免租形式把維園球場租予東區各界協會舉辦疫後振興經濟活動，但「東偉」卻以承包商姿態把檔位分租，有商戶估計「東偉」最少收取了三百萬元租金，質疑「東偉」做法有違活動原意，康文署則指由於歡躍維園不收入場費，故不向東區各界協會收取租金，至於場內個別另外收取入場費的項目，康文署則會抽取一成作場租，另外亦會收取行政費用，但未有實際金額。蔡素玉昨強調，部份針對她的指控是惡意中傷，又說：「只要唔好再有對我唔公平嘅抹黑就冇問題。」
20031119-64,20031119,64,梁國雄澄清無用錢僱示威者,梁國雄澄清無用錢僱示威者 【本報訊】在區選挑戰民建聯立法會議員蔡素玉的「四五行動」成員梁國雄，遭周刊指他用錢僱用失業人士參加示威。  梁國雄昨召開記者會，批評有關報道無中生有，是想「抹黑民主派、死撐保皇黨」，打擊他的選舉部署，他正考慮向廉政公署投訴。     逐點反駁報道   昨日出版的《東周刊》指有「四五行動」成員涉嫌以金錢僱用「職業示威者」，並且引述兩名自稱曾收受金錢參加「四五行動」示威人士，力證外號「長毛」的梁國雄對事件知情。  梁國雄昨在記者會上強調，「四五行動」從無用金錢聘請任何人示威，對於報道引述一名有參與示威的「阿倫」，承認曾收錢示威，梁國雄指他與對方不熟識，也沒有對方的聯絡方法，更加從來沒有用金錢僱用對方示威。  梁國雄又逐點反駁報道，例如報道提到○○年十月特首在立法會宣讀施政報告，報道指受聘人早上在立會集合，實際上他們下午才到立會示威、報道又指他們曾在立會內拉橫額，但實際卻沒有。
20031119-65,20031119,65,爭居權人士或轉軚,爭居權人士或轉軚 【本報訊】民建聯蔡素玉與「四五行動」成員「長毛」梁國雄競逐區議會錦屏選區，原以蔡素玉勝算較高，但有知情人士透露，該區選情有變，區內部份爭取居權人士可能轉軚支持「長毛」。  據了解，區內一班為子女爭取居港權的家長，有感蔡素玉為他們爭取不力，轉而向梁國雄求助，更有人表明不會再在區選中投蔡素玉一票，而梁國雄近日曾獲邀出席爭取居權人士的集會，令部份民建聯支持者擔心這些選票會倒向「長毛」。  另外，該區增加了不少中產選票，包括年前才入伙的港運城居民，這批中產選民在7.1大遊行後，會否增加了投票意欲，在區選中積極支持「長毛」，是民建聯另一隱憂，加上蔡素玉近日備受醜聞困擾，有地區人士形容，雖然蔡素玉贏面仍看高，但絕非十拿九穩，隨時會陰溝裏翻船。
20031119-66,20031119,66,當晚11時起公布結果,當晚11時起公布結果 【本報訊】即將於下星期日（23/11）舉行的區議會選舉投票，與上屆最大的不同將會是點票速度，因為點票地點由中央點票站改為在四百多個投票站進行，選舉事務處估計，當晚十一時許會陸續公布選舉結果，凌晨二時會完成絕大部份票站的點票工作。     設統籌及新聞中心   為方面傳媒第一時間向市民報道最新選情，政府於九龍灣國際展覽中心設立統籌中心和新聞中心，統一發放各區選舉結果。在全港四百個選區中，除去七十四個自動當選議席，其餘三百二十六個議席，將由七百六十三名候選人競逐。  屆時全港將開放四百二十三個投票站，約二百四十一萬八千名已登記選民早前陸續收到投票通知書，提醒他們往哪裏和如何投票。十一月二十三日的投票時間為早上七時半至晚上十時半。選舉事務處提醒候選人和助選團，於晚上點票時切勿喧嘩歡呼，以免騷擾點票站附近居民。
20031119-67,20031119,67,料16萬港人染此症　半數未正式求診九成慢阻肺病因吸煙,料16萬港人染此症　半數未正式求診 九成慢阻肺病因吸煙 【本報訊】慢性阻塞性肺病是現今僅次於癌症、心臟病及中風後的全球第四大殺手，患者因慢性支氣管炎或肺氣腫而呼吸困難，肺部無法換氣致死。本港九成慢阻肺病患者是因吸煙，或因二手煙、污濁空氣或長期接觸化學品等影響；而患上此病的人數正不斷上升，四十歲以上的煙民更屬高危一族。　記者：梁洵瑜 今日是「世界關懷慢阻肺病日」，呼吸系統專科醫生梁宗存表示，全球醫學界都擔心未來患此病的人數會不斷上升，現時全球每年有二百七十多萬人死於慢阻肺病，本港每年有二千多人死於此病，是繼癌症、心臟病及中風後的全球第四大殺手。  本港患上此病人數不斷上升，醫管局入院數字顯示，二○○一年有三萬五千多人次因慢阻肺病而入院，九七年只有二萬四千多人，病患人數五年內已上升逾四成；住院病人約佔公立醫院內科病房病人總數的一成，更是最常見需要再度入院的疾病類別。     污濁空氣亦有影響   梁宗存稱，九成慢阻肺病患者是因吸煙引致，或因二手煙、污濁空氣或長期接觸化學品等因素所影響，估計本港有十六萬名吸煙或曾吸煙的人士患上此病，其中至少十萬人的病情已屬中度或嚴重，其中半數以上未有正式求診找出病因，直至因流感、空氣污染指數急升或細菌感染等問題誘發嚴重呼吸不暢順才發現患上此病。  他解釋，慢阻肺病主要是慢性支氣管炎或肺氣腫。慢性支氣管炎患者，因煙草的焦油或污染物導致氣管發炎，氣管壁腫脹、分泌大量痰涎並積聚在氣管內，形成氣管收窄；肺氣腫則因肺氣泡囊壁膨脹，影響肺部換氣功能而呼吸困難。     嚴重者入院吸氧氣   此病可嚴重影響日常生活，如運動時氣喘；靜止休息，甚至在進食時，也會感到呼吸不到足夠氧氣，嚴重者要入院吸氧氣。他提醒市民，若已連續咳嗽四周、痰多及呼吸困難，應盡早進行肺功能測試，如排氣量少於肺部排氣量的七成，即屬慢阻肺病，四十歲以上吸煙或曾吸煙人士更是高危一族。  市民嚴重忽視此病，即使久咳未愈，求診時也未必做肺功能測試，只服用化痰及止咳藥，是治標不治本的做法。其實，只要及時發現，患者即時戒煙，可阻止氣管再度收窄惡化；配合使用氣管擴張劑，有助減低病發機會，並有機會挽回約三成的肺功能；注射流感疫苗也有助預防因流感誘發慢阻肺病。
20031119-68,20031119,68,膠吊帶植皮下拉緊頸皺紋,膠吊帶植皮下拉緊頸皺紋 【本報訊】愛美人士的喜訊！美國外科醫生發明了一種新拉面皮技術，可以成功減少頸部的皺紋。綜合外電報道，頸部在人老化的過程中最早出現皺紋，一直成為不少愛美人士的煩惱，美國亞特蘭大Emroy大學醫學院兩名研究人員研製了一條塑膠吊帶，植入面皮下、由一邊耳垂橫跨下顎到另一邊耳垂，拉緊下顎皮膚，防止頸部皮膚因鬆弛及脂肪聚積而出現下垂老態。     九成九人感滿意   共有八十八名女性及十二名男性於一九九六年至九八年期間接受了植入吊帶，各人的平均年齡為五十四歲；在一年後，九成九人都對外觀改變的效果表示滿意，而且沒有人因植入吊帶而感到不適，其中八十六人更表示會向親友推薦該項新技術。  目前一般人都會用整容及抽脂的方法減少皺紋，新技術的優點是可避免整容及抽脂可能造成神經線受損的風險，而且日後更可對吊帶作調校再收緊。
20031119-69,20031119,69,不育婦自行注射增排卵量,不育婦自行注射增排卵量 【本報訊】本港不育問題愈趨嚴重，現時每六對夫婦中，即有一對不育；其中半數病例均源自女方。有藥廠在港推出針對不育女性的新治療方法，讓不育女性利用載有藥物的「注射筆」，每日自行在肚皮上注射，免卻每日到醫院或醫生處接受注射來增加排卵數量的麻煩。  名為「PuregonPen」的「注射筆」，上月在港推出。仁安醫院輔助生育中心毛匡珽醫生昨在記者會上稱，「注射筆」使用原理與糖尿病人所用的胰島素注射器相若，不育女性只要連續十天早上自行在肚皮上注射藥物，即完成一療程。     價錢五千至八千元   毛匡珽稱，「注射筆」內含有腦下垂體激素，刺激卵巢製造更多卵子，由正常人每月排卵一粒，增至每月排卵十至十一粒。成熟的卵子將會被抽出體外，與男性精子結合，形成胚胎，再放入女性的子宮內，成功受孕率達三成。「注射筆」的價錢由港幣五千至八千元不等。
20031119-70,20031119,70,變色飲管可測出迷姦藥,變色飲管可測出迷姦藥 英國警方發明了一種特別的飲管，可以檢測到飲料中是否含有迷姦藥品，如GHB。英國《每日紀事報》報道，該飲管有綠色及白色兩種顏色，當飲管接觸到杯中飲料，即可測試出飲料是否含有迷姦水等藥物，若真的含有迷姦水等藥物，飲管會變色，藉以示警。有關飲管將在明年推出市面，英國警方期望此特製飲管可以有效減低迷姦案件的發生。
20031119-71,20031119,71,惠譽無意調整銀行評級,惠譽無意調整銀行評級 【本報訊】評級機構惠譽國際金融機構聯席董事劉曙明估計，銀行試辦個人人民幣業務，短期得益有限，長遠則要視乎銀行能否經營更多不同業務；經營兌換、信用卡及滙款能否帶來重大利潤，則要視乎實行時間，以及銀行能獲得多大生意量而定。該公司目前無意因此調整對香港整體及銀行業的信貸評級。     利潤視乎處理量   至於本地銀行未來可在港吸納的人民幣存款，劉氏說有關業務對銀行利潤的影響，要視乎銀行將有關存款經結算行作清算後，能從中收取多少息差，若處理量愈大，所獲利潤愈多。  劉曙明又說，有關措施對銀行評級影響中性，本港銀行目前從事的外幣兌換及滙款業務，佔銀行整體業務比重不大。
20031119-72,20031119,72,婦手術後每日200性高潮,婦手術後每日200性高潮 英國《太陽報》報道，全球最少有數十名女性受到持續性高潮的困擾，有女性甚至每日有二百次性高潮。報道引述受到此問題嚴重困擾的女性表示，異常過多的性高潮令她們經常陷入尷尬情況。其中一名七十一歲的美國女性強調，無論出席晚宴或遊車河時，都會不明所以地出現性高潮；她在四年前進行過腦部及膀胱手術後，情況更為嚴重，最多每日有二百次性高潮。  美國波士頓大學的性醫學中心紀錄了十名有關患者的資料，美國新澤西州的專家更稱全球約有四十名女士受到這問題影響。男性也有同樣問題，名為「金槍不倒」。
20031119-73,20031119,73,研究「木糖醇」防止蛀牙,研究「木糖醇」防止蛀牙 美國華盛頓大學牙科公共健康科學院研究，如何憑「木糖醇」（Xylitol）防止蛀牙。不少香口膠都含有「木糖醇」（Xylitol）成份，但醫學界暫時仍未知木糖醇如何幫忙防止蛀牙。美國《西雅圖時報》報道，美國華盛頓大學牙科公共健康科學院正進行一項研究，期望可找出不含蔗糖成份的木糖醇，對口腔內細菌的影響。  參與有關研究的共有一百二十二人，他們分成四組，其中三組經常咀嚼含有不同劑量木糖醇的香口膠，餘下的一組就咀嚼不含木糖醇的香口膠。研究最快在明年初完成，其後會進行另一項研究，找出每日要咀嚼香口膠多少次及多久，才可有效防止蛀牙。
20031119-74,20031119,74,健康地帶：飲食節制防痛風症,健康地帶：飲食節制防痛風症 痛風是一種關節炎症，主要是我們身體內產生過多尿酸，尿酸鹽凝聚關節內，引致發炎疼痛。痛風並不能根治，但適當的藥物治療及飲食控制是可以防止痛風的復發。醫生會個別為病患作長久的醫治，並且定期安排病人作血液檢驗。  有些痛風病患是沒有明顯的症狀，只是在驗血時才發覺血尿酸過高。  有症狀的病患在初期發病時，通常只有一個關節受影響，最常發作的關節是大腳趾（即腳趾公），也可見於膝頭、足踝等。受影響的關節會突然紅腫及劇痛，如果發作時不醫治，數天後痛楚會開始減退。若痛風病患得不到適當的醫治，多個關節可能會受影響，並且會經常復發。嚴重的痛風，會令關節變畸形。     避免高「嘌呤」食物   痛風病人多是四十歲以上，男性多於女性。有些人身體內的新陳代謝受到遺傳因素影響，會傾向於產生過量的尿酸。若在日常飲食中，喜好一些含有高成份「嘌呤」的食物，例如動物內臟、貝殼類海產、酒類等，這些「嘌呤」在人體內經過新陳代謝後，會變成尿酸，再加上暴飲暴食，很容易誘發痛症。  當患者急性發病時，一些藥物可以幫助病者迅速減低關節劇痛。當血液內的尿酸持續高出正常的水平，病人便需要長期服用另一類藥物，以維持血液內正常的尿酸水平。  要避免進食以下含有高「嘌呤」成份的食物，包括酒類；動物內臟；沙甸魚、魚卵、貝殼類海產；過量的乾豆類、冬菰、菠菜及鮮露筍等蔬菜；過量的肉類等等。多飲開水（每天最少兩公升）可幫助排出體內過量尿酸。患有痛風症的病患應避免身體過胖。  資料來源：衞生署中央健康教育組  原文可於下列網頁瀏覽：  http://www.cheu.gov.hk/b5/info/otherdiseases_04.htm   
20031119-75,20031119,75,約五千元一部　勢將取代傳統錄影機DVD錄影機促銷售量倍升,約五千元一部　勢將取代傳統錄影機 DVD錄影機促銷售量倍升 【本報訊】隨着視聽器材產品數碼化，傳統錄影機面臨被淘汰，近日多個電器品牌以大眾化價錢推出新款數碼DVD錄影機，並且以送贈禮品或提供優惠搶客，有電器商表示，數碼DVD錄影機銷量近日上升了近一倍。由於內地生產商最快在下月加入戰團，推出售價只需約三千元的「國產機」，預計數碼DVD錄影機的平均售價可望再下降半成至一成。　記者：黎國強 先鋒電子（香港）有限公司近日推出全新型號的數碼DVD錄影機──DVR-310-S，並提供一項「錄影機Trade-in大行動」，只要由即日起至本月三十日期間購買該款DVD錄影機的行貨版，便可憑發票、原廠保修證及任何電視錄影機一部，不論好壞，換領價值四百元的銀行現金禮券。     國產只需三千元   飛利浦的DVDR75則送贈總值約一千元的禮品，包括DVD光碟、影音線及自製DVD封套軟件。樂聲牌的DVD錄影機價錢最便宜，只售四千九百八十元，隨機附送三隻原廠DVD光碟。另外，東芝首部DVD錄影機──DVD-R1下周也會到貨，價錢待定。  華仁會電器有限公司店長梁永強表示，由於競爭激烈，近月數碼DVD錄影機的價錢下降了兩至三成：「大概半年前，DVD錄影機平均一部都要八、九千蚊，近期新出嘅型號，功能同質素更好，但價錢只需四千多元至七元不等，所以銷量升咗成倍。」  梁永強說：「聖誕前夕，啲日本大廠本身都會推優惠，如果大陸機出埋，價錢預計可以再平半成至一成，但要睇國產機嘅質素有無競爭力，但可以肯定嘅係，過多半年，傳統錄影機就唔會有人買，會被淘汰。」  中原電器負責人張先生說：「DVD錄影機嘅價錢比半年前回落咗一千至二千元不等，𠵱家平均五千蚊倒就買到一部，隨着價錢愈鬥愈平，DVD錄影機已經開始普及。」
20031119-76,20031119,76,大改革玩創新　燒味fusion菜茶餐廳魔術表演搶客,大改革玩創新　燒味fusion菜 茶餐廳魔術表演搶客 【記者翁煜雄報道】隨着經濟不景，價格較低廉的茶餐廳如雨後春筍，面對激烈競爭，傳統茶餐廳不斷自我增值，其中太興燒味更於周末及周日在兩間分店，搞魔術表演娛賓，又推出以西式烹調方式處理的燒味fusion菜，務求殺出重圍。  餐飲聯業協會主席伍德良說，茶餐廳近期愈開愈多，競爭日趨激烈，部份則面對老化問題，因此創新是唯一出路，部份如太興等則效法西式快餐廳如麥當勞，推出魔術表演，可達宣傳之效；他說部份茶餐廳亦提高侍應服務水平：「着到好整齊，又有禮貌。」     生意升兩成   太興燒味餐廳負責人劉漢基說，經濟不景反而令茶餐廳生意上升，雖然生意額數月前曾因沙士疫潮下跌兩成，但近月已回升並較去年反升兩成；但他說不少食肆早前均裁員，部份薄有積蓄的失業者紛紛合資開辦茶餐廳：「因為茶餐廳相對容易搞。」因此業界競爭十分劇烈。  為迎接挑戰，他說茶餐廳需不斷創新，本月起每逢周六及周日邀請魔術師駐店表演「手撕紙藝」及「小丑魔術」，本月先在西灣河新太安樓分店登場，下月則在元朗富達廣場分店接力演出。他說首數場表演反應十分理想，正研究會否推廣至其他分店。     翻新貴賓廳   他又說，為吸引更多年輕人，最近更推出fusion燒味套餐，如青芥辣忌廉汁焗燒肉飯及紐西蘭牛肉瑞士汁炒濕河等，以西式烹調方式炮製傳統燒味；西灣河分店更設一可容納兩圍客人的貴賓廳，供客人開派對；十三間分店正陸續翻新，令門面更富時代感。  「茶餐廳今時今日點只茶餐廳咁簡單？」他說繼叉燒月餅後，現正趁秋風起推出脆皮臘腸，又正擬售賣樽裝的奶茶：「遲啲會喺超市都買到我哋嘅產品。」
