key,date,article_daily_id,title,text
20030318-0,20030318,0,立會議員公審梁錦松「你係政府負資產」,立會議員公審梁錦松 「你係政府負資產」 雖然特首董建華企圖以一句「高尚情操」，力保偷步買車醜聞主角財政司司長梁錦松毋須下台，但隨着政府公開更多內部文件，愈來愈多證據顯示梁錦松不但在買車前知悉會提高汽車首次登記稅，事後更力圖掩飾真相。本身是資深大律師的立法會議員余若薇直言，按表面證據，已經「夠證據告（梁錦松以權謀私）有餘」。　記者：莫劍弦、羅偉光 【本報訊】立法會政制事務委員會昨日召開特別會議，討論梁錦松偷步買車事件。多名議員猛烈抨擊梁錦松以「公私分得太開」來解釋多次未有申報加稅前買車一事，講法難以令人接受，議員形容梁錦松已變成「董建華政府最大負資產」，為了政府和市民，請他「應盡快喺財政司司長職位上消失」。     據資料絕非一時疏忽   梁錦松堅持自己因忙於制訂預算案，加上愛妻情切、急於買車，才會一時疏忽，他認為自己有犯錯，但決不是操守問題。  對於議員多次要求他在通過預算案後離職，梁錦松只謂：「我聽行政長官嘅決定，會盡心盡意盡力，為香港市民服務。」  為了應付今次立法會政制事務委員會會議，梁錦松特別準備了買車及制訂預算案的時間表，更特別獲特首批准，公開他在行會討論加汽車首次登記稅的內容。  但披露愈多資料，愈發現司長在事件上不是一時疏忽。譬如他在一月十四日開完預算案策略小組會議，討論加汽車首次登記稅，數日後買車時竟毫不察覺問題。     梁稱將私事公事分開   梁錦松也證實自己沒有在行會討論加汽車稅時，作出利益申報；更重要的是，他原來放棄了不只一次機會，申報買車事件。  面對這些疑問，連梁錦松自己也找不到答案：「從三月九日到如今，我不停反覆思量，為乜會變成咁？為乜會將自己陷入呢個局面？為乜我無由一開始就醒覺要避嫌、要避免畀人有利益衝突嘅感覺？為乜從去年十月底開始討論此稅項，有好多好多機會提醒我有利益衝突之嫌，我都會毫不察覺？為乜我在一月十八日買車之際，居然會唔醒起幾日前喺內部會議上討論過提高首次汽車登記稅一事？……為乜喺宣讀預算案時，及以後幾日，都冇意識出咗問題，而等傳媒嘅報道先發覺？」 梁錦松最後惟有以自己要照顧太太伏明霞來作辯解：「太太從鎂光燈前退下……身懷六甲，從天光直到天黑等住我返屋企。準備BB出生嘅事，買嬰兒床、尿布、奶樽等等，都係佢一手包辦，我冇時間為佢張羅。佢需要一部房車，方便BB出入，做丈夫嘅能力所及下，自然會順佢意思。」     被質疑沒能力當司長   梁錦松聲言，由於自己刻意將公事和私事分開，結果沒有將兩件有利益衝突的事拉在一起想，才會發生今次事件。  多名議員均表示，完全不能接受梁錦松的解釋，並要求他再次辭職。民主黨鄭家富質疑梁錦松是否有能力繼續當財政司司長：「你話公私兩忙，但畀人感覺係公私不分，咁點畀盤數你搞？第日你討論聯繫滙率時，一陣阿梁太又話要沽港元，你又話公私分開，咁點？」  職工盟李卓人形容在新證據下，梁錦松「水洗都唔清」；陳偉業不留情面批評梁錦松信譽破產：「你唔適合再做財政司司長，你已經成為董建華政府負資產，你咁想為市民服務，你最能夠為市民服務，就係盡快喺財政司司長職位上消失。」     客觀看證據夠告有餘   法律界代表吳靄儀坦言，為了要有效推動預算案，「係咪應該畀另一個人做（財政司司長）？」並要求特首將梁錦松涉嫌以權謀私一事轉交律政司處理。獨立議員余若薇形容看到政府新證據後，「個心都實埋……從客觀睇，夠證據告（以權謀私）有餘，換咗係其他低級公務員，已經採取行動。」
20030318-1,20030318,1,彭定康當選牛津新任校長,彭定康當選牛津新任校長 【本報訊】香港殖民地時代的末代港督彭定康獲選為英國牛津大學校長。五十八歲的「肥彭」昨日擊敗大法官賓厄姆勳爵、喜劇演員托克什維格等對手，以四千二百多票當選成為新任牛津校長。     高票擊敗法官   英國廣播公司昨日報道，超過八千名牛津畢業生及學者參加了上星期五及星期六的投票，在現任歐盟外交事務專員彭定康、前任大法官賓厄姆、喜劇演員托克什維格和公眾生活標準委員會前任主席尼爾四人中，選出牛津的新任校長。  校方昨日公布投票結果，在首天投票中已初步領先的彭定康共獲得四千二百多票，較其勁敵賓厄姆多出一千七百多票。他將接替在今年一月身故、上任近十六年的前任校長詹金斯。  今次選舉的主要議題是大學學費的問題，但牛津本科生不能參與投票。彭定康早前發表競選宣言，誓言會盡全力將牛津推上更高峯，與美國的哈佛、耶魯等大學看齊。他指出，牛津面對財政緊絀、受北美大學挑戰和人才外流等問題，要扭轉形勢，畢業生應多給母校捐款，他則可發揮募捐的角色。     有助解決財困   牛津大學校長一職其實是個象徵性的虛位，沒有實權，也不獲薪酬和宿舍，卻擁有崇高的地位。彭定康本身是牛津Balliol學院的畢業生，並在牛津結識現在的妻子。有牛津畢業生認為，彭定康的國際地位，能協助財困的牛津籌款。
20030318-2,20030318,2,遺書囑家人　勿棄容祖兒相片F5女生步母後塵跳樓亡,遺書囑家人　勿棄容祖兒相片 F5女生步母後塵跳樓亡 【本報訊】一名十七歲應屆會考女生，同時亦是歌星容祖兒的歌迷，其母在十多年前跳樓自殺身亡後，父親續弦再娶，由祖母撫養成人的事主，昨日突於母親十五周年死忌後兩天，留下遺書表示生命沒有意義，並叮囑家人不要丟棄家中容祖兒的物品，事後被發現在元朗朗屏邨二樓電梯大堂跳樓斃命。　記者：陳天華、馮志偉、胡苑君 死者劉穎賢，與七十多歲的祖母同住朗屏邨石屏樓二樓一單位，昨晨六時十五分，有街坊發現一樓平台躺卧着一名頭部重創的昏迷少女，於是報警，救護員到場將少女送院，惟抵院證實不治，警方在場調查，相信她是在二樓的電梯大堂越過欄杆跳下。據說，她被送院時，救護員發現其腹部微隆，似有身孕，但是否確實懷孕，則有待法醫剖屍檢驗。     覺得自己失敗   在事發一個半小時後，約七時四十分，正當警方在現場調查死者身份時，住在二樓的劉穎賢祖母起床發現不見了孫女，但卻留下一封給父親和祖母的遺書，內容稱自己渾渾噩噩做了十多年人，覺得很失敗，又說自己不是一名乖女兒，認為生命沒有意義，加上感到功課壓力，故此作出死的決定。另外，遺書又叮囑家人不要丟棄其偶像容祖兒的物品，包括相片、海報及唱碟等。  對於歌迷自殺一事，容祖兒昨晚在一個場合中回應表示：「人死不能復生……為乜事要跳樓呢？唔應該自尋短見。」她又說，既然死者的遺言要求保存其物品，其家人也應該照其心願做。     老師評價極高   另外，劉穎賢就讀的學校就事件回應稱，劉是該校的中五文科生，成績中上，老師對其評價極高，指她為人積極、開朗、非常有禮，從未因情緒問題向輔導主任求助。由於事前全無迹象，校方感到愕然及非常哀痛。  據悉，死者劉穎賢是家中獨女，父親是家具工匠，母親原是大學生，但疑因讀書過度而患上精神病，十五年前的三月十五日，疑病發從一大廈三十樓跳下身亡，當時一家人十分傷心，至幾年前，其父續弦再娶，由於新母親在灣仔工作，為方便上班，父親便與新妻子遷出居住，留下穎賢與祖母繼續在元朗居住。料不到就在母親十五年死忌後的兩天，穎賢竟步母親後塵，走上這條不歸路。
20030318-3,20030318,3,「驚打仗　返唔到嚟香港」退伍軍人　訴說對戰爭看法,「驚打仗　返唔到嚟香港」 退伍軍人　訴說對戰爭看法 美軍完成部署，前線的軍隊只待一聲令下，美伊大戰一觸即發。「軍人就係完全服從命令，效忠國家，軍隊可以話係政治統治嘅工具。」曾參與聯合國維持和平部隊的退伍華籍英軍Ray，訴說自己對戰爭的看法，但拒絕評論美英向伊拉克開火是否一場正義之戰。  「如果你參與過軍事演習嘅，你就唔會想打仗。」Ray來自軍人世家，父親一輩的五兄弟都參加華籍英軍，Ray自小受家庭影響，八十年代，他和兄長待大專畢業便先後投考入伍。在為期十三年的軍旅生涯中，每年兩次的演習已讓Ray體會到軍人在戰爭中承受的痛苦，也培養出他嫉惡如仇、黑白分明的軍人性格。     「侯賽因係抵打」   九一年，波斯灣戰爭結束，Ray所屬的皇家運輸隊二十九營被調往鄰近伊拉克的塞浦路斯駐防，參與聯合國維持和平任務。「嗰陣時都驚會再打仗，驚返唔到嚟香港。」十二年前的戰事仍記憶猶新。「嗰陣時，侯賽因真係抵打，𠵱家美國有好多證據，唔可能全部攞晒出來，係搵緊一個好嘅excuse（藉口）。」Ray以軍人口脗表示，有很多軍事機密非為外人所知，而戰爭是解決的方法。  屬於後勤支援的Ray雖然未曾見過前線死傷狼藉的悲壯場面，但他知道，戰爭帶來的禍害和殘酷是無人可預料的。「速戰速決係最好嘅策略。」分析現在的形勢，Ray表示只有侯賽因答應美國的要求退位或逃亡，否則戰事無可避免。     當軍從不言悔   將人生最美好的青春獻給軍隊，現年四十一歲的Ray從不言悔。「軍隊所學嘅嘢，喺其他地方學唔到。」Ray表示，在軍中培育出自我克制、刻苦耐勞的個人意志，讓他一生受用。他笑稱若不是九七回歸，要解散華籍英軍，說不定他現在仍會在軍隊服役。  記者：陸羽平
20030318-4,20030318,4,局勢告急　港記者撤離危城,局勢告急　港記者撤離危城 【本報訊】伊拉克局勢告急，港府呼籲市民不宜前往伊拉克及鄰近地區，目前仍在當地的香港居民應盡快離開。入境處則設立二十四小時求助熱線，協助有需要的香港居民。  保安局表示，至昨早為止，約有十三名香港記者仍在伊拉克，二十六名記者在鄰近地區採訪。由於局勢緊張，本港各傳媒派駐當地的記者昨已陸續離開，有線電視新聞及體育部副總裁趙應春表示，該公司在中東的採訪隊有十三人，仍留在伊拉克採訪的助理新聞總監馮德雄昨晚已跟隨中國駐伊拉克大使張維秋撤出巴格達；在科威特採訪的則有五人。  亞視新聞部高級副總裁關偉表示，派駐伊拉克人員在昨晚九時已安全抵達約旦。至於科威特的三人採訪隊，如覺得有危險便要撤離。他最擔心以色列的情況，因為不時發生「人肉炸彈」事件，因此以色列採訪隊日內會離開；而土耳其採訪隊也將於今日返港。     入境處設熱線   無綫方面，伊拉克的採訪隊數日前已經離開，而約旦安曼的採訪隊部份人員會返港，部份轉到科威特，當中包括助理總經理黃應士、記者譚衛兒及陳凱欣等。  港府昨發表聲明，指現時不宜前往伊拉克及鄰近地區，仍在當地的港人應盡快離開。入境處則設立全日求助熱線：28293010，為有需要的港人提供協助。在約旦、伊朗、沙地阿拉伯、土耳其、科威特及敍利亞的港人，可向當地的中國大使館求助。不過，目前未有香港旅行團前往或途經伊拉克，也未接獲港人求助，有需要的香港居民，可致電入境處電話：28246111，查詢中國駐海外使館的資料。  美國駐港總領事館昨晚顯得外弛內張。記者走近領事館門外拍照時，立即有幾名保安人員衝出查問，知是記者後才鬆一口氣，並着記者遠離領事館。至於英國總領事館的保安人員，看見記者則若無其事，只是左閃右避，不想被攝入鏡頭。據記者所見，未見警方特別加強領事館保安措施。
20030318-5,20030318,5,只想向港施壓　取消削減工資菲國將撤傭工來港禁令,只想向港施壓　取消削減工資 菲國將撤傭工來港禁令 【本報訊】菲律賓傳媒報道，菲律賓總統阿羅約夫人答應短期內撤回暫停批准菲傭來港的禁令。  她解釋，菲律賓政府只想向香港特區政府施加壓力，希望港府取消徵收外傭稅及削減菲傭工資，當局會將事件提交國際勞工組織，控告港府。  阿羅約夫人在本月五日指示海外就業管理局，暫停批核來港當外傭的申請，以抗議本港徵收外傭稅及調低外傭最低工資。     決定被批評輕率   不過，這個決定引起本港菲傭組織不滿，組織更批評阿羅約夫人的決定輕率，危及她們的生計。  事隔不足兩星期，阿羅約向當地傳媒承諾，短期內撤回菲傭來港禁令。  但她同時強調，不但菲律賓政府反對本港開徵外傭稅，本港的僱主及其他輸入外傭的亞洲國家也表示不滿。  本港家庭傭工僱主協會副主席羅軍典昨日回應時說，早料到菲律賓總統的禁令不能維持長時間。他指出，近期不少外傭僱主聯絡該會，擔心下月一日菲律賓當局不肯批出屬新工資的菲傭合約，他計劃今日聯絡菲律賓駐港總領事館，了解對方的取態。
20030318-6,20030318,6,王永平指目標未達　會採其他措施議員恐政府迫公僕離職,王永平指目標未達　會採其他措施 議員恐政府迫公僕離職 【本報訊】政府將削減一成公務員，節省二百億元的有關開支。但有立法會議員擔心，政府為達收支平衡，將會「不擇手段」強迫公務員離職。公務員事務局局長王永平承認，若未能達致削減人手及開支的目標，會考慮採取其他措施，但重申現階段沒有裁員計劃。     三管齊下削減人手   在昨日的立法會公務員及資助機構員工事務委員會上，王永平解釋，政府會透過第二輪自願離職計劃、停止招聘公務員及自然流失三管齊下的方法，削減一成公務員人數至約十六萬人，並減少二百億元開支。  不過，他補充說，能否達致目標則要視乎有多少公務員參與自願離職計劃；若無法達到目標，才會採取其他可行措施，但他始終不肯解釋其他措施是否包括裁員行動。  多名立法會議員都擔心政府若無法達致平衡預算，將會強迫公務員離職。民主黨立法會議員張文光認為，若解僱公務員，將違背特首的承諾。職工盟的李卓人則批評，政府一方面津貼僱主訓練大學生，但另一方面停止招聘公務員，任由大學生「自生自滅」，是自相矛盾的做法。
20030318-7,20030318,7,促港將日文列入課程,促港將日文列入課程 【本報訊】本港的學生現時要掌握兩文三語，將來或會變成三文四語。因為日本駐港總領事橫田淳昨表示，正尋求港府將日語列入中學課程的可能性，這對香港將會大有裨益。  橫田指出，目前只有一間中學有開辦日語課程供學生選讀，但卻有超過十間中學有開辦英語以外的歐洲語言課程；但近年報考「日本語能力檢定試」的人數連年增長，日本文化協會主辦的日語課程也大受歡迎。  中文大學日本研究學系系主任李活雄指出，現時日語課程需求甚殷，以中大為例，今年總共開辦十一班日本語基礎課程給學生報讀，是該系創系十一年以來最多；學生報讀的原因主要是為興趣，亦有一些是為了前途或到日本旅遊，去年畢業的二十五名本科生中，就業率達百分之百。
20030318-8,20030318,8,東涌吊車恐影響巴士,東涌吊車恐影響巴士 【本報訊】估計每年可吸引數十萬名遊客來港、由地鐵有限公司負責經營的東涌吊車將於二○○五年落成。在昨日一個討論吊車條例草案的立法會委員會上，有立法會議員擔心，吊車落成後會影響大嶼山巴士公司的生意，導致數以百計從業員失業。  「吊車落成咗，啲遊客湧晒去搭吊車，咁咪即係迫巴士公司執笠。」立法會議員陳偉業批評，政府研究東涌吊車計劃時，沒有顧及大嶼山巴士公司數以百名員工的利益，擔心他們成為吊車落成後首批「犧牲品」。出席會議的經濟發展及勞工局副旅遊事務專員栢志高表示，相信吊車落成後每年會吸引數以十萬名遊客到訪，屆時大嶼山巴士公司將有更多機會發展其他旅遊景點路線，反而有助改善巴士公司現有經營狀況。
20030318-9,20030318,9,促強制標籤基因食品,促強制標籤基因食品 【本報訊】市民在超級市場或街市選購食物，除了考慮價格及品質等因素外，食品有否含基因改造成份，也是重要的考慮因素之一。民主黨訪問了六百名市民，超過六成人認為政府應修改法例，強制在基因改造食品加上標籤；近六成市民表示，會選擇一些完全不含基因改造成份的食品，以確保健康。  負責調查的民主黨食物安全及環境衞生政策發言人李華明昨在記者會上表示，鑑於現時仍未能證實基因改造食品是否對人體的健康構成損害，因此政府有責任立法，強制標籤含基因改造食品，讓市民知所選擇。  李華明表示，立法會食物安全及環境衞生事務委員會下月會到澳洲及日本，考察當地政府管制基因改造食品的情況。
20030318-10,20030318,10,「我哋喺香港冇尊嚴」36歲女新移民受盡白眼,「我哋喺香港冇尊嚴」 36歲女新移民受盡白眼 港人近年面對經濟重擔和倒行逆施的政府政策，被壓得筋疲力竭，心底裏原有的仁慈和關愛，一點一滴被擠乾擠淨。天主教香港教區主教陳日君說這是病，病徵是對人漠不關心、欠缺愛心、缺乏尊重、盲目而短視、忽視弱勢、剝削和不公義。 本報將一連數天向讀者揭示種種病例，故事主人翁其實每天都在我們身旁經過，問題是：你是否願意拿出愛心、開出藥方，還是容許歧視繼續存在？　記者：陳廣慧、徐岱靈 自爭居權事件後，新移民總令人聯想到無學識、無文化、無禮貌，說話帶有濃厚鄉音的「阿燦」，女的更糟糕，十居其九被視作「北姑」。對來港只有兩個多月的阿儀（化名）來說，在四川，她是一個幼稚園教師，在香港，她是一個受盡人白眼的「大陸婆」，她的生活毫不快樂：「我哋呢啲人喺香港都係冇尊嚴㗎嘞。」  三十六歲的阿儀多年前在家鄉四川認識一名「香港仔」，由拍拖到結婚，她的生活由天堂跌落地獄。五歲的兒子天倪二○○○年獲准來港與父親一同生活，但不久父親卻因犯事被重判坐牢十六年。     母子住丁方板間房   去年十二月三十一日，阿儀獲發單程證來港，與家翁家姑同住，無奈婆媳不和，結果兩母子被趕出街，在尖沙嘴露宿街頭，後在社工協助下入住深水埗一間板間房，房子細小得坐廁就在床邊。  現在每月靠四千五百九十六元綜援金過活的阿儀，很想自力更生。她來自四川，較香港人優勝之處是通曉普通話，一心以為可當個普通話補習老師。「我去申請，佢哋話我唔識電腦，唔識打字，又話我廣東話唔正。」 「話我廣東話唔正」   「我想學電腦，報讀基本文職訓練課程。」阿儀拿着刊載着課程資料的報紙說：「去到報名，個小姐同我講：『你知唔知𠵱家香港三十幾歲人，做文職啲人唔要㗎！你講廣東話又唔正，做接線聽電話又聽唔到……』」  在四川當幼稚園教師的阿儀，從沒想過在香港找份文職工難過登天。她沮喪地說：「咁我唔讀書囉，去洗廁所囉！」但清潔工也不易為，一天工作十二小時，天倪中午放學後由誰照顧？  阿儀於是向社會福利署求助，社工卻向她連珠炮發：「你哋啲新移民個個一落嚟就攞綜援，又唔慳啲使，你哋就唔使捱苦，我哋香港啲錢唔會畀你咁使！」  社工質疑兩母子每月已有四千多元綜援，包括學費、房租連生活交通已十分充裕，但一個小孩子需要的，實在不只是填飽肚皮。     居深水埗被人問價   記者在阿儀家中見到一罐奶粉，天倪急不及待搶着埋怨媽媽：「佢唔肯買高兒聰！」原來天倪就讀的幼稚園，老師叫全校小朋友買一款價錢較貴的奶粉，但一個綜援家庭負擔不了，結果媽媽買了平價奶粉，兒子一直耿耿於懷。沒有錢就沒有交通費，兩母子已經不去想，何時可以再長途跋涉去赤柱探望獄中的丈夫和父親。  即使是日常生活，每天也有令人氣結的時候。「去買餸，揀條菜都俾人叫大陸婆！去睇醫生，要攞好多證明文件，又俾人話大陸仔阻住晒啲時間。」  居於深水埗區，阿儀試過拖着天倪時被途人當街問價：「有個男人話畀我五百蚊，叫我跟佢返去！」  阿儀說，的確有一些新移民是藉假結婚，刻意騙取綜援，做非法或不道德的勾當，但這並不代表全部新移民也是十惡不赦的罪人。「尊重，已經唔知係乜嘢感覺。只不過我係新移民，你係舊移民，唔應該一竹篙打一船人。」
20030318-11,20030318,11,從未提醒買車涉利益衝突阿松卸責助手當殃,從未提醒買車涉利益衝突 阿松卸責助手當殃 財政司司長梁錦松偷步買車遭窮追猛打，特首董建華一力護短，但梁錦松昨日在立法會被議員連番追問他在事件中是否蓄意以權謀私、是否有人作出過提點時，梁錦松情急之下，竟然把兩名下屬也扯落水，指兩人曾乘坐其凌志LS430新車，但二人由始至終沒有提醒他買車可能涉及利益衝突。     一月底重坐過我架新車   梁錦松上任年多以來，每次露面身旁總少不了政務助理李達志及新聞秘書譚志源的蹤影，兩人均是政務官（AO），李達志曾任經濟局首席助理局長，譚志源曾任香港駐日內瓦經濟貿易辦事處副代表，之前任特首副私人秘書，主要負責董太的公關工作，兩人於○一年起擔任梁錦松的左右手。偷步買車醜聞被揭發後，兩人一直協助梁錦松向記者解畫。  昨日會上議員主要針對梁錦松言行質問，但涂謹申突然提出其政務助理及新聞秘書，有沒有提醒上司可能失職，一直以沉重語氣回答問題的梁錦松，爽快地說兩名下屬不但知道他買新車，而且「一月底重坐過我架新車」。     聲稱沒看過庫務局指引   梁錦松指助手沒有提醒他，連庫務局發出要有份參與制訂預算案人員遵守申報利益衝突的指引，他亦說沒有看過，但根據資料，此文件會送交財政司司長備考。  本報記者
20030318-12,20030318,12,葉澍堃：戰事爆發　構成壓力失業率回升至7.4%或再惡化,葉澍堃：戰事爆發　構成壓力 失業率回升至7.4%或再惡化 【本報訊】政府昨日公布的數據顯示，原已穩定的失業率再度攀升零點二個百分點，回復至半年前的水平，達到百分之七點四。失業率攀升主要受建房量減少的影響，令失業人口增加逾一萬人至二十五萬六千人。學者指出，未來失業率走勢，將視乎戰爭情況及本港能否迅速解決非典型肺炎問題。  對於去年十二月至今年二月的失業率上升至百分之七點四，經濟發展及勞工局局長葉澍堃表示，雖然零售和酒店業的就業情況有改善，但因建造業和裝修行業受公營及私營房屋興建量減少的影響，令失業率上升。     就業不足下降   此外，就業不足率由百分之三點一降至二點九，即有十萬零一千人就業不足，減少六千八百人，其中主要來自建造業，製造業的就業不足率亦見下降，但幅度較小。  葉澍堃指出，現時評論非典型肺炎對本港經濟的影響是言之過早，但他承認，若爆發戰爭，將對失業率和本港經濟構成壓力。  科技大學經濟發展研究中心主任雷鼎鳴表示，一旦爆發戰爭，油價將會上升，對美國經濟構成壓力，同時美元貶值，有可能影響香港的入口價格，投資者在投資港元資產時也會較為審慎；而戰事長短、會否引發對美國的報復襲擊等，都會影響本港經濟和失業率。  他又指出，暫時非典型肺炎對港影響不大，但若政府未能在短期內解決問題，對經濟及失業率都有負面影響。
