key,date,article_daily_id,title,text
20030925-142,20030925,142,蓋茨說不知情微軟關閉網上聊天室,蓋茨說不知情 微軟關閉網上聊天室 互聯網世界廣闊無垠，很自由，很自在，網上聊天室更讓人暢所欲言，或論盡天下，或說是道非，或胡說八道，這是最能實現言論自由的一片天地。然而，美國電腦巨擘微軟公司周三宣布，由於聊天室讓孌童癖和垃圾電郵有機可乘，微軟旗下的MSN網站將全面停止免費無監管聊天室服務，包括香港在內的全球二十八個國家或地區共二十五萬個聊天室更會乾脆關閉。 微軟周三宣布，從十月十四日起，MSN在歐洲和中東所有聊天室將會全部關閉，亞洲和拉丁美洲絕大部份地區的聊天室也一樣，MSN只會在加拿大、澳洲、日本、新西蘭和巴西提供有主持人二十四小時監察的聊天室。  不過，身在南非的微軟主席蓋茨，竟表示對關閉聊天室的決定概不知情，他周三回答記者時說：「我不知道有那回事，看了報道才再回應。」本年四月，微軟曾宣佈推出「網上廁所」，當時蓋茨一樣懵然不知，後來澄清那「網上廁所」只是惡作劇。     籲改用MSNMessenger服務   微軟承認聊天室的討論內容九成九是正當的，但指孌童癖者在聊天室尋找獵物，垃圾訊息散播者在聊天室張貼色情訊息、蒐集其他人的電郵，沾污了整個服務。  「聊天本來有點嬉皮士特質，是免費和開放的，但一小撮人改變了它，影響了所有人，這很令人悲痛。」MSN歐洲總經理薩頓說：「我們嘗試做正確的事，展示我們負責任的領導者立場。」  大刀闊斧下卻有例外，MSN在美國、加拿大和日本仍會開放沒有主持人監察的聊天室，但只有MSN的收費服務訂戶才能使用。微軟解釋，這是因為他們的身份和資料都寫在收費紀錄上，應該不敢犯事。  至於在其他完全關閉聊天室的地區，微軟叫用戶改用免費的即時訊息傳遞工具MSNMessenger在網上聊天。MSNMessenger用戶可以只和聯絡人名單上的網友聊天，其他人要得到用家許可才能加入名單，比聊天室較能控制聊天對象。  MSN香港總監陳毓秀向本報表示，香港MSN聊天室亦將在下月十四日關閉，暫時未有計劃重開。他指出，關閉聊天室其實也是因應用戶習慣，亞洲的MSNMessenger用戶數目，是聊天室的七倍。微軟亦指MSN在全球有二億用家，但只有一百二十萬人使用聊天室。 香港議員：MSN做法無不妥   香港理工大學通識教育中心首席講師史文鴻不贊成MSN關閉聊天室，認為會令正當用戶不能再用MSN這服務，但他認同要監管網上聊天室十分困難，只能依靠用戶自律。代表資訊科技界的立法會議員單仲偕，卻認為MSN做法沒有不妥，網民仍可在網上其他地方發表意見。  路透社/法新社/英國廣播公司/本報記者
20030925-143,20030925,143,與被捕華裔教士相識美控敘裔繙譯通敵,與被捕華裔教士相識 美控敘裔繙譯通敵 美國軍方進一步擴大在關塔那摩戰俘營的間諜搜捕行動，繼三日前公布拘捕華裔隨軍回教士優素福．余（YousefYee）上尉，周二再公布起訴一名敍利亞裔空軍繙譯員，指他企圖把美軍機密情報送往敍利亞，控以三十二項罪名，包括間諜和通敵罪，最高可判死刑。 現年二十四歲的被告哈拉比和優素福．余一樣是回教徒，於二○○○年一月加入空軍，去年被調往專門囚禁阿富汗戰犯俘虜的關塔那摩基地服役九個月，擔任阿拉伯語繙譯員。任務結束後，他在今年七月二十三日，即約兩個月前飛返佛羅里達州，當局立即拘捕他，目前扣留在加州一個空軍基地。  控狀指出，哈拉比被捕時身上藏有兩份囚犯手寫筆記，他準備把筆記交給某人帶到敍利亞，而筆記內容全部是關於美國情報搜集工作的細節，以及美國的反恐戰計劃。     私藏戰俘筆記口訊   此外，哈拉比被捕時攜帶的手提電腦亦載有囚犯機密資料，以及約一百八十個囚犯的口訊，準備送往敍利亞或卡塔爾；他又藏有往來關塔那摩軍機資料和軍事設施地圖。  控狀列出哈拉比涉及的罪行還包括：  ‧在關塔那摩把囚犯資料及情報經電郵傳送給未獲授權的明知「敵人」  ‧拍下戰俘營的照片  ‧未獲授權下跟囚犯接觸，包括為囚犯送酥餅點心  ‧隱瞞另一名未具名軍官在未獲授權下接觸囚犯  ‧與敍利亞駐美國大使館聯絡，但未依例上報  ‧向空軍虛報前年已入籍成為美國公民     控32罪被空軍扣留   一名空軍發言人表示，哈拉比和優素福．余認識，但未知是否同謀；他沒有透露兩人被捕是否有關。哈拉比被控的三十二項罪名包括八項與間諜有關、三項通敵和其他違反命令、偽造文件及銀行詐騙罪。優素福．余於本月十日被捕，暫未被起訴。  代表哈拉比的軍方律師倫敦質疑軍方今次起訴行動證據不足：「我們不認為已見到足夠證據支持控罪。」  美國正調查敍利亞的角色，但敍利亞指有關指控「毫無根據」。  美聯社/法新社/《紐約時報》
20030925-144,20030925,144,阿蓋德曼谷圖襲以航,阿蓋德曼谷圖襲以航 亞太經濟合作組織（APEC）領袖峯會下月才在泰國首都曼谷舉行，但恐怖襲擊警報已頻傳。周三，泰國總理他信證實，的確有恐怖分子密謀在曼谷向以色列航機施襲，曼谷警方已經搗破陰謀。  他信說：「有組織承認有恐怖襲擊計劃，我們對以色列航機一向採取特別嚴密的保安。」他沒有進一步解釋，只呼籲市民毋須恐慌。     機場櫃位附近攝錄   以色列一間電視台周二報道，曼谷警方搗破了恐怖組織阿蓋德施襲陰謀，三個月前在曼谷機場拘捕了一名男子，他當時在以色列航空公司櫃位附近用攝錄機拍攝，懷疑企圖襲擊以航乘客。警方把他拘捕後，在他家中搜出圖謀施襲的證據。  APEC舉行在即，美國傳媒日前報道，落網的「東方拉登」漢巴利供稱阿蓋德將施襲，包括用導彈擊落客機和炸毀兩間美國集團酒店（萬豪和Conrad）。當局已將保安升級。  法新社
20030925-145,20030925,145,廣告數普京七宗罪,廣告數普京七宗罪 五名俄羅斯知名人士在英美多份大報，包括《金融時報》、《每日電訊報》、《華盛頓郵報》和《紐約時報》，刊登全版廣告，狠批總統普京「七宗罪」，敦促美國總統喬治布殊檢討普京這朋友是否交得過。     異見者英美登公開信   以長居英國的俄羅斯大亨別列佐夫斯基為首的五人，估計花了約三百二十萬港元刊登這封致喬治布殊的公開信，提出普京施政的「七宗罪」，包括：  ‧克里姆林宮幾乎直接操控國會、傳媒和法庭，令選舉淪為鬧劇  ‧在車臣犯下種族滅絕和戰爭罪行  ‧內舉不避親，安插前國安局同僚出任逾半主要官職  ‧情報機關利用反猶太主義和恐外情緒，將大企業「妖魔化」  ‧製造類似納粹德國下的「軍國主義歇斯底里情緒」  普京周二啟程到美國訪問，將和誇讚他「誠實坦率」的喬治布殊會談。美國駐倫敦大使館指廣告篇幅顯著，白宮必定留意得到。  公開信另外四名聯署人包括投奔英國的前政治犯布科夫斯基，俄羅斯著名異見人士沙哈洛夫遺孀本納和俄羅斯國會兩名前議長。  英國廣播公司
20030925-146,20030925,146,被斥打壓網上言論,被斥打壓網上言論 微軟關閉MSN聊天室的決定，有保護兒童慈善組織叫好，說可避免孌童癖者侵害兒童；但也有人狠批，指微軟這種做法等於在網上打壓言論自由，也令孌童活動「地下化」。     孌童活動將「地下化」   英國保護兒童慈善組織NCH支持微軟關閉聊天室。NCH互聯網顧問卡爾說：「過去十二個月，因互聯網而發生在孩子身上的壞事有上升的趨勢，我們不能坐視不理。」英國「全國防止虐待兒童協會」認為微軟做法值得其他公司效法。  但微軟關閉聊天室，有人指形同打壓網上的言論自由，持這些論調的包括言論自由支持者和業內人士。微軟的競爭對手AOL、雅虎和英國互聯網服務供應商Freeserve都聲言不會改變本身的聊天室政策。Freeserve發言人說：「聊天室是網上最受歡迎的交流工具，那不會消失的」，並指這種不顧後果的宣傳伎倆，只會令兒童轉用沒監管而不太安全的聊天室。  反對者認為那只會令兒童轉到更隱匿的聊天室聊天，那時更難監管了。英國監察組織「英格蘭兒童權益聯盟」（CRAE）政策顧問道蒂說：「兒童喜歡和其他人聊天，他們希望互相扶持，希望交談，歷史證明關閉一些東西只會令活動轉移陣地，那就更危險。」  路透社/英國《獨立報》
20030925-147,20030925,147,美簽證系統中病毒,美簽證系統中病毒 美國國務院一個核對簽證申請人身份的電子系統，周二遭電腦病毒入侵，全球系統癱瘓了數小時，影響全球美國簽證審批。  國務院周二晚向全球大使館和領事館發內部通告，指「領事館監察及支援系統因發現病毒要關閉」。該系統儲有逾一千二百八十萬個來自聯邦調查局、國務院、移民部、情報部門的檔案，包括至少七萬八千個懷疑恐怖分子的名單。所有簽證申請人都要經系統核對，沒問題才會獲發簽證。     癱瘓數小時   系統沒有後備支援，停頓了數小時之久才恢復運作。但駐南韓漢城美國大使館發言人指這「不是大問題」。  國務院沒有公布系統感染了何種電腦病毒，但在另一項內部通告中說發現了「Welchia」病毒。這種病毒上月出現，專門襲擊新版的微軟視窗軟件，和「Blaster」病毒合共襲擊了全球數以十萬計電腦。  美聯社
20030925-148,20030925,148,甘迺迪新婚照,甘迺迪新婚照 美國史密森藝術和工業大樓，上周五起展出五十五張前總統甘迺迪夫婦的黑白生活照。照片於一九五四年拍攝，當時兩人新婚，在喬治敦居住。  （圖一）：甘迺迪和積琪蓮站在寓所露台看街景。  （圖二）：甘迺迪在國會辦公室看文件，罕有地架着眼鏡上鏡，積琪蓮則在旁寫字。  美聯社
20030925-149,20030925,149,加州垃圾電郵罰780萬,加州垃圾電郵罰780萬 美國加州州長戴維斯周二簽署國內最嚴厲的打擊垃圾電郵法案。法案涵蓋所有在加州收發的垃圾電郵，不單針對發出垃圾電郵者，也追究電郵所宣傳的公司，每宗事故最高可判罰七百八十萬港元。華盛頓州九八年通過同類法案，只針對誤導失實宣傳電郵，最高罰款為每封三千九百港元。  美聯社
20030925-150,20030925,150,沙地挾人質槍手三死,沙地挾人質槍手三死 沙地阿拉伯南部吉贊市槍手周二闖進醫院挾持人質事件在疑團中結束，內政部與當地電視台完全不提及人質，只說警方突襲殺死三名槍手、兩槍手投降，卡塔爾半島電視台網站則指所有人質獲釋。記者周三走進醫院，只見內裏滿布血迹、彈殼和玻璃碎，催淚氣氣味在十八小時後仍未散去。  美聯社
20030925-151,20030925,151,國際點與線：「蠢材，那仍然是經濟問題」 - 林沖,"國際點與線： 「蠢材，那仍然是經濟問題」 - 林沖 美國人對於政客的講話總不會忘記，從加利哈特的「牛肉在哪裏」，到尼克遜的「再也不會有尼克遜給你們玩了」，人人都記得。周一，美國最新公布的民意調查，說若在今天舉行總統大選，喬治布殊會輸給民主黨的克拉克，就在這骨節眼上，人們又傳誦起老布殊十一年前輸給克林頓一役中，小克的那句話：「蠢材，那是經濟問題。」（It'stheeconomy,stupid）自由派的幾個專欄作家，這兩天把這句話改了一改，改成「蠢材，那仍然是經濟問題」（It'sstilltheeconomy,stupid）。     逃不出經濟枷鎖   左右美國明年大選的決勝因素，主要仍然是國內問題而非伊拉克局勢。三十年來，只有一次美國大選是靠外交問題定出高下──七二年，尼克遜答應下令美國撤出越南，終於贏得連任。此後三十年，沒有一個美國總統能逃出「國內因素」這一命運枷鎖。喬治布殊父親老布殊，縱使擊潰伊拉克解放科威特，最後仍然死在經濟下滑手裏。  美國經濟在九一一事件後一直未見好轉，這所以喬治布殊要撤換財長奧尼爾之故，可是美國經濟到今天仍然疲弱，聯邦基金利率已降至人們有記憶以來的低位，可是依然未有起色。美國近日放出風聲，暗示強美元政策可能有變數；美國在財金政策上出現大調整，正是為明年大選喬治布殊蟬聯鋪平道路。  美國經濟能否趕及在明年十一月大選前出現復甦勢頭，未必能如願。反恐戰未能竟全功，九一一翻版的陰影一直未能清除，這對於祈求有一個安定環境發展經濟的美國來說，不啻是雪上加霜。美國人是不是就這樣判了喬治布殊死刑，言之尚早，但剛過了的周一晚上，他接受電視台專訪，竟落得慘淡收場，全國僅四百萬人收看！  是美國人厭倦了喬治布殊，抑或是美國人厭惡透了政治？很難有一個清晰的答案。可是，歷史證明，經濟問題處理不好，必難逃下台的命運，八十年代初的卡特如是，九十年代的老布殊亦如是，喬治布殊是不可能不知道的。"
20030925-152,20030925,152,丹麥王儲娶澳洲民女,丹麥王儲娶澳洲民女 現代灰姑娘的童話再次重演。繼丹麥二王子約阿希姆娶了香港民女文雅麗後，他的兄長、王儲弗雷德里克亦決定和澳洲籍民女唐納森共諧連理，結束鑽石王老五生涯。丹麥兩名王子相繼迎娶民女，成為歐洲一時佳話，有人甚至形容這是「全球化」的表現。 丹麥王室周三宣布，女王瑪格麗特二世已首肯這門親事，將於下月八日的內閣會議取得內閣同意後，才會正式宣布王儲訂婚喜訊。根據丹麥憲法，王室婚姻須經政府批准，但只屬禮儀性做法。至於婚期則暫時仍未落實，不過據弗雷德里克的私人秘書透露，婚禮會在明年舉行。     未來王后念法律   三十五歲的弗雷德里克和比他年輕四年的唐納森，於二○○○年悉尼奧運會上由西班牙王儲費利佩介紹認識。自此二人暗中交往，直至前年年底被一本丹麥名人雜誌報道，戀情才告曝光。當地輿論和國民對這位「未來王后」甚有好感，對她的甜美外表、趨時衣着以至法律系學位無不讚賞有加。  過去一年兩人感情愈趨穩定，開始結伴出席公開場合，唐納森去年聖誕節更與女王一家過節。女王上月已向傳媒放風，在一個記者會上稱讚唐納森「肯定會是好媳婦」。  丹麥國民對今次婚訊期待已久，王室公布消息後，國家電視台整個早上不停作出特別新聞報道。首相拉斯穆森喜孜孜說：「王儲作出了一個好抉擇。」     「這才是全球化」   正在王宮外觀光的二十三歲巴西遊客桑托斯也大讚：「弗雷德里克從另一個洲挑選太子妃是很好的決定。這才是全球化呀。」  樣子俊朗、極受國民愛戴的弗雷德里克，過去曾有數名丹麥女友，但最終還是選了來自國外兼屬平民身份的唐納森，令她成為首位嫁入歐洲王族的澳洲平民。  唐納森生於學術世家，有三姊弟，是么女，父親現職英國牛津大學數學講師，生母在她出生後不久逝世，繼母是英國小說家。唐納森在澳洲長大，大學畢業後於悉尼任職地產經紀，二○○二年遷居丹麥，在當地的微軟分公司工作，但她周三宣布離職。  綜合外電報道/澳洲《信使報》
20030925-153,20030925,153,丹麥皇室平民化,丹麥皇室平民化 唐納森嫁給丹麥王儲，將成為未來的王后，這個童話般故事羨煞了不少人。不過她並非首位嫁予丹麥王室的平民，只是延續了近代丹麥王族與平民通婚的趨勢。  早在八年前，二王子約阿希姆便娶了個港產王妃文雅麗，成為本港茶餘飯後的話題。在嫁給約阿希姆前，文雅麗像其他香港女孩一樣，過着朝九晚五的平民生活，嫁予王族後，為丈夫誕下兩名小王子。     港產王妃成佳話   女王瑪格麗特二世本人對門當戶對的觀念看得很淡，王夫亨里克親王也非出身王族，只是個法國外交官。  不過王室生活也不易適應。六十八歲的亨里克去年一度因不滿被王室侍從呼喝，覺得地位卑微和有被侮辱之嫌，一度憤然「出走」，回法國老家三星期。  本報資料室
20030925-154,20030925,154,美富豪扮啞婦支解鄰居,美富豪扮啞婦支解鄰居 美國紐約地產大亨德斯特（SeymourDurst）之子羅伯茨（RobertDurst）兩年前由紐約搬到德州居住，但他男扮女裝扮成啞婦，後來更殺死鄰居，把他千刀剮，砍下他的手、腳和頭，棄屍大海，之後若無其事跑去理髮又到酒店喝酒。控方指他是「冷血狡猾的殺人犯」，但辯方說他有輕度自閉症才犯下血案。     先槍殺再分屍扔海   德州法庭周一開審這宗離奇殺人案，六十歲的紐約地產大亨之子羅伯茨，被控前年九月在德州家中槍殺七十一歲的布萊克，然後像「宰牛」那樣，把死者的臂、腿和頭顱一一砍下，裹屍三層丟入海港。  羅伯茨否認控罪。辯方律師說，案發當天，羅伯茨返到家裏，赫然發現布萊克擅闖入他的房子，還拿了他的手槍，於是兩人展開「生死搏鬥」，突然手槍聲起，布萊克中槍，羅伯茨驚慌得發狂才支解死者。辯方律師還說，羅伯茨患了輕度自閉症，「有那種會逃避麻煩的性格」。     為前妻失蹤案逃亡   不過案發時，羅伯茨一身麻煩：他的前妻一九八二年離奇失蹤的案件重開調查，而她一名朋友兼案件證人又在二○○○年被殺，因此他逃亡到德州。雖然他的家族在曼哈頓擁有不少著名物業，他在德州只租住月租僅二千多港元的廉價單位，他又易服扮成啞婦，但最後還是逃不過殺人的官司。  英國《每日電訊報》/美國《紐約每日新聞》
20030925-155,20030925,155,腸道不適　教宗取消接見信眾,腸道不適　教宗取消接見信眾 教宗若望保祿二世以「腸道不適」為理由，罕有地取消周三到聖伯多福廣場接見信眾，再次引起外界關注他的健康，並憂慮他下月能否出席上任二十五周年紀念和德蘭修女的宣福禮。  梵蒂岡指教宗是於周二下午感到不適，但強調只是「小問題」。教宗透過電台祝福信眾，後來電視播放他祝福時的影像，只見八十三歲的教宗臉色蒼白、身體虛弱、口水微淌。雖然只說了短短兩句話，但說到一半已無聲，最後更喘了一大口氣，彷彿無法呼吸。     10年來第三次   教宗在過去十年只曾三次取消出席這項每周一次的定期活動。不過梵蒂岡堅稱，醫生只是慎重起見，為免出現併發症，才要教宗取消今次露面。教宗九二年要動手術切除膽內一個橙般大小的腫瘤。八一年他又在遇刺受傷後切除部份腸臟。  路透社/法新社
20030925-156,20030925,156,美國媽媽乳汁含毒防火劑,美國媽媽乳汁含毒防火劑 美國非牟利組織「環境工作組織」周二公布一項調查報告，指美國給嬰兒餵母乳媽媽的乳汁中含有有毒防火劑多溴化聯苯醚（PBDE），但強調毋須中止哺乳。     來自日常家具   這項調查研究了二十名美國媽媽，其中兩人乳汁中的PBDE含量更是美國歷來錄得的最高水平；她們二十人乳汁中的PBDE含量，更是歐洲最近類似調查得出的平均水平的七十五倍。  但報告指美國婦女毋須中止哺乳，因為沒有研究證實從母乳中吸入阻燃劑等化學物質會危害兒童健康。  PBDE有防火作用，廣泛應用在家具、電腦、電視機、影印機等產品上，但PBDE與殺蟲劑（DDT）和聚氯聯苯（PCB）一樣會積聚在人體中。有研究發現積聚太多PBDE會令老鼠學習、記憶和行為受影響。  美國有線新聞網絡/新華社
20030925-157,20030925,157,減免費用戶省支出,減免費用戶省支出 微軟關閉大部份MSN網上聊天室，說是為了杜絕孌童癖者侵害兒童和散播垃圾訊息人士濫用，盡「社會責任」。不過，業內分析員指出，微軟還有商業考慮，那就是要賺錢。     MSN首季蝕7.2億   MSN是微軟一大虧本部門，今年首季虧損近七億二千萬港元。美國「微軟路向」分析員赫爾姆認為，微軟大動作關閉MSN聊天室，可減去MSN免費用戶，增加整體收入。  「這個轉變有好的副作用，如可把散播垃圾訊息人士趕出聊天室。」他說：「但我相信那是要改善MSN賺錢能力。這令微軟可放棄支援聊天服務的設施，省下資源賺更多錢。」  聊天室關閉後，MSN用戶若要不被監視在網上聊天，只有兩方法：一是成為MSN的收費服務訂戶；微軟上月才宣布推出名為「MSNPremium」的計劃，包括電郵收發和數碼照片分享等服務，月費約七十八港元。二是使用即時訊息傳遞工具MSNMessenger；微軟、AOL和雅虎都在爭奪這個市場。  美聯社
20030925-158,20030925,158,大耳王,大耳王 這頭巴吉度獵犬雙耳全長二十九點二厘米，獲健力士世界紀錄大全確認為全球耳朵最大的狗，他的主人已為牠雙耳買重三十七萬港元保險。  美聯社
20030925-159,20030925,159,國際醫Mail,國際醫Mail 兒子幼時患癌，母親不妨多檢查乳房。研究發現，孩子若5歲前診斷出癌症，母親就會在誕下他10年內可能患乳癌，可能性比正常高1倍。若患癌的是男童，母親患乳癌的可能性又高50%。專家推斷是懷孕時荷爾蒙失調，胎兒p53抑癌基因失調。
20030925-160,20030925,160,小統計,"小統計 聯合國周二發表首份有關全球使用搖頭丸和安非他命的調查報告，發現全球逾4,000萬人服食，並有上升趨勢，而且不少人不知服食這些軟性毒品的禍害。"
20030925-161,20030925,161,太空發電廠　激光傳能源,太空發電廠　激光傳能源 在太空中建立太陽能發電廠，直接為地球提供用之不盡的能源，似乎是科幻片情節。但德國科學家認為這並非異想天開，有望在五十年後實現，因為他們已解決了箇中一些最主要的相關技術。 歐洲航空防務與航天公司（EADS）的科學家米勒，周二在德國不來梅展示了該公司與卡爾斯魯厄大學研究員合作研製的新型激光裝置，並把這個是未來太空發電廠的重要組件，形容為「是在太空建立太陽能電源系統的首個重要里程碑」。     利用激光傳送能量   過去三十年，科學家一直研究如何將距離地球三萬六千公里外的太空中收集太陽能，轉化成為地球上可用能源的方法。EADS和卡爾斯魯厄大學研究員窮兩年心血，花了約五百三十萬港元研究，終於解決了如何控制激光光束，從遙遠的太空送回地面的難題。  科學家構想的解決方法是：首先利用人造衞星上的太陽能電池板收集太陽能，然後利用這個激光裝置為激光測定方向，透過激光光束把能量準確地送回地面接收站，再傳送到地面的輸電網，轉變成電力。     2008年送上太空站   米勒強調，他們計劃在二○○八年將第一部激光裝置送上國際太空站，但太空發電廠還要等多五十年才能落實運作，因為他們還要進行更多地面研究，嘗試提升通過激光光束傳送回來的能量級別，完全掌握有關技術才可正式投產。  德新社
20030925-162,20030925,162,網上購物按鍵格價,網上購物按鍵格價 雅虎（Yahoo！）為了加強公司的搜尋服務，周二宣布推出新的搜尋引擎，讓用戶可透過搜尋引擎尋找所需貨物、格價和購物。那就是活像那些購物格價雜誌或天書放上網，消費者今後想買東西毋須由東街跑到西街的商店格價，卻只消按一下電腦鍵盤或拖一下「老鼠」就有參考了。     購物網站　競爭激烈   雅虎發言人形容新搜尋引擎「將成為顧客找尋貨物的最佳方法」。據指出，這種搜尋引擎只會顯示文字廣告，一旁則會顯示所有用戶尋找的產品，用戶可比較貨品在各家公司的售價。雅虎也會測試一個新軟件，用戶只要輸入一些個人化設定，軟件就能根據設定找尋最適合用戶的貨品。  互聯網貨品搜尋服務競爭現時已愈演愈烈，因為網站公司只消透過用戶按連結購物後可獲回扣賺錢，在美國MySimon和PriceGrabber購物搜尋引擎，就在這個市場上爭得頭崩額裂。Shopping.com和雅虎主要對手Google設立的Froogle現在亦已加入戰團。  美國有線新聞網絡
