key,date,article_daily_id,title,text
20030925-63,20030925,63,婦捲車底傷,婦捲車底傷 【本報訊】葵涌石籬邨石華樓對開的石排街與梨貝街交界路口，昨晨發生車禍。昨晨近七時，一名六十歲姓梁婦人為貪方便，捨行人天橋不用，走出石排街行人路鐵欄外路邊橫過馬路。  消息稱，當時一輛客貨車駛至梨貝街對開時，懷疑婦人誤以為客貨車會停，讓對面線一輛旅遊巴士右轉入梨貝街，遂衝過馬路。但客貨車未有停下，結果煞掣不及將婦人撞倒。  猛烈撞擊下客貨車擋風玻璃粉碎，衝前七米始停下，婦人頭部被車輾過，上半身被捲入車底受重傷，由消防員救出後情況危殆（圖）。客貨車三十五歲姓柯司機無受傷，接受酒精測試無飲酒，警方正調查意外原因。  杜建彬攝
20030925-64,20030925,64,洩漏毒氣兩人送院,洩漏毒氣兩人送院 【本報訊】新蒲崗彝倫街一個垃圾站，昨午五時許發生「毒氣」洩漏事件。兩名姓李（二十六歲）及姓曾（二十二歲）工人將約二百升、有去迹作用的洗石水注入一部空氣過濾清新機時，機內溢出劇臭，工人感頭暈並且嘔吐，遂奔出垃圾站求救。消防員到場將兩人送院後，並在垃圾站內發現一頭口吐白沬猝死的花貓。  事發後，身穿防化衣的消防員將空氣清新機內二百多升液體抽走化驗（圖）。  陸文超攝
20030925-65,20030925,65,債務纏身女子燒炭,債務纏身女子燒炭 【本報訊】居住在荃灣三棟屋村一名二十九歲姓黎女子，疑不堪債務纏身，昨晨三時許，在酒吧借酒澆愁後由姓葉女友人送返家，友人其後離開，她隨即燒炭企圖自殺。  三小時後，友人擔心她做儍事遂折返查看，赫見黎女昏迷床上，旁邊放着一個炭爐，立即報警。警員到場將她送院（圖），情況嚴重。警方事後撿獲一封遺書，獲悉女事主與丈夫現正涉及一宗關於藥物的官司。  杜建彬攝
20030925-66,20030925,66,醉酒乘客勒索鬧事,醉酒乘客勒索鬧事 【本報訊】「你個證矇查查嘅！條安全帶又唔舒服，點搞㗎？攞一千蚊嚟先啦！」昨凌晨零時，五十二歲姓胡倒楣的士司機，遇上一名在尖沙嘴往旺角惡乘客無理取鬧，坐「霸王車」兼勒索，司機拒絕被拳毆襲擊，驚動途人報案。  警方到場將涉嫌傷人莽漢拘捕，初步相信有人醉酒鬧事。被捕男子四十七歲姓劉，其間他大吵大鬧脫去上衣，要數名警員合力抬上警車（圖），經調查後獲准保釋候查。司機事後自行駕車往醫院，敷治後無礙。  黎志偉攝
20030925-67,20030925,67,鬧市色狼連環非禮,鬧市色狼連環非禮 【本報訊】銅鑼灣鬧市發生非禮案，昨下午一時許，一名男子在駱克道街頭徘徊，當時正值午膳時間，街上行人如鰂，其間兩名女途人發現手背及臀部遭人觸碰非禮，涉案色狼得手後轉身即走。  兩名女受害人嚇至花容失色，但不甘被輕薄遂尾隨跟蹤疑人，稍後截停疑人報警求助。  警員迅速趕至拘捕涉連環非禮案的四十八歲姓關男子（圖二），並將兩名年齡三十二及三十五歲女受害人帶署助查（圖一右及右二）。  胡恩宏攝
20030925-68,20030925,68,妙齡少女服藥割脈,妙齡少女服藥割脈 【本報訊】一名二十三歲姓胡女子疑因感到不開心，昨晨二時許，在元朗朗屏邨畫屏樓地下與十八歲姓劉誼弟聊天時，突然情緒激動跑往垃圾房，拾起一塊玻璃碎片割脈，並聲稱之前曾吞服一樽安眠藥企圖雙料自殺。  事主誼弟見她左手腕血流如注，且神志不清，遂報警將她送院治理（圖），情況穩定，胡女事後拒絕透露尋死原因。  李旭基攝
20030925-69,20030925,69,王德輝山頂大宅5800萬售出,王德輝山頂大宅5800萬售出 【本報訊】雖然華懋王家的豪門爭產案尚未落幕，由華懋集團主席龔如心亡夫王德輝擁有的山頂百祿徑十五號大屋，被接管三年後，幾經波折，終以五千八百萬元易手。無論將來是龔如心勝訴，還是她的家翁爭得遺產，都沒法再得回這幢大宅了。  上址物業在二○○○年七月，由當時的臨時遺產管理人接管。物業現有樓面三千六百餘呎，地盤面積一萬五千八百二十方呎，地積比率零點五倍，假如重建，可建總樓面七千九百一十方呎，以成交價五千八百萬計算，每呎樓面地價達七千三百三十二元。     重建後呎價可達萬三   地產界人士指出，該物業荒廢多時，已無價值，但物業坐落貴重地皮，可重建兩幢約三層樓高洋房，估計落成後，每呎售價可達一萬三千至一萬四千元，不過，物業毗鄰為斜坡，重建時需進行修葺工程，增加建築成本。市場消息表示，物業有多個財團落標競投，部份為發展商，亦有個別豪宅投資者。  王德輝遺產管理人今年二月，將上述物業公開招標出售，不過，龔如心即向法庭申請推翻出售命令，可惜最後被判敗訴；及後遺產管理人委託律師行將物業標售，悉未能售出，其後物業改以暗標方式放售，近來樓市轉旺，該物業終成功脫手。
20030925-70,20030925,70,兩車相撞司機受傷,兩車相撞司機受傷 【本報訊】昨下午約一時，石硤尾大埔道發生兩車相撞車禍。一輛由三十七歲印巴裔司機駕駛的泥頭車，從四咪半一個停車場駛出，泥頭車轉出大埔道時，一輛由三十五歲姓江司機駕駛的七人私家車，沿大埔道向九龍方向行駛，司機煞車不及撞向泥頭車車尾。  意外發生後，七人車車頭嚴重損毀（圖），姓江司機手腳及額頭受傷，送院救治後情況穩定。  吳國威攝
20030925-71,20030925,71,要求提供名牌靴代替安全鞋路政督察涉索利益受審,要求提供名牌靴代替安全鞋 路政督察涉索利益受審 【本報訊】參與興建中環一條行人天橋工程的地盤總管，依據合約須提供五對安全鞋，但負責該工程的路政署督察及工程師，與土木工程署監工，涉收受地盤總管購買三對合共逾三千元的Timberland皮靴充當安全鞋，三人被控公職人員索取及收受利益四項罪，案件昨在西區法院審訊。　記者：蔡曉楓 三名被告分別為路政署工程督察徐展鵬，四十歲；土木工程署工程監工盧偉立，三十三歲；及路政署工程師周浩明，三十一歲，控罪指首被告徐展鵬於去年三月至四月，兩度向鶴記營造有限公司索取Timberland皮靴作為報酬，而三名被告均有接受該報酬。     每對價值千元   鶴記營造有限公司地盤總管魏盛益昨供稱，有關工程為興建機利文街一條行人天橋，魏須依據合約提供五對安全鞋，去年三月首被告徐展鵬要求他購買Timberland皮靴給他及次被告盧偉立作安全鞋，至三月二十三日，首、次被告與魏到又一城的Timberland專門店選購皮靴，由魏付款，每對皮靴價值一千元。  魏盛益續稱，同年四月十五日一次會議後，首被告再問魏有否替第三被告周浩明購買Timberland皮靴，魏遂詢問第三被告有關購鞋的事，第三被告回應「跟住徐生（首被告）嗰對照買」，兩人於五月十日到上述Timberland專門店，由魏付款一千二百多元購買一對皮靴予第三被告。魏又指出，購買Timberland皮靴予三名被告後，他們對魏的態度並無太大分別，只是對於工程的要求「（買鞋）之前提多啲，之後提少啲」，但施工標準則跟從合約規定。聆訊今續。  案件編號：WCSCC849/2003
20030925-72,20030925,72,刀插同鄉腎臟印傭監42月,刀插同鄉腎臟印傭監42月 【本報訊】離鄉別井來港工作一年的年輕女印傭，不甘遭同鄉在背後中傷她是「女同性戀者」，相約維園聚會期間亮刀刺傷女同鄉腹部，導致同鄉腎臟撕裂，最終切除。她昨在高等法院承認一項蓄意傷人罪，判監三年半。     官指有計劃襲擊   二十三歲印尼籍被告RindaAndayani，去年八月來港做傭工，被控一項蓄意傷人罪。法官宣判指出，被告有計劃襲擊女事主，令她嚴重受傷，腎臟撕裂，需接受手術把腎臟切除。但法官接納被告是真心相信女事主在背後中傷她，才促使她行事。  案情指出，被告與現年二十歲女事主早於○○年在印尼一所印傭訓練學校受訓時認識，相繼來港工作，雙方保持聯絡。今年二月十六日星期日，被告致電女事主，相約往維園傾談，其間被告突持刀衝向女事主，刺傷她的腹部，女事主傷重失去知覺。  被告遭朋友拖離現場，女事主送醫院救治，證實腹部有一處五厘米深的傷口，腎臟撕裂及結腸有兩個約兩厘米大的小孔，接受手術把結腸修補，但一腎臟需切除。  事發三小時後，被告往北角警署自首，警誡下表示，因女事主指她是「女同性戀者」，令她非常憤怒，故當日買定利刀襲擊女事主。  案件編號：HCCC192/03
20030925-73,20030925,73,女警險被搶槍,女警險被搶槍 【本報訊】有濫用咳水習慣及曾入住精神病院的髮型師，今年初因氣促到威爾斯親王醫院急症室求診，疑突然失常，欲襲擊一名男護士，更試圖強搶一名駐院警花佩槍，糾纏間女警手腳受傷。他昨在區域法院被控企圖搶劫及襲擊兩罪。     糾纏間受傷   被告黎國強，二十九歲。案情透露，今年一月二十九日，被告因呼吸急促到威爾斯親王醫院求醫，被安排在一房間等候，當護士往取藥時，被告卻在房內大便，護士發現時房內已有數處屎迹。男護士李國雄安排被告坐上輪椅，但遭被告企圖施襲。  駐院軍裝女警吳沅欣上前制止，黎坐回輪椅後，又突然用手企圖拉出女警佩槍。女警與被告爭持間，右手腕及右腳踝受傷。聆訊今續。  案件編號：DCCC550/03
20030925-74,20030925,74,扑頭案事主突「失憶」,扑頭案事主突「失憶」 【本報訊】一名長洲居民在光天化日下被扑頭襲擊，事後向警方透露，其友人向他借錢不遂施襲，並劫去其載有二千多元的腰包，涉案男子昨在高等法院否認打劫罪，事主卻突然「失憶」，強調腰包是自願奉上，事後才遭不知名人士襲擊。     借錢不遂捱打   二十六歲貨櫃站工人陳家雄，被控於今年一月一日，在長洲中心里五號後巷，搶劫二十八歲麥添成的腰包。  麥添成作供指，與陳相識十多年，案發當日陳問他借錢，他將腰包交給陳，後來被人用硬物扑了一下，但不知是誰所為。  不過，據控方所指，麥曾向警方透露，陳借錢不遂後，從花槽中抽出物件，打他頭部四、五下，將他打暈。聆訊今續。  案件編號：HCCC119/2003
20030925-75,20030925,75,藝人曾偉明違選舉例,藝人曾偉明違選舉例 【本報訊】藝人曾偉明早前在村長選舉中，自動當選青龍頭村村長，但因無依時遞交選舉費用單據，違反選舉法例，昨到高等法院申請在限期內補交資料，法官指曾偉明的誓章未夠完備，要求他在七天內重新提交誓章，另擇日子提訊。     重新提交誓章   曾偉明昨在庭上指，他於今年七月二十七日至三十日到上海公幹，並無收到政務署要求他提交選舉申報書的信件，令他未能提交有關資料。法官鍾安德要求他在七天內重新提交誓章，案件押後再審。  曾偉明庭外表示，現常於內地拍劇，稍後或加盟亞視。  案件編號：HCMP3463/03
20030925-76,20030925,76,兒童風濕病基金急籌經費,兒童風濕病基金急籌經費 不說不知，原來風濕病並不是老人病，小至一歲多的孩子也有機會患上。現時主要負責治療兒童風濕病的瑪麗醫院約有一百三十名病童，小小年紀便要忍受關節腫痛甚至變形的折磨，更有機會出現腎炎及腦神經系統失調等嚴重併發症。部份病情嚴重的病童更要長期服食自費購買的藥物，對家庭造成沉重負擔。蘋果日報慈善基金特別成立專戶，為香港風濕病基金會籌款，盼善長慷慨捐款，好讓他們得到治療。 六歲半的浩榮外表看來與一般小孩無異，惟當他走起路來，便會發覺步姿有點兒怪。吳太捲起浩榮的褲管給記者看，記者發現他膝蓋腫大，與瘦小的雙腿形成強烈對比。     每周一次物理治療   「醫生話佢𠵱家重發緊炎，未算完全行得正常，我都擔心唔知佢第日行路會唔會跛吓跛吓。𠵱家夜晚瞓覺佢要戴腳箍，防止雙腳攣埋一嚿。」吳太說。  就讀小一的浩榮，今年二月發覺走路時一拐一拐，吳太先後帶他往看私家醫生及公立醫院，卻無法查出病因，吳太只好帶兒子去看跌打，情況稍有好轉，可是不久膝蓋出現腫痛症狀，吳太遂帶兒子轉看骨科，經多次檢驗後，才知浩榮患上幼年突發性關節炎，屬風濕病一種。  「前後花咗幾個月先知道佢患咗乜病，當時我第一個反應係：乜唔係老人家先有風濕病咩？之後浩榮轉咗去瑪麗兒科，我見到原來好多細路仔都有呢啲病。」吳太說。現時，浩榮每天須服七種藥物及每星期接受一次物理治療，病情尚算穩定。 每月藥費二千多元   瑪麗醫院兒科專科醫生李子良表示，兒童風濕病大致分為幼年突發性關節炎及紅斑狼瘡病兩大常見類別，現時這兩類病童分別依靠消炎止痛藥及類固醇作主要治療，這些藥物均被醫管局納為常規藥物，但部份病情嚴重的紅斑狼瘡病童則需自費購買一種抑壓免疫功能的藥物，每月藥費二千多元。以瑪麗醫院為例，現時約有十多名病童需要自費買藥，還未計算物理治療以及其他復康器材的開支，對於基層家庭來說，負擔着實不輕。  捐款編號：C1122    暖流熱線  電話：29908688  傳真：23702192  電郵： adfund@appledaily.com   網址：  http://www.charity.atnext.com  
20030925-77,20030925,77,資助醫療減家人負擔,資助醫療減家人負擔 香港風濕病基金會成立於2001年，成員包括醫生、職業及物理治療師，以及公眾人士。基金會旨在透過宣傳和教育，增加市民對此病的認識，以及支援有關研究項目。  另外，基金會現正積極籌款，以資助病人在醫療方面的開支，包括：不被醫管局納入為常規藥物而醫生又建議病人使用的自費藥物、家居設施改裝、購買復康器材以及額外營養品等。預算資助每人每年三千元。  蘋果日報慈善基金現成立「兒童風濕病患者醫療專戶」，籌得善款將會全數用作資助罹患風濕病兒童的藥物及其他醫療開支，減輕病童家人的負擔。    暖流熱線  電話：29908688  傳真：23702192  電郵： adfund@appledaily.com   網址：  http://www.charity.atnext.com  
20030925-78,20030925,78,風濕病無法根治,風濕病無法根治 瑪麗醫院兒科專科醫生李子良表示，醫學界暫時仍未掌握兒童風濕病成因，不過大多相信與病者基因有關，並由過濾性病毒或細菌引發。已有六年專責醫治風濕病兒童經驗的李醫生解釋，風濕病者的自身免疫系統出現失調，發出錯誤指令，產生抗體攻擊自己身體的關節部位，造成發炎。  至於嚴重的系統性紅斑狼瘡病患者，腦部、腎臟及心臟等主要器官亦有可能受到影響。  李醫生稱，風濕病暫時仍然無法根治，只能依靠藥物控制病情，某些病情輕微的病人可於接受藥物治療一年多後停藥，但仍有復發機會。     移植骨髓效果良好   歐美醫學界於五年前開始研究使用病者自體骨髓移植方法進行治療，本港自兩年前至今亦已替三名嚴重病者進行移植，原理是在病者骨髓中擷取純淨的幹細胞後，利用化療及電療，將病者體內所有好壞細胞殺清，然後輸入幹細胞，讓病者「重生」，暫時發現效果良好，其中兩人已停藥，餘下一人亦只需服低劑量藥物，惟李醫生強調並非所有患者都適合進行移植。     延誤求診影響一生   李醫生特別提醒家長，假若發現子女關節發痛超過兩個星期，應該盡快帶他們看醫生，關節紅腫以及臉上長出蝴蝶形疹的話，更須即時延醫治理，否則後果可大可小。「我見過好多家長帶佢哋仔女嚟睇病嘅時候，仔女啲關節已經變晒形，甚至功能永久受損。其實只要及早醫治，比起二十年前，藥物已經可以好有效控制呢啲病。」    暖流熱線  電話：29908688  傳真：23702192  電郵： adfund@appledaily.com   網址：  http://www.charity.atnext.com  
20030925-79,20030925,79,失業漢：市道惡劣好恐怖,失業漢：市道惡劣好恐怖 一直深信「肯做一定搵到兩餐」的吳先生，面對今時今日的經濟環境，也不得不舉手投降。「我呢句說話真係要收番，原來市道惡劣起上嚟，真係可以好恐怖。」四十六歲的吳先生歎着氣說。     一家恐斷炊   從事運輸及地盤行業多年的吳先生，受沙士疫症影響，自四月起開始失業，向來不認命的他，一直努力找尋新工作，並深信只要肯吃苦便有出頭天。可惜事與願違，有三十多年工作經驗，擁有十多個認可牌照的吳先生，屢次見工都石沉大海，令他大感氣餒。  吳先生一直為家庭經濟支柱，現與年邁母親同住，剛巧五歲女兒月前獲發單程證來港，一家三口生活拮据，就連給女兒入讀幼稚園的錢也沒有。「好彩學校都好體諒，學費畀我暫時拖住先，不過，書簿費就要分期交，連埋茶點費，每個月都要三百幾蚊。」     已撥款救急   在窮途末路下，吳先生早前已向社會福利署求助，但審批需時，三口恐有斷炊之虞。蘋果日報慈善基金已撥款三千元，助他們暫度經濟難關。  捐款編號：C1124    暖流熱線  電話：29908688  傳真：23702192  電郵： adfund@appledaily.com   網址：  http://www.charity.atnext.com  
20030925-80,20030925,80,議員指摘出口術　聯手壓迫打工仔僱主聯會：未來數年毋須加薪,議員指摘出口術　聯手壓迫打工仔 僱主聯會：未來數年毋須加薪 股市上升、失業率回落、沙士後經濟逐漸復甦，盡是好景一片。咬緊牙關的市民正打算喘一口氣時，卻冷不防僱主團體將一盆冷水潑到打工仔的頭上。香港僱主聯合會本周向旗下全部會員，建議未來幾年不需要向員工全體加薪。　記者：譚暉 【本報訊】大部份機構的人力資源部，將在未來一、兩個月檢討員工來年的薪酬調整。香港僱主聯合會在本周一向所有會員發出指引，認為由於本港員工的薪酬仍然在世界最高水平，因此僱主在未來數年毋須調高整體薪酬水平。有立法會議員指摘聯會出口術，製造大僱主聯手壓抑員工工資的無良局面。  聯會主席業榮達說，經濟復甦會導致人才競爭，而人才競爭又會引起僱員期望出現普及加薪。但他認為，現在是適當時機去消除每年定期加薪的既有觀念。而本港員工的薪酬處於世界最高水平，所以在未來數年，毋須調高整體薪酬水平，「決不可將現有的經濟改善，變成另一輪薪酬通脹的指引。」     按業績表現個別加薪   僱主聯合會的四百五十間會員機構，在本港共聘請了逾五十萬名員工。聯會行政總監馬黎碧蓮表示，據一間顧問公司的資料，本港僱員的整體薪酬位列全球首三名之內。該會希望打破打工仔以為「每年一定加人工」的想法，不要到了明年一月就指望僱主加薪，但聯會鼓勵僱主按業績及員工工作表現作個別加薪。  職工盟立法會議員李卓人斥責，僱主聯合會透過發指引方式，令到大僱主互相聯手壓抑工資的合理增長，這只會令到員工對僱主日益不滿。  「打工仔呢幾年已經夠慘，面對裁員、減福利、減人工，好辛苦去捱過沙士的打擊，點知僱主聯合會又出口術話唔好加人工！」他批評，僱主聯合會企圖要打工仔領取低薪永不翻身，反映資方根本不會在逆境順境中與勞方共同進退，與員工分享成果。  另外，招聘及人力資源顧問公司翰德國際昨公布第四季就業報告。報告指，本地公司表現出兩年以來最強勁的招聘意向，顯示本港經濟正逐步反彈。但在經濟艱難起步之際，具MBA（工商管理碩士）學歷的求職者並不特別具優勢，八成半本港僱主不願支付較高薪酬予MBA持有人。 35.2%公司欲增聘人手   調查在七至八月間進行，訪問了本港、中國、新加坡和日本，超過二千名跨國公司招聘決策者在未來三個月增聘員工的意向，其中本港受訪者約五百人。  本港有35.2%的受訪公司表示，有意於未來數月增聘人手，較上一季的23.6%大幅上升11.6%，其中增聘意欲最強的是會計、金融服務顧問、工程及消費品業，有意裁員的公司也由上季的6.5%大幅降至2.3%。整體而言，98.6%的受訪公司預期明年上半年業務屬「平穩」、「良好」或「卓越」。該公司亞洲區行政總裁利嘉偉說，自由行可令本港零售業受惠，但暫未能確定對本港經濟的實質影響。
20030925-81,20030925,81,蘋論：縮短投票時間？胡官三思！ - 陳雙,蘋論：縮短投票時間？胡官三思！ - 陳雙 選舉管理委員會準備縮短新一屆區議會的投票時間三小時，由原來早上七時半至晚上十時半，改為由早上七時半至晚上七時半，該會主席胡國興法官透露，下屆立法會選舉也可能同樣安排，把投票時間減少三小時。     胡官承認影響選民   選管會這個突然的改動，招來各界強烈批評，認為剝削了選民的投票權，向港人的民主熱情潑冷水。但從胡國興昨日的言論來看，他已作了決定，即使有政黨或市民反對，也不會改變初衷。  胡國興的理據有三：  （一）縮短時間可以節省資源，方便進行點票工作以及公布結果；  （二）此舉可以減少對投票站附近居民的滋擾；  （三）六成意見書贊成縮短時間至十二小時，當中九成選擇了新的投票時段；故此他作出了改動。  這些理由表面來看好像有點道理，但是站不住腳。因應今次選舉指引所進行的諮詢時間，剛好在四月二十八日至五月十七日的沙士襲港期間，當時未發生7.1五十萬港人上街事件。其次胡官所指的贊成意見書只有一百一十份，相對於近三百萬登記選民人數不成比例；還有，胡官雖然一口咬定「有心投票的人就一定會投」，他不擔心投票率下降，但是他也承認有選民會受到影響。  香港的選舉，投票時間有十五個小時，比其他地方可能較長，這與香港人的特殊生活習慣有關。  選管會選擇星期日投票就是希望方便選民，鼓勵更多人投票，但是新安排剛好自相矛盾，對那些星期日要上班的選民不公平。根據過去的經驗，晚上七時半至十時半正是投票高峯期，前往投票的選民，比早上七時半至十時半的三小時多出一倍，與其縮短晚上的投票時間，為甚麼不遲一點才開始投票？ 諮詢不足強硬推行   新安排究竟可省回多少金錢，胡國興說目前計算不到，但肯定財政司司長唐英年不會期望選管會可以幫助他解決財赤；提早關票站大門，或許可以達到即晚公布選舉結果的目的，但這肯定不是選民首要的考慮；至於滋擾，縱使有極少數人真的覺得被滋擾，但一年有多少次選舉呢？  我們認為7.1之後，香港的民情發生了重大的變化，登記選民數目在七月忽然大幅增加，就是明證。胡國興說他絕無政治考慮，但是對一個行之有效的選舉安排作出如斯重大的改變，而又不廣泛諮詢尋求共識即強硬推行，難免令人有陰謀的感覺。區議會選舉十月二日才開始接受提名，十一月二十三日才舉行投票，還有時間去討論，請胡法官三思。  （圖）選管會主席胡國興決定將區選投票時間縮短三小時。　資料圖片
20030925-82,20030925,82,還斂集：是日休息 - 張五常,還斂集：是日休息 - 張五常 小啟：《還斂集》暫停一天      逢周二、四、六刊出  電郵： nscheung@netvigator.com 
20030925-83,20030925,83,尊子江湖滾熱辣,尊子江湖滾熱辣
20030925-84,20030925,84,李八方隔牆有耳：,李八方隔牆有耳：    傳真︰2623-9278  電郵︰ pf_lee@appledaily.com 
