key,date,article_daily_id,title,text
20031119-214,20031119,214,樓市點擊,樓市點擊 南豐新邨成交倍增呎價微升   ▲利嘉閣張碧華表示，鰂魚涌南豐新邨3座高層C室，474方呎，剛以115萬元易手，呎價2426元，屬市價。原業主88年以60萬元購入，進帳55萬元，升值近1倍。本月暫錄10宗成交，較上月同期增加1倍，平均呎價2500元，升1%。  ▲馬鞍山海典灣3座高層F室，625方呎，剛以178萬元轉售，呎價2848元，造價合理，利嘉閣吳家榮透露，賣方02年以180萬元購入，屬微蝕。物業剛入伙，放盤漸增，現時約有120個盤源，本月迄今暫錄15宗二手成交，呎價徘徊2800至3100元。     海逸豪園業主兩年虧蝕47萬   利嘉閣林穗華說，紅磡海逸豪園海逸灣21座中層A室，828方呎，以303萬元售出，呎價3659元，高市價3%。賣方01年以350萬元購入，虧蝕47萬元，折讓13%。屋苑本月暫錄12宗成交，維持上月同期水平，平均呎價保持3800元。現時放盤約180個，叫價介乎4100至4200元。     綠楊新邨投資客連租約購入   ▲中原林經略稱，荃灣綠楊新邨獲投資者購入連租約單位，C座高層6室，511方呎，成交價130萬元，呎價2544元，屬本年新高，單位附連租約，全包月租6730元，回報逾6厘。同日另一投資者則短炒成功，售出C座低層7室，511方呎，成交價121萬元，較9月份銀主盤購入價89萬元，獲利32萬元。本月暫錄20宗成交。     奕翠園千呎單位300萬沽出   ▲上水奕翠園1座低層C室，1066方呎，剛以300萬元連車位易手，呎價2814元，造價理想。單位享內園景，原業主96年以420萬元購入，損失120萬元，貶值29%。利嘉閣田國輝指出，上述為本月首宗成交，與上月同期3宗成交比較，市況顯著放緩，主要是上月屋苑造價普遍較9月份上升一成，令買家趨向觀望所致。目前約有40個放盤，每方呎叫價2800元。
20031119-215,20031119,215,美股早段靠穩,美股早段靠穩 美國股市昨天早段靠穩，受惠於HomeDepot上季盈利勝預期，以及美林建議客戶買入通用電氣（GE）及晶片股。杜瓊斯工業平均指數早段一度升39.63（0.41%），見9750.46。納斯達克綜合指數最多升16.39（0.86%），至1926.00。開市後半小時（本港時間昨晚11時），杜指升24.30，報9735.13；納指升14.41，報1924.02。
20031119-216,20031119,216,和黃債券孳息高勢加碼,和黃債券孳息高勢加碼 【本報訊】銀行界消息透露，和記黃埔（013）擬發行的30億美元（234億港元）債券已定出初步意向價格，7年期債券孳息為美國國庫券息率加195點子；10年期債券孳息加210點子；而30年期債券孳息則加245點子。據悉，每種債券發行額仍未確定，但每種發行額將至少有7.5億美元（58.5億港元）。和黃股價昨日持續偏軟，收報55.75元，跌1.25元或2.2%。 外電引述一名新加坡定息債券交易員表示，以和黃2013年到期債券於二手市場造價，息率較美國國庫券高183至186點子，現時建議發行的10年期債券息率加210點子，自然較吸引。現時市場已流傳，債券將超額認購，和黃會加大發行額，同時考慮發行歐元或英鎊部份。     考慮發行歐元債券   是次乃和黃今年第5度發債集資，也是日本以外亞洲企業之中最大宗的債券，前四次集團透過發債已於市場吸納了45億美元資金。包括年初原發行15億美元債券，其後兩度加碼令總集資金額上升至35億美元，之後又發行了10億歐元債券。連同早前籌組的38億港元銀團貸款，籌組的款項足夠應付至05年6月前到期贖回的債券所需。  另外，和黃發言人接受查詢時表示，現階段無意參與美國港口碼頭項目。而和記港口發言人也回應，該公司經常會跟進全球港口發展情況及搜集有關資料，提交興趣表達書是獲取資料的方法之一。與此同時，和黃經常會收到來自不同港務局的發展計劃資料，但這並不代表公司有意投資某些港口。  接近和黃消息指出，除因該項目無經濟效益外，美國營運碼頭涉及審批程序複雜，加上碼頭業務被視為敏感行業，為避免再次捲入不必要的政治爭拗，該集團無意投資美國碼頭。     無意投資美國港口   《南華早報》日前引述和黃一名執行董事指出，旗下和記港口表達對紐約Bayonne碼頭項目的興趣。報道並引述Bayonne碼頭負責重建的機構指出，CSXWorldTerminalLLC及中遠集團也可能入標競投。Bayonne碼頭項目將於明年1月公開競投，明年中有結果，項目年期30年，可以續期。
20031119-217,20031119,217,電盈固網客戶流失見改善,電盈固網客戶流失見改善 【本報訊】電訊盈科（008）自年中推出多項固網增值服務，除本地固網客戶流失情況改善外，寬頻客戶增長率也有上升。電盈營運總監麥柏喬表示，今年底固網短訊登記用戶可達60萬，明年中增至90萬戶，若計及未來推出新服務，登記用戶有可能升至100萬戶。     55萬登記用新服務   至於，NOW寬頻電視自9月推出至本月15日，登記客戶逾15萬，平均每日上客2000戶，預期年底登記客戶人數將增至20萬，明年中更增至35萬。  對於7月推出固網短訊服務，客戶簽約1年獲贈送附短訊功能的電話，麥柏喬未有評論客戶流失的改善情況，只估計下半年流失率較上半年低。按電盈03年上半年業績顯示，今年頭6個月集團流失了20.5萬條電話線，截至6月底共有293.3萬條電話線。若明年中登記固網短訊用戶達100萬，便佔其固網電話線總數的三分之一。  他又指出，固網電訊服務推出後，4個月內已有55萬用戶登記使用，65%為住宅用戶，35%為商業用戶，現時每日仍有2000個新登記。住宅方面，七成用戶曾使用固網短訊，最受歡迎的內容為足球資訊、星座運程及天氣等。商業方面，較多利用電話作為私人助理、企業電話簿及接線生服務。未來會推出更多服務，如國際短訊等滿足客戶需要。  另外，電盈昨日宣布，為商業客戶推出一項綜合話音數據通訊服務，利用一個電腦界面，處理所有話音及文字訊息，每名用戶月費介乎188至328元不等。     NOW電視很快可回本   至於NOW寬頻電視，客戶安裝後首4至6周費用全免，麥柏喬無透露現時收益情況，只謂每戶補貼成本約800元，很快可回本。但他表示，服務推出後可進一步鞏固其寬頻服務市場佔有率，因於登記寬頻電視客戶中，25%為新客戶，令9、10間Netvigator寬頻服務上客率增加逾倍。
20031119-218,20031119,218,廣船遭立案調查,廣船遭立案調查 【本報訊】廣船國際（317）宣布，收到中國證監會的證監立通字001號通知，該公司涉嫌違反證券法律法規，中國證監會已決定從本月17日開始，對該會廣州證券監管辦公室巡檢發現的部份事宜展開調查。是次屬首家H股公司遭中國證監會立案調查。     股價急跌6.71%   廣船雖指上述調查目前對集團持續經營無重大影響，但股價即時遭到拋售，最低見1.37元，跌8.05%，收報1.39元，仍跌6.71%。  廣船11月7日曾發表通告指，集團10月9日收到廣州證管辦於8月11日至15日對集團的巡迴檢查後，發現廣船由95年至02年多宗涉及公司管治、規範運作、信息披露及財務方面出現多個問題，並要求廣船限期整改，廣船將召開董事會表示接納建議，但似乎中國證監會未就此作罷，並據該報告展開調查。  廣州證管辦指出，廣船與大股東中國船舶工業集團公司及改制存續企業廣州造船廠的關係尚未理順，彼此運作獨立性不強，兩名高層管理人員在關聯企業兼職，有潛在同業競爭關係，分割不夠明確。  此外，廣船部份規章制度不夠完善，在決策上仍沿襲一些國企的做法，董事會在審批關連交易時，關聯董事未有避席，獨立董事未符合獨立的要求等。
20031119-219,20031119,219,短線遊：米埔雀鳥酒店入冬客滿,短線遊： 米埔雀鳥酒店入冬客滿 歡迎各位到來米埔濕地酒店！千祈唔好以為自己睇錯嘢，其實米埔自然保護區的確係候鳥遷徙途中補給停留的地方，所以話佢係一間酒店絕對冇搞錯！入冬，正是來自西伯利亞的候鳥前來「入住」的旺季，食到肥肥白白後便轉飛澳洲及新西蘭等地。今日Henry同Cookie一早入米埔，探吓呢班「老外」及長期居留的「住客」。   記者：戴維浩　攝影：梁細權 部份相片由世界自然（香港）基金會提供 Model：Henry、Cookie（RichStrategy）  米埔風光   米埔環保行  星期六截止報名    一年一度的世界自然（香港）基金會「米埔環保行」慈善步行籌款即將於11月30日及12月7日舉行，今年活動主題為「米埔今昔」，你可以藉此了解米埔的演變及其自然生態的價值，更可一睹珍貴雀鳥的風采。只要募捐$400，就可以參加這個有意義的活動。  截止報名日期：11月22日  查詢及報名：25261011  網址： www.wwf.org.hk/dmp  $20租望遠鏡    睇雀仔不可以缺少的裝備當然係望遠鏡啦！點知有「冒失王」之稱嘅Henry竟然出門口前忘記帶，搞到女友Cookie偏晒嘴。不用擔心，原來中心有望遠鏡供應，遊客只須要登記姓名及付上$20租金便可租借。 舉頭見大白鷺    米埔自然保護區基本上由大大小小的魚塘、基圍及涼濕地組成，遊客可悠閒地在小道上步行參觀。在斯科特野外研習中心起步，小路的左邊是魚塘、右邊是基圍，沿途皆林蔭處處，風景宜人，在這裏觀鳥，原來不必刻意去找，牠們自然會飛來「歡迎」你。Cookie立即在樹冠上搜索到一隻體型碩大的白色雀鳥，這正是大白鷺。 放輕腳步入觀鳥屋    邊行邊睇雀，不久便來到其中一個參觀重點——觀鳥屋。這是一間樓高三層，由金屬及木材搭建而成的觀鳥樓。屋內人頭湧湧，不過大家都放輕手腳，因為觀鳥屋是由金屬及木材組成，進入時都會放輕腳步，避免發出噪音嚇走外面班「住客」。 長期住客鸕鷀    Henry用望遠鏡從高樓左邊一看，立即發現一大群黑色鳥類，這正是米埔其中一種數量最多的「長期住客」鸕鷀。雄性的鸕鷀在交配季節會換羽毛，屆時牠們便會換上白啡色的「踢死兔」，周圍去識女仔。     沼澤生物愛捉迷藏    淡水沼澤及蘆葦林，是各種生物的安樂窩。在香港圓桌會木橋一直走去，終點站是蘆葦及紅樹林，途中除了欣賞風景、雀鳥，亦要留意兩旁蘆葦叢中生物，據統計，有超過四百種的生物在此棲息，有彈塗魚、水鉸剪、水蛇等，不過牠們像愛和同你玩捉迷藏，經常躲起來，要你細心觀察。 灰頭鷦鶯扮貓叫    Henry同Cookie在蘆葦林中邊玩邊走，忽然聽到有貓叫聲，原來這是一種會扮貓叫的候鳥灰頭鷦鶯，以叫聲嚇怕入侵者。     黑瞼琵鷺現身    真是皇天不負有心人，他們竟然在行程未段目睹這裏的大明星——黑瞼琵鷺，現時世界只僅存大約一千隻，原來牠們已到達了米埔。  又食又玩     教育中心有得玩    距觀鳥樓5分鐘路程，會找到教育中心，這是個玩樂好地方。屋頂上有一系列雀鳥模型，清楚展示了不同雀鳥的特徵，方便觀鳥時辨別。館內還有其他有趣展品，如哈哈鏡、拼圖、昔日米埔漁民模型等等，益智又有趣。 純天然手信    來米埔除了睇景觀了外，原來還可以買手信，認着這間在教育中心前草坪的綠色小屋。這裏除了有冰凍飲品出售外，還有蜜糖及花粉。據店長梁先生表示這些蜜糖及花粉採自他飼養的蜜蜂，真正天然無添加！花粉及蜜糖每瓶分別售$70及$50。 食住甜粟賞靚景    試完蜜糖及花粉，Cookie話重要食甜粟。兩個人坐在綠色小屋旁的草坪樹蔭下，欣賞旁邊的紅樹林的風光，一邊咀嚼香甜粟米，的確寫意。  公眾參觀團    一般人都不能自行前往米埔，必須隨觀賞團參觀，每逢星期六、日及公眾假期都會舉辦公眾參觀團，參觀必須預約，但十二月及一月的團已經額滿，二月的團則仍未接受報名，有興趣的人士可上網了解情況。  收費：$70  網址：  http://www.wwf.org.hk/chi/index.html        交通    17小巴：由上水廣場至米埔村村口，車費$6。  76K巴士：由上水火車站至米埔村村口，車費$6.9  的士：由上水市中心直接乘的士至研習中心需時約二十分鐘，車費約$58。  （由村口步行至斯科特野外研習中心需時約二十分鐘。）
20031119-220,20031119,220,住家菜：家常上海菜蟹黃豆腐幾分鐘搞掂,住家菜： 家常上海菜蟹黃豆腐幾分鐘搞掂 大閘蟹上市一陣子，其實現在這個時間最肥美合時。除了清蒸大閘蟹外，也不妨試試其他的特色食法。而多種食法中，必不可少的便是各式的上海食法，因為大閘蟹是上海人的最愛。今次介紹兩個用上大閘蟹的上海菜。   記者：謝翠玲　攝影：林栢鈞 示範：海逸軒大廚劉志傑師傅 地址：北角海逸酒店三樓（21852788） 之所以會有以傳統上海菜為骨幹的大閘蟹示範，除了因為上海菜花款多，也因為示範的劉師傅曾在上海工作多年。劉師傅十八歲入行，開始的時候是以粵菜為主打，然後在九○年開始，帶着他的粵菜功架去上海發展，期間在上海、杭州等地的多間著名酒店工作。  雖然劉師傅主要負責粵菜，但跟不同的地方的大廚合作交流，結果便不停學習到各個地方的菜式。回到香港後，劉師傅繼續將各地的烹飪方法融合，成為自家獨特的烹調特色。不過他也很尊重菜式的傳統，像今次的大閘蟹以上海做法最為值得推介，他便完全照正統去做。 拆蟹粉、蟹黃    要拆蟹粉，可以買約3両重的大閘蟹4隻，蒸熟便可以拆出蟹粉跟蟹黃。 紅梅蟹黃燴白玉    這個以蟹黃來跟豆腐同燴煮的菜式很易做，但無論是色、香、味也有十足分數，是家常或是宴客也適合的菜式。由於蟹黃已熟，所以烹煮的時間不用太長，才幾分鐘便弄好一個菜，非常方便。  用咩料：    （自製價：$100）  百福蒸煮豆腐　1盒  蟹黃1両半  薑粒、葱粒各1湯匙  清雞湯適量  好易做：        小貼士︰    盒裝蒸煮豆腐比一般豆腐滑身，而且已很乾淨，所以不用特別刻意沖洗，不然反而會沖爛。 蟹粉水晶小雲吞    這種薺菜蟹粉雲吞比平日廣東式雲吞小巧精緻得多，每隻只是茶匙的大小，一口一個，是很有名的上海小吃。餡料不用包太多，每顆小小的以清水灼熟再放入清湯中，用來作開胃小吃不錯。  用咩料：    （自製價：$100）  雲吞皮　適量  半肥瘦豬肉3両  蟹粉1両半  上海薺菜1両  清雞湯　適量  葱花、麻油、胡椒粉　各少許      好易做：        小貼士︰    小雲吞其中的薺菜帶有特別香味，南貨舖有售，如果買不到便寧願不加，因為其他菜跟蟹粉味道不配合。      包小雲吞二部曲：   桂花薑茶湯圓    平日吃大閘蟹多配薑茶，但今次則可以試試這個加了點新意的薑茶吃法，就是加入桂花湯圓來同吃。既有驅寒功效，又帶有桂花的清香。不過桂花不能多放，不然會變怪味。  用咩料：    （自製價：$20）  老薑　2両  紅糖  普洱茶葉　3片  乾桂花或桂花醬　少許  湯圓（可用急凍桂花圓子）      好易做：    1先將老薑洗淨，拍碎。加入一公升煲滾，加入茶葉，中火繼續煲半小時。  2待薑水煲好後，加入紅糖攪溶。  3湯圓以清水煮熟，放碗中，加入薑茶。將乾桂花浸開，或放入桂花醬拌勻即可。
20031119-221,20031119,221,悼林振強 - 左丁山,悼林振強 - 左丁山 星期日晚上，揸車返屋企之際，手機響起，乃賓架陳來電；講一句：「天妒英才。」左丁山立即問：「誰是英才？」賓架陳只講了一句：「林振強去咗」。左丁山呆咗半秒，立即打電話求證，得知林振強因癌症逝世，以後各位都睇唔到佢嘅抵死幽默詐儍反諷嘅過癮專欄咯。 林振強首先係廣告界創作奇才，早已闖出名堂，後來肥佬黎欣賞佢，請佢入佐丹奴負責創作（creative），佐丹奴早期啲宣傳口號，多出其手筆，到咗九○年，《壹週刊》創刊，林振強亦包辦《壹仔》的宣傳口號！例如「壹」週刊嗰名就係佢諗出嚟嘅，「不扮高深，只求傳真」亦然。壹仔編輯每個禮拜都怕晒林振強，皆因每星期四下晝鋤書大會，肥佬黎下令宣讀林振強之每周批判書，猶如讀聖旨，俾佢批評為「悶」、「唔好聽」、「呃秤」、「圖片曳」、「唔知講乜」嘅文章插圖，一定飽受教訓，鬧多幾次就俾肥佬黎照肺，分分鐘冇得撈。  而今林振強去矣，佢在肥佬黎心中嘅地位，相信好難搵人代替，幸好《壹仔》、《蘋果》已經長大成人，創下與別不同嘅風格，好有生命力，不會因為任何人之消失而受到影響。  林振強在左丁山眼中，係一個特殊奇才，佢係番書仔一名，留學美國自學中文，填歌詞極有意境，創作口號往往簡簡單單，一針見血；寫專欄，思潮如海闊天空，「老作」源源不絕，左丁山與佢有數面之緣，交情甚淺，不過曾經有過工作關係，亦讀得佢嘅專欄多，對佢嘅逝世，遺憾遺憾。
20031119-222,20031119,222,健康前線：廚房油煙慢性傷肺,健康前線： 廚房油煙慢性傷肺 慢阻肺病（包括慢性支氣管炎和肺氣腫）是香港常見的慢性疾病，潛伏期可長達二、三十年。梁子超醫生指出，八成患者是由於長期吸煙，其餘兩成則由於空氣污染及遺傳等多方面因素，但最為人忽視的，就是空氣污染當中竟包括煮食爐和暖爐所產生的煙霧。藉着國際胸肺醫學組織於今日定立「世界關懷慢阻肺病日」，更應關注此病的普遍及嚴重性。   記者：邵超　攝影：楊錦文、梁細權 油煙濃味影響肺功能    除了吸煙可引致肺病，烹調時所產生的油煙味亦暗藏危機，長期吸入或會影響肺功能。故此，長期或曾經吸煙的家庭主婦，患上慢阻肺病的機會較高；相反地，不吸煙的家庭主婦，即使長期接觸家居油煙及煙霧，患病的機會亦會較低。 醫生金句    「其實肺容量好大，儲備好多，正常人即使割去一邊肺都可以正常生活，但不斷受到侵害，太遲先發現肺功能受損，有可能只剩低兩至三年命。」 剖析慢阻肺病    慢阻肺病全名為慢性阻塞性肺病，它是一種肺部病症的統稱，由於呼吸道受阻，引致呼吸不舒暢。呼吸道的功能，是把空氣引進肺部，呼吸道從氣管開始分支，愈分愈小，形狀就如樹幹的樹枝。每個分支的末端形成很多細小的氣囊，這些氣囊稱為肺氣泡。 肺受損無法挽救    慢阻肺病患者的年齡多在四十歲以上，絕大部份的患者都是吸煙或曾經吸煙的中年及老年人士，為甚麼要強調是「絕大部份」？梁子超醫生解釋：「慢阻肺病係無逆轉性嘅病，肺功能一旦受到破壞，服藥只能夠紓緩病情、減低惡化速度，但受損嘅肺部就唔能夠復原。」  吸煙固然含有對身體有害物質，更容易引致氣管發炎和收窄，長期刺激發炎現象，會導致肺功能受損，故此吸煙者的肺功能可能較非吸煙者快速衰退，在三、四十歲開始便逐漸浮現出來。     好壞肺分別      左邊肺    健康的呼吸道是暢順的。吸氣時，肺氣泡便充氣，呼氣時便瞬即排氣。      右邊肺    慢阻肺病患者的呼吸道收窄，令能進入的空氣減少，引發以下兩病例：  慢性支氣管炎：氣管壁增厚及腫脹，或氣管壁肌肉收縮，或氣管產生過量分泌，即痰涎。  肺氣腫：肺泡壁和細支氣管受到破壞，肺氣泡換氣功能較差，吸氣容易呼出困難，肺部有脹滿的感覺。 初期病徵僅咳嗽多痰    慢阻肺病的初期病徵並不明顯：  1.經常咳嗽和多痰  2.傷風、感冒  尤其每年天氣乾燥，逐漸轉涼，不少人患上傷風、感冒，讓病人疏於防範。  「慢阻肺病嘅初期病徵好輕微，慢慢會愈嚟愈嚴重。若果持續咳嗽，咳時多痰，做運動時比其他人容易覺得氣喘，都應該及早去睇醫生。」  慢阻肺病患者如果發現連坐着也感到呼吸困難時才去看醫生，可能已出現以下多項併發症：  1.呼吸衰竭  2.肺心病、氣胸或肺炎等  3.情況嚴重可致猝死
20031119-223,20031119,223,玄學運程：大門顏色夾命數好運自然來,玄學運程： 大門顏色夾命數好運自然來 大門是出入必經的地方，在風水學上稱為「納氣之所」，若然催旺大門口，就能夠帶動吉氣，好運自然跟着你。 怎樣將家中的大門變成一個催旺你的納氣位﹖可從顏色着手。至於甚麼顏色才生旺你，則要先計算自己的先天命數。   文：方海閱 www.fonghoiyue.com.hk 計算方法如下︰    男性︰（100減出生年份最後的兩位數），然後除9，得出的餘數便是先天命數。  舉例︰生於1980年  （100－80）÷9＝2餘2，2便是先天命數。    女性︰（出生年份的最後兩位數減4），然後除9，得出的餘數便是先天命數。  舉例︰生於1980年  （80－4）÷9＝8餘4，4便是先天命數。  結果    即是說，如果計出來的先天命數為1，屬水命人，大門的顏色最好漆上金、銀、米白或黃色。  可用顏色地氈解救    若嫌油門工程太大，可在門口鋪張配合自己先天命數的顏色地氈，也可收到一定的效果。
