key,date,article_daily_id,title,text
20040803-0,20040803,0,停職留薪條件：不得參選大班上廉署告商台,停職留薪條件：不得參選 大班上廉署告商台 【本報訊】商業電台與名嘴鄭經翰解約事件愈鬧愈大，商台董事俞琤昨日指鄭經翰早有意向參選，並首先提出願意解約，鄭經翰則反駁商台涉以威迫利誘手段阻礙他參選立法會，爆料指商台在解約條件中除要求他停職留薪外亦不可參選，他今日會向廉政公署及選舉管理委員會舉報。大班哽咽說有人無所不用其極打壓他，感到被朋友出賣，對商台已情至義盡。　記者：羅偉光　莫劍弦　張嘉雯 俞琤昨日下午突然在金鐘港麗酒店舉行記者會，身在中環香港會的鄭經翰得悉後即到場，是兩人上星期在《風波裡的茶杯》中公開攤牌後再次對陣。不過在俞琤開腔期間鄭僅旁聽，俞琤發言後大班才上台逐一反駁。  俞琤在記者會上修改上星期「封咪影響言論自由」的解約原因，表示是收到大班有意參選訊息後才向他建議提出解約，她強調無意阻大班參選，因參選與主持節目只可二擇其一，若大班參選合約即不存在，但她沒解釋何謂「合約不存在」，只表示議員不應擁有最高收聽率的時段為發言平台。  上周俞琤對大班「感性」主持風格有意見，昨日她又提出另一解約原因，她引述《明報周刊》報道稱，民主黨立法會議員李柱銘曾建議大班不要參選，雙方繼續「裏應外合」，她認為這做法有問題，「應該係好公平，畀唔同團體、信念嘅人公平對待。」 大班指俞琤手法「好毒」   俞琤表示昨日才舉行記者會是因不希望事件影響商台營運總裁蔡東豪及顧問梁文道，加上近幾天時間緊湊，每天皆有事情發生，所以延至昨天才公開事件來龍去脈。  鄭經翰在俞琤記者會後逐一反擊，並爆出商台在解約條款中要求他不參選立法會，他認為商台是以錢威脅他，涉嫌觸犯《選舉（舞弊及非法行為）條例》，他今日會向廉署及選舉管理委員會投訴。他又透露雙方原訂昨早簽訂解約協議，但商台臨時失約。  他又質疑俞琤突然開記者會另有目的，「今朝（我）先宣布參選，八點半響（港台）英文台（宣布），唔夠八個鐘頭就開記者會。」他形容俞琤做法猶如「一棍打落嚟」而且手法「好毒」，令他重新考慮是否參選。  鄭經翰又說俞琤所謂「解約建議」，是他與蔡東豪及梁文道午膳時提出，當時只是擔心商台受到政治壓力而作出的建議，「如果商台有政治壓力，要getridof我，即係要整走我，可以依約辦事，我唔會有任何怨言。」他強調當時沒有提及「唱衰」商台字眼，也不知有人會將「把酒言歡」的說話向上司稟告，其後俞琤與他見面，俞反應很大，指因為他提出要唱衰商台，所以要解僱他，他隨即質問梁文道，梁聲淚俱下向他道歉，「我問佢你噏乜呀，我無咁講過（唱衰商台），佢都覺得係自己口多，同我道歉。」  大班解釋，他對蔡東豪提及參選只是「亂噏」，屬私人對話，當時只希望改變節目形式，邀請立法會議員輪流在節目中表達意見。至於俞琤批評他利用商台與民主黨裏應外合，他澄清「唔係淨係同民主黨，係同立法會議員裏應外合，服務巿民同處理投訴。」     中方要大班在政壇消失   知情人士指出，大班原以為商台根據合約條款解約及作出補償，但在六月發出要求大班「停職留薪」的信件中，卻加入不讓大班參選立法會的條件，否則便不會獲得補償，由於此條款是商台單方面加入，大班堅決不接受。知情人士又形容，商台既不准大班開咪又限制他參選，背後明顯有政治因素，而從一些親北京政界人士得悉，中央不單要大班封咪，更要他從此在香港政壇消失。
20040803-1,20040803,1,高山空氣稀薄致腦水腫,高山空氣稀薄致腦水腫 【本報訊】高山症是指遊客登上海拔二千四百米以上的高山地區時，身體產生的一系列症狀，常見的高山地區包括尼泊爾的喜馬拉雅山和中國西藏藏族自治區。這些地區空氣稀薄，氣壓低而氧氣濃度較低，因而導致身體機能出現問題，患者嚴重的會出現肺水腫及腦水腫，在尼泊爾，每三萬名登山人士就有一萬五千人患上高山症，一人死亡。     水份流失頭痛暈眩   急症室醫生彭繼茂說，高地空氣中氧氣成分低，人體需要加快呼吸速度以攝取足夠氧氣，結果會導致血液內的二氧化碳濃度下降，體內水份流失，輕則頭痛、暈眩，嚴重的話，就會造成肺水腫及腦水腫。腦水腫是由於腦細胞缺氧，細胞壁保護機能喪失，水份進入腦細胞，使腦細胞脹大，壓住中樞神經，隨時會突然死亡。  高山症的預防方法主要是留意登山的速度，不要爬得太高太急。一般來說，一天之內登山的高度不宜超過三百米。同時，當登至二千五百米至三千米處時，應停留兩三晚，給身體有充足的時間去適應稀薄空氣和氣壓的變化。因為高地空氣乾燥，而且登山運動時呼吸加快，有可能使體內水份流失增加，容易造成脫水，所以應準備充足的食水飲用。
20040803-2,20040803,2,疑遭放生　邨童嬉水釀意外平田村噴水池食人䱽噬傷少年手,疑遭放生　邨童嬉水釀意外 平田村噴水池食人䱽噬傷少年手 【本報訊】藍田平田邨一個噴水池昨發生罕見懷疑食人䱽咬傷人意外，一名十四歲男童在邨內噴水池嬉戲時，企圖捕捉一條遭人棄置放生的食人䱽時被利齒咬傷手指，他送院需縫上三針及留院觀察。至於涉嫌傷人的食人䱽，事後由警員撿走。　記者：勞康言　宋光明　姜偉康 現場為平田邨平旺樓與平仁樓之間的扶手電梯底一個噴水池，噴水池呈不規則形狀圍着扶手電梯，面積比半個籃球場略小，池水深約半米，池邊張貼有嚴禁落水嬉戲等警告字句。較早時懷疑有市民將兩條約八吋長的食人䱽及一條約九吋長的「豬仔魚」，於池內放生棄置。     貼標語呼籲不要落水   昨凌晨二時，十四歲姓陳男童與三名友人進入噴水池嬉水期間，陳童發現池內有三條魚游來游去，惟不知其中兩條為十分兇惡的食人䱽，他好奇上前捕捉時，不慎被其中一條食人䱽鋒利的牙齒咬傷左手中指，當場鮮血四濺，事後因傷口十分痛楚向看更求助召救護車送院，陳童手指的傷口需縫上三針，並要留院接受觀察。  至早上七時許，屋邨管理人員得悉有食人䱽咬傷住客事件後，立即派清潔工人抽乾水池的水，並將池內兩條食人䱽及一條豬仔魚用膠桶盛載，再通知警方將三條魚帶走，交有關部門檢驗。  房屋署發言人及平田邨社區事務促進會主席陳周軒均表示，發生意外的噴水池旁邊已貼有標語，呼籲市民不要落水嬉戲，並很久沒有人將魚於噴水池放生，事前亦未接獲有人通知及發現在池中有食人䱽，這是該噴水池第一次有人被魚咬傷。由於現正放暑假，為免再有貪玩小朋友落水池玩耍發生意外，稍後將就事件開會討論及考慮加派人手巡邏，又在池邊增加警告標語，勸喻市民勿在水池放生。     房署禁水池放生魚類   平田區議員陳昌指出，屋邨九七年落成入伙時，常有人在水池放生金魚，但兩、三年前已被房署禁止，為防蚊患滋生，工人經常清洗水池及在水中放漂白水，噴水池約三日前才清洗重新放水。  同類事件過去亦曾發生，九八年九月二十八日，一名四十九歲姓鄭房署清潔工人，在舂坎角馬坑邨清洗邨內魚池時，遭食人䱽咬傷手指。同年十一月三十日，一名五十歲姓陳工人，在柴灣公園荷花池清理魚池時，亦遭食人䱽咬傷手指。
20040803-3,20040803,3,學名「比蘭紐魚」性格兇殘,學名「比蘭紐魚」性格兇殘 海洋公園水族館館長黎耀南指出，昨日疑咬傷人的「食人䱽」，相信屬肉食性的南美洲淡水食人䱽品種，牠不適宜家居飼養，生有鋒利牙齒，是惡名昭彰的肉食魚，就算手指被咬傷，傷勢亦可以很嚴重。  食人䱽學名「比蘭紐魚」，性格兇殘，不宜與其他魚類同養，牠除了襲擊其他魚類外，飢餓時亦會向同類攻擊，現時本港法例未有管制飼養食人䱽，本港很多水族館亦有出售，售價由數十元至數百元不等。
20040803-4,20040803,4,殉情異國情侶98年開始領綜援,殉情異國情侶98年開始領綜援 【本報訊】前日在香港仔華貴邨華孝樓跳樓自殺殉情的異國情侶，家人昨前往殮房認屍及到現場拜祭，社署亦證實，兩名死者自九八年開始，已申領綜援金過活。     備生雞拜祭   社署發言人稱，兩名死者譚兆璋（三十二歲）及巴籍女子丁凱倫（三十歲），以健全人士身份領取綜援，兩人先後申請，每月領取綜援金共五千多元，兩人的個案社署並無特別作出跟進，如果死者家庭經濟有困難，可向該署申請要求援助。  女死者丁凱倫生長在富裕家庭，家住港島薄扶林豪宅，家人並開設滅蟲公司，而男死者出身貧窮，在滅蟲公司任職認識「太子女」，兩人情投意合墮入愛河，但兩人身份懸殊，遭到女方家人反對，丁女毅然與家庭決裂，跟隨男友捱窮，兩人並需以綜援金過活，最後以死殉情。  昨晨九時許，女死者的數名男女親人，到西環殮房辦理認領兩名死者屍體手續，其後一行人約同道士，攜備生雞及死者生前穿着的衣服，在墮樓現場拜祭及進行招魂儀式。
20040803-5,20040803,5,助降氣溫屋宇署鼓勵擴闊路面,助降氣溫屋宇署鼓勵擴闊路面 【本報訊】本港夏天愈來愈熱，氣溫上升的幅度更是全球平均增幅的三倍，天文台歸咎於市區高樓大廈過於密集。屋宇署決定修訂指引，鼓勵發展商擴大路面的空間，希望有助增加通風，降低溫度。     放寬部份建築限制   路面狹窄，行人又行車，站在旺角街道一會兒已感到十分不好受。路面這麼擠迫，是因為發展商通常都會用盡地盤的邊界，建築物盡量佔據地面空間，藉此增加地舖面積，提高商業價值，結果剩下窄小的路面，街道愈狹長，汽車廢氣及地面熱氣就愈難散去。  為了加強路面通風，屋宇署決定修訂指引，以高度換取闊度，容許建築物減少地面佔地空間，以騰出較寬闊的道路面積，減少了的樓面面積則可以往上移，部份建築限制會放寬，樓上可以起高一點或者闊一點，彌補地面空間的損失。  屋宇署發言人說，建築費可能會因而增多，但在目前競爭較大的市場下，相信業界會盡量提供較良好的居住及社區環境。新指引並非強制執行，只是給予發展商更大彈性，在設計上幫助街道散熱。
20040803-6,20040803,6,內地大學生妓女借Neway兜客,內地大學生妓女借Neway兜客 【本報訊】持雙程證來港的女「雞頭」，安排七名內地女子到CEONeway卡拉ＯＫ陪唱，然後到時鐘酒店向客人提供性服務，該批妓女當中包括大學生及護士，收費約二千至三千元，最後被警方「放蛇」揭發事件。涉案女「雞頭」昨承認依靠妓女收入維生，被判入獄八個月，七名妓女承認違反逗留條件，各判監兩個月。     吩咐客人K房等候   三十一歲首被告湛小艷，被控七項依靠妓女收入維生，另一項違反逗留條件罪獲控方不提證供起訴，控罪指湛於今年七月三十日，在銅鑼灣糖街的CEONeway卡拉ＯＫ內依靠另七名年齡二十二至三十歲被告的收入維生，而該七名被告則在駱克道立德大廈內違反逗留條件。  案情指出，首被告可安排雙程證女子來港提供公關及性服務，今年七月二十六日身為卧底警員的第一證人致電首被告，要求她安排數名妓女，首被告吩咐他帶同其他客人到涉案卡拉ＯＫ房等候，首被告將第六被告帶到房中，第一證人與第二名卧底警員在房內，第六被告向第二名卧底警員陪唱，兩人其後到附近的時鐘酒店，第六被告向對方提供性服務，第一卧底警員給予首被告三千元。  四日後，第一證人再要求首被告作出同樣安排，六名卧底警員先後到該卡拉ＯＫ，首被告則安排第二至第八被告到房內陪唱，並收下一萬九千元有記認的鈔票，七名被告其後到時鐘酒店向卧底警提供性服務，當她們接過二百元小費後沐浴期間，其他警員掩至將各被告拘捕，首被告則在卡拉ＯＫ內被捕。  辯方求情稱，首被告與夫分居，須獨力照顧九個月大女兒及患肺癌的母親，第二至第四被告均為大學生，欲「搵快錢」才犯案，第六至第八被告分別任職護士、會計文員及公司負責人，為家中經濟支柱，希望獲輕判。  案件編號：ESCC3354/2004
20040803-7,20040803,7,台漢右腿多處灼傷佳能數碼相機非原廠電池爆炸,台漢右腿多處灼傷 佳能數碼相機非原廠電池爆炸 【本報訊】台灣一名木器行僱員日前在工作時，其放在褲袋裏的日本佳能IXUS數碼相機電池突然爆炸，令他的右腿多處灼傷及出現撕裂。經廠商檢視後，發現「惹禍」的電池雖印有「MadeInJapan」（日本製造）字樣，卻非原廠出品，懷疑屬廉價電池。香港佳能有限公司表示，正向日本總公司了解事件，暫無需要回收同類產品。  台灣《蘋果日報》報道，任職司機的事主顏先生表示，事發時他將公司東主交給他、體積細小的相機及兩顆電池放在相機袋內，並隨手將相機袋放進褲袋中，不久突然聽到「砰」的聲響，「我的大腿感到好像要燒起來一樣的劇烈灼痛，一時還搞不清楚發生甚麼事，只覺得一個滾燙的東西卡在我的小腿上。」他的同事馬上把他的褲子割開，相機連同燒焦的電池一同跌在地上。     沒有印上品牌名稱   顏先生猶有餘悸地說：「還好命大，連醫生都跟我說，可幸事發時你沒有使用相機，不然現在恐怕連眼睛都被炸瞎了。」  台灣佳能公司光機部人員昨日調查爆炸原因，初步檢視認定爆炸與相機無關。負責人員表示，原廠電池在台灣的售價每顆約一千七百元台幣（約港幣四百元），而包裝上必定清楚印有「Canon」字樣，但肇事相機電池僅印有「ETNBIL」，一看就知道不是正牌貨。台灣一些經銷商為促銷相機，或會配搭一些其他廠房出產的電池當贈品。香港佳能有限公司發言人回應指，本港從未發生過類似事件，暫不會回收有關產品。香港城市大學物理及材料科學系副教授鍾志源表示，冒牌電池的安全電路裝置質素未必夠好，若有大量電流流過，或無法切斷電流，結果電池會因過熱而爆炸。
20040803-8,20040803,8,忽見記者　搭膊頭合照　拒絕配票陳婉嫻、陳鑑林貌合神離,忽見記者　搭膊頭合照　拒絕配票 陳婉嫻、陳鑑林貌合神離 【本報訊】否認有意與民建聯劃清界線的工聯會副理事長陳婉嫻，在缺席民建聯多個誓師大會後，昨日終與分隊參選的民建聯黨友陳鑑林一同召開記者會闢謠，聲言「兩聯（工聯會、民建聯）合作爭三席」，但對於如何合作，兩人口徑不一，陳鑑林指下一步會與陳婉嫻商討配票問題，陳婉嫻卻表明反對配票，稱會與陳鑑林的名單「公平競爭」，一切由選民決定。　記者：何文雯　莫劍弦　莊曉陽 爭取連任九龍東的立法會議員陳婉嫻，昨日與參選名單中排名第二的工聯會成員林文輝及排第三的獨立人士鄧家彪率先報名，以「創造就業」為選戰主打，陳鑑林則會於稍後報名。身兼民建聯與工聯會成員身份的陳婉嫻，早前指為明確顯示代表勞工立場，選舉時只會強調工聯會身份，又會與另一民建聯成員陳鑑林分拆名單參選，惹來外界質疑她是否想與民建聯劃清界線。  陳婉嫻原定昨日下午二時半與本身的團隊報名，卻忽然於中午一時緊急召開記者會，與陳鑑林雙雙出席，澄清雙方沒有嫌隙。陳婉嫻解釋，與陳鑑林分開兩隊，是為了在比例代表制下可力爭三席。     陳鑑林擬稍後配票   對於兩人同屬民建聯，卻不同日報名參選，陳鑑林指他與「嫻姐」沒有分歧，不需要特地這樣做以示團結。陳婉嫻也解釋，她缺席民建聯誓師會，主要是她一早已計劃立法會休會後的行程，到了民建聯舉辦活動時，她不想改變計劃。  早前港大進行的民調顯示，陳婉嫻支持度高達三成以上，可將第二位的林文輝帶入立法會，陳鑑林則不足一成，昨日談到如何配票，雙方的態度頗為耐人尋味，陳鑑林稱現階段會專注拉票，配票問題將於選舉後期才考慮。  當時陳婉嫻在旁並沒有異議，只表示不相信她會「吸晒陳鑑林啲票」，因她有信心兩張名單各有支持者，更表示曾向陳鑑林表示：「我同佢講，我哋大家冇關係啦，公平競爭吖嘛！因為兩隊人都想入立法會，邊個攞第三席，就睇最後邊個跑出啦。」 嫻姐：不主張配票   但兩小時後，陳婉嫻於報名參選儀式記者會上再被問到如何與民建聯配票，她忽然表示：「我諗我哋唔係好主張配票，因為由選民決定，特別係呢區好成熟吓，市民一直都睇到我哋嘅工作。」當時陳鑑林並不在場。  九龍東已報名的候選人包括民主黨李華明、大律師梁家傑兩張名單，另外前綫的陶君行也會參選，除了李華明、梁家傑可望各得一席外，第五席將會是排李華明名單第二位的胡志偉、陳鑑林和陶君行之爭。
20040803-9,20040803,9,民主雙隊展開港島直選戰,民主雙隊展開港島直選戰 【本報訊】民主黨與《基本法》45條關注組高舉爭取○七及○八年雙普選的旗號，昨日以民主派雙團隊的姿態，攜手報名出戰港島區立法會直選。雖然親北京政界人士不斷批評他們爭取普選目標不切實際，但代表關注組出戰的現任立法會議員余若薇仍然充滿信心，認為只要市民在九月十二日踴躍投票，仍然可以爭取到雙普選，並呼籲港人要永不放棄。  民主黨今次由主席楊森及前主席李柱銘等合組參選名單，夥拍關注組的余若薇及何秀蘭名單參選，並以「民主派雙團隊」名義，以「1+1=4」作口號，希望選民以一帶一、兩人分別投兩隊方式，令四位現任議員順利連任，李柱銘更親自駕車，接載其他候選人巡遊港島區，為他們拉票，之後兩支隊伍在修頓球場再誓師參選，關注組成員更傾巢而出為他們打氣，包括甚少出席政治活動的大律師公會前主席李志喜等。     籲9.12表態爭普選   楊森承認民主派今次要全取四席有一定難度，他期望今次民主派在港島區聯手參選，可以令投票率創歷史新高，這樣可以保證民主派可以取得四個議席。  對於同區對手民建聯及范徐麗泰均提出爭取二○一二年普選，余若薇認為○七及○八年普選特首及立法會，並非完全不可能，她形容○七及○八年普選仍然有機會做到，問題取決於港人是否願意以手中選票表態支持，「○七同○八年有冇普選，睇9.12港人表態，世事可以變，睇你有冇努力，只要永不放棄」。  余若薇又呼籲港人在九月立法會選舉踴躍投票，為香港爭取新希望，「我哋要話畀全世界人知，香港人係熱愛民主，值得有普選，我哋係為香港而投票」。
20040803-10,20040803,10,岑建勳出面挺劉千石參選,岑建勳出面挺劉千石參選 【本報訊】職工盟會長劉千石雖然以獨立名義參選，但聲勢一點也不弱，多個民主派成員，包括職工盟秘書長李卓人、民主黨涂謹申、街工梁耀忠、參選衞生福利界的麥國風、演藝界岑建勳及職工盟一些成員都有到場支持。劉千石表示，既要團結市民一起爭取民主，同時要令北京放心，他願意當一個與中央溝通的「工兵」，希望民主派在九龍西可以全取四席。     阿石願當溝通工兵   未能代表職工盟參選的劉千石表示，原本以為要「孤身上路」，但很多支持者繼續支持他，參選的得失不重要，最重要是達到保衞打工仔女的飯碗、爭取公義和民主的目標。他又指，若可以透過配票爭取四席，可以考慮配票。  根據政黨民調，較早前因提出「與中央各退一步」的大和解言論而備受民主派批評的劉千石，雖願意當與中央溝通的「工兵」，但其選情未必完全穩固。被問及「若落選是否代表和解路線不受市民支持？」劉千石則回應說，不能這樣武斷評論，因為香港的主流意見是贊成溝通，有調查也顯示，超過八成市民是贊成溝通，不應把中央與香港的關係視為非敵即友。  到場支持劉千石的岑建勳表示，劉千石提出與中央理性溝通對香港有利，相信市民也會心裏有數，若劉有需要，日後也會幫劉助選。
20040803-11,20040803,11,威迫利誘不參選可囚七年,威迫利誘不參選可囚七年 為防止在選舉過程中，有人威迫、利誘別人參選或不參選而左右選舉，當局在《選舉（舞弊及非法行為）條例》制訂條文不容任何人作出上述行為；除了針對提供利益或作出威迫的人外，連接受利誘而決定參選或不參選的人也受規管，最高刑罰可判罰款五十萬元及入獄七年。  選舉事務處發言人表示，不會評論個別事件，並強調目前沒接獲任何涉及上述條例的投訴個案，又指一般而言，接獲投訴後，選管會成員會審視個案再決定如何處理，甚至轉介廉政公署跟進。
20040803-12,20040803,12,曹宏威突然參加直選,曹宏威突然參加直選 【本報訊】港進聯曹宏威昨報名參加新界東直選，他否認今次出選是為免港進聯因無人出戰地區直選，令主席劉漢銓面對辭職壓力。曹聲稱在朱幼麟決定退選後已部署參選；他昨日在報名後，隨即前往中文大學派單張，但只派了七張就離開。  此外，港進聯鄧兆棠昨日發表聲明，決定放棄參加新界西直選。至於主席劉漢銓會否參選，他昨日與曹宏威報名時，仍說叫大家等截止提名時便知曉。
20040803-13,20040803,13,陳國強向職工盟示好,陳國強向職工盟示好 【本報訊】已退出工聯會及民建聯的陳國強，昨天以獨立身份報名參選勞工界功能組別選舉。由於工聯會的選票不會再投給陳，陳要當選便要取得其他工會，包括職工盟、甚至親台工會等支持。他向職工盟示好說，支持○七、○八年普選，若職工盟邀請他，他會考慮參與明年的7.1遊行。  陳國強表示，目前仍未找職工盟李卓人討論，但很多公務員工會都表示支持他，其中本地高級公務員協會更提名他參選。
20040803-14,20040803,14,建築測量界六人混戰,建築測量界六人混戰 【本報訊】建築、測量及都市規劃界又多一人角逐，民主黨政策協調部部長吳永輝昨天報名加入戰團，連同今天將報名參選的前測量師學會會長陳佐堅，這界別預料將出現六人大混戰。  吳永輝表示，相信會得到業內的中小型公司支持，並會把「清新、改革、堅定」的力量帶入議會，並會促進年輕專業人士的就業。但他不肯評論哪名參選人較有優勢及自己的勝算。
20040803-15,20040803,15,金怡假期董事長參選,金怡假期董事長參選 【本報訊】力爭連任立法會旅遊界議員的楊孝華可謂兩面受敵，除要應付批評他「霸住茅廁唔辦公」的對手謝偉俊外，剛退出自由黨的金怡假期董事長葉慶寧昨報名參選。葉表示，三人之中，他是百分百的旅遊業經營者，真正代表業界。  他又暗批楊孝華未有為業界在立法會爭取權益，他參選是不想未來四年旅遊界的議席繼續被浪費。葉慶寧報名後只答了數條問題便急着離開。
20040803-16,20040803,16,歐志遠挑戰區會兩虎,歐志遠挑戰區會兩虎 【本報訊】立法會區議會功能組別，原本是鄉議局主席劉皇發與民主黨區議員鄺國全之爭，但無黨派區議員歐志遠昨天報名參選後，戰況由兩雄相鬥變成三方廝殺。  本身是元朗區議員的歐志遠，得到不少民主派人士提名支持，包括陳偉業、曾健成及身兼淘大業主委員會聯會主席的葉興國。  歐志遠批評，目前庸才治港禍國殃民，需全面改革，但他不評論誰是庸才，並表示留待記者猜測。
