key,date,article_daily_id,title,text
20040928-0,20040928,0,削綜援　零用錢1600變500一刀穿頸　老夫涉殺少妻,削綜援　零用錢1600變500 一刀穿頸　老夫涉殺少妻 【本報訊】政府去年六月開始削減綜援，竟引發一宗家庭慘劇！年近七旬老翁不堪年輕二十三載的嬌妻，在政府削綜援後，一再扣減其每月使費，令他每月僅剩五百元使用，盛怒下在妻子吃飯時，從後以生果刀將她一刀穿頸殺害，此案昨在高等法院開審，控方指老翁殺妻後，自行致電報警時大呼：「老夫少妻，我受老婆氣，受得好慘，我𠵱家錯手殺咗佢！」　記者：梁偉強 現年七十歲的被告譚樹堅，昨否認於去年九月十六日，謀殺其四十六歲妻子陳妹仔，譚樹堅與妻子於八二年在內地結婚，案發時與三名子女，一家五口同住香港仔華貴邨華愛樓一單位，案發時一家人每月領取一萬一千多元綜援。     被告哭泣對警認殺妻   根據控方所稱，譚樹堅於當日上午與妻子吃飯，其間妻子說要將譚的每月使費，由一千元減至五百元，譚當堂怒火中燒，離席後拿起削蘋果皮的刀子，當時妻子仍在吃飯，譚將紙刀套塞入褲袋後，從後一刀插入妻子的後頸，其妻即時血流如注，倒卧血泊中。  稍後，譚樹堅致電弟婦陳倩華，說一時衝動殺了妻子，弟婦答：「做乜咁儍，伯爺？」譚再致電999報警，以戰抖的聲調向警方訴說受妻子氣，錯手殺人，當警方到場時，譚一直哭泣，並說：「阿sir，係我殺我老婆嘅，你拉我喇，拉我喇！」 死者氣管被割斷外露   譚樹堅在警署向查案的探員說，綜援是以他的名義申請，亦是存入其戶口，但妻子認為金錢要用在三名孩子身上，最初不肯給他使費，後來才給他一千六百元，但去年六月政府削綜援起，其妻削減了他六百元使費，案發當日又說要在下個月開始，再削一半至五百元。  根據控方所稱，譚樹堅一家自九八年五月起領取綜援，但去年六月，其家庭的綜援金額，被削減百分之十一點一。  譚說：「我要一千六百蚊，唔過份啫，剩返五百蚊，七十蚊要飛髮，邊有得使？呢個月點樣過？」譚說他忍無可忍，一時衝動才將妻子殺害。  根據控方所稱，救護員到場時，被告的妻子已不省人事，沒有呼吸，沒有脈象，送院後證實死亡，醫生檢查時發現其左邊頸項，有一道七厘米深的裂傷，氣管及血管外露，氣管完全割斷，右邊頸項亦有一道兩厘米的表層裂傷，其死因是割斷氣管的刀傷。     爭拗點是否受妻挑釁   港島衝鋒隊警員周麟昨作供稱，被告譚樹堅被捕時，仍穿着染血上衣，「淨係掛住喊」，「喊得好傷心」，但其樣子仍很冷靜，故擔心他會做儍事，譚其後被帶返警署搜身，發現其身上有港幣五百零二元九角、人民幣一百零二元及一部「Nokia」手機。  控方指出，此案爭拗點是被告是否受到妻子挑釁，才動手殺人，聆訊今續。  案件編號：HCCC62/2004
20040928-1,20040928,1,失更警員離奇跳樓亡,失更警員離奇跳樓亡 【本報訊】一名北角警署的警員，昨午應上班卻失更，警方恐有別情，即透過各警區同袍協助尋找，原來他獨自走上深水埗李鄭屋邨高處跳樓，送院死亡，由於死者當時身上無身份證或警員委任證，直至稍後死者的家人獲安排認屍，終證實他的身份，警方對他自殺的原因正深入調查。  死者姓呂（三十五歲），在北角警署任職警員，屬運輸組，專門負責警車工作。據稱，他早前已不開心，家人亦多加留意。  昨午，姓呂警員應要上班工作卻失更，警方恐有別情，聯絡過他的家人，同時透過警察電台，要求各警區同袍協助尋找，但一直沒有他的消息。     警方調查尋死原因   昨午十二時，一名中年男子被發現在李鄭屋邨禮讓樓高處墮下，送院證實死亡。現場地下遺有一包香煙及一隻手表，他當時穿着藍Ｔ恤、短褲和拖鞋，身上無身份證或其他證件，警員在他身上撿獲了一串鎖匙，便持匙到樓上逐戶插匙嘗試開門，可是不成功，只好收隊離去。  據上址大廈的六十二歲姓林保安員稱，事發前巡樓之際於上址十七樓走廊，發現該男子的影蹤，因為感到對方無可疑便沒再留意；而附近的崇正中學，據說有學生目睹該男子從天台躍下，因此而感到很不開心。  此外，由於失更警員的家人急於找尋他的下落，稍後警方便將昨日自殺者的身形、特徵資料作核對，發現李鄭屋邨的跳樓死者與失更警員十分脗合，於是安排姓呂警員的家人前往認屍，結果證實李鄭屋邨跳樓死者正是失更警員，警方仍調查他尋死的原因。
20040928-2,20040928,2,60年僅21次　錯過需多等9年中秋遇滿月9:09pm月最圓,60年僅21次　錯過需多等9年 中秋遇滿月9:09pm月最圓 【本報訊】由於滿月不一定出現在農曆每月的十五，所以中秋看滿月並非必然，不過今年中秋剛好是滿月。今晚賞月，記緊兩個關鍵時刻：九時零九分，月兒最圓；零時二十七分，月兒最亮。要是錯過了今年的中秋滿月，就要多等九年。明月共賞，天倫同悅，父母昨晚伴着子女提燈夜遊，搶先迎月。　記者：蔡元貴　張嘉雯 綜合中國科學院紫金山天文台及香港天文台的分析，今晚九時零九分，是今年中秋夜月亮最圓的時刻，零時二十七分則是月亮升得最高，最光最亮的一刻。香港天文台預測，今晚天氣清明，本港正受大陸乾燥氣候影響，天朗氣清，是賞月的好時機。天文台科學主任莫慶炎表示，賞月不分地區，只要市民舉目南方上空，在一些比較空曠、沒有高樓大廈或高山遮擋的地方，都可以盡覽迷人月色。     2013年再遇中秋滿月   香港太空館助理館長劉啟業解釋，所謂最圓的滿月，是指月球、地球和太陽幾乎成一直線，地球處於太陽和月球之間，而又沒有遮擋陽光照射在月球的一剎；今晚九時零九分，正好是此情此景。一九七一年至二○三○年的六十年間，農曆八月十五就只有二十一次滿月，八月十六反而有三十一次，其餘八次在八月十七。  由於滿月不一定出現在農曆每月的十五，所以中秋不一定有滿月。廣東天文學會推算過，要是市民錯過了今年中秋滿月，則需要等到九年後，二○一三年九月十九日中秋節晚上七時十三分，方能再會最圓的月。  賞過圓滿的月，可以休息一下，吃一口月餅，呷一杯清茶，靜候月兒最光明一刻的來臨。劉啟業說，零時二十七分，當月球升得最高，即月上中天，也就是月光最亮的時候；這是地球表面與月球之間受大氣層遮擋最微薄的時分，月色最是皎潔。 大坑逾百人舞大火龍   冷冷的皓月帶給人間暖暖的時節，在沙田公園的迎月綵燈會，昨晚很多市民一家大小挑着燈籠前來遊玩。大會設有中國大型民族歌舞及雜技表演，又有攤位和燈謎遊戲。最受歡迎是看相算命的攤位，大排長龍。  五十歲的社工爸爸黎先生與太太和八歲兒子一家三口前來參加綵燈會，黎先生廢物利用，以拾回來的紙鳶線轆和罐頭鐵罐自製成可以在地上滾動的燈籠，吸引了很多途人圍觀。黎先說這是兒時玩意，希望傳授給孩子，讓他認識傳統與環保。兒子曉峰則說，中秋願望是以後每年都可以跟爸爸媽媽一起吃月餅、玩燈籠。  大坑坊眾福利會昨晚也舉行了舞火龍盛會，逾百人舞着火龍，在區內巡遊，既慶祝中秋，也替居民祈福。
20040928-3,20040928,3,地鐵通宵疏導賞月人潮,地鐵通宵疏導賞月人潮 【本報訊】本港各類公共交通機構會在中秋期間實施多項特別措施，疏導賞月人潮，深圳海關則成立了節日工作小組監察口岸交通情況。警方則會在多處地方封路及改道，方便市民遊樂。     深圳海關設節日小組   為配合中秋節活動，大部份鐵路，今晚將通宵或延長行走，如地鐵沿線今晚則通宵行駛（見表）。各巴士公司亦有特別延長服務及改道等安排，而專線小巴則有延長服務時間和改道措施。欲進一步知悉各交通工具安排，請瀏覽運輸署網頁  http://www.info.gov.hk/td/chi/notice/specialtravel/specialtravel_index.html  。隨着中秋、國慶兩個節日的到來，深圳各口岸正準備迎接客貨運高峯期。深圳海關表示，包括羅湖海關、文錦渡海關、皇崗海關在內的深圳市各口岸海關，均已成立了節日工作領導小組，指揮節日期間各項工作。運輸署提醒旅客，如欲在中秋節及國慶假期利用過境穿梭巴士由落馬洲往皇崗，或六條定班定點過境巴士線由香港各區往皇崗，應預早計劃行程，並盡量利用火車到羅湖管制站過境。
20040928-4,20040928,4,北京人員密會民主派　料陸續可獲發證岑建勳獲發10年期回鄉證,北京人員密會民主派　料陸續可獲發證 岑建勳獲發10年期回鄉證 【本報訊】北京與民主派之間的溝通再有突破進展，曾任支聯會常委的演藝界人士岑建勳，昨日證實已獲內地發出十年期回鄉證。據了解，中央正逐步安排向民主派人士發還回鄉證，較早前北京曾派人秘密到港，約見上月在上海遭沒收證件的民主黨成員羅致光，查詢他是否想取回回鄉證。有接近中方消息人士相信，部份溫和民主派人士短期內可先獲發證。　記者：莫劍弦 外交部駐港特派專員楊文昌昨日出席福建社團聯會國慶酒會，回應岑建勳事件時說，相信會有愈來愈多民主派人士獲發回鄉證，今次只是一個開始，日後每個人都有發證機會。  岑建勳自八九年六四事件後，一直未能成功返回內地，直到今年七月，他透過特首辦及中聯辦協助獲發一次過的回鄉證，前往上海、北京等地觀光，並與中方官員見面，當時他已透露想取得多次回鄉證。岑建勳昨日接受香港電台訪問時證實，在本月初已經獲發十年期回鄉證，今次他是因為工作上需要，透過特首辦聯絡協助而成功取得證件，過程順利，他也感到十分意外。     支聯會常委難取證   岑建勳又說，他曾向內地官員提及，希望其他願意返回內地的人士也可獲發回鄉證，讓他們了解內地最新發展，而在一國兩制下，由特首辦出面安排無證人士重新獲發回鄉證，是最適合的做法。  有接近中方消息透露，北京已開始安排向部份遭沒收回鄉證的民主派人士發還證件。據悉八月時隨社聯代表團到上海，但遭沒收回鄉證的民主黨成員羅致光，較早前曾在港與來自北京人士秘密會面約半小時，主要討論發還證件事宜。消息人士相信，類似羅致光、李華明等溫和民主黨成員，會在短期內最先獲發還證件，之後會是持有過期回鄉證的人，至於身兼支聯會常委的民主派人士，相信會最難取得回鄉證。     李華明不貿然申請   羅致光昨對密會北京人士一事表示不願置評，但對包括他在內的部份民主派人士，可在短期內取得回鄉證一事感到樂觀。另一位遭沒收回鄉證的民主黨成員李華明則說，若果沒有北京明確示意，他不會貿然往申請證件。身兼支聯會常委的民主黨成員鄭家富則說，相信自己獲發還回鄉證的機會不大。
20040928-5,20040928,5,理大、樹仁學生會突被拒上京,理大、樹仁學生會突被拒上京 【本報訊】中央邀請各界上京慶祝國慶五十五周年的活動生變，原獲邀請並已決定應邀的理工大學及樹仁學院學生會，昨突然收到中聯辦通知，指兩會不獲安排上京。兩大學生會會長聲言事件或涉及「敏感因素」，相信問題出在中聯辦，兩會今天將舉行記者會交代詳情。  理大學生會會長黎震傑昨日接受查詢時拒絕透露被拒原因，只說上周四收到邀請函，考慮了一會後才回覆。外界分析，兩大學生會臨時被拒訪京，可能與有學生打算上京請願有關。  除了被拒的理大和樹仁外，中大學生會及學聯已主動拒絕中聯辦邀請，而香港大學、城市大學、科技大學、浸會大學、嶺南大學及教育學院學生會則會上京。學聯行政幹事劉英傑表示，學聯堅持在「六四」未平反前不與中方有任何官方交流或接觸。     訪京團將見領導人   由特首董建華率領、二百多人組成的訪京團行程緊密，於九月三十日下午抵達北京後直接前往人民大會堂，料獲國家副主席曾慶紅接見。礙於時間緊迫，專機不設行李寄艙以節省等候行李時間，由於進入人民大會堂需接受安全檢查，除女士可帶小型手袋外，男團員不得攜帶手提包。
20040928-6,20040928,6,保皇黨瓜分立會「筍位」,保皇黨瓜分立會「筍位」 【本報訊】今屆立法會尚未正式開會，會內兩大保皇黨民建聯及自由黨，已協議瓜分十八個事務委員會大部份主席之位，其中包括最受重視的政制、保安、房屋事務委員會及政府帳目委員會，而民主派只餘福利、勞工、衞生等五至六個委員會主席可爭逐，令民主派在會內影響力進一步被削弱。  由於政府會在今個立法年度內討論○七及○八年特首及立法會選舉方案，政制事務委員會成為民主派及保皇黨必爭之地，但在民建聯及自由黨協議下，他們會共同支持民建聯的譚耀宗當主席，民主派可說無望角逐。有民主黨候任議員形容，主席可控制委員會的討論議程，由譚耀宗「把關」，「政府可以放心好多」。     民主派難以抗衡   此外，一些被視為曝光率高的委員會主席，如保安、房屋等，也落入民建聯手中，而自由黨則取得多個涉及工商事務的委員會主席之位。至於負責追究部門有否浪費公帑的帳委會，則由早餐派石禮謙代替李家祥；而上屆由民主黨李華明奪得的食物安全及環境事務委員會主席，則協議由張宇人出任，李恐難連任。  有民主黨人形容，在自由黨、民建聯「執政聯盟」合作下，四分五裂的民主派根本連談判機會也沒有，「佢哋傾掂就知會我哋，剩番幾個主席位等我哋（民主派）分」，民主派難以與他們抗衡。
20040928-7,20040928,7,港府企硬不准長毛改誓詞,港府企硬不准長毛改誓詞 【本報訊】立法會秘書處昨以書面回覆候任議員「長毛」梁國雄，指他準備更改誓詞，自行加入效忠中國人民及香港市民等字眼，可能違反《宣誓及確認聲明條例》及牴觸議事規則，秘書處將無法為他宣誓，長毛相當有可能被視為無按法律宣誓而被取消議員資格。長毛昨晚稱仍未決定會否按法例宣誓，要先諮詢法律意見。     長毛：政府想他丟議席   據悉，港府對長毛宣誓一事決定採取強硬態度，不容許有人更改誓詞，即使立法會主席批准，政府也會向法院提司法覆核。  長毛昨晚與中文大學學生會面時，就宣誓事宜表示，「會用感覺同良知決定」，並引用前任保安局局長葉劉淑儀的名言，叫「大家放長雙眼睇。」他說不想用民意要求他宣誓做下台階，相信政府想用盡一切辦法令他喪失議席。  另外，新一屆立法會主席選舉提名今日下午截止，民建聯和工聯會支持上屆主席范徐麗泰連任。范太昨與傳媒茶敍時表示，目前難以評論會如何處理長毛宣誓的問題。但對於議員的衣着，她指只要全體議員接受，穿汗衫、牛仔褲參加立法會也可以。
20040928-8,20040928,8,陳啟宗憂議員令商界邊緣化,陳啟宗憂議員令商界邊緣化 【本報訊】恒隆地產主席陳啟宗不點名批評社會福利界張超雄等候任議員，未上場已要「砌低」立法會及行政會議通過的削綜援安排，是非常不理性的做法，「等於將法律踐踏在腳下」。他又擔心，鄭經翰等說話激進的議員，會變相令立法會變成搞階級矛盾的地方。  陳啟宗昨出席香港發展論壇研討會後表示，憂慮議員借社會福利等議題，利用階級矛盾令商界邊緣化，令社會變得非理性化及共產黨化，因為商界「人數少、唔夠多」，社會要兼顧不同人的利益，「如果利用階級矛盾為私人嘅利益，激化社會唔係好事。」  對於陳的批評，張超雄接受查詢時說：「被邊緣化嘅係啲弱勢社群，香港社會又點會邊緣化到啲商家？佢哋話晒事！佢哋賺大錢之餘，唔該都照顧吓啲弱勢社群啦！」他指反對削綜援並非「砌低」法治，因削綜援只是行政決定，他們是要糾正錯誤的政策。
20040928-9,20040928,9,反對削綜援三百多人請願　社署署長西裝被扯破,反對削綜援 三百多人請願　社署署長西裝被扯破 【本報訊】反對港府於下月一日削減長者及殘疾人士綜援金的行動一浪接一浪，二十一個社福團體近三百五十人，昨日趁中秋前夕，遊行至灣仔胡忠大廈社會福利署抗議。各人情緒激動，在混亂中，社會福利署署長鄧國威的西裝被扯破。示威者其後轉往中環政府總部，將請願信及標語摺成紙飛機拋入內後離開。  包括關注綜援檢討聯盟、香港社會服務聯會、社工學聯等二十一團體昨日發起遊行，要求政府停止第二階段削減老人及傷殘人士綜援金。數百人先於灣仔修頓球場集合，然後遊行至胡忠大廈的社署辦事處，要求署長鄧國威與他們見面。     長毛「護送」署長   擾攘十分鐘後，鄧國威在助手陪同下步出大廈，但由於現場人多擠迫，鄧未能步往遊行主辦單位預先準備的地方接收請願信。示威者認為鄧國威未能回應他們所求，因此開始鼓譟，其中一人更企圖從人堆中攔腰把鄧國威拉出來。  拉扯之間，鄧國威的西裝背部出現了一道小裂痕，皮帶也被扯鬆，非常狼狽。參加遊行的候任立法會議員「長毛」梁國雄隨即呼籲示威者冷靜，並勸傳媒散開，他自己則親身「護送」鄧國威至示威者一早劃定的位置。一位老婆婆代表主辦單位送上一個裝有芋頭的月餅盒，寓意長者及傷殘人士在中秋前夕因綜援金被削，負擔不起一盒月餅。鄧國威則稱政府會繼續聆聽市民聲音。  鄧國威昨早曾到灣仔聖雅各福群會長者地區中心參觀，了解貧窮人士日常生活情況。七十二歲的李志現時每月領取二千四百元綜援金，下月要削減一百三十元，每月的生活費、看中醫費用等令他頭痛不已。李伯昨沒當面向鄧提出暫緩削減綜援要求，「政府鍾意一意孤行，同佢講都冇用！」 楊永強續被批評   對於衞生福利及食物局局長楊永強表示，當局正研究容許領取綜援的長者，在西醫束手無策下可獲資助向中醫求診。不少市民昨致電電台「烽煙」節目，質疑當局是想借此將不滿削綜援的話題「帶走」。  母親感染沙士而病逝的薛培餘，昨日就楊永強的建議主動致電傳媒批評他說：「佢好唔負責任，如董建華所講，佢好膚淺……重有幾日都唔做，都重搞風搞雨，留番啲蘇州屎畀人，佢係咪想延續自己嘅嘢落去，驚我哋未夠慘？」
20040928-10,20040928,10,接受重返社會適應課程寶馬山雙屍案重犯今出獄,接受重返社會適應課程 寶馬山雙屍案重犯今出獄 【本報訊】北角寶馬山雙屍案最年輕的犯人尹三龍在服刑十九年後，今早將可步出赤柱監獄，並趕及在中秋佳節與家人團聚。懲教署署長彭詢元表示，尹三龍重投社會後仍要接受監管，署方會協助他找工作，並可能安排他從事運輸業。　記者：陳沛敏　林社炳 彭詢元昨日出席在囚人士叉式起重車操作訓練課程證書頒發典禮，被記者問及尹三龍的情況，他說：「尹三龍服刑期間讀好多書，知識有晒裝備，最重要係出獄後，社會要畀機會佢，重新投入社會。」     希望從事運輸業   面對就業市場失業率仍然偏高，彭詢元透露，尹三龍出獄前，曾接受五日重返社會適應課程，了解就業情況，學習見工技巧。尹三龍獲釋後，在監管期內署方會協助他找工作。  懲教署助理署長（更生事務）陳聖碩補充說，尹三龍希望出獄後從事運輸業，具體細節仍待安排。尹三龍重投社會後，監管期最少長達一年，其間如要離港都要申請。懲教署輔導組人員並會在尹三龍出獄後，定時到他的居所和工作地點，跟進他重投社會情況。  陳碩聖指出，每年約有八千名囚犯獲釋重返社會，但只有約三千名接受監管的釋囚，獲懲教署協助找工作。面對釋囚就業困難，懲教署與工商界合作，因應市場發展需要，提供訓練課程，讓在囚人士學得一技之長。香港九龍城工商業聯會會長陳榮濂在同一場合稱，最近向一百五十名會員發起「一公司請一人」運動，讓囚釋重投社會，不再誤入歧途。  據了解，雖然出獄在即，尹三龍昨在獄中的生活如常，仍需到車衣工場工作，負責縫製紀律部隊及其他政府部門制服等工作。近日，有懲教人員與他碰面時，都不忘鼓勵他說：「出去好好做人，搵番份工。」尹三龍則多以點頭微笑作回應。     梁耀忠赤柱接人   按照囚犯出獄慣例，今早尹三龍清晨起床如常吃過早餐後，將被安排與監獄監督會面，署方會詢問他有否特別需要等，然後辦理出獄手續，領回入獄時交由獄方看管的私人物品，以及在獄中工作賺取的工資等，然後步出監獄，按習俗不可回望監獄。  一直協助未成年犯人爭取確定刑期的候任立法會議員梁耀忠，今早也會到赤柱監獄迎接尹三龍。
20040928-11,20040928,11,被告泣勸兒女勤力讀書,被告泣勸兒女勤力讀書 涉嫌謀殺妻子的譚樹堅在口供上說，年近半百時，在鄉下迎娶年輕二十三年的嬌妻，其後移居香港，但他飽受妻兒冷落，兒子更曾拿摺櫈打他，加上妻子一再削減其使費，令他一時衝動犯案，控方昨日在庭上播放譚伯與警方會面的錄影帶時，坐在犯人檻內的譚伯老淚縱橫，一邊以紙巾拭淚。     形容妻兒全「當我死」   譚伯與警方會面時，形容妻兒全部「當我死」，他說兒子一返家便玩電腦，他責罵兒子時，妻子便會倒轉頭責怪他，又吩咐兒子，若父親「話得啱就受，唔啱就駁返轉頭」，結果令譚伯大受苦頭，有一次責罵兒子時，更被兒子拿起圓櫈拍打他。  根據譚伯弟婦陳倩華的口供，譚伯並無不良嗜好，八二年在鄉下結婚，去年八月她從鄉里口中得悉，譚伯夫婦感情出現問題，譚伯活得很不開心，她遂往華貴邨探望他，從中開解，譚伯亦親口承認生活不愜意，妻兒均對他不好。     入院留醫家人未探望   據陳倩華所知，譚伯在案發前兩年，曾因腹部要動手術，入住瑪麗醫院二十多日，但妻兒都沒往醫院探望他。  陳倩華與夫譚漢民於去年九月五日，一起到華貴邨探望譚伯，勸他返鄉下居住，當時譚伯答應，並說會跟他倆一道走，詎料事隔半個月，便發生慘劇。  不過，譚伯對兒女仍很關心，在與警方錄影會面的尾聲，仍帶淚勸他們生性做人，勤力讀書，不要與黑社會分子為伍。  本報記者
