key,date,article_daily_id,title,text
20040803-204,20040803,204,寶潔盈利增44%,寶潔盈利增44% 【本報綜合報道】美國最大家庭用品生產商寶潔（P&G）上季純利增長四成四，反映該公司去年收購德國美髮用品公司威娜（Wella），使其歐洲營業額上升。寶潔預期，本年度全年純利會有雙位數增長，營業額升幅有6%至7%。  寶潔上個財政年度第4季（截至6月30日）純利13.7億美元（約106.9億港元，每股50美仙），比前年度同季的9.55億美元（每股34美仙）增長43.5%，並較市場預期的每股48美仙純利理想。撇除重組開支，寶潔上季盈利上升13%。  上季營業額129.6億美元，增長19%，略優於市場預期的128.6億美元。     收購威娜有利業績   寶潔在去年9月份收購德國美髮用品生產商威娜以加快其美容用品業務的營業額增長，此舉有助該公司上季在歐洲市場的營業收入上升。此外，寶潔出品的Crest牙膏和Pampers尿片在發展中市場銷售愈來愈好。
20040803-205,20040803,205,國際視野：數據好壞左右大市,"國際視野：數據好壞左右大市 本周金融市場戲碼不弱，英倫銀行和歐洲央行議息結果，以及美國公布的一些重要經濟數據，預料將為市場帶來漣漪。  周四英倫銀行貨幣政策委員會議息，相信在近期強勁的零售銷售和經濟增長數字支持下，極大機會調高基本利率0.25厘。  至於歐洲央行，因為數據參差，估計還會「再坐一會」。  美國方面，值得注意的重要經濟數據有今日聯儲局基本上用作量度通脹指標的個人消費開支平減指數（PCEdeflator），該指數5月份急升（按年）2.5%，是接近4年來最高，假如6月份升幅比預期大，反映所謂須「量度」的「步伐」已加速，不無令人懷疑聯儲局會否循序漸進地加息，尤其是油價屢創新高，明顯地應了筆者一直強調油價上升非短暫之說，汝道燃油價格持續攀升，是否會影響耗油量大的美國？     美就業市場或改善   不能忽視的是油價高企的惡種子又會否散播至其他經濟環節，最終誘發通脹加快上升？  另一個比較重要的美國經濟數據，是周五公布的7月份失業率和非農業職位，前者應維持在5.6%，後者6月意外地僅增加112,000個，遠差過市場預期，今次無人夠膽胡亂猜測，不過若按照密歇根和芝加哥兩家大學，加上供應管理協會（ISM）的理想調查報告，6月份令人失望的數字有可能如格老所說的「曇花一現」（onlyablip），估計7月就業市場應有長足改善。  歐元區本周亦有失業率、零售銷售等數字發表，儘管德國Ifo商業信心指數和法國消費者開支等數據令人鼓舞，整體而言，人們還是不應期待有任何驚喜。  然則經濟數字好壞或會令市場出現過激反應，投資者還應鎮定。  王冠一"
20040803-206,20040803,206,花旗銀行增租花旗廣場3萬呎,花旗銀行增租花旗廣場3萬呎 【本報訊】市場預測05年甲級商廈供不應求，部署擴充的金融機構趕快以相宜租金洽租優質寫字樓，鷹君集團（041）旗下中環花旗銀行廣場，獲舊租客花旗銀行增租約3萬方呎樓面，另一大租客同時洽租近9萬方呎，有關交易落實後該廈租金將調升20%。 鷹君集團助理董事李澄明透露，花旗銀行廣場包括花旗銀行大廈及亞太金融大廈，已承租花旗銀行大廈3層的花旗銀行，剛協議向鷹君多租兩層約3萬方呎；另一金融機構，正洽租花旗銀行廣場9萬方呎，準備將目前分散的寫字樓集中，並預留更多樓面作擴充。     金融機構洽租9萬呎   中國工商銀行（亞洲）早前承租亞太金融大廈逾10萬方呎樓面，租期長達10年，該廈10月易名中國工商銀行大廈。  他說，05至07年新落成的甲級商廈有限，中區新供應更只有AIGTower，市場將出現供不應求。預期花旗銀行廣場的空置率，短期內將由現時15%降至7至8%，屆時租金將調升約20%至逾30元水平。  地產界人士表示，BNP銀行最近已落實租用中環國際金融中心二期59至63樓5層，共11.6萬方呎，並預留64樓約2.3萬方呎以備擴充，令該廈空置率跌至約10%水平；個別間細單位，每呎叫租近40元。  據了解，BNP銀行現時租用中環中建大廈10層逾7.5萬方呎，將先行遷往國金中心，至於證券行法國巴黎百富勤租用的亞太金融大廈3.5層約5.6萬方呎，租期至05年底，將會較遲遷出。     甲級商廈租金勢升   摩根士丹利顧問董事卓百德說，近期核心區甲級商廈租務活躍，空置率持續下降，加上未來新供應減少，預料05年底租金將較03年谷底勁升一倍。  據世邦魏理仕統計，中環甲級寫字樓現時租金較去年第四季谷底回升16.2%。
20040803-207,20040803,207,回撥七億六　純利增兩成四恆生業績有驚喜,回撥七億六　純利增兩成四 恆生業績有驚喜 【本報訊】受惠於經濟復甦，令銀行信貸質素大幅改善，恒生銀行（011）半年純利62.45億元，增長24.35%（見表），是有史以來最佳的中期業績，增長也勝市場預期，股東資金回報率也創下30.9%的半年度新高。恒生中期每股盈利3.27元，派發第2期中期股息1.1元，連同第1季股息，半年共派發股息2.2元。     半年派息共$2.2   恒生期內大幅回撥7.63億元呆壞帳，以及重估物業淨增值1.19億元入帳，令半年業績出乎意料。期內該銀行特殊準備共回撥6500萬元，去年同期則有4.62億元的撥備，恒生副董事長兼行政總裁鄭海泉解釋，回撥最主要來自物業相關貸款以及企業貸款。  另外，恒生一般準備也回撥6.98億元，去年同期則回撥600萬元，主要是採用新模式計算撥備，故信貸質素在大幅改善下，該銀行可錄得大量淨回撥。若扣除一般準備回撥計算，恒生半年純利56.69億元，仍增長13%。鄭海泉預期，下半年再大幅回撥的可能不大。  恒生上半年淨利息收入繼續收縮，較去年減少9.75%，至47.11億元，主要是淨息差和淨利息收益率繼續收窄，分別降至1.96和2.02厘，較去年底減少14和13個基點。恒生非利息收入繼續上升，較去年同期增加25.73%，抵銷利息收入下降的影響。     息差收窄壓力仍大   展望下半年，鄭海泉相信，貸款需求仍然疲弱，加上市場競爭及利率上升將帶來挑戰，息差仍有收窄的壓力。目前銀行在定期存款已經無利可圖，而且貸款息差仍可能下調，惟有希望債券利率上升，使日後再投資債券的利率會更好。  他續稱，在正常情況下，儲蓄利率不可無止境處於零水平，長遠仍是趨升。不過，美國若8月加息，恒生會否隨即調高短期儲蓄利率，鄭氏稱要視乎同業的做法。  期內，恒生持至到期的債券組合價值（以成本價入帳）達1193.67億元，較去年底的1126.45億元升近6%。     債券投資未有虧損   鄭海泉表示，債券組合為長期持有，按市場價值重估後，也未有在損益表入帳，故無出現虧損，即使是以市值計算，其在長期投資工具上，也未有虧損，只是「賺少咗」。
20040803-208,20040803,208,德勤物色15萬呎租盤,德勤物色15萬呎租盤 消息指，現正租用上環永安中心近15萬方呎的德勤關黃陳方會計師行，已委託代理尋找新辦事處，料成為商廈大業主新一輪力爭對象。  消息人士透露，德勤早於99年或以前已開始租用永安中心逾10層樓面，租期至06年，為避免屆時新供應減少推高租金，所以提前物色租盤。     太古廣場三期有機會   地產界人士預料，提供逾60萬方呎樓面的金鐘太古廣場三期剛落成，每方呎叫租約20元，仍未有租約落實，是德勤其中一個考慮對象。另明年初落成的AIGTower，可供出租樓面約30萬方呎，亦是該會計師行考慮之列。  不過，仍未開始預租的AIGTower，每呎叫租將較現時永安中心的約14元，高逾一倍，可能未合乎德勤預算。
20040803-209,20040803,209,嘉亨灣昨日正式收票,嘉亨灣昨日正式收票 【本報訊】中原地產與日本物業代理合作推銷西灣河嘉亨灣，美聯昨日亦於澳門分行推介該盤，本周將辦睇樓團來港。另外，發展商恒基地產（012）昨日正式收票。     中原推介至日本   中原地產執行董事陳永傑說，與在港設有分行的日本「天支不動產」合作，將嘉亨灣資料推介至日本，並由該行轉介有興趣買家予中原，而現時已有4至5個來自日本的投資者有興趣。  美聯物業董事張錦成表示，本周將安排20至30人的睇樓團由澳門來港。首10名澳門買家，送旅遊優惠及1年租管服務，總值約30萬元。  另外，世紀21亦夥拍中國工商銀行（亞洲），為買家提供九成半按揭保險，利率全期P（最優惠利率，5厘）減2.75厘，送按揭額1.2%回贈及來回曼谷機票，優惠期兩個月。  嘉亨灣於昨日下午6時正式收票，公司及個人名義只限一人一票，昨收約200個登記。  恒基營業部總經理張炳強表示，內購日期未定。市場消息指，物業昨日再錄得成交，3座20樓B室，呎價8500元。據了解，新地（016）副主席兼董事總經理郭炳江昨日往參觀。
20040803-210,20040803,210,泛海兩項目補價2億,泛海兩項目補價2億 【本報訊】過去半年較少曝光的泛海集團（129），最近一口氣與政府達成兩個發展項目的補地價協議，涉資近2億元。  兩項目分別位於油塘及元朗屏山，發展商早於年多前已開始與政府洽商補地價事宜，惟彼此就補價金額未達一致意見，至最近才達成協議。     油塘建39層高物業   其中油塘項目位於四山街與崇信街交界，面積約2.65萬方呎，可建商住樓面約15.9萬方呎，計劃建1幢39層高物業，提供約210個面積約600至900多方呎單位，涉及補價約1.7億元。該項目附近由恒基地產（012）持有的草園街項目，早前也與政府達成協議，補價約1.8億元。     香港仔補價商討中   至於屏山項目則在屏山屏興里，家安花園附近，地皮面積約3.54萬方呎，地積比率1倍，計劃建兩幢低密度住宅，連停車間共5層高，提供49個面積700至1000方呎的單位，涉及補價約2500萬元。  兩項目已完成地基工程，估計建築費逾1億元。據悉，發展商正籌備在年底前發售。  另外，泛海位於香港仔及元朗洪水橋項目，仍與政府商討補地價。
20040803-211,20040803,211,熱門屋苑成交升23%,熱門屋苑成交升23% 【本報訊】九成半按揭計劃推出，為二手樓市增添動力，中細價物業先受惠。美聯物業指出，受九成半按揭計劃推出帶動，本港35個熱門屋苑，過去一周錄得137宗成交，較前周的111宗上升23.4%。     首期減輕推動入市   美聯物業資料顯示，計劃推出後，帶動二手藍籌屋苑交投上升，在買家首期負擔減輕下，選購單位由細價樓伸延至中價物業。  美聯物業進行的調查顯示，不少買家考慮以九成半按揭置業，以柴灣杏花邨、九龍灣德福花園及新屯門中心比例較多，佔五成。  美聯物業營業經理廖英才表示，一對新婚夫婦因九成半樓按推出，以218萬元買入杏花邨11座高層4室，583方呎，呎價3739元。
20040803-212,20040803,212,中原夥大新推九成半按揭,中原夥大新推九成半按揭 【本報訊】迎合二手物業的九成半按揭計劃陸續推出，中原地產夥拍大新銀行，為買家提供全期P（最優惠利率，5厘）減2.75厘，以及最高保費50%現金回贈。     回贈保費50%   大新銀行個人處總經理余李玉梅說，經中原地產轉介，至大新承造九成半按揭，便可選用全期P減2.75厘利率，保費回贈，則視乎年期，以10年為例便可獲半數回贈。另外，亦豁免估價費、手續費、送首年火險及家居保險折扣等優惠。  中原地產執行董事陳永傑（圖左）指出，自政府取消置業貸款後，上車客缺乏資金入市，500萬元以下物業成交量，自4月迄今已累積下跌40%，九成半按揭則有助上車客入市。他預期，可藉此帶動二手交投，年底成交量可升30%，樓價也會有10%上升空間。
20040803-213,20040803,213,地產多聲道：嘉和苑買家兩度追價30萬,地產多聲道：嘉和苑買家兩度追價30萬 樓市交投唔係咁好，低價成交多，在此氣氛下，估唔到重有買家願意追價，金豐易居崔佑興話，一名回流客，喺三個鐘頭內，兩度追價共三十萬元，購得西半山列堤頓道嘉和苑單位。  呢個客，回流本港兩個月到，先後睇咗三十個單位，最近睇嘉和苑高層B，九百一呎，鍾意佢中西合璧裝修設計，同埋無敵海景。  崔佑興話，兩個禮拜之前，嘉和苑原本有另一個高層，呢個買家當時因為要諗一晚，結果俾人捷足先登，今次見再有放售，梗係嗱嗱聲啦。今次作價比起兩周前嘅成交價重低少少，計落追完價都有着數，真係塞翁失馬。     施綺蓮阿媽賣樓   好耐都冇蒲頭嘅前亞姐施綺蓮，市場人士話，最近佢阿媽將西貢物業，以千二萬賣畀西貢海灣酒店洋業主。  物業由三幢三層高村屋組成，喺西貢景星廣場斜對面。施綺蓮阿媽揸咗好耐，之前租出去做意大利餐廳，點知個租客欠租，搞到佢去追租時大鬧餐廳，差啲上埋差館。唔知係咪因為咁，所以決定割愛。  至於買家，係近年積極喺西貢買嘢嘅澳洲籍投資者。宏億置業方國珊話，佢買嚟諗住自己開餐廳。物業五千呎，呎價二千四。     朗豪坊雕塑做地標   約人一齊玩或做嘢，好多時都會搵啲地標做約定地點，唔驚搞錯，好似銅鑼灣時代廣場門口大電視、尖沙嘴碼頭五支旗杆等，但係相約喺旺角又點算呢？  遲啲就唔使擔心嘞，因為鷹君朗豪坊，會擺放三十呎高嘅雕塑「Happyman」，咁第日一講就知邊度啦！  聽鷹君講，因為個雕塑又重又大，所以要分割搬運，到現場再砌番埋。  呢啲地標，好容易聚集人流，咁商場生意自然受惠啦。鷹君果然有諗頭。 遠金中心成交頻頻   金鐘遠東金融中心近期錄得多宗成交，屋之島董事總經理黃志強話，中國旅遊協會喺香港註冊嘅非牟利機構，亞洲旅遊交流中心，原本租用遠金二十樓近二千呎單位，最近轉租為買，成為業主，購入價逾千萬，每呎近五千四。呢個機構今次買寫字樓嘅資金，相信應該係由內地母公司畀。  另外，遠金二十七樓四千二呎單位，上月以每呎七千八摸出，兩個月升值五巴仙。       第一城業主難捨難離   租客喺同一個屋苑置業不時都有，沙田第一城最近有一單，似乎冇乜特別，但利記周德龍話，呢個買家原來九九年買過第一城三九五呎  單位，到○一年賣出轉為租戶。  最近見樓市回落，六月佢四出睇樓，結果用百四萬，買入十六座低層B，逾五百六呎，每呎近二千五，比市價低一成。聽講，今次買樓係因為住慣呢區，同埋方便小朋友返學。  周德龍話，出貨業主八二年以八十二萬購入，諗住換樓，又已睇啱心水，所以肯平買平賣。  蘭西  電郵地址： nancy@appledaily.com 
20040803-214,20040803,214,悅濤軒5批投資者洽購,悅濤軒5批投資者洽購 【本報訊】長江實業（001）蓄勢推售的東涌映灣園3期悅濤軒，隨着租管條例撤銷，投資者入市意欲增加。長實表示，現有5批投資者洽購，長實計劃全層出售，一層8伙，意向呎價3500元，全層逾2800萬元。稍後計劃提供代租服務，進一步吸納投資客。  長江實業高級營業經理郭子威說，東涌樓回報4至5厘，隨着迪士尼樂園明年落成及區內發展，相信回報升至6厘。  配合悅濤軒開賣，該公司在中環中心增設CCClub會所，住客前往該會所，使用設施，收費36元。現有的尖沙嘴喜來登酒店會所，收費22元。另外，每名買家可得免費會籍4個，總值12萬元。  另外，東亞銀行為嘉華地產的深井海雲軒提供樓按優惠。樓價70%一按，P（優惠利率，5厘）減2.75厘，25%二按息率P。買家可享2.3888萬元信用卡免簽帳額及律師費津貼。另可選擇3年延期還本，優惠相當於樓價8%。中原地產及美聯物業分別送贈希臘郵輪旅遊及數碼影音組合，名額各5個，總值20萬元。
20040803-215,20040803,215,樓市精點,樓市精點   西貢起草規劃   ▲規劃署正為西貢市制定分區計劃大綱草圖，涉及104.61公頃。其中新世界的大網仔土地會劃作綜合發展區，地積比不逾1.5倍。另現有工業區土地，劃為住宅戊類，地積比不逾2倍，樓高不逾8層。  ▲受九成半按揭帶動，荃灣綠楊新邨單日錄得3宗成交。美聯梁仲維說，G座中層1室，671方呎，獲上車客以170萬元承接，每呎2534元。     豪宅租漲一成   ▲卓先報告，港島豪宅上月租務暢旺，尤以3萬至6萬元的物業需求大，各區租金較年初升一成，升幅最顯著的大潭陽明山莊，7月呎租22元升19%。  ▲馬鞍山迎濤灣推出一口價優惠後，刺激該區二手交投。美聯葉永昌說，聽濤雅苑2座高層B，977方呎，作價370 萬元，每呎3787元。業主99年以470萬元買入，蝕21.3%。 君頤峰沽兩伙   ▲何文田君頤峰連錄得兩宗成交。7座高層A，1245方呎，以890萬元易手，每呎7149元。另1座低層B，1423方呎，作價795萬元，每呎5587元。  ▲利嘉閣陳延春說，觀塘麗港城32座高層A，937方呎，以333.6萬元成交，每呎3560元，造價合理。業主98年以550萬元買入，蝕216.4萬元，39.3%。     太古城沽兩伙   ▲利嘉閣馬忠強說，鰂魚涌太古城海天閣低層連平台，823方呎，以420萬元易手，每呎5103元。業主00年以290萬元買入，持貨4年賺130萬元，44.8%。
20040803-216,20040803,216,又一居　連平台花園珍貴,又一居　連平台花園珍貴 又一村又一居逾千八伙，當中珍貴的連平台花園，只佔132個，介紹的正是這類，花園450方呎，間隔方形，周邊圍欄建花槽種植小樹，中央放置深木長餐桌，煥發悠閒寫意的氣息，我有我自在。  戶外環境優美，內櫳也高質素。設計富現代感，客飯廳以淺色為主，鋪素色牆紙及天花線，灰色細方格地磚，訂做白色地櫃，廚房改半開放式，並添加飾櫃，美化空間。  三房略有改動，套廁變為獨立洗手間，兩房以衣櫃取代間隔牆，慳位又實用。  記者：溫潤潔  攝影：司徒世華
20040803-217,20040803,217,格格價：同類賣貴很多,格格價：同類賣貴很多 中原林美娟說，又一居連平台花園放盤罕有，造價至少高兩成，最近一次成交在3月，6座低層C，705方呎，花園700方呎，以460萬元易手，每呎6525元。  她說，現有三個，以這個裝修最佳，但花園較細，叫價498萬元，有4%議價空間。另兩個裝修一般，但就貴得多，開價490萬及580萬元。
20040803-218,20040803,218,東亞全年盈利預測被調低,東亞全年盈利預測被調低 【本報訊】東亞銀行（023）上周公布的中期業績遜於市場預期，昨遭多家證券行調低全年盈利預測，股價昨日續軟，下跌2.94%，收報21.45元。     股價續受壓跌近3%   摩根大通調低東亞全年盈利預測1.1%，至21.75億元；投資評級維持「中性」，未來6至12個月的目標價為24.4元，可於20元收集。該行認為，東亞的股本回報率僅9.9%，令人失望，若該銀行能以優惠價在內地進行收購，將有助提升股本回報率。  摩根士丹利直指東亞業績較市場預期差，將其投資評級降至「減持」，目標價下調至20.9元。  高盛雖然將東亞盈利預測調低6%至9%，但把6個月目標價重新定為27元，維持「跑贏大市」評級。法國巴黎百富勤對東亞業績同樣失望，將今年盈利預測調低3.8%。
20040803-219,20040803,219,香港寬頻投訴IP電話受阻,香港寬頻投訴IP電話受阻 【本報訊】城市電訊（1137）旗下香港寬頻日前推出，應用互聯網技術的寬頻電話（IP電話）服務，惟新服務未正式推出卻發生懷疑被人蓄意阻撓，導致未能為客戶提供服務。該公司更將矛頭直指電訊盈科（008）旗下經營網上行寬頻服務的IMS。 城電主席王維基說，「若證實係有人故意違法，除失望外，亦會係我響呢行12年從未見過咁惡劣嘅情況。」他表示，並已向電管局反映，促請監管機構維護公平的競爭環境。他更指出，電訊條例第24條（c），故意不發送任何信息、截取、扣留或阻延任何信息，即屬違法，一經定罪可罰款2萬元及監禁2年。他質疑事件中「有冇人觸犯24條」。不過，電盈方面則否認其事。     用寬頻電話擴市場率   事緣城電周日宣布，於港引入寬頻電話服務，原以為可利用互聯網技術，解決網絡接駁入屋問題，令其網絡覆蓋迅即由52%上升至73%，擴大市場佔有率。業內人士認為，若服務推出，最受影響的自是網絡覆蓋較完善的電盈及和記環球電訊，猶以前者標準月費仍維持於110元影響較大。不過，服務仍未正式面世，電話訊號卻受到干擾，令服務差點「難產」(詳見附表)。  問題雖獲解決，王維基承認，新服務甫推出便發生事故會影響客戶信心，並指「某啲人嘅計劃已得逞」。為此公司昨日亦推出新優惠，首5000名寬頻電話用戶，只需簽約1年，月費將低至38元，並明言「有仇必報......會好針對性去吸納某啲寬頻用戶」。     電盈否認有違規行為   他表示，不想猜度對方是無意或故意，但強調「稍有智慧都會知係乜事」，而事件中另一主角電盈、集團個人客戶電訊市務處總監李玉兒就說：「絕對冇做過調整（網絡），並強調任何犯法事都唔會做。」  李玉兒則回應，公司歡迎市場引入任何新科技，又謂香港寬頻的IP電話服務並無對電盈造成影響。她謂，固網短訊電話推出至今已1年，用戶達70萬用，期望昨推出「固網隨時賞300萬短訊問答比賽」可吸納50萬用戶參加。  電管局發言人證實，昨日早上收到香港寬頻報告，指其IP電話傳送發生問題。該局理解有關傳送現已回復正常，當局亦會與網上行服務供應商IMS溝通及跟進事件。她續稱，市場早已有其他IP電話服務存在，當局會在年底前就IP電話的規管進行諮詢。
20040803-220,20040803,220,上華削價三成招股,上華削價三成招股 【本報訊】晶圓代工股份相繼公布的季度業績，均有理想表現。晶圓代工華潤上華（597）昨亦趁勢宣布，捲土重來，但大幅調低招股價32%至51%，由原招股價0.73至1.1元，下調至0.5至0.54元。集資規模亦減少43%至53%，介乎4000萬至4300萬美元（3.12億至3.35億港元），於今日至周五接受申請，下周五（13日）在主板掛牌。     集資額削至3.12億   華潤上華原計劃6月招股上市，因市況逆轉，最終被迫押後。是次除大幅削價外，原機構投資者亦會增持公司股份。招股書透露，華潤上華原有機構投資者股東，有意於國際配售部份認購總值2180萬美元的股份，佔集資額約一半。  該公司商業發展總監湯國江對是次招股反應充滿信心，他指出，招股價低廉，預測市盈率（加權平均）只有11.7至12.6倍，較同業如中芯（981）的預測市盈率27.3倍低。至於，減少集資的差額將透過銀行貸款補足。  另外，招股書披露該公司今年首季度業績，盈利106萬美元（826.8萬港元），較去年同期升66%，因期內付運晶圓數量上升，但平均售價則下跌13%，至180美元。該公司預測，04年度盈利不少於1122萬美元，升1.79倍。此外，主力為內地農信社提供銀行軟件及商業解決方案的中天國際，亦計劃短期來港在主板上市。
