key,date,article_daily_id,title,text
20040211-0,20040211,0,白沙村兩女童兇殺案開審　疑兇信姦屍可令冤魂化厲鬼學邪術殺人　為向妻報仇,白沙村兩女童兇殺案開審　疑兇信姦屍可令冤魂化厲鬼 學邪術殺人　為向妻報仇 【本報訊】轟動一時的元朗白沙村連環殺女童案，疑兇唐永強昨在高等法院受審。控方透露唐因不滿嬌妻離家出走，遂以「泰國邪術」報復，誓言殺五個有血緣的人後自盡，令五人鬼魂怨氣沖天，供其驅使，而為使兩女童與他有血緣關係，他焗殺二人後，竟玷污其屍。　記者：梁偉強 根據控方聲稱，唐永強於○二年十二月二十日案發後，嚴重燒傷，羈留北區醫院，兩日後他在病榻上，突然向看守的警員自爆：「我唔係變態色魔，我殺人係為咗報仇！」  唐永強向警方透露，他在泰國學了邪術，相信殺害五名有血緣的人，再行自盡，五隻「怨氣沖天」的惡鬼，便會受其驅使，向其妻報復，而他挾持三名年幼子女點燃石油氣，就是為了與子女同歸於盡。唐永強進一步揭發驚人案情，原來他將十一歲陳姓女童及十歲嚴姓女童帶返家，並用枕頭將二人焗死後，為使二人變得與他有血緣關係，竟侵犯二人屍身。     妻子相片寫「生忌」   此外，唐永強對妻子的怨恨，似乎亦見於一張妻子相片上，相片寫着妻子姓名、出生日期及「生忌」二字，以五口釘嵌在一塊小木板上，木板則放在收藏嚴姓女童屍身的衣櫃頂。  現年三十九歲的唐永強，架着一副眼鏡出庭，燒傷的面部已經康復，他凝神傾聽繙譯員說話時，神情平靜，但偶爾嘴角帶笑，昨日他否認兩項謀殺及一項企圖謀殺罪。  唐永強妻子樊柳珊，比他年輕十六歲，為幫補家計，瞞着丈夫做卡拉OK公關，因夜歸遭丈夫打罵，終在○二年十二月初離家出走。 樊柳珊向丈夫坦言另結新歡，不肯回家，唐永強屢勸不果，曾多次向妻子及小姨揚言要殺掉子女，再殺兩女後自盡，利用「五鬼」向妻報復。  樊柳珊昨在庭上作供時，坦言以為唐永強「吹水」，不料案發當日○二年十二月二十日，接到唐來電說：「我殺咗一個女仔，放喺紙箱收埋入衣櫃，等啲仔女玩多一陣，就放石油氣，等爆炸殺咗幾個細路。」  樊聞言說：「三個細路係無辜㗎！」求唐放人，唐不允，說：「你𠵱家講太遲喇，你早啲講重可以！」樊立刻知會家人趕往白沙村，抵埗時，警方及消防員已到場。  控方表示，唐永強緊閉門戶，挾持三名年僅一歲至五歲的子女求見妻子，否則點燃石油氣，後來屋內傳出敲打聲，警方決定破門入屋，突聞爆炸聲響，警方及消防員衝上一樓，發現唐永強與三子女在房間內，身前有兩罐石油氣，一個噴着氣體，一個已冒火，各人均被燒傷，但唐仍想以火燄襲擊警員，遭消防制止，旋即被捕。     兩女藏屍衣櫃沙井   警方救出各人後，在房內衣櫃發現失蹤一日的姓嚴女童屍體，屍身為被子包裹，再以尼龍繩綑綁，內褲染滿血迹；後來法醫官證實，死者私處嚴重撕裂，處女膜幾乎完全破損，並殘留唐永強的精液，死去一日，死因為窒息。  次日，警方在屋外化糞池沙井底，發現失蹤十七日的姓陳女童的裸屍，屍體已嚴重腐爛，相信死去一至兩星期，已無法確認死因，但手上仍有父親所送手表，聆訊今續。  案件編號：HCCC176/2003
20040211-1,20040211,1,王坤：似同地產商枱底交易市民「烽煙」猛轟官商勾結,王坤：似同地產商枱底交易 市民「烽煙」猛轟官商勾結 【本報訊】港府將位置絕靚的紅灣半島賤賣予地產發展商，市民「眼睜睜」看着納稅人的財產成為地產商的囊中物，大呼不值。電台「烽煙」節目昨日充斥着猛烈抨擊港府官商勾結的民憤。房屋委員會委員王坤指摘，港府在事件上一直拒絕滙報，令房委會淪為「尿壺」，「有需要時攞出嚟用一用，無用時就嫌佢『壓』。」     要求公開交代   王坤昨日在電台節目中表示，他曾多番向負責官員追問紅灣半島的商討進展，但官員一直諱莫如深，拒絕透露談判進展，連已作出決定也沒有通知他。他坦言，對港府是次做法極為不滿：「就好似同地產商做緊枱底交易咁！」他並質疑，身為問責高官的房屋規劃及地政局局長孫明揚，到底是向誰問責。  王坤認為，在樓市氣氛普遍轉好下，港府大可以按合約向地產商補回十九億元後，再將整個屋苑進行公開招標，屆時的收益相信會較為理想。他要求港府公開交代事件的前因後果。  香港房屋政策評議會總幹事葉肖萍則說，官商勾結早已存在，當年孫明揚推出「孫九招」，公布為居屋劃上句號時，大地產商何鴻燊公開向他作九十度鞠躬，早已令人側目。她又揶揄房委會的功能盡失，應該及早解散。     賤賣做法愚蠢   不少市民昨日致電到商業電台及香港電台的「烽煙」節目，批評港府賤賣紅灣半島的做法。市民阿Sam指摘，港府賣斷紅灣半島，令到努力賺錢希望可以買到紅灣居屋的市民很失望。而紅灣半島將來轉為私人住宅出售時，恐怕這批市民再也冇能力可以買到該屋苑的單位。  市民陳小姐也質疑，港府在整件事的處理手法，都是「自把自為」，並無諮詢過任何一個機構。也有市民指摘港府賤賣房屋的做法愚蠢，因為紅灣半島如果是以居屋出售，呎價為二千多元，但將來若改為私人樓宇，呎價可能要四千多元。有聽眾直言，港府是次是「半賣半送」，反映這是商家治港。
20040211-2,20040211,2,街市外堆滿雜物阻路,街市外堆滿雜物阻路 觀塘瑞和街市政街市門前，以及瑞和街與瑞寧街交界行人路邊，被附近商戶佔用擺貨及堆放發泡膠箱，附近居民投訴，行人路有如露天貨倉及理貨場，造成阻塞及環境衞生問題，但沒有政府部門處理。     阻塞通道衞生惡劣   居民蕭小姐不滿地表示：「嗰邊好多地方都好迫，市政街市門口對出係咁，條街又係，成日俾人擺好多膠箱、膠籃、竹籮、手推車，佔去半邊行人路，搞到無路可行之餘，而且重好亂，亂到好似貨場咁！」  記者前往視察，見瑞和街街市門前，行人路邊堆放手推車、盛滿蔬菜的膠箱、發泡膠箱。  在瑞和街與瑞寧街交界，位於魚檔和肉檔門前行人路邊，亦被商戶擺放不少滿載海產發泡膠箱，不但阻塞行人路，環境衞生亦劣。  本報已將投訴轉介食物環境衞生署跟進。  （○二○三○五四）    服務熱線  電話：29908288  傳真：23702192  電郵： sservice@appledaily.com 
20040211-3,20040211,3,雅景台滲水住戶困擾,雅景台滲水住戶困擾 讀者鄺女士買入房屋協會興建之馬鞍山夾屋雅景台一單位，九八年入伙不久，即發現窗邊滲水、入牆煤氣喉管及熱水爐排氣煙道出現銹迹，浴室瓷磚出現裂痕，她多次向管理處投訴，至今未維修。  她說，向管理處投訴，職員上門時只用手檢查窗邊了事，並無作任何測試，且表示可能因天雨關係滲水而已。     保養期過　房協助跟進   香港房屋協會公共關係經理梁綺蓮覆函稱，管理公司去年收到投訴後，管理員曾聯同承建商到鄺女士單位檢查，發現熱水爐掣下瓷磚留有銹迹外，並無發現窗邊滲水痕迹，故當時建議鄺女士聯絡煤氣公司安排檢查，疑因安裝有問題引致煤氣喉管出現銹迹。  覆函表示，因屋苑早於九八年入伙，已過一年維修保養期，故房屋協會只以顧客為本精神，協助跟進。就有關投訴，由於經過房協管理處維修人員、工程人員及承建商代表，經多次檢查，均無發現牆身滲水現象，故認為毋須於外牆進行維修工程。  （○一二六一三七）    服務熱線  電話：29908288  傳真：23702192  電郵： sservice@appledaily.com 
20040211-4,20040211,4,創歷史新高　打破沙士前紀錄港人VISA簽帳年花1070億,創歷史新高　打破沙士前紀錄 港人VISA簽帳年花1070億 【本報訊】雖然去年上半年，沙士襲港對消費市道帶來重擊，但下半年已回復元氣。香港最大信用卡品牌VISA，去年零售簽帳數字錄得破紀錄的一千零七十億港元，較前年增加百分之五點七，其中十二月份簽帳消費更錄得一百二十四億八千萬元，也是單月新高。另外，VISA卡在港個人消費滲透率亦上升至百分之十五點四，即港人每消費一百元，便有十五元四角透過VISA卡支付。　記者：丘倩瑜 沙士襲港，曾一度對本港消費市道帶來沉重打擊，VISA卡也難幸免，第二季簽帳額因而下跌半成。然而，下半年消費信心顯著回升，刺激信用卡簽帳，第三及第四季總零售簽帳額均見上升。單月計算，十二月份的簽帳創紀錄，達到一百二十四億八千萬元，較去年同期上升兩成九。現時，全港共有七百萬張VISA卡。  VISA國際香港及澳門地區總經理陳碧鏵表示，十二月份有顯著增長，主要因為市民消費意欲重燃，而該月又是傳統消費旺季，再加上銀行今年積極鼓勵市民以信用卡交稅，刺激信用卡簽帳。     白金卡增長最勁   她預期，由於消費情況仍理想，加上信用卡繳稅繼續增加，故今年一月份整體簽帳額也會可觀，料全年有單位數增長。  本港不同VISA卡品種中，以VISA白金卡的增長最為強勁，截止去年底發卡達四十萬張，較前年同期躍升三成半，而整體簽帳也較前年同期激增五成六。全年，該卡種持有人平均每月以VISA卡簽帳四千三百二十五元，較金卡高兩倍半，較普通卡更高出五倍。     仍然有增長空間   目前，全港共有約七百萬張VISA卡，約每人擁有一張VISA卡，其中普通卡佔五成九，金卡佔三成半，白金卡則僅佔半成，餘下為商業卡。陳氏估計，本港VISA卡發卡數目將維持穩定，而簽帳額則仍有增長空間。  事實上，據VISA的數據顯示，港人目前每一百元的消費中，有十五元四角是透過VISA卡支付，比例是各支付機構中最高，也較○二年上升一點三個百分點，而市面上所有支付機構合共佔二十二元。  她表示，VISA會積極推廣信用卡的使用，例如戲院、停車場、油站及帳單繳費時，以進一步提高VISA卡在個人消費開支的滲透率。去年，VISA卡在超級市場、油站和醫療的滲透率最高，按次達百分之十四點八、十三點八及十三點七。
20040211-5,20040211,5,碌卡交稅刺激簽帳額,碌卡交稅刺激簽帳額 多間銀行去年底提供優惠計劃，歡迎信用卡客戶碌卡交稅，有關款額可獲積分優惠，甚至可享現金優惠，每二百分回贈一元，兼且有免找數期，故吸引不少人採用，令簽帳額彈升；業界也表示此業務反應理想。  使用方法亦很簡單，部份銀行信用卡持有人只須確定本身信貸額較稅款高，便可於網上處理有關繳款；若信貸額不足，持卡人也可於繳款限期前三個工作天，致電要求臨時提高信貸額，取得批准後再繳款。不過，碌卡交稅前最好留意銀行會否徵收額外手續費。
20040211-6,20040211,6,港「雞頭」遭生劏慘死,港「雞頭」遭生劏慘死 【本報訊】澳門消息：一名月前到澳門做「雞頭」的香港男子，昨清晨疑與內地嫖客爭吵結怨，結果被人「班馬」尋仇，遭四名內地男子持利刀及鐵鎚襲擊，寡不敵眾遭利刀生劏慘死街頭。兇徒行兇時，遇澳警巡邏車路過，當場拘捕四名涉案兇徒。     疑與尋芳客結怨   慘遭利刀生劏橫屍街頭港人楊華傑（三十二歲），據悉月前才到澳門做雞頭（依靠妓女維生），主要在司打口一間低級酒店活動。該酒店內有數十名北姑長期「打躉」，因收費低廉至兩、三百都有交易，每晚尋芳客川流不息，不少客人是自由行的內地客。  昨清晨五時許，兩名二十餘歲的內地青年到該酒店尋芳，可能因言語問題，遭數名駐場大漢包圍恐嚇趕走；有人疑不甘受辱，數分鐘後，四名分別持利刀及鐵鎚的兇徒到場，當中包括被趕走的兩名青年，聲言要找楊「算帳」。  楊與四兇徒在酒店門外疑談判破裂，對方有人發難，用刀及鐵鎚向楊施襲，他頭部及身體多處受傷，其中一刀插中胸口被生劏，隨即倒卧血泊；此時，一輛警方巡邏車經過上前制止，其中兩名兇徒當場被捕；警方事後根據疑兇口供在附近住宅再拘捕另外兩人。  被捕四名內地青年均是二十餘歲，他們向警方供稱，案發前其中一人曾在現場遭楊聯同兩名男子冒警行劫，返回寓所後與同鄉折返現場欲教訓對方，不料重手將其殺死。
20040211-7,20040211,7,出現發燒肺炎　已被隔離治療粵中學生疑染沙士,出現發燒肺炎　已被隔離治療 粵中學生疑染沙士 【本報訊】廣州一名中學生出現部份沙士病徵，包括發燒、白血球低及肺炎，當地專家已將病人列為沙士懷疑個案，加以隔離治療，但因其血清檢測屬陰性，尚未正式列為疑似個案，仍須留院七天以進一步觀察血清變化。  廣州呼吸疾病研究所副所長蕭正倫昨日接受香港有線電視訪問時證實，一名留院治療的中學生，出現部份沙士病徵。他說：「目前還未正式確診，剛剛認為他有可能，他屬於非典型性肺炎，和前一個病人一樣，體溫高、肺炎、白血球低，我們就立即留意。問題是如果不考慮其他沙士病人，他自己的血液，所做的檢測，全部呈陰性，而且一直檢測下都是陰性。現在，我們已替他三日抽驗一次，因有些相似，我們就不放，一定要留住他。」     留院觀察七天   蕭正倫強調，較早前確診的四宗沙士個案，病人出現的病徵，包括無傳染性、血清抗體急升，均與去年沙士病者所有症狀很不相同，所以在確診方面出現困難。這名中學生因此需要再留醫觀察七天。  廣東省新聞辦接受查詢時則堅稱，目前只有四宗已出院的個案，未收到新的沙士疫情報告。  這是廣州去年底再傳出爆發沙士疫情以來的第五宗懷疑個案。其中，第四宗個案直到病人康復出院之後，內地才公布並通知香港，引發隱瞞疫情的批評。  廣東省衞生廳副廳長王智瓊昨日則否認隱瞞疫情，強調沙士疫情的證實及公布權在國家衞生部。廣東如何將懷疑個案通報給香港，有待進一步溝通。
20040211-8,20040211,8,醫局沙士會議被指馬虎,醫局沙士會議被指馬虎 【本報訊】立法會調查沙士專責委員會昨向醫院管理局專業及公共事務總監高永文取證時發現，去年沙士襲港期間，醫管局行政高層並沒有記錄首十日的疫情會議情況，議員質疑有人刻意不作記錄，但遭高永文否認。  高永文作供稱，從去年三月十五日起，每日均有召開由他主持的醫管局總監會議，但至三月二十五日，即醫管局行政總裁何兆煒染病入院第二天，才開始有會議記錄。     疑刻意不作記錄   議員鄭家富質疑有人刻意不作記錄，「十日會議，沙士咁嚴重嘅問題，點會冇記錄咁馬虎？」高永文極力否認刻意不作記錄，強調當時沒有負責記錄會議內容的行政人員在場，自己開會時也沒有記錄內容的習慣。  議員又質疑，醫管局在沙士期間成立逾八個委員會，部份委員會功能重叠，導致訊息混亂。高永文則不同意，並指這是因為部份委員經多次磨合都難以達共識，才須高層「以大啲力度」，成立另一委員會作決策，而所有委員會最後都向醫管局總監負責，否認缺乏有力領導。他強調醫管局董事局是高層次管治架構，非直接處理運作事宜，而醫管局主席梁智鴻更不時參與總監會議及提出建議。  對於早前的研訊上，有威院醫生指高永文反對關閉急症室，高永文解釋，當時認為關閉急症室無助控制8A病房疫情，故只決定急症室不接收內科病人，以紓緩內科病房醫護人手壓力，而決定亦得到威院管理層同意。
20040211-9,20040211,9,發燒家庭轉院,發燒家庭轉院 【本報訊】一家四口包括三成年男女及一名小童，因有人發燒不適，帶感冒徵狀，昨晚十一時由荃灣仁濟醫院轉院往葵涌瑪嘉烈醫院，四人由全副保護裝備的救護員護送抵埗（圖），他們下車後被送往傳染病房。  黎家駒攝
20040211-10,20040211,10,五人沙士呈陰性　續啟動黃色應變威院發燒10人無患流感,五人沙士呈陰性　續啟動黃色應變 威院發燒10人無患流感 【本報訊】威爾斯親王醫院8A病房十名發燒病人進行的甲型流感測試結果呈陰性，五人沙士冠狀病毒測試亦呈陰性，其餘五人則尚待結果，院方繼續封鎖病房及啟動黃色警報感染控制措施。該院指發燒病人不是源於共同和單一感染源頭，有微生物學家指病人出現的不是典型感冒病徵，醫管局否認事件與病房過份擠迫有關。     非單一源頭   記者昨在威院所見，醫護均戴口罩及穿上保護衣物，一名職員在8A病房外站崗，防止未經批准人士入內。威院發言人說，十名在8A病房發燒的病人正被隔離，其中五人仍發燒，另外兩人的X光片顯示有肺炎症狀；而為病人進行的甲型流感測試，十人均呈陰性；五人的沙士冠狀病毒測試結果呈陰性，其餘五人的測試預計今日有結果。院方繼續封鎖8A病房，房內其他二十三名沒有發燒的病人不能轉往其他病房，並謝絕探訪。  威院發言人稱，8A病房的員工沒有發燒及肺炎症狀，初步檢查認為發燒病人並非源於共同及單一感染源頭。中大微生物學系副教授陳基湘說，這批病人無接觸過禽鳥，病徵主要是輕微發燒，但不是典型感冒病徵。醫管局高級行政經理鄭信恩否認事件與病房過份擠迫有關，她強調現為流感高峯期，該局會因應內科病床需求，預留其他病房病床減輕擠迫情況，威院亦已增加病床間的距離。  醫管局主席梁智鴻說，這次事件顯示現時防疫機制成熟，有需要時其他醫院會配合紓緩隔離病床壓力，一些非急症病人會獲安排較後時間才入醫院。
20040211-11,20040211,11,疑欠下巨債　圖雙料自殺司機燒炭車失控狂衝險墜海,疑欠下巨債　圖雙料自殺 司機燒炭車失控狂衝險墜海 【本報訊】灣仔碼頭昨發生罕見的「自殺式」車禍。一名嗜賭的士司機疑欠下巨債走投無路，昨先在車廂放置炭塊燒炭，並駕車到海邊企圖連人帶車衝落海雙料自殺，不料當的士抵碼頭附近時，司機疑中一氧化碳失去知覺，的士失控撞毀兩邊鐵欄後，再狂衝百米外的海邊，幸好車頭撼向圍欄鐵馬停下，只差一、兩米便直插墮海，車毀人亡。　記者：李旭基 有的士行家目擊事件經過，立即協助打爛肇事的士玻璃窗，疏導車內的濃煙及讓新鮮空氣流入，再由趕至的警員及消防員將火種撲滅，救出事主送院搶救，性命無礙。警方暫列交通意外處理，並聯絡司機的家人了解其背景。     狂衝百米亂撼亂撞   製造「車毀人亡」自殺場面的士司機姓陳，三十七歲，送院搶救後已經逐漸甦醒，目前情況穩定。他事後向警方承認，計劃在的士車廂內點火燒炭，待車內的氧氣燃燒淨盡，便駛至博覽道東的海邊衝落海，意圖雙料自殺，不料被圍欄及鐵馬所阻，撿回一命。  現場消息稱，肇事的士為事主透過中介人向車行租用，只有四個月。據稱，司機疑因嗜賭欠下卡數及財務公司等債務逾三十萬元，懷疑有人走投無路下，設計這個在車內燒炭及駕車衝落海的「車毀人亡」計劃，企圖雙料自殺。  事發於昨清晨五時許，在灣仔會議道萬麗海景酒店外等客一名的士司機，目擊一輛的士「揸到舞龍咁」，由菲林明道天橋落斜俯衝而下，其間如「波子機」的彈珠般亂撼亂撞，先後撞落兩邊行人路的鐵欄，再沿菲林明道狂衝近百米，鏟上會議道交界的行人路，掃低八、九個鐵馬及圍欄才停下。  目擊者形容，慶幸肇事的士沒有撞向路邊候客之的士，而會議道又沒有車輛往來，否則連累其他駕駛人士造成傷亡。  該的士只差一、兩米便直插落海，整個過程驚險萬分。     打爛玻璃驅散濃煙   同業見發生意外慌忙報警及趨前查看，赫見肇事的士司機昏迷不醒倒在軚盤上，車門反鎖車廂內煙霧瀰漫，於是用硬物打爛三角形玻璃窗開門，驅散濃煙及讓新鮮空氣流入車內。  警方接報趕至發現的士後座位膠墊上，有一個鐵罐炭塊仍在燃燒，立即用滅火筒將火種撲滅，再由消防員救出司機送院。
20040211-12,20040211,12,24河北民工疑墮招工陷阱流落香港,24河北民工疑墮招工陷阱流落香港 【本報訊】二十四名河北民工疑墮下「招工陷阱」，上月底來港準備前赴以色列工作，可是聯絡人失蹤被迫滯留香港，他們交付的六萬元人民幣費用泡湯、攜來的盤川亦用盡，更被逐出酒店，上周五起在維多利亞公園展開露宿生涯，昨日他們到西環中央駐港聯絡辦事處求助，警方已介入調查。  疑遭「賣豬仔」的二十四名民工來自河北省，全是男性，年齡由十九至四十歲，彼此屬同鄉關係。警方發現他們的入境逗留期限已於上周五屆滿，各人涉嫌逾期逗留被帶署，已通知入境處跟進事件，但因人數眾多，警方需安排傳譯協助分批錄取口供，並追尋有關聯絡人下落，若有需要會聯絡內地協助。     擬往以色列   據民工向警方稱，去年底同鄉表示有公司招工到以色列工作，由於薪酬不俗，各人經考慮後決定出國外闖，稍後他們向負責接洽的聯絡人繳付六萬元人民幣費用，並由有關公司代辦出國證件、以色列簽證及購買飛機票。  消息稱，這批民工於上月底由河北鄉間出發，由聯絡人安排先到深圳、再來香港，他們於上月二十九日抵港後獲安排下榻灣仔駱克道一家酒店，當時聯絡人稱本月六日他們便乘飛機前赴以色列工作，而他們的旅遊證件亦於當日屆滿。  可是上周五該名聯絡人突然失蹤，民工彷徨無助滯留香港，因無錢支付酒店房租遷出，他們拖着大小行李，在寒風冷雨下流落街頭，十分狼狽。稍後各人來到銅鑼灣維多利亞公園，展開為期四日露宿生活。     求助中聯辦   昨日上午十一時許，這批民工陷於窮途末路，決定到西環干諾道西的中聯辦辦事處求助，駐中聯辦警員向他們了解事件後，懷疑他們遭「賣豬仔」到香港，於是將各人帶返警署調查。
20040211-13,20040211,13,夫妻庭上相會恍如不見,夫妻庭上相會恍如不見 自言並非變態色魔的唐永強，在嬌妻心目中，是愛妻兒的人，即使丈夫涉嫌犯上彌天重罪，她出庭頂證丈夫時，亦對他沒有半句詆毀，還承認多次見異思遷，均獲丈夫原諒。     似長輩多於丈夫   身材嬌小、年僅二十三歲的樊柳珊，長髮披肩，染成金色，昨與坐在犯人檻內的唐永強，相見恍如不見，沒有太多眼神接觸，她長相年輕，不似三子女之母，唐永強板着臉望着她時，神情肅穆，儼如樊的長輩，實難想像二人份屬夫妻，相識十三載。  樊柳珊與唐永強原是元朗朗屏邨的鄰居，她於九○年認識唐，當時僅十一歲的她不理父母反對，終日流連唐家，唐的妻兒也因此離家出走，她十六歲之時便與唐同居。  而樊與唐正式註冊結婚，是九九年的事，但早兩年已誕下長子，他倆曾做運輸生意，但失敗欠債，夫婦倆又經常打麻雀賭錢，以致要向外家賒借，靠綜援度日。樊於○二年十月開始做卡拉OK公關，但知道唐不會允許，便訛稱在一間出名的餐廳做侍應，不過因經常穿得花枝招展，徹夜不歸，唐曾因此對她打罵。  本報記者
