key,date,article_daily_id,title,text
20040306-101,20040306,101,騎呢真人騷帶挈出處女碟佐敦唱衰Victoria報罵狗之仇,騎呢真人騷帶挈出處女碟 佐敦唱衰Victoria報罵狗之仇 英國巨胸名模佐敦（Jordan）自參與森林真人騷後人氣激增，有唱片公司看準時機，已答應斥資讓她出版首張個人唱片。最近正籌備新碟的佐敦，聲言要在唱片中親自填詞，數臭與她結怨無數的碧咸（DavidBeckham）太太Victoria。     三年前結怨   Victoria三年前開始與佐敦結怨，當時Victoria形容佐敦是「狗」，兩人繼而展開沒完沒了的罵戰。佐敦為了向Victoria報復，已打算夥拍曾與Victoria合作的二人跳舞組合TrueSteppers，向於音樂事業上屢戰屢敗的Victoria示威。  當年Victoria曾請來TrueSteppers監製其歌曲《OutOfYourMind》，可惜Victoria不爭氣，於細碟榜上輸給一位名不經傳的女歌手SophieEllisBextor。據英國《太陽報》透露，佐敦今次請來TrueSteppers是想證明給Victoria看，當年Victoria失意細碟榜，只能怪自己太過不濟。     積極學聲樂   至目前為止，佐敦已寫下多首揶揄Victoria的歌曲，亦有多首作品是挖苦其前男友、曾與Victoria合作的男歌手DaneBowers的歌曲。  為令大碟更具瞄頭，佐敦現正積極學習聲樂，準備在新大碟創一番成績。有評論指Victoria早被英國樂迷唾棄，有人可能故意要令Victoria丟臉而購買佐敦的唱片。  另外，英國《星期日郵報》剛於昨日公布全英三百位最富有名人，身家約有七億五千萬港元的碧咸居然三百大不入，而位居最高的娛樂圈中人則是排名四十三、身家約一百零二億港元的保羅麥卡尼（PaulMcCartney）。
20040306-102,20040306,102,莎拉、Mr.Big曾整容？,莎拉、Mr.Big曾整容？ 人氣劇集《色慾都市》主角莎拉謝茜嘉柏嘉（SarahJessicaParker），日前被整容網頁指出她與飾演Mr.Big的基斯羅夫（ChrisNoth），均有曾動手術縮鼻的迹象。     準備出書   專門揭發整容藝人的網頁「AwfulPlasticSugery」，日前刊登莎拉與基斯多年前與現時鼻子的特寫。從相片來看，不難發現兩人的鼻形均與年前有出入。另外，於《色》劇中演女作家的莎拉，據說目前對寫作事業甚有憧憬，正物色出版商為她出書。
20040306-103,20040306,103,奧斯卡明年提早舉行,奧斯卡明年提早舉行 剛過去的奧斯卡由以往慣常的三月底提前至二月底舉行。近日奧斯卡的執行監製透露，他計劃把以後的奧斯卡頒獎禮再推前兩星期，在二月中舉行，據知此舉可為播映奧斯卡的美國廣播公司（ABC）帶來豐厚廣告收益。  而電影藝術及科學學院發言人表示，理事會將於月底就此事開會商議及表決。  此外，被指有機會提名下屆奧斯卡的米路吉遜（MelGibson），據悉可憑《受難曲》賺取二十二億港元。
20040306-104,20040306,104,全裸Charlotte值千四萬,全裸Charlotte值千四萬 上月剛滿十八歲的威爾斯女歌手CharlotteChurch，最近獲一個成人電視頻道垂青，出價一百萬英鎊（約一千四百萬港元）邀請她拍攝裸照，據知其經理人公司正慎重考慮。  據英國報章《DailyStar》報道，Charlotte形象不再像以往般清純，正好切合該成人電視頻道的需要，有知情人士透露：「天使轉變成反叛少女，正合我們的意思，她絕對是全國最喜愛的可人兒之一。」
20040306-105,20040306,105,離離合合　今次冇得掹米倉男友情人節咀新歡,離離合合　今次冇得掹 米倉男友情人節咀新歡 日本女星米倉涼子去年三月被發現與劇集《武藏》拍檔市川新之助蜜運，其後二人數度傳出分手及復合，但近日二人的感情終於瀕臨決裂，皆因上月十四日情人節當晚，市川不在米倉身邊之餘，還與一名羅馬尼亞美女模特兒在街上三度擁吻。     俱樂部公關   由最新一期雜誌《Friday》所刊登的相片看來，身為藝人的市川竟不顧身份，於情人節晚上約八時在東京西麻布大街上，公然與一名二十四歲的外國美女手拖手及熱吻，儼如一對熱戀中的情人。二人當晚共去了三間食店，到凌晨才依依不捨地分道揚鑣，分開前該女子還擁着市川深深一吻。  據悉該美女在一間專門接待名人藝人的俱樂部工作，而市川自兩個月前認識女方後，便如着了魔般每周到訪該店或相約外出，該美女也曾到市川家過夜。  據知市川更曾對該美女懊惱地說：「我女友的工作及收入都比我多。」對於此事，市川所屬的事務所表示此乃他的私事，不願回應。
20040306-106,20040306,106,宋承憲舒淇續前緣,宋承憲舒淇續前緣 據韓國報章報道，韓國男星宋承憲近日接獲電影《星月童話》及《少年阿虎》導演李仁港的邀請，與張曼玉及舒淇等合作新戲，片酬更高達四億韓圜（約二百六十萬港元）。  宋承憲的事務所前日承認對此極為心動，發言人說：「我們收到的是一個科幻故事劇本，知道對手是張曼玉及舒淇，而導演是李仁港，都好有興趣，宋承憲更在認真地研究劇本。」宋承憲曾與舒淇在電影《夕陽天使》中合演情侶，而影后張曼玉會否答應演出，則未見樂觀。
20040306-107,20040306,107,上戶彩搭上忍者亂太郎,上戶彩搭上忍者亂太郎 美少女上戶彩演而優則唱，亦有不少兒童fans，故近日NHK電視台便向上戶彩提出，將其人氣新曲《為了愛》改編成人氣卡通片《忍者亂太郎》的新片尾曲。  上戶彩不但把握此機會，而且還不忘提攜同門後輩，請即將出道的三人女子組合為她唱和音，據知此組合平均年齡只有十一點三歲，將是上戶彩事務所的最新武器。此外，今天上戶彩亦會為了新碟舉行大型fans聚會。
20040306-108,20040306,108,師奶紀香買貴嘢呻笨,師奶紀香買貴嘢呻笨 廣告合約數目不斷減少的日本女星藤原紀香，日前簽約成為一專門在便利店出售的電腦軟件代言人。廣告中的紀香打扮成一個大嬸買了昂貴的軟件後，在便利店看到價錢便宜五分一的相同商品，即時不斷呻笨。  此外，韓國少女歌手BoA今年繼續成為飲品CALPIS的代言人，日前她便戴上四方帽，拍攝新一輯廣告。
20040306-109,20040306,109,東東同經理人分甘同味,東東同經理人分甘同味 陳曉東昨日與經理人羅嘉慧等於跑馬地的PacificCoffee歎茶，不過三人一見記者馬上迴避，而東東與經理人坐到暗角位後，更點了一件蛋糕兩份食。     迴避鏡頭   昨午三時許，東東、羅嘉慧及一女性友人在咖啡室歎茶，最初三人坐在靠門口的位置，當他們發現門外有記者時，東東大方拍照，但不久他即與女性朋友坐到店內的暗角，剩下羅嘉慧獨個兒坐在原來的位置近十分鐘，其後她才與東東同坐。  此時有記者內進拍照，該女性朋友即時遮臉，東東笑說：「我有朋友喺度。」羅嘉慧亦說：「畀啲空間佢啦。」過了不久三人便離開，臨走時東東被問到有報道指他鬧喊羅嘉慧，東東即時黑面，自行登上保母車。  採訪、攝影：娛樂突發組
20040306-110,20040306,110,嵐5小子煲老藕織冷衫傷透Fans心,嵐5小子煲老藕織冷衫傷透Fans心 偶像組合孭重飛嘅電影，通常票房都只係一般，但由五人男子組合嵐主演嘅《Lifeishard但happy》就好收得，唔夠年半就開拍續集。今次《Lifeishard所以happy》嘅故事承接上集，講佢哋各散東西三年之後再重遇嘅故事。但我羅拉見五子由上集嘅黃毛小子，搖身一變白領藍領，但個樣依然好babyface，好似唔多夠說服力喎！     不倫戀見到唔開胃   至於故事嘅重心會放喺大野智身上，上集講佢同大佢十年有多嘅有夫之婦大搞不倫戀，今集變本加厲，除咗同佢愛人發展半同居生活，大野重為咗佢變咗白領工作奴㖭，而且睇見佢挨落個做得佢阿媽嘅女人身上，真係唔多開胃。  而最搞笑嘅新橋段，反而係相葉雅紀變咗個乸乸哋嘅織冷衫高手，佢成日着住自己織嘅冷衫出場，真係搶鏡到爆。同時二宮和也嘅撒亞人look，都幾超現實。  被問到對今次續集有乜期望，松本潤就做代表話：「套戲好能夠講到我哋呢個年紀嘅人嘅迷茫。」咁又係，不嬲呢類勵志戲喺日本都好煞食㗎啦。
20040306-111,20040306,111,古妮高娃商場晒背親親B女,古妮高娃商場晒背親親B女 俄羅斯網壇靚女古妮高娃（AnnaKournikova），噚日去咗新加坡為Omega所出產嘅最新珠寶系列做宣傳。為咗隆重其事，古妮高娃噚日着住件露背白旗袍去商場宣傳，吸引好多人嚟一睹佢嘅風采，期間古妮高娃都好親民咁抱住個BB女主動合照。雖然古妮高娃嘅網球事業應該已經玩完，不過佢咁識耍親民牌，都抵佢咁多fans嘅！  美聯社
20040306-112,20040306,112,收拾心情賣力宣傳,收拾心情賣力宣傳 班亞弗力（BenAffleck）同莉芙泰萊（LivTyler、左）繼《絕世天劫》後再度合作嘅《JerseyGirl》，將會喺月尾公映，由於班仔同有份客串嘅珍妮花洛庇絲（JenniferLopez）早排已經分手，搞到部戲都俾波及，前日部戲喺紐約舉行慈善放映會，班仔同莉芙自然要齊齊現身，落力為新片造勢。  美聯社
20040306-113,20040306,113,潑婦互罵冷眼觀戰,潑婦互罵冷眼觀戰 英國男歌手洛史釗活（RodStewart）嘅前妻RachelHunter，最近從佢現任女友PennyLancester手上搶走咗個胸圍廣告合約，Penny重同Rachel鬥數臭對方，好似潑婦罵街咁。不過洛史釗活似乎對前妻同女友嘅罵戰好少理，前日佢就飛到美國首都華盛頓演唱，你睇佢個樣幾風騷！
20040306-114,20040306,114,舊曲悼故友　歌舞會知音林憶蓮性感大傾銷,舊曲悼故友　歌舞會知音 林憶蓮性感大傾銷 林憶蓮與倫永亮前晚在紅館舉行演唱會，憶蓮穿上多套性感服裝，酥胸半露，實行向現場觀眾「賣大包」。而他們演繹舊作時，亦分別向去年逝世的張國榮、林振強及梅艷芳致敬。 林憶蓮與倫永亮前晚在紅館為《港樂林憶蓮倫永亮Live》演唱會揭開序幕，憶蓮先後換上五套性感服裝在台上獻唱，當她走近台邊握手及收禮物時，酥胸半露，十分誘人。     「火花永遠在心內」   倫永亮演繹當年與梅艷芳合唱的歌曲《心仍是冷》時，輕吻手持的一支白玫瑰，然後放在台上的空櫈上，寓意獻給已故好友阿梅。而憶蓮唱出歌曲《哭》及張國榮為她獨白的舊作《赤裸的秘密》時，亦向故友林振強及張國榮致敬，她說：「以往大家合作，擦出好多火花同回憶，即使好多朋友唔喺身邊，但呢啲火花都永遠會喺我心入邊，永遠陪住我。」憶蓮事後說：「情緒係『揦』住，如果一喊就唱唔到。」至於倫永亮則直認白玫瑰是獻給阿梅，他說：「我冇嘢講，係唔想咁刻意，想點到即止。」  憶蓮前晚穿上多套低胸裝及短裙演出，她起初為免春光乍洩，鞠躬時都以手護胸，但最終忘記了，結果頻頻向歌迷「賣大包」，而倫永亮以綠色裝束示人時，台下歌迷直指他的打扮很姣，憶蓮亦說：「你成日玩我，整蠱我，你件衫好靚喎，一陣嗰啲衫重姣。」對此倫永亮說：「你叫我唔好釘珠片，我好乖，點知你由頭釘到落腳。」     「鼻水入耳聾聾哋」   此外，倫永亮與憶蓮在演唱會安歌期間，除大唱輕快歌曲外，又不停滿場飛，兩人不時互撞屁股跳舞，倫永亮還輕吻憶蓮的玉手。憶蓮取笑倫永亮說：「你成隻甩繩馬騮，追到我氣咳。」而倫永亮則指籌備這次演唱會很辛苦，他說：「音樂好震撼，鼻水入咗耳仔，我左耳都聾聾哋。」  採訪：駱華齡　攝影：陳偉權
20040306-115,20040306,115,小黑遺作婦女節現銀幕,小黑遺作婦女節現銀幕 柯受良（小黑）去年猝逝，令圈中人深感痛惜，小黑生前最後一部自導自演電影《生死速遞》，將於本月二十五日上映，有關方面特別在下周一的三八婦女節，於灣仔會展先行舉行首映禮，屆時除主角任賢齊和小黑兒子柯有倫出席外，小黑圈中好友曾志偉、陳慧琳和張學友等也會出席，齊齊向小黑這位亞洲第一飛人致敬。     趕救患癌病童   小齊與林心如在《生死速遞》中飾演熱戀情侶，故事講述身為年輕醫生的小齊，與女友林心如為救血癌病童，四出尋找適合的骨髓捐贈者，最後發現飾演囚犯的小黑脗合，惟小黑須趕及在二十四小時之內抵達醫院，否則病童將性命不保。
20040306-116,20040306,116,病壞小白龍無錫受難記柏芝反串少俠日屙五次,病壞小白龍無錫受難記 柏芝反串少俠日屙五次 張栢芝現正身在無錫拍攝新片《小白龍》，她在片中扮演馮寶寶在六十年代曾飾演的小白龍一角，昨日栢芝女扮男裝，反串以少俠造型示人，但她自稱日前又屙又嘔，仍抱恙上陣，然而藥就可以不吃，護膚品卻不可不用。 張栢芝昨日身在無錫影視基地內的水滸城，拍攝新片《小白龍》，此片乃改篇自李翰祥於六十年代所編、由馮寶寶主演的電影，而栢芝昨日更在影城內以反串少俠造型亮相。     着古裝講手機   昨午三時許，栢芝在影城內的一間搭建茅屋內拍戲，其間她趁着空檔，披上厚厚的大披肩獨個兒步往附近的小檔攤蹓躂，雖然栢芝的少俠造型頗具英氣，不過她卻邊行邊講手提電話，還在電話中說：「吓？點解部投射冧咗㗎？快啲整番佢啦！」對話與其打扮可謂相映成趣。  其後栢芝發現有記者在場，主動打招呼，她說前日又屙又嘔，至昨天仍未康復，她說：「我噚日屙咗五次，都冇帶藥，但最緊要帶護膚品，呢度日日有四季嘅天氣，一時大風，一時又好凍，又落雨，所有人都病咗。」     小影迷攞簽名   栢芝坦言今次拍《小》片頗為辛苦，因每日都要趕戲，而她在影城內逛街時，有名小女孩向栢芝攞簽名，她擁着女孩合照，心情似乎十分好。  記者黃文偉、何永寧無錫直擊
20040306-117,20040306,117,張佩金快將度過危險期,張佩金快將度過危險期 張佩金在上海發生車禍後，其傷勢已稍見好轉，昨日她的男友兼經理人Harry在上海的醫院接受記者訪問時，稱張佩金現須以呼吸器幫助呼吸。醫生曾於一周前表示，若張佩金在接受手術後的兩周內，無受到細菌感染，便可脫離危險期，換言之下周便屬張佩金的關鍵期。     批中會遇車禍   Harry表示張佩金早前曾見過一位相士，對方曾批她會遇上車禍，所以張佩金一直不敢開車，想不到仍難逃一劫。  此外，Harry昨早接受新城節目訪問時說：「佢噚日做完第三次手術，好成功，之前一直唔醒，原來係俾條喉頂住，醫生幫佢喺喉嚨開窿唞氣，佢就醒番。」  記者何永寧、黃文偉上海直擊
20040306-118,20040306,118,王菲黎明唱K齋猜枚,王菲黎明唱K齋猜枚 王菲和黎明前晚在台灣出席完電影《大城小事》首映後，便跟一班工作人員往卡拉OK。據知王菲和黎明在卡拉OK房內都沒有唱歌，只是跟自己的助手玩猜枚，王菲猜枚頗為了得，令到對手不停被罰飲酒。  王菲和黎明昨日在台灣宣傳返港，出閘時王菲急步行先，而黎明隨後，他的師奶歌迷即趨前簇擁，對於欲送上禮物的fans，黎明有點𤷪𤺧的說：「等我上車先送畀我。」  此外，吳君如前晚於電台節目，表示欣賞黎明宣傳電影《大城小事》的手法，她說：「可能呢套戲做任何嘢都係自己一蚊一蚊咁攞出嚟，唔需要贊助，咁咪可以攞番啲明星風采。」
20040306-119,20040306,119,"之之激到瘦重現24""纖腰","之之激到瘦重現24""纖腰 年屆四十一的關之琳近日成為瑪花纖體廣告代言人，以火辣紅色比堅尼拍攝廣告，剛巧二十年前，二十一歲的之之亦曾着過紅色比堅尼拍照，今日的她比當年毫不遜色，惹火之餘，更將其白滑肌膚表露無遺。     夫婦取笑下決心   現時體重一百一十磅、擁有35C、24、35美好身段的之之，明顯充滿自信。拍攝廣告當日，男性工作人員眾多，之之不用清場即除去外套埋位。之之表示試過與男友黃家諾行超市，被一對路過夫婦取笑她肚腩大，之之感到羞辱，即決心減肥。  至於有指本來之之是簽約皇室纖形，但不滿屈居劉嘉玲之下，才改選瑪花，之之解釋其實她與瑪花一早有口頭協議，後來皇室出高價向她招手，之之因為不想失信於人，故最終選擇擔任瑪花代言人。"
20040306-120,20040306,120,溫總派1936億助貧,溫總派1936億助貧 為期十一天的十屆全國人大二次會議昨日在北京開幕。就任總理一年的溫家寶發表了首份政府工作報告，一以貫之地落實其「平民總理」的理念，在照顧農民、下崗工人、城市貧困戶等弱勢群體方面，開出了高達一千九百三十六億元的支票。 溫家寶在去年當選總理後的首場記者會上，曾大打「平民牌」，自稱「我是一個很普通的人」。一年來，溫家寶的平民總理形象已深入人心，無論沙士爆發期間在北京大學飯堂與學生一起用餐，還是到醫院探望愛滋病人，與他們握手傾談，都為內地民眾津津樂道。     五年內撤全部農業稅   在昨日的政府工作報告中，溫家寶強調今年工作的基本思路是要堅持科學發展觀，「着力解決經濟社會發展中的突出矛盾、着力解決關係人民群眾切身利益的突出問題」。他在報告中開出的支票不多，但絕大多數承諾都是着眼於照顧弱勢群體，讓他們從今年起獲得近二千億元的直接受益（見附表）。  溫家寶說，解決「三農」（農業、農村和農民）問題，是政府工作的重中之重。他宣布，今年將取消煙葉之外的農業特產稅，並將逐步降低農業稅稅率，平均每年降低一個百分點以上，五年內取消農業稅。與會代表對此報以最熱烈的掌聲。     撥巨款普及農村教育   內地的農業稅是依照承包土地的產量分級計算的，國家規定最高稅率不得超過百分七。今年若稅率降低一個百分點，農民就可以減輕負擔七十億元。  溫家寶對農民的照顧，不只是體現在稅、費的減免，還包括對農村教育的關注。他提出，中央將撥巨款用於農村義務教育，以及改造農村中小學危房，還將啟動西部地區「兩基」（基本普及九年義務教育、基本掃除青壯年文盲）攻堅計劃，希望到二○○七年實現目標。     設貧戶「生活保障金」   溫家寶同時承諾，投入巨資安排下崗工人再就業，並確保城市貧困戶獲得類似香港綜援金的「最低生活保障金」。  對於近期民眾激烈反彈的拆遷、徵地問題，溫家寶明確要求，在城鎮房屋拆遷中，要合理確定拆遷規模，完善補償安置政策；徵用農村土地，也要嚴格控制規模，給予農民合理補償。他提出，用三年時間基本解決建築業拖欠民工工資問題。  本報記者/新華社/路透社
20040306-121,20040306,121,開30億支票阿扁台中拔藍營4樁,開30億支票 阿扁台中拔藍營4樁 台灣總統陳水扁昨天在台中縣用銀彈政策展開「拔樁之旅」，一口氣拜訪了四個「藍營」控制的鄉鎮，結果收穫甚豐，受到三個國民黨、一個無黨籍鄉鎮長「高規格」接待，動員大批鄉親高叫「阿扁凍蒜」（當選），阿扁也一口氣開出三十多億元的建設支票給這些鄉鎮。  陳水扁昨天馬不停蹄的到台中縣東勢、石岡、神岡、后里等四個鄉鎮。國民黨籍東勢鎮長張錦湖給予「高規格」接待，不但有女員工在門口列隊歡迎，還動員五百多位鄉親座談。張錦湖感謝政府在「九二一」震災後重建山城的努力，也公開呼籲鄉親大喊「阿扁凍蒜」口號，使阿扁笑得合不攏嘴。     鄉鎮提要求全部答應   陳水扁稍後轉往石岡鄉、神岡鄉、后里鄉公所，沿途逢廟必拜，同樣受到國民黨籍的石岡鄉長劉宏基、神岡鄉長陳啟宏、無黨籍的后里鄉長陳義貞的熱情接待，動員大批鄉親迎接，預祝阿扁高票當選。三個鎮也趁此良機，提出三至五億元的建設需求，阿扁都一一的爽快答應，但要求鄉親「一定要讓他連任成功」。  民進黨立委認為，鄉鎮長公開挺扁，會影響中間選民投票意向，有助阿扁連任。國民黨籍立委則抨擊阿扁「假視察、真拔樁」，亂開競選支票，要求選民不要被蒙騙。對於有國民黨籍鄉鎮長「倒戈」挺扁，國民黨台中縣黨部強調，將派員了解他們是否真的挺扁，並評估影響範圍，想辦法彌補流失的選票，黨紀問題則留待選後再議。  台灣《蘋果日報》
20040306-122,20040306,122,《台北時報》通告員工不支持綠營請離職,《台北時報》通告員工 不支持綠營請離職 總統大選日近，台灣英文報章《台北時報》（TaipeiTimes）最近向全體員工下發聲明，重申該報支持民進黨的堅定立場，絕不容許員工質疑與挑戰，記者若寫了對民進黨不利的報道，將被開除，不支持泛綠者也請在大選前離職。  《台北時報》總編輯朱立熙被指在二月十三日向所有員工發出電子郵件稱：「不論各位的政治立場為何，本報支持『泛綠』的立場絕不容質疑與挑戰……我歡迎不認同本報立場的人盡快在選前離職，我們尊重各位的選擇，並成全想走的人。」     禁採訪不利民進黨消息   該報一名記者說：「我曾被告知，如果寫了對民進黨不利的報道或是太『藍』的新聞，我會被開除。」迄今為止，並沒有傳出該報有記者因持不同政見而被辭退的消息。  朱立熙昨晚接受台灣《蘋果》記者查詢時，反駁相關報道說：「這完全是惡意的抹黑」、 台灣新聞記者協會昨天指摘部份平面及電子傳媒，在報道陳由豪揭發總統陳水扁收取二千萬元黑金的新聞時，令人懷疑有意打擊特定陣營（陳水扁），同時缺乏查證及平衡的新聞原則。  台灣《蘋果日報》
20040306-123,20040306,123,賣總統飯盒籌錢,賣總統飯盒籌錢 昨天推出由陳水扁親筆簽名的「阿扁總統紀念飯盒」，每盒售價為二百九十九元新台幣（約七十三港元），是普通飯盒十倍，並以「網絡訂購，超市取貨」的方式公開發售。  台灣總統選舉進入倒數最後半個月的決戰時刻，為了籌措競選經費，支持陳水扁競逐連任的「扁帽生活館」推出這種「總統飯盒」。「扁帽生活館」執行長孟義超表示，許多中間選民不習慣走入人聲鼎沸的競選總部或後援會，但可透過網絡的隱蔽性，直接購買選戰紀念品，這樣做有助於民進黨開拓票源。  「阿扁總統紀念飯盒」的盒身深綠色，盒蓋有阿扁娃娃及陳水扁的親筆簽名，飯盒共有兩層，可用微波爐加熱，每盒的售價為二百九十九元。顧客可到 www.skyshopping.com.tw 選購該款飯盒，在網絡付款後，可在全台灣的五大超市取貨。  中央社
20040306-124,20040306,124,「政治巨頭」下跪,「政治巨頭」下跪 台灣兩個推動教育改革的團體，昨天在台北召開記者會，幾名頭戴陳水扁、連戰、李遠哲等政治人物頭套的成員，一起在中正紀念堂前下跪，懇求關心教育的各界人士一起參加教改遊行。  中央社
