key,date,article_daily_id,title,text
20041213-78,20041213,78,解民主黨偏安之局,解民主黨偏安之局 范國威 民主黨經歷十載風光，現遇上前所未有的難關，猶如劉邦退走巴蜀，官兵大量流失，外圍又處處受制於西楚霸王項羽。民主黨能否如劉邦般，最終以弱制強，還看民主黨今後是否可廣納賢能、調整策略。  九四年，港同盟與匯點合併成立民主黨，並在隨後的區議會、市政局及立法局選舉取得佳績，聲勢如日方中。不過，在二○○○年立法會選舉中流失選票十七萬，本年九月的立法會選舉中，民主黨議席數目下降至九席，第二梯隊全軍盡墨，在香港島選區更被指誤打告急牌，大失民心。據香港大學民意研究計劃最新的政治團體評分調查，十大政團當中，惟獨民主黨的民望下跌。  更令人憂心的是政治空間大幅萎縮，過往儘管有中方的打壓，但憑着高舉民主派的旗幟，而市民亦別無他選，能保有基本的支持。不過，近年民主派新興勢力相繼崛起，基層的有長毛、職工盟，中產的有四十五條關注組。雖然民主派政團之間仍是良性互動，但此消彼長，民主黨人應以項羽的敗亡為戒。 項羽兵足糧多，手下猛將如雲，如范增、陳平、韓信均曾在帳下效力，但項羽性格多疑、專橫、妒才，致陳平、韓信轉投劉邦，范增失寵離去。反觀劉邦在軍事上一直處於劣勢，但廣言納諫，知人善任，對將士毫不猜忌，故賢士紛紛投效。項羽眾叛親離，難逃敗北的命運。  民主黨遇上難關絕非偶然，曾幾何時民主黨曾如項羽般人才濟濟，擁有極為寬闊的政治光譜。光譜核心有李永達、張文光、何俊仁、楊森，左側有走基層路線的曾健成、劉千石、陳偉業，右翼則有維護中產利益的張炳良、馮煒光、盧子健。不過，時移世易，民主黨未能把黨內政見分歧轉化為黨內派系良性競爭，再將之作為推動黨務的力量，導致左翼棄走右翼淡出，只餘主流派別唱獨腳戲。  綜合各方救亡方法，大致可分兩類。其一建議民主黨重拾基層路線，以滅貧政策、設立最低工資及最高工時法為爭取目標；另一主張積極關注中產議題，提倡自由市場經濟、公平競爭法、優質教學、環保及稅務改革。兩種說法各有所長，基層路線乃民主黨崛起之道，駕輕就熟；另一方面，中產人士乃民主黨過往忠實的支持者，不能放棄。 從表面看，兩派主張似水火不容，然而民主黨過往能將兩派主張納入羽翼之下，各取所需，足證基層利益和中產階級並非必然對立。英國工黨領袖貝理雅在九十年代推行「第三條路」的路線，打破左派及右派的傳統思想框架，又大幅吸納對手保守黨的政策，成功結束工黨十八年的在野生涯，上台執政至今，民望仍然高企。  因此，民主黨人須認清問題的核心，從來不是嚴重的意識形態分歧，亦並非純粹政治定位之爭，而是政見的包容及政策整合的表達技巧。政黨其中一個重要功能，乃整合不同民意和利益，再將之歸納為一套可供選擇的政策方案和政治藍圖。民主黨應把自己定性為「務實型」政黨，而非「意識形態型」政黨或「全民」政黨。  名將韓信初投劉邦陣營時，只獲任命為管理糧草的都尉，其後才獲丞相蕭何的推薦。韓信在軍中毫不起眼，劉邦初時對蕭何的進言半信半疑，不過最後仍納諫，也打破論資排輩的框框，拜韓信為大將軍。當時劉邦身邊不乏大將，如周勃、灌嬰及樊噲等，均隨劉邦征戰多年，卻遭韓信「空降」爬過了頭，心裏自然不服。然而，劉邦讓韓信展示獨當一面的軍事才能，令各將士莫不拜服。 劉邦若沒破格提升韓信，相信最終只能偏安巴蜀，這說明了吸納人才的重要性。民主黨雖然不乏人才，但人皆有其不足，如劉邦所言，「運籌帷幄之中，決勝千里之外，吾不如子房。鎮國家，撫百姓，給饋餉而不絕糧道，吾不如蕭何。連百萬之軍，戰必勝，攻必取，吾不如韓信。此三人者皆人傑也，吾能用之，此吾所以取天下也。」若民主黨人能知其不足，展示更大的包容胸襟，重新邀請已退黨的黨員回巢，及已淡出的黨員出山，可期打破偏安之局。  劉邦雖得蕭何、韓信等賢士之助，仍不能保證每戰皆捷，惟有廣結不滿項羽的諸侯，施合縱連橫之計。劉邦率兵初出關，組諸侯聯軍五十六萬人，曾一度攻佔楚都彭城，迫使項羽星夜趕回。劉邦在滎陽之戰，游說英布叛楚，擊退楚軍，奪得尚佳的後方基地。及至決定性的垓下之戰，劉邦再拉攏九江楚軍守將叛變。項羽四面楚歌，最終烏江自刎。  因此，民主黨人不能忽視周遭的民主派政團、民間團體及支持者。過往面對中方強勢的打壓，民主黨人總覺勢孤力弱，但經二十三條一役，不難發覺民主的朋友遍布各階層，有年輕人、有中產、有學者、有工商界等，問題只是如何將分散的力量團結起來。民主黨和民間團體應重新認清彼此的政治功能，促成雙方在民主路上分進合擊的良性互動。 不能否認，前綫、民協、四十五條關注組等泛民主派政團各有所長，能爭取部份非支持民主黨的力量。  假若民主黨能與其他民主派政團結盟，甚至進而重新組合，將更有效凝聚支持民主的港人，形成中方難以忽視的力量，須知道穩健發展的政黨政治，乃香港全面普選的重要先決條件之一。不但民主黨需要思考，更值得民主派深入討論。  ……………………………………………………  作者為民主黨區議員
20041213-79,20041213,79,新買手機內存19個肉麻短訊在「3」購入疑是舊機當新,新買手機內存19個肉麻短訊 在「3」購入疑是舊機當新 《蘋果》一讀者在和記電訊公司旗下「3」電訊店，購買一部手機，使用時發現新手機內竟儲存有十九個於九日內先後接收的短訊，內容以夫婦相稱的肉麻情話，部份更是在深夜發送，他質疑是舊機當新機出售。 「啲職員話係新機，但係手機裏面居然有十九個未出機前發送嘅短訊，全部都係以老公老婆相稱嘅肉麻對話，如果俾我老婆睇到就大件事！」  《蘋果》讀者陳先生稱，上月二十三日他在大埔昌運中心商場地舖「3」電訊店購買一部LG8120型手機，並簽了一年半的上台合約，每期供款二百多元。返家後，他取出手機測試，竟發現內有十九個由十一月十四至二十日間收到的短訊，發送時間最夜至凌晨一時許，最早則為早上八時許。  他質疑新手機為何儲存一批未出機前發送的短訊，於是向「3」電訊店查詢。職員稱可能是試機時未有刪除。他稱，為何職員會在凌晨試機，以及全部均是以老婆老公相稱，部份短訊內容更是長達四十至五十字。其中包括：「老公聽吓我電話……你唔理我……我會好慘！Sorry！」、「老公我知你嚴（嫌）我煩……你已經唔再愛我……yammy老婆。」     發訊電話屬和記職員   陳先生說，為查證手機是舊機還是新機，他根據手機上發訊人來電號碼，主動致電對方查詢，接電話是一名女子，他即問對方：「你老公係咪喺『和記』做？」該女子回答說：「係呀！咩事呀？」他隨即掛線。  事後，他致電和記電訊客戶熱線查詢，職員表示手機內短訊只會在機樓內儲存四十八小時，即機主只要在四十八小時內再啟動手機，手機內短訊就不會被刪除。換言之，該部手機於上述九日內有可能連續被啟動使用，訊息才會保留。 職員稱誤將退機出售   和記電訊至本報截稿前仍未回覆本報查詢，但陳先生表示，本報跟進其投訴後，和記電訊客戶服務部曾有職員聯絡他，解釋是「因為有客人出咗部機後唔滿意，落返舖頭退機，咁有職員唔覺意當新機擺番落舖頭，就錯手畀咗客人。」  手機市場行內人士指出，手機儲存有出機前的短訊，只有兩個可能性，「試機時留下，或是職員用過或賣過出街退咗返嚟。」  不過他排除試機的可能性，「試機冇可能凌晨，重要係老公老婆嘅對話，就算小心下載都唔會下載成咁！」  （一二○三○一三）    服務熱線  電話：29908288  傳真：23702192  電郵： sservice@appledaily.com 
20041213-80,20041213,80,有線寬頻推銷員涉誘客簽約,有線寬頻推銷員涉誘客簽約 有線電視一用戶，直斥有線寬頻推銷員不擇手段，以續約有線電視，可獲免費安裝及使用有線寬頻一年半為餌，誘他簽約後，接獲月結單才知，原來他同時要付有線寬頻及有線寬頻月費，沒有「免費寬頻」這回事。  有線電視用戶梁先生稱，今年七月接獲有線寬頻推銷員電話，指他與有線電視的合約將近到期，月費將會由239元增至298元，若他續約一年，可獲免費安裝及使用寬頻一年半；他覺收費化算，便答應簽約。     接月結單始知「中計」   他說，有線寬頻推銷員上門簽約時，只供有線電視及安裝有線寬頻的合約副本給他簽署，至於免費使用有線寬頻十八個月的合約，推銷員謂暫只有臨時文件，故要待他稍後到公司取合約正本，始再給他簽署。  至今年九月份，他接獲月結單時，發現有線寬頻及有線電視均向他徵收費用，並沒有「免費寬頻」這回事，他向有線寬頻投訴無結果，轉向本報投訴。     終止合約　不收罰款   有線寬頻發言人回應稱，接獲投訴後已即時跟投訴人聯絡，並為他提前終止合約，當中並不會收取任何罰款；投訴人亦滿意有關安排。  （一○二一○三六）    服務熱線  電話：29908288  傳真：23702192  電郵： sservice@appledaily.com 
20041213-81,20041213,81,鳳南路重型車噪音滋擾居民,鳳南路重型車噪音滋擾居民 有中港貨櫃車司機為方便往來兩地，將貨櫃車泊於上水鳳南路一帶，以便進出沙頭角邊境。惟貨櫃車停泊時製造的噪音，附近翠麗花園一帶居民投訴遭受噪音滋擾。  鳳南路與天平路交界居屋翠麗花園居民張先生稱，由於該處鄰近邊境沙頭角，有不少重型車及貨櫃車駛經及停留。近期重型車在鳳南路與天平路一帶違例停泊情況，有增多趨勢，每當重型車駛經及停泊時，產生大量噪音，居民備受噪音滋擾，由清晨五時開始，直至次日凌晨二時，聲浪不絕於耳。  「佢哋如果要停低食飯唞吓，泊一陣都冇所謂，但係近期啲貨櫃車泊到開巷，當正係貨櫃車專用區，由朝泊到晚，架車出出入入時嘈到震！」     環保署：噪音未超標   環保署發言人回覆本報稱，曾派員到上址路段評估交通噪音，調查結果發現並無超逾70分貝的規劃標準。而居民所指的噪音滋擾情況，相信是重型貨車違例停泊於上址路段而引致。過往環保署亦有將有關投訴轉介警方及運輸署作跟進。  （一○二七○一七）    服務熱線  電話：29908288  傳真：23702192  電郵： sservice@appledaily.com 
20041213-82,20041213,82,東堤灣畔行人路泊滿單車,東堤灣畔行人路泊滿單車 東涌慶東街私人屋苑東堤灣畔門外，原設有一個單車停泊區，但附近不少沒公德心居民，隨便將單車停泊在單車停泊區外行人路上，阻礙途人來往。離島民政事務處跟進本報轉介居民投訴後回應稱，五個政府部門已設跨部門工作小組，採取聯合行動，清理區內非法停泊單車。  慶東街及附近居民向本報投訴稱，慶東街行人路兩旁泊滿單車，「好多居民為咗方便，隨便喺條行人路邊泊車，搞到成街單車，政府又冇積極取締。」  離島民政事務處回覆本報查詢稱，已在慶東街單車停泊處外行人路，以及區內違例停泊單車黑點加設告示牌，警告居民不可停泊單車佔用政府土地。     五部門將聯合清理   離島民政處稱，各政府部門可根據其適用法例，採取行動清理非法停泊單車，由離島地政處、離島民政事務處、食物環境衞生署、警務處及運輸署等組成的跨部門工作小組，會鎖定區內違例停泊單車黑點，並制訂優先次序，採取聯合行動清理非法停泊單車。  （一二一○○○二）    服務熱線  電話：29908288  傳真：23702192  電郵： sservice@appledaily.com 
20041213-83,20041213,83,逛館不一定要理解藝術品,逛館不一定要理解藝術品 【本報訊】不少港人以為博物館只收藏高深難明的藝術品，巴黎龐比度中心開館的目標之一，是希望不愛逛博物館的人也會進內參觀。在該中心負責保護藝術品工作的CamilleMorineau表示，欣賞藝術作品不一定要理解其背後深意，她建議港人到博物館時，可隨意觀賞合眼緣的藝術品並「愛上它」，慢慢便會培育出興趣，不會覺得逛博物館是一件艱深事。     突出建築作賣點   歐美國家經營有道的博物館經常以突出的建築物作賣點，增加遊客到訪的興趣，同時吸引不願到博物館的人。五九年建成的紐約古根漢博物館、七七年建成的巴黎龐比度中心，以及九七年才建成的西班牙畢爾包古根漢博物館，均是當代的經典建築物。  不過，博物館藏品才是吸引遊客到訪的靈魂。龐比度中心國家現代博物館總監AlfredPacquement表示，博物館每年也要預備一筆資金購買展品，以該中心為例，每年都會花四百三十萬歐元（約港幣四千四百萬元）購買藝術品。  AlfredPacquement指出，香港應在博物館開館前五年開始購買藏品，這筆龐大的資金除由政府資助外，可參考不少國家的模式，制訂稅務優惠鼓勵私人捐贈藝術品。
20041213-84,20041213,84,民進黨倒扁聲四起,民進黨倒扁聲四起 台灣立委選舉順利落幕，但綠營（民進黨、台聯）不僅未能贏得過半議席，民進黨多名資深立委更意外落敗。部份立委嚴詞炮打黨中央，狠批主席陳水扁「一人決策」，導致選戰失利，要他引咎辭去主席；副總統呂秀蓮亦開腔要求改革黨務、改組內閣。一時間，倒扁之聲四起，民進黨、總統府、行政院的人事大地震勢所難免。 「真是莫名其妙的選舉，許多優秀的現任都落選，盡上一些阿貓、阿狗！」「黨主席陳水扁要為這次敗選負責！」民進黨立委選舉受挫，未能實現議席過半目標，沈富雄、段宜康等十多名資深立委更名落孫山，引爆黨內不滿。     議題硬幹令民眾生厭   民進黨籍立委陳景峻指出，在選舉議題上，陳水扁先後提出柔性政變、黨徽和國徽區隔、正名等議題，基本上和一般普羅大眾關切角度不同，反而讓民眾對政黨惡鬥心生厭惡。這是民進黨執政後出現最大的警號，必須深刻探討民眾的真正需求何在。  民進黨大老林濁水批評，選戰中陸續提出教科書、正名等議題，有點拿這些東西硬幹的意味，反而一直做球給對手打，同時也流失了中間選票。  呂秀蓮昨出席公開活動時亦不忘「提點」陳水扁，指綠營今次小輸，陳水扁要面對黨內改造、內閣改組、提升綠營立委問政能力等問題。  面對黨內倒扁聲浪高漲，民進黨立院黨團書記長蔡煌瑯立即「護駕」，強調民進黨其實沒輸，只是成績不如預期，呼籲立委不要借此遷怒陳水扁。 由於民進黨周二將舉行中常會，外界預期陳水扁將在會上依民進黨的慣例為敗選引咎辭去黨主席。但台灣《聯合晚報》昨引述接近陳水扁的人士指出，陳水扁正為他辭職後的人事安排而費煞思量，預料明年二月前，讓所有人事調整「一次到位」。換言之，他可能要明年二月才會辭去主席職務。  選後即向陳水扁請辭的民進黨秘書長張俊雄昨表示，明日的民進黨中常會上，陳水扁將就民進黨的未來走向和尋求朝野合作等發表講話，他及李應元辭職所牽動的中央黨部改組問題，中常會亦會深入討論，改組輪廓將會浮現。  台灣《蘋果日報》/中央社/東森新聞網
20041213-85,20041213,85,台兵請假投票受阻,台兵請假投票受阻 台灣立委選舉傳出軍方阻攔官兵外出投票事件。駐台北陸軍一七六旅，原允許讓士兵前日請假出營投票，臨時卻遭高層阻止，旅長馬醒民事後更被指失職遭處分。     旅長批假遭處分   消息指，馬醒民原計劃讓屬下家在北部的官兵，在前日分兩批休假輪流出營投票，並獲上級同意。但有人向陸軍總司令朱凱告狀，指留守兵力不足。馬醒民疑因受上級責罵，在選舉日前一晚突然宣布取消休假，已離營的軍人也被緊急召回。  「整個事情很弔詭，旅長想讓每個官兵盡量能投票的立場很好，軍人難道不是國民？為何不能投票？如果有政黨或政府想操控選舉，軍隊不就被利用了？」不少軍官均替馬醒民不值，認為事件動機不純。  國防部發言人劉志堅昨日強調事件屬正常安排，與政治、政黨傾向無關。  台灣《蘋果日報》
20041213-86,20041213,86,再加化學品增酸味　主銷安徽浙江致癌霉米製鎮江醋,再加化學品增酸味　主銷安徽浙江 致癌霉米製鎮江醋 江蘇「鎮江醋」以芳香濃郁、酸而不澀，馳名國內外。但中央電視台最近揭發，鎮江的一些醋廠使用致癌發霉大米生產醋，還加入化學劑冰乙酸來提高酸味。有工廠一年賣出一千噸毒酸醋，主要銷往安徽、浙江等地。 中央電視台記者早前在鎮江採訪當地醋廠時，接到多名銷售商投訴，指一些醋廠近日所生產的醋味道苦澀，與正宗優質鎮江醋的醇厚味鮮品質完全不同。記者隨後到當地多家醋廠暗中調查，發現大部份醋廠廠房衞生環境惡劣，工人用未經過任何消毒的舊瓶子來盛載酸醋，還赤腳站在醋池中工作。     用未消毒舊瓶盛載產品   其中一家醋廠的負責人承認，工廠為了節省成本，使用較便宜的大米，而非國家規定的優質糯米來釀醋。負責送米的一名工人更直指，這些做醋的大米，均已發霉變質，不能食用，只可用作工業用途。  更令人震驚的是，一些醋廠為求增加產量，在做醋的過程中，大量加水，醋味變淡後，竟放入只有印染工廠才會使用的化學品冰乙酸，來增加酸味，使得這些醋變得苦澀。  據了解，單單鎮江就有至少六家醋廠，違法使用發霉大米及毒性強烈的冰乙酸來生產酸醋。有醋廠老闆表示，一年能賣出一千多噸醋，除在江蘇省內發售外，大部份銷往安徽、浙江以及江西等地。     真醋搖晃有泡　酸而不澀   國家質檢總局監督司司長紀正昆指出，變質發霉的大米中含有致癌物質黃曲霉素，長期食用對人體會造成嚴重損害，而工業用的冰乙酸則含有大量重金屬雜質，絕對不能食用。  紀正昆表示，要選擇正宗的「鎮江醋」，除可注意樽外的商標及包裝外，還可憑外觀及口感來判斷。一般香醋醋液清亮，用力搖時，會有泡沫，而口感綿厚，香而微甜，酸而不澀，市民並不難分辨。  中央電視台
20041213-87,20041213,87,萬人送別數學大師陳省身,萬人送別數學大師陳省身 一代國際數學大師陳省身昨日在天津出殯，上萬名南開大學的師生手持紙鶴、橫幅，在寒風中列隊送別，場面感人。  享年九十三歲的陳省身，本月三日晚上因病在天津病逝，數千名南開大學師生當晚自發舉行燭光悼念晚會。學生後來更在圖書館前的廣場上，掛起串串紙鶴，直至陳省身昨日出殯，廣場上隨風揚起的紙鶴估計有二萬隻。     南開師生冒寒送靈車   昨日早上，成千上萬南開大學師生冒着接近攝氏零度的低溫，沿着校園大中路兩側佇立，靜待靈車經過。靈車後來經過送行的學生時，有人高舉手上的白色紙鶴，以表哀思。有學生說：「雖然沒有聽過陳先生的課，但他的精神和魅力一直感染着我。今天，先生就要走了，我們來和大師作最後的告別。」  陳省身遺體其後移送天津北倉殯儀館，舉行送別儀式。大廳靈堂氣氛肅穆，大師的遺體被安放在翠柏叢中，灑滿紅掌花。以全國人大副委員長丁石孫、國務委員陳至立為首的黨政官員到場致祭，陳省身遺體在送別儀式後隨即火化。  中新社
20041213-88,20041213,88,丐婦幫湧往河南行乞,丐婦幫湧往河南行乞 甘肅一批農婦近日湧往河南鄭州，甚至遠至遼寧瀋陽等大城市行乞，令市民不勝困擾。她們多帶着小童一起乞討，手背上有傳統少數民族的刺青花紋，被稱為「丐婦幫」。     稱來自甘肅岷縣   自上周開始，鄭州市便常有十多名帶有濃厚西北口音、帶着小童的中年婦女，在街上行乞。被問及身世時，這群「丐婦」都會說來自「甘肅岷縣」，因家鄉遭受冰雹災害，被迫來到大城市乞食，每天最多可討一二十元。  她們還表示，留在鄭州行乞，每月要交二百元住宿費，卻不肯透露是否有人在背後操縱。  《鄭州晚報》
20041213-89,20041213,89,貴州礦井爆炸困36人,貴州礦井爆炸困36人 內地礦難頻仍，繼山西盂縣南婁鎮上周四發生煤礦氣體爆炸造成三十三人死亡後，貴州思南縣昨亦發生煤礦滲水事故，三十六礦工被困井下，生死未明。這是內地不足一星期內，第二宗嚴重礦難事故。  現場為思南縣許家壩鎮天池煤礦，事發昨午十二時半，當時有八十人在井下工作，四十四人成功逃出，三十六人被困井下。當局指出，天池煤礦是一個鄉鎮有證煤礦，年設計產量三萬噸。貴州省官員趕赴現場，指揮搶救，暫時未知事故起因。  新華社
20041213-90,20041213,90,人工美女選舉,人工美女選舉 整容在內地愈來愈流行，北京更將在本周六舉行首屆人工美女選舉，參選佳麗年齡由十七歲至六十二歲，全部均接受過整容手術，昨日在大會安排下會見傳媒，表現充滿自信。  路透社
20041213-91,20041213,91,服裝商場爆炸2人傷,服裝商場爆炸2人傷 廣州白馬服裝商場前日驚傳爆炸事故，至少造成兩人受傷。前日下午三時十五分，廣州站南路白馬服裝商場北座三樓茶水間門口的垃圾桶突然爆炸，傷及茶水間內兩人，其中一人額頭擦傷，另一人右腿膝部骨折。當局正調查事件。  《新快報》
20041213-92,20041213,92,十億建恐龍遺址公園,十億建恐龍遺址公園 擁有過萬隻恐龍蛋化石的廣東河源市宣布，投資十億元興建面積約半個長洲大小的恐龍遺址公園，除設有恐龍博物館外，還會引進美國製造的機械恐龍模型，設置一史前世界漫遊區，料五年後落成，每年可接待二百萬遊客。  《廣州日報》
20041213-93,20041213,93,三主席為敗選辭職,三主席為敗選辭職 在西方民主社會，政黨領導人因議會選舉失利而請辭，其實相當普通。民進黨自一九八六年創黨至今，先後有三位黨主席許信良、施明德、林義雄，因選舉失敗而引咎辭職（見附表）。 一九九三年底，台灣舉行縣市長選舉，當時的民進黨主席許信良誇下海口，承諾若民進黨無法取得過半數的十一個縣市長席位，便引咎辭職。結果，民進黨「贏了選票，輸了席位」，在選舉中取得百分四十二的選票，但只取得六席。許信良因此辭職。  另一次較矚目的，是一九九八年民進黨在台北、高雄兩市市長、市議員及立委「三合一」選舉失利，時任黨主席林義雄引咎辭職。
