key,date,article_daily_id,title,text
20041110-193,20041110,193,國際視野：美元短線應有支持,國際視野：美元短線應有支持 金融市場經過上周的美國總統大選亢奮後，近兩日已見平靜下來，股滙債金市都呈大牛皮狀態，與其說市場正觀望聯邦公開市場委員會（FOMC）議息結果──絕大部份人認為加息0.25厘屬意料中事，倒不如說投資者極重視會後聲明有何啟示，作為明燈指路？  筆者估計，在剛發表的就業數據出乎意料地理想的影響下，聯儲局諸公不但加息絕不手軟，會後聲明或會出現比回復「中性」更積極的字句，意味12月儲局通常按兵不動之傳統或會打破，即今年內短期聯邦利率或調升至2.25厘應無走雞。     憧憬貿赤收窄   此外投資者不敢輕舉妄動的原因，是美國商務部今日將公布9月份貿易數字，市場預期赤字可能比8月的540億（美元．下同）稍為收窄，估計約在530億左右，假若大幅低於此數，相信美元短期有一定支持。  事實上，若以貿易加權計，美滙從布殊甫上場至今向下調整幅度已不小，「強美元政策」這句口號或曰謊言早已被戳破，根本沒有人會相信美元後市有何彈升能力，只會繼續尋底而已，連股神畢菲特、滙壇狙擊手索羅斯、華爾街舉足輕重的大摩首席經濟師羅奇等名震一時之士也一致看淡，市場情緒又怎會不出現一犬吠影、百犬吠聲之現象？  可是話說回來，這些人除talkingtheirownbooks之外，美元的下跌又為美國帶來甚麼極大好處？根據經濟合作及發展組織（OECD）的估計，美滙要跌（以貿易加權計）22.5%，才能將赤字佔GDP比率減少1個百分點，那麼若要貿赤收窄至GDP的4%之下，美元豈不……？苟如是，則全球經濟嘛……？！  王冠一
20041110-194,20041110,194,樂悠居配貨先吸納大手客源,樂悠居配貨先吸納大手客源 【本報訊】新盤市場自上月中荃灣爵悅庭及長沙灣碧海藍天開賣後，市況淡靜。不過，隨着另一焦點盤荃灣樂悠居獲批售樓紙，預料將掀起新一輪熱潮。華人置業（127）表示，該盤先接受大手洽購，每名買家須選購8伙或以上單位，透過代理提交資料，最快本周六落實買賣，市場估計，已有10至20名準買家有意大手購入單位。 華人置業銷售經理柯靄邦表示，樂悠居售樓紙昨批出，首階段只接受大手客源。有意選購買家，須一併購入8伙或以上單位，並將欲選購單位樓層及面積等資料交予代理。  發展商收集有關資料後，將配對貨源，決定出售單位細則，最快周六簽訂買賣文件。     每呎不逾四千   發展商昨午招待約1500名地產代理，前往參觀現址示範單位，本周六正式開放予公眾參觀。  雖然發展商未有公布售價，柯靄邦表示，定價毋須大折讓。  消息則指出，早前揚言平過毗鄰爵悅庭的樂悠居，獲預留單位的呎價3500至4000元，較爵悅庭平均呎價4400元低近10至20%。 炒家部署掃貨   面對樂悠居推售搶客，新鴻基地產（016）的爵悅庭以靜制動，未有反擊動作，相反，系內的油麻地窩打老道8號，消息表示，增設一及二按首2年免息供計劃，吸引投資客入市。  美聯物業董事布少明稱，該行已有5至6個準買家，有意大手購買樂悠居單位作投資。  據知，近期高調入市的炒家，亦蠢蠢欲動，計劃斥資購入大量單位。華置說，暫不設購買上限，但若發現買家過量入市，保留出售權利。  樂悠居全數提供960伙，20%單位為433方呎1房設計，發展商曾表示，單位售價最平130萬元，銀碼細，加上項目明年底入伙前，買家可選擇只付樓價10至15%作首期，入市成本較低，遂吸引投資客注意。市場現時已收約500票。  中原地產執行董事陳永傑指出，近期欠中細價全新項目推出，樂悠居料吸引一批上車客。
20041110-195,20041110,195,泓都80伙獲洽購　涉6.5億,泓都80伙獲洽購　涉6.5億 【本報訊】新世界發展（017）與市建局的西環新盤泓都，售樓紙仍待批出，但市場已接獲準買家有意大手洽購10層共80個單位，涉資6.5億元，交易有待落實。  何伍燕榆指出，早前西灣河嘉亨灣及荃灣爵悅庭開售，市場消耗了一批購買力，目前市況轉靜，樓市再進入另一調整期不足為奇。至於旗下元朗流浮山及屯門虎地項目，計劃本月內申請售樓紙。     黎汝遠4000萬買港灣   同系的何文田君頤峰，餘下1200至1300方呎單位，增設送25萬元家具裝修套餐優惠。項目尚餘不足100伙，75%為1200至1300方呎3房單位，呎價7900至8000元。  另外，資深投資者黎汝遠，昨斥資4000萬元大手掃入大角嘴港灣豪庭20伙。  美聯物業陳坤興表示，該批單位分布第8座，E及H室各佔10伙，單位一律499方呎，呎價4008元。
20041110-196,20041110,196,網通超額30倍凍結280億,網通超額30倍凍結280億 【本報訊】中國網通（906）公開發售部份昨日截止認購，市場消息透露，超額逾30倍，將以接近上限價8.91元定價。以公開發售股份約1.046億股計算，凍結資金逾280億元，預計在今日凌晨定價。  網通國際配售部份超額逾10倍，由於公開發售部份超額逾30倍，保薦人將按比例調高公開發售股數，由佔總發行股數一成上調至三成。  受網通招股反應理想消息刺激，連帶中電信（728）股價昨日亦一度上升4.81%，收市報2.7元，升3.85%。  有證券業人士指出，網通可望接近上限8.91元定價，本地散戶認購網通的反應不算熱烈，但有內地投資者透過本地證券行入票，加上本地大孖沙表態認購其股份，如長和系認購1億美元，李兆基認購數億美元及鄭裕彤等亦有認購，令網通迅即大熱。     可望接近上限定價   散戶方面，認購反應只屬一般，位於油麻地的中國銀行分行在截止認購前15分鐘，亦只有兩名散戶前來入表，其中吳小姐表示，由於網通股東之一為江澤民之子，而且現時銀行息率甚低，加上近期股市表現良好，經濟又復甦，因此決定購入些少作短期投資，打算揸兩個月左右。她之前亦有認購新股。
20041110-197,20041110,197,東亞放售商廈　市值20億,東亞放售商廈　市值20億 【本報訊】近期寫字樓和舖市承接力強，東亞銀行（023）趁勢委託仲量聯行，短期內出售一籃子物業，估計市值約20億元，包括業權統一的乙級商廈、分層寫字樓和舖位等近10項物業。     一籃子約10項物業   仲量聯行證實，剛獲東亞銀行委託為代理，出售一批市值約20億元物業，包括多達約10個項目，部份是業權統一的商廈，但現階段仍未落實詳細出售計劃及時間表。  市場消息表示，東亞擬售的一籃子物業，最貴重是灣仔軒尼詩道東亞銀行灣仔大廈，全幢近10萬方呎，市值數億元，另外業權統一的包括旺角彌敦道旺角東亞銀行大廈、旺角亞皆老街數層高寫字樓連舖及西環全幢寫字樓等。分層寫字樓則包括告士打道東亞銀行港灣中心其中10層連一批車位，及銅鑼灣麥當勞大廈兩層寫字樓等。  近期全幢寫字樓交投活躍，市傳大鴻輝興以逾3億入標競投暗盤標售的上環嘉華銀行中心全幢，約7.3萬方呎，每呎逾4000元。  另外，工銀亞洲暗盤標售的中環皇后大道中122至126號全幢寫字樓，獲準買家出價逾2億元洽購。
20041110-198,20041110,198,貝沙灣摸上摸個案最多,貝沙灣摸上摸個案最多 【本報訊】樓價近一年來大幅飆升，樓花新盤成為投資者短炒圖利對象，以確認人身份轉讓的成交（俗稱「摸貨」）趨增，個別單位更有超過一次「摸售」（俗稱「摸上摸」），過去3個月來至少5個新盤出現「摸上摸」成交（見表），當中以薄扶林貝沙灣最當炒，「摸上摸」個案為各新盤中最多，累積升幅也最大。     14個月升值達65%   近3個月來市場最少5個新盤出現「摸上摸」個案，當中以貝沙灣最受炒家歡迎，單是10月份錄得73宗「摸貨」成交，當中3成更屬「摸上摸」個案。  最新一宗為二期1座中層C室，1402方呎，最後以1120萬元摸出，該單位一手業主於去年9月以680萬元向發展商購入，於今年3月以900萬元摸出，14個月內兩度易手，累積升幅達65%。 嘉亨80宗摸貨成交   中原黃國明表示，貝沙灣二期預計06年1月入伙，未來一年樓市持續上升，「摸上摸」個案有增無減。  西灣河嘉亨灣開售僅3個月，至今已錄得近80宗「摸貨」成交，「摸上摸」個案暫時只有2宗，包括昨日錄得的2座中層H室，中原唐詠勤表示，該單位於今年8月由投資者以309萬元一手購入，翌日即以333萬元摸出，至昨日再以355萬元「摸上摸」，短短3個月累積升幅達15%，兩名業主分別賺24萬及22萬元。
20041110-199,20041110,199,星光行近2萬呎標售,星光行近2萬呎標售 【本報訊】九龍區寫字樓頻錄得全層大手成交，刺激業主善價沽售物業，其中美資公司正標售尖沙嘴星光行近2萬方呎樓面，12月20日截標。  中原地產九龍商業部營業經理李婉琪說，航天科技（031）標售的尖沙嘴康宏廣場21樓全層，約2.94萬方呎，截標前已獲投資者以1.8億元購入，每方呎6122元。  她表示，尖沙嘴大面積寫字樓放盤不多，故康宏廣場21樓放盤不久便獲市場承接。一家美資公司趁勢標售3個星光行寫字樓，約1.97萬方呎，分布於9、10和12樓，計劃售後租回，預計租金回報約5厘。  據她了解，星光行近期易手單位，海景每呎約4000元，非海景約2000元，兩者呎租分別約18至19元和10至13元，正標售的單位部份有海景。
20041110-200,20041110,200,甲級商廈租金料回升,甲級商廈租金料回升 【本報訊】上月甲級寫字樓交投暢旺，全層成交多達17宗，但成交價升幅放緩，業界預期租金回報率可重返3.5厘的合理水平。  美聯物業工商舖行政總裁黃子華表示，由於經濟持續好轉，甲級商廈需求急升，據政府統計，近年外資來港設辦事處有上升趨勢，03至04年更增加超過400間，另外，將實施的內地民企自由行，吸引不少內地企業來港設辦事處，上月杭州茶葉公司便購入金鐘力寶中心約2000方呎寫字樓，料未來需求進一步上升。  本地企業方面，黃子華說，最近錄得不少公司因應擴充，需增加租用寫字樓約30%，其中一會計公司上月於中環中心增加租用逾60%樓面。他預計年底前寫字樓售價及租金分別升10%和15%。  另外，據利嘉閣統計，10月全港有266宗商廈買賣登記，創金融風暴後單月新高，涉資28.16億元，其中中區商廈因有全幢及全層成交登記，另總值較9月勁升11.69倍。
20041110-201,20041110,201,又一居交投增逾五成,又一居交投增逾五成 【本報訊】中原地產研究部分析，今年已有多個豪宅屋苑成交量超過去年全年總數，其中升幅逾五成的又一村又一居，以118宗居首。  中原城市領先指數內成份豪宅屋苑中，又一居今年暫錄得118宗，較去年全年多53%。升幅居次位的是大潭陽明山莊，暫有65宗成交，較去年全年升44%。其他成交超越去年的屋苑包括中半山帝景園及地利根德閣、灣仔會景閣及西半山雍景臺等。  該行指出，今年樓市雖由豪宅帶動，成交暢旺，成份豪宅屋苑的交投普遍也超越去年，但對比97及98年，仍有一大段距離，相信是買家及投資者近年較集中買賣豪宅新盤，如薄扶林貝沙灣、何文田君頤峰及西灣河嘉亨灣等，令傳統豪宅市況平淡。
20041110-202,20041110,202,蘭西情報課：濠江舖價過萬蚊一呎,蘭西情報課：濠江舖價過萬蚊一呎 澳門概念股炒風未停，當地樓市一樣熾熱，好似舖位咁，旺區放盤叫價過萬蚊一呎，拍得住本港市區二線街舖。  高士德大馬路十五A舖，現由Nokia租用，地下近千四呎，閣樓四百三呎，連租約放售，叫價二千八萬，呎價逾萬五。同街由帝邦金舖以每月兩萬九租用嘅舖位，九百呎，索價逾千萬，每呎近萬二。𠵱家北角英皇道街舖，呎價係萬五蚊。  喺澳門開咗兩間分行嘅美記，計劃再開，最近開始喺本港報章賣吓澳門樓盤廣告，當中亦都有啲平貨，花王堂街，二千呎，叫兩百四萬，每呎都係千二蚊；南灣大馬路一個萬一呎舖，就索價一千萬，呎價九百，夠吸引。  澳門樓市有可為，中原都計劃月內喺澳門開四間分行，睇中記網頁專欄講，澳門報紙都有報道呢單消息。     利記加薪12%   渣打突然炒魷，全城矚目，不過，都有唔少公司請人與加薪，咁打工仔前景都冇咁悲。利記執董廖偉強話，有見於樓市好景，公司頭十個月業績比預期理想，所以決定，提高所有前線員工底薪，最多加六百。  前線員工凡做滿一年，按年資與表現釐定加幅。代理底薪一般只係五千，若果加足六百，幅度係一成二。至於經理，底薪八千，加幅近八巴仙，都算唔錯。利記現有九百前線員工。  同時，美記執董陳坤興話，公司機制係按月、季或年度，視乎前線員工表現，若果達標又有主管推薦，就有人工加。  代理行前線員工有人工加，唔知後勤幾時至有？ 英京新盤來港發售   倫敦樓市熱潮維持咗幾年，但好少來港推售，高力國際下周在港推出全新住宅OntarioTower，售價二百八十七萬起。  睇番啲資料，個盤位近金絲雀碼頭，高二十九層，提供開放式至兩睡房設計，三百五十至九百六十呎，計落呎價都要八千零蚊，貴唔貴就睇你點睇。  不過高力話，物業位於倫敦商業中心區，交通方便，出租潛力高。由於未來供應有限，估計倫敦市中心區住宅樓價，每年可升六巴仙至一成。     二線舖位租金照起   自由行客嚟香港，目的主要係買嘢，零售業最受惠。自由行客必定幫襯嘅地區，好似旺角、尖沙嘴及銅鑼灣等，舖位已經炒到飛起，租金升到你唔信。  原來其他地區，啲業主一樣諗緊打租客主意，同租客傾加租。  蘭西聽聞，有啲連自由行客都未必會去嘅地區，業主一樣照加租，幅度係兩位數。  呢類舖位，有啲月租都係幾千蚊，實際只係加幾百蚊，但對租客嚟講，係咪好多，真係見仁見智。     赫蘭道難得有屋賣   淺水灣赫蘭道可以話係南區最少買賣嘅豪宅地段，過去十年，只得九六年一單，罕有度直迫石澳道大屋。  第一太平戴維斯啱啱受業主委託，標售赫蘭道五號全幢六個單位。物業佔地二萬一呎，有四個複式及兩個分層，樓面萬七呎，以每呎兩萬元計，市值三億半。下月八號截標。物業二○○○年頭曾以逾億一內部轉讓。  赫蘭道只有十多個物業，幾乎全部業主都係名人，一號業主係「電器大王」信興蒙民偉、三號屋主係保險界名人鷹星董事總經理施瀚霖、九號大業主係友邦、十一及十四號，則分別由恒基同中電嘉道理家族持有。  電郵地址： nancy@appledaily.com 
20041110-203,20041110,203,樓市動向,樓市動向 香港　太古城有客上車   ▲世紀21康靜說，上車客以346萬元，購入鰂魚涌太古城恒天閣低層F，684方呎，每呎5058元。部份業主見買家入市意欲下降，叫價放軟，但剛成交單位，造價仍屬偏高。     寶馬山獲利38萬   ▲利嘉閣莊桂玲說，北角半山寶馬山花園（圖）9座低層A，1070方呎，成交價698萬元，每呎6523元。業主5月以660萬元購入，賺38萬元。  ▲港置林樹權說，西半山雍景臺1座高層E，1353方呎，成交價1120萬元，每呎8278元。業主蝕130萬元。  ▲美聯謝藝說，北角半山萬德閣A座中高層1室，1473方呎，以700萬元成交，每呎4752元。業主9月以550萬元購入，兩月獲利150萬元。     九龍　外籍商人漾日接貨   ▲港置倪永佳說，外籍商人斥645萬元，購入尖沙嘴漾日居3座高層D，1168方呎，每呎5522元。業主00年以643萬元購入作投資。  ▲美聯陳松林說，紅磡海逸豪園本月只9宗成交，較上月同期少五成半，成交以兩房單位為主。18座高層G，由投資者以397萬元購入，798方呎，每呎4975元。 帝庭園回報3.3厘   ▲中原吳偉強說，投資者以810萬元，買入何文田帝庭園7座中層B，1496方呎，每呎5414元。回報3.3厘。  ▲利嘉閣封重勳說，大角嘴維港灣本月只3宗成交。5座低層G，609方呎，成交價282萬元，每呎4631元。     新界　碧堤一季升值一成   ▲港置楊文榮說，深井碧堤半島6座中層D，1010方呎，成交價370萬元，每呎3663元。業主8月以335萬元購入，獲利35萬元，10.45%。  ▲利嘉閣徐子豪說，上車客以175萬元，買入沙田好運中心榆林閣高層C，567方呎，每呎3086元。     加州花園漲價5.6%   ▲中原龍智烽說，元朗加州花園呎價較上月升5.6%，至3153元，加州豪園升1.2%至3418元。投資者斥918萬元，購入加州豪園A期雙號屋，2471方呎，每呎3715元。  ▲美聯梁仲維說，荃灣愉景新城10座高層D，723方呎，成交價260萬元，每呎3596元。     炒家掃屯門市廣場   ▲祥益張才權說，屯門市廣場2座低層G，448方呎，成交價67萬元，每呎1496元。7座低層E，587方呎，成交價96萬元，呎價1635元。兩單位均由炒家入貨。
20041110-204,20041110,204,迎濤灣　30萬裝身‧望吐露港,迎濤灣　30萬裝身‧望吐露港 馬鞍山樓齡較新物業，大多遠離市中心，惟迎濤灣得享鄰近中心區、兼擁全海景優勢。  物業享臨海地利，約十至十五分鐘行程，即抵馬鞍山廣場等購物商場。該處還有巴士、小巴，以及即將通車的馬鞍山鐵路車站，不失方便就腳。  介紹的2座低層H室，屬於973方呎三房大碼，廳房皆享海景，環境清幽，非市中心煩雜氣氛可比。  裝修落足本錢，費用逾30萬元，更換廚廁用料設備及全屋窗台，配搭厚重深沉的巨碼家具，品味自成一格。 尚有貨尾   世紀21廖振雄說，迎濤灣尚有貨尾，二手放售不多，約15個，大部份有海景，呎價3700至4500元，望樓則低至3000元。這個海景大碼，既附靚裝，又連市值30餘萬元的車位出售，呎價僅3392元，堪稱筍盤。9月底1座高層H，973方呎，以388萬元易手，每呎3988元。至於貨尾，多為高層海景戶，每呎定價逾4000元。  記者?攝影：伍志輝
20041110-205,20041110,205,赫斯基派息和黃進帳逾6億,赫斯基派息和黃進帳逾6億 【本報訊】和記黃埔（013）旗下加拿大赫斯基能源昨日宣布，派發第三季度中期息，每股0.12加元，特別息每股0.54加元。赫斯基能源由李嘉誠家族私人持有36%，另外透過和黃持有35%權益，以派息合共0.66加元（約4.3港元）計算，李嘉誠及和黃可各得約6.56億元及約6.37億元股息，預期明年1月1日派發。     李嘉誠收六億半   赫斯基分別在今年2月、4月及7月合共派發了每股股息1加元，估計李嘉誠及和黃各得約9.94億元及約9.65億元股息。和黃昨日收報60.25元，跌0.82%。當地Peters&Co.能源股分析員WilfGobert指出，基於和黃及李嘉誠持股量逾70%的考慮，相信赫斯基較傾向派發股息，避免進行回購令大股東持股量進一步上升。  另外，外電引述大連港集團副董事長朱寶學於大連表示，和黃正就入股當地的礦石碼頭，與該集團進行最後磋商。  至於和黃旗下和電國際（2332）昨宣布，全球發售的穩定價格行動已於11月5日結束，期間全球協調人高盛，曾以每股5.45至5.85元購入4728萬股，另以每份10.57至11.35美元購入839.8萬股美國存託股份，相等於約1.26億股。鑑於高盛已於市場購入逾1.73股，補足國際配售超額分配部份，因此超額配股權並無行使，並將於本月15日失效。
20041110-206,20041110,206,世銀降港GDP　明年4.6%,世銀降港GDP　明年4.6% 【本報訊】世界銀行昨日發表東亞區經濟報告指出，受高油價及美國財赤高企影響，展望明年區內經濟增長轉趨不穩。世銀將東亞區增長預測，由今年的7.1%，下調至05年度的5.9%；並同時把中港的經濟預測，分別由9.2%及7.4%，調低至7.8%及4.6%。 世銀東亞及太平洋區首席經濟師HomiKharas在報告中表示，受惠於蓬勃的出口、區內貿易及固定投資回報理想，今年是東亞區強勁增長的一年，但最新數據顯示，區內的周期性復甦可能已見頂，經濟活動正放緩，而高油價將削弱明年區內經濟增長0.5至1個百分點。中國正進行的經濟宏調，除控制借貸及投資過熱外，同時亦會壓抑對亞洲出口商品的需求。     料人民幣暫難升值   對於市場揣測人民幣升值，他認為中國不會在短期內進行，因為以整體數字計算，中國貿易順差總額只屬溫和，讓人民幣升值，並非降低環球貿易不平衡的最佳途徑。1年期人民幣不交收遠期合約折讓價，昨日輕微收窄至3500點子。  浸會大學財務及決策系助理教授麥萃才認為，世銀報告只是初步預測數據，有可能會在明年度再因應市況改動。有關預測是根據當前經濟狀況所作的合理推算，今年度香港經濟增長理想，由於基數不像去年般低，故相比之下明年度本港經濟增長略低，亦屬正常現象。另外布殊連任，反恐政策及伊拉克戰事，必然會令油價面對上升壓力；加上冬季在望，未來3至6個月的原油需求將會增加。 油價上升壓力仍在   他指出，亞洲地區大多是石油輸入國，油價飆升會產生負面影響。為應付軍備開支，美國外債高築，美元滙價將繼續轉弱，意味區內貨幣變相升值，此舉對倚賴出口美國的區內經濟實體不利。  在日內瓦瑞士國民銀行國際銀行及金融研究中心演講的金管局總裁任志剛指出，中國當局可以在適當時候試行較靈活的滙率制度，他們亦表明有此意向，但面對持續進行的宏觀調控，「目前並不是進行這個實驗的好時機」。
20041110-207,20041110,207,諾貝爾經濟獎得主倡增徵高收入者稅,諾貝爾經濟獎得主 倡增徵高收入者稅 【本報訊】分別於1996及2001年獲諾貝爾經濟學獎的莫理斯及斯彭思，昨日來港出席講座。對於港府提出開徵銷售稅，莫理斯持審慎態度，他指出，銷售稅是累退稅制，可擴闊稅基，由於美國收入稅率較高，開徵銷售稅有助減低收入稅；但香港收入稅率相對較低，此舉反增加低收入人士負擔。     建議港府注意生活質素   莫理斯認為，相對於其他地區，香港收入稅仍有進一步上調空間，特區政府可向高收入人士徵收更高稅款，加強社會福利制度；又建議改變薪俸稅徵收方法，由現時由僱員申報，改為僱主申報，以減低行政費用開支。  被問到特區政府應如何推動本港經濟，斯彭思表示，政府在推動經濟時，會引發空氣及環境污染等問題，需動用龐大資金解決，屆時本地生產總值（GDP）雖有增加，但市民沒有實際受惠，所以政府不應只着重經濟發展，亦應注意生活質素。  另外，他指出中國對放寬人民幣自由浮動，仍持審慎態度，估計人民幣滙率將保持平穩。又稱中國加息是好事，但相對於英倫銀行調整息率影響屬全球性，中國加息影響輕微。
20041110-208,20041110,208,港基推優惠拓財富管理,港基推優惠拓財富管理 【本報訊】港基銀行（636）催谷財富管理業務，推出存款及投資優惠。即日起至12月底止，凡認購港基指定的投資產品或基金達10萬元（或等值外幣），並以全新資金開立兩個月定期存款戶口，即可享年息加1.5厘的優惠。現時，港基有息支票戶口息率介乎0.125至0.4厘。  港基零售銀行及消費信貸部門主管李儀章表示，有關優惠雖增加存款利息支出，但希望藉此增加交叉銷售比率，由約每客戶1.5個產品，增至超過2個，加強財富管理業務。  此外，即日起至今年底，透過港基認購指定基金，客戶除可享認購費減半至2.5%外，每認購10萬元（以個別基金計算）即可獲100元百佳現金券1張。  另方面，恒生銀行（011）昨推出3隻香港地產股票基金，包括100%保本基金，年期4.75年，共派息8.5厘；及兩隻3.75年期的100%和90%保本基金。12月3日截止認購。     永亨大新稅貸減息   此外，永亨信用將實際年利率降至2.49厘（貸款100萬元或以上），貸款40萬或以上可低於3厘；大新/豐明銀行則將最低年息降至2.76厘（貸款40萬至50萬元）。
