key,date,article_daily_id,title,text
20040306-49,20040306,49,情困婦人求死獲救,情困婦人求死獲救 【本報訊】土瓜灣九龍城道同興花園一個單位，姓鄧婦人疑與丈夫感情出現問題，昨凌晨三時許，爬上窗門企圖跳樓，其夫及時阻止，她情緒激動被送院（圖）。  王偉禎攝
20040306-50,20040306,50,男子疑被尋仇圍毆,男子疑被尋仇圍毆 【本報訊】昨凌晨零時左右，姓鍾（三十九歲）男子在元朗塘坊村突被七、八名青年圍毆。警方後拘捕三名青年（圖），據稱傷者曾與女鄰居爭執，他認出其中兩名逞兇者是該鄰居的兒子，懷疑有人代母出頭。  陳偉良攝
20040306-51,20040306,51,瞞過打金師傅　金行損失千元姊妹花行騙鍍金換真金,瞞過打金師傅　金行損失千元 姊妹花行騙鍍金換真金 【本報訊】葵涌一家珠寶金行日前遇到假金黨，一對疑是姊妹花的女子取來金珠鏈變賣，再補二百元購買另一條新金鏈，兩人扮作趕時間，催促成交，打金師傅僅憑手感便收貨，待客人離開他用火熔金，始發現是鍍金貨，於是報警，金行損失千多元，警方人員昨午到有關金行調查，有十年經驗的打金師傅承認老貓燒鬚。	記者：黃偉民 現場在葵涌廣場一間珠寶金行，由東主及兩名職員看舖。本月三日有兩名相貌相似、三十多歲的姊妹花上門，拿出一條重三錢四九的金鏈變賣熔掉，該金珠鏈由三十七粒金珠組成，一名有十年經驗的打金師傅將金珠鏈秤完便用手感覺。  其中一女子走出門外扮看金飾，其後催促店內姊妹說要趕時間，需要快些，打金師傅憑自信沒再進一步檢驗，相信金珠鏈是真貨。  女顧客表示想買一條新金鏈，最後她挑選一條重二錢八二的金鏈，職員要求補二百元，女顧客迅速付款便取走新金鏈離開。     不排除疑犯曾行騙   未幾，打金師傅用烈火將部份金珠燒熔，始發現色澤變黑，才知是鍍金的金珠，與東主商議後翌日報警，及至昨午四時葵涌警署刑事偵緝探員親到有關的金行調查，被騙走的新金鏈值千多元。  警方撿走閉路電視的錄影帶，又將金珠鏈取走調查。不排除兩名女疑犯曾到多間小型金行企圖行騙，刻正展開偵查。  金行東主稱，這是其店舖首度遇上假金黨，過往多是歹徒偷龍轉鳳或移形換影手法偷竊金鏈。打金師傅承認老貓燒鬚。
20040306-52,20040306,52,四男女開房索「K」,四男女開房索「K」 【本報訊】昨晨四時許，兩名年僅十六、七歲少女，夥同兩名男伴（十八及十九歲）往旺角山東街賓館開房，並疑在房中集體吸毒。警方接報有人打架到場調查，當場緝獲近二十二克俗稱「K」仔的氯胺酮毒品，市值約二千六百元，四名男女涉嫌藏毒被捕（圖）。  黎志偉攝
20040306-53,20040306,53,工人電鋸自傷左膝,工人電鋸自傷左膝 【本報訊】中環皇后大道中「中環中心」一個通宵進行裝修工程的單位，昨清晨五時許發生意外。一名工人利用電鋸工作時，左膝頭不慎被電鋸鋸傷，其他工人立即報警將傷者送院治療（圖）。  李家傑攝
20040306-54,20040306,54,反斗鱷再現曬太陽,反斗鱷再現曬太陽 【本報訊】元朗反斗鱷昨午十二時又再出現（圖）在甩洲的泥灘曬太陽，即使有運沙船駛經附近水域，鱷魚也動也不動，至下午四時許，才潛回水中，失去影蹤。  陳天華攝
20040306-55,20040306,55,總理報告有必要可增刪,總理報告有必要可增刪 政府工作報告是總理向全國人民交出的「成績表」，歷屆總理對此都非常重視，要幾個月才能撰寫好。因此，溫家寶不將香港的愛國爭論寫入報告，一方面因為中央沒定論，另方面也跟報告早已定稿有關。     港問題微不足道   溫家寶的政府工作報告早在去年底已由總理辦公室的官員，聯同國務院研究機構的專家撰寫了初稿，溫家寶親自修改後，於今年一月十八日在國務院第三次全體會議上，討論工作報告的草稿。修改後，溫家寶從一月底開始又親自主持了四次座談會，聽取各界代表的意見，至二月中旬已基本定稿。當時香港的愛國爭論才剛開始，溫家寶不可能預先知道這場爭論會變成左派的「表態騷」。  況且，在偌大的中國，香港問題只是微不足道，總理要處理的問題千頭萬緒，成千上萬的下崗工人沒工作，民工被拖欠數以億計的工資……。  在此情況下，溫家寶不可能為了香港的愛國爭論而修改報告內容。過去，報告內容也會在最後關頭作出修改，甚至用紙條封住刪改部份，但這些大多關乎中央的路線之爭，或是中共中央對某個問題有了新共識。香港內部的爭論，還沒必要用上這種非常手段。  本報記者
20040306-56,20040306,56,貨車撞壆藥油散地,貨車撞壆藥油散地 【本報訊】一輛運載藥油的客貨車，昨午二時許沿西九龍走廊天橋南行途中，駛至近塘尾道附近時突然失控，客貨車高速鏟上石壆，繼而向左翻側左邊車身貼着路面滑行二十米才告停下，車上藥油散滿地上，二十一歲跟車工人右膝重傷（圖），事後與輕傷司機一同送院。  張培生攝
20040306-57,20040306,57,巴士跌木板司機傷,巴士跌木板司機傷 【本報訊】昨午十二時許，五十一歲姓陳雙層巴士司機（圖）在旺角亞皆老街煞停巴士，疑因衝力大致駕駛座右上方一塊一呎長木板鬆脫跌下，擊中司機右額，由巴士公司代為報警送院。  潘志能攝
20040306-58,20040306,58,基金送暖惠澤逾2800人,基金送暖惠澤逾2800人 蘋果日報慈善基金去年十一月展開「送暖行動」，資助多間非牟利社會服務機構購買棉被、毛氈、棉褸、頸巾和冷帽等禦寒物資，送贈獨居弱老、單親及低收入家庭、殘疾人士、籠屋戶、露宿者等，合共逾二千八百人受惠，讓他們度過充滿暖意的冬日。 個案一   「以前天冷都只係加件衫喺面就瞓覺，呢個冬天咁凍，如果唔係得善長送啲棉被嚟，我哋幾仔乸真係唔知點算……」三十一歲的單親媽媽阿梅歎道。  夫離家不知所終  阿梅育有兩子一女，現年分別一歲、三歲及八歲，其夫任職運輸工人，乃家庭經濟支柱。惟其夫早前離家不知所終，遺下四母子孤苦無依，現靠綜援金度日，須節衣縮食，無力添購寒衣。  阿梅母子日前獲「送暖行動」安排送贈棉被及棉褸等禦寒衣物，得以安度嚴冬，暖在心頭。  「遲吓暖番啲，我會將啲棉褸同棉被收好，等出年再用，呢啲棉被起碼夠我哋用幾年。」她連聲感激地說。     個案二   「我淨係得一件衞衣、兩件毛衫，同埋𠵱家着緊呢件厚褸，自己有哮喘病，好怕凍，成日都覺得唔夠暖。」七十多歲的洪叔告訴記者。  露宿者洪叔無親無故，一向在深水埗鴨寮街賣二手雜貨，收入不穩。為節省開支，他三年前開始在天橋底露宿，每月依靠一千多元綜援金維生。每逢天冷，他便蜷縮在帆布床上，靠一些隨身衣物及殘舊棉被保暖，境況堪憐。洪叔日前獲義工探訪及轉贈一張又厚又軟新棉被，令其感受人間溫暖。  蘋果基金早前從「送暖行動」專戶撥款四萬七千一百三十元，資助香港社區組織協會購買八百五十張棉被及三百件棉衣，分贈新來港家庭、露宿者、長者及籠屋居民。 「以後唔使驚冷親」   該活動的負責人之一施姑娘說：「佢哋收到善長送嘅棉被，個個都好開心，以後唔使驚冷親。」她表示，不少低收入及綜援人士，無力花費數百元購置禦寒物資，透過是次「送暖行動」，便能直接幫助弱勢社群抵抗嚴寒。  「送暖行動」專戶捐款編號：C0670    暖流熱線  電話:29908688  傳真:23702192  電郵: adfund@appledaily.com   網址：  http://www.charity.atnext.com  
20040306-59,20040306,59,體弱老伯盼有一部洗衣機,體弱老伯盼有一部洗衣機 記者探訪姜伯當天，他剛從醫院回來。「兩隻腳嘅關節痛得好厲害，啱啱至睇完醫生，攞咗啲止痛藥。」臉色蒼白的姜伯歎道。  七十歲的姜伯，一生充滿傳奇，原籍上海的他，在內地大學畢業，當過醫生，八十年代初獲發單程證來港定居，在香港開設了一間貿易公司；可惜好景不常，他因為一宗中、港、台生意糾紛，最終於一九八七年被逮捕入獄，度過了十五年鐵窗生涯。  回望往事，姜伯欷歔不已。「好似發咗一場夢咁，所有財產被充公，出番嚟之後，乜都冇晒。」姜伯前年出獄後返回香港居住，自此靠綜援金維持生計，妻兒則留在內地生活。  由於經濟拮据，姜伯目前棲身舊區唐樓板間房，許多家具也欠奉，他現時最急需一部洗衣機。     飽受貧病交煎   「近年身體好差，除咗風濕關節痛之外，重有肺病，早幾個月至因為肺炎住咗一輪醫院，所以晚晚彎低腰用手洗衫嗰陣，覺得好辛苦。」  姜伯慨歎，綜援金每月僅有二千二百餘元，連基本開支也難以應付，委實無力自掏腰包購買昂貴的家庭電器。你願意捐助姜伯解困嗎？  捐款編號：C1303    暖流熱線  電話:29908688  傳真:23702192  電郵: adfund@appledaily.com   網址：  http://www.charity.atnext.com  
20040306-60,20040306,60,傷青會急徵賣旗義工,傷青會急徵賣旗義工 大部份中學於本月陸續舉行考試，令不少依靠中學生為義工生力軍的社會服務機構，出現義工短缺問題。將於本月二十日（星期六）舉行賣旗籌款的香港傷殘青年協會，誠邀熱心善長慷慨買旗之餘，身體力行參與賣旗工作。  傷青會成立於1970年，是一所由傷殘人士組織及管理的慈善機構。服務範圍包括：社交及康樂中心、家居暫顧服務、就業服務中心、電腦工作坊、花藝舍等，致力協助傷殘人士重拾自信、提升就業機會。  由於該會每年自負盈虧服務項目經費有一半來自公眾捐款，而該會已獲社會福利署通知，明年將不獲賣旗機會，故今次賣旗籌款數目，將直接影響該會來年的服務計劃。  傷青會盼各界人士踴躍登記成為賣旗義工，市民查詢詳情或報名，請致電該會聯絡，電話：23379311。    暖流熱線  電話:29908688  傳真:23702192  電郵: adfund@appledaily.com   網址：  http://www.charity.atnext.com  
20040306-61,20040306,61,蘋論：敢說真話才能保護一國兩制 - 盧峯,蘋論：敢說真話才能保護一國兩制 - 盧峯 只要聽聽幾位立法會議員在美國國會聽證會上的說話，就可以清楚知道那些批評他們引入外國勢力干預香港、那些批評他們是「吳三桂」、是「漢奸」的人是多麼無聊、多麼可笑。  李柱銘先生及另外兩位議員在昨天的聽證會上不過是對關注香港事務的美國議員、學者及傳媒重申港人對民主的期望、重申港人對民主的訴求。他們既沒有要求美國政府或國會做些甚麼，更沒有要求人家通過甚麼法案推動香港民意進程。可以說，他們只是在如實反映香港的現況、如實反映市民的想法而已。難道說實話、講真相的就是「漢奸」嗎？  事實上，不管是中國或是香港，都是國際社會的一分子，都需要盡量爭取國際社會的了解、都需要盡量減少外間的誤會或誤解，而要促進了解、減少誤會，最有效的方法、最直接的方法自然是面對面的交流、面對面的溝通。這一次立法會議員李柱銘先生等到美國出席聽證會，發揮的正是這樣的橋樑作用及溝通作用。難道促進外界了解中國及香港，減少誤會的就是「漢奸」嗎？  更何況由李柱銘先生等幾位在沉重的政治壓力下依然沒有退縮、依然敢於挺身向國際社會說出港人對民主的訴求，而不是像那些親北京人士那樣只懂逢迎及說些「政治正確」的說話。對於國際社會、對於外國政府及傳媒來說，李先生這樣的行為充份說明「一國兩制」運作成功、充份說明香港依然有言論自由的空間、充份說明香港不是一個普通的中國城市，而是一個特別的中國城市。我們認為，李先生等幾位議員今次出席聽證會不單不是在唱衰香港，反而是在唱好香港、唱好「一國兩制」。實在不明白怎麼唱好香港居然會被視為是「賣國」的行為！  我們更認為，真正損害香港、真正損害中國、真正損害一國兩制的絕不是李柱銘先生等幾位議員，而是那些在暗處扣人家帽子、而是那些動輒罵人是「漢奸」的人、而是那些只懂鸚鵡學舌的官員；因為他們不但在收窄港人的言論空間、不但在挑動社會分化，他們更不肯、更不願向中央政府如實反映市民對民主的訴求、反映香港的真實情況，令中央政府跟香港市民之間的隔閡愈來愈深。像這樣的行為才是真的在傷害香港、傷害中國、傷害一國兩制。  （圖）李柱銘先生昨天出席聽證會。
20040306-62,20040306,62,蘋論：舶來張五常 - 何洋,蘋論：舶來張五常 - 何洋 為港人熟識的張五常教授透過深入淺出的文字引領讀者進入經濟學的殿堂。在美國同樣亦有一位著名經濟學家以同一手法將複雜的經濟概念向讀者解釋。他的名字叫蘇敖（T.Sowell），現為美國史丹福大學胡佛研究所的資深研究員。蘇敖的著作很多，單是著書便有10本之上。蘇敖和張五常有一共通點，他們不但同樣高舉自由市場旗幟，而且兩人亦與自由市場的重鎮──芝加哥大學──有不解之緣。  本科畢業後，蘇敖旋即考入1982年諾貝爾經濟學獎得主史德格拉當時任教的哥倫比亞大學攻讀研究院，隨後他跟隨史氏一同轉往芝大經濟系。在芝大，除史氏外，蘇敖亦受教於另一芝大中堅人物──佛利民。談到佛利民的高級價格理論課，蘇敖將他在課堂上的感受比喻為經歷了最嚴謹的軍事訓練。  由於對經濟思想史有濃厚興趣，蘇敖決心在這方面下苦功。在一門由海耶克任教的課內，蘇敖曾提交一篇以重新評估薩伊定律（Say'sLaw）為題的習作，海耶克對該文給予高度評價，故其博士論文亦以同一題材為題，並得史氏和佛利民出任他的論文老師。  蘇敖大力宣揚自由市場的優點和政府干預的遺害，似乎不應與馬克思思想扯上任何關係。事實卻不然，他在哈佛念本科時的學位論文就是以馬克思的經濟學為研究重點。其後，他更在1985年出版一本以馬克思的政治和經濟哲學為內容的專著呢！
20040306-63,20040306,63,還斂集：中國青年要學好英文 - 張五常,還斂集：中國青年要學好英文 - 張五常 美國辦軟件程式生意的公司，這些年紛紛把工作外判。受益的主要是印度。專於這行業的朋友說，中國青年寫軟件程式的本領不比印度差，只因為英語水平遠遜於印度，生意大部分跑到印度去。年多來印度的經濟有急速的增長，除軟件程式外，外資到印度設廠也開始見到規模，雖然以製造業而言，比中國還差很遠。  印度的工資比中國的低廉，而英語水平高很多，只因為體制的改革慢了一步，中國先拔頭籌。是的，印度的政府壟斷比中國更甚，而他們的貪污制度化了，要取個商業牌照為時甚久。只不過二十年前，印度的生活水平高於中國，今天倒轉過來，後者遠勝也。這可見改革得法，可以容易地反敗為勝。  時勢所迫，今天印度的改革也有瞄頭。他們人也多，也聰明，也能刻苦耐勞，工資也低。向前看，印度可能是二十一世紀的中國的主要競爭對手。他們明顯地優於中國的，是英語水平。為什麼會是這樣呢？一個解釋是印度曾經長時期受到英國的管治。另一個可能更重要的解釋，是印度沒有統一的文字。要選一個知識分子共通的文字，他們選中了英語。  不管我們喜不喜歡，英文成為唯一的國際語言，已有半個世紀了。雖然中文愈來愈重要，但世界漸趨大同，今天的青年不能不學好英語。英語表達力強，但不容易學。要學到下筆成文很有點苛求，但要學到說得通、寫得通—足以應酬—是起碼的要求吧。  今天國內青年對中語文字的操縱，明顯地高於香港的。這對學語文有助。另一方面，國內的大學生，為了要考英文公開試（如托福），死記，對英文的字彙知得不少。問題是他們的發音差得離譜，為文不僅錯得厲害（主要是用錯字），而更頭痛的，是寫來不像英語。學語言是要常用的—要生活在語言中。 十年前我和舒巷城有爭議。我認為中國推行的拼音，與英語的字母發音很不同，拼音的基礎對學英語發音可能有大礙。舒兄不同意（我的太太也不同意），但今天聽到國內的青年讀英文，彷彿是拼音讀法，聽不懂。盜版影碟也誤導。這些影碟的中文字幕亂譯一通，不足為奇，奇怪的是英文字幕的英語，竟然與演員口中說的往往是兩回事。你有你講，我有我寫—你說奇不奇？英譯中的書籍也糊塗。我在國內的書局翻閱過些中譯的經濟學課本，不容易找到譯得稱意的。  上述都是困難，要想辦法改進。但最說不通的，是外間的人（例如港人）要到國內去辦學校，不容易獲得牌照。毫無疑問，今天國內的英語教育市場大得驚人。然而，我們聽到的、看到的，好些是不大懂英語的在教。數之不盡的國內青年問怎樣學好英語，我不知從何說起。說難不鼓勵，說易卻不對，我只說：背吧，天天朗誦而背之一個小時。  國內開放英語教育市場是刻不容緩的了。只要課室夠大，廉價收費也是生意。雖然香港大學生的英語水平有點那個，但可以教的還不少。國內一般青年需要的，不是把英語學得可以寫論文，而教師也不用通過什麼基準試。國內需要的是足以應酬的說得通、寫得通，而重點是要普及。      逢周二、四、六刊出  電郵： nscheung@netvigator.com 
20040306-64,20040306,64,江湖滾熱辣,江湖滾熱辣
20040306-65,20040306,65,李八方隔牆有耳：,李八方隔牆有耳：    傳真︰2623-9278  電郵︰ pf_lee@appledaily.com 
20040306-66,20040306,66,董建華今明見胡溫,董建華今明見胡溫 【本報記者北京報道】正在北京訪問的特首董建華今日將到中南海，與國家主席胡錦濤見面，明日再與國務院總理溫家寶會面後，然後返回香港。  根據過往慣例，澳門特首何厚鏵將緊接董建華之後，與兩位國家領導人會面。     見薄熙來談CEPA   董建華昨晨列席十屆全國人大二次會議後，馬上到國家旅遊局與有關官員會面，下午再分別拜訪商務部和民航總局。  新任商務部部長薄熙來和副部長安民同時會見董建華，薄熙來在傳媒拍照時候，三次讚揚董建華為香港的繁榮穩定和發展作出大量有成效的工作，給內地同事留下非常深刻的印象，做得非常成功。  薄熙來又稱，他們將一如既往，按計劃堅決支持特區的各項發展，包括中央大力支持的更緊密經貿（CEPA）關係工作。  董建華回應時表示，昨日到商務部是特意感謝商務部全力推動中港更緊密經貿關係安排的工作，這對香港的經濟發展非常重要。
20040306-67,20040306,67,　　曾憲梓話胡溫係死老鼠 - 李八方,　　曾憲梓話胡溫係死老鼠 - 李八方 擁有盜冒外國名牌嘅刑事犯罪紀錄嘅人大常委曾憲梓，一向大膽敢言，喺北京開會，當被記者問及中國領導人胡錦濤獲得李柱銘喺美國國會高度評價時，曾憲梓一副老人癡呆相，鼻哥窿郁一郁，黑口黑面，不屑咁罵咗一句：「貓哭老鼠！」     老江勢力指使   嘩，李柱銘係貓，不過胡錦濤同溫家寶就係老鼠？貓哭老鼠，係當隻老鼠死咗之後先至哭嘅，曾憲梓不但形容胡溫係老鼠，重詛咒胡溫快啲死，果然係暢所欲言，開人大胡溫新政嘅言論自由新風氣喎！  好多高官同人大政協私底下議論紛紛，爭相解讀曾憲梓呢一句「老鼠論」嘅指示。有人認為黑曾個腎唔係操作得咁好，腎上腺分泌過盛，亦有啲不願透露姓名嘅港區人大話，曾憲梓健康好好，一啲都唔懵，佢咁講，幕後有老江一派勢力指使，想同胡溫對抗。無論係點，曾憲梓為人咁坦率，相信喺美國政府心目中亦大大加分。  但係話時話，曾憲梓唔知係咪病壞咗，噚日連司徒華同馬丁都分唔開，叫范太紀律處理埋冇去美國嘅華叔，認真亂龍。  （圖）曾憲梓連邊個去咗美國都搞錯，亂咁鬧人。      傳真︰2623-9278  電郵︰ pf_lee@appledaily.com 
20040306-68,20040306,68,　　李卓人聽話拜洋薩 - 李八方,　　李卓人聽話拜洋薩 - 李八方 京官近日連環炮轟到美國出席參議院聽證會嘅三名立法會議員，日前有人講過句話馬丁等人去「拜洋菩薩」。不過職工盟李卓人不單止唔嬲，重鬼咁得戚，日前去國會同議員開早餐會時，臨入國會前突然問馬丁同涂謹申：「有人話我哋來拜洋菩薩，入廟拜神，使唔使鞠個躬先？」  馬丁係天主教徒，而且知道阿人搞笑睬佢都儍，阿涂亦冇你咁好氣，阿人就自己向住國會大樓合十行禮，「咁先係真正拜洋菩薩嘛！」  另外，主持「香港民主狀況」聽證會嘅參議員SamBrownback（布朗巴克）可說係中國通，應該都知道馬丁返唔到大陸，但喺會上卻明知故問，「為甚麼你係香港立法議員，卻不能到中國呢？」  馬丁答佢話，六四事件後佢被視為異見人士，不能踏足大陸，又笑稱美國人權英雄馬丁路德金有一個夢，香港嘅馬丁．李就有兩個夢，「一個係追求民主，一個係返回家鄉。」呢場「政治棟篤笑」全場為之起哄。  （圖）阿人（右）向住國會大樓合十行禮，馬丁知道阿人搞笑睬佢都儍。      傳真︰2623-9278  電郵︰ pf_lee@appledaily.com 
20040306-69,20040306,69,　　肥佬黎談台灣《蘋果》 - 李八方,　　肥佬黎談台灣《蘋果》 - 李八方 肥佬黎噚日喺香港萬豪酒店同班壹傳媒嘅廣告客戶大談台灣經驗，聽講有成三十圍枱，肥佬見到有咁大班聽眾，嘢都唔食跳咗上台講足一粒鐘。  肥佬呢世人最鍾意有挑戰，佢認為，台灣報界咁多年都安於現狀，只係着重政治同文藝嘅沉悶內容，一定要先打破。佢又話畀台灣啲同事聽，要針對消費者嘅需求而唔係讀者；再講吖，《蘋果》唔同台灣其他報刊，冇得派入屋，讀者每日都要makeachoice，梗係啱睇先買，台灣《蘋果》日銷四十幾萬份，廣告最多，肥佬話有信心做一哥喎。  （圖）肥佬黎噚日同班壹傳媒嘅廣告客戶大談台灣經驗。      傳真︰2623-9278  電郵︰ pf_lee@appledaily.com 
20040306-70,20040306,70,　　雲大棉嘲笑梁振英 - 李八方,　　雲大棉嘲笑梁振英 - 李八方 因敢言而連政協都冇得做嘅老愛國雲大棉噚日出現喺北京飯店，大家非常驚訝，唔通雲老又補番做政協？  雲老同太太及兩位公子，特登揀呢個時候上京，話係想探吓老朋友。講到下屆特首，雲老把口仍然唔收，話如果梁某人做到特首，大家就要買定「雪屐」走佬。咁佢自己又點？雲老重搞笑，話自己何止「雪屐」，連單車都買埋。  （圖）前政協雲大棉（右）揀喺兩會期間，一家四口上京。        傳真︰2623-9278  電郵︰ pf_lee@appledaily.com 
20040306-71,20040306,71,　　葉澍堃蝦子麵送記者 - 李八方,　　葉澍堃蝦子麵送記者 - 李八方 經濟發展及勞工局局長葉澍堃噚日鬼咁高興同記者講，踏入三月，每日勞工處收到嘅空缺都維持喺一千個嘅水平，勢頭好好，二月份私人機構嘅空缺有成二萬三千幾個，較一月同舊年同期都大增，港人有嘢做，葉局長最高興，佢梗係希望利用CEPA嘅契機，同勞資雙方傾掂數，創造更多新職位。  唐唐下周講首份預算案，葉局長話佢唔知情，但都好想唐唐減紅酒稅，唔使俾新加坡搶晒啲紅酒客。雖則唐唐同葉局長好運，但係老左日日炮轟，怕唔怕嚇走晒啲米飯班主？葉澍堃話滙豐大班講咗，佢冇補充喎。坐得喺度做局長，梗係愛國啦。葉澍堃噚日雖然喉嚨痛，但係工照返，提起翡翠拉麵又開新店，局長猛話啲麫正，重將舊年喺工展會大手筆買下嘅蝦子麵送畀記者，真多謝晒。        傳真︰2623-9278  電郵︰ pf_lee@appledaily.com 
