key,date,article_daily_id,title,text
20040425-0,20040425,0,患「洗髮盆綜合症」英婦不治仰頸中風洗頭奪命,患「洗髮盆綜合症」英婦不治 仰頸中風洗頭奪命 【本報訊】到髮廊理髮，洗頭時一般都是躺在洗髮椅上頭向後仰，頸枕着洗髮盆，但原來這個平常的動作，可能是死亡陷阱。英國一名中年婦人四年前到髮廊洗頭時突然中風，最近更病發身亡。這種罕見的「洗髮盆綜合症」（WashingBasinSyndrome）源於頸部動脈栓塞，本港亦間中出現類似中風個案。有專家建議，日後到髮廊洗頭，不妨俯身面向洗髮盆沖洗。　記者：周文清、曾家竹、陳倩雯 死者是五十一歲女教師帕梅拉，來自英國多塞特郡的普爾。○○年九月，新婚還不到半年的她在丈夫克拉布陪伴下，如常光顧髮廊，洗頭時仰卧椅上，頸枕着洗髮盆。突然間，帕梅拉滿臉漲紅，洗頭過後，她就變得口齒不清。醫生證實，她患上「缺氧性中風」。  那次中風沒有斷尾，約一周前，帕梅拉在家中泳池游泳期間，再次中風，送院後證實不治，遺下夫婿與兩個孩子。     口齒不清常覺冷   帕梅拉的丈夫克拉布憶述太太四年前在美容院的經歷說，她那時覺得非常不妥，口齒不清，雙手更像爪子般曲起。求診時，醫生說她輕微中風，護士問她有否到過髮廊，然後向她解釋，這是「洗髮盆綜合症」。  醫生解釋，帕梅拉當時患了因輸血往腦部的主血管栓塞而形成的缺氧性中風。中風後，她連續三星期說話和平衡都有困難，後來情況好轉，但從未完全康復，偶爾會口齒不清，又時常覺得很冷，夫婦倆今年因而移居氣候較暖和的西班牙。     港亦有中風個案   所謂「洗髮盆綜合症」，是指洗頭時頸項長時間過份後仰導致中風。英國神經病學專家貝特曼解釋說：「這個動作會拉扯動脈。你若倒楣，便有可能把它們撕裂，血液繼而滲到不同組織之間，凝結成血塊，阻礙血液流到腦部，最後導致中風。」  中文大學醫學院內科及藥物治療學系（腦神經科）副教授黃家星表示，本港亦間中出現洗頭時頸項向後仰引致中風個案。他解釋稱，當頭仰得太後，頸骨壓着頸部負責運送血液到腦部的椎動脈時，血管的內、外膜會分開，部份血液會流入內膜與外膜之間的假通道，形成「分割式血管瘤」，真正經由血管內腔運行到腦部的血液因而不足，導致缺血性腦中風。 病徵：視力減弱   腦科專科醫生黃震遐則說，另一個可能是患者將頸部大力向後仰時，椎動脈被拉得扁平，導致血液無法暢通流向腦部，形成中風，但此情況比較罕見。患者一般在四十八小時內出現中風病徵，包括精神不振、說話模糊、視力減弱及身體癱瘓等，嚴重者會在短時間內死亡。  英國的貝特曼補充說，洗頭引致中風的情況並不普遍，主要影響頸、椎動脈本身特別脆弱的人，但他說，大家不應為此害怕上髮廊，但如果可以的話，改為把頭傾前俯向洗髮盆會較好，因為這樣便不會拉着頸項。  承受喪妻之痛的克拉布呼籲美容院常客以後小心：「我不是在散播恐慌，只是不想再有人死於洗髮盆綜合症，有高血壓者真的應該小心，不要仰頸洗頭。我不怪髮型師，但髮廊應貼上警告牌，就像機場保安探測器前，有對心臟起搏器病人的警告一樣。」
20040425-1,20040425,1,醫病耗積蓄　未留下現金,醫病耗積蓄　未留下現金 羅文在七十至八十年代紅透半邊天，單是唱片版稅收入已過千萬，但他不擅投資，加上性格疏爽兼熱愛名牌，積蓄不多，臨終前因為醫肝癌，更耗盡畢生積蓄，據悉病逝後沒有留下現金，不動產包括跑馬地蟠龍道九號連天台的舊居、曼谷兩個住宅單位、一架英國古董車及一些名表首飾。     申請透支額為醫病   由於羅文生前沒有立下遺囑，根據香港法例，遺產由羅文的胞姊譚文玉和胞妹譚明玉接管，今年遺產管理手續已正式辦妥。  羅文跑馬地的寓所是向美國銀行做按揭，據悉，他為了籌錢醫病，曾向銀行申請二百六十萬元透支額，至前年初，因病情惡化，借款至一百九十萬時被銀行終止透支額，並須每月還款三萬元，羅文隨後經濟出現問題，連前年中秋節入院的五萬元醫藥費，亦是其前助手Terry向朋友借錢支付。  除了該筆貸款外，曾經跟隨羅文多年的菲籍司機DeVeraJoseR，亦於上月入稟向羅文遺產管理人追討羅文拖欠薪金七萬多元。而蟠龍道寓所天台漏水，業主立案法團要羅文夾份的十多萬維修費，仍然拖欠。現時羅文的胞姊和胞妹，若成功將蟠龍道的寓所放售，欠款問題相信可解決。  本報記者
20040425-2,20040425,2,銀行收樓拍賣減風險,銀行收樓拍賣減風險 法律界人士謝連忠律師指出，羅文以物業作抵押品，向美國銀行取得借貸款項，銀行方面不會理會物業持有人在生或是破產與否，只要對方未能如期還款，銀行方面即可入稟法院要求收樓，以保障自己利益。  謝又稱，羅文逝世後，他的親屬或遺產管理人無法還款，銀行要求收樓，這種情況相當普遍，但銀行為何這樣久才提出收樓，則有多個可能性，其中包括銀行不想事件再拖下去，遂要求收回物業自行拍賣，以減低風險。
20040425-3,20040425,3,圖按着光碟機　失重心頭撞地3歲童2呎檯墮下危殆,圖按着光碟機　失重心頭撞地 3歲童2呎檯墮下危殆 【本報訊】粉嶺嘉盛苑昨中午發生家居意外，一名三歲男童在家中由菲傭照顧進食午膳時，疑於菲傭入廚房取水時，圖爬上兩呎高的小枱按動影音光碟機（VCD）開關掣，但失重心從枱上翻跌地上，頭部着地受重傷，菲傭即通知女僱主報警將小主人送院救治，情況危殆。     菲傭往取水時出事   重傷男童姓文，與父母居於嘉盛苑嘉耀閣一單位，其母親姓張。據悉由於文童父母都有工作，平時由一名二十三歲菲律賓女傭照顧起居飲食。  事發昨中午十二時二十分，現場消息稱，男童坐在廳間一張小櫈上，由菲傭照顧享用放於兩呎高小枱上的午膳，其間，菲傭入廚房擬取水給小主人飲用，只是數十秒時間，轉身進入廚房時，卻發現小主人從櫈上爬上該張兩呎高枱子，伸手擬按動枱子旁的影音光碟機的開關掣，她見狀大驚，立刻從廚房奔出制止，但小主人已失重心從枱上翻跌地上，當場頭破血流嚎啕大哭，菲傭即通知姓張女主人，報警將男童先送北區醫院，因頭部受重傷陷昏迷，再轉送沙田威爾斯醫院治療。  警員事後在場調查後，認為案件無可疑，相信屬意外。
20040425-4,20040425,4,兒童好奇易生意外,兒童好奇易生意外 有兒科醫生認為，兒童天生好奇，易被身邊的物件吸引，亦喜歡爬高爬低，碌架床和枱櫈是容易發生意外的陷阱之一，兒童容易從高處跌傷，如果是摺枱，須留意是否有可能會將兒童頸項夾住，又或拉跌枱布將碗碟、滾湯弄翻令兒童被擊傷或燙傷，一些大型家具、電器是否容易翻倒，令兒童被壓重傷。  其實，很多家居意外都是涉及人為疏忽引致，家長及女傭一時忽視危險之存在，又沒有好好盯實兒童的舉動，導致意外發生後造成難以挽回的結果。
20040425-5,20040425,5,遭賊刀挾弱女含淚求救,遭賊刀挾弱女含淚求救 【本報訊】旺角彌敦道萬寧分店一名年輕女職員，前晚被一名闖入店內打劫的持刀賊人挾持作人質與警察對峙，她數度被賊人用刀架頸，嚇致花容失色，但不敢哭喊，只能含着眼淚以求救的眼神向店外的警察求救，在飽受十多分鐘的驚嚇後總算有驚無險，賊人最後棄械投降並將她釋放。     無業劫匪棄械投降   被賊人挾持的女職員姓劉，二十三歲，她在事件中只是右手扭傷，送院檢查後已經出院。據警方表示，被捕疑匪姓楊，五十四歲，無業。據案情透露，疑匪前日晚上十點四十分到旺角彌敦道六五五號的萬寧分店內徘徊，到十一點十五分該店打烊仍未離去，他見店內只剩下三名女職員，於是亮刀打劫，旺角特遣隊警員接報到場將他包圍在店內，賊人挾持劉女，不時揮舞八吋長的利刀，要求警員撤走，最後見無路可逃，與警對峙十多分鐘後棄械投降。
20040425-6,20040425,6,櫃機提款萬元　惹來兩賊跟蹤釣魚郎遇劫復遭推落海,櫃機提款萬元　惹來兩賊跟蹤 釣魚郎遇劫復遭推落海 【本報訊】一名戴鴨舌帽的釣魚郎，昨晨在馬鞍山銀行自動櫃員機提款一萬元，稍後準備到銀行入數繳交供樓款項和雜費，但發現銀行未到營業時間，便往鞍駿街堤岸釣魚消遣，突然被兩名賊人箍頸掩口，搶去褲袋內現金後將他推落海逃去；幸現場堆滿礁石和淺水，遇劫事主半身濺濕爬上岸報警。　記者：文兆麟 遇劫事主姓羅（三十五歲），事後向警方表示，昨晨八時許他在馬鞍山富安花園一家銀行的自動櫃員機提取一萬元現金，準備再到銀行入數繳交供樓款項和雜費，但發現距離銀行早上九時開門營業時間尚早，反正已帶備釣魚用具，包括魚竿、魚絲和魚餌，不如先到到鞍駿街馬鞍山公眾池泳對開堤岸釣魚消遣。     一賊箍頸一賊亮刀   姓羅的事主又表示，他抵埗後正朝海面視察環境，還未拉竿拋絲之際，突然被人從後箍頸掩住口鼻，又感到被另一人亮出𠝹刀指嚇，繼而伸手入褲袋搶去他該叠剛提取的一萬元鈔票，賊人得手後將他推落海逃去，因於事出突然，自己背向賊匪，故看不清楚對方的面孔。  慶幸現場堆滿礁石，堤岸距離水面僅一米半，水亦不深，事主只是沾濕下身沒有受傷，自行爬上岸以手提電話報警求助；隨後由警車接載在附近兜截，但無發現賊人蹤影。  今次劫案兩名劫匪行動迅速，警方調查後懷疑事主在銀行自動櫃員機提款時已遭賊人窺見，一直跟蹤着他，趁時機適合便聯手打劫該筆金錢，連事主手提電話亦無興趣劫走。     自動轉帳避免攜款   現場堤岸是釣魚的熱門地點，但事發時卻沒有其他市民目擊，警員曾向事主要求出示銀行提款的收條，可是事主稱他提款時沒有要收條，故無法出示，在兜截劫匪無果後，遇劫事主便返署助查。  銀行界人士稱，業主供樓除以現金交付之外，還可以用自動轉帳或支票方式交付，這樣可避免攜帶一筆金錢在身，即使遇劫也可減少損失，況且自動轉帳亦有其好處，可避免逾期繳款而被罰錢的機會。
20040425-7,20040425,7,親友憤慨未還死者公道數百居民上香祭遇害三母女,親友憤慨未還死者公道 數百居民上香祭遇害三母女 【本報訊】天水圍天恒邨倫常慘案的死者三母女，親友將於今日在沙田寶福紀念館設靈，明日舉殯，三母女隨即進行火化；而天恒邨的居民昨晚在兇案現場樓下舉行公祭儀式，其間有數百名居民在死者靈前上香，以表示哀悼。  另外，死者親友在紅磡一家道堂為三母女設置靈位，女死者金淑英胞妹的男友余先生，昨午亦到道堂拜祭及處理殮葬事宜。他表示，親友從警方通知得悉男戶主李柏森不治，他認為李死得太早，「便宜咗佢」，他深信慘案是李柏森所為，但李事前報警指妻子金淑英殺害兩名女兒，但可惜他早死，不能還金淑英一個公道，令她死不瞑目，親友都覺得非常憤慨。  至於天恒邨居民服務社，在邨內籌款替三母女舉行法事，儀式於下午五時半開始，直至晚上近九時結束。在恒運樓兇案現場樓下空地，由十多名道士誦經超渡，並到凶宅門外招魂及進行破地獄儀式，讓枉死的三母女早登極樂世界。儀式場地擺放三母女靈位，祭品包括兩女童生前愛吃的朱古力及飲品等。     男戶主不治案件成謎   法事進行期間，不斷有居民前來上香，估計有數百人拜祭，而三母女的靈位，兩女童燕利及子雲的姓氏亦改隨母姓。據主辦法事的街坊稱，兩女童是被父親殺死，落到地府不應再隨父姓，而今次法事需費一萬元，街坊總共籌得近四萬元，餘下款項將作為社區服務支援用途。  此外，新界西立法會議員譚耀宗昨晚亦有前來拜祭。他指出，事件是一個悲劇，但男戶主死亡令真相成謎，關於警方沒有處理女死者的報案是否失職，他認為警方仍在調查中，不應太快下定論；不過，天水圍的警力不足，以及前線警員缺乏應付家庭暴力意識，均需作出改善。     已提醒前線警員當心   警務處處長李明逵表示，警方仍跟進案件，並循其他途徑包括法醫報告等尋找破案線索。至於警方被抨擊在案發前處理該宗家庭糾紛不當，他說，若發現有人處理失當，警方會進行內部調查，警方並提醒前線警務人員，面對同類家庭暴力案件時，應顧及受害人的情緒。
20040425-8,20040425,8,爛賭七旬婦被收數佬押返港,爛賭七旬婦被收數佬押返港 【本報訊】一名疑嗜賭七旬老婦，往濠江賭敗欠下大耳窿四萬元債項，昨凌晨被兩名收數佬從澳門押返鴨脷洲寓所，催迫其家人代為清還債項，但其子不肯就範報警求助，警員到場將兩名收數佬連同女事主一併帶署調查。  被大耳窿押返香港追討債項的老婦姓李（七十歲），與家人居於利東邨東昇樓一單位；兩名收數佬分別姓陳（十九歲）及姓梁（二十六歲），被警員帶署調查後准予離去。     兒子報警求助   據悉李婦愛好賭博，雖已一大把年紀，仍間中到澳門賭場博殺。較早前，她又到澳門賭場賭博但敗北，向貴利集團借錢企圖翻本又再輸光，欠下大耳窿四萬元債項。  昨日凌晨三時三十分，七旬的李婦被人由澳門押返本港後，由兩名收數男子押返回鴨脷洲利東邨寓所，要家人代為還債，但李婦姓陳（三十二歲）兒子懷疑母親在澳門被大耳窿訛騙，拒絕還款，並致電報警。
20040425-9,20040425,9,超級六合彩一注獨中4139萬,超級六合彩一注獨中4139萬 【本報訊】為慶祝馬會設立場外投注站三十周年而設的「跨越30」周末金多寶六合彩，昨晚在全城哄動下進行攪珠，結果頭獎只得一注中，幸運兒獨得四千一百多萬元，打破今年最高派彩紀錄。  昨晚開獎的「跨越30」周末金多寶六合彩多寶獎金三千萬元，由於馬會預計頭獎基金可達四千五百萬元，所以特別將受注時間延長至昨晚九時四十五分，以方便投注人士，但最終總投注額只達八千七百萬元，頭獎基金只得四千一百萬元。     橫財夢浪接浪   昨晚攪出的七個號碼為24、30、39、43、44、48及特別號碼23，碰巧與主題「跨越30」有關的「3」字號碼有四個，頭獎一注中，派四千一百多萬元、二獎七注中，每注派五十四萬餘元、三獎二百八十注中，每注派三萬六千多元。  中獎彩金超過五百萬元的中獎幸運兒（包括電話投注、智財咭及互動投注服務客戶），均需致電馬會熱線：1817登記。  橫財夢一個接一個，由於上周六沙田賽馬三T無人中獎，有一千一百萬元多寶撥入今日沙田女皇盃日賽馬內，馬會估計十元一注獨中正獎，幸運兒可獨得二千二百萬元彩金，三T場外截止投注時間為頭關第四場開跑前十五分鐘，即今午二時正。
20040425-10,20040425,10,政府追21幅地清理費,政府追21幅地清理費 【本報訊】審計署去年狠批地政署於九七年收回青衣北部二十一幅船廠租用地時，沒有嚴格要求租戶按例負責清理搭建物和污染土地，須花費七千萬元清理含石綿及化學廢物的搭建物，並為七萬五千立方米受污染泥土進行除污。律政司昨日入稟高等法院，向二十一個涉案租戶，就沒有履行租約條文和政府已承擔的清理費用，作出賠償。     花去公帑七千萬元   入稟狀指出，被告二十一個租戶，沒有遵從租約條例，因在該土地棄置包含重金屬、有機物質、有毒物質和排泄物等污染物，而造成污染，並因搭建物排放有毒及侵蝕性污染物，令政府須付出有關清理和除污費，故此要求二十一個租戶作出賠償。  去年審計署報告批評，政府於九七年收回青衣北部六幅已批租船廠用地，並終止十五份短期租約；地政總署沒有嚴格要求承租政府用地的船廠在交還時清理好土地，以致政府在收回青衣及竹篙灣共二十二幅用地時，要動用五億多元清拆搭建物及清理污染土地，其中四點四億元用於清理竹篙灣致癌物質二噁英。  根據短期租約訂明，當租約終止時，有關二十一個船廠用地租戶，須負責清理搭建物，但地政總署並沒有採取行動執行有關條文，結果政府須花五百五十萬元，清理地盤含石綿及化學廢物的搭建物，其後又須承擔六千四百五十萬元，在七萬五千立方米受污染泥土進行除污工作。  案件編號：HCA943-56、958-64/04
20040425-11,20040425,11,頂頭槌練瑜伽會中招,頂頭槌練瑜伽會中招 【本報訊】除髮型屋洗髮椅隱藏中風危機，有腦科醫生警告，練習瑜伽、乘坐過山車或踢足球「頂頭槌」等會出現頭部向後仰動作的活動，均有導致中風，甚至死亡的危險，醫生呼籲長得高、患有高血壓及血管硬化的人士加倍小心。  中文大學醫學院內科及藥物治療學系副教授黃家星估計，本港每年約有一千人因頭部仰得太後引致中風，佔所有中風人數百分之五左右，當中包括練習瑜伽人士，以及經常駕駛「耷頭」單車而保持頭部向後仰高的職業單車手等。     高血壓高危一族   他解釋，人類的頸部存有椎動脈，負責輸送血液到腦部，比其他血管較為重要，一旦受損令血液未能流向腦部，即可能引起頭暈、眼盲、半身不遂等中風病徵；嚴重的會導致腦幹死亡，幾小時內身亡，死亡率達一成。  腦科專科醫生黃震遐也指出，以往部份中風病例是由於乘坐過山車、踢足球時「頂頭槌」、被按摩師傅「扭頸」，把頭仰得太後，傷及脊椎動脈引致的。由於此症與血管有關，故患有血管硬化、高血壓及多骨刺的人特別容易出現此情況，長者亦屬高危一族。     頭痛應立即求醫   醫生黃家星及黃震遐均呼籲高危人士應避免進行把頭仰得太後，或頸部大力向後的危險動作；當把頭仰得太後，出現不尋常的頭痛症狀時，應立即求醫，及早接受治療。  香港執業脊醫協會主席陳允灝指出，玩機動遊戲機、做仰卧起坐、坐牙醫椅或做瑜伽時，只要做出類似頭部仰後動作，都有機會引發此症；至於人們將頭部猛力向後仰會引發的「金門橋綜合症」（GoldenGateBridgeSyndrome），也出於同一道理。
20040425-12,20040425,12,禁售含馬兜鈴酸中藥,禁售含馬兜鈴酸中藥 【本報訊】衞生署公布，由今年六月一日起，停止進口及銷售含有馬兜鈴酸的中藥材及製劑。這是由於過往有病人服用含馬兜鈴酸的中藥材後出現不良反應，而香港中藥巿場上亦曾發生錯用或誤用含馬兜鈴酸的中藥材。     條例六月生效   最近有病人購買中藥時，藥材舖誤將含有馬兜鈴酸的「尋骨風」代替了不含馬兜鈴酸的「白英」，導致病人不適。衞生署指出，根據文獻報道，長期過量服用含有馬兜鈴酸的中藥，會導致腎衰竭及尿道癌等藥物不良反應。含馬兜鈴酸藥材雖然品種眾多，較常用藥材有數種，包括關木通、廣防己、馬兜鈴、青木香和天仙籐。  目前本港藥業界沒有一套有效機制，以分辨含有馬兜鈴酸中藥材品種的真偽。為保障巿民健康及用藥安全，香港中醫藥管理委員會中藥組經討論後決定，於今年六月一日起，停止銷售含馬兜鈴酸的中成藥。同時，衞生署又停止進口及銷售附件之名單甲藥材及暫時使用附件之名單乙藥材，有關名單會於今日上載香港中醫藥管理委員會網頁 （ http://www.cmchk.org.hk）  。
20040425-13,20040425,13,三成公開試考生失眠,三成公開試考生失眠 【本報訊】踏入考試季節，莘莘學子均面對沉重的考試壓力。一項調查顯示，約三成半受訪的應屆會考及高考生感到壓力偏高，部份更出現失眠、頭痛及手震等症狀。有社工提醒考生，不要把考試成績等同終生成就，並應該多找朋友傾訴，以紓緩壓力。  香港青年協會成功訪問二百六十七位應屆會考及高考生。受訪考生的主要壓力來自擔心未能升學、對自己及父母的要求。在面對壓力時，部份考生承認會失眠及難以集中精神，甚至會生理上感到不適，如頭痛及手震。     成績不是終生成就   青協單位主任徐小曼昨日在記者會上表示，隨着會考主要科目考試在本周開展，考生壓力將愈加沉重。為了有效紓緩壓力，考生不要把考試成績等同終生成就，應該多找朋友傾訴。應屆會考生尹淑娟則指出，沉重壓力曾經導致她經常發脾氣，甚至害怕到哭出來，可幸得到老師開解，現時已能夠輕鬆面對考試。     半數學生出現抑鬱   此外，香港青年協會一項全港調查顯示，在一千多名中一至中五學生中，有五成受訪的中學生於接受問卷調查前一星期內，曾出現抑鬱情緒表徵，反映學生出現抑鬱情緒的情況頗為普遍。調查顯示，青少年學生最普遍的抑鬱情緒症狀，依次是「難於專注在我要做的事情上」、「我認為我很失敗」、「一些以往不令我困擾的事都會令我感到煩惱」。
20040425-14,20040425,14,意見是否具法律約束力掀爭議人大今討論特首政改報告,意見是否具法律約束力掀爭議 人大今討論特首政改報告 【本報訊】人大常委會今日開會討論備受爭議的特首政改報告，但兩地法律界已就人大常委會確認報告時，提出的政改意見是否具法律約束力，掀起新一輪爭拗。港大法律學院院長陳文敏認為，人大常委會在確認報告以外的意見並無法律效力，特區政府毋須跟從，但《基本法》委員會委員陳弘毅及內地法律學者蔡定劍則反對，認為有關意見對特區政府有約束力，政府日後討論具體政制方案時，有需要遵從。　記者：莫劍弦 人大常委今日召開特別會議，討論確認特首董建華較早前提交的政改報告，並於明日正式公布結果，不過，政府高層以及親中人士在會前已不斷「放風」，指人大常委會藉今次機會，正式表明香港○七及○八年不可以普選特首及立法會，令特區政府下一階段討論政改方案時，可以排除普選模式。     只能解釋含糊地方   陳文敏昨出席港大一個政改論壇時認為，人大常委會早前提出釋法，只能解釋《基本法》條文內含糊地方，並非任何由人大常委會作出的解釋，都具有法律效力，直到目前為止，人大常委會指出《基本法》唯一含糊的地方，就是有沒有啟動政改的需要，而非如何進行政改，故此人大常委會明日公布決定，僅限於是否啟動政改方面對特區政府有法律約束力：「唯一要解決問題係有冇政改，嗰啲唔係佢決定範圍嘅事，我哋冇法律責任去跟。」  他指特區政府也毋須理會那些意見，「其他嘢只係佢哋（人大常委會）意見，唔應該對香港任何機關有約束力。」  出席同一場合的陳弘毅也承認，人大常委會對○七、○八年普選的意見，在香港是否有法律效力是有爭議：「根據內地法律制度（人大常委會意見）係有法律效力，香港因為『一國兩制』，法律效力係點，會有唔同講法。」但他認為政治上，特區政府不會做違反人大常委意見的事：「政制方案不符（人大）意見，批准機會會好低。」     國內專家：形同法例   中國政法大學教授蔡定劍指出，根據國內法律，人大常委有權給予意見，並與法例具有相同法律效力，所以若人大常委就○七、○八年普選提出意見，特區政府有責任履行。  另外，天主教香港教區主教陳日君昨日出席電台節目後表示，希望今日召開的人大常委會，不要為○七及○八年普選，定出任何時間表，中央應該先諮詢港人意見才決定。　  昨日抵達北京開會的人大常委曾憲梓稱，會在今日會議上反映香港人對政改意見，包括支持和反對普選在內，但他認為主流意見是反對在○七及○八年普選，他又批評民主派早前闖關是「做騷」。
