key,date,article_daily_id,title,text
20040306-0,20040306,0,鮑威爾晤李柱銘30分鐘　美國政府闡明立場︰香港民主進程影響中美關係,鮑威爾晤李柱銘30分鐘　美國政府闡明立場︰ 香港民主進程影響中美關係 【本報訊】民主黨立法會議員李柱銘與美國國務卿鮑威爾會面，掀起一浪中美外交角力。美國國務院高級官員以強硬的語氣促請北京尊重香港人意願：「如果香港的自由及民主活動受到影響，美中關係也會受到影響，香港、北京、華盛頓以至其他地方，無人會因此得益。」中國外長李肇星指摘這是外來勢力干預香港事務。　記者：羅偉光（華盛頓）、蔡元貴、譚暉 民主黨的李柱銘、涂謹申、職工盟的李卓人三位立法會議員及人權監察總幹事羅沃啟出席美國聽證會後，約於香港時間昨晚九時四十五分與國務卿鮑威爾及副國務卿阿米蒂奇會面約四十五分鐘。鮑威爾於會議開始後約十五分鐘中途加入，與李柱銘共會面約三十分鐘。他是民主派議員此行所會見的美國最高級官員。  李柱銘會面後引述鮑威爾表示，非常關注香港民主情況，李柱銘則向他闡述了民主派對香港民主進程的意見，認為香港民主發展雖然在短期內遇到困難，但長遠是有信心的。李柱銘說，港人爭取民主不應影響中美關係，因為兩國一直是貿易上的緊密夥伴。     高姿態接待惹北京反彈   美國高級官員明確支持香港○七及○八年普選特首及立法會，副助理國務卿施理華（RandallG.Schriver）在國會「香港民主狀況」聽證會上指出，港人去年已顯示了爭取民主發展的訴求，而美國政府長期政策是香港應朝更大民主化及普選前進，「我們認為香港人過去八個月已重複地向政府表達立場，香港及中國政府是時候聽取港人的聲音。」  施理華說，「如果香港自由、民主活動受影響，美中關係也會受到影響，香港、北京、華盛頓以至其他地方，無人會因此得益。」 美國派出鮑威爾高姿態接待香港民主派議員，引起了北京的反彈，外長李肇星被問及香港政制發展問題，會否影響中美關係時表示，香港問題屬於中國內政。他強調，香港是中國的香港，外來勢力不應隨便干預。  亞洲電視昨晚引述北京外交部透露，副外長戴秉國昨日中午啟程訪問美國，預料屆時會與美國高層高員觸及香港近期的政治問題，包括鮑威爾接見民主派人士一事。外交部稱，戴秉國此行是作為中國特使，出訪美、德、法等多個國家，與該等國領導人商談雙邊關係及當前共同關心的問題交換意見。但戴秉國昨日拒絕證實此事。  中文大學政治及行政學系教授戴大為MichaelC.Davis認為，本港民主發展受到阻礙，的確會影響中美關係。他解釋，政制開放與經濟利益有密切關係，而美國在本港有很大的利益，這包括一大筆美國機構在港的投資，因此美國政府很關注本港的政制發展。  美國國務院發言人包潤石則表示，美國各階層的官員跟各國人士會面，是希望了解每個國家的情況，這不僅是出於興趣，也符合美國的利益。     美參議員鼓勵人民力量   至於主持聽證會的美國參議員布朗巴克（SamBrownback）更批評，中國強調一國多於兩制，他指美國給予香港有別於中國的待遇，是基於一國兩制之下香港有一個有別於中國的政府系統，「若香港被迫失去自主及民主，美國的政策也會被迫改變。」他指出，7.1大遊行顯示香港人發洩不滿之餘並不損害社會穩定，香港人應繼續展示人民的力量，而香港民主亦有利中美關係，「若二○○七年香港民主有長足進步，兩國關係亦會有所進展。」
20040306-1,20040306,1,內地學者：議員必須贊同「一黨專政」,內地學者：議員必須贊同「一黨專政」 【本報記者北京報道】民主黨前主席李柱銘等人士的訪美之行，在北京繼續引起迴響。清華大學法學院副院長王振民昨日表示，香港立法會議員到美國出席國會聽證會談香港民主，已經違反《基本法》。他又認為，議員的職位在香港有官方性質，必須要承認和贊同香港民主派口中的「一黨專政」。  王振民昨日接受香港記者訪問時表示，香港立法會議員就職宣誓時，宣誓效忠《基本法》和香港特別行政區，但民主派人士今次赴美並非一般旅遊、探親或訪友。被問及這是否意味其他人也不可以到外國講任何有關香港政治的問題時，他則沒有解釋，只說：「這種形式應該是違反《基本法》的。」  他又認為，香港是中華人民共和國轄下的一個特別行政區，因此特區的官員也是中華人民共和國的官員，因此應在宣誓效忠香港特別行政區的同時，效忠中華人民共和國，立法會議員也應如此：「立法會議員也是官員嘛！」  但當記者質疑香港立法會議員並非官員時，王振民則指議員是立法機關成員，因此也有官方性質，必須要承認和贊同「中國共產黨領導下的多黨合作制」，他說：「不是香港要搞社會主義，但最起碼要認同大陸的社會主義制度。」被問到這是否意味立法會議員要贊成中國「一黨專政」時，王振民首先說「是」，後來尷尬地澄清他並非指「一黨專政」，而是「中國共產黨領導下的多黨合作制」。     譚耀宗加入批評   政協委員譚耀宗則批評說：「如果特區政府做得唔好，作為立法會議員，可以提出意見，幫助政府改善施政，而唔係去美國，拉美國人去壓特區政府，去壓中央政府，呢個唔係一個中國人嘅行為。」他指李柱銘即使在美國強調支持「一國兩制」、反對台獨，也只是騙人的說話，與其行動剛剛相反。  人大代表李鵬飛則認為，李柱銘作為政治人物，在這個敏感時期赴美，引起強烈反應，如同「踩鋼線」。他指最重要的是李柱銘在美國說了甚麼話，而美國這時舉行此聽證會，顯示美國國會收到的報告指香港民主進程不理想，因此作出關注。
20040306-2,20040306,2,以色列前總理：愛國不能強迫,以色列前總理：愛國不能強迫 【本報訊】近期北京向香港人表明只有愛國的人才可治港，但愛國主義濃厚的以色列，前總理佩雷斯昨日在港道出愛國主義的精髓，是要人民自由地用心去思考領會，並非以行動去表達，更不能以武力去強迫人民愛國。他又以愛情比喻「一國兩制」，「如果你隻眼開隻眼閉，愛情就可以有圓滿結局！」  因促成以色列與巴勒斯坦和平協定，於九四年成為諾貝爾和平獎得主之一的以色列前總理佩雷斯，昨到訪香港城市大學，主持城大傑出學人特別講座，題為「今日之先－明日之途，經濟與科技發展在當今世界的角色」，吸引二百多名師生參加。  一直以愛國主義作為精神教育核心的以色列，透過學校、軍事訓練、廣播等一切大眾宣傳手法，將愛國主義滲透公民意識中，向國民灌輸愛國主義思想及猶太民族感，令以色列人成為全球最愛國的國民之一。佩雷斯被學生問及近期香港愛國主義爭論的看法時，佩雷斯並無正面回應。     愛情妙喻一國兩制   但他指出，愛國主義觀念不斷轉變，愛國是要由心去思考領會，並非以行動去表達，須讓人民自由去思考愛國的價值觀，不能以武力去強迫人民愛國，但他同意必須自小教育小朋友如何愛護國家。  提及本港推行一國兩制出現矛盾及兩岸統一問題，這位於九五年接替遇刺身亡的拉賓出任以色列總理的佩雷斯以愛情比喻一國兩制，他說：「如果你隻眼開隻眼閉，愛情就可以有圓滿結局，但如果你用顯微鏡去看，便當然會發現有問題，愛情自然難有美滿結局！」但他認為，中國最終不會以武力去解決中台統一問題。
20040306-3,20040306,3,歷史學者：「賣國」不能亂罵,歷史學者：「賣國」不能亂罵 【本報訊】民主派赴美，被人大常委曾憲梓指罵為「漢奸」、「賣國」。不過，歷史學者指出，一個人要有意識地去做一些損害自己國家的事，並且危害到自己國家的存亡，才是較清晰的賣國行為；在其他情況之下，「賣國」就往往成為政治伎倆，被政客作為打擊對手、混淆視聽的武器。  中大歷史系副教授CathyJ.Potter說，「賣國」是極具爭議性的字眼，容易淪為情緒化、口號式批評，對理性討論不會帶來好處。  她說，雖然各人可以對「賣國」有不同的演繹，但必須清楚被指為「賣國」的行為，到底為國家帶來甚麼損害。她解釋，一般而言，當一國的公民，有意識地做一些危害到國家存亡的事情，稱之為「賣國」就不會惹來很大爭議。歷史上的確有很多普遍被認為是叛國的賣國賊，他們多數是在戰爭時，向敵方透露國家軍情，甚至改投敵方陣營，令到自己的國家備受損害。     赴美是言論自由   至於民主派到美國國會講述香港的民主發展，她說，「完全看不到對中國或香港的存亡，會帶來甚麼影響，根本是兩碼子事」。對於民主派這次訪美，被親中人士抨擊為「賣國」，她則大笑說，「他們只不過是行使言論自由的權利而已，怎麼會扯上賣國？」  CathyJ.Potter又說，對於本港政改的爭議上升到有無「賣國」的討論層面，她感到很遺憾，並指這種論調毫無建設性，也對雙方的理性討論沒有好處。她說，在一個政治、經濟、思想開放型的社會，到外國發表就本國的意見，根本是很自然並常見的事情。
20040306-4,20040306,4,倒董力量見曾蔭權,倒董力量見曾蔭權 【本報訊】由署理行政長官曾蔭權領導的政制發展專責小組昨日與民主倒董力量成員見面，諮詢他們對政改意見，雖然包括梁國雄、曾健成等人並無帶有任何「大聲公」或橫額，但政府總部仍然如臨大敵，派出十多名保安人員監視他們出入政府總部。發言人蕭若元表示，他們在會面中質疑曾蔭權是否有權將市民提交有關原則以外的其他政改意見交中央，並要求董建華如實向中央反映港人對普選的意願。
20040306-5,20040306,5,九團抗議美聽證會,九團抗議美聽證會 【本報訊】九龍社團聯會代表昨日前往美國駐港總領事館請願，對美國參議院屬下的外交關係委員會邀請民主派人士出席聽證會表示強烈不滿及遺憾。  代表在總領事館門外，將一封自製的邀請卡及回禮利是交予領事館，總領事館職員接過請願物品後，請願代表和平散去。該會表示，稍後亦會舉辦聽證會，邀請美國國會議員來港，解釋美國攻打伊拉克後的重建及民主發展。
20040306-6,20040306,6,曾憲梓鬧人「漢奸」,曾憲梓鬧人「漢奸」 【本報訊】即使李柱銘在美國稱讚胡、溫及重申支持一國兩制，人大常委曾憲梓仍狠批他是「貓哭老鼠」，骨子裏仍是反中。昨日身在北京出席人大會議的曾憲梓指，用「漢奸加賣國」都不足以形容李柱銘，又指他無資格做中國人，行為可惡，立法會應對他們作出紀律處分。  港區人大代表兼立法會主席范徐麗泰指出，議員的一言一行市民都會看在眼內，相信李柱銘等三位議員決定出席美國國會聽證會前，也有考慮後果，若大部份市民不認同他們的行為，就要付出代價。
20040306-7,20040306,7,戀上有婦之夫　自願陪伴殉情孕婦與男友燒炭險釀兩屍三命,戀上有婦之夫　自願陪伴殉情 孕婦與男友燒炭險釀兩屍三命 【本報訊】一名失婚婦人，戀上有婦之夫，更為對方懷有身孕，最近發現情郎經濟陷困境想以死逃避，她竟願陪對方往酒店租房仰藥燒炭自殺殉情，險釀兩屍三命，幸女事主在昏迷前一刻，疑抵受不了痛苦或不想未出生子女陪死，改變初衷爬出房間呼救，及時將她及情郎從死門關前救回。　記者：王偉禎 殉情男女懷孕女事主姓黃（三十二歲），報住九龍灣德福花園，經急救後情況危殆，暫未知其腹中胎兒能否保着。其男友姓張（三十六歲），情況嚴重。警方調查後相信二人均出於「自願」，列自殺案處理。     男方債台高築   現場消息稱，姓張男子報住紅磡半島豪庭，已有家室，黃女則為失婚婦人，兩人已暗中來往一段日子，黃女且為對方懷有身孕，但此段婚外情緣，最近因張財政出現困難面臨抉擇，張在債台高築，苦思無解下決定以死避債，並將萌死念頭告知女事主。  黃女獲悉，曾多番勸解男友，奈何男友死意已決，已懷有身孕的黃女見男友要棄她而去，亦感到生無可戀，願與愛郎一起共赴黃泉。     租住酒店輕生   本月四日晚上八時，消息稱，兩人帶備聚寶盆及炭等，租住尖沙嘴廣東道一間四星級酒店一房間後，在房內服食安眠藥及燒炭自殺。  至昨日凌晨四時許，女事主疑抵受不了痛苦，從房間掙扎爬出走廊呼救，其間她的微弱叫喊聲驚醒一名睡夢中澳洲住客。  該住客其後以夜深被人滋擾致電酒店經理投訴，經理着職員上樓查看，赫見女事主半昏迷倒卧房間外的走廊，一名男子則躺在房內睡床旁邊的地上，但神志仍然清醒，而在男子身旁有一個正燒着炭的聚寶盆，慌忙通知經理報警。     房內未撿遺書   警員及救護員到場將兩人送院救治，警員在房內撿獲兩包安眠藥，疑兩人服藥後燒炭自殺，但在房內未有發現遺書，惟聯絡兩人的家人助查後，相信姓張男子因經濟出現問題，加上婚外情困擾，一時想不開想以死逃避，黃女愛郎情切以死相陪，案件無可疑。
20040306-8,20040306,8,孕婦燒炭禍及胎兒,孕婦燒炭禍及胎兒 若孕婦燒炭和仰藥雙料自殺，不僅對母體構成傷害，而且禍及胎兒，將來有可能誕下愚蠢和健康欠佳的嬰兒，兒科醫生呼籲自殺者要三思。  兒科醫生李家仁稱，燒炭時一氧化碳會將人體內的紅血球氧份排去，使人體組織得不到氧氣供應，漸漸產生頭暈、頭痛、抽搐、四肢無力、意識喪失，最後缺氧死亡。  胎兒是靠母體血液供應氧份，所以孕婦燒炭和仰藥一定會對胎兒造成影響，特別是最初懷孕的數個月，胎兒的器官逐漸成長，其受影響程度，視乎吸入的一氧化碳和藥物的多寡，嚴重者可能流產，即使孕婦獲救，能保住胎兒，將來亦可能是愚蠢和健康欠佳的嬰兒。李家仁指出，胎兒腦部受損在母體懷孕期間不容易檢查出來，可能直至出生後，待其成長才知悉。
20040306-9,20040306,9,「等政府承擔市民無雞食責任」談判破裂雞販決下周三罷市,「等政府承擔市民無雞食責任」 談判破裂雞販決下周三罷市 【本報訊】家禽業代表昨晚與衞生福利及食物局局長楊永強就恢復輸入內地活雞展開的談判破裂。香港活家禽批發商會會長徐名團表示，對楊尚未定出恢復輸入內地活雞時間表感到非常失望，業界將依照原定計劃，在下周三開始無限期罷市，「等政府承擔市民無雞食嘅責任！」     楊永強：暫不入口活雞   徐名團強調，政府應按照世衞的規定，若內地連續二十一日沒有禽流感新症，即應恢復入口活家禽，現時政府的做法等於叫業界「等死」，「巿民唔係冇信心食雞，係價錢太貴，巿民負擔唔起。」他強調政府「擺明係卸膊，如果楊永強唔肯負責，就由我哋業界負責囉。」  楊永強會後發出聲明，力言同情家禽業從業員情況，會提供如低息貸款等經濟援助，或協助他們轉型，並強調政府得悉國際獸疫局正考慮是否更改現行指引，把限制受疫症影響國家出口家禽產品的期間由目前的二十一日改為三個月。  他又稱，食物環境衞生署人員稍後會到內地了解禽流感最新疫情，在有信心時盡快恢復入口冰鮮及冷藏禽肉，但暫時不會入口活雞，希望業界不要動輒罷巿。有份參與會議、代表漁農界的立法會議員黃容根形容楊永強與業界不歡而散，補助金是雙方主要的爭拗點。     內地冰鮮雞本月內輸入   政府擬為休業的禽業檔戶提供一萬元補償金，仍開業則獲五千元。港九新界家禽批發零售商會主席黃偉泉在會上要求，提高特惠補償金及將免租三個月的措施擴展至售賣凍鮮禽鳥的攤檔，五千元的補償金微不足道，無法彌補每月十多萬元的租金。  此外，廣東省農業廳昨晚舉行記者會，動物防疫監督總所長余業東宣布與香港的衞生官員開會後，香港同意在本月內恢復輸入內地冰鮮雞，但仍未定出確實日期。他又強調，理解及尊重香港暫停輸入活雞，而目前省內三百多個供應活禽鳥給本港的農場已做防疫好準備，隨時可以恢復供港。
20040306-10,20040306,10,今明六合彩足智彩賽馬有多寶橫財四響炮彩金8100萬,今明六合彩足智彩賽馬有多寶 橫財四響炮彩金8100萬 【本報訊】人無橫財不富，馬會今明兩日推出橫財四響炮讓大家一償心願。馬會的六合彩、足智彩六寶半全場、賽馬三T及六環彩六寶獎今期均有多寶彩金累積，總彩金高達八千一百萬元。其中六寶半全場及六寶獎一注獨中的派彩，更會打破歷來最高紀錄，馬會已預備大量電腦票，方便公眾落注。     延長售票時間   橫財四響炮第一擊六合彩「周末勁賞金多寶」將於今晚攪珠，自馬會於賽馬休戰的周末增設攪珠後，不時會在周末動用金多寶儲備。  今晚攪珠將有二千萬元金多寶，如只有一票獨中頭獎，估計幸運兒可獨得獎金三千三百萬元。攪珠將於晚上九時二十五分舉行，售票時間會延長至晚上九時。  至於第二擊的足智彩「六寶半全場」，則有六百四十多萬元累積多寶，撥入今晚彩池。預計十元一注獨中的彩金高達一千五百萬元，是此項彩池推出以來的最高派彩紀錄。  第三擊及第四擊分別為明日沙田賽馬三T及六環彩六寶獎，分別有多寶四百六十多萬元及一千一百多萬元。馬會估計，如只有十元一注獨中三T正獎，派彩可達一千三百萬元；如十元一注獨中六寶獎，估計派彩更高達二千萬元，打破○一年六月十一日創下十元一注派彩一千五百多萬元的紀錄。     較平時多下注   馬會場外投注處昨日已開始接受投注六合彩及足智彩六寶半全場，不少到場投注六合彩的人士表示，巨額彩金當前，會較平時多下注數十元，期望幸運之神眷顧。  不過，投注者普遍不懂足彩及賽馬，沒有興趣下注足彩及賽馬特別彩池，對由電腦隨機分配的電腦票亦提不起興趣。
20040306-11,20040306,11,香港問題成中美角力牌,香港問題成中美角力牌 【本報訊】著名中國問題專家、美國哥倫比亞大學東亞研究所前所長黎安友（AndrewNathan）表示，由於台灣對美國而言具有重要的軍事戰略價值，故台灣形勢對美國制訂中美外交政策非常重要，香港問題不能相提並論，然而，美國一直關注香港公民自由的問題，若北京繼續壓制香港的自由，美國必然更關注香港情況。     布殊藉機拉票   熟悉中美關係時事評論員林和立則說，香港政制發展已提升至國際層面，香港亦成為中美外交問題上，繼台灣問題後，美國用以跟中國角力的一張牌。  林和立說，美國派出國家安全顧問賴斯及國務卿鮑威爾接見李柱銘等人，是異乎尋常的。他估計，這與美國總統大選在即有關，現任總統布殊過去曾因反對台獨及不支持台灣公投，被國內輿論批評為對北京示弱。為了拉票，擊退克里，布殊有需要藉香港問題取分。  昨日出席美國國會香港民主問題聽證會的美國學者及智囊組織代表，幾乎一面倒批評中國打壓香港民主，喬治敦大學法學院副院長費能文（JamesFeinerman）指香港政制需要改革配合人民的民主訴求，他又認為，香港應設立憲制法庭，以確保司法制度獨立。  美國傳統基金會亞洲研究中心中、台、蒙古政策研究員譚慎格（JohnTkacik）也批評美國政府過去一面倒支持中國對香港政策，若華府真的支持香港人爭取民主，便應採取具體行動向中國施壓，包括暫停高級官員及議員訪問中國，及檢討美國高科技出口到香港的限制。
20040306-12,20040306,12,公務員或避免進一步開刀,公務員或避免進一步開刀 為了控制政府支出，前任財政司司長梁錦松積極削減公務員的編制和開支，但現任財政司司長唐英年在他首份財政預算案中，預料只會提及港府堅持小政府的角色，不會進一步向公務員開刀。不過，唐英年在籌備財政預算案時，盡見各界代表聽取意見，但很多公務員團體卻沒有被諮詢，公務員工會抨擊唐英年拒絕聆聽員工意見，而會計界則敦促港府，盡快將公務員的薪津與私人機構看齊。  兩位前任財政司司長踏出了控制公務員編制的步伐，曾蔭權早於二○○○至○一年度的預算案，已宣布削減當時的二十萬名公務員，三年內減至十八萬八千人。到了上年度梁錦松的預算案，更進一步把公務員編制再削減至約十六萬個。     公僕將削至16萬   現時公務員的編制已按步伐減至約十七萬三千多人，港府預期到明年三月底時，可以減至十六萬七千人，到○六年可達瘦身的目標。另外，港府又將在三月底，公布每年開支高達十億元的公務員子女海外教育津貼的削減方案。  畢馬威會計師事務所稅務合夥人王尹巧儀表示，公務員的開支佔政府總開支逾七成，「冇一間私人機構會出現呢個員工開支比例」。解決財赤要由縮減政府經常性開支入手，因而無可避免要全面檢討公務員的薪津支出。  她說，現階段暫不需要一刀切再削減公務員的工資，但港府卻應加快處理公務員的薪酬水平調查，以期盡快將公務員的薪酬與私人機構看齊。至於十七萬的公務員編制也屬過多，「有研究指香港公務員嘅人數，比新加坡多出超過百分之五十，但新加坡政府要兼顧國防保安，香港唔使，點解香港政府重可以請咁多人？」     無徵詢工會意見   公務員工會聯合會主席梁籌庭則批評，前任財爺梁錦松在準備預算案時，都有徵詢公務員工會的意見，但唐英年卻完全漠視員工的聲音。他擔心公務員將成為財政預算案中的主要開刀對象；而○五至○六年度完成的薪酬水平調查，也予下一任特首進一步削減公務員薪酬的口實。  香港高級公務員協會高級副主席潘偉明也強調，目前公務員的薪酬及津貼，以至員工人數，都已是減無可減。  本報記者
