key,date,article_daily_id,title,text
20041110-0,20041110,0,150師生郊野公園旅行出事中五女生墮崖全身骨折,150師生郊野公園旅行出事 中五女生墮崖全身骨折 【本報訊】沙田馬鞍山曾璧山中學的一百五十名師生，昨天在清水灣郊野公園進行「秋季旅行」時發生嚴重意外，一名十六歲女生在五十米高的懸崖上飛墮而下，全身骨折重傷昏迷。警方及消防處在事發個半小時後始接到報案，在巨浪險將女生捲走的剎那，用直升機將她吊起送院，經急救後情況嚴重。　記者：陸文超、鄭大康 墮崖女生楊慧欣，十六歲，就讀中五，與父母及兄長同住沙田，她目前仍在港島東區醫院急救，據楊的家人表示，女童全身包括手腳骨及肋骨折斷，而臉部擦傷嚴重，即使治癒亦會留下疤痕。楊父昨晚傷心地說：「個女好貪靚，其中一個心願係將來做模特兒，𠵱家唔知點算好。」     險遭上漲潮水捲走   警方消息稱，警員事後向參與今次旅行的教師了解事件經過，有人向警方表示，他們是在集合學生點名時發現少了一人，然後發動師生在附近山頭尋找了個多小時無發現後，才報警求助。  事發現場位於清水灣大坳門路的清水灣郊野公園，警方表示，昨上午，曾璧山中學的一百五十名師生，分乘四部旅遊巴，往上址秋季旅行。至下午二時十五分，教師集合學生點名時，發現姓楊女生不知所終，教師隨即分成多組，帶同學生四處尋找，但一直無發現，直至下午三時五十四分報警。  警員、消防員及漁護署人員在接報後，於附近山頭登山搜索，直至下午五時四十分左右，將軍澳分區警署軍裝巡邏小隊一名姓何的高級督察，終於在一處懸崖邊的草地上發現姓楊女生的學生證。何立即趴在懸崖邊向下望，結果發現一名少女倒在五十米下的石灘上，當時潮水正上漲，海水潑打在少女身上，但她一動不動。  何事後向記者表示，當時他估計，潮水持續上漲，會將事主捲走，於是立即召直升機支援。 疑拍照時跣腳墮下   飛行服務隊直升機於傍晚六時三十五分抵達現場，當時現場海面已揚起巨浪，二十分鐘後將事主救起送往東區醫院急救。警員稍後通知女生家人趕往醫院。  楊的父親為退休警員，他事後向記者說：「學校方面處理今次事件唔係太妥當，當老師發現有人失蹤，就應該立即報警，唔可以拖。」他表示，今次慶幸有警員發現女兒跌在地上的學生證，否則的話，女兒昏迷不醒下極可能會被海水捲走。  楊父說，女兒非常重視今次旅行，數天前已向家人表示，會考過後，大部份同學便各散東西，所以她帶同相機，與所有同學合照留念。楊父表示，他曾叮囑女兒要小心，想不到她竟然墮崖重傷。  據現場消息稱，參與今次旅行的全部是該校的中五學生，午膳時，各人正在現場一帶自由活動。警方估計，事主可能在懸崖邊拍照時，因草地濕滑導致「跣腳」，跌落山崖。
20041110-1,20041110,1,丙型肝炎20年後才病發,丙型肝炎20年後才病發 范徐麗泰透露丈夫於二十多年前輸血不幸感染丙型肝炎，香港大學醫學院肝膽胰外科主任盧寵茂稱，丙型肝炎主要是經由血液傳染，由於數十年前醫學界尚未發現丙型肝炎，因此不少接受輸血人士在不知情下感染。丙型肝炎絕少引發急性肝病，病人通常在感染後二十多年才出現肝硬化、肝癌，由於未有預防疫苗，故較難預防染病。  香港大學醫學院外科學系副教授廖子良指出，丙型肝炎在港不算普遍，由於控制病情藥物昂貴而且有極大副作用，晚期病人除非移植肝臟，否則難以治癒。
20041110-2,20041110,2,100元一對轉售　引發街坊搶購潮200元買千對“newbalance”,100元一對轉售　引發街坊搶購潮 200元買千對“newbalance” 【本報訊】大埔太和邨對開行人路，昨日出現「波鞋山」奇景。一名「收買佬」以二百元買下一批原本準備運往垃圾堆填區棄置的退貨“newbalance”名廠波鞋，事主起初以為只有幾十對，豈料運來的卻是近千對，千對波鞋堆在街頭，事主不知如何處理，惟有即場叫賣：「一百蚊一對！」結果無端端發達，賺個盤滿鉢滿。  「富貴逼人來」的事主黃先生，本身是一個小販，據他表示，日前有朋友稱有人有一批「公司退貨」的名廠波鞋，在清理貨倉時準備棄掉，只要他肯給工人幾百元車馬費便可以接收，問他有沒有興趣。黃答應後相約對方昨日中午十二時在大埔太和邨新和樓對開收貨。     夾雜退貨單據   黃一直以為只有幾十對波鞋，於是依時推着手推車到達；不久，對方駕着一輛密斗貨車到來，司機並拿出一對波鞋給黃「驗貨」，黃則給了二百元司機作車馬費，司機然後將車斗上的波鞋卸下行人路；突然，黃聽到「轟隆」的聲音，近千對波鞋如潮水湧至，瞬間在行人路上起了一個「波鞋山」，嚇得黃目瞪口呆。  直至司機將貨車開走，黃仍是「憂喜交集」，喜的當然是「物超所值」，憂的卻是一時間不知如何取走這座「波鞋山」。黃發覺鞋堆中夾雜有一些退貨的單據，有些註明「鞋舌甩線」，有些寫着「鞋邊撕裂」，但表面看來，大部份波鞋仍是十分簇新完整的。 驚動警員調查   不久，有街坊經過，以為有平貨執，於是一方面向黃問價，一方面則走進波鞋山中「尋寶」，黃靈機一觸，大叫：「名廠波鞋，公司退貨，一百蚊一對，任揀！」結果人群愈來愈多，最多的時候有五、六十人在尋寶。由於這些波鞋十分混亂，有人拿着「左腳」找「右腳」，有人拿到了「左右腳」又發覺不同尺碼，黃更要致電多名朋友到來幫手收錢。  由於情況混亂，驚動警員調查，警員了解後未有檢控黃非法擺賣，只是限他在一小時內清理現場，黃惟有立即電召一輛貨車到場將所有波鞋清走，但當時他已賣出近一百對波鞋，以二百元成本賺近一萬元，還未計算剩下的幾百對波鞋，事主可謂「發達囉！」
20041110-3,20041110,3,警周日起嚴打小巴衝燈,警周日起嚴打小巴衝燈 【記者謝明明報道】針對近期接連發生多宗涉及小巴的嚴重交通意外，警方將於下周日（十四日）起，在全港進行為期四星期的針對性打擊公共車輛超速及衝紅燈行動。警方認為，強制小巴裝設車速顯示器，有助檢控超速司機。  警方交通總部總警司林善政接受訪問時指出，近年涉及小巴的交通意外、投訴及檢控均有上升趨勢，今年首十個月涉及小巴的交通意外逾九百宗，較去年同期上升一成半。警方在九月時已設立專責小組研究箇中原因及制訂預防措施，並列出全港四十一處小巴超速及衝紅燈的交通黑點。  除加強道路安全教育外，警方下周日起會在全港進行為期四星期的針對性行動，打擊小巴等公共車輛超速及衝紅燈，屆時會調派警力加強巡邏，不排除派出便裝人員於有關交通黑點監察小巴等車輛有否超速駕駛。據了解，該四十一處交通黑點包括窩打老道及薄扶林道等。 續牌須裝車速顯示器   香港九龍新界公共專線小巴聯合總會主席梁雄表示，小巴業界昨與運輸署舉行會議後，同意將車速顯示器列入小巴營業牌照的續牌條款內。
20041110-4,20041110,4,蔡卓妍湖北撞車曾休克,蔡卓妍湖北撞車曾休克 【本報訊】藝人蔡卓妍（暱稱阿Sa）昨晨在湖北前往郊區拍攝外景途中，她乘坐的七人車與前方一輛汽車相撞，蔡在車廂中跌倒受傷，更一度休克，她被送到就近的木魚鎮（譯音）醫院，傷勢暫無大礙，今日她將返回本港接受詳細檢查。     跌倒頭撞前方座位   事發於昨晨十一時許，身在湖北拍攝電影《情天大聖》的蔡卓妍正乘坐七人保母車，前往郊區外景場地途中，這輛由內地司機駕駛的包車突然與前車相撞，當時睡眼惺忪的蔡卓妍在車廂內跌倒，頭部撞向前方座位，她即時暈倒，並一度休克。     今晨返港詳細檢查   工作人員見狀，立即將蔡卓妍送往附近的木魚鎮醫院，經初步檢查後證實她四肢並無受傷，蔡亦已返回酒店休息。但據悉，蔡卓妍清醒後頭部仍不時感到眩暈，為安全計工作人員取消原定工作安排，今晨會將她送返本港接受詳細頭部檢查。
20041110-5,20041110,5,「炒高薪舊人　低薪請新人」工會怒斥渣打無公義,「炒高薪舊人　低薪請新人」 工會怒斥渣打無公義 【本報訊】剛創下歷來最高半年業績紀錄的渣打（香港）昨宣布裁員二百人，包括各級員工，佔香港員工總數的百分之五，但同時招聘八十名批發銀行業務新人。銀行業工會代表崔世昌憤斥渣打「炒高薪舊人，再低薪請新人，無公義。喺唔好景時員工幫你捱生捱死，到你賺錢竟然裁員。」　記者：王倩瑜、譚暉 經濟發展及勞工局常任秘書長張建宗昨透過發言人表示，裁員事件反映個別銀行正面對服務轉型；但他指現時就業市場氣氛良好，部份財經機構正吸納人手，希望被裁的渣打員工盡快找到新工。勞工處轄下就業中心今起設立十個特別櫃位，協助被裁員工。  渣打（香港）今年上半年錄得二十三億六千八百萬元盈利，渣打董事王冬勝昨公布裁員安排時表示，被裁員工全部來自零售銀行業務，包括負責財務管理、信用卡及按揭業務的各職級員工，他們會獲得優於勞工法例的賠償。     王冬勝承認盈利不錯   王冬勝解釋，銀行業競爭激烈、市民借貸需求疲弱，在無選擇下才被迫裁員。他承認今年壞帳減少，盈利不錯，「但收益唔係好穩定……展望○五年樓宇按揭競爭大，信用卡卡主又無借貸意欲，所以用沉重心情做出相應（裁員）行動。」現職員工會獲發花紅及加薪，但他無透露加幅。  被問及在巨額盈利下仍裁員是否無情僱主時，王冬勝無作正面回應，僅強調裁員是因應架構調整，與內地拓展業務無關。另外，渣打的批發銀行業務現招聘八十人，配合銀行的大中華發展。渣打副行政總裁及總總理蘇利民補充，招聘新人將作改善現有分行網絡、加強營銷隊伍及開發新產品。 香港銀行業僱員協會總幹事崔世昌以震驚及氣憤來形容渣打的裁員行動。他斥責不少銀行正增聘人手，反映業界人手不足，渣打此舉只是裁退高薪員工，再用較低工資招聘新人。他批評打工仔好不容易捱過數年的減薪、凍薪、削福利潮，消費意欲剛好轉，就被渣打的大規模裁員破壞。港九工團聯合總會代表昨前往渣打中環總行請願，然後到銀行工會遞交請願信，抗議渣打在有盈餘下裁員，缺乏社會責任，要求銀行收回決定。  滙豐、恒生及中銀均表示暫無計劃裁員；其中滙豐及恒生銀行目前正招聘員工，滙豐發言人指，不排除個別部門要重整架構，但會盡量安排受影響員工調職。
20041110-6,20041110,6,塌篷意外　小業主或被追討2000萬元當局立例私樓法團買第三保,塌篷意外　小業主或被追討2000萬元 當局立例私樓法團買第三保 【本報訊】香港仔添喜大廈小業主因十年前的塌簷篷意外而面臨被追討二千多萬元賠償的事件，引起公眾關注小業主的法定賠償責任問題，當局已決定立例規定，私人樓宇業主立案法團必須購買第三者保險，最低保額為一千萬元，預計每座大廈每年需因此多付數萬元保費，亦有法律界人士指出，小業主為免賠償責任「上身」，可考慮用有限公司形式持有物業。     每年保費二至六萬   立法會民政事務委員會本星期五會召開特別會議，討論政府建議立例規定大廈業主立案法團必須購買第三者保險的問題，政府初步提出最低保額定為一千萬元，視乎樓宇的維修狀況而定，估計每座大廈的每年保費要二至六萬元，但一些失修的大廈，保險公司可能要求較高的保費才會承保，當局將於明年四月向立法會正式提交有關的條例草案。 遊行要求交代帳目   香港律師會社區關係委員會主席彭雪輝昨表示，市民若要避免賠償責任「上身」，可以在買樓時用有限公司的形式持有，但應先衡量有關的風險，因為成立公司亦需付出一定費用，若本身個人財產不多，成立公司最後的得益亦未必太大。  南區民政事務專員劉國材昨晚與五十名添喜大廈小業主開會後表示，今晚七時會在香港仔街坊福利會為業主舉辦大會，安排律師等專業人士為業主提供意見；而民政事務總署設立的熱線電話昨日收到二十三名添喜大廈的業主求助。  一批添喜大廈的業主昨晨亦在區內發起遊行，要求管理公司交代之前收取的百多萬元管理費及訴訟費。  管理公司表示，已根據破產管理處指示，將有關款項的戶口凍結，本星期五會向業主交代帳目。  現時申請將添喜大廈業主立案法團清盤的，是已墊支巨額賠償的大業主香港仔長勝置業公司，協助添喜大廈小業主的南區區議員石國強表示，長勝置業一直有與他們聯絡，部份小業主亦希望能與長勝達成一個雙方都接受的還款安排。
20041110-7,20041110,7,「凍結我層樓就跳樓死」,「凍結我層樓就跳樓死」 添喜大廈百多個小業主均沒有料到，買樓不但未能「添喜」，還為他們增添了許多煩惱和憂愁。兩年前被地產經紀誤導，以為不用負擔塌簷篷賠償而購下物業的方太慨歎，「第一次置業，以為有個安樂窩，點知搞成咁！」     已賠七萬還須再賠   方太昨日到民政事務處開會時愁眉不展，會議未結束她已「聽到冇心機」先行離場。她指出，兩年前才買入添喜大廈的單位，「當時經紀猛話唔使驚，唔使賠嘅！」他們一家並不富裕，現時還要償還銀行按揭貸款每月一萬元，現時三個子女還在求學，方太憂慮不能負擔巨額賠償。  現年七十多歲的小業主阮三妹則向記者哭訴：「如果凍結我層樓，我就跳樓死！」她表示，她和八十多歲的老伴楊喜添三十年前是小販，當時用了辛苦賺來的積蓄十萬多元購下添喜大廈一個單位，「以為有個竇口，點知到𠵱家咁大年紀至過唔得世！」她擔心至晚晚失眠，食不下咽，「好驚冇咗間屋，冇地方踎！」  另一年老的小業主羅帶好亦表示，之前已經耗盡積蓄，及向人借錢，賠償了七萬多元，無理由再要她賠償，她氣憤地說：「要畀，就畀我條老命！」  本報記者
20041110-8,20041110,8,男童17樓躍下氣墊救命,男童17樓躍下氣墊救命 【本報訊】天水圍天華邨一名十四歲中學男生，昨午放學歸家後疑沉迷打機，遭母責罵後爬出十七樓住所窗外，危坐石壆，二十分鐘後躍下，其母在屋內聞訊嚇致情緒激動，高聲哭叫，男童直墮樓下的救生氣墊再反彈落地身受重傷，與其母分別送院治理。  自殺男童姓郭（十四歲），與四十一歲姓莫母親住天華邨華萃樓十七樓一單位。由於郭童生長於單親家庭，生活不甚愉快，學業跟不上，去年曾留級重讀，備受壓力，近年他更情緒不安，需要到青山醫院接受精神治療。  消息稱，昨午四時郭童放學歸家後沉迷於打機，遭母薄責即大吵大嚷：「不如死咗算數。」他爬出客廳窗口，危站窗外石壆，其母嚇致不知所措，立即報警，又通知青山醫院派來社工協助。  消防員在對上的樓層縋繩戒備，又在樓下張開救生氣墊，警方將在樓下圍觀之數十名街坊驅散，其間男童見有消防員靠近，便沿客廳石壆走往十呎外睡房石壆，消防員惟有爬出繼續勸止。郭童時而站立，時而危坐，擾攘二十分鐘後，突然站起來轉身，瞬間躍下，直墮救生氣墊，再反彈落地面，口鼻滲血，救護員上前拯救時他仍清醒，目前情況嚴重。
20041110-9,20041110,9,冒充女護士　致電查詢性經驗男化驗員涉性騷擾強姦案受害人,冒充女護士　致電查詢性經驗 男化驗員涉性騷擾強姦案受害人 【本報訊】一名於公共衞生檢測中心擔任化驗員的二十九歲男子，透過工作接觸到強姦案受害人的資料，他涉嫌冒充女護士致電受害人，查詢對方性經驗及遇事經過。警方接獲投訴展開調查，並由女警「放蛇」，拘捕涉案化驗員，控以打出淫褻電話等六項罪名，案件昨在九龍城裁判法院提訊。  被告衞永佳於衞生署轄下的公共衞生檢測中心擔任二級醫務化驗員，現面對三項冒充公職人員，及三項打出令人厭惡（淫褻）的電話罪名，被告否認控罪，案件將於下月二十一日進行預審。     女警「放蛇」接來電   控方昨在庭上透露，被告因工作關係需化驗強姦案受害人的體液，並可以接觸到受害人的個人資料。警方接獲有關受害人投訴，指有人致電並查詢強姦經過及性經驗，於是展開調查。  警方「放蛇」把一些體液樣本及一個能聯絡到一位女警的電話號碼，裝成強姦案受害人的資料交給被告，有關女警分別於今年六月九日及七月七日，收到一位自稱是「廣華醫院陳姑娘」來電，對方在電話中講出淫褻內容。被告其後被上司發現在辦公室內講電話，而電話的另一端為該名女警，故當場被捕。  被告現獲准以二萬元現金及二萬元人事保釋外出候審，其間不得離開香港，需於每晚十一時至翌晨六時守宵禁令。另外，被告在候審期間不得接近位於南昌街的公共衞生檢測中心。  案件編號：KCCC13519/04
20041110-10,20041110,10,親友認屍　女性友人突「爆料」一屍兩命啤酒女郎死前曾啪13粒丸,親友認屍　女性友人突「爆料」 一屍兩命啤酒女郎死前曾啪13粒丸 【本報訊】深水埗南昌街「啤酒女郎」一屍兩命案昨晨有突破性發展，大批重案組探員帶同死者父親及一批友人往殮房認屍時，死者的一名女友突然「爆料」，稱事發前數小時，即事發當日上午十一時，死者曾致電給她，並在電話中說：「我已經啪咗十三粒丸仔，你估結果會係點！」  調查該案的深水埗重案組探員隨即帶走死者生前數名友人往警署提供資料，與此同時，再召鑑證科探員重返命案現場搜集證物。  警方消息稱，案件目前仍列作屍體發現案處理，至於死者的真正死因，有待法醫官做進一步毒理化驗。  案中死者王翠茵，二十二歲，生前任職「啤酒女郎」，與二十七歲姓冼男友同居於深水埗南昌街一幢唐樓的套房單位內。  前日下午二時許，姓冼男子報警，聲稱外出返家後，發現女友在床上昏迷不醒，警員到場後證實王已身亡。     手臂針孔「吊針」留下   調查該案的重案組探員稍後在死者的右前臂發現一處針孔，而死者父親表示案發前八小時曾接到女兒來電表示即將結婚，故警方認為案件有可疑，隨即帶走死者男友調查。  至昨晨，法醫官經初步驗屍後，證實死者生前已懷孕，而她手臂上的針孔，是數日前因自殺不遂被送院後，在醫院內打「吊針」所留下。
20041110-11,20041110,11,校外活動須遵教局指引,校外活動須遵教局指引 【本報訊】對於一名中五女生昨日參加學校旅行時墮崖重傷，教育專業人員協會副會長區伯權關注事件，他指墮崖女生幸保性命，但校方應檢討意外原因。其實現時教育統籌局有就中、小學舉辦課外活動發出指引，學校亦會每年均有投保「綜合保險計劃」承保學童參加校內或課外活動時發生意外的風險。     應先考察路線安全   區伯權稱，教統局的指引內雖沒有列明參加戶外活動的教師及學生人數比例，但一般而言校方會自行訂出安全標準，就是每名教師不可看顧超過三十名學生，而最安全的師生人數比例是三名教師照顧四十名學生。  根據教統局制訂的一套有關學校「戶外活動指引」，內容涵蓋陸上及水上活動，如遠足、露營、野外定向、獨木舟及滑浪等十一項戶外活動，校方及負責教師在安排上述戶外活動時要留意參加學童的能力、活動安全等，而且在出發前更要留意天氣變化，負責導師須於活動前作實地考察行程路線，並作出緊急應變計劃。  該指引亦建議，隨隊教師或導師應每隔一段時間點算人數，確保參加學童仍齊集隊伍中，若有關戶外活動涉及挑戰及體力鍛煉性質，更應有教師或導師在場從旁指導，而且至少要有一名曾接受急救訓練成員隨隊照應。  行山組織友峯會麥先生指，西貢大坳門清水灣郊野公園風勢強勁，是市民放風箏熱門地點。他補充，大坳門郊野公園部份位置靠近懸崖，存有一定危險，建議旅遊人士逗留在郊野公園的圍欄範圍內，免生危險。
20041110-12,20041110,12,未應「吹雞」　遭「大佬」教訓臥底警受刑鐵通擊背24下,未應「吹雞」　遭「大佬」教訓 臥底警受刑鐵通擊背24下 【本報訊】警方前年展開代號「船塢」的反黑行動，派遣卧底警員滲入黃大仙區三合會和勝和蒐集罪證。卧底警在四個月內親身體驗入會、「吹雞」、「收𡃁」及投靠其他三合會等活動，他曾因沒有應頭目的「吹雞」號召，被罰當眾赤膊跪下，接受鐵通毆背處分。涉案十二名年輕被告，昨日於區域法院審訊，其中八人認罪，餘下四人否認控罪受審。　記者：羅宇光 案中主犯為二十一歲男被告李志達，承認七項罪名，包括兩項以三合會成員身份行事、兩項參加三合會集會、一項邀請他人加入三合會、一項協助管理三合會及一項毆打傷人罪名，還柙候判。     成為三合會會員   另兩男五女被告，年齡十五至二十一歲，承認當中五項有關黑社會罪名，亦押後判刑。同案兩男兩女被告，否認三項有關黑社會罪名，今天續審。  控方案情指出，警方於○二年底展開「船塢行動」，派遣警員陳輝俊以卧底身份調查黃大仙區三合會活動。陳輝俊於十一月認識被告李志達，並應邀於翌月加入三合會，身份為「掛藍燈籠」，屬最低級會員，成為李志達的手下。李志達教陳輝俊在黃大仙區內應自稱其保家是「東頭邨和勝和飛龍」，在區外則應說「亞公」是「東頭邨和勝和樹雄」。  陳輝俊跟隨李志達期間，李志達曾「吹雞」糾眾找尋一名出言不遜的男子，因找不到便散隊。後來部份被告相繼入會，李志達安排他們成為陳輝俊的手下，並尊稱陳為「大佬」。○三年一月，李志達開會宣布「勝和大佬」已經潛逃，他與手下暫歸「九江街14」及「大環山老新」兩個三合會所管，李更教陳及其他被告「14K」職級、禮儀及談判規矩等。 卧底警員曾作供   同年二月某天，李斥責陳沒有應他前一天的「吹雞」號召，遂當着三名被告會員面前，命令陳脫下衣服，跪下受罰。李其後拿出一支鐵通，在陳的背脊打了二十四下。  警方在○三年三月採取行動，大舉拘捕二十多人，部份人於今年五月在裁判法院應審，卧底警員陳輝俊曾出庭作供。  案件編號：DCCC390/04
