key,date,article_daily_id,title,text
20041213-132,20041213,132,匯控股價軟　散戶信心弱港股料試低位,匯控股價軟　散戶信心弱 港股料試低位 【本報訊】美元反彈及美國本周可能再加息，市場憂慮資金流走，加上新國際會計制度將影響滙控（005）盈利，淡友藉消息沽滙控壓低大市，令恒生指數上周五失守萬四關。證券界人士預期，滙控今日仍有沽壓，大市將試低位；摩根士丹利報告指出，港股現價相對區內其他市場並不便宜，對港股持審慎態度。     大摩審慎看後市   摩根士丹利的亞太區策略報告指，本港明年經濟增長將由今年的7.8%放緩至4.5%；個別股份的估值已充份反映，推高港股的潛力極小，對後市態度審慎。但大摩看好長實（001）及思捷（330），目標價分別為79元及51元。  上周港股連跌4個交易日，上周五更受滙控拖累，恒指跌穿14000點，一周計共跌310點，技術走勢轉弱。  本報上周五晚所做的散戶指數電話調查顯示，135名有投資股票的被訪者中，只有52.59%預料本周港股可以止跌回升，比例為最近10周第二低，較之前一周的71.09%大減逾18個百分點，反映散戶信心大不如前。 新股錢回籠見轉機   至於沒有投資股票的市民，入市意欲也下降，上周198名被訪者中，只有4.55%表示短期內會入市。  是次調查於上周五晚6時半至10時半內，以音頻電話隨機抽樣進行，共訪問了333名18歲以上的市民，其中40.54%有投資股票。  興旺證券聯席董事姚浩然表示，港股走勢偏弱，加上滙控在美國掛牌的預託證券上周五收市價折算港幣約130.19元，較香港收市131.5元，再跌1.31元，相信投資者仍會藉滙控不明朗因素，推低大市。雖然美元反彈，但未見有資金流出本港，加上本周中期領匯（2382）及國航（753）陸續上市，被凍結的資金釋放後，屆時港股將有轉機。  另外，新鴻基地產（016）及新創建（659）上周五收市後宣布，放棄清拆紅灣半島，姚浩然稱，消息對新創建股價的衝擊較大，新地近期技術走勢偏弱，相信放棄清拆紅灣，會令股價進一步受壓。
20041213-133,20041213,133,一味窩輪：市況迷濛炒輪勿過勇,一味窩輪：市況迷濛炒輪勿過勇 台灣立委選舉，藍營贏咗，個市少咗一個壞因素。領匯（2382）上市司法覆核受唔受理，今日有結果，結果如何主宰短期大市方向。領匯事件中，諗起4個字，就係「過街老鼠」。  中移動C輪4476：大市欠明朗，炒C輪千祈咪太勇，一係等候領匯司法覆核受唔受理有結果後先至做嘢，一係等股價跌到較低水平時，博正股反彈而買佢哋啲C輪。  中移動（941）過去1周跌1.20元，收25.60元，若然跌到25元邊邊，可細注諗吓C輪，主角係4476，明年3月到期，輪價30仙，溢價3.4%，槓桿率10.2倍（有效7.1倍），引伸波幅30.6%。比較短期嘅2181與2206，溢價低啲，亦啱短炒，交投亦唔錯。  中電信C輪4499：中電信（728）過去1周跌0.20元，收2.75元，跌幅大過中移動。若見跌至2.65元左右，亦可博反彈細注買C輪。  中電信C輪交投、條件都遜於中移動C輪。4499輪價46.5仙，溢價3.5%，槓桿率5.9倍（有效4.3倍），引伸波幅37.6%，爆炸力係細啲，但勝在明年6月至夠鐘，大把時間。想槓桿率大啲，則揀4577，當然要畀高啲溢價。  聯通C輪：聯通（762）過去1周跌0.40元，收5.9元。再跌，估計會有支持及技術性反彈，冇乜C輪揀得落手，一係溢價太高兼無成交，一係屬數據好難計嘅特種輪。博反彈都只係適宜買正股。  章盛
20041213-134,20041213,134,點股壇：迪生毛利率顯著提升,點股壇：迪生毛利率顯著提升 廸生創建（113）於公布業績前，股價急升，公布中期增長9倍後，再進一步，而大股東配售1800萬股作價9.75元，使股價未能守穩於高價10.55元，此股於10月底成價只是6.30元，於急升之後仍可高價配售，反映市場依然看好。  廸生截至9月止的半年，業績頗令人滿意，盈利7756萬元，上年同期僅為771萬元，每股盈利27.5仙，中期息13仙，增380%。  期內營業額只增10%，香港只增5.1%，其他亞洲地區則增18%，就營業額看，上年同期受沙士影響，而自由行於上年7月才實施，今年則全期受惠，亦無沙士的影響，香港營業額增幅只有5.1%，顯然受惠於自由行有限。  從毛利看，增長22.5%，則有頗佳進步，毛利率由上年同期的41.8%升至46.5%，是增長的主要來源，銷售、行政及其他開支只增8.3%，聯營公司由虧損256萬元轉而獲利585萬元，也是因素，聯營公司主要經營中國業務。  期內增設精品店及專賣店58間，目前全球零售網路達386間，香港只有52間，但佔營業額59%，是包括若干批發業務在內，期內所增新店，主要是內地增設37間及台灣增設13間，目前內地精品店共140間，遍布25個省市，也包括深圳西武百貨，但估計內地業務的貢獻平平，反而設有精品店145間的台灣，成為香港以外的重要市場。 未來續有強勁增長   零售業慣例是下半年表現較佳，上年的下半年，已獲利1.12億元，該期內毛利率只是42.2%，今年上半年已升至46.5%，下半年旺季應不會下跌，因此，應有頗佳增長，但不能與上半年的增長9倍比較。11月初於旺角朗豪坊開設的西武百貨，佔地2萬方呎，表現甚佳，預期開業首年已可帶來貢獻，廸生表示對下半年非常樂觀，亦期待未來數年續有強勁增長。  保守估計，廸生今年增長可達90%或以上，股價9.90元，預期PE12.4倍，息率4厘，估計未來仍有上升空間，但經過大幅上升後，大股東配售亦滿足市場需求，股價需要鞏固，短線受交投不穩定所影響，配售後如仍無幫助，短線難炒，中線仍看好。  齊明
20041213-135,20041213,135,連環炮：地產股走勢不再樂觀,連環炮：地產股走勢不再樂觀 港股上周反覆回落至13901收市，10日及20日線相繼失守，9RSI跌穿50中軸，MACD向淡，從技術走勢看，恒指短線將下試13700。  然而港股上周的走勢與美股背馳，由於領匯（2382）的訴訟風波乃內部不利因素，故港股不能追隨美股上升。法院判原訴人勝訴並發出禁制令的機會不大，但潛在的上訴行動，必會打擊投資信心，海歌上周六已建議了一些應對策略，讀者可作參考。  滙控（005）更改會計制度，實質的影響其實甚為輕微，上周五港股的沽壓部份來自這個藉口，但相信滙控可守於129元之上，伺機反彈。當然，若法院出乎意料的頒臨時禁制令不讓領匯如期上市，則滙控129元將無險可守，很快會破關而下。  紅灣半島事件結束，結果不利新地（016）及新世界發展（017）之股價，對大市氣氛有一定影響。     紅灣事件損信心   事件的結局會受反對拆卸紅灣半島的市民及團體歡迎，政府也可舒一口氣。從環保角度看，這個結局是好的，但正如某大學教授接受傳媒訪問所言，香港的自由經濟已受影響，「政治」壓倒「法律」並非一件好事，香港不一定受這單一事件影響太深，但計及領匯事件以及未來可能陸續有來的類似事件，香港經濟可能要付出沉重代價。非商業與商業利益永遠存在衝突，市民若有不滿，應向政府施壓修改制度，而非動輒向商業機構施壓，這會對香港整體利益不利。  海歌一直對地產前景樂觀，但紅灣半島事件會令地產商投地時更為審慎，對樓市的前景會有一定的負面影響。地產分類指數已跌穿重要支持位，各個技術指標亦向淡，短線走勢已偏悲觀，指數處17530，跌穿17000跌幅將再度擴大。  海歌
20041213-136,20041213,136,期指戰況：大戶可能再震倉,期指戰況：大戶可能再震倉 期指上周以大陰燭下跌，周初升至14352高位後轉向，跌勢轉急，尤其是下破14100後技術指標全面向下，止蝕盤推動期指以13815低收，周五急跌189點，低水86點。  周線圖呈破頭穿腳走勢，動力指數急跌，全周波幅共562點，總成交合約共13.5萬張，對比前周增加，顯示淡友開始反攻，未平倉合約可能會下降。技術而言，期指在創出3年高位後回落，日線圖形態不利，再加上頂背馳壓力，令現貨及期指均轉向，並失守20日線。市場情緒開始由樂觀轉淡，雖然基調尚好，但大戶可能趁勢再次震倉，固此，短線的風險上升。  期指收市價已下破10月升浪以來的短期上升軌，更跌破0.618位，反彈阻力會在20日線之下，13960已有初步阻力，估調本周初在13640至14000內爭持。  H股期指上周急跌224點，周線圖呈大陰燭下跌，貼近10周線，動力指數跌至中軸區，後市有機會下試中期上升軌及50周線，主要支持在4500水平。周期形態已轉淡，10日及20日線已作交叉訊號，本周初下跌目標區在4570至4620，到位短線可平淡倉，中期牛熊轉向點則在4414。  寶維
20041213-137,20041213,137,周線穿頭破腳看圖捕先機：升浪暫告段落,周線穿頭破腳 看圖捕先機：升浪暫告段落 港股上周反覆下試低位，周三的急挫，下破10日線及升軌重叠區，已表示今次升浪將告一段落，而隨後的下跌，進一步確認跌勢。  恒指收報13901，全周有310點跌幅，即前周的進帳全數報銷，走勢向弱，一旦資金撤走，大市可能會進一步急挫。目前可以寄望的，是新股國航（753）及領匯（2382）退款回籠，能為大市帶來支持。  周線圖所見，恒指呈大陰燭，不論是烏雲蓋頂，或者是穿頭破腳，均屬利淡走勢，加上收市重回14000之下，顯示之前的上破，本質上為假突破。所以，港股後市走勢向弱。  支持方面，升軌與10日線（14118）重叠區支持已告失守，走勢上已處弱勢。下一個支持，約在10周線（13544），即50日線（13541）及調整升幅一半目標所在。  技術指標方面，大市回軟，周線圖DMI中的+DI與-DI差距進一步收窄，偏弱，MACD牛差距亦收窄，偏軟，短線指標STC與RSI已由嚴重超買區回落，下調壓力增大。  中資股方面，國企指數在5000區見沽壓，周線圖連呈兩支陰燭，形態上為雙飛烏鴉的利淡走勢，而日線圖的小圓頂更見明確，走勢並不樂觀，恐怕要下破250日線，在4400才可覓得支持；紅籌指數走勢與大市相若，亦是烏雲蓋頂的利淡走勢，其勢要下試1400支持。國企指數收報4693，全周跌203點；紅籌指數收報1500，全周跌63點。   是日建議：   瑞力控股（491）：陽燭，在0.017元見支持，成交增加，配合升勢，利好，現價買入，博其可升破10日線（0.0212元），目標價看0.022元，跌至0.017元以下止蝕。  安德利果汁（8259）：陽燭，上破降軌及平均線阻力，利好，RSI回升，上企中軸，亦利好，現價買入，目標1.25元，失守10日線（1.069元）止蝕。  寶光實業（084）：陽燭，升破近日高位阻力，MACD牛差距持續擴大，利好，現價買入，目標0.88元，0.70元線以下止蝕。  東尼
20041213-138,20041213,138,大股東星政府上車落車：利豐雅高超值,大股東星政府 上車落車：利豐雅高超值 利豐雅高印刷（623）掛牌逾13年，股份交投有時一片空白。上月15日成交284萬股，已屬少見，當日有此成交，是因為有「大手」184萬股易手，每股0.98元。  ■利豐雅高業務是書籍、雜誌及包裝印刷等，原屬楊一貴家族控制的公司，91年9月以每股1.28元招股，掛牌後股價最高2.73元，最低0.52元，現價1.02元。  去年6月，新加坡上市印刷公司SNP（新加坡國家印務出版集團）以每股1.42元收購利豐雅高，利豐雅高的英文名稱Leefung之前亦冠以SNP。新加坡政府全資擁有「淡馬錫」（Temasek），淡馬錫間接擁有SNP54.5%，SNP現時擁有70.1%利豐雅高。計算起來，星洲政府實益擁有利豐雅高38.2%，是控股股東。  ■SNP在星洲掛牌，按季宣布業績，利豐雅高跟隨。04年（12月年結）第3季，營業額2.76億元，增20%；純利2081萬元，增7%。首3季合計，純利3782萬元，較去年同期2070萬元大增83%，9個月每股盈利9.4仙，增幅相同。預測全年盈利5500萬元，大增144%，每股盈利由5.6仙增至13.6仙。  業績大進，最大原因是不再受03年沙士及美國入侵伊拉克事件影響，業務恢復正常。     05年PE4.8倍   ■利豐雅高3個月前，以現金4.04億元向大股東SNP收購兩家「立體及觸摸圖書」公司，以9月份兩公司的盈利410萬元計，收購作價PE約9.9倍。收購的壞處是利豐雅高借貸上升，估計現時借貸淨額4.50億元，淨負債比率62%，並不偏低。收購的好處是盈利增加，若以利息成本周息4厘計，公司每年盈利可增逾3000萬元，這個得益，可完全反映在明年帳目中，除非公司供股令股數增加，產生攤薄效應。  05年利豐雅高盈利預測8500萬元，每股盈利21.1仙，預期PE降至4.8倍。  ■9月底，每股帳面值1.86元，股價折讓45%，在印刷股中的折讓數一數二。  ●利豐雅高是印刷股中的超值冷品。1年目標價1.60元，折合05年預期PE7.6倍。去年SNP以每股1.42元收購時，最高1.80元。SNP往績PE9.5倍，可作參考。  何車
20041213-139,20041213,139,投資縱橫：台獨威脅並未消除,投資縱橫：台獨威脅並未消除 台灣上周六舉行立委選舉，結果是泛藍陣營勝回一仗，奪取過半數議席，令陳水扁控制立法院之希望落空，兩岸緊張氣氛似可緩和，但兩岸存在的問題以及台獨的威脅其實並未有解決。  在225個議席當中，藍營攻佔114個席位，只是些微大多數，當中國民黨、親民黨及新黨各佔79、34及1席，國民黨與親民黨有共同利益立場，但亦存在頗大的利益衝突，這情況可在過去一段時間兩黨在政治利益分配上的爭拗看得出來，未來會否鬧翻，對藍營能否在立法院制衡陳水扁相當關鍵。  綠營在選舉中受挫，會削弱陳水扁搞台獨的本錢，但卻不會削弱其搞台獨的決心。作為連任總統，他要在與北京改善關係及搞台獨之間作選擇，很明顯，他已明確地表明會選擇後者。那麼，他會因為沒有控制立法院而收手不搞台獨嗎？當然不會。除了立法院外，他還有很多方法、招數搞台獨，這點大家不用懷疑。  立法院在藍營之手，美國欲向台出售6000億元軍備自然難以通過，但阿扁要買槍炮，美國要收「保護費」，雙方料會採取一些手段促成交易，這些做法都不會有利兩岸關係。  台獨的問題若升溫，戰爭的危機變成事實的機會愈大，這點美國非常清楚，亦是美國對「台獨」態度轉趨強烈反對的原因。台獨活動最有可能在未來兩年趨活躍，對香港的潛在經濟威脅頗大，居安思危，不宜掉以輕心，要密切留意。  （本欄逢周一刊出）  冠　天
20041213-140,20041213,140,股市觀察站：年尾例旺似難出現,股市觀察站：年尾例旺似難出現 恒指上周下跌超過300點，跌穿10日平均線和14000的心理關口，10日線暫時維持上升，但假如恒指跌穿上周五收市價13901，10日線便會回落，成為初步的調整訊號。  滙控（005）近期兩度升至135元附近便掉頭回落，並低於20日平均線133元收市，為近日恒指帶來沉重壓力。滙控上周五以131.50元收市，僅輕微高於近一個月的低位130.50元，20日線上周五開始回落，若不及時反彈，走勢將十分不利，屆時有機會回落至120元附近。     藍籌走勢轉弱   「聖誕鐘，買滙豐」，傳統上12月是較有利於滙控，但11月創新高後，股價在高位被拋售，在好淡力量抗衡之下，年底前股價可能出現大幅波動，影響恒指亦較反覆。  由於3G和加拿大石油業務有利好消息，和黃（013）成為近期表現最好的藍籌股，上周升上今年最高位72.25元後，回吐2.50元，上周五收69.75元。現時股價仍高於20日平均線約3%，和黃走勢偏強，對恒指產生支持作用。  地產股的調整相信經已出現，新地（016）前周創出80.75元今年新高後有回吐，已掉頭下跌約7%，其20日線於上周五開始回落，假如未能及時反彈及進一步跌穿50日線（75.40元），跌勢將會加劇。 另一隻早前的強勢股太古A（019），上周亦跌超過5%，其20日線亦於上周五開始回落，短期頗大機會考驗50日線58.30元支持。長實（001）則因和黃強勢而企穩於20日平均線附近。由於滙控和地產股近期的調整壓力加大，年底前將對淡友有利，年尾例旺，不易出現。     美股走勢參差   美股通常出現的年底升市，同樣也未見實現，過去一個月杜指一直在10400至10600內窄幅拉鋸。上周具影響力的通用電氣大升近4%，再接近全年高位，反映美股利好的一面。但另一方面，英特爾的20日線率先回落，當納指升近全年高位而重要科技股卻反覆回落，並非佳兆。  （本欄逢周一刊出）  梁從源
20041213-141,20041213,141,701收料站：其士國際回吐可吼,701收料站：其士國際回吐可吼 其士國際（025）上周五公布中期業績靚靚，股價即刻有反應，彈升愈11％，收7.20元。原本小初以為消息刺激短暫，過後就會算數。  但經紀黃話唔係，聽講人哋重有後着，唔會咁短癮。相信隻股稍後陸續有消息，當中可能涉及收購合併之類，所以若見股價回落番多少，可以諗吓。  其士國際中期盈利比去年同期勁升66%，有成1.25億元，兼夾有中期息每股20仙派發，相當唔錯，所以上周五股價最高見過7.35元，收7.20元，升11.63％，成交股數187.79萬股，金額1322.5萬元。  其士國際盈利上升，主要係來自建築及機械工程，其中管道技術業務表現理想係重要推動因素，據講公司未來會以此為重點，繼續大力發展。  另外，早前股價已見異動的結好控股（064），上周五亦突然發難，急升23.49％，收1.63元。結好已講明唔會沾手濠江賭業，只係傾緊一間金融服務公司。但經紀陳話，傳聞今次炒上，主要來自濠江炒家的動力。  慕容小初
20041213-142,20041213,142,股海實戰錄：匯控企穩港股反彈,股海實戰錄：匯控企穩港股反彈 趙飛雲噚日入場為「精英大師」打氣，隻馬遠較預期贏得易，順利完成13連捷，不過時間56.8秒則非常普通，難怪贏來不費吹灰之力，似乎對手臨陣腳軟。香港出咗隻世界短途馬王，自然值得香港人驕傲，但願值得香港驕傲的不只是「精英大師」。  趙飛雲冇認購領匯（2382），但就將1手領匯的金額投注「精英大師」，聖誕大餐已經有着落。「精英大師」勝出後，相信全城的一個熱門話題，就是「精英大師」能否打破美國馬王「雪茄」保持的16連捷紀錄，以現時情況看來，機會相當大。「雪茄」當年斷纜時，趙飛雲剛巧在美國，新聞報道員對雪茄落敗的評述只是3個字，但印象深刻，這3個字就是「Nomorecigarette」。  講完閒話、講番正題，上周五美股升後回吐，杜指輕跌9.6，收10543，納指跌0.4%，收2128，而紐約期油再度回落至41美元以下，收40.71美元。  在美國預託證券上市的主要藍籌股，上周五表現參差，其中宣布更改會計制度的滙控（005），收130.19元，較香港收市價跌1.31元。但其他主要藍籌如中移動（941）、和黃（013）、長實（001）及新地（016）等則較香港收市價輕微收高，看來今日如果滙控保持平穩，港股有機會略為反彈，如能重新守在14000之上收市，則短期展望會轉佳。     新地太A伺機吸   上周曾提過打算吸納太古A（019）及新地，計劃暫時冇變，太A在59-60元水平會先買1注，以50日線58元作短線止蝕位；新地則會在71-73元水平先買1注，跌穿長期升軌70元止蝕。  趙飛雲
20041213-143,20041213,143,羅寶文擔大旗富豪系酒店變身,羅寶文擔大旗富豪系酒店變身 本港酒店業受惠於自由行，前景秀麗。在港擁有最多酒店的富豪酒店（078）趁勢大展拳腳，擔此重任的正是世城系主席羅旭瑞女兒、富豪酒店執行董事羅寶文。對於集團旗下酒店翻新擴展計劃，羅寶文已有腹稿，其中機場富豪將發展成針對企業客的一站式會展酒店；百利保（617）持有的西貢橋嘴島項目，則發展成結合醫療及玩樂元素的世界級度假勝地。  羅寶文接受本報訪問時表示，本港醫療服務達世界水平，故將引進類似泰國華欣著名度假村Chiva-Som的營運模式，在橋嘴島設置酒店、水療中心及多項水上活動設施，提供兼具醫療及玩樂的度假「套餐」。     橋嘴島引進水療中心   在Chiva-Som享受一個4天水療溫泉療程，收費近萬元。羅寶文直言，橋嘴島項目針對本地及亞太區高消費顧客，現已與多家世界級營運商，包括經營醫療服務的機構，洽談合作機會。不過，島上有小量地產項目，百利保向政府承諾預留公眾休憩地點。  羅旭瑞較早前表示，橋嘴島逾20萬平方呎發展計劃，總投資逾10億元。     機場富豪變會展酒店   至於機場富豪，將發展成亞太區一站式會議展覽酒店。她指出，機場富豪設有約20個功能房（functionroom）、全港最大的宴會場地，及逾萬呎商場，現正與世界級水療營運商洽談，設置水療中心，並在未用盡的空間，增加其他商業設施，配合機場展覽中心06年開幕。  她相信機場富豪有優勢成為世界級會議展覽酒店，希望提高住客消費之餘，可吸引海外企業客戶租住，作企業培訓及會議場地。  至於旗下另外4家酒店，除了銅鑼灣富豪香港將加建樓層，增加50至60間客房外，九龍富豪、沙田麗豪及富豪東方將進行大堂翻新。羅寶文指出，香港旅遊業愈來愈興旺，富豪需透過擴展增加市場佔有率及提高本身品牌，藉此提高酒店入住率及房租。  本報記者
20041213-144,20041213,144,投資學堂：匯控博逆境再創奇跡,投資學堂：匯控博逆境再創奇跡 世事經常出現很多奇妙的巧合，就以近日的滙控（005）為例，上周初，香港滙豐突然宣布多名極高層的人事變動，這消息在歐美亦有廣泛報道，可能是這因素，吸引了市場對滙控的注意，繼而便有些美國的財經傳媒評論滙控，好像《華爾街日報》在上周三便有就滙控作專題報道，題為「HSBCStockmaypaypriceforbank'sexpansionstrategy」，文中談到滙控股價的已相對偏高，升勢能否持續等問題。  繼而亦吸引了一些美國投資者的注意，亦在網上談論應否沽出滙控獲利回吐。跟着翌日（上周四），滙控在倫敦便發表聲明，指出採用新會計準則，將對帳目有重大影響（Significantmonetaryimpact），引致市場沽售。這一連串事件，好像一個跟着一個而來。  在過去兩年，滙控的升幅跑贏其他同類大型國際銀行股，例如在過去兩年，滙控股價大約上升了45%，同期Citigroup僅上升了20%，BankofAmerica上升了33%，Barclays則上升了28%，可見滙控股價表現較大部份巨型銀行股突出。 股價再挫吸納良機   至於欲沽出滙控當然因有負面因素，據《華爾街日報》報道，近期美國調高利率，將令滙控在美國的資金成本增加，估計這方面在日後Household的業績中將會反映。至於在亞洲區，尤其是香港，近年銀行業競爭激烈，正如上周渣打（2888）便預期今年在香港及新加坡這兩大亞洲市場的業績平平，盈利增長將會來自呆壞帳的回撥，若以此推測，滙控在本港的業務，可能亦不會太強勁。  此外，英國的按揭市場雖然持續增長，但近期已有減慢趨勢，相信這最終會影響滙控在英國的盈利。在上述因素下相信滙控本年的盈利增長一般，但其估值相對其他同類銀行股略為偏高，故近日已有個別外資行將滙控的評級調低。  另一方面，近期美國持續調高利率，但香港不但沒有跟隨，甚至更略為調低利率，反其道而行！基本上，這因素可能對滙控不利，因為在資本市場（MoneyMarket），滙控在美國是淨借入（NetBorrower），在本港則是淨借出（NetLender），在兩地利率一升一降下，對滙控的利潤亦有一定負面影響。  在過往多年，滙控經常能在業績中創造奇迹，在同儕表現不濟時，滙控的盈利仍有不俗表現，筆者相信今年滙控亦不會例外。故稍後當滙控進一步下調，應是另一趁低吸納良機。  譚紹興  電郵： ricky@rickytam.com 
