key,date,article_daily_id,title,text
20040923-29,20040923,29,神秘狂徒女人街六度飛磚,神秘狂徒女人街六度飛磚 【本報訊】肆虐旺角通菜街（俗稱女人街）的飛磚狂徒，目無法紀，昨晚在多次犯案現場再次高空擲磚，幸只撞及檔攤簷篷彈落地面，沒有傷及遊人或檔口物件，警方接報到場調查仍然毫無頭緒，這是一個月來第六次飛磚犯案。報案檔主不諱言，可能要戴頭盔開工，但又怕戴頭盔後令顧客不敢光顧。     警方調查無果   報案姓陳的三十二歲檔主，與三十歲胞弟在通菜街八十一至八十三號對開，經營一檔賣衣衫的檔攤，他說自八月下旬起，該名「神秘殺手」便開始在亞皆老街與奶路臣街一截通菜街擲磚，至今已是第六次，對上一次發生於本月十七日晚上，他的右腳被碎磚石濺傷，因感傷勢不重才不前往醫院。  昨晚八時半，姓陳檔主檔攤隔籬另一檔賣手袋成衣的檔攤，即通菜街八十五號對開，上空突然有一塊建築用的紅磚擲下，剛落在手袋成衣檔的膠簷篷，再反彈於行人通道路面，磚頭崩碎，幸無傷及遊人或檔口物件。  據稱，當時有一名外籍男遊客在檔口購物，見有磚頭飛下嚇至匆匆離開。在砰一聲時，姓陳的檔主聞聲即閃身入行人路躲避，事後他代為報警。警員到場調查一番無果，便收隊離場。姓陳檔主稱，在這條街的檔主無不成驚弓之鳥，且每日都有大批遊客到臨購物，若擲死人警方才重視案件，只會影響旅遊形象。陳的檔口過去曾數次被擲磚，更被掟穿簷篷，他不諱言曾考慮戴頭盔開工，但又怕戴頭盔後令顧客不敢光顧。
20040923-30,20040923,30,地鐵冒煙屬煞車故障,地鐵冒煙屬煞車故障 【本報訊】地鐵公司完成上周六一輛東涌列車冒煙事故的初步調查，證實起因是煞車系統故障，令煞車組件在高速行車時互相摩擦產生白煙，列車並無着火，白煙亦對人體無害；地鐵強調一個月內發生七宗事故均屬個別事件，地鐵每年都耗資二十億元進行更新，系統並未出現老化。     否認出現老化   地鐵車務主管劉焯民昨解釋，列車每個車輪都有一個煞車板及一個煞車碟，當要停車時，煞車板會壓向煞車碟，煞停車輪，上周六肇事東涌列車第五節車卡一個名為「煞車制動控制組合」的電子煞車系統發生故障，錯誤發出停車指示，令該節車卡共八個車輪的煞車板都壓向煞車碟，但由於其他車卡仍在高速行車，於是第五卡的煞車板與煞車碟便不斷摩擦產生高溫和白煙，煞車碟是鋼製，而煞車板則是由耐熱防火合成聚脂製造，故絕無火警危險，白煙亦無毒，他們已將故障系統送交英國檢驗。對於有乘客在事故中打開列車通風窗，他指若列車故障時冷氣停頓，乘客可打開窗增加空氣流通，但若車廂外有煙，乘客應通知車長及聽從指示。
20040923-31,20040923,31,燒炭死者家人無傷感,燒炭死者家人無傷感 【本報訊】疑變性無望前日在土瓜灣住所燒炭自殺喪命的三十三歲男子陳志聰，與其相識多年的著名「同志人」性權會主席邵國華昨表示，陳志聰並無向醫生要求提早進行變性手術，但他上周五會見心理醫生後，仍未獲醫生推薦接受手術，之後顯得情緒低落，估計他可能因變性一事受壓力而自尋短見。邵國華續稱，陳志聰雖然遷出獨居，但相信他無感情煩惱及經濟困難。該會及其同志圈中朋友已向死者家人表示慰問，將會盡量給予幫忙。  昨晨九時許，陳志聰的母親與另一名男家人一同到殮房認屍，其間他們均無表現傷感，反而言談甚歡。陳母事後更表示要趕回家照顧女兒，沒隨家人往辦理兒子後事。
20040923-32,20040923,32,人力資源浪費　嚴重過印度請人不當港年損390億元,人力資源浪費　嚴重過印度 請人不當港年損390億元 【本報訊】一項調查顯示，本港僱主未能善用人力資源，造成每年高達三百九十億港元經濟損失，相等於本地生產總值百分之三，幾乎等於香港每年的教育開支，浪費情況在七個受訪的國家及地區中最嚴重。有人力資源顧問公司建議企業應檢討招聘及管理模式，避免出現員工錯配。　記者：盧文烈 為了解各地僱主如何運用人力資源，人力資源顧問公司SHL與TheFutureFoundation今年首季訪問了香港、澳洲、印度、荷蘭、瑞典、英國及美國共七百名公司主管及二千五百名僱員。調查發現，本港每四名員工中便有一人在熟悉職務前離職。因每名員工平均要花六個月時間才適應工作環境，故此現象定對僱傭雙方造成嚴重損失。  調查又顯示，本港僱主平均需花兩成一的工作時間，糾正員工表現欠佳造成的問題，所需的時間較瑞典僱主高出兩倍。調查因此推算出本港僱主未能善用人力資源而造成每年三百九十億港元的經濟損失，相等於本地生產總值近百分之二點九九。  SHL大中華區測評業務總監余建中說，調查並不代表本港僱員工作表現較其他地區差，問題主要出於僱主在招聘及管理上有不足之處，造成員工錯配，他建議僱主聘請員工前多了解公司的需要：「除咗睇學歷之外，應徵者嘅性格都要做詳細分析，如果唔係，最終只會請到啲唔合心水嘅員工。」     八成港人慣常無償加班   另外，公益企業及港大向一千名僱員進行調查顯示，八成港人慣常無償加班，但兩成八受訪者表示會藉請病假以彌補所欠缺的休息，分別有四成五及三成人更表示，工作令他們筋疲力竭及抑鬱，負責調查的機構提醒僱員應留意超時工作對健康造成的影響。
20040923-33,20040923,33,僅增0.125厘　樓按供款加幅微港銀行加息幅度遜美國,僅增0.125厘　樓按供款加幅微 港銀行加息幅度遜美國 【本報訊】繼上月初象徵性加息後，本港昨再度跟隨美國加息，但像上次一樣，加幅少於美國；聯邦基金利率上調四分之一厘，本港銀行多數只加約八分之一厘。雖然加幅小，但仍是本地最優惠利率四年以來首次調高，業界一致把有關利率，從五厘增加八分之一厘至五厘一二五，置業人士每月供款將輕微上升，食息一族也受惠不大。　記者：劉美儀、鄺敏琪 本地銀行普遍把基本儲蓄利率，從○點○一厘增至○點一二五厘（即八分之一厘），以十萬元存款計，年息會由十元飆升逾十倍至一百二十五元，由可購買一份三文治「飛升」至足夠看兩齣戲。一些進取的中小型銀行則以高息力爭存戶，例如大新銀行集團旗下的豐明銀行，儲蓄存款利率高達○點七五厘，但業內人士指出，整體存款息率仍低，小市民欲求較佳回報需另闢途徑。     最優惠利率四年首調升   雖然今年美國先後三次加息，但本港最優惠利率則是四年來首次調升，有關利率增加八分之一厘後，以物業的按揭貸款額二百萬元計，分二十年攤還，按揭利率為最優惠利率減二點七厘計，業主每月供款額由一萬零四百零四元，增加一百二十元至一萬零五百二十四元，即使最優惠利率再調升○點二五厘，每月供款額亦只是增至一萬零七百六十九元。  滙豐、恒生、渣打、中銀香港、東亞、永亨、工商銀行（亞洲）、花旗、美國銀行（亞洲）等，宣布由今日起（渣打則由下周一起），將基本儲蓄利率從○點○一厘，升至○點一二五厘，中銀香港對二十萬元以上存款，則給予額外○點○五厘利息（即合共○點一七五厘）。  星展（香港）、永隆、大新銀行集團及中信嘉華銀行，均提供較高息率以吸引存款，除豐明利率高達○點七五厘外，中信嘉銀一律給予（不包括理財戶口）○點一七五厘儲蓄利率，大新對十五萬以上存戶則給予○點二二厘息率。  本港加息後，拆息市場及結餘均未有太變化，金管局總裁任志剛表示，息口去向由銀行決定，目前港元滙率保持穩定，低於七點八水平，暫未見有資金流出，銀行結餘仍維持數十億元，隨着息口向上，市民對供樓負擔上升亦應有心理準備，本港經濟正強勁復甦，他並不太擔心加息對本港經濟帶來影響。 王冬勝：市民負擔不大   銀行公會主席王冬勝表示，加息八分之一厘後，一般人每月按揭供款只增加約一百元，市民的負擔壓力不大，他預料今年美國仍會加息兩次。  工銀亞洲董事兼副總經理黃遠輝亦指出，在市場預期樓價將穩步增長下，相信最優惠利率輕微調高，不會阻礙市民買樓意欲，亦不致影響貸款需求。  滙豐銀行總經理柯清輝則估計，年底前聯邦基金利率將由現時一厘七五增至二厘。
20040923-34,20040923,34,停泊座駕不用找車位,停泊座駕不用找車位 【本報訊】在寸金尺土的香港鬧市，尋找停泊車位是駕駛者一大煩惱。西門子早前與香港理工大學合作，協助該校學生研發「泊車上架」的全自動化停車場，可為駕駛者找車位、停泊車輛或取車。西門子投資在理工大學工業中心的SIMATIC培訓中心昨天正式開幕，並展出該校學生利用中心設備而製成的「全自動化停車場」模型。     可用手機預定車位   停車場由五名理大學生和四名香港專業教育學院（青衣）學生組成的小組研發。理大機械工程系三年級學生葉盛源說，駕駛者只需把車輛停在指定位置，尋找停車位、停泊車輛、取車以及收費等全由自動化系統代勞，車輛會由自動輸送系統安排擺放在空置車位，車位有如貨架般由鋁架層叠組成。  葉盛源說，這類停車場在海外國家已使用，香港仍屬起步，九龍城一私人屋苑設類似車場，但只可容納五十個車位，若五輛車輪候入內需等十分鐘，但新設計自動化車場則可縮短至兩分鐘；駕駛者更可透過手機等預訂車位，亦可用手機短訊預訂取車時間。
20040923-35,20040923,35,清潔劑殺蟲劑擬納入規管,清潔劑殺蟲劑擬納入規管 【本報訊】政府為改善本港空氣污染情況，建議分兩階段規管可釋出「揮發性有機化合物」（下稱化合物）的印墨、油漆、噴髮膠、清潔劑與殺蟲劑等產品，估計有數千款含化合物的產品將納入規管。  政府會諮詢市民及業界兩個月，預計在明年年底實施第一階段規管。     違規最高罰款10萬   屆時進口及製造商要為含化合物的產品包裝貼上標韱，標明含量及提供測試報告；若規管未能達致預期效果，政府到○六/○七年進一步管制含化合物產品的含量，並鼓勵生產商棄用。  環境運輸及工務局局長廖秀冬昨在記者會上稱，揮發性有機化合物與氮氧化物產生光化作用，形成臭氧；臭氧濃度高時可引致眼部不適及令市民出現上下呼吸道病徵等。化合物又會令懸浮粒子增加，使能見度下降。港府在前年開始與廣東省政府合作，希望透過合作及規管含有關化合物的產品後，將空氣中的有關化合物含量在六年內減少五成五。刑罰方面，政府建議違規者可被罰款五至十萬元，及監禁最多六個月。  市民可致電25946218查詢諮詢文件詳情。
20040923-36,20040923,36,九巴研究延長老人假日優惠,九巴研究延長老人假日優惠 【本報訊】九巴長途線及長者假日車費優惠將於本月底屆滿，九巴執行董事伍穎梅昨日表示，積極研究延長是項優惠，希望盡快會有好消息公布。  伍穎梅昨日出席九巴版圖2004慈善義賣記者會時，被問及油價上升會否影響延長車費優惠的決定，她強調，油價方面的因素不能與車費優惠混為一談，九巴已實施多項成本控制措施，今年上半年的整體乘客量上升超過百分之二。  至於會否加薪給予屬下員工，伍穎梅表示，會等至明年四月與兩個工會開會後才有決定。
20040923-37,20040923,37,車長被迫跳線新巴或現工潮,車長被迫跳線新巴或現工潮 【本報訊】新世界巴士分會不滿新巴公司自今年初起，對車長實施苛刻制度。包括要求車長「跳飛機」，即在一更內駕駛不同型號的巴士，又強迫車長「跳線」，在一更內駕駛不同的路線；甚至安排他們「早茶作午飯」、「宵夜當晚餐」。該會警告新巴，若不解決問題，工會不排除採取按章工作等工業行動。     每更要行六條線   新世界巴士分會主任朱本典昨在記者會上稱，新巴車長被迫「跳飛機」、「跳線」的情況，最嚴重甚至是車長在每一更要駕駛七部不同型號，又或五至六條不同路線的巴士。他指出，該會過去曾就有關問題與新巴多次開會，但都沒有結果，而該會於上月五日及十三日分別向運輸署和勞工處反映，但至今仍未獲改善。  朱本典譴責新巴，對車長實施的工作安排，除增加車長壓力，影響他們的表現外，最終更危害乘客安全，新巴及運輸署實責無旁貸。  新巴發言人回應稱，安排新路線時會先讓車長熟習，才正式駕駛。為了靈活調配及讓車長輪流休息或用膳，公司才可編配車長駕駛不同路線。新巴會就這問題，下月初與工會見面。
20040923-38,20040923,38,35%受訪者懵然不知超標全港肥人154萬,35%受訪者懵然不知超標 全港肥人154萬 【本報訊】衞生署一項港人體重調查發現，三成四受訪市民屬過重或癡肥，以此推算，全港近一百五十四萬人體重超標，健康亮起紅燈。更嚴重的是，衞生署發現約三成半受訪的過重人士，竟懵然不知已超標，還以為自己體重正常，而且只有一成半人有進行減肥。　記者：倪清江 衞生署去年一月透過電話，成功抽樣訪問逾一千七百名年齡介乎二十至六十四歲的市民，由他們自行報告身高及體重，再計算出他們的「體重指數」（BMI），然後根據亞洲人標準，將他們分為癡肥、過重、正常及過輕四個類別。  調查結果顯示，逾五成受訪者身體指數屬於正常水平，癡肥及過重各佔約一成七，餘下約一成二屬於過輕（見表）。以此比例推算，全港該年齡組別人士當中有八十萬人屬癡肥，七十四萬人過重。報告特別指出，一般人傾向「報細」體重，卻誇大身高，暗示肥胖人口比率實際可能比調查更高。     男士較女士多   有四成三受訪的男士屬肥胖級，比率較女受訪者多六成；男性肥胖一族最多介乎三十五至四十四歲，女性肥胖人士則以四十五至五十四歲最多。不過，有一成半受訪女士體重過輕，較男受訪者多出近一倍，她們主要介乎二十至二十四歲。  報告指出，兩成一癡肥受訪者不同意他們癡肥，另三成五超重人士也不認同他們過重，而且只有兩成四癡肥人士及一成半過重人士有減肥，多數是靠做運動及控制飲食。     可引致糖尿病   衞生署在報告中指出，錯誤評估體重，情況可大可小，「例如，一名癡肥的男士會忽略針對他的減肥建議；一名過輕的女士減肥，情況更令人憂慮。」  醫學會會長蔡堅指出，上述調查顯示香港是亞洲區內肥胖人口最高的城市之一。他相信是環境限制，令市民不欲做運動：「工作時間長咗，有時間都用嚟休息瞓覺。」他警告，糖尿病及不少心血管疾病都是由肥胖引起，若情況持續，肥胖人口將來會為公共醫療體系構成重大壓力。
20040923-39,20040923,39,起重車倒車撞死人,起重車倒車撞死人 【本報訊】昂船洲昂運路中流作業區一個貨櫃場，昨晚七時發生奪命工業意外，一名工人被一輛倒後的貨櫃起重車輾斃，警方及勞工處正調查意外起因。  死者姓蕭（六十三歲），為一間物流公司的工人，肇事起重車司機姓黃（三十六歲），據他向警方稱，事發前正操作起重車吊運貨櫃箱，當他將車後退時不覺有人在車後，其後他將車向前及轉右時，才發現一名下身受傷男子躺卧其車後地上，立刻通知貨櫃場人員及報警。警員及救護員到場證實他已死亡，懷疑他被起重車撞倒輾斃，實情有待進一步調查。  本月七日下午五時許，葵涌七號貨櫃碼頭亦曾發生相若意外，一名保安員姓梁（五十三歲）被一輛倒後泊位的起重車撞倒及捲入車底死亡。
20040923-40,20040923,40,丈夫婚外情少婦割脈,丈夫婚外情少婦割脈 【本報訊】二十三歲姓蘇少婦疑受丈夫婚外情困擾，昨凌晨二時許，在土瓜灣美景街順安大廈住所飲酒澆愁，然後打爛煙灰缸用碎片割左腕自殺，幸她及時致電友人訴苦由對方報警。  警方到場將事主送院，並帶其兩歲兒子同行，其間事主聞愛兒受驚哭泣不止，立即將他摟在懷內柔聲安慰。
20040923-41,20040923,41,工人遭巨型水管壓腳,工人遭巨型水管壓腳 【本報訊】新界北區打鼓嶺坪輋五洲路一個擺放建築材料的露天貨倉，昨上午十一時半，六十歲姓何工人推着一架木頭車經過一處堆積如山的巨型水管時，疑木頭車撞及水管，雖然水管未有倒下，但底部的水管則移位壓着其左腳。  何動彈不得自行用手機報警，消防員到場將他救出送院治理，並無大礙。
20040923-42,20040923,42,醉漢炒車躲入料理店,醉漢炒車躲入料理店 【本報訊】一名醉漢昨凌晨疑酒後駕駛私家車，在西貢越線與一輛的士迎頭相撞，導致的士司機受輕傷。肇事司機事後與車上一名女乘客棄車，躲入一間日本料理店樓上一單位，警員在目擊者協助下尋獲涉案司機，驗出酒精超標將他拘捕。  涉嫌酒後駕駛及肇事不顧而去被捕男子姓梅（三十八歲），於昨日凌晨零時許，與一名女子在西貢普通道近西貢公路一間日本料理店消夜後，滿身酒氣至對面天后廟旁露天停車場駕駛一輛四驅車離開，左轉入西貢公路出九龍，疑司機酒後失控越過對面線行車仍不自覺，行駛二十多米後即與一輛新界的士相撞，幸姓陳（四十五歲）司機僅輕傷。  消息稱，意外發生後日本料理店有職員走出查問，四驅車司機與職員傾談後，棄車與車上女乘客進店舖樓上一單位。警員趕至將受傷的士司機送院敷藥，在目擊者協助下，到附近一單位內尋獲涉案司機及女乘客，司機接受酒精呼氣測試後證實超標四倍被捕。
20040923-43,20040923,43,15男求職　破財八千布伴遊騙局工人收監,15男求職　破財八千 布伴遊騙局工人收監 【本報訊】一名裝修工人涉布下招聘「男伴遊」騙局，在報章刊登「男女快錢」廣告，要求應徵者繳付手續費，從而騙取十五名求職男子約共八千元。該工人昨在荃灣法院承認十五項欺詐罪，聲稱曾遭同樣手法受騙，裁判官斥責他所犯罪行嚴重，計劃周詳，判監十個月以收阻嚇。　記者：陳浩義 二十八歲被告陳子樂，裝修工人，十五項罪指他於○三年八月二十七日至本年三月二十七日間，聲稱可介紹工作給十五名男子從而欺騙金錢。  律師求情表示，被告已婚，沒有案底，中五畢業後，曾任地盤測量員，轉職裝修工，月入約九千元。  被告被捕至今已囚柙半年，他對事件感後悔，希望輕判，讓他早日出獄照顧患病年邁母親，同時懇請法庭可讓他親手撫摸初生的兒子。  裁判官宣判時表示，以人道理由批准其要求，可在獄中親撫從未接觸過的兒子，但被告所犯罪行為法律不容，須判阻嚇刑罰。  案情指出，被告在報章刊登「男女快錢」的招聘伴遊廣告，然後相約應徵的事主到尖沙嘴美麗華酒店會面，聲稱可介紹工作，酬勞由二千元至五千元不等，但要求應徵者先付二百元手續費。     登「快錢」招聘廣告   事主其後未獲工作，被告在電話中聲稱顧客已取消交易，老闆認為事主所存的手續費不足，故不會安排工作，更訛稱會歸還金錢，最後其中三名事主報警。  被告於本年三月一日前往刊登廣告後，遭探員跟蹤至停車場拘捕，在被告身上撿獲兩部手機、十張他人的信用卡、刊登廣告收據及兩本記事簿，從記事簿發現十五名事主的姓名及電話號碼。  被告於警誡下承認根本安排不到有關工作，該些信用卡是向人購買以方便收錢。  案件編號：TWCC756/2004
20040923-44,20040923,44,地產界：加息無礙買家入市,地產界：加息無礙買家入市 【本報訊】本港按揭利率終於進入上升周期，但今次未有全面跟足美國的四分一厘幅度，只加八分之一厘，每一百萬元貸款額（以P減二厘七五供二十年計算），每月供款多六十元。業界認為，供樓負擔只輕微增加，近期樓市也有利好消息支持，加息無礙買家入市，僅個別二手業主願意擴大議價空間。  利嘉閣地產董事總經理何紹章指出，利率加幅溫和，供樓人士負擔增加輕微，樓市近期升勢強勁，加上市場上優惠的按揭產品，可抵銷加息的影響，相信不會影響買家入市步伐。美聯物業也指出，平均供樓負擔比率，只由百分之二十四點二，增至二十四點五，大部份屋苑未有改變「供抵過租」的情況。  小業主對加息未有太大反應，未見即時封盤或減價求售。不過，中原地產助理營業董事譚桂貞則指出，將軍澳區有個別業主憂慮加息後樓市轉淡，增加議價空間促銷，如維景灣畔低層單位，業主加息前議價空間五萬元，昨日則增至十萬元。     實物投資興趣轉濃   經絡集團副行政總裁盧子勇表示，在加息周期開始，定息按揭產品會受買家歡迎，預期銀行會繼續推出有關產品；而採用定息的比例持續上升，七月已達一成二。  地產發展商普遍樂觀。九龍倉置業董事黃光耀指出，雖然低息周期完結，但隨着通脹來臨，樓價趨升，市場對實物投資興趣轉濃，加息反而會提高投資客入市意欲，料投資客入市比例逐步增加。  恒基地產營業部助理總經理林達民則指，就業情況轉穩定，「打工仔」工作安全感增加，足以抵銷加息壓力。相反，就業市場前景不穩，「即使減一厘都冇刺激作用。」  恒隆地產主席陳啟宗更表示，香港加息對本港樓市在心理及實質上都不會有影響。他指出，最優惠利率調升幅度有限，在未來一至兩年不會對樓市有影響，因為香港已經歷一段很長時間的低息期，息口上升亦不會出現惡性通脹。
20040923-45,20040923,45,貨車頭撞凹狂撼婦人,貨車頭撞凹狂撼婦人 【本報訊】四十九歲姓蔣婦人，昨午一時許由灣仔告士打道橫過馬路時，遭一輛運魚貨車猛撞飛彈六米外地上，頭部重傷大量流血，運魚車車頭撞至凹陷，傷者同行友人立刻上前安慰和報警。救護員趕至將傷者送院，初步懷疑她腦部受創需施手術搶救。貨車司機事後通過警方酒精測試，警方呼籲目擊者提供資料。  梁偉權攝
20040923-46,20040923,46,泊位溜後跣落明渠,泊位溜後跣落明渠 【本報訊】一輛四十呎長貨櫃車，昨凌晨三時半，由姓梁（四十二歲）男子駛到屯門五柳路一處空地停泊。其間司機疑沒有拉上手掣，貨櫃車溜後撞爛圍欄跣落八呎深、四十呎闊的大明渠內（圖）。貨櫃車沒有損毀但車頭仍然擱在路面，司機無受傷驚魂略定，自行爬落車報警求助。  區恩傑攝
20040923-47,20040923,47,古廟金箔佛牌被盜,古廟金箔佛牌被盜 【本報訊】有一百二十年歷史的筲箕灣愛民街「洪聖古廟」，昨午三時許，八十四歲的義務廟祝「德叔」返回打點時，發現原本放在神壇上的洪聖爺佛牌不翼而飛（圖），懷疑被人偷走於是報警。德叔事後表示，失竊的木製佛牌貼滿金箔，約值數千元，數年前，這廟亦曾被賊人偷去兩尊觀音像。  溫文學攝
20040923-48,20040923,48,忘關尾板失80萬貨,忘關尾板失80萬貨 【本報訊】九龍灣發生偷竊八十萬元手表零件案，昨上午十一時許，三十四歲姓杜貨車司機到宏泰道一幢工業大廈提取五十多箱手表零件，他報稱忘記拿取貨單遂返回公司，可是忘記關上貨車尾板（圖），事後發現車上其中九箱、共值八十萬元零件失竊。警員發現卸貨區閉路電視攝下賊人偷竊經過。  羅日昇攝
