key,date,article_daily_id,title,text
20041213-29,20041213,29,受盡歧視　慘遭騙財　仍堅持出書失明女克服障礙圓作家夢,受盡歧視　慘遭騙財　仍堅持出書 失明女克服障礙圓作家夢 【本報訊】「只要相信童話，童話就會發生！」汪明欣小時候曾六度接受角膜移植都失敗而失明、留學澳洲飽受種族及殘疾歧視而影響升學、回港考上演藝學院竟因失明而被校方置於候補取錄名單上、想出書又遭無良出版商騙去按金……但抱着世間總會有童話的信念，終於成為本港首位華人失明女作家，昨天為其著作《如果你相信童話》舉行新書簽名會。　記者：雷子樂 年僅二十六歲的汪明欣，昨為自己新書簽名會獻唱時激動得落淚走音。她十分珍惜今天的一切，因經歷了不知多少次奮鬥、絕望再奮鬥，才有這成就。明欣兩歲時患肺炎及德國麻疹令視力受損，六次接受角膜移植手術都不成功，八歲時視覺神經終於壞死。     兒時愛閱讀童話   在患得患失的感覺間度過童年，閱讀童話給她帶來希望。安徒生童話、長腿叔叔等凸字書，她讀得滾瓜爛熟，童話完美的結局是她面對失敗的心靈寄託。她在心光盲人學校完成中二後，為向家人證明自己能獨立生活，成為本港首位赴澳洲升學的失明人，但留學兩年後因歧視問題令她找不到升學機會，被迫回港重讀中三。  樂觀的她仍慶幸留學時學會獨個兒洗衣、煮飯。中五畢業後她投考演藝學院欲念聲樂，又因校內沒有足夠照顧失明人的設施而被校方置於候補取錄名單上，幸而現仍能在公開大學修讀語言及繙譯。  明欣以「樂澄」為筆名，花了兩年時間學習電腦和寫書，處女作《如果你相信童話》內容是透過一個心理醫生的遭遇，描寫出一個勵志愛情故事。
20041213-30,20041213,30,增加收費難阻內地婦來港產子,增加收費難阻內地婦來港產子 【本報訊】立法會衞生事務委員會今日討論政府建議六項紓緩內地人士來港使用本港醫療服務問題，包括提高入院按金及收費，「走數」者必須繳交附加費等建議；但有醫療界人士在昨日的《城市論壇》上均認為，增加收費無效，其中代表醫學界的立法會議員郭家麒說，加費只會令走數更嚴重，當局應與內地商討如何禁止孕婦來港。  他又稱，有些內地孕婦在懷孕八個月仍可持商務簽證來港，以往內地海關採取嚴緊措施防止孕婦來港，但自由行實施後即放寬。他認為，去年有一萬名內地婦來港產子，以每名孕婦使用兩萬元計，已用了本港兩億元。     護理人員壓力大   代表衞生服務界的立法會議員李國麟強調，因內地孕婦已令六間產科醫院，婦產科使用率由七成急升至百分之一百二十，護理人員壓力極大，令六間醫院婦產科護理人員病假數目在過去半年達八百日，他擔心此問題會嚴重影響本港整體醫療服務。
20041213-31,20041213,31,逾萬斑蝶來港過冬,逾萬斑蝶來港過冬 【本報訊】踏入冬季，數以萬計色彩絢爛的斑蝶來港過冬。香港鱗翅目學會為找尋這批過冬斑蝶的來源地，聯同香港大學生態學及生物多樣性學系舉辦全港性追蹤過冬斑蝶遷離調查。     歡迎市民參與調查   該調查將於本月至明年一月期間，在斑蝶過冬的地點捕捉一千隻斑蝶，並在斑蝶左右翅底面做標記。  該會並邀請中學生義工於明年一至三月，到各處找尋有記號的斑蝶，以及在斑蝶幼蟲寄主植物上找尋斑蝶的卵和幼蟲，然後滙報。  該會歡迎市民在該段期間參與有關工作，將資料填寫在該會網頁  http://hkls.org  上。該會稱，每年十一月至翌年二月，均會有大量斑蝶在本港的樹林群集過冬，每個地點的斑蝶數量多達一至四萬隻。
20041213-32,20041213,32,珊瑚樹適應力強栽種容易,珊瑚樹適應力強栽種容易 珊瑚樹（Viburnumodoratissimum）形態優美，是常綠小喬木，樹幹呈灰褐色，橢圓形的葉為對生單葉，縱脈與支脈交接處常有小撮黃幼毛。  春季白色小花綻放，花瓣細小，向外反捲，花蕊伸出花冠以外。果實也是橢圓形，夏季成熟，初時呈紅色，熟透時會轉為紫色，活像一串串迷你葡萄。各種食果鳥類常聚集樹上享用甜美的果實，讓我們在觀樹之餘，也可聽到群鳥唱詠！ 珊瑚樹適應力強，栽培容易，是理想的遮蔭和觀賞樹。其根、葉、樹皮均可入藥。  甚麼是對生？葉的排列方式，指葉片長在莖上同一位置的兩側。  撰文：漁農自然護理署
20041213-33,20041213,33,村民曾聯署求搬遷　昨毀消防鐘燒垃圾10歲孖寶破壞王又反轉大窩口,村民曾聯署求搬遷　昨毀消防鐘燒垃圾 10歲孖寶破壞王又反轉大窩口 【本報訊】被街坊形容為「反轉」荃灣大窩口邨、住客曾提出發起全邨簽名行動要求其一家遷出的一對十歲「百厭孖寶」孿生兄弟，昨凌晨疑悶極貪玩，先走到住所毗鄰大廈，用掃帚擊毀其中兩層樓的消防喉警鐘玻璃，然後結伴到樓下公園，將垃圾桶蓋及小量垃圾放在滑梯組合上，再用打火機放火燒毀，被巡經保安員發現當場逮着。消防員到場將火救熄，「孖寶」兄弟則被接報警員拘捕帶署。　記者：黎志偉、吳淑義 被形容為反轉全邨的百厭孖寶孿生兄弟姓黃（十歲），他們涉嫌刑事毀壞及縱火，事後各准以現金五十元保釋候查，於本月三十日再返警署報到。小兄弟昨日遭母親勒令留在家中，連邨童相約他們釣魚也被禁，但至晚上九時，兩兄弟又離家出現在樓下公園嬉戲，甫見記者卻「快閃」離去。  街坊稱，小兄弟生於單親家庭，與姓劉（三十一歲）新來港母親、一名就讀小五的十一歲胞姊，同住大窩口邨富德樓一單位約三年，靠申領綜援金維生。兄弟兩人均在大廈街一間小學就讀三年級。不過三姊弟經常逃學，一直有社工跟進個案，若非社工登門到訪，他們也不肯回校上課。小兄弟向外聲稱其父親多年前病逝，但母親甚少照顧他們，即使他們徹夜不返家到處流連露宿也不理，每日僅給予十多元自行買食物果腹，其入住老人院的外婆則間中登門探訪。     經常炫耀不怕警察   街坊續稱，小兄弟與其胞姊均十分頑皮愛搗蛋，本性聰明但品格壞。由於他們犯事頻頻（見表），經常被帶返警署，有警員還形容該對小兄弟為「常客」，連葵涌警署的所有人也認識他們。沒料到有人卻引以為榮，常向邨童炫耀他們的惡行，更聲稱兩兄弟因多次偷竊，曾雙雙被判入住兒童院，還威風地揚言：「我哋係唔驚警察㗎！」 其中原居住小兄弟對面單位十多年的李女士稱，他們一家遷入不久，全邨居民便無日安寧，更有住客曾提出發起全邨簽名行動，藉此向房署施壓要求對方一家遷走，但被房署拒絕。李女士稱多次遭兄弟深宵按門鐘及用力關門等噪音問題滋擾，又被兄弟用電芯擲向其魚缸，她向黃母投訴卻不果，反被對方指摘：「你冇本事教好我個仔，就唔好喺度講咁多嘢！」結果她忍受僅一年，便主動調遷同邨另一單位。     曾「持槍」行劫店舖   另外，街坊指三姊弟常夥同到邨內多間商舖偷竊食物及玩具等，兩年前三姊弟更向邨內一間店舖「持槍」行劫，胞姊負責把風，兩兄弟持假槍入內犯案，被東主認出報警將他們拘捕。街坊笑說：「佢哋好一視同仁㗎！全邨間間舖都偷勻晒，唔會唔偷是但一間嘅！」其中身受其害的麵包店東主怒斥：「佢哋真係神憎鬼厭！化咗灰都認得佢哋呀！」而洗衣店東主則表示曾好心給錢三姊弟買食物果腹，沒料到之後常被對方前來要錢。  事發昨凌晨零時許，有保安員巡經大窩口邨富德樓對開公園，發現小兄弟將垃圾桶蓋及小量垃圾移往滑梯組合上，然後用打火機放火燒毀，即時將他們逮着報警，由消防員到場將火救熄。警員趕至調查期間，另有保安員巡經富國樓六樓及十一樓走廊時，發現該兩層的消防喉警鐘玻璃被擊碎，經警方查問下，兄弟兩人亦承認涉案，事後雙雙被捕帶署。
20041213-34,20041213,34,同行女友困車廂溺斃飆車衝落水庫港人身亡,同行女友困車廂溺斃 飆車衝落水庫港人身亡 【本報訊】廣州消息：一名香港男子偕內地新相識女友，前日凌晨乘坐友人改裝跑車，一行四人從中山市出發飆車，當他們駛到廣州市郊區的帽峰山時，疑因超速失控撞毀路邊石躉，全車衝落三米深的水庫，司機及另一內地乘客破窗自行游上岸，港人與女友則葬身水底。 意外中死亡港人姓馮，年約三十歲，而新相識女友年約二十一歲。據悉，馮姓港人原籍中山，最近鄉中林姓朋友買了一部房車並改裝成跑車。  前日凌晨時分，馮偕女友應邀到中山市小欖鎮試新車，當時他坐在車頭司機旁位置，女友及另一叫阿燦的內地男子則坐在車後排。  從中山小欖到廣州帽峰山一百多公里路程，他們只用了五十分鐘；約凌晨一時五十五分，他們從帽峰山下來時離山腳只有幾百米處的一個急彎，車輛疑超速失控撞爛路邊的石躉，凌空飛起直衝落三米下的水庫。  據阿燦事後憶述，當車輛跌落水庫後，他和司機小林用腳踢車窗逃生，身旁女子的安全帶則未能解開，最後他與小林惟有自己游上岸。     蛙人水底撈屍   當地公安派蛙人到場搜索，將失事車輛吊出水面，並在後座發現已溺斃的身穿紅色衣服女死者，坐車頭的馮姓港人則失蹤，公安再調派多名蛙人到場搜索，直至前日上午十一時，才在三米深的水底撈起港人屍體。  當地交警表示，據證據顯示，肇事車輛當時時速達八十公里，而現場路段是限時速二十公里。  據悉，帽峰山因路窄急彎多，是近年廣東賽車族最受歡迎的飆車地方之一，每到深夜時分，經常有幾十名車手在此賽車。上月十九日，一名賽車手亦在同一位置失事衝落水庫，幸車手無受傷而自行游上岸。
20041213-35,20041213,35,海鮮檔遭惡煞搗亂,海鮮檔遭惡煞搗亂 【本報訊】旺角奶路臣街二號一個售賣海鮮攤檔，昨午四時許遭兩名大漢前來搗亂，兩疑人各持一柄一呎長手電筒，砸毀攤檔多個盛載大閘蟹發泡膠盒，部份大閘蟹當場死亡，兩疑人得手後逃去。警員趕至調查，三十六歲姓劉女東主稱未有與人結怨，不明遭搗亂原因，警方暫列刑事毀壞案處理。
20041213-36,20041213,36,二百人排通宵買票,二百人排通宵買票 【本報訊】九鐵及中旅社昨開始預售農曆新年前後（年十八至正月十五，即新曆一月二十七至二月二十三日)，往返香港與上海及北京直通火車票。有市民在旺角中旅社提早二十小時到來排隊（圖），至清晨五時許約出現二百人。九鐵熱線電話：29477888。  伍浦鋒攝
20041213-37,20041213,37,老翁捲車底重創亡,老翁捲車底重創亡 【本報訊】一名六十九歲姓黃老翁，昨晚九時許在深水埗石硤尾街近汝州街，被一輛空載的旅遊巴士撞倒及捲入車底拖行七十五米，但四十三歲姓張旅巴司機並未察覺，直至一名姓徐休班警長從後駕車追上響號，將旅巴截停，司機才知出事，消防員到場將老翁救出（圖），送院搶救，傷重死亡。  薛家傑攝
20041213-38,20041213,38,女子行山跣腳受傷,女子行山跣腳受傷 【本報訊】數名行山愛好者昨日聯袂前往西貢行山，至中午十二時許，各人途經鹹田灣對上山頭時，懷疑山路崎嶇，一名四十餘歲女子突跣腳摔跌地上，左手手腕甩骱受傷，由同行友人報警，飛行服務隊直升機到場，將傷者（圖）救起送往屯門醫院救治。  譚健文攝
20041213-39,20041213,39,工人東主送院　廚師帶署追討豆漿貨款食肆混戰,工人東主送院　廚師帶署 追討豆漿貨款食肆混戰 【本報訊】為討回一百七十元欠款，一名豆品廠工人昨日在將軍澳一個屋苑街市，與一名食店東主發生爭執，雙方口角動武，其間食店廚師亦加入戰團，三人扭打一團場面混亂。警方趕至控制場面，雙方三人涉嫌在公眾地方打架，一併被拘捕帶署。　記者：陳天華 被捕豆品廠工人姓彭（四十六歲），與涉案姓黃食店東主（四十七歲）事後聲稱受傷由救護員分別送院醫治，兩人稍後無礙，出院後被帶署；至於同案被捕姓郭食店廚師（五十七歲）在事發後即時由警員帶署調查。     自行取回豆漿   消息稱，四十六歲姓黃男子在將軍澳廣場萬有街市地下經營食店，食店售賣包括粥粉麵飯及豆漿等各式食品，其中豆漿則向一家豆品廠購入，每日新鮮運到。  前日早上，豆品廠一名兼任司機姓彭送貨工人來到食店送上一桶新鮮豆漿，當時食店姓黃東主未有即時繳付七十元費用，只表示會自行聯絡豆品廠東主商討，姓彭工人於是離去繼續送貨。  昨晨食店開業，食店姓黃東主又致電豆品廠訂購一桶半新鮮豆漿，至早上十時許，姓彭工人送來豆漿，並向東主收取兩日合共一百七十元的貨款。現場消息稱，當時姓黃東主聲言會自行致電找豆品廠傾談付款問題，並打發姓彭工人離去。  此時姓彭工人自行致電東主，其東主命令他即時收取貨款，他把東主意願向食店東主轉達，但食店東主未有理會，姓彭工人於是自行進入食店取回豆漿，卻遭食店東主阻止，雙方互相拉扯推撞，更大打出手。稍後，食店一名廚師亦加入戰團，三人混戰亂作一團，警員到場分隔雙方，經調查後拘捕三人，其中姓黃東主與姓彭工人分別手腳擦傷，由救護員送院醫治。
20041213-40,20041213,40,女警急救昏迷男子,女警急救昏迷男子 【本報訊】一名機動部隊女警，昨下午四時三十分與同袍巡經油麻地上海街三二二號對開時，遇到途人報案，指一名男子昏倒在上址後巷。女警趕往後巷查看，果然發現一名腳穿拖鞋的男子倒在地上，毫無知覺。她立即用心外壓及人工呼吸等方式施救（圖），並召來救護車將他送院，但抵院後證實不治。警方稍後證實死者是一名姓張（五十四歲）的癮君子，懷疑他較早前在附近「啪針」後喪命，被人移屍至上址後巷。  盧志光攝
20041213-41,20041213,41,雙程證男子偷欄杆,雙程證男子偷欄杆 【本報訊】姓周（三十五歲）雙程證男子，涉嫌偷走放在灣仔會議道海水抽水站外的一批欄杆，但被途人發現及時致電報警拘捕（圖）。警方在疑犯的手推車上撿獲八個兩米長一米高的欄杆，據報欄杆為水務署所有，但已被拆除棄用。  李家傑攝
20041213-42,20041213,42,15童黨圍毆五少年,15童黨圍毆五少年 【本報訊】五名十四至十七歲少年，昨凌晨四時許，在西環堅尼地城海旁卑路乍灣臨時公園內聊天時，十男五女（十五至二十歲）突然出現斥喝他們離開；事主們其後到一間便利店繼續閒談時，其中三名暴風少年尾隨及喝令他們折返公園，其後事主們在公園內遭對方「十兄弟」揮拳毆打受傷，兇徒傷人後逃去，警員接報到場將傷者送院（圖），他們表示不明遇襲原因。  黃曄寧攝
20041213-43,20041213,43,回歸5周年反罪惡,回歸5周年反罪惡 【本報訊】澳門消息：警方在澳門特區回歸五周年紀念前夕，在多個娛樂場所及食肆進行大規模的反罪惡行動，於昨凌晨時分在南灣及新口岸區的卡拉OK及酒吧，帶走六十多名可疑男女返警署協助調查（圖），當中包括港人及自由行內地旅客，各人在警署助查至昨日上午後，全獲准離去。
20041213-44,20041213,44,專家：疏忽管教構成虐兒,專家：疏忽管教構成虐兒 對於大窩口邨一對十歲孿生兄弟的百厭行為，香港家庭及事業發展服務訓練總監司徒漢明表示，對成長中的子女管教，令他們學懂自律、守規及責任感，實是家長的「天職」，但孿生兄弟的母親如此放棄管教子女，已構成疏忽照顧，可被視為虐待兒童個案。  司徒漢明指出，該對兄弟的典型行為問題，對社會的破壞性很高，主要是他們長期缺乏母愛，相信他們對其他人亦失去信心，其母應重新關心及管教子女。長此下去，孿生兄弟長大後可能會觸犯法例，故需要專家給予長時間輔導，否則應交由社署的院舍託管，讓他們從中學習規律。     應加強訓練紀律   另外，孿生兄弟因為平日未能透過社會認可的方法，如優越的運動會比賽及學業成績來獲取滿足感，所以只好採用另類方法，如犯事被警員拘捕返署，去追求新鮮的官能刺激，並可在朋輩中表現其個人膽識，以博取掌聲來顯示威風。  他建議，孿生兄弟應進行一些有難度性、挑戰性及紀律性的活動，如攀石、軍訓、獨木舟或加入球隊，將他們多餘的精力轉化往正途，從而達到成功感。  此外，「樂苗坊」註冊心理學家周婉芬博士指該對兄弟的行為屬品行紊亂（ConductDisorder），是一種病態，可能他們自小缺乏管教及愛護及自卑，致他們頻頻犯規，家長必須以懲罰及愛心，雙管齊下去教導他們，否則日後只能將他們判入兒童院甚至監獄，透過刑責來讓他們知道後果的嚴重性。  本報記者
20041213-45,20041213,45,效果雖良好　手術風險高自體血幹細胞移植治兒童風濕,效果雖良好　手術風險高 自體血幹細胞移植治兒童風濕 【本報訊】除老人家常在「翻風落雨」之時風濕病發作外，不少兒童也飽受各種風濕病的煎熬，例如紅斑狼瘡症及幼年特發性關節炎等，嚴重者更可致失明及器官衰竭。香港大學醫學院近年為嚴重兒童風濕病患進行自體血幹細胞移植手術，效果良好，幾乎所有患者的病情均得以紓緩。不過，由於手術風險高，醫生預計不會成為一線治療方法。	記者：陳倩雯 港大醫學院兒童及青少年科學系名譽臨床醫學助理教授李子良強調，風濕病不只是「老人病」，瑪麗醫院的風濕病病人中，年紀最小的只有兩歲。八成兒童風濕病患所患的是系統性紅斑狼瘡症及幼年特發性關節炎。     免疫系統失調   李子良解釋稱，兒童風濕病成因是他們的免疫系統失調，誤將體內的正常細胞錯認為有害物質，令關節、骨骼周圍的軟組織發炎。其中患有幼年特發性關節炎的兒童，其關節會紅腫及疼痛，嚴重的更會變形，甚至影響皮膚和心肺；他們也較易患上慢性虹膜炎，嚴重會失明。系統性紅斑狼瘡症患者的關節會腫脹及僵硬，嚴重者會腎衰竭，甚至死亡。  十九歲的何家麗，自七歲已患上系統性紅斑狼瘡症，嚴重影響生活，病情更在數年前突然急轉直下，藥物無法控制，「我唔可以曬太陽，同陽光海灘絕緣；又試過落床都落唔到，活動範圍好細。」幸而她在今年七月在瑪麗醫院接受自體血幹細胞移植手術後，目前已毋須靠藥物控制病情。  該學系另一名譽臨床醫學副教授夏修賢稱，患者中約有半成至一成對藥物沒有滿意反應，病情愈趨嚴重。所以港大自二○○一年起為九名這類病患進行自體血幹細胞移植手術，從病人的骨髓採集造血幹細胞，然後為病人進行化療，以清除病態免疫系統，再輸入造血幹細胞。 死亡率達一成   九名病人進行手術後，其中三人可以停止服藥；三人減藥；兩人則在手術後病情復發，須以藥物控制，另有一名十三歲的紅斑狼瘡患者因腎功能差，在進行化療期間死亡。  李子良強調，有關手術存有一定風險，原因是當化療藥物鏟除了病態免疫系統的幹細胞後，體內就沒有血球，須待輸入幹細胞的兩至三周後才會再產生血球及血小板。有關手術的死亡率達半成至一成，而化療藥物也會對心臟、腎臟及生育能力造成不良影響。所以有關手術暫時仍未能成為對付嚴重兒童風濕病的一線治療方法。
20041213-46,20041213,46,促透過醫生轉介檢查身體,促透過醫生轉介檢查身體 【本報訊】香港醫學會發現，近年愈來愈多化驗所提供身體檢查套餐，甚至為市民進行一些不必要的檢查，所以要求政府及立法會跟進。其實化驗師必須獲醫生轉介，才可為病人進行檢查或化驗工作；化驗師業界認為，守則存在灰色地帶，註冊的化驗師應可提供預防性檢查，而毋須醫生轉介。     部份檢查潛在危險   亞洲電視昨日報道指，現時愈來愈多由化驗所提供的健康檢查服務，市民可直接到化驗所要求檢查，毋須由醫生轉介，但根據醫務化驗師管理委員會規定的專業守則，化驗師不可在沒有醫生、牙醫或獸醫的轉介下，為市民進行任何化驗，否則違反專業守則。  香港醫學會擔心會出現市民做了一些不必要的檢查。該會會長蔡堅舉例稱，是否需要每年做一次照胃X光檢查，該檢查輻射量很強，對有計劃懷孕的婦女有潛在危險，該會要求衞生福利及食物局處理此問題，而代表醫學界的立法會議員郭家麒也表關注，計劃在立法會上提供討論。  但是醫務化驗所總會榮譽秘書朱麗珍則認為，其實註冊化驗師也可以提供預防性的健康檢查或化驗工作，當局可再深入討論，由業內提供一般性的健康檢查。
20041213-47,20041213,47,吃未熟豬肉易感染旋毛蟲,吃未熟豬肉易感染旋毛蟲 【本報訊】俄羅斯《科學信息》雜誌報道，該國科學家最近研究發現，食用未煮熟的豬肉可能使人感染旋毛蟲，危害健康及生育能力。     影響生育能力   旋毛蟲是一種十分細小的寄生蟲，可寄生在人體、豬和老鼠等體內。俄羅斯專家用老鼠進行實驗後發現，旋毛蟲除令被感染對象發生消化不良、發燒和肌肉疼痛等症狀外，其體內的活性物質還可能破壞被感染對象的骨髓和生殖細胞的DNA（脫氧核糖核酸），致使DNA的一部份從被破壞細胞中流出，在細胞周圍形成類似彗尾的雲狀物質，影響生育能力。  參與研究的俄羅斯醫學科學院專家杜爾涅夫說，旋毛蟲在生物體內經歷複雜的發展過程，其隨食物進入胃後，先在小腸內聚集，三天後具備繁殖能力並產下幼蟲。幼蟲可進入血液循環系統和身體各部位，侵入肌肉組織，破壞肌肉纖維，吸取養份；約兩周後，幼蟲會用膜把自己包起來。  科學家發現，旋毛蟲正式「安家落戶」會對生物造成的破壞最強。旋毛蟲的破壞力與數量有關，若大量寄生在生物體內，在生物的小腸內聚集，能對生物造成嚴重損害，幸而現代的醫療方法可以完全制服旋毛蟲。
20041213-48,20041213,48,科學家發現治療瘧疾新法,科學家發現治療瘧疾新法 美國西北大學及澳洲墨爾本醫學院的研究人員分別表示，已破解瘧疾在人體內迅速擴散之謎，以及找到治療這傳染病的新捷徑。科學家指出，瘧疾主要透過寄生蟲入侵人體細胞，令人身體感到不適。瘧疾每年殺死逾一百萬名小童，在非洲最少有五分之一的初生嬰兒死於這傳染病。科學家發現，傳播瘧疾的寄生蟲都有同一種蛋白質PfEMP1，只要限制這種蛋白質的生長，即可有效治療瘧疾。
20041213-49,20041213,49,孕婦肚皮凸子宮或有問題,孕婦肚皮凸子宮或有問題 台灣《東森新聞網》報道指，孕婦的肚皮上出現小腳印，是胎兒在蠕動嗎？林口長庚婦癌科科主任張廷彰醫生表示，對於比較瘦小的孕婦來說，由於胎兒在母親腹中會蠕動，肚皮時而出現小凸起，是正常的，代表胎兒正常健康生長。但他亦提醒，若孕婦肚皮出現長時間凸起的現象，很有可能是子宮內膜或子宮肌瘤移位，所以不可掉以輕心。
