key,date,article_daily_id,title,text
20040207-0,20040207,0,法官：現代教育不可用暴力扭裂學生耳仔女教師罪成,法官：現代教育不可用暴力 扭裂學生耳仔女教師罪成 【本報訊】執教鞭逾二十七年的資深小學女教師，因小五男學生上數學科時不服從指示，遂扭其耳朵以作懲戒，導致該名學生耳朵出現一點五厘米的裂傷，需入院縫四針，留醫六天。涉案女教師昨於觀塘法院承認襲擊傷人罪，案件押後至本月二十四日，待社會服務令及感化官報告宣判。被告出手扭傷學生耳朵，可能面臨喪失教職。　記者：陳曉薇 五十八歲的女被告蔡淑水，任職小學教師，控罪指她於去年十一月七日，在秀茂坪樂善堂楊仲明學校，襲擊一名十歲上午班小五男學生，導致他的身體受到傷害。     或不會被判監禁   裁判官施萬德裁決時表示，現代教育並不容許教師使用任何暴力，被告以暴力作教育工具，是羞恥的行為，她對學生亦樹立了不良榜樣，令學童以為暴力可以解決問題，相信被告用了頗大力度，致令男童受到這麼嚴重的傷害，但考慮被告已經真心後悔，相信她非蓄意傷害學童，因此不打算判她監禁刑罰，但仍先取閱報告後判刑。  案情指出，案發於中午時分，上午班尚有一節課堂便放學，被告正帶領一班小五年級，進行一個名為「益智趣味數學班」的課外活動，以有趣的方法教學生數學。被告開始授課時，着學生拿筆計數，但受害男童用手玩弄衣服，沒有服從她的指示拿出筆來，被告隨即上前扭其左耳一下。     縫四針留院六天   受害男童被扭耳懲罰後，耳朵曾流血，但他如常上課，放學後更完成補習班，才返家將此事告知母親。其母隨即將他送院治療，發現其左耳珠留下一點五厘米長的撕裂傷口，需縫上四針，並留院六天。被告於三天後被警方拘捕，在警誡下表示因為男童沒有遵從指示，才會扭其耳朵。  辯方律師求情時表示，首先要向事主及其家人，致以深切歉意，被告已經知錯，她於內地接受教育，在廈門大學畢業後，來港再修讀葛量洪教育學院課程。此後，她開始執起教鞭，至今已逾二十七年，自八七年起，她在涉案學校出任教師，現已有十七年，月入二萬五千元。其夫離世二十多年，被告一直獨力撫育三名子女成人，今次犯罪與其本性不同。 家長要求賠五萬   律師續稱，被告案發時因事主只管玩弄衣服，不肯執筆計數，影響其他同學的進度，才上前扭其耳朵一下，希望能引起男童專注上課，絕對無意傷害他。被告現已被校方停職，很大可能喪失教職，願意作出賠償。  律師庭外表示，被告於校內專責教導小五、六學生，男童只是耳背受傷，並無表面傷痕，相信現時已無大礙。男童家人曾要求賠償五萬元。  教協會張文光指出，是否吊銷該名教師的教席，會由教統局常任秘書長羅范椒芬應法庭判詞才作出決定。教育統籌局發言人則表示，政府已於九一年頒布，在《教育規例》中列明禁止教師體罰學生，教師一經法庭定罪，最高可被監禁一年及罰款五萬元。  案件編號：KTCC8043/2003
20040207-1,20040207,1,為20萬與鬍鬚勇結怨,為20萬與鬍鬚勇結怨 【本報訊】被稱為「湖南幫教父」及「湖南師祖」的「盲忠」，五年前與歌星張栢芝的父親鬍鬚勇結怨，結果掀起了一場近年罕見的江湖風暴。江湖傳聞，事件的起因，是一筆二十萬元的欠債。     盲忠遭煙灰盅拍穿頭   據悉，盲忠原本與鬍鬚勇並無過節，但多年前，盲忠曾借出二十萬元予一名騎師，有人指鬍鬚勇是這筆錢的擔保人。九九年八月，盲忠與鬍鬚勇在尖東一間酒店相遇，有人重提舊帳起爭執，混亂中，盲忠被人用煙灰盅兜頭拍下，當場血流披面。  數天後，油麻地果欄的多間店舖被「湖南幫」掃場，有人更一掟數百萬元，發出「奪命追殺令」；「湖南幫」更發動百人晒馬，警方高度緊張，連月遍搜「湖南幫」的所有「地盤」。  事隔不久，黑道再傳出一個「江湖姦殺令」，目標直指一名當紅女星，事件震動整個娛樂圈，但最後事件獲擺平，終於不了了之。
20040207-2,20040207,2,駕車闊太自嘲：今次老貓燒鬚油門錯當煞掣房車墮街,駕車闊太自嘲：今次老貓燒鬚 油門錯當煞掣房車墮街 【本報訊】中區半山昨日發生罕見的私家車「跳樓」意外。一名「闊太」駕駛富豪名車，在住所一樓停車場泊位時，疑將油門當煞掣踩，導致汽車失控，全車衝前撞破「水馬」築成的臨時圍牆，倒豎葱式直插落馬路。幸而現場大廈搭有棚架進行外牆維修，阻擋了「跳樓」私家車的衝力。「闊太」有驚無險，事後自嘲說：「揸咗四十年車，今次真係老貓燒鬚。」　記者：梁偉權 女事主許太（六十三歲），與家人同住干德道四十五號金輝閣，丈夫在九龍灣開設貿易公司。女事主每日都習慣駕駛其「富豪S40」的私家車送丈夫上班，然後買餸再返回家中。昨晨十一時十五分，她做完了每朝工作後，如常駕着私家車回家，結果出事。  現場金輝閣目前正在進行大廈翻新維修，外牆搭滿了棚架，一樓是停車場對着干德道的平台。工人將原來的鐵欄拆掉，改而擺放了一列一米高的相連「水馬」，作為臨時圍欄。     水馬棚架減跌勢   昨日事發時，許太正在停車場平台前一個車位準備將車泊好，懷疑她踩煞掣時錯踏油門，導致全車突然飆前，並撞向平台邊的「水馬」臨時圍欄，將十五個相連的「水馬」撞開。私家車則連同「水馬」直衝而出，再撞向外牆的棚架，九十度角式由一樓直插落十五呎下的地面。  由於有「水馬」和棚架承托着，私家車車頭不致直接撞撼地面，車頭僅輕微損毀，而在車廂內的許太亦只是擦傷腳輕傷。但她無法自行爬出，事後須由管理員報警拯救。消防員接報到場後，首先用麻繩固定私家車位置，然後小心翼翼救回許太。許太事後拒絕送院，由趕至的子女攙扶回家休息。消防員事後設法將私家車扶正在地面，而許太稍後返回現場取回留在車上的餸菜。她平靜的表示，當時並不太驚，因為車是慢慢的滑下。
20040207-3,20040207,3,立會第四度否決施政報告致謝議案,立會第四度否決施政報告致謝議案 【本報訊】立法會經過連續三日辯論，昨在保皇黨再次護董下，終於否決由民主派提出不滿特首，未有在施政報告中提出政改時間表的遺憾修訂動議。不過，由於民主派也全力反對原本致謝議案，令原議案一樣無法通過，出現「兩大皆空」局面。這是董建華出任特首以來，第四次發表施政報告不獲立法會致謝。     民建聯顯得低調   最後一天辯論主要討論政制、保安、公務員及司法事務，但絕大部份議員均集中在政改爭議上，民主派及保皇黨針鋒相對。提出遺憾修訂案的民主黨主席楊森，批評政府利用法律及程序拖延政改。他又反駁民主普選是奪中央權力的言論：「將港人民主訴求同獨立畫成等號，實在亂扣港人帽子。」  民主黨張文光則指自23條事件後，董建華問責班子已是百孔千瘡，中央應還政於港人。「還政於民不是國家恥辱，而係國家光榮」。他更反駁普選等同獨立的言論：「一國本無事，獨立亦非臺，本來無一物，何處惹塵埃？」  余若薇指雖然外界覺得中央叫停政改時間表，但董建華也要負上責任。「好多人懷疑，究竟董先生有冇如實向北京反映港人意願。」  保皇黨方面，民建聯顯得低調，只由副主席譚耀宗重申，民建聯支持07普選立場。反擊重任則落在一班親北京議員身上。身兼全國人大港區代表的黃宜弘，指摘批評中央插手政改的人，不要忘記「香港只係中國一個特區，唔係獨立或者半獨立，不能排斥中央參與」。他又批評反對中央干預的人「對一國認知不足，忽略對《基本法》規定」，一旦取消功能組別，會令「香港賴以成功嘅自由市場機制走向福利主義。」自由黨主席田北俊稱，該黨調查顯示不少中小企、商界及中產人士，均對「一步到位」於○八年取消功能組別議席、普選立法會感到憂慮，擔心大搞福利主義，而願意與中央就政改妥協的市民較不願妥協的多。     遺憾修訂案遭否决   負責政制檢討的政務司司長曾蔭權則重申，與中央商討主要避免日後討論到具體方案時，會與中央產生矛盾。他又保證一旦政府在政改方案有任何傾向，一定會立刻向公眾公開。  最後，楊森的遺憾修訂案因不獲功能組別過半數支持而否決，而原議案亦無法得到直選及選委會過半議員支持，同遭否決。
20040207-4,20040207,4,失業減少綜援支出回落,失業減少綜援支出回落 【本報訊】今年一月申領綜援個案數字，終於打破過去三年持續升勢，首次出現回落（見表）。政府消息形容，受經濟復甦影響，申領失業綜援個案減少，令整體數字回落。不過，消息人士對跌勢能否持續仍持觀望態度，強調一切仍要視乎經濟情況。  去年十二月，申領綜援個案總數超過二十九萬，其中有逾五萬個個案，來自失業綜援。社會福利署消息人士透露，經濟環境好轉，申領失業綜援數字在過去三個月都已有下降，令一月份整體申領綜援數字亦首次回落，最新數字為二十八萬多。其中失業綜援也跌至五萬以下。○三至○四年度，綜援預計開支為一百七十億元。     下年度削三億元   消息人士稱，政府現階段再無任何計劃改變綜援金額和申領資格，這方面來年工作重點將是如何進一步鼓勵單親家長投入勞動市場。針對近期通縮放緩，社會也會密切監察年中是否有可能再度出現通脹，並由此對綜援家庭影響。  ○三至○四年度，社署總開支逾三百二十億八千萬元。消息透露，社署下年度會削減開支百分之三，總削減金額約為三億元，其中綜援獲得豁免削減。而資助機構的減幅也較整體減幅少，減幅約為百分之二點五。安老服務更會額外獲得新錢增加服務。  消息人士稱，政府內部已同意下年度增撥資源用作安老服務，其中主要是增加老人復康服務，減輕醫院壓力。換言之，現時由醫療系統處理的復康服務，會轉由社會福利系統承擔。消息人士形容，醫療系統處理復康服務成本比較昂貴，此舉將有助政府整體節省了資源。  在削減資源之下，政府下年度會關閉屬下單親中心和新移民中心，然後把相關服務併入綜合家庭服務中心。社署也準備改變現行託管服務資助形式，由直接撥款予機構，改為向家長發出服務券。
20040207-5,20040207,5,仍寒冷明最低9℃,仍寒冷明最低9℃ 【本報訊】立春已過，但寒流未退。天文台預測本港未來數天仍然寒冷，今日最低氣溫為攝氏十度，明日及星期一更會跌至九度，到下星期中氣溫才會逐漸回升。民政事務總署強調，不會趕走在避寒中心的避寒人士。     千五長者按平安鐘   天文台表示，冬季季候風將在未來數天持續為華南地區帶來寒冷的天氣，今明兩天多雲有雨，明日氣溫最低跌至九度，星期一天色轉晴但溫度仍然偏低。預計到下星期中氣溫才逐漸回升，下星期二最低氣溫回升至十二度。  長者安居服務協會表示，寒流下過去兩日共有近一千五百人按動平安鐘求助，七十九人需送院治療，顯示寒冷天氣繼續威脅長者，該會總幹事馬錦華呼籲市民多關心鄰居獨居長者，長者則應添衣及進食澱粉質食物以保持身體溫暖。  此外，民政事務總署昨日繼續開放設於社區中心內的十四間避寒中心，助理署長謝萬誠稱由於要維持社區中心日常運作，故避寒中心只能在下午五時半至早上八時半開放，其餘時間避寒人士仍可逗留在中心內使用其他設施，該署不會趕避寒人士出街。油尖旺福利專員何陳惠琼稱，每晚六時半至十時會有社工在避寒中心當值，向需要長期住宿者提供協助。
20040207-6,20040207,6,街市生意清淡　八成運往食肆第一日復市活雞售價升一倍,街市生意清淡　八成運往食肆 第一日復市活雞售價升一倍 【本報訊】四萬隻本地大肥雞昨日清早分批出發，八成運抵酒樓食肆，兩成則運入街市；活雞批發價急升七至八成，零售價更以倍數暴升。昨天是本地活雞復市首日，但街市生意淡靜，連同食肆訂購數量，四萬隻活雞只售出三萬多隻。今日會再有四萬隻超齡的巨雞應市，散戶及主婦想找些身形適中的鮮雞享用，相信要多等三、四天。　記者：蔡元貴、林社炳、李偉民 「年三十晚食過雞後，過年都冇食過雞。不過所有仔女返齊嚟食飯，所以幾貴都要買隻雞清蒸。」家庭主婦楊太在深水埗北河街街市挑了一隻三斤半重的本地雞，售價八十元。捱貴雞，市民梁太相當不滿：「政府一係就唔畀所有雞檔賣雞，唔好淨係畀賣本地雞，又唔畀入口內地雞，搞到啲雞貴晒。」     批發市場工人忙碌   禽流感肆虐亞洲，市民食雞信心下降，導致街市一度囤積過量活雞，政府於上月三十一日宣布同時暫停入口內地活雞，並禁止本地雞場輸出雞隻。本地活雞禁令昨日解除，長沙灣家禽批發市場恢復供應，凌晨三時許，四萬隻活雞陸續運抵市場，工人交收點算，忙得團團轉。  雞價大幅上升，港九新界家禽批發零售商會主席黃偉泉說，本地活雞批發價由平日每斤十元上升至昨日的十七、八元。四萬隻鮮雞，八成都是供應給酒樓食肆的；來價貴，加上首日推出的大肥雞不受主婦歡迎，昨日很少街市商戶取貨，結果全日只賣出了三萬多隻活雞。  在深水步北河街街市，十六個雞檔中，只有五檔營業，而大部份店舖的雞籠都沒有入貨活雞，故顯得有點冷清。幾間有入貨的雞檔，也因生意淡薄提早休息。  年三十晚生意滔滔的雞販林洪說，批發價上升，零售價也由原來每隻二十至四十元，被迫加至五十至八十元，加幅高達一倍。他過去每日向批發商取二百隻活雞，昨只入了一百隻，但只賣出三十隻。     2000嘉美雞全售罄   在港島西環士美菲路街市十個雞檔，只有一半營業，平價冰鮮雞比貴價活雞受歡迎得多。雞販林先生說：「朝早七點到十點，賣得嗰一隻雞。反而休市清潔日賣剩嘅冰鮮雞，一隻二十幾蚊，就賣出二十隻。」市民劉太以七十五元買了兩隻冰鮮雞返家煮食。此外，有士美菲路街市雞販梁伯對市道感悲觀：「政府針對活雞供應買賣，賣雞蛋都好難置身道外，大家都係實死冇生。」  至於本地名牌雞「嘉美雞」則相當旺市，昨日推出二千隻，比平日多一倍，全部售罄，預料今日會再推二千隻，售價維持在平日的每斤二十八至三十元。黃偉泉說，今日會再有四萬隻本地雞應市。新界養雞同業會理事郭銘祥說，本地雞場停市了一段時間，產生大批超齡超重的大肥雞，每隻三斤半至四斤，估計需時四至五日，市場才消化的來。
20040207-7,20040207,7,老字號入貨　鹽焗雞熱賣,老字號入貨　鹽焗雞熱賣 【本報訊】活雞昨日再度應巿，以鹽焗雞馳名的泉章居即時搶閘購入三百多隻活雞，炮製撚手鹽焗雞，旋即熱賣；美心快餐則另大賣廣告，強調全線暫停售賣中國家禽類產品，又創製蒜香燒牛𦟌等另類燒味，減價兩成促銷。  客家菜老字號泉章居經理陳旺偉表示，昨日向相熟的批發商入貨，共購得三百多隻活雞應巿，批發價只稍為上漲，但食店並沒有將費用轉嫁顧客，「都係賣一百五十蚊隻鹽焗雞。」陳旺偉笑稱，昨日不少熟客到店內等候新鮮熱辣的鹽焗雞，「午巿生意好好，賣咗五十隻，𠵱家晚巿都爆晒，估計三百幾隻雞可以賣清。」     美心賣廣告促銷   至於美心快餐昨日則大賣廣告，強調全線暫停售賣中國家禽類產品，以新鮮材料創製一系列燒味替代，包括蒜香燒牛𦟌、燒豬頸肉、蜜汁燒骨及佛山熏蹄，並減價兩成促銷。  太興燒味發言人則表示，鑑於雞隻來貨不穩定，會另創新菜式如美國燒雞髀及燒牛柳，亦打算推出中西合璧的燒味飯，如牛柳拼叉燒飯。  新光及聯邦酒樓則採取觀望態度，新光酒樓集團常務董事總經理胡珠表示，巿民對食雞仍有戒心，加上昨日活雞的批發價較平日高，故沒有全線購入活雞；聯邦酒樓集團董事總經理程基表示，昨日僅入了約五百隻活雞，較平日減半，「啲巿民對食雞重係有戒心，暫時唔想入咁多。」  至於中環鏞記酒家行政經理王揚威則表示，雞隻始終代替不了招牌燒鵝，暫停供應燒鵝後生意跌了一成，但近日推出的炭燒羊髀和燒乳豬反應不錯，生意額回升。
20040207-8,20040207,8,私葬死雞元朗雞場封查,私葬死雞元朗雞場封查 【本報訊】寒流襲港，新界雞場陸續爆發小型死雞潮。漁農自然護理署昨日繼續四處收集禽畜屍體，在元朗大江埔村仍有雞場場主不理會禁令，把病死家禽棄置到禽畜屍體收集站。元朗牛潭尾一個雞場便因前日違例私自埋葬六隻死雞，即時被封查，禁止賣雞。     護衞全日駐守   私葬死雞事件是在傳媒揭發下，漁護署才獲悉。有關雞場位於牛潭尾南區第一段松樹頭，面積約一萬平方呎。  漁護署指出，該雞場場主前日曾主動呈交十三隻死雞予漁護署棄置，連同六隻私葬的死雞，化驗後證實全部都不是死於H5禽流感，而該雞場前日並無運送雞隻往批發市場出售。漁護署已暫停該雞場賣雞，以便調查，並於昨日派出護衞全日駐守該雞場，嚴禁私運雞隻。  為了加強監察雞隻死亡情況，政府前日起規定全港雞農必須把死雞交由漁護署處理，若不遵守規定，會被撤銷牌照。  不過，元朗大江埔村的動物屍體收集站昨依然是屍橫遍地，一袋袋死白鴿和死豬堆放在地上。     再收逾千死雞   香港禽畜業聯會主席鍾鋒說，已多次呼籲會員遵守呈交死雞的規定，「呢啲係成個行業嘅事，唔係一個雞場嘅事。」新界養雞同業會理事郭銘祥亦稱，持續的寒流，加上連日來沒有陽光，讓病毒得以生存多日不死，若雞場通風欠佳，雞隻很容易生病，尤其是與禽流感相似的呼吸道疾病「新城病」，「啲雞一感染新城病，會死得好快。」一些雞場會在嚴寒天氣下以帆布擋風，但卻沒有確保空氣流通，反而影響雞隻健康。  漁護署昨日共收集了一千六百五十四隻死雞，來自一百零三個農場，死雞並無異常情況。
20040207-9,20040207,9,飼養雀鳥染疫風險不高,飼養雀鳥染疫風險不高 不少港人都有飼養雀鳥，香港大學微生物學系助理教授黃世賢認為，飼養雀鳥而感染禽流感的風險不高。他指出，外國有關禽流感的研究顯示，觀賞鳥雖曾被發現帶有禽流感病毒，但全屬H3、H4及H10類型，並非可傳人的H5類型，因此對人類構成的風險不高。但他提醒市民，飼養雀鳥必須注意環境衞生。  愛護動物協會則建議，市民不要將飼養雀鳥放在近窗位置，避免野鳥飛近。
20040207-10,20040207,10,議員促減雞檔數目,議員促減雞檔數目 【本報訊】代表飲食界的立法會議員張宇人昨在電台節目中指出，將活雞中央屠宰不能有效防止禽流感爆發，政府應改變現行將內地雞及本地雞同時擺放在長沙灣批發巿場的做法，以及減少街巿的雞檔數目，防止雞隻過擠而互相傳染疾病。  他又稱，受禽流感影響，首當其衝除了雞販外，燒臘店亦因此損失慘重；相反，一些餐廳及食肆則影響輕微。
20040207-11,20040207,11,學生家長：「絕不可傷害孩子」,學生家長：「絕不可傷害孩子」 【本報訊】女被告蔡淑水於涉案期間，在樂善堂楊仲明學校上午校任教。該校低班學生屬全日制，小四至小六則分上、下午校。  數名下午校家長得悉事件後，一度聚集校外議論紛紛。家長們不約而同表示為人師表絕不應以暴力方式對學生，並對涉案老師以發洩不滿，扭裂學生耳朵的行為，認為絕對不能容忍。  數名接放學的女家長接受訪問時表示，她們接受老師施予有限度的體罰，但絕對不可傷害到孩子。她們知道受害男童的傷勢後，更稱不能容忍被告的行為。本報欲聯絡上午校女校長霍少甜以了解事件最新發展，但校方回應她下周一才上班。
20040207-12,20040207,12,觀鳥大賽如期舉行,觀鳥大賽如期舉行 【本報訊】在禽流感陰影下，世界自然（香港）基金會宣布，如期於本月二十八日舉行第二十一屆香港觀鳥大賽，基金的米埔自然保護區經理楊路年強調，參賽者只會用望遠鏡觀察，不會直接接觸鳥類，故活動絕對安全。  比賽要求參加者在十八個小時內，盡量記錄香港範圍內雀鳥品種數目，數目多者勝出，基金每年由此籌得三分一經費。
20040207-13,20040207,13,雞檔或免租一個月,雞檔或免租一個月 【本報訊】對於有街市雞販表示雞價大幅颷升，但生意額卻銳降，而雞檔租金是最大的經營成本，盼政府減租及盡快恢復輸入內地活雞。食環署署長梁永立昨稱，可考慮免租一個月，但減租則暫時難以決定，而有困難的雞販也可考慮退回牌照轉業。  梁永立說，由於鄰近地區疫情仍嚴重，當局會在連續三周沒有出現新增禽流感個案下，才會考慮恢復輸入活雞。
