key,date,article_daily_id,title,text
20040928-204,20040928,204,惟對前景審慎　經濟或失動力日企業信心持續改善,惟對前景審慎　經濟或失動力 日企業信心持續改善 【本報綜合報道】日本企業今季對營商環境更具信心，但對未來數月的樂觀程度減弱。彭博資訊的調查亦顯示，當地大型廠商今季信心升幅可能是逾1年最細，反映經濟有放緩迹象。 日本內閣府和財務省公布，反映日本所有大企業信心的商業調查指數（BSI），由第2季（截至6月）的7.2，攀上今季的9.6；但估計第4季信心會降到9.5，明年首季料進一步跌至8.5。     信心指數料回落   大型製造商方面（資本額至少10億日圓，相當於約7051萬港元），其商業信心由第2季的8.9，攀上第3季的12.8，數據為正數，意味樂觀者佔多數；但估計第4季信心會回落到9.6。至於大型非製造商的商業信心今季升至7.6，高於次季的6.1。  法國巴黎銀行經濟師說，日本大型和小型公司、製造商和非製造商的商業情緒皆改善，而且範圍十分廣泛。日本財務省官員表示，最新商業信心數據反映日本零售業廣泛地好轉。  日本央行行長福井俊彥說，該國經濟在第2季放緩後，可望持續自發地增長。他重申該行將維持零息政策，直至核心消費物價指數錄得按年升幅，以促進經濟增長和對抗通縮。     周五公布短觀報告   據彭博的調查預測，日央行本周五發表的「短觀」報告將顯示，當地大型廠商的信心指數會由6月份季度的22，升至9月份季度的23，是13年來最高，惟增幅是逾1年來最弱，反映這個全球第2大經濟體系增長有減慢迹象。  包括東京電子等日本廠商上月警告，半導體和其他電子產品的存貨積壓，可能拖慢盈利增長。分析員說，美國汽油價格趨升可能打擊該國消費需求，加上中國實施宏觀調控，或會損害日本出口，日本股市下跌亦不利日本商業信心。
20040928-205,20040928,205,杜指早段跌破萬點關,"杜指早段跌破萬點關 【本報綜合報道】美國股市昨天早段下跌，杜瓊斯工業平均指數曾跌穿萬點關口。油價創新高，加上當地6星期內4度遭颶風吹襲，令投資者關注企業利潤會被削弱。  杜指早段一度跌48.30（0.48%），低見9998.94。納斯達克綜合指數最多跌16.43（0.87%），降至1863.05。開市後個半小時（本港時間昨晚11時），杜指跌43.66，報10003.58；納指跌12.38，報1867.10。  上周五，杜指升8.34，收報10047.24；納指跌6.95，收報1879.48。  Ehrenkrantz,King,Nussbaum首席投資策略師海曼說，油價愈接近每桶50美元，市場愈關注高油價對經濟的打擊；季尾的季節性買盤，似乎是唯一支持大市的因素。     新屋銷量勝預期   樓市方面，美國上月新屋銷量增幅是近4年來最勁，受惠於按揭利率處於4個月低位。雖然當地5至7月份新屋銷量向下修訂，但樓市仍將是經濟增長的支柱之一。  8月份單一家庭房屋銷量較前月升9.4%，年率增至118.4萬個單位，多過市場估計的116.5萬個，升幅是2000年12月以來最大。但7月份銷量由原先統計的113.4萬個單位，修訂為108.2萬個；6月銷量由121.1萬個修訂為116.7萬個；5月銷量從128.3萬個修訂至124.4萬個。  美國30年期平均按揭利率由7月的6.06厘，降至上月的5.87厘。雷曼兄弟高級經濟師巴特說，按揭利率偏低令樓市持續興旺。然而，美國二手樓銷量上月減少。     圓滙挫至111水平   滙市方面，美元昨天升見111日圓，創6周新高，油價逼近每桶50美元或拖累日本經濟復甦前景，以及日股連跌7日，令圓滙受壓。  美元兌日圓曾高見111.42，升0.79日圓，是8月13日以來最高水平；紐約早段報111.19日圓，升0.56日圓。日本內閣改組對圓滙影響不大，原因是大部份財經事務閣員職位不變。  滙商說，美國本身是全球最大石油進口國，加上七大工業國（G7）財金官員將於周五召開會議，美元兌其他主要貨幣表現較遜色。德國商業信心連跌兩月對歐元影響有限，歐元低位一度見1.2250美元，跌0.26美仙；紐約早段報1.2298美元，倒升0.22美仙。"
20040928-206,20040928,206,德商業信心降內部需求不振,德商業信心降內部需求不振 【本報綜合報道】德國本月份商界信心下降，是過去5個月以來第4度報跌，主要受油價上漲以及內部消費需求不振拖累，數據反映這個歐元區最大經濟體系增長步伐或正放慢。  德國慕尼黑經濟研究所（Ifo）9月份商業信心指數由8月的95.3下降至95.2，顯示企業對未來6個月經營環境的信心下跌，但仍略優於市場預期的95.1，該指數在今年1月升見97.5的3年高位。  至於經營現況指數由8月的94.7微升至94.8；展望指數由上月的修訂後的95.9下降至95.7，是去年7月以來最低。     經濟持續緩慢復甦   Ifo所長辛恩（Hans-WernerSinn）表示，德國近幾個月以來出口暢旺，但企業現在相信外圍需求對該國經濟增長的推動力正輕微減弱；總的來說，數據顯示德國經濟持續緩慢復甦。  據路透社引述希臘消息人士的話報道，國際貨幣基金組織（IMF）在將於明天發表的《全球經濟前瞻》報告中，預測歐元區今、明兩年的經濟增長率為2.1%和2.3%；美國及全球今年經濟增長分別為4.3%和4.9%。
20040928-207,20040928,207,國際視野：固定匯率不能持久,國際視野：固定匯率不能持久 筆者時常掛在口邊的「不平衡現象」，除日前經合組織（OECD）發出的中期全球經濟預測中有點題外，最近國基會（IMF）亦不約而同地呼籲各回應齊心合力，尋求解決全球經常帳不平衡之方法，足見問題已迫在眉睫。本欄久不久便提出這枚計時炸彈不容輕視，何時爆破或會否爆炸，便要看看有關領導人之決心和遠見矣！  問題是，家家有本難念的經，美國接二連三發生事故，「布拉格」法寶盡出，力挽狂瀾於既倒，在將美國這個病人從深切治療部帶出（現在識行識走）之同時，亦帶領全球經濟邁向復甦，可是卻換來龐大「雙赤」，如何解決，要那些從中受惠兼多謝無句之國家共謀共識、作出行動或有高人才能為之。     美國雙赤難解決   中國在走向市場經濟的歷史過程中僅屬剛剛起步，問題叢生乃必然，「穩定壓倒一切」，最重要的是下崗工人不會釀成社會動盪，故此刺激投資和就業乃政府首要任務。在這次G7會議中，中國財金官員就有關彈性滙率問題上，必備受壓力，試問人民幣若升值，對外國直接投資、出口和製造業就業問題帶來的影響有多大？現時估計已有2億人在望天打卦（無工做或開工不足），你教我如何遷就？  歐洲結構改革緩慢，內部需求疲弱，一樣要依賴出口養命，何況歐洲在融合的過程中似乎已自成一國，要咱們肩負甚麼責任或道義？  日本好地地又再跌落地，是「假黎明」抑或真正「老化」，甚或唞完氣再來過，暫難下斷語，不過總覺得有心無力！其餘塘邊鶴因曾受重創，還在休養生息，又怎會自毀長城？  目前全球正處「固定滙率」時期，個個攬住同一隻大笨象，美國佬郁不得其正，奈何！  王冠一
20040928-208,20040928,208,小巴大王3.5億買4舖位,小巴大王3.5億買4舖位 【本報訊】舖市續旺，資深投資者「小巴大王」馬亞木入市更勇，月內斥資3.522億元購入4項店舖，作長線收租，反映對後市相當樂觀。 馬亞木對本報表示，最近以1.27億元，購入佐敦18號廣場，又向漢寶集團購入深水埗東蘭閣地下至2樓近4萬方呎商場。近日再以5370萬元，購入尖沙嘴金馬倫道17號兩個地舖，及以5150萬元，購入旺角西洋菜街南250至252號豪園茶餐廳，回報率約4至6厘。     看好舖市「睇啱再買」   據悉，漢寶集團早年高價購入的東蘭閣商場，以約1.2億元轉售予馬亞木。  他說，40多年前已開始投資本港舖市，累積持有逾100個舖位，由於一直看好舖市，「買多賣少」，傾向長線收租。「舖市穩定，未來（價錢）只有一路少少咁升，如果啱價仍會繼續買。」     沙士後轉攻一線旺舖   地產界人士表示，馬亞木所持舖位涉資逾20億元，趁「沙士」後樓市低潮斥資逾5億吸納旺舖，近年更由二、三線轉戰一線旺舖，今年購入的舖位涉資逾6億元（見表），其中以東蘭閣、旺角新興大廈六福珠寶地舖及佐敦18號廣場最貴重。  一名地產代理說，馬亞木在全港各區都持有舖位長線收租，早年曾於美孚新邨大手買入住宅和商場舖位，亦持有尖沙嘴寫字樓及九龍塘和山頂豪宅收租物業。  他說，馬亞木坐擁近600部小巴，所獲利潤主要投放旺舖，近年入市愈來愈積極，堪稱舖市的「長青樹」。  中原地產九龍商舖部高級董事潘德榮表示，受惠於近年實施的自由行政策，主要購物區旺舖成交絡繹不絕。  據美聯物業統計，截至本月商舖的成交量創97年金融風暴後的新高，成交近3500宗，涉資逾240億元，兩者均較去年全年勁升逾30%。
20040928-209,20040928,209,皇九8樓標售,皇九8樓標售 投資者大舉入市，除受自由行帶動而交投熾熱的舖位物業，甲級寫字樓也備受追捧，而業主也趁勢放售手上單位，榮豐國際持有的中環皇后大中九號8樓全層，現以招標方式放售，估計市值逾1億元。  代理仲量聯行投資部主管盧慶雄表示，8樓面積13721方呎，業主自用一個單位，其餘已全數租出，月收33.4萬元。上址截標日期為10月20日。他補充，今年7月，15樓一個細單位以每呎逾萬元易手，料今次標售的8樓，可獲青睞。據了解，業主意向呎價逾1萬元。  較早前，大摩基金持有7年的24樓全層，分拆為7單位出售，面積700餘至2800方呎，呎價9200至1.02萬元，並於短時間以每呎9200至9300元，沽出2個單位。  資料顯示，皇后大道中九號3003室，3230方呎，業主委託中原標售，已於上周六截標，單位市值3300萬元。  據代理表示，皇九現時叫租每方呎為25至26元，以此計算，回報率約3厘。
20040928-210,20040928,210,御海園推5伙應市,御海園推5伙應市 【本報訊】華業（控股）發展的薄扶林御海園，剛獲發入伙紙，即日起推出5個單位，包括3個分層、1個複式及1個相連單位，平均呎價9295元。物業至今售出3伙，總值1億元，料全數售罄，合共套現逾7億元，扣除成本，利潤可觀。     入場費1200萬元   御海園提供32個單位及4座洋房，至今售出1座洋房，1個分層及1個複式單位，呎價9600至1.5萬元，3伙共值1億元。餘下30個單位及3座洋房，現推出首批5伙，面積1432至2523方呎，入場費1200萬元。餘下3座面積4200至5500方呎洋房，發展商擬提升交樓質素，暫不會推出市場，不過買家可議價洽購。  御海園至今套現1億元，預計餘貨全數沽清，可套現7億餘元，該項目地皮及建築費分別1.6億及1.3億元。華業主席兼董事總經理周年茂表示，豪宅供應愈來愈少，物業尚有加價空間。
20040928-211,20040928,211,藍天取消樓按優惠,藍天取消樓按優惠 【本報訊】樓市現升勢，發展商陸續削減優惠。香港興業（480）的東涌藍天海岸，下月3日起取消首18個月P（優惠利率，5.125厘）減5厘優惠，另配合中秋節假期，以呎價3600元推出該盤第2座高層單位，本周日前送贈半年管理費。  香港興業市務經理林紅表示，藍天海岸自本月初推出第2座以來，累售230伙，佔該座392伙的59%，套現6億至6.5億元，平均呎價3400至3500元。市道好轉，集團視乎賣地成績決定銷售策略，近兩星期已放慢賣樓速度，每周推售10餘伙應市。  配合中秋節假期，推出該座40至50樓單位，呎價3600元。周日前該盤買家獲贈管理費，每方呎1.55元。10月底前透過利嘉閣地產購入該盤，送郵輪優惠，名額3個，總值8.4萬元。
20040928-212,20040928,212,港島豪宅市況活躍,港島豪宅市況活躍 【本報訊】市場昨日錄得多宗大手成交，淺水灣道56號（圖）的38號複式單位，面積4153方呎，附連1319方呎天台，以7100萬元售出，呎價17096元。  壽山村道松柏花園3A號屋，2100方呎，剛以2290萬元成交，呎價10905元。大潭陽明山莊9座12樓59室，2628方呎，連租約，以2200萬元成交，呎價8371元，另13座低層75室2787方呎，亦以2088萬元沽出。中半山堅尼地道36至36A號1樓相連單位，以2700萬元成交。     碧堤蔚藍獲掃貨   另外，尖沙嘴君臨天下1座59樓A室1433方呎，以1830萬元成交，業主今年初以1336萬購入，獲利494萬元。跑馬地禮頓山1座30樓A室，1438方呎，則以1650萬元易手。另淺水灣華景園3座10樓A室，以1200萬元轉讓。  投資者繼續大手掃貨，美聯梁少峰說，深井碧堤半島二期獲投資者以1200萬購入4伙，呎價3900至4100元。港置張國鋒稱，將軍澳蔚藍灣畔獲中資以1056萬元，購入4個二手單位。  另外，本地商人昨以近3000萬元掃入屯門聚康山莊12伙，平均呎價約2700元。
20040928-213,20040928,213,歌賦山道28號2伙獲預留,歌賦山道28號2伙獲預留 【本報訊】盈科大衍（432）主席李澤楷私人持有的山頂歌賦山道28號，全數7座洋房，落實售出3伙，另2座獲預留，可供發售的僅餘最後2座，呎價維持2.1萬至2.3萬元，入場費至少1億元。  歌賦山道28號最近售出的2號屋為示範單位，面積8216方呎，連5975方呎花園及逾1000萬元裝修，作價1.7億元，每方呎20691元。另5及6號屋分別作價1.3億及1.2億元；餘下4座洋房包括面積近1萬方呎的1號屋，料成交價可達2億元。估計7座洋房可套現超過10億元。     機樓改建精品豪宅   盈大行政總裁李智康表示，豪宅供應自明年起大減，市場對豪宅需求增，不少買家購入豪宅作投資用途，旗下薄扶林貝沙灣南灣原定今年只售250伙，由於反應熱烈，保留的50伙也一併推出，至今已全部沽清，最後售出的7座低層單位，以呎價近9000元成交。南灣餘下200伙，預計明年初發售，分層單位每方呎售價至少1萬元。  繼貝沙灣及歌賦山道後，集團將主力重建機樓，首個重建項目詳情將於一兩周後公布。由於機樓佔地不大，只可重建單幢樓，會以精品豪宅為發展路向。
20040928-214,20040928,214,楊家誠脫造市罪違反披露條例罰款4.3萬,楊家誠脫造市罪違反披露條例罰款4.3萬 【本報訊】證監會公布，成功檢控易達興業（855，現稱中國銀龍）的大股東楊家誠，指他於01年曾5次持有易達已發行股本超過20%，但未有披露，違反《證券（披露權益）條例》。  不過，證監檢控他在期內操縱市場的罪名不成立，他只被罰款4.3萬元及須繳付調查費7398元。  證監指楊氏在01年5月17至24日期間，蓄意造成易達股份成交活躍的虛假誤導性表象，違反《證券條例》。證監在該7天期間內共識別出194宗涉及楊氏的清洗交易，其中大部份交易在今年5月18及21日發生。楊氏在觀塘裁判法院聆訊期間就該控罪提出抗辯，裁判官林鉅溥認為楊氏提出充份的疑點，故裁定其市場操縱罪名不成立，但裁判官接納控方指楊氏令人生疑的說法。
20040928-215,20040928,215,樓市精點,樓市精點 太古城造價升8%   ▲香港置業陳偉指出，鰂魚涌太古城本月至今錄得85宗成交，平均呎價約4600元，較上月升約5至8%，其中耀星閣高層B室，面積757方呎，剛以360萬元售出，呎價4756元，原業主獲利20萬元。  ▲世紀21李獻章說，西灣河逸濤灣3座低層A室，面積760方呎，剛由一對新婚夫婦以370萬元購入，呎價4868元。     美孚租客入市   ▲中原黃惠霞說，荔枝角美孚新邨百老滙街54號極高層A室，面積1750方呎，成交價608萬元，呎價3474元，買家為該屋苑租客。美孚新邨本月至今錄得130宗成交，已超過上月全月的115宗，平均呎價2380元。  ▲美聯陳瑞章稱，紅磡黃埔花園本月暫錄得60宗二手成交，較上月同期增43%，平均呎價也升7%至4050元。日前7期5座中層A室，面積888方呎，成交價348萬元，呎價3919元。     海名軒民企承接   ▲中原王淑儀表示，紅磡海名軒獲內地民企以1900萬元購入2座高層A室，面積2139方呎，呎價8883元。而1座低層B室，2548方呎，以約2300萬元成交，呎價9027元，買家為中港商人。 都會軒高價成交   ▲利嘉閣林穗華表示，日前一外籍商人以345萬元購入紅磡都會軒1座高層18室，597方呎，呎價5779元，較市價高出5%。     藍澄灣高市價17%   ▲中原麥成輝表示，和記黃埔地產的青衣藍澄灣，剩餘的20伙貨尾，過去周六日賣出14伙。其中，第6座高層H室示範單位，638方呎，以246.8萬元售出，呎價3868元，由於連家具及享海景，造價較同類高17.2%。  ▲長實發展的廣州國際玩具禮品城，與六家銀行包括恒生、中國工商銀行、中國銀行、交通銀行、民生銀行、深圳發展銀行合作，為玩具城買家提供金融服務。當中，港資的恒生銀行提供P（優惠利率，5.125厘）減1.5厘港幣貸款安排。
20040928-216,20040928,216,地產多聲道：畢加索名畫蒞臨國金中心,地產多聲道：畢加索名畫蒞臨國金中心 法國國寶畢加索名畫「巡遊舞劇帷幕」，下月十四日至月底，空降全港最高最大型國際金融中心商場公開展覽。法國總統當日重會出席開幕禮。  新地伍步昂話，呢件係無價國寶，由於法國領使出面，巴黎龐比度中心至肯借出，展覽活動未計保險費已高達一千萬，國金管理公司，會安排每隊二三十人嘅保安隊，二十四小時看守呢幅名畫，以策安全。  佢重話，幅畫有生命，好似人咁要休息，所以展覽時間限於朝十一晚七。  另外，原來特區政府都有借來啲法國名畫，明年在港展出。     價值千六萬浴室   山頂歌賦山道二十八號豪宅，噚日開放逾八千呎嘅示範單位，獨佔頂樓全層嘅套房，內有七百五十六呎嘅浴室，面積大過間房，唔單止夠大，計落重好貴㖭，以間屋嘅呎價計，呢個浴室值千六萬。 爵悅頂樓叫皇庭   屋苑特色單位，近年興改番個名以顯身價，新地荃灣爵悅庭都唔例外，四個頂層複式命名為「爵悅皇庭」，乃係美聯早前搞命名比賽嘅冠軍作品，得主有五千蚊獎金。  新地周國賢話，原本內部已經改做「爵悅皇廷」，咁啱同美聯嘅得獎作品讀音相同，之後考慮過，覺得「庭」字較「廷」感覺較溫馨，最後決定採納美聯嘅冠軍作品，反而棄用自己嗰個。     沙田第一城供平過租   加息周期展開，供樓支出趨增，但仍有唔少租轉買個案，利嘉閣周德龍話，沙田第一城一座低層E租客，剛以百七萬買入同座中層E，五百四十呎，每呎三千一，高市價五巴仙。  佢轉租為買，係因為「供平過租」，佢畀開七千五蚊租，現以七成按揭，最優惠利率減二厘六，二十年還款計，月供唔使六千四。就算再加啲息，仍然有着數。     西貢封路一箭雙雕   西貢市中心萬年街一帶，黑社會霸佔咪表車位，非法代客泊車，一直令警方頭痛，最近警方諗到條橋，建議將萬年街同部份市場街路段，喺泊車高峯期間，即禮拜一至五下晝六點至凌晨十二點，周六日同公眾假期朝十二晚十二，封咗佢唔畀泊車，變做行人專用區，嗰度食肆重或者可以搞露天茶座。  警方話，萬年街嘅食肆冇反對，政府其他部門冇意見，而旅遊事務專員話，可改善海旁一帶環境，同促進呢區旅遊業。但有啲區議員認為，西貢車路已少，咁做可能令嗰度重塞車。蘭西就關心對舖位租售價嘅影響多啲。  蘭西  電郵地址： nancy@appledaily.com 
20040928-217,20040928,217,嘉華星濤灣裝修似示範單位,嘉華星濤灣裝修似示範單位 馬鞍山嘉華星濤灣戶戶有露台，八成單位享海景，其餘望山，視野皆開揚，是物業強項賣點。介紹屬前者，客廳露台及兩房均與海為伴，加上位處高層，景觀開揚，並可眺望中文大學，感受一下書卷味。  戶主於飯廳一壁鑲大鏡，好將海景反映入室，其他牆身分別鑲玻璃及鋪雲石，另建有地櫃及假天花燈槽，布局如示範單位般。此外，房間設計有心思，大房變身子母房，中央以一扇鏡面趟門分隔，變相可當作三房看待。     海景兩房戶罕有   嘉華星濤灣以兩房居多，利嘉閣宋良安說，馬鞍山兩房海景戶罕有，此屋苑正好補市場所缺。入伙僅數月，放盤多為交樓標準，這伙裝修費10餘萬元，每呎開價3660元，屬合理價。其他海景叫價3500至4000元。他說，嘉華星濤灣上趟兩房海景成交在8月底，2座低層C，722方呎，作價240萬元，每呎3324元。  記者：溫潤潔　攝影：司徒世華
20040928-218,20040928,218,國美大股東配售套9.54億,國美大股東配售套9.54億 【本報訊】國美電器（493）在7月曾兩次嘗試配股，均因市況欠佳告吹，但昨日終成功完成配售。市場消息稱，國美大股東兼主席黃光裕配售2.4億股舊股，每股定價3.975元，較停牌前折讓15.43%。黃氏至少可套現9.54億元。 國美昨日開市前停牌，進行配股。配售工作在收市後完成，配股價定於3.975元，以04年預測盈利計算，預測市盈率約15倍。今次配售價接近上次配售價的下限，而且配售股數銳減，令集資金額縮減逾五成，更較首次擬配售時的金額大減近30億元。是次配售安排行仍為荷銀證券。  接近安排行消息人士表示，以接近上限的配售價訂價，是因為反應理想。據悉，今次荷銀並沒有為國美舉行推介會。該消息人士拒絕透露，今次配售的具體認購情況，只表示有關配售獲超額認購，並很大可能行使6000萬股的超額配售權。若荷銀悉數行使超額配售權，黃光裕將可額外套現2.39億元，達11.93億元。     黃光裕還需再減持   有分析員表示，今次配售價較上兩次合理，再加上近期市況亦較理想，能成功配售是意料之內，但市場最的大憂慮是，黃光裕還需再作配股，將其持股量降至75%或以下。  今次配售前，黃光裕包括行使可換股票據在內，共持有國美97.2%股份，而今次配股約相等於國美已發行股本約14.62%，若將超額配售的6000萬股計算在內，則會增至18.27%。配售完成後（假設悉數行使超額配售權），黃光裕持股量將降至78.93%，還需配售多近4%股份，才可符合最低公眾持股量25%的要求。  另外，外電報道，摩根士丹利以3.9億元購入內地第3大電器連集團上海永樂20%權益。完成交易後，摩根士丹利將是永樂第3大股東，有關交易正待上海市政府審批。永樂計劃明年上市集資78億元，今次引入摩根士丹利為股東是上市計劃的其中一部份。
20040928-219,20040928,219,樓按拖欠率6年新低,樓按拖欠率6年新低 【本報訊】金管局昨日公布8月住宅按揭調查，由於一手市場的新批貸款減少兩成，抵銷了二手樓交易貸款13.8%的增長，令期內新批住宅按揭貸款減少0.5%，至117億元。按揭貸款質素則繼續改善，拖欠比率由7月的0.54%降至0.5%，是自98年8月以來錄得的最低比率。     8月新批貸款降0.5%   東亞銀行（023）總經理兼個人銀行主管唐漢城表示，8月整體市場樓按業務略為放慢，因期內推出的大型新盤減少，除嘉亨灣外，主要為貨尾盤。此外，一些入伙期短的新盤，業主多選擇建築期供款，故不會「即時上會」，亦令市場的按揭生意稍為放慢。他認為，9月份尚有數天便完結，暫時看表現應與8月相若。本地銀行剛公布增加最優惠利率0.125厘，至5.125厘，迄今未見對市場的影響。     定息借貸需求增加   按揭調查又顯示，8月新取用住宅貸款減少14.5%，至92億元；未償還按揭貸款微跌至5233億元，涉及加按及轉按的交易，亦較7月減少0.3%。  以低於最優惠利率超過2.5厘新批出的貸款所佔比例，由7月的65.3%進一步上升至66.1%。隨着市場預期進入加息周期，定息按揭的需求增加，所佔整體按揭的比例由7月份的12%升至15.4%。
