key,date,article_daily_id,title,text
20040923-0,20040923,0,涉款4億台幣5個香港老千呃一萬台灣人,涉款4億台幣 5個香港老千呃一萬台灣人 【本報訊】台灣高雄警方連破兩宗由港人操控老千集團策劃的驚天大騙案，共拘捕五名香港老千及多名台灣人，兩宗騙案分別以期貨買賣和電訊促銷優惠招徠，合共騙了超過一萬名台灣人，涉及金額達四億新台幣，折合港幣逾九千萬元。警方在行動中，發現涉案詐騙集團幕後操控期貨價格，而其辦公室更安裝有一尊「黃大仙」像，內裏布置恍如迷宮，到處是暗門秘道，十分詭異。 高雄市警局刑警大隊昨日公布破獲地下期貨詐騙集團的經過，發言人指出，被捕的四名主犯為香港黑幫分子，他們在各縣市成立多間空殼公司，並以已婚婦女為對象刊登招聘廣告，然後游說投資，受騙婦人達二千人，詐騙金額至少二億元新台幣（折合約四千六百萬港元）。另外，高雄警方亦偵破了另一個以香港人為主腦的兩人詐騙集團，該集團以電訊促銷優惠為名，受騙人數達八千人之多，包括銀行在內，涉及金額亦達二億元新台幣，即約四千六百萬港元（詳見另文）。     成員幕後操控價格   據警方調查該個期貨詐騙集團得知，四名香港首腦每隔一段時間即往返港台兩地，並對外訛稱自己是新加坡人或馬來西亞人，他們不斷吸收成員，做案範圍遍及全省各地，而犯罪集團每到一縣市都只逗留一兩個星期便轉移陣地，以避開警方耳目。其中香港的主犯更從香港帶了一尊「黃大仙」像往台，供奉在辦公室內以求平安。  四名香港主犯分別為蘇汝超（四十二歲）、丘耀東（三十六歲）、莊鴻炎（三十七歲）、陳志偉（四十一歲），他們負責組織分工及欺詐布局；被捕台灣男子許乃彤（三十九歲）則為掛名的公司負責人，袁惠君（三十歲）、楊秀婷（三十歲）、林毓純（二十九歲）為面試主管及會計，其餘人等則假扮資深員工，慫恿新進員工投資，整個集團共有十八人。  台灣警方指出，本月初，受害人在報章上看到「興旺嘉有限公司」刊登招聘廣告後前往應徵，旋即獲得取錄，上班後即有所謂資深人員教她寫「報價表」，其間對方多番試探受害人的經濟狀況，並慫恿她們進行投資期貨，結果受害人經不起誘惑而中招，最後血本無歸。 警方表示，案中期貨以口數為單位，有四口、六口及八口等，每一口金額相當於四十萬元新台幣（約九萬港元），一人最少買兩口，亦即八十萬元（約十八萬港元），公司從投單到觀看期貨交易跳動的電腦顯示都是偽裝的，幕後有成員假造成交價格，整場交易其實都是一場騙局。     辦公室設密室秘道   警方調查後發現，這個詐騙集團只要騙得金額超過千萬台幣（約二百三十多萬港元），就會利用假日晚間搬家走人，到另一個據點捲土重來，為了避免引人注意，集團成員進出大樓都戴上口罩以免容貌曝光，辦公室更設有密室、暗門及秘密通道以方便逃逸。  高雄市警方在九月初展開調查，發現這家公司從高雄市轉移到屏東市民生路，並改名「寶鼎新業有限公司」詐騙。前天深夜，警方採取行動將各涉嫌人等一舉成擒，除了逮到十八名男女嫌犯外，並起出電腦、電話機等各式機具四十五台，另有代碼表、假期貨資料、帳冊、銀行存摺及五十八萬元台幣（約十三萬港元）贓款，兩年來共有二千名婦人受騙，涉及金額二億元台幣以上，折合逾九千萬港元。
20040923-1,20040923,1,匯豐更換辨偽「存錢妥」新機,匯豐更換辨偽「存錢妥」新機 針對不法之徒利用滙豐銀行「存錢妥」辨識鈔票系統犯案，銀行已在員工培訓及器材技術兩方面作出改善，除加強員工分辨真假鈔能力外，同時引入一批防偽功能經技術改良的「存錢妥」機，目前全線一百六十部舊式「存錢妥」機，已更換了二十多部新機，置於不同分行及日夜理財中心。  滙豐銀行發言人表示，該銀行的「存錢妥」機於一九九三年正式投入服務，銀行於十年間不斷加添新機，滙豐銀行目前全線擁有一百六十部「存錢妥」機，主要設置於各分行、日夜理財中心及理財易中心。     職員監察運作   案發後銀行方面鑑於不法之徒利用「存錢妥」系統以假鈔換真鈔，即時停止理財易中心的「存錢妥」服務，只餘下分行及日夜理財中心的「存錢妥」機，可於辦公時間內在銀行職員監察下繼續運作。  發言人又稱，銀行現已引進擁有更先進防偽功能的「存錢妥」機，過去市民使用舊式「存錢妥」機，只能逐張鈔票存進機內，新機經改良後，可每次存進三十張鈔票，並能更準確辨認面額一千元、五百元及一百元紙幣。滙豐銀行目前已更換了二十多部新機，置放於分行及日夜理財中心。另一方面，銀行亦不斷更新員工辨別真偽的資料，給前線經常接觸鈔票的員工提供訓練。  本報記者
20040923-2,20040923,2,四年49人服中藥有不良反應兩人飲廿四味感冒茶過敏,四年49人服中藥有不良反應 兩人飲廿四味感冒茶過敏 【本報訊】港人服用中藥普遍，衞生署過去四年共接獲四十宗涉及四十九人服食中藥後出現不良反應的個案，包括兩宗飲用廿四味涼茶及感冒茶後，呈現皮膚痕癢、屙嘔及肚痛等過敏反應，署方強調該兩宗個案乃個別人士出現的過敏反應，與涼茶藥方無關；中醫師則呼籲體質虛寒人士少飲涼茶。  衞生署自○○年一月至今年六月，共接獲四十宗服食中藥或中成藥後感不適的呈報個案（見表），涉及四十九人，年齡由六至八十七歲，其中三十八人須入院治療，六人需深切治療，幸無人死亡。     多人因烈性中藥出事   其中最多人因服食製川烏、製草烏或熟附子中毒，主要因為藥材中的毒性成份烏鹼影響服用者的中樞、呼吸、心臟及消化系統，其中三人需深切治療；另有六人服食洋金花後不適，其含有的東莨菪鹼等毒性可影響心血循環系統；此外，五人服食尋骨風、廣防己及馬兜鈴中毒，三種藥物均含有馬兜鈴酸，可致腎衰竭。  至於兩人因飲用廿四味及感冒茶後出現過敏反應，衞生署發言人表示，兩人飲用後出現皮膚痕癢、嘔吐、暈眩及肚屙反應，調查後證實過敏反應與廿四味或感冒感的藥物或藥方無關，相信是個別人士的本身問題。  衞生署表示，服藥後出現不良反應的原因，包括使用及劑量不當、藥物含有雜質及錯誤用了其他藥物替代等。在四十宗個案中，有十二宗涉及市民自行買藥服食，甚至自行購買受監管的烈性中藥服食而出事。  中醫師公會主席關之義表示，製川烏及熟附子等均為烈性中藥，必須在註冊中醫師的處方下才可服食，市民絕不宜自行購服。廿四味則屬性苦寒，脾胃虛寒、行經婦女及孕產婦女不應飲用，感冒茶則一般屬辛溫類，雖無毒性中藥，但市民也應先行向中醫求診，診斷體質後開藥較安全。 專家不鼓勵多飲涼茶   香港大學中醫學院助理教授朱藹美不鼓勵市民飲太多涼茶，因為涼茶乃針對以往南方天氣熱，用作解實熱，但現代人多在冷氣下生活，很少暴曬，若飲用太多涼茶，反而會令體質變得虛寒。她又提醒市民，不少減肥中成藥成份不明，不宜胡亂服用。  本身為註冊中醫師的涼茶店春回堂第三代傳人林先生指出，廿四味是南方藥，沒有通方，不同的涼茶舖可能有不同的配方，但主要材料包括紅絲線、水翁花、木患根、榕樹鬚等非毒性中藥，具疏風散熱、清理腸胃、利尿、利大便及提升免疫力等功效，一般來說是老少皆宜藥物，若市民有其個別隱疾，則應在飲用前求教中醫。
20040923-3,20040923,3,本港立法規管中藥,本港立法規管中藥 【本報訊】自○三年起，本港透過現行法例，制訂中藥及中成藥批發及零售商的發牌制度，以此規管在港發售的中藥和中成藥，中成藥並須經當局評估其效用及安全性後，方可在港註冊發售。同時，法例對中藥的貯存、標籤及調配都有所規定。     中成藥須註冊   《中醫藥條例》由特首委任的香港中醫藥管理委員會執行及實施，根據該例，任何人士欲經營中藥材零售或批發、中成藥批發或製造，均須向衞生署中藥組申領牌照。同時，按中成藥註冊制度，所有中成藥必須經中藥組註冊，方可進口、在港製造和銷售。該例的附表又訂明三十一種毒性中藥材及香港常用的五百七十四種中藥材。  至於涼茶舖出售的涼茶，由《公眾衞生及市政條例》規管；樽裝涼茶則視乎產品的應用方法、聲稱用途等，而決定是否屬於中成藥。
20040923-4,20040923,4,村居老漢冒死撲火,村居老漢冒死撲火 【本報訊】元朗田廈路田心村一間村屋的分租房，昨晨七時許疑因洩電導致閉門失火，火舌席捲一發不可收拾。七旬老房東誓死保衞家園和挽救二十九吋電視機，冒着屋頂倒塌危險，不斷來回奔走十多次用水桶載水奮力撲火，要由趕至消防員勸止拉開。由於村口水井無水要耗半小時拖喉八百米，毗鄰村民同心合力開喉射水阻止蔓延，最後火警救熄無人受傷。  發生火警現場是田廈路田心村一間逾千呎、用鋅鐵及木搭建而成的平房，房東姓陳（七十七歲）與妻子同住，其妻在洪水橋賣衫。據街坊稱，陳伯有六名子女全部已婚遷出，十多年前他將廢置的豬欄改建成六個分租房間，現時其中兩個房分租予兩名單身漢。  昨晨七時許，消防員接報趕至阻止陳伯奔入火場，但被他掙脫，雙方一度角力，要兩名消防員熊抱將他拉開。不過村口水井無水，要拖喉八百米。其間消防員與警員也只得效法陳伯，用洗面盆和水桶載水淋火。毗鄰村民則在單位拉水喉，爬上屋頂向起火單位射水。
20040923-5,20040923,5,倘07、08冇普選　擬接受政治現實梁家傑支持中途站政改,倘07、08冇普選　擬接受政治現實 梁家傑支持中途站政改 【本報訊】以爭取○七、○八年普選為參選政綱的《基本法》45條關注組成員、立法會九龍東候任議員梁家傑表示，若中央堅持二○一二年才讓香港普選，只要○七、○八年選舉方案不違背普選目標及加強代表性，如加入區議員為選舉委員會成員推選特首，他會考慮支持這種「中途站」政改方案。　記者：羅偉光 選舉結束後泛民主派醞釀就政改方案達成共識再向港府提出意見，但各黨派評估政治形勢後調整立場，令能否達成共識出現微妙局面。梁家傑接受本報訪問時指出，經歷兩年7.1大遊行、區議會及立法會選舉，加上支持○七、○八年普選的泛民主派候選人獲六成二選票，形同對普選的全民公決，因此中央應信任並了解港人民主訴求，繼續指香港未成熟實行普選是「貽笑大方嘅政治表述」，「冇人話人大全體會議唔可以推翻人大常委會決定，重有○五、○六年兩年人大會議，有機會改變人大常委會決定，只係有冇政治決心嘅問題。」     不接受再增功能組別   不過，梁家傑承認始終要面對政治的現實，不會貿然反對漸進式政改方案，「如果最後擺上枱嘅方案唔違背普選目標，而且喺代表性方面有進步，我會考慮支持。」他舉例稱，若選舉委員會擴大至一千六百人，並包括民選區議員，在增加了代表性的情況下他可以接受，但卻不能同意增加立法會功能議席的數目，「咁做係倒退，唔可以接受。」  梁家傑形容這是「中途站」式政改方案，「中央指○七、○八年唔可以普選，但唔可以君臨天下赤裸裸咁將決定加諸香港人身上，香港人係講道理嘅，只要中央講明白，話二○一二年可以普選，再提出具體時間表，一步一步去實行，畀香港人睇到隧道另一邊有光明，先可以解決管治問題。」 北京對港分鷹派鴿派   北京選舉前向民主派釋出善意，選舉過後中聯辦即約見了45條關注組的四名大狀。梁家傑稱中央最大智慧是邀請全體議員上京，直接聽取意見，「中央唔能夠永遠喺北京遙控香港，應該建立恒常溝通機制，向香港開放溝通渠道。」他說過去幾年接觸一些內地官員及學者，感到內地對香港政策有鷹派、鴿派，決策時會互相牽制，因此民主派意見不一定獲接納，「我哋講咁多嘢雖然未必即刻有成果，但至少北京唔會一面倒只聽到一種聲音。」     直選才感受選民期望   初次直選，梁家傑稱最深刻是目睹社會貧富懸殊嚴重，「經過直選洗禮嘅人，先會感受到選民嘅期望同責任，唔會輕易行使權力，董生就係因為冇試過直選，先做唔到真正想市民所想，急市民所急。」
20040923-6,20040923,6,從助選青年睇到香港希望,從助選青年睇到香港希望 梁家傑未參選前，幾乎每晚都會回家與妻子及子女吃飯，但隨着新一屆立法會開始正式運作，這個「住家男人」亦要改變習慣，他說已定下工作時間底線，希望日後每星期最多只有三晚不回家吃飯，爭取時間敍天倫。     每周四日回家吃飯   立法會議員工作繁重，梁家傑稱大律師工作方面，估計只可應付目前五分一的工作量，即每月最多可抽二至三日時間上庭，家庭生活方面，他已定下工作時間底線，目標是每星期最多只有三晚不回家吃飯，其餘四晚留給家人，記者提醒他星期三肯定不能回家晚飯，因為逢周三的立法會會議通常於晚上十時後才結束，他詫異地說：「乜要開到咁夜。」  梁家傑這次在九龍東孤身作戰，他說全靠一班年輕的助選團成員投入，「令競選工程做到個勢出嚟」，他又說助選團中不乏醫學院、法律系大學生，日後希望可藉社區服務及政策研究維繫這班底，「喺呢班後生仔身上，睇到香港嘅希望。」     秀茂坪邨說服阿伯   回想這次選戰，他說，最大收穫是學懂聆聽不同意見，並透露曾在大班被包圍的秀茂坪邨遭一長者質問，他沉着氣逐一回應，最後對方竟稱「你都唔係冇道理」，他說：「只要你對人冇偏見，始終都有機會說服到人。」  本報記者
20040923-7,20040923,7,學者建議特首暫緩削綜援,學者建議特首暫緩削綜援 【本報訊】在社福界及候任立法會議員反對下，特首董建華正考慮撤回下月一日實施削減長者及殘疾人士逾百分之五綜援金的安排。有學者建議特首可暫緩執行削減綜援至明年一月，令貧苦大眾得以暫時紓緩苦況。     可押後至施政報告後   中央政策組昨與社聯舉行滅貧研討會。研討會嘉賓之一、香港大學社會工作及社會行政學系講座教授周永新建議特首運用政治權力，押後削減綜援日期至明年一月，即發表新一份施政報告後才實施。他表示，削減綜援的討論已演變成政治角力；鑑於通過削減綜援方案時已經過詳細討論，因此不宜擱置。  候任社福界立法會議員張超雄歡迎建議，認為可令有需要人士「鬆少少氣」。中央政策組首席顧問劉兆佳表示，港府正考慮是否如期削減綜援，至今未有決定。行政會議成員兼工聯會會長鄭耀棠認為，行會與立法會已通過削綜援方案，應該尊重法治精神。  特首辦昨表示，特首仍在考慮部份候任立法會議員提出撤回第二階段削減綜援的安排。
20040923-8,20040923,8,民主黨入營商政治定位,民主黨入營商政治定位 【本報訊】經歷選戰失利、議席減少的民主黨，定於十月十日舉行退思營檢討黨務，該黨中委、立法會黨團及地區支部都會派員參與，討論範圍包括議員利益申報制度到未來政治定位，議題也可能包括民主派與中央溝通的問題。外交部駐港特派專員楊文昌昨晚表示，萬事起頭難，但民主派訪京的希望大大存在。     楊森否認會大幅重組   據了解，民主黨正、副主席將於退思營中提出具體方向和方案讓黨員討論。主席楊森指，該黨與中央溝通的立場大抵已定，希望雙方可接觸之餘，也會要求平反六四和爭取○七、○八普選。  他說退思營最主要的議題是民主黨未來的政治定位，因新一屆立法會加入了多位大律師及鄭經翰、梁國雄等人，泛民主派的政治光譜寬闊了，民主黨需要思考定位何在。  另外，楊森否認議題包括民主黨內部大幅重組的可能性。
20040923-9,20040923,9,社福界張國柱放棄呈請,社福界張國柱放棄呈請 【本報訊】立法會社會福利界及會計界兩個組別選舉時均出現臨時投票人數與收回選票不符的情況，以六十四票之差落敗的社福界候選人張國柱昨與選舉管理委員會委員梁乃鵬會面後表示，不再尋求推翻選舉結果。會計界候選人陳茂波仍未放棄，已透過律師去信選管會，要求審閱有關的文件和紀錄，若發現有可疑會提出選舉呈請。     陳茂波查投票紀錄   張國柱昨引述梁乃鵬指投票人數只是臨時數字，可能會出錯，並稱若要重新覆核投票資料，需由法庭頒令。張國柱表示，無奈接受對方解釋，因有法律意見認為呈請理據不足，且法律費用龐大，故將不會提出選舉呈請，但會將自己的個案交由民主發展網絡選舉監察小組跟進。  陳茂波指選管會方面未有約他見面，他上周五已透過律師去信選管會，要求派人審閱有投票紀錄的電腦報表等資料。
20040923-10,20040923,10,民主黨抽輸　無得調位長毛坐近自由黨,民主黨抽輸　無得調位 長毛坐近自由黨 【本報訊】新一屆立法會議員尚未正式就任，先預演一場「政治角力」，為爭取未來四年在議事廳中的有利位置，各大黨派及獨立議員昨日開會商討座位安排。暫定的座位表上，民建聯保住原有位置；民主黨希望從側面座位改到正中位置的願望落空；「長毛」梁國雄，則成功爭取坐在自由黨附近。  十多位候任議員昨開會商討座位安排，各人對座位各有偏好。沒出席的長毛由獨立議員陳偉業代表，兩人除希望座位相連外，也表明希望坐在自由黨附近，正與自由黨商討入黨的鄉議局代表林偉強也主動要求與自由黨同坐，最後大家都得償所願，林偉強夾在自由黨及梁國雄中間。     四大狀面向主席位   上屆與民主黨李柱銘為鄰的金融界代表李國寶希望繼續坐在李柱銘身旁，新入會的鄭經翰也有同樣要求，結果兩人成為李柱銘的左鄰右里。  過去四年自由黨和民建聯佔據了正面對着立法會主席的座位，民主黨只能坐在側面，這次民主黨要求換位被其餘兩黨拒絕，要以抽籤決定，自由黨抽到「頭籌」可優先選位，其後依次是民建聯、部份獨立議員、泛民主派及早餐派，結果三大黨基本位置沒有大變。  《基本法》45條關注組余若薇、吳靄儀、梁家傑和湯家驊則取代了上屆早餐派議員面向主席台的前排四個相連座位，最後選位的五位早餐派議員別無選擇，調到民主黨後面坐。
20040923-11,20040923,11,利用客戶合約騙銀行,利用客戶合約騙銀行 【本報訊】除了港人操控的期貨詐騙集團外，台灣警方昨亦拘捕了以開設寬頻公司詐騙的港人主謀。在台灣讀大學的香港男子陳板文夥同台灣老千在台開設公司，以優惠價代辦寬頻服務及銷售手機作餌，吸引八千人訂購三年寬頻服務，並安排訂戶向銀行分期付款，老千集團預先向銀行取得三年服務費，但一年後集團將公司倒閉，捲款潛逃，從中詐騙二億元新台幣，約港幣四千多萬元。     開設21間門市   高雄警方經半年追查，昨日分別在台中和高雄兩地，拘捕涉嫌詐騙的港人和其他兩名台灣同黨，其中香港主謀陳板文，四十八歲，報稱在台灣讀過大學，他在公司雖然只是副總經理，但負責公司的實際操作，而另兩名台灣同黨則為一對同居男女，包括在公司任總經理的蕭宇清，三十七歲，曾有詐騙前科，以及蕭的姓夏女友，為公司另一名負責人。三人昨日被捕後均否認指控，並互相推卸責任。台灣警方在涉案疑犯的單位內起出大批贓物、存摺、合約及公司的廣告單張等。  警方透露，陳板文和蕭宇清等人在去年初合組「精聚整合行銷股份公司」，並設有二十一間門市。該公司先向台灣多家電信公司，包括台灣固網、新世紀資通（速博）、信超媒體及中華電信等簽訂一至兩年的ADSL寬頻服務，但以優惠價替人代辦寬頻上網服務，卻訛稱服務合約有三年，而且訂戶必須經指定的銀行信用卡分三十六期付款。  當客戶和銀行建立分期付款合約後，陳板文等人的公司向銀行取得三年的服務費，但公司經營一年後，在今年三月份倒閉，令訂戶和銀行蒙受巨大損失。
20040923-12,20040923,12,母趕至合十祈禱　疑生意糾紛惹禍東主遭狂斬右臂幾斷,母趕至合十祈禱　疑生意糾紛惹禍 東主遭狂斬右臂幾斷 【本報訊】港島上環半山發生駭人血案，一名物流公司東主疑因生意糾紛惹禍，昨晨在寓所附近路邊取車時，遭兩名兇徒揮刀襲擊，右手臂被斬至傷口深可見骨，血肉模糊傷勢嚴重，恐有殘廢之虞，兇徒傷人後棄刀逃去。傷者母親趕至，合十為兒子祈禱。警方調查不排除血案涉及生意糾紛。　記者：胡恩宏、梁偉權 遇襲事主姓譚（三十三歲），經營流物公司多年，與姓劉妻子（三十五歲）及父母同住上環半山卑利街英輝臺。據街坊表示，事主每日早出晚歸，習慣回家時將私家車停泊在住所附近的摩羅廟街路邊泊車咪表位，至翌日早上再到來取車，並與妻子一同乘車上班，日日如是，懷疑被兇徒已掌握事主的生活習慣進行伏擊。     傷口達一呎長   事發於昨晨八時許，事主如常離開住所到摩羅廟街路邊泊車咪表位取車。現場消息稱，當時，事主打開左邊車門站在一旁等候妻子到來，突然有兩名身穿黑衫黑褲，一名戴口罩及一名金髮男子衝至，兩人各持一柄呎半長的牛肉刀，不由分說便向事主揮刀狂劈。  事主冷不猝防右臂被利刀狂劈，連中多刀重創，其中一刀的傷口更長達一呎，由上臂直伸至手肘以下，事主當場受傷倒在地上，並驚呼狂叫：「哎呀！乜事啊！」兩名兇徒斬人後沿些利街向山下逃去，其間在摩羅廟交加街將兩把染血兇刀拋入路旁一間石屋花園內，途人見發生血案報警。  警員趕到現場見事主右手血如泉湧，立即解下傷者領呔，索緊其右前臂為他止血。傷者妻子及母親先後趕至，母親即場合十為兒子祈禱及加以安慰：「仔，斬傷隻手啫，冇事㗎，阿媽喺度唔使驚！」傷者由妻子陪同送院救治，警方派出警犬到場，沿兇徒逃走路線調查，但無發現。     兩人目擊經過   警方事後尋獲兩名目擊案發經過的市民提供資料，包括一名路過的外籍女子和附近一名店舖職員。  現場消息稱，事主近日成功獲取一宗大生意，但就外判問題與一間公司發生糾紛。據悉事主堅拒讓對方參與該宗生意，雙方曾多次談判但無果，警方正調查遇襲原因是否與此有關。
