key,date,article_daily_id,title,text
20041110-132,20041110,132,廣州性用品展遭哄搶,廣州性用品展遭哄搶 廣州巿日前舉行的性商品展銷會，在人山人海的展館內竟然上演哄搶性用品的鬧劇。一些參觀展銷會的巿民趁着會場擁擠混亂，拿起公開擺放的性商品不付錢便走，引發大批人哄搶，甚至有人趁機混水摸魚，偷走場內參展商、觀眾的手機和手袋。     有人趁機偷竊手機手袋   第二屆全國性文化節於上周六至前天在廣州舉行，同場還有非常大膽的自慰器、催情藥等性用品展覽，三天的參觀人數達到十一萬。前天中午十二時，距離閉幕還有個半小時，人流達到高峯，參展廠商紛作最後衝刺，大量性用品割價銷售，原價三百元的性用品減至一百五十元，有的性模具甚至只需幾元，吸引大量人群圍成一團搶購。  但在這時候，幾名男子走過一個攤位，突然抱起一大堆擺在桌上的性用品，沒付錢就往外跑。促銷人員連忙大聲呼喊，但由於要留在攤位看守產品不便去追，最後幾名男子消失在人群中。工作人員表示，此事件「刺激」起更多人「情緒高漲」，有幾個攤位隨即也發生哄搶事件，其中有年輕人也有老年人，還有人趁機偷竊手機和提包。  廣州《信息時報》
20041110-133,20041110,133,兩匪槍殺巡防隊員,兩匪槍殺巡防隊員 深圳巿寶安區上周日發生歹徒開槍事件，一名巡防隊員被殺。兩名歹徒開槍後，截停一輛的士逃走，不久又開槍打傷的士司機，搶走車輛後繼續逃竄，最後在警方圍捕下棄車潛逃。警方目前正通緝兩名槍匪。     再傷司機搶的士   十一月七日晚十時，巡防中隊隊員楊紅如等三人，在民警率領下於寶安體育館網球館附近巡邏，發現草坪上有兩名男子形迹可疑，遂上前盤查兩人。當被要求查看證件時，兩名男子拿起皮包就跑，民警和巡防隊員從後追趕。兩人邊逃跑，邊拔出手槍向後對準楊紅如開槍。楊的腹部中槍，送院後終告不治。  歹徒接着登上一輛的士。當的士行至南頭關口時，兩人發現有武警盤查車輛，於是向司機開槍，搶車後沿107國道逆向逃跑，司機則打開車門跳車逃走。歹徒在駕車逆行幾百米後棄車，最後溜進安樂村內潛逃。  《南方都巿報》
20041110-134,20041110,134,教育部：大學不應再加費,教育部：大學不應再加費 針對內地高等院校近年亂收費的嚴重問題，教育部副部長張保慶明確指出，今後高校教育的收費「不能再提高了」。他強調，高校收費改革是必須的，但不能使高等教育的發展以教育收費為目的，收費應只是對政府投入教育財政資金不足的一種補充。     京城大學生年使費萬元   張保慶日前在陝西西安舉行的全國高教代表大會民主評議領導幹部工作研討會上承認，目前大學生上學的成本很高。在北京，以一個大學生一個月生活費三百元計算，加上四千元的學費和回家探親等其他各項費用，一年就是近萬元，對農民和下崗工人的子女而言負擔很大。他強調，中國的高等教育不能辦成誰有錢誰就能上大學的局面，「這不是共產黨國家的教育」。  有教育專家保守估算，中國近十年的教育亂收費超過二千億元人民幣。張保慶指出，去年全國教育收費一千一百億元，其中高校教育收費四百多億元，而國家對高校的財政投入為七百多億元。  高校教育要進行收費改革，但必須堅決制止亂收費現象，現在一些高校變相提高收費標準，完全是高校本身的行為。  新華網
20041110-135,20041110,135,載鋼貨車壓死9小學生,載鋼貨車壓死9小學生 北京至珠海的京珠高速公路河北邢台南口段，昨日下午一時發生駭人的車禍。一輛載滿鋼材的貨車行駛途中突然失控翻側，車身壓住路邊一群經過該處的小學生，造成九死、十八傷，死者中除負責帶隊的一名小學教師外，其餘都是小學生。  新華網
20041110-136,20041110,136,6千億軍購案再遭封殺,6千億軍購案再遭封殺 台灣六千一百零八億台幣購買美國武器的預算案，昨在立法院程序委員會第十次闖關。國民黨和親民黨立委以十八比二，成功否決將議案列入院會議程。換言之，軍購案能否「復活」，要等下月十一日新一屆立法院選出後才能定斷。  中央社
20041110-137,20041110,137,大陸官員今抵台談包機直航,大陸官員今抵台談包機直航 胡錦濤集黨、政、軍大權於一身後，美國總統喬治布殊成功連任，台海兩岸關係亦開始出現微妙的變化。台灣當局近日突然改變態度，批准大陸直接主管兩岸包機直航及兩岸觀光事宜的官員訪問台灣。據悉，這兩名大陸官員將於今天抵達台灣，預料將與台灣當局就大陸居民直接到台灣旅遊，以及兩岸春節包機等問題展開磋商。 將於今天飛抵台灣，並進行十天訪問的是國務院台灣事務辦公室（簡稱國台辦）海峽經濟科技交流中心主任李小云。隨同李小云訪台的，還有國台辦屬下大陸海峽旅行社總經理馮卓志。據了解，由馮卓志主掌的海峽旅行社，是大陸專門負責兩岸直航包機事宜的機構。     國台辦主任李小云主持   知情人士透露，國台辦負責兩岸旅遊業務的李小云是首度前往台灣，而馮卓志則是安排兩岸包機的中方實際執行者，曾多次到台灣參觀和訪問。  目前李、馮兩人是安排大陸人民到台觀光及兩岸直航包機的重要執行人物，但兩人今年九月份申請前往台灣時，仍遭到台灣陸委會及入出境管理局的反對，後來在總統府國家安全會議出面後，陸委會等相關部門才批核李、馮二人到台灣的申請。     直接赴台旅遊料有突破   而台方負責接待兩名大陸官員的旅遊業者則指出，海峽經濟科技交流中心及海峽旅行社直屬國台辦，今年台灣總統大選前，國台辦估計連戰和宋楚瑜當選後兩岸可能三通，曾計劃以澳門為中轉站，設立海峽旅行社澳門分公司，在台灣則設立海峽假期公司。後來雖然泛藍在總統大選中失利，但海峽旅行社所建立的兩岸三地相關渠道則仍繼續運作。  知情人士指出，李小云和馮卓志訪台的公開行程，以考察台灣重要旅遊景點為主。儘管大陸還未開放居民到台旅遊，但海峽旅行社已委託台灣的海峽假期公司，製作一本介紹台灣重要旅遊點及特優商店的小冊子《發現台灣》，將在大陸發行二十萬冊。  海峽旅行社準備在內地大舉介紹台灣觀光景點的舉措，是否意味着大陸居民到台旅遊將有突破性進展，則值得留意。  台灣《蘋果日報》
20041110-138,20041110,138,包機直航須經第三地,包機直航須經第三地 目前，兩岸並沒有直航班機，數以十萬計台商往返兩岸，必須先飛到香港或澳門等第三地，再轉機前往目的地，浪費不少時間和金錢。  直航包機則是搭載台灣人的包機，飛到第三地（例如港澳）降落，稍事停留後就可原機起飛，前往大陸或台灣的目的地。這個安排最大的好處就是，乘客不用下機轉機，而是一直留在原機上，雖然還要到第三地降落，但已比以前的安排省時省錢。可是，這種變相直航安排首次出現在去年春節，之後因兩岸關係變冷而中止。
20041110-139,20041110,139,百萬台灣人移居大陸,百萬台灣人移居大陸 自從台灣民進黨四年前上台執政、發生興建第四間核電廠的激烈爭議後，台灣便掀起移居大陸的浪潮，今年總統選舉前後朝野的對抗升級，更加快了台灣人移居大陸的步伐。這五年來，在紛擾的政治爭拗中，估計已有約一百萬名台灣人移居大陸。     年輕人時興到上海工作   八七年，台灣當局開始容許居民到大陸探親，當時台灣人並不喜歡到大陸，台資公司要提供雙倍薪酬與住宿，才有台灣人願意到大陸工作。但時移世易，隨着大陸的高速發展，加上島內政治局勢惡化，到上海工作現已成為台灣年輕人時髦的象徵。  台灣前建設商公會理事長、遠雄集團董事長趙藤雄說：「上一次廢核四事件引發政爭後，這股移民潮就明顯了。自廢核四的二○○○年到目前，台灣人在中國沿海省市置產數目達五十萬戶，以一戶至少二口人計算，應該有一百萬台灣人常居中國。這次三一九槍擊事件，也加速台灣人移居中國的腳步，這個事件之後至今，初估到對岸置產的，至少有四到五萬戶。儘管今年中國實施宏觀調控，上海房價漲幅還是上揚百分二十到三十。」     赴大陸主要是企業高層   在上海經營房地產的台商夏智亮認為數字可能偏高，也沒有官方數字給予佐證，但他承認，台灣人在上海置業的數字不斷增加，估計上海每年樓宇交易中，有一成（約二萬間）是台灣人購置的。他表示，現在到大陸工作的主要是大企業派來的高級管理層，以前則是來投資的台商居多。  台灣《時報周刊》
20041110-140,20041110,140,「幽靈暴怒」進軍神速美奪1/3費盧杰,「幽靈暴怒」進軍神速 美奪1/3費盧杰 美伊聯軍總攻伊拉克「恐怖之城」費盧杰（Fallujah），周二踏入第二天。美伊聯軍地面部隊周一兵分兩路，從東北面和西北面殺入費盧杰，正式展開代號「幽靈暴怒」（PhantomFury）行動，大軍神速挺進，不足二十四小時，就控制三分一個費盧杰，殺入城內。但在兩天行動中，美軍已有五人陣亡，十四人受傷，美軍預期前頭是一場廝殺戰。 在美軍戰機開路下，美軍第一步兵師的坦克和悍馬戰車，從東北面殺入費盧杰的阿斯卡里區；五千名美國海軍陸戰隊和四千名伊軍則從北面分多路進擊，向西北面六千名武裝分子大本營的約蘭區進攻，展開「幽靈暴怒」行動的首輪地面進攻戰。  東北路大軍行軍神速，周二清晨已殺到離市中心不足一公里，奪下火車站，直奔市中心。一進城，美軍視察被一輪炮火轟炸的懷疑武裝分子目標，有美兵大叫：「到處都是橫飛血肉。」     醫院遭美軍4導彈轟炸   美軍自周一晚展開地面戰，向武裝分子據點發射逾五百枚一百五十五毫米榴彈炮。每枚炮彈都裝了全球衞星定位系統，準確擊中目標，美軍更出動無人駕駛偵察機將目標中彈後情況傳送回營地。海軍陸戰隊軍官說，美軍的進攻策略是由北面殺到南面，軍隊「最初還遇到抵抗，但現時幾乎沒有遇上抵抗」，「軍方已控制城中三分一地方」。  西北路大軍挺進速度卻比較緩緩慢，也遇到更猛烈的抵抗。美軍一度要向約蘭區外圍的武裝分子據點，投擲至少四枚二千磅炸彈。到周二早上，已有海軍陸戰隊員進駐區內一些建築物天台。 美伊聯軍說遇到的抵抗比預期少，但費盧杰居民說，城東和城北持續有駁火，美軍周二更向一所醫院發射四枚導彈，造成多人死傷。居民又指，北部巷戰非常激烈，至少有兩架美軍坦克陷火海，聯軍一度遭到猛烈炮火攻擊，要急召戰機向武裝分子藏身地發射導彈支援；在東北部則有美軍直升機遇襲中彈，機師受傷，但安全返回基地。     半天地面戰17美軍死傷   費盧杰聖戰戰士委員會消息人士透露，武裝分子在反擊行動中擊落三架無人駕駛偵察機、兩架直升機和兩輛坦克戰車，但美軍否認有直升機被擊落。伊拉克防長胡贊伊更指，有些武裝分子已經逃脫，有些則挾持居民作人盾。  胡贊伊希望戰事不會持續太久。但在華府密切注視戰況的美國國防部長拉姆斯菲爾德，態度審慎，指費盧杰戰役會非常激烈，需要一段時間才能完成，預計要跟武裝分子打一場硬仗。美軍周二表示，在過去十二小時地面戰，至少有三人陣亡十四人受傷，連同周日晚兩名陣亡美軍，今次行動共有五美軍殉職。  事實上，美軍挺進時已遇到武裝分子埋下的路邊炸彈，而他們聲言用來對付美軍的人肉彈、汽車彈和沾上毒物的地對空導彈還未派上用場。駐伊拉克最高指揮官凱西預期，更大更血腥的衝突已在前頭。 巴古拜警署遇襲45人死   法新社隨軍記者報道，美軍對付路邊炸彈的戰術，是砸掉火車軌，越過田野向前推進。至於對付城市巷戰、進行挨家逐戶搜查的戰術，是先砸毀建築物牆壁，再向武裝分子匿藏地點用機關槍掃射。美軍同時收緊圍網，防範武裝分子佯裝平民逃走。  美軍圍剿費盧杰的同時，武裝分子已在伊拉克各地施襲，造成大量人命傷亡。在首都巴格達市中心，周二就發生爆炸。在巴格達東北面六十五公里外的巴古拜，武裝分子襲擊三間警署和一條橋樑，造成四十五死三十二傷。在拉馬迪，數百名武裝分子佔下據點，美軍遇上兩枚汽車彈，雖擊斃七名武裝分子，但也有五名美軍受傷。  追隨阿蓋德的伊拉克伊斯蘭軍，周一亦在網上發表「緊急和重要」聲明，呼籲武裝分子襲擊二十多個「預先約定」的目標，包括伊拉克政府大樓、大使館、國防部、內政部、財政部、石油部以及各大酒店，以報復美軍攻擊費盧杰。牽一髮動全身，美軍面對的火頭，面積愈燒愈大。  法新社/美聯社/路透社
20041110-141,20041110,141,伊軍怕死200人臨陣逃去,伊軍怕死200人臨陣逃去 進攻費盧杰的除了美軍，還有新伊拉克軍。駐伊美軍估計，這群夾在臨時政府命令和同胞反對聲之間的伊軍，估計至少有二百人做了逃兵，另有二百士兵砌詞「放假」。有報道更指伊軍其中一營五百名士兵中，有三百多人做了逃兵。     教士恐嚇「宰殺叛徒」   新伊軍每日遭受襲擊，形象低落，這次出擊費盧杰，不少人認為是「省招牌」的機會。士兵吉代卜說：「這是向伊拉克人民證明我們可保護他們的機會。」  不過，伊拉克的回教教士，不管是主流遜尼派還是激進什葉派，都指摘新伊軍協助美軍是為虎作倀。主要遜尼派政黨「伊拉克伊斯蘭黨」周二宣布退出臨時政府，抗議美軍攻打費盧杰。費盧杰的教士聲言要「宰殺」打自己人的士兵，武裝分子更揚言要把他們斬首。  「有些人收到恐嚇，因而害怕。」伊軍士兵拉希姆解釋逃兵心態：「他們怕死。」  美國《芝加哥論壇報》/路透社
20041110-142,20041110,142,巴人憂390億財產遭侵吞阿拉法再傳死訊,巴人憂390億財產遭侵吞 阿拉法再傳死訊 巴勒斯坦自治政府主席阿拉法周二晚再傳死訊。他就醫的法國巴黎貝爾西軍方醫院院長指他「健康惡化，昏迷程度加深，難以診治」後，巴方消息人士指他也許只能多活若干小時，法新社引述匿名巴人自治政府閣員指他已死，但外長沙阿斯和院方均否認。 阿拉法妻子蘇哈周一才炮轟巴人總理庫賴、外長沙阿斯、巴勒斯坦解放組織副主席阿巴斯等人，爭住繼位，想「生葬」阿拉法，四名巴人高層成員周二照計劃抵達法國，到醫院探望阿拉法。  庫賴一行四人在醫院逗留了兩個多小時，離開後阿巴斯指阿拉法病情「非常嚴重」；外長沙阿斯則表示和蘇哈的衝突已結束。     「他腦出血後逝世」   但路透社引述至少三名接近阿拉法的匿名消息人士指他已經逝世。其中一人透露：「他周一晚開始腦出血後逝世，他的保鑣互相擁抱親吻，勸勉對方要堅強。」  沙阿斯否認阿拉法已死：「無迹象顯示……他任何重要器官已死。我們不信安樂死。」他指阿拉法的病與中毒或癌症無關，但無說明病因。  阿拉法已住進深切治療部，自他病重以來只有很少數人能探望他。根據法國法例，蘇哈可全權決定他接受怎樣的治療及讓哪人見他。巴人高層消息指，他血小板過少，現在每天都要輸血。  蘇哈和巴人高層權鬥，不少巴人認為是錢作怪。阿拉法領導巴勒斯坦建國運動四十年，管理了一個帳目混亂的投資金融王國，財產估計高達約三百九十億港元，巴人擔心他一旦逝世，巨款會被親信侵吞。 「蘇哈從來對政治沒興趣」   巴解於七九年起得到阿拉伯世界巨額援助，九四年自治政府成立後又得國際援助，錢全由阿拉法管理。巴解前財長古賽因說，阿拉法以親信名義投資和開銀行戶口藏巨款，雖然那些投資公司不少已經倒閉，但知情者估計巴解仍約有二百億至三百一十億港元資產。  有兩個名字經常和阿拉法的錢拉上關係，一個是替他轉移自治政府款項的財務顧問拉希德，另一個就是蘇哈。她戶口一筆約八千九百萬港元款項涉洗黑錢，正被法國調查。住在西岸拉姆安拉的沙米認為，權鬥背後「是錢作怪。蘇哈從來對政治沒有興趣。」  美聯社/法新社/英國《衞報》
20041110-143,20041110,143,心臟新藥專治黑人,心臟新藥專治黑人 美國醫學界近日測試了一種混合兩種藥物而成的心臟藥丸，可將罹患嚴重心臟衰竭的美國黑人死亡率減低四成三，入院機會減低三分一。倘獲美國食品及藥物管理局（FDA）批准用以治療黑人，將成為首種專售予特定種族人士的藥物。     首隻種族藥物   專治黑人的新心臟藥叫BiDil，由麻省生物科技公司NitroMed研製。BiDil由兩種非專利的心臟藥──isosorbidedinitrate和hydralazine混合而成，前者有助製造對心臟有益的一氧化氮，後者則用以治療高血壓。  NitroMed研發了BiDil後，未獲FDA視作新藥批准發售，因大部份白人病者在初期研究中分別服用上述兩種藥，沒有療效。後來研究發現BiDil對黑人起作用。  NitroMed對千多名心臟衰竭黑人進行的為期兩年測試，一半服食普通心臟藥，另一半服食心臟藥及BiDil。結果服食BiDil的病人中，僅百分六點二死亡，另一批則有百分十點二不治，這代表BiDil有效將死亡率減低四成三。  美國有五百萬人患心臟衰竭，黑人患病機會比其他膚色人士高兩倍半。心臟科醫生吉本斯說，這是一個有助研製以種族為基礎藥物的分水嶺。  美聯社/《洛杉磯時報》
20041110-144,20041110,144,成人玩具——海豚潛艇,成人玩具——海豚潛艇 新西蘭舉行第八屆「大孩子玩具展」，展出一艘機械海豚潛艇，除了外形似海豚，更能像海豚那樣在海中翻騰，最適合愛好水上活動的「大孩子」駕駛。     售價15萬至39萬   機械海豚潛艇，由玻璃纖維和纖維B製造，長四點四公尺，引擎馬力達一百一十匹，潛在水中每小時可航行二十五公里，浮出水面時速可達五十公里。這艘海豚潛艇，跟常規潛艇不同，不靠氣壓艙下沉，而是靠前進動力和機翼下沉。  製造商VASH公司說：「我們在滿是海洋的星球出生，我們有融入海洋的夢想，就像海豚那樣融入海洋。」VASH說機械海豚潛力無限，可用潛入海中觀看水底世界，也可用作拯救艇和教人愛護環境。  現在機械海豚仍未推出市面，VASH還在不斷測試和改善，確保它安全可靠。萬事俱備後，如意算盤是推出兩座位海豚潛艇，售價介乎十五萬六千港元至三十九萬港元。  《新西蘭先驅報》
20041110-145,20041110,145,泰青少年時興戴彩色牙箍,泰青少年時興戴彩色牙箍 箍牙的人都盡量不露齒，偏偏泰國有些年輕人時興戴假牙箍，在金屬線上穿上色彩繽紛的小環，當作時尚飾物，可隨每天不同心情轉換顏色。  曼谷最多潮人流連的多個市集，都有各式攤檔擺賣不同款式的假牙箍，顏色任擇。十四歲女學生杰西卡露出「橙色笑容」說：「這些顏色環可愛得不得了。」     女生藉牙箍妨礙進食減肥   最便宜的不用十港元便有交易，那是一條飾以單色珠粒的鐵線，自行把兩端勾在臼齒上便可。但如果花得起七、八百港元，便可在上下排牙箍各鑲上十粒顏色環。假上顎也有售，上面畫了卡通人物。牙醫診所也可為顧客裝假牙箍。  除了「貪靚」，有女生更藉着戴假牙箍令自己進食困難，減低食慾以減肥。  有醫生指出，假牙箍雖無矯形作用不會影響牙齒位置，但長期套上會痛楚，而且可能引致發炎。一些女生交換假牙箍佩戴更非常不合衞生。假牙箍若在口水影響下釋出有毒物質，會損健康。  法新社
20041110-146,20041110,146,華軍火商獲侯賽因贈油券,華軍火商獲侯賽因贈油券 已被捕的伊拉克前總統侯賽因，在九一年波斯灣戰爭後被國際社會制裁，但一直有傳他用石油換取武器。《亞洲華爾街日報》周二進一步揭露，侯賽因和中國武器製造商有千絲萬縷的關係，點名指中國軍工業龍頭北方工業公司前副總經理黃如鎮，曾獲侯政權送贈價值不菲的石油購買券。     涉及2300萬桶石油   報道說，該報獲現年六十八歲的黃如鎮親口證實，他本人兩次和巴格達的石油官員會面，因而替他在本港成立的兩間公司──PurichInternationalLtd和ChaseStarLtd取得石油換購權。  伊拉克石油換購權，由九九至○三年分五批批出，供換購石油量達九百萬桶。《亞洲華爾街日報》相信，黃如鎮可能就是在侯政權的石油買家秘密名單中的「Joan先生」。根據伊方紀錄，「Joan先生」獲石油券共有八批，合共可買二千三百萬桶石油。但黃如鎮堅稱自己按照聯合國石油換糧計劃規定取得購買權，跟北方工業無關。  《亞洲華爾街日報》
20041110-147,20041110,147,小啟,小啟 版面調動，「名人軼事」、「小統計」和「每日英語」欄暫停
20041110-148,20041110,148,掃雷偵測減美軍傷亡　遙控先鋒踩敵陣,掃雷偵測減美軍傷亡　遙控先鋒踩敵陣 美軍上到「恐怖之城」費盧杰的戰陣，恐怖分子和武裝分子早已準備好路邊彈、人肉彈、汽車彈和沾毒導彈伏擊。凶險重重，美軍當然不只是在心口上掛個勇字就上陣，而是有多種可遙控的高科技武器充當他們的急先鋒。無人駕駛偵察機、掃雷車、干擾引爆炸彈訊號的系統、偵測炸彈特製裝甲車，以及偵察機械人，都有助他們在這場越戰以來最大規模城市戰中偵測炸藥、刺探敵人情報。 「沼狸」偵測炸彈裝甲車   「沼狸」（Meerkat）可遙控，也可由士兵駕駛，專責在戰地偵測炸彈、掃雷，能抵擋三枚反坦克地雷同時爆炸的衝力。還有一部叫「水牛」（Buffalo）的重型裝甲車，可深入雷區，用伸縮臂掃雷。     搜彈拆彈機械人   搜彈拆彈機械人PackBot功能是搜索汽車炸彈，能走進可疑車輛內檢查是否藏有炸藥，更具有拆彈功能，在伊拉克危險地帶常見出沒。     「男巫師」電子干擾系統   「男巫師」（Warlock）電子干擾系統是用大氣電波瓦解武裝分子襲擊計劃的系統，裝在軍車上，能干擾用手提電話等裝置遙控引爆炸彈的訊號，使炸彈變成「流」彈。     空中間諜球/炮彈數碼相機   戰陣上最緊要是刺探軍情，美軍放「空中間諜球」到高空一動也不動，又在炮彈上的數碼相機，讓炮彈射到敵陣，拍下敵方軍情，再傳送回軍營電腦。 無人駕駛偵察機   美軍無人駕駛偵察機每天在伊拉克出動四百架次。  「環球鷹」（GlobalHawk）無遠弗屆，可在空中停留24小時，中途不加油，一次可飛行逾二萬公里，相當於環繞了地球半圈。  「烏鴉」（Raven）不夠一米長，翼展一點三米，重一點八公斤，可放入手提箱，最遠可飛十四公里，在空中逗留八十分鐘。  「影子」（Shadow）能在接到命令四十五分鐘後出動，搜索路邊炸彈、汽車炸彈、武裝分子據點、狙擊手匿藏處等，幾分鐘就可把影像和情報傳送回軍營電腦，比由人造衞星接收影像更快。  這些高科技軍備，能幫助美軍克敵制勝，美國國防部估計約四成炸彈在引爆前被發現，能減低美軍傷亡。但也有軍官質疑這些軍備只是聊備一格，有好過無。  美聯社
