key,date,article_daily_id,title,text
20040923-88,20040923,88,騙財17萬　兩人認罪15人候審歹徒破匯豐存錢機假鈔換真銀,騙財17萬　兩人認罪15人候審 歹徒破匯豐存錢機假鈔換真銀 【本報訊】犯罪集團成員窺準滙豐銀行「存錢妥」機辨識偽鈔的漏洞，於今年復活節期間，存入五百元偽鈔，再從櫃員機提取款額相同的真鈔，令銀行在短短三日內損失逾十七萬元。警方翻查銀行紀錄，拘捕多名涉案人士，其中兩人昨於區域法院承認串謀盜竊及行使偽鈔等四項罪，押後判刑。　記者：羅宇光 案發後滙豐銀行立即採取補救措施，引入擁有先進防偽功能的新款「存錢妥」機，預計數年內全線更換。     先後發現433張偽鈔   控方案情指出，滙豐銀行職員於今年四月七日，首先在旺角新世紀廣場分行的「存錢妥」機內，發現九十五張五百元偽鈔，銀行其後在各分行的「存錢妥」再發現三百多張五百元偽鈔，合共四百三十三張。銀行隨即翻查紀錄，發現有人於同月八日及九日，利用提款卡將偽鈔存進涉案「存錢妥」，轉頭便在櫃員機從卡戶口提取相同款額真鈔，令滙豐銀行在三天內損失十七萬一千五百元。  警方針對銀行紀錄調查，發現本案兩被告涉案，遂於同月十四日及二十日登門拘捕。次被告陳飛龍（二十二歲）在警誡下承認，在案中擔當中間人角色，他指稱一名叫Sunday的女性友人手上有一批來自內地的五百元偽鈔，打算存入「存錢妥」，再從櫃員機提取真鈔，遂向陳要求提供提款卡作案，事成會分利潤予他。  陳後來透過一名叫「阿東」（譯音）的男子非法取得九張提款卡轉交Sunday。 全部提款卡同密碼   首被告劉俊菁（二十一歲）在警誡下亦承認是中間人角色，並從中賺取了四千五百元。劉聲稱「阿東」以每張二千五百元的價錢出售非法提款卡，提款卡的密碼已按買方要求全部預設為「123456」。此外，警方上門拘捕次被告時，在其寓所搜獲小量K仔、冰毒及大麻。  兩名被告為報稱學生的劉俊菁，及任職夜總會經理的陳飛龍，控罪四項，其中兩罪指他們於今年三至五月，串謀另外十九人偷竊香港上海滙豐銀行的財產，及串謀使用非法取得的自動櫃員機提款卡，不誠實地從滙豐銀行多部自動櫃員機提取及處理該批現金。     案件涉集團式運作   陳飛龍另被控兩罪，指他於今年四月八日串謀其他人行使四百三十三張五百元偽鈔，及於四月二十日在旺角亞皆老街寓所藏有K仔、大麻及冰毒。  兩被告承認全部控罪，由於警方指案件涉及集團式運作，共有十九人被落案起訴，除昨日兩被告外，尚有十五人將於十一月進行審前覆核，故此本案兩被告將待該案審結才判刑，首被告將替控方作供。  案件編號：DCCC871/2004
20040923-89,20040923,89,李怡專欄：非變不可 - 李怡,李怡專欄：非變不可 - 李怡 江澤民下台，胡錦濤全面接班，中國的內外政策與人事布局會不會變？從胡錦濤連日來關於人大、關於政協、關於對台政策等等談話來看，當然是沒有變。四中全會後，九個中央常委與江澤民一起合照，也宣示了中共最高權力核心的人事沒有變。許多中國問題觀察者以及香港區全國人大代表、政協委員，也說中國政策與人事不會變。  任何一個新上任的主管，即使是一家公司收購了另一家公司派來的新總裁，也一定會說一切政策與人事不變。這已是必然的姿勢。但真的是不變嗎？恐怕不會如此。  任何一個新主管在熟悉了他領導崗位的權力聯繫，尤其是他的權力鞏固以後，就一定會變。更何況，在「一朝天子一朝臣」的中國政治文化中，任何省、市，只要換了一個領導，就一定要變些花樣，以示他比上一任更有作為，也要從「變」中進一步鞏固自己的權力。華國鋒下台時，鄧小平對他也是善頌善禱，當時也是表現出一切不變的姿態，但不到一年，就從政策、人事都大變也。真正不變是有的，那就是因為最高權力還未真正交班，比如江澤民接趙紫陽任總書記，實際權力還在太上皇鄧小平手裏，儘管鄧連軍委主席都已辭掉，但江稍稍想變一下，鄧小平即以南巡發話讓江澤民在北京發抖。沒有全面接班，自然不會變也不敢變啦。 現江澤民已全退，看來他不可能像鄧小平那樣垂簾聽政了，因為他是在權爭中潰退的。但江系人馬還在中央常委中佔多數。這些人雖善辨風向，但暫時還擺脫不掉與江的干係。因此胡溫縱有新政或新人事布局，短期內還是無法施展。但被種種問題與矛盾所迫，在可見將來，胡溫恐怕面臨「變亦變，不變亦變」的非變不可的局面矣。  最大的問題是腐敗。據一位了解中共內情而且也看到有關文件的朋友對筆者說，這十年來，內地跑出國外的有四千名貪官，以各種名目帶走的國有資產達四百億美元。這是一個相當驚人的數字，四百億美元，若是一個小國，可能整個財政就垮掉了。這問題引起中共元老及各級幹部的關注，也引起老百姓的議論與憤懣。 過去朱鎔基反貪，結果保守派反而拿他的親信朱小華開刀。實際上，過去幾年的反貪、反經濟犯罪，都是權力鬥爭的祭品。正如文革結束前中共批「走資派」一樣，被指為「走資派」的不是真的走資，而是權爭中的失敗者。同樣，過去幾年被指為經濟犯罪的，也是權爭中的失敗者，因為經濟犯罪人人有份，只看你的權力後台夠不夠硬而已。環顧中共高層，沒有老婆、子女、秘書牽涉到權錢交易的，幾乎沒有哪一個啦。許多人的子女佔領上千億企業的主管之位，已經是公開的事。  只除了胡錦濤、溫家寶，筆者至今仍未聞他們的子女、親屬在企業主管中有任何職位。胡溫獲得元老的支持，宋平向中央提出挺胡接班的書面講話，自與中共當前的貪腐問題已極為嚴峻有關。  胡溫接下去的做法很可能是避開針對「人」去反貪腐，而致力於建立制度化去反貪腐。這次四中全會，通過「加強執政能力建設」的決議，就有拋棄過去把中國共產黨視為「革命黨」、「領導黨」的意向，開始吸收世界上其他的執政黨的經驗與教訓，建立執政的體制。在「人民網」中，有中央黨校的學者，更提出執政黨的「合法性」的問題，帶出了人們對中共或有較大變革的期待。
20040923-90,20040923,90,長毛當選後怎樣,長毛當選後怎樣 施永青   今次立法會選舉，長毛梁國雄竟高票當選，相信連他自己也有點意外，故當記者問他是否打算宣誓效忠《基本法》時，他竟不知所對。 我與梁國雄相識超過二十年。一九七六年，我因不滿中共鎮壓四五天安門學生運動，憤而離開香港的左派組織。  初時，我只是不滿中共背叛革命，對馬克思主義仍存幻想，機緣巧合下，結識了一些第四國際──托洛次基派在港的成員，梁國雄就是其中一個。「雄仔」當時只有二十餘歲，但已是中堅分子，並有份擔《十月評論》的編輯工作。  形式上我不算他們的黨員，只屬外圍的支持者，但亦有參與他們的一些活動，包括支援金禧中學的學運，爭取艇戶上樓，營救劉山青，以及反對中國對越南的戰爭等。我發覺這批人甚有理想，有為革命獻身的浪漫情操，相對已變成反動當權派的中共，對我更有吸引力。  由於我對馬克思主義有一定的理論基礎，因此他們搞讀者會及研討會時，常邀請我做主持或講者，以幫助他們的成員提高理論上的純潔性。身為共產黨員卻不懂馬克思主義的情況，在全世界普遍存在，托派的理論水平一般較中共的黨員好，但能真正讀懂馬克思原著的也不多。 經過一段時間一起活動，我發覺托派的精神雖然可嘉，但他們要行的路卻是不通的。再者，我開始接觸到海耶克與卡爾．波柏的書，已懂得從理論層面批判馬克思主義，遂與托派朋友日漸疏遠。  之後，我與雄仔雖間有見面，但我已明確表明不再認同他們的政治路線。他們的某些活動，譬如反美侵伊、反全球化等，我有時會作選擇性的支持；但倒董我則覺得意義不大，董建華只是北京的代理人，倒了也改變不了甚麼，有本事的，應夠膽挑戰中共也要偷偷投靠的全球資本主義建制。  自蘇聯解體後，全世界都認為資本主義將為我們帶來美好新世界，知識界已失去對資本主義的批判能力，托派本應多在這方面起點作用，想不到現在連長毛也要走入建制。  雄仔出來競選，我事前也與他討論，我問他是否以後打算玩建制內的遊戲，他說，他的目的不是要入建制，而是藉此暴露建制的不合理。倘真如是，梁國雄就應堅持原則，在宣誓時效忠全國人民及香港市民，而非《基本法》。 寫這篇文章時，尚未聽到長毛如何宣誓，但已看到長毛回應記者時，立場已開始動搖，企圖借個別選民的意願，作為自己向建制低頭的解釋。其實，選民之所以選長毛，正是因為他與建制誓不兩立，若長毛一當選就改變立場，選民豈不失望？  當然，無人知道選民中哪類意願佔多數，但長毛一旦宣誓效忠《基本法》，已代表政治立場有根本轉變，這就不是靠繼續住公屋，及只花小量議員收入於個人生活，就補救得了的。  想當年，劉山青因支持中國民運被中共囚於獄中，只要肯簽悔過書，就有機會獲釋回港，但山青卻選擇坐牢，不是坐一兩個禮拜，而是坐十幾年。這種對原則的執着才令人敬佩。  還記得，當年吳仲賢（托派在港的領袖）在大陸被捕，因為曾假意認罪招供，回港後一直不獲組織原諒，死而留憾。當時，批吳最激的就是梁國雄，我曾表示過不理解，但梁國雄卻認為這是原則問題，關係到革命氣節，想不到今天長毛卻視革命原則為無物。  早年，梁耀忠決定入建制玩選舉遊戲時，一樣被雄仔嚴厲批評，認為是沒有腰骨的表現。其實，當時梁耀忠已放棄托派的理念，但雄仔卻至今仍然穿着哲古華拉的汗衫四處招搖，這是我對長毛的要求特別嚴厲的基本原因。 我認為，長毛在效忠《基本法》這個問題上應三思，這將使他陷於極不利的政治位置。試想一下，如果他的對手問他一句：「你長毛當時是否發假誓？」他如何回應？承認發假誓會犯法，說是真心效忠又會令支持者失望，從此失去街頭戰士的風采。為甚麼不可以堅持原則？只宣誓效忠人民，讓特區政府去煩惱是否讓你做議員好了，這才有利於暴露建制的不是。  可惜，照長毛近期的反應看來，做尊貴的議員實在太吸引了，連曾以做街頭戰士為榮的長毛也不願放棄了。宣誓向《基本法》效忠，只是向建制屈服的開始，要長期保住議席，需要向建制妥協的地方將來還多着呢！  本來，我作為一個早已向建制低頭的人，沒有資格批評長毛。關鍵是我早已放棄共產主義，但長毛卻還在標榜要不斷革命。  長毛最推崇的哲古華拉，在古巴革命成功後，有高官也不做，選擇去拉丁美洲發動人民起義，結果在游擊戰中被殺；但長毛卻選擇在一個他認為不可被認受的政權中當議員，難道他認為他可以爭取到立法會通過撥款，支持第三世界的人民革命？ 托洛次基的理論精粹是不斷革命，即是說單在一個國家取得革命勝利是沒有意思的，一國先實行社會主義是沒有前途的，故必須不斷革命直到全世界無產階級都得到解放，共產主義才可在全世界得以落實。長毛今天卻打算向一個背叛革命的政權下的特區政府效忠，豈不是與自己的信仰背馳？  幸好，長毛的選民並非人人知曉他的政治信仰及終極追求，否則其中一定會有人大吃一驚，原來我們竟選了個共產黨做立法會議員！香港是一個恐共情緒為主流的城市，出現這樣的事情何其弔詭？  易卜生有一齣名劇，叫做《玩偶之家》，女主角娜拉在一個男權意識為主流的社會裏，受不住家庭的壓力，最終決定離家出走。魯迅先生曾為文問「娜拉走後怎樣？」魯迅先生擔心，娜拉或許可以逃離自己的家庭，但一樣逃不出建制社會，最終可能淪落妓院。他認為建制社會只能容許個別娜拉出走，但絕不會容忍千萬個娜拉同時出走。  我相信，香港社會最多容得下一兩個長毛當選，而他們當選後的命運亦會與娜拉出走後差不多。  ……………………………………………………  作者為中原集團主席
20040923-91,20040923,91,香港人已準備好普選,香港人已準備好普選 馬嶽 九月十三日早上，在九龍灣展貿中心那個異常擠迫的選舉新聞中心，在摩肩接踵的候選人、傳媒人和評論員之間，流傳着這樣一個笑話：九一二選舉後，香港的民主派開始相信，香港並不具備在○七、○八年推行普選的條件。因為，第一，特區政府根本沒有能力應付規模這樣大的選舉；第二，我們沒有足夠的票箱。  今年立法會選舉正顯示，香港選民的成熟程度，絕對足以普選產生我們的政府，未準備好的只是特區政府和中央政府。從選民參與程度方面來看，香港的五成半投票率，已經和美國總統選舉的投票率相若，而美國中期國會選舉的投票率，更經常只得四成多，只是我們上屆區議會選舉的水平。不少歐洲成熟民主國家的國會選舉，有七、八成的投票率，但如果我們考慮到香港立法會只有一半直選，而立法會權力有限，反之歐洲國會選舉則會產生政府，香港的五成多投票率，已經能顯示選民很高的參與意欲了。 從選民和候選人行為分析，今屆選舉雖然有少數牽涉暴力的事件（例如大班被圍和黃成智被打），但整體上選舉是很和平地進行的。選舉出現這麼多混亂，包括有選民被拒諸票站門外，有某些票站要排長龍達一個鐘頭才可投票，換了其他發展中地區，難保不會出現衝突，但大部份選民還是耐心地等。選舉出現這麼多難以解釋的混亂，連選票總數都不對，也沒有候選人不承認選舉結果，有不服的也只是嘗試訴諸司法程序而已。  有人會說：香港有不少政治制度上的配套條件未成熟，例如政黨規模和質素不夠、政策研究發展不足、政治人才不足等，政制發展第二號報告書，便是用類似理由，認為香港未適宜普選。這次選舉，也有政黨和候選人提出「條件成熟論」，在他們支持二○一二年普選下，還加一個「條件成熟」的限制，即到時如果不符合這些條件，又可以將普選無限期推遲。  其實上述這些配套，很多都要等政制開放後，才容易有長足發展。封閉的政制難以吸引政治人才，難令政黨發展，也難以鼓勵政策研究（因為如果沒有公開公平的渠道影響政府政策，即使大花資源，理性地做研究，也是徒然）。 最重要的是，特區政府和保守人士整天以政黨發展、政治人才和政策研究不足，作拖延改革的藉口，但他們做過甚麼來「創造條件」？答案是沒有。特區政府從未做過任何事情，以扶助政黨發展，例如以政黨法賦予政黨法定地位和權益、像外國以公帑資助政黨發展、或者與政黨分享部份行政權力。  反之，回歸後政府做的，都是壓抑和打擊政黨之舉，包括《特首選舉條例》規定，特首不能是政黨成員，殺局令政黨第二梯隊受打擊，高官公開發言時，經常將政黨貶為爭逐私利、只懂吵鬧的政客，政府委任公職時，往往避開政黨人士等。  政府本身做過甚麼工作來培養政治人才嗎？政府連委任公職人士，也是來來去去同一批。政府有大力推動民間作政策研究嗎？在教資會的領導下，大學學者作本地政策研究，根本是吃力不討好之舉，而政府調撥作本地政策研究的資源，也少得可憐。 如果特區政府在否決○七、○八年普選後，不提出正面措施培養政治人才、推動政黨發展、鼓勵政策研究，而現在說要「創造條件」的政黨和候選人，也都只停留在「只說不做」的階段，那便是「等運到」。因為人才不會從樹上生出來，政黨發展和政策研究，也需要大量社會資源投入，只會讓中央政府幾年後以同樣理由，再否決香港人的普選訴求一次而已。  事實上，如果香港的政治人才和政策研究長期處於低水平，用甚麼政制也不會成功，港人治港只會愈搞愈糟，最後會愈來愈倚賴中央援助，也不符合國家利益。政制事務局如果在未來兩三年，不能提出有效的協助政黨發展和推動本土政策研究的措施，我會支持將這個局裁掉以減輕財赤。  ……………………………………………………  作者為香港科技大學社會科學部助理講師、香港民主發展網絡成員
20040923-92,20040923,92,福布斯勸董建華減稅,福布斯勸董建華減稅 廖建明 美國《福布斯》雜誌總裁兼總編輯史提夫．福布斯（SteveForbes）每之來港，幾乎都遇上重大新聞。兩年前，福布斯來港主持「福布斯全球行政總裁會議」時，特區政府剛推出二十三條；今次他再來召開相同的會議，江澤民剛退下中共中央軍委主席。  福布斯期望中國穩定改革，如此對各方都有利。他說：「希望今次能提供一絲穩定，讓中國繼續享有增長，但不是控制下的增長；也不要見到台灣問題升級甚至失控，因此需要堅穩之手掌舵。」中國的銀行系統百病叢生，必須首先大力改革，因此福布斯希望美國政府不會成功迫中國浮動人民幣，他說中國「尚未準備好。」  台灣問題一直都是北京的頭等大事，福布斯寄語北京：「耐性往往產生紅利，九六年射導彈那一套不中用。」他認為，台灣問題源自中國內部政治變化多於兩岸實際關係惡化，因為兩岸的經濟聯繫其實日深。他說北京應該用較冷靜的手段，一方面加強經濟關係，同時又不威脅台灣的自由，方可達兩岸合作。 至於美國對中國政策，福布斯讚賞布殊總統掃除「戰略模糊」的做法。他指布殊一方面告訴中國，攻擊台灣會惹美國強烈反應，另一方面又讓台灣知道，貿然宣布獨立美國未必出手相助，這是清晰的立場。他說：「希望四年後繼任布殊的人不會走模糊的舊路，否則將自找麻煩。」  今年美國總統大選尚未舉行，福布斯已說「四年後繼任布殊的人」！因為我要求福布斯取出他的水晶球預測結果，他斬釘截鐵的說：「布殊會贏。」原因？首先，美國經濟轉佳，第三季數字比第二季好，就業不斷增加，所以民主黨再打不嚮經濟牌。  其次，雖然很多人對伊拉克局勢不滿意，但克里也提不出甚麼良方。福布斯說：「克里始終不像統帥的樣子，除非他在辯論有超卓表現，否則他會輸。」  福布斯曾是布殊的手下敗將，四年前角逐過共和黨總統候選人提名，但他給布殊四年來的表現很高分。他讚布殊的外交方向正確，「不能向邪惡低頭，必須痛擊恐怖主義」。他說三年來有進展，首先是阿富汗，然後伊拉克，最近利比亞又自動放棄核武，「我們今天比九一一安全些」。 福布斯如此看伊拉克局勢：「敵人不再襲擊美軍，因為知道正面交鋒肯定會輸，他們現在轉向平民下手，這是軟弱的表現。」他的反恐方針跟布殊吻合，就是鼓勵盛產恐怖分子的國家推行政治改革，而且絕不坐視人家做壞事。他說：「民主以及手牽手一同出現的經濟自由，有助剷除恐怖主義。美國必須推動政治開放。跟冷戰般，這是很多年的長期工作。自由世界要學曉如何打這場仗。」  對於北韓，福布斯認為美國要跟中國聯手，再多施壓。至於伊朗，他奉勸那些教士及早妥協，否則「一年半載後，以色列真有可能出手攻擊。」  福布斯不忘奚落克里，謂他做總統會像卡特般軟弱，我則說克里愈來愈似杜卡基斯。福布斯回應說：「麻省真有問題！」 福布斯雖然肯定布殊的成就，但也像很多保守派人士般，不滿意布殊增大政府開支的情況。他說：「布殊在財政預算開支的部份太鬆手了。雖云經濟放緩，再加上要打反恐戰爭，可以預期出現財政赤字，但他們原可以做得更好，可以更加節制，我想他們已吸收了教訓。」  國會兩院皆由共和黨控制，也許讓布殊花錢容易些，但福布斯說問題根源在白官，「就算是在九一一以前，他們已花錢太多。」  只要控制開支，福布斯不太擔心財赤。他說：「經濟正在增長，實際的赤字比預測的低了五百億美元，赤字已開始下降。」 福布斯支持自由經濟，對布殊和克里的經濟政策不問也知偏好。他贊成布殊減稅造就今天經濟復甦，精簡稅制，以及改革兩大頭痛難題：社會保障及醫療保健。他說：「克里要加稅、增加政府管制、反對自由貿易……認為毋須改革社會保障，醫療保健就要政府更多插手。」  兩年內第二度選擇香港做開會地點，福布斯可算是投信心之票給香港。他認為這有助一國兩制的兩制繼續運作，他說：「香港再次做東道主是好事，沒有人會到沒有前景、沒有經濟自由的地方開會。國際商界領袖來到香港，親身體驗兩制是否仍然存在。」  香港這兩年有很多風雨，福布斯希望江澤民下台後，北京對港會有更節制的政策。他說：「去年七一大遊行反對國家安全條例，顯示香港願意捍衞自由。要確保兩制繼續運作，保持警覺非常重要。」 福布斯向北京進一言：「遵守協議，才能對台灣有吸引力。」  我問福布斯，如果要向董建華建議一項事情來改善香港，那會是甚麼？福布斯想也不想便說：「開始再減稅！」  減稅一直是福布斯的中心主張，他競選總統時就建議減稅：畫一入息稅為百分之十七、廢除利息稅和遺產稅等。說來諷刺，福布斯的低稅主張，靈感可能來自香港，但香港今天反其道而行。莫說減稅，銷售稅已躍躍想登場。  福布斯寄語特區政府：「先看看日本的情況！」面對財赤，美國和香港的良方始終是：減稅和控制開支。不愧為高舉資本主義旗幟的《福布斯》老闆。  ……………………………………………………  作者為本報論壇版主編、公共事務關係總監
