key,date,article_daily_id,title,text
20050130-0,20050130,0,沒有國葬　沒有十里相送紫陽精神長存,沒有國葬　沒有十里相送 紫陽精神長存 一個中國改革開放的總工程師，官方指稱其貢獻只是「有益的」；一個探望絕食學生時淚灑天安門廣場的善良長者，至死未能洗去「犯了嚴重錯誤」的污名。但是，沒有盛大國葬、沒有人群擠滿長安街的十里相送，也不會改變趙紫陽子女對父親的敬愛，更不能磨滅百姓對「紫陽精神長存」的信念。一代改革先鋒和政治家，從此永別了！　中國組 中共前總書記、改革家趙紫陽遺體告別儀式，昨日上午在北京八寶山革命公墓舉行。清晨五時三十分，當老天爺還沒睜開眼、萬千黎民百姓還在沉睡之際，趙紫陽的遺體就被悄悄由北京醫院運送往八寶山公墓，靈車的車頭只有一朵白花，沒有趙紫陽的遺照，使十里長安街沒有出現令當局難堪的送別隊伍。  雖然當局通知致祭人士，遺體告別儀式將在上午九時舉行，但全國政協主席賈慶林、中共中央組織部部長賀國強、中央辦公廳主任王剛、國務院秘書長華建敏等高級官員，在八時就前往送別，是第一批弔唁客。趙紫陽生前的盟友、前秘書鮑彤更一早就被公安送往致祭，沒有面對官員、民眾和傳媒的機會，而這也是鮑彤和趙紫陽闊別十六年後首次重逢，卻已是人鬼殊途。     骨灰不准放革命公墓   在當局嚴密審查致哀者的身份下，昨天只有約二千人獲准進入靈堂內瞻仰安眠在鮮花翠柏中的趙紫陽遺容。公墓外，不時湧來致悼的人潮，有的身穿黑衣衫，有的胸前佩着白花，有的打出「紫陽精神永存」的橫幅。他們被上千名的公安攔截在公墓外，甚至被送上警車帶走；有些人持有經趙家邀請、由當局發出的通行證，也不能入內。他們的悲哀，他們的憤怒，他們的心聲，再也不能讓趙紫陽聽見、看見了，但是，終有一天，會凝聚成還趙紫陽一個公道的力量。  十時三十分左右，趙紫陽的遺體火化。由於當局不准他的骨灰存放在八寶山革命公墓第一室（國家領導人骨灰室），趙家子女決定將骨灰帶回家，暫時安放在富強胡同六號。他們只想父親早日入土為安，不想再與當局糾纏下去。他們的心聲，就是那幅掛在趙紫陽遺照下花籃上的輓聯所說的「您的精神長存」。 「八九年犯嚴重錯誤」   因反對武力鎮壓八九民運的中共前總書記趙紫陽，在本月十七日上午七時零一分病逝，享年八十五歲。趙紫陽的女兒王雁南當時形容說：「他終於自由了。」但是，在趙紫陽的生平和評價、告別儀式的規模、骨灰的存放地點等問題上，當局仍層層設置障礙，令趙家子女遲遲無法為父親舉殯。  令人哀慟無言的是，趙紫陽子女迄今不敢將噩耗告訴病重的母親。與趙紫陽結縭逾半世紀、攜手走過風風雨雨的夫人梁伯琪，仍不知道趙紫陽已撒手西去，昨日也未能見他最後一面，沒出席告別禮。  在趙紫陽的遺體火化後二十一分鐘，官方新華社發布簡短消息，完全沒提及趙紫陽生前擔任過的具體職務，只說：「在革命戰爭年代和社會主義建設時期，趙紫陽同志在地方先後擔任過中共縣委、地委、省委主要領導職務；在改革開放前期，趙紫陽同志先後擔任過中央和國家重要領導職務，為黨和人民的事業作出過有益的貢獻。在一九八九年春夏之交的政治風波中趙紫陽同志犯了嚴重錯誤。」  這是中共對一位國家前總理、中共前總書記的應有稱呼嗎？這是對一個被譽為「中國改革開放總工程師」的領導人應有的評價嗎？時間和民心，會作出最後的裁決！  當局所謂的人文關懷只表現在新華社所說的：「在趙紫陽同志患病和病重期間，中央指示有關部門對他的生活和治療作了妥善安排，並專門成立醫療小組進行積極救治。在趙紫陽同志彌留時，曾慶紅同志代表中央領導同志前往醫院看望。」
20050130-1,20050130,1,官方網站稍開禁容悼趙,官方網站稍開禁容悼趙 【本報訊】趙紫陽昨日出殯，官方立即加強審查網上言論，僅得人民網、新華網兩個官方網站，稍稍開放言禁，但言論尺度狹窄，只容許網民留言哀悼，淺談趙紫陽生平功過，言論稍有逾越即遭刪去，新華網發展論壇更是一面倒讚揚黨中央處理得宜，評價客觀公開。 版主動不動刪帖   「班竹（版主）殺帖也太厲害！三個帖至少有兩個出不來！」、「趙紫陽同志永垂不朽！！」跟帖：「還不快點刪？！」人民網強國論壇及新華網發展論壇，是內地昨日少數還稍稍開放言禁的網站，但人民網控制嚴苛，版主動不動就刪帖，有網民不滿版主狠下殺手，留言狠批當局殺得太厲害，也有網民擔心言論不合乎版主心意，即使心有千言萬語，也不敢跟帖。另外，有網民留下隻字片言後，發現版主「手下留情」，未有刪掉悼言，於是隨即跟帖，感謝版主「皇恩浩蕩」。另一個容許網民留言悼趙的新華網，言論控制痕迹明顯，只許網民留下「悼念」、「默哀」、「一路好走」等悼詞，餘下的通篇是歌頌中央的文章，有的讚揚中央對趙紫陽寬宏大量，評價客觀公開，體現實事求是，證明「中國在進步！請（趙紫陽）一路走好」。  至於新浪網、搜狐、網易等內地大型網站，可能吸收了趙紫陽去世當天網民失控的教訓，僅轉發新華社的通稿，拒絕讓網民留言，大家只能看通稿，不能發聲留言。
20050130-2,20050130,2,六四鎮壓後　一別十六年鮑彤見趙已隔陰陽,六四鎮壓後　一別十六年 鮑彤見趙已隔陰陽 中共前總書記趙紫陽的秘書鮑彤，與他的老領導分隔了十六年後，昨天終於可以再見面，但已是陰陽相隔，人鬼殊途，實在讓人欷歔不已。鮑彤昨日清晨五時突然被公安吵醒，帶到北京醫院，與趙家六名親人一同送別趙紫陽的遺體，隨後還被安排到八寶山出席告別儀式。	中國組 中國人權民運信息中心引述鮑彤女兒鮑簡表示，北京公安清晨五時，將鮑彤由寓所帶到北京醫院，瞻仰趙紫陽的遺體，作最後道別，當時有六名趙家親屬在場。鮑簡說：「公安在凌晨五時十五分把他帶到醫院，讓他見趙紫陽遺體的最後一面。除了他（鮑彤）之外，現場只有趙紫陽的家屬。」  趙紫陽的靈車在清晨六時離開醫院，七時到達八寶山革命公墓。有消息指稱，鮑彤隨後獲中央特別批准，出席趙的遺體告別儀式。消息透露，官方曾向鮑彤開出讓他出席儀式的條件，就是他在八寶山期間，不得帶有政治標語、自備輓聯及發表政治言論。鮑簡說，鮑彤與趙紫陽自八九年「六四」後，已有十五年多沒有見面，也沒有試過用電話聯絡，起初情緒相當低落，到近年才平復過來，早前獲悉趙的死訊，令他感到相當難過。鮑簡說：「他感到很難過。他未能在過去十五年裏見到在生時的趙紫陽，而現在只能看到其遺體。」這種重逢故舊卻已是陰陽相隔的痛，又豈是外人能明白呢？     戴晴出席告別儀式   七十三歲的鮑彤，七十年代尾開始跟隨趙紫陽，兩人關係密切，且私交甚篤。趙紫陽八七年出任中共總書記，鮑彤一直是他的政治秘書，當時還可以列席政治局常委會會議，同時也是當年替趙紫陽執行政治體制改革的操作者。八九年六四事件後，鮑彤被捕判監七年，之後一直被軟禁。外界一直認為，鮑彤是替趙紫陽坐牢的。趙紫陽本月十七日逝世，鮑彤曾計劃到趙家弔唁，但遭阻止，鮑夫人蔣宗曹更遭便衣公安人員推倒在地受傷。  鮑彤稍後託人送上一幅「紫陽千古」輓聯，發表一篇名為《紀念趙紫陽》的悼文，強烈譴責當局軟禁趙紫陽十五年，並指趙是被軟禁而死的。  另外，居住在北京的「天安門母親」發起人丁子霖、抗沙士英雄老軍醫蔣彥永、自由作家劉曉波，以及人權工作者胡佳等異見人士昨日均表示，受到公安嚴密監視，不能出門前往出席趙的遺體告別儀式。與「六四」有關的人中，只有《光明日報》前記者戴晴出席了遺體告別儀式。
20050130-3,20050130,3,喪禮降格「沒把他當領導人」,喪禮降格「沒把他當領導人」 【本報訊】中共前總書記趙紫陽的遺體告別儀式昨日在北京舉行，出席的最高領導人只是全國政協主席賈慶林，中央電視台只是照讀新華社的文稿。當局顯然只給予趙紫陽一個大約相當於全國政協副主席的喪禮待遇，漠視他曾經是中共最高領導人、漠視他在人民心中的崇高地位。  中共黨和國家領導人舉殯一直分不同的等級、按不同的規格舉行，出席的領導人、慰問或致送花圈的領導人、傳媒報道的長短與提及的領導人姓名，因規格不同而有別：毛澤東、周恩來、鄧小平等人去世要舉行「國葬」；其他領導人去世，從胡耀邦、楊尚昆等中共政治局常委一級，到副總理、政治局委員一級，再到其他人大副委員長、全國政協副主席一級，都有相應禮儀。     中央電視台終發消息   昨日向趙紫陽告別的只有全國政協主席賈慶林、中組部長賀國強、中辦主任王剛、國務院秘書長華建敏，中央電視台雖打破兩個星期的沉默，第一次發布趙紫陽病逝及遺體火化消息，但只是照讀新華社的文稿，並未配發應有的照片或趙紫陽生前活動的錄影。  如果將昨日的喪禮安排與近年逝世的幾位全國政協副主席相比，清楚地顯示當局刻意降低規格，只將趙紫陽當作略高過部長級、大致接近全國政協副主席一級而已，根本未當他是前總理、中共前總書記，甚至連已故全國政協副主席、著名科學家盧嘉錫的喪禮也不如，遑論「國葬」。  北京獨立經濟學者茅於軾昨日表示：「（當局的安排）表示中央還是很重視趙紫陽的，不過，整個儀式的安排，顯然是沒有把他當作國家領導人來看待。」
20050130-4,20050130,4,新華社評價：趙有功有錯,新華社評價：趙有功有錯 【本報訊】趙紫陽的遺體在昨天早上十一時火化後，官方新華社在半小時後立即發布這消息，內容了無新意，但附有最具爭議的對趙紫陽生平的評價，全文如下：  「趙紫陽同志因病醫治無效，於2005年1月17日在北京逝世，終年85歲。趙紫陽同志的遺體今天在八寶山革命公墓火化。賈慶林、賀國強、王剛、華建敏等同志代表中央領導同志前往八寶山革命公墓為趙紫陽同志遺體送別，並向其親屬表示慰問。  趙紫陽同志1919年10月生於河南省滑縣，1932年23月加入中國共產主義青年團，1937年參加革命工作，1938年2月加入中國共產黨。在革命戰爭年代和社會主義建設時期，趙紫陽同志在地方先後擔任過中共縣委、地委、省委主要領導職務；在改革開放前期，趙紫陽同志先後擔任過中央和國家重要領導職務，為黨和人民的事業作出過有益的貢獻。在1989年春夏之交的政治風波中趙紫陽同志犯了嚴重錯誤。     中央代表前往送別   在趙紫陽同志患病和病重期間，中央指示有關部門對他的生活和治療作了妥善安排，並專門成立醫療小組進行積極救治。在趙紫陽同志彌留時，曾慶紅同志代表中央領導同志前往醫院看望。  中共中央辦公廳、中央組織部、國務院辦公廳、全國政協辦公廳等單位送了花圈。趙紫陽同志親屬、身邊工作人員、生前友好、家鄉和曾經工作過的地方代表、中央和國家機關工作人員代表也前往送別。」
20050130-5,20050130,5,解讀中國：趙紫陽悲劇的力量 - 張華,解讀中國：趙紫陽悲劇的力量 - 張華 現代中國的一齣悲劇《趙紫陽》，今天落幕了。雖然沒有十里長街的淚水相送，也沒有舉國哀悼的悲慟情景，甚至他至死還蒙受着不白之冤。但是，這樣的結局，才是一個被幽禁了十六年、最後鬱鬱而死的中共前總書記該有，只有他才配得上這樣的命運。在人類歷史中，一齣齣悲劇推動過一次又一次的社會變革，推動社會的進步。趙紫陽的悲劇，能為中國的現代化和民主化帶來甚麼動力呢？  古今中外，悲劇永遠扣人心弦，劇中那無盡的遺憾、悲痛，讓人難以忘懷，而那些傳誦千古的故事，也多是悲劇。莎士比亞的《李爾王》、塞萬堤斯的《唐吉訶德》、被亞里士多德譽為古希臘最經典悲劇的《埃迪帕斯王》，都是佼佼者；中國古代的屈原、項羽、岳飛等，都是悲劇人物，他們的故事都打動千萬人心。     理念成為不朽傳說   西方的悲劇始於古希臘時代，劇中主角都是大英雄因命運弄人，或個人的性格缺憾，總遇上難以逃避的災難，總會受到邪惡力量的迫害，最後溘然而逝。但他們勇於反抗命運的氣概，那壯烈的情懷和英雄主義思想，為正義、理想而獻身的精神，卻成了不朽的傳說。由於現實世界的殘酷，這些悲劇英雄的故事在西方世界代代相傳，成為社會最重要的精神食糧，激勵各人勇於面對逆境。面對暴政，他們敢於挺身而出；面對不公，他們願意捨身成仁。這就是悲劇的力量！  趙紫陽不是完人，做過很多錯事，在五十年代的土地改革、文革初期，還是那個吃人制度的幫兇，甚至在八九年血腥鎮壓民運前，他對現代民主政治的認識還很稚嫩，對民主的信念和追求也不熱切。但這無損他的聲譽，因為他在大是大非的關頭，在高尚和卑鄙之間、在良知和權位之間，他選擇了高尚、守住了良知。 趙紫陽影響力猶在   為此他被迫背負着「莫須有」罪名，從天堂走向地獄，從雲端掉落深淵，不但失去權力、失去自由，令子女、老妻、部下也陪着他惶恐度日，但他仍拒絕認錯來換取復出，拒向不合理的制度低頭。  過去十六年，中共如此對待他，還在他的喪禮安排上多方阻撓，更令他的悲劇增添幾分悲壯。  一個悲劇人物，即使是小人物，也可以是推動社會進步的重要力量。湖北大學畢業生孫志剛，前年到廣州工作，外出時因忘帶暫住證而被公安拘捕，後來在拘留室被活活打死。這是一齣悲劇，在社會上引起極大的迴響，引起總理溫家寶的關注，「暫住證」這種不合理制度廢除了。這是孫志剛以生命換來的成果，是社會進步的表現。趙紫陽的悲劇呢？  趙紫陽今天化作一縷輕煙，消失於京城灰蒙蒙的天空之中，但他對中國社會變革的影響力，一定不會隨他而逝。  只要中國要發展，早晚要面對「政治民主化」這道坎，趙紫陽的名字必然被重提，成為民主的象徵。諸位，千萬別低估了悲劇的力量！  電郵： cheungwah@appledaily.com 
20050130-6,20050130,6,叩訪富強胡同六號,叩訪富強胡同六號 編者按：這篇題為《叩訪富強胡同六號》文章，是趙家一位不願具名的親友去年探訪趙紫陽的實錄，罕見地披露了晚年趙紫陽對中國政治體制改革的深入思考。趙紫陽前智囊、前中國經濟體制改革研究所所長陳一諮取得這份記錄後，認為這篇文章所述內容是可靠的，又通過其他渠道對文中內容的真實性進行了確認，昨天透過「中國人權」公開此文。 在上個世紀七八十年代，我和趙紫陽家有很好的友誼。「六四」以後，我家漸漸和他們斷了聯繫，今年我和趙紫陽的兒子聯繫上了。對於我，趙紫陽不僅是在中國改革開放中立下豐功偉績的領袖，不僅是制止血腥屠殺的偉大政治家，而且是長輩，是親人。如今，經歷過「六四」以及了解改革開放初期之艱難的正直的中國人，都會對軟禁於破舊小院的趙紫陽心生同情。我非常想見到他，哪怕僅僅是向他傳遞一份敬重，一份愛戴，讓他知道，許許多多的普通中國人在惦念着他。  夏末的一天，我在細雨中來到富強胡同。緊鄰着繁華的王府井，小胡同越發顯得蒼涼靜謐。六號院灰牆上圍着一圈鐵絲網，門旁牆上鑲嵌着的「北京市重點保護四合院」石匾旁，注有「非開放單位」的提示，兩個警衞站在大紅門口，在周圍的古舊灰暗中顯得十分扎眼。我拿出身份證登記後，繞過大概是工作人員住的前院，來到老爺子的屋裏。  這個房間坐南朝北，一大排窗戶面對院子，但按照老北京的習慣，這並不是最適合居住的房子。東牆一排黃色的書架，像是七八十年代的機關用具，一張黑色大寫字台上零散地擺放着書刊，旁邊有一張電動按摩椅，椅子前面放着一個紅色的鐵皮暖水瓶，是那種在很多人家裏早已見不到的舊式暖水瓶，他（趙紫陽）自己倒開水。椅子後面放着氧氣瓶，西牆一排電視音響，兩個單人沙發靠着南牆，門口還有一個塑料三角架擺着雜物，陳舊的地板已被擦得紅漆脫落了。這就是趙老爺子的書房兼客廳。 「有些人告訴我各種消息」   坐在按摩椅上的老爺子站起來迎接我。他比十五年前最後一次在電視上露面消瘦了許多，但精神還好。我握着他的手說，趙叔叔，我們很想念你，我們大家都很想念你。他說，知道知道。我告訴他今年最受關注兩本書是《往事並不如煙》和《中國農民調查》，他說，「我都看了。」焦國標的《討伐中宣部》他也看了，還知道《南方都市報》案任仲夷、吳南生都給省委寫了信，還是判了八年。我說：「你消息很靈通啊！」老爺子有點得意地說：「有些人告訴我各種消息。」  我就講了黨校教授怎麼把各種觀點往「三個代表」的筐裏裝；講了法制建設、黨大還是法大的不同觀點；講到一個教授對政治體制改革前景的憂慮，說「政治體制改革，也就是真正實現法治，我是看不到了，我的兒子也看不到，我的孫子能不能看到我不敢說」。他聽得很有興趣，說：「黨校現在很敢講啊！」我說，我聽的課中，大概有三分之一的教授照本宣科講老話，有三分之一比較左或者教條，而有一些教授講得相當客觀甚至前衞，很尖銳，很實際。我感覺黨校許多教員都有過出國考察學習西方政治的機會，對西方國家特別是美國作了許多研究。
20050130-7,20050130,7,「現在中國的明白人愈來愈多了」,「現在中國的明白人愈來愈多了」 老爺子說：「現在中國的明白人愈來愈多了。其實現在的領導人也明白，但是他們沒有辦法改變現狀。現在的領導人沒有理想，沒有信念，他們不知道要把中國帶到哪裏去。中國的一黨專政是歷史形成的。共產黨認為打了天下就得坐天下，中國老百姓也認可打天下者坐天下的老傳統。問題在於，中國共產黨是按照列寧主義建設的黨，它控制了全國的所有資源。過去搞計劃經濟，平均主義，大鍋飯，也就是多一點少一點的區別，毛主席也不過是建個別墅嘛！可是搞市場經濟了，私人擁有資本、財產合理合法了，共產黨就必然會腐敗，有權勢的人必然會利用他們對資源的控制權把社會財富變成自己的私有財產。他們已經形成了一個很大的既得利益集團。」  「一黨專政下搞商品經濟，肯定會產生腐敗。但是像中國這樣，腐敗的面這樣廣，腐敗的速度這樣快，腐敗的程度這樣嚴重，這是全世界都少見的。審計署最近審計出許多嚴重案件，各地貪官也殺了不少了，沒用！共產黨控制所有資源的基本事實不變，腐敗就控制不了。印尼蘇哈托軍人政權也很腐敗，他那一家人也很厲害，但是和中國比，因為這個軍人政權沒有掌握國家的全部資源，不至於像中國這樣，腐敗滲透社會生活的各個方面，滲透進每個角落。」 「現在搞的是最壞的資本主義」   這時候妞妞（王雁南）進來打過招呼，老爺子接着剛才的話題憤怒地說：「中國現在搞的是最壞的資本主義！西方早期資本主義也壞，但可以逐漸走向進步，走向文明，而中國這個最壞的資本主義不可能走向進步！」我說：「其實，也可以有些辦法限制腐敗呀！比方說，給媒體充份行使輿論監督的權力，對各種貪污行為、對各種違反科學的決策及時曝光，可以使官員的行為有所顧忌，這是對黨有利的呀，而且成本很低，可是為甚麼中宣部老是阻止輿論監督，老是限制媒體呢？」  老爺子說：「他們害怕。他們害怕裂開一條縫，各種矛盾衝出來弄得不可收拾。他們必須維護他們自己和他們代表的一群人的既得利益。胡溫，不知道他們對政治體制改革怎麼想，即使他們有想法，也很難，要得罪那麼多既得利益者，很難。」我問：「那以後怎麼辦呢？」  老爺子說：「沒治了。就是北京人說的『沒治了』。沒有辦法了。」他咳嗽了一下，接着說：「有人給我講清末的歷史。戊戌變法不過只是一些改良而已，比起後來的晚清新政，新政的變革還徹底一些，但慈禧不能接受，把變法鎮壓了。到八國聯軍打到北京，她也知道政權已經爛得無法維持，後來她自己搞新政。可是晚了，新政推不動，孫中山就領導辛亥革命了。」
