key,date,article_daily_id,title,text
20050127-56,20050127,56,20年舊樓可申請復修,20年舊樓可申請復修 【本報訊】市區重建局昨宣布，即時放寬參與樓宇復修試驗及貸款計劃的申請資格，以改善舊樓環境衞生，凡樓齡二十年以上的樓宇都可參加。市建局表示，將額外增撥二千三百萬元作為經費，估計有一百六十五幢樓齡「較輕」大廈會受惠。  市建局地區發展總監林偉能昨表示，去年推出的復修及貸款計劃只容許三十年樓齡以上的大廈申請，至今已有八十二幢大廈參與，反應良好，故進一步放寬至二十年以上樓齡大廈都可參與。此外，未接獲屋宇署維修令的住戶，亦可向市建局申請參與復修試驗計劃。  已參與市建局復修計劃、位於大角嘴的富貴大廈東座業主立案法團主席譚小姐表示，大廈約二百名業主早前斥資二百二十多萬元，完成大廈外牆、水渠及油漆翻新工程，市建局資助十多萬元物料費用。復修前一個約三百平方呎單位賣二十萬元也無人問津，但復修後開價三十萬元都「爭住要」。
20050127-57,20050127,57,國泰機師骨灰擬撒下深淵,國泰機師骨灰擬撒下深淵 【本報訊】潛水身亡的國泰機師DaveShaw的追悼會昨在南非首都比勒陀利亞舉行。他的兒子正考慮將父親的骨灰撒在他出事的淡水洞穴Boesmansgat或他以往曾潛探的洞穴，讓他安息。他說：「我高興父親能完成他的任務，帶Deon回來，我父親在作他喜愛的潛水時去世，亦在幫助他人時去世。」  DaveShaw因打撈十年前在該洞穴失蹤的潛水員DeonDreyer的屍體時意外死亡，其後兩人屍體同時被發現。南非《星報》引述DeonDreyer的母親說：「我等待了他十年……看見他的遺體可以讓我說聲再見。」
20050127-58,20050127,58,滅蚊運動下月底展開,滅蚊運動下月底展開 【本報訊】為加強控制登革熱病媒白紋伊蚊及日本腦炎病媒三帶喙庫蚊在港數目，食物環境衞生署將由下月二十一日開始，進行為期二十個星期的滅蚊運動，以提高市民的防蚊意識。  食環署發言人表示，推行滅蚊工作期間，當局會配合地區防控蟲鼠組人員的檢查和執法。  政府有關部門亦會在其轄下場所進行檢查和巡視可能滋生蚊子的地方，及進行滅蚊工作。此外，上月誘蚊產卵器平均指數最高是灣仔北及上環，兩地區均為百分之二。
20050127-59,20050127,59,大隧申請加價影響獅隧,大隧申請加價影響獅隧 【本報訊】大老山隧道提出加費申請，加幅最多達三成，私家車及的士加價兩成至十二元，較獅子山隧道收費貴四元，預計屆時每日近千架次車輛會轉用獅隧，令已超出容量的獅隧更擠塞。當局表示，隧道收費可由特首、行政會議與隧道公司協定更改，但若隧道公司是次加費建議被政府拒絕，該公司或會訴諸仲裁。     累積虧損逾四億五   環境運輸及工務局將就大老山隧道加費申請諮詢立法會交通事務委員會。該局文件指出，大老山隧道公司至去年六月累積虧損四億五千多萬元，與其估計累積盈利十億多元相差逾十四億元，故提出加費申請。  但文件指出，大老山隧道每日容量為七萬八千五百架次，現時每日行車量為六萬一千二百架次，加費後每日將有九百四十架次車輛改用獅隧，改行大埔公路則有二百六十架次，會令兩者更擠塞，尤其是獅隧每日容量七萬八千五百架次，現時已達八萬九千架次。不過，隨着馬鞍山鐵路啟用及八號幹線長沙灣至沙田段○七年通車後，獅隧擠塞將改善。  據大老山隧道加價建議，私家車和的士收費由十元增至十二元；小巴和輕型貨車加一元至十八元；雙層巴由二十元加至二十六元。
20050127-60,20050127,60,郭晶晶接「閉口令」：不知道，別問我,郭晶晶接「閉口令」：不知道，別問我 【本報訊】從萬人歡呼的奧運「金牌英雄」到被剔除出隊的「跳水隊罪人」，田亮認識到天堂與地獄之間，原來可以這麼近。內地主要媒體站在田亮的對立面看事件，一點也不意外；同樣，最壁壘分明的回應來自互聯網的論壇。至於前緋聞女友郭晶晶及其他跳水隊員，如胡佳等，則收到了「閉口令」，拒回應事件。  正在訓練中心的郭晶晶只作了六個字的回應：「不知道，別問我。」就隨即登上了領隊周繼紅的車絕塵而去。  領隊周繼紅面對記者說的第一句就是：「我不會對事件發表任何言論。」對於田亮發表的聲明，她也表示沒有看到。  國家體育總局游泳管理中心主任李樺，在回答如果田亮表現好，能否回到國家隊時，表示國家大門永遠向優秀運動員敞開。     設體育明星管理制度   新華網發表評論，「田亮與科比、姚明的差距──評體育明星管理」，文中提到田亮是國家資源培訓，而科比卻是靠自己，因此中國運動員不該私下作商業活動。文章末端更提出中國應該與時並進，建立一套管理明星運動員的制度，避免田亮事件重演。  反應最激烈的，仍然來自相對自由的網上論壇。「田亮除了是運動員，他還是人，應該有基本自由。」可是，更多的留言都抨擊田亮「是國家培養你成材，是領導的關懷和人民的支持，可你有了名氣就狂了……」
20050127-61,20050127,61,喇沙中一生　花半年創作　挫30萬幅作品12歲童奪海報設計全球冠軍,喇沙中一生　花半年創作　挫30萬幅作品 12歲童奪海報設計全球冠軍 【本報訊】「人與人之間嘅矛盾好似一幅牆，令人類走入黑暗嘅迷宮，我畫嘅白鴿就將地球從迷宮中拯救。」十二歲的李卓達擊敗一百九十四個國家及地區超過三十多萬幅作品，奪得國際獅子總會第十七屆和平海報設計比賽全球總冠軍，亦是本港第二位奪此殊榮的「小畫家」，足證明本港青少年的創意無限。　記者：黃秋豪 國際獅子總會舉辦全球性的和平海報設計比賽已有十七年歷史，讓十一至十三歲的兒童參加；今屆比賽的主題為「GivePeaceaChance（給和平一個機會）」。就讀喇沙書院中一的李卓達第二年參賽，上屆入選全球最佳的二十四幅作品，獲優異獎。  這次他奪得全球總冠軍可謂「過五關，斬六將」，首先擊敗來自近二百間港澳的中小學，共一千一百多幅作品，然後再與全球一百九十四個國家及地區，超過三十萬幅參賽作品一較高下。李卓達的作品以一隻白鴿啄破一個黑暗迷宮，從而帶來光明來表達對和平的希望，獲評判團的一致好評。     白鴿眼神堅毅   李卓達說，人與人之間的矛盾像一道牆，會令人類走進黑暗的迷宮。「我希望人人好似白鴿咁堅定不移，不怕困難，努力用和平方法解決矛盾，咁就可以走出黑暗，得到真正嘅和平。」  李卓達從構思至完成作品共花近半年時間，繪畫了四十多幅草圖才滿意，當中以白鴿的眼神最難表達。「我要用白鴿嘅眼神嚟表現佢嘅堅毅，最終喺兩、三張畫紙上面畫滿咗白鴿眼先得到最滿意嘅一對。」  國際獅子總會港澳三○三區和平海報委員會主席何麗貞表示，連李卓達在內，本港至今曾獲兩次全球總冠軍及四次優異獎。     青少年有創意   何麗貞說：「對上嗰次攞全球總冠軍係○一至○二年嗰屆，香港青少年可以有咁好成績，證明佢哋嘅創意無限。」
20050127-62,20050127,62,大馬撿擬走私來港999條巨蜥,大馬撿擬走私來港999條巨蜥 【本報訊】馬來西亞檳城關稅局偵破今年度最大宗走私巨蜥案，在當地機場起獲九百九十九條準備運往香港，總重達四千四百公斤，俗稱「五爪金龍」的巨蜥。《星洲日報》報道，該批巨蜥疑主要供應給中國和香港食客，作為華人農曆新年的野味大餐。     五爪金龍藏於木箱   檳城關稅局執法組日前清晨，接報到峇六拜國際機場空運中心展開調查，結果在一批準備運往香港貨物中，起獲大批學名澤巨蜥的活生生「五爪金龍」，該批巨蜥裝在藍色網袋，每個網袋大概放有三、四條，再放在七十個通風的木箱裏。     擬運到野味店烹煮   據野生動物局調查官員指出，運送這批巨蜥的負責人在向關稅局呈報時，填寫虛假資料，只呈報運送五百隻動物，但沒提及那是動物法例下受保護的澤巨蜥。他說，經過調查，這批巨蜥相信是在彭享及柔佛深山被捕捉後，再運送到檳城，然後再空運到香港及內地等地方野味店，被宰殺成為「桌上佳餚」，以應付農曆新年所需。這批巨蜥共重約四千四百公斤，總值約二十多萬港元。
20050127-63,20050127,63,公務員迫退休評核期擬縮短,公務員迫退休評核期擬縮短 【本報訊】政府自○三年四月起精簡處理表現欠佳公務員的手續後，截至上月底的二十一個月內，共有十七名公務員因工作表現持續欠佳而被着令退休。公務員事務局局長王永平透露，政府正考慮進一步把着令退休所需的評核時間由現時的一年縮短至半年。不過，公務員工會聯合會主席梁籌庭卻認為半年時間太短，未必可真正觀察員工的表現，擔心反而會激起管職雙方的矛盾。     21月退去17人   王永平昨在立法會回覆議員質詢時表示，新措施截至去年底的二十一個月內，已有十七名員工因表現持續欠佳而被着令退休，較新措施實施前四年合共只有十六人被着令退休大幅增加。他形容修訂程序取得成效，當局正考慮進一步簡化着令表現持續欠佳公務員退休的程序及所需時間，未來幾個月會諮詢公務員敍用委員會及職方意見。  另外，王永平表示，政府會透過加強培訓以提升公務員的表現，今年將推出新一輪培訓資助計劃資助初中級管理人員修讀外間認可管理課程。
20050127-64,20050127,64,醫護人員被襲個案增,醫護人員被襲個案增 【本報訊】衞生福利及食物局回覆立法會查詢時指出，公立醫院醫護人員當值時被襲的個案持續高企，去年上半年共發生三百三十二宗；最多發生在葵涌醫院，其次是青山醫院及東區醫院，分別有七十五、四十八及四十六宗。  由○○年開始，醫護人員被襲個案急速增加，○○年有三百二十三宗，○二年增加一倍至六百六十一宗，○三年也有六百二十六宗。  由九七年至去年，當局總共起訴二十五宗個案中的動武者，十六宗個案被定罪，他們被判罰款、接受法庭監管、拘留精神病院或監禁。
20050127-65,20050127,65,房協20村再凍租一年,房協20村再凍租一年 【本報訊】房屋協會考慮本港經濟及市場情況後，昨決定繼續凍結轄下二十條屋邨下財政年度（即今年四月至明年三月）的租金，涉及三萬二千多個單位，估計約十萬名居民受惠。  房協發言人表示，這是房協自九八年以來連續第八年凍結出租住宅單位租金，房協將於明年初再次全面檢討租金水平。  受惠屋邨包括港島的健康邨、勵德邨，九龍的駿發花園、家維邨及新界的乙明邨、沙頭角邨等。
20050127-66,20050127,66,內地製造DVD　外銷本港海外日本卡通片盜版集團被搗破,內地製造DVD　外銷本港海外 日本卡通片盜版集團被搗破 【本報訊】海關特遣隊破獲近年最大宗盜版光碟案，大批關員過去兩日在觀塘一個商業大廈及沙田一家物流公司內，共起出二十四萬隻盜版港產電影及日本卡通片DVD，總值逾六百萬元。行動中，海關拘捕一個盜版光碟集團的四名骨幹成員，目前正追緝主腦歸案。海關表示，過去五年，海關共撿獲盜版光碟三千多萬隻，涉及的款項高達六億六千多萬元。　記者：薛家傑 海關特遣隊監督陳志洪表示，今次代號「刺針」的行動部署了約兩個星期。海關人員較早前根據線報，發現一個盜版光碟集團，從內地輸入大量日本卡通片集及港產電影的盜版DVD光碟，然後以批發形式本銷或出口往海外。  至前日下午四時許，二十名特遣隊關員採取行動，突擊搜查觀塘道一個商業大廈內一家公司，結果撿獲二十三萬隻盜版電影及日本卡通片光碟，並拘捕兩男兩女（二十八至四十三歲）。海關相信，上址是盜版光碟集團的包裝及儲存中心，被捕男女則是集團成員，在上址負責包裝及出貨。  此外，海關人員亦在上址撿獲電腦及出貨單據，稍後將有關器材及文件交由海關「電腦資料鑑證實驗室」檢驗，套取該集團的進一步資料，及追查主腦的下落。     撿獲24萬隻光碟   至昨天上午十一時，關員再於沙田一家物流公司，撿獲一萬隻正準備付運往美國的盜版光碟，兩批合共二十四萬隻光碟，總值逾六百萬元。今次撿獲的光碟包括日本卡通片集《GTO》、《千與千尋》、港產電影《2046》、《救命》等等。  海關表示，由二○○○年至去年，海關共偵破四萬餘宗盜版案件，撿獲盜版光碟三千一百五十多萬隻，總值六億六千八百多萬元，共拘捕六千五百零九人，當中五百四十一人為十五歲以下小童。
20050127-67,20050127,67,跳海拾篋兩漢獲救,跳海拾篋兩漢獲救 【本報訊】二十名乘貨船抵港印度籍船員，昨清晨五時，乘一艘駁艇離開停泊在南丫島的貨船開抵尖沙嘴天星碼頭登岸，其中兩名分別四十六及五十歲船員疑因大浪致船隻搖晃，一人失重心將攜帶載有手提電腦及咖喱粉的手提篋跌落海，兩人先後跳落海將手提篋撿拾回，但卻因水退無法上岸。  警員到場拋下兩個水泡給他們，再由駁艇將他們救起登岸，兩船員僅衣衫盡濕，未有受傷，篋內物件亦未損毀，事後與其他船員自行離去。
20050127-68,20050127,68,解款箱失靈冒紅粉,解款箱失靈冒紅粉 【本報訊】昨下午三時許，兩名解款員到鰂魚涌太古坊德宏大廈花旗銀行提取文件，其中一人（圖右三）拿着的解款箱突然噴出紅色粉末，左手及褲管沾上紅粉，銀行內防火鐘更觸動。大批警員趕赴現場發現並非發生火警，只是解款箱失靈洩漏防盜粉末，稍後護衞公司派員取走失靈解款箱檢查。  簡明恩攝
20050127-69,20050127,69,校巴撞車11童送院,校巴撞車11童送院 【本報訊】一輛載着三十名小學二年級男女學童的校巴，昨晨十時許，沿屯門公路駛回位於天水圍的學校，途近元朗公路上橋位時，因前面一輛貨車突然煞停以閃避切線的士，致校巴收掣不及撞上貨車車尾。其中七女四男均為七歲的學童受驚及報稱不適，事後須一併送院（圖），其餘學童則由另一輛校巴接走。  梁瑞帆攝
20050127-70,20050127,70,寄遺書後男子自殺,寄遺書後男子自殺 【本報訊】鯉魚門鯉安苑一名疑患思覺失調男子，日前向友人寄出兩封遺書後服藥自殺，死者友人昨日接獲信件趕至事主寓所，赫見木門由硬物頂着，於是報警。警員破門救出陷於昏迷男事主送院（圖）證實死亡，警方相信事件無可疑，正聯絡死者家人助查。  自殺死亡男子姓梁（三十九歲），任職貿易公司，平日聘有一名鐘點工人打理家務，警方亦發現事主曠工多日。消息稱，昨日揭發事件的姓李女子（四十一歲），昨日外遊回港返家接獲事主信件，發現是對方的遺書，立刻約同持有死者門匙的鐘點女工趕赴現場。  劉永明攝
20050127-71,20050127,71,體育政策僵硬　世界冠軍變負面教材田亮商業價值或下跌,體育政策僵硬　世界冠軍變負面教材 田亮商業價值或下跌 【本報訊】就國家跳水隊怒炒田亮事件，有學者指出，在中國體育事業發展過程中，國家有關部門應研究體育事業如何與商業取得平衡，照顧運動員的心理狀態，令他們有更好的出路。有體育界人士同時指出，田亮被國家跳水隊開除後，他的商業價值亦會下跌。 浸會大學體育學系副教授雷雄德指出，現時中國體育運動與商業的關係愈來愈密不可分，田亮並非個別例子，其他金牌選手亦會面對類似問題，他認為體育總局應研究是否需要採取新措施讓運動員更易在運動與商業間取得平衡，尤其是照顧金牌選手的心理狀況，「未成金牌運動員之前，完全冇呢啲問題，但一奪得金牌後，運動員面對商業利益同刻苦訓練，壓力可能會好大，條路點樣走，唔易決定。」     仍有機會返國家隊   雷雄德續稱，國家跳水隊可輕易放棄田亮，與跳水隊有完善培育接班人制度有關，他形容跳水隊除了少數在「金字塔尖」的金牌選手外，底部還有不少有潛質的新秀，故相信田亮離隊也不會影響○八年的奧運成績，他又說不擔心田亮自此身價暴跌或運動員生涯告終，「憑佢嘅外形，相信只要稍加包裝就可以喺娛樂圈闖出成績，而且佢始終係奧運金牌得主，應該重有好多商業機構向佢招手。」  香港體育學院署理院長鍾伯光表示，中國運動員由國家培養，需要絕對服從紀律，田亮作為著名運動員，違反紀律對年輕一輩造成負面榜樣，國家跳水隊將他開除無可厚非，若他能再投入訓練並有所表現，則仍有機會重返國家隊，但事件對他聲譽有損，相信他的商業價值亦會下跌。  據統計，中國現時有五百萬名退役運動員，由於年紀大，沒有文化加上傷病纏身，缺乏社會關心，不少人晚景淒涼。以中國體育大省的遼寧為例，該省的體育學院有「金牌工廠」之稱，擁有世界冠軍五十人，亞洲冠軍一百九十五人，全國冠軍一千多人，但金牌運動員退役後的生計都成大問題，舉重名將才力的例子更令人心酸。 運動員退役乏保障   曾打破世界紀錄及奪得六十多個冠軍的金牌舉重選手才力，因病於前年去世，年僅三十三歲，他九七年退役被分配到瀋陽市交通局，因學歷太低被拒，最後被安排到遼寧體委大院當看更，家中生活困難，長期患病無錢醫治鬱鬱而終。  現時中國的奧運冠軍，是在「舉國體制」下培養起來的，靠的是國家投入巨額資金及力量，把全國最優秀的人才集中在奧運數個項目上，不惜一切代價，保證運動員奪金摘銀，而在金牌背後，中國體育「金字塔」的塔基卻充滿辛酸和淚水。  或許田亮深明前輩運動員的苦況，在奪取榮譽後進入娛樂圈積累資本，但從國家來看，每個奧運選手投入的經費近五百萬元，去年雅典奧運共有四百名運動員，以獲取三十二枚金牌折算，每枚成本高達五、六千萬元，金牌運動員可說是「國有資產」，對國家來說，田亮的行為絕對不能容忍。
20050127-72,20050127,72,價值55000兩鬆獅狗被賊偷走寵物店東主懸紅八千元尋犬,價值55000兩鬆獅狗被賊偷走 寵物店東主懸紅八千元尋犬 【本報訊】油麻地庇利金街發生偷狗案，兩頭系出名門的鬆獅狗（ChowChow）昨下午在一家寵物店內不翼而飛，店東懷疑賊人趁店內無人看舖，潛入店內打開狗籠將狗偷走，警方接報將案件列作盜竊處理。店東表示，兩頭被偷的鬆獅狗總值五萬五千元，店方已與其中一名準狗主合資懸紅八千元尋狗。　記者：盧志光 發生偷狗案的現場為油麻地庇利金街二十三號康妮寵物美容店。警方消息稱，昨下午三時五十分，上址女店東黃太（五十歲）報案，指兩頭分別放在兩個狗籠內的鬆獅狗不翼而飛。警員到場發現狗籠被人打開，懷疑有人潛入店內開啟狗籠將狗偷走。  據黃太向警方稱，事發時，她正在寵物店的閣樓工作，店內的寵物美容師亦在另一個房間內替狗隻吹毛，所以舖面無人看守，估計賊人趁機潛入店內將狗偷走。     曾獲最佳外觀獎   黃太事後向記者稱，兩頭被偷走的鬆獅狗一雌一雄，是一對「姊弟」，分別三及兩個月大。兩「姊弟」系出名門，父親「麵包頭」是一頭名犬，連續多年在「亞太狗展」中獲取「最佳外觀獎」等獎項。  黃太說，被偷走的鬆獅狗「姊弟」市價分別三萬五千元及兩萬元，其中雄狗兩星期前由一名熟客朱太落定購買，並起了名字叫「Coffee」，準備日內將狗取走，怎料卻被賊人偷去。  黃太表示，寵物店開業八年，年前曾發生賊人入店偷走波斯貓案件。而經過今次事件，她打算加強保安，包括替每個狗籠加上大鎖。此外，她與準狗主朱太商量後，決定合資八千元懸紅，追尋狗「姊弟」的下落。
20050127-73,20050127,73,小巴撞壆司機被困,小巴撞壆司機被困 【本報訊】一輛空載紅色小巴，昨凌晨近一時，沿油塘茶果嶺道慢線向觀塘駛至貨物裝卸區對開時，二十九歲姓謝司機報稱扭軚閃避突然衝出馬路的流浪貓，失控撞毀三十米鐵欄、數棵大樹及一個垃圾桶後，再反彈撞路中石壆，車頭嚴重損毀，司機右腳受傷被困，並透過無線電通知其他司機報案。消防員到場將傷者救出送院（圖），他酒精測試沒有飲酒。  黃曄寧攝
20050127-74,20050127,74,海鮮公司被淋紅油,海鮮公司被淋紅油 【本報訊】深水埗海壇街一間專營海鮮批發公司，昨晨八時許，一名女職員上班時，發現大閘及門外屬於公司的一輛貨車的擋風玻璃及車身遭人淋紅油（圖），遂通知姓林（四十歲）東主報案。東主表示沒有與人結怨，但懷疑與較早時生意上的金錢糾紛有關，案件警方仍調查中。  吳國威攝
20050127-75,20050127,75,賊黨一小時兩行劫,賊黨一小時兩行劫 【本報訊】北角及銅鑼灣昨在一小時內分別發生兩宗搶劫案，昨晨一時許，姓植（四十五歲）的士司機（圖右）接載三名男子往北角卻遇着「霸王客」，被對方圍毆及搶去他一百元逃去。至二時許，姓謝（十九歲）青年與姓林同齡女友，在銅鑼灣告士打道近百德新街一個公園遭三名賊人圍毆及搶去一部值二千多元的手機，賊人逃去，事主受輕傷。警方現正調查兩宗劫案是否屬同一幫人所為。  卓永強攝
20050127-76,20050127,76,老翁收衫失足跌傷,老翁收衫失足跌傷 【本報訊】昨下午一時許，七十二歲姓鄧老翁在大埔富亨邨停車場一樓上蓋收衫時發生意外，當他爬上一米半高矮牆，準備解下繩索取回在上址曬晾之衣物，突失足飛墮三米下地面跌傷右腳，由街坊發現報警，救護員趕至替傷者包紮後送院（圖）。附近居民常在上址平台曬晾衣物，事發後不少街坊聞訊趕忙收衫。  徐雲庭攝
