key,date,article_daily_id,title,text
20050416-28,20050416,28,柯尼卡、美能達兩款數碼相機稱王,柯尼卡、美能達兩款數碼相機稱王 【本報訊】消費者委員會測試了市面上十一款新型號的數碼單鏡反光機及輕便相機，柯尼卡美能達Dynax7D+28-100mmD及DiMAGEA200型號相機，獲得最高評分，成為新一代「數碼機王」之一。 比較解像度   消委會測試了三款數碼單鏡反光機及八款數碼輕便相機，以比較各相機的解像度、照片清晰度、電池表現及拍攝速度等。結果售價近一萬五千元的柯尼卡美能達的Dynax7D+28-100mmD，以及只售約七千元的賓得*istDS+18-55mmDAAL型號相機，在總評中同得四分，雙雙獲得「機王」美譽。  數碼輕便相機方面，柯尼卡美能達的DiMAGEA200、新力Cyber-shotDSC-V3及尼康的Coolpix4800型號相機在總評分中同獲四分，成為輕便相機中的最佳選擇。消委會表示，各樣本在不同測試項目中表現互有高低，價錢則相差頗大，消費者不妨細心比較，選擇心儀相機。
20050416-29,20050416,29,平價咖啡機媲美貴價貨,平價咖啡機媲美貴價貨 【本報訊】消委會首次測試在巿面售賣的九款家用Espresso特濃咖啡機，發現售價相距極大，由千多元至近萬元不等，惟測試結果顯示，售價最低的DeLonghi牌EC200CD型號（圖），在測試中總評分最高，表現與貴價貨不遑多讓。  消委會測試九款家用的Espresso特濃咖啡機，分別有三款全自動型號以及六款非自動型號，售價由一千二百九十八元至八千九百元不等，測試其咖啡味道、使用方便程度、咖啡溫度、省電度、起泡效果、沖調首兩杯咖啡的時間等項目。     售價相差大   結果顯示，儘管樣本售價相距極大，惟貴價樣本的表現未能「獨霸」最好評級。  其中價錢最低的DeLonghi牌EC200CD型號（一千二百九十八元）以及中價的Saeco牌ViaVeneto型號（二千六百五十元）咖啡機，與售價五千多元至八千多元的三款全自動型號的貴價機（DeLonghi牌MagnificaEAM3000B型號、Saeco牌Incantorondo型號及Gaggia牌Titanium型號），試測中同樣獲得的評分最高，獲四星評級（以五星最高）。
20050416-30,20050416,30,代鹽產品影響人體健康,代鹽產品影響人體健康 【本報訊】食物環境衞生署聯同消委會，去年開始測試市面上七十四款食鹽，發現全部樣本都沒含砷、鎘及銅等金屬污染物；本港亦沒發現有人以工業鹽充當食鹽出售。不過，消委會提醒市民，代鹽產品內的鉀會影響人體健康，切勿以「代糖」心態食用代鹽產品。     過量可致心衰竭   消委會指出，一般低鹽產品是以鉀代替鈉令食物有鹹味，但攝取過量的鉀會影響腎病人士，或正服用高血壓及心臟衰竭藥物人士的健康，令他們出現心律不整及心衰竭危險，故不宜大量食用代鹽產品。  食環署顧問醫生何玉賢則表示，食鹽所含的氯化鈉雖能協調體內神經傳導、肌肉收縮及平衡電解質，但過份攝取鹽份會導致嘔吐、腸胃潰爛及高血壓等中毒反應。他建議成年人每人每日攝取不多於五克（約一茶匙）食鹽，以避免出現中毒反應。
20050416-31,20050416,31,逾300教徒維園悼教宗,逾300教徒維園悼教宗 【本報訊】三百多名天主教徒昨於維園舉行悼念教宗若望保祿二世燭光集會，以歌聲及誦經聲感謝教宗為世人所作的貢獻。  燭光集會於昨晚七時許舉行，不同年紀信眾陸續到達維園，並燃點起燭光。大會帶領三百多名信徒默哀一分鐘後，再誦經及唱歌，氣氛哀而不傷；大會更播放多段講述教宗生前如何到第三世界國家等，扶助弱小貧窮情況，部份人邊看邊拭淚。  陳日君與信眾分享時說，教宗尊重宗教自由，但內地教徒卻未能享有完整的信仰自由，他呼籲內地政府「唔使怕」，「因為真正嘅教徒肯定係好公民，因為聖經叫我哋愛自己國家。」大會在台上表示受民陣所託，提醒信徒四月二十四日的反人大釋法遊行，但陳日君不肯回應會否呼籲信徒參與。
20050416-32,20050416,32,周一嶽探望日本腦炎初癒童,周一嶽探望日本腦炎初癒童 【本報訊】半年前不幸感染日本腦炎後，因神經系統受損而終日神色呆滯的六歲小童莫家樂，今日已像普通小孩一樣活潑非常。衞生福利及食物局局長周一嶽昨到流浮山探望大病剛癒的樂仔，惟樂仔正在午睡，未能與周相會。     說話有點含糊   周一嶽昨午前往元朗流浮山沙江村探望樂仔，可惜樂仔當時正在午睡，周只坐在樂仔的床邊一會就離去。樂仔其後接受訪問時說，早前因為生病而無法行步，但現已可踏單車，說話時還蹦蹦地跳。但記者所見，樂仔說話仍有點含糊。  周一嶽昨又前往元朗坑口村及沙江村一帶巡視蚊患情況，包括前往一間未能聯絡上業主的荒廢村屋巡視積水情況。  元朗區約有八百所類似的荒廢村屋，食環署人員往往需要耗費大量時間確定有關村屋的擁有人，令滅蚊工作存有困難。所以當局計劃下月四日向立法會提交文件，建議修改法例，賦予食環署在沒有發出通告的情況下，對有關處所採取滅蚊行動，並追討相關開支的權力。
20050416-33,20050416,33,不斷打電話可囚兩月,不斷打電話可囚兩月 根據香港法例第228章《簡易程序治罪條例》第20條，任何人若使用電報、電話、無線電報或無線電話傳送任何極為令人厭惡的訊息，或任何不雅、淫褻或威脅性質的訊息；或使用上述方法傳送任何其明知是虛假的訊息，旨在對他人造成煩擾或不便，或旨在令他人產生不必要的憂慮；或無合理因由及旨在達致任何上述目的而不斷打電話，一經定罪，可被判處罰款一千元及監禁兩個月。
20050416-34,20050416,34,騎師韋紀力上訴被駁回,騎師韋紀力上訴被駁回 【本報訊】澳洲籍騎師韋紀力在今年三月五日於沙田馬場第二場第四班千二米泥地賽事，策騎由練馬師姚本輝訓練的「有信心」出賽，因陣上未盡全力爭取最佳名次，最終跑第六名，被馬會競賽小組判罰停賽十六日。     指馬匹健康有問題   韋紀力對裁決不服提出上訴，經過本周三日審訊後，昨晚九時終於有判決，馬會董事局裁定韋紀力上訴失敗，維持原判，由下周三起開始停賽，直至六月二十二日才可策騎馬匹出賽。  馬會上訴委員會由主席夏佳理及董事施文信主持，因兩人平日公事繁重，所以要在辦公時間後才可以主持聆訊，而韋紀力則聘用大律師艾勤賢代為答辯，更從澳洲聘請獸醫來港，透過獸醫的專業知識，證明辯方其中一個主要論點，「有信心」在該仗及對上幾場賽事後，喉部或氣管內有很多血，反映「有信心」健康有問題，足以影響陣上演出。  可是以夏佳理為首的上訴委員會，對此卻不予認同，認為「有信心」該仗在陣上末段走勢強勁，故此氣管及喉部有血影響演出的理論，並不適用於該駒身上，所以駁回韋紀力的上訴。
20050416-35,20050416,35,設售原油騙局　誘買家入數千五萬偷龍轉鳳盜款案三漢受審,設售原油騙局　誘買家入數千五萬 偷龍轉鳳盜款案三漢受審 【本報訊】一批騙徒設局假扮出售價值一千五百萬元的原油，要求商人先開戶存入千五萬作抵押，同一時間利用假證，在同一銀行開設與商人同名的帳戶，乘機「偷龍轉鳳」，調轉商人手上存摺，騙得商人將錢存入假帳戶。其中三名匪徒及後到銀行，意圖利用假證取八百萬，遭機警的銀行職員揭發當場被捕；其中一匪昨在區域法院認罪，並將出庭指證兩名同黨。　記者：陳曉薇 二十八歲被告李兆樑，報稱無業，昨日承認兩項使用虛假文書及一項處理贓物罪；同案另外兩名被告，為二十九歲的林展忠（任職司機）及三十一歲的謝俊賢（任職侍應），二人否認使用虛假文書、處理贓物及管有他人身份證等三罪，昨受審時指其招認的口供，並非自願錄取，要求法庭不要接納為呈堂證供。     以假內地證件開戶   根據李兆樑承認的案情，三十四歲從事保險業的事主陳建威，代其外父同意購買一批價值一千五百萬元的原油，陳與賣方達成協議，賣方須將一筆二十萬元定金交由一名律師保管，陳則須在銀行開立一個帳戶，存入一千五百萬元，以示他有能力達成交易。去年十一月一日，陳在銀行以一百元開立一個帳戶，而李兆樑亦以假內地證件，在同一銀行開立一個與陳同名的帳戶。     醒目銀行職員報警   陳同日到餐廳與賣方代表見面，其間賣方代表乘機「偷龍轉鳳」，將李兆樑開立的帳戶存摺調包給陳，叫陳將錢存入假帳戶。雙方翌日將假存摺及賣方的二十萬元定金放在律師樓作抵押，簽署原油交易合同，同日陳用身份證查帳時，發現他開立的帳戶只有開戶時的一百元，差不多同時間，李到銀行報失銀行存摺，以假證意圖提取三百萬元現金及購買一張五百萬元的本票，銀行職員發現李形迹可疑，暗中報警揭發事件。  警方在現場拘捕李兆樑、林展忠及謝俊賢三人。李在警誡下稱，林指使他用假證開戶，答應給他二萬元作報酬，謝負責睇水。  案件編號：DCCC1350/04
20050416-36,20050416,36,探望患癌入院母親時犯案入境處職員偷拍裙底罰千元,探望患癌入院母親時犯案 入境處職員偷拍裙底罰千元 【本報訊】已婚高級入境處事務助理因母親患末期肺癌，到明愛醫院探病期間，以具有攝錄功能的手提電話，偷拍一名女訪客的裙底春，被醫院職員目擊犯案過程，報警將他拘捕。其後警方在其手提電話內發現逾十段偷拍裙底短片，涉案入境處職員昨在觀塘裁判法院，被裁定一項在公眾地方作出擾亂秩序的行為罪名成立，罰款一千元。     妻子聞判庭上嚎哭   辯方求情稱，被告任職入境處近十二年，月入二萬一千多元，今次事件令他失去工作，對他打擊甚大，其母親已去世。裁判官基於被告初犯，事主事後才感到驚慌，因此判處被告罰款一千元。被告妻子昨得悉丈夫罪成後，不禁嚎哭起來，至等候判刑期間，被告擁着妻子安慰她。  三十三歲男被告梁達新，高級入境事務助理，現被停職。控罪指他於去年十月二十六日，在深水埗明愛醫院懷明樓九樓，用手提電話拍攝一名女訪客的裙底春光短片。  二十七歲事主昨供稱，案發日中午她到明愛醫院探望病重的舅公，當她站在病房外，專心注視報告板上的資料後，不久有警員通知她遭人偷拍裙底，她觀看有關短片，確認短片中的女子為她自己。     持手機伸入兩腿間   目擊案發經過的醫院女健康助理員昨供稱，她在病房替病人換尿片後，望向病房外，見到被告曲膝站在事主後面，手持手提電話伸進事主兩腿間，她立即將事件告知護士長代為報警。  被告昨自辯稱，他見事主所使用的手提電話十分漂亮，遂上前站在她身後察看其牌子，並沒有偷拍她。裁判官不接納其解釋，認為控方證人的供詞可靠，裁定被告罪名成立。  案件編號：KTCC7924/04
20050416-37,20050416,37,來港偷貨　東莞銷贓兩專業女賊同囚26月,來港偷貨　東莞銷贓 兩專業女賊同囚26月 【本報訊】兩名經常持雙程證並以不同身份來港的內地婦人，於四天內在多個大型商場大肆偷竊，盜取三百二十多項價值逾十萬元貨品，打算帶返內地東莞的店舖出售。二人每次均能逃過店舖職員的法眼及防盜系統，警方接獲線報，二月二十四日成功在紅磡火車站拘捕正攜着大批「戰利品」離境的婦人。二人昨在區域法院承認控罪，在加刑三成後被判監兩年兩個月。     多次冒名來港   被告歐瑞萍（三十五歲）及姚容英（四十九歲）同被控一項串謀偷竊罪。兩名被告分別曾以另外數個名字來港，而且均曾數度在港觸犯店舖盜竊罪，並因此被判監禁，被告的代表大律師亦承認她們為「專業罪犯」。至於案中替兩被告看守贓物的林莉玲原被控以一項處理贓物罪，獲控方終止起訴釋放。  案件編號：DCCC251/05
20050416-38,20050416,38,候發落少年犯獲定刑,候發落少年犯獲定刑 【本報訊】八五年寶馬山雙屍案，最後一名「等候特首發落」的少年犯張有恆，在獄中服刑十九年後，昨終獲法庭定下確實刑期為三十五年。一直協助這些少年犯的立法會議員梁耀忠認為判刑過重，隨即與張有恆會面商討，以決定是否提出上訴。  張有恆代表大律師曾指，張當年曾表示願意認罪及作控方證人，張的判刑與當年認罪的同案被告尹三龍差別不大，但法官指從當年的審訊文件中沒有關紀錄。法官認為本案是最差的謀殺案，需以三十七年為判刑起點，鑑於張在獄中表現良好，扣減兩年至三十五年。  案件編號：HCMP2184/04
20050416-39,20050416,39,屈臣氏涉侵權遭禁制,屈臣氏涉侵權遭禁制 【本報訊】擁有藥油「香雪精」本港註冊商標的香港聯華藥業有限公司，指控連鎖藥房「屈臣氏」，出售侵犯該商標專利的藥油產品，昨入稟高院申請禁制令，要求禁止「屈臣氏」再侵犯該商標，銷毀所有侵犯商標產品，交代貨源資料及從中所賺利潤。  入稟狀指出，原訴人的代理人曾於去年十一月四日，在答辯人位於灣仔太原街分店，以十元五角買得一支印有與「香雪精」商標相似的藥油。  案件編號：HCA658/05
20050416-40,20050416,40,每六人有一人沉迷色情遊戲港二萬青年打機上癮,每六人有一人沉迷色情遊戲 港二萬青年打機上癮 【本報訊】根據一項調查結果推算，本港有近二萬一千六百名青少年已「打機上癮」，他們平均每周上網打機超過五日、每日逾五小時，主要是打戰爭及賭博遊戲，以及每六人中就有一人在參與色情成份的網上遊戲後成癮。　記者：陸羽平 這些青少年放學後除了吃飯及洗澡外，其餘時間都是用來打機，因而致荒廢學業、身體欠佳、脾氣暴躁、人際關係惡劣。負責是項調查的機構強調，若要預防打機上癮，青少年必須懂得平衡生活模式，家長應為子女提供合適的電腦器材，而政府則應加強監管網吧。  香港基督教服務處去年十月至今年二月，訪問了一千一百八十二名使用互聯網的中一至中五學生。調查發現，百分之五點四的受訪學生出現打機上癮情況，以現時全港中一至中五學生人數約為四十多萬推算，即有二萬一千六百名學生已打機上癮。他們每天上網打機達五點五小時，遠較一般未上癮青少年的二點九六小時為高。 停打機變不安煩躁   此外，受訪學生選擇電腦遊戲的類型多以智力及模擬為主，但色情遊戲最易令他們上癮，每六名玩過電腦色情遊戲的人中即有一人上癮。他們一旦在停止打機後，仍會經常想着遊戲情形，並出現不能自控及停止電腦遊戲活動時會覺得不安、煩躁等。  該服務處專業助理郭毅權稱，本港打機上癮的青少年人數雖然不算太多，但情況值得關注。青少年對性充滿好奇心，惟家長在這方面卻諸多避忌，選擇色情遊戲的青少年初時會選擇如打麻雀除衫的遊戲，隨着刺激度減少，就會變本加厲，透過瀏覽更多色情網頁來增加快感。他憂慮玩色情遊戲上癮的青少年會因而失去自控能力，更有可能在現實生活中付諸實行。     必須懂得自我克制   該服務處屬下「樂Teen會」督導主任葉穎思認為，預防打機上癮，青少年必須懂得自我克制；家長應為子女提供合適的電腦器材；而政府則需加強監管網吧。  此外，該服務處昨日舉行「4.15」話停就停行動日，呼籲青少年應具自控能力，不要沉迷打機，有關活動由立法會議員單仲偕、教統局首席教育主任潘漢雄和政府資訊科技總監辦公室高級系統經理張兆星主禮。
20050416-41,20050416,41,流感潮稍退染病者減少,流感潮稍退染病者減少 【本報訊】本港最近感染流感的人數稍有下降，但衞生防護中心上周仍接獲七宗流感集體爆發的報告，共四十四人染病，其中二十三人需留院治理。 較前周下跌一成八   衞生防護中心公布，七宗流感爆發個案全在本月三日至九日間接獲，包括五間安老院、一間智障人士宿舍及青山醫院。總染病人數共四十四人，包括十二男三十二女，年齡介乎十五至九十四歲。  其中位於屯門的鄰舍輔導會友愛展能中心暨宿舍共有七名院友及一名職員染病，全部毋須送院；青山醫院一個病房則先後有八名女病人出現發燒及感冒症狀。  衞生署的統計資料，上周每一千名向私家醫生求診的病人中，有六十八點五中感染流感，較之前一周下跌一成八；每一千名到政府普通科診所求診的病人中，則有七點一人感染流感，較之前一周微減百分之五。
20050416-42,20050416,42,九鐵擬推出短途月票,九鐵擬推出短途月票 【本報訊】九廣鐵路公司主席田北辰承認，新推出的東鐵及馬鐵月票，首個月只賣出五萬四千張，比原先預計的九萬張為少，相信是由於東鐵較多短途客，九鐵正考慮再推出短途月票，預計數月後有決定。  民建聯立法會議員劉江華及民建聯新界沙田支部昨與田北辰會面，劉江華在會後稱，月票三百元的定價過高，未能惠及沙田區的短程乘客；他們又建議推出售價二百元的短途月票，吸引大學站至大圍站一帶的居民，並要求九鐵繼續提供即日回程八折優惠。
20050416-43,20050416,43,新巴城巴員工加薪2%,新巴城巴員工加薪2% 【本報訊】新巴及城巴工會與資方達成共識，今年加薪百分之二，兩巴五千多個員工每個月最少加一百八十元，加薪追溯至今年一月起生效。     追溯至一月生效   新巴與城巴多個工會昨日分別與管理層展開加薪談判，資方就加薪幅度作出讓步，將加薪幅度由原本的百分之一點五提高至百分之二，或至少每月加一百八十元，以較高者為準，但原本發放的五百元特惠金則取消。  大部份工會均接受加薪方案，但汽車交通運輸業總工會新巴分會主任朱本典表示，他們要求公司除加薪百分之二外，應繼續向每名員工發放五百元特惠金，他們要求與新巴母公司新創建集團主席鄭家純開會。  工會與資方又一度就加薪日期展開爭論，資方提出為了方便參考其他機構的加薪幅度，明年起押後至四月一日起加薪，各工會強烈反對，最後資方再次讓步，同意每年到四月才展開加薪談判，但加薪追溯至一月生效。
20050416-44,20050416,44,警總動員新界多區大舉掃蕩勝和前坐館連同30骨幹被捕,警總動員新界多區大舉掃蕩 勝和前坐館連同30骨幹被捕 【本報訊】警方根據卧底探員的情報，昨凌晨動員有組織罪案及三合會調查科（俗稱「O記」）、毒品調查科及新界北總區、大埔警區反黑組展開瓦解黑幫「和勝和」核心勢力行動，拘捕號稱「土皇帝」的和勝和上任「坐館」白頭仔，及其麾下逾三十名得力助手及幫中骨幹，其中包括一隊以中學生為主力組成的和勝和「行動組」。警方消息透露，行動將持續三日進行，尚餘的拘捕目標高達六、七十人。　記者：林榮海 消息稱，警方今次行動主要針對和勝和上任坐館白頭仔在新界區的龐大勢力。較早前，警方接到長期潛伏在和勝和卧底探員情報，掌握上水、大埔及葵青區多股和勝和勢力的最新活動，當中包括該黑幫在新界區的紅油、私煙、翻版光碟及毒品的主要基地，於是部署今次行動。  參與今次行動的除包括O記及新界北總區和大埔警區反黑組外，尚有毒品調查科及海關人員。昨凌晨時分，大批O記探員首先在上水區大規模圍捕目標人物，結果先後拘捕白頭仔，及其二十餘名得力手下及骨幹成員。  至昨天下午，O記聯同海關及元朗警區人員，先後在元朗及荃灣搗破多個由和勝和控制紅油站，拘捕一批黑幫成員。     招學生入「行動組」   與此同時，新界北及大埔警區反黑組則在大埔區掃蕩區內的和勝和勢力，拘捕六名懷疑是和勝和行動組的成員。警方消息稱，上月十日，活躍港島區的黑幫和合圖，在黑幫新義安的協助下，於大埔廣福邨附近開設一條由大埔往荃灣的公共小巴線，該線共有十輛小巴及二十三名司機，每日利潤達六萬元。和勝和聞悉後，要求與和合圖「五五分帳」共同經營小巴線，但被拒絕。和勝和稍後部署報復行動。  消息稱，白頭仔的兩名頭馬「鬈毛強」及「馬騮」，在大陸遙控指揮一隊由幫中黑學生為主力組成的行動組，在廣福邨執行伏擊小巴的行動。該隊行動組的兩名均姓黃，分別十九及十六歲的小頭目，隨即與另外八名成員，連續兩晚在小巴站頭埋伏，用石塊襲擊埋站小巴。 未來兩天持續打擊   本月十三日，大埔警區反黑組在小巴站頭附近埋伏，拘捕該對姓黃的小頭目及另外兩人，並追緝另外六名黨羽。直至昨晚八時許，反黑組探員接獲線報，獲悉另外六人在區內一家遊戲機中心集合，於是掩至上址，將他們一網成擒，據悉，被捕男子中大部份為學生。  至昨晚，大批探員再度掩至上水區及葵青區，追捕另一批和勝和的骨幹成員。根據警方所掌握的資料，至少尚有六、七十名活躍的和勝和成員，被警方列為拘捕目標。警方的行動將在未來兩天持續進行。
20050416-45,20050416,45,被拖行15米　成功拔車匙警勇擒驅車吸毒男子,被拖行15米　成功拔車匙 警勇擒驅車吸毒男子 【本報訊】一名「蠱惑」癮君子近期兩度在公眾場所吸毒被捕後，昨晨駕車往隱蔽偏僻的飛鵝山吸毒，以為神不知鬼不覺，但再度遭巡警撞破，他無視警員截查企圖開車逃走。一名警員奮不顧身抓住車邊，遭拖行十五米後成功拔去車匙，與在場同袍合力將疑人制服。警方在車內搜出美沙酮、毒品及吸毒工具，事件中有兩名警員受傷送院。　記者：黃曄寧 被捕男子姓林（四十歲），涉嫌襲警、藏毒及藏有吸毒工具被扣查。據悉疑人近日曾兩度在黃大仙區公眾場所吸毒被捕，目前仍在保釋中，疑他為避警方耳目，故意驅車往人迹罕至的山頭吸毒，惟終難逃法網。     在飛鵝山道撞破   至於兩名受傷警員約三十歲，隸屬東九龍衝鋒隊，其中遭車拖行的警員額頭及雙腳受傷；另一警員與疑人糾纏間亦手腳擦傷，兩人經治理無礙。  昨凌晨四時許，衝鋒隊警車在飛鵝山道進行反罪惡巡邏，至百花林對開二百米時，見一輛車停在路邊凹位，車窗開啟男司機似在吞雲吐霧。  警員上前截查時，發現司機正以膠樽飲品自製工具吸食冰狀毒品，神態模糊問非所答，警員表露身份作出警告後，有人竟開動引擎加速逃走，但疑人反應遲鈍車速不快，一名警員奮力抓住車窗，遭車拖行奔跑十五米後，成功將車匙拔去。  私家車停下後，疑人發狂反抗與警員角力，數名警員立即上前協助，各人合力把疑人制服，以手銬將他雙手反鎖後押上警車。     車上撿吸毒工具   警方事後在車上撿獲美沙酮、小量冰毒、懷疑可卡因粉末及吸毒工具，並將之帶走化驗。
