key,date,article_daily_id,title,text
20051210-0,20051210,0,家人盡最後心意擬撮合殉愛小情侶　冥婚合葬,家人盡最後心意 擬撮合殉愛小情侶　冥婚合葬 【本報訊】「儘管佢哋選擇嘅路係錯，但亦希望佢哋喺另一個世界可以一齊生活……」一對年僅十六、七歲的小情侶前日在大埔相擁跳樓自殺殉愛，雙方家人昨日懷着沉痛的心情到殮房辦理認屍手續，他們都希望能夠盡最後心意，達成兩人共同生活的意願，考慮撮合兩人，為他們舉行「冥婚」，並合葬在一起。　記者：周志鴻、吳淑義 對於因女死者懷有身孕，兩人無法面對此煩惱而尋死，男死者母親慨歎：「如果一早知道這事，問題就容易解決啦……怪就只怪兒子愛得太癡！」  十六歲男死者易俊榮與十七歲的女死者余詩嘉，同在大埔卍慈中學就讀中五，自中一便是同學關係，兩年前開始成為情侶。患有癌病的易母，目前正接受化療，身體很差，昨晨她拄着柺杖在家人的攙扶下，到沙田富山殮房認屍。她含悲帶淚地說，她有三女一子，俊榮是家中幼子，也是獨子，讀書亦是姊弟中最叻的，全家人都十分疼惜他。 母：只怪兒子愛得太癡 篤信佛教的易母昨日十分傷心但也很平靜，她說：「噚晚（前晚）我通宵念《大愛無限》經文，希望減輕兒子嘅罪孽，早登極樂，下一世做一個腦筋清晰嘅人。」易母表示，兒子曾經帶過女朋友詩嘉回家，她知道詩嘉家庭背景很複雜，家中管教也很嚴，形成詩嘉經常表現得很失落和情緒化。  對於有傳詩嘉已懷孕，易母表示並不知情：「如果一早知道，問題就容易解決啦，最多咪停學一年……」她說，他們母子關係一向很好，好像朋友般無事不談，可是今次兒子卻完全沒有向她透露過有甚麼問題。」易母慨歎：「怪就只怪兒子愛得太癡！」  易母表示，她是兒子學校的「家長及教師會」成員，原本兒子今日需要回校上台領取「中英數成績優異獎」，現在她也不準備出席代領；不過，易母謂下周會與校方聯絡，希望可以向全校學生講幾句說話，告誡青少年遇到問題，應多與父母溝通，尋求協助。她說：「父母一定會支持子女的，即使父母解決不了，總有辦法解決的。」  易母昨日在殮房認屍的時候，身體很不舒服，三女兒一直在旁侍候，不時替母親掃背。在母親面前她強忍眼淚，其後表示，不想令老人家太傷心，事實上她昨日亦哭了一夜，一雙眼睛亦哭得通紅。她說和弟弟的感情十分要好，但事發前卻沒有發現弟弟有何異樣。  另一方面，詩嘉的生父、養母、阿姨和親友十多人，昨日下午三時許，帶同一名道士返回大埔富亨邨亨榮樓一樓平台兩人跳樓現場進行路祭。各人在道士帶領下焚燒冥鏹，進行招魂儀式，並傷心地叫喚：「嘉嘉，返嚟呀……」儀式為時約四十分鐘。  據詩嘉的阿姨莫太表示，詩嘉雖然自小被生母遺棄，父親無力照顧將她交託人家撫養，詩嘉的養母待她有如己出，親友們也對詩嘉很愛護。 盼其他年輕人引以為戒 不過，莫太也說，可能詩嘉的成長背景比較複雜，有被遺棄的感覺，認為這是她生命中一個遺憾，所以詩嘉很怕被人看不起，因此對自己的要求很高，特別在學業方面。最近一次詩嘉考試名列第三，雖然亦可以獲得獎學金，但她曾向生父表示自己退步，需要加倍努力。當時父親已勸她不要給自己太大壓力。  莫太說，詩嘉今次選擇的路是錯的，希望其他年輕人引以為戒。她謂希望他們在另一個世界可以一齊生活，所以聯絡男方的家人商討為他們舉行冥婚及合葬的儀式，據知男方家人亦同意，但因為男死者的母親身體不適，有關的細節稍後再商討。
20051210-1,20051210,1,今日黃絲帶行動爭普選,今日黃絲帶行動爭普選 【本報訊】民陣及民主派繼12.4大遊行後，將於今日國際人權日發起「黃絲帶行動」，爭取人權及全面普選，民主派十多名立法會議員昨舉行記者會（圖），每人均戴上黃絲帶。民主黨立法會議員張文光說，今次集會及遊行活動會在今午三時開始，他們會將象徵人權的黃絲帶，綁在總部外圍的鐵欄上，另一名負責今次行動的民主派立法會議員郭家麒預計，將會有一千人參加行動。
20051210-2,20051210,2,程翔遭延長扣押三個月,程翔遭延長扣押三個月 【本報訊】被指為替台灣當間諜的傳媒工作者程翔，已被扣押超過七個月。法新社昨晚引述消息指出，鑑於事件複雜，內地再度延長扣押程翔三個月，並已知會聘請程翔的新加坡《海峽時報》。 團體促盡快放人 程翔事件關注組發言人昨證實，內地自上月六日起延長扣押程翔，自四月至今已經有七個多月。換言之，內地再度延期扣押三個月，最新扣押期限至明年二月初始屆滿。發言人認為，若內地沒有足夠證據作出起訴，應盡快釋放程翔。關注組連同記者協會、港大學生會及港大畢業同學會，稍後會將在十二月四日收集到的一萬零二百九十六個簽名，透過港府或中聯辦轉交北京。  按照內地法規，檢察當局在拘押程翔的兩個月內必須起訴，不過程翔拘押期滿後，當局已兩度延長扣押日期。  保安局發言人昨晚表示，港府非常關注程的個案，會繼續與內地當局聯絡，把任何最新消息通報家屬，但港府不會透露個別個案詳情。
20051210-3,20051210,3,湯家驊：北京強硬時間表無望,湯家驊：北京強硬時間表無望 【本報訊】政府利用民意迫民主派支持政改方案，一直對爭取普選時間表抱有希望的45條關注組立會議員湯家驊透露，他近日從有關渠道了解，北京在12.4二十五萬人上街後，對普選時間表的態度變得強硬。他對立法會表決政改方案前，中央提出普選時間表已不存希望，但他堅持民主派不應因民調結果，或一些眼前政治利益轉軚支持政府。就算方案被否決，未來一、兩年仍要繼續向中央及特區政府，爭取落實普選時間。  二十五萬人上街發出普選訴求後，港府仍然堅拒在普選時間表問題上讓步。湯家驊昨日接受訪問時透露，日前從一些渠道得悉，12.4大遊行後，中央對普選時間表的態度明顯變得強硬，由之前持開放態度，轉為強調已將政改問題交由特首曾蔭權處理。若曾不允落實普選時間，中央會支持其決定。 不因眼前政治利益轉軚 湯家驊說，由於中央態度忽然轉趨強硬，他現在已不會再對普選時間表存有任何希望。不過，就算政改方案遭否決，憲制上並無限制特首再向中央提交新方案，故他認為公眾及民主派應該在方案否決後，繼續向中央及特區政府爭取落實普選時間表，民主派也不應因民調結果，或現方案中一些眼前政治利益，改變立場支持政府。他說：「我哋唔應該淨係睇眼前都未知係唔係嘅政治利益，應該睇長遠。」他已為否決方案做好準備。  民主黨政制事務發言人楊森也表明，民主黨不會支持沒有普選時間表的政改方案。他認為12.4大遊行後，支持政改的市民開始減少，他相信距離立法會表決政改方案的日子愈近，支持方案的人數會再減少。他又強調，若政改方案最終不獲通過，責任也不在民主派，因為政制改革是港府與中央政府的責任，民主派無法改變政府決議案，也不能自行提出普選時間表決議案。  不過，曾經指中央願意研究二○一七年落實普選的民主黨立法會議員涂謹申表示，直到現時為止，他對普選時間表仍抱一點點希望。
20051210-4,20051210,4,議員促即辭德銀　領匯董事會力撐立法會擬迫鄭明訓解畫,議員促即辭德銀　領匯董事會力撐 立法會擬迫鄭明訓解畫 【本報訊】領匯雖然成功上市，股價更節節上升，但負面消息仍不斷傳出。立法會財經事務委員會將於下周初召開特別會議，討論領匯主席鄭明訓涉嫌漏報擔任德意志銀行顧問事件。委員會副主席湯家驊要求當局澄清鄭有無利益衝突，成員鄭經翰認為鄭明訓的獨立性已出問題，應立即辭去德銀顧問職務，監察領匯團體更表示要研究透過法律途徑控告領匯。　記者：莊曉陽 不過，領匯董事會力撐鄭明訓。董事會昨日開會討論事件，發言人於會後表示，董事會認為主席鄭明訓獨立，可以繼續出任領匯主席，因為根據《房地產投資信託基金守則》，持股不足一成的德意志銀行不是領匯的重要持股人，鄭明訓只是德銀亞太區委員會資深顧問，職位不涉及行政，所以無損鄭明訓的獨立性。  德銀是目前領匯主要股東之一，持有領匯約百分之五點五的基金單位。接近政府消息人士則表示，鄭明訓是否辭職，應該由他自己衡量，相信大眾自有公論。 反領匯團體研究入稟 另外，反對領匯上市的團體領匯監察，昨天到領匯總部抗議，要求鄭明訓立即下台。發言人陶君行表示，領匯招股書從未披露，鄭明訓擔任德銀顧問一事，這有損投資者的知情權，他們會研究是否透過法律途徑入稟控告領匯。  立法會昨天舉行的內務委員會上，多名議員支持召開特別會議，討論近日涉及領匯的連串事件。財經事務委員會主席陳智思表示，目前仍等秘書處排期召開會議，下周二或三都可以開會。成員涂謹申則指，立法會應邀請鄭明訓出席解畫，站在領匯股東的利益，鄭明訓也應該來立法會澄清所有問題。 恐大鱷迫董事會加租 45條關注組議員吳靄儀表示，由基金持有大部份領匯的問題有迫切性討論，政府不能不聞不問，早些討論可以及早行動。鄭經翰則指出，領匯上市後已成為「大鱷」吸納的目標，超過八成股份由機構投資者及對沖基金持有，他們隨時串連向領匯董事會施壓，要求大幅加租及把商場拆骨，便會大大影響商戶及公屋居民利益。鄭又要求，鄭明訓立即辭去德銀顧問一職。  不過，湯家驊及涂謹申都指，目前仍未能斷定鄭明訓是否一定要辭職。  涂謹申稱，他已再去信領匯要求進一步澄清，若鄭明訓只擔任與財務無關的顧問，就應該沒有問題，否則鄭明訓就「死梗」。  前綫召集人劉慧卿則去信房屋及規劃地政局局長孫明揚，要求當局交代鄭明訓是否需要辭去其中一職。
20051210-5,20051210,5,領匯股價再創新高,領匯股價再創新高 【本報訊】雖然領匯房產基金爆出主席鄭明訓並無申報身兼德意志銀行資深顧問身份，可能引發一場政治風波，但領匯股價並無受到影響，反而連升三日，昨日更創出收市價新高，收報十四點零五元，升零點三元，散戶若仍持有，帳面已賺了四成四。  投資界人士指出，現時主要是基金吸納散戶手上的股票，若他們集合起來持股六至七成，將有實力提出更換管理層。 基金持股七成可左右運作 亨達投資聯席董事黃敏碩表示，鄭明訓事件令整體市場的訊息披露水平打了折扣，因為現時連一個分析員也要應證監會要求申報利益；但他相信事件對領匯股價的影響不大，因為近期市況對房地產信託投資基金趨之若鶩，加上市況氣氛較佳，以及前日加入成為大摩MSCI香港指數成份股，對股價有推動作用。他認為，投資者不會將鄭明訓事件效應放大。  信誠證券聯席董事連敬涵指出，鄭明訓事件對領匯股價並無影響，近期主要是基金向散戶收貨，帶動領匯股價節節上升，現時市場關注有多少領匯基金單位流入大型基金公司手中。若大部份散戶的股票被吸去，令大型基金合計持有領匯六至七成，將會影響領匯未來走勢，他們也有實力提出重大決議案，影響領匯運作。但他相信大部份基金投資領匯都只是為了投機賺錢，未必有意接管該公司。
20051210-6,20051210,6,前立法局議員獲中英港信任,前立法局議員獲中英港信任 鄭明訓除了出任領匯主席，以及德意志銀行亞太區資深顧問，現時亦為上市公司思捷環球及建滔化工獨立非執行董事，也是馬會董事。鄭明訓一直活躍於政界及商界，並同時獲得中方、英資及港府信任。  鄭明訓曾出任英之傑太平洋有限公司主席，八七年成為香港美國商會首位華人會長。九二至九四年他出任香港總商會主席，九五年透過總商會功能組別晉身為立法局議員，並獲中央政府委任為特區籌備委員會成員，是籌委會中唯一有外資背景的成員，九七年過渡後曾任臨時立法會議員。  現年六十九歲的鄭明訓，在內地出生，香港長大，祖父是「香港淘化大同」創辦人。鄭明訓早年負笈美國，曾先後在美國伊利諾斯州森林湖學院取得文學士學位，及後獲美國賓夕凡尼亞大學華頓商學院頒授工商管理碩士學位。  鄭明訓現也是香港中文大學校董，又在中大及香港科技大學兼任教授。  本報記者
20051210-7,20051210,7,撞車洩危險氣體元朗大塞車,撞車洩危險氣體元朗大塞車 【本報訊】元朗新田公路昨晨發生車禍，一輛載滿危險品的貨車在行駛途中失事，猛撼切線駛入的吊臂車車尾。貨車車頭凹陷司機被困車內，其中一支屬第二類危險品的氬氣在撞擊中洩漏氣體。消防員接報趕至爭分奪秒，一方面拯救傷者，一方面將氣體搬落車射水戒備，耗費近一小時全部清理妥當，未有釀成爆炸。  遇車禍的司機姓關，二十五歲，送院治理後情況穩定。他駕駛的五點五噸貨車領有運載危險品的牌照，事發時運載的壓縮氣體包括十支風煤樽、十八支氧氣、一支氮氣及一支氬氣，大部份為空載。 消防射水戒備 昨日上午十一時許，關駕駛運載危險品的貨車沿新田公路快線往上水，駛近落馬洲迴旋處時鄰線一輛吊臂車突然切線駛入，關收掣不及猛撼對方車尾。  貨車車頭凹陷，關被夾住動彈不得，由其他駕駛者代為報警。 司機被困車內 消防員接報趕至，用工具拯救被困傷者；與此同時，車上一支氬氣洩漏氣體，雖然氬氣屬於穩定性高的壓縮氣體，爆炸機會極低，但為防萬一，消防員小心翼翼將它搬落車，並向它射水戒備，稍後再逐一將其他氣體也搬下。  車禍期間現場交通大受阻塞，車龍延綿數公里；警方事後通知有關公司到場清理該些危險品。  資料顯示，氬氣在空氣中含量佔第三位，它無色、無臭、無味，不可燃亦不助燃，屬惰性氣體，無論在室溫或高溫下都不易發生反應，但它仍有一定用途，例如用來燒焊切割玻璃燈泡、在焊接金屬時使用氬氣可防止金屬與氧反應。
20051210-8,20051210,8,婦洗廁所卡住頭一小時,婦洗廁所卡住頭一小時 【本報訊】荃灣海濱花園海暉閣昨晚發生驚險意外，一名七十八歲老婦在廁所大掃除時，頭部卡於坐廁水箱與洗手盆之間約五吋罅隙，動彈不得，八十五歲丈夫欲救無從，一小時後才致電報警。消防員到場取肥皂液當潤滑劑塗於老婦頭髮，輕易將她救出，化險為夷。 肥皂液當潤滑劑救出 遇險老婦姓溫，事件中雙耳夾至紅腫發痛，她獲救後仍然驚魂未定，由救護員送院時一臉驚惶。兒子稍後回家發現母親遇上意外，憂心不已。  據知七十八歲溫婆婆與八十五歲姓黃丈夫居於海濱花園海暉閣四樓，昨午四時許，溫婆婆在家中大掃除，她首先清洗廁所，其間她蹲在地上，探身拭抹坐廁後面位置。至下午約五時，溫婆婆嘗試站起身，可是頭部卻卡在坐廁水箱與洗手盆約五吋罅隙之間，無法動彈。  現場消息稱，溫婆婆多番嘗試把頭退出不果，掙扎之下反而把頭部愈夾愈緊，其夫聽到溫婆婆呼救聲前來相助，可是溫婆婆當時夾於罅隙內，他亦不敢輕舉妄動。  溫婆婆繼續嘗試自救，可是整整一小時仍是無法脫困，此時其夫發現老妻被困已經一小時，擔心頭部受傷，決定報警求救。消防員及警員接報到場救援，消防員小心視察情況後，發現溫婆婆只是頭部被卡並無受傷，加上她被困多時，決定取來肥皂液當作潤滑劑塗於溫婆婆頭髮上，然後慢慢移動溫婆婆身軀，隨即將她救出。救護員檢查發現溫婆婆並無表面傷痕，但雙耳則夾至大片紅腫，為安全起見，將她送院檢查。
20051210-9,20051210,9,青嶼幹線10條隧道車速限制補刊憲,青嶼幹線10條隧道車速限制補刊憲 【本報訊】一名在青嶼幹線超速駕駛的司機去年以車速限制未刊憲為理由而成功脫罪，暴露了青嶼幹線及十條行車隧道車速限制的法律漏洞，運輸署昨日終於將車速限制重新刊憲「補鑊」，但之前被控超速的司機不會獲撤銷告票及退回罰款。法律學者認為，政府有錯失，但現時已過了司機可以上訴的時間。  環境運輸及工務局發言人表示，《道路交通條例》第四十條規定高於時速五十公里的車速限制均須刊登憲報，自去年九月高院就一宗青嶼幹線的超速個案作出判決後，當局就青嶼幹線及各行車隧道的車速限制問題進行了全面研究，結果認為將有關路段的車速限制刊憲，有助警方有效地執法。  至於在青嶼幹線及各隧道超速被控的司機會否獲退回罰款，發言人指出，就算某些地區的車速限制未曾刊憲，據《道路交通條例》，未有刊憲限制更高車速的道路，都有時速五十公里的車速限制，故被控的司機仍屬超速。 被抄牌上訴有時限 青嶼幹線、三條過海隧道、五條政府隧道、及大老山與大欖兩條私營隧道的車速限制昨日正式刊憲，即日由上午十時起生效，警方可以合法地檢控超速司機。  但香港大學法律學院助理教授張達明認為，警方過去在青嶼幹線檢控超過七十公里車速限制的司機，是沒有法律基礎，理論上被控的司機都可以上訴，但去年判決至今已超過一年，已過了合理的訴訟時間。
20051210-10,20051210,10,上班施襲　揚言淋鏹　認罪待判示愛被拒失婚婦毆女友,上班施襲　揚言淋鏹　認罪待判 示愛被拒失婚婦毆女友 【本報訊】獨力養育兒子的五十歲失婚婦人，疑對年輕八載的閨中同性密友產生愛慕之情，向對方示愛被拒後，因一時衝動，趁她上班途中，向她淋潑機油，並揮拳施襲，更揚言下次會淋鏹水，幸得一名貨車司機制止及報警。婦人昨在沙田裁判法院承認一項襲擊傷人罪名，案件押後至明年一月五日，等候精神及感化官報告判刑，其間被告獲准以二千元保釋。　記者：陳美琪 五十歲的被告黃文愛，報稱任職清潔工人，被控一項襲擊致造成身體傷害罪名，控罪指被告於今年十月十四日期間，在沙田禾香街二至十號沙田冷倉門外，襲擊女子周小嫦，對她造成身體傷害。 揮拳打頭及身體 控方案情透露，被告與四十二歲的受害人是舊同事兼朋友，案發當日上午八時許，受害人在上班途中經過火炭上址，被告突然從後走近受害人，並將機器用的潤滑劑淋潑在她的身上，她轉身看到被告手持一個塑膠瓶，被告對她說：「這次是機油，但下次將會是鏹水。」受害人立即逃跑，但經過一番追截，被告終捉住她，揮拳擊打她的頭部及身體，一名貨車司機剛在附近泊車，他目睹事件後即制止被告，及在受害人要求下報警。  警方接報到達現場，將被告拘捕，她在警誡下，承認因感情問題，曾以拳頭毆打受害人。其後，被告與受害人被送往沙田威爾斯親王醫院檢驗，醫生證實被告並無表面傷痕，受害人則左眼擦傷。 離婚20年甚寂寥 控方庭外表示，被告是一間清潔公司的員工，工作時會使用機油，案發時機油大部份只觸及受害人的頭髮及額頭，被告與受害人感情要好。  辯方在求情時指，被告並無犯案紀錄，她離婚近二十年，獨力撫養兒子，感到十分寂寥，她承認對受害人存有愛意，但只是一廂情願，受害人已有家室，並已拒絕接受她的愛意，被告因一時衝動犯案，現已深感悔意，希望法庭輕判。  案件編號：ST12858/05
20051210-11,20051210,11,冥婚分三種不具法律效力,冥婚分三種不具法律效力 所謂冥婚，是替去世的人舉行的婚禮，一般共分三種，一是兩名於同一意外或事故中死去男女的結合；二是生人與死去愛人的結合；三是兩名互不相識、於不同時間死去男女因家人撮合在陰間成婚，華人社會舉辦冥婚儀式並不罕見。  不過有玄學界人士稱冥婚不宜鼓勵，因為據佛教教義，人死後應放下世間萬念才能輪迴轉世，在生者舉辦冥婚可能有礙死者解脫。法律界人士亦指，結婚儀式須經新郎、新娘宣誓才具法律效力，冥婚儀式中新郎或新娘並無宣誓，因此冥婚不具法律效力。
20051210-12,20051210,12,跌出巴士男乘客情況嚴重,跌出巴士男乘客情況嚴重 【本報訊】前晚十時許在慈雲山乘搭巴士期間，因巴士車門突然打開跌出車外重傷五十八歲張姓男乘客，現時仍留醫治理，情況嚴重。九巴發言人形容事件十分罕見，並表示公司會協助警方調查意外原因，而肇事車長現暫停駕駛工作，等候警方調查；同時公司已聯絡傷者親人及慰問。  九巴發言人表示，今次意外十分罕見，前晚肇事行走北慈雲山至長沙灣的2F線雙層巴士，為奧林比安（Olympian）型號十一米長，並非空調巴士，車齡十二年，對上一次檢查為上月十七日，並無問題，現時該車在何文田汽車扣留中心等候檢驗；而意外中姓袁（四十五歲）車長，於二○○○年入職，一直駕駛2F路線並無發生意外，意外發生後他已暫停駕駛，等候警方調查報告。另外，車禍後，公司已聯絡傷者的親人及表示慰問，同時向其親人解釋有關賠償問題，但暫時未接獲其親人索償要求。
20051210-13,20051210,13,一哥探望打氣　祝願早日康復遭匪劏肚失血三公升勇警脫險,一哥探望打氣　祝願早日康復 遭匪劏肚失血三公升勇警脫險 【本報訊】前晚在美孚地鐵站擒賊時遭悍匪劏肚重創休班警唐尹超，醫生替他施手術切除部份壞死腸臟，手術中事主共失去三公升血液死過翻生，其父母得悉兒子暫無生命危險頓時鬆一口氣。昨午警務處處長「一哥」李明逵亦前來醫院探望打氣，祝願受傷警早日康復。 以為腹中拳 擒賊受傷警員唐尹超（二十四歲），現時情況嚴重留醫。據知他未婚，加入警隊五年，現時駐守牛頭角警署軍裝巡邏第三小隊，之前曾在機動部隊服役。涉案被捕越南男子昨仍被深水埗警區重案組探員通宵扣查。  唐尹超經醫生搶救後昨晨曾經甦醒，他醒來後曾向家人同袍講述事發經過。據他透露前晚他當通宵班（俗稱夜尾），當晚九時許他與友人在長沙灣區打球後，獨自到美孚地鐵站乘地鐵上班，期間他看見一名男子在地鐵站慌張奔跑，身後則有兩名軍裝警員啣尾追捕。  由於當時疑人手中並無利器，他嘗試攔阻疑人去路，豈料混亂中疑人突然取出利刀朝他腹部刺去，他即時感到一陣劇痛，當時還以為是腹部中拳，豈料稍後才知是腹部中刀如同劏肚般劃破一個傷口，鮮血泊泊流出，腸臟更是外溢。  昨午四時，警務處處長「一哥」李明逵由西九龍總區指揮官盧奕基陪同，抵達瑪嘉烈醫院探望唐尹超，「一哥」攜來一個生果籃送予唐的雙親並慰問，隨即換上防護衣進入深切治療部探望死過翻生的唐尹超，親自給他打氣鼓勵。一哥逗留二十分鐘後離去，稍後不少同袍相繼前來探望。
20051210-14,20051210,14,少女抖「空竹」,少女抖「空竹」 四位女娃娃在尖沙嘴商場表演傳統雜技「空竹」，各人手執一根繩子，把漏斗狀的竹筒隨意轉動，配合優美的步姿，吸引途人駐足觀賞，讚歎不已。  她們是索拉奇藝坊的中國年輕成員，隨同雜技團來港公演《奇幻之旅》，昨日則抽空在海港城獻技，與眾同樂。《奇幻之旅》最後一場告別演出，將定於下周五晚上公演，現尚餘小量最佳位置門券公開發售。	  謝榮耀攝
