key,date,article_daily_id,title,text
20051210-139,20051210,139,婦孺跪求領屍汕尾開槍鎮壓　村民向胡溫呼救,婦孺跪求領屍 汕尾開槍鎮壓　村民向胡溫呼救 發生開槍鎮壓請願村民的汕尾市東洲鎮死亡數字成謎，村民表示遇害人數近二十人，但至今只領回兩具屍體，昨日有數十名懷疑家人遇害的婦孺在村口跪地哀求領回親人屍體。有村民表示聽聞有人在製造假證據，擔心當局將鎮壓事件的責任推在村民身上。另外，也有村民據報冒險向外發出求救信，希望國家主席胡錦濤、總理溫家寶施以援手。 「她們連家人屍體都看不到，都在村口跪着，哀求領回屍體，許多女人在哭，但都沒人理會。」據東洲鎮村民表示，昨日有數十名懷疑家人遇害的家屬，全身白色素服跪在村口，要求當局解釋為何開槍，並要求領回屍體。村民指出，在開槍鎮壓事件後，有二十多名東洲鎮村民失蹤，部份懷疑遇害，「他們如果逃出村外不會幾天都沒有消息的。」該名村民補充說。 鎮壓請願　死亡人數成謎 據村民反映，事發本月六日晚，先是當局下令向村民放催淚彈，因此激發部份村民向發電站方向投擲土製燃燒物，但他強調這些燃燒物不會致命。擔心當局將以此作為開槍鎮壓的藉口，將全部責任歸咎於村民。  東洲鎮昨日氣氛仍十分緊張，全鎮附近集結過千警力，除了各處出入口被公安封鎖外，鎮內還有數百名全副武裝的防暴警察候命。當局又在鎮內張貼通緝令，追捕三名被指帶頭滋事的村代表。三人均為四十多歲的男村民，其中兩人姓黃，一人姓林。村民表示，當局聲言將要入村搜屋，拘捕涉嫌帶頭的村代表及數百名在六日晚「鬧事」的村民。當局又多次警告村民若集結反抗，將再採取六日晚的鎮壓行動。 數百警察進駐　隔絕交通 據東洲鎮陳姓村民表示，開槍鎮壓的武警和公安已全被換走，新調來的防暴警察不停在鎮內巡邏，許多男村民不敢外出，部份逃出鎮外的村民則不敢回家。  該村民又表示，由於東洲鎮與外界連接的大小路口均有身穿制服的公安設置關卡，村民害怕當局秋後算帳但根本無法逃出去。  據悉，東洲鎮與外連接的小路口至少有三、四個公安把守，大路口則有十多人看守，出入車輛和人均要受檢查。有香港記者未入鎮就被公安截獲。  本報記者/「大紀元」網站
20051210-140,20051210,140,當局秋後算帳　村民人心惶惶,當局秋後算帳　村民人心惶惶 「我哋犯咗乜嘢事，（公安武警）要開槍對待，咁大個人冇諗過咁得人驚。老一輩村民舊時就話驚死喺日本仔槍下，估唔到𠵱家佢哋會向自己人開槍。」 催淚彈刺激眼通紅 東洲鎮一名陳姓村婦昨日透過香港親友向傳媒求助，她表示當局開始秋後算帳，四處搜捕村民，不但村內人心惶惶，而在外打工的男村民連回家也不敢。  據陳女士表示，當局在六日晚九時許開槍鎮壓，她在家也聽到槍聲，「有的連續十多響。聽村民回來說開槍的有武警，也有公安。」她表示，三名家人當時也在示威人群中，逃回家時雙眼都因受催淚彈刺激變得通紅。  另一名東洲鎮村民阿杜表示，官方至今表示只有三人死亡，但村民則估計有近二十人死，他表示，在六日晚發生開槍鎮壓事件後，他趕到鎮人民醫院，見到兩名被槍殺的村民中，有一人是他認識的姓江村民，年約三十多歲，送院醫生已宣布他已經死亡，而另一名二十多歲的青年則送院後不治。 外出村民不敢回家 他表示，事發當晚在鎮內並沒有參加請願，但他認為當局無論如何也沒有理由開槍鎮壓。他說：「我現在在外打工，聽村民說警察在到處抓人，我也不敢回家。」  本報記者
20051210-141,20051210,141,兩煞潛女生宿舍姦淫11人,兩煞潛女生宿舍姦淫11人 陝西黃陵縣一間學校發生駭人輪姦案：兩名歹徒深夜酒後摸黑潛入女生宿舍，四小時內在床鋪間來回穿梭，輪姦及猥褻十一名年僅十多歲的女生。其間，受害女生無人敢高呼求救。 無人敢呼救 事發於今年三月二十四日晚，黃陵縣兩名外來工趙志龍、範長江疑酒後亂性，摸黑潛入當地一間中學的女生宿舍，向一群正在熟睡的十多歲女生施暴。兩人猖狂至極，從深夜將近十二時到次日凌晨四時許，在女生的床鋪間穿梭，輪姦及猥褻了十一名女生。  其中一名疑犯被捕後憶述說：「我叫她們脫衣服，她們不脫，我就用拳頭在她們臉上打，掐她們的脖子，咬她們。」據悉，疑犯企圖向一名女生施暴時，被對方用腳踹了一下，他愣了一會兒，隨即走開了。兩名疑犯事後很快被公安拘捕，上周一被押送上法庭受審，將於近日判刑。 近日將宣判 案發後，黃陵縣的學校並未加強學生防範性侵犯的教育，一所小學的副校長無奈地說：「在我們這麼偏僻的地方，老師們都是談性色變，哪裏還談得上給學生們教授如何保護這方面的方法。」  《法制日報》
20051210-142,20051210,142,礦難死亡人數增至87,礦難死亡人數增至87 周三所發生的河北唐山劉官屯礦難，至昨午死亡人數已增至八十七人，目前尚有二十一人失蹤。由於現場的一氧化碳等有害氣體仍然超標，阻礙救援工作，被困礦工恐怕已無生還機會。  另外，吉林省長春市雙陽區長嶺煤礦前日發生滲水事故，當時共有七名礦工井底工作。除一名僅受輕傷的礦工獲救外，其餘人等均被困，生死未卜。 三處意外69礦工仍失蹤 當局事後共調動一百條抽水管，不斷將井下的積水抽走，目前救援工作仍在進行中。  至於上周五河南省洛陽市新安縣石寺鎮寺溝煤礦所發生的滲水事故，井下被困的四十二名礦工至今仍下落不明。  國家安監總局昨日指，出事的礦井目前仍滲水，但未有交代搜救人員有否發現生還者。  新華社/法新社
20051210-143,20051210,143,北京民工時薪7毫,北京民工時薪7毫 北京十四名外來民工，為當地一家電訊公司挖路布設電纜，雖然判頭承諾每人日薪四十多元，但他們每天工作十二小時，部份人到頭來只取得相當於一天不足八元的薪金，時薪不足七毛錢，部份人甚至連一毛錢也拿不到。  「我們睡覺的地方比馬路上還冷。」該批民工完成有關工程已有五、六天，因沒有旅費回鄉，只能在宣武區廣義街北口一處用塑膠布及舊木板搭建的簡陋小屋內暫時居住。  當地近日氣溫驟降，令他們冷得如同被「雪進」冰窖一樣，部份裹着被子哭泣。  《新京報》
20051210-144,20051210,144,老妻少夫　恩愛15年,老妻少夫　恩愛15年 重慶合川古樓鎮檔子村有一個幸福小家庭，丈夫是四十五歲的謝永全，妻子是七十三歲的雷星玉，雖然夫婦二人年齡相差二十八歲，但結婚十五年仍恩愛非常，還共同養育十三歲的養女謝安勤。  《重慶時報》
20051210-145,20051210,145,李肇星批小泉傲慢,李肇星批小泉傲慢 正在馬來西亞訪問的中國外長李肇星昨日譴責日本首相小泉純一郎，堅持前往靖國神社參拜，是自大傲慢的表現，這個錯誤必須糾正。馬來西亞外長哈米德昨日則罕有地就當前的中日關係發言，表示日本必須盡力改善與中國的關係。  美聯社
20051210-146,20051210,146,女生捐器官救七人,女生捐器官救七人 台灣高雄市一名十三歲胡姓女學生今年十月遇上車禍不幸身亡，經父母同意，捐出心臟、肝臟、眼角膜、腎臟等器官，遺愛人間，令七名病人重生。  除兩位肝臟受贈者尚未出院，其餘五人都恢復後出院。  中央社
20051210-147,20051210,147,部份即食麵鉛量高,部份即食麵鉛量高 上海市消費者保護委員會抽查市面二十三個即食麵樣本，全部樣本雖符合標準，但康師傅、統一及日清等知名即食麵品牌部份產品的鉛含量或苯甲酸達到標準的最高值，面臨超標的危險。不過，統一及日清等均堅信自己產品的質量。  《新京報》
20051210-148,20051210,148,總額500億　中小企歎門檻偏高內地大幅增加對台商貸款,總額500億　中小企歎門檻偏高 內地大幅增加對台商貸款 為解決內地的台商，特別是中小企業融資困難的問題，內地對台商的貸款額將由三百億元（人民幣．下同）加碼至五百億元，並放寬貸款條件。但香港台灣工商協會常務董事陳自創對記者稱，由於貸款的門檻依然偏高，恐中小企業的台商難於受惠。 國家開發銀行副總經理賈曉軍表示，在新措施下，台商只要提供出口信用狀（LC）、已簽訂的合同與應收帳款等流動資金財產，都能做為抵押。同時，由其他企業、個人做擔保的擔保貸款，該行亦會接受。貸款對象主要是支持台資中小企業和國家重點支持的產業。 資產在台灣難作擔保 台商的貸款，由申請、審批到確認，需時約一個月。台商在申請貸款時，應先向投資所在地的台辦提出申請，由當地台辦審核是否真正具有「台商身份」，然後再交由當地的開發銀行分行審核。三千萬元以上的貸款，須交由開發行總行審批，三千萬元以下則可由地方分行審批，但貸款的具體細節將在稍後正式對外公布。  陳自創表示，內地的五百億貸款對融資需求極為迫切的數萬家大陸台商而言，無疑是「及時雨」，但能否具體落實？後續發展仍有待關注。他稱，內地的台商，特別是中小企業，因經常無法提供融資保證人及在擔保品不足的情況下，難以取得貸款。這是由於許多台商的資產均在台灣，內地的銀行與台灣沒有直接的業務往來，不接受此擔保品等情況下，而現階段內地貸款政策的關鍵，還是要台商提供足夠的擔保品，以使台商「根留」內地。  他續說，受內地宏觀調控措施影響，近年許多台商轉向香港台資銀行或台資財務公司求援，即使貸款利率較高，但由於要求的融資擔保品較少，短期借貸周轉較為方便，令十多家的香港台資銀行、或台資財務公司平均獲利貢獻高達逾三成。  今年九月，內地宣布將對台商提供三百億元的開發性貸款方案，但這筆貸款的規模最終將加碼至五百億元。  台灣《聯合報》/本報記者
20051210-149,20051210,149,微軟斥132億投資印度,微軟斥132億投資印度 正在印度訪問的微軟董事長比爾．蓋茨（BillGates）宣布，今後四年將在印度投資十七億美元（約港幣一百三十二億元），並增加當地僱員人數，由目前的四千人增至七千多人。看好印度的不只蓋茨，管理諮詢公司科爾尼（ATKearney）對全球投資者信心進行的一項年度調查顯示，印度已成為世界上僅次於中國，最吸引外商投資的國家。 印度投資吸引力超越美國 科爾尼推出的○五年外國直接投資信心指數顯示，有八成企業領導人計劃未來三年在海外設立公司，比例遠遠高於去年的六成六。以投資吸引力計算，中國自○二年以來一直佔據榜首位置，而印度在排行榜中的位置由去年的第三位升至第二位，而美國則由去年的第二跌至第三，英國保住了第四的位置，其他西歐國家的排名均下滑。  其實，印度利用外資過去均處於較低水平。○四年印度利用外資只有五十三億美元（約港幣四百一十一億），佔全球外國投資總額百分之零點八，相比於中國六百零六億（約港幣四千七百億）的直接利用外資額，更見差距。  為吸引外資，印度政府近年亦推出一系列措施，例如加強基礎建設，放寬電訊、公路和機場等領域的外資最高比例限制等，以吸引外國的直接投資。  不過，科尼爾的報告同時指出，印度需要克服狹隘的商業利益和基礎設施、物流和監管方面的障礙，才能受惠於不斷飆升的投資者信心。  英國《金融時報》/本報記者
20051210-150,20051210,150,首爾$7.5過踩冰癮,首爾$7.5過踩冰癮 冬天除咗食火鍋之外，最啱就係溜冰啦。舊年首爾廣場喺平安夜開放溜冰場，吸引咗大批人潮，今年佢哋特別提前喺噚日開放，預計開放三個月。其實開幕前一日，已經有小朋友試玩。今年佢哋會增設休閒空間，同時將去年每次一個鐘嘅使用時間延長為兩個鐘，費用包埋借溜冰鞋、帽、手套、儲物櫃都係一千韓圜（約港幣七個半）咋！
20051210-151,20051210,151,東海大橋今日通車,東海大橋今日通車 中國第一座外海跨海大橋──上海東海大橋今日正式通車。據講，呢條東海大橋全長三十二點五公里，係洋山深水港區嘅重要配套工程，建造時間為三年。東海大橋所用嘅鋼材近一百萬噸，主要有鋼板、鋼管等，混凝土就用咗一百五十萬噸。
20051210-152,20051210,152,台售多啦A夢郵票,台售多啦A夢郵票 台灣嘅中華郵政十二月一日起代售多啦A夢郵票，其中包含幾款多啦A夢嘅迎春造型。多啦A夢個人化郵票圖案以中華郵政發行的「十全十美」郵票，結合多款「多啦A夢」新年造型每組售價新台幣兩百八十元（約港幣五十八蚊）。
20051210-153,20051210,153,菲國機場笑臉迎人,菲國機場笑臉迎人 劉德華嗰句「今時今日，咁嘅服務態度係唔夠㗎」，已經成為各個服務業嘅標準，連菲律賓馬尼拉國際機場都好有同感。當局已經發布一份備忘錄，指示機場工作人員要笑住迎接出入境嘅旅客。知情人士話，呢份備忘錄源自阿羅約夫人幾個禮拜前去韓國出席亞太經濟合作會議時嘅不快經驗。阿羅約夫人喺機場貴賓室候機用點心時，發現服務員都黑口黑面，就問機場總經理：「點解你啲人唔對我笑？」於是，第二日就出咗呢份備忘錄嘞。
20051210-154,20051210,154,著數街：深圳南山買花半價,著數街：深圳南山買花半價 平至七毫半（人民幣．下同）一支玫瑰、一元七毫至兩元一支火百合，以及二十至九十多元不等的江西景德鎮陶瓷；貴至長逾六呎，要有個豪宅花園才放得下，價錢由數千元至數萬元不等的台灣真柏盆景……都能在深圳南山國際花卉市場找到，其產品價格更比香港便宜一半，亦較市面平逾兩成。  今年七月才開張的深圳南山國際花卉市場，是深圳三大花卉市場之一，也是深圳一個大型的花鳥魚市場，園區整體是一個仿歐式風格的建築群。但因地方較為偏僻，平時前來光顧的人或遊客不多，但環境清幽，花卉、盆景、陶瓷等產品價廉，如雲南空運的玫瑰一束（二十支）賣十五元、百合一束（十支）賣十七元。這裏的商戶均期待西部通道啟用後，可以改善市場營商環境。  本報記者  亞太經貿版歡迎讀者「爆料」或提供意見，電郵地址：asiamoney@appledaily.com
20051210-155,20051210,155,人權日前美呼籲自由造福中國,人權日前美呼籲自由造福中國 今天是世界人權日。曾高調批評中國「一黨專政」政治制度的美國常務副國務卿策利克，前天在中美「戰略對話」會談上，向外交部副部長戴秉國為首的中方代表團重申，美方關注中國的人權狀況，並強調促進自由和人權並不會危害社會穩定，呼籲北京在這兩方面努力。 中美第二次戰略對話在周三和周四（美東時間），於美國華盛頓舉行。前天會談結束後，策利克向記者透露，一如總統布殊在上月訪問北京一樣，美方這次在會談上再次向中方提到自由和人權的重要。他在聲明中表示：「我們（向中方）解釋，美國提出這些議題並非是為了給中國帶來威脅或不穩定，而是因為我們相信擴大自由，是中國發展的自然和不可或缺的一部份。」 美方：並非把中國包圍 不過，策利克並未透露中方在會議上，對人權問題有何回應。一名匿名美方官員指，美方重申關注中國軍力的高速發展，但「雙方都注意到，中國並非下一個蘇聯；美方現正尋求把中國拉出來，而非把其包圍起來。」中國外交部的聲明則指出，中方進一步向美方闡述了和平發展戰略，「表明中國的發展不僅是對中國人民負責，也是對世界負責，既造福中國人民，也惠及世界。美方對此表示贊同。」  策利克曾於九月二十一日在「美中關係全國委員會」演講，罕有地批評中國的政治制度，指中國「需要政治轉變，使其政府對人民負起責任和義務。」而今年美國總統布殊、國務卿賴斯、國防部長拉姆斯菲爾德訪華時，每一次都有要求北京領導人改善人權狀況。賴斯更曾向中方提交一份「關注人權名單」，並對中方未有積極回應感到失望。 互補接觸追求相同目標 此外，剛結束的中美戰略對話，還討論了美中貿易龐大逆差、人民幣滙率機制改革、全球反恐、防止大殺傷力武器擴散、能源安全、防治禽流感等議題，並就伊拉克、阿富汗、北韓等國際問題交換意見。雖然雙方會後沒有達成任何實質成果，但策利克仍表示：「我們不追求同樣的政策，但可以通過互補的接觸，追求相同的政策目標。」他重申希望中國作為「負責任的利益合夥人」（responsiblestakeholder），並形容美中雙方在兩天的會談進行了「建設性」的對話。  美聯社/法新社/新華社
20051210-156,20051210,156,溝通改善中美關係　攤牌利胡總訪美,溝通改善中美關係　攤牌利胡總訪美 對於剛結束的中美第二輪戰略對話，中國人民大學國際關係學院教授時殷弘昨表示，對話雖觸及中國的人權和自由等問題，但在會談中美方將兩國的實質問題有系統地擺到談判桌上與中方商討，雙方系統地加強了解和溝通，這對胡錦濤明年初的訪美是非常有利的。 美多做少說免傷和氣 時殷弘指出，自今年八、九月份以來，中美關係良好的迹象愈來愈明顯，雙方雖有爭端，但總的氣氛比今年一至七月要好得多。他估計，美國今後一方面會系統地加強與華合作，同時又會加強防範中國，但會多做少說，不一定再公開提出中國威脅論，因為多說可能破壞中美關係。  對於昨日的中美戰略對話，時殷弘認為，這次對話與以往很大不同的是，美方將兩國的實質問題有系統地擺到談判桌上與中方商討，既讓中方明白美方的政策，也讓中方有機會向美方解釋自己的難處。  對於美方在會議上所提到的人權和自由問題，他說：「這是美國對華的老話題，特別反映了布殊政府向全球推動民主的政策，美國總是要說這些話的嘛！包括布殊訪華的時候也這麼說，問題是，中國聽不聽，倒是另外一回事。」  本報記者
20051210-157,20051210,157,聯合國宣言定人權日,聯合國宣言定人權日 一九四八年十二月十日，聯合國大會通過《世界人權宣言》，宣布「所有的人均生而自由，在尊嚴及權利方面處於平等地位。」此後，這天便被定為「世界人權日」。  《世界人權宣言》和《經濟、社會、文化權利國際公約》、《公民權利和政治權利國際公約》以及《公民權利和政治權利國際公約任意議定書》，這四份重要的國際法文件構成了《國際人權憲章》。  不過，中國政府至今仍未有簽署《世界人權宣言》，只簽署了《經濟、社會、文化權利國際公約》以及《公民權利和政治權利國際公約》。
20051210-158,20051210,158,「利益合夥人」誘中國,「利益合夥人」誘中國 美國副國務卿策利克今年九月發表題為《中國往何處去》的演說，大肆鞭撻中國封閉的政治制度，敦促中國推行民主選舉外，還希望中國成為國際社會負責任的利益合夥人（responsiblestakeholder），發展對華的合作關係。 成為負責任國際成員 有專家認為，策利克提出的利益合夥人說，標誌着美國對華政策的轉折，顯示喬治布殊政府強調對華接觸，誘導中國成為國際社會負責任成員。  策利克在演說中指出，中國是強大的，將影響未來世界的發展，對中國會如何利用其影響力，表示高度關注及疑問。  不過，他認為，面對日益強大的中國，美國對華政策不會僅着眼於讓中國成為國際組織的一員，而是應再進一步，務必令中國成為系統內負責任的利益合夥人。他指出，中國不僅有責任強化國際組織的作用，還要和美國加強合作，一起處理新世紀的眾多挑戰。  本報記者
20051210-159,20051210,159,獄中律師獲頒人權獎,獄中律師獲頒人權獎 代表上海數千被迫遷戶打官司而入獄的內地律師鄭恩寵，榮獲德國法官協會頒發的本年度「人權獎」。由於鄭恩寵目前身陷囹圄，其妻子欲代表他到德國出席本港時間昨晚舉行的頒獎禮時，卻受到中國當局的諸般阻撓，結果無法成行。 為數千被迫遷戶打官司 事實上，早在今年五月，德國法官協會已將鄭恩寵列為本年度「人權獎」的得獎人。兩個月後，鄭妻蔣美麗獲得護照，準備在年底前往德國代夫領獎。德國法官協會曾在十月中致電蔣詢問其護照號碼，但這通電話可能遭到中國當局竊聽，然後上海閘北區法院突然在十月底指蔣美麗涉及物業糾紛案，限制她出境。 妻被限制出境未代領獎 無可奈何之下，蔣美麗只好委託被迫遷戶代表、香港居民沈婷女士到德國代表鄭恩寵領獎。在昨晚的頒獎禮舉行前夕，德國總統克勒特別在一個招待會上致詞，表示強烈關注中國人權狀況，尤其是維護人權的律師受到迫害的情況。  中國人權
