key,date,article_daily_id,title,text
20050606-134,20050606,134,劫賊殺婦餓死弱智童,劫賊殺婦餓死弱智童 廣東省北部連州市的一名單身中年婦被入屋竊匪掐死，更不幸的是，寄養在她家的十六歲嚴重智障少年，事後乏人照顧，竟在家中活活餓死，直至半個多月後，屍體發臭，鄰居報警才揭發這宗慘劇。行兇的竊匪已被公安拘捕。 鄰居聞惡臭揭發兩屍 五月十八日，連州市西岸鎮一棟樓宇的居民，忍受不了其中一個單位傳出的陣陣惡臭，報警求助。公安到場破門而入，發現單位內有兩名死者，屍體已高度腐爛，相信他們分別是五十多歲的黃姓女戶主，以及她親戚寄養在此的十六歲少年何X軒。後經法醫鑑定，黃女被人掐住脖子窒息而死，而何X軒則是活活餓死的。  公安事後組成專案組，發現鎮上一名十六歲鄭姓少年案發前曾在附近出現，且涉及多宗偷竊案，近日不知去向。公安加緊追捕，上月二十五日終在連州市將他拘捕。他向公安供稱，上月五日晚八點，他潛入西岸鎮一棟住宅的二樓，偷到三十元，準備離開時被剛回家的黃姓女戶主撞見，雙方發生拉扯，鄭因無法掙脫，於是掐住黃女的喉嚨，令她窒息而死。他將被控搶劫殺人罪。  廣東《南方都市報》
20050606-135,20050606,135,自閉漢偕3兒女投河死,自閉漢偕3兒女投河死 台灣彰化秀水鄉四十三歲男子溫錦鐘，昨日上午帶同九歲兒子、兩名八歲雙胞胎女兒到河邊，先將兩名子女推落河，再抱着幼女跳河自殺。警方表示，懷疑溫錦鐘因患有嚴重自閉症，加上離婚兼失業，無力撫養三個小孩而帶着他們走上絕路。  台灣《蘋果日報》
20050606-136,20050606,136,33米水泥塔跌死6工人,33米水泥塔跌死6工人 前日上午，九名工人在遼寧省燈塔市恒威水泥廠擴建工地，為水泥塔封頂時，懸掛式操作平台的七根鋼絲突然斷裂，工人從三十三米高空墜下，六人身亡、三人受輕傷。當時在塔頂工作的還有十多名木工和瓦工，所幸未到平台上工作。  遼寧《華商晨報》
20050606-137,20050606,137,2.5米鋼管貫腹,2.5米鋼管貫腹 西安市北郊一個工地前天發生罕見工業意外。一個吊塔吊着近百根鋼管從六樓吊到八樓時，兩男一女的三名工人，聯同這批鋼管從空中滑落，其中一人遭一條二點五米長的鋼管貫穿腹部。工人送院後接受了兩個多小時的手術，穿腹的鋼管被取出，目前已脫離生命危險。主診醫生對於該根兩端並非尖銳的鋼管能夠貫穿人體腹部，感到不可思議。  互聯網
20050606-138,20050606,138,射程覆蓋上海香港台試射千里巡航導彈,射程覆蓋上海香港 台試射千里巡航導彈 台灣中山科學院研製的雄風巡航導彈（台灣稱為「巡弋飛彈」）已突破關鍵技術，正式試射成功，其射程達一千公里，可覆蓋大陸東南沿岸重要軍事目標，預期今年底或明年就可進行小量生產，令台灣具備攻擊上海、香港等沿海大城市的能力。 台灣的《中國時報》昨日報道，這次成功試射雄風巡航導彈，應在三個月前。試射當日，天氣晴朗，發射地點是台灣南部的屏東九鵬導彈基地，導彈向綠島方向的海域發射，飛行超過五百公里，並落在海面上，順利命中模擬目標。據報道，台灣國防部長李傑全程觀看了巡航導彈試射，對發展巡航導彈高度關注和支持的總統陳水扁獲悉後，甚感欣慰，並嘉勉有關人員。 擁有與大陸談判籌碼 台灣新研製的雄風巡航導彈，相信是在雄風系列短程導彈的基礎上發展出來的，據稱射程可達一千公里，涵蓋大陸東南沿岸目標，預計今年底或明年初將進行「小量初期生產」，邊生產，邊改進、測試，待構造定案後再大量生產。這將是台灣軍方首次擁有「戰略型武器」，具有重要的軍事、政治意義。  如果雄風導彈部署在台灣中部山區，其射程已可達上海、南京、香港等大城市；如果配備在即將從美國購入的紀德級導彈驅逐艦上，對大陸其他內陸城市的威脅自不待言。  報道稱，負責研製雄風巡航導彈的「雄風計劃室」主持人是王德勝與龔明賢。王德勝在以色列取得博士學位，專長就是巡航導彈和反艦導彈的研製。  台灣國防部昨日重申，對有關消息「不予置評」。不過，軍方高層私下指出，大陸近來透過媒體放出「撤除瞄準台灣導彈」的消息，並非政治善意，而是在軍事上認定台灣已成功發展巡航導彈、具反制導彈能力所致。早在四月十六日，原本要求大陸撤除導彈的陳水扁，已改口稱「導彈問題的重點在銷毀而不在減少、撤除」，顯示台灣當時可能已成功試射巡航導彈，擁有與大陸談判的籌碼。  美國將正式公布的「中國軍力報告」指出，中國部署在東南沿岸、瞄準台灣的導彈已增加至七百二十五枚。台灣軍方則指，這些導彈主要部署在江西樂平、贛州，福建永安、仙遊，廣東梅州等五個基地，可對台灣進行連續十五小時、五波攻擊。  本報記者/台灣《中國時報》
20050606-139,20050606,139,美台秘設軍事熱線兩年,美台秘設軍事熱線兩年 美國官員證實，台北與華府已設立一條軍事熱線電話，這是美國與非邦交方僅有的一個官方熱線。熱線電話的設備由美國提供，台灣獲授權使用的最低層級官員是國防部副部長。 無大危機　從未通話 台灣《聯合報》引述與台灣軍方互動密切的美國官員稱，美台軍事熱線電話於二○○二年秋天完成建構。依據雙方的秘密協議，設立熱線旨在因應「台海發生迫切軍事危機、台灣遭受突發性攻擊」等重大狀況時，台北可突破外交限制，即時與美國政府及美國軍方直接對話。不過，軍事熱線設立至今從未使用過，因台海迄今未爆發足具威脅的軍事危機。  據報道，美方在一九九六年台海軍事危機後提議設立軍事熱線，當時的台灣總統李登輝曾希望說服美國，將軍事熱線電話提升至元首熱線，但遭美方拒絕。  台灣《聯合報》
20050606-140,20050606,140,巡航導彈命中機率高,巡航導彈命中機率高 巡航導彈主要依靠噴氣發動機的推力和彈翼的氣動升力來飛行，是一種遠程精確制導的高科技武器，具有體積小、重量輕，飛行高度低、攻擊突然性大，命中精確度高、摧毀能力強等特點，可以從地面、空中或水下發射，攻擊固定目標或移動目標。新一代巡航導彈採用新的制導技術，實現慣性加GPS（全球定位系統）加紅外線影像制導。  最顯赫的巡航導彈，當數在阿富汗戰爭、伊拉克戰爭中充份展示威力的美製「戰斧」導彈，射程可達四百五十至二千五百公里。  《蘋果》資料室
20050606-141,20050606,141,6款廣東手機電池不合格,6款廣東手機電池不合格 國家質檢總局昨日公布的手機電池抽查結果顯示，內地生產的手機電池逾兩成不合格，主要是電容量不足、安全性能不合格等，部份僅得幾分鐘壽命，甚或發生短路，有爆炸起火的危險。質檢總局點名批評六款廣東生產的手機電池，港人如購買手機電池時應留意相關牌子。 長時間充電會起火 中央電視台報道，按照國家標準規定，手機電池必須有充電保護和短路保護的裝置，即在電池充滿電或者發生意外短路時能自動斷開，以達到保護電池的作用。但這次國家質檢總局在北京、天津、上海、浙江、廣東、福建等六個省市，抽查二十七間廠家的二十七款手機電池，發現合格率為百分七十七點八，不合格的逾兩成，六款被點名批評的不合格手機電池，竟全部由廣東的廠家生產（見表）。  信息產業部通訊產品質檢中心主任助理穆懷遠指出，不合格的電池中，有的是充電保護不起作用，長時間充電會引致起火、爆炸，危及財產及人身安全；有的電池在大電流放電情況下，放電時間只有三點五分鐘，遠低於標準的五十一分鐘，放電時間愈短，電池的容量愈低，出現一充電就滿、一用就沒電的情況。 消費者宜選大品牌 另外，國家質檢總局還在六省市抽查二十五間廠家的手機充電器產品，其中有三種不合格，包括廣州迪一電子公司生產的DY-K515型旅行充電器、福建省泉州市光遠電子公司「PUGUANG」牌電池充電器、泉州市威訊電子公司「ZHOUXUN」牌智能充電器。  質檢專家表示，消費者應盡量到大商場購買大品牌的手機充電器產品，購買時還要特別留意安全性能，檢查有沒有保護功能，以確保短路時不要發生危險。  中央電視台
20050606-142,20050606,142,球迷不滿黑哨爆騷亂,球迷不滿黑哨爆騷亂 河南省新鄉巿前天的一場甲組足球聯賽，賽後發生球迷騷亂。逾千名主場球迷因為不滿球證的裁決，與公安發生衝突，又砸毀球場設施和座椅，數名球迷流血受傷，有記者試圖拍攝時也遭公安武力阻止。 與警衝突　傷及記者 河南建業隊上周六下午在新鄉巿的主場迎戰青島海利豐隊，二比二言和。賽後大批主場球迷不滿球證偏袒客隊，在看台上不停地高喊：「黑哨！黑哨！（球證吹假波）」一名球迷與在場女警發生口角後，十多名手拿盾牌和警棍的防暴警察衝上看台，立即有球迷向警察投擲礦泉水瓶。警察後來把兩名球迷強行從看台拖到場中，施以拳腳，兩人被打至血流披面。  有記者試圖上前拍攝，亦遭警員揮着警棍阻止，惹來球迷更大不滿。有人拆下座椅扔入場中，有人衝擊體育中心的大門，壓碎大門玻璃，並高呼：「嚴懲兇手！」一名攝影記者的腿被玻璃劃傷，鮮血直流。事件擾攘近三小時，球迷至晚上八時許才完全散去。  中國足協表示，會在收到比賽監督和球證滙報後，嚴肅處理事件。  Tom網站
20050606-143,20050606,143,狎童案宣判日近　連日失眠顏憔悴米高心驚機器助泵血,狎童案宣判日近　連日失眠顏憔悴 米高心驚機器助泵血 狎童案世紀審訊持續四個月，米高積遜面臨裁決，可能剛過了這輩子最漫長的周末。在忐忑地等待陪審團周一繼續退庭商議作出裁決之際，他緊張得要找來心臟病人使用的醫療儀器，幫他將血液由腳部泵上心臟，以讓他的心臟可以得到休息，幫助他血壓循環和入睡。 據美國霍士新聞頻道報道，一輛全球心臟護理公司的小型貨車，前日（周六）傍晚六時許，將一部血液儀器送進米高積遜在加州的「夢幻樂園」。消息人士透露，該公司亦派來一名不知道是技師還是護士的人員同來，負責接駁儀器。米高積遜的知交、黑人喜劇演員格雷戈里（DickGregory）說，那機器擠壓腿部，幫助將含氧血由腿部上運行至心臟。 減氣促胸痛　增血液循環 報道無透露儀器名稱，但估計全球心臟護理公司網站介紹的「體外反搏治療」（EnhancedExternalCounterpulsation）儀器，作用包括減輕氣促和胸痛、穩定血壓、增加血液循環、增強體力和令人睡得安穩。  霍士引述格雷戈里說，該儀器是哈佛大學科學家發明，但未獲美國食品及藥物管理局（FDA）批准。但全球心臟護理公司網站指EECP機已得FDA批准用作治療冠狀動脈心臟病等病。  要使用這樣的儀器，反映米高積遜健康出了狀況。他上周四在聽完控辯雙方完成結案陳詞離開法庭後，就因脫水入院。他的家人說他十分緊張，連日失眠。跟開審初期相比，當時精神飽滿常微笑的米高積遜，上周變得極度憔悴瘦弱，兩頰凹陷如「皮包骨」。 「還服用維他命和補充劑」 除了上周外，他二月亦曾因感冒症狀入院留醫，審訊要押後數天。三月，米高積遜又因為背痛到醫院求診，之後一身睡衣拖鞋「街坊裝」趕上庭。接近積遜家族的消息說，米高積遜的健康現由格雷戈里全權負責，除了使用「血液機」，他「還服用維他命營養素和補充劑」。  米高積遜發言人說，米高積遜上周末留在家中「盡量放鬆」，以迎接「審訊中最糟糕的一部份」。他說米高積遜「憑着對上主的堅定信仰支持下來」。在「夢幻樂園」陪伴米高積遜度過這個周末的，除了他的家人，還有長駐門外、深信米高積遜絕不會傷害小孩子的十多名忠實擁躉。  美國霍士新聞網/法新社
20050606-144,20050606,144,審訊如做騷3度遲到,審訊如做騷3度遲到 過去幾個月的審訊，對米高積遜造成沉重精神壓力，其間米高接連做出「失常」行為，隨着陪審團退庭商議，令米高所承受的壓力也愈大，使人擔心他的健康狀況。 穿睡衣拖鞋趕赴法庭 米高一向予人行徑古怪，去年第一次出庭，跳上車頂跳舞，並向在場一千多名歌迷送上飛吻，以致遲到，被法官梅爾維爾訓斥，警告他若再這樣做，將以蔑視法庭罪拘捕他，令他自此不敢遲到和「做騷」。  在案件開審期間，米高都循規蹈矩，直至三月十日當原告男童第二天作供時，米高遲遲未出現法庭，他的代表律師解釋，米高因背痛入院，法官不接受解釋，警告米高若不在一小時內現身，就發拘捕令和沒收他的保釋金。米高隨即趕到法庭，頭髮蓬鬆，身穿睡衣和拖鞋，跟平日先化妝、衣着天天不同的「姿整」樣子截然不同。事後十一天，米高再因為背痛遲到，法官這次沒有大發雷霆。  法新社
20050606-145,20050606,145,瑞典「國家品牌」最閃,瑞典「國家品牌」最閃 美國人無知，俄羅斯人暴力，意大利人有趣，英國人聰明有禮……商品有品牌，國家也有品牌，令人一想到某國的人和事，就聯想到某些特質。一個國際調查發現，瑞典的「國家品牌」最閃亮，中國排第六。 這個「國家品牌指數」調查，是由英國的國際品牌專家安霍爾特和美國GMI網上調查公司聯合進行，查詢十國共一萬人對十一國的印象，就旅遊、政府管治、國民、文化、投資和出口商品六大項目的各方面評分，從而得出整體的「國家品牌指數」評分，並計劃之後再作定期調查。  安霍爾特說，不管人們對別國印象是否正確理性，「國家品牌」實際上在國際貿易、政治和旅遊等各方面都影響深遠，人們選擇到法國旅行、買德國汽車、欣賞意大利歌劇，認為日本人有野心，背後就像消費者對雀巢和Nike等知名品牌有一定聯想一樣。 和平公義政治穩定 瑞典的「國家品牌指數」在十一國中最高分，主要是因為「所有人都羨慕」它是個和平和公義的國家、是個浪漫的旅遊目的地、人民好客、政治又穩定，雖然大多數被訪者都對瑞典由誰主政不甚了了。安霍爾特說，瑞典的形象未必最刺激，但沒有人不喜歡，「基本上，瑞典是個沒有人在意的國家」。  排第二的英國，以國民的質素最被外國人欣賞，是跨國公司請僱員的首選，在旅遊目的地和流行文化兩方面評分也很高。意大利排第三，主要是文藝復興時代遺產令它的旅遊目的地評分高。中國和印度分別排第六和第七，都是以文化歷史遺產最受世人敬仰。 美國攻伊拖低形象 調查又發現，「國家品牌」很多時受國際政治影響，美國商品和服務雖然得到最高評分，整體品牌評分卻被攻打伊拉克的不受歡迎外交政策拖累，一成人認為美國政府「危險」，令排名只得第四。  安霍爾特認為，一些國家的品牌形象其實跟真實有所偏差，像敬陪末席的土耳其，就是很不幸地被人聯想到回教極端主義，兼受人權紀錄差的形象所拖累；尾二的俄羅斯則受制於暴力多和不穩定的負面形象；尾三的南韓則被很多美國被訪者形容是邪惡和不穩定，但他們可能將南韓和北韓混為一談。  英國《觀察家報》
20050606-146,20050606,146,法意隧道大火20人中毒,法意隧道大火20人中毒 穿越阿爾卑斯山脈、連接法國和意大利的弗雷瑞斯隧道，前日（周六）發生大火，一輛運載輪胎的貨車在隧道內疑漏油起火，波及另外五輛車輛着火焚燒，包括一輛運載膠水的貨車，膠水在攝氏九百度高溫下釋出劇毒物質。大火造成至少兩人死亡，另有多達二十人吸入毒氣不適。隧道將關閉數月。 900度高溫　膠水釋劇毒 當地時間前日下午六時，一輛運載着輪胎的貨車，由比利時開往意大利南部城市巴裏，途中駛進十三公里長的弗雷瑞斯隧道後，因洩漏燃油起火，波及另外五輛車輛。大火期間，隧道氣溫高達攝氏九百度，一輛起火貨車上的膠水包含聚合樹脂，釋出劇毒物質。  高溫和濃煙令救援人員無法靠近起火點，濃煙從意大利隧道口冒出。意大利救援人員擔心，部份隧道可能有塌頂危險。消防員花了六個小時控制火勢，兩名死者都是斯洛文尼亞籍貨車司機，其中一人冒着濃煙在隧道內逃跑了約一公里倒下。  一名逃過大難的司機說：「我突然看見有煙由右邊冒起，於是馬上下車，觸動警鐘，然後向意大利方向逃跑。」  這場火災令人憶起六年前的阿爾卑斯山勃朗峯隧道大火，當時一輛麵粉貨車起火，波及30輛車子，大火焚燒了兩天，隧道溫度達攝氏一千度，造成三十人喪生。弗雷瑞斯隧道一九八○年投入服務，穿過阿爾卑斯山，連接法國里昂和意大利都靈，每年車輛流量達二百萬架次。  美聯社/法新社/路透社
20050606-147,20050606,147,小泉拒妥協續拜靖國,小泉拒妥協續拜靖國 日本首相小泉純一郎參拜靖國神社的風波愈鬧愈大。雖然中國和南韓強烈反對，但小泉的親信和顧問山崎拓透露，小泉今年會繼續到靖國神社參拜。  山崎拓周日說，小泉認為自己是一國領袖，有責任為戰爭陣亡者祈禱。「以小泉的性格，他不會讓自己信念妥協。」他說：「當他再到靖國參拜，我們會透過外交途徑，尋求中國和南韓諒解。」 自民黨亦有反對聲音 日本反對小泉參拜靖國神社的呼聲不斷增加，繼八名前首相擔心參拜神社令中日關係惡化，要求小泉慎重處理後，執政自民黨內部亦有反對聲音，部份保守派元老亦正游說小泉不要再到神社參拜。  日本兩大報章──最開放的《朝日新聞》和中間偏右的《讀賣新聞》，在社論中要求，將靖國神社內甲級戰犯的牌位，移到其他適當的地方供奉。但二戰甲級戰犯東條英機的家人強烈反對；山崎拓也說，基於反對聲音強烈，相信小泉任內不可能將甲級戰犯分開供奉。  美聯社/法新社
20050606-148,20050606,148,英料今當「歐憲殺手」,英料今當「歐憲殺手」 法國和荷蘭全民公投否決接納歐洲聯盟憲法後，歐盟內部傾軋持續。法國總統希拉克和德國總理施羅德前日（周六）會晤後，再次敦促歐盟各成員國繼續確認歐憲程序，但英國外相施仲宏預料今日會宣布擱置歐憲公投。 法德促繼續確認 希拉克前日在德國首都柏林跟施羅德會晤，兩人見面來一個擁抱，用身體語言表明，法德向來要當「歐洲核心」的盟國關係，未受法國選民向歐憲說「不」動搖。兩人強調，他們不想「放棄歐洲理想」，敦促歐盟各成員國繼續確認歐憲。  但英國報章報道，外相施仲宏料於今日宣布擱置歐憲公投，但用字會盡量避免英國蒙上「歐憲殺手」惡名。  德法正擔心英國會趁出任歐盟下半年輪任主席國時弄權，令歐憲永不翻身，希拉克發言人警告，英國有「責任推動整合精神」。  法新社/英國廣播公司/《獨立報》/《星期日泰晤士報》
20050606-149,20050606,149,前教宗手稿不被燒毀,前教宗手稿不被燒毀 已故教宗若望保祿二世曾要求把他的私人筆記文件燒毀，但他生前的私人秘書齊維茲大主教前日（周六）強調，這些筆記是若望保祿二世的重要遺產，一些更可能有助他封聖，所以沒有按他遺願燒毀。 私人秘書沒執行遺願 齊維茲由一九六六年起，一直為若望保祿二世工作，直至對方逝世，若望保祿二世臨死前更握着他的手。一九七九年，若望保祿二世曾表示，他沒有留下個人財產，並要求齊維茲把他所有私人筆記文件燒掉。不過，齊維茲前日接受波蘭電台訪問時說，他沒有燒毀這些筆記。  「有很多關於不同問題的手稿，沒有東西被燒毀，沒有東西值得被燒毀。」齊維茲說：「為了後世的人，所有東西，每句句子，都應被保存，作為歷史。這些東西都有豐富價值，應逐步公開。」  齊維茲沒有詳細解釋，但表示部份手稿可能對若望保祿二世的封聖過程有幫助。  美聯社
20050606-150,20050606,150,武裝艦巡馬六甲防海盜,武裝艦巡馬六甲防海盜 馬來西亞國防部長納吉布周日在新加坡的亞洲安全研討會上表示，為了打擊日益肆虐的海盜問題，加強馬六甲海峽的安全，大馬當局將會准許武裝船艦為商船護航，而美國和日本將在保衞馬六甲海峽安全工作上扮演更大角色。  法新社
20050606-151,20050606,151,瑞士公投加入神根條約,瑞士公投加入神根條約 非歐盟成員國瑞士周日舉行全民公決，決定是否加入歐盟的《神根條約》和《都柏林條約》，讓瑞士對歐盟成員國開放邊境，協調各國政治庇護程序，以及給予同性戀婚姻人士權利。當地電視台預測公投將以五成二贊成票通過。  路透社
20050606-152,20050606,152,常飲汽水　骨骼變脆,常飲汽水　骨骼變脆 喜歡飲汽水的大朋友小朋友要小心！科學家首次發現，長期飲汽水，會令骨骼變得脆弱，增加了患上骨質疏鬆等骨骼病症的風險。丹麥研究人員在《骨質疏鬆症國際》期刊即將發表的報告中指出，汽水會消耗人體內的鈣質，導致骨骼發展受損。 汽水有損骨骼，原因是汽水加入二氧化碳製成，會令飲品酸性增加，人體飲用愈多的汽水，血液中的酸就會愈多，人體就需要消耗愈多的鈣，中和血液中的酸。但鈣是鹼性礦物，有助骨骼生長，鈣消耗得多沒有補充，會影響骨骼生長。 酸性飲品消耗鈣質 丹麥研究人員在今次研究中，請來十一名男性在連續十天內每日飲二點五公升的可口可樂，接着又連續十天每日喝同等份量的牛奶，結果顯示他在飲可口可樂期間，骨質明顯流失。 飲可樂少女易骨折 研究隊伍發言人說：「研究顯示連續十日大量飲汽水加上低鈣餐單，比起十日飲牛奶加上低鈣餐單，會造成骨質流失。我們關注到時下以可樂或汽水取代牛奶的趨勢，這趨勢意味人體減少攝取鈣，影響健康和增加患上骨質疏鬆症的危險」。  研究人員強調，結果對喜歡飲汽水的小朋友骨骼成長有啟示，對女性健康影響的含義更大，因女性骨質流失更嚴重。哈佛大學公共衞生研究所之前有研究指，愛飲汽水的少女，骨折機率是不飲汽水的三倍；愛喝可樂的少女，骨折機率更是不飲可樂五倍。  本港家庭醫學醫生關嘉美說：「帶二氧化碳的汽水、香檳、甚至有氣的礦泉水稱為碳酸水，年老、更年期、或缺乏荷爾蒙激素的人，都不宜多飲。」但她認為，「每日飲一支、半支汽水，不會增加患上骨質疏鬆症的風險。」她又說，人類平日可以透過進食豆類、奶品、肉類和蔬菜中吸收鈣質。  英國《泰晤士報》/本報記者
20050606-153,20050606,153,體外反搏「自然搭橋」,體外反搏「自然搭橋」 體外反搏治療是一種無創傷性療法，主要應用於冠狀動脈病患者，也適用於腦腎等缺血性病人身上，臨床實驗證實能有效減低病人心絞痛，這種簡易療法毋須開刀，在六十年代由哈佛的學者提出，經中國醫護人員弘揚，已經獲得美國食品及藥物管理局認可。 氣帶隨心跳充氣放氣 接受治療的病人，只需要將三個可以縮脹的氣帶，套在臀部、大腿和小腿的位置，隨心跳節拍充氣放氣──當心臟舒張放鬆時，氣帶會充氣施壓，將充氧血液由下身驅回主動脈，增加心肌的供血，達到改善心腦腎等器官缺血情況；相反，當心臟泵血時，氣帶會放氣。  反覆充氣和放氣，身體會進行被動式的運動，讓更多血液流遍全身，外部加壓的血液甚至能繞過受阻塞的動脈，通過受刺激張開的側枝血管，直流心臟，形成新動脈，這個情況稱之為「自然搭橋」。  新加坡《聯合早報》/香港港安醫院網頁
