key,date,article_daily_id,title,text
20050127-136,20050127,136,拍新劇全體演員隨時候命伊健得寵奉旨破戒,拍新劇全體演員隨時候命 伊健得寵奉旨破戒 無綫重頭劇《隨時候命》昨日試造型，無綫高層曾勵珍更親自監場，還下令一眾演員拍攝期間不可度期外出，以及不准遲到，新人鍾嘉欣即時被嚇得口窒窒，但反斗的鄭伊健竟敢反駁說：「珍姐話佢哋啫，我早已經度晒期出嚟。」 無綫即將開拍一套有關飛行服務隊的新劇《隨時候命》，演員包括鄭伊健、林保怡、佘詩曼、楊思琦及鍾嘉欣等，昨日數十位演員齊集將軍澳電視廣播城試造型，而香港飛行服務隊人員亦會協助參與拍攝工作。     珍姐現身訓示   無綫戲劇分部副總監曾勵珍昨日親自監場，介紹劇集之餘還嚴厲地說：「拍呢套劇要隨時候命開工，首要條件係唔可以妨礙飛行服務隊工作，所以期間藝員唔准度期出去，唔准遲到。」珍姐此言一出，一眾藝人自然不敢怠慢，鍾嘉欣自我介紹時，未知是否被珍姐威嚴嚇怕，說話即時口窒窒，要林保怡打圓場。     接受秘密訓練   反而被珍姐寵愛的鄭伊健，雖然已有七年未有替無綫拍劇，但昨日一聽見珍姐的一番叮囑後，不但沒有半點怯意，還鬼馬地說：「珍姐講佢哋啫，唔係話我，我由舊年已度期度到今年，所以都冇話推咗啲乜嘢工作，之前無綫重安排我秘密去訓練，拍攝時又要落水救人，又要喺直升機吊落山頭，今次學咗嘅嘢，真係可以大派用場。」
20050127-137,20050127,137,Twins送猴迎雞休養生息,Twins送猴迎雞休養生息 女子組合Twins有感新春將至，計劃下月六日年廿八相約齊齊洗邋遢，希望送舊迎新，將去年的不如意事一掃而空。     健康放首位   面對新的一年，Twins決定要爭取充足的休息時間，實行將健康放在首位，她們自言目睹連串的疫症爆發及天災人禍後，更懂珍惜生命。  鍾欣桐表示曾因過勞而肌肉嚴重痠痛，她說：「初時重以為自己係患咗慢性疲勞綜合症，但係食咗赤靈芝後，腰痠背痛已經好咗好多。」事實上，Twins早前成為陳妙瑛旗下的健康產品「紅太陽舞茸赤靈芝」代言人，難怪賣花讚花香了。
20050127-138,20050127,138,楊采妮赴斯理蘭卡賑災,楊采妮赴斯理蘭卡賑災 楊采妮昨日起程到斯理蘭卡，探望受南亞海嘯影響的災民，楊采妮透露近日不少朋友不停送上物資給她帶往災區，她說：「有啲人就送奶粉、BB仔衫同埋玩具，重有音樂帶，因為我想同當地嘅小朋友玩一啲集體嘅遊戲我帶咗兩個篋，我自己只係用咗半個篋放嘢。」  楊采妮飛抵當地看到災情後，會否忍不住哭起來？她說：「梁詠琪都叫我要忍住，咁我惟有匿埋一邊喊啦，我覺得親身去探訪，等佢哋知道有好多人關心佢哋，佢哋都會開心啲，而且呢啲訪問唔係做一次，要持續做畀多啲溫暖佢哋。」  採訪、攝影：胡比
20050127-139,20050127,139,趙子女盼父周六舉殯,趙子女盼父周六舉殯 擾攘十天的中共前總書記趙紫陽的出殯時間初步敲定，趙紫陽的子女昨日表示，希望遺體告別儀式在本周六舉行，正與當局商談細節。不過，當局擔心周末有太多人出席，尚未最後確定日期。至於對趙紫陽的評價等爭議，據聞雙方各有妥協，但當局規勸趙家勿洩漏「黨和國家的機密」。　中國組 趙紫陽在本月十七日上午病逝。按中共以往為胡耀邦、鄧小平、楊尚昆等已故領導人舉殯的慣例，都是在他們逝世後一個星期舉行，但由於當局在趙紫陽的生平和評價、喪禮安排、趙紫陽骨灰安放地點等問題上，未能與趙家達成共識，令喪禮一再押後，有關中共高層因此引發爭鬥的傳聞也甚囂塵上。     家屬不願多提評價爭議   趙紫陽的幼子趙五軍昨日在趙府親口告訴記者：「可能定在二十九日或三十日，屆時逢星期六和星期天，對大家都好。」早前有報道指趙的家屬和中共中央曾八次協商未獲結論，趙五軍昨日的回答比較明朗，顯示雙方的意見可能漸趨接近。  但當記者追問：「中央對總書記的評價是否有了結果？」趙五軍則不願正面回答。至於趙紫陽的骨灰會否放八寶山革命公墓骨灰堂第一室，趙五軍說：「應該吧！」。被問及喪禮由哪個層級的人主持時，趙的親人回答說：「我們家屬不在意，都可以溝通的」。  中國人權民運信息中心昨日下午也引述趙紫陽的女兒王雁南表示，想將遺體告別儀式定在星期六或星期天舉行，但涉及許多事定不下來。她說，不方便透露細節。 當局規勸勿洩「國家機密」   信息中心還表示，中共當局雖然不願意用「黨和國家領導人」的規格隆重處理趙紫陽的後事，卻以「涉及黨和國家機密」規勸趙紫陽家人，不要向外透露趙的信息，令家人承受很大壓力。  趙紫陽的兒媳任克英則向法新社證實，家人傾向於在這幾天舉行遺體告別儀式，但還沒有最後決定。「家人認為，可以在星期六舉殯，這是雙方（當局與趙家）的共識，但還在討論細節。」  法新社同時引述趙家一名不願具名的親友說：「趙家希望在周末舉行遺體告別儀式，但是中共中央說在周末舉行，擔心人太多。因此還在商量，日期還沒有確定。」  被問及對趙紫陽的評價是否達成共識，趙家親人表示，他們無法接受趙紫陽在八九年犯了嚴重錯誤的結論，「家人不想聽到這個詞，也從不相信那是真的。」她強調：「我們當然要求有公正的評價，但能否達到這個目標，並不取決於我們。一個人、一個家庭，無法對抗政府。」  至於趙紫陽遺體告別儀式的規模，在趙家幫忙料理靈堂事務的劉先生說，凡是到趙家弔唁者均能得到趙家自行印製的遺照一張，並設有自願參加遺體告別儀式的登記簿，屆時將中共中央辦公廳劃定人數再行通知前住。
20050127-140,20050127,140,北京人學用筷子迎奧運,北京人學用筷子迎奧運 為了迎接○八年奧運會，北京市政府將開展為期一年以「禮儀北京，人文奧運」為主題的「首都文明禮儀教育實踐活動」，通過各大傳媒教育巿民認識基本社會禮儀。有傳媒更編成《禮儀新三字經》，以「手中筷，別指人；勿敲桌，別擊碗」，教育巿民正確使用筷子的方法。     「別指人　勿敲桌　別擊碗」   該項宣傳教育活動已於元旦正式啟動，每兩個月將會集中宣傳一個範疇，打頭炮的是生活禮儀，三四月份是社交禮儀，然後分別是觀看體育賽事禮儀、職業禮儀、校園禮儀和涉外禮儀。當局希望在○八年奧運會時，「全世界都能從北京市民的身上感受到禮儀之邦的風采」。  在餐桌用筷禮儀上，《北京青年報》列出十大禁忌，包括忌把筷子繞來繞去、用筷子叉食物、用嘴舔筷子、夾菜時滴着料汁、把筷插進菜裏翻來翻去等。  中新社
20050127-141,20050127,141,杭州西湖爆副傷寒疫潮,杭州西湖爆副傷寒疫潮 浙江杭州著名旅遊景點西湖，水源受到病菌污染，導致附近一些使用地下水的農村地區，在去年尾爆發副傷寒疫症，患者高燒持續不退，觸發居民恐慌。當地政府表示，疫情目前已受控制，多數病人已經治癒或正在康復，並呼籲居民不要再使用受污染的井水，全面改用城市自來水。 杭州市西湖區留下鎮橫街社區，在去年十二月有居民持續高燒不退，經檢查證實是感染了副傷寒，目前大部份人已治癒出院。     疑外地病人糞便染井水   橫街街道黨委書記張加明表示，疫症與地下水污染有關，污染源頭則可能是帶有副傷寒病毒的外地人到當地後，其糞便污染了井水，其他人因使用地下水受到感染。當地今年將大規模改造化糞池，防止化糞池出現滲漏導致病菌傳播。  傳染病專家指出，副傷寒的傳染源主要是受病菌污染的水。由於很多農村使用井水或使用不規範的自來水，因此當地居民容易從食水感染到甲型肝炎、細菌性痢疾等傳染病。據悉，目前浙江省農村有八成五的家庭都通了自來水，但至少有一半的家庭直接使用地下水或其他天然水，沒有經過正規的淨化處理。  在曾經爆發疫症的橫街社區，雖然經濟條件不差，也已引入杭州市的自來水，但不少居民為省錢，仍直接從自家的水井抽取地下水，用來洗衣服、洗臉、刷牙和洗菜等。     居民為省錢不用自來水   張加明表示，現在居民基本上已停飲井水。不過，由於水費由社區支付，住戶不願繳交水費，社區的經費又有限，故此目前只能限時供應自來水。一名居民說：「我們用的自來水一直是不花錢的，如果用市裏的自來水，那就要掏錢了，這多不好啊！」  浙江《今日早報》
20050127-142,20050127,142,廣州深圳春運假票湧現,廣州深圳春運假票湧現 年近歲晚，香港人北上回鄉坐飛機或搭火車時千萬小心！大批活躍於深圳及廣州的騙徒，趁內地春運（春節運輸）開始，以廣東爆發沙士、火車發生爆炸或假機票等層出不窮的手法，詐騙南來北往的旅客。     謊稱鬧沙士騙走車票   在廣州火車東站，一名被騙了一百元的年輕女子哭喪着臉說：「他（騙徒）說現在廣東鬧非典（沙士），那裏要健康證，車票全被他們收走了。」  另一名受騙男子則說：「他（騙徒）說火車已經出事了，昨天晚上在東莞跟油罐車相碰了，炸掉了……」然後騙徒誘騙他改搭長途汽車，但車票又是假的。  一名山東中年女子受騙後抱着頭哭訴：「我爸死了，我想回去……」原來她被騙去了一張價值二百零三元的火車票，還被游說買了一張三百六十元的假長途巴士票。  另外，在深圳則出現假機票。受騙旅客在機場登機時突然被拒，才知道受騙。據稱，這些假機票的印刷雖然粗糙，但因為價錢便宜，還是有人中計，深圳當局近日已查獲數百張假機票，還發現不少機票代售公司，都是無牌經營。  中央電視台
20050127-143,20050127,143,妻掐下體痛醒植物人,妻掐下體痛醒植物人 四川一名民工墮樓昏迷，成為「植物人」後，妻子意外發現丈夫對她的撫摸有輕微反應，遂每天輕掐丈夫的下體、胸部及腋窩等敏感部位，一個月後終令丈夫甦醒。  四川廣安市鄰水縣村民楊建民，去年七月在成都一個地盤從四米多高處墮下，腦部受傷昏迷，變成「植物人」。其妻殷志容不辭勞苦，每天到醫院照料，有次替丈夫洗澡時，指甲無意間碰到楊建民的乳頭，發現他胸前的肌肉突然顫動了一下。  殷志容開始嘗試用手撫摸或輕掐丈夫最敏感的大腿內側、下體、乳頭和腋窩等部位，「刺激」丈夫的反應。至八月二十二日，殷志容把手伸進楊建民的被窩，輕掐他的敏感部位時，見丈夫的嘴角微微動了一下，隨即加重揑掐的力度。楊建民突然呻吟道：「痛……不要這樣子……」隨後緩緩地甦醒過來。  《現代家庭報》
20050127-144,20050127,144,台灣瓜子調味劑超標,台灣瓜子調味劑超標 台灣高雄縣衞生局抽查市面的年貨食品，發現當地知名品牌「盛香珍瓜子」等所含的人工調味劑超過標準，而「德利食品豬肉絲」的防腐劑含量超標七倍多，不宜食用。  高雄縣衞生局今次共抽查一百二十二件年貨食品，發現十二件不合格，包括「盛香珍瓜子」，所含的調味劑每公斤達二點八克，超過所容許的每公斤兩克標準；翁財記瓜子則未標示調味劑含量。  另外，深圳食品藥品監督管理局發現，廣東著名的「皇上皇」臘味存在衞生問題。  台灣《蘋果日報》/《南方日報》
20050127-145,20050127,145,婦超市偷奶粉被打死,婦超市偷奶粉被打死 廣東增城一家購物商場員工濫用私刑，涉嫌虐打一名偷奶粉的湖北女子。該女子事後被送往醫院，搶救了十九日，終因傷重不治。     職員用刑　鐵絲抽打   遭打死的三十二歲女子劉小蘭，是三個孩子的母親，上月十九日在增城新塘的英桂購物商場，偷取一包值價二十元的奶粉時，遭商場員工發現。劉隨後被帶上商場辦公室，遭人拳打腳踢，還用電線綑綁雙手，並用木板、鐵絲抽打頭和身體。  劉當夜被扔到商場後門，後被公安發現送往醫院急救，終因傷重不治。公安事後拘捕兩名涉案員工，並通緝當日下令用刑的商場經理。  《南方都市報》
20050127-146,20050127,146,公審「黃牛」,公審「黃牛」 遼寧瀋陽公安前日在火車站前舉行公審大會，大批涉嫌炒賣車票的「黃牛黨」一字排開，接受公審。  路透社
20050127-147,20050127,147,中共史專家：對趙不公必惹民憤,中共史專家：對趙不公必惹民憤 【本報訊】中共前總書記趙紫陽逝世至今，官方仍未還他一個公道。中共黨史專家、《晚年周恩來》一書作者高文謙警告，國家主席胡錦濤及總理溫家寶，應以毛澤東及鄧小平為鑑，在對趙紫陽的評價上，不要無視民意或鎮壓民意，否則將令中國陷入危機，個人也會遺臭萬年。     對趙評價不公將釀災難   目前在美國定居的高文謙，曾任「中共中央文獻研究室周恩來生平研究小組組長」。他接受多維新聞網訪問時表示，在評價趙紫陽的問題上，胡溫乃至中國政治都在一個十字路口。但在趙紫陽剛病逝時，胡、溫沒有把握時機，恢復趙紫陽的名譽，導致人心不滿，進退失據。這會重蹈毛、鄧死路，趙紫陽的後事處理不好，這筆帳不會記在鄧小平和江澤民的頭上，而是記在胡、溫的頭上。  高文謙說，毛澤東當年發動大躍進，結果造成嚴重災難。他為掩蓋錯誤，嚴厲打擊敢於發表真實意見的彭德懷，以後又迫害劉少奇，不斷以新錯誤掩蓋舊錯誤。鄧小平也是這樣，六四事件的導火線是胡耀邦逝世時對他的評價不公。人民要求糾正失誤，公正評價，但鄧不准許，激起民憤，最後釀成「六四」慘劇。  而趙紫陽的前智囊嚴家祺亦指出，中共如何評價趙紫陽，是關係到中國在二十一世紀的前途和命運的大問題，他呼籲胡溫尊重廣大民意，不要以鄧小平和江澤民的個人意見為依歸。
20050127-148,20050127,148,摯友：悼念壓不住,摯友：悼念壓不住 【本報訊】中共前總書記趙紫陽的病逝，繼續在中共黨內發酵。美國多維網昨日發表一名趙生前摯友、中共高幹的匿名信，痛批胡溫恐懼、退縮，大舉監控異見人士，但也敵不過全球悼念趙的活動。     匿名信嘲「當局恐懼了」   該封匿名信毫不留情地批評，中共當局不顧客觀事實、人心向背以及起碼的人情和禮節，在處理趙的葬禮一事上，繼續凌辱及誣衊趙。本來，只要中共肯作出讓步，還是有機會爭取得到人民和趙家人的諒解，但現在採取強硬立場，是不自量力，到頭來將自討苦吃。  他說：「當局恐懼了，退縮了。此刻它正在表演它的執政能力，展示它的堅定。它正在與時俱進地加強對悼念者的限制和控制，又逼迫一批記者出境。它以為，只要動用武裝的或便衣的暴力扼殺入口，靈堂無法出入，就可以高奏凱歌。」  匿名信還指出，中共無論做甚麼，也敵不過世界各地悼念趙紫陽的熱情。「靈堂已經完成了自己的歷史使命。她得到了國人的共鳴，港人的響應。東起紐約，西到巴黎，從極北的加拿大，到南方的澳洲，都傳來了知音的回聲。」
20050127-149,20050127,149,西方指監控漸失效,西方指監控漸失效 【本報訊】雖然趙紫陽的逝世在內地沒有引起軒然大波，但美國《華爾街日報》昨日一篇評論文章認為，儘管內地傳媒在事件中一直保持緘默，官方亦嚴格監控互聯網，但部份網民仍能在官方所設互聯網「防火牆」的「裂痕」中，得悉事件的一二，令中國領導層面臨一大難題。     互聯網成「民眾集結平台」   該篇題為《中國牆上的裂痕》的文章指出，趙紫陽上周逝世後，互聯網已成為「中國民眾集結、表達哀思以至挫折感的平台」。網民也發現，官方封殺網上消息極為嚴重。有網民留言稱，嘗試在網上搜尋有關趙紫陽的消息，但發現很多網址都不能打開：「我很困難才找到這個網站，但我細閱後很震驚，我對國家的未來感到很憂慮。」  文章指雖然當局努力架設網上的防火牆，防止內地網民看到「反動訊息」，「但裂痕已經開始出現。」  此外，美國《商業周刊》一篇評論指出，如果趙紫陽的死亡沒引發重大抗議，部份原因是許多民眾太忙於工作、消費和積累財富。自八九年以來中國人的平均收入增長了五倍，使得多數民眾甘於沉默。
20050127-150,20050127,150,趙五軍豆大的淚珠滾下來...,趙五軍豆大的淚珠滾下來... 【北京報道】昨天往趙府祭拜的人潮較少，但警戒依舊森嚴，趙的舊宅靠大馬路的一條巷子，停着一部坐着公安的車子，旁邊放了兩個「車輛改道」的紅色警告牌子，巷裏布滿了便衣公安，趙府所在的整條富強胡同，禁止車輛進出，據目擊者說有車子想要進入巷子時，更立刻被要求繞道。     便衣公安扣查訪客相機   前天由於有四名香港記者被公安扣留問話，連夜遣返香港，再稍早，有數名「政法大學」的學生買了花，要為「趙伯伯」致意，遭到公安拘留盤查，在「富強胡同」成為街坊談論的話題。  一位從台灣到北京擬往趙府致唁的人在大門口被兩名公安盤查，那人表明是從海外前來致意的，公安立刻再問：「和趙家人有甚麼關係？」那人回答：「朋友，來祭拜的。」幸好趙家人趕來解圍。公安表示：「先生，你還帶着相機呢，請把相機、背包全留在這。」訓練有素的便衣公安立刻看出來客外套鼓鼓的，藏了一部相機，立刻被「繳械」。 無人探望晚年與狗為伴   據那位台灣人士描述，大門進去後在院子左邊不遠便是趙的靈堂，約有五、六坪大（約二百平方呎）而已，是書房改的，趙的相片在正中央，四邊擺滿鮮花，只是經歷了一個禮拜，有些鮮花已漸凋零，靈堂旁擺滿了趙的相片，其中一幅是趙晚年和最疼愛的外孫女的合照，趙笑的非常開心，另外一幅趙晚年和他愛狗合照，也引人矚目。趙晚年部屬、親友不敢見他，陪伴最多的反而是他的愛狗，狗比趙早逝，據說趙非常傷心。  趙的兒子趙五軍趕過來答禮，對着要離開的那名弔唁人士說：「留個名字、地址吧，出殯時好通知你。」  被問及家中情況時，趙五軍低着頭說：「母親還不知道這事呢，她身體還好，我們就怕她知道這事受不了。」「那夫人可能不參加總書記的喪禮了？」弔唁人士追問。「不知道喲，還沒決定呢。」趙五軍搖着頭說。     「懷念不殺同胞的趙總書記」   這時，弔唁人士看到趙的兒子眼裏泛着淚水，弔唁人士隨即在禮簿上簽了名，發現禮簿上有資料的人數並不多。最後，他跟趙的兒子說：「我們是台灣來的，台灣同胞懷念不殺同胞的趙總書記。」這時趙的兒子眼中豆大的淚珠立刻滾了下來。  台灣《蘋果日報》供稿
20050127-151,20050127,151,台候任閣揆向北京示好謝長廷不強推「正名運動」,台候任閣揆向北京示好 謝長廷不強推「正名運動」 以政治手腕靈活稱譽台灣政壇的候任行政院長謝長廷，獲總統陳水扁委以重任後，隨即大打安定牌，向北京示好，宣稱不會強行推動台灣「正名運動」，即把政府機構和企業、學校名稱中的「中國」改為「台灣」。此舉相信有助紓緩北京對台灣當局快速推動台獨的憂慮，有助緩和兩岸關係。 台灣前總統李登輝近年致力推動台灣「正名制憲運動」，去年十二月立委選舉前，陳水扁總統為爭取台獨選民的支持，也大肆宣揚「正名運動」，聲稱在兩年內將台灣所有駐外辦事處、島內公營機構以至學校，刪掉原有的中國名稱，改名台灣，被北京狠批這是台獨言行，美國也認為此舉等同單方面改變台海現狀。結果，立法院選舉泛綠未能取得過半議席。  謝長廷接受台灣《中國時報》專訪時，透露了修訂台灣正名運動的政策取向。他強調，正名運動是運動，應該由社會來推動，若只有百分之三十的民意支持，政府就不能拿來做政策。他說，應讓台灣社會了解有甚麼困難需要改名，而非為改名而改名。     強調要符合多數人想法   他指出，行政院是一個政府機關，和立法院及社會運動團體不一樣，行政院基本上要做的是社會能形成共識的事，符合多數人的想法，「我們在做的事，是一百個人走一步的事，不是一個人走一百步的事」。  謝長廷強調，安定內閣由行政院做起，包括陳水扁在內的政府高層，都會謹言慎行，不要在不適當的時間講出不適當的話，未來推動法案時，將安排民生法案優先，民生法案中也是無爭議的優先，有爭議的、政治性的放在後面。  謝長廷指出，台灣現在最大的問題是信心流失，「沒有信心，甚麼東西都不相信時，坦白講會活不下去」，謝長廷並強調，陳水扁以及新內閣均要累積人民對制度的信心。  本報記者
20050127-152,20050127,152,曾認一中　推動互訪,曾認一中　推動互訪 號稱「南霸王」的謝長廷，其實政治手腕相當靈活。二○○○年六月當選民進黨主席後，謝長廷全力推動兩岸市長互訪，並獲大陸積極回應，後因陳水扁政府反對才被腰斬。  謝長廷當時就兩岸問題強調：「台灣與大陸仍為同一個國家領土的基礎並未改變。」時任廈門市長的朱亞衍隨即邀請謝長廷訪問廈門。在台灣行政院退回謝的申請後，謝反過來邀請朱訪問高雄，朱亦接受邀請，準備訪台，但又被行政院否決。  謝長廷甫接任行政院長，又決定修訂「台灣正名」運動，此舉或許會令一直奉行「一個中國」原則的北京稍稍放心，不再時時搬出對待陳水扁的強硬態度，有助兩岸關係緩和。  本報記者
20050127-153,20050127,153,國務院暗示　不歡迎台官坐包機,國務院暗示　不歡迎台官坐包機 台海兩岸本周六將恢復中斷了五十多年的客機直航，但北京昨日強調，兩岸關係仍然嚴峻，兩岸業界協商春節包機，不等於兩岸恢復會談，北京並反對台灣主管兩岸事務的官員以及半官方機構人員，乘搭包機前往大陸。  國務院台灣辦公室發言人李維一昨在例行記者會上表示，今年的春節包機，由兩岸航空業界推動，是一種務實的安排，是為了滿足台胞回鄉探親的需要，並不意味兩岸的商談和協商已經恢復，也不會成為為今後兩岸就其他事務商談的模式。  李維一強調，春節包機是為了方便台胞回鄉，因此不應出現政治干擾。他暗示，不歡迎台灣陸委會或海基會的人員，搭乘包機前往大陸。     斥陳水扁搞《反吞併法》   另外，兩岸春節包機啟航前夕，適逢前國家主席江澤民對台講話（即「江八點」）發表十周年，李維一表示，北京隆重其事，明日將在人民大會堂舉行紀念活動，屆時中央領導人將發表重要講話。他並批評，台灣總統陳水扁威脅針對大陸《反分裂國家法》而制訂《反吞併法》，這是台獨分裂行徑，全體中華兒女是堅決反對的。  新華社
20050127-154,20050127,154,布殊矢言　常提醒中國改善人權,布殊矢言　常提醒中國改善人權 美國總統布殊在華府時間周三矢言，將會向中國和俄羅斯施壓，促使兩國推動自由化。他會「時常提醒」中國領導人改善人權，同時亦將就民主改革問題向俄羅斯總統普京施壓。  布殊說：「在將來與中國領導人的會晤中，我會時常提醒他們，一個尊重人民、尊重人權及人民尊嚴的社會所帶來的好處。」  布殊在記者會上表示，他上周發表的就職演說中，承諾在全球推動自由化，他會在推動自由化及發展與中俄這兩個強國的外交關係中取得平衡。  法新社
