key,date,article_daily_id,title,text
20050127-0,20050127,0,指請假期間沉迷「商業活動」國家跳水隊怒炒田亮,指請假期間沉迷「商業活動」 國家跳水隊怒炒田亮 【本報訊】奧運跳水金牌得主、「跳水王子」田亮，昨日突然失去國家跳水隊員資格，國家體育總局批評他違反隊紀隊規，私自與娛樂公司簽約，過多從事商業活動，體育總局並宣布決定不保留其國家隊員資格。田亮對此發表公開信，稱感到震驚。本港體育學者則指事件反映共產國家仍視金牌運動員是為國爭光的「國家財產」，難以容忍運動員過人化、明星化的行為。　記者：羅偉光 目前在西安訓練的田亮昨接受新華社訪問時坦言心情很難受，一時很難接受失去國家隊員資格的事實，但強調不會放棄訓練，即使不在國家隊受訓，還會盡一切努力歸隊，目標是○八年北京奧運會。  昨日早上曾致電聯絡田亮的內地網站搜狐體育則形容，田亮聲調顯得情緒低落；田亮下午向傳媒發出公開信，亦表示體育總局決定令他震驚，感到特別傷心及難過，但在信中沒有辯解當局對他的批評，僅表示「在經紀人和英皇這件事情上，我曾經多次向游泳中心滙報和溝通。」     違規與娛樂公司簽約   田亮與郭晶晶被視為中國跳水隊金童玉女，但田亮在公開信中表示，不希望外界把郭晶晶能重返國家隊事件與他比較，並指出兩人經歷最根本的分別是郭的教練一直留在國家隊，而他的教練張挺卻「不知何種原因，自從雅典奧運會後也被國家隊拒之門外」，他希望能與張挺同返國家隊。  游泳運動管理中心主任李樺昨在記者會上嚴厲批評田亮，指他在雅典奧運後以身體原因請假半年，卻頻繁參加商業活動，當中一些更是沒有經游泳中心同意，又違反體育總局規定找經理人及私自與娛樂公司簽約，故決定暫時不保留田亮的國家隊員資格，但他強調這次不是除名或開除。 李樺強調當局不反對運動員從事商業活動，但必須遵守三點要求，不影響訓練、比賽；必須獲中心批准、同意；以及適度，他說明星運動員適當從事商業活動也是回報社會的一種方式，也是對明星個人價值的肯定，李樺稱，曾就這些問題多次與田亮談話，並與田所屬的陝西跳水隊召開專題會議商討，雖經領導多次批評，但沒有收到預期效果，他指田的所作所為對跳水隊備戰○八奧運帶來不良影響。  李樺昨日稱國家隊永遠對優秀運動員開放，有實力的選手能遵守規章制度，服從國家隊的管理，國家隊的大門就永遠敞開，游泳運動管理中心跳水部主任李大正則不願回應田亮何時能歸隊。田亮的教練張挺昨亦接受新華社訪問，他認為田亮應把事件當成一次教訓。     個人化行為觸怒領導   本港公民教育委員會製作的《心繫家國》國歌短片有田亮與郭晶晶去年訪港片段，港府發言人稱是否刪剪片段，需由該會決定；而中國游泳代表團三十五名代表明日抵港，會先後在港澳進行為期五天慈善表演，田亮不會隨團來港。  浸會大學體育學系副教授雷雄德稱，田亮事件反映共產國家仍有國家級金牌運動員為「國家財產」的觀念，他說雖然國內體育運動已非常商業化，但一些體育政策領導人可能觀念傳統，故田亮明星化、個人化的行為觸怒一些人，因此失去資格並不出奇。香港體育學院精英培訓及康體發展總監長鍾伯光指出，田亮過多參加商業活動，可能會對國家隊紀律造成不良影響，他認為國家隊決定正確。
20050127-1,20050127,1,缺運動員經理人成導火線,缺運動員經理人成導火線 「跳水王子」田亮憑一副俊朗臉孔，加上在跳水活動上的輝煌成就，○○年悉尼奧運揚名後瞬即成為廣告明星，Amway更委任他為中港地區的商品代言人，而去年雅典奧運後，中港的品牌贊助亦蜂擁而至。可是，由於國家體委欠缺為精英運動員安排像外國一樣的經理人制度，致令田亮在安排比賽訓練及商業活動上失了分寸，引發今次事件。     在美國源遠流長   在美國體壇，商業與體育活動掛鈎源遠流長，其中最成功的例子，莫過於已退休的NBA巨星佐敦，他一面方在籃球場上爭取到六屆總冠軍戰績，在商界亦長袖善舞，與Nike的廣告合作更成為商業神話。另一位成功人物是同為Nike高爾夫球代言人的「老虎仔」活士，他近兩年成績雖然下降，但在商業上的成就卻有增無減，去年收益更突破八千萬美元。  至於與田亮同在希臘奧運奪金的國家田徑跨欄名將劉翔，在奧運後同樣成為廣告的火熱寵兒，狂熱程度不亞於田亮，但劉翔並沒有失控，反而在處理白沙集團煙草廣告方面十分恰當，知道拍香煙廣告有損國家選手形象，不但叫停該廣告，還「醒目地」提早在傳媒面前復操，如此舉動，與田亮沉迷紙醉金迷的明星夢有天壤之別。 當然，外國亦有經典的失敗例子，八八年漢城奧運加拿大飛人賓莊遜因被驗出服食禁藥，弄至身敗名裂。另一位失敗名將則是NBA巨星拜恩，他○三年捲入一宗強姦醜聞，案件纏擾他兩年，直至去年才正式被判無罪，但拜恩形象已嚴重受損，最大贊助商Nike以他名命的籃球鞋臨時抽起，至今未見曙光，意大利ferrero名牌朱古力及麥當勞更不與他續約。     專人助平衡心理   體壇名將一旦棋差一着，失去的遠比在運動場上所失的更多。田亮今次雖然犯錯，但國家體委有考慮過安排精英運動員經理人制度嗎？巨星佐敦、活士均有經理人公司協助他們安排日常比賽、訓練及商業活動；中國健兒的身心平衡也需要專人協助，在拜金魔鬼誘惑下，走上如賓莊遜、拜恩的失敗之路，是國家損失大，還是田亮損失大？  本報記者
20050127-2,20050127,2,扶助失業適得其反,扶助失業適得其反 尹慧詩 董建華在第八份施政報告中，以不少篇幅講及如何改善經濟發展，獅子山學會歡迎見到董先生終於明白「扶貧紓困、共建和諧社會」的治本方法是發展經濟，增加就業機會。但諷刺的是，雖然董先生在施政報告中，已承認失業問題最嚴重的，是低技術低學歷的一群，但亦同時提到可能設立最低工資和最高工時，反映董先生始終未能大膽抗拒民粹的干預市場訴求。  最低工資及最高工時可謂天下間最美麗的謊言。最低工資設立後，僱主聘用低技術人士的成本增加了，令低技術低學歷的一群失業問題惡化。與此同時，很多小企業為了公司的存活，亦會被迫開除那些低技術低生產力的員工，令本來有工作的都被迫加入失業大軍。至於那些還能留下的，會比以前好嗎？在現時的營商環境，無論大小企業都只剩個位百分點的盈利，最低工資的惡政令企業無利可圖，僱員更加不用升職加薪。  至於最高工時方面，根據邊際遞減定律，邊際產量最終會減少，但如何量度在何時邊際產量才等於零，是一個極艱深的問題。歌星的最高工時一定與文員不同，那麼政府要設立多少種不同的最高工時才足夠？政府又如何監察？若政府接納設立最低工資和最高工時的建議，唯一從中得益的只有工會幹事，讓他們又可在失業率上升後再多添一些成員。 施政報告中另一重大方向是發展所謂文化及創意產業。繼科網中藥物流後，董先生又再雄心壯志，定立以其所謂文化及創意產業為新經濟增長點。雖然創意產業在不少外國經濟轉型中，的確能推動經濟再上一層樓，但在香港能否達到相同效果，仍是未知之數。  其實創意產業在香港絕非新事，但礙於本地文化獨特性及市場局限性，而營運成本卻跟隨大圍環境不斷上升，加上大陸封閉；香港創意產業由於未能打進這個人口最多文化最相近的市場，故一直苟延殘喘。董先生建議的只是配套上的支援，亦忘記了發展創意產業最重要的是人才。  董先生想幫助的低技術低學歷的一群，應不會因為發展所謂的文化及創意產業得益，而畢業失業的一群亦不會受惠於此政策。在現今中央計劃式的教育制度下，學生都成為考試奴隸。香港學生的特色是盲目追求表面成績，除了考試卷的知識一概不理，每逢考試後便急速失憶。雖然仍有少數學生修讀關於創造及媒體的科目，但內容始終流於表面技術，而且修讀藝術科目的學生逐年減少。當所謂的人才只懂背誦，藝術修養卻乏善足陳，空殼地發展文化及創意產業，大談發展創意產業何嘗不是國王的新衣？  在未來兩年任期內，董先生何不貫徹香港一向積極不干預的作風，留待市場自行調節，自己則慢慢細心觀賞市場的威力？  ……………………………………………………  作者為獅子山學會傳訊小組成員
20050127-3,20050127,3,九倉電訊後勤北遷　兩地協調出問題申請電話五個月未安裝,九倉電訊後勤北遷　兩地協調出問題 申請電話五個月未安裝 九倉電訊近月將後勤遷往內地，出現協調困難，有商業機構申請其固網電話服務，近五個月仍未能成功接駁，令其生意大受影響，最終需要轉向其他電訊商申請安裝固網電話。 去年八月申請九倉電訊商業固網電話服務的何先生憶述，職員當時承諾可於十至十四天內啟用兩條電話線，其後九倉電訊職員為其安排裝線，但安裝後卻不能通話；九倉電訊職員翌日回覆稱當天傍晚應可啟用。然而，兩天後電話線仍未能運作，九倉電訊職員又稱至少再等九天才能啟用。     投訴被推來推去   何先生大感無奈，惟有「慢慢等待」，惟九天後電話仍未能開通，他再致電九倉電訊查詢，卻又被多個部門「推來推去」，不但未能確定接駁電話線日期，其中更有職員稱「冇收過你紀錄」。  何先生向電訊管理局投訴後，九倉電訊始承諾三至四天後可接駁，其後又稱因「後勤搬咗上廣州、協調出誤會」，電話暫無法使用。他說，九倉電訊建議他先向電訊盈科申請兩條專線，再接駁到九倉電訊的固網網絡，費用九倉電訊全數負責。     接駁後號碼又錯   他別無他選，只想公司盡快有電話可用，遂按九倉電訊職員指示，申請電訊盈科的專線服務，並隨即辦理轉線安排、將線路接駁到九倉電訊，終於十月中完成轉線，但他所揀選的電話號碼，與九倉電訊分配給他的並不相同，致造成混亂；最終仍不能成功轉線。 未代付費被追數   「好離譜！電話係用嚟做生意，足足搞咗四個幾月；損失幾多都計唔到！提供唔到服務，竟要客人申請其他電訊商網絡；搞完一大輪，又搞錯號碼；最後重俾電訊盈科追數，邊有咁嘅服務㗎！」  直斥九倉電訊行政混亂的何先生不滿地道，由於他曾向電訊盈科申請專線，九倉電訊雖承諾負擔有關費用，但其間他卻不斷被電訊盈科追收費用；他向九倉電訊反映，職員卻又要求他先行繳費，待九倉電訊成功轉線後始退還有關款項。何先生感求助無門，遂向本報反映。     技術問題致阻延   九倉電訊有限公司函覆時承認，有關申請因技術性問題而受到阻延，該公司已即時通知何先生有關情況及提供其他可行方案及建議，務使他能盡快使用服務；事件相信乃跟進過程中出現溝通誤會。  至於何謂「後勤」工作，九倉電訊發言人則謂難以三言兩語作解釋，一般是指公司的物流工作，包括定單的跟進程序等。  發言人強調，已安排退款予何先生，他對安排亦表示滿意。  （一二二三○三四）    服務熱線  電話：29908288  傳真：23702192  電郵： sservice@appledaily.com 
20050127-4,20050127,4,西樓角路運輸交匯處空氣濁,西樓角路運輸交匯處空氣濁 荃灣西樓角路荃灣多層停車場大廈地下公共運輸交滙處，有候車乘客投訴空氣混濁侷促，令人不適，希望有關部門改善。  「個交滙處除咗有市區同新界的士站，重有專線小巴站，啲車停喺度等客嗰陣，排啲廢氣出嚟，加上嗰度樓底唔高，搞到空氣好侷促，令人唔舒服，希望負責嘅政府部門關注吓！」     運輸署負責監測   環保署跟進本報轉介投訴後回覆稱，上址屬半封閉式公共運輸交滙處，運作及空氣質素監測，均由運輸署負責，環保署已將投訴轉介運輸署跟進。  運輸署回覆本報查詢稱，根據紀錄，上址公共運輸交滙處空氣質素，符合環保署指引；不過，運輸署會定期監察有蓋公共運輸交滙處內空氣質素，以免市民受影響。  （一二一四○八○）    服務熱線  電話：29908288  傳真：23702192  電郵： sservice@appledaily.com 
20050127-5,20050127,5,浙江街擺滿布疋阻路人,浙江街擺滿布疋阻路人 土瓜灣海心公園及露天停車場之間一段浙江街，被附近店舖擺放大批布疋，令行人路有如布疋倉庫，停車場使用者投訴，布疋造成阻塞，且若意外塌下，易令途人受傷。  「嗰度成條路好似貨倉咁，擺滿晒布，好阻塞，有啲重叠到好高，如果啲布叠得唔好、或唔覺意碰撞到塌落嚟，就好易整親人，我哋去停車場攞車嗰陣都要步步為營，希望政府部門快啲去取締。」     佔五分之四通道   記者現場所見，上址為通往停車場的必經之路，大量布疋放置於行人路上，佔了五分之四空間，行人途經甚為不便。  本報已將投訴轉介予食物環境衞生署跟進，現正跟進處理中。  （一一二二○○一）    服務熱線  電話：29908288  傳真：23702192  電郵： sservice@appledaily.com 
20050127-6,20050127,6,打工仔與老闆產前檢查病假可獲津貼,打工仔與老闆 產前檢查病假可獲津貼 本欄是勞工處與《蘋果日報》合辦，逢星期四刊出，旨在為勞資雙方解釋有關僱傭問題，如僱主或僱員有任何疑問，可致電勞工處查詢。 查詢熱線：27171771 此熱線會由「1823政府熱線」職員接聽。 秘書小姐：喂，恭喜恭喜，恭喜你有喜。  會計太太：多謝多謝！我本來都好開心，但係醫生話我有少少作小產，叫我休息多啲同密啲覆診。唉！唔使做咩！我邊有咁多假成日去睇醫生？  秘書小姐：喂，唔係噃，你去做檢查係當病假計㗎噃。  會計太太：但係《僱傭條例》寫明，要唔少過連續四日嘅病假先可以攞津貼。做檢查要做成四日，大吉利是咩！  秘書小姐：唏，條例有另外寫明，懷孕僱員因為產前檢查、產後治療或者小產而缺勤嘅每一日，如果有適當嘅醫生證明書，就可以當病假計，可以有相等於正常工資五分之四嘅疾病津貼，唔使連續四日或以上。咁當然，你都要儲到足夠嘅病假數目先啦。  會計太太：唔，成日攞假好似唔係幾好咁。  秘書小姐：咪儍啦，醫生叫得你覆診，就即係有需要啦。如果你為咗咁唔去睇醫生，到時真係出事要放長病假，公司損失咪重大。話時話喇，你通知咗老闆未㗎？  會計太太：未呀。  秘書小姐：你快啲遞醫生證明書通知老闆啦。《僱傭條例》下嘅生育保障係由你遞咗醫生證明書之後至生效㗎。你都要畀時間老闆去安排人手㗎嘛。  以上資料只用作說明《僱傭條例》下的相關條文，對有關法例的詮釋，應以《僱傭條例》原文為依據。如有任何爭議，則以法院的判決為最後依歸。  資料提供：勞工處勞資協商促進科 服務熱線  電話：29908288  傳真：23702192  電郵： sservice@appledaily.com 
20050127-7,20050127,7,濕地公園發現　漁護署緊急應變奪命紅火蟻殺入天水圍,濕地公園發現　漁護署緊急應變 奪命紅火蟻殺入天水圍 【本報訊】肆虐美國，澳紐以至中、台兩地，毒素可令人休克致命的紅火蟻懷疑已入侵本港，漁農自然護理署人員昨日在天水圍濕地公園保育區發現七至八個疑似紅火蟻的蟻巢，每個可育出八萬至五十萬隻紅火蟻。保育區離民居只有半公里至一公里，鄰近天恒邨、天逸邨及嘉湖山莊的居民驚聞紅火蟻入侵均感到十分憂慮，漁護署並成立特別專責組負責滅蟻，並將樣本送到內地及外國作進一步化驗。　記者：張嘉雯、蔡朗清 在發現疑似紅火蟻後，漁農自然護理署昨日訂出緊急應變方案，並即時成立專責小組，並動員三百名人員在一星期內巡查全港郊野公園及檢查所有農圃，追蹤紅火蟻的蹤迹，又要求各政府部門密切監管轄下植物的情況。該署強調，暫時未有資料顯示郊野公園受紅火蟻影響，故不會封鎖本地郊野公園設施。     每個蟻丘相隔八米   漁護署副署長劉善鵬昨在記者會表示，昨日接近中午時段，該署巡邏人員在天水圍濕地公園發現七至八個疑似紅火蟻蟻丘，每個相隔七至八米，高度不逾十厘米，經化驗後發現蟻樣本的腰柄明顯分為兩節、棒後腹呈黑色，符合紅火蟻的特徵，已將此列入疑似個案。  該署高級農業發展主任劉紹基表示，本港約有二百多個螞蟻品種，但全部品種均不會建蟻丘，故初步相信是次發現的蟻丘屬紅火蟻；他補充指，紅火蟻的蟻丘一般高約十至三十厘米，今次發現的蟻丘較矮，故需要將有關樣本寄往內地、日本及英國核實，未知何時有結果。劉紹基又指，天水圍濕地公園是新近建成，公園內的植物也在最近栽種，故即使是次發現的確實為紅火蟻，也屬於初期繁殖。 劉紹基表示，紅火蟻屬家蟻科，可爬行八至九米，其中蟻后在分巢時更會飛行至少七至八米，他相信紅火蟻一般不會爬進樓宇，但會跟隨植物「入屋」。截至昨晚，漁護署已清除濕地公園內的四個蟻丘，該署不願評估紅火蟻入侵的嚴重性，又強調不清楚紅火蟻的來源，只表示部份栽種的植物來自內地及台灣。  被問及漁護署是否因內地及台灣發現紅火蟻後才加緊留意紅火蟻，劉紹基沒有正面回應，只指紅火蟻的蟻丘與掘路的痕迹相似，不易發現。     周六開放日將如期   天水圍濕地公園原定於周六舉辦的開放日將如期舉行。劉善鵬表示，濕地公園未全面完工，保育區離遊人遊覽的區域有一定距離，又指保育區屬政府範圍，一般巿民不會到達。  距離濕地公園只有半公里的居民均對紅火蟻入侵表示憂慮。有居民表示，由於屋苑附近的公園及草地均有不少螞蟻，小朋友均愛到公園玩耍，巿民也不懂分辨紅火蟻和一般螞蟻。
20050127-8,20050127,8,專家指三月為擴散期,專家指三月為擴散期 【本報訊】香港大學生態學及生物多樣性學系助理教授侯智恒表示，美國於六十年前曾受紅火蟻「入侵」，問題至今仍未解決。他指，三月份是紅火蟻最易擴散時期，故港府在三月底前應做好預防措施，包括多與內地溝通，了解紅火蟻的擴散情況。  侯智恒解釋，紅火蟻通常在蟻丘非常「擠迫」時，蟻丘中的蟻后才會帶領一批工蟻，在落雨時飛離原本的蟻丘，尋找另一合適地方建巢；因此他相信在天水圍發現的懷疑紅火蟻，是由陸路「入境」。  立法會食物安全及環境衞生委員會主席李華明表示，當局須加強巡查各區，防止紅火蟻在本港「落地生根」。但由於年關在即，若實施禁令會嚴重影響年花生意，故暫未需全面禁止內地植物入口。
20050127-9,20050127,9,尚餘數個蟻巢　今日繼續清剿蟻后一死蟻群自動滅亡,尚餘數個蟻巢　今日繼續清剿 蟻后一死蟻群自動滅亡 【本報訊】漁農自然護理署昨日發現疑似紅火蟻昆蟲，在毒蟻襲擊本港陰影下，漁護署人員不敢輕視，立即召喚專業滅蟲公司派出專人到天水圍濕地公園剿滅螞蟻，但由於天色開始入黑，尚餘三至四個蟻巢未被搗毀，螻蟻可偷生多一日，漁護署稱今日會繼續滅蟻行動，並強調只要殺死蟻后，便可輕易把螞蟻徹底殲滅。     搜集殺蟲水資料   漁農自然護理署高級農業發展主任劉紹基昨在記者會上表示，員工昨日巡邏時發現懷疑紅火蟻蹤迹後，該署已即時召來專業滅蟲公司到場滅蟻，他說對付紅火蟻並不困難，滅蟲人員會先把覆蓋蟻巢的泥土翻開，再把殺蟲水直接噴入蟻巢便大功告成。  劉紹基又說，使用普通殺蟲水已可殺死紅火蟻，為方便日後更有效率滅蟻，該署正搜集各地殺蟲水資料，找出哪種殺蟻水最有效對付紅火蟻。  劉紹基稱滅蟲人員昨日已剿滅了三、四個蟻巢，由於天色已轉黑，故滅蟲人員今天才會繼續滅蟻工作，預計今天內可完成滅蟻任務。     獨蟻后長有翅膀   自言並非昆蟲專家的劉紹基坦言，有關紅火蟻的資料全是在近兩日研究文獻得知，他表示滅蟻首先殺死蟻后，因一窩蟻中只有蟻后有繁殖能力，而蟻后每隔約半年便可分巢，若蟻后被殺，其他蟻因沒有繁殖能力便會自動滅亡。漁護署人員昨日發現七至八個蟻巢，估計在濕地公園該區範圍內，可能有多隻蟻后存在。  根據資料，紅火蟻蟻巢分單蟻后型及多蟻后型兩種，前者蟻巢內螞蟻數目由五萬隻至二十四萬隻不等，後者的蟻巢內螞蟻數目可高達五十萬隻，而紅火蟻后通常藏於蟻巢較深處，平時不易看到，蟻后有翅膀，體形較工蟻大，胸部較厚膨脹，腹部亦較長較大。
20050127-10,20050127,10,疑栽種植物時帶入公園,疑栽種植物時帶入公園 【本報訊】天水圍濕地公園昨發現疑似紅火蟻，漁護署表示暫時未知蟻群來源，但相信是早前在保育區栽種植物時帶入公園，不排除疑似紅火蟻來自中國；署方會加強對內地輸港的年花及盆栽消毒，以及在羅湖口岸抽查攜帶盆栽入境的人士。     加強檢疫輸港年花   漁護署高級農業發展主任劉紹基昨日在記者會上表示，暫時未知道疑似紅火蟻的來源地，不排除來自中國或其他地方的可能性。  由於今次發現疑似紅火蟻的天水圍濕地保育區，剛栽種了植物，故有可能是栽種有關植物時一併將疑似紅火蟻帶來濕地公園。他說，為了防止紅火蟻從外地傳入香港，署方會在打鼓嶺特別處理區加強對內地輸港的年花及盆栽進行消毒。對有個別人士帶盆栽經羅湖口岸入境，署方即日起加強抽查，並呼籲巿民不要再帶盆栽來港。  九鐵昨日則表示十分關注廣東省發現紅火蟻事件，已要求職員提醒乘客，不可以攜帶任何盆栽或帶有泥土的植物進入九鐵範圍，以確保他人享有安全及舒適的旅程。乘客如果被發現違規，九鐵職員會拒絕有關乘客入閘，或要求乘客下車或離開鐵路範圍。
20050127-11,20050127,11,市民紛要求漁護署鑑別,市民紛要求漁護署鑑別 【本報訊】市民近日對螞蟻蹤影特別敏感，紛紛拍下螞蟻照片交漁農自然護理署，要求鑑別紅火蟻是否已殺到香港，但經辨認後確定均是本地常見的紅樹蟻或本地火蟻。  漁護署官員昨解釋，紅樹蟻與紅火蟻最大分別，是紅樹蟻的巢築在樹上，而紅火蟻的巢則在地上，紅樹蟻無腰節，紅火蟻則有，從市民提供的照片辨認，市民發現的大部份為紅樹蟻，雖會咬人，但不會致命。 不過官員又指，本地火蟻與紅火蟻在外觀上更易混淆，因為兩種蟻腰柄均有兩分節，要識別兩者，最簡單可從是否有蟻丘分辨，紅火蟻會把巢築成蟻丘狀，本地火蟻則沒有蟻丘。此外，紅火蟻額前有三隻小齒，本地火蟻額前則只有兩隻，紅火蟻顎骨有四隻小齒，本地火蟻顎骨則有三至五隻，紅火蟻棒後腹黑色，本地火蟻棒後腹則為啡色。
