key,date,article_daily_id,title,text
20050827-0,20050827,0,斬殘稚童　人神共憤賢仔，全城祝福你,斬殘稚童　人神共憤 賢仔，全城祝福你 【本報訊】梨木樹七歲男童岑浩賢身上被斬的八處刀傷，彷彿砍在全城市民心上。岑浩賢前日被兩名冷血兇徒斬至重傷，社會齊聲譴責行兇者喪盡天良；行政長官曾蔭權更以「人神共憤」形容案情。躺在病床上的賢仔，目前傷勢嚴重，牽動滿城憂心與關心，企盼無辜小童早日康復。　記者：蔡元貴、黃學潤、吳國威 賢仔目前在仁濟醫院接受治療，雖沒有生命危險，但情況嚴重。醫生說，賢仔的右前臂有六處刀傷、右腿兩處刀傷，其中手腕肌腱及肌肉也斷開，估計要幾年才可完全康復。負責調查的探員形容，賢仔很「硬淨」，情緒已逐漸穩定，將會有心理醫生跟進觀察。  全城緝兇，全民送暖。昨日不斷有熱心市民前往醫院慰問受傷的賢仔，花籃、玩具、糖果堆滿病房。下午五時許，市民葉太帶同她的五歲女兒來到，想探望賢仔，葉太並不認識賢仔，只是閱報得知事件，十分同情賢仔的遭遇，便與女兒同來探望。五歲的小女兒買了一副玩具送給賢仔，她們買玩具時，玩具店東主得知事件，更託葉太給他多送一副積木給賢仔。 有市民想懸紅緝兇 葉太是基督徒，她和女兒昨日為賢仔祈禱祝福，望他早日出院。兩母女本想當面鼓勵賢仔，但由於賢仔傷勢仍嚴重，不宜其他人進入病房，葉太只好放下禮物。昨日送上花籃的，還有仁濟醫院董事局、荃灣民政事務處及民主黨主席李永達等。  有市民則想捐錢緝兇，本報昨日接獲多名熱心市民來電，表示想懸紅。任職貿易公司的陳小姐受老闆所託，表示懸紅五萬元賞金，希望能盡快把兇手捉拿歸案。任職錄音師的林先生也表示願意捐出一萬元，「用來緝兇又好，幫助個細路又好，希望可以做小小嘢。」他說，兇案完全不可思議，兇手十分可恥。 周潤發：感到心痛 演藝界也紛紛聲討兇徒，並關注賢仔傷勢。周潤發、黎明、陳慧琳及楊千嬅都捐出善款幫助賢仔度過難關。周潤發對冷血兇案感到心痛，陳慧琳直言覺得毛骨悚然，擔心遭遇會對賢仔造成深遠的心靈創傷。劉德華則願望伸出援手，協助賢仔日後生活所需。  行政長官曾蔭權則以「人神共憤」形容兇案，並對事件表示「震驚、心痛和憤怒」，他說：「我知道小朋友目前嘅情況雖然有好轉，但依然十分嚴重，我希望佢能夠盡早康復，相信香港市民都會為佢祝福。」他表示，社會福利署於昨日上午已聯絡了賢仔的家人，並會提供他們需要的幫助。  曾蔭權說，警務處處長李明逵昨早已向他滙報了緝兇的最新進展，並且向他保證一定會盡全力將兇徒繩之於法，「我一定唔會容忍這種兇殘嘅行為喺我哋社會發生，而香港市民亦希望我哋唔會畀兇徒逍遙法外。」曾蔭權呼籲，目擊案件發生的市民，將他們看到的、聽到的盡快告訴警方，「我對警方緝拿兇徒嘅能力好有信心，加上市民協助，兇手一定走唔甩。」 特首送上兒童書籍 他又派代表昨傍晚到醫院給賢仔送上一張親筆簽署的慰問卡，並寫上「祝願您早日康復」，又送了三本書給賢仔：《小朋友想知的世界大發明》、《小朋友想知的十萬個為甚麼》和《放眼大自然》，都是圖文並茂的兒童書籍。  「小朋友一定要堅強頂住！」互聯網的時事討論區，賢仔成為網民的焦點。網民都以不同表達方式為賢仔祝禱，在「民主論壇」的其中一則留言說：「希望老天爺俾一個機會這個小朋友，如果個小朋友手腳有甚麼事，變成傷殘，真係好陰功。」  在傍晚的商業電台節目《左右大局》上，有市民致電表示擔心賢仔傷勢，並要求警方盡快懸紅緝兇。李先生說：「我唔理你曾蔭權又好、李明逵又好，政府應該第一時間懸紅，再遲啲做就冇用，到時兇手都着咗草啦。」
20050827-1,20050827,1,愛心抗兇殘　捐款助賢仔,愛心抗兇殘　捐款助賢仔 【本報訊】賢仔遇襲引起全城憤慨及同情，除了繼續有市民願意私人懸紅，緝拿兇徒歸案外，社會人士及本報亦分別成立基金，作為懸紅及賢仔日後的醫療、學習及生活費之用。 再有市民願懸紅緝兇 其中一個由商業電台聯絡社會人士成立的基金，市民可以將捐款存入恒生銀行戶口：767－1005424，戶口名稱為：香港耆康老人福利會。至於本報援助基金，市民則可以用支票寄交本報，支票抬頭為：「蘋果日報有限公司」。  另外，一名致電本報懸紅一萬元緝兇的錄音師林先生，直斥事件「天理不容」。他說：「俗語謂『禍不及妻兒』。大人做錯甚麼事，也不應該連累家人，特別是一個只得七歲、毫無反抗能力的小童。」他又說：「喺香港發生啲咁嘅事，實在難以置信、不可思議。」並指事件對男童心理和身體造成極大影響。  另外，一名貿易公司東主亦表示，願意懸紅五萬元緝兇。
20050827-2,20050827,2,蘋果專項基金捐助賢仔,蘋果專項基金捐助賢仔 七歲的賢仔無辜被斬重傷，引起公憤，讀者主動聯絡本報捐款援助賢仔，包括支援賢仔日後的醫療、學習、生活費用及懸紅。《蘋果日報》即時成立「岑浩賢援助基金」及管理委員會，收集讀者捐款。 讀者可用信用卡過數（見附表），或用支票寄交：將軍澳工業邨西駿盈街八號蘋果日報有限公司，支票抬頭請寫：「蘋果日報有限公司」，所收捐款將會全數交律師行託管，基金管理委員會將研究捐款的各項用途比例。  市民如能提供有關兇案線索，請致電26318437，與新界南總警區重案組聯絡。
20050827-3,20050827,3,周日籲少吃魚　昨說日食290公斤才有事周一嶽改口風被轟「靠害」,周日籲少吃魚　昨說日食290公斤才有事 周一嶽改口風被轟「靠害」 【本報訊】衞生福利及食物局局長周一嶽說了一句「食少啲魚」，即時癱瘓本港的淡水魚業；但他昨日在立法會特別會議上卻突然大改口風，替其言論「降溫」，指平均每人每日要進食近二百九十公斤問題淡水魚，並要經過長期攝取，才會引致不良健康後果，所以呼籲巿民安心食魚。有魚販直斥周一嶽出爾反爾及「靠害」，更要求周辭職，以紓民憤。　記者：張嘉雯、陸羽平 周一嶽於本月二十一日公佈本港出售的淡水魚部份含有致癌物孔雀石綠，提醒巿民小心選擇，若仍有疑慮，可以「食少啲」，遂令本港淡水魚業過去一周生意慘淡。政府昨刊登憲報，把孔雀石綠納入《2005年食物內有害物質（修訂）規例》內，禁止所有食物含孔雀石綠；違反法例者，最高會被罰款五萬元和監禁六個月。  立法會食物安全及環境衞生委員會昨日舉行特別會議，周一嶽在會上稱，由於內地及本港加強監管，加上問題淡水魚所含的孔雀石綠水平，「不大可能」對人體構成不良影響，故市民可放心食用，「𠵱家淡水魚比起香港過去幾個月嚟講，一定安全好多，所以一定可以安心食用。」至晚上，衞福局突以新聞稿公布，每人每日進食近二百九十公斤的問題淡水魚，或超過七公斤鰻魚或其製品，才會對人體有不良影響。 「二百九十公斤論好過份」 代表漁農界的立法會議員黃容根批評，周一嶽早前的言論是「出口術」，令業界添上「無形枷鎖」，「局長叫唔好食，市民真係唔食淡水魚，出咗問題，我唔係怪你，你做得好快，但快得嚟你用說話嚟影響咗。」周一嶽解釋，其說法基於證據，「你話我叫人唔好食淡水魚，我可以話，我冇講過呢句說話，我只係叫人考慮清楚，暫時唔好食。」  該委員會主席李華明其後接受查詢時稱，周一嶽的「二百九十公斤論好過份」，「咁之前禁嚟做乜呀？咁安全做乜要禁呢？」  旺角花園街街市內合和海鮮檔主潘先生怒斥周一嶽的言論「害死」全港魚販，要求周辭職以息民憤，「如果唔係佢叫人食少啲淡水魚，都唔會搞成咁啦。」潘一臉無奈地說，每天虧蝕千多元，現在連水、電費恐怕也負擔不了，更遑論還要交租，「罷巿就冇用㗎喇，叫周一嶽辭職啦！」  另一攤檔森記海鮮的負責人王先生也對周一嶽恨之入骨，「𠵱家好似打完你一棍，又再打多你一棍，然後講句Sorry，你會唔會唔記得？」 百噸合格淡水魚等候運港 周一嶽稱，已成立由他親自領導的跨部門工作小組，日後由內地輸港的淡水魚，只會由八十八間註冊的養魚場供應，衞福局會盡快列出合規格養魚場的名稱及數目，以便業界參考，並接納議員建議，研究同時抽取魚及魚塘水化驗；深圳已有逾一百噸經檢驗合規格的淡水魚等候運往香港。食物環境衞生署署長梁永立下周到廣州、深圳及珠海，進一步跟進食用魚的安全監管。  周一嶽在會後被問到是否擔心失言會影響其民望，他未有正面回應，只說希望給巿民清晰的訊息，讓大家作出明智選擇。  此外，民建聯昨在立法會門外請願，要求設立中港兩地直接點對點的食物安全通報機制。
20050827-4,20050827,4,經營困難魚檔望政府免租,經營困難魚檔望政府免租 受到毒魚事件影響，魚販連日來生意均大受影響，叫苦連天；部份在政府轄下街市經營魚檔的檔主更盼政府體諒業界經營困難，免卻他們的租金。香港新界養魚協進會理事長黎來就則表示，暫時未決定會否罷巿，業界今早會舉行會議，確定進一步行動；而港九新界海外漁業批發商商會理事長許漢文亦稱，魚巿場今日會如常交收。  記者昨在旺角花園街街市所見，淡水魚檔鮮有市民光顧，顯得十分冷清。合和海鮮檔主潘先生說，五日前購入的十多條鯇魚及大魚至今仍未售清，即使將內地簽發的入口證明展示出來，也對銷情毫無幫助，部份不新鮮的魚已當作垃圾丟棄。他希望政府體恤業界經營困難，免卻其租金。森記海鮮負責人王先生稱，連日來買入的魚「死的死、倒的倒」，已虧蝕近五萬元，即使政府賠錢亦彌補不到其損失。  街市內售賣鹹水魚的魚販也指生意下跌。經營十多年魚檔生意的好姐說，很多市民根本不懂分辨鹹水魚及淡水魚，總之凡是魚即避之則吉，令生意跌近一半。 強調不考慮賠償 周一嶽昨在立法會特別會議上稱，現階段無考慮向業界作任何賠償，也不會提供免租、免息貸款等優惠，只承諾會將業界的「辛苦期」縮短，「因為用公帑，要同庫務局了解，了解業界嘅理據。」對於立法會議員張宇仁擔心政府昨日刊憲禁止在本港出售的食物中含有孔雀石綠後，業界隨時誤墮法網，周一嶽說：「佢哋都可能好無辜，我哋會小心檢控，但係立咗法就一定要執行，唔會草率。」  黎來就認為，周的言論不負責任，又擔心法例通過後隨時無辜受檢控，「佢自己又唔檢查入嚟嘅魚有無毒，應該要負責任……我哋賣魚，都唔知佢響邊度落藥，半途落咗咁點呀？」  本報記者
20050827-5,20050827,5,中港交換豬鏈球菌基因資料,中港交換豬鏈球菌基因資料 【本報訊】內地四川爆發人類感染豬鏈球菌已告一段落，港府早前要求取得內地患者的鏈球菌基因排列資料，有助分析本港與內地個案是否有關連。衞生署衞生防護中心總監梁栢賢透露，本港最近已獲內地有關的基因資料，而本港也同時把本地個案的基因資料，交予內地作研究。  梁栢賢說，兩地交流有關豬鏈球菌的基因排列資料，本港可以對照近期在本地出現的個案，與內地的豬鏈球菌是否有分別，有助了解內地的豬鏈球菌是否已在本港出現。 成功研發快速檢測 此外，北京檢驗檢疫局和中國獸醫製品監察所，成功研發豬鏈球菌快速檢測技術，昨在北京通過專家組鑑定。  新方法只要一個半小時即可完成測試，較傳統方法需時三至七日為快，新測試法更可克服樣本易受污染問題，不但用於活豬檢測，更可用於豬肉及相關產品。
20050827-6,20050827,6,本港斑疹傷寒個案急升,本港斑疹傷寒個案急升 【本報訊】斑疹傷寒個案有持續上升趨勢，上月本港有五宗個案，包括一名男子感染由跳蚤傳播的城市斑疹傷寒，以及四名曾到郊外或行山者感染叢林斑疹傷寒，今年首七個月累積患者人數達十七人，較去年同期上升逾倍，醫生提醒市民要注意環境衞生及郊遊時宜使用驅蚊劑。 與衞生及氣候有關 衞生署衞生防護中心昨公布七月的傳染病數目，上月有五宗斑疹傷寒個案，包括一名二十八歲居於將軍澳的男子，在六月十五日出現發燒、肌肉痛、無力等病徵，在將軍澳醫院治療後康復。該中心調查後發現患者間中會到調景嶺一個公共屋邨的街市，但未能證實是否在該處染病。  其餘四宗全部為叢林斑疹傷寒，四名患者年齡介乎四十二至六十歲，分別於六月二十日至七月二十日期間出現病徵，全部入院，治療後康復。該中心發言人稱，患者均曾到郊區，如行山及在戶外擔當剪草工作。  本港今年的斑疹傷寒呈報個案急升，至七月已有十七宗，較去年同期只有八宗上升逾倍，更逼近去年全年十八宗的總數，而過去數年每年個案由四至十四宗不等。香港大學微生物學系助理教授黃世賢說，個案上升或與環境衞生變差或氣候轉變有關。  他指出，城市斑疹傷寒主要由在老鼠身上的跳蚤傳播，跳蚤糞便中帶有致病的立克次氏體細菌，故此病與老鼠數量有關，市民應注意環境衞生。叢林斑疹傷寒則由蟎的幼蟲傳播，市民到郊外宜用驅蚊劑。  此外，七月份也有十五宗麻疹個案，患者包括十名由內地來港兒童。昨日本港又再有一宗由菲律賓傳入的登革熱，令今年已有十四宗外地染病個案。
20050827-7,20050827,7,回收含西藥成份消腩丸,回收含西藥成份消腩丸 【本報訊】衞生署昨日公布即時回收名為「瘦身丹──消腩丸」的減肥產品，該產品含有西藥「西布曲明」，是衞生署本月第三宗發現健康食品含西藥成份。醫學界人士指出，「西布曲明」（Sibutramine）可引致血壓上升，心血管病人不宜服用。 53瓶已流入市面 衞生署指出，暫未接獲有市民服食「瘦身丹──消腩丸」後不適的報告，署方已指令入口商從市面回收產品。發言人指，進口商名為永盛保健食物有限公司，該公司稱在六月入了一批貨，共八百三十多瓶，在藥房售賣，署方在公司回收七百七十八瓶，所以在市面須回收的數量相信只是五十三瓶。  發言人又表示，本月進行健康食品抽驗時購買了該產品進行化驗，結果顯示產品含有西藥「西布曲明」，屬於藥劑製品類附表三的毒藥，必須在醫生處方及藥劑師的監督下發售。  購買了該產品市民，可於辦公時間內把產品交予衞生署藥劑事務部位於九龍南昌街382號公共衞生檢測中心三樓的辦事處，衞生署已設立熱線23192839；亦可把產品交回入口商，電話24116776。 心血管病患不宜 香港醫院藥劑師學會藥物教育資源中心教育總監崔俊明指出，「西布曲明」是有效的減肥西藥，能抑製食慾，減除腰部及肩膊的脂肪特別有效，但患心血管病人士不宜服用，而服藥三個月後若不能減少百分之五體重亦要停服，因此需經醫生處方服用。
20050827-8,20050827,8,中央借抗日紀念　再為曾蔭權撐腰特首下周上京料見領導人,中央借抗日紀念　再為曾蔭權撐腰 特首下周上京料見領導人 【本報訊】中央再以行動表態支持特首曾蔭權，港府昨日宣布曾蔭權獲邀到北京出席官方舉辦的抗戰勝利六十周年活動。預料曾蔭權屆時將與中央領導人見面，有親北京政界人士估計，中央可能會借機正式公布國家副主席曾慶紅九月初訪港出席香港迪士尼樂園開幕禮。有民主派人士也說，最近有中方官員私下向他們了解，若民主派有機會與曾慶紅見面，會否有激烈示威行動，更特別關心「長毛」梁國雄到時會否搞事。　記者：莫劍弦 政府昨日宣布曾蔭權獲國務院邀請，將於下周五訪京，出席紀念中國人民抗日戰爭暨世界反法西斯戰爭勝利六十周年大會及多項慶祝活動，於九月四日（周日）返港，特首辦發言人稱，曾訪京期間會出席文藝晚會及酒會，暫未有安排與領導人見面。  有親北京政界人士透露，中央會在短期內正式公布國家副主席曾慶紅來港主持香港迪士尼樂園開幕禮，他估計中央可能會借機向曾送禮，等他與中央官員見面後宣布曾慶紅接受邀請來港的消息，顯示中央對曾蔭權支持。 憂長毛令曾慶紅尷尬 曾蔭權昨未有評論港澳辦常務副主任陳佐洱近日秘密來港，是否和曾慶紅來港有關，只說港澳辦高級官員來港舉行工作會議，是經常有的事，特區政府現正盡力爭取國家領導人來港出席迪士尼開幕禮，也一直努力爭取立法會議員和中央官員接觸。  有民主派人士透露，最近不少內地官員私下來港約見，了解若曾慶紅訪港時與民主派見面，民主派會否有激烈請願示威行動，該民主派人士稱，他感到北京對曾慶紅與民主派見面方式舉棋不定，且對與民主派立法會議員、甚至全體議員見面仍有顧慮，擔心如「長毛」梁國雄等借機示威，令曾慶紅尷尬。 領導人不應怕見示威 民建聯主席馬力接受商台訪問時，也贊成曾慶紅與民主派議員見面，若到時有人示威，港人自會評價，「到時會有（電視）直播，大家會判斷到。」民主黨副主席何俊仁表示，民主黨若有機會和領導人見面，不會有任何示威行動，他又認為曾慶紅作為大國領導人，應有信心及胸襟面對示威請願，民主黨也不會強求一定要和曾見面。  香港科技大學社會科學部助理教授馬嶽認為，任何大國元首，無論在本國或外國出席公開活動，都會面對示威抗議，曾慶紅若果想顯示他開明一面，應無懼面對民主派任何示威活動。
20050827-9,20050827,9,為免影響民主派團結前線決定不退出民陣,為免影響民主派團結 前線決定不退出民陣 【本報訊】政治團體前綫昨晚召開執委會，討論是否退出民間人權陣線，由於民陣一直是民主派政黨及民間團體合作主要平台，前綫執委會對應否退出民陣意見分歧，支持及反對陣營展開激烈辯論，結果支持留在民陣的意見勝出，執委會在毋須表決下，通過繼續保留在民陣會籍。  據了解昨晚前綫執委會會議中，對是否退出民陣花了很多時間討論，支持及反對兩派進行激烈辯論，其中前綫秘書長陶君行及部份身兼民陣成員的執委強烈反對前綫退出，認為民陣是不同民主派團體合作的平台，縱使對個別問題有不同看法，也不應退出，以免影響民主派之間團結，但有個別支持退出的執委認為，既然大家在理念上有分歧，毋須一定要留在民陣中。 民陣表示歡迎 民陣前任副召集人孔令瑜認為前綫留在民陣是好事，事實上在三次7.1遊行中，前綫都扮演積極角色，貢獻良多，她認為前綫今次有意退出民陣，事前沒有任何徵兆，若前綫覺得在理念問題上有不同，大家可以再討論。  民陣召集人莊耀洸則表示歡迎前綫決定保留民陣會籍。民陣早前更新成員團體登記，在九月截止前，包括前綫在內近十多個團體未有回覆，民陣即時將截止日期押後到十一月，並接觸有關團體了解。據知前綫退出的主要導火線，是前綫成員甄燊港反對民陣在今年7.1遊行以同志團體帶頭，事後甄的言論遭民陣內部強烈批評，並要求前綫派代表向民陣解釋，但前綫未有理會。
20050827-10,20050827,10,民意調查：半數人指中港合作不足,民意調查： 半數人指中港合作不足 【本報訊】近期有關食物安全風波，暴露中港兩地溝通不足問題，新世紀論壇於八月十一至二十一日期間，成功訪問一千二百六十二名市民，調查顯示，近五成被訪者認為，特區與內地合作並不足夠，有需要改善；認為兩地合作已足夠的僅佔四成二。 反對公務員做特首 調查亦顯示，有四成七被訪者不同意日後特區由公務員出任行政長官，認為應該的則近三成七。高逾七成一被訪者認為，特區應培養更多政治人才，為未來管治作好部署。 七成人冀施政進取 至於對施政報告的期望，近七成被訪者認為施政報告應該進取一點，為本港未來發展做好長遠規劃。  一成六被訪者則指，施政報告應貼近現實，集中處理具影響性的問題。另有不足百分之五被訪者指，施政報告應主力維持特區現狀，「甚麼也不應做」。
20050827-11,20050827,11,接駁肌腱鋼針固定骨折處,接駁肌腱鋼針固定骨折處 【本報訊】前晚遭兇徒狂斬右手重傷的七歲童賢仔，主診的仁濟醫院矯形及創傷科部門主管韋玉良醫生指，賢仔右手傷勢雖已動手術接駁斷裂肌腱及肌肉，並以鋼針固定骨折傷處，不過院方暫未能確定其右手喪失功能的程度，但相信賢仔日後更可能出現「長短手」後遺症。 心理學家跟進輔導 沙田仁安醫院骨科顧問醫生龍衍輝拒絕評論事件，但指手腕聚集大量神經線、控制手指活動肌腱，若同一組肌腱、神經線及骨骼遭多次刀傷重創，即使手術能接駁肌腱，惟手指活動能力或受創，更嚴重是可能傷及骨骨后板（epiphysis）影響骨骼生長。  韋玉良醫生昨午向傳媒講述賢仔傷勢時稱，賢仔心理狀況穩定，由臨床心理學家跟進輔導。他指賢仔右手所中六刀，以手腕兩處刀傷最嚴重，肌腱、肌肉齊遭斬斷及出現骨折；至於其大腿傷勢僅屬皮外傷。  他補充，事發當晚賢仔送院即時進行三小時手術，成功接駁斷裂肌腱、肌肉及骨骼。同時醫生在手術中已替賢仔在右手傷處安裝鋼針固定傷勢，不排除賢仔可能出現傷口發炎及黏結等後遺症，估計起碼要數年才康復，日後更可能需施手術取出鋼針。他指出，賢仔送院時失血情況並不嚴重，稱讚事發時現場急救做得好，令賢仔減少出血情況，他強調，以當時情況而言，若兇徒要行兇取命，賢仔恐怕已性命不保。
20050827-12,20050827,12,劉慧卿爭連任財委主席,劉慧卿爭連任財委主席 【本報訊】政界盛傳特區政府有意將立法會現任財務委員會主席、前綫劉慧卿「拉下馬」，改由親政府議員接任。劉慧卿昨天發出聲明，指她出任主席期間進行多項改革，令財委會工作得以流暢進行，對政府不欲自己連任感到「不是味兒」，呼籲各黨派繼續支持自己出任主席。  被指將獲推舉接替劉慧卿的泛聯盟成員劉秀成稱，迄今未收到任何邀請；至於會否支持劉續任，泛聯盟未作討論。  民建聯副主席譚耀宗亦指，該黨暫時未就財委會主席人選進行任何討論，因此未作任何決定。
20050827-13,20050827,13,觀塘區議會景田區補選,觀塘區議會景田區補選 【本報訊】選舉事務處昨天宣布，觀塘區議會景田選區，將在十月二十三日進行補選，以填補前觀塘區議員吳重德，因騙取公帑被囚十八個月而出現的議席空缺。有意參選者可於九月八日至二十一日提名期間內，向選舉事務處遞交參選表格。  據了解，親政府陣營與民主派均對有關議席虎視眈眈，親政府陣營有意支持地區工作經驗豐富、現任匯景花園業主委員會主席的張順華披甲上陣。  民主派則屬意由現任民主黨立法會議員李華明再戰江湖，穩住九龍東地盤。
20050827-14,20050827,14,促撤秘密監察行政命令,促撤秘密監察行政命令 【本報訊】多名民主黨成員昨天帶同橫額到政府總部請願（圖），要求特首曾蔭權從速撤回有關秘密監察的行政命令。民主黨批評行政命令繞過立法程序，更不滿當局事先未向法律界進行諮詢，建議當局就此進行緊急立法，正當地規管執法部門的秘密監察行為，妥善保障人權。  黃賢創攝
