key,date,article_daily_id,title,text
20050416-0,20050416,0,路政署文書助理涉利用入境處漏洞滋擾女上司2300次,路政署文書助理涉利用入境處漏洞 滋擾女上司2300次 【本報訊】路政署一名文書助理，與女上司素有積怨，他涉利用入境處智能身份證換領熱線不會核實預約人士身份證號碼的漏洞，將上司的辦公室直線電話當作申請者的傳真號碼申報，助理既令上司不斷接到只有「嘟嘟」聲響的傳真來電，又可減輕在入境處工作的女友工作量，令兩人可透過電話聊天，女上司在四個多月間接獲多達二千三百次滋擾電話，助理昨在法庭被控以一項不斷打電話和十項刑事損毀罪。　記者：戴國輝 二十七歲被告鄧志倫，沒有刑事紀錄，報稱任職路政署文書助理。被告姓于女友在入境事務處工作，負責替智能身份證申請者拍照及打指模，她與母親及被告母親即「未來家姑」昨日同到法庭支持被告。     被告與女友擬十月結婚   辯方大律師透露，被告與女友決定本年十月擺酒結婚，律師坦言已叮嚀被告切勿過於樂觀，被告能否擺酒視乎被告會否失去自由。被告承認失當，嘗試就其所作所為向其上司致歉，惟上司不接納。  被告否認一項不斷打電話及十項刑事損毀罪，案件昨日在九龍城裁判法院開審。控罪指被告去年五月五日至八月五日不斷打電話，旨在對其上司張德美構成煩擾及不便，及自去年四月至八月，十度破壞入境處的電腦系統。  入境處發言人指案件尚未審結，現階段不宜評論智能身份證預約熱線是否有漏洞而遭人利用犯案。  控方沒有傳召證人出庭作證，僅倚靠控辯雙方同意的案情舉證。案情指出，入境事務處提供智能身份證二十四小時電話熱線，供預約人士使用，預約人士只須提供身份證號碼便可，處方不會核對預約人士身份證號碼的真偽，所有資料都輸進入境處位於灣仔入境大樓的電腦伺服器內。 一天裏曾收50神秘來電   被告上司為路政署助理文書主任，她與被告素有積怨，自去年二月起不斷收到奇怪電話，聽筒內傳來如傳真機般發出的「嘟嘟」聲，起初每天只有三十多個神秘電話，最嚴重時每日高達五十個。  案情續指，至去年五月，被告上司轉用另一個電話直線號碼，她仍不斷收到神秘電話。至七月尾，上司將直線電話接駁至傳真機，便不斷收到來自入境處有關智能身份證換領計劃電話預約服務的傳真，僅七月二十九日、八月三日及五日三天，上司便收到十八張傳真。  原來被告冒充預約人士，自去年四月起胡亂報上身份證號碼，並將上司的電話直線號碼當作預約人士的傳真機號碼。直至八月九日，被告向其他路政署高層承認，他為了作弄上司才犯案，他上班時利用辦公室枱頭電話致電預約熱線，即使放工回家後，他仍會利用住所電話犯案。  事件東窗事發，警方拘捕被告，被告在警誡下承認因工作太沉悶犯案，被告又指他的女友在入境事務處工作，負責為申請者拍照及打指模。被告犯案令大批預約人士沒有出現，其女友便較閒暇，能花更多時間與被告透過電話聊天。警方拘捕被告後，他的上司再沒有接到神秘電話。  裁判官陳錦昌裁定被告十一項控罪表證成立，被告需要就所有控罪答辯，被告選擇不作供，沒有辯方證人，案件押後至本月二十九日裁決，被告獲准保釋外出。  案件編號：KCCC13300/04
20050416-1,20050416,1,李華明申領回鄉卡　北上晤喬曉陽司徒華：選擇性邀請志在分化,李華明申領回鄉卡　北上晤喬曉陽 司徒華：選擇性邀請志在分化 【本報訊】民主黨中常委羅致光證實，他也獲邀下周四北上深圳，出席由人大常委會副秘書長喬曉陽主持的釋法座談會，他將會再申請回鄉卡。另一獲邀的民主黨成員李華明預料下周三便可以領取回鄉卡。  民主黨這次共有六名黨員受邀請，當中更首次包括核心中常委成員，不過，支聯會系統的黨員仍被摒諸門外，民主黨黨鞭司徒華指出，這次不是突破而是做戲，中央選擇性邀請民主黨成員只是要分化該黨。 補領原因被迫選「遺失」   羅致光一直是民主黨主流派核心，曾擔任立法會議員多年，他去年八月隨社會福利界訪問團到上海時被沒收回鄉證，即時被遣返本港。有黨內人士稱，李華明和羅致光大有機會取得可以多次往返內地的回鄉卡，獲邀的六名黨員代表了民主黨不同系統，包括主流派、匯點派及區議員，相信黨內非支聯會系統的人士，例如主席李永達、前主席李柱銘、楊森及涂謹申等，都有望逐步取得回鄉卡。  羅致光接受查詢時表示，這次是向民主黨一名中常委發還回鄉卡，可說是放寬了對該黨的態度，他將會再申請回鄉卡，希望可以獲發還回鄉卡。  李華明表示，昨晨到了中旅社辦理申請手續，職員着他不要排隊，直接辦理補領手續及繳付五百六十元補領費，並告訴他下周三可取回證件。由於表格沒有列出「回鄉證被沒收」這一選項，被問及補領原因，李華明只能選擇「遺失」一欄。  有民主黨內人士分析，過往民主黨的中常委，甚至是中委都會被列入沒收回鄉證的黑名單，中央此舉是希望在署理特首曾蔭權掌權的新局勢下，與民主黨逐漸建立關係，透過溝通減少社會上的爭議，創造和諧的環境。     受邀請者不應沾沾自喜   不過，司徒華持不同看法。被問及這次是否民主黨與中央關係的突破，司徒華表示：「突乜破？以前喺香港都有請啦，有咁嘅揀擇又點叫突破？係做戲。」  司徒華說，中央選擇性邀請肯定有分化作用，受邀請的人不應沾沾自喜，赴深圳時應盡力表達民主黨的意見。
20050416-2,20050416,2,候選人辭公職應避免於官邸晤選委,候選人辭公職應避免於官邸晤選委 【本報訊】選舉管理委員會昨公布特首選舉活動指引。選管會主席胡國興指出，主要官員一定要先辭職才可參選，若該候選人辭職後仍住在官邸，就應該避免利用官邸與選舉委員會成員會面，由於特首選舉經費上限達九百五十萬元，相信候選人不會因要在酒店與選委見面或要與選委出外飲茶，而令選舉支出超出上限。  現時住在政務司司長官邸的署理特首曾蔭權大有機會參選特首。被問及候選人可否用官邸見選委，胡國興立刻反問說：「辭咗職點用官邸？」當記者告訴他，有關官員可享有兩個月的搬家期，胡表示：「實情唔使（用官邸見面），你可以去出面飲茶，可以去酒店，你有成九百五十萬選舉經費。」 若有競爭點票時不唱票   與○二年的選舉指引比較，新的選舉指引較大改動是可容許候選人自由參與選舉無關的節目，屆時平等時間原則不適用，也不會計算選舉經費。胡表示，這安排是為了平衡言論自由及選舉公平，「如果講邊隻奶粉好，咁有乜關係？點解唔可以講奶粉？講太太生仔？」  對於有外界批評落選區議員仍擔任代表區議會的選委，胡國興指由於正式選民登記冊已公布，選管會無權剔除名單內的名字，所以那些選委仍有資格提名候選人及投票，但由於選舉指引規定，若選委不再與有關界別有密切聯繫便會喪失資格，可能有人會利用這點在選舉後提出選舉呈請，這些選民投票前或需要徵詢法律意見。胡國興又表示，若這次選舉有競爭，點票時不會像首屆選舉般唱票。
20050416-3,20050416,3,港大學生：法制淪為政治工具,港大學生：法制淪為政治工具 【本報訊】港府就新特首任期提請全國人大常委會釋法，惹來社會廣泛非議。有大學生代表昨日批評，人大釋法損害本港法治，令本港引以為傲的法制淪為政治工具。  香港大學學生會昨舉辦題為「釋即是空？」的論壇，該會外務副會長謝智衡批評「基本法已經清楚講明特首嘅任期係五年，咁係咪重要人大釋法呢？……釋法唔符合市民意願，特區政府有責任作為市民同中央政府嘅橋樑，但𠵱家就偏重咗喺中央嗰邊。」他強調，身為學生都非常擔心人大釋法損害本港法治。     學聯指林瑞麟「耍」學生   一名法律系學生在台下發言時也指摘政府，「司法制度係用嚟確保行政權唔會被濫用，𠵱家政府尋求人大釋法，就係將佢嘅決定加諸於司法制度上，令本港嘅法制變成政治工具。」  此外，香港專上學生聯會及七間大專院校學生會代表昨就○七普選與政制事務局局長林瑞麟會面。  學聯發言人陳嘉俊在會後表示，林瑞麟在會上重申○七普選已遭人大否決，又指增加選委會成員數目不符人大常委會規定。陳嘉俊指摘林瑞麟提出樣板答案，只是「耍」學生，令人感到失望。  該會早前與七間大專院校進行校園全民投票，結果以大比數通過○七年普選特首。  該會將約見署理特首曾蔭權及去信中央反映意見，並會參與下周二舉行的法律界黑衣沉默遊行。
20050416-4,20050416,4,與港澳辦主任廖暉會面曾蔭權拒到立會內會解畫,與港澳辦主任廖暉會面 曾蔭權拒到立會內會解畫 【本報訊】立法會內務委員會主席劉健儀較早前去信署理特首曾蔭權，要求他出席內會滙報與國務院港澳辦主任廖暉會面的詳情，但曾蔭權昨日去信劉健儀，指會面內容已透過傳媒向公眾交代，所以他不會到內會解釋，議員若有問題可在本月二十八日的答問大會上提出。  曾蔭權稱，他擔任政務司司長以來，經常與中央部門就重要事宜交換意見，上月與廖暉在深圳見面也是慣常安排，當時他滙報說，董建華辭職後香港一切如常，政府運作暢順，他又提及延長政制發展的諮詢期至下月底。
20050416-5,20050416,5,問責官離職後工作規範彭鍵基法官任諮委會主席,問責官離職後工作規範 彭鍵基法官任諮委會主席 【本報訊】由前任特首董建華落實的高官問責制，直至他辭職仍未制訂問責高官離職後的工作規範。  署理特首曾蔭權昨日宣布成立問責制主要官員離職後工作諮詢委員會，委任高等法院原訟庭彭鍵基法官為主席，港大副校長李焯芬以及中信泰富董事總經理范鴻齡為委員，委員任期為兩年。  職權範圍包括訂立原則和標準、為前任問責制主要官員離職後的工作安排提出意見；以及根據所採納的原則和標準，就前任主要官員的工作安排作出研究。
20050416-6,20050416,6,補選特首任期首日聆訊陳偉業不必承擔政府訟費,補選特首任期首日聆訊 陳偉業不必承擔政府訟費 【本報訊】立法會議員陳偉業就補選特首的任期是兩年抑或五年，向高等法院申請司法覆核，本周三獲受理後，原定昨日開庭處理訴訟費問題，但因雙方達成協議，聆訊取消，主審法官夏正民昨在庭上按協議內容，下令陳不必承擔今年五月十日首日聆訊及之前的訴訟費，並指協議合理之至。  陳偉業早前以案件涉及公眾利益，事關重大，要求法庭預先下令，即使他敗訴，也不必承擔港府的訴訟費，當時法官對此有保留，認為若人大釋法對陳不利，陳仍堅持訴訟，便不能豁免堂費。  案件編號：HCAL36/05
20050416-7,20050416,7,促查東主有否非法轉移資產海洋皇宮明結業員工報警,促查東主有否非法轉移資產 海洋皇宮明結業員工報警 【本報訊】海洋皇宮大酒樓夜總會拖欠二百多名員工遣散費的糾紛升級。四十多名員工昨向警方報案，要求警方調查酒樓東主有否非法轉移資產；港府也加速研究修例，堵塞破產欠薪保障基金易被濫用的漏洞。而酒樓副總經理張永新的父親張耀榮昨透露，張永新連同多名股東兩年前，僅以約三十五萬元購入該資不抵債的酒樓，他又強調自己只佔一股股份，「講緊嘅（遣散）責任都只係一萬蚊」。　記者：譚暉、盧文烈、林社炳 近日備受員工指摘的張耀榮昨日向本報表示，○三年海洋皇宮大酒樓因為資不抵債而被破產管理署接手，其子張永新與多名股東其後以約三十五萬元購入，但就要承擔原有的大筆債項。張耀榮承認，三十五萬的購入價算頗低廉，但如早知業主將於兩年後中止租約，這筆投資也不化算。     張耀榮：只佔一股   他否認自己曾是酒樓的大股東，並希望酒樓員工別針對他：「我只得一股股份，根本冇話事權」；他指，整間公司有五百多股，他只佔五百分之一，「如果要清還嘅遣散費係五百幾萬，咁我講緊嘅責任都只係一萬蚊」。  雖然酒樓將於明日正式結業，但員工們昨日仍如常工作。四十多名員工則連同立法會議員李卓人，拉起橫額遊行到灣仔警察總部報警，要求調查酒樓東主有否私自轉移資產。     警商罪科表示關注   參與遊行的員工沿途高呼口號，抗議酒樓股東濫用破欠基金。員工又將於周一向張耀榮進行抗議。  警方發言人表示，商業罪案調查科已向員工解釋，由於酒樓仍然營業，暫未看到有刑事成份，但商罪科對事件十分關注。  由勞工處、商罪科、破產管理署及法律援助署組成的跨部門打擊濫用破欠基金小組，將於下周召開特別會議研究海洋皇宮事件有無涉及詐騙成份。 政府：此風不可長   經濟發展及勞工局常任秘書長張建宗批評，僱主如企圖將支付工資及遣散費的責任轉移破欠基金是不負責任、不合情、不合理的做法，「此風不可長」，如果海洋皇宮大酒樓涉嫌欺詐，或非法轉移資產，處方會交商罪科調查。另外，勞工處已設立兩條熱線電話21506397及29286006，向受影響員工提供就業及僱員權益的服務，並將於下周一替員工進行登記，協助他們申請破欠。  破欠基金委員會成員李漢城認為有必要加速修例，他無奈地說，「明知呢單嘢係俾人搵笨，冇辦法都要按法例賠畀員工」。工聯會則要求勞工處加快發放破欠基金程序，讓員工在五周內取得款項。
20050416-8,20050416,8,發食肆牌擬考慮申請人背景,發食肆牌擬考慮申請人背景 【本報訊】海洋皇宮大酒樓夜總會公然逃避支付僱員遣散費，惹來全城嘩然。經濟發展及勞工局常任秘書長張建宗透露，正考慮各種堵塞濫用破產欠薪保障基金的建議，包括研究要求中式食肆開業時繳交保證金，以及成立食肆「黑名單」等。有破欠委員會成員建議飲食業成立賠償基金，處理食肆倒閉後的員工欠薪問題。  破欠基金委員會主席何世柱表示，稍後計劃向食物環境衞生署及酒牌局提交飲食業黑名單，若一些食肆倒閉後，短期內又重新開業，會要求有關當局參考這些紀錄，作為審批發牌的考慮條件之一。     促業界自設賠償基金   衞生福利及食物局局長周一嶽認為，酒樓東主在結業後拖欠員工遣散費，然後再於另一地點開新店，是不道德的行為，從道義上，他贊成將這類僱主列入黑名單，作為日後審批發牌的參考，但法律上做不到，不過若情況嚴重，不排除日後修例。  食環署副署長李麗儀則說，正研究是否可以仿效發酒牌的做法，在發食肆牌時，考慮申請人背景。  破欠基金委員會成員李漢城批評，海洋皇宮蓄意拖欠遣散費令人憤怒，建議飲食業界自行成立賠償基金，專責處理食肆結業後僱員被拖欠薪金的問題，「無理由拖埋其他行業落水」。
20050416-9,20050416,9,積金局：一萬僱主常欠供,積金局：一萬僱主常欠供 【本報訊】強積金管理局去年收到九千三百三十九宗投訴，超過八成來自飲食、建造、清潔和保安四個行業；該局發現本港約有一萬名僱主有經常拖欠供款紀錄，當中百分之六屬蓄意拖欠，大部份是中小型企業，拖欠供款期最長超過十個月，局方今年會主力嚴打長期拖欠供款的無良僱主。     「部份東主令人厭惡」   積金局執行董事（執法部）李樹榮承認，部份酒樓東主違規行為令人感到厭惡，當中包括有僱主透過經常轉換公司，以逃避強積金供款，去年至今該局就曾向七名蓄意拖欠僱員供款的酒樓董事，提出刑事檢控。  該局高級經理賴偉昌透露，該局調查發現本港約有一萬名僱主有經常拖欠供款紀錄，當中百分之六屬蓄意拖欠，該局今年除會申請法庭執達主任，抄封違法僱主的資產外，又會針對持有物業的欠款僱主，向法院申請押記令。李樹榮稱，去年該局成功追討五成一僱員被拖欠的供款，較○三年的四成二為多，被追款的公司多在中途已結業。
20050416-10,20050416,10,家長：港樂園開幕後　帶子女去見識迪士尼巡迴表演深圳熱爆,家長：港樂園開幕後　帶子女去見識 迪士尼巡迴表演深圳熱爆 【本報訊】深圳消息：「香港迪士尼樂園巡迴路演」昨日首天在深圳展開活動，吸引大批小朋友參與，部份家長表示準備在九月香港迪士尼開幕後，盡快攜子女到港見識，而國慶長假期更是來港首選時間。  「好得意呀！」很多小朋友看到心儀的迪士尼樂園偶像出現，無不歡喜雀躍大叫。該批卡通偶像包括米奇老鼠、米奇的女友米妮老鼠、唐老鴨、高飛等。     數百人提早霸位   今次的路演首站將一連三日在深圳羅湖萬象城舉行，每日五場，每場半小時，在下午一時展開的第一場之前，早已有數百名觀眾聞訊趕至霸位，塞滿整個演出場地，甚至有家長特意替年幼子女向學校請假，目的是讓子女滿足如迪士尼宣傳所言的「奇妙之旅」。  在主角米奇老鼠帶領下，眾卡通人物在舞台上隨音樂節拍載歌載舞，由於節目介紹和電腦遊戲攤位以普通話和簡體字為主，小朋友玩得很投入。  任職教師的葉女士稱，她一向有買迪士尼的英文教材指導現年八歲的兒子，所以兒子對迪士尼的卡通人物非常熟悉和有親切感，她打算在香港迪士尼樂園開幕後，帶兒子親臨夢幻樂園體會歡樂的一刻，更希望能預訂到樂園內酒店房間。     旅行社代辦行程   從事家具業的姜先生，一家三口對路演節目讚不絕口，三歲半的女兒很喜歡米奇老鼠和唐老鴨，姜先生說計劃在十月一日國慶長假期來港玩數天。  不少旅行社負責人稱，如果自由行旅客來到香港才發覺買不到門票或住不到樂園內的酒店將會很掃興，故旅行社可代辦迪士尼行程，價錢雖稍貴一點，仍有一定吸引力。
20050416-11,20050416,11,虛假個案令出席率大跌,虛假個案令出席率大跌 入境處為令市民能以較快捷方便的途徑進行智能身份證預約服務，設立一條二十四小時電話熱線，卻因為不會核實身份證號碼，即使多名預約人士共用一個傳真號碼仍不致引起當局疑竇，為了刪除虛假預約個案，入境處須特別指派一名高級入境事務主任，每天花一小時刪除資料。     換證計劃07年完成   案情透露，自去年二月起，入境處沙田智能身份證中心開始接獲虛假預約個案，預約人士偶然不知所終，令沙田區預約人士的出席率由百分之八十五，下降十五個百分點至百分之七十。  資料顯示，入境事務處由○三年八月開始，為全港市民簽發新一代的多功能智能身份證，凡持有有效香港身份證的市民，均須換領新證，政府會按市民的出生年份，安排市民分批換領身份證，一九五○或一九五一年出生人士的換證期，須於本月二十三日前，前往智能身份證中心，辦理換證手續，逾期換證而又無法提供合理解釋，可被當局提出檢控。  入境處預計須換領智能身份證數目將達到六百九十萬張，整個計劃會於○七年三月完成。  本報記者
20050416-12,20050416,12,8月中起港迪士尼上空列禁飛區,8月中起港迪士尼上空列禁飛區 【本報訊】香港迪士尼主題公園開幕在即，在迪士尼樂園由地面至四千呎的高空，也將於八月十六日正式開始列為禁飛區。民航處表示，這是本港有史以來首個透過立法來訂定的永久禁飛區；而一般私人機構若想申請將某個地區列為禁飛區，處方會以有關建議會不影響飛行安全及公眾利益作為考慮因素。  民航處處長羅崇文昨解釋，由於迪士尼樂園未來每天均會放煙花，飛機不適宜在煙花附近飛過；同時，為了營造迪士尼一個完整的公園氣氛，「唔想市民同白雪公主玩嘅時候，成日見到天上嘅飛機」，因此批准在迪士尼上空設立禁飛區。     救援飛機可獲豁免   由於迪士尼與港府簽訂的合作協議中，條款之一是必須在迪士尼的上空設立禁飛區，港府因此制訂《飛航（飛行）禁飛令》。但條例在立法會通過後，一直沒有生效日期，直至迪士尼決定在八月十六日試業，因此禁飛令也將於同日生效。而這也是本港首次以立法形式來訂定的永久性的禁飛區。  羅崇文強調，所有飛機將禁止飛入禁飛區內，但進行拯救、救傷任務的飛機則可獲豁免；而迪士尼設禁飛區對飛機航道沒有造成太大影響，反而可阻止一些私人機構租飛機低飛劃過迪士尼上空。  他又說，海洋公園的上空現時並沒有永久禁飛的規定，只會在特定的需求（例如飛行表演）之下將部份的空域列為禁飛區。至於一般私人機構若想將某個空域列為禁飛區，處方則會按照上述兩個因素予以考慮。  另一方面，由於今年「十．一黃金周」時，迪士尼樂園經已開幕，羅崇文希望十．一長假期的航班升降次數，可以再創新高。
20050416-13,20050416,13,逾4000人爭12空管職位,逾4000人爭12空管職位 【本報訊】提供導航服務的主要人員是來自民航處的航空交通管制主任，但該處在未來十年將要面對五、六十名經驗豐富的空管人員相繼退休的難題。民航處處長羅崇文表示，較早時處方公開招聘十二名見習航空交通管制主任，結果接獲四千多封應徵信，即平均三百多人爭逐一個職位空缺。 羅崇文說，民航處現時約有二百名空管人員，面對未來五、六十名資深空管人員相繼退休，該處將面對嚴重的人手流失。為免出現青黃不接的問題，處方將會繼續招聘見習空管人員。他強調，見習空管人員的職位一向搶手。有關職位屬公務員職位，現時的起薪點為月薪一萬二千九百五十元；而訓練一名具備所有牌照的空管人員，一般需時六至七年，每人訓練的總成本也需二百多萬元。
