key,date,article_daily_id,title,text
20050606-0,20050606,0,消委會擬發指引杜絕不良推銷手法纖體公司蠱惑招迫減肥,消委會擬發指引杜絕不良推銷手法 纖體公司蠱惑招迫減肥 【本報訊】夏日炎炎，纖體公司各出奇謀吸引愛美人士減肥。有關注減肥問題的團體發現，不少纖體公司以誤導、誇張，甚至「靠嚇」的蠱惑招作招徠，譬如女士的體重指標明明合乎標準，仍有纖體公司勸她減肥十磅；又有公司故意將查詢者的肥胖程度誇大。消費者委員會承認現時無法例監管纖體公司的銷售方式，今年內會向業界推出最佳營運指引，以杜絕不良推銷手法。　記者：雷子樂、譚暉 在灣仔的會議展覽中心，上周五開始一連三日舉行「夏日婚紗及結婚用品展暨美容及健康減肥博覽」，吸引大批準新人及愛美者入場參觀。纖體美容公司負責人Elgreen昨表示，三日來生意滔滔，估計有近一千人參加其瘦身、瘦臉療程，部份男士為結婚當日「靚啲」，甘願與女友排隊一小時報名。多間參展的纖體美容公司都表示在經濟好轉下，估計今年的生意額較去年多兩至三成。 「放蛇」被游說減10磅 纖體成風，各公司的推銷手法令人關注。香港進食失調康復會今年也有參加展覽，並派出職員扮成有意光顧者，到各纖體公司「放蛇」。該會行政主任余文蕙曾到數間參展公司查詢減肥計劃，體重指標（BMI）屬正常的她，在其中一間公司進行BMI測試後，職員竟說她可以「減多五至十磅」。「佢哋唔會話你知你BMI係正常，只不斷強調BMI最低係幾多，你重要減幾多先會到呢個最低標準。」  據余文蕙觀察，若查詢者的BMI正常，部份纖體公司會轉為查問他們自覺身體哪部份較肥胖，不少纖體公司替準顧客量度手臂、大腿時，都會量度手、腳較上部位、即較肥胖的位置，量度時亦會故意將軟尺拉鬆，誇大準顧客的肥胖程度，再游說她們局部減磅。余文蕙說：「佢哋會以電話攻勢，不斷用『你咁肥，男友會唔鍾意』等說話嚇你，令你覺得自己好有需要減肥。」 游說客人不停加錢 纖體美容公司發言人蕭若元接受本報查詢時承認，現時坊間有些美容院用不老實的方法游說客人減肥。最常見的問題銷售手法有兩種，一是所用的減肥方法根本無法成功減肥，「佢哋話減到肥係呃人嘅」；另一種手法則是不斷向參加了減肥療程的顧客加收費用，「佢哋要個客不停加錢，根本唔想個客減到肥。」  婦女團體「不示弱女人」發言人林英卿則不點名批評，在近年市場競爭愈來愈激烈下，有纖體公司甚至免費招募瘦身代言人，嚴重破壞女性的尊嚴。她形容有關推銷手法極不負責任，令社會充斥瘦即是美的錯誤觀念。  消委會去年共接獲五百六十多宗有關美容及纖體公司的投訴，今年首季的數字已達一百九十多宗。該會副總幹事劉燕卿對有纖體公司使用誇大、誤導的推銷手法表示關注，該會將在今年內與業界合作推出最佳營運指引，讓業界自由參與，以杜絕有關問題。
20050606-1,20050606,1,巨型石屎跌腳旁戶主嚇呆,巨型石屎跌腳旁戶主嚇呆 「點解可以有咁大塊石屎冧咗落嚟㗎！」上周四發生睡房天花下塌當日，羅先生外出未歸，當他聽到家人覆述事發經過時大嚇一跳。  當日晚上約八時許，羅先生的家人正在廳中觀看電視，突然聽到房間傳出異響，「見到有少少灰塵跌落嚟，我哋都重不以為意。」當時羅母正在房內取衣物準備洗澡時，一塊重達三十磅的天花石屎突然在她身後下墜，與她僅一米之距，部份碎石則打中她的腳踝。 「房署好唔負責任」 羅先生說：「滿地都係石灰，我阿媽嚇到腳都震晒。」  「我阿爸阿媽同個妹都響嗰度瞓，𠵱家夜晚都瞓唔着，好擔心再有石屎冧落嚟。」羅先生強調，一家人平日約於晚上十時就寢，七十多歲的父親更會八時多便上床睡覺，事發當日幸好一家人正在看電視，「我覺得房署好唔負責任，咁危險，之前我哋屋企已經跌過石灰落嚟，問佢哋重實牙實齒話無問題，完全唔理你，梗係啦，因為唔係佢哋住，係我哋住吖嘛！」  本報記者
20050606-2,20050606,2,地球之友擬公布　「城市雪房」名稱空調過低場所被「通緝」,地球之友擬公布　「城市雪房」名稱 空調過低場所被「通緝」 【本報訊】地球之友上周推出「這個夏天不太冷」的空調節能運動以來，不少市民向該會投訴，指公共場所的空調經常令人冷到「騰騰震」。該會初步調查發現，私人屋苑泓景臺的第六座大樓大堂，溫度更低至只有攝氏十八度；該會於是向這類機構發出「通緝令」，並要求全港市民舉報空調溫度過低的室內場所。 呼籲舉報「冷罪行」 地球之友環境事務經理朱漢強說，初步發現戲院、巴士、離島線渡輪、茶餐廳、屋苑大堂等都是「城市雪房」的黑點。灣仔區議會主席黃英琦也曾向該會稱，日前到香港藝術中心觀賞表演時，冷得要蓋上披肩。  他指出，空調過冷會令人容易患上感冒、肩周炎、風濕、關節炎等「冷氣病」；又浪費能源，堪稱為「冷罪行」。該會呼籲市民舉報這些機構的「冷罪行」，藉以向機構負責人施壓，以便洗脫本港有全球最凍室溫的惡名。  他又稱，深圳市政府去年起已要求各商場、賓館的空調溫度不得低過二十五度，初犯者會遭到口頭警告，再犯則會被公布商號名稱，受輿論「唱衰」。該會有意仿效此做法，在接到市民投訴、並經該會查證屬實後，會將被投訴機構的名稱列入「城市雪房」的黑名單上，並予以公布。  有意作出舉報的市民可登上該會網頁（www.foe.org.hk）或致電（25285588），告知「城市雪房」的名稱、寒冷程度、該場所有否回應市民投訴等資料。  此外，昨日是「世界環境日」。環境運輸及工務局局長廖秀冬昨日稱，去年路邊錄得的懸浮粒子和氮氧化物水平，較九九年分別減少百分之九及兩成四；港府今年的工作目標之一，是強制重型柴油車輛安裝廢氣消減裝置。 替樓宇作環保評級 屋宇署署長鄔滿海說，將於一、兩個月內，完成為全港樓宇發出環保評級的環境表現計劃顧問報告。  他說，有關計劃會在全港的公營及私營房屋推行，但屬自願性質，希望樓宇由設計、建築以至保養都符合環保原則。
20050606-3,20050606,3,文職公僕年浪費27公噸紙,文職公僕年浪費27公噸紙 【本報訊】政府推動減少用紙多年，但一項調查卻發現，逾半受訪的文職公務員認為，辦公室浪費用紙，數量平均達二十張。負責有關調查的「消費者力量」估計，政府每年浪費紙張數量達二十七公噸，需要種植五百四十棵大樹和逾八千公噸天然資源才能抵償。 用再造紙不足25% 消費者力量上月訪問了三百零六名文職公務員，五成二人認為辦公室浪費紙張，數量由五張至三百張不等；而最多人稱每天浪費紙張數量為二十張。  調查又發現，政府使用再造紙的百分比不足兩成五，而選購的再造紙也只是含四成的回收物料。  該會項目統籌陳偉民說，從政府資料發現，政府在○三年度辦公室用紙量達九千三百公噸，宣傳方面的用紙量為五千五百公噸，但到○四年度的用紙量上升半成，共耗用五千九百公噸。他批評政府仍未嚴格執行善用資源政策，呼籲當局嚴格執行減少使用紙張。
20050606-4,20050606,4,向醫學界選委施壓　阻對手獲提名機會煲呔扣帽子：一票兩投不道德,向醫學界選委施壓　阻對手獲提名機會 煲呔扣帽子：一票兩投不道德 【本報訊】為求在高票提名下自動當選的特首候選人曾蔭權，昨天出席為選舉委員會成員而設的閉門答問會時，批評醫學界支持「一票兩投」的做法不道德，席間更大說「風涼話」，要求醫學界選委支持自己，令包括提出一票兩投構思的候選人李永達「早啲脫離痛苦」。李永達與另一候選人、立法會議員詹培忠認為曾氏有向選委施壓之嫌。　記者：許偉賢、莊曉陽 曾蔭權昨天結束一連兩天、合共四場的選委閉門答問會。他昨午與醫學、教育、法律及建築工程界別近九十名選委會面時，被醫學會會長蔡堅問及醫學界有意支持一票兩投，即提名人選與投票支持人選可以不同。  蔡堅在會後引述指，曾蔭權回應時強調一票兩投做法不道德，並公開要求界內選委支持自己，令其他候選人早日脫離痛苦，「佢話自己會全力以赴，早啲令到佢嘅對手脫離痛苦。」 法律學者斥蓄意混淆 45條關注組成員、香港大學法律學院助理教授張達明在會上跟進問題，質疑曾的言論是嚴厲地指摘及譴責選委，重申提名與投票為兩個不同階段，「佢蓄意混淆係唔啱」。  兩位特首候選人李永達及詹培忠齊轟曾蔭權有施壓之嫌，李永達斥道：「最唔道德唔係一票兩投，而係小圈子選舉，市民冇得投票。」他批評曾蔭權不與他比較政綱，卻用這些伎倆批評他，屬黔驢技窮，又嘲諷「佢畀自己友嘅親中選委片先至痛苦」。  詹培忠則稱：「佢唔係政治初哥，點會唔知呢啲說話會（對選委）有壓力？」他認為曾蔭權幾乎盡攬所有選票，應該更加謙虛，「唔好講埋啲咁霸道嘅說話。」  除向醫學界施壓外，曾蔭權又向關鍵的社福界埋手，昨早與社會福利、漁農及文化等界別選委舉行閉門答問時，特別表明目前連一個社福界選委的提名也沒有，希望社福界可以支持他。 承諾不減公僕不減薪 據立法會漁農界代表黃容根會後引述，有社福界選委批評曾以「強政勵治」為政綱，擔心他當選後採取強硬霸道手段推銷政策，對民意置之不理。對此曾蔭權會後回應說，強政勵治不是指霸道和獨斷獨行，而是指政府會有決心執行政策，不會朝令夕改，做到言必信，行必果，堅稱施政會以民為本。但45條關注組立法會議員梁家傑另一場合說，真正的強政勵治應謙虛包容，充份取得公眾的授權後才做事，絕不是板起面孔裝強勢，隨意用權力排斥不同意見。  曾蔭權又稱，自己只欲全力以赴，全取七百多個選委提名；但最終結果如何，須由選委自行決定。他又承諾一旦成功當選，會保留十六萬公務員隊伍編制，不會縮減，又稱公務員沒有再減薪必要。  曾蔭權將在本星期內，與部份投票取向並不統一的界別選委閉門會面，包括建築測量界、高等教育界、社福界及法律界等，為盡取選票作最後衝刺。
20050606-5,20050606,5,曾為言論「補鑊」只允兩年內不碰23條,曾為言論「補鑊」只允兩年內不碰23條 【本報訊】有選舉委員會成員前天引述特首選舉大熱門曾蔭權指，23條立法條文過於寬鬆，日後立法時要重新檢討；曾蔭權昨天隨即「補鑊」，表明政府在○三年推出23條立法建議後引來極大反響，而社會至今仍未就立法工作做好準備，因此他就算成功當選，亦不會在未來兩年為23條立法。  身為45條關注組成員的法律界選委、香港大學法律系助理教授張達明昨在選委閉門答問會後引述指，曾蔭權向與會者表明，「𠵱家社會都唔想𢱑開個傷口，所以喺兩年任內都唔會掂23條，即係連研究或者諮詢工作都唔會做。」  泛民主派立法會議員鄭經翰則替「老友」曾蔭權辯護，強調是「土共」不敢公開討論23條及法輪功問題，在閉門答問會發功結果令23條立法問題訊息含糊。
20050606-6,20050606,6,教育政策模糊倒叫教師反省,教育政策模糊倒叫教師反省 【本報訊】特首候選人曾蔭權聲言教育為其政策綱領最重要的一項，但有教育界選委批評曾蔭權在教育政策上欠缺具體方向及抱負，亦不明白業界憂慮；有選委更引述曾在選委閉門答問會上表示，中史課堂沉悶，呼籲中史老師反省為何沒有人願意修讀。  教育評議會副主席何漢權昨在會後指，席間向曾蔭權建議推行中班教學、鎖定每班為三十至三十五人，另亦反映愈來愈少人修讀中史的問題。何形容在「三三四」新學制下，「通識教育係金裝上陣；中國歷史就倉皇落馬」，擔心年輕人對國家歷史認識不足。 被指不了解業界憂慮 不過，何漢權對曾蔭權的回應並不滿意，指其欠缺具體教育方向及抱負，更不了解業界憂慮，「我睇唔見佢有任何具體承諾，只係話會同（教育統籌局局長）李國章傾。」  何漢權又指曾蔭權談及修讀中史人數下降時稱，個人對中史有情意結，但不喜歡背誦，加上中史課堂沉悶，他當年上課時不少同學在堂上睡覺，「佢叫老師反省吓，點解中史科冇人修。」  教評會稍後會開會，決定所持六票的投票取向。
20050606-7,20050606,7,梁家傑開地區辦中聯辦到賀,梁家傑開地區辦中聯辦到賀 【本報訊】45條關注組立法會議員梁家傑於藍田的地區辦事處昨開幕，邀請到中聯辦九龍工作部宣教處處長陳實擔任嘉賓。這是中聯辦近年罕有地派代表出席民主派議員的活動。陳實表示，與梁家傑在一些場合碰過面，中聯辦是要廣泛團結各界人士，所以收到邀請後便出席開幕禮。  據悉，關注組另一名成員湯家驊的將軍澳地區辦事處於數月前開幕時，也曾發邀請函到中聯辦邀請官員出席，但最終沒有回音。 陳實稱會增加溝通 昨日在開幕禮期間，陳實一直坐在台上，但鮮與民主派成員談話。陳實會後表示，這次出席「冇乜特別」原因，他過往與梁家傑在其他活動曾多次碰面，所以收到邀請後便來了，而今次是他首次出席議員的辦事處開幕。梁家傑也說，邀請中聯辦官員沒有特別原因，只因他的職員跟陳實相熟，所以發了邀請函給他。  問及日後會否參與其他民主派議員的活動，陳實表示，現在還說不定，要看看到時有沒有被邀請，總之中聯辦會做多些溝通工作。  除了中聯辦官員外，民政事務局局長何志平、屋宇署署長鄔滿海、45條關注組成員余若薇、湯家驊及吳靄儀、民主黨李柱銘、李華明及涂謹申、同樣來自立法會九龍東選區的「大班」鄭經翰，以及會計界議員譚香文也有出席。  問及是否贊成把局長剔出行政會議時，何志平表示，若有任何可以令施政暢順的改革建議，他都會支持。李華明則表示，在首天的選委閉門答問會上，他曾問曾蔭權，如何證明他會做得好，不會步董建華後塵，曾蔭權則說：「你提名我個名，我就做得到啦！」
20050606-8,20050606,8,函各堂區神父惹不滿,函各堂區神父惹不滿 【記者張嘉雯報道】有意參選特首的曾蔭權，一直標榜自己是虔誠教徒，上周開始向全港二十四萬天主教徒拉票，去信全港堂區，要求神父囑咐教友為選出特首及為他本人祈禱，惹來部份神父不滿。有神父直言不會為他作宣傳，更即時將信件掉進垃圾桶；有教徒直斥曾的要求荒謬，「唔該佢唔好再用教徒嘅身份做幌子，掩飾自己作為中央嘅工具。」  曾蔭權上周去信全港五十多個天主教堂區的主任司鐸，請神父呼籲教友「在關鍵時刻為香港祈禱，以選出天主眼中的好特首」，並為他本人祈禱，「讓我能時時毫無保留地工作，為香港、為中國、為光榮天主！」 信函被掉進垃圾桶 有堂區神父坦言，不會為曾蔭權作宣傳，更將曾喻為經紀，「啲經紀都係咁推銷自己㗎啦，佢咁做都冇乜奇怪吖，佢要做呢個位梗係無所不用其極。」有神父更即時將信函掉進垃圾桶，「佢想表達自己係好人，呢啲宣傳我唔會理會，八百人選一個人，都唔係民主過程，你寄呢啲嘢畀我有咩用啫？」  天主教正義和平委員會幹事孔令瑜對曾的拉票手法極為不滿，直指他的要求荒謬，「咁你係咪叫啲教友為你成為中央嘅工具祈禱呢？天主教會團體邀請你出席論壇你又唔嚟，你憑咩叫我哋為你祈禱呀！」她指曾過往的作為不符合天主教會的價值觀，在《基本法》第23條立法、居港權及《校本條例》上沒盡力，「唔該你唔好再將我哋扯埋一齊嚟講，得閒就攞個教徒身份出嚟用吓，當係工具，係好唔道德。」  曾蔭權競選辦公室昨承認曾蔭權曾向天主教會本港各堂區寄出有關信件，但對於其他問題暫不作回應。
20050606-9,20050606,9,黃毓民勁窒曾語無倫次,黃毓民勁窒曾語無倫次 【本報訊】時事評論員黃毓民昨出席前綫舉辦的「行政長官選舉鬧劇」論壇時批評，特首補選是一個不義及侮辱人類智慧的選舉，認為當選呼聲高唱入雲的曾蔭權即使當選亦缺乏認受性，對他處理政治問題的態度感到悲觀，「阿爺（中央）話乜佢話乜。」 曾經被煲呔警告 黃毓民憶述，在○三年六月底曾與曾蔭權會面，當時身任政務司司長的曾警告他勿煽動群眾上街，「佢同我話如果有乜事，你都要負責。」他當時的回應是，「有乜事係你細佬（警務處處長曾蔭培）問題。」他批評曾蔭權自言「流香港血、飲香港水」的說話是語無倫次，「香港唔係一個民族，我哋流緊中國人嘅血……飲嘅就係東江水。」  至於曾蔭權日前公開指稱市民應客觀評價六四事件的言論，黃毓民坦言非常不滿，「如果佢老竇俾人殺咗，佢提唔提？佢個仔俾人殺咗，佢提唔提？」他強調，六四事件與經濟發展無關，不肯面對六四事件與日本人逃避二次大戰史實無異，「我哋重點話日本人唔肯面對歷史？」  黃毓民又批評呼籲各界支持曾蔭權的問責局長及選委會委員，「阿爺叫曾蔭權做，我哋咪支持佢囉，呢啲人咪叫奴才囉。」他呼籲市民不要放棄爭取普選。
20050606-10,20050606,10,大班爆料：煲呔原來有擦鞋嗜好,大班爆料：煲呔原來有擦鞋嗜好 立法會議員「長毛」梁國雄日前送鞋油、鞋刷給曾蔭權，諷刺他擦中央鞋；與曾蔭權友好的「大班」鄭經翰（圖左）昨透露，曾蔭權的確有擦鞋的嗜好，因他工作壓力大，會以擦自己的鞋來減壓。  大班說曾蔭權這習慣來自當差的父親，因警察需要「擦令」對鞋，說不定曾蔭權小時曾幫父親擦鞋賺零用錢，但選委就不要「亂咁擦Donald鞋」，因為分分鐘用錯鞋油擦錯鞋。
20050606-11,20050606,11,每年四至九月為減肥高峰期減肥致暴食症個案飆升,每年四至九月為減肥高峰期 減肥致暴食症個案飆升 【本報訊】香港進食失調康復會一連三日進駐「美容及健康減肥博覽」會場，接受對減肥有疑問者的查詢，三天內收到最少一百二十人查詢或求助。 15至25歲減肥高危族 該會行政主任余文蕙表示，大部份自以為肥胖的求助者，其實體重都合乎標準，毋須減肥，但約一成個案有患厭食症或暴食症的危機。該會去年共接到一百五十八宗減肥引致患暴食症的求助，較○二年飆升四倍。  根據該會的求助統計，每年四至九月是減肥高峯期，因減肥方法失當而引起的進食失調問題，通常在十月至十一月湧現，十五至二十五歲是最高危一族。余文蕙表示，一成求助者填寫對食物態度的問卷後，被評定為高危，出現常害怕自己進食過量、愛空肚的感覺、進食後會感到內疚等症狀，易患厭食症或暴食症。  坊間不少纖體公司都聲稱可以控制食量的方法，協助顧客在極短時間內減磅。但余表示，當節食一段時間後便容易「餓過飢」，之後就暴飲暴食，令體重到最後不降反增。「當食親嘢都計住卡路里、成日怕增磅，就要小心會患暴食症。」 1%被訪者藉毒品減肥 該會在減肥博覽進行的問卷調查還發現，百分之一的被訪者承認曾服食軟性毒品減肥。余表示，安全減肥的速度應是一星期只減一磅，半年內不可減超過一成的體重，若纖體公司的減肥計劃超出這範圍，參加者就要小心有反效果。
20050606-12,20050606,12,余若薇：女選委向曾呻難襯衫,余若薇：女選委向曾呻難襯衫 45條關注組立法會議員余若薇（圖）表示，最近時裝潮流興藍色和綠色（曾蔭權競選活動主色），有女性選委特意穿綠、藍色的衣服參與答問會，還要向曾蔭權呻：「藍色同綠色衫好難襯！」  穿上藍衫黑褲的余若薇昨出席梁家傑的地區辦事處開幕禮時笑說，梁的演講常插入四字真言，去年選立法會的文宣以藍色為主，現在曾蔭權又用藍色，演講又多四字詞，其實是學梁家傑。
20050606-13,20050606,13,許冠文促：助向內地推銷廣東歌,許冠文促：助向內地推銷廣東歌 文化界選委許冠文（圖）認為，唱片業的市場逐漸萎縮，廣東歌又開始式微，希望曾蔭權在更緊密經貿關係安排（CEPA）下，協助唱片業拓展市場至內地珠三角。  許冠文又說，會上有向曾蔭權談及盜版、非法下載電影等問題，若沒有好好保護知識產權，創意工業也發展不了，而曾蔭權則向他們承諾會盡力去做，多點與業界會面溝通。
20050606-14,20050606,14,漁農界冀：勿讓周一嶽管漁農業,漁農界冀：勿讓周一嶽管漁農業 有漁農界選委趁閉門答問會向曾蔭權「篤背脊」，投訴衞生福利及食物局局長周一嶽（圖）。選委黃火會後承認，要求曾不要讓周一嶽沾手漁業和農業，改為成立新的漁護局負責有關政策，因身為醫生的周一嶽不了解業界事情。  黃火又批評周一嶽，雞有病毒就要全部殺掉，魚有病毒也要全部殺掉，「咁人有病毒係咪全部都要殺？」據引述曾蔭權回應說，日後會再與業界接觸。
20050606-15,20050606,15,衣服亦被燒穿　兇徒逃去無蹤墓碑大王遭潑鏹命危,衣服亦被燒穿　兇徒逃去無蹤 墓碑大王遭潑鏹命危 【本報訊】一名經營墓碑石廠五十年的老行尊，昨日在大埔寶湖花園停車場取車期間，被埋伏兇徒以通渠水照頭淋，當場頭部及身體被嚴重灼傷，送院後情況危殆，而兇徒事後則逃去無蹤。警方調查發現，傷者數月前亦曾被人淋鏹水襲擊，懷疑是同一兇徒所為。消息稱，警方初步相信事件與事主的生意無關，現正循他的感情生活進行調查。　記者：張培生、文兆麟、李偉民 傷者潘利英，七十五歲，在粉嶺和合石墳場開設「潘記石廠」已五十年，並在紅磡設有寫字樓。據同行表示，潘是白手興家，平日工作十分勤力，在行內可說是老行尊。據稱，他的妻子已去世多年，獨生女年前結婚遷出後，他便一人獨居在大埔區。 留院情況危殆 昨晨十時四十五分，他獨自到寶湖花園停車場的地庫車位準備取私家車返回和合石工場，當時他打開車門坐進司機位，尚未關上車門之際，突然有人從後叫了一聲：「阿叔！」潘下意識的回頭查看，隨即被人用一個盛有腐蝕性液體的紙杯，向他照頭淋下，他感到頭部及面部十分灼熱，上身衣服亦被燒穿，當場受傷痛楚不堪，兇徒得逞後向防煙門方向沿後樓梯逃去。  事主負傷向停車場出口方向狂奔呼救，驚動街坊通知保安員報警，保安員立即取來清水淋向事主身上，替他清洗身上的腐蝕性液體減輕痛楚，救護員事後到場替傷者敷藥及包紮紗布，然後送院治理。傷者頭部及上半身受傷，全身百分之十三皮膚被嚴重燒傷，幸沒有傷及眼睛，未致失明，但目前情況仍然危殆，現正在深切治療部留醫。  警方事後在現場調查，發現兇徒留下曾盛載腐液的紙杯，並在後樓梯發現一樽強力通渠水及一樽蒸餾水，懷疑兇徒事前在梯間稀釋通渠水，然後以紙杯盛載，並埋伏等候事主出現時行兇。警方事後撿走停車場的閉路電視錄影帶返署進一步調查。 疑涉感情問題 對於事主被人淋通渠水行兇，他的石廠工人和家人均表示不明所以，但相信他在生意上並沒有得罪人，亦沒有欠債或經濟問題。不過有消息稱，事主在數月前亦曾遭人淋鏹水襲擊，經治理後並無大礙，而事後警方並沒有拘捕任何人，警方不排除兩宗案件有關連，又懷疑事件涉及事主的感情問題，現正循他的私人生活方向展開調查。
