key,date,article_daily_id,title,text
20050725-196,20050725,196,英之見：投資分析反應要夠快,英之見：投資分析反應要夠快 英鎊回落過百點，外滙市場走勢比港股易猜。港股上周五升勢比自己預期強，並不是先高後低，十分出奇，地產股尤其勁，不過美元三扒兩撥收復大部份失地，資金流入或者資產偏低之說，短期內應該不成立，遲早會再炒人民幣，但港股至少會出現較大的調整。  油價上周五才升，是值得記存的一課。理論上人民幣升值一刻已應該有反應，遲了一天才突破，升市評論又是人民幣升值。有兩個解釋，第一是評論只是事後孔明，但求就手找一個理由；第二是這個市場可能相當人為，市場是大，但大小戶實力可能非常懸殊，日後要十分小心。  上周五走勢實質上是個別發展，不少中資股反而受壓。最令筆者奇怪的，是市場對中資航空股盲目的追捧，因為人民幣升值，債務負擔變相減輕，這和賭贏外滙基本上沒有分別，可是這些公司業績乏善足陳，並未說明增加價值的能力。滙率變化只是短期利好，長期賺錢能力才是真正的關鍵，高追這些股票，只不過等於派彩給賭贏航空股賭贏外滙的朋友而已。 累積經驗不能只靠記憶 原材料股回落是意料中事，前幾天升勢太勁，商品價格上周四晚又不前，借勢回吐是正常。不過市場的解釋，是人民幣升值，令海外礦產公司在價格上有優勢，似乎又有點過慮，因為商品價格是會調整，出現新的平衡點，不會特別打擊這些國內公司的生意。  可惜今次反應已太慢，無論是原材料價格以美元計向上調升，又或者海外公司取得價格上的優勢，海外的原材料公司都一定受惠，這是比在香港亂點甚麼受惠股，是更加有信心的行動。投資分析之難，往往在於瞬間要有決定，匆忙交卷，反應要快，好像現在想通實在太遲，所以經驗才這樣值錢。  今次事件另一教訓，是自己太懶，人民幣升值時機是突然，但出現並不是意外，事前思考未夠充份，其實是沒有藉口。近期連番有突發事件，自己的即市反應已算合格，不過事後回看，再上層樓的空間甚大。要累積經驗，以往是單靠記憶，似乎應該嘗試寫投資日誌，相信會頗有幫助。  黃國英  電郵：alex.wong@sywg.com.hk    作者黃國英為證監會持牌人士
20050725-197,20050725,197,曾淵滄專欄：下一目標為日圓歐元,曾淵滄專欄：下一目標為日圓歐元 人民幣終於「出其不意」地升值了，人民幣升值利好哪些股？利淡哪些股？上個星期五的股市已作出反應。  雖然是「出其不意」，但早已為許多人所猜到，數個月前「任三招」一出，我就說人民幣升值之日不遠矣！董下曾上，我也說過人民幣升值最早是7月份，等曾蔭權正式上任才進行，以免為香港帶來亂子。  既然上周五股市已正確的反映了人民幣升值的刺激，因此，今日我們應該進一步關心的問題是：人民幣還會再升值嗎？還能升值多少？人民幣升值的影響力有多強？  先談人民幣會不會再升值？答案應該是肯定的，人民幣的第一輪升值僅2%，肯定不能使到美國政要滿足，必然再繼續加強攻勢，迫使人民幣再升值。實際上，上星期四晚上，人民銀行在宣布人民幣升值的同時，也宣布人民幣與美元脫鈎，與一籃子貨幣掛鈎，這個決定也提供了人民幣再升值的機會。人民幣與一籃子貨幣掛鈎，當這一籃子的貨幣升值，人民幣就升值，這一籃子貨幣中肯定包括日圓與歐元，因此，熱錢的下一輪攻勢應該是先令日圓、歐元升值，間接地使到人民幣升值，只不過，這一籃子的貨幣也肯定包括美元在內，而且比率不輕，因此，日圓、歐元每升值2%，人民幣也只會升值1%，如此一來，想炒人民幣升值倒不如去炒日圓與歐元。  人民幣升值2%之後，上星期五美元兌人民幣的一年期期貨仍然有約4000點子的折讓，這相當於5%的折讓，連星期四晚上宣布的2%算在內，共7%的折讓，這表示國際炒家皆估計人民幣在1年之內會再升值5%，總共升值7%。  人民幣升值，如果只是升2%，對香港經濟而言，沒有甚麼影響。是的，香港有不少工業家在內地有投資，人民幣升值會加重他們的成本，但是，一個商品的總成本中，至少有一半以上是入口的原料、半成品等等，在中國內地加工的附加值不會超過一半。因此，人民幣升值2%，內地設廠出口成本的上升不會超過1%。  如果人民幣不再升值，影響就非常小。  曾淵滄  城市大學MBA課程主任
20050725-198,20050725,198,炒匯心經：美元收復部份失地,炒匯心經：美元收復部份失地 面臨沉重的國際壓力，中國終於決定令人民幣兌美元升值2.1%至8.11元，開啟了進一步升值的大門。消息傳出之初日圓上揚，但之後回吐部份漲幅，美元上周五收報111.33日圓，遠離上周四所觸及109.85的3周低位。  上周五倫敦警方在追查襲擊交通系統炸彈客的過程中，在地鐵站擊斃了一名男子，安全憂慮加深，促使英鎊下跌至1.74美元收市。英國第2季GDP僅較上年同期成長1.7%，乃逾12年來最差表現，亦為鎊滙平添沽壓。受鎊滙弱勢拖累，歐元亦挫至1.2066美元收市，美元兌瑞郎則收於1.2975。  分析家指出，美元兌歐洲貨幣仍有上漲空間，因美國經濟成長較強勁，且利率看升，而歐洲則經濟成長遲滯，且利率頂多是原地踏步。  匯中龍
20050725-199,20050725,199,麥嘉華筆記：美債市前景不可高估,麥嘉華筆記：美債市前景不可高估 近日不少債市專家都持有相同或近似的看法，就是債市眼前的升浪有機會延伸。一些債市權威人士更預期，10年期債券孳息將會由現時略高於4.2%降至低於3.5%的水平，若預測準確的話，現水平的債券價格將會有不少於5%的上升空間。 我無意在此與這些專家或權威人士大唱反調，刻意指債價必然不會上升，又或者長債孳息不可能再下滑，但我想提出以下事實，好讓投資者思考一下，希望有助提高他們的警覺性。  債市的升浪於1981年開始啟動，當時長債孳息高企於15.5%以上，換言之，我們所處的牛市已經歷了一段非常長的時間，而根據「牛去熊來、熊去牛來」這個周而復始的經濟定律，牛市不可能永恆不變，熊市終須有日必會重臨。 牛去熊來是定律 事實上，全球債市的熊市也許已經在不知不覺間悄然而至，不然又如何解釋現時的債券孳息為何會高於2003年6月之時──當時日本政府公債孳息低於0.5%，而美國10年期長債孳息亦不過是3.1%？  我個人認為，現階段若要購買孳息約為4.5%的30年期美國公債作長線持有的話，必須要對前景極為樂觀，並需要抱有極大的信心，因為我相信在未來數年的某個特定時刻，我們將會面對美國消費物價指數遠較現時為高的經濟環境。為何我會有這樣的看法呢？   通脹重臨遲早事 首先，聯儲局正由不斷摧毀紙幣購買力的格林斯潘掌舵，再加上美國龐大負債所佔GDP的比重已甚高，以及美國樓市的過度熾熱情況，聯儲局終有1日會在別無選擇下，只好恍如沒有明天般狂印鈔票，但狂印鈔票亦難以挽經濟狂瀾於既倒，因為債價和美元將會雙雙潛水。  我認為美國狂熱的樓市正從兩方面威脅着美國的經濟：  其一，格林斯潘這個經常根據初級記者在《華爾街日報》撰寫的文章作出經濟預測的老人家，很可能誤以為經濟仍然「強勁」和「健康」、只有部份地區的樓市存在了些微泡沫迹象，因而進一步調高聯邦基金利率，令樓價通脹放慢腳步。在此情況下，長期債市或會感到安心，因為聯儲局進一步加息的動作，予人感覺是將會在日後把經濟帶入疲弱的漩渦。 債價難升兩理據 縱使如此，我相信債券價格亦只會在現水平橫行，難望有較大的升幅。我所持的理據有二：  首個原因是債市投資者早已揸重了貨。若根據統計數字，牛熊比重的讀數現時正處於極高的水平。  其次是債市將會與美元共同率先反映聯儲局狂印鈔票這一項不利因素，因此，在聯儲局正式開動印鈔機之前的幾個月，估計美元和美債便會雙雙受壓，到時長債孳息飆升，將會間接對樓市構成傷害。  其二，大家不妨想一想以下的情況：美國製造業開始轉弱，而樓市的滑坡，令消費亦深受打擊，但這個曾經以為樓價只會升不會跌的帝國，卻剛剛用飛彈狂轟伊朗（雖然這只是我個人的想法，但成真的機會卻極大），以致油價一放難收，屆時聯儲局將被迫大刀闊斧地減息。到了那個時候，想想股市、債市、滙市和金市等將會有何反應？ 長債仍要趁高沽 最原始的反應自然是資金湧往避險所──大量資金自股市中流失，投向政府公債和黃金。不過由於比天高的能源價格和聯儲局大量印鈔，令通脹壓力漸次形成，債券其後亦因遭投資者唾棄而被大舉拋售。  綜上所述，我建議投資者在美國長債反彈時，不妨趁高沽之，這樣做所要承受的風險只會十分有限，但長期而言則資本增值的潛力卻甚高。  ﹙本欄隔周逢周一見報﹚
20050725-200,20050725,200,長汽附屬公司股東打官司,長汽附屬公司股東打官司 【本報訊】再有民企爆出醜聞，據內地報章報道，長城汽車（2333）主要附屬保定長城去年遭兩名股東起訴侵損利益。不過，長汽由收到入稟狀至今，從未如其他公司般，就此敏感消息發出過通告或在年報作出隻字披露。 長汽年報未有披露 長汽董事局秘書白雪飛稱，該公司沒有做過假冒及侵害保定長城股東利益的事，並解釋未有作出披露是想待法院有判決後再向股東交代。對於北京佳美亞投資發言人指今年1月曾向港交所（388）就事件作出投訴但至今沒有下文，港交所發言人稱不會評論個案，只會將調查結果通知投訴人。  長汽、佳美亞及保定中信內燃機製造，依次佔保定長城51%、24.5%及24.5%股權，保定長城一直以優惠價向長汽供應發動機，長汽03年純利中11.7%來自保定長城。  由於內地汽車業競爭劇烈及維持自身的利潤水平，長汽去年曾要求其主要附屬公司保定長城內燃機製造進行5600萬元人民幣利潤返還，但遭保定長城另兩名股東視為侵損股東利益，去年12月16日，長汽及保定長城遭入稟河北保定市定興縣人民法院起訴，法院於同月22日立案，並於今年4月12日開審，但案件已超過半年審判期限，法院仍未判決。 法院遲遲未判決 佳美亞及保定中信指，長汽在上市前，曾要求將保定長城的公司章程21條、有關召開董事局會議及動議有效出席董事要求，由原先的4/5降低至1/2，長汽在去年9月29日未有通知他們的情況下，召開了保定長城股東會，由長汽副董事長劉平福及投資管理部部長楊志娟，取代保定長城原總經理郭喜君及財務部長李德永的董事職位，連同長汽董事長魏建軍及前保定長城總經理趙元俊，可說控制了保定長城由6人組成的董事局。  佳美亞及保定中信法定代表李金祥及馮柱更指，長汽後勤管理部部長徐德才在工商局的董事變更表上假冒所有6人的簽名及手印，去年10月8日，保定長城召開董事會提出向長汽進行利潤返還並獲通過，但李馮兩人並不同意。遂入稟法院，要求確定去年9月24日長汽委派劉平福及楊志娟，代替郭喜君及李德永出任保定長城無效，並於今年1月再向法院追加訴訟請求，要求確認兩人行使董事職權期間表決通過的各項決議。
20050725-201,20050725,201,投資論勢：美元美息快將見頂,投資論勢：美元美息快將見頂 上周最令人感到意外的，也許是人民幣突如其來宣布升值。記得我在3月傳言最盛時，曾指憧憬人民幣升值的投資者必然會失望而回，當時算是僥倖言中，但我對於人民幣今年內不會升值的看法，其實在上周初已動搖，誘因來自英國《金融時報》前周五的1篇報道。  報道指美國白宮已向一些重量級國會議員透露，中國會在國家主席胡錦濤9月出訪美國前，於8月份改變人民幣緊釘美元的滙率政策。由於市場對此消息的反應出奇地平靜，已符合中國所謂「改變滙率政策須出其不意」這項大原則，而上周中國亦有經濟學者建議可以用「管理浮動」（managedfloat）的形式增加人民幣的彈性，更足以令人相信有關政策的改變已準備就緒。人民幣不等待8月而提前在7月升值，更是高招。  接踵而來要留意的大事，尚有8月聯儲局議息。如無意外，聯儲局在今次會議中，應會把聯邦基金利率提升至3.5厘水平。 聯儲局議息格外留神 大家也許仍記得，筆者去年底亦在此預測，美息將會在3.75至4厘便止步。若根據客觀因素分析，美國現時的通脹仍然受控，根本沒有大幅推高息率的必要，聯儲局唯一的憂慮，可能是部份地區確實因息低而存在了樓市泡沫。  我認為，格林斯潘一直摸着石頭過河找尋的「中性利率」，應該已近在眼前，除非再遇上類似911恐襲或長期信用管理爆煲事件，否則其繼任人所接手的，將不會是燙手山芋，因為格老已製造了充裕減息空間，要應付一般的經濟逆境，理應綽綽有餘。故此，我相信聯儲局很快便會在會後聲明中刪除有關字眼，市場若認為美息接近見頂，將令美元進一步受到打擊。  趙善銓
20050725-202,20050725,202,陸叔理財：人民幣微幅升值利好港股,陸叔理財：人民幣微幅升值利好港股 上周二才在本欄重提人民幣升值對國企股的影響，殊不知「即刻見功」。事先聲明，我真的不知曉人民幣會升值，純粹假設人民幣一旦升值對國企如何有利而已。不過，今次事件凸顯了中國政府的確言而有信，話明會出其不意地將人民幣升值，就貫切實行，的確一諾千金。  人民幣升值2%，並同時間放棄已維持了長達11年的人民幣緊釘美元政策，改與一籃子貨幣掛鈎，整體而言，是一個「上上之策」。 一步到位反而不妙 歐美等地一直認為，人民幣要升值1成，才可以修補中國與它們之間的貿易失衡。不過，如果中國真的一步到位，將人民幣升值1成，必然會為香港的金融體系及投資市場帶來震盪。  大家應知道，目前人民幣仍未能自由兌換，而近年國內的龐大外滙儲備（截至上半年6月底升至7110億美元），大部份來自外資到國內的固定投資，所以資金不是話走就走；相反，香港一直以來都是炒人民幣升值的基地，每次盛傳人民幣升值，游資都會湧入港股炒作一番。但一旦人民幣再沒有升值的憧憬時，資金便會撤走，對股市所帶來的打擊，實在不能忽視。故此，目前人民幣只升值2%，暗示未來仍有上調的空間，資金仍然會繼續停留在區內，  既然人民幣以此幅度上調屬利好，本地股市投資者又應該如何自處？事實上，上周四晚人民幣升值消息曝光後，一些絕迹於股市多時的朋友亦問道：「𠵱家無貨點算呀？」。 牛市第3期快來臨 其實，這個現象頗值得我們留意。首先，近年投資者已較以前聰明，寧願忍手也不冒險高追股票。不過今次情況有點不同，因為甚囂塵上的人民幣升值問題終於落實，而大家都明白人民幣升值後對股市有正面刺激，尤其是目前的情況更令投資者憧憬，所以潛伏已久的「投資熱情」再度被引發出來。可能由於近日股市升得太急，所以暫時「冷靜」及「理智」尚可以抑壓這「熱情」，但我相信，當大市出現整固時，他們會按捺不住而入市。所以，今次升浪並非是港股最後的一段升勢，經過調整後，應當還有另一次更顯著的升浪出現。因此，牛市第3期的來臨，似乎愈來愈明顯了。  上周五國企的升幅未有如想像般強勁，可能大家認為是國企早前已偷步上升，因而上周五借好消息出貨。不過，我覺得獲利盤固然是阻礙升勢的一大原因，但實際上今次突如其來的升值，不少國企都需要被重新評估升值後的影響，所以當市場氣氛冷靜過後，再部署入市也未遲。總之，在未來時間要在股市搵錢，「冷靜」是必要的條件。  陳永陸
20050725-203,20050725,203,理財智慧：新匯率制度非完全浮動,理財智慧：新匯率制度非完全浮動 人民幣在上周突然宣告升值百分之二，港幣兌人民幣的現鈔牌價在翌日普遍由原先每百港元兌105-106人民幣調升至每百港元兌103-104人民幣。對於喜愛北上旅遊的人士，即時受到影響，購買力迅速下降。  中國宣布人民幣升值之同時，亦把沿用多年與美元掛鈎的制度，改為「有管理的浮動滙率制度」（ManagedFloatSystem），與早前傳媒所報道的與一籃子貨幣掛鈎的浮動滙率制度，並不完全相同。  與一籃子貨幣掛鈎的滙率制度，是屬於接近完全浮動滙率制度之一，國家貨幣滙率的升跌，與其有關連的一籃子貨幣幣值強弱有關，而不是由單一貨幣的升跌所決定。其情況就如一個由不同貨幣所組成的投資組合，投資組合價格的波動，當然會比起單一貨幣的波動為小，這就是傳統投資組合理論所說的「分散風險」作用。採用與一籃子貨幣掛鈎的滙率，其代表性當然比只與單一貨幣掛鈎的滙率系統更佳。 美元比重仍最大 傳統一籃子貨幣滙率制度在建立之時，要決定所選取的外幣是哪些。而外幣構成部份，主要視乎本國的外貿夥伴是哪些國家，再以這些國家貨幣組成其投資組合。以中國的外貿情況來說，美元、日圓、歐元、英鎊、澳元及加元應該會放在組合之內。此外，決定滙率的高低，要基於每種投資組合貨幣的比重，而傳統上，會以國家與國家之間外貿規模來決定。  中國與美國的貿易額龐大，而香港與中國的貿易亦很頻繁，加上港元與美元掛鈎，所以預計美元在一籃子貨幣之中的比重仍會很大。  一籃子貨幣掛鈎的滙率機制，其運作是只要一籃子之內的外幣價值有變，貨幣的滙率便會出現調整。其次是如果一籃子貨幣所屬國家外貿比重有變，亦會影響到滙率的升跌。這種滙率機制，透明度較高，而現在中國所採用的管理浮動滙率與此有別。  麥萃才  浸會大學財務及決策系助理教授
20050725-204,20050725,204,銷售弱成本重　亞洲對手強勁美汽車業前景堪虞,銷售弱成本重　亞洲對手強勁 美汽車業前景堪虞 美國汽車業正面對銷售疲弱、成本負擔沉重以及來自亞洲同業的激烈競爭。行內分析員認為，美國汽車業前景堪虞。 【底特律法新社電】美國三大汽車生產商──通用汽車（GM）、福特（Ford）和戴姆勒佳士拿（DaimlerChrysler）近期分別推出價格優惠措施，寄望能藉此刺激銷售，但不少汽車業分析員認為這些措施不夠吸引。 分析員促縮減規模 通用汽車今年次季顯著虧損2.86億美元（約22.31億港元），而福特汽車上季雖然賺9.46億美元，但在北美市場卻虧蝕9.06億美元。一些分析員預期，美國大車廠近期的裁員行動未能解決問題。  CSMWorldwide分析員伯克表示，通用汽車不致走向倒閉，但該公司應縮減規模，才能改善處境；福特的問題亦一樣，美國車廠都應該更加輕裝上路。  福特和通用汽車上星期分別宣布，打算關閉更多廠房。此外，通用汽車表示計劃增加在亞洲採購物資，而福特則說會進一步裁減全職僱員。  不過，馬里蘭大學商學院教授莫里塞指出，通用汽車管理層實施的舉措，不足以令該公司扭轉劣勢。他說，通用汽車生產的轎車和貨車不賺錢，這種情況難以在短期內改變；該公司若不大刀闊斧地進行策略及領導上的轉變，虧損只會愈來愈多，現金愈來愈少，銀行對放款會愈來愈保留，最後可能被迫申請破產保護。 通用汽車或會破產 美林證券首席汽車業分析員卡塞薩說，第2季通常是汽車製造商業績較強的一季，但通用汽車的北美業務上季仍虧蝕12億美元，顯示該公司正面對銷售和成本的問題，管理層進行大規模改革的壓力愈來愈大。  相對通用汽車和福特，戴姆勒佳士拿上季業績預期會較佳，原因是該公司的產品種類多，管理層對削減成本不遺餘力。但惠譽國際（FitchRatingsService）表示，減價壓力以及競爭對手擴張生產規模，將繼續壓縮戴姆勒佳士拿的毛利，美國佳士拿（ChryslerGroup）近期致力改善營運的努力，或多或少會因此被抵銷。  
20050725-205,20050725,205,惠而浦加價爭奪Maytag,惠而浦加價爭奪Maytag 【三藩市彭博資訊】美國最大家用電器生產商惠而浦（Whirlpool），把收購同業Maytag的開價提高至每股18美元。 涉資14.4億美元 惠而浦原本提出以每股17美元收購Maytag，但有關收購建議在上周四遭Maytag拒絕，該公司遂把收購價提高至每股18美元，按Maytag上周五的收市價計，溢價為11%。Maytag發行的股份共有7990萬股，每股18美元的價錢意味惠而浦收購這家美國第3大電器生產商的開支將達14.4億美元左右。  Maytag原本已在5月份接受Ripplewood以每股14美元現金收購該公司。惠而浦表示，可以考慮替Maytag向Ripplewood支付4000萬美元的「分手費」。
20050725-206,20050725,206,Jetstar與Valuair合併,Jetstar與Valuair合併 【本報綜合報道】新加坡兩家廉價航空公司JetstarAsia（捷星亞洲）和Valuair（惠旅航空）宣布合併，這是東南亞廉價航空業內首宗併購。  Jetstar和Valuair昨天發表聯合聲明，表示將成立一家控股公司，共同擁有和經營該兩家公司；兩者在「可見的將來」將繼續以本身品牌經營航線，所提供的服務與過往相比將幾乎沒有分別。 廉價航空業整合 東南亞過去兩年有多達16家廉價航空公司開始經營，令業內競爭加劇。由於燃料價格急漲、競爭激烈，以及部份國家政府不願開放航權，令東南亞的廉價航空公司面對整合壓力，新加坡和印度政府一直促請業界進行合併。  Jetstar和Valuair未有透露合併的細節，但新加坡《商業時代》上周報道，此宗合併的條件是新公司獲注資逾5000萬新加坡元（約2.34億港元），主要由澳航提供，而擁有Jetstar19%股權的新加坡國營投資公司淡馬錫亦可能注資。
20050725-207,20050725,207,日企業負債10年最低,日企業負債10年最低 【本報綜合報道】日本上市公司的負債總額10年來首次跌破100萬億日圓（約6.96萬億港元），反映日本經濟持續復甦令公司財務狀況日益好轉。由於當地公司的手頭現金逐漸增加，該國可能出現新一輪企業併購潮。 跌破100萬億日圓 《日本經濟新聞》報道，該報對日本1181家上市公司進行的調查發現，截至今年3月底，日本上市公司的負債總計為97萬億日圓（約6.75萬億港元），較去年同期少7萬億日圓（約4875億港元），比1997年的高峯期大減24%。  該報說，最新趨勢反映日本上市公司正持續償還債務，同時增加手頭現金，其中三分一受訪公司表示完全沒有負債。隨着日本企業逐漸建立現金儲備，當地可能出現新一輪公司併購潮。  在各行業中，電子設備生產商的債務削減步伐最快，其中日本電氣（NEC）估計其附息債務到明年3月底會降到約1.01萬億日圓（約702.96億港元），遠少過1998年的超過2萬億日圓（約1392億港元）。  
