key,date,article_daily_id,title,text
20050731-0,20050731,0,港中招個案愈揭愈多　秀茂坪住家男人發病懷疑下廚染豬瘟,港中招個案愈揭愈多　秀茂坪住家男人發病 懷疑下廚染豬瘟 【本報訊】四川省的豬鏈球菌疫情愈爆愈烈之際，本港也發現愈來愈多感染個案。衞生署衞生防護中心昨公布，再多一名八十四歲男子於上月中染病，目前仍然留醫，情況穩定；病人曾經在家中協助煮食，傳染病醫生懷疑他在廚房感染細菌。衞生福利及食物局預期，接獲的呈報感染個案可能在未來數天上升；醫院管理局則計劃與衞生防護中心合作分析過去兩年的本港病例，但被傳染病醫生批評「已經遲咗！」　記者：陳倩雯、羅偉光 衞生防護中心最新接獲的一宗豬鏈球菌感染呈報個案，患者是一名八十四歲退休老翁，居於秀茂坪。他上月十六日發病，出現發燒及右膝腫痛的病徵，同日到聯合醫院急症室求醫。病人的血液化驗於上月二十二日有結果，顯示他感染豬鏈球菌，臨床症狀為心內膜發炎。病人仍然留醫，正接受為期六周的抗生素治療，目前情況穩定。  衞生防護中心調查所得，病人近期沒有離港外遊紀錄，也沒有到過豬場；但病人曾在家中協助煮食，惟不記得病發前有否接觸生豬肉。他的家人則沒有出現病徵。 老人皮薄較易感染 傳染病專科醫生勞永樂估計，染病老翁可能是從家中廚房感染細菌，「咁係反映廚房有（感染豬鏈球菌）風險，雖然話就算啲豬肉有菌，你識處理就冇事，但係好多人都忽略咗處理生豬肉時要注意衞生，所以有事都唔出奇。」他指出，老人感染此細菌的風險較大，原因是老人的皮膚較薄，有傷口時較難「埋口」，抵抗力也較弱。  豬鏈球菌不屬於法定呈報傳染病，因此本港醫療及衞生部門均沒有充份掌握此疾病在港的流行情況。衞福局發言人表示，由於內地及香港對豬鏈球菌感染個案提高警覺，故預計未來數天呈報個案數字可能上升。醫院管理局及衞生防護中心昨日宣布，計劃研究及分析過去兩年公立醫院的豬鏈球菌病例。 港11個案全是男性 衞生防護中心署理行政總監程卓端昨出席電台節目時表示，由於該中心認為豬鏈球菌「係重要嘅病」，故自去年五月起加強監察，提醒醫生及醫院呈報個案，至今共接獲十一宗呈報個案，全部患者均是男性，當中只有四宗相信是與曾接觸豬隻及生豬肉有關，其餘病例的感染途徑仍然未明。  不過，該中心最新接獲的六宗病例，均在四川爆發豬鏈球菌疫症後才接到通知；單在過去三天，中心已接獲兩宗病例。其中最新一宗個案病人入住的聯合醫院表示，該院得悉衞生防護中心再次提醒報告懷疑個案後，昨晨將有關個案通知該中心。  勞永樂批評，有關情況反映醫管局及衞生防護中心合作不協調，「𠵱家先分析就遲咗啲啦！睇嚟醫管局唔係好聽話，當衞生防護中心冇到，叫佢（呈）報，佢就嫌麻煩唔（呈）報。」他建議政府緊急立法，將豬鏈球菌列為第三十一種法定呈報傳染病。他指出，感染豬鏈球菌初期病者會發燒、頭痛，後期則出現關節炎、腦膜炎、細菌入血等病徵。 肉商憂走私活豬增 內地四川省昨再增兩市出現豬鏈球菌感染個案，死亡人數再增加兩人。對於廣東省潮安縣也有感染病例，本地豬農及肉商均說生意受影響，香港禽畜業聯會主席鍾鋒稱，本港八成進口活豬來自廣東省，他憂慮不法分子會由非指定農場走私活豬或豬肉來港，促請港府加強抽查入口活豬及豬肉。香港豬肉行總商會副理事長許偉堅說，正常情況下夏季豬肉銷量較少，今年受疫症打擊，生意再下跌約兩成。
20050731-1,20050731,1,邀學者提意見育人才　事後漠視建議書不聽民意曾蔭權被轟傲慢,邀學者提意見育人才　事後漠視建議書 不聽民意曾蔭權被轟傲慢 【本報訊】特首曾蔭權十月公布的施政報告，培訓政治人才是其中一個重點，早前一群大專學者，花了半年時間撰寫一份建議書交給曾蔭權，並要求會面討論，但曾蔭權以公務繁忙為由拒絕，只將建議書轉交有關部門了事。有學者對曾的處理手法極之不滿，批評曾態度傲慢，之前聽取學者意見純屬「做騷」。　記者：莫劍弦 政府去年發表政制檢討四號報告書後，團體民主發展網絡與當時的政務司司長曾蔭權見面，有與會學者稱，由於報告指香港政治人才不足，曾蔭權會上誠懇地建議學者提出意見，故會面後民網即集合一班來自全港大專院校、研究公共行政及政治學的學者，花了半年時間撰寫一份培育香港政治人才建議書，並於七月提交已成為特首的曾蔭權、政制事務局等，並要求與曾蔭權見面討論。  不過民網上周收到曾蔭權私人秘書覆函，指已收到建議書，並轉交有關部門參考，又說由於特首公務繁忙，未能安排見面。政制事務局也覆函稱已收到及備悉報告，完全沒有交代會如何跟進，對於民網要求與政制發展專責小組見面，政制事務局稱要稍後再回覆。 許仕仁上周四曾赴京 有份撰寫建議書的中文大學政治與行政學系高級導師蔡子強，對學界一番心血石沉大海十分不滿，他說當日一班學者是十分有誠意與政府商討，也從務實角度，不惜花半年時間研究培育政治人才建議，豈料現在連見面也拒絕，他批評曾蔭權諮詢學者，根本只是「做騷」，「我哋真係好有誠意想同佢對話，但係佢態度咁傲慢，連見都費事見你。」  民網主席朱耀明也說，他收到曾蔭權的覆信後，感到曾的態度十分冷漠，「可以見到佢施政根本唔係『以民為本』，根本從無諗過去聽民意。」他說香港學者一直想以踏實態度，盡量與政府就一些政治改革進行對話，希望能以溝通取代上街示威，但政府對心平氣和的溝通視而不見，他批評政府形同「犯賤」，「心平氣和想同你講，你就係都唔聽，係要幾十萬人上街，你先改少少，我只可以諗到用『犯賤』去形容。」他又說既然特區政府不願對話，他會想辦法將建議書交給內地部門及有關研究機構，直接向中央反映。  另外，政務司司長辦公室證實，許仕仁上周四曾赴北京，與負責香港事務的官員見面。
20050731-2,20050731,2,論培育政治人才　倡政黨加盟政府,論培育政治人才　倡政黨加盟政府 【本報訊】香港民主發展網絡在去年政府發表政制發展專責小組四號報告書後，隨即集合一群來自不同大專院校的學者，就報告中提出培養本地政治人才的建議，撰寫一份「培育政治人才建議書」，提出從公務員系統、政黨發展、改革地區行政和諮詢組織，以及加強政策研究等方式，全方位培養香港政治人才。  建議書指出，目前公務員系統已不足應付今天政治化的社會，所以建議發展政黨作為香港未來的執政團隊，加強政黨政策研究及執政能力，開放更多渠道給政黨進入政府，培育執政人才，這樣才可以吸引優秀精英加入政黨。 吸納不同階層議政 至於政務官的角色，建議書提出公務員負責制訂政策工作有不足之處，應該逐步由政黨人士負責政策制訂工作，變成政黨執政，公務員應該由「通才化」變為「專業化」，協助政黨推行政策之外，也讓公務員可有渠道加入執政團隊。  建議書又提出協助政黨發展、下放權力給地方行政架構，以及開放諮詢組織，成立監察公職人員組織，吸納更多不同階層人士參政、議政，從不同架構，全面培養不同範疇政治人才，有助加強政府管治及施政能力。
20050731-3,20050731,3,擬設區議員酬酢開支,擬設區議員酬酢開支 【本報訊】接連發生多宗立法會及區議會議員濫用公帑案件，議員申領公帑缺乏監察令人關注，為加強規管區議員申領公帑舉辦社區活動，民政事務總署擬增設「酬酢及聯絡開支」。 每年一萬九千多元 區議員目前每月有薪酬約一萬七千元，另有一萬多元實報實銷津貼作辦事處及職員開支，由於區議員日常需經常出席酬酢活動，但致送花籃的費用卻不能申領津貼，故區議員一直要求增加這方面津貼減輕負擔，經多年爭取後，當局終接納要求，建議新增「酬酢及聯絡開支」，每年最多可申領一萬九千多元，有關開支也可用於非牟利性質的社區聯誼活動。  此外，區議員現時申領公帑印刷名片，不可印上其他職銜，據了解當局正考慮放寬規定，准許議員同時印上專業資格、政黨或非牟利團體職位，但香港以外的職銜，則要再檢討。
20050731-4,20050731,4,民運人士入境被留難,民運人士入境被留難 【本報訊】海外民運人士經常指香港政府有民運人士「黑名單」。  據《中央社》昨日報道，本月十三日中國民主團結聯盟主席薛偉持美國護照由澳門赴港，香港入境處人員盤查他兩小時後對他說，原本按規定他可免簽證留港一個月，但今次只批准他入境二十四小時，並在他的護照上蓋上有關字句，且未有解釋原因。  薛偉離港返澳門時，一度因護照上的蓋印，遭澳門要他立即離境返美，但當薛向澳門關員解釋自己是民運人士時，澳門當局即批准他入境。薛稱以往到港從未受到阻撓，他估計今次遭遇，可能與他去年當上中國民主團結聯盟主席有關，質疑香港入境處有民運人士「黑名單」。  身兼支聯會副主席的立法會議員何俊仁批評，香港對異見人士入境限制，一直較澳門更嚴苛，從他向政府了解，有關決定並非是中央要求，他批評政府這樣做，只會破壞香港國際城市聲譽，令人質疑是否落實「一國兩制」。
20050731-5,20050731,5,民園麵家最後也最輝煌的一天,民園麵家最後也最輝煌的一天 【本報訊】佇立中環八十年見證周遭環境大變身、標誌着香港獨特大牌檔文化的民園麵家，昨日光榮結業。雖然雨點恍似纏綿道別似的不肯停下，但仍有不少市民甘願冒雨撐傘光顧，把握最後機會品嘗民園馳名的牛腩及豬手麵。民園負責人之一的李建坤對市民的熱情支持深受感動，他希望將來有機會東山再起，與知音重拾昔日香港情懷。  民園昨踏入生命最後一頁，早上開檔前已有食客排隊等候；大批食客將只有六張桌子的民園「迫爆」。李建坤說，為應付大批食客，民園昨預備了八盆牛腩及四盆豬手，較平日多一倍，但豬手及牛腩於傍晚前已售清。  昨日不少市民扶老攜幼專程光顧，其中老主顧姚小姐帶同四歲兒子趕上最後一天，她說：「呢度嘅牛腩撈麵最好食，十年前搬走後，今次係第一次返嚟，諗住帶個仔嚟見識大牌檔嘅特色，同埋了解吓佢媽咪成長嘅地方。」  另一位自七十年代起經常光顧民園的外籍人士關尚義，用流利廣東話說可惜，「呢類大牌檔係香港特殊次文化，但𠵱家要結束好可惜，下一代冇咗呢方面嘅經驗，希望香港可保留番呢種大牌檔文化。」 食客寫心意卡表心聲 而一直爭取政府續牌予民園的中區區議員甘乃威昨日攜同心意卡到民園，讓食客寫上心聲，他批評當局官僚，他促請當局應保留本港這類具歷史的大牌檔。  民園於昨晚八時許全部食品售清後正式關門結業，李建坤眼紅紅地說：「真係唔捨得，𠵱家係我一生中最傷感同無奈嘅時刻，今日亦都係民園開舖以來最輝煌嘅時刻，今日生意比平日多兩成，對於市民咁熱烈支持非常感動，希望將來有機會再繼續營業。」  有八十年歷史的民園麵家因其持牌人黃光慶於今年五月離世，法例未許麵檔合夥人李建坤繼承牌照，被迫結業，雖然社會各界爭取食環署續牌予民園，但最終失敗。
20050731-6,20050731,6,下周日阿仙奴對車路士賽事受注馬會新推「走地盤」撼外圍,下周日阿仙奴對車路士賽事受注 馬會新推「走地盤」撼外圍 【本報訊】歐洲各地主流足球聯賽陸續開鑼，香港賽馬會足智彩將推出多項新投注形式迎接新球季，其中新設開賽後仍受注的「即場投注」，將於下月七日星期日舉行的英格蘭社區盾大戰阿仙奴對車路士時，初次接受投注，務求打擊目前非法外圍盛行的「走地盤」賭法。　記者：曾雁平、蔡建豪 據悉，足智彩將在新球季落實多項新猷，除首設走地盤形式的「即場投注」外，包括混合過關等各項過關項目上限亦會放寬，由目前的六關增至八關。混合過關將較賽馬早一步，可透過電話投注、網上及投注寶等投注形式，預計馬會將於周內公布新球季各項新措施及詳情。 只在直播賽事受注 消息稱，「即場投注」只會在直播賽事受注，推出初期會如以往初推出的新玩法一樣，每個比賽天只有一至兩場賽事受注，待投注人士熟習後始增加場次，足智彩已選定下月初本球季首場矚目大戰英格蘭社區盾阿仙奴對車路士，作為即場投注的頭炮。  有線電視球彩台主持許諾輝指出，「即場投注」未必可以吸引大眾球迷下注，「足智彩今次推出『即場投注』，可能係想建立一啲自己嘅玩法。」不過，對普羅球迷嚟講，就未必有太大吸引力，因如比賽有比數，領先一隊的主客和賠率就會大幅調低，除非是大戶作套戥，否則大多不會再追勝方。」他直言，相對即場亞洲盤回報一般高達投注額的八至九成，會較吸引投注人士。  事實上，非法外圍的活躍程度已隨足球博彩規範化減低，外圍莊家為與足智彩抗衡，近季推出「走地亞洲盤」，以求保障收入。  一名熟悉非法外圍運作的人士透露，由於球迷可看過陣容及球隊臨場表現後始下注，現已吸引到相當數量的球迷轉玩非法走地盤。 「外圍唔使即時交收」 廣東省電視台足球評述員何輝則表示，即時投注不會提升中彩機會，「足球比賽充滿變數，就算看過比賽也沒有甚麼保證，而上季尾就聽聞不少球迷落注『走地盤』，在最後幾分鐘由贏變輸。」  他認為即場投注未必能有效打擊外圍的「走地盤」，「雖然兩者同樣開波後也可落注，但係非法外圍最大優勢始終唔使即時交收，可『篤數』、甚至買『白頭片』，係合法投注途徑無法提供到嘅方便。」
20050731-7,20050731,7,走地盤隨戰況調節盤口,走地盤隨戰況調節盤口 俗稱的「走地波」是目前非法外圍莊家流行的賭波形式，投注人士可在球賽開始後繼續落注，現時亞洲外圍莊家主要提供走地亞洲盤，其中盤口讓球數和水位會隨戰局變化而調整，莊家亦會隨賽事形勢調節亞洲盤盤口，勝負依據下注時的盤口至九十分鐘完場賽果為依歸。  海外博彩公司和亞洲外圍莊家亦有提供半場亞洲盤，莊家會在半場時間提供一個全新亞洲盤盤口，派彩則以下半場賽果為依歸。至於足智彩新推出的玩法即場投注，則單一調節提供賽事主客和賠率，賠率隨戰局變化而調整，派彩以全場九十分鐘完場賽果為依歸。即時投注會因球賽一早大局已定，致一方面派彩變得乏味，亞洲走地盤則可藉盤口變動，平衡投注對賽兩隊球隊的勝出機會。
20050731-8,20050731,8,衛星訊號延誤馬會有風險,衛星訊號延誤馬會有風險 馬會足智彩於新球季直播賽事接受即場投注，投注人可透過觀看球賽過程，開賽後始決定如何下注。不過，由於衞星訊號傳送期間存在延誤，馬會受注期間亦要承受風險，或會被投注人士掌握數秒空間，贏取最高回報率。  現時本港直播的足球賽事畫面，難免與歐洲當地比賽現場存在至少數秒的時間差異，由於即場投注賠率會隨即場賽果調節，賽果或會在衞星訊號傳遞期間發生變化，馬會受注期間亦要承擔風險。 利用時差投注有前例 本港警方今年初曾破獲一宗非法收受波纜案件，涉案集團透過駐於歐洲地區球賽現場的人員，以長途電話通報賽事發展，再把握時差、利用網上投注「走地波」牟利。  即時投注大大增加足球賽事的可觀性，澳門彩票過去一年一直研究，開設與非法外圍相類似的即場亞洲盤走地波投注，該公司發言人回應查詢時承認，走地波投注存在不少技術問題，當地球賽直播次數較少，以及資訊準確性均屬考慮因素，現仍需進一步測試及評估走地波的風險。  外國不少接受即時投注的大型博彩網站，在球賽出現角球或罰球等入球機會時，會短暫停止受注，以保障被投注人士利用衞星訊號傳遞的誤差。  本報記者
20050731-9,20050731,9,漫畫節電玩展勁賣新玩具,漫畫節電玩展勁賣新玩具 【本報訊】漫畫節及電玩展繼續旺場，玩具商趁機勁推新產品，其中成為日本少男少女愛情顧問的點頭公仔，同樣受充滿愛的疑惑的本地青年歡迎；愛「篤」魚蛋、身穿本地校服的港產公仔，最易讓本地青年產生共鳴；以歌曲餵飼的電子狗則可解家中難養真狗的苦悶。 「點頭公仔」搶灘 人潮昨再迫爆漫畫節及電玩展會場，漫畫商攤位仍車水馬龍，天下出版董事兼副總裁馬淑珠說，有信心今年營業額比去年多逾一倍。漫畫迷花費隨精品多售罄而稍減，但年輕人一點也不寂寞，擠到玩具攤位繼續「血拼」。  名為Unazukin的兩吋高公仔令不少少女大呼：「好得意呀。」Bandai發言人版權及傳媒執行員黃瑞寧稱，Unazukin意思是「披着斗篷的點頭公仔」，日本已推出第四代，每次都賣斷市；漫畫節是本地首賣點，每個售五十多元，兩天內多次需補貨。  她說，公仔感應聲音後會隨機地點頭或搖頭，日本人會向它訴心事：「問吓好唔好揀個男仔做男友，公仔點頭即係好，搖頭就搵第個。」她說當地瘋狂程度媲美當年的他媽哥池：「去到邊都會帶住。」  黃瑞寧說，設計師的靈感源自居於遠郊的祖母：「佢嫲嫲可以同公仔講嘢，冇咁悶。」她說日本新一代多為獨生，少有傾訴對象，故大行其道，料本港同樣寂寞的年輕男女也會着迷；同場亦有售公仔飾物及匙扣等。  由本地創作的孖公仔也搶手，環球Hobby館經理黃俊航表示，Mimi及Momo像芭比般可換漂亮衣服，但造型手工卻像男孩子愛玩的手辦公仔，故顧客男女各佔一半；孖公仔更極富地道特色，如手持魚蛋及身穿本地學校校服，並愛玩時下青年的玩意。本地青年易生共鳴：「唔會好似美國或者日本公仔咁冇親切感。」他說，過去兩天八百個公仔差不多售罄需補貨。 電子狗肚餓食歌 由恆景電子遊戲總代理的日本產品第一代電子寵物狗已推出，牠肚餓時要食「歌」，方法是駁上MP3輸入音樂，牠就變成喇叭狗播出歌曲；牠亦會隨心情播放不同旋律音樂，每隻售三百多元。  Lego攤位亦人頭湧湧，因售賣的都是限定品，如盛蛋器、冰格及磁石積木及售數千元的巨型積木公仔，大都賣斷市。
20050731-10,20050731,10,9歲醒目女及時助救火,9歲醒目女及時助救火 【本報訊】灣仔昨發生抽濕機自焚意外，一部使用四年抽濕機突然冒煙起火，屋內一名九歲機警女童臨危不亂，記起師長教誨先關掉電源及撥電報警。事件中女童與四歲妹妹和外傭均無受傷，消防員調查後懷疑電線短路起火。 關電掣報警呼救 機警女童姓李，叫「婷婷」，與父母及四歲妹妹居於灣仔堅拿道西九號友光大廈七樓一單位，警員及消防員事後稱讚女童鎮定。據李母稱，自焚抽濕機於四年前購入，火警中抽濕機頂部塑膠按鈕及外殼焚毀，機電工程署人員事後取走自焚抽濕機檢驗。  昨上午十時，李母發現「婷婷」睡房積聚濕氣，於是開動抽濕機吸走濕氣，稍後她外出留下印尼女傭照顧「婷婷」及四歲幼女。約一小時後，「婷婷」嗅到陣陣焦臭味，她循異味追查赫見房中抽濕機冒煙起火。  據她事後憶述，當時火光熊熊，她急忙關掉抽濕機電掣電源，然後呼喚女傭求助，女傭即時取水到來灌救。其間「婷婷」想起師長教導遇上危急事情要報警求助，於是拿起電話撥電報警求救。外傭稍後救熄火勢，帶領「婷婷」兩姊妹逃生。
20050731-11,20050731,11,周一嶽急推防疫措施機場向四川旅客派傳單,周一嶽急推防疫措施 機場向四川旅客派傳單 【本報訊】被各界批評應付豬鏈球菌被動後，港府昨急推多項新措施防範疫症入侵，更高調透露由衞生福利及食物局局長周一嶽統領的跨部門工作小組昨召開會議，強調會繼續對疫症保持警覺。議員批評港府拖延至今才推出防範措施，已延誤掌握四川疫情。  衞福局署理常任秘書長陳育德昨否認港府處事被動，重申不宣布停止四川豬肉入口，是因為現時尚無科學證據顯示四川疫情與進食豬肉有關，若本港單方面宣布禁止四川豬肉入口，難以向國際交代。  他又說前日得悉北京市禁止四川豬肉入口後，即向國家質檢總局查詢，獲覆內地疫情未有新發展，故本港暫毋須採取相同措施。 仍未提及禁川豬 港府昨晚公布，周一嶽領導的跨部門小組昨開會後，推出多項防範措施，包括在機場向來往四川的旅客派發單張，提醒他們避免接觸豬隻；並每日聯絡內地對口單位掌握最新疫情。當局新推出的措施，並無提及在甚麼情況下才禁止四川或內地其他省市活豬及豬肉進口。衞福局發言人稱工作小組上周一成立，成員包括局內多個相關部門十多人，有需要時會邀請其他部門加入，小組已常規化每日開會。  港府消息人士強調，目前措施能保障市民健康，至於市民憂慮入口豬肉傳播疫症，主要是心理因素，消息又稱特首曾蔭權重視事態發展，現交周一嶽全力處理。立法會議員李華明慨歎官員始終未能吸取教訓，至今才推出防範措施，令人質疑捍衞市民健康的決心。
20050731-12,20050731,12,「天鷹」強風吹側貨船,「天鷹」強風吹側貨船 【本報訊】受到熱帶風暴「天鷹」相關的外圍雨帶影響，本港離岸海域昨日吹強風，海面有大浪及狂風雷暴，導致汲水門及西貢海面先後有兩艘貨船擱淺及被吹至翻側，幸而無造成傷亡事故。 西貢大浪灣海面擱淺 前晚十一時許，一艘長逾五十米載滿貨櫃箱的內地船，離港返回內地途中，駛經深井青龍頭對開海面時，在風雨中意外撞向岸邊淺灘擱淺，船頭損毀入水，船上八名內地船員未有受傷，事後報警求助，其後消防船及水警輪接報到場協助將船上積水抽走，而船公司則在昨日凌晨派出拖船將遇險的船救離險境。  另外，昨晨六時五十分，有船隻駛經西貢大浪灣海面，發現一艘二十米長五米闊的貨船在沙灘對開五十米的海上傾側擱淺，於是報警。水警輪到場調查，在船上發現五十箱牛肚，另有六十箱牛肚在海上漂浮，而船上則空無一人，懷疑已乘其他船隻安全離開，警方調查後相信該貨船是遇風浪擱淺，事件並無可疑。被發現的百多箱牛肚事後交由食環署處理，而海事處已接手進行調查。
