key,date,article_daily_id,title,text
20051210-219,20051210,219,淺談債與息：長短息預示美息快見頂,淺談債與息：長短息預示美息快見頂 還有不到數天，美國聯儲局便會揭曉今年最後一次議息結果。市場普遍相信，下周二美國公開市場委員會將會進一步加息1/4厘，令美國歷史性地在一年內加息8次，也是自去年6月以來連續第13次加息，加息幅度更是劃一的0.25%。  到底這次加息之後，是否代表美國加息周期已進入倒數，而明年中將會是息口見頂之時？  或許，美國國庫券已露出了一些蛛絲馬迹，不同期的債券孳息率帶來了對後市的啟示。在過去一兩周中，美債先後出現多次長息低於短息的現象。  以本周初為例，兩年期的孳息率為4.45%，而三年期的孳息率則略低0.01%，報4.44%。對上一次出現這種不合理的現象，已是5年前的事了。  按正常情況，期限愈長，利息應愈高，因為資金被鎖死的時間多了，利息回報理應相應提高，才能抵銷這方面的流動性風險；又有解釋說，短期的利息收益可再次享受息叠息的回報，相對地，一次過鎖定長期資金，便沒有了這方面的優惠，故利率必須較高才合理。    長息較高非必然  事實上，在一般情況下，長息在大部份時間都是較短息高的，然而，若往後經濟可能轉壞，利率甚至有下調壓力時，倘若今天不把利率鎖定，日後存款續期時，可能只能取得較低息率。既然如此，長息便可能遭市場力量推低，出現三年期回報率較兩年期的為低的現象。  翻查紀錄，上次出現同類現象是在2000年11月，當時聯邦基金利率為6.5%，處於10年以來的最高水平。過了約2個月後，美息便於翌年1月3日開始下調。所以，這次美債孳息率的改變，可能反映了加息已接近尾聲了。  陳鳳翔  中國工商銀行（亞洲）財資部主管
20051210-220,20051210,220,會後聲明或刪「寬鬆」政策措詞儲局下周再加息1/4厘,會後聲明或刪「寬鬆」政策措詞 儲局下周再加息1/4厘 經濟研究員一致認為，美國聯邦儲備局未來兩次議息會議將合共加息半厘。但部份研究員估計，當局下周的會後聲明可能改變措詞，或刪去有關貨幣政策仍「寬鬆」的字眼，不過會小心處理，以免市場反應過大。 【本報綜合報道】路透社的調查發現，所有20位經濟研究員皆預測，聯儲局下周二議息後會加息0.25厘，把聯邦基金目標利率調升至4.25厘；明年1月31日（聯儲局主席格林斯潘任滿前最後一次會議）料再加息0.25厘。 將會避免刺激市場 今次調查結果與上月略有分別，當時有4位經濟研究員預測，聯儲局下月開會後將按兵不動。  自聯儲局去年6月展開加息周期以來，其會後聲明一直表示其貨幣政策「寬鬆」（accmomodative），當局可能繼續「循序漸進地」（measured）加息。分析員正爭論當局會否改變措詞。  調查顯示，過半數經濟研究員（共11人）估計下周二的聲明措詞會有轉變，但一些人認為當局會到明年1月或3月美國經濟更明朗時，才改變聲明內容。  聯儲局上月會議紀錄顯示，當局有意改變會後聲明的部份措詞。有分析員認為，下周的聲明或不再表示貨幣政策仍「寬鬆」，但他們說，這意味美國利率接近「中性」，市場會以為加息周期快將結束，故當局須審慎行事，以免市場反應過大。聯儲局官員未有詳述何謂中性利率，這亦反映當局或須再加息。 仍暗示利率未見頂 一些分析員認為，聯儲局下周將保留「循序漸進地」加息的字眼，因美國近期經濟數據理想，故當局下周議息後會起碼再加息一次。高盛證券亦估計當局下周會刪除「寬鬆」字眼，或改為表示「為控制通脹，循進加息可能是恰當做法。」
20051210-221,20051210,221,消費情緒4月最佳,消費情緒4月最佳 【本報綜合報道】美國本月消費者情緒改善，是4個月來最佳，得益於汽油價格下降，令家庭有更多閒資消費。但美股昨天早段上升乏力，因英特爾（Intel）調低第4季營業額預測，以及默克（Merck）被指摘低估其治療關節炎藥物Vioxx產生的副作用。  密歇根大學公布，消費者情緒指數由11月的81.6，升到12月的88.7，是8月以來最高，且優於市場估計的85.5。  杜瓊斯工業平均指數早段一度升18.57（0.17%），見10773.69。納斯達克綜合指數最多升5.86（0.26%），至2252.32。開市後半小時（本港時間昨晚11時），杜指升5.69，報10760.81；納指升1.75，報2248.21。  在周四，杜指挫55.79，收報10755.12；納指跌5.55，收報2246.46。
20051210-222,20051210,222,WTO經濟效益達4萬億,WTO經濟效益達4萬億 謝國忠表示，若下周在港舉行的世貿（WTO）部長級會議，成功推進多哈回合談判於明年完成，全球經濟增長可望增加0.5%，相當每年經濟效益額外增加5000億美元（約4萬億元）；不過他對會議談判結果並不樂觀。  謝國忠昨出席總商會午餐會後表示，是次會議焦點是促使發展中國家開放服務業，發達國家則降低農業補貼，然而歐盟似乎不願削減對農產品補貼，故會議成功機會很微。 歐盟不願削補貼 他指出過去4年是全球經濟歷來最蓬勃時刻，02至05年分別達4.5%、5%、5%和4.6%的高速增長，遠高於以往平均的3.7%，主要有賴全球經濟一體化下，配合資訊科技發展，讓中國大量廉價勞動力投入市場所致，大大提高生產能力並壓抑通脹。他估計未來5年，全球通脹率會繼續保持在2%的低位。  貿發局首席經濟師梁海國亦指出，世貿會議推動自由化、降低關稅和減少配額，對貧窮國家有利。而透過多邊貿易談判，歐盟的關稅已由50年代的20%，降至現時2至3%；美國由15%降到2至3%；全球貿易佔整體經濟亦由70年代12%，升至30%。
20051210-223,20051210,223,金價衝上530美元,金價衝上530美元 【本報綜合報道】國際現貨金價昨天突破另一心理關口530美元，續創24年半新高，因市傳中國吸納黃金，加上基金持續追捧。  在投機買盤推動下，國際現貨金一度勁揚9.60美元（1.84%），攀上每盎斯530.75美元。本港時間昨晚11時半，金價報530.35美元，升9.20美元。  新加坡對沖基金SwissAsiaCapital投資總監金納表示，深信中國和一些亞洲國家正在購入黃金，但要等到他們買入足夠黃金後才能肯定。 紐約期油見1月高位 另外，國際原油期貨價格昨天升至1個月高位，天然氣價格更創下歷史新高，反映市場關注美國本月可能較往常寒冷，令這個全球最大能源消粍國的冬季燃料供應呈現緊張。  紐約原油1月期貨曾漲至每桶61.50美元，升84美仙（1.38%），是上月4日以來最高價。倫敦布蘭特原油1月期貨高位一度見每桶59.58美元，升91美仙（1.55%）。  本港時間昨晚11時，紐約期油報60.60美元，倒跌6美仙；布蘭特期油報58.74美元，升7美仙。  紐約天然氣1月期貨價格曾高見每百萬英制熱量單位15.52美元，升52.6美仙（3.51%），是紐約商品交易所推出有關合約以來最高價；接近中段報14.75美元，跌24.4美仙。
20051210-224,20051210,224,日上季經濟僅增1%,日上季經濟僅增1% 【本報綜合報道】日本昨天出乎意料地向下修訂第3季經濟增長，主要由於當局大幅調低企業存貨數字，以及政府壓縮開支。但分析員指出，日本資訊科技業清理存貨的行動已屆尾聲，加上當局調高上季企業資本開支和私人消費升幅，反映這個全球第2大經濟體系仍在穩步復甦。  內閣府公布，今年第3季國內生產總值（GDP）年率增幅由原初統計的1.7%，向下修訂至1%，市場原先預期上季GDP升幅會調高至2.4%。除了存貨及政府開支因素外，日本次季經濟增長由3.3%顯著調升至5%，也是導致上季GDP升幅被下調的部分原因。日本上季GDP按季增幅亦由0.4%向下修訂為0.2%，低於次季的1.2%。  上季企業存貨由原初公布的無升跌，修訂為下跌0.4%，其中電子通訊設備、電視、工廠機械臂以及建築機械存貨均減少。政府投資升幅由1%向下修訂為0.3%。不過，上季企業資本開支升幅由原初估計的0.7%大幅調升為1.6%；私人消費升幅由0.3%調升為0.4%。企業投資和私人消費分別佔日本整體經濟約17%和一半。 復甦前景仍穩 分析員指出，上季GDP修訂數字看來欠佳，其實上季企業資本開支和私人消費升幅被調高，以及存貨下跌都是好兆頭。他們說，存貨減少顯示資訊科技業自去年中以來的清理存貨行動已屆尾聲。
20051210-225,20051210,225,瑞穗落錯盤蝕300億圓,瑞穗落錯盤蝕300億圓 【本報綜合報道】日本瑞穗證券承認，前日錯誤以1日圓落盤沽空逾6萬股J-Com股票，損失可能高達300億日圓（約19.4億港元）。  瑞穗證券社長福田真在記者會表示，曾4度嘗試取消錯盤，可惜都未能成功。他指出，錯盤迄今造成大約270億日圓（約17.5億港元）損失，但數字最終可能高達300億日圓，因為該公司仍須回補空倉，惟今次出錯不會危及其財政狀況。  270億日圓的損失幾乎相當於瑞穗證券上財政年度（截至3月底）的281億日圓純利，但只佔母公司瑞穗金融集團本年度（截至明年3月底）6300億日圓預計純利的4.3%。瑞穗金融集團股價昨天曾下滑2.25%，最後倒升2.02%，收報90.8萬日圓。 東交所遭批評 福田真透露，瑞穗證券在東京時間周四上午9時27分，一名交易員錯誤以1日圓沽空61萬股首日掛牌的J-Com股票，原本應該是替一位客戶在61萬日圓（約3.95萬港元）的價位沽出1股。  日本證券經濟研究所主任研究員佐賀卓雄批評，東京證券交易所很離譜，竟然沒有任何機制阻止此等不可思議的錯盤。  根據現行的交易規例，證券行不能隨便取消已落盤的交易。
20051210-226,20051210,226,國際視野：龍的故事與好萊塢橋段,國際視野：龍的故事與好萊塢橋段 易經曰：一陰一陽之謂道。易學中的太極圈是圓的，代表周而復始、循環無間。圈中的黑與白，俗稱陰陽魚，是表示事物的兩面性、相對性、矛盾性。陰陽魚內還有小圓圈，顯示陰中夾陽、陽中藏陰，以筆者膚淺的理解，是表述了事物不論如何發展，當中都隱藏着盛中有衰、否極泰來之規律或道理。  瞧瞧目前世界經濟的發展，宏觀點看，不少經濟活動都集中在東西方之交流，而當中最被提及的貿易糾紛、滙率爭議、資源吸納、資金流向等問題，不也是涉及東方的中國和西方的美國，從而隱約出現了陰陽魚之現象嗎？    基金趁機渾水摸魚  就是因為這樣，故此「龍的故事」和「好萊塢橋段」才會被利用作為炒作的好藉口。這個世界還分兩批投資者，短線代表當然要數如雨後春筍般冒起的對沖基金，中長線守護神則有傳統的互惠或退休基金。前者受限制程度有限，故活動範圍甚廣兼靈活，只要有快錢搵的地方，必「差」隻手埋去，部份有管理費收、有花紅分，正一關人，你估他們賺得多抑或出資班儍佬？後者因受不同法例管制，手法較循規蹈矩及保守，亦多以客戶利益為依歸，故在風險管理方面較為謹慎，大多以投資債券、優質股票組合或其他如已證券化與地產有關的票據等，但兩者也各有長短線之投資戥勻。  「好萊塢橋段」五花八門，有時高深莫測，令人歎為觀止。有些人自以為出自名牌（大學或大行），便能登上擂台，豈料卻被抽至似豬頭甚或被擊倒，這是思維問題。「龍的故事」也鑊鑊新鮮鑊鑊「甘」，油價升是你、金屬商品期貨屢創高又是你、人家赤字不斷擴大更是你，不被短打者（對沖基金）炒個不亦樂乎才怪。然則有相對、有矛盾才是「道」，大家都要珍惜！！  王冠一
20051210-227,20051210,227,為收回再招標準備九鐵要求屯門站減補價,為收回再招標準備 九鐵要求屯門站減補價 【本報訊】因補地價超高令招標反應慘淡的九鐵屯門站上蓋發展項目，招標結果尚未揭盅，九鐵已率先要求與政府商討，力爭降低補地價，為項目一旦收回再招標作兩手準備。 兩手準備　收回機會大 九鐵消息人士透露，九鐵董事局轄下的物業委員會於昨日開會，審核屯門站上蓋項目唯一一份由長實（001）提交的標書，有關標書將再交由環境運輸及工務局、財經事務及庫務局等官員，組成的屯門站物業發展管理局審批，決定會否批出發展權，抑或收回重新招標。  雖然結果未定，但九鐵已作出兩手準備，主動向地政總署提出再商討調低補地價金額。九鐵認為，屯門站的補地價過高，令市場難以接受，以致招標反應冷淡，希望政府可以降低項目的補地價金額。九鐵發言人對補地價不予置評，只表示目前正審核有關標書，希望盡快公布結果。  從九鐵的舉動，顯示屯門站收回的機會頗大。 嫌補價貴　僅收1標書 第一太平戴維斯物業估價及專業顧問行政董事陳超國指出，由於屯門站的標書已列明，發展商一旦入標，即代表接納補價金額，故不能就補地價提出上訴。是次九鐵要求政府降低補地價，可能是為收回項目重新招標作準備。 7幢住宅　投資逾70億 剛於兩周前截標的屯門站項目，因首期補地價高逾34億元，每呎樓面地價達3500元，遠超同區現樓呎價。多家發展商均批評，項目的補地價超高，其中新世界發展（017）董事兼集團總經理梁志堅更直指「貴到離譜」，結果獲邀入標的10家財團之中，只有長實以獨資形式參與，令屯門站成為歷來兩鐵招標項目中，反應最差的一個。  總投資額超過70億元的屯門站上蓋發展項目，將興建7幢32至39層高住宅連商場，提供1924個單位，總樓面面積達156萬方呎。
20051210-228,20051210,228,CIT售豪宅換入鰂魚涌商廈,CIT售豪宅換入鰂魚涌商廈 【本報訊】英資基金CapitalandIncomeTrust（CIT）證實，已向置地購入鰂魚涌英皇道1063號全幢寫字樓，據悉成交價近12億元，平均每方呎約4500元，以呎租15元計，回報率只有4厘，該基金因應市況而轉換投資組合，同時以逾1.7億元，售出去年以1.6億元購入的山頂花園其中1座，獲微利。 山頂花園逾1.7億轉手 CIT顧問AlbertThump向本報表示，落實購入英皇道1063號商廈，總樓面約26萬方呎，現時出租率約90%，呎租約15元，預計未來有增幅。  他說，CIT同時以稍高於1.7億元，售出去年購入的山頂花園1幢，扣除雜費有微利，出售原因是套現購買售價吸引的英皇道商廈，作主要投資，估計短期內不會再進行收購。置地發言人對消息不予置評。  CIT於01年曾以1.32億元，購入中環荊威廣場9層寫子樓，去年10月以1.75億元轉售，獲利近33%，同期以1.6億元購入山頂花園。  英皇道1063號商廈位於船塢里及英皇道交界，原址為皇冠車行大廈，盈科集團於95年底以6.75億元向英之傑購入，8個月後以8.1億元轉售予置地重建，於1999年落成。  地產界人士說，該廈成交價雖然遠低於業主意向價18億元，但由於位置偏離地鐵站，呎價4500元屬合理。
20051210-229,20051210,229,避示威　灣仔客提前睇樓,避示威　灣仔客提前睇樓 【本報訊】美國下周二議息，市場預期本港銀行有機會再度加息，買賣氣氛觀望，令本周主要二手屋苑預約睇樓量未見太大起色。不過，美聯物業則指出，由於下周本港舉行世貿部長級會議，灣仔北一帶將成示威區，會實施改道或封路，為免引起不便，建議客戶提早安排睇樓，因而令灣仔區本周預約睇樓情況不跌反升。 整體氣氛一般 美聯物業區域經理蔡俊雄表示，世貿會議下周舉行，約六成原本計劃下周才睇樓的客戶，為免受突發事故影響，提前本周六日睇樓。該行過去兩周集中推介灣仔北物業，如修頓花園及熙華大廈，並舉行開放日，以避免因會議帶來的不便影響。  中原地產則指出，由於銀行有機會再加息，令大型屋苑睇樓氣氛未見明顯改善，預約睇樓量與上周相若。以鰂魚涌太古城為例，業主對後市觀望，本周有180組預約睇樓客，較上周減少10%。新界以沙田第一城睇樓氣氛較佳，本周有140組預約，較上周120組多16.7%。
20051210-230,20051210,230,曉廬凝聚各界猛人,曉廬凝聚各界猛人 【本報訊】男高音巴伐洛堤的「環球之旅告別演唱會」上周五喺香港舉行，演唱會因為由中建旗下的摩天豪宅曉廬冠名贊助，所以中建邀請不少城中發展商出席。  南豐集團當然是嘉賓之一，主席陳廷驊同助手張華清出席。陳廷驊一向甚少拍照，這次願站定任人影，都算少見。  一向積極贊助藝術活動的盈大執行董事李智康亦有到場。另外，還有不少政商界名人。  中建不愧是本港世家望族，請到唔同界別的猛人共聚一堂。
20051210-231,20051210,231,鯉灣天下傳首宗成交,鯉灣天下傳首宗成交 【本報訊】泛海集團（129）的油塘新盤鯉灣天下，無懼近期市況淡靜，計劃開賣。 呎價5800高市價18% 消息指出，該盤昨招待地產代理帶準買家參觀外，市傳18樓B室以呎價5800元，約516.2萬元成交，若屬實將是首宗成交。造價較鄰區二手價高18%。代理指出，鄰近的藍田滙景花園海景單位，二手呎價約4900元。 地利根德閣嘉里售1伙 另外，嘉里建設（683）拆售中的中半山地利根德閣1及2座，剛售出1伙，美聯中半山助理營業董事何銘培表示，1座中層B室，3052方呎，成交價2170萬元，呎價7110元。據悉，單位意向價2350萬元，現以低約8%售出。
20051210-232,20051210,232,經絡推按季定息樓按,經絡推按季定息樓按 【本報訊】經絡集團及香港置業有見於本港銀行有機會下周再度加息，夥星展銀行，為一及二手樓買家提供按季定息計劃。星展銀行表示，使用該計劃，相比一般傳統優惠利率（P，7.75厘）減2.25厘樓按息率，首半年節省8%利息。 首半年可省8%利息 經絡按揭轉介首席副總裁鄭偉雄表示，計劃首年按季度鎖定息率，首季4.85厘，次季5.15厘，第三及第四季分別5.65及5.9厘，其後P減2.25厘，首年可延期還本，最高可按樓價95%。星展銀行按揭及有抵押貸款業務總監鍾少權表示，與一般P減2.25厘計劃比較，上述按季度定息，首半年節省利息8%。  香港置業營業董事姚偉南表示，上月二手住宅註冊有5206宗，較10月的5902宗跌11.8%。40個主要屋苑平均呎價跌至上月3717元，跌幅4.2%。
20051210-233,20051210,233,人民幣周內三創新高,人民幣周內三創新高 【本報訊】人民幣滙率本周內3度創新高紀錄，昨收報8.0765兌1美元；人行再透過10家商業銀行，完成28億美元的掉期操作。  市傳協定1年後的人民幣掉期滙價與上次相若，約為7.85兌1美元；人民幣不交收遠期合約折讓價則變化不大。美國聯儲局下周議息，港息昨稍微回軟，業界相信目前最優惠利率與同業拆息息差相距達3.5至3.75厘，理論上若美國加息0.25厘，本港難有理據超越美息加幅。 港息下周難超加 人民幣滙率從本周初的收盤價，報8.0808兌1美元，升至昨日的8.0765，一周累升0.05%，並創一周內滙價3度新高的紀錄。1年期人民幣不交收遠期滙價，收市報7.77兌1美元，與前日水平接近。  一外資行財資交易主管表示，人民幣現貨價保持緩慢向上爬行，1年期不交收遠期滙價仍徘徊7.77兌1美元水平；1個月港元拆息收報4.08厘。  摩根士丹利董事總經理兼亞太區首席經濟師謝國忠預期，明年人民幣有機會微升2%，美息則升至5厘水平，中國正面對過份投資問題，明年的鋼鐵、汽車等價格將會下降。 貿易順差105億美元 美國財長斯諾表示，中國加強滙率彈性，以及美國提高儲蓄率、其貿易夥伴經濟增長加速等，均是解決美國環球貿易失衡的關鍵，他認為中國應加快步伐，讓市場力量推動人民幣滙率朝更彈性方向邁進。  另外，中國商務部發表數據，11月份貿易順差達105億美元，稍低於市場預測；1至11月累計貿易順差，則達908.2億美元。
20051210-234,20051210,234,元朗工廈　4900萬元易手,元朗工廈　4900萬元易手 【本報訊】利嘉閣測量師行工商部區域董事楊龍表示，元朗康業街9號梁氏偉明工業大廈（前星拱工業大廈）全幢，約6.87萬方呎，剛以約4900萬元易手，每呎713元，市值呎租約3.5至4元，回報率逾6厘。  他說，有投資者年初以2650萬元，購入鄰近的永成漆廠全幢，約4.68萬方呎，現以確認人方式出售，意向價3800萬元，每呎約812元。  工廈投資熱持續，受追捧地區由葵涌、荃灣蔓延至元朗，福方國際（885）上月宣布，以5308萬元售出元朗灰沙圍福方數碼中心全幢，約9.79萬方呎，每呎542元，並以585.6萬元年租，租回最少一年。
20051210-235,20051210,235,亞洲凍倉　申請發展156伙,亞洲凍倉　申請發展156伙 【本報訊】恒基地產（012）年中以6.2億元，購入北角亞洲凍倉地皮後，現正式向城市規劃委員會申請，興建2幢商住及2座商業旅遊有關物業，提供156個住宅。另新鴻基地產（016）馬鞍山村住宅項目，昨日獲批建180幢獨立屋。  亞洲凍倉地皮面積約7.37萬方呎，細分南北兩地盤，南地盤約以8.15倍地積比率，興建2幢46至48層高商住物業，可建樓面約24.43萬方呎。北地盤主要在東區走廊之下，地積比率0.44倍，可建樓面約1.9萬方呎，興建2座1至2層高，與消閒文化及旅遊商業有關的物業。 莊士紅磡廣場起酒店 由莊士機構持有的莊士紅磡廣場，申請改建為1幢25層高，提供398間房的酒店，總樓面約12.3萬方呎。源興國際申請，將元朗1幅逾2萬方呎地皮，改變規劃用途，計劃發展1幢7層高酒店，提供306間房。至於裕泰興或有關人士持有的土瓜灣馬坑涌道1號地盤，則申請建1幢23層高住宅，提供376個單位。 馬鞍山村批建180洋房 此外，城規會批準新地在馬鞍山村的獨立屋發展，地盤約115.4萬方呎，住宅樓面約34.6萬方呎，建180幢連車房的2至3層高獨立屋。另附住客會所及公眾使用的訪客中心。
20051210-236,20051210,236,減價出貨南浪劈價31萬成交,減價出貨 南浪劈價31萬成交 祥益地產盤嘉茵指出，屯門南浪海灣1座中層D室，709方呎，早於3月份已放盤，至近日累積劈價31萬元，終獲買家以152萬元承接，減幅達17%，較01年購入價171.2萬元，貶值11.2%。荃灣荃威花園，亦難逃減價命運，世紀21陳愛如表示，G座高層4室，9月份放盤，開價136萬元，近日以123萬元獲承接，減價13萬元，近一成，相比市價則低逾5%。
20051210-237,20051210,237,樓市快訊香港　樂信台獲利23萬元,樓市快訊 香港　樂信台獲利23萬元 ▲美聯梁浩威指，西半山樂信台3座高層F室，面積967方呎，成交價683萬元，呎價7063元，原業主雖96年購入，獲利23萬元。    ▲利嘉閣李嘉華表示，鰂魚涌康怡花園本月暫只有3宗成交，其中G座高層10室，面積642方呎，成交價278萬元，呎價4330元，原業主97年買入，蝕205萬元。 海怡半島賺173萬成交 ▲中原謝文禮稱，鴨脷洲海怡半島9座高層H室，面積931方呎，成交價423萬元，呎價4544元，買家為投資者，原業主03年以250萬元購入，獲利173萬元。    ▲利嘉閣區振輝表示，中半山嘉富麗苑2座低層B室，1881方呎，1600萬元成交，呎價8506元。    ▲美聯李崇傑表示，跑馬地樂陶苑A座低層7室，2406方呎，1850萬元成交，呎價7689元。原業主2000年以1600萬元買入，賺250萬元。
