key,date,article_daily_id,title,text
20050130-106,20050130,106,容祖兒大馬談情說愛,容祖兒大馬談情說愛 容祖兒昨日在馬來西亞宣傳三月在雲頂舉行的演唱會，屆時太極樂隊的鄧健明和黃丹儀會擔任表演嘉賓。  當地傳媒問到祖兒的愛情生活時，她表示現階段感情一片空白，祖兒說：「雖然我𠵱家冇男朋友，但將來我識咗男朋友之後，都唔會刻意公開，始終呢啲係兩個人嘅嘢，如果傳媒影到我嘅拍拖相，我就一定會承認。」     讚陳奕迅專一   祖兒希望男友性格戇直及要懂得包容她，因為她是歌手，故二人不能拖手出街。有記者問祖兒為何不考慮圈中人？她表示自問姿色一般，怕圈中男友不會珍惜她，不過祖兒說：「我當然唔會一竹篙打一船人，陳奕迅同劉青雲係好專一。」
20050130-107,20050130,107,何韻詩法國驚魂5小時,何韻詩法國驚魂5小時 何韻詩昨日在九龍灣舉行簽名會時，即場捐出一百張新碟義賣，每張售價一百元，至少籌得一萬元，款項將透過樂施會捐予南亞海嘯災民。  阿詩說：「其實我哋唔好只為災難籌款，平日都要幫助世界各地嘅人。」     看歌劇被呃   阿詩透露早前到歐洲為ChristianDior拍照，回程時於法國機場滯留近五小時，她說：「本來上咗機，突然成班警察上嚟數人數，然後叫晒啲人落機，好似話少咗個人，佢哋喺機場劃個位畀我哋坐，有軍人攞住機槍，又有大狼狗，好似難民營咁，又好似恐怖襲擊。」幸好只是虛驚一場，阿詩說：「我都唔介意，好過喺飛機度爆炸呀。」  阿詩又謂在倫敦逗留五日，一心往看歌劇，怎料門票要七百多港元一張，她說：「我嘈咗好耐先退錢，佢哋想蝦我一個女仔，點知遇着個癲雞乸。」
20050130-108,20050130,108,日日練水與隊友談笑風生田亮絕口不提娛樂圈,日日練水與隊友談笑風生 田亮絕口不提娛樂圈 田亮雖被國家隊除名，但昨日患上感冒的他仍留守陝西游泳中心，接受連續十一個小時的刻苦訓練。現場所見田亮昨日心情開朗，笑容滿面，但他對涉及娛樂圈的任何話題都避而不談。 田亮昨日在陝西游泳中心進行訓練，他早上六時起床、吃早餐，七時接受體能鍛煉包括拉筋、體操及跳彈床；十二時放午飯，稍事休息後，下午二時開始跳水練習，至五時許結束集訓即返回宿舍。  田亮被國家隊除名後，連日來有不少傳媒往游泳中心追訪他，田亮亦有問必答。昨晨他心情不錯，與隊友有講有笑，更讓男隊員坐在他小腿上一起熱身，而田亮又與記者大談攝影經，態度合作，只避談所有關於娛樂圈的敏感話題。     漂亮是別人想法   昨晨田亮對記者重申當日獲悉被趕出國家隊，感覺很難過，他說：「我在隊中十一年，所有快樂、開心、不開心、成功、失敗，都在這裏度過，現在我的目標是為全運會備戰。」問到當初是由誰為他安排出席商業活動？田亮微笑說：「我只想回答有關訓練的事情，目前我會專心訓練，做好自己本份。」  這時有內地記者指田亮擁有一張漂亮臉孔，有條件當演員，田亮說：「這是別人的想法，我不想回答。我只想說自己的感受，希望你們體諒。」田亮在過去半年身陷花花世界，問他對重新受訓會否不適應？他說：「我八歲開始跳水，訓練了十八年，但只休息半年，怎會不能適應？運動員休息放假，調節身體是很平常的事。」  不過昨午傳媒卻突然被請到會議室等候，游泳中心聲稱田亮因患感冒，身體不適暫不接受採訪，田亮在離開中心時被問到病況如何，他只說：「還好，還好。」 傳霍英東助晶晶   田亮昨日又曾接受新華社錄影訪問，他受訪時表現嚴肅，對每個問題都三思作答。而陝西省體育局局長李明華昨日到游泳中心探望田亮，李明華說：「無論在質量、體能上，田亮都很好，他是一個好孩子，很乖。」李明華更否認田亮連日表悔意是為向國家隊示好。  此外，昨日有內地報道指田亮表示不會跟英皇解約，但他會與國家體育總局游泳運動管理中心溝通下一步的做法，他承認過往與中心缺乏溝通，希望這次溝通後過幾天能有結果。而昨天又有周刊報道指郭晶晶本與田亮同一命運，被國家隊開除，但獲男友霍啟剛祖父兼全國政協副主席霍英東出面求情，加上她肯公開表示悔意，才逃過一劫。  記者曾小嘉、盧健陝西直擊
20050130-109,20050130,109,兩岸雙向直航溶解56年霜凍,兩岸雙向直航溶解56年霜凍 兩岸自一九四九年分治以來，首次雙向對飛、中途不停第三地的包機直航。大陸六家和台灣兩家航空公司，昨日對開了十八班機，來往大陸的北京、上海、廣州和台灣的台北、高雄五個城巿，載客逾二千人次。大陸的民航機在五十六年來首次降落台灣，台灣民航機也完成從台北直飛北京的歷史之旅。 兩岸在○三年春節曾經實行台商包機，但只有台灣航機參與，而且中途必須停香港或澳門。今年的包機方案，毋須中停第三地，以來往北京和台北的航班為例，只需經過香港飛行管制區，飛行時間約四小時二十分鐘，較原先經第三地轉機節省兩小時。     南航頭啖湯首抵台北   昨晨八時零五分，南方航空的CZ3097航班，載着兩百四十二名乘客，在廣州白雲機場起飛，並在九時二十八分抵達台北桃園中正機場，成為五十六年來首班循合法途徑在台灣降落的大陸民航機。中正機場隨後舉辦歡迎活動，行政院陸委會副主委邱太三等官員到場歡迎抵埗台商。  在北京首都國際機場，中國國際航空公司的CA1087航班，載着一百四十名乘客在七時五十分起飛，在十一時四十分抵達台北，較預訂時間早了一小時。稍後，國航由北京飛往高雄的CA1085航班在十一時四十分抵達，較預訂時間早了一小時。而在上海浦東機場，東方航空和上海航空首班飛往台北的航機，亦在上午九時前起飛。     華航提早10分鐘飛京   在台北，飛往北京的「頭啖湯」由中華航空取得，華航的CI581航機較預定時間提前十分鐘，在七時五十分載着二百三十一名乘客起飛前往北京，在中午十二時抵達。長榮航空也在上午八時半，起飛了首班往北京的航機。兩家台灣航空公司的回程航機，已於昨晚八時前飛返台北。 昨日完成歷史之旅的機員和乘客，都感到榮幸和興奮難忘。首名在台灣降落的大陸機師、南航機長郝建華，在降落中正機場後難掩喜悅之情，打開機頭的窗戶向台灣媒體揮手，並在駕駛艙與機組人員拍照留下歷史紀錄。他下機後對記者說：「第一次到台灣，真的非常非常高興。」華航和長榮昨為首航北京舉行起飛儀式，包機的乘客也興奮地拍照留念，不少包機還在艙裏大開香檳，機組人員和乘客同慶歷史時刻。  本報記者
20050130-110,20050130,110,呂秀蓮：大陸對台打擊沒變,呂秀蓮：大陸對台打擊沒變 雖然兩岸包機直航終於實現，但台灣副總統呂秀蓮卻「大潑冷水」。她指兩岸的善意雖從包機開始，但大陸對台灣的態度並沒改變：「一方面要收攬民心，另一方面卻非常嚴厲的打擊。」     美：直航合乎兩岸利益   她呼籲大陸不要在外交上將台灣「趕盡殺絕」，應讓台灣加入聯合國，才能具體展現對台的善意。  台灣交通部民航局長張國政卻與呂秀蓮的意見相左，他表示，今年的包機方案較前年「向前跨了一步」，為兩岸民航交流打下堅實的基礎，相信兩岸平日的包機直航指日可待。陸委會副主任邱太三也表示，這次春節包機是兩岸歷史性的第一步，顯示兩岸可用擱置爭議、相互尊重、實事求是的方式，完成互利互惠、有利民生的交流活動。  至於春節包機是否可發展為兩岸間的「常態包機」，陸委會主委吳釗燮表示，當局會以「穩健腳步循序漸進」，日後不排除在春節外進行包機規劃，又指會繼續推動貨運包機，但能否成事要看大陸方面是否願意。美國國務院則發表聲明，歡迎兩岸實現春節直航包機，並指兩岸加強經濟聯繫，合乎兩岸的利益，亦有助增進台海地區的和平與安全。  本報記者
20050130-111,20050130,111,江澤民機師駕國航抵台北,江澤民機師駕國航抵台北 「我用國語向台灣人民致以美好的祝願！」為慶祝半個多世紀以來兩岸首次直航包機，北京安排前國家主席江澤民的出訪機師，負責北京首個飛往台灣的包機航班。而機師飛到台灣區域時，更棄用英語，改用國語，以示雙方都是中國人。     抵台上空用國語   五十六年以來，北京首飛台北的直航包機，航班編號為CA1087，客機為波音737-300型客機，由中國國際航空公司負責，而負責這次任務的三十七歲機師金宜斌，祖籍南京，飛行時間達一萬一千多小時，曾為江澤民出訪駕過專機。  金宜斌昨日起飛前接受內地記者訪問時表示，為保證包機直航萬無一失，前晚國航對兩架直航客機進行最後特別檢查。他指出，一般飛機在進行飛行後都進行正常的A檢、C檢或D檢，但在執行極為重要任務前，除正常檢查外，還要再「特別檢查」。  他說，此前只能在飛行圖上看台灣的山、水，看到的只是抽象的符號和黑白圖像。昨日他能親眼目睹台灣真實的青山綠水了。金宜斌準備飛到台灣區域時，用國語向對方致以美好的祝願，而不想用英語，他認為同是中國人用國語更為親切。  中新社
20050130-112,20050130,112,廣州發行直航首日封,廣州發行直航首日封 廣州市郵政局為慶祝兩岸春節直航包機，昨日特別發行紀念封，封面左下角印有寓意羊城人民的五羊石像遙望台灣，飛機聯繫兩岸的圖案，蓋上特製郵戳。至於郵票則選用鳳凰飛舞的《吉祥如意》祝福系列郵票。  《南方日報》
20050130-113,20050130,113,長榮靚空姐豔壓兩岸,長榮靚空姐豔壓兩岸 哪間公司的空姐最靚？台灣服裝設計師認為兩岸空姐都很漂亮，分別在造型及制服，華航制服較為過時，大陸海南空姐感覺像公安，太嚴肅，而南航穿大紅色很土氣。台灣長榮整體高雅，可惜髮型不夠清爽。  台灣《蘋果日報》
20050130-114,20050130,114,台商偕菲傭乘搭包機,台商偕菲傭乘搭包機 兩岸春節直航包機原規定只限台商及家眷乘搭，但昨日上午卻有普通台灣旅客，乘坐由台北飛往北京的華航包機到北京玩。另一名台商的妻子，計劃帶同一家坐包機到北京與丈夫團聚過年，她的菲傭也獲准乘搭包機。  中央社
20050130-115,20050130,115,統派揮舞雙旗迎台商,統派揮舞雙旗迎台商 大陸包機昨在台灣中正機場降落，一批「愛國同心會」民眾揮舞五星旗及青天白日滿地紅旗，歡迎台商及機員，直喊中國統一、反台獨、不承認陳水扁總統等口號，後來因慶祝儀式的參加資格與警員衝突。  台灣《中時晚報》
20050130-116,20050130,116,票站探路保妻安全壯丁組隊冒死投票,票站探路保妻安全 壯丁組隊冒死投票 面對威脅，有選民畏縮，但亦有人揚言今天冒生命危險也要投票。前空軍機師杰布里就打算把有意投票的選民組成「投票先頭部隊」，分兩批人投票，先由壯男打頭陣，若安全回家，才讓妻子前往投票。     「這是建設未來基礎」   杰布里計劃今早和一批壯男浩浩蕩蕩先到票站投票，希望透過人多勢眾的威勢，把武裝分子嚇倒。自從侯賽因政權被推翻，暴力襲擊不斷，杰布里一直活於恐懼中，現在伊拉克舉行半個世紀以來首次自由選舉，他誓要發揮公民權力，即使付上性命去投票也是值得。他說：「這是個里程碑，是建設伊拉克未來的基礎……冒險也是值得的。」  他說這個計劃靈感來自電視上一個政府廣告，內容是一名老翁被一班蒙面惡棍在後巷欺負，老翁拒絕退縮，之後愈來愈多公民加入，嚇走惡棍，帶出的訊息是「伊拉克平民團結起來，強大過極端分子」。  杰布里堅持投票，但同是前執政復興社會黨官員卻持不同想法，有的認為現在發生的一切對國民來說是「恥辱」；有的原想對新政府作出貢獻，但因過去的背景而被排擠，決定杯葛選舉。英國《衞報》指，今次大選似乎肯定會流血，只是不知流多少；而大選過後誰來掌權、武裝分子如何反應，也是未知之數。  英國《泰晤士報》/新華社
20050130-117,20050130,117,美軍武裝分子鬥法心理戰術左右選情,美軍武裝分子鬥法 心理戰術左右選情 在大選前夕，伊拉克武裝分子跟美軍和臨時政府進行心理戰較量。前者希望藉襲擊和恐嚇來壓低投票率，削弱大選認受性；後者透過加強保安和散播利好消息，營造安全氣氛，令選民安心去投票。  伊拉克臨時政府前天宣布已擒獲阿蓋德三號人物扎卡維三名助手，捉拿扎卡維本人亦指日可待，但官員亦承認這些人其實兩周之前已落網，留待選前兩日才公布，是想催谷公眾的投票信心。     巴格達如死城   首都巴格達氣氛不像打選戰，而像準備打仗。美軍直升機在市內嘈吵地低飛，把汽車防盜警鐘都弄響，伊拉克警察緊張兮兮地持槍，街上空空如死城。在武裝分子上月光天化日處決三名選舉官員的海法街，美軍巡邏次數由一日一次提高至三次。在另一武裝分子重鎮薩邁拉，美軍裝甲車隊一邊對付武裝分子，一邊用揚聲器廣播叫居民記住去投票。  扎卡維領導的武裝組織，近日不斷在互聯網發布反大選宣傳和恐嚇聲明。雖然伊拉克只有百分二人可上網，經由國內外報章與電視台報道，民眾一樣收到訊息。武裝分子頻密施襲，令不少選民猶豫不決。武裝分子昨天在巴格達和哈奈根發動炮彈和自殺式炸彈襲擊，造成至少十八人死亡，並對至少七個城市票站發動炸彈襲擊。  美聯社/法新社/路透社
20050130-118,20050130,118,米高積遜狎童案明開審15歲主角現身作供,米高積遜狎童案明開審 15歲主角現身作供 美國一代樂壇天王米高積遜被控狎童的「世紀審訊」，明日（周一）將正式開審，米高積遜在預審聆訊有得有失。得的，是法官裁定指控他的男童要上庭公開作證，在眾目睽睽下接受米高積遜律師盤問。失的，是警方在他家中搜出來的成人書刊影碟，以及觸發當局調查的爆炸性紀錄片，都列作呈堂證物。 上周五的最後一次預審聆訊，加州聖巴巴拉縣高等法院法官梅爾維爾作出了多個重要裁決，其中一大關鍵是要未成年證人出庭安排。現年十五歲的男童，指米高積遜前年二月至三月多次在其加州大宅「夢幻樂園」性侵犯他，弟弟目睹其中兩次。  控方想兩人出庭作證，但要閉門進行以保護他們。米高的律師梅塞羅說，「他們都已十多歲，不再是小孩子。他們不是檢控官口中的小羔羊」，暗示他們是為求財而誣陷米高。  最後，梅爾維爾裁定兩人要站上證人台，但警告如律師令兩人難堪，就會改為閉門作證。     警撿米高積遜鹹書呈堂   控方在物證方面則勝回兩仗。梅爾維爾裁定警方在「夢幻樂園」搜出來的五十件成人刊物和影碟，大部份可呈堂。檢察官佐嫩指這些物品性質有同性戀的，也有異性戀的，包括兒童或貌似兒童的裸照，足以證明米高積遜「對兒童有色慾」，又或者是誘惑兒童墮入性圈套的工具，其中一件證物有米高積遜和男童的指紋。 男童出鏡紀錄片列證物   梅爾維爾又裁定，可在庭上播放英國記者巴希爾攝製的紀錄片《米高積遜大追蹤》。米高在片中與案中男童牽手出鏡，承認有跟兒童共睡，前年播出後各界嘩然，後引起性侵犯指控。梅塞羅指該片以「荷李活手法」剪輯，高度斷章取義、歪曲事實以求引起哄動，但要求不列為證物不果。  米高積遜被控十項罪名，包括性侵犯兒童、向兒童灌酒和企圖非法禁錮，但他否認全部控罪。本案周一開審的第一件事是選陪審團，但以法院發出四千封傳召信，預計需時一個月才能選出十二名陪審員。米高每日須出庭，但梅爾維爾已叫他不要帶大批家人隨員到庭造勢，指法庭座位有限。  這次「世紀審訊」未開審已風波連連，男童向大陪審團指米高為他手淫的口供，較早前被傳媒公開，引起警方調查。米高獲准在今天發表錄影聲明，就保密口供外洩作出反擊。  法新社/美聯社/路透社
20050130-119,20050130,119,傳媒紮營訪世紀審訊,傳媒紮營訪世紀審訊 這場「世紀審訊」明天開審，美國傳媒無不嚴陣以待，數日前已開始在加州聖瑪莉亞法院外的停車場部署採訪工作。有傳媒職員已在法院外紮營，各電視台的衞星傳送車亦陸續抵達，法院周圍正逐步變成一個「傳媒村」。     媲美辛普森殺妻案   這情況就如當年美式足球明星辛普森因為被控殺妻，在洛杉磯法院出庭時那樣哄動。正忙於為儀器接駁電線的技工紐金特說：「我們要為全國廣播公司（NBC）及其附屬公司接駁十四部攝影機。」除鋪設全長數公里的電線，傳媒還要在法院附近設立臨時錄影廠。當地有商人出租空置辦公室給傳媒，大賺一筆。  有較大規模的電視台更在法院外搭建了升降台，讓旗下的星級主播可高居臨下。紐金特說：「那將是個馬戲團，會有大量人潮。」  英國廣播公司
20050130-120,20050130,120,意黑手黨訓練小童做殺手,意黑手黨訓練小童做殺手 意大利黑手黨惡名昭彰，不但作奸犯科，還將本來天真無邪的小童招攬成黨羽，把小至十歲的孩子訓練成殺手，教他們如何用槍來恐嚇他人和殺人。  意大利傳媒周末報道，執法官員和法律專家日前在南部阿普利亞區巴里，舉行一個關於黑手黨活動的研討會，巴里總檢察長迪比通托透露了一個駭人消息，就是當地黑手黨訓練小孩用槍，看看誰有犯罪天份，然後再加培訓他們當殺手。     教販毒用槍扶植當教父   巴里副檢察長迪格朗尼莫更引述一個真實個案，案中主角自小就與黑手黨持槍成員為伍，十歲時已開始替黑手黨售賣毒品，其後更接受訓練當殺手。  訓練期間，黑手黨成員不斷利誘他們，承諾會給他們很多錢，終有一天更可能被扶植成黑手黨「教父」。除物質誘惑外，這批「娃娃兵」更被賦予權力感，一槍在手，讓他們擁有可操生殺大權的感覺。     窮區1721童變「娃娃兵」   事實上，這些「娃娃兵」很年輕就賺很多錢，加上獲教父器重，令他們泥足深陷，愈難從歧路中抽身改過。  有社會學家估計，阿普利亞區現時有一千七百二十一名少年接受黑手黨訓練，他們大多來自區內的貧窮家庭。  為了遏止這個問題，有執法人員提議應起訴黑手黨「教父」招攬兒童加入犯罪集團，但有少年罪犯法官則認為，應為兒童提供教育和足夠社會服務計劃，教他們潔身自愛。  法新社
20050130-121,20050130,121,洛歇馬丁奪美總統直升機合約,"洛歇馬丁奪美總統直升機合約 美國海軍前日宣布，由洛歇馬丁跟歐洲公司設計的US101，奪得建造二十三架新一代總統專用直升機「海軍陸戰隊一號」的合約。這標誌西科爾斯基公司四十八年來壟斷總統直升機合約的年代終結。     議員不滿非「美國製造」   US101直升機，是根據英意兩國研製的三引擎EH101直升機加以改良，但飛行速度、航程和載人都不及西科爾斯基的VH92。新一代總統直升機的機身和螺旋槳都將在英國建造，傳導系統則在意大利建造，將於○九年十月投入服務。  洛歇馬丁奪得合約，帶出兩個重大意義：美國工作外判和美國軍火市場開放給外國承包商。此舉引來西科爾斯基公司位處的康湼狄格州議員德勞羅不滿，「『美國製造』應解作某些意思，國防部必須加以解釋」。     「總統需生存力強直升機」   不過，助理海軍部長揚格淡化處理採用US101對美國工業的影響，堅稱合約合乎買美國貨的規定；並強調「在反恐戰中，總統需要一架生存能力強的直升機」，確保未來總統的安全。這番話顯然是衝着西科爾斯基公司製造的直升機日前在伊拉克墜毀，造成三十一名美軍殉職。　美聯社 US101直升機規格   ‧高：6.6米  ‧長：19.2米  ‧闊：4.5米  ‧最大負重：6,124公斤  ‧航程：402公里  ‧載客量：14名乘客，4名機員  ‧時速：268公里"
20050130-122,20050130,122,字跡暴露英揆壓力大,字跡暴露英揆壓力大 英國首相貝理雅上周四在瑞士達沃斯出席世界經濟論壇會議時，遺下了他在紙上亂塗的字迹。經筆迹學家分析，發現他是個過份自信、反覆無常的人，正承受極大的壓力。     自信煩躁不認錯   筆迹學家貝奇說：「我十八個月前分析過他（貝理雅）的字迹，跟現在相比分別很大。當時他的字體圓渾得多，顯示他隨遇而安。例如寫『t』字，那個鈎不會起尖角。現在他比以前自信得多，但不少筆畫都起角，缺少彎曲，表現煩躁。」「他又經常重寫一些筆畫，我從未見過他這樣做的。他正承受非常沉重的壓力，令他出現了強迫性神經症。」  貝奇指貝理雅面對批評時，即使自知有錯，也不肯面對；紙上寫有很多四方形和三角形，更代表凡事要他作最後決定，不會受人影響。  英國《泰晤士報》
20050130-123,20050130,123,Cool字東西方看法異,Cool字東西方看法異 甚麼是「酷」（Cool）？出席世界經濟論壇「亞洲的酷」研討會的港、日、韓商界領袖，無法賦予精確定義，但同意亞洲社會「酷」的表現與西方大異：西方的「酷」是「自由與反叛」，亞洲則是「名牌與時髦」。     自由反叛Vs名牌時髦   香港Tom集團行政總裁王兟指出，皮具名牌LV目標顧客本是中年婦女，但不知何故大受亞洲年輕人歡迎，許多人節衣縮食也要買一個，覺得是時尚象徵。  「酷」也可能蘊育在地方，就像懷舊的上海「新天地」，對某些人來說代表真上海，但也有人視為最「酷」新景觀。  而且，即使「酷」本質一致，但在東西方文化上表現卻大異。以手機為例，歐美重視耐用，在亞洲卻往往六個月就更換，認為追上新科技才「酷」。  中央社
20050130-124,20050130,124,抗議普京濫權,抗議普京濫權 俄羅斯聖彼得堡市昨日有五千人示威，抗議總統普京政府濫用權力和踐踏平民權利，以及不滿當局立例以現金取代部份主要社會福利。  美聯社
20050130-125,20050130,125,60架波音787機售中國,60架波音787機售中國 美國波音公司跟空中巴士爭奪中國航空市場終贏回一仗，中國前日跟波音簽了中國民航史上最大額定單意向書，中國初步同意購入六十架波音787客機，總值約五百六十二億港元，把中國當天向空中巴士購買總值約一百一十億港元的五架A380比下去。  法新社/中新社
20050130-126,20050130,126,柬婦染禽流感送越救治,柬婦染禽流感送越救治 越南周末證實再有十三歲女童死於禽流感，是一個月內的第十一宗死亡個案。另外，柬埔寨一名婦人出現禽流感症狀，情況危殆，已被送到越南救治，若證實她感染禽流感，將是這波自去年底爆發的禽流感，首宗在越南以外地方有人感染個案。  美聯社
20050130-127,20050130,127,美增派軍機測伊朗空防,美增派軍機測伊朗空防 美國情報消息人士透露，美軍近日增派軍機進入伊朗領空，測試伊朗的空防力量，並為未來可能的軍事行動尋找攻擊目標。伊朗當局已多次就美軍戰機犯境一事發出警告，揚言會把入侵領空的美軍戰機擊落，但迄今未有發射過導彈。  英國《衞報》
20050130-128,20050130,128,南韓不再視北韓為主敵,南韓不再視北韓為主敵 將於周五出台的南韓國防白皮書，將會刪除已使用了十年的「主要敵人」概念，不再把北韓視為「主要敵人」，改為「對南韓造成直接軍事威脅」。不過，反對黨大國家黨指政府此舉形同「單方面精神上解除武裝」，損害南韓軍隊士氣。  法新社
