key,date,article_daily_id,title,text
20050416-117,20050416,117,嚴淑明揶揄章小蕙,嚴淑明揶揄章小蕙 嚴淑明日前出席台灣超視節目《命運好好玩》，節目上的堪輿師指「吸血狐狸精」的特徵是皮膚白裏透紅和肉軟，讓男人願意為她付出一切時，嚴淑明竟揶揄章小蕙。嚴淑明聽完堪輿師形容「吸血狐狸精」女子的面相時，她即衝口而出，以國語說：「章小蕙就是皮膚好白好嫩的那種，肉也好軟。」後來，嚴淑明又解釋說：「我不是說章小蕙是吸血狐狸精，不要誤會我。」  不過由於章小蕙近日正在美國探望在彼邦念書的兒子，她的助手表示已透過友人把有關節目片段錄下，才再決定是否採取法律行動。  此外，嚴淑明昨日在台灣拍外景時不慎受傷，事後往看醫生，她表示膝蓋受傷和腦震盪。  採訪、攝影：黎寶蘋
20050416-118,20050416,118,與秀姑、陳穎妍同月同日生志偉聽寧波車藏歌賀壽,與秀姑、陳穎妍同月同日生 志偉聽寧波車藏歌賀壽 曾志偉、黃杏秀及陳穎妍同在前日生日，三人除分別舉行生日會，志偉及陳穎妍亦有到賀秀姑的生日會，而志偉赴會前先與八位青海的寧波車一同茹素，獲獻唱藏語生日歌祝壽。 曾志偉、黃杏秀及陳穎妍均是四月十四日生日，前晚他們分別舉行生日派對，志偉與青海來港的寧波車吃齋後，先到灣仔出席秀姑的派對，陳穎妍亦有到場，之後他便到王子酒店出席自己的派對。     籌款建佛寺   志偉前晚先與約八位寧波車在銅鑼灣齋舖吃齋，何麗全及梅小惠等都在場，志偉表示幾位寧波車是來自青海的佛寺，來港主要傾談籌款建佛寺的事，席間寧波車們還以藏語唱生日歌送給志偉。到晚上十時多，志偉便到秀姑於灣仔集美會舉行的生日派對，而另一壽星女陳穎妍、苗僑偉夫婦、李克勤與盧淑儀、何家勁及樂易玲等都到賀。  秀姑等人在十二時多陸續送客，當阿叻送樂易玲離開時，他半帶醉意地搭着樂易玲肩膊說：「呢個我女友。」到秀姑步出，他左右各攬一人，秀姑表示其生日願望是身體健康，阿叻已送花及為她辦生日會，問為何不與志偉同辦，秀姑說：「佢今日食齋，我唔食咪分開囉，我等陣都去佢度。」     方便直接上房   而志偉逗留一個多小時便由後門走人，他到自己在王子酒店舉行的生日會，不少圈中人都有到賀，包括志偉兒子曾國祥與好友周浚偉、李蘢怡、李麗珍、許志安、余文樂及李珊珊等。  志偉表示其生日願望是身體健康，此乃他今年第四個生日會，他表示早已向友人呼籲不要送禮，將錢捐予福幼基金做善事，不少藝人支持其善舉。志偉又說：「我喺酒店搞係方便醉咗可直接上房。」  此外，於凌晨一時多才到場的張栢芝，逗留三小時後與梁漢文及蘇永康一同離去。  採訪：何永寧、卓寶花  攝影：陳偉權、娛樂突發組
20050416-119,20050416,119,17城市第二波大遊行京滬發警告遏反日示威,17城市第二波大遊行 京滬發警告遏反日示威 在日本外相町村信孝訪京前夕，北京、上海、廣州等十七個內地城市的民眾，正醞釀發動第二輪波瀾壯闊的反日示威。不過，京滬兩地的公安局突然警告，未經許可的集會、遊行、示威，或標語、口號未經公安批准的，一律視作非法行為，公安將追究法律責任。這與一周前，中國外交部肯定反日示威是愛國行動的取態，形成鮮明而強烈的對比。 自從中國各地爆發反日浪潮以來，日本當局幾乎每天都有主動的回應，町村信孝揚言要當面批評中國總理溫家寶，日本又批准民間企業鑽探東海油田。日方的挑釁舉動，令中國民間反日聲浪更大。     遊行未經批准視作非法   法新社稱，北京、廣州、瀋陽、成都、杭州、天津和武漢等城市，分別將在今、明兩日舉行反日示威。「中國保釣論壇」昨天更稱，內地至少有十七個城市的民眾，正以網絡形式互相聯絡，準備發動大規模反日遊行。亦有報道稱，上海今天亦將舉行反日示威。  不過，面對日方連串「攻勢」，加上海外輿論的批評，北京官方立場近日卻明顯軟化。北京市及上海市公安局分別在其官方網站上稱，《中華人民共和國集會遊行示威法》規定：凡舉行集會、遊行、示威活動的，要依法向公安機關提出申請並獲得許可。未依法申請或者申請未獲許可的；未按照公安機關許可的目的、方式、標語、口號、起止時間、地點、路線進行的，均視為違法行為，公安將追究法律責任。  兩地公安局向傳媒強調，未接獲今明兩日的遊行申請，更未批准遊行活動。此舉暗示，今明兩天的遊行為非法行為，官方隨時可以取締。  日本《產經新聞》則引述日本駐華大使館官員稱，北京公安已拘留了七名涉嫌破壞日本大使館的人士。消息透露，上周參與組織廣州大遊行的「廣東愛國志願者同盟」十二名成員，早前一度被公安帶走協助調查。 小泉盼不會演變成暴亂   顯然，中日雙方都有意紓緩劍拔弩張的氣氛。中國外交部長李肇星昨就中日問題以溫和的語氣表示，近日有日本運動員參加了北京的馬拉松比賽，也有訪日的中國代表團受到熱情的歡迎，中國主張以史為鑑、面向未來的精神，發展中日睦鄰友好的關係。  而日本內閣官房長官細田博之昨表示，中國方面似乎正在作出多方面的努力，同時日方樂見事件的進展。而首相小泉純一郎則稱，他希望中國周末的示威行動不會演變成「暴亂」，如果示威是在有序及受控的情況下進行的話，也不一定是壞事。  本報記者
20050416-120,20050416,120,美：中國具第一世界軍力,美：中國具第一世界軍力 美國助理國防部長羅德曼昨日在眾議院聽證會上表示，中國軍事快速擴張，過去十五年國防開支每年以雙位數增長，解放軍已不再是第三世界武力，在一些領域已達到第一世界的水準，對美國維護亞太安全構成威脅。     導彈戰機潛艇先進   羅德曼指出，過去一直認為解放軍在量的方面有優勢，但在武力結構和武器科技方面則較落後，但在中國經濟快速增長下，國防預算年年劇增，進行軍事現代化，解放軍已不再是第三世界武力，特別是在彈道導彈、巡航導彈、先進戰鬥機和潛艇方面，都有先進武器，在一些領域已達到第一世界的軍事力量。     美副卿指華引火上身   而《華盛頓時報》引述國防部下月將發表的中國軍力報告稱，解放軍瞄準台灣的導彈已由去年的五百枚增加到七百二十五枚，足以對台灣發動攻擊。  另外，在北京通過《反分裂國家法》一個月後，美國國務院主管政治事務的新任副國務卿伯恩斯首次表明美國「強烈反對」這一立法，並指反分裂法反讓中國政府「引火上身」。他在眾議院接受質詢時說：「我們已經非常強烈地大聲說出反對反分裂法。」  中央社/本報記者
20050416-121,20050416,121,美對華軟硬兼施圖改變北京政權,美對華軟硬兼施圖改變北京政權 台海兩岸近二十位學者昨日在上海舉行研討會，討論中、美、台關係。有大陸學者指出，美國對中國仍是軟硬兼施，「目的是要改變中國，要改變中國政權」。     對華政策圍堵利誘   上海復旦大學美國研究中心副主任沈丁立出席研討會時表示，目前美國對中國的政策是既有圍堵、又有正面利誘，在圍堵上包括對台出售武器，以及禁止對中國轉移先進技術，「美國對中國是採取軟硬兩手，目的是要改變中國，要改變中國政權。」  沈丁立也指出，美國是否威脅中國，或中國是否威脅美國，要看中國想做甚麼，如果它想充當全球大國，難免會被覺得威脅美國的利益。但事實上，目前中國無意充當全球大國，只是地區大國，這對美國威脅不大。  在台灣問題上，沈丁立認為，大陸無意以武力攻擊台灣，也不會引起美國很大的對抗行動。  中央社
20050416-122,20050416,122,1800萬中國人癡肥,1800萬中國人癡肥 英國醫學雜誌《刺針》一份研究報告稱，中國大陸十分一人口體重超出標準，其中多達一千八百萬成年人屬於癡肥，六千四百萬人因飲食不均衡及缺乏運動，可能患有心血管疾病。     心血管病威脅6400萬人   美國新奧爾良杜蘭大學公共衞生熱帶醫學學院華裔教授何江，在今日出版的《刺針》發表研究報告，指他所領導的研究小組早前在中國二十個市區及鄉郊，替近一萬九千名年齡介乎三十五至七十四歲的人士進行健康測試，量度他們的體重、脂肪、血壓及膽固醇等。結果發現，肥胖人士以北方人及女性較多，並主要集中在城市。  何江並以有關數據推算，現時中國十分一人口，即約一億三千七百多萬人體重超出標準，當中一千八百萬人屬於癡肥。約六千四百萬成年人因超重、膽固醇及血糖過高，可能患有心血管疾病，主要原因是飲食不均衡及缺乏運動。  研究指出，飲食無節制，特別是消耗過量甜及油膩食物，是經濟高速發展國家人民的通病，再加上不良生活習慣，令城市人健康受損。  中國衞生部去年亦曾公布一項調查，指內地兒童癡肥問題嚴重，比率高達百分八。  法新社
20050416-123,20050416,123,清道夫醫院外病發失救亡,清道夫醫院外病發失救亡 浙江寧波一名年近六旬的清道夫，前天上午在掃街時突然暈倒在距一家醫院十多步的地方。當時有數十人圍觀，但始終袖手旁觀，醫院的醫生也拒絕出門救人。結果，十多分鐘過後，這名倒地後還會郁動的清道夫終於猝死路邊。     沒人施援手　醫生拒出門   清潔公司一名趕到現場的經理說：「我和另一個清潔工搬不動他（死者），周圍圍着幾十人，有載客三輪車夫、有汽車司機、有店舖老闆、有過路人，把路都堵得水洩不通。我向他們求助，沒人應聲……我們跑進醫院先找了外科，又找到內科，醫生還是叫我們自己把病人抬進醫院。後來還是由到場的民警和我們一起把人抬進搶救室。」  接手救人的邱隘醫院醫生表示，人在進入醫院時已斷氣了，死因有待解剖驗屍後才知道。	浙江《現代金報》
20050416-124,20050416,124,九成指甲油不合格,九成指甲油不合格 台灣消基會昨日公布，愛美女性常用的指甲油竟有九成不符合規定，其中不乏經常在廣告中可見的知名品牌。被抽查的指甲油中，有七成五未註明警告用語，有二成至二成五連最基本的成份都沒有標示，甚至連廠商都未註明。  中央社
20050416-125,20050416,125,花枝招展,花枝招展 北京一家台資女性內衣公司以富有中國傳統特色的內衣文化作為招徠，設計的胸圍在海內外均受歡迎，模特兒昨日正展示新款胸圍。  歐新社
20050416-126,20050416,126,美警告僑民：在華要小心,美警告僑民：在華要小心 美國駐華大使館昨日首度就中國反日浪潮發出警告，指反日遊行有可能演變成廣泛反外國人的行動，要求在華的美國公民小心。上海則有網民呼籲，參與遊行的民眾不要衝擊日資企業。     日急籲在華國民勿挑釁   美國駐中國大使館昨日發出電子郵件，呼籲在華美國人對中國的反日示威提高警覺：「由於這類事件性質多變，正在中國旅遊的美國公民應提高警覺，示威與遊行可能在未有事先預警下，隨時隨地發生。示威雖然針對日本人，但也可能會牽連到廣泛的外國人。」  而日本駐北京、上海、瀋陽、重慶、廣州，以至香港的總領事館，昨日均發出緊急通知，指內地多個大城市今、明兩日會有大規模反日遊行，呼籲在華的日本人提高警覺，並且小心言行，避免與中國人接觸時做出挑釁性行為。 上海網民促勿毀日資店   有上海網民則在網上論壇張貼出遊行「重要提示」，呼籲準備參加遊行的民眾理性、克制，不要攜帶日產相機、攝影機、手相等電子產品，遊行途經過日資商店及公司，也不要做出破壞行為（見表）。這些注意事項，對於港人如果北上碰到反日遊行時也適用。  還有網民建議，要好好跟在場公安配合：「特別是在使館門口，如果警察叔叔看着你，就不要亂丟東西，如果沒有人看着你，就丟一個雞蛋或者一個番茄，萬一丟完被警察叔叔發現，就朝他笑笑。」  法新社/本報記者
20050416-127,20050416,127,南韓著火飛箭射日官邸,南韓著火飛箭射日官邸 中國爆發第二波反日怒潮前夕，南韓一批前軍方特工昨日亦在首都首爾（即漢城）舉行反日示威，一日內先後衝擊日本大使官邸及日本大使館。他們焚燒日本大使的肖像及「棺木」，向日本大使官邸發射着火飛箭，甚至企圖向日本大使館開槍，抗議日本篡改侵略歷史以及企圖成為聯合國安理會常任理事國。     前特工為小泉「舉喪」   日本聲稱擁有南韓控制的獨島的主權後，南韓差不多每天都有反日示威。日本駐南韓大使高野紀二月公開聲稱，獨島不論在歷史上及法理上均是日本的領土，更令日韓關係更加緊張。  南韓約三十名前特工，昨日凌晨首先前往日本駐南韓大使高野紀元的官邸，在官邸前為高野紀元舉行模擬喪禮，焚燒高野紀元的肖像及假棺木，然後，燃點箭頭，射向高野紀元的官邸，但沒有射中目標。  他們下午轉往日本大使館抗議，並計劃在使館外為日本首相小泉純一郎舉行「喪禮」。他們一面拉起聯合國的旗幟，一面抬起小泉純一郎的「棺木」，遊行前往大使館，途中被警方截停。警方試圖搶走「棺木」時，示威者反抗，雙方發生推撞。     示威者圖向使館開槍   一名示威者企圖向大使館發射鞭炮，但被多名南韓警員帶走；另一名示威者則跳上附近一輛客貨車頂，揮舞一支類似霰彈槍的物體，企圖向大使館開槍，南韓警員上前阻止。南韓防暴警察最後將該批前特工帶返附近警署調查。  法新社/美聯社
20050416-128,20050416,128,中國大阪領館收剃刀信,中國大阪領館收剃刀信 中國駐大阪領事館繼周一接獲內藏子彈殼的恐嚇信後，昨日再收到一封藏有剃刀的恐嚇信，威嚇中國政府停止反日教育，以及停止針對日本的示威活動。     附字條：停止反日教育   日本「時事」新聞社引述大阪警方發言人指，該封恐嚇信以棕色信封郵寄到中國駐大阪領事館，裏面藏有一塊剃鬚刀片以三張寫有「停止反日教育」、「終止暴力反日示威」以及「在達賴喇嘛面前下跪」等字句的信紙。  警方已檢走該封恐嚇信，並指疑犯可能是不滿近日中國出現的反日示威而作案。  中國駐大阪領事館本周一曾收到一封內藏一個子彈殼的恐嚇信，警告中國若繼續有反日示威，就會有中國人遇襲。  而橫濱中國銀行分行所在的一棟大廈，周日凌晨亦遭氣槍襲擊。翌日，這家中銀分行更收到恐嚇電話。  另外，日本昨日發表外交年度報告，指摘中國在東海開發天然氣，以及去年十一月解放軍一艘疑為「漢級」核潛艇闖入日本領海，「造成了侵害日本安全保障和主權權利以及其他權利的嚴重問題」，並導致兩國的緊張關係升高。     日報告：潛艇侵日主權   報告同時指出，安定的中日關係對亞太地區的和平與繁榮不可缺少，強調經由對話面對末來改善關係的重要性。  日本外相町村信孝也表示，期望周日訪華，有助紓緩兩國目前的緊張關係。而日本經濟產業大臣中川昭一聲稱，可考慮中日共同開發位於東海有爭議海域的天然氣田。  法新社/日本「時事」新聞社
20050416-129,20050416,129,童增：理性示威有助民主,童增：理性示威有助民主 內地第二波反日浪潮即將爆發之際，中國民間保釣聯合會會長童增昨日呼籲，中國政府應藉着內地近日連串的示威遊行推進民主，依法允許民眾遊行。     上周末為大家上了一課   童增主張「民間主動依法登記，有關部門依遊行法允許」，以教育民眾上街遊行要規範化、法制化。  童增讚揚中國當局上周允許民間發起抵制日貨的示威抗議活動，並調動公安、交通等有關部門，協助維持秩序。  他認為，北京上周末發生的反日示威理性和平，唯一美中不足之處是活動透過互聯網發起，迄今不知道活動由何人組織，自然未按照規定申請遊行。  童增坦言，內地民眾的法律意識不強，北京上周末的反日示威活動，為大家上了寶貴一課，未來組織遊行應該先向公安部門依法登記、事先畫定路線，獲批准後才進行，這不但能預防非理性的過激行為，也能推進中國的民主體制。     內地不報道日挑釁言論   另外，雖然日本官員近日發出多番挑釁言論，但中國報章連日來均極少報道，以免火上加油，刺激民眾採取更激進行動。廣東網民昨亦投訴，廣東近日轉播本港電視新聞時都抽起有關日本的新聞，改為插播廣告。  中央社/本報記者
20050416-130,20050416,130,港教育團體聯署抗議,港教育團體聯署抗議 香港教育評議會及中國歷史教育學會發起全港中小學教師聯署活動，抗議日本篡改歷史教科書，至昨日已收集到一百五十間學校、約六千名教師簽名。發起團體下周四將遊行往日本駐港總領事館交信。聯署信還包括反對日本以任何形式侵佔釣魚台及加入聯合國安理會。	本報記者
20050416-131,20050416,131,東莞台資廠加入示威,東莞台資廠加入示威 內地反日示威一浪接一浪，抗議者多是大城市的大學生等年輕人，而東莞台資工廠的員工也不甘後人，星期日將上街示威。示威者主要來自台資工廠台達電、東聚、旭基、偉盈、永利電機等，至少有八千多人。明日上午八時，他們將在華隆新世界廣場集合。  台灣《聯合報》
20050416-132,20050416,132,日大學網站貼中國旗,日大學網站貼中國旗 中日對抗情緒繼續在互聯網上蔓延，繼日本警察廳、防衞廳被大量訪問癱瘓後，一些日本公司、大學的網站相繼遭遇黑客入侵。日本熊本大學網站前晚被黑客貼上中國國旗及歷史不能否定的標語。而索尼中國公司的網站也遭到攻擊而停止運作，至昨晚仍未恢復正常。  本報記者
20050416-133,20050416,133,布殊：偉大中國正瘋狂發展,布殊：偉大中國正瘋狂發展 美國總統喬治布殊周四會見美國報章編輯協會成員時形容，中國是一個偉大的國家，正在瘋狂地發展。他認為，中美關係非常複雜而友好，希望和中國繼續保持這種關係。他同時期望兩岸保持和平，中國實現宗教自由，接納包括天主教會在內的所有宗教。 這是北京上月通過《反分裂國家法》授權解放軍必要時對台動武後，喬治布殊首度評論中美關係。美國國務卿賴斯上月訪華期間表示，喬治布殊歡迎中國國家主席胡錦濤今年訪美，顯示兩國建設性合作關係並未因北京制訂反分裂法而出現倒退。不過，喬治布殊其後婉拒和中國舉行「戰略對話」，僅同意舉行「全球對話」，建立常設副外長級會談機制，討論一系列的政治、安全及經濟問題。     期望和中國合作反恐   喬治布殊在華盛頓會見美國報章編輯協會成員時，對中國以及中美關係作出「廣泛、率直」的評論。他說，中美關係非常複雜而友好，他計劃和中國繼續保持這種關係。  喬治布殊解釋了他眼中美中關係的複雜性。他指出，在外交政策方面，美國政府期望在反恐戰爭上和中國合作，亦希望台海兩岸保持和平。美國政府高級官員表示，布殊的講話符合美國的一貫政策，即台海任何一方不應作出任何改變台海現狀的敵意行動。     稱中國發展推高油價   喬治布殊還指出，中國經濟高速發展，是美國油價上升的部份原因，他呼籲中國實行人民幣滙率自由浮動，令中美能進行自由公平貿易。他說：「在我看來，中國是一個偉大的國家，正瘋狂地發展，這也是美國人為甚麼現在看到汽油價格超過兩美元（一加侖）的原因之一。因為中國的能源需求巨大，而世界的石油供應跟不上能源需求的增長」。  喬治布殊指出，在人權方面，美國政府期望中國接納所有宗教，「我常常提醒中國政府，一個偉大的國家尊重人權，舉個例說，接受天主教會，不懼怕宗教活動」。  路透社/中新社
20050416-134,20050416,134,摩納哥人泣別癡情國王,摩納哥人泣別癡情國王 摩納哥三萬多名公民周五懷着傷痛心情，向統治了他們五十六年的雷尼爾親王作最後告別。這位國君跟已故荷李活女星嘉麗絲姬莉（GraceKelly）譜出的童話式戀曲，至今仍為人樂道，但隨着他的靈柩周五移送到聖尼古拉大教堂地下墓室，長埋在嘉麗絲姬莉墓旁，為這個經典愛情故事正式畫上句號。 來自六十多國的一百五十名國家元首及代表，包括法國總統希拉克、西班牙卡洛斯國王、英國安德魯王子等出席了喪禮，他們先到王宮內的巴拉丁小教堂向雷尼爾遺體告別，再步行到喪禮地點聖尼古拉大教堂，等候移靈。     親屬伴靈柩經光榮之門出宮   六名身穿黑服、戴着紅色和白色玫瑰花的王宮職員，在中午時分（本港時間下午六時），將雷尼爾的靈柩抬離巴拉丁小教堂。一百七十名王宮職員在教堂外的庭院整齊列隊，向這位備受人民愛戴的親王道別。靈柩上放有一把劍、蓋上紅白兩色國旗，按照雷尼爾的遺願，由十名騎兵衞隊成員抬出王宮，經過「光榮之門」，走二百米路前往聖尼古拉大教堂舉行喪禮。「光榮之門」隨後關閉。  雷尼爾三名子女──王儲阿爾貝，嘉露蓮公主和史蒂芬妮公主，以及他的外孫和親屬，在神職人員陪同下組成送殯行列緊隨其後；阿爾貝一臉肅穆，兩名公主戴着黑色面紗，禁不住飲泣。同行者還包括雷尼爾的六歲半愛犬「奧丁」，但見牠走路時一拐一拐的。  送殯行列途經之處，都有數千國民送別靈柩，其間在嘉露蓮特別要求下，樂隊奏出貝多芬的「葬禮進行曲」，樂器都披上黑布；又按王室傳統，鳴槍三十六響。喪禮以天主教形式舉行，由巴爾斯大主教主禮。由於全長九十分鐘的喪禮只准獲邀人士出席，摩納哥國民只能透過電視直播觀看儀式進行，多間教堂亦設有大螢幕直播。 長埋愛妻嘉麗絲姬莉墓旁   巴爾斯大主教在講道時，回顧了雷尼爾傳奇一生：「四十九年前，差不多同一天，在同一座大教堂，他迎娶了嘉麗絲王妃殿下。他跟王妃心神結合，成為獨一無二的一對。」嘉麗絲姬莉在八二年遇車禍逝世，雷尼爾從此不再婚。「對我們每一個人來說，親王是國家元首之外，更是朋友、是家人。今日，我們都彷彿被這個愛我們、備受我們敬愛的偉人遺下，成了他的孤兒。」  喪禮後，王室設宴招待各國賓客。到了下午六時三十分（本港時間周六凌晨零時三十分），大教堂再舉行追思彌撒，讓國民參加。之後，雷尼爾的靈柩在私人葬禮下，長埋大教堂地下墓室、亡妻嘉麗絲姬莉墓旁。雷尼爾因為心臟、腎臟及呼吸問題，四月六日病逝，終年八十一歲。  美聯社/法新社/路透社
