key,date,article_daily_id,title,text
20050827-141,20050827,141,賭王舉家賀超瓊43歲　局長八卦,賭王舉家賀超瓊43歲　局長八卦 昨日是何超瓊四十三歲生日，前晚賭王何鴻燊偕二姨太藍瓊纓率何家三朵金花超鳳、超儀、超蕸以及愛兒猷龍等，到中環麗嘉酒店食飯慶祝，而碰巧民政事務局局長何志平同場出現，他竟跟記者問長問短。 賭王何鴻燊為賀寶貝女何超瓊昨天四十三歲生日，前晚舉家到中環麗嘉酒店晚飯，順道享天倫。當晚七時多，何鴻燊偕二姨太藍瓊纓乘坐勞斯萊斯房車到達酒店，賭王下車後即輕扶二姨太內進，沒多久束起孖辮的何超儀、夫婿陳子聰、何猷龍偕妻羅秀茵和何超鳳一家等亦各自到場，會合早已在內的壽星女超瓊一同進膳。 阿Sa嚇到掉頭 賭王闔家慶祝期間，現場亦出現不少名人明星。除房祖名駕車到酒店外，阿Sa亦與兩名友人和一小孩於十時多離開，當她準備從側門離場之際，遠遠看見門外聚集傳媒，她即時掉頭，與友人各自分頭走，最後阿Sa選擇從正門離開，但笑容有點尷尬。  而湊巧在酒店現身的民政事務局局長何志平見到傳媒在場亦忍不住八卦一番，記者告訴他正在等候何生何太，他又問：「邊個何生呀？」當他得悉是何鴻燊後，再打趣問：「邊個老婆先？一、二、三、四？」記者說是二姨太，何志平聞言便臉帶笑意離開。 超儀爭獎榮幸 至十時半左右，何家眾人各自離場，穿上黑白套裙的壽星女超瓊聞記者祝她生日快樂後，說了一句「多謝」便上車直返梅道寓所。超鳳偕夫何志堅和兩名女兒上車時，被問到有否送禮物給超瓊？她便笑說：「有呀，送乜就要保持秘密。」  此外，何超儀憑《蝴蝶》一片角逐亞太影后，她表示未有想過奪獎問題，但今次是她入行以來最大獎項的提名，所以有份入圍已感榮幸和開心。  採訪、攝影：娛樂突發組
20050827-142,20050827,142,女影迷勇救張可頤,女影迷勇救張可頤 張可頤和張家輝前晚到尖沙嘴拍攝政府短片，為宣傳稍後在香港舉行的世貿國際會議。兩人在片中扮演夫婦，硬銷香港價廉物美。 否認攜女伴消遣 拍攝期間，有兩女一男張可頤的影迷突然趨前要求合照，可頤為遷就影迷而蹲下來拍照，卻不慎跣腳，幸好兩名影迷連忙把她扶着，才不免跌倒。  對於有雜誌報道張家輝攜女伴在橫店消遣，他澄清說：「我當時喺無錫拍緊《新醉打金枝》，個人都唔喺橫店。不過我都習慣咗呢啲雜誌剪咗個人頭就砌古仔。」  採訪、攝影：何永寧
20050827-143,20050827,143,化工廠爆炸釋毒煙,化工廠爆炸釋毒煙 吉林省吉林市一家化工廠，周三在剛剛開始試產時，突然發生強烈爆炸，並引起大火，造成兩名正在工作的工人被燒傷。為防現場再次發生爆炸，威脅民眾的安全，當局在事發後，將現場方圓三公里的地方戒嚴。  據稱，周三上午九時半，吉林市大宇化工有限公司突然發生爆炸，三聲巨響過後，一個巨型火球從廠房躥出。  緊接着，滾滾濃煙在空氣中瀰漫着令人窒息的氣味，加上火場內還有五噸易燃易爆化工原料，隨時可能再次發生爆炸，公安緊急疏散數百名工人及圍觀的群眾，消防部門亦急調約二百名消防員救火，終於在當天中午將大火撲滅。  據一名工人表示，爆炸前，一名操作工人發現壓力表異常後，負責人通知正在工作的二十多名工人緊急疏散，結果，有兩名工人因來不及撤離而被燒傷。  吉林《城市晚報》
20050827-144,20050827,144,4車連環撞16死傷,4車連環撞16死傷 安徽省蕪湖市南陵縣前日發生四車連環相撞意外，造成七人死亡、五人重傷、四人輕傷。其中一名貨車司機和三名中型巴士乘客當場死亡，另有三人經搶救後不治。 中巴內3乘客死亡 現場位於南陵縣家發鎮馬橋境內。目擊者透露，事發時看見一輛貨車和一輛中型巴士相撞，隨後又有一輛運送黃沙的貨車撞上前面一輛貨車的車尾，把前面的貨車撞到路邊，此時一輛輕型客貨車，又輕微撞向前面的貨車。  車禍發生後，其中一輛貨車懸空在馬路的路基上，車頭嚴重變形。而事發時載有十多人的中型巴士，車身被撞至面目全非，車頭被壓扁，玻璃粉碎。第一輛與中型巴士相撞的貨車司機及中型巴士的三名乘客當場死亡，另有三人在搶救後不治，九人受傷。  《安徽市場報》
20050827-145,20050827,145,胡錦濤國事訪美　白宮三度否認,胡錦濤國事訪美　白宮三度否認 中美兩國正為中國國家主席胡錦濤下月訪美的接待規格暗中角力：美方最初稱，胡此行不足以稱為「國事訪問」後，中方隨即於前日作出反駁，強調這是「國事訪問」。不過，白宮昨日卻罕有地再次澄清，這並非「國事訪問」，顯示美方看來在這個中方最關注的「面子」問題上加以阻撓，以增加討價還價的本錢。 美國官員日前公布，胡錦濤將於下月七日，首度以國家元首身份到訪白宮，但這不完全是「國事訪問」。中國外交部前日稱，胡錦濤下月初到美國進行「國事訪問」。 「不是官式國事訪問」 緊接着，白宮發言人昨日三度強調胡錦濤的訪問並非國事訪問。美國白宮副發言人迪菲在本港時間昨日凌晨舉行的例行記者會上，被一名記者問到：「就胡主席的『國事訪問』而言，胡主席可以向美國提供甚麼，從而阻遏美國國會目前日益高漲的保護主義及反華情緒，而美方又能夠提供甚麼給中方呢？」  迪菲回答說：「待中美雙方真正會面臨近的時候，我們會回答部份相關問題，但我不認為這是一次『國事訪問』。這不是一次『國事訪問』，這不是一次官式的『國事訪問』。不過，隨着會面逐漸臨近，我們可就這方面做更多事情，起碼一段時間內不是（國事訪問）。」  據中央社引述了解訪問內情的華府智囊透露，中方對胡錦濤此行是不是「國事訪問」非常在意，也爭取得非常厲害。其實根據白宮官員透露的接待細節，除了白宮以午宴代替白宮晚宴外，與國事訪問的規格差不了多少，但白宮就是不承認是次乃「國事訪問」。 料與反華氣氛有關 智囊分析稱，白宮之所以再三澄清胡錦濤到訪不是「國事訪問」，應與目前全美瀰漫反華氣氛有關，而中國於三月間通過《反國家分裂法》，則是遠因。  此外，可能在先遣人員討論相關議題時，中方對某些問題堅持拒絕讓步，使美方反感，故刻意在中國最在意的訪問規格上做文章。  本報記者/中央社
20050827-146,20050827,146,訪美規格換峰會主導權,訪美規格換峰會主導權 中美之間就中國國家主席胡錦濤的訪美規格，究竟是不是「國事訪問」出現分歧。對此，有專家以罕見、奇怪及不正常來形容，但也有專家認為，這不過是美方的姿態，其背後目的只是想用規格來交換「中美峯會」議題的主導權。  中國人民大學美國研究中心主任時殷弘教授昨指出，這麼大的國家，不會搞這些小動作吧？他覺得這種事情很少見、有點奇怪，同時有點「不正常」，但他相信問題可以順利獲得解決，「不過就是個名稱問題嘛！」 指美為增會談籌碼 本港時事評論員劉銳紹表示，這次胡錦濤是應美國之邀，且以訪美為主要行程，若取消訪美，則美方必會失分。現時美方提出發二十一響禮炮、在白宮南草坪舉行歡迎儀式，完全按國事訪問的規格接待胡錦濤，但卻不肯用「國事訪問」的名稱，是因為美國要抬高自己在會談中的「叫價」，在外交策略上叫「主導議程」，迫中國多作讓步。他相信，美方最終定會將此行定為「國事訪問」的。  本報記者
20050827-147,20050827,147,中國百億購40俄軍機,中國百億購40俄軍機 中俄聯合軍演剛結束，中國已決定向俄國購買三十架能用於運兵及空降傘兵部隊的「伊爾-76」運輸機，以及六至十架「伊爾-78」空中加油機，估計交易金額高達十多億美元。 下月中俄軍會商價錢 俄羅斯官方「俄新社」報道，中國軍方對「伊爾-76」運輸機及「伊爾-78」空中加油機特別青睞，主要是因為這兩種軍機，在今次中俄聯合軍演中表現超卓。報道引述俄軍方消息指，中國將採購三十架「伊爾-76」，以及六至十架「伊爾-78」。兩國官員將於下月在俄國黑海舉行的中俄軍事技術合作委員會會議上，商定價錢，有可能還會即場簽署合同，估計交易金額高達十多億美元。俄羅斯航空工業界人士相信，這批軍機的交貨期，可能要兩至五年時間。  專家表示，中國購入「伊爾-76」運輸機，目的是要提升空投傘兵作戰能力。解放軍空軍配備「伊爾-78」空中加油機後，戰機續航能力將增強三倍。 提升空投傘兵作戰力 另外，俄羅斯獨立電視台報道，從周四的強制分隔作戰演習看來，中國軍隊的作戰實力，在跳傘、射擊等方面仍與俄國有很大差距，特別是中國部隊所空投的傘兵裝甲車，接連在預演及正式演習中，都發生着陸翻車事故。  「美國之音」
20050827-148,20050827,148,中梵高官教廷秘密會談,中梵高官教廷秘密會談 中國和梵蒂岡關係再有突破發展：中國駐意大利大使館發言人前日證實，教宗本篤十六世正式接任教宗後兩天，即今年四月二十六日，一名中國外交部官員與梵蒂岡外長，進行秘密會面，這是雙方近期最高層的接觸。已故前教宗若望保祿二世據報亦在去年八月和一個中國代表團見面。 斷交50年　關係解凍 中國駐意大利大使館發言人指出，中國外交部官員四月二十六日和梵蒂岡外長拉約洛大主教會晤。此外，一個力促中梵關係改善的天主教組織亦表示，去年八月，一個較低層次的中國代表團亦曾拜會前教宗若望保祿二世。該組織的創辦人表示，當時若望保祿二世曾說，自己有可能到中國。該名創辦人希望，教宗本篤十六世能達成前任教宗若望保祿二世的願望。  中國和梵蒂岡雖斷交逾五十年，但雙方近期互動頻繁，兩度共同任命內地的神職人員，顯示中梵關係有進一步解凍迹象。而梵蒂岡外長拉約洛大主教早前更表示，中、梵之間沒有解決不了的問題。  美聯社
20050827-149,20050827,149,梅州封礦場百人靜坐,梅州封礦場百人靜坐 廣東梅州市百多名礦工疑因不滿當局，在本月初發生導致百多人死亡的「大興礦難」後，炸封全市礦場，昨日在市政府門外靜坐抗議，要求當局停止炸封礦場。有消息指出，礦工聲言，將發動逾千人今日繼續在市政府外，靜坐抗議。消息指自本月七日梅州興寧大興煤礦，發生導致一百二十多名礦工死亡的滲水事故後，當局大規模整頓煤礦，炸封了梅州、韶關、清遠逾百家煤礦，令不少礦工生活困難。  梅州市百多名礦工昨日在市政府門外靜坐，要求當局停止炸封礦場及作出賠償。市政府並未派人接見靜坐的礦工，公安人員則在在現場監視，未有採取任何行動。市政府一名官員接受本報電話查詢時證實，曾有礦工靜坐，但拒絕透露詳情，只稱事件已平息。 礦場漏煤氣15人亡 據了解，清遠及連州上周封閉當地的煤礦時，曾引發嚴重警民流血衝突。傳聞清遠有公安被礦主槍擊，導致兩名公安死亡。連州市執法人員上周在炸封一家礦場時更遭到村民阻攔，武警、公安一度向村民發射催淚彈。雙方衝突造成六名村民及多名公安受傷，四人被拘捕。  另外，貴州仁懷市大壩鎮竹林灣煤礦，前日下午發生氣體洩漏，當時共二十一名礦工在井下工作，六人獲救，其餘十五人全部死亡。  本報記者/新華社
20050827-150,20050827,150,馬英九民望升至65%,馬英九民望升至65% 身兼台北市長的國民黨新任主席馬英九，雖然在黨內中常委選舉初嘗失利滋味，但民望卻愈來愈高。台灣最新民調顯示，有六成五台灣民眾支持馬英九，較今年五月國民黨主席選舉前，上升五個百分點。 10億元賣地遭控訴 台灣無線衞視本周一及周二訪問了一千零六十七名台灣民眾，發現馬英九的支持度高達六成五，而前國民黨副主席、現任立法院院長王金平支持度卻急跌八個百分點。至於台灣總統陳水扁、行政院院長謝長廷、民進黨主席蘇貞昌的支持度則分別是二成八、五成二及五成二，明顯落後於馬英九。  另外，馬英九甫上任國民黨主席，決心治理黨產問題，本周二即正式到國民黨總部上班第二天，同意出售國發院土地，金額涉及十億港元。台聯黨昨日入稟法院，控告馬英九圖利罪及背信罪，不但賤賣黨產，還涉嫌利用市長身份變更土地，但馬英九對上述指控，一概否認。	TVBS
20050827-151,20050827,151,天安門紀念抗戰,天安門紀念抗戰 為紀念抗戰勝利六十周年，北京將在九月三日即下周六在天安門廣場地區舉行紀念活動。活動期間，當局將對天安門廣場及周邊地區實施臨時交通管制，而天安門城樓、人民大會堂、毛主席紀念堂、國家博物館等亦停止對外開放。  《法制晚報》
20050827-152,20050827,152,市委領導層變動,市委領導層變動 廣州市委領導層出現人事變動：市委副書記蘇志佳兼任市紀委書記；林元和、方旋任市委副書記；薛曉峰任市委常委。朱振中則被免去市委副書記、市紀委書記職務，暫時未知新職。朱穗生亦被免去市委常委職務，廣東省委另有任用。  《廣州日報》
20050827-153,20050827,153,舞姿優美,舞姿優美 二○○五年世界速度滑輪錦標賽前日在江蘇蘇州正式揭幕，整個賽事為期九日。兩名運動員在前日的開幕禮上作出高難度表演，形態獨特優美，令人歎為觀止。  路透社
20050827-154,20050827,154,《財富》選中企百強　中石化居首武漢鋼鐵狂升61級,《財富》選中企百強　中石化居首 武漢鋼鐵狂升61級 《財富》雜誌公布最新的2005年中國企業一百強。今年的排行榜與去年相比，除中石化、中石油、中移動（香港）和中聯通繼續力保前四甲的位置外，最矚目莫過於鋼業表現。 受惠於去年鋼鐵價格持續大幅攀升，在去年排行榜中名列第八十九位的武漢鋼鐵，今年連續跳升六十一級，躍升至二十八位，乃排行榜中較罕見現象。此外，亦有多家鋼鐵公司首次打入一百強。 全球復甦　鋼價大漲 受惠於去年全球經濟復甦，全球市場對鋼鐵的需求旺盛，導致鋼鐵價格水漲船高。在市場求大於供的情況下，幾乎所有大陸的鋼鐵產品價格都大漲超過七成一，甚至達一倍，令許多鋼鐵企業的收益大幅增長，並創下多年來新高。  武鋼以二十九億美元的營業額跳升至中國百強企業的第二十八位之餘，其他鋼鐵企業如濟南鋼鐵（第四十二位），重慶鋼鐵（第一百位）等亦首次進入一百強。馬鞍山鋼鐵則由去年的第二十八位升至今年的二十三位；上海寶鋼則由去年的第九位微降至第十一位，這是由於寶鋼主是靠進口原材料生產，受制於國際鋼鐵原料價格大漲，影響營業額。 受制宏調　需求放緩 去年，大陸的鋼鐵業發展可謂一枝獨秀，但隨經濟過熱，中央政府在去年底開始採取宏觀調控措施，壓制固定資產投資，市場對鋼鐵需求回復正常，在價格正逐步回落的背景下，可以預見鋼鐵企業在明年的排行榜中未必再有理想的表現。  根據經合組織今年一月發布的研究報告指出，○五年全球鋼產量的增長率，將從○四年百分之八點七下降到百分之五，明年將進一步下降到百分之三點五。這主要是因為全球最主要的鋼鐵消費國──中國的需求增長逐漸放緩，今年很可能會低於百分之十；與此同時，中國鋼鐵產量將增長百分之十至十五。  《財富》雜誌
20050827-155,20050827,155,以營業額釐定百強,以營業額釐定百強 新鮮出爐的《財富》中國企業一百強，與大陸近期推出的中國企業五百強相比，彼此的排名十分接近。這是由於雙方均根據企業的經營規模，即營業額計算；企業利潤，反而不重要。 大陸富豪怕排行榜 如排行第一的中石化與排行第二的中石油，在利潤方面相差八十五億美元；排行第十二的中海油，去年的利潤高達十九億美元，較第十位的二千五百萬美元的的中國財險為高。  繼早年《福布斯》推出中國富豪排行榜，《財富》推出中國企業一百強，在中國市場引起一陣轟動。  目前讀者對中國企業或富豪的排名已感麻木，只是大陸的企業喜歡將此作為炫耀的工具。至於內地富豪在經歷過早年，身家被曝光，遭國家稅務部門追討欠稅，甚至被判入獄後，大家對排行榜已感到害怕。然而，有富豪如劉永好般，至今屹立不倒。  本報記者
20050827-156,20050827,156,萬人爭赴星教漢語,萬人爭赴星教漢語 儘管只招收七十名赴新加坡的漢語教師，但由於月薪最高超過二萬元人民幣，大陸報名人數竟超過一萬人。據報，報名者如果想順利成為赴新加坡的教師，須經過三道關卡的篩選。  新加坡和中方專家將於九月初分別在華東師範大學、天津師範大學、西南大學組織面試，預計九月中敲定七十名錄取人員，其中中學教師四十人，小學教師三十人。目前海外學習漢語的人數保守估計約二千萬左右，對外漢語教師缺乏一百萬。  北京《晨報》
20050827-157,20050827,157,中歐紡品談判膠著,中歐紡品談判膠著 中國和歐盟經過兩日的談判，仍未就中國紡織品積壓歐洲多個港口的問題達成協議。中國紡織工業協會發言人孫淮濱表示，目前談判涉及許多技術性問題，難度比較大，但由於歐盟代表需要對自身貿易商有所交代，因此談判一定會產生某種結果。  孫淮濱稱，歐盟代表此次來華與中方就輸歐紡織品壓港一事進行磋商，是雙方為解決歐盟內部市場危機而進行的一次應急性接觸，說明在自由貿易條件下，用數量限制這種人為的計劃手段來安排國際貿易是很不合理的。  新華社
20050827-158,20050827,158,上海要成金融中心,上海要成金融中心 上海市常務副市長馮國勤表示，將依據「五年打基礎、十年建框架」規劃，於二○二○年把上海建成國際金融中心。他稱，上海把金融業放在優先發展的戰略地位。  今年上半年，上海新增金融機構四十九家，金融機構總數達五百六十六家，其中各類外資和中外合資金融機構三百多家。上海已初步形成了一個證券市場、外滙市場、期貨市場、黃金市場、產權交易市場等構成比較健全的全國性金融市場體系，日益成為全國資金市場和資本市場的中心。  新華社
20050827-159,20050827,159,殘舊設施肇禍　乘客緊急疏散北京地鐵起火,殘舊設施肇禍　乘客緊急疏散 北京地鐵起火 近年多次發生冒煙事故的北京地鐵，昨日早上繁忙時間又發生類似安全事故，幸未造成傷亡。一列已經使用了二十多年的舊式列車，在行駛時車廂內的風扇因為電線短路冒煙起火，數百乘客及時疏散，但一名列車司機在救火時一度被焗暈。這是北京地鐵近年來首宗明火事故，也暴露出這條全國最古老地下鐵路的安全隱患。 由於事發時正值上班高峯期，加上和平門站外聚集了二十多輛警車、消防車和救護車，令附近路面交通一度嚴重受阻。在服務受阻的地鐵西直門站，地鐵職員限制乘客入站，隔幾分鐘才放十多人進去，但有乘客因為不滿時間被耽誤，拼命往人龍前方擠，秩序一度混亂。 司機救火時被濃煙熏暈 昨晨七時二十三分，一列北京地鐵二號線（西直門循環線，又稱內環線）列車，在崇文門站向和平門站方向行駛時，四號車廂突然冒煙，並出現一股燒焦的異味。司機下車檢查時，認定是車廂頂的風扇電線短路所致，於是立即安排車上所有乘客疏散，並把空車駛回車廠檢修。  列車駛至和平門站時，發生故障的風扇出現明火。車站工作人員通知司機，共同撲救控制火勢。北京公安、消防等部門接報後，立即疏散站內乘客和開啟地鐵排煙系統，並封閉和平門地鐵站。  消防員在八時十二分把明火撲滅，三十歲的列車司機在救火時被濃煙焗暈，被救出後經過半小時輸氧才甦醒。火警期間地鐵內環線全線停駛了近五十分鐘，直至八時十三分後才陸續恢復正常。 徹底檢查所有舊式列車 北京地鐵公司解釋，發生故障的列車已經運行了二十多年，屬已列入逐步更新的老列車。該公司並由昨晚開始，徹底檢查所有安裝有風扇的舊式非空調列車，嚴防此類事故再次發生。  已啟用了二、三十年的北京地鐵一號和二號線，其供電系統、車廂設備已經嚴重老化，近年車廂以至地鐵管道內已多次發生因為短路所致的冒煙意外，幸未造成傷亡。  新華社/《北京晚報》/本報記者
20050827-160,20050827,160,網民斥沒資格辦奧運,網民斥沒資格辦奧運 北京地鐵再度發生安全事故，內地網民反應激烈，狠批北京地鐵設備陳舊、管理部門麻木，質疑這樣的集體運輸水平，能否有資格舉辦奧運。而一名在北京定居的港人則指出，和上海地鐵及香港地鐵比較，北京地鐵最不安全。 「比香港足足慢一半」 在內地差不多生活了近十年的香港居民陳小姐，曾先後在上海及北京居住。她批評北京地鐵服務「好差」，車站管理人手不足，「一旦有事，也找不到人」；而車廂設備亦陳舊落後，既無空調，只有風扇，「冬天冷、夏天熱」；再加上，地鐵車速較慢，「比香港足足慢一半」，因此，她較少乘地鐵。  「我坐過廣州、上海、深圳、北京的地鐵，其中北京地鐵是我坐過的最破的地鐵……」「看人家上海，唉，羨慕啊！」「車廂內就蒸箱一樣，就這條件還申辦奧運呢，真是不敢想像。」「難道，普通人，老百姓就理應默默的忍受這一切嗎？」內地網民獲悉北京地鐵再度發生冒煙事故後，既怒且憤，批評管理部門麻木，即使北京地鐵發生多宗安全事故，仍未作出重大改革，要求地鐵高層辭職。  本報記者
20050827-161,20050827,161,網民反應,網民反應 「我經歷過的北京地鐵冒煙事故至少已經有兩次了，真不明白，非得要大火着起來才有人管，管理部門真是麻木得可以，地鐵公司的頭應該下台了！」    「北京的地鐵配置實在是太差了，今夏這麼熱的天，居然連空調都沒有，那些破電扇吹出來的全是熱風，而且每當車門關閉後，車廂內就像蒸箱（類似蒸籠）一樣，就這條件還申辦奧運呢，真是不敢想像。」    「早該換新車了，八通線〈北京地鐵較新支線〉每天上下班人多的要命，但是車廂就那幾節，人不停的猛增，車廂不變！」  資料來源：新浪網
20050827-162,20050827,162,乘客跑出站外大喊：著火了！,乘客跑出站外大喊：著火了！ 昨晨七時半，北京地鐵和平門站一個排風口呼呼地冒出灰黑色的濃煙，一股電器燒壞的味道嗆得令人喘不過氣來。在和平門附近拉人力三輪車的張先生，看到很多人從地鐵裏往外跑，有人還大喊着：「着火了！」  不久，和平門站除了東南口以外的所有入口都關閉，不讓乘客進內。地鐵「內環線」服務全線中斷，令不少乘客氣急敗壞，地鐵職員則拿着揚聲器呼籲乘客改乘其他交通工具。一名外地人把大包小包擱在站口外，焦急地踱步：「我都到半小時了，還進不去，真急人哪！」有乘客則不滿地鐵公司的應急安排：「最可氣的是在復興門換乘時都沒有人通知，我從一線倒（轉乘）環線，走了一大圈，到了環線才知道！」 空氣瀰漫濃重煙氣 八時半以後，救護車駛離現場，和平門站重新開放。但由於消防員噴水救火，站內下行的樓梯、售票處大堂和地鐵站月台都濕漉漉的，空氣裏瀰漫着濃重的煙氣，不少乘客捂着鼻子匆匆出站。地鐵職員手拿拖把，清理大片積水，一邊不住地提醒乘客：「小心啊！注意腳下濕滑！」  《北京晚報》
