key,date,article_daily_id,title,text
20050725-0,20050725,0,奪命豬鏈球菌　內地已殺17人超市停售四川豬肉,奪命豬鏈球菌　內地已殺17人 超市停售四川豬肉 【本報訊】內地四川省出現的神秘病毒，至今感染人數已激增至五十八人，當中至少十七人死亡。由於患者均曾接觸豬隻或羊隻，本港兩大連鎖超級市場昨日即時停售來自四川的急凍豬肉及內地免治豬肉；冰鮮禽畜業界也呼籲肉商停止從四川入口急凍豬肉。衞生福利及食物局局長周一嶽引述內地衞生部指，引起事件的「元兇」很可能是豬型鏈球菌，但他表明暫時無意禁止四川豬肉來港。　記者：陳倩雯、張嘉雯、林社炳 周一嶽昨出席公開活動時表示，前日接獲內地衞生部門通知，四川資陽市農民感染的疾病估計與接觸豬隻有關，最大可能是感染豬型鏈球菌，但有待科學印證病原體是否新的病菌；暫未能證實會否人傳人，但相信可能性不大。 暫不禁四川豬肉輸入 本港沒有從四川進口活豬，但有輸入急凍豬肉。周一嶽表示，由於所有急凍豬肉均須通過衞生檢驗才可輸港，加上四川幅員遼闊，又不清楚肇事農場的規模，故不會因為部份農場出現疫情而完全禁止四川豬肉輸港。  政府拒絕主動堵塞疫情，但作為本港主要肉商之一的百佳超市證實，部份分店有出售來自四川的急凍豬肉，為預防起見已即時停售。惠康超市發言人則回應，該店出售的豬肉由五豐行供應，正向該行查詢豬肉的來源，在獲回覆前已先停售來自內地的免治豬肉。  香港冰鮮禽畜業商會主席郭時興也稱，商會已呼籲肉商暫停從四川進口急凍豬肉。他指出，本港有兩成急凍豬肉來自四川，其餘的從湖南、山東及廣西等內地省分，以及從巴西入口，通常用來製作叉燒及排骨。有市民昨表示為了健康着想，暫時不會光顧燒味店，也不會隨便購買來貨不明的平價豬肉；亦有市民表示無懼燒味是否由病豬炮製。  四川為港人旅遊熱點之一，新華旅行社副總經理謝日中稱，暫時不會更改四川旅行團的菜單，若政府有進一步通告，才會將有豬肉的餸菜從餐單中剔除。他強調，四川旅行團只會到省會成都及九寨溝等地遊玩，不會深入農村，因此不會受到事件影響。 叉燒高溫烹調風險低 懷疑引致十多四川農民死亡的豬型鏈球菌，主要是透過人體傷口接觸豬隻帶菌的肉、血液及分泌物等感染，可引起腦膜炎及敗血症等嚴重感染，但帶菌豬肉經高溫烹調後也可食用。傳染病專科醫生勞永樂及香港大學醫學院微生物學系助理教授黃世賢均表示，當帶菌豬肉被急凍時，肉中細菌的活動會被抑制，不會大量繁殖，但在解凍過程中有可能再度活躍起來；直至被高溫烹調後，細菌才會被殺死，因此進食叉燒感染細菌的風險十分低。 新界豬場死豬數量增 四川豬隻出現致死病毒，但本港豬農似對事件掉以輕心，昨日在元朗錦田大江埔的豬場，有工人在處理豬隻時沒有穿上防感染衣物；豬場內更有死豬被隨意棄置在地上，豬群中則混雜了患有皮膚病的豬隻。有清理死豬的食物環境衞生署承辦商工人稱，近日的死豬數量略有增加，未知是否與酷熱天氣有關。
20050725-1,20050725,1,長期濫藥可永久性傷大腦,長期濫藥可永久性傷大腦 近年青少年濫藥問題嚴重，其中K仔（氯胺酮）更成為時下最熱門青少年服食毒品，精神科醫生警告青少年長期服食精神科藥物，會對大腦構成永久性傷害，即使青少年日後戒除毒癮，後遺症仍然伴隨終生。  對於警方在暑假期間高調打擊罪案，以免青少年誤入歧途，油尖旺區議會主席陳文佑表示歡迎，他指出黑幫在的士高內販毒增加收入的問題一直存在，但出動手推車公然向青少年兜售毒品則非常猖獗，希望警方繼續進行打擊行動，避免青少年遭到荼毒。 青年成黑幫替死鬼 陳文佑表示，每年夏季，數以萬計青少年都成為黑幫招攬對象，月前警方在一項搗破賣淫場所行動中，曾發現有名校女生充當妓女已經敲響警鐘。  陳文佑指出，本港經濟轉型，工廠北移，加上本港經濟不景，現時青少年要找暑期工並非易事，個別青年可能受不住金錢引誘，鋌而走險從事販毒或賣淫工作，情況令人惋惜。  他補充，未成年青少年是黑幫主要「生力軍」，黑幫主要招攬青少年售賣盜版光碟及冒牌貨，因為青少年被捕落網，亦未必能夠入罪，成為黑幫犯罪的「替死鬼」。  本報記者
20050725-2,20050725,2,韓農民率先來港示威,韓農民率先來港示威 【本報訊】近二百名來自本港及亞洲其他地區的反世貿人士昨午發起示威，抗議世貿談判黑箱作業。形象激進的南韓農民昨亦派出五名代表打頭陣，為年底在港舉行的世貿第六次部長級會議示威作熱身。南韓農民請願時表現得和平克制，又與外傭示威者一起載歌載舞。他們估計年底會有一千五百名南韓農民、學生、工人來港示威，保證不會使用暴力。 盼給予足夠示威空間 示威者昨戴上黑手套，有的更在頭上套上黑紙箱，抗議政府跟世貿談判黑箱作業，事前沒充份諮詢民意。外傭代表則穿上民族服裝，集會時大跳民族舞。全場焦點落在五名南韓農民代表身上。他們到場後拉開一幅寫上「世貿殺害農民」的紅色橫額，並高舉他們在各地和平示威的相片加入大隊，沿途一起呼叫口號。  示威者由中環滙豐銀行總行遊行到政府總部集會，逾五十名軍裝警員在場維持秩序，港島總區高級警司（行動）劉業成亦一度在場監察。  韓國農民曾在多次示威中作出激烈行動，○三年曾有韓農在墨西哥的世貿會議示威中用刀自殺。但擁有三萬會員的韓國婦女農民協會主席尹今順昨強調，農民並非野蠻人，希望港府給予足夠空間，讓他們在世貿部長級會議中和平示威。 取消補貼致負債大增 在南韓種植水果的尹今順表示，南韓入世後，政府取消農業補貼，令農民負債大增，自殺問題嚴重。會員人數達一百一十五萬的韓國農民聯盟副主席徐廷吉指，現時每農戶平均欠債二十二萬港元，是十年前的四倍。尹今順稱年底會有一千名南韓農民及五百名學生、工人來港和平示威，並計劃舉行講座向港人講述世貿對農民生活的影響。國際農民組織「農民之路」表示，三百名日本、印度、泰國農民年底也會來港抗議。  工業貿易署署長楊立門昨反駁，示威者指世貿談判黑箱作業並無事實根據。他強調港府為準備世貿談判，已進行了兩次公眾諮詢。
20050725-3,20050725,3,救生員改8月1日罷工,救生員改8月1日罷工 【本報訊】港九拯溺員工會策劃發起的七月三十一日五百人渡海抗議行動觸礁，工會指出是由於海事處已拒絕發出渡海泳許可證，因此罷工將改在八月一日舉行，估計屆時有八百至一千名救生員到淺水灣參加罷工及集會。工會指海事處是受到港府高層的政治壓力而剝削救生員的請願權利。 處方不批准渡海泳 工會副主席郭紹傑表示，下月一日的罷工將由早上十一時至下午六時舉行，全港所有泳池泳灘都有救生員參與，但工會呼籲淺水灣泳灘的救生員如常當值，並建議泳客屆時最好只去淺水灣游泳，以策安全，「到時有成千個救生員喺淺水灣，泳客如有意外，見到一定幫手救人！」  他表示，海事處於前日正式通知工會拒絕發出許可證的決定，但他指摘處方是「出爾反爾」，「上星期五早上海事處同我哋開會，重話（渡海泳）冇問題，連戴乜嘢顏色嘅泳帽都傾埋，佢哋又建議工會嘅渡海泳最好由八百人減到五百人、最好出信畀會員，提醒佢哋要注意維港水質、重建議我哋租用躉船，點知下晝就同傳媒講唔批准！」  他質疑處方在○三年時曾向工會發出渡海泳的許可證，工會是次抗議行動是反對康樂及文化事務署計劃將大角嘴泳池工作外判，處方不應阻撓。海事處發言人強調有關決定經過深思熟慮，並非在受壓下才決定拒發許可證。 或須關閉部份設施 康文署發言人則呼籲救生員應緊守崗位，暑假期間泳客眾多，罷工行動會影響救生服務。此外，該署也制訂應變措施，包括聯絡其他機構提供合資格的臨時救生員，也不排除當日由於救生員人手不足，而需要關閉該署轄下的部份游泳設施。
20050725-4,20050725,4,五成人憂泳池水質變差,五成人憂泳池水質變差 【本報訊】公眾泳池近期接連發現糞便及嘔吐物，加上曾有不法之徒在泳池更衣室偷拍泳客換衫照後上載到互聯網，令市民關注泳池的衞生及安全問題。一項調查顯示，約五成受訪泳客擔心泳池水質變差及被偷拍，因而減少到泳池游水次數。負責調查的政黨建議，當局應提高在泳池偷拍的罰則及加強清潔泳池，以挽回市民信心。 擔憂換衫被偷拍 民建聯上月至今月初以電話訪問了七百三十四人，當中一成七人表示不滿泳池的衞生環境；近四成游水時曾發現池內有類似糞便、紅蟲及嘔吐物；一成七指泳後曾出現肚痛、皮膚敏感等症狀；五成四更指受池水不潔影響，會減少到泳池游水。  泳客除擔心水質，亦擔憂換衫時成為偷拍對象。調查指近一成人曾見過有人用相機，或以具拍攝功能的手機在泳池或更衣室拍照；四成七擔心被偷拍，而減少到泳池次數；四成四贊成禁止泳客帶相機及具拍攝功能手機進入泳池範圍。另逾一成人曾在泳池被偷去財物。  民建聯衞生事務副發言人彭長緯昨在記者會表示，調查結果顯示市民不太滿意泳池的衞生及安全情況。現時在更衣室或泳池偷拍的最高刑罰，只是罰款二千元及監禁十四天，他認為是太寬鬆，建議當局提高罰則至等同非禮罪，即最高監禁十年。 聘逾百清潔大使 此外，康樂及文化事務署今年四月至今，在全港三十六個公眾泳池接獲五十宗便溺及嘔吐物報告。該署已聘請逾百名清潔大使，向泳客宣傳游水時要注意的衞生事項。
20050725-5,20050725,5,「幫人哋擋咗一劫」勇警查犯遭割頸　母另一番體會,「幫人哋擋咗一劫」 勇警查犯遭割頸　母另一番體會 【本報訊】上周二在深水埗巡邏遭割頸重創的警員朱振國，轉往廣華醫院腦外科搶救，傷勢仍然危殆，醫生現時替他腦部減壓治療。而其母昨日首度開腔，她為兒子的英勇行為感到驕傲，並且感謝兩位參與搶救的好市民。她又批評警方的巡邏制度，希望全面改行「孖咇」制，她說：「因為係一條人命，唔好每次出事至嚟改變」。　記者：吳國威、羅振輝 朱振國遇襲受傷後，其家人均請假輪流到醫院等候消息。不過，由於他仍然昏迷，家人及調查案件的重案組探員，至今未能與他接觸，日前朱振國轉到廣華醫院救治，由腦外科顧問醫生郭正光主診。朱母指出，由於兒子頸部大動脈被割斷，腦部曾一度缺血缺氧，現在需要進行減壓。 遲兩分鐘送院必死 她引述醫生說，為減低身體郁動，對腦部產生壓力，要給他食藥讓他繼續睡覺，目前他仍有發燒迹象，需要蓋凍毯保持低溫，最主要是防止腦部發熱。醫生又指，當日他送院時，身體已失去八成血液，若遲多兩分鐘送來必將喪命。  朱母又稱，當日要用十多包血漿輸血急救，其頸部大動脈進行接駁手術後，到現在縫合情況良好。醫生對朱振國的傷勢表示滿意及樂觀，如無意外及保持現有狀態將痊癒，狀況應比普通中風病人為佳。  朱振國當差十年，其母形容他「好勇好搏」，並是一名乖仔，自幼已懂事及懂得照顧自己，當差之後，母親經常提醒他不要搏得太盡，他總是這樣回應：「𠵱家唔搏幾時搏」。駐守尖沙嘴警署時，有一次窮追賊人不捨，結果令到自己受傷，其母對他的好勝亦沒有辦法。  不過，兒子今次截查疑人受重傷，朱母卻有一番體會，「佢截到一個準備犯案嘅人，幫到人哋擋咗一劫」，作為母親是引以為傲。她說，當日早上知道兒子出事，她當場大哭並幾乎嚇至暈倒，可幸現在都捱過了。 冀警隊全改「孖咇」 她又表示兒子遇襲受傷、大動脈傷口不停滲血時，兩位好市民施以援手替他止血，當兒子痊癒出院之後，定必向兩位好市民當面道謝，她亦多謝同袍及市民關心。至於其子出事時，救護車在十多分鐘才到場，她感到驚訝，若然救護車早五分鐘將其子送院，他現在情況應會好得多。  另外，她亦不滿警方的巡邏制度，批評指稱：「因為係一條人命，唔好每次出事至嚟改變」，她希望警方吸取今次事件的教訓，警員巡邏應由「單咇制」改為「孖咇制」，並且增加輔警當值人數。同時，她又建議警隊增加人手，例如降低入職要求及起薪點，讓更多人加入警隊。
20050725-6,20050725,6,救人青年謙稱盡綿力,救人青年謙稱盡綿力 案發當日參與救人的蕭景生（二十三歲），連日來都有留意受傷警員的新聞，看到報道知他一直情況危殆，亦顯得擔心，昨日知道朱振國傷勢好轉，則覺得安慰。他謙稱，在事件中只是盡了市民的一點綿力，並不是甚麼救人英雄。 待傷者清醒往探望 蕭說事後警方曾與他聯絡，除錄取口供外，得悉警方可能會向他頒嘉許狀或好市民獎。由於受傷警員仍未清醒，蕭暫時不會到醫院探望，但希望他早日康復，繼續為市民服務，稍後該警員清醒過來，他便會到醫院探望。  至於朱振國的傷勢，有腦科專科醫生表示，一般情況下，若因大量失血導致大腦缺血而休克，對傷者腦部及其他器官造成的損害，要視乎哪些部份的腦細胞受損較嚴重，才能判斷。但若因一條主動脈受傷而出現部份腦缺血，則較容易出現類似中風症狀，即半身不遂。  腦科專科醫生黃震遐稱，人體失血過多會導致腦部缺血缺氧，而後遺症要視乎腦部哪一個區域受到缺血嚴重破壞，才能明確斷定。他解釋，若傷者曾因為大量失血而導致休克，雖然變成植物人的機率較低，但這種情況下缺血對身體的損害也較難斷定，有可能是視覺區域、或四肢、或其他器官、或活動能力受損。 或出現中風後遺症 黃震遐又說，若傷者是因為一邊的主動脈被斬傷而失血過多，則有可能導致相關連的腦部局域因缺血而出現功能受損。傷者日後或會出現像中風一樣的後遺症，換言之，或會出現左邊或右邊手腳無法活動的情況。  本報記者
20050725-7,20050725,7,瀟灑男模贏「香港先生」,瀟灑男模贏「香港先生」 【本報記者卓美娟、王崇穎報道】無綫電視主辦的「香港先生選舉」，昨晚在將軍澳電視廣播城舉行決賽，十二位入圍的候選者，經過六個環節演出，逐部份即時篩選後，「瀟灑組」冠軍得主乃現年二十一歲、任職模特兒的2號高鈞賢，而「健力組」冠軍得主則是最年長、現年三十七歲，任職健身教練的14號鄭健樂。二人在中場休息一個小時，學習如拉丁舞和武術特別演出環節後，最終由2號高鈞賢成為「香港先生」。 自言贏才華與笑容 2號高鈞賢接過「香港先生」獎項，他大談得獎感受說：「心情好開心，個比賽可以俾我騷好多嘢，我一直好想做一個成功藝人，今次我諗自己係贏才華同笑容。」  大會安排藝人鄭裕玲、周麗淇和丘凱敏做司儀，全女班的評判團陣容鼎盛，包括名模Rosemary、港姐冠軍徐子珊、藝人伍詠薇、韓君婷、廖碧兒和張可頤等，以及合共超過六百名觀眾評判。  2號高鈞賢外表斯文，他每個環節都表現平均，佔盡優勢，尤其在「必殺技」表演時，他表演彈琴，散發浪漫優雅氣質，令身為評判之一的韓君婷頓時為之着迷。當2高鈞賢換上三角泳褲濕身演出時，他更主動走近韓君婷的面前親吻她的手背。 筋肉型男惹女士叫囂 「筋肉型男」14號鄭健樂，在「必殺技」表演時，穿上僅可遮掩下體的黑色泳褲，大曬肌肉，在鏡頭前擺出多個健美先生「甫士」，令現場女士叫囂不停。中場一小時休息後，2號高鈞賢即場與跳舞老師黃蕊拍檔大跳拉丁舞，他的步伐充滿節奏感，表現淡定，相對來說14號鄭健樂表演武術和耍刀，未知可是因為他全身肌肉，體重較重，動作不夠靈活，他亦未能依武術導師楊菁菁在尾段做出一字馬，比較失色。
20050725-8,20050725,8,鍾庭耀提醒曾蔭權　勿將民調當政治工具,鍾庭耀提醒曾蔭權　勿將民調當政治工具 【本報訊】特首曾蔭權上場後，聲言以民意為施政之本，並引用中央政策組負責的調查稱，市民關心經濟問題多於政治問題，雙普選並非市民最重視的議題。香港大學民意研究計劃主任鍾庭耀稱，當局披露的民調資料仍未符國際標準，曾捲入民調風波的他提醒曾蔭權，「唔好將民調當做政治工具，否則會陷入更大政治危機。」　記者：羅偉光 曾蔭權自三月中任署理特首至自動當選特首，民望屢創新高，連帶其他高官亦受惠。對於政府整體民望穩步上揚，鍾庭耀接受訪問時稱，參考以往數據，新官上場首兩個月是民望觀察期，若期間沒有重大負面事件，市民對官員印象大致定形，故這兩個月是曾蔭權民望能否站穩陣腳的關鍵時刻。 民望跌至50分便不妙 鍾又指前任政務司司長陳方安生民望最高逾八十分，「如果曾蔭權達到呢個水平，北京就唔使再驚陳太。」前任特首董建華民望最低見三十多分，之後長期徘徊四十多分，低於五十分合格水平，鍾庭耀認為，以曾蔭權的背景及北京對他信任程度較董為低，其民望一旦跌至近五十分便處境不妙，「北京對佢嘅容忍程度，應該低過董建華。」  中央領導人強調施政要以民為本，曾蔭權亦說重視民意，但他引述中央政策組負責的調查，指市民認為解決失業問題優於雙普選卻引起爭議。  鍾庭耀稱，港府應全面披露民調資料讓公眾參考，才符合國際標準，「中央政策組有咁多專家，知而不做，或者唔知道點做，都係唔啱。」 會陷入更大政治危機 至於曾蔭權是否利用民調玩弄民意，鍾說會從正面去看，「希望佢唔好將民調當做政治工具，否則會陷入更大政治危機，如果政府都帶頭破壞民調公信力，香港亦唔會有獨立民調風氣。」  鍾庭耀於○○年爆出特首高級特別助理路祥安因特首民調接觸他，觸發「鍾庭耀事件」，令香港大學前校長鄭耀宗下台。五年後回顧，鍾對此輕描淡寫，「雙方對民調嘅理解頻道唔同。」
20050725-9,20050725,9,民主黨岑永根涉濫用免費泊車證,民主黨岑永根涉濫用免費泊車證 【本報訊】為方便區議員履行公務，房屋委員會發出特許泊車證供議員在所屬地區公共屋邨停車場免費泊車，民主黨北區區議員岑永根被投訴濫用泊車證，跨區到屯門免費泊車。岑永根否認濫用泊車證，但遭管理屋邨停車場的領匯踢爆，調查後證實事件。 跨區使用　辯稱公務 本報本月初接獲投訴，指岑永根以到屯門蝴蝶邨執行公務為由，經常使用該邨停車場，並以房委會發出的特許泊車證免費泊車。  據房委會指引，岑獲發的泊車證只可在北區使用，使用屯門停車場需繳費。投訴指岑雖聲稱公務在身，但到蝴蝶邨後卻多在邨內酒樓出沒，由於他是公職人員，管理人員惟有「隻眼開隻眼閉」讓他免費泊車。  岑永根本月初接受本報查詢時否認濫用泊車證，強調到蝴蝶邨是要探望調遷該處居民而非「食飯飲茶」，「有個案要跟進，幫忙送啲舊電器畀街坊。」他又表示，使用蝴蝶邨停車場有支付費用，「點會唔畀錢？屋邨停車場有半個鐘頭免費上落貨，泊少過半個鐘咪唔使畀錢囉。」  領匯卻踢爆岑永根，表示調查後發現，岑永根過去數個月確曾多次使用其只可在北區使用的特許泊車證進出蝴蝶邨停車場，管理公司向他解釋後，岑永根才再無使用他的特許泊車證進出蝴蝶邨。本報日前多次聯絡岑永根，但未獲回覆。  蝴蝶邨區議員蘇愛群稱，曾經聽聞有管理人員與公職人員就使用特許泊車證起爭議，她說區議員應該遵守指引不得越區使用特許泊車證，「一次半次就可能係誤用，但係長期咁做就屬於濫用。」
20050725-10,20050725,10,涂謹申歡迎廉署調查,涂謹申歡迎廉署調查 【本報訊】廉政公署會就民主黨立法會議員涂謹申涉及的滙標事件，再次展開調查，涂謹申昨天在港台節目《舊日的足跡》中強調「公道自在人心」，希望藉最新調查，為自己洗脫嫌疑，「甚至還我清白」。  涂謹申在節目中承認，過往忙於應付法律及政策問題，沒有花時間處理地區行政事務，加上一向依賴職員處理帳目，以致出現問題。他直認敏感度不足，而有關負面新聞已令其心情及形象受影響，今後將改善行政管理工作。 暗示不會辭職 對於有人要求他辭職，涂謹申強調，「我無做過對唔住人嘅事，亦無任何隱瞞」，暗示不會辭職。他亦指出，立法會及黨內進行的調查均顯示其個人誠信未受質疑，指外間對其態度「苛刻」，源於社會對議員要求較前提高，「我要接受，因為我都係咁要求人，所以咁樣係應該嘅。」  涂謹申稱，當日若出席民主黨三人小組會議，有助協助調查。被問到民主黨有否力保他時，涂強調該黨沒懷疑其有私心及得益，亦支持自己。
20050725-11,20050725,11,感染者死亡率達五成,感染者死亡率達五成 【本報訊】感染豬型鏈球菌是一種人畜都會患上的病症，除豬隻可能會在受感染後發病及死亡外，人類感染後也會出現腦膜炎、敗血病等嚴重病徵及失聰的後遺症，死亡率高達五成。此細菌每年在本港均造成數宗感染個案，是導致本港成年人出現腦膜炎的最常見細菌。 可致器官衰竭併發症 香港大學醫學院微生物學系助理教授黃世賢稱，豬型鏈球菌常在豬隻的上呼吸道發現，豬隻帶菌可以沒有病徵，也可導致豬隻關節炎及腦膜炎。人類感染則是透過傷口接觸細菌引起，但絕對不會人傳人。  該學系副教授何栢良強調，感染此菌的病人會迅速發病，「由起初發燒至好嚴重只係一至兩日」，病者一般會出現關節炎及腦膜炎病徵，包括頭痛、乏力、抽筋及嘔吐等；若細菌入侵聽覺神經，即可導致失聰，也可引起器官衰竭及敗血病等嚴重併發症，死亡率高達五成。此病症可透過服用抗生素治療，但若病人未有及早求醫而出現腦膜炎，即有七至八成風險出現永久失聰的後遺症。  衞生署衞生防護中心的資料顯示，去年一月至今年三月期間，本港共有五宗豬型鏈球菌感染個案，其中三名病者是需要經常接觸生豬肉的肉檔工人、屠場工人及中式酒樓點心師傅。此病被勞工處列為職業病之一，九四至○四年間共錄得七宗與職業有關的豬型鏈球菌個案。
20050725-12,20050725,12,程翔妻：夫仍無歸期,程翔妻：夫仍無歸期 【本報訊】被中國扣查約三個月的資深記者程翔，其太太劉敏儀昨天表示，至今未有丈夫獲釋時間表，但對他平安返港持樂觀態度。 他精神及健康不俗 昨日有報道指程翔可於本周內獲釋，劉敏儀昨天接受查詢時指，自從行政長官曾蔭權早前向港澳辦主任廖暉了解程翔被扣一事後，「我喺各方得到嘅消息，對佢獲釋都係好樂觀」，但她強調，有關消息絕非來自官方渠道，至今仍然未有丈夫確實歸期。  劉敏儀透露，保安局官員每周約與她本人聯絡一至兩次，交代丈夫的最新情況。她指丈夫目前精神及健康情況不俗，只是血壓呈不穩定，須靠藥物治療。劉敏儀續稱，雖然程翔被扣查將近百日，劉對丈夫獲釋仍感樂觀，聲言會繼續靜心等候丈夫返港。  保安局發言人昨日回應指，特區政府一直與程翔家人保持聯絡，提供可行協助，並會將任何最新消息向其家人通報。  任職新加坡《海峽時報》首席中國特派員的程翔是在今年四月中，被指涉及從事間諜活動而被內地扣查。
