key,date,article_daily_id,title,text
20050606-197,20050606,197,國際視野：不懼風險只怕迷茫,"國際視野：不懼風險只怕迷茫 在加息周期仍未完結之際，美國10年期聯邦債券孳息再度滑落至4厘之下，不要說令不少分析家及市場人士大跌眼鏡，連決策者也摸不着頭腦，不然又怎會有conundrum一詞出現？本欄一直提醒讀者美債不宜沾手，瞧瞧去年6月聯儲局開始加息前後，10年期國債孳息曾攀升上4.9厘，可是及後經濟增長數據愈理想，利率愈被調高，孳息卻愈向下滑，至今年2月竟下穿4厘，在格老不諱言質疑這是個「謎團」之後，孳息又再上升至4.6厘，稍後徐徐下滑至上周五一度低見3.80厘的14個月低位，但收市又回升至接近4厘，若果不是「局」內人或英明神武之箇中能手，只顧頂白跟紅或看表像進行買賣之士，不被摑至似豬頭才怪！ 美債孳息走勢飄忽 其實孳息最近之向下滑落，並非沒有理據支持，法國和荷蘭在歐盟新憲法公投之前已不斷傳來不利消息，影響所及，資金又怎不暫時撤出歐洲市場避避鋒頭？有數得計之高風險投資未必會嚇怕投資者，然不明朗或不確定性，又豈是冒險的契機？那麼在此情況下，誰個才是最受惠者已不言而喻矣！  令一般投資者啼笑皆非的是，這次公投小風暴，固然是孳息被推低之好藉口，但美國勞工部剛公布的5月份非農業職位增長僅錄得78,000個，比4月的增加274,000個有天壤之別。5月份職位增長數字不及市場預期的一半，惹來不少分析家估計加息周期快將完結，長債孳息應繼續尋底才是，可是表現卻與想法背馳，10年期聯邦債券孳息不跌反升，除認為是大戶趁壞消息進行補倉外，看不出有其他因素，如此波動的走勢，又怎不玩死人？自問藝高人膽大者，這個不失為表演功架的市場。  王冠一  "
20050606-198,20050606,198,長實賣樓再增透明度,長實賣樓再增透明度 各界對內部認購手法的批評之聲不絕，現正內購的新盤，發展商的態度更謹慎。長江實業（001）上周末推出18個長沙灣宇晴軒海翡翠單位內購，也嚴守指引，即場派發加推單位價單，並揚言會研究電腦系統配合，進一步增加透明度。 【本報訊】長實執行董事趙國雄表示，宇晴軒昨日加推8個單位，已即場與首批價單一併派發，並將已出售的單位劃去，強調以高透明度的手法賣樓。 宇晴軒加推8單位 趙國雄指出，考慮加入電腦系統，買家簽約時，螢光幕會顯示有關單位及價錢，在場的準買家可即時知道。對於地產代理監管局指，代理的資訊須與發展商公布的相符，他亦贊同，並表示會盡快將樓盤資料通知各地產代理，特別是價錢，必須要統一。  市場人士認為，樓市受加息影響，近期氣氛淡靜，發展商不傾向一次過推出大量單位，每次推售的數量有限，要提供高透明度並不困難。不過，若市況轉活，市場對新盤需求大，當買家爭相入市時，對發展商的要求亦隨之降低。趙國雄則指出，日後推出的新盤，也會最少提早1天公布價單。  長實高級營業經理郭子威表示，宇晴軒海翡翠昨天加推8伙，兩天共售出18個單位，平均呎價6160元。本周將推出相連戶，早前已售出50套，呎價6000至6600元，尚餘50套待售。   定額供款即將取消 另外，對於銀行再度加息，趙國雄認為，加幅輕微，對樓市影響有限。郭子威補充說，加息後成本增加，早前推出的定額供款計劃，最快明天取消。
20050606-199,20050606,199,新盤兩天銷量減少75%,新盤兩天銷量減少75% 一手市場缺乏全新盤開售刺激，剛過去的周末交投再度回落，在多個貨尾盤乏成交下，6個主要新盤兩天僅錄得53宗買賣，較前周210宗大跌七成半。 售出53伙旭日佔47% 兩天新盤成交，只有近日重售的土瓜灣旭日豪庭貨尾，及日前內購的長沙灣宇晴軒海翡翠錄得雙位數字銷量，其餘新盤均只有三數宗買賣，前周熱賣的上水御皇庭，銷量急轉直下，只售出3伙。  由華人置業（127）或有關人士發展的旭日豪庭，過去兩天銷量佔整體47%。市場人士認為，該盤樓齡雖已屆4年，不過呎價貼市，吸引區內街坊捧場。
20050606-200,20050606,200,摸貨首5月成交僅次97年,摸貨首5月成交僅次97年 【本報訊】樓市上半年投資氣氛熾熱，中原地產指出，今年首5個月以確認人身份轉讓的二手私人住宅有1890宗，較去年同期的1597宗，增加18.3%，屬97年樓市高峯期後，同期的新高。 1890宗年增加18% 中原地產研究部高級經理黃良昇指出，今年首5個月的摸貨成交，是自03年以後，第2年錄得升幅，亦是繼97年同期之後，另一新高紀錄，但數量仍較之錄得的4752宗相距甚遠。  摸貨量最多的10個屋苑中，不少為即將或開始入伙的屋苑，當中近期入伙的將軍澳蔚藍灣畔以230宗居首，第2位的東涌映灣園也屬樓齡較新的物業，有183宗摸貨，近期準備交樓的長沙灣宇晴軒以182宗居第3位。 蔚藍　映灣　宇晴較多 其餘入十大之列的屋苑，亦以新盤為主，包括西灣河嘉亨灣、堅尼地城泓都及荃灣樂悠居等。傳統屋苑，有第6位的天水圍嘉湖山莊，佔75宗摸貨成交，荔枝角美孚新邨以41宗排第9位。  另外，利嘉閣地產研究部主管周滿傑指出，統計5月份的摸貨成交，有519宗，較4月份的535宗少3%，獲利個案達472宗。而上月二手交投減少，但摸貨所佔比例，則較4月份多，佔5.2%。摸貨成交最多的首十個屋苑，有9個是入伙不足2年或樓花。
20050606-201,20050606,201,二手交投跌幅收窄,二手交投跌幅收窄 【本報訊】香港置業資料顯示，全港44個大型屋苑剛過去周末合共錄得139宗成交，較前周微跌5%。 港島屋苑逆市上升 但港島區屋苑成交逆市上升，至於九龍及新界區屋苑交投仍較前周下跌，不過跌幅已大為收窄，反映市場已逐步消化加息的負面影響。  香港置業區域經理葉明輝表示，港島區住宅供應相對較少，加息陰影淡化後，購買力很快便累積起來，港島屋苑兩天共錄得23宗成交，較前周上升9.5%。熱門屋苑如鰂魚涌太古城，為買家首選吸納對象，共有6宗買賣，較前周升20%。同區南豐新邨，由於租金回報理想，甚受投資者歡迎，兩天共有5宗成交，升25%。 九龍樓70宗買賣 九龍屋苑兩天錄得70宗成交，較前周跌6.7%。港置半島豪庭分行營業經理陳紹眉表示，個別屋苑受區內新盤開售刺激，交投逆市上升，如紅磡黃埔花園，受同區海名軒貨尾熱賣刺激，成交顯著增加，兩天錄得5宗，較前周上升逾六成。 新界區成交跌8% 新界屋苑交投跌幅最大，兩天只有46宗，較前周減少8%，除東涌藍天海岸交投增加外，其餘各屋苑成交量全面報跌或不變。港置藍天海岸分行區域經理褟啟豪表示，自上月傳有投資者以1.5億元大手掃入區內屋苑50個單位後，藍天海岸交投顯著增加，過去兩天共有8宗，較前周升14.3%，連續第4周錄得升幅。
20050606-202,20050606,202,樓市動向,樓市動向 香港　太古城半年升9.5% ▲世紀21勞振華表示，鰂魚涌太古城資深投資者，剛以460萬元沽出啟天閣中層A室，面積870方呎，呎價5287元。該投資者於1月以420萬元購入，現賺40萬元，9.5%。  ▲香港置業葉明輝表示，鰂魚涌華蘭花園玉蘭閣低層F室，面積481方呎，作價168萬元，每呎3493元，原業主今年4月以156萬元買入，持貨不足兩個月賺12萬元。 翰林軒火速成交 ▲利嘉閣杜美萍表示，西半山翰林軒2座高層E室，1048方呎，放盤不足12小時，獲換樓客以700萬元承接，呎價6679元，原業主02年初以475萬元購入，持貨3年賺225萬元，單位升值47.4%。 九龍　星光行5樓招標 ▲美聯區詠妍表示，尖沙嘴星光行5樓33至35號單位，招標出售，下月19日截標。單位面積4350方呎，交吉，配備獨立洗手間及冷氣系統，適合教學中心、美容及軟件一類行業。 黃埔花園換樓 ▲中原曾偉堯表示，紅磡黃埔花園十期1座中層C室，面積1033方呎，享全海景，剛以510萬元易手，呎價4937元，造價理想，買家為同區換樓客。  ▲香港置業麥國良表示，大角嘴港灣豪庭5座高層F室，617方呎，以230萬元成交，呎價3728元，原業主於去年3月以209萬元買入，持貨1年多獲利21萬元，升值一成。 海逸97年貨勁蝕 ▲利嘉閣林仲山表示，紅磡海逸豪園2座高層G及H相連單位，2763方呎，獲用家以1600萬元承接，呎價5791元，原業主97年4月以2868萬元購入，勁蝕1268萬元，貶值44.2%。 新界　松濤苑年賺430萬 ▲嘉信置業黃富傑表示，西貢松濤苑A段單號屋，2500方呎，連800方呎花園，以1850萬元成交，呎價7400元，原業主去年初以1420萬元買入，1年多賺430萬元。  ▲美聯黃國良表示，天水圍嘉湖山莊美湖居8座中層F室，576方呎，成交價115萬元，每呎1997元，低市價9%，原業主00年以140萬元買入，持貨5年轉手蝕25萬元。 盈翠半島低水6% ▲青衣盈翠半島9座低層A室，541方呎，以226萬元易手，呎價4177元，低市價6%，更屬近期新低。美聯周志忠表示，原業主00年以250萬元買入，轉手蝕讓24萬元。  ▲美聯陳光明表示，大埔滌濤山7座複式，3090方呎，另789方呎天台，獲外區用家以1740萬元一手購入，呎價5631元。該盤尚餘不足10個貨尾。
20050606-203,20050606,203,蘭西情報課：請睇戲apm催谷夜市,蘭西情報課：請睇戲apm催谷夜市 觀塘apm商場開業個多月，人流已經相當不俗，新地宣傳攻勢仍不怠慢，為推廣獨有夜行零售概念，大搞夜貓購物激賞，今個月內，逢禮拜一至四，夜晚十點至凌晨兩點，凡買嘢滿三百，就送夜場戲飛一張，重可以參加有獎遊戲。  其實apm搞夜行零售有一定難度，事關無論上班族抑或上學族，多數都等到禮拜五同周末，至會狂歡至深夜，店舖日以繼夜經營，成本都唔輕，請sales都難啲。  不過，話時話，apm除咗帶旺同區商廈市道之外，亦令到的士行業受惠。早排蘭西睇完午夜場，散場都成兩點鐘，行返去對面裕民坊，好容易就搵到的士坐。個司機話，apm開咗，佢哋深宵生意都多番，唔使等太耐，已經有客。 按九成半起泡沫 經常都有人話，當師奶阿叔都走去瘋狂炒樓炒股，就係大跌市嘅徵兆。  蘭西有次去屯門做嘢，搭小巴時，聽見兩個去緊街市買餸嘅師奶大談樓市，其中師奶甲聲如洪鐘咁話，個市升咗咁多，買樓咪搵自己笨？  師奶乙都贊成，之但係佢話，隔籬屋個師奶丙，啱啱又買多咗個單位用嚟炒，佢嫌股市賺錢太慢，不如買多幾層樓，等升值好過。  師奶乙見師奶甲一臉疑惑，就解釋話，師奶丙係申請九成半按揭買樓，加上屯門樓百零萬已有交易，買兩間，首期都係十零萬。講到好似唔使供咁。  樓市真係潛在唔少泡沫，果真爆破，呢鋪都咪話唔傷。 代理花臣推員工 樓市急轉直下，已經係事實擺在眼前，靠佣金搵食嘅地產代理行，耐唔耐就要搞吓花臣，鼓勵員工，繼續衝呀衝。  中記搞咗個「極速起動大獎」，員工喺今個月七號之前，凡係促成交易，不論一二手、租或售，都可以攞到件奧地利水晶獎座，名額三百個。  美記就出動紀念版瓷杯，獎勵最快促成交易嘅員工，名額同樣三百個。  話時話，點解無端端會走隻紀念版杯出嚟？其實係美記慶祝上市十周年嘅活動之一，佢哋喺馬來西亞訂購咗一批紀念版錫杯，諗住送畀一批貴賓。 返鄉下新都城筍賣 今時今日，返鄉下歎世界，仍然係唔少老一輩嘅心態，將軍澳新都城啱啱有個老街坊，不惜以低於市價賣樓，帳面賺咗二十零萬，返大陸長住。  利記高世聰話，單位係都會豪庭三座低層G室，八百六十六呎，造價約二百五十七萬，每呎唔使三千蚊，低市價八個巴仙。原業主喺○二年買入，當時嘅價錢係二百三十幾萬，𠵱家除清雜費後，仍然有賺。  其實佢早已移居內地，長期丟空個單位，為咗圓歎世界美夢，反正又可以套現，平平地賣咗佢好過咁話。 皇御居押後 近期樓市氣氛明顯轉靜，新盤開售都要諗過度過。羅家寶百樂集團發展，首個住宅項目沙田皇御居，上個月先至講緊七月發售，𠵱家都因應市況咁靜，延遲到八月尾、九月頭。  皇御居雖然係百樂第一個樓盤，不過，佢哋嘅市場觸覺一啲都唔輸蝕。  負責銷售同策劃嘅中記話，皇御居剛剛攞咗滿意紙，現場搭緊示範單位，預計八月先至完成，到時可以配合推售。  中記董事阮錫章話，皇御居意向呎價七千蚊，勢成該區新指標，所以要等到市場條件配合，先至推售。  電郵地址：nancy@appledaily.com
20050606-204,20050606,204,富邦招兵買馬理財客戶冀增兩千,富邦招兵買馬理財客戶冀增兩千 富邦銀行香港（636）正式改名後，隨即積極拓展財富管理業務──AmbassadorBanking，並會在母公司富邦金融控股協助下，發展台灣客戶的離岸AmbassadorBanking服務，冀年底前理財客戶數目，從現時超過五千人增至七、八千人。 AmbassadorBanking添人手 富邦香港金融市場推廣部主管區子安表示，AmbassadorBanking是非利息收入的主要來源，佔逾6成，因此富邦積極在服務及產品方面滿足客戶。該行零售銀行業務主管葉嘉敏表示，今年會繼續增聘人手，並擴充分行或服務網點。  目前富邦香港23家分行中，7成完成裝修，並設有AmbassadorBanking的服務點，另有4家獨立的理財中心。下半年該行計劃增聘10至20個銷售人員，並增加在分行中設置服務點，但無意再另開無銀行服務的理財服務中心。  該行個人銀行部主管李儀章表示，現時富邦香港的AmbassadorBanking客戶，平均存款額高於最低要求的100萬元，大部份屬存款，僅2至3成屬投資方式，希望日後將比例提高。該行也推出優惠，鼓勵客戶增加投資，如7月底或之前成為AmbassadorBanking新客戶，可享一律2%的基金認購費。  該行正開拓包括台灣客戶在內的離岸銀行服務，富邦金控的角色以轉介客戶為主，但要符合法規，兩行不能合作推出一戶口，同時管理兩行資產的服務，而富邦香港在台灣也未有辦事處。現時離岸銀行小組員工數目約40人，除台灣外，還會發展大中華其他地區。 拓台灣客戶離岸銀行服務 產品銷售方面，今年首季銀行結構產品銷售減少，但區子安指出，富邦首季結構產品銷售較去年同期為佳，但近兩個月市場缺乏投資方向，風險及回報難達平衡，料5、6月保持淡靜，至7月將好轉，至於基金，首5月銷售增長可觀，料新1季投資集中於地產基金及保本基金。該行將提出一新產品，回報可達6厘。  本報記者
20050606-205,20050606,205,西半山高雲臺難得維港煙花景,西半山高雲臺難得維港煙花景 香港寸金尺土，即使豪宅區的西半山，樓宇也愈起愈多，海景單位買少見少，優質的更是罕有。介紹的高雲臺極高層，客廳及各房俱望維港，包括中區至北角，西九龍沿岸，滿目都是繁華景象，華燈初上，夜賞東方之珠光芒，節日則見煙花璀璨，無論何時，景色均美。  內櫳同樣有睇頭，客飯廳及走廊鋪砌圍邊雲石，訂做木色飾櫃，內置燈槽發放柔和光線。套房部份牆身鋪木板，窗台鋪黑金沙雲石，起對比作用。廚廁選用新潮物料，饒富現代家居韻味。   極高層更架勢 港置周銓泰說，與H室一樣，G室望維港，最優質，這盤位處極高層，更具氣勢，內櫳豪裝及連家具，開價838萬元，合理。另一極高層盤，無裝修，索價880萬元。此外，E、F室望西區海景，有西斜，開價約700萬元。海景成交遠至1月，1040方呎高層F，作價650萬元，每呎6250元。  記者：溫潤潔　攝影：梁祖彝
20050606-206,20050606,206,中銀樓按加息其他銀行將跟隨,中銀樓按加息其他銀行將跟隨 【本報訊】中銀香港（2388）發言人表示，由今日開始，會將新造樓宇按揭利率調高0.25厘，即介乎最優惠利率減2厘至2.25厘（即按揭利率介乎3厘半至3.75厘）。現金回贈同時由0.3%至0.6%，減至最高回贈為0.4%。她指出，今次調整按揭息率，主要是因應市場變化及資金成本。  銀行界人士指出，自金管局推出優化聯滙措施，同業拆息普遍企於3厘以上，對本地銀行資金成本構成一定壓力，估計其他銀行將相繼調高按揭利率，若未來最優惠利率追隨美息上調，本港按揭息率未來數月將再上調。  自金管局本年2月底就樓按現金回贈發出指引後，銀行已多次調整按揭息率及現金回贈。中銀方面，自3月至今，連同優惠利率的調整，新造按揭息率已上升逾1厘。至於4月中調整按揭利率並取消現金回贈的滙豐及恒生銀行（011），目前按揭息率仍為最優惠利率減2.25厘。  滙豐銀行亞太主席鄭海泉日前指出，該行會否調整按揭利率仍待研究。由於過去按揭息率偏低，故有銀行將息率向上回調。恒生銀行副董事長兼行政總裁柯清輝早前表示，本港按揭利率尚有1厘的上調空間。
20050606-207,20050606,207,分拆中國建築中海派特別息,分拆中國建築中海派特別息 【本報訊】中國海外（688）母公司中國海外集團落實以介紹形式分拆中國建築上市。中國海外將以總代價7.88億元，將本港建築業務售予中國建築，代價以中國建築的股份支付。中國海外並計劃將該批股份以特別股息派予股東，比例為每18股中國海外可獲分配1股中國建築。  中國海外昨表示，上周五與母公司達成買賣協議，向母公司全資附屬公司中國建築出售香港建築業務，該業務截至去年12月底止年度盈利7530萬元，出售作價相等於9倍市盈率。母公司將會向中國海外轉讓中國建築3.57億股支付代價。 每18股獲分1股 待股東於本月底通過上述交易後，中國海外將向股東派發實物的特別股息，每持有18股中國海外，可獲分配1股中國建築；從而落實中國建築以介紹形式在主板上市的計劃，市場估計，若一切順利，中國建築可於7月正式掛牌。  整個交易及上市程序完成後，中國海外母公司持有中國建築64.27%股權，公眾持股量為35.73%，中國建築主要經營香港建築業務。中國海外集中於中港物業發展及基建項目投資。
20050606-208,20050606,208,任三招加劇利豐匯率風險,任三招加劇利豐匯率風險 金管局自上月中推出3項優化聯繫滙率措施後，港元兌美元滙價波幅擴闊至1000點子，對利豐（494）、德昌電機（179）及偉易達（303）等有顯著交易來自美國的企業，較以往面對更大的滙兌風險。利豐主席馮國經表示，集團已為交易作好對沖，於新措施下業務將不會受到影響。 【本報訊】馮國經對本報表示，由於利豐大部份交易均以美元結算，並會為交易作對沖安排，因此即使滙率波幅多達1000點子，亦不會影響業務；相反若港元長遠有升值的情況，則對集團毛利率有輕微影響。他認為「世貿部長級會議今年在港舉行，若沒有成果，對貿易業的影響會較大。」  利豐04年營業額471.72億元，其中68%來自美國市場、20%來自歐洲，餘下則來自加拿大、澳洲及中美等其他地區；期內純利15.3億元，毛利率及核心經營溢利率，分別是9.6%及3.4%，03年則為9.3%及3.1%。 68%生意　來自美國 有外資分析員表示，以利豐這樣規模的貿易公司，且又是以美國為主要市場，在港美滙率由固定變為有一定幅度的浮動，相信毛利率會略受影響，但由於有關措施剛實施，暫難計算具體的影響有多大。  另一名分析員則估計，利豐為美元滙價進行的對沖，費用應不會太高。  渣打銀行經濟師許長泰表示，雖然在優化聯繫滙率下，港元兌美元有上下調整約0.6%的空間，技術上增加了從事中美貿易的企業風險，但實施新政以來，金管局已多次出手，基本上已令港元兌美元保持在7.8元水平，預料在一般情況下，優化聯滙將不會令中美貿易企業面對較大美元滙兌風險。 滙率浮動　風險增加 相對美元，許長泰反指目前歐元的滙兌風險更大。至於企業在優化聯滙下是否需為美元作對沖？他認為除視乎企業各自的發展策略而定外，亦端視企業對聯滙的信心有多大。
20050606-209,20050606,209,德昌全年純利料增三成,德昌全年純利料增三成 04年度三成營業額來自美國市場的德昌電機（179），將於下周一（13日）公布全年業績。據ThomsonFirstCall綜合15家證券行預測，德昌截至3月底05年度純利約11.83億元；證券行普遍預期，德昌仍需面對原材料漲價壓力。 產品價格未追上 瑞士信貸第一波士頓預測，德昌全年純利11.39億元，較上年度增加24.79%（見表）。  該行認為，德昌期內仍將面對生產原材料價格，與產品價格加幅步伐未能一致，擔心情況持續，故投資評級維持「跑輸大市」，目標價6.85元。  瑞銀證券則較樂觀，料德昌05年度純利13.1億元，升43.6%，反映集團成功控制開支及員工成本，產品價格亦趨穩定。  不過，該行擔心鋼鐵及銅價繼續上漲對德昌今年業績的影響，現時給予該公司的評級為「購入」，目標價則為8.4元。
