key,date,article_daily_id,title,text
20050827-225,20050827,225,升值憧憬升溫　人民幣再創新高,升值憧憬升溫　人民幣再創新高 【本報訊】外圍市場趁日圓滙率上升及國家主席胡錦濤訪美前夕，加上人行公布下周一的人民幣中間交易價為8.0965，是機制改革以來的最強滙率，令市場揣測人民幣滙率在昨晚或在G7會議期間再升值1%，雖然人行已否認，但人民幣不交收遠期合約仍交投頻密，1年期不交收遠期價格顯著轉強，每美元兌人民幣由7.86升至7.81，港滙也一度升破7.77水平。 期滙有異動見7.81 市場人士相信，短期內仍有投機活動借消息炒賣人民幣升值。而中國貨幣網顯示昨日內地遠期滙市有一宗成交，合約期限為35日，成交價每美元兌8.0816人民幣，與工商銀行的1個月期合約買入擺價8.0816相同，這是自上周一內地銀行間期滙市場突然啟動後，第2次單個交易日錄得成交。  一名外資銀行交易主管表示，昨午分別從倫敦及日本等市場，傳出人民幣將升值的消息，人行其後重申沒有改變滙率的立場，人行貨幣政策委員會委員余永定接受路透社訪問時表示，人民幣一次性、大幅升值對中國經濟的負面影響更大，人民幣滙率最終由市場力量決定。  銀行公會主席和廣北認為，熱錢流入本港炒作人民幣升值的成本甚高，金管局的優化措施已令相當部份的熱錢流走。  另外，市場盛傳中國將再度重估人民幣值，令美元一度由全日高位回吐近1日圓，在亞洲尾市降至109.37日圓，較周四紐約收市低0.67日圓。其後儘管中國人民銀行否認有關報道，圓滙繼續在109水平徘徊，美元於紐約早市報109.86日圓，跌0.18日圓。 日圓受惠　升上109 在亞洲市初段，阿蓋德組織據報已把恐怖襲擊對象移至亞洲區的金融中心，令美元一度升見110.39，較周四升0.35日圓。
20050827-226,20050827,226,萬談財策：了解風險投資第一步,萬談財策：了解風險投資第一步 「知己知彼，百戰百勝。」這句老掉牙的話，卻是投資場上的真理。在投資前必要先了解甚麼是風險，並計算個人承受風險的能力。甚麼是風險呢？其實由開始投資到獲取回報期間，所有不確定而影響回報的因素，均會構成風險。換句話說，風險是為獲得潛在投資回報過程中的代價。 投資可賺可蝕。每個投資者都想贏，但未必人人都有敢輸的心理質素。假如市場升跌起伏會令你茶飯不思，甚至影響工作情緒，便不要勉強自己──選擇儲蓄保險、債券或平衡基金等中至低度風險的投資工具便好了。寧可降低投資回報要求，勤儉些、多儲錢，一樣可達成目標。  即使你覺得自己具備冒險精神，在投資前，也請先衡量自己是否符合承受高風險的條件。  首先是時間。恒指在這3年間由12000點起步，曾跌至8400多點，最近又高見15000點以上水平，證明短線市場可以非常波動，但長線而言，股市走勢卻始終向上。恒指在過去20年每年平均複式增長達11%，只要投資時間夠長，中途的波幅可以置之不理。 長短線處理不同 若短期要動用資金，如3年內要買樓結婚，便應乖乖的把儲蓄留在存款戶口。堅決要投資的話，亦只可考慮存款證、外滙基金票據或短期美國國庫債券等低風險工具，息率雖只有約3至4厘，卻足以跑贏通脹。如果是以退休為目標的儲蓄投資，則可進取一點。例如距離退休時間仍有逾20年的話，增長型股票或基金，均是較佳的選擇。  其次是財政狀況。試試拿出計算機，認真點算一下自己有多少資產（不包括自住物業）及負債，以得出淨資產數額。舉例說，存款、債券和股票等資產加起來有100萬元，另有80萬元貸款未償還，即淨資產只有20萬元。換句話說，資產價格只消下跌兩成，便會淪為負資產。 冒險先要講本錢 不少投資者一直高估了自己承擔損失的能力。例如上有高堂下有妻兒要養、工作或生意收入不穩定，甚至經常外出公幹，其實都沒有太多本錢去冒險。就算你像唐吉訶德般勇敢，亦請對高風險投資項目抱謹慎態度。  投資不是合起雙眼賭運氣的遊戲。認股證及期貨等較高風險的投資產品，原理及操作通常都較複雜，投資新手切勿未學行先學跑，要先進修好理財知識、多看投資書籍和留意財經新聞，由小注買賣股票及債券開始，累積經驗後，才可挑戰高難度。  大部份保險公司及銀行都樂意免費替客戶評估個人風險承受能力，但假如你每次聽到投資理論都禁不住打呵欠，倒不如順道找個有經驗的理財顧問，揀選往績優良的基金，將財富交給專業人士管理吧！  MLC萬誠
20050827-227,20050827,227,宏觀理財：買危疾保險　保障要足,宏觀理財：買危疾保險　保障要足 每個人都希望身體健康，但疾病往往是突如其來的。一般的傷風感冒，只需數天便能痊癒；但若不幸患上危疾，例如心臟病及癌症，病者不但要擔心病情，更要面對冗長的療程及昂貴的醫療費用。為了減低患病帶來的經濟壓力，有些人會選擇購買危疾保險，當患上受保危疾時，可獲保險公司賠償，以支付所需支出。但購買了危疾保險，又是否等於有足夠保障？  在選擇危疾保障計劃時，應注意保障的範圍──範圍愈廣，保障相對較大。現時市場上有些計劃提供多達48種危疾保障，當中包括癌症、中風、柏金遜病等。個別計劃還提供特別賠償，例如患上男性獨有的癌症，可獲額外賠償；若客戶接受血管成形術治療法（即通波仔手術），又或是女性客戶患上原位癌，也可獲預支保障額的某個百分比，用以支付醫療開支。另外，個別計劃更提供第二醫療意見及跟進服務，讓客戶聽取另一位外國醫生的意見，從而選擇最合適的治療方法。  除保障的範圍外，保障期亦十分重要。年紀愈大，患上危疾的機會便愈高，對保障需求會相應增加。市面上亦有提供保障至100歲的計劃，讓受保人暮年時仍然能得到保障。  治療癌症的醫療費用，動輒要數十萬港元。購買危疾保險，需確保有足夠的保額，除醫療費用外，應把患病休養期間可能失去的入息計算在內。  另外，歷史悠久、作風穩健的保險公司，可令客戶更為安心。客戶不妨以保險公司所管理的資產總值、國際評級及理賠評級，作為揀選的準則。  客戶應按個人所需而選擇合適的危疾保障計劃，如有疑問，請向保險顧問查詢。
20050827-228,20050827,228,儲局勢繼續有秩序加息格老憂股市樓市過熱,儲局勢繼續有秩序加息 格老憂股市樓市過熱 美國聯邦儲備局主席格林斯潘警告，美國股價及樓價持續漲升，反映投資者在低息環境下愈來愈願意冒風險，這種情況發展下去將不利金融市場。他又表示，不擔心油價當前的升勢。分析員認為，格林斯潘暗示聯儲局將繼續有秩序地加息。 【本報綜合報道】格林斯潘昨天出席堪薩斯城聯邦儲備銀行在懷俄明州JacksonHole主辦的中央銀行行長年會，他指出美國投資者經歷長期的經濟穩定，愈益相信投資風險已比以往減少，資產價格漲升是結構性和永久性的，因此對資產風險溢價不斷下降亦甘之如飴，這種情況推動股、樓等資產價格近期一浪高於一浪，從而推高消費者和企業開支。 不擔心油價大漲 格林斯潘提醒市場人士，不要對美國經濟的穩健程度過份有信心，在目前的環境下更應格外審慎，目前充裕的流動資金隨時可消失，按揭利率等資金成本有上升的可能，資產價格也有機會下降，對整體經濟構成的風險將不小。他表示，歷史證明，風險溢價長期偏低的後果會是很嚴重。 學者恐泡沫爆破 他表示，聯儲局已更密切關注資產價格走勢，美國經濟有需要維持其靈活性，以應付資產價格一旦出現暴跌。  對於近期屢創新高的油價，格林斯潘表示不擔心。他說，由市場主導的美國經濟甚具靈活性，在過去兩年來成功應付油價上漲。  雷曼兄弟經濟師馬蒂斯表示，格林斯潘的言論顯示聯儲局將繼續循序漸進地加息。  普林斯頓大學經濟學教授克魯明警告，美國樓價持續攀升正形成物業泡沫，預期此一泡沫明年春季將會爆破。他表示，美國的樓市泡沫在未來3年內若一直不爆，他將會感到意外。  克里夫蘭聯邦儲備銀行一項研究顯示，聯儲局可出乎意料地透過拖延加息來紓緩高油價對經濟造成的打擊，但效果可能會相當短暫。  研究結果顯示，假如油價上漲一成，將導致聯儲局加息2厘，拖累國內生產總值（GDP）倒退0.5%；聯儲局若延遲加息，將令原本預期加息的消費者喜出望外，GDP跌幅料將收窄至僅0.2%，同時不致刺激通脹加劇。  不過，該行指出，這一招或只可用一次，不會萬試萬靈，原因是此舉對公眾造成的出其不意效果將會減退。
20050827-229,20050827,229,紐約油價高企67元,紐約油價高企67元 國際原油價格昨天在電子交易時段回軟，因為颶風「卡特里娜」料不會正面吹襲墨西哥灣的產油設施。但市場依然關注未來的風暴會肆虐該區，令油價在紐約開市後再升近歷史高位。  紐約原油10月期貨昨天一度跌47美仙（0.70%），低見每桶67.02美元；倫敦布蘭特10月期油曾跌62美仙（0.94%），至每桶65.65美元。在紐約早市，紐約期油一度回升至67.78美元，倒升29美仙（0.43%）；布蘭特期油高見66.55美元，升28美仙（0.42%）。  荷蘭皇家蜆殼（RoyalDutchShell）和英國石油（BP）為防範颶風吹襲，已在墨西哥灣疏散部份非重要員工，但表示產油運作未受影響。不過，市場仍擔心「卡特里娜」的路線會轉為較接近墨西哥灣的鑽油台，並關注颶風季節尚未完結。
20050827-230,20050827,230,美消費情緒遜預期,美消費情緒遜預期 美國股市昨天早段向下，主因是該國消費者情緒在3個月來首見轉弱，及油價反覆上升。  杜瓊斯工業平均指數早段一度跌58.27（0.56%），見10392.36。納斯達克綜合指數最多跌14.97（0.70%），至2119.40。  開市後個半小時（本港時間昨晚11時），杜指跌45.69，報10404.94；納指跌13.28，報2121.09。  在周四，杜指升15.76，收報10450.63；納指升5.46，收報2134.37。  密歇根大學公布，受汽油創新高影響，美國消費者情緒指數由7月份的96.5，降到8月份終值的89.1（初值為92.7），為5月至今首次報跌，且低過市場估計的92.7，跌幅是去年2月以來最大。  展望指數從7月份的85.5跌至76.9；現況指數由113.5降到108.2。
20050827-231,20050827,231,日核心消費物價連降兩月,日核心消費物價連降兩月 【本報綜合報道】日本消費物價一如預期連跌兩個月，反映這個全球第2大經濟體系尚未擺脫持續了7年的通縮，而日本央行短期內料不會改變推行了4年的「零息」政策。  由於白米、電訊及公共用事業收費下降，日本全國7月份核心消費物價指數（不計較波動的新鮮食品項目）較去年同期跌0.2%，跌幅與6月份和市場估計相同；與前月相比，7月份核心消費物價無變動。整體消費物價指數（CPI）在6月按年跌0.5%後，7月份降幅收窄至0.3%。  日本財務大臣谷垣禎一說，該國仍受溫和通縮困擾，故日本央行應繼續推行極寬鬆的貨幣政策。經濟財政大臣竹中平藏表示，儘管通縮持續，當地經濟正邁向復甦。 央行暫難收緊銀根 日本消費物價跌勢近期有放緩迹象，核心CPI跌幅接近零。經濟研究員認為，今年稍後CPI按年計會止跌回升，預料日本央行可能最快在明年結束「零息」政策。  巴克萊資本首席經濟師TakujiAida說，日本通脹壓力在今年10月至明年3月會加劇。  首都東京方面，8月份核心CPI按年跌0.3%，較7月份的0.4%降幅溫和；但整體CPI在7月份跌0.3%後，本月跌幅擴大至0.6%。
20050827-232,20050827,232,日銀行職員侵吞900萬美元,日銀行職員侵吞900萬美元 【東京路透社電】日本第2大銀行東京三菱銀行（BTM）一名合約女僱員，12年來盜取客戶共900萬美元（約7020萬港元），其後有客戶投訴，她的罪行才被揭發。日本警方正進行調查，但尚未正式檢控該女子。  東京三菱表示，該名54歲的員工曾向10至20名客戶推銷虛假的投資產品，並定期向客戶支付「利息」，以掩飾其罪行；後來一名客戶要求銀行調查上述欺詐事件，該名職員在事件曝光後於今年6月被解僱。  金融廳下令該銀行加強監管合約員工，並每季滙報改善保安的進展。  諷刺的是，《日本經濟新聞》一項客戶調查發現，採用先進的生物識別保安技術的東京三菱，在客戶保安方面是業內之冠，得分遠勝對手。為了減省成本，日本企業近年傾向把後勤職位外判，並愈益依賴合約員工。
20050827-233,20050827,233,星工業生產跌2.3%,星工業生產跌2.3% ▲新加坡受電子及藥物生產商減產拖累，7月份工業生產較6月少2.3%，與6月份銳升9.5%的情況大相逕庭；工業生產按年升5.9%，增幅較6月的9.4%溫和。但分析員認為，尚無明確訊號顯示當地經濟正走下坡。
20050827-234,20050827,234,歐元區M3急升7.9%,歐元區M3急升7.9% ▲歐元區7月份M3貨幣供應出乎意料地加快增長，較去年同期升7.9%，是2003年10月以來升得最急，升幅高於市場預期的7.3%，以及6月經向上修訂的7.6%。數據反映歐洲央行下一步加息的機會高於減息，但因歐元區經濟持續疲軟，該央行難以在短期內收緊銀根。
20050827-235,20050827,235,英再減息機會轉淡,英再減息機會轉淡 ▲英國次季經濟增長由原先統計的0.4%，向上修訂為0.5%，原因是上季製造業生產跌幅細過初步評估；與去年同期相比，上季經濟增長亦由1.7%調高為1.8%，但仍是2002年首季以來最慢。這意味英倫銀行應毋須急於在今年內再減息。
20050827-236,20050827,236,中行主包銷商　高盛擔任,中行主包銷商　高盛擔任 【本報訊】彭博資訊引述消息稱，計劃明年首季在港上市的中國銀行，將委任高盛集團為主包銷商，由高盛亞洲董事總經理馬勤率領的代表團，已於本周與中行董事長肖鋼會面，商討上市安排。中行計劃集資最少50億美元，高盛將與中行核數師羅兵咸永道緊密合作，籌備中行上市大計。 瑞銀也派高層晤中行 雖然市場傳聞高盛正洽商入股另一國有四大商銀──中國工商銀行，但報道指出，高盛在協助中資海外上市方面具有優秀戰績，是其最大優勢，中行股改上市標誌着國有銀行的改革里程碑，不容有失，故該行必須確保由最具經驗的投資銀行掌舵。  報道又稱，瑞士銀行（UBS）也派出代表團與中行管理層會晤，瑞銀於02年夥拍高盛及中銀國際，任中銀香港（2388）的上市包銷商。市場估計，中行是次上市的包銷費，涉資1.5億美元。
20050827-237,20050827,237,柯達廈門廠房減產,柯達廈門廠房減產 ▲全球最大攝影器材生產商伊士曼柯達（EastmanKodak）表示，將關閉紐約羅徹斯特一間相紙廠和一間化工設施廠房，並會縮減其在中國廈門的菲林廠產量，原因是菲林銷路加速下滑。柯達將在上述兩地合共裁減約900個職位，並透露正着手關閉西維珍尼亞的一間廠房，重整業務將帶來1.81億美元的額外成本。
20050827-238,20050827,238,國際視野：借風吹風　風雨欲來？,國際視野：借風吹風　風雨欲來？ 不知是否一眾基金經理或大戶仍未度完假，國際金融市場表現淡靜。美歐股市近日玩「單跳」（日升日跌），然僅局限於窄幅波動。美債孳息自月初高位急速回落後，似乎在4.15厘水平有點阻力，滙市牛皮，金價則如老僧入定，只有油價雖然單日上落在1%左右，但因其屢創高位並正朝70美元（1桶．下同）逼近，故廣受關注。  紐約原油10月期貨前日一度創下68美元的歷史新高，主要是市場借風暴消息──盛傳墨西哥灣油田或遭狂風正面吹襲影響生產甚至要關閉云云。既然沒有甚麼新意可刺激個市，借個風來吹吹風，誰曰不宜，油價便在鬥「吹風」的情況下再創高位。 炒期油慎防成大鱷點心 可是風勢不強兼短暫，經氣象報告糾正後，油價當日即回落至66美元，「擒擒青」以為鴻鵠將至之「即日鮮」，不幸成為吹風大鱷的點心，這個悲情森林之弱肉強食，可見一斑。  然而在不少分析員或經濟師高唱油價將突破70美元甚至80、100美元之際，人們可別忽略了一些看似小事的基本因素。全球最大零售連鎖店沃爾瑪（Wal-Mart）日前已提出油價（上升）影響其業績之警告，航空公司喊苦連天之餘，部份還透露有申請破產保護之虞；各大車廠亦以大折讓促銷、不少企業（美國）也開始感到壓力而怨聲載道，難道決策者真會袖手旁觀，讓其（油價）繼續升空乎？  令人詫異的是，全球經濟包括美國可以在油價已達68美元水平之時還屹立不倒。油價何去何從，筆者沒有水晶球，故無法告之。  不過可不要忘了8月23日欄內所說，若按華爾街大行及法國總理之預測，配合布殊總統的能源稅務優惠方案來衡量，就算油價不是離頂不遠，也恐防來個大跌十元八塊，到時更別忘了向冠一臉上貼金！  王冠一
20050827-239,20050827,239,3大型新盤下月開賣都會駅先行　碧堤、翔龍灣緊接,3大型新盤下月開賣 都會駅先行　碧堤、翔龍灣緊接 【本報訊】發展商藉一周內兩度勾出共3幅地皮的利好消息推盤，3個大型新盤下月爭相開賣，由剛取得售樓紙的將軍澳都會駅打頭陣，周一率先接受相連戶洽購；深井碧堤半島三期亦緊接周五舉辦名人之夜，或同時接受預留；土瓜灣翔龍灣也展開軟銷，準備加入開盤行動。 都會駅售樓紙批出 由長江實業（001）等發展的都會駅，部署推售已有一段時間，長實高級營業經理郭子威說，項目剛獲批售樓紙，短期內開賣。  市場消息指出，都會駅將於下周一，率先接受買家出價，洽購第3座50樓以上，1900方呎的相連單位，參考價1200萬至1300萬元，意向呎價近7000元。至於分層單位，市傳周四將內購。  郭子威說，都會駅兩個連空中花園單位，命名為「MetroSky都會天際」，分布於第2及3座，面積1329方呎，將於下月27日賣地後才推出，意向呎價1.2萬元，每名買家可獲贈價值30萬元旅遊優惠。 碧堤樓價九成入伙付 同樣蓄勢下月開賣的碧堤半島三期，九龍倉（004）昨先公布建築期付款方法。  九龍倉置業發展董事黃光耀表示，該項名為「一成置輕鬆」計劃，買家付樓價10%後，樓價90%餘款可於批出滿意紙後清付，物業最快今年底至明年初落成。另外租客入市，提供相關證明，可額外獲60天成交期；深井同區業主換樓，額外享120天成交期。  配合推售，碧堤三期將於下周五舉行名人之夜晚會，消息透露，現時市場預先收取逾200票，當晚或可預留單位，示範單位下周開放。  同系的尖沙嘴擎天半島，1座尚餘5伙1167至2715方呎單位。受惠於西九龍兩地皮勾出，即時封盤，下月賣地日後加價5至8%。  另外，恒基地產（012）土瓜灣翔龍灣，也計劃下月推出。 翔龍灣設行政級樓層 恒基營業部總經理謝偉銓表示，物業將提供行政級樓層單位，用料較標準單位佳，面積以1500方呎為主，售價參考西灣河嘉亨灣，意向呎價1.5萬元，擬9月開賣。
20050827-240,20050827,240,會展擴建獲批明年動工,會展擴建獲批明年動工 【本報訊】貿易發展局提議擴建灣仔會議展覽中心的計劃，昨日獲城市規劃委員會通過，明年1月可動工，投資額約13億元。 投資額約13億元 是次乃將會展一期及二期之間的中庭通道擴建，總樓面約53萬方呎，增加的3個展覽廳，約20.9萬方呎樓面，可容納1000個展位，工程預計09年初完成，費用由貿發局融資，會展管理公司也會參與投資。  貿發局主席吳光正表示，擴建計劃只能短期紓緩目前展覽面積不敷應用的問題，長遠而言，仍會爭取興建會展第三期。  貿發局過去1年廣詢各界意見，並修改內容，故昨日順利獲批，但城規會附有條件，該局須向有關部門，提出解決因擴建加重的交通負荷，及疏導行人計劃，並要求改善中庭覆蓋會展道及水道的通風及照明設施。
20050827-241,20050827,241,名門見首宗二手成交,名門見首宗二手成交 【本報訊】大坑名門封盤1個半月，首度錄得二手成交，買方以收購公司形式購入，原業主持貨不足兩個月，獲利93.4萬元。代理估計，上述造價將成為二手價指標，有助帶動該盤二手買賣。 單位升值6.3% 名門二手放盤累積約30個，叫價每呎1.1萬至1.9萬元，較買入價高10至30%，不過，大部份放盤業主不急於求售，以致有價無市。首宗二手成交為5座高層B室，1168方呎，連車位以1576.8萬元易手，呎價1.35萬元，升值6.3%。  名門今年6月底時開售，兩周後封盤，其間售出255個單位，佔總數68%，套現約58億元。名人買家包括歌星容祖兒，斥4620萬元，購入1座中層相連戶，呎價近1.5萬元。餘貨將於下月解封，不過，最貴重的相連及複式大宅，保留至明年初才推出。
20050827-242,20050827,242,澳門樓市料末季反彈,澳門樓市料末季反彈 【本報訊】澳門經濟持續向好，吸引外資進駐。美聯物業引用澳門統計暨普查局數據指出，今年上半年，澳門新增公司錄得1551間，較去年同期1034間上升50%。雖然澳門住宅樓市在第三季出現放緩，但商舖買賣仍然活躍。隨着東亞運動會及多項娛樂設施陸續落成，預料澳門樓市第四季會回升，交投較第三季增加32%。 交投量看升32% 美聯物業澳門行政總裁張一輝表示，澳門樓市第三季受加息及多項降溫政策影響，交投轉淡，樓價出現下調。數據顯示，澳門第三季平均住宅呎價901元，較第二季的936元跌3.7%。交投量亦由第二季6838宗，萎縮至5470宗，跌幅達20%。  不過，張一輝預期，隨着下半年澳門漁人碼頭落成、東亞運動會開幕等利好消息推動，第四季將掃除負面消息，樓市再度轉熱。受前景看好刺激，澳門統計局數據指出，今年第二季錄得838家新增公司進駐，較第一季的713家升18%，反映外資對澳門經濟前景信心。他預期，澳門全年樓價升值30%，迄今已上升17%。住宅成交全年料2.4萬宗，首3季料有1.7萬宗。
20050827-243,20050827,243,荃灣兩工廈地廠擬改商業用,荃灣兩工廈地廠擬改商業用 【本報訊】多項物業昨日截標，其中荃灣灰窰角街8至10號，及12至16號兩幢工業大廈，獲多名買家以私人協議方式洽購。  負責招標的萊斯物業表示，由於灰窰角街附近未來相繼有新住宅物業落成，料人流會增加，市場對商舖需求趨增，有見及此，兩業主計劃將上述地廠改作商業用途。據悉，兩物業分別佔地約5000及6000多呎，現為1幢2層及10層高廠廈。 康宏3單位收3標書 另外，美聯九龍商業部助理區域經理黃璜表示，昨日截標的尖東康宏廣場27樓3單位，面積約11270呎，共接獲3份標書，出價均貼近業主意向價，但業主仍在考慮中。
20050827-244,20050827,244,中環舖50萬租出,中環舖50萬租出 【本報訊】中環蘭桂坊德己立街58至62號地下A、B舖，剛獲一間西餐廳承租，月租逾50萬元，為中區近期較矚目的大手舖租個案。  地產界消息指出，上述地舖約3500方呎，為陳姓投資者於去年7月以約7100多萬元購入。舖位半年前在市場放租，月租叫價約55萬元，至近日以約50萬元租出，平均呎租約143元，回報高達8.5厘。 許留山租旺角舖 除上述租賃個案外，涼茶糖水連鎖店許留山，據悉剛以月租約21萬元，承租旺角豉油街60至64號前金聲戲院地下約800方呎舖位。  業內人士預期，在迪士尼以及第四季傳統零售旺季效應帶動下，未來一、兩個月商舖租務更暢旺，租金保持高企。
