key,date,article_daily_id,title,text
20050127-214,20050127,214,南亞經濟料擴張6.25%,南亞經濟料擴張6.25% 【本報綜合報道】聯合國表示，去年底的世紀海嘯對南亞經濟影響不大，該區今年全年經濟料擴張6.25%，較去年僅低0.05個百分點。聯合國亦估計，今年全球經濟會溫和放緩。  聯合國在厚達121頁的報告指出，由於這次災難對工業和港口設施的衝擊有限，加上離岸油田和天然氣田未受影響，故南亞經濟增長應不會嚴重受損；預料只有旅遊業會遭受廣泛影響，而斯里蘭卡和泰國承受的打擊會較大。     海嘯影響有限   報告預測，今次海嘯會令斯里蘭卡和泰國經濟增長減慢0.25個百分點。另邊廂，印尼和印度經濟由於規模較大，應足以承受海嘯帶來的衝擊。 至於全球經濟，聯合國估計今年會增長3.25%，較去年的4%增幅溫和（見表）。聯合國表示，許多國家的財政赤字過高，而滅赤是會拖慢經濟增長，但全球經濟基調仍穩健。
20050127-215,20050127,215,油價反覆杜指回升,油價反覆杜指回升 【本報綜合報道】美國股市昨天早段上升，受惠於德州儀器（TexasInstruments）及柯達（Kodak）等公司上季盈利勝預期。另外，紐約證券交易所（NYSE）擬提早兩小時開市吸引投資者。  杜瓊斯工業平均指數早段一度升65.03（0.62%），見10526.59。納斯達克綜合指數最多升19.63（0.97%），至2039.58。開市後1小時（本港時間昨晚11時半），杜指升57.72，報10519.28；納指升12.67，報2032.62。     紐交所擬提前2小時開市   在周二，杜指升92.95，收報10461.56，是去年12月21日以來最大單日升幅；納指升11.25，收報2019.95。  紐交所行政總裁塞恩表示，紐交所正考慮延長交易時間，以吸引更多國際投資者。他說，該所可能會提早開市或延遲收市1至2小時，以提早開市機會較大，最後決定會在今年內作出。  另外，美國能源部公布，該國上周（截至本月21日）餾分油（包括取暖用燃油）庫存減少230萬桶，而市場預期降200萬桶。原油存量增加340萬桶，多過預期的增加100萬桶。  庫存公布後，油價反覆偏軟。紐約3月份原油期貨接近中段曾見每桶49.07美元，跌57美仙（1.15%）。倫敦3月份布蘭特期油最多曾跌61美仙（1.30%），至每桶46.35美元。
20050127-216,20050127,216,美05年財赤將逾4000億,美05年財赤將逾4000億 【本報綜合報道】美國白宮估計，該國本財政年度財政赤字會創新高。國會預算辦公室（CBO）則認為，美國本年度財赤會貼近去年的紀錄。這意味美國總統喬治布殊將難以實現其滅赤承諾。  白宮一名高層官員說，美國本年度（去年10月開始）財赤會增至4270億美元（約3.3萬億港元），打破去年的4120億美元紀錄。  CBO預測，美國現年度財赤會達3680億美元；倘國會通過增加對伊拉克和阿富汗的軍費，財赤可能升至約4000億美元（約3.1萬億港元），接近去年的紀錄，且大過去年9月估計的3480億美元。雷曼兄弟經濟師馬圖斯認為，CBO的預測顯示布殊不易在5年內實現將財赤減半的承諾。     羅奇：美難施零息政策   另外，美國摩根士丹利首席經濟師羅奇（StephenRoach）說，美國不能不顧後果地推行實質的零息政策；美元下跌尚不足以解決全球經濟失衡問題，故聯儲局今年需要將實質利率由目前的零厘（中性水平）調升到「限制性」水平。  不過，美國大型債券基金PIMCO董事總經理麥卡利（PaulMcCulley）認為，現處2.25厘的聯邦基金目標利率，可能在升至2.5至3厘便見頂。
20050127-217,20050127,217,柯達盈轉虧蝕1200萬,柯達盈轉虧蝕1200萬 【本報綜合報道】全球照相業「一哥」美國柯達（EastmanKodak）上季出乎意料地轉盈為虧，主要受重組開支影響。  不過，上季數碼攝影產品銷售激增40%，該公司並預測今年盈利會優於市場預期。  柯達第4季淨虧損1200萬美元（約9360萬港元，或每股蝕4美仙），前年同季有純利1900萬美元（每股7美仙）。但上季營業額升3%，達37.7億美元（約294.1億港元）。不計特殊項目，上季每股賺78美仙，好過ThomsonFirstCall綜合分析員估計的65美仙。  柯達說，由於稅務會計出現錯誤，該公司上季除稅後收入或要修訂，但上述錯誤沒有「違規」迹象。柯達估計今年每股賺2.60至2.90美元，勝過分析員預測的2.52美元。
20050127-218,20050127,218,任天堂純利倒退43%,任天堂純利倒退43% 【本報綜合報道】全球最大手提遊戲機生產商日本任天堂（Nintendo）受日圓升值影響，加上遊戲銷售未如理想，上季純利大跌43%。該公司並調低全年業績預測。  任天堂第3財政季度（截至上月底）純利213億日圓（約16.1億港元），少過前年同季的374億日圓；營業額則微升1.4%，至2314億日圓（約174.4億港元）。  由於圓滙上升和GameCube遊戲機需求放緩，任天堂估計本年度經營溢利有1100億日圓，差過原先預期的1200億日圓；純利預測由900億日圓，下調到700億日圓；銷售額預測則由5400億日圓，調低為5200億日圓。  路透社綜合分析員估計，任天堂全年度經營溢利為1200億日圓，純利則有742億日圓。
20050127-219,20050127,219,國際視野：企業盈利見頂回落,國際視野：企業盈利見頂回落 企業陸續公布上季盈利，從已派發成績表的表現來衡量，到目前為止的結論是差強人意，部份分析員更認為走勢應屬「負面」。  這也難怪，根據花旗集團研究部透露，分析員大多不看好全球企業去年第4季之業績，調低盈利預測的比調高的多，這是2003年7月以來首次，不被看好的地區包括日本、英國和歐元區，至於美國和亞洲（日本除外）則升降比例極接近，足見已開始𣲷油。  花旗指出，歷史告訴我們，過去若有這種情況出現，即顯示增長期已見頂並開始滑落。換言之，全球企業盈利已在去年第3季見頂，縱使動力依然存在，但步伐卻已慢了下來，而當中滑落最速的地區要算日本，不無給人有另一次「假黎明」的感覺。     美歐日五十步笑百步   筆者認為，是不是假黎明尚言之過早，不過正如本欄早前所指，銀行盤數雖然已靚了許多，呆壞帳亦大幅減少，可是最重要的問題──通縮始終揮之不去。此外失業率仍高企，工資增長呆滯，政府對振興經濟已顯得黔驢技窮，認真「濕滯」。  歐洲方面稍為好點，但亦是五十步笑百步而已，企業從年前平均錄得雙位數字盈利增長，到最近退縮至僅有單位數字增長，足以反映經濟不濟遂導致生意難做。這亦難怪，歐元持續攀升、油價居高不下、成本增加、出口萎縮，及經濟活動減弱，又怎期望盈利會有驚喜？其實美國亦未見佳處，除以本傷人的金融業有較好表現外，其餘乏善足陳，科技環節更慘不忍睹。照攤路估計，今年全球經濟將不復往年勇矣！  王冠一
20050127-220,20050127,220,太航配舊股抽水十億,太航配舊股抽水十億 大市好轉即吸引上市公司「抽水」。去年7月中上市的乾散貨船公司太平洋航運（2343），兩主要股東昨日收市後透過高盛亞洲，共配售3.2億舊股，作價3.215元，較收市價3.35元，折讓4%，套現10.3億元。兩股東持股量將由合共41.9%，降至16.6%。  該兩名股東為DryBulkShipping及IDBCarriers。根據太航招股書，他們是創始股東，本身屬於私人投資公司，於99年同意投資太航，並提供巨額資本，他們的股份禁售期為180天。另一名持股14.2%的主要股東Pembroke則有1年禁售期。  值得留意的是，配售代理高盛，剛於上周舉行一個關於乾散貨航運市場的電話會議，演講者包括太平洋航運行政總裁夏文傑，高盛前日發表相關研究報告，給予太航「跑贏大市」投資評級，目標價4.5元。太航本月6日派發了去年度中期股息，每股8仙，兩名售股股東已收取合共4245萬元的股息。
20050127-221,20050127,221,經絡夥美聯提供二手借95%三年只供息,經絡夥美聯提供 二手借95%三年只供息 【本報訊】樓按市場競爭激烈，銀行積極推出各種按揭計劃爭生意。繼渣打銀行日前推出不設貸款額上限的九成半按揭計劃後，經絡集團夥美聯物業，向二手樓買家提供95%按揭首3年供息不供本計劃，貸款額高至1200萬元。 供款計劃直接與一手市場「拗手瓜」，有助增加二手市場競爭力，美聯預期今年二手成交較去年增12%，選用九成半樓按比率可望增到15至20%。  對於二手樓提供具競爭力的付款優惠，威脅一手市場，嘉華地產董事總經理呂耀華認為，兩者質素有別，對一手市場不會有太大影響。華懋集團售樓部經理吳崇武則認為，二手暢銷，對一手樓更有利，樓按優惠對一手市場不構成影響。  經絡集團副行政總裁盧子勇表示，今年二手樓將主導市場，集團夥拍3至4間銀行，向二手樓買家提供兩項95%按揭計劃。透過美聯入市、經絡集團作按揭轉介，買家首3年只需供息，可延期還本3年。全期息率P減2.8厘，貼近現時一般發展商一手樓的供款優惠；並可獲貸款額1.5%現金回贈，貸款上限為1200萬元，自僱人士及空殼公司均可選用。市場認為，在一手樓貴過二手樓情況下，該計劃無疑令一手樓受威脅。  此外，買家亦可選擇全期P減2.875厘低息計劃，貸款額由最低500萬至最高800萬元，回贈1.65%。 供款可逾入息一半   供款比率更放寬至可高於入息逾五成。盧子勇指出，過往貸款人供款比率普遍佔入息28%，雖經放寬，但銀行本身有嚴格審批標準，會因應供款人財務狀況及入息作審批，料風險不大。上述兩計劃按揭年期加樓齡，最高為60年。  過往選用九成半樓按計劃的二手樓，普遍樓價低於200萬元，他預期計劃可刺激中高價二手樓成交。美聯物業資料顯示，去年842萬至1263萬元中高價樓成交1411宗，較03年的389宗大增2.6倍。
20050127-222,20050127,222,建築期付款新盤獨有,建築期付款新盤獨有 新盤為求吸引買家，付款安排法寶盡出，即使價錢較二手樓高，優惠的付款方法亦足以令買家轉投一手市場。  剛推出的二手樓九成半按揭延期供本計劃，雖然為新盤多添競爭對手，但同類的按揭產品，其實在新盤市場早已推出，而且條款更加優惠；此外，最受投資者歡迎的建築期付款安排，二手樓至今仍然有所不及。     受投資者歡迎   新盤的售價一般較二手樓高，主要以付款方法吸引買家入市，如近期推售的東涌映灣園悅濤軒，便曾推出一、二按合共九成半按揭首32個月免息供（現已縮短至28個月）計劃，並由發展商及銀行補貼利息支出。  另外，馬灣珀麗灣3期亦有首兩年一、二按免息供付款安排，但二按利率較高。  利嘉閣地產執行董事廖偉強認為，新盤以樓齡、用料及配套設施等取勝，與二手市場屬兩類客源，料優惠付款方法對新盤影響不大。  另外，近年新盤大部份投資者均喜選用建築期付款，如去年開售，以投資者佔多的荃灣爵悅庭，佔四成買家選用建築期付款安排；其他如西灣河嘉亨灣，建築期付款比例亦高，此類付款安排是二手樓無法提供的。
20050127-223,20050127,223,皇府山首批呎價4476,皇府山首批呎價4476 【本報訊】新鴻基地產（016）上水皇府山，以平均呎價4476元推出首批14個中低層單位，下周三以先到先得形式公開發售；市場人士認為價錢較市價高出逾10%。發展商表示，公開發售前，計劃本周六率先內購，代理指目前市場已累收1300張入票登記。     周六內購收票1300   新地代理總經理周國賢表示，皇府山擬周六進行首輪內購，推出單位視乎市場反應而定，價錢與首批相若，整批單位平均呎價4400元。他指出同區已多年沒有新盤推出，難以比較，強調首批12伙屬「吸引價」。  首批單位分別位於第1座3樓及第7座7樓，面積573至926方呎，售價221.75萬至467.63萬元，呎價最平3870至5050元。發展商設3項付款安排，即供付款可獲樓價3%折扣；亦提供建築期及首18個月一、二按免息供付款安排，選用的買家需按照定價付款。  地產代理指出，皇府山的首批單位，較毗鄰10年樓齡的奕翠園（呎價3800至3900元），已高出15至18%。美聯物業董事布少明指出，集團已收600張入票登記，估計市場累收1300至1400票。  另外，周國賢說皇府山的32個特色單位，繼續以議價形式接受洽購，意向呎價6000至逾1萬元。對於近期有新盤開售出現混亂，他表示會特別留意現場情況，包括人流控制、貨源分配等。
20050127-224,20050127,224,泓都放籌叫價10萬,泓都放籌叫價10萬 【本報訊】由新世界（017）及市建局合作發展的堅尼地城泓都，首批12個單位將於今天以抽籤形式發售。代理指市場上昨有約50個籌號放售，叫價最高達10萬元。     近二手價難炒起   投資氣氛濃厚的泓都，昨日公布抽籤結果後，已陸續有籌號放售，頭20個以內叫價由1萬至10萬元（見表）。 發展商昨宣布加推193伙，平均呎價6744元。  市場指是次公開發售，只有小部份單位定價低於二手樓花造價，其他單位與二手樓花放盤相若，準買家根本毋須買籌入市，預料炒籌情況不會熱烈。
20050127-225,20050127,225,何文田屋地標價2億,何文田屋地標價2億 【本報訊】市區豪宅地渴市，李氏家族標售的何文田亞皆老街157號地皮昨日截標，據悉獲7、8個發展商入標，包括信和置業（083）及莊士機構（367），個別標價接近2億元。  亞皆老街157號屋地為市區罕有優質地皮，面積約1.8萬方呎，最高可以5倍地積比率重建，但地契限制發展高度35呎，重建需申請改契及補地價，發展有難度。  另外，東亞銀行（023）標售的旺角東亞銀行大廈，亦於昨日截標，仲量聯行僅表示反應熱烈。市場人士透露，業主意向價2.5億元，以總實用樓面17844方呎計，平均呎價約1.4萬元。業主亦考慮售後租回地庫至2樓舖位，月租68萬元。  日前截標的尖沙嘴漢口中心地下加州健身中心舖位，以1.45億元售出，呎價約5.3萬元。     壽臣山洋房呎價1.4萬   此外，利嘉閣執行董事廖偉強說，外資基金GRA拆售的壽臣山道東1至9號20間洋房，已售出連租約單號屋，6063.4萬元，每呎約1.4萬元。
20050127-226,20050127,226,蘭西情報課：朗豪坊開幕場面火爆,蘭西情報課：朗豪坊開幕場面火爆 旺角新地標朗豪坊經已正式開幕，商場幾乎租晒，前晚開幕禮煙火夜，請嚟董特首撐場，非常熱鬧，一手一腳將朗豪坊由冇變有嘅鷹君副主席羅嘉瑞，更加全家總動員，重睇晒全場表演，包括英國雜技團特技、數碼天幕首映同埋放室內煙花，親兄弟羅旭瑞同姪女羅寶文都有捧場。  鷹君方面話，希望以後每日都能安排一段數碼天幕放映時間，未來重可能再有幾次特技表演。不過，煙花表演就未必再有機會，因為喺室內放煙花有一定難度，需要向政府證明有足夠安全措施，先會獲准舉辦。  據講，呢啲煙花，不同於一般新年維港放嗰啲，係特製嘅，爆炸後即刻冷卻，絕不會燃燒任何物件，所以唔怕有火舌，辣親任何觀眾，大可睇得放心。  不過，成日都好似好忙嘅董特首，就無暇等埋煙花騷，已抽身離去。     商廈愈嚟愈貴   高緯物業一份報告話，全球主要商業城市寫字樓租金，香港去年排名第五，比○三年十名不入，明顯超前，頭四位排名則不變。  報告話，香港寫字樓租金去年飆升逾倍，幅度勁過排頭位、只有兩成三嘅倫敦西部。  早排戴德梁行都有個類似調查，香港全球排名第九，兩個調查結果唔一樣，大概係因為戴德梁行所計算嘅，係租務開支水平，即係連管理費、差餉等都計埋。  高緯錄得嘅香港寫字樓租金升幅，高於其他代理行，可能由於佢只計最優質嗰啲商廈（見表）。 華置到皇府山偷師   新地上水皇府山噚日開記者會，圓滿結束之後，蘭西突然見到華置高級銷售及租務經理柯靄邦，喺售樓處現場觀摩。相信佢事先冇諗過，會失驚無神開記者會，搞到同一眾記者撞到正，但佢冇準備咩新料透露。  不過，到夜晚，柯靄邦出席中記周年晚會，就補番飛，佢話，上水粉錦路洋房，計劃三四月推出。雖然以前講過，都好過乜都冇講。     美記派發賞金花紅   呢年幾樓市發癲咁好番，捱咗幾年跌市嘅地產代理，終於捱出頭嚟。各大代理𠵱家除咗要鬥跑數之外，年頭年尾，重興埋鬥向員工派錢多。  好似美記咁，冇耐前先話發放雙糧兼花紅，個別員工最多可以攞到相等於全年十八個月糧，啱啱又好闊佬咁講，今個月底，會再向後勤員工，派發年終賞金及特別花紅，最多可以攞到相等於兩個半月嘅糧。但究竟有幾多人攞到呢個數，可能就只有黃主席至知。  黃主席重話，攞完錢，大家就要提高士氣同埋工作效率嘞。     愉景周末度假行善   南亞海嘯，各地賑災超過一個月仍然未完，大嶼山愉景灣業主委員會與香港興業，周日舉辦「善心送南亞」籌款，善款捐紅十字會。  當日由中環至愉景灣渡輪及愉景灣巴士收費，一律作捐款用途。此外，喺愉景廣場，舉行愛心步行與高爾夫球車扮靚比賽，每位參加者至少須付一百蚊作登記費，愈多人參加，籌得款項愈多。  大會準備咗多項精采歌舞節目，務求吸引更多市民，一家大細來到愉景灣，做善事之餘，又可以歡度假日。  電郵地址： nancy@appledaily.com 
20050127-227,20050127,227,樓市動向,樓市動向 香港　廠家海怡購12伙   ▲美聯梁文輝說，中資廠家以3200萬元，購入鴨脷洲海怡半島12個單位，呎價3600元。例如18座高層A，728方呎，成交價270萬元，每呎3709元。  ▲中原趙蓮香說，北角栢景臺2座高層D銀主盤，1112方呎，以708萬元成交，每呎6367元。物業有60個放盤，每呎叫價8000元。     九龍　炒家掃半島豪庭   ▲利嘉閣馮樹勳說，大角嘴維港灣9座低層A，928方呎，成交價490萬元，每呎5280元。同座高層E，641方呎，成交價292萬元，每呎4555元。屋苑本月有14宗成交。  ▲中原陳耀明說，投資者以1548萬元，購入紅磡半島豪庭4個單位，3個連租約，2座低層C則是交吉成交，1043方呎，成交價438萬元，每呎4199元。     新界　兆安苑銀主脫手   ▲祥益地產張才權說，屯門兆安苑E座低層6室銀主盤，591方呎，成交價61.6萬元，每呎1042元。P座低層4室，672方呎，成交價65.8萬元，每呎979元。  ▲世紀21奇豐鄭達昌說，馬鞍山中心2座低層B，491方呎，以122萬元易手，每呎2485元。屋苑本月有12宗成交。     荃灣中心賣87萬   ▲美聯梁仲維說，荃灣中心11座低層G，492方呎，成交價87萬元，每呎1768元。19座高層A，490方呎，成交價120萬元，每呎2449元。屋苑本月有30宗成交。
20050127-228,20050127,228,美湖居　用料間隔冠嘉湖,美湖居　用料間隔冠嘉湖 天水圍嘉湖山莊美湖居，屬於整個屋苑最後一期，興建時正值樓市興旺期，由大堂至單位內的用料質素，都較其他期數好，內櫳實用度也高於現下一般新盤。只是客廳為當年流行的鑽石形，雖可避免與毗鄰單位對望，家具擺設卻較為麻煩。  單位入口以玻璃飾櫃作屏風，免卻視線由大門直望客廳，而睡房則加添入牆衣櫃。  坐向東南，外望公園及會所景，以及其他期數的樓宇，不過有一定距離，對單位景觀影響輕微。	 樓齡較新   中原郭佩玲說，美湖居因為樓齡新，較受歡迎，造價一般較其他期數高約一成，每呎1900元。本月成交的6座高層H，714方呎，作價130萬元，每呎1821元。另外1座高層H，714方呎，有靚裝修，成交價137.8萬元，每呎1930元。  記者?攝影：林志光
20050127-229,20050127,229,宜基保險疑倒閉　執業資格暫停,宜基保險疑倒閉　執業資格暫停 【本報訊】宜基保險顧問有限公司懷疑倒閉事件，香港專業保險經紀協會昨日發表新聞稿稱，直至目前為止，該會尚未能與宜基保險顧問的負責人聯絡，故根據香港專業保險經紀協會章程及會員規章宣布，由周一（24日）起，暫停宜基的執業登記直至另行通告為止。  該協會又表示，任何受影響客戶請盡快與相關保險公司聯絡，或致電28698515與香港專業保險經紀協會秘書處查詢。  保監專員袁銘輝接受查詢時表示，已收到協會有關通知，據悉是有客戶繳交保費後未能與公司聯絡，再親身到公司嘗試了解事件，見人去樓空，才發現事件。到目前為止，協會方面僅收到一兩名市民報告受影響。
20050127-230,20050127,230,中化香港獲注資產涉50億,中化香港獲注資產涉50億 【本報訊】中化香港（297）昨日突然於中午12時零1分申請停牌表示，將發出有關於一項構成十分重大的收購事項，關連交易及反收購交易通告。路透社引述接近交易消息人士透露，中國最大化肥進口及供應商中化集團，計劃以總代價50億元，向旗下中化香港注入化肥資產，包括其全資子公司中化化肥公司，中化香港將以新股支付代價。交易後，中化集團持有中化香港擴大已發行股本95%，為維持25%公眾持股量，中化香港會在市場配股。 中化香港停牌前曾升上0.485元，升8.99%，收0.475元，升6.74%，成交1.059億股，成交額5008.7萬元。     購母公司化肥業務   其實中化集團早已希望在港或新加坡上市，只是市場過去數年對化肥公司興趣不大，中化集團2000年3月將非化肥業務分拆，成立中化國際並於上海上市，但仍未完全放棄海外上市計劃，去年2月購入前稱華德豐的中化香港21.17%股權，並於去年6月易名，市場早憧憬該集團終會將資產注入。  由於是次收購屬於反收購交易，港交所將視其為新上市申請處理，包括須提交3年經審核帳目，交易要獲得股東大會批准方可進行，中化集團須放棄投票，基於交易由宣布至完成股東大會批准及全面收購須一段時日，而收購將令中化集團於中化香港持股量超過9成，中化集團必定會配售部份中化香港股份以維持其公眾持股量。     集團將會配售股份   據中化集團網站資料，該集團是中國最大的化肥進口商和磷復肥生產商，年進口化肥佔中國進口總量6成以上，在全球的化肥生產能力達280萬噸，其中中化化肥公司主要經營化肥進出口、化肥營銷及化肥企業投資，近年在內地興建或收購的化肥廠達10家，化肥產能逾600萬噸，為內地唯一一家同時擁有氮、磷、鉀三大基肥及復合肥、BB肥等二次加工肥料的大型化肥企業，預計2至3年產能將擴大至1200萬噸。 購併活動有增無減   隨着國資委主任李榮融對中央企業提出要求，若不能在規模上進入本行業前三位，就要重組，並要求他們逐步將優良資產擇機注入到上市公司，近日又表示國資委將採取多種措施，培育和發展30至50家具國際競爭力的大公司大企業集團，令許多國企均積極尋求重組及購併機會。  摩根大通證券（亞太）董事總經理孟亮亦預期，今明兩年無論國企或海外公司的購併活動只會有增無減，尤其中國入世時間表承諾會對外資開放的行業，如消費品、零售、基礎工業及金融業購併的交易更多，由於每個行業內，發展成熟及具市場地位的中國公司不多，相信這些公司的叫價只會愈來愈貴。
