key,date,article_daily_id,title,text
20061204-0,20061204,0,台南旅遊熱點旅巴墮崖21死,台南旅遊熱點 旅巴墮崖21死 【本報訊】台灣消息：台南旅遊熱點梅嶺風景區昨發生台灣有史以來最嚴重的旅遊巴意外，造成21死24傷慘劇。一輛滿載一間小學家長會44名成員和家眷的旅遊巴，全車連司機共45人，在梅嶺風景區遊覽後回程駛經一條村路的落斜彎位時，懷疑在高速下腳掣失靈，全車失控撞毀路邊防撞石壆後翻落20米的山崖下，車身嚴重損毀，車廂內外死傷枕藉。救援人員到場搶救傷者，經送院後證實其中21人死亡，當中包括4名小童，其餘24名生還者傷勢嚴重。 本港康泰旅行社總經理劉美詩表示，一般到台灣的香港團不會安排遊覽梅嶺，她說：「香港人到台南玩，通常會去高雄。」不過，據知有部份愛賞花的香港散客會到梅嶺遊覽。梅嶺位於台南縣楠西鄉，是當地著名旅遊勝地。特別踏入每年12月至1月，梅花滿山，吸引大批市民往當地賞梅。 車翻滾　多人拋出車外 是次肇事旅遊巴的44名旅客，都是高雄市鼎金國立小學的家長會成員和他們的眷屬，昨午5時30分，各人遊罷台南縣梅嶺風景區後，乘坐由姓顏司機駕駛的旅遊巴回程，至楠西鄉路一個落斜向右彎位時，有乘客突然聽到司機大叫：「沒煞車！（即腳掣失靈）」接着便發生意外。  據稱，旅遊巴失事時首先狂撼右邊路邊防撞石壆，由於撞力相當猛烈，全車在路邊翻滾，部份車窗即時爆裂，多名乘客被拋出車外；有人倒在路上，有人隨墮山旅遊巴滾下山崖，最後旅遊巴墮下20米深的山崖，並壓着部份乘客，其他經過的駕車人士立即報警。 違規定　司機車齡不足 台南縣消防局接報後出動10多部救護車趕往搶救，由於當時暮色漸濃，令拯救的難度大增。救援人員攀下山崖將被困車內及壓在車底的傷者逐一抬上路面，當時發現10多人已沒有生命迹象；45名死傷者分別被送往永康奇美、柳營奇美、署立台南醫院新化分院以及台南成大等醫院。可是，其中21人在抵院時已證實不治，當中包括4名小童，另24人連司機在內也告受傷。  警方事後在場調查，在路面發現20多米的煞車車胎痕，相信當時車速相當高。肇事原因有說是現場照明不足，也有說是旅遊巴腳掣失靈。肇事旅遊巴有18年車齡，依照台灣法例，10年車齡以上的大客車須每半年驗車一次，肇事旅遊巴在今年9月通過驗車測試。  另外，據稱肇事司機取得大客車駕駛執照不足9個月，不符合駕駛旅遊巴需要3年經驗的規定，違反台灣《公路法》。 5年前　兩宗意外53傷 鼎金國小校長江滿堂接獲消息後，與校方行政人員趕到現場。江滿堂表示，今次是家長會主辦的年度例行活動，是一日遊行程，前往台南縣奇美博物館及梅嶺風景區等地，校方知悉這個活動但未介入，參加者主要是家長會成員及眷屬。  今次是台灣史上遊覽車意外死亡人數最多的事故，5年前，梅嶺路段亦曾連續發生兩宗遊覽車意外。01年3月25日，一輛由高雄市前往台南梅嶺的遊覽車，在下山時翻落山崖造成37名乘客受傷。同年11月17日，一輛由彰化前來的遊覽車，失控撞上路邊的食肆，造成16人受傷。
20061204-1,20061204,1,李澤楷︰我要真民主選委政綱表立場　中聯辦出手打壓,李澤楷︰我要真民主 選委政綱表立場　中聯辦出手打壓 【本報訊】電訊盈科主席李澤楷繼出售電盈股權事件中觸怒北京後，正競逐選舉委員會議席的他將向資訊科技界選民發出宣傳單張，以「齊心爭取真民主」為題，表明支持重視民主發展的特首候選人，又要求新一屆特首加快香港民主進程，更說會利用其國際網絡，令香港變得更民主。過去鮮有公開談論對民主政制立場的他，又聯同六名IT20參選團隊成員，另行發出宣傳單張，要求加快本港政改步伐。據了解，中聯辦曾嘗試出手阻攔，但最終無功而還。　記者：莫劍弦　莊曉陽 李澤楷原本夥拍19名資訊科技界人士，以「IT20」名義，撰寫聯合政綱出選，IT20政綱主要強調業界利益，並無提及對民主普選的立場。據了解，一直對民主普選有堅持的李澤楷，希望向業界選民交代更多他對民主普選的看法，故決定自行印製個人競選宣傳品講述民主理念。 列支持者包括方敏生 本報昨日向選舉事務處查閱候選人登記的競選宣傳品時發現，李澤楷上周五已登記一份個人宣傳單張，單張以「齊心爭取真民主、我需要你的一票」（Yourvoteiscrucialtoachieverealdemocracy）為題，並將「真」字印得特別大，開宗明義以爭取真正民主為目標。單張日內將寄到選民手中。  除了講述對業界的貢獻、個人專業資格外，李澤楷在宣傳單張中多處談及其民主理念，包括「支持重視資訊科技及民主發展的特首候選人」，「期望新一屆特首加快香港民主進程」，他將支持香港發展民主，作為他對特首候選人其中一項重要訴求。  李澤楷又強調，他有很強的國際網絡，會利用這方面協助香港發展資訊科技，「令香港成為更開放、更民主的地方。」他更列出一些來自學界、資訊科技界及社會福利界的支持者，包括社聯行政總裁方敏生。  李澤楷又夥拍其他六名IT20的成員，再發出另一份拉票宣傳品，包括莫乃光、李惠光、劉嘉敏、趙志洋、賴錫璋及麥鄧碧儀，除了交代對資訊科技界的建議，更表明關注政改問題，「要求更積極推動有利香港社會和諧及經濟發展的民主政制改革」。  下周日將舉行選委會選舉，選出負責推選新一屆特首的800人。資訊科技界共設20選委議席，共有39人角逐。 學者：難免影響李嘉誠 業界人士透露，今次李澤楷自行發出宣傳單張闡述民主理念，又拉攏IT20六名成員另行出宣傳品，變相令IT20拆夥，引起中聯辦不滿，他得悉有中聯辦中人曾向相關人士施壓，企圖阻止他們另出宣傳品，但最終無功而還。  與李澤楷另出宣傳單張的莫乃光接受查詢時表示，他們七人以往經常在業界事務合作，各人對界別問題理念相近，所以再走在一起發出宣傳品，莫乃光並不否認七人在促進本港民主步伐立場相若，看法十分接近，但他說，沒有中聯辦中人接觸他，阻止他夥拍其他六人、另行印發宣傳品。  中文大學政治與行政學系高級導師蔡子強認為，李澤楷在選委參選政綱中表明支持民主，是一件好事，可以借此向公眾證明，不是所有工商界都是唯利是圖、反對民主普選，工商界之中同樣有開明人士，支持民主普選，但蔡子強相信，李澤楷今次高調支持民主，難免影響其父親李嘉誠與北京關係，令李嘉誠尷尬。
20061204-2,20061204,2,澳旅客料破2000萬逼近本港,"澳旅客料破2000萬逼近本港 【本報訊】澳門公布首十個月旅客達1,788萬人次，較去年同期上升近16%，預計今年旅客將突破2,000萬人次，逐步逼近香港旅客人數。澳門昨日大事慶祝，多個旅遊景點以舞龍醒獅表演。香港旅遊業議會指出，澳門旅遊業興旺對香港也有益處，不擔心香港旅遊地位會被對方爬過頭。  資料顯示，澳門入境旅客於2000年才大約900萬人次，六年後的2006年將突破2,000萬，使澳門回歸祖國近七年來，入境旅客增加了一倍有多。內地是澳門最大客源，佔總體入境旅客的54%；約一半是自由行旅客。 內地客源增長放緩 澳門旅遊局局長安棟樑表示，對於一個人口只有50萬的城市，一年接待2,000萬人次的旅客，實屬不易。他同時表示，澳門旅遊局將繼續推廣由多種元素組成的綜合旅遊。不過澳門旅遊商會會長陳志傑分析稱，作為旅遊支柱的內地客源，今年增長已漸見放緩，而且很多旅客都是一日遊人士。  香港早前爆出零團費醜聞，原來澳門也同樣受此問題困擾。陳志傑說，導遊選擇性帶團，未必能讓旅客體現澳門文化特色。而且澳門旅遊仍靠賭博支撐，難吸引旅客多留幾晚。  截止十月為止，香港旅發局今年暫時錄得2,076萬人次，雖較去年同期上升了8.7%，也已被澳門步步進迫。不過香港旅遊業議會發言人稱，訪澳旅客很多是香港人（超過三成），而且旅遊澳門的旅行團多數也來香港，港澳可說是互相補足，因此毋須擔心澳門旅客超越香港。"
20061204-3,20061204,3,近期學校食物中毒事件,近期學校食物中毒事件 10月25日 馬鞍山曾璧山中學及小西灣漢華中學，共33男、12女生，吃過2間供應商提供的午餐後，肚痛和嘔吐 9月28日 天水圍妙法寺陳呂重德紀念中學13名中一生，吃過供應商提供的粟米雞絲飯後感肚痛和作嘔 9月21日 元朗公立中學校友會小學12名小六生，吃過供應商送來的飯盒後嘔吐不適 9月14日 馬鞍山香港道教聯合會純陽小學34名小學生和1名老師，吃過供應商提供的「雞翼、珍寶腸和粟米提子乾炒飯」午餐盒後屙嘔肚痛 9月13日 大埔羅定邦中學8中一生，吃過由供應商提供的午餐後，上吐下瀉不適  資料來源：《蘋果》資料室
20061204-4,20061204,4,陶傑專欄：種族平等須政府帶頭 - 陶傑,陶傑專欄：種族平等須政府帶頭 - 陶傑 特府完成《反種族歧視條例》草案，通過之後，港人將禁止公開呼喚「阿差」、「賓妹」、「㗎頭」、「鬼佬」等，以免對該等弱勢族群造成心理創傷。  此一條例，抄襲自英美西方文明國家，亦為華人世界就所謂種族歧視問題第一個政府模仿歐美立法者。特府拼盡全力與國際文明勢力接軌，連日本也沒有類似法例，特區不但超越了日本，而且率先掙扎「脫亞入歐」，是為繼「雞珍」當選世衞總幹事後，令港人再「威」一次，吐氣揚眉，令人深為欣賞。  「阿差」、「賓妹」之類的惡搞謔稱，流毒多年，破壞社會和諧，立例禁止呼喚，極為及時。然而反對種族歧視，不止流於封上兩片嘴皮。實現特區種族平等，就像五天工作，必須由政府帶頭垂範。僅以印巴裔人士為例，他們許多在香港祖居三代以上，操流利粵、英、印、巴等三四國語言，更以粵語為母語，理應同工同酬。特府應該做個榜樣，未來新開的四十多個政治委任的副局長，局助之類，率先撥出兩成空額，由特區印巴裔人士出任，以示特府反種族歧視之誠意。  根據《基本法》，只有特首與司局長方須由黃面孔百分之百純正中國種裔人士出任，連有八分一混血者也沒有資格，但局長副助級《基本法》並無規定，特首也不必「報請中央任命」。本港印巴裔人士才學俱備者甚眾，至少當日如果「商人治港」，由夏里拉來做特首，一定好過董伯。 照顧印巴裔人士工酬平等權益，遺珠已久，不要只禁口頭稱呼，就算香港六百萬人，由今日起，把印巴裔人士尊稱做爸爸、爺爺、皇帝，但電視台六點半粵語新聞報道員沒有一個印巴女性，各大傳媒總編輯沒有一個印巴男性，上自滙豐、中行的行政總裁，下至電台名嘴DJ。九巴小巴的士司機，也沒有一位出身麼地道、自小在麥花臣球場與香港華裔街童一起「碌泥沙」踢足球長大的印巴港人，口惠而實不至，說不過去。  在英帝殖民地時代，尚有一個印巴裔精英鮑文，官拜運輸署長，證明印巴裔人士完全有能力管好香港。豈料特區時代卻倒退到管治班子中國種族清一色──雖然其中不乏據親中派所指係「黃皮白心」的生理華人、心理白人的問題人員──但表面看來，全部黑髮黃皮，半根雜毛也沒有，如何令人滿意？  特府不妨先做一個內部檢討，看看政務官天之驕子、行政與新聞主任等，有多少印巴裔人士，還是少數族裔只限於懲教署各大監獄的通櫃執行主任一層，幾十年來閉塞難以升遷，做一個報告，帶頭改善，較為服眾。例如主理此事的林鄭月娥，露面時身邊的新聞副官，由印巴裔女性出任，含笑以流利粵語解釋政策，就順眼許多，豈非好過只禁止市民呼喚「阿差」？  逢周二、四、六刊出
20061204-5,20061204,5,美國與世界：美應對伊拉克發最後通牒,美國與世界：美應對伊拉克發最後通牒 柯翰默CharlesKrauthammer 《華盛頓郵報》專欄作者 如今美國人欣然接納所謂「現實派人士」，布殊主義似乎已成歷史灰燼，大家注意到了利益的概念，還以為這是前國務卿貝克和伊拉克研究小組提出的新想法。  難道他們不知道過去五年美國都在忙甚麼？的確，布殊總統言談間總充滿威爾遜主義的理想熱情，例如在他第二次就職演說時，宣稱要打倒暴君。但美國在伊拉克、阿富汗與黎巴嫩的民主化政策，原就建立在美國最具體的利益上。 軍力無法解決動亂 如果美國真的謹守理想主義，就應該去干涉查德、緬甸或是蘇丹達爾富爾地區，但美國並非如此。美國只想在三個戰略地位重要的國家：阿富汗、伊拉克和黎巴嫩，維持脆弱的和平，這三國的重要性，在於它們鄰近對西方利益威脅最大的敍利亞與伊朗。  美國特別想推動伊拉克民主，是因為建立親西方、具有民意基礎的合法政府，可確保美國利益長長久久，侯賽因政權總是威脅到波灣和平與美國利益，趕走侯賽因父子勢在必行。但侯賽因繼任者、民選的馬利基政府卻很失敗。  失敗的原因在於伊拉克複雜的政治文化，國內無法達成共識，領袖難有作為。但是美國仍該設法改變政府結構，結合庫爾德族、溫和的遜尼派、世俗什葉派和其他派系的什葉派，來個政治大和解，組成新政府。  最近大家都說遏止伊拉克戰亂的關鍵在於政治，這又是另一個後見之明，至少一年前就看得出來，美國無法用軍力解決動亂。軍費代價高昂，勝利短暫如雲煙，而且毫無促成政治和解的可能。所謂和解是指按照族裔比例，給予遜尼派應有的政治與經濟（也就是原油）權力，但現在馬利基所領導的什葉派政府卻不能達成此目標。 伊敍兩國鼓吹內戰 美國應對馬利基發出最後通牒：如果他在兩個月之內不能達成政治和解，或是交出政權給新的聯盟政府，美國就要棄守巴格達綠區，退回基地。美國將任由內戰發展，讓身處綠區原受美軍保護、又跟什葉派激進教士薩達暗通款曲的伊拉克政客自行面對叛軍，至少可迫使他們面對問題，要不就是對遜尼派更慷慨一些，要不就是退居幕後，讓願意和解的人來組政府。  要成功惟有從伊拉克內部進行政治改革，不過美國採取的「區域化」新模式，是把伊朗和敍利亞也牽扯在內，要他們替美國解決燙手山芋。這個構想是假設伊拉克若穩定，伊朗與敍利亞都有利可圖。  利益、穩定、區域強權，都是現實主義的典型術語，但要伊朗與敍利亞跟美國分享伊拉克和平的利益，那根本是空想。伊敍兩國在動亂的伊拉克才有厚利，因此兩國都在煽動叛亂，鼓吹內戰。 很差勁的現實主義 最好的情況是，他們給美國幾個月時間撤軍，但美國撤軍為甚麼需要他們幫忙？沒有他們，我們自己照樣可以順利撤軍。而美國還要回報他們於事無補的假幫忙，無異投降，敍利亞可能會再要求美國不插手黎巴嫩，就像在上次波灣戰爭前，美國在伊拉克需要援助，當時的國務卿貝克把黎巴嫩交給敍利亞作為補償。  伊朗也會要求美國放手不管核武計劃，這將使伊朗成為超級強權，主宰波灣阿拉伯國家及油權。這是得不償失的做法，也是很差勁的現實主義。  逢周二刊出
20061204-6,20061204,6,還斂集：陶傑怪論有真意 - 張五常,還斂集：陶傑怪論有真意 - 張五常 那天見陶傑寫《為什麼你不必寫好中文》，題目古怪，好奇讀讀。他提出兩個大調，一明一暗，讓我這位大師翻出來，使讀者們吵鬧一下也好。  第一大調清楚。陶老弟認為，中文不必學好，因為要欣賞優美的中語文字，找幾位今天還活着的高人的作品，品嘗可也。學好中文？發神經！何必有自唔在，攞苦嚟辛。  如此類推，我想到一位年輕人要學打高爾夫球，問陶夫子意見。夫子曰：「高爾夫球？容易容易。你只要識得何謂桿，何謂洞，就畢業了。要欣賞高爾夫球技嗎？看老虎活士比賽就足夠，無須自己打得好。」  也如此類推，我幻想自己被聘請為香港某大學的中文教授（資格足夠有餘吧）。課堂上學生舉手問：「大教授呀，有人說你的文章有別字，你自己也說一千個字錯一個，別字重要嗎？」我回應：「別字？讀得出聲就是對！解不通是因為你生得蠢。」  拿着陶傑發揮，因為想到這樣的一個問題，重要的。不久前聽到朋友說，美國不少幼兒班開始教三歲多的孩子學中文，講普通話。這顯然起於炎黃子孫的口袋裡有幾個錢，人口十三多億，西洋鬼子於是看風駛𢃇，拜秦始皇為師。問題是，中文是上選的語文嗎？比起英文怎樣了？中文可否成為國際大語言呢？  我的看法是：中、英二文皆可以寫得非常優美，二文差別甚巨，但二者都是人類文化中的頂級文字了。相比之下，中文因為沒有文法的約束，而常用的字彙比英文少很多，所以較為容易學。當然，要到家二者皆困難。分別的重點，是中文字單音（逼着常用字彙較少），英文字多音（常用字彙多，字與字之間的變化微妙）。英文的表達能力強，但要學得好難於登天。中文的表達能力，要靠砌字高明，而又因為是單音字，講平仄，讀得朗朗上口的要論長短句的字數。 平心靜氣地衡量中、英二文，我認為達到師級二者皆絕妙，但中文比較容易學（個人認為容易相當多），所以長久一點看，中文要成為國際語言不苛求。二十年前我不這樣想，因為當時中文不能打字，一着之差，輸幾千里。今天中文用電腦打字，可以打得比英文還要快（一位同學一分鐘可打二百個中文字）。  正在為中文的前途偷笑，陶傑卻給我潑一盆冷水，頭痛是他潑得對。這是他提出的第二大調，暗的，愈想愈對。他指出要學好中文不能不懂得中國的文化傳統，漠視這傳統學不出什麼來。這樣，只知何謂桿、何謂洞就差不多了。陶夫子舉出明人楊慎的《臨江仙》──以「滾滾長江」起筆的那一首。  記得四十多年前選修心理學，有一種測試，是測一個人的第一時間聯想到的。考者出一詞，答者要立刻覆一詞，看看效果。陶夫子之見，是如果你出「長江」一詞來測試我這個老人家，我會立刻回應：「大江東去。」但如果你出「長江」考一個香港學子，他會立刻回應：「李嘉誠！」  一盆冷水，卻是真理。其他語文我不懂，但比起中文，英語是不着重於文化傳統的基礎來協助表達的。中文呢？你不需要像某些寫中國詩詞的君子，只七個字要下三個典故註腳，但某些成語，或某半句典出何處，或多或少你總要學得。不止此也：要用得很熟才可以寫得流水行雲，才有自然的文采。當我寫「去如黃鶴」，淺的，或說「梓澤邱墟」，深的，我是想也不用想就放進去，自然的，但或明或暗地假設讀者知道中國曾經出現過崔顥與王勃這兩個人。英文不用這一套。  陶傑之見，是如果考上述的心理測試，出「黃鶴」，香港學子的第一時間回應，可能是「禽流感」。有這樣的文化，好中文不學算了。高見也。  電郵：nscheung@netvigator.com  逢周二、周五刊出
20061204-7,20061204,7,我問你答：相士不是活神仙,我問你答：相士不是活神仙 黃晉虎 廟街相士　外號「廟街神相」 Q：你去年坐了五個月牢後上訴得直。相士替人趨吉避凶，為何你卻避不過此劫？（去年因在廟街向卧底警員說：「在這裏擺檔要付錢」而被控收陀地，判監十八個月，入獄五個月後上訴得直。）  A：其實我前年已算到○五年會有一劫，去年我沖夫妻宮，很大機會離婚收場，只得兩種化解方法，其一是「包二奶」，避見老婆一年；其二是惹上官非坐監，我當然不希望婚姻破裂，最終真的應了命數，但沒想到會是被「屈」而坐。今次經歷，令我學懂「閒事莫理、險地莫企」。  Q：獄中生活如何？他們知道你是相士嗎？  A：有人把我認出來，最後一傳十、十傳百的傳遍整個赤柱東頭懲教所。我粗略估計，曾為逾百囚犯看相，懲教署職員也有。我的身份算是令我得到一點優待，起碼入面的黑社會頭頭和倉霸（監房內的犯人頭目）對我也客客氣氣，沒有受到欺凌。  話說回來，囚犯的面相、掌相原來真的有不少共通點。以面相來說，他們的鼻大多有點歪，眼神閃爍不定，更喜歡以眼角斜視別人。至於掌相方面，佔了一半都是斷掌，即是沒有智慧線，而生命線和感情線則相連一起。這些人生性只要喜歡一樣東西，便要把它拿到手，一生錢財易來易去，較易作奸犯科。  我曾為一名五十歲的殺人犯看相，他二十四歲便入獄，原本被判死刑，後來改判終身監禁。他在獄中發憤進修，拿了大學學位，今年五月獲假釋，現在大家成為朋友。 Q：在廟街擺檔，有哪些難忘經歷？  A：大約一年前，一個少女找我看相，她剛與男友分手，情緒十分低落，更透露想死，我跟她說，她的真命天子還未出現，好言相勸。碰巧當時有一個男的在旁等候看相，他也是失戀。那個少女走後不久，發覺遺留了東西折返，兩人就這樣認識了，最後還結了婚呢。  我也經常為人做媒，遇到生肖、八字很夾的男女客人，便為他們牽紅線，成功撮合很多姻緣！我也遇過很多存心踩場的人，我問他們姓甚名誰，他們卻說：「你不能算出來嗎？」有些更離譜的，會問我知不知道他們早上吃過甚麼，把我當神仙，我惟有笑笑跟他們說：「師傅是食飯，不是食香的。」也有外國人特地來廟街看相，看相算命的方法並無不同，他們的問題也是圍繞感情和事業為主。 Q：可否預測一下香港來年的運程？  A：明年地支有沖害，新曆八月七日至九月七日期間會發生一宗意想不到的大型交通意外；亦因二黑病星入中宮，秋天會爆發比較厲害的疫症，要小心飲食。至於股市方面，則會大上大落，預計五至七月會出現一輪急跌，跌破一萬八千點，其後會在國企股的帶動下升破二萬點；樓市以豪宅市道較佳，預計會有兩成升幅。這些大家只作參考便可，其實只要平日多行善積福，便有好報。  本報記者　鄭少斌
20061204-8,20061204,8,小塊文章：不容有失 - 李怡,小塊文章：不容有失 - 李怡 吳邦國訪港，最受輿論關注的兩個要點，一是沒有公開挺曾，二是特別提到香港必須搞好選委會的選舉。早前胡錦濤外訪時也對香港媒體說，選舉委員會的工作，「是今後一段時間香港政治生活的一件大事，我理所當然地希望香港特區能夠把這項工作做好。」  由八百人的小圈子選舉特首，把幾乎全體香港市民排拒在外，這算是甚麼了不起的「香港政治生活的大事」？香港市民有多少人關心選舉委員會的產生？八百人小圈子的組成，甚麼時候沒有「搞好」過？中央高層何以一再出言要「搞好」，實在讓人抓破頭皮都想不通。  不過，香港多數市民不屑一顧的事，卻是中央十分緊張關顧的大事。尤其是，不久前傳聞曾蔭權有意放馬讓梁家傑取得一百人提名的選舉入場券，中央於是大為緊張。胡錦濤、吳邦國口中的「搞好」，以及廖暉在深圳的坐鎮，就為了要全力封殺梁家傑。關係到權力，中共從來就是要有百分百的把握，絕對不容有失，哪怕只是失了小小的參與選舉權。  李怡
