key,date,article_daily_id,title,text
20061204-294,20061204,294,御皇庭爆蝕讓潮呎價2455元平過舊樓　上水樓市淪陷,御皇庭爆蝕讓潮 呎價2455元平過舊樓　上水樓市淪陷 雖然賣地成績造好兼銀行減息，樓市尤其是中小型樓仍然無起色。去年高價買入新盤的業主，今年差不多無一倖免要勁蝕，更引發投資者拋售蝕讓潮。去年高價開售仍熱炒的上水御皇庭，入伙一年，造價愈跌愈殘，新近一宗成交造價僅137萬元，勁跌近25%，呎價低見2455元，平過同區樓齡10年以上的二手屋苑，勢將令到已疲弱的上水樓市進一步淪陷，二手樓要再劈價才可獲承接。 【本報訊】金龍地產分行經理陳民傑稱，御皇庭頻頻錄得蝕讓，造價屢造新低，1座逾15樓G室，558平方呎，原業主為炒家，去年以182萬元一手買入，因樓市急轉直下，日前大幅減價近25%，以及提供3.5個月長成交期，才僅以137萬元賣出，呎價低見2455元，創屋苑新低之外，造價更不及已有13年樓齡的二手屋苑上水中心（呎價2845元）。 二手交投連使費全蝕 御皇庭今年約有25宗二手成交，15宗要蝕，最多蝕27%，其餘10宗若計及使費一樣要蝕。屋苑現有近100個放盤，平均叫價每呎3400元，個別更低於3000元，貼近同區樓齡較高的二手屋苑造價，其中1座低層B室，560方呎，買入價175.7萬元，現開價150萬元，折讓14.6%。  恒基地產（012）及爪哇控股（251）發展的御皇庭，去年中以高於同區二手屋苑逾10%開賣，個別呎價4800元，因有大量優惠，包括長成交期及免息供，入場費又低於160萬元，成為當時熱炒新盤之一，投資者羅家寶以1億元掃入5層共40伙。消息透露，羅氏去年買入該批單位，部份未有完成交易。據悉，御皇庭尚有近100個貨尾，主要集中第3座，平均呎價約3800元，較二手價高近10%。  他稱，由於御皇庭有不少炒家有貨在手，加上二手放盤多達逾100伙，一手貨尾又有供應，有投資者為求出貨，除調低叫價外，更不惜以長成交期或加佣以求甩身。  新屋苑爆蝕讓潮，將會拖累上水整體二手樓市，事實上，過去一年上水中心等二手屋苑，造價已下跌一成。 四大屋苑料再跌價10% 中原地產營業董事許偉邦表示，上水樓價之前的確「升得太急」，近期出現調整是很正常，業主議價幅度已擴大至5%，預期明年上半年前，上水四大二手屋苑，包括上水中心、新都廣場、上水名都及龍豐花園，造價有機會再跌10%。上水屋苑近期不乏減價例子，上水中心2座中層463方呎，原先叫價125萬元，現減至120萬元。
20061204-295,20061204,295,炒新股李兆基跟得過九成獲利　累賺100億,炒新股李兆基跟得過 九成獲利　累賺100億 近年香港富豪紛紛認購來港上市的國企新股，當中最矚目的是10月上市的工商銀行（1398），吸引新股常客李嘉誠，李兆基（四叔）和鄭裕彤認購外，亦引來新地郭氏兄弟、糖王郭鶴年、吳光正、陳廷驊以及榮智健入股，合共投資128億元，以上周股價收市計算，賬面利潤達34億元。近月新股熱再起，不少投資者都跟富豪買新股，但要跟當然要揀個最好，首選當然是有香港畢菲特之稱的李兆基。 投資者跟富豪買新股時，須留意富豪是否該股的公司投資者，這可在招股書上找到。愈多富豪成為新股的公司投資者，愈能反映該新股的投資價值及公司前景。如果投資者只是從報紙看到，傳聞某富豪入股，但在招股書卻沒有列明，便需慎重考慮是否認購；須知道富豪認購新股，很可能只是出於「畀面」性質，並不是真正睇好該股前景，因此不作為公司投資者。 逢大必抽　好股長揸 過去3年，香港股神四叔投資內地企業新股，戰績彪炳，獲利甚厚，以上周收市價計算，已知持股的新股（見表）賬面利潤為近100億元，入股10隻中資股中，至今9賺1蝕，勝出率達90%。還未計算其他不知持股量的新股如平安保險（2318）、網通（906）、中興（763）及招商銀行（3968）等。  相反，恒基地產（012）截至06年6月底全年盈利135億元，但撇除物業重估收益，實際盈利只有53億元，難怪四叔上月話「炒股好過起樓」。而李嘉誠及鄭裕彤炒新股可計算的賬面利潤，分別為40.8億及33.1億元，雖然遠較四叔為少，但亦獲利不菲。  從四叔買新股的經驗，可綜合兩個心得：第一，只揀大型新股，能夠穩定派息；第二，好股不妨長揸，為求最大回報。  四叔鍾情內地大型企業。每次大型國企來港上市，例必捧場，並且斬獲豐富。四叔揀選的大型國企新股種類多元化，包括工業股玖龍紙業（2628）、能源股神華（1088），以及金融股如國壽（2628）及中國銀行（3988）等；這些公司均有派息保證，財務穩健。即使四叔投資的中海集運（2866）賬面仍虧蝕，但該公司過去兩年均有派息，可長揸收息。  長揸一向都是李兆基的投資策略，他最引以為傲的投資當然是國壽。國壽上市當初配股予四名公司投資者，包括李嘉誠旗下的長實（001）及和黃（013）、李兆基及鄭裕彤的周大福企業。 航運股略遜　中集運潛水 鄭裕彤及長實先後於04至05年沽出手上的1.11億及2.14億股國壽，分別獲利3.3億及1.9億元，及後鄭裕彤再進一步沽清餘數。只有李兆基不為所動，繼續持有手上4.28億股國壽。以國壽上周收市18.9元計算，四叔手上國壽總值81億元，較最初的認購價3.625元，股價升值了4.2倍，賬面獲利逾65億元；和黃手頭的2.14億股則有32.7億元賬面利潤。  值得一提，四叔和航運股好似唔係咁「夾」，先後投資中海集運及中遠控股（1919），中海集運首日上市及目前股價均是跌破底價，而中遠控股上市17個多月以來，股價長時間潛水，只是近月才反彈回升。
20061204-296,20061204,296,主要貨幣滙價,主要貨幣滙價
20061204-297,20061204,297,周末新盤賣84伙減半,周末新盤賣84伙減半 【本報訊】一手市場缺乏全新大型樓盤壓場，加上二手市場對利好消息適應需時，被寄予厚望的賣地成績未能「單天保至尊」，過後首個周末，整體樓市氣氛仍然呆滯。 嵐岸預留52伙稱冠 個別發展商的加價假動作，並未為一手市場帶來預期的推動力，主要新盤及貨尾銷情平淡，過去兩日只約84宗（見表），比賣地前周末逾160伙挫一半，其中以馬鞍山嵐岸成績最佳，兩日共預留52伙，呎價4200至4500元。至於二手市場，放盤業主看好後市，紛紛收窄議價空間，但買家缺乏追價意欲，交投放緩。  嵐岸位於紅磡都會商場的示範單位，昨有大批市民到場參觀，發展商亦即日加推22伙，全屬第5座中層C及E室。長實（001）執行董事趙國雄表示，賣地後新盤氣氛比預期理想，嵐岸銷情也有進展，有信心聖誕前售出300伙，甚至超標。他預料年底前樓價不會有大改變，個別樓盤或會有少許調升空間。  長實副首席營業經理郭子威表示，本周推售650至690方呎的兩房單位，意向呎價4300至4400元，未定數量，不排除即時內購，正商討免息免供及定額供款安排。  另外，恒基地產（012）指剛開始收樓的上環聚賢居，日前錄得貨尾成交，2座中層F室，860方呎，成交價750萬元，呎價8721元。  至於其他主要一手盤，銷情亦未見突出，屯門豫豐花園售出約10伙；長沙灣碧海藍天及荔枝角曼克頓山，則分別錄得8宗及6宗成交。  利嘉閣執行董事廖偉強認為，過去兩日一手銷情較前周下跌，主要是嵐岸推盤已步入中段，市場暫時又未有全新大型樓盤接棒，致令銷情放緩，但他相信隨着東涌新盤影岸‧紅即將開賣，短期內可再度帶起氣氛。 二手樓減1/4　澳門旺 另外，美聯物業資料顯示，十大屋苑周末只錄得19宗成交，較上周的25宗減少24%，其中荔枝角美孚新邨及天水圍嘉湖山莊減33%，只有4宗；大角嘴維港灣更沒有成交。該行董事何銘培說不少買家早在賣地前偷步入市，而部份二手放盤業主因看好後市，叫價企硬，令買家卻步。他預期拉鋸局面只會持續短時間，12月整體交投向好。  相比之下，一海之隔的澳門仍見朝氣勃勃。由合和（054）、信德（242）及澳娛合作的氹仔濠庭都會，過去兩天共售出90伙，比香港整體一手銷情還要好。發展商四度加推，並提價1.25至3%，平均每呎逾2300元。首推的「顯濠軒」已售出七成。
20061204-298,20061204,298,新界　東港城9年貶值55%,新界　東港城9年貶值55% ▲利嘉閣黃展望表示，將軍澳東港城5座高層B室，592方呎，以186萬元易手，呎價3142元；原業主97年以414.6萬元購入，勁蝕228.6萬元，貶值55.1%。東港城現有260個放盤，平均呎價3400元。 麗都花園呎價1900 ▲一名上車客以市價購入深井麗都花園5座中層D室，675方呎，涉資122萬元，每方呎1807元；利嘉閣何汝珊說，單位01年作價113萬元，微賺9萬元。該屋苑11月份共有11宗成交，平均呎價1900元。 加州花園兩個多月賺45萬 ▲元朗加州花園榕翠徑雙號屋，面積2021方呎，成交價580萬元，呎價2870元。美聯呂偉雄稱，上手業主兩個多月前才以535萬元入市，轉手即獲利45萬元，升8.4%。 映灣園回報4厘 ▲中原游波指出，東涌四大指標屋苑11月份有120宗租賃成交，較10月份下跌35.8%。其中映灣園8座中層H室，1201方呎，剛被機組人員以每月1.3萬元承租，呎租10.8元，回報4厘。 綠楊換樓客高5%接 ▲荃灣綠楊新邨N座高層4室，667方呎，由換樓客以225萬元吸納，每方呎3373元，較市價高5.4%。美聯吳彤稱，原業主95年以286萬元買入，損手61萬元，跌21.3%。
20061204-299,20061204,299,蘭西情報課：恒基助弱勢社群攞義工獎,蘭西情報課：恒基助弱勢社群攞義工獎 成日話啲商人無良心，其實都唔係嘅，好似恒基咁，旗下嘅偉邦物業管理就因為推動傷健共融，又鼓勵員工熱心做義工，所以榮獲社會福利署「支持殘疾人士就業嘉許典禮」嘅最高榮譽「超卓合作夥伴大獎」，跟住同姊妹管理公司恒益，又喺「2006年義工嘉許典禮」掃埋「全港最高義工服務時數獎」私人團體組別2同1嘅冠軍同優異獎，認真熱心公益。  集團執行董事孫國林話，恒基不嬲都好重視企業社會責任，好似近期又有新搞作，同志願團體美奇妙漁農合作社聯手，為旗下西灣河嘉亨灣、將軍澳新都城等提供政府認證優質海魚訂購服務，預計可以開創過百個就業機會。雖然唔係多，但都可以紓緩吓基層失業問題，等政府唔使咁頭痕。  除咗呢啲，恒基物業管理部早喺03年已經同社福機構合作，請啲智障、殘疾同復康人士喺大型屋苑工作，幫助弱勢社群自力更生。其實啲企業多啲關心社會，做吓公益活動，就唔使成日俾人奸商奸商咁叫啦。
20061204-300,20061204,300,香港仔中心旋轉木馬冧長者,香港仔中心旋轉木馬冧長者 聖誕節普天同慶，大人細路都開心，老人家又如何？和記黃埔就好抵讚，今年喺旗下香港仔中心廣場，亦即全區最多耆英聚腳嘅地方，擺放一座15呎高巨型聖誕音樂木馬，搞吓氣氛。  佢哋仲將呢個布置名為「冬日歐陸奇幻聖誕」，設計係仿照歐洲遊樂場旋轉木馬，除咗彩色駿馬，仲有可愛小鹿、慈祥聖誕老人同得意小孩等裝飾，加埋音樂裝置，定時播放聖誕音樂，對於一眾公公婆婆而言，簡直係一流嘅視聽享受，點都好過齋坐屋企咁悶。  木馬裝飾會擺到出年1月2日，時間都唔短，提醒各長者街坊，若然家有細路，記得喺今個月16至25日，逢星期六、日同公眾假期，帶埋佢哋嚟呢度，到時會有聖誕老人出現，或有機會同聖誕老人影相。  此外，聖誕老人亦會到各期商場，派糖果畀小朋友。
20061204-301,20061204,301,經紀瞓身搶一手盤,經紀瞓身搶一手盤 𠵱家班經紀喺一手市場搵食搵到過晒界，基本上已經冇咩分區可言，極其量都只係有主區嘅名號，但係場內一大堆經紀都係嚟自五湖四海，搶得快好世界。  中原將軍澳區同事，最近做咗3單新盤大刁，總值5000萬，分別係營業額達準千萬主管級數嘅余瑞娟，親手促成荔枝角曼克頓山2座高層A室，2185萬元，仲有就係兩單馬鞍山嵐岸相連戶，5座E、F室1100萬元，同埋1座A、B室1680萬元，都係余主管嘅手下包辦。  年近歲晚，開單最實際，一手樓開單率真係好講彩數，人多啲大包圍，中嘅機會率都高啲。不過，問題係經紀集中火力搶攻一手樓，淡市下要慢慢煲嘅二手樓就冇人理，有啲分行甚至長期關門納空租。咁樣嘅運作模式，真係健康咩？
20061204-302,20061204,302,港島指標屋苑最新行情,港島指標屋苑最新行情
20061204-303,20061204,303,熱辣辣成交紀錄,熱辣辣成交紀錄
20061204-304,20061204,304,招股價2.45-2.6元　最多集資27.2億陽光房託周五招股,招股價2.45-2.6元　最多集資27.2億 陽光房託周五招股 恒基地產（012）、恒基發展（097）及集團主席李兆基私人將20個商場及寫字樓項目分拆為陽光房產投資信託基金（REITs）上市，本周五公開招股，每股招股價2.45至2.6元，最多集資27.2億元。 【本報訊】根據初步招股文件，陽光本月8至13日公開招股，21日掛牌，發售10.45億個基金單位，集資25.6億至27.2億元。公司預測，上市至明年6月底止半年的可供分派利潤為1.22億元，將全數分派。恒地股東每持有13股，可優先認購1個單位。 四招財技提高收益率 初步招股文件詳列陽光提高收益率的四招，將收益率提高至8.49%至9.01%作招徠：首先是利率掉期。陽光為購入20項物業，將貸款39.5億元，負債比率達41.2%，接近上限45%。利率掉期後，截至2011年全期平均定息3.44%，降低利息支出；第二招是管理人收取基金單位作管理費，令陽光的現金支出減少；第三招是大股東提供07至09年度的租金收入保證，依次是4.05億、4.29億及4.55億元，等於每年增長5.9%；最後一招，大股東打算未來3年不收息，2010及2011年度分別減收60%及50%。  陽光表明，採用四招財技後，由上市至07年6月底止半年，可供分派利潤增加1億元，等於總數82%。若不使用四招財技，可供分派利潤只有2190萬元。  陽光包括的20項投資物業遍及港九、新界，總樓面面績129.43萬平方呎，平均出租率接近九成，估值為90.9億元，寫字樓及商場平分春色；當中三項物業，包括上環皇后大道東248號、將軍澳新都城1期及上水中心購物商場，已佔全部估值70%，佔截至今年6月底止全年淨租金收入64.5%。 恒地股東優先認購 恒地、恒發及李兆基私人出售的投資物業，依次佔20項物業總估值14.76%、0.54%及84.7%；即出售該批投資物業的最大得益者是李兆基。恒地及恒發分別以總代價10.84億元及3800萬元出售相關物業（見圖），分別錄得虧損1.2億元及收益800萬元。  按招股價2.45元及2.6元計算，陽光購入20個項目的總代價分別是70億及73億元，代價以上市籌集資金、基金單位及銀行貸款支付。
20061204-305,20061204,305,二手活躍一手推盤7年新低,二手活躍 一手推盤7年新低 市場統計，一手推盤今年將創99年有紀錄以來新低，料僅1.4萬伙，較去年的1.5萬伙進一步減少；其中豪宅迄今只得619伙，較去年的2093伙，大減七成。二手市場卻持續向好，主要屋苑上月成交，創下半年新高。 今年料得1.4萬伙 美聯物業首席分析師劉嘉輝說，今年息口走勢不明朗，影響推盤步伐。資料顯示，上半年只有3643個單位推出；下半年推盤加快了，多達8489伙，但始終未能收復失地，估計全年只有1.4萬伙，是連續第4年萎縮。影響所及，今年首11個月，一手私人住宅買賣合約註冊總值僅448.5億元，較去年同期銳減五成。  至於二手樓市，近日交投轉趨活躍。利嘉閣地產研究部主管周滿傑說，減息因素，加上賣地成績理想及港股屢創新高，皆增強買家入市意欲。50個指標屋苑，11月共有955宗成交，較10月的856宗增加12%，按月成交更創7個月新高。他估計12月交投可望再增15%，超越1000宗水平。
20061204-306,20061204,306,世房未來兩年百億買地,世房未來兩年百億買地 世茂房地產（813）剛於上月發售5年及10年期高息票據，集資總值46億元，執行董事許世壇說，所得資金主要用作在內地增加土地儲備。世房自從年初引入策略投資者、年中上市，以及今次發債，全年集資達百億元，足夠未來一兩年買地之用。此外，世房未來五年也會繼續擴展包括酒店及商場在內的投資物業業務。 【本報訊】許世壇周末在上海出席世茂皇家艾美酒店開幕儀式後表示，有意增加投資物業組合，主要是酒店及商場。世茂現於上海擁有佘山及皇家兩間艾美酒店，共有1097間房，位於外灘的尊悅酒店明年3、4月開業，將有630間房，總投資20億元（人民幣．下同）。由於位置優越，目標平均房租是400美元，高於上海平均最貴房租300美元。 增加酒店商場比重 世房正考慮在佘山興建一個包括商場及酒店的主題公園，總投資逾30億元，酒店約佔三分之一，初步設計有300間房，一家德國地產商將入股該酒店30至40%；商場部份的樓面有30至40萬方米；主題公園部份也正在物色合作夥伴。整個項目明年動工，許氏預期可在09至2010年落成。  許世壇解釋，增加投資物業組合，主要是提高穩定現金流，長遠希望投資物業佔整體業務30%，賣樓佔70%；預料明年投資物業佔盈利18%，2010年增至兩成。以新開的皇家艾美酒店為例，9月底試業，首兩個月已錄得經營溢利，入住率是50%，預料明年平均入住率可攀上70%，平均房租1800至1900元，08年開始提供穩定盈利貢獻。除了上海，世房在南京也有一間酒店明年開業。 負債比率僅12% 至於主要的售樓業務，世房現有1600萬方米土地儲備，足夠四、五年發展之用，但公司正積極投標或參加拍賣，以增加土地儲備。世房主席許榮茂說，最近發債集資，主要用作買地，年底前可能有公布。許世壇補充，發債後，世房負債比率是12%，若有合適項目再要融資，負債比率可升至40%，無意配股集資。  許榮茂指出，包括天津、青島、遼寧及瀋陽在內的環渤海地區是明年發展重心，雖然中央政府為壓抑樓市增長太快而收緊銀根，但由於土地成本不斷上升，未來樓價仍會溫和上升，每年升5至8%是正常。世房今、明兩年每年售樓的樓面超過百萬方米，集中在北京、上海、江蘇昆山及常熟等城市，08年增加一倍至200萬方米。
20061204-307,20061204,307,煤氣內地業務借殼百江,煤氣內地業務借殼百江 【本報訊】市場一直揣測會將中國燃氣業務分拆上市的中華煤氣（003），選擇了以注入資產方式取得百江燃氣（1083）控制權，以借殼形式取得拓展內地業務的現成平台。煤氣斥32.31億元出售10個內地燃氣項目予百江，換取百江擴大後股本約45%股權，成為最大單一股東。煤氣常務董事陳永堅表示，暫無意再注入其他內地燃氣項目。 內地項目換45%股權 根據協議，百江將向煤氣以每股4.18元發行7.73億股新股，收購煤氣包括青島、淄博、龍口及威海等10個內地項目。完成交易後，煤氣將持百江約45%，百江原控股公司威華達（622）持股量將由60%攤薄至30%，剛從和記黃埔（013）手上購入百江股份的惠理基金亦由10.68%攤薄至5.87%（見圖）。  百江現擁有內地燃氣項目（不包括液化石油氣項目）35個，覆蓋32個城市，橫跨8省，用戶達170萬人，今年首6個月管道燃氣銷售量達3.67億立方米。若加上煤氣持有的項目，總數將達60個，覆蓋55個城市，橫跨12省，用戶人數達440萬，今年首半年管道燃氣銷售量達10.46億立方米。  煤氣將派出包括陳永堅在內的四名代表進入百江董事局，原百江主席歐亞平辭任主席，由陳永堅接任。摩根士丹利為煤氣的財務顧問。 百仕達（1168）系內三家公司上周五停牌，當時已傳出煤氣有意購入百江股權。百江停牌前報3.96元，該公司向煤氣發行新股的價格，較停牌前收市價有5.56%溢價。除10個項目外，煤氣還將該批項目涉及約5.68億元股東貸款轉讓予百江。煤氣將申請清洗豁免，避免向百江小股東提出全面收購，百江將舉行股東大會讓股東表決。  值得注意的是，原持有百江6.12%的和黃，於停牌前兩日悉數將所持股份以平均價每股3.55元售予惠理基金。和黃02年5月以每股3.25元購入3846.15萬股百江，賬面賺1153.85萬元，回報率約9%。百江今天復牌。
20061204-308,20061204,308,新濠分拆博亞賺27億,新濠分拆博亞賺27億 【本報訊】新濠國際（200）就旗下新濠博亞發行美國預託股份，分拆在美國納斯達克上市事宜，昨日向股東刊登通函。據新濠董事會估計，分拆新濠博亞上市，將可錄得22.87億至27.14億元賬面收益。市場消息稱，新濠昨日就分拆新濠博亞上市事宜在港進行機構投資者推介。  通函亦首次披露，新濠博亞將經營豐德麗（571）位於澳門路氹影城度假村項目──MacauStudioCity內的賭場，該項目預計09年開業，新濠博亞將可攤佔其內賭場所賺取博彩收入的一定比例，具體數目待定。  現時新濠博亞由新濠及澳洲娛樂公司PBL各佔50%，根據新濠早前公告披露，該公司計劃發行經擴大股本約10%至17.5%股份後，新濠及PBL在新濠博亞的持股量將降至介乎41%至45%。 集資淨額65億 據昨日的通函披露，新濠博亞上市集資淨額65.68億元，以此計算，新濠手上的新濠博亞賬面值將由預期約37.86億元增至60.73-65億元，故出現22.87億至27.14億元視作出售股份的賬面收益。  另外，新濠攤佔新濠博亞的虧損亦因持股量減少而削減。根據獨立財務顧問英高的函件指出，截至05年12月底及今年9月底止，新濠博亞淨虧損分別為330萬美元及1760萬美元。由於新濠博亞不再以新濠附屬入賬，其負債亦不用計入新濠賬目內，新濠預期資本負債比率將由去年底的31.2%降至16.6%-17.8%。獨立財務顧問英高認為，分拆條款屬公平合理，符合股東利益，故建議股東贊成分拆。 高盛調降評級 雖然分拆新濠博亞正在進行，但新濠股價偏軟，昨收報21.3元，跌4.27%。高盛證券發表報告，將新濠投資評級由買入下調至中性，但維持目標價22.5元。高盛指出，自3月該行將新濠投資評級調高至買入後，新濠至今已升93%，上周五收市價22.25元已距離目標價不遠，除非新濠博亞在美國上市後股價顯著造好，才能支持投資者繼續買入新濠，但高盛稱，仍看好新濠在澳門的博彩業務。
