key,date,article_daily_id,title,text
20060209-66,20060209,66,健康地帶：便當要雪藏吃前須徹底翻熱,健康地帶：便當要雪藏吃前須徹底翻熱 便當，這個小小的盒子，滿載媽媽無盡的心思、女朋友無限的愛意、婆婆的細心體貼。吃一個便當，不但能果腹，更是給心靈上的一點安慰。  自製的便當，除可配合個人的口味及對食物的喜好外，相比起出外進食高脂、高鈉的食物，油份及調味可控制得更好，所以也會更健康。一個營養均衡的便當，五穀（即飯、麵、意粉等）應佔整個餐盒容量的一半（約一碗至一碗半）；而蛋白質類（即鮮肉、魚、豆腐、蛋等）佔四分之一（約半碗）；而蔬菜則佔餘下的四分之一（約半碗至一碗）。如在飯後加一個飯後果，就更均衡完美了。  自製便當雖然會較外出飲食健康，但如儲存或處理不當，隨時會成為食物中毒的陷阱。由於細菌最容易在四度至六十三度的溫度滋生，所以所有熟食均不應存放於此溫度範圍內超過四小時，否則必須棄掉。 飯及餸汁宜分隔存放 因此，未進食前，最好把便當雪藏於四度以下，上班途中最好用保溫或保冷袋保存。市面上推出了很多保溫功能良好的真空飯壺，保溫功能可長達六小時，但為衞生起見，回到公司後最好還是把便當雪藏，進食前以高溫徹底翻熱，即可吃得健康又安心！飯及餸汁也最好分隔存放，這樣，可以保持飯粒更乾身，口感更好。  撰文：米施洛營養護康中心營養師麥美芝  原文可於以下網頁瀏覽：www.mslhk.com  逢周二至五刊登
20060209-67,20060209,67,嫁娶過大禮利是代生雞,嫁娶過大禮利是代生雞 【本報訊】禽流感襲港，不但影響雞販的生意，亦令傳統用生雞來招魂及作結婚過大禮的文化，可能因新例嚴禁散養雞而絕迹。有大妗姐索性改以紅包封利是取代生雞，以保留大吉大利的意頭。 公雞奔走帶旺墳地 負責替交通意外死者進行追魂及殯儀的普渡苑老闆吳厚福表示，以往會以生公雞作「招魂雞」，進行招魂或殮葬儀式。如在意外中身亡的死者，主持人會將公雞倒吊，掛在死者的衣服上進行招魂，寓意將死者的亡魂招到公雞上，令他們可順利走進陰間。  至於進行殮葬儀式時，殯儀業界亦會帶備生公雞到下葬的地方，讓公雞四處走，以帶旺該處地方。主持人一般於儀式進行後，不會捉回生雞。他說水上人、客家及圍村人，比較習慣以這種傳統招魂，惟現時禽流感再現，業內人士亦無法買到生雞，而為安全計，亦必須暫停這種招魂方式。忠誠殯儀代表陳雄標指，招魂雞是道教、佛教慣用招魂的儀式，和合石及將軍澳墳場常見。  負責舉辦婚嫁儀式的英姐說，自禽流感爆發後，港人已不敢於婚嫁儀式中交換生雞公、雞乸，並改以利是上寫上雞代替。她說，按傳統習俗，以前娶妻的男方需自備兩對生雞公、雞乸送給女方作過大禮，女方會將其中一雙回給男方，以取「生生猛猛」的意頭。
20060209-68,20060209,68,台灣發現三款　一款本港有售卓悅回收致癌唇膏,台灣發現三款　一款本港有售 卓悅回收致癌唇膏 【本報訊】塗唇膏是不少女士們每天的例行動作，但台灣當局發現，三款唇膏含致癌重金屬「鎘」，其中一款在港有售，本港卓悅化妝品連鎖店昨日即時回收。該三款唇膏的鎘含量雖未超標，但本港消費者委員會及醫學界，都呼籲女士們小心選擇，以免長期吸收唇膏內的化學物質，影響健康。　記者：翁煜雄 台灣消費者文教基金會抽驗四十三款唇膏，該會《消費者報導雜誌》副社長李哲瑜表示，抽驗結果發現「BOB保濕口紅」、「HOT水漾晶涷口紅」及「LCHEAR水凝合濕口紅」均含微量鎘，但未超出每公斤最高含量20ppm的標準。 鎘會破壞肝腎功能 但他說鎘是電池、染料與合金中最常見的重金屬，可經口或鼻進入人體，並堆積在肝和腎。長期食入低劑量鎘，會導致腎小管損傷，並使骨骼變脆易斷，世界衞生組織也已將鎘列為致癌物。該會建議女士們小心選擇唇膏，以免因長期使用而致癌。  台灣衞生署藥政處處長廖繼洲卻說，一般人塗唇膏時，每天使用唇膏量約為0.1cc，就算連續使用五十年，也只接觸2ppm重金屬，「所以塗一輩子都很安全！」  本港卓悅化妝品店亦有出售「HOT水漾晶涷口紅」。該店發言人說，昨已即時回收，而迄今透過五間分店共售出三十多支HOT唇膏，顧客可退回貨品。  本港消費者委員會副總幹事劉燕卿表示，該會有參考國際標準監察唇膏含鎘量，早前抽查本地唇膏均無發現問題。她說，不建議女士們長期使用被驗出含鎘的唇膏，該會將跟進並再抽查市面唇膏。海關表示會密切留意情況，並強調在港出售的化妝品，需符合消費品安全條例。  家庭醫生關嘉美解釋，長期吸收鎘或會導致牙齒轉黃，肝、腎功能遭破壞，而鎘亦被認為可能會引致肺癌及前列腺癌。她說女士進食前應抹去唇膏，減少影響，「唇膏有色素同化學物，食咗點都唔好！」
20060209-69,20060209,69,情人節鮮花銷情料增三成,情人節鮮花銷情料增三成 【本報訊】與愛侶慶祝情人節，少不了一束鮮花。玫瑰一向是眾人首選，除了鮮紅及香檳色等較傳統的顏色外，今年亦有紫色、綠色配粉紅色等玫瑰，由於色彩特別，價錢也較昂貴。有花商表示，不少男士都願意用數千元買花換取情人一笑，今年情人節的鮮花銷量料將比去年增加兩至三成。 貨源有限訂花趁早 花店GaryKwok負責人Gary表示，今年情人節銷情理想。以往不少男士買花欠缺心思，通常要求花店東主出主意，但今年則一改習慣，「男士們多咗心思，會主動講吓想點配搭。」  她又指，男士們今年比去年捨得花錢，多不吝嗇購買一束一千多元的鮮花。  Gary指，玫瑰一向是情人節的代表花，當中尤以紅玫瑰最受歡迎，其次便是鬱金香，但今年有新引入的紫玫瑰。八款情人節花束的售價，由七百八十元至二千三百八十元不等。  AnterraFlorist負責人Clifford亦表示，該店今年引入雙色玫瑰，包括粉白色、配以紅色邊的玫瑰，及由翡翠綠、粉紅色組成的玫瑰，每支約九十元。他說，由於貨源有限，故訂花要趁早，「否則好難攞齊合心水嘅花。」  香港鮮花零售業協會主席謝黃小燕預計，今年情人節鮮花的銷量會比去年增加兩至三成，價格也會較平日上升最多五成；她建議，男士們若嫌玫瑰昂貴，可考慮選購鬱金香，但鬱金香盛放的日子比較短。  另外，商務印書館也於今年首創情人節訂花速遞服務，由即日起至本周六到商務全線門市（地鐵分店及大學店除外），訂購鮮花束及金莎束，對方將於情人節下午五時前收到鮮花。同時，市民也可用八折優惠選購圖書，連同訂購的花束或金莎束一起速遞到情人手中。
20060209-70,20060209,70,酒店套房半價搶情侶客,酒店套房半價搶情侶客 【本報訊】情人節臨近，各酒店紛紛推出情人節晚餐及住房計劃。香港洲際酒店除了近十七萬元的超豪總統套房套餐外，並推出情人節優惠住宿計劃，客人用低至六折的價格，即可入住行政人員花園海景套房及行政套房等。酒店公關及傳訊經理傅嘉恩表示，「好似行政人員花園套房一晚租金原價四萬五千元，優惠價二萬七千元。」她補充說，住客在情人節期間亦可以低至近半價享用水療設施，包括私人水療按摩房、香薰按摩及面部護理等。 坐直升機遊覽維港 至於半島酒店也不甘示弱，推出三日兩夜的半島至尊體驗，入住總統套房及坐直升機遊覽維港一周，共需十一萬元。酒店發言人表示，情侶可以選擇入住半島的套房或花園套房等，首日可以在房內享用燭光晚餐及欣賞爵士樂或弦樂演奏；另外，又可選擇私人太極班或個人健身訓練，「客人可享受三十分鐘直升機遊維港，再乘坐勞斯萊斯離開酒店。」  另外，旺角朗豪酒店推出「TopoftheWorld」情人節住宿計劃，情侶可入住總統套房「ThePenthouse」，享用由行政總廚親自負責的八道菜情人晚餐，並享兩小時水療健體中心療程。
20060209-71,20060209,71,五成車主因貴油改搭公共車,五成車主因貴油改搭公共車 【本報訊】油價不斷飆升，一項調查發現，全球車主均因油價上升而苦不堪言，有八成二的車主指油價上升增加了他們的日常開支。近五成的本港車主因此改搭公共交通工具、三成的車主寧願減少駕駛，以減輕油價的負擔。  AC尼爾森於去年十一月進行一項網上調查，訪問了全球四十二個國家超過二萬三千五百名消費者。調查中有七成網民擁有私家車，車主中八成二人感到油價上升令他們日常開支增加。 改買新款車輛 而在本港的受訪者中，無論是否車主，港人均認為油價上升會增加他們的開支，消費者最常用的抗「貴油」策略是「改乘公共交通工具」、「減少駕駛次數」和「減少其他非必要的生活開支」。  同時，有百分之九的本港受訪者，改購買新款車輛來省油；亦有受訪者與別人共享一架車輛，以省卻金錢。  香港AC尼爾森董事總經理陳映芳表示，由於本港的交通工具網絡較完善及地點較集中，市民受貴油的影響較其他國家少，香港人更可以步行取代駕車。
20060209-72,20060209,72,商場展八呎水晶玫瑰,商場展八呎水晶玫瑰 由即日起至本月十八日，一日內在又一城兩間不同店舖，消費滿一千元或以上，可憑即日收據換領「浪漫玫瑰園」優惠券一張。「浪漫玫瑰園」是由九百九十九朵紅玫瑰組成，園中放置一朵價值港幣一百萬元、由十三萬九千九百九十九顆Swarovski水晶製成的八呎巨型水晶玫瑰花，持優惠券的戀人可在園內合照。
20060209-73,20060209,73,兩油公司減柴油價格,兩油公司減柴油價格 蜆殼及加德士宣布，即日起調低車用柴油價格。蜆殼「清爽」環保柴油每公升減價一角，連稅後的最新價格是八元一角六仙；而加德士的超低硫環保柴油的最新價格是八元一角七仙。兩間油公司都表示，柴油入口價近日漸見回落，因此作出減價決定；油公司將密切注視市場走勢，在適當時候再作調整。
20060209-74,20060209,74,貧婦初為人母　無錢買嬰兒奶粉,貧婦初為人母　無錢買嬰兒奶粉 二十三歲的阿詩，上月底臨盆在即，丈夫遭逢失業。現時她連奶粉及尿片錢也要向人賒借，一家三口生活彷徨。  阿詩表示，還未替出世兩周的兒子改名，目前最彷徨是籌措生活費，「生完BB之後，我老公又冇工開，好擔心之後嘅生活，周圍向人借已經借到盡，屋企人都唔可以幫到幾多。」望着枱上只剩下一罐奶粉，阿詩正惆悵如何籌錢買奶粉。 難再靠賒借度日 「佢好大食㗎！一出世就食四安士奶，一罐奶粉五日就食完。尿片就三、四日用一包，養BB真係唔易，『皮費』好貴。」雖說生活擔子沉重，但每當望着愛子，剛為人母的阿詩便不期然展露一絲慈母的笑容。  曾任職侍應的阿詩，一年前修讀美容課程，修讀課程期間懷有身孕，但她仍盡力完成課程。 夫做散工剛失業 現已考獲一紙美容證書的阿詩，暫時仍需在家休養，她計劃稍後將會找工作幫補家計。  記者探訪當日，阿詩的丈夫正出外找工作。阿詩指丈夫任職運輸散工，收入不穩定，即使有工開，每月只得四千元左右，要擔起一家三口的生活實在難捱。  「如果佢要轉行，又唔知做得啲乜，好難有人請。」阿詩目前最大的期望是：「希望經濟好啲，BB都可以食飽啲！」  蘋果日報慈善基金了解過阿詩一家三口的生活苦況，即時撥款五千元，助其購買嬰孩的奶粉及尿片等必需品。  捐款編號：C1930    服務熱線  電話：29908288  傳真：23702192  電郵：sservice@appledaily.com
20060209-75,20060209,75,單親三母子　瀕臨斷炊困境,單親三母子　瀕臨斷炊困境 三十五歲的單親婦阿恩與兩名兒子相依為命，近日其患哮喘病的六歲幼子明仔因身體不適，多次尋求中西醫治療，致經濟拮据，一家正面臨斷炊，蘋果日報慈善基金即時撥款給她，以解燃眉之急。  日前，記者到訪阿恩家中，談及明仔的病況，身兼父母職的她，顯得憂心忡忡：「早排過年，囝囝個肚突然好痛、好唔舒服，惟有即刻帶佢搭的士趕去睇醫生；呢幾日佢突然發高燒，周身唔舒服，又再帶佢睇醫生。呢排淨係搭車來來回回加埋睇醫生都唔少錢，𠵱家一來擔心囝囝健康，二來又擔心屋企冇錢開飯。」 子醫藥費加重負擔 阿恩曾從事文員，婚後留在家中相夫教子。數年前夫婦仳離，自此阿恩獨力照顧兩名現年分別六歲及十三歲兒子，三母子靠領取綜援金維生。每逢假日，阿恩只會帶孩子到就近公園遊玩，享受親子樂。  阿恩表示，幼子明仔自出世後罹患哮喘病，須長期服藥及覆診，控制病情。近日，體弱的他，經常發燒及感冒不適，阿恩除了疲於帶兒子求診之外，亦為支付其醫藥開支，致經濟陷困。  為了節省開支，連日來，阿恩母子只以白粥、即食麵、清菜和番薯果腹，境況堪憐，她歎道：「咁多年慳慳哋，勉強應付到兩餐，但想儲多個錢根本好困難，所以囝囝睇醫生嘅錢全部喺買餸錢度拎出嚟，𠵱家連兩餐都成問題。」 蘋果基金撥款應急 為了生計，阿恩曾向家人籌措，惟他們本身亦自顧不暇，刻下，阿恩正為母子的伙食憂愁，蘋果日報慈善基金有見她的苦況，即時撥款二千元，助她應付短暫生活急需。  捐款編號：C0770    服務熱線  電話：29908288  傳真：23702192  電郵：sservice@appledaily.com	
20060209-76,20060209,76,獨居病婦　獲善長送贈電視,獨居病婦　獲善長送贈電視 四十四歲獨居婦阿莉，家中欠缺電視機，遂致電蘋果日報慈善基金求助，她的需要經報道後，即獲讀者送贈一部十四吋的新電視機給她解悶。  日前，記者再次探訪阿莉，她正在觀看電視節目，不愁寂寞。 「屋企多個朋友」 阿莉喜孜孜地說：「以前屋企冇電視機，每晚坐喺度都唔知點打發時間，但自從有咗部電視機之後，可以隨時睇電視劇集、新聞報道，生活冇咁悶，好似屋企多咗個朋友，心情都開朗啲。」  阿莉早年與丈夫仳離，她曾從事散工，並租住狹小板間房。數年前，醫生證實背部腰骨勞損，另其雙腳膝蓋生長骨刺，現須每周前往醫院進行物理治療，紓緩痛楚。  近年，阿莉亦患上精神病，須長期服藥及覆診。她現靠綜援金及傷殘津貼維生。  月前阿莉獲房屋署編配旺角區公屋，由於她是傷殘人士，獲社會福利署發放搬遷津貼，但有關資助僅足以支付一筆搬遷費，難有餘錢購置基本家具，早前她喜獲社工轉送二手衣櫃及枱櫈，應付生活需要。  阿莉表示，希望腰骨的痠痛盡快痊癒，然後再找工作幹活，此外，樂於助人的她，亦不時到社區中心做義工服務，回饋社會。 腰痛痊癒再工作 「呢次搬屋好彩有社工同埋你哋《蘋果日報》幫忙，雖然我冇能力捐錢幫人，但𠵱家我一得閒會去做義工，探訪公公、婆婆，希望將啲歡樂帶畀佢哋。」阿莉由衷表示。  捐款編號：C1887    服務熱線  電話：29908288  傳真：23702192  電郵：sservice@appledaily.com	
20060209-77,20060209,77,蘋論：政府還當立法會是夥伴嗎？ - 盧峯,蘋論：政府還當立法會是夥伴嗎？ - 盧峯 若果特區政府真的視立法會為施政夥伴，那特區政府的高層官員包括政務司司長及其他主要官員自然應該樂意到立法會解釋政府的政策、自然應該踴躍到立法會回應議員的意見及訴求。事實卻不是這樣。  立法會成立的西九龍文娛藝術區發展計劃小組委員會好不容易花了超過一年時間，召開了二十多次會議，又到西班牙畢爾包進行實地調查研究才完成了一份詳細的研究報告，就西九龍發展計劃提出多項不同意見；這樣份量十足的報告，理應受到特區政府的重視、理應得到特區政府高層官員的積極回應。只可惜負責西九龍發展計劃的政務司司長許仕仁先生只是簡單的以沒有新資料提供為理由就拒絕出席上星期的小組會議及回應報告；而在昨天當立法會全體大會正式就報告作辯論時，許先生更選擇了避席、更選擇了缺席。像這樣的表現、像這樣的態度，怎能顯示政府重視立法會的工作、怎能讓人感到政府真的把立法會當成夥伴呢？  事實上許先生以無法提供更多資料為理由拒絕出席立法會會議是荒謬及沒有說服力的。首先，出席會議的目的是回應立法會小組報告的建議而不是提供甚麼新的資料，只要許先生及他的幕僚仔細看過小組的報告就能夠對報告作直接的回應、就不難點出報告有甚麼不足之處、就不難說明報告的建議跟政府的規劃如何不相容，偏偏許先生卻選擇迴避。難道許先生連報告也沒有仔細看過？難道許先生認為報告太差不值得回應？ 而且，重複一貫的政策、重申原來的立場是政府官員的慣技，也是經常出現的情況。不管是在立法會的政策委員會或特首的答問大會上，特首或主要官員經常都只是闡述政府既有的政策，真正提供新資料或新政策方向的反而不多。若果按照許先生、許司長的說法，特首及其他主要官員不是可以隨時因沒有「新料」公布而拒絕出席立法會會議或答問大會嗎？若果特首及主要官員可以隨意選擇不出席立法會會議的話，立法會怎能正常、有效運作呢？  毫無疑問，立法會西九龍文娛藝術區發展計劃小組委員會提出的建議跟政府一直以來的構想、跟政府一直以來的規劃有很大差距，但是議員的不同意見絕不意味他們故意為難政府、絕不意味他們的做法「過晒界」；小組報告反映的是社會不同黨派、不同階層人士對西九計劃的另類看法、另類構想；只要聽聽昨天立法會辯論時議員的發言，就可以清楚知道各主要政黨對政府的西九計劃有這樣那樣的擔憂及顧慮。面對這種強烈的不同意見，特區政府高層該做的是小心聆聽立法會小組提出的意見，盡力回應小組提出的質疑，詳細解釋政府的方案為何較小組的建議更優勝。只有透過認真的對話及溝通、只有透過耐心的解釋，雙方的差距才有可能縮小、雙方的分歧才可能收窄，從而令西九計劃能盡快上馬。偏偏負責計劃的政務司司長許仕仁先生卻連直接回應及溝通的工作也不願做、也要迴避。這不是在為西九計劃製造更多障礙、為行政立法關係製造更多麻煩嗎？
20060209-78,20060209,78,福建農婦染H5N1距港愈近,福建農婦染H5N1距港愈近 【本報訊】福建再有人感染禽流感，中國國家衞生部昨晚通報指，福建漳浦縣確診一宗人類感染高致病性禽流感病毒的病例，患者是一名二十六歲女農民，目前病情穩定。本港衞生防護中心已接獲內地通報，有傳染病專家擔心禽流感與本港距離愈來愈近，市民應提升預防意識；而禽流感已席捲全球，就連非洲也失守。 未透露是否接觸禽鳥 昨日新確診的女患者姓林，居住在福建省漳浦縣，上月十日發病，出現發熱、肺炎病徵，經福建省疾病預防控制中心及中國疾病預防控制中心檢測後，證實感染H5N1禽流感病毒，接受治療後，目前情況穩定。至於患者如何受到感染及病發前是否有接觸過禽鳥，當局則未有透露。  據了解，當地衞生部門已採取相應的防控措施，並對曾與患者有密切接觸的人士進行嚴密醫學觀察，暫未發現其他異常個案。漳浦縣獸醫部門指，當地未有發現動物感染禽流感的疫情。這次是福建第二宗人類感染個案，去年十二月在福建三明市確診的四十一歲女工，因感染禽流感病發身亡。  自去年十一月湖南省確認首宗人類感染禽流感病例以來，內地迄今共發現十一宗人類感染病例，其中七人死亡。  此外，世界動物衞生組織（OIE）昨日證實，非洲尼日利亞北部地區一批家禽染上H5N1病毒，已與世界糧農組織（FAO）派出的專家前往調查。 禽流感證實殺到非洲 此外，伊拉克南部一名十四歲鴿子小販，周日也懷疑死於感染禽流感病毒。香港大學微生物學系禽流感專家管軼數個月前曾表示，若歐洲爆發禽流感，非洲也不能倖免。該系助理教授黃世賢認為，福建再有人染病，顯示禽流感與本港距離愈來愈近，並質疑為何今次同樣只有人類感染個案而未有禽鳥疫情出現。
20060209-79,20060209,79,蘋論：西九龍是大政府利益輸送 - 李兆富,蘋論：西九龍是大政府利益輸送 - 李兆富 孫明揚在立法會說︰「政府推展西九計劃的政策目標，是發展一個世界級的綜合文娛藝術區，豐富市民的文化藝術生活，創造就業機會和促進旅遊事業發展。」特區官僚究竟要到甚麼時候才會放棄「假大空」，踏實一點應該做的事？  當年政府將數碼港吹捧上天，結果今天這個水盡鵝飛的空殼究竟為香港貢獻過甚麼？除了附帶的豪宅可能讓少數幸運的投資者發了一筆小橫財，數碼港只不過是一個未能令特區政府清醒的教訓。若官員對「假大空」仍然有遐思，應該找個工作天的下午到數碼港走一趟，在那冷清清廣場大聲朗誦當年甚麼創造就業機會豪情壯語，任何一個知廉恥的人這一刻都會頭皮發麻。數碼港的教訓香港人是歷歷在目，官僚現在硬銷「假大空」的西九龍，將翻版數碼港模式說成世界級的綜合文娛藝術區，不是侮辱香港人的智慧是甚麼？  更根本的問題是，為甚麼香港要以耗費巨額公共資源，去興建一個甚麼文娛藝術區？為了創造就業機會？這種謊話香港人聽得太多。  當年政府亦說興建迪士尼期間會創造成千上萬的建造業職位，但數據卻反映建造業失業情況完全沒有改善，可惜香港人已經白白浪費了上百億的公共資源。我們必須明白，這些資源本來是可以用在教育醫療等長遠項目，現在香港人的血汗錢卻用來補貼跨國財團。  官僚可以找出一個理由說服香港人，為甚麼要以上千億的公共資源來津貼三家入圍財團嗎？從三家入圍財團的反應，政府建議的西九發展模式絕對是一個牟取暴利的黃金機會。就算完全不了解香港地產市場的人都知道，發展商有興趣的只是項目中的商業及住宅部份，至今甚麼文娛藝術區只不過是得到這塊便宜地的手段。試問這種情況下，發展商會有心好好建設經營那個甚麼文娛藝術區嗎？ 特區官僚現在慷他人之慨，以香港珍貴的土地資源，換取一個沒有市場價值的文娛藝術區，這樣操守就是強政嗎？反過來說，若官僚辯稱文娛藝術區有它的經濟價值，那事情就更加簡單，政府既然承認官方沒有辦理文娛藝術設施的能力，乾脆將規劃作文娛藝術區的土地拍賣，讓發展商自行建設經營。事實上，政府亦應該擁有的所有表演場地和博物館讓民間去運作，像孫明揚所說︰「引進市場上的資源，原創性及創新概念……切合市民和香港需要。」  若特區官僚明顯是從心底信奉自由市場的一套，事情的發展次序應當是先民營化所有政府擁有的表演場地和博物館，然後再以最直接的方法拍賣文娛藝術區的土地，讓發展商去處理餘下的問題。至於甚麼商業和住宅區，香港早已有一套行之有效的制度去拍賣土地，又何必再無中生有來這個西九龍綑綁？  官僚在西九事件上思維邏輯有太多犯駁之處，愈說得多，利益輸送便愈見明顯，特區亦明顯完全離棄小政府原則。所以請官僚不要再將「假大空」和市場拉上關係，免得日後黑狗偷食白狗當災。
20060209-80,20060209,80,尊子江湖滾熱辣,尊子江湖滾熱辣
20060209-81,20060209,81,李八方隔牆有耳：,李八方隔牆有耳：  傳真︰2623-9278  電郵︰pf_lee@appledaily.com
