key,date,article_daily_id,title,text
20060815-0,20060815,0,泥頭車汀九橋捱撞安全帶斷了　司機飛出車慘死,"泥頭車汀九橋捱撞 安全帶斷了　司機飛出車慘死 【本報訊】一輛泥頭車昨在荃灣汀九橋，遭突然爆胎失控的貨櫃車狂撼車尾，泥頭車車頭猛撞路中石壆及燈柱，司機座位的車門及安全帶同被扯斷飛脫，車門打中尾隨車輛，引致兩車相撞。泥頭車司機則被拋出車外，左腳斷開斃命，貨櫃車司機則受傷送院。意外後汀九橋出九龍方向全線封閉達五小時，交通大受阻塞。　記者：張培生　吳國威　潘志能 車禍中慘死的泥頭車司機何日強，54歲，居住在李鄭屋邨禮讓樓一單位，妻子於三年前患乳癌去世，一子一女均已長大成人，各自有家庭。何駕駛泥頭車已有十多年，是出事泥頭車車主。昨上午11時15分，何日強正駕着沒有運泥的泥頭車，沿青朗公路出九龍，豈料在駛至汀九橋時遇上車禍。 貨櫃車爆胎失控衝前 現場汀九橋出九龍線共有四線行車，扣除左一線往大嶼山迪士尼樂園，另三線出九龍。事發時，一輛貨櫃車拖頭拖着40呎的空拖架，由43歲姓姚司機駕駛，沿出九龍三條行車線的慢線行車，而泥頭車則隔着中線在快線同方向出九龍。據目擊者稱，事發前，泥頭車剛從快線切入中線行車；就在此時，貨櫃車的右前車胎突然爆裂，貨櫃車隨即搶右軚由慢線滑向中線，衝前並狂撼泥頭車車尾。  貨櫃車在撞車後，姓姚司機馬上扭左軚修正，全車即越過慢線掃毀一列防撞欄，沿斜坡滑行20米衝落北岸公路停下，幸當時北岸公路沒有汽車駛至，貨櫃車司機僅受輕傷。然而，泥頭車被撞後衝過快線，猛撼分隔來回行車線的石壆及一支燈柱，燈柱被撞致搖晃不定，燈泡墮下，石壆碎裂。由於撞力相當猛烈，泥頭車車頭損毀嚴重，右邊車頭連同部份引擎零件被削開，車門飛脫，原本扣在司機身上的安全帶亦被扯斷，整部泥頭車再向前打轉及衝行了25米始停下，泥頭車車頭毀爛，頓成廢鐵。 司機左腳撞石壆斷掉 意外中，泥頭車司機因為安全帶被扯斷，整個人被拋出車外，左腳首先撞向石壆，當場斷開飛脫，身體則倒在對面行車線上，重傷昏迷。同時，泥頭車的車門飛脫，擊向車後一輛貨車的擋風玻璃，其尾隨的客貨車則收掣不及，撞向貨車車尾，此兩車則無人受傷。  救援人員接報到場拯救傷者，斷腳泥頭車司機被送院急救，惟已證實不治；貨櫃車司機經治理後情況穩定。警方即時將汀九橋出九龍方向全線封閉，另外對面入新界方向亦封閉兩條行車線。 安全帶可受力1500磅 政府化驗師及鑑證科人員奉召到場協助搜集證據，現場交通大受阻塞，至五小時後各輛肇事車輛被拖走後現場解封，交通才回復正常。  此宗意外已交由新界南交通特別調查隊調查，警方呼籲目擊者或有任何資料提供人士，致電36611300與警方聯絡。  對於今次因安全帶被扯斷，司機拋出車外慘死。理工大學機械工程學系工程師盧覺強表示，一條合規格的安全帶可承受1,500磅力，因此司機在扣緊安全帶後，理論上即使遇上意外亦沒有足夠衝力扯斷安全帶，令司機拋出車外。  盧指出，意外中安全帶被扯斷，估計由於尼龍帶遭刮花、磨蝕所致。他呼籲所有司機在開車前，除了要扣安全帶外，同時應檢查妥當安全帶是否穩固，如發現有問題應即時更換。"
20060815-1,20060815,1,出身名門祖父創辦廣生行,"出身名門祖父創辦廣生行 立法會秘書長馮載祥出身名門望族，祖父馮福田是香港老字號「廣生行」創辦人，其「雙妹嚜」牌子的產品，如花露水等，至今仍廣為人熟悉。  馮載祥在香港大學畢業後未有接手家族生意，加入政府做官，仕途一帆風順，曾為訪港英女皇和英國前首相戴卓爾夫人當傳譯。93年任工業署副署長時，轉投脫離政府架構的港英立法局秘書處，獲聘為秘書長，其間經歷97回歸，一做就是13年。 曾與許冠傑夾band 馮載祥在立法會擔當大管家角色，掌管立法會秘書處，也是立法會主席左右手；當每隔四年改選立法會後，主席人選未定，首次會議便由秘書長主持。立法會秘書長薪酬相等於政府首長總薪級第六級（D6），月薪約162,000元，由於職位屬合約制，三年合約屆滿可得逾百萬元約滿酬金。此外，秘書長還可以使用車牌「LS2」的專車代步。  熱愛音樂的馮載祥讀書時喜愛「夾band」，曾與歌神許冠傑夾過band，更在一個歌唱比賽中與歌神「拗手瓜」。馮在舞會邂逅妻子馬潔嫻，之後結婚誕下兩子女，馮妻是公關界名人；夫婦今年四月更榮升外公及外婆。另外，馮載祥亦熱愛養馬，在馬會養有的馬匹包括「哈哈霸」。"
20060815-2,20060815,2,木受潮發霉生蝨,木受潮發霉生蝨 熟悉裝修用料的「設計情報中心」設計師陳禮善指出，每年潮濕天氣，木材偶有發霉，不過他稱，近這兩、三個月最嚴重，行內收到的投訴也增多，「我哋初步估計可能同國內進口，又或控制潮濕嘅工夫冇做得咁好有關，加上部份木材採用環保物料，即甲醛量低，防蟲功效亦少咗。」  陳禮善續說，木材浸過水或者受潮，就容易發霉，及孳生「傢俬蝨」。若廚房多水喉及濕度高，應採用防潮板或夾板。至於廚房地櫃的地台可採用金屬腳「墊高」，避免用木方而受潮發霉，「呢啲係製造嘅問題，又或者考慮到工程造價。」 另外他估計，除潮濕環境外，可能因施工時間趕急，牆身或地面未亁透已經嵌櫃，令到原本無事的木材被濕氣焗住而發霉。  
20060815-3,20060815,3,截濕水源頭防治,截濕水源頭防治 從事滅蟲行業的香港殺蟲業協會理事陳澤森表示，在潮濕地方或受潮木材上生長的昆蟲，英文名為pillbugs，如藥丸般大小，與一般生長於污穢及多塵地方所孳生的蝨不同，其破壞力較弱，不過部份人可能因敏感而出現皮膚紅腫。  陳澤森稱，寄生在木材的昆蟲，於本港一年四季皆會繁殖，尤其夏天繁殖力更快。如要防治，除了使用適當殺蟲劑，更要截擊濕水源頭，如有發霉、發黑的木材，就要換走。  他補充，如被昆蟲或蝨咬至皮膚紅腫，可用清水及肥皂沖洗暫緩痕癢，不過每人的敏感反應不同，應向醫生求診。
20060815-4,20060815,4,商戶佔用公眾地方阻行人,商戶佔用公眾地方阻行人 香港街道狹窄，偏偏有不少商戶罔顧公德，將貨物枱椅擺放在公眾地方，阻礙行人出入，亦影響環境衞生。近日有讀者分別投訴九龍不同地點，有商戶霸路情況。  個案一：何先生不滿旺角廣華街一家茶餐廳，長期佔用附近公眾地方。「好多wargame友，經常都喺呢間茶餐廳聚腳，餐廳裏面唔夠位用，就將啲枱櫈長期擺晒出街，後巷仲衰，仲要嚟洗碗洗菜，搞到經過嘅人好唔方便，仲孳生蟲蟻惹老鼠。」  食環署回覆稱，接獲本報投訴後，即派員到現場視察，證實有關食肆佔用舖外行人路與橫巷，並已就此作出檢控。不過，食環署巡查附近地方後，並未發現蟲鼠孳生迹象。  檔案編號：0712043 三個月七宗檢控 個案二：讀者伍先生投訴稱，深水埗汝州西街與永明街交界行人路，常被大牌檔佔用。「呢度好多工廠大廈，食飯同下午茶時間都有好多行人，大牌檔為咗多做生意，成日將枱櫈擺出行人路，馬路邊又放滿貨物同單車，迫路人行出馬路，好危險啫！」  食環署回覆稱，一向關注上址熟食小販市場大牌檔造成阻塞的問題，過去三個月，已向違例大牌檔發出7宗檢控。經本報轉介伍先生投訴後，隨即再到上址巡查，發現有5間大牌檔造成阻塞，食環署已即時提出共5宗檢控。檔案編號：0712042  個案三：居於佐敦的房先生，不滿德成街一間超級市場，經常把大量貨物放在行人路上，阻礙居民出入。「我都明白佢哋要補貨，但都唔好堆晒喺條路，搞到人都行唔到！應該推入超市裏面。」  食環署回覆稱，曾派員到上址巡查，見該超市員工正在馬路上落貨，已即時勸喻負責人將貨物搬回舖內，以免造成阻塞。因有關問題涉及街道管理，故亦已將個案轉介予運輸署及警方跟進。  檔案編號：0707034
20060815-5,20060815,5,人搵工．工搵人女子欲轉職診所助護,人搵工．工搵人 女子欲轉職診所助護 香港基督教青年會長沙灣中心與《蘋果日報》合辦「人搵工工搵人」專欄，逢周二刊出，由香港基督教青年會長沙灣中心提供待聘者檔案，供僱主揀選合適員工。本欄歡迎僱主聯絡中心職員曾姑娘登記空缺或查詢。 電話：27088995 阿雯過去曾任職售貨員，欲轉行任診所助護，但因欠缺相關經驗，致令她在面試時多次碰壁，無功而回。她歎稱，除了欠缺相關工作經驗外，亦因為暑假期間多學生搵工，競爭較大，令她更感心灰意冷。她向記者表示，她考慮良久才決定轉職診所助護，故不會輕言放棄。「所以我仍然會繼續努力到勞工處搵工，唔放過任何一個機會。」 待聘人士檔案 檔案編號：329（阿雯） 性別：女  年齡：23  工作經驗：青年大使、售貨員  期望工種：診所助護、文具或精品店售貨員  居住區域：石硤尾  學歷：中五  專長/性格：工作態度良好、有責任心及勤力 檔案編號：330 性別：男  年齡：42  工作經驗：倉務  期望工種：倉務  居住區域：石硤尾  學歷：中三  專長/性格：懂普通話 檔案編號：331 性別：男  年齡：33  工作經驗：粵菜助廚  期望工種：助廚、廚房雜務工作  居住區域：荔枝角  學歷：中三  專長/性格：有責任心、耐性、刻苦耐勞
20060815-6,20060815,6,新聞資訊研究組酒後駕駛初犯可囚六月,"新聞資訊研究組 酒後駕駛初犯可囚六月 《道路交通條例》第39B規定，在道路上發生意外，警員可要求司機進行俗稱「吹波波」的酒精呼氣測試，若呼氣結果顯示司機酒精含量超過限度，即100毫升呼氣內有超過22微克酒精，警員可拘捕有關人士。警方發言人表示，在一般情況下，有關人士會在警署接受第二次酒精測試，若同樣超標就會被落案起訴酒後駕駛罪名，否則將視乎情況對有關人士作出口頭警告。酒後駕駛一經定罪，如屬首次犯罪，可被判罰一萬元及監禁六個月，再犯則可判罰25,000元及監禁三年。 酒精消化因人而異 全民健康動力主席勞永樂表示，酒精含量會隨時間、肝功能及新陳代謝而下降，但所需時間則因人而異，因此部份酒後駕駛人士即使在現場的呼氣測試超標，最後都可能毋須被起訴：「有時啲酒精可能已經消化咗、幾時做第二次呼氣測試，唔同嘅呼氣方法，都會對測試結果有唔同影響，所以結果有變唔出奇。」"
20060815-7,20060815,7,辯護律師不肯定審訊何時結束程翔今受審料刑期達八年,辯護律師不肯定審訊何時結束 程翔今受審料刑期達八年 【本報訊】代表資深新聞工作者程翔出庭答辯的廣東律師何培華證實，程翔案今天在北京開審，但未能肯定審訊何時結束。他透露，由於案件涉及國家機密，讓他代表程翔上庭答辯，事前須經國安部批准，他目前仍不能確定控罪會否成立。外界的看法則普遍悲觀，中文大學中國法制研究計劃研究員王友金表示，法院開審已代表有相當證據指控程翔，估計程翔的刑期可能長達五至八年。 長時間拘留違反程序 程翔目前聘請兩名來自廣東的律師代表答辯，其中一人是廣東環宇京茂律師事務所首席合夥人何培華。何的友人形容他為人正直、過往曾接辦一些維權案件及冤案，但不是被內地迫害的維權律師。被問及案件何時開審時，何培華昨表示，「香港報紙點講就係點講」，但他不知道審訊能否在兩天內完成。他又多番強調，由於目前正代理案件，所以不能接受採訪。  消息人士透露，程翔案今天將於北京市第二中級人民法院開審，預料周三將完成審訊，稍後才會公布判決。有線電視昨報道，法院外的通告欄仍未有相關公布，法院的檢察員接受訪問時態度惡劣，只對記者表示應向從廣東來的兩位律師及法院查詢，「我沒有義務答你。」  新加坡《海峽時報》記者程翔去年四月起，被內地指為境外機構擔任間諜而被拘留至今。雖然開審在即，香港各界繼續盡最後努力營救程翔，香港記者協會及民間人權陣線等團體將於今晚7時至8時，在中區遮打花園舉行燭光集會聲援程翔，並要求法院公平、公正及公開審訊程翔。民主黨副主席何俊仁昨去信特首曾蔭權，希望曾協助程翔平安返港及與家人團聚。 駐京辦不可派員聽審 熟悉內地法律的王友金表示，法院應有相當證據指控程翔，估計判刑已經有定案，審判只是形式程序，根據案情程度可能會判囚五至八年。他說，由於案件屬國家安全範圍，法院以閉門審訊無可厚非，雖然國安部長時間拘留程，已違反多項程序，但內地法制不健全，法院也不會因此判程翔無罪。  特區政府發言人則表示，非常關注程翔的個案，中央政府表明會依法處理案件，及充份尊重當事人在憲法下的權利，當局會繼續向程翔家人提供一切可行協助。據悉，由於案件屬國家安全，特區政府只擔當傳話人角色，甚至連特區政府駐京辦官員也不可以派員聽審。  網友對程翔案今開審議論紛紛。「車臣」在其雅虎網誌表示：「我唔知程翔先生有無偷國家機密……如果真係偷國家機密，點解唔早啲審，要等到一年後﹗」網友「非法移民」則要求案件公開審訊：「如果因為各種原因而閉門審判，無論佢有無做過，任何審判結果都是難以服人……」
20060815-8,20060815,8,連續五期頭獎懸空今六合彩獨中可得4800萬,"連續五期頭獎懸空 今六合彩獨中可得4800萬 【本報訊】7月份六合彩暑期金多寶開獎後，本月雖然沒有任何金多寶攪珠，但由於過去五期六合彩均無人命中頭獎，令多寶金額如雪球般愈滾愈大，今晚的多寶便累積至3,332萬，馬會估計如一票中頭獎，幸運兒將有機會獨得4,800萬彩金，將是香港六合彩歷史上第六大頭獎派彩。 延長售票至9時 這次六合彩連續五期無人命中頭獎，是本年首度出現，雖然如此，最近這三周，六合彩仍頻頻送出巨獎，事關自7月22日至本月1日，短短11日之內，已有三次的六合彩頭獎派彩超逾1,000萬，其中7月25日的暑期金多寶攪珠，頭獎更有三注中，每注派1,077萬，一次過製造了三位千萬富翁。今期頭獎一注中可贏4,800萬，彩金更為吸引，加上馬會近兩日在電視、電台大力宣傳下，預料會掀起投注熱潮。  為了疏導投注人龍，馬會特意將各項投注設施的售票時間，延長至今晚9時，攪珠則於晚上9時30分舉行，亞洲電視本港台將直播攪珠過程。  10號及1號開出次數最多  此外，數據顯示10號及1號是本年攪出次數最多的號碼，10號有20次，1號則有18次，可作為參考；而位於中環士丹利街10至12號的「中區」投注站，則最受幸運之神眷顧，由94年至今，已售出過31張六合彩頭獎彩票，單是今年頭六個月，這所投注站也產生過三位頭獎幸運兒，似乎真的風水特佳。"
20060815-9,20060815,9,赤鱲角「亞洲國際博覽館」發生慘劇逾噸鋼閘塌下殺人,"赤鱲角「亞洲國際博覽館」發生慘劇 逾噸鋼閘塌下殺人 【本報訊】啟用約半年的赤鱲角「亞洲國際博覽館」昨下午發生鋼閘「殺人」事件，一名尼泊爾籍保安員，在推動兩道前後接駁，底部嵌有滑輪的手動橫趟式大型鋼閘時，懷疑接駁位鬆脫，其中一道長約6米、重逾1000公斤（逾一噸）的鋼閘整幅塌下，保安員閃避不及被鋼閘壓住，10分鐘後由消防員救出送院，但傷重不治。　記者：李志強　周鴻熙 這是過去5個月來本港發生的第5宗鋼閘倒塌事件，過去4宗同類意外共釀成1死4傷。亞洲國際博覽館公共關係及傳訊經理陳建明昨天向本報表示，對今次事件深感遺憾，意外起因正由警方調查，館方向死者家屬致以深切慰問。  事件中的死者DamaiBishunPrasad，39歲，曾任啹喀兵，97年退役後轉任保安員，7個月前受僱於一家法資保安公司擔任總隊目，在赤鱲角國際機場展航路亞洲國際博覽館上班，負責巡邏任務。 保安拉閘　疑鋼閘出軌 據死者的同事向記者說，發生倒塌意外的鋼閘位於博覽館東面出入口，俗稱為「東閘」，上址是消防通道，平日不會打開，但由於昨天下午進行消防演習，所以需要開啟鐵閘讓消防車進入。  死者的同事稱，昨下午4時許，場館內的消防演習結束，Bishun在東閘拉動鋼閘，準備將大門關上，但其中一道長6米、高2.8米的鋼閘在路軌滑動至大門正中位置時突然「出軌」，整幅重約1000公斤的鋼閘向Bishun迎面砸去，他閃避不及，慘叫一聲後被鋼閘壓倒在地上。  現場消息稱，正在附近工作的6至7名保安員目擊事件後立即找來木方及鐵枝，合力搬動鋼閘，但由於鋼閘太重，數分鐘後仍未能將傷者救出，於是報警。 胸骨折斷　肺部被刺穿 據悉，一隊參與演習，事發時剛剛離開的消防員，接報後重返現場，消防員用油壓唧升高鋼閘，然後將壓在鋼閘下約10分鐘，重傷昏迷的傷者救出送院，但稍後證實不治。醫生初步檢驗，發現死者胸骨折斷，並刺穿肺部死亡。  警方初步調查發現，倒塌的鋼閘原本與另一道鋼閘接駁，意外發生時，兩道鋼閘互相扣住從門側拉出，懷疑兩道鋼閘之間的接駁位甩脫，導致其中一道鋼閘倒塌，警方將事件列作工業意外處理，通知勞工處人員到場調查。  死者Bishun與妻子育有一子兩女，保安公司職員事後接載他的妻子及長女往醫院認屍，妻子認屍後情況激動。保安公司職員表示，死者生前與妻兒居於元朗雞地，月入9,500元，是家中經濟支柱。"
20060815-10,20060815,10,新聞資訊研究組裝閘須做雙重保險,新聞資訊研究組 裝閘須做雙重保險 對於接二連三發生鐵閘塌下意外，有業內人士指出，現時的裝閘師傅愈來愈馬虎，可能是導致意外原因。裕景鋼閘中心羅先生表示，有經驗的公司一般會為鐵閘做足雙重保險：「鉸位淨係燒焊嘅話，一裂咗就好易甩，最好就係再鎖埋螺絲。如果個閘咁重，鉸位多啲就安全啲。」  東區醫院急症室部門主管劉楚釗稱，鐵閘擊中頭部可導致頭骨碎裂，或即時斃命；即使頭骨未裂，頸部神經亦有可能受創，即使救回亦可能四肢永久癱瘓；若只壓在胸部，亦會引致呼吸困難，數分鐘內便會窒息死亡。今次意外發生於赤鱲角機場的亞洲國際博覽館，這個耗資23.5億元興建的場館於去年12月正式啟用，是全球最大及最先進的展覽中心之一。
20060815-11,20060815,11,女子唱K飲酒疑遭落藥迷姦,女子唱K飲酒疑遭落藥迷姦 【本報訊】25歲女侍應與友人到卡拉OK消遣期間，飲下數罐疑遭人落藥的啤酒後，變得軟弱無力，迷糊間被初相識的男友人帶到時鐘酒店施暴，涉案男子被控一項強姦罪名，案件昨在高等法院開審。21歲被告謝海彬，無業，被控於去年10月6日，在旺角一間賓館內，強姦一名25歲女子。  任職侍應的女事主昨供稱，案發日晚上11時許，她相約女友人「B女」到旺角的Neway卡拉OK消遣，而「B女」帶同被告及另一名男友人到場，介紹予事主認識，他們一起唱歌、飲酒，事主亦由飲檸茶改為飲啤酒，當她飲下3、4罐啤酒後，感到十分暈眩，「唔係好似平時飲咗啤酒咁，覺得好攰、好暈唔清醒」，她懷疑曾遭人落藥。事主續稱，此時她找其男友人「爸爸」到來接她離開，被告隨即向她表示：「等我陪你落去，帶你去見爸爸啦！」處於迷糊狀態的事主覺得自己走進一房間內，被人拋在床上。 半裸逃出賓館房間 不久，事主感到被人脫去褲子，她於是死按住褲頭，被告用枕頭壓着她的頭，事主瘋狂掙扎，大叫「救命」，被告一手叉住她的頸，一手按住其大髀，將她強姦，事主期間高呼：「我唞唔到氣，窒息啦！」  被告完事後走進廁所，事主感到十分驚慌，走出房外到賓館的接待處，「佢（被告）走出嚟鬧我黐線，叫我着番條褲」，她很害怕，沒有理會被告，後來有個阿姐叫她入房着褲，她才驚覺自己原來沒有穿着褲子。事主指自己並非自願與被告性交。控方開案陳詞指出，涉案賓館的閉路電視顯示，事主與被告於凌晨1時半離開，當時事主軟弱地倚着被告，無力前行。其後事主報警，檢驗發現她身上多處有瘀傷，外陰亦有傷痕，警方在賓館撿獲染血枕頭及被告的手提電話，同日被告自首。  案件編號：HCCC18/06
20060815-12,20060815,12,索錢不遂　逆子揮刀揚言殺母,索錢不遂　逆子揮刀揚言殺母 【本報訊】曾犯事被判入沙咀勞教中心服刑的16歲少年，昨晨在葵盛西邨住所，疑向母親索錢不遂大發雷霆，竟向護母的胞姊動粗發洩，繼而從後箍着母親頸項及持𠝹刀指嚇，要脅喝道：「如果你（母親）再唔畀錢，我就殺咗你！」其胞姊聞悉恐釀倫常血案，大義滅親報警，由到場警員將頑劣胞弟拘捕。被威嚇母親事後返署助查，至於受輕傷胞姊則獲送院。 姊護母遭拳打腳踢 涉嫌刑事恐嚇及襲擊罪被捕的逆子姓鄧（16歲），與姓陳（43歲）母親及20歲胞姊，同住在葵涌葵盛西邨五座一單位。據鄧姊事後透露，胞弟之前因犯事，被判入大嶼山沙咀勞教中心服刑，至最近才刑滿返家團聚，豈料弟弟始終劣性難改，昨日再次犯事，更膽敢傷害家人。  昨晨10時許，鄧姓少年擬離家出外，於是向母親索取零用錢但被拒，雙方隨即發生激烈爭執。其間在房間內睡覺的鄧姊被吵醒，乃不值胞弟所為，憤而衝出護母及指摘對方，卻引起弟弟不滿，向她拳打腳踢。混亂間，鄧姊遭抓傷面部及鎖骨，加上她見胞弟不知悔改，所以沒好氣地逕自回房休息。 胞姊見狀報警拉人 不過，少年死心不息，繼續向母親索錢仍被拒，怒不可遏，竟從後緊箍母親頸項，還取出𠝹刀向她指嚇要脅，揚言：「如果你再唔畀錢，我就殺咗你！」驚動在房內的鄧姊報警求助。警員到場將涉案少年制服拘捕，連同絲毫無損的母親一併帶署。胞姊則僅受輕傷，事後獲送院敷治。
