key,date,article_daily_id,title,text
20061205-336,20061205,336,花絮王旭東不慣被追訪,花絮 王旭東不慣被追訪 國家信息產業部部長王旭東出席世界電信展研討會後，本地媒體自然追問國內3G何時發牌時間，但部長卻只官腔回應「該發的時候會發的」，這樣的答案傳媒自然不滿意。  於是繼續追問，部長邊行邊說，被記者追逐逾百米，場面混亂，只有2、3個護衞為他開路；其間並遭記者碰撞到，痛得他唷唷叫；到了候車處見車還未來接載他，顯得有點不耐煩，「車為甚麼沒來！」又再折返會場貴賓室內。  他顯然不習慣被香港傳媒圍攻採訪，訓示記者「這不是問問題的方式！」最後他更從後門逃離記者的追迫。不過，部長下午卻突然透過港府通知傳媒，將於中國館二樓內召開記者會，未知是否要體現國內開放的一面，抑或有高人指點。
20061205-337,20061205,337,東風調高股改對價,東風調高股改對價 東風汽車（489）調高對滬A股東風科技的股改對價，由原先10送3.6股改為10送4股，若獲東風科技A股股東批准實施，持股量將由75%降至65%。
20061205-338,20061205,338,手機發展快固網N倍,手機發展快固網N倍 國際電信聯盟（ITU）秘書長內海善雄昨日表示，固網電話發展至10億用戶，需時長達125年；但流動電話只用了21年時間，便達到10億用戶Nor，然後再用3年時間增加多10億，他估計此發展速度仍可保持。  同樣寬頻網絡的用戶亦迅速增長，今年人數已是03年的3倍，主要因為價格不斷下降，平均每年跌40%，但容量卻年增60%。國際電聯目標是於2015年，讓全球一半人口能夠接觸資訊科技；他又推舉香港為進入亞太區的跳板。
20061205-339,20061205,339,華能15.2億購深能源9%,華能15.2億購深能源9% 華能國際電力（902）宣布，擬斥資15.2億元（人民幣．下同）現金向內地A股深圳能源認購2億股新股，佔深能源擴大後股本9.08%，每股作價7.6元，以確保華能佔深能源股權不低於25%。
20061205-340,20061205,340,12月新股招股時間表,12月新股招股時間表
20061205-341,20061205,341,中保配股集資6.26億,中保配股集資6.26億 中保國際（966）擬以每股8.1至8.35元，配售7500萬股，集資6.26億元，安排行為嘉誠證券。該股昨收報8.67元，升0.463%。另市場消息指，長盈集團（689）擬以每股0.29至0.295元，配售約6億股，集資1.74億至1.77億元，配售安排行正由花旗及BNP百富勤爭奪中；長盈昨停牌前報0.32元。
20061205-342,20061205,342,兩次減持套35億　有助粉飾業績長和悉售Priceline,兩次減持套35億　有助粉飾業績 長和悉售Priceline 美國網上旅遊服務供應商Priceline.com在美國周一時間公布，長實（001）及和黃（013）將透過高盛在市場悉售380萬股Priceline股份，預計配售將於周四完成。和黃委派的兩名董事──黎啓明及韋以安亦會辭任Priceline董事職位。 【本報訊】Priceline在通告中沒有透露是次長和系出售作價，若以Priceline美國周一收市價40.31美元計算，估計長和系可套現約1.53億美元（約11.87億港元）；若連同9月所減持890萬股Priceline，該集團共可套現35.46億元，相信有助粉飾其全年業績。 和黃料不影響合營運作 9月初，長和系透過高盛於市場配售約890萬股，亦無透露配售作價，若以當時收市價34.16美元計算，涉資3.04億美元。當時Priceline指出，長和共持有1270萬股，出售佔其所持股權約70%，減持後其仍持有9.6%的Priceline權益。  和黃昨接受傳媒查問時表示，悉售Priceline權益，主要是希望為股東創造最大投資價值。該集團對在Priceline的投資一直感到滿意，相信出售股權後不影響和黃與Priceline合營公司的日後運作。和黃與Priceline於亞洲以Hutchison-Priceline名義提供網上旅遊服務。  2000年初和黃與Priceline合作，於亞洲提供網上訂購機票及酒店房間服務。Priceline其後出現財困，01年2月長和斥資7400萬美元，或每股作價2.1美元購入其17.54%股權；其後長和增持至33.2%。 在英推流動寬頻服務 另外，和黃執行董事黎啓明於世界電信展中國日開幕禮上指出，和黃將於本月在英國推出流動寬頻服務，將互聯網的寬頻應用服務帶到手機上，目前集團在全球推出的3G服務客戶人數已達4050萬人。
20061205-343,20061205,343,北興配股籌2630萬,北興配股籌2630萬 北方興業（736）宣布，以每股0.38元價格，配售6989.5萬股新股，佔擴大後股本約16.67%；配售價較停牌前股價0.415元，約折讓8.4%；集資淨額2630萬元用作一般營運資金。
20061205-344,20061205,344,吉利上月銷車升6.8%,吉利上月銷車升6.8% 吉利汽車（175）表示，持股46.8%之兩家聯營公司，11月汽車總銷量1.5萬台，較去年同期升6.8%，較10月升19.5%。首11個月售出15.52萬台，按年升34.7%，已達全年銷售量18萬台的86.2%。
20061205-345,20061205,345,Priceline事件簿,Priceline事件簿 日期 07/1997 事件：JayWalker創立Priceline網站，讓消費者在網上競投機票 03/1999 Piceline在美國納斯特克上市，招股價96美元，曾升至974.2美元 02/2001 長和斥資約5.8億港元，購入Priceline的17.54%股權 06/2001 長和增持至30% 08/2002 長和系斥資逾4600萬港元，增持至33.2%以上 05/2004 長和向美證監申請，讓其可出售共1000萬股 09/2006 長和系出售890萬股 12/2006 長和悉數出售餘下380萬股 註：股價經調整
20061205-346,20061205,346,恒生大量硬幣存款收費,恒生大量硬幣存款收費 【本報訊】恒生銀行（011）明年1月1日起調高兩項服務收費，屆時將會向存入500個或以上輔幣的客戶收取相當於存款額2%手續費，最低收費50元；500個以下則豁免收費。另外，客戶自動轉賬如因存款不足而退回，收費將由現時的110元調高至130元。恒生銀行該兩項新收費均與滙豐銀行看齊。  滙豐早前已宣布，11月1日起客戶若存入硬幣數目逾500個，一律統一收費，按存款總額收取2%作手續費，最低收費50元；500個或以下豁免收費，但若客戶為卓越理財戶口客戶，則可豁免收費。恒生雖然已列明收費，但發言人指出，分行仍會按照個別情况、視乎客戶關係來酌情處理。 特級基金免轉換收費 另外，恒生在新收費資料中列明，客戶由「恒生精選基金系列」內的基金轉入該系列內的貨幣市場基金，所有綜合戶口客戶均獲豁免收取轉換手續費；過去這項優惠只適用於優越理財客戶。  至於特級基金轉換服務原本只適用於優越理財客戶，現時亦擴展至適用於所有綜合理財客戶。所謂特級基金轉換服務，即客戶把贖回原有基金所得金額入賬前，預先以該行提供的墊款，申請認購另一基金單位，其後才把贖回所得金額清還墊款額。
20061205-347,20061205,347,中信國際資產引入3外資,中信國際資產引入3外資 中信國金（183）宣布，中信國際資產管理引入3名海外投資者增資擴股，合共投資14億元，日資的AMC、中東背景的IthmaarBank及MegaRiderOffshoreLtd.（MRO）將分別向中信國金購入中信國際資產管理現有股份及新股。交易完成後，3外資將分別持有中信國際資產管理25%、20%及15%；中信國金意向維持最大單一股東身份。
20061205-348,20061205,348,皇府山傳下周劈價清貨,皇府山傳下周劈價清貨 貨尾盤減價浪接浪，市場消息稱，新鴻基地產（016）位於上水的皇府山，計劃最快下周出招清貨，有可能以優惠價賣樓，令屋苑二手減價壓力大增，有業主大幅減價近100萬元放盤。 業主減價百萬求售 去年趁市旺高價開售的皇府山，平均呎價逾4500元，個別更達5700元，較同區二手造價貴逾40%，如今樓市逆轉，加上尚有近200個貨尾，減價壓力自然較大，市傳新地將於短期內有動作，部署最快下周推出全新第8座逾100伙，或作新命名，計劃以「優惠價」清貨。  皇府山二手因極少人接貨，交投相當淡靜，成交量比同區居屋還少，今年至今只有約11宗成交，其中9宗要蝕，呎價3398至5050元，蝕幅普遍逾10%，最高22%。  其中6座低層C室，952方呎，剛以385萬賣出，較去年買入價約430萬元，蝕45萬或逾10%。 二手放盤近200個 屋苑二手放盤近200個，呎價普遍低於3800元，較買入價低逾10%，由於叫價企硬，二手成交相對較靜。6座逾15樓C室，952方呎，去年初以477.9萬元一手買入，因無人問津，業主現勁減近100萬元，開價380萬元求售，呎價3992元。
20061205-349,20061205,349,李澤楷2億增持電盈,李澤楷2億增持電盈 【本報訊】上周四電盈（008）控股公司盈科拓展舉行股東特別大會，否決出售電盈權益予梁伯韜的計劃，換言之李澤楷不會向電盈小股東派發特別股息，翌日（上周五）電盈股價大跌，李澤楷當日以接近2億元大手增持電盈股份。  聯交所資料顯示，電盈主席李澤楷上周五增持4100萬股或0.61%公司股份，每股作價4.841元，總值1.98億元，令他持股量由26.38%上升至26.99%。 網通：與電盈保持合作 網通（906）母公司網通集團持有電盈19.9%，早前有報道指出，網通集團或會與其他投資者增持電盈，再聯同其他小股東召開電盈股東大會，撬李澤楷出電盈董事局。是次李澤楷增持，除可視為趁低吸納外，亦可藉此進一步鞏固其大股東地位。  另網通首席執行官左迅生昨於世界電信展指出，無論電盈有否出現股權變動，網通集團作為電盈第二大股東的地位不變，故與電盈的合作關係亦不會有重大改變。網通集團仍會履行作為電盈第二大股東的責任及義務，暫沒有計劃增持電盈。
20061205-350,20061205,350,黃逸思任廣發行執董,黃逸思任廣發行執董 【本報訊】以花旗為首的財團奪得廣東發展銀行85.6%股權後，已委任一位重量級財金界人士出任廣發行非執行董事。消息透露，代表花旗的非執董乃該集團前高層兼華人資深銀行家黃逸思，任期3年。 與梁錦松黃鋼城齊名 退休前位居花旗集團執行副總裁的黃逸思，乃本港及國際知名銀行家，他與前財政司司長梁錦松及現任星展銀行副主席黃鋼城等齊名，均屬本港第一代外滙投資專才。  黃逸思退休前長居美國發展，他與前美國財長、現任花旗集團執行委員會董事魯賓，同列集團執行委員成員，是花旗集團最高層的華人銀行家。梁錦松任財爺年代，市場曾有傳聞，指梁氏有意邀請黃逸思加盟金管局，出掌主管銀行監理的副總裁職位。  根據花旗為首財團與廣發行的協議，中國人壽(2628)及花旗，可各自委任3名董事及1名非執董，加入新組成的廣發行董事會，而花旗更有權提名廣發行的最高管理層人選。  業內人士指出，雖然黃逸思只擔任非執董職位，但以其聲望及資歷，加上與花旗的長遠密切關係，相信對重組後的廣發行未來發展，可發揮積極作用。
20061205-351,20061205,351,創維電視十月少賣22%,創維電視十月少賣22% 創維數碼（751）公布，10月份內地電視機銷量較9月份下跌32%，海外則升29.2%，整體總銷量跌22%；較去年同期下跌6.8%。
20061205-352,20061205,352,台和中期息每股1仙,台和中期息每股1仙 台和商事（1037）公布截至9月底中期業績，純利1102萬元，微增5.5%；每股盈利4.21仙，派中期息每股1仙。
20061205-353,20061205,353,現代貨箱3年開支百億,現代貨箱3年開支百億 【本報訊】九龍倉（004）旗下現代貨箱碼頭董事總經理柯禮賢預期，未來3年投資中港碼頭的資本性開支達百億元，隨着深圳大鏟灣1期首兩個泊位及蘇州太倉2期4個泊位，明年底全部啓用，現代貨箱在內地的投資將於08年進入收成期。  現代貨箱今年1至11月共處理490萬個標準箱，較去年同期增加6%，柯禮賢昨日與傳媒聚會時預期，全年可處理550萬個標準箱，增長8%，與葵涌碼頭整體增幅相若，增長動力主要來自躉船及轉口貨量增加。  另外，他預測，深圳今年的吞吐量可望超越香港，增長約12%。  現代貨箱現在絕大部份生意來自葵涌碼頭，柯禮賢坦言，現正集中發展大鏟灣及太倉兩個內地項目，未來亦會在中國內地其他地區物色投資機會，希望中港業務以後變得比較平衡。
20061205-354,20061205,354,意馬中期虧損收窄,意馬中期虧損收窄 意馬國際（585）公布截至9月底中期業績，虧損1148萬元，較去年同期的4072萬元虧損收窄。
20061205-355,20061205,355,高院入稟狀速覽,高院入稟狀速覽
20061205-356,20061205,356,利和3.3億購成衣物流業,利和3.3億購成衣物流業 利和經銷（2387）宣布，計劃以最多3.3億元，向美國物流供應商買入成衣物流業務及相關資產，其中9730萬元將由內部現金儲備支付，其餘2.33億元向銀行借貸，收購價相當於有關業務04年及05年的經調整未計利息、稅項、折舊及攤銷前盈利的6.6倍。
20061205-357,20061205,357,蓄勢加息日圓再衝114熱錢不絕　亞洲股滙新高,蓄勢加息日圓再衝114 熱錢不絕　亞洲股滙新高 日本央行一名政策委員暗示該行準備好再加息，日圓兌每美元昨天衝上114水平，是近4個月來最強。亞洲二線貨幣亦全線上揚，馬來西亞元和韓圜雙雙攀上近9年高峯。隨着熱錢不斷流入亞洲，區內股市水漲船高，新加坡、印度及印尼股市齊創新高。 【本報綜合報道】日央行政策委員水野溫表示，日本將不會重見通縮，同時工資趨於向上；假如有人認為該行會等到經濟數據全面呈強才加息，這種想法是錯的。  受水野溫的言論影響，美元一度滑落0.82日圓，降至114.44日圓，是8月初至今低位；歐元兌日圓交叉盤更曾瀉至152.61，挫1.18日圓。  住友信託銀行市務部副部長AkifumiUchida說，水野溫的貨幣政策立場較平常強硬，意味日央行有機會在本月調高利率；日圓在年底前料有力挑戰112兌1美元和151.5兌1歐元。  亞洲二線貨幣昨日同樣受追捧，反映亞洲10隻貨幣走勢的JP摩根指數升0.2%，攀上108.92的9年高位。 馬元韓圜大勇9年最強 當中以馬元最突出，漲0.9%，至3.556（兌1美元．下同），創98年初以來新高，即去年馬元與美元脫鈎至今最強，部份歸功於馬來西亞經濟研究所推測馬元明年首季可見3.5。  韓圜受惠離岸投資者和出口商拋美元，衝上924.45，升0.33%，是1997年10月以來最高。  今年迄今，泰銖累積升15.16%稱冠；韓圜居次席，升9.25%；馬元排第七，升6.27%。  美國銀行大中華區經濟研究和策略主管王慶認為，美國經濟可望「軟着陸」，對亞洲出口的影響料溫和，故此大多數亞洲貨幣應可進一步上揚。 新加坡印尼股市新高 德意志銀行外滙策略師貝治說，美滙不濟，加上熱錢湧進亞洲股市，為亞幣提供上升動力。  亞股方面，MSCI亞太指數於東京尾市升0.4%，至137.02的6個半月來高峯（見圖）。印尼股市勁揚2.63%，新加坡股市飆升1.8%，印度股市漲0.46%，3個市場齊創新高；大馬股市亦反彈1.07%，攀上9年高位。日股受銀行股下跌拖累，微跌0.23%。  PTTrimegahSekuritas基金經理貝杜利說，許多投資者都覺得亞股現水平偏高，但又擔心錯過升浪。
20061205-358,20061205,358,高院入稟狀速覽,高院入稟狀速覽
20061205-359,20061205,359,美服務業呈強道指揚,美服務業呈強道指揚 【本報綜合報道】美國供應管理協會（ISM）11月份非製造業指數由10月的57.1，升至58.9，是半年來最強，較市場預期的55.5為高，這項反映服務業的數據紓緩市場對美國經濟走下坡的憂慮，刺激美股表現，道瓊斯工業平均指數早段最多升39點，報12323點。  截至昨晚11時15分，道指報12313點，升30點；納斯達克指數報2457點，升9點。  美國第三季非農業生產力最後修訂至增長0.2%，遜於市場預期的0.5%，亦較前季的1.2%大幅放緩；期內勞工成本大幅向下修訂，增長只有2.3%，較預期的3.2%增長溫和，市場對工資上漲引發通脹的憂慮大減。 IMF：市場認定美將減息 雖然聯儲局多番警告工資上升、通脹惡化的風險未除，但昨日公布的數據紓緩通脹的憂慮，令市場預期聯儲局減息機會增加。紐約早段，美元曾倒跌，歐元升見1.3364，0.21美仙。國際貨幣基金組織（IMF）第一副總幹事利普斯基說，市場似乎已認定美國未來將放寬貨幣政策。對於美滙低迷，他認為毋須過慮。  在石油輸出國組織力托油價的言論聲中，國際期油周二反彈，電子交易時段最高報每桶63.25美元，升81美仙，紐約早段報63.11美元，升67美仙。還有不足10天，油組就會舉行會議，市場相信油組將會決定減產刺激油價，分析員亦預期，美國取暖用油的庫存會因天氣轉冷而減少，均支持油價向上。
20061205-360,20061205,360,財經人：美隆行政總裁一年扭亁坤,財經人：美隆行政總裁一年扭亁坤 【本報綜合報道】紐約銀行（BankofNewYork）以165億美元（約1282億港元）併購美隆金融（MellonFinancial），消息一出，促成交易的功臣美隆金融行政總裁（CEO）凱利，亦隨即受到華爾街投資者及分析員讚賞。 促成交易功臣備受讚賞 現年52歲的凱利於今年2月才加入美隆出任CEO，當時股東正向管理層施壓，前CEO更曾收到投資者去信指銀行「長期表現不濟」。  凱利接手這個燙手山芋，要扭轉亁坤似乎並不容易。但憑藉過往的實戰經驗，他上場僅11個月便促成是項交易，並繼續出任新公司掌舵人，令其事業推向另一高峯。  凱利加盟美隆前，於Wachovia集團擔任財務總監，其間曾參與該集團與FirstUnion銀行、PrudentialFinancial及SouthTrustCorp合併的事務，在企業併購方面經驗豐富，可謂身經百戰。  Morningstar投資研究所分析員柏德表示，Wachovia成功藉併購其他企業帶領業務更上一層樓，凱利功不可沒。  對於凱利出掌新公司CEO，市場亦相當看好。  紐約銀行與美隆金融合併後的新公司BankofNewYorkMellonCorp，總部設於紐約，但現金管理及股票轉讓業務則留在匹茲堡，整項交易料於明年第三季完成。 凱利（RobertKelly）職場簡歷 2/2006至今 美隆銀行及集團主席、  總裁兼行政總裁 9/2001-1/2006 Wachovia高級副總裁  兼財務總監 11/2000-9/2001 FristUnion（合併後改名Wachovia）副總裁兼財務監 1988-2000 任職Toronto-DominionBank，最高職位為副主席
20061205-361,20061205,361,熱錢湧亞洲　泰銖攀高峯泰國禁外人短炒國債,熱錢湧亞洲　泰銖攀高峯 泰國禁外人短炒國債 面對游資近期源源不絕湧進亞洲金融市場，泰銖攀上8年來高峯。為免炒家囤積泰銖，然後突然抽走資金造成震盪，泰國央行昨宣布限制外國人買賣泰國債券，變相收緊外滙監管措施。 【本報綜合報道】泰央行表示，非當地居民投資泰國國庫債券、政府債券或央行債券時，如果本身沒有經營基本業務，有關人士必須持有該等債券至少3個月，才可出售。 外資買債券3個月始可沽 此外，泰央行禁止非當地居民透過回購協議買賣債券，並要求企業和金融機構不要把短期債券售予海外投資者。聲明又提到，該央行將留意新措施的成效，必要時會採取進一步行動。  泰央行行長塔莉莎指出，大量海外資金趁泰銖高企流進泰國債市，主要投放在短期債券；他們正等候適當時機出貨，然後把資金調走。在2003年9月，泰央行亦曾採取類似措施，防範泰銖炒賣活動。  泰央行也擔心泰銖太強會打擊出口，為了遏止泰銖升勢，該央行較早前除了透過出口術，還真金白銀干預滙市，都無功而還。  泰銖（兌每美元．下同）上周五曾衝上35.64，是98年底來新高。受泰央行新措施影響，泰銖昨曾回吐0.42%，降至35.96，其後反彈；今年來仍漲14.4%，是升勢最凌厲的亞洲貨幣。曼谷TMB銀行司庫薩蒂安說，泰央行的措施應可令泰銖不致於過份波動，但無法扭轉美元全面轉弱的局面。 央行憂礙出口遏泰銖升勢 事實上，其他亞洲二線貨幣同樣受追捧，新加坡元和韓圜日前齊衝上9年高峯。  在97年，泰國、馬來西亞及南韓等亞洲國家，長期倚賴中短期海外貸款維持國際收支平衡，滙率不恰當地偏高。索羅斯等金融大鱷率先狙擊泰國，大舉沽空泰銖。泰國失陷造成骨牌效應，引發「亞洲金融風暴」。  吸取亞洲金融風暴的教訓，亞洲國家積極增強外滙儲備的實力，並致力改善經濟。  泰國在9月發生政變，但得益於出口理想，第3季國內生產總值（GDP）較次季增長1.5%，是一年來最強勁；按年擴張4.7%。
20061205-362,20061205,362,油組或托價　抵銷美元弱勢,油組或托價　抵銷美元弱勢 【本報綜合報道】美元近期表現疲弱，惹來石油輸出國組織（OPEC）成員國關注收入變相減少，不排除會提出進一步減產去托高油價。不過，由於氣象專家估計美國下周氣溫較往年和暖，意味取暖用燃油消耗量或比原先預測為少，紐約原油價格昨天一度挫逾2%。 油價昨回落 紐約原油1月期貨在電子交易初段曾升39美仙，攀上每桶63.82美元的兩個月高位；其後價格輾轉回落，一度倒跌1.37美元，低見62.06美元。  儘管油價已重上每桶60美元以上，甚至一度逼近64美元，但由於油價是以美元計算，美元近期大跌，恐變相影響油組成員國收入。因此，油組成員於下星期開會時，或再次討論是否需要透過減產刺激油價。  油組主席達烏科魯道強調，不能漠視美元弱勢對成員國收入所帶來的影響。  事實上，油組過去亦曾以抬高油價來抵銷美元下跌的影響，但這已是03年底至04年初的事，當時油價處於每桶約30美元左右。  在外滙市場，面對歐洲央行本周有機會加息0.25厘，把基準利率推上3.5厘，歐元昨日曾升0.31美仙，升到1.3367美元的20個月高峯。美元兌日圓最低見115.10，跌0.34日圓。  其後有投資者趁低買回美元補倉。本港時間昨晚11時半，歐元報1.3303美元，跌0.33美仙；美元兌日圓報115.53，升0.09日圓。  但PutnamInvestments和最球最大債券基金Pimco推測，歐元明年有力挑戰1.40美元。
20061205-363,20061205,363,國際視野：禾雀亂飛　各自修行 - 王冠一,國際視野：禾雀亂飛　各自修行 - 王冠一 美元兌英鎊跌至14年低位，兌歐元也改寫20個月低紀錄，兌日圓和瑞郎亦節節敗退，這反映了甚麼？  近日公布包括極疲弱的樓市、慘不忍睹的製造業及工廠定單，以至部份零售數字等，又是否顯示美經濟有邁向衰退之虞？  奇怪的是，「貨運指數」（truckersindex，追蹤商品貨運之指標）在10月急跌1.8%，美林視之為衰退邊緣（borderlinerecessionary）之經濟收縮領先指標；孳息倒逆（inverted）多時，10年期聯邦債券孳息急速滑落至4.43厘，與短期聯邦利率竟相差75點子，可視作市場對美經濟前景之憂慮。可是，決策者卻對上述情況不以為然。  美財長保爾森所下的強美元「聖火令」在感恩節前後已無人聽佢支笛，當被問及為甚麼強美元變弱美元時，只口中念念有詞重複：「強美元符合美國利益」，閣下見此情景，有何感想？  聯儲局主席伯南克更加犀利，早前指樓市下陷（slump）將嚴重拖累經濟增長，消費開支若明顯減少，對經濟的衝擊更大。言猶在耳，日前發表講話時卻指華府並不知樓市惡劣程度，更改口說對經濟前景抱樂觀態度，並重申非常關注通脹情況，不排除加息可能（furtherpolicyactionagainstinflationwillberequired），看官，汝等聽了後又可有不知Ben哥葫蘆裏賣甚麼藥的感覺？  Ben哥由上任至今，其發言及與市場溝通之技巧備受批評，故被冠之以「3B」──語無倫次的Ben，伯南克稱號，反映市場對其不滿之諷刺。從金融市場之表現，不是Ben哥睇錯市，便是他在擘大眼講大話。難怪個市禾雀亂飛、各自修行，亂過亂世佳人矣！
