key,date,article_daily_id,title,text
20061109-286,20061109,286,WWW.至擊肥白領坐爆影印機,WWW.至擊 肥白領坐爆影印機 影印機工作是複製文件，但也可用來娛己娛人。外國一名胖子複製文件時，貪得意爬上影印機，為自己的大屁股留「倩影」，豈料他太重磅，竟然把影印機的玻璃面硬生生壓爆！  畫面一開始，只見一名肥胖白領在房內影印完文件後，四望無人，立即快手快腳脫下長褲，一屁股坐上影印機，然後開始影印。肥胖白領見惡作劇無人發現，正當沾沾自喜，說時遲那時快，只見玻璃面突然破裂，把他困在影印機上動彈不得。  肥胖白領下場如何不得而知，但他的所有舉動已全收進閉路電視之中，同事看到就肯定笑爆嘴。  vidiLife網站
20061109-287,20061109,287,青年屁股燒煙花炸到內傷,青年屁股燒煙花炸到內傷 煙花璀璨美麗，大人小孩都愛玩，但玩時請用腦袋想一想。英國森特蘭（Sunderland）一名青年就做出蠢事，竟然想出玩「自爆」──把一支煙花火箭塞入屁股燃點，結果把自己炸到內傷。 玩「自爆」的青年22歲，姓名不詳，之前駐紮在伊拉克，最近剛回國。「周日晚營火會結束後，約有40人在場，那傢伙突然叫嚷：『好悶啊！有甚麼好玩？』話畢逕自褪下褲子，從後塞入火箭……」目擊的16歲少年卡西姆說。「現場立即哄堂大笑，大家都不相信他真的會點火！」 「我們覺得勁好笑」 火箭數秒後爆炸，青年被震得趴在地上。但沒有人想到危險，反而哈哈大笑，有人更拿出手機，拍下青年「屁股爆煙花」的場面。  卡西姆說：「他最初看來沒甚麼，我們都覺得勁好笑！誰知他站起來蹣跚走了幾米又摔倒，屁股流出許多血。」他說救護員到場後也大笑，「沒人當作一回事」。 結腸燒傷需要留醫 不過，事情比他們想像中嚴重，醫生檢查後指青年結腸燒傷，至前天仍未出院。  英國煙花協會主席伍德黑德（JohnWoodhead）自言入行45年，從未見過這種事，「令人難以置信！」  英國《泰晤士報》
20061109-288,20061109,288,兄揹紙板弟弟征高山,"兄揹紙板弟弟征高山 兩兄弟，有福同享，有山同登！蘇格蘭人達林與弟弟戈登，都是爬山發燒友，但弟弟患上重病後，無法再繼續這嗜好，達林又不想拋下弟弟，所以最近他征服蘇格蘭最高的本尼維斯山（BenNevis）就全程揹着弟弟──的真實尺碼紙板人。 助白血病弟圓心願 現年32歲的達林和29歲的戈登，曾經征服幾十座900米以上的高山，更約定要攜手登上1,300米的本尼維斯山。然而，八年前戈登發現患上白血病，就沒再攀山了。達林非常疼弟弟，不止捐骨髓給他，最近更決定「揹弟弟上山」，助他圓了心願。  在本尼維斯山頂上，達林抱着紙板弟弟高興地合照，還「蠱惑」地說：「我把他揹在背上，所以我是比他先一步到達山頂的！」達林也為救了戈登一命的慈善組織籌到逾二萬港元善款。  英國廣播公司"
20061109-289,20061109,289,漢堡包要人心臟病發,"漢堡包要人心臟病發 「心臟病發」、「四重搭橋手術」，誰都不想，但美國亞利桑那州有人一想起就流口水──說的是「心臟病發燒烤餐廳」（HeartAttackGrill）招牌菜、號稱含2,200卡路里的「四重搭橋手術漢堡包」（QuadrupleBypassBurger）套餐。 一公斤牛肉加煙肉芝士 這個巨型漢堡包的材料，包括重約一公斤的四大塊牛肉、三塊芝士和四塊煙肉，還有番茄和生菜，估計含1,200個卡路里，再加純豬油炸的薯條和汽水，共有2,200卡路里，相當於一個成人一日所需。  至於自問無福消受「四重搭橋手術」的人，可以考慮較「輕怡」的「三重搭橋手術」、「雙重搭橋手術」或普通「搭橋手術」，同樣真材實料，有機會讓人「心臟病發」，歡迎認同餐廳「食……死都抵」口號的顧客挑戰。萬一真的撐得太飽動不了，顧客可以坐在輪椅上，由打扮成性感俏護士的女侍應推到門外。  metro.co.uk/Ananova網站"
20061109-290,20061109,290,識歎狗兒搭巴士往蒲吧,識歎狗兒搭巴士往蒲吧 狗也愛「蒲吧」，而且分文都不用花！住在英國約克郡的小狗「拉蒂」（Ratty）十分懂得享受生活，每星期最少兩次，獨個兒乘巴士到24公里外的酒吧消遣。每次這位熟客進場，女侍應就會奉上香腸。「拉蒂」還懂得「轉場」，最近改為幫襯第二家酒吧。 舊吧易手懂「轉場」 不久前，「拉蒂」慣常去的酒吧易手，新老闆不再歡迎寵物，牠於是決定轉移陣地。現在牠仍然乘坐同一路線的巴士，在同一個車站下車，下車後卻過馬路到對面街的另一間酒吧去，一樣受到貴賓待遇，可以大吃牠最愛的香腸。  主人凱爾（GaryKay）說，養「拉蒂」本是希望牠在農場捉老鼠，沒想到牠如此「爛蒲」。他好氣又好笑：「這傢伙有自己的想法。」麻煩的是，「拉蒂」不懂回家，每次都要勞煩別人送牠一程，所以凱爾決定今後要拴住牠。  英國《約克新聞》
20061109-291,20061109,291,聖經擋子彈救男子命,聖經擋子彈救男子命 「當信主耶穌，你和你一家都必得救」。其實只要口袋放兩本《聖經》，一樣可以得救！美國佛羅里達州一名男子，日前無端被匪徒槍擊，幸好恤衫口袋的《聖經》擋住子彈，撿回一命。 兩本放在胸前口袋 男子在奧蘭治帕克（OrangePark）管理一間基督教外展組織，周一他將垃圾拿出門外時，被兩名持槍男子伏擊，向他連開兩槍，一槍打中他的帽，而另一槍則打中他心臟，兩人見得手，拔腿就逃。  兩名槍手又怎想得到，子彈剛好被男子恤衫口袋裏兩本《聖經》擋住，他除了胸口痛楚，以及有個紅印外，絲毫無損。他說：「兩本《聖經》就像盾牌，保住了我的命！」  美國Local6網站
20061109-292,20061109,292,放風箏,放風箏 秋高氣爽，放風箏最好不過。美國艾奧瓦州貝滕多夫（Bettendorf）一個公園內，一名男童把鮮艷的「噴射機」風箏高高舉起，準備讓它翱翔天際。  美聯社
20061109-293,20061109,293,愛心聖誕星,愛心聖誕星 美國電視節目主持曼努諾絲（MariaMenounos）為斯華洛世奇水晶店設計了這顆聖誕星，將在eBay拍賣，收益捐給病童慈善組織。  美聯社
20061109-294,20061109,294,高票連任參議員　啓動總統戰希拉莉步向白宮,"高票連任參議員　啓動總統戰 希拉莉步向白宮 美國紐約州參議員希拉莉（HillaryClinton）輕而易舉當選連任，取得近67%的選票，成為選舉的大贏家之一。儘管這位前第一夫人一直未表態2008年是否爭逐總統寶座，但這一役取得壓倒性大勝，已為她打開通往白宮之路的大門。《華盛頓郵報》就指，前天是她的總統競選運動開始的一天。 希拉莉連任是意料中事，這次選戰的焦點也不在她會否勝出，而在她會否爭取民主黨提名參加兩年後的大選。但她前晚（周二）獲悉勝利後，仍然沒正面回應是否有意選總統，只強調民眾已發言要求改變。 勝利演說：要取回我們的國家 「我已準備捲起衣袖開始工作！」為勝利而一臉興奮的她，在丈夫克林頓和女兒切爾西陪同下，在紐約一間酒店發表勝利演說：「訊息非常清楚：是時候往新方向出發了。我們要取回我們的國家，今晚就開始！」  希拉莉多次被追問是否會角逐總統之職，但她一直強調專注參議院的工作，還沒有任何決定。分析家則意見紛紜。《紐約時報》指她成功連任，令她出馬角逐總統的可能性大增。民調專家卡羅爾（MauriceCarroll）亦指出：「以目前的勢頭，希拉莉總統選戰大可以在11月8日就起動。而且我認為事實如此。」  希拉莉這次競選連任花了近3,000萬美元（約2.34億港元），冠絕同儕，亦令外界更加確信她是為2008年鋪路。紐約大學政治系教授布拉姆斯（StevenBrams）估計開支一部份是用作幫助其他參選的民主黨人，以換取他們支持。「我相信她放眼將來，因而試圖討好其他民主黨人和領導層。」 累積巨額經費　政治策略家伴枕邊 但福德姆大學（FordhamUniversity）政治科學教授帕納戈普洛斯（CostasPanagopoulos）認為2008仍遙遠，希拉莉很可能確實未有決定。  當然，希拉莉去馬的徵兆不少：她已累積巨額經費，招攬多名重量級政治顧問，枕邊人更是一流政治策略家。近月她亦加緊批評總統喬治布殊，對準反恐戰和財赤等問題發炮。事實上，擔任參議員六年，她專攻衞生和國防問題，亦在多項兩黨共倡項目中跟右派人士合作，憑實力和努力贏得尊敬。  不過，即使希拉莉有意出戰，無人可保證她必定獲提名，布拉姆斯指出，「若她決定去馬，會冒出許多新問題」，最大障礙是：從未有女性獲主流政黨提名參選總統。美聯社/法新社/中央社"
20061109-295,20061109,295,「布殊墮進地獄」民主黨奪參眾兩院控制權,"「布殊墮進地獄」 民主黨奪參眾兩院控制權 美國國會在中期選舉變天，共和黨「雙失」，眾議院和參議院的控制權都失去了。雖然共和黨仍未承認落敗，但美國傳媒昨天一面倒報道，繼民主黨贏得眾議院控制權，兩黨爭持激烈的維珍尼亞州參議院席位，也成為民主黨候選人的囊中物。民主黨重奪失落了12年的國會控制權，過去6年對民主黨視而不見的總統喬治布殊，政治生涯由這一天起可能跌進「地獄」。 維珍尼亞州的參議院選戰一度陷入膠着，在點算逾90%選票後，發現競選連任的共和黨議員艾倫（GeorgeAllen）和他的民主黨對手韋伯（JimWebber）得票太過接近，只差3,000票，可能要重點。但美聯社根據周三晚點票結果，指韋伯以7,236票贏了選舉。  贏了此仗，民主黨總算在參議院由原來的43個議席多取得6席，再加上獨立人士兩席，贏得逾半數的51席，繼取得眾議院控制權後，再下一城，成功全面掌控國會兩院。眾議院還未完成全部點票，但民主黨在全部435席中，奪得229席，共和黨196席，只餘10席未開出，勝負無爭議。 布殊大方向民主黨示好 勝負分明，大局已定，共和黨人私下已竊竊私語「回天乏力」，喬治布殊對中期選舉戰果雖然失望，但拿出政治胸襟和民主風度，致電祝賀民主黨人，周三早上已致電將成為國會眾議院史上首位女議長的佩洛西（NancyPelosi）祝賀她，以候任議長女士稱呼她，邀請她出席周四的午餐會；下午召開記者會時更大方承認「民主黨這一晚表現很好」，又說在餘下兩年的總統任期會致力和民主黨人合作。  喬治布殊放下身段，向他過去6年冷待的民主黨伸出橄欖枝，其實迫於政治現實需要。不和民主黨建立政治夥伴關係，他推行政策必在國會處處受到阻撓，變成跛腳鴨，不能寫下他仍然想留在史冊上的功績。 與佩洛西如火星撞地球 不過，英國《每日電訊報》昨天以「布殊今天開始墮進地獄」為題，表達對喬治布殊和民主黨和解的前路不樂觀。尤其是，佩洛西過去曾形容喬治布殊「危險」、「無能」、是沒有穿衣服的國王，而喬治布殊自己也未必能事事讓步。即使喬治布殊說「相信兩人可以在雙方認同的事發展合作關係」，但兩人立場一左一右，如火星撞地球，合作應該很難。  此外，在選前已有民主黨人聲言要就伊拉克戰爭錯失和聯邦高官違法爆出中央情報局女特工普萊姆的事，彈劾喬治布殊，將他拉下馬。民主黨前主席麥考利夫（TerryMcAuliffe）就發狠話：「喬治布殊可能不知道他的總統生涯快完結，這個人會以我國史上最差總統的身份下台。」  民主黨已準備明年1月奪得眾院控制權後100小時內，推動立法禁止議員收受政治說客禮物、要在兩年內把近10年來沒有提高過的最低工資由時薪5.15美元增加。  美聯社/路透社/英國《衞報》/《每日電訊報》"
20061109-296,20061109,296,北京促民主黨建設中美關係,北京促民主黨建設中美關係 今次共和黨在中期選舉失利，令民主黨在2008年的選舉中更穩操勝券，極有機會掌權。而即將成為眾議院議長的民主黨黨鞭佩洛西（NancyPelosi），一直對中國的人權狀況極度不滿，曾不留情批評中國領導層。面對新黨、新人事和新作風的美國國會，中國希望民主黨控制的國會，能扮演「建設性的角色」，繼續推動中美外交關係。  中國外交部發言人姜瑜昨天說：「維持友好的中美關係，將有利於地區和世界的和平、穩定和繁榮發展。」「我們相信無論是共和黨或是民主黨，他們都希望和中國建立一個可靠、健全和穩定的關係。我們希望新一屆美國國會可扮演一個建設性的角色，積極促進中美完好的外交關係。」姜瑜重申，中方會加強和美國間的合作，增進相互了解及信任，並努力推動中美良好的關係。  法新社
20061109-297,20061109,297,佩洛西66歲第一位眾議院女議長,佩洛西66歲 第一位眾議院女議長 「今晚是美國人的重大勝利！」當票站調查顯示民主黨將重奪眾議院控制權時，黨鞭佩洛西（NancyPelosi）向支持者高呼勝利。66歲的她，肯定是今次中期選舉的一大贏家，她將成為美國史上首位女性眾議院議長。 促中國釋放異見人士 佩洛西誓言國會會邁向新方向：「今天，求變的美國人投了民主黨人一票，讓民主黨帶領國家走向新方向，這也是我們一直想做的。」  佩洛西來自政治世家，父兄都是政客，丈夫是富商，她1987年從政，2003年開始擔任民主黨黨鞭。她今次在三藩市的選區以超過80%的高票，第九次勝選。  北京對她並不陌生，1989年六四事件發生時，她公開指摘北京血腥鎮壓學生，之後猛烈抨擊中國人權狀況。她多次表示欣賞台灣的民主發展，2000年陳水扁當選總統，她就率先致電祝賀。  她多次與國家主席胡錦濤有不愉快的交手經歷。2002年胡錦濤訪美，她當面要求中國釋放異見人士，令他拂袖而去。今年公開呼籲華盛頓不要以隆重儀式接待胡錦濤，直指他是「獨裁國家」的領導人。  北京以外，在美國國內的共和黨人更對支持墮胎和反戰的她恨之入骨，對她出任議長，有共和黨眾議員曾說，那「簡直是嚇死人」。  法新社/英國《泰晤士報》
20061109-298,20061109,298,阿諾舒華辛力加59歲「這是我最愛的續集」,"阿諾舒華辛力加59歲 「這是我最愛的續集」 「這是我最愛的續集。」由荷李活明星變成加州州長的阿諾舒華辛力加（ArnoldSchwarzenegger）說。  阿諾在今次中期選舉，競選連任成功，沒有成為一任完的州長，就像他拍的《未來戰士》一樣有第一集又有續集。   跟共和黨保持距離 加州1,580萬合格選民之中，民主黨人佔42%，共和黨人只佔34%，阿諾能再次攻陷這個民主黨重鎮，逃過許多共和黨兄弟慘敗的命運，全憑他的政治智慧──只跟共和黨保持適當的距離，免得被黨醜聞和失政連累。  結果，阿諾得票率高達63%，幾乎是民主黨對手的兩倍。阿諾笑逐顏開，與來自民主黨甘迺廸家族的妻子施賴弗（MariaShriver）深情擁吻，在彩紙紛飛中，又向支持者說：「我喜歡拍續集，但是這次無疑的是我最愛的續集。」  有個民主黨人妻子，加上支持一些跨黨派的法案，例如通過限制溫室效應氣體排放量法案，斗膽批評華府否定京都議定書的全球暖化政策，令阿諾在民主黨人中也吃得開。  59歲的阿諾，是奧地利人，身高1.88米，曾在奧國軍隊中開坦克車，21歲身無分文闖美國，多次贏得健美先生銜頭，之後拍過小電影，後來成為荷李活紅星。  美聯社/路透社/法新社"
20061109-299,20061109,299,港商憂慮人民幣將受壓升值,港商憂慮人民幣將受壓升值 美國中期選舉民主黨獲勝，經濟學者預期美國經濟政策不會有大轉變，而本港廠商則關注美國對華施壓，要求人民幣升值的聲音會增加。 市場訊息恐混亂 科大經濟學系助理教授鄒偉業認為，民主黨在議會中掌權，或在政治上帶來的轉變會大些，特別是在伊拉克議題上。由於布殊總統仍有2年任期，其間與議會在政治和經濟政策上或會出現分歧，令市場訊息混亂，如加稅不加稅等，不過美國始終是一個較成熟的政治體系，因此一些延續性的經濟政策，相信不會有大轉變。或許民主黨在外貿保護主義上會更鷹派，以維護低下層利益，不過全球一體化是不可逆轉的趨勢，因此他未見到是次改變對美國經濟政策會有大改動。  香港中小型企業聯合會會長佘繼標則說，是次民主黨出掌議會，他關注民主黨會否為了保護美國產品及本土工業，進一步向中國施壓要人民幣升值。  本報記者
20061109-300,20061109,300,楊愛倫54歲兩華裔女子踩入國會,楊愛倫54歲 兩華裔女子踩入國會 今屆中期選舉，有數十名華裔候選人。事前就被一致看好的楊愛倫，順利當選紐約州眾議員，成為該州首位華裔女性眾議員。  54歲、民主黨籍的楊愛倫來自台灣，她取得候選人資格後，就被視為大熱，因為對手年輕知名度不高，缺少競選經驗，再加上所在選區是民主黨票倉，種種有利條件下果然跑出。她移居美國已經29年，有多年服務社區的經驗，也在市議員劉醇逸的辦公室擔任主任四年，也是她重要的參選資本。楊愛倫表示，希望她的參選，能夠啓發和鼓勵更多亞裔女性參政。 吳振偉五度連任 另一個備受矚目的，是俄勒岡州的眾議員吳振偉（DavidWu），他順利拋離對手成功五度連任。  加州華人亦創造從政歷史。58歲的華裔移民余胤良，以高票數當選加州歷來首位華裔參議員，馬世雲亦當選加州首位華裔女眾議員。  今屆共和黨籍的華裔法律教授丁景安（JanTing），在特拉華州挑戰參議員席位，可惜得票率只有29%，由民主黨籍卡珀（ThomasCarper）當選。參議院歷年只出現過一位華裔參議員，就是祖籍廣東、共和黨籍的鄺友良，他在1957年代表夏威夷州進入參議院，但在2004年97歲時逝世。  美聯社/台灣東森新聞網
20061109-301,20061109,301,網通集團成大股東　有機染紅李嘉誠入股電盈飆7%,網通集團成大股東　有機染紅 李嘉誠入股電盈飆7% 電訊盈科（008）主席李澤楷出售近23%電盈股權再有新進展，買方梁伯韜終如期在盈科拓展的特別股東大會前，成功籌組的財團，消息指成員除李嘉誠基金會及梁伯韜外，還包括網通（906）的策略性股東西班牙電訊商Telefonica，3方分別佔12%、3.4%及8%。此「夢幻組合」除令市場憧憬交易成功在望，更為電盈帶來晴朗的一天，電盈貫徹其藍燈籠的作用，股價昨升6.89%，收報5.12元，而恒指則跌128點。據悉，梁伯韜日內正式公布具體財團名單。 【本報訊】梁伯韜的財團若成功入股電盈，屆時Telefonica購入的8%股權，將與網通母公司網通集團原先持有的兩成股權，注入合營公司，市場相信網通集團將有話事權，網通集團變相持有約28%權益，成為單一最大股東。  日後Telefonica可委任2名董事，網通集團則可委任4名董事；梁伯韜則出任公司主席。  市場人士估計，若電盈成功引入Telefonica為股東，並加強與網通及網通集團的連繫，日後發展為「中國故事」，投資價值大大提高，到時由股市的「藍燈籠」或變成「紅燈籠」，除電盈升近7%成為藍籌之冠外，亦帶挈將來成為姊妹公司的網通升3.7%。 Telefonica購8%夥網通合營 不過，有電訊分析員指出，就算梁伯韜的財團名單落實，也並不代表李澤楷一定能順利「離場」，因為李澤楷出售電盈股權須待盈拓舉行特別股東大會就交易進行投票，由於李澤楷並無投票權，成敗關鍵在於小股東意願。盈拓已定於11月24日舉行法院會議，特別股東大會就預期在27至30日期間舉行。  至於李嘉誠基金會只入股12%，亦巧妙地避開了條例監管，避免觸犯電訊條例中電訊持牌商不可持另一電訊商逾15%股權的規定，及廣播條例下的跨媒體擁有權。和記黃埔（013）現在港經營固網及電訊服務，及營運新城電台。  李嘉誠曾表示，這第三個孩子（基金會）的財產，家裏任何人都沒有份，任何人都不可以動。但基金過去卻與長和系一同進行多項投資，如與長建（1038）共同入股澳洲收費公路項目、與長和系斥25億元購上海浦東地皮及共同入股中行等，入股電盈情理上有商榷餘地。事實上，該基金會的成員大部份均與長和系有關連的（見表）。 基金會與長和系千絲萬縷 李嘉誠基金對有關消息不予置評。Telefonica發言人接受《有線電視》查詢時亦不予置評。證券界對這宗交易較買賣雙方更具信心，並認定這個財團組合已將交易障礙消除。金英證券指出，由於李澤楷並非李嘉誠基金會的受益人，所以李嘉誠基金會是財團其中一員應該是合法的。而滙豐證券指，儘管財團名單尚未得到交易各方確認，但消息非常正面，令交易失敗風險大大減低。  財經事務及庫務局局長馬時亨昨出席立法會會議時拒絕評論電盈的易手交易，但他重申，所有上市公司的活動，包括股權轉移及收購，證監會均會嚴密監管，電盈股權轉讓交易亦不例外。
20061109-302,20061109,302,4日累升近7%　創新高中石化今料染藍,4日累升近7%　創新高 中石化今料染藍 恒指服務公司今將於港股收市後公布季度檢討，由於中石化（386）完成股改，加上市值及上市時間亦達標，成為以H股身份晉身恒指新貴大熱，部份券商亦估計中國銀行（3988）及和電國際（2332）亦有機會；至於電盈（008）及長江基建（1038）則被視為被剔除的熱門成分股（見表）。 【本報訊】市場借中石化將成為藍籌新貴續炒，股價再創新高，收報5.75元，升2.13%；3家證券行的報告均預計，中石化會入圍。估計中行及和電染藍的則分別有兩家，中行及和電昨分別升0.89%及2.09%，收報3.39元及16.6元。電盈則跌0.2%，收5.11元，長建升1.08%，收23.4元。 里昂上次估最準 根據準則，中行距離「染藍」時間規定尚差1個月，被選中機會較微，工商銀行（1398）上市時間更短，亦未能染藍。另李嘉誠上市王國已有四家藍籌股，倘再引入和電，恐惹外界疑慮。  翻查券商今年猜恒指新貴表現，以里昂最準，上次公布名單時更「五估五中」。另外，過往公布名單後，新貴股份翌日普偏造好，當中以富士康急升4.5%最佳。 上石化儀征　再炒私有化 是次新貴大熱中石化本周已累升逾6%，大行中以中銀國際對其最樂觀，目標價7.08元。另中石化旗下上海石化（338）、儀征化纖（1033）及深A股江漢石油鑽頭三家公司的股改動議，前日遭流通A股股東否決，市場憧憬中石化可能重新啓動私有化這些子公司。由於三家公司的A股繼續停牌，故昨日上石化及儀征兩隻H股受追捧，分別裂口高開5.26%及5.1%，並很快衝上全日最高位3.49元及1.67元，升8.05%及6.37%，但股價迅速回落。  及後中石化董事會秘書陳革就有關「現階段沒有對他們提出二次股改計劃」的言論，在上午11時52分於路透社發出，加深市場對上石化及儀征私有化的憧憬，股價再度掉頭回升，分別收報3.43元及1.62元，升6.19%及3.18%，成交金額達4.62億元及1.17億元。  陳革表示，三公司股改動議遭否決，是市場對股改對價期望過高，並對此表示遺憾。他指出，上石化等股改不成功，不意味着中石化會啓動「整合」行動，且對中石化未有不利影響。   中行傳夥美林　籌組基金 不過，陳革雖然「口硬」，但江鑽石油在停牌通告內卻已露口風，表示中石化會盡快再次提出「改正方案」，該公司將繼續停牌。加上中國證監會已有通知，首次失敗者可在1個月後重來，否則中石化將上石化及儀征私有化的機會最大。  另據內地傳媒報道，中行正在籌辦一家中外合資基金公司，可能年底完成籌建，美林證券傳聞是中行的外資合作夥伴。中行日前一招聘廣告中透露，在申請成立直接控股的基金管理公司，並招聘負責市場業務的副總經理和投資總監。
20061109-303,20061109,303,主要貨幣匯價,主要貨幣匯價
