key,date,article_daily_id,title,text
20060209-0,20060209,0,男拔萃發現禽流相思雀,男拔萃發現禽流相思雀 【本報訊】位於旺角的傳統名校拔萃男書院爆發禽流感危機，日前在該校校園內撿獲的相思死鳥，經化驗後疑帶有H5病毒。校方昨晚向全校師生及家長發出緊急電話短訊，簡述此宗禽流個案。校方又透露，在去年聖誕節已兩度在校園內發現死雀，但未有通報漁農自然護理署。近日接連發現禽鳥感染病毒，衞生署署長林秉恩直言，禽流感在港爆發的風險已愈來愈高。　記者：張嘉雯　林社炳　黃曄寧 拔萃男書院校長張灼祥昨晚在校內舉行臨時記者會，他表示，本月六日下午二時，該校一名工友及一名園丁在校內近太子道花墟入口的樓梯鐵絲網附近，發現一隻死去相思雀，兩人以膠袋封好死鳥，下午四時由漁護署人員取走，至昨晚七時，校方收到衞生署來電，指經化驗後，死去相思雀懷疑帶有H5病毒。  張灼祥指，該校在聖誕節時亦曾發現死去的斑鳩及麻雀，但由於當時禽流感未有爆發，故沒有通知漁護署跟進，是次處理死雀的兩名員工事後沒有發燒，也沒有呼吸道感染病徵，校方會建議二人服用預防藥物。衞生防護中心會要求二人接受醫學監察，中心今日會派員到學校跟進。 手機短訊通報師生 校方昨晚向全校師生及家長發出緊急手機短訊，今日會正式向學生宣布事件。該校原定今日為參與周日馬拉松比賽學生舉行的誓師活動不會改期，也不會取消喝雞腳湯的傳統。  該校面積二十萬平方英呎，共有一千四百名學生，其中三十多人居於校內宿舍，旁邊拔萃男書院附屬小學則有七百名學生。校內沒飼養雀鳥，但由於校園內有不少林木，吸引不少雀鳥棲息。  本報記者昨晚到該校視察，一批中六學生對校園死雀一事一無所知，但認為「唔驚得咁多」；正念中四的陳同學則指校園空曠，向有雀鳥聚集，不擔心會受感染。 「爆發風險愈來愈高」 衞生署署長林秉恩回應本報查詢時表示，「禽流感爆發嘅風險愈來愈高，病毒喺區內愈來愈多，預期會再有雀仔感染禽流感」。由於不知現況會維持多久，故市民應做好預防措施，庭院若飼養雞隻應盡快交出，以防受野鳥感染。  教育統籌局昨發出緊急指引，提醒學校避免在校內飼養禽鳥，若發現死雀，要即時通知該局及衞生署，若學生出現病徵，應即時呈報。  教育界立法會議員張文光批評教統局指引不足，校方對於是否需要封鎖現場，隔離學生感到疑惑，認為該局應即時與衞生福利及食物局制訂撿拾死鳥的程序指引，「亡羊補牢好過乜都唔做。」  H5N1關注組成員、傳染病專科醫生勞永樂建議政府設立「有人接聽」的電話熱線，以免延誤通報。他相信，當發現有一群雞隻患上禽流感時，就是港人在今次疫潮中出現第一個感染個案之時。  香港大學動物學系副教授梁志清估計，病毒源頭應在香港或珠三角，港府應與內地合作找出源頭。他又批評，在新法例下，研究人員使用的實驗雞亦要領牌，更難查出源頭所在。
20060209-1,20060209,1,中國問題專家晚年居港,中國問題專家晚年居港 現年九十四歲的ClareHollingworth，為當世其中一位最具資格的戰地記者，她以率先報道納粹德軍入侵波蘭邊境掀起二次世界大戰而揚名於世，從事傳媒工作逾七十載的她，除了報道戰地新聞外，近年長居本港，又曾在香港大學執教及在亞太研究中心任研究員，出版有關政治及戰爭史書籍。 目睹納粹德軍發兵 Hollingworth於一九一一年在英國出生，年輕時在波蘭首都華沙，積極參與援助逃避納粹德軍迫害的猶太人、天主教徒及共產黨員社區，獲得英國《每日電訊報》賞識，一九三九年獲聘為特派員。  Hollingworth在親撰的文章中記載，她被派往波蘭邊境後，向英軍借用軍車，闖入德國境內，回程時發現德軍坦克及納粹德軍已在波蘭邊境集結布防，向東面進發，因而揭發德軍發動戰爭的陰謀，獨家報道了二次大戰一觸即發的消息。  在隨後七十年的傳媒生涯，Hollingworth曾遠赴阿爾及利亞、越南及中東等地，報道主要戰事，並於○○年在英國獲得最為英國新聞工作者尊崇的「新聞工作終身成就獎」。七三年，她以六十高齡，出任首位駐北京的外電記者，而自八十年代開始，她便長居香港，八五年她出版講述毛澤東的著作《Maoandthemenagainsthim》，被譽為熟悉中國問題的專家，她○三年時在家跌倒，導致股骨折斷，曾入醫院接受治療。  本報記者
20060209-2,20060209,2,機電安全信箱電飯煲傳焦味　應即停用,機電安全信箱 電飯煲傳焦味　應即停用 謝女士近日使用電飯煲時，飯煲偶然發出輕微焦味，而該電飯煲的功能仍然良好。  謝女士問：  (1)為何電飯煲會發出焦味？  (2)使用電飯煲時有何安全事項需要留意？ 交經驗技師檢查 機電工程署回覆如下：  (1)電飯煲在使用時偶然發出焦味的原因有很多，這可能是內膽底部黏有異物或電飯煲內部配件損壞，當飯煲使用時，高溫把異物或損壞配件加熱變焦所致。  但這僅是電飯煲發出焦味的常見原因，並不足以反映個別情況。  為確保安全，若發現電飯煲有焦味或其他異常情況，應立即停止使用，並交由供應商或有經驗技師檢查。  (2)使用電飯煲時需留意事項：  ‧電飯煲周圍應預留足夠散熱空間  ‧使用時，避免把電飯煲放在煮食爐具旁，以免飯煲外殼溫度過高，令內部機件過熱  ‧不應把電飯煲放在洗滌盆旁邊，亦不可弄濕接駁電飯煲的電源線插頭部及其軟電線，以免飯煲沾水而引致漏電 確保內膽沒異物 ‧使用電飯煲前必須檢查內膽，確保內膽外部沒有異物或水份  ‧確保電飯煲水滴收集孔沒有被阻塞，及沒有積水滲入飯煲內部  若對家用電器產品的安全有任何懷疑，或發現有異常情況，應立即停止使用，並交由供應商或有經驗的技師檢查，或致電政府熱線1823查詢；亦可來信機電工程署電力法例部（九龍啟成街3號），或瀏覽機電工程署網頁www.emsd.gov.hk，以獲取有關電器安全的資料。    服務熱線  電話：29908288  傳真：23702192  電郵：sservice@appledaily.com	
20060209-3,20060209,3,百佳售過期嬰兒飲品,百佳售過期嬰兒飲品 【本報訊】農曆新年期間，超市出售逾期食品的情況仍然毫無改善，位於屯門鄉事會路的百佳超級市場，昨晚竟然被踢爆出售過期嬰兒飲品。一款專供嬰兒飲用的嘉寶（Gerber）牌梨汁，逾期已兩個多月。  出售過期食品的百佳超級市場位於屯門鄉事會路與河傍街交界，昨晚記者在超市內其中一列專賣嬰兒食品及飲品的貨架上，發現五樽嘉寶牌的梨汁竟全是過期飲品。  這五樽售價分別六元五角的梨汁，均是一百一十八毫升裝的嘉寶牌梨汁，記者發現這五樽梨汁的玻璃樽樽底均刻有「BestBefore」及「此日期前最佳」的中英文字樣，而刻在樽底的日期是二○○五年十二月二日，顯示該飲品的最佳食用日期已過。 誤食或會中毒 當記者向百佳職員表示梨汁已過期時，一名女職員十分緊張地說：「嘩！過咗期啦！」然後立即將貨架上的梨汁取走，並向記者說：「如果有人買咗，退番嚟，我哋會畀番錢。」  兒科醫生陳以誠表示，一般而言，已超過食用限期的食物品質可能有變，市民絕對不宜購買。他解釋，若製造時經真空無菌處理程序，有關食物即使超過食用期限亦未必即時變壞，但無可否認是食品可能已變壞、出現雜質、甚至滋生細菌，市民誤食可能引致食物中毒，他呼籲市民不要冒險購買，安全至上，購買食品前應小心查閱包裝紙盒、玻璃瓶樽蓋上的食用限期。  最近一段時間，多家大型連鎖超市接二連三被揭發出售過期食品，農曆新年前，葵青區的區議員更透過「放蛇」行動，在區內的百佳及惠康超市，發現大批的逾期食品，當中包括過期四年半的火鍋湯底及過期近半年的嬰兒米粉。
20060209-4,20060209,4,國產電視突著火焚屋,國產電視突著火焚屋 【本報訊】元朗一個家庭的一部國產電視機昨懷疑機件故障引致短路，發生爆炸並着火焚燒，屋內一名老婦、印傭及手抱的六個月大嬰兒，另還有一頭犬隻慌忙走火警逃生逃過一劫。消防員到場將火救熄，但起火單位遭嚴重焚毀。  現場泰豐街五十號錦華樓二樓一個單位，男戶主姓李，住有一家六口及一名印尼女傭，肇事的二十一吋電視機是國產牌子。據戶主女兒李小姐稱，該部電視機於數年前在內地買回來，以往未有試過出事。現時家居付諸一炬，由於有購買保險，賠償事宜由保險公司處理，家人需要搬到親友家中暫住。 印傭抱少主逃生 事發昨下午二時許，屋內只有男戶主母親、印傭及一個六個月大嬰兒，另外還有飼養的狗隻「波子」；其時，該名七十多歲老婦，正在廳中看電視，懷疑電視機機件故障引起短路，突然發生一響爆炸，隨即冒煙及着火焚燒，在房內照顧嬰兒的印傭，聽到聲響出來察看，見狀連忙抱着嬰兒及帶同老婦，以及愛犬波子跑落地下逃生。  火舌向屋內蔓延，火警現場冒出大量濃煙，住在樓上約六、七名住客走上六樓天台暫避，另約有十名住客則疏散到地下，消防員接報到場，開一條喉及兩隊煙帽隊撲救，以及架起雲梯戒備。消防員在樓上一個單位，救出一名不良於行的老婦，並於十分鐘後將火救熄。  但起火的電視機被燒至熔化，全屋被嚴重熏黑及受水迹影響，李小姐表示，火警損失難以估計，可幸的是家人及愛犬都沒有受傷。  現時天氣開始潮濕，電視機最容易起火，據消委會指出，電視機火警的主要原因，是因為機件老化損耗，或機件出現問題，以致過熱短路起火，而傳統的顯像管電視機，內有高電壓裝置，加上電路零件較多，如果天氣潮濕，進入電視機的濕塵容易成為導電體，因此釀成火警。消委會提醒市民，使用電視時注意安全事項，包括用開關掣關閉電視，並需定期清理積塵（見附表）。
20060209-5,20060209,5,豐收教會牧師資格受質疑,豐收教會牧師資格受質疑 【本報訊】在馬來西亞失蹤的本港豐收教會成員譚珮筠至今未有音訊，香港教會更新運動聯同一批教牧人員將於今日發出聲明，對豐收教會負責人梁子孝的行為操守及牧師資格存疑，認為他與教徒的關係已超越教牧人員與異性接觸的界限。豐收教會其中一名董事現於屯門一教會中學任教，該校校長感到驚訝，不清楚這名教師有否向學生傳教。 警務處長指調查有困難 有份參與今次聲明的香港教會更新運動總幹事胡志偉牧師昨表示，發表這份聲明是要澄清外界對基督教教會的誤解。他指根據近日傳媒刊登梁子孝與教徒的曖昧相片及內容，有正統教派人士認為梁已超越教牧人員與異性接觸的界限，有違反教牧人員專業操守之嫌。  胡志偉又指，梁的牧師資格未經正規申請及未經教牧團審核程序，亦無經過「按牧禮」，只是梁自己宣稱牧師身份，本地教會不會接受。但他坦言因本港並無法例規管牧師資格，所以梁此舉並無違法。  另豐收教會其中一名董事現於屯門浸信會永隆中學任教，她回應本報查詢時承認有此事，但以私人問題為理由不作答。該校校長譚日旭得悉事件後感到驚訝，他說並不知道豐收教會的背景，亦不清楚該教師有否藉機向學生傳教，「我哋作為一間教會學校，老師同學生分享一吓信仰問題一啲都唔出奇。」  譚珮筠未改信豐收教會前，是中華基督教禮賢會香港堂信眾，該堂的宣教師何少玲昨表示，譚於幾年前突然轉教會，她曾與譚聯絡，當時譚聲稱「好攰，想休息吓先。」自此再無聯絡。  警務處處長李明逵昨出席警察員佐級協會新春酒會時表示，譚珮筠一案警方暫列失蹤人口案處理，暫未有人被捕或協助調查。警方已透過國際刑警與馬來西亞警方聯絡，要求當地警方協助調查，目前暫未有需要派本港人員到當地調查。但他直言由於案件發生在馬來西亞，並非香港司法管轄區，警方在調查上有一定困難。
20060209-6,20060209,6,聘未成年少女　提供「一二三」性服務淫賤網吧大亨重囚,聘未成年少女　提供「一二三」性服務 淫賤網吧大亨重囚 【本報訊】警方於○三年九月展開「火苗行動」，派出卧底探員滲入油尖旺區色情場所蒐集證據，成功拘捕五名骨幹成員，當中包括有淫賤網吧大亨之稱的盧氏兄弟，兩人將網吧與淫業結合，聘用未成年少女提供手淫、口交及性交，收費由一百至三百元不等，俗稱「一二三」的性服務。繼弟弟早前被判入獄後，哥哥昨日亦因十四項控罪，被法官重判入獄四年。　記者：黃詠鍶 本案四名被告順序為盧偉民（四十四歲）、蔡禮財（三十六歲）、廖冲非（四十七歲）及趙德雄（四十三歲）。四人早前被裁定十四項管理賣淫場所及洗黑錢罪名成立，暫委法官胡雅文在判刑時指，首被告明顯為案中主腦，須重判入獄四年；次被告為其副手，判處入獄三年三個月；另兩名被告則各判入獄兩年半。 官指業務策劃仔細 法官表示，根據一名曾在「情心網吧」工作的上網輔導員供詞，被告曾至少聘請一名未成年少女在網吧內賣淫，並吩咐她們如遇上警方掃黃時便從後門逃走，或訛稱「見工」或「找朋友」。法官雖然接納那些少女並非在不自願的情況下於網吧內工作，但認為那些少女在脆弱、易受影響及易被剝削的年齡，被告聘請她們賣淫實不為社會及道德所接受，此亦為本案加重刑罰的因素。  法官續指，被告的業務有組織並曾經仔細策劃，除在街上派發傳單及豎立廣告板外，更於成人雜誌上刊登廣告，控方亦以罪行屬有組織性為由申請加刑。不過，法官指控方並無提供足夠證據顯示，有關被告所經營的賣淫場所規模及賣淫所得的利潤，加上法官本身採納的判刑起點亦已反映控罪的嚴重性，以及各被告在案中所扮演的角色，故拒絕控方有關申請。有份參與是次行動的警務人員表示，警方尊重法庭的判決，並指警方一直有監察情報以打擊淫業活動，經過連番掃蕩後，淫賤網吧已逐漸式微。 上網輔導員作掩飾 根據控方案情，本案四名被告管理位於旺角及佐敦至少七間賣淫場所，當中兩間網吧曾聘用未成年少女擔任上網輔導員，為客人提供賣淫服務，網吧內的一二三性服務，任客人選擇，分別指手淫、口交及性交，收費由一百至三百元不等，證據顯示，四名被告在銀行戶口內處理八百四十多萬元賣淫場所得益。首被告的弟弟盧偉雄另案於去年五月，就兩項管理賣淫場所罪被判入獄一年半。  案件編號：DCCC882/04
20060209-7,20060209,7,O記策劃　派臥底滲透蒐證火苗行動曾拘「車壇教父」,O記策劃　派臥底滲透蒐證 火苗行動曾拘「車壇教父」 警方有組織罪案及三合會調查科（俗稱O記），○三年九月起展開火苗行動打擊淫業，除派出卧底探員假扮嫖客外，亦安排探員滲入盧氏兄弟擁有的部份賣淫場所任職以蒐集證據，當中有卧底探員在行動中被捕。警方經過半年深入調查後進行拘捕行動，而「車壇教父」呂米高亦曾被指於案中的情心網吧被捕，最後因證人證供不可靠，呂米高被控的對十六歲以下兒童作猥褻行為罪被判無罪釋放。  火苗行動由O記統籌，並與西九總部重案組、刑事情報科及機動部隊等聯合行動，其中一次於○四年三月二十五日凌晨，派出七百五十人搜查多處地方，並在十四間色情場所內拘捕四百多人，其中包括二百一十八名妓女及十三名骨幹成員，當時警方曾凍結淫業集團資金達四千五百萬元。  警方在掃蕩後發現，盧偉民經營的賣淫場所在旺角弼街一幢大廈內設有監察中心，內設多部連接本案七間賣淫場所的電腦。  據悉，由於經營色情事業大不如前，而年輕人近年喜愛流連網吧，有人遂將網吧與色情事業結合，把淫賤網吧引入建立淫業王國。  本報記者
20060209-8,20060209,8,遺孀心情漸平復　帛金盡捐公益金埃及奪命車禍：銀行家父子下周二出殯,遺孀心情漸平復　帛金盡捐公益金 埃及奪命車禍：銀行家父子下周二出殯 【本報訊】埃及奪命車禍十四名死者遺體全部運回香港，其中同時罹難的老牌華資廣安銀行家族梁定中父子，將於下周一設靈，翌日出殯。據了解，梁定中的遺孀黃青雲心情已逐漸平復，在親友協助下處理丈夫及兒子後事，並決定把所有帛金捐送公益金。  主辦涉及車禍埃及旅行團的旅行社捷旅假期昨日發表聲明，表示經保險公司安排下，車禍死者遺體本周陸續運抵香港，最後一批遺體預計今日抵港，目前尚有八名傷者分別在法國巴黎及瑞士蘇黎世留醫。 重傷次女已返港就醫 遺體抵港，車禍死者家屬開始籌備後事，銀行家梁定中、梁耀威父子將於下周一在香港殯儀館設靈，星期二中午大殮並出殯。承受喪夫喪子雙重打擊，在埃及表現哀痛心情激動的梁太黃青雲，事發後一直以淚洗面，未能接受痛失至親事實。據了解，她近日心情逐漸平復，着手處理丈夫及兒子後事，並決定把所有帛金捐送公益金。至於在車禍中受重傷的次女梁苑婷已返港就醫，但暫時未知能否出席喪禮送別父親及弟弟。  在巴黎留醫的傷者中，年僅十五歲的林展藤傷勢明顯好轉，昨轉至普通病房，並可半卧在病床上看電視。母親在車禍中喪生的林展藤似不想回憶慘劇，表明不願多談意外，僅表示傷勢已無大礙。其父林家川傷勢較嚴重，仍需在深切治療部留醫，林展藤稱暫未知父親傷勢進展。 受傷領隊返港仍無期 同樣在巴黎留醫的旅行團領隊黃偉雄情況穩定，醫生稱已安排心理醫生輔導他，以讓他盡快克服心理創傷，但未知何時可送返港治療；另一傷者麥潤成仍在深切治療部，其親友已抵達巴黎，麥送抵巴黎時情況頗為嚴峻，但病情近日逐漸穩定。  此外，捷旅假期昨宣布車禍後設立的兩條二十四小時查詢熱線停止運作，市民如有任何查詢，可在辦公時間致電62995828。
20060209-9,20060209,9,埃及醫生「斷漏症」爆肺傷者照送上機險死,埃及醫生「斷漏症」爆肺傷者照送上機險死 【記者白琳蘇黎世直擊】正在蘇黎世接受治理的埃及車禍傷者，其中兩人被發現遭埃及醫生「斷漏症」。兩名出現「氣胸」（俗稱「爆肺」）的傷者在醫護人員毫不知情下送上飛機，險因氣壓轉變而死，直至送抵蘇黎世才被發現。有本港醫生指出，若將嚴重爆肺傷者送上飛機，傷者或因呼吸加速而窒息致死。 傷勢幸未惡化 兩名在蘇黎世的傷者李年歡與鄭燕玲現仍插着喉管協助呼吸，其中李剛接受手術，至今麻醉未醒；鄭被送到蘇黎世時下巴嚴重燒傷，估計是車禍發生時下巴曾猛烈摩擦；兩人手腳紅腫，醫護人員要立即為他們包紮消腫。  據悉，兩人在車禍發生後均出現爆肺，但埃及的醫護人員一直未發現，直至兩人送上飛機一刻仍茫然不知，猶幸他們傷勢未有因此惡化。香港醫學會會長蔡堅稱，爆肺在醫學上稱為氣胸（Pneumothorax），傷者不適宜乘搭飛機，因氣壓變化會令其呼吸加速，嚴重者要在飛機上立即接受手術，將管插入胸部排走空氣，否則會令傷者窒息而死。  中國駐蘇黎世大使陸文杰表示，日前已探望送抵的港人傷者，又指埃及醫護為傷者處理傷勢不理想，要蘇黎世的醫護人員重新包紮。事實上，埃及醫生斷漏症已非首次，已轉送巴黎的肇事旅行團領隊黃偉雄，其埃及治療報告未有發現他頸部骨裂。
20060209-10,20060209,10,寬仔慘死全校師生默哀,寬仔慘死全校師生默哀 【本報訊】九歲小二男生盧漢寬，前日早上在將軍澳景明苑住所對開上學途中被車撞死事件，寬仔父母昨晨到殮房認屍時，雙雙哭成淚人。寬仔就讀學校全體師生在昨日早會為他默哀，有同學獻上心意卡懷念他，亦有同學寫卡安慰寬仔父母：「盧漢寬父母，請你們不要這麼傷心。」  昨早十時許，寬仔父母、兩名兄長及親人一行九人，抵達沙田富山殮房認屍。在未認屍前寬仔母親已哭個不停，需親人在旁不停安慰，至認屍後寬仔父親亦按奈不住哭起來，由協助認屍警員用車接載他們離去。  另外，寬仔就讀的彩虹邨聖公會日修小學，前日早上不幸事件發生後，校方即時通知全校師生有關消息及啟動危機小組，教統局心理學家及社工瞬即到學校協助處理學生情緒。 安慰「你們不要太傷心」 昨早八時許，校長李偉栢在早會內鼓勵全校師生不要過份難過，同時為寬仔默哀一分鐘。校方同時向同學派發心意卡，鼓勵同學寫出對事件感受以宣洩不安情緒。有同學藉心意卡道出對寬仔的懷念及安慰寬仔父母：「我覺得好傷心，時時都好難過。」、「你的家人好想念你，希望你能安息。」、「雖然你們的兒子不幸死了，但是你們不要太傷心。」讓同學掛上心意卡的壁報板，同時貼上寬仔生前的剪紙勞作及他喜愛的海豚卡通公仔。  學校姓陳教務主任表示，數名與寬仔諗熟的同班同學，在事件後表示十分不開心，但無太大情緒問題，校方及教統局會跟進輔導，其餘師生未見出現問題。他指寬仔性格乖巧樂於助人，轉校後成績大有進步，深受同學歡迎和老師疼愛，更曾於上學期當上班長，同學及老師對他不幸遇事深感難過。  此外，寬仔以前就讀的尚德邨一間小學昨發表聲明，表示對寬仔不幸喪生感到難過，已為全校師生提供心理輔導安排。對於寬仔父親不滿校方未有讓兒子留班致需跨區上學，校方指乃根據教統局一般升留班指引處理。
