key,date,article_daily_id,title,text
20061205-0,20061205,0,煲呔求連任　腰斬銷售稅,煲呔求連任　腰斬銷售稅 【本報訊】為了連任，沒甚麼不可放棄。受各界批評的商品及服務稅（俗稱銷售稅）諮詢工作正「殺入直路」，財政司司長唐英年昨突然宣布，政府在餘下三個月諮詢期內，不會再推介銷售稅。據悉，今次半途「腰斬」銷售稅是特首曾蔭權的意思，旨在推高本人民望為角逐連任特首掃除政治障礙。官場指出，這也是推銷銷售稅無方的唐英年有意離開官場的訊號。　記者：雷子樂、白琳、莫劍弦 唐英年昨晨出席行政會議後突然主動向記者宣布，剛向行會滙報稅制改革公眾諮詢中期檢討。過去五個月的諮詢中，發現公眾贊同需要擴闊稅基，但對銷售稅持保留態度。他指政府清楚聽到市民強烈反對銷售稅的聲音，承認未能說服市民將銷售稅作為解決稅基狹窄的主流方案：「現時未有民意基礎同條件推行，所以喺餘下諮詢期內，唔再推介銷售稅。」 官場流傳唐將離開港府 唐英年昨午出席傳媒簡報會，被問及「斬稅」是否特首曾蔭權施壓時說：「呢個係我個人決定」。當被追問這決定是否與下周日的選舉委員會選舉，或全國人大委員長吳邦國近日訪港有關，唐只重申這是其個人決定。曾蔭權昨亦擺出一副置身事外的態度，指他與所有行會成員都支持唐的決定。  雖然唐一力承擔「斬稅」決定，但接近政府消息人士稱，曾蔭權昨日在行會會議表明贊同放棄推銷銷售稅。據悉，曾對唐硬銷銷售稅一直有微言，擔心會影響政府民望。消息人士指曾蔭權明年一、二月宣布角逐連任特首，他一直希望參選前進一步推高民望。放棄銷售稅可推高民望，又可避過競選時要對落實銷售稅表態。官場相信，半途斬稅是曾蔭權的主意。  對唐英年而言，「斬稅」卻是政治挫敗。有官員稱，早前官場盛傳，唐今次落力推銷銷售稅，是想顯示其能力，為角逐下屆政務司司長鋪路，可是隨着各方看淡，政府內部已流傳唐無意留任下屆政府的消息。不少官員認為今次唐決定放棄銷售稅，是他將會離開官場的訊號。 見好收恐失擴稅基民意 另一政府消息人士解釋，今次政府放棄銷售稅，主要是已成功爭取市民支持擴闊稅基，政府認為應「見好就收」，若堅持下去，不但無法扭轉民意，甚至會令支持擴闊稅基的民意轉軚，結果得不償失。  不過，身兼行政會議成員的立法會泛聯盟議員陳智思對政府突然轉軚深感失望，「我個人反對呢個決定，因為過咗今次時機，就好難再推」。唐英年希望市民會繼續就其他可行方案提意見。稅制改革公眾諮詢中期報告指其他擴闊稅基可行方案，包括環保稅、陸路離境稅、資產增值稅等。 學者稱是一個政治決定 城市大學專業進修學院學術統籌宋立功認為，政府突然擱置推介銷售稅是一個政治決定。他指出，過去數個月國家領導人談及香港，最突出的主題是建立和諧社會。目前大部份民意反對銷售稅，又不獲各黨派支持，加上選委會及特首選舉在即，難免令人懷疑有關決定是希望掃除一切不利因素。  反對銷售稅大聯盟歡迎政府的決定，大聯盟主席兼立法會議員方剛說：「唔希望呢個係政府權宜之計，大盟聯堅持簡單低稅制，保住香港購物天堂美譽。」民主黨經濟政策發言人單仲偕歡迎有關決定，並指出政府從間接稅所得的收入比薪俸稅還多，根本毋須擴闊稅基。  受惠於不會開徵銷售稅的消息，多隻本地零售股昨日均造好。便服零售商佐丹奴升4.72%收4.22元；經營崇光百貨的利福國際早上一度升至18.3元，最後升幅收窄至1.43%，收17.7元；迪生創建亦升1.24%至8.15元。
20061205-1,20061205,1,李澤楷︰我要真民主選委政綱表立場　中聯辦出手打壓,李澤楷︰我要真民主 選委政綱表立場　中聯辦出手打壓 【本報訊】電訊盈科主席李澤楷繼出售電盈股權事件中觸怒北京後，正競逐選舉委員會議席的他將向資訊科技界選民發出宣傳單張，以「齊心爭取真民主」為題，表明支持重視民主發展的特首候選人，又要求新一屆特首加快香港民主進程，更說會利用其國際網絡，令香港變得更民主。過去鮮有公開談論對民主政制立場的他，又聯同六名IT20參選團隊成員，另行發出宣傳單張，要求加快本港政改步伐。據了解，中聯辦曾嘗試出手阻攔，但最終無功而還。　記者：莫劍弦　莊曉陽 李澤楷原本夥拍19名資訊科技界人士，以「IT20」名義，撰寫聯合政綱出選，IT20政綱主要強調業界利益，並無提及對民主普選的立場。據了解，一直對民主普選有堅持的李澤楷，希望向業界選民交代更多他對民主普選的看法，故決定自行印製個人競選宣傳品講述民主理念。 列支持者包括方敏生 本報昨日向選舉事務處查閱候選人登記的競選宣傳品時發現，李澤楷上周五已登記一份個人宣傳單張，單張以「齊心爭取真民主、我需要你的一票」（Yourvoteiscrucialtoachieverealdemocracy）為題，並將「真」字印得特別大，開宗明義以爭取真正民主為目標。單張日內將寄到選民手中。  除了講述對業界的貢獻、個人專業資格外，李澤楷在宣傳單張中多處談及其民主理念，包括「支持重視資訊科技及民主發展的特首候選人」，「期望新一屆特首加快香港民主進程」，他將支持香港發展民主，作為他對特首候選人其中一項重要訴求。  李澤楷又強調，他有很強的國際網絡，會利用這方面協助香港發展資訊科技，「令香港成為更開放、更民主的地方。」他更列出一些來自學界、資訊科技界及社會福利界的支持者，包括社聯行政總裁方敏生。  李澤楷又夥拍其他六名IT20的成員，再發出另一份拉票宣傳品，包括莫乃光、李惠光、劉嘉敏、趙志洋、賴錫璋及麥鄧碧儀，除了交代對資訊科技界的建議，更表明關注政改問題，「要求更積極推動有利香港社會和諧及經濟發展的民主政制改革」。  下周日將舉行選委會選舉，選出負責推選新一屆特首的800人。資訊科技界共設20選委議席，共有39人角逐。 學者：難免影響李嘉誠 業界人士透露，今次李澤楷自行發出宣傳單張闡述民主理念，又拉攏IT20六名成員另行出宣傳品，變相令IT20拆夥，引起中聯辦不滿，他得悉有中聯辦中人曾向相關人士施壓，企圖阻止他們另出宣傳品，但最終無功而還。  與李澤楷另出宣傳單張的莫乃光接受查詢時表示，他們七人以往經常在業界事務合作，各人對界別問題理念相近，所以再走在一起發出宣傳品，莫乃光並不否認七人在促進本港民主步伐立場相若，看法十分接近，但他說，沒有中聯辦中人接觸他，阻止他夥拍其他六人、另行印發宣傳品。  中文大學政治與行政學系高級導師蔡子強認為，李澤楷在選委參選政綱中表明支持民主，是一件好事，可以借此向公眾證明，不是所有工商界都是唯利是圖、反對民主普選，工商界之中同樣有開明人士，支持民主普選，但蔡子強相信，李澤楷今次高調支持民主，難免影響其父親李嘉誠與北京關係，令李嘉誠尷尬。
20061205-2,20061205,2,婦墮祈福黨圈套　哭訴：俾鬼整60萬現金換一叠陰司紙,"婦墮祈福黨圈套　哭訴：俾鬼整 60萬現金換一叠陰司紙 【本報訊】一名當大廈保安員的婦人因為愚蠢和貪心，昨在荃灣街頭被「祈福黨」兩名女騙徒騙去畢生積蓄60萬元。騙徒以介紹一份高薪工作給女事主作餌，游說她祈福酬謝神恩，並謂以真金白銀作祭品，將可以獲取「祭品」一倍的回報，女事主於是拿出畢生積蓄給騙徒祈福，結果60萬元換來一叠陰司紙。她事後向警員哭訴：「真係俾鬼整，仲有咁多攞咁多，驚死唔夠！」　記者：吳國威 女事主姓李，56歲，育有三子都已長大成人，現與次子同住葵涌邨，她在屯門湖景邨當大廈的夜更保安員。昨晨8時許，她下班後到荃灣楊屋道街市準備買餸回家，其間有一名年約40歲、中等身材及束短直髮的女子走近搭訕，言談間，對方指女事主現時的工作太辛苦，表示可以介紹一份較舒適而且高薪的工作給她。 搭訕介紹高薪工作 正當女事主猶豫不決之際，第二名女騙徒出場，她年約30歲、5呎6吋高、中等身材及束曲髮，扮作在旁聽到兩人對話，並謂：「佢唔做，不如介紹我做啦！」此時，女事主見有人和她爭做該份工作，立即向一女騙徒說：「我做，我做！」  這時候，兩名女騙徒見李婦經已上當，於是進一步一唱一和，指女事主真是有福，一定是有神靈庇佑且必須祈福酬恩。第一女騙徒更謂祈福一定要以真金白銀作祭品，而且可以得到一倍的回報，例如以10萬元祈福，將來就可以賺回20萬元；此時，第二女騙徒即表示亦要加入一齊祈福，並相約稍後在附近國瑞道公園會面。  女事主信以為真，於是先後到兩間銀行提取了全部積蓄共60萬元，再到公園與兩名女騙徒見面。當時，第一女騙徒已準備了兩個一式一樣的環保袋，裏面各放有兩個蘋果，給了女事主和第二女騙徒，並着她們各自用報紙將鈔票包裹，然後放入環保袋內。李婦信以為真依照吩咐，用報紙包好60萬元現金，然後放入袋中。  第二名女騙徒亦裝模作樣用報紙包鈔票，事實上她是將一叠陰司紙用報紙包上。之後兩人將兩個環保袋交給第一女騙徒，對方即着她們閉上眼睛誠心禱告，然後趁此機會將兩個環保袋對調，待女事主禱告完畢後將環保袋交回給她，叫她回家再上香一次，至凌晨零時才好打開取回款項。  女事主「千多謝、萬多謝」後與女騙徒道別，並見她們進入大窩口地鐵站，自己亦返回葵涌邨住所。在返家後，李婦打開環保袋取出報紙包裹的鈔票，豈料拆開一看即晴天霹靂，發覺全是陰司紙，始知受騙。 「仲有咁多攞咁多」 李婦在中午12時報警，並帶警員到肇事國瑞道公園調查，其間女事主講述事件時十分激動：「俾人呃晒啲錢，真係俾鬼整，仲有咁多攞咁多，驚死唔夠！」其後李婦長子接報到場，見母親傷心痛哭，便安慰她說：「算啦，你都係想我哋好啫！」警方現正追緝兩名女騙徒歸案。  短短15天，沙田和荃灣先後發生祈福黨騙案，兩名婦人合共被騙去160萬元。警方新界南警區指揮官鄧厚江昨坦言，關注該兩宗在其轄區發生的祈福黨騙案，將針對平日不留意新聞的長者進行宣傳。警方過往亦曾建議法庭加強街頭騙案刑罰。警方資料顯示，今年首十個月接獲171宗街頭騙案，涉及1,140萬元財物損失，雖比去年同期的318宗、涉及1,900萬元損失下跌，但案件逾半與祈福黨有關。上一宗發生在上月20日，沙田廣源邨一名婦人被騙100萬元。"
20061205-3,20061205,3,近期學校食物中毒事件,近期學校食物中毒事件 10月25日 馬鞍山曾璧山中學及小西灣漢華中學，共33男、12女生，吃過2間供應商提供的午餐後，肚痛和嘔吐 9月28日 天水圍妙法寺陳呂重德紀念中學13名中一生，吃過供應商提供的粟米雞絲飯後感肚痛和作嘔 9月21日 元朗公立中學校友會小學12名小六生，吃過供應商送來的飯盒後嘔吐不適 9月14日 馬鞍山香港道教聯合會純陽小學34名小學生和1名老師，吃過供應商提供的「雞翼、珍寶腸和粟米提子乾炒飯」午餐盒後屙嘔肚痛 9月13日 大埔羅定邦中學8中一生，吃過由供應商提供的午餐後，上吐下瀉不適  資料來源：《蘋果》資料室
20061205-4,20061205,4,陶傑專欄：種族平等須政府帶頭 - 陶傑,陶傑專欄：種族平等須政府帶頭 - 陶傑 特府完成《反種族歧視條例》草案，通過之後，港人將禁止公開呼喚「阿差」、「賓妹」、「㗎頭」、「鬼佬」等，以免對該等弱勢族群造成心理創傷。  此一條例，抄襲自英美西方文明國家，亦為華人世界就所謂種族歧視問題第一個政府模仿歐美立法者。特府拼盡全力與國際文明勢力接軌，連日本也沒有類似法例，特區不但超越了日本，而且率先掙扎「脫亞入歐」，是為繼「雞珍」當選世衞總幹事後，令港人再「威」一次，吐氣揚眉，令人深為欣賞。  「阿差」、「賓妹」之類的惡搞謔稱，流毒多年，破壞社會和諧，立例禁止呼喚，極為及時。然而反對種族歧視，不止流於封上兩片嘴皮。實現特區種族平等，就像五天工作，必須由政府帶頭垂範。僅以印巴裔人士為例，他們許多在香港祖居三代以上，操流利粵、英、印、巴等三四國語言，更以粵語為母語，理應同工同酬。特府應該做個榜樣，未來新開的四十多個政治委任的副局長，局助之類，率先撥出兩成空額，由特區印巴裔人士出任，以示特府反種族歧視之誠意。  根據《基本法》，只有特首與司局長方須由黃面孔百分之百純正中國種裔人士出任，連有八分一混血者也沒有資格，但局長副助級《基本法》並無規定，特首也不必「報請中央任命」。本港印巴裔人士才學俱備者甚眾，至少當日如果「商人治港」，由夏里拉來做特首，一定好過董伯。 照顧印巴裔人士工酬平等權益，遺珠已久，不要只禁口頭稱呼，就算香港六百萬人，由今日起，把印巴裔人士尊稱做爸爸、爺爺、皇帝，但電視台六點半粵語新聞報道員沒有一個印巴女性，各大傳媒總編輯沒有一個印巴男性，上自滙豐、中行的行政總裁，下至電台名嘴DJ。九巴小巴的士司機，也沒有一位出身麼地道、自小在麥花臣球場與香港華裔街童一起「碌泥沙」踢足球長大的印巴港人，口惠而實不至，說不過去。  在英帝殖民地時代，尚有一個印巴裔精英鮑文，官拜運輸署長，證明印巴裔人士完全有能力管好香港。豈料特區時代卻倒退到管治班子中國種族清一色──雖然其中不乏據親中派所指係「黃皮白心」的生理華人、心理白人的問題人員──但表面看來，全部黑髮黃皮，半根雜毛也沒有，如何令人滿意？  特府不妨先做一個內部檢討，看看政務官天之驕子、行政與新聞主任等，有多少印巴裔人士，還是少數族裔只限於懲教署各大監獄的通櫃執行主任一層，幾十年來閉塞難以升遷，做一個報告，帶頭改善，較為服眾。例如主理此事的林鄭月娥，露面時身邊的新聞副官，由印巴裔女性出任，含笑以流利粵語解釋政策，就順眼許多，豈非好過只禁止市民呼喚「阿差」？  逢周二、四、六刊出
20061205-5,20061205,5,花6萬元減磅失敗無錢退,"花6萬元減磅失敗無錢退 在瘦身熱潮下，不少女士不惜「一擲千金」參加瘦身療程。有女士早前以60,000多元購買三項減肥療程，由於不屬於合約保證包減的計劃，最後成效不顯著，但要求退款卻被拒。有關公司表示，合約沒承諾必須減至指定磅數，且事主未按建議接受療程，影響效果。  體重150磅的郭小姐，一直嫌自己身形過胖，今年5月她到沙田一間纖體公司參加減肥療程，共簽了三份合約，收費逾64,000元，減肥療程包括用儀器減肥、人手通淋巴及做「太空艙」，職員稱這些療程可針對殲滅脂肪，但合約內沒列明指定期限內可減的磅數。  由於她常到內地公幹，故未能配合每星期做一至兩次療程，多月來因未見成效，磅數仍保持原位，故要求提前解約及退款，但被拒絕。 非保證包減計劃 有關纖體公司分店負責人回應，郭小姐的減肥療程屬於非合約保證包減的計劃，故沒指定期限內須達致指定磅數，該公司已列明簽約後不能取消及退款，故此她仍要履行有關合約。由於客人於6至8月期間只到該公司進行七次療程，較建議的每周安排一至兩次為少，另要配合營養師的均衡飲食指導，方能達致最佳效果。  消費者委員會發言人指出，減肥計劃如屬有條件式減磅，即協議在指定期限內減指定磅數，若減不到磅，消費者有權提出退款。相反，若減肥療程沒講明指定期限可減磅數，只要有關公司能提供服務，履行承諾，事主便難以提出解約。  發言人提醒，部份瘦身公司以免費療程出任代言人為噱頭，吸引巿民參加減肥計劃，但這些瘦身計劃附帶一系列條件，除了須跟從其指引減磅外，即使減足有關磅數，也要求參加者須於一段時期內保持有關磅數，否則收回有關瘦身費用，巿民宜留意。  檔案編號：1107001"
20061205-6,20061205,6,美國與世界：美應對伊拉克發最後通牒,美國與世界：美應對伊拉克發最後通牒 柯翰默CharlesKrauthammer 《華盛頓郵報》專欄作者 如今美國人欣然接納所謂「現實派人士」，布殊主義似乎已成歷史灰燼，大家注意到了利益的概念，還以為這是前國務卿貝克和伊拉克研究小組提出的新想法。  難道他們不知道過去五年美國都在忙甚麼？的確，布殊總統言談間總充滿威爾遜主義的理想熱情，例如在他第二次就職演說時，宣稱要打倒暴君。但美國在伊拉克、阿富汗與黎巴嫩的民主化政策，原就建立在美國最具體的利益上。 軍力無法解決動亂 如果美國真的謹守理想主義，就應該去干涉查德、緬甸或是蘇丹達爾富爾地區，但美國並非如此。美國只想在三個戰略地位重要的國家：阿富汗、伊拉克和黎巴嫩，維持脆弱的和平，這三國的重要性，在於它們鄰近對西方利益威脅最大的敍利亞與伊朗。  美國特別想推動伊拉克民主，是因為建立親西方、具有民意基礎的合法政府，可確保美國利益長長久久，侯賽因政權總是威脅到波灣和平與美國利益，趕走侯賽因父子勢在必行。但侯賽因繼任者、民選的馬利基政府卻很失敗。  失敗的原因在於伊拉克複雜的政治文化，國內無法達成共識，領袖難有作為。但是美國仍該設法改變政府結構，結合庫爾德族、溫和的遜尼派、世俗什葉派和其他派系的什葉派，來個政治大和解，組成新政府。  最近大家都說遏止伊拉克戰亂的關鍵在於政治，這又是另一個後見之明，至少一年前就看得出來，美國無法用軍力解決動亂。軍費代價高昂，勝利短暫如雲煙，而且毫無促成政治和解的可能。所謂和解是指按照族裔比例，給予遜尼派應有的政治與經濟（也就是原油）權力，但現在馬利基所領導的什葉派政府卻不能達成此目標。 伊敍兩國鼓吹內戰 美國應對馬利基發出最後通牒：如果他在兩個月之內不能達成政治和解，或是交出政權給新的聯盟政府，美國就要棄守巴格達綠區，退回基地。美國將任由內戰發展，讓身處綠區原受美軍保護、又跟什葉派激進教士薩達暗通款曲的伊拉克政客自行面對叛軍，至少可迫使他們面對問題，要不就是對遜尼派更慷慨一些，要不就是退居幕後，讓願意和解的人來組政府。  要成功惟有從伊拉克內部進行政治改革，不過美國採取的「區域化」新模式，是把伊朗和敍利亞也牽扯在內，要他們替美國解決燙手山芋。這個構想是假設伊拉克若穩定，伊朗與敍利亞都有利可圖。  利益、穩定、區域強權，都是現實主義的典型術語，但要伊朗與敍利亞跟美國分享伊拉克和平的利益，那根本是空想。伊敍兩國在動亂的伊拉克才有厚利，因此兩國都在煽動叛亂，鼓吹內戰。 很差勁的現實主義 最好的情況是，他們給美國幾個月時間撤軍，但美國撤軍為甚麼需要他們幫忙？沒有他們，我們自己照樣可以順利撤軍。而美國還要回報他們於事無補的假幫忙，無異投降，敍利亞可能會再要求美國不插手黎巴嫩，就像在上次波灣戰爭前，美國在伊拉克需要援助，當時的國務卿貝克把黎巴嫩交給敍利亞作為補償。  伊朗也會要求美國放手不管核武計劃，這將使伊朗成為超級強權，主宰波灣阿拉伯國家及油權。這是得不償失的做法，也是很差勁的現實主義。  逢周二刊出
20061205-7,20061205,7,新造木製家具櫃桶有蟲,"新造木製家具櫃桶有蟲 有讀者訂造木製家具，收貨後一星期發現櫃內有蟲，質疑家具本身有問題，有關店舖回應，因事主拒交回貨品作測試，難作跟進。有滅蟲專家稱，以1比99漂白水徹底揩抹家具，可預防及解決木造家具有蟲的問題。  讀者盧小姐本年4月中經創意家居坊設計公司訂造木製衣櫃及雜物櫃，收費16,940元。她於5月中收貨後一星期，發現櫃桶內有不明小蟲出沒，外形呈啡黑點狀。她曾噴射殺蟲水，小蟲死後不久又再出現。她向有關傢俬店投訴，「職員話蟲可能來自屋企其他傢俬，要求我攞其中一個櫃桶落去畀佢哋做測試，但我覺得冇信心，所以冇應承到。」 濕氣過重易生蟲 創意家居坊設計公司負責人洪先生稱，該公司曾要求盧小姐提供其中一個櫃桶作測試，以驗證小蟲來源，但盧小姐拒絕，難作跟進。  亞太區殺蟲業協會聯盟主席陳澤森表示，現時不少家具設計公司工場均設於內地，若工場濕氣過重，便有可能令木材孳生蟲，最常見的是靠食霉菌維生的Booklice，因初期形成時呈透明狀，故難以察覺。  除了保持地方亁爽外，他建議用1比99漂白水清潔全屋家具及地腳線以作預防，至於家具啲蟲會唔會互傳？除非你將放喺有蟲櫃桶的嘢，拎去放喺冇蟲嘅櫃桶，否則可能性唔大。」  檔案編號：1019027"
