key,date,article_daily_id,title,text
20061109-109,20061109,109,陳年裝胸案網上重審肥姐台慶夜迫供阿梅隨口噏,"陳年裝胸案網上重審 肥姐台慶夜迫供阿梅隨口噏 每年總會在無綫台慶中演出搞笑劇的肥姐沈殿霞，今年因接受完胰臟腫瘤切除手術後仍在家中休養，本月19日台慶夜未必能聽到她聲如洪鐘的笑聲。不過，凌零發在網上發現87年肥姐與已故樂壇天后梅艷芳和劉德華等主演的台慶劇《超級八卦法庭》之珍貴片段，眾星齊齊爆肚外，阿梅更拿自己當年谷胸及紋身事件來開玩笑，令人笑破肚皮之餘，更叫人懷念不已。 凌零發在網站YouTube中，看見網友fredling把87年《萬千星輝賀台慶》中的搞笑台慶劇，分成「超級八卦法庭part1（anitamui梅艷芳andylau劉德華）」及partII兩條短片放上網，點擊率合共約有16,000多人次，頗受注目。 陪審團齋坐畀面 在這個《超級八卦法庭》中，肥姐扮演法官、鄭裕玲（嘟嘟）演控方律師、劉德華演辯方律師、已故樂壇天后梅艷芳演控方證人、廖偉雄（阿燦）演庭警，而王晶、陳友和顧嘉煇則客串做陪審員，但就片段所見，三人只是畀面陪坐。  一開始，嘟嘟提出女演員應該跟男演員同工同酬，然後帶控方證人阿梅作供，阿梅指女演員身心所受壓力比男演員大，所以不但要跟男演員同酬，且更要較他們收得更高，阿梅說：「女演員除緋聞外，又話俾人包、又話墮胎、又話紋身，好似我咁俾人話到七彩！」其時華仔插嘴說：「咁係應該嘅！」阿梅聞言即扮怒睥華仔，嚇得華仔連忙更正道：「唔係！」 嘟嘟作勢打華仔 其後阿梅大吐苦水，指女演員走紅後要經常買靚衫見人，又要裝胸作勢十分辛苦，由於當年阿梅曾谷胸拍攝唱片封套，華仔遂追問阿梅究竟有沒有裝胸作勢，雖然控方律師嘟嘟即時提出反對，但肥姐卻抵死地向當年被傳上圍忽然變大的嘟嘟說：「我唔係問你！反對無效，因為我都想知！」  華仔見狀乘機揶揄嘟嘟一番，遭對方作勢追打，其時阿梅聲稱自己沒有裝胸，但華仔仍咬着阿梅不放，要她供出圈內誰人裝胸，阿梅遂鬼馬地說：「曾華倩！佢係裝胸作『細』，唔係大！」眾人的精采演出，逗得全場觀眾拍爛手掌呢！  台慶趣劇大審判  Part1網址： http://www.youtube.com/watch?v=UWBU8v4VlRY   Part2網址： http://www.youtube.com/watch?v=q2XLOfkKWps "
20061109-110,20061109,110,電眼影帝棋逢敵手偉仔唔收錢狂咀徐靜蕾,電眼影帝棋逢敵手 偉仔唔收錢狂咀徐靜蕾 由梁朝偉、金城武、舒淇及徐靜蕾主演的電影《傷城》將於下月在港上映，梁朝偉跟戲中太太徐靜蕾的咀戲更在電影預告片中曝光，偉仔開玩笑稱自己因為沒有片酬，導演劉偉強才如此厚待他，安排5場咀戲給他盡享溫柔，偉仔還大讚對手徐靜蕾有影后風采，能帶到他入戲。 聖誕檔期上映的港產片《傷城》，已定於下月21日上畫，近日電影公司已為該片展開鋪天蓋地的宣傳，而《傷城》最新電影預告片也陸續在全港電影院曝光。  在預告片中，梁朝偉跟徐靜蕾這對夫妻十分恩愛，不管是在客廳走廊，抑或是街上相遇，兩人都會輕輕來個Kiss。 金城武獲生果獎勵 偉仔在片中如此好艷福，問他是否買通導演劉偉強，偉仔開玩笑說：「其實唔係買通劉偉強，係完全免費零片酬至蒙導演照顧，哈哈，大家都知劉偉強好精打細算，金城武跑到標晒汗，佢先至話叫茶水阿姐喺佢飯盒度加多個生果做獎勵，我咁大份優差，斷估都一定畀咗好多好處佢啦。」  不過偉仔表示跟徐靜蕾在戲中是飾演一對恩愛夫妻，所以有咀戲十分正常，他說：「因為我哋喺戲中感情好好，就算喺屋企碰到，都會嚟個HelloKiss。」問他會否打破自己一片中最多場接吻戲的紀錄，偉仔說：「以次數、場數嚟講當然係啦，成5次，不過徐靜蕾不愧為影后，好厲害，由佢眼神我完全睇到個角色，望住佢已經入到戲。」 劉偉強杭州受歡迎 對於被影帝偉仔稱讚，徐靜蕾榮幸地說：「他真的沒有拿片酬嗎？那我是不是也應該退款給導演？還是我更應該給他錢啊，他對我這麼好！」  另一方面，劉偉強和麥兆輝憑《頭文字D》於「2006聯通新勢力中國杭州大學生電影節」中，勇奪大學生最喜愛的電影「金桂獎」寶座，他們日前更專程親自到達當地領獎。  此外，偉仔昨日由北京公幹返港，他戴着墨鏡由三名助手陪同下步出機場，一臉疲倦兼披頭散髮，問他可會陪入圍今屆金馬獎最佳女主角的女友劉嘉玲出席頒獎禮，偉仔以微弱聲音說：「要睇佢。」  撰文：丁寧
20061109-111,20061109,111,ClickClick情報科：《一擲千金》網上版夠闊綽,ClickClick情報科：《一擲千金》網上版夠闊綽 凌零發昨日在美國電視網站NBC.com中，發現近日無綫新遊戲節目《一擲千金》的網上版，凌零發當然第一時間click入試玩，發現網上版的玩法大致跟真實版一樣，都是選號碼箱，不過它就沒有養眼的千金小姐做標記。  既然是網上版，出手亦豪得多，最高的獎金是100萬美元（約780萬港元），真實版只得300萬港幣，相差甚遠。另外，網上版是用電腦計算出價，而沒有一個banker出價的畫面。基本上網上玩法很容易及簡單，如果觀眾有興趣參加無綫的《一擲千金》，大可先上網站試玩練習。  《一擲千金》網上版  網址： http://www.nbc.com/Deal_or_No_Deal/game/flash.shtml 
20061109-112,20061109,112,霆鋒病癒趕赴內地,霆鋒病癒趕赴內地 前日事先張揚因身體不適到養和醫院診病的謝霆鋒，因腸胃炎及哮喘發作要留院一日，昨早他於愛妻張栢芝陪同下出院，吸引十多名記者採訪，霆鋒隨即往機場乘飛機到內地工作，他在醫院表示因發燒可能未能出境，加上因患腸胃炎，恐怕上機後會傳染給其他乘客才決定留醫（編者按：一般腸胃炎不會傳染）一日。至於栢芝就趁霆鋒接受訪問時，先行登上保母車，穿着拖鞋的她腳趾上塗上鮮艷指甲油，十分搶眼。 劉德華內地返港 霆鋒到達機場後，吸引十多名自由行旅客爭相合照，他來者不拒，問霆鋒病好了沒有？他謂已退燒可以上機。問為何栢芝沒有陪他，霆鋒說：「做嘢還做嘢，佢聽日都要去武漢做嘢。」霆鋒又謂其父母謝賢及狄波拉已知其病情。此外，容祖兒昨與琦琦不約而同到上海工作，陳慧琳則與劉德華分別於內地返港。  採訪、攝影：藍文浩、駱華齡、陳順禎
20061109-113,20061109,113,靜待知音賞EO2四仔Blog舞道真情,靜待知音賞 EO2四仔Blog舞道真情 我跑車男頗喜歡跳舞音樂，間中也會留意四個大男孩組成的EO2唱快歌、跳勁舞。雖然他們距走紅仍有一段距離，但其實Otto、Eddie、Eric和Osman工作認真，正等待知音人，跑車男為何知道？因為全都可以在他們的Blog中找到。四個人平時表面嘻嘻哈哈，但其實也有深情一面。在Blog中他們不時分享工作心情，除有以往當舞蹈員的相片，又有近日與其他歌手的排舞相，他們日前接受訪問時不約而同地說：「好多人未必信係我哋寫㗎，但Blog入面嘅嘢全部係自己嘢。只係有時打字打得慢，要同事代勞，但係啲相同內容都係我哋想講嘅。」  EO2Blog：   http://hompy.netvigator.com/main/page/eo2school   OttoBlog：   http://hompy.netvigator.com/main/page/g923     
20061109-114,20061109,114,馮仁昭四圍超：伊健提YoYo失晒魂,馮仁昭四圍超：伊健提YoYo失晒魂 鄭伊健、周麗淇、張智霖、方中信同內地女星霍思燕等，前晚喺觀塘出席新片《天行者》首映。霍思燕以大露背吊帶裙亮相，搶盡密實女主角周麗淇嘅風頭。  伊健啱啱喺泰國完成新劇宣傳工作，一返港即刻趕去首映禮。問佢請咗邊個嚟睇首映？伊健話：「我都未必睇得晒，一陣要返屋企執行李。」問佢點解女朋友唔嚟？伊健口快快答話：「唔得閒，要做嘢。」當指明女方係蒙嘉慧（YoYo）時，伊健即刻詐儍話：「請咗周麗淇，YoYo係邊個嚟？唔記得，好攰。」 前言不對後語 問到伊健首映翌日又要返北京拍劇，咁咪冇時間同YoYo見面？佢話：「冇呀，都唔得閒，一陣要返去瞓覺。」記者即反問伊健唔係要返去執行李咩？佢話：「啲行李喺北京。」問佢點解前言不對後語，佢就話：「真係好攰。」至於俾霍思燕搶盡風頭嘅周麗淇就話：「佢（霍思燕）一向係咁，我哋唔同style，如果我咁着嚇死你啦。」張智霖就透露靚靚袁詠儀就嚟生，但佢點都唔肯講BB嘅性別。
20061109-115,20061109,115,網友拆穿小丐幫身份ClickClick情報科：星爺乞兒女原來係郭襄！,網友拆穿小丐幫身份 ClickClick情報科：星爺乞兒女原來係郭襄！ 很多藝人都當過童星，馮寶寶、黎小田甚至李小龍都是童星出身，想不到在內地吸引萬千男fans的楊冪，除了在《神鵰俠侶》中飾演丐幫幫主黃蓉的小女兒郭襄外，小時候也曾與周星馳在《武狀元蘇乞兒》亮相，飾演對方的乞兒女，不過其出鏡時間不足一分鐘，對白欠奉，若不是網民眼利，恐怕大家都會走漏眼！ 現年20歲的內地女星楊冪，憑《神鵰俠侶》中飾演郭襄一角而為港人熟識，其美貌更吸引眾多港男fans。凌零發日前在香港討論區便發現網友mk1on3234以「冪冪小時候和周星星拍的武狀元蘇乞衣」為標題，指出楊冪原來早在小時候在電影《武狀元蘇乞兒》中飾演周星馳的女兒。 三條辮精靈可愛 根據該名網友所提供的網址，凌零發看到一段名為「楊冪小時於武狀元蘇乞衣中的演出」的YouTube短片，整個片段只有一分鐘，而且已經是電影尾聲，講述周星馳飾演的蘇乞兒向路人討錢，更亮出刻上「奉旨乞食」的金造乞兒兜，其後一群小朋友衝出來，圍着路人團團轉要求更多錢，而身為母親的張敏也在旁幫手，原來現在風靡萬千少男的楊冪，竟藏身該群小朋友當中。  凌零發估計當時的楊冪只有四、五歲，片段中的她梳着三條小辮，樣貌可愛精靈，並由螢幕左下方閃出來走到路人面前討錢，大部份時間都是背向鏡頭，只有約一秒時間可以看到她正面咧嘴而笑，接着便與其他小孩蹦蹦跳跳離開。  雖然楊冪只有幾秒戲份，但眼利的fans仍可把楊冪認出，令凌零發不得不寫個服字。雖然有不少網民質疑片段中的小女孩是否楊冪，不過經凌零發打探所知，楊冪在《武狀元蘇乞兒》中的演出已是人所共知的事，網上有不少有關這段影片的討論，影片也被上載到不同楊冪fans網址公諸同好。 已成超人氣女星 想不到當年還只是客串童星的楊冪，今時今日已經亭亭玉立，還成為炙手可熱的女星，紅遍中港兩地，未知星爺有沒有興趣與這個哎吔女兒來個銀幕父女團聚呢？
20061109-116,20061109,116,網友葉沙超人爆料ClickClick情報科：素顏楊丞琳嚇爆網,網友葉沙超人爆料 ClickClick情報科：素顏楊丞琳嚇爆網 化妝品對女明星真是起了化腐朽為神奇的作用，凌零發昨日在UWANTS討論區中，發現有網友葉沙超人以「楊丞琳無化妝相」為題貼了兩張台灣可愛教主楊丞琳沒有化妝的相片，平時可愛教主出席活動都盛裝打扮，模樣可愛，跟網上兩張無化妝的照片相差甚遠。 激似熊貓 相片中見楊丞琳戴上白色cap帽，穿上黑色T恤，面色蒼白，有網友justice@@留言說：「第一張我見到隻熊貓咋喎！」另外，網友hikaruizaki則說：「嘩……化妝前化妝後都差得幾遠吓喎！」不過，有不少可愛教主的忠實fans仍然力撐偶像化妝前後分別不大。
20061109-117,20061109,117,李亞鵬否認酒吧涉色情,李亞鵬否認酒吧涉色情 噚日內地有報道話，傳聞王菲李亞鵬兩公婆（圖）同內地演員王學兵合資經營嘅北京夜色酒吧，涉及高級色情服務，因為呢排當地警方加強各項查緝，先俾人發現，仲話北京有派出所已經約咗李亞鵬同王學兵會面，不過李亞鵬嘅經理人馬葭就否認有關傳聞，仲要求報道呢件事嘅內地傳媒三日內道歉，否則採取法律行動。
20061109-118,20061109,118,偕何寶生出海放生呂頌賢Blog遊水世界,偕何寶生出海放生 呂頌賢Blog遊水世界 跑車男記得兩位無綫前小生呂頌賢和何寶生向來非常老友，大家同為虔誠佛教徒、同樣愛玩電腦及愛踏單車，但近年呂頌賢轉攻內地拍劇，何寶生已剃度出家。呂頌賢個多月前開始寫blog，除了上載他的潛水照外，最難能可貴的是見到他與法號道生法師的何寶生一同出海放生、孖住上blog的珍貴合照。  呂頌賢和何寶生曾於96年在電視劇《笑傲江湖》中飾演令狐沖和林平之，他們的古裝風采，一直令觀眾難忘，對比現狀，確有十年人事幾番新之感，不過呂頌賢日前和跑車男聊天時卻另有看法：「大家唔好諗到咁upset，法師唔係避世，又唔係乜嘢咁大件事，另一個開始啫，你當佢轉咗做社工，但冇糧出，為人民服務，好多人喺生死邊緣，法師一句話會開導好多人。」  呂頌賢「賢仔漫遊」Blog：   http://lvsongxian.blog.sohu.com 
20061109-119,20061109,119,天映重拍張徹舊作,天映重拍張徹舊作 繼陳可辛宣布重拍張徹（圖二）舊作《刺馬》後，天映娛樂都宣布重拍另外兩部邵氏經典武俠電影，包括張徹導演嘅《五毒》（圖一），同何夢華導演嘅《血滴子》，並作全球發行。《五毒》搵咗曾拍《無字頭四殺手》、《重案組》嘅導演黃志強執導，《血滴子》就搵陳德森做導演。
20061109-120,20061109,120,非關男友事　想做就做樂基兒激光褪紋身嗌痛,非關男友事　想做就做 樂基兒激光褪紋身嗌痛 名模樂基兒昨日與熊黛林及羅霖等往銅鑼灣名店廊行騷，早前見她行騷時發現其大腿側的BB紋身圖案不見了，昨日她終承認以激光褪走紋身圖案，並主動透露連右手拇指位置的海馬紋身圖案也一併褪走，該位置現已結焦，她說：「我不嬲做嘢係鍾意做就做，全身總共有五個紋身，𠵱家唔要呢兩個，唔代表我會陸續褪走埋其他嘅紋身。」她又說：「用激光褪走紋身要四至八次先可以完全褪清，過程畀紋上去時痛好多倍，所以我以後唔會再紋身啦。」問她這是否男友黎明的要求？她說：「唔係。」 定期做檢查 另外，有周刊報道樂基兒早前在醫院出現看婦科，又指她秘密入院四小時，她說：「呢段新聞好離譜，又冇新相，嗰張醫院門口相係舊年11月嘅，完全作嘢，我同大部份女性一樣，都會定期做婦科檢查㗎啦。」  採訪:顏英儀  攝影:陳慧安
20061109-121,20061109,121,馮仁昭四圍超：紅姑托頭撒嬌星味依然,馮仁昭四圍超：紅姑托頭撒嬌星味依然 鍾楚紅息影多年，但依然好有星味，前晚紅姑難得出巡，同女伴去跑馬地彭慶記食家開餐，即時吸引大班記者追訪。   親切揮手拜拜 前晚紅姑約女伴食晚飯，選坐位置開揚，毫不介意食相任人睇，其間佢同朋友傾得好開心，大家有講有笑，紅姑聽對方講嘢時，仲以手托頭聽得入神，其後當佢發現有記者喺門外影相，即時要求換位，轉坐較隱蔽嘅一枱。  到11點零鐘，紅姑食飽飽後，由女伴先去附近攞車，跟住紅姑就戴上墨鏡，孭住大手袋，施施然行出食肆，現場見佢清減唔少，由之前嘅圓碌碌身形變苗條，成個人有番線條，紅姑見記者即刻帶笑撒嬌話：「乜你哋咁樣㗎？」但佢就好有禮貌，臨上車仲同記者揮手拜拜，再由女伴充任柴可夫接送離開。  紅姑當年咁紅，到𠵱家待人接物都咁大方得體，嗰啲行街被人影幾張相就發爛渣嘅藝人，唔該向紅姑學吓嘢啦。
20061109-122,20061109,122,「我覺得佢OK就OK」熱情碧兒硬蹺陳豪撐爭獎,「我覺得佢OK就OK」 熱情碧兒硬蹺陳豪撐爭獎 在TVB台慶最佳男主角觀眾投票中五強不入的陳豪，前晚與緋聞女友廖碧兒往將軍澳出席Gucci活動，提到陳未能入選五強一事，廖碧兒即熱情蹺着對方的手說：「我對佢有信心、佢係OK嘅，有冇（獎）佢都係OK嘅。」 超級名牌Gucci前晚於將軍澳邵氏影城舉行時裝騷及派對，出席嘉賓包括有曾傳緋聞的陳豪及廖碧兒、劉嘉玲及關之琳等，邵氏影城主人家邵逸夫（六叔）則由妻子方逸華及陳志雲陪同出席。 陳豪尷尬抿嘴 緋聞男女陳豪及廖碧兒，被記者取笑難得情侶檔上陣，廖碧兒聞言更正說：「我哋係男女檔至真。」提到陳豪在TVB台慶最佳男主角觀眾投票中五強不入，廖碧兒即時主動蹺着陳豪手，力撐他說：「我對佢有信心，有冇（獎）佢都係OK嘅。」  記者指只是廖碧兒個人認為陳豪OK，她即堅決地說：「係，我覺得佢OK就OK。」面對「男女檔」拍檔廖碧兒突如其來熱情力撐，在旁的陳豪顯得一臉尷尬。 嘉玲大讚中田 此外，劉嘉玲前晚在場內巧遇日本型男中田英壽，她大讚對方charming，對於有雜誌指其母搬回與她同住一事，嘉玲說：「我哋唔係一齊住，不過經過嗰件事（父親去世），我同媽咪關係係close咗好多，好似佢鍾意食辣蟹我咪陪佢食囉。」  採訪:顏英儀、吳天慧  攝影:陳順禎
20061109-123,20061109,123,阿佘否認𢱑銀還賭債,阿佘否認𢱑銀還賭債 十拿九穩捧走今晚台慶最佳女主角獎的佘詩曼，昨日被周刊報道指她曾往澳門豪賭，而且每次賭錢都在私人賭廳進行，動輒10多萬元上落，又指她不顧藝人身份，會到聯誼會開雀局，所以她才要不停接演電視劇及拍攝纖體廣告賺錢填賭數云云。 見識無妨 本報記者昨日致電向阿佘查詢時，她笑說：「我冇睇過段報道，亦冇睇開八卦雜誌。我不嬲都唔鍾意賭錢嘅，啲記者日日都見到我開工拍戲，邊會有時間去賭？如果有機會，都可以去賭場見識吓，但我真係冇時間。」  採訪：葉雪
20061109-124,20061109,124,傅穎情挑中基飲酒壯膽,傅穎情挑中基飲酒壯膽 鄭中基主演的電影《3分鐘先生》，其中有幕是傅穎（Theresa）情挑鄭中基，拍攝前Theresa一直擔心，她說：「雖然我哋同一間公司又合作過好多次，但我未試過演咁成熟嘅角色，惟有拍之前飲酒壯膽。」
20061109-125,20061109,125,袁詠儀決自然分娩,袁詠儀決自然分娩 快當父母嘅張智霖（Chilam）同袁詠儀（靚靚）噚日接受商台電話訪問，Chilam話已做好晒一切準備等BB出世，又話靚靚決定自然分娩，但以BB安全為先，有需要就開刀。前晚，佢哋兩公婆發現遠處有長鏡偷拍客廳，Chilam覺得自己冇嘢做錯，繼續唔拉窗簾。靚靚就大爆話老公好錫佢，仲身兼外賣仔、按摩師同魔術師𠱁佢開心。  
20061109-126,20061109,126,馬浚偉撞馬頭傷眼,馬浚偉撞馬頭傷眼 馬浚偉噚日喺元朗拍攝劇集《天機算》嘅一場騎馬戲，雖然馬仔都有騎馬經驗，但佢噚日騎上馬背嗰陣，發現隻馬有啲唔妥，所以有關大動作嘅奔馳場面就搵替身做，馬仔只係需要拍攝騎上馬背嘅戲份，不過隻馬起前蹄時，馬頭就撞正馬浚偉，令佢左邊面腫咗，左眼更加睜唔大，工作人員於是將佢送咗去私家醫院檢查，佢依家已經出咗院，今晚會如期出席台慶頒獎禮。  
20061109-127,20061109,127,鄭希怡半裸上陣先斬後奏,鄭希怡半裸上陣先斬後奏 鄭希怡（Yumiko）的首張個人新曲加精選專輯即將推出，她日前拍攝唱片封套，邀得唱片監製蔡一智負責形像及唱片封套設計。  不過蔡一智要她半裸上陣，終極性感，由於Yumiko覺得意念吸引，所以在未得家人同意下，先斬後奏答允拍攝，獻出了她寶貴的第一次。
20061109-128,20061109,128,蔡少芬晉身五強恨當劇后,蔡少芬晉身五強恨當劇后 蔡少芬早前到美國傳道，兼到西安領取「時尚貢獻大獎」，對於憑劇集《火舞黃沙》裏飾演焦玉一角而打入無綫台慶觀眾投票部份最佳女主角最後五強，她說：「入到五強已經好開心，因為去年嘅《棟篤神探》咁受歡迎都入唔到五強，所以今次自己都恨攞獎㗎。」
20061109-129,20061109,129,發哥鞏俐赴美谷新戲,發哥鞏俐赴美谷新戲 張藝謀的《滿城盡帶黃金甲》同劉偉強的《傷城》都係排喺聖誕檔期上畫，呢輪兩部戲都展開好大宣傳攻勢，噚日《滿》片又有一款海報曝光，呢款海報係發哥同鞏俐嘅皇帝同皇后扮相。除咗香港同內地不斷加強宣傳外，發哥、鞏俐同張藝謀又去咗美國出席美國電影學院電影節之閉幕禮，佢哋部片係閉幕電影，啲飛一早賣晒，發哥同鞏俐都好重視呢個閉幕禮，所以專登飛去美國出席呢個頒獎禮。
20061109-130,20061109,130,舒夫真高郵輪訪問上賓招待,舒夫真高郵輪訪問上賓招待 2006年度亞洲小姐冠軍舒夫真高，聯同其他得獎佳麗孟玲、韓燕和曾敏，上星期乘搭意大利郵輪作親善訪問，途經海南島、越南等地。她們更得到上賓式的招待，與船長及該郵輪行政總裁跳舞。
20061109-131,20061109,131,今日追星指南,今日追星指南 《休．映．戲》開幕典禮 出席藝人：劉德華  時間：晚上6時  地點：尖沙嘴星光大道（香港藝術館外） 周大福RebornInStyle晚會 出席藝人：楊采妮  時間：晚上6時30分  地點：香港會展新翼301展覽廳
20061109-132,20061109,132,啤梨抱佢唔起　衞蘭自嘲太肥,啤梨抱佢唔起　衞蘭自嘲太肥 官恩娜、衞蘭、衞詩、關智斌與葉文輝（啤梨）等一班歌手昨日出席在新城舉行的新城勁爆頒獎禮2006記者會，一班歌手互相投票選出心中的新城勁爆新人王，最後由周國賢的組合Zarahn得7票勝出。 拍檔錫臉嫌多口水 現場還有角逐新城勁爆人氣歌手的候選人，剛巧四男四女，結果每兩人分成一組，分別是官恩娜與張敬軒、關智斌與鄭融、衞蘭與啤梨，以及麥浚龍與謝安琪，司儀要求各組擺出預先安排的不同舞姿讓傳媒拍照，當中以衞蘭與啤梨的動作最高難度，女方需用雙腿夾着男方的腰間，衞蘭見狀即耍手擰頭，不停儍笑並說：「呵呵，我咁肥，唔得㗎，我怕佢抱我唔起。」即引來全場大笑，最後啤梨只是將衞蘭一邊腳托起，但表現得危危乎，險些跌倒。  此外，今日是SunBoy'z成員Steven生日，昨日其公司趁機為他提早慶祝，泳兒在徇眾要求下送上香吻，令Steven暈得一陣陣，但當另外兩位男拍檔親吻他時，他卻一臉痛苦並笑說：「嘩！好多口水，好核突呀！」  採訪、攝影：胡比
20061109-133,20061109,133,12名模化身月曆女郎周汶錡、陳嘉容性感行善,12名模化身月曆女郎 周汶錡、陳嘉容性感行善 齊集中、港、台12位名模，包括周汶錡、陳嘉容、熊黛林、姚書軼（Mikki）、孟廣美及劉丹等，各化身月曆女郎，早前為LookModels拍攝2007月曆，這套月曆主題為「TheMessageofLOVE」，每套售價200元，限量發行2000本，會作慈善用途幫助黎巴嫩災民。 Mikki不怕全裸 其中一名月曆女郎陳嘉容更與髮型師丈夫RickyKwok拍檔，她任客席形象指導，Ricky則負責各模特兒的髮型設計。  有份擔任月曆女郎的Mikki昨日接受電話訪問時說：「我哋12個女仔係分開影呢輯相嘅，大合照就用電腦效果key埋一齊。」問她有沒有膽量做性感的成人月曆女郎？她說：「只要影得有美感，全裸我都接受到。」  Mikki又指未知自己在月曆中會做哪一個月的女郎，她說：「如果係4月就最好，因為我係4月出世嘅。」  採訪:林妙萍
20061109-134,20061109,134,陳沛嘉歎Spa護膚開心賀壽,陳沛嘉歎Spa護膚開心賀壽 陳沛嘉獲邀擔任棕櫚島形象大使，早前她飛往當地拍照，並盡情曬太陽及歎spa，拍攝完畢後陳沛嘉即趕返香港慶祝生日，她表示今次生日十分開心，共切了三次生日蛋糕，男友也正準備一枚「正在製作中」的戒指給她作生日禮物。
20061109-135,20061109,135,衞詩改裝冷帽表達愛意,衞詩改裝冷帽表達愛意 （右起）衞詩、應昌佑及王菀之昨日到香港仔出席新城「卡拉O!BABE飛躍校園」活動，衞詩帶備自製首飾向學生表達「啓發智能、創意互動」的主題，她說：「我成日都會自製好多飾物，試過將一頂冷帽改裝送畀男友，佢收到仲好開心㖭。」
