key,date,article_daily_id,title,text
20061109-0,20061109,0,小甜甜翁媳爭產案抗拒終院命令供出幕後人　95歲王廷歆︰唔怕坐監,"小甜甜翁媳爭產案 抗拒終院命令供出幕後人　95歲王廷歆︰唔怕坐監 【本報訊】30歲創辦商業王國，80歲痛失愛兒，90歲打官司與新抱龔如心爭產；傳奇一生的華懋集團創辦人王廷歆今年95歲了，還要面對生命中最嚴峻的挑戰。王廷歆在去年審結的世紀爭產案中落敗，今年更被終審法院命令供出借四千萬給他打官司的「幕後黑手」。命令期限昨日到了，王廷歆打破多年緘默，斷然決定抗命，寧願冒上藐視法庭的罪名，無懼入獄：「法庭判我坐監咪坐監囉！」　記者：梁偉強　蔡元貴 華懋集團前主席王德輝1990年被綁架後失蹤，高等法院1999年宣布他法律上已死亡。王德輝剩下近400億元遺產，掀起了其父親王廷歆與其妻子「小甜甜」龔如心的世紀爭產案。結果去年終審法院裁定王廷歆敗訴，更於上月下令家翁交代誰人替他支付4,100萬元律師費。法庭命令的限期昨日屆滿，蟄伏多年的他，昨日終於露面，向傳媒公開他的決定。 「覺得做了很有意義的事」 自2001年出庭作供之後，王廷歆一直未有公開露面。闊別五年，王老翁依然健談。昨日他在菲傭及女兒王德華的夫婿崔健民陪伴下，與記者見面。訪問在沙田一間酒店的房間進行，這位在世紀爭產案中歷盡滄桑的華懋集團創辦人，整整一小時都坐在輪椅。輪椅一旁掛着一個尿袋，王廷歆的腳邊還擺着一支木枴杖。  王廷歆先發表一份書面聲明，內文說：「本人覺得自己做了一件很有意義的事，絕不後悔……在香港，如果一個人有理，但沒有足夠的現錢打官司，本身條件又不符合法律援助資格，借錢打官司又不對；試問這一個人如何才能落實《基本法》及《人權法》中賦予人們『在法律前人人平等』的權利？」  老人家還算腦筋清醒，所有問題都答得井井有條，只是聲音比較沙啞。畢竟是95歲老翁了，說話時會有口水從嘴邊流下來，不時要用紙巾拭抹，間中還有幾聲咳嗽，需要吐痰。酒店房間高達攝氏二十四、五度，王廷歆還要穿上長袖恤衫、背心棉衲、一頂絨帽，還有一件西裝外套，在訪問期間因為人多悶熱，才除了下來。 「唔畀人支配，唔係三歲細路哥」 法庭按龔如心的要求，命令他供出借錢給他打官司的人的身份，王廷歆以「無道理」形容這個命令，還表明不會交代這些事情。記者問他怕不怕被控藐視法庭，怕不怕坐監，王廷歆睜大雙眼說「不」：  記者問：你會唔會講出邊個借錢畀你？  王答：唔會講。  記者問：你可能會被人告你藐視法庭，你擔唔擔心？  王答：由得佢告囉，告得乜啫？無法無天！  記者問：你可能要坐監，驚唔驚？  王答：都冇道理，法庭判我坐監咪坐監囉！都冇道理！  王廷歆形容，借錢給他的人，是出於「同情和正義」，並強烈否認傳聞指有「幕後黑手」夾錢資助打官司，直斥這是胡說八道：「我唔會畀人支配嘅，我唔係三歲細路哥。」五年前撐着枴杖上庭，力數媳婦不是的家翁，昨日依然餘怒未消，說到激動的時候，還會擊掌、拍手。  上星期才因為小便時失足跌倒，弄傷入院，王廷歆昨日依然火氣十足。談及昔日的爭產官司，王廷歆大為氣結，更堅持自己是對的：「人哋唔嚟迫害我，我從來都唔會打官司。」他多次形容終審法院的判決是「弄假成真」。 「破產就破產，我唔怕」 王廷歆說話很多四字詞：「口是心非」、「欺人太甚」、「弄假成真」、「利慾薰心」，出口成文的王老翁，能操兩文三語。回答問題時，他主要用上海話，中間夾雜廣東話。記者送了一盒曲奇餅給他，吃了一口，他就大讚「verygood!verygood!」訪問完畢，他就問：「OK?」  除了交代借錢給他打官司人士的身份，王廷歆還可能被媳婦追討數以億元的訟費。老人家就是大無畏：「我會同律師商量，破產就破產，我唔怕。煮到埋嚟就食，未到日子，到咗先算，唔好理佢！」  王廷歆反指，他應該擁有華懋20%股權：「佢（龔如心）應該畀我，無辦法（取回）就打官司。」來自溫州的王廷歆，操的是濃厚鄉音的上海話，即使找來女婿崔健民繙譯，也只能聽得懂六、七成。王老翁有時把說話寫在紙上，給女婿及記者看，說到自己一手創辦的華懋集團，如今不再屬於自己時，他憤筆寫下了「利慾薰心」四個大字，給記者拍照。 「佢無離婚，照理都係我新抱」 十年來，翁媳二人已經沒有再見一面。但過了門就是媳婦，在王廷歆眼中，「小甜甜」還是王家人，「佢無離婚，照理都係我新抱。」如果還有機緣碰面，他會對新抱說：「希望你回頭是岸，改過自新。」"
20061109-1,20061109,1,任職和記電訊　找不到客戶憂失業科大生跳樓亡,任職和記電訊　找不到客戶憂失業 科大生跳樓亡 【本報訊】一名科技大學生物學系應屆畢業男生，甫離開校園即投身和記環球電訊，一切由「零」開始。小伙子本來躊躇滿志，但臨近試用期滿仍找不到生意，十分擔心被「炒魷」失業。沉重壓力令他極度困擾，終在三日前辭職，惟一直未能釋懷，前日在小西灣住所大廈企圖跳樓獲救，事後不足24小時，昨晨他竟再在同一位置跳下當場慘死，其父母在場相擁痛哭，令人歎息。　記者：李家傑　黃學潤 跳樓身亡的青年賴岸青，英文名「Felix」，是一名虔誠基督徒，他在剛過去的萬聖節（10月31日）才滿22歲；他與50餘歲父母及一名就讀香港大學的20歲胞妹，同住在小西灣邨瑞強樓三樓。 「生命尚存，便有希望」 香港科技大學校長朱經武昨獲悉事件感到非常難過，又向死者家人致深切慰問。朱經武表示，「年輕人要珍惜生命，經歷挫折是人生的一部份，當勇敢面對，克服困難。正如國際著名科學家霍金的一句話，『生命尚存，便有希望』，世上沒有解決不了的問題，亦沒有比生命更重要的東西。」曾讀過科大的電視藝人「肥田」胡杏兒，對有師弟自殺感到惋惜，她表示人若遇到困難或不如意事，應向家人或朋友傾訴，一人計短二人計長。  Felix甫畢業便在和記環球電訊任職客戶主任（accountexecutive），至三日前自行辭職。他原本今日要重返校園穿着畢業袍、戴上「四方帽」，開開心心地舉行畢業典禮，接受眾人祝福。可是他毅然選擇走上絕路，從此與親人和摯友陰陽相隔。  據稱，Felix向來個性開朗、活躍，交遊廣闊；而且興趣甚多，包括彈結他、打鼓、聽古典音樂、攝影和球類運動，更自稱是「籃球老手」。他今年6月曾到新疆烏魯木齊參與學術交流，回港後接受香港電台節目訪問，向聽眾分享自己的所見所聞。他又在8月回家途中無故遇襲，被扑穿頭要送院縫針，但沒影響其樂觀性格。 網誌透露工作壓力大 他在網誌透露，曾向家人表示工作不如意，因為其上司要「建立一隊professionalsalesteam（專業銷售隊伍），但他在「training（培訓）都尾聲了，真正工作還未開始」，又「擔心自己適應工作方面，不夠努力和放膽、怕犯錯」；加上同期入行的新人「都已經簽了一些broadband（寬頻網絡）、電話線和mobilephone（流動電話）的單」，所以「感到工作壓力很大，很down（低落），有點depressed（抑鬱），並擔憂找不到客戶被炒魷而失業」。  前日早上8時許，Felix在住所大廈22樓梯間企圖跳樓，幸及時被女保安員發現報警，經消防員好言相勸15分鐘，卒被勸服救下。他當時無受傷，情緒亦平復毋須送院。 警撿一封客戶投訴信 至昨清晨5時許，父親發覺兒子醒來心事重重，遂表示給他沏茶，希望兩父子能促膝詳談，聆聽一下兒子的心事。沒料到，父親甫進入廚房，Felix便趁機衝出屋外，走到前日企圖自殺同一位置，攀出欄杆躍下，墮地頭爆肢折，驚動街坊報警。事主雙親驚聞噩耗，馬上飛奔下樓，當他們目睹愛兒倒卧在血泊中，夫婦傷心得擁在一起悲慟痛哭。現場消息稱，警方事後無撿獲遺書，但在其房內找到一封事主被客戶投訴的公司信。  不過，和記環球電訊發言人昨日表示，事主於今年8月21日入職及接受培訓以來，都無表現異樣，該公司亦從未向他發出任何警告信。直到本月7日，Felix以私人理由向公司辭職，跟他同期加入受訓的其餘五名同事則仍在職。另外，事主上星期已要求昨日放假，相信他原本是為準備畢業禮而請假。
20061109-2,20061109,2,搬碼頭後中環過海或加價,"搬碼頭後中環過海或加價 【本報訊】天星小輪下周日起會展開歷史新一頁，中環碼頭將遷往位於離島渡輪碼頭旁的新碼頭，新碼頭耗資1,200萬元裝修，設施更為寬敞，而碼頭的新鐘樓也會由當日接替舊鐘樓在海旁以鐘聲報時的任務，新鐘樓的電子鐘以衞星定位系統調校，將是全港最準時的戶外時鐘。  天星小輪有限公司常務董事易志明表示，搬碼頭後來往中環至尖沙嘴的航程時間約7至8分鐘，和現時差不多。 新廣場展出大銅鐘 新碼頭共有三層，地下及第二層分別是小輪的上下層入口，碼頭用玻璃外牆設計，乘客可飽覽維港景色，第二層設有碼頭廣場，設有10多間商舖及休憩區，設計也充滿天星小輪的特色，包括有多張小輪座位款式的長椅，採用了船上使用的舊式吊燈，日後舊鐘樓拆卸後，鐘樓的大銅鐘也會在此展出。第三層是公眾觀景層，有餐廳、露天茶座及展覽廳，目前仍在裝修，明年1月初才可開放。  易志明說，搬碼頭後中環至尖沙嘴線乘客量會下跌13%，但加價會是最後的手段，希望新碼頭不只是公共交通設施，而會發展成人流滙聚的休閒區，用商舖租金收入補助船費。"
20061109-3,20061109,3,組新班底舊人難留任,組新班底舊人難留任 【本報訊】代表中國出選的陳馮富珍，一直是已故上任總幹事李鐘鬱的愛將，早在陳太任職本港衞生署署長期間，李已多次嘗試「挖角」。陳太加入世衞後，李繞過北京開設新職位以擢升陳，故今次陳的當選，可算是完成了李鐘鬱的心願。 李鐘鬱多番力捧 03年9月，李鐘鬱希望陳馮富珍取代希曼醫生，擔任傳染病總監一職，按世衞慣例，該工作屬助理總幹事職級，是政治任命職位，但北京當時屬意另一人選─衞生部對外關係司司長劉培龍，李別無他法，遂將傳染病總監工作交予非洲加納一名專家，再委任劉擔任有名無實的助理總幹事，讓陳太出任低助理總幹事一級的人類環境保護司司長，以圖繞過中央政府，但最後中央亦對陳的任命首肯。  翌年，李鐘鬱在世衞內開設新職位，讓陳擔任世衞傳染病科助理總幹事兼流感大流行總幹事代表，去年陳的合約完結，李即明正言順擢升陳。據世衞的職員所說，陳之所以深得李的寵愛，全因陳明白李不愛下屬過於高調、功高蓋主。  陳太上任總幹事後首項工作是組織內閣，雖然世衞規定，所有參選總幹事的現職世衞人員，包括日本代表尾身茂將可復職，但按慣例，新任總幹事將組織全新班子，相信曾與陳太逐鹿的人士將全部「無得留低」。  新內閣需反映聯合國的地區分布，按慣例，中、英、美、法、俄將各佔助理總幹事一席，非洲、拉丁美洲及阿拉伯亦可分一杯羹，預料陳組閣時將「回饋」在選舉中支持她的國家。
20061109-4,20061109,4,陶傑文章：伊拉克戰爭的功過是非 - 陶傑,陶傑文章：伊拉克戰爭的功過是非 - 陶傑 侯賽因被判死刑，伊拉克局勢未了，國內的民主政治尚未成熟，教派內戰頻仍。侯賽因的判決引起爭議，西方左傾輿論指判決偽善，為了美國中期選舉造勢，美國也同樣「有罪」。  伊拉克局勢發展成一個亂局，美國不是沒有責任，這一點毋庸置疑，八十年代兩伊戰爭，侯賽因的伊拉克得到美國支持。一九八五年，美國國防部批准美國化學工業廠商向伊拉克出售可製化學武器的五種原料，包括可製作炭疽武器的化學品Bacillusanthracis。這批殺傷武器的運售單，在美國參議院一九九四年發表的一項報告書有所披露。報告書追溯了十年前的化工原料貿易，目的是評估海灣戰爭中美軍可能身中毒氣的損傷狀況。  英國也好不到哪裏。一九八八年，英國向伊拉克出售可製作芥子氣的原料，價值二十萬鎊。同年，英國廠商向伊拉克出售一種氯化物，聲稱用作製造原子筆芯和布染料的「工業用途」，貿易額僅二萬六千鎊，此等原料，同樣可用作生化武器。  庫爾德族人遭毒氣屠殺，歐美早有所聞。然而八十年代中央情報局向美國駐中東的使節提交報告，指使用生化武器殺庫族的是伊朗。一九八七年，侯賽因用生化武器屠殺了十八萬庫爾德族人，英美保持沉默。 此等交易，有案可稽，俱屬事實。英美分化中東以制衡，是長期的政策，大國外交，本來如此，十分正常。如同中國今日聲稱「崛起」，一樣用銀彈貿易分化歐美關係。你可以做的，人家有本錢，一樣也可以做，這叫做平等。  英美對中東的分化政策，基於利益，加上國內商人以市場為本，盲目圖利，這是資本主義的罪惡之一。然而八十年代既已鑄成大錯，今日有必要糾正。侯賽因既然是英美扶掖出來的惡魔，則解鈴還需繫鈴人，前人種下的孽因，由布殊和貝理雅來清理，發動伊拉克戰爭，審判侯賽因，正是英美必須履行的一份國際道德責任。政治是「此一時，彼一時」，越共不也是中國用軍火扶植起來的政權？一九七八年的「懲越戰」又是甚麼？  何況所謂英美，二十年前與今日，不是同一個政體。八十年代的美國是列根主政，後來老布殊上台，資助侯賽因和拉登。今日的小布殊與老父不是同一條路，在外交政策諸多不和，做兒子的來糾正父親的錯誤，這樣的兒子，對歷史負責，值得讚揚。  英國對伊拉克出售化工原料，是保守黨任內之事，又豈能以「英美昔日接濟侯賽因，為何今日又反過來把他打倒」，而鎖定布殊和貝理雅為「罪犯」？如果此一邏輯成立，則發動「文革」的是中國共產黨，後來通過否定「文革」決議的鄧小平，也是中國共產黨，掛的是同一副「中共」的招牌，鄧小平一度還是老毛的心腹，這筆債又該不該算在老鄧的頭上？  歐美的左傾輿論，拚命翻八十年代的老賬，不但不足以否定英美攻打伊拉克，「有過必改」，更彰顯小布殊和貝理雅勇於面對先任政府錯誤的責任感。這是民主制度的特點。發動伊拉克戰爭，結束侯賽因暴政，絕對有必要，戰勝容易，戰後扶掖民主難，布殊和貝理雅一樣有錯誤，是另一個問題。  逢周一、三、四、六刊出
20061109-5,20061109,5,我問你答：為甚麼香港容不下舊記憶？,我問你答：為甚麼香港容不下舊記憶？ StellaSo 年輕創作人插畫藝術家 Q：你的作品中有很多香港舊區的街道、樓宇，尤其在你筆下的灣仔更顯露出一份特殊的情感，可不可以說說其中的因由？  A：我自小在灣仔長大，那時我們家住在英皇集團的舊址，樓高十七層，每層有十個單位，雖然居住環境不算太好，但鄰里之間關係和睦，小朋友都會到處串門嬉戲，好不快樂。  我就讀的幼稚園就在軒尼詩道官立小學旁邊，即是現在那座玻璃大廈的舊址。可是好景不常，這些為我帶來快樂童年的地方最後都被拆掉了，那個時候很不明白，為甚麼一幢幢不算太舊的樓宇就這麼被拆掉。  直到軒尼詩道循道堂，即那個電車路旁的三角位置說要翻新時，感覺真的很捨不得。然後我開始用即影即有的照相機拍下這些景物，也是我作插畫的開始。我想既然無法挽回被拆的事實，惟有用光與影將它們紀錄下來。  Q：舊區重建是為了改善居民的居住環境，為甚麼你認為要把它們留下來？  A：這只不過是政府掛羊頭賣狗肉的藉口。現時在舊區居住的都是老人家，他們住的地方都有幾百呎，甚至近千呎。你（政府）強行把他們迫遷，然後在原地建一座豪宅，幾百呎的地方就要賣幾百萬，你說這些老人家有負擔能力嗎？這就叫改善居住環境嗎？稱得上是以人為本嗎？  灣仔是一個很特別的地方，這裏中西交會，讓人產生很多聯想，即使同樣是舊區的深水埗也比不上。就以藍屋來說，那裏的人一住就住上幾代人，他們是灣仔歷史見證的大百科全書。  在探訪過程中，我又發現藍屋的舊址原來有一間華陀醫院，後來又改建成華陀廟，然後又與黃飛鴻的徒弟結上淵源。看看它的空間結構，那些漂亮的地磚，屋頂上可能有一棵樹，有人在露台上晾衫，這樣的構圖多好看，這才是香港。 Q：旅發局將香港包裝成動感之都，你對大城市都會化、現代化的香港感覺怎樣？  A：我覺得我的工作就像在跟變化中的香港比賽，你看到處都在遷拆、搭棚、圍板。舊有的天星碼頭都快要動工拆卸了，明年二月灣仔街市又要交吉，我不明白為甚麼香港連這點舊有的集體記憶都容不下？  你看現在那些新樓有甚麼特色可言？全部都像倒模一樣，連站在門口拍張照片，都會有幾個保安走過來，甚至會發惡砸相機。這樣的城市沒有人性、沒有感情，也不能給我創作靈感。如果有一天，當這些舊樓都被拆光，我想也沒有再留下來的理由，或者南丫島沒拆得那麼快。  我不明白香港為甚麼不可以像鄰近的城市，如澳門或上海等，將這些舊樓保存下來。香港已經走錯了這麼多年，還以為董建華下台換個人上來情況會好一點，怎知原來一樣。  本報記者　陸羽平
20061109-6,20061109,6,退出學聯　所為何事？,退出學聯　所為何事？ 傅景華　香港大學學生會前副會長 據報，港大學生會正醞釀脫離學聯，並以公投作決定。筆者曾於九十年代參與這兩個組織，看到這段消息，心裏好生奇怪，港大學生何以要與學聯割席並劃清界線？至近日，收到有關這次公投的資料，內裏列出退出學聯的理由共四項：一、外界干預；二、共識機制失效；三、財政及行政混亂；四、運作模式不合時宜（詳見學生會網頁 http://www.hkusu.org/）。  屬內部管治問題 先說第二、三和四點，都是學聯內部的管治問題，例如鎖匙管理、財務和核數分家、會所管理及表決過程等事務性事宜。這些問題只需學生們冷靜地自我檢討不足之處，似乎不難解決，怎也不會弄到退會的田地。  若論第一點外界干預，就非同小可。學聯被指長期受前學聯成員及民間團體左右。事實上，學聯向與社運關係密切，後來更成立社運資源中心，為本地社運界提供資源，協助彼此間的連結，壯大民間社會。因此，若學聯可團結更多社會人士，正是求之不得。只要學聯仍掌管理權，學生對社會議題有清晰的理解和堅持的話，何懼之有？ 「干預論」站不穩 究竟為何會有這種「干預論」呢？說來奇怪，「干預論」與港區政協委員劉迺強先生（即現港大學生會會長劉方的父親）於二○○四年七月二十七日在《信報》專欄中的觀點，何其相似，該題為〈不要干預學運〉的文章指：「……『六四』開始了由『民主派』主導的學運另一頁。以陶君行等為首的當年學生會領袖，與支聯會和同穿一條褲子的港同盟和後來的民主黨合流，學生會幾乎成了它們的外圍組織。政黨直接介入學運，大量培訓學生領袖，長期霸佔學生會……」前後一脈相承。  筆者在六四後始參與這兩個組織，自然知道劉先生是胡扯。無論六四前後，學聯與不少現被稱為「民主派」的人士和民間團體（包括劉先生當主席的匯點），在共同立場的基礎上合作，但也常出現分歧，居英權為一例，肥彭政制方案是另一例。學聯也曾公開批評與民主派「穿一條褲子」的支聯會，這樣的學聯又怎能說是與民主派「合流」或其「外圍組織」呢？ 剝削後來者機會 反觀現今的學生組織，讓政協委員做統戰跑腿約見特首，做人家競選的人肉布景板。學生既接受不了民間團體的「干預」，為何又會接受政協的「干預」呢？這是否雙重標準？  好了，即使四大罪狀成立，問題應是學生沒有做好本份，沒有盡力抗拒「干預」和提高學聯的管治水平。既然表決程序欠妥，何不按會章辦事？既然財政混亂，又有否請教專業的意見？既然鎖匙被非法持有，何不報警求助？  學聯由學生會組成，它出現問題，就是現屆學生會無能和失職，最好是選能讓賢予更有能力的港大同學接棒，而非退出學聯。你們憑甚麼剝削其他同學及將來的師妹師弟參與學聯的機會？筆者希望每一位投票的同學，了解清楚事情始末，才決定上述指控是否足夠構成退會理由。
20061109-7,20061109,7,一針集,一針集 陳太當選世衞總幹事，香港人都很高興，因為起碼五年內陳太都不會重返香港的醫療系統了。大陸人也很高興，因為五年內大陸都不會被宣布為疫區。當然最高興的是非洲人了。  正果    「一針集」歡迎來稿，每段不超過一百字，稿酬一百元。  傳真：26239278  電郵：forum@appledaily.com
