key,date,article_daily_id,title,text
20070404-235,20070404,235,阻嚇重複認購見效,阻嚇重複認購見效 【本報訊】證券登記公司總會會長唐冠良及香港中央證券登記行政總裁黃龍和昨日均表示，上周警方就涉及盜用他人身份證重複認購新股採取行動，拘捕18名男女，加上已改良退票機制，隨機遮蓋退票身份證任何兩個號碼，已起到足夠阻嚇作用，相信由碧桂園（2007）起，重複申請的宗數將會大減。  唐冠良說，過戶處早已得悉有人利用過往退票身份證號碼固定遮蓋2個號碼，在遮蓋位置填寫他人身份證重複認購新股，但無奈一直沒有受害人報警，及後有一名女士在認購建滔積層板（1888）的新股時遭退票，卻發現自己的身份證號碼刊於股份配發結果通告內，然而並沒有收到股票，在其後一些新股仍有類似現象，經向警方投訴後正式展開調查。  唐又說，由於中信1616公開招股於3月27日截止，警方3月29日才公布已採取行動，因此中信1616仍有900多份重複申請遭剔除，但他相信由碧桂園起，重複申請現象將會大減，故短期內不會再推出其他措施。  黃龍和贊同，新退票防範措施將會發揮功效，預計能有效打擊60%至70%重複認購申請，但他認為，此舉並非唯一防範措施，證監會亦可以隨時調查。
20070404-236,20070404,236,怡系新加坡上市股票,怡系新加坡上市股票 公司：怡和控股  最高：22.80  最低：22.00  收市：22.40  升跌：-0.20  成交股數（千股）：187.6    公司：怡和策略  最高：13.60  最低：13.10  收市：13.20  升跌：-0.50  成交股數（千股）：228.0    公司：牛奶國際  最高：4.02  最低：3.94  收市：3.98  升跌：+0.08  成交股數（千股）：224.1    公司：置地  最高：4.80  最低：4.66  收市：4.70  升跌：-0.06  成交股數（千股）：2069.0    公司：文華東方  最高：1.95  最低：1.90  收市：1.94  升跌：+0.04  成交股數（千股）：678.0    （單位：美元）
20070404-237,20070404,237,中環在線：賀回歸新世界先啓動 - 李華華,中環在線：賀回歸新世界先啓動 - 李華華 回歸十周年，很多活動爭相出籠。新世界集團就搞咗個中華民族文化周，噚日由第二代嘅鄭家純（圖右三）出嚟，為佢哋「新世界青年領袖工程」主持活動啓動禮，主要針對中港青少年的交流，當中最有趣嘅活動，係模擬城市政府會議，由北京、廣州、香港同上海嘅代表學生，代表其城市競逐成為全國重點推介，評審嘅亦係一班扮演內地各部門「官員」嘅學生。集團亦做善事當係賀回歸，捐出500萬銀畀無子橋慈善基金。  梁鑑章攝LiWaWa@AppleDaily.com
20070404-238,20070404,238,中環在線：工行記招未夠國際化 - 李華華,中環在線：工行記招未夠國際化 - 李華華 全球市值入咗銀行股三甲嘅工商銀行，噚日公布上市後首份成績表，成班高層留喺北京召開發布會，然後用視像會議形式畀香港傳媒參與，同當地記者輪流發問。作為首家A+H股同步上市兼全國最大國有銀行，咁嘅安排，都係政治正確，可以理解。  之不過，一直掛在口邊要國際化嘅工行，喺答問環節編排上就未算國際化，管理層回答長篇大論唔在講，發問時間連英語繙譯，只夠兩地傳媒共發問5大條問題，香港配額只得兩條，咁嘅發布會安排，同佢哋嘅業務發展一樣，仲有好多改善空間。 內地賓架薪酬脫軌 工行兩位最高領導人，薪酬亦喺業績中披露，去年度董事長姜建清，稅前薪酬總額係130萬人民幣，行長楊凱生就收125萬元，雖然內地賓架薪酬水平近年改善唔少，但作為全球市值3大行嘅主席同CEO，薪酬待遇應該逐步同國際市場接軌至啱。  LiWaWa@AppleDaily.com
20070404-239,20070404,239,新股上市備忘,新股上市備忘
20070404-240,20070404,240,07年4月4日收市指數,07年4月4日收市指數
20070404-241,20070404,241,中環在線：王建宙荷包脹靠股證,中環在線：王建宙荷包脹靠股證 大型國企閒閒哋每年賺過百億，但由於係國有企業，大股東係中央，所以，就算賺多幾多錢，管理層嘅人工都唔可以加得太多，或同國際睇齊。不過，華華發覺，中移動班管理層，舊年竟然大幅加薪，董事長王建宙加44%，年薪差唔多成千萬；三個執董則各加八成，年薪都有700萬。  唔通做國企老總都可以有咁高人工，年薪過千萬？睇真啲，原來係股證作怪。中移動股價舊年好似坐火箭，由30幾蚊升到上80蚊，水漲船高，管理層持有嘅股證自然大幅升值，而股證包埋係董事酬金入面，薪金自然大幅上升。若果唔計呢筆，人工維持05年水平──冇調整。  LiWaWa@AppleDaily.com
20070404-242,20070404,242,投資版金榜,投資版金榜
20070404-243,20070404,243,中環在線：劉鑾鴻人工加四倍 - 李華華,中環在線：劉鑾鴻人工加四倍 - 李華華 喺香港經營崇光嘅利福國際（1212），舊年業績相當唔錯，升咗三成七，全因為財富效應，香港人使錢豪爽咗，原來利福自己都一樣，就係大幅勁加人工嘞，最厲害係董事總經理劉鑾鴻（圖），佢嘅人工足足升咗4倍幾！  據利福年報披露，人稱「細劉」嘅劉鑾鴻，總年薪05年只係得263萬，06年已暴升至1428.6萬；雖然，當中有1083.6萬係屬於股份付款（Share-basedpayment），但就算淨計佢嘅薪金同其他福利，都比05年多41個巴仙，加到343.8萬！  細劉係咪值得收咁多，大家睇吓舊年佢有單內幕交易案纏身，最壞嘅結果係唔可以再做利福董事，當時股價長期喺18蚊樓下徘徊，一話冇事，股價即刻升到24蚊。咁若果你係利福股東又點睇呢？  LiWaWa@AppleDaily.com
20070404-244,20070404,244,炒友Blog：下降三角形向淡居多 - 邱古奇,炒友Blog：下降三角形向淡居多 - 邱古奇 今日假期休市，不推介股票，繼續淺談技術分析。最近談過對稱三角形和上升三角形，兩者都是整固形態為主，但前者本質上並無利好或利淡的傾向，故屬於中性形態，而後者本質上傾向利好，故屬利好的形態。  今次介紹的下降三角形（DescendingTriangle）則是利淡的形態，是淡友的好朋友。在一個下跌的趨勢中，下降三角形通常以整固形態出現，股價整固過後，多會延續先前的跌浪。如果在一個上升趨勢中遇到下降三角形（右圖就是一例），就要提防那是轉向形態，即整固過後並非延續升浪，而是轉升為跌。  下降三角形亦由最少4個接觸點構成，其中兩個接觸點在上方連成一條下降軌，而第1點必定高於第2點，若有第3個接觸點，亦一定低於前兩點。  另外最少兩個接觸點在下方連成一條支持線，這兩點所代表的股價相同或十分接近，故此這條支持線是一條橫行的水平線。 好友久守必失 觀察下降三角形的外觀，便可見到支持線看似能抵萬馬千軍，但亦反映出好友無力進攻，支持線無法上傾變成升軌。反觀降軌越壓越低，淡友有力步步進迫。好友能守不能攻，所謂久守必失，故下降三角形被視為利淡形態。  在判斷和利用三角形炒賣時，還應留意以下4點：  1）下降三角形的接觸點，較常見的有5-6個，其可靠性比4個點的好。  2）營造時間可長達數月，但不應短於3周，過程中交投漸減，向下突破時有大成交配合較好，卻非必要，因形態本身有利淡傾向。  3）下降三角形量度升幅的計算方法，是從三角形的最高點減去最低點（三角形最闊之處），得出一個差數，然後再以突破點減以這個差數。以右圖為例，和黃（013）今年1月初至2月底營造下降三角形，左方起點為最闊之處，高點是83元，低點是77.45元，2月尾破位而下之處亦是77.45元，套入公式即為77.45元－（83元-77.45元），得出目標價71.9元，結果3月14日和黃股價跌至71.6元才反彈。  4）股價向下突破後多有反彈，也就是所謂後抽，而先前三角形的支持線會變成阻力，若股價能以大成交升破此阻力，則可望回復升勢。
20070404-245,20070404,245,中環在線：陳南祿做打工皇帝 - 李華華,中環在線：陳南祿做打工皇帝 - 李華華 國泰航空行政總裁陳南祿今年7月將更上一層樓，為控股股東太古大搞中國業務，隨住責任越來越重，佢嘅人工亦越來越高。國泰最新出爐年報披露，陳南祿舊年嘅人工已經突破千萬元，全年𢭃1016萬元，加薪9.3%，成功晉身為打工皇帝。  陳南祿舊年加薪，主要係分多咗花紅，全年分到432萬花紅，唔知係咪成功收購港龍航空，立咗大功呢？即將接替佢做行政總裁嘅湯彥麟，年薪亦過千萬，全年𢭃1012.8萬，加薪18.7%。  不過，華華唔係好明，點解湯彥麟加得仲多過陳南祿嘅。  LiWaWa@AppleDaily.com
20070404-246,20070404,246,股場放大鏡：航通注資炒雜燴 - 歐陽風,股場放大鏡：航通注資炒雜燴 - 歐陽風 航科通信（1185）在2月中停牌，搞咗接近兩個月，到噚日先至復牌。呢間公司好多人憧憬會有優質資產注入，結果一如市場所料，航通獲母公司注資，而且包括風力發電機在內嘅資產，但就並非單純環保業務，仲有其他雜項資產，而且要股東供股集資，噚日股價開出嚟表現麻麻，收市更加倒跌5%。 業務發展冇重點 根據公告，航通會以9億元收購一籃子業務，包括汽車發動機管理系統及配件製造、車身密封系統製造、電梯用發電機製造、風電設備及可再生能源項目，代價以1.3億元現金及22億股新股支付，每股發行價0.35元。以呢批資產全年純利約9620萬元計，注入嘅PE大約9.3倍，睇落不過不失。  公司已發行股數10億股，呢批新股份將大幅攤薄現有股東權益，但由於公司盈利基礎低，06年中期仍錄得虧損，故此無盈利攤薄效應，反而因新資產有盈利而得益。至於現金代價部份，由於公司無乜錢，故此要10供4籌資支付，供股價都係0.35元，較停牌前大幅折讓逾50%。  航通之前已經投資風力發電，故此注入相關資產唔會太過意外，反而係汽車發動機同車身封密系統、電梯業務就比較令人摸不着頭腦，因為母公司中航總，如果想系內公司業務清晰化，應該將汽車相關資產注入有造汽車嘅中航科工（2357），電梯相關資產則畀有造大廈鋁製品及不銹鋼產品嘅中航技術（232），𠵱家炒埋一碟注入航通，完全唔知佢想點。  其實航通以往咁多年業績乏善足陳，主要原因都係缺乏一個發展重點，太過多元化，假如投資此股會覺得無所適從。
20070404-247,20070404,247,金手指：要同客劈酒…點算？ - 孫柏文,金手指：要同客劈酒…點算？ - 孫柏文 今日，孫柏文將會施展渾身解數，將我當年做石油分析員學到嘅最寶貴一課同大家分享。今晚開始，相信大家都好有可能放幾日假期，以前做分析員嘅時候，我會把握呢啲長假期去充實自己。  而因為充實自己嘅最有效方法，就係多啲體驗、多啲試驗，所以我好希望大家可以將我今日分享嘅經驗，自己去試一試。  今時今日，因為原材料價格持續高企，好多時候做金融業都會被客人問及有關原材料龍頭——石油嘅問題。仲因好多時，客人都會喺有酒飲嘅情況之下問問題，所以就當今日嘅《金手指》文章有一石二鳥之用。  最後，今日孫柏文原先想將題起為「要同朋友劈酒…點算？」不過為咗安撫嗰啲覺得文章一定要有財經角度嘅fan屎，就用咗呢個題。禮拜二再見！ waterinjectionmethod圖解 1.油井中嘅原油，因為本身係從史前動物被地殼壓縮而變成，所以油井本身往往會有足夠壓力將原油射出地面上。油井開採初期，石油開採人員只需要在地下鑽一個洞，原油就會自動標出。  不過久而久之，由於一瓶被搖動過嘅香檳，雖然開瓶時會有大量香檳湧出，不過平復下來之後，就會發覺瓶裏還遺留下大量香檳。油井都係一樣，雖然一個油井可能已經冇原油湧出，不過本身裏面仲有好多石油。平均一個油井只有30%嘅石油，可以只靠油井本身壓力湧出，所以如果冇其他補救方法，就會有70%嘅石油被浪費。    2.為咗開採埋餘下70%嘅石油，石油工程師就會喺油井嘅另一端開多一個洞，然後用管道將水住入油井。咁樣油井裏面嘅壓縮力就可以維持，繼續生產石油。  雖然開採出來嘅原油液體，含水量會慢慢增加，石油越來越稀，不過就可以令一個油井嘅生產壽命延長，原本無可能開採嘅70%石油都可以攞到。呢個將油井recoveryrate推高嘅方法，就係叫做waterinjectionmethod。  3.好多人經過服用大量酒精之後，個胃都會因為身體頂唔順血液中嘅含酒精量，所以出現嘔吐。不過就算胃部啲肌肉，經過扣喉後用龐大嘅壓力，迫啲「嘢」出來，好多時候，就算經過長時間喺馬桶前「拜神」，大家嘅胃部都會餘留啲酸度極高嘅「殘留物」。  而往往就係呢啲「高酸性殘留物」，令到一個人喺服用酒精之後嘅第二日，唔想返工，亦希望有人「殺死佢算」。    4.為咗將胃部餘下嘅「殘留物」迫出來，大家可以喺「嘔無可嘔」嘅情況之下，飲1至1.5公升水落肚。將胃裏面嘅壓縮力提高，將「殘留物」嘔出，啲水又可以將「高酸性殘留物」開稀，將酸度降低，減少嘔吐物損害食管嘅危險。不過因為「入口」、「出口」都係同一條管道，所以「再嘔」應該喺「飲水」之後兩分鐘進行。只要進行兩次，個胃就應該「亁亁淨淨」。最後，為咗補充水份，應該飲第三次水，不過今次唔需要嘔番出來。    金手指網誌：   http://phatdat.blogspot.com 
20070404-248,20070404,248,窩輪戰機：建行轉強博7897 - 方德正,窩輪戰機：建行轉強博7897 - 方德正 好友對5天長假視若無睹，信心爆棚。港股假前交易壯旺，技術指標接近全面向好，升勢的確擋不了，恒指以20209收市，再漲207點。國企也不示弱，H股指數收9859，升135點，幅度達1.4%，升勢凌厲，預期假後更上一層樓。  建設銀行（939）昨高見4.59元，收4.55元，升0.04元，成交196球。股價力迫50日線，MACD牛差距再度擴大，升勢一觸即發，短期目標1月初高位5.35元。  國泰航空（293）受惠油價回落，昨振翅高飛，最高升至20.65元，收20.45元，仍升0.45元，股價重越50日線，上試22.10元高位。 ■建行C輪7897收0.236元，升0.009元或3.9%，成交353球。此輪07年8月13日期滿，行使價4.80元，溢價10.7%，槓桿率19.3倍，有效8.4倍，引伸波幅29.8%，街貨3.9%。正股見5.35元，由價外轉回價內，爆炸力更強，此輪理論價0.714元，升203%。  ■國泰C輪7529收0.179元，升0.022元或14%，成交2.3球。此輪07年12月28日到期，行使價22元，溢價16.3%，槓桿率11.4倍，有效5.3倍，引伸波幅35.2%，街貨4.7%。正股見22.10元，此輪理論價0.262元，升46%。
20070404-249,20070404,249,國金眺望：兇手 - 方卓如,國金眺望：兇手 - 方卓如 悉尼熄燈一小時。汽車雜誌在介紹新車時，加入環保指數，過份消耗汽油的被指為不合時宜。戈爾那套地球暖化的紀錄片，可以算是環保變成主流意識的起點。  《時代》雜誌專題講述地球暖化。換着一年前，應該只會是學術研究的文章。今日能夠引起共鳴，成為大家關心的社會現象，全靠過去一年天氣反常，令人提早親身感受原本應該是兒子將來三十歲時才會遭遇的天氣突變。要更多人注意環保，其實只需要電視台增加天氣報告時間，效果高於戈爾走出來做show。  這篇專題所講的五十一項減低暖化速度的板斧，香港人經已做了許多，如果要打分，應該是環保班上的高材生。但身處大陸，環看四周，將來這個地方，會是未來地球暖化的兇手。《時代》叫人搭巴士，大陸沒錯是有人搭公車，但國策是走向美國式的汽車大國。現在大陸是每一千人一部車，美國是每一千人有五百架車，內地的目標是比現在增加十倍。貴為美國雜誌，五十一項辦法，有十分一與汽車有關。大陸要行汽車政策，是與環保為敵。  中國是僅次於美國的二氧化碳排放大國，但不等如大陸沒有環保生意。《時代》叫人轉用乙醇，中國都有製造乙醇的公司。早前上市的中糧，乙醇的生意額只佔未夠一成，卻佔盈利的三成。是乙醇好賺，還是其他生意做得差，未及研究。  要減慢全球暖化，唯一方法是希望大陸出一個翻版戈爾，用符合國情的方法，叫內地幫手出力減少排放。美國一個三億人口的國家自律，未夠抵銷一個十三億人口的國家出力排放。在大陸，過氣政客無法高調，只可以例如請胡錦濤落鄉探訪時，四處宣揚。反正他是念水利工程，都與環保拉得上關係。水是環保生意，從食水到污水處理，都是大熱。但涉及水的生意，政府對價錢有嚴格控制，不容肆意加價，是收入穩定但盈利欠缺驚喜的項目。  環保概念在大陸有排未流行，但環保生意經已成行成市。又一次證明，生意人永遠行先一步。
20070404-250,20070404,250,案內人隨筆：如何跑贏大陸股市？ - 尹思哲,"案內人隨筆：如何跑贏大陸股市？ - 尹思哲 是日金句：BeforePaulandIstartedthecompany,wehadbeeninvolvedinsomelarge-scalesoftwareprojectsthatwererealdisasters. ──BillGates 假期前夕，思哲早已安排妥當，好好休息幾天，順道洗滌一下疲憊的身心。這兩天，感到公司節奏放慢了，同事似乎輕鬆了不少，只是來往的電郵更加密集，因為誰都想把握最後機會，趕在假期前把重要的requestsend出來，尤其是老闆。  但反正都放假了，思哲懶理那些飛來飛去的電郵，隨手打開討論區，看這天有甚麼城中熱話。由於中信1616上市，絕大部份高人氣的文章都與它有關，還有不少人估它首日會大升七八成，後來跟收市價一比，原來網上的智慧竟不遜於尋常分析員。不過，再看下去，見有人正談論他的炒股大計，不知道甚麼原因，這位人兄自稱不喜歡打工，決意全職投入炒股大軍行列了。思哲不知道有多少人是全職炒股維生，如果全職炒股變成潮流，這就肯定是大跌市的先兆。 市場憧憬必有作為 事實上，也不是沒有人，是靠全職投資股票為生，只不過全職炒股，需要的是極強的心理質素。但當你的投資回報，變成了唯一收入來源，這個月不賺錢就沒飯開，你的精神狀況一定很緊張，間接影響了投資表現。舉個例，昨天有隻股票，升幅比中信1616更厲害，中信1616升不了七成，它一日漲了160%，它就是金榜集團。  本來，金榜只是一隻不起眼的毫子股，早些時候才賣了核心商場業務。前天，公司宣布委任中信集團前主席王軍，為該公司主席兼執行董事。結果消息一出，市場憧憬金榜未來必有作為，或可能轉型主攻大陸市場，股價亦勢如破竹。  其實打從昨日開市計，直至中午休市，金榜半日升幅差不多是全日一半（約80%）。那時候，電視財經台大概有報道了，若貼市的全職炒家見到了，他會有膽量入市嗎？或許小部份勇氣可嘉的人夠膽，思哲認為大部份人肯定不會這樣高追。  再舉個例，據《FinancialTimes》報道，中國超過95%的股票型基金，其今年第一季度表示，跑輸予基準滬深300指數。由於滬深300指數首季飆升了36%，在總共183隻股票型基金當中，僅有9隻的表現，在今年第一季度表現勝過了基指。  何以滬深300升了36%，大部份股票型基金的表現竟還差強人意？很簡單，因為基金經理根本沒有跟隨升勢入市。報稱，基金經理因為壞消息接踵而來，因為害怕客戶贖回，手上持有的現金高達四成。誰不知大陸股市長升長有，壞消息當好消息炒，結果這種市況考起了這幫專業投資者。  總而言之，今年的股市不容易炒，如果認為自己不適宜打工，決心全職投資，其實也不一定要炒股。 創業才是致富之道 在搜尋大陸股票型基金資料的時候，竟讓思哲找到一個基金理財的Web2.0網站，這個名為財幫子的網站，介面簡潔，關於中國各類型基金的資料還叫齊全，雖然它根本沒有甚麼社群功能。  但事實上，作為用家，BloombergTerminal的UserInterface相當爛，這是為甚麼它跟許多微軟的軟件一樣，需要用家特地跑去上堂，學習如何操作使用。  幾個月前，思哲介紹過Monitor110，就是基於Web2.0概念設計成的一個像BloombergTerminal那種產品，此外，還有Bullpoo這個由香港人創辦的Web2.0炒股網站。說不定有朝一日，它們就會像YouTube那樣飛黃騰達、身價百倍，思哲始終相信，致富的最佳道路是創業而不是炒股。  無論如何，祝大家有個愉快的復活節假期。    案內人隨筆網誌：   http://wanszezit.wordpress.com/   電郵：insider@appledaily.com"
20070404-251,20070404,251,魚缸暴炒族：國壽醞釀新升浪 - 方星俠,魚缸暴炒族：國壽醞釀新升浪 - 方星俠 清明時節雨紛紛，股海淡友欲斷魂！不少股友常問星俠，股壇其實不乏精英，何以媒介上卻充斥屢睇錯市之劣質股評？一聽，就知問題艱深。星俠惟有以反問作回答，歷史都有所謂「濫竽充數」，當年南郭先生不曉樂器都一樣「吹得兩咀」，後來才露出破綻。股壇屢見看錯市之劣質股評又有幾奇？最奇係居然仍有人找他們來「充撐」場面，散戶肯去聽之餘，最慘仲係有樣學樣走去亂沽。  回看4月以來這3天不少財經演員的「股評」，看淡言論佔去泰半，港股卻一路勁升至昨日，收20209，成交更高達516億元，盲從所謂「長假期前例淡」而沽期指者，早已遭「大長挾」而玩完，只是未知淡友們事前的睇跌觀點，又如何自圓其說呢？  有「中東股神」之稱的沙地王子走訪中國兼「掃貨」，散戶不妨思考，身為花旗集團大股東的他又會買乜股呢？ 傳中東股神入股 早前內地保監會放寬保險公司入股銀行，國壽（2628）即與花旗聯手入股廣東發展銀行，彼此既已「眉來眼去」，故沙地王子可能入股國壽之傳聞不脛而走。是次中國之行，未知沙地王子會否乘機促成其事？  另外，國壽自高位28.85元調整至近期低位18.42元，跌幅超過10元，之後在20元至22元之間表現硬淨，新升浪或快展開，由22元水平往上炒高10元，中線目標正好是32元。
