key,date,article_daily_id,title,text
20070222-0,20070222,0,福布斯全球調查　霍建寧新居上榜亞洲5大豪宅　香港佔4間,"福布斯全球調查　霍建寧新居上榜 亞洲5大豪宅　香港佔4間 【本報訊】香港彈丸之地卻盛產市值以億元計的超級豪宅。財經雜誌《福布斯》昨日公布全球及亞洲最昂貴豪宅排名，英國超級豪宅UpdownCourt以10.76億元蟬聯全球「一哥」寶座。亞洲區五強之中，香港雄霸四席；其中「打工皇帝」和黃董事總經理霍建寧，去年以3.5億元購入深水灣道37號、人稱「港版梵爾賽宮」的三層高獨立屋，令他首次榮登亞洲第二最貴豪宅的主人。　記者：馮永堅、黃偉駿 《福布斯》連續三年向世界各地的地產經紀查詢當地豪宅價格，以其最後成交價等因素計算，選出全球及亞洲最貴豪宅排名。位於土耳其最大城市伊斯坦堡的WaterfrontEstate以7.8億元成為亞洲最昂貴豪宅，霍建寧的3.5億元大宅新居則緊隨其後，晉身亞洲第二豪宅。  「呢個係我見過最靚、最豪嘅豪宅！」一名曾參觀深水灣道37號獨立屋的地產經紀，這樣形容霍大班的新居。三層高的梵爾賽宮式建築氣勢懾人，步進大宅，迎接你的是一個布滿古羅馬雕塑的泳池，旁邊則是可容納七部車的小型停車場。  獨立屋佔地約2.2萬方呎，總樓面面積逾1.6萬方呎，面積雖比不上外國豪宅，但勝在有迷人景觀，坐擁深水灣全景。大宅有六間套房，分別位於二、三樓，其中三樓的主人房有近800方呎，面積之大足夠一家四口居住。除了睡房，大宅其他房間數目也多得驚人，七個浴室、三間工人房及至少兩個廚房，有時入錯房間也不足為奇。 金碧輝煌喻為「港版梵爾賽宮」 據了解，霍建寧的大宅前主人是一名內地投資者，曾把全屋地板鋪上數十萬元的意大利名廠雲石，裝修金碧輝煌，被喻為「港版梵爾賽宮」，霍大班接屋後未知有否重新豪裝。  現年55歲的霍建寧是本港數一數二的打工皇帝，和黃集團的年報顯示，霍建寧05/06年度年薪達1.31億元，花紅則高達1.19億元，合共進賬2.5億元。  面積達6,000方呎、樓高三層兼擁維港全景的山頂施勳道創世紀21號A大屋，今年以市值1.9億元退居亞洲豪宅榜第三位；毗鄰的21號B則以1.7億元列第四；第五位是華置主席劉鑾雄位於白加道31號的大屋。 李嘉誠大屋無法估價沒有上榜 本來，商人趙世光去年以3.8億元天價連地購入的石澳道13號大屋，理應力壓霍建寧深水灣大宅上榜，但由於他連地一併購入大屋，故未有列入只計算大宅價值的排名榜。至於霍大班的老闆、香港首富李嘉誠位於深水灣道的大屋，由於無法估價，故此也未有上榜。  美聯物業首席分析師劉嘉輝表示，除上述豪宅，發展商最近推出的倚巒及凱旋門部份單位，成交也逾億元。他指，不少民企近年湧港集資上市，締造了不少內地億萬富翁，當中不少會來港置業，相信本港豪宅市道短期內有升無跌。中原地產研究部聯席董事黃良昇說，受惠內地豪客入市及本港股市暢旺，保守估計豬年豪宅價格會有雙位數字升幅。 3.5億元港版梵爾賽宮 今年新入榜的港島南區深水灣道37號大宅，由和黃董事總經理霍建寧去年初以3.5億元購入。大屋有「港版梵爾賽宮」之稱，總樓面1.6148萬方呎，呎價2.1675萬元。  資料顯示，物業原由榮利集團持有，94年以2億元轉售予樂聲電子，其後樂聲電子花四年時間重建，連利息總投資額達3.3億元。99年，由從事石材生意的創律集團主席徐增平以2.2億元買入，半年內以2.6億元轉售予國內商人成磊，至去年3月才由霍建寧高價購入。"
20070222-1,20070222,1,拜年歸家　車禍滅門一家三口斷頸亡,拜年歸家　車禍滅門 一家三口斷頸亡 【本報訊】昨日大年初四，屯門公路近掃管灘橋發生今年以來最嚴重的三死奪命車禍，一對夫婦攜着3個月大兒子往親友家拜年後，駕乘較早前購入的二手豐田私家車返屯門寓所途中，在彎位失控猛撼路旁石壆。私家車車頭嚴重損毀，駕車丈夫與抱着兒子坐在車廂後座的妻子雖綁有安全帶，但在猛烈的撞擊及拋動下，一家三口疑頸部折斷斃命。女事主愛子情切，臨死前仍緊抱愛兒在胸前不放。　記者：譚健文、陳偉良 由於車禍現場沒有遺下煞車胎痕，加上有目擊者稱肇事私家車出事前有彎不轉，且不減速直駛撞向左邊路旁石壆，警方正調查車禍起因，不排除有人打瞌睡或機件出故障肇禍。 衝力極猛安全帶損毀 三名死者分別為蘇文偉（36歲）、其妻陳家怡（35歲）及他們的3個月大兒子。警方消息稱，三名死者俱無表面傷痕，但頸骨嚴重受創，尤其是坐於車廂後座的兩母子，安全帶亦受損，可見當時撞擊力之猛烈，而三事主的頸部在前後猛烈擺動後致受重創，但他們的真正死因仍有待法醫官剖驗。  死者夫婦蘇文偉及陳家怡在同一公司任文職，為同事關係，兩夫婦三個月前以六十萬元購入屯門錦豐花園一期C座一個銀主盤單位，一個月後遷入居住，蘇之岳父亦居於同一屋苑H座。肇事的豐田Corolla私家車，95年出廠，蘇於過年前才購入作代步。事後警方聯絡上事主夫婦的家人，從肇事私家車車尾箱發現載有不少過年禮品看來，相信事主夫婦一家三口往親友家拜年後，駕車返家途中出事。  奪命車禍現場為屯門公路近掃管灘橋400米一個右彎位，昨晚6時30分，蘇駕着私家車沿屯門公路中線往新界方向行駛，其妻子則扣好安全帶抱着兒子坐在車廂左邊後座位。據目擊者稱，當肇事私家車駛至上址右彎位時，私家車並無右轉反而直撞向左邊路旁石壆。由於撞力猛烈，私家車左邊車頭嚴重損毀，部份車頭引擎亦陷入車廂內，車上一家三口全受重傷陷昏迷，其中女事主昏迷前，仍緊抱放於胸前的兒子，未幾車頭更冒出濃煙。  一名姓曾男子（27歲）收工駕駛綿羊仔電單車途經發現車禍，見肇事私家車車頭有煙冒出，立刻下車查看擬施援手。據鐵騎士表示，當時司機位的安全氣袋已彈出，扣有安全帶的司機陷昏迷，坐在車廂後座女乘客抱着一名嬰兒，兩人亦是不省人事，他立刻報警。  在等候救援人員到場期間，鐵騎士發現車上兩男女都昏迷不醒，他難以救出，又見車頭持續冒出濃煙，擔心車頭燒起來，遂冒險先將嬰兒救出。未幾消防救護員到場，他即將嬰兒交由救護員照顧。 無減速轉彎直撞石壆 消防員合力撬開車門救出姓蘇司機及其姓陳妻子，救護員並即場為他們一家三口急救。據現場消息稱，陳婦及其兒子被救出時已無呼吸脈搏，其丈夫亦重傷垂危，急送屯門醫院搶救，陳婦與兒子搶救至晚上7時18分及7時21分不治，其夫在8時52分傷重死亡。其家人接獲通知趕抵醫院驚聞耗噩，悲痛不已。  警方新界北交通特別調查隊已接手調查此宗意外，呼籲目擊者提供線索，初步調查顯示，肇事私家車當時應轉右彎，但該車並無減速轉彎，而是直駛撞向路旁石壆。至於肇事私家車當時的車速，由於撞車後車上的車速表轉為零度，有待驗車查驗，但從車頭損毀程度看來，當時車速應很高。
20070222-2,20070222,2,特稿業界：百佳員工粗心大意,特稿 業界：百佳員工粗心大意 一支「崩豬針」再令人懷疑百佳超級巿場對貨物的品質保證水平，多名豬肉業界人士均指出，有經驗的街市豬販知道耳背至脢頭是豬農的主要打針位置，切肉時會特別檢查是否留有斷裂的針頭，因此相信事件與百佳員工檢查工作不足有關。 割豬殼多留意打針位 元朗鮮肉聯合會理事長莫耀南表示，豬肉留有防疫針頭不常見，如有發現，一般長度由幾分至1吋左右。他指出，專業的豬販分割「豬殼」時，都會特別留意主要打針位置，若留有針頭，應不難發現。他認為百佳常聘用生手的員工處理豬肉，以致欠缺相關經驗，「業界個個都知，呢次可能係百佳員工粗心大意。」  豬肉行總商會副會長許堅指出，豬的忍痛力較強，留有針頭也不會有特別反應，針頭甚至會被當作豬毛。所以當豬肉留有針頭時，便有賴有經驗的豬販把它挑出來，他也指事件是百佳員工過於大意。  本報記者
20070222-3,20070222,3,新聞資訊研究組汽車兒童安全椅實屬必要,"新聞資訊研究組 汽車兒童安全椅實屬必要 三個月大嬰孩在滅門車禍中慘死，令人關注是否需立法強制幼童乘車時必須使用特定安全座椅。曾任法醫官的香港汽車高級駕駛協會副主席蒙海強稱，使用兒童安全椅實屬必要：「以時速70公里造成嘅撞擊，等於由六樓跌落嚟，BB單靠家長手抱，冇可能得到保護。」 宜參考外國法例 現行法例規定兩歲以下幼童在前座必須使用合格束縛設備，惟後座則只需戴安全帶。立法會交通事務委員會主席鄭家富認為，政府應參考外國幼兒汽車座椅的相關法例，研究立法的可行性。  英國去年9月實施新例，孩童乘車時需使用適合其年紀及體重的汽車安全座椅，違者可罰款約7,500港元。台灣04年強制執行1歲以下嬰兒必須置於後座嬰兒卧床，違者罰款約125港元。  汽車配件店負責人莊小姐稱，一般汽車兒童安全座售約700元，座椅本身設有安全帶，並可供汽車安全帶將座椅扣緊，至於供手抱嬰兒用的嬰兒籃則極少人買：「好多家長覺得BB大得快，用唔得耐，唔會花錢買。」"
20070222-4,20070222,4,年初一港人收發SMS創新高,"年初一港人收發SMS創新高 【本報訊】這個農曆新年港人不但派利是更手鬆，連發出的手機短訊（SMS）也創出新高。電訊管理局最新數字顯示，剛過去的大年初一市民發送與接收的手機短訊數目多達3,200萬個，比去年同日大幅上升37%，數字也打破今年元旦創下的3,100多萬個紀錄，雖然整體數目遜於內地，但比例相若。 年輕一輩潮流習慣 根據電訊管理局統計，市民在豬年大年初一發送與接收的手機短訊數目多達3,244.7萬個，比對上的狗年大年初一的2,368.2萬高出37%，數目也較剛過去的情人節2,715.3萬個與元旦日3,106.4萬個高。雖然電管局近年才開始統計手機短訊數目，但根據過往經驗，本港的手機短訊數目年年遞增，而且每逢特別日子，例如農曆新年或情人節，市民發出及接收的手機短訊數目均會突然大幅上升，所以這個年初一的手機短訊數目相信是一項新紀錄。  港人發SMS成狂，但中文大學精神科學系教授李誠認為，這不是導致市民近年減少前往拜年的原因，「香港人少咗去拜年係整體趨勢，拜年都只係搵好熟嘅親戚。」他說收發短訊在年輕一輩中已成為潮流習慣。  內地近年也興起一股「短訊熱」，根據中移動和中國聯通等幾間大型電訊公司統計，在剛過去的除夕，北京市民發出的手機拜年短訊接近5億個；資訊產業部統計顯示，去年全國手機短訊量發出量逾4,296億個，每人每日平均發出一個，比例跟本港相若。"
20070222-5,20070222,5,3店8客食盆菜後不適續有市民投訴美心蘿蔔糕發霉,3店8客食盆菜後不適 續有市民投訴美心蘿蔔糕發霉 【本報訊】衞生署在農曆年期間共接獲三宗曾進食盆菜而懷疑食物中毒的報告，三宗個案共涉及8人不適，他們分別曾進食過由黃大仙新光酒樓、葵涌大快活快餐店及觀塘麗都海鮮酒家購買的盆菜；未有個案與進食美心盆菜有關，但續有市民不滿美心蘿蔔糕發霉。  三宗進食盆菜後不適的個案，其中一宗共25人在年初一於黃大仙新光酒樓購買盆菜後，於家中進食，其中兩名女子進食後嘔吐大作，到聯合醫院急症室求診。第二宗個案在上周五，6人進食了在葵涌安蔭邨大快活快餐店購買的盆菜後，一男一女不適，向私家醫生求診。 有事主指食物有酸味 第三宗個案涉及10人進食過觀塘麗都海鮮酒家盆菜後，4人不適。其中在進食後肚痛的呂小姐指出，進食時並無感到食物有何不妥，但有朋友則指「覺得啲食物有啲酸味」，各人分別到政府醫院及私家醫生求診。  衞生署發言人表示，該署仍在調查有關個案，是否與進食盆菜有關。  食物環境衞生署已先後派員到過新光及麗都海鮮酒家調查，並取走環境樣本化驗，巡察後滿意酒樓的衞生情況，至於葵涌大快活的個案，則仍在調查中。 美心稱食譜包裝一樣 另外，連日來均有市民指在美心購買的蘿蔔糕有發霉問題，其中劉女士表示，進食了在沙田火車站提取的蘿蔔糕後，五名家人先後肚屙。  美心發言人則強調，該集團今年出售的蘿蔔糕，食譜與包裝均與以往的無分別，製作後立即冷藏，未知是否與今年農曆年特別和暖有關，但她強調，市民要把蘿蔔糕放入雪櫃冷藏，並在食用期限前進食。
20070222-6,20070222,6,婦疑打針染食肉菌喪命背痛接受注射　針口肌肉潰爛,婦疑打針染食肉菌喪命 背痛接受注射　針口肌肉潰爛 【本報訊】能於一日內置人於死地的食肉菌再現。一名婦人在一私家診所打針後，針口感到痛楚須入院治療，醫護人員發現其臀部針口受食肉菌感染，導致壞死性筋膜炎，壞死組織範圍迅速擴大，即進行手術仍無法挽回性命，婦人入院一日宣告死亡。衞生防護中心昨日派員到老婦求診的西醫診所調查，了解打針程序，暫時未能確定染菌是否與打針有關。醫學界人士指出，若因打針致病極為罕有，當局應調查並公布詳情。　記者：梁洵瑜 死者是一名73歲老婦，她上周三，即2月14日因背痛，向香港仔一家西醫診所求診，並接受注射，於臀部打針。但翌日因她感到針口痛楚，進入瑪麗醫院治療，醫護人員發現其臀部針口處肌肉潰爛，呈壞死性筋膜炎，隨即為她切除壞死的組織，但病情迅速惡化，壞死範圍急速擴大，隨即將她送往接受深切治療，但2月16日老婦宣告死亡，即入院約一天即告不治。 在診所打針後發病 院方驗出死者感染A型鏈球菌，屬食肉菌的一種。瑪麗醫院發言人表示，已把個案交死因庭研究。由於死者曾向香港仔一西醫診所求診，故院方同時將個案呈報衞生防護中心。該中心發言人證實此個案，昨日即時派員到該名西醫的診所調查，包括了解有關打針程序有否出現問題，但由於調查工作尚未完成，未能透露詳情。  傳染病專科醫生勞永樂指出，衞生防護中心應詳細調查老婦感染與打針有沒有關係。但他認為感染原因有很多，包括老婦的皮膚早帶有病菌，經打針針口感染，或針藥受到病菌污染，甚至她求診前已感染等。他指出，當局仍須調查打針過程是否合乎標準，及化驗有關針藥有沒有受到病菌污染。  曾治療食肉菌病人的骨科醫生高拔萃認為，難以判斷個案是否與打針有關，因為老婦感染食肉菌的可能性很多，但現時診所打針已用即棄針筒及藥水，很少重複使用同一樽藥水，故因針筒及針藥而受感染的可能性很低。 A型鏈球菌存於皮膚 他解釋，食肉菌如A型鏈球菌普遍存在於皮膚，但一般扺抗力強的人士沒有問題，但長期病患如肝病及糖尿病人、長者等會容易感染，感染後死亡率也相當高。若感染位置在臀部，死亡率更高，因接近身體主要器官如心臟及肝臟等，細菌入血速度更快，「腳趾或者手指感染救得番嘅機會會較大」。  本港以往提及的食肉菌個案，以被海產刺傷或感染海水中的創傷弧菌較多，但高拔萃稱，以往也有資料顯示有人打針後感染食肉菌，最多人是因一些微細傷口受惡菌入侵致病。
20070222-7,20070222,7,市面半數白鱔皆走私貨趁年假空檔混入註冊魚場魚輸港,"市面半數白鱔皆走私貨 趁年假空檔混入註冊魚場魚輸港 【本報訊】有內地不法分子趁農曆新年假期渾水摸魚，把來歷不明的魚混入供港註冊魚場的魚中，再以貨船運來香港，以避過檢驗程序，減低成本。 魚商否認有走私貨 本港業界指，農曆年鮮魚供不應求，價錢好，吸引不法之徒鋌而走險，又因養殖白鱔的魚場不多，供應量少，故走私貨以白鱔為主，估計本港半數白鱔皆屬走私魚。  本港有線電視在廣州黃沙海產交易巿場拍攝了工人把不明來歷的白鱔、桂魚及生魚等運至惠州、佛山、中山及深圳，再經中山碼頭運港。有關水產公司負責人承認，過去兩年均有批發鮮魚至港，每日交易數千斤，提供本港八至九成白鱔。  擁有供港註冊魚場的中山水產公司總經理辦公室負責人回應傳媒時稱，供港魚類均來自註冊魚場，否認有人把走私魚混在其中，又指公司被國家評為信用公司，不會掛羊頭賣狗肉。  港九新界海外漁業批發會理事長許漢文說，過年鮮魚銷情理想，「趁呢幾日空檔期，啲食肆吸貨吸得好犀利，價錢都幾好㗎，可能啲人係趁啲官員及質檢局嗰啲人放假所以咁做。」 可省逾萬元檢驗費 新界養魚協進會顧問郭誌有稱，大部份註冊魚場鮮有飼養白鱔，令白鱔供不應求，估計本港巿面上半數白鱔皆為走私魚。他解釋，魚場檢驗的費用約每斤兩毫，以每個場數萬斤計，每次檢驗約需6,000至18,000元。  食物安全中心發言人表示，經聯絡後，廣東出入境檢驗檢疫局將跟進事件；食環署過去一年共接獲約58噸來自非註冊魚場或無證明文件的內地淡水魚或其製品。"
20070222-8,20070222,8,求學業問姻緣問姻緣文武金花二廟香火盛,求學業問姻緣問姻緣文武金花二廟香火盛 【記者馮永堅、陸羽平報道】農曆新年假期結束，善信到廟宇祈福仍不絕。不少「廿四孝」父母為求子女學業進步，趁昨日年初四帶備寓意聰明伶俐的大葱及代表勤力的芹菜，偕子女到上環文武廟上香祈福，祈求文昌帝保佑子女在新一年學業進步；單身女一族則湧到深井青龍頭金花廟祈福，希望白馬王子早日出現。  位於上環荷李活道的文武廟昨日香火特別鼎盛，廟內廟外整日善信絡繹不絕，中午時分廟外更有數十人排隊等入廟，廟宇要實施人流管制措施控制人流。與荃灣圓玄學院不同，文武廟沒擠滿趕攝太歲的美少女，只有一班只得十歲、八歲，被父母抱高觸摸相傳只要一摸即可成績突飛猛進文昌筆的小朋友。 11歲女童連續10年祈福 睡眼惺忪的幼稚園生Samuel，被父母帶到文武廟一摸文昌筆及大關刀，希望學業進步及日後事業有成。Samuel父親陳先生說，除祝願愛子學業成績外，還希望他身體健康，「最重要係身體健康，有健康先可以畀心機讀書吖嘛。」11歲的呂倩茹就連續10年跟母親到文武廟祈福，她指雖然要早起床及「俾煙焗」，但為了自己「美好的將來」也是值得。  祈福無分國界，不少遊客也按農曆新年傳統到文武廟上香。來自美國的Dennis稱，很多店舖雖於新年期間休息，但也有花車巡遊、煙花滙演及到廟宇上香等活動，令他留下深刻印象。  不想明年孤獨過年的單身女，就湧到金花廟誠心上香，祈求另一半盡早出現。昨日是年初四拜祭吉日，金花廟香煙裊裊，除有一家大小前來求家宅平安，亦有為數不少的單身女性向廟內的金花娘娘求姻緣。廟祝華叔稱，求姻緣以20多歲花樣年華的青春少艾居多，「唔少相貌幾好，唔憂嫁嘅都有。」家住上水的廖小姐坦言，因與拍拖兩年的男友常為小事爭拗，藉此向金花娘娘許願，希望兩人關係能和好如初。
20070222-9,20070222,9,特稿魚蝦刺傷都會感染惡菌,特稿 魚蝦刺傷都會感染惡菌 可在短時間內奪命的食肉菌主要有三種，包括A型鏈球菌、創傷弧菌及大腸桿菌，其中以前兩者威力較強，可在短時間導致患者出現壞死性筋膜炎，嚴重者可在12至24小時內死亡，死亡率高達三成 傷口急速壞死 A型鏈球菌或稱化膿鏈球菌（Streptococcuspyogenes）主要存在咽喉及皮膚表面，經由傷口感染，感染後可大可小。輕者可引致膿腫、蜂窩性皮炎，嚴重者可以筋膜壞死，傷口很快潰爛，侵蝕入肌肉筋膜，壞死的面積可在數小時內急速地擴大，要立即以手術切除壞死組織及用抗生素治療。  另一種食肉菌是創傷弧菌（Vibriovulnificus），存在於海水，夏季海水溫度上升是感染高危期，以往有多宗個案患者被海產如魚、蝦刺傷後感染，魚販及主婦個案較常見；也有主婦在街市買餸時不慎被海產刺傷感染。  至於大腸桿菌（E.coli）的攻擊力相對較弱，一般要配合厭氧菌才有攻擊力，並只能襲擊抵抗力較低的病人。  本報記者
20070222-10,20070222,10,今往澳門博彩局交涉中空寶16歲女誓向金沙追討,今往澳門博彩局交涉 中空寶16歲女誓向金沙追討 【本報訊】年初三在澳門金沙賭場玩角子機中了74萬元的16歲少女，因未滿18歲未能領取獎金，「中空寶」的阿彤及父母，昨仍顯得非常不忿。他們指稱，事件發展至今，心情有如坐過山車般高低跌宕，但他們會極力爭取，今午將到澳門向博彩監察協調局交涉。 阿彤與母親昨晨5時返抵本港，她們因為向金沙賭場追討，折騰了大半日，感到十分疲倦。阿彤說，至昨午為止，共收到數十個友人來電及SMS短訊祝賀，但因為未能領獎所以未算喜事，「𠵱家乜都唔諗，等收到錢至算」。  其母指稱，阿彤是一名幸運兒，她去年春節亦到過金沙賭場，玩角子機贏了千多元，玩遊戲也經常中獎。去年底阿彤到添馬艦環球嘉年華遊玩，看中一個4呎高的玩具熊，她只扔了三個硬幣便中巨獎，贏取該玩具熊，家裏不少玩具公仔，亦是玩遊戲贏得。其母形容，女兒今次在金沙賭場中獎，是「一夜成名」。 父親近年賭輸20萬 阿彤表示，當日她玩過數部角子機，中獎的一部玩了15分鐘，每鋪放三個硬幣，角子機顯示的5個數字總和50為「中獎」，總和80為「大獎」，中獎前她輸了百多元。到最後一鋪，角子機亮起燈號，職員到場恭喜她中了「中獎」，獎金74萬元，其後查看她的身份證，發現她未滿18歲要求立刻離開。  從中獎到「中空寶」，阿彤與母親經多次理論後，賭場答應72小時回覆，兩母女的心情，就好像坐過山車一樣，從高峯跌落低谷，賭場其後重新啓動該角子機，供其他客人玩樂，並堅持不發出她中獎的證明，現時一家人仍忐忑不安。阿彤的父親則說，女兒為了陪伴外婆才入賭場。從事裝修工程的彤父稱，近兩年他亦有到金沙賭博，輸錢約20萬元，他認為小賭怡情，賭錢切忌沉迷，他又不覺女兒是運財童子，玩角子機不算賭錢，中了獎純屬運氣。  金沙賭場昨回覆本報查詢，重申72小時作出答覆。阿彤與父母今午將到澳門，約晤博彩監察協調局人員，要求金沙發還74萬元獎金。阿彤表示，假如獲發獎金，她將儲蓄留待日後往外國升學。 律師稱可入稟追討 另外，本報讀者林小姐稱，多年前在美國拉斯維加斯的賭場，見過有兒童拉角子機贏得100萬美元，該兒童的父親按着手把，聲稱由他拉角子機，但職員翻查錄影帶知道是兒童所為，因其未滿18歲賭場拒發獎金，相信金沙亦會依例辦事。  法律界人士黃國桐認為阿彤可入稟法院，循民事程序向賭場追討獎金。對於賭場指阿彤因未成年進入賭場，所以中獎無效，黃稱：「違例入咗去同中咗獎唔派彩，係兩件事嚟喎！」賭場讓未成年賭客入場是保安漏洞，也是賭場監管責任，賭客押錢下注，就是另一種契約，「中咗就要派彩，況且角子機並無貼上警告字句如『18歲以下人士中獎無效』，賭場唔可以因為賭客非法進入，而拒絕派彩，咁事主輸咗嗰啲錢，賭場係咪又唔算畀番佢呢？」
