key,date,article_daily_id,title,text
20070721-103,20070721,103,網誌事件　越辯越離奇方中信踢爆莫可欣遊廣州,"網誌事件　越辯越離奇 方中信踢爆莫可欣遊廣州 雖然莫可欣已否認在其網誌發表抨擊廣州讓人難以忍受的文章，但其男友方中信卻請助手在自己網誌寫道歉文章補鑊，昨日方中信在中山出席新劇開鏡拜神，他坦承有道歉，但也相信女友沒有寫偏激文章，不過莫可欣自言近來沒有到過廣州，方中信卻踢爆女友早前曾到廣州購物，讓事件更加惹人疑竇。 最近有自稱是莫可欣的人在網誌（ http://blog.sina.com.cn/mokexinblog），以英文發表一篇題為《廣州──我真的難以忍受的地方》的文章，批評廣州的一切讓人難以忍受，內容偏激，惹起網友公憤，她又怒罵台灣總統陳水扁太太吳淑珍早前涉嫌貪污案，該文章其後已被刪除。後來一名自稱名叫小豬，是莫可欣男友方中信助手的人，在方的網誌（http://blog.sina.com.cn/alexfong317）發表道歉文章，前日莫可欣否認抨擊文章出自其手，並表示近來都沒到過廣州。  組師奶團購物 昨日，方中信與伍詠薇、楊怡及向海嵐等於中山出席新劇《建築有情天》的開鏡拜神，對於抨擊廣州事件，方中信謂確是他着助手小豬代寫道歉文章，他說：「道歉文章係真嘅，我有問我女友，佢話平時喺blog寫日記，冇講過廣州啲乜嘢，不過既然發生咁嘅事，我唔想國內嘅人唔開心，咪叫小豬寫封信上去囉，我都冇時間澄清。我相信我女友唔會咁做。」  莫可欣表示近來都沒到過廣州，但方中信昨日口徑不一致，被問到可知女友近來有否到廣州，他說：「佢早排去過廣州買嘢，係啲師奶團咁囉，唔鍾意又唔會去買嘢啦，我識嘅莫可欣唔會咁偏激寫嘢，可能係惡作劇。」 狂食薯條增肥 眾《建》劇演員昨日即席打高爾夫球，只見伍詠薇臉容比前發福，她說：「我為套劇狂食薯條增肥咗七磅，其實之前太瘦，𠵱家老公都話我fit。」問她上圍可有升cup，伍詠薇說：「各樣地方都有升。」  劇中伍詠薇飾方中信妻子，楊怡則是第三者。楊怡自言從小看方中信的戲長大，封他做偶像，問她與偶像合作感覺如何，她故意以手掩住心口笑說：「佢真人好完美呀。其實佢貪玩多啲，同我哋絕對冇代溝。」  採訪、攝影：曾小嘉 自稱莫可欣網誌原文 ""Guangzhou-can'treallystandtheplace. OnthetrainfromHKtoGZ,Iwantedtogetsomesleep.Thekidbehindmewasshouting,talking,belchingandscreamingallthetime.Finally,Icouldn'tstanditanymoreandturnedaroundtotellhimtoshutup.HismomwassittingnexttothekidandwhenIlookedatthekid,Iwasabitashameofmyself-hewasinfactretarded.Shxt,howstupidIwas!!ButthenIthought,evenhandicappedpeoplecanbebad,lookatTaiwan'sfirstbitch,sheisacripplebutisabsolutelycorrupt!!WhenIthoughtofit,Ifeltabitbetter.  ArrivedinGZafterfeelingabitawkward.Man,ImustsayBig6（編按：大陸）iscertainlynotmyfavoriteplaceatall.Thepeoplehere,theair,thetraffic,justeverythingareunbearable!  Thefoodwasgoodthough.However,whateverwewantedtoorderwasalreadysoldout:thechicken,theduck,theporkknuckles,thetofu,thedesserts,younameit.Andthatnotjusthappenedinonerestaurantbutin2. 網友譯本 《廣州──我真的難以忍受的地方》 從香港到廣州的火車上，我想小睡一會。但我後面的一個小孩不停的說話，尖叫。後來我真的受不了了，於是轉過來叫他閉嘴。他媽媽也坐在他旁邊。但當我看到這個小孩的時候我有那麼一點慚愧──這孩子是個智障兒童。他媽的，我怎麼這麼愚蠢呢。不過後來我又想了想，即使是殘疾人也有很壞的人。看看台灣的第一婆娘吧（編按：陳水扁的老婆），她是個殘疾的人，但她卻是個十足的貪污犯！當我想到這些，我心理好過了很多。  到了廣州之後我就感覺有點不爽。我必須說我根本一點也不喜歡大陸。這裏的人，這裏的空氣，這裏的交通，總之這裏的一切都是那麼的讓人難以忍受。不過這裏的食物還是不錯的，但是我們叫的菜總是賣完了。"
20070721-104,20070721,104,黎姿探弟展笑靨,黎姿探弟展笑靨 黎姿胞弟黎嬰的病況日漸好轉，日前已由深切治療部轉送到腦外科病房留醫，每日風雨不改探望胞弟的黎姿，昨日如常到瑪麗醫院探病時，終於展現笑靨，故相信黎嬰的病情應再有進展。 心情不錯 昨日中午12時，黎姿雙親和親友等先到達醫院，半小時後，戴墨鏡的黎姿突從後樓梯出現，不發一言，直入病房，但她與醫護人員談話期間不時發出笑聲，記者在門外也清楚聽見，可見其心情不錯。至1時左右，滿面笑容的黎姿探病後推門離開，問她有關其弟病況進展如何？她笑說：「多謝關心。」再問她知否黎嬰何時出院？她只報以微笑，未有回答。  此外，陳志雲昨日往又一城出席AlainMilki活動，被問到黎姿何時正式復工，他說：「暫時仍然未可以講幾時正式復工，呢啲事冇人想嘅，咁大件事，有乜緊要過屋企人吖？」  採訪、攝影：娛樂突發組、吳天慧
20070721-105,20070721,105,徐子淇產後瘦17磅,徐子淇產後瘦17磅 徐子淇日前為丈夫李家誠誕下7.8磅B女，現時子淇母女仍在沙田仁安醫院休養。昨日有周刊報道指B女有些面黃，須戴眼罩照燈。至於媽咪子淇懷孕暴肥70磅，但產女後已輕了17磅，李家誠為了陪伴妻女，更在醫院處理公務，認真公私兩忙。  據悉連日有不少親友和恒基兆業職員曾探望子淇母女，故產房走廊擺滿鮮花和禮物，而日前專程往醫院賀老友李家誠生女的李國寶兒子李民斌，其乘坐的平治房車昨日5時許再在醫院出現，但車輛直駛入停車場，其後則載着一對男女離開，未見李民斌。 阿嬌現身醫院 此外，昨晚鍾欣桐（阿嬌）曾坐保母車到醫院，但沒有接受訪問；而黎姿的車輛也曾在那裏出現，但記者致電黎姿卻未獲回覆。  採訪：娛樂突發組
20070721-106,20070721,106,陳沛嘉禁制男友債主騷擾,陳沛嘉禁制男友債主騷擾 名模陳沛嘉因男友彭文堅捲入錢債糾紛，聲稱遭收數佬電話滋擾，更語帶威嚇，令她擔心人身安全，早前入稟高等法院申請禁制令，禁止債主或其代理人再作任何滋擾行為，昨獲法官頒發臨時禁制令，除律師間的書信往來，債主或其代理人不得接觸或聯絡陳沛嘉。 遭恐嚇報警 代表陳沛嘉的大律師指稱，陳沛嘉的男友彭文堅被指欠下王景慈（譯音）逾400萬元債項，有收數佬電話滋擾陳沛嘉，本月初，她更收到電話留言，聲稱「你話唔驚係咪呀？俾我見到你睇吓點！」內容超越之前的恐嚇，涉及暴力，故陳沛嘉報警求助。王的代表律師則指，王對於收數佬的行為全不知情。  案件編號：HCA1490/07  採訪：梁瑞珮
20070721-107,20070721,107,袁彌明猛晒靚膊頭,袁彌明猛晒靚膊頭 無綫第一次主辦《最受歡迎廣告頒獎禮》，為此不停宣傳，以幸運抽獎作招徠，吸引觀眾投票。昨日袁彌明、鄧上文、孫慧雪和彭冠期到九龍灣展貿的EMax宣傳，邀台下觀眾玩遊戲，自創有趣廣告。 想拍跑車廣告 袁彌明身穿露肩短裙，展示青春活力，她說：「最近識到個形象顧問，佢話我個膊頭靚，要露多啲膊頭，所以我會成日着露膊衫，冬天時連頸巾同絲巾都唔會戴，同埋會keep住短頭髮，突出我個膊頭。」講到拍廣告，她說：「我由97年開始拍廣告，拍到𠵱家，好多廣告都拍過，護膚品、婚紗，每年最少keep住拍一個，𠵱家最想拍跑車廣告，因為覺得好型。」至於鄧上文，最喜歡就是嬰兒和動物廣告，她說：「我知道呢類廣告最難拍，如果我可以拍廣告，最想就係同畢彼特（BradPitt）拍，真係拍乜我都肯。」  採訪、攝影：楊潔雯
20070721-108,20070721,108,拍MV周街攬住瞓何韻詩尖胸拮男模,拍MV周街攬住瞓 何韻詩尖胸拮男模 何韻詩食過翻尋味，特地找來曾為她擔任MV男主角的日籍靚仔男模藤岡龍雄，再為她拍攝新歌《睡王子》MV，二人在街頭不停相擁而眠，親密貼身，對於被指胸部可能拮到對方，阿詩稱自己是專業演員，故蝕底也會做。 何韻詩前晚在銅鑼灣街頭拍攝新歌《睡王子》MV，她找來之前為其拍過《勞斯萊斯》的日籍男模藤岡龍雄（Dean）再合作，演出沒有床的床戲，阿詩又笑言唱片公司大灑金錢，投資過千萬日圓給她拍MV，今次她會將MV拍成故事短片，稍後推出新碟時，連帶出一張MV影碟。 拍床戲冇床 談到與男主角的「床戲」，阿詩笑言：「我哋好似睡王子同睡公主咁，去到邊都周圍瞓，我哋拍床上戲走床，齋瞓呀！」阿詩謂現實生活中的她不易入睡，故她很想投入角色，前晚二人就在一條斑馬線旁的燈柱站着睡覺，還來一個親熱擁抱，問阿詩是否故意找一位靚仔和她睡，她說：「我係恨有個人𠱁我瞓，又好似攬枕咁俾我攬。」 「佢咀我個嘴」 問到阿詩會否與阿Dean有親熱咀戲？阿詩笑謂：「喺街想點親熱呀？都係攬吓啫，佢咀我個嘴囉。」有指二人擁抱時，阿詩不停派波餅，她謂：「專業演員，蝕底嘢都會做。」被指可能拮到對方，阿詩說：「OK啦，感覺到先算，如果要佢硬食咗，咁唔好意思囉。」  阿詩表示自從拍攝《勞斯萊斯》MV後，她很多fans都喜歡上Dean，今次特地找他再合作，是想挽回fans的心。  採訪：王連連  攝影：林德雄
20070721-109,20070721,109,林青霞再探桃花源,林青霞再探桃花源 由蘇玉華（中）以及其男友潘燦良情侶檔演出的舞台劇《暗戀桃花源》，下月在香港文化中心大劇院上演。林青霞（左二）以前也曾擔任過同名舞台劇的女主角，飾演雲之凡一角，日前她還特別往探班，並與劇團主要演員合照留念。
20070721-110,20070721,110,眼鏡大師親Miki棄李蕙敏,眼鏡大師親Miki棄李蕙敏 眼鏡大師AlainMiki昨日在九龍塘又一城出席其名下設計比賽活動，出席藝人包括楊愛瑾（Miki）及李蕙敏（A.Lee）等，數度來港的AlainMilki出名熱情，更曾對關之琳及劉嘉玲等人熱情擁抱，昨日現場所見，Alain對一身青春背心裙上陣的Miki較有興趣，更從低處「高炒」望她，反之對A.Lee則瞄也沒瞄她一眼，到與Miki及A.Lee合照時，Alain也只攬着Miki。 「外國人熱情啲」 事後記者告訴Miki出名熱情的Alain從低處「高炒」望她，知不知道他對女性超級熱情？她說：「唔係啩？我冇聽過佢啲嘢，應該係外國人熱情啲啫，其實我今日又唔係着得好性感。」  採訪、攝影：吳天慧
20070721-111,20070721,111,周麗淇缺點懶執拾,周麗淇缺點懶執拾 周麗淇（右二）和張繼聰（左）昨日在新城電台宣傳音樂會，由於音樂會以「搵」為主題，故周麗淇被要求找出自己的優點和缺點，她說：「我嘅優點係聽人意見。」問其缺點是否其外形？她笑說：「外形改唔到，惟有接受，但我嘅缺點係唔執嘢，屋企越嚟越多嘢，媽咪仲話間屋幾大都冇用。」
20070721-112,20070721,112,吳文忻撚幾味謝男模,吳文忻撚幾味謝男模 吳文忻昨日到新城接受訪問，對於最近被周刊指露底挑逗男模特兒Andy，而Andy就是與她在寫真集內拍下不少親熱照的男模特兒。昨日她強調當日露底只是不小心，至於是否有發展機會，吳文忻就說：「冇發展機會，同佢唔會有感覺，我識佢另一半㗎，為咗多謝佢，我下個禮拜仲會親自下廚，答謝喺寫真集中幫手嘅朋友。」  吳文忻自認廚藝了得，問到這是否冧男友的絕招時，她就說：「唔可以話係冧男友，好似之前我哥哥生日都第一次試我嘅手勢，我覺得幾有意思。」 為籌款唔理銷量 此外，今日文忻將會到書展為其寫真集造勢，她坦言會以平常心面對銷量，因為她今次的寫真集是為「容我燦爛慈善基金」籌款，所以到時她都會邀請好友到場支持，不過當提到「整容三嬌」Freeze會否到場時，她即開玩笑說：「冇叫呀，胸襲呀！」  採訪、攝影：駱華齡
20070721-113,20070721,113,港男李豪勇奪人氣獎,港男李豪勇奪人氣獎 應屆12位候選香港先生聯同陸詩韻昨日在荃灣錄影節目《濟濟一堂40年》，一眾候選港男即席表演才藝，結果由6號李豪（圖）奪得「現場最具人氣香港先生」。昨日擔任司儀的陸詩韻表示看好10號單俊偉，她說：「佢係dancer嚟㗎，舊年除夕騷我都有同佢合作過，當時覺得佢好斯文。」
20070721-114,20070721,114,馮仁昭四圍超：華仔坐纜車累Fans穿頭縫針 - 馮仁昭,"馮仁昭四圍超： 華仔坐纜車累Fans穿頭縫針 - 馮仁昭 劉德華噚日喺台北舉行「貓空纜車愛的叮嚀音樂會」，宣傳佢張新國語碟《一隻牛的異想世界》，他先帶15個孤兒院嘅小朋友試坐新開的貓空纜車，做第一個乘客。  之後華仔又喺貓空嘅指南宮站唱新歌，雖然噚日台北氣溫高到38度，但音樂會未開始，已吸引3,000人到場排隊等睇華仔，仲要出動300個義工同保安維持秩序。 送CD慰問 不過，華仔上山途中，貓空纜車就發生小意外，有個乘車上山嘅遊客，唔小心將手提攝錄機從吊車上跌落山，掟中一個女途人，搞到佢即時頭破血流要送院救治，仲縫咗五針。華仔唱完歌後返酒店，睇電視新聞先知件事，查得傷者係佢歌迷，華仔即派人送簽名CD去佢屋企慰問。  此外，華仔接受商台錄音訪問，講起新戲《兄弟》只有四虎獨欠梁朝偉，佢話係因為金錢問題，絕對唔係外間所推測嘅是是非非，佢話：「初頭導演話搵五虎，我就同佢講budget得2,000萬，如果要搵偉仔，佢就要度掂條數。」"
20070721-115,20070721,115,汪明荃悼劉東夫人,汪明荃悼劉東夫人 娛樂唱片老闆娘劉東夫人早前去世，昨日其女兒劉鳳兒及次子劉家富在半島酒店為母親舉行追思會，前來追悼的有汪明荃（右）、王天林（左）、俞琤和鄭國江等，鄭少秋、白雪仙和樂易玲則送上花牌。劉鳳兒表示母親生前願望是將經典粵曲重新錄音，然後推出唱片，故她與弟弟會盡力完成母親的遺願。汪明荃則透露劉太生前很愛錫她和秋官，並謂永遠記得對方叮囑她唱歌要有感情。
20070721-116,20070721,116,馮仁昭四圍超：靚靚諗定追第二胎 - 馮仁昭,馮仁昭四圍超：靚靚諗定追第二胎 - 馮仁昭 吳君如（右）為有線娛樂台節目《吳君如友嘢講》擔任主持，第一集佢就邀請咗好朋友袁詠儀（靚靚）做嘉賓，靚靚話懷孕初期都唔想知道BB嘅性別，但後來好多朋友亂咁估，所以先決定去照清楚。另外，靚靚又話到BB8至9個月大就識得認人，到時佢一定唔捨得出去拍戲，同埋佢話到仔仔一識行就會計劃生第二個。
20070721-117,20070721,117,Race膽顫見金庸,Race膽顫見金庸 2R的黃婉伶（Race）昨日在灣仔會展出席港台「太陽計劃2007──太陽閱讀Teen」，跟武俠小說家金庸（查良鏞）會面，席間Race送上自己的新書給金庸，她說：「我之前做《笑傲江湖》舞台劇都認識金庸，不過今日再見面好緊張，我送自己本新書畀佢，希望佢可以睇吓年輕人寫嘅嘢，只要佢肯睇，我已經好開心。」Race的散文集中輯錄了不少性感照，可怕金庸看到噴血？她說：「啲相係性感得嚟好健康嘅。」
20070721-118,20070721,118,馮仁昭四圍超：官恩娜以Yumiko為鑑 - 馮仁昭,馮仁昭四圍超：官恩娜以Yumiko為鑑 - 馮仁昭 官恩娜噚日着咗條娘爆嘅裙，去ifc出席手袋騷，佢話遲啲會去荷蘭做華人新秀歌唱大賽嘉賓。問官恩娜有冇鄭希怡（Yumiko）早前喺加拿大走光嘅陰影？佢話：「我都驚㗎，不過我會做足防走光措施，同埋提醒自己唔好太大動作。」
20070721-119,20070721,119,李司棋祝福黎姿弟,李司棋祝福黎姿弟 「大契」李司棋昨日在奧海城出席「甜心『鮑鮑』新秀大會」，甚少下廚的她透露剛從青島拍完劇集《珠光寶氣》回港，被問到停工多時的黎姿即將復工，劇組有否被打亂陣腳？她說：「暫時冇乜影響，佢都唔想嘅，希望佢（黎姿胞弟）快啲好番。喺青島拍嘅都係冇黎姿嘅戲份，之後會再去拍，就畀佢唞多啲，搞掂屋企嘢。」
20070721-120,20070721,120,鄭丹瑞力撐朱培慶,鄭丹瑞力撐朱培慶 廣播處處長朱培慶因為拖女新聞而提早退休，曾跟朱培慶共事過的鄭丹瑞（圖），最近接受港台《名人館》訪問時，提到朱培慶時說：「我頭先來到港台，見到新哥（張文新），我叫佢幫我同朱sir講『我撐』。」鄭丹瑞認為在所有人都未知道真相是甚麼的時候，不可以將朱培慶判刑，他說：「最令人失望係港台員工第一時間出嚟講士氣受打擊。」
20070721-121,20070721,121,馮仁昭四圍超：梁漢文唔知健仔做老竇 - 馮仁昭,馮仁昭四圍超：梁漢文唔知健仔做老竇 - 馮仁昭 梁漢文（左）、盧巧音、楊思琦（右）同薛家燕噚日到新城為下月喺順德舉行嘅「香港新城電台走進高明演唱會」出席記者會。梁漢文對於好友張衛健（Dicky）就快做老竇，佢就話仲未收到風，又話未聽過Dicky提及，不過佢就叫大家靜待答案咁話。
20070721-122,20070721,122,陳美齡恨飲新抱茶,陳美齡恨飲新抱茶 陳美齡一家五口是次專程從日本來港賀姨甥天承娶老婆，去年尾陳美齡曾返港往養和醫院切除唾液腺腫瘤，手術十分順利。前晚她更在婚宴上高歌一曲《Timeless》送給一對新人。 將赴京演唱 陳美齡說：「寓意佢哋要一世相親相愛嘛。」她又笑言見到姨甥娶老婆，自己也恨飲新抱茶。  陳美齡透露9月25日會以日中友好協會大使身份，到北京人民大會堂舉行演唱會，她說：「呢個活動係慶祝中日友好35周年紀念，我上次返內地已經係85年，咁耐冇返去，內地變化又咁大，我都充滿期待。今日返日本就會開始動手將啲歌詞繙譯成中文，到時除咗二仔要返高中行唔開外，其他個個家庭成員都會同我一齊去。」
20070721-123,20070721,123,相士話：子淇要追仔2010最易中,相士話：子淇要追仔2010最易中 徐子淇終於本月17日誕下一名女嬰，作為爺爺的李兆基固然高興，但據悉他私底下恨抱男孫。記者就找來三位堪輿學家，根據徐子淇命格推算她何時最有機會懷男嬰。    蘇民峰（圖）：佢條命屬火，生於冬天，需要火嚟照暖，木就生火，咁佢喺火嘅年會較易生仔，2010至2015連續6年都係屬木同火，會易啲生仔。如果嫌耐，08年單獨一年都會較易生仔，但就唔夠2010年後嘅機會大。    鄭智恆：如果佢09年有，09或者10年生都好大機會係仔，因為徐子淇係壬戌年申亥月丙辰日出生，09年係流年傷官，女命流年傷官嘅話就大多生仔。    區仲德：佢會到2010年先會遇到子星，子星先至旺。佢今年虛齡26歲，要到虛齡28歲，子星先會顯現先會旺。2010年子星呈現，佢生仔嘅機會好大，但如果係呢幾年再生就都會係女。 娛樂資料庫：性別冇得揀惟有繼續生 為人父母的通常都口說不介意孩子性別，但其實非常着緊，最理想就是仔女兼得。 趙汝琪、Audrey 趙曾學韞新抱Audrey連生五名兒子，她日前公開表示：「想追個女嘛。」 王敏德、馬詩慧 一直恨仔的王敏德與馬詩慧已有兩名女兒，99年尾二人終成功得子。 沈嘉偉、邱淑貞 結婚7年、育有兩名女兒，去年被指曾遠赴尼泊爾，找當地的師傅祈福，求早生貴子。 李澤鉅、王富信 已是三女之母的王富信，05年再度懷孕，並於去年中產下一子，償追仔心願。 碧咸、Victoria 兩人已育有三子，Victoria近期受訪問也坦言希望多添名女兒。    資料來源：《蘋果》資料室
20070721-124,20070721,124,馮仁昭四圍超：李連杰基金義工星閃閃 - 馮仁昭,馮仁昭四圍超：李連杰基金義工星閃閃 - 馮仁昭 李連杰近年全情投入佢發起嘅壹基金計劃，前日佢公開咗基金透過銀行、滙款嘅捐款約551萬、義工捐款48萬、加埋手機短訊同網上外幣捐款，總共籌得約600萬。李連杰不停游說中港台娛樂圈藝人加入義工行列，𠵱家基金嘅永久義工明星名單包括周潤發、劉德華、周杰倫、李安、吳宇森等。早前有內地媒體質疑李連杰私吞善款，對此佢回應：「我今天站出來做這件事，第一，我還蠻有名的；第二，我的錢還夠養家餬口，沒有必要出來騙每個人一元錢。」
20070721-125,20070721,125,一週追星星,一週追星星 萬寧夏日驚喜浪接浪 出席藝人：馮德倫、AmandaS.  時間：今日下午2時50分  地點：沙田新城市廣場1期L3樓313號舖 ILoveYouBoyz簽名會 出席藝人：ILoveYouBoyz  時間：今日下午3時  地點：會展會議廳A區 森美移動簽唱會 出席藝人：森美  時間：今日下午3時  地點：創紀之城apm大堂 李克勤新碟發佈會 出席藝人：李克勤  時間：周一下午3時  地點：數碼港三期L3海景廣場 極限運動群英會 出席藝人：徐淑敏、葉翠翠  時間：周二下午2時15分  地點：太古城中心二樓舞台
20070721-126,20070721,126,小啓,小啓 是日稿擠：《娛樂怪史》暫停一天
20070721-127,20070721,127,小啓,小啓 編註：是日稿擠，Hit爆娛網、優先搜畫暫停一天。
20070721-128,20070721,128,紅BlogBlog異國戀大考驗　張靜初玩蟲　家輝食曱甴,紅BlogBlog 異國戀大考驗　張靜初玩蟲　家輝食曱甴 由內地導演章家瑞傾力打造的雲南「紅河三部曲」壓卷之作《紅河》，找來張家輝及張靜初上演一段異國戀情，連月來兩人也在雲南中越邊境小城河口趕拍，日前終於完工。二人近日分別在blog上跟fans分享電影拍攝過程，不過一中一港演員卻有不同的感受，面對內地的惡劣拍攝環境，張家輝明顯不及內地的張靜初豁達！ 噪音騷擾 張家輝在網誌內表示，過去兩個月的拍攝工作對他來說是個大考驗，因為內地跟香港的生活方式有許多差異，當他以為自己已住進全鎮最好的酒店時，卻整天被不同的聲音轟炸，沒有辦法之下他惟有選擇接受，而最叫他吃不消的，則是有天吃了一口外賣的飯盒後，竟發現盒內有一隻跟他拇指一樣大的蟑螂，凌零發都覺得相當恐怖。  不過張家輝已經頗能調節自己，他除了默默接受之外，更有一番新的領悟，他說：「你遇到好的事情的時候，不要認為這是最好的，同樣，當然你遇到壞事的時候，更加要有心理準備迎接更壞的事情來臨。」 樂在其中 另一方面，在片中演智障越南女孩的張靜初，雖然同樣經歷張家輝的苦況，不過她卻樂在其中，張靜初面對不少蛇蟲鼠蟻，更搞笑地說以她在戲中智障女孩的眼光，河口變成了動物園！  張靜初更徒手抓起蝸牛，又跟獨角仙拍照都面不改容，非常大膽，還把這些相片放上網跟fans分享，似乎非常投入角色。  版主：凌零發    張靜初Blog   http://blog.sina.com.cn/zhangjingchu     張家輝Blog   http://www.cheungkafai.com/ 
20070721-129,20070721,129,關仁隱事：皇妃慘變拖肥奶媽 - 關仁,關仁隱事：皇妃慘變拖肥奶媽 - 關仁 「皇妃」早排同公仔箱高層個女「拖肥」合作拍劇，佢兩個出席宣傳活動嘅時候手拖手，好似感情好好咁，但其實皇妃咁做只係畀面高層，佢對拖肥極度嫌棄。 老手戥場 關仁聽聞公仔箱高層，為咗彌補自己個女嘅半桶水演技，唔單止搵好多演技派同佢個女合作，而且佔一半以上嘅場口，都要有個演技派戥住，等拖肥做唔掂嗰陣，有個老前輩幫手提點，結果皇妃同拖肥合作嗰陣，連拖肥去廁所，都幾乎要皇妃傍住。  搞搞吓皇妃拍嘅場口無端端多咗好多，結果皇妃越拍越覺得唔對路，忍唔住搵幕後講數，要求佢哋唔好再要佢做湊女婆，但講完之後，只係象徵式減咗少少咋。  Textby關仁
