key,date,article_daily_id,title,text
20070831-384,20070831,384,生死物語「簿」你大,生死物語 「簿」你大 開學前兩天，也是最後一夜可晚點睡，追看比電影靚N倍的《死亡筆記》動畫。看夜神月像罰抄般在筆記簿寫下名字，憶起兒時在方格紙上抄詞語的光景。現代小孩打鍵盤多過拿筆桿，背面印有九因歌的練習簿賣少見少。欷歔之際，竟發現仿傳統、人手製的練習簿！跟其設計師聊天，慶幸他的堅持，令練習簿不會隨鐘樓而去…… 記者：馮冠芝　攝影：梁細權 珍藏舊「簿」貝 現今電腦、Palm滿飛，還以練習簿記事的Benedict可變奇珍，但從他的收藏所見，前人善用練習簿的程度，才教人嘆為觀止。最令他印象深刻的是一本50年代，寫了他人生日死忌的「月筆記」：「那年代的人很節儉，會將小孩用剩的簿當記事用。記親戚生日很常見，但死忌則較少有。」亦見過一本封面手寫「口供簿」，內容活像偵探查案的「L筆記」：「詳細記述了上下課的詳情。除畫了學校4幢大廈的地圖，連桌椅也會形容。又記了關於移民美國的自問自答。」自8年前Benedict開始從廢紙回收廠尋找收藏品，就發現練習簿自己會說故事。 練習簿最愛用　暑假一天耗一本 逛apmKubrick書店發現了一個小型文具展。除有30至70年代的傳統文具，還有許多以LaJeunesse品牌發售的仿古練習簿、時間表等手製文具。既是收藏者又是設計人，BenedictLeung對文具的執着，竟非一般大眾的鉛筆擦膠，而是比「死亡筆記」多了九因歌的練習簿。阿月不眠不休寫名字，Benedict則呆整個暑假在練習簿上畫畫。「未識寫字，我已用練習簿畫畫。每年暑假都獨自坐在房中畫公仔，一日可畫滿一本厚練習簿。」 房間借客 三歲定八十，Benedict現在還是「簿不離手」：「我落街唔帶錢也要帶練習簿。」除了記設計靈感，他更會用練習簿記事、電話等。於他，練習簿比電腦更有用：「簿內是空白的，就像一個空白的私人房間，每人愛幹甚麼都可以，用這私人房間去成長。」他以「房間借客」的角度，改良練習簿的缺點，去年4月以自家的練習簿品牌LaJeunesse誕生了。 設計大晒冷　借古諷今 不止製作技巧，Benedict文具封面、設計都回到過去，真的如此喜歡以前？「以前的人，較誠懇認真，懂得做人道理。」再看他的作品，跟舊年代的文具相似而不相同，他的設計，件件有嘢Say！ 「房間門口」寄語 CouldHaveBeen Benedict的文具，由買紙、印刷、裝訂等，全是人手製。他找來半退休的伯伯們幫手，採用只有座枱般大的印刷機，一切都是舊年代的技術。說他的作品是仿古也不盡然，因為他用那時的技術，去做一些那時有可能發生，卻沒發生的事（CouldHaveBeen）。例如其中一本封面畫了一個男孩冒雨離開中山小學校，是寄寓30年代從動盪中國來港，或到外國的華埠，下雨思鄉愁，亦思國家情愁。  Benedict每個設計都「內有亁坤」，乘此展覽，推出《更美好年代——手製文具創作筆記》一書，前部份細說作品概念，後部份則邀智海，以富想像力的插畫，繪出Benedict製作文具的25個程序，此批畫同時展出。 智海插圖手製文具過程 1.練習簿所選用的紙若太薄遇熱會捲起來，此時要與印刷機鬥快捲紙，否則會Jam紙。 2.然後在未釘成書的紙上壓線，再以衣車車線，稍有差池，便前功盡廢，不能重車。 3.車線後要逐本對摺。車線後簿會自動彈開，需用重物壓過一兩日，才可裁切。 4.潤飾後，Benedict會逼車往書店賣「兒子」。 更美好年代-LaJeunesse手製文具創作展  日期：23/8-4/9（1:00pm-10:00pm）  地點：觀塘apm6樓L6-1a舖  查詢： http://www.kubrick.com.hk/ 
20070831-385,20070831,385,遮打花園變時尚舞台超模‧靚衫Luxury,遮打花園變時尚舞台 超模‧靚衫Luxury 平日的中環西裝套裝人流不絕，但由今晚開始，中環心臟遮打花園則變得衣香鬢影靚人靚衫，原因是「MasterCardLuxuryWeekHongKong2007」這個本地時裝界盛會於今天晚上正式展開，直至9月9日一連十晚各大國際級品牌如CalvinKlein、ZacPosen、OscardelaRenta等，輪流在遮打花園特別搭建的大舞台演出，全場可容納500多人，於香港舉行的時裝表演來說，可謂規模最大的一次。香港的時裝愛好者終於不用飛去巴黎米蘭也可感受到頂級時裝展的氣派。 記者：梁俊鵬 攝影：陳陶鈞 協力：林栢鈞 Model：IMGModels （左）CalvinKleinCollection的超長晚裝裙，由身高180cm的模特兒Caite示範，無難度。  來自歐洲的模特兒Diana（中）和Juli（右）穿上VivienneTam東方味的裙子，置身中環，獨有風味。 TheSwank集合KENZO、Givenchy、ChristianLacroix等各大名牌，這次亦參與表演。 ColletteDinnigan自95年在澳洲打響名堂後，一直也有參與巴黎時裝周，ClaudiaSchiffer及LucyLiu亦是其捧場客。 CalvinKleinCollection，貫徹其簡約設計，雖是黑、灰色為主的冬裝，在中環的燈飾中仍是亮麗照人。 消費者可參與的時裝表演 一向在巴黎米蘭舉行的大型時裝周，對象都以時裝業界買手而設，只有少數時裝友和品牌熟客，才有預覽新裝的機會。這次LuxuryWeek卻以消費者為對象，只要係有Invitation（當然都很珍貴啦）就可入場參與。今次專為表演而搭建的場地，佔據半個遮打花園的範圍，規模相當大，可容納500多人。來自東歐的模特兒已陸續到港，準備今晚的演出。 杜鵑任開幕嘉賓Model 今次LuxuryWeek的主辦單位IMGFashion，更特地找來14位歐洲名模助陣，全部都是Runway經驗Model和《Vogue》、《Bazaar》等雜誌的封面女郎，其中多位來自東歐的模特兒，更是首次在港行Show。今日為我們「時戴令」拍攝的三位模特兒，皆是模特兒界的RisingStars。此外，今次亦請來中國超模杜鵑出任嘉賓模特兒。杜鵑自膺03年度中國小姐後，火速在時裝界冒起，成為首位登上法國版《Vogue》封面的亞洲模特兒。幾年間已獲邀參與巴黎各大品牌的高級訂製時裝展。06秋冬她更完成了時裝周43場發佈，LouisVuitton、BottegaVeneta都紛紛向她招手。 時尚之夜 LuxuryWeek由8月31日至9月9日擧行，共11場表演，最後一晚則為特別演出。《蘋果日報》獲邀成為今次LuxuryWeek的傳媒合作夥伴，早前更送出180張貴賓入場券予《蘋果》讀者參與這個時尚活動，感受一下Luxury。有關這次時裝展的最新情況，請留意「時戴令」日後的報道。
20070831-386,20070831,386,菠蘿煲呔南瓜頭開學一嚿飯,菠蘿煲呔南瓜頭 開學一嚿飯 漫長的暑假快結束了，下星期一又要迎接新學期。開學在即，買齊書本、文具、校服、書包、鞋未呢？我最着緊的，還是吃得溫飽，那才有氣力讀書嘛！既然經常被人話出街食冇益，不如自己做個有「營」飯盒，二加三少肉多菜，味道要好、賣相要靚，最緊要係食得飽！ 記者、示範：黃潔蓮 攝影：陳盛臣 學生哥（南瓜飯糰） 南瓜營養高，可增強免疫力、優質脂肪酸又可防止血管動脈硬化等，用來製成南瓜飯糰，不論顏色、味道和營養都滿分！   材料 南瓜50克、米1杯、番茄1片、雞蛋1隻、藍莓2粒、菠蘿1片、紫菜2片、西蘭花1/2個、雜菜粒30克 做法 1.南瓜去皮去子切粒，放入米中加入適量的水煮成南瓜飯。    2.趁熱將南瓜與飯攪勻，搓成球狀做成頭。    3.雞蛋烚熟切片與藍莓切片砌成眼睛；番茄切絲做成嘴巴。    4.菠蘿切件，做成煲呔；紫菜剪成半圓做頭髮；加入用鹽水灼熟的西蘭花及雜菜粒伴碟即成。 貼士 南瓜本身水份重，在烹煮時會溢出水份，所以煮南瓜飯時應比平日煮飯下水的份量少一點，以免飯太黏。 鉛筆盒（四色糙米飯） 開學文具最需要筆盒，用火腿、紫椰菜、雞蛋皮化成顏色筆，內裏包着牛肉碎糙米飯，拿着來吃方便好多。糙米含粗纖維，有益腸胃，對於多肉少菜的小朋友來說，最能補充纖維素不足。 材料 紫椰菜1片、火腿1片、雞蛋1隻、糙米飯1碗、腸仔1條、免治牛肉100克、甘笋1條    醃料：生抽1/2茶匙、糖1/2茶匙、胡椒粉少許 做法 1.牛肉加醃料醃10分鐘，燒熱鑊加少許油炒至熟透呈粒狀，加入糙米飯中拌勻。    2.腸仔煎熟、雞蛋拂勻煎成蛋皮，甘笋及紫椰菜用鹽水灼熟備用。    3.把飯鋪在保鮮紙上，再用壽司蓆捲起搓成3條圓柱狀，跟腸仔差不多粗幼，分別以火腿、紫椰菜、蛋皮等包裹着，甘笋切件削尖成鉛筆頭即成。 貼士 雞蛋皮要煎得靚不起泡，要在鑊上沾少許油，然後以慢火將蛋皮煎熟，切忌猛火和多油。 百科全書（蛋包公司三文治） 百科全書的內容豐富，可解答疑難。像公司三文治，包含多種餡料，一定可以填飽你個肚。 材料 蛋1隻、麥包3片、生菜1片、煙肉1片、青瓜4片、番茄1個、芝士1片、火腿1片 做法 1.煙肉煎香備用；番茄去蒂切厚片。    2.麥包切去1/3成長方形，分別夾入芝士、青瓜片、生菜、番茄片及煎好煙肉，面頭放火腿片夾成三文治。    3.雞蛋拂勻煎成薄薄蛋皮，裁成與麵包相若的闊度，長度要是3倍，然後包着夾好的三文治即成。 貼士 青瓜切去頭後磨出白色汁液，可將青瓜的澀味去除。切片後浸進冰水中，可使其爽脆。 網球精英（茄汁茄子肉丸意粉） 很多人不喜歡吃茄子那滑潺潺的口感，但茄子本身營養甚豐富，提供大量的鉀質來幫助平衡血壓。只要用味帶酸甜的番茄醬蓋過茄子潺潺的口感，配上乒乓肉丸，有齊滑嫩彈牙口感。 材料 免治豬肉300克、洋葱1/4個、茄子1隻、意粉（煮熟）200克    調味：生抽1湯匙、砂糖1茶匙、蛋1/2個、胡椒粉少許、生粉1湯匙    汁料：番茄2個、茄汁2湯匙、砂糖1湯匙、鹽少許    芡汁：水50毫升、生粉1茶匙 做法 1.免治豬肉加調味及切碎的洋葱粒拌勻醃15分鐘，之後搓成乒乓球狀蒸10分鐘至熟。    2.茄子用尾部，切厚片並裁成球拍形狀後用鹽水汆熟，跟肉丸同排在意粉上。剩下的茄子切粒備用。    3.將汁料中的番茄去蒂後煲熟，去皮切粒。燒熱鑊將番茄粒、茄子粒、茄汁、砂糖及鹽拌勻略煮，再埋生粉芡後淋在意粉上即成。 貼士 番茄去蒂後，軟軟在表面𠝹十字，然後放入滾水中煮熟，就可輕易搣走皮。 買定料明日教你煮即食麵 辛辣雞絲冷麵 韓國辛辣麵1個、雞扒1件、紅辣椒1/2隻、熟蒜1茶匙、日式燒汁2湯匙    韓國辛辣麵的麵質較粗韌有彈性，即使煮過時亦不會過腍，過冷河後更為彈牙，加上附有辛辣調味料，很適合做冷麵。 芝士白汁吞拿魚焗一丁 出前一丁1個、吞拿魚2湯匙、洋葱粒少許、鮮奶1/2杯、花奶2湯匙、卡夫芝士1塊 燒汁肥牛公仔麵卷 雞蓉味公仔麵1個、肥牛150克、洋葱圈適量 肉鬆福字粢飯 福字麵1/2個、糯米100克、橄欖油2茶匙、肉鬆適量
20070831-387,20070831,387,囗過冷河囗灌滾水彈又爽四式變麵,囗過冷河囗灌滾水彈又爽 四式變麵 即食麵之父安藤百福先生於1958年推出全球第一種即食麵ChickenRamen，被日本人評為「20世紀最偉大發明」。時至半個世紀後的今天，即食麵依然偉大，3分鐘食得，打救過無數忙到唔得閒食的香港人，更偉大的是，一個平平無奇的即食麵可以變出更好味的美食，而且唔同牌子的即食麵亦各有獨特之處，今日請到怪師傅為大家示範4款創新食法。 記者：趙珮倩 攝影：周旭文、林栢鈞 烹飪指導：怪師傅烹飪工作坊創辦人劉傑盛師傅（http://www.masterwhy.com） 炒麵彈牙秘訣 相信唔少朋友都鍾意「炒一丁」，通常我們都會先將麵放滾水中煮，但這樣只會使麵變腍，過冷河只是「補救」方法，令它避免過腍。原來最佳的做法是將麵放在筲箕中，不停灌滾水將麵淥至9成熟，然後即時蓋濕布焗約4至5分鐘，然後再炒來吃，這樣保證彈牙爽口。 怪師傅  入廚年資：超過30年  威水史：獲頒發全國認可（中式）麵點高級技師證書，擅長製作中式點心，創意無限千變萬化。 肉鬆福字粢飯 份量：3人  0hr25min  有邊個細個未試過生食福字麵？香口惹味脆卜卜，其味粉乃關鍵所在，撈埋肉鬆，味道勁夾，與軟綿糯米口感成強烈對比，有脆有趣！ 材料 福字麵1/2個、糯米100克、橄欖油2茶匙、肉鬆適量、調味粉1包    用乜麵：  福字上湯伊麵 做法 1.糯米加入2杯水蒸20分鐘至熟透，待凉備用。    2.福字麵壓碎，加入調味粉撈勻。    3.糯米飯與即食麵混合，加入4杯熱水及橄欖油拌勻。    4.將混好的麵飯糰鋪平放在保鮮紙上，然後撒上肉鬆，用力捲起，吃時切件上碟。 貼士 糯米飯加入水後會黐埋一團，故要加入少許橄欖油才易於攪拌。 辛辣雞絲冷麵 份量：1人  0hr15min    麵質較粗韌有彈性，即使煮過時亦不會過腍，加上附有辛辣調味料，很適合做辛辣冷麵。 材料 韓國辛辣麵1個、雞扒1件、紅辣椒2隻、熟蒜1茶匙、日式燒汁2湯匙、辛辣調味粉1/2包    用乜麵：  韓國辛辣麵 做法 1.辛辣麵以550毫升滾水煮分半鐘至8成熟，然後過冷河盛起瀝亁。    2.雞扒烚熟後切絲，混入冷麵中，下調味粉拌勻。    3.紅辣椒切粒，與熟蒜及日式燒汁拌勻，吃時淋上面即可。 貼士 以調味粉亁撈麵，味道會較鹹，宜逐少加入試味。 燒汁肥牛公仔麵卷 份量：2人  0hr10min    雞蓉味粉味道偏濃，加上公仔麵本身蛋味較重，令煮出來的肥牛卷更惹味，色、香、味齊加分。 材料 公仔麵1個、肥牛150克、洋葱圈/生粉各適量、雞蓉味調味粉1包    用乜麵：  雞蓉味公仔麵 做法 1.公仔麵以550毫升滾水煮2分半鐘，然後過冷河瀝亁。    2.肥牛肉捲上適量公仔麵，塗上少許生粉封口。調味粉加入1杯熱水攪勻備用。    3.燒熱鑊下肥牛卷煎至8成熟，倒入調味水，加蓋焗1分鐘至入味，最後放上洋葱圈點綴。 貼士 煎肥牛卷時要先煎封口位部份，避免散開。 芝士白汁吞拿魚焗一丁 份量：1人  0hr20min    出前一丁麵質夠滑夠腍，爽口不黏牙，以白汁焗口感極佳。 材料 出前一丁1個、吞拿魚2湯匙、洋葱粒少許、生粉水/鹽各適量、鮮奶1/2杯、花奶2湯匙、卡夫芝士1塊、麻油少許    用乜麵：  麻油味出前一丁 做法 1.出前一丁以550毫升滾水煮3分鐘，然後過冷河瀝亁。    2.洋葱粒起鑊炒至半熟，倒入1/2杯水、鮮奶、花奶及吞拿魚，加入生粉水煮至稠身，下鹽調味。    3.將白汁淋上麵條，鋪上芝士，放入已預熱焗爐，以220℃焗8至10分鐘，吃時加入麻油拌勻即可。   貼士 白汁要煮至夠稠，否則汁液全滲漏至黐底，影響賣相。 ５款新派即食麵韌力測試 即食麵款式越賣越多，行到大型超市的麵架，超過百幾款你揀，但十幾蚊包，又唔捨得亂買嚟試？即刻搜羅５款新派即食麵，跟足包裝指示煮埋，睇睇煮完煲水的清澈度（5分為最清），以及比試一下各麵條韌力有幾勁（各以10吋長麵條掛上小鈎作測試，10分為最高）。 豆乳即食麵$11（a） 麵條過腍，口感一般。 蒟蒻即食麵$14.5（a） 超煙韌勁有嚼感，賣點係只有60卡路里，健康之選。 北海道即食麵$12（a） 麵條煮完仍有少許油饐及鹼水味。 有機即食麵檸檬草味$6（b） 不經油炸，的確少了一份油膩感。 有機蕎麥即食麵$12.5（b） 蕎麥味幾特別，惟麵條短散易斷。 售賣點 （a）city'super（23758222）    （b）MARKETPLACEbyJASONS（21174146） 買定料明日教整甜品 咖啡蛋白杏仁餅 凍蛋白70克、砂糖50克、糖粉90克、杏仁粉70克、即溶咖啡粉6克、蛋黃10克、全蛋30克、呍呢拿條1/8條、無鹽牛油125克、傳統牛油忌廉100克   焗水果盤 砂糖77克、橙酒60克、士多啤梨6粒、蛋黃50克、呍呢拿條1/4條、奶125克、淡忌廉125克、意大利軟芝士50克、紅桑子/藍莓/橙柳/芒果片各適量 芒果乳酪慕絲杯 芒果肉粒1/2個、芒果果茸150克、魚膠片2.5克、砂糖20克、魚膠片2.5克、淡忌廉80克、乳酪30克
20070831-388,20070831,388,數碼達人：翠兒阿寶　搶手機,"數碼達人：翠兒阿寶　搶手機 一向有推出廸士尼角色特別版手機嘅Dmobo，最近又有新手機推出，今次就改為推出華納陣營的翠兒版手機LT1。同以往一樣，手機內外都以翠兒為主題作包裝，最特別係機身有18K鍍金外殼，再加上一個手機搖動閃燈功能，限量發售1,000套，特別罕有，難怪翠兒阿寶都搶住要。 記者：許福合 攝影：陳陶鈞 邊度都有翠兒 呢部翠兒手機LT1，論功能雖然唔算頂級最強，不過都算滿足到一般用家，好似有130萬像素鏡頭、MP4播片、MicroSD插卡等等，講真，淨係賣周身翠兒已經夠晒號召力。筆者最欣賞機背翠兒插畫，拎住講電話都可以畀其他人睇到，令人流晒口水！而機身內亦係翠兒世界，無論開機關機都會播放一段翠兒動畫，真係幾搞鬼過癮；再加埋大量翠兒Wallpaper，可以日日換畫，翠兒Fans肯定開心死！ 限量1,000套 雖然主要係賣樣，但LT1都有唔少好玩功能，最好玩當然係搖動閃燈，只要將手揮動，機側閃燈就會自動偵測擺動速度，出現預先輸入的閃燈字樣。至於顯示內容可以自己輸入如I囗U、HELP等，並且可以分別設定成唔同模式使用，例如開機、關機及通話中。LT1將會限量推出，雖然包裝就唔見有證書，不過機身印有編號，筆者手上一部就係0001/1000，可見限量只有1,000套，有興趣就要行快步！   Profile 制式：GSM900/1800MHz  通話時間：120-150分鐘  待機時間：80-120小時  屏幕：2.2吋26萬色  鈴聲：64和弦、MP3、Midi、Wav  記憶卡：MicroSD  其他功能：手寫輸入、GPRS、MMS、電子書、遊戲、130萬像素鏡頭、3GP/MP3拍片  體積：90×49×15mm  重量：75g  售價：$1,580（連翠兒公仔）  查詢：Dmobo（31022868）"
20070831-389,20070831,389,好想飛：避世Cafe　上山看海食咖喱,"好想飛： 避世Cafe　上山看海食咖喱 陽光、海灘、美女、苦瓜，比香港大30倍、位於日本南端的冲繩小島，就只有這些沒其他？唔信，人人鑽進海底看魚看珊瑚，我偏要爬山上斜食風食晚餐！我說：仁者樂山。朋友說：不是「樂」山，是「拗」頸才真。是的，要發掘冲繩可愛的另一面，就由包拗頸開始…… 記者、攝影：鄒家鳳　鳴謝：EGL東瀛遊 「甚麼東西，要駕車上山吃？」「泰國菜？那霸市南城市多的是。」「大半小時了，肚都攣喇！」七人車內七嘴八舌，都跟我唱反調，包拗頸的我當然死撐，死撐全因雜誌上一張海天一色的照片，還有被JOHO《冲繩旅遊》雜誌選為2006南部No.1餐廳Cafe的緣故，而對那避世的CURCUMA，深信不疑。  可是，我們從那霸市到南城市，再沿着知念的山路向上爬，路很彎很窄，繞過一間又一間的民居，一個又一個的小花園，左兜右拐……衞星導航明明指示已到，怎麼依然如像雲裏霧裏，天色漸濃，心裏開始急，正當人人都勸我放棄的時候，終於看到風車了，根據書上指引，再向右轉即達。 藍色太平洋　若隱水平線 「怎麼是間小木屋而已？」迎面看到的只是前菜，是專賣有機健康食品的小店，旁邊還有草藥園，種植冲繩和東南亞各地500種如鬱金等不同藥草和植物。穿過小店便是餐廳，從餐廳向外望，不就是相片中的景色？藍色天藍色海，面向這個水平線若隱若現、沒遮沒擋的太平洋，有誰還會說我老點？況且，這裏的日式泰菜實在不錯，無論鄰桌來自神戶的Saori和Ari向我們推介的咖喱雞、炸蝦、柚子沙律，辣的脆的酸的，都對準我脾胃，只是室外的清風，只能吹亂我的長髮，不能吹走那些蚊子，我咬了三口食物，蚊也叮了我三口，算吧，還是搬回室內，凉着冷氣吃咖喱好了。隔着玻璃的太平洋，不也一樣美嗎？ 2006南部No.1Cafe CURCUMA  地址：冲繩縣南城市知念字知念1190  電話：（81）98-9491188  時間：10:00am-10:00pm，星期二休息 大宅茶館　看東海上的夕陽 經過那次駕車上山的經驗，以為今次會聰明點，認路快一點，「喂，這裏是中北部名護市附近，跟南部相差十萬八千里，認路？說笑吧！」結果，還是找上大半小時，才看到那個小木牌「花人逢」。  由昭和年代的大宅改建成今天的喫茶館，已有九年歷史，內裏仍保留一些古老傢俬，單是那個大木櫃就早已過了百歲大壽。面對着東海的古雅小茶館，沒有CURCUMA般熱鬧，二三十個座位，除了室外的兩張木桌，全是榻榻米設計，小桌旁邊還放着體貼的旋轉蚊香，讓你欣賞稍縱即逝的夕陽時，不用分神拍蚊。   食物只有兩種　最愛餐廳第五位 「不過，這裏只有兩款食物：意大利薄餅和日式蔬果沙律。」朋友說來的缺點，倒為又懶又沒主見的我省了不少時間，而且味道一流。不過，最討人歡喜的，還是每杯飲料（只提供咖啡、煎茶和花果茶）所花的心思，陶瓷茶杯鮮花伴碟，優雅得徹底。難怪在「冲繩情報IMA網站」的最喜愛餐廳榜中排第五，山內和子和松村奈苗的生日都特地從大阪和奈良來慶祝。 花人逢  地址：冲繩本部町山里1153.2  電話：（81）98-0475537  時間：11:30am-7:00pm（夕陽西落之時），星期二、三休息 冲繩料理　價錢減半好味雙倍 「今天又到那個山頂嘆茶看海？」不，來到冲繩怎可能錯過冲繩料理！今天「Downtoearth」到豐見城市OutletMallAshibinaa吃苦瓜吃海葡萄。「都說你包拗頸！」  在香港吃冲繩菜，幾串海葡萄六七十元，苦瓜又話搭飛機，炒埋蛋成百元一碟；來到冲繩，這些都變了尋常物，隨處可見，價錢平一半，好味卻雙倍。連平時不吃苦瓜的我，都把它吃個清光，那個花生豆腐，更是我的至愛，軟滑之中帶點煙韌，有點像年糕，未放進口已聞到一陣花生香。還有不可不吃的冲繩拉麵，滑得來有點彈性，彈牙得來有點嚼口，是烏冬和拉麵的混合體，放上一串串碧綠通透的海葡萄，爽脆清香，一口咬下去，帶點海水的鹹味，像吃魚子醬，卻低脂沒膽固醇，就可以放心盡情吃啦！ 海葡萄家  地址：冲繩縣豐見城市豐崎1-188  電話：（81）98-8512715  時間：11:00am-9:00pm 酒鬼注意　Mandy'sCheckList ．酒後駕駛罰二萬 導遊田先生從不在行程中喝酒，原來怕醉酒駕駛，罰款30萬至50萬日圓！即港幣二萬至三萬三千多元，分分鐘幾個月人工，自駕遊旅客博唔過呀！ ．代客駕車　放心飲 若然你沒定力兼酒量淺，酒後還要駕車點算好？在冲繩可找代客駕車服務，他們會駕着電單車或私家車（需2人）前來，然後拖鈎在你的車輛後，再按你的指示駕駛你的車輛載你回家。每公里約$13.4，約相等於香港的士的兩倍價錢。 出門提一提 簽證：持BNO或香港特區護照均免簽證，可停留3個月。查詢：25221184（香港日本領事館）  旅行團：直航日本冲繩島首里城、海底玻璃觀光船、海洋博水族館、玉泉洞、樹包厝、OUTLET購物超值四天團JKNA04/JKNB04/JKNE04，出發日期：9月14、22日，每位$4,099起。查詢：23152000（東瀛遊）  貨幣：100日圓約兌6.72港元  電壓：100V，兩腳直插座  時差：比香港快1小時  國際電話區號：81  旅遊查詢： http://www.ocvb.or.jp/  下周冲繩雷暴，27~30℃"
