key,date,article_daily_id,title,text
20070414-122,20070414,122,任達華：我演得唔差㗎,任達華：我演得唔差㗎 任達華04年憑電影《PTU》和去年的《黑社會》兩次榮膺金紫荊影帝，在今晚舉行的金像獎頒獎禮中，他憑電影《黑社會以和為貴》獲提名最佳男配角，他坦言視電影《父子》的童星吳澋滔為最大對手。 最緊要享受 頒獎禮如箭在弦，華仔連日工作忙得透不過氣，他表示除了趕拍電影《文雀》外，日內又要到內地拍廣告，為了尊重金像獎大會，華仔答應今日中午趕回港出席盛會。  從影生涯中經歷過無數成敗得失的華仔，賽前心情十分平靜，日前他還到尖沙嘴做gym，然後抽空接受本報專訪，特意挑選在海邊拍照的他輕鬆地說：「我𠵱家心情好平靜，今日就專登嚟到海邊relax一吓，我係嚟睇海，唔係跳海，我從來對攞唔攞獎都抱平常心，因為頒獎禮年年有，只要我一日未退休，一日都會繼續拍好啲戲，況且每年評審嘅標準都唔同，得獎只當鼓勵，冇獎咪出年再努力過。我嘅心態同流水一樣，長流不息。」  華仔坦言曾見過有些演員獲獎後，未有再發憤努力，他說：「某啲人攞完個獎，反而害咗佢，變得冇晒方向。」所以他只視獲獎是錦上添花，他續說：「就算冇得獎，只要用心演好部戲，一樣會得到觀眾嘅認同。我覺得作為專業演員，好應該要有呢種進取精神，咁樣大家共同努力，香港嘅電影圈先會越做越好。」  他更形容參加金像獎就像出席一個美麗的晚會，他說：「邊個攞獎我都咁戥佢開心，最緊要嗰晚大家都好好享受。」 大讚吳澋滔 知己知彼，百戰百勝，華仔也有留意其他角逐最佳男配角的對手，尤對年僅10歲的吳澋滔印象難忘，他說：「譚家明部戲真係為Ian（吳澋滔）度身訂做，佢好聰明，演繹父子情好投入，不過我喺《黑社會以和為貴》裏面同個仔嘅對手戲，一樣演得唔差，最終要睇評審決定。」  採訪：比華利  攝影：林德雄
20070414-123,20070414,123,人物誌富家餅女性感出頭,人物誌 富家餅女性感出頭 前晚喝醉酒後被醉鬼輕薄的吳雨霏，現年20歲，畢業於香港的加拿大國際學校，父親從事製衣生意，家住比華利山。Kary15歲參加903CleanandClear活動時，被唱片公司EMI發掘，02年與8名女新人組成Cookies出道，更拍水着寫真（圖）冧fans，當時有傳她因富家女背景獲黃柏高力捧，3年間9餅女篩剩4女，樣子最不起眼的Kary也順利過關。  04年Cookies轉投金牌經理人公司，Kary另獲安排同時擔任樂隊PingPung主音，以性感Rock女形象示人，出騷例必tubetop短裙騷長腿，憑一曲《愛是最大權利》成功上位，後更推出個人大碟。感情方面，06年初傳她與陳冠希好友KevinPoon火速撻着，可惜戀情不足半年便告吹。
20070414-124,20070414,124,奧莉花拒做油脂祖母,奧莉花拒做油脂祖母 澳洲長青歌手奧莉花紐頓莊（OliviaNewton-John），闊別香港七年，今晚會在紅館舉行演唱會。奧莉花前晚抵港，昨日在中環舉行記者會，大談工作大計。  早前抗癌成功的奧莉花，現時忙於在全球巡迴演出，稍後她還會拍一齣電影，但她對詳情三緘其口。早前有指奧莉花將會夥老拍檔尊特拉華達（JohnTravolta）翻拍電影版《豪門恩怨》（Dallas），奧莉花指未有人接觸過她，至於被問到會否考慮拍《油脂》（Grease）續集，奧莉花即耍手擰頭說：「要拍的話早應在20年前拍，難道叫我與尊去飾演祖父或祖母？」  採訪：劉梓恩  攝影：陳偉權
20070414-125,20070414,125,馮仁昭四圍超：密約鬍鬚型佬　傑仔中菜好彩頭 - 馮仁昭,"馮仁昭四圍超：密約鬍鬚型佬　傑仔中菜好彩頭 - 馮仁昭 草蜢噚日去元朗幫一間服裝店剪綵，人哋剪綵舞獅諗住大鑼大鼓攞個好意頭，點知身為嘉賓嘅蔡一傑，見人哋武師咁興奮，打算沾埋人哋嘅光采，武師採青時，生菜擲中傑仔，搞到一身都係，佢同蘇志威即時執起啲生菜，傑仔仲笑逐顏開咁話：「真係好彩呀！啲菜噴埋嚟，好似執金呀，我覺得係一個好兆頭。」 隱蔽位密斟 其實傑仔呢期行好運外，人緣都當旺，喺佢身邊嘅同性好友就好似走馬燈咁不停轉。早幾日傑仔同蔡一智、蘇志威去商台出席記者會後，就撇低拍檔，一個人去咗銅鑼灣嘅燕萍越南餐廳。傑仔好似同啲店員好熟，仲同店內一名身材瘦削、着住件白色T恤嘅中年鬍鬚佬密密斟，佢哋傾咗兩句後，就行去餐廳嘅隱蔽位置坐底繼續傾，仲用屏風隔住，唔知有乜咁神秘。後嚟鬍鬚佬攞住兩杯青檸水行出餐廳招呼記者，仲話：「你哋邊間㗎？影得佢（蔡一傑）靚啲喎！」鬍鬚佬認真細心。  另外，草蜢最近推出嘅新碟，首批其中2,000隻出現技術問題，佢哋打算喺下星期四下晝六點開始，喺公司幫買咗碟嘅人換碟，阿智話：「我哋會搵柯南查件事，但呢2,000個係好運嘅人，好似中獎，到時我哋會有個回贈大派對，送草蜢精美手帶、傑仔送嚿木、阿細送佢哋出門口，禮成！」"
20070414-126,20070414,126,大劉飛身護女友,大劉飛身護女友 為「大劉」劉鑾雄誕下女兒的呂麗君（後），平時甚少露面，昨日與大劉十指緊扣在太古廣場shopping，當記者上前影相時，護女友心切的大劉說：「你哋唔好騷擾其他人。」  之後大劉便以身體遮掩女友身影，以免女友被記者追訪，真是十分體貼。
20070414-127,20070414,127,馮仁昭四圍超：趙薇、李泉拖手攞靈感 - 馮仁昭,馮仁昭四圍超：趙薇、李泉拖手攞靈感 - 馮仁昭 趙薇日前同內地音樂才子李泉（右）手拖手出席上海時裝派對，又睇KylieMinogue演唱會，因而傳出緋聞。不過，趙薇噚日委託新浪網發聲明，話李泉係佢隻專輯嘅音樂製作人，佢哋去上海係為唱片錄音，去睇演唱會都係搵靈感。趙薇話同李泉係好朋友，一直以兄妹相稱，今次傳緋聞令到雙方好尷尬喎！
20070414-128,20070414,128,Stephy爆Kary酒後亂性,Stephy爆Kary酒後亂性 鄧麗欣（Stephy）昨日到銅鑼灣與fans優先欣賞新片《十分‧愛》，Stephy透露日前做身體檢查：「好彩都係女醫生做婦科檢查，不過最唔慣係等做檢查時要男女一齊等，雖然有着袍，但始終裏面真空。」對於好友吳雨霏（Kary）因飲醉酒而被洋漢抽水，Stephy踢爆好姊妹酒量不佳，而且一飲醉會周圍錫人，不過只限女仔。
20070414-129,20070414,129,馮仁昭四圍超：霍啓山專注搞地產 - 馮仁昭,馮仁昭四圍超：霍啓山專注搞地產 - 馮仁昭 霍啓山噚日路過中環置地廣場，揸住文件、着住淺藍西裝外套嘅佢，以一貫低調嘅語氣話：「啱啱開完會。」問啓山𠵱家有冇拍拖，佢話：「冇拍拖，因為想專注事業，𠵱家幫緊屋企搞南沙嘅地產項目。」記者講笑話啓山條件咁好，可能會有女孩子主動追求，啓山又冷冷咁拋一句：「冇。」
20070414-130,20070414,130,馮仁昭四圍超：陳潔靈鱆魚慰耀榮 - 馮仁昭,馮仁昭四圍超：陳潔靈鱆魚慰耀榮 - 馮仁昭 （左起）陳潔靈、肥媽同葉麗儀噚日去港台接受訪問，陳潔靈話佢工人日前放假，冇人煮飯，所以買咗盒燒鵝飯做晚餐，點知食完就喉嚨敏感不停咳，要搵中醫做針灸。對於張耀榮近日被頒令破產一事，陳潔靈講笑話整一味鱆魚上素（上訴）畀張生食，而肥媽就話畀啲鹹竹蜂張生，等佢下一下火。
20070414-131,20070414,131,張睿家演搖滾高材生,張睿家演搖滾高材生 金馬獎最佳新演員張睿家最近接了驕陽電影公司新片《夏天的尾巴》，該片由鄭文堂執導，本月初在台南開鏡，其他演員還有日本新星藤岡靛、新生代創作歌手Enno與林涵等等，戲中張睿家飾演超級高材生，熱愛青春搖滾音樂，他對自己的角色相當滿意。
20070414-132,20070414,132,馮仁昭四圍超：關心妍得寵出新碟 - 馮仁昭,馮仁昭四圍超：關心妍得寵出新碟 - 馮仁昭 關心妍（Jade圖）早前接受商台節目錄音訪問，佢話即將去日本拍攝新碟短片，內容圍繞一個女人嘅愛情故事。阿Jade話公司都投資咗好多錢落呢隻碟度，不過就唔擔心再次傳出公司偏袒佢，而唔錫周麗淇（Niki）嘅消息。因為阿Jade知道Niki遲啲先會出碟，到時公司又會投資另一筆錢幫佢宣傳喎。
20070414-133,20070414,133,姚嘉妮憂患心臟病,姚嘉妮憂患心臟病 姚嘉妮昨日到尖沙嘴擔任美容院開幕嘉賓，她透露早前檢查到右邊心瓣比較厚，若情況嚴重會變成心臟病，她說：「醫生話有遺傳，我爺爺都係有心臟病，不過醫生話要做詳細檢查先知，我有問佢會唔會影響生BB，佢就話唔會。」
20070414-134,20070414,134,阿Sa撐Niki冇機心,阿Sa撐Niki冇機心 Twins昨日到都會商場擔任模仿新星比賽評判，對於日前有報道指周麗淇（Niki）因在公司失寵，向好友蔡卓妍（阿Sa）訴苦，希望借她的關係加入英皇，阿Sa說：「黐線㗎，Niki份人好直腸直肚，佢識朋友唔會有目的，佢都冇同我訴過苦。」
20070414-135,20070414,135,娛樂怪史：八両金哭訴老婆走佬,娛樂怪史：八両金哭訴老婆走佬 時間：98年11月21日    人物：八両金、八両菜    地點：八両金香港仔寓所    經過：貧賤夫妻百事哀，呢個世界好多人只可以共富貴，唔可以共患難，八両金老婆八両菜（何顓彤）就係其中一個例子。八両金原本家財千萬，但98年因為投資失利變成一無所有；八両菜就因為炒燶股而搞到周身債，但又唔肯同八両金一齊共患難，結果拋夫棄子，十足十粵語片劇情。  話說98年11月，八両金喺香港仔寓所攬住個仔向傳媒哭訴老婆離家出走，話如果唔係有個仔嘅話，佢一早就跳樓死算數。到咗第二日，八両金先知八両菜為咗還債偷偷地去咗日本做嘢，八両金唔單止原諒咗老婆，而且仲喺八両菜由日本返香港嗰日，帶埋個仔去機場接機，一家三口團聚，場面溫馨。  八両菜重投八両金懷抱之後，佢哋經常一家三口出現，大晒恩愛，可惜呢段歡樂溫馨嘅日子維持咗冇幾耐，八両菜始終捱唔到窮困日子，決定再次拋夫棄子，今次仲一去冇回頭。到今時今日，都係八両金獨力養大個仔咋！  本欄逢周一至周六刊出
20070414-136,20070414,136,潮上身活己嵐曲奇餅鏈墜,潮上身 活己嵐曲奇餅鏈墜 「呢個鏈墜係一個台灣歌迷送畀我嘅，我比較鍾意一啲得意飾物，特別係用食物做主題嘅。我着衫個tone有時會比較沉，要靠誇張少少嘅飾物去襯托一下，除咗呢個曲奇餅鏈墜之外，個fans仲送咗一個蛋撻鏈墜畀我。」  採訪、攝影：李珮洳、駱華齡、陳俊強、卓美娟
20070414-137,20070414,137,Emily插畫師描花冧熊黛林,Emily插畫師描花冧熊黛林 熊黛林、傅穎（Theresa）、楊愛瑾（Miki）、房祖名、王敏德及兩位愛女昨日到中環出席「EmilytheStrangeArtExhibition」活動，現場展出了13幅Emily的繪圖及油畫，Theresa刻意以Emily的齊蔭長髮示人，十足十真人版的Emily。 手繪外套 熊黛林昨日在場時被Emily的創作人RobReger及插畫師BuzzParker作弄，兩人作狀在她的玉臂上畫畫，嚇得她耍手擰頭，最後兩人就在地上畫了一朵花包圍她，令熊黛林十分高興。房祖名就獲創作人及插畫師親自在其白色外套上繪畫Emily的公仔頭，可謂獨一無二。  Theresa透露有意配合新書，推出一個類似Emily的公仔，她表示今次新書與上次的風格明顯不同，她說：「上次就講好多愛情，今次就會講吓啲新聞，好似老公殺老婆呢類新聞。」  另外，帶同兩位愛女到場的王敏德透露近日正忙於籌備他自資六位數字的新碟，碟內更會收錄他與陳慧琳和鍾鎮濤合唱的歌曲。  採訪：駱華齡  攝影：陳俊強
20070414-138,20070414,138,車載朋友　否認拍拖,車載朋友　否認拍拖 唐寧昨日應邀去到荃灣出席活動，唐寧即席示範製作陶瓷。有報道指唐寧與樂隊農夫的成員陸永駕車秘密拍拖，唐寧指對方是其異性朋友，但並非發展感情，她說：「我哋私底下係識咗好耐嘅朋友，最近我哋有合作，要傾啲嘢，嗰日我順便車埋佢。」
20070414-139,20070414,139,潮上身貝安琪擋厄運手鏈,潮上身 貝安琪擋厄運手鏈 「呢條Carat嘅土耳其石手鏈係朋友送畀我，係可以帶嚟幸運，如果我嗰排遇到啲衰嘢，條鏈就會因為幫我擋煞而爛，我之前有條戴咗兩日就爛咗，唔知係唔係嗰排太多是非，之後呢條我戴咗好耐都冇嘢。我相信呢條鏈會帶嚟好運，不過平時戴飾物唔會着重牌子，只要見到靚就會買。」  採訪、攝影：李珮洳、駱華齡、陳俊強、卓美娟
20070414-140,20070414,140,潮上身關楚耀反光潮波鞋,潮上身 關楚耀反光潮波鞋 「呢對波鞋喺美國最hit，好多唱hiphop嘅歌手都係着呢個牌子，好似JustinTimberlake咁。我之前有留意呢個牌子，但香港當時未有得賣，但最近有個朋友可以班到，我即刻第一時間買咗一對。我平時好鍾意着呢種板仔鞋，最重要係佢鞋面有3M物料，夜晚出街都唔會俾車撞，因為有反光功能，可以話係一對安全鞋，既安全又型仔。」  採訪、攝影：李珮洳、駱華齡、陳俊強、卓美娟
20070414-141,20070414,141,對付情敵　拳分高下,對付情敵　拳分高下 葉佩雯及少爺占等前晚出席「LeSportsac隨身物大搜尋」活動，他們表示得廣告商贊助一世免費用袋，惹來親朋戚友致電欲分一杯羮。葉佩雯談到與朋友去看泰拳而惹緋聞，她謂男友郭偉亮開玩笑謂要與情敵打拳分高下。
20070414-142,20070414,142,索女晒命　享受單身,索女晒命　享受單身 近日因拍電影《女人本色》而不慎拗柴的薛凱琪，前晚忍痛在中環繼續拍攝電影，吳文忻（圖）都有前來捧場打氣。問吳文忻感情生活如何時，她表示目前未有人追求，又稱自從18歲之後沒有試過沒有男友陪伴，現在正好享受單身生活的樂趣。
20070414-143,20070414,143,潮上身鄧麗欣手錶當飾物,潮上身 鄧麗欣手錶當飾物 「呢隻錶買咗幾個月，最鍾意係個錶面夠細，唔係好似戴錶，似飾物多啲。條錶帶我當佢係首飾咁戴，好易襯衫，一物二用。平時都幾鍾意買錶，總數有成20隻，不過價錢最貴都係幾千蚊，我都好恨有隻名貴手錶㗎！」  採訪、攝影：李珮洳、駱華齡、陳俊強、卓美娟
20070414-144,20070414,144,醉語小八卦Paco險失晚節,醉語小八卦 Paco險失晚節 昨日凌晨與餅女同場蒲吧的金牌經理人黃柏高（Paco），離場時竟同樣被撩，一名洋漢見Paco被記者拍照，好奇上前問他姓名，又問「Youlivehere？」帶醉的Paco居然跟對方握手並回答說：「Ilivehere。」其實他的家在羅便臣道，認真搞笑。
20070414-145,20070414,145,吳澋滔發燒堅持赴會,吳澋滔發燒堅持赴會 年僅10歲的吳澋滔去年憑電影《父子》揚威台灣金馬獎，勇奪最佳男配角，今次他再獲提名「第二十六屆香港電影金像獎」最佳男配角和最佳新演員，信心十足的他已訂做好戰衣。日前他往試身時，對一身白馬王子look非常滿意，更捨不得脫下衣服。	  近日吳澋滔摘下香港導演會推介的2006年度新演員獎，成績斐然。至於能否在金像獎中再下一城，賽前有不少圈中人看好他，就連憑電影《黑社會以和為貴》獲提名最佳男配角的張家輝也視他為勁敵。  吳澋滔去年出席台灣金馬獎時穿上黑色禮服，該禮服由司馬燕的設計師好友Joey操刀，今次她再邀Joey替兒子度身訂做新衫，經過兩星期趕工，一套白色禮服終於「出世」，膊頭和褲腳外側還釘上閃片。問澋滔可喜歡一身白馬王子look？他雀躍地說：「我好鍾意。」貪靚的他更不停在鏡前左照右照，捨不得脫下。  上周吳澋滔隨雙親到上海過復活節，回港後即發高燒，司馬燕馬上帶他往養和醫院診治，她說：「醫生驚佢甲型流感，好彩測試後冇事，只係普通感冒，佢呢幾日都向學校請病假喺屋企休息，希望可以精精神神出席金像獎。」 最開心見城城 年紀尚小的吳澋滔對獎項並不看重，賽前生活如常，仍然愛與弟弟吳景燿打機和嬉戲。不過吳澋滔讀國際學校，平時多用英文跟別人溝通，廣東話不算流利，故此他很擔心上台領獎致感謝詞時出洋相，他說：「台下面咁多觀眾，我最驚係到時自己太緊張，諗住講嘅嘢又唔記得，媽咪又唔可以喺身邊幫我，咁就真係唔知點算。不過，頒獎禮中又可以見番阿爸（指郭富城）最開心，拍完部戲後，佢好忙，我哋好少見面。」  採訪、攝影：比華利  場地提供：PURSUEFashion
20070414-146,20070414,146,寵物善終　搵定後路,寵物善終　搵定後路 王喜（中）昨日在海港城為無綫音樂台錄影節目，與Kawaii份屬老友的他得知對方自資六位數字力捧四男組合Rednoon，問他可會效法Kawaii轉做幕後？他說：「𠵱家仲有人搵我拍嘢，梗係繼續拍，但都計劃緊搞寵物善終服務。」
20070414-147,20070414,147,一周追星星,一周追星星 「Ohya打造AstroBoy潮服潮展」開幕禮暨時裝Show 出席藝人：周麗淇、AnaR.  時間：今日下午2時  地點：青衣城1樓夢幻島大堂 我和啤梨、Kenny有個夢想 出席藝人：關智斌  時間：周一下午3時  地點：黃埔新城電台 「法拉」性感戰「羅拉」 出席藝人：陳法拉  時間：周二下午2時  地點：銅鑼灣怡和街2-6號英光大廈11樓i-One網吧 周大福．莫文蔚閃耀續約啟動禮 出席藝人：莫文蔚  時間：周四晚上7時  地點：香港會議展覽中心 陳冠希揭示Levi'sCopper的傳奇 出席藝人：陳冠希、森美  時間：周五晚上8時15分  地點：7號碼頭L4
20070414-148,20070414,148,ClickClick情報科網料大募集,ClickClick情報科網料大募集 《蘋果》娛樂版設立讀者來料專欄，歡迎大家提供有關藝人的相片、video及有關藝人有趣網料。    Case1：任何關於藝人的過癮網料，如討論區有趣的娛樂圈題目，內文請附上有關題目網址    Case2：無意或刻意拍下的明星video或相片，如藝人街頭拮魚蛋、當街攬仔/攬女等    Case3：藝人入行前或後的珍貴、古怪相片    Case4：與明星的過癮合照    請附姓名、電話及電郵地址，電郵到：adent@appledaily.com  所有照片或video一經採用，酬勞由$200起  而提供網料酬勞則由$100起
20070414-149,20070414,149,不要讓我在周末死去LongVacation,不要讓我在周末死去 LongVacation 6:16:29pm　vi：我lee期在家安靜地生活 6:16:43pm　g：講得呢句？即係代表你下期會勁玩囉：P 6:16:49pm　vi：你個死婆！使唔使咁明白我呀！ 朋友與我的msn對話    十多年來，朋友一直不間斷地工作，忽然一天，他認為自己是時候休養一下，就把心一橫放下一切，好好休息一場；這一場，長達兩年。這段日子裏，他在家中mememoremore，閒時去去旅行，生活多寫意。  可惜呢，漸漸有人傳出他有心理病，在家中「抑鬱玩自閉」，出外則是「神情恍惚」；高興是因為「過度亢奮」，沒有表情時則是「神情呆滯」。  其實呢，人不是在家中就是在街上；不是高興就是沒有表情的囉。  許多人認為人若不工作，就是不正常。不工作的話，就得找點其他事來做，才叫正常人。假若這個朋友是花了兩年時間去讀書，就叫做「增值自己」，如果是花了兩年去旅行，就叫做「見識世界」，若然放假兩年是為了籌備婚禮，就叫作「找到真愛」，但若留在家中啥也不幹，則被喻為「精神有病」。  總之，許多人覺得：如果你給自己休息，但甚麼也不做，就事有蹺蹊。  休息，本來不就是甚麼也不做嗎？ 公司迫放假 三、四月是各公司結算月份，身邊不少朋友囤積了假期，被公司迫放假，頻呻不知假期幹甚麼才好。有些急急計劃外遊，沒錢的就想法子約朋友喝東西，有位朋友甚至絕望到連自己不喜歡的旅遊點也決定起行，理由是：我怕浪費了假期嘛……  我看不出「黑着臉跟姨媽去貴州」有哪一處不是浪費了假期。  放假就得排滿時間表，是我們都有一份奴性；沒有事幹，就慌惶失措。記得某次到阿姆斯特丹旅行，那是一個星期一，我參加了單車旅遊團，踏單車上北部山頭，嘩！嚇得我呢，山上湖邊滿是人，他們都在草地放狗看書，更多的在睡覺、望天、玩手指，我問今天不是工作天嗎？導遊笑說：「才管不得上班呢，天氣這樣好」那一刻，我感到我的提問是何其典型香港人。  換着是我們呢，或許都會到郊外玩玩，最主要的分別則是：  1.──不會選工作天  2.──我們會拿iPod、沙灘波、PSP、小說、啤牌、PDA、雜誌……總之「好忙咁」就最好  做甚麼都可以，就是不懂甚麼也不做；看來這種更像精神病。 返工式娛樂 更嚴重的情況是：放假期間不只誓要填滿行程表，還要用勞動式的「娛樂」來填滿自己──猜枚、劈酒（是劈而非飲）、嗌歌（是嗌而非唱）、磨通宵（是磨而非玩）……  上班已經這麼勞累了，還要再勞累一點才心息。我一直在想，這是因為：縱使下了班，人卻沒有離開工作狀態，所以硬要把自己弄得更勞累，因為心底裏的奴性並沒有離開，俗稱仍然在「做嘢mode」。上班時卑躬屈膝，下班還要罰自己灌酒，這是對自己最大的整蠱。間中抽空放肆當然無所謂，每逢周末都「返工式」地去劈酒，可免則免。倪震說他喝酒但不猜枚，因為酒屬美事，飲酒該是獎勵，不是懲罰。 燃燒自己 有位朋友真的笑死我，我問他為何頻頻劈酒，對話如下：  我：劈劈劈，到底有甚麼好劈？  他：（想了一會）我只是想燃燒自己。  我：頂你個肺，占士甸、JimMorrison、AnneSexton、KurtCobain、ChetBaker、KeithRichards那些就叫燃燒自己，他們不是藝術家就是詩人或音樂奇才，你那麼貪錢又要供樓，何來談得上「燃燒自己」呀大佬？  他：不一定要有才華才能燃燒自己哦，正如不一定要權相佑那樣靚仔才有權患抑鬱症！  我：當然不一定要靚仔才有權患抑鬱症啦，但「燃燒自己」的名銜是別人給的，不是自己說自己是的。燃燒燃燒，要有原料才有得燒，別人有才華才叫燃燒，燃燒火燄留後世，你留甚麼？留下一部滿是鹹網病毒的電腦麼？  朋友哈哈大笑，對話以他的粗言穢語作結。我想說的是，狂妄還狂妄，劈酒還劈酒，不要將之浪漫化。  曾經有一位朋友在我家等我，一等就是一個下午，我問他在我家做了甚麼，他說見陽光溫暖，就在大廳的地上享受陽光，睡了一個午睡。他人又勤奮又執着，工作時總會全心全意，休息時卻懂得真正放鬆自己，真是一介人上人。  放開一切，享受甚麼也不做的感覺，不要老是搞到自己很忙碌，才感到自己存在。至今，我仍在努力學習中，共勉之。 娛樂與快樂 曾經在《新假期》雜誌提及國內作家周國平對現代人找尋娛樂的睇法，收到不少讀者查詢，現來節錄數段：  我討厭形形色色的苦行主義。人活一世，生老病死，苦難夠多的了，我能享受時憑甚麼不享受？享受實在是人生的天經地義。蒙田甚至把善於享受人生稱作「至高至聖的美德」……  然而，怎樣才算真正享受人生呢？對此就不免見仁見智了。依我看，我們時代的迷誤之一是把消費當做享受，而其實兩者完全不是一回事。  ……例如，純粹泄慾的色情活動只是性消費……走馬看花式的遊覽景點只是旅遊消費……用電視、報刊、書籍解悶只是文化消費……  至高無尚的境界當然是「靈魂的愉悅和昇華」，辦不到的無所謂，試着搞清楚「娛樂」和「快樂」的分別就夠了。  回望那位決定在家中閒休兩年的朋友，他不只不值得到別人的負面揣測，甚至該得到別人的讚賞才對。  （作家通常都很討厭別人沒首沒尾地節錄自己的文章，我希望周國平先生不會太討厭我。讀者如喜歡的話，可找尋全文閱讀。原文為散文，題目為「消費＝享受？」）《周國平作品精選》（簡體字）出版社：長江文藝ISBN：7-5354-3005-8  撰文：卓韻芝  電郵：g@crhk.com.hk  本欄逢周六刊出
