key,date,article_daily_id,title,text
20070831-112,20070831,112,U25索女入行排晒隊娛樂風頭躉：動漫Maggie烏雞豐胸,U25索女入行排晒隊 娛樂風頭躉：動漫Maggie烏雞豐胸 今時今日要在娛樂圈成名，單靠選美、參加新秀抑或藝員訓練班已經好out，加上香港人食快餐的心態，對於青春有限的少女來說，成名就真的要趁早，要在最短時間獲得最多人注意，就必須踏上成名之「露」。以天賦的美好身段作為必殺技，不費錢、不費力，但又最具殺傷力，難怪越來越多U25一族（Under25）爭相露兩手，憑34D豐滿上圍突圍的動漫Maggie李曼筠便是最佳例子。　撰文：林妃、羅慧敏 去年動漫節，在「電車男」叢中冒出一名索女，她以性感gamegirl造型亮相，被攝影發燒友圍住狂影，她就是人稱動漫Maggie的李曼筠。擁34D超級湯碗胸的Maggie，今年繼續恃勢行「胸」，在剛過去的動漫節中輕易成為焦點，更揮低港姐徐淑敏及名模Rosemary。 「我都想有人錫」 巨胸令人羨慕又妒忌，不過對Maggie來說，究竟是優勢還是負累？Maggie日前接受本報專訪說：「呢樣嘢有好有唔好，上年因為咁好多人留意，唔好嘅係啲人只係留意呢樣嘢，我想人留意多啲我嘅表現。」口口聲聲要人留意她的表現，但Maggie還侃侃而談她的豐胸「秘訣」：「身材好係天生㗎，真係要多謝媽咪，平時又多啲飲媽咪靚湯，最鍾意係青紅蘿蔔瘦肉同烏雞湯。我都好鍾意飲全脂奶，一日飲兩杯，皮膚都白啲滑啲。」  年多前與男友分手的Maggie，揚言已準備好迎接新戀情，簡直是fans的天大喜訊，她說：「之前戀愛大過天，但經歷幾段失敗戀情，覺得所有嘢唔一定跟住自己行。𠵱家如果遇到一個有上進心、可以畀到空間大家而又有感覺嘅人，我都想有人錫㗎。」 明年出碟圓歌星夢 Maggie有份主演的《地獄第19層》本月上映，她又即將接拍青春校園片，她說：「我想拍一部講愛情嘅電影，因為可以喺拍攝過程中感受舒服同甜蜜感覺。另外都想演精神有問題嘅人，因為好多朋友話我有妄想症。」  Maggie續說：「呢排好鍾意睇余文樂嘅武打戲，覺得好好睇，當然想同佢合作，但係就好似襯唔起佢囉。」Maggie也正為歌唱事業鋪路，希望明年可推出唱片，一圓歌星夢。  攝影：林德雄  泳衣提供：Rush  髮型：BrianChiu＠HAiR  化妝：KhakiYan＠MAEVON 江若琳　20歲 三圍：32B、23、33 美貌：★★★★  身材：★★  人氣：★★★★  觀眾緣：★★★★    在這色慾娛圈，清純玉女路線猶如死路一條，江若琳偏要走入死胡同。04年她參加劇集《伙頭智多星》女主角招募而認識寰宇老闆娘林小明太太，獲對方賞識簽約寰宇。入行後，江若琳猶如紙板人角色，直至在廣告擘大眼說：「我日日都食明眼素㗎！」才開始得到人注意。心知不能一世靠食明眼素，江若琳豁出去推出三點式寫真，其人氣終如火箭般上升。 Chrissie周秀娜　22歲 三圍：32C、23、33 美貌：★★★★  身材：★★★★半  人氣：★★★  觀眾緣：★★★半    能從緋聞男女方力申和鍾欣桐成功搶走注意力的，除了鄧麗欣外，還有周秀娜。電影《出水芙蓉》開鏡當日，穿比堅尼、擁魔鬼身材的Chrissie一躍入池，即時驚艷全場。Chrissie04年參加漫畫節舉辦的「香港電玩展GameGirl大賽」，其後擔任模特兒，早前為旅遊雜誌拍攝的噴血三點式照，成為不少網友的珍藏。Chrissie肯捱肯露，全為了頭家，原來魔鬼也不壞！ MandyLieu　22歲 三圍：32A、23、34 美貌：★★★★半  身材：★★★  人氣：★★★半  觀眾緣：★★★半    新紮模特兒MandyLieu是馬來西亞及美國混血兒，03年隻身來港發展模特兒事業，不久便被周星馳看中，獲邀拍攝生力啤廣告，因而有「啤妹」之稱。最近她高調與台灣男星陳柏霖拍拖，又被拍得在淺水灣嬉水照片，結果帶旺人氣，工作接踵而來，連亞視也邀請她拍攝遊戲節目。 陳瑀涵　23歲 三圍：36D、24、35 美貌：★★半  身材：★★★★★  人氣：★★★★  觀眾緣：★★★    寶島女星陳瑀涵去年過江參選亞洲小姐，樣子平凡的她落選是意料中事，唯一令人難以置信的，卻是她曲折離奇的成胸之路。陳瑀涵的上圍由04年的32A變成今日的36D，加上雙峯堅挺得如岩石，「岩石胸」之名當之無愧。陳瑀涵深知驕人身材是搵食工具，近日叠埋心水以性感形象進軍樂壇。據聞馬偉豪有意找陳瑀涵演出《新紮師妹4》，若然成事，單看她穿緊身制服捉賊的狼狽相，已值回票價。 Freeze 由整容三嬌組成的樂隊Freeze，打正性感旗號登場，但「Freeze」的由來，究竟是希望觀眾目光「freeze」在三人身上，還是令觀眾對整容感到心寒的「freeze」？    Allen陳樂榣　23歲（左）  三圍：34C、24、34  美貌：★★  身材：★★★半  人氣：★半  觀眾緣：★★    自我增值有好多方法，陳樂榣卻選擇整容，她還得到家人支持。早前她便到韓國接受整容手術，修葺鼻子、眼睛和磨平牙齒。    Carisa甄穎珊　25歲（中）  三圍：33C、23、34  美貌：★★半  身材：★★★★  人氣：★★★半  觀眾緣：★★    甄穎珊去年挾着「黃宗澤舊愛」之名參選亞洲小姐得個桔，今年年初去韓國整容大修葺，順便改改運勢。    Sukie石詠莉　20歲（右）  三圍：33C、24、35  美貌：★★★半  身材：★★★★  人氣：★★★  觀眾緣：★★★    04年勇奪數碼情報CoverGirl冠軍出道、曾擔任catwalk模特兒的石詠莉，算得上是索女一名，可惜自成為整容三嬌的骨幹後，相信未來日子都要拋胸露面。 導演評分：江若琳最掂 影壇新人輩出，要爭取演出機會，非要具備樣貌和實力。01年在紐約國際獨立電影展，憑執導的電影《女人那話兒》奪得最佳導演獎的本港女導演黃真真，環顧幾位U25少艾，她看好江若琳可塑性較大，並說：「我覺得江若琳個樣好sweet，性格又開朗，如果佢嘅演技不停改進，喺呢行發展係好有潛質，有機會我都會考慮同佢合作。」  黃真真又大讚MandyLieu笑容甜美，不過由於雜誌大多報道她熱戀的新聞，所以擔心對方沉迷拍拖，難於投入工作。至於「人工美女」Freeze，黃真真認為最不幸是外間只留意她們的身材，角色有局限。  樂於起用新人的導演馬偉豪則說：「其實呢幾個新人都各有潛質，不過暫時嚟睇，我覺得江若琳人氣多啲，佢標咗出嚟先，佢表現淡定又大方得體，有機會開戲，寰宇老闆林小明放人，我都一定會考慮搵佢。我睇咗《男兒本色》，作為新人，江若琳嘅表現算唔錯。」  採訪：比華利 娛樂資料庫：索女也有過氣時 雷凱欣（Vonnie）  24歲  三圍：35F、23、33  代表作：電影《瘦身》及《新禁室培慾之愛的俘虜》  雷凱欣99年參加YMC台VJ選舉出道，其後以3G之名推出唱片《我要造勢》，不過大家似乎只對其35F上圍有興趣。 黃榕（Gloria）　26歲　三圍：34B、22、32  代表作：擔任成人網站WebJ、高潮樂隊女主音  原本擔任模特兒的黃榕，00年跑去做成人網站WebJ，受盡網友指指點點，不過Gloria終被雜誌發掘，拍攝一系列性感水着照，漸漸為人所熟識。去年加入林祥焜率領的高潮樂隊當女主音，每逢出騷例必以超性感造型示人，令大批港男垂涎欲滴。 姚樂怡（Sherming）　28歲  三圍：34C、24、35　代表作：擔任電波少女  大家近年在黨螢光幕見到姚樂怡，只以為她是三線姐仔，那就大錯特錯。其實98年她擔任電波少女時，其34C驕人上圍絕對是註冊商標。成名後的姚樂怡沒有因此而收斂，每每在鏡頭前賣弄風情，在水着界甚吃香。 張碧珊（Tiffany）  26歲  三圍：33D、22、34  代表作：擔任雜誌封面女郎  2001年，香港零售業不景，當年只有20歲的Tiffany，為了餬口，毅然穿性感bratop在百利時裝店看舖吸引顧客，能否增加生意不得而知，但她卻被雜誌記者發現，並擔任封面女郎。
20070831-113,20070831,113,馮仁昭四圍超：基仔累林夕焦慮症復發 - 馮仁昭,馮仁昭四圍超：基仔累林夕焦慮症復發 - 馮仁昭 古巨基（右）前晚喺中環舉行新碟交流會，監製雷頌德（左）同填詞人林夕（中）都有出席。林夕話幫基仔做呢張碟，壓力大到焦慮症翻發要食番藥，佢做事從未諗過放棄，但今次真係想退出，但基仔同雷頌德都唔畀，佢寫完最後一首歌後，病情先好轉，不過前晚見佢仲有少少手震。基仔同歌迷交流時講咗好多關於歌曲嘅感人故事，大家都聽到眼濕濕，好感動。
20070831-114,20070831,114,馮仁昭四圍超：Freeze販賣人工性感 - 馮仁昭,馮仁昭四圍超：Freeze販賣人工性感 - 馮仁昭 整容三嬌Freeze近日獲得廣告商青睞，成為纖體產品代言人，日前佢哋拍攝平面廣告，性感打扮極之噴血，成員（左起）甄穎珊、石詠莉同陳樂榣先後以三點式同埋金色bratop襯熱褲影相，大晒人工美好身形。不過有趣嘅係之前品牌曾經請傳整容嘅容祖兒拍廣告，𠵱家就到整容三嬌接棒，真係巧合啦。
20070831-115,20070831,115,力洗車震污名馮仁昭四圍超：朱慧敏救事業任施暴 - 馮仁昭,力洗車震污名 馮仁昭四圍超：朱慧敏救事業任施暴 - 馮仁昭 朱慧敏自從同梁榮忠嘅車震事件告一段落後，發展明顯比梁榮忠好，佢前晚同鍾嘉欣、馬浚偉及李天翔喺中環為無綫新劇《金石良緣》開工。 鍾嘉欣跨欄跌倒 劇情講述不務正業嘅李天翔原本對鍾嘉欣不懷好意，最後卻轉移目標，喺酒吧遇上因心情唔好而買醉嘅朱慧敏，李天翔色心起，將飲醉酒嘅朱慧敏帶到公園施暴。鍾嘉欣同馬浚偉獲悉趕去救佢，拍攝期間鍾嘉欣跨欄時唔小心跌倒，好彩冇大礙。  為咗拍攝呢場戲，朱慧敏瞓身演出，李天翔唔單止騎喺佢身上，仲借位錫佢面珠。着住吊帶上衣嘅朱慧敏冒住唔連戲嘅危險，都要勁打底防走光，佢話：「我着多咗件黑色tubetop防走光，希望觀眾睇嘅時候唔會留意到穿崩問題。」朱慧敏話現實中就算好失意都唔會買醉，佢話：「我只會做運動。」  馬浚偉表示《金》劇兩位演員譚小環同曹永廉分別喺今年拉埋天窗，不過佢話：「我要搵多啲錢先結婚。」鍾嘉欣就希望可以喺30歲前嫁得出，佢話：「因為我好鍾意小朋友。」
20070831-116,20070831,116,馮仁昭四圍超：祖兒追軒仔交新歌 - 馮仁昭,馮仁昭四圍超：祖兒追軒仔交新歌 - 馮仁昭 容祖兒（中）、張敬軒（右）同側田（左）噚日喺港台出席「全球華語歌曲排行榜頒獎禮記招」，呢個頒獎禮今年會喺香港搞，港台話頒獎嘉賓暫定譚詠麟、田亮，聯絡緊嘅就有林憶蓮、李司棋同關菊英等。祖兒一見到軒仔就追歌，祖兒講笑話：「我就嚟要淋佢油，年頭等到𠵱家都未有，就係爭佢隻歌，搞到我出唔到碟。」
20070831-117,20070831,117,馮仁昭四圍超：吳宗憲指警鎖定疑兇 - 馮仁昭,馮仁昭四圍超：吳宗憲指警鎖定疑兇 - 馮仁昭 台灣綜藝主持吳宗憲嘅豪宅日前懷疑俾人槍擊，佢噚日喺台灣錄影台視節目《齊天大勝》後講番件事，佢話當日錄影完節目返屋企，聽到兩下巨響，花園嘅燈忽然暗咗，佢話：「的確有被空氣槍之類的東西打破電燈，當天我是沒有怕啦，也沒跟人結仇，從前在秀（騷）場，就曾被人用槍指頭，這點小事沒好怕的。」吳宗憲話因為媽咪擔心先報案，佢仲話警方已經鎖定特定人士。
20070831-118,20070831,118,馮仁昭四圍超：亞視10月改台徽 - 馮仁昭,馮仁昭四圍超：亞視10月改台徽 - 馮仁昭 朱慧珊（圖）噚日出席亞視記者會，對於亞視10月初會有變動，佢認為係好事，佢話：「我主持嘅節目都會有改變，但我都繼續喺度。」另外，有傳營運總裁何定鈞上場後，向營業部四名舊臣子開刀，佢話：「公司有近千人，有員工進進出出係正常，其實新聞部同工程部都好多人進出。外面人才缺乏，我哋想換血都唔得。」亞視10月18日將推出好多新節目，同時亦會改台徽。
20070831-119,20070831,119,馮仁昭四圍超：克勤掛靴齋練唔出戰 - 馮仁昭,馮仁昭四圍超：克勤掛靴齋練唔出戰 - 馮仁昭 李克勤噚日帶領劉浩龍、林海峰同鄭丹瑞（阿旦）等去到順利邨足球場，同由聽眾組成的足球隊對戰，比賽以3比3打成平手，最後互射12碼，歌星隊以總比數6比4勝出，阿旦仲被選為最佳球員。克勤話覺得年紀大容易受傷，正考慮掛靴，日後佢只會參與練波，正式比賽就唔會落場。另外劉浩龍日前慶祝好友謝霆鋒生日，佢話見到張栢芝已經收身，可以即時出嚟拍廣告。
20070831-120,20070831,120,馮仁昭四圍超：森美一提囝囝即口窒 - 馮仁昭,馮仁昭四圍超：森美一提囝囝即口窒 - 馮仁昭 森美擔任OK連鎖便利店首位代言人，噚日佢同600名員工喺理工大學出席誓師大會。森美話好開心見到印有自己個樣嘅宣傳海報周圍貼，馮仁昭問佢驚唔驚囝囝見到啲海報，會自然反應嗌爸爸？點知森美竟然口窒窒唔識答。對於網友彈佢演嘅《森之愛情》悶兼扮靚仔，佢話：「第一集個故事係簡單啲，至於話劇情似韓片，度嗰陣都唔知，好多嘢都係導演話事。」
20070831-121,20070831,121,馮仁昭四圍超：狄龍奪金紫荊成就獎 - 馮仁昭,馮仁昭四圍超：狄龍奪金紫荊成就獎 - 馮仁昭 近日經常俾人話電影提名名單唔公平嘅金紫荊電影頒獎禮，噚日喺尖沙嘴舉行記者會，宣佈今年嘅卓越成就獎會頒畀狄龍。對於狄龍獲獎相信外界都冇乜異議，而佢太太陶敏明亦同一班朋友到場支持，狄龍話對於獲獎驚喜之餘仲好安慰，佢話：「證明我喺呢行冇浪費時間，好多謝太太做我義務嘅經理人跟出跟入。」另外，大會主席透露網上嘅最佳男、女主角投票，暫時由劉德華同蔡卓妍領先。
20070831-122,20070831,122,第64屆威尼斯影展之一鳴驚人湯唯男人婆變騷姑娘,第64屆威尼斯影展之一鳴驚人 湯唯男人婆變騷姑娘 湯唯在李安電影《色，戒》中大膽全裸色誘梁朝偉，令對方險入萬劫不復之地，不過這位戲中尤物曾幾何時是男人婆一名。04年，湯唯以25歲之齡參加選美比賽，不過有指她太像男孩步操而只得第五名。其後湯唯擔任遊戲代言人，造型詼諧，難以想像她能成為《色，戒》女主角。據知湯唯接拍《色，戒》後，即接受李安禮儀特訓，最終令人刮目相看，李安應記一功。  現年27歲的湯唯在杭州出生，自小受濃厚藝術氣息薰陶，父親湯余銘是畫家，母親施西鳳則是舞台劇演員。湯唯念高中時已擔任模特兒，其後考上中央戲劇學院導演系，畢業後曾參演《后海前街》及《女人不哭》等劇集，更憑《警花燕子》獲得第六屆電視電影百花獎優秀女演員獎。撰文：林妃 2004年 自信爆棚　選美飲恨 當年25歲的湯唯參戰環球小姐北京賽區只得第五名，據悉其母施西鳳不滿賽果，找主辦單位理論，得出答案是湯唯女人味不夠。 2005年 俏麗警花　首獲大獎 在中央戲劇學院導演系畢業的湯唯，前年參演張菁執導的電視電影《警花燕子》，更於去年奪得中國電視電影百花獎優秀女演員。 2005年 戚眼戚鼻　欠女人味 湯唯擔任網絡遊戲《破天一劍》代言人，在宣傳活動上大擺美少女甫士，美感欠奉之餘，更「娘」得惹人發笑。 2005年 打扮中性　陽氣旺盛 湯唯在舞台劇《切．格瓦拉》中飾演正面女一號，打扮中性，導演指她走路時虎虎生威，比較男孩子氣。 2007年 地獄特訓　索爆回歸 湯唯在《色，戒》中飾演愛國學生王佳芝，舉手投足都散發成熟女人味，絕對是接受李安地獄式訓練的成果。 話你知：刺殺漢奸　真人真事 李安的《色，戒》改編自張愛玲的同名短篇小說，該小說於1950年完成初稿，1977年交給雜誌發表，至1983年收入《惘然記》內。《色，戒》講述抗日戰爭時期，大學生王佳芝（湯唯飾）潛入上海，欲暗殺漢奸汪精衛的手下易先生（梁朝偉飾）。過程中，王佳芝用美人計色誘對方，但竟不知不覺間愛上易先生。到暗殺時機成熟的一刻，王佳芝暗地裏協助易先生脫險。然而，張愛玲這短篇小說，靈感其實來自1937年的一宗真實案件——西伯利亞槍擊案。 埋伏皮草店 當年鄭蘋如是蔣介石旗下的女特務，她隱瞞身份，色誘汪精衛手下丁默村，並引對方到西伯利亞皮草店，好讓埋伏的槍手行刺，誰知最後一刻竟被丁默村發現並及時逃脫，鄭蘋如也因此被關押，最終遭到殺害，死時才23歲。抗戰勝利後，丁默村被南京國民政府逮捕，在軍事法庭上被控以漢奸罪遭槍斃，而鄭蘋如則被國民黨政府追封為烈士。  有指張愛玲從她的愛人、汪精衛的文膽胡蘭成那裏聽到這個故事，多年後便寫成這部短篇小說，也有指張愛玲這篇小說中明顯帶有她個人經歷的痕迹，比如張愛玲對易先生的描寫，便令人聯想到她與胡蘭成的一段情。撰文：李全  
20070831-123,20070831,123,朱家欣忍痛別亡弟,朱家欣忍痛別亡弟 朱家鼎的喪禮昨日低調進行，只有數十名至親到火葬場，除紅姑好友周潤發夫婦和谷薇麗等外，還有朱家鼎廣告界友好、著名設計師陳幼堅等等。至於朱家鼎兄長朱家欣及其太太陳依齡，昨日上午一早到香港殯儀館打點，朱家欣痛失胞弟心情悲痛，未有停下來接受記者訪問。 韓國影迷送花圈 儘管紅姑一早告知親友不要致送花圈，但昨日上午仍有紅姑的韓國影迷會等把花圈送到靈堂，殯儀館職員一概拒收，花店職員惟有把花圈放置馬路一旁。
20070831-124,20070831,124,馮仁昭四圍超：蒙嘉慧同Jacky仔好番 - 馮仁昭,馮仁昭四圍超：蒙嘉慧同Jacky仔好番 - 馮仁昭 蒙嘉慧（YoYo）同歐陽震華等《爸爸閉翳》嘅演員，噚日去到將軍澳出席「爸爸閉翳之巴巴閉團圓一家親活動」，早前有報道話由於YoYo唔肯生小朋友，所以令到男友鄭伊健家人好不滿，YoYo話冇睇過呢篇報道，暫時會以工作為先，唔考慮生BB。另外早前有指YoYo拍劇期間虐待拍檔童星Jacky仔，不過喺活動上YoYo同Jacky仔互餵月餅，佢強調唔會再為呢件事回應。
20070831-125,20070831,125,馮仁昭四圍超：洪天明讚徐子淇收身弗 - 馮仁昭,馮仁昭四圍超：洪天明讚徐子淇收身弗 - 馮仁昭 徐子淇坐完月即刻出動，相約朋友中環嘆茶，仲俾人影到佢火速收身成功，減去接近50磅。噚日子淇舊愛洪天明喺無綫錄影遊戲節目，同樣成功減磅嘅天明話：「佢（子淇）一定好多纖體贊助喇，不過佢都係一個好積極嘅人，𠵱家唔同以前，好多媽咪一生完就即刻瘦身，仲弗過以前。」
20070831-126,20070831,126,今日我生日,今日我生日 李美鳳　44歲 87年參選香港小姐競選獲得亞軍，其後加入娛樂圈拍攝多部電影包括《精裝追女仔2》及《偷情先生》等。
20070831-127,20070831,127,馮仁昭四圍超：鄭中基賭廳獻唱失色 - 馮仁昭,馮仁昭四圍超：鄭中基賭廳獻唱失色 - 馮仁昭 鄭中基前晚喺澳門威尼斯人度假村酒店表演，留鬚渣嘅佢着咗件黑色閃片豪華運動裝，喺一個坐滿近百名賭客嘅賭廳內獻唱，台下有人邊聽歌邊賭錢，亦有人聞聲而至捧場，但因為音響效果麻麻同埋現場太嘈，有賭客大叫：「唔夠大聲呀！」鄭中基聽到後即刻講笑話：「咁我細聲啲囉。」但佢呢個gag實在好爛，所以觀眾冇反應。
20070831-128,20070831,128,上海直擊Karen柱女舞動上海灘,上海直擊 Karen柱女舞動上海灘 莫文蔚（Karen）上周三在上海馬戲城附近進行拍攝工作，在酷熱天氣下，她先後換上四個造型，並在攝影師前擺出不同姿勢，當中最誘人的是Karen穿上紫色連身裙，攬着燈柱跳鋼管舞，由於她要不停轉圈，工作人員特別在地上鋪上床褥，以策安全。不過Karen擺動身體時，被大風吹起裙襬，露出打底褲，可算失策。 腳部感到痛楚 其後Karen伸開雙手做出凌空跳起的動作，經過一輪蹦蹦跳後，她的腳部感到少許痛楚，工作人員即時替她檢查，並在右腳尾趾貼上有圖案的膠布。為了令Karen的腳部得到紓緩，工作人員特別讓她在休息時換回平底鞋，出鏡時才穿上高踭鞋。  由於Karen需要以比較厚的背心裙上陣，弄得香汗淋漓，不過她仍能保持笑容，不用埋位時，更不顧儀態地拉開領口散熱，又伸手入衫內抹掉胸前的汗水，引人遐想。  採訪、攝影：盧健
20070831-129,20070831,129,馮仁昭四圍超：阿姐11月榮升汪博士 - 馮仁昭,馮仁昭四圍超：阿姐11月榮升汪博士 - 馮仁昭 汪明荃將獲香港城市大學頒授榮譽文學博士學位，以表揚佢對社會同教育嘅貢獻，頒授儀式會喺11月舉行。阿姐今年入行40周年，又開演唱會，又獲頒博士學位，真係三喜臨門，佢噚日接受商台訪問，問係咪要稱呼佢做汪博士，阿姐話：「過咗11月先啦，其實有冇殊榮我都係咁做嘢，學位係對我工作嘅肯定，都係鼓勵其他人。」
20070831-130,20070831,130,最愛肥尊　一部不漏,最愛肥尊　一部不漏 湯盈盈（中）及王賢誌前晚到太古城出席電影《戀愛大爆發》的首映禮，她透露自己十分喜歡尊特拉華達（JohnTravolta），對方的電影全都有欣賞。而昨日一早湯盈盈亦與陳法拉及黃宗澤到新西蘭擔任華裔小姐選舉的嘉賓。另一方面，王賢誌將會為有線主持節目，被問到早前跟陳志雲飯聚一事時，他揚言只是閒聊，並沒有談及公事，而對方也沒有邀他回巢。
20070831-131,20070831,131,今日我生日,今日我生日 張豐毅　51歲 內地知名實力派演員，作品包括《駱駝祥子》，最近也在吳宇森執導的《赤壁》飾演曹操一角。
20070831-132,20070831,132,拉姑包起Eason個唱徐濠縈三級制對付撲飛潮,拉姑包起Eason個唱 徐濠縈三級制對付撲飛潮 徐濠縈、黃偉文、楊采妮、周汶錡和張玉珊等，前晚出席名牌YvesSaintLaurent在灣仔舉行的07秋冬時裝騷。談到陳奕迅（Eason）10月舉行的演唱會掀起撲飛潮，不僅Eason要迴避想買飛的朋友，連Eason嫂徐濠縈一樣叫苦連天。 按輩份親疏處理 徐濠縈說：「日日都十個八個order，十年冇見嘅朋友都打嚟，其實真係唔關我事，啲飛係陳家瑛處理。我直情要避電話，但又有SMS同email，好誇張！連奶奶都無端端打嚟，話要十張飛，咁佢梗係最緊要啦。」  徐濠縈很高興老公個唱反應熱烈，對於撲飛要求，現時就要按輩份親疏分三級處理，她說：「奶奶、媽咪同拉姑（狄波拉）咪係最top優先處理，拉姑好支持，每場都要一行飛，尾場仲話要留四行呀！其次咪係日日見嘅朋友囉。」她謂連囡囡同學的家長、老師，甚至學校校長都要求訂票，她笑言為囡囡前途着想，要優先處理校長的訂票。  此外，日前有台灣婦女打胎盤針時染瘋牛症，搞美容的張玉珊說：「打呢類嘢，要認清來源，始終有不法商人，聽聞瑞士打就好安全。」  採訪：林妙萍  攝影：葉君海
20070831-133,20070831,133,亂摘野菌　中毒驚魂,亂摘野菌　中毒驚魂 江若琳早前到雲南拍攝旅遊特輯，並探訪當地少數民族，其間她在路邊採摘漂亮的松茸，工作人員即恐嚇她越鮮艷的菌類就越有毒，要趕快到醫院治理，後來她才知道被整蠱，不禁嘻哈大笑。江若琳還上山學採茶，不過她原來不知道會有高山症等問題，得悉後即笑說：「好彩得我支牙膏患高山症，我一打開蓋就噴晒出嚟，因為有高氣壓呀。」
20070831-134,20070831,134,苦戀惡女　全情投入,苦戀惡女　全情投入 梁漢文早前邀請同門女新人唐素琪擔任新歌《自作多情》MV女主角，兩人早在電視節目《美女廚房》中已認識，所以見面份外親切。唐素琪外表清純，今次要飾演一個玩弄梁漢文的壞女人，至於梁漢文則要做一個深受傷害也繼續付出感情的男人，他獨坐化妝間培養情緒，不消一會就全情投入，拍攝得非常順利。
