key,date,article_daily_id,title,text
20070831-0,20070831,0,有線新聞3女主播遭性騷擾,有線新聞 3女主播遭性騷擾 【本報訊】繼無綫電視前新聞女主播趙海珠遭投資失利的股民以刀片信恐嚇後，致力將新聞主播明星化的有線電視，爆出多名女主播被性騷擾事件。據悉，該台三名貌美女主播，在過去一年半內持續收到懷疑是同一名男子的電話性騷擾及發出內容猥褻的短訊，涉案男子清楚知道她們的行蹤及近況，令她們擔心個人安危，先後兩次報警求助；又曾向有線電視高層反映，但未獲積極回應。　記者：謝明明、蔡元貴 據了解，該名男子初時只以沒有來電顯示的電話號碼致電該三名女主播的私人手提電話，詢問女事主性生活及要求見面做愛，內容極度猥褻。 稱做愛後便不騷擾 近期該男子變本加厲，以有來電顯示號碼的手機多次致電及發短訊予女事主，開出條件指只要女事主肯答應在電話中做愛一次，以後便不再騷擾她們。三名女主播曾嘗試根據有關電話號碼企圖追查該男子身份，但電話長期關機，懷疑是由不用登記的電話卡打出。  其中受滋擾的女主播Ａ曾嘗試更換手提電話號碼，但數日後，該名男子已得悉新號碼，再次致電性騷擾她，更在電話中透露，知道事主最新的個人身體狀況，令事主非常擔心個人安全。  另一位女主播Ｂ，其男友是另一間電視台記者，每當其男友被調派往外地採訪，女主播B接獲的電話性騷擾次數便會頻密起來，顯示涉案男子非常留意及得悉女事主男友的工作安排，令女主播B每逢上班和歸家，特別是深宵時分，都擔心被人跟蹤，感到十分徬徨。 懷疑涉案人是同事 消息人士指出，根據上述種種情況，被滋擾的三名女主播深信涉案男子是有線電視員工，他們曾分別向上級、有線電視總新聞報道員張宏艷，以及有線電視執行董事趙應春反映事件，但各人被指無認真處理及採取實際行動。  本報昨曾嘗試聯絡受滋擾的三名女主播，但未獲回應。消息人士透露，自事件曝光後，有線電視已着該三名女主播「封口」。「其實騷擾未停過，喺過去一個星期都仲有，最初佢哋都驚慌，但𠵱家已經唔係太驚。」  趙應春回應本報查詢時承認，曾接獲有關報告，他着她們刪除有關猥褻的電話內容，若擔心個人安全受威脅，建議她們報警求助。據趙了解，其中一名女主播早於一年多前已報警，警方現正調查事件。趙應春又指自己也曾受過電話滋擾，「我都間唔中試過（遭電話滋擾），其實我哋啲同事久唔久都會接到呢啲電話滋擾，例如想約會佢哋咁！」  提及該公司如何防止員工聯絡電話等個人資料外洩，趙應春指，所有員工的聯絡電話載於內聯網供員工查閱，「同事間需要合作，必須用電話聯絡，加上我哋新聞從業員工作需要，冇可能唔畀手提電話等資料畀人。」張宏艷接受查詢時，着記者向有線電視外事部查詢，她不作評論。 警暫列電話滋擾案 警方發言人證實，分別接獲兩宗有關電話滋擾個案，其中一宗於去年2月1日接獲，經調查後，因無法找到確實證據，警方已終止調查。另一宗於今年8月21日接獲，現由將軍澳警署雜項調查隊接手調查，暫列電話滋擾案處理。  平等機會委員會發言人表示，暫未接獲上述性騷擾投訴，不便評論事件。根據《性別歧視條例》規定，言語上或身體上涉及性的行徑，帶有冒犯性，例如透過電話或傳短訊講述一些猥褻的內容，已構成性騷擾，事主可循民事索償。平機會建議機構制訂預防性騷擾政策，以及設立投訴機制，以便跟進處理。 中外女主播遭狂迷滋擾事件 08/2007  男股民疑買入前新聞之花趙海珠推介的窩輪而損手，涉嫌向無綫電視新聞部寄出兩封附有膠刀叉及金屬餐刀的恐嚇信    12/2006  台灣東森電視台女主播吳宇舒連續兩個月，收到自稱是「國防部副部長二級上將」的中年男子的追求信    10/2005  一名狂迷假扮記者，闖入日本富士電視台錄影室，高呼自己是女主播內田恭子的未婚夫    07/2005    台灣TVBS新聞女主播吳安琪遭署名「阿賢」的粉絲，在網頁中留言恐嚇    02/2005  台灣一名工程師經常到公司門口等候年代電視台主播李文儀下班，有時更送卡片、花、蛋糕至她家    2005  有狂迷連續一星期在無綫電視城門外，等候時為無綫新聞主播的趙海珠放工，有一次更尾隨她上的士，幸被保安人員制止    資料來源：《蘋果》資料室
20070831-1,20070831,1,港客拉角子機$5贏4000萬星際稱機械故障拒賠,"港客拉角子機$5贏4000萬 星際稱機械故障拒賠 【本報訊】「4,000萬！4,000萬呀！」港人田小姐昨晚與友人到澳門星際娛樂場玩樂，她剛坐到角子老虎機前，投入5元硬幣，按掣……突然間，機頂的紅燈閃個沒停，機上獎金銀碼顯示出「40,000,000」。田小姐心中一算：「嘩，係4,000萬呀！」不過，她開心得太早了，星際職員未幾走過來說：「對唔住，係機械故障。」更拒絕派彩。　記者：馮少榮　林榮海 田小姐無法接受中4,000萬元空寶的說法，當職員說要開機檢查時，她恐一切證據會消失，與友人把守老虎機前，直至今日凌晨事件仍未解決。  賭場一名經理昨晚對本報記者說：「呢部機最多派彩額先至係5萬蚊，冇可能會派4,000萬，全世界冇一部機會派咁多錢。派4,000萬，你信唔信？」該經理又說，田女士說中獎之時，「個game（遊戲）都未開始，何來中獎？」他指估計有人是把壞機的「警號」，當成是中獎的「恭賀響號」，才無法接受壞機的「事實」。 「機頂紅燈係咁閃」 田小姐表示，她與兩男一女友人於昨日中午前已到了澳門，主要目的是到剛開幕的威尼斯人度假村參觀，至晚上7時30分才轉到星際玩樂。進入賭場後，田走到一部編號343、名為「深海寶藏」的角子老虎機前坐下。  「我入咗個5蚊銀，跟住㩒掣，突然間機頂嘅紅燈就係咁閃。」她說，當時見到機上的派彩銀碼，展示出「40,000,000」的字樣。「我好肯定係4,000萬，因為我數過，係『一個4加7個0』。」田又說：「當時我好興奮，根本記唔起個畫面show咗啲乜嘢出嚟，好似係啤牌嘅『同花順』。」  田小姐指，當時一名女職員走近，田向對方說：「我中獎喎！」但對方只說：「你等一等，可能係部機有問題，等我check一check。」田即回應說：「壞咗？冇理由喎！」 賭場關機銀碼消失 其後賭場多名經理陸續到來，要求開機檢驗是否故障，但田小姐與友人堅拒，「開機咪乜嘢證據都冇晒？」田與友人守護着老虎機，而賭場方面則將機關上，有關銀碼亦消失。雙方之後不斷爭論，田感無助下致電報警。  當時賭場方面向田小姐表明，不讓他們開機的話，無助解決問題，並向田說：「你鍾意可以繼續喺度玩，我哋好歡迎！」田之後要求有司警到場作證人才可開機，司警其後派員到場，但至今日凌晨雙方仍在討論如何解決。  一名經理說，翻看過閉路電視錄影帶，證實田小姐確曾坐在涉事角子老虎機前及入過錢。他強調：「如果係人為出錯嘅話，我哋一定會負責，但機件故障就唔會。」他又說，事後會向澳門博彩監察協調局呈交報告。他補充說：「角子老虎機壞機，並唔係咁罕見嘅事！」 「你話壞就唔賠？」 「我覺得自己中咗獎，你話壞就唔賠？我點都要有一個滿意嘅解釋，就算係壞機，都有責任賠償畀我！」田小姐說。  澳門星際娛樂場位於澳門市中心友誼大馬路，樓高38層，屬於銀河娛樂集團，集團主席為呂志和。酒店去年10月開業，當時請來著名影星梁朝偉作主禮嘉賓，成為城中話題，其附屬賭場平均每日人流達2萬人次以上，共提供290張賭枱，300部角子機，酒店則有500間房間。"
20070831-2,20070831,2,特稿彭家尋目擊證人助索償,"特稿 彭家尋目擊證人助索償 彭東尼撞車，腦部受創，曾昏迷個多月，蘇醒後恍如植物人，幸其同居女友不離不棄，照顧起居飲食，雖康復緩慢，也漸露曙光，但鬆弛肌肉的針藥，每支5,500元，令他難以負擔，彭家已決心向食環署索償，「佢哋無即時報警，令東尼延誤救治，我哋希望意外目擊者挺身而出，令索償可以順利啲。」 女友：我撐得好辛苦 現年38歲的彭東尼，現於黃大仙一所療養院留醫，彭的女友葉小姐，與彭同居十多年，為了多儲點錢，一直拖延婚事，昨日她與彭的兄長，帶彭到眼科醫院治療眼瘡。  就本報記者所見，彭東尼的左手已恢復活動能力，及常人一半，可用匙羮進食，但其右手僵硬，形同痙攣，頭側向一邊，不能步行，出入均要坐輪椅。  葉對本報說，「東尼一、兩個月前開始識得講單字，認得人，智商正常，但思想混亂，記憶一直衰退，好快唔記得。」  葉曾任職售貨員，意外發生後，為彭四處奔波，找議員求助，向申訴專員遞交請願信，投訴食環署疏忽，又要每日照顧彭的起居，餵彭進食、抹身、按摩肌肉及清理大小二便，惟有放棄工作，全職照顧彭，她捱得住頻撲的日子，但每次想到彭病情反覆，又申訴無門，便悲從中來，「我一個人撐得好辛苦，唔知可以撐到幾時」，說時潸然淚下。 鬆弛肌肉每針5500元 現時彭的住院費，因有醫護社工幫忙故獲豁免，但若要額外藥物，譬如打針鬆弛肌肉，便要5,500元一針，只能望門興嘆。  彭東尼胞兄昨得悉判決後，即時聯絡一直協助彭家的議員王國興，籌備申請法援向食環署索償，他斥責食環署遇事後不顧而去，令東尼延誤救治，並呼籲意外目擊者挺身而出，幫助彭家索償。本報記者"
20070831-3,20070831,3,現場經歷「技工驗完機　巨額銀碼即消失」,"現場經歷 「技工驗完機　巨額銀碼即消失」 4,000萬橫財變空寶，田小姐由「幸運兒」變「不幸兒」，但她沒有咬牙切齒，只表現沮喪。年約30歲的田小姐說話帶點鄉音，堅持不透露任何包括職業等個人背景，亦不願以真面目示人。她說，自己雖然曾經到過賭場，但從沒玩過角子老虎機，只懂「入錢㩒掣」，連如何中獎都不清楚。  她說，前晚入賭場後便獨自玩角子老虎機，先入了50元現金（5元一鋪，可玩10鋪），按第一下掣便「中獎」，機頂的綠燈狂閃，畫面轉藍，打出一些英文字句及在印象中出現「42,900,000」的銀碼，之後一名女職員上前，還向她道賀：「恭喜晒，你中咗巨獎！」當時有2名保安及3名賭客在附近，目擊這「中獎一刻」，其後越來越多人走近圍觀。  未幾，另一名經理級女職員走近，說「唔可能中到幾千萬（獎金）」，指可能機件有問題。此時田的友人已趕來，據友人說，畫面上的英文字句大意為：「中獎，但金額超出上限，請與職員聯絡。」其後賭場很多「高層」趕來，說要開機檢驗，田小姐同意，但技工開機後，畫面則變了樣，英文字句顯示變為：「Machinedisabled----callattendent,largeaccumulatedcreditlimitexceeded.（機器故障—請找職員，積分超出上限）」但巨額銀碼已消失。在場有人此時偷偷以手機拍下屏幕畫面。 「唔走開就抬走你哋」 田說，當時見開機後畫面資料有變，即問對方：「可唔可以還原?」但對方說不可能，田遂拒絕對方再檢驗，與友人守在機前。田小姐說，當時有外籍賭場高層揚言：「唔走開就抬走你哋。」約10分鐘後，駐場司警及博監局稽查到來了解，說要看閉路電視錄影帶，田的友人要求同往，但被拒絕。  之後有賭場職員向田小姐說，看過錄影帶後，確認涉事角子機曾閃燈，不過對方指無法確定屏幕上是否曾出現任何銀碼。  事件擾攘至昨日凌晨，田小姐一方最終同意對方再開機檢驗，當時有職員指，角子機內對每一鋪遊戲都有紀錄，但技術人員從機內取出資料翻看時，卻說：「冇你玩嗰鋪嘅紀錄喎!」又指田小姐是由入錢一刻機器已發生故障，說：「遊戲都未開始，你點會中獎?」  本報記者"
20070831-4,20070831,4,話你知連線角子機多寶獎金巨,"話你知 連線角子機多寶獎金巨 現時澳門各賭場共有逾8,000部角子機，統計指角子老虎機中多寶獎（jackpot）機會是750萬分之一。角子機分連線機和獨立機，連線機是將同一集團的賭場全部同款角子機的派彩金額相連起來，各部連線機的機頂屏幕，會根據各部角子機玩家投注的累積金額，不斷更新彩金的總和，03年7月便有一名韓國遊客在葡京賭場贏得千多萬元連線大獎。相反，獨立機就只是一部機的投注累積彩金，大獎金額亦相對少，一般最高彩金只有幾萬元。 角子機中彩爭拗外國個案 日期：02/2007  事件：一名女士在美國Biloxi的IP賭場玩角子老虎機，中了780萬港元獎金，賭場指老虎機設定錯誤，最後博彩委員會判賭客勝訴    日期：09/2006  事件：美國加州一名男子在桌山賭場玩角子老虎機，中了575萬港元累積獎金，但賭場指老虎機故障，雙方將事件交上法庭    日期：08/2006  事件：一名男子在荷李活HardRockHotel&Casino玩角子老虎機時，中獎200萬港元，賭場起初以機械故障為由拒絕派彩，但最後仍向該男子發出200萬支票    資料來源：《蘋果》資料室 網友有嘢講：「有故障都係賭場責任」 「嘩！咁都唔賠仲成世界，開得賭場就預咗人哋贏錢，人哋又冇出老千……就算有故障都係賭場責任，不能輸打贏要。」  hongkee（蘋果講場）    「個game未開始係乜意思，入咗錢，按埋掣，但係就未開始，乜嘢game嚟？」  有趣（高登討論區）    「我就覺得壞機係你賭場自己問題，你開大道門做生意，明知部機壞都唔整……如果啲人玩完部壞機輸咗錢，你估佢會唔會回水呢﹖」  angelxo（uwants討論區）"
20070831-5,20070831,5,食環署執意向女小販索償,食環署執意向女小販索償 【本報訊】食環署事隔3年後秋後算賬，向被指弄傷兩名員工的女小販黃燕芳婆婆追討11萬賠償，被議員炮轟「小器」、「大蝦細」，但食環署一意孤行，昨午與黃婆婆會面時重申無意撤回追討行動。黃婆婆坦言感失望，說：「佢哋隻手遮天，我就爛命一條，由得佢哋告囉！」 署方稱醫生簽122日病假 陪同黃婆婆與食環署助理署長張英才等高官會面的立法會議員梁耀忠說，會建議黃婆婆申領法援與政府打官司。他認為高官們只懂卸膊，「係咁推嚟推去」。梁引述署方解釋，指3年後才索償，是因為年初才收到判傷報告；至於被質疑在小衝突中，受傷職員何以放了122日病假，署方只說是經過政府醫生簽發病假紙。梁說：「佢哋話係跟政府政策，部門唔能夠決定放棄追討，否則可能會畀審計署批評！」 事發後未被起訴襲擊罪 對於食環署冥頑不靈不肯讓步，黃婆婆說：「個（受傷）職員放足122日病假，我點都唔信！」她表示自己根本無積蓄，「預咗破產，仲有第二條路行咩?」  曾當小販的黃婆婆於04年在葵涌遇食環署掃蕩，她堅稱仍未開檔拒絕被帶走，與食環署職員發生衝突，她稍後被控無牌販賣及阻礙公職人員執行職務罪成，但無被起訴襲擊罪，至本月初接獲食環署追數信件，要求她就兩名職員受傷賠償11萬元。
20070831-6,20070831,6,詹培忠:應賠5%保聲譽,"詹培忠:應賠5%保聲譽 【本報訊】「今次中空寶事件，最大贏家就係賭場本身啦、哈哈！」有40年賭博經驗、自稱「資深博彩人」的立法會議員詹培忠（圖）笑言因為經博彩監管局仲裁證實老虎機故障，不需賠償彩金，同時各大媒體追訪更令賭場名字日日見報「好過賣廣告」。不過詹培忠指，事件確因老虎機失靈而起，他建議賭場按出事老虎機最高派彩額的5%賠給賭客，既可令賭客好下台，又為賭場贏來聲譽，一舉兩得。 議員:仲有幾多部壞機 澳門立法會議員吳國昌則指，這次中空寶事件值得反思，「究竟賭場仲有幾多部壞機呢？賭場容忍壞機收賭注又有冇責任呢？」他指出，賭客進入賭場博彩，只會關心投注是否中獎，但若下注後，博彩機顯示中獎，但賭場又突然指機件失靈不會賠償，這種情況其實十分兒戲，更會降低賭場的公信力及破壞形象。  他認為事件值得澳門各賭場引以為鑑，例如增加巡查老虎機運作是否正常，避免出現同類事故！ 必須出現jackpot圖案 澳門幸運博彩業職工會理事長鄭康樂則說，角子老虎機等博彩機的中獎定義「必須係老虎機出現中jackpot圖案，否則就算機身電腦屏幕顯示中獎字句或打出彩金額，亦唔算數，冇得派彩！」他指事件可能因老虎機電腦軟件故障，賭場需要將軟件交博彩監察協調局調查仲裁，賭場亦會翻查閉路電視錄影帶了解事發情況。他續稱，澳門博彩條例規定，中獎必賠，雖然現時賭場不會照賠4,000萬彩金，但最低限度應償還賭客所下注金額。  記者昨天聯絡澳門博彩娛樂有限公司，以及金沙、永利、威尼斯人等賭場，但均無對事件作出回應。"
20070831-7,20070831,7,索K商人生幻覺拜亡母後跳樓死,索K商人生幻覺 拜亡母後跳樓死 【本報訊】一名中港貿易商人，疑長期「索K」產生幻覺，昨晨往拜祭已故母親後，聲稱遭亡母喚他到附近屯門醫院職員宿舍，走上16樓企圖跳樓自殺。事主與6名警方談判專家對峙逾6小時，仍拒絕接受勸說，當他喝過生命中最後一杯水，將佛珠交給救援人員後，口中喃喃念着佛經，在眾人面前躍下，跌在救生氣墊外地上喪命。 交佛珠口念經後躍下 跳樓身亡的男子潘展文（47歲），從事中港貿易生意，他獨居元朗朗屏邨。據熟悉死者的友人表示，事主有吸食「K仔」習慣，疑因長期吸食導致經常產生幻覺。  昨晨7時半，事主穿紅色T恤及戴深色鴨舌帽，到屯門青松觀拜祭已故母親後，聲稱受亡母使喚，走上毗鄰屯門醫院職員宿舍A座16樓爬出簷篷危站，清潔女工見狀通知院方報案。  消防員到場在地下張開救生氣墊戒備，並召來4男2女的警方談判專家到場展開游說，先後給他遞上香煙、三文治及清水，惟事主拒絕敞開心扉，多次緊握雙拳作勢欲跳，均及時被喝止：「阿潘，你仲有老竇要養，唔死得㗎！」  其間，潘的兩男一女家人聞訊趕至勸說，豈料雙方吵至面紅耳熱，卒被中止對話。至下午2時半，事主將3串泰國佛珠交給談判專家，一邊默念佛經，喃喃自語：「我做過好多壞事，罪孽太深，又俾好多女人呃過！」  不久，救援人員以為能將事主勸服之際，他卻沿着石簷向右走，遠離救生氣墊範圍後躍下，結果跌落氣墊4米外地上，頭爆肢折斃命。
20070831-8,20070831,8,惡鼠噬初生嬰3趾獨睡BB床　母回家餵奶始發現,惡鼠噬初生嬰3趾 獨睡BB床　母回家餵奶始發現 【本報訊】鼠患嚴重的沙田紅梅谷村，昨日發生老鼠咬傷嬰兒事件。一名雙程證母親抱起年僅24日大的兒子餵奶時，赫然發現他左腳其中三隻腳趾流血，被單沾滿血迹大為吃驚，懷疑兒子遭鼠咬傷報警及將兒子送院治療。食環署人員事後在村內放置鼠餌及鼠籠捉鼠。　記者：陳天華、宋光明、文兆麟 現場為紅梅谷村一間用木及鋅鐵蓋搭而成村屋，面積約150平方呎，上址戶主姓朱，與內地25歲姓趙妻子和年齡分別3歲女兒及24日大兒子同住。  朱姓戶主表示，該村鼠患嚴重，黃昏後經常有老鼠出沒，但未有向有關方面投訴，「隔籬屋近日裝修，或者咁樣將啲老鼠趕過嚟」，他懷疑兒子被咬與此有關。他又說曾見幾隻老鼠爭吃放在屋外雪櫃頂的香蕉，「啲老鼠咁犀利，唔知點算好！」 「老鼠大到似貓仔」 朱妻表示，昨晨9時許，失業丈夫出外找尋工作，她帶女兒返幼稚園學前熟習環境，由於未足月幼子不宜吹風，故將他放在BB床睡覺。個多小時後，她與女兒返家未幾，抱起兒子餵奶時，發現被單染有血迹，細看發現他左腳拇趾、中趾及第四隻腳趾流血及有數個被小動物咬的血洞，懷疑他遭老鼠咬傷，大驚下致電丈夫及報警。救護員到場為男嬰包紮傷口，並將他送院。  至下午4時，10名食環署防止蟲鼠組人員到場調查，並在村內放置捕鼠籠及老鼠米捕捉老鼠，以及張貼有關告示。在該村住了20年的林先生稱，「啲老鼠大到似貓仔，成兩三斤重，經常入廚房偷油食，較早前先捉到兩隻。」又有村民因此在家中飼養多隻貓捉老鼠。 食環署派員滅鼠 食物環境衞生署發言人表示，過去三個月，該署未有接獲紅梅谷村有鼠患投訴。事後已派員在現場山邊放置鼠藥及鼠籠滅鼠，並提醒居民保持環境衞生。  對於紅梅谷村鼠患嚴重，沙田區議會衞生及環境委員會副主席黃澤標議員表示關注，「以前未有人投訴過（紅梅谷村）有鼠患，但會關注事件，不能掉以輕心」，區議會會要求食物環境衞生署跟進事件。他又呼籲市民一旦發現鼠患嚴重，最佳方法是至電食物環境衞生署（熱線：28680000），找蟲鼠組人員到場滅鼠。 老鼠咬傷男嬰示意圖 專家之言：清水火酒清潔傷口 對於沙田紅梅谷村有嬰兒在床上被老鼠咬傷，傳染病專科醫生勞永樂稱，「𠵱家香港鼠疫好少，但有可能感染鼠咬熱、漢他病、鈎端螺旋體病或者傷寒。」鼠咬熱一般潛伏期約三星期，早期發現注射抗生素可治癒，但嚴重會令患者淋巴腺腫大及發燒，病毒入血則可致命。 及早向醫生求助 他建議，市民若被老鼠咬傷，應以清水及火酒清潔和包紮傷口，然後向醫生求助。  有兒科專科醫生表示，「老鼠唔會主動襲擊人，可能BB身上染有奶迹，吸引老鼠爬上床搵嘢食咬傷佢（男嬰）。」  由於老鼠帶有很多細菌，除了要注射破傷風針及預防狂犬病針，被鼠咬也可能會感染大腸熱影響肝臟，因而患上壞血病。  今年初，美國密蘇里州一名四周大、在嬰兒床上睡了的女嬰，慘遭闖入屋的老鼠咬傷鼻和嘴唇，雙親事後發現急將女嬰送院。去年10月，台北一名11個月大男嬰，在梳化上熟睡時，遭老鼠咬傷腳趾至見骨。  本報記者
