key,date,article_daily_id,title,text
20070721-0,20070721,0,收家長70萬　賣小一學位拔萃女教師被捕,收家長70萬　賣小一學位 拔萃女教師被捕 【本報訊】名校學位有價，不少家長千方百計爭取子女入讀心儀學校，有人更不惜鋌而走險。曾被喻為九龍塘三大著名小學之一的拔萃小學，該校一名有份參與小一收生程序的女教師，涉嫌收受三名家長合共70萬元賄款，聲稱可以協助他們的子女入讀該校，其中一名家長竟付58萬元以「購買」學位。涉案教師在收款時，被埋伏的廉政公署人員拘捕，人贓並獲。記者：謝明明、倪清江、馮永堅 根據《防止賄賂條例》，行賄與受賄同屬有罪，最高可判入獄10年及罰款100萬元。據了解，案中涉嫌行賄的家長，也可能會被廉署檢控；事件中有關學生，校方仍未決定是否批准入學。  據了解，涉案女教師年約30多歲，今年有份參與拔萃小學的收生程序工作，但並無審批權。消息指，該女教師早前涉嫌向一名家長索取3萬元賄款，聲稱該筆款項有助其女兒申請入讀該校。有關家長於本月18日支付3萬元予該教師，但該教師竟貪得無厭，涉嫌再向該名家長索取7萬元，惹起對方不滿，憤然向拔萃小學投訴，揭發事件。該校立即向廉署舉報，並由廉署執行處Ｂ組接手調查。 一人付58萬買學位 消息指，當涉案女教師於前日在九龍塘又一城名牌食店CovaRistorante&Caffe內，涉嫌準備收取這名家長7萬元「餌錢」之際，早已在食肆內埋伏的廉署人員隨即一擁而上，拘捕這名女教師。  廉署調查發現，被捕的女教師涉嫌曾向另外三名家長索取利益，以協助他們的子女入讀該校，當中兩名家長涉嫌分別給予這名教師2萬元及58萬元「買學位」，其餘一名家長則沒有「上當」。  消息指，廉署不排除有人以捐款名義要求家長「捐出」大筆款項；至於案中涉嫌提供賄款的家長，恐也會被廉署邀請協助調查，甚至可能被檢控。據悉，校方至今未決定是否批准涉案家長的子女入讀該校。  根據《防止賄賂條例》，行賄與受賄者即使目的未達，仍屬有罪，一經被判罪名成立，最高入獄10年及罰款100萬元。 僅四學位可供叩門 廉署提醒家長，在替子女報讀心儀學校時必須提高警覺，若遇上有人索取利益，以協助入讀有關學校，應即時向廉署舉報。  本報昨嘗試向拔萃小學校監盧端岳查詢，但至截稿前仍未獲回覆。教育局稱，事件仍在調查，不便評論。  消息指，九龍塘區內不少名校都有人「走後門」，「幫啲家長嘅仔女入讀名校」，今次只是冰山一角。立法會議員單仲偕的兩名兒子都畢業於拔萃小學，他昨日形容事件匪夷所思。但有該校家長稱，曾有傳聞指不少家長都藉捐款予教會，爭取子女入讀該校。  現時有三所小學有拔萃二字，英中拔萃男書院所開設的附屬小學，一般稱為「新小拔」，以便區分又稱為「舊小拔」的拔萃小學；而私校拔萃女小學則簡稱為「女小拔」。  舊小拔原只收男生，採用英語教學，原屬簡稱「大拔」的英中拔萃男書院的直屬小學，每年供家長在小一統一派位放榜後叩門的學額，僅約四個。自拔萃男書院在04年於校內開辦附屬小學後，05年即與拔萃小學正式解除直屬關係，該校學生不能再直升拔萃男書院，令這所創立於1950年的名小學，受家長歡迎程度下降，該校於05年開始兼收女生。 近年該校是非不絕 據悉，當年大拔原計劃將拔萃小學併入校園內，學界傳聞拔萃小學所屬的辦學教會因不想交回該校用地予政府，因而拒絕，結果被大拔摒棄，之後拔萃小學不時有教師離職，影響教學質素。近年該校是非不絕，前校長陳景行被指英語欠佳，多名教師以辭職迫令校董會把他解僱。  對於今次事件，本身是小學教師的popoyusir在本報網站的「蘋果教員室」討論區批評：「真過份……有家長竟信佢仲過份，這是甚麼社會？」網友狗皇帝說：「做教師做成咁，點身教呀？」 拔萃小學女教師涉嫌收賄示意圖
20070721-1,20070721,1,青梅竹馬　相戀10多年生變扼死女友男跳樓亡,青梅竹馬　相戀10多年生變 扼死女友男跳樓亡 【本報訊】一對青梅竹馬相戀10多年情侶，女方每星期都會到男家過夜一次，奈何時間沖淡了感情，女友終另覓新歡並向男友提出分手，可是她又藕斷絲連，繼續與男友維持半同居生活，結果惹來殺身之禍。女事主前晚到男友粉嶺家中度宿時再次提出分手，男友在情傷下無法自控，趁女友熟睡時將她活活扼斃，並寫下遺書伴屍7小時，最後跳樓自殺身亡，留下了一闋令人感慨的愛情悲歌。　記者：吳國威、吳嘉文、周鴻熙 男死者張伯煌（32歲），女死者潘小鳳（31歲），據說兩人是中學同學，未滿20歲便開始拍拖，有10多年感情；女方家住上水，男方則與父母和一姊一妹同住粉嶺嘉福邨福泰樓21樓一個500餘呎的單位。張為裝修木工，潘女則是地盤文員，兩人既是兩小無猜的戀人，背景亦十分相近，可說是一對非常匹配的情侶。  事實上，男女事主多年來已過着半同居生活，潘女每星期都會到男家過夜一次，甚至有街坊傳聞潘女曾經懷孕及墮胎。可是，兩人感情在四個月前突然起了變化，潘女向男友表示她認識了新男友，要求分手，當時張極力挽救這段感情，曾表示要註冊結婚給她名份，惟潘女事後沒有再提此事，但兩人的感情關係卻出現了裂縫，之後更不時發生爭吵。不過，潘女仍和以往一樣，依然每星期都到男友家中度宿。  警方昨日在兇案單位撿獲男死者留下的遺書，從內容和調查所得資料，勾畫出是次悲劇的大概經過──前晚，潘女到男友家中吃晚飯，之後如常留宿，其間，潘女再次向男友提出分手，並表現得十分堅決，兩人發生激烈爭吵，至深夜，潘女懷疑曾經飲紅酒和服藥，之後上床就寢。至昨日凌晨3時過後，張趁女友熟睡，突然用雙手扼住女友頸項，不消一會兒，潘女便氣絕死亡。  之後，張一直坐在床邊伴着女友的屍體，其間，他拿出記事簿寫下殺死女友的原因和經過，字裏行間表示很愛女友，又希望女友家人可以原諒他。其後他將遺書丟在地上，然後取出𠝹刀割頸和割雙腕企圖自殺，但不斷流血並不足以令他死亡，就這樣，時間到了清晨6時。 母曾查問子支吾應對 張的65歲父親和60歲母親，起床準備外出晨運，當時，張母發覺兒子房間有異聲，曾拍門查詢，當時張支支吾吾瞞過母親，張母不以為意便和張父一同外出，張一對姊妹其後亦離家上班去，剩下張和女友的屍體在家中。  至10時許，張母買餸回家如常在廚房煮菜，張父則繼續在屋邨內的公園散步；另一邊廂，張在10時半決定尋死，他在房間內拆開窗花，跨出窗門一躍跳下，當場倒卧地上，頭爆肢折慘死，街坊發覺立即報警。  警方到場調查期間，張父見所住大廈有人跳樓，於是好奇走近圍觀；他見警員對着樓上自己的住所指指點點，心感不妙，便向警員表示自己就住在該單位，警員即時安排他認屍，豈料一看之下，竟然是自己的兒子，張父晴天霹靂，十分激動，隨即癱軟的跪在兒子屍體面前，哭得死去活來。 警破門赫見床上女屍 警員其後到張家調查，在破門進入男死者房間時，赫然發現潘女死在床上，地上有死者張伯煌留下的遺書，枱上有一支差不多飲完的紅酒，床上有兩排藥丸。警方調查後相信是一宗謀殺及自殺案，事後將兩具屍體移送殮房，等候進一步驗屍確定死因。  另外，據街坊透露，男死者與父親感情很好，去年9月8日，父子一同上陣與街坊打麻雀，其間姓黃街坊輸了200多元給張子，於是給他300元找續，但張被指找續太慢，雙方發生爭吵，父子更聯手與對方大打出手，最後鬧上警署。街坊指死者性格剛烈暴躁，他更曾在04及06年因為濫藥要接受社署跟進輔導。 男子殺女友後跳樓示意圖
20070721-2,20070721,2,迂迴入場　書迷怨走1500米,"迂迴入場　書迷怨走1500米 【本報訊】昨晚的夜市為今年書展掀起高潮，人氣超旺，不少參展商都大做生意，惟一些處於位置較偏遠的場館卻未能從中受惠，迂迴曲折的路線更令市民要長征1,500米才能到達場館，引起怨聲載道，部份參展商聯袂向貿易發展局投訴。  今年書展分有5個場館，會場規定市民必先進入1號或5號館，方能再進入其他展覽館，其餘場館2號及7號分佈較散落，其間市民需要走過彎彎曲曲的路才抵達。 部份展館人流疏落 2號館內的「一代匯集」受到路線不方便的阻隔，生意大跌。負責人譚先生指強制性路線令消費者失去選擇，有顧客向他反映，從地鐵站步行至2號館足足花了兩小時。這條路線令2號館大部份參展商的生意額下降，嚴重的更下跌五成。其中一間「紫羅蘭書局」的總經理王敏聯同十多個2號館內的參展商負責人向貿發局投訴，迫使貿發局決定多開兩個入口，以及在新聞中心附近多開一條行人電梯直上2號館，以增人流，但成效仍在觀察中。  路線安排亦令不少市民白走寃枉路。杜先生指該路線過於曲折，兜兜轉轉又指示不清，「我行咗1500米先入到1號館呀！」"
20070721-3,20070721,3,店員自稱太子爺　澳門豪賭欠貴利大耳窿放紅油田雞追債,店員自稱太子爺　澳門豪賭欠貴利 大耳窿放紅油田雞追債 【本報訊】夥計欠債，累及老闆。旺角先達廣場一間手機店職員，日前在澳門豪賭大敗，欠下50萬元貴利，他向大耳窿自稱是4間手機店的太子爺。大耳窿向手機店追債不遂後，昨日派人將兩個盛着紅油和活田雞的手挽袋，擲入手機店。一時間紅田雞在店內亂跳，情況混亂。警方現正聯絡欠債人，追緝擲紅田雞刑毀歹徒歸案。  現場為旺角先達廣場面向通菜街的兩間相連手機店，兩店是同一東主所有。東主姓鍾，他在先達廣場共擁有4間手機店。據鍾先生稱，去年10月他僱用21歲姓黃職員，至本周二（17日），黃放工後往澳門賭場，至翌日早上11時，被兩名大耳窿押回手機店。兩人向鍾指，黃欠他們50萬元債，要鍾代他償還。鍾一口拒絕，並即時將黃解僱。  鍾表示，黃在周四（19日）與父親再到手機店，並與鍾老闆傾談了一會。當時兩名大耳窿在門外等候，之後黃父子離去。鍾事後才知道，原來黃向大耳窿聲稱，其父是先達廣場4間手機店股東。因此大耳窿一直向鍾追債，並不停致電滋擾，鍾於是在門外貼上已解僱黃的告示。但大耳窿仍不罷休，並將黃欠債50萬元單據影印本放在店內。 閉路電視錄下經過 至昨日下午1時半，當時兩間地舖分別有一名女職員在看舖，其中一舖另有一名女顧客在選購手機。其間，女職員已見到兩名分別身穿紅色和黑白色上衫的青年，在店外徘徊了一段時間，兩人突然走向兩店門前，當時他們各手持一個紙皮手挽袋擲入兩店內，然後即轉身逃去。手挽袋打翻地上，裏面的紅油四濺，袋內突然跳出多隻紅色的小動物，細看下才發覺是染滿紅色漆油的田雞。各人大驚奪門逃出，致電通知東主報警。  警方到場調查並在場撿走了7、8隻染紅了的田雞，事後查看店內的閉路電視錄影帶，發現攝錄到刑毀經過，但只能看到兇徒的手部。警方調查相信事件與大耳窿追數有關。 擲染紅油田雞入舖事件示意圖
20070721-4,20070721,4,書展夜市越夜越墟冚人龍排至會展外　書迷明顯較成熟,書展夜市越夜越墟冚 人龍排至會展外　書迷明顯較成熟 【本報訊】書展越夜越瘋狂，一連兩天的夜書市昨晚展開，今日更遇上書展首個周末，將把書展推上最高潮。上班族昨晚趁書展延長開放至午夜12時，紛紛湧到尋找精神食糧，人龍晚上一直排至會展對面的中環廣場，輪候逾半小時才能入場。書商都增加書量及人手應付，並料今日更墟冚。書迷掃書除緊記書展攻略，也可參考書商提供的10大暢銷書榜。　記者：翁煜雄、黃嘉寶、蔡朗清 華燈初上，灣仔街頭昨晚人頭湧湧，不少下班白領都是朝書展位於會展會場方向走去，陳小姐坦言因昨晚會延長開放至午夜12時，「就算放工先嚟，都可以行耐啲嘛。」博益出版出版人蘇惠良也說，今年門票由20元加至25元，相反早場減至10元，上班族都認為門票差距大，「咁貴行得一陣間，唔抵」，都寧願於夜書市才入場。  人龍越夜越長，場內書迷明顯較早上時段的成熟，尤其晚飯過後，扶老攜幼的家庭讀者更少。 書商增書量加人手 商務印書館董事助理總經理梁榮錝說，因已預料夜書市會吸引不少讀者，故已增加書量，並多聘人手維持秩序，也防發生偷書情況，「上年開到凌晨兩點都試過啦，今年應該冇問題嘅。」九巴及新巴昨今晚上10時至凌晨1時30分，提供巴士接載市民由會展新翼往觀塘及美孚，有需要市民可留意。  梁榮錝說，今年生意額料增逾一成，其中《東京夢清明上河圖．珍藏套裝》更賣逾500本，而教導如何讀外國名牌、食物的《我敢讀英語話題詞》也極暢銷。股票市場大熱，投資書也成為書展贏家，天地圖書批發部主任李服南說，林森池的《平民資本家》於數日前推出後坊間已賣斷市，「得書展仲有得賣！」他說不但本地股民，連內地股民也聞風趕來掃書。 亦舒張小嫻銷量勁 愛情小說永遠暢銷，書展則由兩代愛情小說皇后亦舒及張小嫻，分別憑新作《有時他們回家》及《你總有愛我的一天》兩分天下，李服南笑說：「唔到你唔服，亦舒乜宣傳都唔使，年年咁好賣！」他說現時作家都愛辦簽名會吸引讀者，但亦舒只於十多年前辦過一次，「我仲記得只係得45分鐘。」其他大熱書籍包括每日賣過千本藝人傅穎的《我和陽光在一起》、話題作《小狗懶擦鞋》及斌仔的《我要安樂死》等。  10元早場票需臨場購買，但今年售票處設於舊翼會議廳，需繞過重重鐵馬，再跑上最高層的五號館，才可折返低層、最大型的一號館，故若希望一馬當先的，只好先在附近7-11或OK便利店購正價票。  大部份參展商都提供八折至八五折優惠，部份更推出10元特價書，書迷最好自備環保袋，而不少參展商也推出多款環保袋等，免費派發。 書展10大暢銷書 傅穎《我和陽光在一起》　博益（54元）    商務《我敢讀英語話題詞》附光碟　商務（57.6元）    杭侃、宋峰《東京夢清明上河圖．珍藏套裝》　商務（98.6元）    彭志銘《小狗懶擦鞋》　次文化堂（38元）    《Alice'sAdventuresinWonderland》　壹葉堂（172元）    資料來源：相關出版社 第18屆香港書展 日期及時間  21日：上午10:00至午夜12:00（夜書市）	22及23日：上午10:00至晚上10:00  24日：上午10:00至下午5:00    地點：香港會議展覽中心    票價  上午進場票（下午1:00前進場）10元（只於會展現場發售）  其他時段成人票25元；小童票10元（3歲或以下及65歲或以上人士免費）    夜書巿交通：晚上10:00至凌晨1:30，九巴及新巴提供巴士由會展新翼博覽道入口往觀塘及美孚，收費14.1元    查詢  電話：1830670；網址： http://www.hkbookfair.com/chi     資料來源：貿發局
20070721-5,20070721,5,10歲童遭藤打　報警拘父,10歲童遭藤打　報警拘父 【本報訊】老竇打仔招惹官非。一名10歲男童，疑頑皮被老父用藤條教訓後，心有不甘報警求助，警員接報到場，將涉嫌襲擊引致他人受傷的父親拘捕，男童則送院檢驗。  報警男童姓林（10歲），與67歲父親、母親及兩名兄姐，同住觀塘油塘邨華塘樓一單位，其父已退休。家人稱林童為孻仔，所以甚得愛護，但林常恃寵生驕，非常百厭，又喜「駁嘴」。 「佢知道打999」 家人表示，父親對他的成長十分着緊，由於他頑皮好動，父親不時被激至大怒，向他責罵甚至「藤條炆豬肉」，每次被打他都有向母親及兄姐投訴，今次打999報警，其姐也覺驚奇，她說，「佢睇電視知道求救要打999，但估唔到第一次打呢個電話，就報警拉老竇。」  昨午1時許，兩父子在家中，懷疑男童「唔聽話紮紮跳」，其父發脾氣向他指摘，但他當父親的訓話為「耳邊風」，其父於是拿起藤條向他鞭打及用手搣面，懷疑他心有不甘，其後趁父親不察，打電話向警方報案。警方接報到場，林父始知兒子將事鬧大，警員將父子帶返觀塘警署，由於林童身上有藤條痕，警方將他送院檢查，林父則涉嫌襲擊他人造成身體受傷被捕，稍後將准以保釋候查。
20070721-6,20070721,6,兩拖板插10電掣釀火警母罵子：話咗你啦　燒到乜都冇,兩拖板插10電掣釀火警 母罵子：話咗你啦　燒到乜都冇 【本報訊】「話咗你㗎啦…咁多電線插咁多電掣，𠵱家燒到乜都冇喇!」鰂魚涌海光街一名男子罔顧家居安全，在狹小的房間內放滿電腦和電器，插滿兩排拖板近10個掣，昨晨房間懷疑電線短路起火，數十人匆匆疏散，幸無人受傷，但一家貓失蹤。家人眼見住所焚毀，痛罵他屢勸不改鑄成大錯。　記者：周志鴻、胡恩宏 現場是海光街多寶樓二樓一個單位。女戶主姓葉，69歲；丈夫已過世，她與次子志邦（約40歲）同住，另外一子一女已婚遷出。單位約700平方呎間有4個房間，母子各佔一個，另外兩個房分租予兩名單身漢。 數十住客逃命 昨晨8時40分，葉老太在兒子外出後10分鐘，發現他的房間冒煙及有燒焦味，於是叫醒陳姓租客代為查看。由於房門鎖上，陳要用工具撬開，但撲面湧出黑煙及火舌，慌忙帶同葉老太離開，並拍門叫喚鄰居逃生。  消防員接報到場開喉將火救熄，房間付諸一炬，單位亦嚴重熏黑。其間數十名住客疏散，部份人扶老攜幼，部份人帶同飼養的小寵物離開，幸無人受傷。消防員在大廈4樓梯間，尋獲葉老太飼養的小貓「黑仔」，牠渾身濕透顫抖，但另一隻叫「阿黃」的小貓則不知所終。  消防員初步調查懷疑是電線短路所致，事主辯稱他不肯定離去時是否有弄熄煙蒂，似認為是煙蒂肇禍。葉老太見家園幾乎盡毀，既苦惱又氣結，大罵次子志邦：「話咗你㗎啦，電線一抽二抽，咁多電線插咁多電掣，𠵱家燒到乜都冇喇!」  葉老太指出，兒子志邦的房間只有約80平方呎，但放有兩部電腦，電器用品插滿兩個拖板，估計插拖板的電掣近10個之多，兼且書本雜物塞滿一室，非常凌亂，儼如垃圾崗。母親和兄長經常勸喻，但也不獲理會，導致火災險禍及其他人。消委會提醒市民，必須使用合規格的拖板，同時注意不能再插萬能蘇在拖板上，以免負荷過重致短路起火。
20070721-7,20070721,7,否認勸諭書商收起《愛情神話》影視處長撐員工死不認錯,否認勸諭書商收起《愛情神話》 影視處長撐員工死不認錯 【本報訊】於香港書展出售的文化藝術書刊再次暴露影視及娛樂事務處評選準則不合時宜，在書展揭幕前一天把藝術圖畫視作不雅，影視處處長鄭美施昨日仍死撐沒有錯，只表示會加強前線巡察人員的培訓。有書商則再踢爆處長不講真話，開幕前確有影視處人員向他表示部份書籍或「踩界」。  影視處處長鄭美施為事件昨日首次會見記者，但堅稱在書展揭幕當日已澄清《愛情神話》內刊載的藝術圖畫，並非不雅物品，對《愛情神話》的準則清楚表達該處對文化藝術作品的尺度。  鄭美施又指該處巡察人員在書展揭幕前一天，應貿易發展局邀請到會場給予意見，其間曾與部份書商討論，卻未有要求書商收起懷疑不雅刊物。她強調，「唔可以話處理有乜出錯」，一向沒有要求巡察人員即時表達對書刊內容的看法，正常程序是將涉不雅的書刊帶走研究。她承認有需要加強對前線巡察人員的支援及培訓，包括改善通報機制，讓前線更快及更易取得上司指示。 有指木子美作品「踩界」 影視處指沒有「勸諭」書商收起問題書刊，書商卻另有說法。天地圖書批發部主任李服南表示，書展開幕前確有影視處人員向他表示部份書籍或「踩界」，主要是內地女作家木子美的著作。為免影響參展，他也即時收起該書，「木子美嘅作品比較大膽，但近幾年書展都有賣，唔知點解今年咁敏感。」  皇冠出版社市務經理陳健欣則指出，出售的繙譯小說《香水》也受到影視處「關注」，理由是封面的油畫女主角露兩點，「呢幅好明顯係一幅優美嘅藝術作品。」為息事寧人，她只好將簡介該書的「書腰」拉起，像為圖中女角戴上「胸圍」：「我哋遮住兩點，佢哋（影視處）就冇再嘈！」  遠流（香港）出版有限公司經理陳國華對影視處長的回應感不滿，坦言影視處高層推卸責任。他指影視處當日巡查時，執行的員工是根據部門指引勸諭他們將《愛情神話》收回，否則該書有可能被送檢。「𠵱家就只係管理層推卸責任，話前線員工唔啱，其實佢哋只係執行上層指令，如果影視處決策者仲唔反省，呢啲事只會不斷發生！」  日前被發現出售不適合青少年及兒童閱讀刊物的台灣漫部屋小說漫畫書倉庫攤位，負責人黃先生指在展覽前收到貿發局通知，已收起逾千本問題漫畫。由於現場漫畫書太多，相信是職員一時疏忽，未有收起部份問題漫畫。他承認未能審視每本書內容，對於售賣的漫畫涉及孌童內容也感驚訝。
20070721-8,20070721,8,李小龍迷為偶像設計造型,"李小龍迷為偶像設計造型 【本報訊】「情情塔塔」的愛情小說，在書展中總是最受青春少艾的歡迎，成為大贏家；不過，每次書展總有一些另類書異軍突起，今年書展一本名為《殯儀》的另類書，大談死人化妝等殯儀業八大工作，吸引得連小妹妹也圍住會場攤檔打書釘，叫出版社也大跌眼鏡。 《殯儀》讀者反應熱烈 嘉出版業務總監林靜儀表示，公司一向主力出版旅行書，今次因為有感從事殯儀業的作者梁鳳縈，以正面態度介紹本港殯儀業工作，決定出版《殯儀》一書，想不到讀者反應熱烈，每日售出約200本。內容講及化腐朽為神奇的遺體化妝師、喪禮司儀堂倌、靈界領隊、陰陽傳聲筒的道堂管理員等工作點滴，「呢本書都好實用，講晒成個喪禮嘅流程。」  另一本名為《BruceLeeStillAlive》的李小龍畫冊，由新加坡長大的李小龍迷WingYeung，花了四年時間設計及畫了不同形象的李小龍，將之印成圖冊，其中1,000本特別版在書展期間出售。他本身為設計師，創造了不同造型的李小龍形象，現正與李小龍女兒李香凝聯絡，希望稍後創作一套李小龍為題的動漫，將偶像故事以動畫形式搬上大銀幕。"
