key,date,article_daily_id,title,text
20070404-0,20070404,0,濱崎步抵港飛撲掃Bikini,濱崎步抵港飛撲掃Bikini 日本歌手濱崎步昨日大陣仗來港為後日在紅館舉行的個唱作準備。排場猶如女王出巡的她，也例牌瘋狂購物，昨日甫離開機場即直奔連卡佛買了近30對鞋，後來又到太子大廈買法國名牌Leonard性感比堅尼泳衣，之後才到酒店checkin。 現年28歲的日本女歌手濱崎步將於後日在紅館舉行AyumiHamasakiAssiaTour2007之濱崎步TOUROFSECRET演唱會，預定明日才踏台板綵排的步姐，特地提早於昨天來港購物，幫手刺激香港經濟。  有指步姐近年在日本的聲勢被同門師妹倖田來未追擊，她為力挽狂瀾出盡法寶，今次舉行亞洲巡迴演唱會，步姐早前在台灣首站已極力表現親民，排場更是聲勢浩蕩。昨日步姐來港，繼續大玩親民之餘，更如女王出巡般，她一出機場便急不及待直奔購物，實行做個大手筆的親善女王。 百人接機 親近歌迷引起騷動 昨午2時許，身穿白色套裝及白色高踭鞋的步姐，在近30名隨行人員陪同下步出香港機場，早已在場守候的逾百個fans中，大部份整齊地穿上黑色歌迷會T恤，有人更在面上畫上濱崎步的代表符號，其中2人更戴上彩色爆炸頭假髮，相當搶眼。眾人一見步姐出閘，即歡喜若狂地吶喊，20名保安隨即上前護駕，本來秩序井然，誰知步姐出其不意地走進歌迷叢中，親切地與支持者握手及簽名，也一一收下歌迷送贈的花束和禮物，引發起一場小混亂，但她很快已在保安簇擁下步上保母車，連同其他工作人員一行三輛車直駛離機場，其座駕駛至青馬大橋時，隨行攝影師特地探身出天窗拍攝香港景色及尾隨車隊，步姐也拉開車窗簾向記者揮手。  雖然舟車勞頓，但步姐卻未想休息，反而選擇第一時間往購物，近3時左右，步姐與工作人員及20名保安齊到金鐘太古廣場的連卡佛，她掃貨絕不手軟，逗留半小時主攻高踭鞋，也細意選購春裝，她離去時，記者上前問她買了多少對鞋？步姐以英語說：「Maybetwentyorthirty（大概20到30對）。」早前有日本周刊爆料，指步姐每次上節目都要準備50袋衣物，包括100對鞋作挑選，如此說來，她一口氣買30對鞋也不為過。 女王出巡 文員茶水隨行來港 之後步姐座駕停在中環置地文華酒店，但她沒有下車，不知是否對購物還意猶未盡，未幾又開車到太子大廈，只見她步入法國品牌Leonard時裝店買衫，其間有追車歌迷一直尾隨，上電梯時更不慎跌倒，不過走在前頭的步姐全不知情，她揀衫揀了約半小時，見有性感比堅尼泳衣，更即時拿起bratop細看，久久不願放下。離開太子大廈後，步姐才終於捨得返回下榻的東方文華酒店休息。至晚上約7時，步姐與7名工作人員到尖沙嘴晚膳，大啖避風塘炒蟹。  步姐今次來港，排場不比早前到台灣小，據主辦其演唱會的東亞娛樂劉先生表示，步姐的個唱共有300名日本工作人員，當中包括樂手及服裝師等，而昨日與步姐同機來港的人員也達100人，連她公司的文員及茶水都到齊，相當大陣仗。  採訪：王崇穎　攝影：葉君海
20070404-1,20070404,1,復活檔港片孤軍作戰基仔、阿Sa頑抗戇豆,復活檔港片孤軍作戰 基仔、阿Sa頑抗戇豆 今個復活檔只有由古巨基和蔡卓妍主演的《甜心粉絲王》一套港片上映，力敵七部西片，當中由路雲艾堅遜（RowanAtkinson）主演的《戇豆放大假》（Mr.Bean'sHoliday）氣勢如虹，剛成為東南亞多個地區的開畫票房冠軍，看來《甜》片要有《戰狼300》的拚勁，才有望擊退外敵。 港產電影的拍片量逐年下降，戲院經常出現片源不足情況，連一些大檔期也僅得一、兩部港片上畫，幾乎將市場拱手相讓給西片。今個復活節檔期，西片有《忍者龜》（TeenageMutantNinjaTurtles）、《反斗仙履奇緣》（HappilyN'EverAfter）、《羅拔神奇家族》（MeetTheRobinsons）及《迷你魔界大冒險》（ArthurAndTheMinimoys）四部動畫、以及《戇豆放大假》等共七部電影推出，港片就只有王晶公司的小成本製作《甜心粉絲王》迎戰。 強敵如雲 《戇豆》橫掃東南亞票房 由葛民輝執導、蔡卓妍（阿Sa）、古巨基和鄭嘉穎演出的《甜》片於今日上映，但該片以寡敵眾，肯定要打一場硬仗。鄭嘉穎對影片頗有信心，昨日他接受電話訪問說：「唔擔心票房，有阿Sa同基仔嘛，因為套戲係輕鬆戲，都好啱一家大細入場去睇。」基仔則說：「我哋當然希望套戲有好成績啦，我哋真係好畀心機拍㗎。雖然其他卡通動畫都唔錯，但我哋話晒都係本地製作，希望大家支持香港電影。」  每年復活檔，適合小朋友看的電影往往佔優，所以今次有四部動畫片齊出籠，除了《忍》片要搶頭啖湯提前在上周四推出外，其餘三部明日會同步上映。在四部動畫片中，相信廸士尼出品的《羅》片，觀眾會較有信心，且看這部戲能否不辱使命。至於由洛比桑（LucBesson）導演的動畫《迷》片，有麥當娜（Madonna）、大衞寶兒（DavidBowie）和羅拔廸尼路（RobertDeNiro）等荷李活巨星配音，當然有一定吸引力。  《甜》片除了面對四部動畫外，最強的敵人是由英國著名喜劇演員路雲艾堅遜主演的《戇豆放大假》，戇豆先生在香港已有一班基本擁躉支持，今次路雲難得在戲中有愛情線發展，加上他日前表示此片是《戇豆》系列的最終回，單論牌面已先勝一仗。《戇》片更同時成為馬來西亞、新加坡、泰國和印尼的票房開畫冠軍，氣勢如虹，相信有助該片在香港的成績。  至於楊紫瓊與真田廣之主演、丹尼波爾（DannyBoyle）執導的西片《太陽倒數》（Sunshine）也是在明日上映，這類有關外太空的科幻片，對觀眾來說不算新鮮，反而史提芬鶴健士（StephenHopkins）導演的驚慄片《魔疫》（TheReaping），有奧斯卡金像影后希拉莉絲韻（HilarySwank）助陣，應該會有睇頭。 形勢告急 許鞍華：港片要自救 劉偉強對於在復活節檔期，只有一部港片推出並不是太擔心，他說：「𠵱家可以話係一個調整期，開始汰弱留強，製作人開戲會比較小心，咁樣對影片質素會有保證，觀眾對港片回復信心後，港片自然會興旺。」許鞍華則認為港電影市道一早已令她憂心忡忡，她說：「港片要自救，首先係要自己努力拍啲好戲出嚟，今個復活節我會睇《戇豆》同楊紫瓊部西片，睇佢做成點。」  採訪：馮美茵、蔡如玉、魯萍 《甜心粉絲王》　今日上映  賣點：葛民輝10年後再執導演筒。  期待指數：★★★    《戇豆放大假》　明日上映  賣點：英國笑匠路雲艾堅遜主演，戇豆深受小朋友擁戴，老少咸宜。  期待指數：★★★★    《羅拔神奇家族》　明日上映  賣點：廸士尼出品，信心的保證。  期待指數：★★★★    《迷你魔界大冒險》明日上映  賣點：殿堂級大導演洛比桑首次執導動畫結合真人的電影。  期待指數：★★★    《忍者龜》　已上映  賣點：家喻戶曉的經典卡通人物，四隻龜兄弟，大人細路看得開心。  期待指數：★★★★    《反斗仙履奇緣》　明日上映  賣點：由《史力加》監製約翰威廉斯炮製的童話式動畫片。  期待指數：★★★    《魔疫》　明日上映  賣點：由兩屆金像影后希拉莉史雲克（HilarySwank）擔正演出。  期待指數：★★★    《太陽倒數》　明日上映  賣點：楊紫瓊有份主演，花了逾兩年時間拍攝，《迷幻列車》導演新作。  期待指數：★★★    （註：期待指數最多為5★）
20070404-2,20070404,2,開Blog證蛻變紅BlogBlog：章子怡與曼玉扮Friend,開Blog證蛻變 紅BlogBlog：章子怡與曼玉扮Friend 章子怡終於跟上寫blog熱潮，凌零發日前在搜狐網站上看到章子怡正式開設個人官方網頁，網站內除了有她的真情日記外，更有她自99年出道時拍下的照片，並仔細地分門別類，讓fans把她多年來的變化盡收眼底。 心聲贈Fans 網站首頁就有一段似是章子怡的心底話，聲稱網站是讓她與fans接觸的橋樑、是一個家，相信其fans定會相當受落。網站幾乎羅列出章子怡近年的所有活動，除了有video之外，還有她曾參與的公益活動名單，似乎有心改善形象。不過凌零發最感興趣的，則是她自99年以來為雜誌所拍的照片，由土裏土氣變成今日的「國際巨星」，登上的雜誌也越見高檔。  另一方面，在「子怡與朋友」的相片集中，大部份都是章子怡與其他藝人的照片，當中更有她與張曼玉在宣傳電影《英雄》時的合照，不過拍攝《英雄》時兩位女主角已傳不和，早前章子怡更取代張曼玉位置，出任國際鉑金協會中國區新代言人，令這張「朋友」合照更見珍貴。  雖然網站只開設了數天，但她已經發表了兩篇文章，更有一些她早前到加拿大拍戲時的照片，照片攝於其2月9日生日當天。 傳演《梅蘭芳》 刻下身處東京宣傳電影《夜宴》的章子怡，更大講人生道理，不過凌零發就非常懷疑當中的文字是否出自其手筆，各位讀者可自行判斷。  此外，昨日內地搜狐網報道章子怡極有機會接拍陳凱歌執導的《梅蘭芳》，飾演梅蘭芳紅顏知己、一代名伶孟小冬，最後並嫁給杜月笙。《梅》片策劃人吳迎表示有數十個女演員爭演此角，但因為落實人選尚未簽約，故不便透露。  版主：凌零發  章子怡官方網頁網址： http://www.helloziyi.com 
20070404-3,20070404,3,電影十年《無間道》最佳秋生封帝難得多謝太太,"電影十年《無間道》最佳 秋生封帝難得多謝太太 由香港電台主辦的「香港特區十周年電影選舉」昨日公布得獎結果，黃秋生憑《千言萬語》一片成為最佳男主角，張曼玉則憑《花樣年華》榮膺影后，最佳電影就由《無間道》奪得。早前因與23歲索模JessieCheung頻頻約會而傳緋聞的黃秋生，昨日領獎時竟然罕有地答謝太太。 黃秋生、毛舜筠、劉偉強、麥兆輝及梁洛施等昨日齊集港台電視大廈，出席由香港電台主辦的「香港特區十周年電影選舉」頒獎禮，是次頒獎禮是為了紀念香港特區成立十周年，並在過去1,000部港產片中評選11個獎項。 張曼玉膺影后 大會昨日邀請了多名資深台前幕後電影人擔任頒獎嘉賓，許冠文在頒發最佳男女主角獎時更大講棟篤笑，他說：「𠵱家男女主角演到一啲瑕疵都冇，好似見到我哋特首辯論比賽，梁家傑學咗幾堂演戲，但就好假。特首就真係唔識演戲，佢做番自己，所以真啲囉。」  最佳女主角由張曼玉奪得，由於她不在港，故透過錄音答謝20多年來在她身邊支持的朋友。黃秋生憑電影《千言萬語》飾演意大利籍的甘神父奪得最佳男主角，他領獎時更扮甘神父表示要多謝神，他說：「我要多謝我兩位恩師，鍾景輝同毛俊輝，仲有多謝我太太，幫我睇住頭家，令我可以好自由發揮我嘅創作，搞到我自己都唔知真定假。」  對於高調向太太致謝一事，事後秋生說：「係呀，特別係嗰個時候我係病緊，我好高興可以演到呢個角色，10年嚟咁多高手如雲嘅對手，緊張程度就等如第一次攞金像獎，今次總算對許鞍華（《千》片導演）有個交代，因為10年前喺台灣同香港係一個獎都攞唔到。」 梁洛施一碌木 昨日的頒獎禮由梁洛施和周國豐擔任司儀，女方表現一般，除了口窒窒外，就連介紹嘉賓或是對話時一樣照稿讀搬字過紙。其間工作人員不慎打碎祝酒用的酒杯，她也全無反應，周國豐即時解圍說這代表對香港電影百花齊放。  此外，有份奪得最具潛質男演員優異獎的房祖名，致謝辭時錯將評審團讀成陪審團，哄堂大笑，之後秋生上台領獎時也笑謂要多謝港台的法官及陪審團。  採訪：駱華齡　攝影：陳志嵐"
20070404-4,20070404,4,「香港特區十周年電影選舉」得獎名單,「香港特區十周年電影選舉」得獎名單 最佳電影：《無間道》  最佳導演：杜琪峯《鎗火》  最佳編劇：麥兆輝、莊文強《無間道》  最佳男主角：黃秋生《千言萬語》  最佳女主角：張曼玉《花樣年華》  最具潛質男演員：吳彥祖  最具潛質女演員：蔡卓妍  最佳新晉導演首作：彭浩翔《買兇拍人》  最富香港本土色彩電影：《香港製造》  最具創意電影：《少林足球》  傑出成就獎：劉德華及江志強    資料來源：「香港特區十周年電影選舉」大會
20070404-5,20070404,5,ClickClick情報科網料大募集,ClickClick情報科網料大募集 《蘋果》娛樂版設立讀者來料專欄，歡迎大家提供有關藝人的相片、video及有關藝人有趣網料。  Case1：任何關於藝人的過癮網料，如討論區有趣的娛樂圈題目，內文請附上有關題目網址  Case2：無意或刻意拍下的明星video或相片，如藝人街頭拮魚蛋、當街攬仔/攬女等  Case3：藝人入行前或後的珍貴、古怪相片  Case4：與明星的過癮合照  請附姓名、電話及電郵地址，電郵到：adent@appledaily.com  所有照片或video一經採用，酬勞由$200起  而提供網料酬勞則由$100起。
20070404-6,20070404,6,抗戰餘波楊丞琳赴京鞠躬道歉,抗戰餘波 楊丞琳赴京鞠躬道歉 楊丞琳四年前在台灣出席吳宗憲主持的節目《我猜我猜我猜猜猜》時，被問到抗日戰爭打了多少年，她回答是11年。當得知正確答案是8年時，她竟驚訝地說：「8年而已喔！」引發內地網友炮轟她媚日，還齊齊抵制她。 「我讀書不多」 楊丞琳昨日在北京舉行記招，就失言一事公開道歉。其間她站起來向傳媒鞠躬，說到激動處還兩眼通紅。記者會上重播了當日其失言片段，楊丞琳表示：「這是四年前的事，有些事後來被網友扭曲了，但我還是要為當時言辭不當向內地朋友說聲不好意思，因為我讀書不多，很早休學，今後我有時間會努力閱讀，相信對歷史的了解會更深。」之後主持送上《近代中日關係叢書之五》，該書內容提及抗日戰爭。對於有報道指楊丞琳曾在新加坡揶揄內地網民沒素質，其經理人謂她半年來沒到過當地。  撰文：葉雪
20070404-7,20070404,7,趁葉念琛未到馮仁昭四圍超：Stephy篤爆小方呷醋 - 馮仁昭,趁葉念琛未到 馮仁昭四圍超：Stephy篤爆小方呷醋 - 馮仁昭 鄧麗欣（Stephy）、方力申同導演葉念琛呢個愛情三角錯嘅組合，噚日為宣傳新片《十分愛》，去到商台接受訪問，但葉念琛就姍姍來遲，由小方同Stephy呢對緋聞情侶撐大局。開頭因為導演唔在場，佢兩個接受訪問就係咁打情罵俏，當Stephy話好怕大家嘅焦點放晒係緋聞上面時，小方就插嘴話：「冇人講咪仲大鑊，咁我哋套戲係講愛情嘛。」 合照成「嬲」字 後來小方見導演仲未到，即時發揮搞笑本色𠱁Stephy開心，佢話：「今次張首映飛做到好似請帖咁，公司亦都為部戲出寫真，但寫真集封面Stephy就佔成三分二個樣，Paco仲話因為有Stephy先賣得咁好，而Stephy仲要當住Paco面，話如果冇埋我個樣就賣得仲好！」旁邊嘅Stephy聽到後即時詐嬌話嗰次自己只係講笑，仲話小方呷醋。  訪問將近尾聲時葉念琛先匆匆到場，三人合照時就組成咗一個「嬲」字。葉念琛話對今次《十》片相當有信心，至於佢下一齣新片會否再次搵佢嘅「最佳女主角」Stephy？葉念琛就有所保留話：「要諗一諗個時間先，或者佢唔拍我呢？」
20070404-8,20070404,8,馮仁昭四圍超：陶大宇拒講前妻財困 - 馮仁昭,馮仁昭四圍超：陶大宇拒講前妻財困 - 馮仁昭 陶大宇為郭羨妮離婚嘅事，熱炒咗一個禮拜，當事人成為被追訪嘅對象，對於近日眾多傳聞，大宇都不願置評，噚日佢喺將軍澳電視廣播城開工，又有人問佢前妻黃慧寶係咪財政出問題，佢話：「唔回應喇，你哋鍾意寫乜嘢就寫乜嘢！」如果前妻真係出現經濟問題，會唔會出手相助？佢話：「總之呢啲問題就唔係問題喇！」
20070404-9,20070404,9,偕城城曼谷度春宵熊黛林返港失憶,偕城城曼谷度春宵 熊黛林返港失憶 郭富城與熊黛林半年情似假還真，昨日有周刊拍到兩人在泰國密會，並於酒店共度17小時，之後女方才轉酒店，會合周汶錡行街shopping，更買了一對挑情枕袋。 認曾到泰國 熊黛林昨日與閰清、唐寧等在銅鑼灣出席法國品牌Sinequanone新店開幕活動，被問到與城城曼谷之行，她即說：「我冇睇過報道，乜嘢都唔知呀！」但就承認曾到泰國。談到買一對挑情枕袋，她就說：「我嘅床太細，係放唔到雙人枕頭㗎！」熊黛林表示復活節將飛往北京工作，記者指城城也身在當地拍戲，熊黛林即說：「我唔知呀！」  採訪：梁錦雯　攝影：葉君海
20070404-10,20070404,10,馮仁昭四圍超：古巨基蠟像消肥腩 - 馮仁昭,馮仁昭四圍超：古巨基蠟像消肥腩 - 馮仁昭 古巨基（左）噚日去咗山頂嘅蠟像館為自己嘅蠟像剪綵，同場展出嘅仲有佢創作嘅漫畫人物Kubi蠟像。基仔同為數約30名嘅fans一見到蠟像造型即大讚像真度極高，基仔話：「特別係個眼神同眼睫毛做到好似，不枉當日花咗成五個鐘度身，唯一修正咗係冇咗肚腩。」基仔笑言度身時較瘦，經過新年後就肥咗唔少。
20070404-11,20070404,11,大宇笑對宣馬戀,大宇笑對宣馬戀 近日有消息指宣萱與馬德鐘合演劇集《歲月風雲》撻着，兩位當事人以前分別跟陶大宇和郭羨妮傳出緋聞，認真巧合。昨日大宇在九龍城趕拍新劇《和味濃情》，他說：「得啖笑囉。老實講，𠵱家乜嘢都同我掛鈎，乜都關我事，但我只會專注工作。」  昨日《和》劇劇情指大宇、蘇玉華和秦沛到大牌檔開餐，遇上剛巧路過的廖碧兒和楊天經，大宇示意廖、楊與他齊坐一枱，廖碧兒卻故意坐開。現場所見，作OL打扮的廖碧兒穿高跟鞋，後腳踭卻貼上膠布，但她十分貪靚，每有空檔都着髮型師為她捲髮，相比下蘇玉華就不似對方講究。拍完外景後，大宇即駕車返電視城續拍廠景。  採訪、攝影：娛樂突發組
20070404-12,20070404,12,馮仁昭四圍超：梁朝偉睇病過門不入 - 馮仁昭,馮仁昭四圍超：梁朝偉睇病過門不入 - 馮仁昭 梁朝偉近日備受女友劉嘉玲同台灣富商郭台銘嘅緋聞困擾，一向深閨嘅佢就更少現身，但噚日下晝佢單拖去跑馬地養和醫院，由於在場大批傳媒追訪賭王何鴻燊入院同聾如心嘅死訊，所以偉仔都被記者嚇咗一跳，即刻揸去院外迴旋處兜圈，連醫生都冇睇到就開車鬆人。馮仁昭唔知偉仔呢排係咪唔開心鬱出病，但佢嘅心病睇嚟還需心藥醫嘅。
20070404-13,20070404,13,爛片選舉戰況激烈阿倫、基仔力爭話梅王,"爛片選舉戰況激烈 阿倫、基仔力爭話梅王 由《蘋果》娛樂版舉辦的「第二屆金話梅電影選舉」（GoldenPlum）已經進入最後階段，凌零發率先公布各獎項的投票走勢，爛片之王究竟花落誰家仍靠你的一票，4月7日就截止投票，尚有三日，讀者們快快到以下網址投下你神聖的一票，結果將於4月14日在《蘋果日報》娛樂版及網頁內公布！ 香港一年一度的影壇盛事──金像獎頒獎典禮將於本月15日隆重舉行，可惜近年港產片越拍越爛的情況仍然持續，《蘋果日報》娛樂版以鞭策電影工作者不要再拍爛片為宗旨，今年繼續舉行「第二屆金話梅電影選舉」（GoldenPlum），投票也進行得如火如荼，爛片王、后、導演及電影等也即將誕生！  選舉投票本周六（7日）便會截止，而結果將於14日於《蘋果日報》娛樂版及網頁內公布，距離選舉投票還剩三天，影迷們千萬不要錯過機會，現在先讓凌零發帶大家看看截至昨日各獎項的最新走勢。 四獎同領先 由譚詠麟（阿倫）與李克勤主演的《左麟右李之我愛醫家人》可謂「走勢凌厲」，分別以高票數成為最爛電影、導演、男主角及拍檔四個大獎的頂頭大熱（詳見附表），估不到阿倫與克勤這對樂壇上的最佳拍檔，聯手拍攝電影卻慘淡收場。  《左麟右李》以2,135票暫時高據最爛電影首位，阿倫與克勤也以1,859票力爭最爛拍檔，看來兩人已穩奪爛片之王寶座。最爛男主角由曾獲金馬影帝的阿倫遙遙領先，憑《野蠻秘笈》獲提名的古巨基緊隨其後，要爭爛片影帝就要看讀者心水了！ Fiona鬥Rain 爛片女王爭持較為激烈，由薛凱琪（Fiona）憑《新紮師妹3》以2,412票數暫列首位，第二位的李彩華（Rain）憑《打雀英雄傳》以1,630票力追，鹿死誰手仍是未知之數。  同樣爭崩頭的還有最爛場面獎項，《戀愛初歌》賣《黑拳》廣告、《龍虎門》傳授功夫以及《提防老千》陳煒挑逗王晶三個提名相差不到300票，仍靠讀者一票選出最實至名歸的爛場面。  投票網址：   http://www.atnext.com/jp/goldenplum/ "
20070404-14,20070404,14,馮仁昭四圍超：陳曉東有機演梅蘭芳 - 馮仁昭,馮仁昭四圍超：陳曉東有機演梅蘭芳 - 馮仁昭 陳凱歌將開拍新戲《梅蘭芳》，男主角人選傳咗幾個，噚日又有消息話陳曉東（圖）會簽約內地經理人王京花嘅橙天經紀公司，而呢間公司有份投資《梅》片，喺王京花穿針引線下，陳曉東去咗試鏡演梅蘭芳，劇組方面對佢嘅造型好滿意，𠵱家雙方進入斟洽階段。其實陳凱歌會將梅蘭芳分老中青三個階段拍，而黎明都已經落實演出，應該會演中年梅蘭芳。
20070404-15,20070404,15,紅BlogBlog：李冰冰瞓身隊酒,紅BlogBlog：李冰冰瞓身隊酒 李冰冰近日有望進軍荷李活，內地有報道指她有望接演李連杰與成龍合作、改編自《西遊記》的電影《功夫之王》，未知是否為勤練英文，李冰冰最近到新加坡進修一番，更順道到處遊玩一下，向各位fans介紹當地名勝。 蒲特色酒吧 自稱為李老大的李冰冰，除了在最出名的新加坡象徵魚尾獅前拍照外，還到了一間相當特別的酒吧，酒吧名字叫「ClinicBar」，人客只需要躺在椅上張着嘴，就能喝到酒，令凌零發也想試試。  李冰冰blog   http://blog.sina.com.cn/libingbing 
20070404-16,20070404,16,馮仁昭四圍超：特技王羅禮賢踢爆成龍用替身 - 馮仁昭,馮仁昭四圍超：特技王羅禮賢踢爆成龍用替身 - 馮仁昭 近排越來越多藝人寫blog，估唔到連專做特技嘅香港導演羅禮賢（Bruce）都有呢個習慣，近日仲喺個blog度大爆成龍都有用替身拍戲，同埋成龍電影嘅內幕，令唔少人嘩然。 曾做楊紫瓊替身 一直聲稱唔用替身嘅成龍，就俾Bruce踢爆呢個只係一個「美麗的謊言」。Bruce話喺成龍電影入面，好多嘅飛車場面都係由佢上陣；至於俾成龍踢到飛起嘅壞人，之所以跌得咁亁脆，原來係因為Bruce預先套咗條繩喺啲壞人對腳上面，佢哋被踢時就即刻反方向用力拉條繩，觀眾咪以為成龍好似打到啲壞人飛起囉。Bruce除咗做成龍替身之外，連楊紫瓊嘅替身都做過，喺《警察故事3》入面，楊紫瓊飛車上火車一幕，就係佢男扮女裝拍嘅，真係令人意想不到。  Bruce又喺個blog度講做特技嘅專業知識，又話之所以寫咁多內幕喺度，係想俾更多人了解中國特技，要向全世界展示華人電影有幾優秀喎。  羅禮賢BLOG  網址： http://2006llx.blog.sohu.com/ 
