key,date,article_daily_id,title,text
20070414-0,20070414,0,徐步高穿美津濃犯案後　警登廣告舊鞋換新鞋誘魔警現身,"徐步高穿美津濃犯案後　警登廣告 舊鞋換新鞋誘魔警現身 【本報訊】01年梁成恩被槍殺失槍事件引起警隊極度關注，警方為破案，展開史無前例的調查行動，最後鎖定目標人物是「自己友」，暗中使出一招「引蛇出洞」，以美津濃舊鞋換新鞋圖誘疑兇現身，但不成功，於是轉移調查2,849名有兜風耳、左撇子及財政問題等的警員，偏偏徐步高是「漏網之魚」，直至五年後尖沙嘴槍擊案，其「魔警」身份才真正曝光。　記者：蔡曉楓、梁偉強 昨日要點 殺警案死因聆訊　第31日    01年兩宗槍擊案令警方大為緊張，五年內為破案動員史無前例的人力物力，扭盡六壬想出一招「引蛇出洞」，以「舊鞋換新鞋」圖誘疑兇現身，另外又調查二千多名警員，但徐步高一直不在調查名單之列。 01年3月14日梁成恩（24歲）在石圍角邨石桃樓5樓遭搶槍及槍殺，現場遺下的有用證據不多，又無目擊證人。直至同年12月5日麗城恒生銀行發生持械劫案，巴籍護衞員Khan（31歲）被槍殺，始有更多線索，由於涉及同一支警槍，於是將兩案合併調查。  有組織罪案及三合會調查科（俗稱O記）警司馬志堅昨在死因庭供稱，01年12月5日麗城花園發生持械劫案，巴籍護衞員被槍殺，銀行閉路電視拍攝到，疑犯穿美津濃波鞋，身高約5呎9吋、左手持槍、身手矯健，蒙頭加手套，身上連一吋皮膚也沒有外露，鎖定疑兇是現職或退役警員。而疑兇在劫案現場遺下的波鞋鞋印，亦成為緝兇證據。  警方聯絡美津濃的香港代理，發現全港40間商舖出售該款波鞋，其中兩間位於界限街的警察俱樂部，以及在機動部隊訓練中心內，但大部份人以現金付款，難以追尋，其中12人以信用卡付款，經調查並無發現。 徐步高一直是漏網之魚 馬志堅稱，警方於是施展一招「引蛇出洞」，在警方刊物《警聲》及警署張貼宣傳廣告，推出回收四款美津濃波鞋計劃，以換取300元禮券優惠，計劃列出涉案波鞋，以及另三款在港並無發售的波鞋款式，希望疑兇現形。最後有12位警員回應行動，但該批舊鞋的尺碼及鞋底磨損程度，與現場鞋印不脗合。馬指為免打草驚蛇，引蛇出洞計劃須低調進行，只有極少數同袍知悉。  馬志堅昨強調警方極度重視三宗槍擊案，為找出真兇，動員的人力物力可謂史無前例，將數十萬個資料輸入警隊的超級電腦，其間曾接見2,849名警員，徐步高一直是「漏網之魚」。  警方繼續跟隨閉路電視中疑兇的特徵追查線索，其中戴上頭套的疑兇耳朵突出，於是在3萬多名警員的相片中，找出擁有兜風耳特徵的50歲以下男警員，曾接見1,990位符合條件的警員。警方認為疑兇應是左撇子，接見了130名以左手開槍的警員，並向財政有困難，曾向警隊借貸的14名警員展開調查。  馬志堅解釋徐步高的警員委任證照片上可見雙耳緊貼面旁，與報紙上看到的兜風耳照片不一樣，加上他在警隊申報以右手燒槍，又從未向警隊借貸，因此徐可以逃過被調查的命運。 心理分析推斷警員所為 警方從犯罪心理方向找尋線索，突出疑兇的警員身份。由於一般罪犯不會費神搶警槍，他們可輕易在內地購買黑星手槍，黑星又比警槍「好用」，因此疑兇是難以接觸黑市的警員。其後又進一步推斷疑兇一人犯案，因為警員慣於獨自行事，認為越多人參與，事件越易曝光。而警方懸紅300萬元，相當吸引，應可引出同謀供出疑兇，但一直無人問津。  馬志堅指警方在06年3月17日凌晨尖沙嘴槍擊案發生前，仍沒有間斷調查梁成恩及麗城恒生劫案，相信假以時日會查到徐步高身上。而尖沙嘴槍擊案後，警方遠赴菲律賓，找回曾目擊恒生劫匪掀開頭套的女傭，讓她看徐步高及另11人的照片，但她因事隔久遠而未能辨認出來。  案件編號：CCDI515/01,2261/01&373-4/06 下周一預告 徐步高的妻子李寶玲將首度現身法庭，與徐母張維美陸續作供。 警方誘捕兇徒計劃示意圖"
20070414-1,20070414,1,千億遺產　兩份遺囑龔如心「好朋友」喪禮後發動爭產戰,千億遺產　兩份遺囑 龔如心「好朋友」喪禮後發動爭產戰 【本報訊】華懋集團主席龔如心千億遺產爭奪戰，將於本周三喪禮結束後揭開序幕。據了解，龔如心生前先後立下最少兩份遺囑，其中自稱唯一受益人的神秘人，是龔如心生前好朋友兼親信，持有一份據稱是小甜甜生前最後訂立的遺囑，申明巨額遺產並非慈善用途，內容跟龔家手持龔如心02年所立遺囑不同。「好朋友」打算在喪禮後入稟接收遺產，龔家陣營則不惜興訟，誓保小甜甜將遺產捐作慈善的宏願，世紀爭產案續集即將上演。　記者：黃偉駿、梁偉強 消息人士透露，「好朋友」是一名中年男子，雖然跟龔如心沒有血緣關係，也並非龔家或王家成員，但深得她信任。消息人士稱，「好朋友」並非外界盛傳的契仔張雁坤，也不是華懋任何一名老臣子。據本報了解，「好朋友」準備在喪禮過後，憑手上一紙遺囑，正式根據法律程序接收龔如心龐大遺產及整個華懋集團。 家屬持有遺囑表明捐基金 消息人士指，龔如心原來早於02年中，世紀爭產案訴訟期間，已立下第一份遺囑，詳細列明死後會將大部份財產留給華懋慈善基金作慈善用途，只有少部份留給家人，這也成為龔家家屬在龔如心病逝後，向傳媒披露會捐出千億遺產的理據。該基金早於88年成立，由龔如心三位弟妹一同打理。  自神秘人透過律師高調發表聲明自稱是唯一受益人後，龔家家屬與華懋高層立即追查其身份，赫然發現對方竟是龔如心的心腹好朋友，令龔家大為震驚及憤怒，原因是「好朋友」聲稱擁有龔如心在較後日期訂立的遺囑，內容是龔如心將一切財產遺贈給他，更有意入稟爭產。  據悉，原來龔如心於02年11月在原訟庭被判敗訴後，因擔心日後自己要負上刑責，於是立下一紙遺囑將巨額財產託管給「好朋友」，以備不時之需，該遺囑一直存檔，不曾面世。後來龔如心在世紀爭產案反敗為勝，該遺囑未有銷毀；最近卻被人重新拿出來作為爭產理據。 好朋友手持一頁英文遺囑 消息人士稱，該份遺囑以英文書寫及只有一頁紙，雖然並非龔如心親筆所寫，但看來由她簽署，並有見證人作證，但不是在律師樓訂立。消息人士指龔家家屬已作好心理準備，「好朋友」必會入稟爭產，更可能在短期內進行，但龔家絕不相信該份遺囑的內容。  「雖然所謂『後立』嘅遺囑訂立日期係02年之後，較第一份遺囑新，但龔如心深愛王德輝，又一直同身邊人甚至同中國政府講，會將遺產留畀慈善用途，造福香港市民同祖國同胞，加上千辛萬苦先至打贏官司，贏番聲譽同尊嚴，可以見到『好朋友』聲稱的遺囑內容好有問題，龔家必定會質疑遺囑嘅真假，抗爭到底。」消息人士說。  據悉龔家家屬與華懋高層連日商議後，已作最壞打算，必要時就「好朋友」遺囑合法性對簿公堂，展開另一場世紀爭產案，但目前採取「敵不動、我不動」策略，待「好朋友」出手後才見招拆招。  律師葉成慶表示，遺囑不一定要到律師樓訂立，市民自行手寫的遺囑同具法律效力，但手寫遺囑須符合一般規定：內容須清楚交代遺產如何分配，然後簽名作實及寫明訂立日期；寫遺囑時須有見證人在旁。若有兩份或以上遺囑，以最後訂立者為準，最後訂立的新遺囑會自動令之前的遺囑失效，毋須另辦手續取消舊遺囑。  律師黃國桐表示，遺囑必須有見證人；若無正式遺囑，後人也可以根據先人生前在無見證人情況下自行寫的「意願書」，執行遺產分配，但意願書必須寫得清楚明確。
20070414-2,20070414,2,獨行槍匪挾持顧客劫銀行強迫女職員付鈔　1分鐘掠走4.9萬,獨行槍匪挾持顧客劫銀行 強迫女職員付鈔　1分鐘掠走4.9萬 【本報訊】深水埗永亨銀行，昨日發生劫案，獨行持槍匪徒，闖入銀行用槍指嚇一名老翁作人質聲言打劫，要脅銀行職員，銀行職員被迫交出4.9萬元，匪徒得手後逃去無蹤，被挾持的老翁並無受傷。警方深水埗重案組已接手調查案件，追緝匪徒下落。　記者：張家樂 現場長沙灣道57號的永亨銀行，案發昨日中午近12時，銀行內有七名職員，但只有一名姓吳（72歲）男顧客，現場消息指，該名賊人曾於銀行外徘徊，懷疑見銀行顧客稀少，即衝入銀行打劫，停留約1分鐘後離去。 肥身材戴口罩鴨舌帽 獨行匪徒年約20至30歲，肥身材，約5呎5吋高，戴口罩，頭戴一頂杏色鴨舌帽，啡色眼鏡，身穿杏灰色長袖恤衫，內着一件白色T恤，淺藍色牛仔褲及白色波鞋，身上斜孭一個黑色袋，左手並戴着一隻勞工手套。  現場消息指，匪徒趁吳翁行近第3號櫃位時，從銀行的長沙灣道門口衝入，他用左手箍着吳翁頸，右手並亮出一柄銀色曲尺手槍，指着吳翁的後腰及肩膊，匪徒操純正廣東話，向櫃位女職員聲稱打劫。  吳翁未及反應，不知如何是好，而櫃位女職員，見狀從櫃枱拿出4.9萬元交給匪徒，匪徒將鈔票塞入斜孭袋內，得手後從銀行楓樹街門口離開，向荔枝角道方向逃走。事後銀行職員報警，事件中吳翁並無受傷，並且未有顯得驚慌。  警方接報到場，在附近一帶兜截，但並無發現匪蹤，警方並封鎖銀行調查，向職員及吳翁錄取口供。鑑證科人員亦到場，在櫃位套取指模及搜索證物。吳翁在銀行內助查，至傍晚6時才由探員陪同離開。案件由深水埗重案組接手調查，警方呼籲任何目擊劫案市民，或懷疑接載過匪徒的司機，致電27463456，與深水埗重案組聯絡提供消息。 去年銀行劫案升五成 警方統計數字顯示，去年本港發生23宗銀行劫案，較前年上升逾五成。立法會保安事務委員會主席劉江華認為數字升幅頗大，警方應盡快破案，挽回市民對治安的信心；銀行方面也應研究加強防盜措施，保障顧客人身安全。  副主席涂謹申則關注劫匪挾持顧客手法，可能與近年銀行逐漸實施密封式櫃位設計有關，「啲賊想攞錢，又跳唔過櫃位入面，慌張之下打顧客主意，呢種手法過去比較少，銀行點應變呢？應唔應該就範畀錢呢？如果唔畀，造成傷亡，又邊個負責？呢啲問題都要認真解決。」 槍匪劫銀行示意圖
20070414-3,20070414,3,新聞資訊研究組新界30處地方野豬出沒,"新聞資訊研究組 新界30處地方野豬出沒 香港的野豬多在新界的偏遠地方出沒，漁護署資料顯示，大欖涌及沙頭角山林是野豬出沒的黑點。野豬狩獵隊則表示，野豬數量無從估計，新界區幾乎每個山頭都有野豬，除以上地區外，上水、粉嶺、大埔、屯門及西貢等30多處地方都是野豬出沒的重災區。 去年接143宗投訴 野豬闖入民居時有所聞，去年1月，兩大四小野豬跑進葵涌醫院範圍，警方召來狩獵隊把其中三頭小豬擊斃。漁護署發言人說，今年首三個月狩獵隊共射殺18頭野豬，去年則射殺52隻，較05年的六隻大增。當局去年全年共收到143宗投訴，主要是擔心野豬威脅人身安全及破壞財產。  但發言人提醒市民，除獲發特別許可證的狩獵隊外，任何人非法捕捉或獵殺野生動物，最高可被罰款10,000元。襲擊野生動物至受傷，則違反《防止殘酷對待動物條例》，最高可被罰款20萬元和監禁三年。"
20070414-4,20070414,4,公僕偷拍裙底個案增敍委會倡嚴懲,"公僕偷拍裙底個案增敍委會倡嚴懲 【本報訊】公務員敍用委員會在最新發表的2006年年報中指出，公務員近年觸犯偷拍裙底個案上升，建議將紀律處分起點定於「嚴厲譴責，另加罰款」，犯事者除晉升及聘任受影響外，最多更會被扣減相當於一個增薪點數額的罰款，為期一年。有學者指出，以譴責及罰款作量刑起點過於寬鬆，犯罪者一律革職才可收到阻嚇作用。 最重的刑罰是革職 委員會在年報中提出，鑑於公務員涉及偷拍女性裙底的個案有所上升，決定將這類個案的處分起點定為「嚴厲譴責，另加罰款」。若涉案人士職級較高、曾使用暴力或職權犯事，以及近期有違反紀律紀錄，要面臨更嚴厲的紀律處分，最重的刑罰是革職。  對於涉及色情的嚴重不當行為或罪行，現行的慣常懲罰是最嚴重的革職處分，涉案者將喪失所有的退休金、薪酬及福利。委員會指過去六年的個案中，大部份涉案者的懲罰介乎革職與嚴厲譴責，委員會經過檢討後，認為現有懲罰尺度恰當，可繼續沿用。  城市大學專業進修學院學術統籌宋立功指出，世界各地均非常重視打擊性騷擾罪行，市民一般對公務員道德要求較高，對干犯偷拍裙底春光等行為或罪行，在紀律處分時只以「嚴厲譴責，另加罰款」量刑，刑罰未免過輕，難收阻嚇作用。他認為應嚴懲犯事者，一概革職查辦及取消長俸。 14宗涉盜竊被處分 委員會在年報中提到，近年公務員干犯盜竊罪行的數字，沒有明顯下跌迹象，去年因涉及盜竊被處分的個案達到14宗，其中2宗個案被罰免職。過去數年的個案數字更顯示，有30%個案屬屢犯。  修訂後的懲罰尺度已在去年8月開始實施，分別加重對初犯者及屢犯者的刑罰，初犯者的懲罰起點為「嚴厲譴責，另加罰款」，屢犯者會被革職。  委員會去年合共為103宗公務員紀律個案提供意見，當中35%個案最終判罰革職，也有35%個案被處予嚴厲譴責另加罰款，其餘30%個案則屬不同程度譴責及罰款等。委員會特別提到其中一宗個案，涉及有部門延誤處理違規行為，容許一名違規人員在長達三年期間，屢犯不守時及不服從上級，拖延多時才採取紀律行動，將該名違規人員免職。 近年公務員偷拍裙底判刑個案 案發日期：06年7月  被告：駐荃灣裁判法院庭警周觀勝  事件及判罰：當值時用手機偷拍一犯人女家屬裙底，裁定公職中行為失當，判監半年    案發日期：05年11月  被告：教統局高級學校發展主任陳旭明  事件及判罰：到學校進行評核時，用數碼相機偷拍女生裙底，獲撤銷有違公德行為控罪，自簽一萬元及守行為一年    案發日期：04年10月  被告：高級入境事務助理梁達新  事件及判罰：醫院探望患病母親時，用手機偷拍一病人女家屬裙底，裁定公眾地方擾亂秩序，判罰款1,000元    案發日期：04年9月  被告：衞生福利及食物局助理秘書長陳宇新  事件及判罰：灣仔一餐廳內用手機偷拍一女顧客裙底，裁定公眾地方擾亂秩序，判罰款4,000元    資料來源：《蘋果》資料室"
20070414-5,20070414,5,特稿行員付鈔會拖延時間,特稿 行員付鈔會拖延時間 深水埗永亨銀行劫案中，匪徒以類似手槍物體挾持顧客要脅員工攞錢，現時本港銀行一般為員工訂有內部指引。香港銀行業僱員協會主席李麗貞表示，銀行為保障員工和顧客的性命安全，指示員工在生命受威脅時，應依照匪徒的說話去做，「但畀錢會有原則，唔會一筆過推晒啲錢滿足個賊，而係先畀細鈔，再出大鈔，目的係盡量拖延時間，讓其他員工盡快報警。」  李麗貞說，自去年銀行實施五天結算後，周六人流減少，匪徒以為有機可乘，她卻認為職員因為少顧客，反而警覺性提高。李說，銀行每隔三個月會進行劫案演習，包括找人扮持刀或槍匪徒等。李提醒市民，如在銀行遇到匪徒打劫，可在安全情況下離開銀行及通知警方，若擔心離開惹怒匪徒，應盡量蹲下身，並匿藏在枱底保護自己，銀行職員會用不同方法盡快報警。  本報記者
20070414-6,20070414,6,百人搜山尋失蹤10日老翁家人打鑼呼喚　撿獲拖鞋,百人搜山尋失蹤10日老翁 家人打鑼呼喚　撿獲拖鞋 【本報訊】一名患有老年癡呆症的老翁，10日前離開西貢寓所後不知所終，連日來家人及警方搜尋並無所獲，昨日警方聯同民安隊出動百人，在西貢黃竹洋一帶山頭展開大規模搜索，僅發現老翁的一對拖鞋，至傍晚收隊亦未見其蹤影，生死未卜。 飲早茶後一去不返 失蹤老翁韋仁華，78歲，住在西貢沙角尾村一間村屋。據家人表示，韋翁為西貢原居民，早年移民英國其後回流本港，曾任職保安員，現已退休多時。他與妻育有三女一子，妻及兒媳亦住在沙角尾村另一村屋，對韋翁作出照顧。  家人又指，韋患有輕度老年癡呆症，但身體健康行動自如，離家外出後均能返家，但本月5日早上，他到西貢市中心飲早茶後一去不返，家人四處尋找至翌日仍未尋獲，於是到西貢警署報案。  警方及家人在西貢市區及麥理浩徑，曾張貼尋人告示，警方東九龍失蹤人口調查組跟進調查案件，西貢鄉村巡邏隊，連日來亦在沙角尾村附近搜索，家人與村民更合組搜索隊，並帶備銅鑼上山打鑼尋找他的下落，甚至搜尋到晚上8時才下山，但一直並無所獲。  直至昨日，警方聯同民安隊展開大規模搜索，早上11時，民安隊出動70多人連同20名警員，在竹洋路集合向黃竹洋山頭進發，並向馬鞍山及水浪窩尋找，主要往偏僻山徑及草叢搜索。而韋翁的兒媳亦拿着銅鑼上山，沿路打鑼呼叫家翁的名字。 警方呼籲提供線索 至下午1時，搜索人員在黃竹洋山上雷達站對開草叢，發現一對藍色拖鞋，經家人辨認後證實是韋翁之物，搜索人員於是集中該處一帶仔細搜尋，警方並出動搜索犬在場搜索，但至傍晚未有發現收隊離場。目前韋翁生死未卜，現場消息指，雷達站人員日前曾目睹韋翁出現，另韋翁的堂妹報稱前日在西貢大會堂，曾見過他及打招呼。  韋仁華身高約1.6米，肥身材，體重約68公斤，他圓形臉，頭髮稀薄呈灰白色，頸後生有一個約3厘米直徑肉瘤，失蹤時穿着深色外套及拖鞋。  警方呼籲任何人有韋仁華的消息，致電27032330或27032321，與東九龍失蹤人口調查組聯絡。
20070414-7,20070414,7,家人過份縱容　半數日子曠課逃學小精英唔想返學咬手自殘,家人過份縱容　半數日子曠課 逃學小精英唔想返學咬手自殘 【本報訊】一名小四精英班的9歲男生，本學年開學半年來一半日子曠課，老師及學校社工經跟進後，揭發這名生活在綜援家庭的男童，被祖母及父親過份溺愛，不是縱容他曠課，便是以金錢或玩具，作哄他上學的交換條件，以致男童變本加厲，幾乎日日賴床以求獲得「獎賞」，母親無法糾正亦採取放棄態度。昨晨學校老師及兩名社工專程上門「陪伴」他返學，幾經辛苦將他帶回學校後，男童情緒激動不斷用手拍打頭部及咬手自殘，校方擔心他有情緒問題，於是報警將他送院檢驗。　記者：劉永明 這名「曠課小精英」姓陳，9歲，與60餘歲的祖母、30餘歲的父母及一名12歲的胞姐，同住竹園南邨，陳童在邨內的浸信會天虹小學就讀四年班，一家五口靠綜援金生活。 教統局心理學家協助 校長梁步青對陳童的情況非常關心，亦感到好可惜。梁校長表示，陳童由一年級開始入讀，是一個既聰明又好學的學生，去年升讀四年級更被編入精英班，成績優異。可是開學一個月後他開始經常缺席，有時一星期只有兩、三日上課，校方經了解後認為原因是「屋企人在管教方面有極其嚴重的落差」。  梁校長指出：「嫲嫲好錫個男孫，可以任由佢唔返學，老師勸導時，老人家竟然咁話：『細路仔唔返幾日學冇所謂啦，做乜要搞到細路仔唔開心啫？』」至於陳童的母親，她曾經嘗試教導兒子，但反而被家姑及丈夫責難。梁校長形容她是一個「容易失望、容易放棄」的人，久而久之，便與家姑和丈夫一樣，也任由兒子賴床不返學，有時亦同樣以食物、打遊戲機等條件哄兒子上學，其中一次以100元「獎勵」兒子上學，在這情況下，陳童變得肆無忌憚，經常打罵母親、扯頭髮及擲物發脾氣。 大喊大叫扯母親頭髮 梁校長稱，陳童經常不肯上學，但返回學校又一切如常，與同學相處融洽，現階段還未知道陳童不肯上學的原因，可能是為了換取想要的玩具、可能是有某種心結，只是校方擔心他除此以外有情緒問題，已經通知教統局心理學家提供協助。  昨日是復活節長假期後第一日返學，一直關心陳童狀況的老師及兩名社工為免他躲懶，早上7時左右便到陳家準備接他上學，果然見他仍在賴床，各人着他起床上學時，陳童一度大喊大叫及扯住母親頭髮，結果擾攘了一個多小時才返抵學校。返校後疑陳童一直未能平復情緒，在課室內不斷用手拍打自己頭部及咬手，老師認為他表現不尋常，於是通知陳母及報警將他送院檢驗。 校長：咁落去好可惜 梁校長表示，校方現正努力為陳母提供協助，希望她能夠勸服家人減低教導的落差，否則「學校做幾多都冇用」。他說：「再咁落去，好好一個小朋友就咁就冇，實在可惜！」  陳童就讀的浸信會天虹小學，在小學界有相當知名度，自1997年起以全校主題式推行全方位學習，學校以環境教育作為中心，校內設有環境教育意識的設施，包括環境教育資源中心、園圃、太陽能熱水板等，並於2000年奪得綠色學校獎冠軍。 曠課男生情緒失控示意圖
20070414-8,20070414,8,新聞資訊研究組「多啲用腦會退化慢啲」,"新聞資訊研究組 「多啲用腦會退化慢啲」 近年不時有老年癡呆病患者失蹤事件，本港65歲以上的長者當中，估計有一成患有此症，即約6、7萬人。葵涌醫院老齡精神科顧問醫生余枝勝指，老年癡呆症屬於退化症，成因不明，患者缺乏一種名為乙酰膽鹼的神經傳遞物質，使患者失去判斷能力，不能照顧自己。 可改裝電話追蹤行藏 余醫生表示，長者每隔五年，患上老年癡呆症的機會便高一倍。要延緩衰退病徵，他建議長者多訓練腦力，「好似打麻雀、寫電郵，讀書同埋耍太極咁，多啲用腦會退化慢啲。」  私家偵探張大偉建議家人，可將長者的手提電話改裝成追蹤器，「改裝電話入面嘅程式，只要手機收到嘅地方，都可以知道佢喺邊，我哋嘅電腦會每三分鐘更新佢最新嘅位置。」這類追蹤服務的安裝費連月費約8,000元。香港老年癡呆症協會總幹事鍾愛英亦建議，家人可以將梳化等大型家具放於大門前，以減低長者外出的意欲。 防老人癡呆症患者走失小貼士 *將大型家具放於門口，減低長者外出意欲。如長者堅持外出，可提議其他活動分散其注意力    *請鄰居及附近商店協助，每當見到長者獨自外出，即通知家人    *為長者戴上印有地址及家人聯絡資料的手帶，方便路人或警方聯絡    *為長者的手提電話裝上追蹤器，可隨時知道其身處位置    資料來源：香港老年癡呆症協會總幹事鍾愛英及私家偵探張大偉"
