key,date,article_daily_id,title,text
20081119-219,20081119,219,交易障礙清除微軟有望收購雅虎,交易障礙清除 微軟有望收購雅虎 楊致遠下台，令微軟收購雅虎有機會死灰復燃，而且可以「執平貨」。RBCCapitalMarkets分析師桑德勒說：「楊致遠是上次交易未能成功的障礙。」 股價暴升18% 微軟為了在網上業務追上Google，今年初提出每股33美元（257港元）的高價收購雅虎，楊致遠以出手太低為理由拒絕。雅虎現股價不及當初微軟出價的1/3，GamcoInvestors的基金經理哈弗蒂認為，現在微軟可以提出每股15至18美元（117至140港元）收購雅虎。  微軟拒對楊致遠下台置評，微軟行政總裁巴爾默近周多次公開表示現在無意收購雅虎，但他上月曾提及，收購雅虎的搜尋業務會是個合理交易。  《華爾街日報》引述熟識巴爾默想法人士稱，巴爾默仍有意收購雅虎的搜尋業務，但有見現在經濟差，以及奧巴馬新政府上台後勢將撤換反壟斷官員，巴爾默暫採取觀望態度，不急於出手，可能等到雅虎找到新行政總裁，才再次提親。  投資者最現實，楊致遠下台的消息前天在美股收市後宣佈，雅虎股價在場外交易時段上升超過4%，昨日在德國法蘭克福股市，更一度暴升18%。  路透社/彭博通訊社/美國《華爾街日報》
20081119-220,20081119,220,金融海嘯下的日子……CEO獻計3000億救經濟,"金融海嘯下的日子…… CEO獻計3000億救經濟 美國失業大軍不斷增加，多家大企業的行政總裁促請候任總統奧巴馬上台後，盡快推出至少3,000億美元（2.34萬億港元）刺激經濟方案，金額越大越好，這樣才能刺激民眾消費。 搞基建創造就業 100名行政總裁參加《華爾街日報》舉辦的會議，就美國和環球經濟、能源和醫療護理四個範疇，向奧巴馬提建議。時代華納、高盛、Wachovia銀行的行政總裁，要求奧巴馬推出逾3,000億美元刺激經濟方案，短期可刺激民眾消費意欲。奧巴馬經濟顧問、前財長薩默斯（LarrySummers）早前也贊成推出極龐大金額的刺激經濟方案。  但與會的行政總裁都認為美國應與國際間協調推出刺激經濟方案，這樣才能令全球經濟復蘇。長遠而言，政府應大搞基建，製造更多就業機會，甚至贊成永久減稅和退稅。  美聯社/路透社"
20081119-221,20081119,221,法國上訴法院裁定新娘非處女不能毀婚約,法國上訴法院裁定 新娘非處女不能毀婚約 新娘不是處女，婚約可以作廢嗎？法國上訴法院裁定：不能。  法國一名30多歲回教徒工程師，前年7月和見習護士Y小姐結婚。  本來是喜事一宗，偏偏結婚當晚，新郎才發現新娘不是處女，新娘也才承認自己撒謊認處女，新郎覺得自己要娶的是一個處女，堅持那是新娘的「重要特質」，他一怒之下告上法庭，要求取消婚約。直至今年4月，杜埃法院裁定婚約無效，Y小姐欣然接受，雙方回復「單身」身份。 指處女非新娘「重要特質」 結婚不結婚，本是私人事，但這宗案件引起廣泛爭議，女權分子炮轟裁決規限女性自由，150名歐洲議會議員聯署指裁決不能接受，令案件呈交法國上訴法院重審。  上訴法院前日（周一）終於作出裁決──駁回杜埃法院准新郎以新娘不是處女為理由取消婚約的裁決，指是否處女跟新娘的「重要特質」無關，即使新娘存心欺騙，也不足以構成新郎取消婚約的理由。  根據法國民事法，只有配偶的謊話影響雙方關係，例如配偶真正身份等，才可宣告婚約無效。  裁決平息了公眾怒火，但案中男女主角的代表律師都表示，他們都想了結這段沒意思的婚姻，但不想辦理離婚手續。男方律師更強調，案件由女方違反婚約引起，欺騙男方與她結婚，與宗教信仰無關。Y小姐則說，不想再爭辯，只想繼續如常生活。  英國廣播公司/加拿大《環球郵報》
20081119-222,20081119,222,奧巴馬選定霍爾德黑人將首任司法部長,奧巴馬選定霍爾德 黑人將首任司法部長 美國候任總統奧巴馬（BarackObama）締造黑人入主白宮歷史，他的內閣也將為黑人參政揭開新一頁。有報道指他已選定資深黑人律師霍爾德（EricHolder）出任司法部長，若獲參議院確認，將成為美國首位黑人司法部長。  《新聞周刊》網站前天（周二）引述消息報道，霍爾德已接受邀請，奧巴馬過渡團隊正對他進行「人事審核」，但要等奧巴馬先宣佈最觸目的財長和國務卿人選，才宣佈他的任命。 克林頓時代重臣 57歲的霍爾德現為華盛頓一家律師行合夥人，早年在司法部任職律師，專處理公職人員貪腐醜聞，克林頓（BillClinton）主政時曾出任副司法部長。他和奧巴馬有多個共同點：都是黑人之子；都曾在哥倫比亞大學讀書；都有成功的法律事業；同樣愛打籃球和公共服務。兩人2004年認識後一見如故，他更為奧巴馬選總統當籌款員和策略顧問，又有份為他物色副總統人選。  司法部長人選來自克林頓班底，前第一夫人、克林頓妻子希拉莉（HillaryClinton）也是國務卿熱門人選。希拉莉已委派三名律師，讓奧巴馬團隊審核她夫婦的財務狀況。克林頓也提議一旦希拉莉出任國務卿，他會淡出向外國籌款的克林頓基金會運作，今後會將他的演講和收入來源預先知會國務院。法新社/中新社
20081119-223,20081119,223,聯合航空附加「真人服務費」,聯合航空附加「真人服務費」 油價高企，加上經濟不景氣，生意難做，航空公司為了生存不擇手段，除了徵收燃油附加費外，還不斷巧立名目榨取乘客，一向免費的服務現在都逐樣收費，最新招數則是「真人服務附加費」。  聯合航空（UnitedAirlines）宣佈，顧客今後不使用自動系統訂票，而要服務員代勞的話，將額外付款。USAirways則表示，指定座位──無論是要窗旁或是通道座位，都要額外多付5美元（39港元）。  美國紐約消費者保護委員會炮轟航空公司亂用創意，創作可笑的斂財藉口。  美國《紐約郵報》 各大航空公司掠水招數 ‧真人服務費（訂票不用自動系統，要服務員代勞）  ‧高大乘客費（要求坐經濟客艙頭一排或緊急出口旁較大空間的座位）  ‧行李寄艙費  ‧飲食附加費  ‧食物加熱費  ‧毛毯、枕頭附加費  ‧耳筒附加費
20081119-224,20081119,224,奧巴馬祖父被指食人族,奧巴馬祖父被指食人族 奧巴馬成為美國史上首位黑人總統，歐洲有些白人政客心存戒心，早前德國極右議員形容奧巴馬當選「是美國的猶太人和黑人大聯盟」，波蘭外長西科爾斯基（Radek　Sikorski）更指奧巴馬的祖父是食人族。  西科爾斯基在牛津接受過教育，又曾在美國居住，但早前在反對派議員恰爾內茨基網誌上，卻寫上「你知道麼？奧巴馬和波蘭有一點關係，他的祖父曾吃過一名波蘭傳教士」。波蘭外交部證實西科爾斯基說過這番話，但強調他無意侮辱奧巴馬，也「不會說帶種族主義的笑話」。  英國《每日電訊報》
20081119-225,20081119,225,日回收14萬含毒豆沙包,"日回收14萬含毒豆沙包 日本福岡縣直方市餅吉公司，宣佈回收14萬個豆沙包（圖），指豆沙包含有殺蟲劑殺螟松，有樣本濃度更高達百萬分之770，超標7,000倍。公司上月底接獲投訴，指豆沙餡變苦和有異味，於是展開調查，初步不排除遭人落毒。  新華網"
20081119-226,20081119,226,未來「第一千金」遊白宮,未來「第一千金」遊白宮 奧巴馬兩名寶貝女兒──10歲瑪利亞和7歲薩莎，前日（周二）獲邀訪白宮，在媽媽米歇爾和外婆陪同下，在現任總統喬治布殊第一孖女芭芭拉和詹納當導下，終於參觀了她們未來四年在白宮的睡房。  另外，米歇爾和奧巴馬都勤做運動。44歲的米歇爾原來晨早4時30分就起床做運動，每周做運動三天，每次90分鐘，愛玩舉重、跑步機、踏步機，鍛煉肌肉和心肺功能。47歲的奧巴馬「通常我會每周六天、每天45分鐘做運動。一天舉重一天鍛煉心肺。」他承認要做運動就要犧牲睡眠時間。  美聯社
20081119-227,20081119,227,索馬里海盜騎劫港登記船,"索馬里海盜騎劫港登記船 索馬里海盜成功騎劫歷來最大的戰利品──沙地阿拉伯超級油輪「天狼星號」後，前天（周二）再騎劫三艘船，包括一艘在香港登記的伊朗貨輪。 勒索「天狼星」船主7800萬 沙地官員截聽得知，海盜開天索價，向天狼星號的沙地船主，勒索至少1,000萬美元贖金（7,800萬港元），由於天狼星號載有總值1億美元（7.8億港元）原油，船主可能屈服。  天狼星號遭騎劫後，西方軍艦加緊在亞丁灣巡邏。索馬里海盜仍四出獵食，前天先騎劫了一艘在港登記、掛有特區旗的伊朗貨輪「Delight」號，劫走25名船員，但沒華人。  這是香港船隻三個月來第三度遭騎劫，海盜昨釋放了被劫持了兩個月的香港貨輪「大建」號，船上23名中國船員、1名香港船員和1名斯里蘭卡船員全部安全，送往阿布扎比。目前仍有一艘港船被挾持。  海盜之後又騎劫一艘泰國漁船和一艘希臘貨輪，挾持了約41名船員後，還企圖打印度隱形巡防艦主意，印軍開火擊沉一艘海盜船後，另兩艘海盜船才逃之夭夭。東非海員援助組織指：「海盜傳遞了一個重要訊息：『我們可以為所欲為，做一些出人意表的事。』」聯合國數字顯示，今年在索馬里被騎劫的65艘商船，共支付了3,000萬美元贖金（2.34億港元），現仍有17艘船約300名船員被挾持。  英國《每日郵報》/路透社/美聯社"
20081119-228,20081119,228,美華裔認偷售火箭技術,"美華裔認偷售火箭技術 美國68歲華裔科學家舒全勝（ShuQuan-sheng，圖），前日承認向中國出售液態氫推動火箭技術，指示員工偽造文件和賄賂中國官員，令他的科技公司取得氫液化器合約，獲利逾38萬美元（301萬港元）。舒明年4月判刑，最高可判監25年及罰款250萬美元（1,950萬港元）。  美聯社"
20081119-229,20081119,229,法落選議員殺情婦自殺,法落選議員殺情婦自殺 法國右翼執政人民運動聯盟的65歲國會議員德芒熱（Jean-MarieDemange小圖），疑因3月市長競選落敗，又與妻子辦離婚，情緒受困擾，前日在寓所（圖）與46歲情婦激烈爭吵，虐打和槍殺她後再吞槍自殺。  法新社
20081119-230,20081119,230,澳女手術蘇醒歷劏肚痛楚,澳女手術蘇醒歷劏肚痛楚 手術期間突然清醒會有甚麼感覺？澳洲24歲女子瓊斯（RebeccaJones）說：「我感到醫生劏開肚子的痛楚。」 使勁掙扎卻無法動彈 駭人手術上月中發生。瓊斯到北領地的艾麗斯斯普林斯醫院割膽石，但醫生還未動手，瓊斯就蘇醒了，偏偏麻醉藥繼續令她動彈不得，既睜不開眼睛，也叫喊不出來。  「我以為手術完了，後來才知是另一回事。」醫生劏開她的肚子，瓊斯痛得要命，惟有使勁掙扎引人注意，但最終只能動動手掌，醫護人員卻說：「她的手移動了。」手術繼續進行。  手術完了，噩夢未完。五天後，醫院通知瓊斯胃部有血管被縫合了，要再開刀，瓊斯嚇得慌，仍得硬着頭皮重返手術台，但要媽媽在場，確定她被麻醉後才動手術。  醫院報告顯示，第二名麻醉師發現藥力不足後曾作出調整，醫院經理泰勒也承認瓊斯手術期間曾蘇醒，但否認醫護人員知道她感到痛楚。  瓊斯直斥醫院說謊：「醫生說心臟儀器狂響，含氧量極低，血壓非常高，有人更向我丈夫表示，我幾乎死在手術台上！」瓊斯指她不能工作，又嚴重失眠，考慮控告醫院疏忽。  澳洲《凱恩斯郵報》
20081119-231,20081119,231,加州山火焚毀1000房屋,"加州山火焚毀1000房屋 美國加州山火開始受控，數以百計居民前日返回家園，視察損毀情況。當局出動搜索犬，在流動屋區檢查是否有人被燒死。山火燒毀約1,000間房屋和142平方公里林木，由於空氣污染嚴重，火場附近數十間學校仍要停課。  美聯社"
20081119-232,20081119,232,美國灰姑娘遭姨媽性虐待,"美國灰姑娘遭姨媽性虐待 童話故事中，灰姑娘遭後母虐待，相當悲慘。現實世界裏，美國麻省也有一個灰姑娘，五年來遭姨媽虐待，當表姊妹生活舒適，她卻住在簡陋小斗室，要負責所有家務，還遭性侵犯。 玫瑰花莖　雪藏熱狗毒打 這個灰姑娘，現年16歲，跟35歲姨媽埃斯科瓦爾（MaraEscobar）一家住在麻省伍斯特。但同一屋簷下，姨媽不當她是自己人。她的表姊妹的睡房裝修豪華，掛滿搶眼海報，又裝設電視、遊戲機、錄影機和各樣玩具。她呢，住在另一間簡陋小斗室，內裏只有一張小床，單薄的被褥和殘舊衣櫥。  住不好，姨媽還當她是工人，要她負責所有家務，更無所不用其極凌虐她，用有刺玫瑰花莖和雪藏熱狗打她，用硬物性虐待她。去年6月至9月，她又被拳打腳踢，摔倒在地，雙眼瘀黑，手腕扭傷，她忍無可忍，向社工求助，警方拘捕了她姨媽。警方形容，受害少女遭遇似足灰姑娘，正控告她姨媽襲擊和性侵犯兒童罪。狠毒姨媽准以25,000美元（193,740港元）保釋，她否認虐待姪女，反指她有問題。  美聯社"
20081119-233,20081119,233,一個人一個故事：一張照片助剛果女孩尋母,"一個人一個故事：一張照片助剛果女孩尋母 剛果的基旺加戰火連天，11歲小女孩Protegee從村莊逃難出來後與母親失散，在茫茫人海中尋母，找了三天也找不到，她揹着3歲姪女Reponse禁不住拉起污衣,抹眼淚，她用骯髒衣袖擦淚的一刻，被美聯社記者廸萊拍攝下來。 世界各地數以百計讀者看過照片後為之動容，齊聲要助她尋母。廸萊於是重回基旺加尋找Protegee二人，途中他在聯合國臨時搭建的營地遇見一名女子，打探之下原來她認識Protegee二人，也認識她媽媽。媽媽叫埃斯佩朗斯，法文意思是希望。人間總有希望，她身在基旺加一間教堂避難，廸萊終於找到她，把她女兒的照片給她看，翌日駕車載她和Protegee團聚。  美聯社"
20081119-234,20081119,234,出生一年已花936萬早產嬰16歲了,"出生一年已花936萬 早產嬰16歲了 香港「風之后」李麗珊說過，要養大一個小朋友，要400萬港元。英國一個16歲少女，單在出生的頭一年，就花了120萬美元（936萬港元），因為她當時早產17周，醫院要用昂貴的藥物和醫療設備來治療她。  現時長得亭亭玉立的美少女黑莉（HaileyJames-Gannon），剛慶祝16歲生日，但1992年她幾乎是活不成。當年父親詹姆斯－－甘農（KeithJames-Gannon）與母親葆拉（Paula）到美國佛羅里達州旅行時，葆拉懷孕僅23周的黑莉急不及待要來到人世，黑莉出世時只重1.65公斤，耳朵未發育，肺和胃的功能仍未完全發展。 每日藥費7800港元 虛弱的黑莉要躺在奧蘭多醫院的保育器吊命，頭兩個月父母絕不能觸碰她，以免黑莉感染細菌。要維持一這早產嬰的生命，醫藥費不菲，單是用抗生藥每日要1,000美元（7,800港元）。黑莉的醫藥費最後埋單要120萬美元，都是用父母投保的96英鎊旅遊保險支付。一年之後，黑莉出院了，活得健健康康，四歲還在廣告童星比賽中入圍決賽。  養大女兒費用高昂，葆拉不時會說笑叫黑莉「回水」，實際她認為當年所花的是值得，而且還感激佛州奧蘭多醫護人員的悉心照顧。每當她談到女兒當年與死神搏鬥，她都會熱淚盈眶。  英國《每日電訊報》"
20081119-235,20081119,235,QE2退役泊杜拜改成酒店,QE2退役泊杜拜改成酒店 英國郵輪「伊利沙伯二世號」（QE2）航行近40年後，下周三終告退役，新船主稱會將郵輪改裝成豪華海上酒店，停泊在杜拜朱邁拉棕櫚島東部，與當地繁華的旅遊業互相輝映。  郵輪1969年首航，曾接載數百萬名遊客，是全球仍在航行的最舊式郵輪。但郵輪終究要休息，新船主杜拜世界（DubaiWorld）計劃將它大改成餐廳、酒店房間、商舖及劇院，讓遊客繼續在郵輪上耍樂，並設歷史博物館，展示郵輪的藝術品及其他航海展覽品。  郵輪會有天橋連接岸邊，新船主承諾會保留郵輪珍貴歷史遺蹟。郵輪下周會在英國皇家海軍護衞艦帶領下，抵達杜拜拉希德港（MinaRashid），杜拜則出動帆船、小船及單桅三角帆船艦隊迎接，稍後再駛往棕櫚島東部長駐。  英國《每日電訊報》
20081119-236,20081119,236,英禁與被操控妓女交易,英禁與被操控妓女交易 英國內政部新法出台，嫖客若跟遭扯皮條、人肉販子和妓寨操控的妓女交易，將要留案底和罰巨款；若跟被迫販賣到英國的妓女性交，可能被控強姦。但娼業仍不會列為非法。  英國《每日電訊報》
20081119-237,20081119,237,Vavelta美容極品來自嬰兒包皮,"Vavelta美容極品來自嬰兒包皮 新生男嬰割下的包皮，通常被當作醫療廢物處理，但英國生物醫學公司Intercytex就視它為美容極品，將包皮培植成可提供骨膠原的纖維原細胞，即使滿臉粗糙皺紋或暗瘡凹洞，一經注射都可回復皮光肉滑，而且永久有效。  新藥名為Vavelta，由經酵素處理的小塊包皮提取而成，每瓶呈透明液體狀，注射後可由內至外修復老化或受損肌膚。居於柴郡的44歲離婚婦人莫莉森，因臉龐佈滿凹洞而信心盡失，今年5月她孤注一擲，給雙頰各捱一針，8月再接受療程，皮膚終回復細緻和彈性。  要漂亮便要付出代價，新藥每針收費750英鎊（8,749港元），比打Botox的250英鎊（2,921港元）貴得多，而且要一個月後才見效，但莫莉森非常高興，她說：「我覺得治好八成了，感覺很自由，還重新約會呢。」  英國《每日郵報》"
20081119-238,20081119,238,意總理扮鳥叫嚇默克爾,意總理扮鳥叫嚇默克爾 意大利總理貝盧斯科尼周二和德國總理默克爾舉行峯會，但竟匿藏起來，到默克爾走下專車進入峯會會場，他才從燈柱後面跳出來，嘴裏還學着布穀鳥「咕咕叫」，逗得默克爾很開心。  新浪網
20081119-239,20081119,239,8貓狗減肥要瘦掉1個碧咸,8貓狗減肥要瘦掉1個碧咸 英國學童有肥胖問題，貓貓狗狗也一樣圓碌碌，動物慈善組織PDSA於是成立「寵物瘦身會」，找來八隻國內最具噸位的貓狗，齊齊參加百日瘦身大計，既吃瘦身餐，也勤做運動，誓共減去74公斤，重量等同萬人迷球星碧咸的體重。  八隻貓狗全部超重三成，共重191公斤，13歲大貓廷克斯（Tinks）更誇張，六年前做流浪貓時已重逾11公斤，雖獲主人布賴恩悉心照料，但只減掉逾1公斤，繼續超重96%。PDSA獸醫溫斯利說，「瘦身會」鼓勵主人注意寵物的生活習慣，「很多主人既給寵物吃正餐，又給牠們吃芝士、牛油多士和餅亁，是過份溺愛牠，寵物若缺乏運動，更容易患長期疾病」。  寵物減肥，主人有獎。PDSA表示，減得最多和養成最佳飲食習慣的寵物，可贏得「PDSA寵物瘦身會冠軍」，主人則可與寵物一起去度假。  英國《每日電訊報》
20081119-240,20081119,240,切尼被控「有組織犯罪」,切尼被控「有組織犯罪」 美國德州南部華萊士縣一個大陪審團，周二入稟起訴副總統切尼（圖左）和前司法部長岡薩雷斯（圖右）從事「有組織犯罪活動」。案情指，切尼投資的基金公司，私營了一所監獄，監獄前年有囚犯被打死，因切尼關係，岡薩雷斯阻止調查這宗囚犯死亡案。  美聯社
20081119-241,20081119,241,市場佔有率減下月裁員一成解困,"市場佔有率減 下月裁員一成解困 楊致遠成功擊退微軟的敵意收購，但與Google的廣告合作協議月初告吹，加上金融海嘯衝擊，令雅虎陷入困境。分析認為雅虎高層應大換血，集中發展受年輕人歡迎的服務。 裁減人手及開支 自從Google面世後，雅虎的巿場佔有率不斷被蠶食，由去年10月的21.65%跌至上月的18%以下。雅虎今年5月拒絕微軟敵意收購後，曾與Google達成廣告合作協議，希望每年增加4.5億美元（35.1億港元）的收益，但美國司法部威脅控告兩間公司壟斷巿場，Google打退堂鼓，令雅虎今年第三季盈利僅5,430萬美元（4.2億港元），比去年同期下跌64%。  分析家指，楊致遠黯然離職，反映靠內部管理層進行救亡的行動失敗，因此雅虎必須撤換整個管理層，向外招聘行政總裁，為公司帶來新希望。市場盛傳熱門人選為AOL前行政總裁米勒、新聞集團營運總監徹寧和eBay前行政總裁惠特曼等。  雅虎也要節流。首先應集中資源在最受歡迎的服務，例如YahooNews、YahooSports、電子信箱YahooMail，和照片分享網站Flickr等。此外，雅虎現有14,300名員工，早前已宣佈會在下月裁減一成人手，各部門也必須削減預算。  英國《衞報》/gigaom.com"
20081119-242,20081119,242,失業漢掛「不日瞓街」牌搵工,失業漢掛「不日瞓街」牌搵工 要尊嚴還是要食物？失業九個月的納夫羅茨基（PaulNawrocki）選了後者。為了盡快找到新工，他近日捨棄尊嚴，掛着廣告牌，在紐約街頭向人派履歷表。 妻長期患病女兒剛畢業 59歲的納夫羅茨基，原是玩具業老行尊，是公司管理層，但經濟不景，今年2月遭裁掉，一直找不到工。失業了，妻子又長期患病，女兒才剛剛大學畢業，未付賬單一大叠，剩餘失業救濟金撐不到一個月，馬死落地行，他惟有穿上整齊西裝，背着寫上「不日瞓街」的三文治式廣告牌，在街上找工。  背了數天後，開始有些反應，有招聘者約他面試。《商業周刊》和英國廣播公司都有報道他的故事，途人大都同情他，鼓勵他努力，也有人看見他後一臉惶恐，但不是害怕他，「他們好像在想：『會走到這一步嗎？會發生在自己身上嗎？』」此時此刻，天曉得！  美聯社
20081119-243,20081119,243,基因似人類袋鼠或源於中國,"基因似人類袋鼠或源於中國 澳洲科學家首次破譯袋鼠的基因圖譜，赫然發現牠們的基因跟人類相似，相信兩者是有着共同的祖先，並相信袋鼠的起源地不是澳洲，而是中國。  澳洲袋鼠基因圖組優越中心科學家破譯袋鼠基因圖譜後，發現袋鼠和人類有着相同的基因，而很多基因是同一排序，令他們相信人類和袋鼠在1.5億年前是有着共同祖先，正等於人類和老鼠在7,000萬年之前也是有共同祖先，之後基因出現變化，形成兩種截然不同的動物。  科學家相信破譯袋鼠的基因圖譜，有助了解每條基因的運作，從而知道某條基因變異會產生甚麼基因疾病，也可從中了解人類是如何演進出來。  袋鼠是澳洲獨有的動物，但科學家相信，袋鼠本來是在中國演進出來，之後遷徙到美洲，再遷到澳洲和南極洲。  路透社"
