key,date,article_daily_id,title,text
20080818-0,20080818,0,霍老爺霍啓剛雙雙默認婚事北京直擊　郭晶晶等做豪門金牌新抱,"霍老爺霍啓剛雙雙默認婚事 北京直擊　郭晶晶等做豪門金牌新抱 26歲的跳水女王郭晶晶，前晚在奧運女子3米板摘金，盛傳今次將是郭晶晶最後一跳，之後她將退役下嫁29歲霍家大公子霍啓剛。親睹女友摘金過程的霍啓剛，前晚表現得相當興奮，對結婚傳聞，霍啓剛及準老爺霍震霆均未有否認，看來郭晶晶嫁入豪門日子將不遠矣。 郭晶晶前晚在北京水立方進行女子3米板決賽，獲男友霍啓剛一家到場打氣。其中霍啓剛母親朱玲玲早於晚上7時許拿着攝影器材到達會場，準備為未來新抱影靚相。繼而霍啓剛於8時15分抵達，本報記者問他可有信心女友摘金時，霍啓剛笑說：「有，應該會贏。」對於二人賽事後結婚傳聞，霍啓剛未有否認，只笑說：「呢啲我唔答你啦。」沒多久，霍啓山亦匆匆趕至，以行動支持未來大嫂。 激讚女友 「最後一跳非常完美」 郭晶晶憑着出色表現撼低一眾對手，蟬聯奧運女子3米板冠軍，成功為中國取得今屆奧運第35面金牌。親睹女友奪金過程的霍啓剛，全程表現得既緊張又興奮，賽後他被內地傳媒包圍追訪，在談到觀戰心情時，霍啓剛坦言：「很激動，也很緊張，因為另一位俄羅斯選手的表現同樣十分出色。不過，最後她還是發揮出了很高的水平，很開心。」  對於郭晶晶表現，霍啓剛讚不絕口：「晶晶今天的表現非常穩定，對手很強。晶晶的第一跳完成得非常好，而最後一跳也非常完美。她的優勢就在於穩定，這是她獲勝的關鍵。」問會否跟女友慶祝時，霍啓剛大笑起來：「還沒想過。」霍啓剛還透露，他事前並沒有告訴郭晶晶到場觀戰，而為了備戰今次奧運，他已有好一段時間沒跟女友見面，言語間盡顯相思之苦。 設宴慶功 「約成班運動員飲嘢」 霍啓剛、朱玲玲、霍震霆和霍啓山，於前晚10時20分左右乘坐奧運專車離開水立方，準備返回下榻的北京飯店，當朱玲玲發現記者拍照時，即顯得十分避忌的左閃右避。  郭晶晶前晚奪金，由準老爺、港協暨奧委會會長霍震霆親自頒獎，別具意義。霍老爺昨日接受本報記者電話訪問，大讚未來新抱郭晶晶說：「運動員為國爭光當然係好，佢都表現得好好，同埋呢面金牌好有意義，當時我啱啱睇完羽毛球（林丹奪得金牌），都已經打破咗上屆金牌總數，加埋佢呢一面，更加有意義。」  昨日商台節目中，指霍震霆前晚在北京雙子座大廈的「蘭會所」為郭晶晶舉行慶功宴，霍震霆說：「成班運動員一齊出嚟飲嘢，都係自己啲朋友。」郭晶晶開心嗎？他說：「冇，邊有佢？」外間盛傳郭晶晶圓滿奪金後，將退役收山下嫁霍啓剛，霍震霆聞言即大耍太極說：「你估我會唔會答你呢？我啱啱落機，今晚有馬術活動要去，好喇，我講咗好多，多謝你。」  採訪、攝影：曾小嘉（北京）、林妙萍（香港） 小八卦：黃曉明擁賀霍啓剛 內地男星黃曉明前晚到了水立方欣賞郭晶晶比賽，他更在場內與霍啓剛相遇，二人對郭晶晶成功奪冠都十分興奮，相擁互相祝賀，二人更齊齊目睹郭晶晶站上頒獎台。在觀賞完賽事後，黃曉明於10時許離開場館，不少Fans和傳媒認出他，蜂擁而上，嚇得他一支箭跑向場館的職員通道離開。事後黃曉明接受了記者訪問，他大讚郭晶晶說：「她是一個很好的運動員，為國家爭光不少。」 小八卦：朱玲玲掛夫姓通行 朱玲玲連日來到水立方見證準新抱仔郭晶晶奪金一刻，帶備長鏡頭攝影機，除了拍下晶晶的跳水英姿，更在場館內四處拍照。朱玲玲掛上的通行證，原來繼續用其前夫霍震霆的姓氏，英文名字寫上LolettaFok，相信是方便進出北京各奧運場館，拍到心目中的理想照片。 小八卦：法國藝術融入飲食 前晚霍霆霆宴請運動員的食肆，是位於北京朝陽區雙子座大廈的「蘭會所」，於2006年底開業，佔地6,000平方米，屬餐飲集團俏江南旗下，集藝術、生活、飲食於一身。蘭會所用數千萬請來世界著名的法國設計師PhilippeStarck操刀，整層有餐廳和35間VIP房，整個佈置糅合了法國浪漫風格，以紅色厚重帷幔和水晶吊燈為主，還有號稱世界上最長的四張、共70米長的餐桌。 小八卦：257萬港人撐晶晶 中國跳水女王郭晶晶前晚在水立方衞冕成功，在3米彈板賽事上再添一面金牌，兩電視台直播整個過程，無綫這個時段收視最高29點（182萬觀眾），平均28點（約176萬觀眾），僅次於中美籃球賽事，亞視則最高12點（75萬觀眾），平均10點（62萬觀眾），全港同時有257萬人欣賞郭晶晶奪金。"
20080818-1,20080818,1,回巢無綫　夥毛毛呵護欣宜何守信入行37年首拍處境劇,"回巢無綫　夥毛毛呵護欣宜 何守信入行37年首拍處境劇 有「金牌司儀」之稱的何守信，雖然年屆68，但仍勇於接受新挑戰，繼早年為亞視擔任新聞主播後，下月將回巢無綫參演全新處境劇，跟毛舜筠、鄭欣宜和吳君麗鬥戲。今次除是何守信投身娛樂圈37年以來首次拍攝處境劇外，據知他將以輕鬆搞笑演繹方式，為觀眾發放笑彈。 移居加拿大多年的「金牌司儀」何守信（何B），近日由加國回流香港，為香港電台主持奧運節目外，更準備重返無綫，與故友肥姐沈殿霞的愛女鄭欣宜、吳君麗和毛舜筠（毛毛）等人，合作拍攝新輕鬆搞笑處境劇。 留港一年 「我鍾意新挑戰」 現年68歲的何B，70年代開始效力無綫，擔任摔角比賽評述，多年來雖然也曾參演劇集，如76年與石修和江毅合演的電視劇《龍虎豹》，不過多年來何B大都以主持《歡樂今宵》及司儀工作為主，今次何B挑戰拍攝處境劇，更是他入行37年來破天荒的第一次。  記者昨日致電何B查詢其新動向時，他大方承認稍後會為無綫拍攝處境劇，他說：「做電視咁多年，都知道拍劇（指一般劇集）好辛苦，所以未必有興趣，但拍處境劇唔同，比較輕鬆啲，壓力冇咁大。拍劇我以前都有拍過，但我比較鍾意新挑戰，好似之前亞視叫我做新聞或者《開心大發現》咁，我未試過，都嘗試咗，今次我覺得幾有新鮮感。其實我喺加拿大嗰邊嘅時候，TVB已經有搵我返去幫手拍劇，加上今次合作嗰班演員都好熟，所以咪試吓囉。」  今次處境劇乃肥姐沈殿霞愛女鄭欣宜的處女作，何B跟肥姐份屬多年好友，今次他離開無綫10多年後重返娘家拍攝處境劇，會否是以世叔伯身份助欣宜一把？何B聞言即說：「你哋唔好亂估，我拍處境劇嘅原因淨係我之前講咁多，冇其他原因。」何B表示預計留港一年拍處境劇，而太太陳麗斯則會跟他一樣加港兩邊走。  何守信參演的無綫新處境劇由曾勵珍與羅鎮岳監製，暫定260集，無綫將揀選中環一條街道作為劇名，故事以中環一間名為「潮」的雜誌社作背景，並沿用大部份《同事三分親》演員，包括江欣燕、王祖藍、徐榮、黃子雄和郭少芸等。 下月推出 飾毛舜筠父親 該劇下月推出，何B飾演一個酒吧老闆，也是雜誌社高層毛舜筠和黃子雄的父親，而吳君麗則飾演欣宜的姑媽，江欣燕扮演黃子雄的女友。記者昨日致電向羅鎮岳了解新處境劇的進展時，他只說：「我哋係搵何B演出，但好多細節仲未定，暫時唔方便透露。」  採訪：林妃 人物誌：金牌司儀瓣數多 現年68歲的何守信早年曾在香港浸會大學任職體育科助教，71年由鍾景輝介紹為無綫兼職擔任摔角等體育節目旁述員，翌年正式加入無綫成為合約藝員，主持長壽節目《歡樂今宵》，73年起連續15年擔任港姐及無綫大騷主持，有金牌司儀之稱。90年初何守信移民加拿大，數年後回流返港主持亞視節目《今日睇真D》，又曾與朱慧珊一同擔任亞視新聞主播，但行內人批評頗多，05年主持的《開心大發現》雖較受歡迎，但聲勢已不復當年，不久後他又返回多倫多，直至近日再返港。  此外，何守信75年與歐嘉慧離婚後，曾與汪明荃相戀多年，之後與歌手陳麗斯同居，近年二人才結婚。 娛樂資料庫：處境劇收視靈藥 何守信下月將首度挑戰處境劇，其實無綫自81年播出《香港八一》系列起，從未間斷製作處境劇集，因此類劇集透過角色日常生活諷刺時弊及反映社會百態，容易引起觀眾共鳴，收視向來不俗。    劇集：《男親女愛》  演員：鄭裕玲、黃子華、鄧健泓  最高收視：49點    劇集：《真情》  演員：李司棋、薛家燕  最高收視：41點    劇集：《同事三分親》  演員：關詠荷、江欣燕、金燕玲  最高收視：37點    劇集：《皆大歡喜》  演員：薛家燕、廖碧兒、林文龍  最高收視：36點    劇集：《高朋滿座》  演員：鄭丹瑞、伍詠薇、鍾景輝  最高收視：32點    備注：每點收視約63,000觀眾  資料來源：《蘋果》資料庫"
20080818-2,20080818,2,薛凱琪秘製公仔麵,薛凱琪秘製公仔麵 薛凱琪（Fiona）和周柏豪昨日到淘大商場出席商台活動，並用調酒器調製新飲品，其間他們拋起調酒器，Fiona有點雞手鴨腳，周柏豪就似模似樣，Fiona說：「我好鍾意研究新菜式，近來自己試吓調醬整公仔麵。」  Fiona又表示有次到台灣宣傳，上了徐熙媛（大S）的節目下廚，她說：「之前臨急抱佛腳睇媽咪整甜酸大頭蝦，之後喺節目度同F.I.R.嘅Faye一齊煮，好彩出嚟都好味。」周柏豪則踢爆Fiona論盡，他說：「早排成班同事一齊BBQ，佢搽晒蜜糖將啲食物四圍fing，又喺其他人嘅頭頂度過。」  採訪、攝影：藍文浩
20080818-3,20080818,3,何B遇阿姐：冇問題,何B遇阿姐：冇問題 獲冠「金牌司儀」美譽的何守信（何B）近日忙於為港台擔任奧運節目主持，昨日何B接受商台電話訪問，他透露完成奧運工作後便接拍無綫處境劇。今趟返港工作，他表示太太陳麗斯沒有給他任何意見，但間中會來港探班。 視乎合作形式 年頭返港婉拒了擔任《亮相》主持，何B解釋因當時製作不適合他，相反處境劇較輕鬆，適合自己的年紀應付。談到重返無綫有可能與舊愛汪明荃碰面，何B即說：「唔知呢！或者啩，咁又點呢？冇問題㗎，撞到邊個都冇問題。正如我喺街撞到歐嘉慧（前妻）都會打招呼，以前係做過朋友，但見到冇乜事㗎。」會否與汪明荃一齊工作，他表示要看工作形式才決定。  今屆奧運主持屢遭批評，何B表明十幾年前已經決定不對同行提出任何意見，他只覺得當主持要做到三點，就是經常照鏡、經常有自知之明及睇自己表現如何，兼且不要講太多閒話及拋書包。  採訪、攝影：馬建華
20080818-4,20080818,4,江若琳學費斯練氣,江若琳學費斯練氣 江若琳昨日到新城電台接受訪問，她表示近日都有在家觀賞北京奧運的比賽項目，前日也有欣賞美國游泳選手費斯（MichaelPhelps）圓其奪8金的美夢，她自爆欣賞賽事後，自己都想游水，她笑說：「佢又靚仔又型仔，睇完我都即刻去私人會所游水，因為自己就嚟有騷，要跳舞唱歌，所以游水練氣。」 沙灘恐懼症 江若琳坦言自己有沙灘恐懼症，所以她不會到沙灘暢泳，她說：「沙灘個感覺深不見底，因為以前睇過啲尼斯湖水怪嘅電影，令到自己有陰影，到𠵱家都克服唔到。我平日游水唔會着比堅尼，都唔會同男仔一齊去，因為咁會覺得好尷尬，好多時我都只係着一啲好老套嘅泳衣。」  採訪、攝影：駱華齡
20080818-5,20080818,5,張達明擺李亞鵬上枱,張達明擺李亞鵬上枱 張達明昨日到奧海城為下月舉行的棟篤笑騷《人仔無敵》舉行簽名會，其間播出主題曲MV。  問張達明在騷中會否以藝人作話題？他笑說：「冇人走得甩，會講李亞鵬叉記者頸件事，連梁展文都會講。」會否如詹瑞文般有多個造型？他透露不會有太多，但會有煞食造型。  黃子華同樣在下月舉行棟篤笑，不怕互相搶客嗎？張達明說：「其實大家唔同，我都呼籲大家捧子華場。」  撰文：李全
20080818-6,20080818,6,不滿師妹36D搶風頭戴夢夢寸趙碩之「咁大份」,不滿師妹36D搶風頭 戴夢夢寸趙碩之「咁大份」 趙碩之和戴夢夢昨日在無綫參加遊戲節目《筋肉擂台》，擁有36D上圍的趙碩之以低胸小背心襯短褲上陣，搶走師姐戴夢夢風頭，當兩人扮對打時，夢夢竟暗嘲師妹：「佢咁大份，大佬！」趙碩之只好尷尬附和，自認大隻妹。 戴夢夢昨日以大師姐身份率領一班師妹趙碩之、麥雅緻和Yumi到將軍澳電視廣播城參加遊戲節目《筋肉擂台》，一身低胸裝和熱褲的趙碩之大搶僅穿T恤的師姐夢夢風頭。  身材豐滿的趙碩之拍照時猛俯身，即時成為鏡頭焦點，及後當她和夢夢應記者要求扮對打時，夢夢即衝口而出說：「佢咁大份，大佬！」似乎暗嘲上圍有36D的趙碩之大份兼阻碇，在旁的趙碩之只好尷尬附和，自認大隻妹。 拍電影弄瘀雙腿 趙碩之表示今次是第一次參加遊戲節目，服飾方面也是公司安排，所以她沒有準備T恤，不過為免走光，事前已做足安全措施，她說：「我有貼乳貼，同埋戴運動型嘅胸圍。」她又透露早前拍攝獨立電影《愛到發燒》中一幕推梳化的戲份時，弄得雙腿滿佈瘀痕 夢夢真空影封套 戴夢夢被問到被師妹搶盡風頭時，她說：「新人應該㗎，咁公司先百花齊放，雖然佢只係細我三年，但我覺得自己越嚟越老。大嘅係我，係年資大，但身材就唔係。」夢夢還透露在唱片封套中將大改形象，她說：「到時我會真空上陣着大露背衫，但唔會刻意豐胸，公司太多勁人，自己唔係好有料，唔使刻意整大啲。」  採訪：駱華齡  攝影：陳俊強
20080818-7,20080818,7,馮仁昭四圍超：即日往返台灣　黎明肉體支持光良開騷 - 馮仁昭,馮仁昭四圍超： 即日往返台灣　黎明肉體支持光良開騷 - 馮仁昭 馬來西亞歌手光良嘅巡迴演唱會，尾站已訂好11月15日喺台北小巨蛋舉行，仲改咗名做「光良第一次台北演唱會」，佢噚日邀請咗黎明嚟台北撐場，佢哋兩個一見面就熊抱，老友鬼鬼。  黎明喺會上特登頒咗支旗畀光良，祝佢演唱會成功，佢哋仲將旗插喺小巨蛋嘅模型上，代表光良嘅演唱會可以傲視同群，旗開得勝。  黎明呢次咁畀面即日來回港台兩地撐場，全因佢好鬼欣賞光良之故，佢提到有一次同工作人員去唱K，聽過光良嘅《第一次》後，大讚好聽，之後佢每次去卡拉OK都要點嚟唱，黎明仲用普通話話：「光良是我的好朋友，得知他要開演唱會，不只精神上要支持他，肉體上也要百分之百的支持，所以特地從香港飛到台灣替他加油打氣。」 提阿扁火滾 識英雄重英雄嘅光良都好感謝黎明，佢哋因為《第一次》呢首歌結緣，其後因為李宗盛介紹認識，光良又話：「我的第一場演唱會在香港紅館，門票開賣六天賣完，那時黎明跟我說：『光良，我們成功了！』這句話讓我非常的感動，而且我的第一場演唱會有黎明助陣，所以08年壓軸演出，一定也要邀請黎明來分享我的喜悅。」  此外，對於台灣前總統陳水扁海外洗錢案曝光，每年喺台灣交稅約25萬港元嘅光良，同普羅大眾一樣好震怒，佢噚日話：「很生氣，我有台灣居留證，除繳稅外，被開罰單也要交罰金。」光良也認為陳水扁洗錢金額，應該比目前調查嘅仲多。」  此外，活動主持黃子佼追問黎明同女友樂基兒嘅結婚傳聞，黎明大耍太極：「我來台灣的目的只有光良、小巨蛋。」
20080818-8,20080818,8,馮仁昭四圍超：陳奕迅懶理偷食緋聞 - 馮仁昭,馮仁昭四圍超：陳奕迅懶理偷食緋聞 - 馮仁昭 陳奕迅（Eason小圖）近日喺台灣宣傳國語碟，卻被偷拍到身邊有辣妹陪伴在側，仲俾人影到佢哋一齊返回下榻嘅台北商旅飯店，被懷疑有背妻徐濠縈偷食之嫌。據知同行艷女其實係台灣環球唱片國語部電台宣傳人員許家菁（圖），佢一向鍾意火辣打扮，佢話呢件事之後已經同Eason道歉，仲話自己以後會着得檢點啲，避免引起誤會。Eason則輕鬆面對緋聞，佢話：「我也只需要對一個人交代，就是我老婆。」
20080818-9,20080818,9,叛逆賀軍翔父親棒球棍侍候,叛逆賀軍翔 父親棒球棍侍候 賀軍翔（小美）昨日在荃灣一商場出席「Teen王補習班」活動，並客串擔任教官。小美的出現吸引近400名fans圍觀，他在台上教五名fans玩運動以及用普通話念急口令，最後更送上擁抱，令fans非常滿足。 弄得手臂瘀青 小美接受訪問時透露國中時是一名叛逆少年，曾給爸爸用棒球棍打，他說：「我當時頂嘴，老爸原本想用球棍嚇我，我卻用手格着，結果弄到手臂一片瘀青。」對於台灣男星阮經天人氣急升，賀軍翔表示不擔心被他搶風頭，他說：「大家類型不一樣，希望有更多不同的演員冒起。」  採訪：何永寧  攝影：黃偉雄
20080818-10,20080818,10,徐子珊拍劇錯失奧運,徐子珊拍劇錯失奧運 徐子珊昨日到天水圍出席「划艇競技同樂日」，與小朋友在巨型水池中踏水上單車。近日忙於拍攝無綫劇集《美麗高解像》的她差不多跟奧運絕緣，難得今次參與跟運動有關的活動，令她非常興奮。  子珊透露很容易暈船浪，平日拍出海鏡頭都要吃暈浪丸、戴暈浪帶和黐暈浪貼。談到奧運熱席捲全城，子珊自言是落伍一群，因拍劇錯失多場精采賽事，每次都要從朋友口中得知賽果和看重播。對於葉翠翠被抽出奧運黃金時段，她說：「有咁嘅事？唔係呀？係公司安排，可能因某啲原因，內容就唔知。」 無緣參與主持 至於部份主持屢次出錯遭網民批評，子珊說：「以我所知每次都係公司安排主持，上屆奧運我啱啱選完都有份做。」子珊坦言因拍劇沒有時間修讀公司的主持培訓課程，故無緣參與今屆奧運工作。  採訪、攝影：馬建華
20080818-11,20080818,11,馮仁昭四圍超：關心妍喜為川童圓夢 - 馮仁昭,馮仁昭四圍超：關心妍喜為川童圓夢 - 馮仁昭 關心妍噚日同著名畫家阿虫，參加港台《耆英饑饉8小時》記者會。  今屆活動以「關懷四川．重建校園」為主題，之後香港世界宣明會會喺四川進行校園重建計劃，關心妍即場同幾位饑饉參加者繪畫瓷磚，之後會攞嚟義賣。  關心妍笑自己畫功比較差，所以淨係負責填色，佢話：「之前幾屆籌到嘅善款，經已喺內地起咗好多學校，幫到好多貧苦嘅小朋友提供讀書環境。」
20080818-12,20080818,12,馮仁昭四圍超台灣簽唱變雨神　Eason心痛Fans陪做落湯雞 - 馮仁昭,馮仁昭四圍超 台灣簽唱變雨神　Eason心痛Fans陪做落湯雞 - 馮仁昭 陳奕迅（Eason）噚日去咗台灣，宣傳新專輯《不想放手》，喺西門町聯合醫院廣場舉行簽唱會。Eason可能太耐冇去台灣見fans，所以一出現，即刻魅力沒法擋，但竟由「E神」變做「雨神」，因為噚日台灣落住滂沱大雨，不過E迷仍然熱情未減，一早到場等偶像，簽唱會舉行嘅時候雨更越落越大，積水甚至浸到去小腿，但係幾百個歌迷仍不為所動繼續冒雨排隊，Eason見到好開心咁話：「太值得了！」 積水浸舞台 Eason好心痛歌迷淋雨捧場，所以亁脆陪歌迷濕身演唱，令全場情緒沸騰，本來為顧及歌迷安全，佢只係唱一首歌，不過最後拗唔過熱情歌迷嘅不斷央求，佢忍唔住唱多咗兩首，呢個時候連舞台上面都開始有積水，雖然大家都唔肯走，但隨住Eason清唱最後一曲，全場好安靜咁欣賞完，活動亦正式結束。事後Eason無奈咁話：「可能是我沒跟老天爺簽合約，所以每場活動都下雨吧！」之後大會將簽名會移師到醫院的屋簷下繼續。 抽時間陪女 另外，Eason又提到對個女有愧，因為囡囡成日都問佢去咗邊？佢百感交集話：「該是放慢的時候了！希望調整工作與家庭的時間比例，越快實現越好。」乖女陳康堤已3歲多，佢哋父女相處時間好少，有時佢唔瞓覺撐到朝早送個女返學，佢仲笑自己嘅眼袋亦都越嚟越明顯。
20080818-13,20080818,13,馮仁昭四圍超：黃偉文扮嘢谷舞台劇 - 馮仁昭,馮仁昭四圍超：黃偉文扮嘢谷舞台劇 - 馮仁昭 黃偉文（Wyman右）同梁祖堯合作主演CAMP爆舞台劇《白雪先生灰先生》，佢哋之前影咗張海報，兩個分別好似扮嘢大賽咁，以搖滾樂手同礦工造型示人，最騎呢嘅係一人拎住個名牌手袋，出嚟嘅效果都搞嘢，而「買衫精」Wyman仲要指定其中一款型號嘅經典款式嘅手袋先肯影相。
20080818-14,20080818,14,馮仁昭四圍超：蔡依林帶病捱餓行善 - 馮仁昭,馮仁昭四圍超：蔡依林帶病捱餓行善 - 馮仁昭 蔡依林（Jolin）日前出席喺台灣舉行嘅饑饉三十誓師大會，雖然佢之前俾皮膚過敏症困擾，不過既然身為活動嘅代言人，Jolin仍然帶病上陣，佢話：「皮膚病已經有一段時間，之前已經去了驗血，遲些會有結果。」佢仲笑笑口話對於藝人為咗瘦身捱餓已習以為常，不過佢未試過捱餓30個鐘咁耐，但都會盡力而為。
20080818-15,20080818,15,馮仁昭四圍超：黃伊汶赴京趁奧運熱 - 馮仁昭,馮仁昭四圍超：黃伊汶赴京趁奧運熱 - 馮仁昭 黃伊汶噚日到新城接受訪問，佢話今個禮拜尾會起程到成都、北京宣傳新片《欣月童話》，佢話雖然去到北京時奧運已經閉幕，但佢都希望喺當地感受奧運嘅氣氛，仲想參觀水立方同鳥巢。黃伊汶透露喺《欣》片中佢扮演一名記者，為咗投入角色，佢仲跟隨一名內地記者四周採訪，佢話：「我哋去咗一個好貧窮嘅家庭，見到成間屋都堆滿垃圾，如果唔係為拍戲，自己一定睇唔到呢啲真實嘢，所以都令我獲益良多。」
20080818-16,20080818,16,馮仁昭四圍超：農夫妙法冧老人家 - 馮仁昭,馮仁昭四圍超：農夫妙法冧老人家 - 馮仁昭 二人組合農夫嘅成員陸永同C君，噚日去到油塘一間敬老中心探訪近百名公公婆婆，佢哋送上福袋做禮物之餘仲教老人家rap。農夫話好多時睇新聞都見到好多老人家俾人忽視，所以今次探訪就揀咗老人家做對象，佢哋希望他日賺到錢可以出錢又出力幫助老人家。陸永又話自己𠱁老人家有一手，平時對住屋企嘅老人家，會同佢傾偈之餘又會畀錢佢買嘢食。
20080818-17,20080818,17,馮仁昭四圍超：何韻詩慘被當盧巧音 - 馮仁昭,馮仁昭四圍超：何韻詩慘被當盧巧音 - 馮仁昭 何韻詩（左）噚日現身商台喺九龍灣舉行《萬世巨星大作戰之你個樣樣》活動，見到模仿佢嘅Fans，即忍唔住笑指做乜對眼化得咁勁。  阿詩話初入行經常被人誤會喺盧巧音（Candy），最好笑係胡楓（修哥）成日喺電視城化妝間調亂佢同Candy，好彩𠵱家修哥經已認得出佢。
20080818-18,20080818,18,娛樂開CHAT：裕美、范萱蔚、葉文輝輪住同你Chat,娛樂開CHAT： 裕美、范萱蔚、葉文輝輪住同你Chat 各位娛樂版擁躉，有興趣和你的偶像傾談嗎？《娛樂開CHAT》請來裕美、范萱蔚和葉文輝擔任嘉賓，於今日（19日）及明日（20日）與讀者談天說地，參加者同時有機會得到偶像珍藏禮物，只要你有webcam及headset，並於當日6:30pm準時登入 http://ent.appledaily.com即可，節目於當日7:00pm在《蘋果》網站直播。 
20080818-19,20080818,19,馮仁昭四圍超：王子激吻小薰緊張 - 馮仁昭,馮仁昭四圍超：王子激吻小薰緊張 - 馮仁昭 台灣衛視中文台為宣傳新戲《黑糖群俠傳》，噚日喺美麗華舉行fans聚會，棒棒堂嘅王子同黑Girl嘅小薰講番喺部戲，佢哋因為俾邪教餵春藥，搞到有激情接吻戲，王子話：「原本以為是點到即止，想不到導演說一定要激情擁吻才有感覺。」  從來未拍過吻戲嘅王子坦言，緊張到個心臟都快要跳出嚟。
