key,date,article_daily_id,title,text
20080328-187,20080328,187,英超早飛王：熱刺炒「紐」唔跟就笨 - 畢傑,英超早飛王：熱刺炒「紐」唔跟就笨 - 畢傑 我，仲有面目見讀者……皆因蘋果波神一句說話，貼得波就要有承擔！試過連中6期、試過5連勝等已被讀者遺忘，唔緊要，畢傑未氣餒，必須為連輸4口嘅〈早飛王〉討回公道。星期日機會嚟喇，熱刺主場贏硬紐卡素。畢傑 好多人都覺得，熱刺捧走咗今屆聯賽盃冠軍，變相攞咗下季歐協盃資格，𠵱家喺聯賽無欲無求，冇咗爭勝心。我嘅睇法剛啱相反，因為睇開西甲都知，熱刺領隊拉莫斯教西維爾嗰陣真係場場去盡，大家可以睇到佢哋早前迫和車路士4:4、以及上場尾段都博到盡去贏樸茨茅夫（2:0），就知一早攞咗歐協盃資格唔代表啲咩，至緊要班波落場有heart。  嚟緊周日熱刺連續3場喺白鹿徑主場出戰有優勢外，其餘考慮嘅係周中國際賽期問題。 隊波有戰意羅比堅尼有力 熱刺陣中幾位常規正選如贊拿斯、艾朗連儂、京治、馬白蘭基、侯度史東及戴臣等都冇份入選國家隊打友賽；至於貝碧托夫雖被徵召對芬蘭，但愛爾蘭喺周三未有約戰友賽對手，故羅比堅尼有休息時間。何況前線仲有戴倫賓特，呢位黑人射手話明唔介意打後備，上場對樸茅又有波入，就知班波有體力、具戰意，今次主W唔難開。  紐卡素上周終於反底淨勝富咸2:0，為基瑾上任後第1場勝仗，但大家要留意對手只係尾二嘅富咸咋喎，紐記有幾威呢？再睇軍情，門將基雲、占士米拿、安利、卡卡巴同卡爾繼續養傷，前面奧雲又要打周中作客法國場友賽，咁嘅陣容對下游隊都未掂，試問點頂熱刺嘅攻力？  往績上，近季紐卡素專尅熱刺，近5次交手4贏1輸（4大1細），包括首循環主場贏3:1。不過，當時熱刺仍然係由前帥祖爾領軍，隊中問題多過乜，又點能夠同現時拉莫斯麾下嘅一隊比較。 早飛王貼士 星期日31　熱刺vs紐卡素  首選：熱刺勝（1.55）  次選：熱刺大（1.62）  冷選：熱刺勝4:1（21） 《周末早飛超級重心》 伯明翰搶分攻「城」 星期六8  伯明翰vs曼城1:0（6倍）  伯明翰尚處於護級邊緣，除麥法頓續因傷缺陣外，其餘主力如科素及麥舒菲爾俱能上陣，勝望較對手濃。曼城上仗有馬田柏杜夫停賽復出亦僅和保頓0:0，而這名保加利亞翼鋒周中又要代表國家隊對芬蘭，體力削弱，何況夏文要坐波監。 樸茅主場連「根」拔 星期六11  樸茨茅夫vs韋根2:1（7.5倍）  樸茨茅夫今周續有蒙達利及柏巴廸奧普停賽，可幸上仗對熱刺未准落場的廸科爾可復任正選，有力射破客軍大門。韋根離開JJB爛地主場威力盡失，上場多打布力般一人下亦輸1:3；今周古馬斯續停賽，但柏拉西奧斯刑滿復出。 紅魔盛勢「維」攻格 星期六43  曼聯vs阿士東維拉2:0（6.5倍）  紅魔證實有加利尼維利因傷提早收「咧」，而葡萄牙孖寶基斯坦奴朗拿度及拿尼，未有入選國家隊出戰希臘，料有足夠體力。阿士東維拉或有中堅美爾保復出，但宜留意近仗開始走下坡，上仗主場亦0:1不敵新特蘭。
20080328-188,20080328,188,意甲早飛：利禾奴搶分「上」岸 - 藍鑽石,意甲早飛：利禾奴搶分「上」岸 - 藍鑽石 不嬲都認為利禾奴是意甲的「搵食球隊」，但搵食還搵食，球隊近4場聯賽不勝後，護級形勢急不容緩，是時候認真搶分，周日主場對錫耶納讓平/半，上盤仍然捧得過。  利禾奴的主場水準其實不差，強如國際米蘭與羅馬今季來訪也失分而回；歇冬後，利禾奴主場比賽亦場場有入球，僅曾受挫於祖雲達斯及拿玻里，今仗幾可夫添（僅老將簡尼捷達養傷），由應該延續主場有波入的走勢。錫耶納近況當然理想，近6場贏4場，漸已上岸，戰意肯定不及主隊。  談到周六，卡利亞里主場對羅馬，相信羅馬缺少托廸、柏路達、廸羅斯、胡仙歷的消息未被市場所消化，加上有歐聯後顧，料主隊臨場必起票。卡利亞里早前使用體育法規以外方式處理人事糾紛，被罰3分一事，已上訴得直，重奪隨時構成保命的護級3分，士氣大振，受讓應早撐。文：藍鑽石 意甲 讓球主客和：星期六42卡利亞里勝[+1]（1.85）  讓球：星期日26利禾奴（上）
20080328-189,20080328,189,美職大勢：銀河訪急流勢被淹 - 吾中,美職大勢：銀河訪急流勢被淹 - 吾中 洛杉磯銀河今季雖然實力有增無減，但熱身賽表現叫人失望，加上近屆訪科羅拉多急流全敗，故今訪急流時，平手盤寧取主隊。（球賽編號：星期六58；now633台明日9:30am直播）  銀河今屆雖然由古列治領軍，又有碧咸及當路雲等壓陣，並補入射手卡路士雷斯，可惜在季前熱身賽全無隊形，今訪急流時缺後衞安廸查錫，難以高估。急流雖有前鋒卡斯因傷缺陣，但球隊補入了06年MVP基斯甸高美斯，加上近6次迎銀河全勝，今役W得。  肯薩斯巫師迎華盛頓聯隊一役，前者今屆有艾廸莊臣、貝斯亞加及加西亞等離隊，加上今役又有前鋒阿拿奧特及中場羅渣艾斯賓路沙等因傷缺陣，而華盛頓則有中場馬些路加拿度加盟，就算有中場戴亞真高停賽，相信仍夠贏。  吾中 貼士 讓球過關  星期六57華盛頓聯隊（平）x星期六58科羅拉多急流（平）2x1
20080328-190,20080328,190,西甲早飛：奧沙辛拿「客勝」有「基」 - 牽牛,西甲早飛：奧沙辛拿「客勝」有「基」 - 牽牛 正所謂「行運一條龍，衰開一條蟲」，基達菲2、3月期間係威係勢，不過上仗終於輸畀畢爾包，連同盃賽12場不敗終於斷纜，周日主場對搶分護級的奧沙辛拿，實在讓唔起，讓球主客和的「客勝」早捧為妙。  基達菲呢支兄弟班，之前打出超水準，贏皇家馬德里同賓菲加呢啲歐洲一線球隊，除咗教練米高勞特立領軍有方，兄弟兵打出士氣先係極大原因，不過連拚咁多場，好似列捷特、卡斯基路呢啲主力場場打足咁滯，真係鐵人都死。而且下周中，基達菲更要作客拜仁慕尼黑，打歐協8強首回合大戰㖭！  無疑奧沙辛拿呢排都唔抵幫，上仗主場輸俾貝廸斯，今仗更有中場查維加西亞同後衞荷西素停賽；可幸球隊作客唔錯，連續兩仗迫和維拉利爾同華拉度列，考慮基達菲有歐洲賽後顧，「客勝」早捧。文：牽牛 西甲  讓球主客和:星期日40奧沙辛拿勝[+1]（1.7）
20080328-191,20080328,191,4大聯賽積分表,4大聯賽積分表
20080328-192,20080328,192,特稿二線「魔」兵身價高 - 青蛙仔,"特稿 二線「魔」兵身價高 - 青蛙仔 曼聯在今屆英超聯能夠彈出，並領先車路士、阿仙奴及利物浦5分、6分及14分，陣中的千萬鎊後備兵亦有功勞。  曼聯領隊費格遜今屆亦像利物浦主帥賓尼廸斯一樣，採用輪換制度。在中前場8個位置上，只有傑斯、基斯坦奴朗拿度、朗尼及泰維斯能夠長居正選，餘下費格遜會因應對手及賽事起用不同的球員。同於去夏加盟、身價總值4,700萬鎊（約7.3億港元）的夏格維斯、路爾斯安達臣及拿尼雖未能搶得正選，惟每次落場打聯賽都有好表現，當中以拿尼最突出，入了3球，且球球靚波。 拿尼安達臣最搶鏡 至於身價達1,860萬鎊的卡域克，亦非曼聯的英超隊正選兵，但在歐聯卻得到費格遜重用，長佔正選位。要留意的是，拿尼及路爾斯安達臣跟他一樣，也是曼聯歐聯隊的主力，路爾斯安達臣就此表示：「之前我在波圖因傷休息了8個月，但來到曼聯後在得到隊友的支持協助下，很快便能融入球隊，故對現時的發展相當滿意。」  反而夏格維斯就被拿尼及路爾斯安達臣比下去，無論在英超抑或歐聯都非主力，這大概與他太易受傷有關。  文：青蛙仔 曼聯的千萬鎊後備 球員：卡域克  國籍：英格蘭  位置：中場  年齡：26歲  今屆英超紀錄：24場(17/7)入1球  加盟日期：07/06  轉會費：1,860萬鎊    球員：夏格維斯  國籍：英格蘭  位置：中場  年齡：27歲  今屆英超紀錄：17場(14/3)入1球  加盟日期：07/07  轉會費：1,700萬鎊    球員：路爾斯安達臣  國籍：巴西  位置：中場  年齡：19歲  今屆英超紀錄：21場(15/6)入0球  加盟日期：07/07  轉會費：1,300萬鎊    球員：拿尼  國籍：葡萄牙  位置：中場  年齡：21歲  今屆英超紀錄：23場(14/9)入3球  加盟日期：07/07  轉會費：1,700萬鎊    球員：朴智星  國籍：南韓  位置：中場  年齡：27歲  今屆英超紀錄：7場(5/2)入1球  加盟日期：07/05  轉會費：400萬鎊    註：()內為正選及後備上陣場數"
20080328-193,20080328,193,特稿：卡比路式英軍漸成形 - 阿呢斯奧,特稿：卡比路式英軍漸成形 - 阿呢斯奧 「卡比路第2場」之後，英國傳媒鋪天蓋頂的專欄分析散滿全國，一如政府高官開會，反對派、支持派和溫和派各持己見，論點不一；惟有一點可以肯定，卡比路的未來規劃已大致成形，且可變空間着實不多。  有英國行為學家接受《衞報》訪時指，卡比路的指手劃腳、不安面容顯示了他絕不滿意賽果，賽後只是「謊謊」而談；姑勿論他們是否忽略了意大利人是天生動作多多的民族，卡比路仍言：「高興看見球隊流暢地演繹了兩種不同戰術。」這句起碼有7分真。今天的國際友賽已不可能90分鐘打真軍，讓我們以英格蘭兩場上半場陣式，透視卡比路的組軍大綱。 朗尼配中場謝拉特 明顯地，英格蘭沿用當今歐洲主流的4-2-3-1作基本，體現意式戰術中「控球比速度更關鍵」的理念。這也是卡比路藍圖中的重要一環。下半場，球隊改以4-4-2出擊，相信是他口中的「第2套」應變，換言之亦即是就臨場變化而準備的對策而已。  「心中已有清晰的骨幹成員。」卡比路此言非虛，核心是箭頭朗尼、中場自由人謝拉特，以及「侵略者」祖高爾，再配以兩名中場清道伕（今場是巴利和夏格維斯）聯繫3線。值得一提，謝拉特的角色較球會時吃重，覆蓋面更大，暗示了「雙特」問題已不再困擾。  正方評價是：「英格蘭的邊路攻勢，較倫敦最熙來攘往的皮卡廸利大道還繁忙。」反方自嘲：「巧婦難為無米炊，再厲害的魔術師，也不能把空氣變鈔票。」但說得最妙該是：「慢，慢，快，總好過之前沉悶兼乏味。」也就是卡比路對英軍的要求，亦是詠春技法中「黐手」的精粹所在。文：阿呢斯奧
20080328-194,20080328,194,法甲早飛：圖盧茲平手必捧 - 阿呢斯奧,法甲早飛：圖盧茲平手必捧 - 阿呢斯奧 周日法甲榜尾大戰，因歐協而分身乏術的圖盧茲，將造訪尾席的梅斯，料後者已從谷底反彈完畢，今仗吼實圖盧茲的平手盤，勇取客W！  梅斯早前聯賽忽然連贏兩場，給人絕處逢生的希望，但未幾又連敗兩仗，相信再「反」機會渺茫；球隊與尾4的朗斯相距16分，加上法足盃晉身8強，似乎會把戰線轉移至盃賽，藉此拿下尾彩！梅斯主場錄得2勝3和9負，戰績「包艇」，傷兵包括中場卡廸、蘭奴亞特、守將巴桑等。  圖盧茲兵力不勝負荷，無法兼顧歐洲賽場，令自身陷於降班危機，幸僅落後朗斯3分；球隊自歐協出局後，聯賽已錄得12仗不勝，惟近5場和了4次，而瑞典射手艾文達周中友賽巴西亦僅披甲60分鐘，加上越趨老練的新星馬菲奧、艾邦度，筆者認為圖盧茲是最可能逃出生天的幸運兒；搶分大戰，力捧客軍！文：阿呢斯奧 法甲 讓球：星期日34圖盧茲（平）  主客和：星期日34圖盧茲勝（2.55）
20080328-195,20080328,195,〈球蘋家〉即場來料,〈球蘋家〉即場來料 藍鑽石近期即場來料水準極高，周六就聯同「燈神」牽牛，在《球蘋家》同大家分享即場心得。 你的回應 ●7人欖球賽最吸引你的地方是甚麼？  請上〈球蘋家〉留言  http:hk.myblog.yahoo.com/appleballmen/    頹青大懶堂=.=大佬傑：最吸引我就係球員接應傳球，然後雙方球員互相碰撞，爭取勝利，加上觀眾熱鬧氣氛，令整個比賽更加吸引！    carmen：我鍾意球場外氣氛熱鬧，觀眾扮鬼扮馬入場，充滿節日feel。    MONKEY_BABE：即將上演的「國泰/瑞信香港國際七人欖球賽」，門票早已售罄，已可反映球迷對7人欖球的熱烈；手腳兼用、全身肌肉都用到的技巧，不是一朝一夕訓練到，最為吸引莫過於此。
20080328-196,20080328,196,周六及日各地聯賽及盃賽賠率表,周六及日各地聯賽及盃賽賠率表
20080328-197,20080328,197,丘仔Preview：華倫西亞重返勝軌 - 丘建威,丘仔Preview：華倫西亞重返勝軌 - 丘建威 總結上周西甲，皇馬敗陣而巴塞獲勝，叫做將榜首形勢再次拉近，亦對於季尾舉行的「國家打吡」增添了可觀性。不過最令人深刻的都算是尾場畢爾包對基達菲的賽事，主隊新人加文廸亞甫落場後與對方球員一下碰撞後，居然出現神情呆滯的反應，登時令人想起季初佩亞達的不幸事件，幸好最終都安然無恙。 希廸布蘭技驚四座 講到近排最威水的球隊，華倫西亞絕對當之無愧，繼上周中西班牙盃贏巴塞之後，於聯賽打出更高的水平而戰勝皇馬，終於證明了其實力屬於西甲Big4之一。門將希廸布蘭的表現可謂技驚四座，假若他能夠長期有此演出，實在不難奪得德國隊正選門將之位；其實自從前主席離開之後，華倫西亞架構回復簡單，陣內明顯增強了士氣。當然，教練朗奴高文執掌球隊一段後亦漸上軌道，近仗開始棄用星味過濃又水準不穩的祖亞昆，而改用實際的艾里斯文廸，這決定絕對值得讚賞。  今周他們主場面對馬略卡，相信朗奴高文為帶領球隊爭前六以保帥位，都會全力爭勝。客軍上周在陣容不整的情況下小勝拉科，今場將有中場艾巴加沙及巴斯拿斯停賽期滿復出，將有助其攻守平穩。同時間，一對國家隊前鋒韋拿及古爾沙也可作射術大比拼。  丘建威  有線足球評述員  電郵：mailto:scaa_yau@yahoo.com
20080328-198,20080328,198,球蘋家專欄：NBA迷聚腳好地方,球蘋家專欄：NBA迷聚腳好地方 〈球蘋家〉呢個大家庭，除咗係足球迷嘅天地，籃球迷尤其是NBA粉絲，都鍾意係呢個Blog聚腳；好似周三「我的意見」講開NBA，76人能否保住季後賽席位；吸引埋「土瓜灣鄧肯」留言，話「伊古達拉始終唔係明星級球員，有勇冇謀，76人靠佢都冇咩前途」，香港又有3個台直播，叫座力大增，NBA迷不妨多啲嚟本Blog傾吓波經。  有權利就有義務，各位讀者咁畀面留言，我地當然有回報，好似本報名家藍鑽石，上周六意甲即場來料早場開巷，跟風球迷肯定執唔少，夠買番件NBA波衫威吓啦。 即場來料：意甲專家又得米 藍鑽石：重心推介費倫贏1:0  另一場重心戰費倫天拿vs拉素，費倫出韋利、梅度；拉素彭廸夫後備，博費倫贏一球，1:0。  結果：費倫天拿1:0拉素    藍鑽石：祖國「大」戰買埋客勝  畀埋今晚場大戰，國米vs祖記，要「大」同埋「客勝」。  結果：國際米蘭1:2祖雲達斯    吾中：拜仁食硬利華古遜  拜仁食住利華古遜，單W應該冇問題。  結果：拜仁慕尼黑2:1利華古遜    戰鬥員A：熱刺信心飛爆晒棚  熱刺排名低過樸茅，但讓咁多，有信心飛，捧熱刺W。  結果：熱刺2:0樸茨茅夫 有獎遊戲：意、西領頭羊今周前途又點？ 意甲榜首國米同西甲榜首皇馬，近況都一般；今周佢地均遇上硬淨對手，各位Blog友不如登入〈球蘋家〉，估下呢兩場波戰果如何，答中即送你Niketee一件，名額3名，截止時間為周六11:00pm。    第7期答案：C（5-6球）  得獎者：meilin、matthewtong、chris_pch  本報將另行通知得獎者取獎品方法     http://hk.myblog.yahoo.com/appleballmen/   你的意見：不論對本版內容有讚有彈，歡迎在《球蘋家》留言    即場來料：大戰連場，名家即場為你指點迷津    有獎遊戲：自問足球迷，豐富獎品等你攞
20080328-199,20080328,199,周日及一各地聯賽賠率表,周日及一各地聯賽賠率表
20080328-200,20080328,200,周末有乜睇：默西塞德打吡周日上演 - 賴恩,周末有乜睇：默西塞德打吡周日上演 - 賴恩 下周日（30日）英超將上演一場默西塞德打吡大戰，今季首循環利物浦作客憑兩個12碼力克愛華頓，今次兩隊易地而戰。究竟是利物浦再勝對手鞏固第4位的優勢，還是愛華頓報卻一箭之仇取替前者位置？周日之戰後答案自當揭盅！  上輪聯賽遭榜首的曼聯所敗兼遠遠落後14分的利物浦，今季要後上奪標已是「數字上的可能」，加上歐聯又要兩度硬撼阿仙奴，因此領隊賓尼廸斯會否盡遣強陣迎擊今仗對手愛華頓勢成疑問。  此外，利物浦目前僅以兩分之差領先愛華頓，要力保聯賽第4位出戰來季歐聯，今仗絕對不能手軟，在魚與熊掌不能並存之下，究竟「紅軍」會從中作如何取捨，將是賓帥今季所遇的最大難題。文：賴恩
20080328-201,20080328,201,挪超攻略：阿里辛特「客勝」可期 - 牽牛,挪超攻略：阿里辛特「客勝」可期 - 牽牛 周六挪威超級聯賽揭幕，季初大事擴軍的華拉倫加，主場對阿里辛特；考慮主隊新兵甚多，季初友賽顯示入球率平平，一於博阿里辛特成功偷雞，取「讓球主客和」「客勝」。  華拉倫加貴為05年冠軍，上季只得第7名，球會高層甚感不滿，決定大變格，請來國腳中場馬田安達臣出任球員兼領隊，並簽入了基斯杜化希斯特、薩坦尼斯等新兵，可惜季初友賽表現平平，近3場友賽只入2球，而馬田安達臣、基斯杜化希斯特、朗尼莊臣及史托碧克等國腳亦剛為挪威國家隊出戰國際賽，影響備戰；阿里辛特沿用上季成功護級骨幹，以防守力出色見稱，近6仗友賽均未嘗每場失波多於一球，今仗亦可趁對手未上力，成功偷雞搶分。  牽牛 貼士 主客和/讓球主客和  星期六49華拉倫加和（3.75）  星期六49阿里辛特勝[+1]（2.2）
20080328-202,20080328,202,周末焦點球星：科蘭登艇顯身價,周末焦點球星：科蘭登艇顯身價 周六西甲維拉利爾迎戰馬德里體育會，除是兩軍力保前4名歐聯資格外，亦是馬體會前鋒科蘭，首度重返艾米歷高球場倒戈前度球會之戰。首循環雙方於馬體會主場碰頭，當時維軍贏4:3演入球騷，而該仗科蘭因傷未能披甲，周六這名兩戰入兩球的烏拉圭射手勢顯身價。
20080328-203,20080328,203,蘋果波經賠率表(1),蘋果波經賠率表(1)
20080328-204,20080328,204,蘋果波經賠率表(2),蘋果波經賠率表(2)
20080328-205,20080328,205,基特拿放走22名職球員,基特拿放走22名職球員 因破產而被接管的蘇超球隊基特拿，周三放走22名職球員以紓緩財困，球會同時解除了6名社區教練及1名球探的職務。綜合外電（蘇格蘭）
20080328-206,20080328,206,超級貼士：默西賽德打吡撐紅軍 - 譚拔士,"超級貼士：默西賽德打吡撐紅軍 - 譚拔士 1.星期日37利物浦vs愛華頓 波膽：2:0 信心指數：★★ 利物浦上場「雙紅戰」慘吞曼聯3隻光蛋，其實領隊賓尼廸斯賽前已知爭標無望，故此戰之勝負其實對爭取來屆歐聯資格的形勢沒有太大影響。不過，紅軍幾經艱苦始成功重回勝軌，現突然遭「紅魔」一頭冷水照頭淋，球隊上下也希望在歐聯8強首回合作客對阿仙奴前能夠重新振作。  利物浦明日主場對愛華頓，正是賓尼廸斯所需要的賽事，因既是默西賽德郡打吡戰，亦是「4哥」之爭，如能順利取勝，有助提升球員士氣及信心。「紅軍」今季積極招兵買馬，總算成功改善作客戰績，可是主場表現反而不濟，結果因主場失地太多，導致再次失落爭取聯賽錦標的機會。 紅軍聯賽主場只一負 不過，賓尼廸斯早前經調整陣式及踢法後，錄得7連勝佳績，當中歐聯主客兩勝國際米蘭可說是代表作，而主場挫國米可說是「紅軍」的翻身戰，而球隊亦成功走出英足盃慘遭班士利淘汰的低谷。  西班牙前鋒費蘭度托利斯今季挾盛名加盟利物浦，經過大半季後已證明賓尼廸斯未有入錯貨；筆者相信這名擁有極佳個人能力的星級前鋒，在「紅軍」前線扮演極其重要的角色。 愛華頓球員有疲態 值得留意的是，利物浦今季聯賽在主場只曾一次落敗，只要今仗擊敗愛華頓，聯賽第4位基本上會相當穩陣，故鬥志絕對不用懷疑，因球員清楚知道，贏波後便可專注與阿仙奴爭歐聯4強席位。  至於愛華頓近期狀態明顯回落，個別球員過去幾場明顯出現疲態，看來球隊仍未能從歐協盃出局的事實恢復過來，而上場主場對韋斯咸的表現更是令人失望，領先下還要被韋斯咸扳平；由於中場重心卡希爾將續缺陣，就算紅軍未能以最強陣容出戰，仍值捧場。 2.星期六8伯明翰vs曼城 波膽：2:1 信心指數：★ 論實力曼城理應較伯明翰為高，但伯明翰過往在主場的表現甚為硬淨，儘管贏波不多，但輸波的機會亦很少，即使強如阿仙奴亦未能取勝。麥法頓受傷多少會打擊伯明翰的實力，不過曼城作客不濟的表現，令我傾向投伯明翰信心一票。 3.星期六9保頓vs阿仙奴 波膽：1:2 信心指數：★ 阿仙奴上仗敗走史丹福橋，但已連續37場未曾連輸，故我深信「兵工廠」今日揮軍銳步球場，可以奏凱歌。保頓踢法勇悍，「兵工廠」球員不易適應，但兩隊之間的實力的確有一大段距離，加上保頓隊長路蘭停賽，阿仙奴3分可期。 4.星期六10打比郡vs富咸 波膽：1:0 信心指數：★ 今季從未向球迷推介打比郡這支降班膽，但凡是總有例外，因富咸已經跨季連續33場聯賽作客不勝，今仗雖然只是作客打比郡，但打比郡早前鬥曼聯是展示出韌力，故今仗我寧可推介主隊。當然，這類海軍鬥水兵的賽事，只宜小注。 5.星期六11樸茨茅夫vs韋根 波膽：1:0 信心指數：★ 樸茨茅夫主場鬥韋根原是一場半斤八両的賽事，不過主隊前鋒廸科爾的質素，可能是此戰兩隊的分別。韋根上仗作客布力般流浪慘負1:3，從表現看來，球員似乎已認為沒有降班危機，踢起缺乏鬥志，故今仗可考慮捧老樸主場揚威。 6.星期六12雷丁vs布力般流浪 波膽：2:1 信心指數：★★ 雷丁目前31分之中，有25分是靠主場取回來，而此戰適主場面對作客表現平平的布力般流浪，我認為雷丁此戰大有機會繼借主場之利擊敗布力般，進一步脫離逃離降班漩渦。 7.星期六13新特蘭vs韋斯咸 波膽：1:1 信心指數：★ 韋斯咸其實可以是一支頗難應付的球隊，從今季先後擊敗曼聯和利物浦中可見一斑，特別是當前鋒艾殊頓重拾最佳狀態。不過，新特蘭上仗作客擊敗維拉，令球員信心有所提升，今返回主場對韋斯咸是有力保住1分。 8.星期六43曼聯vs阿士東維拉 波膽：2:0 信心指數：★★ 從任何角度看，曼聯今仗在主場維拉是有贏無輸的格局。經過大半季的鬥爭，曼聯於榜首取得5分優勢，「紅魔鬼」不會讓優勢輕易溜走。客軍維拉過往鬥強隊表現素有保證，可惜碰上曼聯正值巔峯，輸波是可預期的賽果。 9.星期日16車路士vs米杜士堡 波膽：3:1 信心指數：★ 車路士上仗反勝阿仙奴，成為英超「2哥」，球員信心提升，今仗在主場出戰米杜士堡，料來亦可以輕易取勝，但領隊格蘭會否為下周的歐聯8強賽事留力值得關注，加上賠率有欠吸引的情況下，今仗並非理想投注場合。 10.星期日31熱刺vs紐卡素 波膽：2:0 信心指數：★★ 奇雲基瑾終取得重返紐卡素後首場聯賽勝仗，不過今仗作客白鹿徑鬥熱刺，絕不是一場容易應付的賽事。論兩隊人腳，相差可能不是太遠，只是前鋒線卻是分野所在，主隊的貝碧托夫狀態大勇，絕非紐卡素的「豆腐防線」所能應付。 「暢譚英超」周末推介（3月份） 主客和2x1：  星期六9阿仙奴勝（1.6）x  星期日37利物浦勝（1.7）@800    主客和3x1：  星期六12雷丁勝（2.4）x  星期日31熱刺勝（1.55）x  星期日37利物浦勝（1.7）@500    今次投注：1,300分    累計結餘：83,435分  上次賺蝕：-600分  規則：全季底分為100,000分，每次最多投注2,000分，以周二及周六見報貼士計。"
