key,date,article_daily_id,title,text
20080221-187,20080221,187,奇趣特搜：夫沉迷阿嬌艷照　大肚少婦喊離婚,奇趣特搜：夫沉迷阿嬌艷照　大肚少婦喊離婚 香港「阿嬌」等一眾女明星的艷照，竟引發內地夫婦婚變危機！福建少婦小王日前挺着大肚子，拉着丈夫小張，去婚姻登記處申請離婚，離婚原因一欄寫「丈夫精神出軌」。  小王近日發現，丈夫一回家就呆在電腦前在看甚麼，後來她趁小張不在家，打開電腦一看，竟存放了數百張香港女明星的艷照，她一氣下全刪掉了，小張回家發現相沒有了，就大發脾氣，說自己還應承了翌日給同事看，並重新在電腦搜集起來。而小王最傷心，是丈夫趁其大肚時背着自己搜集這些照片。小張見妻子如此傷心，最後在婚姻登記處苦苦哀求她回家，危機才暫時解除。     http://news.sohu.com/20080220/n255248656.shtml 
20080221-188,20080221,188,「治病神米」吹噓抗癌　大米熱賣,"「治病神米」 吹噓抗癌　大米熱賣 上海最近出現一種聲稱可抗衰老又防癌的「治病神米」，一両米等於2,000粒維他命，吃飯等於吃補品。大米名叫「德潤生白金米」，每公斤售96元，廣告中指，此米是軍隊、中央機關、釣魚台國賓館、人民大會堂等重量級機關採用的大米，很多市民看見是領導人也吃的大米，都紛紛搶購。 廣告標榜供應釣魚台賓館 「廣告上說能抗癌，我們打算買給父母。雖然假東西多，但應該不敢拿政府去騙人吧！」上海一對年輕夫婦二話不說就買了一桶標價192元的德潤生白金米。也有一名中年婦女說：「大米有如此高技術含金量，送禮最體面。」  而德潤生在廣告中介紹，白金米含CEB活性因子和SOD抗氧化因子，能抗氧化、抗衰老，進而預防心腦血管疾病、癌症、糖尿病等，並且享有人民大會堂、釣魚台國賓館及政府指定供應商特供大米三大榮譽。廣告彩頁上又印有中國航天員中心特供大米頒發儀式的現場照片，航天英雄楊利偉也在場……總之名銜榮譽多籮籮！ 市民投訴揭虛構CEB因子 有市民認為白金米的廣告涉嫌造假，向報館投訴，事件曝光後，工商部門已在日常檢測中發現其違規問題，要求改正。  「騙人的東西！」內地生物化學博士方舟子說，在生物醫學文獻中沒有一種叫CEB因子。至於供應釣魚台國賓館等三個榮譽，竟是花費5萬元就可以買來的榮譽。   http://news.sohu.com/20080221/n255279449.shtml "
20080221-189,20080221,189,水靈集,水靈集 相中女郎站在盛放的櫻花下，與花爭艷毫不遜色，難怪被攝影師評為：美麗堪比櫻花的美女。     http://www.9k8y.com/HtmlPage/2007-09-19/TT_2299_1.htm 
20080221-190,20080221,190,順口溜：官僚文化,順口溜：官僚文化 工作是會來文去，迎來送去。  解決問題是推來推去，拖來拖去，  下級和群眾只能聽來聽去，等來等去。    註：「會」指會議；「文」指文件
20080221-191,20080221,191,順口溜：司機之苦,順口溜：司機之苦 陪不完的笑臉，  說不盡的好話，  遞不完的香煙，  掏不清的罰款。
20080221-192,20080221,192,水靈集,水靈集 內地模特兒古晨擁有獨特的典雅氣質，穿起性感泳裝，仍十分優雅。     http://liyingqingcheng.blog.hexun.com/16833886_d.html 
20080221-193,20080221,193,奇趣特搜：求保佑入學　女生跪拜魯迅像,奇趣特搜：求保佑入學　女生跪拜魯迅像 瀋陽的魯迅美術學院招生考試的場外，出現此驚人一幕！在該校舉行藝術類招生專業課考試當天，一名女生在家長陪同下，在校園內的魯迅塑像前跪拜，女生每叩一次頭，雙手都放在跪墊前的地面，每次叩頭都伏地幾秒鐘，態度極之虔誠，足足拜了五次，歷時五分鐘。學校一些職員說，如此迷信行為出現在藝術考場非常荒唐！該校每年有4萬考生報讀，但最多只有10%人獲取錄，競爭十分激烈。     http://edu.ce.cn/exams/gaokao/kx/200802/21/t20080221_14587931.shtml 
20080221-194,20080221,194,中小學必修文革樣板戲教育部被轟「發神經」,中小學必修文革樣板戲 教育部被轟「發神經」 文革時期曾紅極一時的革命樣板戲，將成為中國中小學生的必修課之一！中國教育部已對九年制義務教育階段的音樂課程標準進行修訂，增加了京劇教學內容，而選定教學曲目中，大部份選自文革時期流行的革命樣板戲，其中一些歌詞不但充滿紅色極左意味，更令不少經歷過文革的內地民眾不寒而慄。有內地民眾斥教育部「神經病」，並稱「決不會讓我的孩子去學那些東西！」 據北京市教委體美處副處長王軍介紹，為了傳承民族優秀文化，教育部對九年制義務教育階段音樂課程標準進行了修訂，在音樂課程中增加京劇內容，並在北京、上海和廣東等10個省市自治區的試點基礎上逐步向全國推開。從今年3月至明年7月，10個省市自治區各選20所中小學進行試點。目前，15首京劇教學曲目已確定，教材編寫和光碟研製工作也已啓動。 學唱《紅燈記》《紅色娘子軍》 王軍表示，當前中小學生普遍存在民族文化藝術鑑賞能力降低問題，開設京劇課「有利於強化學生民族文化學習意識」。選定的15首教學曲目中，有9首是文革「樣板戲」的內容，包括京劇《紅燈記》選曲《窮人孩子早當家》、京劇《沙家浜》選曲《要學那泰山頂上一青松》；京劇《紅色娘子軍》選曲《接過紅旗肩上扛》等；根據不同年級，確定不同的教學唱段。  當局的決定引起內地各方反應。北京雙榆樹中心小學校長曾樾稱，京劇是國粹，納入學校教育非常有必要，而且「樣板戲是當年每個人都會唱的。」又稱「我會和學生一起唱，還能給他們講一些背後故事。」北京的家長張先生表示，自己是上世紀60年代生的，「我們這代人，對於樣板戲有深厚感情，孩子如能學唱，我們之間的話題會更多。」 「勾起慘痛回憶不寒而慄」 但也有不少民眾對當局的決定表示反感。在北京媒體工作的羅先生對本報指：「教育部的官員簡直是神經病！怎麼能把這些東西作教材，讓孩子學?!」「樣板戲是文革產物，它勾起我們這代人多少慘痛回憶，現在一聽到還讓人不寒而慄，我是決不會讓我的孩子去學那些東西的！」也有網民指，「憑甚麼規定要學京劇？中國傳統戲劇那麼多，要學就學我們東北『二人轉』好了！」「北京人喜好，不代表我們南方人也鍾意！」  北京《京華時報》/本報記者 話你知：否定傳統　炮製怪胎 樣板戲，正式名稱叫「革命樣板戲」，是文革時期（1966－1976年）中國大陸的「文化怪胎」，毛澤東煽動的文革把中國傳統的文化藝術都當做反動打入冷宮，令中國的文化藝術領域「萬馬齊瘖」。為充裝門面，在毛的妻子江青親自欽點主持下，選出一些傳統戲曲重新包裝，改曲填詞，使之充滿革命味道，符合當局標準後推出，全國效仿，謂之「樣板」。  首批樣板戲共八個，包括京劇《紅燈記》、《智取威虎山》、《沙家浜》、《海港》、《奇襲白虎團》，以及芭蕾舞劇《紅色娘子軍》、《白毛女》和交響音樂《沙家浜》。之後又推出第二批共四個，包括京劇《龍江頌》、《紅色娘子軍》、《平原作戰》和《杜鵑山》。在長達10年時間裏，這幾個戲頓成全國數億民眾唯一的「文化享受」。 部份革命樣板戲歌詞 《接過紅旗肩上扛》──《紅色娘子軍》選曲  接過紅旗肩上扛，接過先烈手中槍！  踏着英雄足迹走，革命到底永不下戰場！  放眼看天下，風雷震八方！  燎原烈火旺，工農齊武裝！  誓把那南霸天北霸天，一切反動派統統埋葬！  照耀着我們的是永遠不落的紅太陽！    《窮人的孩子早當家》──《紅燈記》選曲  好閨女！  提籃小賣拾煤渣；  擔水劈柴也靠她！  裏裏外外一把手；  窮人的孩子早當家！  栽甚麼樹苗結甚麼果；  撒甚麼種子開甚麼花！ 15首必學京劇曲目 小學：  一年級《報燈名》  二年級《窮人的孩子早當家》（《紅燈記》）  三年級《都有一顆紅亮的心》（《紅燈記》）、《甘灑熱血寫春秋》（《智取威虎山》）  四年級《接過紅旗肩上扛》（《紅色娘子軍》）、《萬紫千紅分外嬌》（《紅色娘子軍》）  五年級《猛聽得》、《要學那泰山頂上一青松》（《沙家浜》）  六年級《包龍圖打坐在開封府》、《你待同志親如一家》（《沙家浜》）    中學：  中一《兒行千里母擔憂》、《猛志在胸催解纜》  中二《這一封書信來得巧》、《趁夜晚》（《奇襲白虎團》）  中三《智鬥》（《沙家浜》）    註：括號內為所屬樣板戲  資料來源：北京《京華時報》
20080221-195,20080221,195,台南大天后宮佈馬頭人偶陣馬英九疑被落降頭,台南大天后宮佈馬頭人偶陣 馬英九疑被落降頭 距台灣總統大選尚有一個月，繼早前《刺馬記》作家曲南長預言國民黨候選人馬英九將在選舉中遭行刺後，台灣傳媒昨又爆出馬被落降頭疑雲！台南一級古蹟大天后宮被爆料指，曾把戴着馬頭的小人偶與聚寶盆，放在媽祖神像正下方，佈局和泰國陰廟養鬼仔等邪術相似，疑是對馬落降頭。廟方否認其事，澄清純屬信眾以此招財。馬則回應說沒感覺，並呼籲選戰不要再走偏鋒。 踢爆今次「落馬降」疑雲的，是一名自稱就讀大學宗教系的學生。他日前向傳媒爆料指，位於台南市、被台灣政府列為一級古蹟的大天后宮，疑玩邪術、養鬼仔，在媽祖神像正下方，放置着一個大盆，裏面裝滿各種珠狀物體，外面放有戴着馬頭的小人偶，及鼓、鈴等玩具與不明礦石法器，「尤其是那些玩偶，帶着幾分邪氣」。 擺法近似泰式降頭 據悉，馬英九大年初四，曾到過大天后宮上香，而台南又是綠營的傳統根據地，有挺馬英九的宗教人士質疑，這些擺放神枱下的馬頭小人偶，類似泰國降頭中的「古曼童」，放置的人疑是對馬落降頭。更詭異的是，生肖人偶中，竟沒有民進黨候選人謝長廷及副手蘇貞昌所屬的「狗」和「豬」，令人懷疑是否另有內情。  「真倒楣！下不為例。」大天后宮主委曾吉連昨日回應指，該聚寶盆其實是馬英九台南市競選總部婦女後援會總幹事侯蔡雪吟，兩個月前擺放在廟內，主要用來聚財，絕不可能是對馬落降頭。而侯前日已把聚寶盆拿走。不過，同樣是供奉媽祖的大甲鎮瀾宮、北港朝天宮等多間廟宇均聲稱，不容許廟內擺放聚寶盆這類物品。而研究台灣宗教民俗的靜宜大學教授林茂賢也指，台灣民間信仰或正統道教，都從沒有這種傳統，更何況媽祖不是財神，有關做法應是信眾「自創」。民俗專家王長春昨細看聚寶盆佈局後說：「這是子午定山崗格局，是求財用的。」   蜜蜂築巢被指吉兆 在台灣，大小廟宇處處可見，當地人經常到廟宇參拜，習俗千奇百怪。而當地每逢踏入選舉季節，都必定出現一些怪力亂神之說。台灣TVBS昨日便報道，彰化縣議員劉淑芳的住所，日前突然飛來四、五千隻蜜蜂，在空心門柱內築巢，恰巧門柱上貼着馬英九贈送的春聯。有人遂穿鑿附會，指這是吉兆，「連蜜蜂都知道馬英九是最好的依靠。」  台灣《蘋果日報》 話你知：大天后宮屹立300年 位於台南市中區永福路二段的大天后宮，又稱台南大媽祖廟，是一所擁有300多年歷史、供奉媽祖的道教廟宇，前身為明寧靖王府，是當年鄭成功之子鄭經為了表示忠於逃到台灣的明宗室遺族寧靖王朱術桂而建造。後來，清朝大將施琅率兵渡海，成功降服台灣，為答謝媽祖庇佑，遂把寧靖王府改建為大天后宮。經過幾次整修，大天后宮在1985年被列為台閩地區第一級古蹟迄今。而廟中古匾古聯甚多，其中以清朝皇帝御賜的「神昭海表」、「德伴厚載」、「與天同功」最為珍貴，甚具歷史考證價值。 台灣人迷信習俗 紅線牽姻緣 ‧神明出巡用來綁着祭品豬腳的紅絲線，被信徒當成求姻緣的聖物。 做事先擲筊 ‧凡事都以擲筊（兩個半月形占卜木製道具）決定，一般以擲出三次一正一反的「勝杯」，便算得到神明默許。 蓋鐘罩厄運 ‧相傳廟宇內的銅鐘能罩住厄運，俗稱「蓋鐘」，許多善信會將生辰八字寫在紅紙上，貼在廟宇正殿的銅鐘內。 私物放神像下 ‧信眾把求財的法器及個人物品，放在廟宇神像下方或供品台上，祈求神明祝福。但一般被稱「正廟」、供奉道教傳統神祇的廟宇，都不容許放置私人物品，更不會有養鬼仔這些祭祀無主孤魂「陰廟」的東西。  資料來源：《蘋果》資料室
20080221-196,20080221,196,「審馬」檢察官調職,「審馬」檢察官調職 主辦馬英九市長特別費案的台灣最高檢察署特偵組檢察官侯寬仁（圖），昨日請辭特偵組檢察官一職獲批准。他將與特偵組另一位已獲准請辭的檢察官周志榮一道，調回高檢署。國民黨總統候選人馬英九表示，「尊重侯寬仁及特偵組的決定」，但民進黨總統候選人的謝長廷陣營則借機質疑馬干預司法。 侯寬仁稱需要休息 侯寬仁和周志榮兩人均因在「馬案」中充當主角，飽受外界質疑。前不久，台灣高檢決定分批調整有爭議性的特偵組檢察官，當中周在春節前以「完成學業」為由請辭獲准；侯寬仁則是在春節過後，以「需要休息」為由請辭。特偵組是2007年4月成立，包括十位號稱是「辦案高手」的檢察官，如今十去其二，特偵組是否將進行「換血」，辦案的走向是否轉變，引發各界關注。  台灣《蘋果日報》
20080221-197,20080221,197,湯圓定標準　網民斥無聊,湯圓定標準　網民斥無聊 為迎接象徵團團圓圓的元宵佳節，大批北京市民昨日排隊買湯圓的同時，湯圓的國家標準亦將於今年底前正式出台，初定湯圓要白色，形狀正圓，餡料含量不得少於整個湯圓20%。但大批網民斥規定無聊：「饅頭之後，下來是湯圓，之後呢，是燒餅、包子，還是油條！」「人的長相是不是也要出台標準？」「國家就不能搞點有用的政策出來？」 要白色正圓不漏餡 將出台的中國首部元宵產品行業的國家標準，初定湯圓的顏色和形狀外，亦要求沒變酸變壞、無異味、不漏餡等，水份不得超過湯圓的45%，糖的份量要達30%。湯圓的包裝設計也要反映品質和凸顯文化特色。網民對此規定大肆批評之餘，也有網友提出，希望元宵列入法定假期，一家大細可以吃完湯圓，再一起上街看燈展。  北京老字號稻香村、錦芳小吃由前日開始不斷出現買湯圓的人龍，最長達四、五十米，下午5時所有湯圓已賣光，稻香村今年準備了140萬斤湯圓發售，又增加了草莓、荔枝等水果口味湯圓，錦芳小食就推出無糖湯圓。在廣州，一個農莊的多位點心師傅，用兩天製作了一個直徑1.5米的「天下第一湯圓」，湯圓由56種原料製成。  兩岸各處昨日均舉行燈會。在台灣，台南縣昨晚舉行大型燈會，由總統陳水扁點燈，主燈「禮鼠獻瑞」高18公尺及重25公噸。  台灣《聯合晚報》/《北京商報》
20080221-198,20080221,198,著名作家浩然病逝北京,著名作家浩然病逝北京 內地著名作家浩然20日因病在北京逝世，享年76歲。他是文化大革命時期少數可以在新華書店陳列自己作品的作家，代表作包括描述農村合作化的長篇小說《艷陽天》、《金光大道》等。 文革時期「一個作家」 不過，官方新華社報道其生平時，未提及被批評為替文革唱讚歌的《金光大道》一書。  中國著名作家茅盾曾概括文革時的文藝作品為「八個樣板戲一個作家」，浩然就是茅盾所說的「一個作家」。浩然原名梁金廣，《艷陽天》、《金光大道》是文革時的流行讀物，浩然也受到中共領袖毛澤東的夫人江青的賞識，成為江青的座上常客和「欽差大臣」。文革後，浩然一度遭批判，但後來通過政治審查復出，至1997年更出任北京市作家協會主席。  本報記者
20080221-199,20080221,199,嫦娥二號預期明年升空,嫦娥二號預期明年升空 中國的衞星總設計師兼總指揮葉培建接受中央電視台採訪時透露，「嫦娥二號」衞星將於2009年前後升空，同樣由長三甲火箭發射。 嫦娥一號首遇月蝕考驗 此外，中國首顆繞月探測衞星「嫦娥一號」昨日首次和月蝕會面。在上午8時43分，「嫦娥一號」開始逐漸被地球陰影所遮擋，其間，它的飛行只能靠蓄電池，而且要經受攝氏零下100多度的嚴寒。近四個小時後，下午2時10分，「嫦娥一號」成功飛出陰影區。  葉培建指出，從監控資料來看，「嫦娥一號」的表現比原先預計的要好。它會消耗六成的電量，但實際只消耗了四成。與此同時，國防科工委昨日下午舉行儀式，將「嫦娥一號」衞星從38萬公里外太空傳回地球的30首樂曲，贈與三家中國官方媒體，向聽觀眾播放，其中包括與香港相關的《我的中國心》。中央電視台
20080221-200,20080221,200,一代紫砂巨匠蔣蓉去世,一代紫砂巨匠蔣蓉去世 中國著名紫砂工藝美術大師、一代紫砂巨匠蔣蓉，前日凌晨零時30分，因急性腦梗塞在家中去世，享年90歲。她的紫砂果品小件，曾在1954年作為當時總理周恩來出國訪問時的國禮。 「枇杷筆架」放中南海 蔣蓉生於江蘇宜興一個紫砂陶藝世家，別號林風，因家境清貧，11歲輟學隨父學藝，此後70多年間創作200多款紫砂作品，大多以自然界的瓜果、動植物為題材，作品形象栩栩如生，形成獨特的紫砂藝術風格，作品「枇杷筆架」，更被選作北京中南海紫光閣的陳設。她與吳雲根等人被譽為紫砂藝界「七大老藝人」，是中共建政後，紫砂藝術發展重要奠基人之一。蔣在1993年被授予中國工藝美術大師稱譽，前年獲中國工藝美術協會頒發中國工藝美術終身成就獎。  新華網
20080221-201,20080221,201,廣西男子染禽流感亡,廣西男子染禽流感亡 中國衞生部昨晚發佈通報，指廣西壯族自治區確診一例人類感染高致病性禽流感（H5N1）病例。這是繼2月18日湖南省確診一病例後，發生的第二例死亡病例。  患者梁某（男），41歲，南寧市西鄉塘區人，無業人員。他在本月12日發病，14日症狀加重後入院治療；18日，患者病情迅速惡化，經緊急搶救後無效，於20日凌晨5時死亡。而患者在發病前曾接觸病死家禽。本港衞生防護中心昨接獲衞生部通報有關個案。對於內地短時間內分別在湖南及廣西有人感染禽流感死亡，傳染病專科醫生勞永樂擔心，南中國地區禽流感病毒非常活躍，相信在禽鳥之間已出現爆發情況，才會傳染給人類，以往當廣西及湖南出現個案後，廣東也相繼有人感染，故他擔心未來廣東省也有爆發危機，港府必須提高警覺，市民到內地必須注意個人衞生，切勿接觸家禽及野鳥。  中新社/本報記者
20080221-202,20080221,202,盡論中國：裁減百名部長　李克強豪賭 - 李平,盡論中國：裁減百名部長　李克強豪賭 - 李平 十一屆全國人大一次會議將於3月5日舉行，選出新一屆國家領導人。由於溫家寶總理連任，以及新任副總理人選，都早已在去年10月的中共十七大定案，高層人事異動相信不會有意外，反而，由新任政治局常委、將出任常務副總理的李克強主推的「大部制」，成為近期海內外傳媒關注的焦點。 缺經驗搞合併被質疑 所謂「大部制」，又稱「大部門體制」、「大部委制」，就是將國務院那些行業相關、職能相近的部委合併，組建大交通部、大農業部、大衞生部等，現有的28個部委可能裁減四分一，相關機構、事業單位更要大幅裁減。  這是胡錦濤、溫家寶主政以來最大型的政府改革，而負責實施這一改革的李克強，並沒有在中央政府任職的資歷，對各部委的職能、人事架構並不熟悉，因此，坊間不時有人質疑，李克強的經驗、威望都不足以勝任。  大部制的改革，固然有部委設計如何適應社會發展需要、如何提高效率等技術性問題，但能否成功的關鍵在於如何克服部門利益的阻礙，直接地說，就是李克強能否克服部長們的阻礙，讓他們接受新的機制？這是場豪賭，勝負也將決定李克強能否樹立威信、在五年後接替退休的溫家寶出任總理。 邁向總理寶座第一擊 裁減四分一部委及相關機構，意味着要裁減超過100位部長、副部長，任務之重堪比2005年解放軍裁軍20萬時裁減150多位將軍。李克強能否完成邁向總理寶座的第一擊，取決於三個因素：  其一，胡、溫撐李，盡在不言中，但胡溫到底能否號令諸侯、部長，還是真的政令不出中南海？其二，鐵道部、交通部、民航局在今次雪災中的表現，頻頻受到人大代表、政協委員炮轟，但鐵道部公開捍衞現有體制，李克強能否把握機會，將這些財大勢雄的部、局壓縮到大交通部內？其三，公眾輿論對大部制的認識和支持，能否對部長們構成足夠的壓力？    電郵：mailto:China@appledaily.com
20080221-203,20080221,203,陳良宇近期天津受審,陳良宇近期天津受審 備受關注的上海社保案核心人物，原中共中央政治局委員、上海市委書記陳良宇案，將於近期在天津出庭受審。消息指，陳被起訴的罪名主要有收受賄賂、濫用職權兩項。 受賄罪可判死刑 法學界人士稱，濫用職權罪刑罰在6個月至10年間，而受賄罪最高可判死刑。  陳良宇是2006年9月被當局以「涉嫌在社保案中嚴重違紀」免職的；去年7月中共將他「雙開」（即開除黨籍及公職），移交司法，中紀委並宣佈他涉及「六宗罪」，其中包括「收受他人財物數額巨大」及「道德敗壞，利用職權玩弄女性，搞權色交易」等。據悉，陳受賄款項主要來自上海禧福集團前主席張榮坤。張通過已故中共政治局常委黃菊秘書王維工，約陳一起用餐，從而獲陳「關照」，以10.15億元代價，獲得價值13.36億元的上海路橋股權。張奉送陳的賄款高達200萬元；張案目前仍未判決。  中新社/本報記者
