key,date,article_daily_id,title,text
20080221-0,20080221,0,陳冠希好戲認拍淫照　退出香港娛圈,"陳冠希好戲 認拍淫照　退出香港娛圈 【本報訊】用詞懇切的道歉、有限度的引退承諾，能否平息令七名女子名譽盡喪、在社會捲起巨浪的藝人淫照風暴？「失蹤」了25天，事件男主角陳冠希昨終於現身。披上西裝褸，藏起平日那副輕佻嘴面，他獨個兒在台上，承認大部份淫照是他拍攝的，對受害女子、家人、全港市民致歉，並宣佈退出香港娛樂圈。臨行前，他拋下一句：「請給我一個機會」。精心安排的「懺悔錄」完美落幕，演了一齣好戲的陳冠希隨即被警察搜屋協助調查。記者：雷子樂、謝明明 裝潢華麗的大禮堂、閃爍不停的鎂光燈，昨午3時，陳冠希（Edison）在貼身保鑣陪同下，終於鼓起勇氣回應淫照事件。不再是滿身潮服，這一回他穿上恤衫、黑色西裝褸，一臉嚴肅的走上講台，先解開西裝褸的鈕扣，坐下來發表約六分鐘的英文聲明，沒回答會場內近300名記者的提問。  他首先長長的「唉」了一聲，再宣讀事先準備的聲明。上月27日互聯網出現首張藝人淫照後，陳冠希一直沒有現身。這天他劈頭第一句就說他回到香港，是要向公眾、向自己交代。他聲稱從沒有逃避責任。過去數星期一直和母親、家人和他所愛的人共處，彼此互相關懷。 稱從未向人展示照片 過去三周半，藝人淫照一批一批的在網上流傳，受害女子越來越多，433張淫照捲起社會連場風暴。陳冠希昨承認：「大部份近日在互聯網流傳的照片，是我拍攝的。」他強調這些都是非常私人的照片，聲稱從沒向人展示過，也沒此意圖。陳冠希指該批照片是被違法偷竊，未經他本人同意就被惡意及蓄意地上載互聯網。他說，事件對社會造成惡劣的影響，「我深感痛心」。  接下來他八度就淫照事件作出道歉：「我要向所有受此事傷害的人表達歉意。我要向所有受事件傷害的女士、其家人，及所有香港人道歉，對不起！」他接着向父母受到傷害致歉。他並再次「衷心、毫無保留地」表達對香港市民的歉意。說時神情凝重，與平日說話時嘴歪歪，擺出一副輕佻嘴臉的「寸樣」判若兩人。  風靡年輕人的萬人迷，深明香港的年輕人崇拜偶像。他自知淫照事件令他無法成為年輕人榜樣，但還是希望事件可給他們上一課。陳冠希說，離開香港的日子，他作出一個重要決定，鄭重宣佈當完成手頭上已承諾的工作，就會無限期退出「香港娛樂圈」。有限度的引退，他自言是為了找個機會去療傷、重建生活。懺悔後他決定「贖罪」，表示未來數月會參與公益慈善活動貢獻社會。 警開路暫住四季酒店 陳冠希續稱事發後一直跟警方合作，並感謝警方的辛勞工作。淫照自上月27日在網上流傳至今，已到達不可收拾的地步。他昨天才「醒覺」要保護受害女子和年輕人，決定要採取行動制止淫照繼續流傳。他表示已要求律師在法律允許的範圍內，採取法律行動，保護那些受害者。接着他再次向所有受害女士、家人、全港市民致歉，希望得到大家原諒。記者會結束前，陳冠希說：「請給我一個機會。」  記者會結束，陳冠希在大批警員結成人鏈開路的協助下，回到馬己仙峽道寓所，接受警方搜查。直至昨晚10時許，陳冠希在相信是警員駕駛的私家車開路下入住中環四季酒店，現場有警員及保安人員把守。據悉，陳冠希此行回港，將逗留三至四日，然後啓程赴美。  雖然他昨宣佈退出香港娛樂圈，但離港後會先到波士頓會合女友楊永晴（Vincy），再到洛杉磯傾談拍片事宜。他早前與任賢齊及內地男星黃曉明合演、由寰亞電影公司投資的警匪片《神槍手》將於下月上映。下月中又會在內地出席一個由他代言的眼鏡品牌活動。 年中接拍荷李活電影 據悉，陳所屬的寰亞集團老闆林建岳，在內地有公司投資拍電影，陳冠希退出香港娛樂圈，大可在內地發展，林建岳也會協助他赴美工作，陳年中將接拍一套荷李活電影，其實他早有演出荷李活電影的經驗，包括06年上映的《咒怨2》，以及去年客串演出《蝙蝠俠——黑夜之神》，該片將於7月在港上映。  此外，陳冠希的Clot多媒體公司旗下尚有藝人農夫，問到該公司會否結業時，陳的經理人稱尚未決定。  著名美國娛樂網誌作家PerezHilton的網站，指事件有利於陳冠希在美國發展。Perez昨以「在美國，性愛影帶能幫助你的事業」為題，報道淫照事件：「留在美國發展吧，Edison，你在荷李活會成為大明星！」但他稱，陳冠希因修理電腦而導致淫照外洩，卻十分「白癡」（Idiot）。 陳冠希發言全文 TodayI'vecomebacktoHongKong,tostandbeforeyou,andaccountformyself.I'veneverescapedfrommyresponsibility.  Duringthepastfewweeks,I'vebeenwithmymother,myfamilyandlovedones,toshowsupportandcare,andatthesametime,havethemsupportandcareforme.  IadmitthatmostofthephotosbeingcirculatedontheInternetweretakenbyme.Butthesephotoswereveryprivateandhavenotbeenshowntopeopleandwereneverintendedtobeshowntoanyone.Thesephotoswerestolenfrommeillegallyanddistributedwithoutmyconsent.  ThereisnodoubtwhoeverobtainedthesephotoshavebeenuploadedthemontheInternetwithmaliciousanddeliberateintent.Thismatterhasdeterioratedtotheextentthatsocietyasawholehasbeenaffectedbythis.Andinthisregard,I'mdeeplysaddened.  Iwouldlikenowtoapologizetoallthepeopleforallthesufferingthathasbeencaused,andtheproblemsthathavebeenarisenfromthis.Iwouldliketoapologizetoalltheladiesandtoalltheirfamilies,foranyharmorhurttheyhavebeenfeeling.I'msorry.  Iwouldliketoalsoapologizetomymotherandmyfather,forthepainthattheyaresufferingthatI'vecausedthemduringthesepastfewweeks.  Mostimportantly,IwouldliketosaysorrytoallthepeopleofHongKong.Igivemyapologiessincerelytoyouall-unreservedlyandwithmyheart.  IknowyoungpeopleinHongKonglookuptomanyfiguresinoursociety.Andinthisregard,Ihavefailedasarolemodel.However,Iwishthatthismatterwouldteacheveryonealesson:toalltheyoungpeopleinourcommunity,letthisbealessonforyouall.Thisisnotanexampletobesetforyou. Duringmytimeaway,I'vemadeanimportantdecision.IwillwholeheartedlyfulfilallcommitmentsthatIhavetotake.Butafterthat,IdecidetostepawayfromtheHongKongentertainmentindustry.Idecidedtodothistogivemyselfanopportunity,tohealmyself,andtosearchmysoul.Iwilldedicatemytimetocharityandcommunityworkwithinthenextfewmonths.IwillbeawayfromHongKongentertainmentindefinitely,thereisnotimeframe.  I'vebeenassistingthePolice,sincethefirstdaythephotoswerepublished.AndIwillcontinuetoassistthem.Afterthispressconference,Ihaveobligationstohelpthemwiththeirinvestigationandhopethatthiscasecanendsoon,aseveryoneIthinkhasthesamewish.IwouldliketousethisopportunitytothankthePolice,fortheirhardworkonthiscase.Thankyou.  Ibelieveeveryone'sprioritynow,myprioritynow,istostopthesufferingandpain.Wedonotwanttoletthissituationbecomemoreoutofcontrol.Weneedtoprotectalltheinnocent,andalltheyoung,frommatterslikethis.Inthisregard,Ihaveinstructedmylawyertodoeverythingpossiblewithinthelaw,toprotectalltheinnocentvictimsofthiscase.  Ibelievethatapressstatementisbeingissuedaswespeak,onwhatmylawyerhasadvisedmetodo.  Lastly,Iwouldliketothankeveryoneforcomingheretoday,andlisteningtowhatIhavetosay.Iwouldliketoalsoapologizeonceagaintoalltheladiesandtheirfamilies,myfamily,andtoeveryoneinHongKong,andeveryoneinoursociety.I'mdeeplysaddenedbythis.AndIapologizetoeveryonethathastogothroughthis.  IwouldliketoalsothankyouforgivingmethisopportunitytosaywhateverIwantedtosayallalonginmyheart.Ihopeaftertoday,Icanhaveyourforgiveness.Inregardtothiscaseandeverythingthathashappened,I'mdeeplysorry.Ihopeyouallwillacceptmyapologyandgivemeachance.Thankyou. 陳冠希發言撮要 ‧回香港向公眾作出交代，從來沒有逃避責，離開香港是要照顧母親和家人  ‧承認曾經拍攝過大部份最近流傳的私人相片，但從來未有公開這些私人相片，這批相片曾經被人偷去  ‧偷竊相片的人惡意及蓄意地將這些相片上載到互聯網。對於事件的惡化及其對社會帶來的影響，甚感痛心  ‧向被因發放被竊相片而受傷害的人、其父母及所有香港人作出衷心和毫無保留的道歉  ‧年輕人喜以娛樂圈人物為榜樣，為自己未能作好榜樣道歉，希望年輕人藉着這次事件上了一課  ‧將會先盡心盡力履行手頭上已承諾的工作，之後退出娛樂圈  ‧會藉此機會檢討自己，重建生活，決定參與公益慈善活動，展開重生及貢獻社會  ‧自相片開始發放後，已經向警方提供協助，會繼續與警方合作去完結這件事，藉此感謝警方為這件事所做的一切工作  ‧先要制止現時的情況繼續發生，大家同一目標去保護所有無辜人士及年輕人。已經指示律師採取所需的法律行動，保障權益受剝削的人士，為此代表律師亦已經發放一份公開聲明  ‧最後，多謝大家給予這次機會使本人可以去表達心中的說話，真正非常抱歉，希望得到大家原諒  資料來源：陳冠希記者會"
20080221-1,20080221,1,郭炳湘、唐錦馨半生緣四十年前嚴父棒打鴛鴦　97綁架案之後再續舊情,"郭炳湘、唐錦馨半生緣 四十年前嚴父棒打鴛鴦　97綁架案之後再續舊情 【本報訊】華麗家族頓生巨變，牽動3,600億元地產王國的利益角力，更揭開豪門長子一段鮮為人知的半生緣。被指與新鴻基地產主席郭炳湘突然休假有關的女子唐錦馨（IdaTong），原來早在40年前已結識少年郭炳湘，卻因郭父反對，兩人被迫分開。直至郭炳湘97年被綁架獲救後，兩人舊情重燃，昔日的紅顏知己逐漸成為他身邊最倚重的女人。　記者：劉碧思、潘鳳蓮、梁洵瑜、張珮琪 據悉，唐錦馨現年61歲，比郭炳湘年長3歲，她少女時代已認識郭家大少爺，兩人40年前相識相愛，但當時郭父郭得勝認為女方無法輔助兒子發展事業，阻撓二人交往。小情侶被迫分開後，各自成家，唐錦馨71年嫁給醫生劉國霖；郭炳湘則娶了父親屬意、任職滙豐銀行的LydiaKui，但未幾即宣告離婚，後來才與出身醫學世家的現任妻子李天穎成婚。  97年郭炳湘被張子強綁架，慘遭綁匪虐待，其後獲救，卻性情驟變，再度與早已跟劉國霖離婚的唐錦馨交往。社交界傳聞，郭氏遭綁架後，有一段時間不敢回家，其間就是留在唐錦馨的家中。兩人的關係逐漸在社交界流傳。唐錦馨經常倍伴喜愛戶外活動的郭炳湘潛水、打高爾夫球和滑雪，更有人目擊他們不避嫌地在高球場上拖手。 姿色平凡為人聰明 社交界消息稱，郭太李天穎認識唐錦馨多年，郭老太鄺肖卿也早知此事，但見曾被綁架的兒子一直受情緒病困擾，跟這女子卻特別投契，惟有「隻眼開隻眼閉」。有新地中人稱，李天穎與唐錦馨曾多次在公開場合碰頭，包括05年10月中環四季酒店開幕當日。不過，作為郭家大少奶，李天穎要表現得大方得體，沒有露出不悅神色；唐錦馨也識趣地使用特別通道出入。  然而，有指近年唐錦馨不斷增加自己在新地的影響力，更傳出有人以郭太名義在市場上掃貨買樓，直至近期郭炳湘意圖讓唐錦馨進入新地董事局，終觸發家族成員的強烈反彈，最後由郭老太出手，聯合次子炳聯和三子炳江，逼使長子郭炳湘暫時休假。  據稱，已屆61歲的唐錦馨姿色平凡，約5呎2、3吋高，膚色黝黑，但為人聰明。唐錦馨弟弟唐基華為社交名媛寇鴻萍第一任丈夫，寇鴻萍昨接受查詢時表示：「前夫的確有個家姐叫Ida，但唔知係咪同一個人。據我所認識嘅IdaTong的確好能幹，為人亦好低調。」 前夫：我哋已成陌路人 82年跟唐錦馨離婚的劉國霖昨午在其診所接受訪問時不介意分享昔日情史：「18、19歲讀香港大學時就認識佢（Ida），後來拍拖大概五年就結婚，生咗三個仔女。」孩子早已長大成人，全部在外國生活。「我哋離婚好耐啦，以前嘅往事唔記得囉，𠵱家我哋已變成陌路人。」他不諱言，結婚十多年後雙方因性格不合分開，二十多年來鮮有往來。  談起前妻，現為香港私家醫院聯會主席的劉國霖氣定神閒地說：「佢（Ida）係好叻女，好獨立嘅女人。」但對於前妻與郭炳湘的關係，他說：「我唔識郭氏家族嘅人，Ida點識我就唔知，我估計就算識都係十幾年前嘅事。」他透露，子女得悉母親捲入新地家變後，曾多次致電回港問他因由。  記者問劉國霖可有前妻的相片，他說：「當年結婚時，我哋同攝影師嗌交，所以結婚時冇影相；生活照，離婚時佢（Ida）乜都帶走，連底片都冇剩。」"
20080221-2,20080221,2,淫審處評級　兩周刊甩難,淫審處評級　兩周刊甩難 【本報訊】疑似藝人淫照風暴上月底爆發後，有市民向影視及娛樂事務管理處投訴部份報刊處理手法過火，該處遂於2月14日主動將第531期《東方新地》及第936期《壹週刊》特刊，送交淫褻物品審裁處評級，結果兩刊昨日只被暫定為第一類物品，即既非淫褻，亦非不雅。影視處昨日即時要求覆核結果，但有審裁員估計覆核推翻原評級機會不大。 暫定第一類　影視處促覆核 影視處昨日傍晚發出新聞稿，表示參考《淫褻及不雅物品管制條例》給予淫審處的指引，以及淫審處過往評定同類物品的結果後，認為有需要要求淫審處以公開聆訊形式，覆核兩本刊物的暫定類別。影視處解釋，考慮到社會對今次事件廣泛關注，希望全面聆訊可以讓公眾更清晰明白淫審處的評訂標準。截至昨日，影視處共收到248宗投訴，不滿報刊報道淫照事件手法。  根據條例，審裁處覆核物品類別時，主審裁判官將會同四名或以上審裁員，進行公開聆訊。曾經參與公開聆訊的審裁員張民炳表示，過去有覆核個案成功推翻原評級，但他認為今次推翻原判機會不大，「因為雜誌已經將人體敏感部位打格仔。」他又稱：「審裁人員唔可以話影視處收到好多人投訴就釘咗本書，你要釘人都要跟法例做嘢。」他估計，在現有法例指引下，兩刊交不同審裁員評審，只會得出同樣結果。  根據法例，第一類物品不受規限，如屬第二類不雅物品，不可發佈予18歲以下人士，出版刊物需包膠袋及加上警告字句，如果被評定為第三類淫褻物品，一律不得發佈。
20080221-3,20080221,3,雖已道歉　無減罪責女受害者可民事索償,雖已道歉　無減罪責 女受害者可民事索償 【本報訊】淫照無論淫與不淫，只要證明拍照的人，蓄意或疏忽流出照片，而對被拍的人帶來經濟損失及心靈創傷，都有可能負上民事責任，被追討索償。陳冠希昨日多番向受害女性道歉，法律界人士認為無助於減免其罪責。 有潛在的假定協議 律師涂謹申指出，根據普通法案例，私人照片的拍攝雙方，在沒有合約規定下，應有潛在的假定協議，照片只作雙方欣賞，不會流傳給第三者。一旦私照外洩，相中人因而蒙受損失，有權向負責保管照片的一方索償。原訴人須證明，對方是蓄意或疏忽，導致照片外洩。就淫照風暴而言，警方調查的結果，將有助了解陳冠希有否疏忽。  「法庭會睇被告疏忽嘅程度，係唔係去到要負上民事責任嘅地步，喺呢方面，好少案例可以參考。」律師謝偉俊說。《個人資料（私隱）條例》規定，個人資料使用者須採取所有切實可行的步驟，以確保個人資料受保障而不受未獲准許的或意外的查閱，如違反這些規定而對任何個人造成損害，當事人有權申索補償，包括對感情的傷害。  律師梁永鏗表示，根據法例條文，由於公眾可憑淫照直接或間接確定有關女藝人的個人身份，陳冠希作為照片的製作人，也等同是女藝人個人資料的使用者。 感情傷害賠償額少 至於賠償多寡，謝偉俊認為，除了鍾欣桐可能因失掉廣告合約而蒙受實質經濟損失外，其餘女藝人的所謂感情傷害，縱使獲得法庭認同，也不會是很大數目。
20080221-4,20080221,4,家長聯盟：道歉僅表面工夫,家長聯盟：道歉僅表面工夫 【本報訊】「我哋對佢嘅道歉有保留！」家長聯盟主席陳小珠認為，陳冠希對青少年及家長的道歉，僅屬表面工夫，但淫照風暴對社會帶來的後遺症實在太大，很多家長仍很憂心。教育界則希望，青少年好好吸取教訓，對錯失承擔責任。  家長聯盟陳小珠說：「每一個人都要向自己做過嘅事負責，陳冠希都係受害人，但係啲相點解會流出？仍然值得商榷。佢嘅道歉只係表面上嘅工夫，我仲係有啲保留。」  陳小珠指出，並非要針對陳冠希個人，但今次事件帶來的後遺症，很多家長還不懂得處理，例如子女與家長對待偶像拍攝淫照的態度就很不一致。 要學習承擔錯失 香港專業教育人員協會理事區伯權說：「如果陳冠希真係誠心道歉，對被佢傷害嘅人作出補償，咁就值得青少年學習。」另一方面，他也寄語下一代，應吸取陳冠希的教訓：「同學要學習承擔，對自己嘅錯失，負責後果。」  教評會副主席何漢權則認為，陳冠希昨日的道歉，承認錯誤及願意退出香港娛樂圈是行對了第一步，但他認為陳冠希仍未承認全部錯誤，更認為「陳冠希最重要係承認性濫交呢個錯誤！」
20080221-5,20080221,5,陳冠希回港行蹤列機密,陳冠希回港行蹤列機密 【本報訊】淫照風暴男主角陳冠希避走美國一段時間，他待在外國靜心等待其經理人公司通知回港，據悉陳將於日內抵港，極有可能於後日舉行記者會交代淫照事件。鑑於江湖流傳有人要出暗花斬陳冠希，警方與經理人公司為了保障陳冠希的人身安全，對其回港的行蹤和新住處保持高度機密。他回港後除了與律師開會外，還會主動向警方提供資料。 將留美數月拍西片 陳冠希回港舉行記者會交代事件後，他所屬紅館經理人公司短期內不會替他安排新工作，不過今年中他將會到美國洛杉磯接拍一部西片，屆時將在美國逗留三、四個月，由於這次淫照事件在亞洲地區造成很負面影響，經理人公司希望先安排他在美國發展一段長時間，待事件淡化後，才考慮讓他回流香港發展，而之前他有份參演的電影《神槍手》會如常安排在下月中推出，投資該片寰亞公司無意把他演出的戲份刪剪或抽起。  紅館經理人公司老闆林建岳昨天出席一新春酒會時，被問及陳冠希何時回港時稱：「你哋唔好再問我，我冇嘢好講。佢會喺呢個星期內回港，到時你哋再問佢。」
20080221-6,20080221,6,朋友傳播藝人淫照北京嚴打台灣拘發放陳冠希性愛影片網民,朋友傳播藝人淫照北京嚴打 台灣拘發放陳冠希性愛影片網民 【本報訊】本港警方稱市民向友人傳閱淫照不違法，但內地《法制晚報》昨報道，北京市公安局明確表態，如有人向朋友通過網上打包傳播有關藝人淫照，且數量在200張以上，將被追究刑事責任；將圖片掛到博客或論壇上，也涉嫌違法。北京網絡新聞信息評議會點名批評百度網傳播相關照片，責成百度網須向社會公開道歉。  另外，台灣一名24歲男子因在網站提供相關淫照，以及標榜有陳冠希現任女友楊永晴18歲時自拍的性愛影片供網民下載，遭當地警方控以散佈猥褻物品罪，但警方無法判斷影片中的女角是否楊永晴。  藝人淫照風暴除成為華人社會焦點外，海外傳媒亦有跟進報道，美國《華爾街日報》網上版一篇題為《艷照門》（PhotoGate）的署名文章，形容艷照事件是香港政府奉行「循序漸進式民主化」的反面例子，暴露了沒有開放政治體制，沒有民主和普選，便無法有效監督警權。 《華爾街日報》責港警 《華爾街日報》網上版2月19日的文章指出，香港政府經常表示只有循序漸進達致民主，才能確保社會穩定，但「艷照門」事件正正是反面例子。文章指出，警方高調調查事件，導致網民鍾亦天被拘禁兩周，也有其他網民先後被檢控，鍾其後獲撤銷控罪，在在打擊了警方的威信。  文章點名批評警務處處長鄧竟成，及一眾警隊高層的言論前後矛盾，令情況變得更壞，最終刺激數百網民上街。文章指出，事件反映在沒有開放的政治體制下，警隊即使調查期間出現失誤，亦毋須負上責任。  此外，《華爾街日報》的中文網站，連日來也有報道艷照門事件，指中港警方對淫照束手無策，又有報道引述北京網絡媒體協會的聲明，批評內地網站百度網協助淫照在中國內地廣泛流傳。
20080221-7,20080221,7,泰國拜會白龍王林建岳祈福消災,泰國拜會白龍王 林建岳祈福消災 【本報泰國芭堤雅直擊】陳冠希親身露面向公眾致歉之際，他所屬紅館經理人公司老闆林建岳未有現身記者會撐場，反而選擇與兒子林孝賢在泰國芭堤雅拜會白龍王，並參加每年元宵佳節舉行的祈福消災儀式。 父子爭取前排跪拜 昨晨7時許，過百信眾穿上整齊白色衣服現身白龍王廟，林建岳父子爭取有利位置在前排跪拜，儀式開始前，有記者遞上Edison照片給白龍王，他立即示意弟子叫記者收起，並加以訓示。  林建岳虔誠上香，然後合十跪拜，白龍王又在他的頭上打圈燒符和點蠟燭，口中念念有詞，為他進行祈福儀式。白龍王其後又給林建岳送贈碌柚，以及一條紅繩和佛牌，示意他為身邊的兒子林孝賢掛上。  上午10時許，正在嘉賓區休息的林建岳接聽過電話後，忽然神色凝重，並向記者透露陳冠希已回港：「今日會有記者會，但我唔會出席。」待祈福儀式完畢後，林建岳父子坐車返回曼谷下榻的酒店稍事休息再出動午膳，記者追問為何不陪伴Edison出席記者會？林建岳說：「因為我喺泰國。」 傳Edison求點迷津 林建岳一直對白龍王深信不疑，白龍王曾在祈福大會指示林建岳含熄蠟燭，Edison也受林建岳影響，篤信白龍王。林建岳03年投資電影《無間道III終極無間》，特別邀請白龍王來港主持開鏡禮，Edison更被拍到與白龍王吃飯，並自爆對方贈言他不要亂發脾氣，同年隨林建岳到泰國為白龍王賀壽，淫照風波後，傳聞他也致電白龍王要求指點迷津。  記者：黃文成
