key,date,article_daily_id,title,text
20080802-177,20080802,177,絕地反擊港股午後轉向倒升131點,絕地反擊 港股午後轉向倒升131點 國家主席胡錦濤表明中國在奧運後繼續推動經濟改革，外界解讀為放鬆從緊政策，令港股午後形勢180度逆轉，由早上最多挫523點，變成倒升131點收市，低位起計抽升約655點，收報22862點，升0.58%。市傳內地銀行獲准增加貸款額度，內銀股上演反擊戰，令H股指數同樣呈現V形反彈，由跌3.23%變倒升0.31%，收報12545點，升38點。 早段曾急挫523點 全日總成交608.6億元，重上六百億；即月期指高水6點。本港時間昨晚11時半，滙控（005）及中移動（941）在美國預託證券（ADR）表現偏軟，前者折算報128.8元，較港收市低0.6元，後者報104.6元，較港低1.2元。  六行三保早上曾跌2%至3%，但午後傳出人行允許內銀增加貸款額度，股價午後甫開市即裂口上揚，建行（939）及中行（3988）更倒升1%。京華山一研究部董事鄧以旭稱，除胡總講話及內銀准增加貸款傳聞，坊間估計上月通脹回落至6.5%，進一步加強貨幣政策放鬆的預期。他料下周市況穩中偏好，滙控業績及儲局議息則左右大局。  高盛表示，中資股現估值被低估，H指現價為預測市盈率12.7倍，遠低於該行認為合理交易範圍的16至18倍，相信現水平已反映一定的宏觀及盈利風險，估計短期可反彈至14800水平，較現價有18%上升空間。  高盛續稱，刺激中資股短期上升因素，包括通脹改善、現時市場風險承受能力偏低，及奧運會順利舉行；但在內地宏調政策及企業盈利前景更清晰前，A股將持續整固，滬深300指數月內將於2600至3000點徘徊（昨收報2840點）。 中鋁減鋁價急跌3.6% 中鋁（2600）調低氧化鋁8.6%，是兩個月來第二次，股價急挫3.6%，為表現最差藍籌。德銀指受電力供應緊張影響，電解鋁產量已下降，氧化鋁生產成本上漲令毛利受壓，維持沽售評級。另外，外電引述消息指，中國正考慮向未鍛軋的鋁合金徵收5%出口關稅，最快9月實施以減少有關產品出口。 六行三保午後反擊 財險（2328）  昨低見：4.71元　收報：5.00元　全日變幅：+2.04%    建行（939）  昨低見：6.67元　收報：6.98元　全日變幅：+1.45%    國壽（2628）  昨低見：28.80元　收報：30.15元　全日變幅：+1.34%    交行（3328）  昨低見：9.55元　收報：10.04元　全日變幅：+1.11%    中行（3988）  昨低見：3.48元　收報：3.61元　全日變幅：+0.84%    中信行（998）  昨低見：4.83元　收報：5.00元　全日變幅：+0.40%    工行（1398）  昨低見：5.70元　收報：5.90元　全日變幅：無升跌    招行（3968）  昨低見：27.15元　收報：28.20元　全日變幅：-0.88%    平保（2318）  昨低見：52.05元　收報：54.05元　全日變幅：-0.92%
20080802-178,20080802,178,跑贏美車廠亞洲汽車美國市佔率飆,跑贏美車廠 亞洲汽車美國市佔率飆 受累汽油漲價和信貸收緊，美國汽車市場上月銷量降到16年低位，美國三大車廠的市場佔有率更創新低。但亞洲汽車因耗油較低而受歡迎，令上月在美國市場的佔有率破紀錄。  根據Autodata的資料，美國汽車市場銷量連跌9個月，是01年經濟衰退以來最長跌浪。上月銷售跌13%，以年率計降至1255萬輛，是92年4月以來最少，其中輕型貨車銷量更急挫25%。 耗油量低受歡迎 由於汽油價格高達接近每加侖4美元（約31.2港元），加上美國車耗油量較大，全美三大車廠──通用、福特和克萊斯勒上月銷量分別跌26%、15%和29%，令旗下美國品牌在美國的市佔率降到42.7%的新低。反觀亞洲車廠的小型車和混合能源汽車較節能而受青睞，令亞洲汽車品牌在美國的市佔率升至破紀錄的49%。歐洲車的市佔率則升1個百分點，至8.3%。  日本汽車方面，日產汽車是少數在美國錄得銷售升幅的車廠，上月銷量升8.5%；本田汽車銷量跌1.6%，但已連續3個月跑贏美國克萊斯勒；豐田汽車銷量雖然大跌12%，但較美國三大車廠優勝。分析師說，隨着信貸收緊，加上汽車租賃融資活動轉弱，預料未來數月汽車銷售會受壓。
20080802-179,20080802,179,投資萍語：中資股短期風險較小 - 熊麗萍,投資萍語：中資股短期風險較小 - 熊麗萍 沉靜一段時間的「一籃子」救市措施傳聞突然再起，令上周五內地股市終於可主導港股表現，大市由跌轉升。  筆者相信北京奧運仍是中央政府的焦點所在，在這段期間推出一些與股市相關的重大措施之機會甚微，但一些只與個別行業相關的政策調整則不會中斷，例如調高出口產品退稅，調整產品價格等，若政府真的如傳聞中將多項救市措施一併推出，令市場焦點將由北京奧運轉向股票市場，這似乎並非中央政府的取向，亦與近期高層官員一直強調保持金融市場穩定的言論相違背。筆者相信市場只利用這些消息作短線炒賣活動，不宜見股價急升追貨。  相反，美國聯儲局、歐洲央行及英倫銀行本周均召開會議，利率動向將對美元、油價及金價走勢影響較大，並左右美股走勢。港股固然受這些外圍因素影響，另一主要焦點是公司業績，滙控（005）、恒生銀行（011）明天公佈中期業績，緊接其後的便是東亞銀行（023）、港鐵（066）及太古系等。  由於銀行在次按投資、兩房債券及貸款之撥備數額難於掌握，因此，各方對銀行股業績的預測相當參差，以滙控為例，預計上半年盈利倒退15%至35%不等，而東亞的盈利預測亦由增長10%至下跌20%的大範圍，反而市場對恒生的預測則較接近，由盈利增長8%至下跌5%不等。 滙控業績影響力大 由於預測的上限與下限數字相距較大，因此，實際數字應可符合預期，但若在預期上限或下限，對股價影響仍會相當明顯，尤其是滙控，該股份由近期低位反彈15%，若其盈利倒退為市場預期下限，股價才可望突破130元，並帶動恒指上越23000點。  筆者更關注滙控的英國業務表現，當地樓市及經濟持續疲弱，若業績反映這方面的撥備金額大，令其股價借勢調整的機會甚高。但以估值而言，預期市賬率為1.5倍，仍屬合理，持貨者索性待業績公佈後再決定沽售或持有，未持貨者則可靜待大市調整拖低其股價時才買入。  至於國企股業績方面，根據A股所列的時間表（H股只是未正式公佈），大多在本月下旬才公佈，減少受業績因素影響，中資股短期風險較小。繼續留意中化化肥（297）、中鐵建（1186）及中交建（1800）。    熊麗萍　滙業財經集團證券部主管  作者目前持有中鐵建（1186）及中交建（1800）股份。
20080802-180,20080802,180,財話短說和黃51億奪希臘碼頭,財話短說 和黃51億奪希臘碼頭 ▲和黃（013）旗下和記黃埔港口宣佈，由和黃港口牽頭的財團獲希臘塞薩洛尼基（Thessaloniki）港務局確認為發展該港新貨櫃碼頭的首選投標者。塞薩洛尼基港是希臘第二大港口，財團投標價為4.19億歐元（約50.8億港元），該作價未包括碼頭年度租金等費用。
20080802-181,20080802,181,財話短說財顧贊成聯通售CDMA,財話短說 財顧贊成聯通售CDMA ▲聯通（762）將於9月16日舉行股東特別大會，表決向中電信（728）出售CDMA業務交易；股東通函指，聯通獨立董事委員會及獨立財務顧問美林皆建議股東投贊成票。
20080802-182,20080802,182,基本攻略：23500點有強大阻力 - 姚浩然,基本攻略：23500點有強大阻力 - 姚浩然 滙豐控股（005）、恒生銀行（011）將於明天公佈中期業績，揭開了藍籌公司公佈業績的序幕。在業績公佈前夕，投資者採取觀望態度，上周初大市成交金額降至400億元多，創下年內單日成交金額最低紀錄。北京奧運會將於本周開幕，會否對大巿有「冲喜」作用呢？  美國政府再次出招穩定巿場，包括容許證券商以「資產擔保證券」（Asset-backedSecurities）為抵押品借貸工具的臨時有效期，將由原來的9月中延長至明年1月底，增加與歐洲央行的美元交換額度（SwapLine）由原來500億美元增至550億美元，以及改變有關臨時借貸的拍賣安排，由原來每兩周一次改為每周一次等。加上，美國證監會決定將限制19隻金融股沽空的緊急措施，延長兩周至本月12日，筆者相信一系列措施，可以對金融巿場短期產生穩定作用。不過，筆者認為未可因此而對美國經濟前景樂觀，仍需步步為營。  美國樓巿跌勢持續，尚未看到止跌回穩的曙光；在整體經濟狀況疲弱下，美國金融業在第三季可能仍要面對巨額撥備的風險。事實上，美林證券以大幅折讓價格出售億美元的債務抵押債券（CDO）予私募基金LoneStarFunds的關連公司，以及計劃發行新股集資補充資本，反映金融業仍處於捱打困局。因此，美股由政策所推動的上升，未必能刺激亞洲區及港股向上突破。  另一方面，內地最新經濟策略由「雙防」轉為「一保一控」，保持經濟平穩較快發展及控制物價過快上漲，顯示內地當局已注視到經濟在奧運後有下滑風險，宏調政策在未來有機會出現適當的調節。  但鑑於目前通脹仍處於高位，且奧運盛事亦即將展開，筆者預期內地短期放寬貨幣從緊政策的機會不大；待居民物價指數（CPI）進一步回落至6%以下，以及生產物價指數（PPI）從高位掉頭回落，當局才會考慮把從緊的貨幣政策放寬，筆者估計最快也要第四季才有機會進行。 中石化7.85元吸納 外圍及內地短期缺乏利好的刺激因素，投資者把焦點轉移至即將公佈的中期業績，觀望態度濃厚，大巿持續橫行的機會較大，預期恒指在100日線附近約23500點會有強大阻力，這個水平亦接近反彈整個跌浪幅度的一半，上落波幅介乎22000點至23200點之間。  受油價大幅上升影響，中石化（386）之煉油業務出現虧損。不過，油價於過去兩個星期從高位顯著回落，將可紓緩其煉油業務營運上的困局。此外，內地CPI已從高位逐步回落，反映通脹壓力有所紓緩，不排除奧運後成品油價格有機會再獲上調。投資者可候股價回落至7.85元附近吸納，目標8.50元，止蝕7.50元。  姚浩然　時富資產管理聯席董事
20080802-183,20080802,183,讀者信箱：宏華橫行後料向下,讀者信箱：宏華橫行後料向下 讀者胡先生問：本人以3.40元買入宏華集團（196）、15元買入聯通（762），請問兩股止賺及止蝕位如何訂定？聯通暫有微利，可否長線持有？  覆讀者胡先生：宏華上日收2.87元，跌1%，近日橫行後有再下滑的迹象，2.80元若失守，會推向2.50元，反彈阻力在2.93及3.07元，破位可試3.33元，但現時看來，向下方發展的機會較大，可考慮以2.80元作止蝕位，伺機沽出換馬。  聯通上日收16.48元，升1.85%，走勢轉強，日內料上試16.90元，破位上望17.80元，可繼續持有，短炒以15.40元作計數位，向上伺機獲利，中線可以17.80至19.00元作目標，逐步推高計數位。  讀者馬女士問：本人以1.50元買入波司登（3998）、1.28元買入越秀投資（123）、4元買入香港興業（480），全部虧蝕，請問點算好？ 興業波幅收窄突破在即 覆讀者馬女士：波司登上日收1.35元，升3%，股價日前反彈至100日線遇阻回落，但很快已回復升勢，技術上有破100日線炒上的勢頭，只待成交配合，可以1.26元作止蝕位持有，股價上破1.38元後，會向1.60元關推進，破位看1.70元，若高位遇壓回落，可沽出計數。  越秀上日平收1.15元，跌穿橫行區，1.09元不容有失，破位將向86仙推進。上日唯一偏好的技術啓示，乃陽燭高收形態，若未來一兩天可抽回10日及20日線之上，股價仍有機會上試1.28至1.33元區域。可考慮以1.08元作止蝕位持有，股價反彈可伺機沽出換馬。  興業上日收3.52元，跌1.1%，股價維持橫行格局，波幅已非常狹窄，是伺機突破的形態，股價若然炒上，第一個目標先看4.14元，可以3.25元作止蝕位繼續持有。  （歡迎查詢有關投資事宜，來信請寄將軍澳將軍澳工業邨駿盈街8號一樓《蘋果日報》或傳真23703886投資版編輯收）
20080802-184,20080802,184,財話短說穆廸降合生前景至負面,財話短說 穆廸降合生前景至負面 ▲信貸評級機構穆廸昨日公佈，把合生創展（754）的Ba3企業家族及高級無抵押債券評級的前景，由穩定降至負面，主要反映合生較早以7.72億元人民幣買入惠州一幅土地，可能令公司財政狀況受壓。
20080802-185,20080802,185,財話短說韓換銀次季少賺11%,財話短說 韓換銀次季少賺11% ▲滙控（005）擬收購控股權益的韓國第六大銀行韓國外換銀行（KEB），公佈截至6月底止第2季度業績，盈利較去年同期下跌11%至2464億韓圜（18.88億港元），期內淨息差亦收窄14點子至2.92厘。
20080802-186,20080802,186,一周好介紹,一周好介紹 作者鄧建初、曾永堅、彭偉新、連敬涵及蘇顯邦均為證監會持牌人士。 363上海實業　收市：22.80元 上海市政府之窗口公司，業務多元化，包括房地產、基建設施、醫藥、消費品及信息技術等業務。過往股價表現與同類股北京控股（392）亦步亦趨，但現時已被北控拋離，主因是北控早前曾有重組計劃，預期上實未來亦會有類似行動，現價相對北控值博得多。可候22.50元吸納，目標價28.00元，止蝕21.30元。 941中移動　收市：105.80元 我們的研究所得，中國的移動通訊用戶數近5成集中於東部地區，雖一級城市滲透率已超過80%，但東部地區滲透率仍處於60-70%，未來1-2年並無成長瓶頸之隱憂。顯示中國移動通訊市場尚未達飽和，相信具品牌優勢及相對優質的中移動，其持續競爭優勢可維持其盈利增長力，建議103.00元以下吸納，12個月目標價138.00元。 1088中國神華　收市：28.80元 中國最具規模的煤炭資源龍頭生產商，今年上半年，其商品煤炭產量及煤炭銷售量較上年同期分別增長17%和17.7%。市場憧憬下半年獲注資，估計有可能收購西三局等項目。雖然發改委發出限制動力煤價格上調，但現時煤價仍保持高企。股價由近日高位急跌，可在28.00元買入，中線目標35.00元，破25.00元止蝕。 2319蒙牛乳業　收市：23.60元 年初發改委限制乳類產品加價，加上內地原牛乳價格高企，一度對蒙牛的盈利產生壓力，不過，隨着發改委調高一系列的行業入門門檻，以及原牛乳價格在夏季期間回落，蒙牛的整體成本及競爭壓力得到紓緩。集團年初時公佈會調整集團的產品組合，改善毛利率，建議在23.00元買入，上望25.80元，跌穿22.20元沽出。 763中興通訊　收市：38.90元 今年首季按照內地會計準則，季度營業額增逾四成至86.4億元人民幣，純利更有96.3%升幅至6089萬元人民幣，相信隨着內地電訊行業正啓動重組，以集團在電信系統設備方面的競爭優勢，應可搶佔電訊商的基建投資新定單，有利業績及股價表現。建議38.50元買入，目標43.00元，穿37.00元止蝕。
20080802-187,20080802,187,市況逆轉要改基金組合投資相連保險免費換馬,市況逆轉要改基金組合 投資相連保險免費換馬 黃小姐向保險顧問購買了兩份月供投資相連保險，為退休生活做準備。不過環球股市下挫，基金回報錄得負增長，專家指出，投資相連保險可以免費轉換基金，建議黃小姐善用其優點，不時檢討投資組合表現，因應市況調配基金。　記者：溫德發　攝影：李潤芳 黃小姐除有份14萬美元人壽保障計劃（包括醫療附加保障），也透過投資相連保險投資基金，爭取較高回報。她說：「我向來都有一位保險經紀朋友幫忙理財，基金回報方面尚算可以，起碼見到自己的投資每年都有增長。」  黃小姐先後買了兩份投資相連保險，月供金額分別為5000元及1200元（圖1、2），供款年期20年。但受環球投資不景氣影響，大部份基金都有虧損。晉裕集團投資研究部聯席董事林偉雄指出，投資相連保險好處是不收取基金轉換費，可靈活調配基金組合，省卻認購費、贖回費及轉換費。 波動市增組合防守性 他建議，保留投資組合內的貝萊德新興歐洲基金、惠理價值基金及AIG拉丁美洲基金，投資比重分別為24%、20%及10%。新興歐洲基金主要投資於俄羅斯，在經濟蓬勃及商品價格強勁帶動下，該國企業盈利會有理想增長。至於現時組合內其他投資地區，例如中國，因受惠基建投資、出口結構變化及中產消費力強勁，預料繼續帶動中國經濟持續發展。拉丁美洲則受惠原料價格高企。  滙豐印度股票基金、貝萊德世界礦業基金、首域中國增長基金及荷銀商品物料基金則建議剔除，待巿況回穩再作考慮。現階段可換入ManAHLDiversifiedFuturesLtd、景順健康護理基金及首域亞洲股本優點基金，佔整體投資比重分別為24%、12%及10%。ManAHLDiversifiedFuturesLtd為期貨及期權基金，目標在任何市況下爭取絕對回報，這類基金能平衡投資組合風險。健康護理行業受惠人口老化問題，行業需求有增無減，在波動巿下防守力較強。 亞洲市場估值吸引 林偉雄認為，亞洲正處於健康調整階段，估值水平已見吸引，可加入首域亞洲股本優點基金，其特點是按股息收益率及長線資本增值潛力來挑選股份。經過重新調整後（圖3），除避免基金選擇重複，整體防守力亦大大提升，預計組合年回報可逾7厘。  但他提醒，這類投資相連計劃，收費如行政費用等都會在計劃前期收取，若提早離場，涉及的投資成本會很高。日後如以月供基金作投資，應透過銀行代理的零售基金，冇投資年期限制。 斷供收費多成本高 此外，一個負責任的理財顧問，對客戶投資組合須定期進行評估及檢討（如3個月），遇巿況有較大波動或出現轉勢，更要及早提出專業意見。 個案：黃小姐  年齡：37歲  婚姻狀況：未婚  職業：人事助理經理  收入：2.8萬元月剩：5000元  資產：一個現值約130萬元單位，投資相連保險總值34.4萬元，公積金36萬元及現金17萬元  症狀：過於倚賴單一保險顧問，不懂得利用投資相連計劃的靈活性  目標：短期內報讀碩士課程，希望60歲退休後每月有1萬元生活費 物業保險：不宜低價沽售物業 黃小姐打算將現持有的物業出售或租出，搬回與父母同住。林偉雄表示，物業位於鑽石山，交通方便，應具升值潛力，既然非急於套現，不建議在樓巿低迷下沽售，可等待樓市轉旺時才作決定。  現可考慮先把單位放租，以租金收入補貼修讀碩士課程費用，若每月淨租金收入5500元，相當於年回報率5厘。 加長醫療保障至百歲 至於人壽保險計劃中的附加醫療保障，保障期只達70歲，醫療索償往往在年紀較高時出現，因此建議於今個保單年度完結時，轉換保障年期可達100歲的醫療保障計劃，每年續保，並無儲蓄成份。  若本身的保險公司並無提供這類醫療計劃，可考慮到其他保險公司投保。以保柏卓康健醫療保障計劃（基本保障──住院及手術）為例，以黃小姐的年齡計算，一年保費為2193元，可續保至100歲。 退休：博回報5厘儲640萬 黃小姐60歲時，即23年後，若要維持現時每月1萬元生活支出，按4%通脹率計算，屆時每月支出約2.5萬元，如以女性人均壽命83歲作參考，即要應付23年退休生活。  假設退休後投資回報5厘，黃小姐60歲時就要608萬元。投資相連保險組合，連同公積金計算，假設每年總回報率為5%，23年後退休時就可獲得640萬元，夠應付退休所需。  如果回報有7厘的話，則可獲得893萬元，退休後每月生活水平，就可提升至相當於目前每個月有1.35萬元（見表）。 小知識：供款要先扣保費 投資者經常將投資相連保險與月供基金混淆，因大部份投資相連保險均可月供付款，供款又同樣是投資於基金上，誤以為投資相連保險內包含的保險是附送贈品。實情是，投資者需為此保障支付保費。一般來說，投資者月供金額，會先扣去保費及行政費，餘額才會作投資基金。  保監處指出，很多時投資者不知道，於保單早已列明提早退保會有額外收費，若提早退保或受保期間申請減低供款，會被徵收保單尚餘年期的行政費。
20080802-188,20080802,188,財話短說集優3.6億購器材,財話短說 集優3.6億購器材 ▲上海集優（2345）宣佈，已就購置一台3.55萬噸離合器式螺旋壓力機及相關部件，與中國機械設備進出口總公司及德國公司SMS達成協議，包括技術服務費用的總代價約為3.56億元。
20080802-189,20080802,189,理財第一波：基金的模擬回報　投資(十九) - 李兆波,"理財第一波：基金的模擬回報　投資(十九) - 李兆波 我有朋友對基金深信不疑，是投資組合內的必然之選，亦有朋友對基金恨之入骨，因為回報未能兌現。  兩星期前談及以年回報去比較基金的表現作初步標準，此方法不適用於成立只有數年的基金。舉例說，有基金只成立了3年，總回報是110.7%，年回報是（1+110.7%）1/3-1=28.2%，是一個相當高的數字，但由於只成立了一段短日子，表現受短期經濟周期影響，此等因素長期來說將不能維持，因此這方法不能作準。  在購買基金時，你可能收到大堆數字資料，其實不是全部都有參考價值。你可以用你的方式把資料重組，始終自己最明白自己的分析。情況一如財務報表，管理層負責製作，核數師會利用自己的審計方式去進行審計，提供審計意見，告訴投資者那盤數是否真實而公平。 自己重組資料分析 老實說，有些基金上的未來表現數列我也不太明白，亦懷疑售賣的代理有多少可以明白，以簡單的方法去分析便穩妥得多。  最簡單的方法是要求代理，把投資回報以最淺白的方式列出，並模擬未來走勢。舉例有人投資10萬元買基金，認購費4%，即是4000元，餘下9.6萬元才是投資的本金。 首幾年表現最重要 首年回報6%，本金增至101,760元，基金收取每年資產值2%管理費，於是本金減至99,724.8元，仍然少於起初的10萬元。第2年仍有回報6%，本金增至105,708.3。如果回報及收費不變，5年後有116,126.4元。比起沒有認購費，少了約4,800元，是起初本金的4.8%。  另一種情況是首3年回報-3%，次2年回報5%，管理費每年2%，如有認購費，一年後在扣除收費前有93,120元，扣除收費後只有91,257.6元，如是者就算在第4及5年有年回報5%，本金只有87,316.3元，仍少於起點的10萬元。原因是收費及在首數年有負回報，投資者要在差不多第10年才返家鄉，沒有認購費，第8年已差不多返家鄉。因此基金在首數年的表現至為重要，否則費用付了，本金卻越來越少。    香港浸會大學會計及法律系講師　李兆波  電郵地址：mailto:simonsplee@gmail.com"
20080802-190,20080802,190,財話短說煤氣附屬發78億定息債,財話短說 煤氣附屬發78億定息債 ▲煤氣（003）宣佈，為全資附屬發行總額78億（約10億美元）、票面息率6.25%的10年期定息票據作擔保。煤氣指今次發債是今年迄今亞洲規模最大的投資級別企業發債事項，發債所得款項將用於再融資、資本開支，或營運資金。
20080802-191,20080802,191,財話短說中電半年售電量跌4%,財話短說 中電半年售電量跌4% ▲中電控股（002）旗下負責九龍及新界區供電的中華電力，公佈今年上半年售電數據，因受到向內地售電大幅減少18.9%所拖累，整體總售電量下跌4%，本港總售電量跌1.5%。上半年總售電量中12%是售予內地，餘下則是本地售電。
