key,date,article_daily_id,title,text
20080818-113,20080818,113,平保：A股最苦時刻已過,平保：A股最苦時刻已過 【本報訊】平安保險（2318）總經理張子欣表示，今年以來A股累跌3000點，相信已經度過最艱苦的時刻，料投資市場下半年仍然波動，不過，相對上半年會較為平穩及樂觀，預期今年底或明年初股市會較為明朗。副首席投資業務執行官陳德賢補充，下半年投資策略仍會比較審慎，將會進一步提高固定投資比重。截至6月底止，該比重為64.2%。 提高固定投資比重 海外市場投資方面，張子欣指，港股及H股仍然是投資核心，主因對港股熟悉程度較高，穩定的分紅回報有利長期投資，惟他不排除市場向下波動，因此投資取向較為審慎。  收購富通資產管理業務50%股權一事，張子欣指，原定下半年通過有關當局審批，由於準備資料需時，現時審批程序仍在正常地進行中。另外，與新加坡大華銀行在內地籌建的合資基金公司，有關工作仍在籌備當中。  董事長兼首席執行官馬明哲表示，旗下各子公司資本充足率很足夠，暫無進一步融資計劃。他指，平保短期仍有足夠資本滿足子公司資金所需，若有需要，將按各子公司業務發展、資本充足率及償付能力進行注資。雖然平保A、H股股價低迷，他表示，暫時無回購計劃，個人亦沒有增持或減持股份。 暫無意融資或回購 平保上半年業績表現雖然優於預期，但純利仍錄得2.09%的跌幅，主要受資本市場疲弱，拖累總投資收益急挫63.96%，基於同一原因，反映保險股未來增長潛力的內涵價值亦跌13.52%。  證券界普遍對平保抱正面看法，瑞信表示，上半年A股急挫48%，平保業績仍然強勁，由於投資收入急降，次季稅前溢利未如理想，惟仍對平保抱樂觀看法，當股市轉趨平穩，預期全年內涵價值可增長18至20%。  美林研究報告則指，平保下半年增長空間有限，認為其需要倚重核心的壽險業務，未來仍充滿挑戰。  嘉誠證券維持平保評級為「跑贏大市」，惟大削其目標價至78元，主因未實現投資虧損並未影響盈利表現，但拖累內涵價值急跌。花旗看法較正面，並分別調高平保今明兩年盈利預測14%及4%。 證券界看平保前景及目標價 美林證券行評級*：中性  目標價：67.32元　變幅：不變　潛在升幅#：40.25%    花旗證券行評級*：買入  目標價：70.00元　變幅：不變　潛在升幅#：45.83%    嘉誠證券行評級*：跑贏大市  目標價：78.00元　變幅：-25.71%　潛在升幅#：62.50%    瑞信證券行評級*：跑贏大市  目標價：83.00元　變幅：不變　潛在升幅#：72.92%    *評級全部維持不變  #平保昨收報48元，跌1.84%
20080818-114,20080818,114,二手速遞　新界雅典居中層兩年升14%,二手速遞　新界 雅典居中層兩年升14% ▲中原劉冬冬指出，馬鞍山雅典居8座中層C室，1068方呎，連車位，成交價525萬元，呎價4916元。原業主持貨2年獲利65萬元，升值近14.1%。
20080818-115,20080818,115,豐隆准港辦伊斯蘭金融分行另設窗口　推商品交易存款,豐隆准港辦伊斯蘭金融 分行另設窗口　推商品交易存款 【本報訊】消息透露，擁有大馬背景的豐隆銀行旗下香港分行，已向金管局遞交在港設立伊斯蘭銀行業務窗口的申請，並獲當局認可。短期內該行將與企業客戶達成首宗以商品買賣形式安排、接近定期存款服務的商品交易存款（簡稱CMD）。　記者：劉美儀 該批CMD協定金額為1億美元（約7.8億港元），豐隆亦不排除稍後推出其他符合教規的伊斯蘭投資產品。是次乃首趟有伊斯蘭銀行業務窗口（window）在海外市場設立，由於本港並未草擬伊斯蘭銀行法，故窗口模式是本土註冊伊斯蘭認可機構的另類選擇。 今舉行設立窗口儀式 由大馬郭令燦家族持有的豐隆集團，旗下豐隆銀行已在馬國註冊成立伊斯蘭銀行，並設有審定產品標準的教規委員會。現時香港分行設立的窗口，屬總行延伸海外的業務平台，理論上當地全線伊斯蘭銀行服務都可在港平台推出，惟本港業務的主要監管地，仍屬馬來西亞中央銀行範疇。  豐隆銀行香港分行將於今日傍晚舉行在港設立窗口的儀式，據悉，金管局副總裁蔡耀君及余偉文將會出席。金管局發言人表示，歡迎在港發展伊斯蘭金融服務的新安排，但不會評論個別銀行的申請。豐隆銀行香港分行行政總裁譚炳勝上周接受查詢時回應稱，正就本港設立伊斯蘭金融服務窗口的安排積極推進中。  消息指出，豐隆總行已設立伊斯蘭銀行，故本港分行在資產負債管理上，可更享靈活彈性，例如透過CMD吸收的存款，若無其他資金出路，可拆回予總行，該行亦可配對在港推出其他伊斯蘭投資服務或資產，如伊斯蘭按揭或基金。估計未來業務來源，海外客戶佔七成，其餘由本地企業及機構客戶帶動。 有助承銷伊斯蘭債券 豐隆香港分行即將推出的CMD，據悉投資期為3至6個月，透過符合教規的商品買賣內含「嘜高」的溢價，為存戶提供等同利息的投資回報。消息說，該行在港設立伊斯蘭窗口後，對日後承銷其他在港發行的伊斯蘭債券亦有利，讓伊斯蘭背景的投資者更放心買賣。由機管局「打頭陣」在港發行的伊斯蘭債券，涉及的稅務豁免安排可望10月份解決，料可為本港推出伊斯蘭產品製造聲勢。
20080818-116,20080818,116,南航半年經營虧損12億,南航半年經營虧損12億 【本報訊】南方航空（1055）昨公佈，截至今年6月底止中期純利8.47億元（人民幣．下同），增長4倍，每股盈利0.19元，不派息。  事實上，南航上半年錄得經營虧損11.68億元，只因人民幣升值帶來滙兌收益26.35億元，帶挈純利大增。  南航對下半年前景不表樂觀，指國際和國內宏觀經濟環境不明朗，航空公司可能面臨需求不足、市場競爭激烈及油價高企三方面的壓力，將要面對一個較長的嚴冬。公司同時宣佈，每10股轉增5股，向全體股東轉增21.87億股，令總股數增至65.6億股。 多賺4倍　看淡前景 上半年，南航收入增加9.1%，至267.81億元，總開支提高14%，至280億元，因而錄得經營虧損11.68億元；當中，只有港澳地區錄得經營利潤3200萬元，國內航線轉盈為虧，錄得經營虧損5.13億元，國際線經營虧損增至6.87億元。  油價上升及擴大機隊使燃油成本增加，燃油開支達到103.83億元，大升兩成，佔總開支37%。期內，平均每公里客運及貨運收益分別是0.6元及5.77元，升1.7及1.8%。  財務方面，南航上半年的利息支出是9.95億元，減少12%，主因是利息下降，目前的總借貸是523.5億元，手持現金51.4億元。南航昨收2.58元，跌0.8%。
20080818-117,20080818,117,TOM虧損擴至5.5億,TOM虧損擴至5.5億 【本報訊】TOM集團（2383）公佈截至今年6月底止中期業績，因期內須為若干第一代流動通訊產品及服務相關業務之無形資產作4.72億元的減值撥備，加上債券滙兌錄得5400萬元虧損，令整體虧損由去年同期的8495.2萬元擴大至5.47億元，每股虧損14.06仙，不派中期息。  集團4.72億元撥備主要來自對北京博訊融通信息科技投資的商譽撥備，首席執行官楊國猛拒絕預測，是否須再作巨額撥備，只表示「希望下半年唔需要」。 撥備4.7億天災礙收入 期內，集團整體收入較上年同期減少1.1%至13.32億元，未計入一次性非現金流開支，經營溢利增3.3%至1027.6萬元，互聯網及出版業務繼續是核心收入來源，分別錄得5100萬元及6400萬元的分部溢利，增55%及10.3%。  戶外傳媒業務盈轉虧，由於四川地震及不少二三線城市開始城市重整規劃，加上大部份新推出的媒體須經投標程序導致成本大幅提高，令此業務錄得900萬元虧損。電視業務虧損擴至3200萬元，因旗下華娛衞視在深圳落地訊號受阻影響覆蓋，加上不少廣告客戶因天災而擱置市場推廣計劃。  楊國猛表示，華娛落地受阻是政策及溝通的問題，惟5月已回復正常，至於早前與網上電視商Joost組合營拓高清網上視頻，他指現時內地逾半網民均於網上收看電視，合營符合市場趨勢之餘，亦可擴大華娛的傳統電視覆蓋。
20080818-118,20080818,118,特稿工業股暫難走出困境,特稿 工業股暫難走出困境 嚴峻的營商環境導致上半年國內有多達6.7萬家企業倒閉，近期工業股開始陸續公佈上半年業績，亦已充份反映營商環境的嚴峻情況。中央已明確將宏觀調控的首要任務，由「雙防」（防經濟過熱、防通脹）調整為「一保一控」（保持經濟平穩較快發展、控制物價過快上漲），但下半年工業股能否因而扭轉困境，似乎未許樂觀。  法巴證券聯席董事王華發表報告指出，工業股目前仍面對兩大困境，勞工成本上升及資金緊絀問題，由於A股和地產市道低迷，鎖住不少資金，甚至影響企業營運資金；有企業雖然遷廠至越南或內陸城市以降低成本，但過渡期會出現營運開支重叠增加問題。若中央沒有新支援措施推出，他預期下半年工業股經營環境沒有多大改善。 資金緊絀　勞工成本升 香港中小型企業商會會長吳宏斌亦認同，原油商品價近期雖顯著下降，但對廠商只帶來短暫受惠，因為訂立新定單時，客戶會要求將單價下調。他預期，環球經濟及股市大跌影響消費意欲，最快也要明年下半年市場才會復蘇。  北人印刷（187）中期業績盈轉虧，董事長王國華表示，經營環境困難，導致印刷企業利潤大幅降低甚至倒閉，印刷機械設備市場需求因而大幅萎縮，短期難望走出困境。集團表示要嚴格控制資金佔用，降低庫存佔用。  南太電子（2633）第二季大跌66.6%，非執行主席顧明均指出，近期環球經濟不景，拖累集團業績，預期未來困難的營商環境會進一步加劇，並對集團未來數季的營運業績造成負面影響。  不過，申洲國際（2313）主席馬建榮則認為，內地紡織業的寒冬已過，因內地本月初已調高對紡織界的出口退稅率兩個百分點，反映對紡織業界支持。  南華證券分析員陳浩銘亦指出，隨着原油商品價格回落，工業股的經營成本可望減輕，下半年業績表現會好些，但仍未反映在股價上。他指不少工業股的市盈率已跌至單位數字，股價具吸引力，只是大市氣氛偏淡。 部份工業股上半年業績 南太電子(2633)  盈利/(虧損)(萬元)：1708.2#　變幅(%)：-46.7    東大照明(8229)*  盈利/(虧損)(萬元)：301.5　變幅(%)：-15.2    裕興科技(8005)  盈利/(虧損)(萬元)：76.5　變幅(%)：-95.7    上聲國際(8226)  盈利/(虧損)(萬元)：(180.2)　變幅(%)：虧損擴大    北人印刷(187)  盈利/(虧損)(萬元)：(2097.6)~　變幅(%)：盈轉虧    *4至6月季度業績  #單位為美元；~單位為人民幣
20080818-119,20080818,119,招金半年純利增35%,招金半年純利增35% 【本報訊】招金礦業（1818）受惠於黃金銷售價格上漲29.5%至每克209.35元（人民幣．下同），加上企業所得稅率下降至25%，帶動上半年純利增長34.6%至2.14億元，每股盈利0.15元，不派中期息。 產量減一成 截至6月底，招金尚有784千克的庫存黃金，以上海黃金交易所上半年平均銷售價每克206.98元計，若全數售出，淨利潤將增加6830萬元。  上半年招金的黃金總產量減少10%，至8423千克，主因是地方礦山安全事故，造成煙台地區非煤礦山停產整頓13日，以及精礦產出減少，使招金購入金精礦及加工的數量下降。期內毛利率亦下降9.27個百分點至53.96%，主要是外購金銷售有所增加，及新收購礦山的企業毛利率較低所致。  值得注意是招金積極收購礦山及探礦權等，令手持現金較去年底減63.7%，至5.9億元。展望下半年，招金已成立對外開發的領導組織架構，確保實現全年對外開發目標計劃；另會加大地質探礦力度，確保全年探礦新增儲量突破35噸。
20080818-120,20080818,120,泓富派息率達9.2厘,泓富派息率達9.2厘 【本報訊】泓富產業信託（808）公佈中期業績，上半年可分派收入8902.4萬元，按年增長9.46%，每基金單位分派6.9仙，增加8%；以該基金6月底及昨日收市價同為1.5元計算，按年計分派收益率為9.2厘。 派6.9仙　增8% 期內，泓富收益升7.7%至1.29億元，物業收入淨額增10.2%至1.04億元，平均呎租為14.07元，增加5.9%。  泓富上月取消利率掉期，署理行政總裁葉錦泰表示，息率低企下作出有關舉措，是符合股東效益，亦不會為全年業績帶來重大影響；是次獲益7100萬元，可為未來併購增添彈藥。  他補充，除優化現有資產外，泓富仍在中港兩地物色併購機會，本港以甲級商廈及工廈物業為主，內地方面則留意位處主要地段的甲級商廈，但由於全球信貸危機依然存在，故不急於進行收購。 中港伺機併購 泓富上半年續租率由去年同期的56.1%，降至51.3%，主席趙國雄解釋，是公司優化物業定位，導致部份租戶流失；而泓富今年約有30%續租樓面，上半年已完成17%，續租租金平均升幅達24.6%；他有信心下半年出租率跟上半年的99.1%相若。  展望下半年本港商廈市道，趙國雄說，未來3年商廈供應量持續緊張，及本港經濟基調良好，看好租金續有增長，而且「唔係好多行業負擔到咁高租金」，將引致部份企業由核心商廈，遷往非核心商業區，有利其發展。
20080818-121,20080818,121,財話短說群星半年多賺76%,財話短說 群星半年多賺76% ▲群星紙業（3868）上半年純利1.9億元（人民幣．下同），增長76.1%，主要受惠於其他收益激增163倍，至5013.9萬元；每股盈利18分，派中期息4.16港仙。其他收益包括存款利息收入2110萬元，及財務資產已變現收益淨額2910萬元。期內營業額升31.8%至6.83億元，因銷量及售價俱升。
20080818-122,20080818,122,會德豐地產賺6.6億,會德豐地產賺6.6億 【本報訊】會德豐地產（049）昨公佈，截至6月底止中期純利6.55億元，增長35.6%，每股盈利31.6仙，維持派發中期息2仙。該公司更改截數日期，故今次公佈的業績，是對比截至07年9月底止的中期業績。  會德豐地產上半年營業額激增5.2倍，至39.73億元，主要因為旗下會德豐地產（新加坡）公司在新加坡的公寓項目海景華庭期內落成入賬，確認到較高的物業銷售收益。地產業務的收入及經營利潤分別是36.2億及6.86億元，07年度半年則只有1.6億及700萬元。  該公司收租業務的收入及經營利潤分別是1.85億及1.3億元，增加16%和20.4%，主要來自香港的會德豐大廈、健威坊及新加坡的會德豐廣場。另外，今年上半年錄得投資物業重估增值7.11億元，提高2.65倍。
20080818-123,20080818,123,吞鴻興後再出手　CVC入股宜進利,吞鴻興後再出手　CVC入股宜進利 【本報訊】由「紅籌之父」梁伯韜任高級顧問的私募基金CVC，繼取得老牌工業股鴻興印刷（450）控股權後再度出手，計劃入股被基金洗倉的宜進利（304）。CVC董事總經理何志傑接受查詢時表示，宜進利並非市場想像得那麼差，決定入股主要看中其生產及零售業務。　記者：陳健文 宜進利昨日開市前停牌，並於早上9時58分發出通告，指停牌是有待發出有關CVC提出，可能購買公司股份的意向性要約的公佈。何志傑向本報承認，CVC有意購入宜進利一定比例的股權，惟不肯透露入股的作價、股數及具體方式。 CVC：非想像那麼差 他說，市場上有關宜進利的多項傳聞他們也略有所聞，惟研究過其賬目後，認為宜進利股價急瀉與市場氣氛變差有關，強調CVC會就入股一事小心研究。據悉，CVC就入股宜進利而進行的盡職審查仍在進行中。  有外資分析員估計，由於宜進利早前所簽訂貸款的其中一項條款──主席周湛煌及執行董事梁榕兩人持股要保持25%以上，及要具有管理控制權。估計今次將有別於入股鴻興，CVC將不會取得宜進利控制權，以免因而破壞條款，令銀行即時催收貸款。  該分析員所指的貸款，是宜進利於上月29日宣佈，與包括荷蘭銀行、美國銀行及德意志銀行等多家銀行達成的銀團貸款協議，總額約15.6億元，期限為3年。 不擁控股權免違貸款條約 宜進利於上周一股價急瀉後，管理層召開電話會議時曾表示，公司財務情況沒有異樣，淨負債額約40億元，與3月時相若；各項貸款安排亦沒有變更，約18億元的過渡性貸款已延至明年，並已就約12億元的銀團貸款進行再融資，管理層沒有透露公司有資金需要。  高盛昨發出研究報告，維持給予宜進利「買入」評級，但目標價由8.9元下調至5元。該行表示，在與管理層會面及研究過其財務狀況後，認為宜進利能度過難關。高盛指宜進利正研究發行年息10厘的債券，最壞情況下，其每股資產淨值為0.8元。該公司停牌前報1.5元。 高危名單 摩通：24隻股財政弱 近期部份二、三線上市公司因財務問題，被基金大肆洗倉，股價單日動輒跌逾50%甚至突然停牌。摩根大通認為，在現市況下最重要是持有現金，該行並根據負債比率、純利率及淨營運資金對銷售額比率等標準，選出24家財務狀況較脆弱的公司（見表）。  摩通所選的24家公司，不乏近期頻頻見報的名字，包括表示無力償還部份債務的德發（928），及被基金洗倉的宜進利（304）。名單亦包括多隻基金愛股，如創科實業（669）、理文造紙（2314）、冠華國際（539）及太平洋恩利（1174）等。 創科理文造紙上榜 該行認為，借貸收縮對中港企業的影響，現時才剛開始顯現，預期未來數月公司所面對的情況將變得更艱難，投資者在選股時，應考慮公司的資金處理能力。摩通相信，只有那些能夠管理好現金流的公司，才可度過今次難關。 摩根大通列財政薄弱公司*名單 宜進利（304）　昨收：1.50元　變幅：停牌  德發集團（928）　昨收：0.40元　變幅：停牌  利君國際（2005）　昨收：0.62元　變幅：-8.82%  中國製藥（1093）　昨收：2.54元　變幅：-8.30%  常茂生化（8208）　昨收：1.09元　變幅：-4.39%  聯邦製藥（3933）　昨收：3.80元　變幅：-4.28%  中國龍工（3339）　昨收：6.28元　變幅：-4.27%  深圳中航（161）　昨收：4.32元　變幅：-3.79%  天工國際（826）　昨收：3.19元　變幅：-3.33%  創科實業（669）　昨收：6.89元　變幅：-2.82%  亞洲水泥（743）　昨收：4.65元　變幅：-2.72%  建滔積層板（1888）　昨收：4.69元　變幅：-2.70%  太平洋恩利（1174）　昨收：1.19元　變幅：-2.46%  理文造紙（2314）　昨收：7.61元　變幅：-2.44%  海升果汁（359）　昨收：1.16元　變幅：-1.69%  宏華集團（196）　昨收：2.52元　變幅：-1.56%  中電新能源（735）　昨收：0.72元　變幅：-1.37%  冠華國際（539）　昨收：2.06元　變幅：-0.96%  卡森國際（496）　昨收：1.35元　變幅：無升跌  蜆壳電器（081）　昨收：3.70元　變幅：無升跌  光宇科技（1043）　昨收：3.90元　變幅：無升跌  百營環球（761）　昨收：1.19元　變幅：+0.85%  安德利果汁（8259）　昨收：0.60元　變幅：+1.69%  恒豐金業（870）　昨收：2.02元　變幅：+2.02%    *市值逾1億美元
20080818-124,20080818,124,財話短說天能中期盈利增83%,財話短說 天能中期盈利增83% ▲天能動力（819）公佈，上半年純利1.21億元（人民幣．下同），按年增長83.3%，每股盈利12.1分，不派中期息。期內營業額12.7億元，升76.1%，主要由於佔營業額達97%的鉛酸電池銷售急增所致。但受累於鉛的價格上漲，導致毛利率降1.6個百分點至23.2%。
20080818-125,20080818,125,偉易達：北美收入跌,偉易達：北美收入跌 【本報訊】繼續有工業股表示受到美國市場放緩的影響。偉易達（303）昨公佈截至6月底止首季度管理報告書，雖然董事會對公司4至6月的季度表現感到滿意，但仍關注產品所在市場的經濟狀況，尤其是美國市場，皆因按地區劃分，偉易達首季度來自最主要的北美洲市場收入錄得下跌。  按業務種類分，佔該公司營業額最大的電訊產品銷售收入，亦較去年同期縮減。  截至3月底止年度，偉易達旗下北美洲及電訊產品業務，分別佔公司全年營業額比重55.9%及44.3%；而歐洲和亞太區，只佔38%及3.6%；電子學習產品及承包生產業務，則佔39.7%及16%。 電訊產品收入亦降 偉易達表示，雖然美國市場放緩，令公司北美洲的電訊品牌產品首季收入下跌，但偉易達及AT&T兩個品牌合計，仍佔據美國無線電話市場領導地位。至於首季度總收入仍錄得增長，主要有賴電子學習產品業務及承包生產業務的銷售額增加；而歐洲、亞太區和其他市場，首季度收入亦錄得上升，抵銷了北美洲銷情減慢的影響。  除了北美洲營業額受美國經濟放緩拖累，偉易達董事局亦指，高油價、中國勞工成本上漲及通脹升溫，均令公司成本繼續面臨壓力。
20080818-126,20080818,126,財話短說中國興業向深發展購債權,財話短說 中國興業向深發展購債權 ▲中國興業（132）與深圳發展銀行佛山分行等擬訂立債權轉讓協議，將向後者購買債權，代價約9096萬元，以內部現金資源支付。中國興業認為，債權轉讓協議可容許集團一次性解決所有申索，讓集團集中資源於核心業務發展；據董事估計，至少4320萬至7050萬元的債權可悉數取回現金。
20080818-127,20080818,127,財話短說中軟奪滬地鐵系統項目,財話短說 中軟奪滬地鐵系統項目 ▲中軟國際（8216）旗下上海華騰軟件系統，贏得上海地鐵自動售檢票系統最大招標項目，合約涉及逾3億元人民幣。該系統涵蓋7號線28個車站及羅店公共交通樞紐5個車站，及11號線北段一期20個車站的系統設計及集成、設備供應、施工安裝、系統測試以至開通營運。
20080818-128,20080818,128,轉主板手續研再簡化,轉主板手續研再簡化 【本報訊】港交所（388）自7月1日開始簡化創業板公司轉主板上市的手續後，截至昨日已有4家創業板公司成功轉板。不過，港交所上市委員會委員黃天祐表示，現時轉板申請並未顯著增加，將研究進一步簡化申請轉板的手續。 個半月四公司轉板 他昨日出席美聯工商舖（459）轉板儀式後稱，創業板公司是否決定申請轉主板，會考慮包括股份成交量，及擴大股東基礎等多項因素，從目前數字來看，申請轉板的情況維持正常。  同一場合，美聯工商舖行政總裁黃子華表示，中環核心地段的寫字樓供不應求，即使香港及全球經濟出現放緩，只會對租務市場造成輕微影響，估計下半年甲級寫字樓租金會上升一成，但價格仍有下調壓力；不過租務市場表現強勁，相信可彌補買賣業務倒退的影響。
20080818-129,20080818,129,群星料保25%毛利率,群星料保25%毛利率 【本報訊】群星紙業（3868）主席朱玉國昨日表示，由於預料內地裝飾原紙市場未來每年可維持約20%的增長，故公司仍有不少增長空間，暫無意於上游或下游業務進行收購。 暫無意收購 群星財務總監歐陽廣華補充，據非正式統計，該公司目前市場佔有率約為8%。  歐陽廣華指，今年包括原材料在內的各項成本雖上升不少，但公司透過推出新產品、調整產品組合及售價，令上半年毛利率能夠維持，料下半年亦可以保持。群星今年上半年整體毛利率維持25.3%，今年1月將平均產品售價上調2至3%。  按群星的擴產計劃，於今年尾、明年初及明年尾，各有6萬噸新產能投產（主要為裝飾原紙）；而今、明兩年之資本性開支，分別約為7.17億及5.29億人民幣，將以內部資源支付。  目前群星總產能約為20萬噸，主要為裝飾原紙。
20080818-130,20080818,130,財話短說國航載客量跌6.8%,財話短說 國航載客量跌6.8% ▲中國國際航空（753）公佈，7月份載客298.4萬人次，載貨8.16萬噸，分別較去年同期跌6.8%及升7.8%；其中港澳及國際線的載客量分別下跌24及19%。載客及載貨率則分別是73.3及58.9%，跌8.1及升3.3個百分點。
