key,date,article_daily_id,title,text
20081024-239,20081024,239,中國留英學生被殺案三疑兇落網,中國留英學生被殺案 三疑兇落網 中國留學生兩個月前在英國紐卡素遇害一案案情，前日（周四）取得突破，警方拘捕了三名中國人，懷疑他們是殺害楊振興和女友周茜的兇手。  警方根據線報，前天凌晨在多個地方進行連串搜捕行動，拘捕了17人，大部份是涉及爆竊案，但在莫珀斯拘捕的三名年齡介乎22歲至33歲可疑中國男子時，卻發現三人是涉及今年8月紐卡素殺害楊振興和周茜的兇案。25歲周茜及楊振興，8月初被發現慘死在寓所內，楊振興頭部嚴重受創，估計死前受虐近一小時，兇徒還把兩人飼養的花貓都溺斃。有報道指楊振興替國際賭波集團出千，疑因欠下「線人」酬勞，遭上門尋仇。但警方指犯罪集團可能一早盯上兩人，誤以為他們是來自有錢家庭。  中新社/法新社
20081024-240,20081024,240,威廉哈里非洲齊腹瀉,"威廉哈里非洲齊腹瀉 英國威廉和哈里王子，上周六起在非洲參加慈善汽車越野賽，但周一在特蘭斯凱疑水土不服，與隊友齊齊腹瀉，被迫暫停比賽，現已重返賽道。兩位王子為兒童組織籌款，需於一周內完成1,609公里賽程。  英國《每日電訊報》"
20081024-241,20081024,241,彭博可三度角逐紐約市長,彭博可三度角逐紐約市長 美國紐約市議會前天以29票對22票，通過將市長任期由兩屆延長至三屆，令現任市長彭博（MichaelBloomberg）和市議會成員可角逐第三任期。彭博表示，此舉有利他們合作帶領紐約走出經濟困局。  路透社
20081024-242,20081024,242,奧黨主席斷背被撤職,奧黨主席斷背被撤職 奧地利極右翼政客海德爾（JoergHaider圖右）月中車禍身亡，繼承他出任「未來奧地利聯盟」政黨領袖的27歲佩茨納（StefanPetzner圖左），公開兩人斷背，關係「超越友誼」，說傷心得想和他「一起死去」。  英國《泰晤士報》
20081024-243,20081024,243,霍金明年將卸任劍橋教授,霍金明年將卸任劍橋教授 英國劍橋大學宣佈，天體物理學家霍金（StephenHawking）明年1月年屆67歲，根據校方規定要退休，因此霍金明年1月就要卸任盧卡斯數學系教授。校方將指派另一名學者擔任該職，霍金將會以榮譽教授留在大學做研究。  法新社
20081024-244,20081024,244,科學家成功消除老鼠記憶無痛失戀或成真,科學家成功消除老鼠記憶 無痛失戀或成真 荷李活電影《無痛失戀》中消除痛苦記憶的技術，成真又接近了一步。科學家在老鼠實驗中，成功選擇性消除特定記憶。  美國喬治亞醫科大學腦研究所所長錢卓（JoeTsien），與上海華東師範大學的科學家合作，發現一種叫「CaMKII」的蛋白激酶，在記憶形成過程有重要作用，而在老鼠記起特定記憶時，令老鼠腦中這種「記憶分子」過多，可將記憶抹走。 沒有傷害一般記憶力 錢卓的研究隊就用這種方法，消除老鼠對受過電擊的恐懼記憶。他們也試過給老鼠幾種玩具玩，然後抹走其中一種玩具的記憶，結果老鼠的反應就像見到新玩具一樣，對其他玩具反應不變，證明沒有傷害一般記憶力。  錢卓指他日或可用同樣方法，在人憶舊事時服用或注射「記憶分子」藥物，來抹走痛苦記憶，像困擾退伍軍人的戰場回憶，以及引起嚴重恐懼症的記憶。  但錢卓表明，人腦比老鼠腦複雜得多，同樣方法用到人身上，可能是「幾年到幾十年」後的事。他也不認同《無痛失戀》的情節：「如果關係不好，希望有藥丸抹走對方或那段關係的記憶，那不是解決辦法。」  法新社/英國《每日電訊報》
20081024-245,20081024,245,Gphone開售熱賣有難度,"Gphone開售熱賣有難度 開售了！互聯網搜尋器一哥Google踩過界進軍手機業的首部Gphone──G1，前日（周三）在美國開售。沒有對手蘋果iPhone推售時的墟冚場面，但經銷商T-mobile在芝加哥的分店特別提早營業，滿足捧場客。  G1售價179美元（1,396港元），需與經銷商簽兩年合約，「齋機」價400美元（3,120港元）。不少人對G1開放程式碼的Android興致勃勃，因為既可自行開發軟件，又可免費下載其他人的傑作。  有手機專家批評，G1沒有像樣的媒體播放器，又不支援商業電子郵箱，耳機駁口更使用USB插槽，而非普遍使用3.5毫米插口，「這只會將G1複雜化，若Google想藉此兼賣配件，恐怕只會事與願違。」  themoneytimes網站"
20081024-246,20081024,246,麻生與妻資產總值3800萬,"麻生與妻資產總值3800萬 日本首相麻生太郎專蒲高級夜店，被指太富有和脫離民眾之際，當局昨天公開他與妻兒的資產，名下包括兩輛寶馬汽車、東京和日本南部多個名貴物業、58件藝術品和七個高爾夫球會席，資產總值3,800萬港元，是內閣中第二最有錢政客，而最有錢的是總務大臣鳩山邦夫。  路透社"
20081024-247,20081024,247,馬來西亞禁女性「男仔頭」,馬來西亞禁女性「男仔頭」 馬來西亞伊斯蘭法理事會前天頒令，禁止女性剪短髮或作男性打扮，也禁止她們行為舉止模仿男性，指這些行為有違伊斯蘭教義。因禁令未經議會通過，暫沒法律約束力，也沒列明違令的懲罰。  美聯社
20081024-248,20081024,248,沉迷Facebook易變交友狂,沉迷Facebook易變交友狂 打開Facebook，檢查一下朋友名單，名單是否很長？素未謀面的「朋友」是否很多？如果是，你或者已患上「識朋友癮」。  上癮病專家斯莫爾伍德（DavidSmallwood）估計有10%網民容易患上「識朋友癮」，當中以女士最易中招。她們重視關係，如果在Facebook上有數百名朋友，她們自信心會增強，會覺得很成功。  斯莫爾伍德警告，沉溺酒精和藥品，以及購物狂不宜玩Facebook。例如Facebook上設有「request」功能，對方要答應，才能將他加入朋友名單中，若對方拒絕，會打擊染上「識朋友癮」用戶的心靈。斯莫爾伍德忠告，若發現以上「病徵」，應立即鏟走Facebook。  英國《每日電訊報》
20081024-249,20081024,249,日清杯麵含藥味投訴21宗,日清杯麵含藥味投訴21宗 日清食品杯麵含防蟲劑事件擴大。公司表示，自4月起至今，共收到21宗合味道杯麵含藥味的投訴，化驗後發現全部含防蟲劑成份二氯苯。一名婦人周一食用合味道杯麵後不適，日清子公司明星食品製造的CO．OP杯裝拉麵醬油味，也驗出有防蟲劑成份。  日本東京廣播公司
20081024-250,20081024,250,以色列蛇Spa爬行當按摩,以色列蛇Spa爬行當按摩 Spa有水療有真人按摩，在以色列原來還有蛇Spa，讓多條無毒粗蛇幼蛇隨意在身上游走，藉以減壓。  老闆芭勒（AraBarak）說，有次看見朋友玩蛇後一身輕鬆，想起蛇爬行時會產生磨擦作用，有按摩功效，粗蛇較大力可提供深層按摩，幼蛇則可解決皮膚表面痠軟，於是前年開設蛇Spa，更找來多條佛羅里達皇帝蛇、粟米蛇和牛奶蛇侍客，每次收費30英鎊（379港元）。你敢不敢試？  英國《每日郵報》/《每日電訊報》
20081024-251,20081024,251,新一代超音速飛機倫敦3小時飛紐約,"新一代超音速飛機 倫敦3小時飛紐約 和諧式客機退役五年後，超音速飛行幾乎成為歷史，但美國Aerion公司宣佈，正研製新一代超音速飛機，不但沒有和諧式客機的噪音，而且票價較便宜，還可縮短公務繁忙人士穿梭大西洋的時間。  Aerion發言人米勒（JeffMiller）指出，新超音速飛機的外形和體積，未必及得上和諧式客機的優雅，但最高時速是音速1.6倍，來往倫敦和紐約毋須3小時，比現時客機飛行時間快60%，而且不會像和諧式客機發出吵耳的噪音，即使以音速1.15倍飛行，也不會出現音爆現象。 票價平過和諧式客機 新超音速飛機造價為4,750萬英鎊（5.7億港元），但米勒強調飛機每公里飛行成本，跟波音747客機相若，票價也肯定比和諧式客機退役前的8,292鎊（99,915港元）便宜。新超音速客機將於2012年試飛，至少有50人對此感興趣。  和諧式客機1976年首航，但2000年在巴黎發生空難，加上維修成本高昂，英國航空公司和法國航空公司在2003年底把和諧式客機全面退役。  英國《每日電訊報》"
20081024-252,20081024,252,大隻佬變性人扮藝伎圓夢,大隻佬變性人扮藝伎圓夢 日本藝伎令人想起小鳥依人，京都最近卻出現一名大隻佬藝伎。一名前英國國防部變性人，渴望一嚐當藝伎滋味，幾經游說，終獲京都旅遊部職員協助達成心願。  來自倫敦的瑪麗．默多克，原名馬爾科姆，現年70歲，正接受荷爾蒙變性治療。她心願是穿和服扮藝伎，可是她身高1米80，橫看豎看都像個男人，京都當局以這是女性「專利」為理由拒絕要求。但瑪麗死心不息，「告訴他們護照上有女性名字，並展示乳房」，最終獲他們首肯。  瑪麗曾在國防部工作，負責制訂軍機飛行路線，1994年離職。2004年，瑪麗開始使用女性荷爾蒙，正排期做變性手術。  《每日電訊報》
20081024-253,20081024,253,感應器傳心聲植物寫網誌,感應器傳心聲植物寫網誌 科學家相信向植物播放音樂，有助植物生長，現在日本有一棵植物懂得「寫網誌」，講出自己的感受。  「綠小姐」是東京附近鎌倉市一間咖啡店中的心葉毬蘭，它並非會寫字，而是慶應大學工程師栗原慧透過感應器，量度樹葉上的電子訊號強弱、光線和人類接觸，將訊號傳送到電腦，再利用算式把訊號和其他元素，例如天氣和溫度轉化成日文。「綠小姐」上周寫道：「今天天氣晴朗，我可以好好曬日光浴，真的很開心。」  英國《每日郵報》
20081024-254,20081024,254,長壽眼角膜「活」了123年,長壽眼角膜「活」了123年 世界最長壽紀錄是122歲，但現存一隻眼角膜更厲害，「活」足123年，比巴黎艾菲爾鐵塔面世還要早。  這個最耐用眼角膜的主人是80歲挪威男子奧納（BerntAune）說：「這是挪威最老的眼睛，我不知它是否全球最老，但我現在的視力已不大好。」他1958年接受眼角膜移植手術，捐贈者是一名於1885年6月出生的男子。  醫生指，「若說這是全球最老的存活器官，我不會感到詫異」，眼角膜移植是在20世紀初出現，通常都是在老人死後才割下來的，在1950年代的醫生都認為，移植的眼角膜只能用五年。相比之下，奧納的眼角膜算非常耐用。根據《健力士世界紀錄大全》，全球最長壽人瑞是法國的卡爾芒特（JeanneCalment），她1997年逝世終年122歲。  路透社
20081024-255,20081024,255,人越感溫暖心腸越熱,人越感溫暖心腸越熱 人體越溫暖，心腸越熱。美國有研究發現，人抓着熱的東西，不但可暖和身體，心腸還會隨之熾熱，對人更加慷慨和信任。  美國耶魯大學邀請了41名學生，手持一杯熱咖啡或凍咖啡，向他們講述一個虛構人物如何勤力、謹慎和有決心，然後要他們評估這個人的性格，結果顯示手掌暖笠笠的學生，較多使用慷慨、擅於交際和溫厚等親切形容詞。大學再邀請另外53名學生拿暖包或冰袋，並給他們雪糕贈券或贈飲作紀念品，結果手暖的傾向送出紀念品，手掌冷冰冰的則傾向留為己用。  科羅拉多大學研究員威廉斯（LawrenceWilliams）指出，體溫與心腸的關係與人體大腦島葉皮質有關，該區除了應付體溫轉變，還要處理信任和同情心感覺。  美聯社
20081024-256,20081024,256,麥克萊倫撐奧巴馬,麥克萊倫撐奧巴馬 美國白宮前發言人麥克萊倫（ScottMcClellan），前天開腔表態支持奧巴馬當總統，是繼前國務卿鮑威爾之後，第二位支持奧巴馬的喬治布殊政府前官員。《紐約時報》也宣佈支持奧巴馬。  麥克萊倫在2003-06年出任白宮發言人，前日為一個清談節目錄影時表示，一直希望一位可改變華府政治的人入主白宮，他相信奧巴馬可以做得到，所以會投他一票。對於麥克萊倫倒戈，共和黨不會感到意外，因為他年初出版新書，揭露華府在攻打伊拉克一事隱瞞真相，令喬治布殊很尷尬。 《紐約時報》表態支持 此外，在民主黨初選時支持希拉莉的左傾《紐約時報》，前晚也公開支持奧巴馬，因為奧巴馬「戰勝一個又一個的挑戰」、有領袖風範、將希望和改變的承諾實質化，並要求民眾要有社會責任。較早前《華盛頓郵報》和《洛杉磯時報》已表態支持奧巴馬，但報章取向向來不會對選情有重大影響。  美聯社/路透社
20081024-257,20081024,257,遭歐洲議會掌摑北京或以經濟報復,遭歐洲議會掌摑 北京或以經濟報復 歐洲議會無視北京警告，把沙哈洛夫人權獎頒給胡佳，無疑是向中國摑了一巴掌，北京表示會向歐盟交涉，但強調不會影響今天召開的亞歐峯會。 揚言違反國際做法 中國駐歐盟大使宋哲上周四已去信歐洲議會主席，警告頒獎給胡佳，將會嚴重損害中國與歐盟關係。外交部發言人秦剛昨天重申「堅決反對某些國家以人權為借口，干預別國內政」，胡佳是罪犯，「頒獎給罪犯，等同干預中國司法主權，也完全違背了這個獎項的目的」。  劉建超其後指摘頒獎給胡佳是違反國際做法，但強調不會影響亞歐峯會，因為相對當前逼切的國際事務，這是小事一樁。但這只是外交詞令，北京稍後可能會祭起經濟大棒懲治歐盟。  現時金融海嘯席捲美歐，北京若實施經濟制裁，如將買飛機定單給美國波音而非空中巴士，又或限制中國人歐遊，將令歐洲經濟雪上加霜。  北京奧運前，法國總統薩爾科齊揚言杯葛開幕禮，巴黎市讓流亡西藏精神領袖達賴喇嘛當上榮譽公民，北京就曾撒手不管民間杯葛法資家樂福超市，又禁止中國人到法國旅遊，最後迫使薩爾科齊派特使到北京叩頭。  法新社/本報記者
20081024-258,20081024,258,芬蘭新蒲點公廁酒吧,芬蘭新蒲點公廁酒吧 芬蘭圖爾庫鎮（Turku）居民的夜後蒲點，竟是公廁，因為商人海基萊（MarkkuHeikkila）將一所建於75年前的圓形公廁改建成酒吧，成了當地夜蒲熱點。  這所公廁吧內遍佈廁所用品，坐廁懸到天花變成座椅，飲品有「最後一滴」、「前列腺」和「黃金淋浴」。若不嫌惡心，可從撒烈酒的小便雕像自斟自飲。海基萊說：「不同文化背景的客人反應不一，德國人笑着高談闊論，視廁所為平常不過的話題，但其他人會視之為禁忌。」  當地10多年前起相繼出現主題酒吧，如把舊銀行、學校和藥房改建成酒吧，大受市民歡迎。  路透社
20081024-259,20081024,259,「綠基因」貓會發青光,「綠基因」貓會發青光 貓貓眼睛會在晚上發光，但美國新奧爾良這頭半歲大雄貓「綠基因」（MrGreenGenes），身處黑房而被紫外光照射，眼睛、鼻孔、齒齦、舌頭和耳朵都會發青光，是全球首隻會發青光的貓。  「綠基因」並非新品種花貓，而是美國奧德班瀕危物種研究中心透過基因改造技術，把綠色螢光蛋白植入花貓的基因序列，以便研究囊腫纖維症及其他疾病，因為貓的基因序列跟人類相近。綠色螢光蛋白是今屆諾貝爾化學獎的得獎研究，用來標記生物體內細胞的變化，最適合用來觀察癌細胞變化和轉移，追蹤化療的進度。  英國《每日郵報》
20081024-260,20081024,260,Britney帶旺男嬰取名Jayden暴增,Britney帶旺男嬰取名Jayden暴增 「Jayden」並非常見名字，但到了2025年，美國將會有一大群叫Jayden的青年大學畢業。全靠歌手BritneySpears兩年前替兒子取這個冷門名字，帶動Jayden熱潮，紐約衞生部最新統計，去年當地初生男嬰中，有846個取名Jayden，令這名字由前年的第591位，激升為去年第二位。  並非個個父母都抄襲名人明星，有不少對孩子寄予厚望，去年就有32個「救世主」（Messiah）和26個「達爾文」（Darwin）誕生。26個女娃兒是父母的「珍寶」（Prescious），25個女娃兒被視為「鑽石」（Diamond）。  美國《紐約時報》 2007紐約5大熱門BB名字 女  1.Isabella  1.Sophia  3.Emily  4.Ashley  5.Sarah    男  1.Daniel  2.Jayden  3.Michael  4.Matthew  5.Justin    資料來源：《紐約時報》
20081024-261,20081024,261,麥凱恩：佩林選後捐衫,麥凱恩：佩林選後捐衫 選情告急的麥凱恩，近日忙於箍票，還要為副手佩林的15萬美元（117萬港元）置裝費撲火，強調選後會將衣服捐給慈善機構。  佩林日前被揭發自提名以來，花了共和黨全國委員會15萬美元，來為自己及家人添置名牌衣服和扮靚，引起輿論廣泛批評。麥凱恩前日（周四）在佛州拉票時，被傳媒追問得有點不高興，只說：「佩林需要衣服，選舉後會捐出，就沒有問題。」至於怎樣捐出，麥凱恩沒回答，而他也說共和黨沒有買衣服給他。  「公民責任和道德」組織，已向聯邦選舉委員會投訴佩林，用競選經費作私人用途，違反了選舉法，因為「許多美國人現時財政緊絀，佩林花巨款買衣服尤其可惡」。  佩林把爭議歸咎於性別歧視，指外界只針對女候選人，談到男候選人時完全不會關注到衣服「那麼表面」的問題，並強調自己沒花15萬美元那麼多錢買衣服。  美聯社/法新社 扮佩林比賽 拉斯維加斯一間脫衣舞俱樂部，舉辦扮演佩林比賽。一眾脫衣舞孃各出奇謀，有人拿槍，有人戴上阿拉斯加小姐彩帶，最後由衣着保守的瓊斯（右圖）勝出。  路透社
20081024-262,20081024,262,前蘇聯核子學家綻放人權光輝,前蘇聯核子學家 綻放人權光輝 沙哈洛夫獎是由歐洲議會於1988年設立，紀念前蘇聯核子物理學家兼人權鬥士沙哈洛夫（AndreiSakharov）。沙哈洛夫為蘇聯研發氫彈，但大力反對核武擴散，並倡議禁止核試，還主張和平共存的思想，1975年獲頒諾貝爾和平獎。他下半生要求當局釋放政治犯，又反對紅軍入侵阿富汗，結果被流放到高爾基市。  歐洲議會設立沙哈洛夫獎，旨在表揚那些爭取人權自由、對抗不公義的人權鬥士或團體。前南非總統曼德拉、中國異見人士魏京生、緬甸民主領袖昂山素姬等都曾經獲此殊榮。  維基百科
20081024-263,20081024,263,金融海嘯下的日子……新生代首嘗失業　大蕭條過來人：小兒科,金融海嘯下的日子…… 新生代首嘗失業　大蕭條過來人：小兒科 金融海嘯觸發環球衰退，美國出現自911以來最嚴重的裁員潮，從未失業的精英首嘗失業滋味，社會一片絕望情緒。親身經歷1930年代大蕭條的一輩，卻流露樂觀精神，指當今經濟危機難跟大蕭條相比。 「窮得連生存也成疑」 83歲的北卡州居民克拉克（JoeClark），大蕭條時是小學生，每餐只是吃豆和番薯。他說：「無論從任何角度比較，目前危機只是小兒料。」93歲的坎寧安（Cunningham）認同：「當年我們窮得連生存也成疑問，現在已算不錯了！」  老人看得開，45歲銀行員工雷納（MichaelRaynor）卻覺得面對空前危機，他第一次失業，多年在家照顧女兒的妻子也要重新工作。雷納代表了美國「新世代失業群」，他們投身社會多年，美國經濟欣欣向榮，現時失業率卻是911恐怖襲擊以來最高，令他們首嘗失業滋味。  法新社/《今日美國報》/美國廣播公司
20081024-264,20081024,264,白宮之戰：記者「補鑊大全」 - 盧峯,白宮之戰：記者「補鑊大全」 - 盧峯 麥凱恩大勢已去是誰也看得到的情況，美國跑政治新聞的記者幾乎全部都認為奧巴馬將會在十一月四日勝出，問題是小勝還是大勝而已。從近日多個原來支持共和黨的州分都由奧巴馬領先來看，麥凱恩敗的可能比1996年的多爾（BobDole）更慘。 以備麥凱恩絕處逢生勝選 當然，政治特別是選舉有的時候是會出現意想不到的結果的。1948年大選，杜魯門總統就在一致看淡下擊敗杜威，讓政治新聞老手面目無光，幾乎要「搵窿捐」。為免今次大選重蹈六十年前的覆轍，有些資深的記者半開玩笑半認真的弄了一個補鑊大全，協助行家解釋為何麥凱恩可以絕處逢生，勝出大選。  大全指出了幾條絕世好橋，讓行家不用口啞啞。第一條是奧巴馬優勢太明顯，選民認為他「贏硬」，索性放棄投票，令共和黨「偷雞」成功。以密歇根州為例，在麥凱恩撤走競選辦後，奧巴馬跟麥凱恩的支持度差距升至五成四對三成八。這樣大的距離也許真的會令奧巴馬的支持者卻步。  另外一條是今年新登記的選民不願到票站投票，要知道新選民大半是奧巴馬的支持者，若果他們選擇做沉默的羔羊，奧巴馬的優勢便會大幅縮水，麥凱恩自然有機可乘。  還有一些外在因素可以影響選情，例如美國經濟突然奇迹地好轉，政府的救市方案空前成功，杜指重上萬二點。經濟低迷是美國選民銳意求變的原因，只要經濟強勁反彈，股市牛氣冲天，大家當然不會再視喬治布殊或麥凱恩為仇人了。  不過，最有可能的一條是未來兩星期在美國發生另一次大型恐怖襲擊。例如恐怖分子在佛羅里達或俄亥俄這類關鍵州引爆帶輻射的骯髒彈，又或是拉登再次向紐約發動襲擊，又或是伊朗成功試爆核彈。這樣的危機肯定會令選民重新考慮投票的意向。  不知道這個補鑊大全會否真的派上用場呢！
20081024-265,20081024,265,含農藥引致嘔吐日老婦食日清中毒,含農藥引致嘔吐 日老婦食日清中毒 日本又發生食物中毒事件，但今次並不是進口中國食物，而是家喻戶曉的日清杯麵。日本衞生當局昨天（周四）表示，神奈川縣一名婦人食用日清杯麵後，出現嘔吐和舌頭麻痹，當局後來在杯麵中驗出有農藥，日清高層向消費者致歉。 含有防蟲劑 神奈川縣藤澤市當局表示，67歲婦人周一食用一個購自超市的日清杯麵，並喝了杯麵湯，五分鐘後開始嘔吐，25分鐘後舌頭麻痹，沒有入院，兩小時後無恙。她的75歲丈夫也吃了一點杯麵，沒感到不適。他們指揭開杯麵蓋後已感到一陣藥臭。  警方後來在杯麵中驗出對二氯苯，對二氯苯是一種防蟲劑的化學物質，並檢查過容器，初部沒發現破洞或有異，暫時沒接獲其他受害報告。  含防蟲劑的杯麵，是由日清食品關東工場於8月30日製造，食用期限為明年1月30日。日清昨晚召開記者會，表示工場一直沒使用對二氯苯，正翻查工場內的閉路電視，查看是否生產過程出錯。社長中川晉謹此致歉，並指同一天生產的杯麵共有50萬個，承諾會向消費者回收這批次杯麵。  本報昨晚致電本港日清食品有限公司，查詢市面出售杯麵的生產地，但未能聯絡上。另外，兩間大型超市惠康及百佳發言人均表示，暫未能確定有否售賣日本疑含殺蟲劑的杯麵口味，但已聯絡有關產品的供應商查詢。  路透社/日本放送協會
