key,date,article_daily_id,title,text
20081119-0,20081119,0,李兆基：我唔識炒股,"李兆基：我唔識炒股 【本報訊】曾被坊間讚為股神，其後自稱「冒牌股神」的恒基地產主席李兆基，在雷曼兄弟爆煲後昨日首次公開露面。經歷金融海嘯，李兆基旗下私人投資旗艦兆基財經的規模，「水瓜打狗，唔見一截」，他昨晚出席復旦大學教育發展基金會成立酒會，不欲與傳媒多談股市，更與旁邊的公關說：「唔講喇，我都唔識炒股票！」記者：劉碧思、張德遜 身家縮水令以往慷慨分享個人投資心得的李兆基，昨晚亦不願多談股市。甫面對傳媒即說：「今日唔講嘢，金融海嘯波幅太大，市面太過動盪嘞，我都唔識睇呀，乜都唔識睇，唔知道點睇。」雖然四叔談股色變，但當問及他個人投資的成績，四叔仍勉強回應。 去年新股賺543億 其中較多人關心的是他的愛股中國人壽，四叔曾經多番推介此股，但據港交所資料顯示，李兆基10月底以每股平均價19.387元，沽出3,182萬股，套現6.17億元，賬面獲利5億元。被問到「沽晒啲國壽未」時，四叔回應：「未沽晒，未沽晒，仲有一大半㖭。」那會否再沽？四叔說：「到時先知呀，哈哈，我都唔知呀！」  除了未知會否再沽國壽，四叔亦未看清這個時候應否撈底買股票，城中一眾大孖沙包括首富李嘉誠、新地郭氏兄弟等，已相繼入市增持自己公司股票，但至今仍未見四叔蹤影，四叔說：「暫時未有（增持恒地計劃），慢慢睇吓先！」看來四叔對後市仍然迷惘。  事實上，四叔旗下私人投資旗艦兆基財經規模亦今非昔比，昨晚被問到兆基財經現時的規模時，四叔苦笑說：「𠵱家水瓜打狗，唔見一截！」  李兆基私人投資旗艦04年12月成立，起初投資額500億元，去年3月升值至1,000億元，去年10月恒指衝破三萬點大關，兆基財經的規模已達2,000億元，但今年7月中，恒指跌至21,000點，四叔私人投資亦縮水，跌至1,500億元，減少四分之一。以昨日恒指收12,915點計算，與7月恒指比較，跌幅近四成，以此幅度計算，兆基財經規模僅900餘億，較高峯期減逾一半。  曾經是股市大好友的四叔，在港股飛升時，被散戶奉為股神，當時四叔有「好嘢」都會公諸同好，亦踴躍認購新股。過去五年，四叔先後投資26隻新股，去年10月港股高峯期，四叔單是新股投資，賬面已賺543億元。然而，一場金融海嘯，四叔持有的新股縮水達九成，跌剩64億元。 碧桂園蝕得最「甘」 四叔現時持有的26隻新股，九隻賺、16隻蝕、一隻打和。當中以四叔至愛中國人壽賬面獲利最多。假設月初四叔減持國壽後，沒有進一步減持，現時手頭仍持有3.52億股國壽，賬面獲利58億元，但較股價高峯賬面贏176.5億元，蒸發超過百億元。緊隨其後賺得最多的是平安保險，賬面賺14億元。  今年四叔只認購一隻新股中鐵建，現時打個和。至於去年認購的10隻新股，則全軍覆沒，賬面輸20.6億元，蝕得最「甘」的是碧桂園。去年4月四叔豪擲10億元撐同鄉楊國強，碧桂園一度為四叔賺16億元，但隨着內地嚴打熾熱樓市，碧桂園狂瀉至今逾七成，令四叔賬面損手7.4億元。 四叔今年精句 18/11恒指報  12,915點  「𠵱家水瓜打狗，唔見一截！」 2/9恒指報  21,042點  「恒指預測全屬個人意見，並非一定準確，大家要小心，聽聽就算；現時非常穩陣及抵買，是入市良機。」 19/5恒指報  25,742點  「今年夏天只守不攻，8月可轉守為攻，可重上30,000點，22,000點為入市良機。」 28/4恒指報  25,666點  「壞消息已出得七七八八，壞極都咁上近，唔會跌近22,000點。」 29/1恒指報  24,291點  「我唔係股神，只是股民，最多是冒牌股神；『名牌股神』係畢菲特，我就算仿效佢都唔合格」    資料來源：《蘋果》資料室 四叔投資新股賺蝕 股份：中國人壽（2628）  招股價：3.59元　昨收報：20.00元　賬面賺：62.72億元*    股份：平安保險（2318）  招股價：10.33元　昨收報：29.10元　賬面賺：14.17億元    股份：神華能源（1088）  招股價：7.50元　昨收報：12.10元　賬面賺：4.78億元    股份：招商銀行（3968）  招股價：8.55元　昨收報：12.10元　賬面賺：3.24億元    股份：工商銀行（1398）  招股價：3.07元　昨收報：3.60元　賬面賺：2.76億元    股份：交通銀行（3328）  招股價：2.50元　昨收報：4.40元　賬面賺：1.52億元    股份：建設銀行（939）  招股價：2.35元　昨收報：3.88元　賬面賺：1.22億元    股份：中油化學（3983）  招股價：1.90元　昨收報：2.75元　賬面賺：0.87億元    股份：領匯（823）  招股價：10.30元　昨收報：13.80元　賬面賺：0.14億元    股份：中鐵建（1186）  招股價：10.70元　昨收報：10.70元　賬面賺：0.00億元    股份：中遠控股（1919）  招股價：4.25元　昨收報：4.23元　賬面蝕：0.04億元    股份：中煤能源（1898）  招股價：4.05元　昨收報：3.99元　賬面蝕：0.06億元    股份：中國中鐵（390）  招股價：5.78元　昨收報：5.06元　賬面蝕：0.37億元    股份：中海集運（2866）  招股價：3.175元　昨收報：0.92元　賬面蝕：0.71億元    股份：玖龍紙業（2689）  招股價：3.40元　昨收報：1.55元　賬面蝕：0.85億元    股份：中國電力（2380）  招股價：2.53元　昨收報：1.35元　賬面蝕：0.91億元    股份：洛陽鉬業（3993）  招股價：6.80元　昨收報：2.48元　賬面蝕：0.99億元    股份：復星（656）  招股價：9.23元　昨收報：1.91元　賬面蝕：1.24億元    股份：恒鼎（1393）  招股價：6.83元　昨收報：1.40元　賬面蝕：1.24億元）    股份：中外航運（368）  招股價：8.18元　昨收報：1.91元　賬面蝕：1.49億元    股份：波司登（3998）  招股價：3.28元　昨收報：0.75元　賬面蝕：1.50億元    股份：遠洋地產（3377）  招股價：7.70元　昨收報：1.95元　賬面蝕：1.75億元    股份：大昌行（1828）  招股價：5.88元　昨收報：1.03元　賬面蝕：1.93億元    股份：合景泰富（1813）  招股價：7.28元　昨收報：1.38元　賬面蝕：2.70億元    股份：中國銀行（3988）  招股價：2.95元　昨收報：2.11元　賬面蝕：4.00億元    股份：碧桂園（2007）  招股價：5.38元　昨收報：1.42元　賬面蝕：7.36億元    賬面總賺：64.29    *已計算11月初減持所獲利的5億元  註:以去年10月股市高位計，賬面曾賺543億  資料來源：《蘋果》資料室"
20081119-1,20081119,1,29歲特警輸股票百萬攬祖母燒炭同死,29歲特警輸股票百萬 攬祖母燒炭同死 【本報訊】一名29歲機場特警，不但擁有剛強體魄，同時亦是警隊「心聆團隊」義工，專門輔導有情緒問題的同袍，也得過傑出義工獎。可是，一場金融海嘯，令他輸了百多萬元股票，並欠下20多萬元債務，加上最近警長升級試失敗，在雙重打擊下，事主情緒崩潰卻又「能醫不自醫」，昨日他被發現與祖母一同在旺角住所燒炭身亡，慘釀嫲孫雙屍命案。警方調查不排除有人擔心死後祖母乏人照顧，因而做出如此儍事。　記者：冼偉倫、鄧偉明、鄭大康 雙屍命案的嫲孫二人為82歲姓黃的老婦和其29歲孫兒馬震邦，現場為旺角弼街71至73號弼街樓。人稱「馬婆」的黃婆婆是該大廈的業主立案法團主席；馬震邦則任職機場特警，擔任行政工作，同袍稱呼他的花名為「儍仔」。  嫲孫二人居住上址四樓一單位，地下梯間一個約60平方呎的閣樓亦是他們擁有。昨下午2時45分，街坊經過後巷發現閣樓有煙冒出，以為發生火警報警。消防員到場破門進入，赫見兩嫲孫倒卧閣樓奄奄一息，身旁有一個炭爐，懷疑他們燒炭自殺。救護員立即將兩人送院急救，惟均告不治。  消息稱，警方在現場撿獲相信是男死者留下的遺書，內容指祖母年老多病，不想她太過辛苦因而做出今次事件。另外消息又指，男死者最近投資股票失利輸掉百多萬元，同時欠下財務公司和信用卡20多萬元，除了經濟問題外，他早前被上司推薦參加警長升級試亦告失敗，在雙重打擊下自尋短見，但又擔心死後無人照顧年邁祖母，最後雙雙燒炭。 嫲孫相依為命廿多年 街坊指人稱馬婆的女死者平日身體健壯，健步如飛，聲如洪鐘，「講嘢好惡好大聲」。馬婆每日都會到茶樓飲早茶，街坊在談及他們嫲孫相依為命的身世時都非常感觸。據稱，男死者馬震邦的父親亦是警務人員，在交通部任職高級督察。街坊指，馬婆早年與丈夫在旺角花園街賣魚維生，其後丈夫去世，她雖然有三名子女，但關係都十分疏離，其中一子即孫兒馬震邦的父親，在震邦2、3歲時便離婚，之後更將震邦交給她照顧，自此嫲孫便相依為命20多年，兩人關係十分密切。 上周帶同到內地旅行 嫲孫二人同住多年，至去年馬震邦才遷出與女友同居，聘請了一名菲傭照顧祖母。據說，祖母近年身體轉壞，患有糖尿病和不少老人病，馬雖然遷出，但仍會每日返家與祖母吃飯，對她十分孝順。  日前，馬因與女友鬧翻搬返與祖母同住，上周他更帶祖母到內地旅行四天，有街坊昨日懷疑馬當時已有自殺念頭，因而與祖母一同旅行還最後心願。  昨日事發後，男死者父親接獲通知，立即趕往醫院了解情況，但都無法見到母親和兒子最後一面。此外，馬震邦多名同袍事後亦到現場路祭，各人均對阿邦自殺一事十分傷心。 嫲孫燒炭自殺示意圖 特稿 不忍遺下至親　萌攬住死愚念 對有學過心理課程的警員與祖母燒炭死亡事件，註冊臨床心理學家朱嘉麗不諱言心理學家、社工、醫護人員同屬自殺高危一族，案中警員作為心理輔導員，若本身情緒潛伏問題，輔導別人接觸更多不開心的事，有機會萌生輕生念頭。加上他對祖母感情深厚，捨不得丟棄她，容易一齊走上不歸路。 警員常把困擾收藏 朱嘉麗說：「唔好以為讀過心理課程就唔會自殺，最重要係所讀嘅程度去到邊，而且涉及個人性格、成長經歷等，喺壓力下能唔能夠自我療傷，其實因人而異。」  她指出，警員呈現男子漢形象，若本身因經濟、感情及工作困擾而有自殺傾向，多數人都不敢向上司反映或求助，因害怕令自己在警隊檔案中留下不良紀錄，形成鮮與別人傾訴的情況。加上肇事警員在輔導同袍時，往往會接觸到不開心事情，有機會連自己也抽身不到，受負面情緒影響而尋死。  有關警員自小與祖母生活，感情深厚，他可能怕自己死後遺下祖母，因而生出不如一同尋死的念頭。  朱嘉麗勸勉情緒低落者，一定要與別人傾訴，多作社交活動和做運動，將一些不開心的情緒宣洩出來。  本報記者 你想知　想講　想問？ 面對金融海嘯的冲擊，你會如何保持心靈上的健康富足?    請即上《蘋果》網頁 http://appledaily.atnext.com留言喇！   或電郵至：mailto:focusgroup@appledaily.com  傳真：37112411  手機短訊：63836568
20081119-2,20081119,2,失業率升至3.5%　未計被裁5000人,"失業率升至3.5%　未計被裁5000人 【本報訊】金融海嘯衝擊下，本港失業率連續兩個月上升。港府昨日公佈8至10月失業率為3.5%，較7至9月微升0.1個百分點，但仍未計算近期受裁員潮影響的5,000人。政府承認失業率屬滯後數字，目前數據還未全面反映全球金融海嘯的影響，預料失業率短期內將進一步上升。學者估計未來三個月會再多1.5萬至2萬人加入失業大軍，失業率到年底料升至4%。  統計處昨公佈8至10月的失業人數為131,800人，較7至9月減少2,200人，但經季節性調整後，失業率反由3.4%升至3.5%。失業率上升主要見於零售、運輸、進出口貿易、酒店業和倉庫等行業。 高層僱員也受影響 就業不足率方面，更「反高潮」出現0.1個百分點跌幅，由1.8%跌至1.7%，下跌主要出現在建造業和娛樂及康樂服務業。統計處解釋，不排除部份就業人士由原先就業不足類別轉為失業，令就業不足率下降。  政府發言人表示，失業率上升頗為廣泛地分散在本地經濟及對外貿易行業。財政司司長曾俊華指，本港失業率上升風險較大，料升勢持續。  勞工處上月共收到58,659個私人機構職位空缺，較去年10月微升3%，但同期向勞工處登記求職的則有11,049人，較去年10月的9,080人，勁升兩成。  政府消息人士指出，金融海嘯不但影響基層打工仔，高層僱員亦受嚴重衝擊。今年7至9月，經理及行政人員失業率為1%，較6至8月的0.6%激增0.4個百分點，預計情況會繼續惡化。 預計年底升至4% 由於最新失業率仍未反映澳門金沙集團、滙豐銀行及星展銀行合共裁員5,000人的情況。中文大學經濟系副教授關焯照預計，未來三個月，失業率每次會有0.2%至0.3%升幅，到年底升至4%，下年底更會進一步升至5%至5.5%，大部份行業都受影響。香港百貨商業僱員總會副理事鄧祥勝預期，零售業失業率在農曆新年後將惡化。飲食業職工總會秘書李國華則指，10月份已有最少五間酒樓結業，但失業率只是微升，對此感詫異；他又說，市況不景，最近飲食業新入職薪酬已降低約5%。"
20081119-3,20081119,3,拆局陳淑莊領政治功勞,拆局 陳淑莊領政治功勞 有政界人士分析，合和二期事件獲順利解決，相信與合和主席胡應湘不想再無了期拖延計劃、政府也希望能夠加快基建工程有一定關係，可謂得出「雙贏」方案。政府更不惜做「順水人情」，把政治功勞送給關注事件的公民黨新丁立會議員陳淑莊，也有助緩和公民黨與政府關係。 有助改善雙方關係 有泛民主派立法會議員指出，合和第二期工程引發保育及規劃爭拗已糾纏多年，雖然合和拿出早年獲城規會通過的方案作籌碼，迫使政府讓步，但發展局局長林鄭月娥以強硬作風見稱，該議員指：「當年孫明揚做房屋及規劃地政局局長都搞唔掂，林太仲硬過孫公，唔係咁易要佢讓步。」胡應湘不想拖延計劃，選擇一定程度妥協是唯一方法。  從政府角度看，若合和願意讓步，方案又足以向公眾交代，加上政府正希望加快基建工程，創造就業，林鄭月娥自然不會再作阻撓。但最令泛民想不到的是，政府竟把這個「政治功勞」送給陳淑莊，林鄭月娥特別選擇在立法會回應陳淑莊質詢時宣佈此「喜訊」，公民黨在規劃問題與政府素有爭拗，今次政府向公民黨「送大禮」，相信有望改善雙方關係。  本報記者
20081119-4,20081119,4,金融業破欠申請升3.2倍,"金融業破欠申請升3.2倍 【本報訊】金融海嘯引發企業倒閉潮，破產欠薪保障基金過去半年收到3,258宗申請，較去年同期上升24%，其中「金融、保險、地產及商用服務業」的申請更激增3.2倍，多達624宗，申請之多近年罕見。破欠基金委員會主席陳鎮仁估計，破欠申請會繼續上升，農曆新年前後將會是高峯期。 建造業申請大跌五成 勞工及福利局局長張建宗昨以書面回覆立法會議員質詢時稱，破欠基金今年4月至10月共接獲3,258宗申請，較去年同期的2,627宗增加24%；過去半年涉及的申索款項高達2.17億元，較去年全年的1.85億元還要多出16%，反映基金動用款項正急速增長。  各行業中，以「批發、零售、進出口貿易、飲食及酒店業」申請最多，有924宗，其次是有784宗的「運輸、倉庫及通訊業」；排第三是「金融、保險、地產及商用服務業」，申請數目有3.2倍增長，達624宗。相反過往高踞前列位置的建造業，申請數字只得394宗，大跌50%。  破欠基金委員會主席陳鎮仁表示，受金融海嘯影響，金融及保險等行業申請破欠數目急增是意料之內，他相信，隨着經濟環境轉差，破欠申請會持續上升，農曆新年前後會是高峯期。他指出，現時破欠基金每年有4億元收入，申索金額則為1億多元，金融海嘯來襲，料申索金額大增，但現時基金仍有14.37億元盈餘，故有足夠彈藥應付未來兩、三年的經濟變遷。 勞工處半年發84傳票 張建宗又表示，勞工處調查可能涉及基金被濫用的清盤個案時，如發現有足夠證據證明公司負責人違例欠薪，會提出檢控，今年4月至10月期間共發出84張傳票，有僱主被判監4個月，緩刑3年。另有18名公司負責人被取消董事資格。 破產欠薪保障基金申請數字 行業：金融、保險、地產及商用服務業  去年4月至10月：148  今年4月至10月：624  增減幅度：+322%    行業：運輸、倉庫及通訊業  去年4月至10月：252  今年4月至10月：784  增減幅度：+211%    行業：電力、燃氣及水務業  去年4月至10月：1  今年4月至10月：2  增減幅度：+100%    行業：製造業  去年4月至10月：229  今年4月至10月：412  增減幅度：+80%    行業：批發、零售、進出口貿易、飲食及酒店業  去年4月至10月：1,026  今年4月至10月：924  增減幅度：-10%    行業：社區、社會及個人服務業  去年4月至10月：187  今年4月至10月：118  增減幅度：-37%    行業：建造業  去年4月至10月：784  今年4月至10月：394  增減幅度：-50%    總數  去年4月至10月：2,627  今年4月至10月：3,258  增減幅度：+24%    資料來源：勞工及福利局 你想知　想講　想問? 申請破欠基金的人數大增，你有何意見？    請即上《蘋果》網頁 http://appledaily.atnext.com留言喇！   或電郵至：mailto:focusgroup@appledaily.com  傳真：37112411  手機短訊：63836568"
20081119-5,20081119,5,應屆大學生冇工做,"應屆大學生冇工做 【本報訊】經濟不景扭轉「大學生唔憂冇工做」情況。最新失業率顯示，大專及大學生失業率均上升，有08年畢業生現正待業，寄出二十多封求職信均無回音，惟有看書進修及鍛煉體能，提升自己。  據統計處數字顯示，今年7月至9月，非學位專上學歷程度人士的失業率為3.6%，較6至8月的2.9%，升0.7個百分點；而擁有學位的專上學歷程度人士，失業率則由2.4%升至2.5%。 僅獲兩次面試 阿Son為應屆理工大學物流系畢業生，由於早前經濟環境不俗，畢業後他用了40,000多元到歐洲旅遊數月，返港後又協助同學籌辦迎新營。原以為今年很易找到工作，但這個如意算盤被一場金融海嘯冲散。他說：「我9月開始搵工，寄咗20封信出去都冇回音，得一、兩份有得面試，銀行已經預測到經濟唔好，都已經唔請人。」他上個月找得一份政府臨時工，現時工作完成，只有繼續等待。  他說父母及兄長均從事飲食行業，擔心市況差會影響他們的飯碗，希望盡快找到工作，包括計劃投考紀律部隊。雖然心情不太好，但阿Son仍積極裝備自己，每天閱讀中英文報紙及書籍進修，又操練體能，希望配合求職所需。"
20081119-6,20081119,6,大摩在港連派三日大信封,"大摩在港連派三日大信封 【本報訊】市場消息人士透露，繼高盛、瑞銀、瑞信等投資銀行較早前紛紛宣佈裁員，美資投資銀行摩根士丹利（大摩）昨日終於在港派大信封。資料顯示，大摩8月份時全球有46,383名員工，據了解，大摩有意全球裁員約兩成，即約9,000多人，香港從昨日起，連續兩至三天，分部門派大信封，昨日主要是交易、銷售及資本市場部門的員工接大信封，投資銀行、研究部及其他部門將陸續收到裁員訊息。  有傳另一美資銀行花旗昨日在香港裁減400名員工，花旗發言人對此不予置評，強調本港員工受影響人數絕對不多，重申會透過自然流失、業務出售及解僱，至明年上半年全球員工數目降至30萬人。 中銀香港花旗亦裁員 消息人士指，花旗本港裁減人員數目不多於250人，以本港4,000名員工計，裁員人數估計只佔不多於一成。花旗香港前日開始的裁員分部門進行。昨日輪到債券及證券資本市場部門的員工收大信封，傳聞負責地產行業的投資銀行部同事差不多全部被裁。  此外，中銀香港亦傳出將會大裁員。有中銀員工指，銀行早前已進行小規模裁員，裁走一批加入銀行不久的大專畢業生，未來會向財富管理部門員工開刀，因銀行數月前曾向外高薪挖角，生意淡靜下，該部門人手過剩。中銀發言人強調，銀行在保持人力資源基本穩定同時，會根據市場環境及業務變化，審慎調整人力政策。 信德集團迫放無薪假 早前高調表示不會裁員及減薪的賭王何鴻燊，被揭發旗下公司有裁員及變相減薪行動。有員工投訴，信德集團旗下經營自家品牌零售業務的「澳門東西」，早前裁減19名員工；賭王旗下另一業務噴射飛航，要求員工10月起連續三個月，每月多放三天無薪假，變相減薪10%。員工批評何鴻燊睜大眼講大話，講一套做一套。信德集團昨日在截稿前未有回覆查詢。"
