key,date,article_daily_id,title,text
20081024-73,20081024,73,《蘋果》格價　中原劈價稱王西洋菜南街電視機勁平,"《蘋果》格價　中原劈價稱王 西洋菜南街電視機勁平 【本報訊】泰林電器倒閉，有「電器街」之稱西洋菜南街剩下百老滙、鐳射、豐澤及中原電器四分天下，戰情仍激烈。本報日前在電器街抽查四款熱門全高清電視機價格，四大電器店劈價最高達兩成搶客，當中以中原一次過刷卡付款再有特價，平通西洋菜南街。有業界人士坦言，「𠵱家嚟南街買電器，比其他地區分店買分分鐘平一成，搭車嚟買都抵」。　記者：蔡朗清 旺角西洋菜南街大型連鎖電器店林立，短短一條南街設有逾10間店舖，原本五分天下，泰林受金融海嘯襲擊不支倒地，剩下百老滙、鐳射、豐澤及中原拚個你死我活。電腦商會會長張耀成表示，南街屬電器零售業橋頭堡，每間店每月營業額高達3,000萬元，「𠵱家經濟唔好，啲舖頭都唔理公價自行劈價促銷。薄屏電視更加係首當其衝啦。」 電器連鎖店大比拼 記者本周一到電器街四大電器連鎖店格價，抽查四款較熱門全高清液晶電視機，計有LG42吋42LG70YR、聲寶42吋LC-42GX3DH、新力40吋KLV-40X350A，及三星46吋LA46A650A1F。記者逐家討價還價，各店均願意一減再減，減幅由5%至18%不等及可免息分期；要求加送HDMI高清線材、電視清潔套裝等禮物也答允。當中百老滙所售新力電視減幅最多達18%，由26,800元減至2,2000元，平了4,800元。 一次過付款再減5% 記者要求一次過付款是否再平，百老滙及豐澤「企硬」不會再減。中原及鐳射較進取可再減，最高再減5%；中原更可以刷卡，鐳射則需付現金。經格價顯示，中原可謂平通西洋菜南街，四個樣本三款最便宜，其中三星電視售價較百老滙及豐澤平達10%。  記者再到有關店舖其他區查詢同款電器也較南街昂貴，其中荃灣豐澤售賣的LG電視機售15,610元，較南街豐澤貴5.5%，又較中原及鐳射貴近12%。張耀成笑言：「只要消費者夠主動討價還價，𠵱家嚟南街買電器，比其他地區分店買分分鐘平一成，搭車嚟買都抵。」 「電器街」四大天王 旺角西洋菜南街影音格價 液晶電視機（行價）：LG42LG70YR（22,300元）  生產商優惠：7折價15,610元及送高清機頂盒  零售店實價*  百老滙　免息分期：14,800元　一次過付款：14,800元  豐澤　免息分期：14,800元　一次過付款：14,800元  鐳射　免息分期：14,480元#　一次過付款：14,000元##  中原　免息分期：14,800元　一次過付款：14,000元##				    液晶電視機（行價）：聲寶LC-42GX3DH（24,800元）  生產商優惠：送3,000元銀行禮券或高清電視錄影機  零售店實價*  百老滙　免息分期：21,800元　一次過付款：21,800元  豐澤　免息分期：22,320元　一次過付款：22,320元  鐳射　免息分期：約21,300元#　一次過付款：約20,800元##  中原　免息分期：23,000元　一次過付款：22,300元      液晶電視機（行價）：新力KLV-40X350A（26,800元）  生產商優惠：送2,000元超巿禮券及PS3  零售店實價*  百老滙　免息分期：22,000元#　一次過付款：22,000元  豐澤　免息分期：23,200元　一次過付款：23,200元  鐳射　免息分期：缺貨　一次過付款：缺貨  中原　免息分期：23,200元　一次過付款：21,500元##      液晶電視機（行價）：三星LA46A650A1F（32,680元）  生產商優惠：送32吋液晶電視機  零售店實價*  百老滙　免息分期：29,400元　一次過付款：29,400元  豐澤　免息分期：29,412元　一次過付款：29,412元  鐳射　免息分期：27,800元　一次過付款：27,000元  中原　免息分期：27,200元#　一次過付款：26,500元##    *經記者講價後所獲折扣價，只供參考  #該項產品免息分期價錢最平  ##該項產品一次過付款價錢最平  資料來源：上述電器店及記者巡查 特稿：送$3000銀行現金券 金融海嘯席捲全城，各品牌電視機生產商近月提供連串優惠搶客，如減價促銷、送銀行現金券、超巿禮券等。有專家教路，在旺角西洋菜南街購買電器盡享優惠，必須貨比三家，主動要求減價及索取優惠。  經濟不景，各品牌電視生產商推出種種優惠吸引顧客，購買指定型號額外送禮品。 須主動向店員查詢 禮品計有LG電視機減價三成及送高清機頂盒；聲寶送3,000元銀行禮券或高清電視錄影機；新力送PS3及2,000元超巿禮券；三星送32吋LCD電視等。但記者在西洋菜南街就有關電器格價時，部份職員未有告知有關優惠。  電腦商會會長張耀成表示，消費者想享盡優惠，必須主動向店員查詢，「最好係事前搜集吓資料，邊間生產商提供乜嘢優惠」。他說，附送禮物五花八門，以現金券最實際，「啲禮物未必啱用，同埋多數係舊款，經已跌晒價」。  張耀成說，在南街購買電視貨比三家搜集價格資料後，便可以同店員討價還價，「只要同店員講，對家出呢個價，啲店員都肯再減價，仲要攞埋小禮物」。他說，若消費者現金充裕，一次過付款一般再享優惠。  本報記者"
20081024-74,20081024,74,鳳姐慘遇賊嫖客,"鳳姐慘遇賊嫖客 【本報訊】筲箕灣西灣河街發生鳳姐被劫案，一名鳳姐前晚深夜與嫖客交易後，遭對方用一呎長鐵鋸架頸打劫，搶走她價值1,200元的手機。遇劫鳳姐返回葵涌寓所後致電報警，稍後被送院檢驗。  遇劫鳳姐姓楊，37歲，與家人同住葵涌和宜合道一單位，最近在西灣河街一幢唐樓租用一間套房做鳳姐。  她遇劫後未有即時報案，至凌晨1時許返回葵涌寓所後才致電報警，警員及救護員到場將她送院檢驗（圖）。她向警員稱，匪徒年約40至50歲，身高約1.75米，犯案時身穿黑色上衣。"
20081024-75,20081024,75,港旅業搶日本高消費長者,"港旅業搶日本高消費長者 【本報訊】金融海嘯衝擊本港旅遊業，港府變招上陣，積極開拓海外新客源。商務及經濟發展局表示，旅發局下月將成立香港會議及展覽拓展部，主力全球宣傳活動，未來會銳意吸納日本銀髮一族、台灣年輕客群、印度家庭旅客等三大客群。 吸納台灣印度客 商務及經濟發展局局長劉吳惠蘭，昨日出席立法會經濟發展事務委員會會議時表示，為應付金融危機帶來的影響，旅遊發展局正重新調整全球推廣策略，與一些高增長客源的市場加強合作，開拓一些新旅客產品吸納旅客，包括向日本銀髮一族（指高消費長者）推廣生態旅遊；向台灣的年輕客群推廣演唱會及另類藝術遊；向印度家庭旅客推廣家庭旅遊套餐。  劉吳惠蘭說，未來五年政府會加強推廣會展旅遊，旅發局將在下月成立香港會議及展覽拓展部，財政預算案已預留1.5億元給旅發局進行全球宣傳香港；政府又為會展活動提供一站式專業支援服務，希望能鼓勵更多海外人士來港參加會展活動。今年首八個月訪港旅客人次高達1,957萬，較去年同期升7.3%。"
20081024-76,20081024,76,消費blog：iPhone跌咗有得賠,"消費blog：iPhone跌咗有得賠 我個friendSunny早前失魂落魄，皆因唔見咗部iPhone3G，佢同其他iPhone友一樣，已經「中咗毒」，每隔幾分鐘都要攞部iPhone出嚟玩吓。但係佢噚日同我講，佢終於買番部iPhone：「而且唔使畀全價㖭。」 購新機只需$2760 原來，iPhone有保險㗎。佢幾個月前喺3香港買iPhone時，個職員都冇同佢講，好在有個朋友提佢，原來買iPhone係會送一年保險，佢即時去3香港門巿補申請保險：「好在部機唔見咗之前我已申請番保險，所以只係需要向3香港畀2,760蚊，就可以買番部新機。但係保險公司要我出示喺警署報失嘅文件。」  Sunny仲話，間保險公司話，如果當初冇申請保險，失機嘅機主需要向3香港，延長合約六個月，預繳1,322蚊，再畀多4,100蚊機價，先可補買部機。  我打電話去3香港問吓，佢哋話原來只要喺買iPhone手機時，答應簽多三個月約就可以有免費保險一年，呢項服務只限iPhone。手機細細部，容易唔見，大家記得有呢樣福利呀，如果唔係就唔着數。  不過，若大家係喺Apple網頁買嘅iPhone，Apple就無提供呢個保險服務。  電郵：mailto:shoppingjing@appledaily.com  逢周六、周日刊出"
20081024-77,20081024,77,外圍六合彩被搗,"外圍六合彩被搗 【本報訊】一名在夜總會任經理的男子，兼營外圍六合彩，引誘夜總會的女公關和熟客幫襯，警方新界南總區重案組探員根據線報，昨晨8時許在灣仔道一單位將他拘捕（圖），並在單位內撿獲兩部電腦及23,000元投注紀錄。  警方消息稱，被捕男子姓鄭（27歲），有案底，大半年前租住灣仔莊士敦道149號三樓一間分租房。  消息稱，新界南總警區重案組探員較早前接到線報，懷疑鄭在夜總會內引誘女公關、下屬以及熟客投注外圍六合彩，玩法如同內地的外圍六合彩，分大細號碼、單雙號碼、特別號碼等等，於是進行拘捕。"
20081024-78,20081024,78,屋漏拜拜　七口家有覺好瞓,"屋漏拜拜　七口家有覺好瞓 「屋頂整好，以後落雨唔使半夜三更起身擺盆盛水，唔單止無漏水，冬天時無風吹入屋，間屋都暖得多。」經過工人接近兩星期修葺，原本千瘡百孔的屋頂現已滴水不漏，阿妹（個案編號：C2451）想到多年來屋漏兼逢連夜雨的狼狽日子結束，心裏有說不出的喜悅。 獲助更換鋅鐵板 45歲的阿妹與其因中風而行動不便的丈夫（59歲），連同五名在學的子女，七口子住在已有30多年歷史的祖屋。該位於西貢的祖屋以木、石屎及鋅鐵搭建，屋頂日久失修，每逢雨天，雨水便從屋頂流入屋內，弄濕家具電器。阿妹動員全家在家中擺放近十個水盆，再以帆布鋪屋頂，也只能減輕漏水的滋擾。  自從丈夫中風後，阿妹一家便倚靠綜援金維生，她為要照顧丈夫及子女，無法外出工作。她眼見屋頂越來越霉爛，除了漏水，更擔心漏電及塌屋，危及家人安全。本報報道阿妹一家窘境後，蘋果日報慈善基金接獲熱心讀者捐款17,880元，阿妹在社工協助下，利用這筆款項安排工程公司為其維修了屋頂，更換了鋅鐵板。阿妹對善長的愛心感激不已：「多謝各位好心人，𠵱家我一家人瞓覺都安心好多。」    蘋果日報慈善基金  電話：29908688  傳真：37112468  電郵：mailto:adfund@appledaily.com  網址： http://charity.atnext.com     蘋果日報慈善基金接收捐款戶口  恒生銀行：368-006565-001  中國銀行：012-898-00067655  滙豐銀行：580-198836-001  渣打銀行：447-0-667059-3"
20081024-79,20081024,79,持裸照勒索前女友母親涉案男子與同夥被捕提訊,持裸照勒索前女友母親 涉案男子與同夥被捕提訊 【本報訊】雙程證無業男子涉利用載有前女友裸照的光碟，向前女友母親勒索540萬元，否則將光碟公諸於世。前女友母親在銀行將20萬元現金支票交予該男子的友人，警方跟蹤他返回寓所，將兩名疑犯一網成擒。兩名涉案男子被控串謀勒索及偷竊罪，昨日解往東區裁判法院提訊，還柙至本月28日再訊。記者：蔡曉楓 首被告陳清（31歲），無業，持雙程證來港；次被告陳明峰（51歲），報稱經理。兩人昨日由警車解往法院應訊，他們表現冷靜。控罪指兩人於今年10月6日，在香港為使自己獲益，而以恫嚇方式，不當地要求A小姐交出港幣540萬元。另控兩人於今年10月18日，在荃灣眾安街合眾大廈地下的星展銀行，偷竊一名男子20萬元。 控罪嚴重拒保釋 控方向法庭申請將案押後進行認人手續，指兩名被告串謀勒索事主540萬元，由事主將20萬元的現金支票交予次被告，刑事情報科探員跟蹤次被告後將他拘捕。  兩名被告昨日由律師代表申請保釋，已婚的首被告與任職護士的妻子育有一名兒子，他經常來港照顧妻兒，其父母則是內地退休公務員，首被告可交出20萬元保釋金。次被告任職清潔公司經理，可交出兩萬元保釋金。辯方又指事件不涉及暴力，但他們向法庭投訴遭警方毆打。裁判官指控罪極之嚴重，拒絕兩人保釋申請，還押警方看管。 次被告遭警跟蹤 據了解，事主收到一張載有其女兒裸照的光碟，而首被告即女兒的前男友向她勒索涉案款項，否則會公開其女兒的裸照。事主報警，向友人借來20萬元，在警方監視下到銀行將支票交予次被告。警方跟蹤次被告返回荃灣寓所，將兩人一網成擒。  案件編號：ESCC5024/08
20081024-80,20081024,80,活動快遞：跨世紀長者婚禮招參加者,活動快遞：跨世紀長者婚禮招參加者 機構：無國界義工  內容：透過新世紀婚禮使長者緬懷婚姻生活，從而整合及鞏固與伴侶關係  婚禮日期：11月16日（星期日）；10月31日截止報名  婚禮地點：西貢清水灣道1111號景輝堂  對象：60歲或以上長者夫婦（額滿即止）  費用：長者每對100元（有經濟困難可申請豁免）  備註：是次婚禮只屬活動並無法律效力  查詢電話：21161212
20081024-81,20081024,81,店舖主管疑呃八女財色,"店舖主管疑呃八女財色 【本報訊】樣貌俊俏的欺詐慣犯，曾假扮遊客騙取名牌貨品而被判囚。出獄後疑再次化身「大話王」，在網上結識多名女子，先相約對方見面後發生關係，趁機偷去網友財物，最終被警方及事主合力設局擒獲。涉嫌騙財騙色的男子昨日提堂，由於懷疑他曾以相同手法欺騙至少八名女子，警方會聯絡所有事主協助調查。  現年27歲的被告苗棋智，昨日由警車押解到九龍城裁判法院應訊，暫被控兩項盜竊罪，指他於本月14日，先在尖沙嘴金馬倫道恒生銀行櫃員機，偷取女事主2,000元，同日又於附近的星林居雲南桂林過橋米線店內，偷去事主的LV手袋、Dior袋、Gucci銀包、手機、八達通、信用卡及身份證等物件。 偷竊前科判囚20月 被告暫毋須答辯，等候進一步調查及認人手續。控方案情指出，被告於網上結識女事主，相約見面，隨即發生關係。被告繼而帶事主用膳，卻趁事主離開座位，將她的財物偷走後逃去。警方稍後拘捕被告，警誡下他承認曾以相同手法欺騙至少八名女子。  有詐騙前科的被告昨要求保釋候訊。他報稱失業，但透過代表律師指自己現職電腦公司店舖主管，承諾會向警署報到。惟遭裁判官拒絕申請，將他還柙至12月18日再訊。資料顯示，被告於04年5月至12月，14次在港九多間店舖，竊取總值約26萬元的名牌貨，05年被判囚20個月。  案件編號：KCCC6245/08"
20081024-82,20081024,82,活動快遞：赤腳步行籌款助國內兒童,活動快遞：赤腳步行籌款助國內兒童 機構：香港基督教青年會  內容：為廣西貧苦農村及四川受地震影響學校籌款，最後二百米赤腳行路，以體驗山區兒童上學情況  日期：11月9日（星期日）  時間：上午10時至下午1時（步行活動）；上午11時至下午4時（免費攤位遊戲）  地點：尖沙嘴文化中心露天廣場  對象：任何人士  費用：50元（10月30日截止報名）  查詢電話：22687718/22687716
20081024-83,20081024,83,董事涉以月餅賄警,"董事涉以月餅賄警 【本報訊】一名公司董事涉嫌於去年9月14日，將15盒月餅送給警方大嶼山區交通隊隊員，廉政公署接報調查，以董事違反《防止賂賄條例》將他拘捕。  案件昨日在荃灣裁判法院提訊，董事否認一項向訂明人員提供利益罪，案件押後至12月8日進行預審。  被告錢達勇（37歲）否認控罪，控方初步會傳召八名證人，其中四人是警務人員。被告准以現金2,000元保釋候訊，不准接觸證人。  案件編號：TWCC3057/08"
20081024-84,20081024,84,老翁申請逆權侵佔地皮,"老翁申請逆權侵佔地皮 【本報訊】新世界發展95年在元朗唐人新村購買兩幅農地作發展，但一名老翁聲稱在上址居住近30年，飼養了70隻貓、50隻狗、1隻猴子，還種滿果樹。老翁昨日興訟高等法院，要求聲明按《時效條例》，他已逆權侵佔地皮逾12年，擁有地皮業權。  原告余紹卓（77歲），被告為新世界發展旗下的揚威投資有限公司。  代表原告的律師指出，任職地盤工人的余紹卓在79年冬天開始，佔用上址7,000平方呎地皮，地主一直沒有出現。惟被告一方指出，余紹卓是在他們購入地皮後才佔用地皮，故不受《時效條例》約束。  案件編號：HCA277/07"
20081024-85,20081024,85,蘋論：香港有六成市民不理性嗎？ - 李怡,"蘋論：香港有六成市民不理性嗎？ - 李怡 施政報告出台不到十天，還未待立法會通過致謝動議，曾蔭權就擱置了施政報告的其中一項建議，就是引入高齡津貼（即生果金）的入息及資產審查，而高齡津貼則照加至1,000元。  先不說對生果金設資產審查是否得當，作為特首在施政報告中一項建議，竟然在十天內就收回，顯示他的施政出爾反爾，進退失據，方寸大亂，令市民對他盡失信心，實在較提出資產審查這建議的本身更不堪。我們不禁要問：當初這個資產審查建議，是怎樣擬定的？在施政報告發表前，特首的多場諮詢會，難道都沒有想過或提過生果金的問題？行政會議中有民建聯成員（鄭耀棠和未當選立會主席前的曾鈺成），難道政府沒有同他們溝通，何以資產審查會遭民建聯這樣強烈的反對？一個政策的推出，如此缺乏深思熟慮，又怎能讓人對這個政府放心？  擱置生果金的資產審查，不是政府從善如流。曾蔭權說，是因為自施政報告提出後，民情一面倒，有六成市民不贊成，他說政府提出資產審查，是朝着政策可持續發展方向去做，但「理性的討論，被感性反應通通蓋過」。  反對資產審查，都是屬於「感性的反應」嗎？六成反對的市民，都是「不理性」的嗎？曾特首的「理性」竟向「不理性」的市民讓步。他這番話簡直是對市民的侮辱。  反對資產審查的意見，基本上不是反對政策可持續發展，而是資產審查改變了生果金的性質。生果金之設，本意原是敬老，是對在香港貢獻了一生而進入老年的人，所表達的敬意。就等於去探望一位老人家，帶去一籃生果。向老人家奉上生果之前，無道理問這位老人家有多少身家，是否不給這籃生果他就買不起生果了。當然，如果原意是敬老的生果金，變成了老人要靠此維生的養老金，那麼性質就起了變化。對於養老，既有強積金，亦有綜援，領綜援或以後若增設養老金，自應有資產審查。問題是：生果金增加區區300元，有沒有變質成養老金？很明顯，所增款項有限，而且即使是一千元，也不足以養老，因此生果金略增，並沒有改變作為敬老金的性質。這是反對生果金設資產審查的主要論點，這論點實在很難令人認為是不理性的「感性反應」。  再從政府開支來看，現在領生果金的長者約48萬人，據估計增加300元後，每年政府增加的開支是18億元。18億元，向48萬長者表示敬意，這數目算多嗎？與政府一擲百億元捐助四川相比，與政府高薪請一批不知可以負擔甚麼工作的副局政助相比，與旅發局之類的大花筒開支相比，18億豈是大數目？為此而引發爭議簡直是政府在製造內耗。  曾特首解釋擱置生果金資產審查的另一理由，是金融海嘯的衝擊。但金融海嘯在施政報告發表前已經爆發，為甚麼當時還要引入一個會引起社會爭議的資產審查機制？難道十天前曾特首就沒有想過，金融海嘯會不斷有壞消息出現嗎？「家和萬事興」當然沒有錯，但是否有金融海嘯才需要「家和萬事興」，沒有就不需要了呢？  生果金略增，相對於政府的各項施政來說，其實只是小事一樁。但這樣的小事，都處理得手忙腳亂，而回顧過去，幼稚園學券，副局政助事件，外傭稅風波，市民對這樣盡失方寸的無能政府，能不寒心嗎？"
20081024-86,20081024,86,青年涉姦好友女友罪脫,青年涉姦好友女友罪脫 【本報訊】無業青年涉嫌趁好友犯事被羈留時，聲稱安慰其女友，在對方不適服藥及借酒澆愁後將她強姦。青年在高等法院被控強姦，經審訊後，陪審團昨日裁定被告強姦罪名不成立。由於青年早前承認與未成年的女友性交及拒捕，法官將案押後至11月13日，等候女童的心理報告判刑。 另涉與女童性交案 由四男三女組成的陪審團退庭商議近七小時後，裁定23歲被告潘惠祥強姦罪名不成立。  控方案情指去年4月，19歲女事主的男友因犯案被羈留，事主在7月4日相約被告見面傾訴。事主當晚不適服下止痛藥後，與被告喝了四罐啤酒，翌日凌晨遭被告強姦。事主聲稱被告犯案後曾說過「算啦！大家飲大咗，你落仔嗰陣，就打畀我啦！」事主的男友事後獲釋，與事主結婚。  另被告承認在去年5月7日，在將軍澳寓所與13歲女友性交。女童翌日報警，被告被捕後承認曾與女童發生性行為，但表示想與對方分手。  被告獲准保釋後，於7月28日在屯門的遊戲機中心，因形迹可疑被查牌警員截查，曾反抗拒捕。  案件編號：HCCC128/08
20081024-87,20081024,87,江湖滾熱辣 - 尊子,江湖滾熱辣 - 尊子
20081024-88,20081024,88,香港航空炒10名機師,香港航空炒10名機師 【本報訊】航空及地產代理業昨日均傳來裁員消息。香港航空以更換航機為理由，宣佈與10名機長及機師終止合約。利嘉閣則逐步落實瘦身大計，宣佈下月初關閉四間分行，解僱近20名員工。 利嘉閣再裁20人 剛於上周宣佈裁減至少九名機艙服務員的香港航空，昨日再宣佈終止六名機長及四名副駕駛機師的合約。裁員的理由是香港航空計劃於明年引入空中巴士A330廣體客機，該10名機長及機師不懂駕駛空中巴士，公司又不想投放資源培訓，決定棄用。  香港航空商務總監吳道榮聲言，兩次裁員均與金融海嘯無關：「我哋無意縮減早前公佈嘅機組擴展計劃，事實上，香港人仲有出外習慣，嚟緊嘅聖誕同農曆新年，我哋仍需要加班，而且油價近排大跌，暫時見唔到我哋會受好大衝擊。」  另一方面，利嘉閣地產董事伍洽強表示，因公司生意出現困境，所以將在下月初關閉長沙灣及土瓜灣四間分行，裁減近20名員工並完全撤出該兩區市場，四間分行租約未完，會暫停營業。過去一個月利嘉閣已裁減過百名員工，有近20間分行暫停營業。
