key,date,article_daily_id,title,text
20080903-88,20080903,88,澳門墮天仙局　一對K遇3條10港商一鋪啤牌輸350萬,"澳門墮天仙局　一對K遇3條10 港商一鋪啤牌輸350萬 【本報訊】一名本港商人日前往澳門洽商時誤墮「天仙局」，遭兩名假扮新加坡富商的內地男子設局玩沙蟹，結果「一對K」對「3條10」，一鋪啤牌輸掉350萬人民幣，事主懷疑受騙而報警。澳門警方稍後拘捕兩名騙徒，並通緝一名懷疑是中間人的本港男子。 被誘往傾生意 誤墮天仙局的港商53歲姓馬，他向警方表示，上月初有人接觸他，指可以介紹一名新加坡富商給他，若雙方有意可以合作搞生意。馬表示，該名中間人更聲稱新加坡富商已抵澳門，可安排他們見面，他於是與對方一同前往澳門。  據悉，姓馬港商來到澳門後，立即往中區一家酒店與新加坡富商見面，當時酒店房間內除了富商外，尚有另一名男子，雙方交換名片及傾談一會後，中間人疑有事外出，有人遂提議玩啤牌，於是三個人在房間內玩起沙蟹（話事啤），其間互有輸贏。  據事主向警方稱，差不多玩到最後出現一鋪「問題」牌局，當時他持有「冚手」K，對家牌面有一隻「A」，另外一家牌面是一對10。當時，牌面有一隻「A」的男子「出口術」，指下家最多只是一對10，但說完之後棄牌不跟，卻慫恿事主與下家對賭。怎料，雙方開牌後，事主一對K，但下家卻是三條10，下家盡數贏走枱面包括現金及支票共900多萬元，事主聲稱，這鋪牌令他輸了350萬元人民幣。 港人主謀在逃 據事主向警方稱，其後離枱結賬，他因為身上現金不夠被迫寫下欠單，對方更表示若事主不付款，會找人上門追收欠款，事後他覺得有可疑，遂向當地警方報案。澳門警方根據事主提供的資料，上月31日，分別在外港碼頭和關閘拘捕兩名案中騙徒。  消息稱，被捕的兩名騙徒分別姓郭，40歲，報稱在深圳從事地產生意，另一人姓楊，38歲，報稱在番禺任職司機。郭被捕後聲稱是被人臨時拉伕上陣「戥腳」，有人答允他如果事成會給他10,000元報酬。不過，警方在他身上搜出20多萬元人民幣，但郭無法提供這筆錢的來源。  澳門警方經過調查後，懷疑案中充當中間人的香港男子，其實是這個天仙局騙案的主謀，警方目前正加緊通緝其歸案。"
20080903-89,20080903,89,防數據淪為左派配票武器泛民籲選民杯葛票站調查,防數據淪為左派配票武器 泛民籲選民杯葛票站調查 【本報訊】選舉管理委員會漠視有親北京政團利用票站調查進行選舉配票的問題，令泛民主派不得不還以顏色。八個泛民主派組織昨天召開聯合記者會，呼籲全體選民「沉默是金」，拒絕向任何票站調查員說明投票意向，包括香港大學民意研究計劃。前任政務司司長陳方安生建議選民對票站調查「不聽不答」，防止票站調查數據淪為政團配票的有力武器。 港大研究押後發佈 在泛民主派全面杯葛下，連帶歷史悠久以及最具公信力的港大民意研究計劃也遭殃。身兼研究計劃主任的鍾庭耀對此表示失望，擔心有關行動會損害公民社會的長線發展，並對專業的調查機構造成傷害，他寄語泛民人士重新考慮。考慮到社會的種種疑慮，鍾庭耀昨天也決定將原訂在投票當日中午便向贊助傳媒發放的投票數據，押後至晚上8時才發佈，相信有關安排能達到資料保密及令市民放心。不過，泛民團體未有改變杯葛票站調查的決定。  力促選管會收緊票站調查不果的八個泛民主派團體，昨天在聯合記者會上狠批選管會主席彭鍵基，他們指去年的區議會選舉以及立法會港島區補選，已經揭示有參選陣營利用票站調查掌握投票情況，即時調整選舉策略，影響選舉公平性。他們曾為此向彭鍵基要求修訂選舉指引，規定學術機構以外的任何機構不得進行選舉調查，此舉不但沒有任何成果，選管會更不規管調查機構如何使用調查所得的資料，泛民對此漠視選舉公平的行為表示強烈不滿。 當局被轟監察不力 為免再令親北京陣營以最新資料進行選舉部署，阻礙選情，泛民主派呼籲選民投票當日對票站調查人員「保持緘默」，拒絕回應任何提問，以免票站調查成為財雄勢大政團的配票工具。陳方安生昨天出席一公開活動時也呼籲選民對票站調查「唔聽唔講同埋唔好理會」，認為選民「憑良心」投票已經足夠。  備受泛民陣營炮轟的彭鍵基，指他昨天巡視模擬票站時，沒有明確指出將票站調查資料用於選舉部署是否違規。他隨後回應傳媒提問時則指，如果利用票站調查資料影響選舉，就必須列入選舉經費。有泛民主派人士認為，選管會此說變相等同默許政團透過票站調查部署選舉，反映當局監察選舉公正不力，必須盡快修訂選舉指引。
20080903-90,20080903,90,隔牆有耳：特首辦用福和廁紙 - 李八方,"隔牆有耳：特首辦用福和廁紙 - 李八方 福和廁紙俾《蘋果》踢爆含菌量爆燈，物流服務署噚日證實，除咗康文署同房屋署公廁，連禮賓府都係用福和廁紙，特首辦廁紙供應商都係福和。醫生話用細菌紙巾隨時中招，有傷口嘅話可能感染發炎，八方記得煲呔曾因肚屙請假，日後「辦大事」時，曾太可以考慮塞兩卷私家廁紙畀煲呔。  有菌廁紙可能連累特首，物流署卻懶懶閒，話已經同福和「磋商」事件。福和噚晚發出聲明，指被驗出有菌嘅樣本，可能受環境污染，而佢哋係按國家衞生紙標準生產，即係每克廁紙要少過600粒細菌，而唔係一次性衞生用品標準，每克廁紙要少過200粒細菌咁高要求。廁紙唔係「一次性衞生用品」，唔通會有人翻用？麥當勞都係用呢個較高標準，《蘋果》驗到福和每克原裝廁紙有3,400粒細菌，就算用國家標準，一樣超標。"
20080903-91,20080903,91,通波仔病人勿停服藥物,通波仔病人勿停服藥物 【本報訊】冠心病患者接受通波仔手術後並非一勞永逸，瑪嘉烈醫院分析了01至05年間、570名使用滲藥支架作通波仔手術的病人，有4人不按醫生指示提前停服抗血小板藥，導致急性血栓塞，其中兩人懷疑因此死亡。有心臟科醫生指出，植入滲藥支架後的血栓塞風險較傳統支架高，病人手術後必須服藥最少一年。  瑪嘉烈醫院心臟科高級醫生徐炳添指出，滲藥支架與傳統支架的安全性及有效性相若，但前者的心臟病復發率只有一成，低於後者的兩至三成。但滲藥支架容易促使血小板細胞積聚，形成血栓塞，因此植入滲藥支架後必須服抗血小板藥最少一年，植入傳統支架只須服藥一個月。他指血栓塞可於數小時內奪命。
20080903-92,20080903,92,隔牆有耳：網友最想劉華做議員 - 李八方,隔牆有耳：網友最想劉華做議員 - 李八方 一項網上調查發現，網友最想劉華當選，唔係民建聯個A貨劉華，係真正個劉德華。調查由新浪網進行，有千幾個網友投票，太平紳士劉德華得票率達27%，最多人想佢做議員，第二位係發哥，得21%票。  候選人最愛認叻，標榜自己為民服務政績無數，如果阿叻參選，真係大把機會俾佢認叻，有兩成人投票話最想佢做議員；志雲大師都有8.5%支持率，網友讚佢把聲夠靚，聽佢講嘢就算係廢話，都可能冇咁難受。  香港政壇一池死水，有7.6%人想星爺入立法會，其實煲呔講嘢，好似話視民意如浮雲都好爆笑，星爺當選真係棋逢敵手；令人意外係狄龍都上榜，半成人最想佢從政，指佢有大俠feel，可以幫小市民伸張正義。
20080903-93,20080903,93,醫學Online節食減肥營養未失衡,醫學Online 節食減肥營養未失衡 醫學界一直認為以嚴厲節食方法減肥，易因營養失衡影響健康。澳洲一項研究分析了293名使用各種節食方法減肥人士的健康狀況，包括著名的食肉減肥，或戒吃澱粉質及肉類的減肥法，結果顯示在兩個月的戒口期內，若與正常食量的減服人士比較，嚴厲節食方法減磅效果顯著，也未見有營養不良的問題。但令人失望是，參加者在節食時多吃蔬果的習慣，一般未能在減肥後繼續維持。
20080903-94,20080903,94,醫學Online運動抗放射治療傷害,醫學Online 運動抗放射治療傷害 需要接受放射治療的癌症病人若勤做運動，有助可抗衡輻射對身體帶來的傷害。瑞典一項研究比較兩組患上腦癌，須接受放射治療的老鼠康復情況。一組老鼠獲安排經常在跑步圈內運動，另一組則長時間靜止不動，數月後研究人員發現運動組老鼠可發展成腦細胞的初生神經細胞數量，是不做運動老鼠的兩倍，相信日後運動組老鼠的語言、記憶及思考能力恢復程度，也會較靜止的老鼠理想。
20080903-95,20080903,95,隔牆有耳：田二少又要查字典 - 李八方,隔牆有耳：田二少又要查字典 - 李八方 天文台台長林超英掀起特區一片查字典風氣，九西候選人田二少都要請教啞老師，事緣佢有款新單張，指自己有膽色，有人卻質疑佢寫錯字，應該係「膽識」先啱，身為語常會主席，錯字有失身份。  二少助選團則話，佢哋有查過《辭淵》，確係有呢個寫法先用。網友則指《中文一分鐘》陳永明教授話膽識先正確，雙方都有根有據，不如搵林超英評定。  身為人大嘅田二少，參選立法會卻得唔到中聯辦祝福，選情急轉直下，佢喺最後拉票階段印製幾款新單張，入面有張相攝於70年代，個look勁似李小龍，佢話當年真係有人誤認佢係明星。
20080903-96,20080903,96,隔牆有耳：警隊有個接生王 - 李八方,隔牆有耳：警隊有個接生王 - 李八方 警務處出版嘅《警聲》噚日報道，香港上月誕生咗一位鸚鵡之子。時間係8月23日，凌晨約兩點半，正式係一個風雨交加嘅晚上，水警輪65號接載咗南丫島一名即將臨盆嘅孕婦，全力開往港島。但係水警輪仲未抵達碼頭，呢位風之子已經急不及待，乘風破浪而出，喺水警輪上面呱呱墮地了。  呢單嘢《蘋果》都有報道過，《警聲》就報道多一樣嘢。幫手接生嘅，除咗一名護士之外，仲有警署警長張天賜。張sir可能係警隊中最旺丁嘅警務人員。佢擔任接生工作駕輕就熟，原來遠在1988年，佢仲當緊老散時，已經試過喺冇醫護人員指示下，喺大鴉洲船民營內數次為女船民接生。至於個孕婦，係菲律賓人，同外籍丈夫住喺榕樹灣。
20080903-97,20080903,97,醫學Online疑犯被捕致心臟病發,醫學Online 疑犯被捕致心臟病發 西班牙一項研究發現被警察拘捕也可引致心臟病發。研究人員分析了過去10年間，60宗被拘留不足24小時的疑犯突發死亡個案，死者除了一名女性外，全部是年輕男士，屍體解剖發現，不少死者均有血壓及腎上腺素飆升的問題。專家指出這兩種情況會導致心跳加速，即使是一向身體健康的壯男，也有可能引發心臟病死亡，而拘捕過程中，警察使用手銬，疑犯心臟病發的風險增加。
20080903-98,20080903,98,政壇八達通：京官來港觀戰收料 - 單仁,政壇八達通：京官來港觀戰收料 - 單仁 單仁昨日說阿爺派「省港旗兵」為親北京候選人助選，其實阿爺手上何只一路「精兵」主理香港立法會選舉？單仁從政圈中人聽聞，中央各負責處理研究香港問題單位已整裝待發，日內會抵達香港，觀察選舉之餘，自然是要向各方人士「收料」，評估後立法會選舉形勢！ 內地議論廖暉去留 有政界人士對單仁說，早前他到內地觀看奧運比賽，不少研究港澳問題的「朋友」邀約他見面，對方表明立法會選舉前會來港，屆時大家可以見見面，談談選情云云。單仁老友事後才知悉，原來多個政府部門、研究機關都有人來港觀戰，包括中央御用研究香港問題的港澳研究所在內，他又聽聞港澳辦高層也會進駐深圳，近距離觀察選情。按以往慣例，港澳辦主任廖暉應該會同行，但朋友說今次親北京陣營贏面高，恐怕未必需要廖太子御駕親征。  不過政界朋友說，內地官場已為香港立法會選舉後，港澳辦及中聯辦的換班問題議論紛紛，包括廖太子是否真的離開港澳辦？他離開後會否仍舊在幕後操控大局？他會否仍舊留在港澳小組？政界朋友說，煲呔由廖太子一手提拔，正所謂官場有人好做事，沒有了廖太子，煲呔就要向阿爺「交到功課」，否則肯定有排煩！不要忘記，老董也是在港澳辦前主任魯平退休後，才「腳痛」下台，煲呔應有所啓發！  此外，日前有網友Chan報料說，他上星期回深圳探親時，從他姑媽口中得知，其姑丈是內地人，但同時擁有香港身份證，所以他姑丈的工作單位早已用他在港居住女兒的地址，登記做選民，又安排他的姑丈9月7日來港投票，美其名是「支持香港選舉投票」，並且有500元車馬費，以及包一餐免費午餐！  單仁對網民Chan報料不感意外，其實泛民去年在區選、立法會補選中，已發現有些並非區內居民，忽然現身投票站，曾有助選團中人對他說，上次區選投票日，就有連票站附近那兒有巴士站、的士站也不知的「選民」向他問路，這又怎能不令人懷疑，這些選民根本不是在港居住呢？
20080903-99,20080903,99,醫學Online三成酗酒者從沒求診,醫學Online 三成酗酒者從沒求診 南韓首爾大學一項研究估計國內有180萬人患上酒精使用障礙症，即對酒精依賴或濫用酒精。研究人員指出患者如果48小時內不能飲酒，會出現全身痙攣及有蟲爬上身等感覺及症狀，而酒精濫用者則不能控制自己豪飲的行為，飲酒習慣更影響學業及工作。研究顯示與酒精問題相關的死亡率高達每10萬人之中，有近10人，但大部份人不會視酒精使用障礙症為疾病，近三成人從未想過求診治療。
20080903-100,20080903,100,奧運主持青出於藍劉璇簽TVB挑戰阿姐,奧運主持青出於藍 劉璇簽TVB挑戰阿姐 現年61歲的阿姐汪明荃，日前在《奧運金牌精英大滙演》中呼喝國家跳水隊金牌得主王峰，惹來外間炮轟，反觀跟阿姐一起主持大滙演的前國家體操隊選手、現年29歲的劉璇，不論擔任司儀還是主持奧運直播節目，表現均贏盡口碑，表現比演藝經驗豐富的阿姐好，青出於藍。無綫有見及此遂拉攏劉璇簽約旗下拍劇、唱歌及做主持，前晚劉璇更出席無綫飯局洽談合作事宜。 至於阿姐因死撐「運動員唔係大晒」進一步惹來網民反感，成立反阿姐聯盟圍剿，昨日她出席公開活動時終一改死撐態度，指自己當日只是講笑，似乎有意認低威平息風波。 劉璇贏取觀眾利入行 現年29歲的前國家體操隊選手劉璇，2000年在悉尼奧運奪得平衡木金牌後，翌年便退役，全心全意投入演藝界發展，但星運平平，成績遠不及在運動場上輝煌。直至在剛結束不久的北京奧運會上為無綫擔任直播節目主持，親切出色表現贏得觀眾和網民一致讚賞，近日更獲無綫高層賞識，有意簽她為合約藝人，前晚無綫高層與藝員作私人飯局，便順道邀劉璇見面洽談未來合作。  無綫管理層每隔兩、三個月，便會邀約旗下藝員飯局聯絡感情，而前晚無綫在尖沙嘴一餐廳舉行的飯局上，與無綫沒有合約的劉璇竟也有份列席，並獲安排坐在製作資源總監樂易玲身邊，不禁令人懷疑無綫有意力邀劉璇加盟。 陳志雲讚表現佳 記者昨日致電有份出席飯局的無綫總經理陳志雲，問無綫是否有意簽劉璇為旗下藝人時，陳志雲未有否認，他說：「任何有潛質嘅藝人我哋都有興趣簽，今次佢喺奧運節目嘅表現好好，大家有目共睹。」問到是要簽劉璇拍劇還是擔任主持時，陳志雲說：「乜嘢都會，今次合作成數都好大。」雖然劉璇不懂廣東話，但陳志雲認為可以慢慢學，問題不大。  劉璇為李寧內地經理人公司旗下藝人，無綫今次則有意跟她簽訂香港工作合約。記者昨日致電劉璇助手Johnny了解時，他直認不諱說：「無綫想同劉璇簽歌星合約同藝員合約，噚晚係佢第一次同無綫高層見面，大家有個初步接觸，但劉璇本身喺內地簽咗畀李寧間公司，都要等佢經理人嚟香港同無綫再傾。」採訪：林妃 阿姐認衰：講吓笑啫 汪明荃上周六主持《奧運金牌精英大滙演》時，先呼喝國家跳水隊金牌得主王峰盡快上台，然後連環寸郭晶晶和吳敏霞，態度無禮，惹人反感，連日遭網友不斷炮轟，更在網上發起反阿姐大聯盟，阿姐之後仍死撐「運動員唔係大晒」，令外間更加反感，為息事寧人，阿姐昨日再度回應事件時態度明顯軟化。 「希望大家公道啲」 昨日阿姐在金鐘出席無綫劇集《東方之珠》台灣親善之旅宣傳，談到失言一事，阿姐終肯認低威說：「都冇法，當然唔希望被批評，成個奧運搞得咁成功，香港都好歡迎班運動員，成個月都報道奧運新聞，我亦只係講吓笑啫，其他人點講控制唔到，做好自己認為啱嘅事，希望大家對人對事都公道啲。」  阿姐自言沒被事件影響心情，被問到日後會否在演出時收斂，她說：「睇我出發點啦！可能志偉講好啲，佢似講笑。」至於會否繼續維持自我風格，她說：「我一向穩穩陣陣，唔會喝人，亦唔會整到人尷尬，呢啲說法唔公平，你哋都可以上網睇番條片吖，好多人睇㗎，大家應該上吓我個網睇吓，就知道汪明荃嘅為人，了解多啲我，就知我唔係咁嘅人。」 無綫收17宗投訴 因不滿阿姐在大滙演上失儀表現，日前有網民在Facebook網站成立「反汪明荃！咁無禮貌，影衰香港啊！！！」小組，事隔兩天，人數已由剛成立時的26人跳升至截至昨晚為止的401人，不少人更留言批評阿姐表現離譜及失禮香港人，AndyNg說：「汪明荃以為自己係t×b阿姐大晒！乜嘢人都唔放在眼內！」而無綫前日收到12宗投訴阿姐不尊重金牌運動員，昨日新增5宗，總計17宗；廣管局昨日暫無接獲正式投訴，但有巿民致電反映意見，指某主持人言論不當。  此外，身為全國政協委員的阿姐，98年曾到台灣拍劇，只是短短逗留數天，但因其政協委員身份敏感，曾被要求寫悔過書，至今已有10年沒踏足台灣的她，今日會啓程到台灣宣傳劇集《東方之珠》，她說：「我會盡量做好宣傳。」採訪：卓寶花　攝影：林德雄 人物誌：金牌得主璇美人 獲無綫青睞邀請簽約的劉璇，現年29歲，曾是國家體操隊成員，於2000年悉尼奧運勇奪平衡木金牌（圖）及女子個人全能及團體銅牌，同年奪得全國十佳運動員殊榮。  劉璇曾被指貌似陳慧琳，有「璇美人」稱號，01年退役後入讀北京大學新聞與傳播學院，並於05年畢業。讀書期間她已投身演藝界，02年接拍電影《我的美麗鄉愁》，其後演出過多齣電視劇，但星途一般，近日進軍樂壇，早前則為無綫擔任北京奧運體操專業評述。 娛樂資料庫：李寧挾金入無綫 不少運動員在退役後選擇投身電視圈，無綫也曾跟不少運動員簽約，但多數發展平平。 鄧浩光：曾代表香港游泳隊參加國際賽事，76年已成為「香港飛魚」，84年被名導演楊凡發掘拍攝電影《少女日記》，後加入無綫。    黃澤鋒：前香港泳隊代表，曾贏得「香港渡海泳」冠軍，後報讀87年電視藝員訓練班加入無綫。    李寧：曾屢奪奧運金牌的李寧，退役後於93年拍攝無綫劇集《武尊少林》，又曾接拍動作電影《七金剛》，但因不賣座而淡出演藝界。    司徒瑞祈：6歲起開始學游泳，是香港男子短池100米蝶泳紀錄保持者，04年加入無綫拍劇。 5優奧運主持 徐嘉樂  被冠以「人肉體育字典」等美譽，對各項體育運動均熟悉，評述時盡顯專業。 方力申  評述游泳賽事時表現專業，事前準備功夫妥當，被網友大讚表現稱職。 翁金驊  負責評述籃球賽事的他，講解比賽時清晰易明，保持一貫水準。 雷禮義  雖然評述排球賽事時曾被指嘈吵，但對賽事規例熟悉，講解專業。 江嘉良  在訪問乒乓球隊時問題恰當專業，並以老大哥身份勉勵道賀倍感親切。 5劣奧運主持 張嘉兒  經常講錯說話，如把日本蛙王北島康介講成北島行佳，又把俄羅斯說成蘇聯。 楊思琦  被網友批評聲尖又嘈，完全達不到水準，旁述舉重時只懂說：「嘩！嘩！好勁呀！女力士呀！」 李思雅  經常大驚小怪尖叫狂嗌，女排賽事進行時竟高叫：「如果係我就手都斷埋啦！」被轟作狀。 陳百祥  被責體育知識貧乏，如中美男子籃球賽事中，以為guard是防守，連球員身份也搞不清。 袁彩雲  作為賽事主持全程近乎零發言，只懂向鏡頭展露僵硬笑容，對提問完全搭不上嘴。    資料來源：《蘋果》資料室
