key,date,article_daily_id,title,text
20081024-0,20081024,0,全球恐慌性拋售　滙豐跌至88元股市最恐怖一天,"全球恐慌性拋售　滙豐跌至88元 股市最恐怖一天 【本報訊】由悲觀到絕望，金融海嘯第40日，全球數以億計投資者經歷最恐怖的一天。前一晚美股仍高收172點，豈料亞洲股市在毫無徵兆下崩盤，亞洲四小龍慘瀉8.3%至10.6%。重磅股滙豐單日挫12.6元報88元，港股萬三關即告失守。亞股恐慌拋售蔓延至歐洲，英、法、德股市甫開市急挫超過8%，美股期貨更跌550點至停板，將恐慌情緒推至極限。全球投資者輸錢之餘，信心盡失。　記者：黃武榮 於1929年10月24日星期四，華爾街股市開始暴跌，史稱「黑色星期四」（BlackThursday），結果造成經濟大蕭條，79年後的同一天，環球股市再遭逢大劫。歐洲三大指數昨晚最多跌9%至11%，本港時間昨晚11時，三者跌幅收窄至約7%。美股三大指數則跌逾4%，道指報8288點，跌402點、標普500跌42%，納指挫68點至1535點。滙豐在倫敦及美國預託證券（ADR）未止瀉，折算報81元，較港再跌7元。 羅傑斯：將步入無底深潭 商品大王羅傑斯（JimRogers）回覆查詢時不諱言：「恐懼已主宰市場，雷曼破產是震撼（shock），但真正令市場恐懼（fear）是失去信心，股市、滙市、債市、商品將步入無底深潭（deepwater），現在惟有現金是王（cashisking）。」  的而且確，昨日無大型企業破產、經濟衰退亦眾人皆知，「無厘頭」跌市最容易引發市場恐慌，令投資者大舉拋售股份套現。雷曼9月15日申請清盤時，港股翌日跌1052點（5.44%），但昨日恒指居然再瀉1142點（8.3%），收報12618點，為金融海嘯後股市跌幅最大的一天。短短個月半間，港股累挫31%或5682點，指數時光倒流至四年前水平。  多隻藍籌股跌到「慘不忍睹」，和黃率先跌至2003年沙士價，收市跌穿40元。國泰亦逼近沙士最低價的8.25元，收報8.78元。不過，最令散戶揪心及無奈的是，作為港股精神支柱大笨象滙豐折翼沉淪。  滙豐股價插水式跌至90元，收市競價時段再跌2元至88元，市值單日蒸發逾1,500億元。獨立股評人陳永陸（陸叔）苦笑，「滙豐尾市都近3,000個牌，築成血肉長城守住90蚊，點知一個基金大沽盤已將長城摧毀，擺明基金佬要錢唔要貨」，「連滙豐一日都可以跌成咁，仲有乜好講呢，散戶彈藥已耗盡，輸錢輸信心」。 散戶：去年今年反差太大 炒齡30年、長駐證券行的陳先生，亦未能接受跌市事實，「捱過87股災及97金融風暴，點估到金融海嘯一鋪清袋，去年同今年嘅反差太大喇」。他昨日跟大隊尾市於90元買入滙豐，豈料仍要蝕錢收場。證券行內不少散戶亦一臉死灰，潘女士前日以3.3元掃入工商銀行，昨日再跌7.3%至3.15元，離開時不甘心破口大罵，「係咪要跌到招股價（3.07元）先識停啊！」另一散戶的愛股中國人壽則失守20元，收報19.4元跌9.3%。  港股市值昨日蒸發近7,000億元，只餘8.61萬億元。本報訪問十多位股評家，皆拒絕預測「港股下一站」，郭沛金融投資研究部主管郭家耀索性指出，「等到一萬點先講啦」。  市場人心惶惶，除股市外，滙市及商品市場皆出現資金逃亡潮。拆倉套息令日圓滙價急升至91美元水平，觸發滙市出現前所未見的波動。商品市場亦難充當資金避難天堂，金價跌穿700美元、期油更跌低至60美元邊緣。 昨日全球市場恐慌情况 美國  ‧開市前，道指期貨曾跌停板，股市早段最多跌505點  ‧國債成資金避風港，30年國債孳息創逾30年新低    歐洲  ‧英、法、德股市早段曾跌近10%  ‧英國經濟終收縮，英鎊捱沽，兌美元曾跌5.9%至5年新低    香港  ‧股市未止瀉，恒指失守13000點關口，和黃跌穿沙士價，低見39.5元  ‧信貸危機重燃，1個月拆息再升破3厘    中國  ‧為應付金融危機，與南韓、日本等國成立800億美元外滙儲備基金  ‧中央連番救市未奏效，滬深股市分別挫1.9%及1.7%    日本  ‧全球資金湧入日圓避難，日圓兌每美元曾狂飆6.6%至90.93日圓  ‧日本股市急挫9.6%    南韓  ‧第三季經濟增速為四年來最慢，股市急挫10.6%  ‧韓圜曾挫逾5%    俄羅斯  ‧股市急瀉逾14%，停市至下周  ‧爆煲憂慮升級，拖累俄股於倫敦交易的預託證券跌23%    資料來源：綜合外電"
20081024-1,20081024,1,曾蔭權你看到嗎？小老闆　大善心　靚粥天天贈長者,"曾蔭權你看到嗎？ 小老闆　大善心　靚粥天天贈長者 【本報訊】逆境時曾受街坊恩惠的屋邨小粥檔老闆李松興，近日起每天早上免費向逾百位長者送贈靚粥，又加送腸粉炒麵，為節衣縮食的公公婆婆帶來人間溫情。長者們吃得滿足，對非大富大貴的李松興心懷感激，口裏卻咒罵特首曾蔭權大條道理剝奪長者的生果金，「抵佢俾人掟蕉」。 民間自發的敬老善行，特首曾蔭權，你看到嗎？ 記者：林社炳、黃偉駿 何文田愛民邨的「冬菇亭」粥檔，每天都有一班公公婆婆圍坐在一張大桌，桌上放着兩大沙煲靚粥，一煲是煮得綿綿的「米王」白粥，一煲是足料艇仔粥。公公婆婆吃得津津有味，吃完一碗再一碗。粥檔夥計還按照各人不同喜好，免費奉上腸粉或油器。  粥檔不起眼的牆角上，貼出一張「長者免費早餐」告示。除假日外，每天早上7時至11時，粥檔會供應艇仔粥、牛肉粥、豬紅粥、魚片粥和白粥。每位長者還可點選腸粉、炸兩、炒麵、炒米或油器一件。個多月前，小粥檔老闆李松興推出這項善舉，大受長者歡迎。 逾百長者每天吃14煲 追隨李松興22年的拍檔楊立東，看見沙煲內的粥吃得差不多，又再奉上另一煲熱騰騰的粥，給遲來「等位」的長者。他說，一般長者最少吃兩碗，有些吃三、四碗，每天有逾百名長者，吃掉最少14至15煲粥。最初他要求公公婆婆出示長者卡，後來無暇理會，甚至有愛民邨、何文田邨以外的長者也來吃免費粥。有帶同小孫女來吃粥的婆婆，覺得有點不好意思，街坊即插嘴說：「唔使覺得醜，最好等全世界知道，香港老人家有幾慘。」  本來不愛吃粥的李婆婆，以往早上會到粥舖隔鄰的茶檔，吃9元的盅頭飯。91歲的她說：「每朝食餐免費粥，可以慳番9蚊，晚黑再食一餐。」無親無故的李婆婆，每月靠政府3,000元綜援過活，交租後只餘下2,000元生活費。同桌的黎婆婆說：「粥檔以前半價優惠長者，𠵱家唔使錢任食，可以慳番個錢。」 顧客不屑生果金政策 談到特首曾蔭權建議要審查長者資產，作為提高生果金的附帶條件，長者們怒氣冲天。有婆婆衝口而出說：「抵佢（特首）俾人掟蕉，應該掟埋雞蛋。」與她對坐的伯伯說：「（生果金）一毫子都唔加，佢鍾意畀你就畀，唔畀你就唔畀。」他續說：「買個爛橙都要三蚊個。高官坐車唔使銀紙，電油唔使銀紙，住唔使銀紙。我哋小市民要畀稅，你哋班高官去嘆世界，有冇搞錯？」  鄰座的打工仔曾先生聽得同樣氣憤。他說，雖然與曾蔭權同姓，但不屑他在生果金問題上，講一套，做一套，不理民間疾苦。  李松興的善舉街知巷聞，四位教會義工答允下月無條件協助派粥給長者。也有不少人聽到李向長者贈送靚粥，特別乘坐的士來光顧，李松興說：「唔少人食10蚊粥，放低30蚊，以示支持敬老。」 歡迎榮智健吃免費粥 在李松興眼中，派免費粥是知恩圖報，不能說是善舉。「六、七十年代經濟唔好，舅父同阿姨做大牌檔，一煲湯，成條街走嚟飲都得。」  李松興有個夢想，希望有一天大牌檔可以24小時營業，免費招待所有有困難的街坊，「有粥食粥，有飯食飯」。他笑說，他的姓名與中信泰富執行董事隻字不差，「就算係榮智健（中信泰富主席）破產，都可以嚟我檔口食免費粥。」 小市民心聲 《不屑曾蔭權》  打工仔曾先生說：「我雖然同曾蔭權同姓，但不屑佢喺生果金問題上，講一套，做一套。」 《唔敢話政府》  黎婆婆說：「政府鍾意點幫就點幫啦，我哋冇權話事，唔敢講。」 《高官嘆世界》  吃免費粥的伯伯說：「我哋小市民要畀稅，你哋班高官就去嘆世界，有冇搞錯！」 你想知　想講　想問? 善心粥檔老闆每天請長者吃粥，你有何意見？    請即上《蘋果》網頁 http://appledaily.atnext.com留言喇！   或電郵至：mailto:focusgroup@appledaily.com  傳真：37112411　手機短訊：63836568"
20081024-2,20081024,2,價錢合適會考慮售兩隧,價錢合適會考慮售兩隧 【本報訊】對於有政黨建議政府應趁機向中信泰富購回東、西兩隧股權，中信泰富董事總經理范鴻齡稱，若有適當買家及價錢合適，會考慮出售包括兩隧等資產，但強調大股東中信集團承諾協助安排15億美元備用信貸及手頭現金，中信泰富有足夠營運資金。  日前強烈批評中信泰富的網上評論員DavidWebb，昨日在一個公開場合表示，榮智健應否辭去主席一職，應交由股東及董事會決定，年齡亦是一個考慮。不過，以往投資者投資中信泰富可能是基於公司與中央的關係。 機構投資者應知風險 DavidWebb不贊成由國家出手將中信泰富私有化的解決方法，他認為市場產生的問題，應由市場解決，中信泰富應出售部份資產解困，並估計在正常情況下，債權銀行將對中信泰富催債。  對於中信泰富透過滙豐銀行買賣累計外滙期權（外滙Accumulator），滙豐銀行執行董事王冬勝昨日表示，機構投資者有別於一般零售投資者，應對有關金融產品有較深認識，並熟知風險，強調該行只出售這類產品予機構投資者及私人銀行客戶。  就母公司中信集團短期內將召開董事局會議商討善後工作，集團發言人冀峰昨表示不知有此會議，惟強調集團將全力支持中信泰富，其營運仍正常，至於榮智健應否請辭，他不予置評，中信泰富則予以否認。
20081024-3,20081024,3,善行獲響應　小老闆矢言細水長流「就算用晒金條仍派粥敬老」,善行獲響應　小老闆矢言細水長流 「就算用晒金條仍派粥敬老」 海嘯即景 【本報訊】何文田愛民邨「冬菇亭」粥檔老闆，派免費粥敬老善舉觸動人心。供貨給粥檔的食物供應商，昨日主動承諾九折優惠供貨給檔主減低成本；有小商人捐出100公斤肉鬆，響應派免費粥檔主的敬老行動，另有讀者致電本報希望捐款給粥檔支持派免費粥行動。善舉贏得不少人認同的李松興說，「就算用晒我幾條金條，仍會繼續派免費粥敬老。」　記者：林社炳 昨日未到上午七時派免費粥時間，粥檔特別為長者而設的大枱，已坐滿婆婆及公公。夥計如常奉上「任食唔嬲」大大煲的沙鍋粥，再按各人喜好附送腸粉或油器。夥計英姐說，除「熟客仔」外，昨日多了些新臉孔。負責炒粉麵的楊立東表示，老人家早起，吃免費粥的長者，通常十點後便減少，但昨日十點後仍有不少長者來吃粥。 肉商支持九折供貨 第一天來吃免費粥的周婆婆說，自己的子女失業兩年後才找到工作，剛做了一年，現在經濟不景，可能再度面臨失業。聽說有善心人派免費粥才來吃，減輕一點負擔。她說，「嚟食粥最緊要問良心，唔好貪，最好自己真係有困難，先至嚟食。」  陳伯沒吃免費粥，坐在鄰桌自費付錢光顧，用行動支持派粥敬老的老闆。他說，「好似呢類善舉，今時今日，少之又少。」他在區內住上多年，除了李松興的粥檔，其他食肆別說優惠長者，還不斷加價，增加長者和基層市民的負擔。隔鄰做街坊早市生意的中式茶檔，夥計表示生意略受影響，早茶不設優惠長者。  派免費粥的老闆李松興昨日看見多了長者來吃免費粥，他表示同樣多了市民和街坊來光顧，為他打氣，支持他的敬老行動。他年前參加車行舉行的抽獎活動，獨贏得價值15萬元的金條，他說，「就算用晒我幾條金條，仍然會細水長流，長開長有，仍然會繼續派免費粥敬老。」話說沒完，他接到肉食供應商的電話，知道他派免費粥敬老，表示即日起貨源供應會給他九折優惠，支持他的敬老行動。 商人捐100公斤肉鬆 肉鬆批發商黎先生閱讀報道後深受感動，他說，自己做小生意，知道小商人經營困難。免費派粥敬老的粥檔老闆，善舉很值得敬佩。自己也有批發肉鬆給粥檔，希望捐贈100公斤肉鬆，直接送到李松興的粥檔，下粥或轉贈給老人家。他說，「我想捐多的，不過自己真係能力有限，只係想盡啲啲敬老心意。」 你的回應 對粥舖老闆免費招待長者食粥，部份讀者在《蘋果》網頁留言如下：    仗義每多屠狗輩，為富不仁的富豪，你們慚愧嗎？  ——lvanb    好感動！雖則只是一碗粥，但已看出老闆的善心，我亦會親身支持一下！  ——龍崗joe    老闆雖然幫唔到全部人，但最少略盡綿力幫得就幫，都係令人感動同尊重，靠呢個曾蔭權政府死得㗎啦，自救仲實際。  ——mizukitsune
20081024-4,20081024,4,部份星展苦主或賠足雷曼產品贖回價　下周存戶口,部份星展苦主或賠足 雷曼產品贖回價　下周存戶口 【本報訊】星展銀行今天開始向首批「因為銷售行為不當而購買雷曼相關產品」的苦主提出賠償金額，下周發信通知所有客戶有關「結構性零售債券」的贖回款額，並將款額存入客戶戶口，但星展銀行未有透露獲得賠償的個案數目，只稱賠償總額約為3.62億至4.14億。 未透露賠償金額總數 民主黨主席何俊仁及立法會議員甘乃威昨天約見星展銀行董事總經理王潔鳳，商討賠償問題。何俊仁會後稱，星展未有透露有多少個案因銷售手法不當而獲賠償，亦未透露涉及的賠償金額總數，但他坦言，「銀行方面畀我嘅感覺，係有啲個案預咗會和解，有啲個案會賠足100%。」  雖然星展願意作出賠償，但何俊仁說，星展堅稱今次只就銷售手法作出賠償，「佢哋唔覺得係同產品結構問題有關。」他讚揚星展自願作出賠償是積極做法，希望其他銀行仿效。  為免苦主接受了銀行回購後損失索償權利，民主黨亦在其網址 http://www.dphk.org擬定了標準格式的信件，供雷曼苦主使用，信件列明縱使銀行把回購款額存入苦主的戶口，亦無損苦主向銀行索償的權利。  大聯盟指賠兩成太低 雷曼苦主大聯盟召集人陳光譽說，暫時沒接獲星展有關賠償的通知，他認為星展的做法雖有示範作用，但賠償比率只有22.3%太低，對賠償方法有保留。他指大聯盟今晚會與包括星展在內等多間銀行代表與民主黨開會，屆時會再了解賠償詳情。 你想知　想講　想問? 對星展賠償苦主的數額有甚麼意見?    請即上《蘋果》網頁 http://appledaily.atnext.com留言喇！   或電郵至：mailto:focusgroup@appledaily.com  傳真：37112411　手機短訊：63836568
20081024-5,20081024,5,證監增查40雷曼個案兩本地銀行涉違規銷售,證監增查40雷曼個案 兩本地銀行涉違規銷售 【本報訊】金管局昨日公佈，截至周四止共接獲1.6萬宗雷曼迷你債券及相關產品的投訴，並將第二批共40宗涉及銷售失當的個案，轉介證監會處理，以便採取進一步紀律行動。該40宗違規個案涉及兩間本地銀行，其中一間是新上榜。金管局上周五將首批共24宗違規個案轉交證監，涉及銀行盛傳是星展和大新，其中大新承認正配合當局調查。 傳中銀接觸苦主談賠償 銀行公會署理主席兼中銀香港副總裁林炎南昨午與金管局開會後重申，專責小組正研究與迷債信託人滙豐加強合作，公會冀最快12月初公佈回購內容。據他所知，本周初已有個別銀行主動與雷曼相關產品投資者和解，業界優先和解的個案，主要涉及65歲以上、缺乏投資經驗的長者。  本報得悉，市傳銷售雷曼迷債逾30%的中銀香港，已開始接觸向銷售失當的客戶商談賠償事宜。  金管局副總裁蔡耀君昨早於電台節目表示，該局正就雷曼事件安排調節機制，下星期會公佈具體細節。  蔡耀君說，銀行與客戶商討迷你債券賠償時未必全數賠足，或因此出現民事訴訟，屆時有關個案可轉介至調解人，以達成雙方同意的方案，而調解費用一般平均分擔，不排除有特別安排，減輕苦主負擔。  對於星展銀行向因銷售手法有問題而購買Constellation雷曼信貸掛鈎票據的客戶作出賠償，蔡耀君表示歡迎，亦鼓勵業界以其他方式協助苦主。他補充，若苦主滿意賠償額，可向金管局撤銷投訴，但如果有關個案已進入調查程序，該局仍繼續處理。 市況壞恐拖低抵押品價 外界憂慮全球市況迅速下滑，或進一步拖低雷曼迷債抵押品價值，銀行公會另一署理主席盧重興傍晚主持例會後表示，市場變化好快，「現正與時間競賽解決問題，部份銀行已開始做嘢，做得到就去做」。他強調，雷曼迷債涉及逾萬名投資者及十多間分銷銀行，回購問題需時處理。 你想知　想講　想問? 對證監調查違規銷售雷曼產品有甚麼意見?    請即上《蘋果》網頁 http://appledaily.atnext.com留言喇！   或電郵至：mailto:focusgroup@appledaily.com  傳真：37112411  手機短訊：63836568
20081024-6,20081024,6,銀行擬設仲裁機構解爭拗,"銀行擬設仲裁機構解爭拗 【本報訊】星展集團率先公佈向不符標準的個別雷曼相關票據客戶賠償，此舉對本港銀行解決雷曼迷債帶來一定壓力，消息指出，銀行公會旗下專責工作小組，有意成立仲裁調解機制，冀透過外聘獨立專業仲裁機構，協助銀行與客戶之間，就不當銷售爭拗達成和解。  據了解，具體行動仍有待19家銀行一致同意，金管局亦計劃就相關投資產品，設立調解機制，兩機制最終會否聯合為一，尚待商討。另外，據悉金管局最快本周內，將次批涉及雷曼銷售失當調查個案，轉介證監會處理。 滙豐：不一定效法星展 財經事務及庫務局副局長梁鳳儀，接受本報查詢時表示，金管局就雷曼客戶投訴的調查個案，本周內將有新進度，呈交證監會進一步處理，但詳情留待該局公佈。她亦透露，該局有意設立調解機制，希望藉着更多仲裁及協商渠道，讓投訴人可與金融機構達成和解。她昨午呼籲其他銀行效法星展賠償苦主做法，主動就一些涉及不良銷售個案與客戶和解，毋須金管局作出調查。  滙豐銀行執行董事王冬勝表示，星展出售的掛鈎產品與其他銀行不同，星展向客戶賠償，惟本港銀行界不一定效法，最終要視乎政府及銀行公會委任獨立顧問作出估值後再作定案。 豐隆長者客獲原價回購 東亞銀行管理層出席花旗在前日舉行的投資者會議，花旗報告指出，東亞三年前已停止銷售雷曼迷債，迄今有關迷債餘額為1.8億元，估計賬面值僅餘1,500至5,000萬元，花旗相信，東亞因回購迷債構成的虧損將微不足道。不過，據悉，有關市值並非參考安永最新估值數據，只是政府早前預算。  外電報道，新加坡的豐隆金融昨晚發表聲明指，計劃向年紀大於62歲、不高於小學程度的客戶，以原價回購雷曼相關衍生產品，但須扣除迄今已支付的利息。"
20081024-7,20081024,7,特稿買350萬雷曼產品　85歲翁痛哭,特稿 買350萬雷曼產品　85歲翁痛哭 逾百名雷曼苦主昨晨拉起橫額，先後到金管局及證監會請願及遞信，要求協助追討損失，並到個別銀行要求見面，其中部份花旗銀行苦主一度突擊花旗的中環分行要求與職員會面但不果，一名購買了100萬元雷曼掛鈎票據（ELN）的程女士，力斥花旗欺騙她，一度跪在地上痛哭，情緒激動。  64歲的程女士表示，用了畢生積蓄的棺材本購買100萬元雷曼ELN，「我唔識英文，5分鐘就簽咗名。」同樣買了ELN的黃女士則不滿政府，只敦促銀行回購迷你債券，忽略買了ELN的苦主，希望當局能夠一視同仁向他們提供實質協助。 稱職員誤導「好安全」 約10名花旗銀行苦主其後前往中環會德豐大廈六樓的花旗銀行分行，以提款為由，要求與職員會面但被拒絕，經警方調解後銀行職員同意讓苦主入內，但最後眾人未有全部提款便離開。  另外，約三十名南洋商業銀行的苦主到中環南洋銀行分行門外，要求銀行「還我血汗錢」，年屆85歲的郭先生哭訴被職員誤導下，分四次購買雷曼迷你債券及掛鈎票據共350萬元，「介紹同埋簽名嗰陣都係得我一個人，我乜嘢都唔知，佢凈係話同定期差唔多，好安全，點知發生咁嘅事…嗚…嗚」。苦主們最後獲准分批入內，與銀行副總經理陳振英會面，並獲銀行承諾最快30日後有調查結果。  另外，對金融界立法會議員李國寶加入立法會因雷曼事件成立的小組委員會，民主黨李永達對此有保留，指李出任東亞銀行主席，而該銀行有出售雷曼迷你債券，擔心出現角色衝突。  本報記者
20081024-8,20081024,8,宜進利員工斥清盤人未盡責,"宜進利員工斥清盤人未盡責 【本報訊】上市公司宜進利集團清盤後，近二百名員工昨分別在港深兩地舉行申訴大會及靜坐，追討逾千萬元欠薪及遣散費。本港員工指摘臨時清盤人富理誠有限公司，無履行應有責任，在公司仍有大量資產下只發放部份遣散費及代通知金，又不派員保護內地廠房，任由供應商取走公司資產。深圳廠房約60名員工則在羅湖口岸廣場靜坐，希望追討九月份的工資及加班費等。  該公司本港的員工代表賴小姐表示，清盤人只在昨午發放十月份工資及年假補水，以及部份遣散費及代通知金，分別8,000元及2,000元給130名本港員工，但仍欠約一千萬元。她說：「公司仲有錢，但清盤人都叫我哋申請破欠基金，咁係有濫用之嫌，我哋唔想」，她說只想在公司剩餘資產中，取回應得的全數遣散費、代通知金、花紅、公積金等合理賠償。 無人看廠物資遭搜掠 宜進利內地總廠長梁先生亦指清盤人富理誠本月中已不再派人看守內地廠房，導致追討欠款的供應商可肆意入內搜掠，令西鄉廠房廠長捱打受傷。  協助員工的立法會議員葉偉明要求勞工處介入，協助員工追討欠款及轉換另一間公司做清盤人。富理誠有限公司發表聲明，強調已按法例所訂明，發放能優先支付的最高賠償金，每名員工可收取平均約28,000元，亦已協助他們申請破欠基金。  另外，早前結業的創億玩具廠母公司華興公司員工張先生稱，身兼廣州市政協委員的老闆馬長興日前通知他及十多名工友，不用再上班，返家等消息，現擔心眾人十月份共100萬元工資及遣散費等「凍過水」，十分徬徨。"
