key,date,article_daily_id,title,text
20080903-0,20080903,0,股倉蒸發600億　一隻碧桂園輸4億四叔：蝕得好慘,"股倉蒸發600億　一隻碧桂園輸4億 四叔：蝕得好慘 【本報訊】「香港股神」李兆基（四叔）老貓燒鬚，買入順德同鄉楊國強旗下的碧桂園股票，持有17個月，賬面輸近四億元。四叔昨日忍不住向記者大呻：「我揸住碧桂園手貨，已經蝕緊幾億元，好慘㗎啦！」事實上，恒指從去年10月高位累積下跌超過一萬點，四叔私人的股票組合市值，亦由高峯2,000億元，減至1,400至1,500億元，蒸發近600億元。記者：高淑嫻、黃武榮 以「給你一個五星級的家」為宣傳口號的碧桂園，去年4月在港上市，四叔為支持同鄉老闆楊國強，斥資10億元認購。碧桂園去年市旺時，曾創出歷史高位14.18元，一度為四叔帶來16.4億元賬面利潤。 兩至三隻股會換馬 可惜好景不常，隨着內地加強宏調力度，打擊熾熱樓市，加上楊國強私人投資繁多，影響碧桂園股價狂瀉不止，昨日收報3.29元，再創上市以來新低，較招股價「潛水」四成。四叔所持的碧桂園股票，賬面輸3.9億元，他昨日出席美麗華股東會後，被問到會否趁低吸納碧桂園，他脫口便說已經輸了錢，「唔適宜再揸咁多。」  四叔又表示，仲有兩至三隻股份「唔適宜再揸咁多」。四叔一直有推介13隻心水股，包括碧桂園、港交所、中國人壽和中國神華等（見表）。他昨日首次透露，正在考慮剔走兩至三隻心水股，換入另外兩至三隻新寵。可惜他今次非常口密，不願透露落選和候選名單，似乎是要避免令到相關股份價格波動。  他只強調，神華是他的超級愛股，內地銀行與保險股也是心頭好。以此推測，最大機會無得留低的是內房股和港交所。不過，他手持13隻愛股，現價較高位下跌35%至77%，四叔目前不急於套現，無理由無端端蝕沽，除非入市價更低，這個就只有四叔心水最清。四叔笑言「𠵱家立立亂，等到恒指升番上23,000點，先有心機講你知。」  他亦不忘為碧桂園講句公道話，指碧桂園股價是「跌過龍」，被投資者一沉百踩，老闆楊國強私人投資計劃多，令到市場認為隻股不夠踏實，比較「浮啲」。 認購國壽賺過百億 除了碧桂園外，四叔07年認購的十隻新股幾乎全軍盡墨，其中八隻錄得賬面虧損。蝕得最勁的是碧桂園，排第二亦是內房股合景泰富。幸而四叔四年多前認購國壽新股，累計賬面利潤仍然超過百億元，令到四叔的新股投資組合賬面仍賺229億元。 禁售期拖累要坐艇 四叔買新股要輸錢，因為他以機構投資者身份認購，有半年至一年禁售期，即使這些新股去年掛牌後大升，四叔都不能沽貨，只可以眼白白看着別人沽貨賺錢。到禁售期屆滿，大部份股份的股價又已下跌，距離高位甚遠，甚至潛水，四叔又不會貿然蝕沽，只好坐艇。難怪四叔年初至今只認購中鐵建一隻新股。 李兆基13隻愛股表現 股份名稱：碧桂園（2007）  歷史高位：14.18元　昨日收市：3.29元　跌幅：77%    股份名稱：富力地產（2777）  歷史高位：45.6元　昨日收市：13.16元　跌幅：71%    股份名稱：中國遠洋（1919）  歷史高位：40.8元　昨日收市：14.6元　跌幅：64%    股份名稱：港交所（388）  歷史高位：268.6元　昨日收市：100.6元　跌幅：63%    股份名稱：中煤能源（1898）  歷史高位：29.5元　昨日收市：12.72元　跌幅：57%    股份名稱：中國神華（1088）  歷史高位：57.95元　昨日收市：26.2元　跌幅：55%    股份名稱：平安保險（2318）  歷史高位：124元　昨日收市：58.25元　跌幅：53%    股份名稱：中石油（857）  歷史高位：20.25元　昨日收市：9.95元　跌幅：51%    股份名稱：中信泰富（267）  歷史高位：51.7元　昨日收市：27.25元　跌幅：47%    股份名稱：中國人壽（2628）  歷史高位：53.8元　昨日收市：29.7元　跌幅：45%    股份名稱：中國海外（688）  歷史高位：21元　昨日收市：12.8元　跌幅：39%    股份名稱：招商銀行（3968）  歷史高位：40.4元　昨日收市：25.35元　跌幅：37%    股份名稱：中海油（883）  歷史高位：17.6元　昨日收市：11.38元　跌幅：35%    資料來源：彭博資訊 認購新股賬面賺229億詳情 中鐵建（1186）  招股日期：08年2月　認購金額：3.9億元　賬面賺：0.26億元    中國中鐵（390）  招股日期：07年11月　認購金額：3億元　賬面賺：0.15億元    中外航運（368）  招股日期：07年11月　認購金額：1.95億元　賬面蝕：1.19億元    大昌行（1828）  招股日期：07年10月　認購金額：2.34億元　賬面蝕：1.49億元    波司登（3998）  招股日期：07年9月　認購金額：1.95億元　賬面蝕：1.21億元    遠洋地產（3377）  招股日期：07年9月　認購金額：2.34億元　賬面蝕：1.25億元    恒鼎實業（1393）  招股日期：07年9月　認購金額：1.56億元　賬面賺：0.49億元    合景泰富（1813）  招股日期：07年6月　認購金額：3.33億元　賬面蝕：1.79億元    復星國際（656）  招股日期：07年6月　認購金額：1.56億元　賬面蝕：0.87億元    碧桂園（2007）  招股日期：07年4月　認購金額：10億元　賬面蝕：3.88億元    洛陽鉬業（3993）  招股日期：07年4月　認購金額：1.56億元　賬面蝕：0.41億元    中煤能源（1898）  招股日期：06年12月　認購金額：3.9億元　賬面賺：8.35億元    工商銀行（1398）  招股日期：06年10月　認購金額：16億元　賬面賺：11.88億元    招商銀行（3968）  招股日期：06年9月　認購金額：7.8億元　賬面賺：15.33億元    中油化學（3983）  招股日期：06年9月　認購金額：1.95億元　賬面賺：3.07億元    中國銀行（3988）  招股日期：06年5月　認購金額：14.04億元　賬面賺：1.81億元    玖龍紙業（2689）  招股日期：06年3月　認購金額：1.56億元　賬面賺：0.62億元    領匯（823）  招股日期：05年11月　認購金額：0.4億元　賬面賺：0.31億元    建設銀行（939）  招股日期：05年10月　認購金額：1.872億元　賬面賺：3.11億元    交通銀行（3328）  招股日期：05年10月　認購金額：2億元　賬面賺：5.12億元    神華能源（1088）  招股日期：05年6月　認購金額：7.8億元　賬面賺：19.45億元    中遠控股（1919）  招股日期：05年6月　認購金額：7.8億元　賬面賺：19億元    網通（906）  招股日期：04年11月　認購金額：3億元　賬面賺：3.54億元    中國電力（2380）  招股日期：04年10月　認購金額：1.95億元　賬面蝕：0.18億元    中海集運（2866）  招股日期：04年6月　認購金額：1億元　賬面蝕：0.42億元    平安保險（2318）  招股日期：04年6月　認購金額：7.8億元　賬面賺：36.18億元    中國人壽（2628）  招股日期：03年12月　認購金額：15.6億元　賬面賺：113.46億元    認購金額總計：127.96億元　　賬面賺總計：229.44億元    資料來源：《蘋果》資料室 你想知　想講　想問? 你過往有跟隨四叔的心水選擇買股票嗎?  請即上《蘋果》網頁 http://appledaily.atnext.com留言喇！   或電郵至：mailto:focusgroup@appledaily.com  傳真：37112411  手機短訊：63836568"
20080903-1,20080903,1,港大調查兩成中學生想死他們要家人關愛,"港大調查兩成中學生想死 他們要家人關愛 【本報訊】新學期未必是令人喜悅的新開始，不少中、小學生均為適應問題、學業及愛情煩惱，每天懷着沉重心情上學，學期伊始成為學生自殺的高危期。香港大學防止自殺研究中心最新的調查發現，本港有兩成中學生曾想過自殺，其中逾5%更曾付諸行動企圖自殺。研究人員表示，家人和友人的關愛是防止學生自殺的靈丹妙藥，可有效打消他們自尋短見的念頭。記者：梁美寶、馮永堅、倪清江 香港大學防止自殺研究中心在07年底至08年初，以問卷形式訪問了1,000名中二至中七的學生，了解其自殺傾向，發現逾20%受訪者曾想過自殺，當中逾5%曾付諸行動企圖自殺。以本港有45萬中學生推算，即有九萬個中學生曾想過死，當中4,500名學生曾企圖自殺。 生命熱線追尋300高危生 該中心總監葉兆輝表示，選擇自殺的學生多數感到沒有人關心、無人理會，處於一個被隔絕的世界，若他們感到家人或身邊友人的愛護，大有機會打消自殺念頭；調查也發現與家人關係良好的學生，選擇自殺的機率較與家人關係差的學生低一半。  學生自殺的原因較以往變得「多元化」，葉兆輝說，十年前學生多為學業而自殺，但時至今日，想死的學生會備受愛情、家庭及人際關係等不同問題困擾。他說，調查結果非常值得關注，希望社會各界多以愛與關懷，救回尋死的年輕人。  另一個防止自殺機構「生命熱線」昨日亦公佈，開學前後該機構在互聯網找到近1,000個問題學生網誌，他們不約而同地透露對開學的負面感覺，包括困擾情緒、未能應付功課壓力及擔心與新同學「唔夾」，當中約300個網誌有透露對生命的無奈，如寫下「如果要留班就自殺」、「做人好辛苦，我真係頂唔順」等令人心寒字句，屬自殺高危一族，該機構將盡力尋找及協助他們。 面對新學年轉變壓力大 生命熱線副總監錢文紅說，近年不少學生都愛在網誌留下自己的苦與樂，部份人將它視作宣洩途徑，由於學生較易受朋輩影響，如他們看到這些字句可能有樣學樣，「好似感冒咁一個傳一個，引起自殺念頭」。本報更在網上找到多張學生自殘相片及短片，其中有女生更拍下長達六分鐘的自殘短片，以𠝹刀在手臂𠝹出「灰」及「死」兩字，影片甚為恐怖血腥。  為預防青少年自殺，生命熱線早前開設了電郵回應服務，若收到一些學生透露想死的電郵，即會以電郵開解他們。本月10日是「世界預防自殺日」，生命熱線與雅虎網站合作，當日若有人搜尋「自殺」及「死」的相關字眼時，該網站會即時顯示生命熱線的24小時預防自殺熱線：23820000，讓有需要人士使用。  教育評議會副主席何漢權指，每年9月是中學生自殺高危期，因新學年學生要面對新環境、同學、老師和課程的轉變，部份人因而感到壓力大；另一高危期是考試前後。教育局資料顯示，由02/03學年至今年，共有約60名學生自殺身亡，每年平均10人。 如何幫助自殺高危人士 1〉表現關懷及不批判，耐心聆聽當事人困擾  2〉盡量肯定及欣賞當事人的能力  3〉若當事人情緒持續低落，勸他並盡量為他找專業人士協助  4〉以開放態度與當事人探討難題的解決方法  資料來源：生命熱線"
20080903-2,20080903,2,余若薇選情極危,余若薇選情極危 【本報訊】前任政務司司長陳方安生昨日表示，對立法會港島區候選人、公民黨黨魁余若薇的選情感到擔憂，指近日由於不少選民以為余早已夠票，故計劃自行配票改投其他候選人，結果令在公民黨參選名單排第二的余若薇，選情變得極度危急。 陳太：泛民派內爭票 陳太表示，留意到近日有人惡意攻擊公民黨表現霸道，並指該黨其實不需要10萬張選票，「但如果你哋分析吓票源，同埋計吓幾多票先能夠當選，事實上10萬票先係穩陣，8萬票係絕對唔穩陣。」  陳太昨日出席民主黨涂謹申拉票活動後表示，近日最不幸的現象就是泛民主派候選人互相攻擊，「有啲人可能知道喺保皇派爭票好難，所以喺泛民派內互相攻擊去爭票，但咁樣做係無補於事。如果繼續係咁，泛民喺港島區隨時只有兩席，保皇派就可以攞到四席。」  陳太指出，近日政府民望和支持度插水，市民更應該了解，現時對政府表達不滿的最好方法，「就係喺9月7日，透過我哋手中一票表達畀政府聽，我哋唔鍾意佢哋專橫霸道，唔鍾意保皇黨凡事都支持政府，令政府可以為所欲為。」
20080903-3,20080903,3,選區分析支持率勁跌涂謹申勢危,選區分析 支持率勁跌涂謹申勢危 【本報訊】立法會九龍西選情對民主黨、公民黨及社民連來說，恍如坐過山車般大起大落，民主黨涂謹申的支持度由8月初排第二位，跌至本周初第五位，隨時議席不保。有泛民中人分析，現時各民調尚未反映左派陣營鐵票，預計泛民三黨候選人，只有兩人可以當選，誰人出局將成外界關注焦點。 梁美芬得票一成非難事 香港大學民意研究計劃9月1日公佈的九西滾動民調結果顯示，獲逾一成支持率的候選名單分別有民協馮檢基、民建聯李慧琼及社民連黃毓民。若根據民調走勢分析，過去一個月馮、李兩人支持度相對穩定，起伏不大，估計兩人各取一席機會很高。  黃毓民支持度則由最初的7.4%逐步升至10.6%，可說是穩步向上，相反民主黨涂謹申支持率由8月初15.7%一路跌至7.9%，中間反彈迹象不大，顯示涂支持率有機會在未來幾日，隨着下降軌繼續下跌。  有民主黨人士分析，民調尚未反映左派陣營鐵票，按過去九西選情分析，左派尚有最少五個百分點選票尚未現形，現時梁美芬支持率為6.2%，若投票日梁獲左派配票，要取得一成得票率並非難事，所以不能一廂情願按民調結果，推測民主黨、公民黨及社民連可以全取九西三席，從保守角度分析，三黨候選人只能保兩席。按目前形勢推論，黃毓民有望保持上升走勢，特別是社民連透過互聯網爭取年輕選民支持，策略十分成功，估計黃入局機會遠較毛孟靜、涂謹申高。 民主黨元老傾全力助選 據悉，民主黨內部也認為涂謹申選情惡劣，已視保涂為最重要任務，除了將黨內餘下資源全投進九龍西，前任政務司司長陳方安生今日也會到九西為他助選，黨內兩大元老李柱銘、司徒華更會輪流為涂拉票，直到投票日為止。民主黨中人相信，若未來幾日涂謹申支持率無法反升，到投票當日左派鐵票現形後，要保住涂謹申一席難度會更大。
20080903-4,20080903,4,新丁之言田北辰：我無建制派本錢,新丁之言 田北辰：我無建制派本錢 建制派兩名新人、自由黨田北辰及獲中聯辦力撐的梁美芬，在九西選區互搶選票，最終或導致兩敗俱傷。據了解，左派曾有意見認為中聯辦棄保支持度平平的梁美芬，改為力撐走勢不俗的田北辰，令他有足夠支持度擊敗至少一名泛民候選人，可惜中聯辦堅持力撐支持度不足的梁美芬，田北辰昨直認「選情嚴峻」。  由商入政的田北辰形勢本來大好，但中聯辦拒絕配票，同時將30名地區樁腳「鐵票」全送梁美芬，令梁支持度後來居上。直認選情嚴峻的田北辰昨天與傳媒會面時，表明不會告急，只希望在最後關鍵時刻，以勤力及誠意打動約近兩成多的中間游離選民，令他可以反敗為勝。 暗諷梁美芬樁腳多 田北辰承認，其他建制派候選人是其主要對手，對此感嘆指：「我係空有建制派包袱，而無建制派本錢」，直指其選舉工程只靠十數名助選團協助，「出面一個樁腳都無」，動員力遠遠不及其他建制派對手，似暗諷梁美芬「有幸」獲中聯辦安排了近30個地區樁腳助選。  不過，在中聯辦力保下，梁美芬似乎仍然未能起死回生，最新支持度僅排在第六位，左派陣營幾乎打定輸數。田北辰則表明會在最後選舉階段靠個人實力爭取游離票。本報記者
20080903-5,20080903,5,選區分析新界東勢亂　劉慧卿隨時墮馬,選區分析 新界東勢亂　劉慧卿隨時墮馬 【本報訊】立法會新界東7個直選議席中，頭4席花落誰家，形勢相當明顯；至於餘下3席由誰人奪得，反而出現較大變數。除了民建聯排第二的陳克勤有機會外，前綫劉慧卿、社民連的梁國雄、民主黨黃成智、甚至在選舉後期支持率不斷上升的龐愛蘭，也有機會當選。而隨着梁國雄支持率由低位反彈，劉慧卿形勢更嚴峻。  根據港大最新民調顯示，三張參選名單取得逾一成支持率，分別是民主黨鄭家富、民建聯劉江華、及公民黨湯家驊，三張名單中，劉江華支持率最穩定，長期取得15%左右，鄭家富及湯家驊則有下跌趨勢，但仍是泛民中支持度最高名單。 前票后被長毛攤薄票源 泛民中人評估，按民調走勢看，劉江華、湯家驊、鄭家富，以及有近9%支持率的自由黨主席田北俊，可望取得一席，但餘下3席由誰取得，就充滿變數。其中「長毛」梁國雄支持率回升到7.7%，已壓過了劉慧卿，估計取得一席機會很高；民建聯名單排第二的陳克勤有隱形鐵票力撐，入圍機會也大，餘下的劉慧卿、黃成智及龐愛蘭各有5%左右支持，誰可取得一席，視乎最後幾日選民投票取向。  原本被視為有望奪一席的劉慧卿，因為不少選民認為她「夠贏」，變相令她更難以告急方式拉票，有泛民中人指出，劉曾是新東票后，雖然她近年被走激進路線的梁國雄攤薄票源，但難以令選民相信劉已去到出局邊緣，「正所謂爛船有三斤釘，地區好多選民唔信卿姐告急，再加上長毛分咗佢嘅票，卿姐形勢都幾難搞！」  劉慧卿昨天在記者會上直認選情嚴峻，其中一個原因，或是地區傳出不少指她必勝的謠言，令選民轉而投票支持其他候選人，劉慧卿希望支持她的選民繼續投票給她。 新短片銷百分百出席率 為了在最後關頭向選民發送她未必「贏梗」的訊息，一直拒打告急牌的劉慧卿也特別印製了一批寫有「選情嚴峻」的紙扇派送給街坊，當中寫上「卿姐需要你全投」；同時也特別製作一條全新短片，放上其競選網誌 http://www.keepHKshining.com，力銷其100%立法會出席率及敢言實幹作風，希望市民支持她繼續監察政府。 
20080903-6,20080903,6,兵行險着新星如意算盤未必響,兵行險着 新星如意算盤未必響 民建聯副主席劉江華領導的新界東團隊支持度持續下滑，最終未必能奪兩席，在黨內敲起警鐘。據了解，民建聯今屆決意由陳克勤（圖）換上李國英，其實被不少黨員認定是兵行險着，因為陳克勤的吸票能力肯定較李國英低，但由於陳克勤為黨內打造的政治新星，成敗牽繫甚廣，因此該黨不容有失，最後關頭必會全力箍票。 流失大量鄉事票 由陳克勤頂上李國英參選的安排，最初也在黨內引起爭議，但據知當時黨員考慮的一個重要因素，是陳克勤背負的象徵意義。有消息指，陳克勤為根正苗紅的黨員，曾經參選區議員，其後被民建聯保送入政府擔任特首辦特別助理；最終要他辭工參選，就是希望透過陳克勤一擊即中，為民建聯「省靚招牌」。  本來陳克勤入議事堂機會甚高，但不少鄉事派因早前的區議會功能組別風波而對民建聯深表不滿，因而流失大量鄉事票至其他團隊；加上聲稱獨立實際卻為新論壇成員的龐愛蘭加入競爭行列，也令民建聯失去部份選票。泛民主派各團隊亦針對陳克勤的特首辦背景，在選舉論壇向他猛烈圍攻，希望把他拉下馬，以打亂民建聯的如意算盤。  本報記者
20080903-7,20080903,7,當值民政處職員怨無法投票,當值民政處職員怨無法投票 【本報訊】民政事務總署職員須於投票日開工，協助選舉。該署上月中已就職員投票的安排發出指引，聲稱當日可以讓部門職員執行職務的同時，也可投票。但有員工投訴，根據署方當天的安排，他們根本無法履行公民責任。 早上當值至凌晨 18區的民政事務處不同職系的職員都可能需要於立法會選舉日，協助選舉主任執行各項與選舉有關的職責，讓立法會選舉得以順利舉行。  民政事務總署前日的新聞稿聲稱，各區民政事務處會於選舉當日作出切實可行的安排，在人手方面作出調配，讓當日參與執行選舉有關職務的同事，可於法定的投票時段內前往投票，履行其公民權利。  署名「一名民政事務處職員」的投訴人說，各區民政事務處現正安排各區職員協助下星期的立法會選舉，在剛過去的區議會選舉，大部份民政事務處的職員均需於當日當值。署方雖表示職員可於上班前先行投票，但基於職責上的安排，部份職員須於早上7時報到，直至凌晨時分才下班，以致當日根本沒有機會投票，署方所謂的投票安排對他們來說根本形同虛設。  民政事務總署發言人昨日只重申前日發表的新聞稿，未能進一步回應員方的申訴。
20080903-8,20080903,8,劉慧卿責龐愛蘭呃選民,劉慧卿責龐愛蘭呃選民 【本報訊】在新界東參與立法會地區直選的龐愛蘭，雖然身為新論壇理事，卻報稱為獨立人士，更與新論壇反對2012年全面普選持相反意見，坦言個人是支持2012年普選，結果受到其他泛民候選人狂轟為隱形左派，前綫劉慧卿更責她「欺騙選民」。 名為獨立實為左派 打着獨立旗號在新界東參選的龐愛蘭支持度節節上升，正向該區第七席邁進。但其疑似泛民的政治立場卻受到質疑。香港電台昨日舉辦選舉論壇，對手質疑龐愛蘭身為新論壇成員而未有表露政治聯繫，名為獨立卻實為隱形左派，難以期望她在立法會憑良心投票。前綫劉慧卿「篤爆」她指新論壇一直反對2012年普選，龐卻表示支持，直斥「究竟你係精神分裂，定係欺騙緊選民？」  龐愛蘭回應時只稱，新論壇並非一個政黨，因此個人可以支持2012年普選。但有市民不滿，質問龐指「點解要迴避親中立場？」社民連「長毛」梁國雄一度揶揄龐愛蘭指「無新論壇就無龐愛蘭」；民主黨黃成智也怒斥龐愛蘭口口聲聲支持民主，「你咁多年嚟為民主做過啲乜嘢？」
