key,date,article_daily_id,title,text
20081227-0,20081227,0,阿女唔做功課　藤條教訓爸爸報警拉媽媽,"阿女唔做功課　藤條教訓 爸爸報警拉媽媽 【本報訊】教仔要循循善誘，還是棒下出孝兒呢？一名與丈夫分居，獨力管教兩名女兒的單親媽媽，前晚發現11歲大女未做好假期功課而大發雷霆，取出藤條體罰女兒。至昨日凌晨時分，女童趁母親入睡後致電父親哭訴，慈父心痛立即趕往探望，並報警指控妻子打女，警員到場將涉嫌體罰女兒的婦人帶署，女童則被送院敷治。　記者：譚健文、黃江奇 遭媽媽「藤條炆豬肉」的女童姓陳（11歲），右手腕、手背和五隻手指都留下紅紅的藤條痕。涉嫌打女的媽媽姓黃（35歲），事後被警方扣留調查，列傷人案處理，女事主事後獲准以1,000元保釋候查。  消息稱，黃婦多年前與姓陳男子結婚，婚後兩人育有兩名女兒。年前夫婦意見不合協議分居，兩名現年11歲及6歲女兒由媽媽照料，母女三人同住大角嘴橡樹街一個板間房單位，現年46歲的丈夫則另居別處，但他跟兩名女兒感情甚佳，經常見面。 手腫疼痛　致電父親哭訴 黃婦母兼父職，獨力肩負照顧兩名女兒的責任，據知她十分緊張女兒的功課，經常督促她們溫習，壓力很大。兩女近日放聖誕假期，黃婦多次督促她們要及早做好假期作業及溫習課本，可是至前晚黃婦發現大女兒仍未做好假期作業，登時大發雷霆，喝罵女兒。  黃婦怒不可遏，最後一時「火遮眼」，隨手拿起藤條狠狠向大女兒責打，女兒揮手擋格時右手被藤條打中多下，手背、手腕及五隻手指紅腫，痛得她哇哇大哭，及後黃婦和兩女如常就寢。至昨凌晨時分，右手隱隱作痛的女童趁母親熟睡，偷偷致電父親哭訴。陳父知道女兒遭責打痛在心頭，立即趕往女兒住處查看。  至凌晨2時許，陳趕抵橡樹街妻子家中，看到女兒右手紅腫，登時勃然大怒，指摘妻子不應狠心打女，更致電報警。警員到場調查，證實女童曾被藤條鞭打，於是召救護車將女童送院，陳父和幼女亦陪同送院，女童經檢查及敷治後無礙出院，涉嫌打女的媽媽則由警員帶署調查。 情況嚴重　可被控虐兒罪 防止虐待兒童會總幹事雷張慎佳表示，理解案中單親媽媽所承受的沉重生活壓力，「一個女人喺現今時勢，照顧兩個女之外又要兼顧家庭，的確十分吃力，但體罰責打並唔係最好嘅管教方法。」雷太解釋，女事主兩名女兒身心正處發育階段，漸有自己的主張和意見，甚至會挑戰家長權威。  雷太補充，作為單親家長，教導子女做功課是親子之間最常發生磨擦的戰場，她建議家長要循循善誘，耐心引導，高壓的責打體罰只會引來反效果，最直接是傷及幼童，無形惡果則是破壞親子關係，甚至傷害孩童的自尊心。  去年10月14日，一名單親媽媽因為9歲兒子拒做功課，用藤條施以體罰再將他趕出家門，結果被控虐兒罪成，判處一年感化令。雖然香港沒有法例禁止家長體罰子女，但若情況嚴重，當局可以傷人或虐兒罪起訴。 媽媽打女被捕示意圖 世界各地體罰兒童規限 加拿大  ‧容許家長用合理方法體罰子女，例如打屁股，但用棒或皮帶體罰則屬違法    蘇格蘭  ‧禁止對未滿3歲孩子打耳光或屁股；對3歲以上孩子則不可打頭、搖晃身體，亦不可用皮帶、拖鞋或棒棍體罰    英國  ‧禁止公立學校體罰兒童；同時禁止父母用工具體罰子女，也不許打子女的頭、眼和耳朵    巴基斯坦  ‧可用工具抽打子女背部    新加坡  ‧中學允許對一些嚴重違規男學生進行打藤體罰，女學生可免    荷蘭、法國、以色列  ‧禁止家長及學校體罰兒童    中國大陸、香港、澳門、台灣、奧地利、芬蘭、拉脫維亞、克羅地亞、德國、挪威、塞浦路斯、瑞典、丹麥、冰島、烏克蘭、羅馬尼亞、保加利亞、匈牙利  ‧止學校體罰學生，但家長體罰子女則沒有明文禁止    資料來源：《蘋果》資料室 你想知　想講　想問？ 你有教導子女的心得與我們分享嗎？    請即上《蘋果》網頁 http://appledaily.atnext.com留言喇！   或電郵至：mailto:focusgroup@appledaily.com  傳真：37112411  手機短訊：63836568"
20081227-1,20081227,1,地勤罷工　行李輸送停頓　影響83航班機場半癱6小時,地勤罷工　行李輸送停頓　影響83航班 機場半癱6小時 【本報訊】本港機場爆發近年最大規模的工潮，近千名香港機場地勤服務有限公司（HAS）員工，不滿資方停發相等於一個月薪金的工作表現獎，昨午1時起進行三小時警示性罷工，其間行李處理服務幾乎停頓。有人苦等四小時才取回行李，有離港旅客的寄艙行李更要由下一班機運往目的地，場面混亂，到晚上7時服務才恢復正常。機場六小時陷入半癱狀態，83班航班受影響，數以萬計乘客飽受折磨。資方最後提出發放14日工資作補償，勞資下月5日再開會，工會承諾該日之前不會有罷工行動。　記者：盧文烈、黃偉駿、羅日昇 香港民用航空事業職工總會及機場空運員工協會代表，昨晨與資方進行約三小時談判，香港民用航空事業職工總會副秘書長葉偉明於會後宣佈談判破裂。由於公司只願向每名員工發放750元一次性的獎賞，代替相等於第14個月糧的工作表現獎，員工難以接受，即時宣佈下午1時至4時罷工三小時。 近千名當值員工參與 數百名原本在停機坪工作的員工，即時響應工會號召，放低手頭工作，在停機坪集會，部份更拉起抗議橫額。葉偉明指昨有近千人響應罷工，全部要當值的員工都有參與。  HAS負責六成機場地勤或停機坪服務，客戶包括44間航空公司。罷工主要影響行李處理、貨物裝卸及接載機組人員的巴士服務。  雖然罷工行動在下午4時結束，但仍有大批行李積壓未能獲得處理，有乘客花了超過四小時等候行李，直至傍晚7時許，行李服務才陸續回復正常。  有抵港旅客表示，行李認領大堂擠滿旅客，多人鼓譟，場面混亂，有人越等越急，怒斥機場管理局及航空公司沒有應變方案。  民主黨南區區議員柴文瀚昨日從台北旅遊返港，受今次地勤罷工影響，延誤近一小時才起飛，返抵香港已經是下午4時50分。但原來他的噩夢這時才開始，只見行李認領大堂萬人空巷，他所乘搭航班的行李輸送帶，顯示屏上竟然同時出現了六班航機，而且「條輸送帶好耐先出一件行李。」 廣播只稱有技術問題 柴文瀚批評HAS管理層處理不當，「明知呢兩日聖誕假期完，好多市民返香港，就應該小心啲處理罷工問題。」他又批評機管局隱瞞真相，「我哋喺裏面等行李嘅時候，廣播只係話有技術問題，冇講話有地勤罷工。」  網友「Aliceee」同樣運滯，等了兩小時仍未能領回行李，最後旅行團領隊向他們表示，機場職員無法保證他們可以即日領回行李，建議各人先登記資料後離開。但她住所的鎖匙因為放了在行李箱內，結果要找開鎖工人「爆門」才能入屋。  截至昨午6時，共有36班抵港航班的行李需較長時間送抵行李認領大堂，47班離港航班的起飛時間延誤。國泰航空承認工潮期間行李上落服務幾乎停頓；港龍則透露，罷工期間，離港乘客的寄艙行李需由較後航班運送而延遲抵達。 勞方仍不滿　下月再議 工潮一度令機場陷於半癱狀態，資方急忙安排在下午4時30分召開第二次會議，提出向員工發放相當於14日工資的工作表現獎。機場空運員工協會總幹事周小松透露，員工對新方案並不滿意，已提出反建議，容許資方先發放14日獎金，其餘半個月獎金則分期發放，或者「遲啲發」，即堅持一個月獎金不能少。諮詢後若員工對公司建議不收貨，不排除1月5日後再發起工業行動。勞資雙方昨同為罷工行動向旅客致歉。  代表保險業的立法會議員陳健波指出，旅客抵達目的地後，行李出現延誤，旅遊保險不會作出補償；但若行李最終遺失了，一般旅遊保險都會賠償，但要提供證明。 本港近年較矚目工潮 07年8月8日至9月11日  數百名扎鐵工人馬拉松式罷工36天，爭取加薪及縮減工時    08年5月5日至5月6日  100多名泥頭車司機在3個堆填區罷工，要求承建商發放燃油附加費    08年7月11日至7月12日  維他奶運輸部約200員工罷工兩天，爭取加薪    08年7月21日至22日  屈臣氏蒸餾水約400名司機及跟車工人罷工兩天，爭取提高佣金    08年7月27日至29日  雀巢香港有限公司約200名司機及跟車工人罷工兩天半，爭取提高佣金    08年7月29日  雅潔蒸餾水運輸部約50名司機罷工數小時，爭取提高佣金    08年10月3日  蒂森克虜伯電梯公司約80名技工罷工一天，要求加薪及改善待遇    資料來源：《蘋果》資料室 你想知　想講　想問？ 地勤人員以罷工行動要求資方維持發放  工作表現獎，你是否支持其做法？    請即上《蘋果》網頁 http://appledaily.atnext.com留言喇！   或電郵至：mailto:focusgroup@appledaily.com  傳真：37112411  手機短訊：63836568
20081227-2,20081227,2,白腹海鵰重臨電塔築巢你拆我建　再與港燈角力,白腹海鵰重臨電塔築巢 你拆我建　再與港燈角力 【記者林社炳報道】一對本港罕見的白腹海鵰，近日重臨港島南區田灣與港燈再度角力。這對固執的留鳥，不是爭取港燈減電費，而是堅持在電塔上築巢，相信是希望在繁殖季節傳宗接代。港燈多次派員「拆竇」，白腹海鵰一再重建家園。有自認是「冷血」的觀鳥者內心被打動，呼籲同好發聲為白腹海鵰「保衞家園」。  退休救護員王錦輝日前帶記者到位於田灣的香港仔西避風塘防波堤，看到白腹海鵰抓着一根樹枝，空降到牛奶公司冰廠及凍房的高架電塔上，放下樹枝後再緩緩飛離還沒蓋好的鳥巢。 觀鳥者籲「成人之美」 王錦輝說，今年10月曾在金鐘和記大廈，看到「熟口熟面」的白腹海鵰飛翔；兩、三周前再次發現牠們在香港仔西避風塘同一個高架電塔築巢。本月19日看見相信是港燈派來的人員，拿着黑膠袋登上電塔，拾走鳥巢的樹枝。  他說，去年同期在田灣觀鳥，已察覺白腹海鵰和港燈各不相讓，不斷「你拆我建」鳥巢。後來再不見白腹海鵰出沒，心想這場人鳥之爭終告落幕。沒想到「拆建」鳥巢的人鳥大戰，近日再次重演。  與白腹海鵰結緣的王錦輝，形容他退休前擔任救護員的工作「好血腥」，容易失去對人與事的感覺。最近有環保人士搶救垂死的老牛，再次觸動他對生命的關懷。他說，「呢對白腹海鵰堅持喺電塔築巢，一定係想生仔，港燈好應該成人之美。」他呼籲保育人士要求一直自稱推動保育和環保的港燈和政府謀求解決方法。港燈在上月員工動態刊物發表文章，表示在田灣50多米高的電塔平台，另行蓋搭一個人工鳥巢，遠離高壓架空電纜，避免白腹海鵰觸電化為灰燼，可惜這對白腹海鵰一直「不領情」。  白腹海鵰在香港相當罕見，除了田灣的一對，過去曾在青洲及竹篙灣曾發現牠們的蹤影。 白腹海鵰小檔案 名稱：白腹海鵰White-belliedSeaEagle（Haliaeetusleucogaster）  科屬：本港留鳥的中大型猛禽  體長：約60至74厘米  識別：頭、頸、腹及尾部為白色，上身呈灰色。有鈎狀嘴及利爪  習性：愛在海上及水塘覓食魚類  繁殖期：每年10月至翌年3月    資料來源：漁護署《觀鳥背後》
20081227-3,20081227,3,獎金歷來第二高六合彩兩注中各分2965萬,"獎金歷來第二高 六合彩兩注中各分2965萬 【本報訊】歷來第二高獎金超級六合彩昨晚攪珠，結果由兩名幸運兒瓜分馬會這份大禮，每注獲派2,965萬頭獎獎金，迎接一個快樂的新年。昨晚攪出的號碼為2、17、19、21、24、34及特別號碼18。 投注額1.2億今年最高 昨晚頭獎獎金如此巨大，皆因上期舉行的六合彩聖誕金多寶攪珠無人中頭獎，超過4,100萬多寶撥入昨晚彩金，加上馬會延遲兩日攪珠，因此令投注額比上期大幅上升，達1億2千400萬，是今年最高投注額。結果頭獎兩注中，每注派2,965萬。  根據馬會資料顯示，歷年最高派彩頭獎得主在03年誕生，幸運兒獨得7,096萬獎金。而聖誕金多寶是歷史最悠久的金多寶攪珠之一，自1991年開始舉辦，歷年共創造20多位頭獎得主，派出獎金總額超過四億元。  昨晚頭獎已送出，下期攪珠開獎時間回復正常，在周二晚九時，由於無多寶累積，估計頭獎基金為下限的500萬。 新春金多寶有3800萬 另外，下月便是農曆新年來臨，在這個大日子，馬會亦準備了一份「大利是」給全港投注人士認領，將動用3,800萬金多寶儲備舉行新春金多寶攪珠，馬會預計屆時頭獎若一注獨中，幸運兒將可獨得6,000萬頭獎彩金，過一個難忘的新年。"
20081227-4,20081227,4,保安與投注客互毆買六合彩打尖釀血案,"保安與投注客互毆 買六合彩打尖釀血案 【本報訊】超級六合彩昨晚攪珠，吸引大批市民到馬會場外投注站購買六合彩，其中一名發橫財夢的男子，昨午在荃灣的馬會場外投注站排隊時，疑為打尖問題與馬會一名保安員發生爭執及扭打，他與保安員同告受傷，兩人並因涉嫌在公眾地方打架被警方拘捕帶署調查，該市民痛失發財機會兼惹上官非。  疑因打尖問題與保安員打架受傷男子姓黃（46歲），左眼角及左臉受傷，事後要送院治療；涉案馬會保安員姓林（51歲），額頭及頸部受輕傷，在現場接受治療後毋須送院，兩人涉嫌在公眾地方打架被捕。 兩人一同被捕 現場為荃灣沙嘴道301至303號馬會場外投注站，由於昨晚的六合彩累積的多寶獎金高達4,125萬元。不少市民為博巨獎，昨日紛紛到投注站買六合彩碰碰運氣，午後更出現排隊人龍，馬會派出保安員在場維持秩序，避免有人打尖出現爭端。  事發於昨日下午3時25分，上址投注站門外有大批市民在排隊入內買六合彩，黃擬加入排隊人龍時，疑有人打尖，姓林保安員聞悉向黃了解時，雙方發生爭執，有人動手後互相追打同受傷。警員在場調查後，以涉嫌在公眾地方打架將兩人拘捕。"
20081227-5,20081227,5,主人願領回呷醋貓免人道毀滅,主人願領回呷醋貓免人道毀滅 【本報訊】「希望佢真係會好好照顧隻貓啦！」前日在觀塘麗港城發惡抓傷男女主人的呷醋老貓現時「羈留」漁護署，由於貓主人曾聲言不會領回花貓，一名熱心女子恐怕花貓遭人道毀滅致電當局陳情欲領養花貓。但數小時後，貓主人又回心轉意要取回花貓，領養夢落空的女子祝願花貓可以頤養天年。 愛貓女保貓命圖領養 要求領養呷醋老貓女的熱心女子姓陳，從事船務行業，她說「抓傷主人嘅貓女成十歲，算係老貓，其實今次件事好唔尋常，隻貓除非有唔好經歷，否則唔會無端端襲擊主人。」她坦言，貓主人出爾反爾令她失望，但「最擔心係個主人，日後仲會唔會用平常心，好好對待一隻曾經襲擊自己嘅貓。」  家中養有五條貓、六頭狗的陳女士表示，昨晨看報得悉發生這宗老貓呷醋抓傷男女主人奇案，感到十分好奇，但更令她震驚是受傷主人透露不會領回這頭老貓，換言之老貓女在漁護署的動物管制中心羈留五日後便要人道毀滅，死路一條。  她續稱，不忍心看着一條生命白白死去，因此「膽粗粗」致電有關部門陳情，她憶述當時費盡唇舌終打動署方職員，替他聯絡傷人花貓的主人，再經一番游說終說服對方同意將老貓轉贈予她，在老貓的囚禁期滿領養老貓。  她說當時滿心歡喜，準備在家中騰出空間，為這名新成員添置鐵籠，傍晚時分突接獲漁護署通知，指老貓的主人突然表示自己領回花貓。 望主人能善心對待牠 陳小姐直言，接獲消息一刻當然失望，但仍尊重對方意願，她表示領養原意是為保貓命，既然貓主人回心轉意，只希望對方會善待這頭十歲老貓，讓牠安度晚年。  這宗呷醋老貓連環傷人事件發生於前日中午，觀塘麗港城一對男女遭飼養10年老貓抓傷，事件疑因家中新添了一名兩個月大女嬰，令原本備受寵愛老貓失寵呷醋，老貓狂性大發傷人「被捕」囚禁7日。
20081227-6,20081227,6,悼念追車資喪命司機　同業呼籲：的士裝閉路電視防賊,"悼念追車資喪命司機　同業呼籲： 的士裝閉路電視防賊 【本報訊】一名的士司機日前因追捕未繳付車資乘客猝死案件，引起的士業界關注。港九新界的士司機總會建議，在的士倒後鏡安裝閉路電視監察器，保障司機安全之同時，發起由今日開始一連五日，在全港九個的士站設捐款箱，為猝死司機劉振鏗募捐，幫助其遺孀及子女度過困境。 記者：黃學潤 本月23日在黃大仙因追捕欠付車資的乘客，疑心臟病發猝死的58歲司機劉振鏗，為港九新界的士司機總會的會員。該會近20名會員，昨日在觀塘翠屏邨一所酒樓舉行記者會，會議前各會員起立默哀一分鐘悼念。 搭霸王車每日10宗 該會主席李志祥表示，劉加入該會已10多年，他猝死事件，反映的士司機屬高危行業，乘客搭的士欠車資逃跑屬司空見慣，平均每日有10多宗。有同業向會方反映，他們成功截獲「走數」乘客報警時，很多時警方只是勸喻乘客交回車資，卻不作刑事檢控，故希望警方日後對「走數」乘客嚴肅處理及作出刑事檢控。  的士劫案及乘客坐霸王車案件屢見不鮮，李志祥建議，在的士車內倒後鏡兩旁安裝兩個閉路電視鏡頭，一個攝錄車外情況，另一個攝錄車內，監察乘客搭車過程，以保障的士司機生命財產安全。他謂，安裝該閉路電視成本僅約2,000元，建議由司機及車主分擔。該會將去信立法會要求安裝。 發起募捐幫助孤寡 李表示，為了幫助猝死司機劉振鏗的遺孀及子女解決殮葬費及度過困境，該會由今日起至31日的一連五天，發起募捐行動，在全港9個的士站，包括港鐵九龍塘及紅磡車站、金鐘站、九龍機鐵站、中環機鐵站、機場大站、大埔及上水火車站，以及屯門八佰伴的士站，放置捐款箱讓市民捐款，捐款站24小時有人當值。  警方表示，今年首三季（截至本月15日為止），共有37人因不付的士車資離去被捕，當中有18人（截至10月）遭受檢控；去年被捕人數則有44人，當中有34人被檢控。警方對乘客不付的士車資離去案件一向嚴肅處理及依法辦事，並呼籲的士司機如遇到乘客不付車資離去，應即報警。 特稿 律師：攝錄乘客或侵私隱 對有的士團體建議在的士上裝設閉路電視，有法律界人士和其他的士商會均抱反對態度。法律界人士黃國桐稱：「我坐咗你架的士度，就好似承包咗呢段時間，無理由任你裝攝錄系統影我㗎。唔通我租咗間屋，業主話要響屋裏邊裝攝錄系統，有冇道理吖？」黃國桐指出，要裝的話必須通過立法程序才能進行，他個人認為涉及行蹤私隱問題，因為有攝錄系統即等同司機掌握到乘客的行蹤，名人固然不想被人知，普通人也不希望司機掌握到行蹤。  的士同業聯會主席梁紹昌稱，他認為在的士內裝設這類監控系統是不切實際，一來涉個人私隱，另方面車廂狹窄，騰不出空間裝錄影機，況且在行車時震動，攝錄效果成疑，最後是若的士乘客有心犯案，戴太陽眼鏡和口罩，拍到對方影像也難以追查。梁反而認為警方增加路障，和利用的士通訊器知會同行協助較為實際。  本報記者 你想知　想講　想問? 你認為怎樣做才能保障的士司機的安全？    請即上《蘋果》網頁 http://appledaily.atnext.com留言喇！   或電郵至：mailto:focusgroup@appledaily.com  傳真：37112411  手機短訊：63836568"
20081227-7,20081227,7,小巴狂撼九巴31人受傷乘客互指對方車輛衝燈肇禍,小巴狂撼九巴31人受傷 乘客互指對方車輛衝燈肇禍 【本報訊】葵涌昨晚發生大、小巴迎頭狂撼大車禍，至少造成31人受傷。一輛滿載16名乘客的小巴，在青山道與和宜合道的十字路口，與一輛正在轉彎的雙層九巴迎頭相撞，兩車車頭均嚴重損毀，兩司機同被困駕駛倉，兩車大批乘客在車廂內橫七豎八倒地，部份人更遭被撞毀的座椅壓着，頭破血流，在車上呻吟呼叫，情況混亂。消防員到場救援時，發覺小巴車底冒煙，恐隨時爆炸着火，立即救火救人同步展開，幸最終並無發生火警。　記者：李偉民、劉漢權、麥超億 意外後，兩車乘客互指對方車輛衝燈肇禍，警方正調查意外原因。31名傷者事後分乘多輛救護車，分別送往仁濟醫院、瑪嘉烈醫院及明愛醫院治理，兩巴司機均傷勢嚴重，其餘人等傷勢較輕。  兩輛肇事車輛，分別為行走佐敦至梨木樹的36號B九巴，以及行走荃灣至觀塘的紅頂市區小巴。昨晚10時許，巴士沿青山道向荃灣方向落斜行駛，至和宜合道交界的交通燈位時右轉；同一時間，一輛滿載乘客的小巴，則在對面線沿青山道上出九龍方向，至和宜合道十字路口時，兩車成90度角的迎頭相撞。 兩司機受重傷困車內 由於撞力相當猛烈，兩車車頭嚴重毀爛嵌在一起，兩名司機均受重傷無法動彈，被困駕駛倉內。另外兩巴車上的椅子不少均被撞至甩脫，幾乎全部乘客在車上倒下，互相擠壓，有人撞向玻璃窗，有人被椅子壓傷，多人頭破血流，手腳受傷。一時間，呼喊聲此起彼落，情況十分混亂。  警方、消防員及多輛救護車接報趕赴現場營救，部份傷勢較輕的傷者自行爬出車廂，在路邊接受包紮，傷勢較重的則由消防員抬出；消防員更要用工具將兩車車頭玻璃打碎，以及撬開軚盤，將兩名重傷的司機救出。同一時間，消防員發現小巴底部有黑煙冒出，擔心隨時有起火爆炸之虞，立即分派人員開喉射水，幸終無發生火警。  傷者中包括男女老幼，多輛救護車先後將31名傷者分送多間醫院治理。警方在場調查期間，有小巴乘客指當時車速很快，被問到是否有人衝燈時，有乘客憤怒大叫：「有人衝燈，係小巴！」但同時亦有人指是大巴衝燈。對於兩車均有乘客指對方車輛衝紅燈肇禍，警方仍在調查中。  九巴發言人稱，出事的巴士為富豪超級奧林比安型號，車齡六年半，本月20日曾作例行檢查。車長在97年入職，駕駛36B線的夜更，事發時為第三轉，至於今次肇因有待警方深入調查。  葵青區議員林紹輝指出，車禍現場的燈位經常有車輛衝燈，入夜時最為嚴重，希望運輸署加強監察系統杜絕司機衝燈行為。
