key,date,article_daily_id,title,text
20080328-112,20080328,112,新知熱聞：全國機場脫鞋安檢,新知熱聞：全國機場脫鞋安檢 受早前疆獨恐怖分子擬引爆南航客機等事件影響，國家民航總局現已要求全國各大機場，對乘搭飛機的所有旅客，在安檢的時候都要脫鞋檢查（圖），看看是否藏有刀具等攻擊性武器。而為避免延誤，當局要求乘客提前2小時抵達機場。圖為西安咸陽國際機場安檢人員，正仔細檢查女乘客的靴子。     http://news.163.com/08/0328/09/4845IR3600011229.html 
20080328-113,20080328,113,Net詞典：出「奧步」即耍茅招,Net詞典：出「奧步」即耍茅招 自去年底開始，台灣政壇流行一個詞「奧步」，政治人物指摘對手搞「奧步」，街頭巷尾的民眾也在議論着政治人物又要耍出甚麼「奧步」。甚麼是「奧步」？「奧步」的「奧」其實是源自《楚辭》中的「謷」。而「奧步」源生於「奧客」，所謂「奧客」，係指刁鑽耍賴的顧客。其實，「奧」是台語（或閩台話）向漢文借用的諧音字，音義為腐爛，如奧魚、奧材；又為扯爛污，如奧客、奧步。「奧步」用來形容不聽話而愛妄語的不肖之徒，一個惡劣的人被稱「奧客」，而耍邪惡手段或「茅招」的行為就叫「奧步」。
20080328-114,20080328,114,逾百內地學者呼籲中央反省西藏政策,逾百內地學者呼籲 中央反省西藏政策 包括作家、律師、學者、藝術家、工程師在內的內地逾百名中國知識分子，近日發表關於處理西藏局勢的十二點意見，包括敦促中國政府停止鎮壓，與達賴喇嘛對話等，有份聯署的西藏問題學者、作家王力雄接受本報記者電話採訪時指，昨日發生在大昭寺僧人對外訴寃事件，說明這次騷亂的矛盾仍未解決，不過是政府強力控制下暫時平息，但政府能否長久控制局勢值得置疑。過去幾十年，北京耗費巨大的人力財力建設西藏，但並沒有得到當地僧侶認同，足以提醒當局反省。 沙葉新：北京應與達賴對話 而有份聯署的另一位學者，著名劇作家沙葉新則認為，北京應該放棄成見與達賴喇嘛對話，以穩定西藏的動盪局勢，因為達賴還是主張非暴力解決西藏問題的，過幾年如果他去世了，主導流亡藏人社團的將是主張暴力的青年一代，「到那個時候，你想對話也找不到對象了，藏區可能會出現更大的流血事件，那才是最可怕的。」至於逾百名學者的十二點意見，還包括支持達賴的和平呼籲，希望遵循善意、和平與非暴力的原則妥善處理民族爭端等。  本報記者
20080328-115,20080328,115,憂臨近奧運爆騷亂廣州突禁群眾活動,憂臨近奧運爆騷亂 廣州突禁群眾活動 受西藏事件影響，為避免不法分子趁機製造騷亂等事件，廣州突然宣佈停止舉行各類群眾性活動，如大型演唱會、商場促銷和大型展覽活動等，直至奧運結束為止。本報獲悉，除廣州外，其他大城市亦將陸續仿效暫停審批群眾性活動批文的措施。  有從事廣告界的人士對本報稱，本周一分別接獲廣州市文化廳和公安部門的口頭通知，暫停一切涉及群眾活動的批文。市文化廳官員拒絕解釋原因，僅稱接獲上頭通知「限制群眾性活動……所有批文需暫時擱在一邊」。至於公安部門則明言，主要受西藏事件影響。 周華健演唱會被迫取消 據悉，周華健原定下月26日在廣州舉行的演唱會被迫取消。周的經理人楊永安在接受本報電話採訪時說：「呢次幫華健搞演唱會嘅主辦單位，經驗比較淺，批文係出咗，仲要有公安文件先可以公開賣票，但公安嘅部份仲未搞好，距離演出仲剩番一個月時間，我哋都擔心趕唔切。」公安批文審批不順利，是否受西藏事件影響？楊續說：「唔知，都有可能，不過如果真係有關，應該北京嘅多個台灣藝人演唱會會首當其衝……」而下月19日在廣州舉行的陳奕迅演唱會則會如期舉行。消息人士稱，當局的做法乃「斬腳趾，避沙蟲」，令業界損失慘重，並批評當局行政干預商業行為。  本報記者
20080328-116,20080328,116,會面泯恩仇　馬英九、李登輝復合,會面泯恩仇　馬英九、李登輝復合 相隔8年，台灣總統當選人馬英九，昨日終於和前總統李登輝見面；兩人一笑泯恩仇，被台灣傳媒形容為「馬李復合」。 言談甚歡多鼓勵 馬英九和副總統當選人蕭萬長於昨日下午4時30分，來到台北市外雙溪的翠山莊，拜會李登輝。李登輝和夫人曾文惠，特別親自出門迎接兩人，其間還不忘提醒馬，和門外的記者揮手致意。三人談了一個半小時。馬蕭離開時，李還親自送行。馬形容，會面言談甚歡，李對他語多鼓勵和肯定，並期許他將來執政一定要做到清廉的政府。至於李日前曾向日本報章指他不是個統派，馬坦言感覺非常有趣。而將來有機會，他還會再來向李請教。  馬李恩怨可追溯至1980年代。馬英九曾擔任李登輝的英文繙譯半年，獲對方賞識，但後來兩人多次因憲改及政見問題產生過節。直至1998年台北市長選舉，李出面力挺馬，兩人一度表面和好。但在2000年，國民黨因內部分裂，導致在總統大選中慘敗，喪失政權。李被指是罪魁禍首，被迫辭去國民黨主席職務，馬李關係自此冰封。而李也曾在總統陳水扁新上任時，和陳有過一段蜜月期，兩人被形容為情同父子，但隨後卻越鬧越僵，甚至到了公開決裂的地步。 就職前晤陳水扁 另外，馬英九前晚與幕僚開會後決定，他的就職典禮將以簡單隆重、避免鋪張為原則舉行，地點傾向台北小巨蛋，宴會場地以圓山飯店為首選。而他亦將在5月20日前會晤陳水扁。至於馬的新官邸，暫名為「興安官邸」，預計在8月裝修完畢。而馬的母親秦厚修則因本人意願，仍會住在原處，屆時將由特勤中心加強保護。  至於馬英九在520就職前訪美一事，日趨明朗，美國在台協會（AIT）理事主席薄瑞光，昨晚已由美國飛抵台灣，估計是與馬商談有關行程。  本報記者 貿發局：三通對港影響微 香港貿易發展局副首席經濟師邱麗萍說，兩岸三通後，或多或少會影響香港的中介角色，但香港是國際化程度很高的城市，台灣公司去大陸投資，仍會使用香港的金融服務，對香港中轉角色的影響並非太大。 兩岸轉口佔香港總貿易額3% 邱麗萍指出，台灣現時經香港空運去大陸的貨品以電子零件為主，但香港貿易商並非左手交右手那麼簡單，很多是有提供增值服務，通航後仍需要經香港。無可否認，直航後香港在航運上面對的競爭大了，但部份台商仍會選擇經香港，因香港與珠三角城市間的航線網絡發展得較快。她又指，現在兩岸貿易經香港轉口的該部份金額，只佔香港總貿易額3%，即使三通令轉口貿易減少，影響亦不會很大。她又認為，台灣將放寬企業去大陸投資，對香港金融服務的需求會增加，過去幾年就有很多台資企業來港上市籌集資金，而香港資金調配靈活，是大陸暫時未做到的。隨兩岸經貿交往增加，台灣企業更加需要使用香港律師、會計師等專業服務。香港有低稅率等營商優勢，只要維持優勢，相信可抵銷三通對香港中轉角色的部份負面影響。  本報記者
20080328-117,20080328,117,勸妻子放棄工作?馬英九：我沒膽,勸妻子放棄工作? 馬英九：我沒膽 「這次我沒有說服她放棄工作，我有幾個膽子啊！」新當選台灣總統的馬英九，在接受台灣《蘋果日報》專訪時，對於太太公開表示5月20日當選第一夫人後，仍將繼續工作時，頓時露出一臉怕老婆的模樣，臉上還不時泛出絲絲的笑容。 「她完全不介入我的公務，讓我沒有後顧之憂，我們偶而也會談政治問題，有一次我在外面講話不得體，她也會說：『你講的這個不太好』，最後我也出面解釋並道歉，她是以一般觀眾角度看事情，我覺得很好。」  馬英九稱，他之所以尊重太太，是因為兩人在國外多年都是互相負擔家務，「小孩子我也會照顧，在台灣生老二（馬元中）時要餵奶，我還一面準備甲等特考，一面餵奶。」他稱，有一次一位父執輩請他們兩夫妻吃飯，她本來不想去，因為兩人與保母約了下午兩點帶小孩，時間一到他們就說要離開去接小孩，但卻讓長輩們不太高興，認為接小孩有這麼重要嗎？此後，太太周美青就不太參加馬的宴會了，「我也完全支持，即使是國宴，她在我當部長時曾去過過一次，因為很無聊以後就沒參加了。」 「不希望她變成我的附庸」 馬英九稱舉出這個例子，「就是要說不希望我變成她的負擔，也不希望她變成我的附庸，這個很重要，因為她有自己的工作、生活圈、朋友，為何一定要跟着我跑？既無趣也沒有必要嘛，我也覺得這樣很好。」  但馬英九強調，「至於未來國宴的場合，她當然要來，吃飯的時間總是有的，但國宴一年大概幾十次也沒有很多，其實我當台北市長有時吃飯，很多人都也會帶太太來，但從來也沒人問我，因為大家知道我太太沒興趣，況且不去也沒甚麼事，反正就是應酬嘛！」馬坦誠，多年來太太既要工作，又要照顧孩子，除了朋友的家庭聚會外，兩夫妻很少一起出門。  台灣《蘋果日報》 夫婦互相評價 -馬英九-  ‧「我太太真的做好了一個政治人物妻子的本份。」  ‧「我在電台上點《箏》這首歌給太太，是想她了解，我相當懷念當時一家人可以常常在一起出遊，然後在山上聽着這首歌的那種感覺。」  ‧「她不會去沾染不必要的是非，也不會過問我的公務，是對我選戰最大的幫助。」    -周美青-  ‧「馬英九很不體貼，但認真、善良、正直。」  ‧「我永遠是他最忠誠的反對黨。」  ‧「馬英九從來都不是偶像，他也永遠不會是我的偶像。」  ‧「缺點喔，他實在是一個先生有的缺點，他通通有。」
20080328-118,20080328,118,馬認大女兒擁美國籍,馬認大女兒擁美國籍 馬英九昨日坦承，大女兒馬唯中擁有美國國籍，因為她是在美國出生，但強調女兒同時擁有中華民國護照，「她還是中華民國人，除不能選舉外，其他事情都可以做」；小女兒馬元中是在台灣出生，「根本就沒有綠卡，從來就沒有申請，也沒得到過。」  馬英九的兩個女兒分別是28歲的馬唯中和23歲的馬元中。馬唯中畢業於美國哈佛大學，目前在美國從事展覽籌備等工作。身高1.72米的她皮膚白淨，氣質優雅，待人接物得體，即便是回台投票被媒體追訪，也是落落大方。有媒體形容她很像南韓明星李英愛，也有指她像台灣明星劉若英。 哈佛畢業　似李英愛 二女兒馬元中目前就讀於美國布朗大學，與家姐一樣長相清秀，只是沒有家姐在公開場合那麼大方。馬任台北市長時，一次給表現優異的初中畢業生頒發市長獎，碰巧女兒馬元中也獲此殊榮，馬給女兒頒獎後，問「親一下好不好」，馬元中害羞地連說「不好！不好！」快步下台。  馬元中英文不遜家姐，她的博客文章多為英文。她曾在博客中形容自己「屬於朋友有難、赴湯蹈火在所不辭的熱血少女」；又寫道：「最愛吃媽媽煮的咖哩牛肉麵、蓮子銀耳湯、綠豆湯」；還寫過「自己想當個很中國的中國人」。  台灣《蘋果日報》 馬唯中 年齡：28歲  學歷：哈佛大學生命科學系畢業，紐約大學博物館系碩士  職業：在美任爆破藝術專家蔡國強工作室的項目助理  特點：身高1.72米、外貌極像馬英九、性格沉靜  經典時刻：  ‧父親任法務部長時因厲行查賄下台，曾以「若是在古代，可能要被殺頭的」安慰爸爸  ‧因在美國出生擁有綠卡，被綠營窮追猛打 馬元中 年齡：約23歲  學歷：美國布朗大學藝術系  特點：活潑開朗、幽默  嗜好：烹飪、電影、音樂，常看漫畫也節食，曾想當模特兒  經典時刻：  ‧曾說「爸爸的臉太油」，拒絕爸爸當眾親吻她  ‧記者問她對很多女性視爸爸為偶像的看法，反問「爸爸比我胖這麼多，怎麼會是偶像呢？」    資料來源：《蘋果》資料室
20080328-119,20080328,119,新疆煙花爆炸25人死當局排除涉人為破壞,新疆煙花爆炸25人死 當局排除涉人為破壞 新疆吐魯番市，發生嚴重煙花爆炸事故。當局準備在沙漠地區銷毀一批廢舊煙花爆竹時，突然爆炸，造成至少25人死亡、4人失蹤、9人受傷。消息指，死者中，除爆破公司人員及公安外，還包括兩名記者。當地公安接報後大為緊張，派人到場調查後，初步認定今次爆炸屬安全事故，並排除人為破壞的可能。 爆炸發生在距離吐魯番市約7公里的七泉湖鎮戈壁灘地區。前晚7時許，當局把廢舊904箱已存放逾10年的煙花爆竹，運到當地準備集中銷毀。工人正朝一個大坑卸下該批煙花爆竹時，突然發生爆炸。  消息人士透露，爆炸令在場運送該批煙花爆竹的9輛車嚴重損毀。而參與銷毀工作的22人則當場死亡，另有3人在送往醫院時不治。至於9名傷者中，目前除2人重傷，仍在搶救外，其餘均已脫離生命危險。 9車嚴重損毀 當局事後指，死者主要是吐魯番市公安局、吐魯番市恰特喀勒鄉爆竹廠及當地爆破公司人員，以及兩名到場採訪的電台記者及電視台攝影記者。現時尚有4人失蹤，搜救人員在現場發現一些殘肢，已交由公安部門進行DNA技術鑑定，以盡快確認死者身份。 尚有4人失蹤 吐魯番公安局辦公室一名女警官稱，經過公安對事故現場的勘察，已認定今次爆炸屬安全事故，並經排除涉及人為破壞的可能。新疆公安廳、安監局有關人員已組成事故處理小組，趕赴吐魯番市進行調查。  自新疆本月初發生懷疑疆獨分子，企圖在一架飛往北京的客機上製造空難事故後，當地氣氛一直緊張。烏魯木齊市日前更傳出四輛巴士在市內發生炸彈連環爆炸的謠言，新疆公安廳隨後高調公開闢謠，並指已把造謠者拘捕。  新華社/中新社
20080328-120,20080328,120,番禺海洋公園2010開業,"番禺海洋公園2010開業 被列為廣州亞運會配套項目的番禺海洋公園已開始規劃和招商，並初定兩年後建成。該公園投資50億元，佔地3000多畝，面積較香港海洋公園大三倍。番禺區長更宣稱，公園落成後「肯定超過香港海洋公園！」香港海洋公園昨日在接受本報查詢時稱，不介意珠三角地區有更多主題公園建設，以供民眾有更多選擇，並稱香港海洋公園將繼續以己之長，服務和吸引遊客。 廣州番禺區區長駱蔚峰近日在暢談該區旅遊規劃時透露，為配合2010年11月在廣州舉行的第十六屆亞洲運動會，番禺將大手筆投資旅遊項目。其中包括將投資50億元，建設世界級的海洋公園。 區長：肯定超過香港 該公園從番禺蓮花山東部綿延至伶仃洋，全部規劃成海洋生態旅遊區，建成主題海洋公園。駱蔚峰更宣稱，公園落成後「肯定超過香港海洋公園！」  駱蔚峰同時透露，廣州番禺長隆野生動物世界也在擴大，同時擴建的還有嶺南四大名園寶墨園。另外，珠江口最後一塊未被開發的綠色島嶼海鷗島，也將被打造成一個生態休閒旅遊景區。番禺一些別具嶺南風味的古鎮，如沙灣文化古村落和石樓鎮大嶺村等，都將包裝後與遊客見面。他透露，去年番禺的景點接待遊客1,100萬人次。 邀港設計師參與規劃 番禺發改局昨證實，當局已開始對番禺海洋公園的規劃和招商，並有意邀請本港園林景觀設計師參與規劃設計，「用你們所長，才能超過你們。」而番禺區發改局副局長陳裕偉日前稱，番禺海洋公園料2010年開業。  目前，珠三角主題公園的密集度為中國之最。業內人士擔心，密集的主題公園會否如機場那樣，導致惡性競爭，但番禺區官員陳裕偉認為，大家如把握好錯位經營，仍然存在共存空間，「香港定位高端國際市場，珠三角的主題樂園，則可以定位於本土中低端遊客，大家可以互惠共贏。」  廣州南方網/本報記者 珠三角主題公園比拼"
20080328-121,20080328,121,浙江貨輪撞毀大橋,浙江貨輪撞毀大橋 昨日凌晨１時15分，一艘內地空載貨輪航行穿過正在建設的寧波金塘大橋時，貨輪的桅杆與橋面相撞，導致橋面崩塌，斷成兩截，跌落並橫壓於貨輪的駕駛艙上。 4人生死不明 船上當時有20人，其中16人獲救，4人被困在駕駛艙內，生死不明。發稿時止，當局仍在搶救中。當時橋面並無人員通行，橋上無人落水。  國家交通部已成立調查組，趕赴現場調查。金塘大橋是繼杭州灣跨海大橋和東海大橋之後，中國在建的第三長跨海大橋，全長21公里，於2006年4月動工，預計明年通車。  中新網
20080328-122,20080328,122,不滿夫拒回娘家　婦吊幼子門上燒,不滿夫拒回娘家　婦吊幼子門上燒 山東濰坊一名婦人因為不滿丈夫以照顧患上感冒的7個月大兒子為理由，沒有陪伴她返回娘家，給她的父親慶祝生日，竟然把兒子吊在門框上用火燒。丈夫返回時雖然及時把兒子救下送院，但是因為兒子曾一度缺氧而停止呼吸，兼雙腿被燒傷，可能留下嚴重後遺症，永遠站不起來。  事發於上月22日，家住濰坊安丘市大汶河旅遊開發區的賈先生，因為7個月大的兒子患上感冒，沒有去給岳父慶祝生日，只得其妻獨自一人回娘家。 責丈夫給她丟臉 當日下午，賈妻回來後很不高興，說丈夫給她丟臉。賈當時並沒有在意，做好飯後就離家辦點事，約1小時後回來，發現屋內起火，兒子被紅帶子勒頸吊在門框上，臉色青紫。  賈趕緊救下兒子，隨即送他到醫院搶救。醫護人員指，孩子雖保住性命，但留下了嚴重的後遺症，治療需要3年至半年時間，還有可能永遠站不起來。據悉，事件傳開後，很多好心人紛紛解囊，捐錢給賈支付兒子住院每天的數百元醫藥費。  至於賈妻被捕後獲准保釋，等候審訊。有網民認為，她所涉的控罪，應是「殺人未遂」，實不該准予保釋：「簡直是太可怕了，虎毒尚不食子啊，何況是自己親生骨肉！」  《青島早報》
20080328-123,20080328,123,賭波集團滲透東莞校園,"賭波集團滲透東莞校園 東莞市數十所中學，最近被外圍賭波集團滲透，在校內尋找學生做莊家開賭盤，專賭美國職業籃球賽(NBA)賽果，情況越來越嚴重。不少學生賭波成癮，有人更因借高利貸賭波輸掉一萬元不敢上學，還要到處避債。 「我每天只記得投注」 就讀虎門中學高二班級的小峰(化名)，更是其中一位賭波成癮的學生。「從上學期開始，我幾乎每天都只記得NBA賽程，每天都只記得投注、看盤。腦子裏根本裝不下別的，只知道賭波。」小峰說，他上周輸波欠下3,000元賭債，被莊家恐嚇，最後惟有要求母親代為還債。小峰坦言，校內有些班級，幾乎全班男生都玩過賭波。上學期校方就處分了26個賭波學生，其中2人涉嫌做莊被勒令退學。 每球季投注額逾750萬 在莞城區一所中學就讀的小陳，自稱是莊家，專在同學中間煽動賭波之風，之後再把收回來的同學賭資，分批轉到外圍賭波集團手中。他指，東莞幾乎每所學校都有莊家，下面會再招幾個同學做「艇仔」負責受注，或者發手機短訊催數。小陳還稱，外圍賭波集團有專人放高利貸及追收爛賬，不少學生輸波，都會向家人索要金錢還債，他們大都不敢報警，怕被尋仇。  有中學教師坦言，現時已無法遏止這股賭波歪風，校方只能被動地，時刻保持警覺，一旦查出學生交易賭資、催債短訊等證據，便採取行動。當局保守估計每個球季同學投注金額逾750萬元。  廣東《南方都市報》/《南方日報》"
20080328-124,20080328,124,陳良宇拒認罪或囚18年,陳良宇拒認罪或囚18年 因上海社保基金案落馬的上海前市委書記陳良宇，昨日在天津第二中級人民法院接受秘密審訊，罪名涉及受賄與濫用職權及玩忽職守三項，其受賄金額約240萬元。據悉，陳良宇精神狀態良好，他承認自己有責任，但未明確表示自己有罪。陳的刑期將較北京前市委書記陳希同為重，但不會判死，刑期很可能在17或18年。據悉，之前中紀委公佈陳良宇「生活腐化，並導致兩女為其墮胎」，沒被列入控罪，而當局指控他受賄，主要來自上海社保基金挪用人張榮坤；張通過陳的幫助，獲得30億元社保基金貸款用於私企發展。  本報記者
20080328-125,20080328,125,17國外交員獲准訪拉薩,17國外交員獲准訪拉薩 繼邀請19家中外媒體到西藏拉薩採訪後，中國昨日安排包括美、英、德等17個國家的駐華外交人員到拉薩考察兩天。 美盼派員往川甘示威區 美國國務院指中國有關做法，向正確方向踏出一步，但仍不足夠，希望北京能容許美國外交人員，到四川、甘肅等其他曾爆發藏民示威的地區自由視察。  據法新社報道，這次獲邀到拉薩考察的外交人員，安排得十分倉促，前日才知會各國駐華大使館，並規定他們只能各自派出一名外交人員隨團。而獲邀的國家，還包括法、日、澳、俄、加拿大、意大利及西班牙等。另外，歐盟各國外長昨晚齊集斯洛文尼亞首都盧布爾雅那，討論有關是否杯葛北京奧運開幕禮的提案。德國外長施泰因邁爾（Frank-walterSteinmeier）明言，他與德國總理默克爾（AngelaMerkel）將不會出席北京奧運開幕禮，但就表示決定無關西藏問題。  法新社/路透社
20080328-126,20080328,126,兩岸快線大巴撞車墜河11死20傷,兩岸快線 大巴撞車墜河11死20傷 湖南省西北的桑植縣昨日上午發生特大車禍，一輛大客車在行經該縣兩河口鄉潭口村時，與一輛麵包車相撞後墜河。事故已造成11人死亡，2人下落不明。該車是從深圳龍崗開往重慶的45座大客車，初步了解車上並無境外人士。另外搶救上來的20名傷者均已送往醫院。當局正調查事件。  新華社
20080328-127,20080328,127,央視新大樓花名「大褲衩」,央視新大樓 花名「大褲衩」 為迎接奧運，北京新建築林立，市民紛紛為其起綽號，憑大家的眼力，一定不難猜到鳥巢、水立方指的是甚麼；但你能說得出，那座建築物叫「大褲衩」（俗稱：大褲襠）嗎？「雞蛋」、「鳥蛋」又是指那個建築物呢？ 市民譏似塌樓 作為北京奧運主場館的國家體育場，憑其獨特造型躋身世界知名的建築藝術，「鳥巢」名字亦因此不脛而走。國家游泳中心則綽號水立方，外牆上鼓起的一片片半透明狀的「藍色泡泡」，讓人有種想觸摸的感覺，因此也有人叫它「水泡泡」。北京市工程部官員徐波說過很喜歡這兩個綽號，覺得非常生動。  至於剛封頂的中央電視台新總部大樓，一開始已被市民批評似塌樓，經過都心驚驚。正因為它半空中連接的兩座塔樓，外形極似一條褲，被人起名「大褲衩」。有網友就揶揄：「不求最好，只求最怪！」「總覺得不太符合中國電視台風格！」但大樓卻享負盛名，早前被美國《時代》周刊評為2007年世界十大建築奇迹之一，與「鳥巢」一齊入圍。42歲的北京的士司機陳先生說，「鳥巢」很有藝術感，但「大褲衩」看起來有些危險。 大劇院似油罐 至於去年底開放、在天安門廣場西側的國家大劇院，因為它半橢圓形鋼體結構，置身人工湖中，恍如一隻蛋。它的外號亦與蛋分不開，有「巨蛋」、「鳥蛋」和「雞蛋」之稱。但大劇院副院長鄧一江就直言不喜歡這個外號。有網民就說：「你不告訴我，我還以為是個大油罐或者大倉庫。」   http://bj.news.163.com/08/0327/10/481KT1PJ003800C8.html 
