key,date,article_daily_id,title,text
20080221-302,20080221,302,中移動覓夥伴拓歐業務,中移動覓夥伴拓歐業務 【本報訊】中移動（941）加快海外拓展步伐，英國《金融時報》報道，中移動正考慮在歐洲擴張業務，集團歐洲、中東及非洲地區總部昨日於倫敦正式開張，為海外華人服務。中移動英國代辦處首席代表HenryGe表示，會專注於3個領域的發展，包括新興市場、希望與中國保持聯繫的海外華人，及短期出外公幹或旅行的國內同胞。 無意收購英公司攞牌 他表示，非洲及中東新興市場將是今年的首要目標，另公司亦正考慮在歐洲建立一個虛擬的流動電話網絡。HenryGe解釋，若中移動以自然增長方式發展可能進展緩慢，需時長達5年，故希望與擁有強大網絡的夥伴合作，毋須收購一家英國公司以獲得英國業務牌照。  正當海外電信機構均有意加強新興市場的投資，中國卻積極鼓勵本地公司走出去。  目前中移動在海外收購由母公司進行，去年母公司便以2.84億美元，收購巴基斯坦流動電訊商Paktel的88.86%股權，並向其注資7億美元。去年底，網通（906）亦於倫敦設立其歐洲業務總部。
20080221-303,20080221,303,財話短說浪潮增持山東浪潮至100%,財話短說 浪潮增持山東浪潮至100% ▲浪潮國際（8141）公佈，斥資3600萬元（人民幣‧下同），向母公司購入山東浪潮商用系統60%股權至全資擁有，相關財務業績將被納入浪潮國際的賬目內綜合處理。山東浪潮主要業務為開發、生產及銷售電腦軟件及電腦周邊商品，特別是電腦化收款機及銷售點終端機；截至07年底止，其未經審核的全年純利達625.4萬元，資產淨值4269.9萬元。
20080221-304,20080221,304,中交利比亞簽約121億,中交利比亞簽約121億 【本報訊】內地媒體中國證券網報道，中交建（1800）與利比亞房屋及基礎設施建設部，簽署約值121.37億元合同。中交建表示，該批項目是集團進軍利比亞的首批合約，對集團於北非地區發展具重要意義。 中鐵附屬純利增260% 今次中交建所簽署的工程，包括米蘇臘塔市9000套民用住宅設計與施工，及米蘇臘塔市和本沃利市的城市道路、排水、電力與通訊改造。報道指工程將在利比亞有關當局審批後正式進行。  另外，中鐵（390）宣佈，集團持有51%權益的A股公司中鐵二局，經初步測算，07年度全年純利約3.6億（人民幣．下同），升260%；預期全面攤薄每股收益約39.47分。中鐵指出，盈利急升是因收購後資產及盈利基礎發生重大變化所致。  新華網報道，上海至南京的軌道交通可行性研究報告已獲發改委正式批准，滬寧城際鐵路項目即將展開。  報道指鐵路全長300公里，為客運專線，設計時速為200公里，投資總額逾394.5億元。估計中交建、中鐵及即將上市的中鐵建，均會入標競投。
20080221-305,20080221,305,財話短說金滙去年度少賺50%,財話短說 金滙去年度少賺50% ▲金滙投資（378）公佈，截至去年12月底止全年純利2704.6萬元，倒退49.9%。每股盈利6.75仙，不派末期息。
20080221-306,20080221,306,青啤去年純利料6.3億,青啤去年純利料6.3億 【本報訊】有內地企業管理顧問公司估計，青島啤酒（168）去年度業績，將因勞工與原材料成本上升，及未能將上漲成本轉嫁，可能損失1億元（人民幣．下同）利潤。據ThomsonOne綜合14家證券行數據，預測青啤07年度純利將達6.34億元。 成本升損失一億 內地傳媒昨引述北京知行合一企業管理顧問公司負責人郭弘波表示，青啤07、08年純利勢將受成本上升影響。他說在新勞動法實施後，青啤員工成本升7至8%，但作為國企，工資上漲幅度不可低於物價漲幅，因此預料青啤08年度的工資將有雙位數字漲幅。  報道亦指，07年內地進口大麥最低價格是每噸170至200美元；今年澳洲進口大麥每噸345美元，最高更達516美元，內地大麥漲幅亦達90%，而包裝成本升2至3%。  報道引述青啤總裁金志國表示，今年企業最大的風險來自物價波動。
20080221-307,20080221,307,板塊移動：國家扶持12大技術項目　設備股吃香,板塊移動：國家扶持12大技術項目　設備股吃香 中央為改良各大主要行業結構，日前發佈最新文件，擬推動八項重大技術裝備研製，及促進四項重大行業關鍵技術開發。由於政策為裝備製造業帶來龐大商機，相關設備股可望獲強力支持，至於新能源行業更明顯成為國家重點扶持對象。　記者：杜思敏 國家發改委日前發佈《「十一五」重大技術裝備研製和重大產業技術開發專項規劃》，提出中國會研製八項重大技術裝備，包括大型的水電機組，核電設備、石油天然氣管道，以及新型船舶和海洋石油工程設備等。 研進口稅優惠細則 根據《規劃》，中央為了推動重大裝備工程，將研究進口稅優惠政策的實施和細則，並制訂採購和工程管理辦法，以及鼓勵企業建立技術中心、培育具自主創新能力和核心競爭能力的大企業。  中央又力挺節能及新能源、環境保護、提高資源開發效率和石油化工提煉的技術開發，從這四個重點範疇反映節能環保行業將擁有極大發展空間。在環保技術方面，不但節能、風能、大型海上風電、地源能、太陽能技術會獲得支持，工業廢水處理、城市垃圾處理等技術亦將獲大力推動。  中國積極擴大水電和核電規模、提高煤炭採掘效率和加強海上採油發展，以及改善節能環保等技術，主要目的是為未來能源開發創造更佳條件。 擴水電核電谷環保 獲得國家大力扶持，能源開發企業都可從中受惠，因此市場預期，能源設備股將成為新一輪市場焦點。分析師指出，最新規劃提出會提高裝備工業的自動化程度，標誌着裝備製造業將向自動化發展。  本港上市能源設備股當中，從事水電和核電主機設備的哈爾濱動力（1133）昨逆市漲1.67%，收21.3元；石油鑽採機械商山東墨龍（568）微升0.76%；其他多隻設備股受昨大市下跌拖累仍靠穩，海油服務（2883）和中國傳動（658）僅微跌不足1%。  雷曼上月底已表示看好中國傳動，目標價為19.9元，較昨日收市價15.32仍有30%上升空間；花旗則調高海油服務投資評級至「買入」，目標價16.9元，較昨日收市價15.32元仍有10%升值潛力。 中央重點開展技術項目 --八項技術裝備--	  ‧大容量高水頭水電機組  ‧百萬千瓦核電關鍵設備  ‧大型石油天然氣長輸管線成套裝備  ‧大型煤礦綜合採掘及洗選成套裝備  ‧百萬噸級大型乙烯成套設備  ‧大型煤化工成套設備  ‧大型寬帶薄板及寬厚鋼板生產關鍵裝備  ‧新型船舶和海洋石油工程設備    --四項技術範疇--  ‧節能及新能源  ‧環境保護  ‧資源高效開發及綜合利用  ‧石油煉製與現代化工 設備股表現一覽 埃謨國際（8149）  昨收報：$3.58　變幅：+1.99%    哈爾濱動力（1133）  昨收報：$21.30　變幅：+1.67%    山東墨龍（568）  昨收報：$1.33　變幅：+0.76%    中國傳動（658）  昨收報：$15.32　變幅：-0.26%    海油服務（2883）  昨收報：$15.76　變幅：-0.51%    上海集優（2345）  昨收報：$2.63　變幅：-0.75%    上海電氣（2727）  昨收報：$6.25　變幅：-1.11%    航科通信（1185）  昨收報：$0.77　變幅：-2.53%    東方電氣（1072）  昨收報：$50.60　變幅：-2.69%
20080221-308,20080221,308,財話短說招商局售兩隧權益予港通,財話短說 招商局售兩隧權益予港通 ▲招商局國際（144）進一步出售非核心業務，集中經營碼頭生意，昨公佈以4.6億元，把經營西隧及紅隧的聯營公司HighFortune（HF）之13%股權，售予港通控股（032）。完成後，港通在HF的持股量由37%升至50%。HF於06及07年度未經審核虧損分別約1450萬及1700萬元。
20080221-309,20080221,309,焦點行業退稅挺研發利農業設備,焦點行業 退稅挺研發利農業設備 除了重點行業的多項大型設備受國家扶持，農業設備亦是國家主力推動的行業，根據財政部近期出台專項進口稅收政策規定，為鼓勵製造新型大馬力農業裝備，相關進口稅今年開始實行先徵後退，所退款項將用於企業新產品研發及自主創新能力建設。新政策目的在於貫徹落實國務院《關於加快振興裝備製造業的若干意見》的政策精神，振興內地農業裝備製造業，加快農業機械化過程，改進農業生產方式，及實行農業現代化。  當局鼓勵製造大馬力農業裝備，包括輪式拖拉機、馬鈴薯聯合收穫機、自走式青貯飼料收穫機、馬鈴薯種植機、大型小麥免耕播種機和採棉機等。農業機械製造及銷售商第一拖拉機（038）昨微跌0.6%，收4.88元。
20080221-310,20080221,310,財話短說中國東方附屬半億增持,財話短說 中國東方附屬半億增持 ▲中國東方（581）宣佈，旗下附屬公司以5452.99萬元（人民幣．下同），增持佛山津西金蘭冷軋板公司股權至80.67%；津西金蘭的業務是購入帶鋼再加工，裝成冷軋鋼板或鍍鋅鋼板。收購完成後，津西金蘭會將註冊資本由2.15億元，增至3.97億元。中國東方指是次收購及隨後的增資建議，可令津西金蘭獲得充裕資金發展業務、增加產能和加強公司在津西金蘭管理控制。
20080221-311,20080221,311,證券行對個別港股最新目標價,證券行對個別港股最新目標價
20080221-312,20080221,312,財話短說傳人保決定整體上市,財話短說 傳人保決定整體上市 ▲據《中國證券報》引述消息人士指，中國財險（2328）母公司中國人保集團（圖）已決定，仿效太平洋保險模式整體上市，並會保持財險的H股獨立上市地位；至於人保集團上市時間表，將在中國再保險之後。
20080221-313,20080221,313,財話短說中傳動股東押股5.62%,財話短說 中傳動股東押股5.62% ▲中國傳動（658）公佈，接獲主要股東Luckever通知，已將所持的1.58億股中國傳動（佔12.66%），其中的7000萬股（5.62%）抵押予交通銀行（3328），作為3億元循環貸款提供保證。Luckever是大股東的一致行動人士。
20080221-314,20080221,314,金股逆市升等紫金返家鄉,金股逆市升等紫金返家鄉 港股噚日跌咗超過500點，但金礦股喺金價上升支持下逆市造好，之前入咗紫金礦業（2899）坐艇嘅北角阿Ben打嚟問好唔好趁反彈走貨。    沈：沈振盈　玲：楊慧玲  Ben：想問吓隻紫金，我自己都坐咗艇，之前睇好佢係資源股，10.2蚊入咗，但係𠵱家巿況唔好，趁佢反彈，喺入貨價平手走？定係跟沈大師今日喺蘋果專欄咁講12蚊走？  沈：紫金係隻比較複雜嘅股，巿況同金價都會影響到佢，有時佢跟巿走，有時又跟金價走。不過我發現佢1月開始唔太跟金價走，金價升時股價冇乜點郁，但到2月佢又跟番金價走，就算個市調整，股價都冇乜點跌。3月係黃金季結，好多基金都揸咗好多金，對冲通脹同經濟衰退嘅風險，金價有機會喺第一季再爆頂，所以你會見紫金一跌到10蚊好快就反彈。你可以再揸一陣，未來整體金價都係升，加埋估計股巿到3月都唔會大插，你可以揸貨等佢再升少少，會唔會見12蚊就要睇吓夠唔夠力，不過到11.5蚊你都有一成賺，可以考慮走咗先。  Ben：會唔會賺少咗呀？  沈：個市咁波動，真係唔好介意話賺得少咗，就算真係賺少咗，將來總有機會再買到平貨。  玲：其實我自己噚日都有買紫金，不過今日走咗啦，大師你覺得我可唔可以入番再走多轉？  沈：其實紫金抗跌力比較強，你可以趁金價升再博多轉，博佢升到11.5蚊賺返10%。 建設銀行（939） 五蚊邊入炒波幅 關公：今日推介隻建設銀行（939），六行中我最睇好呢隻，但係唔建議𠵱家買，佢短期都唔會升穿6蚊，𠵱家買冇咩水位賺。等個價跌到5.3至5.4蚊就可以入嚟短炒，就算股價再跌，長揸都唔怕。  沈：如果佢跌穿5蚊一定要先走貨，寧願等股價再低啲先再入過，如果係即日鮮，可以喺5蚊至6蚊之間炒吓波幅。其實六行之中，反而好多投資者都鍾意招商銀行（3968）。  玲：係呀，招行最近發咗盈喜，話盈利會升一倍！  關：但係佢都有危機，就算個巿連升4、5日佢都升唔起，點都升唔穿30蚊。  沈：建行都一樣，點升都升唔到6蚊，只係大家水位唔同。揀建行嚟短炒，5.2至5.3蚊入，到6蚊就走，喺2月仲可以咁做，3月就唔知喇。    --大埔關公建議--  建議買入價：5.4元　目標價：6.2元  止蝕價：5元　時期：- 中石油（857） 短炒一轉 陳小姐：我想買中石油（857），𠵱家仲未買，應該幾錢買？  沈：中石油近排走勢每逢喺11蚊都有反彈，之前油價升嗰陣對股價都冇太大刺激，反而一路向下走，股價由20蚊跌到10蚊先企穩。呢隻股曾經跌穿10蚊，短期有反彈條件，可以喺11.5蚊樓下入，始終佢嘅巿盈率唔高，預期會成為亞洲最賺錢嘅公司，都係對佢有利。  玲：巿況波動，𠵱家未係最好嘅入巿時機，你可以等個巿定啲，大約11蚊先買。佢未來一兩個月會投資過千萬喺西氣東輸項目，可以等埋佢3月出業績，舊年油價咁高，中石油今年盈利一定創新高，點都可以冲喜吓！  沈：佢問題在於有太多衍生工具，所以股價一反彈到某啲位就有阻力，但係短線都可以炒吓，可以喺11.5蚊買，12至13蚊走，定10蚊止蝕。 中國銀行（3988） 次按影響細 楊小姐：我想睇吓中國銀行（3988），佢噚日話次按撥備對業績影響唔大，其實買唔買得過？  沈：話次按對佢影響唔大，搞到人人對佢都有憧憬！但唔同報紙對𠵱番說話有唔同演繹，佢噚日係話所有CDO（債務抵押債券）已經全數沽售，唔會大幅影響2007年嘅盈利。但事實上CDO只係佔2億至6億美元，反而最重要嘅係ABS（資產抵押證券），估計中行投資超過500億港元喺ABS度。佢2007年盈利可能仲有增長，但係2008年有機會因為次按撥備而倒退。  楊：咁3.1蚊買唔買得過？  沈：長線就唔好啦，短炒就無妨，可以定3蚊止蝕，到3.3蚊至3.4蚊就走，都只係用1毫博2、3毫。如果業績跌，有機會跌穿招股價，一穿就好危險。    --將軍澳楊小姐建議--  建議買入價：3.1元　目標價：3.5元  止蝕價：-　時期：一個月
20080221-315,20080221,315,今日到期渣打棄救WJ嘉銀恐見紅,今日到期 渣打棄救WJ嘉銀恐見紅 信貸市場環境持續惡化，擔任結構投資工具公司（SIV）Whistlejacket（下稱WJ）票據保薦人兼牽頭經理的渣打集團（2888），昨表示決定撤回早前向WJ接管人德勤會計師行提出的有條件解決方案。市場預料，WJ在缺乏注資拯救下，今日到期償付的票據將面臨違約而最終倒閉。渣打指已為WJ資產作出的1.16億美元減值準備已足夠，WJ餘下投資值達71.5億美元票據，集團並無持有。  持有WJ票據投資總值達4000萬美元的中信國金（183）旗下中信嘉華銀行，或會因WJ違約而要再進行約五成減值準備。貝爾斯登亞洲研究部常務副董事陳昔典表示，有關撥備應劃入去年抑或今年損益賬內，將對07年中信嘉銀賺蝕有重要影響。 嘉銀或再減值五成 截至去年11月，中信嘉銀持有WJ票據資產淨值僅為原來投資的57%，跌價部份已作出約17.2億美元撥備。金管局總裁任志剛去年底指出，本港有銀行受次按影響而業績可能見紅。  中信嘉銀發言人說，該銀行對於截至去年12月底的截數日期內，按SIV資產淨值為基礎進行的減值準備安排，感到合適及滿意；對於有關WJ最新發展，及嘉銀會否額外增加撥備，則不作評論，該銀行會與核數師及有關方面繼續研究。  理論上WJ倒閉事件在07年截數日後發生，按正常會計準則考慮，額外撥備應在08年度賬目才反映，但面對即將違約的WJ票據，撥備會否在去年度業績反映，尚待研究。  對於渣打撤回拯救WJ方案，道瓊斯通訊社引述WJ接管人說，仍會尋求各種重組SIV方案，現階段未必需要清倉式割價出售剩餘資產。渣打已併入資產負債表的WJ資產約34億美元，其資產淨值約為原來投資額逾九成水平。
20080221-316,20080221,316,港交所穿$154　政府坐艇,港交所穿$154　政府坐艇 【本報訊】近期本地正股和窩輪交投量均持續萎縮，早呈疲態的港交所（388）股價持續積弱，昨開市不久即逆市插水，跌破港府去年9月增持的每股平均價154.44元，收報153.2元，狂瀉4.3元，令港府正式「坐艇」，其增持部份賬面蝕1949.22萬元。 去年增持　賬面蝕1949萬 昨日港交所成交34億元，居活躍榜首位，其中沽空金額佔31.5%，即10.8億元，意味每十手成交，即有三手是投資者沽空睇淡，預期股價仍有得跌。對於跌破入市價會否再增持溝淡，財經事務及庫務局局長陳家強昨晚出席一酒會時回應稱，當初入股港交所屬長線投資，但會否再增持，及現價是否良好入市水平，則不作評論。  事實上，港府於今年1月22日也險成「蟹民」，當日港交所低見155.6元，收報156.3元，賬面計仍微賺2923.83萬元。港府在去年9月7日一天內，斥資24.277億元，增持港交所1571.95萬股，持股量由4.41%增至5.88%，在股價單日最高峯時268.6元（去年11月5日）賬面勁賺17.95億元。不過，去年11月初國務院總理溫家寶叫停「港股直通車」後，港股成交量即有下滑趨勢，加上今年首季新股幾近夭折，導致昔日「猛如虎」的港交所股價不斷尋底。 交投大減　成致命傷 港交所頹勢未止，成交萎縮可謂是致命傷。今年至今，港股日均成交僅1068億元，單計本月至今，每日平均交投更只有860億元。證券界年初起已對港交所重新計數，瑞銀、星展及瑞信上月率先調低目標價，上周花旗更狂削至151元的坊間最低價。有分析員不諱言，會待港交所下月5日放榜後，一併調低其評級及目標價。  凱基證券亞洲營運總裁鄺民彬認為，投資者可在145元博反彈，上望165元。
20080221-317,20080221,317,財話短說澳華去年蝕2350萬澳元,財話短說 澳華去年蝕2350萬澳元 ▲澳華黃金（1862）公佈截至07年底止全年業績，股東應佔虧損2349.7萬澳元，每股虧損13.23澳仙，不派末期息。期內經營活動收入2428.1萬澳元，而就兌換可換股票據成本等財務費用支出達1446.5萬澳元，升1.34倍，令除稅後經營活動虧損增加。
20080221-318,20080221,318,中環在線：何超瓊「管人靠惡實聽造反」 - 李華華,中環在線：何超瓊「管人靠惡實聽造反」 - 李華華 以心建家嘅郭氏家門內鬥，兄弟意見相左，相比起嚟，起碼賭王二房4姊妹就融洽得多，何家大小姐超瓊噚日出席一個財經論壇時，分享做管治嘅心得，仲暗示多得細個時何媽媽管教嚴厲，佢今日先可以做到女賭王。  澳門何家大小姐超瓊自從以個人名義同美高梅金殿孖住搞賭場後，就多咗個女賭王封號，佢話做領袖、學管治呢家嘢，細個時就喺屋企俾何媽媽訓練。  因為媽咪制訂一套問責制管理模式，佢係大家姐（喺賭王二房嚟計），要孭重飛睇住細佬妹，兇得嚟又要令細嘅信服，有爭拗時仲要做和事佬，呢個可以話係佢做領袖嘅啓蒙時期，佢話，呢個成長環境對佢後嚟喺企業度做管治好有用。 知人善用　自小訓練 據佢講，何媽媽要佢做最大嘅睇住班細佬妹，不論學校成績或者規矩做得唔好，作為大家姐亦要捱鬧。超瓊好有承擔咁話，呢啲係大家姐嘅責任同義務。不過，佢話唔會一味兇細佬妹，而係摸熟各人性格，軟硬兼施。佢解釋，「管人要令人信服，互相信任，如果唔係一定反（抗）你。」所以佢話做大嘅都要不時自我檢討。  將呢啲細蚊仔嘢，用喺公司管治上work唔work？睇超瓊喺信德集團（242）越嚟越受賭王重用（家陣係董事總經理），自己又做埋女賭王，就知有幾掂啦。佢曾經同傳媒講過，話超鳳管理財務，而超蕸份人就文靜啲，唔多說話，但最可靠，最啱做地產管理……呢個家姐果然識用人。 最錫超儀　張羅戰衣 至於佢最錫嘅應該係細妹超儀，當年超儀要入娛樂圈，大家姐就幫手向父母求情，前年超儀要出戰威尼斯影展角逐影后，四出搵名牌贊助戰衣，全靠大家姐幫佢張羅，難怪超儀話大家姐係佢偶像。 搞美高梅金殿顯骨氣 何超瓊除咗講家教，仲講番搞美高梅金殿時嘅辛酸，呢位大家姐第一次擺脫賭王老竇，自己同過江龍合作搞賭場，可以話係放低身段，因為佢唔係齋坐喺房，而係好認真落手落腳做。  話說美高梅金殿籌備之初，好多嘢都由超瓊負責，好似向政府有關單位申請乜申請物，又要同銀行交涉等，而呢啲嘢，大家姐其實都未做過，但既然係自己嘢，亦唔想將老竇公司嘅資源公器私用，惟有自己四圍跑，瞎子摸象咁摸番嚟。佢好樂天咁話：「本嚟做開企業管治，變咗落手落腳做番前線嘅嘢，真係創業咁，幾得意，亦引發咗唔少新思維。」  咁澳門嘅前景係咪真係咁好呢？佢就畀一串數字出嚟，話澳門喺03年沙士及之後每年嘅人口增長有幾多，重點唔係數字，而係大家姐嘅記性，華華見佢喺台上完全冇望貓紙，就吐出一串數字，記憶力認真強，而呢個亦係做領袖嘅資質之一，唔係點記得下屬有乜專長。    電郵：mailto:LiWaWa@AppleDaily.com
20080221-319,20080221,319,中環在線：傳國美黃光裕又曲線買嘢 - 李華華,中環在線：傳國美黃光裕又曲線買嘢 - 李華華 內地電器巨頭國美電器（493）主席黃光裕似乎又再發功，過去一個月已十幾次回購國美股份，好可能係為另一次收購行動做準備，今次對象係邊個呢，內地傳媒《南方都市報》報道，話係山東家電連鎖企業三聯商社。  內地上市嘅三聯商社，喺山東有過百間門市，佔濟南家電市場約七成。話說喺情人節嗰日，呢間企業嘅股權被司法拍賣（拍賣原因又係另一個古仔），當日有一間叫龍脊島嘅神秘企業，用近5.4億銀人民幣高價投得，當時大家就估幕後老細係邊個，咁啱國美黃光裕係咁回購股份，似係想買嘢，自然「嫌疑」最大。 同得主有接觸 《南方都市報》話，前日國美總裁陳曉好曖昧咁話，「國美沒有參與當日股權競拍，但目前和三聯商社股權拍賣得主有接觸。」  過咗冇幾耐，就有傳國美正係三聯商社嘅最終買家。  咁迂迴收購嘅手法，可以話係黃光裕嘅慣用伎倆，佢舊年底收購大中嘅時候，都係用呢招。今次借第三者出手競投，內地傳媒估可能國美電器喺香港上市，參加競投內地上市公司股權嘅審批程序會耐啲，所以要搵捷徑。
20080221-320,20080221,320,財話短說中海發展夥寶鋼組航運合資,財話短說 中海發展夥寶鋼組航運合資 ▲中海發展（1138）宣佈，董事會通過與寶鋼集團共組合資航運公司，將分別持有51%及49%權益，註冊資本約6240萬元，中海出資3182萬元，會將已簽訂的造船合約轉讓予合資公司，包括早前簽訂的兩艘30萬噸級礦砂船，及4艘23萬噸級礦砂船。代表中國鋼廠與三大鐵礦石供應商進行談判的寶鋼集團董事長徐樂江稱，中方是否跟隨日韓鋼廠今年的鐵礦石升幅，將於本月底前決定。另外，中海以2636萬元將載重量1.89萬噸的長陽輪售予九洲船務。
