key,date,article_daily_id,title,text
20080802-0,20080802,0,斬頸怪客出沒銅鑼灣搭訕兩句　拔刀就斬　阿嬸命危,斬頸怪客出沒銅鑼灣 搭訕兩句　拔刀就斬　阿嬸命危 【本報訊】日本秋葉原兇徒亂刀斬殺無辜途人的事件昨日在本港銅鑼灣鬧市「翻版」。一名在銀座廣場工作的清潔女工，被一名怪客搭訕兩句後從後拔刀狂斬及插，她頸背中四刀受重創，兇徒得手後瞬即逃去，遇襲清潔阿嬸送院搶救命危。她在送院前曾向警員表示不認識兇徒，未知遇襲原因。灣仔重案組正追查兇徒動機及緝捕其歸案。記者：胡恩宏、黃偉民、卓永強 現場是銅鑼灣謝斐道509號銀座廣場地庫，約有70間店舖，不少售賣潮流服裝、精品及玩具，頗受青少年歡迎，逢假日都擠滿遊逛人群，是銅鑼灣其中一個青少年蒲點。案中遇襲的清潔女工58歲姓石，受僱於一間清潔公司，被派往銀座廣場做早班清潔約四年，上班時間由上午9時至下午6時。 兇徒戴黑色框眼鏡 石婦與丈夫住在西灣河愛東邨，夫婦育有四子一女，她遇襲後一度清醒，向警方表示與兇徒素未謀面，亦沒有與人結怨及欠債，而且身家清白。她送院後傷勢急轉直下，情況危殆。警方不排除兇徒有精神問題，昨病發胡亂襲擊人，石婦不幸遭殃。  昨上午11時許，商場地庫的店舖大部份仍未開舖，該商場沒有裝設閉路電視，早上7時只有一名保安員當值，至晚上6時保安員才增至兩名。當時石婦在地庫走廊打掃，一名年約27、28歲，約5呎8吋高、戴黑色框眼鏡、身穿白色T恤、灰色長褲，孭着一個黑色背囊的男子趨前向她搭訕：「點解咁多舖頭未開門嘅？」石婦回應：「係呀，咁早未有舖頭開㗎。」 婦人負傷緊追倒地 該名男子聽罷離開，石婦繼續清潔走廊，稍後往地庫後巷踎在地下洗地拖，該名怪客突然從後現身，手持一柄尖刀向石婦狂斬及插，她冷不提防結果後頸、肩背及手臂中四刀，傷口達一吋，她受創高聲呼叫怪客隨即逃走。  石婦一度啣尾緊追至樓梯口不支倒地，一名保安員亦有協助追捕，怪客跑上謝斐道向波斯富街逃去，保安員擔心石婦傷勢返回商場看望及報警，有店舖東主將石婦扶起及協助止血。救護員到場替她包紮及送律敦治醫院，初時她仍有知覺稍後昏迷，轉送瑪麗醫院治療，情況危殆。  警方將銀座廣場地庫封鎖調查，並在附近兜截兇徒但並無發現。警方封鎖介乎景隆街與波斯富街一段搜尋，最終並無所獲。商場於傍晚6時半解封，案件由灣仔重案組跟進，調查兇徒動機及追緝其下落。 商場常客：得人驚 怪客在鬧市商場行兇，銀座廣場店舖及顧客均感震驚及恐慌，新組合VEGA樂隊昨在附近商場演出，解封後往銀座遊逛，其中兩名女成員Valerie（葉瑞玲）及Gabby（楊芷瑩）是銀座廣場常客，她們異口同聲感到震驚：「唔認識都斬好得人驚。」恐防疑兇匿在附近，遲些又再出沒行兇，她們稱將會小心出入，留意周圍的可疑人。  店舖東主「型婆」指出，遇襲的清潔女工待人友善，只是說話大聲一點，商場發生血案對她有心理影響。另修甲店店員Cathy稱，商場燈光比較暗，以後會叫男朋友接放工。而時裝店店員朱小姐則說：「好得人驚，點解佢（女工）無端端俾人斬，我以後都會小心啲。」 怪客斬插清潔女工示意圖
20080802-1,20080802,1,梁展文當年賤賣紅灣半島鄭裕彤今日重金收編旗下　議員：官商勾結,"梁展文當年賤賣紅灣半島 鄭裕彤今日重金收編旗下　議員：官商勾結 【本報訊】有份促成政府將私人參建居屋紅磡紅灣半島以8.64億元補地價，賤賣予新世界發展與新鴻基地產的前房屋及規劃地政局常任秘書長梁展文，去年初才正式退休，昨日即不避嫌加入新世界發展主席鄭裕彤麾下，以逾300萬元年薪出任要職。立法會議員狠批是赤裸裸的官商勾結，質疑當年政府賤賣紅灣半島有利益輸送之嫌，呼籲新一屆立法會徹查事件。記者：黃偉駿、林俊謙 新世界中國地產有限公司昨日宣佈，委任62歲的梁展文出任該公司執行董事及副董事總經理，初步為期三年，任期即日起生效。梁展文每年除了獲得312萬元年薪，並有董事袍金及有權收取酌情花紅等豐厚報酬。由於梁於07年1月正式退休，根據公務員事務局規定，D4或以上首長級人員在停止政府職務後12個月期間不得擔任外間工作，即使3年內也須先得到批准，換言之梁展文今次加入新世界已獲政府首肯。 做法「倒曾蔭權米」 職工盟立法會議員李卓人批評，與地產商打交道多年的梁展文完全不避嫌加入新世界擔任要職，是「倒曾蔭權米」，再次證明政府與商界之間存有利益輸送，「當年賤賣紅灣半島，係咪明益新世界先？特區政府成日話香港廉潔，但似乎根本走唔出利益輸送嘅陰影。」李卓人呼籲新一屆立法會重新徹查紅灣半島事件，查出當年政府是否賤賣市民資產。  公民黨立法會議員湯家驊質疑，現時高官的過冷河期太短，而且沒有禁止高官在退休後重投任內的相關行業，「咁佢哋任內係咪唔敢得罪發展商呢？推政策時會唔會就住呢？呢啲係官商勾結嘅基本誘因。」他建議政府延長過冷河期，以及考慮不准退休高官重投曾處理過的敏感行業。  加入政府30多年的梁展文，最為人熟悉及最具爭議性，是他在房屋地政部門工作期間的「政績」。他於02年中出任房屋及規劃地政局（房屋）常任秘書長，上任初期本港樓市正陷入低迷，前特首董建華叫停居屋托市，並於04年初將有「居屋樓王」之稱、位於紅磡的全海景私人參建居屋紅灣半島共2,740個單位，以8.64億元補地價，賤賣予新世界發展旗下新世界創建與新鴻基地產轉作私樓出售，平均樓面呎價僅1,800元，引起全港譁然。  新世界隨後表示打算將紅灣半島拆卸重建豪宅，進一步激起社會口誅筆伐。當時梁展文以常秘身份出席立法會解畫，否認事前知悉發展商打算拆樓重建，但承認地契沒有禁止發展商重建的條文。 嘉亨灣批地最矚目 不過，梁展文最為公眾熟悉，是審計署05年揭發他在01年擔任屋宇署署長期間，運用酌情權增撥1.07萬平方米額外樓面面積予嘉亨灣發展商恒基地產，以補償恒基按地契要求興建的公共交通總站，估計恒基因此多賺5.7億元。特首隨即委任獨立調查小組調查，梁不服審計署報告內容，在立法會展開聆訊前，入稟高院尋求司法覆核，但獨立調查小組在06年中發表報告，指梁行使酌情權合理，梁同月終止司法覆核。 已領千萬元退休金 梁展文在05年11月28日，在噓聲中開始退休前休假，離開官場前完成將甚具爭議的領匯上市（11月25日）。他退休支取千萬元退休金和每月六萬元長俸。  新世界中國由新世界發展持有71%股權，近年主要由新世界主席鄭裕彤的孫兒鄭志剛打理業務，主席兼董事總經理則是鄭志剛的父親鄭家純，公司主要發展內地物業，土地儲備達2,600萬平方米，是擁有最多內地土儲的香港發展商。  新世界發展暫未有回應事件。公務員事務局則表示，不評論個別案例。 梁展文小檔案 年齡：62歲    學歷：倫敦大學校外課程榮譽文學士    官職：02-05房屋及規劃地政局常秘、99-02屋宇署署長、97-99房屋局副局長、94-97香港駐多倫多經貿辦處長、91-94副憲制事務司、1976轉入政務職系、1966加入人民入境事務處 前高官離任後轉投私人機構 前高官：曾蔭培  官職：警務處處長  私人機構職位：新創建集團執行董事    前高官：許淇安  官職：警務處處長  私人機構職位：嘉華集團常務董事    前高官：李君夏  官職：警務處處長  私人機構職位：長江實業及和記黃埔顧問，負責策劃保安事宜    前高官：苗學禮  官職：房屋署署長  私人機構職位：載通國際控股有限公司（前稱九巴控股）非執行董事    前高官：鍾麗幗  官職：房屋署副署長  私人機構職位：恒基集團轄下香港小輪發展部董事    前高官：林光宇  官職：民航處處長  私人機構職位：嘉華國際集團營運總裁    資料來源：《蘋果》資料室 	你的意見? ●梁展文退休後出任新世界發展要職，你認為當中是否牽涉利益輸送？  ●對於政府批准梁展文加入新世界發展，做法有否不妥？  請電郵至：mailto:focusgroup@appledaily.com  或傳真至：37112411或發短訊至：60107999"
20080802-2,20080802,2,家屬轟醫護馬虎害死阿婆,家屬轟醫護馬虎害死阿婆 【本報訊】再有公立醫院病人進行通波仔手術後死亡。一名年逾70歲婆婆，上月在東區醫院進行通波仔手術後，翌日出現頭痛及胸口痛病徵，家人多次向醫護人員反映，不獲理會，結果婆婆在9個多小時後死亡。家人正考慮聘請律師協助，向東區醫院討回公道。 向護士反映不獲理會 77歲唐婆婆因有兩條心臟血管阻塞，上月22日在東區醫院進行通波仔手術。其女兒莫小姐表示，手術翌日約下午4時，她往醫院探望母親，母親表示頭痛及胸口痛，「條氣唔順同好促，透唔到氣」。她多次向護士反映，但不獲理會。至晚上，其母親沒胃口進食，惟有躺在床上休息，其後更嘔吐。晚上7時許醫生巡房時，只表示安排唐婆婆再插喉吊鹽水，但沒詳細檢查，護士只給予唐婆婆一粒止痛藥。  莫小姐表示，萬料不到她離開醫院後，晚上11時多突然接獲醫院來電，指其母心跳曾停頓，正在搶救，「我去到時見到佢滿面通紅，頭筋都脹晒」，其母終在凌晨1時45分終告不治。莫小姐及其六名兄弟姐妹對母親突然離世感到難過，認為醫院沒有即時安排其母作詳細檢查，才令母親於手術後短短9個多小時死亡，「簡直係草菅人命」。她正考慮聘請律師協助，向東區醫院討回公道。  老人科專科醫生佘達明表示，年邁病人進行通波仔手術，風險較高，若手術後病人出現不適，應立即作詳細檢查，甚至推入手術室檢查血管。最大可能性是病人手術後出現併發症，剛通波仔的血管再破損，引致其他血管阻塞，引致心臟肌肉壞死及心衰竭，沒及早發現而死亡。  東區醫院發言人回應說，當獲悉唐婆婆頭痛，醫護人員處方止痛樂，亦多次量血糖等檢查，之後病人再沒有表示不適。至凌晨時分護士巡視時，發覺病人無反應，立即搶救，惜終告不治，院方已向醫管局呈報。
20080802-3,20080802,3,楊森以古蹟保育政綱谷票,楊森以古蹟保育政綱谷票 【本報訊】民主黨誓言要為泛民在港島區爭第四席後，民主黨前主席楊森即為爭取連任，全力拉票。楊森認為，自由黨林翠蓮出選港島後，會拉散民建聯和前任保安局局長葉劉淑儀兩張建制派名單的得票，只要支持泛民的選票集中投給民主黨和公民黨，泛民在該區會有較大機會取得四席。 港島區力爭兩席 民主黨甘乃威、楊森、徐遠華參選團隊昨日公佈古蹟保育政綱，呼籲政府打造歷史城區，保留中環街市、荷李活道前警察宿舍、嘉咸街市集等有歷史價值的建築。楊森接受訪問時指，港島區今屆選情比過去激烈，泛民支持者若想泛民保住現有四席，最好是將選票投給公民黨和民主黨，「如果啲票係好分散嘅，對泛民爭取第四席唔會有好處」。  楊森評估，泛民的功能組別議席將會減少，所以現時保住直選議席數目十分重要，以在來屆保住21席的關鍵少數，為市民在政改問題上把關。楊森又指，民主黨最近在港島區由「力保一席」改為「力爭兩席」，是由於黨內民調顯示，他「過票」給甘乃威後，自己仍有一定支持度，有力為該黨力保兩席。  此外，楊森又炮轟早前發表「叉頸論」的競選對手、前任保安局局長葉劉淑儀，指有關言論反映葉太「仍然自覺係保安局局長，佢最熟悉扣喉呢啲嘢，所以不自覺就幫公安解釋咗。」  排公民黨港島參選名單首位的陳淑莊昨日表示，希望每支參選隊伍做好自己的本份，爭取自己的支持者。她指今年港島區有11支隊伍參選（見表），戰情混亂、激烈，配票更加不可行，「香港選民係明智嘅，心目中已有支持嘅候選人，我希望選民按個人意願投票。」 2008年立法會選舉 地方選區參選人 《香港島（6議席，11份名單）》  參選名單：勞永樂    參選名單：陳淑莊、余若薇、容詠嫦　政治聯繫：公民黨    參選名單：甘乃威、楊森、徐遠華　政治聯繫：民主黨    參選名單：黎志強　政治聯繫：獨立民主派    參選名單：曾鈺成、蔡素玉、鍾樹根、張國鈞、陳學鋒、郭偉強　政治聯繫：民建聯    參選名單：何秀蘭　政治聯繫：公民起動    參選名單：曾健成　政治聯繫：社民連    參選名單：葉劉淑儀、史泰祖、黃健興、陳岳鵬　政治聯繫：獨立    參選名單：林翠蓮、王錦泉、顏才績　政治聯繫：自由黨    參選名單：袁大明    參選名單：蕭敏華    《九龍西（5議席，14份名單）》  參選名單：梁美芬、梁偉權、林家輝  政治聯繫：前兩者沒有申報，後者填報為獨立人士    參選名單：李慧琼、鍾港武、陳偉明、鄭泳舜　政治聯繫：民建聯    參選名單：馮檢基、莫嘉嫻、秦寶山、黃志勇、楊振宇　政治聯繫：民協    參選名單：涂謹申、林浩揚　政治聯繫：民主黨    參選名單：譚凱邦    參選名單：莊永燦    參選名單：龍緯汶、韋世民　政治聯繫：南方民主同盟    參選名單：黃毓民、李偉儀　政治聯繫：社民連 參選名單：柳玉成、蔣潔鳳、徐達偉　政治聯繫：前者報稱獨立，後兩者沒有申報    參選名單：田北辰、何顯明　政治聯繫：自由黨    參選名單：毛孟靜、伍月蘭、鄧志盈　政治聯繫：公民黨    參選名單：林依麗    參選名單：劉千石    參選名單：王紹爾　政治聯繫：民建聯      《九龍東（4議席，6份名單）》  參選名單：李華明、計明華、黃啓明、黃偉達　政治聯繫：民主黨    參選名單：胡志偉　政治聯繫：民主黨    參選名單：陳鑑林、黎榮浩、陳曼琪、洪錦鉉　政治聯繫：民建聯    參選名單：梁家傑、余冠威、黃鶴鳴　政治聯繫：公民黨    參選名單：黃國健、陳婉嫻、王吉顯、簡銘東　政治聯繫：工聯會    參選名單：陶君行　政治聯繫：社民連    《新界西（8議席，14份名單）》  參選名單：蔣志偉、楊智恒　政治聯繫：民協    參選名單：周梁淑怡、周永勤　政治聯繫：自由黨    參選名單：張賢登、鄺俊宇　政治聯繫：民主黨    參選名單：李永達、王雪盈、林紹輝、張慧媚、林立志　政治聯繫：民主黨    參選名單：何俊仁、許智峯、盧民漢　政治聯繫：民主黨    參選名單：譚耀宗、張學明、梁志祥、陳恒鑌、龍瑞卿、梁嘉銘、老廣成、呂堅　政治聯繫：民建聯 參選名單：梁耀忠、黃潤達　政治聯繫：街工    參選名單：張超雄、陳琬琛、黃家華　政治聯繫：公民黨    參選名單：王國興、麥美娟、曾梓筠、徐帆、梁子穎、鄧家彪、姚國威、陳文偉　政治聯繫：工聯會（麥及曾兩人沒有申報聯繫）    參選名單：李卓人、譚駿賢　政治聯繫：職工盟    參選名單：阮偉忠    參選名單：梁雪芳、THAPAKomal　政治聯繫：前者為藍英同盟；後者沒有申報    參選名單：陳偉業　政治聯繫：社民連    參選名單：鄒秉恬　政治聯繫：獨立    《新界東（7議席，10份名單）》  參選名單：劉慧卿、柯耀林　政治聯繫：前綫    參選名單：鄭家富、任啓邦、何淑萍、梁　里、關永業、容溟舟、林少忠　政治聯繫：民主黨    參選名單：黃成智、莫兆麟　政治聯繫：民主黨    參選名單：田北俊、簡永輝、方國珊　政治聯繫：自由黨    參選名單：蕭思江、容超榮　政治聯繫：港人民權民生黨有限公司    參選名單：李子榮　政治聯繫：無黨派    參選名單：梁國雄　政治聯繫：四五行動、社民連    參選名單：湯家驊、曾國豐、曾健超　政治聯繫：公民黨    參選名單：龐愛蘭　政治聯繫：獨立    參選名單：劉江華、陳克勤、莫錦貴、黃碧嬌、陳國旗、劉國勳、連楚強　政治聯繫：民建聯（莫錦貴沒有申報聯繫）    註：早前報名在新界東參選的北區區議員葉曜丞，昨天退選  資料來源：選舉事務處 功能組別參選人 漁農界：黃容根〈民建聯〉、梁和平    保險界：秦鈺池、陳健波、蔡中虎    航運交通界：劉健儀〈自由黨〉、譚志華    教育界：張文光〈民主黨、教協、支聯會〉、何漢權、余綺華    法律界：吳靄儀〈公民黨〉、何君堯	    會計界：譚香文〈公民黨〉、陳茂波、龔耀輝、嚴定偉、黃宏泰    醫學界：楊超發、郭家麒、梁家騮、何良    衞生服務界：溫德才〈獨立〉、李國麟    工程界：黎廣德〈公民黨〉、何鍾泰、文錫昂    建築、測量及都市規劃界：余錦雄/劉秀成〈獨立〉/吳永輝〈民主黨〉、陳耀輝〈獨立〉、陳贊輝 社會福利界：張國柱〈社工總工會〉/狄志遠〈民主黨〉    旅遊界：董耀中〈自由黨〉/葉慶寧〈獨立〉/司馬文〈公民黨〉、謝偉俊    紡織及製衣界：劉柔芬〈自由黨〉、鍾國斌    批發及零售界：方剛〈自由黨〉、趙振國    資訊科技界：譚偉豪、莫乃光	    區議會：葉國謙〈民建聯〉、林偉強    商界（第一）：林健鋒〈自由黨〉/邵在德〈獨立〉    商界（第二）：黃宜弘*	    地產及建造界：石禮謙*〈獨立〉    工業界（第一）：梁君彥*〈自由黨〉    工業界（第二）：林大輝*	    金融界：李國寶*〈獨立〉    金融服務界：詹培忠*    體育、演藝、文化及出版界：霍震霆*    進出口界：黃定光*〈民建聯〉    飲食界：張宇人*〈自由黨〉    鄉議局：劉皇發*〈自由黨〉    勞工界（3議席）：潘佩璆*〈工聯會〉/葉偉明*〈工聯會〉/李鳳英*〈勞聯〉    *沒有競爭對手，可望自動當選  資料來源：選舉事務處
20080802-4,20080802,4,新世界高層撐梁展文　被批侮辱公眾智慧議員轟：明目張膽輸送利益,新世界高層撐梁展文　被批侮辱公眾智慧 議員轟：明目張膽輸送利益 【本報訊】被指在04年賤賣居屋紅灣半島予新世界發展及新鴻基地產的前房屋及規劃地政局常任秘書長梁展文，獲新世界發展旗下新世界中國地產委任為執行董事及副董事總經理，引起官商勾結的指控。新世界發展董事總經理梁志堅指，當年與梁展文就紅灣半島「未傾過一句說話，未開過一次會」，意指梁沒有參與紅灣項目，不過有議員指梁展文在賤賣紅灣半島一事上確有話事權，批評今次事件是明目張膽的利益輸送，要求梁展文公開交代，特首曾蔭權也要向市民解釋。　記者：麥志榮、林俊謙 當年代表發展商與政府就賣斷居屋紅灣半島談判的新世界發展董事總經理梁志堅昨出席有線電視節目《飛常政經》時回應稱，「從來呢單嘢我未同梁展文傾過一句說話，亦唔係佢打理嘅，從來我未同佢開過一次會」。 梁展文曾認統籌紅灣 他指出，負責談判的房屋及規劃地政局、地政署及律政司三個部門，每個部門都派6至7人開會，梁展文從未有出席任何一次會議。  梁志堅又透露，聘請梁展文是新世界主席鄭裕彤親自處理，自己也是前天收到內部通告才知道。他們是賞識梁展文的工作能力才聘請他，稱一個公務員離開了政府，「過晒冷河」，已和普通人沒有分別，新世界是「堂堂正正請佢番嚟」。  在04年紅灣半島賤賣及面臨拆卸的風波，當時擔任房屋及規劃地政局常任秘書長的梁展文多次出席立法會房屋事務委員會議，向議員作出解釋。  他當時在接受電台訪問時曾表示，紅灣半島的談判他負責統籌，補地價由地政署高級及律政司官員組成的談判小組負責。  新世界中國地產發表聲明表示，梁展文的職責為管理國內地產的內部行政工作，不涉及香港業務，所以他過去的政府工作與現時的職務並無利益衝突。  曾經跟進紅灣半島事件的民主黨立法會議員李永達批評，梁志堅說法欺騙公眾，因為政府與發展商討論補地價，常秘不會直接參加談判，但最終作出決定，梁展文肯定有「話事權」。議員陳偉業批評梁志堅侮辱公眾智慧，「中英談判鄧小平都無去開會」，政府的談判代表只是按上司梁展文的決定去辦事，今次是「明目張膽嘅利益輸送」。 特首也要向市民解釋 前任政務司司長陳方安生批評，「先有許仕仁、𠵱家又有梁展文，佢哋咁做法，會畀市民咩印象呢？就係政府官員越嚟越無規無矩」。她要求政府及梁展文要公開交代，特首曾蔭權也要向市民解釋。  民主黨創黨主席李柱銘表示，梁展文事件令市民覺得十分不妥，「佢已經唔係第一個，𠵱家好多大機構，都會畀好高人工請前高官」。  中文大學政治與行政學系副教授馬嶽認為，梁展文事件難令公眾信服，令人懷疑有人與財團有默契，在職時給予財團好處，以換取日後一份工作。 紅灣半島事件簿 日期：02年11月  事件：政府宣佈停售居屋，並擬將已落成的私人參建居屋紅灣半島賣斷予發展商新世界及新鴻基地產    日期：03年1月  事件：政府與新世界等就紅灣半島轉為私樓展開補地價談判    日期：04年2月  事件：政府與新世界等達成協議，以8.64億元補地價賣斷紅灣半島，被議員批評賤賣資產    日期：04年11月  事件：新世界宣佈要拆卸全新的紅灣半島，改建為豪宅出售    日期：04年12月  事件：新世界在各界的強烈反對下放棄拆卸計劃，改為將紅灣半島裝修    日期：07年12月  事件：紅灣半島裝修完成，改名為海濱南岸發售，以呎價推算，發展商獲利至少52億元    資料來源：蘋果資料室
20080802-5,20080802,5,吳靄儀：不能只顧業界私利,吳靄儀：不能只顧業界私利 【本報訊】公民黨吳靄儀今年在法律界第五度參選。雖然受到競選對手、身兼律師會副會長何君堯批評未有關注業界利益，但吳靄儀力指法律界代表「唔能夠只為一己私利」，強調自己關注業界需要之餘，會繼續為社會服務，並會一如其參選口號，堅持立場，「信念始終如一」。 法律界猛人撐場 多名法律界猛人包括資深大律師張健利及陳景生等昨天現身吳靄儀的造勢會，以行動支持她競選連任。張健利直指「疾風知勁草」，吳靄儀堅持信念，單憑這點就足以支持她續任。公民黨黨魁余若薇則指，「法律界不是僅僅要一個有質素的代表，我們要的其實是一個高質素的代表」，認為向來立場堅定的吳靄儀是不二之選。  執業律師楊元彬也駁斥某些人指吳靄儀沒有關注業界內的問題是「毫無根據及不公平」，又力撐業界代表需要回饋社會，為在政治上受到不公平對待的人爭取合理權益，不理解為何有業內人士會借此攻擊吳靄儀過於政治化。  吳靄儀重申，就算身為法律界代表，也不能只照顧業界而不理會社會大眾，「（業界代表）唔能夠只為一己私利」。她重申對法律界時刻關心，「每一分鐘都唔會忘記我嘅選民」，但毋須經常宣之於口，並強調若只顧及業界利益，會令社會對法律界失去信心，故此會一如以往堅定立場。
