key,date,article_daily_id,title,text
20081227-98,20081227,98,特稿料吸引旅客到深圳轉平機,特稿 料吸引旅客到深圳轉平機 深港兩地融合是本港未來經濟發展大方向，故特首曾蔭權在07年施政報告，首次提出研究港深兩地機場的直通鐵路計劃。港府官員說，由於鐵路僅20分鐘車程，新機鐵可鞏固香港作為國際航空中心地位，吸引更多內地的轉機旅客，「嚟香港轉機嘅內地客唔使為咗預交通時間花多兩、三個鐘。」深圳亦可與香港互補，提供緊密的內地航點，吸引旅客到深圳機場乘搭更廉價的內地航班。  現時深港兩地機場已有不少合作，國際與國內航線互相接駁，兩地又有直通巴士、海上航線，但全程需花逾一小時，對兩地轉機旅客始終不方便。港府官員說，兩地機場碼頭的渡輪服務每日只得四、五班，航程又超過一小時，乘搭直通巴士需時更長。 促進兩地機場發展 現時深圳機場的內地航點城市超過40個，往上海和北京等大城市每日多達數十班次，內地直航的機票又比香港直航便宜，故不少港人已選擇深圳機場往內地城市。反過來，不少內地人也喜歡香港國際航班頻密，飛深圳然後來港接駁國際航班。因此，港深新鐵有助促進兩地機場發展、兩地居民往來。  本報記者
20081227-99,20081227,99,美食嘉年華　煞科益街坊一蚊一條冰下魚,"美食嘉年華　煞科益街坊 一蚊一條冰下魚 【本報訊】冬季美食嘉年華今日煞科，多個參展商為免花錢將貨物運走，明言會將食品割價傾銷。除「一蚊一條魚」（原價48元）、9毫子一盒「沙溪涼茶」外，皇帝蟹、急凍鮑魚、山竹果汁等亦勢將在最後時段以八折或更低價清貨。由於美食嘉年華數日來丁財兩旺，參展商餘貨不多，市民掃貨請早。　記者：張文傑 首日以「一蚊一隻栗毛蟹」作招徠的優質堂，昨繼續擠滿鍾情日本海鮮的顧客，負責人陳先生表示，今日「好頭好尾」，每條「冰下魚」以一蚊出售，限量2,000條，「原價48蚊條，我哋特登留起一批做特價，當係報答顧客支持。」他更會從顧客中抽出幸運兒，送予價值8,000元的巨型鱈場蟹，並揚言如今日下午300元一隻的「幻之蟹」仍未售罄，為求清貨，會把所有蟹即場鹽燒，供顧客任食。 視乎去貨始定減幅 專營急凍食品的攤檔檔主莊小姐亦稱，極可能將餘貨較多的產品割價促銷，「好似智利鮑魚、皇帝蟹咁，幾日以嚟都無減價，又係要急凍食品，唔方便擺來擺去，最後一日可能會九折甚至八折賣埋佢。」專誠由美國運來逾百箱山竹果汁作推廣的余先生說，昨日已將一箱六樽的果汁由198元減至180元，銷情不俗，但強調「唔想運返美國」，今日會視乎情況再減價。  另外，凉茶茶包攤檔今日亦會推出特別優惠，顧客於攤位內購物滿50元，只需加9毫即可購得一盒原價29元的「沙溪涼茶」，售完即止，檔主高先生說：「希望最後時刻掀起高潮，大家買得盡興！」  今年煞科日減價的幅度相信不及以往大，主因是今屆展期適逢聖誕假期，人流特別多，很多參展商異口同聲說，毋須作出大幅減價，去貨速度已十分理想。  主打新加坡入口的即冲咖啡職員葉小姐表示，昨日已由100元三盒減價至100元四盒，「減一次價已賣得好好，應該唔需要再減。」售賣牛奶調味棒的職員指三種味道的產品中，朱古力及士多啤梨味已將近售罄，只有香蕉味餘貨較多，如有需要才會在最後時間由50元8包減至50元10包。 料入場人次破60萬 冬季美食嘉年華昨日錄得17.6萬入場人次，三日以來已累積約55萬人次。主辦機構指今日星期日兼展期最後一天，雖然展覽時間會改為早上11時至晚上7時，比之前縮短兩小時，但相信總入場人次可突破去屆的60萬。 美食嘉年華煞科10大必掃品 *山竹果汁  價錢：$180/6樽　攤位：山婷（C17）    新加坡咖啡  價錢：$100/4盒　攤位：利高國際食品（C19）    ^冰下魚  價錢：$1/條　攤位：優質堂（D01-04）    *急凍鮑魚  價錢：$260-$290/包　攤位：澤興食品（D10）    *皇帝蟹  價錢：$288-$328/隻　攤位：澤興食品（D10）    有機藍莓亁  價錢：$60/包　攤位：綠盈坊有機店（E18）    #沙溪涼茶  價錢：$0.9/1盒　攤位：祥誠集團（E29）    *牛奶調味棒  價錢：$50/8包　攤位：CHEF'SGARDENLTD（F38）    高麗人參茶包  價錢：$380/30包　攤位：平壤海棠花食品（G13）    飛機欖  價錢：$10/3粒　攤位：砵仔王（N08）    ^限量2,000條  #於攤位內購物滿$50才可享有此優惠	  *視乎情況照價再八折  資料來源：主辦機構及參展商 你想知　想講　想問？ 經濟不景下，你會到那些地方購買平貨？    請即上《蘋果》網頁 http://appledaily.atnext.com留言喇！   或電郵至：mailto:focusgroup@appledaily.com  傳真：37112411  手機短訊：63836568"
20081227-100,20081227,100,不屑與後輩平起平坐祖兒、阿詩黑面齊藐謝安琪,不屑與後輩平起平坐 祖兒、阿詩黑面齊藐謝安琪 今年憑一曲《囍帖街》大發神威的謝安琪（Kay），走勢直逼一眾天后，前晚Kay更在新城頒獎禮上勇奪4獎，緊貼得5獎的大贏家容祖兒，並與楊千嬅及何韻詩（阿詩）等一線女歌手看齊，陳奕迅（Eason）更出口力撐指Kay可與祖兒一較高下。祖兒和阿詩這對緋聞好友似是感到威脅埋身，前晚在慶功宴上不約而同排斥Kay，擺明車馬阻她上位。 今年第一張樂壇成績表「新城勁爆頒獎禮2008」，前晚在亞洲國際博覽館舉行，賽果一如所料由陳奕迅及容祖兒各得5獎成為大贏家，但謝安琪卻憑《囍帖街》勇奪勁爆年度歌曲大獎、我最欣賞歌曲及我最欣賞女歌手等獎項，更上位躋身成為新城勁爆女歌手獎得主，與容祖兒、何韻詩及楊千嬅等一姐平起平坐，風頭一時無兩。 阿詩唔願排排企合照 Eason和千嬅前晚在慶功宴上，異口同聲力撐Kay，直言看好她可與祖兒「鍊過」，為Kay打下一支強心針。Kay整晚在慶功宴上也表現風騷，大合照時企正中間位全程笑容滿面，更將Eason的頭髮撥亂，心情勁靚，但她與身旁的祖兒卻交流不多，不時你望左我望右。當Kay在台上講述得獎感受時，祖兒更表現得極不留心，寧願跟Eason傾偈。  至於阿詩據聞不滿女歌手獎由3變4，被Kay上位分一杯羮，加上二人雖然同樣得4個獎，但全晚焦點全落在Kay身上，阿詩聲勢被蓋，難怪她在慶功宴上全程黑面。當千嬅、祖兒和Kay三人在台上平排合照時，惟獨阿詩一人坐到前排梯級，刻意避開其他三位女歌手獎得主，擺明避開Kay以免和她在台上硬碰。 祖兒自稱重質唔重量 已為人母的Kay已屆31歲，與阿詩同齡，比28歲的祖兒年長，但論入行資歷，出道僅3年的Kay則是三人中最淺的一個，祖兒和阿詩這對緋聞情人眼見這位「後輩」來勢洶洶，似乎有意合力阻她上位。事後祖兒被問到是否覺得Kay成為其勁敵時，未有正面回應，她只說：「我冇去計，最緊要係對樂壇有貢獻，獎項係鼓勵，多少唔重要，同埋係重質不重量，所以得獎嘅人都係實至名歸。」  Kay被記者指已躋身一線女歌手之列時，謂最重要是歌曲受歡迎，她說：「我冇諗過同人比，歌手唔應該分乜嘢線，幾多線唔係自己講，Eason畀咗好多鼓勵我，阿詩、祖兒都畀好多意見我。」 千嬅讚謝安琪夠努力 另一方面，Eason被問到覺得Kay是否可與祖兒比拼時，他直說：「真係有得鍊㗎，我今晚最開心睇到本地樂壇唔係青黃不接，Kay、方大同、張敬軒都有咁好成績。」一直是祖兒宿敵的楊千嬅也出言支持Kay，指Kay上位是好事，她說：「冇理由樂壇得嗰幾個女歌手，我見到阿Kay喺台上喊，都明白佢付出好多努力，後輩上位唔應該覺得有壓力，反而自己要更加努力，不停同自己鬥。」  採訪：胡比、馬建華  攝影：葉君海
20081227-101,20081227,101,台灣填詞人電視爆大鑊周慧敏兩度撞破倪震姦情,台灣填詞人電視爆大鑊 周慧敏兩度撞破倪震姦情 偽情日記之越挖越臭--倪震偷食斷正事件昨日又有驚人發展，台灣填詞人梁鴻斌日前在綜藝節目《王牌大間諜》中，大爆周慧敏（Vivian）曾兩度在家撞破倪震姦情，因此今次倪震與張茆偷食，對她來說只是濕濕碎。梁鴻斌昨日接受本報訪問時，再大爆曾目睹倪震在KTV中明媾一名1970年出生、曾來港發展的台灣女藝人。 倪震與城大女學生張茆偷食斷正後，雖然已冧掂周慧敏與他結婚，但其風流臭史卻越揭越有。繼被指曾背着Vivian暗媾吳綺莉、李美鳳、朱茵、葉蘊儀、內地名模裴蓓及新人羽翹等後，日前台灣填詞人梁鴻斌更大爆Vivian曾撞破倪震姦情。  別名「天天」的台灣填詞人梁鴻斌在平安夜（大前晚）播映的台灣綜藝節目《王牌大間諜》中，與主持人就倪震偷食以致與Vivian分手、復合到宣佈結婚事件展開討論。其間梁鴻斌忍不住爆料說：「基本上張茆這個事情，對周慧敏來說是個小case，在20年過程當中，有兩次比這個嚴重太多了，因為現在網絡比較發達，張茆頂多是把一些不雅的照片post在網路上，但是曾經周慧敏抓過兩次姦在床上面，她連這種事也可以忍受，張茆算那根葱啊！」 提早回家 周慧敏開門撞到正 此番話一出，主持人及在場嘉賓即刻起哄，梁鴻斌續說：「因為他們兩個（倪震與周慧敏）住在一塊嘛，那時候周慧敏告訴他：『我去國外去工作了。』但是她提早回來……」其時主持問：「你說帶到家裏面？」梁鴻斌答道：「對、對。提早回來門一開……所以大家覺得張茆這事情好像很大條，對周慧敏來講是小之又小的事情。」記者昨日分別致電倪震、周慧敏及倪震父親倪匡，但一直未獲回覆。周慧敏經理人陳先生則說：「我冇聽過Vivian提起呢件事，對於佢嘅私生活唔回應。」  梁鴻斌在節目大爆倪震臭史，究竟他何以知道周慧敏撞破姦情？他昨日接受本報記者電話訪問時說：「我以前在報社當唱片記者，不時接觸周慧敏，我們關係很好，每次她來台灣，我們都會碰面。其實那個秘密是周慧敏身邊的朋友告訴我的，當日周慧敏跟朋友訴苦，說提早回到家裏，然後發現別個女生在家中，所以很生氣。那是很久以前的事，大約發生在90年代吧，但我相信她不會承認。」梁鴻斌指近日傳媒雖連環揭發倪震情史，但卻不及這個秘密震撼，他說：「這件事好重要，我特別講出來highlight一下。」  對於倪震為人，梁鴻斌不敢恭維，他說：「他的人品一般，但卻很花心。」他再向記者大爆周慧敏撞破姦情事件發生前，自己曾目擊倪震在台灣夜店中媾女實錄，他說：「記得倪震十多年前來台，要約一位台灣女藝人去KTV，但那位女藝人卻要求我相陪，於是當時只有我們3人同場。我親眼看到倪震不停與女方說笑和飲酒，他真的很會說話，看得出他對她非常有意思。」究竟那女藝人是誰？梁鴻斌大賣關子：「她的名字我不能說，因為她現在已結婚和生了孩子，她也是我好朋友，我不想影響別人，我只可透露她是1970年出生，曾來香港發展，曾到香港出唱片，但現在則轉為拍劇。」那個嫌疑女藝人可會是伊能靜？他說：「絕對不是。」 現場目擊 揭倪震媾台灣女星 梁鴻斌指該女藝人主動找他一起赴約，所以他才對整件事瞭如指掌，當晚大夥兒逗留了兩個多小時後，他便陪女藝人離開，由於那是10多年前的事，很多細節他已忘記了。梁鴻斌指女藝人是清純玉女，絕對拍得住周慧敏，又指倪震當日約女藝人見面，一定對女方有意思，但女藝人覺得倪震為人花弗，所以最終還是請倪才子食檸檬。  採訪：林妃 人物誌：為孫燕姿填詞打響名堂 在台灣綜藝節目《王牌大間諜》中大爆倪震偷食有前科的台灣填詞人梁鴻斌（天天），曾在當地做了15年娛樂記者，主要負責樂壇新聞，曾擔任《大成影劇報》採訪中心副主任，也有當過電台及電視主持人等工作，早前還推出文集《天天狂想曲》（圖）。天天01年為孫燕姿歌曲《綠光》填詞而成名，之後陸續為孫燕姿打造《神奇》及《奔》等的代表作，其間他曾為蔡依林、張惠妹及蕭亞軒等歌手填詞。天天與圈中人關係良好，早前梁朝偉和劉嘉玲在不丹舉行婚禮，也有邀請他出席。 話你知：誰是倪震獵物？ 台灣填詞人梁鴻斌昨日接受電話訪問時，表示曾目擊倪震在台灣卡拉OK內狂媾台灣女藝人，他表示該女藝人1970年出生，當年是歌手，現已轉型拍劇，更是已結婚產子。記者列舉了八位女藝人的資料，當中以伊能靜和陶晶瑩較脗合。
20081227-102,20081227,102,Angelababy盼做包租婆,"Angelababy盼做包租婆 𡃁模楊穎（Angelababy）最近搬入九龍城1,500呎大屋，金融海嘯價月租萬多元，以她30,000元一場騷的身價來說綽綽有餘，她日前說：「我希望快啲儲到筆錢，買間屋用嚟收租，我淨係想快啲畀屋企人一個好啲嘅環境，好舒服咁過每一日。」 電話傳情 Angelababy表示會跳舞減壓，她說：「一有時間我就去學跳舞，跳舞好有成功感。」緋聞男友陳偉霆跳舞了得，加上早前兩人被拍到孖咇放狗，大可跳跳舞放放狗輕鬆一下，Angelababy卻說：「咁咪佢放佢隻狗，我放我隻狗囉。𠵱家少咗見，惟有通電話，有時會出嚟食飯嘅。公司冇畀壓力，總之𠵱家就冇拖拍啦。」  撰文：林妃  攝影：陳順禎  場地：LUX  服裝提供：acupuncture  化妝：K.K.Kwong  髮型：CarrChengofPopHairdressing"
20081227-103,20081227,103,廖碧兒聖誕吐苦水,廖碧兒聖誕吐苦水 廖碧兒昨日出席在維園舉行的工展會，近日她正於加拿大拍攝電影《TheKingofFighters》，合作的還有MaggieQ，今次她險些趕不及回來，她說：「溫哥華大風雪，我班機延遲咗6個鐘先起飛，我之後啲機都要停飛，呢個聖誕冇收過禮物，又冇乜賺外快，因為加拿大好凍，喺零下18度，我哋啲衫又好單薄，雖然打得好吃力，但係好有型。」 人造雨變雪條 廖碧兒又說：「我有凍到病咗，我哋成日喺冰天雪地度拍打戲，不過MaggieQ好叻好少病。」又表示曾試過拍下雨戲，但噴出來人造雨卻變成雪條，她又將8個暖包藏在腰間，結果被輕微灼傷。  採訪：李全
20081227-104,20081227,104,胡杏兒談情現囧樣,胡杏兒談情現囧樣 胡杏兒前晚接受商台《嘩！嘩！嘩！打到嚟！2008》的訪問，主持吳君如坦言若不是胡杏兒為電視劇《肥田囍事》增肥演出，她也不知胡杏兒是誰人。而當晚胡杏兒的「囧」樣成為嘲笑箭靶，當主持問到胡杏兒的情史時，胡杏兒不知如何回答，主持即笑說：「又唔整個囧樣出嚟？囧樣又嚟啦！」問到拍劇時有沒有曾對男主角動情，幾經追問下胡杏兒終爆出當日拍《衝上雲霄》時對吳鎮宇曾有點戲假情真。 嫌Bosco花弗 談到緋聞男友黃宗澤（Bosco），胡杏兒謂：「其實我同鄭嘉穎都傳過，我都想，佢OK㗎，好男人，Bosco唔啱自己，個樣花弗，不過佢好照顧人，有上進心。」杏兒初入行時曾與一位混血兒拍拖，她透露男方正與一名女藝人蜜運，但拒爆女藝人身份。  採訪：王崇穎
20081227-105,20081227,105,子聰掃貨超儀埋單,"子聰掃貨超儀埋單 何超儀和丈夫陳子聰前晚拍拖到銅鑼灣家品店「住好啲」逛街，雖然兩人只是隨意行了一個圈，不過收穫已相當豐富，包括買了坐墊、枱墊和杯墊等，兩人不時有商有量，表現相當恩愛。 買型人相機 雖然超儀和陳子聰被不少市民認出，不過兩人依然悠然自得四圍逛，二人除了買家庭用品之外，超儀又揀了一部型人必選的Lomo相機，盛惠4,600元。  所有戰利品由超儀負責找數，陳子聰在旁打點，兩公婆相當合拍。由於收穫甚豐，所以店員幫他們搬戰利品上車，超儀和陳子聰離開時齊向工作人員道別，與平日的火爆性格截然不同。  採訪、攝影：娛樂突發組"
20081227-106,20081227,106,闊太Look賀外甥結婚嘉欣一聽倪震快閃,闊太Look賀外甥結婚 嘉欣一聽倪震快閃 許晉亨的外甥郭永亮（Andy）與拍拖多年的女友黃兆賢（Flora）昨日結婚，早上行禮、斟茶儀式及晚上的120圍喜酒均在灣仔會展舉行。許晉亨早上單拖觀禮，晚上則拖妻子李嘉欣出席喜宴。一對新人的婚禮中西合璧，兩人用英文名開首的A和F，設計成甚有中國風的logo，喜宴場地也搭建巨型紅白柱，牆上則綴上金色印字。  新娘黃兆賢穿上白色婚紗，配襯碩大的珍珠頸鏈，新郎郭永亮行禮後說：「我哋喺北京讀書時相識，拍咗四年拖，佢好難追㗎，我畀太太101分。」他透露兩人會去多個國家包括印度度蜜月。 聞許太開心回頭 許晉亨、混血女模AmandaS.與男友、合和太子胡文新等昨早觀禮，其中許晉亨早上9時多便到場，但不見李嘉欣，婚後發福的亨亨更凸出小肚腩。記者問新郎胞弟郭永聰，嘉欣會否赴喜宴？他說：「應該會，都係一家人呀！」  至晚宴時段，許世勳夫婦先到場，到晚上七時半，多名保安突然在場外打點，原來李嘉欣和許晉亨拖手到場，令場面變得混亂。被傳有孕的嘉欣穿上吊帶晚裝，腹部平坦，看不出有懷孕迹象，她更罕有地戴甚有闊太feel的翡翠耳環。當記者高呼「許太」，嘉欣即開心回頭，問她是否有喜？她笑而不答，再問其舊愛倪震偷食後跟周慧敏結婚，會否祝福他？嘉欣即詐聽不到，轉身入場。  此外，鄺美雲、田北俊、袁彩雲和趙式明也有出席喜宴，朝早往觀禮的胡文新晚上則缺席宴會，避過與兩名舊愛袁彩雲和趙式明同場。  採訪：顏英儀　攝影：陳順楨 郭永亮（Andy）  年齡：34歲  背景：許愛周家族後人  職業：商人    黃兆賢（Flora）  年齡：28歲  背景：—  職業：拍賣行珠寶專家
20081227-107,20081227,107,超雲淑女Look酒店狂歡超盈露香肩夜店蒲通宵,超雲淑女Look酒店狂歡 超盈露香肩夜店蒲通宵 前晚聖誕夜，賭王何鴻燊三姨太長女何超雲和四姨太長女何超盈，分別現身灣仔和中環跟女性朋友夜蒲，狂歡慶祝。穿上毛毛褸、一臉貴氣的超雲，跟以性感tubedress上陣的超盈相映成趣。連日出動夜蒲的超盈，大前晚玩至通宵達旦，面容明顯露疲態，而同樣是愛蒲一族的唐貝欣前晚也全女班在中環通宵狂歡。 留學海外的名人第二代每逢長假返港，都不會放過夜蒲好機會，何超盈自大前晚平安夜與唐貝詩到蘭桂坊狂歡至凌晨3時後，前晚約11時半她又再次出動，與一班女性朋友到Dragon-i狂歡賀聖誕，玩至通宵達旦，不過今次她身邊多了一名保鑣護駕，但與她傳緋聞的翻版張震Harris則未見出現。 收香水做禮物 早前花了數萬元減肥的超盈，明顯瘦了一大圈，前晚她穿上性感tubedress大騷身材，她先在Dragon-i玩了約30分鐘，其後似是嫌悶決定轉場，離開時手上拿着一支Dior香水，不知是否朋友送贈的聖誕禮物。超盈說：「之前已經同屋企人慶祝咗聖誕節，所以今晚同朋友慶祝，我媽咪都去咗party啦！」 全女班賀佳節 全女班慶祝聖誕的超盈，被問到現時有沒有男友即大發嬌嗔，她說：「我都冇拍拖，所以同女仔朋友慶祝。」  另一邊廂，何超雲前晚則穿上厚厚的毛毛褸，手挽JimmyChoo手袋與女性朋友現身灣仔君悅酒店，吃晚飯慶祝聖誕節，打扮得體的超雲完全是一副「何家淑女」模樣，難怪她深得賭王的痛錫。此外，前晚約11時，寇鴻萍細女唐貝欣相約朋友到母親開設的夜店FEVAR飲酒，同樣是全女班慶祝。  採訪：梁錦雯  攝影：林德雄
20081227-108,20081227,108,羅霖闔家君悅敍天倫,羅霖闔家君悅敍天倫 賭王千金何超雲前晚在灣仔君悅酒店慶祝聖誕節，同場還有羅霖和劉坤銘一家五口，以及東亞銀行主席李國寶和太太，一家共享天倫同度佳節，雖然近日全球金融海嘯，不少富豪身家大縮水，但仍無損過節好心情。 劉坤銘與太太羅霖及3名兒子，在君悅酒店享用聖誕大餐，剛滿3歲的幼子Jonathan由工人手抱，十分精靈可愛。至於李國寶夫人潘金翠則穿上紅色套裝，十分應節，李國寶兩次向在場記者講「MerryChristmas」，心情看來不俗。  採訪：梁錦雯  攝影：林德雄
20081227-109,20081227,109,唐禹哲獎項決定行程,唐禹哲獎項決定行程 台灣男歌手唐禹哲昨午在青衣為新碟《D新引力》舉行香港預購簽名會，近400名fans排隊等候。談到在前晚新城勁爆頒獎禮中獲得全國樂迷投選勁爆突破表現大獎，阿哲認為能夠得到大家認同，感到十分高興。至於稍後會否出席其他電台和電視台舉行的頒獎禮，他笑謂要看頒獎禮有沒有看上他才編排行程。
20081227-110,20081227,110,張衞健菲律賓補擺酒,張衞健菲律賓補擺酒 張衞健和張茜已定於1月12日菲律賓補擺喜酒，他們大手筆請了約200名好友遠赴當地分享喜悅，並包賓客機票和食宿。  早前健仔接受訪問表示鄭秀文、許志安、梁漢文和狄波拉也答應到賀，今次婚禮還得到當地政府和酒店支持，他希望可以大放煙花，辦一個難忘婚禮來𠱁老婆開心。
20081227-111,20081227,111,黃榕死守性感路線,黃榕死守性感路線 新紮𡃁模ECupBaby劉欣宜日前宣佈封胸，但擁32B上圍、曾與陳冠希（Edison）傳緋聞的黃榕雖然在娛圈打滾多年，卻堅決繼續行性感，09年更會以舞后為目標進發，自言視蔡依林為學習對象。 苦練霹靂舞 黃榕近日愛上跳HipHop和霹靂舞，她表示明年2月14日情人節會為跳舞學校公演，昨日她在電話中說：「我一向有跳開HipHop，但霹靂舞就係3個月前先開始學，一跳就超鍾意，因為舞姿好型。」霹靂舞動作大，難度高，黃榕練習期間吃了不少苦頭，她說：「始終男仔力氣大啲，練習起嚟比較容易掌握，我𠵱家都練到少少成績，可以倒立同一字馬。」  問到黃榕情人節公演時可會邀情人往欣賞？她說：「我暫時都冇情人，到時先算。」  採訪：比華利  攝影：黃偉雄  髮型、化妝：KathyL.（CiaoBella）
20081227-112,20081227,112,黃宗澤興奮奪金唱片,黃宗澤興奮奪金唱片 黃宗澤（圖）昨日在銅鑼灣慶祝新碟達金唱片銷量，是新人銷量之冠。問其歌唱成績比緋聞女友胡杏兒好，怕不怕杏兒失落，他則謙稱只是比她早出道。至於與黃宗澤同屬東亞唱片的王菀之昨在銅鑼灣出席活動，談到東亞歌手不出席港台頒獎禮，她說：「尊重決定，我唔係每個頒獎禮都參與，有意義先參加。」
20081227-113,20081227,113,被歌迷模仿嫌三嫌四馮仁昭四圍超：Hebe踩凸腩Fans「令人不舒服」 - 馮仁昭,"被歌迷模仿嫌三嫌四 馮仁昭四圍超：Hebe踩凸腩Fans「令人不舒服」 - 馮仁昭 台灣人氣組合S.H.E噚日喺九展舉行「S.H.E宇宙聯盟聖誕大派對」，同1,500位歌迷歡度BoxingDay，佢哋搞咗個「比你賤S.H.E模仿大賽」，有歌迷竟然擺偶像嘅緋聞上枱，分別扮演Ella嘅緋聞男友吳尊、同Selina傳過撻着嘅羅志祥，以及扮Hebe嘅緋聞情人周杰倫，𠱁到S.H.E拍爛手掌兼同假緋聞男友擁抱。 「好像懷孕一樣」 有參賽男歌迷模仿S.H.E，但係佢哋下身就只係着住條緊身褲，搞到下體現形，連S.H.E都睇到大皺眉頭，話男fans醜化佢哋。Hebe話：「好害怕，看到扮我的那個有大肚子凸出來，好像懷孕一樣，令人很不舒服。」Ella亦大踩男fans表現誇張，又唔打底令下體現形。  S.H.E嘅派對門票分為非會員價320蚊同會員價290蚊，雖然佢哋只係唱咗三首歌，但歌迷完全唔介意，仲睇得好投入。  S.H.E透露前日到銅鑼灣行街買禮物同食聖誕大餐，仲同工作人員交換禮物，Selina抽到Ella所送、寫住「love」同「you」嘅一對電話繩，佢話：「因為現場好多女生，她送這禮物是希望大家早日找到另一半呢。」"
