key,date,article_daily_id,title,text
20080903-209,20080903,209,08美國大選佩林是非纏身　奧巴馬支持率升至50%,"08美國大選 佩林是非纏身　奧巴馬支持率升至50% 美國共和黨全國代表大會第二天，壓軸戲是準總統候選人麥凱恩（JohnMcCain）女拍檔佩林（SarahPalin），正式成為美國史上第二名競選副總統的女性，寫下歷史。但在這歷史時刻，她的負面消息源源不絕，傳媒最新抖出她曾接受涉及賄賂的油商捐款、曾吸食大麻、曾嘲笑癌病政敵為「蕩婦」（bitch）……佩林頓成麥凱恩競選負資產，更令民主黨總統候選人奧巴馬（BarackObama）支持率首度飆升至50%，處於穩勝大選的安全線。 麥凱恩上周五宣佈44歲的佩林為副手，她支持擁槍權和反墮胎等立場，贏得黨內保守派喝采，但蜜月期只有一天。在傳媒猛挖她底蘊下，她周一承認17歲長女未婚懷孕，雖然黨內保守派、反墮胎人士和奧巴馬都指那是她的「家事」，令風波未鬧大，但有人質疑她治家不成怎能治國？ 捲入「州警門」案　被指濫權 至昨日（周三）共和黨大會第二天，佩林是非依然不絕。傳媒抖出，自詡廉潔的她2002年選阿拉斯加副州長時，曾收受油商VECO共4,500美元（35,100港元）捐款，VECO後被揭以非法途徑捐款，集團主席承認賂賄和貪污。她改革者的形象毀於一旦。  佩林又聲言反對國會胡亂撥款，說出任阿拉斯加州長後，曾成功阻止國會撥款興建一座「大白象」橋樑，但繼被篤破她其實曾主張要國會撥款建橋後，傳媒昨日又披露，她今年以來多番「伸手」要國會撥款助阿州建設工程，總資助達人均300美元（2,340港元），是全國之冠。  出任阿州州長，她又捲入「州警門」（Troopergate）事件，被指濫用職權，向州安全專員施壓，迫他辭退當州警的前妹夫，他不從，就將他革職。她正因州警門事件受查，私人律師費95,000美元（741,000港元），全由州政府支付。州警門調查估計在大選前有結果，《紐約郵報》指那結果可能成為麥凱恩競選的「10月驚奇」。 嘲政敵「蕩婦」片段YouTube熱播 雖然傳媒日前指她曾是鼓吹獨立的阿拉斯加獨立黨黨員報道失實，真相是她丈夫托德（Todd）兩度登記為該黨黨員，但傳言指她1994年曾陪丈夫出席該黨大會，可以成為她不愛國的「罪證」。  傳媒還挖出她個人操守問題。她2006年接受訪問承認曾吸食大麻，還說「我不能像克林頓一樣，指自己從沒吸進去」。她今年1月又在訪問形容戰勝癌魔的政敵格林（LydaGreen）是「蕩婦」，嘲笑她是「一種癌症」，訪問片段正在YouTube熱播。  是非一大堆，講完都令人長吁一口氣。麥凱恩原想靠她攻陷女性和保守派票倉，給民主黨擲下一枚重磅炸彈，殊不知這枚炸彈炸人不成炸傷自己，黨內外如今都質疑他選錯人。喬治布殊政府一名前官員直言對選擇佩林「感到作嘔」，共和黨高層指麥凱恩選人未經深思熟慮，只在半年前見過佩林一面，於上周突然選了佩林，目的只為製造哄動效果。  哄動之後，結果蓋洛普最新民調顯示奧巴馬的支持率已跨越穩勝選舉的門檻，亦即達到50%，麥凱恩支持率僅43%。麥凱恩陣營急補鑊，除了強調佩林是在填寫「你是否對婚姻忠誠、有沒有使用過性服務」等70條問題及經全面審查後才獲選，又指她的負面消息是奧巴馬陣營的抹黑行動，也是重施打擊希拉莉的性別歧視伎倆。還有是派出10人阻止佩林親友接受訪問，以免講多錯多。  美聯社/路透社/《今日美國報》   佩林是非簿 傳幼子是孫兒 ‧網上傳聞她患唐氏綜合症的四個月大么子特里格，是她長女布里斯托爾所生，因她懷胎七月時身形太苗條 長女未婚懷孕 ‧承認17歲長女布里斯托爾未婚懷孕 夫挺阿拉斯加獨立 ‧傳聞曾加入阿拉斯加獨立黨，主張阿拉斯加獨立，後證實入黨的是她丈夫，她1994年曾伴夫出席該黨大會 涉濫權 ‧捲入州警門案，施壓要州安全專員炒掉她的前妹夫，他不從即將他革職，州議會正調查她是否濫權 收涉賄油商捐款 ‧2002年角逐阿拉斯加州副州長時，收受涉賄賂的油商VECO共4,500美元捐款 屢向國會要錢 ‧今年多番伸手向國會要錢資助阿拉斯加建設，總資助達人均300美元，屬全國之冠 嘲政敵「蕩婦」 ‧接受訪問形容戰勝癌魔的政敵格林是「蕩婦」，嘲笑她是「一種癌症」"
20080903-210,20080903,210,未來女婿愛爆粗,未來女婿愛爆粗 美國共和黨準副總統候選人佩林，承認17歲長女布里斯托爾（Bristol）未婚懷孕五個月，但會將腹中嬰兒生下來，還會跟嬰兒爸爸結婚。但她的未來女婿卻在社交網頁MySpace上表明不喜歡小孩，又用粗言形容自己是「紅脖子」（F---ingRedneck），即是反建制的中下階層人士。 自爆不想要小孩 布里斯托爾男友是約翰斯頓（LeviJohnston），跟她一樣是17歲，入讀瓦西拉高中。約翰斯頓加入曲棍球隊，曾和布里斯托爾兄長、現正服軍役的Track做隊友，表現出色得24場射入24球，但去季勇戰受傷，脛骨撞裂。  約翰斯頓在MySpace自爆正談戀愛，但不想要小孩；喜歡和一大班男仔玩耍、玩曲棍球、露營、釣魚、玩滑雪板、踏單車、射擊；又顯露粗野一面，說「你幹我？嘿！我回敬踢你的屁股呢！」（Yaf---withmeI'llkick[your]ass）。  約翰斯頓「F---ingRedneck」形象曝光，可能對「麥佩」配構成壓力。但美聯社報道，他將出席共和黨全國代表大會，看未來岳母接受副總統提名。他媽媽前日向傳媒說，他和布里斯托爾結婚絕對無壓力，因為兩人早已計劃結婚。  美聯社/美國《紐約郵報》
20080903-211,20080903,211,工會煽動組軍政府　曼谷市民說不,工會煽動組軍政府　曼谷市民說不 總理沙瑪在曼谷頒佈緊急狀態，由軍方負責恢復首都治安重責，令市內瀰漫軍事鎮壓的緊張氣氛。但這時竟有反對派進行策反，提出由軍人組織新政府，但軍頭強調軍隊不會用武力鎮壓示威，也無意發動軍事政變。  昨日聲援反政府示威的曼谷都會電力局工會領袖皮安，向陸軍總司令阿努蓬策反，要求沙瑪辭職、解散國會眾議院和成立軍人政府。  但武裝部隊最高司令汶頌表明，親政府和反對派支持者互毆令局勢緊張，實施緊急狀態是正確的，但他強調軍方站在人民一邊。阿努蓬則表明，軍方不會武力驅趕佔據總理府的示威者，「也不會發動政變，我們尋求以國會機制解決問題」。朱拉隆功大學政治分析家巴尼坦認為，軍方選擇扮演仲裁角色，反映軍方明白發動政變推翻民選政府的後果。 「不要失去民主自由」 事實上，曼谷市民都反對軍人執政。Phanchita是應屆女子大學畢業生，她說，十多年前泰國大學生為爭取民主自由而遭軍隊血腥鎮壓，今次軍隊介入政權只應屬過渡性質，「最終要選出民主政府，不要失去得來不易的民主自由。」  華僑楊小姐也不支持由軍人組織政府：「我希望軍隊不要偏幫任何一方，不要影響民主自由。」她直言，泰國政局越來越亂，當地人卻越來越不關心政治，只是擔心會影響當地經濟。但也有例外，從事美容生意的Wannfri說：「不管是軍人干預抑或協商，最重要是盡快平復局勢，不要再讓政局動盪下去。」
20080903-212,20080903,212,共和黨全國大會爆首枚政治炸彈08美國大選：佩林認長女未婚懷孕,"共和黨全國大會爆首枚政治炸彈 08美國大選：佩林認長女未婚懷孕 美國共和黨前日（周一）舉行全國代表大會首天，一枚「政治炸彈」爆炸。共和黨準總統候選人麥凱恩（JohnMcCain）夥拍的阿拉斯加州女州長佩林（SarahPalin），承認未成年的女兒未婚懷孕，但不會墮胎。儘管大會代表挺她，民主黨總統候選人奧巴馬（BarackObama）也不搞抹黑，但傳媒挖出佩林負面新聞越挖越多，輿論指她可能成為麥凱恩競選的負資產。 麥凱恩上周五宣佈佩林是競選拍檔，由於她反墮胎等立場，贏得黨內保守派認同。但她出任阿拉斯加州長僅兩年，選民對她陌生，所以傳媒猛挖她底細。網上日前更傳言，她患唐氏綜合症、僅四個月大的幼子特里格（Trig），其實是她17歲長女布里斯托爾（Bristol）的孩子。  為了闢謠，佩林周一發表聲明，承認愛女在求學階段未婚懷孕五個月，但孩子還未出世，女兒將生下孩子，然後和孩子的爸爸結婚。她說：「我們漂亮的女兒布里斯托爾告訴消息，作為父母，我們知道那會令她成長得比我們預期的快。布里斯托爾要面對大人的責任，她知道我們會給她無條件的愛和支持。」  言詞懇切充滿父母情，佩林初步得到黨內支持。麥凱恩更表示一早知情，指女兒未婚懷孕不應是問題。南卡羅來納州共和黨主席戴森說：「這不會對她構成損害，這是家庭問題。」反墮胎人士則說，最重要是她女兒不是要墮胎。 奧巴馬拒抹黑牽扯孩子 奧巴馬也保持君子風度，強調那是佩林的家事：「我媽媽18歲生我，要面對很多家庭問題。總之孩子不應成為政治話題，這不是我們追求的政治。」  女兒未婚是家事是社會問題，但佩林還有其他負面新聞。一則是她捲入所謂""Troopergate""即州警門事件，她被指運用權力，迫州公安委員會專員莫尼根炒掉州警伍滕，伍滕是她前妹夫，曾用電槍襲擊繼子，又威脅殺死佩林父親查理斯。 或成麥凱恩競選負資產 她也被指出1990年代原是阿拉斯加獨立黨成員，爭取阿拉斯加公投脫離美國獨立，她更常將「阿拉斯加為先」口號掛在嘴邊。這跟麥凱恩「國家為先」立場有別，黨內保守派也可能介意，傳媒指這令佩林可能成為麥凱恩競選負資產。  佩林爭議纏身，《今日美國報》和蓋洛普調查，如果麥凱恩不能完成總統任期，只有39%受訪者認為佩林勝任做副總統。  美聯社/路透社/美國廣播公司/《紐約時報》/《今日美國報》/《華盛頓郵報》"
20080903-213,20080903,213,親泰王外長突請辭　沙瑪勢危傳今早宣佈下台,"親泰王外長突請辭　沙瑪勢危 傳今早宣佈下台 泰國政府在曼谷頒佈緊急狀態令第二天，反對派號召的全國大罷工，響應者寥寥可數，驟眼看示威者的過激行動未獲廣泛支持，但入夜後，65歲的外長德．汶納突然請辭。德．汶納和泰王蒲眉蓬關係密切，他辭職被視為是泰王對總理沙瑪政府有保留，意味沙瑪倒台日子不遠。曼谷流傳沙瑪今早發表電台講話宣佈辭職。 德．汶納本是退休外交官，曾是泰國駐華大使，駐美大使及駐聯合國大使。今年7月，泰王頒佈御令，任命他出任外長，他走馬上任，就泰柬邊境柏夏威古寺爭議，成功修補雙邊關係後，昨晚向沙瑪提出辭職。 是沙瑪倒台的一步 《泰叻報》網站報道，德．汶納辭職的原因，是疲於向國際解釋泰國近期混亂政局的變化；《民族報》則報道，沙瑪曾盡力挽留他，希望他留任至目前的政治危機化解為止，但他以照顧患重病的太太為理由拒絕。  但政治分析家汶耶干指，德．汶納曾在泰王首席私人秘書處工作，在沙瑪頒佈緊急狀態令一天後離職，意味泰王對沙瑪上台七個月的政府有保留，「是這個搖搖欲墜政府邁向終結的另一步」。  如果這代表泰王的態度，這個態度加上負責恢復曼谷治安的陸軍總司令阿努蓬採中立立場，拒絕使用武力驅趕佔據總理府九天的反對派示威者，那意味能穩定泰國大局的兩股勢力──泰王和軍方，都不支持沙瑪政府。 響應罷工者寥寥可數 沙瑪頒令緊急狀態令後，反對派領袖林明達接受《曼谷郵報》訪問時，首次拋出四點妥協方案：第一，當局承諾不作有利政府的修憲；第二，暫停大型基建項目；第三，推政治改革；第四，接受法院對柏威夏古寺的裁決。柏威夏古寺位於柬泰邊境有爭議地區，沙瑪政府原支持柬埔寨將古寺申報為世界遺產，但憲制法庭6月裁定違憲。  林明達強調大前提是沙瑪必須下台，新總理人選須是教育部長頌猜或財長素拉蓬，但沒解釋選中兩人的原因，並預計沙瑪數天內請辭。他指妥協方案若獲接納，就會結束示威集會。他說，「人們不會原諒沙瑪」，「新總理必須廉潔」。  總理府昨晚仍有5,000名反對派支持者聚集，沙瑪助手指他對軍方仍未驅逐示威者感到震驚。示威者有人席地而睡，但一組人卻在一名前士兵指引下，學習自衞術及如何防避軍警進攻，一名66歲婆婆也拿起棍棒，要死守總理府。  曼谷昨天流傳沙瑪最快今早辭職，指他會於7時30分（香港時間8時30分）在泰國電台作出宣佈。由於泰國國會昨天起就財政預算進行兩天辯論，分析家又估計，一旦預算案獲通過，沙瑪政府會宣佈解散國會，提前大選，因為執政黨可以運用撥款大搞基建或「派糖」催谷選情。  至於反對派昨天號召43個國營工員大罷工行動，響應者寥寥可數。國營電力公司100人請病假，但政府機關水電沒截斷，巴士和火車如常行駛，泰航航班沒受影響。  路透社/法新社/泰國《曼谷郵報》"
20080903-214,20080903,214,第一夫人呼籲團結救災,"第一夫人呼籲團結救災 共和黨全國代表大會昨天在明尼蘇達州聖保羅市揭開序幕，本是為準總統候選人麥凱恩造勢，但卻被颶風「古斯塔夫」搶去風頭，但共和黨人卻主動搞賑災籌款，搶回部份傳媒焦點。  全國大會開始15分鐘後，共和黨全國大會主席鄧肯（MikeDuncan）要求各代表致電紅十字會捐款賑災。總統喬治布殊要到墨西哥灣指揮救災，無法出席，令首晚焦點落在第一夫人勞拉（Laura）和麥凱恩夫人辛蒂（Cindy）上。  勞拉一出場就說，「我們都是美國人……今天我們的首要任務，是確保墨西哥灣區沿岸居民的安全和福祉」，呼籲國民全力籌款救災；辛蒂也作類似呼籲。布殊透過視像會議向黨代表發言。 風災災民料今天可返家 大會在一小時內籌得780萬港元後，麥凱恩的助手更宣佈，上月籌得至少3.666億港元競選經費，是共和黨歷來單月最大筆捐款。颶風登陸後減弱成一級風暴，並未造成重大破壞，墨西哥灣沿岸疏散的200萬居民，今天可望重返家園，全國大會亦可望恢復正常。  在會場外有約10,000人示威，但有反戰示威者襲擊部份黨代表和搗亂，警方用胡椒噴霧鎮壓，拘捕284人。  麥凱恩要靠今次大會提高支持率，但哥倫比亞廣播公司（CBS）和《紐約時報》的最新民調顯示，麥凱恩的支持率為40%，落後對手奧巴馬8個百分點；而蓋洛蓋的民調結果也顯示，麥凱恩的支持率為43%，落後奧巴馬7個百分點。  美聯社/法新社/美國廣播公司"
20080903-215,20080903,215,華婦攜子體驗民主代價,華婦攜子體驗民主代價 泰國政局陷入膠着狀態，首都曼谷繼續實施緊急狀態，市面卻生活如常，有家長攜同幼兒，有中學生趁不用上學，到總理府聲援反對派，以實際行動支持爭取民主自由。支持及反對政府兩大陣營舉行燭光集會，可能再次爆發衝突，記者感到外弛內張。  記者昨日中午到支持總理沙瑪的人民力量黨設於皇家田廣場的大本營，只見約50名紅衫軍正吃午飯，廣場上並有幾百隻鴿子覓食，相對佔據總理府的近萬名反對派支持者，場面顯得冷清。有紅衫軍對記者說，沙瑪支持者傍晚會有聲援大會。  記者隨後到反對派陣營，在通往總理府正門大街通道，有配備警棍及盾牌的防暴軍警戒備，並且築起鐵絲網，防止紅衫軍再衝擊反對派。   直播最新形勢打氣 記者在反對派佔據的總理府，感覺有異於紅衫軍陣營的冷清場面。總理府內仍然堆滿物資及擠滿反沙瑪政府的支持者。義工忙於派發免費午餐、飲品、濕紙巾和果汁沙冰給長駐及聲援的支持者果腹消暑解熱，更設有救護站，派發藥物給有需要人士。  部份連日來據守總理府的反對派支持者選擇躺卧在草地，或找個陰凉處來個小睡，有人繼續拍打膠手掌，為台上現場直播最新形勢的講者打氣，也有黃衫軍在總理府大樓正門席地而坐把關。  有黃衫軍對記者說，晚上情況較嚴峻，紅衫軍隨時會來衝擊。由於連日晚上均有大型活動，不少反沙瑪政府的民眾前來聲援。  記者所見，反對派連日來雖然盤據總理府，卻自律禁足，沒有闖入大樓倒亂，只開放總理府大樓地下洗手間，為聲援的民眾提供方便。反對派又在總理府食堂設置寬頻上網服務，隨時了解最新事態發展。 昨日有幾名高中女生到總理府聲援反對派，其中當地華僑鄭美媚說，其任公務員的母親一直是他信和沙瑪的支持者。但鄭與很多同學一樣支持反對派，又經常與父母談論政治問題，前晚獲得母親同意下，與同學專程往總理府聲援反對派，希望為堅持自己信念的反對派打氣。  做小生意的Nongyao昨攜同8歲兒子Chusitt到總理府，她說，92年學生爭取民主運動，遭軍隊血腥鎮壓；06年軍事政變迫使他信下台，現在再發生政局變化，希望給兒子實地體驗爭取民主自由，是要付出代價。  又有年輕母親抱着才4個月大的嬰兒，跑到總理府給反對派打氣，藉此向仍然未懂事的兒子灌輸民主意識。
20080903-216,20080903,216,軍中溫和派也不挺沙瑪,軍中溫和派也不挺沙瑪 泰國局勢發展，還看軍方。但軍中，撐反對派的強硬派失勢，溫和派當道，軍事政變可能性不大。  佔據總理府的反對派示威者相信獲軍方撐腰，空穴來風必有因──反對派領袖詹龍是前軍方將領，跟軍中強硬派有聯繫，包括國家安全司令部前副司令潘洛和前情報主管普拉松，潘格揚言詹龍若被捕，他會牽頭示威。  潘格曾涉及暗殺前總理他信的陰謀，普拉松前年有份參加推翻他信的政變，兩人對他信和他的傀儡沙瑪都極度不滿。前年他信改組軍方，試圖安排10名親信候補駐守首都曼谷的第一師軍官，結果遭軍方發動政變推翻。  這次政變後，強硬派失勢了。去年軍方改組，由溫和派阿努蓬出任陸軍總司令，成為軍方第一人。雖然是溫和派，阿努蓬曾參與推翻他信政變，被指為他信傀儡的沙瑪，他自然不站在他一邊。  綜合外電
20080903-217,20080903,217,尼日利亞為奧巴馬籌款,"尼日利亞為奧巴馬籌款 美國民主黨的奧巴馬創造歷史，成為美國首位黑皮膚的總統候選人，非洲人也感光榮，甚至替他「籌款」。非洲國尼日利亞上月就舉行了一場「非洲人支持奧巴馬」籌款宴會，但美國法例規定候選人不得收受海外政治捐獻，結果連累奧巴馬被質疑違法。  「非洲人支持奧巴馬」組織，於上月11日在拉各斯籌辦晚會，數百名流商賈每人付逾2,000美元（15,600港元）。反貪官員到場向組織負責人兼尼國證券交易所主席問話，但她聲稱是自發籌款，籌得款項會用來登廣告號召公眾為奧巴馬祈禱，卻不會輸送給奧巴馬陣營。  因沒觸犯法例，尼國沒再追究，但輿論撻伐，尼國人大多數活在赤貧中，支持奧巴馬太奢侈。奧巴馬陣營則矢口否認和尼國籌款事件有關。  美聯社"
20080903-218,20080903,218,泰旅遊業損失135.7億,"泰旅遊業損失135.7億 泰國政局持續動盪，遊客紛紛退房、退團或取消到泰國旅遊計劃，還把原訂在泰國舉行的會議及展覽活動押後。旅遊業界初步估計，政治不穩可能造成至少600億銖（約135.7億港元）損失。  旅遊業佔泰國整體經濟11%，泰國旅行社協會主席阿波乍里（ApichartSankary）指出，10月是當地旅遊業高峯期開始，隨着當局實施緊急狀態，已嚇走外國遊客到泰國旅遊的意欲，歐洲旅客訂房和訂團人數較去年大減10%，中國遊客也被嚇怕，沒有在京奧結束後大批湧現，連泰國本地遊的旅行團也有90%要等消息。若示威持續到下個月，旅遊業肯定大受打擊。  泰國旅遊協會原先估計今年旅遊收益高達6,000億銖（約1,357億港元），若按10%遊客打消到泰國旅遊的數字計算，估計損失至少600億銖。  路透社/中通社"
20080903-219,20080903,219,麻生自詡最有資格任首相,麻生自詡最有資格任首相 日本首相福田康夫前晚突然辭職，執政自民黨昨召開緊急會議，敲定本月22日選舉黨總裁，據照傳統，總裁將出任首相。被視為熱門人選的自民黨幹事長麻生太郎，毫不諱言自己「最有資格接替福田」，率先表明參加黨總裁選舉。  現年67歲的麻生，去年9月已曾和福田爭逐總裁一職，最後落敗。他曾任總務相、外相，福田上月改組內閣，委任他為幹事長。他2000年至05年任外相間鼓吹「中國威脅論」，曾否認南京大屠殺，又曾發起漫畫外交，宣揚日本文化。  除了麻生，56歲前防衞大臣小池百合子，也獲黨內中青和少壯派支持。她對參選不置可否：「這不只是自民黨危機，而是日本危機，望能和大家共度時艱。」  福田去年71歲登場，跟前任安倍晉三一樣，不出一年辭職，引起輿論責難。雖然他說為了化解政治僵局而辭職，但日本《每日新聞》社論說：「這是不負責任的政治……損害國家利益。」東京一名47歲營業員說：「我對政治再沒期望了。」 日本近20年換13首相 日本近20年換了13任首相，短命政府難推動施政，分析家認為反映自民黨病入膏肓。一橋大學政治學教授加藤哲郎指，民主黨欠缺強勢有才幹領袖，即使換首相，也未必能在明年大選勝出。  自民黨內派閥眾多，人氣低首相都被逼宮撤換，支持率僅29%的福田也有傳是被逼宮。日本實施兩黨制本可刷新一黨獨大的腐敗局面，問題是最大在野黨民主黨內反黨魁小澤一郎的鬥爭加劇，兩黨制未必成事。  法新社/美聯社/中央社
20080903-220,20080903,220,不滿改革緩慢　抗爭行動升級昂山素姬拒醫生檢查,不滿改革緩慢　抗爭行動升級 昂山素姬拒醫生檢查 緬甸民主領袖昂山素姬（AungSanSuuKyi）抗爭行動再升級，繼早前拒見聯合國特使甘巴里（IbrahimGambari）和拒絕接收糧食，她前天（周二）拒絕跟軍政府勞工部長昂基會晤，也拒讓私人醫生替她檢查身體，抗議軍政府政治改革進展緩慢。 緬甸軍政府喉舌《緬甸新光報》昨報道，軍政府應甘巴里要求，周一透過昂山素姬的律師基溫（KyiWin）向她放話，說安排昂基翌日跟她會晤，但她透過基溫知會當局，她不願見昂基，也拒絕讓私人醫生來替她檢查身體。報道說：「除了基溫之外，昂山素姬現時任何人都不想見。」  她所屬的政黨「全國民主聯盟」發言人表示，他們暫時不清楚昂山素姬為甚麼不肯見昂基和醫生，很可能是「她不滿民主改革會談沒有進展，也沒有落實時間表」。 律師沒否認絕食傳聞 63歲的昂山素姬，自上月中起一直拒絕接收全民盟送過來的食物，一度惹人揣測她進行絕食抗議。基溫周一探望她，她說自己消瘦了、覺得疲累。基溫對她的絕食傳聞沒作出證實或否認。  兩人會晤，據悉就當局違法延續對她的拘禁進行磋商，研究上訴的可能，因為根據軍方的法例，當局在沒起訴下只能拘禁某人五年。軍方自2003年5月開始軟禁昂山素姬，五年期限早已屆滿。  昂山素姬過去19年，超過13年被軟禁在仰光的寓所，糧食是靠全民盟每天送過來，但她自上月15日起一直拒絕接收食物補給，令外界關注她的健康情況。  美聯社/法新社
