key,date,article_daily_id,title,text
20081119-99,20081119,99,隔牆有耳：華仁秘聞三嚿任睇 - 李八方,"隔牆有耳：華仁秘聞三嚿任睇 - 李八方 港、九兩間華仁書院專出政商名人好多人都知，但原來佢哋嘅幕後主事人喺回歸前曾經一度諗過放棄辦學，好彩最後關頭佢哋決定留低，同香港人共渡甘苦、跨過九七，今時今日莘莘學子，同慕名而至嘅家長，先有機會繼續報讀呢兩間名校。呢啲秘聞八方點解會知？皆因有本800幾頁嘅歷史書囉！ 擔心回歸想撤出香港 華仁係天主教學校，來自愛爾蘭嘅耶穌會會士好多年前接咗嚟做，教學生用知識幫助窮人，辦得有聲有色，八方噚日去咗耶穌會神父來華八十年事跡書介會，就撞到馬丁李柱銘、梁家傑兩位政界校友，又見到唔少投身教育界嘅華仁仔。本歷史書《JESUITSinHONGKONG,SOUTHCHINAandBeyond》有800幾頁，厚過《黃頁》重過磚，八方一睇，竟然發現一段鮮為人知秘聞。  原來八九年六四事件後，耶穌會諗過應唔應該繼續留低，當時香港人心恐共，擔心香港赤化後冇好日子過，神父憂慮都唔係冇道理，佢哋唔單止想唔搞靜修院同港大嘅宿舍利瑪竇堂，最得人驚係一度考慮唔辦學，停辦兩間華仁書院！  八方睇完驚魂未定，即刻問馬丁知唔知呢件事，佢聽到都嚇一跳，「唔係啩，完全未聽過！」其他校友亦好愕然，似乎對呢件事都聞所未聞，正當大家狐疑之際，兩間華仁嘅校監周守仁神父出現，證實咗呢個講法。  FatherChow話，當年佢哋20、30個會士開咗個大會，傾耶穌會士應唔應該撤出香港，愛爾蘭會士人數稍多，絕大部份人都覺得要留低，但有受過中共苦頭嘅會士就好擔心，驚97後會畀人拉去坐監，又怕失去宗教自由，最後由省會長吳智勳神父發出聲明，表明耶穌會留守香港同澳門服務，兩間華仁先有得留低。  當年聲明話耶穌會留守港澳，係因為要繼續幫助窮人，因為窮人冇得揀，會士要同佢哋共進退。呢本記載耶穌會喺香港80年歷史嘅書由愛爾蘭神父莫禮善寫，入面仲有200幾張珍貴嘅歷史圖片，想知多啲秘聞，可以去兩間華仁買，每本只係300蚊。  mailto:pf_lee@appledaily.com"
20081119-100,20081119,100,嘉欣預演婚禮　大劉致電恭喜甘比坐月忽然出巡,嘉欣預演婚禮　大劉致電恭喜 甘比坐月忽然出巡 李嘉欣與舊愛劉鑾雄（大劉）之間有十多年恩情，緣份非常微妙。昨日本來仍在坐月的大劉愛將甘比，自生女後首度公開露面，陪伴大劉在福臨門吃飯，獲12名保鑣貼身護駕，非常架勢。巧合的是，昨日正是嘉欣婚前最後一次開工，在上海穿上鑲有萬顆水晶的低胸婚紗行騷，恍如預演婚禮一般，她更透露獲大劉親身恭賀結婚。 李嘉欣即將與許晉亨結婚，昨日她在上海太平路出席「CRYSTALLIZED施華洛世奇元素」婚禮滙展。下午約3時半，嘉欣先穿便裝在場內參觀展品，之後才入後台換衫，在模特兒行騷後壓軸出場，她所穿的低胸婚紗，由美國設計師ElieSaab設計，鑲了逾一萬顆水晶，非常高貴。 生日求婚 嘉欣稱收8卡鑽戒 當嘉欣由旋轉舞台走出來時，現場有大會男高層穿禮服上前，又有花仔花女送上水晶花球等，令嘉欣恍如預演婚禮一樣。事後被問到大劉和甘比巧合地與她同日現身，會否感到不開心時，嘉欣以普通話說：「不會，我們是好朋友，他已經親身恭喜我。」會否覺得事件十分巧合？她說：「不會，每天都有很多巧合。」大劉似乎特別重視她？她說：「我和他是好朋友。」  嘉欣更大方談及許晉亨求婚和結婚等事，只是婚禮日期仍然保密。被問到待嫁心情時，她說：「有一點點興奮和緊張，現在一切順利，我工作比較忙，交給男友處理。」她謂婚禮只會請至親到場，沒有圈中人，問她會否怕得罪人？她說：「這個是我自己的日子，我喜歡就行。」她又謂婚後會為圈中朋友再作安排，或者舉行派對慶祝。  嘉欣說：「我一生中有兩個特別的年份，1988年我入行，到現在20年，讓我感到驕傲和開心，我也有珍貴的經驗，2008年是很重要的一年。」問到本月23日和24日那天才是她結婚的日子？嘉欣說：「日子隨時會轉，Julian（許晉亨）和我都不會在口中作實。」李嘉欣也不回應一億禮金及500萬婚禮傳言，只表示籌備一年，希望有一個浪漫婚禮，不能用數字來衡量心思和心意。  問到許晉亨如何向她求婚時，嘉欣說：「傳統方法，onekneedown（單膝跪地），之後問我：『willyoumarryme?』」問她當時如何回答？她甜笑說：「我沒回答。」其後又續說：「其實那天是我07年生日，在國外求婚的。」又承認男友用8卡鑽戒求婚。有傳嘉欣已懷孕，對此她說：「這一刻不是，但順其自然。」 人鏈護駕 甘比未收身現疲態 無獨有偶，甘比自上月底誕女後，昨日也首度公開露面。中午約12時45分，大劉先乘坐自己的48車牌Benz到達福臨門，約十分鐘後，仍在坐月期間的甘比坐CC8車牌Benz現身，不施脂粉的她仍留着一頭長髮，面容有點疲乏，身穿杏色真皮亁濕褸、碎花裙及長靴包到實。產後未收身的甘比腰腹仍然突起，但她身手如常敏捷，在保鑣護駕下快步走入福臨門。  大劉與甘比匆匆用餐約40分鐘後，甘比先於下午約1時半離開，問到她何時為女兒擺滿月酒，甘比充耳不聞，大劉派了12個保鑣在現場圍成半圓形人鏈包圍福臨門出口，隔開現場約40名記者，場面架勢誇張，連電車乘客及外籍人士均紛紛舉機拍照，探頭八卦。約5分鐘後，大劉也跟着離開福臨門，甘比返回梅道一號寓所，大劉則回華置上班，其後他約於4時45分離開公司，直駛甘比寓所探望，逗留約一小時後離開。至於呂麗君昨日則全天留在家中。  採訪、攝影：曾小嘉、王崇穎、娛樂突發組 過氣情人巧合暗戰 李嘉欣與劉鑾雄一度相愛，分手後大劉更以TheOne名義送上全版廣告為女方慶祝生日。能成為情人自是有緣，兩人情緣已盡，但種種「巧合」還是停不了，鬥搶風頭做傳媒焦點，儼如一場暗戰。 李嘉欣  10月23日：有人致電報館，指李嘉欣與許晉亨已於婚姻註冊處登記排期結婚。  昨日：李嘉欣現身上海出席婚前最後一個活動，穿婚紗亮相。  11月23日：李嘉欣與許晉亨舉行500萬婚禮結婚。    大劉  10月23日：大劉女友呂麗君發聲明，宣示正印身份及質疑甘比初生女兒的父親是甚麼人，全城嘩然。  昨日：大劉與還未坐滿月的甘比現身福臨門。  11月23日：甘比女兒滿月之喜。    資料來源：《蘋果》資料室 專家話：坐月外出手尾長 富豪劉鑾雄的愛將甘比（陳凱韻）上月23日誕女，可是她昨日仍在坐月期間，已急不及待陪大劉外出午膳。中醫師張家康指產婦不宜於坐月期間外出，他昨日說：「產婦生完BB身體會好虛弱，加上呢排天氣凍咗，好容易吹風受凉會染上外感，手尾好長。如果一定要出街，都要注意保暖身體，唔好着短裙同闊領衫，驚會冷親。」  堪輿家麥玲玲也認同產婦坐月外出犯禁，她昨日在電話中說：「產婦生完BB個人能量會弱咗，未恢復身體出街會容易影響健康。」
20081119-101,20081119,101,男女家分兩日兩地擺喜酒嘉欣爆料結婚未經許家同意,男女家分兩日兩地擺喜酒 嘉欣爆料結婚未經許家同意 【上海直擊】李嘉欣和許晉亨的大日子逼近，兩人拍拖期間，一直盛傳許家兩老拒絕讓她入門。李嘉欣前晚自爆婚事無經許家兩老同意，是兩人間決定，但仍收到兩老送厚禮，而為了妥善安排男女家親友，婚宴將分兩天、兩個地點舉行。 李嘉欣將於周日（23日）與許晉亨結婚，近日卻傳出婚期推遲了一日，嘉欣也沒有澄清確實日期。最新消息是，原來嘉欣婚宴會一連兩天舉行，周日先在許家石澳大宅結婚，獲邀的50多位賓客全部是男家的至親，女家方面就只有嘉欣的母親和姊姊有份出席。  據悉李媽媽曾為此不太開心，孝順的嘉欣只好再與亨亨商量，女家下周一（24日）於石澳的鄉村俱樂部再擺喜宴，請女家至親，至於娛樂圈中友好，嘉欣只會在下月初補請朋友吃飯。嘉欣今次為婚禮特別在Valentino訂做了五件包括黑色、火紅、粉紅、杏色和金色，共約500萬元的晚裝，她日前更到中環作最後試身，近日消瘦了的她，更要將晚裝縮改尺寸。 先斬後奏 「兩位唔講任何感受」 嘉欣婚前繼續開工，前晚在上海出席「CRYSTALLIED──施華洛世奇婚禮概念展」，穿上婚禮晚裝。晚上10時正，嘉欣穿上由邱雪祺設計的粉橙色低胸婚紗，在10個保鑣護送下入場，引來全場哄動，同場另一嘉賓范冰冰即時被當透明。  嘉欣繼續大晒幸福，透露現時心情不錯，婚後不會退出，更指拍拖初期，亨亨已着她不要工作，她說：「佢𠵱家冇要求，不過佢知道我呢個trip（工作），佢都『吓』咗一聲。」她謂現時已38歲，不會不捨得結束單身日子，更粉碎了她來自不完整家庭的陰影。  有指許世勳夫婦是正統名門望族，不愛兒子亨亨娶明星，加上掌握亨亨經濟命脈，所以就算之前亨亨曾經和劉嘉玲、黎姿等拍過拖，都不能成為眷屬。嘉欣與亨亨拍拖後，也盛傳一直受到兩老反對，拒絕讓她入門。  外間經常指嘉欣得不到許家兩老歡心，未來老爺、奶奶對她倆結婚沒甚反應，她說：「寫乜都冇所謂，佢哋一早已經知道，都有出席我哋訂婚派對，係求咗婚幾個月之後舉行。」問她未來奶奶是否疼錫她？她說：「不嬲兩位都唔講任何感受，uncle、auntie送咗好多禮物畀我。我哋結婚冇經佢哋同意，但前幾日，佢都送咗一個好大嘅surprise畀我哋。」是否大屋呢？她說：「唔講。」亨亨前外父何鴻燊頻頻開口嫌棄亨亨，又指何超瓊甩難，嘉欣說：「我覺得每個父母都錫自己仔女，覺得佢哋最好，我哋（指何超瓊）係好朋友，大家都知。」 婚前癡纏 嘉欣回港即會亨亨 嘉欣下午和胞姊李嘉明、陳善之由上海返港，5時半到港後，隨即返回渣甸山寓所。至7時左右，亨亨坐了CK95車牌的座駕，到渣甸山接未婚妻，前往深水灣道80號的許世勳物業，他們在車上都要十指緊扣拖到實，十分煙韌。  此外，李嘉欣好友袁詠儀（靚靚），有傳獲邀出席婚禮，前晚靚靚出席在洲際酒店舉行的演藝人協會籌款晚宴時，表示仍未收到邀請，她又大爆嘉欣想生BB，她說：「有次我去睇演唱會撞到嘉欣，佢問我個仔點，我話佢好得意，我咪叫佢生番個囉，佢話佢都想呀，生多個優良品種嘅靚B幾好。」  採訪、攝影：曾小嘉、林妃、娛樂突發組
20081119-102,20081119,102,劉鎮偉炮製國產變形金剛馮仁昭四圍超：方力申、鄭中基化身機械人 - 馮仁昭,劉鎮偉炮製國產變形金剛 馮仁昭四圍超：方力申、鄭中基化身機械人 - 馮仁昭 劉鎮偉原本今年想再開拍電影《西遊記》，實行同周星馳打對台，但因為好多技術問題未解決，所以決定擱置落嚟，先搞中國版《變形金剛》，片名暫定為《機器俠》，《機器俠》主角由方力申擔任，其他機械人分別由鄭中基、胡軍同吳京等人演出。女主角係曾同黃曉明合演劇集《新上海灘》嘅內地女星孫儷，鄧麗欣（Stephy）就會客串一角。 重中國色彩 呢部戲月底就開拍，主要喺寧波同上海拍攝，預計出年暑假上映，部戲會有好多特技，除咗香港先濤會幫手搞部戲嘅特技外，仲會喺荷李活搵人做特技，雖然呢部戲以科幻特技為主，但劉鎮偉會加番重講情嘅部份，唔會機械人齋打咁悶。  部戲投資約五千萬，資金主要來自內地片商，由於係中國版機械人片，製造出嚟嘅機械人會好重中國色彩，等觀眾睇時有啲新鮮感。  此外，方力申、吳京同黃柏高噚日接受商台電話訪問，方力申早前拍攝電影《狼牙》，佢喺戲中一改斯文形象，化身打仔，佢話拍攝時吳京要求好高：「吳京要我一氣呵成做啲扭同踢腳嘅動作，我要連拍32個take先成功，覺得仲辛苦過當年游水，令我好有挫敗感。」
20081119-103,20081119,103,劉偉強唔使BoBo還片約,劉偉強唔使BoBo還片約 今年初淫照風暴爆發後，涉及事件的陳文媛（BoBo）盛傳到了美國結婚生仔，日前她與男友金紫耀乘搭私人飛機由溫哥華返港。 志偉等飲喜酒 原來BoBo與劉偉強還有片約，劉偉強前晚出席尖沙嘴洲際酒店舉行的演藝人協會籌款晚宴，談到會否找BoBo演出時，他說：「睇佢心情同情況點，佢同我簽咗4部，𠵱家仲有兩部。」劉偉強表示很久沒與BoBo聯絡，至於會否要對方履行合約，他說：「唔會，冇所謂，唔會迫佢還片約。」至於同場的曾志偉，被問會否找BoBo拍戲時說：「唔會，人哋息影，搵到好老公，希望佢擺酒請我飲。」  採訪：魯萍  攝影：葉君海、黃偉雄
20081119-104,20081119,104,馮仁昭四圍超：港產佳麗爭模特兒大獎 - 馮仁昭,馮仁昭四圍超：港產佳麗爭模特兒大獎 - 馮仁昭 現年22歲嘅關家敏（圖）大後日將代表香港，到深圳參加「第20屆世界模特小姐大賽總決賽」，屆時有嚟自61個國家同地方嘅佳麗角逐獎項，佢哋仲會着民族服裝、泳裝同晚裝火併一番。  關家敏話入模特兒界前係喺律師樓工作，呢次得到模特兒公司推薦參賽，雖然有壓力，但會盡力做到最好，佢仲話會以樂基兒同熊黛林做目標。
20081119-105,20081119,105,馮仁昭四圍超華星騷回味歌星最紅時　偉仔再唱矇矓夜雨裡 - 馮仁昭,馮仁昭四圍超 華星騷回味歌星最紅時　偉仔再唱矇矓夜雨裡 - 馮仁昭 東亞華星演唱會喺下月13日同15日喺亞洲國際博覽館舉行，華星出身嘅歌手如今個個喺樂壇獨當一面，大部份歌手已過檔東亞娛樂。據知參與今次演唱會嘅歌手除咗唱自己嘅歌之外，仲會演繹華星年代張國榮、梅艷芳同羅文嘅經典歌曲。大會好有誠意咁邀請梁朝偉喺下月13日嗰場做特別嘉賓，大唱佢首經典金曲《矇矓夜雨裡》。 斟華仔扮哥哥 據演唱會監製話翻查華星歌曲歷史，原來華仔係第一個唱張國榮（哥哥）嘅名曲《為你鍾情》，當年無綫簽華仔畀華星準備出碟，點知華仔錄完首歌就俾無綫雪藏，結果首歌輾轉落到哥哥手上，哥哥仲唱到大紅大紫。華仔版本嘅《為你鍾情》母帶仍放喺華星音樂庫，聽過嘅人話華仔嘅唱腔同哥哥好似。華仔喺電影《愛君如夢》中曾扮哥哥《大熱》嘅長髮造型，今次監製決定邀請華仔再扮哥哥嘅長髮風姿，不過華仔仲考慮緊，而佢只演出15號一場。  至於鄭秀文最近就努力喼弗，當晚會演唱《叮噹》同《熱愛島》等歌，大會提議佢以Nike眉再現舞台，佢仲會同舊愛許志安合唱多首情歌。另外，鄭秀文早前跟宣明會去蒙古探貧童，佢同啲小朋友一齊玩遊戲，雖然言語不通，不過大家用表情同歌聲去溝通。
20081119-106,20081119,106,馮仁昭四圍超：6號袁小曼　亞姐公投領先 - 馮仁昭,馮仁昭四圍超：6號袁小曼　亞姐公投領先 - 馮仁昭 20位候選亞姐前日喺中山遊覽孫文紀念公園，今屆亞姐採用全民投票形式，亞視高層葉家寶透露暫時以6號袁小曼同16號趙楊票數領先。袁小曼知道後話：「真㗎？但中國人口多，我有預計過可以暫時領先，增強咗自信，我會繼續叫身邊朋友投票。」趙楊就話：「我曾經參加網絡賽區，有咁多人支持當然開心，亦會增加信心。」
20081119-107,20081119,107,馮仁昭四圍超：國際小姐奪冠無暇尋愛 - 馮仁昭,馮仁昭四圍超：國際小姐奪冠無暇尋愛 - 馮仁昭 今屆國際小姐冠軍西班牙小姐（中）、亞軍哥倫比亞小姐（左）同埋季軍波蘭小姐噚日到尖沙嘴，接受首飾禮品。西班牙小姐話今日就會離開香港，最難忘嘅係香港夜景，今次佢都有抽時間去行街。問聖誕節會唔會同男朋友一齊慶祝？她話：「我未有男友，呢一年都要忙國際小姐嘅工作，所以冇時間識男友，等完成工作先有時間拍拖。」
20081119-108,20081119,108,馮仁昭四圍超：熊黛林愛風度勝高度 - 馮仁昭,馮仁昭四圍超：熊黛林愛風度勝高度 - 馮仁昭 熊黛林近日忙於宣傳電影《葉問》，扮演葉問老婆，其實以佢1.78米身高，搵男拍檔好難，就算現實生活，佢緋聞男友郭富城都唔及佢高。熊黛林日前接受內地傳媒訪問時話：「男士高度不重要，重要的是風度。」至於懶理熊黛林恨嫁嘅城城，早前接受台灣傳媒訪問，提到唔願講感情，佢話：「我只是想保護身邊出現過的異性朋友。」  資料圖片
20081119-109,20081119,109,馮仁昭四圍超：袁彌明拍拖一年恨嫁 - 馮仁昭,馮仁昭四圍超：袁彌明拍拖一年恨嫁 - 馮仁昭 袁彌明日前接受有線娛樂新聞台節目《主播會客室》訪問，佢自爆曾有人邀請佢出席飯局，不過佢一口拒絕，佢話：「所以我唔知自己個巿場價，其實唔係所有飯局都有下文，如果藝人想有下文就會有。」袁彌明坦言𠵱家有個拍拖一年多嘅圈外男友，仲視對方做結婚對象，男友好尊重佢嘅事業，袁彌明話：「如果佢叫我推性感騷，我會要佢畀番騷錢我，所以男友就冇反對。」
20081119-110,20081119,110,馮仁昭四圍超：洪金寶拍西片玩馬騮 - 馮仁昭,馮仁昭四圍超：洪金寶拍西片玩馬騮 - 馮仁昭 好耐冇喺荷李活拍戲嘅洪金寶，最近接咗一齣恐怖搞笑西片《WarMonkeys》，美國娛樂雜誌《TheHollywoodReporter》話部戲嘅故事係講洪金寶飾演嘅護衞，意外闖入一個地下研究院，唔小心放走咗一班受過軍訓嘅馬騮，雙方展開大激戰。影片集CG、槍戰、爆炸及功夫元素於一身，預計明年初開鏡。
20081119-111,20081119,111,娛樂開CHAT：ECupBaby同你Chat,娛樂開CHAT：ECupBaby同你Chat 各位娛樂版擁躉，有興趣和你的偶像傾談嗎？《娛樂開CHAT》請來ECupBaby劉欣宜擔任嘉賓，於今日（11月19日）與讀者談天說地，參加者同時有機會得到偶像珍藏禮物，只要你有webcam及headset，並於6:30pm準時登入 http://ent.appledaily.com即可，節目於當日7:00pm在《蘋果》網站直播。 
20081119-112,20081119,112,自揭新歡底郭羨妮戀尖嘴偉仔,自揭新歡底 郭羨妮戀尖嘴偉仔 沉寂一時的郭羨妮，日前在台慶頒獎禮上穿上中門大開的性感晚裝，艷絕全場成焦點。昨日又有報道指她電爆「通菜街林峯」，她表示男方是單身漢，大讚他說：「佢個樣似梁朝偉，把聲似張國榮。」 郭羨妮去年因為搭上有婦之夫陶大宇要避走加國過冷河，她表示仍很想拍拖，但堅稱要搵圈外人，昨日有報道指她約會「通菜街大少林峯」，電爆對方，又同車返香閨。 肯定非第三者 昨日郭羨妮在將軍澳電視廣播城出席《萬千星輝賀台慶》拜神時解釋說：「係普通朋友，朋友約食飯，已經識咗幾年，係女性朋友介紹，佢哋已經結晒婚，所以介紹畀我。我已經問過佢冇女朋友，佢身邊朋友我都識，已經起晒底。」男性友人被指是通菜街林峯，郭羨妮即刻解畫說：「唔似，佢個樣似梁朝偉，把聲似張國榮，係真㗎，我哋有一齊去唱K，不過唔好叫佢通菜街，好肉酸。」莫非是山頂梁朝偉，她笑說：「咁佢又冇咁有錢，尖沙嘴喇。」 穿性感裝尷尬 雖然頒獎禮無緣攞獎，郭羨妮深明搶鏡之道，一身中空性感晚裝，令全場嘩然，日前在台慶頒獎禮坐在汪明荃後面，而鏡頭又不時對準阿姐，故其透視胸常在鏡頭前出現。郭羨妮前晚在電視城綵排時說：「我現場睇電視都知，所以有時用手遮吓又拍吓手，避得都避，好尷尬嘅。」  對於無綫近期將緋聞男女藝員擺上枱宣傳，令沒有緋聞的楊怡未成話題人物，她即笑指曾經與吳卓羲傳過緋聞，於是她飛撲埋吳卓羲身邊，十分搞笑。  採訪：胡比、楊潔雯  攝影：陳俊強
20081119-113,20081119,113,馮仁昭四圍超：阿嬌、Edison誤傳合作拍戲 - 馮仁昭,馮仁昭四圍超：阿嬌、Edison誤傳合作拍戲 - 馮仁昭 內地網嘅報道有時都好有「創意」，噚日馮仁昭睇到單料，話英皇會搵王家衛執導拍部戲，搵因為淫照事件搞到雞毛鴨血嘅陳冠希（Edison）同鍾欣桐（阿嬌）主演，蔡卓妍（阿Sa）都有份客串，仲話明年初開拍。阿嬌同阿Sa飾演姊妹，分別愛上由謝霆鋒同陳冠希飾演嘅富豪兄弟，但霆鋒一聽到陳冠希個名就辭演。馮仁昭打電話問英皇電影同王家衛方面，佢哋都話冇件咁嘅事。
20081119-114,20081119,114,余安安拗柴扮Twiggy,余安安拗柴扮Twiggy 陳寶珠主演嘅舞台劇《我愛萬人迷》明年1月公映，監製甘國亮（左）同有份演出嘅余安安前晚亮相《蘋果》網站直播節目《娛樂開CHAT》。余安安帶咗佢喺劇中嘅造型相到場，佢話：「呢個造型係參照60年代最紅嘅模特兒Twiggy，所以個眼妝要超誇張，影嗰陣甘生仲提我學Twiggy嘅招牌拗柴腳甫士㖭！」大家可登入《蘋果》網站 http://ent.appledaily.com重溫節目。 
20081119-115,20081119,115,代表亞姐宣誓6號袁小曼食螺絲卸膊,代表亞姐宣誓 6號袁小曼食螺絲卸膊 20位準亞姐昨日在中山繼續進行拍攝及公益宣傳活動，其中6號袁小曼、11號林淑蓉及17號邱璐璠一同上台宣誓，但三人卻頻頻食螺絲，事後袁小曼指其他兩位佳麗沒有緊接她發言才令她大出洋相。 亞洲小姐的20位候選佳麗昨日繼續在中山拍攝外景及進行公益之旅，她們一行人出席粉紅絲帶宣傳活動，呼籲女士要定期作身體檢查。大會安排6號袁小曼、來自新加坡的11號林淑蓉及來自江西的17號邱璐璠，一同上台代表其他佳麗宣誓，袁小曼帶頭說起，但林淑蓉和邱璐璠卻沒有接下去。之後再說誓詞時又頻頻食螺絲，當眾出醜。  事後問到6號袁小曼當眾出醜一事，她說：「我係做足準備，第一個講嘢嘅人係我，但我講完之後，其他兩位佳麗又冇講，所以先搞成咁，我冇緊張，係大家冇共識。」 3號顏子菲走光 林淑蓉則坦言在台上說誓詞時很緊張，她說：「我第一次見咁多人仲要上台講嘢，不過我相信比賽時會冇問題，因為到時會有綵排。」邱璐璠則表示上台前三人有排過，但可能三人來自不同地方，不同語言，所以才會誤會，不過她相信到比賽時沒有問題，邱璐璠說：「希望之後做好啲，彌補今日做得唔好。」  3號顏子菲身穿背心裙坐下時不慎露底，她事後解釋可能因自己身形高䠷，但裙子比較短，才會不慎走光，下次會加倍小心。  採訪、攝影：曾小嘉
20081119-116,20081119,116,F.I.R.平安夜開騷會港迷阿沁後悔跪地求婚,F.I.R.平安夜開騷會港迷 阿沁後悔跪地求婚 台灣組合F.I.R.將於平安夜在香港亞洲國際博覽館舉行「F.I.R.飛兒樂團第十行星世界巡迴演唱會」，阿沁笑言屆時氣氛熱烈的話會將女友阿飛包成禮物送給歌迷。不過阿沁不肯透露是否真的向阿飛求婚，他坦言十分後悔曾於演唱會上作出此舉，因為在不同地方舉行演唱會時都要重複求婚這一幕。 下月24號平安夜F.I.R.將於亞洲國際博覽館舉行香港站巡迴演唱會，於台灣演唱會上阿沁曾拿出大鑽戒向女友阿飛求婚，問他會否在香港再重演這一幕，他表示很後悔做了這件事。  阿沁說：「當台灣演唱會求婚之後，每到一個地方都要做這件事，真的有點後悔。不過很多朋友都有問我借道具大鑽石，我已將愛散播給大家。」再追問阿沁是否於現實中已向阿飛求婚，他倆只笑而不答，含情脈脈互望。 扮聖誕老人派禮物 此外，F.I.R.打算唱廣東歌送給香港歌迷，阿飛表示自小是王菲以及草蜢的歌迷，不過她擔心自己唱廣東歌唱得不好會被取笑。之後記者提議阿沁及阿飛合唱《其實你心裏有沒有我》，阿沁考慮了一陣子便答應並說：「好呀，你們選這首歌一定很紅，如果到時不懂唱就由歌迷幫我們。」在旁的陳建寧即自薦屆時為二人伴舞，他又指當晚會扮成聖誕老人向在場歌迷大送禮物。  採訪、攝影：李珮洳
