key,date,article_daily_id,title,text
20080328-0,20080328,0,嘉玲開餐廳半年　男友巡視業務偉仔上海試菜,"嘉玲開餐廳半年　男友巡視業務 偉仔上海試菜 【上海直擊】梁朝偉和女友劉嘉玲不但是情侶，更是生意拍檔，去年10月他們合資在上海開設「廚房88」餐廳。身為大股東的偉仔一直忙拍戲，前日才趁空檔與嘉玲飛上海，二人下機便急不及待趕往餐廳巡視業務，順便試菜兼醫肚。 劉嘉玲近年除了選擇性接拍電影和廣告，也替將來鋪定後路，密密在內地投資房地產和經營酒吧生意。去年10月，嘉玲與男友梁朝偉、舒淇和袁詠儀低調在上海合股開設「廚房88」餐廳，眾人共投資約300萬元，偉仔與嘉玲是大股東之一，投資約100萬元，不過這幾位娛樂圈大忙人都是出錢投資，沒有參與食店的行政管理。餐廳開業之時，偉仔正忙於為電影《赤壁》趕戲，無暇親到餐廳巡視業務，由於他今日與章子怡獲邀出席名牌SalvatoreFerragamo在上海的活動，偉仔特別提早兩天到達，並隨嘉玲到「廚房88」試菜。 大魚大肉 打包走冇浪費 偉仔和嘉玲前晚拍拖飛上海，抵達浦東機場即獲地勤人員貼身招呼，穿上07秋冬Dolce&Gabbana的PVC豹紋亁濕褸配黑色PVC長靴的嘉玲，甫出閘即心急一馬當先，緊隨其後的偉仔則不停講電話。二人雖貴為巨星，卻未獲機場內的旅客留意，他們離開機場便立即乘車到餐廳會合朋友晚飯。  餐廳方面安排偉仔與友人一行約8人在廂房用餐，眾人由晚上7時多吃到10時多，三個多小時內飽嚐美食。據知眾人點了麻辣雞絲魔芋、椰子燉雞湯、麻辣牛蹄筋、三寶鵪鶉、芙蓉魚翅、石鍋桂魚、椒麻魚頭和扒幸鮑菇8道菜，共值1,888元，由於是試菜關係，所以菜式是點多了，不過偉仔沒有浪費，他將吃剩的菜全部打包帶走。離開前，偉仔和嘉玲更在門口的簽名板上簽名，替餐廳省靚招牌。 腹部扁平 嘉玲否認懷孕 近日有報道指嘉玲懷孕三個月，但前晚步出餐廳時，穿上貼身上衣的她，腹部明顯扁平，問到她是否懷孕時，她回報一臉莫名其妙的表情，至於何時與偉仔拉埋天窗，嘉玲也未有回答，再追問她此行來上海是否主要耍樂為主，嘉玲則點頭。偉仔發現記者追訪，即顯得沒有表情，沒有回答任何問題便快步登車，返回嘉玲近年在上海自置的豪宅丹楓苑。  記者昨日致電給偉仔與嘉玲的經理人公司澤東，其發言人梁小姐說：「偉仔今次返上海主要係出席一個時裝品牌活動，其他事情無可奉告。」記者再追問嘉玲是否有懷孕？她回應說：「嘉玲大肚肯定唔係事實，我哋將會向呢本雜誌採取法律行動。」  採訪、攝影：盧健 招牌菜：主打粵滬菜 劉嘉玲和梁朝偉去年10月於上海開設的「廚房88」，位於靜安區大沽路405號，以粵菜和上海菜馳名，招牌菜有牛奶麵、鐵板海鮮豆腐、石鍋桂魚、椒麻豆腐及梅亁菜燒肉等，還有鎮店之寶「仙鶴神針」，仙鶴是乳鴿，神針就是魚翅，食客需在三天前預定。至於五豆老火湯，雖然材料普通，但味道卻也是一絕，也是店內的搶手貨，價錢方面尚算適中，每人平均消費約100元，一碗內有4隻大蝦的酸辣海鮮麵售價為45元人民幣，價廉物美。另外，出名識食的馮德倫日前帶同兩位助手到廚房88開餐，嘆足3小時才離場。 話你知：清幽丹楓苑毗鄰楊恭如 嘉玲和偉仔的上海寓所丹楓苑位於興國路，於99年建成，屬兩幢5層樓的低密度住宅，單位面積由1,090呎至2,199呎，售價則由500萬至1,000萬人民幣不等，全苑只有18名業主，而屋苑附近多為同類型住宅，該處擁有物業的名人除了劉嘉玲，近年轉戰內地的楊恭如也與家人居於上址，有指是由周正毅所贈的「禮物」之一。 富甲一方：蘇州小富婆京滬廣置業 蘇州出生的劉嘉玲，有着一份濃厚的家鄉情，尤其對鄰近的上海情有獨鍾，她在內地擁有多幢物業之餘，近年也積極在上海開拓食肆業務。 物業：蘇州嘉玲苑  簡介：05年以1,000萬在家鄉蘇州拙政園買下佔地550平方米的四合院單位，更以自己的名字為豪宅命名為「嘉玲苑」，現市值約1,500萬。    物業：上海東方劍橋  簡介：06年底以300萬買入位於上海鎮寧路東方劍橋單位，有指是用作投資用途。    物業：北京柏悅居  簡介：06年底以1,250萬買入位於北京中央商務區的柏悅居，現市值約1,400萬。    物業：上海華府天地  簡介：去年豪擲5,000萬購入上海超級豪宅「華府天地」。 業務：MuseClub酒吧  簡介：06年投資千萬在上海開設的士高形式的酒吧。    業務：M2Club  簡介：去年開設、位於上海南京西路的酒吧。    業務：廚房88  簡介：去年10月在上海開設的餐館。    資料來源：《蘋果》資料室"
20080328-1,20080328,1,疑似婚外情第三者登報𠱁老婆陳伶俐蹺實林敏驄補鑊,疑似婚外情第三者登報𠱁老婆 陳伶俐蹺實林敏驄補鑊 現年31歲的陳伶俐與年長12年的林敏驄結婚近10年，近日傳出女方不忠，先後與兩名麻雀腳過從甚密，阿驄夫婦婚姻亮紅燈，陳伶俐的中年禿頭雀友Peter也與太太分居。陳伶俐急急替瀕臨破碎的家庭補鑊，她前晚刻意挽着阿驄臂彎慶生日闢謠，而Peter昨日則為太太在報紙發道歉聲明，誠懇要求復合。 陳伶俐和林敏驄的忘年戀始於97年，翌年奉子成婚，99年誕下兒子林肯，04年誕下次子林善。可是幸福之家近日出現裂痕，陳伶俐被指背夫偷漢，趁着老公北上搵食，愛搓台灣牌的她同時與兩名雀友過從甚密，其中一人是火車頭越南餐廳老闆李成文，另一是任職股票行、禿頭的有婦之夫Peter蔣。陳伶俐多次與Peter密會，每當他們打完牌，陳伶俐便會駕車送Peter返回禮頓山寓所，而當阿驄不在港，Peter便趁機夜訪住在北角威景臺的陳伶俐。兩個家庭瀕臨破碎，有傳阿驄獨自遷到天后美城花園，Peter則與太太分居，獨自租住跑馬地TheEllipsis服務式住宅。 愛的宣言 「我當日冇嫁錯人」 事件被揭後，陳伶俐和Peter便各自作出補鑊行動，陳伶俐前晚高調為阿驄慶祝生日，而Peter則以暱稱AhPei昨日在本報刊登道歉聲明，內容是求分居太太原諒，希望看在兩名孩子份上，兩夫妻可以破鏡重圓。  陳伶俐有見前日是阿驄43歲正日生日，她安排兩名女性朋友，與壽星公在銅鑼灣PokkaCafe晚飯，一行四人離開時，阿驄夫婦先送友人上車，當發現記者追訪，陳伶俐即極速用手蹺着老公臂彎，阿驄則識趣地擠出笑容，盼以恩愛表現為傳聞闢謠。其後他們到附近取車，陳伶俐友善地對記者說：「仲跟？」阿驄也接口說：「夠啦，行啦。」  本報記者昨日致電陳伶俐，問她前晚送甚麼生日禮物給老公？她說：「一份超級大禮。」據知她替阿驄接了一個talk騷，與曾志偉拍檔，昨日還簽了約，她續說：「咁啱又係阿驄生日，雙喜臨門，老公快樂等於我快樂。呢件事令我更珍惜老公，佢絕對百分百投我信任票，好多謝佢，證明我當日冇嫁錯人，我更愛呢個老公。」對於Peter向太太的道歉聲明，陳伶俐說：「我唔知，未睇報道。」她日後可會約腳打牌？她說：「我幫老公接咗騷，好多嘢做，相信一段時間都唔會打牌。」 苦作中樂 笑稱麻雀館開騷 阿驄獲悉太太的箍煲宣言，他昨日在電話中說：「好肉麻，唔使講。」他堅稱夫婦感情沒變，談到生日願望，他說：「希望是非告一段落，我唔想再講呢件事，一切工作為重。」據知阿驄與曾志偉的talk騷暫定7月舉行，細節仍有待開會決定，會在那裏舉行？他竟說：「麻雀館。」會否要求太太與Peter劃清界線？阿驄說：「唔講咁多啦。」Peter昨午從外返回跑馬地寓所時，五時多再度外出，他特別安排由友人駕車到停車場接載，住宅保安還替他開路，坐在司機位旁邊的Peter，全程拉低鴨舌帽之餘，又以手掩面。記者嘗試拍車窗問刊登道歉聲明的AhPei可是Peter本人，他並沒回應，Peter的友人多次飆車和遊花園，最後撇甩採訪車。  採訪、攝影：娛樂突發組、陳寶明、比華利 雀友1號 Peter：乞求你原諒 給我心愛的太太  這突如其來的考驗令我想了很多，領悟的遠超我想像。我不預期你在這個時候會相信我任何說話，但真相是，我真的愛你。  在遷出以後，我明白我不能沒有你，也怪自己以往不夠心存感激。  你曾為誕下我們兩名乖巧的孩子而承受很多，永遠都值得我敬重。現在我們、我們的家，都在瀕臨破裂的邊緣，我為此感到懊悔。  請不要放棄我們的婚姻，就算不為了我們，也該為孩子設想，我乞求你的原諒。當你願意去聆聽的時候，我會解釋一切。  我愛你!!!  永遠是你的AhPei 雀友2號 「火車頭」老細一家親 陳伶俐最近被指與兩位麻雀腳過從甚密，除登廣告向老婆仔女道歉的「雀友1號」Peter外，還有「雀友2號」、火車頭越南餐廳老闆李成文。有指約一年前，陳伶俐經常到位於大坑浣紗街的「火車頭越南餐廳」閣樓私竇竹戰，因而結識李成文，雙方火速撻着，更有指她不時向身邊好友確認對方的男友身份。至今年1月，李成文在自己的餐廳為陳伶俐慶祝31歲生日，林敏驄則沒有在場。 話你知：登報冧女萬萬聲 被指與陳伶俐發展婚外情的Peter，昨日在本報娛樂版刊登了一個四分一版的廣告，向太太表白心迹，其實在報章登廣告的費用，會因應廣告大小、版位及色彩來計算，價錢由數千元至數十萬不等。  過往不少名人也曾經登報示愛，最近期的可說是去年9月8日，著名古董錶收藏家梅強年以署名「『百年寵愛』的你」，在兩大報章刊登全版廣告，預祝汪明荃演唱會成功，令阿姐喜上眉梢。  富商大劉劉鑾雄也經常登報，06年6月20日就以「TheOne」名義，在舊愛李嘉欣生日當天在報章登全版廣告賀伊人生日，而以往也曾以「肥仔Joe」、「Joe糞」及「在扭耳仔的『流口水』大哥，妳的老公仔」為名登報向前女友王穎妤發表愛的宣言。
20080328-2,20080328,2,謝安琪冇食慾激瘦十磅,謝安琪冇食慾激瘦十磅 古巨基、吳雨霏（Kary）、謝安琪（Kay）及側田，前晚於會展演出「Nokia音樂會」。Kary一身露肩裝配熱褲，狂騷長腿非常性感，而身為「張師奶」的阿Kay就包到冚。問Kary着得如此性感是否博搶鏡？她說：「梗係唔係，只係露腿啫，OK啦。」 否認不和 阿Kay表示近日因為太疲勞而沒有心機進食，因而瘦了十磅。問到囝囝張瞻近況，她說：「朝早我會同老公一齊湊佢，雖然我啲頭髮成日轉顏色，但囝囝一樣認得我，可能佢已經習慣咗。」有傳言話阿Kay與張敬軒不和，所以軒仔個唱沒有請她做嘉賓，阿Kay就強調與軒仔是好朋友，隨時ready為軒仔個唱出力。  採訪：李珮洳  攝影：陳順禎
20080328-3,20080328,3,玩自拍　吹喇叭　咬耳仔祖名台灣單挑四辣妹,玩自拍　吹喇叭　咬耳仔 祖名台灣單挑四辣妹 房祖名近年經常被拍到夜蒲媾女，但他似乎毫無戒心，前晚他在台灣好友黃立行的夜店夜蒲，身邊的辣妹如車輪轉，祖名和辣妹更忘形傾到雞啄唔斷，又玩自拍，可謂艷福無邊！ 最近台灣藝人黃立行、黃立成及吳建豪在台灣合資開夜店「Primo」，日前才開張，身為他們好友的房祖名，前晚身穿格仔衫和架上黑框眼鏡飛身前往捧場，當晚原來是「淑女之夜」，辣妹全部免費入場，難怪全場皆是樣靚身材正的辣妹。 交換手機號碼 除了祖名外，當晚還有吳建豪和台灣藝人彈頭等夜蒲，但兩人都不及祖名受辣妹歡迎，不少辣妹圍着祖名團團轉。當晚所見祖名先和友人在貴賓房內飲酒傾偈，其間拿出相機和辣妹攬頭攬頸玩自拍，之後再和一長髮辣妹坐在一張圓枱附近，他們兩杯落肚即開始傾偈，祖名不時講到手舞足蹈。之後祖名走到bar枱前面，即引來三位辣妹埋身，祖名對辣妹可謂來者不拒，四人在bar枱前有講有笑，還即場交換手機號碼！ 拖辣妹四圍走 當晚祖名表現得甚high，飲完手中的紅酒後，他索性拿起整支紅酒「吹喇叭」，然後又和一位身材高䠷的辣妹埋身密斟，他更毫不避忌拖着辣妹在場內四圍走，逗得她們開懷大笑。祖名在店內玩至凌晨四時多，離開時在門外仍有和辣妹交談，整晚豔福無邊。  採訪、攝影：黎寶蘋
20080328-4,20080328,4,紅BlogBlog返美度假忙過拍片　吳彥祖賀父壽撐奧巴馬,"紅BlogBlog 返美度假忙過拍片　吳彥祖賀父壽撐奧巴馬 近年轉戰商界的吳彥祖（Daniel），上月與女友LisaS.投資1,200萬在上海為酒吧Racks開分店，前晚又慶祝中環店開業一周年，更預備大展拳腳在北京及澳門再開店，難怪近日陳自強退股JC，Daniel的經理人合約於7月完結，林建岳有意拉攏他過檔，Daniel也未急於傾新合約。凌零發日前瀏覽Daniel的網誌，更發現他本月中專程回美國三藩市，出席亞裔美國人電影節之餘，順道探望家人及朋友，過了一個輕鬆的假期。 -親情篇- 為老父慶生辰 在三藩市出生的Daniel，三月中重返老家出席影展，更趁機盡享家庭樂，原來他的父親剛於周一79歲生辰，於是Daniel就跟他的胞姊Greta、姊夫及父母團聚慶祝。照片所見，他的父親看似非常年輕，而首次曝光的Greta樣子更與Daniel非常相似。Daniel又在另一篇網誌中透露其美國家居生活趣事，當他執拾車庫時，竟發現野生火雞匿藏其中，Daniel更拍下照片與大家分享。 -社會篇- 反對種族歧視 雖然Daniel表示不想將網誌變得政治化，但返回美國，Daniel當然難免要談談熱爆燈的美國總統提名戰選情，他更表示十分支持民主黨候選人奧巴馬（Obama），出席影展時已戴上他的競選襟章。在另一篇網誌中更激讚奧巴馬有關種族議題的演說，Daniel自己也對亞裔演員在美國一直演無聊角色感到十分氣憤，更呼籲大家團結一起改變現狀。 -勵志篇- 重返母校演講 除了享受家庭樂之外，Daniel也有相約好友敍舊，他與朋友狂擦日本菜，又四出找尋美食，更與多年好友齊齊四處蕩，十分寫意。Daniel又回到高中母校HeadRoyce演講，分享其心路歷程，92年畢業後，Daniel已很少回到母校參觀，今次更是其英國及日本文學老師在影展中發現他的蹤影，才特意邀請他回校演講。  版主：凌零發"
20080328-5,20080328,5,鄭中基為阿Sa度劇本,鄭中基為阿Sa度劇本 鄭中基、劉心悠和寇鴻萍偕女兒等，昨日到跑馬地馬場，出席傳媒集團舉辦的「十大代言人選舉2008頒獎典禮」，大會邀請擔任評審的黃柏高及霍汶希（Mani）等都有出席。  鄭中基表示正準備參與吳京執導的新片，他又編寫劇本，他說：「我寫緊笑片劇本，我喺戲中做警察，同方力申捉連環殺手。」鄭中基謂會考慮角色性格，找緋聞女友蔡卓妍（阿Sa）擔演一角。 阿嬌匿埋進修 對於阿Sa最近因阿嬌事件，獨力苦撐工作，鄭中基坦言有致電慰問她，不覺她因壓力而消瘦。而阿Sa的經理人Mani指，阿Sa隨後會接拍兩部電影，減少獨自面對傳媒的機會，而阿嬌就投入進修，Mani說：「我哋唔會交代佢喺邊，希望佢好好把握今次機會學習。」  採訪：張俊銘  攝影：葉君海
20080328-6,20080328,6,紅BlogBlog：阿詩MV玩滄桑,紅BlogBlog：阿詩MV玩滄桑 何韻詩近來正為即將出新碟兼在世貿中心開舖賣精品忙個不停，不過她仍有時間更新網誌，更搶先將新歌《韻律泳》的MV片段放上網益fans。凌零發日前瀏覽阿詩的網誌，發現她將導演麥婉欣執導的《韻律泳》MV放上網，片段中大小水池加上黃葉片片，充滿蒼凉感，展現阿詩成熟一面。  此外，阿詩第一次開舖賣精品，谷宣傳當然不遺餘力，近日她連番公開不同產品，連一直只聞其名不見其影的限量人形菇仔memorystick真身也正式公開，更有設計藍圖。原來菇仔memorystick只要除褲就會露出USB插頭，認真鬼馬。    何韻詩BLOG   http://hk.myblog.yahoo.com/geelee-gooloogutgut     《韻律泳》MVpreview   http://www.youtube.com/watch?v=qiHH8ZOTyfk 
20080328-7,20080328,7,動漫Maggie亞視開金口,動漫Maggie亞視開金口 亞視即將推出音樂節目《樂壇風雲五十年》，會逢周日晚八時半播映，正好對撼無綫節目《鐵甲無敵獎門人》，昨日李曼筠（動漫Maggie）和前輩歌手夏韶聲、吳國敬、蔡立和陳德彰等，現身大埔亞視總台。 夏韶聲掟碟𠝹損手 為宣揚正視真音樂，眾人進行破碟儀式，夏韶聲更不慎𠝹傷手。一眾歌星曾為無綫主持節目，今次倒戈相向，蔡立說：「同無綫合約已經完咗兩年，新加入亞視，主要係時間配合，加上又做音樂節目，相對唔會有太大衝突，而且鍾意聽歌嘅觀眾始終會睇，遊戲節目只係多一個選擇，希望個平台可以大啲。」動漫Maggie會在節目中首度獻唱，她更找老師學唱歌一堂，希望多元化發展，但仍會以拍攝電影為主。  採訪：卓寶花  攝影：陳順禎
20080328-8,20080328,8,金話梅爛片等你選,金話梅爛片等你選 由《蘋果》娛樂版舉辦的「第三屆金話梅電影選舉」（GoldenPlum）現已開始接受投票！各位讀者可於今日起至4月11日期間，在壹蘋果網絡內投票，選出心水爛片，結果將於4月13日在《蘋果》娛樂版及網頁內公佈。    投票日期：即日起至4月11日中午12時  揭曉日期：4月13日於《蘋果》娛樂版及網頁  投票網址： http://www.atnext.com/jp/goldenplum 
20080328-9,20080328,9,薛家燕生日願望搵個伴,薛家燕生日願望搵個伴 本月30日58歲牛一的薛家燕昨日到銅鑼灣率先與影迷慶祝生辰，現場筵開37席，家燕姐的細女、安德尊、伍衞國及吳剛等都有出席，安德尊還送上大利是恭賀家燕姐。  家燕姐笑言自從換了新髮型後，感覺自己越來越後生，她說：「譚詠麟話佢年年25歲，所以我今年就係24歲，就連之前有超過30年嘅影迷都讚我越嚟越後生，好似同30年前冇分別，我嘅秘訣就係要睇開啲，心境要開朗。」 暗示有人追 至於是否需要愛情滋潤時，家燕姐即笑說：「𠵱家都好似有啲，自己生日願望想搵個好伴侶，最緊要係我鍾意同埋啱傾，不過要就到我啲時間真係唔易搵，都幾陰功。」  採訪、攝影：駱華齡
20080328-10,20080328,10,拍戲慘遭生劏江若琳斗室伴惡臭內臟嘔,拍戲慘遭生劏 江若琳斗室伴惡臭內臟嘔 江若琳（Elanne）在恐怖片《嚇死你》其中一場戲，是她在手術床上慘被劏肚，露出血淋淋內臟，而這些內臟是以牛、豬和雞的內臟代替，Elanne要與牲畜的內臟相對10小時，惡臭難忍，害得她邊拍邊嘔。 寰宇公司為了力捧旗下藝人江若琳，特別找來錢江漢執導電影《嚇死你》，除了由江若琳擔任女主角外，其他演員還有李璨琛與曾國祥，該片並於下周四上映，雖然是低成本製作，但Elanne十分珍惜今次演出機會，在拍攝這部戲期間，她最難忘是拍攝一場夢境戲，是講述她躺在手術床上被人劏肚，連血淋淋的內臟也露了出來，鏡頭前是血腥恐怖，鏡頭後則是奇臭難擋。 蒼蠅四圍飛 由於工作人員在早上已經將牲畜內臟放在手術室，其後經過10小時的長時間拍攝，這些牲畜內臟早已發黑和發臭，但Elanne一直困在臭氣熏天的手術室演戲，看着一隻又一隻蒼蠅圍着那些內臟飛來飛去，她看見已經想作嘔，導演知道她感到惡心，特別上前將她抱到攝影機底躲起來，讓她可以遠離蒼蠅一會兒，到拍攝時，Elanne與牲畜內臟距離不超過四吋，叫她實在受不了。 企都企唔穩 Elanne表示：「嗰日去到拍攝現場已經覺得臭氣熏天，加上見到工作人員滿手鮮血，埋頭埋腦搞緊呢啲道具，我已經心知不妙，但估唔到拍攝時間咁長，而且時間越長嗰啲臭味就越難頂，到我拍完最後一個鏡頭，我真係忍唔住，即刻衝咗出手術室嘔，連企都企唔穩，之後助手扶我返酒店冲凉，我仲係忍唔住一邊冲凉一邊嘔。」後來她更加將整支香水灑滿房間和身上，藉以趕走那股惡臭味道。  撰文：林妃
20080328-11,20080328,11,娛樂開CHAT：Hotcha、小齊下周輪流上,娛樂開CHAT：Hotcha、小齊下周輪流上 各位娛樂版擁躉，有興趣和你的偶像傾談嗎？《娛樂開CHAT》將請來Hotcha及任賢齊擔任嘉賓，分別於4月1日（下周二）和4月2日（下周三）與讀者談天說地，同時又有機會得到偶像的珍藏，只要你有webcam及headset，並於當日6:00pm準時登入 http://ent.appledaily.com即可，節目於當晚7:00pm在《蘋果》網站直播。 
20080328-12,20080328,12,男友移情別戀阿妹投中村懷抱,男友移情別戀 阿妹投中村懷抱 台灣天后張惠妹主演的音樂劇《杜蘭朵》昨晚在日本東京公演，開騷前，阿妹跟男主角中村獅童作最後綵排，並招待傳媒採訪。  飾演高貴女王杜蘭朵的阿妹以古裝造型示人，英氣十足，雖然其緋聞球星男友何守正，日前傳出密會星光二班的林佩瑤，但阿妹未受傳聞影響，綵排時表現得非常落力。  至於剛與女星竹內結子正式離婚的中村獅童，日前又被偷拍到跟女星鈴木砂羽密會，但他沒有就此事回應。  撰文：林妃
20080328-13,20080328,13,馮仁昭四圍超莫可欣6月開刀分娩　BB嘆免費奶粉 - 馮仁昭,馮仁昭四圍超 莫可欣6月開刀分娩　BB嘆免費奶粉 - 馮仁昭 腹大便便嘅莫可欣噚日代表MTV台，到觀塘出席一個宣揚預防愛滋病嘅活動，一同出席嘅仲有古巨基。可欣話自己個肚已經六個月，體重增加咗十磅。佢話：「雖然唔係重咗好多，但醫生話呢個磅數都算正常，最重要係BB喺個肚度發育健全。」 擇個好時辰 手上戴住鑽戒，一臉幸福嘅莫可欣透露預產期係6月底，佢好坦白咁話：「我年紀大，驚唔夠氣力Push，加上我真係好怕痛，所以唔會揀自然分娩。」佢仲笑住話：「雖然我係鬼婆，但係都好迷信，所以已經搵咗個師傅幫BB擇好時辰，準備剖腹生產，求心安之餘，最重要係BB一世好運啦！我仲計劃好BB出世頭三個月會餵人奶，之後先至轉餵奶粉。」面對近排奶粉缺貨問題，佢話一啲都唔擔心，因為佢已經搵咗奶粉贊助商。 唔適宜動土 至於BB嘅爸爸方中信，本來想搵人裝修BB房，後嚟經裝修師傅點醒，有大肚婆喺屋企唔適宜動土，所以打消咗呢個念頭。  莫可欣話：「我哋商量好，BB個名會搵師傅改，而方中信有啲fans都有幫BB諗咗啲名，有啲都幾得意，我哋都幾鍾意，但係一切都要等師傅算過先至決定。」雖然近日方中信喺北京忙緊拍戲，但佢會度定期返嚟香港陪可欣坐月，另外，佢哋亦會搵人幫手陪坐月湊BB，到時可欣會休息三個月左右，𠵱家佢最擔心係工作會受到影響。  採訪：馬建華  攝影：林德雄
20080328-14,20080328,14,馮仁昭四圍超：哥哥迷紙鶴表心意 - 馮仁昭,馮仁昭四圍超：哥哥迷紙鶴表心意 - 馮仁昭 四月一日係哥哥（張國榮）離世五周年嘅日子，「哥」迷一如往年會喺呢日舉行紀念活動，噚日就率先喺EMAX舉行「張國榮－星．聲傳奇」互動音樂活動，會場裏面展示咗好多珍貴圖片同資料，而且仲設立咗「紙鶴表心意」活動板，只要捐款畀兒童癌病基金，就可以掛上紙鶴同點播哥哥嘅名曲，至於山頂嘅溫莎夫人蠟像館，今日開始歡迎「哥」迷入場獻花。
20080328-15,20080328,15,楊思琦操Fit迎夏日,楊思琦操Fit迎夏日 楊思琦、張可頤和徐淑敏昨日在尖沙嘴出席無綫節目《更上一層樓》的記者會，近日天氣回暖，思琦、徐淑敏和擔任司儀的呂慧儀紛紛以夏裝示人，思琦說：「我前排要開工，冇乜時間扮靚，咁啱近排心情幾好，所以專登揀一條既簡單又有女人味嘅裙嚟着，希望睇落可以精神啲！」夏天將至，又是思琦行泳衣騷的旺季，她笑說：「乜你哋咁講㗎，我遲啲要幫劇集《銀樓金粉》做宣傳，加上今年嘅冬天又食得多咗，所以𠵱家要操番啲線條同自信心！」另外，狀態回勇的張可頤透露去年已經停止服藥，她說：「𠵱家可以話係完全康復，不過暫時未有一個好劇本，值得我搵命博。」  採訪、攝影：何慧斯
