key,date,article_daily_id,title,text
20081227-210,20081227,210,沙地30年來首次公映電影,"沙地30年來首次公映電影 拍掌、歡笑、食爆穀，在其他地方只是電影院尋常景象，但在沙地阿拉伯，這就是革命性突破。當地禁播電影30年後，終有第一部劇情片公開播映。  這次播放的電影《Manahi》，是「沙地畢菲特」阿爾瓦利德親王（AlwaleedbinTalal）旗下魯塔納（Rotana）娛樂集團出品，本月中在吉達市（Jeddah）和塔伊夫市（Taif）公映九天。  沙地人民餓了看電影多年，吉達播電影的文化中心，每日兩場1,200個座位都爆滿，要在午夜加開一場。全場觀眾為片中農夫主角的烏龍遭遇捧腹大笑，已是久違了30年的集體經驗。  沙地極保守的瓦哈比派（Wahhabist）教士，1970年代指電影荼毒人心，全國禁播電影。這禁制近年已多少被衞星電視和錄影帶打破，也有咖啡屋夜間偷偷播電影，但沙地人想堂堂正正入電影院看戲，仍是要去鄰國。  這次公映電影得到麥加省長哈立德親王（Khalidal-Faisal）支持，才能成事，每場播放前仍要先由宗教警察檢查男女觀眾是否分隔好。但本片能否在風氣更保守的首都利雅得（Riyadh）播放，現在仍是未知之數。  法新社"
20081227-211,20081227,211,911促使甘迺廸女兒從政,911促使甘迺廸女兒從政 美國前總統甘迺廸的女兒卡羅琳（CarolineKennedy），有意在希拉莉出任國務卿後，填補紐約州參議員空缺。她前日首度就此事接受訪問，指911襲擊和替奧巴馬助選，激勵了她任公職的決心。  51歲的卡羅琳一直低調生活，只從事慈善和社會事務。她接受NY1電視台和美聯社訪問時表示，「一直有人鼓勵她從政」，在經歷了911襲擊和今年替奧巴馬助選後，終於激勵了她踏入政壇的意志。碰巧希拉莉獲提名做國務卿，為她製造了一個完美機會，於是兩周前正式向紐約州長佩特森表示有意填補希拉莉的空缺。  共和黨批評卡羅琳對紐約州也不熟悉，沒資格做參議員。黨內對手、紐約州眾議員阿克曼，更把她跟女星「籮霸」珍妮花洛庇絲相提並論，徒有虛名。卡羅琳在訪問中逐一反駁，堅稱自己熟悉州內62個縣的事務，又指「珍妮花洛庇絲長得很好看，但在公共政策和成長生活上，我們沒有太多相似之處」。  卡羅琳強調，她並不認為家族背景令她可理所當然地出任參議員，但她「與準總統在工作上有良好關係」，希望把這些優勢帶給紐約州居民，她會「雙倍努力」爭取民眾支持。她又感謝亡母積琪蓮鼓勵她「過自己的生活，不要擔心別人怎樣看自己」，令她有勇氣踏入政壇。  美聯社/德新社
20081227-212,20081227,212,日婦迫女賣淫交電話費,"日婦迫女賣淫交電話費 父母愛護子女，就算作自我犧牲也在所不惜，但日本卻有一名不一樣的媽媽，竟然迫15歲女兒賣淫，目的是要用女兒的肉金來支付流動電話費。和歌山法庭前天（周四）判處這名母親入獄三年半和罰款10萬日圓（8,563港元）。  據案情透露，案件發生於今年2月，37歲婦人與47歲丈夫合謀，強迫就讀中三的女兒賣淫，帶她到和歌山市一間酒店跟嫖客交易，肉金為12,000日圓（1,027港元）。  婦人迫女兒賣淫，原因是她嫌手機電話費太昂貴，決定要女兒賣淫賺錢幫補電話費。  法官在判刑時痛斥婦人不負責任，當女兒是搖錢樹，一手毀掉女兒的貞操，令她身心受創，「她就只有你一個媽媽呀，你實在太過份了」。  共同社"
20081227-213,20081227,213,奧巴馬食刨冰忙壞特工,奧巴馬食刨冰忙壞特工 正在夏威夷度假的美國候任總統奧巴馬（BarackObama），前日（周五）帶同兩名女兒吃刨冰，引起哄動。民眾爭相走近拍照，令特工疲於奔命地阻止。  奧巴馬趁未上任前，回到他的出生地夏威夷歡度12天聖誕假期。自上周六抵埗後，他除了兩度外出打高爾夫球和每天去健身外，大部份時間都與家人，留在租住的度假屋內。前日他首度帶着大女瑪利亞（Malia）和幼女薩莎（Sasha）亮相，但妻子米歇爾（Michelle）無同行。 「出巡」盡展親民形象 奧巴馬帶着兩名女兒和她們的朋友，到一個水族館看海豚表演，然後再到一個購物中心吃東西，奧巴馬那嫁給華人的同母異父妹妹吳瑪雅（MayaSoetoro-Ng）也有同行。  當小朋友們點刨冰時，奧巴馬不禁笑道：「我投降了。」他吃了一份三文治後，也點了一碗刨冰，並說要請記者吃，但忙於拍照的記者沒領情。奧巴馬「出巡」吸引大批民眾圍觀，令特工十分緊張，但奧巴馬盡展親民形象，與部份民眾握手。  路透社/美聯社
20081227-214,20081227,214,橫濱市長遭情婦控告,橫濱市長遭情婦控告 44歲的日本橫濱市市長中田宏爆出桃色醜聞，一名曾以花名「奈奈」在夜店當公關的30歲女子，聲稱2004年開始當他的情婦，前年6月分手。早前她已入稟法院，控告中田宏損害她的名譽，索償257萬港元。  中央社
20081227-215,20081227,215,墨西哥小姐勾結毒販判囚,墨西哥小姐勾結毒販判囚 日前在墨西哥警方掃毒行動中被捕的「墨西哥小姐」季軍蘇尼加（LauraZuniga），前天（周五）被判監40天，而國會議員針對選美佳麗跟毒販勾結，要求當局調查毒販是否透過滲透選美賽事和娛樂事業來洗黑錢。 毒販或借選美會洗錢 蘇尼加被捕後，有人開始指摘她當選季軍是否「造馬」的結果，因為她的男友是當地大毒梟的弟弟。「墨西哥小姐」選美會主辦單位至今，仍未決定是否褫奪她的后冠。有國會議員警告，毒販可能透過搞選美會和娛樂事業來洗黑錢，因為這類活動要花很多錢，是洗黑錢的好機會。現時北墨西哥的娛樂事業，包括演唱會、選美活動等，據說已被毒販染指。  當局雷厲掃毒，但有前助理警察總長涉嫌在掃毒行動中乘機渾水摸魚，偷了毒梟的錢而被當局調查。該名警察總長除了侵吞金錢外，還涉嫌威迫園丁透露毒梟下落，若他不肯說，就強姦他的妻子，甚至將他擲進獅子籠內餵獅子。  法新社/美聯社
20081227-216,20081227,216,CIA以「偉哥」刺探情報,CIA以「偉哥」刺探情報 美國中情局（CIA）為刺探阿富汗塔利班組織的情報，可謂無所不用其極，除以金錢利誘軍閥和酋長外，還用「威而鋼」（俗稱「偉哥」圖）賄賂他們。CIA以「偉哥」刺探情報，令通常有多個老婆的線人樂於接受。  美國《紐約郵報》
20081227-217,20081227,217,放學時間遇空襲家長激動誓焚以色列,放學時間遇空襲 家長激動誓焚以色列 哈馬斯的保安設施是設在民居，作為掩護，以軍昨天向加薩發動第一輛空襲時，適值學校放學，很多父母都憂心如焚地湧到學校，找尋自己的孩子，場面非常混亂。  57歲的馬斯里坐在靠近警察總部的街頭中心，左右開弓地掌摑自己那張鋪滿灰塵的臉，呼天搶地說：「我的兒子死了！我的兒子死了！」 病床不敷應用 原來他在空襲前幾分鐘，叫兒子出去買香煙，怎料遇上空襲，現在生死未卜，他埋怨說「我可不可以像燒香煙般，焚燒以色列。」加薩市有120多人喪命，當中70人是在警察總部遇害，屍橫遍野，一名生還的警員舉起食指，為死去的同袍祈禱。  由於死傷人數太多，很多平民都協助將傷者抬上汽車或貨車上，第一時間送往附近的醫院搶救。市內最大的醫院所敘法醫院，昨日擠滿傷者，病床不敷應用，傷者都要席地就醫。  一名醫生說：「我們要在地上，甚至走廊為傷者診治，這裏已經沒有空位了。我們不知道誰在這裏，亦顧不了救治的先後次序。」當局擔心血庫不夠血，已呼籲市民踴躍捐血。  在黎巴嫩的巴人難民營，不少青少年上街燒車胎，以示支持加薩的同胞跟以軍抗爭到底。在約旦，數以百計憤怒的約旦人走到聯合國辦事處外示威，一邊揮舞哈馬斯旗幟，一邊高喊：「哈馬斯向前進，你們是大炮，我們是子彈。」  美聯社
20081227-218,20081227,218,意國滑雪撞死人兇手逃去,意國滑雪撞死人兇手逃去 意大利阿爾卑斯山區，上周四早上，51歲廚師蘭奇納帶同12歲女兒去滑雪，其間他被一名中年男子撞倒，撞傷頭部引發心臟病，但該男子不顧而去，蘭奇納女兒眼看父親死去。  英國《衞報》
20081227-219,20081227,219,格國總統無故打總理,格國總統無故打總理 格魯吉亞總統薩卡什維利向以火爆脾氣見稱，據當地傳媒報道，他上周無緣無故出拳毆打總理姆加洛布利什維奇，然後更拿起電話擲到姆加洛布利什維奇身上。姆加洛布利什維奇受辱後立即提出辭職。  英國《每日電訊報》
20081227-220,20081227,220,費城大火7人相擁而死,費城大火7人相擁而死 美國費城一處民居前晚發生大火，燒死四名成人和三名小孩，消防員發現死者屍體時(圖)，他們全都相擁在一起。消防員表示，屋內沒有安裝煙霧感應器，正調查起火原因。  美聯社
20081227-221,20081227,221,紫外光殺微生物新法釀酒　飲醉不再頭痛,"紫外光殺微生物 新法釀酒　飲醉不再頭痛 聖誕派對停不了，你是否宿醉未醒？南非一間公司研發了一部機器，聲稱可減低酒精中令人頭痛的物質，並可改善酒精味道，讓人飲酒後第二天不會頭重重、隱隱痛。  喝酒後頭痛，主要因為葡萄酒生產過程中，加入了二氧化硫（sulphurdioxide）殺死微生物和酵母菌，並抑制葡萄酒的氧化作用，達到防腐抗氧效果，保持葡萄酒的果味與鮮度。不過二氧化硫溶於水後與其他物質結合，會產生亞硫酸鹽（sulphite），它就是導致頭痛的元凶。 Surepure可保存原味 亞硫酸鹽與酒精，未來不會再形影不離，因為南非一家公司研製出一部叫Surepure的機器，改用紫外線殺死酒精中的微生物。Surepure的體積不大，相等於兩個冷藏箱，旁邊插着兩條管，一條將酒輸進去，由另一端輸出。酒精輸進機器後，會被紫外光燈照射，每小時可處理4,000公升酒。  二氧化硫另一個壞處，是把酒精中的香味也驅走，用Surepure就可保存酒的原味。南非L'Ormarins酒莊今年生產的4,000公升chardonnay白酒中，有一半是用Surepure機器製造。美國、新西蘭、澳洲、智利多間酒廠正試用，若效果理想，就會正式採用。  英國《泰晤士報》"
20081227-222,20081227,222,美婦交還藏巨款餅盒,"美婦交還藏巨款餅盒 住在美國加州的羅戈菲，10月10日買了一盒餅亁給女兒。拆開後，竟發現裏面藏有10,000美元（約78,000港元）現金。羅戈菲將錢交給警方，後來證實是一名婆婆退回餅亁時，誤把自己畢生積蓄放進餅亁盒。婆婆拿回積蓄後沒感謝羅戈菲。羅戈菲不介意，只要求商店給女兒一盒新的餅亁。  美聯社"
20081227-223,20081227,223,不吃早餐日少年早失身,"不吃早餐日少年早失身 日本少女們很早就失身，原來箇中除了涉及家庭環境因素，還與不吃早餐有關。  日本厚生勞動科學研究組今年9月，向約1,500名16至49歲的男女發問卷，調查他們初次性經驗與中學時代生活狀況之間的關係。結果顯示，中學生失身的年齡，平均為19歲，而中學時代不吃早餐的人，失身的平均年齡為17.5歲，比每天吃早餐的人約早了兩年，而吃早餐越少，開始性行為的年齡就越小。  至於覺得母親讓人厭煩的少年，平均失身年齡為16歲；不喜歡父親的人，平均失身年齡為18.6歲。另外，在家不開心的少年，初試雲雨情的年齡亦較早。  被訪者不滿父母不為他們做早餐，就越傾向早點失身來抒發心中鬱結。而較早失身的少年，不吃早餐的原因是他們很晚才回家。  共同社"
20081227-224,20081227,224,剛果華人鬧市被槍殺,剛果華人鬧市被槍殺 非洲剛果民主共和國，在過去的一星期之內，共發生了13宗命案，死者當中包括三名外國人，分別是一名中國人以及兩名黎巴嫩人。  該名被殺的中國人，是在前天光天白日下，於利卡西市遭人槍殺，警方懷疑他是被劫殺。  presstv.ir
20081227-225,20081227,225,日麥當勞賣新包臨記扮顧客,"日麥當勞賣新包臨記扮顧客 日本麥當勞被踢爆「做媒」，請臨記扮顧客，為新出口的漢堡包造勢。  日本大阪市分店於周二發售新產品「1/4磅漢堡包」（QuarterPounderBurger），吸引15,000名顧客排隊購買，創下單一分店單日最高銷售額1,000萬日圓（85.6萬港元）紀錄。由於銷情太厲害，在高峯期更多達2,000人排隊搶買，引起懷疑，結果被揭發有1,000人是受聘於一間市場調查公司，以時薪1,000日圓（85.6港元）排隊，為「1/4磅漢堡包」造勢。  對於被指僱人造勢催谷產品，日本麥當勞發言人表示對事件不知情，只是曾委託市場調查公司，了解首天推出的新產品服務和品質，「我們不知道有1,000人是被派來當顧客」。  彭博通訊社"
20081227-226,20081227,226,狗狗高買叼走21元骨頭,狗狗高買叼走21元骨頭 美國鹽湖城一間雜貨店周三發生高買案，店舖經理雖然成功攔截小偷，但仍無奈放走對方──因為牠是一隻狗狗，絕不好惹。  狗狗是雜貨店新客，牠像普通人一樣，逕自走入鹽湖城市郊默里鎮Smith'sFood&Drug店內，狂嗅一名女童後，好像熟悉店內方向似的，一直走到第16行的寵物糧貨架，叼走了一條售價2.79美元（21.7港元）的骨頭，然後施施然離開商店。  這份美味聖誕禮物，狗狗當然沒付鈔，即使牠見到經理亞當森趨前，也毫無懼色。亞當森怕被狗狗噬咬，所以沒伸手搶回骨頭，只說：「放下它！」但狗狗只瞪着他，之後直奔向大門，逃之夭夭。  狗狗惡行已被商店閉路電視拍下，看來商店除要小心竊賊，還要小心高買狗。  美聯社
20081227-227,20081227,227,珍寶機載46.5萬億蟻　人一生吃1200隻雞通天曉服務嚴選刁鑽難題,"珍寶機載46.5萬億蟻　人一生吃1200隻雞 通天曉服務嚴選刁鑽難題 2004年英國推出手機短訊服務「你問我答」（AQA），手機用戶發送任何問題都可獲得答案，四年來發送的問題超過1,600萬條，以下是部份「騎呢」兼刁鑽問題。 Q：一架珍寶客機可載多少隻蟻仍能起飛？  A：一隻蟻重3毫克，一架飛機最多可載46.5萬億隻。 Q：北極熊（圖）的肝可以吃嗎？  A：不可，因為北極熊的肝含有極高水平維他命A，攝取超過30克維他命A已足以致命。  Q：每個人一生吃了多少隻雞？  A：平均吃1,200隻雞，即是1,800公斤雞肉。 Q：誰收的粉絲信比披頭四更多？  A：希特拉在1930-40年代收到的支持者信件，比披頭四、滾石樂隊和麥當娜加起來更多。  Q：戴卓爾夫人（圖）與雪糕有何關係？  A：戴卓爾夫人年輕時是化學家，曾參與研發軟雪糕。  Q：那個電影角色被扮演得最多？  A：福爾摩斯由72個演員在204部電影中扮演過。  Q：誰是史上首個連環殺手？  A：漢朝濟東王劉彭離，他不滿父親梁孝王在宮廷鬥爭中被殺，糾黨謀財害命，在23年間共殺了逾百人 Q：搬到那裏可立即成為百萬富翁（圖）？  A：津巴布韋。  Q：多少部iPod才可儲存全球所有原裝版本歌曲？  A：以全球有40億首原裝版本歌曲計算，要400萬部4GB版iPodnano或10萬部16GB版iPodclassic才夠儲存。  Q：那首歌在電影中出現得最多？  A：《HappyBirthdayToYou》。  Q：甚麼動物有兩個心臟？  A：沒有，但墨魚、蠔和八爪魚有三個心。  英國《每日郵報》"
20081227-228,20081227,228,「瑪利亞」聖誕產子取名「耶穌」,「瑪利亞」聖誕產子取名「耶穌」 二千多年前的12月25日，聖母瑪利亞在伯利恒城誕下耶穌，成為今日的聖誕節。在今年聖誕節，秘魯一名20歲婦人誕下麟兒，基於種種機緣巧合，決定替兒子取名為耶穌（Jesus）。  婦人替兒子取名耶穌，並非是要嘩眾取寵，而是因為她的名字跟聖母瑪利亞一樣叫VirginMaria，丈夫瓦曼尼雖然不是叫若瑟，但卻是個木匠。兩夫婦原先打算以當地一個足球員的名字為兒子命名，但因為兒子在聖誕當天誕生，幾個巧合令他們決定叫兒子做耶穌。事件獲當地傳媒大事報道，指「兩千多年後，伯利恒的故事又再重演。」  路透社
20081227-229,20081227,229,BagTV手袋電影隨身看,"BagTV手袋電影隨身看 女士手袋通常用來擺放手機、錢包和扮靚用品，但英國BagTV推出的皮手袋，則是集高科技和時尚於一身，不但可擺放雜物，還可用來看電影、短片或照片，女士只要帶着它，就可一邊行街，一邊看電影。  高科技手袋的正面設有一個18厘米闊的LCD螢光幕，螢光幕表面設有透明保護膜保護畫面，並備有USB連接埠和SD卡槽。女士無論身處何時何地，都可以拿出手袋，播放DVD或預先下載的MPEG格式的影片或照片，或用電線接駁電視機，每次可連續播放2.5小時。  手袋內置播放器，並沒有增加手袋太多重量，因為設計師已將電池重量降到最低，確保女士可輕鬆上路。  BagTV皮手袋集儲物與娛樂於一身，還備有紅、黑、白、粉紅色等多種顏色供消費者選擇。  這款高科技手袋售價295英鎊（3,379港元），網站還有耳機、記憶卡、火牛等配件出售。  BagTV網站"
20081227-230,20081227,230,iPhone鑲超巨鑽索價1950萬,"iPhone鑲超巨鑽索價1950萬 奧地利著名珠寶設計師阿洛伊遜（PeterAloisson）年初才推出號稱全球最貴的iPhonePrincessPlus，定價17.6萬美元（138萬港元），不足一年，他再推出全新豪華版iPhoneKingsButton，價錢貴得駭人，索價250萬美元（1,950萬港元）。  驟眼看，KingsButton與其他豪華版iPhone的外形差不多，都是包金鑲鑽，但其矜貴之處是分別以18K黃金、白金及玫瑰金包着手機表面，機身四周更鑲了138顆採用明亮式切磨的鑽石，最特別還是手機主按鈕鑲了一顆6.6卡罕有巨鑽，絕對是其他豪華版iPhone所不及，不過如今全球經濟不景，用250萬美元買一部手機，會否奢侈了一點？  bornrich網站"
20081227-231,20081227,231,iPhoneNano曝光縮水四分一,iPhoneNano曝光縮水四分一 一年一度的蘋果MacworldExpo大會下月初揭幕，雖然蘋果早前已宣佈這是最後一屆，而行政總裁喬布斯（SteveJobs圖）也不會出席，但蘋果仍會把握這個最後機會發佈至潮至in的產品，據說iPhoneNano是大會的主打新產品。 消息傳了多時，一直未見iPhoneNano的真面目，近日網上終於出現首張iPhoneNano的概念圖（圖），雖說這並非真正製成品，但若iPhoneNano真如相中一樣，比原版iPhone細1/4，相信會吸引更多人搶購。  crunchgear網站
20081227-232,20081227,232,丹麥極罕跑車王馬力1104匹,"丹麥極罕跑車王馬力1104匹 丹麥車廠Zenvo研製出1,104匹馬力的ST1超級跑車，但整部跑車的重量只有1,376公斤。ST1超級跑車裝配了7公升V8雙增壓引擎，令馬力推到了驚人的1,104匹，扭力是1,430nm，令這部跑車成為歷來加速得最快的跑車之一，由靜止加速至時速100公里只需3秒，時速可高達375公里。  ST1性能強悍之餘，外形也極具流線型，車身用上超輕的碳纖維，而內櫳設備非常先進，有定速巡航、無匙智慧啓動、內置GPS導航等。這部超級跑車只限量生產15輛，估計定價逾100萬美元（780萬港元）。  gizmag.com"
20081227-233,20081227,233,遭以軍佔領和談欠共識激進巴人武力圓獨立夢,"遭以軍佔領和談欠共識 激進巴人武力圓獨立夢 以巴衝突是個歷時2,000年的宿怨，猶太人被古羅馬帝國亡國驅逐出巴勒斯坦後，一直念念不忘復國。巴勒斯坦後來先後被奧斯曼帝國吞併和英國接管，到以色列1948年成功建國，巴勒斯坦獨立的夢想卻落了空。 淪為二等公民 以色列先後打了五次中東戰爭，一直佔領巴勒斯坦。巴人淪為二等公民，1987年至1993年起義後，迫使以色列同意用土地換取和平，讓巴人終於可成立自治政府。不過以巴和談一直未能就以巴邊界劃分、耶路撒冷歸屬和巴勒斯坦難民回歸等問題達成共識，衝突一直持續。  以巴和談一直圍繞着聯合國建議以巴並存的兩國方案兜兜轉轉，阿巴斯所屬法塔赫派系也一樣，多年沒有出路，令聲言不放棄武力消滅以色列的激進組織哈馬斯坐大。哈馬斯去年佔據加薩地帶後，不時用火箭彈襲擊以色列，以軍則以軍事行動和封鎖加薩地帶來還擊。  《蘋果》資料室"
20081227-234,20081227,234,防印度進犯　巴基斯坦急調二萬大軍抗衡,防印度進犯　巴基斯坦急調二萬大軍抗衡 印度孟買連環恐怖襲擊發生剛滿一個月，被指打擊恐怖分子不力的巴基斯坦，為防範印軍空襲，前天（周五）突然宣佈正從阿富汗邊境抽調兩萬大軍到印巴邊境，令南亞硝煙味道漸濃，美國、中國和英國都呼籲印巴克制。  巴基斯坦宣佈所有軍人消假之餘，又把駐阿富汗邊境瓦濟里斯坦的10萬大軍中，抽調第14步兵師兩萬士兵到東面的印巴邊境。據邊境居民說，運載士兵及軍備的車隊，要三個小時才能通過一個市鎮，可見這次軍事調動的規模極大。  總理吉拉尼（YousufRazaGilani）昨天出席前總理貝娜齊爾（BenazirBhutto）遇刺一周年紀念活動時強調，巴國無意跟印度開戰，「我們不會率先採取冒進的軍事行動，但同時會採取行動自衞」，表明這次調軍是要警告印軍切勿輕舉妄動空襲巴國，否則巴軍會自衞還擊。  巴軍如此緊張，並非杞人憂天，這與印度近日持續向巴國施壓有關。印度外長慕克吉（PranabMukherjee）指，巴基斯坦虔誠軍是策劃孟買襲擊的幕後黑手，除非巴國兌現反恐承諾，否則別怪印度採取主動措施。 傳印度擬空襲核設施 據《印度時報》報道，印度在上月26日孟買遇襲後，曾給巴國30天限期打擊恐怖分子，前天正是最後通牒屆滿日。據報印度連日來跟以色列、美國和英國情報機關秘密開會，商討聯手空襲巴國核設施的可能，所以巴軍不但連日派戰機在主要城市上空加緊監視，還急急抽調大軍到東面佈防。  美英兩國呼籲印度克制，而中國外長楊潔篪連日來跟印巴兩國外長通電話，呼籲他們透過對話解決問題。軍事分析家指，巴軍從西面調走1/5士兵，對反恐戰構成重挫，因為這讓塔利班和阿蓋德坐大，更難清剿恐怖分子。  法新社/路透社/美聯社 印巴開戰對兩國影響  --政治--  印度：孟買連環恐襲反映保安和情報出問題，印度選民廣泛不滿政府，當局採取強硬行動可贏回民心  巴基斯坦：戰爭可令愛國情緒高漲和帶來團結，使軍人勢力坐大，對文人政府統治進程構成重挫，印度可煽動俾路支省和普什圖族分離主義    --保安--  印度：一旦開戰，國內毛派游擊隊和東北部叛軍組織可能趁亂加強攻擊，伊斯蘭激進分子亦可能乘虛而入，從孟加拉邊境滲入發動襲擊，令印軍疲於奔命  巴基斯坦：軍方將放棄支援美國的反恐戰，令塔利班和阿蓋德勢力坐大    --經濟--  印度：令飽受金融海嘯冲擊的印度更難以復元，因為海空通道受阻，影響貿易，但軍用品需求會對製造業有刺激作用		巴基斯坦：政府剛向國際貨幣基金會借錢救經濟，爆發戰爭將令資金流出，印度會海路封鎖主要港口卡拉奇，明年經濟復蘇的希望勢幻滅    法新社
