key,date,article_daily_id,title,text
20090123-66,20090123,66,學商界聯手　紓緩畢業生壓力經機會應急七招保就業,"學商界聯手　紓緩畢業生壓力 經機會應急七招保就業 【本報訊】經濟危機引發的失業潮農曆年後將進一步浮現，行政長官曾蔭權牽頭的經濟機遇委員會昨宣佈推出七項「保就業」應急措施，包括增加大學助教及研究生學額，以及與商界合作推行實習生計劃，紓緩應屆畢業生就業不足的情況。此外，逾20個法定機構今年會招聘共6,000人，以及推出2,000份臨時工及實習機會，配合加快招聘公務員等措施，期望為勞動市場提供60,000個就業機會。人事顧問指新措施只能解決短期就業問題。記者：蔡建豪、梁美寶 應屆大學或中學畢業生，勢將面對畢業等如失業的困境。行政長官曾蔭權昨出席經機會會議後提出的七項新措施中，針對要求各大專院校，在新學年增加助教、研究員及研究生的名額，讓更多畢業生可選擇繼續升學，押後投身社會工作。  創新及科技基金會將擴大實習研究員計劃的資助範圍，僱員再培訓局會提供逾14萬個培訓名額，也是希望鼓勵參與研發工作，以及為待業及失業一族提供再培訓機會。 學生一邊搵工一邊進修 城市大學學生就業及實習策劃處處長郭秀芳承認，去年11月與前年同期的職位空缺數目比較，跌幅逾四成，預計今年大學生就業率將由去年的99%跌至60%。大學畢業生的月薪更會由約11,000元跌至僅9,000元，情況較03年沙士更嚴峻。  香港大學就業指導中心總監陳秉光稱，港大畢業生去年的就業率達100%，預計今年有2%至3%的畢業生未能找到工作，報讀研究生課程的比例也會增加。他指許多學生也會作兩手準備，一邊找工作、一邊報讀研究院。  在升學進修以外，曾蔭權建議畢業生參與企業實習生計劃，指已獲香港總商會及其他本地及國際商會同意，為畢業生提供為期少於一年的實習生名額；他也與香港中國企業協會取得共識，提供到內地企業實習及接受培訓的機會。  新措施另一重點是創造臨時就業機會，屋宇署已獲准聘用170人拆除全港5,000個棄置招牌。逾20個法定機構今年將招聘6,000人及提供2,000個臨時工或實習機會。其中醫院管理局計劃提供5,500個職位空缺，是各法定機構之最。海洋公園則會提供1,290個臨時職位或實習空缺，主席盛智文表示，隨着「亞洲動物天地」及「高峰列車」等新景點春、夏相繼啓用，料會聘用100名全職員工，公園擴建期間的推廣活動亦須額外聘用超過1,000名臨時員工。 人事顧問：僅短期紓緩 合眾人事顧問總經理蘇偉忠指出，經濟惡化對人力市場造成衝擊，政府的新措施全屬一些短期紓緩措施，考慮到私人機構吸納職位的能力，故鼓勵畢業生進修，「繼續升學，唔好出嚟住。」他認為政府今次挽救措施較沙士時期的層面廣闊，但實習生計劃成效很可能取決於政府的資助比例，「在商而商，唔係太多機構肯做。」 政府七項保就業措施 屋宇署：額外撥款1,800萬元拆除5,000個棄置招牌，提供170個職位    創新及科技基金：擴大研發人才方面的資助範圍及金額，提供600名實習研究員名額    僱員再培訓局：今年提供最少14.3萬個培訓名額    各大專院校：增加助教、研究員和研究生學額，紓緩畢業生就業    逾20個法定機構：聘6,000人及推出2,000份臨時工或實習機會    本地及國際商會：「實習生計劃」招聘年期少於一年的實習生    香港中國企業協會：安排本地大學畢業生到內地實習和培訓    資料來源：經濟機遇委員會 你想知　想講　想問? 你對經濟機遇委員會提出的保就業七招有何看法?    請即上《蘋果》網頁 http://appledaily.atnext.com留言喇！   或電郵至：mailto:focusgroup@appledaily.com  傳真：37112411　手機短訊：63836568"
20090123-67,20090123,67,他們不會謙卑或感恩 - 張成覺,他們不會謙卑或感恩 - 張成覺 張成覺　自由撰稿人 「今天我站在這裏，為眼前的重責大任感到謙卑，對各位的信任心懷感激，對先賢的犧牲銘記在心。」  奧巴馬就職演說就以如此平實的話語開頭，對於大陸的中國人，卻顯得格外新鮮。尤其是「謙卑」和「感激/感恩」這兩個詞，絕對是「中國特色的社會主義」國家元首講話中所欠缺的。 中央領導人不必致謝 人所共知，中共的「黨和國家領導人」履新，從來沒有向公眾發表過甚麼就職演說，此乃其選舉機制決定的。中共實行「集中指導下的民主」，無論黨或國家的最高職務，均由黨內核心人物一人或二、三人內定。故新任首腦不必向選民致謝與交代。  現任北京最高領導人去年訪日講的一段話，正是中共首腦人物的心理寫照。  事緣一位學童好奇地詢問這位中國「爺爺」：為甚麼想當主席？在一片哄笑聲中，中國「爺爺」輕鬆地答道：不是我想當（主席），是全國人民選我當。  顯然，這至少是盜用民意。大陸的「國家主席」名義上由「全國人民代表大會」選舉產生，具體操作則經由出席大會的「全國人民代表」投票。然而，那些代表都不是全民直選出來的，何況「國家主席」候選人也是由「黨中央」欽定之後，再讓代表們按表決機器，走走過場。  正因為此，「主席」不會對投票選他的代表「心存感激/感恩」，對自己榮膺重任也不會自感「謙卑」。  細加分析，其所以無「謙卑」感，原因在於：「黨」安排他擔任這個職務，是權力分配的結果。除非他是超級強人兼元老鄧小平，或者他是儍瓜，才會推辭不幹。既非「鄧公」，又非白癡，自然「當仁不讓」，欣然登上最高的寶座。那怕力所不逮，昏庸低能如李鵬，政績一塌糊塗，也可以搪塞過去。  至於「感恩/感激」，那倒是有的，只是其對象不是與會的那二、三千名「全國人大代表」，而是破格提拔隔代「接班人」的鄧公，和其他幾位名列「八老」的革命前輩。 中美先賢屬對立營壘 這就是中國的「國情」。跟大洋彼岸的美利堅合眾國，實在是大異其趣。看來，要中共領導人學會「謙卑」和「感激/感恩」，還不知是那年那月的事！  當然，中美元首的心態也不是全無相通之處，例如「對先賢的犧牲銘記在心」，應屬心同此理。即所謂飲水思源，喝水不忘挖井人也。  只不過兩者的「先賢」分屬對立營壘。奧巴馬所頂禮膜拜的林肯，是自由、民主、平等、博愛、人權、法治等普世價值的忠實信奉者與勇敢捍衞者，勢將為千秋萬代所景仰；而中共的「先賢」卻是誤信共產邪說的受騙者或毛式暴政的維護者，必將被後人遺忘或遭人唾棄。
20090123-68,20090123,68,扁家弊案的歷史意義 - 北方可可,扁家弊案的歷史意義 - 北方可可 北方可可　大陸《博客網》專欄作家 十九日，備受矚目的台灣前領導人陳水扁家族四大弊案，在台北地方法院開庭審理。毫無疑問，陳水扁卸任後涉案被查，並已開庭審理，這是他咎由自取，同時也是台灣法律對「法律面前人人平等」這句話的一次具體踐行。  談到扁家弊案，筆者無意去探討具體案情，只想從一個內地百姓之視角來談一點個人感受。筆者以為，無論陳水扁最終是否被判入監或者入獄幾年，從司法獨立這個角度來看，陳水扁今天能夠被押上審判台，它本身已經是台灣民主和法制進步的一個具體體現，因為在台灣的兩蔣時代，包括李登輝時代，這樣的事情都是斷不可能發生的，因此該案當然具有一定的歷史意義，甚至是劃時代的一件大事。關押前領導人這樣的事情，人們此前只從媒體上看到過，例如在韓國、在秘魯等國；但在中國歷史上，至少人們還不曾看到過在和平時期以法律手段處置前領導人。事實上，「法律面前人人平等」、「天子犯法與庶民同罪」等等這些中國諺語，長期以來都僅僅是一句諺語而已，而陳水扁此次之被審判，以歷史的縱向觀察來看，它把這些中國諺語變成了事實。  毫無疑問，在內地，從陳良宇到陳希同，再到成克杰，這些高官之被判刑，它同樣也是歷史的一個進步。不過，坦率來說，內地司法獨立的步子看上去仍然步履蹣跚，舉步維艱。一個簡單的觀察是，在內地的涉案貪官東窗事發之後，人們看到，先行介入調查的並非是應該及時介入調查的國家司法機關，而是黨的紀律檢查機關，「雙規」這種措施顯然就不是司法行為，但這樣的「處理」規矩和程序似乎至今仍在沿用，而國家的司法機關就只有在適當時候接受「雙規」之後的「移交」而已。我想無論怎樣，這都不能說成是一個正常而規範的司法程序，且不去說在這一過程中正義和公平是否得到了維護。  我們不妨說回台灣的事情。弊案纏身的陳水扁如今看上去難逃這場牢獄之災了，因為檢方所起訴的犯罪事實似乎確鑿無疑，律師出身的阿扁縱使多出一張嘴，怕也難以黑白顛倒了。不過，撇開弊案本身，客觀、理性、歷史地來說，陳水扁及民進黨他們對台灣民主和法制進程的推進是有貢獻的，這一點應當實事求是；因為主要是這些人長期以來所做出的努力，才實現了台灣的第一次政黨輪替，威權政治才退出了歷史舞台。無論政黨之間的惡鬥，還是選舉中間的政治操作，抑或是族群撕裂這些現象的出現，包括直到今天台灣的立法院裏常常出現的扭打場面；但宏觀來看，這樣的政治「亂象」（權且如此概括），它總比國民黨的一言堂好，比沒有選舉好，比少數人說了算好，這應該是一個無可爭辯的事實。  華人世界裏能把一個前領導人送上法庭，這的確很不容易！從這個意義上來說，該案之後會如何「落槌」我看已不重要，重要的是已經跨出的這個「第一步」。
20090123-69,20090123,69,公款買套不算甚麼 - 簡敬禧,公款買套不算甚麼 - 簡敬禧 簡敬禧　自由撰稿人 安徽省國土資源局官員被網民揭穿用公款豪飲大喝之餘，竟還買了二十多盒「想念」牌安全套。事件被公開，民眾群起攻之，被指摘的主要有兩點，首先是用公款喝貴酒、吸貴煙，還涉嫌召妓；二是用公款買安全套，「一次買二百多個，用得那麼多嗎？」但只要略略了解祖國國情，便明白官員用意。 由官員帶頭消費 金融海嘯，席捲全球。胡總早前提出挽救經濟措施，其中之一，就是刺激內需，由地方市民帶起消費，如小齒輪滾大齒輪般，逐步向上擴展，增加廠商定單。眾所周知，內地各地方政府大大小小的部門官員，從來就是最核心最長情的高消費一族，八萬八千八百八十八元人民幣一席的團年夜飯，圍坐一起的，除了少數暴發土豪外，就是這些地方父母官了。中央指示多消費救市，官員帶頭，用公帑拯救面臨破產及裁員危機的酒廠、煙廠、酒樓、夜總會，用真金白銀挽救了幾多山西民工，餵飽了幾多湖北三陪，還未計他們家鄉的家人，真乃用心良苦。  此外，內地一直奉行一孩甚至無孩政策，官員以身作則，用套自縛，一來免除後患，二來防止性病愛滋，減少國家教育及醫療開支，此等愛國行為，何止高尚，簡直應當表揚。  至於召妓嘛……，妓也有家人啦，也要幫啦，況且市道不佳，官員壓力也很大，適當的鬆弛，也很平常，二百多個套，不算甚麼啦，何必這麼小家呢？
20090123-70,20090123,70,蘋果論壇漫畫 - 馬龍,蘋果論壇漫畫 - 馬龍
20090123-71,20090123,71,歡迎投稿,歡迎投稿 本報對來稿有刪減權，勿一稿兩投。來稿須附姓名地址電話。退件請附回郵信封。來稿可用下列方法擲交。郵寄：香港新界將軍澳將軍澳工業邨駿盈街八號一樓《蘋果日報論壇版》收；傳真：23703283；電郵：mailto:forum@appledaily.com
20090123-72,20090123,72,食店沙律活蟲嚇壞顧客,食店沙律活蟲嚇壞顧客 讀者尹小姐早前偕友人到和民居食屋旺角文華分店用餐，其間點選了海老帶子沙律，未幾侍應送上賣相精美的沙律，正當各人準備大快朵頤之際，她發現碟上有一條蟲在蔬菜間蠕動。「條蟲啡色，大約兩吋長，好以蚯蚓咁，慢慢喺菜裏邊爬出嚟，好核突。」 料蔬菜未徹底清洗 席上各人均被嚇得食慾全失，雖然職員願意善後，但她仍不滿和民未有妥善處理食物，威脅食客健康。  和民居食屋客戶服務部表示，該公司的出品均需符合既定程序才供顧客享用，相信是次事件源於蔬菜未有徹底清洗，導致蔬菜裏有殘留昆蟲，該公司已要求各分店確保所有食物衞生，避免同類事件發生，並向尹小姐道歉，若事件引致任何問題，公司願意負責。檔案編號﹕0111001    社會服務  報料熱線：29290000  社會服務熱線：29908288  蘋果日報慈善基金：29908688  傳真：37112468  網上捐款： http://charity.atnext.com/donate   各類表格： http://charity.atnext.com/forms   電郵：mailto:sservice@appledaily.com    匿名投訴恕不處理。一經投訴，本報保留刊登權利。
20090123-73,20090123,73,電子恐龍爆皮難尋供應商保養,電子恐龍爆皮難尋供應商保養 Pleo電子寵物小恐龍趣致可愛，讀者譚先生於3個月前以約3千元在百老滙購入一隻，惟上月發現Pleo表面出現多處爆裂，由於產品有一年保養，他遂即時與提供保養服務的Pleo香港供應商傲米子實業（香港）有限公司（OMIZ）聯絡，惟客戶服務熱線長響，以電郵聯絡又沒有回覆，不知如何是好。 上門探訪吃閉門羮 本報致電OMIZ的客戶服務熱線，但聽筒傳來「嘟」長響，無法接通，而官方網站也無法登入。記者到該公司位於觀塘的地址查訪，發現門外貼有「是日盤點，暫停營業，不便之處，敬請原諒」的告示。本報曾透過曾發售此產品的百老滙與OMIZ聯絡，百老滙表示，OMIZ的營業代表告知負責人不在香港。該公司已沒銷售Pleo，並正積極與OMIZ聯絡處理產品保養事宜。顧客如可致電27436611查詢。檔案編號：1229008    社會服務  報料熱線：29290000  社會服務熱線：29908288  蘋果日報慈善基金：29908688  傳真：37112468  網上捐款： http://charity.atnext.com/donate   各類表格： http://charity.atnext.com/forms   電郵：mailto:sservice@appledaily.com    匿名投訴恕不處理。一經投訴，本報保留刊登權利。
20090123-74,20090123,74,積金知多啲：自僱人士可按年供款,"積金知多啲：自僱人士可按年供款 問：本人過往受聘於一家雜誌社擔任攝影師，最近離職，轉任自由攝影師。本人知道自己應屬於強積金制度下的「自僱人士」，請問我是否應加入強積金計劃，及須否每月替自己供款？  答：在強積金制度下，自僱人士是指凡年齡18歲至65歲前，並非受聘於任何人士或公司，而以非僱員身份提供服務或貨品來賺取入息，不論是獨資經營者，或是生意合夥人，均屬強積金制度下的自僱人士。因此，你需加入強積金計劃及準時供款。 申報入息方式 不過，自僱人士與一般僱員不同，可以選擇按月或按年供款。自僱人士可以選擇以下申報有關入息的方式，包括以最近稅單的應評稅利潤作為有關入息；以個人入息免稅額作為有關入息；以書面聲明向受託人申報有關入息；或以供款入息上限，即每年港幣1.2萬元或每月1,000元作為供款。積金局熱線：29180102"
20090123-75,20090123,75,「撐企業」方案翻生財困僱主可重組債務,"「撐企業」方案翻生 財困僱主可重組債務 【本報訊】金融海嘯令不少企業面臨倒閉的風險，特首曾蔭權昨在經濟機遇委員會會議後，提出政府「撐企業」方案，將重新考慮多年前胎死腹中的拯救企業程序，向面對短期財政困難、但長遠仍有生存能力的企業，提供翻身及重組債務機會，希望企業員工不用因企業倒閉，加入失業大軍行列。 中小企貸款已批29億 財政出現嚴重問題的企業，離不開被清盤或申請破產。曾蔭權昨表示，本港企業面對的財政困難普遍是缺乏短期周轉資金，長遠來說仍有生存能力。參考美國及歐洲做法，可以考慮給予有關企業一個凝結期，讓企業考慮債務重組，企業若能繼續生存，旗下員工即可避免失業遣散。  拯救企業程序的立法草案曾於2001年呈交立法會審議，銀行及僱員組織當時均對立法建議有保留，不同界別也憂慮自身利益被剝削。早前指金融海嘯期間不宜處理政改諮詢等爭議性議題的曾蔭權，被問及會否憂慮立法拯救企業程序會引發廣泛爭議，他回應謂拯救企業並非短期方案，仍需進行諮詢，最重要是解決存在已久的企業結構問題。  曾蔭權亦指出，政府早前預留1,000億元支援銀行貸款予中小企，目前已收到逾1,700宗申請，並已批出了29億元貸款。政府亦會於今年籌辦一系列大型節目及國際級盛事，包括體育及本土節慶活動，提升盛事之都形象，促進旅遊及零售業。  此外，地政總署已整理全港可供非政府機構短期租用的政府空地資料，各機構可於分佈各區的1,000塊土地舉辦社區活動，鼓勵及刺激地區經濟，若活動得到區議會及政府部門支持，機構只需繳付象徵式的1元租金。"
20090123-76,20090123,76,大學校友提供空缺,大學校友提供空缺 【本報訊】金融海嘯來襲，大學畢業生隨時成為失業大軍，大學不得不出手「救市」，各出奇謀招攬職位，有大學校長呼籲校友為師弟妹提供職位，也有大學邀請企業家教導畢業生如何創業，以及提供心理輔導及畢業前特訓等。 開辦講座教創業 城市大學學生就業及實習策劃處處長郭秀芳表示，今年就業情況並不理想，校方預計不少畢業生未必立即找到工作，故近日已聘請企業家到校，教導學生如何創業；同時，校方每月舉行一次的就業講座，以往甚少爆滿，即使報名後也有學生缺席，但現時在有關講座甫推出即在一、兩日內爆滿，反映學生求工心切。  香港大學近日亦有邀請校友回校，教導師弟師妹如何在逆境中找工作及面對金融海嘯。  嶺南大學校長陳玉樹近日則向校友發電郵，呼籲校友若所屬公司有全職或兼職空缺，希望能為800名今年5月畢業的嶺大畢業生提供就業機會；若嶺大校友所認識的朋友或其公司有職位空缺，也可介紹給嶺大學生。  中文大學發言人表示，大學學生事務處的就業策劃及發展中心已加強與僱主組織及校友的聯繫，了解市場情況，以及安排校友交流會，為準畢業生提供求職意見；中心也將加強寰宇暑期實習計劃，為學生尋找實習機會。 大學生反應 城大二年級學生  Jeffery：「雖然出年先畢業，但擔心金融海嘯持續影響就業，會提早一年為搵工作準備。」 城大應屆碩士畢業生  申曉瑩：「擔心喺金融海嘯之下搵唔到工做，所以𠵱家已經開始寄求職信。」
20090123-77,20090123,77,狂野照再現網上張茆攬仔示威,狂野照再現網上 張茆攬仔示威 【偽情日記之芳蹤處處】賤男倪震偷啜城大女生張茆（Miffty），這段風流史糾纏了個半月，後來演變至倪震和周慧敏結婚，張茆也返港重歸校園，表面上似暫息風波，但實情仍有暗湧。近日網上再度流傳大批張茆性感照，有騷胸自拍、瞓床伸脷、煲煙劈酒甚至貼身攬仔，野性狂放表現應有盡有。 與倪震一啜成名的22歲城大女生張茆，本月初已返港回歸校園，搣甩冶艷形象扮乖學生上堂。之前她在聲明上指發生蘭桂坊濕吻事件後上了人生中最寶貴一課，今後必用心完成學業，積極堅強面對生活，言猶在耳，但近日網上竟湧現大批從未曝光的張茆性感照，其狂野不羈一面叫人驚嘆。 辣妹本色 瞓床伸脷玩誘感 有鋪自拍癮的張茆，自上月8日與倪震的茄輪照被刊登後，網上即瘋傳她近百張的自拍性感照及生活照，令她驟變網上紅人。沒料到偷食事件近日漸趨淡化，張茆也重返校園，日前網上卻流傳多幀張茆從未曝光照片，相中的她貫徹辣妹本色，其中一張照片她身穿至愛的斑馬紋低胸背心戰衣，黑bra跌帶，貼身攬實一名年輕男子，女方笑容得戚，示威之味甚濃。  在上月曝光的張茆自拍照中，其實已有她攬洋漢及啜女友的豪放照，今次流傳的自拍照更凸顯其野性。她無視旁人眼光，在不同的洗手間對鏡自拍，其他自拍場景尚有閨房、夜店及升降機等，不過以她瞓床伸脷的大頭照最挑逗，至於其他相片她大多低胸露腿示人，劈酒煲煙也狂影一餐。 網誌紀錄 自爆鍾情笨叔叔 張茆喜愛網上交友，但她在聲明上曾強調濕吻曝光後，翌日即將新浪博客關掉，這個她認可的網誌，就曾一度上載她和倪震的合照。近日有網友找出其博客文章存檔頁面，發現她「出事」前仍密集式寫日誌，透露夜夜笙歌的爛蒲生活，同時也訴說了她的女兒心事。  一直有傳張茆和倪震老早相識，蘭桂坊事件前約一周，她在11月30日的網誌上講述與友蒲吧玩到high，又自爆鍾情年紀大的男士「笨叔叔」，令人懷疑此君是中坑倪震，她提道：「笨叔叔的外套很大很溫暖，我昨天很不舒服，真的很難受，還好有笨叔叔照顧，有人照顧有人關心真好……現在23、4歲的男生我都覺得好小哦，喜歡大的男生，比較有安全感。」  張茆在另一篇網誌上又寫道：「我很Playgirl麼？沒有啊，我們都有很愛的人。」10月時她在網誌上曾自嘆悲哀：「在Club開的花，怎麼會沒有沾上煙味？」又曾說：「我發現我真的是個很天真很蠢的人。」其說話是反映心情抑或另有所指，相信只有張茆和倪震兩人最清楚。撰文：李全 娛樂資料庫：男人緣不斷顯魅力 活躍夜店的張茆，野性索女深受異性歡迎，44歲賤男倪震也拜倒石榴裙下，與她在蘭桂坊夜場濕吻五分鐘。至於青梅竹馬男友林鵬，網上也流傳一張親密照，相中人半裸貼在一起，男方的背部更刺上「M」（Miffty）字紋身，是為愛的印證。可惜偷啜事件後有傳兩人感情破裂，林鵬還表示要褪走紋身，puppylove宣告死亡。  張茆更毫不掩飾自己的魅力，不時張貼與男伴的親密合照，先有與老外親密依偎照，又有與男性友人齊齊瞓大床的照片，更曾與男伴兩手拼心心的示愛相，認真花樣多多。
20090123-78,20090123,78,梁漢文約滿無人問,梁漢文約滿無人問 無綫《勁歌金曲》前晚在將軍澳電視城進行錄影，參與演出的有關淑怡、梁漢文、Freeze、可嵐及小肥等，向來愛出位裝扮的關淑怡，今次卻未有令人驚喜，她一身黑色低V，全程配上太陽鏡，而Freeze則例牌拋胸露腰，至於玉女新晉歌手可嵐則罕有地酥胸半露。 可嵐木瓜豐胸 梁漢文自言婚後要全面復出，他說：「雖然家人未有催生BB，不過有所暗示，對造人大計我哋盡力而為。」另外，已約滿金牌的梁漢文，還未續約，他自言並非獅子開大口之人，而且因為沒有人知他約滿，故未有其他公司接觸他。  Freeze在農曆年期間到澳門賭場登台，她們去年同樣到澳門登台，𢭃得過萬元利是，希望今年繼續有利是進賬。至於一向甚少性感示人的可嵐今次忽然拋胸上場，她接受訪問時說：「平日好少咁着，所以有啲唔慣，我之前減肥但係又唔想減胸，咪日日食木瓜，𠵱家上圍豐滿咗。」  採訪：卓寶花  攝影：陳順禎
