key,date,article_daily_id,title,text
20090503-111,20090503,111,電戲道：南京！南京！血的反思,電戲道：南京！南京！血的反思 南京大屠殺，聽起來已相當沉重，72年了，雖然見證歷史的人越來越少，但日軍種種暴行，早已刻在中國人的腦海，日本教科書怎樣竄改也改不了。《可可西里》導演陸川花了4年時間拍攝黑白電影《南京！南京！》，好讓世人重新了解南京大屠殺，並嘗試以日本軍人的角度反思戰爭意義。內地名導馮小剛曾說，香港人只懂向國產片說×，且看這部製作認真、具歷史深層意義的內地電影，香港人又會如何對待。　撰文：馮國康 當我知道要寫這篇關於南京大屠殺電影的專題時，其實我是拒絕的。一想到戰爭的殘酷、日軍的暴行以及30萬同胞被屠殺，從未體驗過戰爭的我，也覺得這歷史包袱太沉重了，怎樣也無法落筆。顯然，陸川沒有小記般懦弱，這位憑《可可西里》聲名大噪的內地年輕導演，花了4年汗血拍攝這部震撼人心且極富爭議性的電影《南京！南京！》，目的就是逼我們這一輩，反思這段以血寫成的歷史。 日軍角度反思戰禍 電影從1937年12月13日南京淪陷開始，雖有國民黨士兵潰逃出城，但仍有流着熱血的中國人奮死掙扎，為光榮而戰，劉燁飾演的國民黨精銳部隊下級軍官陸劍雄，便是其中一員。抵抗失敗後，士兵被推入江中、活埋、砍頭、槍殺，南京城一片死寂，惟獨德國商人拉貝先生（JohnRabe）建立的南京安全區，成了難民收容所。范偉飾演的唐先生和高圓圓飾演的姜老師，便肩負起安全區的工作，保衞着20萬人的性命。 以往的抗日電影，多將日軍描寫成滅絕人性的魔鬼，陸川卻大膽以日本將士為視角，嘗試從侵略者角度反思戰爭的代價。中泉英雄飾演的日本士兵角川先生，是全片的核心人物，對於被扯進這生死之城，他一開始已覺無奈，到後來看見無助的平民枉死，得知心愛的女人被蹂躪，到槍殺高圓圓，蘊藏在心底的良知一次又一次被衝擊，最終完全陷入崩潰。 結局中，角川先生親手將兩名中國人送出南京城後吞槍自殺，試圖救贖自己邪惡的靈魂，並引證他的遺言──生比死更困難。不過陸川將日軍侵華暴行變得「人性化」，惹來爭議及抨擊早已在他預計之中。 抨擊聲中收1.1億 《南京！南京！》採用黑白影像也是另一大特色，因它所呈現的視覺震撼更加強烈，令死城南京變得更愁雲慘霧，被屠殺的國民更觸目蒼凉。事實上，電影毋須刻意渲染血腥，也不需借助顏色彰顯殘缺，因內容本身已具備所有衝擊與色彩。 日前《南京！南京！》在內地一片爭議聲中上映，僅十日票房已收1.1億人民幣，更有望在日本上映。撇除所有國仇家恨，我覺得身為中國人，都應該花這130分鐘時間到影院走一趟，用心反思戰爭的代價。 香港上映日期：5月7日 五大難忘場面 以下含有《南京！南京！》故事情節，不喜勿看！ 捨生守城 電影一開始，劉燁所屬的國民黨精銳部隊明知沒有希望，仍奮力守城頑抗日軍，展現的正是寧死不屈的民族特性。在開場的巷戰場面中，導演陸川以主觀鏡頭拍攝槍林彈雨的畫面，節奏明快緊張，令觀眾猶如置身戰場，體驗戰爭的可怕。 從容就義 既然由影帝劉燁掛帥，理應由他擔任救世角色，但《南京！南京！》沒遵從這大片慣有格局，劉燁出場約半小時便為國捐軀。死前一刻，他怒目盯着東洋鬼子，然後轉身蓋上小兵雙眼，靜待死亡來臨。他的犧牲令整齣電影更顯悲壯，激起觀眾的反戰情緒。 獻身救人 日軍到處姦淫虜掠，有次來到南京安全區，要求拉貝先生交出100名女人以換取日常物資。青樓女子小江無言舉手，無私奉獻肉體以救助落難同胞，為的只是換取更多人生存的機會。原來，在人性扭曲的亂世中，仍存在着高尚的情操。 諷刺祭祀 電影後段加插一幕極富爭議性的場面，日軍舉行了肅穆莊嚴的祭祀儀式，為陣亡戰友送終，一段日本傳統舞蹈伴奏大和民族樂韻，對同胞之愛，以及對他人之殘暴，形成超強烈對比。然而，這幕戲有浪漫化大屠殺惡行之嫌，招來猛烈抨擊。 以死贖罪 范偉飾演的唐先生為保全性命出賣同胞，但目睹女兒被日本人擲出窗扔下樓後，才醒覺委曲求存根本沒用，良心也備受譴責。原本他可與妻子離開南京，但最終決定留下來為靈魂救贖，笑着對妻子說：「放心，這個月的工資會準時交給你。」不久卻被日軍處死。 話你知：日人角度爭議性大 《南京！南京！》以日軍角度反思戰爭，其實荷李活導演奇連伊士活（ClintEastwood）06年執導的《硫磺島戰書》（LettersFromIwoJima圖），同樣是以日本人的視覺去看太平洋戰爭，贏得不俗迴響。 不過從日軍角度反思戰爭未必萬試萬靈，如日本已故大導演黑澤明晚年執導的《8月狂想曲》，內容描寫第二次世界大戰原子彈爆炸過後45年的長崎，意圖化解歷史所帶來的仇恨苦痛，卻引起國際紛爭。 資料庫：歷史傷痕血染銀幕 東洋鬼子侵華，令無數國民留下無法磨滅的創傷，這一段以血寫成的悲慘歷史，也成為了不少電影的題材。 《地雷戰》1962年 以海陽地雷戰為背景，講述海陽人民自製地雷，令日軍聞風喪膽。 《屠城血證》1987年 由羅冠群執導，陳道明主演，全片圍繞南京大屠殺，純粹展示東洋鬼子惡行。 《南京1937》1995年 吳宇森監製電影，以中日結合的家庭作為視鏡，側面描寫大屠殺的可怕。 《黑太陽南京大屠殺》1995年 素以血腥殘忍鏡頭聞名、曾拍攝《黑太陽731》的導演牟敦芾執導，在銀幕重現那段慘絕人寰的歷史。 《五月八月》2002年 講述一對年幼姊妹五月和八月，在南京大屠殺的洗禮下，如何掙扎求存的故事。 《南京》（Nanking）2007年 外國人製作紀錄片，由劫後餘生的人親身談及不堪回首的回憶。 《戰火逃城》2008年 同樣以南京大屠殺為背景，講述周潤發飾演的游擊隊員，帶領60名戰爭孤兒逃避戰火。 資料來源：《蘋果》資料室
20090503-112,20090503,112,電子傳媒自我防疫,電子傳媒自我防疫 香港終於出現了豬流感，電子傳媒每天仍要繼續運作，因此各傳媒都加強防疫措施。無綫外事部副總監曾醒明指公司在兩日前已作出內部通知，他昨日在電話說：「公司嘅洗手間、電梯㩒掣同門柄等都會定時消毒，亦要求有病嘅員工要戴口罩或放病假。」至於前線採訪的新聞部同事，曾醒明說：「採訪過高危地方嘅同事，佢哋喺出面有辦公室，唔需要返公司，佢哋嘅採訪車入面，會有防疫裝備。」 藝員咀戲照拍 無綫有見疫情未趨嚴重，暫時仍會招待現場觀眾參與綜藝節目錄影，曾醒明表示旗下藝人拍接吻戲仍如常，但若藝人有不舒服，可以提出跳拍。無綫製作資源部總監樂易玲則呼籲藝人沒必要勿離港。亞視公關部助理總監區展程指亞視同樣關注疫情，防禦措施跟當年沙士一樣，他昨日在電話說：「公司內部加強消毒，新聞部同事採訪車內會有齊防疫裝備畀同事用。」 新城和商台主要以電台節目為主，兩台的防疫措施相似，新城台長朱明銳昨日在電話中說：「為防傳播細菌，所有咪會戴上咪套，DJ必須戴口罩做節目，完咗仲要換埋咪套，直播室仲備有消毒噴霧。」 採訪：葉雪　攝影：娛樂突發組
20090503-113,20090503,113,吳尊訪日即探額溫,吳尊訪日即探額溫 吳尊、張韶涵、辰亦儒和胡宇崴4人不怕豬流感的威脅，前日飛到日本大阪宣傳《公主小妹》，日本機場為了防止疫情蔓延，甫到關西機場就要量度體溫，現場更出現長長的人龍。吳尊因膝蓋舊傷未癒，乖乖坐在輪椅上量額溫，4人花了兩個小時才完成出關手續，吸引過百名歌迷接機。 瘋狂購物 各人為了安全起見也自備口罩，吳尊的緋聞女友張韶涵此行與親友同行，張韶涵到達的首天就立刻到市內瘋狂購物，第二天吳尊與張韶涵一碰面就鬥嘴，旁若無人地打情罵俏。 採訪、攝影：黎寶蘋
20090503-114,20090503,114,北京直擊克勤下月赴美：好擔心,北京直擊 克勤下月赴美：好擔心 李克勤、譚詠麟和曾志偉前晚到北京出席音樂會，他們均知道香港有一宗豬流感確診個案，克勤表示擔心一定有，希望疫情快來快走，他說：「真係冇辦法，惟有勤啲洗手，注意個人衞生。下月要去美加做演唱會都擔心㗎，始終屋企都有小朋友。我啱啱有啲感冒都食咗藥，因為唔知啲菌會點。」克勤表示每次出埠之後都會自我隔離兩日，以免感染囝囝。 勿歧視墨西哥人 問到阿倫會否擔心下月美國的《左麟右李》演唱會要取消？他說：「主動權唔喺我哋度，要睇搞手。香港之前有沙士，當時如果俾人知道係香港人都會被人歧視，家發生豬流感大家唔好歧視墨西哥人，大家要共同面對，家家有求，全世界都有可能發生。」 曾志偉則擰擰頭說：「多災多難呀，希望快啲過去啦，香港人以前都感受過，大家應該互相幫忙。」 採訪、攝影：曾小嘉
20090503-115,20090503,115,群星灣仔開P保持距離碧兒豬嘴口罩嚴陣以待,群星灣仔開P保持距離 碧兒豬嘴口罩嚴陣以待 無綫一眾花旦廖碧兒、胡杏兒、葉翠翠及甄子丹太太汪詩詩等，前晚在灣仔出席派對，碰巧附近的維景酒店有旅客確診豬流感，廖碧兒表示母親在加國寄豬嘴口罩給她；汪詩詩也直言有點擔心，她指賓客進場時還未公佈確診個案，大家臉貼臉熱情打招呼，但離場時大家得知消息即改為飛吻。 香港前晚出現首宗豬流感確診個案，患者來港後入住灣仔維景酒店，港府為防疫症擴散，前晚暫時封鎖酒店。有傳媒適逢前晚在灣仔會展舉行周年派對，廖碧兒、汪詩詩、胡琳和鮑起靜等畀面出席，現場星光熠熠，可是派對中段，嘉賓們獲悉灣仔確診豬流感個案，大家為安全都盡量保持距離。 母返加擔心疫情 廖碧兒表示一直留意疫情最新發展，但她前晚在派對中卻不知灣仔出現確診個案，她昨日在電話中說：「好彩家知病者喺墨西哥嚟，正係豬流感爆發源頭，慶幸媽咪啱啱返咗加拿大，佢好擔心我，仲話要寄啲豬嘴口罩返嚟畀我預防。」 甄子丹太太汪詩詩昨日在電話中說：「派對中段，我收到sms話有豬流感確診，當時都幾驚，始終派對都有咁多人。所以大家嚟派對前都有臉貼臉sayhi，但走嘅時候，大家都改做airkiss，小心啲嘛。」 身在內地拍戲的甄子丹很擔心疫情，每天都致電提點太太做足預防措施，汪詩詩說：「我哋屋企有小朋友，我都特別緊張，堅持要工人用漂白水拖地，邊個出完街返嚟都要立即換衫換鞋，屋企都買定幾盒口罩，以備不時之需。」 胡琳搭的士心驚 此外，胡琳和吳亭欣前晚離開派對時，分別在的士上聽新聞報道證實灣仔有確診消息，二人感到與豬流感擦身而過，回家立即由頭洗到腳清潔一番，胡琳昨日在電話中說：「小心駛得萬年船，保持個人衞生好重要。」吳亭欣則說：「都唔知啲細菌傳播到去邊，但會勤啲洗手，同人傾偈都唔行咁埋。」鮑起靜丈夫方平表示太太易患感冒，既然疫情已殺到香港，他說：「我都要買定口罩畀老婆。」 採訪：比華利　攝影：陳俊強
20090503-116,20090503,116,動漫Maggie擊退封胸碩之,動漫Maggie擊退封胸碩之 前晚有傳媒在會展舉行70周年慶祝派對，不少女星低胸露背性感出擊，李曼筠（動漫Maggie）身穿低V短裙上陣，青春逼人；一向喜歡展示驕人身材的Freeze盛裝赴會，她們的谷胸裝令人眼前一亮；至於電影《3D玉蒲團》的女主角葉玲穿上低V晚裝，其34C逼爆上圍也成為焦點。 怕局限形象 反觀36D的趙碩之卻封胸赴會，失色不少，她說：「因為好多前輩同我講，唔好成日將焦點放喺個胸度，如果唔係好局限形象，不過有工作要求我都會解封。」 採訪：胡比 攝影：陳俊強
20090503-117,20090503,117,梁廷鏘拒談前妻爆料,梁廷鏘拒談前妻爆料 寇鴻萍丈夫梁廷鏘日前偷食斷正，事件曝光後，前日兩夫婦於馬場晒恩愛，卻遭梁廷鏘首任妻子于楓踢爆他經常偷食。前晚寇鴻萍偕夫婿在灣仔出席派對，陳慧嫻和許志安上台演出。 另外，寇鴻萍與丈夫日前接受傳媒專訪，表示不能忍受丈夫偷食，不過兩人在訪問中卻表示恩愛如昔。寇鴻萍更稱丈夫可能遭人佈局，為了贖罪，梁廷鏘表示會送大禮給她補鑊。昨日記者致電梁廷鏘問到其前妻于楓力數他的「偷食」前科，他甫聽到記者問題時立即說：「我家開緊會。」之後便掛線。 採訪：顏英儀　攝影：陳俊強
20090503-118,20090503,118,清朝四合院祖屋遭強拆89歲滿族婦北京街頭申寃,清朝四合院祖屋遭強拆 89歲滿族婦北京街頭申寃 祖先遺留的清朝四合院，竟被當局強拆，更傳出變成中國紅色資本家、已故國家副主席榮毅仁後人的居所！89歲滿族的北京老人王琳，身穿抗議標語的T恤，在一連三日的五一假期，與子女走上街頭抗議，誓要拿回祖屋。 「6年無家可歸了！」王琳與一班子女前日開始在北京故宮東側、著名的南池子大街的祖屋門口抗議，在街頭不斷大聲疾呼。其間，有不少便衣公安在附近監視，但無人上前阻止。 傳榮毅仁後人遷入 王琳53歲的女兒黎江昨日接受本報訪問時稱，昨日有6、7名便衣公安在附近監視，下午時分，突然有警車到來，有公安上前查問，問他們為甚麼在此，後來，屋內一名男子駕車離開後，警車也開走了，相信是屋主要外出，擔心他們鬧事，所以向派出所報警。她不知道屋主的身份，但很多消息都說是榮毅仁的後人。 王琳說，自己上街「是迫上梁山，忍無可忍呀」！據悉，王琳與子女一直住在南池子大街46號的祖屋，而大街過去曾有不少名人居住。但2003年2月，他們突然接到北京東城區人民政府一紙強拆令，以修繕南池子文化區為由，在3日後即19日，開發商即派人強拆他們的房子，屋內所有東西也被搬走。後來，開發商就在原址興建豪華四合院，並改名為66號院。自此，王琳就到處「漂泊」。王琳稱，祖先在乾隆年間曾在上書房為師，雖然以後家道中落，但是一直居住在紫禁城東側的南池子大街46號院。 黎江氣憤地說：「母親（現在）都在親友家這裏住兩天，那裏住兩天。」「產權證都在我們手中，土地使用權還是我家的，我們想不通。當局有人跟我們說可以賠錢，但我們不要錢，屋是我們的，我們會一直在門口抗議，以後，每一個周、六日都會來，一直等到當局答覆。」王琳家人過去6年從地方到中央不斷上訪，但沒有一次得到回音。黎江無奈地說：「沒辦法，現在只能這樣（上街抗議）。」南池子緊鄰故宮東牆，歷史上是元明清三朝皇城的一部份，曾經作為官署和各種庫房的用地。 博訊/本報記者
20090503-119,20090503,119,廣州櫃員機提款遇劫老闆捱斬搶回染血鈔票,"廣州櫃員機提款遇劫 老闆捱斬搶回染血鈔票 廣州治安不靖。一名商人在上下九路鬧市的櫃員機提款後，被匪徒從後連捅兩刀，要脅把錢交出，但是商人不從，試圖反抗，匪徒於是再斬其左手，將3,000元人民幣（下同）搶走，商人情急之下，從匪徒手中強搶回12張染血鈔票，匪徒最後逃去無蹤。 事發在上九路、人民南路交界的銀行櫃員機，前日清晨7時許，姓林的服裝商人從櫃員機提取3,000元準備買貨，他轉身欲離開時被一名頭戴鴨舌帽、帶普通話口音的中年匪徒連捅兩刀，傷及胸部，歹徒威脅林把錢交出，林奮起反抗，與歹徒拉扯，混亂間歹徒斬傷林的左手，刀刃卡在他的左手上。匪徒趁機搶走現金，林從後追趕，從匪徒手中奪回12張染血鈔票，匪徒搶走1,800元逃去無蹤。 林最後追不到匪徒，左手流血不止，附近路人見狀致電召喚救護車。醫生表示林傷及胸部，要動手術將瘀血及氣泡移除，左手傷勢嚴重，不排除骨折及傷及神經線，若傷及神經，可能會出現局部不靈活等後遺症。公安正調查案件，相信櫃員機周圍的多個閉路電視鏡頭，應該可拍到案發經過。 廣州《羊城晚報》"
20090503-120,20090503,120,打針偷換病人藥物無良醫生清水當肝炎藥,打針偷換病人藥物 無良醫生清水當肝炎藥 內地無良醫生問題嚴重。重慶市江北區一名病人拿着醫院購買的藥物，到診所打針時，醫生卻偷龍轉鳳，偽裝抽取藥物，其實為病人注射普通水，並將未使用的藥物轉賣，遭病人揭發後，醫生趁夜搬家，逃去無蹤。 被騙的是一名患乙型肝炎的唐姓婦人，她今年2月，花近千元人民幣從醫院購買10多樽藥物，帶回居住的蘭溪社區的一間診所，由王姓女醫生替她注射。可是經過一個療程後，唐發現病情未有改善，於是懷疑王曾對藥物動手腳。本月23日，唐再到診所打針，她特別留意王的一舉一動。唐發現王的針管抽取注射液後，偽裝將針頭插入藥瓶。當唐打完針後，特意到垃圾桶取回藥瓶，卻發現它完好無缺，懷疑醫生在病人離開後，撿起來拿去賣，王見東窗事發，迅速逃離診所，並且關門數日。 唐其後派親戚日夜守候診所，發現王日前漏夜搬走設備，被唐的親戚截住，但當時情況混亂，王最終趁亂逃去無蹤。當地公安接報，將事件轉介衞生執法部門調查。 《重慶晨報》
20090503-121,20090503,121,恐嚇食水中落毒台勒索大學案警掌線索,恐嚇食水中落毒 台勒索大學案警掌線索 台灣東海大學遭勒索恐嚇在食水中落毒案，正由台中市警察局全力偵查，局長葉坤福昨表示，警方已掌握部份線索，案情偵辦有進展，有信心可以破案。 台中市的東海大學兩天來連續接獲恐嚇信和恐嚇電話，歹徒要求校方支付500萬元新台幣（約117萬港元）和50両黃金（約值41萬港元），否則將向學校投擲氯氣炸彈及向學校水源下毒。 歹徒疑與學校有地緣關係 警方昨表示案情偵辦有進展，初步研判歹徒應與學校有地緣關係，或了解學校環境，否則一般人不容易知道水塔或校長室位於何處。警方也已根據歹徒留下的電話及賬戶找到相關人士進行調查及測謊。該大學的主任秘書曾華源稱，昨日未再接到歹徒電話，校內暫時先恢復供應非食用水，並供應住宿生瓶裝水飲用，校園內也加強安全巡邏。 中央社
20090503-122,20090503,122,兩岸快線女副市長29樓墮下死亡,兩岸快線 女副市長29樓墮下死亡 浙江湖州市副市長倪玲妹（圖），昨日凌晨接近一時在當地星海名城29樓一個單位墮樓，公安接報到場時倪已證實死亡，當局正調查她墮樓死因。50歲的倪玲妹是湖州人，一直在當地當官，她分管科技、教育、衞生、文化、體育、廣播電視、人口計生等範疇。 新華社
20090503-123,20090503,123,兩岸快線爆竹加工廠爆炸13人死,兩岸快線 爆竹加工廠爆炸13人死 山東慶雲爆竹加工廠昨日發生爆炸，導致13人死，2人傷。昨日中午1時30分左右，位於慶雲縣慶雲鎮楊莊子村的一處非爆竹加工點發生爆炸，造成村民楊子葉的3間房屋倒塌。當地警方正追捕犯罪嫌疑人楊某。目前，受傷人員已轉移到濱州進行治療。 新華社
20090503-124,20090503,124,白宮在MySpace開戶,"白宮在MySpace開戶 美國白宮進一步深入Web2.0世代，前天（周五）在社交網站Facebook和MySpace（圖），以及微型網誌Twitter開戶，發佈白宮最新消息，希望透過互聯網迅速地接觸更多人。白宮同時也在網站WhiteHouse.gov加了新內容，包括如何對抗豬流感的訊息。 開張不夠兩天，白宮在FB已有10萬擁躉，超過12,000名MySpace朋友，還有逾22,000名Twitter追隨者。白宮新媒體小組負責人指出，白宮不會逐一回應群組參加者的留言，但「他們可互相討論，我們也會看到他們的意見」。不少人立即發言：「我愛高科技總統！」 總統奧巴馬自參選開始，已很着重互聯網宣傳，在FB、MySpace都有頁面。就職後他亦承諾用互聯網令政府「更透明、更歡迎分享和合作」。新媒體小組之前已把WhiteHouse.gov大革新，並加入影片分享網站YouTube和相片分享網站Flickr。 法新社"
20090503-125,20090503,125,英婦醉酒圖咬空姐腳,英婦醉酒圖咬空姐腳 英國一名俄羅斯裔婦人，在一班由美國洛杉磯飛往倫敦的航機上，用紅酒和洗手液服用抗抑鬱藥後，像喝醉酒似的，對空姐拳打腳踢，甚至扮瘋狗企圖噬咬空姐腳部，結果被控襲擊機組人員罪。 54歲的魯薩諾娃，上周三乘坐聯合航空客機飛返英國時，飛機起飛不久，她開始用酒服藥，醉醺醺地狂踢前面座椅，睡了一會兒，又大鬧機艙，胡言亂語，更衝入洗手間喝掉整瓶洗手液。 多名空姐見狀，隨即抓住她雙臂，企圖將她制服，但她卻對空姐拳打腳踢，不慎跌倒在地，更像瘋狗一樣，企圖噬咬空姐腳部，其他空姐於是合力用手銬鎖起她，客機要在緬因州急降。警方隨即拘控她，她說自己害怕乘搭飛機，所以用紅酒開服安眠藥和抗抑鬱藥。一旦她襲擊機組人員罪成，可判監20年和罰款25萬美元（195萬港元）。 美聯社
20090503-126,20090503,126,英婦臨盆　等不及救護員夫靠睇YouTube接生,英婦臨盆　等不及救護員 夫靠睇YouTube接生 身懷六甲的太太，距離分娩還有三星期，但某天突然有作動迹象，英國一名丈夫為防萬一，登入短片分享網站YouTube觀看教人如何接生的片段。結果四個小時後真的要學以致用，成功在家中幫太太接生。 英國皇家海軍工程師斯蒂芬斯（MarcStephens），與妻子阿喬已育有三名年幼女兒。3月21日晚，阿喬突然感到不適，斯蒂芬斯擔心胎兒提早出世，於是着太太上床休息，然後逕自花半小時，在Google尋找接生資料，又在YouTube觀看孕婦分娩片段。 四小時後，太太真的作動，他致電給醫院，但醫院說有太多病人，暫時沒多餘助產士騰出來，只能急召救護車前來。 回憶短片內容模仿技巧 可是救護車尚未趕到，羊水已流出，太太的尖叫更吵醒了兩歲大的女兒，斯蒂芬斯惟有大着膽子，回憶短片內容，當着女兒面前，模仿短片裏面所教的技巧，幫太太接生，誕下2.4公斤的兒子加布里埃爾。救護人員也及時到達，將母子送院。斯蒂芬斯說：「這是我們第四名孩子，之前我都是站在妻子身旁打氣，今次卻要親手接生呢。」 英國廣播公司/英國《每日郵報》
20090503-127,20090503,127,LV蟬聯最強奢侈品牌,"LV蟬聯最強奢侈品牌 金融海嘯冲擊百業，奢侈品銷情也受影響，但表現仍勝過中檔路線品牌，而皮具巨擘LouisVuitton則繼續稱霸，蟬聯全球實力最雄厚的奢侈品品牌。 有市場調查機構訪問了全球超過100萬消費者，計算消費者對各品牌的忠誠度及品牌未來表現的評價，從全球5萬個品牌中，選出百大最具實力品牌榜。 在奢侈品組別中，LV、Hermes和Gucci繼續雄踞三甲，但品牌價值全都下跌，好像LV就由去年257.4億美元（2,007億港元）急跌近25%。 去年排第四的鐘錶首飾品牌卡地亞跌至第七，反映經濟不景，名牌手袋、鞋子仍有銷量，但100萬美元（780萬港元）的鑲鑽腕錶乏人問津。但名牌的業績仍比中檔品牌好，因有實力的消費者花錢也審慎，寧願買一個上萬元的皮包，而不再買五個各值2,000元手袋。 福布斯網站 10大奢侈品牌價值 1　LV　1,513億（1） 2　Hermes　613億（2） 3　Gucci　582億（3） 4　Chanel　485億（5） 5　Rolex　431億（6） 6　Hennessy　421億（7） 7　Cartier　383億（4） 8　Moet&Chandon　378億（9） 9　Fendi　270億（10） 10　Prada　210億（12） 註：港元計；（）內為去年排名"
