key,date,article_daily_id,title,text
20091117-0,20091117,0,美總統訪華奧巴馬促中國　尊重普世價值,美總統訪華 奧巴馬促中國　尊重普世價值 【美總統訪華】「表達自由、宗教自由、接觸資訊和參與政治的自由，是普世權利。無論在中國、美國或任何國家，所有人都應擁有這些權利。」美國總統奧巴馬（BarackObama），昨日在訪華行程首站，在上海科技館與500多名中國青年直接交流，強調自由是普世價值，促北京當局賦予人民各樣自由，「不應限制互聯網的使用」。他說出了許多內地人不敢說的心聲，可是交流會沒有全國電視直播，奧巴馬向神州大地發出的自由呼聲，被牢牢地箝制着。 奧巴馬前日飛抵上海，昨晨跟上海市委書記俞正聲和上海市長韓正會晤，到下午1時左右，在科技館講台上，先發表演講，再跟500多名上海青年直接對話一小時，他臨場向美國駐華大使洪博培請教了一句上海話「儂好」（你好），向青年們打招呼，博得一陣歡呼掌聲。他在四夜三天訪華行程中，就以這一場演說、這一場對話，表達出對中國要有自由的訴求。 「唯有自由能讓國家長存」 今年是中美建交30周年，他在演說中回顧了中美關係，又指中美歷史上都曾經歷艱難的時刻，曾「經過一段時間才爭取到全面的平等權利」，像他能夠成為美國首位黑人總統，全賴自由、平等這些美國的核心價值，這些價值是「最黑暗風暴中」的指南針。 他強調，美國「不尋求把任何政治體制強加於任何國家」，但美國深信表達自由、宗教自由、接觸資訊和參與政治的自由，「是普世的權利」，是全世界所有人都應尊重和享有。他說：「林肯在內戰期間說過，唯有以自由、以所有人類平等的原則，才能讓國家長久存在。」 接着是奧巴馬和500多名中國青年的直接對話，他們來自復旦、上海交通、同濟等八間上海大學。美方要求以美國市政廳會議（TownHallMeeting）互動開放形式舉行，也要求接受中國網民提問。 奧巴馬也在台上邊走邊說，營造互動開放氣氛，一小時內他答了八條問題，六條由現場青年提出，兩條由洪博培代網民交美國駐華使館問題作出的提問。 承接宣揚普世價值的演說，洪博培先聲稱代一名網民提一條問題：「你知道防火牆的事情嗎？我們是不是應該自由地使用Twitter？」奧巴馬答道，他沒有用過這個微型網誌網站，但深信資訊越自由流通「社會越強」，所以他「非常支持不審查內容」，美國沒限制使用互聯網，「這就是我們力量的來源」。 資訊流通造就問責政府 他說自己「有時候也希望資訊不是那麼自由地流通，這樣就毋須聽到別人的批評」，畢竟「人處於某個權力地位時」就不想聽到批評。但他深信資訊自由「會使民主制度變得更強，使我變成一個更好的領袖，因為那迫使我審查自己幹的事，每天都要審查，要看看我是不是真的為美國人民」。他要說的是，資訊流通可造就一個問責政府。 至於現場青年問題，都是先來一番歡迎奧巴馬的客套話，然後提一些像「你要從中國帶甚麼回美國」、對中國第一個印象、獲諾貝爾和平獎等問題。一名上海外國語大學學生問他對台售武的看法，他沒正面回答，只說「我的政府全面支持一個中國政策」，「非常高興看到」海峽兩岸關係改善。 有與會青年在對話後不諱言，他們事先就這場對話接受了四天培訓，反映當局順應了美方要求舉行一場市政廳會議交流會之餘，其實只是「做騷」，仍然設法箝控大局，以防對話出軌。 除了做騷，奧巴馬講普世價值的演說和對話，當局沒讓中央電視台作全國直播，只讓新華網上直播。美國原本安排了數名青年公民代表參加交流會，也遭北京否決。 但奧巴馬演說一完，他的普世價值講話，即被內地網民廣泛轉貼。普世價值，中國人都想享有。 法新社/美聯社/路透社
20091117-1,20091117,1,住使館區飯店每晚$39000,"住使館區飯店每晚$39000 奧巴馬昨天抵達北京後，隨即到釣魚台國賓館，出席中國國家主席胡錦濤為他所設的私人晚宴，晚上則下榻使館區附近的北京國際俱樂部飯店。 為了接待奧巴馬，飯店前天已派員在正門裝設安檢設施，並檢查飯店內日常設備。飯店日前已拒接新客，接待處更指200多間客房全部爆滿，最快要到後天才有空房出租。奧巴馬明天離開北京前往南韓。 北京國際俱樂部飯店建於1997年，距離美國大使館僅1分鐘車程，美國前總統喬治布殊和克林頓訪華時，便曾入住該飯店。 消息指奧巴馬入住的是1908號，是面積近200平方米的總統套房，內有可容納8至10人的寬敞飯廳和獨立廚房，另有客廳、辦公室和書房，浴室配備按摩浴池和個人桑拿房，可欣賞都市景致，房租每晚約5,000美元（39,000港元）。 台灣東森新聞"
20091117-2,20091117,2,受騙港商外商上訪被帶走,受騙港商外商上訪被帶走 一批在大陸投資的港商及外商，趁奧巴馬訪京，到北京上訪，希望向奧巴馬及國家領導人，反映在大陸投資受騙問題，但部份商人被國安人員帶走。 港商（內地）投資權益關注組一名成員指，他們一行約10人，由上周三（11日）到昨日分批赴京，但昨日有數名國安人員到酒店將4人帶走，表示「廣東省公安廳會與你們談的了」，直至昨深夜仍未獲釋。有成員指，他們部份人雖未被帶走，但出入仍受監視及跟蹤，國安守在酒店門口說：「你們不要出去。」 但他們仍計劃在清晨時分去天安門看升旗，有機會會去中南海，向奧巴馬及國家領導人求見求助。今次關注組一行也有成員來自美國、加拿大、澳洲的商人，他們在廣東，山西等投資酒店及開廠後受害、受騙，歷經數年到各部門投訴無果。 本報記者
20091117-3,20091117,3,大風大雨希拉莉要攙扶,大風大雨希拉莉要攙扶 隨同奧巴馬訪華的美國國務卿希拉莉（圖左），昨日登上總統專機「空軍一號」準備前往北京時，上海浦東國際機場刮起大風大雨。62歲的希拉莉有人攙扶打傘，但風太大了，傘子也吹翻，累她狀甚狼狽。 路透社
20091117-4,20091117,4,領養女嬰作伴終老　金融海嘯捲走300萬坎坷婦掟死1歲女認誤殺,領養女嬰作伴終老　金融海嘯捲走300萬 坎坷婦掟死1歲女認誤殺 【本報訊】在日本任繙譯員多年的中年婦人，10年前回流香港覓偶，可惜多年來仍然單身，兩年前便往內地領養女嬰，打算作伴終老。婦人平日對養女呵護備至，經去年金融海嘯捲走一半身家300萬元後，性情大變。去年10月，她返家見13個月大的養女扭計不停嚎哭，便將養女倒吊，將小頭顱撼地，並大力搖晃七至八次，女嬰最終傷重不治。婦人昨在高等法院承認一項誤殺罪候判。　記者：陳曉薇 法官張慧玲下令被告陳敏音（52歲）還柙至下月11日，待索取其心理及精神報告判刑。遭遇不測的女嬰07年9月在江西省出生後被遺棄。被告去年3月獲批收養女嬰，同年8月女嬰來港定居，入住被告旺角廣華街明威閣的住所，由被告獨力照顧。去年10月13日，被告到深圳辦事，將女嬰交母照顧，同日傍晚她返家，當時13個月大的女嬰身體並無異樣。 同晚10時許，在被告住所對面街的仕德福酒店任職廚師的劉灝然，晚膳後到酒店三樓露台吸煙，稍事休息，卻見到驚心動魄的一幕。劉當晚從露台見到被告在寓所內雙手捉住女嬰雙腳倒吊，然後把女嬰擲落地下。其後被告再次提起女嬰雙腳倒吊，用力搖晃四至五下。劉見被告重複這串動作共七至八次後，將女嬰帶到廁所搓胸，又做人工呼吸，便通知酒店保安，但無報警。 頭部手腳多處內外傷 被告稍後將養女包着毛巾抱至廣華醫院搶救，聲稱女嬰從床上意外墮地。女嬰送院後一度心臟停頓，後轉往兒童深切治療部。醫生檢驗女嬰後，發現她並非意外受傷，於是報警。被告被捕後稱，她當晚回家餵女吃粥，女兒吃飽後卻扭計，不停嚎哭，不願入睡。她受女兒喊聲刺激，一時情緒失控便將她倒吊，擲落地下，直至自己頭腦清醒見女兒失去知覺，才抱她跑往醫院求醫。女嬰五天後病情惡化，證實腦幹死亡。至22日，醫生在被告同意下拔喉停救，剖屍發現女嬰頭部及手腳出現多處內外傷。 辯方大律師是香媛昨替被告解釋她所為時，亦聲言「原因可能連佢自己都唔知」。辯方指，被告對女兒疼愛有加，女兒食道有問題，每餐吃得極少，經她悉心照顧，才養得肥肥白白；她去年被金融海嘯拖累，損失一半身家共300萬元，此後一直擔心自己無法再賺回這筆錢，開始表現「抆憎」，根本不知自己為何向女兒痛下毒手。 失常求醫等不及排期 辯方續指，被告認為自己案發時失常、失去理智，才會對女兒動粗。她去年8月見自己性格有變已主動求醫，但醫院將其個案排期至11月中，才能轉看精神科，可惜慘案在10月已爆發。她被關押後驗出患上躁狂抑鬱症，已定期服藥。事後悔疚不已，極度想念女兒，常泣不成聲，相信再犯機會近乎零。 案件編號：HCCC183/09 中年婦殺養女示意圖
20091117-5,20091117,5,庭上激動抽泣　過後平和祈禱,庭上激動抽泣　過後平和祈禱 【本報訊】樣子溫文端莊的陳敏音，昨聞控方讀出女兒遇害經過時，表現激烈，涕淚縱橫。聽審時，她不但雙手掩面痛哭，還多次激動得伏在犯人欄枱上抽泣。在公眾席上的18名親友及教友受氣氛感染，亦面露難過之色。惟她聆聽辯方大律師求情時，心情大變，擺出合掌祈禱手勢，表現平和，返囚室時更向親友點頭告別。 精力盛愛吵嘴應求醫 中文大學精神科李誠教授指，全港有百分之一成年人口患躁狂抑鬱症，現時醫學界仍不肯定此病成因，但能證實病人腦分泌令腦功能嚴重失調，導致情緒、行為及判斷力走兩極化。此病病情能在幾天及幾星期內急轉直下，在嚴重躁狂期，病人容易判斷錯誤，脾氣暴躁，以及出現被迫害和妄想症狀，一時失控，可能會有自殺及殺害自己孩子的行為。 李誠勸告任何人當發現自己或家人一星期內睡覺少，但仍精力旺盛，喜歡跟人吵嘴，心情長期低落，便要及早求醫，否則至後期時，會自覺無問題，拒絕求醫。
20091117-6,20091117,6,狠母背後少女時代生活糜爛　日本追尋真愛落空,狠母背後 少女時代生活糜爛　日本追尋真愛落空 養母狠下毒手，將年僅13個月大的女嬰倒吊撼地，在旁人眼中這個惡毒媽媽，似乎面目可憎。但據辯方所講，少女時曾有不幸遭遇的陳敏音，經過年月洗禮，現時不單止是個虔誠基督徒，還是個孝敬父母、熱心公益、愛心爆棚的大好人。 曾留學當繙譯員 辯方昨指，陳敏音15歲時，曾遇慘痛經歷，事件對她心靈構成沉痛傷害。她在遇事後一度放棄自己，過着放任生活，數年間兩度墮胎。在港生活糜爛，陳1980年經朋友介紹，轉到日本求學，一切重新再來。 陳敏音在日本替內地商人任繙譯員，一直找不到真愛，1998年回流返港尋找對象。惟一切落空，她便打算收養女嬰作伴終老。陳敏音過往曾三次向社署申請領養，均獲派收養先天有缺陷的嬰兒。她因擔心無力照顧，所以並無接納。至去年排除萬難，終能成功收養肇事女嬰。 據陳敏音的家人及教友所講，陳孝敬父母，在內地助養兒童，在港經常探望老人院及孤兒院，表現無限愛心。她在正式收養女嬰前，更先向有經驗的家長取經。親友均認為她因為金融海嘯損手，才會不自覺患病犯案。 本報記者
20091117-7,20091117,7,癱瘓消防索償4450萬和解車禍後曾想輕生　最終勇敢面對,"癱瘓消防索償4450萬和解 車禍後曾想輕生　最終勇敢面對 【本報訊】經常出入火場，拯救危困市民的年輕消防員，04年遇交通意外，變成四肢癱瘓，從此要與輪椅作伴，靠別人照顧。他曾萌輕生念頭，最終勇敢面對，還以過來人身份勉勵遭遇不幸的人要愛惜生命。昨日，他藉控告肇事司機及車主的索償案，請求司機小心駕駛，否則會摧毀他人一生。對於肇事司機因不小心駕駛僅判罰款1,200元，他控訴說：「香港係咪一個法治社會？」 案件原安排在高等法院開審，原告駱偉堅（34歲）控告肇事司機周誠煥及車主周誠啟（均譯音）疏忽，索償額高達逾4,450萬元，駱早前已取得200萬元中期賠償，與訟雙方昨日終達成和解協議，賠償額保密。代表大律師李樹旭庭外說：「足夠佢（原告）嘅使費。」 藉機呼籲司機小心駕駛 李在庭上代原告發表宣言，無論賠償金額多少，原告都不能重享以往的生活，但希望藉此向駕駛人士帶出一個訊息，請求他們要小心及有責任感地駕駛，因為車輛可以成致命武器，摧毀別人一生。 高院特委法官余若海亦語重心長，勉勵駱要憑意志及毅力跟自己的殘疾作戰下去，更指一個人有沒有用，並非取決於他的雙手及雙腳，而是他的莫大意志，並祝福駱要努力，跟家人好好生活下去。 駱坐着自動輪椅離開法庭，向記者講述他的痛苦心路歷程。他表示車禍重創後昏迷兩天，有可能變成植物人，結果蘇醒過來。但他兩年後才能接受現實，其間曾萌輕生念頭，要求醫生安樂死，「當時覺得人生有乜意義，癢又唔到，轉身又轉唔到，仲唔好喊㖭。」 「做唔到救人死剩把口」 慶幸醫院的院牧對駱不離不棄，令他克服身心障礙，鼓起勇氣去面對。駱希望將經歷與其他病人分享。他幽默地說：「我都冇辦法，個天唔收我……家做唔到救人，得番一樣嘢，死剩把口！」他勉勵遭遇不幸或挫敗的人，「我咁樣，對眼望住天花板，都可以捱到今時今日，生存落去，健全嘅人要更加珍惜生命！」 談及肇事司機，駱坦言從沒有埋怨及憎恨，「係人哋戥我唔公平啫」，但也慨嘆說：「香港係咪一個法治社會？撞到人癱都只係罰1,200蚊，我就冇咗一生……好過攞把刀去劈人，都唔使坐監。」 車禍發生於04年2月22日早上，駱駕駛電單車途經元朗荃錦公路，肇事寶馬房車失控越線迎頭撞向駱，駱被拋離電單車，當場昏迷。肇事司機因不小心駕駛被判罰1,200元。律師透露，涉及四肢癱瘓並能和解的索償案，最大一宗賠償金額達5,000萬元，本案則屬第二最大金額。 案件編號：HCPI140/07 駱偉堅索償概要 痛苦及喪失樂趣　金額：$3,000,000 審訊前收入損失　金額：$1,057,365 審訊前醫療開支　金額：$246,790 審訊前住宿開支　金額：$749,560 審訊前其他開支　金額：$1,613,515 日後收入及福利損失　金額：$6,054,761 日後醫療費用　金額：$1,657,520 日後住宿費用　金額：$3,309,552 其他損失及開支　金額：$26,044,833 電單車報銷　金額：$14,200 利息　金額：$809,286 總數金額：$44,557,382 註：扣除200萬元中期賠償，索償額為$42,557,382 資料來源：入稟狀"
20091117-8,20091117,8,好心分手出事後主動離開女友,好心分手 出事後主動離開女友 駱偉堅過去五年身心受盡煎熬，縱使如何堅強，但提到忍痛主動跟女朋友分手、父親及契媽無私的悉心照顧、以及昔日上司的無限支持，也不禁流下男兒淚。問他最想多謝誰，他微笑說：「所有關心我嘅人！」 駱自言讀書成績不算好，但勝在有強健體魄，經過兩次投考，終在23歲時當上消防員，一份極有意義的工作，他出入火場，曾參與00年土瓜灣塌簷篷救援工作。 可是，28歲遇上車禍，傷及脊椎變成四肢癱瘓，結婚計劃告吹，更忍痛主動向女友提出分手，駱語帶悲傷謂：「對佢（女友）唔公平，冇理由要佢照顧一個完全郁唔到嘅人，我24小時需要人照顧。」 前上司：新一代榜樣 駱住過三間醫院近三年，接受多次手術，因醫院人手問題，照顧未必周到，試過發高燒卻派漏藥，幸得退休父親及契媽悉心照顧，現時則聘用外傭。他以往酷愛戶外活動，游水、行山、踩越野單車及駕駛電單車，擁有健碩身形。現時，只有肩膊以上有知覺，平日坐輪椅及卧床，需插尿喉。駱說取得賠償金後，首先尋覓安樂窩，安頓下來。 他的前上司、現已退休的紅磡消防局局長郭永光昨亦到庭。郭形容駱是「21世紀新一代消防員的榜樣」，讚賞其工作表現，對其遭遇感到心痛。駱指郭與他並肩作戰，一切盡在不言中。駱的同袍及朋友在網誌留言不斷為他打氣，並上載不少朋友到醫院探望及為他慶祝生日的照片。 本報記者
20091117-9,20091117,9,割腕　仰藥　吞釘服特敏福情緒差　少女再自殺,割腕　仰藥　吞釘 服特敏福情緒差　少女再自殺 【本報訊】黃大仙一名17歲少女感染人類豬流感後，一個月內兩度尋死，幸均僥倖獲救。上月中旬少女疑服食醫生處方的治療流感藥特敏福後情緒低落，於自我隔離期間割腕及吞服安眠藥自殺獲救。少女昨晨再於家中鯨吞50粒安眠藥、兩粒螺絲釘後，再割腕三料自殺，幸由其母親及時發現再救一命。 記者：伍蒲鋒 傳染病專科醫生指，醫學界對服食特敏福後會否引致情緒問題未有定論，但病人服藥後，醫生及家人應留意有關情況。 兩度尋死的17歲少女姓袁，據知本身有情緒問題，需服藥控制病情，袁與49歲姓周母親及40歲阿姨同住豐盛街33號海港花園2座一單位。事發昨晨7時許，曾患豬流感的袁女與母親同在海港花園家中，當時袁母仍在房中熟睡，袁女忽萌尋死念頭，竟取出兩粒螺絲釘，一瓶安眠藥及一把刀，作三料自殺。 母親進房及時救回 袁女先取出50粒安眠藥?下，再把兩粒螺絲釘?落肚，然後取刀割破左手手腕。其間袁母醒來，準備提醒女兒已到服藥時間，可是袁母甫開女兒房門，赫見女兒左腕鮮血四濺，知道女兒尋死自殺，立刻上前奪刀制止。 袁母取去刀後報警求救，其間女兒告訴她曾?服安眠藥及螺絲釘自殺，救護員替神志仍清醒的袁女包紮後送院搶救，現時情況危殆。 其實袁女自殺曾有前科，據知上月中她出現發高燒等流行性感冒症狀後，到診所求醫及進行測試，至上月16日袁女被知會確診患上豬流感，醫生於是處方專治豬流感的特效藥特敏福給她服用，其間她亦在家中接受自我隔離，但據知她服食特敏福後曾出現情緒低落副作用。 屋內未有發現遺書 兩日後（18日）的凌晨3時許，袁女在家以刀割左手腕及?安眠藥自殺，但由同住的阿姨發現報警送院救回一命。昨日事發後，警方在屋內未發現遺書，暫列企圖自殺案，正調查其兩度輕生原因。 急症室專科醫生馮顯達指，少女?下兩粒螺絲釘會否受傷，視乎螺絲釘長度及是否卡在食道或胃壁，若螺絲釘不長，應不會傷及食道及胃壁，一般兩、三日內會排出，若螺絲釘較長則刺傷內臟，需動手術將釘取出。 豬流感少女兩度自殺示意圖 蘋果資訊︰服後副作用　外國頻傳 曾患人類豬流感17歲少女一個月內兩度自殺獲救，原因未明。近年有醫學研究發現，服食抗流感病毒特效藥特敏福後可會令人出現語無倫次至自殺傾向。 傳染病專科醫生勞永樂則指，有關研究在醫學界存有爭議，而昨日自殺少女估計流感已經痊癒，受特敏福影響較低，加上她有情緒病，而且流感痊癒後患者或會出現情緒低落及疲倦情況，難以確定事件是否與服用特敏福有關，但醫生處方特敏福時亦應了解病者情緒狀況，以免出現不良反應。 資料顯示，日本07年曾有多名青少年懷疑服用特敏福後，出現無故大叫大笑等異常行為，更有人疑服用醫生處方特敏福後跳樓。新加坡《海峽時報》早前則報道，由05年至今，新加坡共有6名16歲以下患者服用特敏福後出現語無倫次或有自殺傾向，令人擔心服特敏福後出現不良副作用。 勞永樂指，其實現時醫學界對特敏福副作用研究不多，美國食品及藥物管理局亦未有定案，該局已要求藥廠在特敏福的說明書上印上警告字眼。
20091117-10,20091117,10,昨發寒冷警告　歷來最早,"昨發寒冷警告　歷來最早 【本報訊】一股東北季候風為華南帶來寒冷天氣，天文台於昨午發出今年入冬以來首次的寒冷天氣警告，是歷來最早的紀錄。預料明日更凍，市區氣溫可能跌至11℃，至周四才逐步回暖。天文台並預測今明兩日多雲，獅子座流星雨可觀度大減。 市區明日跌至11℃ 一股東北季候風的補充正為華南帶來寒冷的天氣，本港地區今日天氣預測大致多雲，晚間有幾陣雨，天氣寒冷，市區最低氣溫約12℃，新界再低兩三度，日間最高氣溫約15℃，吹清勁北風，晚間離岸海域及高地間中吹強風。展望隨後一兩天早上仍然寒冷，明日市區氣溫可能跌至11℃。 天文台昨午4時20分發出入冬以來首個寒冷天氣警告，是1999年寒冷天氣警告系統生效以來，最早發出的紀錄，打破了去年11月28日同是4時20分的紀錄。社區組織協會幹事吳衞東說，協會昨日收到露宿者的求助個案共有十宗，較平日多一倍。協會將會派出社工到多個避寒中心探訪露宿者，了解他們衣食住行的需要。 昨日截至下午5時，有1,625個長者按動平安鐘求助，其中66人送院，主要因為頭暈和氣促。長者安居服務協會提醒長者留意有關寒冷天氣之注意事項。 九個避寒中心開放 社署提醒長者注意身體，並呼籲親友和鄰居多關心及慰問體弱長者，有需要可致電熱線23432255求助。民政事務總署開放轄下九個避寒中心，讓有需要人士入住。 香港天文學會指出，本月18日清晨5時45分是流星雨出現的高峯時段，估計每小時有數十至數百顆。"
20091117-11,20091117,11,特稿對話背後中美攻防戰,特稿 對話背後中美攻防戰 奧巴馬昨日與上海青年對話，表面上平和，背後卻是刀光劍影。中方嚴防話題走火，美方就主動挑起敏感的網絡事件，讓奧巴馬表態支持網絡自由；中方背後即時下令各網站「收聲」，不得炒作。官方新華社更被指故意譯錯奧巴馬原意，背後角力充滿硝煙。 參加對話學生先行洗腦 這次奧巴馬到訪，創下與中國青年學生直接對話先例，美方更決定以互聯網直播，令視互聯網為大敵的中共不得不接招，名義上通過新華網等「收集民意」，實際上所有問題都經篩選，「五毛黨」（當局用錢養的網民，據稱發一個帖可獲津貼五角錢）更大舉出動，搶佔網上論壇。 美方深知中共做法，故除與中方合作，還在駐華使領館官網及Twitter、Facebook等不受中共掌控的網站開專欄，收集民意，白宮網站直播對話，迫令中方也全程直播。但事前上海當局對所有參加對話的青年學生集中培訓，先行洗腦，防他們提問惹火找麻煩。 果然，七位提問者的問題，全部未超出官方認可範圍。但美方不示弱，第五個問題後，駐華大使洪博培適時插入，以收到中國網民問題為由，拋出互聯網防火牆和Twitter事件問題，為奧巴馬提供了炮位。奧巴馬則借題發揮，大談互聯網自由的政治和經濟價值，成為昨日對話大熱話題。 內地媒體高度振奮，至少有30多個網站以獨立標題，對奧巴馬的回應單獨報道，令外界一時詫異。但中共似乎早有準備，內地網民透露，各大媒體、互聯網即時收到宣傳部門通知，強調轉載對話內容「一律用正規媒體通稿及新華社報道，嚴禁自作主張炒作，一經發現，堅決予以刪除。」 媒體接令惟有刪除，讓奧巴馬精采之言埋在長篇大論中。網易本來獨立放在首頁，但27分鐘後刪去，新浪網則將標題改為「互聯網已變更強工具」，不痛不癢，仍獨立置題。有網民還質疑新華網篡改，指奧巴馬意思是「在美國，我們沒有限制使用互聯網的機會」，但新華網譯成「在美國，我們有沒有受限制的使用互聯網的機會」，意思完全不同。本報記者
