key,date,article_daily_id,title,text
20091117-139,20091117,139,藍籌股反彈稱王滙控美市曾升破百元　紅獅再現,藍籌股反彈稱王 滙控美市曾升破百元　紅獅再現 【本報訊】今年3月9日滙控（005）驚見33元「跳樓價」，港股同日暴插至11344點低位。事隔10個月，恒指已大翻身直闖23000，昨收22943點，升390點（1.73%），較3月低位剛好反彈一倍。獅子行亦重拾霸氣，股價突破97元，較3月低位彈2.2倍，成為藍籌反彈王。滙控昨早段在美市曾升破百元關口，成功變身紅底股。　記者：黃武榮 恒指尾市曾升至22998點，差兩點即見23000。滙控收97.1元，升2.6%，貢獻恒指89點，連同四大內銀藍籌，合共推高大市239點，佔全日升幅六成。本港時間昨晚11時半，滙控美國預託證券（ADR）折算99.1元，較港收市再高2元，在倫敦預託證券折算亦高見98.9元。 港股年內料可見24000 僑豐證券業務發展董事連敬涵指，滙控近期買盤相當積極，尤以外資行為甚，滙控淡友慘淡收場，被挾得毫無還手之力。觀乎近日走勢，滙控周內極大機會變紅底股，如配合中移動（941）起動，大市年內可見24000。 值得留意，滙控近月股價扶搖直上，成交亦大躍進。統計本月迄今，近半交易日滙控皆成為最活躍成交港股，昨亦以28億元交投居首。 滙控衍生工具近日熱炒 滙控衍生工具亦成為散戶新寵，瑞銀亞洲區認股證業務主管于正人透露，滙控窩輪及牛熊證近兩日交投熾熱，且清一色睇好，昨日滙控認購證及牛證，已錄得近十億元交投。 港股及滙控齊於3月9日創年內新低，前者剛好翻一番，後者則彈升2.2倍，壓過騰訊（700）的2.1倍升幅；期內富士康（2038）、中銀香港（2388）及中信泰富（267）亦反彈近2倍。 世紀供股　每手賬面賺1.1萬 滙控回勇，首季無棄船、在世紀供股時願以每股28元供股價支持的股東，可謂苦盡甘來，稱得上今年最佳投資。以供股前手持一手（400股）為例，股東單是供股（166股）部份賬面已賺約1.1萬元。 大市成交增至768億元的本月高位，反映市場動力漸強。美國總統奧巴馬訪華，市場估計新能源成討論重點，續有再生能源股炒上，紅發（2958）漲13%，中電新能源（735）進賬半成。金價升不停，金礦股瑞金（246）及紫金（2899）分別抽高8%及6%。 滙控膺今年藍籌反彈王 滙控（005） 昨收報：97.10元　變幅：+2.64%　3月9日報*：30.56元　累積升幅：+2.18倍 騰訊（700） 昨收報：148.20元　變幅：-0.20%　3月9日報*：47.19元　累積升幅：+2.14倍 富士康（2038） 昨收報：6.82元　變幅：+1.64%　3月9日報*：2.19元　累積升幅：+2.11倍 中銀香港（2388） 昨收報：19.60元　變幅：+0.72%　3月9日報*：6.30元　累積升幅：+2.11倍 中信泰富（267） 昨收報：22.15元　變幅：+0.68%　3月9日報*：7.30元　累積升幅：+2.03倍 恒生指數 昨收報：22943點　變幅：+1.73%　3月9日報*：11344點　累積升幅：+1.02倍 *計及除淨、供股等因素後調整 金價新高金股升不停 瑞金礦業（246） 昨收報：12.50元　變幅：+8.32%　成交額：1.69億元 紫金礦業（2899） 昨收報：8.82元　變幅：+6.01%　成交額：4.42億元 澳華黃金（1862） 昨收報：56.40元　變幅：+4.44%　成交額：0.03億元 招金礦業（1818） 昨收報：14.72元　變幅：+4.10%　成交額：1.63億元 靈寶黃金（3330） 昨收報：3.10元　變幅：+3.33%　成交額：0.19億元
20091117-140,20091117,140,亞太區股市,亞太區股市 日本：9791.18　+20.87(+0.21%) 澳洲：4755.20　+48.80(+1.04%) 新西蘭：3173.97　+15.82(+0.50%) 新加坡：2783.85　+56.62(+2.08%) 馬來西亞：1278.31　+7.35(+0.58%) 泰國：706.75　+8.42(+1.21%) 台灣：7792.68　+127.05(+1.66%) 南韓：1592.47　+20.48(+1.30%) 菲律賓：3011.36　-22.96(-0.76%) 印尼：2468.68　+41.87(+1.73%) 印度：17032.51　+183.68(+1.09%)
20091117-141,20091117,141,內地股市,內地股市 深綜指：1181.63　+29.05(+2.52%) 深A指：1240.27　+30.98(+2.56%) 深B指：624.17　+1.36(+0.22%) 滬綜指：3275.048　+87.40(+2.74%) 滬A指：3435.400　+92.17(+2.76%) 滬B指：250.241　-0.95(-0.38%)
20091117-142,20091117,142,歐美股市及美債,歐美股市及美債 美股道指：10378.92　+108.45(+1.06%) 美股納指：2193.40　+25.52(+1.18%) 美股標普500：1104.17　+10.69(+0.98%) 英國：5379.51　+83.13(+1.57%) 德國：5778.22　+91.39(+1.61%) 法國：3851.65　+45.64(+1.20%) 美國10年期債息：3.40厘　-0.02厘
20091117-143,20091117,143,貴金屬及商品,貴金屬及商品 盎斯金#：1131.10　+12.40(+1.11%) 九九金：10418.00　+190.00(+1.86%) 白銀#：17.94　+0.51(+2.90%) 白金#：1431.50　+38.50(+2.76%) 倫敦期銅#：6714.50　+194.50(+2.98%) 紐約期油#：77.35　+1.00(+1.31%) CRB商品指數：271.20　+2.08(+0.77%) #單位：美元
20091117-144,20091117,144,主要貨幣滙價,主要貨幣滙價 歐元 兌美元：1.4973　兌港元：11.6041 +0.0547 日圓* 兌美元：89.43　兌港元：8.6625 +0.0178 英鎊 兌美元：1.6746　兌港元：12.9765 +0.0522 瑞郎* 兌美元：1.0078　兌港元：7.6857 +0.0338 澳元 兌美元：0.9359　兌港元：7.2520 +0.0211 紐元 兌美元：0.7448　兌港元：5.7711 +0.0093 加元* 兌美元：1.0449　兌港元：7.4151 +0.0482 人民幣* 兌美元：6.8270　兌港元：88.09 +0.0100 （歐美股市、滙價、貴金屬、商品價截至23:00） *為每美元滙價
20091117-145,20091117,145,上午曾飆31%　收市僅升13%中糧包裝虎頭蛇尾,上午曾飆31%　收市僅升13% 中糧包裝虎頭蛇尾 【本報訊】中糧包裝（906）昨首日掛牌，股價表現虎頭蛇尾，最終以貼近全日最低位收市，報6.11元，較招股價5.39元上升13.36%，遠遜上周五暗盤升幅的31.54%，散戶上午若高追便中伏；按每手1000股計算，中籤者賬面獲利720元。　記者：周燕芬 中糧包裝於開市後5分鐘便升至全日最高位的7.05元，較招股價升幅達30.8%；之後輾轉回落，於收市前7分鐘跌至全日最低位6.06元；全日成交1.31億股，涉及金額8.68億元。 母公司擬分拆地產業務 母公司中糧集團董事長寧高寧昨出席掛牌儀式後表示，中糧集團下一個分拆上市計劃將是旗下商業和住宅地產業務，暫沒有時間表，亦未有上市規模，但會尋求中港兩地上市；而中糧包裝將透過收購合併，拓闊塑料和紙包裝市場，使公司成為綜合包裝公司，於3至5年成為大型國內消費品和食品包裝公司。中糧集團早前入股蒙牛（2319），他指集團暫無計劃增持蒙牛。 另外，同系的中糧控股（606）全資附屬中糧米業（大連）公司，上周六在大連市大窯灣港的DCT集裝箱碼頭正式投產，總投資額3.14億元人民幣，是中糧集團在東北投資的首個大米加工基地，每年可加工大米23萬噸。寧高寧表示，這是中糧大宗糧油業務由外向型向內需型轉變、由國外企業客戶向國內消費者轉變的重要舉措。 中國森林$4242入場 至於計劃本周四招股的中國森林（930），昨日進行投資者推介，市場消息指其國際配售部份已錄得超額認購逾1倍。中國森林派息政策將按每年收入的20至25%，而非以盈利作基礎，接近公司的消息人士解釋，因為盈利受到每年樹木的估值而有較大波動，以收入作計算基礎，更能反映公司核心業務狀況。 據初步招股文件顯示，中國森林今年上半年的樹林估值增值5.19億元（人民幣．下同），08年則出現估計貶值6.11億元。今年上半年集團盈利4.32億元，較去年同期跌91.7%，預測截至今年底止全年盈利不少於5.089億元。 是次集資12億至15.75億港元，每手2000股，入場費4242.38港元，另有15%超額配股權。集資的95.5%用作收購新的森林，2.8%用於改善營運及資訊系統，1.7%作研發開支。若公開發售超購100倍或以上，將啟動回撥機制，令公開發售佔招股比例由10%增至50%。
20091117-146,20091117,146,名人捧場民行獲郭炳湘、細劉入飛,名人捧場 民行獲郭炳湘、細劉入飛 消息透露，進入招股次日的民生銀行（1988），截至昨日國際配售部份已錄得逾7倍超額認購，若不計算基礎投資者數額，認購金額已超過200億美元。 三一孖展旺金沙冷清 據悉，認購的投資者中，除了包括量子基金創辦人索羅斯、中東、歐美和印度基金，以及中資保險股外，尚有新鴻基地產（016）非執行董事郭炳湘及人稱「細劉」的劉鑾鴻。 民行的孖展認購走勢則較緩慢，本報統計12家證券行，合共錄得孖展額314.7億元，只超購19倍，甚至還有少許入飛者轉軚，由民行倒流往集資額較小的三一重裝（631）及花樣年（1777），兩公司昨日截孖展，孖展額明顯增加，11家證券行分別合共錄得147.4億及150.2億元申請，相當於超購60.4及46倍。 昨開始公開招股的濠賭股金沙中國（1928），場面極度冷清，9家有提供孖展認購的證券行僅得4.4億元申請，相當於公開招股集資額17%。 截至昨日止，4隻同期招股的新股，三一以「黑馬」姿態跑出。該公司主要生產煤炭機械，里昂昨日發出簡報，指三一即使以上限4.8元定價，明年市盈率亦只有13倍，遠較已上市的中國機械股10年平均18倍市盈率低，而且公司09年上半年毛利率達49%，屬於同行對手之中最高，在建築機械行業處於中期頂之際，礦務機械業才剛由谷底走出來，建議客戶沽中國龍工（3339），認購三一。
20091117-147,20091117,147,下月上市佳兆業下周四起招股,下月上市 佳兆業下周四起招股 以深圳發展為基地的佳兆業，將於下周展開上市前路演，消息人士透露，公司將於本月26日（下周四）公開招股，計劃下月9日掛牌。 50億銷售額未入賬 今年內地樓市成交表現理想，帶動開發商銷售錄得佳績，佳兆業副主席兼執行董事孫越南昨日在深圳接受傳媒訪問時表示，公司於年初至6月底，錄得合同銷售為25億元（人民幣．下同）。據了解，公司累計銷售而尚未入賬的銷售額，截至10月底已達40億至50億元。 截至9月底公司擁有31個項目，分佈於內地9個城市，其中大部份位於華南區，佔土地儲備約60%，餘下40%位於華南以外地區，已擁有項目的城市包括深圳、廣州、東莞、惠州、珠海、上海、江陰、成都及長沙。 孫越南表示，公司目前持有1250萬方米土儲，足夠未來3至5年發展所需，由於深圳未來土地供應較少，深圳特區政府有意進行舊城改造，公司未來將考慮從舊城改造、爛尾樓及收購項目途徑增加土儲，目前有部份項目已簽訂框架協議，主要集中於廣東省。
20091117-148,20091117,148,內地樓價明年料春暖秋凉,內地樓價明年料春暖秋凉 【本報訊】經歷07年大漲後，中國樓市猶如過山車般速起急落；去年金融危機曾令樓市一度停滯，但中央政府一籃子的扶持計劃又令其起死回生。對於各項優惠政策即將到期的憂慮，中國社會科學院發表報告預計，優惠政策方向不變，料明年樓市春暖秋凉、震盪增長，尤以滬京杭樓價升勢最勁。 社科院昨發佈《中國住房發展報告（2009-2010）》指出，隨着宏觀經濟趨好、政府推出多項優惠政策及持續寬鬆的流動性，開發商資金壓力得以紓解，購地能力與意願雙雙提升，故料土地市場需求將進一步回升，土地價格將維持升勢，滬京杭三地潛力位居前三。 社科院估滬京杭升勢勁 報告指出，至明年第四季，住房增量與存量市場將呈現春暖秋凉、價穩量增的局面，以震盪性態勢增長：明年首季價穩量微降，第二季度價量齊升，三、四季度價跌量降或以穩定為基調。 在經濟復蘇未穩、出口仍疲弱之下，房地產對於拉動內需意義重大。報告建議，明年住房調控應以增加銷售、擴大投資、調整結構、價格穩定為目標，大幅提升小戶型、保障房比例，並解決未達保障房購買門檻的「夾心層」的住房問題。中銀監副主席蔣定之表示，目前二套房利率政策並未改變，但對房價過高問題將給予高度重視。 社科院財貿所專家高廣春表示，今年過快釋放的流動性推動房價飆升，其中流入樓市的貸款又刺激投機性的住房開發和消費，而風險放寬手段有限，加上政策性住房金融未發揮作用，目前樓市面臨諸多問題，甚至出現泡沫。
20091117-149,20091117,149,康師傅多賺49%首三季毛利率36%　盼再增,康師傅多賺49% 首三季毛利率36%　盼再增 【本報訊】康師傅（322）公佈，7至9月第三季純利按年增長60.41%至11.5億元，創下單季純利新高，按季比較增長更有加快趨勢；累計今年首三季純利25.49億元，升48.88%，優於市場預期，不派息。財務長林清棠希望，在規模效應下，整體毛利率可再上升，集團會繼續擴產。　記者：陳健文 康師傅今年首9個月總收入314.99億元，升19.81%，每股盈利45.63仙。按德意志銀行預測康師傅今年全年純利28.23億元計，即目前已達到其預測約90.29%。 受業績理想刺激，康師傅昨升2.7%至18.26元收市，創上市新高。 即食麪、茶飲料市佔率奪魁 集團首三季毛利率約36.05%，按年升3.28個百分點，因生產成本及原材料價格下降。若單看第三季業務，季度收入增幅放緩至16.29%，期內毛利率亦輕微收窄至35.81%。 按產品類別劃分，飲品仍是康師傅主要收入來源，約佔首三季營業額54%，即食麪約佔41%，餘下3%及2%分別是糕餅及其他產品。按AC尼爾森統計顯示，截至9月底止，康師傅仍穩坐內地即食麪冠軍寶座，數量及金額計的市場佔有率分別約41%及54.2%；茶飲料亦保持首位，數量及金額計的市佔率分別約48.7%及47.5%。 三種原料成本將溫和升 包裝水方面，康師傅亦繼續取得內地首位，按銷售數量及金額計的市佔率，分別約24.1%及22.5%。果汁飲料業務則繼續排在可口可樂及統一（220）之後。 林清棠表示，第三季包括棕櫚油及糖等生產成本均出現上升趨勢，只有麪粉價格的波動較小，他預期，三項原料的成本於本季度（第四季度）將會溫和上升。 他指出，集團會透過擴大生產及控制成本，令毛利率維持平穩，目標是希望可進一步上升。他又指，集團會審慎物色收購對象。 康師傅業績概略 首三季收入　金額：314.99億元　變幅：19.81% 首三季毛利　金額：113.57億元　變幅：+31.84% 首三季純利　金額：25.49億元　變幅：+48.88% 第三季度純利　金額：11.50億元　變幅：+60.41% 第三季度收入　金額：119.86億元　變幅：+16.29% 每股盈利　金額：45.63仙　變幅：+48.86%
20091117-150,20091117,150,售後租回售英總部獲利45億,售後租回 售英總部獲利45億 滙控（005）旗下英國滙豐銀行，成功以7.725億英鎊（99.7億港元），向韓國國家退休基金出售位於倫敦金絲雀碼頭的總部物業加拿大廣場，將為滙控帶來約3.5億英鎊（45.2億港元）盈利，預計交易於年底前完成。 每年5.9億租回 滙控會按先售後租形式，每年以4600萬英鎊（5.93億港元）作價租回大樓使用，年期長達17.5年。集團原於前年5月，以11.09億英鎊作價達成先售後租協議，租賃期為20年，但後因市況變化令出售交易告吹，滙控「殺定」後淨賺2.5億英鎊（32.3億港元）。 滙控上周公佈旗下滙豐融資第三季度業績及作出管理層滙報，美國信貸減值按季下跌，里昂發表報告，對滙控的投資建議由「出售」上調為「跑輸大市」，里昂預期，滙控的不良貸款及撥備狀況會持續改善，故調高對09年度滙控盈利預測，優於市場平均水平約6%，明年則高於19%，目標價94元。
20091117-151,20091117,151,資本策略引入鄧普頓,資本策略引入鄧普頓 【本報訊】資本策略（497）公佈，發行7800萬元可換股票據予鄧普頓資產管理公司旗下基金TempletonStrategicEmergingMarketsFundIII，可按每股0.25元換股，較昨收報0.216元溢價約15.7%，兌換股份佔擴大後股本約3.68%。該票據於2012年到期，年息4厘，每半年派息一次，資策所得資金將用作一般營運用途。 發7800萬元換股票據 主席鍾楚義表示，是次引入鄧普頓基金為公司的投資者，有助提高公司的知名度，以便在資本市場吸引國際投資者，他相信，鄧普頓會在市場繼續吸納公司股份，使持股量可增至達5%。現時鍾楚義持有資策約29.9%股權，他本人也有意增持股份。 他又說，公司目前正競投上海一至兩個優質大型項目，現時公司手頭現金約8億至9億元，足夠未來一年在上海發展所需，除非遇上巨型項目，公司具有足夠資金應付，暫時亦無配股集資計劃。 至於資策旗下位於跑馬地的地產項目，他表示，將最早於明年6月發售，總面積約4萬呎，若以每呎2萬元計，料套現近8億元。
20091117-152,20091117,152,中國風電純利飆近倍,中國風電純利飆近倍 【本報訊】中國風電（182）公佈截至9月底止中期業績，半年純利1.07億元，按年升98.57%，主因旗下風力發電業務開始產生顯著盈利貢獻；每股盈利為1.61仙，不派中期息。 主席兼行政總裁劉順興重申，內地風電設備價格下跌對公司有利，暫無再融資需要。 4新電廠年底前投產 中國風電半年營業額3.45億元，上升51.61%。截至9月底止資產淨值約31.89億元，按年上升28.34%。期內有3家風力發電廠投入生產（共14.85萬千瓦），另外有9家風電廠（共59.6萬千瓦）處於興建階段。 劉順興說，截至9月底，旗下7個電廠所生產電力均順利上網，預期將有4個新電廠可趕及今年底前投產，餘下5家則按計劃明年下半年陸續投產。按目前擴展計劃，公司每年新增風電裝機容量將介乎50萬至60萬千瓦。 他指出，公司早前配股後，現時持有約9億元淨現金，目前並無融資需要，下半年度會否派息要留待董事會決定。另外公司宣佈，將年結月為原本的3月底改為12月底。
20091117-153,20091117,153,利信達中期少賺一成,利信達中期少賺一成 【本報訊】利信達（738）公佈截至8月底止中期業績，半年純利3628.2萬元，按年倒退9.75%，主因本港業務欠佳及利息收入下降；每股盈利5.7仙，中期息維持3仙。行政總裁兼執行董事劉舜慧表示，香港業務自9月起開始反彈，惟公司未來會投放更多資源發展內地。 未來力攻內地 利信達半年營業額4.12億元，微升1.04%。按市場劃分，內地市場佔總營業額比重由08年約51%升至67%，按金額計約2.78億元，按年升33.4%。反觀香港區營業額縮減29.61%至5627.3萬元，佔總營業額比重亦降至13.65%。 利信達上半年度內地店舖的同店營業額增幅為3.3%，本港則錄得約20%倒退，主要受金融海嘯影響。劉舜慧表示，自9月起香港業務開始好轉，中港兩地業務於9月及10月均錄得逾10%的同店營業額增長，有關勢頭亦延續至11月。 截至9月底，利信達共有482個銷售點，其中約465個位於內地，港澳地區只有17個。截至10月底，總分店數目已增至531個。劉舜慧說，維持明年將增加200間銷售點的目標，主要位於內地，中期而言內地分店數目可於明年底前增至800間。
20091117-154,20091117,154,美維併同業唐家派錢股東每股獲$1.87現金兼TTM新股,美維併同業唐家派錢 股東每股獲$1.87現金兼TTM新股 【本報訊】政務司司長唐英年家族旗下美維控股（3313）落實賣盤，分別把印刷線路板及覆銅面板業務售予納斯達克上市公司TTMTechnologies及大股東唐翔千，小股東可收TTM新股及現金，總值每股3.47元，較停牌前2.15元溢價61.4%。　記者：高淑嫻 唐家是次無現金落袋，只收TTM股份，成為TTM單一大股東。今次交易總代價68.24億元，基本上是唐家向小股東派錢，美維把出售印刷線路板所得全部現金派予小股東，唐翔千支付現金1.366億元購回覆銅面板業務，也悉數派予小股東，小股東每股可收取現金1.87元，餘額是TTM新股，小股東可持有或沽售套現。 股價潛水　愧對股東 執行主席唐慶年昨在記者會上承認，交易對小股東有優惠，指若小股東無錢賺、無優惠，交易難獲通過，而且「小股東買咗（美維），公司股價無乜彈，我哋都唔好意思」。的確，美維07年上市以來股價浮浮沉沉，介乎0.66至2.79元，公司停牌前只報2.15元，較兩年前招股價2.25元仍潛水，若小股東以招股價認購，今次交易正好帶來54%回報。 另方面，市場解讀唐家出售業務並將美維除牌是要淡出商界，減低日後被指官商勾結機會，為唐英年競選特首鋪路，對此唐慶年似早有準備，強調交易與唐英年無關，指是商業決定，唐英年於公司停牌前全不知情。副主席唐英敏笑言，為免唐英年被人追問美維為何停牌而毫無頭緒，停牌當天才告訴他來龍去脈。 唐家變TTM單一大股東 不過，唐家因交易成為TTM單一大股東，持股33%，TTM經營印刷線路板業務，亦有為美國國防部提供服務，此舉可能令唐家涉及更敏感的軍事議題；唐慶年回應說，線路板在國防部不算敏感項目，而且美國有法例把公司股東與國防機密隔開，股東只能考慮財務利益，不能接觸相關國防技術。交易亦有條文限制唐家對TTM的投票影響，若要增持，最高持股量是39.1%，只有唐慶年獲提名加入TTM董事會；但允許唐家繼續控制亞洲的印刷線路板業務。唐慶年表示，有意長期持有TTM，禁售期18個月。 美維悉售業務詳情 出售印刷線路板業務予TTMTechologies 小股東收取：現金8.838億元及TTM總值8.783億元的新股 大股東收取：TTM總值22.784億元新股，持股量33% 總值：40.4億元 出售覆銅面板業務予大股東唐翔千 小股東收取：現金1.37億元 大股東收取：承兌票據26.47億元 總值：27.838億元 合共（等於每股） 小股東收取：18.99億元（3.47元） 大股東收取：49.26億元（3.47元） 總值：68.24億元	
20091117-155,20091117,155,中策馬時亨購股權分5年行使,中策馬時亨 購股權分5年行使 【本報訊】中策集團（235）新任主席馬時亨昨表示，對中策長期表現有信心，至於近日公司股價大幅波動，如昨日逆市倒插16.92%，跌至0.54元收市，他建議投資者要留意風險。 柯清輝太忙未開董事會 繼董事兼行政總裁柯清輝前往台灣撲火，馬時亨昨透露，稍後他也會到寶島了解南山人壽的情況；自兩人加盟中策後，公司尚未召開過董事局會議，他解釋，主要是柯清輝事務繁忙。 馬時亨表示，出任中策主席後，無計劃再擔任其他上市公司執董職位，將利用以往經驗加強中策的公司管治。除了350萬元基本年薪及花紅外，還獲發1億股5年期購股權，他笑言購股權分4至5年分派與行使，到時該批購股權可能已不值錢。 對於金融海嘯一周年後，全球經濟與資產出現新泡沫，以患上腦動靜脈血管畸形辭職退休的馬時亨指出，歐美像剛脫離深切治療部的病人，目前尚在病房留醫，前者仍須醫生密切監察，後者情況稍佳，但相信未來一年仍維持低息政策；至於中國，「呢個病人就經已無乜病，可以響花園度散下步，部份城市仲增長勇猛，甚至已可以好似我咁，可以周不時跑吓步。」他認同內地目前股樓均有泡沫，且對泡沫爆破感到有點憂慮，相對而言，本港目前資產泡沫不及內地來得厲害。
20091117-156,20091117,156,平保：保費增長勝同業,平保：保費增長勝同業 【本報訊】平保（2318）昨日舉行第三季網上業績說明會，董事會秘書姚軍表示，新保險法對保單品質、業務員的銷售行為、理賠等提出更高的要求，但新保險法的實施並不會明顯地引起經營費用、理賠費用等方面成本上升。 新保險法提高成本小 姚軍續稱，平保首10個月的保費收入取得高於行業平均的增長，今年新單中投資相連保險佔比很低。至於萬能險結算利率水平，他指出，由於平保的萬能險銷售較同業為早，因此較早累積一定規模的平滑準備金，料集團仍有能力維持具市場競爭力的萬能結算利率水平。 對於明年首季，集團將在保持各項業務健康穩定增長基礎上，以「平安一賬通」的全國推廣為契機，提升交叉銷售對業務快速發展的貢獻度。 副首席執行官兼常務副總裁孫建一說，集團暫無在股市集資計劃。對於與大華合資成立基金公司，他指申請仍在監管機構審批中；深發展的交易已按相關程式正常進行申報。
