key,date,article_daily_id,title,text
20090807-0,20090807,0,聲援維權律師港女生公開信質問溫家寶：你們為何如此狠心！,"聲援維權律師 港女生公開信質問溫家寶：你們為何如此狠心！ 【本報訊】誰說香港的青年只懂吃喝玩樂，只懂打機追逐o靚模？年僅17歲的中七學生鄭詠欣，看不過北京政府打壓為人民發聲的民間組織公盟法律研究中心，拘捕身兼維權律師的核心成員許志永博士。她提起小小的筆桿，向總理溫家寶發出如千斤重的公開信，質問溫家寶為何如此狠心，對付一名這樣體諒政府、理性論政的學者。　記者：蔡朗清、蔡元貴 暑假後升讀中七的鄭詠欣，就讀荃灣保良局李城壁中學，前日在報章發表了一篇題為《請用法理來說服我──為許志永老師給溫家寶總理的公開信》。她昨日接受本報訪問說，今年4月與通識教育科的同學到北京考察交流，走訪了公盟及其核心成員許志永，談了兩個多小時。得悉公盟是一班為人民爭取公義的組織。豈料數月後的今天，繼公盟被「抄家」，許博士更身陷囹圄，至今尚未獲釋。 由構思至落筆花了兩日 鄭詠欣表示，同學們對事件十分憤慨，經商議後，決定在facebook組成聲援許志永的群組，又各自撰文投稿報章，她則寫了一封致溫家寶、近2,000字的公開信，上周六開始構思至落筆共花了兩日時間寫成。 鄭詠欣談吐溫文有禮，但文筆強勁有力。她在公開信劈頭第一句說，斗膽用這個標題，因心情與龍應台教授執筆寫《請用文明來說服我──給胡錦濤先生的公開信》時有類似的感受，「我雖然只是一個高中學生……但仍希望能透過自己手上微弱的筆，表達對政府處理『公盟』及許志永先生的手法的不滿。」 文章稱，「溫總理，提起你的名字時，人們都會說你是平民總理，有些小朋友還會被你的親民作風所吸引，叫你一聲溫爺爺」，「但是當我一想起你任內被捕、被禁、被整頓的媒體和異見人士，我卻又不得不質疑你作為純真善良小朋友學習對象的資格！」 鄭詠欣為公盟大抱不平，「公盟是由一群關注中國發展的律師及學者所組成的民間組織……就國家的法制改革提出一些意見和建議，推動國家實現民主法治……被徵地者、毒奶粉案的受害者等等提供法律援助，幫助他們透過現有的司法制度去取得公義。」最後中國政府稅局卻指控公盟漏報稅項。 促給異見人士生存空間 「溫總理，你經常說要『依法執政』、『依法治國』……執法機關是根據哪一條法例去帶走許先生的？」她又稱讚被拘禁許志永「充滿理想但不狂妄……堅信中國終有一天能實現法治民主與自由。」 她狠批「溫總理，我真的十分不解為何你們的心如此的狠。」她又寫道：「為四川地震災後工作努力，我總想叫你一聲『溫爺爺』的。但當看這麼多不合法不合理的事情在中國發生，我實在叫不出呀！」 鄭詠欣昨強調，她將會「耐心等候和熱切期待」溫家寶的回覆，並希望溫釋放許志永，以公平公開處理公盟被指控漏報稅事宜，「最後係希望中國社會終有一天容許異見人士發聲，畀佢哋一個生存空間。」 帶領鄭詠欣一眾同學訪京的老師張銳輝說，訪問公盟目的是讓同學體會國情：「我哋每年嘅考察都有呢個環節，等同學親身了解中國民間嘅發展現況。」他指不少人對「國情」的態度都偏向觀察國家的正面成果，其實訪問民間維權組織也是體會國情的重要途徑。 這次行程共有大約30名同學參與，由五位老師作嚮導，除了與許志永交流之外，也前往北京信訪辦，觀看人民上訪的情況。整個過程，師生沒有受到任何壓力或阻撓。 公開信發出後，暫時未獲任何官方回應。張銳輝說，同學沒有真的把信寄給溫家寶，只是各同學與許老師有一面之緣，對他的維權工作很敬佩：「同學們知道許志永老師被拘禁後，即刻坐埋一齊傾下有乜可以做，所以就花咗啲時間寫封公開信，為許老師出點力，我作為教師，對同學嘅舉動覺得好欣慰。」 請用法理來說服我 ──為許志永老師給溫家寶總理的公開信 溫總理： 斗膽用這個標題，因為我現在的心境，與龍應台教授執筆寫《請用文明來說服我──給胡錦濤先生的公開信》時有類似的感受；龍教授的文章，溫總理想必已經讀過了。我雖然只是一個高中學生，對國事的了解、對文字的掌控，當然不比龍教授，但仍希望能透過自己手上微弱的筆，表達對政府處理「公盟」及許志永先生的手法的不滿。 溫總理，提起你的名字時，人們都會說你是平民總理，辦事以民為本，站在人民利益那方。有些小朋友還會被你的親民作風所吸引，叫你一聲溫爺爺，視你為模仿的對象。 但是當我一想起你任內被捕、被禁、被整頓的媒體和異見人士，如劉曉波先生、程翔先生、《冰點》雜誌、《南方都市報》等等時，我卻又不得不質疑你作為純真善良小朋友學習對象的資格！難道我們國家的教育，是要教小朋友與其他人意見不合時就要對付對方，而非講求中國人千百年來堅持的仁義觀？ 近日被政府盯中的是許志永先生和他所領導的「公盟」。 公盟是由一群關注中國發展的律師及學者所組成的民間組織，他們透過學術研究就國家的法制改革提出一些意見和建議，推動國家實現民主法治。他們另一項為國人所熟知的工作，是為一些弱勢群眾如上訪者、被徵地者、毒奶粉案的受害者等等提供法律援助，幫助他們透過現有的司法制度去取得公義。單從近日稅局搜查後曾獲得幫助的民眾紛紛勇敢地到公盟辦事處聲援一事，任誰也看到「公盟」是站在人民那邊的！為何溫總理你所領導的政府仍要做出這件不合民情的事呢？ 據我所知，「公盟」的工作是非牟利的，他們曾經想登記為民辦非企業單位，但遭到當局拒絕，被迫申請為有限公司。在國際社會，這種團體並不需交稅，而其捐獻者更能獲得免稅優惠。但由於公盟的成員是守法的律師，明知制度的不合理仍舊依規定納稅。在被稅局指控漏報稅項時，亦坦誠地承認錯誤。為何溫總理你所領導的政府仍要向他們徵收最高的罰款，並過分地在公盟辦事處以「搜證」為名而檢走所有維權資料呢？更令人感到無法理解的是，許志永先生突然在召開第二輪聽證會之前，遭公安與便衣從家中帶走，並扣留在看守所中，不能與家人及律師聯絡，同時更要公盟關閉其網頁，這實在是對公民基本權利的無理剝奪。 溫總理，你經常說要「依法執政」、「依法治國」，我想請問你一下，執法機關是根據哪一條法例去帶走許先生的？ 我對中國法律的認識十分膚淺，但仍知道憲法是國家的根本大法，具有最高的法律效力。在我國憲法的第35條列明，中華人民共和國公民有言論、結社的自由，第37條更清楚指出中華人民共和國公民的人身自由不受侵犯，禁止非法拘禁和以其他方法非法剝奪或者限制公民的人身自由。就我對上述條文的理解，我認為許先生現在應該可以自由地留在家或身處辦公室辦事的。 今年4月，我和其他同學到北京考察交流時，有幸在未被搜查的公盟辦事處與許先生談論中國政治。看見他願意無私地為中國在法治民主領域上努力，並對於中國的未來充滿了希望，令我深受感動。猶記得考察時，我們曾到過永定門內國務院信訪辦的門前，親眼目睹不少惡形惡相的截訪者和情況可憐的上訪者。因此，在傾談中有同學便問了許先生一句「為何中央政府會容忍那些截訪者存在呢？」你知道許先生怎樣答嗎？他說上訪人數遠遠超過信訪部門所能承受，所以中央政府亦唯有容許截訪者存在，以免信訪部門的工作量極嚴重超標。在訪問中他多次提醒我們中國政府已很努力，要對政府有多點耐性。 許志永先生就是這樣的一個人！他充滿理想但不狂妄，他看到很遠的目標仍堅持穩重地一步一步走下去，他不怕只有一點一點微弱的力量在慢慢地付出，堅信中國終有一天能實現法治民主與自由。 溫總理，我真的十分不解為何你們的心如此的狠。為何要用這方法去對付這樣一個體諒政府、理性論政的學者呢？他所做的事只是在現有的遊戲規則下安分守己地為弱者去爭取憲法賦予的權利。他做的事情無一不是愛國為民！為何中央連這樣的一個人物也不能放過呢？為何不容許他和公盟透過公開公正的司法程序去處理這事呢？ 溫總理，看着你為四川地震災後工作努力、關心礦工工作環境之時，我總想叫你一聲「溫爺爺」的。但當看着這麼多不合法不合理的事情在中國發生，我實在叫不出呀！但願有一天這樣的事情能夠圓滿解決並不再發生，我相信那一天海內外同胞才會由衷地振臂一呼「中國萬歲」的！ 祝 身體健康 香港中七學生 鄭詠欣敬上"
20090807-1,20090807,1,中學生聯盟：成效不大侵私隱,中學生聯盟：成效不大侵私隱 【本報訊】政府強調警方不會單純因學生被驗出吸毒而作出檢控。不過，警方的駐學校聯絡主任有機會在出席講述驗毒結果的跨界別個案小組會議時，得悉那些學生曾經吸毒，若情報顯示學生可能是拆家，不排除會作出跟進。驗毒計劃一出，有學生表示支持，也有人擔心被侵犯私隱。 支持學生：有助驗明正身 在大埔區升讀中二的黃同學表示，曾聽聞友人有吸毒習慣，她支持計劃，「家好多人吸毒，要及早阻止。」另一位升讀中三的張同學也支持驗毒計劃，認為驗毒結果有助區內學生驗明正身。 不過，中學生聯盟主席文曉彤認為，驗毒計劃不能解決問題，「係起到阻嚇作用，但係（吸毒）過咗一段時間都係驗唔到，成效唔大，又侵犯學生私隱。」她又擔心校內多人知悉驗毒結果，出現標籤效應，「你諗吓如果突然間社工嗌你去見，其他同學會點諗呢？想改過自新都抬唔起頭。」 有服務大埔區的社工表示，吸毒學生有不同方法逃避驗毒，例如被抽中時「扮唔舒服」，或像道友一樣以他人尿液「頂包」，「大不了咪逃學避一避」。
20090807-2,20090807,2,副主教楊鳴章：抗毒非單靠驗毒,副主教楊鳴章：抗毒非單靠驗毒 【本報訊】天主教香港教區副主教楊鳴章表示，政府推行校園驗毒計劃過於倉促，建議押後一個學期或一個學年實施。他重申，教會不主張校園驗毒，擔心破壞家庭關係，甚至令學生逃學；不過，教區並無向轄下學校給予指示，學校可自行選擇是否參與。 配套未做好　籲推遲計劃 楊鳴章昨日接受電子傳媒訪問時表示，政府推行校園驗毒過急，建議推遲一個學期或一個學年，「只係針對學校驗毒，忽然間喺平地一聲雷，好急進咁推行，根本完全有些少措手不及。」他解釋，計劃未必抽中吸毒學生，即使抽中，亦未必自願，社工跟進的配套亦未做好，「我覺得就算推遲一個學年，又有乜大問題呢？因為我們現在唔係乜工夫都唔做，不過驗毒可以推遲。」 他不相信驗毒可以找到吸毒學生，「有冇方法係可以逃避呢？我哋大家都知道係可以嘅，佢逃學咪得囉！」他表明不是教學生逃學，只是質疑效果，又指抗毒並非單靠驗毒，擔心若家長同意讓子女參與計劃，但子女不願意，會破壞家庭關係；又指學校不應懲罰吸毒學生，應加強教育及跟進。 他指教區並非與政府對着幹，亦沒有下令學校退出，個別學校可自行決定是否參與。
20090807-3,20090807,3,隱瞞多年　康文署失國父文物不報警不追查　議員決立會追到底,"隱瞞多年　康文署失國父文物 不報警不追查　議員決立會追到底 【本報訊】康樂及文化事務署又「孭鑊」。原本收藏於該署轄下孫中山紀念館的21件國父文物，在01年跟其他約3,000件文物一同購入時被遺失，但署方懵然不知，直至審計署在05年查核時才揭發事件。惟康文署事後沒有報警，更放棄追查文物下落。昨日被踢爆後，署方承認該批文物已不知所終。立法會議員陳淑莊質疑有人刻意隱瞞，會在立法會追究到底。 記者：黃偉駿 康文署於01年底籌建孫中山紀念館時，派出當時的歷史博物館館長吳志華到美國洛杉磯，向孫中山女兒孫琬70多歲的契女司徒倩，洽購逾2,700件國父文物，包括多幅珍貴照片、文書及證件等。司徒倩因擔心死後無人打理該批文物，答允以半捐半售形式以港幣100萬元低價向港府出售整批文物。 不過，署方於02年初分別在美國及澳門接收該批文物時，由於發現對方交來的文物數目超逾3,000件，比原有多出約400件，誤以為沒有遺漏，沒有即場核對清單，並於同年在孫中山紀念館陸續展出該批文物。 拒透露有何紀律處分 05年底審計署對康文署博物館的館藏進行審核，發現賬目混亂，名單上有21件文物更不知所終，包括有宋慶齡簽名的國父照片等；於是撰寫報告，打算在06年3月報告書中狠批康文署。然而，審計署隨後以康文署正在進行調查為由，將有關報告內容臨時抽起。 康文署發言人昨表示，署方於07年完成調查後，已將結果知會民政事務局及審計署。當時調查認為不涉刑事成份，只是有人在處理過程中欠缺謹慎，也沒有證據顯示文物在運送過程中遺失，所以只向當時負責有關工作的博物館館長作出紀律處分。署方未有透露作了甚麼處分，但翻查資料，吳志華一直負責本港的文物保育與博物館工作，現時仍然是康文署助理署長（文博）。 陳淑莊怒轟離譜黐線 康文署副署長鍾嶺海昨日表示，對事件十分重視，但承認已經無法尋回遺失的21件文物。他又諉過於人，稱可能是賣家在填寫清單時出錯。 公民黨立法會議員陳淑莊炮轟康文署離譜及「黐線」，處理珍貴文物的過程非常馬虎，「你買件Gucci，人哋畀件Prada你，應該去換番，有乜理由照單全收。」她指署方動用的是公帑，應該有謹慎的開支程序，她稍後會在民政事務委員會追究責任，「中間一定有人隱瞞。」 孫中山文物遺失經過 日期：01年11月 事發經過：歷史博物館館長吳志華赴美以100萬港元向孫中山女兒契女司徒倩，購入2,700多件國父文物 日期：02年初 事發經過：康文署於美國及澳門接收文物，但沒有即場點算是否跟清單所列相同 日期：02年9月 事發經過：部份文物在孫中山紀念館展出 日期：05年底 事發經過：審計署查核康文署博物館藏品，發現少了21件清單上的文物 日期：06年初 事發經過：審計署以康文署正調查為由，臨時抽起狠批康文署遺失文物的報告內容 日期：07年中 事發經過：康文署向民政事務局提交報告，指不涉刑事，已處分館長吳志華，但無跟進文物下落 資料來源：康文署、審計署 抽起報告　審計署受牽連 【本報訊】原本揭發文物遺失混帳的審計署，因為遷就康文署的調查，結果臨時抽起報告內容，最終被傳媒率先揭發。審計署署長鄧國斌表示，若署方對康文署的報告內容不滿，定必作出跟進。立法會政府帳目委員會已表明會跟進事件。 鄧國斌昨向本報表示，署方在05年審查康文署賬目時發現事件，隨後將報告草稿交給對方作回應；當時康文署稱正進行調查，署方於是決定等待調查報告完成，臨時抽起審計報告內遺失文物的部份。鄧國斌解釋，由於不能透露調查細節，所以目前不能交代審計署是否仍跟進這宗個案，但強調署方若不滿康文署的解釋，及公眾對事件十分關注，署方必追究到底。 立會表明會跟進 審計署在06年3月份的審計報告內，就公共博物館服務提出多項建議及批評，包括指多間博物館都沒有典藏政策，及積壓了大量藏品未登記入冊，但未有提及這宗國父文物遺失個案。 不過，立法會政府帳目委員會成員鄭家富認為今次事件嚴重，委員會一定跟進。委員會主席黃宜弘表示，曾到訪過康文署的貨倉，發現內裏十分混亂。他說立法會復會後，將聯同其他成員跟進事件。"
20090807-4,20090807,4,陪會考兒子撲位　慈父心臟病發中六只餘1507學額　平均20人爭一個,"陪會考兒子撲位　慈父心臟病發 中六只餘1507學額　平均20人爭一個 【本報訊】中六收生程序今日進入第四階段，推算仍有約三萬名合資格升中六學生未找到學位，但公營中六學額只餘1,507個，平均20.5人爭一席。連日來學生和家長四出撲學位，一名患高血壓、心臟病及糖尿病的慈父，昨陪伴兒子回母校找中五重讀學位期間，疑勞累過度致心臟病發，當場暈倒，送院救治後無大礙。 一名在新界鄉議局大埔區中學就讀的會考生，因成績欠佳未能升讀中六，其父由前日放榜日，即陪兒子四出找尋學校，可是一番奔波仍無收穫，遂決定回原校嘗試報中五重讀。其父今年50歲，患高血壓、心臟病及糖尿病，昨晨10時許，在其子填表期間，這位好爸爸突然暈倒，兒子見狀大驚呼救，由校方召救護車，經救護員急救後已回復神志，由17歲兒子陪同送院檢查。 觀塘區餘額最多 律敦治醫院內科顧問醫生劉育港指出，中五會考放榜令不少家長牽腸掛肚，不少家長會陪子女找學校共度難關，但提醒家長要保重身體，因為勞累及緊張情緒足以誘發心臟病，令血壓、腎上腺素及荷爾蒙增高，加重心臟負荷，誘發心臟病。 會考前日放榜後，推算至今仍有30,844名考獲升中六成績的考生未找到中六學位，他們只能趁今日收生階段，到原校以外中學撲學位。目前剩餘的1,507個學額，觀塘區佔最多，有170個；其次是大埔、黃大仙及葵青區。直資中學也有97個餘額。離島區八所中學今日將在東涌教育工作者聯會黃楚標中學舉行聯招，該區有97個餘額。今日過後如果仍有學額剩餘，教育局將舉行統一派位。 各校昨日上午只能取錄考獲最佳六科14分或以上的考生，但不少成績未達標的考生，仍到各中學撲位。教育局發言人表示，昨日收到兩宗對收生程序的投訴，局方會向學校了解。 觀塘高雷中學昨晨仍剩餘44個中六學額，吸引至少60多人前往報名，但大部份因不足14分失望而回。 旺角潮州公學門外昨晚出現一條20多人的人龍，準備今天申請餘下的中六學額。 10所最多餘額的中學 學校：佛教大光中學 餘額（個）：53 學校：佛教慧因法師紀念中學 餘額（個）：42 學校：明愛莊月明中學 餘額（個）：40 學校：高雷中學 餘額（個）：38 學校：孔聖堂中學 餘額（個）：37 學校：伊斯蘭脫維善紀念中學 餘額（個）：37 學校：佛教慈航智林紀念中學 餘額（個）：37 學校：香港仔工業學校 餘額（個）：36 學校：救世軍卜維廉中學 餘額（個）：36 學校：中華基督教會基協中學 餘額（個）：30 資料來源：教育局"
20090807-5,20090807,5,考評局提醒會考生：索答卷不同覆核成績,考評局提醒會考生：索答卷不同覆核成績 【本報訊】考試及評核局正接受有關覆核會考成績和索取答題卷的申請，局方稱至昨日未有收到會考生提出取回答題卷申請。該局秘書長張永明提醒考生，申請覆核成績和索取答題卷是兩項服務，索取答題卷並不包括覆核成績。 會考前日放榜後，陸續有考生到考評局申請覆核成績。至於今年起正式提供索取答題卷的服務，發言人表示，至昨日只有四宗，都是在會考放榜前收到。張永明昨在電台節目表示，考生上訴覆核成績及領取答題卷副本，是法律賦予的權利，局方會盡力配合考生的需要。 未出評核標準　難爭取加分 考評局發言人補充說，考生若按照《個人資料（私隱）條例》申請索取已評閱的答題卷，局方會將已評閱的答卷上所有資料，包括考生的完整答卷、考生不同分題及項目所得的分數、閱卷員的評語及記號提供給考生。 不過據了解，考評局每年較後時間才出版「評核標準」，考生即使覺得評卷有問題，也未能趕及在申請覆核會考成績期內，找專人按照官方答案再批核，因而難以向考評局爭取加分。 另外，新學年起將推行新高中，明年會考將是舊制最後一屆，後年有多一次補考，但張永明不鼓勵學生今年重讀中四，認為應盡力而為。
20090807-6,20090807,6,立會特權案　准呈梁國雄誓章,立會特權案　准呈梁國雄誓章 【本報訊】新世界發展董事總經理鄭家純及執行董事梁志堅，就《立法會（權力及特權）條例》是否合憲而申請司法覆核。立法會調查梁展文事件的專責委員會成員之一梁國雄，昨向高等法院申請呈交新誓章，內容講及當年起草《基本法》有關條文的過程及立法原意，獲法官批准。 李柱銘：從未如此忍氣吞聲 代表梁國雄的資深大律師李柱銘指，早前曾多次去信知會申請一方，尋求他們同意呈交新誓章，他當大狀以來從未如此忍氣吞聲，但始終未能解決問題，結果勞煩法庭給予指示。 司法覆核申請人鄭家純及梁志堅的代表大律師潘熙反對梁的申請；不過，反遭法官張舉能質疑，申請人應有責任向法庭提供《基本法》草擬資料，協助法庭正確詮釋有關條文，現刪除梁國雄新誓章中其中兩段，其餘部份確實提供相關資料，不明兩名申請人為何反對。 法官同時批准立法會秘書長吳文華呈交新誓章，內容關於立法會在《基本法》生效前後召開聆訊的歷史資料。法官又指示，申請人及所有訴訟相關人士，均可於下周一前向法庭呈交相關資料，本月17日聆訊維持不變。 案件編號：HCAL79/09
20090807-7,20090807,7,長毛：不應為總辭潑冷水,長毛：不應為總辭潑冷水 【本報訊】部份泛民主派對五區總辭的變相公投建議成效存疑，憂慮泛民以小博大也未必有助特區普選進程。但力推五區總辭的社民連成員「長毛」梁國雄卻認為有關憂慮「無邊無際」，直指「試過先知有冇效」。他期望泛民最遲在11月宣佈五區總辭方案，以便在政改報告出爐前向特區政府發出最後警告。 期望11月有全盤計劃 有泛民中人一直對五區總辭計劃有所保留，公民黨黨魁余若薇也擔心計劃對泛民陣營「弄巧反拙」。長毛昨天直指有關憂慮「無邊無際」，認為泛民應從進取角度思考計劃，「唔係去搵一百個理由諗去唔去」，強調必須親身落實計劃才知是否有成效。他認為泛民中人若對計劃有隱憂，大可表明不參與，但不應自潑冷水。 由於五區總辭的最主要目標，是向政府表明爭取2012年雙普選的決心，長毛認為泛民主派必須盡快在9月開會討論，並在10月定稿，例如決定辭職及參與補選人選，以及落實如何籌募選舉經費，以便在11月有全盤計劃，「畀政府一個警告，叫佢唔好攞個差勁政改方案出嚟。」
