key,date,article_daily_id,title,text
20090208-0,20090208,0,更衣室藏攝錄機　偷拍啤酒女郎疑多人中招　酒樓經理被捕,更衣室藏攝錄機　偷拍啤酒女郎 疑多人中招　酒樓經理被捕 【本報訊】灣仔一間酒樓疑出現鹹濕經理，兩名被稱為「啤酒妹」的啤酒推廣女郎，前晚上班在酒樓更衣室換衫時，於暗處發現一部正在開着的攝錄機，懷疑有「偷窺狂」偷拍她們的更衣春光，於是立即報警。警員到場調查，證實該部攝錄機是酒樓一名經理所有，並懷疑他就是該名「偷窺狂」，於是將他拘捕帶署調查，警方初步懷疑有人長期進行同類偷拍行為，相信已有多名啤酒女郎中招。　記者：麥超億、冼偉倫 現場為灣仔洛克道一間酒樓，據悉，該酒樓平日常有啤酒女郎做推廣活動，在晚飯及消夜時段向客人推廣啤酒。事發在前晚11時許，兩名啤酒女郎返回酒樓上班後到更衣室換制服，其間有人發現暗處有一點紅燈閃閃發光，於是走近細看，赫然發現竟是一部家用的攝錄機，而且正在啓動中，鏡頭則對準她們換衫的位置。 記憶卡內藏多張春光照 兩女發現後大為震怒，認為有人偷拍她們換衫，立即穿上衣服走出酒樓大堂向職員投訴，但一時不得要領，其中一名23歲姓蕭的受辱啤酒女郎報警。警員到場調查，發現攝錄機內有一名男子的自拍片段，稍後證實該攝錄機的機主是一名35歲姓謝的酒樓經理，經查看攝錄機內的記憶卡，發現內有女性更衣的畫面，懷疑有人偷拍春光，於是以「破壞公眾體統罪」將謝拘捕帶署。  消息稱，警方懷疑有人在更衣室放置攝錄機偷拍女職員換衫春光的行為，已維持了一段長時間，同時估計已有不少女士中招而不自知。因此，警方到被捕經理住所及酒樓儲物櫃搜查，追查他有沒有收藏更多有含偷拍春光的錄影記憶卡。警方事後准他以500元保釋候查。  記者昨日就事件到該酒樓查詢，一名經理似在隱瞞，他回應稱：「我哋呢度係有啤酒妹嘅，但冇聽過有偷拍咁嘅事。」同酒樓一名女知客則表現驚訝說：「如果有咁嘅事，咁我咪一樣俾人拍咗囉！」 啤酒女郎：都係打底安全 據一名在灣仔區工作的啤酒女郎表示，公司有指引若她們遇到同類事件要報警，但公司和同行間都不會公開談論事件，以免影響商譽。她說，如果她在大牌檔開工時，她一定不會在大牌檔的廁所換衫，「因為污糟嘛！」她會在附近商場廁所換衫；即使在酒樓開工，她亦寧願在酒樓女廁換衫，因為始終覺得更衣室「唔係咁安全」。她最後說：「都係打底最安全。」  對於今次偷拍事件，法律界人士黃國桐稱，在公司更衣室偷拍的行為可觸犯「破壞公眾體統罪」，由於這是普通法，判刑是根據過往判例來考慮，條例本身沒有最高刑罰，所謂最高刑罰指審判場所的權限，如觸犯這罪在裁判法院審理，最高是判刑三年，在地方法院審理，最高是判刑七年。  他又指出，根據過往的判例而言，被告罪成多判緩刑和罰款，也有些會被判入獄幾個月，但他覺得有上司利用自己職權在公司裏偷拍，行為是可耻和令人擔憂，犯罪者應被判刑重一些。此外，很多犯罪者是涉及心理問題，最好判他們接受適當的心理治療。 酒樓經理更衣室偷拍啤酒女郎示意圖
20090208-1,20090208,1,新春車牌拍賣　競投氣氛熾熱女子170萬投得車牌「2318」,"新春車牌拍賣　競投氣氛熾熱 女子170萬投得車牌「2318」 【本報訊】城中富豪雖然被金融海嘯捲走大半身家，但富豪的玩物「幸運車牌」仍然企硬有價有市。運輸署昨舉行的農曆新年車牌拍賣氣氛比預期激烈，逾半拍賣的車牌成交價都數以十萬元計，無字頭車牌「2318」由一名神秘女士以全日最高價170萬元投得，全日總成交價874.6萬元，是自03年沙士以來第4高。  運輸署昨推出45個車牌拍賣，當中42個是傳統「幸運車牌」，餘下3個則是自訂車牌，底價由數千至廿多萬元。事前不少買賣「幸運車牌」的業界人士都不看好，估計今次拍賣成績會如前幾次般淡靜，未料昨競投氣氛熾熱，半天的拍賣會有約100人出席，多個車牌都經過十多口承價成交，廿多個車牌甚至以十萬元以上賣出。 兩人相爭承價37口 無字頭「2318」車牌昨成為全場焦點，由底價5萬2千元開始，即獲多名買家競價，每口叫價由二千跳至五千、再跳至一萬、二萬、五萬。到約第17口價只剩下一名身份神秘女士，與著名馬主梁啓徽和兩名二十多歲的兒子出價。兩邊陣營爭持激烈，到第30口價，拍賣官把每口價提升至十萬元，當時出價已達100萬元，但兩邊仍未放棄。到第37口價，該中年女士終以170萬元投得，成交價較底價高出31.7倍是全日最高價。該女士全程都使用手提電話和他人交談，相信是電話另一端的隱形富豪指派她競投，該女士沒回應記者提問便匆匆離去。 有猜測是平保投得 「2318」是中國平安保險在港交所的上市編號，故惹來現場猜測是該公司派人競投，平保發言人盛先生回應本報查詢時指不了解事件。  梁啓徽未能投得「2318」後，將目標轉至無字頭「3218」（諧音生意實發）和「MY8」，分別以75萬和44萬元投得。他表示，兩個車牌都是兩名兒子的心頭好，故即使花百多萬元也覺值得。他又指，雖然昨日是首次出席車牌拍賣會，但覺得現場競投氣氛甚好，不見得買家受經濟轉差影響出價意欲。  另一買家吳先生則帶同家人以11萬元投得「NG38」，認為車牌可代表自己姓氏和帶有好意頭。曾出席數次車牌拍賣的他指，昨日競投氣氛甚好，買家都願意花數以十萬元投得心頭好。 十個成交價最高車牌 第1位　車牌：2318　成交價：1,700,000  第2位　車牌：3218　成交價：750,000  第3位　車牌：1318　成交價：650,000  第4位　車牌：NG1　成交價：550,000  第5位　車牌：MY8　成交價：440,000  第6位　車牌：MY333　成交價：400,000  第6位　車牌：MM88　成交價：400,000  第8位　車牌：GG*　成交價：380,000  第9位　車牌：MS1　成交價：300,000  第10位　車牌：NN3　成交價：240,000    註：拍賣車牌45個，3個無人競投，總成交價8,746,000元 農曆新年車牌拍賣成績 2009年份　總成交：874.6萬元  2008年份　總成交：3,369.1萬元  2007年份　總成交：595.6萬元  2006年份　總成交：492.5萬元  2005年份　總成交：1,348.7萬元  2004年份　總成交：904萬元  2003年份　總成交：776.7萬元    資料來源：運輸署、《蘋果》資料室"
20090208-2,20090208,2,特稿馬主：車牌較買馬風險低,特稿 馬主：車牌較買馬風險低 擁有名駒「幸運馬主」的馬主梁啓徽昨日首次出席運輸署的車牌拍賣會，並以110多萬元投得兩個車牌。在澳洲等地經常參與馬匹拍賣的他指，買馬比車牌更有風險，「隻馬買返嚟之後唔一定好跑得成日攞獎，但車牌就可以長期掛喺架車度，屬於自己冇咩風險。」 幸運車牌屬富豪玩物 梁又表示，今次拍賣花百多萬投得兩個牌不算貴，並指在澳洲馬匹拍賣會每隻馬匹動輒需花數十萬澳元（以百萬港元計）才購得，比較下車牌拍賣便宜得多。優質幸運車牌中心董事顏文翰表示，「幸運車牌」屬富豪玩物，也是他們的身份象徵之一，故即使經濟下滑也不會損害他們追捧「幸運車牌」的心態。  顏又稱，「幸運車牌」尤其是「無字頭」的車牌最為矜貴，擁有的富豪多是用家，只會放在自己名下的車上，當作是珍藏品之一。他續說，「幸運車牌」數量不多，買少見少，「所以好多有錢人都肯畀多啲錢出嚟投心頭好顯示自己身份，有價有市自然越來越貴。」  本報記者
20090208-3,20090208,3,5.5萬人今跑馬拉松多處封路,"5.5萬人今跑馬拉松多處封路 【本報訊】一年一度運動盛事「渣打馬拉松」今日舉行，今年參加人數再度刷新至5.5萬新高。有體育專家及醫生提醒健兒們進行比賽後應即時補充水份，並作拉筋及按摩等紓緩肌肉動作，亦應進食含碳水化合物與蛋白質的食物補充體力。至於沒有參賽的市民，也可享受全港3,000個商戶提供的優惠，全城為香港加油！  第13屆渣打馬拉松共吸引來自20個國家地區超過5.5萬人參加10公里、半程馬拉松及全程馬拉松賽事；多達161條巴士線及27條小巴線受影響，東區走廊、彌敦道、西九龍快速公路及青嶼幹線等多條道路會暫時封閉，預計下午2時才解封。  家庭醫學專科醫生關嘉美指，跑完馬拉松後若情況許可，未來一星期最好穿着大半號至一號的波鞋，讓雙腳休息，「因為跑完步會令雙腳脹少少，着波鞋會舒服啲，亦盡可能唔好上落樓梯。」 300商戶優惠為香港打氣 浸會大學體育系副教授雷雄德表示，比賽過後健兒們應即時補充水份，進食簡單及易消化例如香蕉、麵包等碳水化合物及澱粉質食品，更要拉筋紓緩肌肉疲勞，並應穿上外套保暖，「因為跑完後3小時身體免疫系統會下降，就算到時天氣熱啲都要着番件外套。」回家後可以40至42度水溫洗澡5至10分鐘才休息。  渣打又發起「全城跑出來為香港加油」活動，發起3,000個商戶在今天提供各式優惠為香港打氣，參加商戶包括泰昌蛋撻、7-11、萬寧及中原電器等。市民只要到泰昌惠顧任何貨品並叫「CheerupHongKong」或「香港加油」口號，便可獲贈蛋撻一個；7-11則推出一元一杯思樂冰及奶茶，到萬寧購買任何產品也可獲500毫升礦泉水一支及多張優惠券，詳情可瀏覽 http://www.cheer-up-hongkong.hk網址查看。 "
20090208-4,20090208,4,政府再洩機密Foxy任下載包括殉職消防英雄蕭永方資料,政府再洩機密Foxy任下載 包括殉職消防英雄蕭永方資料 【本報訊】繼踢爆警務處及入境處人員網上洩密，Foxy天王再揭消防處及食環署的機密文件，經Foxy軟件公諸於世。文件多為消防員考核報告，其中嘉禾大廈火警中英勇殉職的消防隊目蕭永方，文件詳列上級對他的評語，令英雄身故後也難保私隱。消防工會要求局方徹查原因。　記者：翁煜雄、蔡元貴 前晚，Foxy天王在網上分享軟件Foxy輸入一些關鍵字眼，即搜索到大批涉及消防處及食環署的限閱文件。本報發現文件多來自消防處，其中「員佐級人員考核報告」載有最少22名消防員及消防隊目資料，包括姓名、職級、入職年份、學歷、體能表現、工作表現等。  其中一人叫蕭永方，從報告顯示的職級、出生及入職年份，相信就是去年8月10日於嘉禾大廈五級大火中殉職的消防隊目蕭永方。上司對他於02至03年表現評語不俗，於各方面評級均取得優或良，結論是「非常適合升級」。  蕭永方的考核報告稱，他是一個工作態度認真充滿幹勁，積極進取及具備領導才能的人，加上他精闢的分析和判斷能力，是一個能夠承擔重任的隊目。 消防工會要求徹查 報告特別提及02年6月中紅磡家維邨發生的一宗跳樓事件，「蕭永方被委派到天台執行任務，他帶領幾名隊員到達天台部署一切，當接到立即行動指令的一瞬間，表現出臨危不亂及果斷，成功拯救一名接近死亡邊緣跳樓之女子。其行動效率極高有出色表現，常常受到上級之讚賞。」其他消防員評核有的只取得常或可評級，又有文件列出消防員聯絡電話。另外，也有文件疑來自食環署，包括一份非公務員合約僱員的評核報告。  文件涉及年份甚廣，最遠99年，最近08年。Foxy天王表示：「保安局長李少光講過關注啲洩漏事件，咁快又再發生，連在浩園長眠英雄都無法安息，個人資料任人睇，對佢家人實在係傷害。」互聯網協會會長莫乃光估計，極大可能是有人將機密文件帶返家中處理，電腦曾安裝Foxy軟件，而Foxy易遭黑客偷偷加入間諜程式，就算用戶已設定只分享指定檔案，Foxy也可偷偷分享其他文件，甚至用戶已刪除它，也可悄悄留在電腦內，應交由專業人士徹底清除。  消防處職工總會主席袁晃謙說，員工評核資料極機密，有時連當事人也不可接觸，他要求局方徹查事件。立法會議員涂謹申對於政府多次發生此類事件感驚訝，政府尤其保安局應加強保障私隱措施。  消防處表示已發出指引，若須把限閱及機密文件帶離辦公室，必須上級同意，並採取適當保密措施。消防處將跟進處理今次事件，食環署則表示會了解事件。 你想知　想講　想問？ 政府部門機密文件屢在Foxy被洩露，你認為原因何在？    請即上《蘋果》網頁 http://appledaily.atnext.com留言喇！   或電郵至：mailto:focusgroup@appledaily.com  傳真：37112411  手機短訊：63836568
20090208-5,20090208,5,特稿警方口供紀錄也中招,特稿 警方口供紀錄也中招 去年經Foxy軟件洩密的重災區警務處，上月又有內部文件流出。網民陳先生透過Foxy覓得一份警務處會面紀錄，內容是天水圍警署一名警員，向聚賭疑犯錄取口供的資料。陳先生擔心文件公諸於世，日後疑犯受查問時有所準備，不利調查。  陳先生於上月30日，無意中下載了一份文件，名為「pol_857_street_gambling.doc」，是列明為「個人資料」的會面紀錄。據文件顯示，天水圍警署姓嚴警員於上月17日曾向被捕男子問話，涉及一宗街頭聚賭案，文件列出15條問題，包括「邊個做莊」、「台面啲錢係邊個嘅」等。 致函投訴未回覆 文件沒有暴露涉案被告的身份，但陳先生擔心這位嚴先生拉了非法賭博的人，要問甚麼的問題被公開之後，很多人會有所準備，影響警方調查。陳先生已去信警務處投訴，但迄今未有回應。立法會保安事務委員會副主席涂謹申促請警方徹查事件：「我最怕仲有唔知幾多資料經Foxy外洩，警方一定會搵出個源頭。」  警隊員佐級協會主席鍾錦華說，自從去年大量警隊文件流出的醜聞爆發後，警隊加強安全措施，警務人員只在必須時才能在家中處理文件，並須得到上級同意。  本報記者
20090208-6,20090208,6,劉母追奧運金牌不果爆內幕李暉曾與劉洋同住一單位,劉母追奧運金牌不果爆內幕 李暉曾與劉洋同住一單位 【本報訊】北京奧運武術示範賽劍術、槍術全能金牌得主劉洋，與香港「太極王后」李暉間的恩怨越揭越深。劉洋母親昨接受訪問披露，李暉扣着劉洋最重要的奧運金牌不放的原因，又說出兒子遭李暉解僱的原委。由於未能聯絡李暉回應，事件的真相仍待解說。  李暉的手機昨日一直未能接通，但本報卻找到劉洋及他母親張春燕，以下是他母子所說的版本。  劉母表示，劉洋於去年奧運完結後，與一名同齡、青梅竹馬的女子（現隸屬北京某體操隊）結婚。劉洋於去年9月中旬返港，並將婚訊告之其僱主李暉，之後劉洋於9月16日接到一封提前終止合約信，指公司（李暉武術文化中心）重組架構，劉洋的合約即時被終止。 指兒子結婚導致被炒 「她（李暉）對我兒子說，一個星期內要離開香港，否則向入境處告發他！」劉母說。劉母又稱，她以前多次由北京來港探望兒子，都住在李暉位於西半山的雍景臺的單位內，而兒子亦與李暉共住同一單位，已屬男女朋友關係。她見兒子與李暉年紀相差太遠，為兒子的處境感難受，她記得當時直接問李暉，有否與兒子結婚？李暉斬釘截鐵地說：「沒有！」  劉母認為，兒子被李暉解僱，主因是「關係已盡」，遂借勢提前解約，再者又可避免支付劉洋在港工作滿四年的長期服務金。至於扣起他最重要一枚金牌，則是有心留難劉洋及阻礙他的發展，因沒有金牌，怎算奧運冠軍！ 劉洋否認與李暉緋聞 另一方面，已返回北京的劉洋，在電話中透露，目前受僱北京首都體育大學，教授武術及器械。他指很想回港處理事件，無奈工作合約被終止，來港簽證無法辦理。他說：「我一定要拿回那枚奧運金牌，真的沒辦法，只有透過法律途徑去解決。」  劉洋證實，他已與一名從小認識的女子，於去年奧運結束後結婚，但對於被坊間指他與李暉關係不尋常，他回應：「我沒有跟她（李暉）同居，我是住在她單位內一個房間，所有的學生及學生的家長，都不認為我跟她有曖昧的關係。」  這宗撲朔迷離的事件，緣於劉母前日到港，直往李暉家中，欲替兒子取回去年在北京贏得的奧運武術項目的金牌，由於李暉拒不交出，最後演變成警察上門將劉母驅走一事，劉母不忿，遂透過傳媒將事件曝光。
20090208-7,20090208,7,襲警案揭政府物業被霸佔,襲警案揭政府物業被霸佔 【本報訊】四名藍帽子警員，昨午巡經荃灣綜合運輸大樓平台，截查一名可疑男子時遇反抗，糾纏間一名警員遇襲受傷，但仍將疑人制服拘捕。被捕疑人其後證實為露宿者，警員事後在其佔用平台地方撿獲不明來歷廁紙及罐頭，疑偷竊得來。涉案男子姓許（33歲），因涉嫌襲警、偷竊及偷電被捕。  現場為大河道98號荃灣綜合運輸大樓，屬政府所有。上址樓高四層，地下為小巴站，一樓為平台，樓上則為多層停車場及荃灣駕駛學院。有街坊表示，一樓平台近通往地下樓梯處的一列地方，原有10個花槽，由於大樓要配合港鐵上蓋物業發展將要拆卸，數年前有關當局將花槽用石屎填平，及用鐵板將花槽圍着，每個花槽周圍如一個約100平方呎的單位。 疑偷電受查時襲警 由於近碼頭風凉水冷，其後被一些露宿者霸佔入住，入住的露宿者多為小數南亞裔人士、無業漢及癮君子，單位內放有床褥及木櫃等雜物。  昨午1時許，四名機動部隊警員在大河道一帶進行反罪惡巡邏，在巡至上述綜合運輸大樓平台時，發現許在一個面積約10平方呎的水喉槽房間內形迹可疑，上前截查時，發現他正偷取水喉槽內的電源為手提電話充電。  其後他帶領警員返回其單位取身份證明文件，警員打開他的一個鐵箱搜查時，發現箱內有四卷公廁廁紙及數罐罐頭，來歷不明懷疑他偷竊所得，欲將其拘捕時，許突然反抗與一名警員糾纏，糾纏間警員受傷，但仍將他制服拘捕。事後受傷警員獲送院治療。
20090208-8,20090208,8,預料下年度財赤大過今年度曾俊華暗示不會全民派錢,"預料下年度財赤大過今年度 曾俊華暗示不會全民派錢 【本報訊】財政司司長曾俊華昨日面對市民當面要求「派糖」的壓力下，以政府下年度赤字將較今年度大作為回應。他又指政府資源有限，暗示不會一刀切向全民派糖。曾俊華又指，新一份預算案會以創造就業為重點，呼籲銀行金融業的失業人士考慮其他工種，「工作係無分貧富貴賤嘅。」 叫失業者面對現實 曾俊華昨日到將軍澳出席一個財政預算案論壇時指出，現時本港失業情況以銀行金融業情況較嚴重，勸喻有關人士要面對現實，現時要找回同類工作的可能性不高，應考慮其他工種。大批現場市民向他提出要求政府派錢和推出不同紓緩措施，有市民更批評政府對物流業支援不足，「比新加坡、南韓同大陸差好遠。」曾俊華回應時稱，政府會考慮退稅，向中產提供協助，又指政府將與鄰近地區商討幫助物流業。有中小企代表質疑政府推出的1,000億元貸款計劃成效不彰，曾俊華則稱：「睇唔到銀行唔借錢，唔信佢哋有生意會唔做。」商務及經濟發展局局長劉吳惠蘭昨稱，計劃至今已批出1,900宗申請，合共借出41億元。  面對有市民力促公務員減薪共度時艱，曾俊華稱，本港政府與其他國家相比，公共事務支出比例佔總生產值低於20%，政府會留意那方面可以節流，但隨後又稱為創造更多就業機會，「公務員會再請多啲人」。對於有人要求政府推出措施吸引遊客留港消費，曾俊華就提出反建議：「希望公司推出更多實惠產品、好啲嘅折扣，相信會吸引好多人。」面對有長者要求政府縮短診所候診時間，曾俊華即稱：「我都係用政府啲服務，係有啲診症，我都要等好耐。」他指政府日後會提高醫療支出。 市民促公務員減薪 至於有市民要求在預算案每人派5,000元現金的建議，曾俊華稱：「相信好多人贊成咁嘅睇法。」但強調政府資源有限，有需要透過針對性措施協助有需要人士，又指雖然政府於09/10年的收入會減少，但不會因而縮減支出，預期09/10年的赤字會較大，會多於75億元。 曾俊華回應市民對預算案的訴求 市民訴求：遏止超市商品價格上升  曾俊華回應：政府不會控制商品價格    市民訴求：協助青年人首次置業  曾俊華回應：年輕人最重要有穩定工作，首次置業可慢慢完成    市民訴求：縮短長者輪診時間  曾俊華回應：我用政府診症服務也要等長時間    市民訴求：推出措施吸引遊客留港消費  曾俊華回應：公司應推出更多實惠產品及折扣    資料來源：「財政預算案」諮詢論壇"
20090208-9,20090208,9,疑兇提堂　拒用律師　殺妓案編號666警追查是否另涉同類案,疑兇提堂　拒用律師　殺妓案編號666 警追查是否另涉同類案 【本報訊】「鳳姐殺手」的出現，引起鳳界人心惶惶。警方經過抽絲剝繭調查，終於拘捕涉嫌於一個月內連殺兩名性工作者的年輕裝修工人。他被控以兩項謀殺罪，經過兩日來戴上頭套進行案情重組，昨日遭押解到九龍城裁判法院提堂，首度露出廬山真貌。他暫時毋須答辯，控方表示會聯絡被告寓所附近營業的性工作者，並會追查他是否牽涉其他同類案件。　記者：楊家樂 報稱裝修工人的23歲被告康子賢，昨日戴上頭套，鎖上手銬，由警車押送到法庭，進入法庭範圍後始脫下頭套，進入羈留室等候。直至法庭傳召被告應訊，他在多名庭警看管下步出犯人欄。庭上所見，被告身材高大，樣貌不算俊朗，但外表頗斯文。 一臉倦容　陰聲細氣 經過多日受查後，被告露出一臉倦容，惟表現仍冷靜。他聆聽法庭傳譯員朗讀控罪後，回答「明白」時陰聲細氣，更數番冷眼望向庭上記者。碰巧這宗涉及兩條人命的案件，在法庭的案件編號竟是被稱為魔鬼數字的「666」，有旁聽人士得悉後不禁驚呼「好邪」。  面對謀殺如此嚴重的指控，被告罕有地沒有聘請律師代表，亦拒絕駐庭當值律師協助。署任主任裁判官胡雅文見狀，特意查問他是否不用律師代表，被告只冷冷地表示沒有需要。  控方將安排二手店東主及被告寓所附近營業的性工作者認人。警方亦懷疑被告涉及過去多宗同類案件，一旦調查後發現與被告有關，會即時安排其他案件的證人參與認人手續。案件押後至本月12日再訊，被告繼續還押警方看管。 多人旁聽打探進度 昨日多名市民特意前往法庭旁聽，又向庭警及記者查詢聆訊進度，但未知當中是否包括被告或死者親友。另外兩名疑為探員的人士到庭了解情況，並向主控官解釋調查進度。二人離開法庭時三緘其口，未有回應記者提問。  控方昨於庭上披露警方調查內容，指泰裔性工作者黃愛珊（38歲）於今年1月31日，在其工作的土瓜灣道7號單位遇害，貴重財物被偷去。警方調查發現有人於本月2日，將她的手機出售到二手店，遂根據線索於本月4日前往被告樂華南邨寓所將他拘捕。  被告向警方承認曾用毛巾掩着黃的口部，令她死亡，又承認於今年1月9日至10日期間，在觀塘宜安街致昌大廈單位殺害鳳姐關淑儀（47歲）。驗屍報告指兩名死者均是窒息致死。  案件編號：KCCC666/09
