key,date,article_daily_id,title,text
20090208-131,20090208,131,浪圖盡：初步阻力在14100/14500 - 王逸,浪圖盡：初步阻力在14100/14500 - 王逸 港股於上周現先跌後回升高收，雖然H指已升破50日線，但恒指仍受制於50日線，仍可視作跌破「小雙頂」的後抽反彈。  目前沿用的首選浪段模式仍然有效，即巨浪IV的大浪A中浪（C）低位於10月27日的10676見底後所展現的大浪B中浪（A）反彈已告完結。11月5日高位為中浪（A）小浪a，小浪b以曲折形方式於11月21日的11815見底，12月11日高位15781為小浪c的細浪(5)高位，亦即中浪（A）反彈高位。  隨後的回落為中浪（B）的小浪a調整，低位企於50日線附近，1月7日高位15764為小浪b反彈高位，目前屬小浪c細浪(4)反彈，初步阻力14500/14100，回落目標仍為11815，甚至回試10676低位附近。  次選則可視大浪B中浪（B）小浪c的調整已於1月21日12439見底，目前為中浪（C）的小浪a上升，初步目標為14600/14500。  至於較為偏淡的次選模式，仍視去年10月30日高位31958以來的調整未完，10月27日低位10676只屬巨浪IV大浪A的中浪（C）小浪3低位，隨後回升只是中浪（C）的小浪4反彈。中浪（C）小浪4的運行模式有多種，其一可視15785為小浪4的細浪(a)高位，隨後為細浪(b)微浪a回落，低位為12月24日的13856，1月7日完成細浪(b)微浪b反彈，然後再開展細浪(b)微浪c下跌至1月21日低位12439，目前為細浪(c)回升，目標為15700附近，然後再現回落及爭持，待完成「三角形」整固後才開展中浪（C）小浪5下跌見新低。  次選可視1月23日低位6613為大浪B中浪（B）的小浪C低位，目前為中浪（C）小浪a反彈，目標8400/8100。 H指候8100/8400回吐 H股指數的調整模式相似：  首選仍視10月27日低位4792為巨浪IV大浪A的中浪（C）低位，目前為大浪B反彈，中浪（A）已於12月11日的8669見頂，目前為中浪（B）回落，中浪（B）的細浪(a)低位為12月24日的7420，1月7日高位8774為細浪(b)，目前為中浪（B）的小浪（c）細浪(4)反彈，且已抵達目標區7800/7600，隨後再現下跌，回試6000或去年10月低位4800附近。  較偏淡模式仍視巨浪IV的大浪A的中浪（C）小浪4已經以曲折形方式完成反彈，小浪4的細浪(c)高位為1月7日的8774，隨後開展小浪5下跌，細浪(1)為1月15日的6806，目前仍為細浪(2)反彈，整個小浪5可達3980/4500之間。此外，小浪4亦可以「三角形」模式整固，細浪(a)高位為12月11日的8669，細浪(b)以不規則形回落，於1月23日的6613見底後，目前為細浪(c)反彈，目標為8400，完成整固後，小浪5仍會見新低。  本周策略：兩項指數企穩於假前低位續現反彈，由於H指已升破50日線，恒指亦逼近50日線阻力，若向上突破，仍有力再升，目標分別為恒指14500/14100及H指8400/8100，目前可將止賺/蝕位略為提高至恒指12700，H指7100。  若短期回升到兩項指數前述阻力位，可先行獲利回吐，待回試恒指12700及H指7100，且能守穩高收後，才再行作入市考慮，屆時仍以該水平為止蝕位。  王逸
20090208-132,20090208,132,投資的天空：貸款增加≠經濟向好 - 張士佳,投資的天空：貸款增加≠經濟向好 - 張士佳 溫總以「信心之旅」形容剛剛結束的歐洲多國訪問，溫總自然不忘報「喜」，例如指出內地近月貸款增長迅速，暗示經濟已經逐步復蘇，溫總對此表示相當興奮，大市表現相當「合作」，H股指數升幅更是可人，但筆者細看貸款數據，卻不是太樂觀。  溫總所指，是國內金融機構的人民幣貸款增長，其中貸款在12月增加了7000億人民幣，1月份更誇張，頭20日已有9000億人民幣新增貸款，暗示經濟活動轉趨活躍，難怪溫總亦感到雀躍。不過，筆者觀乎歷史數據，幾乎每年一月份的貸款增長數字均勝過年尾，皆因不少企業集中在年初投入生產，資金往來自然較多，所謂貸款急升，可能只是季節性效應而已。  當然，近萬億元貸款終非小數目，士佳遂將數字拆解，結果發現，新增貸款多集中於短期借貸，當中多數會用於還債，雖然可減少企業周轉不靈而倒閉，但是對資產價格卻未必有刺激作用。另一方面，與政府項目有關的貸款亦佔一定比例，筆者估計，地方政府為響應中央救市方案，大小基建紛紛上馬，亦對新增貸款有刺激作用，不過內地企業經常一窩蜂響應中央政策，結果往往引發產能過剩。若單憑數月數據便斷定經濟好轉，似乎較為武斷。  再者，經濟與股市未必同步，例如01-03年期間，貸款增長數字節節上升，但當時資金幾乎全部投入經濟建設，令同期股市表現乏善足陳。反而另一關鍵因素──利率，與股市關係更加密切，皆因經濟不景氣，政府經常投放大量資源刺激經濟，而把通脹放在一旁，到經濟情況慢慢好轉，央行才會對付通脹，放膽加息，其時股市多數已經見底回升。 大市急升只是挾倉 所以，與其留意貸款變化，不如緊盯着息口去向更為上算，若經濟好轉，央行加息，到時未必只有股票上揚，樓價亦可能上揚。當然，尚要其他因素配合，但現時來看，一切還言之尚早，經濟尚有隱憂，所以，近兩日大市雖仿似氣勢如虹，但筆者未驚過，暫時只以挾倉視之。  不過，小心駛得萬年船，加上美國可能有救市效應（上期因字體潦草，助手誤將港元打成美元），所以筆者亦先避其鋒，做了對冲，若大市掉頭下跌，可能最終會沽低咗，但這些市況，寧願待市況確定，亦絕對不能犯下FatalMistake。  張士佳
20090208-133,20090208,133,投資萍語：短線料繼續挾上 - 熊麗萍,投資萍語：短線料繼續挾上 - 熊麗萍 內地股市於上周一紅盤高開後，幾乎全周5個交易日均展強勢，中資股自然受帶動，H股指數上周漲升8%，只略遜於上證綜合指數10%的升幅。  內地股市上升帶挈中資股造好絕不為奇，但上周五尾市恒指突然抽高，升逾13600點水平實在意外。恒指多次上升至13500點均現阻力，要升穿該水平必須有新消息，但從近期外圍及本港股市走勢來看，同一因素可被用作推高或壓低大市的藉口。  筆者上周於本欄分析時亦指出，現時擺在眼前可成為有心人對大市推波助瀾的理據實在不少，上周五美國公佈一月份失業率上升及職位勁減的利淡數據，卻被演繹為利好消息，認為這些壞數據可迫使參議院通過刺激經濟方案，令道指急升逾200點，連串的似是而非因素，使筆者一時間對於「理性分析」有點慨嘆。  話雖如此，但當這些炒作過後，市場始終也會返回基本因素，近日升市仍只能視作反彈，中長線投資策略絕不宜過份情緒化或被短期市況波動所影響。但短線而言，恒指既已突破13600點，短期再以落後股份挾高的機會仍高。本地地產股如長實（001）、信置（083）及恒隆地產（101），另外，一向波幅較大的富士康（2038），甚至出口股利豐（494）及裕元（551）亦大有機會短線追上。 提高警覺隨時落車 中資股亦同樣利用藉口將落後股份推高。因此，大家在追捧中資股時亦應有更高的警覺性，掌握落車時間。從近期政府推出行業刺激措施來看，一旦政策曝光，股價即時回吐，未能及時落車者，需因應個別股份實力及真正受惠程度，決定應否繼續持有。  上周建議持有的中海石油化學（3983）也明顯出現趁好消息出貨現象，但以質素而言，暫可靜待回升。機械設備股當中，哈爾濱動力（1133）則具持有價值，但筆者對紡織股則並不看好。  除了行業政策之外，若內地股市再升，市場甚至可能以A、H股差價作為炒作，筆者並非鼓勵大家採用賭博心態，但一向H股較A股折讓較小，甚或有溢價的股份，近期折讓幅度擴大，例如中鐵建（1186）、中興通訊（763），由於這些股份有基本因素支持，可作為「進可攻、退可守」之選。    熊麗萍　滙業財經集團證券部主管  作者目前持有中鐵建（1186）。
20090208-134,20090208,134,基本攻略：以50日線定好淡 - 姚浩然,基本攻略：以50日線定好淡 - 姚浩然 市場憧憬振興規劃上台，內地股市在牛年首個星期「送熊迎牛」，上證綜合指數逼近2200點，深證成份指數升穿7700點大關，升至近4個月新高，兩地股市成交額上周五增至超過1800億元人民幣；加上澳洲及日本等國紛紛推出新救市措施，帶領港股恒指重上萬三點關口。不過，港府上周一公佈上季負資產數目急升逾3倍，市場憂慮樓市前景暗淡，利淡地產股表現。受利淡利好因素互相影響，究竟港股能否重上50日線，還是回試10日線呢？  中國物流與採購聯合會於上周三公佈，內地1月份製造業採購經理指數（PMI）顯著回升至45.3%，數據遠勝預期。筆者認為，製造業PMI雖仍低於盛衰分界線，但連續兩月持續顯著反彈，可反映工業生產有復蘇狀況。  除經濟數據理想外，市場亦關注中央推出振興規劃事宜，上周三國務院審議並原則通過紡織及裝備製造產業振興規劃，鼓勵企業實行兼併重組，並決定紡織服裝出口退稅率調高至15%，改善紡織業外需放緩的問題。此外，溫家寶言論中表示，1月份首20天，銀行新增貸款達9000億元人民幣，市場揣測今年1月份新增信貸規模有望突破1.2億元人民幣，中資銀行股因而受市場追捧。滬綜指亦因而突破去年12月高位阻力，技術走勢向好，短期內仍可望保持強勢。  不過，建議投資者不宜過份樂觀，從近況分析，筆者認為內地經濟快速下滑之勢雖有喘定迹象，但受環球金融危機打擊，內地上半年經濟會否維持合理增長仍是未知之數。 平保等35元吸納 此外，本周內地將公佈多項經濟數據，當中以1月份外貿易差最為市場關注，如外貿持續出現負增長，或會成為推低大市的藉口。  港股目前以中資股為主導，市場一旦傳出相關政策消息，有關股份異動將影響港股去向，故投資者應留意中央出台振興規劃去向。滬深兩市成交額急增，投資氣氛漸入佳境，但目前上海股市09預測PE接近15倍，深圳股市09預測PE達16倍，相對主要發達國家及新興市場為高，不排除滬綜指於2300點附近會出現阻力，投資者應注意高位將有回吐風險，不宜高追。筆者預料，恒指將於10日線及50日線之間徘徊，建議投資者可以50日線作為短線阻力位指標，如上穿該指標，可視作走勢轉強的訊號，或可再試100日線阻力位，屆時短線投資者可考慮先行食糊沽貨套利。  平安保險（2318）提供多元化金融服務及產品。平保於08年度四類保費收入達1291.193億元人民幣，同比增長28.1%；其人壽保費收入為1011.77億元人民幣及財產保費收入為267.51億元人民幣。此外，平保投資在富通所產生的負面因素已反映在股價身上；反觀，內地A股巿場回升，相信其投資收益於09年將恢復穩健水平，將吸引投資者重新留意這隻股份，可考慮待股價回落至35元吸納，中線目標42元，止蝕32元。    時富資產管理聯席董事　姚浩然  作者的客戶目前持有平安保險（2318）。
20090208-135,20090208,135,讀者信箱：鞍鋼守穩7.70元續向好,讀者信箱：鞍鋼守穩7.70元續向好 讀者許先生問：本人以19元買入東方海外（316）、7元買入鞍鋼（347）、0.80元買入美維控股（3313）、17.90元買入九倉（004），請問上述4股應持長線還是短炒？止賺及止蝕位在那個價位？  覆讀者許先生：東方海外上日升3.3%，重上20元之上，報收20.30元，現價計，閣下有微利，短線阻力位在21元。大市氣氛好轉，股價有機上試該阻力，但該阻力位需有大成交方可望突破，遇阻回落宜先行獲利，破位可以25元作目標，逐步推高止賺位便可。  鞍鋼上日逆市下跌0.5%，報收8.44元，由於之前連升多日，上日可視作技術調整，守穩7.70元，無礙股價向上之走勢，可考慮以7.60元作計數位繼續持有，股價向上若未能突破8.80元，可先行獲利，破位則以9.30至9.50元作目標。 一拖1.92元有阻力 美維上日平收68仙，股價仍處低位，成交稀疏，70至80仙之間有多個阻力位，「蟹貨」多，暫難開展升浪，宜考慮伺機沽出換馬。  九倉上日收17.96元，上升1.69%，股價暫受制於18至19元阻力區，技術形態偏淡，不宜過份期望，現價與閣下之買入價相若，可考慮沽出計數。  讀者洪先生問：本人以2元買入第一拖拉機（038）、2.40元買入中渝置地（1224），請問兩股的投資策略如何？  覆讀者洪先生：一拖上日收1.86元，升2.7%，股價處於反彈後的整固階段，1.70至1.73元有頗強支持，1.92元則阻力相當大，若上試1.92元不破，宜先行沽出，候低補回。股價上破1.92元，看2.10元。  中渝上日收1.93元，大成交破10日線，短線上試2.13元，破位看2.36元，暫以1.85元作止蝕持有。  （歡迎查詢有關投資事宜，來信請寄將軍澳將軍澳工業邨駿盈街8號一樓《蘋果日報》或傳真23703886投資版編輯收）
20090208-136,20090208,136,IMF籲全球重組銀行體系,IMF籲全球重組銀行體系 【本報綜合報道】國際貨幣基金組織（IMF）總幹事卡恩警告，全球先進國家已「陷入蕭條」，除非各國重組銀行體系，否則金融危機可能惡化。他呼籲各國準備「全面」干預銀行體系，並迅速將無力還債的銀行出售或關閉，以免金融危機蔓延。  卡恩在東南亞出席一個中央銀行家會議時表示，全球金融危機可能尚未度過最壞時刻，除非各國致力重整銀行體系，以恢復市場對銀行體系的信心，否則各國的振興經濟措施難以令全球經濟擺脫衰退。 加企月炒13萬人歷來最多 卡恩說，美國總統奧巴馬的7800億美元（約6.1萬億港元）振興經濟方案，其規模和細節均適當。歐洲方面，雖然歐洲央行或會進一步減息，但卡恩指此舉可能不及重組銀行體系般重要。他續稱，儘管亞洲多國已合共推出逾6850億美元的刺激經濟措施，但仍有空間推出更多振興方案。  隨着金融海嘯蔓延，美國三家銀行上周五遭監管機構接管，包括位於加州的County銀行和Alliance銀行，以及喬治亞州的銀行FirstBankFinancialServices，令美國今年被接管的銀行增至九家。  其他國家亦受金融危機打擊，加拿大企業上月共裁員12.9萬人，是歷來最多。  另一邊廂，信貸研究機構鄧白氏（Dun&Bradstreet）調查指，隨着融資成本上漲和銷情放緩，預料澳洲今年會有逾10萬家中小企倒閉。
20090208-137,20090208,137,一周好介紹,一周好介紹 作者鄧建初、曾永堅、彭偉新、連敬涵及蘇顯邦均為證監會持牌人士。 291華潤創業　收市：11.26元 最傳統之老牌紅籌綜合企業股，業務多元化，屬於進可攻、退可守之優質實力股。未來有分拆旗下子公司概念可供炒作，短線投機或中線投資皆可列入吸納對象。中期業績雖倒退52%至21.59億元，但現水平已反映不利因素。建議可於現價吸納，短線目標可見12.50元，跌穿10.70元止蝕。 3988中國銀行　收市：2.18元 去年在人民幣公司貸款市場提高市場佔有率0.6個百分點，全年錄得新增人民幣公司貸款2626億元人民幣。受惠於去年11月份開始國內新增貸款全面回升，同時可望成功爭取較低風險的基礎設施項目和大型企業貸款市場佔有率。策略投資者套現後，短線下跌風險有限。可於2.10元吸納，上望2.40元，破1.85元止蝕。 658中國高速傳動　收市：10.20元 於國內從事機械傳動設備之研究、設計、開發、製造及分銷業務，中央持續鼓勵發展風力發電市場，國家能源領導小組辦公室預期，在2007至2010年的發電容量年複合增長率為49%，將為集團在期內的銷售及盈利帶來雙位數增長，商品價格低迷和產品種類提升，將令集團毛利率上升，建議9.20元吸納，目標14.50元。 762聯通　收市：7.35元 上月發盈喜，指受惠於出售CDMA業務及資產而錄得一次性收益入賬。雖然其推出內地3G服務時間相較對手為慢，不過其網絡制式已經成熟，手機配套及增值服務支援亦會較多，可從後趕上。股價在多年低位徘徊超過一周後，上周五呈突破，料近期中資股表現轉佳下，應有力再向上，建議7.30元買入，目標8.20元，穿7元止蝕。 1093中國製藥　收市：2.56元 由於內地去年已正式通過了醫療改革，令到今年內地醫療用品及藥品開支會大幅增加，而中國製藥主要的產品除了維生素C外，亦有部份青霉素抗生素、頭孢菌素抗生素等產品，預期內地在醫療用品的開支會大幅增加下，對中國製藥的前景會有利好的推動作用。建議投資者在2.50元附近買入，上望3元，如跌穿2.20元則沽出止蝕。
20090208-138,20090208,138,投資名言：金價短期整固宜候低吸 - 張敏華,投資名言：金價短期整固宜候低吸 - 張敏華 去年金融風暴浪潮席捲全球，拖累資產價格拾級而下，在主要資產類別中只有美國國庫債券及黃金錄得正回報，成為投資者的綠洲。隨着聯儲局減息到零至0.25厘水平，加上國庫券孳息率處於歷史低水平，近期市場焦點傾向聚焦於黃金投資上。不過，近日金價從高位有所回落，顯示金價於高位遇上阻力，投資者傾向先行獲利。 早前現貨金價曾升至接近每盎斯930美元水平，主要受惠於資金流向。由於黃金被視為資金避風港，每當金融市場不穩，金價往往受惠。事實上，從黃金期貨淨長倉合約數目或交易所買賣基金的持金量可見，資金已重投黃金懷抱，推升近期金價造好。以期貨市場為例，雖然金融風暴導致「去槓桿化」趨勢，加上美滙顯著上升，令去年下半年黃金長倉合約數目大減，但近日隨着長倉增加而短倉減少，「淨長倉」已見回升（圖），顯示金融市場持續反覆波動，投資者看好黃金，資金重新流入黃金期貨市場。  要分析金價後市，可從投資需求及實際需求入手。從早前各地公佈的第四季經濟增長數據可見，環球經濟放緩的程度或較預期嚴重，促使花旗分析員下調全球經濟增長預測至負0.7%。經濟衰退深化，避險情緒自然揮之不去。近期美元、日圓走勢持續偏強，反映美股波動性的VIX指數亦有所回升，都印證投資者仍然如履薄冰，信心並未回復。礙於實體經濟受創已深，料難以出現V形復蘇，市場的避險心態有機會持續高企，增加黃金作為資金避風港的投資需求。此外，黃金亦可發揮另類投資的作用，對冲貨幣貶值的潛在風險，有機會吸引資金流入金市，支持金價向好。 可對冲貨幣貶值風險 但短期金價或會受實金需求疲弱拖累。以全球最大黃金消費國印度為例，近月當地黃金進口持續下跌。數據顯示印度1月份黃金進口量只有1.2噸，較去年同期急跌90%。實金需求疲弱局限金價表現。  花旗分析員認為，黃金產量持續下降，以及新興市場（特別是來自中國及印度等國家）對黃金的中長期需求有望回升，配合投資需求增加，都對金價表現帶來正面幫助。惟近日金價升幅主要由投資需求帶動，欠缺實際需求支持，加上美元滙價或通縮風險可能上升，都有機會拖累短期金價進入整固期，促使花旗分析員下調今明兩年平均金價預測至每盎斯825美元及900美元。因此，雖然我們認為黃金是其中一項投資前景較佳的商品類別，但由於金價已由去年11月低位回升超過25%，短期升勢或受一定限制，現時黃金投資的回報與風險比率可能並不吸引。  看好黃金後市的投資者可考慮候低吸納，當金價作出調整時才伺機入市，增持相關基金，亦可利用「平均成本法」分段買入，以減低投資風險。但投資者須注意黃金基金多投資於金礦股，而非實金或黃金期貨合約上，導致基金表現未必完全反映金價走勢，同時會受其他因素，包括環球投資氣氛及股市表現等因素所影響。    張敏華  投資策略及研究部主管Citibank環球個人銀行服務
20090208-139,20090208,139,萊德有理：預期09年第二季度見底？ - 貝萊德,萊德有理：預期09年第二季度見底？ - 貝萊德 自金融危機於去年10月爆發開始，環球股市反覆下挫，恒生指數截至2月4日，跌至13063點，標準普爾500指數為838.51點。根據美林證券於一月中旬時發表的研究顯示，全球經濟活動在去年12月顯著下跌，現在更處於1991年相若的水平。投資者自然會問，現時是否入市的好時機？市場調整是否開始見底？首先貝萊德是相信目前估值已處於非常合理的水平，不過歷史卻告訴大家，試圖捕捉市況往往得不償失。  貝萊德嘗試列舉數據以作說明，假設投資者於1997年時把10000元投資於股市，為期10年。情況一：投資者選擇保持投資，到2007年時，他可取得17758元（或5.91%的回報）。情況二：投資者試圖預測市場走勢而投資，但錯過了這期間回報最高的5天，到2007年時，他只取回13782元（或3.26%的回報）。最差的情況是投資者錯過了這期間回報最高的30天，到2007年時，他只取回5587元（或-5.66%的回報）（參考附圖）。這個例子告訴我們，投資者從採取保持投資策略所取得的回報，比嘗試預測市場走勢而投資所得的回報更好。 孳息曲線可作預測 不過，投資者最終還是會問，市場是否已見底？根據美林證券報告，歷史告訴大家孳息曲線的走勢可用作反映市場波幅及盈利增長的預測，但通常有約兩年時間的滯後表現。報告結果表示轉捩點在2007年第二季度，代表預期市場將在2009年第二季度開始回升。當然，該報告也強調結果並沒有明確的信號指示，並預計市場仍存在變化。  無可否認，究竟市場是否已觸底或後市走勢預測如何？仍然眾說紛紜。此外，預測市場走勢需要做專業的研究，並非一般投資者容易做到。萬一預計失準，投資者有機會損失大部份資金。因此我們建議投資者可投資於基金，讓基金經理的專業知識和對市場敏銳的觸覺，按市場前景作出投資。 較看好能源黃金基金 此刻讀者可能會問：「目前的整體市況仍然反覆，究竟應該投資於那一個資產類別？」按照我們剛才解釋，由於各個市場的大勢走向還未明確，我們建議投資者可以選擇投資於環球市場和各資產類別的混合基金，通常這些混合基金都集合了股票、債券與現金管理，基金經理可透過靈活管理的方式，因應市場變化而彈性調整投資組合。此外，如基金的投資範疇能覆蓋全球，更可進一步分散風險，所以特別適合於波動市況。  至於個別投資者如能夠承受較高風險，並尋求較佳回報，我們建議他們可考慮於他們的組合加入能源基金和黃金基金，這兩個行業均是我們今年較為看好的行業，稍後兩期，貝萊德將跟大家進一步探討能源及黃金市場的走勢。    BLACKROCK貝萊德
