key,date,article_daily_id,title,text
20090904-0,20090904,0,港大醫學院前院長　侵吞400萬林兆鑫囚25月,"港大醫學院前院長　侵吞400萬 林兆鑫囚25月 【本報訊】香港大學醫學院前院長、國際腸胃專科權威林兆鑫，03至07年間侵吞港大捐獻及病人診金共400萬元。區域法院法官李瀚良昨判刑時嚴斥，身為港大醫學院院長的林兆鑫應有更高尚的誠信，惟其行為違反病人、港大醫學院及醫院管理局對他的信任，將涉款作學術用途的解釋實難以令人信服，考慮到林兆鑫過去對醫學界的貢獻，酌量減刑，就他承認一項公職人員行為失當罪，判即時入獄25個月。　記者：陳詠詩 港大醫學院回應表示，尊重法庭判決，並指07年已成立專責小組，全面檢討港大臨床部門私家診症服務收費及安排。 六年為醫學院籌14億元 現年66歲的林兆鑫，本周二認罪後，繼續准以30萬元保釋外出，至昨午2時30分判刑；林牽着妻子陳詠琦提早一小時抵達法院。林在庭上聆聽判詞時一臉嚴肅，面容崩緊，當法官宣讀刑期後，他一度垂低頭，表現失落。 法官判刑時提到，林兆鑫67年在港大醫學院畢業後，一直努力；01年成為港大醫學院院長，在任六年以來，為醫學院籌得14億元捐款。法官確認林過去的品格卓越，履行不同公職，學術上的成就得到國際間肯定，是腸胃專科權威。林在腸胃科的研究對治療及預防十二指腸潰瘍及胃癌帶來深遠影響。法官相信林是一個真誠及有愛心的醫生，案中涉及的病人並沒有因此得不到恰當的治療或蒙受金錢損失。 根據辯方求情指出，林兆鑫因為本案已身敗名裂，緊隨本案判刑後，仍須面對紀律聆訊。法官表示，林兆鑫身為港大醫學院院長，應有更高尚的誠信，惟林的行為違反病人、港大醫學院及醫管局的信任。 聲稱款項用作學術研究 本案源於林的病人郭石開收到兩張分別由醫管局及林的公司開發的賬單，向醫管局查問下而揭發事件。案情顯示，侵吞事件已持續多年，林將金錢據為己用，又利用醫學院及瑪麗醫院的信紙誤導病人及捐款人。當林接受內部調查時，又游說郭更改投訴，以圖掩飾事件；法官認為有關情節嚴重。 辯方求情時曾指，林將侵吞的款項用作學術研究，與學者或捐款人交流聯誼之用，他只是靈活運用款項。不過，法官認為案件涉款巨大，有關說法難以令人信服，林也沒有進一步解釋。 法官認為公職人員行為失當罪屬嚴重罪行，必須判監；並援引案例指，牽涉違反誠信及盜款500萬至1,500萬元的案件，判刑起點應為五至十年，案中林侵吞共400萬元款項，故以五年作量刑起點。 法官考慮林認罪，已償還侵吞的400萬元予港大及醫管局，加上過去良好品格，扣減共35個月，判林入獄25個月。法官表明，已考慮其個人背景及案件所負刑責，沒有特殊因素可予緩刑。 案發於03年9月至07年1月間，林兆鑫身為港大臨床教職員，在瑪麗醫院診治私家症時，要求12名病人將診金存入其持有的GastrointestinalResearch（簡稱GR）銀行戶口。至06年7月，郭姓病人繳付內窺鏡檢查診金後，再被要求付款，引起院方內部調查。 欺詐及盜竊罪不予起訴 林隨後約郭見面，要求郭將已付診金改為予港大的捐款，林又自掏腰包，借郭的名義捐款給港大，兩方最後簽署文件同意以上安排。廉署調查再發現，被告曾要求三名病人及家屬，將合共380萬元捐款存進GR銀行戶口。林從沒有向港大申報與GR關係及利益。林獲控方接納承認一項控罪，餘下的33項包括欺詐及盜竊罪則不予起訴。 案件編號：DCCC440/08 林兆鑫簡歷 年齡：66歲 家庭：妻陳詠琦，有三子女，大女為醫生，次子為工程師，幼女為大律師 履歷： 1967年　港大內外全科醫學士 1969年　港大醫學院執教 1975年　港大醫學博士 1980年　瑪麗醫院顧問醫生 1981年　港大腸胃研究所主任 2001年　港大醫學院院長 榮譽： 1997年　榮獲OBE勳章 2002年　獲頒Bockus獎章 2003年　中國科學院院士候選人 2005年　港大明德教授教席 資料來源：《蘋果》資料室"
20090904-1,20090904,1,通波仔後兩周　竹戰男猝死醫生：手術後一個月不應受刺激,通波仔後兩周　竹戰男猝死 醫生：手術後一個月不應受刺激 【本報訊】一名男子兩周前才做完「通波仔」心臟手術，昨凌晨與朋友在油麻地一間聯誼會打麻雀消遣期間疑病發，突然暈倒，經送院搶救後終告不治。心臟科醫生表示，病者即使曾做通波仔手術，但不代表「以後乜事都冇」，手術後一個月內更不應做劇烈運動或受刺激，一旦身體不適要立即求醫，以免錯過搶救的黃金四小時。 突心絞痛不適 猝死56歲男子姓周，居於深水埗汝州街。據悉，周患有冠心病，兩周前剛做了俗稱通波仔的冠狀動脈導管介入手術，身體仍在復元中。前晚他一時技癢，與多名男女友人相約到油麻地白加士街120號3樓一間聯誼會竹戰。據悉周開枱不久後，突然感到心絞痛不適，於是請一名友人「頂上」，而他則坐到一旁休息及觀戰。 至昨凌晨2時許，周突然感到胸口楚痛，以一手按胸狀甚痛楚，繼而倒地昏迷不醒，雀友們見狀大驚，將他扶起後致電報警，救護員到場替他急救，當時他已全無反應，經送院搶救，延至凌晨3時33分終返魂乏術，雀友們得知他突然離世均感欷歔。 心臟科專科醫生何鴻光解釋，如病者所患的冠心病較嚴重，加上年屆50多歲，通波仔未必能一次過完全解決所有心臟問題，手術只能協助病者改善血液循環，萬一血管閉塞亦不會即時死亡。他說，不少人「以為通波仔以後乜事都冇」，事實上手術只是放入支架擴闊收窄的血管，以協助血液循環，並不代表其他有膽固醇積聚的血管「冇事」，一旦病者緊張受刺激，膽固醇斑塊破裂，便會引致血管栓塞。 不舒服應求醫 何鴻光指通波仔手術一般很安全，只有1%的危險性，手術後24小時最關鍵。他說，通常放入支架後傷口至少一個月才癒合，這個月內病者雖可如常走動，但要避免劇烈運動及受刺激，並要按時服食兩種抗血小板藥物，若有不適立即求醫，「好似今次打麻雀嘅男事主，佢覺得一唔舒服，應該立即睇醫生，千祈唔好等，因為出事後黃金四小時最重要。」一名64歲老翁今年6月便在通波仔一日後，便到西貢清水灣二灘游泳，結果病發遇溺死亡。 通波仔手術後打麻雀男子猝死示意圖
20090904-2,20090904,2,校園驗毒資料不交警方政府修訂建議　教評會：破綻仍多應撤回,校園驗毒資料不交警方 政府修訂建議　教評會：破綻仍多應撤回 【本報訊】特首曾蔭權一聲令下，指示必須在今年底推行的大埔區校園驗毒試行計劃，漏洞處處，備受各方批評，政府終於肯刪除將吸毒學生資料轉交警方的建議。不過，這個學生有權不參與的驗毒計劃，經修訂後被指更加支離破碎，「有好多破綻，左手打右手。」 記者：倪清江　夏志禮 立法會將於下周二討論校園驗毒計劃，保安局和教育局昨向立法會提交的文件顯示，方案修訂後，學校會要求家長和學生簽署參與計劃同意書，而不是只取家長簽署；然後由一男一女護士、兩名社工和一名資料管理員組成的驗毒小組，不定期到大埔區的中學，隨機抽選5%自願參與的學生驗毒。 旨在預防學生吸毒 初步計劃列明，驗毒結果將通知校長、學校社工、班主任和家長；學校警方聯絡主任也會知悉結果，令外界擔心吸毒學生會被警方盤問供出毒品來源和指證他人。當局終認衰，修訂計劃，取消向警方提供驗毒計劃下的毒學生個人資料，警方也不會採取跟進行動。 政府消息人士承認，在港吸毒已屬違法，但目前律政司會視乎每個個案情況而決定是否檢控，不向警方舉報並非給予毒學生「免死金牌」，試驗計劃旨在預防學生吸毒，並且協助吸毒學生戒毒，吸毒學生不會被控以吸毒罪名和開除學籍。 當局指保密學生曾經吸毒的資料十分重要，除了獲當事人同意的人士可知悉外，不會洩露予他人。 消息指出，大埔區23所中學都沒有表示不參與驗毒計劃，包括屬天主教的恩主教書院。天主教香港教區早前對驗毒計劃有保留，昨日則不評論政府的修訂建議。 計劃已變政治問題 立法會議員黃成智認為，驗毒計劃並非解決青少年吸毒問題的主要方法，「計劃已經慢慢變成眾多抗毒計劃中嘅一個服務，可有可無，如果配套設施唔夠嘅話，更加係毫無作用。」他指計劃已經變成政治問題，「理解特首有壓力要推行，試行過程當中發現有問題，就要即刻叫停。」 教育評議會副主席何漢權要求當局撤回，再諮詢後才推行，促請當局按照律政司司長黃仁龍最初建議，在明年新學年才試行。他指這個急就章的計劃，「有好多破綻，左手打右手。」 青年聯社召集人江貴生指，計劃經修訂後仍難改其本質，堅決要求政府撤回方案。他表示，若11月政府如期向家長派發同意書，他們會有抗爭行動。 大埔區中學校長會和大埔區家長教師會指修訂可釋除學生及家長的疑慮。立法會教育界議員張文光認為，方案修訂後會較易讓學生及家長接受，私隱保障亦較之前好。善明會的調查發現，502名受訪家長中，78%支持驗毒計劃，但有個別家長仍認為驗毒計劃漏洞太多，無法阻止學生吸毒。
20090904-3,20090904,3,販毒學生不自首會被舉報,販毒學生不自首會被舉報 【本報訊】當局承諾不會將被驗出吸毒的學生資料交予警方，但若在社工或教師輔導期間，學生承認有販賣分拆毒品，由於罪行嚴重，如不主動自首，社工或教師可能向警方舉報。 當有學生被驗出吸毒，校長會首先獲知會，然後通知學校社工或其班主任，再通報家長，以協助他們戒毒。 政府消息人士表示，當局不會包庇販毒的學生，學校可視乎嚴重性決定如何處理。按現時做法，若社工輔導吸毒的學生期間，他們承認販毒，「例如身邊有毒，或賣剩幾包」，不會為他們隱瞞，社工專業守則列明可先勸喻他們向警方自首，否則可作出舉報。 有權「縮沙」 當局擬在12月推行大埔區驗毒計劃，家長如不簽署同意子女參與驗毒，消息人士表示，校方需派人了解原因，「但唔會煩到佢哋屈服，我哋冇數要交。」這份同意書在推行的學年內有效，其間也可隨時撤銷。 同意驗毒的學生，在被抽中要求提供尿液樣本後也有權「縮沙」，不過會被懷疑有問題，護士先會詢問他們是否有身體不適，之後再交學校社工或班主任跟進。
20090904-4,20090904,4,教家長驗毒小冊子靠估成績轉差　爛牙便秘　視為表徵,教家長驗毒小冊子靠估 成績轉差　爛牙便秘　視為表徵 【記者雷子樂報道】如果你的孩子出現學業轉差、衣服有異味、獨留房中等任何一項迹象，很抱歉，根據一份由政府禁毒基金資助的吸毒危機測試表分析，他「可能已經有吸毒行為」。大埔區內部份中學生，近日都收到這份由東華三院及香港大學學者製作的小冊子，全港的中學生將陸續收到這份「開學禮物」。有學生直斥該評估誤導、靠害，內容極度荒謬，人人也會被評為癮君子。 指「爛牙便秘」太武斷 這份名為《無毒家教有妙法》的小冊子共有8頁，其中一頁是吸毒危機測試表，按行為、身體狀況、個人物品、情緒及生活習慣、社交等分類，列出25項危機表徵，供家長根據子女近況作評估，只要發現任何1至8項，就會評為可能已有吸毒行為，毒品已影響日常生活。如有9至15項徵狀，更被視為對毒品已有一定程度依賴，家長要鼓勵子女接受治療。 在大埔區讀中五的陳同學收到小冊子後相當不滿，電郵本報逐點反駁。例如「學業表現轉差」可能是科目越來越難；鼻敏感、傷風都會「常流鼻水」；「衣服有異味」，炎炎夏日很常見；「情緒不穩定」、「與朋友聯絡表現神秘」等表徵是青春期的常態。「爛牙、便秘、腹瀉」則更加武斷，「爛牙都係，咁不知有幾多小學生吸毒啦！少食菜都會便秘」。 青年聯社召集人江貴生批評問卷設計誇張、嚴重簡化，易引起親子間無謂的猜疑。立法會社福界議員張國柱說，業內人士會明白相關用字，但對普通家長或會「有少少驚嚇」，認為應詳加說明。禁毒常務委員會主席石丹理表示，問卷的評分機制「可能粗糙咗啲」，但許多都是吸毒的早期徵兆，如擁有改裝飲品樽、渴睡睡足一至兩天等，況且1至8分只是「有可能」有吸毒，有助提醒家長多關心子女。 製作單位：對象是家長 負責該套危機測試及家長禁毒教材套的東華三院越峰成長中心主任鍾燕婷回覆本報查詢時表示，該宣傳單張對象是家長，吸毒危機測試只是初步評估工具，子女出現當中表徵並不代表必然有吸毒，家長須諮詢社工意見。單張及整個「家長禁毒資源套」計劃由禁毒基金資助，總撥款額為93萬元，製作過程參考了外國文獻、禁毒處、教育局資料，並向社工、老師、警察、家長教師會諮詢。 吸毒危機測試內容（節錄） 有否出現以下表徵 行為：學業轉差/自言自語/常苛索金錢/認識吸毒朋友/開始口吃 身體：尿頻/常流鼻水、鼻血/尿道發炎/有不明瘡疤/爛牙、便秘、腹瀉 個人物品：有錫紙、飲管/有不明來歷藥物、煙管/藥袋內有藥物/衣服有異味 情緒及生活習慣：數小時內不斷飲大量清水或凍飲/改變進食習慣/情緒不穩定/感疲倦、恍惚/記憶力衰退/渴睡（睡足一至兩天） 社交：長時間流連在外/與朋友聯絡表現神秘/獨留房中/落disco/借錢說不出理由 出現表徵：0個 分析：子女沒吸毒迹象 出現表徵：1-8個 分析：可能已有吸毒行為，毒品已影響日常生活 出現表徵：9-15個 分析：對毒品已有一定程度依賴 出現表徵：16-25個 分析：吸毒情況十分嚴重，可能明顯吊癮，情況危險 資料來源：《無毒家教有妙法》
20090904-5,20090904,5,特稿議員試評估　被列或吸毒,特稿 議員試評估　被列或吸毒 「渴睡？中咗」、「情緒不穩？我起伏好大o架」、「改變飲食習慣？早排有減肥！」《無毒家教有妙法》小冊子的吸毒危機測試，「揭發」了發動罷驗校園驗毒計劃的江貴生，原來「可能對毒品已有一定程度之依賴，身體可能出現吊癮症狀」。立法會社福界議員張國柱，也因為「年紀大，有尿頻；唔夠瞓有渴睡」，被列為「可能有吸毒」。測試結果人人「中招」，永不落空。 「我梗係冇吸毒啦！」江貴生笑說：「我咁都衰咗十幾樣，好彩我同屋企關係唔差，否則真係唔敢畀阿媽睇。」他認為，疑心重的家長，一旦填寫問卷，「青年人都幾麻煩」。張國柱也最少取得3分，他說對結果一笑置之，建議家長應多關心子女，「好似衣服有異味，洗多啲衫囉；爛牙就帶小朋友去睇醫生」。 本報記者
20090904-6,20090904,6,新世紀疫症豬流感昨再添一亡魂,"新世紀疫症 豬流感昨再添一亡魂 【本報訊】自5月1日出現首宗豬流感個案後，本港疫潮短短四個月內急速擴散，昨日再多一名患者不治，是連續第五日錄得死亡個案，累積至今共10人死亡。本港昨日錄得492宗新增感染個案，創單日新高，截至昨日共錄得12,948宗感染個案。 一名55歲曾患鼻咽癌的男病人上月30日出現流感症狀，到屯門醫院急症室求診，其後入住隔離病房，同日病情轉差轉送深切治療部。他同時服用特敏福、樂感清和抗生素，並依賴呼吸儀器維生，惟延至昨午宣告不治。院方已準備將個案轉交死因裁判官跟進。 威院一女病人危殆 目前仍有111名病人需留院接受治療，其中94人情況穩定，7人嚴重及10人危殆。昨日新增一宗危殆個案是威爾斯親王醫院一名52歲女病人，她昨因流感症狀到威院急症室求診，但情況轉差被送深切治療部，現服特敏福並使用儀器幫助呼吸，院方正密切監察其情況。 甲型H3流感亦繼續肆虐，一名患長期病的94歲女病人上月28日因發燒入住東區醫院，其後確診甲型H3流感，本周二病逝。另一名75歲患長期疾病的男病人，8月23日出現流感症狀入住聯合醫院，翌日確診患甲型H3流感，昨日不治。 深水埗英華書院全體中一生現時正因豬流感而停課，校長李志華表示，會繼續按衞生署發出的指引清潔及做好防疫措施，「始終我哋唔係專家，唔可能睇住確診人數而自決要唔要停課，所以我哋會繼續同衞生署保持密切聯絡，今次爆發其實都係一次好嘅經驗。」他又指，不擔心本學期進度會受豬流感影響。 中國獲批生產疫苗 此外，中國獲批准生產全球首隻豬流感疫苗，北京科興生物製品有限公司獲國家食品藥品監管局批准生產。臨床結果顯示，兒童、少年和成人三個年齡組別人士接種疫苗21日後，有效保護率由81.4%至98%不等，達國際要求70%。疫苗只須打一針，適用於3至60歲人士。疫苗面世後會交由國家分派，為高危組別接種。"
20090904-7,20090904,7,李國能言論惹「組班」疑慮法律界：如法官係同一個團隊　咁上訴都冇用,李國能言論惹「組班」疑慮 法律界：如法官係同一個團隊　咁上訴都冇用 【本報訊】終審法院首席法官李國能前日宣佈提早退休，表明希望由其繼任人決定終審法院及高院法官接班人選的言論，昨日引起法律界議論紛紛。有資深法律界人士質疑，李國能的說法等於叫首席法官自組班底，將破壞法官任命制度的獨立性，出現「一朝天子一朝人」局面，可能損害香港法治精神。 記者：莫劍弦 李國能前日公開解釋提早退休的決定時說，其中一個原因是希望司法機構繼任事宜，可以有更順利安排，因為2011年至2014年終審法院及高等法院都有多位法官踏入退休年齡。李國能認為，這些法官繼任人不應由一名與他們同期退休的人做決定，由新的終審法院首席法官作出安排會較為合適。 不過，李國能的說法引起不少法律界人士質疑。大律師公會前主席、公民黨立法會議員湯家驊昨日在網誌撰文，指李國能的言論等同說叫其繼任人自組法官團隊，令人十分震驚。 質疑「一朝天子一朝人」 湯家驊指這種做法令人覺得司法體系也搞「一朝天子一朝人」，對強化司法獨立沒有幫助，因為法官的替換應該獨立於行政機關、甚至首席法官的個人喜好之外，由首席法官繼任人「自組團隊」說法，令人不能接受。 湯強調「法官人選應由業界公認為獨立有才之士出任，而非由首席大法官組織班底。」任何宣揚個人組班想法，都是不尊重司法制度，更可能損害法治精神。 本是律師的民主黨主席何俊仁也說覺得有問題，因為每名法官的任命都是一個專業而獨立的決定，法官各自獨立地工作，只須跟從司法機構指引行事，不存在要得首席法官認同，或要他們支持首席法官任何決定，更不應該有所謂由首席法官自組「班底」的情形。 李國能有需要解釋清楚 何俊仁認為，就算李國能退休前，為終審法院及高等法院法官繼任人選作決定，日後李國能的繼任人不應因為他們是由李國能選拔的人，而認為合作出現問題，因為這正是司法獨立、法官工作不受其他人影響的關鍵。他認為李國能有需要解釋清楚其言論的真正意思。 另一名資深法律界人士也質疑，若真的由首席法官搞「班底」，大家是同一個「團隊」，法官將會失去判案的獨立性，「到時下級法院法官，同上級法院法官係同一個團隊，咁仲點向上級法院上訴？假如法官係同一個團隊，對法律問題有睇法相同，咁上訴都冇用！」
20090904-8,20090904,8,議員倡候選人到立會答問,議員倡候選人到立會答問 【本報訊】終審法院首席法官李國能的繼任人選成為司法界最熱門議題。李國能昨天回到終審法院工作時，拒評繼任人選問題。本身為資深大律師的公民黨立法會議員湯家驊認為無論最終由誰接任，獲推薦的候選人應該到立法會接受議員提問，不少黨派卻對此建議有保留，認為立法會不應介入獨立的甄選程序。 明年9月退休的李國能昨稱，司法人員推薦委員會將推薦繼任人選給特首，並由特首任命。由於他身兼委員會主席，而委員會即將展開工作，因而不適合評論繼任人問題。 湯家驊則建議獲委員會推薦的繼任人選到立法會接受議員審核，認為立法會可藉此了解候選人的質素及能力，聲言「由民選議員審核一下人選，其實係理所當然。」 未獲其他黨派支持 有關建議卻未獲其他黨派支持。民主黨主席何俊仁指，行政、立法及司法機關獨立，立法會不宜介入司法人員聘任的甄選過程；若議員對候選人有疑問，可去信推薦委員會要求提交資料。民建聯及專業會議更反對建議，直指司法機構人員的公信力及專業非常重要，立法會不應隨便干預。
20090904-9,20090904,9,送別方心讓　陳太：為他驕傲,送別方心讓　陳太：為他驕傲 【本報訊】簡單一個微笑，足以令人銘記一生。前行政及立法兩局非官守議員、著名骨科醫生、「復康之父」方心讓昨天舉殯，多位親友在安息彌撒中分享方心讓軼事時，無不憶及常掛於方心讓面上的親切笑容，也讚揚他對復康工作的無私奉獻。方心讓最終長眠跑馬地天主教墳場；他那種無私的助人精神，永存於世。 方心讓追思彌撒在銅鑼灣聖保祿基督君王小堂舉行，陳日君樞機參與共祭。其靈柩在10名親友，包括前行政及立法局首席非官守議員鍾士元、前首席大法官楊鐵樑及前兩局非官守議員羅保等扶送下進入教堂，方德心拿着父親的遺像引領親友內進。 不同界別人士在彌撒中分享方心讓生平軼事。前任政務司司長陳方安生感謝叔父為方家上上下下帶來歡樂、榮譽與愛，所有家人都為他感到驕傲。前兩局議員李鵬飛永遠難忘78年就任立法局議員的第一天，方心讓面帶笑容主動上前介紹自己，又着李有問題時可以找他，毫無任何架子，坦言「佢真係好鍾意笑，好多人一定會記得佢。」 遺孀輕撫亡夫臉龐 致悼詞的食物及衞生局局長周一嶽也指方心讓愛笑、樂觀。其孫仔孫女則大爆方心讓嗜食，更是黃油蟹、上海年糕及豆漿粢飯的擁躉。不少殘障人士也到場送別復康之父。香港復康聯會主席張健輝憶述，方心讓試過對他說：「你咁瘦，要食多啲嘢。」其後即送上食物。張含淚道：「雖然你（方）喺遠方國度，我哋永遠懷念你。」 方家眾人一直表現平靜，直至瞻仰遺容時終於哭了。方心讓遺孀葉孔磋望着結伴走過60載的另一半安詳睡着，不禁伸手輕撫他的臉龐，久久不願離開，最終要由親友攙扶返回座位。 在陳日君樞機向方心讓遺體灑聖水後，10名扶靈者扶送靈柩離開教堂。遺體移送跑馬地天主教墳場，讓方心讓長眠靜土。
