key,date,article_daily_id,title,text
20090807-65,20090807,65,光顧儀器美容慘變爛面,光顧儀器美容慘變爛面 女為悅己者容，不少女士為求以最佳狀態示人，選擇不同美容療程達致護膚效果。不過，若遇上美容師技術失準，或儀器出問題，分分鐘弄巧反拙，美顏變爛面。 個案一 彩光去斑變灼傷留疤 慘變「花面貓」的鄭小姐，其友人為Doctor'sConcept旺角分店的會員，早前其友人轉讓15次彩光療程給她，她每次只須講出友人會員編號便可使用療程。數次療程中她雖感到刺痛，但每次臉上起斑位置的深色印都會逐漸減退，但至7月初，同樣的療程卻令她臉上起水泡及留下10多條灼傷疤痕，醫生診斷為燒傷。她已向消委會投訴，事件仍在調查中。 個案二 去死皮失手鏟走皮肉 崔小姐於7月中到沙田一田商場的Covermark美容店做面部療程，美容師用鏟皮機清除面部死皮時，表示剛換新機，需時掌握。當鏟完面後，她前額兩處感覺痛楚，原來被鏟走兩塊如尾指般大小的皮肉，翌日傷口更起水泡及含膿。皮膚科醫生表示，她傷及表皮且傷口深，可能會留凹凸痕。 個案三 微針收毛孔導致爆瘡 光顧現代美容的顏小姐，本年初選用微針療程，稱可改善毛孔粗大，兩次之後面部狂爆暗瘡20多粒，美容師仍稱正常，情況維持兩個月仍未改善，她向皮膚科醫生求診，診斷為皮膚發炎，經服藥後稍為復原。她懷疑皮膚受到不潔器具感染。 現代美容回應稱，每次完成微針療程後，針具會即棄，及重新開一套已消毒和獨立包裝的針具，供下一位客人使用，相信受器具感染的機會不大。而之前顏小姐做過兩次療程，沒有表示不滿。該公司曾建議她改用其他療程，但遭拒絕。而至截稿前，Doctor'sConcept及Covermark仍未回覆。 檔案編號：0712006、0716027、0713057 醫生意見 成功關鍵：技術好及清潔度高 皮膚專科醫生黎湛暉指出，美容儀器很依賴操控者的技術及儀器的清潔度，否則容易令皮膚受損或受感染。彩光儀器可令細胞吸收波段流量，刺激皮膚細胞增長，可抑制色素，達致褪斑。但當調校輸出的能量過強，或輸送時間太長，都會傷害皮膚。如臉上出現類似抓痕，已屬灼傷；復原進度要視乎灼傷程度而定。 消毒不足易感染 至於鏟皮機，可將角質層鏟走，刺激皮膚增生，達致換膚效果，因皮膚磨薄，血管浮現，面色較紅潤。不過，角質層若過份清除，失去保護層，也有一定危險，包括鏟得太深，有機會被病菌接觸表皮而受感染。 而微針同樣可把真皮底層已退化的膠原破壞，刺激膠原增生。若儀器消毒不足，皮膚有機會受感染，最常見的有金黃葡萄球菌，嚴重者可感染肝炎。一旦皮膚受損，黎醫生建議可用清水洗面或凍水敷面，如仍未能紓緩，應向醫生求診。 社會服務 報料熱線：29290000 社會服務熱線：29908288 蘋果日報慈善基金：29908688 傳真：37112468 網上捐款： http://charity.appledaily.com.hk/donate  各類表格： http://charity.appledaily.com.hk/forms  電郵：mailto:sservice@appledaily.com 匿名投訴恕不處理。一經投訴，本報保留刊登權利。
20090807-66,20090807,66,長沙灣名宅　周潤發是業主,"長沙灣名宅　周潤發是業主 【本報訊】昨日發生保安員傷人案的長沙灣名宅郝德傑道嘉珀山，是由仲量聯行物業管理有限公司管理，事發後該公司已安排心理輔導員，隨時為受傷員工及其他員工提供心理輔導服務。此外，公司也額外安排資深管理主任到場，協助大廈的一切管理事宜。 嘉珀山以法國莊園大宅建築概念設計，樓齡五年，佔地60,000平方呎，為兩座12層低密度豪宅，共有22個單位，每個單位2,300平方呎以上，以廳大及樓底高10呎為賣點，間隔為四房。由於間隔實用，嘉珀山曾獲「十大最佳樓則大獎」。 放盤極少　呎價7825元 由於嘉珀山私隱度高，深受演藝界人士追捧，影帝周潤發及藝人王賢誌均為業主。04年4月，周潤發斥資4,680萬元購入2座頂層相連單位，連空中花園總面積5,709呎；地產代理估計該物業現時市值6,600萬元。07年，藝人王賢誌也斥逾千萬元購入上址一個單位。 嘉珀山單位供應量少，放盤更少，成交不算活躍，今年僅有三宗成交紀錄；其中一宗2座8樓一個2,313平方呎單位，在今年7月以1,810萬元成交，呎價7,825元。"
20090807-67,20090807,67,長者賣紙皮遭呃秤,長者賣紙皮遭呃秤 基層市民變賣紙皮廢物旨在多賺十元八塊，然有回收商卻暗調電子磅，令紙皮顯示的重量比實際為輕。70多歲曾伯經常將集得的紙皮推到長沙灣一回收店變賣，但他發現回收店不時呃秤：「我啲紙皮有成10斤，佢哋就話得7斤，呃得好厲害。」曾伯批評店方「在乞兒兜搶飯食」，促海關檢控呃秤回收店。 九名回收商被罰 海關指，凡管有、製造、供應或使用不準確的度量衡器具作商業用途，均屬違法，最高可被罰款兩萬元。如涉及欺詐行為，最高刑罰是罰款兩萬元及監禁6個月。本年首6個月，已有9名廢料回收商，因利用不準確電子地磅收購廢紙而被法庭定罪，涉案的電子地磅被充公。海關舉報熱線：25456182 檔案編號：0705020 社會服務 報料熱線：29290000 社會服務熱線：29908288 蘋果日報慈善基金：29908688 傳真：37112468 網上捐款： http://charity.appledaily.com.hk/donate  各類表格： http://charity.appledaily.com.hk/forms  電郵：mailto:sservice@appledaily.com 匿名投訴恕不處理。一經投訴，本報保留刊登權利。
20090807-68,20090807,68,積金知多啲：自願供強積金　65歲前可提取,積金知多啲：自願供強積金　65歲前可提取 問：若我參加強積金自願性供款計劃，供款是否要到65歲退休時才能取回？ 答：由於自願性供款屬自願性質，故此在繳付及權益支付方面並不受《強積金條例》規管，僱員可於65歲前提取。不過，不同受託人對自願性供款的提取次數及收費各有不同規定，計劃成員必須仔細了解相關條款。 雖然作出自願性供款的計劃成員可以自由提取供款，但由於其主要目的是為退休作更好準備，故此，經常提取供款並不符合自願性供款的原意。 自願計劃有多種 現時市面上的自願性供款計劃各有不同，供款人參加計劃前，應先清楚了解條款內容和規管詳請，若有疑問，應向受託人查詢，以確保計劃切合本身需要。 僱員除了透過僱主向強積金賬戶作自願性供款外，也可作「特別自願性供款」，自行選擇受託人，並直接向受託人供款。 在強積金法例下，自願性供款投資跟強制性供款投資同樣受到嚴謹規管，無論投資規定、資料披露、滙報及審計規定等，兩者並無差別。同時，自願性供款與強制性供款同樣受補償基金的保障。 積金局熱線：29180102
20090807-69,20090807,69,專家之言保安員應接受侮辱性訓練,專家之言 保安員應接受侮辱性訓練 對於豪宅保安主管襲擊三名下屬，城市大學犯罪學家黎定基指，案件顯示都市人缺乏處理人際關係及紓緩工作壓力的技巧，他認為現時物業保安員也應接受一些類似警務人員的基本「侮辱性訓練」，以應付日益繁重的工作。護衞界人士認為，事件顯示護衞工作低薪且工時長的壓力。 飲冰水做運動助減壓 黎定基表示，香港的教育一直以來以學術性為主導，十分欠缺群體生活，人際交往技巧往往靠自己踏足社會後摸索；而現時的人多透過互聯網與朋友溝通，網絡上和朋友發生爭執可用「關機」來處理，但現實生活中若處理得不好就會發生口角，甚至動武。 黎定基指出，任何行業均有工作壓力，保安員的工作壓力包括來自上司、住客及訪客等，因此保安從業員應接受一些類似警務人員的侮辱性訓練，即罵不還口。至於如何紓緩工作壓力，黎定基認為飲冰水、冲凍水凉、聽音樂及做運動等均有幫助。 香港護衞及物業管理從業員總會邱月嫦副秘書長則謂，全港有超過10萬名保安護衞員，大部份人每日工作12小時，但月入只有七千餘元，而且多是兩年工作合約，他們不但要面對長工時、低收入的生活壓力，還要面對飯碗朝不保夕的失業壓力。 本報記者
20090807-70,20090807,70,每月兩次隨機抽查　學生堅拒則不強迫校園驗毒交警跟進　掀恐慌,每月兩次隨機抽查　學生堅拒則不強迫 校園驗毒交警跟進　掀恐慌 【本報訊】政府公佈大埔區校園驗毒計劃詳情，包括護士及社工在內的五人驗毒小組，每月兩次突擊到訪學校，隨機為每校約40名學生進行快速驗尿。但若學生堅拒驗尿，驗毒組也不能強迫就範，但會轉交駐校社工跟進。社工界擔心，駐校社工將會變成強迫學生「就範」驗毒的打手，所謂「自願」只是假象；況且驗毒報告將交警方跟進，恐掀起白色恐怖。 記者：夏志禮　雷子樂　張嘉雯 教育局局長孫明揚及禁毒專員黃碧兒昨就計劃向大埔區校長解畫並收集意見。計劃最快今年12月推行，為期半年，成本由政府承擔。家長簽署同意書後，其子女會列入計劃內。驗毒工作由校外專責小組負責，成員包括男女護士各一名、兩名社工及一名資料管理員。驗毒小組平均每月突擊到訪學校兩次，為每校合共約40名學生進行五種藥物的快速測試，學生是隨機抽出，並獲派發收集瓶，自行提供尿液樣本，其間無人在場監管。 若測試呈陽性反應，學生又自認吸毒，會交由相關人士進行支援工作，包括校長、社工以及學校警方聯絡主任，驗毒報告可交警方跟進。若學生否認吸毒，樣本會送實驗室再進行確認測試，再呈陽性則交上述支援隊伍處理。教育局表示，警方不會檢控吸毒學生，但會利用資訊調查毒品來源打擊源頭。學校承諾不會開除吸毒學生，學生只需接受輔導及其他支援工作。 社工要當說客兼輔導 不過，學生可拒絕參與驗尿，政府發言人指：「我哋明白有同學會有挑戰權威嘅心態，但係如果佢一直拒絕交樣本，我哋唔會迫佢交，校長亦無意用校規迫佢交，但就會叫社工了解佢嘅理由。」 各校駐校社工日後除了要說服學生「就範」，亦負責為有需要的學生提供即時有效的輔導、處理接受測試後學生的負面情緒，並回答學生就計劃流程及各種憂慮的提問。現時本港中學實施一校一社工計劃，駐校社工平均要處理過千宗學生個案，若工作量再增加，恐會爆煲。 青年聯社召集人江貴生表示，學生若拒絕驗毒，當局會安排社工跟進，他批評此舉根本是要利用社工作阻嚇，從而強迫學生「自願」接受驗毒，即所謂「自願」只是假象。有大埔區資深社工也認為，這安排似乎將社工視為「打手」，「如果係尊重個學生，點解唔放過佢？」他估計每十個抽驗樣本，約有一至兩個會呈陽性反應。 立法會社會福利界議員張國柱認為，驗毒計劃的上、下游配套都極度不足，包括未有訂出保護學生私隱的措施、亦未有適當地增加輔導資源，以應付即將「揭發」的吸毒青年，要求當局推遲實施。 恩主教書院尚未表態 大埔區目前只有路德會青欣中心為吸毒青年提供專門輔導，中心每年只能跟進約300個案，至7月已接近「滿額」。中心主任鄧國禧表示，現時新個案需輪候四至六周。 政府消息人士指出，警方介入計劃是要解決社工或學校沒法解決的問題，如毒品小拆家等；針對社工資源問題，政府將於今年9月前陸續推出其他四項禁毒措施，待時機成熟即會加大社工資源。 大埔區內唯一一所天主教中學恩主教書院昨仍未就是否參與計劃表態，孫明揚對此表示，盼透過溝通解決問題，「我相信真理會越辯越明。」 特稿 借權威推測試　問題多 政府推動毒品測試，始於律政司司長黃仁龍去年底發表的《青少年毒品問題專責小組報告》。報告提及測試可達到監察、遏阻、預防吸毒等目的，並訴諸權威，借格拉斯哥大學學者NeilMcKeganey的研究加強說服力。不過，有關研究其實同時點出校本驗毒出現不少問題，至今也沒有具質素的研究證明驗毒計劃的成效。港府引述報告時並沒全面交代這些「不利因素」。 練乙錚昨在《信報》撰寫題為〈政府自知校本驗毒有效性毫無根據！〉的文章，引述McKeganey研究，列舉黃仁龍報告當中所「遺漏」的部份，例如研究指至今仍沒多少對校本驗毒成效的鑑定研究；現存研究的質素也不嚴謹。文章質疑政府「一方面違反學術研究結論，另一方面又借學術研究之名推動政策，特區政府已不是第一次。」 外國研究多質疑成效 事實上，不少外國的研究也質疑校本驗毒的成效。本港青年聯社引述澳洲的研究報告，結論就是「推行驗毒計劃與青年吸毒並無直接關係」。該份由澳洲國家禁毒委員會資助、07年進行的研究也指出，絕大部份的毒品測試方法，若在學校的環境進行，可靠性根本不足。 該研究也指出，現存的學術文章並沒足夠證據顯示校本驗毒計劃能有效阻止吸毒問題，即使有類似的報告，也多是來自美國，水平並不嚴謹。該研究報告更指出，驗毒計劃會觸發學生逃學、心理壓力增加、因私隱受侵犯感到尷尬、破壞學生與家長及學校互信等等問題。本報記者 校園驗毒計劃Q&A Q：何時何地開始試行？ A：今年底於大埔區內23所中學試行，為期半年。 Q：檢驗甚麼藥物？ A：K仔、搖頭丸、冰毒、大麻及可卡因共5種。 Q：以甚麼形式進行？ A：利用驗尿工具套作快速測試，檢驗期限約為1至3天，每種毒品每次測試成本約10元。 Q：誰人負責測試？ A：由校外專責小組、採隨機抽樣形式進行；成員包括男女護士各一名、兩名社工及一名資料管理員。中一至中五及中六至中七以2:1的比例抽樣。 Q：每學年進行多少次毒品測試？ A：驗毒小組每月平均到校兩次，合共測試32至40名學生。 Q：誰負責簽同意書？ A：學校於學期初向家長派發同意書，有效期一學年，家長負責簽署，若學生滿18歲需與家長同時簽署。 Q：學生可否拒絕驗毒？ A：專責人員不會強迫學生驗尿，原則上學生可一直拒絕交出尿液樣本，社工會跟進。 Q：樣本如何採集？ A：向學生派發小瓶，學生自行於洗手間內提供尿液樣本，其間不會有人監管。 Q：那些人有權知悉驗毒結果或報告？ A：學生、家長、班主任、駐校社工、學校警方聯絡主任或分區警察主任等。 Q：若測試呈陽性反應，有何後果？ A：學校不能開除學生，警方亦不會檢控學生，但學生須接受學校及社工的支援及輔導服務。 資料來源：禁毒處及教育局
20090807-71,20090807,71,不老症狂魔與西片雷同港片《殺人犯》抄襲羅生門,"不老症狂魔與西片雷同 港片《殺人犯》抄襲羅生門 現仍上映、由郭富城主演的懸疑電影《殺人犯》，講述城城領養的孤兒原來是患有不老症的惡魔，橋段荒誕離奇，連日來惹來無數爭議。原來世上還有更離奇的事，即將在港上映、但於去年3月拍畢的荷李活電影《孤疑》（Orphan），橋段居然跟《殺人犯》幾乎完全一樣，當中可有抄襲成份，相信比《殺人犯》劇情更值得研究。 由李安徒弟周顯揚執導，譚家明徒弟杜緻朗編劇的警匪懸疑電影《殺人犯》，除了靚仔影帝郭富城在片中歇斯底里式的演出之外，最令人期待的必定是懸疑劇情。不過電影上映後，當中的橋段卻惹來無限爭議，不少影迷本着又要鬧又要睇的原則買飛入場，是以電影上映30日，截至昨日仍錄得1,170萬票房，成績不俗。 同期上映離奇巧合 於7月初在港上映的《殺人犯》講述城城因飽受喪兒之痛後，領養了由5歲童星譚真一飾演的孤兒，電影末段才慢慢揭曉該名孤兒原來是患有不老症的成年人，且是一名專門販賣兒童的狂魔，由於橋段冷門兼離奇，連日引起網民熱烈討論。事有湊巧之顛，由里安納度狄卡比奧（LeonardoDiCaprio）監製、JaumeCollet-Serra執導的電影《孤疑》（Orphan）7月24日於美國上映，但電影劇情居然跟《殺人犯》如出一轍！ 《孤疑》講述女主角因意外流產，為彌補心靈創傷，收養了8歲的女孩Esther，原來Esther是一名患不老症的女人，更渴望跟男主角發生關係。至於她遇上主角夫婦之前，同樣已經犯案纍纍。由於這兩套近乎同時間上映的電影橋段完全一樣，過往極其罕見，很難令人不質疑當中是否有人抄橋。翻查資料，《殺人犯》於去年10月開拍，12月拍畢；而《孤疑》則於07年12月開鏡，去年3月拍畢，本月27日在港上映。 編劇：200%肯定原創 《殺》片編劇杜緻朗昨日接受電話訪問，強調《殺人犯》劇本早於四年前已完成，且有監製江志強可以做證，但當聽到連「不老症」的橋也一樣時，則表現得甚愕然，隨即表示要先向電影公司了解：「因為唔係我一個人嘅事，我只係寫劇本，個版權喺電影公司度，其實個劇本可以話係2005年前已構思，其間一定有畀人睇過。」她以堅定的語氣說：「我可以200%肯定係original（原創），完全冇抄襲。」 問到倘若是對方抄襲，可會作出法律行動，杜緻朗則稱不會回答假設性問題，一切交給電影公司處理。負責製作《殺人犯》的安樂電影公司高層陳小姐，堅決否認抄襲，她說︰「《殺人犯》07年已經拍板開拍，籌備咗四年，劇本搞咗好耐，絕對唔會抄人。」 負責發行《孤疑》的電影公司代表拒絕回應事件，但就表示荷李活片製作時間一般比港產片長很多。《孤疑》於上月24日在美國上映，有可能於幾年前已開始籌備。 採訪：葉雪 《殺人犯》VS《孤疑》 相似橋段（一） 《殺》片：城城的兒子逝世，決定收養男童譚真一 《孤》片：女主角意外流產，決定收養女童Esther 相似橋段（二） 《殺》片：譚真一患上不老症 《孤》片：Esther患上不老症 相似橋段（三） 《殺》片：譚真一被揭是販賣兒童的狂魔 《孤》片：Esther被揭是殺人狂魔 資料來源：《蘋果》資料室 話你知：劣評如潮無損票房 《殺人犯》連環被插，除了劇本爛尾以及電影海報被指抄自《閃靈》（TheShining），在網上討論區更被批評得體無完膚，有人形容「看了套如屎般惡頂的戲」，更有人發短訊忠告朋友別入場看，否則抱憾終生。雖然此片被踩到一文不值，但不少觀眾為了想看電影有多爛而買飛入場，形成你有你鬧，票房繼續升的現象。被圍插的杜緻朗早前忍無可忍在Facebook還擊，她說：「莫名其妙的人身攻擊……究竟我何罪之有？罪至要被打死？每個創作人都會有自己最想表達的主題及世界觀。觀眾有絕對自由對任何電影作任何評價，雖然我不是DavidLynch，我只是個無能為力的杜緻朗。」 人物誌：才女編劇初出脫腳 現年29歲的杜緻朗數年前在城大創意媒體學院畢業，是譚家明的學生，其後被曾志偉發掘寫《江湖》劇本，首部見觀眾的作品已請來劉德華、張學友等大卡士擔正，被譽為才女編劇，但被捧得高自然跌得痛，睇過《江湖》的人都罵聲四起。她之後寫過《霍元甲》、《不能說的．秘密》等不同類型的劇本。她曾在電台節目訪問中表明希望每次寫劇本都要觀眾始料不及，《殺人犯》是她和男友周顯揚雙劍合璧之作，更是周顯揚的處男執導電影，但結局扭橋扭得過火，被網民圍插。 《殺人犯》 開拍：08年10月 上映：7月9日 《孤疑》（Orphan） 開拍：07年12月 美國上映：7月24日 香港上映：本月27日"
20090807-72,20090807,72,阿佘撐嘉穎有風度,阿佘撐嘉穎有風度 現年34歲的佘詩曼經常與合作拍劇的男星傳緋聞，自去年9月被爆與鄭嘉穎撻着後，更多次被拍得密會，但兩人始終否認相戀，日前有周刊撞破兩人約會，鄭嘉穎更被指狠心踢阿佘落車。 「佢係有車過我」 昨日阿佘聯同黃子華、呂慧儀和許紹雄等人，到旺角出席新劇《絕代商驕》宣傳活動。提到被嘉穎踢落車，阿佘明顯有備而來，她更罕有地力撐愛郎說：「佢係一個有風度嘅人，唔會係咁，係雜誌咁寫啫，佢係有車過我，唔係成日，佢一定唔會做咁嘅事。」問到她與嘉穎現時的關係時，她說：「朋友囉！從來冇講過乜，亦都冇講過地上定地下，係雜誌講，我哋係友好關係。」 昨日嘉穎到銅鑼灣出席銀行宣傳活動，被問到何時儲夠老婆本時，他說：「好難話夠唔夠，總之都係努力當中，等我再拍多幾個廣告先喇。」 此外，首次拍劇的賈曉晨（JJ）謂拍劇十分困難，因要背很多對白，幸好同劇的黃子華幫了她不少，她說：「佢教我用自己嘅說話嚟講對白，而且拍呢套劇超爆笑，有時自己都忍唔住笑。」 採訪、攝影：藍文浩、王崇穎
20090807-73,20090807,73,攬仔出貓　是非未了鍾溥敏被爆酒吧做拳手,攬仔出貓　是非未了 鍾溥敏被爆酒吧做拳手 【第37屆港姐之蒲精佳麗】香港小姐競選於本月22日（周六）舉行，臨近比賽仍是非多多，7號鍾溥敏繼被爆夜蒲攬仔及大學出貓後，最近又被爆在酒吧當「拳手」，因猜枚高強而客似雲來，鍾溥敏大方承認曾蒲吧，猜枚只為陪友消遣而已。 無綫香港小姐競選舉行在即，連日來10位佳麗繼續集訓，不過是非不絕，7號鍾溥敏（Mandy）早前除被拍到當街攬仔夜蒲後，又被爆大學一年級考試出貓，她已認錯改過，估不到她繼續是非纏身。 「職業無分貴賤」 日前有讀者報料指鍾溥敏兩年前曾在尖沙嘴「第一吧」任職拳手（猜枚），由於是猜枚高手故成為客人搶手貨，愛向顧客索貼士。昨日鍾溥敏到電視城為才藝表演錄影，她直認去過該酒吧：「兩年前我有去過，因為有個朋友喺外國返嚟，個朋友鍾意去呢間吧，所以佢返嚟幾個月我哋成日有去玩，不過我唔係去做拳手，或者成日去俾人誤會，因為我哋一班朋友係有玩猜拳。」問她是否猜到滿場飛，她說：「我只係同自己啲朋友猜，我都唔係高手，只係玩吓啫。」 鍾溥敏兩年前仍就讀樹仁大學，她說：「即使係做拳手都冇所謂，職業無分貴賤，拳手都係一份正當職業，我自己就冇做過拳手。」 佳麗跳舞頂硬上 此外，昨日無綫安排10位佳麗才藝表演錄影，該節目會在下周六（15日）晚於特備節目《美麗體驗北海道》播出，今次大部份佳麗的才藝是由無綫安排，鍾溥敏一身魚網襪及高衩打扮大跳士的舞，不過她恐防走光，經常用帽子遮掩下半身，她說：「我有打底，我冇學過士的舞，跳舞唔係我嘅強項，不過跳舞可以有啲動感。」 有縮胸周秀娜之稱的5號馬詠恩，昨日的野性打扮似足周秀娜，她說：「我好少咁着法，不過幾有型，我本來想彈琴，不過已經有人做咗。」8號熊穎詩坦言跳hiphop扇舞是由公司安排，她也未學過跳舞，只曾學瑜伽，至於2號林潔瑜則以一身金色短裙跳現代舞。 採訪、攝影：楊潔雯、陳寶明 各位讀者如果認識十位入圍港姐，知道她們的底細，歡迎電郵mailto:adent@appledaily.com報料。
20090807-74,20090807,74,毛舜筠乖女不捨捐書,毛舜筠乖女不捨捐書 毛舜筠、周柏豪及鄧紫棋（G.E.M）昨日應邀出席港台在鑽石山荷里活廣場舉行的「舊書回收義賣大行動2009」，毛舜筠因為拍《畢打自己人》全年無休，她說：「我終於可以申請放到一個禮拜假，本來打算呢個星期喺屋企攬住兩個女，但係今日呢個活動好有意義，我答應出席之後即刻問兩個女有乜嘢書可以捐，點知個大女唔睬我，個細女就好唔捨得咁拎咗本細書出來。」 周柏豪睇書慢 G.E.M與周柏豪都捐出自己看過的書，周柏豪說：「我平時真係少睇書，呢本《窮爸爸富爸爸》我睇咗9個月，平時冇時間睇。」會考剛剛放榜，去年有21分的G.E.M說：「我有師妹同埋歌迷今年考會考，聽佢哋講話考得幾理想，叫我放心。」 採訪、攝影：楊潔雯
