key,date,article_daily_id,title,text
20090904-70,20090904,70,JaniceMan餵薄餅惹混亂,JaniceMan餵薄餅惹混亂 文詠珊（JaniceMan）和黃宗澤（Bosco）昨日同到銅鑼灣宣傳PizzaHut的新款食品，吸引大批fans和市民圍觀，不過兩人要在烈日下宣傳，難免汗流浹背，Bosco更不停抹汗。 JaniceMan和Bosco餵fans食薄餅，fans當然受落，兩人又向市民派番茄仔，引起一陣混亂。問JaniceMan有否整過薄餅？她說：「我有學過，整畀屋企人同自己食。」男友有沒有份？她只說：「整薄餅係一種樂趣，有機會我會整畀大家試吓。」問Bosco是否想女友胡杏兒都識煲湯？他自稱未有女友，記者即謂現在講大話會被狂轟，他仍堅持說：「戀情唔公開，好熱呀，冇呀。」採訪：卓寶花 攝影：彭琮然
20090904-71,20090904,71,溫碧霞助養天使熊貓,溫碧霞助養天使熊貓 溫碧霞早前獲邀請到四川省雅安市的熊貓基地參觀，同時又出席電影展擔任頒獎嘉賓，溫碧霞表示今次去熊貓基地主要宣揚環保及保育瀕臨絕種動物的訊息。 期望帶來平安 參觀期間，溫碧霞要身穿保護衣和手套才能抱熊貓BB，她說：「熊貓BB只得一歲大，所以免疫能力好低，如果要抱小熊貓，就要做好防毒措施。我今次助養一隻熊貓女BB，仲同佢改咗個名叫天使，因為中國多天災，希望天使可以帶來平安好運。」 採訪：陳寶明
20090904-72,20090904,72,周迅崖邊吹風,周迅崖邊吹風 周迅、黃曉明和李冰冰主演的電影《風聲》下月15日上映，戲中黃曉明飾演日本軍官，用盡酷刑殘害革命黨，問黃曉明會否擔心破壞形象？他說：「不擔心，只是演戲，我覺得演反派很有挑戰性。」 買重保險 拍攝《風》片期間，大隊移師一個小島，有場戲講述黃曉明把周迅、李冰冰和張涵予三名革命黨員捉到古堡審問，冰冰還要在塔頂吹風。不過最慘是拍攝在古堡外的崖邊設宴的場面，離地萬丈，面對洶湧巨浪，電影公司也為演員買重保險。當時氣溫只有攝氏五度，周迅和黃曉明等演員要坐在席上一齊吹風，苦不堪言。撰文：葉雪
20090904-73,20090904,73,老中青女星逛銅鑼灣阿嬌匿埋睇衫　陳穎妍密友伴遊,老中青女星逛銅鑼灣 阿嬌匿埋睇衫　陳穎妍密友伴遊 女人shopping無分界限，前晚鍾欣桐（阿嬌）、陳穎妍和蕭芳芳三位老、中、青女星在銅鑼灣各有節目，阿嬌最高檔秘行Chanel，但匿埋睇衫避記者；陳穎妍有癡情TB經理人傍實嚴選中價貨；倒是年紀最大的蕭芳芳落落大方談笑風生，懶理途人眼望望從容打的，又是老薑辣。 銅鑼灣是女人購物大同世界，鍾欣桐、陳穎妍和蕭芳芳前晚不約而同相約女伴shopping逛街。三位女星中以62歲的芳芳姐年紀最大，但表現最得體，前晚她與一女伴現身利園附近打的，兩人邊講邊笑，雖然不時有途人向芳芳姐注視，不過她表現輕鬆，患弱聽的她還即場戴上助聽器，大大方方，與鍾欣桐匿埋揀衫相映成趣。 逛Chanel齋睇唔買 同時間阿嬌和陳穎妍也在附近買衫，33歲的陳穎妍與傳足7年斷背情的TB經理人Polly，齊穿白色裝束喪逛中價時裝店，陳穎妍先後試着紅皮褸及黑皮褸，但結果她不合心水未有買下。現場見兩人比前發福，Polly更做出甚man的掹鬚動作。 另一邊廂28歲的阿嬌則逛Chanel，但發現記者後即閃去底層。該店8時關門，她卻於8時半才離開，問她有否購物？她笑說：「冇，因為你哋囉！」昨日阿嬌到新城接受薛家燕訪問，她透露12月推出個人大碟，新歌已開始播放，她承認獨唱有困難：「好難，阿Sa（蔡卓妍）都係咁，希望快啲一齊唱番歌。」 撐華仔太照顧Fans 近日劉德華因講大話備受外界抨擊，阿嬌昨日也幫華仔講好話：「可能fans對佢期望太高，以佢呢個年紀結婚生仔好正常，佢太照顧fans先唔敢認，佢唔想令fans嘅幻想幻滅，個個都想做劉太o架啦。」 採訪、攝影：羅德光、黃曉程、楊浩賢、何永寧
20090904-74,20090904,74,章子怡、范冰冰攀石激鬥,章子怡、范冰冰攀石激鬥 章子怡和范冰冰合演的新片《非常完美》昨日在香港上映，雖然在拍攝期間曾傳出兩位花旦不和，但卻無損兩人的友情，章子怡更自爆兩人因一同拍攝一場攀石戲，令關係更緊密。 險象環生 原來當日要拍攝一場爭奪男主角蘇志燮的戲份，章子怡就設計向情敵范冰冰報復，並幻想范冰冰中其陷阱於高處墮下。拍攝時兩人險象環生，幸好現場做足安全措施，才未有受傷，事後章子怡說：「因為我與冰冰都是攀石初哥，所以拍攝前很緊張，雖然攀的並非一座真山，但對我們來說確實難過登山。」 此外，早前章子怡接受內地訪問時，當被問到貴為國際巨星的章子怡為何竟沒有一個英文名時，她即真誠說：「我是中國人，為何要一個英文名字。」她更自爆於讀書時代已幻想畢業後嫁人算了，一想便想了十多年。撰文：林妃
20090904-75,20090904,75,千方百計親近烈火英雄阿Sa情迷濕身Bosco,千方百計親近烈火英雄 阿Sa情迷濕身Bosco 蔡卓妍（阿Sa）竟放棄男友鄭中基改投黃宗澤（Bosco）懷抱？早前阿Sa狂追《烈火雄心3》而迷上Bosco扮演的Encore，大讚他又man又型，結果她早前拍新歌MV時自動要求找Bosco擔任男主角又攬又抱，而Bosco亦很識做地在MV賣大包濕身露兩點上陣，令阿Sa即時暈得一陣陣。 早前無綫劇集《烈火雄心3》大收旺場，收視理想，原來蔡卓妍也是忠實fans，她更迷上由黃宗澤扮演的Encore，早前阿Sa為新歌《生還者》拍MV，當工作人員問到她想找誰人做男主角時，她即時表示希望請Bosco演出，但工作人員向阿Sa大潑冷水表示因兩人屬不同公司，加上Bosco檔期緊密，故此成事機會很微，但阿Sa努力透過公司向無綫要人，終於成功找Bosco演出。 免阿Sa落水 拍攝當晚導演要求兩人一同落泳池濕身，當Bosco知道後自動請纓單拖落水，他說：「女仔濕身比較麻煩，佢哋要做比較多準備工夫，不如由我一個落水算。」導演最後都答應由他一人頂上，Bosco穿上白恤衫和牛仔褲落水，上水時隱約露兩點，他笑說：「我自己MV都冇咁性感呀！」阿Sa則大讚他一如Encore般有義氣。 唔玩簽婚書 到拍攝尾聲時，導演表示要拍兩人的親密鏡頭，以表達他們情侶關係，但導演卻叫阿Sa和Bosco「自動波」演出，一時間令兩人不知如何入手，Bosco說：「我拍戲咁耐都係第一次緊張同尷尬。」兩人互望數分鐘後便拍攝，又攬又抱，阿Sa還摸Bosco的耳仔相當入戲，但不到兩、三分鐘，他們已忍不住笑NG。 事後阿Sa大讚Bosco真人比上鏡更大隻，希望將來有機會合作，但問到阿Sa不怕胡杏兒呷醋？阿Sa先反問為何杏兒要呷醋喎？記者指兩人已是半公開的一對，阿Sa聞言識趣說：「杏兒都係一個專業演員，明白呢啲係導演要求，所以唔會咁嘅。」至於男友鄭中基？阿Sa則甜絲絲表示不回應。 另外，阿Sa前晚擔任《勁歌金曲》表演嘉賓，對於近日劉德華被指涉重婚，阿Sa維護對方說：「畀多啲空間佢，好耐冇見佢笑，平時見佢精神奕奕，但家覺得佢好困擾。」阿Sa坦言不會玩簽沒有法律效用的婚書，她更說：「大個鍾意平淡同細水長流，如果要簽就簽真，自己都一把年紀，有真點解唔簽。」至於被追問現時的一段感情是否細水長流，阿Sa表示「希望係啦」，言下之意已視鄭中基為結婚對象。 採訪：王崇穎　攝影：林德雄
20090904-76,20090904,76,徐子珊勁舞賀出碟,徐子珊勁舞賀出碟 徐子珊、蕭希榆、陳偉霆（William）等前晚到將軍澳電視廣播城擔任《勁歌金曲》的表演嘉賓，將於下周推出新碟的徐子珊前晚在台上勁歌熱舞，她坦言現時心情既緊張又大壓力，她說：「我冇瞓唔着，但食少咗嘢，所以個人瘦咗，不過都啱，因為我啲歌衫都幾性感，fit啲就最好。」 William放生女友 對於有消息指英皇有意花800萬簽Angelababy三年，William就表示未有聽過傳言，對於是否接受情侶在同一間公司，他就說：「每間公司都有唔同做法，我同公司合作關係好好，係睇每個人同公司嘅配合，佢想唔想我都支持。」William亦強調與Angelababy已有共識，互相不會干涉認識異性朋友。 採訪：王崇穎 攝影：林德雄
20090904-77,20090904,77,保怡紐約簽名警察求合照,保怡紐約簽名警察求合照 今日44歲生日的林保怡，日前到美國紐約為《2009年度紐約華裔小姐競選》擔任表演嘉賓，並在比賽前到贊助的珠寶店出席簽名活動，珠寶店特地打造了一隻金牛送給保怡作為生日禮物。 數百影迷圍觀 當日簽名活動吸引數百影迷圍觀，因當地不少影迷也有收看保怡主演的《珠光寶氣》，對他所演的高長勝又愛又恨，所以獲悉保怡首次到紐約舉行簽名會，便紛紛到場支持。其中一位坐輪椅的太太專程坐了兩小時車前來找保怡，令保怡大為感動。 另外，其間因為店外聚集人數太多，驚動當地警察到場了解，豈料知道保怡舉行簽名會，警察即要求拍照簽名留念，認真搞笑。 撰文：林妃
20090904-78,20090904,78,囡囡首映叫爹哋　Shopping嗌媽咪華仔何時認骨肉？,囡囡首映叫爹哋　Shopping嗌媽咪 華仔何時認骨肉？ 【一夜賭城戀大咗之孤星淚】劉德華與朱麗倩育有仔女之說流傳多年，但近日被本報獨家踢爆已婚才終於承認妻子的他，仍堅決否認有兒女。不過空穴來風未必無因，要拆解天王骨肉之謎，也有蛛絲馬迹可尋。近日有街坊爆料，指曾目擊朱麗倩偕同一名小女孩購物，女孩稱呼她做媽咪；而早年華仔出席首映禮，播映途中每逢出現其大頭鏡頭時，即有BB聲大叫爹哋。這對孩子口中的爹哋和媽咪，華仔又該如何解釋？ 劉德華因上月缺席外父喪禮及被本報踢爆講大話隱瞞已婚，連日來備受外界批評，其後華仔急急亡羊補牢，寧願冒着涉及重婚之嫌，大前日親證已跟朱麗倩於賭城結婚，及曾與舊愛喻可欣簽過一紙婚書，將私生活坦蕩蕩豁出去，但仍堅決否認有兒有女，強調「我冇細路仔，無論男仔女仔都冇」。 御用飯堂食客爆料 雖然華仔自稱未有骨肉，但他和朱麗倩身邊卻確實存在關係親密的神秘小孩，有傳兩人育有一名11歲肖虎的長女雲楓及9歲肖龍的兒子雲祖。不過華嫂朱麗倩也要苦守24年才獲得名份，那傳說中的小朋友若屬實，又會在何年何月才有名有份？ 華仔有仔女是真是假，從各種蛛絲馬迹中不難拆解。他是加多利山山寨王，身為何文田老街坊的華仔父母，幾乎每日都會幫襯位於窩打老道的豪華大酒樓飲早茶，據該酒樓的食客爆料，朱麗倩以往確曾偕同一名小女孩往嘆茶；也有街坊透露朱麗倩一次在某場合中購物時，同行的一名小女孩當眾稱呼朱麗倩做媽咪。至於早前有雜誌拍得華仔父母與一名小女孩晚膳卻是誤中副車，那個女孩只是華仔家姐的孫女。 街坊及酒樓食客爆料神秘小女孩以媽咪稱呼朱麗倩是鐵證之一；其二是華仔主演的《暗戰》99年舉行首映禮時，有人親眼目擊一班婦人抱着BB及小朋友坐在院內VIP座位，每當大銀幕出現華仔大頭鏡頭時，便傳來BB聲叫喊爹哋，且叫完一次又一次，引來在場觀眾眼望望，結果戲未播完，同行婦人便抱着BB靜雞雞鬆人，但遺留下來的問號是：為何華仔和朱麗倩會被孩子稱呼為爹哋和媽咪？其中關係明顯非比尋常。 另一方面，昨日有周刊再度拍得小麗倩真身，小麗倩上月曾出席朱父喪禮，之後蹤影全無，原來她長駐大馬，前日她穿着校服現身朱麗倩在當地的寓所，並由朱麗倩二哥朱劍輝管接管送。報道指小麗倩為掩飾身份隨母姓，大多在暑假時才返港與華仔團圓。至於更神秘的小劉華，則被指交由華仔移居新加坡的三家姐照顧。 白衫戴孝疲態畢露 華仔至今仍未為連串問號解畫，前日他在家中閉關，昨午則到位於觀塘的華仔天地開會。自從外父過身後，華仔一直穿白衫戴孝，昨日他也繼續穿白色素服，但疲態畢露，默然無語，在會址逗留約6小時後，他便返家休息。反而華仔雙親氣定神閒，兩老昨早約7時外出嘆茶時俱面帶微笑，劉爸爸向記者揮手點頭示好，問到有傳華仔停工時，劉父兩度雙手攤開示意不知道。 華仔金屋藏倩，華嫂朱麗倩自從上月25日與丈夫世紀拖手示眾後，至昨日已連續9天未再露面，似打回原形繼續做其隱形人。多年來她甘之如飴為愛犧牲，與華仔相戀24載只是默默守在他背後。95年華仔主演林嶺東執道的電影《大冒險家》時，與關之琳大鬧緋聞，但朱麗倩哼也不哼一聲，總是對丈夫唯命是從，難怪她會願意為華仔不發喪父訃文，甚至缺席父親喪禮。 採訪、攝影：葉雪、黃文偉、楊浩賢 解碼：身邊人放料逼認妻 華仔將朱麗倩收收埋埋24年，雖說紙始終包唔住火，不過若不是有身邊人通風報信，華仔自編自導的大話西遊，必定可以一直演下去，也不至落得今日進退失據的窘態。 其實華仔為保住事業江山冚實戀情多年，就算朱麗倩願意默默承受，她身邊好友也看不過眼，最有效的方法自然是向傳媒告密，逼華仔招供認妻，如去年朱麗倩胞妹朱麗華大婚之喜，華仔被揭以姐夫身份到賀，還在婚宴上獻唱《如果有一天》，更被拍下照片（圖）。 到今年2月，華仔又被拍得赴大馬與朱麗倩及其家人會面，似是商討婚禮事宜。然後是上月朱麗倩喪父，華仔再被踢爆往大馬見外父最後一面，向來低調的他屢被傳媒揭發行蹤，明顯是身邊有線人放料。講大話有前科的華仔，日前矢口否認育有「華dee」和「華女」的傳聞，不過他面前要對付神通廣大的傳媒，背後又要躲避線人的冷箭，似乎坦白才是上上之策。 12月澳門騷照唱 劉德華12月將到澳門舉行音樂會，有傳他受近日事件所困，本欲推辭演出，但昨日華仔經理人公司表示，他的工作如常不變。華仔演出的這個澳門音樂會，乃由澳門多個機構合作，是一個戶外演出，詳情則有待主辦單位公佈。另外，華仔目前正洽談兩齣電影，稍後還會接拍廣告及為新碟錄音。 如各位讀者找到有關疑似華仔兒女的資料，歡迎電郵mailto:adent@appledaily.com報料。
20090904-79,20090904,79,直言終於等到嫁馮仁昭四圍超：準新娘徐淑敏凸肚練廚藝 - 馮仁昭,直言終於等到嫁 馮仁昭四圍超：準新娘徐淑敏凸肚練廚藝 - 馮仁昭 被形容為幸福準新娘嘅徐淑敏（Suki），噚日同前緋聞男友崔建邦到太古城中心出席美食活動，可能佢哋各自有另一半，所以都冇特別避忌，喺台上有傾有講。被指奉子成婚嘅Suki噚日着上一條火紅連身裙示人，不過平日身形弗爆嘅「咪神」噚日腹部微隆，加上佢上落樓梯又要助手攙扶，現場見佢幾抗拒食生冷嘢，唔知Suki係唔係怕BB小器，所以佢仍然唔認有咗，佢話：「到時有咪知，唔排除有小朋友，相信我有BB時，大家都會祝福我，自己冇驗過（指驗孕）。」 要未婚夫落廚 Suki話做完手頭上嘅工作就會休息，每當提到佢未來老公同年底嘅婚禮時，佢就會流露出幸福滿瀉嘅笑容，佢話：「係呀，終於畀我等到，之前冇拍拖成年，好悶。」Suki喺活動上落手落腳切嘢，仲顯得有板有眼，不過佢話自己平日唔多下廚，反而係未婚夫煮嘢食居多，佢話：「我諗佢情願同我出街食多啲，因為佢嘴刁，等我練好啲廚藝先。」
20090904-80,20090904,80,馮仁昭四圍超：藍奕邦歌曲鼓勵華仔 - 馮仁昭,馮仁昭四圍超：藍奕邦歌曲鼓勵華仔 - 馮仁昭 藍奕邦一向同劉德華都幾老友，成日喺音樂上合作，日前阿邦為新歌《向前走》拍MV，原本呢首歌阿邦係因為去年經歷喪母之痛而寫畀自己作為鼓勵，叫自己凡事要勇敢向前走，但佢近日見到華仔是非不斷，佢都好同情華仔，希望送呢首歌畀佢打打氣，希望佢唔會因最近嘅事而唔開心，繼續向前走，因為好多人仍然會大力支持佢！
20090904-81,20090904,81,馮仁昭四圍超：鍾嘉欣想同杏兒合唱 - 馮仁昭,馮仁昭四圍超：鍾嘉欣想同杏兒合唱 - 馮仁昭 鍾嘉欣（右）日前接受商台節目嘅錄音訪問，近日鍾嘉欣籌備緊嘅新碟，仲親自作咗首《日夜想你》，佢話估唔到公司會揀呢首歌，搞到佢有少少驚，好彩好多同行聽完都大讚首歌旋律好好，令佢打咗支強心針。鍾嘉欣亦好想試吓同胡杏兒合唱，佢話：「因為好多合唱歌都係男女，好少係兩個女仔一齊唱，咁先可以撞到啲火花，成日一男一女會好悶。」
20090904-82,20090904,82,馮仁昭四圍超：成龍過來人同情華仔 - 馮仁昭,馮仁昭四圍超：成龍過來人同情華仔 - 馮仁昭 成龍日前喺北京接受無綫娛樂新聞台訪問，講起劉德華瞞婚事件俾人指摘，成龍當年都係打死唔認有妻兒，佢話自己係過來人，佢話：「點都好，應該有自己嘅空間，我係過來人，當年喺日本有影迷自殺身亡事件，所以祖名都送去外國唔畀人知，我好明白華仔心情，相信華仔本身有好多顧慮嘅原因。」
20090904-83,20090904,83,馮仁昭四圍超：郭偉亮儲錢娶葉佩雯 - 馮仁昭,馮仁昭四圍超：郭偉亮儲錢娶葉佩雯 - 馮仁昭 二人組合Swing重組後將會出碟，噚日佢哋到新城接受DJ露芙訪問，宣傳佢哋嘅新碟，郭偉亮（Eric左）話對上一次出碟已經係7年前，佢講笑話今次係為咗同女友葉佩雯（小圖）結婚生仔籌錢，佢話：「我就快結婚啦，所以要出碟籌錢。」對於有傳好友張栢芝喺加拿大安胎，Eric話：「收唔到消息喎，我估冇，但希望佢有BB，因為都想Lucas有個細佬或者妹，冇咁悶嘛。」
20090904-84,20090904,84,馮仁昭四圍超：James祝Kama覓真愛 - 馮仁昭,馮仁昭四圍超：James祝Kama覓真愛 - 馮仁昭 男子組合Square同師妹林司敏（中）日前喺卡拉OK搞咗個校服派對，有50幾位fans參加，十足開學禮！問到成員之一嘅James（左二）點解唔叫埋前緋聞女友羅凱珊（Kama）嚟玩？佢話：「其實近來大家都好忙，所以冇乜聯絡。」係咪因為Kama被指識咗個有錢少爺而疏遠佢？James話：「呢啲係人哋私事，如果Kama真係搵到真愛，我絕對會祝福佢。」
20090904-85,20090904,85,澳門開騷　老婆唔到阿Lam失魂吉位握手,澳門開騷　老婆唔到 阿Lam失魂吉位握手 林子祥（阿Lam）和太極前晚聯手在澳門開騷，雖然是慈善演唱，但入座率只有6成，不少座位空空如也。當阿Lam興致勃勃走下台和觀眾握手時，一不留神竟走到「吉位」，阿Lam眼見唔對路立即快閃到觀眾堆前繼續握手，身手異常敏捷。 久未合作的林子祥和太極前晚在澳門綜藝館舉行「林子祥．太極同力齊心雙慶澳門演唱會」，雖然他們實力毋庸置疑，音樂會又是慈善籌款性質，但入座率卻麻麻，全晚只有6成滿座，猶幸觀眾反應尚算熱烈。甫開場由一班穿上bratop的女舞蹈員大跳熱舞，之後由太極打頭陣，再到阿Lam上場，其後雙方有合作crossover。 事後詐儍唔認 阿Lam演唱一曲原本和老婆葉蒨文（沙麗）合唱的《選擇》時，由於當晚沙麗未有到場，他笑說：「唱情歌梗係要搵對象，但我個對象唔喺度，有冇人想同我合唱？」有位女fans隨即舉手，但她的廣東話不太純正，女fans說：「我識少少。」但卻把「識」講成「死」，阿Lam在旁也忍不住發笑。 唱至中途，阿Lam興起走落台和觀眾握手，未料他一不留神竟走到一排「吉位」處，阿Lam眼見前面沒有觀眾才如夢初醒，立即快閃走到另一邊和其他觀眾握手。事後慶功時提到觀眾比較慢熱，太極眾人說：「開頭係有啲，但後來OK，都好熱呀。」問阿Lam走到吉位時有何感覺？他即詐儍扮懵說：「吓，係咩？唔覺喎。」記者指座位空空如也，阿Lam續說：「係咩，唔知，唔覺，我投入嘛。」太極竟出口笑窒阿Lam：「係喎，冇人你都握咁耐。」 讚太極變乖巧 至於老婆沙麗為何不來捧場？阿Lam說：「佢自己有嘢做，要打波，遲啲要比賽。」阿Lam和太極不約而同表示希望再有機會合作，阿Lam大讚各人比以前乖巧，問到他們以前如何百厭？阿Lam笑笑口說：「總之家成熟，唔遲到、唔甩音，好乖囉。」前晚適逢鬼節，太極笑稱當晚尾段時又斷線、煙花效果又出錯，覺得很邪。 採訪：胡比　攝影：彭琮然
20090904-86,20090904,86,16歲學生贏加國亞姐,16歲學生贏加國亞姐 亞視《2009亞洲小姐競選》將於下月中舉行準決賽，決賽則定於11月1日舉行。至於亞姐加拿大區決賽已於上月30日在多倫多圓滿結束，冠軍為年僅16歲的中學生盛安，亞軍和季軍分別為19歲大學生林麗雅和左亮，二人巧合地就讀同一間大學。 當晚請來1989年亞姐亞軍萬綺雯擔任特別嘉賓，同樣來自加國的08年亞姐亞軍顏子菲則為冠軍盛安進行加冕。 請假來港參賽 三位加拿大賽區得獎者稍後將來港參加下月中的亞姐準決賽。不過，年僅16歲、從小由杭州移民加國的冠軍得主盛安，原在本月入讀當地中學第12班，但為來港鬥靚，她要特地向學校請假參賽。撰文：林妃
20090904-87,20090904,87,陳麗雲變身潮爆達人,陳麗雲變身潮爆達人 今屆金像獎最佳女配角得主陳麗雲自從奪獎後，工作量增加不少，近日她獲有線娛樂台節目《JohnnyB.Good》邀請，擔任新環節《最潮爆》的主持之一，她更會變身做潮爆達人，與另一主持人陸浩明到處發掘潮爆玩意。 野戰感新鮮 日前兩人親到wargame場作比試，自言一把年紀的麗雲姐原來也愛新鮮事物，她笑說：「打wargame真係幾好玩，陸浩明成日都讓我，所以我先可以勝出。我仲有試整家最興嘅變色gel甲，等自己有一個新潮look。」 陸浩明就自爆起初有意考考麗雲姐的潮流知識，刻意在她面前講潮語，希望可以刁難她，殊不知麗雲姐滿口潮語，即時令陸浩明甘拜下風。 撰文：林妃
20090904-88,20090904,88,父子屋企鬥好戲郭晉安禁B仔睇劇,父子屋企鬥好戲 郭晉安禁B仔睇劇 郭晉安在無綫劇《古靈精探B》要與只有8個月大的BB演對手戲，對他而言一點難度也沒有，因他訓練有素，常與歲半大的乖仔Brad鬥演技。安仔更自爆不准囝囝看劇集，怕他變老人精。 無綫劇《古靈精探B》中的B仔，遺傳了爸爸郭晉安的超能力，協助父母查案。很多演員都怕與小朋友做對手戲，但已是爸爸級的安仔卻大無畏，因他家中有個歲半大的小霸王，經常與他鬥戲。 安仔提起兒子便一副冧樣說：「我喺個仔面前成日笑，因為我想佢知道開心嘅感覺，不過如果佢扭計，我會扮喊，個仔個樣就會好似怕怕咁，其實佢知道係唔開心嘅表現，有時囝囝都會對住我哋假笑，咁我就會同佢講唔好對住爸爸做戲。」 怕變老人精 安仔自言與太太歐倩怡有共同的教仔方式，其中入門兩件事是十分同心的，一是不能體罰，二是不能看劇集，安仔笑言囝囝只能看卡通台，因為不想他失去童真，變成老人精。 為了在兒子面前做好榜樣，安仔自言改變很大，他以前是暴走快車黨，但如今卻是慢世魔王黨，他說：「以前成日被捉到炒牌、危險駕駛，家安全車速50、60公里，唔爬頭，唔違法，我計過數原來踩行油都只係快5分鐘，多謝個仔令我明白到安全嘅重要性。」安仔又笑言希望過兩年才添丁。 採訪：陳寶明 攝影：陳慧安 服裝提供：DKNY 場地提供：DKNY、西苑酒家
