key,date,article_daily_id,title,text
20090123-0,20090123,0,證監與新鴻基達成和解雷曼迷債原價回購,"證監與新鴻基達成和解 雷曼迷債原價回購 【本報訊】近月困擾本港金融市場的雷曼迷債風波，出現突破性發展。證監會昨晚突然公佈，與新鴻基投資服務（下稱新鴻基）達成和解協議，新鴻基將以原價向310名客戶回購所有迷債，預期涉及金額達8,500萬元。今次協議勢將對其他涉及迷債的銀行，在回購問題上構成重大壓力。記者：李嘉麟、劉美儀、高淑嫻 證監經調查後，昨晚就新鴻基自02年起向客戶銷售雷曼迷債涉及的內部系統及監控措施，對新鴻基作出譴責。該會同時宣佈，與新鴻基達成協議，新鴻基自願以原價，向合資格客戶全數回購他們手上未到期的雷曼迷債，並承諾在客戶回覆後30天內「回水」。 涉310客戶8500萬元 合資格客戶是指一般投資者，但四類客戶不在回購協議內，包括在二手市場買入迷債，而且之前從未透過新鴻基購買初次發售的迷債客戶；財務機構、承保人等專業投資者；已向新鴻基展開法律行動的客戶；以及已與該公司達成和解並已收取一筆超逾投資本金款項的客戶。  新鴻基金融昨晚表示，以不多於8,500萬元向310名客戶回購迷債，是最佳可行解決方法，並可為這件不幸事件作一個完結。集團執行主席李成煌表示，8,500萬元對集團財務狀況微不足道，回購行動將不會影響未來數年業務拓展計劃。  證監會行政總裁韋奕禮表示，對結果感到相當滿意，認為這符合投資者最佳利益。今次決定源於證監對新鴻基的調查，該會有四項關注：首先，新鴻基銷售產品前的盡職審查是否足夠；第二，對前線人員提供的培訓是否足夠；第三，評估迷債風險水平、向銷售人員人士傳達風險訊息、確保銷售人員與每位客戶的配對是否提供合理意見；第四，給予客戶投資意見及客戶提出的疑問備存紀錄等工作。新鴻基雖然確認這些關注事項的嚴重性，但和解協議下，不承認任何責任或過失，而在今次事件中，新鴻基沒有遭受任何紀律處分。  證監又要求新鴻基委聘獨立審計師事務所，檢討內部監控制度；若新鴻基在完成目前的改善工作後18個月內，證監再發現相同違規問題，性質又非常嚴重，證監將吊銷新鴻基部份業務的牌照，為期三年，即新鴻基在這段期間不得向客戶銷售或分銷非上市或結構性產品，以及向客戶提供這些產品的意見。  證監以四個月時間迅速完成新鴻基銷售迷債的調查，並與對方達成和解，可謂前所未有。市場人士指出，既然新鴻基涉及銷售問題嚴重性足以被釘牌，證監卻不立刻出手，容許新鴻基出錢和解，明顯有政治意味，把新鴻基個案變成一個解決事件的標準，預料經銀行買入迷債的苦主必然以新鴻基個案，要求銀行全額賠償。 對其他銀行構成壓力 對於新鴻基回購迷債會否對銀行相關個案構成賠償先例，銀行界消息認為，肯定構成一定「心理壓力」及輿論影響，亦擔心公眾將新鴻基個案視為示範作用，要求銀行加速與客戶的和解速度。  不過，消息稱，被譴責機構究竟存在那些具體系統及監控風險漏洞，當局未有闡釋，由於各銀行銷售程序與證券行或有不同，故難以一概而論，銷售銀行是否亦存在相同弊端，而要遭遇雷同判決。  隨着立法會研究雷曼迷債小組稍後將傳召官員作證，消息表示，證監會的公佈會否涉及政治含義仍待觀察。另一銀行界人士亦指，公佈凸顯了兩個監管機構處理上的分歧，若受責機構不認同證監最終判決，亦可採取司法覆核。  財經事務及庫務局發言人表示，港府會繼續檢討，進一步完善規管架構，加強對投資者的保障，有信心證監及金管局就雷曼個案，繼續公正、認真和迅速地進行調查。  截至今年1月7日，銀行與雷曼相關產品投資者自行和解個案，累計達1,517宗，涉及18間銀行，覆蓋投資額6.07億元，正洽商和解個案有1,638宗，涉及投資額6.36億元。根據去年10月底資料，本港雷曼相關產品投資額201億元，由去年10月17日起至今，金管局已合共轉介251宗雷曼相關個案至證監會，當中涉及15間銀行。 回購計劃合資格客戶條件 ＊透過新鴻基購入雷曼迷債  ＊持有雷曼迷債系列5至36當中任何未到期的系列  ＊未有在二手市場經新鴻基購入雷曼迷債，而且之前從未經新鴻基初次購入雷曼迷債  ＊非專業投資者  ＊並未向新鴻基展開法律行動，若已展開，須願意暫緩或終止法律行動  ＊並未與新鴻基達成和解及已收取一筆多過，或相等於投資本金的款項  資料來源：證監會"
20090123-1,20090123,1,政府又計錯數　財赤變盈餘,"政府又計錯數　財赤變盈餘 【本報訊】財金高官警告金融海嘯危機未過，市民勒緊褲頭準備迎接緊日子之際，庫房狀況原來相當不俗。據政府最新數據，截至去年12月政府賬目已出現小量盈餘，由於納稅人年初陸續進貢庫房，估計至3月底本財政年度完結時或會有盈餘，但財政司司長曾俊華認為要積穀防饑，無意慷慨「派糖」。 曾俊華稱要積穀防饑 曾俊華去年3月發表的預算案，估計本財政年度會有75億元赤字，然而最新數據再次顯示官員計錯數，具體數字稍後公佈。消息人士指出，政府賬目出現盈餘只是稅收滯後效應現象，因為過去兩年經濟情況大好，故公司利得稅遠超估計，但由於去年下半年經濟狀況迅速轉壞，因此估計未來一、兩年利得稅收會相應下降，屆時才真正反映金融海嘯對稅收的影響。  雖然出現盈餘，但消息人士稱曾俊華認為應該積穀防饑，因為政府估計經濟最壞的時刻，會在今年下半年至明年初出現，預算案策略是因應實際情況，採取針對性措施應付未來經濟困境，意味財爺不會大手筆「派糖」。  消息人士又表示，雖然截至去年底政府財政有盈餘，但有多筆龐大開支仍未入賬，故盈餘水平會下降，包括曾俊華在去年預算案提出，政府為月入1萬元或以下，約140萬名市民的強積金戶口，每人注入6,000元所涉及的90億元開支，所以本財政年度賬目最終會否有盈餘，目前仍有變數。  政府上月底公佈，截至去年11月底，本財政年度首八個月的赤字為93億元，政府發言人當時解釋，11月份的財政狀況得以改善，主要是由於利得稅收入賬，當時政府仍然看淡財務狀況及經濟前景，預計08至09財政年度的赤字會高於原來預算的75億元。 議員：不能濕濕碎幫市民 立法會議員李卓人指出，若政府最終財政狀況較預期佳，甚至有盈餘，財政司司長應有更大空間創造就業，應付未來一年可能出現的裁員失業潮，繼續以「濕濕碎」方式不能幫助市民；中文大學政治與行政學系高級導師蔡子強認為，政府一直以財政欠佳為由，不肯接納各黨派增加開支建議，若最終真的有財政盈餘，政府很難有藉口拒絕動用開支創造更多職位，否則來年預算案難獲議員通過。 12月份政府財政狀況與最終結餘比 2008年12月  盈餘：有盈餘但未公佈數字　最終盈餘：估計（赤字75億元）    2007年12月  盈餘：356億元　最終盈餘：1,156億元    2006年12月  盈餘：58億元　最終盈餘：551億元    2005年12月  盈餘：（赤字60億元）　最終盈餘：41億元    註:最終盈餘為預算案公佈的全年度數字  資料來源：政府新聞處"
20090123-2,20090123,2,四民航燃油附加費減44-50%旅業籲取消徵費　與內地看齊,四民航燃油附加費減44-50% 旅業籲取消徵費　與內地看齊 【本報訊】民航處批准國泰航空、全日空、尼泊爾航空及新加坡航空四間公司調低客運燃油附加費，新收費短途航班最高為61元，長途航班最高為280元，減幅由44%至50%（見表），有效期為下月1日至3月31日。有旅遊業界人士指，油價已大幅回落，航空公司應盡快取消附加費，刺激市民外遊意欲。  民航處發言人表示，審批航空公司徵收燃油附加費時，已考慮需保障乘客利益及讓航空公司收回部份額外開支等因素，上一輪即去年11月底審視收費時，短途航班的附加費最高是108元，長途航班最高為499元。處方認為現時油價雖已回落，但航空公司收取燃油附加費的安排仍是國際做法，相比國際上其他航空公司的平均收費水平，本地航線所收取的已維持在較低水平。 油價回落至04年水平 香港旅行社協會主席胡兆英稱，附加費不應視為航空公司恒常收入，04年航空公司因油價上升壓力龐大，為補貼營運開支開始徵費，但油價現已回復當年約40美元一桶的水平，徵費因素已不存在，故應盡快取消附加費。他表示，市民由今日起購買2月以後的機票，只需支付已調低的附加費，但之前已購買的機票，航空公司不會退回差價。  現時約有56間航空公司收取附加費，民航處每隔兩個月會審視航空公司調整客運燃油附加費的申請。香港旅遊業議會總幹事董耀中希望隨油價持續回落，處方應盡快於4月起，即下次審批申請時將附加費減至零，「國內航線本月中開始免收附加費，希望其他航空公司都可以咁做。」康泰旅行社總經理劉美詩相信，燃油附加費大幅下調，可刺激港人在春節後的旅遊淡季外遊意欲。 四間航空公司最新燃油附加費 航空公司：尼泊爾航空公司  *新收費：$250　現時收費：$499　減幅：50%    航空公司：全日本航空公司  *新收費：$61　現時收費：$108　減幅：44%    航空公司：國泰航空公司  〈短途〉*新收費：$61　現時收費：$108　減幅：44%  〈長途〉*新收費：$280　現時收費：$499　減幅：44%    航空公司：新加坡航空公司  〈短途〉*新收費：$61　現時收費：$108　減幅：44%  〈長途〉*新收費：$280　現時收費：$499　減幅：44%    *新收費有效期為下月1日至3月31日  資料來源：民航處
20090123-3,20090123,3,上月通脹勁跌至4.6%食品旅遊屋租價格同步下滑,上月通脹勁跌至4.6% 食品旅遊屋租價格同步下滑 【本報訊】經濟不景令物價持續下跌，本港上月綜合消費物價指數為4.6%，較對上一個月5.6%大幅下調一個百分點，主要因為食品、旅遊及私人房屋租金等下跌所致。政府估計，全球通脹壓力繼續減退，本港通脹壓力料在未來一段時間會同樣下降。  政府統計處昨日公佈上月（12月）消費物價指數，在剔除所有一次性紓困措施後，基本通脹率是4.6%，較11月的5.6%大幅下調一個百分點，主要是由於多個項目的價格下調或升幅收窄所致，包括食品、旅遊、私人房屋租金、汽油以及煤氣燃料調整費。當中食品（不包括外出用膳）的價格，在綜合消費物價指數的按年升幅從08年11月的14.9%放緩至12月的11.5%；旅遊及汽油的相應升幅亦分別從10.3%放緩至1.0%，以及從-4.1%下調至-14.7%。 未來數月或跌至2% 政府發言人表示，上月通脹壓力明顯緩和，反映食品價格通脹繼續回落，能源價格下跌和總體需求減弱。隨着國際商品價格回軟以及環球經濟同步下滑，全球通脹壓力將繼續減退，本港通脹壓力在未來一段時間將會同樣下降。  嶺南大學經濟系教授何濼生表示，租金及食物價格不斷下跌，加上美元強勢，令輸入本港貨物價格較平，相信本港通脹率未來一段時間會持續下跌，估計未來數月消費物價指數有機會跌至2%。
20090123-4,20090123,4,失業打擊　男吊頸死　女燒炭亡社工籲積極面對　尋求協助解鬱結,失業打擊　男吊頸死　女燒炭亡 社工籲積極面對　尋求協助解鬱結 【本報訊】特首推出七項製造就業的鴻圖大計，可是，兩名失業多時的男女卻無意靜候「佳音」，昨日疑因失業困擾感到生無可戀，分別在葵涌大廈梯間吊頸及在屯門住所燒炭自殺死亡。有社工表示，現時失業是世界性經濟問題，並非因個人問題及個人能力導致，呼籲失業者要積極及樂觀面對。 記者:陳天華　江寶龍　梁維建 在葵涌吊頸死亡男子杜志信（38歲），與姓程內地妻子同住深圳，他原為貨櫃碼頭搬運工人，較早時失業，之後一直經濟拮据；他曾多次到勞工處找工作，但都無功而還，更令他沮喪的是妻子要與他離婚，在雙重困擾之下，杜近日情緒低落。 曾透露找不到工作 早前，杜到葵涌邨秋葵樓姓程姨仔家中借宿。據其姨仔表示，昨凌晨3時，杜曾透露失業多時找不到工作感到很不開心，並透露想尋死，其後黯然離開，她當時未有為意。  至昨晨7時半，街坊發現有人在秋葵樓29樓與30樓的梯間，用衫掛在近天花的去水渠吊頸自殺報警，消防員接報到場將事主解下，證實經已死亡。死者身上並無證件及遺書，警方事後拿着死者的相片逐家逐戶調查，終尋獲其親人確認身份，調查後相信他是自殺並無可疑。  而燒炭自殺女子姓蔣（24歲），與父母同住屯門新圍苑新珮閣一單位，據悉，她去年中開始失業，一直未能尋獲工作，近日顯得悶悶不樂，但未有向家人提及輕生念頭。前晚女事主疑不堪失業及感到生活不開心，一時想不開，悄悄在房內寫下遺書，並以膠紙封閉門窗罅隙，然後燒炭自殺。 遺書稱生活不開心 至昨晨10時許，蔣女的55歲父親起床後，發現平時早起的女兒仍未出房覺得奇怪，他多次拍門沒有回應，於是開門查看，赫見女兒倒卧床上昏迷；房內瀰漫濃烈的燒炭氣味，並見床邊有一個滿炭灰的器皿，蔣父大驚報警，惟救護員到場證實她已氣絕身亡。  警員在現場撿獲遺書，內容大致謂生活不開心，仵工稍後將女事主屍體移送殮房，等候法醫官剖屍確定死因。  香港家庭及事業發展服務訓練總監司徒漢明，對兩男女因失業自殺死亡感到遺憾及可惜。他表示，工作是人生的重要一環，現時失業是世界性經濟問題，並非個人問題或個人能力導致；很多人均無法避過，只要積極及樂觀面對，可進修重新裝備自己再尋找出路，亦可找社工等專業人士傾訴及協助，盡早解開心中鬱結，以免走進死胡同。家人及親友的支持鼓勵，亦是協助事主度過困境的良方。 男子吊頸示意圖 女子燒炭示意圖 你想知　想講　想問? 如果友人透露受失業困擾，你會怎樣開解?    請即上《蘋果》網頁 http://appledaily.atnext.com留言喇！   或電郵至：mailto:focusgroup@appledaily.com  傳真：37112411  手機短訊：63836568
20090123-5,20090123,5,夫妻牽手跳樓案　目擊者盼調遷,夫妻牽手跳樓案　目擊者盼調遷 【本報訊】葵涌邨芷葵樓夫婦前日牽手跳樓自殺身亡慘劇，警方調查發現男死者是物流公司東主，疑生意失敗欠親友債務20多萬元；妻子則是退職海關人員，患有情緒病。兩人都有自殺企圖，至於是誰教唆誰，遺書則沒有透露。有目睹事件的街坊感到恐慌，要求調遷。 男死者物流公司東主 男女死者分別是54歲的羅自平及47歲的崔麗琼，據稱兩人均是再婚，羅與前妻育有一名30歲兒子；崔則與前夫有一名23歲兒子。昨日一早，男女死者家人先後到達葵涌公眾殮房辦理認屍手續，雙方有交談，但顯然關係頗為生疏，各人亦沒有表現傷心激動的情緒，認屍後均沒有回應記者的提問便各自離去。  至下午2時許，羅自平兒子返回葵涌邨芷葵樓父親和繼母跳樓伏屍現場，放下祭品燃點香燭焚燒冥鏹及雙手合十拜祭，口中念念有詞，為兩名死者悼念，他逗留約5分鐘離去。  消息稱，羅自平原經營物流公司，但金融海嘯令各行各業艱苦經營，他生意失敗致債台高築，警方從他的親戚中獲知，他向親戚借了20多萬元，一直沒有清還。崔麗琼原海關工作，但因患上情緒病而離職，並需長期服藥和覆診。 兩人危坐時曾被勸喻 前日傍晚6時許，羅自平及崔麗琼在家中留下「我倆都沒有任何朋友」的遺書後，雙雙攀窗從36樓跳下當場慘死。在他們跳樓前，住在下一層一名男住客見兩人危坐窗邊，曾出言勸喻，結果親眼目睹兩人跳樓的慘況。該名住客事後致電區議員講述事件，並謂覺得「好驚」，要求協助向房署申請調遷。
20090123-6,20090123,6,醫管局首份嚴重醫療事故報告公院一年內25病人自殺亡,醫管局首份嚴重醫療事故報告 公院一年內25病人自殺亡 【本報訊】醫院管理局公佈首份嚴重醫療事故周年報告，在07年10月至08年9月期間，公立醫院累積44宗嚴重事故，比率為每100萬宗出院或死亡病人中，有2.7宗嚴重醫療事故；最常見為病人自殺，有25名病人在住院或離院期間自殺身亡，其次是手術時在病人體內遺下異物。病人權益組織批評，醫管局去年曾承諾改善防止病人自殺的措施，數字反映有關改善建議，很多時未能在前線落實。  醫管局在07年10月實施嚴重醫療事故通報機制，一年內累積44宗嚴重事故，出事比率為每100萬宗出院或死亡病人中，有2.7宗嚴重醫療事故，首三位常見事故依次為25宗病人自殺死亡個案；其次是10宗在手術或外科程序後，在病人體內遺留工具或異物，病人需再接受另一次手術；第三位是調錯病人或搞錯治療位置，有五名病人受影響。餘下失誤包括嬰兒失蹤、輸血及孕婦分娩失誤等。 推出多項預防措施 報告顯示，留院病人放假回家是自殺的高危期，25名自殺死亡病人中，逾七成是在此段時間在家中自殺，只有約一成人是在醫院自殺。死亡病人中，12人有精神病史，餘下是長期病患者、癌症病人或身體有殘障。  醫管局行政總裁蘇利民表示，已推出多項措施預防嚴重醫療事故，包括引入二維條碼技術輔助確認病人身份，目前正研究全面落實手術前核查措施，防止混淆病人身份，或搞亂手術及外科程序的身體部位。 團體呼籲訂立罰則 社區組織協會病人權益幹事彭鴻昌批評，醫管局預防病人自殺措施一直未見改善，「頭半年有12個病人自殺死亡，後半年有13宗，如果醫院做咗嘢，就唔會多咗病人自殺死，可能有啲措施仲未可以係前線落實。」他指嚴重事故通報機制不重視犯錯員工的懲處問題，容易令公眾覺得「查完一輪都無下文」，並未有吸取事故的教訓，呼籲局方增加調查的透明度，並訂下公開及公平的罰則。 醫管局嚴重醫療事故小統計 事故：住院病人或出院病人自殺死亡  總數(宗)：25    事故：在手術後，遺留工具或物件在病人體內，令病人需進行另一次手術  總數(宗)：10    事故：涉及混淆病人或身體部位的手術或外科程序  總數(宗)：5    事故：溶血性輸血反應  總數(宗)：1    事故：孕婦分娩期間死亡或出現嚴重併發症  總數(宗)：1    事故：嬰兒被擄走或將嬰兒錯交他人  總數(宗)：1    事故：無預期的死亡或嚴重傷害  總數(宗)：1    總數：44    註：覆蓋時間介乎07年10月1日至08年9月30日  資料來源：醫管局嚴重醫療事件周年報告
20090123-7,20090123,7,壓紙機壓碎少東手掌,壓紙機壓碎少東手掌 【本報訊】新蒲崗一間廢料回收店的少東，昨午將一批廢紙放入壓紙機內壓縮時，疑與操作壓紙機的工人有誤解，右手掌慘被突然壓下的油壓板壓至血肉模糊；工人見狀立刻升起油壓板及報警，將少東送往醫院進行接駁手術，但因手掌骨被壓至嚴重碎裂，相信駁回機會甚微。 疑工人誤解肇事 少東姓梁(24歲)，右手掌嚴重骨折，用紗布包紮住手掌傷處，由救護員用擔架床送院時神情痛楚。現場為新蒲崗三祝街18號B地下一間五金回收廢料店，近店門位置裝有一部壓紙機，將廢紙放入機內可將廢紙壓成綑狀。  事發昨下午4時許，少東與一名姓黃(52歲)工人合作處理一批廢紙，黃站在壓紙機前方負責操控，少東則站在壓紙機右邊位置，將廢紙逐批放入壓紙機內，黃按掣令油壓板將廢紙壓扁。當少東將一批廢紙放入壓紙機後，用右手整弄機內的廢紙時，疑姓黃工人以為少東已將手從機內取出，按掣將油壓板降下，少東始料不及未能縮手，右手掌慘被油壓板壓個正着。  少東手掌被壓至劇痛大聲呼叫，姓黃工人聞聲始知出事，馬上將油壓板升起及報警。有目擊者稱，出事時先是聽聞一聲慘叫，循聲查看，發現少東右手掌被壓在機器內，未幾見他從機器中拔出右手，戴着的勞工手套全是鮮血，十分恐怖。警員及消防救護員接報到場，為少東包紮血肉模糊的右手掌，隨即將他送院搶救。 壓碎修復機會微 急症室專科醫生彭繼茂表示，手掌骨被壓碎可否駁回，先要看創傷的嚴重性，例如拇指能否保住，其次是壓傷的時間性，可否盡快送往醫院做手術，因越長時間送抵醫院，傷口受細菌感染的機會越大，而手掌有骨骼、血管、神經系統及肌肉互相牽引。  他續指出，骨骼受損可從身體其他地方取骨進行接駁，要看手掌受傷嚴重性；若手掌是壓碎式的創傷，破壞非常嚴重，大多數修復機會很微，除接駁手術難度高外，就算可駁回康復機會也很微。
20090123-8,20090123,8,王廷歆為訴訟費入稟高院,王廷歆為訴訟費入稟高院 【本報訊】華懋集團前主席龔如心的千億遺產爭奪戰，昨有新發展。一直行蹤隱秘的龔如心家翁王廷歆，終於出招，昨入稟高等法院，要求頒令打官司的訟費，可由龔如心遺產扣除，以令自己不論輸贏，都能立於不敗之地。 擬聘更多大狀爭產 對於打官司「入新抱數」，代表王廷歆的律師林文惠昨對本報指，早前已向訴訟各方提及此事，法庭已排期在3月4日進行聆訊，若屆時無人反對，法庭又接納申請，便會作出頒令。  至於申請頒令的原因，林文惠坦言擔心訟費昂貴，是原因之一。而王廷歆已計劃除了資深大律師莫樹聯，還會聘請更多大狀，以出席4月的千億爭產案。  龔如心於07年患癌去世，留下千億遺產，兩份遺囑。02年一份做慈善，06年一份卻將一切遺產留給曾任風水師的億萬富豪陳振聰。以龔家及華懋老臣為首的華懋慈善基金，懷疑龔如心受騙，展開訴訟後，王廷歆也加入戰團，聲稱不論那一方取勝，按遺囑的條文，他也可分一杯羮。  林文惠昨表示，王廷歆雖已年屆97，有少少老人病痛，但精神頗好，而王對訴訟充滿信心，雖緊張進展，但不會親身到庭。  據了解，王廷歆與第二任妻子張惠莉一直隱居新界區。自06年主動約見傳媒，揚言不會交代誰人資助他與龔如心打官司後，王廷歆便再沒露面。龔如心死後，遺產凍結。自稱與龔如心相戀14年的陳振聰，便負起供養兩老的責任。  案件編號：HCMP132/09
