key,date,article_daily_id,title,text
20090503-52,20090503,52,30份郵差筍工爭崩頭,"30份郵差筍工爭崩頭 【本報訊】失業率升不停，郵政署向中四學歷或以上人士招手，現正公開招聘30個郵差筍工，屬公務員鐵飯碗，月薪超過一萬元。郵政署說反應非常熱烈，過去幾天已收到逾千人申請，預計5月8日截止時，申請總數會突破前年1.2萬人的紀錄，掀起新一輪求職狂潮。 中四學歷起薪萬元 郵政署現有2,960名郵差及300多名高級郵差，該署統計今年內有30個郵差空缺需要填補，遂於上周起公開招聘。郵差的起薪為10,845元，表現良好每年可獲一個增薪點，最高可增至頂薪18,885元。若晉升為高級郵差，月薪可跳升至19,835元，並獲每年增薪點至頂薪22,985元。 郵差申請資格只需具中四學歷，其中包括中國語文及英國語文。申請面試時要接受簡單測試，要背起和拉動一個標準郵袋，約重15至16公斤，以及眼與手部協調的揀信測試。郵政署於07年曾為100個郵差空缺公開招聘，當時吸引逾1.2萬人申請，平均120人爭奪一個職位。 郵政署發言人說，今次申請反應明顯更熱烈，首數天已接獲逾千份申請，越近截止日期，收到的申請越多，相信申請人數會創出新紀錄，而且前年招聘的空缺較今年多，相信今次招聘競爭會更加「爭崩頭」。 郵件總數跌幅不大 郵政署發言人又說，雖然現時很多人已使用電郵溝通取代信件來往，但近年商業郵件數量大增，佔郵件數量九成，例如銀行月結單，令郵件總數跌幅不大。金融海嘯對郵件數量也影響輕微，郵政署發現去年底特快郵遞減少，但空郵掛號增加，估計是市民或中小企由原本使用郵費較貴的特快郵遞，改為用較平的空郵掛號。因此，在派遞量無大減的情況下，郵差編制不會減少。 郵差招聘資料 名額：30個 月薪：起薪10,845元，頂薪18,885元 晉升機會：可晉升為高級郵差，起薪19,835元，頂薪22,985元 學歷：完成中四課程 截止申請日期：5月8日 查詢電話：29212218/29212587 資料來源：郵政署"
20090503-53,20090503,53,野鴿屍體證實帶H5N1,野鴿屍體證實帶H5N1 【本報訊】本港正受豬流感和禽流感夾攻，漁農自然護理署昨公佈，上月27日在屯門良德街撿獲的一隻野鴿屍體，證實帶有H5N1禽流感病毒。今年首四個月染禽流感死亡禽鳥已累積至13隻。 漁護署在上周三已公佈該野鴿屍體對H5病毒呈陽性反應，在進一步測試後，證實帶有可傳給人類的H5N1禽流感。該署提醒市民，為免野鴿聚集造成環境衞生問題，市民不應餵飼，食環署、康文署會繼續向餵飼野生雀鳥而弄污公眾地方及公園的人士採取嚴厲的執法行動。 今年已撿獲13隻 市民如發現病鳥和死鳥，包括野鳥和家禽屍體，可致電1823電話中心聯絡漁護署跟進，市民應避免接觸野生雀鳥、活家禽及其糞便，並應在接觸過禽鳥後徹底洗手，進食的家禽肉類和蛋應徹底煮熟。 連同這隻野鴿屍體，今年已撿獲13隻帶有H5N1禽流感的禽鳥屍體，比去年全年撿獲7隻多出近倍，但少於06及07年的17和22隻。
20090503-54,20090503,54,美減肥丸傷肝須回收,美減肥丸傷肝須回收 【本報訊】在美國每年銷售100萬樽的減肥健康食品「快纖燃脂丸」（Hydroxycut），被指損害人體肝臟與健康，懷疑導致最少一人死亡。美國食品及藥物管理局（FDA）前晚警告消費者即時停用後，生產商宣佈回收14種相關產品。由於健康食品不含藥物成份，毋須向本港衞生署註冊，署方不肯定有否在本港出售。 美國食品及藥物管理局上周五晚表示，快纖燃脂丸的加拿大生產商已宣佈全面回收14款相關產品。 不含藥物毋須註冊 該局官員指出，由於有研究發現，快纖燃脂丸會損害肝臟及影響健康，並已導致最少一人死亡，於是呼籲消費者應該立即停用。快纖燃脂丸標榜由天然成份製造，可以減肥及改善身體線條美，在北美甚受減肥人士歡迎。 快纖燃脂丸不含藥物成份，毋須向本港衞生署註冊，暫不肯定本港是否有售。該署發言人表示，會密切留意情況。記者在部份網上討論區發現，有網民討論該款食品的減肥成效，相信有市民透過網上訂購及在港服用。 香港藥學會會長鄺耀深指，不清楚該款減肥食品有否在港發售，但若不含藥物成份，很難追蹤及監察，「普通美容院都可能買到。」
20090503-55,20090503,55,專家不敢低估殺傷力,專家不敢低估殺傷力 【本報訊】雖然本港首名豬流感病人病情輕微，至今沒有肺炎，其密切接觸者初步對豬流感化驗結果呈陰性；但有政府及微生物學家表示，現階段評估病毒殺傷力言之尚早，「呢個病人冇事唔代表其他人冇事」，抗疫不能掉以輕心。 患者病情不盡相同 據悉，雖然暫時該豬流感患者病情輕微及未有證實傳染其他人，但政府初步評估認為，每次流感傳播都有快和慢之分，不排除會再有個案出現。流感患者病情一向有不同程度，可由沒有病徵，至有輕微病徵甚至死亡，主要視乎病人的抵抗力，「呢個病人冇事唔代表其他人冇事」。 港大感染及傳染病中心總監何栢良表示，流感病毒有很多不可預測的行為，本港只有一個個案，不能斷定病毒毒性強或弱。今次豬流感傳入本港時間，幸好並非流感高峯期，並非適合流行病傳播的季節，但若疫情持續至7至8月夏季流感高峯期，則控疫較困難。 他又指，政府應加強邊境防疫措施，甚至在來自豬流感疫區的航班上，向每名乘客派發口罩，要求他們抵港後戴口罩七天。市民乘的士時，可盡量選擇有戴口罩的司機。
20090503-56,20090503,56,與友行山　獨自走進樹叢遭刺傷城大講師被困東龍島,與友行山　獨自走進樹叢遭刺傷 城大講師被困東龍島 【本報訊】香港城市大學一名講師，昨日與友人往東龍島行山，但他走入叢林中迷途，雙手被荊棘刺傷，被困個多小時後，終於報警求助。飛行服務隊直升機到場將他救起，送往赤鱲角飛行服務隊總部，他事後拒絕送院。　記者：黃學潤 遇事的王煒文（55歲），是城大建築科技學部講師。據王表示，他有30多年建築經驗，在城大任教10多年，雖然並非經常行山，現時每年只有一兩次，但因工作需要不時巡地盤，所以身體狀況良好。 飛行服務隊救人 在西貢清水灣郊野公園對開的東龍島（又稱東龍洲），是本港著名旅遊點，島上有炮台及東龍石刻名勝，同時也是攀石勝地。王煒文表示，他20年前曾來過東龍島遊覽，今次約同10名友人及同事舊地重遊。昨晨10時許，一行人抵達東龍島，他們各自玩樂，有人釣魚及打麻雀，他則聯同4至5人行山。 王煒文說，東龍島的山頂高約200多米，他一馬當先走在前頭，「我行吓行吓，望返轉頭唔見晒佢哋（友人），原來佢哋行到一半就行番落山」，王獨自往前行，步行到山頂的直升機坪後，因為想觀賞魚排的景色，沒有循原路下山，而是鑽進一處樹叢。 「我行來行去都出唔返嚟，雙手仲俾荊棘刺傷」，王說，他被困於樹叢中，兜兜轉轉個多小時，仍無法走出樹叢，於中午12時許，他惟有報警求助。水警、消防及飛行服務隊先後與他聯絡，約40分鐘後，飛行服務隊直升機到場，王返回停機坪登機，被送往赤鱲角飛行服務隊總部。他表示，由於雙手傷勢輕微，所以拒絕送院，他也有向同伴報平安，對今次行山被困並無恐懼。 友峰會會長梁榮亨指出，東龍島的山路甚為易行，正常情況行走應不會迷路，「停機坪雞乸山嗰邊樹叢冇路行，入咗去好易出唔返嚟」，他認為，市民應結伴行山，同時不要冒險行入樹叢，免生危險。
20090503-57,20090503,57,消防15分鐘救貓女,消防15分鐘救貓女 【本報訊】一隻俏皮三色貓昨晨爬至屯門仁政街一幢大廈的外牆，不慎楔在外牆與水管之間的隙縫，動彈不得。愛護動物協會人員乘消防雲梯，輕易將貓兒救起，送交獸醫檢驗。 被困三色貓長約一呎，雌性，已接受絕育手術，一邊耳端被剪去，是愛協貓隻領域護理計劃下的貓兒，牠有義工餵飼。 現場是仁政街31號屯門中心大廈，昨晨8時許，有市民發現三色貓爬至1樓與2樓外牆牆身與膠水管之間的隙縫，於是致電愛協。愛協人員到場視察環境後，召消防員開動雲梯協助。各人準備就緒，卻令三色貓受驚意圖逃跑，愛協人員成功將牠捉住放入網內帶走，耗時僅15分鐘。有圍觀市民拍手稱讚，也有市民批評「勞師動眾」騷擾貓咪玩樂。
20090503-58,20090503,58,單車手撞樹枝跌傷,單車手撞樹枝跌傷 【本報訊】16歲姓林少年昨午4時騎單車，沿馬鞍山錦泰苑對開的單車徑遊玩，途中突然禍從天降，旁邊一棵高30多呎的大樹，其中一截直徑半呎、長10多呎的枝椏連分枝和樹葉，疑早前受蟲蛀腐爛突告折斷，當場拍落單車徑上，雖無壓傷路人，但少年的單車衝至，收掣不及，撞向斷枝致連人帶車翻側，少年手腳擦傷。報警後，警員將斷枝移往一旁，交清潔工人運走，傷者由救護員送院治理，幸傷勢不算嚴重。事後傷者致電家人報平安。
20090503-59,20090503,59,中大女生飲酒服藥圖自殺,中大女生飲酒服藥圖自殺 【本報訊】患有情緒病的中文大學女生，昨日懷疑病發，在宿舍用酒送服藥物企圖自殺，同學發現報警將她送院。校方聯絡女生家人，並向她提供協助。 企圖自殺女生姓尹（21歲），現場為中大新亞書院志文樓學生宿舍，警方指出，尹女患有情緒病。昨午2時許，她在宿舍房間內飲酒服藥，並且致電同學，聲稱很不開心，同學發覺有異立即報警。警方及救護員到場，發現尹女仍然清醒，事後將她送院治理。 中大發言人指出，該名女宿生因為身體不適，由同學發現報警，同學及導師陪同該女生送院，宿舍舍監很關心該女生情況，稍後到醫院探望。校方已通知家人，並向女生提供協助。
20090503-60,20090503,60,餐廳電線短路起火,餐廳電線短路起火 【本報訊】旺角洗衣街一間餐廳昨晨閉門失火，消防員接報到場破門入內灌救，瞬即將火救熄，調查後證實是電線短路所致，樓上30名居民疏散落樓，無人受傷。 現場是洗衣街125號地下一間餐廳，昨晨9時許，居民發現餐廳後巷冒煙，於是報警。當時餐廳還未開門營業，消防員到場要破門進入，開喉灌救迅速將火種撲滅，經調查證實是廚房電線短路，火警無可疑，餐廳熏黑，已經通知負責人善後。大量黑煙湧出，樓上30名居民自行疏散。
20090503-61,20090503,61,社運音樂人用音符悼念《6420》CD延續六四歌聲,社運音樂人用音符悼念 《6420》CD延續六四歌聲 每年的六四集會，市民用燭光、口號和歌聲悼念，但有沒有留意，每年那夜唱的總是那幾闋歌？《祭英烈》的淚眼20年來仍在維園裏凝望，年月也不會蠶蝕《自由花》……感情似凝固在89年的時空。一班社運界音樂人感到事隔多年，許多人感受在變，特別將多年來寫成的民運新歌灌錄成《6420》CD，將這感受與公眾分享。　記者：雷子樂 鼓手、監製Edmund： 「歷史唔一定要用血寫」 梁卓堃（Edmund）是《6420》的監製、鼓手兼錄音。89年，26歲的他「踎」在暗無天日的酒樓廚房做點心。軍隊開槍一刻，Edmund剛下班，與一班「廚房佬」去看脫衣舞。這邊廂脫衣舞娘在表演，旁邊的電視機正播放士兵屠城的片段。「sexandviolence，眼前兩樣嘢都好赤裸裸」。 沒有義憤填膺、沒去「爆樽」聲討鄧小平，Edmund當時只在想：「單嘢關唔關我事？點解感覺好抽離，又好似好親近？」他7歲已移民加國，酒樓點心部裏都是中年同事，許多人經歷過文化大革命，「個個當正自己係政治家」，「個個都話共產黨開槍唔X出奇，係呢次好彩畀記者影到。」但Edmund覺得事情不是這樣簡單。 89當年他寫下《2023》一曲，記下這種既痛苦，又遙遠，似遠離戰場，卻又像被關進了無形監倉的無力感覺。這相信是歷來僅有的89民運英文歌。「寫歌時心態好無奈，怕遲早有日，會有啲嘢會唔記得咗。」六四後香港人怕得爭相移民，他卻「反潮流」回流香港。Edmund說，受六四衝擊，更多香港人開始懂得去質疑身邊的事，覺得要為中國做點事。回港後，Edmund曾擔任黃秋生、樂隊朱凌凌、Blackbox等的監製。喜歡的，都是像Blackbox的《無能用者》、《泥工》等一類寫中低下階層的歌。但這另類音樂人認為：「六四其實播乜歌都得，可以播梅艷芳都得，但係可唔可以唔好再播《血染的風采》呢？歷史，唔一定要用血去寫。」 主音、結他手阿班： 「對六四嘅感受唔同咗」 「一曲好歌對運動好重要，當20萬人一齊唱givepeaceachance，你睇番錄影帶，都仲係好震撼！」阿班是社運樂隊噪音合作社主音。她引用魯迅名言「不在沉默中爆發，就在沉默中滅亡」及《紀念劉和珍君》等文章，寫成新歌《飛鳴》。劉和珍是民國初年的愛國學生，因遊行被段祺瑞政府開槍射殺。 她希望用魯迅的文字，去表達對六四的感受。「如果魯迅翻生，都會畀共產黨再激死。」每年燭光集會，來來去去都是那幾首歌；阿班說歌曲不錯，但20年不變，大家對六四的感覺似乎凝固在當年的時空。「就算你要播《血染的風采》，可唔可以改吓個編曲呢？咁多年，大家對六四嘅感受都會唔同咗。」 六四時阿班讀中三，同學們自發寫標語，在校園內四處張貼。89民運對她有深遠影響，「當時讀大學上莊要傾係咪承認新華社」。大學生會返內地了解民工、農民的生活黑暗面、參與爭取校政民主化，在生活中實踐六四精神。 20年來，六四讓阿班認清許多人的真面目，「當日參與民主歌聲獻中華嘅歌手，仲有邊個敢企出嚟？」 主音、結他手Billy： 從前舊記號新的憤怒 孔繁強（Billy）是噪音合作社主音。20年前，Billy在沙田做社工，經常帶小組與青少年討論時事。《人民日報》發表「四二六社論」後全城怒吼，北京戒嚴後香港掛起八號風球，Billy與一班年輕人踏着單車巡迴全區，呼籲沙田居民遊行。當晚橫風橫雨，竟有200多名居民到場，齊躲在婚姻註冊處屋簷下，「唔知搞乜就過咗成晚」。 軍隊屠城，Billy邊開會邊看電視，激動得立即趕到新華社抗議。到場時已人山人海，市民各自分成小組討論當前局勢，有人認真的呼籲明早到中銀「攞錢」，一堆學生自成一角開會，一起「坐天光」。「當時嘅氣氛係人人都想為中國做啲嘢，但唔知點做，總之就行咗出嚟先。」 六四後，Billy繼續帶領青少年討論時事，直到91直選後才停下來，轉做勞工權益的工作。99年，Billy將沉澱內心的感覺，寫成《記號》一曲，「青春自有暗號，續舞步；從前舊記號，新的憤怒，流連繁華失笑千秋虛假」的歌詞，記下他對學生以璀璨青春去爭取理想的感受。 歌寫好了，但十年後才灌錄CD。Billy說，這是受早前城市大學評議會阻撓派發《六四特刊》刺激，「以前對六四有感覺，一直唔會主動講，但原來你唔講唔講，周圍啲嘢就會不斷變，城大特刊、陳一諤事件，變到你有啲驚。」眾多民運歌曲中，Billy最愛黑鳥樂隊的《朝陽孩子》，97年作品，當時正值香港回歸，「到咗一個轉捩點，佢哋用咗一個好陽光嘅手法去講六四」。他認為六四已發生20年，應讓大家以更多元的方式，在維園這平台去悼念。 《6420》CD收錄了《毋忘六四》、《拒絕遺忘》等九首歌曲及音樂，將隨5月份的文學雜誌《字花》免費派發，並會在六四燭光集會當晚義賣籌款。
20090503-62,20090503,62,測試六四知識團體派會考中史「補充題」,"測試六四知識 團體派會考中史「補充題」 【本報訊】明天是五四運動90周年，也是本港會考中國歷史的考試日。不曉得今年試卷會否觸及五四，肯定的是，不會有關於六四的題目。為了補充會考生對六四事件認識的不足，「P-at-Riot六四文化祭」明日向考生派發補充試題，叫莘莘學子毋忘六四。 不滿教科書自我審查 「家嘅中學會考中史科課程同教科書，好少六四資料，我哋覺得唔應該俾呢段歷史唔見咗。」梁御東是「P-at-Riot六四文化祭」成員，正為悼念六四20周年創作一連串活動。他明言，這份《中國歷史補充試題》試卷是要為現今着重歌功頌德的國民教育作反宣傳。 試卷由他與另一成員葉浩麟設計，半小時的題目，測試考生對八九民運中一些重要歷史人物及事實的認識，並要求考生發表對民運及六四屠城的觀點。梁御東不滿教科書商自我審查，對六四歷史的闡述越來越少：「認識六四有助我哋認識國家，一味唱好國家，點樣令國家改進？」 兩人花了兩星期設計試卷，打算今日在一些自修室派發給應屆會考生，重點則是明天中史科考試日。「P-at-Riot」預備了1,000份試卷，在試場外向完成考試的學生派發。試卷印有「P-at-Riot」網址，希望考生花點時間上網交卷。 梁御東說：「其實我哋都驚搞到佢哋（會考生），但係我仍然好期望考生交卷，答錯唔緊要，有興趣從中認識呢段歷史已經好好。」他又說：「五四同六四都係追求民主，都係年輕人對將來期望嘅表達，我哋設計呢份試卷，目的都係咁。」 補充試題題目舉例 問：89年北京學生控訴社會出現「官倒橫流」等弊病，「官倒」是甚麼？ 答：官倒是1980年代在中國大陸出現的詞彙，意指中國進行的經濟改革過程中，一些官員或官員的親屬，利用權力，從價格雙軌制等中牟取利益。 問：試論述「平反六四會動搖鄧小平的政策，社會和經濟結構會出現動盪。」這個觀點。 答：無標準答案 資料來源：P-at-Riot；答案部份由本報提供"
20090503-63,20090503,63,學者觀點民主化無可阻擋──胡耀邦的理念與主張,學者觀點 民主化無可阻擋──胡耀邦的理念與主張 楊力宇　美國西東大學教授 今年是鼓吹民主與科學的五四運動90周年，也是中共鎮壓六四民運20周年，北京非常敏感，因而持續鎮壓民運及維權運動，並逮捕甚多反對人士，惟恐六四前後出現各種抗議活動。 在八○年代，筆者曾先後分別與中共領袖鄧小平、胡耀邦及趙紫陽深入談話，但印象最深刻的則是胡耀邦。 在我們的談話中，胡耀邦痛斥中共歷史上的暴政。他痛批文革，認為此一運動為中國的政經發展及全民帶來空前的浩劫。他對中國人民所受的苦難展現無比的同情。他對民眾展現強烈的愛護及關懷。他是一位富有人性及同情心的領袖。對中共的某些暴政，胡耀邦實是痛心疾首。 在八○年代中，某些中共人士開始推動反資產階級自由化，批判某些具有自由主義意識及理想主義精神的知識分子（如方勵之），來勢洶洶。 胡耀邦的理念與主張 但在與筆者談話時，胡耀邦堅決反對反資產階級自由化，不但反對鬥爭這些知識分子，甚至表示對他們的同情。而更令胡耀邦憤怒的是當時的另一運動：反精神污染，他嚴肅地對筆者指出，華南一個美術學院的某些黨內人士竟然摧毀了一座美女的石膏像。他認為這些人士根本不知道欣賞藝術，他似乎也有一種無力感，無法阻止這些運動。 此外，胡耀邦對青年學生充滿同情心。當時甚多大專院校學生反對官倒、貪腐，要求民主，形成一股學潮，保守派力主鎮壓，胡雖反對，但卻無力阻止。 在與筆者談話時，胡耀邦透露了他的某些理念與主張： 一、他反對只推動經改，認為政經改革同步進行才是正確的道路。 二、他質疑「四項堅持」的說法，甚至對一黨專政似乎也有不同的看法。 三、對學生反對貪腐及要求政改，胡耀邦顯然充滿同情，反對鎮壓。 四、他強烈反對反資產階級自由化，同時也堅決反對反精神污染。 從胡耀邦的談話中，筆者發現他與鄧小平及黨內的保守派（如鄧立群）的矛盾日益嚴重，黨內並已出現倒胡運動，至1987年初，胡被迫辭職，兩年後（1989年）胡病逝。 鎮壓是下下策 六四民運爆發後鄧小平決定鎮壓，趙紫陽堅決反對，被迫辭職，被軟禁直至2005年病逝。 中共鎮壓六四民運後20年，仍然繼續鎮壓民主運動及維權運動，但鎮壓並不能解決今日中國面臨的內外問題。中共也不可能永遠實行一黨專政，永遠鎮壓民運與維運，蘇聯及東歐共產政權的崩潰應是殷鑑，民主化實是一股歷史性的、無可阻擋的洪流。 因此，逐步推動胡耀邦生前所主張的民主改革才是今日中國應有的方向。
20090503-64,20090503,64,20年前的今天　袁木否決對話　學生宣佈大遊行,20年前的今天　袁木否決對話　學生宣佈大遊行 1989年5月3日，首都青年集會紀念五四運動70周年會議，中共總書記趙紫陽、國家主席楊尚昆及國務院總理李鵬均有出席大會。趙紫陽發表講話，題為《在建設和改革的新時代進一步發揚五四精神》，認為最重要保持社會的穩定。 趙紫陽在講話中這樣形容五四運動：「吸引廣大青年和各界人民投入這次運動的最普遍最深刻的原因，是他們對國家危亡和民族命運的強烈關切，對建立一個真正獨立、自由、繁榮、富強的新中國的熱情嚮往……在民主和科學的旗幟下，那時的廣大青年開始用新的眼光看自己，看中國，看世界。」 趙紫陽發表五四講話 他說，中國宏偉艱巨的現代建設和改革的任務，只有在穩定而不是動亂的社會政治環境中，才能順利進行。他的「五四講話」提到當時的學運：「廣大群眾包括廣大學生希望推進民主政治，要求懲處貪污腐敗，發展教育和科學，這也是中國共產黨的主張。」 同日，國務院發言人袁木宣佈不與北大學生自聯會對話，認為學生背後有極少數人在挑動搞事。北自聯隨即決定翌日早上舉行「慶祝五四，為民請命」大遊行。袁木說，學生提出與某些級別人員平等談判，表現了學生相當程度的幼稚衝動。 他們曾這樣說 青年人要求發揮自己的潛能，實現自我的價值，這種積極性應當受到保護。 ——中共總書記趙紫陽在首都青年集會紀念五四運動70周年會議中發表講話。 悼念六四亡魂 王建平　27歲 北京市　煤氣公司南郊車隊司機 1989年6月3日夜，在西單路口左胸中彈，傷及肺，4日凌晨死於北京市急救中心。骨灰先安葬在京郊一位農民的地裏，後移至海淀區東升骨灰堂。王遇難時留下一對八個多月大的孿生女。 八九民運人和事：趙紫陽 1989年4月30日，中共總書記趙紫陽出訪北韓後回北京，準備出席5月3日舉辦的首都青年集會紀念五四運動70周年會議，並發表講話。該講話稿由鮑彤起草，經政治局和中央書記處審核，其間國家主席楊尚昆、總理李鵬等提出要在講話中加入「反對資產階級自由化」這句話，但遭趙紫陽反對，這舉動成為他日後下台的「罪狀」之一。
20090503-65,20090503,65,世謬中心 - 尊子,世謬中心 - 尊子
