key,date,article_daily_id,title,text
20090121-0,20090121,0,美國第44任總統奧巴馬就職,"美國第44任總統 奧巴馬就職 「我巴拉克．侯賽因．奧巴馬（BarackHusseinObama）謹莊嚴宣誓，我必忠實執行美國總統職務，竭盡全力，恪守、維護和捍衞美國憲法。」按照憲法的誓詞，47歲的奧巴馬周二正午12時05分（香港時間今晨1時05分）正式宣誓就任第44任總統，也是美國首位黑人總統。他隨即發表就職演說，闡明治國理念，號召全國上下建立「責任」文化，團結發揮為國家奉獻，說「我們面對真實的挑戰」，雖然「不能一蹴即就克服」，但「最終必能克服」。從這一天起，美國踏入奧巴馬年代，也踏入希望和困難並存的責任年代。 奧巴馬是在聯邦最高法院首席大法官羅伯茨（JohnRoberts）監誓下，舉起右手，用左手按着第16任總統林肯用過的《聖經》，讀出美國立國至今233年歷任總統同樣讀過的誓詞，之後依照開國總統華盛頓留下的傳統，加上一句「主為我佑」。在他之前，66歲的拜登（JoeBiden）先宣誓出任副總統。  歷任總統誓詞一樣，這一天意義卻不一樣。黑白混血的47歲奧巴馬，打破種族障礙，登上最高權力之位。46年前，已故黑人民權領袖馬丁路德金（MartinLutherKingJr.）在遙對國會山莊的林肯紀念堂前發表〈我有一個夢想〉演說，提出不再以膚色、而是以人格內涵來判斷人的夢想，這一天由奧巴馬實現。 17分鐘演說　舉國連成一體 遙對着當年100萬人集會激昂聆聽馬丁路德金〈我有一個夢想〉的國家廣場，奧巴馬在出席就職禮的24萬名賓客面前，在聚集廣場看大電視的200萬群眾面前，發表長約17分鐘的就職演說，指美國曾克服過巨大困難，今天要舉國上下連成一體，由政府、金融機構和個人都要負責任，為國家作出犧牲和奉獻，對抗金融逆境，令國家回復正軌，延續馬丁路德金的夢想。  犧牲和奉獻的呼籲，又跟已故總統甘迺廸1961年就職演說中「不要問國家能為你做些甚麼，要問你能為國家做些甚麼」遙相呼應。在就職前一天，即馬丁路德金冥壽，奧巴馬到了華府收容流浪漢、問題少年的「布魯斯之家」，捲起衣袖髹油，有人問他是否試過髹油，他說：「這不是火箭科學，只要拿上滾筒，往牆上塗就可。」又說：「我們正面對嚴峻危機，很多人生活變得艱苦，任何人都不能投閒置散，所有人都要出力。」他身體力行，以身作則，向國人說明責任文化的精神。 清晨湧廣場　群眾人心激盪 在他就職總統的這一天，早上5時半，特工叫醒他，之後他做了20分鐘運動和讀報，與候任白宮幕僚長伊曼紐爾（RahmEmmanuel）開會，7時30分與家人吃早餐祈禱，再與候任官員開會，10時與家人離開國賓館布萊爾宮前往白宮，會合卸任總統喬治布殊（GeorgeW.Bush），然後到國會山莊外的會場，宣誓就職。喬治布殊在橢圓形辦公室辦公桌的抽屜，留下祝福奧巴馬的字條。前任總統、國會兩黨領袖都是就職禮的賓客。  群眾卻沒精準的時間表，華盛頓天未亮，人潮就懷着激盪心情，湧往國家廣場，要見證歷史，由天明到天黑，為奧巴馬就任狂歡慶祝。挾84%高民望強勢就任的奧巴馬，在如此人心下，可以強勢執政。民眾期望奧巴馬解決經濟問題、結束伊拉克戰爭、改革醫療制度，但也體諒他面對前所未有的挑戰。民調顯示多數民眾認為奧巴馬落實承諾，需要兩年或更長時間。 入主白宮　首要刺激經濟 挑戰巨大，奧巴馬宣誓、出席國會午宴和參加巡遊後，正式入主白宮，隨即開首次內閣會議，然後才參加晚宴和舞會。奧巴馬計劃上任第一周集中處理刺激經濟，展開從伊拉克撤軍、關閉被指侵犯人權的關塔那摩灣恐怖分子監獄和簽發政府道德守則。他又準備上任初期即推動醫療改革計劃、金融監管制度改革和立法轉用再生能源。但他的8,250億美元（6.4萬億港元）刺激經濟法案，將令政府赤字擴大，那將拖着他實現承諾的後腿，政治蜜月期從來不長遠。  美聯社/法新社/路透社/美國《紐約時報》/《華爾街日報》"
20090121-1,20090121,1,上任後六大挑戰,"上任後六大挑戰 煙癮未除─ 以身作則需戒掉 自從決定參選美國總統後，奧巴馬決定戒煙，包括服食尼古丁香口膠，但未竟全功。早前他不諱言有時會煙癮起，但聲言不會在禁煙的白宮吸煙。反吸煙者已發起連串運動，要求奧巴馬以身作則戒煙，相信是他上台後最具挑戰的任務。  奧巴馬為展現戒煙決心，他將委任反吸煙團體「無煙草青少年行動」行政總裁科爾為美國健康保健部第二把交椅，推廣全國反吸煙活動。其實他當參議員時間中會吸煙提神，但卻有份提出法案賦予食物及藥物管理局權力，監管煙草商製造、推廣和銷售香港。但戒煙，與號召國人奉獻一樣，都要他以身作則。  美國《紐約時報》 金融海嘯─ 掟萬億重振經濟 奧巴馬首要任務是如何振興經濟，因為次按危機引發的金融海嘯，導致企業出現倒閉潮和裁員潮，經濟班子已擬訂了一項8,000億美元（逾6萬億港元）刺激經濟方案，透過大搞基建、發展另類能源及減稅，來製造300萬個就業機會，刺激經濟。  另一方面，國會已批出3,500億美元（2.73萬億港元）救市基金，奧巴馬更決定將救市範圍，由陷入財困的金融機構擴大到挽救斷供業主、汽車業以至一些可能損害經濟信心的企業。但財長蓋特納因欠稅和僱用逾期居留移民，令參議院對他的確認任命聽證會押後，使他就任卻沒有財長領導財經班子救市。  法新社 種族衝突─ 組閣力求多元化 奧巴馬就任，令所有美國人期待他能扭轉根深柢固的種族問題，為和諧種族關係揭開新一頁。  奧巴馬提名種族多元化的內閣，18名閣員中，少數族裔佔了7人，包括四名黑人、一名華裔、一名日裔和一名拉美裔人，此外還委任很多黑人做白宮職員。不過，專家指，奧巴馬組閣時並非以閣員的膚色作標準，而是着眼他們的個人能力，還向少數族裔顯示美國仍是一個充滿機遇的國家。加州州立大學仇恨和極端主義研究中心主任萊文指，奧巴馬就職是個新時代，他提名黑人司法部長霍爾德有很大象徵意義，因為霍爾德以打擊仇恨罪行為己任。  法新社 外交問題─ 軟硬兼施破困局 奧巴馬在外交上，面對着中東、反恐戰、環保、重振美國領導地位等問題，他的候任國務卿希拉莉表明會用「智慧力量」主導外交，即軟硬兼施，靠軍事硬力量，也靠經濟、文化、援助等軟力量，務實為主。  加薩戰爭是奧巴馬要處理的棘手問題，他會委任前參議員喬治．米歇爾出任特使到以巴調停。另一重點是反恐戰善後，奧巴馬讓國防部長羅拔．蓋茨留任，規劃在未來16個月內從伊拉克撤軍。奧巴馬也會加強遏止溫室氣體排放，向歐盟和其他盟友示好。至於亞洲，奧巴馬未有表態，但中國國防部發言人胡昌明促他採取實質措施消除中美關係障礙。  法新社 改善教育─ 撥款援助苦學生 雖然美國大學仍然是全球留學生首選，但奧巴馬深知美國基礎教育競爭力不及中國等新興國家、有質素教師流失嚴重，以及大學學費昂貴，他認為美國在新時代挑戰需要新的教育，提出「世界級教育」構思。  奧巴馬重視幼兒教育，承諾撥款100億美元（775億港元），包括購買電腦，令美國學生可和中國學生比拼。奧巴馬也成立教師服務獎學金，為在職教師提供獎勵。奧巴馬內閣中的教育部長鄧肯專門研究低下層，對苦學生沒錢讀大學甚為了解。奧巴馬便建議免除符合條件的學生4,000美元（31,000港元）學費，但他們必須進行100小時的社區服務。  《蘋果》資料室 核武易主─ 「足球」交奧巴馬 白宮易主，核子公事包也要易主。當卸任總統喬治布殊前赴國會山莊就職禮會場時，他身後會有一名不顯眼的軍官帶着一個真皮包金屬殼的小公事包隨行。儀式完結後，這名軍官則會伴隨奧巴馬回白宮，啓動核武的無上權力，就此靜靜轉移。  這個被稱為「足球」（Football）的公事包，裝了啓動核武的密碼。附上的手冊列出各種核攻擊選擇，從發射單一核武到全面發動核戰爭都有。公事包也內藏一個保密電話，可接通五角大樓、科羅拉多斯普林斯的核武指揮中心和馬里蘭州稱為「SiteR」的地堡緊急指揮中心，從而指揮美國1,300枚戰略核武。  《巴爾的摩太陽報》"
20090121-2,20090121,2,致電多國領袖說再見　反戰人士「贈興」布殊卸任被擲鞋,"致電多國領袖說再見　反戰人士「贈興」 布殊卸任被擲鞋 別了，喬治布殊（GeorgeW.Bush）。當全球陷於次按引發的金融海嘯、當反恐戰仍找不到出路時，美國第43任總統喬治布殊輕鬆卸任，揮揮手返回德州老家。往後的日子，他會在達拉斯（Dallas）的辦公室，寫書為政績辯護。但反戰人士周一不留情面地擲鞋送別他。 在白宮最後一夜，喬治布殊忙着搖電話給多國領袖說再見，從關係密切的英國首相白高敦（GordonBrown），到處於「新冷戰」的俄羅斯總統梅德韋杰夫（DmitryMedvedev）和總理普京（VladimirPutin），都收到電話。告別電話，內容是要感謝英、俄、法、德、日、韓等國家領袖八年來釋出的善意。他又為兩名殺死墨西哥毒販的邊防人員減刑，但他任內只特赦了189人，替11人減刑，不及克林頓任內的一半。  喬治布殊在白宮內忙公務，反戰組織則在白宮外忙擲鞋。華盛頓和平中心等號召了500人，為喬治布殊送上「離別厚禮」──效法伊拉克記者在巴格達向他擲鞋，在白宮門前投擲40多對鞋。發起人沙菲說：「喬治布殊令我們喪失憲法精神，現在卻不負責任地離去。」 返老家寫書為政策辯護 喬治布殊不像很多前任那般卸任時都會帶走白宮用過的所有家具，只帶走祖母留下來的古董衣櫃，其他私人物品則於去年他已變成跛腳鴨時搬走。故他和妻子勞拉周二離開住了八年的白宮時，只拿走幾箱私人物品。反而老布殊夫婦和兒媳享用在白宮的最後晚餐走得沉重，老布殊說很懷念來白宮和離去的時刻，夫人芭芭拉對「第二度與白宮職員落淚話別」份外難過。  離別一刻終於來了，出席完奧巴馬就職禮，喬治布殊下午1時25分在安德魯斯空軍基地發表告別演說後，就會和妻子飛返德州，米德蘭城（Midland）和韋科城（Waco）都有歡迎活動等着他，美國總務管理局已在達拉斯租下2,400平方米的辦公室給他處理卸任後的公務。寫回憶錄、巡迴發表演說、為任內政策辯護，是喬治布殊今後的主要工作。 切尼卸任後與妻子退隱 至於67歲的切尼（DickCheney），卸任副總統後會完全退隱，與妻子回到懷俄明州，「我有許多條河可以釣魚，不用為我難過」。但他日前搬行李時扭傷背肌，要坐輪椅出席奧巴馬的就職典禮，相信暫時不能釣魚。喬治布殊口中的國務卿「妹妹」賴斯，在國務院留下歡迎字條給繼任人希拉莉後，準備回到史丹福執教政治學。54歲的她至今待字閨中，早前被傳媒追問婚事時，她說不是不想嫁，只是「找不到合適的對象」。  美國有線新聞網絡/法新社/美聯社/英國《衞報》"
20090121-3,20090121,3,白宮93人　5小時替總統搬家,白宮93人　5小時替總統搬家 總統就職日，對於千千萬萬美國人來說，是體現民主精神的奇蹟日。但對於白宮內93人來說則是搬遷日，他們要在短短五小時內，送走舊主人喬治布殊的行李細軟，然後有條不紊整頓好新主人奧巴馬一家的行李家當，比變魔術更神奇。  這一天，喬治布殊大清早和夫人勞拉一起接待奧巴馬夫婦後，於早上10時45分將分頭乘車到國會山莊出席就職禮。這一刻，他一家的行李還未搬走，但93名訓練有素的白宮官邸工人，將在奧巴馬就職巡遊結束前將白宮變身。他們會先將舊主人的行李打包搬走，待貨車送來新的第一家庭行李後，再按新主人的心意，將所有衣物摺好放進衣櫃內，將照片在牆上掛好或在梳妝枱上放好。  由混亂一片到收拾妥當，曾服侍七位總統、兩年前才退休的白宮官邸工人沃爾特斯（GaryWalters）說，「這不是容易的工作」，秘訣是早幾周已計劃好流程，然後93人分工合作，開始自己的「任務」。但有時總有失算，沃爾特斯記得，1989年，老布殊就職，他一些孫兒巡遊倦了，早了數小時送回白宮，沃爾斯特情急智生，讓小孩子到白宮花店上了一堂插花班和參觀，才能讓搬遷進行。  但喬治布殊一家都很細心，早於去夏已將私人物件，包括很多書籍、不合季節的衣服、勞拉的晚裝等，運回家鄉德州，勞拉更親手將部份行李整理好。至於奧巴馬，消息指他沒特別要求，不會帶芝加哥老家的傢俬到白宮，全用白宮貨。反而喬治布殊會運走祖母家傳的古董衣櫃。  美國《紐約時報》
20090121-4,20090121,4,黑奴後裔成白宮女主人,黑奴後裔成白宮女主人 奧巴馬成為美國首位黑人總統，締造歷史，也令白宮破天荒迎來首位黑奴後代女主人米歇爾。這位新第一夫人作風一向平實，入主白宮後，將力求減少生活帶來的巨變，首要任務是讓一對寶貝女兒盡快適應。  奧巴馬夫婦在芝加哥的房子是逾千萬港元的豪宅，但相比起有123個房間的白宮，只是小巫。未來四年，米歇爾將不用再為家有害蟲而煩惱，也不必親手做早餐，有100多名侍從提供衣食住行貼身服務，前總統列根就曾形容白宮像「八星級酒店」，但如何讓女兒過正常生活，就要考考米歇爾的智慧。 米歇爾祖先為白人種田 米歇爾入住白宮，也有另一重意義，事關她是以黑奴後代的身份，當上白宮女主人，住進這幢由黑奴打造的「自由之殿」，她家族五代人的故事，見證了美國社會的重大轉變。  米歇爾的祖先來自西非，她的高祖父吉姆．魯賓遜1850年在美國出生，生下來就是奴隸，儘管林肯總統在1863年公佈了《解放奴隸宣言》，他畢生在南卡羅來納州為白人主人賣命種田，住在擠逼簡陋的「奴隸街」宿舍，死時僅38歲。  米歇爾的曾祖父弗雷澤（Fraser）在白人家中當僕人，少爺教曉他識字，也令他決心要讓六個孩子受教育。米歇爾的祖父弗雷澤二世（FraserII），順利高中畢業，並因此得到郵差的工作，定居芝加哥。他的兒子，也就是米歇爾父親弗雷澤三世（FraserIII）一樣重視兒女教育，米歇爾和哥哥都是長春藤名校普林斯頓的畢業生，她更是哈佛法學院高材生，是成功的行政人員，為家族吐氣揚眉。  黑奴踏入賓夕凡尼亞大道1600號，五代人寫成美國傳奇，但米歇爾聲言只想做好「媽咪總司令」，以女兒為生活重心，同時也會協助丈夫消弭種族歧視。前晚（周一）她出席華盛頓一個青少年音樂會，就鼓勵主要是軍眷和軍人子女的觀眾服務社會。「孩子們，你們是國家的未來。每個美國人都要作出貢獻，年輕人也不例外」。她的署名，總是親切的「Michelle」。  英國《每日郵報》/《今日美國報》/法新社/美聯社
20090121-5,20090121,5,第一女兒傳媒新寵照過「正常」生活,第一女兒傳媒新寵 照過「正常」生活 才不過是7歲和10歲，奧巴馬的寶貝女薩莎（Sasha）和瑪利亞（Malia）已是當今世上知名度最高的孩子。萬般寵愛的代價是傳媒追訪，搬入白宮後，她們還能過「正常」的童年生活嗎？專家說，一切視乎奧巴馬夫婦怎樣安排。  美國傳媒對總統的子女向來保持一定距離，知所分寸。像克林頓的女兒切爾西搬到白宮時才13歲，在克林頓夫婦的要求下，讓她可像其他孩子一樣去上學和排練芭蕾舞。專家相信，奧巴馬夫婦會讓薩莎和瑪利亞如常上舞蹈課、踢足球和到朋友家過夜，奧巴馬也會繼續出席女兒學校的家教會。  盡量過「正常」生活的第一家庭還有一項難題，就是「第一寵物」究竟花落誰家？可肯定的是，第一寵物將是花邊新聞的常客。  本報記者
20090121-6,20090121,6,白人優越主義者奧巴馬最大敵人,"白人優越主義者 奧巴馬最大敵人 奧巴馬雖是首位入主白宮的黑人總統，但國內種族歧視問題仍然相當嚴重，白人優越主義者更視他為死敵，揚言要暗殺他，令奧巴馬所受到的特工保護也是最嚴格。  美國三K黨領袖羅布（ThomasRobb）在奧巴馬當選時，指由奧巴馬這個「外人」當總統，全國就已處在種族戰之中，奧巴馬正入侵美國及摧毀基督教文化，威脅要對他不利。在昨日就職典禮，三K黨就呼籲成員臂纏黑紗，倒掛國旗以示不滿。  由新納粹主義分子主持的網站，有多達500個要殺死奧巴馬的留言，當中有的提及刺殺細節。特工處非常緊張，除為奧巴馬打造一輛外號「野獸」的「卡的力一號」防彈車，昨就職禮更出動了45,000軍警，又在禮台上安裝防彈玻璃，確保奧巴馬安全。  英國《每日郵報》"
20090121-7,20090121,7,奧巴馬成模仿對象　黑人精英抬頭美國掀起文化革命,"奧巴馬成模仿對象　黑人精英抬頭 美國掀起文化革命 美國總統奧巴馬在上周六費城演說中，談及美國革命不僅僅是戰爭，也是一場心靈戰，但他自己也悄悄掀起一場文化革命。一直備受歧視的黑人，因奧巴馬之名而吐氣揚名，越來越多精英黑人崛起，改寫美國舊文化。奧巴馬感染力強的演說，也誘使黑人下一代離棄黑人方言。他的健康飲食和運動習慣，實而不華的服裝，勢成萬千美國人模仿的對象。 美國南北戰爭後，黑人解脫了奴隸的枷鎖，但仍有種族隔離。至1960年代，種族隔離才在民權抗爭路上遭逐漸瓦解，到奧巴馬當上總統，更標誌黑人都可登上最高權力高峯。首位黑人總統上台，帶動黑人社會地位一次大躍進，更有黑人精英幫冒起，成為公司高層、律師、政治籌款者，衝擊美國社會的傳統權力結構。 哈佛幫是奧巴馬校友 奧巴馬名校出身，在商界、政界和法律界有不少戰友，可藉奧巴馬之名提升本身事業和地位。第一批人可稱「芝加哥幫」或「曼哈頓幫」，他們都是商界和法律界人士，憑本身人脈關係幫奧巴馬籌款。  曼哈頓著名律師行合夥人約翰遜（JehJohnson）是其中一人，他自豪地說：「現在見新客戶，同事第一就說我是律師，第二就說我是奧巴馬全國財務委員會的人。」  另外兩批分別是「華府幫」和「哈佛幫」。「華府幫」包括候任司法部長霍爾德和駐聯合國大使蘇珊．賴斯，他們早已在白宮和國會打滾，又是奧巴馬的顧問。哈佛法學院自1968年開始大量錄取黑人學生，一年30至40人，至令有超過1,400黑人校友，是奧巴馬依賴的網絡。  黑人的種族「玻璃天花」已被打破，法學院教授威爾金斯（DavidWilkins）說，現在像他的中上層黑人去高檔餐廳或度假區，所受待遇截然不同，「人們都假設你可能認識下任美國總統。」  美國《華爾街日報》 美國冒起的3幫人 芝加哥幫 哈佛幫 華府幫"
20090121-8,20090121,8,黑人新文化運動說標準英語,"黑人新文化運動說標準英語 美國黑人和白人英語大不同，黑人多說埃伯尼語（Ebonics），但被視為黑人總統的奧巴馬卻極少說埃伯尼語。他在激動人心的演說中，字正腔圓說美式英語，最終成功選上總統。憑着超人氣的氣勢，奧巴馬可在黑人中掀起「新文化運動」，將有更多黑人下一代改說標準美式英語，更有人擔心這代表「埃伯尼語之死」。 下一代改說美式英語 埃伯尼語源於西非，現在成為美國黑人的方言。埃伯尼語主要特徵包括動詞tobe不變位，例如說「Ibejoking」，詞尾輔音脫落，例如將「hand」讀作「han」，又經常「you　knows」，雖然不合文法，但不少人視埃伯尼語為美國黑人獨特身份象徵。  奧巴馬除了在華府著名快餐店「老班辣味碗」一句埃伯尼語「Naw,westraight」，意指自己同他陪食的華府市長是「好兄弟」，他幾乎沒有在公開場合說埃伯尼語。財經網站KingGeorge指出，奧巴馬強而有力、感染力強的演說，令不少黑人下一代大為嚮往，他們可能會摒棄黑人方語，這代表「埃伯尼語之死」。因為美國黑人意識到想獲取成功，必須要說標準美國英語，因為標準美國英語是一種權力語言，一種金融語言，是通向成功的敲門磚。  本報記者"
20090121-9,20090121,9,不愛名牌　買現成奧巴馬帶領新潮流,不愛名牌　買現成 奧巴馬帶領新潮流 奧巴馬能否為華府政治帶來改革仍是未知之數，但很多人相信他和第一夫人米歇爾卻會改變美國人的衣着文化。  Men.style.com編輯托雷森指出，奧巴馬的衣飾並非名牌，很多時都是到百貨公司購買現成西裝，但配搭一流，西裝剪裁也稱身入時，絕不像喬治布殊那樣衣不稱身；而且奧巴馬是以快捷的四個步驟的「四手結」（four-in-handtieknot）打領呔，而非最正統的「溫莎結」（Windsor）或「半溫莎結」（half-Windsor）。 米歇爾被視為「黑人積琪蓮」 奧巴馬的西裝look不但夠俊，即使穿T恤和牛仔褲，配拖鞋或波鞋的look，也相當有型，連紐約第五街的名店都大讚奧巴馬穿衣優雅，凸顯個人品味。  奧巴馬的衣着肯定成為很多美國人模仿的新偶像，但他對黑人一些衣着也看不過眼。  板仔褲和鬆身露臀牛仔褲，都是由黑人掀起的潮流，但他去年11月就呼籲青年人應棄穿鬆身露臀褲，認為有失斯文。  至於米歇爾更被視為「黑人積琪蓮」，時裝界都大讚她品味好，她的衣着將會帶動美國以至全球時裝的新路向。  法新社
20090121-10,20090121,10,討厭垃圾食物第一家庭愛吃蔬果,討厭垃圾食物 第一家庭愛吃蔬果 白宮每次換新主人，通常都換大廚，因為他們的口味都不同，但新第一夫人米歇爾卻讓白宮大廚科默福德（CristetaComerford）留任，原因是她和對方都很着重健康飲食。  前總統克林頓每周至少吃一頓炭燒肋骨，妻子希拉莉最愛嫩羊架，女兒切爾西至愛卡夫芝士加漢堡包；剛卸任的喬治布殊不愛吃菜，最愛花生醬蜜糖三文治、漢堡包或烤芝士三文治，勞拉則最愛有機食物。  奧巴馬夫婦雖是黑人，卻討厭吃垃圾食物，兩人都吃得健康和講究，對兩個女兒的飲食更加着重，甚少讓她們吃垃圾食物，因此這個黑人第一家庭入主白宮，相信會多吃蔬果和瘦肉，減少吃高卡路里食物。 鼓勵國民注重健康飲食 奧巴馬夫婦雖然吃得健康，但兩人都肯嘗試新美食，在芝加哥居住時經常上館子用膳，奧巴馬會尋找一些抵食而美味的美食，據說他在當地食肆品評餐廳的食物。  美國人的癡肥問題嚴重，奧巴馬成為全美國的新偶像，他入住白宮後，着重健康飲食，或許起上行下效的作用，鼓勵更多國民今後注重健康飲食。  美國《三藩市紀事報》
