key,date,article_daily_id,title,text
20101119-0,20101119,0,三鴨來港殺少婦,三鴨來港殺少婦 【本報訊】有夫有子的少婦，疑因生活苦悶不時跟閨中女友到深圳俗稱「鴨店」的娛樂場所消遣，不料竟惹來殺身之禍。女事主上月底到元朗女友家中玩樂時，被深圳來港三鴨押走從此人間蒸發，家人在她失蹤三天後報警。警方調查後懷疑女事主被人威迫下透露提款卡密碼，並提走五萬元存款。直至女事主失蹤半月並疑遭殺害，警方終拘捕女事主的密友，懷疑她參與案件，正找尋女事主下落，並追緝涉嫌三鴨歸案。 記者：江寶龍　麥超億 懷疑已遭人謀財害命的婦人鄭×薇（39歲），與姓郭丈夫及年約13歲兒子同住青衣區。鄭婦沒有工作，平日主要是照顧丈夫和兒子起居生活，記者昨日到青衣鄭婦家中了解，只見鄭婦兒子在家，他對事件一概表示不知情。 與女密友常北上消遣 消息稱，鄭婦常與一名45歲姓楊女友來往，兩人份屬閨中密友，不時相約外出活動，及北上消遣。據悉，姓楊婦人與就讀初中的兒子同住元朗八鄉馬鞍崗村。上月30日晚上，鄭婦接到楊婦電話後便離家外出，相信她是應約到元朗探望楊婦，當時另有三名來自深圳、俗稱「鴨」的男妓在楊婦家中。 消息稱，鄭、楊兩婦在深圳娛樂場所消遣期間認識不少男妓，當日三鴨專程來港與她們見面，各人在屋內起初談笑甚歡，但其後因為金錢問題爭執，事後鄭婦更被三鴨押走，從此人間蒸發。 鄭婦姓郭丈夫連日四出尋妻不獲，至三日後（11月2日）到青衣警署報案。當時由警方新界南總區失蹤人口組接手，最初僅當作一般失蹤案件處理，但經過多日追查後，發覺鄭婦在失蹤翌日（10月31日）至11月8日期間，多次被人利用提款卡銀行戶口提走共五萬元。警方認為事件不尋常，於是將案轉交新界南總區重案組跟進。 禁錮時戶口被提五萬 至本周一（15日），鄭婦失蹤已超過半個月，警方終於掌握重要線索，掩至八鄉馬鞍崗村拘捕姓楊婦人，其子則暫住親友家中。消息稱，有人在警方盤詰下和盤托出，指鄭婦遭人押走禁錮期間，被迫令說出銀行提款卡密碼，事後有人將鄭婦的提款卡交給楊婦，由她先後到銀行提走五萬元，事後各人已將贓款攤分。 消息又稱，被捕姓楊婦人聲稱不知道鄭婦下落，更不知她是否經已遇害。不過，警方相信鄭婦已凶多吉少，由於她的銀行存款在11月8日後再沒有支出入賬紀錄，因此不排除她在該天之前已被人殺害。 警正追緝涉案三男妓 警方前日曾派員返回馬鞍崗村現場，除向村民查詢外，並展開搜山行動，其間更出動地底雷達探測儀探測現場，了解鄭婦會否已被埋屍，但未有發現。另外，警方已要求入境處協助查證三名涉案內地男妓的出入境紀錄，並聯絡內地公安聯手追緝三鴨歸案。 婦人疑遭謀財害命示意圖
20101119-1,20101119,1,主教湯漢回應：要把視野放更深遠,主教湯漢回應：要把視野放更深遠 【本報訊】神父的「李嘉誠係魔鬼」言論在教區引起軒然大波，連日沉默的天主教香港教區主教湯漢在最新一期《公教報》回應。他指傳媒「必依據各自之目的」報道今次事件，只能為此祈禱，「沒有天主准許，這些現象不會發生」。 楊鳴章指主教要他忍耐 湯漢在該報一篇訪問稱，教區將從此事學習，重視意見交流的言論自由獲得保護，呼籲各方冷靜及聆聽對方：「我們要追隨聖保祿宗徒的教導：力行仁愛，實踐真理，兩者並行，不可或缺。我常常謹記胡振中樞機的叮囑……要把視野放得更深更遠！」 副主教楊鳴章撰文回應魔鬼論風波時，提及湯漢要他忍耐，傳播處發「遺憾」聲明也是湯的指引，「他叫我們不要多談，更不須指出誰說對，誰說錯了，誰也不應再向傳媒說甚麼」。楊又稱讚湯溫文爾雅，從未見他向任何人施壓，更不會因魔鬼論「提點」羅國輝。 這期《公教報》刊登多篇評論魔鬼論的文章。香港仔聖伯多祿堂主任司鐸郭偉基認為，牧者講真話出於良心呼喚，「魔鬼論雖聽來令某些人不悅，但總勝過聽些恭維、祝賀、善頌善禱的說話」。青年信徒梁允謙則寫道，對教區處理手法感失望，令人質疑魔鬼論與捐款有關，梁說：「教區若真是因此而作出妥協……為了專橫財閥的捐款而犧牲天主所賜的正道和原則，不是太不值得了麼？」
20101119-2,20101119,2,美容療程冒充旅發局呃客,美容療程冒充旅發局呃客 【本報訊】旅遊發展局昨日發表聲明，表示近日有人假冒旅發局名義致電市民，藉詞招募「神秘顧客」為「優質旅遊服務」計劃的商戶進行評審，測試美容中心的服務質素，實際是招客購買美容療程。旅發局至今接獲14宗投訴，參加美容療程的市民被騙數千至萬多元不等。有受害者已報警求助。 稱招募神秘顧客 旅發局今年初陸續接獲巿民查詢，指有巿場調查公司以旅發局名義招募神秘顧客事宜，由過去每月一宗增至最近每月數宗。旅發局至今已接獲14宗相關受騙個案，事主更因此蒙受金錢損失由數千至萬多元不等。 本報最近也接到同類投訴，根據投訴人指，涉嫌假冒的公司名為香港專業媒體有限公司，屬一間巿場調查公司。該公司假借旅發局名義致電事主，聲稱招募神秘顧客測試美容中心服務質素。事主只需填寫一份問卷調查報告，就可以優惠價百多元試做美容療程。有關公司更在電話要求事主提供姓名、地址、信用卡等個人資料。本報昨晚致電該公司，但沒人接聽。 旅發局關注事件 事件又涉及一間集團式美容中心。旅發局發言人表示，部份受害者不虞有詐，擔任神秘顧客到美容中心「測試服務」，其間卻遭美容中心職員游說，參加數千至萬多元的美容療程，「啲美容公司攞埋事主嘅信用卡資料碌卡，事主被迫參加美容療程」。發言人強調，旅發局推行優質旅遊服務計劃的商戶類別中，不包括美容中心，該局也從來沒有委託任何機構，就評審美容中心的服務質素而招募神秘顧客。現時優質旅遊服務計劃只涵蓋零售、餐飲、旅客住宿服務及髮型屋四個行業。 旅發局將會向有關公司發信，表示強烈關注事件。當局呼籲市民，若對優質旅遊服務計劃有疑問，可致電25081234向旅發局查詢；若遇到有人懷疑假冒旅發局名義招募神秘顧客，應盡快報警。警方發言人表示，沒有就這類案件分類，未能提供求助數字。
20101119-3,20101119,3,八成補助學校拒減班包括男拔英華聖保羅　潑政府冷水,八成補助學校拒減班 包括男拔英華聖保羅　潑政府冷水 【本報訊】中學減班方案昨日公佈，學界預料會有約100間中學響應。不過代表22間傳統英中名校的補助學校議會表明，該會八成學校因已轉為直資或有直屬小學，沒有減班空間，只有三、四所中學會考慮，向政府潑了一盆冷水。 記者：倪清江 教育局昨公佈「加強版」自願優化班級計劃，參加的中學在減少一班後，每年本應削減兩個編制內教席，但教育局會給予每校每年最多六個額外教席，讓學校可保留超額教師，但整體教席不得多於減班前，學校因而毋須解僱多出教師人手。過渡期為六年，由第七年起才需分三年，削減該六個額外教席。 各校最遲可在明年2月25日前決定是否參加，教育局會因應各區學額需求，決定有關學校由2011/12學年或2012/13學年開始減班。本學年的已減班的23所中學，可獲同樣權利。 津中議會料100校參加 孫明揚昨聯同由八個中學議會和18區中學校長會組成的聯席會議，呼籲學界積極參加，又強調減班方案以學界福祉和學生整體利益為依歸。孫不估計會有多少間中學參與，津中議會主席廖亞全有信心，會有100間中學參加。 不過在場的補助學校議會主席譚兆炳則稱，撇除已轉為直資的六間會員學校，其餘十多間因有直屬小學，減班後中一學額將不夠小學部學生升讀，因此不能減班，只有三至四間沒有直屬小學的會員學校正在考慮，即八成都不會減班。 補助學校議會有22間會員學校，半數是百年老校，包括已轉為直資的拔萃男書院、聖保羅男女中學和英華書院，以及有直屬小學的喇沙書院、香港華仁書院和協恩中學等。 孫明揚本周一信誓旦旦官立中學全體必須減班，自揭「假自願」真面目，他昨日三度被追問當局是否以長官意志向官中「大石壓死蟹」，他都以和稀泥態度含糊其詞，「政府作為官中辦學團體，需要審慎處理。同時要考慮我哋點樣犧牲小我，完成大我」。他又表示教育局與直資學校有服務協議，不能要求他們減班。 教育局副局長陳維安其後向傳媒簡介時，也迴避官中是否必須減班，「最終大家會有好滿意結果，會繼續同佢哋傾」。各官中由學校管理委員會主席管理，主席是教育局高級官員，副秘書長葉曾翠卿被問及在學校決定時，有關官員會否保持中立或不投票，她即突然黑面，又稱她過往任官中校管會主席時，未曾需投票作決定。 教育局中學減班方案 ‧開始減班的六年內，各校每年享最多六個額外教席 ‧遇教師流失，可增聘教師填補額外教席 ‧額外教席可計算在主任級及學位教師比例內，確保校內升級制度不受影響 ‧六年過渡期後，額外教席分三年逐步取消，每年兩個 ‧用盡額外教席後仍有過剩教師，九年期內可繼續保留 ‧如果第十年仍有過剩教師，教育局會酌情處理 ‧開始減班後連續五年，每年可獲25萬元額外津貼 ‧適用於官立和津貼中學 資料來源：教育局
20101119-4,20101119,4,零炒人方案　可解教師憂慮,零炒人方案　可解教師憂慮 【本報訊】教育局推出的減班方案是「零炒人」計劃，即使過渡期過去，校方仍毋須解僱超額教師，學界料可安頓教師憂慮。教育局局長孫明揚表示毋須動用額外公帑，反而承認減班可節省開支。 按計劃，減班後首三年減少的六個教席，可完全由六個額外教席填補，學校毋須解僱多出人手。當減班推向中四至中六時，需再減六個教席，但即使無法靠自然流失減去六席，超額教師仍可留任。若學校再於之後三年仍有超額教師，到第十年時依然可尋求教育局酌情安排。 學生回升後可加班 若方案有效，中學收生不足而導致殺校的可能性大減，教師毋須憂慮飯碗不保。教育局副秘書長葉曾翠卿表示，中學每年平均流失率為5.3%，相等於有60個教師的中學，每年有三人離任，因此料出現超額情況機會不大。 副局長陳維安稱，2016/17是升中人數低谷，過後學生將會回升，減班的中學屆時會獲優先批准加班，吸納超額教師；他昨未有回應方案無視家長意見。 津中議會主席廖亞全勁讚減班方案，指可紓緩學校課室不足問題，英中減班也可縮窄入學學生能力差異的情況，高中可有更多教師作分組教學。他稱北區、大埔、屯門和元朗正商討全區中學一同減班。
20101119-5,20101119,5,真道書院承認扣起賑川善款,"真道書院承認扣起賑川善款 【本報訊】審計署發表報告踢爆直資學校賬目混亂，震驚學界和家長，但教育局局長孫明揚昨日仍堅拒公開違規學校名稱。被指濫用儲備的直資中學真道書院，昨承認未有全數捐出賑濟四川地震的善款，當中16萬元扣起作盈餘；有家長要求查數。 議員促公開學校名 面對社會猛烈批評，教育局局長孫明揚昨日仍堅拒公開問題學校的名單。他表示要先問過審計署，才能公開名單。不過，審計署署長鄧國斌昨晚在電台節目表示，應否公開名單由教育局決定。 面對兩個部門互相推卸，立法會議員張文光稱不能接受：「任何機構接受政府資助，都應該受到監察，唔單止家長有權知道學校名，所有市民都有權知道。」 身兼直資林大輝中學校監的立法會議員林大輝批評，教育局不公開問題直資學校名稱，會導致「黑狗偷食，白狗當災」。 位於將軍澳的真道書院是審計署批評的其中一所直資學校，校方昨日發表聲明，承認未有全數捐出四川地震賑災善款，但指餘款是家長會所有，校方不能挪用。審計報告指該校為四川地震籌得55萬元善款後，將當中16萬元以保留盈餘為由扣起。真道家長會前主席黃群英否認「侵吞」善款，指早就與四川教育當局有共識，將該筆款項培訓當地教師，只是一直未能安排行程，才沒有機會動用餘款。 真道家長要求查數 對於動用1,000萬元儲備購買三個分別位於西貢村屋及將軍澳居屋單位作外籍教師宿舍，又用15萬元免費為1,000名內地校長進行培訓，以及未按程序招聘教職員等指控，真道表示全部獲得學校管理委員會批准，並無違規。但該校家長譚太表示，學校經費應集中用在學生身上，會在家長會上要求查數。"
20101119-6,20101119,6,恒商儲備2.2億　仍加學費五成,"恒商儲備2.2億　仍加學費五成 【本報訊】審計署調查65間直資學校，最富貴一間累積營運儲備高達2.2億元，原來真身是預科名校恒生商學書院，該校今年更大幅加學費五成，由6,000元加到9,000元。恒商校長崔康常昨指，該筆儲備並非來自學費收入，而且要留作籌建私立大學，否認校方「斂財」。 審計報告不點名指恒商累積營運儲備多達2.2億元，校長崔康常昨接受查詢時表示，該筆儲備並非校方持有，而是屬於辦學團體恒生商學書院有限公司，而該公司轄下還有「恒生管理學院」，正籌備成立私立大學。 校方指款項屬辦學團體 該筆巨款是恒商成立初期，透過投資和滾存得來，並非學校營運收入的盈餘，每年還會從利息收入撥款支持學校營運，「唔係來自學費，否則唔會有幾億，政府搞錯咗，教育局啲人知，審計署唔知」。他指該筆巨額儲本不能隨便動用。 面對巨額儲備，恒商今年卻大加學費五成，崔康常解釋是因為早年曾將學費由12,000減至6,000元，引來赤字，惟有加學費至9,000元，還指「我哋一年頒獎學金都幾百萬」。 經濟學家關焯照建議學校減低信託儲備比例，改持更多現金做定期存款或其他投資，彈性運用，以免家長感到校方「斂財」。"
20101119-7,20101119,7,科大被轟頒學位過度寬鬆,"科大被轟頒學位過度寬鬆 【本報訊】大學教育資助委員會轄下的質素保證局公佈對科技大學的評核報告，指科大學位等級的分佈偏離校方指引，有些學院頒授的較高等級學位數目，遠遠多於校方政策所指示的數目，評級尺度有過於寬鬆之嫌。有專家指，甲等（FirstHonor）及乙等一級（SecondUpHonor）大學學位畢業生在勞動市場有市有價，但濫頒較高等級學位，會令僱主對學院「投不信任票」。 科大棄用拉曲線評分 質保局昨發表報告，批評科大頒授的較高等級學位數目，遠超校方政策所指示的數目；有關情況因學院而異，且屢次出現，以致總體成績和學位等級分佈，遠遠偏離指定百分比範圍，加上本科生教務委員會在監管過程中沒有提出異議，令外界擔心科大的評級尺度過於寬鬆。質保局建議，科大加強監察各學院是否遵從有關政策，並須確保學術水平不受影響。 科大校長陳繁昌反駁指，學院對各級學位比率毋須一致，認為成績應是反映學生實際水平。本科生教務長譚嘉因表示，當全班學生表現均很好時，不應硬性要分高低。科大發言人表示，自06年起，各學院已逐漸棄用俗稱「拉曲線」的方法來評定學生的學習成果。 協理副校長（教學）毛大偉表示，不少學生的年度課程報告（FinalProject）表現出色，又有很多學生到海外院校交流，獲得優異成績，因此推高了整體成績。 合眾人事顧問總經理蘇偉忠表示，獲頒甲等及乙等一級學位的畢業生在勞動市場較搶手，尤以金融界、銀行界、大型企業為甚。甲等學位畢業生月薪可達1.5萬至2萬元，普通畢業生則只有8,500元至1.1萬元，相差高達一倍。不過，濫頒較高等級學位，會令僱主對學院「投不信任票」。他認為，院校對畢業生等級準則必須收緊。 學友社社長伍德基表示，獲頒甲等學位的畢業生，有機會獲得不同程度的獎學金。他指學校頒發等級學位時，定要符合一般人的合理期望。 質保局評核科大部份意見 1.有些學院頒授的較高等級學位（如甲等、乙等（一級））數目，遠遠超出校方政策所指示的數目 2.評定教學表現時，多數只依賴學生意見調查問卷的評分 3.各課程的校外檢討做法各異，以致全校的檢討重點、次序及嚴謹程度一致 4.教學人員評核課業時，往往較為粗略或只有片言隻語，很少甚至沒有給予學生建議和具指導作用的評語 5.多個修課研究生課程毋須接受正式檢討 6.學系撰寫年度課程報告時，內容着重描述多於分析，側重成果多於自我批評 7.全校師生關係緊密，團結一致 8.推行和妥善管理大規模的國際學生交換計劃 資料來源︰質素保證局"
20101119-8,20101119,8,議員質疑解放軍越權釋法指有意見應到立會提出　代政府解畫不當,議員質疑解放軍越權釋法 指有意見應到立會提出　代政府解畫不當 【本報訊】政府早前向立法會提交《2010年法律適應化修改（軍事提述）條例草案》，遭部份立法會議員質疑有藉機擴大駐港部隊特權之嫌，駐港解放軍罕有地為特區政府向傳媒解畫，指個別議員對修訂的看法和解讀，並非特區政府的立法原意，不過有議員質疑，《基本法》寫明駐軍不能干預香港內部事務，他們無權代政府解釋立法原意，明顯是越俎代庖，認為若駐港解放軍要表達意見，應該親自到立法會向議員提出。 記者：林俊謙　莫劍弦 本報早前報道泛民立法會議員何秀蘭、涂謹申對《法律適應化修改條例草案》內多項法例適應化修訂，有擴大駐港解放軍特權及豁免權之嫌，包括將以往只能用作「官方用途」的軍用私人土地，改為可用作「其他目的」，又將原本只容許駐港部隊毋須擁有香港駕駛執照在港駕車，修訂為適用於所有解放軍及其隨員等。 軍方無權代政府澄清 駐港部隊日前致函本報，要求澄清有關報道，指有關草案「旨在通過對涉及軍事提述內容的適應化處理」，「該項立法的原則是進行對等的詞語替換，並無擴大駐軍權利或豁免」，又表明「香港立法會個別議員對草案內容的看法為其個人對修改條款的解讀，並非《2010年法律適應化修改（軍事提述）條例草案》的立法原意」。 何秀蘭接受訪問時指出，對解放軍聲明中自稱不會擴大駐軍權利和豁免表示歡迎，但卻質疑按《基本法》第14條列明，香港駐軍不能干預香港內部事務，行政機關在提出相關草案時，可以諮詢解放軍意見，但解放軍只是被諮詢對象，並無權就草案進行釋法，解放軍為特區政府解畫，有越俎代庖之嫌，「香港特區嘅律政署都唔出嚟澄清，我哋立法部門提出質疑，有乜問題？」她又強烈質疑解放軍指修例不涉及擴權或豁免的說法，過去已有不少先例，只要法例中一個簡單詞語對換，隨時會變成政策上的改變。若駐港部隊要表達意見，就應正式到立法會回應議員提問，「要有正式會議、正式文件，內容要落會議紀錄」。 部隊不熟悉立會文化 涂謹申認為駐港部隊明顯不熟悉香港立法會文化，政府提交草案，議員個人對草案有疑問是十分正常，政府有責任解釋，今次正是議員明白草案是做適應化工作，又發現當中可能產生其他政策轉移後果，才會提出意見。
20101119-9,20101119,9,未交代三軍會防務用地,未交代三軍會防務用地 【本報訊】駐港解放軍容許位處軍事用地的三軍會體育會從事商業活動，一直為立法會議員批評，解放軍致函本報的聲明強調，三軍會一直自行管理、自負盈虧，駐軍未向會所收取任何租金或其他費用，但有議員質疑駐港解放軍回應，仍未有交代三軍會用地是否仍算是用作防務用途，以及會否將不再用作防務用途的用地，交還特區政府。 駐港解放軍在給本報的聲明強調，三軍會體育會所一直自行管理、財政獨立、自負盈虧，駐軍未參與會所的日常管理，也未向會所收取任何租金或其他費用，更未攤分會所的任何收入，又指本報引用07年9月大埔吐露港公路一宗涉及兩部解放軍駐港部隊吉普車及大卡車交通意外，車上軍人拒絕協助警方調查報道不確，他們當時已按警方指示將軍車移開。 非關防務應交還政府 本報於07年9月6日報道該宗交通意外，報道指當時車上軍人留在車內等候上級指示，結果引致大塞車，有市民向在場警員查詢，連警員也苦笑說：「我都想知呀！我掂都唔敢掂佢（解放軍）架車呀！佢話要等上級！」 至於三軍會的問題，立法會議員何秀蘭稱駐港解放軍雖澄清未有從中得益，但據她所知，三軍會是由一私人機構代為管理，解放軍有否間接從相關機構或相關渠道收取費用，情況惹人質疑，駐港解放軍也未有清楚回應有關用地是否仍用作防務用途，若非防務用途就應盡快交還政府。
20101119-10,20101119,10,指港人聲援趙連海　是挑戰北京管治廢噏詹培忠被轟冇良知,指港人聲援趙連海　是挑戰北京管治 廢噏詹培忠被轟冇良知 【本報訊】立法會跨黨派議員前日同聲力促內地法院早日釋放毒奶粉受害家長趙連海，不過金融服務界議員詹培忠昨日卻不理主流民意，指港人聲援趙連海，顯示港人不了解國情，不應「挑剔」內地法院判決，又堅信中國政府如無充份證據，一定不會控告趙連海，揚言不論在內地或香港，任何人想挑戰北京管治權威，「都唔會有好下場」。詹的言論引來泛民議員強烈反彈，指港人聲援趙連海，全出於良知呼喚，「呢個係良知問題，唔係高調低調問題，我哋見到咁嘅事都唔出聲，就係冇良知」。 稱港人不了解國情 立會昨繼續就趙連海被判監兩年半進行休會辯論，在主流民意支持下，前日不少建制派議員均表態支持釋放趙，但昨日發言的詹培忠及旅遊界議員謝偉俊，卻發言公開批評聲援趙連海的人。詹培忠甫發言即質疑港人對趙連海案的反應，反映港人不了解國情，「點解要去挑剔人哋？你哋唔可以絕對話人哋唔啱」，又說北京法院控告趙連海時，一定有「充份證據」，「否則我堅信政府已經係唔會告佢」，又指港人「唔應該討論任何地區嘅政府行為」。詹培忠又警告港人不要挑戰內地司法和中央權威，否則不會有好下場，「呢個世界唔剩只國內，包括香港在內，挑戰管治權威，都唔會有好下場」，又指有議員就趙連海事件批評中國政府，「會令人以為我哋打擊中國」。 判趙連海引起公憤 詹的發言令不少泛民議員譁然。民主黨甘乃威發言反駁，指今次趙連海被判監的結果已引起國內外公憤，「呢個係良知問題，唔係高調低調問題，我哋見到咁嘅事都唔出聲，就係冇良知」，又轟詹培忠指不應挑剔內地法律制度的言論，是本末倒置，「趙連海根本係連去法庭都唔應該，冇理由為自己BB出頭爭取應有權益，要被拉上法庭」。社民連陳偉業亦批評，為中共法院今次判決護航的建制派人士，是「只識做縮頭烏龜，係狗奴才心態」。連續兩日的休會辯論共有27名議員發言，但政府官員堅持潛水不發言。
