key,date,article_daily_id,title,text
20101119-78,20101119,78,補習社未註冊可被檢控,補習社未註冊可被檢控 天水圍居屋居民陳先生發現，有鄰居夫婦經常在家替小學生補習，疑學生數目超過法例規定，但沒註冊，「呢班小學生好頑皮，喺大廈內亂丟垃圾，又喺牆身畫圖畫，影響環境衞生」。陳向教育局舉報，惟獲覆沒證據提出檢控；他欲知當局監管補習社的規定。 勿一次過繳費 教育局回覆，接獲投訴後，派學校督學上門巡查，並無發現學生或教學活動。一般情況下，如巡查其間發現有人在房產內營辦未經註冊或臨時註冊的學校，會發書面警告或提出檢控，並把其後定罪個案資料上載該局網頁。 教育局提醒學生及家長，切勿光顧無牌補習社，以保障利益。如有需要報讀補習社等非正規私校，應選擇已向教育局註冊或臨時註冊的學校，報名前詳閱學校課程單張，留意課程收費包括每月費用及期數，應按月繳費，而不要一次過繳交全部費用，繳交學費後應保存正式收據，上課時須觀察學校環境，留意有否超額收生，如發現有違規情況，即向該局反映。 檔案編號：0810056 教育局網址： http://www.edb.gov.hk  社會服務 ◆報料熱線：29290000 ◆社會服務熱線：29908288 ◆蘋果日報慈善基金：29908688 ◆電郵：mailto:sservice@appledaily.com ◆傳真：37112468 ◆網上捐款： http://charity.appledaily.com.hk/donate  ◆各類表格： http://charity.appledaily.com.hk/forms  匿名投訴恕不處理。一經投訴，本報保留刊登權利。
20101119-79,20101119,79,積金知多啲︰選強積金注意三大因素,積金知多啲︰選強積金注意三大因素 問：本人是一間貿易公司的老闆，有意加多一個強積金計劃供員工選擇，但不知從何入手。選擇強積金計劃時需考慮甚麼因素？ 答：僱主可與員工溝通，了解他們對強積金受託人及計劃的要求；而僱主在挑選強積金受託人及計劃時，可衡量以下三大因素。 （一）受託人的服務範疇及水平 僱主可衡量受託人有否提供適合公司及員工需要的行政支援，例如：協助計算強積金供款的電腦軟件或工具、詳盡的供款紀錄、簡易的行政手續及定期安排僱員講座等。此外，僱主要留意受託人每年為計劃成員提供基金便覽和權益報表的次數，以及容許計劃成員轉換基金組合的次數和轉換所需時間等。 （二）基金選擇多寡 僱主須留意受託人提供的基金選擇是否多元化。原則上，基金選擇越多，僱員越容易挑選到符合個人需要的基金組合。 （三）基金收費 一般強積金基金收費包括參加費、年費、交易費及基金管理費等，但受託人或會豁免部份費用，又或提供額外優惠。僱主可根據受託人的銷售文件，或直接聯絡相關受託人了解收費詳情，也可參考積金局網站的「收費比較平台」 http://cplatform.mpfa.org.hk，比較不同強積金基金的收費。  積金局熱線：29180102
20101119-80,20101119,80,魔鬼論副主教諉過傳媒　教徒反批評教區：不應沉默面對為富不仁,魔鬼論副主教諉過傳媒　教徒反批評教區： 不應沉默面對為富不仁 【本報訊】天主教香港教區副主教楊鳴章在最新一期《公教報》澄清，沒有就羅國輝神父的「魔鬼論」向長實主席李嘉誠道歉，歸咎是傳媒撕裂教會，但直言反對公開指名道姓標籤某人的行為。有教徒擔心事件在教區引發寒蟬效應，發起周日舉行「渴慕正義、實踐真理」祈禱會，並批評教區不應沉默面對為富不仁的剝削者。 記者：白琳 基督教媒體《時代論壇》上周一引述教區秘書長李亮神父，稱楊鳴章已就魔鬼論親自致電李嘉誠道歉。教區傳播處其後發聲明，對魔鬼論引起李嘉誠不快表示遺憾，強調此事不會令李停止捐助明愛。事件引起教徒強烈反響，羅國輝也向傳媒稱被教區「出賣」。 本身是明愛總裁的楊鳴章在最新一期《公教報》撰寫聲明，聲稱從沒直接或間接向李嘉誠道歉，「萬聖節的事件並非由教區或湯（漢）主教所引發，無論對或錯，教區毋須道歉……李先生亦從未要求我們道歉」。 楊鳴章直言不同意公開指名道姓標籤某人，他說：「但這是羅神父的事，我既非在場，亦不了解全部說話的詳細情況，憑甚麼我需要代他表示遺憾呢？」楊強調從沒向傳媒批評過任何神父，因這是「家裏事」，對傳媒「移花接木」感無奈。楊稱主教湯漢叫他忍耐，傳播處的聲明又「語焉不詳」，「我們若處理得不好，引起內外更多誤解，我們誠意致歉」。 楊又親述長實接觸他的經過。本月2日長實一職員致電他：「詢問我是否介意接聽李先生的電話……我能說介意嗎？」李表明繼續捐助明愛，楊表示感謝，「不存在一絲一毫為捐款而去叩頭道歉的問題」。 教徒周日辦祈禱會 對於教區表示遺憾，楊舉例子解釋：「我的同事丁母憂，我握着他的手表示遺憾，這是社交禮貌還是認錯？我希望有識之士能理解此事分別。」他重申不同意發水樓存在，但更不同意「事事由傳媒導引、審判，而最終撕裂教會團體」。 本身是天主教徒的中文大學政治及行政學系學生黎恩灝認為，楊鳴章的聲明不能釋除教徒疑慮，批評楊把責任卸給傳播處，又擔心此事在教區引發寒蟬效應。他與教友將在周日發起渴慕正義、實踐真理祈禱會，今天在報章刊登聲明，斥教區不應沉默面對為富不仁的剝削者，「反而應大力勸勉改錯歸善，甚至應加以揭露和譴責」。他們仍在籌募登報的資金，有意捐款者可致電93343737。 魔鬼論事件簿 10月31日：羅國輝神父在一萬聖節活動上，指邪靈惡魔並不可怕，「李嘉誠、大家樂高層先係食人嘅魔鬼呀」 11月1日：長實高層馬勵志接觸副主教楊鳴章，傳聞馬指李嘉誠對魔鬼論不高興，要求教區回應，否則採取法律行動 11月2日：馬勵志去信楊鳴章，稱只是「關心的查詢」。楊鳴章稱發水樓問題不應針對李嘉誠一人，又說李不高興是正常的 11月8日：基督教媒體《時代論壇》引述教區秘書長李亮稱，楊鳴章曾向李嘉誠道歉，教區曾提點羅注意言論 11月11日：教區發表聲明，對魔鬼論引致李嘉誠不快表示遺憾 11月12日：羅國輝在facebook留言，為教區表示遺憾而痛苦，「我必做一座沉默的驅魔十字架」 11月14日：羅國輝接受傳媒訪問時強調不會收回言論，指教區出賣他 11月18日：楊鳴章在《公教報》澄清，沒有向李嘉誠道歉。主教湯漢說為事件祈禱。 資料來源：《蘋果》資料室
20101119-81,20101119,81,憑《十月圍城》衝擊金馬　求三連霸謝霆鋒勢奪男配角獎,憑《十月圍城》衝擊金馬　求三連霸 謝霆鋒勢奪男配角獎 【第四十七屆金馬獎決戰前夕】第47屆金馬獎將於明天在台灣桃園舉行，港產導演陳德森執導的《十月圍城》獲9項提名，該片演員謝霆鋒及王學圻更成為男配角及男主角的奪標大熱。早前已憑《十》片摘下兩個最佳男配角獎的霆鋒，有望在金馬再下一城，加上電影已經入圍下月舉行的亞太影展，令他的獎座數目坐三望四。另外，影后獎則會是徐帆、湯唯和張艾嘉之爭。 謝霆鋒在電影《十月圍城》中扮演毀容拉車仔，已先後奪得香港電影金像獎及亞洲電影大獎的最佳男配角獎，明晚在桃園縣展演中心舉行的金馬獎頒獎禮，將會是他第三度衝擊男配角獎，他亦已準備到時出席，希望完成三連霸的美夢；而下月初在台北舉行的亞太影展，《十》片已篤定入圍，到時有機會為霆鋒增加一個獎座。 陳德森讚霆鋒破格 事實上今次霆鋒能夠擺脫偶像派形象，在角色塑造及演繹上都令人眼前一亮。身在台北的《十》片導演陳德森昨日接受長途電話訪問時說：「最想都係霆鋒同王學圻老師攞，霆鋒佢真係好努力改變以前靚仔嘅形象，王老師喺戲裏面嘅感染力不在話下，攞獎係對佢哋嘅認同。」 除陳德森看好霆鋒和王學圻外，台灣方面的評論亦一面倒撐王學圻奪得最佳男主角獎，《艋舺》的阮經天只屬越級挑戰，唯一懸念只會來自另一位內地老戲骨倪大紅；如無意外，王學圻將繼去年獲金馬獎最佳男配角後，再進一步成為影帝，他亦已經表明明天會出席頒獎禮。 影后爭奪戰將是鼎足三分之局，雖然台灣影迷極希望在《觀音山》扮演京劇演員的張艾嘉，可重奪台灣失落多時的影后獎座，但內地女演員徐帆在《唐山大地震》中貫穿全片的刻骨演繹，將極有力阻止台灣人圓夢，她明晚會跟《唐》片的導演丈夫馮小剛首度踏足金馬獎頒獎禮。不少服裝品牌及珠寶商已要求為她提供服飾，可見信心十足。相反另一候選人湯唯透過經理人表示，因工作在身未能出席頒獎禮，所以奪標機會只屬黑馬級數。 台灣評審重人情味 女配角方面，首登大銀幕的台灣女演員呂雪鳳在《當愛來的時候》的精準拿揑，不難為她贏得金馬獎座。講到《當》片當然不得不提此片今年獲14項提名，是台灣本土電影的得獎希望。《當》片由台灣導演張作驥執導，劇情講述高中女生來春看不起當二奶的母親，一直想離家出走。不過當她發現自己懷孕又給男朋友拋棄時，大媽的關愛、叔叔無聲的陪伴，讓她逐步找回被人關心、被人愛的感覺；講述一班義士為保護國父孫中山而犧牲的電影《十月圍城》，與《當》片風格迥異，但偏偏在最佳電影及最佳導演獎中鬥過你死我活，亦是這兩大獎項的得獎大熱。但觀乎去年評審團較着重人文關懷的電影口味，聚焦情感及親情的《當》片導演自然被看高一線，《十》片只能靠宏觀的氣魄在最佳電影獎上突圍。 另外，歌星譚詠麟、蕭亞軒及MR.會擔任本屆金馬獎表演嘉賓，台灣名模林志玲則任頒獎嘉賓，而洪金寶及梁家輝已落實出席。 採訪：何永寧 第47屆金馬獎部份入圍名單 －最佳劇情片－ 《父後七日》、《十月圍城》、《當愛來的時候》、《透析》、《第四張畫》 －最佳導演－ 陳德森　《十月圍城》 張作驥　《當愛來的時候》 劉徐杰　《透析》 鍾孟宏　《第四張畫》 －最佳男主角－ 阮經天　《艋舺》 王學圻　《十月圍城》 倪大紅　《透析》 秦徐昊　《春風沉醉的夜晚》 －最佳女主角－ 呂麗萍　《玩醋青春》 湯徐唯　《月滿軒尼詩》 徐徐帆　《唐山大地震》 張艾嘉　《觀音山》 －最佳男配角－ 吳朋奉　《父後七日》 徐才根　《團圓》 謝霆鋒　《十月圍城》 高盟傑　《當愛來的時候》 －最佳女配角－ 張詩盈　《父後七日》 呂雪鳳　《當愛來的時候》 張靜初　《唐山大地震》 郝郝蕾　《第四張畫》 資料來源：金馬獎大會
20101119-82,20101119,82,周秀娜驚青踩蛋,周秀娜驚青踩蛋 周秀娜和莊思敏昨到鑽石山任聖誕亮燈儀式嘉賓，周秀娜即場示範踩雞蛋，並由莊思敏扶住踩了幾級雞蛋樓梯，不過周秀娜表現驚青，場面搞笑。 周秀娜說小時候曾欣賞過沈殿霞在《東華》表演踩雞蛋：「嗰時睇肥姐踩好深刻，成日都想喺屋企踩，搞到媽咪好緊張，唔畀我掂啲蛋。」早前周秀娜和男友陷冷戰，現已雨過天青，但她說男友不時投訴現在約她都要度期。 莊思敏百萬學戲 莊思敏就透露今個聖誕想與家人到外地旅行，但就無意邀男友吳浩康同行：「佢冇耐性，費事啲女人行街時，佢黑面啦。」她又想找詹瑞文學戲，但得知學費不菲，她估計依自己的進度，一個月就要7位數。 採訪：譚倩宜 攝影：陳順禎
20101119-83,20101119,83,李連杰、克林頓分享行善心得,李連杰、克林頓分享行善心得 李連杰近年除了拍戲，亦一直埋首為自己成立的壹基金籌辦活動，他近日原來低調現身香港，昨日更在微博貼上與美國前總統克林頓的合照，李連杰留言說早幾天在港遇上老朋友克林頓，兩人甫見面言談甚歡。 建公益研究院 李連杰說克林頓正協助海地地震後的重建工作，而李連杰的壹基金則在中國和北京師範大學合作建立壹基金公益研究院，克林頓得知後很高興，並答應李連杰下次再到中國會到公益研究院作客，與年輕人分享自己的體驗。 撰文：葉雪
20101119-84,20101119,84,Sammi想翻撻安仔,Sammi想翻撻安仔 自從許志安和女友Michelle分手後，屢傳鄭秀文（Sammi）會跟安仔復合，昨日Sammi抱恙出席慈善活動，談到感情事，她坦言不排除跟任何人有發展機會，更揚言有拖拍是件威水事，所以日後若有機會跟圈中人拍拖，必會公告天下。 鄭秀文昨日帶病跟《歲月神偷》童星鍾紹圖到尖沙嘴出席「香港世界宣明會10萬人連署行動」，戴上口罩的Sammi表示感冒未清，她說：「因為我曳唔聽醫生話，冇食晒啲抗生素，我由細到大都未試過完成過嘅，家真係出事，病咗兩個星期都唔好。」 上帝賜BB會接受 已助養了20多個小朋友的Sammi，坦言覺得助養小孩比自己生更好，她說：「暫時都冇諗過自己生BB，我唔係特別喜愛孕育下一代，如果上帝畀我嘅咪安然接受，但係自己唔特別急住做媽媽。」她笑謂現在收到助養兒童寄給她的信，已感到非常愉快。 日前Sammi到上海出席東亞演唱會時，跟眾人合照並上載微博，惟獨不見她跟許志安的照片，問她是否有所避忌？她坦言：「既然你咁問到，係呀，係避忌，費事麻煩嘛。我同任何人拍拖都會講，我到咗呢個年紀，公開有乜所謂，我有拖拍，同邊個都好，相信我嘅歌迷都會好開心，況且我覺得有拖拍係件好威嘅事，不過係家冇得威，所以冇得講。」 「唔排除任何可能」 當記者指歌迷們都覺得Sammi跟安仔是絕配，她笑說：「都係歌迷嘅幻想，我同佢家真係唔係，不過我唔排除任何可能，我同任何人拍拖都會講，就算圈中嘅都會講，雖然知道公開咗會好麻煩，但係覺得都冇必要隱藏。」　 採訪、攝影：譚倩宜
20101119-85,20101119,85,陳靜未考牌先買車,陳靜未考牌先買車 百果園E神陳靜（DaDa）工作不斷，最近又接拍兩套電影《宅男總動員》和《潮性辦公室》，稍後更會以清純形象為護膚品任代言人和推出年曆，豬籠入水，難怪她直言今年大豐收。 被的士司機騷擾 DaDa承認今年收入理想，打算買車獎勵自己，她說：「平時返工放工多數坐的士，好多時的士司機認得我，不停同我傾偈，如果唔睬佢哋，好似好冇禮貌，但其實我坐的士都係想靜靜休息，所以覺得買架車方便啲。」DaDa打算買10萬元以下的日本車，其他錢則儲起用作置業，但最大問題是她仍未考車牌。　 撰文：葉雪
20101119-86,20101119,86,陳偉霆爆阿Sa送驚喜,陳偉霆爆阿Sa送驚喜 陳偉霆（William）昨日在尖沙嘴出席「Xbox360Kinect玩轉海陸空」活動，後日是他生日，前晚他在女友蔡卓妍（阿Sa）悉心安排下，提早過了一個快樂的生日。 William說：「噚晚真係好開心，女友話同班friend一齊打邊爐，叫我唔食都上去坐下，我錄完音11點幾上到去，得番佢一個，佢話所有人等唔到已經走晒，當時好down，原來女友安排大班朋友喺隔籬房，突然出現畀驚喜我，我仲收到佢送嘅手袋做生日禮物。」 阿嬌唔去頒獎禮 鍾欣桐（阿嬌）昨日到商台宣傳新碟《MoveOn》，她謂當初最抗拒《放低過去》一曲，現在卻最愛這首歌，她說：「啲歌詞講中晒，好似話我之前自閉關埋窗簾，即刻諗起好多嘢。」阿嬌表示將到內地拍劇，故不會出席樂壇頒獎禮。 採訪、攝影：李珮洳、魯萍
20101119-87,20101119,87,君如變超能媽媽,君如變超能媽媽 吳君如前日到上海，宣傳她和古天樂主演的賀歲新戲《神奇俠侶》，但古仔未有現身，擔任監製的陳可辛原先在雲南拍攝新戲《武俠》，但他專程到上海出席宣傳活動。 原來君如和陳可辛已兩個多月沒有見面，兩人甫見面先握手。活動上君如和陳可辛表示不想夫妻檔合作，因為很易把家事一同帶到片場，君如說：「作為演員知道太多，會影響演出情緒。」 君如在戲中有超能力，她透露在囡囡眼中，她也是超級媽咪，認為她任何問題皆可解決，囡囡甚至問她：「你真的會飛？」至於生第二胎的問題，君如說：「如果我還未有孩子，我可能着急，但現在已有，已經不會去想。」 撰文：葉雪
20101119-88,20101119,88,好友鄧文迪改撐李冰冰章子怡被爆甩Vivi變雙失,好友鄧文迪改撐李冰冰 章子怡被爆甩Vivi變雙失 章子怡今年可謂頭頭碰着黑，繼年初捲入四川地震捐款風波後，近日傳她和富商未婚夫ViviNevo正式分手，嫁人好夢成空，難怪外傳她翻撻霍啟山。而章子怡一直和美國傳媒大亨梅鐸老婆鄧文迪私交甚篤，有助她在荷李活發展，但有傳最近兩人鬧翻，好友地位慘被李冰冰頂上，令她的事業頓失大靠山，可謂愛情事業兩失意。 自從章子怡成功進軍荷李活，以及冧掂富商男友ViviNevo後，風頭一時無兩，但隨着年初她捲入四川地震捐款是非，被人質疑有否落實捐款後，聲名受損，接着黑氣纏身。 經理人證實甩拖 首先傳出章子怡和ViviNevo的感情亮紅燈，之前兩人經常以孖公仔姿態出現的情景不復見，沒有富商男友照顧，章子怡不再身光頸靚，難怪近日有傳她翻撻前男友霍啟山，更指兩人到澳門看《水舞間》演出，內地傳媒聯絡章子怡的經理人紀靈靈，她表示絕對沒有此事，再問到章子怡現在感情狀況，有沒有男朋友，紀靈靈回覆：「她現在未有男友。」證明章子怡和ViviNevo已各行各路。 好友鬧翻損失大 感情落空，事業亦有阻滯，原先章子怡接拍大片《雪花與秘扇》，但據知因捐款是非損及形象，結果電影易角，由李冰冰頂上。同時傳出有份參與這部電影製作的美國傳媒大亨梅鐸老婆鄧文迪，跟一直友好的章子怡鬧翻，關係破裂，由於李冰冰臨危受命執二攤接演，故甚得鄧文迪感激，二人馬上成為閨中密友。 不過一直以來李冰冰在公開場合，甚少和鄧文迪一同出現，未有如章子怡當日拖着鄧文迪現身般高調，但日前內地傳媒拍到李冰冰和鄧文迪在北京約會食飯，兩人有傾有講，之後還一同坐車返到鄧文迪的四合院住所，可見交情非淺，而昔日章子怡也曾到過此四合院作客，但現在已人面全非。 撰文：葉雪
20101119-89,20101119,89,范冰冰防狼器傍身,范冰冰防狼器傍身 中國第一美人范冰冰，原來也懂得自我保護之道，早前她在內地接受訪問時透露，她出入隨身會帶備防狼器，若有陌生人超越她的警戒範圍便會使用。 自認有資格搶戲 冰冰一向拼搏，每天平均只睡5小時，早前有電影投資方爆料，指她對大小電影來者不拒，為爭取一些角色，甚至可以不計片酬演出。被問及戲霸這個尷尬問題時，冰冰即瞪起眼不減霸氣的說：「那也得有本事搶才行！比我能搶的人還很多！」 此外，冰冰早前語出驚人說自己不需要嫁入豪門，因為「我就是豪門」，冰冰解釋是為堵別人的嘴，因大家喜歡問甚麼時候嫁入豪門，故乾脆這麼說，她覺得最重要是門後的人是否真心實意的。 撰文：林妃
20101119-90,20101119,90,陳凱歌專捧男星：我不是基,陳凱歌專捧男星：我不是基 陳凱歌日前率領新片《趙氏孤兒》的黃曉明和范冰冰到長沙接受內地節目《快樂大本營》訪問。 自詡女權主義 主持好奇陳凱歌過往執導的電影《霸王別姬》和《梅蘭芳》等，大多數捧紅了當中的男演員，王學圻、張國榮，甚至孫紅雷都知名度躍增，反而同片的女演員卻人氣不及，陳凱歌解釋：「你這樣問的意思，是不是在懷疑我是基啊。」現場觀眾對他的坦白報以熱烈掌聲。 陳凱歌續說：「我沒有歧視的意思啊，但這事必須說清楚，我不是基，我的電影之所以總是男演員能紅，因為我是個女權主義，拍的電影都是給女觀眾看，那當然要找葛優這樣敦厚老實型，王學圻威武有安全感的，包括這麼帥氣的黃曉明，女觀眾看時多享受啊，但這並不是要冷落女演員，比如范冰冰這樣美的女演員演我的戲，讓陪女朋友、老婆的男士們有想頭，別說我沒為男同胞着想。」 撰文：林妃
20101119-91,20101119,91,發聲明證北京結婚大S閃電嫁人被疑有孕,發聲明證北京結婚 大S閃電嫁人被疑有孕 徐熙媛（大S）和內地俏江南少東汪小菲極速撻着，正趕拍新片《大武生》的大S本周二更榮升汪太，兩人禁不住愛火在北京以約10港元手續費登記結婚，不過匆匆嫁人的大S卻被質疑懷有身孕。 台灣女星徐熙媛今年9月底認識了內地俏江南集團少東汪小菲，兩人愛得癡纏高調，見面四次就訂婚，相識未夠兩個月，本周二已秘密在北京登記結婚，大S正式成為汪太。 近日大S身在上海與黃秋生和吳尊拍攝電影《大武生》，陷入瘋狂戀愛的她被指詐病向劇組請假，本周一請假後即飛到北京會合汪小菲，兩人更於周二花費約10港元手續費登記結婚，昨日大S發聲明親證結婚，並公開婚照。 只見大S和汪小菲恩愛緊擁合照，大S更讚老公的帥氣度絕不輸給妹妹小S的老公，聲明中說：「小菲和我於11月16日在北京登記結婚了，感謝各界關心和祝福，我們兩家人都非常開心！小菲和我今後工作照常，懇請媒體朋友給點空間，追殺我們同時自己也請注意安全。」 奶奶要求做人踏實 登記結婚後，兩人未有展開蜜月之旅，反而漏夜乘最後一班機回上海，大S繼續拍戲，由於她被大批記者追訪，故劇組嚴陣以待，出入都用人肉擋箭牌保護她。今次大S匆忙結婚，加上近日她多穿休閒服配平底鞋，故傳出她已懷孕，但其五姑徐薇否認其事，而好友吳佩慈和黑人陳建州也謂沒聽聞。 大S的奶奶張蘭日前接受內地節目訪問，坦言滿意大S做媳婦，她說：「尊重孩子的選擇，他很成熟了，相信他選擇的終身伴侶，不會兒戲。作為一家人是一種緣份，我們都惜福，都珍惜，對於媳婦的要求就是踏踏實實做人、守誠信，這是家族的美德。」 張雨綺約會蘇有朋 雖然有傳大S從張雨綺手上硬撬汪小菲，不過失去金龜婿的張雨綺也不愁寂寞，日前被拍得與蘇有朋親密現身北京機場，張雨綺離開時所坐的座駕更屬汪小菲所有，估計是汪小菲大方將車子送贈給舊愛。 撰文：林妃
20101119-92,20101119,92,"mercibeaucoup,　進駐又一城　帶你提早過聖誕","mercibeaucoup,　進駐又一城　帶你提早過聖誕 極受潮人追捧的日本品牌mercibeaucoup,又有新攪作！品牌剛於又一城開設第三間專門店，貫徹其天馬行空的特色，以雞髀作逗號，化身為本土特色的燒臘店，配上有趣可愛的聖誕新裝，大家還不趕去朝聖？ 遊逛mercibeaucoup,總給人歡樂愉快的感覺，又一城的mercibeaucoup,專門店由日本的室內設計團隊親自負責，並破天荒以極具香港地道文化特色的燒臘店為設計藍圖。門面的長方玻璃內，掛起了一排又一排以啡、橙及綠色等造成的大型咕裝飾，如同燒臘店內掛賣的燒鴨髀和油雞髀等模樣，加上豐富的顏色設計，切合品牌活潑可愛的形象，令人流連忘返！ 聖誕置裝首選 今季品牌以聖誕節與花為主軸，設計師宇津木將聖誕節相關的元素注入設計，當中首推鹿角上衣、北歐風編織的鹿角圖案毛衣、色彩繽紛的leggings、以及令人心動的立體花配飾等，務求讓大家感受到「天天都是聖誕節」的歡樂氣氛！另外品牌副線jevousenprie!快將加推，以及尖沙咀LCX的專門店亦於本周六開幕，粉絲們記緊密切留意！ 現凡於mercibeaucoup,又一城專門店及即將開幕的尖沙咀LCXmercibeaucoup,專門店內購買2010秋冬系列滿5,000元(扣除折扣後)，即可免費獲贈精緻手帕一條/滿8,000元(扣除折扣後)，更可免費獲贈精緻午餐盒一個，數量有限，送完即止。 銅鑼灣百德新街66號 28082789 尖沙咀海港城海運大廈LCX8A號舖 27350729(11月20日開幕) 尖沙咀新港中心1樓133號舖 27353062 九龍塘又一城LG230號舖 22658405"
