key,date,article_daily_id,title,text
20100128-0,20100128,0,以眾凌寡　保皇黨18人拉隊離場議會暴力阻五俠發言,以眾凌寡　保皇黨18人拉隊離場 議會暴力阻五俠發言 【本報訊】中央出手打壓「五區公投運動」，保皇派全力配合做打手。五名公民黨及社民連議員昨日在立法會大會宣讀辭職聲明前，民建聯及工聯會等議員突然聲言反對公投運動，拉隊離場抗議，最終會議因人數不足一半而流會收場，令五人無法在官方會議紀錄上留下辭職因由。泛民主派狂轟保皇派以眾凌寡，利用「議會暴力」扼殺議員發言機會，避聽民眾的心聲，行為極度可恥。記者：許偉賢、莫劍弦 據了解，公民黨及社民連正研究是否將辭職生效日期押後一周，以便五位議員得以在下周大會發言。 社民連主席黃毓民、陳偉業及「長毛」梁國雄，以及公民黨副主席梁家傑和陳淑莊，原訂昨天出席立法會大會時宣讀辭職聲明。五人早向主席曾鈺成遞交發言演辭，並獲批准。正當曾鈺成準備容許五人發言前，部份保皇派卻突然使出連環招窒礙五人的請辭大計。 民建聯陳鑑林首先指五人未有事先向議會提交講稿，質疑不符規程，曾鈺成即表明已經予以批准。民建聯主席譚耀宗接力出擊，發言表明不滿泛民議員利用議會宣傳公投運動後，民建聯、工聯會及專業會議等18位議員即時轉身離開。工聯會王國興離開前高叫「濫用公帑補選可恥、煽動公投港獨卑鄙」，肆意抹黑公投運動。 官員一反常態沒有人列席 面對流會危機的泛民主派力挽狂瀾，急召多名成員包括民主黨李永達及街工梁耀忠返回議事廳；反對拉隊離場的自由黨主席劉健儀也「幫拖」致電黨友張宇人及方剛回去。雖然多名泛民議員趕及在15分鐘內返回議會，但由於逾十多名建制派議員根本不在席，最終除21名泛民主派議員外，建制派只剩下劉健儀、旅遊界謝偉俊、會計界陳茂波、陳鑑林及曾鈺成，合共26人，尚欠4人才夠法定開會人數，會議被迫流會。 不但部份保皇派「玩杯葛」，連特區官員也對此「冷處理」，因為五位議員準備發言時，一反常態地未有任何官員列席，迴避態度相當明顯。牽頭帶隊離場的譚耀宗會後辯稱代表市民表達不滿，聲言：「流會責任唔喺我哋度，佢哋（泛民）要承擔，因為佢哋要用個議會做宣傳。」但事實卻是不論泛民主派以至建制派陣營，均同聲討伐這種剝削議員發言權利的政治舉動。 泛民議員同譴責行為無恥 21位泛民主派議員昨日罕有團結一致抗敵，流會後舉行聯合記者會強烈譴責離場議員行為無恥。身為五區公投運動總發言人的公民黨黨魁余若薇狠批保皇派不敢面對現實，直指：「佢哋成日話要杯葛，又話唔撥款、又話要阻止人辭職同阻止人參選；一切一切手段，其實都係逃避一樣嘢，就係民意。」社民連陳偉業也稱事件「反映保皇派嘅虛怯已經到咗接近崩潰嘅地步」。 雖然不參與五區公投運動，但民主黨大力聲援盟友，主席何俊仁狠批保皇派製造流會，憤指：「連咁樣嘅發言權都要剝奪，咁做係侮辱議會嘅精神，破壞一個議會應該有包容文化。」職工盟李卓人亦炮轟離場議員封殺言論，「我覺得民建聯同保皇黨今日嘅行為只有兩個字可以形容，就係無恥。」 建制派內部也有不滿。身為內務委員會主席的劉健儀不認同議員透過離場表達不滿，強調「議員係嚟開會o架嘛」，批評離場議員「太情緒化」，「唔開會真係唔啱。」謝偉俊也指部份保皇派用上「非常手段」去「玩政治」；原已離場抗議的陳茂波為免流會，其後折返會議廳。 前政務司司長陳方安生也發表聲明強烈譴責議員故意離席引致流會，認為議員請辭事關重大，應該讓他們發言。 《昨日立法會會議議員出席情況》 出席議員（26） 立法會主席：曾鈺成 民主黨（8）：何俊仁、張文光、李永達、李華明、涂謹申、劉慧卿、甘乃威、鄭家富 公民黨（4）：余若薇、梁家傑、吳靄儀、陳淑莊 社民連（3）：黃毓民、陳偉業、梁國雄 民協：馮檢基 職工盟：李卓人 街工：梁耀忠 公民起動：何秀蘭 社福界：張國柱 衞生服務界：李國麟 民建聯：陳鑑林（要求點人數） 自由黨：劉健儀 旅遊界：謝偉俊 會計界：陳茂波 離場議員（18） 民建聯（8）：譚耀宗、劉江華、葉國謙、李慧琼、陳克勤、黃容根、張學明、黃定光 工聯會（4）：黃國健、王國興、葉偉明、潘佩璆 經濟動力（4）：劉皇發、林健鋒、梁君彥、梁劉柔芬 專業會議：何鍾泰 工商界：黃宜弘 缺席議員（16） 獨立建制派（9）：詹培忠、葉劉淑儀、李國寶、陳健波、梁家騮、林大輝、譚偉豪、李鳳英、霍震霆 專業會議（3）：梁美芬、劉秀成、石禮謙 自由黨（2）：張宇人、方剛 民主黨：黃成智 公民黨：湯家驊 註：（　）內為人數 資料來源：《蘋果》資料室
20100128-1,20100128,1,內地女孩贈角膜救港童,內地女孩贈角膜救港童 【本報訊】6歲內地女孩小珊珊，和同齡香港巴基斯坦裔男童小宇邦，兩人互不相識，卻因為一隻眼角膜將他們的生命連在一起。小珊珊因為患上卵巢癌不幸去世，生前母親問願不願意「留下一些東西」，小珊珊點頭，就此她的一對眼角膜令兩人重見光明，一個是汕頭男子，另一個便是小宇邦。 點頭同意捐輸 小珊珊名叫李珊，去年發現患上卵巢癌被送入靈養院度過餘生，其間紅十字會醫生徵求珊母讓女兒死後捐出器官，珊母於是婉轉向女兒問：「你願意走時留下一些東西給科學家研究嗎？」小珊珊在重病中點頭同意。 6歲的香港巴童小宇邦，3年前患上角膜白斑，在港屢醫無效，醫生對邦父表示若要徹底治好其子眼疾，就必須進行眼角膜移植。小宇邦的太叔公阿里，03年因右眼患上蠶蝕性角膜潰瘍，在朋友介紹下到深圳市眼科醫院求醫，結果成功移植眼角膜令他重見光明。 事隔7年，邦父記起這事件，於是帶着兒子北上入住同一間醫院碰運氣，終於在本周二得到小珊珊的一隻眼角膜，令小宇邦再見光明。
20100128-2,20100128,2,狂徒科大10樓擲渠蓋,狂徒科大10樓擲渠蓋 【本報訊】一名神秘男子日前懷疑於科技大學學生宿舍旁的行人天橋上，將一塊渠蓋擲下至地面，險些擊中一名在附近工作的花王。科大已報警求助並呼籲學生提供資料，惟至今仍未確定行兇者身份。校方發言人稱，事件屬刑事性質，若查明案件與學生有關，會將事件交予警方處理。 警方發言人證實，收到一名61歲男子報案，指1月25日早上約9時於科大Hall1宿舍，一塊面積約30厘米乘30厘米的渠蓋從高處墮下，事件中無人受傷，案件懷疑與一名年約30歲的男子有關，警方將案件列作高空擲物案處理，暫未有人被捕。 險擊中外判員工 科大發言人表示，報案員工為外判園林公司職員，當日學校保安部報稱有物品從高處墮下，保安員趕到現場發現有渠蓋碎片，同時發現連接同一宿舍10樓的行人天橋地面，其中一截水渠少了一塊渠蓋，推斷墮下的渠蓋來自10樓，但未有發現任何可疑人物。 校方事後已加強保安巡視有關範圍，張貼告示並透過電郵通知所有員工及學生，呼籲提高警覺，發言人稱，如發現可疑人物即向保安部報告，並全力配合警方調查；若有學生與案件有關，將交由警方處理。 記者昨到肇事現場視察，發現天橋其中一段被查封，地面上水渠明顯缺少了一塊渠蓋，現場貼有校方告示，呼籲學生不要高空擲物。 女宿生心有餘悸 科大學生會會長蘇翊程表示，該行人天橋容許公眾人士使用，但較少看到校外人士，Hall1為本科生宿舍，有保安員駐守，相信學校未必存在保安問題。宿生王小姐說，事發時是早上9時，應該是員工上班時間，幸好早起的宿生不多；她日後會選擇有上蓋的行人通道往來。 臨床心理學家朱嘉麗表示，近年大學生求學壓力過大時有發生，有學生為求排解壓力而作出破壞行為亦有其可能，「如果係學生所做，咁佢試過一次，好大機會會沉溺落去，每次有壓力就用相同方法發洩。」 科大06年於相同地點亦曾發生高空擲物，數名海外生晚上在宿舍內飲酒後借醉鬧事，在宿舍內叫囂，並將一木製保安亭由10樓擲落宿舍旁的行人路，校方最終懲罰肇事學生。
20100128-3,20100128,3,鄧竟成圖控反高鐵示威者直言與80後溝通　只為「知己知彼百戰百勝」,鄧竟成圖控反高鐵示威者 直言與80後溝通　只為「知己知彼百戰百勝」 【本報訊】警務處處長鄧竟成昨日首度開腔評論1.16反高鐵示威，表示將交由律政司研究檢控部份示威者。對於「80後」年輕示威人士，他表示為了「知己知彼、百戰百勝」，會加強與他們溝通。反高鐵人士批評，鄧竟成的言論反映警隊已自視為政治工具，協助政府處理政治問題，「以為戰勝啲示威者，等如政治問題解決咗咁。」　記者：謝明明、張嘉雯 警方近期面對內地公安在羅湖橋涉嫌越境執法時被指坐視不理，處理反高鐵示威和元旦遊行等群眾活動時卻動用過度警力對付和平示威者，鄧竟成昨在回顧警隊工作的記者會上回應時稱，警方視乎實際情況採取相應行動，強調前線人員行動克制，按警隊政策方針辦事。 警被指自視政治工具 對於是否會檢控圍堵立法會的反高鐵示威者，他沒有正面回應，只說大型示威活動後警方都會檢討，若示威者有過激行動，警方會採取適當武力，並會跟進調查，將掌握的證據轉交律政司研究是否檢控。至於懷疑公安越境執法，他指警方已將被指是內地公安的男子的相片，交內地當局核實，但暫未獲回覆。 鄧又稱警方吸取近期示威活動的經驗，會加強與主辦單位聯繫，尤其是80後年輕示威者，「佢哋好多都唔屬於任何組織，警方一直都有透過唔同媒介接觸同了解佢哋，知己知彼，百戰百勝，了解對方想法令溝通更暢順。」 對於鄧竟成以「知己知彼、百戰百勝」形容警方跟年輕示威者溝通的心態，反高鐵停撥款大聯盟成員朱凱迪認為，這反映警隊已自視為政治工具，協助政府處理政治問題，視示威者是政府的敵人。他指出，示威遊行中示威者與警方的肢體碰撞，與黑社會或罪犯刻意襲擊警察的嚴重性相差很遠，當局卻將肢體碰撞放大提升至等同襲警，近年動輒對示威者控以襲警罪，「（示威者）佢哋係對香港有心嘅人，唔係罪犯，但政府或警方以為戰勝啲示威者，等如政治問題解決咗咁。」 朱凱迪舉例，昨日發生的警察被摑事件，明明摑人者應受批評，但網上討論焦點卻是被摑警察暈倒的「表現」，因為令人聯想到過往警察處理示威時「插水」的做法；警察自毀公信力，其實很可悲。 議員狂轟拘捕陳巧文 保安局局長李少光昨日在立法會會議表示，警方在元旦遊行派出超過1000名人員維持秩序，但沒有不同路段警力的詳細資料。議員劉慧卿批評警方部署大量警力是挑釁示威者，「警察多到蟻咁，鐵馬圍成四、五重，你話唔知唔同區域有幾多警力？有冇可能呀？」李少光指當日警方只採取防守策略，不同意挑釁示威者的說法。 議員黃毓民批評警方事後拘捕港大女生陳巧文是製造白色恐怖。涂謹申也質疑警方做法高調，在香港電台外作出拘捕，有違正常程序。李少光則否認拘捕行動是秋後算賬，強調並非針對個別人士，又指警方之前曾到過陳巧文住所，但找不到她。
20100128-4,20100128,4,評論員批評警方挑釁示威者　形象盡毀李少光聲稱警隊威望高,評論員批評警方挑釁示威者　形象盡毀 李少光聲稱警隊威望高 【本報訊】文化評論人陳雲日前在報章撰文，批評警方在遊行中挑釁示威者，輕率動用襲警罪，令巿民深感不滿，同時也令警方多年來建立的形象毀於一旦；保安局局長李少光昨指陳雲的文章斷章取義，否認警方挑釁及羞辱示威者，亦不認同警隊威望掃地，「警方喺巿民心目中嘅信任同威望好高。」 昨日立法會上，社民連黃毓民引述陳雲的文章，李少光最初拒絕回應，其後被公民黨議員吳靄儀追問時指文章內容不實，「評論員文章每日都有，有啲話警方濫用權力，有啲人就話克制，呢篇文章好多時係斷章取義。」他強調，巿民對警方的信任度高，在巿民心目中威望度也很高，「我唔同意97年後警隊係比以前更濫權，更威望掃地。」對於文章指警方拘捕示威者後，以各種方式加以羞辱的指控，他認為與事實不符。 網上罵警察40年罕見 陳雲在文章中指，近日大量網上留言辱罵警察，是40年來罕見，警方用圍欄封鎖或收緊示威路線，故意激怒和挑釁示威者，一旦發生口角或身體推撞，即控告襲警罪名，甚至示威者舉機拍攝警察，也受到一般毆打的罪名警告。他解釋，襲警罪原意是對付黑幫，現今用來對付和平示威者，是將市民當作黑幫集團成員。
20100128-5,20100128,5,警隊聘1200人　須評估心理,"警隊聘1200人　須評估心理 【本報訊】警隊將於今年招聘逾1,200人，並於4月引入心理質素評估，挑選適合警務工作的人選，有助減少人員流失及提高服務水平。警方又修改行為指引，限制警務人員不應與會影響警隊聲譽的人士交往。 警務處副處長曾偉雄昨於記者會上表示，未來兩年是警隊人手自然流失高峯期，警隊計劃今年招聘1,200多人填補空缺，較去年警隊招聘約1,000餘人多，包括新聘150名督察及1,082名員佐級人員。 擴大不良分子定義 為挑選更適合人選，當局將於4月間在招聘中引入心理質素評估。曾透露，投考者在完成筆試、體能測試及初步面試後，需填寫一份3頁問卷，提供心理狀態資料，供最後遴選面試時參考，「考官會根據份心理問卷提出一啲問題，評估投考人嘅心理質素適唔適合做警察。」被問及若投考者未能通過心理質素評估，是否不獲取錄，曾稱該項評估只作參考。 曾又表示，警隊誠信管理委員會發出7項正直及誠實品格行為指引及4項價值觀判斷方法，其中警隊擴大不良分子定義，除黑社會及有罪案紀錄人士外，「任何影響警隊聲譽」的人士也會視為不良分子，警務人員應避免交往。 對於警隊文件多次被人流傳到互聯網，曾偉雄表示，至今共發現35宗警隊內部資料外洩事件，大部份已完成調查，有21名警員需接受紀律處分。警方將向立法會財委會申請撥款，在西九龍總部推出先導計劃，將所有警隊資料儲存到中央資料庫，不再儲存於警署電腦內，減少外洩風險。"
20100128-6,20100128,6,強姦案增三成　友姦高達95%,"強姦案增三成　友姦高達95% 【本報訊】警方去年接獲136宗強姦案，較前年激增三成，95%案中受害人與侵犯者認識，其中有31宗是在網上結識，反映友姦罪案嚴重，警方會加強教育宣傳，提醒市民結交網友要謹慎小心，女士切勿單獨約會。 關注青少年毒品問題 警方於去年共接獲7.7萬多宗罪案，較前年輕微下跌1.1%，除強姦案外，兇殺案也由前年的36宗上升至去年的47宗，升幅30.6%，警務處處長鄧竟成解釋，是因為去年落馬洲及坪輋發生多人謀殺案有關。 鄧又非常關注青少年毒品問題，去年10至15歲涉嚴重毒品罪案被捕少年有169人，較前年144人增加17.4%，涉及嚴重毒品罪案被捕的學生人數更多達240人，較前年上升14.8%。 提及近期發生多宗司機懷疑吸食「K仔」後駕駛的案件，鄧竟成表示，警方非常關注，前年及去年分別檢控3宗同類案件。但警方不能抽驗懷疑曾經吸毒的司機，對於警方會否支持修例，授權警方抽驗藥後駕駛，他表示，修例需獲市民及立法會討論及支持。 本港罪案情況 整體罪案 09年：77,630宗　08年：78,469宗　增/減幅度：-1.1％ 破案率 09年：45.6％　08年：45.6％　增/減幅度：－ 搜獲可卡因 09年：121公斤　08年：64公斤　增/減幅度：+90.4％ 搜獲毒品「冰」 09年：44公斤　08年：24公斤　增/減幅度：+82.7％ 搜獲忘我類毒品 09年：15,442粒　08年：11,984粒　增/減幅度：+28.9％ 兇殺案 09年：47宗　08年：36宗　增/減幅度：+30.6％ 強姦 09年：136宗　08年：105宗　增/減幅度：+29.5％ 刑事恐嚇 09年：2,338　08年：1,934　增/減幅度：+20.9％ 店舖盜竊 09年：10,733宗　08年：9,343宗　增/減幅度：+14.9％ 金舖/錶行劫案 09年：2宗　08年：5宗　增/減幅度：-60.0％ 持類似手槍物體劫案 09年：12宗　08年：22宗　增/減幅度：-45.5％ 資料來源：警務處"
20100128-7,20100128,7,新世紀疫症爆豬流感　特殊學校停課七天,新世紀疫症 爆豬流感　特殊學校停課七天 【本報訊】衞生防護中心接獲今年首宗學校爆發豬流感而要停課個案。屬於特殊學校的深水埗東華三院群芳啟智學校爆發豬流感，感染5名學童及職員，當中1名女童情況嚴重，該校今日起停課7天。但市民對豬流感疫苗仍沒信心，昨日只有1179名市民接種疫苗，創單日新低，只有1名孕婦接種。 四學生一職員中招 深水埗的特殊學校東華三院群芳啟智學校爆發豬流感，4名7歲至15歲的學生以及一名職員中招。其中一名有長期病患的11歲女童，本月20日出現發燒、咳嗽及抽搐，兩日後入院，其呼吸道分泌樣本對豬流感呈陽性反應，她未有接種豬流感疫苗，其他病人情況穩定。衞生防護中心建議該校由今日起停課7天，並已到訪該校，給予健康教育資訊。 截至昨午一時的24小時內，只有1179名高危人士接種疫苗，創單日接種人數新低。接種者中包括1名孕婦、330名65歲或以上長者、255名長期病患者等。本港豬流感疫苗接種計劃展開逾一個月，至今只有約15萬名高危人士接種。屯門醫院發言人表示，首宗接種豬流感疫苗後出現死胎的孕婦，前日獲安排入院準備取出死胎。
20100128-8,20100128,8,和合石墓地擬建骨灰龕,和合石墓地擬建骨灰龕 【本報訊】違規骨灰龕問題嚴重，過去三年地政總署等多個部門，共接獲18宗在大廈或唐樓等設骨灰龕的疑違規投訴，但調查後全部沒有違規。為增加骨灰龕供應量，食物及衞生局正研究在和合石墳場，將長期無使用的土葬墓地改建為骨灰龕，若計劃落實預料可提供5萬至6萬個骨灰龕。 經營骨灰龕投訴不成立 食物及衞生局局長周一嶽昨書面回覆立法會議員提問時表示，根據發展局的資料顯示，過去三年地政總署接獲市區舊式多層大廈單位疑違反土地契約，經營骨灰龕的投訴達6宗；規劃署則接獲5宗紅磡區唐樓單位用作廟宇用途的投訴，全部涉及骨灰龕。食物環境衞生署也接獲9宗同類投訴，當中7宗涉及經營骨灰龕。 地政總署調查投訴後發現，有關土地契約並沒限制骨灰龕用途；規劃署已將投訴轉交有關部門跟進。食環署發現被投訴的處所，並沒無牌經營殮葬商活動或造成環境衞生滋擾。民政事務局亦接獲兩宗在樓宇經營廟宇投訴，但與骨灰龕無關。為加強規管骨灰龕，政府考慮實施自願登記制度。 此外，食物及衞生局局長周一嶽上周五曾往粉嶺和合石墳場，視察是否可將長期無使用的土葬地，改建為骨灰龕。據了解，目前和合石內有一幅位於橋頭路，面積約3.6公頃的土葬墳地，政府內部已批准改建為骨灰龕位或紀念花園，但政府暫時未有興建或諮詢地區人士的時間表。
20100128-9,20100128,9,發展鹿茵山莊賺11億　被追1.8億稅聖公會挑戰稅局敗訴,發展鹿茵山莊賺11億　被追1.8億稅 聖公會挑戰稅局敗訴 【本報訊】香港聖公會將大埔聖基道兒童院舊址地皮，交予地產商長實合作重建低密度豪宅鹿茵山莊，從中獲利逾11億元，遭稅務局徵收逾1.8億元利得稅。香港聖公會不服上訴高院。法官昨指，香港聖公會未有提交賬目，顯示利潤用作慈善用途，不符合條例所定，故判敗訴兼付訟費。 記者：梁瑞珮 香港聖公會教省秘書長管牧師表示，需時詳細研究判詞，才能決定是否上訴，暫不作評論，而該次是香港聖公會首度與地產商合作。聖公會代表律師對判決表示失望。 稅務局發言人對判決表示歡迎，至於過往有沒有教會機構因與地產商合作，引起徵稅爭議，發言人指，基於《稅務條例》保密條款的規定，不能公開個別個案資料。 未交賬目解釋利潤去向 法官芮安牟在判詞指出，雖然上訴一方指，按聖公會的憲章及規例，聖公會作為宣揚宗教的慈善團體，其宗旨是不可從事生意及商業業務；但法官認為，兩者是沒有牴觸及矛盾。 法官指，按詮釋有關憲章，沒有限制教會處置資產，即使憲章禁止教會使用資產作非慈善用途，亦不代表教會無意圖及無從事生意及商業業務。稅務上訴委員會認為聖公會有意圖改變，將地皮轉作商業用途，實屬合理結論。 另按條例，教會有責任證明所得利潤純粹作慈善用途，以及大部份使用於香港，才可獲豁免繳稅。然而，聖公會徐贊生主教向上訴委員會呈交的供詞，未有解釋所指的慈善活動是甚麼，教會亦沒有提交賬目，顯示所得利潤的用途及去向，故不符合條例規定。 獲部份物業再攤分得益 上訴人香港聖公會管業委員會及香港聖公會基金，遭稅務局徵收由98至05年發展鹿茵山莊共逾1.8億元利得稅。 聖公會93年與長實達成協議，將大埔聖基道兒童院舊址地皮交予長實合作重建，由教會向政府申請更改土地用途。項目竣工後，聖公會獲分部份物業出售或自用，另與長實攤分餘下物業的銷售得益。判詞披露，整項發展聖公會從中獲利至少11.19億元。 環保觸覺主席譚凱邦批評，政府當年以廉價甚至免費將社福用地批予非牟利機構，卻沒有限制他們跟發展商合作「搵錢」，今次事件正反映存在漏洞。他指另一社福機構安貧小姊妹會，也正申請將轄下香港仔惠福道聖瑪利安老院改建為住宅大廈，項目總值最少50億元，敦促政府盡快檢討限制社福用地隨意改變用途。 案件編號：HCIA2、3/09
