key,date,article_daily_id,title,text
20101119-265,20101119,265,看圖佈陣：恒指反彈料受制20日線 - 祝文韜,看圖佈陣：恒指反彈料受制20日線 - 祝文韜 美滙回軟及A股止瀉回升，帶動港股顯著反彈，恒指昨日高開223點，午後最多升457點，高見23671，收報23637，升422點，成交923億元。 恒指回調至9月升浪的0.382倍黃金比率（23225）後出現反彈，屬預期之內。昨日雖以陽燭回升，惟技術指標進一步轉弱，10日線（24254）由升轉跌，逐步跌近20日線（23938），MACD熊差距持續擴大，短期向淡形勢未變，昨日回升只是正常反彈，20日線將是較大阻力，不易突破，在重新站穩該線之前，實難言調整完成。 恒指自9月中升破起自去年11月的中期降軌後，個多月已升近量度升幅25000水平，9月升浪的0.5倍黃金比率22680，與5月至今大升浪的0.382倍黃金比率22689相若，即使反彈後再下試該位，仍屬合理調整。 德昌破旗　升浪再起 德昌電機（179）近期跟隨大市整固，昨日回升0.21元或4.56%，收4.82元，成交533萬股，調整相信已經完成，可短炒或作中線持有。 德昌日線圖自3月起營造圓底形態，8月開始回升，本月升至5元水平受阻，呈現旗形整固，昨以陽燭升破旗形，並重上10日線（4.79元）之上，100日線剛升破250日線，出現黃金交叉，主要平均線以向好排列，MACD熊差收窄，未來一兩日有望重現雙牛，走勢向好，可於4.85元或以下買入，短炒以圓底頸線5.30元作目標，失守4.65元止蝕；中線則可以圓底量度升幅7.10元為目標。 祝文韜
20101119-266,20101119,266,期指戰況：正常後抽　淡勢未變 - 吳六奇,期指戰況：正常後抽　淡勢未變 - 吳六奇 即月期指連挫4日後終有較像樣反彈，昨日高開196點後反覆造好，午後在A股帶動下最多升459點，高見23634，尾市升勢回順，最終升362點，收報23537，低水100點，成交合約8.9萬張。 期指日線圖連續4日出現陰燭後，昨以陽燭回升，惟之前的9月升軌23742一如預期由支持變阻力，反彈亦暫受制於小時圖保歷加通道中軸及250小時線，近期調整是否完成仍言之尚早，暫先以正常後抽看待。事實上，技術指標持續轉弱，10日線（24190）及20日線（23895）已由升轉跌，MACD熊差距進一步擴大，短期向淡形勢並未扭轉，20日線與10月高位23897相近，將是今次反彈較大阻力所在。 由於向淡形勢未變，不妨趁反彈在20日線附近小注部署淡倉，以9月升浪的0.5倍黃金比率（22584）作目標，升破10日線止蝕。 吳六奇
20101119-267,20101119,267,窩輪戰機：中電信轉強勢　25949可倍升 - 方德正,窩輪戰機：中電信轉強勢　25949可倍升 - 方德正 大市出現4連陰後，昨終強力反彈，暫免跌穿恒指50日線的考驗。 每次急劇下墜，投資心理多傾向看淡。這是人性弱點，能夠做到「眾人皆醉我獨醒」，才可長期站在勝利的一方。 恒指昨日全程穩處反彈通道內，最高23671，收23637，仍升422點，差點收復前日所失，可惜恒指成份股交投不及前日積極，反映出對今次反彈，投資者仍半信半疑，不敢妄動。 中電信（728）昨升至4.02元後，雖退收3.97元，但升幅1.5%已是3隻內地電訊股之冠。瑞信提升中電信目標價至4.40元，全日均見其活躍於買盤之間，主動掃貨佔56%，9RSI重越40，MACD熊差距收窄，反彈目標4.60元。 ■中電信C輪25949收報0.207元，升0.009元，成交22.9球。此輪2011年3月14日到期，行使價4.51元，溢價18.8%，槓桿率19.2倍，有效6.8倍，引伸波幅44.2%。正股見4.60元，此輪理論價0.501元，升142%。 方德正
20101119-268,20101119,268,實戰理論：中國扭轉乾坤抵銷QE2衝擊 - 沈振盈,實戰理論：中國扭轉乾坤抵銷QE2衝擊 - 沈振盈 連跌多日之後，股市終於出現技術性反彈，相信大部份圖表派都預計得到，始終大市的累積跌幅已差不多1800點。昨日之反彈，回補了大部份前日的下跌裂口，理論上要上試23800至23900點水平也不足為奇。 不過，暫時只能看作技術性反彈，不能過早相信大市已見底。原因有三：（一）美元升勢仍持續，資金流向尚未轉變；（二）中國緊縮政策威力強勁，為要抵銷QE2衝擊，相信仍大有後着；（三）失敗的QE2已令部份資金失去信心，既然早前炒高了股市，炒過龍，又派到貨，於是便順勢沽深一點。 儲局再推QE自取滅亡 對於美元的看法，睇淡美元者始終都是陳腔濫調，只憑「銀紙印得多就要跌」的片面理由，就當作是一切。更有甚者更話，若然QE2冇用，便QE3、QE4……一直QE下去。筆者聽到，簡直覺得不知所謂，若然伯南克真的這樣做，就只會自取滅亡。為何QE2只做6000億美元？就是因為有一些事情已到了危險邊緣，到了底線，再做下來將令全世界對美元、美債失去信心，到時美國就只有「破產」一條路。大家見到長債孳息持續上升，便應該知道資金對聯儲局回購的行動，採取趁機走貨的部署。 中國面對今次美國不負責任行為，水來土淹，已奏奇效。先抽緊銀根，再以內部行政手段打壓炒賣及限制售價，趕班炒家離場，令他們拆倉而挾高美元。 美元一升，商品價格再跌，通脹自可紓緩。最終的結果應該是要令到一切回復至9月份剛開始炒QE2時的水平，即美滙重上82至83，歐元1.3，恒指22000點，金價1250至1280美元。 沈振盈 作者為證監會持牌人士
20101119-269,20101119,269,財智語陸：基金暫無洗倉誘因 - 陳永陸,財智語陸：基金暫無洗倉誘因 - 陳永陸 對於恒指昨日的強勢反彈不感意外，一來是港股連日急回，技術上已出現短線超賣，二來是突如其來的一挾，淡倉們先行回補，因而加速升勢。值得留意是昨日不少財經報章都有指出前日的大跌市是基金洗倉之故，但昨日反彈最勁的，卻是一眾基金股，那麼究竟基金是洗倉還是補倉呢？ 昨日我曾提過這個升浪中的基金部署，恒指回到現水平被迫洗倉，似乎是早了一點。或者對前日基金股急跌，我會演繹為基金先行沽貨獲利。事實上整個港股升浪，不少強者都獲利甚豐，並靜觀其變。 之前已跟一些小投資者講，如果這個升浪完全沒有享受過任何成果，策略上肯定蝕大章，情況就如上述例子，人家不乏獲利空間，高位揸了貨究竟是跟沽止蝕？定是死守到底？如果止蝕後股價如昨日般反彈，又是否跟追？這種疲於奔命的玩法，相信未見利潤已磨滅心智。為減少這心理上失衡，除非真的投資市場是打緊10號風球，否則每次急回時，自己多少總會買點心水股，這是另一原因解釋為何建議趁這個調整要分注買。 下月消費旺短炒零售股 說開基金洗倉，其實除非好像金融海嘯等客觀情況，市場陷於極度恐慌，又或者出現基金贖回潮，基金才會被迫理性地洗倉，但以目前客觀形勢，即使內地政策帶來震盪，基金仍沒有洗倉理據。當明白這個規則時，一些仍有基本因素面支持的股票，應該是跌下來去買，要不是急回時去跟沽。 保險股仍是吸納對象，至於內銀股明顯是受抽緊銀根的陰影影響，但從估值及業務增長前景而言，仍是可吸。若要炒內地政策受惠股，「十二．五」的內容已有所指示，所以電力設備股如東方電機（1072）、哈爾濱動力（1133）亦不怕跟。至於本地零售股，按理亦可短炒12月的聖誕消費市道暢旺的概念。 陳永陸 作者為獨立股評人
20101119-270,20101119,270,青心直說：瞄準內地新中產 - 胡孟青,青心直說：瞄準內地新中產 - 胡孟青 即使係長期睇好盈利增長前景嘅行業，入市時機也極為重要，呢一點好老生常談，卻往往知易行難。 6月底至9月初停牌超過兩個月嘅中國平安（2318），股價雖然在9月初後牌至今短短不足3個月內反彈56%，回顧金融海嘯以來過去表現，股價也曾經從歷史高位124元跌過至22.7元低谷，現價仍距離歷史高位達26%，與中國財險（2328）之35%差距近磅；兩者表現已較中國人壽（2628）之36%差距理想。 單把壽險與產業業務擺埋一齊，投資者仍然會揀壽險，只有壽險保單才會出現15、20、甚至25年期嘅長期保單，銀證保合一所體現之協同效益為保險公司發展下去之大方向。 壽險股近期跑出並非僥倖，歸功於市場對加息之預期將會為投資收益帶來提升之好處，息率回報上升將為新增保費收入無論在債券抑或存款均帶來YieldEnhancement，保險業作為承保與投資並重嘅行業，因此本身透過平安信託持有平安銀行、現時再進一步合併深圳發展銀行的平保，先天優勢已明顯優於同業，股價表現反映市場認同銀保網絡擴張策略。 未來15年保險業高峯期 現時內地保單持有人保費支出平均佔家庭總收入比重只為5%，5年前個人壽險保單平均年保費大約5000至6000元人民幣，隨着GDP與工資水平上升，現時已提升至7000元人民幣。 中國未來15年仍未需要面對像成熟地區般人口老齡化問題，正好是發展保險業務嘅高峯期，擁有一支銷售能力極強、效率極高、平均年齡18.5歲、人數達2.5萬嘅電話銷售兵團。 2009年新增客戶達700萬名，投保人平均年齡只有35歲。每家保險公司均有其自身強項，平保強項就在於其吸客、守客及分銷能力，集中瞄準沿海城市中產階級，配合中國崛起中嘅高消費力新中產階層群體，新中產必需品自然成為投資標的所在。 胡孟青 作者為獨立股評人
20101119-271,20101119,271,曾淵滄專欄：溫總講話透露玄機 - 曾淵滄,曾淵滄專欄：溫總講話透露玄機 - 曾淵滄 昨日港股終於反彈，一連4天急跌之後的反彈，這是跌過頭之後的反彈？還是調整已經結束，這並不容易知道，如果只是反彈，就會形成頭肩頂的走勢，帶來另一個更大的調整。因此，只有等到恒指上破25000點再創新高，才能肯定調整已經結束。 當然，你不一定有興趣等到調整浪正式結束才入市，我也認為，只要你認為股價在這次調整中已經有足夠的下跌幅度，PE相對低的話，你是可以隨時入市。 內房建材股可低吸 今日，我們繼續解讀溫總在澳門的談話，一向來，我很重視溫總的談話，2007年11月，溫總一句「港股直通車不開了」，就結束了那個長達4年多的大牛市；2008年11月，溫總一句「4萬億基建投資」，救活了金融海嘯所帶來的大股災與經濟衰退，還記得今年3月5日全國人大開幕時溫總的工作報告嗎？當時，溫總用了足足120分鐘讀那份報告，而整份報告中，只用1分鐘談樓市，第二天，我就在《蘋果日報》寫了一篇文章，告訴大家我認為2010年中國內地樓價不會下跌。現在，舊國十條，新國五條出齊了，樓價下跌了沒有？答案是沒有，為甚麼沒有，溫總在澳門的談話已經告訴大家，溫總在澳門說：「政府管甚麼？政府管低收入的，管窮人的，對吧？管這個貧困的，而有錢的，收入高的，應該靠市場……」 溫總很清楚地告訴大家，政府決定讓市場來決定私人樓宇的價格，政府的任務只是多建公屋，讓窮人有屋住。留意，溫總只是說讓窮人有屋住，不是說讓窮人變成業主，美國為甚麼會發生金融海嘯？次按是最重大的因素，甚麼是次按？次按就是窮人，沒資格買樓的人去買樓，最後沒錢還債，中央不會不清楚美國的問題，不會不明白次按的危害。 現在，我再告訴大家如何將這一回溫總在澳門談話，轉化為兩個投資概念：（1）中央政府沒打算下重藥壓房價，內房股可以選擇性趁低買，內房股過多，今天不推介；（2）建築材料股如中國建材（3323）、安徽海螺水泥（914）、信義玻璃（868）、中國聯塑（2128）的前途不錯，因為建屋量會增加。 曾淵滄 作者為城市大學MBA課程主任
20101119-272,20101119,272,可信度減IMF預測往績　準確度低,可信度減 IMF預測往績　準確度低 國際貨幣基金組織（IMF）指香港樓市目前未存在泡沫，實情這只是一個假象，多個指標均顯示本港樓價已超高；而翻查IMF對本港經濟預測，無論是好景或低潮時期，與實情都是有差距。 三大數據引證樓價過熱 IMF指本港樓市未有泡沫，原因是現時的低息環境，以及市民收入有所增加。不過，恒生銀行（011）高級經濟師范婉兒表示，香港樓市經已過熱，泡沫已形成，這可從3大指標反映出來，首先今年樓價較過往20年平均上升了一倍；其次是樓價相等於租金比率（以500方呎單位為例），亦由平均的20.8年上升至26年；還有樓價與私人住宅家庭收入比例，亦由平均的7.8年增加至9.5年；這些數據均顯示樓價已過熱。 至於今年本港私人住宅家庭的供樓負擔，佔每月家庭收入的41%，較過往20年平均52%為低；她認為這是不尋常情況，是全球量化寬鬆政策下才出現的特殊現象，資金一旦收緊，按揭息率可於一年內急升5至6厘，情況令人擔心。由於美息於未來一年仍會維持低位，本港的樓市泡沫將繼續漲大，直至息口轉向而爆破！ IMF亦預期明年本港通脹升至5%，為市場之最；恒生預期為3.7%，范婉兒稱，雖然租金會繼續拉高通脹，但亦要關注美元一旦轉強，以及環球食品價格若升至見頂，本港的通脹壓力將獲紓緩。 觀乎IMF對香港過往的本地生產總值預測，與本港經濟實質表現不時存在偏差，例如07年本港經濟比較好景的一年，增長為7.4%，IMF於當年1月的估算為5.5至6%，相差有1.4至1.9個百分點；09年香港經濟低潮錄得-4.6%跌幅，IMF於金融風暴爆發後的08年12月作出首次估算，仍預計09年香港可以正增長2%，對金融風暴的殺傷力完全未能掌握，至09年11月再修訂為-2至-3.5%，仍然與實際差距2.6至1.1個百分點。
20101119-273,20101119,273,股票拋空紀錄,股票拋空紀錄
20101119-274,20101119,274,中環對冲：追落後轉戰日本股市 - 楊延德,中環對冲：追落後轉戰日本股市 - 楊延德 港股在周二、三繼續下調，主要是受到A股的拖累。其實，這次調整來得頗急，不過事先亦有迹可尋，當中最突出的，要算是上周四南韓尾市出現類似美股5月6日的「快閃跌市」（FlashCrash）。 當天，韓股原先大致持平，但在收市前的兩分鐘，大市卻突然急跌2.7%。據了解，其間德意志銀行在市場上大手沽售，金額高達110億港元，市場在缺乏承接下遂大幅下挫。事後，正如美國5月的快閃跌市一般，韓股在上周五雖然高開近2%（收復上周四大部份失地），但下午亦大受壓力而反覆下跌，最後差不多以全日最低位收市。 這兩次「快閃跌市」的經驗告訴我們，跌市方向是正確的，只是速度有點過快，不過股市在反彈後，還是很大機會跌至相近的水位。 美滙反彈利日股 其實，當大市出現這種無法解釋的波動時，最保守的做法便是減低倉位的總持貨量，以防萬一。另外，一些大型基金依賴電腦數據模型來做風險評估，如果股市大幅波動的話，這些風險指標亦會相應上升，而減低這些風險指標讀數的最直接方法便是「縮盤」。加上港股在9月及10月已經一口氣衝上了2500多點，因此回調整固實在正常得很。某程度上，這樣的大市走勢會較為健康。 近期，DXY指數（美滙指數）亦隨着環球風險資產回吐，出現反彈。換言之，短期來說，DXY在聯儲局推出QE2後跌穿76水平，是一個假突破。DXY反彈，對大部份風險資產來說是壞消息，惟獨對日圓卻是好消息，年初至今，日本股市受到強勁的日圓拖累，成為今年以來表現最差的市場。由於日本仍是一個大落後的市場，筆者不排除有基金會在年尾時轉戰日本。 楊延德 中環資產投資有限公司董事 mailto:yeunga@cai-fund.com 逢周二、三、五刊出
20101119-275,20101119,275,投資學堂：恒指短期阻力24090 - 譚紹興,投資學堂：恒指短期阻力24090 - 譚紹興 港股4連跌後終於出現較大的反彈，恒指昨日勁升422點，但成交額只得920多億元，雖然不算少，卻是兩周以來較低的成交。成交縮減同樣出現在國內股市，昨日上海股市成交額降至1270多億元人民幣，較早前平均2000多億元明顯減少了，反映在一輪急挫後，投資者入市也較為小心。 正如昨日收市前數分鐘，恒指期貨的升幅突然大幅收窄，出現低水100點的情況，估計是不少投資者不欲持貨過夜，趁收市前獲利平倉所致。故短期港股的反彈幅度可能不會太高，以恒指由上周高位24988，大幅下挫至前日低位23192計算，這一小型跌浪，反彈跌幅的一半便為24090，相信會是短期的阻力水平。 另一方面，昨日內地11月股指期貨的未平倉合約，已由高峯時的2.9萬多張，減至2000多張，顯示炒家已相繼平倉。在僅得2000多張未平倉合約的情況下，理論上今日股指期貨結算的殺傷力應該不會太大，但綜觀過往經驗，A股始終擺脫不了結算日的魔咒，市況會較為波動，故今日A股可能不會有太大跌幅，但波動則難免。 未跌夠候低吸 近日不少朋友問點睇後市？基本上，筆者仍看好後市，因為資金氾濫的大方向無變，同時在過往的牛市二、三期，港股亦經常出現類似早前的急跌情況，印象最深刻的是2007年7、8月間，港股突然由23500多點，大幅下挫至19386，筆者僥倖在低位買了些內銀股，隨後不久「港股直通車」一響，恒指便掉頭狂升，反覆升至31958歷史高位，在該役有不俗的利潤。 故筆者不會錯過今次低位買貨的機會，只是近日港股雖然跌了千多點，但不少股份僅是跌返10月底或11月初的水平，尚未到心目中的入貨位，惟有稍等。 譚紹興 作者為證監會持牌人士 mailto:ricky@rickytam.com
20101119-276,20101119,276,投資的天空：等大市升多幾日才買貨 - 張士佳,投資的天空：等大市升多幾日才買貨 - 張士佳 港股近日飽受A股煎熬，尤其A股經常玩「午後凶鈴」，更嚇怕投資者，幸好昨日A股終於站得住腳，能夠升市收場，恒指期貨亦終止過去幾日跌勢，回升362點，暫時與昨日專欄「短期縱彈，調整未完」的上半部份脗合，至於會否進行下半部份，當然要看下回分解。 昨日中港股市能夠反彈，相信與國務院提出4招（確保供應、加強補貼、加強監管及嚴懲惡意炒作）穩定價格措施有關，可能有人奇怪這類措施明明顯示中央會出招調控，為何大市不跌反升？ 其實投資者最驚就係蒙在鼓裏，唔知傳聞幾時會變真，既然中央願意露少少底牌畀你知，情緒自然好轉，所以反彈亦好平常。 好多朋友覺得昨日的反彈好大，尤其見不少焦點個股都有不俗升幅，但士佳認為大反彈起碼都要挾大成交上升3%，即約600多點，或者出現上升裂口後，大市能夠企在上面兩三天。 自己昨日趁反彈減持了小量個股，讀者或會奇怪既然筆者認為調整未完，為何不伺機大手減持？我只能答你，士佳唔一定啱，萬一錯了，同大戶做相反動作就弊傢伙，反正就算再跌落去，揸住股票都係捱吓價，又冇做槓桿，衰極有限。 吼逆市破頂股 現階段最重要是做好兩手準備，一方面準備若然睇錯，大市不再下跌轉而直升，就要決定幾時買貨，自己會等大市先升多幾日才買。 另一方面，萬一大市與筆者估計一致，真的再向下插，到時一定兵荒馬亂，大家買貨必須有充足的勇氣及信念，做好捱價的心理準備，如果十五十六，惟有打定算盤唔好買貨。 至於買貨對象，一是昨日所講早前還非常優秀、前景無限，早幾天突然下跌的大股；二是昨日已不理大市，急不及待破頂的個股。 張士佳 寶來證券（香港）董事　投資服務部 mailto:sky788cheung@gmail.com
20101119-277,20101119,277,貸評山下：QE本相　全球收水？ - 黃元山,貸評山下：QE本相　全球收水？ - 黃元山 QE2成了一個新的潮語，高官在談、專業人士在談、老爸老媽在談、清潔工人姨姨也在談。QE2成了所有問題的解釋：為甚麼樓價高，高官會告訴你是因為QE2；為甚麼中國通脹厲害，阿爺也會告訴你是因為QE2；為甚麼股市會大升，專家會告訴你是因為QE2；為甚麼人工追不上通脹，老闆會告訴你因為QE2使來貨貴了成本上漲。 兩個禮拜前，我開始談QE2市場的盲點，因我懷疑QE2可能成為市場炒作的藉口。 首先，是中國通脹問題，我認為官方近期高調批評QE2，除了是就人民幣升值問題向美國爭取籌碼，更希望的是轉移視線。由於官方高調評論，使所有主流媒體也集中報道QE2，但我的看法是，中國貨幣政策過份、過量與過時的寬鬆，才是現在中國面對強大通脹的主因。 放水效用短暫 批評QE2有助平息民怨，把中國的通脹問題歸咎於美國政府，卻不能解決實際問題，所以，預期中國必會在貨幣政策上多做工夫。但問題是，在一個高通脹、高增長的情況下，銀根本身已經越來越緊，在一個銀根比較緊的經濟上再做工夫，我擔心市場低估了中國政府收水的力度。 另外，雖然QE推出後，美國貨幣供應曾大增，但這一年來又跌到一個比較低的水平，反映QE效用短暫（見圖）。在這個情況下，QE2能否再次提升美國貨幣供應呢？如果不能，除非有新的QE3，否則，美國在QE2後，只是繼續收水，而不是放水？ 黃元山 中大全球政經碩士課程兼任講師 mailto:wongcomment@yahoo.com.hk 王良享、丁世民、溫灼培、羅家聰及黃元山專欄，將於周一至周五輪流刊出
20101119-278,20101119,278,港股派息過戶備忘,港股派息過戶備忘
20101119-279,20101119,279,上市公司公佈業績預告,上市公司公佈業績預告
20101119-280,20101119,280,近期宣佈不派息公司,近期宣佈不派息公司
20101119-281,20101119,281,港元定期存款息率,港元定期存款息率
20101119-282,20101119,282,外幣兌港元,外幣兌港元
20101119-283,20101119,283,認同IMF金管局：樓價飆非因聯滙,認同IMF 金管局：樓價飆非因聯滙 國際貨幣基金組織（IMF）和金管局再為維持本港聯繫滙率發聲明，IMF指樓價急升並非實施聯滙的香港獨有，香港滙率並沒有因此被低估，金管局則指聯滙反而令熱錢湧入本港的壓力較低。 IMF亞太區高級顧問NigelChalk支持本港繼續採用與美元掛鈎的聯滙制度，他不認同聯滙是促使本港樓價急升原因，因為新加坡、澳洲和台北等沒有聯滙制度的地區，亦同樣存在樓價上升情況。而本港流動資金充裕，除了美國的量化寬鬆政策外，他指很多內地企業來港發新股上市，集資金額留在香港亦是原因之一。 宜審慎監管　增土地供應 金管局助理總裁劉應彬認同IMF的建議，面對本港樓價上升，資產泡沫風險，宜以財稅、土地供應和審慎監管的方式應變，改變聯繫滙率並非好方法，他重申沒有計劃對聯滙作任何修訂。 對於有市場人士分析，聯滙下港元與美元掛鈎，美元下跌導致港元貶值，引發資產價格升值問題；他指根據IMF和金管局分別的研究所得，港元滙率符合香港未來兩年經濟表現及通脹預期，並沒有出現偏高或偏低情況。 在聯滙下，他指香港面對熱錢流入的壓力，不及周邊其他地區為大，港元滙價仍未觸及強方兌換保證界線，相反周邊一些地區已不斷推出防禦措施，他分析聯滙下港元與美元掛鈎，難期望有顯著升值空間，此外利息亦緊貼甚至低於美國，熱錢流入本港難望財息兼收。被問及會否收緊按揭成數，他只表示若有需要推出相應措施便會推出，事前不會預警。
20101119-284,20101119,284,銀行最優惠利率按揭計劃參考,銀行最優惠利率按揭計劃參考
20101119-285,20101119,285,外幣存款息率,外幣存款息率
20101119-286,20101119,286,九九金　港元/両,九九金　港元/両
20101119-287,20101119,287,銀行同業拆息,銀行同業拆息
