key,date,article_daily_id,title,text
20101023-0,20101023,0,一日兩業界精英自盡滙豐女經理跳樓死　美聯女經紀燒炭亡,"一日兩業界精英自盡 滙豐女經理跳樓死　美聯女經紀燒炭亡 【本報訊】兩名工作表現出色、早前分別獲升職及讚賞的女精英，昨天幾乎同一時間分別被發現在沙田馬鞍山及元朗八鄉自殺身亡。其中一名死者是滙豐銀行分行經理，另一死者則是美聯物業「TopSales」（金牌經紀）。前者不堪工作壓力而跳樓自殺；後者疑因投資期指失手，欠下巨債而燒炭自盡。 記者：鄭文輝　李旭基 跳樓自殺的滙豐銀行分行經理陳舜明（46歲），與丈夫同住沙田馬鞍山錦英苑錦達閣一單位，兩人並無兒女。陳在滙豐銀行工作多年，最近因為工作表現優異，晉升為分行經理。據悉，陳升任經理後工作壓力驟增，因此精神出現問題，需要看心理醫生，並且要定時服藥，事發前請了數天病假。 升職壓力大 昨天下午4時許，陳被人發現從錦達閣22樓住所躍下，直墮地面花槽，街坊見狀立即報警。警員及救護員到場將她送院急救，但稍後證實不治。警員在她身上找到遺書，內容大致透露不堪工作壓力尋死，警員聯絡到她的姊姊往醫院認屍，並得知陳的丈夫身在內地，已與他取得聯絡。 今次是02年以來，第四名自殺身亡的本港滙豐銀行中高層職員；之前三名死者分別是滙豐銀行尖沙嘴分區總監劉學斌（52歲）；滙豐銀行分行財務策劃經理黃逸致（32歲）；滙豐銀行高級資訊科技主任李偉強（29歲）。其中劉學斌及黃逸致均因不堪工作壓力，於08年7月及03年7月分別在藍田興田邨跳樓，及在香港仔薄扶林仰藥身亡；至於李偉強則因婚姻問題，02年在藍田德田邨跳樓自殺。 此外，滙豐銀行優質服務管理部一名經理，及滙豐控股集團結構資本市場一名外籍主管分別在08及05年企圖自殺獲救。 記者昨晚就陳舜明跳樓事件聯絡滙豐銀行，但至截稿時仍未獲回覆。而成衣業、文職及零售業職工總會總幹事張麗霞指出，近年銀行業員工承受強大工作壓力，特別是銷售部門，每年銷售目標遞增10至20%，以她所知不少中層管理人員都「身心受創」，有人更要看精神科醫生。 投資期指欠下巨債 至於燒炭自殺的地產經紀袁秀蘭（37歲），洋名Joyce，在美聯物業加州花園分行任客戶經理。據了解，過去一年，她平均每月生意額高達1,500萬元，達到一年賺取180萬佣金的目標，因而入選今年度「美聯精英會」，成為TopSales。據稱，她稍後更有可能獲得晉升機會。 警方消息稱，昨下午4時15分，八鄉石湖塘田心村的村民途經該處路邊時，發現一名女子倒卧在一輛七人車內不省人事，身旁乘客位地上有一個載着炭灰的鐵煲，於是報警。 警員及消防員到場，扑爛車窗玻璃後將車門打開，發現倒卧車廂的女子已身亡，初步相信她已死去一段時間。警員在她身上找到銀包、身份證及一封遺書，據悉遺書內容大致是不堪金錢困擾而自殺。警方同時發現，死者的家人三天前在落馬洲警署報案，指她不知所終。 　 警方稍後聯絡到七人車的女車主，據稱，她是袁的友人，將車借予袁代步及載客睇樓所用。警方事後亦聯絡到袁的家人認屍。消息稱，警方初步調查發現，袁早前投資期指失手欠下巨債，相信她因此而自殺。 美聯物業發言人昨晚回應記者查詢時表示，人事部目前正對事件跟進中。而袁秀蘭的一名上司向記者表示，袁原本在錦綉花園分行工作，業績非常出色，但兩個月前調往加州花園分行後，工作上頗為吃力，但依然維持不錯的生意額。據悉，日前她才做成一宗生意，失蹤期間，她曾向同事發送手機短訊，指她欲將賣樓的佣金分給同事。 袁秀蘭的一名姓潘同事向記者表示，袁隨和開朗，與同事相處融洽，對於她離世感到非常難過。"
20101023-1,20101023,1,打風不成　菜販主動減價,打風不成　菜販主動減價 【本報訊】颱風鮎魚昨日未有「擺尾」吹襲香港，但已令菜價及魚價持續上升，葉菜售價比平時貴一至三成，海鮮價格亦急漲一成；業界指出，儘管鮎魚對香港影響減弱，但魚價短期內不會回落。幸而有灣仔菜販昨傍晚見打風不成，每斤菜主動減價兩元。 「呢輪魚價都會貴」 海鮮業聯會總會主席李彩華表示，鮎魚犯港，漁民早已回港避風，巿面再沒有海魚供應，令養魚供不應求價錢上漲一成，青斑批發價每斤升至70元，芝麻斑升至80元。高魚價會維持三、四天，「啲漁民要等風球落晒，再出海網魚，一來一回都要幾日，所以呢輪魚價都會貴啲」。 鮮魚價格急升，多種葉菜批發價仍然高企。蔬菜統營處資料顯示，芥蘭昨日批發價由每斤售5.7元，再飆升三成售7.5元，價格已急漲的生菜再升2%售5.2元；芥菜及莧菜批發價持續高企，分別售4.5及5.6元，較平時升近三成及一成。記者昨到灣仔街市了解，有菜販表示，由於鮎魚威脅減退，市民買定存貨需求同告減少，加上預料來源將不受影響，傍晚時將大部份蔬菜每斤減價兩元。
20101023-2,20101023,2,東北季候風殺到　下周三跌至19℃,東北季候風殺到　下周三跌至19℃ 【本報訊】鮎魚向東遠離，本港避過狂風大雨惡劣天氣，而一股南下的東北季候風下周初將抵達華南，本港氣溫將明顯轉凉，天文台預測下周三市區氣溫最低將跌至19℃，成近七年最凉10月天。 來勢洶洶的鮎魚被南下的東北季候風推向福建，連日來受兩者夾擊，本港天陰有雨，天文台昨錄得市區氣溫最高25℃，最低21.5℃；多區跌穿20℃，荃灣曾錄得低至19.1℃。 本港今日仍將多雲和有幾陣驟雨，市區氣溫介乎22℃至26℃，吹清勁至強風程度北至西北風。明日初時有雨，日間天色較為明朗，風勢略為緩和。 近七年來最凉10月 新一股東北季候風將於日內抵達華南沿岸，下周為區內帶來清勁東北風，下星期一和二將有驟雨，下周中開始才再見陽光。天文台預測本港氣溫將由明日最高27℃逐步下降，市區下星期二降至最低20℃，星期三進一步降至19℃，由於日間部份時間有陽光，最高升至23℃；星期四氣溫相若，最低只有19℃。 低於20℃的10月天並不多見，過去六年均未曾出現，較近一次是03年，曾錄得19.9℃，即下周三將是近七年最凉10月天。若氣溫降至19.5℃或以下，更會創近10年的10月低溫紀錄。天文台署理高級科學主任李淑明表示，10月份氣溫平均介乎23℃至24℃，下周氣溫驟降主要是因東北季候風補充。 氣溫降　火鍋生意旺 尖沙嘴寧記麻辣火鍋海鮮酒家陳經理表示，每逢氣溫下降，食客明顯增加，近日生意已比前些天熱日子上升兩成，他估計下周氣溫進一步下降後，會再多兩成食客；他最擔心不是食物不足，而是枱凳不敷應用，「真係越凍越多人」。
20101023-3,20101023,3,華里沙籲和平獎得主攜手促北京釋劉曉波,華里沙籲和平獎得主 攜手促北京釋劉曉波 【本報訊】獲得諾貝爾和平獎的《零八憲章》發起人劉曉波被囚禁在遼寧錦州監獄，曾獲頒諾貝爾和平獎得主的波蘭前總統華里沙主動施以援手，他向「諾貝爾和平獎得主國際峯會」表明下月到日本出席會議期間，力爭所有與會的和平獎歷年得主攜手要求北京政府釋放劉曉波。本港泛民主派亦再次去信呼籲一眾和平獎得主，通過要求立即釋放劉曉波的聯合聲明，有需要時派員到日本游說。記者：許偉賢 有關峯會訂於下月12至14日在日本廣島舉行，以「廣島的遺產．沒有核武的世界」為主題，多名和平獎得主包括前蘇聯總統戈爾巴喬夫及西藏流亡精神領袖達賴喇嘛答允出席。今年和平獎得主劉曉波被中國無理判囚，「要求釋放劉曉波」成為今屆峯會另一焦點。 希望奧巴馬參與聯署 已經答允出席的波蘭前總統華里沙日前向大會預告，會趁出席會議期間爭取所有與會者力促北京政府釋放劉曉波，再次表明歡迎諾貝爾委員會向劉曉波頒發和平獎。 得到華里沙表態支持，本港泛民主派要求釋放劉曉波的聯署行動顯得更有份量。身兼支聯會副主席的職工盟李卓人稱，早前已經透過不同工會及信函，聯絡多名諾貝爾和平獎得主，除了華里沙，還包括南非前總統曼德拉、緬甸反對派領袖昂山素姬及美國總統奧巴馬等，希望他們都參與聯署。 諾貝爾和平獎得主下月聚首一堂，更是泛民力爭得主聯署的好機會。泛民正聯絡峯會的主辦單位，爭取與和平獎得主接觸，游說他們支持釋放劉曉波行動。若主辦單位能安排見面，泛民不排除派員親赴日本游說，呼籲各得主攜手向中國政府施壓。 第18屆亞太經濟合作組織會議（APEC）剛巧於下月13至14日於日本橫濱舉行領袖峯會，國家主席胡錦濤有可能出席，李卓人稱，泛民會再次去信呼籲和平獎得主通過聯合聲明，要求北京釋放劉曉波，讓身處日本的胡錦濤能清晰得知訴求。 形成力量向中國施壓 支聯會常委梁國雄指一眾和平獎得主若通過聲明，將會形成一股強烈的道德力量，向中央表明劉曉波並非只有一少撮人支持，而是獲得國際認同，「就算畀個天中共做膽，佢哋都唔敢鬧晒所有和平獎得主」。
20101023-4,20101023,4,佐敦往中環服務恢復未作廣播港鐵誤導致搶搭駁巴混亂,佐敦往中環服務恢復未作廣播 港鐵誤導致搶搭駁巴混亂 【本報訊】港鐵油麻地站前日的事故造成上班時間大混亂，港鐵承認車站的廣播不足及誤導，不少人誤以為荃灣線過海至中環的服務暫停，導致大批心急如焚的乘客搶搭接駁巴士的場面。立法會議員批評港鐵事故的應變能力不足，必須檢討。 太子站都有車廂爆火花 前日油麻地站約7時發生事故後，佐敦至中環的過海服務在7時半已恢復，但港鐵沿線車站的廣播均未有清楚向乘客交代，不少乘客誤以為荃灣線過海至中環的服務暫停，導致大批乘客在油麻地爭搭接駁巴士的混亂情況。 港鐵公司事務副總經理王美琪昨表示，事後檢討，當時應通知乘客可選擇由油麻地步行往附近的佐敦站繼續行程。她又表示，港鐵每個車站都有事故時安排接駁巴士的預定地點，油麻地站的預定地點原在彌敦道，警方因應實際交通情況而改在咸美頓街。港鐵正全面檢討應變安排，例如印製臨時接駁巴士站位置的單張，派給乘客。 前日油麻地站的混亂情況，在其他站也有出現，乘客賴女士昨致電電台指出，事發時她乘港鐵列車到太子站，也看到車頂冒煙及爆出火花，車廂的燈全部熄滅，車上的乘客都很驚慌，等了約30分鐘列車才恢復正常並繼續行駛，但列車「行吓停吓」，到旺角站便要所有乘客下車，她出到路面，巴士站已大排長龍，她乘巴士到尖沙嘴再轉乘渡輪過海，要兩小時才回到公司。 乘客盧女士指出，事故期間正由黃大仙乘港鐵往屯門，參加女兒畢業禮，到太子站要轉荃灣線，發現月台非常混亂，她只好走回路面和其他人搶的士。她質疑港鐵廣播不清楚，否則她可以選擇乘車往紅磡才轉西鐵，避開混亂。 立法會交通事務委員會昨舉行會議，有議員批評港鐵事故後不懂應變，只懂道歉。有議員質疑港鐵沒有檢視老化設備，要求政府加強監管，確保港鐵做好保養維修。 運輸及房屋局局長鄭汝樺表示，已要求港鐵就事故提交報告，除了解釋事故起因外，亦需要交代日後的應變方案。
20101023-5,20101023,5,故障或不關電纜事,故障或不關電纜事 【本報訊】港鐵油麻地站發生電纜電線折斷的罕見意外，港鐵集中調查是電纜電線本身質素有問題，還是列車的供電系統突然故障所產生的高壓電流引致電線折斷。 電腦顯示列車故障 肇事列車日前進入油麻地站時，列車車長聽到「啪」一聲，顯示電壓出現不穩定，供電系統自動跳掣停止供電，列車電腦顯示列車有電力故障，控制中心嘗試重新開啟電力系統，但不成功，檢查後發現電纜電線折斷，電纜有1.5萬伏特，非常高壓，斷裂會產生大量熱力及火花。 港鐵公司事務副總經理王美琪昨表示，架空電纜一般很耐用，只要保養維修妥善，壽命長達數十年，前日事故未必是電纜本身有問題，當時列車的電腦顯示列車有電力故障，所以同時亦會調查是否列車電力故障引致電纜出問題。 理工大學機械工程系工程師盧覺強表示，列車電力系統如果發生故障，會引致整個供電系統跳掣，大量電流會產生搶火情況，爆發火花，高溫可能令電纜電線燒熔。但另一方面，亦有可能是電纜電線本身已有問題，抵受不了高溫而燒熔。由於電纜電線本身已經燒熔，相信難以調查電纜質素有否問題。
20101023-6,20101023,6,置安心或可做九成按揭,"置安心或可做九成按揭 【本報訊】施政報告提出「置安心資助房屋」計劃，以先租後買形式協助市民置業，但計劃被批評未能幫助申請人儲首期，申請人要「飯都唔食」才可儲夠首期置業。運輸及房屋局表示，正與按揭證券公司商討讓置安心申請人最高做九成按揭，減輕他們的負擔。 五年難儲三成首期 房屋事務委員會昨開會討論施政報告有關房屋政策的內容。不少議員指置安心申請人入住單位後要交市值租金，加上一日三餐、交通及其他日常開支等，租住五年都未必可儲夠首期買樓。工聯會王國興表示，置安心申請門檻（單身人士月入不超2.3萬元，家庭為3.9萬元）未能全面照顧買不起私樓、又不符合申請公屋資格的夾心階層，加上最快在2014年才有1,000個單位供應，未能解決現時難置業的問題。經濟動力梁劉柔芬指，市民買樓一般要付三成首期是太高，認為政府應集中協助他們解決首期問題。運房局局長鄭汝樺表示，已開始與按揭證券公司商討，考慮向申請置安心計劃的申請人提供按揭貸款優惠，「睇吓做唔做到八成甚至九成按揭」。 她又指，發展商如能興建簡約及合乎環保原則的樓宇，當局會考慮讓他們參與置安心計劃，興建先租後買的單位。據了解，運房局現時只屬意房屋協會負責青衣首個置安心項目。 此外，民主黨李永達昨在立法會午宴上，當面向特首曾蔭權指出當局推出置安心計劃後，天水圍等多區樓價已上升5至7%，力促曾蔭權加快推出土地穩定樓宇供應。李其後引述曾指，「我日日都睇住（樓價變化），你唔使驚」。李永達又建議擴大置安心計劃受助範圍，由月入3.9萬元的家庭，擴至月入2萬以下的家庭也可申請，曾蔭權表示可作研究，「我哋呢啲有得傾」。"
20101023-7,20101023,7,紅隧擬加價補貼東隧減價,紅隧擬加價補貼東隧減價 【本報訊】運輸及房屋局局長鄭汝樺表示，下月初將公佈有關改善3條過海隧道流量的顧問研究報告，再諮詢公眾。據悉，鄭汝樺已否定回購隧道的可能性，但接納顧問建議紅磡海隧加價，額外的收費用來相應減低東區海底隧道收費。倘市民支持，會盡快試行。 不考慮回購隧道 政府顧問曾研究不同方案，包括回購各條隧道，但顧問指回購的價錢會引起爭議，需時又長。而且，東隧專營權到2016年便到期，只餘6年多。回購後若要政府在紅隧不加價下，讓東隧和西隧減價，反會刺激整體用量上升。若要紅隧加價來補貼東隧和西隧，便不用回購也能做到。顧問直接建議採用紅隧加價，讓東隧相應減價，便能吸引部份車輛由紅隧改用東隧，達到分流目的，例如紅隧由私家車20元加至25元，東隧則由25元減至20元，估計紅隧每日可減一萬架次。至於實際加減多少，則要待諮詢後才決定。 立法會議員鄭家富認為政府應回購東、西隧，分別估計需100及200億元，然後再調整3條隧道收費來分流。他不贊成紅隧加、東隧減的方案，因為加減的數額多少才有效，很難計算，若東隧因而獲利大增，政府又會被斥官商勾結。 目前3條過海隧道，以紅隧使用量最高，每日逾12.1萬架次；東隧6.3萬；西隧4.8萬。
20101023-8,20101023,8,非法生產利奧回收37藥,非法生產利奧回收37藥 【本報訊】曾被揭製造藥物偷工減料的利奧化學製藥有限公司，又被發現在停牌期間非法生產了37款共42批次的產品，包括多款阿莫西林膠囊、抗敏藥、止咳水、喉痛藥等等。衞生署已指令藥廠回收產品，並呼籲醫護人員及藥店停止配售這些藥物，病人亦應停止服用。 藥物成份不足被停牌 衞生署稱，在今年三月至七月期間，利奧曾四次從市面回收共五款產品，因為該些產品被發現成份含量不足。藥劑業及毒藥管理局轄下的藥劑業及毒藥委員會在四月已決定暫停利奧的生產牌照，直至九月，委員會滿意利奧的改善措施，認為藥廠完全符合「生產質量管理規範」的要求，因此准予全面復產。 但最近衞生署透過監察系統，發現利奧在七月及八月停牌期間，生產37款共42批次的產品，該些產品的安全、效能和品質均未能受到保證，因此必須回收。 利奧藥廠會於下周一公佈藥物回收安排，並已設立熱線34273525，於辦公時間供顧客查詢。衞生署將徵詢律政司意見，以決定是否採取法律行動。藥劑業及毒藥管理局轄下牌照委員會將於下次會議討論可能的處分。 藥劑師學會促延停牌 醫院藥劑師學會副主席崔俊明指出，利奧今年三月至七月期間因為多款藥物偷工減料，而被指令回收及停牌，藥廠竟然「當衞生署冇到」繼續生產，存在嚴重操守問題。 崔俊明又表示，藥物少於標示成份，足以延誤病情，對病人影響可以很嚴重。崔俊明促請當局重懲利奧，延長停牌時間。
20101023-9,20101023,9,廣深部署地對空導彈保衞香港,廣深部署地對空導彈保衞香港 【本報訊】中央社昨引述加拿大《漢和防務評論》報道，指中國大陸已在珠三角部署了紅旗HQ9A型遠端地對空導彈，形成一個保衞香港及廣州的作戰形態。該刊獲得的衞星圖片顯示，空軍已經將廣州兩個地對空導彈陣地改造，同時在深圳建設了預設陣地，估計射程超過125公里的HQ9A，可以涵蓋整個香港空域。 《漢和防務評論》指出，該刊獲得的獨家衞星圖片顯示，廣州軍區空軍已經在珠三角部署了HQ9A遠端地對空導彈。總編輯平可夫撰寫的報道指出，為部署HQ9A，廣州兩個地對空導彈陣地已進行改造，並在深圳建設了預設陣地。以過去數次中國空軍HQ9A機動演習方式判斷，HQ9A平日不會駐紮深圳，只在有需要時才機動進入區內的預設陣地。 曾測試部署深圳邊界 平可夫指出，廣州部署的HQ9A有別於北京地區，廣州軍區部份HQ9A，每輛發射車只配備兩枚地對空導彈，礙於珠三角地區較多橋樑，載重量有限，減少地對空導彈數量有利機動應變。報道又透露，由去年起，HQ9A已多次臨時部署於與天水圍近在咫尺的深圳邊界海岸線預設陣地上，測試HQ9A調動到港深邊界地區的快速應變能力。 HQ9A是中國目前其中一項先進的雙重用途防空導彈系統，既可反飛機及導彈，也是戰術彈道導彈，具備強大的抗干擾能力，遠大的攻擊空域，以及重達180公斤的巨大彈頭威力。 時事評論員劉銳紹表示，中國軍方時有在全國範圍內作出軍事部署，難以評論在深圳設置地對空導彈，目的是否保衞香港空域。
20101023-10,20101023,10,公然護主　自言「講幾句公道話」林大輝暗罵陳啟宗,公然護主　自言「講幾句公道話」 林大輝暗罵陳啟宗 【本報訊】政務司司長唐英年連日被指藉出任政府關愛基金主席，為競選下屆特首鋪路，昨日他有備而來，首度開腔斥有關指控荒謬，又稱會尊重恒隆主席陳啟宗不捐錢給基金的決定，繼續歡迎其他「有心人」捐助。被視為唐英年陣營的工業界立法會議員林大輝，再為唐英年護航，指「其實（關愛基金）支持者的聲音都唔少，好似比反對嘅多幾個」。記者：林俊謙 政務司司長唐英年昨日出席立法會午宴後，罕有地在沒有新聞秘書陪同下，在立法會外接受傳媒訪問逾三分鐘。近日因出任關愛基金主席而備受攻擊的唐英年，雖然一度揚言：「唔講嘞，落雨呀，打風呀」，但被問到關愛基金的問題時，還是逐一詳細回應，並語帶雙關稱已「做好防風準備」。 唐英年稱指摘荒謬 被視為下屆特首熱門人之一的行會召集人梁振英最大支持者，恒隆主席陳啟宗日前公開批評關愛基金，唐英年說尊重陳的決定，指現雖未籌到目標的50億元，但其實「商界反應唔錯」。當被問到關愛基金是否淪為他競選下屆特首鋪路的競選基金時，唐則語氣強硬，兩次力斥指控「荒謬」，指政府會為基金成立委員會，幫助有需要的人士，「所以呢個講法完全係荒謬嘅。」 被問到會否參選下屆特首，唐不作回應，隨即乘車離開。 來自唐英年陣營的工業界立法會議員林大輝，昨日開腔護主，反擊陳啟宗。 林大輝自稱，要為唐英年「講幾句中肯說話」，他指陳啟宗發表拒捐立場後，予人向基金「潑冷水」的感覺。他認為現時在基金未推出前就作出批評，做法不公道，更認為商界其實對基金反應不錯。他說：「暫時社會聽到係佢（陳啟宗）反對聲音最大囉，但其實支持者聲音都唔少，好似比反對嘅多幾個。」 稱非競選特首基金 林大輝稱，關愛基金絕非唐英年競選特首的基金，「唔係擦鞋同歸順基金」，並指擔任有關工作未必對參選特首有利，「你話係水泡又得，係炸彈又得，可以光宗耀祖，又可以一敗塗地」。不過，林就力撐唐英年過去的從政經驗，已顯示出相當有能力，現時的地位是唐過去廿年「赤手空拳打出嚟」、「唔係因為幸運同腳頭好」。
20101023-11,20101023,11,S.H.E.成員Selina嚴重燒傷,S.H.E.成員Selina嚴重燒傷 【本報訊】台灣女子歌唱組合S.H.E.成員任家萱（Selina），昨日在上海拍戲期間遇上意外，在一場爆破戲中受傷，有指她面部受創，背部及四肢同告燒傷，並因吸入濃煙傷及咽喉。任家萱事後被緊急送院，家屬及經理人拒絕透露病情。 意外後現場一片混亂，外傳Selina手腳受傷部位高達50%。Selina原計劃明年與未婚夫張承中結婚，消息傳出後，張承中火速飛到上海探望。Selina是在拍攝湖南衞視新戲《我和春天有個約會》時受傷，她在戲中擔任女主角，又唱又演。 傳媒即日追訪Selina爸爸，他僅說：「我現在很忙，請見諒。」經理人李姚也拒絕透露病情，只說：「不好意思，現在一團亂，晚一點再跟大家說明。」有關Selina燒傷的傳聞很不一致，有些說她燒傷5%，有些指她五成表皮燒傷。醫生初步診斷後稱，Selina手腳傷勢較重，但很清醒，狀態穩定。
