key,date,article_daily_id,title,text
20110305-126,20110305,126,投資名言：油價高企　利好俄股 - 張敏華,投資名言：油價高企　利好俄股 - 張敏華 中東、北非局勢緊張，刺激油價急升，對環球股票巿場有不同程度的影響。2011年2月下旬至今，紐約期油由每桶85美元升至102美元，俄羅斯股巿是少數能逆巿造好的巿場，表現更是環球股巿之冠，其間累積升幅達8%。 俄國日產量逾千萬桶 現時局勢緊張的中東及北非，是全球最大產油地區，去年每天產量達2510萬桶，佔全球石油供應29%，區內最大產油國沙特阿拉伯，每天產量810萬桶，但以單一國家計，俄羅斯才是全球最大產油國，每天產量超過1000萬桶，佔全球石油產量12%（見圖），扣除本土需求後，也是最大的石油輸出國。 油價高企，俄羅斯可說是最大受惠者，無論在經濟和股票投資上均能受惠。作為全球最大的石油輸出國，俄羅斯可取得的經濟效益達到國內生產總值（GDP）11.6%。年初至今，油價累積上升12%，俄羅斯盧布也升值7.8%。此外，俄羅斯股巿的成份股中，能源股所佔比重高達58%，能源股比重高，也是俄羅斯股巿能受惠油價上升的重要原因。 除了石油行業外，未來數年，俄羅斯的金融、電訊、建造等內需行業均具發展潛力。去年下半年，兩家主要的飲品製造商──可口可樂和百事可樂均看好俄羅斯的發展潛力，分別收購了俄羅斯果汁製造商Nidan以及果汁和奶類製造商WBD。 中長期來說，俄羅斯將於2014年主辦冬季奧運會，並於2018年主辦世界盃，未來8年，大型基建發展將源源不絕。花旗分析員預期，世界盃和冬季奧運會的開支，或佔俄羅斯國內生產總值3%，預計當地企業的融資需求勢將大增，俄羅斯央行預期，2010年貸款增長達15%。內需行業的發展，亦令經濟慢慢轉型，昔日能源企業支撐經濟的局面正慢慢改變。 現時，俄羅斯是新興市場中估值最便宜的市場之一，其2011年預計市盈率大約8倍，遠低於摩根士丹利新興市場指數的11倍。花旗分析員預期，2011年俄羅斯可望錄得4%經濟增長，未來兩年更有機會把超過200億美元的國有資產上市，世貿和基建發展，對俄羅斯有中長線的利好作用。外資對當地企業的購併活動，有望提升俄股的估值。 張敏華 投資策略及研究部主管 Citibank環球個人銀行服務
20110305-127,20110305,127,點滴東航預期今年盈利降,點滴 東航預期今年盈利降 ▲東方航空（670）副總經理李軍稱，東航今年客貨運量同比料增約12%，較去年20%增速有所下降。又指「（集團）今年經營壓力要比去年大，今年比去年盈利要少。」他續稱，目前國際原油價格震盪，燃油成本控制壓力加大。
20110305-128,20110305,128,暢談富論：糧食價飛升　農業股看俏,暢談富論：糧食價飛升　農業股看俏 通脹壓力席捲新興市場，相信身處香港的讀者亦感受到物價上升的影響，其中食品價格更錄得顯著升幅。彭博數據顯示，標普高盛農產品指數去年上升34%。面對通脹威脅，投資者不妨考慮透過投資農業相關企業，藉此「轉危為機」。 在供不應求下，農產品價格上升是意料中事。美國人口普查局資料指出，全球人口在2050年前料將高達90億人，隨着城市人口日漸富裕，他們對飲食營養的要求亦相應提高，食用蛋白質的需求增加，意味穀物產量亦需提升以飼養禽畜。按現產量計算，屆時全球穀物產量必須升逾70%，方能滿足新增的糧食需求。此外，各國政府致力推廣生物燃料，以減低依賴傳統能源包括石油、煤等，亦為未來龐大的農產品需求埋下伏線。 前景更勝直接買商品 不過，全球農產品供應增長速度卻無法追上需求。過去一年，俄羅斯嚴重旱災造成全球穀物失收，美國耕地收成減少料將持續，拉丁美洲不穩定的季節性氣候為當地的大豆生產帶來波動，而城市化發展亦令全球耕地面積買少見少。聯合國糧農組織（FAO）數據顯示，人均可耕土地正逐步縮減而具備潛力的耕地中，有四成未有完善的運輸網絡，為發展帶來難度。 上述農產品市場趨勢，隱含龐大的投資機遇。我們認為投資農產品相關股票，前景較直接買入商品更佳。首先，農產品收成易受天氣影響，價格經常出現波動；此外，農產品股票可為投資者提供更廣泛的投資機會。肥料生產、食品加工、農業機械等無法納入商品指數的行業，亦可受惠於全球耕物需求猛增。投資者透過股市，可捕捉有關行業的投資機會。 基於農產品行業結構高度分散，不少大型企業透過收購拓展業務。在過去一年，農業企業的併購轉趨活躍，不僅併購宗數增加，涉及金額亦越見龐大。儘管澳洲礦業巨擘必和必拓（BHPBilliton）最近敵意收購加拿大鉀肥公司PotashCorp.失敗，但顯示企業對農業相關公司的興趣與日俱增。 另外，收購者亦尋求地區分散投資及業務擴展，農產品供應商Agrium收購澳洲穀物營銷商AWB便是一個好例子。 富蘭克林鄧普頓投資
20110305-129,20110305,129,點滴無閒置資金　中投待注資,點滴 無閒置資金　中投待注資 ▲市場盛傳中央向主權基金中投注資，中投副總經理汪建熙表示，沒有政府官員反對增加對中投的注資。他承認，由於中投已無閒置資金，對中投而言會有所限制。此外，中投會逐漸設立海外分支機構，但目前無具體時間表。
20110305-130,20110305,130,大環境小投資：阿拉伯亂局拖累耗油國 - 潘國光,大環境小投資：阿拉伯亂局拖累耗油國 - 潘國光 筆者看好天然資源，早前預期紐約期油價格會跟隨布蘭特油價上升，以目前中東一帶的局勢而論，相信與「圓滿解決」仍有一段距離，油價短期內料難大跌；中長線而言，石油存量及產量正日漸萎縮，油價料將維持在較高水平運行。在是次阿拉伯亂局下，對石油依賴程度較高的國家影響無疑較大，而復蘇力度不穩的成熟國家亦受牽連。 年初至今，MSCI能源指數和俄羅斯RTS指數均升逾12%，印度及沙地阿拉伯股票指數則分別下跌約9%及20%（見圖），可見高油價會打擊新興市場，或利好阿拉伯地區的立論均不正確。 中港影響相對低 埃及仍由軍方統治，加上利比亞局勢不穩，即使油價回落，亦只會是短期現象。有研究報告指出，將不同國家來自能源方面的收入，跟關於能源方面的補貼作比較，可得出哪個國家是高油價下的受惠者（或受害者）。 在新興市場中，受高油價所累的國家主要是石油依賴國，當中埃及、巴基斯坦、印度是能源淨支出國。以印度為例，政府對油價向來提供補貼，最近更決定向國營石油企業提供燃料補貼費用的一半，加上當地公債佔GDP比重逾50%，因此油價越高，對印度的財政壓力越大。亞洲方面，東協國家如新加坡，石油開支佔GDP逾10%，油價上升亦影響當地經濟增長。 相反，對石油依賴較低，甚至本身是石油出產國，則較易降低高油價的衝擊。中國和香港的石油開支佔GDP不足4%，故高油價對經濟的衝擊有限。至於俄羅斯，國內石油消費量只佔當地油產25.7%，其餘74.3%均作出口，因此反受惠於高油價。 成熟國家在今次油價升浪中亦將難獨善其身，近來有研究顯示，油價每上升10美元，將會令美國未來兩年內，每年GDP增長下跌0.2至0.3%。因油價上漲增加了美國人在汽油方面的開支，高油價變相成為對消費者的另類徵稅，減低整體消費意欲。 至於一眾阿拉伯國家，單從油價角度來看，固然難以對經濟增長產生影響，不過，目前當地多國均面臨民眾示威，甚至變天的浪潮，此一大不穩定因素將成為當地經濟的主要障礙。在如此亂局之下，投資能源股明顯比投放在中東地區更能受惠。 潘國光 富邦銀行（香港）第一副總裁兼投資策略及研究部主管
20110305-131,20110305,131,點滴中集︰下半年運費看俏,點滴 中集︰下半年運費看俏 ▲中海集運（2866）主席李紹德指，北非和中東局勢動盪，鐵礦石價格續高，預計今年散貨的運貨全年走勢會先低後高，下半年運費將改善。母公司中海集團已和國泰君安、上海國際集團等，成立20億元人民幣上海船舶基金。
20110305-132,20110305,132,衍生創富：業績期炒購證　防反高潮,衍生創富：業績期炒購證　防反高潮 滙控（005）公佈業績後股價拾級而下，上周二裂口下跌5.14%，當日正股跌勢顯著且成交大升，亦影響了相關認股證引伸波幅之變化。由於滙控股價波動性提升，同日滙控認購證平均引伸波幅上升，令不少相關認購證之跌幅較理論跌幅為低。 滙控股價被市場推低，但其認股證成交上周二、三卻稱冠，成交佔有率分別達20.2%及19.5%。上周二滙控認購證街貨量變化不大，保持約41億份。 基於滙控股價在業績後急挫，其認購證平均引伸波幅由上周一約26.4%，升至上周二的45.96%，升幅約19.56個波幅點。至上周三才回落至27.18%，與上周一水平相若。 這個變化對認購證持有人來說或許是一個利好現象，因為上周二滙控急跌時，不少相關認購證之跌幅較理論跌幅為低。以滙控認購證28059為例，上周二正股曾跌5.14%，此證實際槓桿約11倍，理論跌幅約56.54%，但當日該證僅回吐41%。雷同情況在多隻滙控認購證身上均能找到。 滙控業績後股價急跌，提醒投資者在業績期買賣認股證的風險，倘若結果未見驚喜，加上近期大市走勢偏軟，這些股份在業績後有機會出現較大調整。 麥格理資本證券股份有限公司衍生工具部
20110305-133,20110305,133,點滴劉遵義促中港交易所合作,點滴 劉遵義促中港交易所合作 ▲全球各地交易所相繼合併，全國政協委員劉遵義指，香港應該擔當起這個責任，發展成亞洲最好股票的交易場所。他指香港雖早已是世界金融中心，但如果不和內地聯手，一定會在這種全球交易所大合併的趨勢中被邊緣化。
20110305-134,20110305,134,牛熊攻略：內銀追落後　敲建行C輪 - 于正人,牛熊攻略：內銀追落後　敲建行C輪 - 于正人 上周五港股上揚，主要受中資金融股帶動，其中內銀股似開始追落後，建行（939）繼上周四突破近1個月的阻力位50日線約6.89元後，上周五更曾升穿7元關。 內銀股長期處於內地加息的陰霾下，去年跑輸大市。但市場已預料今年人行將加息多次控制通脹。投資者如看好建行，可考慮價外認購證27441，行使價7.50元，5月到期，引伸波幅27.3%，有效槓桿12.4倍。 內地保險股上周五亦發威。上月底曾創一年低位的國壽（2628）發力追落後，股價連升兩日後，上周五曾高見30.45元，收市亦企穩於30元之上。 國壽雖未公佈去年業績，由於2010年A股表現差強人意，市場普遍不寄予厚望，但董事長楊超日前表示，2011年保費收入增長會高於去年，而加息將刺激壽險股利潤。 技術上，國壽已收復10日及20日線滙聚於約29.50元的阻力，若後市氣氛配合，有機會挑戰阻力「頸線」約30.75元位置。投資者如看好可考慮認購證27765，行使價31.88元，7月到期，引伸波幅27%，有效槓桿10倍。 于正人　瑞銀亞洲股票衍生產品銷售部董事總經理 資料由UBSAG（瑞銀）于正人（證監會持牌人）代表瑞銀編纂並由瑞銀刊發。筆者持有文章提及之結構產品或相關資產。
20110305-135,20110305,135,美林輪證：中移動反彈　追入購證少 - 黃書耀,美林輪證：中移動反彈　追入購證少 - 黃書耀 最近中移動（941）似乎在72元找到一定支持，於3月1日強力反彈，高見75.35元，一口氣突破了10日及20日線；相對強弱指數於2月11日至3月2日與股價出現了牛背馳，其他技術指標亦有類似情況。 中移動較早前宣佈，上客數字重見500萬水平。1月份客戶淨增長526.3萬戶，按月升20.2%，用戶總數增至5.89億；3G終端客戶亦增至2263.3萬，按月增加193.1萬戶，相較12月增186.7萬戶，上客速度加快。 由1月3日至3月3日，流入中移動相關認購證資金達3.59億元，主要集中於1月首3個星期流入，但隨着中移動股價最近反彈，願意追入的資金反而不多，與投資者的慣性相符合。中移動認購證平均引伸波幅現時處於25.1%，為3個月相對低位，且有輕微上升迹象。 上周五中移收報74.60元，往績及預測PE分別為10.75及10.71倍，現時股息率則約3.9%。投資者如看好可留意中短年期略為價外認購證28222，行使價77.99元，6月到期，引伸波幅約24.1%，有效槓桿約12.4倍，每天時間值損耗約0.53%。 黃書耀　香港認股證銷售部主管 美林亞太區股票結構性產品部副總裁 撰寫人為美林香港代表，本身為證監會持牌人士，撰寫人並無持有文章提及之證券，而美林香港是美林認股證及牛熊證之流通量提供者。
20110305-136,20110305,136,內地上月新貸傳不足6000億,內地上月新貸 傳不足6000億 【本報訊】中國1月份新增貸放高達1.04萬億元（人民幣．下同），2月初，銀行繼續「寬貸」，踏入2月首天，內地銀行體系批出新增貸款竟高達5000億元。 不過，在監管機構向違「慎貸令」的銀行收取動態式存款準備金後，銀行「收回」已批出的新增貸款，令2月新增信貸傳跌至不足6000億元。 銀行為「早放貸、早收益」，2月份的首四天，各大銀行貸款額度已基本用罄，「寬貸」行為惹怒人民銀行，人行自年初起，對40多家包括全國性金融機構在內的銀行，收取動態式的差別準備金，此懲罰舉動只緊不鬆，終令銀行收斂。 差別準備金奏效 據《中國證券報》報道，2月銀行業新貸在6000億元以下，遠低於此前市場預期。其中，工行（1398）、農行（1288）、中行（3988）、建行（939）四大行新增貸款分別為550億、700億、470億和450億元，合計低於2200億元。 市場人士認為，與1月高達1.04萬億元新增信貸規模相比，2月不足6000億元的新增信貸水平，反映連續上調存款準備金率，尤其是實施差別存款準備金率政策，已顯示出超預期威力。 人行副行長馬德倫在全國貨幣金銀工作會議上指出，當前貨幣金銀工作面對五項挑戰：一是影響現金投放的因素越來越複雜，對現鈔需求預測的難度不斷加大；二是安全管理時刻不能鬆懈，管理的細節需要不斷加強；三是加強制度建設，嚴格執行規定和命令；四是依法監督，配合商業銀行在現鈔業務方面更好地履行社會責任，推動商業銀行不斷提高現金服務品質；五是從提高防偽技術水平、加強對群眾的宣傳教育等方面採取措施，防範假幣犯罪。
20110305-137,20110305,137,錦言堂：恒指升破降軌　橫行整固 - 李錦,錦言堂：恒指升破降軌　橫行整固 - 李錦 美國上周申領失業救濟人數減少，創08年5月後新低，加上上月ISM製造業指數勝預期，市場對當地經濟復蘇步伐樂觀。另有傳利比亞領導卡達菲考慮接受和平計劃，地緣政治危機有望結束，市場恐慌情緒得以紓緩。過去一周港股表現反覆，於周末前反彈並超越短期下降軌，短線已擺脫反覆下跌局面，後市有望呈區間橫行整固格局。 過去一周窩輪和牛熊證交投均見上升，平均每日成交額分別約133億和63億元。期內恒指牛證錄得約4540萬元資金淨流出，熊證則約8360萬元淨流入，反映資金傾向買入熊證開倉造淡。股份方面，滙控（005）股價業績後顯著調整，有資金趁低吸納相關認購證博反彈。 內銀股近期走強，建行（939）剛突破小長方形頂及50日線約6.90元水平，如看好可留意中長期價外認購證28009，行使價7.38元，7月到期，10.2倍實際槓桿。工行（1398）則上破年初反彈高位6.13元，如看好可留意中期價外認購證28010，行使價6.48元，6月到期，10.6倍實際槓桿。 李錦　法興證券衍生工具部亞洲區董事（日本除外） 本文作者為證監會持牌人士，代表法國興業證券（香港）有限公司撰稿。法國興業證券（香港）有限公司為本文所提及結構性產品之流通量提供者。
20110305-138,20110305,138,永隆料港銀行隨時上調按息,永隆料港銀行 隨時上調按息 【本報訊】近日有大行淡出同業拆息（H）按揭業務，招行（3968）旗下永隆銀行，其按揭及私人貸款中心主管蔡爾全昨表示，現時該行最優惠的新造H按息，為H+0.85厘，儘管有同業淡出，惟各主要銀行仍按兵不動，他不排除稍後會有銀行帶頭加息。 招行未聞股神入股 雖然今年首兩個月，市場的按揭申請回落，但他相信全年按揭業務量及金額，有望錄得與去年相若水平。他指目前新造按揭中，七至八成屬H按業務，該行整體H按組合平均息率，為H+1厘以上水平。 去年該行的商業銀行貸款增長四至五成，內地客戶佔新增貸款六成，永隆商業銀行部主管譚兆文相信，在內地民企來港借貸增多下，今年商業貸款展望仍然樂觀。 另外，市傳股神畢菲特擬投資10億美元（約78億港元），參與招行增資擴股計劃，招行行長馬蔚華出席兩會期間，表示不知悉股神入股計劃。招行H股昨升2.99%，收報20.35元。
20110305-139,20110305,139,人幣股票測試銀行毋須參與,人幣股票測試 銀行毋須參與 【本報訊】就人民幣股票的推出，港交所（388）和證監會將於3月中與券商進行系統測試，銀行公會主席和廣北表示，有關測試不涉及銀行；至於銀行的證券交易系統是否需要調整配合，和廣北稱銀行只是多提供一種幣種給客戶選擇，分別應該不會太大，料銀行在系統方面的改動也不會太多。 銀行系統改動不多 至於促進人民幣股票二手市場的人證港幣交易通，和廣北稱港交所有跟銀行溝通，但該會未就個別銀行是否參與作具體討論。他認為，人民幣股票有助強化本港作離岸人民幣結算中心的地位。對於恒生銀行（011）淡出同業拆息按揭市場，和廣北稱未見有其他主要銀行跟隨，另相信今年按息會有上升趨勢。 另有消息表示，金管局昨要求銀行提交個人客戶存款戶口總數目資料，並於下星期一提交，至於所涉用途，消息稱金管局沒解釋，不肯定與財政預算案派錢6000元的措施有否關係。
20110305-140,20110305,140,窩輪心德：資金流出騰訊購輪套利,窩輪心德：資金流出騰訊購輪套利 騰訊（700）進軍中國團購市場，夥美國Groupon聯手開發的「高朋網」。據中國電子商務研究中心統計，去年內地團購銷售額急增至88.6億元人民幣，料今年將增至240億元人民幣。騰訊將於3月16日公佈業績，此前股價大幅炒高，連番破頂創新高。截至上周四，5個交易日中，認購證有近4900萬流出獲利，部份轉投認沽證部署炒波幅，累計流入超過1900萬元。自1月每逢股價升近210元阻力區，皆會吸引較多資金流入看淡，回落至190元則以認購證看好。 騰訊股價上周五突破長方形的波幅區間，投資者宜觀察以往「逢高造淡」的策略是否仍有效，還是股價有機會隨上升軌繼續上揚。由於股價短線波動性增加，引伸波幅有回升迹象。看好騰訊業績可留意購證26250，行使價220.18元，6月到期，引伸波幅38.2%，為市場較低水平；看淡則可留意認沽證28393，行使價200元，7月到期，引伸波幅36.6%。 德銀環球市場證券部 （撰寫人為德銀環球市場證券部之代表，本身為證監會持牌人士，撰寫人並無持有文章提及之證券，而德意志證券是德銀認股證及牛熊證之流通量提供者）
20110305-141,20110305,141,增加供應工地業主爭獨立發展住宅,增加供應 工地業主爭獨立發展住宅 發展局局長林鄭月娥為增加樓市供應量，用盡一切可行方法，以達財政司司長曾俊華「大口」說的3萬至4萬伙目標，當中包括實牙實齒在港鐵（066）的地盤及主動賣地中，提供逾1.9萬伙單位；而能否達標的關鍵，則在於勾地表和如何加快工業地轉型住宅，以「遠水」（中長線提供住宅地）來壓制「近火」（樓價熾熱程度）。 例如政府去年底修訂荃灣分區計劃大綱草圖，將荃灣東約5.7公頃工業地劃分為5個綜合發展區，以便增加住宅的土地供應。 綜合區多業主窒礙重建 城規會就上述大綱圖修訂，共收到8份反對意見，其中7份是由所涉工地的業主，包括新地（016）、新意網（8008）、裕泰興和威馬製衣等多名廠家提出。綜合而言，大致都指出綜合發展區的缺點，每個發展區內都有不同業主，要啟動重建工作前，必須取得區內的所有業主同意；在他門的意見中，都提出有必要再細分現有5個發展區，或直接改劃為住宅（戊類）用途，以便容許個別自行發展土地。 其中新地便要求將第三綜合發展區一分為二，將所持有的安泰工業中心和毗鄰的亞洲脈絡中心，組成一個面積約8.2萬方呎的新發展區。裕泰興也要求不應只限住宅發展，建議將持有的興業中心土地改劃為商貿或商業地。 持有德士古道98至100號大部份業權的南勵投資，也要求重整第二及第四綜合發展區，以便其可獨立發展所持土地，更向城規會提交初步的發展大綱，擬建2幢約26層高商住物業，提供384個平均面積約606方呎的中小型單位。 此外，部份業主亦反映，修訂後可發展的地積比最高5倍，是不公平，因附近類似的工轉住發展，其地積比高達10倍，「反建議」可放寬限制至8倍，或跟從現時荃灣區的發展規限。
20110305-142,20110305,142,貴油拖累中石油：煉油業務正虧損,貴油拖累 中石油：煉油業務正虧損 中石油（857）董事長蔣潔敏（圖）表示，中國政府部門正針對國內外天然氣價差問題，研究解決方案，包括給予政策支持，市場亦承受一部份，他強調最後結果肯定不會由企業完全承擔。 中外天然氣價差望紓緩 由於國內天然氣比國外有一定差距，中石油的進口天然氣業務形成一定虧損。 他又透露，中石油仍與俄羅斯商談天然氣銷售協議，今年內可能與澳洲達成新的LNG（液化天然氣）協定；今年又會從土庫曼斯坦進口150萬至170萬立方米天然氣。 對於現時油價趨升，他指原油價格在每桶90美元，中石油的煉油業務便處虧損，「目前就在虧損」。 他指油價已進入上升周期，未來10年還會上升到一個較高水平，料這次危機後，油價應回落至95至100美元，此乃市場和生產者均能接受的價格。
20110305-143,20110305,143,金石良言：短炒業績　吼和黃購證 - 黃紹良,金石良言：短炒業績　吼和黃購證 - 黃紹良 恒指上周五升286點，收報23408，成交金額約747億元，當中認股證佔15.50%，牛熊證則佔6%，若投資者看好後市可留意價外購證28753，行使價為23800點，7月底到期，引伸波幅約20.96%，實際槓桿11.12倍。投資者如短線看淡後市，不妨留意價外沽證28757，行使價為21600點，8月底到期，引伸波幅約24.21%，而實際槓桿則約為8.34倍。 和黃（013）將於3月底公佈業績，上周五股價徘徊91.60至92.20元，最終收報91.30元，升1.33%。截至上周四，和黃購證3個交易日之淨資金流入約3390萬元，反映投資者持倉過夜情況普遍。 倘若投資者對和黃未來股價表現樂觀，可以考慮中期購證28598。行使價為115元，屬價外選擇，7月中到期，引伸波幅約為38.73%，實際槓桿則約8.73倍，槓桿比率為48.31倍。28598之街貨量偏低，顯示此證受市場供求而影響其理論價格的機會較微。 黃紹良　巴克萊資本亞太區股票及基金機構市場推廣主管 黃紹良為證監會持牌人，並未持有文章提及之證券。投資者應詳閱相關上市文件並為自己作風險評估，在必要時應諮詢專業建議。結構性產品價格可升亦可跌，投資者或會損失所有投資。
20110305-144,20110305,144,亞太區股市,亞太區股市 日本：10693.66　+107.64（+1.02%） 澳洲：4864.28　+57.83（+1.20%） 新西蘭：3418.11　+20.80（+0.61%） 新加坡：3061.31　+23.96（+0.79%） 馬來西亞：1522.61　+15.73（+1.04%） 泰國：995.91　+5.83（+0.59%） 台灣：8784.40　+46.03（+0.53%） 南韓：2004.68　+34.02（+1.73%） 菲律賓：3882.71　+48.66（+1.27%） 印尼：3542.90　+48.36（+1.38%） 印度：18486.45　-3.31（-0.02%）
