key,date,article_daily_id,title,text
20110816-97,20110816,97,前港姐丘碧瑜控客人誹謗,前港姐丘碧瑜控客人誹謗 【本報訊】經營寵物店並專門繁殖貴婦狗的88年港姐丘碧瑜，指一名今年6月購買了貴婦狗的客人，在facebook留言中傷她，批評她做生意不老實，日前入稟高等法院控告對方誹謗及索償。 與李嘉欣陳淑蘭同屆 丘碧瑜當年獲港姐最受佳麗歡迎獎，冠亞季軍分別是李嘉欣、陳淑蘭及張郁蕾。她參選前已獲英國寵物美容師資格，曾出任香港寵物美容師協會主席。 丘在入稟狀指，被告吳月華（譯音）今年6月2日在其寵物店購入一隻在美國繁殖的貴婦狗，同日在其網誌表示該品種屬茶杯貴婦狗及取名「骰仔」。而同月9日至11日期間，被告在facebook發表誹謗她的留言，聲稱受騙並指控她是「奸商」，令她聲譽受損。 資料顯示，茶杯貴婦（teacuppoodle）是數年前由美國繁殖員改良出來，屬貴婦狗中最珍貴及細小的品種，體重少於1.8公斤。這種狗天生骨脆，心臟不能負荷一般犬隻的運動量，照顧牠們要極為小心。 案件編號：HCA1380/11
20110816-98,20110816,98,助姦女兒獸母待判,助姦女兒獸母待判 【本報訊】獸母教唆男友強姦15歲親女案，高等法院法官潘敏琦提取事主X的心理創傷報告，及兩被告的背景報告，押後至下月1日判刑。法官表明，由於案情非常嚴重，判被告監禁是無可避免。 事主X的母親（49歲）早前承認一項協助及教唆強姦罪。控方指，只有小六程度的女被告88年結婚，誕下涉案的X及其智障弟弟後，90年便離婚。女被告曾任職製衣雜工及收銀等，案發時失業，靠綜援過活，她報稱沒有毒癮。其同齡前男友，日前被裁定兩項強姦罪成，他被指於03年8月兩度強姦當時15歲的X。 案件編號：HCCC4/11
20110816-99,20110816,99,冷血廚師扑頭劏肚行劫,"冷血廚師扑頭劏肚行劫 【本報訊】內地廚師聲稱妻子誕下第二胎後，因「超生」被罰款，患病父母亦要他急籌醫藥費，欠債逾10萬元。 欠債10萬為籌錢犯案 該廚師去年兩度在深水埗大南街向夜歸婦行劫。他用磚頭扑頭劫走女侍應1,600元及手提電話後不足兩個月，再在搶走護老院女職員財物後，用摺刀刺她腹部，令她小腸穿洞，醫治兩個月康復。他昨在高院承認兩項行劫及一項蓄意傷人後，暫委法官李瀚良判刑時斥被告行為冷血，重囚7年4個月。 案情指，41歲女侍應袁碧芬去年7月29日凌晨返家途中，在深水埗大南街228號外，遭持雙程證來港的被告李文輝（30歲）突用磚頭打她後腦，她被迫交出1,600元及手提電話。至9月15日晚，43歲護老院女職員梁素禮行經大南街209號外時，遭被告把她的頭撞向車尾，搶走手袋。被告見梁呼叫，再用摺刀刺她腹部。警方接報翻查梁的電話紀錄，在一樓一鳳將他拘捕。 案件編號：HCCC121/11"
20110816-100,20110816,100,片場不能藏二姐周迅、趙薇踢凳開拖,片場不能藏二姐 周迅、趙薇踢凳開拖 周迅和趙薇同列內地四大花旦，兩人的競爭難以避免，早前兩人就因為接演《畫皮2》的片酬高低問題鬧不和，想不到上周兩位阿姐在拍攝現場休息室，為座椅問題吵大鑊，一度劍拔弩張，令全場人員嚇呆，最後要由現場工作人員把兩人分隔開撲火，才平息事件。 周迅、趙薇與陳坤08年合演《畫皮》時，三人感情十分要好，但隨着兩位花旦競爭越來越烈，友情也開始褪色，自去年底開始一直有傳兩人暗地裏較勁，口和心不和，到今年5月她倆同時答應接演《畫皮2》，因為片酬高低問題，兩人不和已變得白熱化。由於有報道指周迅接拍該片酬金是400萬人民幣，趙薇則是450萬，據悉趙薇片酬實收是300萬。 片酬掀微博暗戰 事後周迅經理人余光照在微博諷刺趙薇，暗示有人造假，自抬身價，趙薇隨即在微博發了一句「恨死某個人」，引得眾網友紛紛猜疑某人是否指余光照。後來周迅接受訪問還拖說：「人不要有太多要求和慾望，心胸會比較寬廣。」似乎在暗諷趙薇心胸狹窄。之後她又辭演鈕承澤本月初開拍的《Love》，有說因為該片拍檔是趙薇，她不想多是非而沒有參演，其角色由舒淇頂上。 趙薇與周迅不和在內地影壇已是公開的秘密，所以最近她倆一起演出烏爾善執導《畫皮2》，電影公司也盡量給予兩位阿姐同等待遇，免得再生事端，但想不到上周兩人在河北易縣開工時，竟然為座椅問題起爭執，據現場目擊者稱：「劇組在拍攝現場安排了一間休息室給兩位花旦使用，她們兩位都有自己的專用椅，上周有天當趙薇坐在休息室，周迅出去拍攝，剛巧她回來看到趙薇把她椅子踢在一旁，周迅氣冲冲問趙薇為何要踢開她的椅子。」 趙薇淡然說：「你當時又不在位，椅子阻路才把它擱在一旁。」周迅聽後面露不悅，隨即叫趙薇先站起來，趙不明所以就站起身，周迅二話不說用力把趙薇的椅子踢開，氣得趙薇雙眼睜大怒問：「你現在是甚麼意思？」周迅回應道：「沒甚麼意思，你不是不在位子嗎？椅子擋路，我就把椅子擱在一旁，有關係嗎？」 陳坤左右做人難 趙薇被氣得走到周迅面前互瞪，兩人劍拔弩張地對峙，把全場人都嚇儍了，真的擔心兩位阿姐會動起手來，現場工作人員立刻調停，然後把他們分開。 夾在兩位好朋友之間的陳坤，雖然知道周迅和趙薇不咬弦，但據悉他還是較偏向支持趙薇多一點，因為他和趙薇畢竟是同班同學，還曾經是戀人，就算兩人無緣相愛相守，但他對趙薇一直是關愛有加。而周迅縱然一直以來和他因合作關係也走得很近，貼微博秘照，親密出行，但陳坤從未表示對她有愛情的感覺，這也許讓周迅很受傷，令她與趙薇嫌隙越來越大。 採訪：葉雪 兩大花旦片場開火示意圖 話你知：畫皮小妖謀害正室 趙薇和周迅在08年電影《畫皮》結片緣，該片由陳嘉上執導，在內地取得2億人民幣票房紀錄，成績彪炳。該片取材自《聊齋志異》同名故事，周迅扮演披着人皮的狐妖小唯，必須靠吃人心來維持皮相。有次小唯被陳坤飾演的將軍王生所救，對王生一見鍾情，遂用妖術迷惑他，但被趙薇飾演的王夫人識破。《畫皮2》則由烏爾善執導，主角繼續由趙薇、周迅及陳坤擔綱，據悉新作不再糾纏於三角戀，而是一部由女性視覺出發的電影。
20110816-101,20110816,101,失戀宣萱素顏睇騷,失戀宣萱素顏睇騷 一連三場的「基會難德SingItUp世界巡迴演唱會」已順利完成，張崇基和張崇德在圈中一向人緣好，因此這三場演唱會有不少嘉賓好友到場支持，除了首場有表演嘉賓鄭秀文，黎瑞恩及車婉婉等亦有捧場。 剛與外籍獸醫男友分手的宣萱則現身第二場，見剛受情傷的她精神還算不錯，大方以素顏面對鏡頭，可見宣萱仍對自己信心十足。 崇基崇德破紀錄 崇德坦言感激不少好友自掏腰包買票支持，崇基崇德亦指今次演唱會打破了場地紀錄，皆因StarHall平日做演唱會到晚上11時已是極限，不過尾場觀眾聽到凌晨12時也不肯走，令他們相當感動。 撰文：葉雪
20110816-102,20110816,102,Edison威畀爹哋睇,Edison威畀爹哋睇 為期三天的熱波星尚沙灘音樂節前晚在上海圓滿結束，陳冠希（Edison）和何超儀等先後演出。Edison穿上籃球巨星米高佐敦（MichaelJordan）的公牛戰衣，以一曲《還記得我嗎》壓軸登場，再一口氣唱出六首歌曲。 之後Edison接受訪問，問他最喜歡當歌手、演員還是老闆，他直言：「我喜歡做自己。」提到工作大計，他說：「我很想拍電影，但還沒找到劇本，接下來會開始錄音，製作下一張專輯。」Edison又表示原本父親不支持他做生意，認為他不會成功，但現在生意上了軌，父親也開始支持他，又穿他的品牌衣服，令Edison感到自豪。 撰文：林妃
20110816-103,20110816,103,余文樂帶傷奪冠,余文樂帶傷奪冠 余文樂和周柏豪所屬的橫洲工業前日在元朗舉行首屆「橫洲工業三人籃球賽」，由初賽到總決賽分別舉行130場賽事，大會分三個組別比賽，柏豪和樂仔分別代表橫洲工業C隊及A隊出戰男子公開組。最後柏豪的C隊在四強戰止步，樂仔的A隊最終憑14比11分奪得冠軍，樂仔在最後一戰中還射入兩球得4分。 北京醫治 提到左手腕的軟組織傷患仍未康復，樂仔說：「有兩節軟骨凸出，用到力不過都會痛。」今趟他到北京拍戲順便醫治頸椎和腰骨四節移位的問題，現在每次打波都特別小心，因為公司不太鍾意他打波受傷影響工作。 採訪、攝影：馬建華
20110816-104,20110816,104,吳晴晴穿越時光搵靚種,吳晴晴穿越時光搵靚種 三級電影《蜜桃成熟時33D》將於下月28日在香港上映，日前公佈的宣傳海報就以在戲中有大膽演出的內地模特兒吳晴晴為主打。反而兩位日本殿堂級的AV男、女優，即有「神之手」稱號的加藤鷹及「AVStephy」吉澤明步的照片就未有在海報出現，相信要到遲一輪的宣傳中才能見到兩人出場。 來自2046年 吳晴晴在片中演一位來自未來的少女，名為蜜桃，她是從2046年經時光機回到2011年。海報中的宣傳語句亦寫道，此行她是為了尋找人類最好的種子，片中自然有不少三級場面出現。另外，早前因穿香港警察制服拍強姦戲，而遭聲討及成為港聞頭條的鷹哥，據知稍後將跟吉澤來港為電影宣傳。 採訪：李森 攝影：葉君海
20110816-105,20110816,105,醉駕上庭揭舊史千千被爆曾犯刑事案,"醉駕上庭揭舊史 千千被爆曾犯刑事案 劉家昌兒子劉子千近日憑《唸你》一曲爆紅，以乖乖仔形象示人的他原來08年曾犯刑事案。記者翻查去年7月千千醉駕案聆訊時，庭上曾提及千千08年曾犯下刑事案，但昨日記者向其助手阿蓉了解時，阿蓉卻表示有待了解。 人紅自然是非多，25歲的劉子千所唱的《唸你》近日在互聯網爆紅，連原裝版及惡搞等各大版本點擊率在一個月內合共高達2,300萬次。不過，近日頻頻以乖乖仔示人的千千，原來08年曾犯刑事案。 老竇鼓勵多追女 本報接獲讀者報料，指千千08年曾犯刑事案，跟他近日乖乖仔形象大相逕庭，令一眾支持他的粉絲頓感受騙。記者翻查資料，發現去年4月在港被揭醉駕的千千，在案件於去年7月29日在觀塘裁判法院聆訊期間，庭上確曾提到千千08年曾犯下刑事案，但未有進一步透露他當年犯了甚麼罪；至於有關千千犯刑事案一事，去年7月30日本港多份報章也有報道。千千當日醉駕被判處150小時社會服務令、罰款8千及停牌兩年，據悉千千已完成社會服務令。 記者昨日致電千千助手阿蓉，問08年千千所犯的刑事案究竟涉及甚麼罪行，其助手表示有待向千千了解再作回覆。 另外，劉家昌日前與千千接受訪問時，透露繼《唸你》後將為兒子再作一曲《吃飯》，他說：「寫得好一定紅，生活化嘛。」早前有傳劉家昌花400萬新台幣要台灣女藝人林亞霖與千千分手，劉家昌否認其事，揚言從不管兒子交女友，相反還希望兒子多交女友，劉家昌說：「他要多交一點，受過打擊，內心痛過，比較寫得出歌。」 採訪：林妃"
20110816-106,20110816,106,章子怡拍戲悟人生,章子怡拍戲悟人生 章子怡最近擔任時尚雜誌《ELLE世界時裝之苑》封面女郎，遠赴比利時拍攝照片。其中她穿一套黑色低胸晚裝配上寬頂法式風情帽，盡顯典雅貴氣，轉頭又換上一套清新的行政服，散發熟女的知性。 「吸取了力量」 章子怡接受訪問時提到其有份主演、王家衞執導的電影《一代宗師》，她坦言對其演出的角色「宮二先生」很有共鳴。 電影拍攝時，章子怡正處於最徬徨的低潮，但電影角色對愛情和人生的抉擇，均深深觸動着她，章子怡說：「她的人生抉擇、愛恨情仇，讓我感覺到同樣身為女性，我們有些地方是血脈相通的。我從她身上吸取了力量！這個角色真的承載了我太多的記憶。」 撰文：林妃
20110816-107,20110816,107,張立基剃毛等出碟,張立基剃毛等出碟 張立基及黃維德等前晚到灣仔出席「美惠純子禁毒慈善金曲演唱會」，張立基即場獻唱《異性相吸》和《你好嗎》，當中《異》曲更是張立基自資請DJ重新混音，他表演時大受歡迎，粉絲拿專輯給他簽名，令他開心不已，不過他卻被發現剃掉腋毛，認真姿整。 戥蔡楓華高興 張立基說希望再出碟，但就無意自資，希望有唱片公司找他，他已回流香港年多，並從朋友口中得知屬於他年代的歌手都再開騷。提到蔡楓華鹹魚翻生，張立基表示有留意，並戥對方開心：「佢喺九展開完騷，又喺內地開。我11月會去加拿大做歌唱比賽評判，會keep住多啲曝光，離開咗香港十幾年，今次返嚟除咗出碟，亦想多啲時間陪媽咪，因為媽咪身體唔好。」 採訪：何慧斯　攝影：仇志德
20110816-108,20110816,108,楊丞琳奪型男第一次,楊丞琳奪型男第一次 台灣歌手楊丞琳（Rainie）最近推出新專輯《仰望》，日前拍主打歌《缺陷美》MV，更邀得蕭亞軒舊愛、有「台灣第一帥」之稱的型男王陽明任男主角。這也是王陽明首次拍MV，他笑言Rainie奪走他的第一次。 改變唱腔 MV中，Rainie與王陽明很癡纏，一時擁抱，一時在對方鎖骨寫情書。王陽明首次演出毫不尷尬，難怪Rainie狂讚他：「很會放電，很會演呢！」此外，Rainie在《缺陷美》中一改以往唱腔，運用「丹田唱法」壓住腹部讓聲音吼出爆發力，頗有另類搖滾味道，但她卻笑說：「在簽唱會唱歌時，我壓住肚子唱，歌迷以為我肚子痛呢！」 撰文：林妃
20110816-109,20110816,109,呂婉柔宣佈結婚,呂婉柔宣佈結婚 現年25歲、有暴乳Baby之稱的呂婉柔，早前驚爆介入汪小菲和大S的婚姻，汪小菲更向她狂發情慾短訊，令大S打翻醋埕。然而事隔不夠三個月，呂婉柔前日凌晨忽然在微博公佈婚訊，並張貼出婚紗照，至於新郎是誰則惹來揣測。 網民懷疑宣傳 穿上婚紗的呂婉柔拿着花球，一副含情脈脈的模樣，她寫道：「我結婚了，婚禮舉辦的地點在澳門，抱歉沒有提前通知大家。這也是前幾天我忽然消失的原因。直到那天我才明白原來女人一生最美的時候是穿上婚紗的那一刻。」由於事出突然，網民不太相信這是事實，又懷疑她只是接拍婚紗廣告而已。 撰文：林妃
20110816-110,20110816,110,馮仁昭四圍超：梁家輝孖索助手　北京隊啤撐枱腳 - 馮仁昭,馮仁昭四圍超： 梁家輝孖索助手　北京隊啤撐枱腳 - 馮仁昭 今年53歲嘅梁家輝同老婆江嘉年結婚廿幾年，平日出嚟佢哋都表現好恩愛，雖然家輝越嚟越有男人味，但佢就一直被公認為好老公，甚少傳出緋聞，即使早年佢同靚女助手Janet傳過緋聞，但佢哋夫妻都係恩愛如昔。 曾傳緋聞冇避忌 不過噚日內地傳媒就大字標題話梁家輝撇妻夜會神秘美女，原來近日家輝喺北京同馮德倫拍緊新片《太極》，家輝喺當地被拍到同神秘美女共晉晚餐，其實嗰位神秘美女就係跟佢7、8年嘅助手Janet，雖然兩人曾經傳過緋聞，但就似乎冇刻意避忌，家輝繼續對Janet照顧有加。 飯後散步返公寓 當日佢哋喺飯店傾到雞啄唔斷，家輝細心遞煙畀Janet，兩人邊煲煙邊飲酒吹水，食到咁上下就散步返酒店式公寓，之後深夜都唔見兩人離開。雖然兩人全程冇乜親暱表現，但睇落好似一對情侶，其實Janet個樣同家輝老婆有幾分相似，只係兩人身形同年紀唔同啫，似乎家輝嘅品味好一致，就連助手都要搵個同老婆相似喎。
20110816-111,20110816,111,馮仁昭四圍超：古仔腳傷辭演　伊健執二攤 - 馮仁昭,馮仁昭四圍超：古仔腳傷辭演　伊健執二攤 - 馮仁昭 古天樂上月底因為喺屋企唔小心俾拖鞋絆倒跌落樓梯，搞到右手同右腳十字韌帶斷裂及半月板撕裂，傷勢都幾嚴重，原本佢本月初要開拍于仁泰執導嘅《一門忠烈之楊家將》，但因為受傷，部戲決定停拍等古仔好番再開。但噚日馮仁昭收到風，部戲聽日喺河南開機，古仔正式辭演啦！佢演嘅楊大郎角色會由鄭伊健頂替。 消完腫做手術 馮仁昭噚日打畀投資呢部戲嘅老闆黃百鳴，佢話：「原本係想等古仔好番先拍嘅，但醫生話佢最少一年唔可以拍動作戲，咁呢部戲有咁多動作鏡頭要拍，又要騎馬，古仔冇可能拍到，我同古仔商量過後，最後都係決定畀佢好好休養，換鄭伊健做佢個角色，而伊健原本嘅角色會畀邵兵做。」 下月中黃百鳴另一部賀歲片《八星抱囍》開拍，究竟古仔演唔演？黃百鳴話：「呢部冇動作，佢可以演嘅，下月中開拍後會先跳拍其他人嘅戲份，古仔戲份會延到最後先拍，等佢隻腳好番咁上下拍會比較好。」古仔家喺屋企靜心休養，出入都仲要用枴杖，等消晒腫後，佢會安排隻腳再做一次手術。
20110816-112,20110816,112,馮仁昭四圍超：謝天華新劇Chok高收視 - 馮仁昭,馮仁昭四圍超：謝天華新劇Chok高收視 - 馮仁昭 雖然謝天華喺家播映緊嘅無綫新劇《潛行狙擊》中，成日俾人笑佢chok過林峯，但就無損收視同口碑，上周收視平均有30點（約192萬人收看），算係近期收得之作。至於「雙馬」馬浚偉同馬國明合演嘅《紫禁驚雷》收視依然冇乜起色，平均只有27點（約172萬觀眾），總算比上周多咗一點，希望臨近大結局收視可以再好啲。
20110816-113,20110816,113,馮仁昭四圍超：官恩娜衣錦還鄉拍特輯 - 馮仁昭,馮仁昭四圍超：官恩娜衣錦還鄉拍特輯 - 馮仁昭 喺大溪地出世嘅官恩娜（Ella），為咗方便發展呢幾年都喺香港住，好少返大溪地，噚日Ella去商台宣傳新碟，佢話嚟緊會為無綫拍一個關於大溪地嘅旅遊特輯，足足返去3星期，會去自己出世嘅醫院同父母住過嘅地方，Ella話有諗過帶埋媽咪一齊去，等佢探吓當地住嘅親友，不過怕媽咪辛苦，都係打消念頭。咁男友？Ella表示：「佢好忙，遲啲同佢去過。」
20110816-114,20110816,114,馮仁昭四圍超：羽翹拖羅力威唔認數 - 馮仁昭,馮仁昭四圍超：羽翹拖羅力威唔認數 - 馮仁昭 羽翹被本報拍到日前同羅力威約會食點心，雖然冇乜親密行為，但十足拖友咁，噚日羽翹喺新城宣傳，係咪同羅力威拍拖？佢話：「我係三年冇拍拖，都想拍，但係我拍拖都唔會公開，同羅力威識咗3個月，一直話約出嚟傾合作嘅嘢，我冇主動拖羅力威隻手。」怕唔怕俾羅力威啲fans鬧爆？羽翹話：「今次佢嘅fans表現好冷靜。」
20110816-115,20110816,115,馮仁昭四圍超：Kelly經理人證冇懷胎 - 馮仁昭,馮仁昭四圍超：Kelly經理人證冇懷胎 - 馮仁昭 陳慧琳（Kelly）之前小產失去腹中孖女，不過佢好堅強，休息後好快康復復出工作，但噚日有報道指Kelly又懷有龍鳳胎兩個幾月，所以同蝦餃仔劉昇去街時都唔可以抱吓佢。向Kelly經理人鍾珍求證，原來佢噚日正同Kelly喺上海做完嘢，準備轉機去黑龍江，佢喺電話中表示：「Kelly冇BB，希望大家可以畀多啲空間同時間佢，唔好畀佢咁多壓力。」
20110816-116,20110816,116,馮仁昭四圍超：吳彥祖貼古仔金馬封帝 - 馮仁昭,馮仁昭四圍超：吳彥祖貼古仔金馬封帝 - 馮仁昭 劉青雲、吳彥祖同古天樂合演新戲《竊聽風雲2》，噚日喺北京舉行首映，青雲、吳彥祖同女主角黃奕及葉璇齊現身，古仔因受傷未能到場。大會透露吳彥祖同古仔會憑呢套戲報名第48屆金馬獎最佳男主角，屆時一較高下，講到有冇信心？吳彥祖話：「拿不拿影帝一切隨緣。」佢反而睇好古仔有勝算，不過目前最希望係古仔嘅腳傷可以早日康復。
20110816-117,20110816,117,馮仁昭四圍超：鮑起靜新節目倍添壓力 - 馮仁昭,馮仁昭四圍超：鮑起靜新節目倍添壓力 - 馮仁昭 鮑起靜會幫亞視做一個資訊節目《百年共和》嘅主持，形式就好似狄娜嘅無綫節目《大國崛起》，噚日亞視安排喺大埔錄影廠探班，鮑姐扮到好似宋慶齡咁，佢話：「我都有睇狄娜嗰個，係有少少似，不過我哋會有更多圖片同專家講解。」鮑姐話做呢個節目好緊張：「唔同拍戲，歷史係唔可以錯，所以我好勤力，背稿背到好熟，好似上咗堂歷史科咁。」
20110816-118,20110816,118,關仁隱事：「楊桃」「五指山」爭角色雙輸 - 關仁,關仁隱事：「楊桃」「五指山」爭角色雙輸 - 關仁 三色台姐仔私下經常鬥個你死我活，好似「楊桃」同「五指山」咁，三色台準備開部有關醜女同靚女大激鬥嘅古裝劇，已經一早定好由力捧姐仔「跑車」做正氣醜女，而邪惡美女本來想搵楊桃或者五指山做，點知佢兩個聽到跑車做好人而自己做衰人時，即刻耍手擰頭拒絕。事關佢哋知道正氣醜女角色討觀眾歡心，邪惡美女乞觀眾憎，醜女戲份又多過美女好多，楊桃同五指山唔肯俾跑車騎住，咪一味sayno囉！原來五指山曾經同高層建議自己做正氣醜女，但高層覺得唔適合，最終美女角色就由「芝芝」冷手執個熱煎堆。 撰文：關仁
20110816-119,20110816,119,馮仁昭四圍超：張繼聰頭MV被河蟹 - 馮仁昭,馮仁昭四圍超：張繼聰頭MV被河蟹 - 馮仁昭 張繼聰噚日喺新城做客席主持，講到佢自己最近有首歌叫做《瑪利殺死小綿羊》，歌詞係講外國好多殺死動物嘅駭人個案，而張繼聰搵咗個導演幫佢將首歌分別剪成三分鐘及一分鐘版本嘅MV，全部都係來自唔少網上虐待動物殘酷片段，但係點知個MV就俾人「河蟹」咗，阿聰話：「我唔明點解會咁，一分鐘嗰條都被列為三級，其實所有片都係喺嗰度搵。」
20110816-120,20110816,120,巾幗紅人：四大花旦多事幹,巾幗紅人：四大花旦多事幹 日前在片場大動干戈的趙薇和周迅，與章子怡和徐靜蕾合稱為中國四大花旦。她們雖事業順利，但除趙薇外三大花旦感情路均迂迴曲折。 趙薇（35歲） 學歷：北京電影學院導演學碩士 感情狀況：09年與黃有龍結婚，育有一女。 獎項：去年憑《花木蘭》奪百花獎最佳女主角 代表作：《還珠格格》、《花木蘭》、《畫皮》 周迅（36歲） 學歷：浙江藝術學校畢業 感情狀況：去年與京城四少之一王爍閃電分手，近日與陳坤傳緋聞。 獎項：06年憑《如果．愛》奪金馬及金像獎影后 代表作：《人間四月天》、《蘇州河》、《如果．愛》 章子怡（32歲） 學歷：修讀中央戲劇學院戲劇系 感情狀況：先後與霍啟山、老外富豪ViviNevo相戀，近日又傳與NBA球星高比拜恩暗交5年。 獎項：04年憑《茉莉花開》奪金雞獎影后、05年憑《2046》奪香港電影金像獎影后 代表作：《我的父親母親》、《臥虎藏龍》、《藝伎回憶錄》 徐靜蕾（37歲） 學歷：北京電影學院表演系畢業 感情狀況：與黃覺分手後，感情生活一直撲朔迷離，近日承認有親密男友，但身份神秘。 獎項：03年憑《開往春天的地鐵》獲百花獎影后 代表作：《投名狀》、《杜拉拉升職記》 資料來源：《蘋果》資料室
20110816-121,20110816,121,馮仁昭四圍超：栢芝北京笑賀趙本山 - 馮仁昭,馮仁昭四圍超：栢芝北京笑賀趙本山 - 馮仁昭 自從同謝霆鋒搞離婚，張栢芝大部份時間留喺內地拍新戲《河東獅吼2》，好少返香港露面，噚日佢就着上一條白色大露背裙，喺北京出席內地演員趙本山開嘅酒店開幕活動，擔任嘉賓之一，同場仲有同霆鋒幾老友又合作過拍戲嘅成龍、章子怡。 栢芝着上大露背裙悉心打扮，見佢狀態相當唔錯，同現場賓客談笑風生，唔知佢係咪真係已經走出離婚陰霾，定係喺人前強裝開心？
