key,date,article_daily_id,title,text
20110922-104,20110922,104,瑤瑤放電兇神惡煞,瑤瑤放電兇神惡煞 台灣藝人郭書瑤早前參加東方衞視《舞林大會》比賽，自我挑戰從未玩過的標準舞，為出戰她連夜苦練，初時瑤瑤興奮期待，但跟着便開始感到壓力很大，結果搞到發噩夢。幸好經過苦練後，瑤瑤在比賽時有出色表現，順利晉級，她當時感動落淚，並說：「過程雖辛苦，不過我很享受跳舞的每一刻。」 唔夠女人味 瑤瑤獲讚有跳舞天份，學習速度快，但也被指女人味不夠。瑤瑤為展示女人味，努力擺出不同表情以及用眼神放電，但工作人員卻取笑她：「你在瞪人嗎？眼神很兇！」 撰文：丁寧
20110922-105,20110922,105,基仔火辣緊貼JessicaC.,基仔火辣緊貼JessicaC. 古巨基近日正忙於為下月在香港舉行的3場演唱會進行綵排，這趟他找來有警鐘胸之稱34C女模JessicaC.擔任舞蹈嘉賓。由於兩人太熟，一場場的辣身舞排練變成兩人大笑的泉源。 一見如故 Jessica早前曾擔任基仔歌曲《獨男》MV的女主角，兩人一見如故成為好友，於是基仔就邀請Jessica任今次個唱的舞蹈嘉賓。開騷在即，兩人近期忙於在尖沙嘴的排舞室排舞。基仔表示今次的舞蹈非常火辣，Jessica的打扮亦很性感，但兩人太熟，所以每當有面貼面動作時，他們都因尷尬忍不住笑出來，基仔笑言希望在台上不會發生這情況。 撰文：李森
20110922-106,20110922,106,李冰冰醉誘成龍上床,李冰冰醉誘成龍上床 電影《辛亥革命》中，本有李冰冰和成龍的激烈纏綿戲，可惜最終被導演刪除。前日網上就流出這段戲的劇照，只見成龍和冰冰赤裸上身，成龍更壓在冰冰身上，十分大膽。 拍完即腳軟 導演張黎拍攝前很緊張這場戲，他主動清場，餘下成龍、冰冰及攝影師等五人。而冰冰為壯膽更猛灌有50多度酒精的白酒，令成龍以為她在喝水，也跟着她喝。當時現場其實只有零下10度，工作人員都穿上羽絨，但兩人則裸着身子。冰冰可能喝酒太多，拍完下床時就腳軟跌倒，成龍立刻抱起她送到保母車，上演一幕英雄救美。 撰文：林妃
20110922-107,20110922,107,梁思浩擺明撩是鬥非,梁思浩擺明撩是鬥非 梁思浩、鄭經翰及導演陳德森，昨到黃大仙為獨居長者慈善團體出席宣傳活動，在無綫做幕後的崔建邦任活動司儀。為該活動任義工多年的崔建邦指，現專心無綫工作。對於有傳他獲now的何麗全招攬，崔建邦說：「家有自己鍾意嘅工作，唔辛苦，其他唔回應。」有指唐詩詠常在崔建邦住所附近出現，更指崔建邦在婚姻註冊處現身，對此崔建邦說：「唔係真我唔會回應，我哋係好朋友，其他唔答。」 想接律師信 梁思浩早前到now102觀星台受訪，思浩在節目中有向方逸華道歉，又談到未能返無綫的原因和與梁榮忠及司徒法正的恩仇，對此思浩說：「有報道話我對梁榮忠、司徒法正撩是鬥非，歡迎隨時發律師信告我誹謗。」 採訪、攝影：張俊銘
20110922-108,20110922,108,《鴻門宴》華麗場景曝光,《鴻門宴》華麗場景曝光 李仁港執導，黎明、劉亦菲、張涵予、黃秋生及陳小春主演的電影《鴻門宴》，將於11月下旬上映，戲中部份主要場景也於日前曝光。 從劇照所見，《鴻門宴》的內景古樸精細，呈現歷史質感，外景則多選自橫店秦漢景區，導演李仁港解釋說：「楚漢爭霸是中國歷史中的重要事件，選擇貼合歷史的場景，才能把人帶到當年的戰爭年代，體會到歷史的滄桑。」 視覺享受 李仁港還親手設計了片中所用的兵器和服飾，他指電影除了故事要好，高品質的視覺享受也同樣重要，他表示：「好看的畫面，能給人最直接的視覺感受，我想把這種美的視覺感受傳達給觀眾。」 撰文：林妃
20110922-109,20110922,109,陳茵媺整蛋糕冧陳豪,陳茵媺整蛋糕冧陳豪 最近頻以情侶檔示人的陳豪和陳茵媺，昨終於分頭搵銀，但不約而同出席鞋品牌活動。陳茵媺與王浩信和陳自瑤齊行鞋騷，大會向茵媺送上一對男裝鞋，寓意她與陳豪共諧連理，最初她不明箇中意思，但經解釋後就說：「唔會喇，對我嚟講結婚係好遙遠嘅事。」茵媺表示不介意以任何形式出席活動，最重要是有錢搵。 陳豪認好夾 陳豪在另一活動亦說不介意為茵媺攞鞋，問陳豪會否叫女友買內褲？他說：「啋！唔得，呢啲嘢太私人，我喺呢方面比較保守。」陳豪透露茵媺曾經整蛋糕給他，他亦為女友冲咖啡，記者說他倆好夾，陳豪笑說：「都係，但又未到結婚地步，我媽咪都冇催我，反而你哋成日催我。」 採訪：王崇穎、卓寶花 攝影：陳慧安
20110922-110,20110922,110,馮寶寶信主大笑「邊個話我儍」,馮寶寶信主大笑 「邊個話我儍」 由童星出身到現在仍於演藝圈工作的馮寶寶，近日受感召成為教徒。前日寶寶姐出席見證會，跟一眾教友分享信主後的新生活，寶寶姐笑言成為教徒後人變得開朗，就連一直不願多談的精神問題傳聞亦肯公開討論。 近日成為教徒、下月將57歲的馮寶寶，前日去到灣仔循道衞理大廈的禮堂出席教徒聚會。寶寶姐當日還在過百名教友前向他們作見證，講自己信主的經歷及重生後的生活，寶寶姐的丈夫及她跟前夫所生的兒子亦有到場支持她。 分享拍戲逸事 寶寶姐穿白色長褲配灰色外套，造型清爽，寶寶姐在台上不失巨星風采，每句說話及動作都吸引到台下教友注意。當講到拍戲的往事時，寶寶姐更是滔滔不絕：「以前拍戲好辛苦，吊威吔都係用條麻繩就算，好簡陋。同埋以前拍通宵係等多，特別係祥哥（新馬師曾），每次都要等佢食完（鴉片煙）至開工，次次都要兩個鐘。」 對於之前有傳寶寶姐精神有問題，她一直甚少在公眾場合談及此話題，這趟在台上她亦主動提及，寶寶姐說：「報紙成日話我儍，所以我對佢哋會有戒心。不過我信咗主之後，人真係開心咗，而且經常會大笑同成日笑。」 有意推出自傳 分享見證後，寶寶姐跟記者交談前，她要逐一問明每位記者所屬報館及姓名才肯跟兒子及老公合照。她又透露有意推出自傳，內容都是一些拍戲時的逸事及自己的心路歷程。寶寶姐表示稍後會返回馬來西亞籌備搬屋事宜，她說：「我家喺吉隆坡住，會搬去怡保。」 採訪、攝影：李志明
20110922-111,20110922,111,黃宗澤：叫天華唞唞,黃宗澤：叫天華唞唞 黃宗澤（Bosco）和徐子珊早前在《潛行狙擊》做情侶，二人前晚以螢幕情侶檔上陣，到灣仔會展宣傳相機產品，徐子珊更賣大包谷胸撐場。 逼子珊撐杏兒 有指《潛》電影版即將開拍，但Bosco直言未落實是否有份演出。對於馬浚偉呻TVB只着重《潛》宣傳，《潛》劇主角謝天華早前回應時被指意氣風發，Bosco笑說：「佢（天華）入戲得滯，叫佢得閒唞唞啦，唔好成日Laughing哥先得。」徐子珊也笑指天華抽離不到角色。 至於胡杏兒和陳法拉都有望爭視后，Bosco要徐子珊明撐杏兒，徐子珊無奈說：「我法拉同杏兒都支持，佢係咁兇我，你哋睇到啦。」 採訪：卓寶花 攝影：陳志嵐
20110922-112,20110922,112,Jeana扮柱女防偷襲,Jeana扮柱女防偷襲 陳靜（DaDa）、何佩瑜（Jeana）、王宗堯和沈志明等，前晚在銅鑼灣鬧市為電影《喜愛夜蒲》派劇照宣傳，現場有十多個保安保護各人安全。Jeana一度索性倚着鐵柱扮「柱女」以防有人從後偷襲。 認肌肉男接載 由於所派的劇照中各人造型性感，問DaDa會否尷尬？她說：「如果着到相中咁派先尷尬。」Jeana被指媾肌肉男，兩人更遊車河，她說該男士為同公司藝人，大家日前出席完《喜》的慶功宴後，她坐該男士順風車過海而已。問Jeana男友有否詐型？她說：「未收到佢電話，都唔怕，我貪方便坐人哋車啫。」 採訪、攝影：魯萍
20110922-113,20110922,113,桃姐征奧斯卡華仔興奮,桃姐征奧斯卡華仔興奮 葉德嫻主演、揚威威尼斯影展的《桃姐》，已獲香港電影製片家協會推舉角逐奧斯卡最佳外語片，下月起在美國搞試片會，有份演出的劉德華昨日透過發言人在電話中說：「好開心，希望真摯嘅情能打動世界上每個人，也希望更多人可以認識許鞍華、葉德嫻同《桃姐》裏面其他出色嘅演員。」憑《桃》片榮登威尼斯影后的葉德嫻也說：「替影片感到開心，自己有份演出都好開心。」 《金陵》趕入圍 至於前日有內地網友爆出張藝謀執導的《金陵十三釵》將代表中國，角逐明年奧斯卡頒獎禮的最佳外語片。為符合申請資格，《金陵》趕於明天起在北京放映。 撰文：李森
20110922-114,20110922,114,《桃姐》、《竊聽2》報名角逐奧斯卡,《桃姐》、《竊聽2》 報名角逐奧斯卡 第84屆奧斯卡頒獎禮將於明年2月26日舉行，而最佳外語片報名日期也將於下月1日截止，現有24部來自不同國家的電影報名，包括剛奪多倫多國際電影節「觀眾選擇獎」的黎巴嫩片《WhereDoWeGoNow?》及台灣的《賽德克·巴萊》等。一向高調衝擊奧斯卡的中國，仍未公佈參選名單。 至於香港會否有片衝擊奧斯卡，記者昨致電香港製片家協會主席洪祖星了解，他說已有片商遞交影片到協會，再由他們11人組成的委員會篩選，然後選出代表，而近日已陸續收到有意報名的電影，包括劉青雲的《竊聽風雲2》及葉德嫻的《桃姐》等，而日內會有定案。 採訪：李森
20110922-115,20110922,115,阿嬌內地受訪繼續被禁,阿嬌內地受訪繼續被禁 鍾欣桐（阿嬌）和蔡卓妍（阿Sa）近日飛往多倫多做騷，早前兩人一同接受內地很受歡迎的節目《快樂邀請》訪問，這節目特別之處是在水上錄影，主持人可能會受到落水和被水射面等懲罰，難怪頭五集網上點擊率已超過500萬次，除阿嬌和阿Sa曾接受訪問，還有鄭希怡、傅穎和謝安琪等。 阿Sa一集反應好 其中阿Sa做嘉賓的一集已播出，反應很好，但阿嬌則沒這樣幸運，當有關部門申報阿嬌一集的播出日期，省電局即叫停不准該集出街，主要是受當年淫照事件影響。至於阿Sa在節目中談到初出道時的瘀事，例如登台沒人理，甚至經常被取笑是「Pizza面」。 撰文：葉雪
20110922-116,20110922,116,祖兒爛玩谷收視,祖兒爛玩谷收視 容祖兒前晚在電視城接連演出《勁歌金曲》和《荃灣飛躍五十載》，對於被安排出席多個節目，祖兒大方說：「我唔介意喎，如果時間啱又有新歌咪做囉，可能我出道早，所以好珍惜演出機會，咪當係練習囉。」談到《勁歌》收視下跌，祖兒說：「大家都係年輕人，或者可以玩多啲，歌手玩吓啲主題遊戲。」 陳美詩前晚也有演出《荃》節目，穿上低胸裝晒事業線，有否向男友孫耀威備案？她笑說：「冇問佢呀，佢成日唔喺香港，或者隔空問吓佢，但佢啲fans反而會幫佢呷醋。」 採訪：王崇穎 攝影：陳順禎
20110922-117,20110922,117,馮仁昭四圍超：梁思浩死畀你睇 - 馮仁昭,馮仁昭四圍超：梁思浩死畀你睇 - 馮仁昭 梁思浩今次喺有線節目《怪談．靈異直播》嘅「死亡預告」，又做人死前嘅其中一種徵兆─「見鬼」，話說喺鬼節嗰日，佢喺深井附近嘅海灘拍一場遇溺浸死戲，深夜時分喺海面扮浮屍。思浩事前本來喺微博預告話叫大家小心浮屍出現，點知佢又「開口中」，翌日喺海灘真係出現浮屍，搞到思浩都覺得：「好邪！」 泰北遇溺有陰影 講到今次扮浮屍，思浩話本來前一晚收到劇本係話佢碌落樓梯死，點知導演嫌佢死得太舒服，開工嗰日臨時先話要改劇本，思浩話：「初初我仲笑笑口話點死都冇所謂，但原來導演想我被水浸死，上次喺泰北就差啲浸死，搞到我唔多唔少都有啲陰影，都唔知佢係咪特登，不過我見到導演要諗10幾種處理方法，我咪頂硬上，唯一希望佢天黑前俾我快啲死。」化晒死人妝嘅思浩，雖然落水嗰陣海面有暗湧，不過為咗大隊可以早做早收，佢諗都唔諗就跳落水，最後一take過搞掂。 拍完浸死之後，思浩仲向導演提議拍埋遺容嘅片段，不過因為劇組冇預備「屍袋」，思浩咪落手落腳周圍搵垃圾袋鋪上身，真係好賣力喎！
20110922-118,20110922,118,林嘉綺、李玟撞日結婚,林嘉綺、李玟撞日結婚 李玟早前宣佈與拍拖8年的未婚夫於下月27日在香港環球貿易廣場（ICC）舉行婚禮，翌日又在邵氏影城設婚宴，同日台灣名模林嘉綺與未婚夫黃麟書也確定在台北寒舍艾美酒店擺喜宴，李玟與林嘉綺的婚期撞日，如果是兩人共同朋友，不知到時如何分身出席。 現年33歲的林嘉綺與在美國任職健體公司並擔任CEO兼訓練師的黃麟書交往3年，嘉綺大男友兩歲，兩人認識8年，3年前才開始交往，拍拖年多黃麟書已有結婚打算，但嘉綺希望今年4月先訂婚，直至兩月前男友再求婚，終獲嘉綺答應共諧連理，之後嘉綺在facebook邀請親友們參加婚禮，並幸福留言道：「我們結婚了！」 嘉綺筵開40席 嘉綺與黃麟書已決定下月28日在台北舉行婚禮，屆時將於寒舍艾美酒店筵開40席，估計婚宴約花掉百萬港元。婚禮當日嘉綺會穿上C.HWEDDING為她度身設計的3件婚紗和禮服，婚宴場地則依照她個人喜愛，佈置以淡雅簡單為主。 想不到嘉綺舉行婚禮當日，竟然撞正36歲的李玟（CoCo）舉行婚宴。李玟的未婚夫Bruce來頭不小，今年53歲Bruce是加拿大籍，曾離過婚，還有兩個女兒，現任職香港利豐集團總裁兼9家公司的董事，他長駐在香港總部。Bruce在台北又開設瑜伽中心，於美國也有許多物業，估計身家有數億美元。 李玟花費千萬 Bruce與CoCo拍拖8年終決定拉埋天窗，於下月27日在香港環球貿易廣場100樓舉行婚禮，翌日（28日）再包下邵氏影城舉行婚宴，並安排親友入住六星級麗嘉酒店，有傳婚宴斥資逾千萬元，而美國名嘴奧花雲費（OprahWinfrey）和成龍都是座上客。 撰文：葉雪
20110922-119,20110922,119,話你知：麻煩事件簿,話你知：麻煩事件簿 傅穎昨天在微博寫悔過書，自認白癡不識時務，其實她出道至今確實惹來不少是非。 數臭舊愛 傅穎與羅仲謙甩拖，去年底她公開大數謙仔花心冇句真，讓她受到很大傷害，上月更自揭遭謙仔打傷，來個玉石俱焚。 唱衰公司 傅穎忽然擅自爆被同公司的羅仲謙虐打，搞到星皓陣腳大亂雪藏她。09年她自爆發律師信給舊公司金牌解約，哭訴自己「食緊穀種」，令金牌急急澄清。 出書爆料 09年出書自爆在圈中遇愛情騙子，惹來連番揣測，據知當時矛頭直指金牌太子鄭中基。 港女上身 傅穎早前在無綫談擇偶條件，表示要月入十萬才考慮。片段在網上熱傳，拜金港女上身的她被網民插爆。 麻煩住客 08年自爆寓所門外有竊聽者，保安指她作料連累至被炒。09年傅穎被投訴在單位製造噪音，去年尾她又聲稱懷疑有偷窺狂破壞其睡房玻璃窗（圖）而報警，認真多事。 資料來源：《蘋果》資料室
20110922-120,20110922,120,話你知：身家億萬年賺五千萬,"話你知：身家億萬年賺五千萬 內地一線小生黃曉明事業如日中天，去年他的片酬已達400萬人仔一部，今年5月他在《福布斯》（Forbes）中文版名人榜排11位，去年收入逾5,135萬，估計身家達幾億。他理財有道，09年看好公司華誼兄弟前景，入了180萬股，當時賬面已值1.27億元。他愛儲名車，至今已擁超過六部，包括平治和寶馬等，他上月被目睹在北京駕駛最新購入的白色林寶堅尼跑車，價值500萬人民幣。"
20110922-121,20110922,121,柯震東劈腿有理,柯震東劈腿有理 憑台灣電影《那些年，我們一起追的女孩》走紅的男主角柯震東，近日多批情慾短片和淫照先後網上瘋傳，最近又爆出他曾背女友黃慶宜（Cherry）追其好姊妹孫尤安，還在夜店一晚三女，三角關係複雜。 「這是我習慣」 20歲的柯震東曾力追33D的孫尤安，二人曾被發現在夜店熱舞和擁抱，對此柯震東說：「這是我平常交友習慣，我跟她是好友。」孫尤安則說：「朋友之間抱一下也沒甚麼吧！擁抱一下說再見是禮貌！」有指柯震東跟Cherry分手後，孫尤安曾反對二人復合，並說：「這件事對我朋友造成很大影響，我絕對反對他們繼續在一起。」 撰文：林妃
20110922-122,20110922,122,馮仁昭四圍超：張可頤少少信心爭視后 - 馮仁昭,馮仁昭四圍超：張可頤少少信心爭視后 - 馮仁昭 張可頤噚日喺商台宣傳無台慶劇《法證先鋒3》，可頤好坦白話梗係有信心憑呢套劇攞視后，但係提到佢唔係親生女？可頤話：「唔係，我當年攞都唔係，總有例外嘅，都有啲啲機會嘅。」 可頤又話知道今年Laughing哥好勁，但就聽講結局嗰集用微波爐可以拆解到炸彈，感覺有啲牽強，佢都想知係咪真喎。
20110922-123,20110922,123,《白蛇傳說》釜山參展,《白蛇傳說》釜山參展 林峯和黃聖依首次合拍新片《白蛇傳說》，兩人分別演許仙和白蛇，日前兩人受訪，林峯坦言最初知道要飾演許仙時，曾感到有點害怕，因為他不能接受許仙這個小男人，後來程小東導演跟他講解這版本的許仙會較陽剛，林峯認為這才符合現代的愛情觀。 林峯談情傷頸 黃聖依踢爆林峯拍談情戲chok傷頸，對此林峯說：「現場有好多工作人員，我哋要好浪漫，當身邊所有人透明，又要顧住部機，所以就整親。」聖依在片中要跟李連杰拍打戲，拍攝前花了兩個月學打。另外，《白》片昨在北京搞首映，投資者楊子宣佈該片會在今年釜山電影節參展放映，對於屆時會否撐場，李連杰說未決定：「我一向不去影展，上回威尼斯影展是因為楊子送我一個百萬的觀音像我才去。」 採訪、攝影：黃曉妍、陶然婷
20110922-124,20110922,124,馮仁昭四圍超：陳坤行頭太勁俾女圍 - 馮仁昭,馮仁昭四圍超：陳坤行頭太勁俾女圍 - 馮仁昭 徐克執導嘅3D武俠新作《龍門飛甲》會喺聖誕檔期上映，家做緊後期製作，有份演出包括有李連杰、周迅、李宇春同桂綸鎂等等。而陳坤就扮演反派角色「雨化田」。陳坤啲戲服好多好靚，陳坤搞笑咁話：「因為造型又多又靚，所以經常被同場嘅女演員集體圍攻，認為我行頭咁多，一個人都可以做一場時裝騷。」
20110922-125,20110922,125,馮仁昭四圍超：Swing演唱會另類宣傳 - 馮仁昭,馮仁昭四圍超：Swing演唱會另類宣傳 - 馮仁昭 組合Swing噚日喺商台做訪問，Jerald自爆話前日同陳奕迅（Eason）一齊幫個節目整蠱Eric，Eason同Eric講話Swing嚟緊嘅紅館演唱會冇咗，因為贊助商揀個期俾佢，覺得Swing唔夠紅，搞到Eric當場晴天霹靂，之後Jerald仲同Eason扮嗌交同打架，事後Eric話冇嬲，仲好開心係假㖭，因為聽到演唱會冇咗嗰刻真係好沮喪。
20110922-126,20110922,126,千千疑戀頭號粉絲,千千疑戀頭號粉絲 紅爆網絡的劉家昌之子劉子千，早前有傳被父親棒打駌鴦，以百萬港元飛甩舊愛比堅尼小姐林亞霖，千千於7月又被爆在日本收埋日籍新女友，但昨日本報獲讀者報料，指千千其實一直有女友，該女生更是其頭號粉絲。 同度低潮 讀者指千千的女友叫張雅琪，今年25歲，就讀台灣德霖技術學校，是半工讀生。她是千千的頭號粉絲，每逢千千出席活動她例必到場支持，與千千公司的同事亦有聯絡。雅琪伴在千千身邊度過幾次低潮，令千千十分感動。早前雅琪25歲生日，有指千千曾帶母親甄珍往雅琪工作的地方見她。千千與雅琪最近更在facebook打情罵俏，千千又公然向她示愛，說永遠愛她。 撰文：林妃
20110922-127,20110922,127,馮仁昭四圍超：亞姐200萬樓引索女 - 馮仁昭,馮仁昭四圍超：亞姐200萬樓引索女 - 馮仁昭 今年嘅《2011亞洲小姐競選》家開始接受靚女報名，亞視高級副總裁葉家寶噚日喺大埔總台嘅記者會宣佈，今屆亞姐嘅獎品會加碼，計劃送出一間約值超過200萬人民幣嘅內地樓作為獎品，果然出手夠闊綽，吸引啲索女快啲嚟參加。07年亞姐冠軍張家瑩聽到即刻問有冇后冠先，佢話：「雖然我覺得用樓做獎品實際啲，后冠有紀念價值點都要保留。」
20110922-128,20110922,128,馮仁昭四圍超：胡美儀出書講心理創傷 - 馮仁昭,馮仁昭四圍超：胡美儀出書講心理創傷 - 馮仁昭 胡美儀噚日喺港台接受訪問，佢話下年會推出個人大碟，演出《情話紫釵》，所以今年會好忙，同時間佢同一位心理學家合作寫書，明年會面世。 胡美儀話寫書係因為人生裏面有好多經驗同過程，好多人都問佢點解唔出書，所以佢同心理學家合作，將佢過往嘅傷痛經歷講出嚟，佢仲話舊年年中開始已經睇嗰個心理醫生。
20110922-129,20110922,129,馮仁昭四圍超：林珊珊代女澄清有着衫 - 馮仁昭,馮仁昭四圍超：林珊珊代女澄清有着衫 - 馮仁昭 林珊珊（左）和劉天蘭（右）噚日接受吳綺莉（中）主持嘅《女人有話兒》節目訪問，三人之前雖然唔認識，但係現場就大講湊女經，吳綺莉仲對劉天蘭軟弱嘅一面好有興趣㖭。早前林珊珊個細女俾人話撬走黃泆潼個24味男友阿肥，兩人嘅親密照仲俾人放上網，林珊珊噚日就話有同個女傾過，今次係人為疏忽，佢以為只得朋友見到，但其實街外人都睇到，珊珊都有睇過，亦代女澄清個女係有着衫影相，同時亦否認傳聞話林海峰唔畀大家嘅女兒一齊玩。
20110922-130,20110922,130,關仁隱事：小黃洗頭亂發老脾 - 關仁,關仁隱事：小黃洗頭亂發老脾 - 關仁 富豪小黃以前好鍾意去中環某名牌髮型屋剪頭髮，每次去到佢都要個髮型師阿仔只服侍佢一個人，搞成個幾兩粒鐘都係收佢千幾蚊好唔化算，加上佢脾氣古怪唔易服侍，阿仔其實唔多願做佢生意。 事關佢試過幾次無厘頭發脾氣鬧啲洗頭妹，鬧到人哋忍唔住喊晒，有次小黃洗頭時，忽然彈起身手指指鬧個洗頭妹，因為佢入去洗頭房時個地下好污糟，但呢啲事又實在唔關呢個妹妹事，再加上佢突然彈起身，洗頭妹唔小心整濕佢背脊，令小黃更加嬲，全場都知佢大發爛渣，大家都怕鬼咗佢，後來阿仔要加佢價先肯同佢剪頭髮，佢覺得唔合理就轉咗場，成班員工都話要劏雞還神！ 撰文：關仁
20110922-131,20110922,131,馮仁昭四圍超：鄧麗欣着不文Tee被轟 - 馮仁昭,馮仁昭四圍超：鄧麗欣着不文Tee被轟 - 馮仁昭 鄧麗欣（Stephy）出道以來都賣清純玉女形象，不過日前佢被網友搵到佢上節目嗰時竟然着住件不文tee。 呢件衫原本係兩隻好得意、好可愛嘅熊仔，但係原來兩隻熊仔嘅下身竟然另有乾坤，當中更疑似係性器官嘅造型，即時令Stephy嘅清純形象盡失，最慘係連網友都暗寸Stephy好邪惡，真係似乎有教壞細路之嫌。
20110922-132,20110922,132,蘋影話：《最爆伴娘團》意識不良中女電影,蘋影話：《最爆伴娘團》意識不良中女電影 被寵壞了的美國人似乎永不知悔改，《最爆伴娘團》的劇本其實寫得精采，不然對安娜這個角色的行為也不會這麼反感，好像看到那些叫做港女的物體活現在銀幕上，她的小家子器，又遇人不淑，既教人氣得跳腳也令人充滿同情。雖然對白頗多節奏也不算快，有些段落的設計卻頗具心思，例如她立意要引起那個明戀她的警察的注意也算夠瘋狂。有些場面的對白也十分抵死過癮。可惜的是這是一個不負責任的結局。這類處境通常總會有個happyending，安娜最後能夠敗部復活，好像是靠自己的努力爭取，其實就像影片開始一切惡運都找上她，結局同樣也是一切好運都來到她的家門。喜歡她的男警原諒她；被她視為私產的好友也婚前憂鬱，要她來發揮老朋友的威力去解救；被她嫉妒的海倫原來婚姻生活不美滿，丈夫時常不在家，於是電影的結局似乎在說這一切的圓滿結局，只是人家比她更差，更敗女，有點踩着別人的頭往上走。我只是個中男不知中女的思想，如果你覺得生活掉進谷底看看這部電影也不壞，卻千萬要明白人生是要靠自己的，不是靠空虛的自我安慰。 撰文：張仰止
