key,date,article_daily_id,title,text
20110922-0,20110922,0,TVB告急李澤楷、王維基挖空六嬸,TVB告急 李澤楷、王維基挖空六嬸 【本報訊】本港明年將增加三家免費電視台，其中由「電訊魔童」王維基創辦的城市電訊，以及「小小超」李澤楷旗下的電訊盈科已積極備戰，近日更以銀彈攻勢，全力向「六嬸」方逸華把持大局的無綫大量挖角。王維基計劃以高一倍人工挖走無綫150人；李澤楷早前亦以加薪最多一倍半，成功搶走無綫綜藝科約30名幕後精英，百億電視王國面臨被淘空。 記者：楊潔雯、何慧斯 城市電訊、電訊盈科及有線電視申請免費電視牌照，廣管局已完成審批，商務及經濟發展局最快一個月內提交行政會議拍板。明年本港將增加三間免費電視台，與無綫及亞視競爭。 挖走150人戲劇組重災區 城市電訊創辦人兼主席王維基率先掀起場電視大戰。據了解，王初步計劃向無綫挖走150人，其中一個重災區是戲劇組，目前已有50人被城電以一倍人工以上挖走。戲劇組分製作和創作兩大部門，創作部包括編審和編劇有30人已遞信，製作部包括監製、導演和助導有20人呈辭。由於無綫薪金太低，一般初級編劇人工不足一萬，編審不足二萬，所以當其他機構高薪挖角，員工都樂意跳槽。 為進一步淘空無綫，王維基近期動作多多，除銀彈攻勢，更禮賢下士求合作，不斷約見無綫監製、導演、編審和小生花旦，據悉馬德鐘、佘詩曼、駱應鈞和林保怡代表都與他先後見面。王維基告訴他們，城電電視開台後，希望每年自製260小時劇集，需大量台前幕後人手，他歡迎即將與無綫約滿的人才與城電合作。據知接觸過的演員明年將為該台拍劇，今年監製無綫劇集《怒火街頭》的唐基明也會為該台製作一齣新劇，男主角已接觸馬德鐘，預計明年3月開拍。 除城電大量挖角，早前李澤楷也先行高薪挖走無綫綜藝科製作總監何麗全擔任電訊盈科電視及新媒體首席總裁及製作部總經理。何麗全過檔後，即以加薪100%至150％以上向舊公司綜藝科挖走資深幕後製作人員約30人，成為無綫另一重災區。 無綫高層近日為挖角潮開大會商討對策，有高層提出向值得挽留的員工加薪三至七成，但大部份員工去意已決。面對內憂外患的無綫正處於捱打狀態，不少小生、花旦如黃宗澤、胡杏兒和陳豪約滿後都想去內地拍劇謀出路，因內地拍劇一集酬金就相等於在無綫拍10集的酬勞。 無綫：早已開編劇班培訓 記者昨致電向王維基求證是否向無綫大挖角，他說：「我諗我幫唔到你，家開緊會，唔方便做回應。」城電公關發言人表示不回應坊間傳聞。 無綫外事部副總監曾醒明對員工大量流失回應說：「整個戲劇發展分部有280幾人，其中編劇佔80幾人，其他係非戲劇的資料搜集同編寫員，今次比較走得多啲嘅係編劇和資料搜集員，直到今日為止大約有10個左右離開。」他承認，無綫台前幕後肯定是其他電視台挖角對象，但公司早已未雨綢繆，早前開辦的編劇班巳培訓十多人。 曾醒明認為挖角潮對無綫運作影響不大，作為一間大機構，有人辭職很平常。他稱，公司7月時已按各部門及員工表現調整人工，編劇和助理編導加幅較高，加薪最多四成以上。他強調，今次流失員工與無綫前副創作主任張華標上次離去相比，張華標影響大很多，當時近20人跟他一起離職，轉投黎智英旗下壹電視，但今年不少編劇已過檔城電，張華標本人原也是王維基挖角對象，無綫早前也想請他回巢，但因黎智英挽留，他已婉拒王維基好意。
20110922-1,20110922,1,法律界意見威迫簽約可申請無效,法律界意見 威迫簽約可申請無效 有律師指出，任何人被威迫而簽下買賣物業的協議備忘，情況跟阿婆被呃簽文件做按揭相似，也是以不正當手段進行交易，可經法律途徑申請協議備忘無效。就算簽下協議備忘，也未算完成交易，業權仍在賣家身上。 未簽轉讓契即未轉業主 律師謝連豐解釋，按一般買賣樓宇程序，買賣雙方簽署協議備忘或臨時買賣合約後，買家便支付訂金，雙方再定出交易完成的日子。其間，買家可以查契。待買家繳付尾數後，雙方便簽署轉讓契，這時才算正式完成交易，買家成為新業主。 他指出，以本案而言，事主僅簽下買賣物業的協議備忘，即使「買家」已向土地註冊處登記，真正業主仍是事主，「買家」尚未成為業權擁有人，情況等如「釘契」，只影響事主將業物放售或申請按揭。 謝續解釋，原告需證明自己當時受到威迫，感覺驚慌及安全受威脅下被迫簽下文件，根本無意將物業出售，按法律原則，可要求法庭宣告有關文件無效。 《蘋果》記者
20110922-2,20110922,2,校方延誤家長被瞞兩周,校方延誤 家長被瞞兩周 【本報訊】本案被揭發的過程幾經轉折，校方得悉事件後，無即時通知女生家長。女生家長終在案發14日後，才得知事件報警。 案發次日即5月17日，女生將手淫一事告訴同學，同學則轉告私人補習老師，由補習老師再通知涉案中學女校長及社工。校長召開教師會議，至5月23日才召見被告及女生，兩人均否認事件。同月27日，校長再召見被告，他當時只承認他搞師生戀，校方只發警告信，未有通知女生家人。 3日後，被告向校長辭職，承認曾親吻、撫摸及叫女生幫他解決生理需要。社工於同日約見女生，女生承認曾到被告家。校方將事件通知女生家長，家長於是報警，當時已是案發14日後。
20110922-3,20110922,3,員工爆料佢想點都得呃人經理　滙豐有讚無彈,員工爆料佢想點都得 呃人經理　滙豐有讚無彈 【記者李凱琳報道】本報揭發滙豐銀行經理，欺騙僅得30萬積蓄的餐廳女工，購買總值90萬投資計劃。滙豐前日已全數退還30萬元，但以內部調查未完，未有向女士道歉和處分涉事經理。有滙豐職員則爆料指，呃人的姓薛經理曾代表銀行奪得多項投資比賽冠軍，令他仍然扶搖直上。 女工終取回30萬 女工王姐表示，最近有家庭成員出現突發事故，急需現金周轉，日前接到滙豐通知，願意取消其投資計劃退還全數30萬，但滙豐職員要求她簽署一份同意書，指這次純屬酌情安排，不代表銀行認錯；而保單滾存一年賺得的二萬多元更未能發還，「佢話扣除手續費，筆數仲少過30萬，佢哋（滙豐）銀行女職員又爆料，指姓薛經理曾多次因違規銷售被投訴，但由於他奪得多項投資比賽冠軍，包括香港財務策劃師學會的2010年香港最佳財務策劃員、銀行界最佳財務策劃員，故深受高層賞識，「喺比賽勝出嘅同事，都可以同公司高層食飯，飯局中會被問及想做乜職位，基本上佢想點都得。」 手下13人「跑數」 薛在09年8月加入滙豐，在淘大分行任財富管理經理，而他勝出比賽後，即獲晉升至高級財富管理經理，負責九龍灣、樂富和黃大仙分行行政工作，手下更有13名下屬助其跑數。 曾與薛共事的滙豐一名男職員指出，按正常情況，原本是財富管理經理的薛，最多只能升至卓越理財客戶經理，「卓越理財客戶經理都要跑數，但佢家就唔使，相信佢之前咁不擇手段，都係為咗今日。」 他又曾目擊薛擅自將客人20萬一次性投資基金，轉至須供款三年、每年供款20萬的60萬人壽投資相連計劃，「不過我哋係局內人，好難開聲叫個客投訴。」事後客人雖然感到被騙，但為怕麻煩繼續供款。 滙豐接受本報查詢時，以未有調查結果為由不作評論，更拒絕披露該名姓薛經理曾否被投訴違規。
20110922-4,20110922,4,聽爽報　睇Video　你爽咗未,"聽爽報　睇Video　你爽咗未 使用爽報 手機開啟爽報主畫面 在手機中輸入m.sharpdaily.hk，首頁顯示的耳筒按鈕為[聲音新聞]、電視按鈕為[動新聞] 聲音新聞 按[耳筒] 連續收聽 1.按[＞]，聲音新聞將依要聞、娛樂、爽最、國際等次序，自動播放 2.為免連續收聽因手機進入鎖定狀態而中斷，可先進入手機設定，按「一般」，然後關上手機自動鎖定功能 3.播放一旦中斷，可按[＞]或欲收聽新聞的圖片，以恢復自動播放 單獨收聽一則新聞 1.按左邊分類進入希望收聽的新聞分類 2.按相片上之[耳筒]收聽該則新聞;或按標題進入文章頁,再按[＞]播放聲音新聞 3.如需收聽前一則或後一則新聞，可按[＜＜]或[＞＞] 動新聞 方法一 1.按[電視] 2.按影片縮圖，即可開始收看動新聞影片 3.可選取是否自動播放 方法二 1.按[耳筒] 2.按標題進入文章頁 3.按影片縮圖，即可開始收看動新聞影片 *如要在手機播放影片，手機需支援串流功能。 搜尋 1.在[動新聞]或[聲音新聞]頂部的搜尋框中，輸入要搜尋的新聞標題，或標題的部份用字，即會列出當天涉及有關標題用字的所有文章 疑難排解 Android手機無法收聽聲音新聞？ 要使用Android手機收聽《爽報》的聲音新聞： ‧手機需為Android作業系統2.2或以上。 ‧先透過AndroidMarket安裝最新版本AdobeFlashPlayer（可於AndroidMarket搜尋關鍵字""AdobeFlashPlayer""） Android手機已安裝AdobeFlashPlayer，卻仍然無法收聽聲音新聞？ 請先開啟瀏覽器的外掛程式(plugin)功能，以下是常用瀏覽器的設定方法： ‧預設瀏覽器：請按手機上的menu鍵，選擇「更多」>「設定」，將「進階設定」內的「啟用外掛程式」的選項改為「永遠開啟」 ‧DolphinBrowser：請按手機上的menu鍵，選擇「更多」>「設定」>「頁面內容設定」，將「啟用外掛程式」的選項改為「總是啟動」 ‧SkyfireBrowser：請按網址列下方的第六個圖示，選擇「Settings」>「BrowserSettings」，將「EnablePlugins」的選項改為「AlwaysOn」 ‧OperaBrowser：請按右下角的紅色O字標誌，選擇「設定」>「進階(A)」，將「AdobeFlash」的選項改為「已啟用」 QR碼掃描軟件 ‧iOS:i-nigma,RedLaser,QRScanner,QRReaderforiPhone ‧Android:i-nigma,QRDroid,QuickMarkQRCode 使用說明  http://m.sharpdaily.hk/userguide.php "
20110922-5,20110922,5,與金像大導手牽手示威港女赴日救海豚,與金像大導手牽手示威 港女赴日救海豚 【本報訊】奧斯卡最佳紀錄片《海豚灣》呈現一幕幕血腥殘害海豚的真相，「不問世事」的港女陳廸茵（Jess）看過後，去年跑到東京示威，本月初更與親弟楊廸威（Zachary）勇闖和歌山縣太地町，即海豚灣所在地，冒着12號颱風危險，與世界各地保育人士，手牽手為海豚默哀。回港後二人發起「保育海豚Tee」行動，呼籲港人齊向捕獵和屠殺海豚說不，並還海洋公園海豚自由。　記者：袁慧妍 親姊弟Jess與Zachary不同姓，因為弟弟幼時過契阿姨。這兩個「香港代表」，本月初與《海豚灣》金像導演RicO'Barry及世界各地保育人士，穿上「DolphinProjectCrew」T恤，一行廿多人到日本和歌山縣太地町和平示威。 當地右翼分子認為捕獵海豚是日本傳統，不論是否有違道德，都不容外人插手，因此不斷「狙擊」Jess他們這些外地保育人士。即使Jess只是在海邊為海豚默哀，右翼分子也在旁邊喧嘩吵鬧，騷擾他們的行動。Jess說，幸好當地警方介入保護，他們的行動才得以順利進行。 Jess與Zachary說，此行印象最深刻是被困海灣附近魚排的受訓海豚，在颱風下不斷掙扎，想逃離大風大浪的海面，但當地人寧願牠們掙扎至死，都不願放生。兩姊弟奮不顧身，到魚排附近拍攝海豚慘況。Jess說︰「如果海豚唔死，就可以賣出去做表演，每條海豚賣12萬至15萬美金；如果死咗，就劏咗佢賣佢啲肉。」 如《海豚灣》導演RicO'Barry所言，海豚的笑容是世上最大的謊言。回港後，Zachary發起「一星期穿一次保育海豚Tee」行動，「好似記者咁，你着件『我不是黑影』Tee，行過啲人就會望吓、了解吓發生咩事，我希望我哋着住DolphinProject件Tee，同樣引起市民關注」，詳情可電郵jesstychan@gmail.com查詢。 同道人擬「帶團」到太地町施壓 Jess去年趁10月14日全球拯救日本海豚日，在港示威。有心人黃錫佑（Fritz）看過報章報道後，主動聯絡Jess，二人本年初前往太地町了解海豚情況。Fritz向記者介紹當時拍攝的照片，拍得漁船圍捕海豚後，悄悄運入帆布遮掩的海灣及屠房，怒斥「如果係咁光明正大，使乜遮？」他下月中會親自「帶團」到太地町，介紹當地美景之餘，更講述海豚慘況，希望把太地町打造成「旅遊景點」，「越多人去嗰度，就越可以向漁民施壓。」
20110922-6,20110922,6,業界揭露借名「培訓」賺到盡,業界揭露 借名「培訓」賺到盡 有業內人士透露，部份本港大型僱傭公司會在菲律賓及印尼等地自設培訓基地，美其名確保傭工服務符合港人期望，實際上是搞一條龍服務賺到盡，待外傭來港後始追討費用，菲國政府難以插手。 業內人士說：「家中介公司普遍向每個準來港傭工，索取港幣萬二至二萬零蚊『手續費』。本來菲律賓政府係禁止中介公司苛索金錢，但由於菲傭係嚟到香港，先至喺港方僱傭中心監管下追返相關費用，菲政府好難插手。表面上，港方唔會過問外地中介公司收費幾多，而傭工還錢亦好少直接還畀港方，但實際上港菲根本係一條龍。」 盛傳賣債給港財務公司 香港僱傭代理協會主席張結民堅稱大部份僱傭中心是與外地中介公司分開經營。但他承認，業內盛傳外地中介公司會將傭工欠債賣斷給香港財務公司。「坦白講，傭工唔窮都唔嚟香港打工，欠債十居其九；反正香港法例健全，僱主毋須太擔心被傭工欠債拖累。」 《蘋果》記者
20110922-7,20110922,7,雙氧水面膜全港回收,雙氧水面膜全港回收 【本報訊】台灣當局早前驗出韓國化妝品名牌Tonymoly一款面膜含有當地禁用的雙氧水，該款面膜在港亦有售，有個人護理用品店已接獲供應商通知回收。海關昨表示，本港規定化妝品或護膚品含雙氧水的安全限量為4%，已派員到市面嘗試購買該產品化驗。 台灣新北市衞生局驗出含2%雙氧水的產品為Tonymoly的Magicwhitemassagepack（神奇番茄美白按摩面膜）。同款面膜在本港屈臣氏及莎莎等店舖有售。屈臣氏表示，已接獲供應商通知會回收該款面膜；莎莎表示，昨日自願將該款面膜下架，保障消費者安全。 本港安全限量4%較寬鬆 海關表示，在測試化妝品或護膚品方面，海關是參考國際採用的認可安全指引，如歐盟議會指令。根據該指令，化妝品或護膚品的雙氧水安全限量為4%。海關已派員到市面巡查，嘗試購買樣本交由政府化驗所化驗。若發現產品有問題，會採取跟進行動。 城市大學生物及化學系副教授林漢華表示，台灣化妝品的化學物質含量標準一向較嚴格，若本港將護膚品的雙氧水含量上限訂為4%屬較為寬鬆。一般用來洗傷口或消毒的藥用雙氧水，含量只有3%，並只用來塗抹；化裝品及護膚品是長時間用於皮膚，若雙氧水含量多會令皮膚痕癢，故標準應較嚴格。 他續指，用來做實驗的雙氧水含量為10%，不小心接觸會令皮膚痕癢，「忍唔住要即刻洗手」。工業用的雙氧水含量為37%，接觸後會感到痛楚，「皮膚會即刻白咗，好似白雲鳳爪嘅白色」，脫皮後沒大礙，一般不會有長遠後遺症。
20110922-8,20110922,8,就業交津72地點派表格,就業交津72地點派表格 【本報訊】全港性「鼓勵就業交通津貼計劃」下月3日起接受申請，市民即日起可到勞工處各就業中心等72個地點索取表格，首批合資格人士最快今年底獲全額600元或半額300元津貼；勞工及福利局局長張建宗承諾3至6個月後作檢討，並研究調整津貼額和入息上限。 最快今年底發放 張建宗昨天巡視勞工處新設於尖沙嘴的「鼓勵就業交通津貼科」後表示，因應最低工資實施，現時約40.2萬人合資格申請交津，較政府原先估計減少3.4萬；他指工資上調的影響仍未全面反映，加上通脹惡化，承諾提早半年在交津計劃實施3至6個月後作中期檢討。除審視申請程序，也會研究交津額和入息上限是否有上調空間，協助更多基層勞工紓困。 合資格人士可追溯申領過去6至12個月的津貼；如下月申請，則可追溯今年4至9月的津貼。每月工作逾72小時可獲600元津貼；每月工時介乎36至72小時者則獲300元。申請人需經家庭入息及資產審查；以二人家庭為例，住戶入息限額為1.2萬元，資產上限為6萬元。 首批津貼最快今年底發放。勞工處處長卓永興稱會重點抽查入息和資產接近上限的申請，抽樣比率約3%。市民即日起也可於民政事務總署各諮詢服務中心、社會福利署各社會保障辦事處索取申請表格，亦可在勞工處網頁下載。
20110922-9,20110922,9,眼醫涉違規用於黃斑病變癌藥疑致盲,"眼醫涉違規用於黃斑病變 癌藥疑致盲 【本報訊】醫院管理局未決定是否使用治癌藥「癌思停」（Avastin）治療濕性老年黃斑病變，最近就爆出本港首宗懷疑因該藥造成一名七旬老翁致盲的個案。西醫工會會長楊超發建議本港應重新審視該藥治療黃斑病變的安全性，並要有更多研究證實其有關效用，保障病人安全。 香港視網膜病變協會主席曾建平透露，早前接獲黃斑病變的病人求助，指數月前於一間眼科醫生診所，接受右眼注射「癌思停」療程，事後眼球即時充血並感劇痛，他引述病人指「事發當日已經係第二、第三次治療，眼痛後，醫生先講係腸癌藥，未註冊用於黃斑病變，又強調眼痛跟藥物無關」。 由於病人無獲主診醫生跟進，感到十分無奈，遂向協會求助。病人正研究透過法律途徑追究，並於今日召開記者會。 曾建平指，該老翁個案會視為藥物不良反應報告，呈報衞生署。美國陸續有人使用「癌思停」後失明，甚至變植物人，質疑該藥的安全性，估計上述個案只屬冰山一角。 醫生：失明或因病情惡化 治療濕性老年黃斑病變的註冊藥物「樂舒晴」（Lucentis）費用昂貴，按本港病人使用份量，每針需八、九千元，近年有研究指治癌藥癌思停也有療效，5,000元一針可分十人使用，每人每次只需500元，故近年外國及本港也有私家眼科醫生應用。 但他認為，使用癌思婷時要用針筒抽取部份使用，增加病人感染風險，「呢隻藥要無菌、真空處理，唔可能分裝使用，所以唔適宜用嚟醫黃斑病變」。 威院眼科及視覺科學系顧問醫生李佑榮估計，病人並非因注射癌思停而失明，是因黃斑病變病情惡化，視網膜底血管增生及出血，血液會再流向玻璃體，令玻璃體呈漆黑一片而失明。外國數據顯示，癌思停引致的併發主要為發炎，不會因該藥直接致盲。除非打針時針口接觸血管，或將一樽癌思停分為很多針，為不同病人注射時，清潔及消毒不當，才有可能令人變盲，但機會很微。"
20110922-10,20110922,10,警清晨拘七人　即解控擾亂替補論壇長毛拒認罪高呼「政治檢控可恥」,警清晨拘七人　即解控擾亂替補論壇 長毛拒認罪高呼「政治檢控可恥」 【本報訊】本月初替補機制論壇正反雙方發生推撞，警方昨清晨突然大舉拘捕七人，其中六人，包括「長毛」梁國雄、人網主持黃洋達及多名學聯成員被控以「擾亂秩序」，即捕即提訊。長毛在庭上高呼「政治檢控可恥！」學聯成員質疑警方於替補機制諮詢完結前拘捕反對者，企圖製造白色恐怖。 記者：白琳、戴國輝 社民連梁國雄、姜靈彰、容偉棠；學聯秘書長陳倩瑩、常委會主席鄧建華，成員黃永志、社運人士黃洋達七人，昨晨七時各自於家中被捕，再由警車押解往尖沙嘴警署。除了姜靈彰外，其餘六人均即日被押到九龍城法院提訊。10多名社民連趕到警署及庭外聲援。 控六人下月14預審 六名被告的兩項控罪，分別是於公眾聚集中作出擾亂秩序行為，及在公眾地方作出擾亂秩序行為。前者指六人「作出擾亂秩序行為」阻止論壇進行；後者指他們「在公眾地方喧嘩」或使用「恐嚇性、粗言穢語或侮辱性的語言」，「意圖激使他人破壞社會安寧」。長毛被加控一項刑毀罪，控方指他涉毀壞科學館玻璃門的門柄。長毛在庭上不認罪，更指捍衛補選權利的行為無罪，高呼：「替補機制可恥，假諮詢可恥，政治檢控可恥！」控方將傳召4名證人，亦會播出錄影片段協助舉證，案件押後至下月14日進行預審，各人准現金500元保釋候審。 長毛在提訊後向傳媒表示，替補機制剝奪300萬選民的被選權，「如果我唔出聲，係對唔住香港人。就算坐監，我都唔會後悔。」其助理姜靈彰當日在論壇場外向政制及內地事務局局長林瑞麟擲狗餅，昨日被控普通襲擊，但未有提訊，保釋候查。 黃洋達與被捕學聯成員陳倩瑩均向本報表示，在論壇沒有與陌生人交談，遑論使用粗言穢語。黃憶述，事前成功申請出席論壇，大批市民於論壇進行期間衝入會場，林瑞麟急急離席，黃即上台發言，「我係幫林公公重整會議秩序。我同大家講，家可以開屬於人民嘅諮詢會。」 斥警製造白色恐怖 他說會想法子傳召林瑞麟出庭作供，解釋論壇混亂責任誰屬，「做一個惹起公憤嘅假諮詢就無罪，揭破謊言就有罪。呢件事最侵害嘅唔係社會安寧，而係林公公面子。」陳倩瑩痛斥警務處長曾偉雄製造白色恐怖，於替補機制諮詢期完結前，協助政府打壓反對聲音。 衝擊替補機制被告資料一覽 梁國雄（55歲） 立法會議員 一項刑事毀壞，一項在公眾聚集中作出擾亂秩序行為，一項在公眾地方作出擾亂秩序行為 黃洋達（32歲） 《香港人網》主持、小說《金錢師》作者 一項在公眾聚集中作出擾亂秩序行為，一項在公眾地方作出擾亂秩序行為 鄧建華（22歲） 嶺南大學四年級生、學聯常委會主席 一項在公眾聚集中作出擾亂秩序行為，一項在公眾地方作出擾亂秩序行為 容偉棠（59歲） 機械技工、社民連成員 一項在公眾聚集中作出擾亂秩序行為，一項在公眾地方作出擾亂秩序行為 陳倩瑩（22歲） 學生、學聯秘書長 一項在公眾聚集中作出擾亂秩序行為，一項在公眾地方作出擾亂秩序行為 永志（24歲） 社區幹事、政策研究員 一項在公眾聚集中作出擾亂秩序行為，一項在公眾地方作出擾亂秩序行為 資料來源：控方
20110922-11,20110922,11,團體促踢走無良參展商,團體促踢走無良參展商 【本報訊】勞工組織中國勞動透視早前曾要求珠寶展主辦單位亞洲博聞．拒絕讓拖延賠償工人的公司參展，但無功而還。中國勞動透視指，過往貿發局也曾禁止違反勞工法例的珠寶商參展，認為今次主辦單位也有責任踢走無良參展商。 今次珠寶展以一展兩館模式，分別在亞洲國際博覽館（9月19至23日）及香港會議展覽中心（9月21至25日）舉行，兩家被指苛待工人的珠寶公司均在亞洲國際博覽館設有攤位。《蘋果》記者前日到亞洲國際博覽館展覽內，向環球寶石首飾公司負責人陳孝江，查詢矽肺病工人賠償問題。陳指示記者向其太太詢問。記者向陳太引述在環球寶石首飾公司工作的工人指摘公司工傷賠償仍「未搞掂」，陳太回應：「邊個話未搞掂？」。 陳孝江更向記者說：「唔好搞嘢，做生意㗎。」其間曾大叫「拆佢（攝影記者）菲林。」及後記者再到展場內另一間被指拖延矽肺病工人索償訴訟的「GoodLuckJewelryInternationalLimited」之攤位查詢，對方則以「唔得閒」拒絕接受採訪。 中國勞動透視表示，去年港資企業力奇珠寶因無依內地法院判決賠償工人，被取消參加香港國際珠寶展及瑞士巴塞爾國際鐘表珠寶展資格，當時香港國際珠寶展主辦單位為貿發局。
