key,date,article_daily_id,title,text
20110708-109,20110708,109,馮仁昭四圍超：徐克紐約獲終身成就獎 - 馮仁昭,馮仁昭四圍超：徐克紐約獲終身成就獎 - 馮仁昭 徐克最近獲紐約嘅亞洲電影節頒贈終身成就獎，認真威水，影展仲會幫佢搞個小型回顧影展，包括佢之前嘅作品《狄仁傑之通天帝國》。佢早前接受《華爾街日報》訪問，被問到喺大陸同香港拍戲有乜分別，佢話大陸拍戲好大陣仗，好似佢上一套戲就用咗超過600人，仲唔包括演員在內，佢仲話都唔知點解以前可以用少過60人去拍《黃飛鴻》出嚟。
20110708-110,20110708,110,憶蓮轟紅館批期短,憶蓮轟紅館批期短 林憶蓮前晚到九龍塘擔任藝術展的開幕嘉賓，穿上黑色透視裝出現的憶蓮消瘦不少，她表示有keep住玩瑜伽，又非常注意飲食。 對於其9月個唱的內部認購已爆滿，憶蓮坦言已知道爆滿的消息，但相信加場的可能性不大，因為當日她向紅館申請是十日開四場，但最後紅館只批八日給她開四場，不過因為以憶蓮的一貫作風，單是做幕後和綵排就需要很多時間，所以現在她只會開三場，已覺得不夠時間綵排，她不滿說：「我都要另外搵地方綵排，唔明白紅館點解批八日，就同我預計埋我啲綵排時間，真係唔能夠接受。」 憶蓮自言會盡量還清飛債，也希望自己不會遺漏。是否擔心會有炒飛情況出現，她反問：「香港有咩？有都控制唔到。」 採訪、攝影：李珮洳
20110708-111,20110708,111,網友紛紛爆料《建黨》設虛擬場繼續偷票房,"網友紛紛爆料 《建黨》設虛擬場繼續偷票房 陳可辛執導的電影《武俠》，其票房早前在內地被主旋律電影《建黨偉業》以偷天換日手法盜取，電影公司投訴後情況仍然沒有改善。在電影公司懸賞下，網民舉報有戲院竟設《建》片虛擬場，盜竊票房事件繼續在內地發生。 有宇宙最強甄子丹助陣、陳可辛執導的電影《武俠》本周一率先在內地上映，香港要到本月28日才公映。當晚內地即傳出該片被《建黨偉業》偷票房的消息，有網友在微博上載一張《建》片的戲票，卻用人手塗改成《武》片，連帶時間和影院也經過更改，直接令《武》片票房轉入《建》片。 雖然戲院方面解釋是誤會，《建》片投資商中國電影集團也指事件跟集團無關，但仍未能釋疑。被偷票房的《武》片宣傳總監陸先生在微博懸賞1,000元，呼籲網友舉報有問題戲院，重賞下網友火速行動。 《武》片宣傳無奈 除爆出偷票房的戲院和地方越來越多外，更發現一種全新行騙手法，就是當觀眾購買《武》片戲票時，工作人員連帶發出一張《建》片戲票，《建》片戲票印了放映時間，但其實該時段並非播映《建》片，而是《武》片時段，這個《建》片虛擬場，變相可不經塗改而將票房轉移。 有網友又在微博寫「買晚上7點50分的《武俠》，售票員面不改色改了票，問他為甚麼，他說名字錯了，這是偷票房麼」，這證明投訴跟懸賞緝兇依然於事無補，《武》片宣傳總監在微博上也只能表示無奈，他說：「今早已就昨晚『錯票』一事與影院交涉。答『搞錯了』……今晚繼續『搞錯』……明天呢？」 陳可辛昨在電話說：「都冇話新唔新橋，都係偷，最希望唔係事實。投訴係唔想佢哋咁放肆，都冇得驚喎，呢個明明係唔啱嘅行為仲要驚咁仲有皇法嘅。」撰文：何永寧"
20110708-112,20110708,112,馮仁昭四圍超：靚聲村姑喪攬上海村姑 - 馮仁昭,馮仁昭四圍超：靚聲村姑喪攬上海村姑 - 馮仁昭 蘇格蘭靚聲村姑蘇珊博伊爾（SusanBoyle）終於去咗中國啦！靚聲村姑噚日飛咗去上海準備出席內地版《全英一叮》嘅節目《中國達人秀》，佢仲因為航班延誤，結果冇乜點休息就喺下午急急見記者，好彩見佢都好精神，仲收到有內地版村姑之稱嘅甜菜大媽送嘅中國絲綢服裝，蘇珊就話：「中國擁有悠久的文化，一直希望來到中國，中國人民很熱情。」
20110708-113,20110708,113,Mia再搶傅穎鏡,Mia再搶傅穎鏡 傅穎、o靚模Mia、Hidy和A.lin等昨日在鑽石山宣傳電影《熱浪球愛戰》，吸引不少傅穎fans到場支持，Mia則大騷驕人上圍搶鏡，令主角傅穎不得不再次服輸。 傅穎擺脫AAA Mia自言乃健康性感，問是否刻意性感搶鏡？她說：「唔會，佢哋係主角，我唔會搶到佢哋鏡，呢套戲係講排球，我覺得自己都好健康性感，而且套戲本身都好有教育意義。」 戲中女演員均以三點式示人，Mia自覺不會教壞小朋友，直言會帶兩個囝囝去觀看。傅穎對於再被搶鏡，她表示不介意，並說：「我好明白佢哋要出寫真要爭取曝光率，希望佢哋發展順利，而且佢哋有咁美好身材，我等隆重場合先出嚟唞吓氣就可以，我比較耐熱。」她更直言已脫離當初入行的AAAcup數，已感到滿意。 採訪、攝影：王崇穎
20110708-114,20110708,114,馮仁昭四圍超：阿倫認八公追睇鋒芝變 - 馮仁昭,馮仁昭四圍超：阿倫認八公追睇鋒芝變 - 馮仁昭 譚詠麟噚日喺理工大學出席「2011辛亥革命百周年主題系列活動」，佢話下個月會帶千五個學生返內地交流，問到佢會唔會帶囝囝去，佢就話一定有機會。講到噚日霆鋒同栢芝返港講數，佢就話：「人哋屋企嘅嘢我唔會去理，唔講但我都好想知，我係一個八卦嘅香港人亦都係一個八公。」阿倫仲話知道湖北都係火爐，但唔擔心會中暑，佢話：「噚日小暑我都去咗打golf，可想而知我幾咁健康。」
20110708-115,20110708,115,馮仁昭四圍超：李璨琛醉到客廳周圍屙 - 馮仁昭,馮仁昭四圍超：李璨琛醉到客廳周圍屙 - 馮仁昭 梁漢文（Edmond）同李璨琛日前接受無綫生活台節目《Paco的風花歲月》黃柏高嘅訪問，Paco形容Edmond係多年戰友兼酒腳。 Edmond同李璨琛就因為當年拍《西遊記》認識，叫做識於微時，Edmond仲話老婆見過李璨琛着住高踭鞋去disco㖭；而李璨琛亦自爆酒醉後發生嘅一件瘀事，佢話：「我試過酒醒後見到客廳有灘水，原來係尿嚟o架，我醉到連自己喺廳度小解都完全唔知道。」
20110708-116,20110708,116,林欣彤儲夠首期買樓,林欣彤儲夠首期買樓 林欣彤、苟芸慧和楊秀惠等昨日在將軍澳電視廣播城出席七月星辰生日會，本月21日是林欣彤21歲生日，但她要在工作中度過。她出道至今走勢凌厲，她坦言已儲夠首期，但為免一次清袋，會再儲彈藥才置業。林欣彤日前又與羅家英為動畫《反斗車王2》配音，對白又長又快，令她應接不暇。 苟芸慧於本月11日生日，剛好要赴德國拍節目，故未能與男友羅天宇共度第一個生日，她表示會以工作為重，也沒時間提前慶祝。 採訪、攝影：卓寶花
20110708-117,20110708,117,吳尊施法出蠱惑,吳尊施法出蠱惑 由《葉問》班底製作，葉偉信執導，黃百鳴、吳尊、古天樂和吳京等主演的青春魔幻電影《開心魔法》將開始拍攝。各人造型花了不少心思，其中黃百鳴最突出，他染了一頭金髮，還將頭髮set高，他表示頭一星期並不習慣。 吳尊由於有不少動作場面，又有超能力戲份，故服裝要做些改動和小機關去配合。他表示從未拍過魔法電影，也很開心可以跟葉偉信和黃百鳴合作。飾演反派的吳京有很多打鬥場面，更可能創作新招一新觀眾耳目。撰文：林妃
20110708-118,20110708,118,馮仁昭四圍超：欣宜勸拉姑莫為孫傷心 - 馮仁昭,馮仁昭四圍超：欣宜勸拉姑莫為孫傷心 - 馮仁昭 鄭欣宜噚日同陳嘉桓及杜宇航等喺香港大學出席活動，鋒芝變成為城中熱門話題，講到鋒芝將會爭兩個囝囝嘅撫養權，欣宜話喺網上見到婷婷話拉姑好傷心仲喊㖭，佢都有傳短訊畀婷婷，欣宜話：「希望拉姑唔好太傷心，我之前都唔夠膽騷擾佢哋，我記得細個我同媽咪唔開心時，拉姑都陪住我哋。」問佢會唔會探吓拉姑開解佢？欣宜就話家唔係適合嘅時候。
20110708-119,20110708,119,鼎爺：點我個仔執屎執尿,鼎爺：點我個仔執屎執尿 李泳豪難捨狠心舊愛楊思琦，父親李家鼎連日力撐兒子，對於思琦前晚接受無綫節目《東張西望》訪問，暗指遭豪仔出賣放料，安排記者5月時偷拍她陪豪仔出席生日飯局。李家鼎昨日在電話訪問誓神劈願，爆粗力證囝囝不是放料人，鼎爺說：「如果我個仔放料，我仆街死，我可以百分百證明豪仔冇放料，嗰時佢哋仲未分手。」 思琦與豪仔飼養多頭愛犬，思琦聲稱視愛犬為親生子女，不過她搬走卻沒帶走這班「仔女」，鼎爺說：「佢肯定唔要啲狗，一直以嚟啲狗都係豪仔打理，佢負責執屎執尿，思琦只係同啲狗玩，邊有照顧過。佢梗係想養夠一百隻，玩之嘛，不過我喝住，我同思琦講，你梗冇所謂，我個儍仔幫你照顧啫。」 「要幫佢企返起身」 鼎爺不滿思琦一腳踏兩船，說：「公道自在人心，我成日同豪仔講，佢屈到你咁，將來水落石出佢冇面。」有報道指豪仔曾表示願養女友與新歡暗結的珠胎，鼎爺即說：「如果個肚係拍拖前有咗，家同我個仔拍拖，講得清清楚楚，我會接受，但家事實唔係咁，我接受唔到，但豪仔真係咁做我一定唔高興，心裏都唔舒服。」 鼎爺估計豪仔最少一年才可撫平情傷，他說：「豪仔第一次拍拖，佢咁投入，仲計劃結婚，但偏偏整劑咁嘅嘢，我要幫佢企返起身，日日都勸佢放開啲。」 思琦新歡Andy一直玩龜縮，但卻有指他向豪仔發即將做爸爸的短訊示威，鼎爺鄙視Andy的行為冇品：「男人講呢啲嘢，真係差啲。」 鼎爺昨晚陪豪仔在尖沙嘴出席無綫劇集《拳王》煞科宴，提及思琦前晚在《東張西望》中連聲指不明李家為何如此，鼎爺火爆說：「係我唔明白佢，其實佢哋分手前幾日，佢先嚟屋企飲茶傾偈。」
20110708-120,20110708,120,夥Hidy搶閘出寫真Jeana倒奶踩娜姐,"夥Hidy搶閘出寫真 Jeana倒奶踩娜姐 o靚模寫真戰一觸即發，新8模成員何佩瑜（Jeana）和余曉彤（Hidy）的寫真集，將於大後日搶先推出。兩女前晚相約巡視印刷廠，見證自己籌備多時的「BB」誕生。34C暴乳Jeana繼續狂踩師姐周秀娜，她自封一代性感宗師，還表明眼中只有自己，不把師姐放在眼內。 周秀娜兩名師妹Jeana和Hidy今夏接棒推出噴血寫真，兩女視自己的處女作是BB一樣寶貝，身為「準媽咪」的Jeana和Hidy前晚相約到柴灣印刷廠巡視，親自監察寫真印製過程。 「佢冇咁性感啦」 近日頻騷事業線的Jeana，前晚穿上lowcut短裙到場，34C胸湧而出，相對32C的Hidy只晒長腿和露肩迎戰。兩女看到寫真的印刷過程，難掩興奮，Jeana大叫：「哇，好壯觀！」她還擺出瞓身倒奶甫士搶鏡，她與Hidy的寫真集大後日便公開發售，出版社分別為她們印製2,000張1：1海報送給粉絲。 暴乳Jeana為上位語出驚人，不時出言狂踩師姐周秀娜，Jeana說：「家佢都冇咁性感啦，我眼中只有我自己。」對於可有信心寫真銷量突破周秀娜？Jeana說：「我負面同正面反應都好多，集合起嚟反應好大。」問到Jeana是否接周秀娜棒做第二代性感女神？她驕傲說：「我係一代性感宗師。」 Hidy讚官能刺激 Hidy的寫真集構思陽光色彩，有別狂野的Jeana，為了不被同門搶風頭，Hidy圓滑地說：「我哋兩本唔同風格，我係陽光同海灘，Jeana係官能上刺激，我希望fans買晒兩本，中午睇我嗰本食雪糕，夜闌人靜就睇Jeana嘅，刺激啲。」 採訪：王連連　攝影：黃文偉"
20110708-121,20110708,121,馮仁昭四圍超：盧覓雪爆梁洛施冇戲拍 - 馮仁昭,馮仁昭四圍超：盧覓雪爆梁洛施冇戲拍 - 馮仁昭 梁洛施發言人盧覓雪噚日喺中環出席美容中心開幕，呢排梁洛施（小圖）又去咗溫哥華，佢話梁洛施仲未落實拍戲大計。盧覓雪話都知好多導演想搵梁洛施開戲，佢話：「Sofar冇電影劇本送過畀我哋，反而嚟自中港台嘅廣告都有，又想搵佢去event。」佢話梁洛施要湊3個仔，時間上都要度度。
20110708-122,20110708,122,郭晉安湊女如災難,郭晉安湊女如災難 陳曼娜前晚於灣仔宴請劇集《團圓》台前幕後工作人員飯敍，郭晉安、劉兆銘及梁靖琪等都有出席，郭晉安的太太區倩怡日前產女，他表示正在放產假，他說：「之前囡囡啱啱出世，個仔覺得失寵呷醋，家情緒先好番啲。」 將演鹹濕皇帝 安仔笑謂幫手湊女，如經歷第二次災難，但感謝女兒為他帶來假期，他說：「我放假到9月先返TVB開新劇，喜劇嚟o架，演鹹濕皇帝，但未知鹹邊個。」安仔謂無綫有很多高瘦靚女，並說：「呢啲角色未做過，有難度，最好合作過熟啲嘅，好似宣萱、徐子珊同胡杏兒咁，可以俾我鹹濕。」 採訪：魯萍 攝影：陳慧安
20110708-123,20110708,123,蘋影話：《黑癲鵝先生》占基利品味最高雅的喜劇？,蘋影話：《黑癲鵝先生》占基利品味最高雅的喜劇？ 坦白說，我從來沒有喜歡過占基利。看過他兩三齣所謂喜劇，擠眉弄眼硬滑稽，頗有如坐針氈之感，我寧願看六十年代的謝利路易，甚至法國的范南度。過去占基利的電影那麼賣座，觀眾緣應該不錯。但對我來說，是毫不過電。在毫無期望的情況下，《黑癲鵝先生》竟然有意外驚喜。 在眾多神奇科幻、打到七彩的暑期猛片中，本片的確是鶴立雞群的合家歡電影。我不介意占基利的演繹方式，也不介意他臉上的歲月痕迹。那些電腦弄出來的六隻企鵝實在太可愛了。在占基利慣常的喜鬧劇類型中，本片不算太胡鬧，比較接近溫情喜劇的範疇，它可能不夠瘋狂惹笑，除了企鵝拉屎這種小孩必定呵呵大笑的笑料之外，其餘逗笑伎倆不算低俗，甚至有頗高雅的文化品味。那些像小孩般搗蛋的企鵝，竟然喜歡看大螢幕上的差利卓別靈。還有古根漢藝術博物館，令人緬懷的高雅餐廳，父子情緣，親情、家庭重要還是金錢、事業重要等等課題，雖是老生常談，卻令電影的品格得以提升。那些可愛的企鵝是怎樣弄出來的呢？據說有真有假，有電腦CGI，真想找製作特輯來看看哩。 撰文：黃國兆
20110708-124,20110708,124,港男書法比賽冇睇頭高海寧胸贏微波楊秀惠,港男書法比賽冇睇頭 高海寧胸贏微波楊秀惠 今屆港男將於下星期六（16日）進行比賽，前晚11位參賽者到鑽石山宣傳拉票，他們以密實look出現齋比試書法，睇頭大減，吸引力欠奉，難怪要出動咪神高海寧以低胸裝火併楊秀惠和朱慧敏。其中高海寧穿黑色谷胸吊帶裙，露出深長事業線，輕鬆撼贏楊秀惠和朱慧敏的微波身材。 一年一度的無綫《香港先生選舉》將於下星期六晚舉行，連日來11位參賽者頻頻亮相拉票造勢，前晚他們到鑽石山出席活動，即場比試書法，一眾港男以恤衫西褲出現，未有機會騷肌肉，睇頭大減，幸好有咪神高海寧、楊秀惠和朱慧敏以低胸裝亮相挽回睇頭。其中高海寧穿上黑色吊帶谷胸短裙，露出又長又深事業線，性感養眼，相反雖然楊秀惠和朱慧敏同樣以低胸裙亮相，但相比起高海寧只屬微波身材，明顯失色。 楊秀惠瘦咗冇胸 問到楊秀惠是否刻意穿低胸撼高海寧？她直言：「好多人話我瘦咗連胸都冇埋，咁點撼呀。」但為配合身上的低胸裝，楊秀惠仔細挑選合適內衣，她坦言很喜歡買內衣作不同配襯，她說：「如果揀啱內衣，會令身材更加好。」由於消瘦不少，楊秀惠要換過一批新內衣，此外又要做treatment保持雙峯堅挺以免下垂，會否請教高海寧？她直言：「梗係會，佢真係好勁。」高海寧則預告港男選舉當晚，由於有不少靚女同場，因此會更悉心打扮。 朱慧敏計劃結婚 名花有主的朱慧敏表示不喜歡太健碩的男士，男友身形均勻，她直言：「我叫過佢去選港男，佢有型又有身形，但佢拒絕咗。」感情穩定有否結婚打算？朱慧敏透露有計劃但並非短期內實行，不擔心男友被撬？朱慧敏笑言：「佢怕我俾人搶至真，雙方最緊要互相信任，一切順其自然。」現場見1號蕭家浩身形明顯消瘦，他坦言因為壓力大所影響。 採訪、攝影：王崇穎
20110708-125,20110708,125,藍奕邦聲討劣質議員,藍奕邦聲討劣質議員 娛樂圈中人為怕惹禍上身，多不敢在政治立場上發表言論，立法會議員梁美芬為政府護航心切，提倡「玩辭職」議員的選民應受懲罰，引來全城圍剿。 創作歌手藍奕邦日前在微博上寫道：「因為梁美芬，我立即決定7月16日前登記做選民！因為我對香港要出一分力，選有質素的人才入立法會，阻止劣質的人再擾亂香港人視聽。」 阿詩登記選民 藍奕邦此舉即被不少網民力挺，他更因為要入網站登記做選民而搞到一頭煙，何韻詩亦在微博抵死和應說：「個網站搞到我hang機。」 撰文：林妃
20110708-126,20110708,126,AmandaS.婚前消瘦,AmandaS.婚前消瘦 AmandaStrang、「翻版關之琳」Jocelyn和老公、龔如心契女徐文玠等，前晚在中環出席首飾活動，李桂蘭兒子、威廉王子同學戴尚安為AmandaS.等拍了半裸廣告相，他更將為國家地理雜誌做導演，拍攝紀錄片。 每朝不停試食 AmandaS.越來越瘦，忙搞婚禮和餅店開幕的她說：「我家忙於試食，牛角包、曲奇，不停咁試。」反而消瘦？她說：「因為每朝六點半就起身，六個師傅不停做畀我試，我只係試一啖，但不停試，好攰！」她上周去米蘭Prada試婚紗，也被fitting部門告誡她不可再瘦，問到Prada婚紗相信至少六位數字金額，她說：「唔係幾多錢，係佢地特別為我訂做，我好榮幸！」 採訪、攝影：梁錦雯
20110708-127,20110708,127,光良九展開騷冧女,光良九展開騷冧女 光良將於9月4日於九龍灣會展舉行「情歌從這裡開始光良香港演唱會2011」，昨日他於尖沙嘴開記者會，大會安排兩位靚女扮成空姐傍實他。 光良表示是次演唱會只開一場，若反應理想要看公司決定會否加場，對於早年於紅館開騷，稍後卻於九展舉行個唱，會否有降格感覺？他說：「呢次主題係以情歌為主，希望可以同fans靠近一啲，自己都好鍾意呢個構思。」 至於嘉賓方面，光良打算邀請劉璇及方大同，問到屆時女友會否到場支持？光良說：「冇乜可能，佢都有自己嘅工作。」他表示與女友感情穩定，問到可有時間陪女友？他說：「唔一定要成日見先會穩定，家咁先係穩定嘅考驗。」 採訪、攝影：王崇穎
20110708-128,20110708,128,馮仁昭四圍超：天明Chok變女裝驚出街被打 - 馮仁昭,馮仁昭四圍超：天明Chok變女裝驚出街被打 - 馮仁昭 洪天明、傅穎（Theresa）、賈曉晨（JJ）和林子善等，前晚喺將軍澳電視廣播城錄影節目《變身男女ChokChokChok》，洪天明最花心思，腳踏3吋高踭鞋加上化妝及手袋，妝扮「驚艷」萬分。 自言第一次着咁高高踭鞋嘅天明，自爆一身打扮都係女友周家蔚精心炮製，佢笑笑口話女友同佢扮靚時當正佢係細個玩嘅公仔，都唔知幾enjoy，天明話：「如果我呢個樣行出街會俾人打，俾人話妖孽，但女朋友見到就好開心，因為平時冇咁嘅機會。」 傅穎借衫變性 女扮男裝嘅Theresa戴咗個短假髮出現，不過佢冇紮胸上陣，男人婆效果未見成功，佢話原本想扮炎亞綸，但係因為身材唔夠高，所以就冇扮。Theresa自言一身服裝都係問朋友借，何韻詩借咗對鞋，葉文輝（啤梨）就借褲，不過馮仁昭質疑身形矮小嘅啤梨竟然可以借褲畀佢？Theresa即笑話：「佢買錯啫，自己打扮上嚟都似男仔o架，不過未試過有女仔追我，入行時自己都有啲rock味，都有好多女fans，但自己冇reject亦都冇accept囉。」
20110708-129,20110708,129,阿嬌力挺霆鋒冇小三,阿嬌力挺霆鋒冇小三 鍾欣桐（阿嬌）、陳偉霆、謝安琪、周柏豪及鄭欣宜等歌手於昨日在調景嶺出席港台《第三十四屆十大中文金曲》記者會。 阿Sa第三次中暑 對於謝霆鋒及張栢芝於昨日分別返港，似將正式硬碰，早前被傳曾秘密探霆鋒班的阿嬌表現頗為避忌不欲多談，她說：「我唔八卦，佢哋大人嚟會解決，件事係點遲早知。」對於有指霆鋒有小三、小四？阿嬌力挺對方：「係人講一句都係嘅，佢咪好唔得閒？清者自清。」會否覺得有人博宣傳？阿嬌沒好氣的謂：「好無聊！」 阿嬌又透露蔡卓妍（阿Sa）在內地拍劇第三次中暑，身為阿Sa男友的陳偉霆即表示心痛及擔心，並希望若工作不忙時到內地探女友。 採訪：文國駿　攝影：仇志德
20110708-130,20110708,130,馮仁昭四圍超：薛凱琪後悔錯過好姻緣 - 馮仁昭,馮仁昭四圍超：薛凱琪後悔錯過好姻緣 - 馮仁昭 薛凱琪（Fiona）噚日去咗商台宣傳新碟，Fiona話新歌《不要愛我》係佢感情上嘅寫照：「有幾年我好灰，就算遇到鍾意嘅男仔，為咗唔令自己受傷，都唔會同佢開始，家我唔會咁做，只要有合適嘅人，我都會試吓同佢開始，不過暫時仲未遇到。」Fiona噚日到黃埔出席新城活動，有指佢因四大唱片關係所以TVB唔畀佢宣傳新片《勁抽福祿壽》，佢就澄清報道失實，仲話嚟緊會為電影宣傳，鐵定出席下月8號嘅首映禮。
20110708-131,20110708,131,小豬來港籲騙徒收手,小豬來港籲騙徒收手 羅志祥（小豬）即將在港開演唱會，昨日他來港為開騷準備，現場有約200位fans接機，雖然人數眾多，但很有秩序，未有造成混亂。小豬戴上黑超和帽出現，由四位保安貼身保護，對於有網友聲稱可以代fans買他的個唱門票行騙被捕，小豬表示：「我也有看到這個報道，希望大家不要欺騙任何人。」其間有空姐上前向小豬索簽名。 此外還有汪明荃由西安返港，她出閘時，適逢謝霆鋒亦步出閘口，問阿姐在閘內有否見到霆鋒？阿姐只是「吓」了一聲未有回應，回港放暑假的賭王千金何超蓮則穿上橫間長裙戴上大帽由司機接機，一身造型相當搶眼。 採訪、攝影：張俊銘
20110708-132,20110708,132,馮仁昭四圍超：梁漢文建議霆鋒唔好拖 - 馮仁昭,馮仁昭四圍超：梁漢文建議霆鋒唔好拖 - 馮仁昭 梁漢文（Edmond）噚日去咗港台出席記者會，講到有指謝霆鋒今日將會返香港處理離婚嘅事，Edmond就回應話：「上次食完佢嗰餐影帝飯之後，冇聯絡，我唔知佢會點樣處理呢啲問題，不過我覺得點都要雙方平心靜氣去傾，唔好拖太耐喇。」 問到佢會唔會搵霆鋒傾吓偈？Edmond就話：「唔會傾，唔關我事，呢啲時間比較敏感，況且又係佢嘅家事，真係唔方便俾意見，佢大個仔識得點處理。」
