key,date,article_daily_id,title,text
20110816-0,20110816,0,中大迎新營玩死女生作家之女留遺書跳樓亡,中大迎新營玩死女生 作家之女留遺書跳樓亡 【本報訊】天文台前高級科學主任兼作家李偉才，其19歲女兒天蔚今年考入中文大學物理系，上星期她參加迎新營後，情緒突變，鬱鬱寡歡，昨晨在薄扶林碧瑤灣家中，留下遺書後從18樓飛墮落街，壓毀一輛私家車後反彈地面重傷，送院不治。警方懷疑天蔚自殺與迎新營活動有關，事後聯絡到活動搞手了解，調查後相信案件無可疑。　 記者：馬耀文 墮樓慘死少女李天蔚（19歲），英文名Fiona，畢業於聖士提反女子中學，今年考入中文大學入讀物理系。其父親為天文台前高級科學主任李偉才，筆名「李逆熵」，是本港著名的科普及科幻作家。消息稱，Fiona於本月10至13日參加中大物理系在逸夫書院舉行的迎新營後回家，家人見她非常不開心，但未有加以追問，至天蔚墮樓後，才聯想到是否與迎新營有關。 曾說迎新營「好唔開心」 據悉，警方事後在李家找到一些迎新營的資料單張，並聯絡上中大物理系迎新營的組織者及組長等人，查問迎新營發生事宜。而Fiona的好友亦向警方稱，近日曾聽到她訴苦，表示在迎新營時感到「好辛苦」及「好唔開心」，警方不排除墮樓原因與迎新營活動有關，日內或會再向其他參與者查問及錄取口供。 Fiona在中學十分活躍，成績優異，從她放上網的成績單所見，各科目均獲教師一致讚好，班主任給她的評語為「天蔚謙和有禮，處事態度認真，樂於承擔而有恒，成績優良，盼精益求精，更有進境」。在責任心、禮貌、關懷他人、主動及領導才能各方面均獲優等的最高評分。與父親同樣熱愛天文地理的Fiona，數年前就讀中學時，經常參加觀賞天文現象活動，08年就曾與父親及家人一起報名參加觀賞日全蝕活動。 昨晨10時許，Fiona與47歲姓麥母親同在域多利道555號碧瑤灣19座寓所，其間大廈52歲姓何看更突然聽到巨響，跑出大廈視察時，發現Fiona從高處墮下，壓毀一輛私家車後反彈地上重傷，口鼻流血，立即報警。現場消息稱，救護員到場時，女事主已無呼吸脈搏，立即為她急救，送院途中亦不停為她施行心外壓急救，惜送抵醫院搶救仍返魂乏術。 遺書大意稱「我要走啦」 警員到場登樓調查，李母才知女兒墮樓，傷心不已，她與多名親友事後抵醫院，聞悉噩耗均十分傷心，有女親友即時落淚。記者致電李偉才了解事件，他聲音低沉，未有回答記者問題即掛線。事後警員在單位內撿獲一封遺書，內容大意稱「我要走啦」，但未有提及輕生原因。家人向警方提及Fiona參加中大迎新營後情緒低落，警方調查後初步認為案件無可疑，死因有待剖驗屍體確定。 中大物理系迎新營營長「卡樂B」承認警方昨午曾向他查詢事件，但他拒絕透露詳情。 近年本港各大學迎新活動越玩越意淫，受到多方批評。其中中文大學更多次被揭發在迎新營大玩不文遊戲，包括人人雙手直豎中指做出不文手勢，耳邊吹氣、面貼面傳牙膏等遊戲。今年中大新亞書院本月初舉行的迎新營預營更大玩色情遊戲，有「男男」扮人形蜈蚣隔着褲又聞又錫屁股，相片事後被人傳至社交網站流傳，一度引起校方關注，事件曝光後，有關相片隨即在社交網站被刪除。香港教育政策關注社主席張民炳表示，大學迎新營玩得過激，以致有人受傷或犧牲，實在不能接受。
20110816-1,20110816,1,小車禍　大發癲金毛警前打記者,小車禍　大發癲 金毛警前打記者 【本報訊】染金髮躁漢昨在楊屋道街市外，報稱被一部客貨車輾到腳掌，他狂性大發打爆客貨車車窗玻璃。《蘋果》記者到場採訪時，躁漢擬追打記者被警員制止。惟記者後退一角時，數名兇徒竟將記者推倒地上拳打腳踢，其後金髮躁漢更擺脫警員衝前狂踢記者面部。《蘋果》記者受傷送院，警方拘捕涉案躁漢，並追緝其餘兇徒下落。 記者：周鴻熙　姜偉康 《蘋果日報》總編輯張劍虹強調，採訪新聞是記者的天職，對記者在履行正當職務時遇到的暴力對待，予以強烈譴責。香港記者協會指出，記者在採訪時被襲擊是不能容忍的，對此暴力行為作出譴責。 出拳打爆客貨車玻璃 涉案被捕男子姓林（25歲），據稱在楊屋道街市賣水果，以往沒有刑事案底。林涉嫌襲擊及刑事毀壞被捕，他右手及左腳受傷，需留院治理。 現場楊屋道街市對開，昨晨約8時30分，一名姓吳（28歲）男子，駕駛客貨車沿河背街行至川龍街交界準備停車往附近拿取定單。其時周圍有不少行人，出現人車爭路情況，吳倒車將要停下之際，突有人猛力拍打車窗。 吳說，當時車速很慢，「佢（林）話我碌親佢，猛咁打車窗，同埋踢架車」。染金髮的林惡形惡相，不停以粗言辱罵。吳見他並非善類，不敢打開車門與他對質，林不得要領竟走到車尾，出拳打爆尾門玻璃，以致受傷流血，吳見狀立即報警。 警方到場時，吳下車協助調查，警員將受傷的林安頓在客貨車乘客位。他的數名友人包括有紋身漢，亦在場了解情況。《蘋果》記者周鴻熙到場採訪，林見到周拍攝即高聲喝警前打記者罵：「影乜×嘢，放低部相機！」他衝下車並撿起一支棍，企圖追打記者，在場警員即時制止。 記者退後遭數人圍毆 周鴻熙說，為免刺激該男子，他退到川龍街路邊的貨車旁，不料兩、三名男子突然衝出，喝斥「叫咗你唔好影」，將他推倒地上拳打腳踢。周說：「眼鏡飛甩埋，相機跌喺地下，身體俾人踩咗好多腳。」他遇襲約一分鐘，隱約聽到有女子說：「夠啦，唔好打啦。」兇徒隨即收手。 周遇襲時警員未有目睹情況，事後他向警員投訴；一名赤膊男子企圖衝向記者，警員馬上制止；但另一邊姓林「金毛漢」，乘機突破警員包圍，一手將周的相機搶走掟落地，並將周推倒地上，向他右臉近耳朵踩了一腳，以致受傷流血。警員隨即制止，並將林鎖上手銬拘捕，將周送院治療。 警方正追緝其餘兇徒下落。 記者遇襲示意圖
20110816-2,20110816,2,金牙大狀　廉署剋星,"金牙大狀　廉署剋星 有「金牙大狀」之稱的資深大律師清洪縱橫法律界30多年，平日有不少徒弟及契仔，難怪有人藉清洪之名，「撻朵」凶警員。 清洪在本地大律師年資排行榜名列第五，擅長打刑事官司，因多次在廉署案件中擊倒控方，故又有「廉署剋星」之稱，其中最為人熟悉的案件要算02年藝人謝霆鋒撞車「頂包案」，謝被控涉嫌串謀妨礙司法公正，當年由清洪擔任代表律師，雖然謝霆鋒被判罪名成立，還柙候判期間嚐到14天鐵窗滋味，但最終獲法庭輕判240小時社會服務令。 有不少徒弟及契仔 清洪原名葉清福，現年64歲、單身，為馬來西亞華僑。清洪於1969年取得英國大律師資格，其後返港於《遠東經濟評論》任職助理編輯5年，至1976年成為香港執業大律師，97年為資深大律師，08年他曾出版《護法》一書。清洪有不少徒弟及契仔，今年初，清洪徒弟唐煒明大律師涉嫌在一間樓上酒吧藏毒，於本月2日被判罪成，判處罰款4,000元。 去年，清洪契仔巫翊鳴於中環自資開設的夜店舉行狂野派對，其間有記者報稱遇襲驚動警方調查，清洪趕至了解及陪同契仔返警署助查。清洪亦曾為涉嫌偽造龔如心遺囑的陳振聰擔任代表律師。"
20110816-3,20110816,3,記者心聲「俾人打預咗，流晒血係第一次」,記者心聲 「俾人打預咗，流晒血係第一次」 「做突發咁耐，俾人打都預咗，流晒血仲係第一次。」遇襲受傷的《蘋果》記者周鴻熙，敷治後已出院，但身體仍然隱隱作痛，耳背有一道兩厘米長傷痕，雖不用縫針，但今日要返醫院洗傷口。周對警方處理有不滿，認為警員如及早用手銬將「金毛漢」鎖上，他遇襲受傷程度將會減低。 周鴻熙指出，從事突發記者10多年，被推撞不計其數，「俾人打今次係第二次，最傷都係今次」。他說，新聞主角見到記者拍攝，粗言問候記者見怪不怪，「見到個金毛喺車度猛鬧，知佢唔好惹，已經行遠啲避佢」，但仍然受到襲擊。 「差人應一早用手銬」 周表示，由於事出突然及掉了眼鏡，未能看到數名兇徒容貌，但攝影機墮地時仍然運作，約有兩秒片段影到一名穿着藍色T恤兇徒，在他身上猛踩。當「金毛漢」在客貨車上接受警員調查時，該名男子被記者拍攝到，曾與數名赤膊及紋身漢在車旁。 「差人應該一早用手銬鎖住金毛，我就唔使咁傷。」周指出，初時該名涉案男子衝下車，企圖用棍追打他時，警員見他有暴力傾向，應鎖上手銬，「如果早啲鎖住佢，唔會有機會俾佢打我」。 《蘋果》記者
20110816-4,20110816,4,替補論壇爆滿　被疑有陰謀學者指：未出街霸晒位　方便統一口徑,"替補論壇爆滿　被疑有陰謀 學者指：未出街霸晒位　方便統一口徑 【本報訊】為期兩個月的替補惡法公眾諮詢期下月24日結束。政制及內地事務局至昨天才公佈，會在月底及下月初舉辦兩場公開論壇，並在昨天通知18區區議員，邀請參與論壇。但合共645個論壇名額，竟然在短短一天內爆滿，有泛民主派區議員在收到當局通知後約3小時，致電熱線留座時已經食白果，質疑政府發動建制派空群而出報名，一心「河蟹」論壇。 記者：陳雪玲 兩場公眾論壇分別在本月23及下月1日分別於沙田文化博物館及科學館舉行，各有350及295個座位。身兼西貢區議員的新民主同盟成員范國威昨指，昨早11時獲議員可報名出席論壇後，隨即在下午2時半致電留座，但接電話的職員回覆指科學館的論壇早在上午已經爆滿，沙田論壇的300個名額當時亦所餘無幾。 「懷疑建制派空群搶位」 范國威質疑：「有乜理由會有咁多公眾人士一早去報名﹖令人好懷疑係建制派空群搶位。」他指公眾反應若如此踴躍，當局就應該加開論壇，否則泛民黨派以至民間團體亦會到場請願。 其他泛民政黨亦有類似「慘況」。民主黨總幹事林卓廷指該黨只得陳樹英及柯耀林兩名區議員成功留座，出席首場論壇，但沒有任何區議員成功報名參與尾場諮詢會。陳樹英質疑當局一早「搵定人報名」，「派6,000元呢個議題好熱門，但公眾諮詢會一半都唔滿，點可能替補機制會一早爆滿？」 公民黨及社民連亦在昨午始得知論壇爆滿消息，急急報名時亦只有數名成員成功留座。 理工大學應用社會科學系助理教授鍾劍華指，多年來從未聞有政府的諮詢論壇「一出街就爆滿」，認為泛民的質疑不無道理：「政府喺替補一事上從來無意諮詢，連諮詢嘅命題都係假……林瑞麟上次（轉軚）咁肉酸都做得出，所謂一件污，兩件穢，（論壇）未出街就霸晒啲位，方便統一口徑。」 政制及內地事務局發言人回應，當局於昨天已經發出新聞公報及於報章刊登廣告，讓公眾知悉有關公眾論壇的安排。發言人稱除了預留少量座位予立法會議員、區議員、記者及工作人員外，所有座位均通過熱線讓市民留座，先到先得。由於反應踴躍，兩場論壇昨天已經滿額。"
20110816-5,20110816,5,承建商斥屋宇署亂咬人,承建商斥屋宇署亂咬人 【本報訊】屋宇署代表在作供時將責任歸咎予承建商朱偉榮，令他受盡千夫所指。74歲的朱昨日接受本報訪問時仍耿耿於懷，「嗰啲人正一狗口長不出象牙，仲要惡人先告狀嚟誣陷我。」他說相信法官的公正、公平，對於自己正被屋宇署票控，他也未感畏懼，更說「平生不做虧心事，半夜敲門也不驚」。 還了自己一個公道 自塌樓後未敢再接工程的朱直言已「金盆洗手」，開工用的裝修工具大部份都已變賣，家中只存留一些簡單的用具及一張書桌。他說，自己信佛幾十年，對當天造成的不幸很不安樂。靠綜援金生活的他對死者家屬只能說是愛莫能助。對於法官的判決，他形容是還了自己一個公道，讓他可以繼續坦蕩蕩地生活下去。 對於接了今次的工程，朱偉榮坦言自己「唔好彩」，並強調該項工程是「盡可能救返層樓」。審訊過程中，屋宇署將塌樓責任諉過於他，朱伯憤憤不平說，「嗰啲癲狗亂咁吠亂咁咬人」。他還呼籲政府多些承擔，在事件中負最大責任的屋宇署及大業主都應向死者家屬發放慰問金作賠償。
20110816-6,20110816,6,特稿鄰宅裂痕處處　草根階層遷入,"特稿 鄰宅裂痕處處　草根階層遷入 馬頭圍道塌樓慘劇發生至今已逾年半，45J毗鄰的45G及45H其後也因危樓牽連而全面拆卸，至今只剩一片頹垣敗瓦，巨型工字鐵及鋼架支撐着45號剩餘的樓宇。樓宇內雖然仍有零星居民出入，但斑駁殘舊的牆身，肅殺的氣氛，一片蕭條。 「窮人邊計得咁多」 記者早前走進最近塌樓位置的45E及45F，日光透過梯間的空隙照向剝落的牆身，昏昏暗暗，裂痕隨處可見，最闊處更可放進一枚一元硬幣。整座樓宇已有逾半居民遷出，空置的單位也由市建局用鐵鏈封鎖，貼上告示。有地區幹事指近54%的業主接受當局收購，繼續留居在此的都是貪平租的草根階層。 「最驚都係啲鋼筋同埋電線。」去年7月以2,000元租金，與妻兒租住三樓一個110呎劏房單位的陳先生坦言是為了平租才搬來。他表示，同樣呎數的單位在同區起碼要貴多700至800元。即使看到幾十年的唐樓弊病處處，他也無奈地說，「冇得擔心，窮等人家又邊計得咁多，安唔安全，惟有信政府。」 去年12月搬到45F、斯里蘭卡籍的Chaminda夫婦稱，兩人都是每月拿3,800元最低工資的家庭傭工，可以租住樓宇的選擇不多。他請記者進入單位指出牆身的裂縫，還有整塊都可搬起的地磚。他說，雖然自己在塌樓後才遷入，但仍有少少擔心，現只等市建局全面收購後領取3,000多元搬遷費補。《蘋果》記者"
20110816-7,20110816,7,撐外傭團體　轟葉劉篤數抽水,撐外傭團體　轟葉劉篤數抽水 【本報訊】外傭居權案下周開審，數十個民間團體斥責保皇黨危言聳聽，誇大港府一旦敗訴即逾十萬外傭自動成為港人，搶去社會資源，其中立法會議員葉劉淑儀任保安局長時，無察覺外傭居權問題，現在卻頻頻「抽水」，「講到好似唔關佢事咁，仲要求人大釋法，好離譜。」團體又指港府也重施當年稱港人內地子女居權案引發167萬人湧港之「篤數」伎倆，煽動市民仇外，希望市民不要受騙。 民建聯、自由黨、新民黨及工聯會均聲稱，若外傭官司勝訴後果嚴重，《基本法》委員會副主任梁愛詩等認為要釋法解決。一批民間團體昨發表聯合聲明，強調外傭以司法途徑爭取居港權是其基本權利，又要求謝偉俊、葉劉淑儀、李慧琼及劉健儀等立法會議員停止散播扭曲事實及分化社會言論，並向市民及外傭道歉。 「葉劉係種族歧視主義者」 香港天主教正義和平委員會幹事孔令瑜表示，1999年港人內地子女居權案期間，葉劉淑儀等官員指港府若敗訴，167萬內地人湧港，「呢個數冇再引證過」，今次又再誇大可成為港人的外傭人數，「葉劉淑儀骨子裏根本係種族歧視主義者」。 香港人權監察總幹事羅沃啟也批評葉劉淑儀，若入境條例有關外傭居權條文有問題，應及早應對，「佢在位保安局局長時冇做任何嘢去改變，今日仲要大大聲抽水，要求釋法。」甘浩望神父說：「呢啲黨因為拉票，講呢啲說話有冇良心先？」 「外傭對香港社會貢獻良多，她們與我一樣，為何不許她們申請成香港永久居民？這是歧視。」任教中文大學的意大利人Gianni來港16年，已成為永久居民，他認為入境條例對外傭不公，港府應糾正錯誤，而非以其他手段剝奪她們應有權利。 湯家驊：稍修例即可閂門 公民黨議員湯家驊在另一場合表明，反對就外傭居權釋法，「若一有爭拗就釋法，司法同立法機關仲有冇存在價值？」他建議稍為修改《入境條例》，訂明「通常居所」指非由僱主、法律或入境處規定的居所，修例後外傭將不符合《基本法》24條列明「在香港通常居住連續7年以上」條件，同時不存在工種歧視。
20110816-8,20110816,8,外傭官司政府突撤新證據,外傭官司政府突撤新證據 【本報訊】高等法院原定今天處理，政府要求呈交保安局首席助理秘書長黃少珠兩份補充誓章，內載政府一旦敗訴，符合資格申請居港權的外傭多達10萬人，闡述對香港經濟、社會福利、房屋及醫療的影響，但政府昨天突撤回提交新證據，法律界指政府或是避免案件因此受拖延，令人大釋法無期。 22日正式開庭 外傭一方表明因需時找專家評估政府的推算方法，趕不及在案件開審前作回應，一直反對加入新證據，但政府未有理會。截至昨天政府突指，為確保涉重大公眾利益的聆訊不會延期，同意現階段不提交新證據，法院今天毋須處理文件，22日才正式開庭。 資深大律師湯家驊相信政府突撤回新證據，可能因發現不提交證據反更有利，也可能希望官司速戰速決，以決定是否上訴或提請人大釋法。另一資深大律師梁家傑也指政府此舉似乎是不想案件再生枝節，免令申請人有理由要求押後聆訊，也反映政府「心虛」，不想數據被質疑而「獻醜」。
20110816-9,20110816,9,《蘋果》報道牽動港人愛心　紛紛捐助羊城孤女醫費可望解決,《蘋果》報道牽動港人愛心　紛紛捐助 羊城孤女醫費可望解決 【本報訊】17年前被港人父母遺棄廣州、幸得善心婆婆鄧姨收留的少女黃日恒，經本報前日報道其坎坷身世後，掀動了港人無限愛心，紛紛向本報表示願意伸出援手。有從事心理治療工作的人士稱要為日恒籌10萬元，而由「四叔」李兆基長子李家傑等商界人士成立的新家園協會，亦主動聯絡提供協助。對於本港市民的熱心，日恒家人直言終可放下心頭大石，但希望日恒的親父母能見親女一面，以解她思念之苦。 新家園協會願提供協助 蘋果日報慈善基金已與鄧姨及其家人聯絡，為日恒開設捐款編號，所收善款會轉交鄧姨用作日恒醫療開支及生活所需。從事心理治療工作的劉生向本報表示，17歲的日恒正值發展其人生觀的重要時刻，能重返校園，有助她心理健康發展。劉生得知日恒因沒有戶籍無法升學，立即聯絡身邊的醫生朋友，他聲稱至今已籌得6萬多元，預計短期內可籌得10萬元。 以世茂集團主席許榮茂為首、聯同李家傑和雅居樂集團主席陳卓林等商界人士成立的新家園協會，負責人郭先生表示，該會曾處理類似日恒的個案，但用4萬元辦理戶籍也未必成事，仍要符合很多條件，包括日恒是否長時間在廣州生活等，該會有相熟律師可提供協助。 日恒的「哥哥」嘉津說，得知不少有心人願伸出援手後，父母都放下心頭大石，「件事拖咗咁耐，終於睇到希望」。他透露家人去年11月曾「放下自尊」接受當地電視台採訪，但報道播出後社會「全無反應」，此次找香港傳媒幫忙，「先知香港人咁有愛心」。他說昨日家人已帶日恒吃最喜歡的炸雞慶祝。 盼日恒名正言順成家人 嘉津直言目前「有錢確係好重要」，既能為日恒醫病，亦可辦理戶籍及領養證，讓日恒名正言順成為家人。嘉津說：「日恒醫好病後，希望佢有日可以獨立，有機會成家立室，真正擁有屬於自己嘅家庭。」 日恒的親父母於17年前將她交由陌生的鄧姨照顧，最初每月提供生活費，間中探望，近年因日恒沒有戶籍，無法升讀高中，黃父不肯付錢，更自08年失蹤。日恒輟學後患上精神病，鄧姨一家面對龐大醫藥費和辦理戶籍等費用，無力負擔。 「黃日恒」捐款編號：C3073 網上捐款： http://charity.appledaily.com.hk/donate 
20110816-10,20110816,10,脅持慘案快滿一年　賠償全無着落黎棟國前後兩個樣,脅持慘案快滿一年　賠償全無着落 黎棟國前後兩個樣 【本報訊】馬尼拉人質慘案快一周年，部份死者家屬及倖存者昨到政府總部，與保安局副局長黎棟國會面，促請特區政府就是否透過外交途徑協助追討責任及賠償，給家屬明確交代。不過，家屬會後表示，黎棟國只表明會將他們的訴求完整轉告特首曾蔭權，由特首最終決定，他本人未能作任何承諾，也未能交代過去一年跟進人質事件的進度。 黎棟國沒交代進展 去年人質慘案後，黎棟國親身往菲律賓，火速協助倖存者及受傷團友返港，表現備受讚賞，民望大升。不過，人質事件一年後，他昨日代表無暇的特首會見家屬時，卻只充當「傳聲筒」角色，只向家屬表明，會將他們的訴求完整轉告特首，家屬引述他的回應：「佢話呢個係特首嘅決定，佢唔能夠作出任何承諾」。 家屬在約一小時的會面期間，清晰表達希望特區及中央政府替他們出頭，透過外交途徑向菲律賓政府追討責任及賠償。家屬今年3月曾與曾蔭權會面，曾當時曾回覆指會跟進事件，但家屬昨日向黎棟國查詢過去一年政府跟進進度時，對方未有交代具體進展。 殉職領隊謝廷駿胞弟謝志恆會後未有回應對政府的態度是否失望，他指明白曾蔭權事忙，未能隨時抽空與家屬會面，但期望昨日開始認真跟進，並讓他們知道特區及中央政府會否提供協助。 家屬昨日已向黎棟國表達，希望向今日訪港的國務院副總理李克強，表達希望中央政府協助的訴求，但詳情仍需特首辦安排。特首辦昨接受查詢時指，仍未收到保安局轉達家屬的訴求，對於特首如何處理，目前未能回應。
20110816-11,20110816,11,剛果案本月24日人大釋法,剛果案本月24日人大釋法 【本報訊】因剛果民主共和國債務案，終審法院上月首次主動提請人大釋法。十一屆全國人大常委會第22次會議，將於本月24至26日在北京舉行，議程之一是就終審法院提請釋法，審議香港《基本法》第13條第一款及第19條的解釋草案。 終院首次提請人大釋法 終審法院早前審理剛果共和國負債8億港元案件，引發債務案涉及國家豁免權問題是否屬《基本法》內，提及的「國防、外交等國家行為」的爭議。法官認為案件判決前，應先啟動《基本法》第158條機制，主動由法院提請人大常委會解釋《基本法》相關條文，釋法後再頒發最終判決。 這是回歸以來終審法院首次提請人大釋法，希望釐清《基本法》有關「國家行為」的意思，當中涉及《基本法》第13條，中央政府負責管理與香港特區有關的外交事務；第19條關於香港特區享有獨立的司法權和終審權的部份。過去人大3次釋法都是根據香港行政部門要求，就居港權、行政長官和立法會產生辦法，以及特首補選任期釋法。
