key,date,article_daily_id,title,text
20110305-0,20110305,0,與安仔復合心情靚爆Sammi：感覺良好,與安仔復合心情靚爆 Sammi：感覺良好 【獨家直擊】許志安與舊愛鄭秀文（Sammi）重燃愛火，二人前晚到佐敦撐枱腳，sweet爆兩粒鐘後，他們離開時均咧嘴笑不停，令身邊人不難感到他們甜到漏的愛情。這晚愉快的感覺，讓Sammi昨午獨自外出工作時，仍全身充滿着愛的力量，除了舉手投足甚風騷，染過靚髮後的她又在微博盡訴心中情，她並留言：「感覺良好。」 鄭秀文和許志安自04年分手至今，感情關係一直拖拖拉拉，前日卻有突破性發展，二人相約在佐敦太平館餐廳嘆下午茶，情侶對坐甜蜜共享豬髀餐，食足兩個多小時。拍拖斷正，但沒有影響Sammi和安仔的心情，他們前晚6時多離去時均笑到蓮子蓉面口。身邊再有人可以依靠，Sammi昨午風騷在微博晒命：「感覺良好。」 情侶品味鍾情紅格 Sammi前日有安仔陪嘆下午茶，雖被本報記者撞破，但無損她愉快心情，昨日她位於梅道蔚皇居寓所樓下集結了大批記者等候，Sammi未能會情郎，她昨午4時多出巡，有愛情滋潤，她刻意打扮，穿上搶眼紅色格仔恤衫配黑皮外套，穿了喇叭牛仔褲和高跟鞋，型格十足，其實前晚安仔的牛仔褲反腳部份也是紅色格仔，看來情人的品味果然特別相近。 Sammi昨日表現風騷，記者問她是否與安仔復合，心情靚爆的她全程笑笑口沒回應。Sammi先到中環為拍電影把頭髮染黑，其後便到跑馬地做腳底按摩。不過Sammi不忘發微博與歌迷傳情，染過髮後她即拍了不少大特寫，還留言：「感覺良好。黑髮，你好！」 Sammi還向歌迷大呻近日因為工作壓力而消瘦，她說：「這幾天瘦了點。每憑（逢）大project前，『壓力』就是天然的瘦身劑。再笑一個，將肥肉通通笑走！呵呵呵！」她又自嘲是「鄭瘦聞」。不過有了愛情滋潤，Sammi好快會心廣體胖。 對於Sammi和安仔復合一事，她的經理人郭啟華昨日說：「其實我都唔知佢哋食飯，所以喺唱片公司嘅立場係冇嘢可以回應。」兩位當事人則透過唱片公司指不回應。 Sammi前日與安仔撐枱腳，嘴角含春的望着愛郎嘆豬髀，反而安仔因為被本報記者撞破而尷尬飲茶，二人前晚食飽後，安仔充當柴可夫送女友回家。為盡快撇甩記者追訪，安仔埋單後先叫餐廳夥計到對面酒店的代客泊車，把車子駛到餐廳門口，然後他才隨女友步出。 狂望天窗童心未泯 當時問到Sammi有關復合，她未有親口回應，但臉上掛着「鄭四萬」笑容，正好表達她冧爆的心情，反而安仔卻例牌否認。Sammi登上男友的黑色Hummer座駕時，她竟好奇地抬頭猛望天窗，童心未泯，安仔其後直接送她到大坑大寶閣，然後才獨自駕車回加多利山。 採訪：王崇穎、朱志聰、 胡比、楊浩賢 攝影：羅德光、陳俊強、黃文偉、黃文成
20110305-1,20110305,1,劉璇否認訂婚,劉璇否認訂婚 盛傳不和的陳法拉和劉璇昨日在電視城宣傳無綫劇集《女拳》，兩人拖手出場，全程有講有笑。 甘願捱世界 有指劉璇與拍拖8年的內地男友訂婚兼同居，她說：「今次係我第一次，亦係最後一次講，報道唔係真，我只係有男友，我哋冇訂婚，適當時候會同大家講。」 有指劉璇與男友一齊捱世界，她說：「我唔會理其他人點揀，個個人幸福嘅定義唔同，我覺得最緊要係內心豐富。」法拉被問到諸葛梓岐宣佈12月結婚，她謂從報紙上知道，問她會否做伴娘或姊妹、或以甚麼身份去飲？她尷尬笑說：「我唔識點答，會唔會去飲就睇到時安排。」 採訪：何慧斯 攝影：陳順禎
20110305-2,20110305,2,陳冠希戥鋒芝高興,陳冠希戥鋒芝高興 陳冠希（Edison）去年底推出國語碟，昨日他在台北舉行簽名會，吸引近百名粉絲到場，Edison感性地說：「真的很謝謝台灣歌迷，我一直蠻想搬來台灣，目前考慮在台北或上海買房子。這裏很舒服，人好景色也好，去年12月發專輯我女朋友也有一起來，她好喜歡台北。」Edison昨日心情明顯很不錯，連被問到謝霆鋒和張栢芝約會親嘴也大方表示：「Good！I'mhappy，希望每個人都開心。」 籌備電視節目 Edison透露近來正忙着籌備新的電視節目，他說：「部份內容會是我到紐約、香港，去些陳冠希才能進去的房子，然後拍成7到15分鐘短片，還有加入動畫，介紹給大家。」他還自誇：「我看過覺得很好看！」至於和周杰倫主持的節目相比？他笑說：「節目形態不一樣。」 撰文：丁寧
20110305-3,20110305,3,Chilam認斟許秋怡,Chilam認斟許秋怡 張智霖（Chilam）和胡杏兒等前晚相約劇集《魚躍在花見》的演員，在尖沙嘴齊齊欣賞大結局，對於今次劇集成績不俗，Chilam坦言覺得很滿意，他說：「今次係一個好嘅開始，劇集夾埋演唱會一齊嚟，真係夾都冇咁準，我都好期待同無綫再合作拍劇。」 「要等佢回覆」 有指Chilam有意找前緋聞女友許秋怡在個唱上合唱，但遭太太袁詠儀反對，Chilam說：「呢啲報道已經司空見慣，我係有搵過許秋怡，但係佢本身好忙，所以仲未落實，要等佢回覆，呢啲嘢交畀導演去安排，我會專心做演唱會。」此外，近日與黃宗澤高調拍拖的胡杏兒則否認關係明朗化，她笑說：「朋友行街好平常，我最介意係俾人影冇化妝個樣。」 採訪、攝影：何慧斯
20110305-4,20110305,4,導演會春茗藝人第二代出頭婷婷捧新人獎贏欣宜,"導演會春茗藝人第二代出頭 婷婷捧新人獎贏欣宜 鄭欣宜與謝婷婷兩位藝人第二代，前晚齊集香港電影導演會春茗，兩人同樣熱愛演藝事業，近年雙雙努力靠自己實力證明並非只靠父蔭而成名，多才多藝的欣宜任司儀外更獻唱祝賀洪金寶獲獎，影壇新人婷婷奪年度新演員銀獎，稍勝一籌。 香港電影導演會前晚在上環舉行2011年春茗晚會暨頒發各項年度獎儀式（詳見附表），各獎項由會員選出，出席嘉賓包括霍震霆、謝婷婷、吳若希、李曼筠與洪卓立等。 爾冬陞獲選會長 大會宣佈第十四屆香港電影導演會會長由爾冬陞擔任，副會長為劉偉強、羅啟銳、陳嘉上及文雋。身在北京開鏡未能出席的爾冬陞由文雋代讀感想，他笑指擔任會長絕對不是優差，獲委員近乎一致推選，他覺得是大家早有預謀。劉偉強解釋因事務日漸繁忙，故副會長由以往兩名加至四名。 欣宜自薦演八婆 同為藝人第二代的鄭欣宜與謝婷婷，於活動上各展自己努力的成果，身為今年樂壇新人的欣宜，前晚與黃真真及導演郭子健擔任司儀，欣宜並獻唱《憑着愛》祝賀洪金寶奪得榮譽大獎；初登大銀幕的謝婷婷憑電影《李小龍》奪年度新演員銀獎。 欣宜去年有份演電影《72家租客》，自言性格積極藉機向導演們自薦，希望能接拍八婆角色，盡展自己刻薄潛能。談到如何花費政府派發的6,000元？她說：「未諗，應該放喺戶口儲起先，我平時可以好慳，但食就唔慳得，或者約朋友食飯。」 新演員銀獎的謝婷婷透露要跟快將結婚的朋友慶祝，臨時抽時間出席。被追問何時結婚，她笑稱未有計劃，但自己很愛小朋友，不過男友安志杰不善照顧小朋友。 採訪：溫敏芝 攝影：陳慧安 香港電影導演會2010年度得獎名單 －榮譽大獎－ 洪金寶 －新演員獎－ 金獎：杜宇航《葉問前傳》 銀獎：謝婷婷《李小龍》 銅獎：陳奐仁《李小龍》 －新晉導演獎－ 導演：莊文強《飛砂風中轉》 －最受推介電影獎－ 《狄仁傑之通天帝國》 《綫人》 《打擂台》 《志明與春嬌》 －最傑出導演獎－ 徐克《狄仁傑之通天帝國》 林超賢《綫人》 彭浩翔《志明與春嬌》 資料來源：香港電影導演會"
20110305-5,20110305,5,周秀娜學捉鬼防撞邪,周秀娜學捉鬼防撞邪 周秀娜今年要強勢在電影圈發力，她孭飛新片《猛男滾死隊》將於下周四上映，她的片約亦一張緊接一張。 拜司徒法正為師 娜姐稍後會跟《海角七號》男主角、台灣男星范逸臣合拍驚慄片，二人扮演情侶，娜姐在戲中還不幸撞邪。 娜姐早前拍完電影《惡胎》後未驚完，今次再接驚慄片，她日前說：「我拍親鬼戲都好驚吓，為咗預防撞邪，我諗住開戲前搵司徒法正上番兩堂，學吓捉鬼傍身。」 採訪：比華利 攝影：陳順禎
20110305-6,20110305,6,周柏豪彈iPad2新套,周柏豪彈iPad2新套 iPad2日前曝光，即時引起娛樂圈中潮人議論紛紛，一向愛熱捧潮物的周柏豪本身因有iPhone而沒有購買iPad，不過當他得知iPad2會推出時，他都打算買，但他觀看記者會後就即打消了購買衝動。 善用apps做音樂 周柏豪笑言會保持觀望態度：「因為部機仲未有USB，如果有USB整相或其他嘢就方便好多，但係前面有鏡頭都可以同媽咪一人一部玩視像，我寧願喬布斯（SteveJobs）身體健康。」 周柏豪自言現時蘋果產品音樂方面都好完善，iPad界面夠大可以運用打鼓、彈琴的apps做音樂，他坦言這方面都吸引他購買iPad2，但他就大彈iPad2推出的SmartCover，他說：「我覺得嗰舊嘢好核突，如果係黑色就好啲。」 採訪：駱華齡
20110305-7,20110305,7,舒淇開中門　嘉玲冇眼睇,舒淇開中門　嘉玲冇眼睇 舒淇與劉嘉玲兩位大美人，昨日齊齊出席台灣一娛樂媒體的開幕禮。雖然嘉玲論身材絕對跑贏舒淇幾條街，但昨日活動上，舒淇穿上超低胸裝、中門大開赴會，成功撼低打扮極度密實的嘉玲。未知是否因為風頭被搶關係，嘉玲逗留不夠10分鐘便速速閃身離開。 楊登魁旗下的Polyface柏合麗娛樂傳媒集團昨日在台灣舉行啟動儀式，有近百圈中人前來撐場，包括劉嘉玲、舒淇、劉家昌、朱延平、侯孝賢和豬哥亮等等。其中34歲的舒淇穿上超性感Gucci靚裙現身，除大騷玉背外，胸前事業線更一直開到近肚臍位置，C級上圍若隱若現，惹火非常，又難怪她一出場便引來全場哄動。 嘉玲急急離開 相反，45歲的劉嘉玲雖然擁D級豐滿身段，但昨日她卻收起性感，只穿密實套裝赴會，結果被同場的舒淇搶盡風頭。活動上，嘉玲和舒淇兩位美女在台上合照，二人攬頭攬頸狀甚老友，其間嘉玲又鬼馬的掩住一隻眼，不敢正面住舒淇心口。 不過，嘉玲剪綵後前後只逗留10分鐘便匆匆離開，一度令人懷疑她是怕了舒淇所致。後經記者了解後，始知道原來嘉玲是要趕搭飛機離開。 戥林熙蕾開心 問舒淇昨日如此性感是否要撼贏嘉玲？她急忙解釋說：「沒有沒有沒有。」被問到好姊妹林熙蕾與男友Chris傳婚訊，她鬼馬的說：「可惜新郎不是我！」舒淇表示近日很少與林熙蕾見面，並說：「不要說那男生的正面，我連側面都不知道，但相信是個好人，因為看蕾蕾很開心。」 此外，曾和劉嘉玲傳緋聞的鈕承澤昨日也有到場，他表示：「後台一團混亂，突然看到一個花花女子（指嘉玲）在旁邊，問她待到甚麼時候也沒說，再打電話給她吧。」 撰文：林妃
20110305-8,20110305,8,三太稱賭王狀態幾好,三太稱賭王狀態幾好 賭王何鴻燊入養和醫院休養了接近兩星期，前晚由三太陳婉珍通宵照顧賭王，她到昨日下午離開時，並談到賭王狀態，她表示：「幾好。」問三太官司進展時，她即收起笑容隨即離開。另外，被賭王點名指不合作的二房兩名女兒超瓊及超鳳亦相繼於下午四時多現身，之後超蕸也有前來探望父親。
20110305-9,20110305,9,孫紅雷吻金喜善燃三角戀,孫紅雷吻金喜善燃三角戀 由孫紅雷、金喜善、吳鎮宇等主演的戰爭電影《戰國》將於下月15日上映，影片前日在北京舉行官網啟動儀式，一眾主角都有撐場。 曾私訂終身 電影中，孫紅雷演大軍事家孫臏，金喜善演龐涓的妻子，而景甜則演田忌的女兒田夕，三人會有一段複雜的感情瓜葛。電影未上映，金喜善與景甜前日就爭寵，令孫紅雷不知所措。 孫紅雷先輕吻景甜手背，再吻金喜善手背，孫紅雷說：「孫臏和田夕彼此喜歡，但孫臏和龐妃小時私訂過終身，交換了信物。但20多年重遇後，物是人非，不僅不記得兩人盟約，信物也忘了。這是非常現實又很殘酷的。」 撰文：林妃
20110305-10,20110305,10,林敏驄爆粗否認遭投訴,林敏驄爆粗否認遭投訴 林敏驄昨在亞視錄影節目，嘉賓司馬燕笑指他不會從後擁抱人，只攬o靚模，阿驄聞言即攬司馬燕，更笑言要洗手。對於有報道指A.Lin等o靚模錄影後向亞視投訴阿驄，阿驄爆粗否認：「X街雜誌老作，黐線，冇投訴，我光明正大。」他還重提攬周秀娜一事：「我點到即止，都唔係攬，俾個hug佢，係西方社交禮儀，同埋因為當時有一陣怪風，我保護佢。」
20110305-11,20110305,11,關仁隱事：「好曳」口多撩女得罪人 - 關仁,關仁隱事：「好曳」口多撩女得罪人 - 關仁 人紅唔紅除咗條命生成之外，本身待人處事亦都有好大影響。話說早前惹上官非嘅「好曳」，喺呢個圈撈極都撈唔起，其實都有原因。 場面尷尬 有個朋友同關仁講，話好曳份人口臭到極，話說有次呢位朋友同幾位女性朋友去咗一間夜店消遣，幾個後生女正經人家係着得性感少少。佢哋入到去撞到好曳喺度，好曳望咗一眼就大大聲咁對住班妹妹仔講「我哋冇叫到小姐喎！」搞到個場面非常尷尬，好曳講完仲好鬼得戚，佢身邊啲朋友想撳都撳唔住。 Textby　關仁
20110305-12,20110305,12,大炳再涉吸毒隨時入獄,大炳再涉吸毒隨時入獄 台灣藝人大炳又再涉吸毒被捕！前晚板橋地檢署兵分11路，前往毒販住處搜索，意外發現大炳在場，大炳看到警方衝進門時神情緊張，並不斷喃喃自語說：「完蛋了！怎麼會這樣！」台灣警方在該處搜出手槍、子彈和毒品。 低頭啜泣 大炳聲稱是找友人聊天，否認吸毒，不過，當問他是否同意讓警方驗尿？大炳卻低頭啜泣，情緒轉趨失控，但仍哭喊：「我沒有吸，只是找他們聊天而已！」大炳的尿液樣本昨早已送往板橋地檢署，他離開警局前仍堅稱沒吸毒及清白。 現年35歲、原名余炳賢的大炳，過往曾三次涉吸毒被捕，每次都聲淚俱下並誓神劈願高呼「洗心革面」及「告別毒品」。檢方表示，第四次犯吸毒的刑責比第三次犯重得多，若大炳今次被確定吸毒，隨時要面臨監禁。大炳被捕消息傳出後，演藝圈無不同聲譴責，白冰冰批評道：「他已不值得同情，別說大家不給他機會，他自己有沒有給自己機會？」 撰文：林妃
20110305-13,20110305,13,遊日遇港人特別避忌馮仁昭四圍超：周子駒孖同性密友浸溫泉 - 馮仁昭,遊日遇港人特別避忌 馮仁昭四圍超：周子駒孖同性密友浸溫泉 - 馮仁昭 無綫節目主持周子駒（Cyrus）雖然多次被傳媒影到佢同鄭伊健女友蒙嘉慧行街食飯，但馮仁昭聽聞佢哋其實只係「好姊妹」關係，而周子駒身邊都有一位感情唔錯嘅同性密友。 好似早幾日咁，有讀者同馮仁昭報料，話上個月喺北海道二世古撞見Cyrus同個光頭外籍同性密友去度假。讀者話第一日見Cyrus身邊有男有女，所以初初覺得冇乜特別。 不過，之後幾日讀者都係撞見周子駒同個光頭朋友一齊，其中一次周子駒發現有香港人喺現場時，仲即刻好避忌咁同個光頭朋友彈開，又好機警咁不時四圍望，似乎好怕被人認到咁款。另外，讀者又喺二世古先後撞見謝天華、傅明憲同樂基兒。由於之前有傳樂基兒大肚，但既然佢去得滑雪，咁就應該唔係大肚啦。 「因為冇着衫」 噚日馮仁昭打電話問番周子駒，佢話上個月同成班朋友去二世古滑雪，問到佢見到香港人時顯得好避忌，佢就話：「唯一避忌嘅時候，係我浸溫泉嘅時候，因為冇着衫，聽到一班人講中文，我話shit，我又唔係完美肌膚，如果有六嚿腹肌就冇所謂啦。我諗避忌係浸溫泉，其他時候冇，我哋咁大班人！」
20110305-14,20110305,14,關仁隱事：「甜甜」扮阿姐命令導演 - 關仁,關仁隱事：「甜甜」扮阿姐命令導演 - 關仁 向來洗腳唔抹腳嘅「甜甜」，最終又要出番嚟拍戲搵錢，而且瘋狂咁叫價，好多片商都話佢開成千萬片酬，真係癲咗，最慘又有一啲唔理成本嘅片商照俾，搞亂個市。不過，甜甜最近拍「過氣導演」部戲真係欺人太甚，竟然每日喺現場要導演點拍點拍，有日導演要先拍晒內地大姐「高興」嘅戲，然後放佢走，點知甜甜話唔得，要先拍咗佢嘅戲先。導演唔理佢，結果佢唔到場開工，導演私下同圈中人呻話，未見過咁冇演員道德嘅演員，以後唔會再搵佢合作。 Textby　關仁
20110305-15,20110305,15,馮仁昭四圍超：王祖藍想去悉尼度蜜月 - 馮仁昭,馮仁昭四圍超：王祖藍想去悉尼度蜜月 - 馮仁昭 王祖藍噚日出席喺電視城舉行嘅《現代塵世美》記者會，祖藍話：「今次去咗悉尼9日，可以話係寓工作於娛樂，因為下半年工作排得密麻麻，所以咪當旅行。」祖藍話今次仲搵埋阿媽做阿四，又問埋度蜜月嘅資料，於是問佢係咪好事近？佢笑住話：「就算唔係佢（李亞男）都要結婚o架，問定先啫！」佢仲話喺節目，除咗講吓讀書嘅生活，同埋爸爸嘅事外，梗係唔少得對女友嘅愛的宣言。
20110305-16,20110305,16,關仁隱事：「賽跑」TB服侍玩斷背 - 關仁,關仁隱事：「賽跑」TB服侍玩斷背 - 關仁 唔少女藝人因為感情上遇到挫折，例如遇到愛情騙子或者花心蘿蔔，令佢哋對男性失晒信心，轉而投向同性懷抱發展斷背情。不過，公仔箱新紮姐仔「賽跑」就例外，佢唔係畀仔飛，事業發展又順利，但關仁聽聞佢最近同一位TB朋友行得好埋，個TB對賽跑簡直無微不至，唔少人成日見到個TB管接管送，賽跑拍外景時又專登走去探班，簡直好過男朋友對女朋友，所以好多人懷疑佢哋關係非一般。 Textby　關仁
20110305-17,20110305,17,封嘴睇Dior騷心情沉重范冰冰素服告別Galliano,封嘴睇Dior騷心情沉重 范冰冰素服告別Galliano 【巴黎直擊】法國超級名牌Dior前晚在巴黎舉行2011年秋冬騷，沒有了主帥JohnGalliano謝幕更成為矚目焦點。中國第一美人范冰冰更成為亞洲區唯一VIP嘉賓，一身東方復古打扮的冰冰戴上黑紗太陽眼鏡cool爆造型，預告不接受訪問，全程顯得沉默，以哀傷心情告別因失言辱罵猶太人被炒魷的主帥JohnGalliano的lastshow。 法國超級名牌Dior前晚（巴黎時間3月4日下午兩點半）在巴黎羅丹博物館舉行2011年度的秋冬時裝騷，皆因主帥JohnGalliano早前失言辱罵猶太人言論被炒魷，這場沒有他謝幕的「告別騷」，成為全球時裝潮人關心的焦點，逼爆會場。 復古打扮搶鏡 Dior騷一向是大星的必睇騷，一如過往吸引不少中外名人赴會，當中包括中國第一美人范冰冰，俄羅斯超模NataliaVodianova，法國女星VanessaParadis胞妹AlyssobParadis等。 剛完成《觀音山》內地宣傳的范冰冰，身穿品牌「簽名式」的白色barjacket配黑色半截裙示人，加上一副黑紗太陽眼鏡，復古味濃。 冰冰雖一身「素服」打扮，仍然吸引中外傳媒追訪，但公關一早預告她不會接受傳媒訪問。 中國名模行騷 作為JohnGalliano服務Dior長達15年的lastshow，這個以70年代波希米亞民族風做主題的時裝騷，中國火紅模特兒劉雯，秦舒培及孫菲菲都有份行騷，繼續有Galliano簽名式的bias-cut剪裁連身裙，其他設計有隆冬調子的絲絨大衣，cashmere質料的公主大褸等，到透視雪紡的sheerdress，美不勝收。 採訪：梁錦貞　攝影：葉君海
20110305-18,20110305,18,馮仁昭四圍超：三太預告賭王下周出院 - 馮仁昭,馮仁昭四圍超：三太預告賭王下周出院 - 馮仁昭 賭王何鴻燊喺養和留院已一個禮拜有多，暫時唔使舟車勞頓去巡各房；反而每日有各房輪流照顧，噚日初時無乜動靜，到晚上七點半，先見三太陳婉珍出勤，問佢賭王幾時出院，三太就話：「應該下個禮拜。」此外，超儀老友杜如風噚日出席代言手機嘅發佈會，講到超儀最近俾家事煩擾，佢話超儀有同佢呻過：「佢開頭真係好嬲，成日呻好煩，我知家何生身體、精神都OK。」
20110305-19,20110305,19,林敏驄幫搞全裸婚禮,林敏驄幫搞全裸婚禮 鄭秀文和許志安復合斷正，安仔波友林敏驄昨午也在微博以抵死文筆留言，自稱大八公的他在安仔去年生日時已說：「祝你求婚成功，不怪我們常常按你死穴，為的是看看你聽見Sam（Sammi）這名字時甜甜的笑容，Sam：我同安仔踢波見到佢眼裏面有你呀！上帝同佢都等緊你咋。」 打油詩祝賀 當林敏驄昨日得悉Sammi和安仔撐枱腳，即作了首打油詩：「水廁安（許志安）在安水廁，甲骨文（鄭秀文）愛聞甲骨，甜甜蜜蜜探芝髀，水柱甲骨在一起，商量Fun事卯兒戲，全裸婚奶耀世紀，喜上加喜，實左廚房碟過期鹵味……攪鬥棚骨有身紀。」又搞笑要為二人安排全裸婚禮，並選址在「菲洲好旺國鎖埋門裙島沙灘對開草叢近印尼嗎里島太平館後門」，他又笑言：「一分耕耘，送一粒乳暈，兩分耕耘，送埋鄭秀文。」 採訪：比華利
20110305-20,20110305,20,馮仁昭四圍超：方中信針灸醫炒車腫腳 - 馮仁昭,馮仁昭四圍超：方中信針灸醫炒車腫腳 - 馮仁昭 方中信前日駕駛25萬嘅名牌電單車出巡，不慎發生意外，電單車翻側傷咗佢隻右腳，佢噚日就喺微博上載咗一張腳腫腫嘅相，上面仲插咗十幾支針，相信係佢傷後接受針灸治療，佢老婆莫可欣當然好擔心，可欣噚日喺電話講：「睇咗跌打醫生，聽日仲要返內地拍廣告，我都叫咗佢小心啲。」
20110305-21,20110305,21,莊思明擺明單戀陳司翰,莊思明擺明單戀陳司翰 莊思明與張繼聰、張秀文等前晚於君悅酒店出席「仁濟醫院周年慈善餐舞會2011」，莊思明早前被拍得與陳慧琳胞弟陳司翰約會食飯，她前晚否認二人拍拖，並說：「好朋友囉。」有否發展機會？莊思明說：「唔知，唔係睇我，睇人哋。」意即神女有心，但陳司翰似已有女友？莊思明說：「我認識佢時，佢冇女友。」她大讚陳高大威猛，雖有聽聞陳曾對女友動粗，但她說：「佢對個個都好gentleman，嗰日報道出咗，佢都有send畀我睇。」她強調現時大家只當對方是朋友。 張繼聰撐食屎論 張繼聰談到老婆謝安琪之前接受訪問指傳媒報道讀者愛看的新聞，謝又說：「如果你生個細路出來，佢話好鍾意食屎，你係咪畀屎佢食？」對此張繼聰說：「每個人講嘅說話，聽嘅人可能聽到唔同意思，有自己唔同睇法，希望社會多啲包容。」 採訪：張俊銘　攝影：陳俊強
20110305-22,20110305,22,馮仁昭四圍超：可嵐痛4個鐘產7磅子 - 馮仁昭,馮仁昭四圍超：可嵐痛4個鐘產7磅子 - 馮仁昭 前歌手可嵐前晚入養和，結果自然分娩生咗個仔。可嵐透過微博直擊自己嘅生仔過程，連未冲凉嘅BB相都貼出嚟與眾分享，佢仲留言：「陣痛係好痛，全自然的，整個催生至生產過程用咗四個半鐘，但用力就push咗半個鐘，連醫生都估唔到咁快。」噚日佢仲開心透露乖仔有7.2磅，中文名叫尤俊，英文名就叫Eugene。
20110305-23,20110305,23,馬詩慧嫌6千蚊唔夠買袋,馬詩慧嫌6千蚊唔夠買袋 馬詩慧昨日現身沙田新城市廣場，以名模星級導遊指點自由行旅客購物扮靚心得。自言是師奶的她表示愛精打細算，更透露在家中她與大女同樣受惠政府派六千元的福利，她說：「我會捐啲畀慈善機構，個女就佢自己使番，六千蚊唔係太多，買個袋都未必夠。」 家人被整蠱 早前有報館收到匿名報料指馬詩慧父親欠債，她指純屬惡搞：「唔係大件事，好詭異，佢都唔喺度好耐，我幾歲大佢已經唔喺度，如果啲人要玩，咪繼續玩。」問到她的母親是否知道此事，她表示：「我唔知佢睇唔睇到呢個報道。」 此外，馬詩慧透露大女在美留學生活愉快：「佢仲成日喺網上搵番我哋喺香港見報嘅相畀我哋，好似好享受生活。」 採訪，攝影：顏英儀
