key,date,article_daily_id,title,text
20110708-0,20110708,0,亞視前晚搶先報喪　日本報章昨晨出死訊號外新華社昨午出稿闢謠　江澤民死去活來,亞視前晚搶先報喪　日本報章昨晨出死訊號外 新華社昨午出稿闢謠　江澤民死去活來 【本報訊】中共前總書記江澤民「逝世」為昨日全球熱話。由前晚到昨日中午短短18小時，由本港亞視率先全球獨家報道江「病逝」，到昨日早上日本《產經新聞》印發號外指江因膀胱癌在北京301醫院去世，再到同日中午官方新華社突然發佈英文電訊稿闢謠，江死去活來的消息，讓人摸不着頭腦，究竟中共領導層發生甚麼事？空穴來風，未必無因，各界正試圖揭開這個謎團。中國組 正當全球關注江澤民的「死訊」時，昨午12點12分，官方新華社突然打破沉默，引述權威消息人士指：「部份海外媒體最近報道有關江澤民因病去世的消息『純屬謠言』。」緊接下午1點32分，半官方的中新社發佈與新華社內容相若的中文訊息，同一時間中通社則發佈中聯辦有關部門負責人，譴責亞視前晚的報道「毫無事實依據、純屬造謠，對香港亞洲電視這種嚴重違反新聞職業操守的行為表示極大憤慨」。江死去活來劇情的峯迴路轉，近年罕見。 以往發喪時間不逾24小時 有北京消息人士稱，江澤民病逝的傳聞近日在中、港兩地鬧得沸沸揚揚，但官方到昨日才出面闢謠，關鍵在於日本著名的《產經新聞》昨早上近10時印發號外，發佈江病逝的消息。外交部和中宣部等部門認為事態嚴重，中央不得不要求新華社出面闢謠，以正視聽。在昨日外交部舉行的記者會上，面對記者三次的相關提問，其新聞發言人洪磊都未有正面回應，只表示新華社已發表相關消息，再沒有新的補充。 此外，香港眾媒體瘋傳江澤民死訊，部份更把江當死人版處理，令北京當局十分不滿，要求中聯辦出面譴責「罪魁禍首」亞視，以儆效尤。 「與老毛（澤東）和老鄧（小平）相比，江算甚麼？我個人認為中央秘不發喪的機會不大。之所以外界對江的死訊深信不疑，可能與發放消息的人判斷失誤有關，需知『死』的定義有不同」。曾在北京中央黨報任職的傳媒人表示，毛和鄧兩位中共舉足輕重的領導人，他們的發喪時間都不超過24小時，江何德何能超過兩人。不過，他說按目前的氣氛來看，可以證明江已病入膏肓，「他在醫學上也許已死亡，但非我們常人認知的死亡。也許中央有關部門和江的家人希望能作最後努力。不過，就算江現在沒死，相信亦距離死亡不遠」。 江病情永遠最大核心機密 於對新華社昨引述權威消息，而不讓江澤民露面？中新社前記者高瑜對大紀元表示，這是中方害怕老百姓知道江的病情，「現在是瞞病不瞞死，我沒死，就可以闢謠，我到底甚麼情況，老百姓不需要知道，江的病情永遠是中共最核心，最大的核心機密」。她認為，今次江無論死不死，對中共政權以及現任領導人都是一個撼動。 現年84歲的江澤民，已退位多年，但其影響力猶在.中共九常委中，除胡錦濤和溫家寶外，吳邦國、賈慶林、李長春、習近平、賀國強和周永康均被視為江派人馬，加上明年中共十八大舉行，因此其健康狀況一直被受外界關注。 本月1日中共建黨90周年大會，第三代領導人全國人大前委員長李鵬、全國政協前主席李瑞環和前總理朱鎔基，就連94歲高齡的政治局前常委宋平也有出席，惟獨老江缺席，隨即引起揣測，指江病危，甚至死亡。更有傳聞指中共正陷入權鬥，對江的死訊密而不宣云云。 昨日，除日本媒體「勇」字當頭，宣佈江澤民「死訊」外，西方媒體如美國《時代》網路版、《華爾街日報》和加拿大多倫多《環球郵報》等均以傳聞的形式報道。對於江何以在短短18小時「起死回生」的謎團，相信只有中南海知曉。
20110708-1,20110708,1,500人排隊搶購限量版人偶,"500人排隊 搶購限量版人偶 【本報訊】動漫電玩節將於本月29日開鑼，廠商紛紛推出限量產品，成為青年人暑假搵快錢良機。一家廠商推出3款動漫節限量版人偶（Figure），昨供VIP會員預訂，引起大批青少年輪購，高峯時人龍逾500人，2,400個限額數小時內火速訂滿，部份僅需付500元定金的定單，隨即在網上以近4,000元放售，利潤高達7倍。 動漫節開幕後取貨 掀起訂購潮的玩具廠商HotToys是國際知名的人偶生產商，以造工精巧細緻見稱，限量產品常被炒賣。是次動漫節限量版12吋人偶共3款，包括鐵甲奇俠2（IronMan2）、鐵血戰士2（Predator2）及蝙蝠俠（Batman），各推出800個，每個訂購價1,380元，買家每款限買一個，每個定金500元，餘數在動漫節開幕後取貨時支付。 廠商安排VIP會員在昨日起至21日到旺角西洋菜南街兆萬中心一間玩具店預訂。據負責人林先生說，昨凌晨1時許收舖離開時已見5至6人通宵排隊，至昨午高峯時人龍約有500人，幸秩序良好，因大部份人均用盡3個訂購限額，結果2,400個限額在數小時內火速訂滿。 「炒單」利潤達七倍 排隊的饒先生是Figure迷，家中有一間房用作收藏人偶，他說這次會花4,140元買齊3款，「出面炒到幾多錢我唔理，我只係買嚟收藏」。人龍中亦有中年阿嬸，記者問她「係咪買Figure」，她說：「乜話？呢啲我唔識喎！」 雖然預訂者貨未到手，但在雅虎拍賣網，昨晚已出現「炒單」情況，如同「炒期貨」。其中一張蝙蝠俠的定單，昨晚9時已有30次叫價，炒至3,400元。另外，有鐵血戰士定單則開價3,980元放售，暫未見承價，但若成交的話，賣方扣除500元定金，將淨賺3,480元，利潤達7倍。買方則要在收貨時付880元尾數，即最終要花4,860元才買到手，是原價的3.5倍。"
20110708-2,20110708,2,刊江死訊山東網站遭查處,刊江死訊山東網站遭查處 【本報訊】亞視在周三（6日）因全球率先獨家報道「江澤民逝世」而遭中聯辦譴責後，內地官方的山東新聞網，當日也因搶先全國一步推出悼念江澤民的網頁，餘波未了。當地消息指，北京有關當局對該新聞網違規之舉十分震怒，下令山東省有關當局查處；該新聞網從出事當日被下令關閉，迄今未能恢復。 有關編輯已停職 有山東新聞從業人士透露，根據中宣部和國務院新聞辦指令，山東省委宣傳部正對山東新聞網因推出「悼念江澤民」網頁的「政治事件」進行調查，網站負責人及有關編輯已被停職，不排除有人要被處分，「現在網站已完全停止運作，何時恢復要等通知」。 據悉，山東新聞網在出事之初曾對外辯稱，有關江的網頁並非網站所為，而是遭人「惡搞」。但消息人士指，其實內地不少新聞門戶網站都因應近期的傳聞，主動策劃並準備好江澤民去世的報道專版，只等一旦當局宣佈即可放出，懷疑山東新聞網因搶閘不當，惹上麻煩。 周三海內外盛傳江澤民逝世時，山東新聞網曾將首頁改成悼念版，以粗黑框加白字標出「敬愛的江澤民同志永垂不朽」悼念語，配上江半身的照片，並設置多個悼念欄目，成內地唯一公開報道「江死訊」的官方媒體。但官方一直未證實死訊。稍後該網即告關閉，迄今無法登入。 山東新聞網創辦於1997年，是山東省、也是內地最早的新聞網站之一。網站宣稱經國務院新聞辦批准成立，具有獨立新聞採編資格（內地規定網站不能自行採訪新聞），由山東省政府新聞辦公室主管，山東省記者協會主辦，是山東省委宣傳部、外宣辦確定的省委、省政府重要資訊發佈平台。
20110708-3,20110708,3,迪士尼下月加價14%,迪士尼下月加價14% 【本報訊】迪士尼樂園將於8月1日起加價，門票料會由350元加至約400元，加幅達14%，高於海洋公園剛公佈加幅12%。新票價更「大細超」，香港市民可延遲至12月才需付新價，但旅客須下月「即磅」加價飛才可入場。立法會議員及旅遊界不滿迪士尼未完成擴建已加價，又批評「大細超」票價歧視旅客，造成混亂。 長者票價或調低 消息指，樂園兩、三個月前已放風會加價，理由是通脹下營運支出日高，料最快今日公佈詳情。樂園現成人門票為350元，據稱樂園本有意調高至逾400元，但業界反對：「400蚊呢個關口唔可以過。」因此，樂園新門票料為395元至400元，399元機會極大，加幅約14%。 小童門票加幅相若，但65歲或以上長者票有機會調低，是樂園首次有部份門票減價。不過，65歲或以上人士現時可免費遊海洋公園。新票價下月實施時，樂園同時會推出優惠，市民購票只需付舊價，變相延遲減價，優惠期估計至年底，「可能12月頭、聖誕前就開始要畀新價」。 旅客方面，樂園只讓旅行社年底前仍以舊價購票，受惠的多為旅行團團友；但旅客即場或上網買門票，並沒此優惠，下月起須付新價，受影響的主要自由行客，而現時內地客逾60%為自由行。樂園09年提高平日票價至350元時，也有類似安排，遭旅遊業界狠批「大細超」歧視旅客。迪士尼發言人稱會盡快公佈門票事宜。 旅議會：變相趕客 旅遊業議會主席胡兆英認為，內地團仍只將海洋公園列入行程表，迪士尼只屬自選行程，迪士尼加價，會再拉遠與海洋公園票價距離，變相趕客。他又不滿門票設「鴛鴦價」，對中外旅客都不公平。 立法會議員李華明理解樂園營運成本上升，但加價始終加重市民負擔，「有優惠期畀市民都係好嘅，咁旅客尤其內地人，人民幣升咁多，畀貴啲都負擔到嘅」。 迪士尼8月1日新門票 成人 現價：350元　估計新價：395元至400元 小童（3至11歲） 現價：250元　估計新價：280元至285元 長者（65歲或以上） 現價：170元　估計新價：或會下調 註：本港市民獲優惠，最遲至12月才需付新票價 資料來源：消息人士
20110708-4,20110708,4,配合大運會　40警郵船搜黑漢,配合大運會　40警郵船搜黑漢 【本報訊】深圳下月舉行第26屆世界大學生運動會（簡稱「大運會」），粵港澳三地進行「雷霆一一」反黑、反罪惡洗太平地行動一浪接一浪。本港警方打擊早前鬧雙胞胎坐館權爭的黑幫和安樂（俗稱水房），有組織罪案及三合會調查科（俗稱O記）昨手持黑名單，登上尖沙嘴中港碼頭一艘郵船搜查，以圖打擊幫中元老「高佬發」。 今屆大運會將於8月12日在深圳市舉行，粵港澳三地警方近期接連採行動打擊黑社會活動，避免影響大運會舉行。本港警方則針對打擊近月因坐館權爭引發江湖風雨的黑幫水房。消息指水房前任坐館「肥威」不肯卸任，與今年4月上任新坐館「子鳳」互鬥，兩派人馬先後爆發刑毀餐廳、搗亂尖沙嘴集美郵輪公司案，更公然在油麻地及旺角晒馬展示實力。警方事後拘捕捲入權爭的幫中元老「高佬發」及他力撐連任的前坐館「肥威」，指兩人率眾到旺角一家麻雀館「晒馬」。 圖打擊水房「高佬發」 昨午5時，40多名O記及水警重案組探員，分別到尖沙嘴中港碼頭及離境大堂搜查。探員手持黑名單在一艘郵船搜尋目標人物，據知該船上的叠碼仔全由水房元老「高佬發」操控，警方高調巡查，意在打擊「高佬發」。 同時，另一批探員又在中港碼頭離境大堂搜查登上郵船乘客。昨日調查行動歷時4小時，至晚上9時許探員才收隊離去。消息稱，行動中警方未拘捕任何目標黑人物，但在截查身份證時拘捕一名涉及其他案件的通緝犯。 據悉，警方近日密切監視兩派人馬，並掃蕩雙方勢力範圍趕絕其收入，迫使雙方平息糾紛。
20110708-5,20110708,5,醫生話：輕微中暑會肚痛頭痛,醫生話：輕微中暑會肚痛頭痛 電話回收街檔老闆蘇先生說，要日飲最少六罐啤酒消暑，揚言「當水飲，唔飲唔舒服」。家庭醫生關嘉美表示，啤酒消暑的觀念大錯特錯，因酒精容易令人脫水，會越飲越渴兼感到越來越熱，反而增加中暑的機會。 宜喝電解質飲品 天時暑熱，關嘉美稱近日不少市民都可能出現輕微的中暑迹象，體溫達38℃至39℃，並有肚痛或頭痛病徵，有市民更會小腿抽筋，「如果核心體溫超過（攝氏）40度，會猝死」。 關嘉美建議市民多飲含電解質的飲品，「唔好飲蒸餾水，要飲一茶匙鹽加500毫升開水」，而且要先吃早餐才外出，空肚則不要喝凍飲，並盡量穿着淺色鬆身衣物，不要酗酒及避免喝咖啡；長者要避免喝凍飲，以免影響心臟健康。 《蘋果》記者
20110708-6,20110708,6,扎鐵工唞大氣後猝死,扎鐵工唞大氣後猝死 【本報訊】天文台昨日連續第五天發出酷熱天氣警告，大埔一個住宅地盤發生工人疑中暑猝死意外。一名工人在地盤單位內工作期間，疑因天氣炎熱「唞大氣」後突然暈倒，同事懷疑他中暑報警，惜送院後死亡。 死者姓李（49歲），扎鐵工人，育有妻子及一對子女，一家四口居於東涌逸東邨居逸樓一單位。李為家中經濟支柱，仍要供養年邁雙親。 肇事現場非戶外 現場為吐露港公路白石角一個住宅地盤。昨日中午12時許，天文台仍發出酷熱天氣警告，大埔區錄得氣溫達攝氏32度。當時李與一班工人在地盤一幢大廈的四樓進行扎鐵工作。消息稱，雖然現場非在戶外，但工作環境仍然很熱。 有工人表示，一班工友埋首工作期間，突然見到李突然「唞大氣」並暈倒地上昏迷，同事見狀懷疑他中暑報警。 救護員到場前，地盤一名安全主任一直為事主進行心外壓急救，惜送抵醫院後證實死亡。死者的妻子與女兒及多名親友接通知趕抵醫院，妻子傷心哭泣，要親友安慰。 香港建造業總工會從建造業關愛基金中，向死者家屬提供10萬元恩恤金，有關地盤的大判及二判亦答允向死者家屬發放合共13萬元恩恤金。 屯門急症室顧問醫生馮顯達表示，工人可能在炎熱天氣下中暑導致心臟病發，但真正死因有待法醫官驗屍後確定。 另外，昨午2時許，一名外籍男子在西貢大浪西灣行山期間疑中暑不適，報警後由直升機送院。
20110708-7,20110708,7,視帝自願收友情價　五花旦難推騷「陳志雲要求　一定要放行」,"視帝自願收友情價　五花旦難推騷 「陳志雲要求　一定要放行」 《志雲涉貪案》【本報訊】無綫電視業務總經理陳志雲涉貪案第10日審訊，有份演出涉案除夕倒數活動的視帝黎耀祥到區域法院作供。他聲稱自願以友情價受聘，沒有人強迫或向他施壓。控辯雙方亦決定不傳召五名無綫女藝人，改為庭上宣讀證供。其中出席陳志雲新書簽名會的佘詩曼供詞透露，活動沒有酬金，本來不想參加，但因提出要求的是陳志雲，不能推卻。當時正與她趕拍劇集的監製梅小青向她指出「係陳志雲親自要求，我一定要放你去」。　記者：楊家樂 視帝黎耀祥供稱，不清楚陳志雲與叢培崑的關係，只記得約於09年初在一個公開場合聽見陳指「叢培崑係我嘅經理人」，而叢則回應「陳志雲先至係我老細」。黎盛讚叢「上進、照顧藝人好周到」，亦指叢善於搞活動。 09年11月，無綫綜藝科及叢先後聯絡黎耀祥，邀請他出席除夕夜在奧海城舉行的倒數活動。由於綜藝科同事表明無綫不會支付出鏡費，黎估計酬金由叢負責，遂安排身為其經理人的太太梁耀蓮洽談。 佘詩曼被陳兩度徵召 黎太後來直指酬金偏低，惟夫妻商量後，決定以2萬元接下工作，比平時活動酬金至少4萬至5萬元為低。肯收友情價，是因曾與叢多次合作，「冇人迫使或畀壓力我去參與」。演出後叢即時出糧，將四個利是封交給黎太，每個內有5,000元現金。至去年2月的陳志雲新書簽名會，黎為支持陳而不收費出席。被問到是誰邀請，他謂：「邊個搵我呀……其實我唔係好記得喇。」 另外，控辯雙方昨日終同意不傳召五名無綫女藝人上庭作供，改為宣讀各人的供詞。五人同指陳沒有施壓要她們出席新書簽名會，但佘詩曼、陳敏之及楊思琦均表明，假若活動涉及商業性質，除非是無綫節目或為支持陳志雲，否則不會不收費參與。除陳敏之及陳倩揚外，其餘都不認識叢。 已離巢的佘詩曼，供詞指她曾被陳兩度徵召，07年要她出席《志雲飯局》，但忘記有沒有酬金；去年2月，當時她正趕拍劇集《公主駕到》，陳叫該劇監製梅小青度期讓佘出席新書簽名會，梅向佘謂「因為係陳志雲親自要求，我一定要放你去」，但並無酬勞。 佘一直以為活動是無綫節目，直至去年2月7日活動後始知有珠寶商贊助。她只收到一本陳志雲新書、一隻錶和鑽石。佘坦言沒有酬勞不想出席，但因是陳提出要求，「冇得推卻」，更謂「如果唔係陳生要求，我一定唔會出席」。 楊思琦以為是無綫騷 楊思琦則指，一直交由經理人接洽外間工作，她亦以為新書簽名會是無綫節目，故沒有查問酬金。楊怡指出，去年1月出席台慶得獎藝員晚宴，席間陳邀多名藝員替簽名會撐場，並即場替楊怡拍下宣傳片。楊怡明知沒報酬，但鑑於活動屬慈善性質及為表支持陳，答應出席。惟她不知活動有贊助商。 此外，陳的前秘書楊慧中繼續作供。她指叢於電郵通訊中會稱陳為DearMaster（親愛的師父），自稱Mentee（徒弟）。陳大部份外間工作由思潮接洽，不過無綫的外事部及營業部等部門均不時轉介外間活動及客戶予陳。楊又指陳會要求她將出席外間活動的紀錄存檔。惟她只跟進活動安排，並不清楚陳有否向上司正式申報，只知陳曾將部份紀錄副本送交上司陳禎祥或李寶安，例如09年獲利甚豐的《志雲飯局》舞台版，陳以電郵向當時上司陳禎祥滙報。 案件編號：DCCC1214/10 視帝與五花旦騷錢及供詞重點 黎耀祥 出騷價：4萬至5萬元 供詞重點：陳志雲曾向黎耀祥介紹指叢培崑是他經理人，而在場的叢培崑表示陳志雲才是老闆 佘詩曼 出騷價：至少4萬元，如有catwalk或唱歌表演要調高 供詞重點：陳志雲新書簽名會無付酬勞，她不想去，礙於陳志雲要她去，難以推卻 楊思琦 出騷價：未有透露 供詞重點：楊思琦指，如知活動屬商業性質，並非為陳志雲宣傳，又無騷錢，她不會出席 楊怡 出騷價：4萬至5萬元 供詞重點：梁乃鵬去年1月為台慶得獎藝員設晚宴，陳志雲邀多名藝員撐場，並即時替楊怡拍宣傳片，楊怡即場答應出席陳志雲的新書發佈會 陳倩揚 出騷價：8,000至2.2萬元 供詞重點：陳倩揚指，作為新人，無論公司或外間工作，她不太計較酬勞，只要檔期能遷就便盡量出席，以增加工作機會 陳敏之 出騷價：3萬至4萬元 供詞重點：陳敏之稱，如她知活動非宣傳陳志雲新書，不是無綫節目，又無騷錢，便不會出席 資料來源：藝員供詞 今日預告 控方將傳召曾與新濠天地接洽的無綫員工"
20110708-8,20110708,8,特稿黎耀祥戴眼鏡扮斯文,特稿 黎耀祥戴眼鏡扮斯文 平日出騷閒閒哋收4萬元的「視帝」黎耀祥昨在法庭白等一天，僅收300多元證人費。但視帝依然表現專業，昨在庭上全程「Chok樣」，以斯文形象淡定作供。對於自陳志雲涉貪案開審，他的名字便經常在港聞版出現，他感覺「錯愕」、「好驚」。當被問及除夕騷僅收2萬元而陳志雲卻收11.2萬元，他即時尷尬笑稱「唔係好方便講嘅」，還寄望陳志雲大步檻過。 律師講嘢慢過拍劇 黎耀祥昨早11時許到庭候命，被安排在證人室呆等，直至下午近3時始被傳召作供。法庭將一份文件誤作供詞給他參考，他立即察覺，非常醒目。他作供時緊握雙手，正襟危坐，目不斜視。作供完畢，他立刻掃視法庭，找出陳志雲蹤影，向對方點頭微笑，陳志雲亦報以招牌燦爛笑容。 架上黑框眼鏡的黎耀祥，離庭後被記者踢爆扮斯文。他笑稱，自己有近視，但的確是為了看來「斯文啲」而戴眼鏡，西裝亦揀較不誇張的。拍過無數法庭戲，但是首次踏足法庭，他笑說：「我估唔到個法庭咁細，我哋個廠大好多，同埋律師講嘢好慢，如果我哋講得咁慢會俾導演話，之後有機會拍法庭戲，對我都有幫助。」 黎耀祥表示，他上庭前曾在公司及活動中碰見陳志雲，大家照舊打招呼，他亦會問候對方幾句。他說：「我哋係工作上夥伴、同事，私底下無特別交情，咁大個人都明白，但係當然希望佢冇事，我不嬲話佢係一個電視界好有才華嘅人，我都係知咩講咩！」他平日將出騷事宜全交太太處理，少理收費，萬估不到因出騷而涉官非。當被問及除夕騷僅收2萬元而陳志雲卻收11.2萬元，他即時彈起，尷尬笑稱：「唔好講啦，唔係好方便講嘅。」 《蘋果》記者
20110708-9,20110708,9,陳志雲四年賺百萬外快,陳志雲四年賺百萬外快 【本報訊】究竟陳志雲一年「賺外快」會有幾多？控方昨在庭上抖出陳志雲前秘書的兩個絕密檔案，顯示陳於05至09年四年間，單計其中15個項目收費，已達113萬元。陳志雲09年向當時上司陳禎祥申請，參與春天劇團主辦的《志雲飯局liveonstage》舞台版，演出三晚，每晚出場費達5.6萬元。春天賺170萬元，他再獲分紅兩成。 秘書代為報稅 控方將一個被列作證物的黃色文件夾交給陳志雲前秘書楊慧中（圖）查看，該文件夾上貼有「outsidejob（外間工作）」標貼，當中有31份涉陳志雲於05至09年接外間工作的文件。據主控官向楊讀出其中15項外面節目演出，四年來收費已達113萬元。其中陳於09年4月27至29日獲贊助將《志雲飯局》搬上舞台，他獲利尤見豐厚。 楊慧中另指，她會以日曆簿及電腦紀錄為基礎，替陳志雲報稅。09年廉署採取拘捕行動前，她便將陳志雲09年度參加的45項外間工作紀錄詳情，紀錄入電腦表格，準備替陳志雲報稅。據悉，當中只有11項已填收入。因表格尚未完成，故未能計出該年涉外間工作的收入。被問及為何表格尚未完成，楊笑稱「我日日有時間就會做，未做完，做緊途中你哋（指廉署人員）已經上咗嚟」。
20110708-10,20110708,10,進退失據慘成炮灰工聯會告御狀,進退失據 慘成炮灰工聯會告御狀 22萬人7.1上街令政府急煞停表決替補方案，也令一眾力撐如期表決的建制派議員臨陣轉軚，更令他們被外界狠批是「橡皮圖章」。一直死撐政府的工聯會議員黃國健昨日終於忍不住發難，力數政府朝令夕改連累建制派，又揚言日後支持政府前都要「諗清楚」。工聯會會長鄭耀棠更暗示會趁周日訪京，向中央打特區政府的「大報告」。 「支持政府要諗清楚」 工聯會一直表態支持替補方案，但政府修訂以至押後表決，令工聯會進退失據淪為「政治炮灰」。這個時候，工聯會會長鄭耀棠透露，他將連同該會幾名港區人大代表及全國政協委員，包括黃國健、陳婉嫻及林淑儀等人，於周日上京與國務院港澳辦官員會面，此行會就香港政制、下屆特首條件以至食物安全等議題與中方交換意見，但未知主任王光亞是否接見，至於工聯會會否趁今次機會向港澳辦打「小告報」，批評政府推銷替補機制進退失據，鄭耀棠笑言：「咩小報告呀？我哋打大報告。」 另一名有份上京的工聯會議員黃國健，明顯對港府處理替補機制的手法十分不滿，昨日狠批政府做法有問題：「政府點能夠咁樣？朝令夕改、臨陣退縮！我哋以後認真要考慮清楚，日後支持佢（港府）都要諗清楚。」他續說：「我唔係勞氣，呢個係事實，我相信好多人（建制議員）喺心裏面咁諗，冇講出嚟啫！」 對於專業會議議員梁美芬因在替補機制上立場搖擺不定，遭各界圍剿，名聲掃地，黃國健表示同情之餘，不點名指梁美芬也是被政府拖累：「我覺得工聯會唔慘，但有啲人好慘，支持咗佢（政府）嘅人真好慘！」 《蘋果》記者
