key,date,article_daily_id,title,text
20110522-0,20110522,0,昔日窮到冇飯開　今朝富貴逼人來行運阿星買樓結婚,"昔日窮到冇飯開　今朝富貴逼人來 行運阿星買樓結婚 【本報訊】香港首名自願高調曝光的六合彩頭獎得主、土生土長的印度人SinghJagpal用純正廣東話自我介紹：「我叫阿星！」父母雙亡、在港舉目無親、曾經窮到冇飯開，一張彩票改寫了阿星的命運，他昨晨已致電馬會登記，明日真正成為4,450萬彩金得主。他坦言：「我仲未諗到點用呢筆錢，不過會先買樓同結婚，但我仍然會繼續做跟車工人。」 記者：馬耀文、劉柏麟、卓永強 阿星的父母40多年前由印度來港生活，相繼去世後留下北角馬寶道一個正被地產商收購的唐樓小單位給他，阿星現時與幾名同鄉同住。32歲的阿星，在筲箕灣一間印刷公司做跟車送貨工人，月入9,000餘元。前日放工，他與同鄉飲完啤酒後回家，晚上7時許行經住所對面的馬會投注站時，見到大排長龍，從來沒有買過六合彩的阿星，突然興起「買張玩吓」的念頭，從此改變了他的一生。 阿星「求其」劃了四注單式，花了40元買了人生第一張六合彩。當晚9時半，他在家中看着電視直播核對六合彩攪珠結果，料不到果真一夜發達。阿星興奮得立即與同住的同鄉跑到樓下投注站，即場拍照留念，其後再將相片和中獎的喜悅放上facebook公諸於世。 天生兔唇　小時候被取笑 與阿星由細玩大的老友Jimmy透露，阿星身世頗為坎坷，他自幼家貧，父母要打幾份工才夠生活，父親當年做看更，母親則在大型洗衣場工作。約四、五年前，阿星的父母短時間內相繼去世，阿星的哥哥赴英國結婚定居，留下阿星在港舉目無親，孤伶伶的他其後招呼同鄉回家同住，才不致太寂寞。 Jimmy說，阿星自出娘胎就有兔唇（裂顎）問題，小時候情況很嚴重，上唇「裂開成條罅」，因而「漏風」口齒不清，其後做過多次手術，現在情況已有明顯改善。兔唇令阿星自小成為同學們的取笑對象，幸而他天生樂觀，並沒顯得太介懷。 「唔做嘢會好悶」繼續跟車 阿星讀書成績一般，中學畢業後又沒有甚麼技能，只能做跟車等散工。自父母去世後，阿星經常沒工開，「成日喺條街度撞到佢，冇嘢做四圍踱，都幾慘o架」。由於沒有收入，在阿星最艱難的日子，間中會「冇錢開飯」，要向同鄉兄弟借錢度日，至近月才找到跟車的工作，生活總算好一點。誰知苦盡甘來，一夜之間成為千萬富翁，同鄉都替他高興，相信他會回報曾幫助他度過難關的好兄弟。 昨日早上，阿星已致電馬會登記，並約定了明日（周一）到馬會領取彩金。阿星和未婚妻及幾名同鄉昨晨落樓再次行經馬寶道投注站，隨即被記者認出截住採訪。他大方的與記者談話，並說已向公司請了假，周二才上班。他說：「我會繼續做跟車工人，唔做嘢會好悶。」並準備提早與女友結婚。 同鄉雀躍「返印度起皇宮」 阿星表示前晚已致電告知身在外地的兄姊他中彩的喜訊，他們都開心到跳起，着他回鄉探親。阿星謂暫時仍未想到如何運用這筆橫財，不過旁邊的同鄉起哄大叫：「返印度起皇宮！」他只是淡淡的說：「買樓啦！」不過女友就比他有計劃，「第一會買樓，跟住搞結婚，同埋做生意」。阿星一行人事後匆匆離開，說要先去吃喝玩樂，「食印度餐慶祝」。信奉錫克教的阿星表示，會將部份獎金做善事。 本港印度社群對於阿星成為六合彩頭獎幸運兒感到非常興奮，不少人說很替阿星高興，亦有人擔心他太高調，最終會自招麻煩。 網民 「有啲酸」「恭喜晒」 「中咗獎未領都咁張揚，果然印度國情同香港唔一樣，希望遲啲唔好喺失蹤人口檔案度發現佢。」 「係你嘅，自然係你中，使乜期期買？使乜又拖膽又複式？幸運兒處女下海40蚊已經搞掂啦！恭喜晒印度先生。」 「中國人中咗會擔心人哋猴住佢啲錢，外國人中咗會同別人分享喜悅。」 「係有啲酸，不過點都好過比蝗蟲中，人哋（阿星）綜援都唔攞。」 「佢呢吓醒呀，係人都知佢中咗，如果有人偷咗佢張飛去拿都唔得。」 「吸引移民香港的最好宣傳，應找佢頂驃叔個位拍《新富貴逼人》。」 「佢會唔會有生命危險？」 「恭喜晒？人哋係土生土長香港人，對香港嘅貢獻都唔少，香港呢啲少數族裔受到咁多歧視，生活比正常人艱難。」"
20110522-1,20110522,1,曾話攞正牌　昨屈記者花架當簷篷劉皇發終認僭建：咪拆囉,曾話攞正牌　昨屈記者花架當簷篷 劉皇發終認僭建：咪拆囉 【本報訊】身兼鄉議局理順新界鄉村屋宇僭建物工作小組召集人的行政會議成員劉皇發，其青山灣物業天佑居被指有僭建物。劉皇發起初轉移視線，表示該處花架「攞正牌」搭建。屋宇署回覆本報證實天佑居庭園存在僭建物，劉皇發昨日又改口承認有僭建，反指記者錯誤理解他的說話。 記者：蔡元貴　林俊謙 本報上周接獲讀者舉報，指劉皇發位於屯門青山灣天佑居的物業，有僭建物。記者從天佑居外圍所見，共六幢的獨立屋，其中一幢的地面一層，明顯多出了一座小玻璃屋，作晾衫擋雨之用。記者於上周二趁劉皇發出席鄉議局會議時向他查詢，他當時迴避了該玻璃屋的問題，只說天佑居內的一個花架，已「攞正牌」取得屋宇署批准，而且每年繳交七至八千元費用。 屋宇署視察指違例 屋宇署至前天晚上才回覆本報，發言人稱，該署人員已前往視察，發現天佑居庭園建有若干違例搭建物。屋宇署表示，該部門會按照發展局局長林鄭月娥本月18日在立法會上公佈有關新界村屋的處理方法處理，並根據《建築物條例》採取適當行動。 劉皇發被屋宇署踢爆之後，昨日又抵賴。他接受記者電話查詢時說：「你哋查到咪賣（刊登）囉，我之前係話花園嘅花架攞正牌，唔係話個簷篷。個簷篷冇攞牌，屋宇署話違例咪拆囉，呢啲嘢全港都有o架喇。」記者向屋宇署跟進查詢，該部門針對天佑居的僭建物有何行動，未有回覆。 鄉紳倡按緩急處理 天佑居六幢獨立屋都是由LWFCompanyLtd持有，董事包括劉皇發本人、其女劉麗華及劉玉蓮、其子劉業強及劉業光等。劉皇發過往參選時，註冊住址都是使用天佑居。劉皇發昨日上午出席自由黨北區辦事處開幕活動時，大批記者守候希望採訪，他抵達時已耍手擰頭表明不接受訪問，離去時更刻意避開記者。 新界鄉事勢力則繼續發表不滿政府針對村屋僭建的言論，十八鄉委會主席梁福元昨日接受港台訪問時表示，新界的鄉村屋及丁屋佔全港僭建物一成，認為當局應該理順全港僭建物問題，把違規建築規範化。梁福元又稱，認同新界村屋不容有特權，但市區的僭建物風險較高，建議當局應按緩急處理，又稱相信新界原居民會理性解決村屋僭建物問題。
20110522-2,20110522,2,安全　美觀　不阻街理順小組3條件保僭建,安全　美觀　不阻街 理順小組3條件保僭建 【本報訊】將與政府就新界僭建問題談判的鄉議局理順小組成員侯志強，向政府發出警告，若草率拆除僭建物，「係咪想搞到世界大亂，搞到好似伊拉克咁？」他又向政府開出3大條件，政府讓符合無結構性安全、美觀和不妨礙行人通路的僭建物繼續存在。 贊同流血革命言論 侯志強昨日出席一個公開活動後，回應有關新界村屋及丁屋僭建問題時指，僭建問題屬全港性，政府若只在新界區清拆僭建物，是對新界人不公，「任你邊個局長嚟拆，都要拆60年，你無理由排我哋第一名拆先，排我哋60名先至拆，得唔得？」 他說個人絕對支持鄉議局委員曾樹和早前聲言新界人為保產業，不惜發動「流血革命」的言論，認為反映不少新界人心聲。他又指，鄉議局有人太過軟弱，「樣樣都話以和為貴，和氣生財，有啲嘢你唔企出嚟係唔得」。 侯志強反駁有人要求透過立法，即時清拆新界僭建物的說法，「你派幾萬個職員嚟拆屋都拆唔掂啦，用60年做嘅嘢，一兩年拆唔拆得晒先？所以有啲人猛咁逼政府都冇用」。他又指，不少新界人居住的地方屬「舊屋地」，並無限制建築樓層數目，「政府係無例可依，無法可執」。
20110522-3,20110522,3,地產代理有責任解釋業權,地產代理有責任解釋業權 【本報訊】謝女士買舖變買牆，到底責任誰屬？熟悉房屋事務的立法會議員李永達表示，今次的買賣過程「非常詭異」，因為美聯物業的代理有職責向買賣雙方解釋清楚涉及的業權是甚麼，並指今次事件中，謝女士只購買了外牆的業權，「店舖」的佔地其實係公眾地方，根本是非法佔用土地。 李永達說，地產代理監管局應調查今次涉事的地產經紀，因為他有責任向買賣雙方解釋涉及的業權是甚麼。他直指今次事件中地產代理已令謝女士受到損失，「如果佢知道買嘅係一幅牆，大家用常理諗都知一定唔會用510萬去買一幅牆啦」。 李永達解釋，事件中的「店舖」位於大廈的「商場公眾地方」，即任何人都無權買賣該土地業權，「家謝女士只係買咗幅牆，所謂嘅店舖用地其實係非法侵佔公共空間，因為塊地根本無賣到」。 李永達又提到，這種情況就像20多年前不少地產代理賣天台屋，「當時佢哋其實只係買咗天台屋塊地，間屋係僭建物無賣到，但當時好多買家都以為自己擁有天台屋同塊地。」
20110522-4,20110522,4,濫用司法論「無向法庭施壓意思」曾蔭權失言　黃仁龍補鑊,濫用司法論「無向法庭施壓意思」 曾蔭權失言　黃仁龍補鑊 【本報訊】特首曾蔭權選擇性引用市民意見，質疑港珠澳大橋司法覆核有人濫用司法程序，激起本港兩大律師會罕有地聯手狠批，政府昨日派出律政司司長黃仁龍代為解畫，辯稱曾蔭權當日只是指出社會有意見認為個別人士濫用司法程序，無表示過他贊同這些意見，強調特首完全無意批評法庭或向法庭施壓。有前高官和立法會議員認為政府的回應相當牽強，當日與特首激辯的公民黨黨魁梁家傑力促曾蔭權就言論誤導市民公開道歉。 香港律師會和大律師公會前晚發表聯署聲明，炮轟曾蔭權對仍進行司法程序的案件作評論並不恰當，強調本港法院有程序及多種措施防止濫用司法程序後，一直低調、甚少評論時事的律政司司長黃仁龍昨日出席資深大律師委任典禮後，即主動回應事件。黃仁龍表示，政府很多時都會打官司，包括司法覆核，「就算我們輸了官司，即使情況嚴重，我們都必須尊重法院的判決，如果我們一日未上訴（成功），我們都會根據法院的判決做事」。 黃仁龍接着說，就傳媒報道個別人士有否濫用（司法）程序一事，「特首只是指出社會上有這樣的意見，他表示他並沒有說過贊同這些意見，所以我很相信當中完全沒有任何對法庭批評或對法庭施壓的意思」。 環境局局長邱騰華昨日亦為曾蔭權失言一事降溫，拒絕評論是否有人濫用司法，但指任何人都可就政府的決定提出訴訟。 梁家傑促曾蔭權道歉 公民黨梁家傑批評，黃仁龍昨日的辯解相當牽強，只想為曾蔭權日前失言「補鑊」，他認為曾蔭權應就言論誤導公眾公開道歉。公務員事務局前局長王永平亦批評，曾蔭權透過引述市民意見，質疑有人濫用司法程序的言論不恰當，「雖然曾蔭權話只係引述市民意見，但畀人印象係佢同意呢啲意見，如果佢唔同意，引述嚟做乜？點解唔見佢引述啲認為司法覆核無問題嘅意見？」
20110522-5,20110522,5,假日訪銅鑼灣中心　搭要付3元外傭組織：擺明針對,假日訪銅鑼灣中心　搭要付3元 外傭組織：擺明針對 【本報訊】「搭收3蚊？」聽來不可思議，但銅鑼灣中心每逢周日都會向訪客收取3元「搭費」。大廈業主立案法團解釋，為紓緩每逢假日都被外傭「逼爆」升降機的情況，決定本月開始每逢周日及公眾假期向外來訪客一律收取3元「搭費」。有外傭組織批評這個做法擺明針對外傭，「點解香港人會咁對外傭？」 記者：梁德倫 位於銅鑼灣糖街的銅鑼灣中心，近年有多家以外傭為對象的商店及外傭中介公司進駐，每逢周日都有大批外傭前往。 根據大廈的通告，該廈業主立案法團為紓緩逼爆情況，今年3月29日的業主大會上，決定5月1日開始，每逢周日及公眾假期都向所有外來訪客收取每人3元「搭費」，並聲明此為「行政費」，因大量訪客逢周日使用該廈升降機加重用電量，並指此舉是為應付升降機的保養維修費。 僅業戶及職員可獲豁免 記者昨日到現場觀察，發現該廈升降機大堂設有「關卡」，有大廈職員監視訪客出入，又貼出告示表明每次上落都要收取3元「行政費」，有效時間為中午12時至下午6時。記者昨日以市民身份嘗試進入大廈，即被職員查問到哪層商戶，又指明每位訪客不論是港人或外傭都要繳付3元才可入內，只有大廈的業戶及職員方獲豁免。 不過，有職員私下向記者解釋，今次做法主要針對外傭，因大廈內有多家外傭中介公司及專做外傭生意的店舖，過往每逢周日及公眾假期都有大量外傭到大廈聚頭甚至「打地鋪」，因此業主立案法團決定收取「搭費」以減少外傭出入；為免被指歧視，遂一視同仁向所有訪客收費。 法團趕客　業主「有得拗」 市民陳先生曾數度到訪該廈，他批評收取搭費擾民，「做乜要搞咁多嘢針對外傭呢？」 外傭組織KOTKIHO發言人Mia更批評，該廈做法不公道，「點解香港人會咁對外傭？」她又說，不少外傭假日到商廈內，除與親友聚會外，有時是想購買家鄉食品或上堂學電腦，又或是到中介公司處理合約等問題，「點解要剝削外傭呢？」 律師梁永鏗表示，該大廈的升降機屬私人地方，業主立案法團向使用升降機的訪客收費在法律上並無不妥。但他指出，若大廈內有小業主商戶不滿向訪客收費的決定，日後在法庭上「有得拗」，「因為佢哋打開門做生意，但法團嘅決定係趕客，可以拗到底收3蚊係咪真係合理嘅維修保養費用」。
20110522-6,20110522,6,親疏有別,親疏有別 【本報訊】特首曾蔭權日前與民建聯議員聯手，在立法會攻擊公民黨在港珠澳大橋環評問題上濫用司法程序，昨日透過其facebook賬戶，上載昨日邀請民建聯成員到粉嶺別墅燒烤午宴的照片，他指雙方宴會上「就着近期的熱門話題踴躍討論一番」。惟照片上載不足兩小時，即引來網民近百個劣評，其中不少市民狠批曾蔭權只宴請民建聯的做法親疏有別，同時浪費公帑，「你份工係負責影相同燒烤？」
20110522-7,20110522,7,香港大廈05年起收費,香港大廈05年起收費 【本報訊】有大廈業主立案法團收「入場費」並非新鮮事，早於05年，位於銅鑼灣怡和街的香港大廈，其法團便每逢周日收取10元的入場費，凡非業主或並非入內探訪住戶的人士，都要向法團繳交費用才可入內及乘搭升降機，此項收費維持六年至今仍未取消。 現只餘少量外傭公司 屬商住大廈的香港大廈過往曾開設多家以外傭為對象的商店及中介所，每逢周日便有以百計外傭出入。該大廈於05年底被傳媒踢爆，業主立案法團為阻外傭逼爆大廈，每逢周日都向商務訪客收取10元入場費，更聘請一名「啹喀」保安員在大門外看守出入情況。 記者昨日到香港大廈，發現收入場費之舉仍未取消，大門依然有啹喀保安守衞，並設有一個錢箱收錢，旁邊有職員負責找續。現場所見大廈內只剩下少量外傭公司，也沒有如銅鑼灣中心般有大量外傭出入。當記者以市民身份入內時，隨即有大廈職員上前查問去向，當報稱一個大廈內的住宅單位後便放行不用付費。職員又指，若訪客並非到訪大廈內的商戶，便不需繳交任何費用。
20110522-8,20110522,8,梁振英暗彈港府房屋政策倡增土地供應　資助巿民「上車」,梁振英暗彈港府房屋政策 倡增土地供應　資助巿民「上車」 【本報訊】日前公開表明對參選特首是抱「當仁不讓」心態的行政會議召集人梁振英，昨日應街工邀請「落區」出席街頭論壇大談房屋政策。當年有份制訂八萬五政策，他把推冧樓市歸咎金融風暴。他又暗彈曾蔭權政府，指近幾年若當局集中資源解決房屋問題，相信現時市民的生活一定會過得更好。 率先表態有意選特首的梁振英，昨日到葵芳邨出席街坊工友服務處住屋關注組的社區論壇。不少居民都不滿公屋輪候時間太長，制度也很多不合理，例如單身人士需要接受計分制評核來決定輪候時間的長短，有公屋住戶也指雙親離世後被房署迫遷至細單位。 梁振英認為，公屋輪候時間長與公營房屋供應量有關，他舉例近幾年新落成的公屋單位每年只得一萬多，與7、8年前每年2萬多個相距甚遠。他直認即使2014/15年度有1.8萬個公屋單位落成仍不足夠，「家係分之者寡、食之者眾，點搞都係有人認為唔公平」。 八萬五失策歸咎金融風暴 梁振英說，現時應從土地供應着手，近幾年公私營單位落成量減少是大勢所趨，「家我哋無咗填海，高度同密度都低咗」，他認為這些規劃問題全港市民都應參與討論。有街坊認為若當初八萬五政策成功，今天便不會有嚴重房屋問題；若政府肯聽民意，也不會有大批八十後、九十後上街。梁振英回應指，八萬五政策是當年評估公私營房屋市場需求後制訂，但遇上金融風暴卻是始料不及的事，但承認若近年政府肯投放資源解決房屋問題，市民生活必定更好，因為房屋現時已成為最嚴重的民生問題。 梁振英認同政府要擔當資助人角色，非以推低樓價至市民可承擔的購買力為止，而是在市民的購買力之上提供津貼讓他們可以「上車」。但他昨對參選特首一事完全封口不答，更指擔任公職多年一直喜歡落區聽市民意見，否則必與社會脫節。
20110522-9,20110522,9,藝團巡迴報哀音悼六四,藝團巡迴報哀音悼六四 【本報訊】六四事件22周年將至，藝術團體發起「報哀音」活動，本周起至6月4日三個星期五、六、日，巡迴港九新界多個地點，以街頭表演方式悼念六四死者，提醒香港人對這個國殤的日子，莫失莫忘。 「六四報哀音」活動由藝團「沒有製作」（NProduction）發起，昨晚在旺角街頭報哀音，唱出多首民運歌曲。「沒有製作」今日會到元朗廣場外報哀音，下周末則會到尖沙嘴及大埔等地點，6月4日當晚則會在銅鑼灣行人專區演唱。 發起這次報哀音活動的團體表示，他們是土生土長香港小市民，沒有政治背景，報哀音也沒有經濟利益，因此進行街頭活動也不畏懼及沒有包袱。他們表示報哀音是希望透過藝術文化，溫柔而堅持地悼念六四，為國家及香港盡一點力做一點事。 「沒有製作」以八九民運、武力鎮壓清場的歷史為藍本，去年上演《喂！趕住投胎呀？！》舞台劇，多場演出均爆滿，今年以「報哀音」形式哀悼六四死者。
20110522-10,20110522,10,刑毀大環山泳池長椅鐵馬沉池底,刑毀大環山泳池 長椅鐵馬沉池底 【本報訊】紅磡大環山游泳池揭發瘋狂式刑毀破壞事件。泳池職員昨晨返回當值時，竟發現有垃圾桶、長鐵椅，甚至鐵馬圍欄等重型物品被拋落主池、副池和跳水池內紊亂不堪，由於弄污泳池需要消毒清潔，整個上午被迫暫停服務，因天雨估計受影響泳客不多。警方經初步調查，相信有人趁深夜潛入泳池大肆搗亂破壞，動機未明。此類刑毀破壞泳池個案，近年來十分罕見。 現場是環海道大環山游泳池，第一節開放時段是上午6時半至中午12時。據泳池職員表示，前晚10時收池後未發現有異樣。 昨清晨6時許，康文署的泳池職員返抵當值，發現報告板、垃圾桶等物品不翼而飛，再看看露天主池、副池和跳水池池底，沉着一批泳池所屬物品，包括報告板、擦池清潔用具、垃圾桶、傘架、地氈、長鐵椅、鐵馬圍欄等，令人吃驚。池邊一些磚塊亦輕微受損，懷疑該批物品被拋入池內時曾撞擊致損毀。 上午停開以消毒 職員向上級報告後，由姓余50歲職員報案，警員到場調查，由於池水被物品弄污需要進行消毒，康文署遂貼出通告將第一節時間的泳池服務暫停。 部份游早水的泳客到達時才知泳池停用，非常失望。有人質疑是否泳池出了管理問題，有人則表示多年來首次聽聞這類缺德事件。 警方經過調查，列刑事毀壞案處理，懷疑有不法之徒在深夜時分潛入大環山游泳池內大肆搗亂，隨意將泳池物品拋入主池、副池和跳水池中洩憤。警方暫未能掌握違法者的犯案動機，至今未有人被捕。 康文署發言人證實有關事件，表示泳池停止服務後，已將該三個受影響的池進行清潔消毒，並在門口張貼告示通知泳客，處理好後便於下午1時30分重開服務。
20110522-11,20110522,11,港馬會台灣一鋪輸三億合資聯營運動博彩　連蝕兩年斬纜,"港馬會台灣一鋪輸三億 合資聯營運動博彩　連蝕兩年斬纜 【本報訊】剛締造了史上最高六合彩投注額紀錄的香港賽馬會，原來日前也締造了另一歷史性紀錄，就是首次「賭輸錢」。馬會年前擴大版圖，踏足台灣合資聯營運動博彩，但兩年來輸掉近3億元，數天前決定壯士斷臂。有立法會議員批評馬會不務正業，有挪用港人公益款項作賭注之嫌。記者：蔡元貴 馬會發言人稱，該機構在台灣投資的「運彩科技股份有限公司」業務已經在周三（本月18日）中止，原因是「基於經營條件大變，馬會已決定退出股東會，但繼續提供風險控管有關的支援服務」。台灣運彩營辦商富邦也於日前公佈，來自香港馬會的三名代表陳承楷（馬會投注事務執行總監）、李保祿（馬會財政事務執行總監）及鄧少華均已辭任運彩公司的董事會。 或違馬會最初成立目的 投資失利多少，馬會拒絕透露，發言人說：「你哋自己都搵到喇，台灣有《蘋果日報》o架嘛。」根據馬會09至10年度年報，運彩科技業績09年開始入賬，馬會先投資5億新台幣（港幣約1.3億元）作股本。2009年，聯營公司錄得港幣9,300萬元虧蝕，至2010年，再錄得1.98億元虧蝕。 一直以打擊非法賭博為名開賭的香港馬會，以「樂意與香港以外地區的獎券營辦機構分享獎券營運的經驗」為理由，2008年開始正式踏足台灣，業務是「就彩券的風險控管提供意見，並以股東形式合作」。換言之，馬會透過股權間在台灣開賭。 立法會民政事務委員會副主席甘乃威認為馬會在境外開賭並不恰當：「馬會成立嘅目的係乜？就係杜絕本地非法賭博同支援香港慈善業務，家走到去海外開賭，道德上已經唔恰當。」他質疑馬會在台灣投資及虧蝕的款項，是否已影響了公益撥款。甘乃威亦不滿民政事務局不聞不問，縱容馬會不務正業。 研究博彩業的澳門大學工商管理學院商業經濟學副教授蕭志成說，馬會在台灣經營博彩失利，很可能是台灣地下莊家太多而不受控，而且台灣政府對境外投資者限制太多。他對馬會向外發展持中立意見：「開拓海外市場係全球博彩業嘅趨勢，馬會如果可以喺海外賺錢，對本地公益事業都有好處。但係始終馬會嘅成立背景獨特，係唔係應該咁做，冇絕對答案。」 盈利不佳台方歸咎馬會 馬會涉足寶島博彩業務，一開始已被反對。馬會高層陳承楷2007年前往台灣與富邦簽署顧問合約時，富邦已被台灣傳媒批評「找中國人當打手」。過去一年，運彩經營不善的新聞一再見報。上月，運彩的保證盈餘未能達標，富邦高層歸咎馬會，表示當初誤信馬會的評估，以為運動彩券在台灣很有商機，導致今天苦果。"
