key,date,article_daily_id,title,text
20110407-0,20110407,0,來港風騷掃名牌潘霜霜呻恐怖被林峯嚇怕,來港風騷掃名牌 潘霜霜呻恐怖被林峯嚇怕 Chok爆王林峯去年搭上36D「浙江小舒淇」潘霜霜，二人暗交年多，甜蜜過後，計時炸彈連環爆發，兩人慾照在過去一個月陸續外流。戀情曝光後玩潛水的潘霜霜昨午風騷來港出巡銅鑼灣的卡地亞和LV等名店，並表示被林峯嚇怕。潘霜霜殺到，前晚在家鄉廈門表演後的林峯，昨日缺席在港的頒獎禮，看來霜峯戀為林峯帶來的陰影有排唔散。 霜峯戀上月中曝光，令chok爆的林峯有得震冇得瞓，他馬上斬纜挽留fans，但與潘霜霜的情慾床照仍繼續流出，林峯前晚避走家鄉廈門，昨日又缺席壹電視大獎頒獎典禮，反而潘霜霜日前卻風騷來港拍寫真，過去一個月贏盡人氣的她，昨日更到銅鑼灣卡地亞和LV等名店瘋狂掃貨，勝利出巡，這是她自霜峯戀曝光後首度在港露面。 稱不再聯絡林峯 昨午6時多，手持Chanel手袋的潘霜霜，在一男一女助手陪伴下現身銅鑼灣卡地亞血拼，其後又轉場到附近的LV，甩拖後的她身邊馬上有異性陪伴。問到潘霜霜來港可有找林峯，她回答：「不說。」可覺林峯對她不好，潘霜霜充耳不聞，到底二人還有聯繫嗎？潘霜霜斬釘截鐵：「不聯繫，不聯繫。」對於整容傳聞也不回應。 潘霜霜早前解釋遺失手機致慾照流出，其實她跟林峯到峇里預支蜜月的照片，隨時也會曝光，當記者追問潘霜霜可擔心還有照片流出時，她並沒回答，反要求記者不要追訪，她說：「你們不要追我，你們很累。」本報記者謂只想霜霜回答問題，她即掩嘴偷笑，其後不理穿上高跟鞋，在扶手電梯狂奔撇記者。 指自己是受害者 雖然有記者尾隨，但無減潘霜霜雅興，她先後到卡地亞和LV，再到D-mop買帽。潘霜霜昨晚玩轉鬧巿，除吸引傳媒追訪，又有途人圍觀，事後有人報警，但警方卻誤會發生打鬥，拿着盾牌到場，擾攘一輪。 潘霜霜掃貨後即到富豪飯堂富聲吃晚飯，她接受本報電話訪問時，堅稱自己也是受害者，她說：「再拍拖不敢找圈中男生，很恐怖，我去到那裏都給人追訪，不過現在事情已過去，我收拾心情，專心工作，不想再浪費時間和希望。」 潘霜霜與林峯的多張床照印證了這段地下情，女方知名度大大提高，慾照更是一波比一波激烈，奇招多多。她上周低調來港影寫真，準備胸降書展。潘霜霜的經理人林小姐昨日在電話中說：「霜霜6月會拍一部內地電影，她現在要調整一下，電影有動作部份，她現在每天都在學習，至於練甚麼功夫就要保密。」 林小姐否認潘霜霜的面孔和身材都曾整容，她堅稱：「有些網上照片是做了工夫，我不覺得她有任何變化。」 林峯缺席頒獎禮 潘霜霜昨日掃名店療情傷，失戀的林峯昨日雖在壹電視大獎中獲十大電視藝人第8名，主演的無綫劇集《談情說案》也獲十大電視節目，不過他卻龜縮缺席，他前晚則現身家鄉為廈門大學表演，又唱又跳，繼續chok爆冧粉絲。 採訪、攝影：比華利、楊浩賢、李志明、黃曉程
20110407-1,20110407,1,訪台變豪放女,訪台變豪放女 日本AV女優周防雪子日前到台灣宣傳《3D肉蒲團之極樂寶鑑》，其間她上節目時，豪放地跳上台灣男藝人宋少卿身上。周防雪子接受訪問時更說：「這次接拍電影《3D肉蒲團》，也是想向家人證明，除了拍AV之外，我可以做的更多。」 享受打真軍 據知周防雪子擅於在AV中演繹騎着男拍檔的性愛姿勢，尤其自豪天生纖腰和圓臀，她自信回應：「的確很多人都稱讚過我屁股的角度很漂亮，腰力很好。」 自稱單身的周防雪子表示拍戲要打真軍，每次都享受到性高潮：「我很幸運從出道以來，都是跟相當有名、技巧也很好的男優合作，在他們的帶領下，每一個男優都讓我很舒服、很投入，常常讓我忘了有攝影機的存在。」 撰文：葉雪
20110407-2,20110407,2,余文樂慘被蹧躓,余文樂慘被蹧躓 久未出碟的余文樂將於下周推出全新國語專輯，主打歌《不是明星》已派上台，並邀得好友張震嶽作曲填詞，日前樂仔拍攝新歌MV，找來籃球隊橫洲工業的八個好兄弟客串。 遭綑綁摸心口 樂仔笑言MV想表達男子頑皮搗蛋一面，故不適合找女主角。拍攝時樂仔並不好受，因為他慘被眾人五花大綁，最痛苦是他唱歌時，邊被隊友摸心口大髀兼被除衫，之後再遭人夾攻掟波，似乎是向樂仔大報復。 聽到導演滿意收貨，樂仔即大反擊，用粉末攻擊眾人，樂仔笑說：「好多謝隊友幫手拍MV，有一個鏡頭係話我哋一齊夾band，佢哋唔識玩音樂，但拍出嚟嘅效果好好。」 撰文：林妃
20110407-3,20110407,3,分燊家積怨未消超鳳、四太同場面左左,分燊家積怨未消 超鳳、四太同場面左左 賭王何鴻燊分燊家事件上月和平解決，有指各房姨太和賭王部份女兒卻因此互有心病，昨日保良局總理就職禮，四太梁安琪和二房女兒何超鳳同場，兩人顯得陌生，全程沒交流和傾偈，並各有各走。 賭王何鴻燊早前的分燊家事件，鬧到滿城風雨，何家內部更分成兩大派系，分別是賭王出面，四姨太梁安琪聯合長房的一方；另一方則是二房長女何超瓊及三姨太陳婉珍。 事件一度鬧上法庭，賭王控告女兒超瓊和超鳳，直至上月各房達成共識，和平解決家產分配，幾房的年輕子女表現得十分融洽，不過據悉其實幾位姨太和賭王部份女兒依然心生嫌隙。 冇偈傾分頭離開 昨日保良局新一屆董事局就職禮在銅鑼灣舉行，續任總理的四太梁安琪與何超鳳同場，兩人全程沒交流和傾偈，在台上合照時，兩人各企一方。儀式完成後，四太和超鳳分頭離開，超鳳和老公何志堅、妹妹超蕸一起走。 四太細女何超欣被人冒名開微博，更上載學校運動會的照片，四太說：「你哋問番佢啦，我唔清楚，我唔搞呢啲嘢，我咁保守，點識得做呢啲嘢。」會否要求超欣減少上網？她說：「細路仔好流行，學業為重。」 超蓮護妹妹超欣 三房細女何超蓮就在微博為妹妹開腔，強調超欣沒微博戶口，又安撫四房姊姊何超盈說：「別氣別氣…不要上她的當！我們這就是免費幫她賺人氣？這種人多的是…反正新浪也不會給她認證，我在這邊鄭重宣明：何超欣是沒有圍脖的！」 另外，有網友昨日在微博向超蓮舉報，指有人經常在facebook張揚跟超蓮很老友，又留言「何超蓮我愛你」，網友向超蓮指此人四處借她的名字招搖撞騙，超蓮聞言在微博澄清根本不認識此人，自己已很少玩fb，叮囑各人要小心。 採訪：王崇穎 攝影：陳慧安
20110407-4,20110407,4,陳敏之滿足撐無綫,陳敏之滿足撐無綫 近日不少藝員狂轟無綫工時長、人工少，不過總有人滿足現狀，陳敏之在無綫多年，她表示不會怕辛苦，最怕沒有工作。昨日敏之、高海寧和周家蔚等在銅鑼灣出席《飲食天王頒獎典禮2011》記者會，敏之說：「我想辛苦啲呀，我之前病咗想做冇得做，呢行冇辛苦邊有世間財，之後會有收成，係成正比。」 對於無綫被指刻薄，敏之力撐說：「我冇睇報道，人哋我唔理，最緊要係健康，之前都係捱壞咗，之後有機會都做唔到，所以我家做嘢同時會調理吓自己。」 同陳山聰疏離 敏之稍後會拍古裝劇《回到三國》，有機會跟好友陳山聰合作，她透露近日跟他很少聯絡，他是否掛着拍拖？敏之說：「我都想知，不過呢樣係人哋私事，畀空間佢解決。」 採訪：楊潔雯 攝影：陳慧安
20110407-5,20110407,5,劉璇結婚未必行禮,劉璇結婚未必行禮 劉璇早前替雜誌《大日子darizi》拍攝封面照，有璇美人之稱的她身形嬌小，穿上多層次的婚紗更顯線條美，她笑言是自己最性感的一次演繹。 仍在摸索事業 由體育界走到娛樂圈，劉璇近日拍攝無綫劇《女拳》，今年更會出唱片，她說：「從來沒想過會灌唱片，這可說是超乎自己的目標，由於仍在摸索階段，故不會限定自己只做哪幾類表演，十分珍惜演出機會。」 劉璇小時候對婚禮有憧憬，覺得要很隆重盛大，到今日才覺得結婚是兩個人的事，幸福更不該由一場婚禮去證明，她說：「拍戲有試過結婚，可是原來穿婚紗也頗複雜，我想當我真的很想去跟大家分享這個喜悅時，才決定是否舉行婚禮。」 撰文：李森
20110407-6,20110407,6,林敏驄被指抽水「有人博宣傳」,林敏驄被指抽水 「有人博宣傳」 林敏驄年初開始替亞視主持節目《智醒智勁四方城》，不少女嘉賓詐型被抽水，連周秀娜也被阿驄箍實纖腰。伴住阿驄主持節目的亞視新人譚杏藍（小花）早前在微博呻被阿驄欺負，有指她當時衝出影廠喊，阿驄昨對此無明火起向亞視要求換拍檔。 要求換拍檔 小花指曾被阿驄用手機高炒影胸，她2月時在微博說：「我以前唔出聲，因為我凡事以和為貴，又怕事！但今次EQ幾高，我都忍你唔到！我都有阿媽生o架！」有指另一女主持陳綺雯都是受害者，有指阿驄趁她坐低影髀罅。據悉為杜絕事件發生，亞視有意叮走阿驄。 阿驄昨在電話鬧爆說：「完全冇呢件事，係咪有人想博宣傳，借我上位搵錯人喇，搵林峯啦。我放得上微博啲相完全冇問題，唔好屈我，我都可以話畀阿媽聽。」他又說：「我啲朋友同王征好熟，亞視叮走我冇所謂，我唔恨做，反正佢哋畀晒錢我。」阿驄又彈小花和陳綺雯表現差：「我9號會再錄影，亞視一係換我，一係換佢哋，我唔想節目有啲搞事嘅人喺度。」 採訪：比華利
20110407-7,20110407,7,家英撐阿姐有理,家英撐阿姐有理 羅家英昨日在尖沙嘴文化中心出席第二屆中國戲曲節活動，其妻汪明荃早前炮轟與鄭少秋舉行演唱會期間，主辦單位分票不公，令其歌迷坐在較差的位置，問到家英哥可有逗阿姐開心？他說：「好難o架喎，要佢自己散發出嚟，應該冇乜問題嘅，其實我嗰日都有去，見佢喺台上講咗啲嘢又面黑黑都知佢有嘢。」 微博展示證據 家英哥又力撐阿姐，表示阿姐fans座位確是很側，他說：「我都知分票係難嘅，不過盡量公平啲囉，應該冇乜事嘅，遲啲都仲會去新加坡開騷。」他又強調阿姐會找齊證據，買賣門票所有紀錄也有保存下來：「丘生（丘亞葵）畀乜佢都有mark低，冇可能空口講白話。」 另外，阿姐昨日如家英哥所言把買賣門票的「證據」放上微博，再次表示不滿主辦單位的分票方法之餘，亦強調與拍檔鄭少秋沒任何不快。 採訪、攝影：文國駿
20110407-8,20110407,8,秋生拉二胡拜錯師,秋生拉二胡拜錯師 劉美君、黃秋生和盧冠廷等昨日到中環支持二胡樂手霍世潔的《爵士．胡情》專輯發佈會，秋生以學生身份到場，他自爆之前遇人不淑，學拉二胡三個月都拉不到聲音，他說：「啲聲拉出嚟好啞，不過跟咗霍老師之後，拉一堂就已經拉到聲。」 劉美君中西合璧 劉美君新碟中的歌曲《何去何從》邀請了霍老師拉二胡，她讚老師造詣勁，拉二胡揮灑自如，她說：「二胡雖然好多人拉到，但配合西樂運用就好少，老師好勁，可以令外國人聽吓，對中樂都有更深認識，對自己張碟中西合璧都覺得好正。」 此外，霍世潔接受訪問時透露新碟已籌備一年，她希望透過其專輯令更多人認識二胡音樂。 採訪：魯萍 攝影：陳慧安
20110407-9,20110407,9,鍾麗緹否認婚變,鍾麗緹否認婚變 現年40歲的鍾麗緹（Christy）去年為丈夫、台灣音樂人嚴錚生下幼女嚴紫凝（Cayla），囡囡轉眼已一歲多，Christy帶着與前夫育有的女兒Yasmine與嚴錚及兩名女兒，一家五口在北京生活。今年初她才被內地記者拍到嚴錚帶着Christy及幼女Cayla現身上海虹橋機場。不過昨日卻有人報料指Christy婚姻亮紅燈，有指是嚴錚愛蒲愛媾女，更有傳二人已分居。 微博留言外遊 Christy本周一在微博留言要出外旅行，她說：「外出旅遊，偷個懶，回來再好好工作。」記者昨日致電她的助手小維求證，她否認：「不會吧，她老公一齊很好，Christy跟朋友到了國外的小島旅行，老公沒同行，過兩天便回來，女兒們要上學，所以沒跟一齊去。」 採訪：可寧
20110407-10,20110407,10,離無綫火速登銀幕阿佘嫁小方易分難解,離無綫火速登銀幕 阿佘嫁小方易分難解 無綫吸金女王佘詩曼約滿後決定外闖，主力返內地拍劇和廣告賺人仔，而一向擅拍愛情小品的葉念琛亦捨棄愛將鄧麗欣，找阿佘夥拍方力申合演新戲。同時，雖然阿佘不想做無綫親生女，但仍獲厚待，其新劇即將推出，毋須變成倉底貨。 近年佘詩曼穩坐無綫一姐之位，其主演的劇集又有收視保證，而她一直受廣告商歡迎，最近才先後續約任代言人拍床上產品及內地飲品廣告，阿佘還將照片貼上微博狂晒。由於有價有市，有傳阿佘約滿無綫後決定外闖，只會跟無綫簽部頭約，以便有更大自由度讓她主力返內地拍劇及廣告賺人仔。 突破性演出 同時，阿佘最近亦被導演葉念琛中，找她夥拍方力申合演新戲，身處北京為電影《隱婚男女》宣傳的葉念琛昨接受電話訪問時直認，會找阿佘及小方在新片《人約離婚後》中演夫妻，他說：「呢套係結婚三部曲壓軸，第一套係《婚前試愛》跟住係《隱》片，今次一開場就講阿佘同小方離咗婚。」 葉續說，一直都想與不同演員合作，早前就有周秀娜及楊梓瑤，他說：「一直想同阿佘合作，新戲中佢會好有話題，仲有突破性演出，不過唔可以講住。」葉又說很久沒找鄧麗欣拍片，是因角色跟配搭的原因。 阿佘昨到尖沙嘴出席頒獎禮，對於馬德鐘老婆炮轟無綫制度沒人性，會否覺得自己走得快好世界？阿佘謂：「我唔了解件事，但做嘢邊有唔辛苦？冇不勞而獲，我冇抱怨，辛苦就梗，惟有頂硬上。」陳鍵鋒亦寸無綫出手低，阿佘說：「我就有得加薪，我同TVB會保持合作關係。TVB嘅工作時間係長少少，但近年調節，我拍劇平均每日都有六個鐘休息，反而內地拍劇要踩好長時間。」 新劇下月播 阿佘雖只跟無綫簽部頭約，但仍獲厚待，她和林峯主演的無綫新劇《花花世界花家姐》就獲安排下月16日推出，不用變成倉底貨。另外，小方與女友鄧麗欣合演新戲《宅男總動員》，小方以為會獲安排眾美女跟他拍談情戲，怎料導演卻要他拍動作鏡頭，幸好他跟同戲的黃又南學了幾招，結果都應付自如。 採訪：葉雪、何永寧、王崇穎 攝影：陳志嵐
20110407-11,20110407,11,AliceB.瞓身賭錢,AliceB.瞓身賭錢 最新一任「Canon女」AliceB.和吳嘉龍，前晚到跑馬地馬場行時裝騷，兩人首次同台即互送高帽，吳嘉龍笑言兩人都是「雜種」，故特別投緣，又讚AliceB.是超級靚女，她雖笑言不相信，但依然開心。 吳嘉龍自詡必贏 吳嘉龍又作狀拿出紙仔笑言有貼士，又自言逢賭必贏，AliceB.則說：「我會賭錢，但如果輸咗我會繼續賭落去，所以我都唔會賭太多。」 雖然吳嘉龍逢賭必贏，但他不喜歡去賭場，他說：「因為去賭場啲人都係搏殺，專注咁去賭錢，反而我鍾意同朋友去馬場，睇吓馬，飲吓啤酒傾吓偈。」 採訪：胡比 攝影：黃文偉
20110407-12,20110407,12,李嘉欣微博粉絲破千萬,李嘉欣微博粉絲破千萬 李嘉欣去年加入微博一族，與粉絲分享生活點滴，包括懷胎過程及生BB後的一舉一動。 獲贈蛋糕 去年11月，嘉欣再開通騰訊網的微博戶口，短短五個月，她的粉絲人數已突破一千萬，相當厲害。 網站昨日送上有1000萬字樣的蛋糕給嘉欣慶祝，嘉欣之後在微博留言：「哇哇哇！感激騰訊和所有留意M（Michele簡稱）的童鞋，通過這平台認識了很多朋友，一起分享生活經歷絕對是一件快事。」 撰文：林妃
20110407-13,20110407,13,丁子高遭舊女友寸孤寒,丁子高遭舊女友寸孤寒 丁子高與楊千嬅結婚前，曾跟圈中幾位女星傳過緋聞，其中一位是台灣女星丁小芹，近日她在台灣受訪時提起舊男友的種種，她雖沒指名道姓，不過一般相信講的是丁子高。 吃飯AA制 丁小芹說，以往與這位舊男友拍拖時，外出吃飯及玩樂都是AA制，有一次男友不見了一個水晶球，就賴是丁小芹取去，令丁小芹非常難堪。雖然丁小芹整段訪問中都沒提到所講男友是誰，但從種種暗示中，令人聯想到就是千嬅夫婿丁子高。之後記者聯絡千嬅的經理人公司查證，但公司沒有作回應。 撰文：葉雪
20110407-14,20110407,14,宣萱：無綫藝人最唔夠瞓,宣萱：無綫藝人最唔夠瞓 宣萱、張嘉兒和鄧健泓前晚到深水埗拍攝無綫新劇《飛虎》，宣萱自言還有一星期就拍畢《飛》劇戲份，由於有不少動作鏡頭，她自言男友十分擔心，她說：「有日拍我吊喺小巴後面嘅戲，男友覺得好危險，但自己就覺得好normal，不過都冇講畀父母知，費事佢哋擔心。自己拍咁耐都冇受傷，只係皮外傷，但家拍戲都錫身咗。」 每年續約 對於馬德鐘的太太在微博炮轟無綫，又指丈夫不夠時間休息，宣萱指這是無綫多年來的制度，自己已習慣，她說：「公司都會體諒我哋，但全世界得我哋係最唔夠瞓，day1已經知道。」她直言與無綫的合約還有9個月就約滿，她表示自己是每年續約。有傳不少花旦相繼不續約，她覺得每個case都不同。 採訪、攝影：魯萍
20110407-15,20110407,15,金喜善北京當娘家,金喜善北京當娘家 久違了的韓國靚媽金喜善前日在北京出席有份演出的電影《戰國》首映禮，同場還有日本男星中井貴一、孫紅雷和吳鎮宇等。 中井貴一和金喜善雖是配角，但仍賣力宣傳，並對內地環境一致讚好，中井貴一說中國已改變很多，他說：「從五年前我來拍片到今次，各方面都變得很好。」金喜善也大讚：「中國是我在韓國以外活動最多的地方，每次到北京都有回到娘家的感覺。」 甘做配角 記者問中井貴一和金喜善會否介意當配角？電影公司人員馬上以「我們不太喜歡這個問題」為由中斷發問，場面尷尬，不過金喜善就解圍說，當主角或配角也沒意見。 採訪、攝影：陶然婷
20110407-16,20110407,16,克勤抱恙獻唱悼亡友,克勤抱恙獻唱悼亡友 香港著名結他手JoeyVillanueva日前不幸離世，他生前先後和林子祥及杜麗莎等香港巨星合作，在娛圈亦人緣甚廣，前晚一眾歌手包括溫拿、林子祥、李克勤、張敬軒和潘迪華等出席在紅館舉行的JoeyV紀念演唱會，眾人輪流上台獻唱悼念JoeyV，場面感人。其中克勤聲帶不適，但他依然抱恙上陣，認真難得。 部份未能出席的歌手如劉德華和鄭秀文等，也預先錄影片段分享和JoeyV的點滴，在演唱會上播出。為紀念JoeyV這位出色的結他手，舞台上擺放了一支結他作裝飾，令觀眾一看到便想起這位傑出音樂人。 撰文：葉雪
20110407-17,20110407,17,馮仁昭四圍超：蘋果哈哈鏡,馮仁昭四圍超：蘋果哈哈鏡 簽約Chok親頸 鄭融噚日續約星娛樂，個妝梗係有咁行化得咁行，老闆薛嘉麟肯掟一千萬嚟谷佢做明日之后，又安排兩位大隻猛男大派香吻，咀到鄭融頭暈眼花，跟住雙眼迷離，連嘴都歪埋呀。 漏電落晒形 林峯呢排俾霜峯慾照搞到落晒形，前晚拍硬檔返母校廈門大學表演，24小時onchok功能突然失靈。講明先，呢張相自從峯峯升級2.0之後，應該都絕無僅有o架啦！ 做木嘴最強 全宇宙最好打又點吖，咪一樣逃唔過哈哈鏡！甄子丹噚日出席壹電視頒獎禮，着到官仔骨骨，但就失驚無神咬晒唇鼓起泡腮，唔知邊個得罪佢嘞。好彩丹爺都有修剪到鼻毛，加番少少分啦。 化妝冇樣睇 做得藝人，都預咗無時無刻補妝o架啦，不過楊怡噚日出席壹電視頒獎禮嗰陣，喺眾目睽睽之下補妝就感覺差啲。不過唔緊要啦，讀者嘅焦點應該會放喺第二度嘅。 不是星是蟹 齋睇呢張相，就知余文樂真係好重視佢隻新國語專輯。佢為咗拍《不是明星》MV，堂堂靚仔居然搞到俾人五花大綁，仲chok個衰樣俾大家任影唔嬲，好大犧牲啫！ 撰文：趙堯
20110407-18,20110407,18,揭林峯攰攰哋唔好性,揭林峯攰攰哋唔好性 「霜峯戀」越揭越多，潘霜霜日前更向雜誌大爆林峯床史，承認首次約會便在林峯家大床，她說：「兩個躺在床上聊天，聊了一個晚上，然後就抱着睡覺。」身材惹火的潘霜霜直認跟林峯有親密關係，她說：「他工作已經很累了，不是每次也要做那事。」 問林峯的床技可為潘霜霜帶來滿足感，她尷尬地說：「我還好呀。」愛情都是盲目，外間指潘霜霜的36D導彈胸是人工貨，她指林峯沒介意。拍拖期間，潘霜霜還貼心為男友買底褲，難怪林峯暱稱她為老婆。 樂易玲見過霜霜 霜峯戀收埋一年兩個月，潘霜霜爆曾遭無綫高層棒打鴛鴦，若二人不分手，林峯便被掟入雪櫃，林峯的富爸爸也非常反對他們交往。 談到該高層暗指無綫製作資源部總監樂易玲，她昨日在尖沙嘴出席頒獎禮時說：「講高層我只係其中一個，我哋係食過一次飯，但佢哋交往同私生活，我唔干涉，我有段時間留意到林峯情緒唔穩定，我勸佢要事業為重。」樂易玲表示這次是林峯昂貴經歷，那可信霜峯戀只在大床談心，樂易玲則說：「唔到我信唔信。」此外，同場曾與林峯傳緋聞的佘詩曼說：「愛一個人應該互相尊重，好嚟好去。」阿佘不信樂易玲刻意拆散兩人。 採訪：卓寶花、王崇穎 攝影：陳志嵐
20110407-19,20110407,19,馮仁昭四圍超：李安趕新戲工人墮地 - 馮仁昭,馮仁昭四圍超：李安趕新戲工人墮地 - 馮仁昭 導演李安正喺台中拍緊佢套新戲《少年Pi的奇幻漂流》（LifeofPi），但前日卻發生工業意外，一名49歲嘅工人喺3米高處墮地後腦受傷，現場工作人員為受傷工人急救後即送往醫院醫治，幸無大礙。陪同傷者送院嘅人員對事件發生經過三緘其口，只話：「不要問我，不然我會被處分！」意外發生後，拍攝現場保安嚴密。李安知道發生意外後，即交代電影公司跟進，仲要求拍攝現場加強安全意識。
20110407-20,20110407,20,劉心悠遇老外當街求婚,劉心悠遇老外當街求婚 劉心悠（Annie）昨日以一身新娘look，出席在旺角舉行的珠寶展擔任模特兒，大會安排一位外籍男模扮新郎，即場向Annie送上巨型心心及求婚，不過她笑言：「我真係等緊人求婚o架。」 Annie身上更佩戴過千萬的鑽飾，閃爆全場，難怪現場要有保安實。問到是否真的恨嫁？Annie表示只是講笑，直至現在緣份仍未出現。 認宅女曾抑鬱 有否追求者？Annie搞難gag說：「我冇跑喎，唔使追喇。」她又再次強調自己名副其實是宅女，平時只在家中靠上網和家人及朋友聊天。但會否擔心會有情緒病如抑鬱症？Annie直言：「初初嚟香港時真係似有少少咁症狀，不過後來習慣咗就冇事。」 採訪、攝影：卓寶花
20110407-21,20110407,21,Mr.跟校長上廣州,Mr.跟校長上廣州 樂隊Mr.早前已為紅色可口可樂錄製廣告歌，日前再接再厲為黑色可口可樂再錄製廣告歌，除了得到廣告商垂青外，亦得到軒尼詩再度邀請他們到澳門演出酒吧騷，明日他們更會隨校長譚詠麟到廣州開演唱會，認真忙個不停。 抱恙頂硬上 雖然主音Alan錄廣告歌當日抱病在身，但他頂硬上，並重新演繹大家耳熟能詳的歌曲《I'dLikeToTeachTheWorldToSing》。Alan說：「今次好高興能灌錄呢支廣告歌，一來呢首歌係陪住我成長，家交由我演繹實在好榮幸同充滿親切感。」撰文：林妃
