key,date,article_daily_id,title,text
20110407-203,20110407,203,財經速遞一拖首季收入增13%,財經速遞 一拖首季收入增13% ▲第一拖拉機（038）今年首季總收入38億元（人民幣．下同），按年增13%，惟原材料價格仍有上漲趨勢，不排除進行價格調整。董事長趙剡水昨表示，期望未來5年，大輪及中輪拖拉機產能由現時6.9萬台增至17萬台，大輪拖拉機市佔率由30%增至50%，中輪拖拉機則增至30%。公司今年資本開支增至約7億元，資金用作研發、擴產、投資新建設及海外併購。
20110407-204,20110407,204,財話短說中信泰富發債息最高8.25厘,財話短說 中信泰富發債息最高8.25厘 ▲外電引述消息稱，中信泰富（267）擬發行的10年期優先無擔保美元票據，收益率將定於約6.75厘，至於另一批永久美元債券的收益率則介乎8至8.25厘。該公司擬集資逾78億元，用於一般公司用途，包括債務再融資。
20110407-205,20110407,205,財經速遞永泰鎖定14億售樓收入,財經速遞 永泰鎖定14億售樓收入 ▲永泰地產（369）執行董事兼地產投資及發展董事總經理區慶麟表示，今年以來已鎖定14億元的售樓收入，未來希望進一步拓中、港的地產市場，集團對本月底推出招標及拍賣的三幅紅磡住宅地皮均感興趣，並會夥拍其他發展商一齊投地。區慶麟表示，夥拍嘉華（173）、信置（083）及南豐共同發展的大埔白石角項目，正申請預售樓花同意書，料年內可推售，有機會於明年入賬，而與南豐合作的上海商住項目則有望明年售樓。
20110407-206,20110407,206,財話短說比亞迪董事局無巴郡代表,財話短說 比亞迪董事局無巴郡代表 ▲比亞迪（1211）公佈，策略投資者巴郡的代表索科爾，由於已辭任巴郡職務，故已辭去該公司非執行董事職務。換言之，公司董事會暫時沒有巴郡代表。
20110407-207,20110407,207,財經速遞香港新能源擴容需2.8億,財經速遞 香港新能源擴容需2.8億 ▲香港新能源（987）自去年向母公司香港建設（190）購入其餘下風電資產之後，其風電裝機容量已經達到611兆瓦。 香港新能源董事總經理容伯強表示，公司未來將維持每年增加200兆瓦裝機容量的目標，按公司權益裝機容量約100兆瓦計算，預計所需的資金約2.8億元。
20110407-208,20110407,208,財經速遞中自化發優先票據還債,財經速遞 中自化發優先票據還債 ▲中國自動化（569）宣佈，集團建議發行於2016年到期以美元列值的優先票據，償還現有約8000萬美元的負債及包括潛在併購等的一般企業用途。評級機構穆迪給予Ba3的暫行評級，另標普則給予擬發行的優先票據「BB-」評級。
20110407-209,20110407,209,長和反對私有化數人頭指違一股一票原則　立會將諮詢,長和反對私有化數人頭 指違一股一票原則　立會將諮詢 【本報訊】立法會明日就《公司條例草案》舉行公聽會，其中和黃（013）罕有派出代表出席即場發表意見。和黃連同一批主要商會早前已提交意見書，反對政府保留上市公司私有化程序中「數人頭」的投票制度，又指並無必要將董事職責寫成法例。 記者：尹彥超 政府第一階段重寫公司法的條例草案，於1月提交立法會首讀後，立法會已成立審議委員會研究草案內容，由於內容複雜，議員提出於明日舉行公聽會諮詢各界意見。 中小企總會撐舊制 其中較具爭議的私有化投票數人頭制度，雖然在先前的諮詢中普遍意見認為應撤銷，但港府仍在草案中予以保留，認為可保障小股東，但會授權法院酌情權，可在適當情況下不採納數人頭的驗證程序。 今次除了和黃派人親身出席公聽會，同系長實（001）也遞交了書面意見，長和兩公司重申反對保留數人頭，認為有違「一股一票」原則，又指大量股東均以代名人或託管人形式持有，但這些代名人只有一票，未能反映實況。兩公司又指現行的收購合併守則已有機制，保障私有化過程中小股東的利益，反而政府提出授權法院可推翻數人頭的投票結果，不能解決分拆股份進行種票的問題。 除了長和兩公司外，主要商界組織包括香港總商會、銀行公會、地產建設商會和香港上市公司商會，均有提交意見書，大合奏呼籲取消數人頭制度。 不過條例亦有支持者，香港中小企業總會和東區區議員楊位醒提交意見，指制度對保障小投資者權益行之有效，而且不會對公司合理的私有化造成任何影響。 私有化投票數人頭的爭議，是源於2009年電盈（008）私有化過程中，被指有股東把股份分拆予大量人士，以便在股東會湊夠足夠支持人頭數目。 指毋須為董事職責立法 另外，和黃在意見書中質疑草案中納入董事職責為法例，包括「有責任以合理水平的謹慎、技巧及努力行事」，認為施加這些主觀準則，可能會令高質素及具經驗人士卻步，不願承擔公司董事職務。和黃指按普通法原則，以法庭判例形式規範董事職責較合適。 長和又指，草案規定上市公司以電子形式或在網站發佈文件時，要預留48小時待股東接收，但港交所（388）的《上市規則》並無規定，若要實行這些電子發放資訊形式將不被視為即時發佈，失卻資訊有效流通之效。 反對保留私有化投票數人頭的機構 ‧香港總商會 ‧香港上市公司商會 ‧香港地產建設商會 ‧長實 ‧和黃 ‧香港銀行公會 ‧中華廠商會 ‧香港特許秘書公會
20110407-210,20110407,210,爆升先兆A50溢價高A股看漲,爆升先兆 A50溢價高A股看漲 追蹤A股表現的A50中國（2823）近日交投再度活躍，昨更借A股衝破3000關，急彈逾2%跑贏A股。收巿報13.84元，較每股資產淨值（NAV）12.51元，有10.6%溢價。根據過去經驗，A50溢價更高，A股往後升勢越勁，可視作A股走向的一大指標。 溢價重上一成水平 A股屬半開放市場，外資最方便是透過A50等ETF基金曲線投資A股，而A50出現溢價或折讓，則某程度上意味外資及基金大戶對A股前景睇法，當睇好A股，他們願意以較高價買入，倘若睇淡，則會以低於NAV價錢博撈底或賤沽。參考過往A50溢價及折讓，往往對後市有先行指示作用。 一名對冲基金經理指，近日A50溢價重上一成水平，是外資對A股短期走勢樂觀的訊號，以去年9月底為例，A50溢價升越10%，滬綜指個半月內，竟由2700點狂飆至3100點樓上，升幅超過15%，無獨有偶，同期A50溢價亦由10%水平，升至近15%，因此近期A50溢價擴闊，對中資股絕對有益無壞，A股後市續升機會頗高。
20110407-211,20110407,211,理大林本利：要保本不如做定存工銀黃遠輝：注意兩地詞彙不同,理大林本利：要保本不如做定存 工銀黃遠輝：注意兩地詞彙不同 《專家評論》一直有在內地做人民幣定期存款的理工大學會計及金融學院副教授林本利表示，近期到內地銀行做定存時，未遇到銀行職員向他推介結構性存款產品。他指出，內地現時一般人民幣3個月定存利率可達2.85厘，連同加息及升值預期，回報約5厘，加上結構性產品到期時，利率有機會不能達標，「既然都係要保本，不如做定存。」 先睇清楚合約內容 對於有內地銀行職員向港客推銷結構存款產品，工銀亞洲董事兼副總經理黃遠輝表示，國內銀行僅設有存款總量指標，不管所吸納存款是長期抑或短期。對於國內銀行銷售人員向港人標榜短期存款利息優惠，他估計，是個別分行或銷售人員吸引客戶手法，國內銀行並不存在吸納港客存款的需求。他又指出，國內存款額達20萬億元人民幣，在港人民幣存款總額僅約4000億元人民幣，相對國內存款實在微不足道，故相信不會針對香港的人民幣存款，作出目標調整。 他提醒港人，國內投資產品合約內容與香港相若，為評估客戶可承擔風險，建議不論簽訂任何投資產品合約時，要先了解相關內容。由於兩地中文詞彙有機會不同，遇上有問題的地方，應向相關人員查問，並要求寫在旁邊解釋。
20110407-212,20110407,212,海螺：今年毛利率續升盈喜刺激　股價創新高,海螺：今年毛利率續升 盈喜刺激　股價創新高 【本報訊】受惠內地對水泥需求強勁，上月剛公佈去年純利大升75%的安徽海螺（914）再發盈喜，料首季淨利潤按年增長150%，以去年首季淨利潤為7.92億元（人民幣．下同）計算，公司今年首季度淨利潤將達19.8億元以上。帶動昨日股價創新高，曾高見49.7元，惟尾市升幅收窄，埋單仍升3.5%，報48.85元。　記者：張活儀 海螺董事長郭文叁更預計，今年平均每噸水泥毛利可維持於120元水平，故對今年業績表現充滿信心。公司去年全年平均每噸水泥毛利僅為80元，相當於每噸毛利率32.4%，較09年上升3.7個百分點。 設專隊西南部覓併購 三星證券研究報告指，內地水泥行業已踏入旺季，於北京、天津、湖南、浙江以及新疆水泥價格，於4月份每噸已上升40至100元，其中於湖南水泥價格更重返去年12月的高位。 該行認為，雖然安徽海螺於上述地區的覆蓋率不高，但卻反映市場對水泥需求上升，而海螺作為內地營運效率最高的水泥生產商之一，料可有效管理成本，相信公司毛利將受惠於價格上升。 除上述地區水泥價格上升外，執行董事郭景彬透露，去年水泥產能過剩重災區四川及重慶等中部城市，近期價格亦逐步回升，為公司帶來收購合併機會，公司已成立併購專責團隊，於西南部或其他地區覓併購機會。 今年整體市場表現，郭文叁認為，內地加強對保障房的供應，目標今年增加1000萬套保障房，合共6億平方米，未計算過去每年新增住宅市場僅10億平方米，增長空間龐大。去年來自房地產及基建行業的水泥需求佔公司收入貢獻各佔約35%，農村建設約佔30%，公司預計今年房地產行業的水泥需求佔收入貢獻將會上升，反觀基建則預計有所下降。 擬發95億元公司債 副總經理章明靜表示，今年目標水泥及熟料產量為1.8億噸，目標銷量約1.7億噸；去年銷量為1.37億噸，至2012年目標水泥及熟料的銷量將增至2億噸。今年資本性開支為90億元。此外，公司計劃發行95億元公司債，預計可於上半年完成。
20110407-213,20110407,213,禁送預付卡　大行：百貨業影響微,禁送預付卡　大行：百貨業影響微 【本報訊】美銀美林就日前總理溫家寶指，要堅決查處以包括商業預付卡等各種名義收送禮金的行為發表報告，指大部份企業預付卡只佔收入的很少部份，只有如金鷹百貨（3308）及聯華超市（980）所佔比重較大，故整體而言對行業影響並不是太大。 金鷹聯華影響較大 美銀美林報告指，大部份內地零售企業預付卡佔總營業額比重均少於10%，只有如金鷹及聯華，其比重佔超過公司總收入的25%，因此若內地真的加大力度、查處這種一向被視為灰色地帶的預付卡付款方法，相信亦只會對金鷹造成較大影響。 有外資分析員表示，其實早於去年當內地禁止各零售企業所發行的預付卡可「交叉」使用後，預付卡佔營業額比重已大幅減少，故認同美銀美林看法，認為堅決查處影響不大。 受消息影響，金鷹昨跌1.33%或0.26元，收報19.26元。聯華跌0.45%或0.15元，收報33元。其他百貨股及內地零售股股價則表現平穩。 溫家寶於3月底召開的廉政工作會議上形容，一些官員的腐敗案件「觸目驚心」，明確表示幹部收受禮金、證券、商業預付卡等禮品均需按受賄處理。
20110407-214,20110407,214,雙匯再上架神冠漲7%,雙匯再上架神冠漲7% 【本報訊】因「瘦肉精」事件下架了約20天的雙匯熟食製品，日前於各超市重新上架。《中國新聞社》報道，雙匯熟食製品已重新上架，但反應不是太熱烈。受重新上架消息刺激，有向雙匯出售腸衣的神冠（829），昨急升6.55%，全日收報9.92元。 《中國新聞社》日前於一重慶超市的雙匯專櫃觀察，發現只有促銷人員不停招呼顧客試食，但沒有太多顧客光顧。報道指，重新上架產品的價格與下架前沒有太大變化。《北京商報》引蘇賽特商業數據機構調查數據，指事件令雙匯銷量跌了46%。 作為雙匯旗下香腸腸衣主要供應商的神冠，其主席兼總裁周亞仙早前於業績會上強調，被驗出有「瘦肉精」的濟源雙匯（雙匯子公司）採購量很少，事件亦無影響集團出貨。
20110407-215,20110407,215,財話短說高盛：保障「烏輪」客利益,財話短說 高盛：保障「烏輪」客利益 ▲高盛就4隻日經指數窩輪上市文件出錯發出公告，指目前正研究不同的解決方案，正與有關監管機構積極商討。高盛稱，理解投資者對有關窩輪停牌的關注，會尋求確保在達成有關解決問題的安排時，現有窩輪持有人的利益不會因停牌時間的長短而受損，並將盡快公佈有關安排的詳情。
20110407-216,20110407,216,財話短說中信泰富擬發債籌78億,財話短說 中信泰富擬發債籌78億 ▲中信泰富（267）擬發行總額10億美元（約78億港元）的可持續債券及十年期高級無抵押票據，以償還借貸及一般營運資金。評級機構穆迪給予其票據Ba1評級，標普則給予BBB-。
20110407-217,20110407,217,稻香：最低工資損盈利,稻香：最低工資損盈利 【本報訊】於中港經營79間中式酒樓或食店的稻香控股（573），去年全年盈利微升5%至2.19億元，低於營業額12.5%的增長速度。行政總裁梁耀進解釋，因為去年公司額外投入了800萬元宣傳自家品牌的月餅，加上食材成本上漲亦令毛利率稍跌。梁耀進坦言，今年5月正式實施的最低工資，其影響會在今年上半年才得到較全面的反映。 稻香的員工開支佔營業額比重達27.5%，梁耀進指最低工資的實施，對盈利能力會有一定影響，去年起公司已逐步提升員工薪酬，但大部份的影響要在今年上半年才會顯現出來。「加人工是市場趨勢，我們會加大業務流程自動化的比例，如推出自助埋單、自助點菜，八達通付款等措施，來減省對人手的需求。」 梁耀進透露，公司新建成的大埔物流中心已於今年1月投入營運，其產能是舊火炭物流中心的5倍，料可協助公司進一步控制成本，令毛利率趨穩。
20110407-218,20110407,218,恒安三招紓成本壓力,恒安三招紓成本壓力 【本報訊】於業績上表示暫無意加價的恒安國際（1044），其管理層日前與投資者會面時表示，可能會調高產品售價，但不會在短期內進行，暫只會以推出新產品、推出更多毛利率較高的中至高檔產品，及調整產品原材料組合，以抵銷成本的上升。 德銀發表報告指，集團重申木漿價格已升至一個很高水平，但很難估計未來走勢，惟仍計劃維持約1個月的木漿貯存。恒安管理層又指，年內有可能落實發展新的消費品業務。德銀維持「購入」評級，目標68.3元。 另外，內地報章《廣州日報》報道，發改委一周內召開了兩次酒業會議，包括華潤、青島、燕京及百威等4大啤酒集團亦有參加，強調要維護價格穩定；報道並沒有披露會否就酒品推出限價令。
20110407-219,20110407,219,財話短說波司登男裝定單增36%,財話短說 波司登男裝定單增36% ▲波司登（3998）宣佈，於江蘇省常熟市舉行的2011秋冬男裝發佈會，錄得定單金額達3.9億元人民幣，同比增約36%。
20110407-220,20110407,220,亞太區股市,亞太區股市 日本：9590.93　+6.56(+0.07%) 澳洲：4908.13　-4.78(-0.10%) 新西蘭：3450.36　+0.48(+0.01%) 新加坡：3171.65　+1.32(+0.04%) 馬來西亞：1561.93　+9.04(+0.58%) 泰國：1089.21　+13.08(+1.22%) 台灣：8901.72　+49.74(+0.56%) 南韓：2122.14　-4.57(-0.21%) 菲律賓：4219.43　+6.91(+0.16%) 印尼：3730.58　+2.79(+0.07%) 印度：19591.18　-21.02(-0.11%)
20110407-221,20110407,221,財話短說五礦購澳洲礦商過首關,財話短說 五礦購澳洲礦商過首關 ▲五礦資源（1208）公佈，於周二（5日）已接獲澳洲外商投資審查委員會書面通知，澳洲政府不反對其收購EquinoxMinerals的交易。
20110407-222,20110407,222,內地股市,內地股市 深綜指：1271.32　+8.87(+0.70%) 深A指：1330.43　+9.39(+0.71%) 深B指：822.66　+0.74(+0.09%) 滬綜指：3007.909　+6.55(+0.22%) 滬A指：3149.589　+6.79(+0.22%) 滬B指：323.972　+1.91(+0.59%)
20110407-223,20110407,223,財話短說統一7.5億購物業管理商,財話短說 統一7.5億購物業管理商 ▲統一企業（220）斥資7.5億元收購卡帝樂實業的全部權益，卡帝樂主要業務為銷售一般商品及家庭電器、物業管理及租賃自置物業。
20110407-224,20110407,224,財話短說中國上月新貸料6000億,財話短說 中國上月新貸料6000億 ▲據《證券日報》引述多數機構專家預測，3月的新增貸款將在6000億元（人民幣．下同）左右。招商銀行研究報告預計，3月信貸投放6000億元，帶動M2同比增加14.5%，M1同比增加15%。
20110407-225,20110407,225,歐美股市及美債,歐美股市及美債 美股道指：12411.80　-14.95(-0.12%) 美股納指：2803.68　+3.86(+0.14%) 美股標普500：1337.24　+1.70(+0.13%) 英國：6038.64　-2.49(-0.04%) 德國：7230.04　+14.93(+0.21%) 法國：4062.56　+14.40(+0.36%) 美國10年期債息：3.57厘　+0.02厘
20110407-226,20110407,226,財話短說滙豐本港PMI上升,財話短說 滙豐本港PMI上升 ▲滙豐香港採購經理指數（PMI）由2月的53.7升至3月的54.9，顯示香港私營經濟體系穩健進步，產出增長繼續改善，銷售價格漲至33個月高位。滙豐香港區總裁馬凱博（圖）表示，由於外圍及本地需求相當穩健，有利香港經濟在今年第一季保持強勁。
20110407-227,20110407,227,貴金屬及商品,貴金屬及商品 盎斯金#：1462.11　+2.41(+0.17%) 九九金：13503.00　+15.00(+0.11%) 白銀#：39.55　-0.01(-0.01%) 白金#：1801.50　+7.75(+0.43%) 倫敦期銅#：9725.00　+120.00(+1.25%) 紐約期油#：108.95　+0.12(+0.11%) CRB商品指數：364.61　+1.15(+0.32%) #單位：美元
20110407-228,20110407,228,財話短說內地樓市成交連漲3周,財話短說 內地樓市成交連漲3周 ▲中國指數研究院公佈，上周（3月28日至4月3日）60%城市樓市成交量環比上漲，為3月中旬以來連續第三周出現環比上漲，而多數城市房價則保持穩定。報告並顯示，上周監測的35個城市中，11個城市成交量漲幅在40%以上，2個城市成交量漲幅過100%。
20110407-229,20110407,229,主要貨幣滙價,主要貨幣滙價 美元 兌美元：　—　兌港元：7.772　-0.0014 歐元 兌美元：1.4299　兌港元：11.1113　-0.0296 日圓＊ 兌美元：85.20　兌港元：9.1165　+0.0240 英鎊 兌美元：1.6327　兌港元：12.6859　-0.0096 瑞郎＊ 兌美元：0.9186　兌港元：8.4614　+0.0028 澳元 兌美元：1.0478　兌港元：8.1425　+0.0262 紐元 兌美元：0.7773　兌港元：6.0410　-0.0188 加元＊ 兌美元：0.9573　兌港元：8.1125　+0.0180 人民幣＊ 兌美元：6.5420　兌港元：84.18　-0.0100 （歐美股市、滙價、貴金屬、商品價截至22:30）＊為每美元滙價
20110407-230,20110407,230,中投七億入股旭光倘悉數行使股債　最多持4.3%,中投七億入股旭光 倘悉數行使股債　最多持4.3% 【本報訊】港股自北非動盪及日本災難後稍見回穩，市場旋即再現引資及抽水活動。在卡姆丹克（712）昨宣佈獲著名國際投資者注資10億元後，早前備受配股押股消息影響的旭光（067）亦表示，獲中投及中信資本入股，涉資9.4億元；雅居樂（3383）及香格里拉（069）則擬發行可換股債券籌資。 記者：林靜 全球第二大芒硝生產商旭光昨宣佈，與中投及中信資本訂立認購協議，兩公司分別認購9000萬美元（約7億港元）及3000萬美元的2014年到期換股債，年息6厘。旭光亦已授予中投及中信資本可認購最多1億美元額外換股債的選擇權，集團所得款項淨額將用作資本開支及營運資金用途。 卡姆自爆引入猛人　股價新高 假設按初步轉換價每股2.81元悉數轉換換股債，將可轉換約3.3億股，佔擴大後股本約5.74%，中投將持股4.31%。換股價2.81元，較旭光停牌前3.11元，折讓9.6%。 中投過往多次入股本港上市公司，尤其鍾情新股，近來入股的新股包括熔盛重工（1101）、融創中國（1918）、博士蛙（1698）及歐舒丹（973）等。 旭光上市後集資活動不斷，繼大股東09年底押股後，集團又於去年底配股集資98.5億元，用作收購中國高分子新材料公司，今年初亦再配股集資9.6億元，一度拖累股價。 但自集團通過以110億元人民幣向大股東收購中國高分子近95%權益之後，市場對旭光再度憧憬，集團當時更估計，收購可以令其利潤、收入及現金流大增，是今年重點投資的業務。 雅居樂發換股債　息4厘 卡姆丹克昨亦宣佈，集團於本月6日與一名國際著名投資者訂立協議，預料將獲10億元投資額，正式協議仍待進一步簽約落實。卡姆丹克昨受追捧，高見4.32元，收報4.19元，升4.75%，再創上市新高。 另外，雅居樂（3383）昨公佈，擬發行2016年到期5億美元（約39億港元）換股債，年息4厘。債券初步換股價每股18.256元，較停牌前13.04元溢價40%，是08年後內房同類型債券中最高溢價。 若持有人按初步換股價悉數換股，公司將發行2.13億股新股，佔擴大後股本約5.78%，發債所得款項淨額約4.92億美元，擬用作可能進行的土地收購及一般營運資金。集團今年首季實現合約銷售金額約94億元人民幣，按年增加62%；合約銷售面積約72萬平方米，增34%。 香格里拉昨午停牌，消息指其發行5億美元5年期換股債，年息介乎1.75至2.25厘，換股價29.03至30.64元，較停牌前21.5元溢價35%至42.5%，另有權增發1億美元。集資所得將用於未來資本開支、一般營運資金及償還銀行貸款。安排行是中銀國際及滙豐。
20110407-231,20110407,231,財話短說比亞迪銷車量跌41%,財話短說 比亞迪銷車量跌41% ▲根據第一財訊報道，比亞迪（1211）3月份汽車銷量較上年同期下降41%，至40027輛。
20110407-232,20110407,232,持續減持馬化騰再3折沽騰訊,持續減持 馬化騰再3折沽騰訊 「QQ之父」馬化騰如期再以賤價減持騰訊（700）。港交所（388）資料顯示，馬氏本周一（4日）在場外以每股平均價67.806元，沽出200萬股騰訊，與當日收市價196.4元比較，折讓65%，套現1.36億元，持股量由11.04%減至10.94%。減持後，馬氏仍持有2.01億股股份。 每股$67.8　套1.4億 馬化騰因「賭輸」期權合約，已於上月28日減持200萬股騰訊。扣除本周一到期的合約，馬氏本月仍有3份共600萬股淡倉合約，將於未來三周到期。因現價已遠高於期權行使價67.8元，料馬氏將繼續三折價賣股。 馬氏上周披露減持後，騰訊股價一度低見189.5元。為挽回投資者信心，公司先後於上月31日及本月1日，在場內共回購61.13萬股，每股平均價介乎187.5至190元，令股價止跌回升，昨收204.8元，漲8.4元，升幅4.3%。
