key,date,article_daily_id,title,text
20111113-213,20111113,213,謝國忠分析樓價料跌穩跌,謝國忠分析 樓價料跌穩跌 【本報訊】大淡友著名經濟學家謝國忠一直唱淡內地樓市，他早前揚言中國房價下跌50%才算合理，他並說出樓價下跌的節奏，就是先跌20%到30%，然後會出現需求，而地產商在減價促銷，待市場消化需求後，樓價又會繼續跌。 「地產轉差是好事」 雖然內地很多市民的居住環境仍差勁，不過，謝國忠說，中國在建36億平方米，中國整體而言沒有房子短缺，當然某個地點可能有短缺。中國人均住房面積已經快30平方米，遠遠超過歐洲和日本。在他眼中，地產轉差是好事，因為資金會流入實體經濟，他更認為資金總的來講並沒有那麼缺，只是大家認為搞房地產才是最賺錢的。「無論政府還是資金，都想賺快錢」。 的確若各類房子供應足夠，以及炒房不再熱爆，樓價會回復合理。供應方面，與商品房不同客源的保障房，被指全國已開工的1000萬套保障房中約三分一屬「挖坑待建」情況。對此，住建部有關負責人稱，今年開工建設1000萬套保障性住房的開工標準是，規劃設計的永久性建築工程已進入地基基礎的結構施工，僅搭建施工現場圍護設施或僅開挖基坑的，不計入已開工套數。
20111113-214,20111113,214,盡早逃生歐銀怕「焗蝕」　擬掟3.2萬億意債,盡早逃生 歐銀怕「焗蝕」　擬掟3.2萬億意債 意大利前總理貝盧斯科尼終於願意請辭，令人認為歐債危機暫時應有喘息機會。然而，有報道指，歐洲銀行業正計劃沽售總值3000億歐元（約3.2萬億港元）的意大利國債，反映區內銀行業對意大利前景全抱負面態度的同時，金額之大亦可能令歐洲央行不斷購入意國國債以壓低債息的努力功虧一簣。 有句英語諺語：「愚我一次，其錯在人；愚我兩次，其錯在我」。歐洲銀行業經歷了要就希臘債務提升撇賬百分比後，當前火頭燒至意大利，銀行均變得更精明，適逢有歐洲央行接貨，不少區內大型銀行已計劃加速盡早沽出手上的意國國債，有些亦叫停了長期買入意國債的投資策略。 區內銀行一直都是意大利的大債主，該國自09年起共發行220億歐元、區內銀行就持有當中的4成。截至去年底，90間最大的區內銀行，則共持有3260億歐元的意大利國債。 央行努力恐付諸流水 事實上，歐央行自今年8月已購入共1100億歐元的歐豬國債，當中部份屬於意大利。而若銀行真的沽售手上意國國債，將能令央行數月來的努力付諸流水。截至去年12月，在意大利最大的10個銀行債主當中，佔了一半是外資銀行，當中法巴持有280億歐元。然而，截至今年10月為止的4個月，法巴便減持了83億歐元，幅度近3成。
20111113-215,20111113,215,消費轉強美股周漲1.4%,消費轉強美股周漲1.4% 【本報綜合報道】隨着意大利及希臘政局改革明朗化，令歐債問題暫時喘穩，有分析指，市場可能會將注意力稍為放回在美國本土經濟之上。 雖然本周初段美股曾經出現大跌市，但其後公佈的多項美國經濟數據均較預期理想，令三大股市顯著造好。道指上周五收市升259點，收報12153點。累計全周，道指升1.4%；標普指數升0.8%，納指則跌0.3%。 儲局：經濟下行風險增 美股上周五越升越有，與消費數據表現理想亦有關係，11月密歇根消費者信心指數初值為64.2，高於市場預期的61.5，數值創5個月以來最高水平，亦是連續三個月錄得增長。展望本周續有沃爾瑪及HomeDepot兩大主要零售股公佈業績，與及一系列消費數據，力足左右大市走向。 德銀首席美股策略師BinkyChadha表示，美國本土形勢不算太差，只是外圍因素影響太大。他表示，「你不需要資金流入美股來令市場造好，只要歐洲沒有壞消息傳出就可以了。」 美國聯儲局副主席耶倫（JanetYellen）上周五重申，歐債危機及其對銀行業的衝擊，已增加了美國經濟下行的風險。耶倫續指，不排除以貨幣政策作為穩定金融體系的工具。另外，她又披露聯儲局將在未來數周內，對銀行業展開新一輪壓力測試。 滙市方面，歐元上周收報1.3747美元，而日圓則累升1.4%，報77.2，為8月中以來升幅最大一周。
20111113-216,20111113,216,清理地方債3萬億舊換新,清理地方債 3萬億舊換新 【本報訊】今明兩年為地方融資平台還債高峯期，資金額高達4.6萬億元（人民幣．下同）。中國銀監會前主席劉明康表示，截至9月底，60%的地方平台貸款已經得到了清理和規範。 在平台貸款問題上，地方政府在中央推動下，已經開始逐步清理規範，目前重簽合同的平台貸款有3萬億元，即舊債成功換新債。「目前的監管手段是非常嚴厲的。」國開行專家委員會常務委員賈庭仁稱，目前該行地方平台貸款餘額佔全國地方平台貸款25%，該行地方平台貸款不良貸款率為0.27%，屬可控。 江蘇擔保公司老闆走佬 劉明康帶來喜訊，市場同時傳來壞消息，據內地《經濟觀察報》報道，江蘇再現業務以借貸為主的擔保公司老闆走佬事件，上月19日，江蘇瑞陽投資實際控制人王兵出逃，並滙走1.2億元，該擔保公司與連雲港四家商業銀行合作的接近7000萬擔保信貸或將全部損失。 據悉，涉案商業銀行其中一家是江蘇銀行連運港分行，另外，有消息稱，包括建行（939）連雲港分行、工行（1398）連雲港分行等另外3家商業銀行也牽涉其中，但消息未能最終核實。
20111113-217,20111113,217,金石良言：資金流入滙控認購證 - 黃紹良,金石良言：資金流入滙控認購證 - 黃紹良 歐洲債務危機暫時得已紓緩，港股經上周四逾1000點調整後，走勢靠穩，上周五高開180點，收復19000點關口，最終收報19137點，上升173點，升幅0.91%。重磅股為升市火車頭，中海油（883）、中移動（941）以及工行（1398）分別上升3.50%、1.47%以及2.11%，並推高恒指超過78點。恒指本周暫時累跌705點。大市成交極為疲弱，上周五成交金額約449億元，當中認股證成交佔19.44%，而牛熊證成交則佔約20.70%。滙控（005）上周三公佈季度業績未如理想，按實際基準計算之除稅前利潤為30億美元，比上年同期下降16億美元。股價上周四急跌9%，其14天相對強弱指數亦由上周三的57急跌至41，反映正股沽壓沉重，上周五收報61.85元，升0.15元。而窩輪市場方面，滙控相關認購證在上周四更錄得資金淨流入金額超過1290萬元，為當日第三大淨金額流入項目，反映投資者趁低吸納作博反彈部署。看好滙控股價將在短期內回穩反彈，可以考慮價外購證14596。此證之行使價為72.88元，屬價外選擇，明年4月尾到期；引伸波幅約為38.75%，而實際槓桿則約為6.96倍。 黃紹良　巴克萊資本亞太區股票及基金機構市場推廣主管 作者為證監會持牌人，未持有文章提及之證券。投資者應詳閱相關上市文件並作風險評估，必要時應諮詢專業建議，結構性產品價格可升亦可跌，或會損失所有投資。
20111113-218,20111113,218,山東停財務公司房貸　全國第一擊,山東停財務公司房貸　全國第一擊 【本報訊】銀行鬆銀根但資金並非向地產商傾斜，地產商向銀行賒借無門，惟有向小型貸款公司（類同香港的財務公司）「叩門」。山東省政府率先向貸款公司提警示，下令禁小型貸款公司新增房地產貸款。山東省為首個叫停小型貸款公司向地產商借貸省分，免得當地地產泡沫再現。 山東省金融辦日前下發通知，除嚴禁小型貸款公司新增房地產貸款，要求自通知下發之日起，嚴禁小貸公司向房地產企業及房地產企業的大股東、法定代表人、董事長、高管人員及親屬等重大關聯方新發放貸款。同時，要求盡快消化存量房地產貸款。 在此之前，監管層還遏制房地產信託融資的發行勢頭。從去年開始，先是銀行限貸，後是信託叫停，再到如今的小型貸款公司禁貸，山東房地產企業融資管道再被收窄。 濟南樓市成交跌20% 山東省小額貸款企業協會會長劉吉民向《中國經營報》透露，不排除一些小型貸款公司將房地產企業的土地權證作為抵押，向其發放貸款，但只是個別小型貸款公司，風險目前是可控的，山東省金融辦也會盡快要求這些企業將貸款收回。中國小額信貸機構聯席會副秘書長劉勇表示，金融辦要求向小型貸款公司借出的資金須盡快返還，對於本已對資金捉襟見肘的房地產商來說，無疑是雪上加霜。 一系列金融組合拳令山東房地產企業叫苦不迭，剛剛過去的10月從往年的「銀十」變成「鐵十」，當月濟南新建商品房、二手房成交量雙雙大跌，跌幅在兩成左右。 山東省政府斷地產商「米路」，天子腳下的北京市可能減收地產商在買地時繳付土地出讓金，免得在賣地少影響政府收入。 今年首10月，北京市土地市場共成交經營性用地98宗，面積868公頃，相當於去年同期的86.8%，僅完成了全年計劃1770公頃的49%，政府土地收益只有372億元人民幣，僅相當於去年同期的73.1%。
20111113-219,20111113,219,新盤廝殺發展商狂加佣御‧豪門佣金連獎金達5%　近年罕見,新盤廝殺發展商狂加佣 御‧豪門佣金連獎金達5%　近年罕見 【本報訊】一眾發展商近月不單榨乾二手客源，相互之間更高佣鬥搶客，繼永泰地產及新地（016）之後，華懋亦加入戰團，九龍城御．豪門特色單位，佣金加獎金高達5%；信和置業（083）也為大埔天賦海灣的部份滯銷單位，加獎金1萬元予代理。 記者：林志光　羅美倫 至於昨日一手市場，落實成交連預留單位，超過80個。然而十大二手屋苑，昨日卻僅錄少於5宗成交，大比數被拋離。 楊洛婷參觀天晉　未扑槌 全球經濟氣候不穩定，本港發展商都趁目前樓市仍不大跌前，鬥快推盤，本季剛開始，發展商大力促銷貨尾盤及新盤已約10個，另如大圍盛世及灣仔壹環等，又已如箭在弦，最快本周開售。因此，發展商早已不惜向代理大放銀彈，鬥搶市場購買力。 新地亦將新蒲崗譽．港灣的代理佣金連獎金，最高加至4%之外，據消息透露，華懋也將御．豪門特色單位的佣金，提高至4%，另加1%獎金，為近數年罕見。該8個特色單位，意向價要4000多萬元起，換言之，如促成交易，代理佣金連獎金便逾200萬元以上。 新地昨日以派貨方式銷售將軍澳天晉1000方呎單位，由於分配不公平，曾引起部份代理不滿，該盤昨日約有40個單位落實成交及預留，市傳前港姐楊洛婷斥資1200多萬元，購入6座30樓以上B室，不過，她回覆本報時稱，只參觀過示範單位，還未決定是否買。另信置方面指，大埔天賦海灣昨日售近30伙，包括8座地下A室，面積2082方呎，呎價16979元。 二手淡　10大屋苑5成交 至於加佣後的瑆華，市場消息指，該盤截至前晚止，有25伙已落實成交，另有近20伙獲預留，至於昨日，只有5伙獲預留。永泰地產陳秀賢表示，約有10%至15%是內地客，已售出最高呎價為有本地客以呎價約2.56萬元，購入31B室單位。另華置即將開售灣仔壹環，示範單位首度開放留客。 此外，被發展商搶奪客源的二手市場，十大屋苑昨日錄得不足5宗成交，中原地產趙鴻運表示，鰂魚涌太古城北海閣高層G室，業主昨降價38萬元，以648萬元售出；香港置業司徒偉文指，同區康怡花園M座極高層16室，業主降價120萬元，以810萬元售出，低市價約一成。
20111113-220,20111113,220,二手速遞雍景臺呎價14138沽,二手速遞 雍景臺呎價14138沽 ▲利嘉閣孔影賢表示，西半山雍景臺1座中層B室，面積1300方呎，望全海景，成交價1838萬元，每呎售價折合14138元。賣方在09年斥資1000萬元購得單位，今番轉手賬面賺價838萬元，3年漲價約84%。
20111113-221,20111113,221,國策透視：短命限購令官場縮影 - 郭小民,國策透視：短命限購令官場縮影 - 郭小民 中山市於上周公佈限價令，規限新落成樓房在年底前出售，每平方米售價不得超過5800元（人民幣．下同），平絕廣東；不過，最令人討厭的是，此政策亦是全國最「短命」，中山市大官，為保烏紗，不惜使出欺上瞞下招數。 不是「那些年」這麼遠，就在今年1月，有份管樓價的住建部約見14城市，共商樓價可控目標，得出結果就是升幅速度不可快於經濟增長，亦不可高於人均收入，兩大原則為限價令定下基礎。 要目標達到，中央想出好橋，就是限價令成為地方官政績掛鈎，中央於年底進行考核。距離年尾還有50多天，地方官的大限臨近，要保官紗，中山市推出「短命」限價令，向中央表達遏樓價誠意，令小民佩服，是中山在平衡各方利益，確有一手。 試想想，樓市旺季「九金十銀」已過，剩下來的個半月，沒有限價令，地產商亦要以優惠甚至減價賣樓，做好盤數；還有，銀行近期雖放貸鬆一點，但對樓按依然緊，平絕廣東的每平方米5800元售價上限限制，影響應有限。 地方未配合調控難達標 中山領導不負中央遏樓價要求，亦照顧了地產商利益。在小民角度，中山市的「短命」限價令只是一個官場縮影，大家不妨看看佛山市較早時放寬限購令，只執行半日便被叫停事件，完全可反映並非個個內地官都鐵面執行中央遏樓價政策。 何解？佛山市之所以鬆懈限購令，是由於當地樓價與經濟增長仍有距離，此時鬆一鬆應不會谷高樓價。 市領導連餘下不到兩個月都不等，在國家政策層面看，要不得，怪不得內地經濟評論文章，不難看到自03年以來，房地產調控已經持續了8年之久，樓控政策幾乎是年年出台，可看到的是甚麼政策效果呢？短短8年，全國房價至少漲了兩倍，京、滬兩地更是翻漲了4倍，這種奇高的房價與國民收入顯然相差懸殊，極不合理。 看來，中央政策要真正由上而下，調控要真正達標，地方官配合是關鍵所在。 郭小民
20111113-222,20111113,222,港交所推人幣期貨難產遲遲未決定　與銀行半年無洽談,港交所推人幣期貨難產 遲遲未決定　與銀行半年無洽談 【本報訊】本港人民幣離岸中心正朝向多元化產品發展，不過涉及人民幣在岸（CNY）中間定盤價，而又會公開擺價及有散戶參與，當局則倍加關注。消息稱，去年港交所（388）曾向銀行就擔任人民幣滙率期貨合約（NDF）市場莊家發出諮詢範本，產品原擬今年第一、二季推出，惟因監管當局一直考慮未決，該所與銀行界的洽談亦已擱置近半年。　記者：劉美儀 市場人士相信，人民幣滙率期貨合約難望今年內在交易所登場。為消除牽涉CNY定盤價的敏感性，據悉，港交所最近擬修訂構思，尋求出路，將原來參考CNY中間定盤價、以美元或港元交收的NDF期貨合約建議，改為以人民幣交收的滙率期貨合約（DF），並徵詢市場對發展可行性看法。 不交收或改做交收 但有財資界人士指出，DF合約到期後以人民幣交收，如何確保參與者特別是散戶，有足夠人民幣交割，須予研究；目前人民幣港股現貨買賣尚未啟動，而滙率期貨合約有槓桿成份，故本地人民幣資金流通性要能配合。 港交所發言人回應時承認，有興趣拓展人民幣滙率期貨產品，此舉亦配合交易所對人民幣業務的全盤發展策略，港交所一直就有關產品的可行性作出研究，並密切注視人民幣市場發展空間，以建立成功的人民幣滙率期貨市場，但目前對人民幣滙率期貨合約並無具體推出的時間表。 經交易所推出的NDF期貨合約，其實是目前銀行同業間，透過場外交易的人民幣不交收遠期合約「場內版」，但場內交易最大分別，是參與商須繳付指定合約按金，交易價格上板公開，對象涵蓋散戶或基金等機構客戶，故規範化要求更嚴謹。 消息說，去年港交所向銀行發出NDF期貨合約諮詢範本後，不少有興趣擔任市場莊家的同業，內部法規及系統準備已「七七八八」，以配合產品最快今年首季末面世的初訂時間表，但過去半年雙方已再無跟進洽談。 發展安排須內地祝福 對於監管當局考慮NDF合約多時仍然未決，箇中原因意見紛紜，有指場內和場外NDF，當局的關注度絕不相同，場內公開「睇升睇淡」人民幣滙價前景，此舉是否符合內地以避險為主要政策考慮，值得留意。 消息亦說，清算行在上海以CNY購售人民幣兌換窗口，9月份被沽爆額，金管局最近發通函提醒銀行，嚴打利用人民幣跨境貿易套滙投機，即可見一斑；交易所NDF期貨合約牽涉CNY中間價定盤，發展安排亦須經內地祝福認可。 但有市場人士指出，純從商業角度看，滙率期貨合約一貫以場外交易為主體，流通性高，操作暢順，買賣包括對冲實盤需要及純交易導向兩類。 港交所計劃推NDF概況 ．去年港交所曾向銀行就擔任NDF市場莊家發出諮詢範本，產品原擬今年第一、二季推出。 ．因監管當局一直考慮未決，港交所與銀行界的洽談已擱置近半年。 ．市場相信，NDF難望今年內在交易所登場。
20111113-223,20111113,223,二手速遞威豪花園減18萬成交,二手速遞 威豪花園減18萬成交 ▲世紀21富山地產何冬梅表示，牛池灣威豪花園1座低層E室，面積478方呎，眺望舊機場海景，業主原叫價278萬元，減價18萬至260萬元易手，減價幅度6.4%，折合呎價為5439元，低於市價一成。原業主於03年以122.8萬元購入，持貨8年賬面獲利137.2萬元，單位升值逾1倍。
20111113-224,20111113,224,二手速遞健威花園380萬易手,二手速遞 健威花園380萬易手 ▲世紀21日昇地產黃文龍表示，北角健威花園E座中層3室，面積534方呎，由於業主急於放售物業以380萬元易手，折合呎價7116元，較同類型單位低6%。原業主91年購入上址，當時作價147萬元，持貨至今20年，賬面獲利233萬元，物業期內升值1.59倍。
20111113-225,20111113,225,美元交收芝交所已推出　交投淡,美元交收 芝交所已推出　交投淡 根據去年8月底，港交所（388）向包括3間發鈔行在內等多間本地及外資大行，所發出的人民幣滙率期貨合約（NDF）諮詢範本，範本建議每張人民幣期貨合約價值為100萬元（人民幣．下同）。 該合約期限包括即月及其後連續12個月期，而合約分別以美元及港元計價交收，每名客戶每月最多可持有500張未平倉合約。 若按恒指期貨合約5%按金計，即每張NDF期貨合約需付5萬元按金，便可入場。 合約技術性複雜 其實，芝加哥商業交易所轄下的24小時電子交易平台「國際貨幣市場」（IMM），約兩年前已提供美元交收的人民幣滙率期貨合約買賣。 該平台有關產品的交易一直表現零星，反映透過交易所買賣滙率期貨合約的發展，並不容易，人民幣是未自由兌換的貨幣，而滙率期貨合約的技術性更為複雜。
20111113-226,20111113,226,渣打：收入員工可續增,渣打：收入員工可續增 【本報訊】歐債問題持續影響投資市場信心，渣打集團（2888）亞洲區行政總裁白承睿表示，集團並無持有任何歐洲主權債，故預期對渣打影響不大；他更直言，渣打仍處於增長期，有信心無論在業務、收入以至員工數目都可維持增長步伐。 歐債未來一年難解決 歐洲主權債務危機由希臘燒到意大利，白承睿坦言，歐債問題對投資市場帶來不明朗性，要有水晶球才能預料到哪個國家即將爆煲。他又預期，主權債問題將於未來一年甚至更長時間繼續困擾歐洲，而亞洲及新興市場亦將無可避免受到拖累。不過他認為，亞洲無論在個人、企業以至國家層面，基礎因素都較歐洲區穩健，故預期短時間內區內國家所受牽連有限。 渣打香港行政總裁洪丕正亦認同，指歐債問解決需時，短期內全球投資信心將繼續受影響，而着重貿易的地區影響將較深。至於早前港府經濟顧問預警，未來經濟增長將持續放緩，甚至不排除出現衰退，他認為，主要因為歐美地區的需求持續疲弱，拖累出入口表現，幸而本港及內地的內需強勁，有助防止歐債問題進一步影響區內經濟。 香港滙豐銀行上周開始裁員行動，另一邊廂，渣打香港則重申其增聘員工的意欲。洪丕正表示，香港就業市場持續穩定，失業率僅處3.2%低位，對本港業務發展有信心，故該行將繼續在市場增聘員工。
20111113-227,20111113,227,二手速遞麗港城15年升值25%,二手速遞 麗港城15年升值25% ▲美聯物業歐仲為表示，觀塘麗港城9座低層E室單位，面積約為857方呎，由於位處低層，故以490萬元易手，折合呎價約為5718元，屬市場價成交。原業主於96年以約393萬元購入上述物業，賬面獲利約97萬元，物業15年升值約24.7%。
20111113-228,20111113,228,明年亦差中小企貸款料放緩,明年亦差 中小企貸款料放緩 歐債危機等外圍因素持續，本港經濟瀕臨衰退邊緣，首當其衝往往是抵禦能力較弱的中小企。渣打香港中小企業理財香港及華南總監區偉權接受訪問時表示，中小企貸款需求已轉向保守，預期該行第四季中小企貸款增長遜於去年，並會持續放緩至明年。 息率料居高不下 區偉權指出，外圍的不明朗影響買家入貨積極性，中小企出口歐美的業務不穩定，收到的急單增多；面對疲弱的市場需求，中小企在融資上亦變得謹慎和保守，不會輕易擴充。不過，他對第四季出口的看法則未至於悲觀，因為出口東南亞、南美業務仍有理想增長，渣打香港7至10月的中小企貿易業務按年仍錄得增長，但坦言較上半年的倍增數字放緩，料明年中小企貸款將難以延續今年的高增長率。 外圍環境變壞，區偉權表示，增加中小企的貸款風險，加上資金成本未見回落迹象，預期中小企貸款息率年底前均會居高不下，例如目前中小企貿易融資貸款息率，一般都高於3厘。
20111113-229,20111113,229,公司專訪上海棟華谷燃料油打救,公司專訪 上海棟華谷燃料油打救 經營瀝青起家的上海棟華（8251）今年受中央緊縮信貸的貨幣政策影響，加上去年上海世博會令道路工程「透支」完成，令瀝青業務首3季營業額急跌55%，佔總營業額比重更由40%降至11.4%。財務總監徐勤進坦言，瀝青的命運全繫於政策之手，短期難望扭轉，公司惟有透過力谷燃料油業務來填補有關損失。 瀝青業務暫難扭劣勢 徐勤進接受本報專訪時表示，經過世博會的「美化」後，上海的道路仍然簇新，暫時仍未需要重鋪，加上大部份新項目源於瀝青用戶資金短絀而停頓，公司又不敢與不熟悉的瀝青客戶合作，以免被拖數，令原本已長達3至6個月的應收賬款周轉天數進一步延長，縮減資金靈活度，以致瀝青營業額大減。 儘管瀝青業務今年表現大為遜色，但他仍對瀝青前景充滿信心，因迪士尼將在上海浦東落戶，與項目有關的道路工程將在2013至2014年激增，而公司又與道路建設商關係良好，相信屆時瀝青業務會有大躍進。 至於取代瀝青成為棟華今年亮點的燃料油業務，首3季營業額按年增175%至16億元（人民幣．下同），佔總營業額比重亦升至逾60%。 徐勤進稱，由於燃料油期權可在商品交易市場買賣，故燃料油價格波動相當大，加上市場龐大，競爭激烈，因此有關業務的毛利率僅2.5%至3%，遠低於瀝青的9%至10%，所以公司希望燃料油業務日後的比重可降回約30%。 料明年轉主板上市 路橋業務方面，棟華今年首3季新增合同額度約6億元，累計合同額度逾10億元。他說，公司大部份項目均是從交通投資局投標中奪得，毛利率有保障，未來會繼續參與競投全國各地的路橋項目。 棟華05年在創業板上市，公司一直有計劃轉主板，惟礙於公司是H股，轉板除要符合聯交所資格，亦要經過中國證監會審批。 徐勤進指出，棟華早已符合轉板資格，有信心明年初通過中證監審批，令公司完上主板之夢。 記者：陳韻妍
