key,date,article_daily_id,title,text
20110407-106,20110407,106,投資245億　票價平過香港迪士尼上海迪士尼今動土,"投資245億　票價平過香港迪士尼 上海迪士尼今動土 全球第六個、亞洲第三個迪士尼樂園今日將在上海動土，首期工程預計2015年建成開幕後，當地將發展成為國際旅遊區。有上海的政協委員已經表明，香港迪士尼樂園「根本容不下所有遊客」，加上上海旅遊配套設施遠較香港充足，相信港、滬的樂園可能會爭奪內地、東南亞的客源。 位於上海浦東新區川沙新鎮的迪士尼地盤，燈柱都掛上「迪士尼樂園動土儀式」的旗幟，並搭起可容納千人的帳篷，十多輛挖掘設備一字排開（圖）。上海多個媒體已收到來自迪士尼的邀請函，公關公司稱「你能想到的大牌都會出席」，可見上海很重視項目。 預計2015年開幕 根據上海規劃和國土資源局公佈上海迪士尼的初步藍圖，樂園投資額達245億元人民幣，除有主題樂園，亦有酒店、商業區、大型停車場，南側有中心湖，兩條地鐵線直達，而土地東側、西北角未有具體用途。 上海迪士尼樂園是中國第二個，客源同樣是內地及東南亞旅客，上海市政協委員屠海鳴直言：「香港迪士尼根本容不下所有東南亞的遊客！」上海迪士尼就是要搶香港迪士尼的客，他認為上海比香港更適宜旅客，不但四、五星級酒店容量遠比香港多，而且價錢更便宜。他更認為上海當局要吸取香港政府投資迪士尼的教訓，除要向門券收入中分紅，亦要盡量參與酒店、電視頻道、英語教育等高利潤的附屬經營項目，取得分紅，以降低上海迪士尼的經營風險。 不過，上海財經大學旅遊管理系主任何建民認為，滬、港迪士尼樂園的目標客源其實不同，香港主要客源是東南亞地區，而上海則主力長三角及內地客源，各自都有足夠人口支持，應該可以容納得下。 上海東方網/新民網 滬、港迪士尼樂園比較 －上海迪士尼－		 位置：浦東新區川沙新鎮 佔地面積：3.9平方公里 首期面積：1.16平方公里 首期投資：245億元人民幣 開幕日期：2015年 每年遊客：預計2,000萬人次 門票費用：250至300元人民幣 －香港迪士尼－ 位置：大嶼山竹篙灣 佔地面積：1.2平方公里 首期面積：0.15平方公里 首期投資：270億港元 開幕日期：2005年9月12日 每年遊客：去年520萬人次 門票費用：350港元"
20110407-107,20110407,107,80後婚姻　丈夫用冷暴力,80後婚姻　丈夫用冷暴力 內地80後婚姻新現象：妻子愛用涉及肢體衝突的熱暴力，但丈夫則偏愛以冷淡、輕視、放任、疏遠和漠不關心等的冷暴力手段。專家認為不論那一種暴力都會令家庭出現更多矛盾。 26歲會計女白領秦圓圓稱，她對丈夫的冷暴力心寒。她的丈夫大她三年，經濟條件好，人亦很有風度，朋友都說她有個好老公，不過每出現爭執，丈夫都靜靜地躲在房間，任她在外聲嘶力竭地發洩。秦圓圓稱目前日子看似平靜，但她卻說：「我真寧願他能跟我打一架！」而與秦圓圓丈夫一樣，吵架時打不還手、罵不還口，一直默默承受的80後男生為數不少，甚至開始形成一種趨勢。中國社工協會婚姻家庭工作委員會理事邱少波認為，這種情況相信與一孩政策的背景有關。邱認為一旦夫妻出現問題，應以理性、冷靜的方式協商解決。 《廣州日報》
20110407-108,20110407,108,支聯會促釋放趙連海、艾未未,支聯會促釋放趙連海、艾未未 【本報訊】趙連海打破沉默，公開聲援「被失蹤」的維權藝術家艾未未後，又遭中共拘禁，香港及海外支持中國民主人士無不義憤填膺，紛紛發起行動力撐趙、艾二人，支聯會昨日宣佈下周日到中聯辦示威，要求北京立即釋放兩人。曾為趙連海「申寃」的全國政協委員劉夢熊認為，趙的行為未超越保外就醫的底線，北京不應拘捕他。 憂慮內地人權情況再倒退 趙連海及艾未未被拘押，引來海內外支持民主中國人士關注，加拿大溫哥華支聯會昨日發表聲明，指摘北京冒天下之大不韙，拘捕艾未未等異見人士，加支聯對此表示強烈抗議，要求北京立即無條件釋放艾未未等異見人士，保障中國言論自由，並對侵犯他們人權的官員加以處分。 香港方面，支聯會主席李卓人猛烈批評北京再拘押趙連海，根本是想殺一儆百，借此對其他維權人士進行恐嚇，製造白色恐怖，顯示北京正在加強對異見人士的打壓，特別是國際知名度甚高的艾未未也被拘禁失蹤，令人憂慮內地人權情況會再倒退。他表示，支聯會將全力支持和聲援趙、艾二人，他們即日決定下星期日（10日）發起遊行到中聯辦，抗議北京拘禁二人，並要求立即釋放所有維權人士。 社民連主席陶君行也說，下周日會到中聯辦進行第八次聲援內地茉莉花行動示威，屆時會一併抗議中共拘押趙連海及艾未未。 曾去信中央領導人為趙連海「申寃」的全國政協委員劉夢熊昨指，他不認為趙連海為艾未未發聲的行動超過當局批准其保外就醫的底線，「趙連海都係出於義氣，因為艾未末聲援過佢，佢今次梗係要幫番艾未未」，認為當局不會再向趙連海採取拘捕行動，但有可能找他問話。 另一曾為趙連海求情的港區人大代表黃國健也稱，不覺得趙連海是次發聲會再被入罪；港區人大代表葉國謙則指未知趙連海此次有否違反任何保外就醫規定，但指他要為自己的言論負責。
20110407-109,20110407,109,拆局寧受傷也不讓孩子受罪,拆局 寧受傷也不讓孩子受罪 趙連海在沉默三個多月之後，終於義無反顧地再度現身維權，並表明以死抗爭的決心。從屈從當局的認罪及保外就醫安排，到挺身而出為艾未未及眾多維權人士發聲，趙連海心路旅程的轉變，已在經YouTube公開的錄影片斷中清楚表明：寧願自己這代人遭受委屈、遭受傷害，也希望孩子們不再受這份罪，因此，「我們不能保持沉默，我們也拒絕沉默」。 只望可觸動當局反思 北京當局近期大肆拘捕、檢控異見人士和維權人士，一方面是擔心阿拉伯國家的反獨裁反貪腐浪潮蔓延到中國，因此鐵腕鎮壓有可能引導示威浪潮的公共知識分子及網絡活躍人士，另一方面則是中共已揭開領導層換屆選舉的序幕，目前各省市區的領導班子調整，就是為明年中共十八大最高領導層換班鋪路，高層的權鬥白熾化之際，以中共寧左勿右的傳統，勢必嚴厲整肅異見言論、異見人物。 正如中共當年鬧革命時所倡言：「哪裏有壓迫，哪裏就有反抗。」當局的高壓政策，猶如為民怨沸騰的油鍋再添上一把火，拘捕艾未未、冉雲飛、唐吉田等藝術家、作家、人權律師，猶如堵塞民間抒發怨氣的最後渠道，令趙連海感受到官民衝突「到了一個前所未有的緊張狀態」，或者說已到臨界點。 不過，一如趙連海所說，內地維權人士並不希望出現社會動盪，對當局仍抱有一絲希望，期待當局尊重法治，兌現總理溫家寶維護社會公平正義的承諾。趙連海雖然捨得一身剮，但目標還不是要把皇帝拉下馬，只是希望可以觸動當局反思。但是，他們這點弱弱的心聲，能被權鬥中的權貴們聽進去嗎？結局是艾未未、冉雲飛獲釋，還是趙連海再陷囹圄？一點也不樂觀。 本報記者
20110407-110,20110407,110,逾百名異見人士被帶走,逾百名異見人士被帶走 【本報訊】自從有網民號召民眾發起「中國茉莉花革命」集會以來，內地加強對維權、異見人士的監控，周日（3日）被當局帶走、至今行蹤未明的艾未未更直言他是被監控對象。至今當局不但帶走逾百人，同時以涉嫌「煽動顛覆國家政權罪」，將親身參與、在網上發佈集會訊息者刑事拘留，目前最少六名異見人士被捕。 網載訊息亦被捕 自從網民號召，在今年2月20日起效法阿拉伯國家，舉行茉莉花革命集會以來，內地當局大大收緊對異見人士的監控，逾百名分佈在北京、上海、山東、浙江、四川、湖南、貴州等地的異見人士，相繼被當局帶走，部份則被當局禁止外出，防止他們參加集會。 在多次的集會之中，當局拘捕了多名參與者，當中來自廣東、在黑龍江哈爾濱參加集會的女子梁海怡，被指在廣場上高呼「還人民自由」口號而被捕，控以「煽動顛覆國家政權罪」。來自西安的魏強亦被指參與北京的集會，亦被當局以同樣罪名刑事拘留。 除親身參加集會，在網上轉載集會訊息的異見人士亦陸續被捕，其中包括八九前學運領袖丁矛、四川作家冉雲飛、四川維權人士陳衞及廣東維權人士鄭創添，亦被當局控以「煽動顛覆國家政權罪」。
20110407-111,20110407,111,被指未達保護級別梁啟超京故居　列入拆遷範圍,"被指未達保護級別 梁啟超京故居　列入拆遷範圍 北京為發展再度破壞歷史文物！西城區陶然亭粉房社區內的粉房琉璃街及潘家胡同內，青磚灰瓦、雕樑畫棟的院落近日全都披上了碩大的「拆」字，而散落於兩條胡同中的30多家擁有百年歷史的會館，包括梁啟超的故居，以及居於當地的3,000戶居民均處於拆遷範圍。中國文物學會呼籲關注將被拆的會館，並保護尚未列拆遷名錄的會館。 會館起源於明、清兩朝，當時一些外地來京的大官、鄉紳或富商集資置地建設會館，供來京趕考、辦事的同鄉吃住落腳，或舉行祭祀等大型活動，以方便照顧，交流信息和聯絡情誼。北京有記載的會館就有500多家，具有相當的文化歷史意義，但隨着房地產業的發展數量正逐步減少。 胡同滙聚34間會館 而由一橫兩縱三條胡同組成的粉房社區處於中心城區，正因地段稀缺而被納入區域建設項目。粉房琉璃街、潘家胡同3,000多家住戶均已接獲拆遷公示，當中有記載門牌的16家會館及18家無門牌記載的會館，都未有進入文物保護單位名單，全都處在拆遷範圍內。 「拆掉很容易，再找回來就相當困難了。」在拆遷範圍中最具爭議性的，莫過於梁啟超的故居，位於粉房琉璃街115號的新會會館，亦是唯一進入了文物普查登記項目的會館。據當地相關人員稱，去年曾有消息指該會館不會拆，連牆上的「拆」字也塗掉了，但後來文委部門又指它因不夠文物保護級別將如期清拆。 對此有內地媒體曾採用現場採訪、傳真等多種途徑聯絡文委相關部門負責人，企圖了解會館的具體情況，但都得不到任何回覆。對於有媒體以「梁啟超故居飲冰室面臨拆遷」為題作報道，西城區政府新聞辦公室昨晚突然指有關報道失實，辯稱梁啟超的書齋「飲冰室」應位於天津。但事實上梁1890年、1895年兩次赴京參加會試，1891年入京完婚及1898年回京參加百日維新時，均住在新會會館中四間北房，無法否定其歷史價值。 革命發源地意義深遠 「拆掉一定會後悔的！」當地居民對會館將消失亦表現得相當不捨。中國文物學會會館專業委員會會長湯錦程提到將被拆遷的會館時更是欷歔不已，他認為會館是擁有幾百年歷史的古建築，「是文化的載體，是革命發源地，擁有文物與革命教育的雙重意義和價值」，「像魯迅進京住在會館，康有為、梁啟超維新變法亦形成於會館」，不應被拆得支離破碎，同時呼籲政府關注會館的保育。 北京《京華時報》 部份遭清拆會館 新會會館 位於粉房琉璃街115號，院中套院，層次分明，目前為文物普查登記項目。梁啟超來京會試時曾住會館中路的四間北房，並在此結婚。 廉新會館 位於粉房琉璃街69號，會館大門兩側各有一個石墩，上有龍形雕刻圖案。兩扇斑駁滄桑的木門上所刻的對聯依稀可辨，上聯為「長治久安經綸盛世」，下聯為「春華秋實黼黻皇猷」，是勉勵進京考試的才子們刻苦學習，將來輔弼國家之意。 萍鄉會館 位於粉房琉璃街85號，曾是在京萍鄉人聚居地。院內四圍的房屋都是三間，街門是一間合瓦清水脊如意門。在光緒年間開啟了舉人上書之門，因「能言人所不能言、不敢言」而成為上書官員中領軍者的進士文廷式曾居於此。 龍綿會館 位於粉房琉璃街29號，由四川龍安府（今平武）和綿州（今綿陽）人合辦。戊戌六君子之一的綿竹人楊銳曾奔走於龍綿等各個四川籍會館，從「公車上書」到「百日維新」，此會館也成了他宣傳、鞭策維新變法的陣地。 資料來源：北京《京華時報》"
20110407-112,20110407,112,接受美聯社訪問茉莉花發起人揭面紗,接受美聯社訪問 茉莉花發起人揭面紗 中國「茉莉花革命」集會幕後發起人終揭開神秘面紗。一名自稱是茉莉花集會的22歲中國男子周日（3日）在韓國首爾接受美聯社訪問，指中國茉莉花革命由海內外受過高等教育的中國青年發起，其中八人在內地，12人在其他不同的國家，包括法國、日本、加拿大和韓國等。 王軍濤曾給予意見 他們透過電郵、網誌及社交網站發佈消息，但基於安全沒有公開身份。六四前學運領袖王軍濤曾給予他們意見。該男子強調，目前被中共拘捕的人士中，沒有一人涉及他們的行動。 該名22歲的男子說，現時80後及90後的年輕人不滿中國出現廣泛不平等及不公義情況，故發起這次行動。他和其餘19人在網上認識，甚至只知道對方的網名。 另一名身在美國紐約、名為「華哥」的27歲成員則指，這次革命純粹是為了爭取民主，並不涉及外國勢力。 中國茉莉花革命開始於今年2月20日星期日，在內地多個大城市的鬧市或廣場、澳門、香港，部份海外地區和台灣同時進行。此後固定於每星期日在各城市人流最多地點或是中心廣場進行散步和圍觀，每周活動的具體時間、地點等其他信息在中國茉莉花革命發起者部落格發佈。至今已舉行第七輪，但在當局嚴厲打壓下，活動規模越來越小。 美聯社
20110407-113,20110407,113,與抗議天王新婚四月台塑林志玲遭夫狂毆,與抗議天王新婚四月 台塑林志玲遭夫狂毆 台灣「抗議天王」柯賜海迎娶有「台塑林志玲」之稱的張美丹後，新婚四個月即傳出家庭暴力。張向台灣《壹週刊》稱，丈夫不顧她剛流產、身體虛弱，屢次霸王硬上弓，她不從便遭狂摑六、七十巴掌。目前張已報警，起訴柯恐嚇、家暴並申請保護令。柯昨日承認：「輕輕打了她四巴掌。」 斥夫索求無度 上周六被打致眼睛四周及顴骨瘀青腫脹，手臂和後頸都有明顯抓痕的張美丹哭着說，去年婚後她懷孕，因柯賜海硬要做那檔事，後來胎兒流產。住院回家後，柯又索求無度。她不肯，柯就將她的心口扯到紅腫瘀青。心灰意冷下她到友人家暫住，上周六她回到新居住所拿東西，柯也剛好回家，二人先是口角，後來柯將其推到牆壁，不讓她離開，之後再扯頭髮及拖她到沙發，騎在她身上毆打。直至柯要接電話她才逃出報警。 在台塑生醫科技有限公司任業務副經理的張美丹，去年11月與剛出獄不久、55歲的柯賜海結婚，當時被喻為「美女與野獸」的組合。上月28日，柯還在電視節目上大呼老婆是他的真愛，不料轉頭即爆出醜聞。有網民昨稱：「事實證明他不是野獸，是打女人的禽獸！」 無黨籍的柯賜海因活躍社會示威抗議而出名，有前空姐稱，柯在婚後曾與她發生多次性行為，更欠她245萬新台幣（約65萬港元）未還，但柯則否認。 台灣《壹週刊》
20110407-114,20110407,114,北師大教授訓示學生：40歲沒4000萬勿見我,"北師大教授訓示學生：40歲沒4000萬勿見我 「當你40歲時，沒有4,000萬（人民幣）身價不要來見我，也別說是我學生。」北京師範大學教授董藩周一（4日）在微博發文，稱「高學歷者的貧窮意味着恥辱和失敗」，隨即引起巨大爭議。 多數網友對他的言論持批評態度，認為教師不應用金錢衡量學生，狠批他是「中國高等教育的悲哀」，更證明中國大學已成為充滿銅臭的標準。有學者發文諷刺說看到他「方知不同的導師有如此不同的價值觀」；但也有網友認同他激勵人們創富沒有錯。他更與網友交鋒，當網友稱「還好不是我父親這麼說」，他回覆「你父親其實很希望你發財」。董藩昨在微博發表正式聲明以求息事寧人，稱其言論「僅是對學生講的勵志的話」，但部份網友顯然對此不領情。 四川《天府早報》"
20110407-115,20110407,115,兩岸快線台徵奢侈稅阻地產泡沫,兩岸快線 台徵奢侈稅阻地產泡沫 為應對房地產價格出現泡沫化風險，台灣財政部推出《特種貨物及勞務稅條例》草案，昨在立法院初審，由於順利通過而可能提前至今年6月就正式頒佈實施。該草案規定，持有非自用住宅的房屋，以及其座落基地、空地，如果在兩年內移轉，將分別按照實價徵收稅款，未滿1年者為15%、1到2年者為10%的奢侈稅。 台灣《蘋果日報》
20110407-116,20110407,116,發海嘯警告　女川核電廠斷電7.1級地震再襲日本,發海嘯警告　女川核電廠斷電 7.1級地震再襲日本 日本311的9級大地震，在東北關東造成超級災難，浩劫還未平復，本州東面近岸昨晚再發生強度達7.1級的大餘震，首都東京都有震感。當局隨即對東北各省發出海嘯警報，預期會有2米高海浪撲岸。由於核災未消除，核電廠安危備受關注，福島第一核電廠頓立即疏散「福島50人」，宮城縣女川核電廠反應堆再傳電源失效，青森縣的廢燃料棒再處廠外部電源也切斷。地震消息亦拖累美股一度勁瀉近百點。 地震發生在日本時間昨晚（周四）11時32分（香港昨晚10時32分），震央位於宮城縣仙台市以東100公里海底，震源深度49公里，震區包括宮城、岩手縣、青森縣、秋田縣、山形縣、福島縣和北海道等地。311地震震央則在仙台市以東130公里，兩次震區相若。美國地質勘探局（USGS）最初測得強度為7.4級，後來修正為7.1級。據報強震遠至345公里外的東京都感受到，建築物持續搖晃動一分鐘，香港天文台也錄得震動。 海嘯或高達2米 311地震後至今四周，發生過數以百計餘震，但強度鮮有超過7級。震後不久，已有1米高的海浪撲到宮城縣太平洋沿岸，未造成損毀，但當局預測之後可能會有高達2米的海浪來襲，而岩手、福島、青森及茨城各縣也會出現半米高海浪。電視台呼籲在近海地方的居民立即到高地暫避，並勸喻漁民勿冒險到海邊察看船隻。海嘯警報在發出後90分鐘解除。 地震後，東京電力公司立即檢查福島核電廠情況，這次餘震的震央距福島縣約140公里。東電昨天凌晨曾向福島第一核電廠1號反應堆注入氮氣，阻止因高溫而不穩定的反應再發生氫氣爆炸。幸好昨晚的強力餘震，未有令第一和第二核電廠出現異常情況，但東電因擔心建築物會震塌，引發爆炸，下令在廠內搶修的全部人員撤離。 福島的核電廠安全，在311地震後曾發生火警的宮城縣女川核電廠，在昨晚震後卻發現三個反應堆外部電源中的兩個暫時失效，日本原子能安全保安院指，該廠正借助應急電源，而冷卻系統現階段仍正常運作。而青森縣的廢燃料棒再處理廠外部電源也中斷，要啟用應急電源。 在仙台市太白區，有居民表示感到大約20秒震動，建築物左右搖晃。有住在17樓高的居民稱，家中電視機搖晃，廚房內的食具等掉到地下。仙台市街頭響起地震警報，警察都上街維持秩序。雖然手提電話服務正常，但有地方停電，有氣體管道和水管損壞，警方在宮城野區等更接到燃氣洩漏和火災報告，有JR火車站停電。 在岩手縣內陸的一關市，居民也說建築物劇烈搖晃，架子上的物件都震至掉下，甚至有家具打翻。雖然建築物未有嚴重損毀，但電力中斷，全市一片漆黑，但民眾尚算冷靜，走到街上，汽車則慢速行駛。 日本再傳地震，立即震動美國股市。地震消息在美股開市約一小時後傳來，立即拖累道瓊斯指數勁瀉近百點，最多跌95點，報12331點，但不足半小時已回穩，只跌不足40點。 法新社/美聯社/路透社/新華社
20110407-117,20110407,117,點滴日航籲員工無薪放假,點滴 日航籲員工無薪放假 日本核輻射危機導致赴日的外國遊客暴跌，日本航空業首當其衝，航班需求劇減，日航為縮減開支，昨呼籲1.2萬名員工在未來兩個月申請無薪假期，又表示會削減本月的國際航班，大部份為亞洲航班。 美聯社
20110407-118,20110407,118,絕望之後　希望重來痛哭女郎尋回愛犬笑了,絕望之後　希望重來 痛哭女郎尋回愛犬笑了 在一望無際的支離破碎中，個子小小的她孤身一人，脫了靴，赤着腳，抱腿而坐，悲苦哀嚎，絕望的神情，令人惻然。這張照片迅即成為日本311大海嘯的經典照，有記者對照片念念不忘，四出追尋，終於找到相中人。原來，她當天驚覺家園盡毀，13隻寵物狗全部失蹤，一下子崩潰了。但哭過痛過，她如今已笑容重現，找回兩犬，更振作了她活下去的希望。 這幀攝於宮城縣名取市的照片，震後三天出現在全球報章上，許多人為相中女郎的悲愴同悲同哀，可惜攝影師沒有問她的遭遇。女郎可憐的身影，一直縈繞在英國《每日郵報》記者瓊斯（DavidJones）心頭，在日本採訪震災期間，努力在人海中尋找女郎的下落。三周過去，女郎終於在名取市一間收容中心，看到記者貼在尋人告示板的照片。 女郎的名字叫伊藤茜（ItoAkane，譯），28歲，任職陪酒女郎，與建築工人男友和他的母親，住在名取市小鎮閖上港一間兩層的木房子。家中還有13隻狗，當中6隻是芝娃娃，全是她疼愛的孩子。 13「孩子」失蹤　房子全毀 311那天，伊藤與狗在樓上看電視，大地震襲來，房子沒大損毀，只是水電煤中斷。「停電令我們看不到電視聽不到廣播，不曉得海嘯將至。我們都不擔心，因為幾年前有過大地震，海嘯的浪才10厘米。」 男友當時在上班，伊藤和男友媽媽決定開車去買電池和食水。「狗兒有點怕……但我們以為快去快回，應該沒問題。」大約一句鐘後，她們回家途中才聽說有大海嘯，於是把車開山上。 「我以為浪再高也高不過二樓，狗兒應該沒問題……第二天，我想回家找牠們，豈料全市水浸，無路可通。我根本不知道房子全毀。直到兩天後，男友駕車載我們回去。」 「我坐在本是大門的地方」 那張照片就是攝於3月13日上午11時左右。「我坐在本是房子大門的地方，驟然明白我們已失去一切，心愛的狗兒也全部下落不明，我驚呆了。」伊藤坐在原地哭了一句鐘，直至男友找到祖母後回來接她。 這次災難奪去了萬多人性命，伊藤與男友、男友母親和祖母都安然，是不幸中的大幸，但13隻狗兒，恐怕凶多吉少吧。可是，伊藤拒絕放棄希望，在收容中心安頓下來後，把精力全放在尋找愛犬上她在鎮上每個告示板都貼上尋犬啟示，在社交網站留言求助，走遍大街小巷，信心和努力終於有回報。6歲尋回犬「阿明」在離家約1.6公里地方，由一個好心家庭帶回家，那家人發現伊藤的啟示，讓她跟阿明團聚。 「我接到他們來電說阿明安全後，真的很開心，這令我有力量去找其他狗。」不久又有好消息，貴婦狗「阿桃」在離家約6.4公里的地方，遇到一名好心女子，送到一間寵物店，店東在社交網寫出阿桃的遭遇，伊藤很快領回阿桃。 跟阿明、阿桃重逢，伊藤更有信心能找到其他狗兒。「對我來說，狗是家人。人家說，父母為子女，可以犧牲自己，我沒有孩子，但我對狗兒也是這樣。這也是照片中的我如此傷心絕望的原因。」 說起照片，為甚麼伊藤要在滿地瓦礫的地方脫掉膠靴？「我當時茫然極了，完全不記得幹過甚麼。那對靴是親戚借我的。」雖然連鞋都要借來穿，伊藤抱着兩犬露出笑容。 英國《每日郵報》
