key,date,article_daily_id,title,text
20110522-252,20110522,252,潛力龐大瞄準回教徒拓清真腸衣,潛力龐大 瞄準回教徒拓清真腸衣 神冠今年將會拓展針對回教徒的清真腸衣業務。周亞仙形容，清真腸衣在製作技術上和普通腸衣完全一樣，只是須額外請專人為屠宰的牛隻進行超渡，並確保在生產過程中，不會接觸到任何豬隻，甚至連員工的飯堂也不可以有豬肉。只要取得相關伊斯蘭組織認證許可後，便把產品銷售往海外。 周亞仙表示，神冠是中國首間進軍清真腸衣市場的企業，而全球具規模生產清真腸衣的公司，亦只得兩間；由於信奉回教的人數佔全球總人口達25%，故清真腸衣的市場潛力可以非常龐大。周亞仙透露，現時公司已撥出20條生產線生產清真腸衣，並在國內進行小量銷售，現只待取得正式認證，便會開始把產品推廣至海外市場。 周亞仙指，清真腸較普通腸衣貴5%至10%，由於其他行政費用較多，故盈利率與普通腸衣相距不大。
20110522-253,20110522,253,高談闊輪：新股熱再起　利港交所 - 司徒光耀,高談闊輪：新股熱再起　利港交所 - 司徒光耀 大市成交萎縮，上周五更低見577億元，拖累港交所（388）亦持續窄幅上落，惟新股熱潮再起，有望刺激其股價。港交所上周五收報173.3元，微跌0.1%，自5月4日失守100日線後，持續整固，逐漸形成小圓底，頸線約處175.6元，與100日線相若，並連續兩日企於50日線之上，MACD作勢發出牛差距，或顯示股價有上升動力。如認為有望突破圓底頸線，可考慮成交理想及街貨量較低的價外認購證25735。 油價由5月初高位每桶逾114美元回落，一度跌穿95美元，惟月內三度測試95美元均能重回其上，顯見具支持。油價探底有利上游油股如中海油（883），上周五收18.14元，跌0.1%，技術上雖以一浪低於一浪形態下行，惟9RSI反見一底高於一底，顯示動力正在凝聚。如看好可留意成交活躍及引伸偏低的貼價認購證25628。 司徒光耀　高盛（亞洲）執行董事 投資涉及風險，認股權證及牛熊證的價值可急升亦可急跌，投資者可能會蒙受全盤損失，購買前應確保了解認股證或牛熊證的性質，詳閱有關上市文件並尋求專業意見。
20110522-254,20110522,254,法證攻防：輪證升不足　篩走有法 - 郭小菱,法證攻防：輪證升不足　篩走有法 - 郭小菱 投資選擇窩輪，最常用的指標是成交量及引伸波幅，數據雖多少反映市場趨勢，卻有其局限。高成交只代表承接多，未必代表市場看好或看淡相關資產，特別是敏感度高的窩輪。至於引伸波幅雖可反映窩輪的平貴，但「低窩」卻會迎來高槓桿，升跌速度增加亦非每個投資者所好，若看錯方向有可能會由買平貨變蝕本收場。 那甚麼才是挑選窩輪的較佳指標呢？投資者可考慮法證指數（www.bnppwarrant.com），可追蹤撇除引伸波幅下，窩輪或牛熊證的價格變化，是否與相關資產的價格變化相近。計算方法是利用實際槓桿計算輪證的理論升幅，再將其實際價格與理論價格作對比，指數0代表輪證價與資產價變化同步，大於0代表輪證實價高於理論價，小於0則相反。 由於沒有計及引伸波幅，而引伸波幅又對輪價有決定性作用，故法證指數如處於-2至2，是投資者不妨參考的選擇。跟行程度高的輪證，代表跟資產價格維持同步升跌，有助投資者篩走「升不足」的輪證。 郭小菱　法國巴黎銀行上市衍生產品部董事 以上資料並不構成買賣建議、邀請、要約或游說。結構性產品涉及高風險，價格可升亦可跌，投資者可能蒙受全盤損失，投資前應了解風險，並諮詢專業顧問。
20110522-255,20110522,255,財話短說中駿估內房快掀減價潮,財話短說 中駿估內房快掀減價潮 ▲中駿置業（1966）執行董事兼常務副總裁李維（圖）表示，近月內地樓市成交量減少，單計五一首兩日假期，北京成交量一手及二手已分別按年減少44%及53%，反映中央調控政策效果已逐步出現，而近期部份城市個別樓盤減價，部份減幅逾10%，他預期內地將於下半年出現降價潮。
20110522-256,20110522,256,窩輪通識：中移或見底　揀C輪,窩輪通識：中移或見底　揀C輪 滙控（005）月中公佈遜市場預期的首季業績後，股價反覆向下，經過連日調整，日前股價已回落至250日線約80.76元爭持，上周五收報81元，接近保歷加通道底部約80.65元。其購證過去連續10個交易日錄得資金淨流入，如欲短期內博滙控反彈，較進取的可留意10兌1的價外高槓桿購證28299，行使價90元，7月到期，實際槓桿21倍，引伸波幅約22%。 惟須留意滙控10日線剛跌穿200日線，技術分析上屬偏淡，投資者如中長線看好滙控而欲趁低吸納，可留意持倉成本較低的長期貼價滙控購證24534，行使價83.88元，2013年1月到期，實際槓桿約5倍。 日前有報道指中移動（941）將下調通話收費，平均減幅約15%，市場擔心對其業績盈利將有影響，近日中移動股價持續受壓，連日來於69元水平好淡爭持，最低見68.60元，已回落至3月17日近68.50元的兩年低位附近。投資者如認為中移動於現水平附近可建立雙底支持，可留意價外中移購證11152，行使價78元，10月中到期，實際槓桿約13倍。 摩根大通股權衍生工具部 資料由摩根大通證券（亞太）有限公司編制，僅供參考。結構性產品價格可升可跌，投資者應詳閱有關上市文件並評估風險，並在需要時諮詢專業意見。
20110522-257,20110522,257,財話短說中播研購美廣播頻道,財話短說 中播研購美廣播頻道 ▲中播控股（471）董事長黃秋智透露，集團需要在未來進一步物色收購及在美國購入廣播頻道，建立寬頻，藉此利用CMMB（中國移動多媒體廣播）技術主攻當地下載市場，因此有需要透過集資、股東注資，應付建立業務所需。另外，集團擬將內地廣電部研發的CMMB技術，引入紐約作商業營運，他估計需時半年始錄得收入。
20110522-258,20110522,258,財話短說中國風電售附屬　獲利兩億,財話短說 中國風電售附屬　獲利兩億 ▲中國風電（182）宣佈，其全資附屬瓜州協合風電，將向同業吉林電力及吉林協合出售其於瓜州公司的51%股權，涉資5.91億元，預期可得未經審核收益1.99億元。其中46%股權由吉林電力購買，涉資5.33億元，另外5%股權則由吉林協合以5800萬元買入。
20110522-259,20110522,259,華生論證：引伸波幅跌　轉捧窩輪 - 曾少華,華生論證：引伸波幅跌　轉捧窩輪 - 曾少華 美國聯儲局第二輪量化寬鬆措施（QE2）將於6月份完結，美元滙價自月初開始反彈，暫時於高位出現回吐，隨即為商品及股市帶來支持。 港股受新股集資及市場觀望情緒影響，全周交投偏靜，恒指重上並守穩10日線，初步升破此浪調整的阻力區，留意上升動力能否進一步加強。大市波幅不足，投資者轉投個股，滙控（005）、中移動（941）及國壽（2628）窩輪交投活躍。 現時市場的引伸波幅已回落至低水平，以窩輪入場較化算。若看好國壽，可留意購證11646，行使價28.05元，2011年10月到期，實際槓桿約8.6倍，引伸波幅約28.9%。看好滙控則可留意購證11827，行使價88.93元，2011年11月到期，實際槓桿約11倍，引伸波幅約26.4%。看好中移動可留意購證11509，行使價78.05元，2011年10月到期，實際槓桿約13.4倍，引伸波幅約22.3%。 曾少華　蘇格蘭皇家銀行股票衍生及結構性產品董事 筆者為證監會持牌人，並無持有上述證券。結構性產品價格可升可跌，投資者可能損失全部投資。投資者應評估產品涉及之風險，並諮詢專業顧問及查閱有關上市文件。
20110522-260,20110522,260,窩輪心德：博滙控彈　Call價外輪,窩輪心德：博滙控彈　Call價外輪 恒指連升3日，上周五收報23199。之前提到恒指牛證總街貨升越40億份是一個警戒水平，多次提醒投資者要小心恒指變化，近數天已見牛證街貨逐步回落，上周四跌穿40億份。上周五窩輪資金情況，投資者較傾向選擇恒指熊證，個股流入資金則較分散，早段以騰訊（700）認沽證為主，但午市轉升為跌，部份投資者選擇沽貨獲利。 滙控（005）認購證自5月4日起連續11個交易日錄得資金流入，金額約6800萬元，日數雖長但每日流入金額不算多，反映投資者信心仍不大，寧觀察周五倫敦股東會情況。滙控250日線處80.77元水平，保歷加通道下線則處約80.30元水平，一旦失守參考78元的3月17日低位。看好滙控而不想投入太多資金，可考慮價外證11260，行使價91.88元，9月到期；或牛證63479，收回價78元，行使價75.50元。看淡可留意認沽證22499，行使價82元，10月到期；或熊證68478，收回價88元，行使價90.50元，7月到期。 德銀環球市場證券部 撰寫人為德銀環球市場證券部代表，本身為證監會持牌人士，撰寫人並無持有文章提及之證券，而德意志證券是德銀認股證及牛熊證之流通量提供者。
20110522-261,20110522,261,財話短說保交所仍待批准成立,財話短說 保交所仍待批准成立 ▲中國保監會主席助理陳文輝出席上海陸家嘴論壇時透露，中保監正與上海方面研究建立保險交易所的問題，他指保交所在國際上既有成功經驗，也有失敗教訓，沒有非常標準的模式。內地傳媒引述知情人士表示，保交所成立一事已進入國務院的審批階段，將落戶上海。
20110522-262,20110522,262,世說權證：炒中材回歸A股　敲購證 - 翁世權,世說權證：炒中材回歸A股　敲購證 - 翁世權 港股近月呈橫行局面，恒指在23000水平附近徘徊，上周五收報23199，一周微跌177點或0.33%。大市缺乏明確焦點，建材類股份吸引投資者注意，當中有報道指中國建材（3323）或回歸A股，刺激中材相關認購證過去一周錄得資金追捧。 值得留意是，踏入5月份港股呈橫行局面，大市波幅收窄。恒指上周高低波幅只有480點，是自今年1月底以來，以點數計最低波幅的一周。恒指30日歷史波幅，亦較對上一周下跌1個波幅點；與一個月前比較，更下跌近5個波幅點，反映港股波幅已經收窄。 上周有傳媒報道，中材管理層指集團正考慮回歸A股上市，但未有確切的時間表。中材上周五收報14.2元，下跌2.74%，一周計則下跌10.1%；過去一周中材失守10日和20日線，目前可留意50日線13.93元的支持力。 中材認購證11637上周五收報0.152元，是當日第三活躍的中材窩輪，行使價16.88元，今年11月11日到期，實際槓桿約3.9倍，引伸波幅59.5%，屬中年期價外認購證，適合看好正股將回升的投資者。 翁世權　渣打認股證銷售董事 本文作者為渣打銀行(香港)有限公司之僱員及金管局註冊人士，其並無持有上述股份。本文為推廣目的而編制，並非獨立研究。
20110522-263,20110522,263,中環在線：證監CEO臨走俾同事玩 - 李華華,中環在線：證監CEO臨走俾同事玩 - 李華華 上周五真熱鬧，呢邊廂記協舉行周年晚宴，港交所（388）行政總裁李小加出席撐場。另一邊廂，證監會亦喺同一晚舉行周年聚餐兼歡送下月底離任嘅行政總裁韋奕禮（MartinWheatley）。華華聽聞，證監各個部門各自拍咗條短片送畀韋奕禮留念，幾位執行董事都有粉墨登場。不過唔知點解，惟獨被視為下任CEO候選人之一嘅副行政總裁林張灼華就冇拍片，難免令人無限聯想。 張灼華唔畀面有因 據講，證監新CEO遴選已進入直路，同林太爭嘅主要係老外，Martin嚟自英國，英國嚟嘅會唔會着數啲？聽講唔一定。證監俾人話有澳洲幫，唔通係澳洲嚟嘅人做？華華未有答案，煩請消息靈通人士告知。 講番歡送晚會，相比起記協晚會喺金鐘五星級酒店舉行，證監都算慳家，揀咗喺大會堂美心酒樓度搞。咪睇證監人員平時咁嚴肅，原來玩起上司上嚟都好放，聽講法規執行部班執法先鋒拍嘅短片內容就非常「大膽」，條片嘅內容係咁嘅…… 話說法規執行部阿頭施衛民工作至夜深，突然有批「雷曼苦主」衝入嚟示威，叫韋奕禮返歸。跟住到法律服務部門接力拍「續集」，佢哋整咗個模擬法庭，受審嘅係Martin，佢被控保障香港投資者同維護金融中心地位不力，被即時裁定罪名成立，將佢遣返老家倫敦。唔知林太係咪唔想咁樣攞Martin嚟玩，所以冇拍片呢。 李華華 mailto:LiWaWa@AppleDaily.com
20110522-264,20110522,264,德智論衡：國策扶持水泥股看俏,德智論衡：國策扶持水泥股看俏 今年內地樓市其中一個重要的結構性變化，是中央將加快保障性住房的建設。中國計劃在2015年前新建3600萬套保障性住房，計劃對投資有深遠的啟示，德盛安聯成員公司RCM認為，這個項目對中國持續增長的意義重大，因為貧富懸殊差距日益擴大，威脅社會穩定。然而，這與其他不少「善意」政策一樣，知易行難。 國務院總理溫家寶於人大會議上提出，保障性住房的建設，就是從供求上解決房地產市場存在的問題，除了棚戶區改造外，主要有公租房和廉租房。中央提出今年建保障性住房1000萬套、明年再建1000萬套，今後5年累計建設3600萬套。 計劃於年內新建的1000萬套保障性住房，建築成本將高達1萬億元人民幣，佔中國國內生產總值近3%（假設土地費用全免）。中央政府將提供補助，或令成本降低15%至20%，但餘下資金仍需由地方政府籌措。其中部份住房將撥作「經濟適用房」，可供銷售，故項目可自行融資；但多數（可能佔大部份）住房將以「租貸房」形式租予低收入工人，因此需由地方政府出資興建，對銀行造成一個潛在的問題。 假設銀行最終批出整個項目建築成本一半的貸款，意味銀行體系在未來5年須承擔約3.5%國家服務類貸款。除非收取市值租金，否則建築成本（每平方米2000元人民幣）的回報將無法趕上現時約6厘的借貸利率。因此，投資者難免質疑銀行的中期盈利能力、資產質素和資金需要。 小型發展商或遭淘汰 就私人物業發展商而言，有關消息並非全然負面。一些未能提供優質產品或財政狀況欠穩健的小型發展商，由於「經濟適用房」的替代效應、客戶群集中（抑制多個物業擁有權的宏調措施將持續）以及加息等機會，或令其被迫退出市場；反之，上市公司的市場佔有率或借機上升。若國有發展商獲邀參與建造保障性住房，需注意其邊際利潤。 物料業已受惠於這個政策。在供應緊絀的情況下（當局關閉效率欠佳及高污染的廠房，加上預期市場期望保障性住房的需求增加），水泥股估值被大幅重估。由於預期市場上更多私人環節供應會被迫退出市場，故我們將更專注於供應面分析。 德盛安聯資產管理
20110522-265,20110522,265,中環在線：3D手袋贈港交所 - 李華華,中環在線：3D手袋贈港交所 - 李華華 「新股超購王」米蘭站（1150）今日掛牌，按照慣例，主席姚君達會喺上市儀式送番份紀念品畀港交所（388），斷估唔會送個二手袋啩？冇錯，係送袋，不過係送袋形嘅蛋糕！ 華華收到風，姚君達揀咗天后嗰間餅店CakeSquare，幫佢整個10x11吋嘅綠色3D手袋蛋糕。至於手袋款，唔係Gucci、唔係Prada，而係米蘭站自家品牌MS（MySignature）嘅Ice-cream系列。除咗潮送手袋，今日傍晚米蘭站仲訂咗喺WHotel開上市祝捷party，一於繼續潮爆。
20110522-266,20110522,266,中環在線：李小琳$10萬行頭 - 李華華,中環在線：李小琳$10萬行頭 - 李華華 中國電力（2380）上周五舉行股東會，主席李小琳一如以往，悉心打扮亮相。據華華所知，佢身上着住嘅Chanel2011年春夏系列，就算有錢喺香港都買唔到，皆因裙款香港專門店冇得賣，上衣逾5萬蚊，港已斷貨。配襯同樣係Chanel出品，價值1.24萬蚊嘅珠鏈，李小琳全身行頭起碼值10萬蚊，唔講得笑！同系列香港有得賣嘅款式（左圖），上衣3.79萬蚊，裙2.4萬蚊。 李潤芳攝
20110522-267,20110522,267,暢談富論：經濟復蘇利高收益企債,暢談富論：經濟復蘇利高收益企債 4月份市場其中一個重要消息，是歐元加息了，為2008年下半年金融海嘯爆發以來首次加息。歐洲央行於4月7日宣佈，將政策利率由0.25厘的歷史低位，上調至1.25厘，商品價格上揚導致已經升溫的通脹問題進一步加劇，比如倫敦布蘭特原油於4月底已超越每桶125美元，因此不少新興經濟體均繼續收緊政策，即使是經濟復蘇落後於金磚四國（巴西、俄羅斯、印度及中國）其他成員的俄羅斯，亦於4月尾突然加息。 在經濟復蘇、息率上調的大環境中，企業債券正吸引固定收益投資者的目光，尤其是高收益債券。由於高收益債券的信貸評級一般低於政府公債及投資級企業債券，因此通常要提供較高的孳息率以補償投資者承受較高的違約風險，然而，隨着經濟好轉、企業違約率下降，有關風險在一定程度獲得緩和，因此近期高收益債券的投資意欲正持續升溫。此外，最近幾年環球股市的波動越來越劇烈，亦吸引投資者由企業股東轉作債權人。 財政改善違約率降 踏入2011年以來，企業信貸市場延續自2009年中環球經濟改善的升勢，錄得強勁增長。目前利好的基本因素包括：（1）企業盈利反彈及企業信貸基本因素向好，尤其美國企業盈利的反彈速度更超出大眾預期；（2）企業現金結餘達到歷史高位，反映強勁的自由現金流及早前去槓桿化所取得的成效；（3）企業方面的表現也持續反映出營運槓桿效益、成本效益、全球化及勞工生產效率的提升。此外，現在許多美國投資級企業資產負債表上的現金已接近歷史最高水平，可能會尋求併購機會，從而利好非投資級別的高收益債券。 具體而言，我們看好能源行業的高收益債券。在環球市場（尤其是快速發展的新興市場經濟體）需求高企的情況下，我們認為石油價格應會繼續上揚，其中部份能源債券，可能因為現金充裕的投資級公司之收購行動而受惠。 我們同時看好無線電訊行業，原因包括現金流量穩定、美國手機通訊蓬勃發展以及4G技術即將推出。此外，我們也對金融行業持積極態度，因為自金融危機以來，大部份公司的財政狀況已改善。 富蘭克林鄧普頓投資
20110522-268,20110522,268,大環境小投資：美歐日國債有泡沫 - 潘國光,大環境小投資：美歐日國債有泡沫 - 潘國光 隨着商品價格從高位下調，市場擔心商品泡沫爆破。過去30年，貴金屬、汽油及美國家庭的房屋、基本日用及必需品價格上升了1至3倍不等，表面看來頗為驚人，惟同期美國總負債升近15倍（見圖），筆者認為後者才是當前金融市場最大的潛在泡沫，最終將必須透過違約或貨幣貶值來解決。 至於歐債方面，預期歐盟會要求希臘選擇局部違約的方案，以保歐元的完整性，惟此方案一旦落實，將表明之前的注資拯救已失效，暗示未來愛爾蘭及葡萄牙亦有可能要步其後塵。 美國債回報降 美國聯邦政府負債上周觸及14.3萬億美元的法定上限，財政部從17日起開始動用公務員退休基金以應付必需開支，直至國會同意提高發債上限為止，未來兩個月，預料兩黨將就削減開支激辯。市場對此消息沒有太大反應，因為傳統上美國國債都被視為無違約風險。加上近日美國新屋動工數字跌近歷史低位，工業生產數據也比預期差，令市場只留意經濟復蘇的去向，多於美國潛在的信貸風險。 債券大王格羅斯一直看淡美國的財政狀況，認為美國將持續壓抑國債的實質利率，犧牲長線國債投資者的利益，並指長期投資美國國債是「自暴自棄」的行為。PIMCO行政總裁伊爾艾朗更預言美國為減輕還債壓力，將會延續低息環境，令國債投資者因通脹而受損，他更認為歐洲未來將有至少一個，甚至越來越多國家需要進行債務重組。 筆者認為，未來幾星期將頗為關鍵，隨着全球經濟放緩的氣氛漸濃，美歐日等多國政府最終將被迫再次採納某種形式的寬鬆措施，其間美歐日元相對其他新興國家及商品貨幣，料將再度回軟。相對成熟國家負債多年以來累積的升幅，筆者並不認為當前的大宗商品，尤以貴金屬及能源存在泡沫風險，因為真正的泡沫存在於成熟國家的國債。 之前有美國投資大行估計，美國不會透過高調賴債的方式來解決問題，因為聯儲局擁有一部印鈔機，大可利用印鈔來還債，故償還本金及利息是不會少的，但償還貨幣的購買力則會減少，這也是另類低調的違約方法。 潘國光 富邦銀行（香港）第一副總裁兼投資策略及研究部主管
20110522-269,20110522,269,中環在線：長者上書催按證公司做嘢 - 李華華,中環在線：長者上書催按證公司做嘢 - 李華華 按揭證券公司密鑼緊鼓，籌備為老人家而設嘅安老按揭計劃。年紀唔細嘅華華，都好心急想知進度如何，咁啱前幾日喺中環碰到總裁劉怡翔（James），即刻掹住佢問詳情，唔問猶自可，一問就有古仔聽。 James話，有日收到封外觀有啲殘舊同發黃嘅信，拆開一睇，原來係一位老人家代表成班長者朋友寫嘅，內容大致係感激按證公司研發安老計劃，惠及佢哋呢啲退休後冇乜收入，但仲有層樓揸手嘅老人家。佢哋好心急等緊安老按揭計劃出台。James話起初收到封信時，以為十之八九係投訴信，點知呢一紙書箋，原來係一份鼓勵。James話正快馬加鞭，同銀行洽談計劃細節，有信心唔使幾耐，可以向呢班老人家有所交代。
