key,date,article_daily_id,title,text
20110305-196,20110305,196,理財第一波：投資與花費6000元 - 李兆波,理財第一波：投資與花費6000元 - 李兆波 昨天敏妮教人如何使6000元，或說如何用6000元。坊間多了相關的討論，皆因我們的政府不懂甚麼是投資，甚麼是花費。 如何用可以分為投資性及消費性，後者包括買衣服、食一餐好的晚飯、去一個短線旅行、換手機、買iPad2，可謂琳瑯滿目。投資則包括買債買股買輪，視乎閣下的投資經驗及風險承受程度。 有位精神病康復者朋友，年輕而貌美，充滿智慧，比一些沒有理財經驗，胡亂管理市民財富的官員高多個層次。她打算在好的價位，利用6000元購入一手工商銀行（1398），實行以錢搵錢。工行是四大內銀股，每手1000股，股價6元的話，一手剛好6000元。09年度每股派息0.17元人民幣，約0.2港元，一手有200元。可以考慮在6元以下，約5.8至5.9元才購入，用上兩年時間，先收股息，再賺股價，一定比放在強積金好。大家要尊重強積金的精神，但是否額外供款要看收費及回報。 工行的股息回報率有3.1%，另一個投資方案是把現金放在內地的人民幣定存戶口，存款息一年有3%、兩年3.9%、三年4.5%，更可受惠人民幣升值。政府計劃發行ibond，息率可能有3%至4%，是可以考慮的選擇，但手續費會比定存高。 買工行　回報勝強積金 政府以為有錢可以亂派，如何派？為甚麼18歲以下及新移民卻沒有？澳門已有多次派錢的經驗，它們可以在兩個月內把支票派到市民手內，香港會如何？大家拭目以待。人數多少不是藉口，最重要的是有智慧。 我會發起中學母校把收到的款項捐出來，不論多少，成立一個基金，讓投資收入支援一些經濟上有困難的師弟妹，名字可能叫「XX校友2011年預算案獎學金」，使有需要的人受惠，及記起如何去理財。 李兆波 中大酒店及旅遊管理學院會計與財務高級導師 mailto:simonsplee@gmail.com
20110305-197,20110305,197,英超矚目大戰：泰維斯堪稱剋星　曼城勢毀「根」 - 吾中,英超矚目大戰：泰維斯堪稱剋星　曼城勢毀「根」 - 吾中 曼城雖然剛傳出後衞高路托尼藥檢不合格的負面消息，但球隊於主場表現一向有保證，加上前鋒泰維斯又「食住」韋根，在周六的英超聯夜場迎戰包尾的韋根時，曼城絕對有力將對手連「根」拔起，直取[-1]的曼城開「主勝」。 吾中 球賽編號：星期六54 曼城vs韋根（有線201及301台直播） 01:30　06/03 曼城目前以28戰得50分排第3，落後榜首的曼聯10分，但領先第4位的車路士2分，為追近曼聯兼保住前3直接踢下屆歐聯分組賽，曼城今役必拼。雖然，曼城於賽前傳出中堅高路托尼因藥檢不合格而被罰停賽（見另文），不過，另一中堅高柏尼料可傷癒復出，而且，曼城仍有多名球員如謝路美保定及米卡李察士等可串演中堅，而且他們今役對手韋根亦攻力疲弱。 主場出擊有保證 再者，曼城今屆於主場表現有保證，近9場主場更取得8勝1和，而兩大攻擊球員迪斯高及泰維斯都料會於今役復任正選，令球隊如虎添翼。可別忘記，泰維斯近兩次鬥韋根共入了4球，其中包括上屆於聯賽迎戰韋根時連中三元，今役絕對是韋根後防心腹大患。 韋根近況極低沉 反觀韋根，由於下游3弱韋斯咸、西布朗及狼隊近仗不時成功搶分，因此，這支西北球隊目前已淪為包尾大幡，若不振作，下屆隨時英冠聯見，故今役亦料會全力搶分。不過，問題是韋根近況甚頹，近9仗僅一勝，而且進攻模式又單調，就算今役基本上可以「夫添」，主力如前鋒洛達列加、中場賓屈臣及尼索比亞等全部可以候命，都不宜高估。 曼城單W只有1.28倍，可謂熱透，合心水的話不妨直取[-1]的曼城「主勝」，有1.9倍。波膽方面，由於曼城後防不時會大意失波，故宜取他們有失球的波膽，可考慮曼城勝3:1及4:1。 星期六54 曼城vs韋根 半全場：主/主 盤口：曼城[-1] 讓球主客和：H主勝 3:1
20110305-198,20110305,198,趣趣地：雲格撐高路托尼到底,趣趣地：雲格撐高路托尼到底 科特迪瓦後衞高路托尼（圖），因藥檢肥佬而被曼城禁止參加任何操練及賽事，阿仙奴領隊雲格，日前就話高路托尼係食錯老婆啲減肥藥而出事，高路托尼日前亦親口承認真係咁。聽聞佢覺得自己好蠢，家陣佢面臨全球性嘅停賽處分，最高會係兩年。好彩佢屋企人，包括一齊效力曼城嘅耶耶托尼，同埋隊友韋拉都好撐佢，雲格更加話肯做佢嘅人格證人，令到佢喺呢次食錯藥事件上唔使孤軍作戰。
20110305-199,20110305,199,周日及一各地聯賽賠率表,周日及一各地聯賽賠率表
20110305-200,20110305,200,趣趣地：格蘭請阿巴食檸檬,趣趣地：格蘭請阿巴食檸檬 韋斯咸近排反彈，搞到領隊格蘭（圖）都做咗搶手貨。有消息話，車路士班主阿巴想搵當年做過佢哋隊波領隊嘅格蘭，返嚟做足球總監，不過佢就俾格蘭請食檸檬。格蘭話好享受成為足球總監，但就更享受成為領隊。另外，佢話好愛韋斯咸，而且同球會嘅職球員建立咗良好關係，所以現階段唔打算離開。咁又係，如果格蘭返咗車仔之後，車仔季尾乜到攞唔到，佢做硬代罪羔羊，所以真係走唔過。
20110305-201,20110305,201,西甲攻略：捧巴塞[-2]照「薩」 - 牽牛,西甲攻略：捧巴塞[-2]照「薩」 - 牽牛 巴塞隆拿的傷兵問題已漸紓緩，周六西甲主場出擊，面對中下游分子薩拉戈薩，正好以大勝向阿仙奴示威，「讓球主客和」巴塞讓[-2]，也照取「主勝」。（球賽編號：星期六65；now632、633及660台明日3:00am直播） 近季巴塞隆拿都有「黑色2月」，今季表現亦有少許下滑，連同盃賽以4勝1和1負完成2月賽程，唯一敗仗是歐聯16強首回合作客以1:2不敵阿仙奴，下周中回師主場上演次回合，球隊連續兩場主場出擊，沒有太大留力必要，而且今仗對手非強，可期大勝嚇窒兵工廠。 巴塞傷兵漸回戰陣 巴塞的「黑色2月」除了戰績跌watt，還受到傷停問題困擾；幸踏入3月情況已有改善，小腿受傷的沙維，上仗對華倫西亞已復出，丹尼爾上仗也停賽復出，他與球隊的續約談判亦有進展，料接受人工加碼，續留在魯營。雖然後衞佩奧爾已復操，但球隊為安全計，將與門將域陀華迪斯休息，留待對阿仙奴才復出。 美斯亦在近期回勇，連續3仗為球隊建功，特別是皇馬翼鋒基斯坦奴朗拿度，在周中對馬拉加一戰中演帽子戲法，西甲入球又追上美斯的27球，兩人都西甲神射手叮噹馬頭，美斯面對弱旅豈會不全力增取入球。 薩拉戈薩作客甚弱 薩拉戈薩自換上墨西哥教練艾古爾，護級形勢稍有改善，上仗更擊敗實力不錯的畢爾包。不過作客問題仍未改善，今季12場作客只曾一勝，表面上6場取得和局，不敗率也未算低，但只因賽程安排，薩軍仍未作客前列球隊。以薩軍作客愛斯賓奴，也淨吞4蛋，今仗遇上巴塞隆拿市「1哥」，更難逃大敗。不過始終薩軍前鋒烏捷回勇，有力破蛋，主隊勝5:1的18倍波膽可小敲。 星期六65 巴塞隆拿vs薩拉戈薩 半全場：主/主 盤口：巴塞隆拿[-2] 讓球主客和：H主勝 5:1
20110305-202,20110305,202,〈蘋果波經〉名家擂台（3月）,〈蘋果波經〉名家擂台（3月）
20110305-203,20110305,203,薩拉戈薩擁英超頹兵 - 牽牛,薩拉戈薩擁英超頹兵 - 牽牛 英超與西甲風格截然不同，由英超球隊跳槽至西甲，要適應並不容易；後衞保羅達施華今年1月，才由新特蘭轉至薩拉戈薩，苦等多時，上仗對畢爾包才有後備上陣機會。這位巴拉圭國腳說：「比較之下，西甲的節奏沒有英超那樣快，而球員亦講求更多控球，不過與我在國家隊的風格相似，我有信心在薩軍穩佔席位。」而薩軍也不乏前英超兵，捷克的查洛錫踢過車路士，頭槌仍算上乘。前利物浦球員龐高尼，則是薩軍後備殺手。 文：牽牛
20110305-204,20110305,204,周日及一各地聯賽賠率表,周日及一各地聯賽賠率表
20110305-205,20110305,205,西甲大勢：馬略卡唔怕華倫 - 牽牛,西甲大勢：馬略卡唔怕華倫 - 牽牛 西甲前4位置甚明朗，周六兩支前4球隊分別作客，其中以第3的華倫西亞作客馬略卡最為凶險，以華倫心繫歐聯，馬略卡平手盤可捧。（球賽編號：星期六52；now632及660台明日1:00am直播） 西甲前4來季可晉身歐聯，以目前形勢，華倫及維拉利爾都拋離第5位的愛斯賓奴，有超過10分或以上優勢，甚穩陣。將作客馬略卡的華倫西亞，下周中又要作客史浩克，上演歐聯16強次回合出線關鍵戰，難免分心；而且華倫剛新敗予巴塞，並續有施薩、阿度里斯等主力受傷。馬略上周中則作客擊敗愛斯賓奴，終止兩連敗，而且休息時間亦比客軍多一天，平手盤可取。 西甲尾場由馬德里體育會主場對維拉利爾（球賽編號：星期六71；now632及660台明日5:00am直播），馬體會近況反覆連和兩場，維拉利爾無疑亦要參戰歐霸盃，不過近況較平穩，「讓球主客和」宜取「客勝」。 牽牛 混合過關 星期六52馬略卡（平）x 星期六71維拉利爾勝[+1]（1.7）2x1
20110305-206,20110305,206,孖寶半全膽推介 - 戰鬥員A,孖寶半全膽推介 - 戰鬥員A 球賽編號：星期六16 對賽隊伍：漢諾威vs拜仁慕尼黑 半場：0:1　1:1 全場：1:2 球賽編號：星期六19 對賽隊伍：史特加vs史浩克04 半場：1:0　1:1 全場：2:1 共4注 戰鬥員A提供
20110305-207,20110305,207,日聯攻略：捧鹿角「主勝」捕「鼠」 - 戰鬥員A,日聯攻略：捧鹿角「主勝」捕「鼠」 - 戰鬥員A 上季最終在聯賽爭奪戰中不敵名古屋鯨魚，未能達成聯賽4連霸的佳績，鹿島鹿角今季將捲土重來，周日頭炮有主場之利，而且對手只是實力平平的大宮松鼠，[-1]必捧「主勝」。（球賽編號：星期日5；now633台今日2:00pm直播）戰鬥員A 今季鹿角最大的改變，當然是放走了前日聯最有價值球員的射手馬昆奴斯，而球隊攻擊力是否因此而削弱，目前很難判斷，上周中的亞冠盃分組賽作客FC上海，最後同對手打成0:0，看似入球能力的確有所影響，惟該仗是作客比賽，況且日超盃對名古屋鯨魚時，也能在對手身上取得入球，只是最後因互射12碼而敗陣，未能捧盃。 新組合有變招能力 過去兩場比賽中，鹿島仍然在嘗試尋找最強的前鋒組合，興梠慎三似乎是必然正選，問題是誰夥拍他，目前有新加盟的巴西前鋒卡路士施華，從山神借用回收的田代有三，以及大迫勇也，組合上其實頗多變化，尤其田代有三上季在山神表現不俗；而另一從山神借用回收的中場增田誓志，也成為了正選，支援老將小笠原滿男。 在亞冠盃後，興梠慎三及中堅岩政大樹都告受傷，但兩人情況並不太差，有望在今仗復出，縱然後者未能及時上陣，替補中亦有伊野波雅彥這位日本國腳，以及前國腳中田浩二，問題不大。 大宮松鼠上季屬中游隊伍，球隊季前放走了多名援將，包括尼拿積克、李浩及安英學，換來了不死鳥的渡邊大剛及磐田山葉的上田康太等。松鼠今季重心將會放在上季中加盟的南韓前鋒李天秀，以及巴西援兵拉菲爾馬古斯。不過，球隊近年作客鹿島幾乎只有輸波的結局，入球亦少，看來今季的人腳，難破不利對賽往績，鹿角[-1]，取「主勝」。 星期日5 鹿島鹿角vs大宮松鼠　2:0 半全場：主/主 盤口：鹿島鹿角[-1] 讓球主客和：H主勝
20110305-208,20110305,208,特稿：薛高銅像賀20周年 - 戰鬥員A,特稿：薛高銅像賀20周年 - 戰鬥員A 適逢今年是鹿島鹿角建立20周年，故球會方面都希望可以獲得錦標贈興，而在這個具紀念性的年份展開新一季日聯，也安排了活動慶祝。 戰機滑翔夠重視 周日主場戰大宮松鼠比賽開始前，日本航空自衞隊將會派出戰機，從30公里以外的茨城縣小美玉市百里基地，飛往球場上空滑翔，作為慶祝鹿角20周年的活動之一，而球會方面亦會邀請一名具份量的女歌手，在比賽前領唱日本國歌「君之代」，務求在比賽前的儀式上與以往不同。 另外，球會方面去年尾亦決定藉20周年紀念，發行限量版的薛高銅像（圖），並且在今年1月中正式發售，限量333個。前巴西國腳及日本國家隊教練的薛高，可說是鹿角歷史上的代表人物，而今次發售的銅像擺設，標榜依據鹿角主場外的薛高銅像外形製造，對鹿角球迷來說，可謂極具收藏價值。文：戰鬥員A
20110305-209,20110305,209,孖寶半全膽推介 - 牽牛,孖寶半全膽推介 - 牽牛 球賽編號：星期六65 對賽隊伍：巴塞隆拿對薩拉戈薩 半場：2:0　2:1 全場：4:1　5:1 球賽編號：星期六71 對賽隊伍：馬德里體育會vs維拉利爾 半場：1:1 全場：2:2　1:2 共8注 牽牛提供
20110305-210,20110305,210,6寶半全場推介 - 青蛙仔,6寶半全場推介 - 青蛙仔 球賽編號：星期六20 對賽隊伍：阿仙奴vs新特蘭 選擇：和/主、客/主 球賽編號：星期六21 對賽隊伍：保頓vs阿士東維拉 選擇：和/主、主/主 球賽編號：星期六22 對賽隊伍：富咸vs布力般流浪 選擇：主/和、客/和 球賽編號：星期六23 對賽隊伍：紐卡素vs愛華頓 選擇：和/主 球賽編號：星期六24 對賽隊伍：韋斯咸vs史篤城 選擇：主/主 球賽編號：星期六54 對賽隊伍：曼城vs韋根 選擇：主/主 共8注 青蛙仔提供
20110305-211,20110305,211,德甲大勢：漢堡主W食「緬」 - 戰鬥員A,德甲大勢：漢堡主W食「緬」 - 戰鬥員A 兩支中上游球隊漢堡及緬恩斯，周日德甲夜場相遇，前者可望乘早前主場大勝雲達不來梅之勢再下一城，取主W。（球賽編號：星期日36；有線61、64及202台明日0:30am直播） 漢堡歇冬後至今的走勢不穩，曾不敵紐倫堡及聖保利，但卻可擊敗法蘭克福、史浩克04及禾夫斯堡，而最近一場主場更取得大勝，4:0狂數雲達不來梅；雖然上周作客凱沙羅頓失分，只是以主場表現，仍然值得信賴。 早已在德盃出局的漢堡，可以全心在聯賽爭取好成績，而目前最大目標當然是下屆的歐洲賽參賽資格。荷蘭老將雲尼斯達萊今季入球能力保持，還有荷西古里路及柏歷，兩人近況皆不俗，可望助球隊取勝。 緬恩斯現時的排名是今季新低，足見他們季初的成績之佳，以及步入季中有回落迹象。雖則去仗作客贏賀芬咸，但歇冬後其實失分不少，故今仗作客，寧捧主隊。 不來梅受讓筍 頭場方面，弗賴堡迎雲達不來梅，後者歇冬後成績平平，惟去仗主場戰前列的利華古遜，可以在落後兩球情況下，最終逼和對手2:2，對球隊士氣有所幫助，有利今仗作客近期入球能力一般的弗賴堡，[+1]捧「客勝」。（球賽編號：星期日25；有線61及64台今日10:30pm直播）文：戰鬥員A 混合過關 星期日25雲達不來梅勝[+1]（1.52）x 星期日36漢堡勝（1.65）2x1
20110305-212,20110305,212,德甲大勢：捧拜仁小勝攞「威」 - 戰鬥員A,德甲大勢：捧拜仁小勝攞「威」 - 戰鬥員A 失意於德國盃的拜仁慕尼黑，周六德甲到訪漢諾威，在下周沒有歐聯後顧情況下，可望藉這場聯賽重整旗鼓，博他們小勝開[-1]的「和局」。（球賽編號：星期六16；有線61及64台今日10:30pm直播） 戰鬥員A 拜仁過去一星期在兩場重要賽事中落敗，先是聯賽迎戰榜首多蒙特，結果負1:3，繼而在德國盃4強戰鬥史浩克04，同樣在主場下，被對手打敗，無緣晉身決賽爭盃，對拜仁來說，失去了德國盃之餘，德甲爭標之路也變得更崎嶇，要從後趕上多蒙特，真的不易。 無懼「小豬」停賽 當然，歐聯16強首回合作客領先國際米蘭，對拜仁出線有利，而下周中沒有歐聯賽期，使球隊可專注今周聯賽，雖則漢諾威排名比他們還高一級，但經驗上及往績上，拜仁都是有利的。目前的拜仁幾乎是沒有傷兵，僅得長期十字軍奧歷一人，縱然中場舒韋恩史迪加今仗停賽，但中場仍有卻奧斯、列貝利及洛賓等人壓陣，足以威脅漢諾威防線。 利華可小勝狼堡 漢諾威目前比拜仁更多出2分，球隊已連續4場聯賽不敗，但要留意對手都是下游球隊，包括雲達不來梅及禾夫斯堡。對賽上，他們主場遇拜仁也是輸多贏少，就算近況不差，但面對「獅子撲兔」的拜仁，不看好漢諾威，博拜仁小勝。 至於次席的利華古遜迎戰禾夫斯堡（球賽編號：星期六55；有線61、64及202台明日1:30am直播），前者去仗大意失荊州，領先下遭雲達不來梅逼和失分，今返回主場，料打醒十二分精神；以對手禾夫斯堡今季作客聯賽僅贏過兩場，利華小勝不成問題，同樣取[-1]的「和局」。 讓球主客和過關 星期六16漢諾威和[+1]（3.65）x 星期六55利華古遜和[-1]（3.65）2x3
20110305-213,20110305,213,火辣戰果：雲格膺最佳領隊笑唔出阿仙奴悶和黑貓 - 藍鑽石,火辣戰果：雲格膺最佳領隊笑唔出 阿仙奴悶和黑貓 - 藍鑽石 阿仙奴領隊雲格當選2月份英超最佳領隊，但應該不會太快樂，因球隊繼英聯盃被伯明翰所敗後，上周六聯賽在主場被新特蘭0:0悶和，痛失兩分，錯過追貼曼聯的良機。藍鑽石 未知是否受到英聯盃新敗，以及心繫歐聯賽事影響，阿仙奴早段踢來患得患失，予新特蘭不少入楔埋門機會。直到35分鐘，拿斯尼單騎直進後遲遲未傳中，無功而還；1分鐘後，賓特拿近門施展倒掛卻被對方門將一抱入懷。上半場阿仙奴贏了形勢，卻無法破關。 易邊後形勢並沒太大變化，阿仙奴控球時間多但難破密集。查馬克於62分鐘後備上陣，幾乎即時建功，他於右路殺入禁區後傳中，奈何艾沙維射門被擋出。71分鐘，拿斯尼主射自由球無功而還，而查馬克其後又頂中柱，注定未能全取3分。除未獲幸運之神招手外，只怪阿仙奴部份時間太堅持於中路切入。 韋斯咸贏波賀柏加 阿仙奴賽後28戰得57分，落後周日才有比賽的曼聯3分，穩守次席。賽前，雲格當選2月份英超最佳領隊，撇開那場英聯盃決賽敗仗，阿仙奴在2月份4場聯賽取得3勝1和，得以向榜首曼聯亦步亦趨。這亦是雲格歷來第11次得此個人殊榮。至於2月份的最佳球員榮譽，落在同日領韋斯咸贏史篤城3:0的中場柏加身上。 伯明翰1:3負西布朗 足球可貴在於逐場計，數天前才打敗阿仙奴勇摘英聯盃的伯明翰，在上周六早場進行的英超榜尾戰以1:3不敵西布朗，或多或少影響周日進行慶祝活動的興致。 上周六德甲及英超部份戰果 《德甲 星期六15　法蘭克福0:0(0:0)凱沙羅頓 星期六16　漢諾威3:1(1:0)拜仁慕尼黑 星期六17　慕遜加柏2:0(0:0)賀芬咸 星期六18　紐倫堡5:0(3:0)聖保利 星期六19　史特加1:0(1:0)史浩克04 《英超》 星期六20　阿仙奴0:0(0:0)新特蘭 星期六21　保頓3:2(1:1)阿士東維拉 星期六22　富咸3:2(1:1)布力般流浪 星期六23　紐卡素1:2(1:2)愛華頓 星期六24　韋斯咸3:0(2:0)史篤城
20110305-214,20110305,214,澳職季攻略：吼黃金海岸聯「客勝」 - 牽牛,澳職季攻略：吼黃金海岸聯「客勝」 - 牽牛 中岸水手上仗力拼下被布里斯班獅吼逼和，未能直接晉身決賽，周六在決賽席位賽與當銳的黃金海岸聯交手，縱有主場之利也有顧忌，宜博客軍不敗取「讓球主客和」「客勝」。（球賽編號：星期六10；有線64台今日4:00pm直播） 水手在決賽資格賽兩回合計亦以2:4出局，要今仗淘汰「黃金聯」才再有挑戰獅吼機會。陣容方面，水手的雲史特坦、美查及巴特利樸達等仍因傷缺陣，但後衞基斯杜治突然與球隊解約。 黃金海岸聯在季後賽先後淘汰墨爾本勝利及阿德萊德聯，上仗作客反勝阿聯3:2。今料有巴西中場笠臣艾維斯復出；而今季3遇水手共1勝1和1負，當中勝仗就是作客水手取得。賽制採一場過分勝負，法定時間和波則加時30分鐘，加時再和則互射12碼分勝負。 牽牛 讓球主客和/主客和 星期六10黃金海岸聯勝[+1]（1.75） 星期六10黃金海岸聯勝（3.5）
20110305-215,20110305,215,上周五及周六部份球賽賽後報告,上周五及周六部份球賽賽後報告 突圍 上周六澳職決賽席位賽，中岸水手憑前鋒卡華斯歷建功，以1:0擊敗黃金海岸聯，將與布里斯班獅吼爭奪總冠軍。圖為水手中場柏迪斯奧佩雷斯（左二），被黃金聯二人夾擊下強行突圍。GettyImages
20110305-216,20110305,216,西甲大勢：大把人頂替C7皇馬小勝實「德」 - 牽牛,西甲大勢：大把人頂替C7 皇馬小勝實「德」 - 牽牛 皇家馬德里上周中大勝馬拉加，卻付出沉重代價，首席射手基斯坦奴朗拿度（C朗）左腿肌受傷，今仗作客桑坦德肯定缺陣，面對近況平穩的主隊，皇馬難大炒，「讓球主客和」冷選「和局」。（球賽編號：星期日40；now632及660台明日4:00am直播）牽牛 皇馬上仗狂勝馬拉加7球，但C朗入個人第3球後受傷退下火線，料需休息個多星期，今仗肯定缺陣；可幸的是，皇馬中前場人材濟濟，希古恩已復操，不過當然復出期仍遙遠，而簡拿利斯則已復出，而當然以級數計，卡卡是頂替C朗最佳人選。 桑坦德自印度班主接手後，聯賽6場不敗，護級形態已穩陣，甚至有力爭取歐洲賽入場券；不過上仗賽和艾美利亞，卻有巴西中堅軒歷基阿祖安奴領紅牌被逐，此子今季已打了25場聯賽，是桑軍後防支柱，缺陣影響甚大；不過考慮主隊近期韌力，縱輸波也難被大炒，「和局」可取。 馬拉加奧軍和格 同日西甲早場直播方面，由馬拉加主場對奧沙辛拿（球賽編號：星期日31；now632及660台今日11:59pm直播）；馬拉加剛吞7蛋，對士氣沒有打擊也是騙人；不過近期對同級球隊，也算成功搶分，近5仗亦和3場，奧沙辛拿上仗也只悶和拉科魯尼亞，球隊一向作客平平，能取1分也如願，「主客和」取「D」。 西維爾鬼盤忌捧 畢爾包近況回落，連輸4場，不過周日主場對西維爾（球賽編號：星期日37；now632及660台明日2:00am直播），西維爾近4仗不敗，上仗更大炒希杭，莊家竟開出主隊讓平/半，似乎甚看好畢軍可反底，畢竟西維爾作風陰陽怪氣；熱捧畢爾包贏波外，「讓球主客和」亦取「和局」。 混合過關 星期日31馬拉加和（3.3）x 星期日37畢爾包和[-1]（3.95）x 星期日40桑坦德和[+1]（3.4）3x4
20110305-217,20110305,217,蘋果波經賠率表（球賽編號：星期六1-14）,蘋果波經賠率表（球賽編號：星期六1-14）
20110305-218,20110305,218,高路托尼面臨停賽兩年,"高路托尼面臨停賽兩年 【綜合英格蘭外電】被視為英超模範球員之一的曼城後衞高路托尼，疑因誤服太太的減肥藥而藥檢不合格，被暫時罰停賽！這名29歲的科特迪瓦國腳更可能面臨長達兩年的禁賽令。 曼城於周四晚發表聲明指：「曼城接獲英足總通知，高路托尼的藥檢樣本A呈陽性反應，故他將不能參與一切足球賽事，直至相關程序完成。」據悉，曼城是於球隊在周三英足盃對維拉賽前得知這消息，因此高路托尼在開賽前被剔出大軍名單。 雖然仍未知道高路托尼是因服用軟性毒品抑或提高表現禁藥以致藥檢不合格，但無論如何，只要他的樣本B在藥檢中同樣不合格的話，就會被罰全球性停賽，最高長達兩年。據消息人士指，身為虔誠回教徒的高路托尼，平日滴酒不沾，故服用軟性毒品的機會很微，他很可能在沒諮詢曼城隊醫的情況下，服用些含有禁藥成份的食物或藥物。 阿仙奴領隊雲格在周五致電舊將了解後，指高路托尼是因誤服太太的減肥藥而出事。高路托尼09年夏天過檔曼城。 其餘英超球員藥檢事件 2005年 米杜士堡的葡萄牙後衞沙維亞在歐洲足協盃賽後被驗出服用合成代謝類類固醇「大力寶」（dianabol） 被罰停賽18個月 2004年 車路士前鋒梅度被驗出服用可卡因 被罰停賽7個月，被車路士解僱兼索償1,450萬鎊 2003年 曼聯的英格蘭後衞里奧費迪南自稱「忘記了」接受藥檢 被罰停賽8個月 2002年 車路士的澳洲門將保斯尼治被驗出曾服用可卡因 被罰停賽9個月兼被炒 ※只列部份，資料來源：《蘋果》資料室"
