key,date,article_daily_id,title,text
20120505-0,20120505,0,國內大學來港面試招生「江湖」英文係乜？刁鑽題目考起港生,國內大學來港面試招生 「江湖」英文係乜？刁鑽題目考起港生 【本報訊】內地多所大學讓港生免試入學，吸引一班為本地大學學額爭崩頭的中六、七學生踴躍報讀。不過，內地名校的面試題目出名刁鑽，其中北京大學及清華大學等院校來港進行面試，既要學生念詩考急才，又要做高難度繙譯，一班尖子幾乎難以招架，直指較在本港大學面試時討論時事的難度更高。記者：歐陽子瑩、梁麗兒 港生今年起首度可透過「免試招生計劃」報讀內地63間院校，毋須筆試，只要面試表現優異、文憑試或高考成績達到院校要求，便可獲擇優錄取。多所名校如北大、清華、復旦及中山大學等，昨起一連兩日於香港大學為學生面試。 北大面試以小組形式進行，四至五名學生需要按題目討論約45分鐘。報讀語言系的陳同學稱，教授要求他們將「江湖」一詞繙譯成英文，「仲要令外國人明白當中嘅中國文化意義」。在觀塘一英中讀書的他坦言被考起，教授提示可以小說《水滸傳》譯名的方向思考，討論氣氛才轉趨熱烈，他最後把江湖繙譯為「BrotherhoodWorld」及「HeroicPlaces」。陳認為，與香港的大學面試比較，內地大學的問題「層次高啲」。 另一個小組則被問到會如何理解「大國興衰，經濟起伏，唯一衰退就是繁榮衰退」這句話。報讀法律系的旅港開平商會中學中六生林同學稱，作答時嘗試定義何為「衰退」及「繁榮」，再與組員從民生、政治等方向解釋及舉例，「教授可能覺得我哋離題，提議可以講可持續發展及科技發展等方向」。 「月亮詩」只識〈靜夜思〉 復旦大學的試題同樣「考起」不少港生，就讀張祝珊英文中學的陸同學報讀了文學系，她表示一開始被問到為何喜歡文學及喜歡甚麼詩，接着教授要求她念兩首關於月亮的詩，「一時間諗唔起，就背『床前明月光』」。相信難以靠李白〈靜夜思〉過關的她表示，香港的入學試討論多與時事有關，「冇expect（預料）過有呢啲問題！」她坦言信心不大，但認為這次面試氣氛較輕鬆。為再爭取機會，她昨早完成面試即匆匆離開，趕往深圳出席華東政法大學舉行的面試。 北大招生辦公室主任秦春華認為，港生的發揮不錯，思維活躍，不過數理能力較弱。他認為題目有挑戰性，可以測試學生處理難題的能力及批判思維。中山大學的考官高定國教授則表示，希望透過面試了解考生的理想，要求他們有良好的語言能力。 面試共舉行兩天，北大、清華及復旦的面試名額各約50個，相信各取錄10至20人，中山大學則會為140多人面試。各院校會於5月中旬公佈預先錄取名單，8月3日前公佈正式錄取名單，較文憑試及高考放榜遲。 向北面試學生心聲
20120505-1,20120505,1,涉案兩弟大反擊廉署拘捕郭炳湘,涉案兩弟大反擊 廉署拘捕郭炳湘 【本報訊】上市公司新鴻基地產與前政務司司長許仕仁，涉及的世紀貪案再有突破性發展。廉政公署前晚拘捕「失勢太子」新地非執行董事郭炳湘，指他涉嫌違反《防止賄賂條例》。可靠消息透露，廉署是根據新地郭氏兄弟提供的證據拉人，並指隨着掌握越來越多證據，廉署正重新審視郭氏三兄弟在案中的角色。 新地與同系的新意網昨日早上開市前突然宣佈停牌，至中午12時許發出通告，宣佈新地非執董郭炳湘被廉署拘捕，已獲准保釋。據了解，廉署是於前晚7時後到郭炳湘家中拘捕他，並出示搜查令帶走一批文件，直至深夜才准他離開。有消息指他昨午再返廉署北角總部，約晚上8時離開，本月底須再向廉署報到。 「股票價格都冇乜嘢影響啫」 新地昨日下午復牌，半日收市下挫1.8%，跌1.7元收報92.6元。新意網則於下周一復牌。新地發表聲明指郭炳湘被捕不影響集團運作。郭炳湘透過發言人稱對事件不予置評。但接近他的消息人士表示，郭炳湘並不擔心，認為自己最終無事，還說：「股票價格都冇乜嘢影響啫。」消息人士稱，郭炳湘認為廉署拘捕他只是循例工作，或想從他手上取得更多文件了解案情。 不過，可靠消息透露，廉署今次採取拘捕行動，是基於新鴻基所提供的資料。消息指，廉署在調查過程中，發現部份相關文件除了有早前被捕的郭炳江與郭炳聯兄弟簽名外，也有郭炳湘的親筆簽名，顯示並非如有人所指，對事件毫不知情，不排除有更多人被捕。 接近郭氏家族的消息人士透露，許仕仁擔任政務司司長期間，郭炳湘在新地身居要職，所以不可能說一句不知情就置身事外。
20120505-2,20120505,2,王永平：梁班子架構臃腫,王永平：梁班子架構臃腫 【本報訊】候任特首梁振英擴大政府架構，增設副政務司司長與副財政司司長，前公務員事務局局長王永平質疑是架床叠屋，若用人不當，會容易發生「上推下卸」的情況，將犯錯責任推在副司長身上。王指梁振英崇尚的新加坡是由副總理兼任部長，絕不像梁班子的臃腫架構。 矮化局長地位 梁振英提出增設兩個副司長，理由是要減輕政務司司長與財政司司長工作量。曾在政府工作30多年的王永平昨質疑，問責局長理應是獨當一面的人物，所以梁以增加協調與統籌去開設新位，是很膚淺的借口，「你搵嘅司長、局長家都未開聲話工作辛苦，點解要開多個位？」 他形容，梁振英新班子已經有「一大棚人」，「政治助理仲話要一拆三」，再增設兩個副司長是架床叠屋，不但進一步矮化委任局長的地位，當出錯要找人問責時，更容易出現上推下卸情況，令副司長成為代罪羔羊。 他又暗諷梁振英崇尚新加坡管治模式，卻未有學足新加坡的精簡管治架構。新加坡除了總理以外，另設兩名副總理，下設十四個部，另有總理辦公室；而兩名副總理要身兼一至兩個部長職務，整個內閣只得15名成員。
20120505-3,20120505,3,鄔滿海：梁上任後率先實施免補地價二手居屋年底推,"鄔滿海：梁上任後率先實施 免補地價二手居屋年底推 【本報訊】候任特首梁振英在競選政綱中承諾每年抽出5,000名白表申請者，免補地價購買二手居屋。曾協助梁振英撰寫房屋政綱的房協副主席鄔滿海昨表示，有關建議會在梁上任後率先推行，白表申請者最快今年底就可以優惠價買二手居屋。 鄔滿海昨在電台節目中表示，梁振英部份房屋政綱不涉及動用新資源，可以短時間內上馬。居屋白表申請者每年抽出5,000人，免補地價購買二手居屋的政策，不涉及興建新居屋，預料最快年底推行。 至於將公屋3年輪候時間的承諾，擴展至單身非長者的申請人，由於需要額外的公屋資源，及需找到土地，預料最快要4年後才可落實。 蝸居部落20人抗議 鄔滿海指出，為了增加土地供應，下屆政府將會致力開闢政府空置土地，善用政府空置宿舍、辦公大樓及學校，另外亦可以研究在現時發展密度較低的社區設施用地上蓋，加建房屋單位。 新政府不會計較地皮大小，未來可能出現兩至三座甚至單幢式公屋，粗略估計每年可額外提供多2,000至3,000個單位。 另外，蝸居部落約20名青年人代表，昨集體到樂富房屋署客務中心遞交公屋申請表，期望候任特首梁振英加快增建公屋，盡快解決青年居住問題。代表指出，他們全部都是低收入打工仔，現與家人同住或住劏房，擔心輪候時間由青年等到中年。"
20120505-4,20120505,4,非法泊車阻梁警員急尋車主,非法泊車阻梁 警員急尋車主 【本報訊】候任特首梁振英昨日到旺角出席教聯酒會期間，至少十多名便衣警員在交通警員在場戒備，其間發現安排梁落車的地方有人非法泊車，一度令在場警員大為緊張，想在梁振英抵達前移走該部車輛，以免被問責。 到花墟雀仔街購物 梁振英昨早上8時30分離開山頂貝璐道住所，便前往廣播道的商台接受訪問，之後趕赴中環雪廠街新顯利大廈會見朋友，直到約下午1時半才乘車返回候任特首辦公室。下午梁前往旺角出席教聯會酒會，其間警方發現安排他落車的康樂街口，非法停泊了一輛灰色客貨車，在場警員即派人四出找尋客貨車車主，想在梁抵達前移走該部客貨車，但未能成功。 出席完教聯會酒會後，梁振英未有通知傳媒情況下，到旺角雀仔街及花墟購買花肥、有機泥、種子等物品，花店老闆汪太表示，向梁振英表示希望能在花墟興建停車場，稱梁也表示贊同，「佢（梁振英）話佢今日都搵唔到位泊車喎」。
20120505-5,20120505,5,潘源良：倘推惡法　黃霑也成罪人,"潘源良：倘推惡法　黃霑也成罪人 《反對惡法》 【本報訊】政府強推「網絡23條」，企圖「壟斷」言論自由，更被質疑背後有政治目的。文化藝術界發起聯署行動，反對通過《版權條例》修訂草案，已有約1,800人聯署，包括歌手黃耀明、導演崔允信、作家陳慧等。文藝界炮轟文化產業由不諳文化的「騎呢蠢人」掌管，擔心草案通過，未來成立的文化局會淪為打壓言論的工具。 文藝界昨召開記者會，要求政府在修訂草案豁免二次創作的刑責及諮詢公眾。身兼香港作曲家及作詞家協會（CASH）理事的著名填詞人潘源良，昨亦公開表態參與聯署，他說已故流行文化創作之父黃霑，於1989年六四事件後，把傳統聖誕歌作二次創作，改成《慈祥鵬過聖誕》諷刺領導人，「我想像唔到霑叔會因為二次創作而被捕」。 他續稱，創作自由及立法規管侵權行為，他同樣尊重，但若兩者出現衝突，「我會企喺創作自由嗰邊，因為後生仔係需要冇恐懼嘅創作空間」。 斥業界趕絕創意 音樂創作人周博賢擔心網絡23條會變成政治打壓工具，他舉例指早前網民把民建聯徽號改做「禮義廉」並印成T恤，結果有人向海關舉報侵權，「有呢啲例子，我哋好擔心呢個修訂係創作人頭上一把刀」。他力斥業界「狼死」，把網民創意趕盡殺絕，表明如政府強推草案，他會公民抗命，「越要我負刑責，我越要做」，他亦會開放其公司持有的版權予公眾使用。 藝術發展局藝術教育小組主席蔡芷筠反對通過草案，「香港由呢啲唔識文化嘅人搞騎呢政策，我哋點可以容忍（立法會功能組別議員）霍震霆代表我哋？」"
20120505-6,20120505,6,家人勸服藥釀兩死慘劇精神病無覆診　劏雞漢殺妻斬女,家人勸服藥釀兩死慘劇 精神病無覆診　劏雞漢殺妻斬女 【本報訊】秀茂坪邨兩死三傷倫常慘劇，揭露一名「廿四孝」媽媽，因患精神病20多年的丈夫病情反覆又拒絕覆診，她肩負家庭重擔，做茶水工撐起頭家，前日放假有街坊約她吃飯，惟同住的丈夫契媽煮了飯而拒絕，豈料丈夫病發狂斬一屋妻女老少，她以身擋刀護女，慘死亂刀下，幼女一度命危，幸搶救後轉為嚴重。 記者：徐雲庭、張家豪、文兆麟、吳子葵、黃通蜀 慘劇中同告喪命夫婦鄭沛森（53歲）及黃雪美（48歲），幼女鄭少沖（15歲），一度性命垂危，搶救後情況嚴重；長女少敏（17歲），敷治後已出院；姓許（75歲）婦人頸及背部受傷，治理後情況穩定，許婦是鄭的契媽，同住秀茂坪邨秀逸樓。 據悉，黃婦早年嫁來香港，一年半前在九龍灣德福花園一間金行當茶水工人，月入萬餘元，是家庭的經濟支柱，她原可逃過一劫，前日她放假，有街坊約她吃飯，黃婦指許婦煮了蒸水蛋，需留家吃飯，不料為此慘死丈夫亂刀下。 曾住小欖精神病院 鄭早年曾於觀塘擺檔賣雞，近年生意失敗，轉至深水埗兼職劏雞，他患有精神分裂症20多年，去年初曾入住小欖精神病院，同年5月及7月在容鳳書紀念中心覆診，但9月29日他卻未有按時覆診，聯合醫院直至去年12月才成功聯絡他，但鄭拒絕接受進一步跟進，由於他病情穩定，屬非優先覆診類別，院方亦無派人跟進。 前晚9時許，一家五口在家晚膳，其間鄭赤膊踱來踱去不肯吃飯，許婦見他神色有異，勸他吃藥，此話即時觸動他，隨即衝入廚房取出菜刀揮舞亂斬，許婦頸部中刀鮮血狂湧，負傷奪門逃去，直奔大廈大堂呼救。鄭繼續追斬妻女，少敏臉部中刀，躲入房間，少沖走避不及，被亂砍狂劈，黃婦以身作盾護女。 警方接報趕抵，鄭曾開門，但見警員即關門，未幾街外傳來巨響，鄭已從27樓飛墮落街身亡，警方破門入屋，驚見黃婦抱住少沖全身披血坐在沙發上，兩人渾身刀傷，其中黃婦頸及頭部皮開肉綻，送院證實死亡。 幼女未知父母雙亡 少沖左耳險被斬甩，治理後已清醒，她未知父母雙亡。昨午5時許，少敏在探員及社署人員陪同下探望妹妹。少沖就讀寧波公學4A班，江副校長形容少沖成績中上，曾參加少年領袖活動。中一時曾獲電腦科第一，中二時在書簽設計比賽獲優異獎。 兇案單位昨仍未解封，家具凌亂不堪沾有血迹。街坊譚太表示，前晚放工回到大廈電梯等，突見許婦從另一部奔出，全身血淋淋呼叫：「個仔斬人！」有街坊指，當時事主單位傳出翻倒物件聲音，之後陣陣慘叫聲，令人毛骨悚然。 香港精神健康促進會主席陳仲謀醫生指過往多宗涉及精神病人的倫常慘劇，都是患者停止食藥，當家人發現應即時通知醫生，惟本港公立醫院精神科資源不足，未必能給予家人太多援助。 殺妻斬女過程
20120505-7,20120505,7,未跟進荔枝山莊　地政總署認錯,"未跟進荔枝山莊　地政總署認錯 【本報訊】元朗大棠荔枝山莊被審計署揭發霸佔官地長達18年，地政總署昨自爆有職員違反指引，未有即時將個案轉交土地管制組跟進及執法，致令政府官地長期被佔用。立法會議員批評政府執法不力、罰則過時沒有阻嚇力，發展局局長林鄭月娥承諾會盡快檢討現行條例及罰則，而荔枝山莊個案已轉介律政司研究是否提出檢控。 林鄭：盡快檢討條例 立法會政府帳目委員會昨日討論審計署有關非法佔用政府土地的報告，民主黨甘乃威指近年霸官地情況愈趨嚴重，地政總署每年平均接獲8,000至9,000宗霸官地的投訴，部份個案更霸官地逾十年，但檢控數字極低，明顯執法不力。 發展局局長林鄭月娥表示，外界不能單靠檢控數字衡量政府的工作成效，當發現有官地被佔用時，會先要求佔用人自行糾正，若發現有冥頑不靈的情況，才進行檢控。但她承認佔用政府土地的條例多年來未有重新檢視是不適合，會盡快檢討。地政總署署長譚贛蘭指，新界鄉郊土地有其歷史因素，政府與私人土地的界線不清晰，「你中有我，我中有你嘅情況經常出現，處理佔用官地時較多爭拗」。 至於大棠荔枝山莊佔用官地的事件，譚贛蘭承認，93年收到荔枝山莊霸官地投訴，曾進行清拆行動，佔用人也曾多次申請短期租約保留違規構築物，至06年短期租約申請被拒後，署方未有再跟進。 她解釋，短期租約和土地管制組為兩組人員，按程序一旦短期租約被拒，有關個案要重新輸入電腦系統，交由土地管制組繼續跟進，但該次事件有職員違反指引，未有即時處理，直至2011年佔用人再申請短期租約才發現問題。她強調今次只是個別事件，署方已吸取教訓，會優化人手及資料處理程序，確保同類情況不會再發生。 而鄉議局主席劉皇發曾「開金口」力撐經營荔枝山莊的十八鄉鄉事委員會主席梁福元，指政府侵佔私人土地，將土地劃為郊野公園用地又沒有賠償。漁護署署長黃志光昨反駁指，當年將荔枝山莊部份面積納入大欖郊野公園範圍內，曾諮詢七個鄉委會，包括十八鄉及大棠村，從未收到反對意見。"
20120505-8,20120505,8,何東花園勢成法定古蹟,何東花園勢成法定古蹟 【記者黎穎詩報道】何東花園一直被歷史學家認為是代表華人在上世紀初，突破殖民地政府早年禁止華人在山頂居住的種族政策的標誌性建築，80多年過去，這座位於山頂道75號的花園大宅很可能再次締造歷史，成為香港有史以來第一宗政府與業主，因為要保育古蹟影響私有產權而要對簿公堂的案件，對將來如何處理位於私人物業上的古蹟有深遠影響。 不理業主何勉君反對 據悉政府打算不理會何東花園業主、何東孫女何勉君的反對，把這個歷史性花園大宅定為法定古蹟，根據《古物古蹟條例》，假如雙方未能就賠償達成協議，業主可向區域法院申請，要求政府賠償。政府堅持有關決定並非不尊重私人業權，因為業主的業權不受影響，影響的僅限於發展權。 「所有要做嘅法定程序都已經做晒，古物古蹟委員會已經投咗票，確定咗何東花園嘅法定古蹟地位，假如唔將何東花園例為法定古蹟，政府根本無可能向巿民交代。」一名知情人士向本報表示，相信政府短期內會有正式公佈。另一名知情人士則表示，將何東花園列為法定古蹟將會對將來怎樣保育屬私人產業的古蹟有重要意義。「假如唔行呢一步，香港無可能做好保育工作。」 何勉君前年向屋宇署遞交圖則申請拆卸園中主樓，身兼古物事務監督的發展局局長林鄭月娥在去年1月宣佈，把本來是一級歷史建築的何東花園列為暫定古蹟，古諮會在去年10月一致確定何東花園暫定古蹟的地位。何勉君於是向特首曾蔭權上訴，要求推翻古諮會的決定。 政府作好準備打官司 何勉君對政府提議換另一幅地給她不感興趣，又指何東花園對公眾沒有太多集體回憶，她希望拆掉日久失修的主樓，原地重建10幢住宅。她亦表示願意捐出大宅上蓋，由政府覓地重建，亦可以把部份花園對外開放。何勉君曾透露若不能重建，她損失達70億元。 因為何勉君已經明確決定不接受將何東花園例為古蹟，不接受政府提出的換地方案，政府已經為將何東花園列為法定古蹟可能面對的後果諮詢法律意見。「點賠、賠幾多由法庭決定，即使打輸咗，都只係輸打官司嘅錢，無理由唔試。」知情人士說。
20120505-9,20120505,9,街坊解畫亂刀斬碎溫馨之家,街坊解畫 亂刀斬碎溫馨之家 「我個仔跳樓死咗，個好媳婦都冇咗啦。」人稱「娟姐」的許婦，雖是鄭沛森契媽，卻情如母子，鄭侍她至孝，每次出糧給她做家用，鄭成家立室後，娟姐也辭去酒樓工作幫他湊女，前晚娟姐見「兒子」精神失常，好心勸他服藥，怎料竟招來殺身之禍，溫馨之家被亂刀斬碎。 契媽沒說鄭有精神病 一名與娟姐相熟女街坊表示，娟姐早年在酒樓賣點心，為人健談，稱鄭為兒子，鄭妻雪美移居香港後，娟姐決定退休幫手湊孫，「娟姐好錫對孫女，每年都帶嚟拜年，兩姊妹好乖，個樣似足阿媽」。她續稱，娟姐從沒說過鄭患有精神病，印象中鄭表現正常，斯文客氣，一家予人頗為幸福平和的感覺。 娟姐昨致電給她慨嘆﹕「我個仔跳樓死咗，個好媳婦都冇咗，我頸被斬中一刀。」她雖然險死，但卻無怪責過契仔半句，當問到鄭是否有精神病，娟姐無奈說﹕「我點會講呢啲嘢啦！」 另外，觀塘區議員黃春平表示，昨曾探望娟姐，說到慘劇她一度落淚，可憐一對孫女無依無靠。社署發言人表示，有關家庭過往無家暴紀錄，亦不屬社署的個案，社署會跟進死者家人長遠的福利需要。 《蘋果》記者
20120505-10,20120505,10,大律師被指捉女證人手摸陽具,大律師被指捉女證人手摸陽具 【本報訊】女警經審訊後，被裁定刑事恐嚇和毆打同居女友罪名成立。她不服被定罪向高院提出上訴，質疑代表大律師失職，令她得不到公平審訊。她的胞姊更現身高院，大爆曾在的士內遭該大律師捉着她的手觸摸陽具。面對嚴重指控的大律師，將於下周一出庭解畫。 案中關鍵人物大律師鄭紀天，05年成為大律師，曾參與前划艇女將陳學殷勒索富商案的辯護團隊。他於去年5月23日代表25歲女警，即今次的上訴人李淑妍，就刑事恐嚇和毆打罪抗辯。李被指於前年7月及11月兩度毆打24歲的同居女友。報稱兼職教師的女事主曾受僱於夜總會，指李曾扯爛她的吊帶睡衣導致赤裸上身，無法求救，兼持刀恐嚇殺人。李最後被定罪及判囚28日。 上訴人指失職 李今次的主要上訴理據是鄭紀天失職，她的胞姊早前在高院的上訴聆訊中作供，公開投訴曾在的士上，遭鄭捉着她的手觸摸陽具，落車時鄭又企圖吻她，幸她成功避開。代表李上訴的大律師黃達華昨在高院表示，李在去年4月被還柙，惟有靠胞姊聯絡，5月12日決定聘用鄭作法律代表。翌日胞姊與鄭在卡拉OK見面，至凌晨3時二人乘的士離開。 黃指胞姊曾向鄭展示相片，說明事主曾向李使用武力，並非善男信女，但之後沒有人向她索取相片呈堂；事主曾向李發短訊「都想你冇咗份工」，李曾着鄭聯絡警方取得相關短訊紀錄，但終沒有下文；鄭在盤問證人期間帶出一些問題後，卻沒有向李索取進一步指示。 黃認為上述資料若呈堂，或影響原審裁判官判斷事主的誠信。處理上訴的高院暫委法官彭寶琴，引述鄭及一名彭姓律師行文員提交法庭的誓章，內容涉及承認曾收過客戶一些指示，但認為毋須跟進。彭官昨聽畢黃的陳詞後，決定傳召鄭於下周一出庭。因本案曾被拘押31日的李，於08年加入警隊。 案件編號：HCMA451/11
20120505-11,20120505,11,活化政府山西翼交予機構再利用,活化政府山西翼 交予機構再利用 【本報訊】一直是香港政治中心的政府山有望可以相對完整地保留，繼早前政府決定取消把舊政府總部西翼，賣給發展商重建成甲級商廈後，據悉政府計劃仿效將荷李活道警察宿舍活化再利用的方式，把西翼交給一個機構使用一定的年期，用途會與公眾有關。 改建程度視乎評級 為了方便該機構將西翼活化再利用，政府會容許機構對西翼作出某程度的改建，包括加建，或拆除某些結構，至於改動的程度，則視乎古物諮詢委員會稍後對舊政府總部進行的歷史建築評級而決定。 「我一直都唔同意政府賣西翼，西翼嘅建築價值可能唔係好高，我唔反對政府將西翼重建、或者改建，但唔應該賣斷，政府山有重要歷史價值，政府應該保留業權。」 古諮會主席陳智思對本報說，他又表示古物古蹟辦事處，最快在本月下旬向古諮會提交舊政總的評級報告。另一知情人士說：「政府唔會賣西翼，反對聲音太大啦。」 由於評級會把中、東、西翼三座建築物一併進行，但三座的歷史及建築價值不同，故可能有不同評級。政府山關注組成員羅雅寧希望政府確保公眾可像回歸前般自由出入舊政總。
