key,date,article_daily_id,title,text
20120505-244,20120505,244,投資導航：炒滙攻略　追．揸．沽,投資導航：炒滙攻略　追．揸．沽 大市上上落落未完，睇股睇到眼花撩亂不如轉睇回報相對穩定的外滙市場。近日環球央行動作多多，澳洲減息、日本放水、美國隨時叫停QE、加拿大有加息壓力、人行又擴大滙率浮動……炒家除了可以鑽研多隻相關受惠股外，還可以投資相關受惠外幣，效果可能還來得直接。倘若投資者眼光準繩，捕捉到如英鎊今年逾5%的升浪，投資回報實際已勝過逾三成藍籌股。今期「投資導航」為大家分析四大外幣前景，探討當中追揸沽策略。 追：歐資避難所　英鎊撈得過 股市向來跟紅頂白，追強沽弱。炒外滙道理亦一樣，要順勢而行，買強勢者值博率較高。 16種主要貨幣中，今年暫以墨西哥比索最強，兌美元已升值超過7%，英鎊表現不俗排第四，兌歐元及美元暫分別升2.6%及4%。 削赤快人一步 雖然英國剛公佈的首季GDP錄得負增長，再次陷入雙底衰退，消息亦曾令鎊滙出現震盪，但無損英鎊向上的勢頭。由於歐元區政經問題，遠較英國嚴重，兼且短期難以解決，令英鎊成為歐元區以外的資金避難所，故英鎊兌歐元的交叉盤（買英磅沽歐元），贏面甚高。 英國兩年前已訂立削赤計劃，明顯較歐豬國行先一步，底子也較好。事實上，瑞士央行月初透露，其外滙儲備所持的英鎊，由去年底的75億英鎊，倍增至今年首季的145億英鎊。美銀美林近期表示，由於英國仍擁有AAA評級，故英鎊順理成章成為其他國家央行的吸納對象。 另一方面，7月尾舉行的倫敦奧運已進入倒數階段，雖然英國為這項四年一度體壇盛事投放的銀彈，較原先預期的超出五倍，但無可否認，奧運會有望刺激當地旅遊及零售業市道，帶動經濟增長，並且吸引資金流入，屆時對英鎊應該有一定支持作用。 揸：人幣難大貶值收息仍和味 中國首季經濟差過預期，市場曾憂慮人民幣需求會被拖累，但人行自4月16日起將人民幣兌美元交易價的波幅，由原本的千分之五擴大至百分之一後，人民幣滙價並未見大幅下跌，反告穩定，顯示人民幣貶值機會不大。 憂通脹不傾向減息 人民幣自2005年推行滙改以來，兌美元累積上升百分之三十，但今年至今微跌0.2%。招商證券表示，人民幣滙率浮動幅度擴大並不意味着升值趨勢告終，但預計今年升值幅度將會放緩至在3%以內。花旗則表示，人行舉動顯示內地官方認為人民幣滙率已接近均衡水準，今年人民幣升值幅度預料會在1%至2%之間。 人行行長周小川早前曾表示，隨着滙率浮動區間的擴大，市場供求力量將發揮更大作用，人行將減少干預，日後人民幣滙率更將趨向均衡。雖然人仔再升值空間有限，但在滙率更穩定的情況下，由於人民幣存款利率較高，以一年期存款為例，即高達3.5厘，揸人民幣的收益相當不俗。 另外，內地經濟雖然出現疲弱迹象，但為了避免引起高通脹問題，人行一直以減存款準備金率方式來放鬆銀根，以刺激經濟。由於人行不傾向減息，意味人民幣高息將可持續一段較長時間。 沽：減息潮持續　澳元勿沾手 作為高息貨幣，澳紐幣向來極受散戶歡迎，近數年更是「財息」兼收佳品。不過利好澳元的兩大因素：息率及商品價，今年雙雙呈下跌勢頭，貪高息撈澳紙，恐怕得不償得。 澳洲央行上周二議息後，下調基準利率半厘，至3.75厘，市場雖預期澳洲會減息，但減幅之大卻出乎意料之外。連今次在內，澳洲自去年11月至今，已三度減息，合共1厘，相信央行已意識到經濟出現變數，要及早行動。澳元走勢實際已敲響警鐘，強勢告終，宜沽不宜買。 樓市泡沫爆破 澳洲經濟以資源及出口主導，受環球經濟放緩拖累，GDP已連續兩季度錄按季下跌，去年第3季及4季，分別跌0.6個百分點及0.4個百分點。 此外，澳洲樓市泡沫爆破，當地首季樓價指數按季跌1.1%，遠超市場預期。再者，上月底公佈的通脹僅升0.1%，低於市場估計的0.6%。經濟、樓市皆弱，以及低通脹，為再減息營造有利環境，利淡澳元走勢。 海嘯曾低見0.6 要留意，息口與澳元走勢的關係，當澳元踏入減息周期，澳元隨即展開跌勢。澳洲上次減息周期是08年美國金融海嘯期間，當時基準利率由08年3月的7.25厘，一直減至09年4月的3厘，其間澳元兌美元由0.9水平跌至0.6邊緣始止跌回穩，跌幅達逾三成。 沽：央行狂放水　日圓無運行 鍾情去日本的朋友，今年shopping最開心，事關日圓為主要貨幣中最差的一隻，兌美元年內跌4%。進取的投資者，今年沽日圓仍有「錢」途。 技術分析：下試84 日本經濟持續於通縮邊緣掙扎，央行近兩個月來，第二度推出量化寬鬆措施，將購買資產規模增加5萬億日圓，令總規模升至70萬億日圓，並維持利率接近零水平，意圖壓低圓滙，增強出口競爭力，令經濟盡快擺脫通縮。 此外，央行更訂立通脹目標，表示通脹或最快於2014年升至1%（今年3月為0.5%），反映央行再放水救市的機會甚高。走勢上，美元兌日圓由2月初的76水平，急升至3月中的84日圓，其後輾轉回落，目前於80水平徘徊。以黃金比率分析，是次回調已達前升幅的50%，將出現較大支持。技術分析指，日圓已反彈至短期頂部，有機再下試82至84水平。 日圓年內是否持續下跌，關鍵繫於歐洲。事關如薩爾科齊未能在法國總統第二輪投票中勝出，或令歐盟的削赤方案出現暗湧。 關鍵繫歐洲市況 此外，希臘國會選舉料未有政黨取得過半數議席，須組成聯合政府，勢削弱新政府的決策能力，該國能否如期落實緊縮措施成疑。上述因素勢令資金持續流入日圓，為滙價帶來支持。 《專家意見》 英鎊年底睇1.7 星展香港財資市場部高級副總裁王良享： 「英鎊相對歐元一定係比較好，相對美元就更有升值潛力、風險比較少。英國削赤先過其他國家一步，佢亦都無融資需要，因為英國國債平均年期長達14年，其他歐洲國家的債都排隊到期，所以英鎊會跑贏其他貨幣，年底可以去到1.7水平。」 日圓短期單邊跌 交銀香港首席經濟及策略師羅家聰： 「相信美金未來幾年會單邊上，放眼幾年都會係咁，因此其他主流貨幣都唔會升太多。唯一相信會係短期行單邊的會係日圓，日圓兌美元會跌得比較明顯，其他如歐元的債務問題已經反映咗，再跌空間唔大。」
20120505-245,20120505,245,上周全球行情：貴金屬及商品,上周全球行情：貴金屬及商品 盎斯金# 上周收：1642.22　升跌：-20.53（-1.23%） 九九金 上周收：15150　升跌：-200（-1.30%） 白銀# 上周收：30.3675　升跌：-0.9（-2.88%） 白金# 上周收：1526.25　升跌：-46.25（-2.94%） 倫敦期銅# 上周收：8175　升跌：-240（-2.85%） 紐約期油# 上周收：98.49　升跌：-6.44（-6.14%） CRB商品指數 上周收：297.15　升跌：-8.36（-2.74%） #單位：美元
20120505-246,20120505,246,歐美股市及美債,歐美股市及美債 美股道指：13107.82　-98.77(-0.75%) 美股納指：2983.38　-40.92(-1.35%) 美股標普500：1380.62　-10.95(-0.79%) 英國：5681.59　-84.96(-1.47%) 德國：6602.79　-91.65(-1.47%) 法國：3178.66　-44.70(-1.39%) 美國10年期債息：1.90厘　-0.03厘 美國10年期債價：100.28美元　+0.09美元
20120505-247,20120505,247,九龍成交紀錄,九龍成交紀錄 備註：成交紀錄由利嘉閣地產根據土地註冊處資料加以整理後列舉，成交日期指正式買賣合約日期，較臨時買賣合約日期稍遲。由於各物業不一定每周會有新成交紀錄，因此可能不會全部更新。所有資料在編排上已力求準確，而所有資料僅作參考用途。 土瓜灣傲雲峰 叫價：600萬元 放盤單位：3座高層F室 面積：719方呎 呎價：8345元 資料來源：世紀21置業薈點傲雲峰分行 大角嘴君滙港 叫價：738萬元 放盤單位：3座高層F室 面積：702方呎 呎價：10513元 資料來源：置業18維港灣分行
20120505-248,20120505,248,新界成交御皇庭獲外區上車客承接,新界成交 御皇庭獲外區上車客承接 美聯葉初聲表示，息口持續低企，為計劃上車人士提供有利條件，上水區屋苑較為低水，價錢吸引，成為不少上車人士之選。區內樓齡較新物業御皇庭剛錄兩房戶成交，2座低層C室，618方呎，作價293萬元，呎價4741元。買家為外區上車客，鍾情單位景觀及座向，斥資購入自住。 賣家於2010年11月以235萬元購入物業，是次轉售賬面獲利58萬元，升值24.7%。4月截至28日，屋苑錄得約12宗成交，平均成交呎價4764元。
20120505-249,20120505,249,新界成交雅典居連車位580萬賣,新界成交 雅典居連車位580萬賣 世紀21奇豐鄭達昌表示，馬鞍山雅典居8座中層A室，901方呎，連車位以580萬元易手，呎價6437元，車位市值25萬元。原業主08年2月購入作價420萬元，獲利160萬元，升值38.1%。
20120505-250,20120505,250,新界成交富豪花園五年倍升,新界成交 富豪花園五年倍升 世紀21奇豐李仕明指出，沙田富豪花園A座愛都閣低層B室，980方呎，成交價495萬元，呎價5051元。買家為區內換樓客。原業主07年以242.5萬元買，獲利252.5萬元，升值一倍。
20120505-251,20120505,251,新界成交匡湖居低市價5%易手,新界成交 匡湖居低市價5%易手 世紀21奇豐廖振雄表示，西貢匡湖居2期D段單號屋，2554方呎，連1969方呎花園及26方呎船位，成交價2930萬元，較同類型單位低5%。原業主09年2180萬元購入，獲利750萬元，升34.4%。
20120505-252,20120505,252,新界成交新華銀行大廈257萬沽,新界成交 新華銀行大廈257萬沽 世紀21卓傑盧耀強表示，葵涌新華銀行大廈中層4室，703方呎，成交價257萬元，呎價3656元，較同類型單位高10%。原業主於91年以69.5萬元購入，獲利187.5萬元，物業升值2.7倍。
20120505-253,20120505,253,新界成交花都廣場七年賺132萬,新界成交 花都廣場七年賺132萬 中原陳永強表示，粉嶺花都廣場9座高層G室，710方呎，三房間隔，成交價302萬元，呎價4254元。買家為同區換樓客，近日有意換上較大單位提升生活質素，有感屋苑環境清靜，單位間隔實用，遂拍板購入自住。賣家於05年9月以170萬元購入上址，沽出單位賬面獲利132萬元，單位升值77.6%。
20120505-254,20120505,254,新界成交愉田苑兩年升50%,新界成交 愉田苑兩年升50% 香港置業張偉良表示，沙田居屋愉田苑F座愉悅閣中層1室，670方呎，自由市場成交價350萬元，呎價5224元。原業主於2010年7月以自由市場價233萬元購入上址，獲利117萬元，升值50.2%。
20120505-255,20120505,255,新界成交領峯低市價3%轉手,新界成交 領峯低市價3%轉手 美聯趙嘉威表示，將軍澳領峯8座右翼中層B室，869方呎，成交價466萬元，呎價5362元，較市場價低3%。買家為外區上車客。原業主2010年10月以428.9萬購入，獲利37.1萬元，升值8.7%。
20120505-256,20120505,256,新界成交用家333萬買新都城,新界成交 用家333萬買新都城 美聯黃少明表示，將軍澳新都城1期2座高層C室，510方呎，以333萬元成交，呎價6529元。買家為區內用家。原業主於05年8月以173萬元購入上址，獲利160萬元離場，物業升值92.4%。
20120505-257,20120505,257,貴金屬及商品,貴金屬及商品 盎斯金#：1643.28　+7.30(+0.45%) 九九金：15150.00　-130.00(-0.85%) 白銀#：30.38　+0.29(+0.98%) 白金#：1540.75　+2.75(+0.18%) 倫敦期銅#：8224.25　-4.75(-0.06%) 紐約期油#：100.30　-2.24(-2.18%) CRB商品指數：299.52　-1.94(-0.64%) #單位：美元
20120505-258,20120505,258,上周全球行情：貨幣滙價,上周全球行情：貨幣滙價 歐元 主要貨幣兌美元：1.3083　主要貨幣兌港元：10.1538 英鎊 主要貨幣兌美元：1.6149　主要貨幣兌港元：13.5325 澳元 主要貨幣兌美元：1.0180　主要貨幣兌港元：7.8948 紐元 主要貨幣兌美元：0.7957　主要貨幣兌港元：6.1749 日圓 美元兌主要貨幣：79.85　主要貨幣兌港元：9.7182 瑞郎 美元兌主要貨幣：0.9182　主要貨幣兌港元：8.4535 加元 美元兌主要貨幣：0.9961　主要貨幣兌港元：7.7949 （＊每100日圓兌港幣計算） 美元兌人民幣：6.3062 每100港元兌人民幣：81.08 美滙指數：79.498 港滙指數：94.6
20120505-259,20120505,259,新界成交栢慧豪廷呎售4050,新界成交 栢慧豪廷呎售4050 美聯周志偉表示，天水圍栢慧豪廷7座中低層D室，884方呎，成交價358萬元，呎價4050元。原業主於09年7月以213.8萬元購入，獲利144.2萬元，升值67.4%。4月栢慧豪廷錄約10宗成交。
20120505-260,20120505,260,新界成交豫豐花園回報4厘,新界成交 豫豐花園回報4厘 美聯陳智生透露，屯門豫豐花園12座低層F室，531方呎，成交價193.8萬元，呎價3650元。買家為同區投資客，單位市值月租6500元，回報4厘。原業主07年153.9萬元購入，賺39.9萬元，升25.9%。
20120505-261,20120505,261,新界成交恒順園低市價3%賣,新界成交 恒順園低市價3%賣 中原劉月華表示，屯門恒順園8座低層D，945方呎，成交價354萬元，呎價3746元，低市價3%。原業主於92年11月以213萬元購入，原開價365萬元放盤，減價沽售仍獲利141萬元，升值66.2%。
20120505-262,20120505,262,新界成交翠擁華庭減價3%易手,新界成交 翠擁華庭減價3%易手 世紀21奇豐趙詠欣表示，馬鞍山翠擁華庭9座高層F室，面積984方呎，三房連套房間隔，原業主於3月初放盤，當時叫價578萬元，減價3%至560萬元售出，呎價5691元。原業主於2010年7月購入上述物業，當時作價439萬元，現將轉售獲利121萬元，升值27.6%。
20120505-263,20120505,263,新界成交聽濤雅苑470萬成交,新界成交 聽濤雅苑470萬成交 利嘉閣楊震霆表示，馬鞍山聽濤雅苑6座極低層F室，880方呎，成交價470萬元，呎價5341元。原業主於98年以410.2萬元購入，獲利59.8萬元，賺幅14.6%。屋苑4月累錄14宗成交。
20120505-264,20120505,264,新界成交藍澄灣三年獲利147萬,新界成交 藍澄灣三年獲利147萬 中原羅彩娥表示，青衣藍澄灣6座低層B室，683方呎，成交價345萬元，呎價5051元，比市價略高。原業主於09年5月以198萬元購入上址，賬面獲利147萬元離場，單位升值74.2%。
20120505-265,20120505,265,新界成交換樓客偷步入市天宇海,新界成交 換樓客偷步入市天宇海 中原林少億指出，馬鞍山天宇海2A座中層D室，875方呎，545萬元成交，呎價6229元。換樓客預期區內新盤開售會帶動二手呎價，偷步入市。原業主2010年470.8萬元購入，賺74.2萬元，升15.8%。
20120505-266,20120505,266,新界成交花園城五年升1.7倍,新界成交 花園城五年升1.7倍 中原招錦昌指出，沙田花園城3期C座雅芝苑低層H室，417方呎，雅致裝修，成交價207萬元，呎價4964元。買家為年輕上車客。原業主07年3月以77萬元購入，獲利130萬元，升值1.7倍。
20120505-267,20120505,267,新界成交紀錄,新界成交紀錄 備註：成交紀錄由利嘉閣地產根據土地註冊處資料加以整理後列舉，成交日期指正式買賣合約日期，較臨時買賣合約日期稍遲。由於各物業不一定每周會有新成交紀錄，因此可能不會全部更新。所有資料在編排上已力求準確，而所有資料僅作參考用途。 大圍恒峰花園 叫價：598萬元 放盤單位：2座低層A室 面積：1118方呎 呎價：5349元 資料來源：世紀21奇豐大圍分行 元朗YOHOTown 叫價：295萬元 放盤單位：1座低層G室 面積：525方呎 呎價：5619元 資料來源：中原元朗教育路第二分行
20120505-268,20120505,268,老樓周記：唱好言論慎防被 - 劉兆昌,老樓周記：唱好言論慎防被 - 劉兆昌 香港人向來見慣風浪，對於樓市大起大落絕不恐懼，正所謂食得鹹魚抵得渴，只要不過度借貸借到盡的話，絕對無問題；若然到頂都唔知，不只小市民，即使經驗豐富的發展商也警覺性極低。 早前發表的數據表面似乎很好，首季落成量僅得600伙，施工量亦不過1.5萬伙，美國聯儲局維持低息至2014年底，以及本地樓價指數就快破97年高峯位等等。 縱使有官員不斷發出對樓市泡沫的警號，亦有行內人士反駁官方，收緊按揭對置業者不利的言論。正由於利好利淡消息齊來，站在利益集團者而言，永遠不會唱淡樓市。 老樓年前主持一個講座時，與會一名大型發展商很坦白對台下聽眾表白：「作為賣樓者，唔會叫買家唔好買樓，只會叫大家喺調整時候傾價。」表態清晰，反映了無論在甚麼時候只會向公眾傳達對樓市唱好言論，並不全面和客觀。 買家易受氣氛感染 事實上，不知情者很容易受到賣樓氣氛所感染，一面倒的單向現象令買家陷入迷局，忘記了自己能不能負擔得來、或是被人潮影響判斷。老樓曾聽過以下個別個案。「首先由代理商帶入展覽館後，足足花了一個小時才完成整個參觀程序，到最後地產代理一方面游說快做買樓決定，二來把有利樓盤和樓市的報紙影印本作為指標，原本只有意買一間自住，但因先做大手客買樓次序押至最後，現場完全不知道銷情而焗住買。」 上述情況正出於一個已售出九成單位的新盤身上，這點正因為為了賣到好成績的銷售手段，老樓亦有類似的親身經歷，莫非親往地盤視察鎖定單位和座數，好易墮入圈套，要買的單位一早被預留，未賣的單位只口頭出價而已。 劉兆昌 資深地產傳媒人  http://www.HKLau.com 
20120505-269,20120505,269,貨幣滙價,貨幣滙價 歐元 主要貨幣兌美元：1.3158　主要外幣兌港元：10.2114 英鎊 主要貨幣兌美元：1.6180　主要外幣兌港元：12.5576 澳元 主要貨幣兌美元：1.0188　主要外幣兌港元：7.9048 紐元 主要貨幣兌美元：0.7944　主要外幣兌港元：6.1670 日圓 美元兌主要貨幣：79.86　主要外幣兌港元：9.7173 瑞郎 美元兌主要貨幣：0.9127　主要外幣兌港元：8.5008 加元 美元兌主要貨幣：0.9928　主要外幣兌港元：7.8136 （＊每100日圓兌港幣計算） 美元兌人民幣：6.3062 每100港元兌人民幣：81 美滙指數：79.114 港滙指數：94.6 （歐美股市、滙價、貴金屬、商品價截至22:15）
20120505-270,20120505,270,本周提醒你,本周提醒你
20120505-271,20120505,271,環球視野：選宅凶忌分門別類 - 周兆祥,環球視野：選宅凶忌分門別類 - 周兆祥 你以為風水一定是迷信？細讀以下的智慧，心水清的話總會悟出寶貴又實在的心理學、生態學、生理學、玄學原理。今期先談凶忌。 凶之方位： ‧房屋在丁字路口或死巷末端 ‧有大路直冲正門 ‧房屋在河口、大橋邊上或下 ‧屋前有十字路口或分叉路、天橋（大凶） ‧有屋角尖插正自己家的出入口或開大門見大樹大山 凶之鄰里： ‧打開窗見煙囪、屋角、天線、枯樹、廢棄物或任何令人不安的東西 ‧窗外見怪石（尤其不穩的） ‧泳池水反射陽光入屋 ‧屋前有大招牌或光管廣告 ‧門前有電桿、電箱、變壓箱 ‧近天線、電纜或屋頂附近有天線魚骨、鑊（大凶） ‧受交通、機器噪音侵襲 ‧近工廠、教堂、廟宇、色情場所、醫院、警署、墳場、殯儀館、加油站、垃圾收集站、鐵路、玻璃幕牆 ‧門前雜草叢生或有藤纏 ‧屋外動工、有工程進行 ‧屋內任何地方有蟻窩 凶之設計： ‧獨自高樓，即房屋比周圍的建築物高，明顯突出（大凶） ‧尖角及不工整的房間 ‧大門前對正空屋、窗口對正鄰家窗口 ‧房屋的基地三角形或長條形 ‧大門對正三叉路、電梯門 凶之氣場： ‧本宅或鄰宅是凶宅，曾有血案等（大凶） ‧鄰宅多身心病 ‧鄰居能量屬負性，如操守差、脾氣劣、家人不和睦難以相處 周兆祥 環保先鋒 mailto:simon317@gmail.com
20120505-272,20120505,272,股樓齊鳴：中國真的要放水？ - 張一鳴,股樓齊鳴：中國真的要放水？ - 張一鳴 經常傳中央放水消息，不管消息是否確實，中港股市總會波動。通常這些傳聞都不會明確指出消息來源，不過在4月中的一次卻很特別，新華社發佈新聞稿，引述人民銀行有關負責人表示，貨幣政策將適時適度預調微調，如通過適時加大逆回購操作力度、下調存款準備金率、央票到期釋放流動性等方式，穩步增加流動性。 內房點心債風險大 要知道新華社是中國官方傳媒機構，市場即視之為官方公告。假設人行真的計劃進行寬鬆的貨幣政策，為甚麼要透過新華社預先對外發放，而不直接由人行公佈？筆者實在看不透「消息」的用意，而在消息發佈後，人行未有如市場預期的放水。 中國不必如美國般運用口術，因中國手上有很多子彈，需要時可即時使用，但有機會推高通脹及產生更大的經濟泡沫。中國正處兩難局面，官方今年GDP增長目標是7.5%，但市場卻憧憬寬鬆政策刺激經濟，普遍預測GDP增長逾8%。GDP增長逾8%是否代表經濟硬着陸，並需要放水？筆者對此有保留。 要達致經濟增長目標，除透過政策微調，可能還有其他軟方法。在新華社發佈有關貨幣政策消息後，剛巧中銀監前主席劉明康警告，購買內地房產商在港發行的點心債存風險。由於內房商能在港以低成本借到龐大資金，加上強烈憧憬政策在不久將來寬鬆，故沒有減價的迫切性，內地房價居高不下。如內房商受劉明康言論，因而未能成功發債，有機會因資金緊絀而減價促銷，正符合中央所望。 張一鳴 NeutronPacific創辦人 mailto:dcheung@live.hk
20120505-273,20120505,273,樓市把脈：領匯股價跑贏住宅價格 - 鍾維傑,樓市把脈：領匯股價跑贏住宅價格 - 鍾維傑 無論閣下對領匯（823）有如何想法，包括有不少商戶因加租而要搬遷甚至結業，但其股價的確硬淨，某程度是有抗跌能力。上述可從以下角度了解，數據來自網站包括Yahoo！Finance等： （A）相比其他在港上市的房地產投資信託基金（簡稱房託）股價表現，領匯全勝，若純用股價上落由2007年尾起計算至今（即非用招股價為基礎），賺了70%，其他如越秀（405）增34%、泓富（808）10%、陽光（435）2%、而下降的有富豪（1881）之18%和冠君（2778）的20%。 （B）相比普及的長實（001）、新地（016）和恒生指數的表現，領匯亦勝出，因同期長實下降了28%、新地則是負35%，而恒指亦減28%。 （C）相比股價波幅（風險之量度），領匯屬中等，比冠君、越秀及富豪的股價波幅低，但高於陽光，與泓富的相約，而長實、新地及恒指之波幅亦低於領匯。 （D）派息方面，一般而言可比其他房託低，但亦不遜色於普及股票。 但和實物比較又如何呢？若由2008年尾計算至今年初：（1）與私人住宅的面積大細分類比較，領匯股價升了118%，A類小型單位69%、B類小中型單位56%、C類中型單位49%、D類大中型單位42%、E類大型單位47%。 （2）與寫字樓及商舖比較，以整體寫字樓市場計平均價格升67%，整體商舖市場則為100%。 （3）與太古城比較這裏以同期呎價變動計算，太古城約有57%增長。 假若有閒資，但又不足夠買樓，可以考慮房託。（註：筆者持有房託股票） 鍾維傑 「地產得」獨立房地產分析網站  http://www.Real-Estate-Tech.com 
