key,date,article_daily_id,title,text
20121229-0,20121229,0,元旦遊行　左派造假挺梁,"元旦遊行　左派造假挺梁 【齊心反CY】 【本報訊】特首梁振英上任不足半年盡失民心，雖然上周到北京述職獲中央三巨頭力挺，可是民望返魂乏術。中大最新民調顯示，梁民望再跌至不合格水平，返回9月谷底。建制派為求製造港人挺梁的「假民意」，竟威迫利誘市民元旦上街挺梁。民陣批評建制派造假是「呃中央、呃市民」，呼籲市民元旦上街，向北京和港府展示真民意。 記者：林俊謙　歐陽子瑩　白  琳 中大香港亞太研究所本月18至22日，即梁振英在北京述職期間，以電話訪問758名市民，發現就算國家主席胡錦濤、總理溫家寶、國家副主席習近平公開力挺，梁民望仍毫無升幅。梁最新評分重回不合格水平，較上月下跌1.1分，只有48.9；而市民對梁振英政府評分為48.5，繼續處於不合格水平，表示信任梁政府市民只有26.5%，不信任卻有28.9%，不信任梁班子的人仍佔多數。 中大亞太研究所分析，梁振英評分再陷谷底，是受到僭建事件影響，即使梁曾到立法會交代及向市民道歉，仍無助提升民望，顯示市民仍質疑其誠信。 面對梁及特區政府民望低迷不振，曾力挺梁做特首的建制派開始擔心，元旦倒梁遊行人數會較他們預期多，近日遂以威迫利誘手段拉市民上街挺梁。「愛護香港力量」明日先上陣，香港各界慶典委員會發起元旦挺梁遊行規模最大，主席鄭耀棠相信會有5,000人參加，主題是「新年新希望」，他否認與民陣打對台，但承認新政府需民意支持才能順利施政。 近日網上再流傳，指有人出價300元請人出席挺梁遊行，召集時間與各界慶典委員會遊行一樣，不少網民質疑左派派錢請人上街造假。 現金券利誘新移民撐場 除了左派出手外，社福界盛傳由恒基副主席李家傑等富豪領導的「新家園協會」，以現金券利誘社工及新移民參加挺梁遊行。有不願透露姓名的新家園社工透露，參加元旦挺梁集會的社工只需「示威、坐吓」，事後可獲現金券獎勵，據說也有人以現金券利誘新移民當日撐場。 本報昨就有關傳聞向新家園社工范國輝查詢，范不肯回應，叫記者向協會總部查詢。協會宣傳推廣幹事傅冰最初否認，之後改口稱或有同事、會員會出席挺梁集會，「行過見到都會參加」。對於有否用現金券利誘市民挺梁，傅多次強調「唔係全部同事知有集會、唔會特登組織」，未正面回應。 民陣籲上街展示真民意 於元旦日下午政總添馬公園發起「愛香港、撐政府，元旦嘉年華」的愛港之聲，昨表示已獲全國政協劉夢熊、理大學者陳文鴻及王紹爾等梁粉到場支持，召集人高達斌昨批評針對梁振英誠信問題的人，誣衊梁的誠信，強調「唔怕做傻仔、做爛頭卒」，堅持挺梁到底。 工黨主席李卓人批評，建制派及左派試圖製造「假民意」死撐大話特首，效果適得其反，「梁振英根本已經無藥可救、返魂乏術，現時只係垂死掙扎」。民陣召集人孔令瑜批評「呃中央、呃市民、呃埋自己」，認為最重要是港人在元旦日下午3時到維園草地參加遊行，向北京和特區政府展示真正民意，「呢個民調加埋香港人嘅實際行動，梁振英距離落台嘅日子不遠了」。"
20121229-1,20121229,1,警再收窄遊行範圍　不排除移走街站拉人,警再收窄遊行範圍　不排除移走街站拉人 【特稿】 警方史無前例禁制民間團體在元旦倒梁大遊行沿途擺街站，港島總區高級警司鄭耀武昨解釋，當日遊行人數眾多，又正值工展會人流高峯期，擔心街站阻塞造成骨牌效應，引發極大「公共安全風險」，不排除移走街站甚至拘捕相關人士。 鄭耀武昨表示，根據警隊條例，警方有責任確保遊行有秩序進行，擔心街站吸引市民圍觀造成阻礙，若遊行隊伍停滯不前，就會對街站採執法行動。至於在甚麼情況下掃場或拘捕，他承認難有客觀標準，「拘捕唔係主要考慮，而係確保遊行暢順」。 民陣副召集人陳倩瑩透露，早前與警方商討時，對方稱會考慮開放6條行車線，但警方昨公然反口指「唔合理」，以兼顧其他道路使用者為藉口只開放3條行車線。 「CY容忍唔到異見聲音」 陳質疑警方藉此封殺遊行街站，「CY容忍唔到異見聲音，唔俾機會團體接觸咁多市民」。她強調以往7.1遊行，民陣均有糾察疏導人流，不存在阻塞問題。 陳倩瑩又指，以往民間團體會申請臨時小販牌以便在街站擺賣，過程順利，今次食環署卻以影響公眾安全拒絕發牌，更反建議把街站由行車路移上行人路。陳質疑部門聯手打壓，指搬上行人路只會對其他市民造成不便引發混亂。食環署稱至今有4宗元旦遊行小販牌申請，兩宗不獲考慮，兩宗仍在處理。 人權監察組織斥警方禁制街站荒謬兼自相矛盾，街站是遊行活動重要一環，牽涉言論等基本自由，受《基本法》保障，禁制街站是阻止示威活動壯大和扼殺團體生存空間，侵犯和平集會和結社自由。監警會將派代表出席元旦遊行集會，了解街站及人流管制情況，以便審視相關投訴。 《蘋果》記者
20121229-2,20121229,2,靠民望壓倒唐英年　難翻身勢成跛腳鴨,靠民望壓倒唐英年　 難翻身勢成跛腳鴨 【拆局】 梁振英能夠以「黑馬」姿態擊敗大熱門唐英年，登上特首寶座，全憑較高民望壓倒對手，令中央「轉軚」棄唐保梁。可是成也民望、敗也民望，梁振英當選後民望急瀉，造就「倒梁」局面。有商界人士直言，雖然中央擺出強硬姿態，力挺梁做特首，可是梁無法扭轉低民望困局，只會令特區政府淪為「跛腳鴨」政府。 當日梁振英由「陪跑」變「正印」特首候選人，與民望一度拋離唐29個百分點有很大關係。當時梁振英有近四成高支持率，亦是挺梁人士成功游說中央「轉軚」，支持梁做新一屆特首原因。有知情商界人士透露，若非唐英年民望「低到中央無法接受」，而梁振英又大幅拋離唐，本年初中央不會貿然換人。 中央設法提升梁民望 該商界人士直言，若中央當日以梁民望高而支持他做特首，今天梁民望低、甚至是歷來新特首開局以來最低民望，中央卻選擇力挺梁繼續做下去，難免令市民及唐英年支持者不滿。他相信中央一定會想辦法提升梁民望，否則長此下去，特區政府難有效施政，「俾佢（梁振英）做足五年，都只會係跛腳鴨政府，乜都推唔到」。 《蘋果》記者
20121229-3,20121229,3,天主教為普選發聲　不反對教友倒特首,天主教為普選發聲　 不反對教友倒特首 【本報訊】特首梁振英謊話連篇，天主教香港教區副主教楊鳴章認為，高官無誠信難以服眾，有錯應改並向市民交代清楚。楊不反對教友參加元旦日的倒梁遊行，又重申教區支持普選，表明會「再出聲或再做嘢」。 楊鳴章在昨晚播出的港台節目《星期五主場》表示，「誠信係非常重要，否則冇法子做到工作、冇法子可以服眾。政府高官要求我哋奉公守法，高官更加要律己更嚴一啲」。 促梁「有錯要改」 楊鳴章不願評論梁振英僭建醜聞，但說：「好希望佢能向廣大市民講清楚，如果有錯就應該改。《聖經》中，耶穌都會同罪人來往的。」他避談是否以罪人形容梁振英，稱晚上會為政府官員祈禱，包括梁振英。 對於元旦倒梁遊行，他認為參加與否由個人自決，「如果教友問我，起碼唔會反對佢去。至於應唔應該去，教友應自決」。 教區今年2月登廣告支持普選，主教湯漢樞機在本周一發表的聖誕文告，再促梁振英落實雙普選。楊鳴章稱並非最後招數，「普選係每個市民應有權利，我哋冇理由唔爭取，我哋會按照可能情況，再出聲或再做嘢」。
20121229-4,20121229,4,黃埔居民被屈260萬幫和黃修渠小業主促管理公司交權　否則上街抗爭,黃埔居民被屈260萬幫和黃修渠 小業主促管理公司交權　否則上街抗爭 【本報訊】紅磡黃埔花園一條私家路的污水渠上月爆裂，經居民偵查後發現同屬和黃發展的三組建築海名軒、海濱廣場和九龍海逸君綽酒店的污水渠，都被接駁到該屋苑，小業主多年來懵然不知，付出至少過百萬爆渠維修費。事件被踢爆後，發展商才主動支付今次及賠償過往的維修費用合共近260萬。居民極度不滿，談判小組今開會，若下周無法與管理公司達成協議，下月初將上街抗爭。 記者：張嘉雯 位於黃埔花園德豐街與船景街的地下污水渠早前爆裂，維修費連管理公司酬金高達132萬元，有「醒目」居民覺事有蹺蹊，向管理公司查問下發現附近海名軒、海濱廣場和九龍海逸君綽酒店，三個建築群的污水渠全駁到該屋苑，多年來維修費全由小業主支付，過往兩年至少三次爆渠，合共從屋苑開支總賬中支走逾126萬。 未經同意駁污水渠到黃埔 事件揭發後，小業主氣憤難平，一直關注事件的業主林先生說，管理公司得悉居民欲採取行動後「知驚」，主動提出支付整筆維修費並免去經理人酬金，「如果我哋今次唔發現，佢已經攞走咗我哋呢筆錢；佢哋唔係自願畀，係因為揭發咗先無辦法。」 業主代表其後與管理公司總物業經理開會，對方承認三組建築均把污水渠駁到黃埔花園，又指屋苑原來的總體規劃渠務圖無接駁外來渠管，「我哋最不滿佢未經法定程序，未經我哋同意就將條渠駁過嚟，（爆渠）之後又當乜事都冇發生過攞我哋錢，喺屋苑總賬出數。」管理公司未有回應本報查詢。 林先生指，屋苑與另外三個建築群均屬同一管理公司，「佢哋以為呢啲係佢哋公司內部事務，唔使交代，下意識覺得：『駁咪駁囉，條渠我嘅。』唔覺得我哋有持份，唔記得條渠有咩頭暈身㷫，都係我哋付賬，點解佢哋（三組建築物）唔使分擔維修保養費？」 「喺呢種關係下，商舖、大業主全部係同系公司、同一集團，點可能公正咁執行呢張公契呢？」林先生指由於無法成立法團，小業主已成立聯盟，截至周四已有逾半代表支持下月初上街，要求管理公司無條件交出百分百權力，「管理公司唔係公契嘅守護人，唔係顧住所有業主整體利益，我哋要利用呢次咁惡劣嘅例子，要佢交番權力出嚟。」 「唔好等到居民抗爭先傾」 該區區議員梁美芬指，管理公司一直用對抗方式處理問題，「搞到關係好惡劣先肯退一步，真係唔好等到居民要抗爭、用真係激烈嘅方式表達，先至嚟傾；居民本身好忙，加百幾蚊管理費，大部份家庭唔覺得係咩，佢哋希望畀咗錢，可以有一個有質素嘅服務。」香港工程師學會前會長黃澤恩表示，三組建築是否要支付污水渠維修費，視乎公契條文，「條渠嘅上游業主係咪要出錢，要法庭先判到，唔同政府渠，可以用納稅人錢。」
20121229-5,20121229,5,無法成立法團　居民任魚肉,無法成立法團　居民任魚肉 【有血有淚】 黃埔居民苦水滿腹，2期懷疑冷氣僭建、5期地磚貨不對辦、7期電梯不經G層……，小業主多年來與管理公司周旋，一次又一次接管理公司律師信，成立法團又不成功，代表個個氣憤難平，希望藉今次爆渠契機團結居民，討回權利。區議員批評管理公司手持公契「以為自己大晒」，權力用到盡。 「問題核心係我哋根本冇制衡權，佢要我哋點就點。」居民林先生指，種種管理問題皆因屋苑無法成立法團，「只要有超過兩成業權人反對，我哋就搞唔成，淨係商場個業權都過兩成啦！就好似打Snooker咁，set死咗，真係好荒謬。」 林指現階段只能成立業主委員會，「咁樣令我哋處於極不利位置，因為呢個只係純粹諮詢組織」。該區區議員梁美芬批評管理公司不尊重居民，「好似揀清潔公司咁，居民示意佢揀A公司，點知佢最後又係揀番居民唔鍾意嗰間B公司。」她又指管理公司經常「告居民」，「管理費係邊個交㗎？居民吖嘛，咁大嘅集團有啲社會企業責任係好應該，唔好揸住份公契就以為自己大晒，權力唔好用到盡，要自我制約。」 《蘋果》記者
20121229-6,20121229,6,擁私家路　發展商為所欲為,擁私家路　發展商為所欲為 【豈有此理】 「偷雞駁渠」問題癥結在於私家路。居民和區議員指出，黃埔入伙超過20年，管理公司一直以仍有土地未發展為由，拒絕把私家路交給政府，小業主承擔近八成保養費用，發展商則「坐享其成」在路上「為所欲為」，「成條街啲舖頭都係佢嘅，可以揀擺咩廣告牌，選舉嘅時候畀唔畀邊啲政黨入嚟，都可以保持個主導權。」 居民林先生指，該屋苑自87年開始發展至今，私家路一直未取滿意紙，「管理公司解釋唔到，點解一直攞唔到（滿意紙），條私家路嘅保養、雜費都係由我哋（小業主）支付，好唔公平。」他和其他業主擔心，日後港鐵站建成後，小業主要承擔的維修費變成無底深潭。 林批評管理公司只顧大業主和商戶利益，其中7期的電梯原本可停靠停車場、地面及平台三層，三年前因商場租戶要求，突然封了地面出口，居民無論殘疾、老弱抑或推着嬰兒車，要由停車場到地面，均要經車輛出入閘口斜路步行；住客從地面層到平台，要走十多級樓梯，曾有長者體力不支暈倒，受傷送院，但管理公司一直未有積極處理。 《蘋果》記者
20121229-7,20121229,7,東北村民代母親高呼：我哋唔係蟻民任踩,東北村民代母親高呼：我哋唔係蟻民任踩 【元旦我上街】 【記者王家文報道】陳美儀一哭，鼻子就會紅起來，當談到新界東北發展，她沒法忘記三個月前媽媽在傳媒鏡頭前聲淚俱下哭訴，「我哋呢啲種菜嘅人，仲衰過地底蟻，任人踩，一踩就踩死」。她每想一次，就掉一泡淚。元旦日，她會代母上街，首次由維園遊行到政府總部，告訴梁振英，他們不是蟻民，「我哋唔要割地賣港」。 語言偽術聽完背脊骨落 陳美儀住在打鼓嶺坪輋元下村，新界人最怕出港島區，要先搭小巴到粉嶺，後轉乘東鐵到紅磡，再轉車過海，來回要近三小時，但近月她已去了港島好幾趟；9月2日參加反新界東北規劃集會，接着支持反國教的佔領行動。本月15日，她首次出席立法會聽證會，說了兩句就泣不成聲，喊到最後仍疾呼：「不遷不拆，撤回爛計劃！」 從小到大，陳美儀很少關心社會議題，從沒上街示威。她說一切都是被迫出來，「要話畀政府聽，我哋唔想離開」。她今年30歲，雖屬非原居民，但一出世便住在元下村，父母務農40年，養大四子女，她小時候也常要落田，幫手淋水、除草、收割。後來母親轉種有機菜，開了「珍記農場」，港九市民也慕名而來。8月中，關注組召開居民大會，一家才知要被收地。 「政府一下子要收地，好似同你講，家種菜冇用喇，起樓啦，第時就上公屋，攞綜援，否定我阿媽幾十年做嘅嘢，好心酸。」陳美儀花了不少唇舌跟同事解釋，東北發展如何不公不義，但轉頭政府偷步賣廣告，包裝成「香港人的新市鎮」，掩飾賣港大計。他們守護家園的堅持，被打成「阻住地球轉」的罪人。 事實是，坪輋和打鼓嶺用作特殊工業發展，公屋比例是零；但政府不斷打基層牌，聲稱支持發展就會有屋住。陳美儀在九龍灣上班，每日來回車程要兩個多小時，「由呢度去深圳仲近過出中環，點會唔係為深港融合？」她曾經支持梁振英，「唉，佢上場後，一個大話冚一個大話，佢啲語言偽術，聽完背脊骨落」。 今若棄東北明將失全港 許多人會問，東北發展與我何干？陳美儀說，三年前高鐵收地、菜園村被滅，她也沒想過自己今天也要上街保家園，「難保第時屯門、元朗都要收地，成個香港變成大陸」；也有人會問，為何要上街倒梁，她搖搖頭說，「有時我都會諗，如果好哋哋一個政府，點解要搞到咁多人不滿？」
20121229-8,20121229,8,新回鄉證四大變化　下月2日接受申請,新回鄉證四大變化　下月2日接受申請 【本報訊】中國公安部網站昨發出公告，表示決定啟用新版港澳居民來往內地通行證（又稱回鄉證），新證將於明年1月2日起接受申請；18歲以下人士的證件有效期由3年延長至5年，申請費用維持不變。公安部稱新證提高防偽性能，進一步便利港澳居民來往內地及在內地生活。 新證件號碼將終身不變 公安部指新版證件與現行證件有四方面變化，包括將原來11位數字證件號碼變為9位。中旅（集團）證件業務部高級經理黎錫明解釋，現行證件號碼最尾兩個數字用作顯示換證次數，但有持證人見每次換證號碼均有變，感到混淆，故新證另闢「換證次數」一欄，證件號碼變成9位，成為「一人一號」終身不變記錄。 新證又增加了持證人港澳地區身份證姓名和號碼，以及申請換證時持用通行證情況的備注，顯示證件的歷史信息。黎錫明表示，首次換領新證或會因證件號碼改變而產生問題，新證背面備注有助解釋號碼改變原因，及後新證持有人換證時，不會出現有關備注。 新版證件提高防偽性能，嵌入電子芯片，儲存持證人基本資料，配合數字加密技術，此外還有多項物理防偽技術。 黎錫明指，新證右上角內藏芯片的通用標注，顯示證件加入芯片；而數字安全防護措施是配合芯片使用，現行證件並無這兩種技術。至於物理防偽包括印刷、螢光及紫外線等技術，新舊證件均有。 為方便香港居民由其他國家或地區進入內地，新證在正面底部以英文標明持證人可憑證進入內地。而為降低未成年人士換領證件成本，將有效期由3年延長至5年。 10年期證照舊收390元 黎錫明表示，申請新證收費不變，仍然是18歲以上人士10年期證390元，18歲以下5年期證260元，即現行3年期證收費。新證啟用後，舊證在有效期內可繼續使用，如損毀或有效期不足六個月可申請換領新證；若有效期逾六個月，提前換證須預約辦理。
20121229-9,20121229,9,團體質疑：地盤凸出位　只會成為豪宅車場出入口橡樹街地舖本毋須重建,團體質疑：地盤凸出位　只會成為豪宅車場出入口 橡樹街地舖本毋須重建 【本報訊】市建局大角嘴杉樹街/橡樹街「需求主導」重建項目，市建局「出口術」施壓，迫令橡樹街87號地舖業主投降接受收購，終落實重建。環保觸覺批評市建局利用群眾壓力逼業主妥協做法不道德，要求公開道歉；而重建範圍呈「T字形」，橡樹街87號就位於凸出的位置，重建後只會成為豪宅停車場出入口，根本沒重建必要。有學者也指「T字形」地盤凸出位置重建後很大機會成為樓宇通道、會所或休憩空間。 記者：譚靜雯 市建局以「共產」式鬥地主手段收樓環保觸覺昨聯同新民主同盟成員到市建局上環總部請願，要求市建局向橡樹街87號地舖業主道歉，並重新審視T形地盤的必要。杉樹街/橡樹街重建範圍總面積約865平方米，包括杉樹街13至31號（單數），以及一街之隔的橡樹街87號，而87號與杉樹街23號地舖相連，整個地盤形成「T字形」。 批核欠缺專業評估 環保觸覺主席譚凱邦表示，單是杉樹街的10個街號三個地段合共約785平方米，已構成可施工的方形地盤，符合需求主導總面積達400平方米的申請門檻，毋須將只有約80平方米的87號地段合併發展。 譚凱邦認為，「T字形」地盤將影響日後橡樹街89至95號舊樓的重建機會，又估計橡樹街87號重建後將是停車場出入口，「為咗個出口就要五金舖迫遷，值唔值得？」他批評市建局批核欠準則及專業評估，建議重新用一、兩個月審視橡樹街87號是否必須納入範圍。 辯稱非市建局規劃 市建局發言人邱松鶴回應指，杉樹街/橡樹街重建項目範圍由業主主動提出，並非由市建局規劃，該局接受申請時，不會更改由居民提交的地盤界線，市建局角色只負責審核，「一係全部範圍批，一係全部唔批」。 不過，邱松鶴也承認，不排除若由市建局進行主導，重建範圍將有所不同。他又否認日前市建局主席張震遠公開呼籲地舖業主接受收購是施壓。 城大建築科技學部高級講師潘永祥表示，本港不少建築項目地盤都會呈「T字形」，料今次橡樹街87號重建後很大機會成為休憩空間或會所等設施。「好多時未必起樓，可能做花園、會所、網球場。如果冇咗87號，假設要起一個公園，就要喺杉樹街13或15號做呢啲設施，咁咪起少咗單位，所以87號嘅存在令起多咗單位。」但他強調，87號的用途需視乎最後的建築圖則。
20121229-10,20121229,10,5業主50萬買樓　勁賺四倍,"5業主50萬買樓　勁賺四倍 【特稿】 大角嘴杉樹街/橡樹街「需求主導」重建項目，市建局早前以「天價」每平方呎實用面積10,238元提出收購，打破該局成立以來九龍區最高收購價。 三業主近十年才購入 翻查土地註冊處記錄，發現橡樹街87號五名住宅業主，可獲市建局逾250萬元的收購賠償，當中逾半業主近10多年才遷入，他們買入單位時售價只需49萬至53萬元不等，即今次重建可大賺四倍，成功售樓可說賺價又賺住。 橡樹街87號樓高五層，共有五個住宅單位，土地註冊處記錄顯示，五名業主分別在月初及月中接受市建局有條件收購，若重建項目獲發展局局長批准後，就可獲超過250萬元的收購賠償。 資料也顯示，二樓、四樓及五樓的業主都是近10多年才購入單位，當時購入價由49萬至53萬不等，其中五樓業主05年才遷入，當年只需55.3萬元買入單位，今次可收取271萬元收購賠償。 《蘋果》記者"
20121229-11,20121229,11,北京酒樓最後盛宴　食客永記填鴨香,北京酒樓最後盛宴　食客永記填鴨香 【本報訊】北京酒樓最後的一夜，人潮如鯽，喧鬧聲交織着陣陣填鴨濃香。90多歲的老闆徐苕洲默默步入酒樓，含蓄地向食客及來訪的記者揮一揮手，木然地返回櫃位打點一切。42年以來，無論春秋寒暑，在酒樓內也見徐伯的身影，直至昨晚大門關上的一刻。 結業前生意飆升 最後的一夜，部長在晚市前向夥計們每人派發別離的大利是。他語帶傷感說，酒樓結業，預料食客會拿紀念品，已特別預備火柴和筷子套等，有部份熱情的食客更把好幾個寫有北京酒樓字句的餐牌拿走留念。有老夥計說，結業前兩個星期生意額飆升，較平日增長一倍，接獲客人的小費打賞以倍升，失業前總算有點安慰。 最後的一夜，不少食客因沒有訂位而空跑一場，只得在門外在結業通告前拍照留念。有食客動氣說，打了多次電話訂位，也沒有人接聽，親自到酒樓才知道訂位的客人太多，全場早已爆滿，只好買外賣回味一番。前晚才與朋友到酒樓吃飯的莫小姐，昨晚又帶朋友到酒樓吃告別宴，因訂不到位改購買雞煲翅等美食返家與家人分享。她依依不捨地說，酒樓被迫結業很可惜。 最後的一夜，最幸運是一對第二次訪港的德國夫婦，昨晚拿着旅遊書介紹慕名而至，未料這間名揚國外的老字號，因業主收樓結業。平日「寸寸貢」的夥計見夫婦倆千里迢迢來到，特別賣個人情，讓他們兩人與一枱居港韓國僑民搭枱。喜出望外的德國老外點了北京酒樓有名的填鴨品嚐，留下美好的回憶。 深宵時分，人潮散去，四周顯得靜寂，老夥計關上了大門，42年的老店北京酒樓走完最後的一夜！
