key,date,article_daily_id,title,text
20120907-0,20120907,0,黑衫反洗腦　今晚政總見,"黑衫反洗腦　今晚政總見 【本報訊】縱然風雨從未止息，反洗腦的民心更加堅定。我們日復日穿黑衣、撐傘子，奔進公民廣場，瀉滿行人天橋，坐爆四條車路。今天全城黑衣日，各界趁快樂周五再次動員包圍門常開。我們相約在此，伴隨絕食過百小時的老教師、兩鬚斑白的社運老兵，還有坐在廣場做功課的孩子，誓要敲醒裝睡的特區政府。　記者：白琳　袁樂婷 民間反對國民教育科大聯盟葉寶琳說，昨日特首梁振英及開展委員會主席胡紅玉輪流開腔，顯示反洗腦運動進入關鍵時刻，「選舉之前究竟有冇得撤回，呢兩日最關鍵」。她指連日來到場市民都抱怨集會時間太短，因此特別安排今天為全城黑衣日，呼籲市民穿黑衣、繫黑帶，把照片上載facebook，在Happy Friday陪伴絕食人士通宵留守。 教局要校長上報黑衣人數 黑衣日籠罩白色恐怖，教協副會長黃克廉呼籲教師今天繼續穿黑衣及到政總集會，但政府學校教師協會主席黃漢金昨晚向本報透露，教育局向各校校長施壓，必須上報今天教師穿黑衣及學生繫黑帶的人數。黃漢金質疑教育局製造白色恐怖。教育局回應時不否認要校長上報人數，稱會向協會澄清當中絕不存在任何不正當的意圖或行動，絕無針對個別老師或學生。 廣告界支援學民思潮大聯盟今天在報章登黑色廣告，相約大家今晚政總見，「我們慚愧，看到有學生絕食，才懂得流淚。我們來遲了。但，我們不想後悔」。成員Jeff表示，聯盟facebook群組一夜之間有4,000同業加入，800人表態今晚撐場，相信屆時不少同業自製創意示威物品撐場。 聯盟正趕印2,000張反洗腦貼紙派給市民，部份廣告人會通宵留守。Jeff希望更多廣告人站出來表態，「冇言論同思想自由，何來創意？」廣告界爸媽把反洗腦心聲與子女照片剪成短片，呼籲市民今晚「圍政總，撐孩子！」 理大300名社工學生及畢業生今晚撐場。該校應用社會科學系專任導師梁志遠說，其他院校社工系也在動員，估計參與人數逾千。該系退休副教授、本周初參與絕食的何芝君擬明天出院，若健康許可也會重返政總。她指現時社會討論層次已提升到政府施政方針，「擔心政府面對其他民生問題，都繼續漠視民意、高壓管治」。藝人黃秋生任主席的演藝學院校友會發聲明，要求政府立即撤回國民教育科，並免費為反洗腦集會提供音響及燈光器材。"
20120907-1,20120907,1,被學民思潮感染　四十年前熱血再湧社運八老加入絕食,被學民思潮感染　四十年前熱血再湧 社運八老加入絕食 【本報訊】火紅的七十年代，有一群熱血青年，無懼鎮壓走上街頭，爭取中文成法定語文、疾呼保衞釣魚台、怒吼反貪污、捉葛柏，啟蒙了香港的社會運動。時日風飛，昔日的街頭鬥士頭已白、鬢如霜，早退下社運火線。受到90後學民「小師弟」的感召，岑建勳、侯萬雲等八位社運老兵昨恍如「大師兄歸位」，走進政府總部廣場宣佈無限期絕食，高呼「誓死保衞孩子！」　記者：梁德倫　蔡朗清　黃通蜀　麥志榮 這八名絕食社運老兵，大部份是在火紅年代參與社運的「70人」，即《70年代》雙周刊成員。八人分別是岑建勳、關錦標、黃興華、侯萬雲、楊寶熙、陳志堅、黃仁逵、吳家麟。八人都是當年保釣、中文運動、反越戰、反貪污捉葛柏、金禧中學事件等社運的搞手，那些年經常因示威而被警方拘捕。 誓死保護我們的下一代 社運老兵們昨午2時開始宣佈絕食，在政府總部廣場外紮營留守，並掛上旗幟鮮明的橫額「70社運老兵團」，與80後的陳景輝、葉寶琳等社運人、90後的學民小師弟黃之鋒齊集廣場，跨世代反洗腦國民教育。 絕食前，他們先由代表侯萬雲讀出絕食宣言。宣言提到學民思潮一直努力不懈的抗爭，正是喚醒這班社運老兵「殘而未滅」學運心火的引子，令他們塵封40年、埋藏腦海深處的社運抗爭片段再度重現。正如他們40年前為了公義和人權上街一樣，今天為了反對國教決定再走上街頭，以無限期絕食抗議政府漠視民意。 這班年逾60的社運老兵們說，他們有人有兒有孫，也有人無子無女，卻被年輕一代所感動，因為在周六添馬公園公民教育開幕禮中，除了天上乍現的彩虹，站在台上的學民思潮代表和歌唱的兒童，也是他們心中的彩虹。彩虹橋下，老將們為了下一代仍有獨立思考能力、為了保護下一代，表明不惜用餘下生命「保護我們的下一代！」 這個社運老兵團其後謝絕採訪，在絕食區內同聲高歌著名人權歌曲《We shall overcome》後，高呼「反對洗腦國民教育」口號。 已成為本港社運傳奇神話的《70年代》雙周刊，亦是由一場學生運動誕生，1969年珠海書院發生香港學運史上的「珠海事件」，學生反對校方操控學生會發動罷課，多名學生被踢出校，其中數學系學生吳仲賢在1970年1月創辦了《70年代》雙周刊，提倡反建制、反抗殖民統治等理念，對本港70年代的社會文化有重大影響，吸引到來自各個階層的人加入，有知識分子、藝術家、學生和工人，梁國雄也深受其影響。 雜誌社有如「散仔館」，不少成員窮得無飯開，便有有工作的成員義助。到了1972年，由於成員間出現政治意見分歧，周刊停刊，成員亦各散東西，但其中不少人一直是社運活躍分子至今。 絕食老兵團簡歷 侯萬雲：65歲，退休人士。在越南出生，1964年來香港讀書，《70年代》雙周刊主編，參與爭取中文成為法定語文運動、保釣運動等。其後曾擔任編劇、導演，亦曾任職《電影雙周刊》及《號外》雜誌。 岑建勳：60歲，電影工作者。《70年代》雙周刊成員，曾參與多次社會運動，其中1973年參加反貪污、捉葛柏運動被拘捕。1989年六四事件後，曾與其他人士暗中組織黃雀行動，營救被通緝學生。 楊寶熙：60歲，現為本土農業推動者。70年代學運先鋒，曾出任中大學生會會長及學聯會長，畢業後在五育中學任教師，1982年因校方無理禁唱《義勇軍進行曲》，發動老師集體辭職抗議。 關錦標：60歲，在70年代曾參加過杯葛市政局選舉、爭取中文成為法定語文、保衞釣魚台運動、支持盲人工友工潮、反貪污捉葛柏運動、支持日本三里塚鬥爭。 黃興華：58歲，現經營搬運公司。1971時是貨車司機，積極投入社運，在示威活動中屬行動派。 黃仁逵：58歲，藝術家及電影製作設計師。《70年代》雙周刊成員，負責美術，當年最出位的封面是小朋友向一面英國旗屙尿。 吳家麟：58歲，IT從業員。70年代初是學生，參加《70年代》雙周刊的編寫工作，積極參加社運，89年六四後曾在英國搞街頭劇示威。 陳志堅：56歲，現職地產界，80年代初開始投入社運。
20120907-2,20120907,2,宣言全文 「夕陽散餘暉　破曉迎彩虹」,宣言全文  「夕陽散餘暉　破曉迎彩虹」 40年前，我們像你們今天一樣年輕，我們曾面對暴力，為公義上街抗爭，為爭人權絕食。今天，我們這班退役多年的社運老兵，早已進入人生的夕陽歲月，有些有兒有孫，有些無兒無女，但為了反對洗腦國民教育，我們宣告：由今天2時起，我們會在特區政府總部外廣場，作無限期絕食，抗議政府漠視民意。 多謝「學民思潮」，你們重燃我們殘而未滅的學運心火，多謝你們無私無懼和不懈的努力，我們謹此向你們致以崇高的敬禮！今日能夠與你們共同作戰，是我們的光榮！ 40年來，我們經常撫心自問，如何與年青一代分享我們的社運經驗？卻沒有想到，原來是我們要向你們學習！怎能不說，有獨立思考能力，是何等重要？我們怎能夠不站出來，用尚未衰透的筋力，嘶聲力竭地高喊：「誓死保衛孩子！」 本月3日添馬公園公民教育開幕禮進行期間，我們看到一雙彩虹，一條出現在天空，一條出現在學民思潮代表與可愛的兒童們唱歌的台上，我們這班老兵，怎能不動容？孩子們，我們將不會吝嗇餘下生命，保護你們，保護我們的下一代！
20120907-3,20120907,3,絕食鬥士韓連山：巿民支持，令我堅持,絕食鬥士 韓連山：巿民支持，令我堅持 年過六旬的老人家，本應喜孜孜在家中弄孫為樂，豐衣足食過日子；惟面對殘害下一代、麻木不仁的梁振英政府，63歲的退休教師韓連山要跑到街頭，餐風宿露絕食。時間一分一秒溜走，生命一點一滴消逝，韓老師絕食踏入第六天、122小時。每天太陽升起，他都擔心一睡不醒；但只要心臟繼續跳動，他會堅持下去，直至政府撤回洗腦國民教育。 兩絕食者不適退出 韓老師是今次絕食行動中，年紀最大及絕食時間最長。他昨說身體狀況十分正常，只偶然血糖偏低需飲糖水。他打趣說：「連尿都驗埋，正常過正常人。」他說每晚臨睡前也怕翌日「唔掂」，對自己能支持至今感到驚訝，「係廣大巿民支持，動力令我感動、令我必須堅持下去，為下一代爭取撤回國民教育科。梁振英未回應前我都會堅持落去，鬥志越來越旺盛」。他強調絕食是自殘或公民抗命，不希望有人加入，但若對方堅持，願站在一起。問及行政會議成員陳智思昨晨指國民教育可試行一年，老馬有火他直斥廢話，「明知叉燒飯有毒，你仲要小朋友食，大家都早知教材有問題」。他又批評教評會的調查是小罵大幫忙，建議的一年冷靜期行不通：「係與狼謀皮，同政府建議如出一轍。」韓連山退休前任教的天主教慈幼會伍少梅中學的10多名學生，昨到場探望韓老師，見到老師無恙後便安心。多名絕食者因身體狀況欠佳，不得不停止絕食。中大新聞與傳播學院教授馬傑偉已絕食50小時，昨晨5時頭暈及血壓偏高，被勸喻入院。他堅持至昨晚8時才停止絕食。眼泛淚光的他自稱「老油條」，但目睹一班堅定不移的學生，也感熱血沸騰，「呢班中學生係香港人精神支柱」。37歲廣告公司老闆姚冠東，為了4歲兒子和未出世的孩子，已絕食了67小時。他患有糖尿，因胃痛及精神委靡，昨午5時結束絕食。他批評政府無情，相信會越來越多人關注反洗腦。《蘋果》記者
20120907-4,20120907,4,內容無新意　只為「試水溫」胡提六建議聯盟不中招,內容無新意　只為「試水溫」 胡提六建議聯盟不中招 【本報訊】對政府撤回洗腦國民教育科的希望昨再一次落空，開設德育及國民教育科委員會主席胡紅玉昨老調重彈，稱獲政務司司長林鄭月娥確認可討論是否撤科；不過其餘五項討論範疇，均是小修小補後繼續推行。民間反國教科大聯盟指當局只是「試水溫」，學民思潮、家長關注組和教協堅持不會加入該委員會。 記者：倪清江　許偉賢　呂焯均 胡紅玉昨下午突然在政府總部西座召開記者會，但30分鐘的發言沒有新意，記者會前，她與林鄭月娥會晤，確認委員會可討論是否撤科。她臚列六大題目：撤科、獨立成科還是跨學科學習、公民教育或德育課程包含國民教育、加入當代中國歷史課程作補充、重新討論課程指引、以及延長三年開展期。 胡紅玉昨被問及為何不撤銷課程，她重複在三年開展期，學校可完全決定推或不推，即使推行也毋須跟隨課程指引。她說委員會可建議修改政府政策，一有定案便會斬件交政府考慮，但接納與否由特首梁振英決定。 「胡六點」並非新建議，除討論撤科外，其餘五項的前提都是繼續推行國教科，胡紅玉更表明會要求政府增撥資源，予不同組織、學校、家長自編教材。她否認重提職能是緩兵之計，又否認是扯線公仔。胡再次要求學民思潮、家長關注組和教協派代表加入委員會，她也同時提出可於其他平台與他們商討；但被問及何不步出政總寫字樓，到廣場與抗議人士對話，她離開不答。 不認為學民是選舉棋子 行政會議成員張志剛日前在報章發表文章，質疑學民思潮成員只是學生，何以會「身懷絕技」，同是行會成員的胡表示，不認為他們是政治籌碼或選舉棋子，「好尊敬佢哋立場，覺得佢哋好叻，令到一個運動成功，唔覺得有呢種嫌疑。」 學民思潮召集人黃之鋒認為，胡昨出來只為事件降溫，大聯盟堅持政府必須撤回國教科，因此行動並未成功。大聯盟發言人葉寶琳表示，胡紅玉只是「試水溫」，因為政府見到連續幾日都有近萬人集會，對管治造成壓力。教協副會長黃克廉認為，胡見傳媒是伸出友善之手，教協會與其他團體繼續要求撤科。 特首梁振英堅稱國教科不是洗腦，重申撤科與不撤科之間有好多可能性。他又稱已向警方發出明確指示，警員在政府總部現場維持秩序時要以最大寬容及容忍度，絕對無清場計劃。 到俄羅斯海參崴參加亞太經合組織會議的財政司司長曾俊華，昨到機場迎接與會的國家主席胡錦濤前表示，相信胡很清楚本港德育及國民教育科問題。在北京的國家教育部部長袁貴仁表示，注意到港府在推行國教科中的態度，認為事件有很大討論空間，認為任何國家與地區都應該有國民教育。
20120907-5,20120907,5,拆局拖延撤科　梁振英隨時墮馬,拆局 拖延撤科　梁振英隨時墮馬 每天有近萬市民在政府總部外反國民教育，但政府仍拒絕撤回國教科，不少政界中人均認為政府一再錯失化解危機機會，只會令反對力量不斷累積，怒火最終指向教育局局長吳克儉及特首梁振英，要求他們下台為民憤負責。有政界中人指出，梁振英日前突然取消到俄羅斯出席亞太區經濟合作組織首腦會議，政圈又再廣泛流傳，梁處理反國教手法令中央不滿，要求他留港處理危機。而特首換馬之說又炒熱，特別是代梁出席會議的財政司司長曾俊華昨表示，他會和國家主席胡錦濤見面，滙報香港情況，又說自己隨時準備好做任何事，更加引起不少人揣測，曾會否是取代梁的人選之一？另一政界人士說，政府現在才說由胡紅玉任主席的開展德育及國民教育科委員會，可以討論撤回國教科問題已經太遲，「民意家唔係討論撤科定唔撤科，而係要政府立即撤科」，再拖延下去只會令市民更不滿，社會繼續累積怒火和不滿，「到時就唔係要撤科，而係要吳克儉同梁振英下台」。《蘋果》記者
20120907-6,20120907,6,CY連環出招圖轉移視線,CY連環出招圖轉移視線 【本報訊】立法會選舉前夕，特首梁振英為減少建制派選情受反國民教育運動的衝擊，連環推出新政策，圖以「煙幕」轉移市民焦點，昨日宣佈在啟德推出兩幅只供香港永久居民購買的「港人港地」，今日續有新招出籠，宣佈無限期擱置深圳的一簽多行措施，並「報喜」指香港日後有權叫停內地增加自由行簽注。政府內部深感目前處於劣勢，需要推出受市民歡迎的新政扭轉局面，故梁振英上周翻炒前朝的樓市十招，再改革交通津貼計劃「雙軌制」關懷低下階層，可是社會怨氣未消，甚至拖累建制派選情。即使代替梁振英到海參崴出席亞太經合會議的財政司司長曾俊華，否認政府出現管治危機，但梁振英管治陷入困局有目共睹，食物及衞生局局長高永文昨日也承認政府面對很大逆境。梁振英昨日再出擊，下午巡視東九龍後，宣佈推出「港人港地」先導計劃，把啟德舊停機坪兩幅住宅土地建成的單位，限定只供香港永久居民購買，30年內轉售也只限售予香港永久居民。 「有權」叫停自由行新簽注 此外，另一個引起港人反感的事件，是早前深圳單方面宣佈放寬非深圳戶籍民工及學生可一簽多次來港，惹香港社會極大爭議。據知梁振英已與北京達成三點協議，最快今日公佈，包括擱置非深圳戶籍的工作人口，一次簽注便可於一年內無限次來港的安排，並容許港方日後有權「叫救命」，當港方發現太多自由行旅客帶來負面影響，可向內地要求暫停內地自由行的新簽注。最後是包括深圳和北京在內的六個城市，容許非該城市戶籍的工作人口，毋須返回原居地才可申請一次性簽注來港，此純為便民措施，故毋須取消。
20120907-7,20120907,7,特首夫人密會中聯辦高官,特首夫人密會中聯辦高官 【本報訊】特首夫人在選舉前夕密會中聯辦女高官？梁振英太太唐青儀（上圖右二）昨午3時許，乘車由特首辦往灣仔港灣道華潤大廈，身穿湖水藍上衣、杏色西褲的梁太甫下車，已有兩名女職員恭候，熱情地引領梁太乘電梯往大廈49樓的華潤集團。至4時53分，梁太由兩名女職員送出門口，登車返回特首辦。 梁太一走，兩女職員即再奔入大廈，一左一右護送中聯辦副主任郭莉（下圖中）出來上房車，房車直駛西環中聯辦。接待人員相同、二人前後腳離開華潤大廈，估計梁太是與郭莉密會。　莊建鑫攝
20120907-8,20120907,8,國教議題民建聯大出洋相,國教議題民建聯大出洋相 【本報訊】眼見政府就洗腦國民教育作輕度讓步，一直反對撤回的建制派提早抽水。民建聯主席譚耀宗昨在港台新界西選舉論壇上，自爆昨早曾致電特首梁振英，要求當局與反洗腦大聯盟磋商解決方法，但被對手工黨主席李卓人諷指：「民建聯最叻同梁振英打龍通」，反問對方有否向梁振英提出撤回，但譚耀宗未有直接回應。同區其他建制派候選人，亦在國民教育問題上出洋相。街工黃潤達向民建聯梁志祥出擊，要求梁志祥表明是否支持撤回，但梁志祥情急下說了一句「反對洗腦教育」後，旋即無厘頭轉移視線，要求街工回應是否支持天水圍設墟市。社民連曾健成駁斥梁，「家講緊國民教育，你唔好東拉西扯」。民主黨黃偉賢亦斥梁一提國民教育就扯開話題「搵窿捐」。 陳恒鑌反口唔認抹黑學民 工聯會不遑多讓，民主黨李永達稱連日在多個論壇上，幾度要求麥美娟回應是否支持撤回國民教育，但麥昨亦未有表態，辯稱社會未就此有共識。有烽煙市民則要求民建聯陳恒鑌交代，為何說學民思潮是「政治工具」。陳強調從未說過「呢四粒字」，指「呢四粒字」出自公民黨郭家麒，反要求郭向他道歉。李卓人即揶揄他是「蠱惑仔」，「你無話政治工具，但你話（學生是）棋子吖嘛」。公民黨則與新民黨互轟，郭家麒斥田北辰的國教立場閃縮，田反指該黨曾在08年立法會支持推行全面國民教育，指公民黨轉軚；余若薇反駁田「斷章取義」，堅稱當時強調要全面推行，但未有支持獨立成科，郭更指田「最無賴」，田激動得指控對方含血噴人。李卓人期間亦要求麥美娟交代，為何工聯會去年不支持交通津貼雙軌制，是否應向工人道歉。麥美娟堅稱「如果唔係食住嚟收，工人要等多半年呀」。李卓人即反駁：「你哋最叻食住嚟收，你乜屎都食。」李卓人其後就此言論道歉，修正指：「係政府畀乜，你哋都照食。」
20120907-9,20120907,9,肥佬黎大班開咪　聽得又睇得,肥佬黎大班開咪　聽得又睇得 更多類型的動新聞 只在爽報放送  今日精選有： 隨時聽隨時睇　大班直播室開咪 爽報網站掃描QR Code  蘋果App一Click就看到 新玩意新玩意，爽報有iPad揭頁App！ 隨時隨地可以揭住睇，很爽哩！  古董潮眼鏡美軍專用款、西德K金眼鏡亦有。 7折有交易、稍後會升值！ 請即上爽報網頁，發掘更多精彩內容！  http://sharpdaily.hk  或上Appstore下載「爽報香港」iPhone app：  http://itunes.apple.com/hk/app/shuang-bao-xiang-gang/id468400467?mt=8 
20120907-10,20120907,10,沈祖堯支持　中大提供場地電力八院校校長尊重罷課,"沈祖堯支持　中大提供場地電力 八院校校長尊重罷課 【本報訊】34年前的中大校園，反對四改三學制的中大學生罷課抗爭；下周二，學聯將原地重現罷課場面，反對「教育23條」。學聯號召全港大學生當天齊集中大罷課半天，作為中、小學罷課的前哨戰。八大院校校長表示尊重學生罷課的意願，其中中大校長沈祖堯全力支持學生，提供場地及電力。 記者：潘柏林　彭美芳　倪清江 學聯昨日號召大學生，以要求政府立即撤回國民教育科為旗幟，9月11日下午2時至6時，齊集中大百萬大道罷課集會四小時，預計逾千學生參加。學聯秘書長李成康昨強調，罷課並非激進，為公義犧牲上課時間很值得，早前絕食送院的港大前教授何芝君也會到場支持。 大專生誓師支持罷課 罷課行動重頭戲是大專生誓師儀式，屆時大專生會承諾支持中小學罷課反國民教育。李成康說：「當日大學生會承諾全力支持中小學罷課，直到梁振英撤回國民教育科。」他指中小學生因怕影響學業，難罷課，大學生較容易發動罷課，他認為大學生可支援中小學補習，目前已有數百人報名加入義教行列。 在1978及1988年，中大學生為反對教育當局要求把中大四年制改為三年制，先後發動兩次大型罷課，兩次也有近3,000中大人響應。 八大院校校長昨表示尊重學生參與集會的自由。中大校長沈祖堯昨日表態，會為罷課大學生提供場地、電力等支援，確保罷課及校內教學活動同時順利進行。 沈祖堯說：「佢哋表達自己嘅訴求，向政府表達意願，我哋係支持嘅。大學教育鼓勵學生有獨立思考能力，我哋亦覺得認識國家唔係錯事，希望兩者取得平衡。」科大、嶺大及城大促請政府，早日解決國民教育科爭議。 三十會登廣告促撤科 十大專院校學生會前日通知同學罷課決定，獲得熱烈迴響，逾百個系會屬會表明支持。學聯在罷課日前，向同學派發黑絲帶和設街站，又到迎新營呼籲新生加入罷課。中大學者聲援罷課，社會學系副教授陳健文及新聞與傳播學院講師譚惠芸，已安排額外課時補課。 大學生罷課後，接着是9.29中小學罷課預演。論壇組織「三十會」早前在報章刊登聯署廣告要求撤回國民教育科，前勞福局政治助理莫宜端也有聯署。該會發起的「義教挺罷課」行動，截至昨日已有超過200人登記參與義教，其中更有居於美國波士頓的港人表示希望回港出分力。而包括前食衞局政治助理陳智遠在內的50位青年學者及文化工作者，已組成支持撤回國教科後援會籌備義教，中學教材內容由各大專教授、講師負責，上載至後援會網站，配合義教行動。 另外，十多名大學學者昨日赴政總反國民教育，包括科大社會科學部副教授成名、中大政治與行政學系高級導師蔡子強、港大法律學院助理教授張達明等。聯署聲明由17人發起，發起人之一成名稱，已收集145名學者簽署，要求當局秉承教育家蔡元培愛護學生精神，不讓孩子偏聽盲目，「守護我哋嘅下一代，守護香港同中國嘅未來。」 我們反洗腦"
