key,date,article_daily_id,title,text
20120505-95,20120505,95,隔牆有耳：執掌衞生署　女專員VS神探輝 - 李八方,隔牆有耳：執掌衞生署　女專員VS神探輝 - 李八方 候任特首梁振英嘅五司十四局班底，主要官員名單陸續曝光，多個副局長未有人選。食物及衞生局副局長嗰位，自從梁卓偉去咗做特首辦主任後就一直懸空。近日醫學界傳出，有「神探」之稱嘅衞生防護中心總監曾浩輝已經辭職，將會埋位做副局長。 八方驚聞此消息，即時四出打探，有人話神探輝嘅專業能毋庸置疑，有多次應付疫症經驗，同傳媒關係良好，轉做副局長勝任有餘。 神探輝唔吼副局一職 之不過權威消息人士卻話，呢單似係流料居多，曾浩輝唔似會辭職，因為佢鍾意留守喺自己專業範疇，對住細菌多過面對政客。神探唔脫離公僕隊伍，可能有更好前途呢！因為衞生署署長林秉恩下個月退休，八方聽聞熱門接任人選包括曾浩輝同食物安全專員陳漢儀，邊個上位，進入最後衝刺階段，好快有結果。 陳漢儀原屬於衞生署，幾年前被借調去食物環境衞生署做助理署長，07年晉升為D4級嘅食安專員。 論資排輩陳略勝一疇 曾浩輝個總監位同樣係D4，兩人官職咁高咁大，不過陳漢儀85年港大醫科畢業，高曾浩輝五班，講論資排輩，陳漢儀資深啲，因此有人對陳漢儀升職睇高一線。 陳漢儀過去幾年處理過三聚氰氨奶粉同孔雀石綠等食物事故，又幫手搞食物安全法，政績唔錯。陳漢儀幼稚園至中學都讀玫瑰崗學校，港大畢業後曾去新加坡進修，88年加入衞生署，2000年升為助理署長。 之前盛傳CY會搵支持者、私人執業眼科醫生周伯展入閣，不過周伯展係「月球」醫生，即係每月最少搵100萬，要佢做官，好多人相信佢未必肯㗎。 mailto:pf_lee@appledaily.com
20120505-96,20120505,96,醫然一笑：一起活下去（五） - 莫樹錦,醫然一笑：一起活下去（五） - 莫樹錦 重創後的何Sir剛走上康復之路，在這路上他遇上兩個難題。 「醫生，你估計我何時可以走動？」他合理地重申問題。 醫生從床尾轉到床邊，好不容易才找到一小片空間坐下，道：「剛才提及的傷勢包括氣胸、脾裂及骨折等，假以時日定可康復。但另外還有脊骨T12和L1（VertebralSpine）骨折，車禍時你定必是背向車輛，FirstPointOfImpact（首先撞擊點）是脊骨，故令脊髓中央神經（SpinalCord）嚴重斷裂，下半身因此可能癱瘓。」醫生說吧默然。 何Sir沒有過大反應，冷靜地說：「多謝你的坦白，我初時還以為是石膏太緊令雙腿麻木。」 「對不起，這方面我們實在無能為力。」醫生說。 「不打緊，我明白，不打緊……」找不到另外一句說話但腦海裏卻有千百個問號：「以後能否控制大小便？學校會否繼續錄用？若不教體育，難道去教音樂？坐輪椅能否打籃球……」 但心底下最痛最難的問題還是：「Jeanie仍然活着嗎？」 自清醒後，他曾向護士打探，答案是對意外毫不知情；試問母親，她當然不知Jeanie為何物，還以為他手術後胡言亂語；想打電話，又苦於手提電話早已在意外中化作碎片。面前的醫生可能是他第二個難題唯一線索。 「醫生，可否問一問。意外發生時還有另外一位女途人，你知道她情況嗎？」 醫生想了想便說：「那次意外總共有四個傷者，因ICU床位緊張，兩個傷者分流到QE，你和另外一個女傷者分流到我們這處，她沒有這麼好運，頭部受重創，昏迷兩天後便告不治。」 「不治」兩字像利刀刺入心臟，心裂的痛比車禍更難受。他不會為癱瘓而哭，但這死訊卻令他情緒完全崩潰，第一滴眼淚落下，靜靜抽泣演變成大聲嚎哭，心裏更大聲咒罵老天一刻間奪走他雙腿和一生唯一所愛。 醫生意料不到反應如此強烈，除了遞送紙巾外便只能說：「不要激動，很多半身不遂病人也能正常生活。」當然醫生不會明白何Sir的眼淚不是為自己而流。 醫生說得對，坐輪椅可以正常過活，但帶着被撕裂的心便很難繼續活下去。（續） 中文大學臨床腫瘤學系教授 莫樹錦
20120505-97,20120505,97,隔牆有耳：屈Sir唔肯做阿二 - 李八方,隔牆有耳：屈Sir唔肯做阿二 - 李八方 3月時退出新民黨嘅屈奇安，退黨背後有內情。八方聽聞喺黃大仙新蒲崗駐紮嘅屈sir，打算揸住葉劉支旗出戰九龍東，希望爭奪九東新增一席，不過，中聯辦副主任林武力挺重點栽培嘅旅遊界謝偉俊，力谷佢做「九東金童」，同「九西鼠女」嘅梁美芬成雙成對。 屈老婆詐型 林武重施故技，希望好似幫鼠王芬咁樣，捧超人謝偉俊上位，所以西環搵啲所謂獨立嘅建制派區議員幫謝偉俊做樁腳，據說有人要求屈Sir屈就吓，排喺謝偉俊名單做阿二，做「超人抬轎員」，雖然屈Sir姓屈，不過卻唔甘心被屈，因此寧願退黨。 不過，有人認為屈Sir輸咗區議會，「食」力麻麻，做阿二好合理。屈Sir同八方講，唔評論呢啲傳聞，解釋退黨係因為太太「投訴」，不滿佢退休之後掛住搞政治，冇乜時間陪佢，老婆開到口，惟有退黨。至於係咪全面退出政壇呢？屈Sir就留一線，話唔會全退。
20120505-98,20120505,98,開心見誠：私家醫生的得與失 - 李德誠,開心見誠：私家醫生的得與失 - 李德誠 離開大學及公家醫院的崗位，轉到私營市場當私家醫生，一轉眼已五年，當中的轉變實在不少，可謂有得有失。 有得的是，離開了公營醫療架構，工作上少了很多掣肘；診所是自己的，所以想播怎樣的音樂、插甚麼的花、養甚麼魚，甚至是診所的光線、溫度也由自己控制。更重要的是，開藥時毋須考慮部門指引或部門經費是否足夠。 不過有得自有失。當一個私家醫生可以是一個很寂寞的工作，與公家醫院不同，每天由巡房、吃早餐到門診，甚至部門會議都是一個群體活動；私家醫生便剛好相反，每日除了見到自己的姑娘之外，甚少與同行見面。以前遇到奇難雜症也可與同僚或更有經驗的師傅請教，但當私家醫生便沒有這份福氣了。 另外，我以前沒想過經營一間診所原來是非常繁複和費神的。地毯弄髒了要更換、要處理姑娘的公積金，更複雜的是藥物管理。以前在公家醫院有藥劑師打點一切，現在便要自己負責買藥數量、留意藥物何時要再訂、決定藥物的價錢等，全都是藝術。 我和我的姑娘都很怕曱甴，從前舊診所隔籬裝修，驚動了小強一家，其中有一隻曱甴走進了我的診所，我和姑娘也第一時間飛奔往診所外，幸好有一名病人不怕，替我處理了它，我們才可安心繼續工作。不過我覺得當私家醫生最大的滿足感，是有更多時間與病人溝通，而且在公營醫療系統中，病人是屬於公家的，尤其精神科醫生往往每六個月便要轉崗位一次，很難長時間跟進同一名病人。 現時，我每名病人覆診，也有10至20分鐘，開始治療時病情尚未穩定，覆診時大部份時間用在跟進病情、解釋治療方案和解答病人問題；但當病情穩定下來時，技術上只須五至八分鐘便可，剩下的時間我喜歡與病人聊天，天南地北無所不談。 這幾年我從病人身上學了不少知識，有病人教我哪裏買菜、買豬肉；有病人教我最新的隔音設施；最近有病人告訴我盛女節目背後一些鮮為人知的事；試過有基金經理告訴我他的最新部署（果然百發百中！），當然不少得與病人分享湊仔經。有時想，雖然彼此是醫生與病人關係，但聊談起來，倒像朋友多一點。雖然看症很費心力，每天與不同「朋友」談天說地，天南地北，很快又回氣，一天的時間很容易很快樂便過去。 精神科專科醫生　李德誠
20120505-99,20120505,99,隔牆有耳：「一人一相」保本部大樓 - 李八方,隔牆有耳：「一人一相」保本部大樓 - 李八方 港大地標本部大樓陸祐堂，係好多人集體回憶，八方都有份，校方建議改做行政用途，學生要去其他地方上堂，港大學生會發起「一人一相」保留本部大樓作教學用途活動，呼籲所有港大人拍下本部大樓照片，分享到Facebook（ https://www.facebook.com/events/307073732701536/），  仲可以簡單說明寫低自己嘅MainBuilding故事，最好有埋姓名、學系、年級或畢業年份。 學生會又要求校方諮詢學生團體，認真考慮學生意見，俾所有港大人都可以參與規劃本部大樓日後用途，仲要公佈未來發展時間表同相關資訊。最後一場本部大樓用途諮詢論壇，於今日上午10時喺本部大樓畢業生議會廳舉行，學生、校友都可以出席。
20120505-100,20120505,100,Ella嫁急色馬來糕脫衣舞撩㷫新郎,Ella嫁急色馬來糕 脫衣舞撩㷫新郎 現年30歲的S.H.E成員陳嘉樺（Ella），昨日跟35歲馬來西亞籍男友賴斯翔（馬來糕）拉埋天窗。Ella貫徹爛玩性格，竟跟老公在婚宴中大跳脫衣舞，不但當眾剝衫扯裙，二人女前男後大跳辣身舞時，Ella拉着老公的手壓胸和摸下體，極度意淫，她又誇口盛讚老公下盤厲害夠威猛，言行豪放。 台灣女子組合S.H.E的成員近年輪住嫁，先有Selina覓得好歸宿，昨日是Ella大婚好日子，她與相識五年、拍拖一年多的馬來西亞籍男友馬來糕在台北寒舍艾美酒店舉行盛大婚宴。向來性格大癲大肺的Ella，昨日在婚禮竟跟老公跳脫衣舞兼摸身摸勢娛賓。 婚宴筵開50席，Ella心情緊張，穿上低胸婚紗、大晒33C咪咪的她接受訪問時說：「很開心。」才說到這裏，Ella已忍不住流淚。被問到跟馬來糕有否提前洞房時，她笑說：「沒力氣，太累了！」隨後記者要求Ella跟老公親嘴，她大方連咀六次。 「老公下盤很厲害」 婚宴開始時，由五對伴郎伴娘先進場，青峰和Hebe壓軸，Ella由爸爸拖着進場，戴上總值逾633萬新台幣Chaumet鑽飾的新娘邊進場邊哭，及至看到父親與馬來糕相擁時，Ella更喊到收唔到聲。Ella其後換上火紅低胸裙，跟馬來糕跳脫衣舞辣㷫嘉賓，二人隨着歌曲《SingleLady》起舞，馬來糕伸手把老婆的裙襬大力扯走，Ella也狂野脫掉老公外衣，他們跟着音樂節奏扭腰摸臀，熱舞不停，高潮所在是Ella和馬來糕扭作一團，馬來糕從後箍緊老婆，雙手不時在Ella的C奶游移，他本來只用右手壓住老婆左胸，但Ella反主動把老公左手放到自己的下體敏感部位，全場驚呼起哄。Ella坦言不介意當眾讓老公摸胸壓下體，她大讚說：「我老公最猛了！」 Ella又驕傲地說：「我老公是不是下盤很厲害？一看就知道我很幸福。」嘉賓聽到Ella的三級笑話都笑不攏嘴。馬來糕雖不是幕前人，但跳起舞來動作敏捷，毫不怯場，他為方便跳舞，特意換上波鞋。他前晚在微博晒婚禮戰鞋，波鞋兩側繡有「Happy」和「Marry」字樣，非常切合婚禮。 鹹濕笑話安慰愛郎 馬來糕不但用舞姿示愛，還向Ella大講肉麻愛的宣言，他情深款款說：「貝貝，謝謝你在我人生最黑暗的時候，奇妙地闖入我的生命中。因為你的活潑、樂觀……還有三八，讓我的生活恢復了色彩。跟你相處的時刻總是快樂自在，沒有壓力，你總是給予我最大的支持與鼓勵。今天，我終於可以叫你老婆，我的愛人、我的妻子，讓我愛你一輩子。」 Ella感謝老爺和奶奶，她說：「謝謝你們接受我瘋瘋癲癲的個性，希望剛才那段舞蹈沒有嚇跑你們。」Ella同時也感謝馬來糕讓她厚臉皮勾引，馬來糕致辭時也流淚，他一時口快把伴郎說成「棒」郎，Ella又講鹹濕笑話：「沒關係啦！大家都有一根棒啦！」 撰文：丁寧 　 新郎馬來糕 年齡：35歲 籍貫：馬來西亞 職業：萊雅保養品的消費用品事業部總經理 年薪：260萬新台幣 　 新娘Ella 年齡：30歲 籍貫：台灣屏東 職業：歌手 年薪：逾1億新台幣
20120505-101,20120505,101,GaGa粉絲扮嘢大格鬥隊啤MaMa險勝大點阿芝,GaGa粉絲扮嘢大格鬥 隊啤MaMa險勝大點阿芝 【GaGa瘋之歡樂滿GaGa】政府擬立法收緊二次創作，但GaGa粉絲一於少理，趁偶像來港開騷發揮創意，把GaGa過往造型再創作擺上身，連鍾楚紅都野性打扮趁熱鬧，堪稱香港史上最多人扮嘢的演唱會。 藝人始終未及fans去得盡，幸卓韻芝挽面子，其鬼僕造型除贏得高登近四千負評外，更殺入GaGa扮嘢比併第二位，輸了個馬鼻給雌雄莫辨的隊啤MaMa。阿芝昨日在電話中說：「睇騷前一晚，GaGa夢召我同班朋友要呢個造型去捧場，醒咗大家都着咗魔咁打扮，我當晚企第一排，GaGa兩次行埋嚟同我講you'resocute，呢啲叫cute，我返屋企成晚瞓唔着囉！」GaGa今日和後日最後兩晚開騷，各位小魔怪要挑機就把握機會！ 撰文:朴呱呱
20120505-102,20120505,102,童愛玲做囝囝二廚,童愛玲做囝囝二廚 童愛玲和梁芷珊前晚到中環出席母親節活動，兩人都帶同仔女出席，童愛玲說8歲兒子Kyle近日迷上煮嘢食：「佢睇咗個小朋友煮嘢食嘅節目，所以鍾意咗，反而我變咗佢二廚，佢知道我煮嘢唔叻，所以想煮畀我食。」 梁芷珊撐老公 梁芷珊的9歲女兒因應活動畫了母親的畫像，兩母女亦穿上母女裝現身，梁芷珊指造型是由大會安排，平時甚少與女兒穿同樣的服飾：「我哋撞衫個女都唔抗拒，仲反問撞衫有罪咩，我個女好獨立，揀衫唔會問我意見。」對於老公羅傑承要為歐文龍貪污案作供，梁芷珊說不擔心，因為老公只是證人，主要是將所知講出來就夠。 採訪、攝影：王連連
20120505-103,20120505,103,陳玉蓮帶髮修行唔想做人,陳玉蓮帶髮修行唔想做人 陳玉蓮昨日在油塘出席「香港復康力量：全港無障礙商場表揚活動頒獎典禮」。蓮妹早前重回無綫拍劇，她表示完成工作後暫不再接工作，專注在內地探訪，月中她便會探訪山區窮鄉。 「唔想再輪迴」 蓮妹說：「呢幾年不停做資料搜集，睇吓有邊啲貧困山區需要幫助，我同一班志同道合朋友為數十人左右，我哋自己開車去到落後地方，咁多年嚟發覺原來唔係只有山區人好窮，好多住喺城市嘅人生活都好困難。」 有傳蓮妹有意出家，她否認其事，還笑說：「我家咪企喺你哋面前，我從來冇皈依，一直都係帶髮修行，我冇一個宗教，修嘅係唔想再輪迴，唔想做人係因為做人比較痛苦，只要深入諗清楚就會發覺有邊一個可以笑住咁終結，通常都係痛苦，我等嘅係上天意旨，我唔係生活得唔開心，相反我份人極之樂觀。」採訪、攝影：魯萍
20120505-104,20120505,104,鄧智偉重新編曲累事吳卓羲唱歌走音別怪他,鄧智偉重新編曲累事 吳卓羲唱歌走音別怪他 吳卓羲、林峯及黃宗澤等無綫一線小生，前晚傾巢而出力撐鄧智偉在九展舉行的音樂會。鄧智偉全晚表現沉默，沒有開金口獻唱，而久未獻唱的吳卓羲則表現失準，唱其代表作《別怪他》都走音，認真失威。 新一代無綫音樂總監鄧智偉前晚在九展舉行「平行回憶演唱會」，雖然有指門票滯銷，但前晚入座率達九成，並有一班無綫藝人王祖藍、李亞男、王君馨、梁靖琪及苗僑偉等撐場。吳卓羲、黃宗澤、鍾嘉欣及鄭欣宜等任表演嘉賓，並由許廷鏗打頭陣獻唱，林峯則壓軸出場，林峯說：「我當呢個係自己嘅騷，見證鄧智偉不斷努力做好音樂，好開心。」鄧智偉全晚表現沉默，沒開金口獻唱，只在台上感激一班歌手及方逸華和樂易玲兩位伯樂。 黃宗澤妖味濃 近年專注拍劇的吳卓羲，前晚唱出其代表作《別怪他》，但未知是否重新編曲，他明顯捉不到key，高音位還有點走音。他事後解釋：「可能戴咗耳機，聽唔到自己把聲，聽晚（今晚）會唱好啲。」問是否太耐冇唱歌？他尷尬說：「唔係，間中有去登台。」黃宗澤則以smokyeyes妖味妝容登場，並選唱女友胡杏兒的歌《幸而》，他笑說：「佢嚟唔到，我代佢唱，但實情係鄧智偉好鍾意杏兒呢首歌。」 昨日是黎耀祥48歲生日，其太太和囝囝前晚特別到場欣賞他演出。祥仔與古巨基合唱《義海豪情》，基仔更把該曲歌詞改成生日歌，又送上蛋糕。 欣宜有新歡錫 另外，欣宜被問前男友Mark和新歡韓模Jin同場拒合照，她說：「呢個係人哋嘅騷，喺度講有啲尷尬。」有指Mark已有新女友，她說：「呢排冇聯絡，係就恭喜佢。」問欣宜是否與Jin拍拖？她說：「朋友啫，好多男女朋友都好錫我。」 採訪：文國駿 攝影：黃文偉
20120505-105,20120505,105,趙雅芝兒子擬簽無綫,趙雅芝兒子擬簽無綫 趙雅芝與黃錦燊的兒子黃愷傑今年已24歲，這位星二代長得高大靚仔，目前在北京電影學院半工讀，並已加入娛樂圈，早前更在內地拍完一套以全部新人演出的劇集。 與女友感情好 最近黃愷傑的一張生活照曝光，相中他拿着甜品微笑，一雙粗眉明顯遺傳自父親黃錦燊，外形俊朗極具幕前發展潛質。 近年黃愷傑也頻頻出席社交活動，早前更表示有興趣簽約無綫在港發展，他與女友劉凱茵拍拖五年，兩人經常拍拖出席活動。劉凱茵雖是上班族，但其漂亮外表絕不輸給其他女星，據知她和趙雅芝感情甚好，更是趙雅芝欽點的新抱。 撰文：林妃
20120505-106,20120505,106,杜汶澤怪病有望痊癒,杜汶澤怪病有望痊癒 杜汶澤早前感染罕見怪病「米勒費雪症候群」，此病會令患者雙目現重影、手腳麻痹兼頭暈氣喘，最壞情況是四肢癱瘓、呼吸困難、甚至窒息死亡，故阿澤已停工休息，連日來留家打坐休養。 阿澤老婆田蕊妮昨在微博宣佈好消息，她透露美國回來的驗血報告證實阿澤只屬輕微病患者，有問題抗體的濃度低過20個百分點，她說：「重病輕患，我感到十分欣慰！醫生說只要這兩個月內他接受適當的治療，好好休息，不要操勞，便可以完全康復！謝謝各界在這段時間的關心和鼓勵，令我和杜先生感到人間有情，無言感激！祝願大家身體健康！」不少好友均留言送上祝福。撰文：丁寧
20120505-107,20120505,107,患糖尿廿多年驚死盧海鵬教蘇杏璇忍口,患糖尿廿多年驚死 盧海鵬教蘇杏璇忍口 盧海鵬榮獲今屆金像獎最佳男配角，所有人都替他開心，連多年前跟鵬哥狗咬狗骨的大白鯊林建明都幫他慶功。前晚一班EYT舊同事在尖沙嘴為鵬哥搞慶祝會，患了糖尿病廿多年的鵬哥，盼有機會與蘇杏璇分享抗病心得，最重要是控制飲食。 多年來EYT藝員一直感情要好，盧海鵬憑《奪命金》勇奪金像獎最佳男配角後，一班舊同事麥景婷、吳麗珠、廖啟智、陳敏兒、黃日華、廖安麗等齊齊幫鵬哥慶祝，連跟鵬哥針鋒相對多年的大姐明林建明亦有出席，她不忘在慶功宴上寸鵬哥說：「嘩！今餐唔係佢請咩？乜咁cheap㗎！」 余慕蓮送吻被胸襲 在大合照時，余慕蓮被安排坐在鵬哥身邊，大姐明硬推余慕蓮吻賀鵬哥，混亂期間，鵬哥疑一度慌張出手觸碰到余慕蓮胸部，停留幾秒仍不自覺，余慕蓮面露尷尬神色，最後只肯作狀扮咀。 談到慶功宴浪接浪，鵬哥說：「都慶祝咗好多次，屋企人呀！珠海拍電影嗰度，仲有呢班EYT，慶鬼咁多次。」鵬哥表示現在拍戲是玩票性質，亦不會加價。 獲頒最佳女配角的蘇杏璇，因糖尿病要鋸趾，鵬哥說：「我喺之前宣傳見過佢，見佢好瘦，以為佢其他事，不過，之後有機會都會同佢傾下，我87年已經有糖尿，到家廿幾年，食嘢係要自己控制，保持血糖低，你睇阿肥（沈殿霞）同董驃都係糖尿引起，所以飲食一定要注意。」 對於有指鵬哥帶新女去嘆茶餐廳，他反問記者說：「係咪影到我個女呀？我冇睇，有時喺某餐廳會有人自己埋嚟，我都冇辦法，唉！呢啲小事，就算係都翻唔起乜嘢船浪。」 採訪：楊潔雯 攝影：仇志德
20120505-108,20120505,108,JaniceMan剩女習慣孤單,JaniceMan剩女習慣孤單 文詠珊（JaniceMan）、林一峰、AliceB.等前晚在銅鑼灣出席一間家居精品店的開幕活動，JaniceMan透露已與男友分手幾個月，現正習慣一個人生活，她說：「以前鍾意熱鬧，家反而享受獨自喺屋企嘅感覺，有時會煮嘢食同整蛋糕，仲會聽書（睇書）同睇歌（聽歌）。」 恃青春慢慢等 問到可擔心變成剩女？JaniceMan說：「我仍然好享受拍拖生活，但家仲後生，可以『剩』吓，當然太長時間都驚，自己係會心急，但會慢慢等Mr.Right出現。」 對於黃耀明早前公開承認是同性戀者，林一峰說：「我早前喺微博都公開講過，我覺得明哥做人光明磊落，會以佢為傲。」他強調在香港沒有被人歧視，問到可會與明哥齊為同性戀者爭取權益？他說：「家係咪要爭取言論自由先呢？但明哥開到聲我一定幫手。」 採訪、攝影：李珮洳
20120505-109,20120505,109,明哥新歡曝光擬投訴,明哥新歡曝光擬投訴 林嘉欣和黃耀明昨在荃灣出席「公平貿易週2012」活動，嘉欣大讚明哥公開承認是同性戀者好勇敢。母親節將至，嘉欣說已預訂花束送給在加拿大的母親，希望老公會代囡囡為她慶祝：「囡囡得18個月大，應該唔識，我諗老公會預時間同我食飯。」她直言現在無時無刻都掛住囡囡，並只會參與有意義的活動。 另外，對於新歡曝光，明哥說：「唔應該將人哋嘅真實資料登出嚟，考慮去私隱專員公署投訴，家男女朋友都怕晒我。」明哥直言要減少時間出街拍拖，問有沒有同性戀組織找他宣傳？他說：「有個反恐懼同性戀嘅活動邀請我，希望時間配合到，我嘅舉動其實係想推廣訊息，唔係做娛樂新聞。」 採訪、攝影：楊潔雯
20120505-110,20120505,110,太極七子重溫君如第一次,太極七子重溫君如第一次 太極樂隊前晚在紅館開騷，任表演嘉賓的包括林子祥、譚詠麟、許志安及草蜢等，太極七子以電單車手look出場，有七年沒返香港的主音之一雷有曜亦回港力撐好兄弟，結他手鄧建明更安排兒子上台表演非洲鼓。 性感女伴舞 太極在台上演繹多首歌曲，亦有嘉賓與他們合唱，其中阿倫甩嘴演繹《頂天立地》。太極表演時，有幾名穿bratop的女舞蹈員貼身為眾人伴舞兼撫摸他們。現場又播放由吳君如處女下海拍攝的《紅色跑車》MV，由於當時君如以濃妝艷抹登場，令台下觀眾爆笑，君如更拍下片段自嘲說：「睇番個MV係我嘅童年陰影，個妝太濃，仲以為拍雪姑七友，點知原來係美女與野獸。」由於個唱反應理想，太極在台上預告將會舉行演唱會Part2。 另外，阿Lam獲厚待打頭陣出場，阿Lam說：「好鍾意同太極唱歌，佢哋夠大聲，我聾嘛。」而阿Lam兒子林德信日前在銅鑼灣被發現與一名auntie嘆茶，原來該女士是其母親吳正元。 採訪：胡比 攝影：仇志德
20120505-111,20120505,111,林德信向長輩介紹女友,林德信向長輩介紹女友 林子祥兒子林德信（Alex)和吳雨霏（Kary）的緋聞傳了多時，雖然兩人曾約會睇騷，但卻死口不認戀情，前日傍晚6時，Alex單拖到銅鑼灣喜喜冰室會合兩位auntie及另一男友人，期間Alex與他們全程以英語對話，其中一名50多歲的auntie對Alex十分痛錫，更親暱地摸他的額頭。 首觀升旗禮 傾得投契之際，Alex拿出手機展示內裏的照片，並以英語表示是他的女朋友，兩名auntie大讚相片女仔很靚及cute，未知所指是否Kary。四人在餐廳內有講有笑，接近晚上七時才埋單離開。 此外，自小在外國長大的Alex昨日出席「香港各界青少年慶回歸15週年系列活動啟動禮」，他表示第一次在灣仔金紫荊廣場觀看升旗儀式：「我都係返嚟香港兩年，其實好多地方都未去過。」 採訪、攝影：梁繼光
