key,date,article_daily_id,title,text
20120820-213,20120820,213,熔盛拍板　中止購全柴,熔盛拍板　中止購全柴 【本報訊】歐債危機加上業務發展或難於融合，熔盛重工（1101）於上周向中證監提交申請撤回批准購買全柴集團的全部股權的申請，雙方會繼續就處理交易事項的善後事宜進行協商。 曾斥22億奪標 A股全柴動力發出公告，指接到江蘇熔盛重工有限公司《關於全柴集團100%股權轉讓交易進展函》。函件稱：鑑於歐債危機造成的全球金融危機越演越烈，市場已發生根本變化，根據《產權交易合同》的約定和全柴動力歷次公告內容以及中國現有的法律規定，經協商，熔盛重工8月17日已向證監會申請撤回「向全柴動力除全柴集團之外的全體股東發出收購股份的要約的行政許可申請材料」。 目前，雙方正積極協商後續方案及事宜。去年4月，熔盛重工以21.5億元（人民幣．下同）的投標價購得安徽省全椒縣政府持有的全柴集團100%股權，因此觸發向除全柴集團之外的全柴動力全體股東發出全面收購股份的要約。期間市場多次傳出收購不成，但熔盛重工一直未有回應，至上周始作出了斷。
20120820-214,20120820,214,太保產險償付能力降,太保產險償付能力降 【本報訊】中國太保（2601）上半年財產保險業務償付能力充足率較去年底大跌39個百分點至194%，董事長高國富解釋，主因業務擴張所致，但該比率仍高於中保監要求，惟在有需要時會向產險業務增資。 拒回應會否集資 上半年集團整體償付能力充足率跌至271%，較去年底跌13個百分點，高國富指出，集團正就中保監提出的政策，研究滾動式三年資本規劃，未來會平衡壽險、產險及新增產品的資本需求，但他未有回應是否有進一步集資計劃。 太保旗下產險綜合成本率上半年升3.1個百分點至94.2%，太平洋財產保險董事長兼總經理吳宗敏表示，主因去年底至今新車銷售放緩，同業價格競爭升溫，加上業務成本上升，以及車險理賠增加所致，預期下半年該比率仍有持續上升勢頭，但相信升幅較緩慢。 美銀美林預計，下半年內地復蘇步伐緩慢，加上上半年減值準備較預期多，故將太保全年新業務價值增長預測由8.5%降至7%，純利預測亦下調17.7%，目標價29.8元；但由於其資本狀況較同業強勁，增長前景亦較佳，故太保仍為該行首選。 太保昨收報24.9元，跌1.2%。
20120820-215,20120820,215,國策透視：裁員潮有席捲全國之勢 - 郭小民,國策透視：裁員潮有席捲全國之勢 - 郭小民 中國商務部上周公佈7月實際使用外資（FDI）金額為75.8億美元，創自2010年7月以來新低，也是年內第6個月出現負增長，數據再惹起市場關注外資是否逐步撤離中國。不過，中國對歐盟的出口額較去年同期大幅下跌16.2%的數據，更值擔憂是趨勢若不改，裁員潮難免殺至。 去年中國外貿還有20%增長，但今年上半年只剩下8%，據商務部發言人沈丹陽表示，主要原因就是全球經濟復蘇緩慢，最嚴重的地區就是歐洲。更令人憂慮的是，沈丹陽提到，對歐盟的出口不樂觀，雖然早在估計之中，但歐債危機進一步發展升級並趨於惡化、歐盟各國進口需求遽降，則超出很多專家的預期。 東北區浙江齊遭殃 歐債的黑洞難測，但亦可從民間活動中掌握脈搏，內地造船業大多數工人無工開已是不爭事實，就連東北地區最大的煤炭企業黑龍江龍煤礦業控股集團已經開始1.2萬人的裁員計劃，有中國電器之都稱號的浙江柳市鎮，據浙江省電器行業協會執行副會長黃忠平表示，過去數年的電器生意每年有20%至30%增長，今年則跌10%，柳市鎮上千家生產電器企業，從業員多達30萬人，生意淡薄令老闆面臨壓力不輕。據了解，全國大型家電零售商美的大連分行亦開始裁員。 除內地企業外，摩托羅拉移動向全球員工宣佈將裁員約4000人，而中國成為這次裁員的「重災區」，摩托羅拉移動要辭退內地1000位員工。 救經濟措施成效仍微 全球經濟復蘇緩慢，裁員並非只在中國發生，面對外貿形勢不樂觀，中國多次強調一方面將繼續落實國務院支持外貿穩增長的政策措施，特別是要幫助企業降低出口成本，改善貿易環境。另一方面是要繼續推動企業轉變發展方式和調整結構。在缺定單情況下，莫說調整結構未能即時解燃眉之急，幫助企業降低出口成本相信助力不大，看來谷基建又成為救經濟的主力，但要防地方債這「炸彈」仍未拆解又添「新彈」，以及類似鐵道部前部長劉志軍的貪腐情況重生。 郭小民
20120820-216,20120820,216,重農行料淨息差續跌,重農行料淨息差續跌 【本報訊】受內地利率市場化影響，重慶農村商業銀行（3618）第二季淨息差收益率急速收窄，這尚未顯著反映人行近兩次減息，行長譚遠勝表示，該行只有活期至1年期存款息率調升至基準利率的上限，相信對存款成本的影響將主要反映於明年上半年，預期今年下半年淨息差會再有所惡化，惟仍可高於去年的3.36厘水平。 譚遠勝強調，該行專注中小企貸款，議價能力較強，貸款生息率高於去年水平；而且全年料可保兩成貸款增幅，大部份貸息都不會下浮至低於基準利率，他相信可維持目前貸款收息率，來彌補減息對存款成本影響。上半年末淨息差收益率為3.5厘。 料保貸款增長兩成 截至6月底該行撥備覆蓋率大增37個百分點至302%，但他解釋，並非因見到壞賬惡化迹象，預期未來比率仍會提高，以抵禦宏觀環境變化而產生的不良貸款。他亦預期，不良貸款率至年底可實現低於1%，6月底為1.19%，主因民間借貸對中西部地區影響有限。期末核心資本充足率跌至12.6%，他強調，2014年底前靠保留盈利，該比率仍可達10.5%的資本要求，維持上市時3年內不集資的承諾。該行業績數據穩健，消除投資者部份疑慮，昨收報3.12元，升2.3%。
20120820-217,20120820,217,樓市外援日資足球隊入市　租東涌兩單位,樓市外援 日資足球隊入市　租東涌兩單位 住宅租務市場湧現「生力軍」，新季將參戰港甲的日資足球隊橫濱FC（香港），剛以月租共逾2萬元承租東涌藍天海岸兩個一房戶。 繼續覓租盤作宿舍 消息人士透露，橫濱FC（香港）承租藍天海岸3座高層G室，500方呎，月租1.05萬元，呎租21元。另一宗為1座中層H室，同為500方呎，月租1萬元，呎租20元。目前區內單位呎租由15至20元不等，故剛租出的兩個單位呎租俱屬市價水平。 橫濱FC（香港）前身為港甲球會標準流浪，在本球季起獲日本乙組聯賽球會FC橫濱注資並易名出賽。雖然新球會將以本地球員為骨幹，但將羅致外援，同時亦會委派部份日本職員留港，故需要在港物色住宅單位。消息人士指，該球會仍繼續物色東涌區內的一房或兩房細單位承租，料作為職員宿舍。不過，代理指，現時藍天海岸細單位放租盤源少，僅約10個。 以往亦曾出現球會承租住宅作宿舍，如08年加入甲組的天水圍飛馬（現稱太陽飛馬），在組軍時豪擲60萬元租用天水圍栢慧豪園全層共8個單位用作球員宿舍，並繳交一年租金。
20120820-218,20120820,218,加強監管銀行操縱Libor　英急補鑊,加強監管 銀行操縱Libor　英急補鑊 英國國會發表報告，促請監管當局收緊對銀行的監管，以及提高罰則，甚至建議當局有權力撤換出事銀行的高層，冀挽回公眾對銀行的信心。 自巴克萊有份參與操縱倫敦銀行同業拆息（Libor）的醜聞被揭後，英國議會財政部特別委員會發表特別報告。委員會主席AndrewTyrie表示：「操縱（Libor）此重要的指標利率已對英國的聲譽造成很大的打擊，公眾對銀行的信心亦跌至新低。所以在銀行如何營運及如何受監管雙方面，有急切改善的需要，以挽回公眾及市場的信心。」 FSA有權撤換銀行高層 報告促請英國金融服務局（FSA）要變得更加主動，對有風險的問題行動提高警覺。與此同時，委員會亦要求英倫銀行提高監管力度，指「該行應有權力撤換（出事）銀行的高層，但在行使此權力時，亦要顧及股東的利益。」 英國銀行家協會負責公佈的Libor，是金融機構之間拆借活動的主要指標，亦影響全球超過300萬億美元的證券市場。巴克萊銀行上月就操縱Libor，向英美監管當局支付4.52億美元罰款後，銀行前行政總裁戴蒙德（BobDiamond）隨即請辭。
20120820-219,20120820,219,中央護稀土擬擴資源稅,中央護稀土擬擴資源稅 【本報訊】據《中國證券報》報道，政府有關部門正研究擴大資源稅從價計徵範圍，從價計徵即按照應納稅資源產品銷售收入乘以規定的比例稅率徵稅，新稅制令稅率提高，助控過量開發，同時亦可增財政收入。業內人士稱，此舉主要是希望通過稅收方式加大對稀土資源保護力度。 擴大從價計徵範圍 根據2011年修訂的《中華人民共和國資源稅暫行條例》，稀土資源稅實行從量計徵的徵收方式，稅率為每噸0.4至60元（人民幣．下同）。以輕稀土為例，根據財政部、國稅總局文件規定，自2011年4月1日起，國家統一對輕稀土礦徵收資源稅每噸60元。自2011年11月1日起，油氣資源稅從價計徵開始在全國範圍實行。 有關部門對從價計徵範圍改革不斷探討中。財政部部長謝旭人於上月指，下半年將深化資源稅改革，擴大資源稅從價計徵範圍。工信部副部長蘇波於本月初指透露，將通過稅收方式提高對稀土資源保護力度，通過稅收調節市場。 興業證券有色行業分析師羅人淵表示，稀土資源稅改革，從國家層面來講，有助於對稀土行業加強管理，有利於保護資源。但是，從稀土行業來說，將會增加稀土行業開採成本。目前，稀土開採企業各項稅收大概要佔開採成本的40%，資源稅佔開採成本的比重大概在20%左右。今年前6個月，資源稅比去年同期增長68.3%。
20120820-220,20120820,220,合和連特別息派94仙,合和連特別息派94仙 【本報訊】合和系公佈截至6月底止全年度業績，合和實業（054）核心純利按年升10.96%至13.47億元，每股盈利4.15元，末期息減6.9%至54仙，為慶祝集團40周年，派特別息40仙，即共派94仙。 董事總經理胡文新認為，新政府不會拉低樓價，只會稍為打壓投機性炒賣活動防止泡沫，相信樓價由市場主導，但集團買地會更謹慎，未來亦只專注發展合和中心二期。截至本月中，旗下跑馬地豪宅樂天峰共售53個單位，期內入賬單位有15個，每呎售價約2.54萬元。與信置（083）合資的利東街項目，住宅部份照原定計劃明年上半年預售，定價會參考市價。 商業發展方面，胡文新說，集團主要物業所處灣仔區因建設不斷優化而獲得升值，料未來數年仍會保持租金增長。期內合和中心一期寫字樓新簽租約租金升19.35%至每方呎37元，零售舖租亦升5%，九龍灣展貿中心寫字樓新簽約租金則升22.45%至每方呎12元，零售舖租升13%，帶動集團租金收入升8.77%至7.07億元。 中港短期投資59億 他續稱，集團未來一年須為合和中心二期支付約37.26億元補地價費用，直到2015年前於中港兩地須投資約59.24億元，手持現金及未動用信貸額分別16.48億及56.2億元，暫無融資壓力。撇除補地價後，合和中心二期土地將有36億元資產值在未來數年內入賬，總數面面積亦會提升約三成。 合和基建（737）全年純利升0.49%至10.23億元，每股盈利34.55仙，末期息減11.11%至16仙。期內公路收入淨額升4.88%至23.86億元。受6月1日生效的新公路收費方案影響，廣深高速公路6月份日均收費下跌16.7%至900萬元人民幣，7月更跌至870萬元人民幣，胡文新表示，雖然假日免收路費會減少整體收入3%，但車流持續上升，料收費會在未來數月趨向穩定。
20120820-221,20120820,221,蘋果綠葉大唐半年純利增24%,蘋果綠葉 大唐半年純利增24% 大唐發電（991）公佈，上半年純利按年增長23.87%至11.54億元（人民幣．下同），主要受益於電價按年增加6.59%額外帶來20.26億元收入，以及水電和風電等清潔能源項目的利潤貢獻，其中次季賺7.02億元，按季大增81.1%。
20120820-222,20120820,222,港7月機場貨運量墜落,港7月機場貨運量墜落 【本報訊】香港國際機場7月份貨運量同比減1.6%至33.5萬公噸，雖然入口貨運量增長4%，但整體貨運量下跌，主要是由於出口貨運量同比減少4%，加上轉口貨運量下跌3%所致。機場管理局行政總裁許漢忠說在新聞稿中指，會密切留意貨運市場的最新情況。不過，轉口貨量跌多少與中國出口面對下行風險加大有關。 內地31個省區市上半年經濟資料全部「出爐」。資料顯示，除甘肅外，其餘30個省份經濟增長增速較去年同期出現明顯放緩。上半年，浙江與廣東在內的兩個出口大省加上北京與上海經濟增速低於全國水準，但與第一季度經濟增速相比，四省市的增速均出現了回升。 京滬經濟按季回升 第一季度北京和上海經濟增速僅為7%，而上半年北京和上海的經濟增速均回升0.2個百分點。第一季度廣東經濟增速僅為7.2%，而上半年增速7.4%，也回升了0.2個百分點。第一季度浙江經濟增速7.1%，而上半年增速7.4%，回升了0.3個百分點。北京市委書記郭金龍已表明，會以基建項目拉動經濟回升。
20120820-223,20120820,223,蘋果綠葉大成生化料盈轉虧,蘋果綠葉 大成生化料盈轉虧 大成生化（809）發盈警，預期上半年業績盈轉虧，主因原材料成本持續上漲，氨基酸產品售價於6月下滑，引致該月錄得虧損；集團因化工醇產品售價下跌而作減值虧損；集團就逾期已久的應收賬款計提呆壞賬撥備；加上其非全資附屬就牛肉零售業務計提撥備所致。公司正檢討有關業績會否影響去年5月發行的4.5億元人民幣債券，倘有違反財務契諾，公司將作適當補救。
20120820-224,20120820,224,樂香園：執完膠粒先好搞兩電 - 密西比,樂香園：執完膠粒先好搞兩電 - 密西比 連兩電利潤管制法則規定回報率也搞不清的環境局局長黃錦星，上任不夠兩個月，日前竟然「發官威」，要兩電十月中或之前提交明年加價建議，更要求兩電要照顧各階層感受，完全將加電費責任推得一乾二淨。 現時兩電9.99%規定回報，是政府與兩電均同意並在08年所簽訂，由於當年是由15%調低至9.99%，政府即時出來「攞威」，指成功爭取減電費。不過，當時很多學者已警告，由於沒有更改燃料轉嫁的計法，電費只會繼續上升。 達成協議後，兩電僅減了一次電費，其後就算經濟欠佳，就算兩電資本開支沒有大升，就是因為燃料可悉數轉嫁，電費每年仍是「步步高升」。 電費年年加，相信除了兩電是沒有人希望見到的，但大家要知道，導致現時境況，政府責任不比兩電少。如果當年「企硬」不讓兩電悉數轉嫁燃料費，電費加幅就可大大降低。又如果加入一定的更改彈性，現在便不用大打「民意牌」。 黃局長，不如先做好回收膠粒工作，向中石化拿清潔費及賠償，才再想清楚，有甚麼理據要求兩電降低電費加幅吧！ 密西比
20120820-225,20120820,225,蘋果綠葉憧憬賣盤　鎮科曾升77%,蘋果綠葉 憧憬賣盤　鎮科曾升77% 鎮科珠寶創辦人吳鎮科旗下鎮科集團（859）股價昨午後初段最多暴升77%，高見0.85元，收市仍升45.8%，報0.7元。市場昨流傳鎮科創辦人兼主席吳鎮科近日因重病入院，觸發公司賣盤的憧憬。就吳鎮科入院傳閒，集團發言人林小姐向《爽報》表示不予置評，公司昨亦發佈不明股價升因的公告。
20120820-226,20120820,226,鐵礦石牛市已逝　贏變輸中信泰富錯過黃金三年,鐵礦石牛市已逝　贏變輸 中信泰富錯過黃金三年 【特稿】2006年購入西澳洲磁鐵礦的中信泰富（267），自此被「寃鬼」纏身。這隻「寃鬼」不但需要源源不斷的「水喉」，更令中信泰富烙下炒燶外滙的疤痕，而投產日期七度押後亦使公司飽受折磨。假若當初找到治「鬼」良方，鐵礦如期在09年初投產，中信泰富便可「食盡」過去三年鐵礦石的升浪，成為獨當一面的礦企。 記者：陳韻妍 拖拉近四年，鐵礦七度延期投產，中信泰富錯過了過去三年的鐵礦石牛市，損失不菲。以中信泰富鐵礦年設計產能2400萬噸，過去三年鐵礦石平均價143.66美元計算，七度延期令公司損失的收入約103.44億美元（約806.8億港元）。 實際損失料逾800億 中央08年底推出4萬億元人民幣救市措施，拉動基建振興經濟，令鋼鐵等工業原材料需求大增，造就商品市場之後三年的黃金檔期。由於中國缺乏優質鐵礦石煉鋼，需要倚賴外國進口，遂推動鐵礦石價格上揚。09年初鐵礦石每噸約70美元，供不應求的矛盾推動價格不斷上漲，去年初曾高見190美元，礦商個個賺到盆滿缽滿。 由於鐵礦石過去幾年價格高企，遂吸引不少企業投資開採鐵礦，意味未來數年將有大量新產能釋放，鐵礦石在供過於求的預期下，未來價格料難復當年「勇」，現時價格已回落至約120美元，故中信泰富的實際損失分分鐘超過上述估計的103.44億美元。 中信泰富等待鐵礦投產的同時，鋼鐵業環境亦由榮轉衰，主席常振明上周便指，現時特鋼市場的環境是十年來最差。公司最初收購鐵礦，便是想為下游的特鋼業務提供穩定而充足的上游礦石，可惜如今鋼鐵市場面對產能過剩及微利潤的雙重打擊，即使鐵礦最終在11月投產，銷情將不如09年。 構成龐大財政壓力 07年中信泰富揀選中國中冶（1618）為鐵礦的總承包商，總開支預算約25億美元。其後澳元升值令成本急漲，加上欠缺經驗低估建設難度，中信泰富須不斷向鐵礦「泵水」，截至今年6月總開支已飆升至78億美元（約608億港元），對公司構成龐大的財政壓力。 人算不如天算，倘鐵礦按照原訂日期09年初投產，中信泰富便不用承受澳元升值引發成本暴漲的風險，更不會墮進鐵礦所掀起的「無底深潭」。
20120820-227,20120820,227,競爭力弱內房難兼顧　齋食老本,競爭力弱 內房難兼顧　齋食老本 中信泰富（267）藉鐵礦更上一層樓的如意算盤不但打不響，更因資源集中在鐵礦項目，導致其餘兩項核心業務特鋼及房地產的發展停滯不前，本港房地產業務更呈「半退出」狀態。現時中信泰富在內地的土地儲備大都是五至六年前買入的，故現時只在「食老本」，未來恐難與其他手擁多塊靚地的內房企業比拼。 由於去年交付兩座位於陸家嘴的辦公大樓，導致基數較高，故今年上半年房地產溢利大減，內地房地產的溢利按年跌67.8%至5.49億元，但即使不計及有關因素，有關業務表現仍遠不及去年。主席常振明坦言，「由於全力投入澳礦建設，中信泰富將近五、六年沒有拿新地」，「今明兩年在房產方面都很謹慎」，只在現有土地進行開發。 錯失「攻城掠地」良機 2009至2011年上半年，是內地樓市的黃金時期，中央08年底推出的4萬億元人民幣救市政策一時間帶旺整個內地樓市，樓價飛漲，地王不斷呈現，可惜中信泰富因發展澳礦而錯失「攻城掠地」的良機。 近年中央決意整頓樓市，出「重拳」打壓樓價，未在樓市輝煌期嚐過「大甜頭」的中信泰富卻要與其他內房企業齊受宏調之苦。常振明指，上海青浦和江蘇無錫兩個住宅項目上半年銷售較緩慢，預計下半年樓市仍充滿挑戰，公司只能消極地靠適應政策去應付。
20120820-228,20120820,228,蘋果綠葉中旅半年少賺7.7%,蘋果綠葉 中旅半年少賺7.7% 香港中旅（308）公佈，上半年純利倒退7.68%至3.3億元，核心純利則跌1%至2.94億元，每股盈利5.81仙，中期息維持2仙。期內收入升6.56%，受證件簽注費用下調，旅行社利潤跌6%至8185.6萬元，酒店業務則受惠市道暢旺帶動出租率及租金上升，利潤增16%至1.26億元。
20120820-229,20120820,229,蘋果綠葉和黃旗下大馬港口擬上市,蘋果綠葉 和黃旗下大馬港口擬上市 外電報道，和黃（013）旗下和黃港口持股31.5%的馬來西亞港口公司WestportsMalaysia有意於當地公開招股上市，集資10億美元（約78億港元），預期今年底至明年初進行。
20120820-230,20120820,230,股價插水淪為唯一「垃圾級」藍籌,股價插水 淪為唯一「垃圾級」藍籌 曾幾何時，中信泰富（267）是散戶的收息愛股，股價更曾一度高達50元，然而隨着市場對磁鐵礦項目的「幻想」破滅，加上炒燶澳元風波，股價跌至目前的11元，評級機構標準普爾更將其信貸評級降至「垃圾」級別，令中信泰富成為唯一的「垃圾級」恒指成分股。 標普降級至BB+ 自收購鐵礦後，大行一致唱好，公司股價亦由20多元飆升至50.45元，但08年爆出炒燶外滙醜聞，股價立即「插水」，更曾低見個位數字。及後股價雖回到雙位數，但面對鐵礦開支不斷增加及投產日期不斷延期的壓力下，股價與昔日水平仍有一段距離。中信泰富上周五收報11.18元，今年至今累跌兩成。 由於鐵礦前景充斥不明朗因素，標普去年7月將中信泰富的長期企業信用評級由「BBB-」下調至「BB+」，企業展望仍為「負面」，令其成為唯一「垃圾」級別的藍籌。穆迪則維其Ba1的評級，為投資級別中最低級。
20120820-231,20120820,231,中環在線：奶月沽清　半島登報耍冧 - 李華華,中環在線：奶月沽清　半島登報耍冧 - 李華華 賣月餅賣到警察到場調停，仲要因為一粒鐘火速售罄而登報道歉，真係只有半島酒店嘉麟樓嘅奶黃月餅先會搞成咁。撞啱經營半島酒店嘅大酒店（045）星期三公佈業績，睇怕行政總裁郭敬文除咗要睇熟盤數，仲要諗定點樣解釋月餅呢單嘢！ 嘉麟樓奶黃月餅查實已經賣咗26年，好多企業同本地富豪每年都一百幾十盒咁訂嚟送禮，近年越嚟越紅，唔知同自由行有冇關，事關買嚟送禮除咗顯示花得起，仲係有味品嘅表現。 月餅前身係奶皇包 聽講製作嘉麟樓奶黃月餅嘅葉永華師傅，亦係嘉麟樓嘅開國功臣之一，嘉麟樓1986年開業佢已經入職，主要負責點心製作。當年月餅主要用蓮蓉做餡，但葉師傅發現食客好鍾意奶黃包，中秋將至，佢就忽發奇想，試吓用奶黃做月餅餡，第一年只係做咗2000盒，做到今年係6.5萬盒。 葉師傅今年已經預多咗產量，原本諗住可以預留一批，畀8至9月去嘉麟樓食中秋晚市套餐（每位888大元，至少4位）嘅食客，每枱送番一盒奶黃月餅，點知上星期四開賣一粒鐘賣晒，呢個送月餅優惠即刻煞停，換言之，今年買唔到嘅粉絲真係要明年請早嘞。 李華華 mailto:LiWaWa@AppleDaily.com
