key,date,article_daily_id,title,text
20120820-0,20120820,0,中央軟弱　怒火焚28市,"中央軟弱　怒火焚28市 釣島風雲 《蘋果》記者深圳、廣州直擊 【本報訊】因香港保釣勇士登陸釣魚台被日本粗暴拘押並遣返誘發的反日怒潮，如期爆發，席捲全國，昨日至少28個大中城市有反日示威遊行，部份城市更演變成「義和團式」暴力事件，示威者打砸日本產汽車、攻擊日資商場店舖。當局戒備森嚴，卻視若無睹，聽之任之，其中以深圳為最。這是繼2005年及2010年後，內地再度爆發全國性大規模反日示威。 記者：林熊、司徒韋桐 深圳反日示威昨日上午開始，約3,000民眾響應網上號召，於10時左右陸續聚集華強北賽格廣場前，中午12時許起程遊行。他們打出「保衞釣魚島」、「振興中華，人人有責」等橫額，高唱國歌，呼喊反日口號，從賽格廣場經人民廣場向深圳火車站進發，沿途吸引大批民眾加入。當局派出大批公安和防暴警沿途戒備，天上還有兩架警用直升機盤旋監控。 示威者「逢日必毀」 因警方封鎖深南東路東行三條行線車，數以萬計示威人龍大受局限，到人民南路與和平路交界處時，當局更設路障阻繼續前進，示威者情緒越發高漲，反日口號夾雜着對當局指摘，部份人怒吼「抗議政府不作為」，先推倒路障，繼而掀翻一輛日本產公安車，示威者跳上車肚揮動國旗，從而點燃眾人不滿情緒，揭開「逢日必毀」序幕。 示威者衝擊嘉賓路友誼商場日式鐵板燒，及東門小型日本料理店，砸碎幕門玻璃，衝入店內趕走客人及店員，繼而沿深南東路大肆破壞，掀翻二、三十輛日本房車，包括兩輛警車；還闖進一個露天停車場將場內日本車全數「反轉肚」。大批公安在場但視若無睹。軍警列成人牆將遊行人龍引入深圳體育館，部份示威者在場外繼續起哄，被警方拖走。下午4時．當局清場驅走其他示威者。 除深圳外，內地昨日至少還有26個大中城市有反日示威。廣州數百人到日本領事館外示威，焚燒日本旗；浙江義烏示威者打砸日本車；杭州一個日本電器專賣店遭示威者攻擊，店中玻璃全被砸碎；成都春熙路日資伊藤店被遊行隊伍圍攻；北京、上海也有市民到日本駐當地使領館示威，但過程和平；珠海昨也有數十人到日資吉之島店外示威。 駭人標語對日宣戰 繼西安示威者前日打出「那怕華廈遍地墳，也要殺光日本人，寧可大陸不長草，也要收復釣魚島」駭人標語後，昨日長沙示威者打出「踢除腐敗、重振政府、驅逐日虜、收復琉球」標語；山東濟寧示威者打出「黑心城管又出人命，喪盡天良」橫額，反日示威變針對中共當局。也有多個城市示威者打出「釣魚島是中國的，蒼井空是世界的」，令人忍俊不禁。 山東濟南、煙台、滕州、濟寧等城市反日示威，均打出要求中國軍方出兵收復釣魚台的橫幅；滕州示威者更用粗口當標語：「鬼子搶我釣魚島，我操鬼子親娘」、「廢了日本雜碎」等。有示威者打出「立即與日本斷交，對日宣戰，使用核武，攻擊東京」，令人見之毛骨悚然。"
20120820-1,20120820,1,生路變車位　領匯房署罔顧人命,"生路變車位　領匯房署罔顧人命 【本報訊】領匯、房署為賺到盡，竟罔顧巿民安全，知法犯法違規改裝公共屋邨消防通道，用作月租車位出租。《蘋果》連日到全港多個屋邨巡視，發現六個公屋共改裝了107個非法車位，年賺逾150萬元，其中四處屬領匯管理。有議員炮轟：「咁樣唔止搶錢，仲罔顧人命！」 記者：馮詩媚　周子惇 六個劃出非法車位的公屋，分別為領匯管理的沙田沙角邨、黃大仙竹園南邨、牛池灣彩雲邨、柴灣小西灣邨，以及房署轄下深水埗白田邨和葵涌石籬邨。就記者所見，所有非法車位均設在豎立「不准阻塞」及「禁止泊車」標誌的消防通道上。當中的月租貨車位，租金由1,500元至2,100元不等，而私家車位月租費用則約為1,500元，另電單車位最平的僅270元，實為大小通吃。 車位設在彎位阻救援 消防處發言人表示，據《消防（消除火警危險）規例》供緊急車輛使用及操作的通道至少須有6米闊，若只供緊急車輛通過亦最少要4.5米闊。若違反規定，最高罰款港幣10萬元，另加每日罰款10,000元。 記者深入調查，發現最令人驚訝的是沙角邨，邨內唯一消防通道，竟公然劃出共33個貨車和私家車位，並劃上月租車位號碼及車牌。而整條通道都豎立「不准阻塞」之消防緊急通道指示牌及「禁止泊車」標誌，但泊滿車後，剩餘可供行車的通道只得5米闊，比消防規定尚欠1米。部份車位更設在彎位上，當有大貨車經過時，場面驚險萬分。 「喺呢個『禁止泊車』路牌之後所泊嘅車，已經係違反交通條例。我哋所見嘅車位都係違法，對租用者嚟講係陷阱！」香港汽車工業學會會長李耀培到現場視察後，炮轟有關當局做法不當，應盡快將車位回復為行車路，要以市民生命安全為大前提。他直斥：「喺消防通道轉彎位設置泊車位會影響消防救援，對居民、泊車人士同道路使用者會存在危險，呢個位置唔應該設立車位，如果遇事消防未能於最接近火場求援。」 房署聲稱有參閱條例 港島東的小西灣邨一期，唯一進入商場的車路前，亦標明為「禁止泊車」緊急通道，由迴旋處到商場卻劃有22個電單車位，令必須駛往商場落貨的大型車輛只好反方向駛入，貨車司機張生說：「迴旋處根本轉唔到彎好危險，條路本身唔夠闊，泊埋車一定會撞。」 而彩雲邨的行車通道兩旁及門外，也劃滿供貨車及私家車停泊的非法車位，令行車通道減至僅4.5米空間，若有發生火警，救援車輛根本無法靠近大廈。 石籬二邨在十與十一座的中轉屋之間，汽車入口閘欄明顯掛上「消防通道，只供緊急車輛使用」的標語，進入後卻劃有十多個車位，而私家車位闊度僅5呎，細得離奇。竹園南邨情況亦相若，在消防通道出租12個非法電單車位；但最離譜是，房署在白田邨狹窄通道勉強劃出四個貨車位出租，以收取每月共6,200元租金。 領匯發言人表示，沙角邨等四個屋邨的車位自05年從房委會購入資產時經已存在，其後並沒有增減。 而道路的業權則不屬於領匯。房屋署新聞組則表示，房委會在規劃轄下的泊車位時，均會參閱相關的消防及交通條例。 六屋邨涉違法改車位情況 1)沙角邨 15個貨車位x月租$2,100	=$31,500 18個私家車位x月租$1,250=$22,500 月租合共：$54,000 2)小西灣邨 6個貨車位x月租$2,150	=$12,900 22個電單車位x月租$380	=$8,360 月租合共：$21,260 3)石籬邨 10個私家車位x月租$1,420=$14,200 6個電單車位x月租$270	=$1,620 月租合共：$15,820 4)白田邨 4個貨車位x月租$1,550	=$6,200 月租合共：$6,200 5)彩雲邨 10個貨車位x月租$1,800	=$18,000 4個私家車位x月租$1,600=$6,400 月租合共：$24,400 6)竹園南邨 12個電單車位x月租$380	=$4,560 月租合共：$4,560 六屋邨107個車位，月租共$126,240，年賺$1,514,880 居民心聲"
20120820-2,20120820,2,三貴利搶錢　借$10000得$1000事主報警　差人懶理：都未強姦你個女,"三貴利搶錢　借$10000得$1000 事主報警　差人懶理：都未強姦你個女 【本報訊】三間公司涉嫌串謀引市民借錢後「㩒住嚟搶」。有市民借10,000元，扣除所有「費用」後，實得僅1,000元！本報調查發現，涉案財務公司並無放債人牌照。不過，當事主無助地走到警署舉報時，警員竟說「佢都未強姦你個女」，更叫事主「搵黑社會同佢哋傾」。 慘被屈錢的李先生（化名），42歲，5月11日從報章上看到「百利達財務按揭」的廣告，「我諗住佢有四間公司，應該唔會假啩！」遂到其觀塘辦公室借貸一萬元，職員要求他在表格上詳列父母、配偶、子女及兄弟姊妹的資料，包括工作和住所地址、電話。 拒貸款反遭恐嚇 百利達即場向李先生收取600元手續費，「我問過係咪借一萬蚊攞一萬蚊走，佢話係；問佢有冇額外手續費，佢哋又話冇，我先借！」李先生說，當他付錢後，百利達拒發收據或任何證明文件，更指財務總監不在公司，要求他到旺角金雞廣場一單位領取貸款。 「去到原來間公司名唔同咗，叫富高！」李先生指，富高稱需收取1,000元手續費及5,000元擔保人費用，「我梗係唔借啦，咪走囉，但佢哋話走都要畀1,000蚊㗎！」其後兩名職員游說他，一個施軟功，「另一個就話知我老婆同個女喺邊度做、我老媽子住邊度，即係恐嚇我……」 李先生就範後，被「押」到另一單位的英倫財務有限公司，簽署借貸合約及取得一萬元支票。富高人員再「押」他到銀行提取現金，即場拿走6,000元，「我話（扣除費用後實收）3,400唔好意頭」，對方就退回400元給李先生。隨後，李先生到觀塘警署報案，但警員說：「所有文件都係同英倫簽，富高冇文件，好難入到佢罪！」 據李先生與英倫簽署的還款協議，貸款額1萬元，年利率46%，分20星期清還，每周還款548元，如經銀行轉賬，則要還570元。約三個月後，本月初百利達及富高游說他再借一萬元，他拒絕後，本月10日被屈欠供款，要他付2,200元「追債費」及遲還（其實已還）的600元，合共2,800元。李先生指有銀行存摺證明已還款，但「佢哋講晒粗口乜都唔聽，又打電話騷擾我屋企人，話限我星期三（8月15日）4點半前要還2,800元，4點半後就還14,800元」。 最終須還$11400 李先生隨即到旺角警署報案，但當值的一名警員竟說：「人哋講粗口啫，都未至於強姦你個女！一係你搵黑社會同佢哋傾啦。」李先生事後怒斥：「我搵黑社會就唔使報警啦！」 警方發言人回應指，會跟進了解事件，如發現有警務人員違規，定必嚴肅處理；該案已列作糾紛處理。 李先生最終不勝煩擾，向老闆借錢交了2,800元，「我屋企人家驚到騰騰震！局住畀佢囉」。至今他仍要再還六期欠款。總括而言，李先生在扣除所有「費用」後，只獲得1,000元，卻要還款11,400元。"
20120820-3,20120820,3,兩地教材比較國民教育本港比深圳更洗腦,兩地教材比較 國民教育本港比深圳更洗腦 《反洗腦》 【本報訊】尚有半個月新學年便開始，國民教育科仍是社會各界的憂慮，當中由浸會大學當代中國研究所編製的《中國模式國情專題教學手冊》，更被家長、教師指是一本徹頭徹尾的「洗腦手冊」。那麼，這本手冊與內地同類教科書相比，結果又如何？《蘋果》記者在多名深圳中小學教師的推薦下，找來三本內地小學、初中及高中採用的教學參考書，交給學民思潮黃之鋒及兩名教育界人士閱讀，撰文闡述兩者分別。記者：林熊　司徒韋桐 深圳版：未見批評西方民主 香港版：肉麻骨痹讚共產黨 陳士齊（浸大宗教及哲學系高級講師） 一般論者都會以為，中國大陸社會本身，長期以來深受「惡質愛國主義教育」之苦。論者更會以近期奧運鬧出的種種笑話作為事例，如將華僑藝人當為中國人來看待，強制要求名人在劉翔奧運「災難」後，有「及格」的情感表現等。但教育這方面的國情究竟如何？ 愛國主義限於經濟 最近得見中國大陸高小及高中的公民教育教科書，實在教港人大開眼界！這兩本教科書在愛國課題上的洗腦程度，竟然大大不及浸會大學當代中國研究所撰寫的《中國模式國情專題教學手冊》！ 中國輕工業出版社的《小學品格教育主題活動設計》，第一章確實關於愛國，而內容也流於唱、繪、讀、觀、展「紅」，但此後給小五小六同學讀的十四章，卻是有關誠信、分享、負責、感恩、合作、廉潔、樂觀、寬容、認真、善良、正直，勇敢、自信、尊重！ 至於南方出版社的《高中優秀教案》十二課，絕大部份是在生活消費、生產經營、收入分配、發展經濟四大單元底下開展討論，內容只有到第四單元「發展社會主義市場經濟」，才開始滲入愛國主義，而且都限於與經濟有關的愛國主義，未有偏頗到如浸大《國教手冊》一面倒歌頌中國共產黨是「進步、無私與團結的執政集團」如此肉麻骨痹；也未見扭曲批評西方民主政制為「政黨惡鬥，人民當災」！ 內地推行不敢過態 如此比較之下，筆者得出如下初步結論：中國共產黨對自己在大陸人民心中的受歡迎程度，心中有數；因此推行愛國主義教育也不敢太過態，以免弄巧反拙；反而特區政府為求表忠，推行愛國主義教育，便只會不顧一切，倒行逆施，完全是小丑表功秀。其愚蠢程度，活像狂吞了百噸膠粒的狀態。至於中國網民奧運期間為何會表現如斯糊塗的大中國沙文主義，那便只有另覓分析了。 深圳版：愛國容許不同情感 香港版：愛國要建基於自豪 黃之鋒（學民思潮召集人） 看畢《小學品格教育主題活動設計》一書後，真的讓我大開眼界。大開眼界的不是這本內地課程教案如何離譜，而是香港的國民教育科程內容，真的「沒有最洗腦，只有更洗腦」。 當香港的國民教育課程指引，清楚列明「課程要求學生培養建立愛國情懷，建立一種對國家自豪感」，將愛國假定為「建立一種對國家的自豪感」，國民教育科更以此為評估標準，可說是一種情感操縱，強求學生在了解國情時以「對國家會否自豪」，實在是強詞奪理。 可以表達憤慨 當《小學品格教育主題活動設計》教導學生學習愛國時，所提供的定義如下：「對自己祖國的一種深厚感情。」當內地的國民教育尚容許學生有對國家正面和負面的情感，如一名中國公民可以對國家表達驕傲和感恩之情，也可以表達對中國現況的不滿和憤慨，但內地的國民教育指引也同樣表示這是一種「愛國」的表現。 除此以外，書中指出愛國主義的內容是「熱愛祖國、熱愛人民、熱愛祖國文化環境……」，並沒有提到如香港國民教育課程指引所提及的「在升國旗時要表達你對祖國的自豪情感」，愛國不應建基於一些象徵性的物品，而是應該建基於該國的人與事。 固然內地的國民教育課程教案也存有不少問題，如課堂上老師教授學生了解祖國的自然環境時，書中建議老師在總結時表示：「歷史的車輪滾滾向前，隨着社會的進步，科技的發展，祖國的騰飛，家鄉將來一定會越來越美好」，我相信教師在課堂上對國家的任何陳述也必須建基於事實和論證過程，而不是一句：「祖國騰飛了！」就說了算。 總括而言，當內地的「愛國」尚且容許學生決定自身立場（即使實際國情絕不是如此），但香港那套卻開宗明義表示「了解國情必須以能否建立對國家自豪感為基礎」，我從來相信學生必須認識國情、了解國家，但絕不應該以這種情感操縱的形式去學習。 深圳版：感情轉化愛黨愛國 香港版：資料有限優化中共 李展華（教院國際教育與終身學習學系一級專任導師） 從內地的小學與高中的愛國教育課程看，內地的小學至高中愛國教育是越走越不開放，小學的愛國教育着重「小公民大智慧」，他們要求學生從愛家鄉的具體感情轉化為抽象的愛黨愛國；以致千人一面讚揚共產黨功績的紅色「教育」，傳統文化被作為必要的點綴；使人誤以為共產中國直線承傳了傳統文化。 而香港《中國模式》愛國教育看似開放，但因所提供的資料有限，令人感覺中國的共產黨是一個理想的模式，是優化了共產黨；學生在缺乏理性的學習基礎下，學生對共產黨不能夠有一個全面的認識；特別沒有將國內共產黨與人民的複雜關係交代清楚，學生難以了解真正的國情。 學敵我二分思想 若與大陸兩本思想品德教育的教學參考書比較，便難看到這種「人民觀」，究竟是大陸在隱瞞「真相」，抑或《中國模式》作者正想把在大陸已無人不知的「常識」大剌剌的向香港師生宣示，成為必須硬吞的「國情」呢？ 《中國模式》手冊看似列出其他「模式」讓學生作「批判比較」，但在資料極不足和偏頗的情況下，學生要在四教節中評價中國模式，究竟可以有甚麼理性文結論？ 想像一個活在多元開放的香港社會的高中生，要啟發他去理性了解中國的發展軌迹及問題，並探索身為中國公民如何獻身為建設一個更民主自由開放的中國而奮鬥時，他在《中國模式》學到的是更封閉的敵我二分思想，及對黨國體制之特點之認同以確認自己是人民一分子的順民而已嗎？ 【紅出沒注意】 如發現有學校、組織推行紅色洗腦教育，可向《蘋果》報料：mailto:adnews@appledaily.com
20120820-4,20120820,4,三公司涉無牌經營,三公司涉無牌經營 【本報訊】《蘋果》調查發現，事件中三間公司，事主李先生都以為是財務公司，但查實三間公司都沒有放債人牌照。市民可在網上查閱財務公司的牌照。 根據《放債人條例》，任何人無牌經營放債人業務，即屬違法，可被罰款10萬元及監禁2年。 兩間轉介貸款的公司百利達及富高，商業登記皆為「財務按揭顧問公司」，但百利達廣告卻省去「顧問公司」四字，令李先生以為是財務公司。 至於正式貸出款項的英倫財務有限公司，於2010年曾成功獲得放債人牌照，但自2011年起，其續牌申請已被駁回。據公司註冊處紀錄，英倫至今未獲放債人牌照。 放債人牌照可網上查閱 本港財務公司可分兩大類，一類是受金管局監管的金融機構，屬於少數，名單列於金管局網頁（ http://vpr.hkma.gov.hk/cgi-bin/vpr/index.pl）。另一類是持「放債人牌照」的公司，受警方和公司註冊處監管，名單每月更新上載「公司註冊處─放債人牌照」（http://www.cr.gov.hk/tc/public/moneylender.htm）網頁。 
20120820-5,20120820,5,後記浸大中國研究所重門深鎖,後記 浸大中國研究所重門深鎖 記者交給學民思潮召集人黃之鋒，以及兩名教育界人士閱讀的三本內地教科書，均為國內中、小學採用的教材之一。 他們閱讀之後，除以「大開眼界」來形容這類內地教材外，並且都認為，內地學生接受愛國教育是必然的；不過，在與香港的《中國模式》手冊比較下，發現該手冊比國內的愛國教育教材更加偏激、更加狹窄，洗腦程度比內地更甚。 記者曾將這些內地教材，帶去負責編製《中國模式》手冊的浸會大學當代中國研究所，但每次去到都是重門深鎖；職員在電話中指研究所負責人在開會，沒有時間接受訪問。 《蘋果》記者
20120820-6,20120820,6,校長會首表態促放棄獨立成科,校長會首表態促放棄獨立成科 【本報訊】繼各方家長和學生早前收集逾10萬市民簽名反對，教協昨起接力擺街站，繼續反洗腦。教協今起向教師派發良心約章，要求教師拒絕成為政治灌輸工具，罷教洗腦科。中學校長會昨首度表態，促請當局勿強行「獨立成科」。9月1日，反國民教育大聯盟會再在政府總部集會，9月中教協會發動24小時靜坐。 教協接力一連七日擺街站 教協昨起一連七日，先後在旺角、銅鑼灣及荃灣擺街站，收集市民簽名，促政府撤回國民教育科。教協教育研究部主任張銳輝表示，家長與學生早前已收集逾10萬名市民簽名。他表示過去兩周教協三度去信教育局局長吳克儉，要求公開會面均遭拒絕；而政府近日常以「三、四年後實行」作擋箭牌，他擔心市民誤以為政府已讓步，故有必要繼續擺街站向市民講解。 教協今起派發良心約章，呼籲教師簽署，拒當政治灌輸工具。至於會否發起罷課，張銳輝指是其中一種手段，但要先得到家長、老師以至市民認同；他說當前首要是加深市民認識洗腦教育禍害，其後才考慮下一步行動，至於教師是否支持罷課，則視乎良心約章簽署情況。 此外，擁有約400名校長會員的中學校長會，昨首度就國民教育科表態，指已在上周五（17日）去信教育局，促請當局放棄硬性規定國民教育「獨立成科」。在現時指引中，小一至中三必須開設獨立科，每人必修；而中四至中六，學校有自主權決定是否開辦，中學校長會期望，政府放寬對中一至中三級的限制，讓學校同樣有自主權。中學校長會主席阮邦耀指出，國民教育科強調「情感觸動」，擔心孩子為求爭分會偽裝情感。 周一嶽籲維護香港價值觀 該會要求教育局就爭議性議題做公開教材庫，包括六四、李旺陽及釣魚台等問題，讓社會減少對洗腦的擔憂；又指教育局要尊重非華裔學生的需要，政府應提供相關課程架構，放下獨立成科框架。中學校長會將派出顧問、退休校長黃謂儒，參加政府設立的國民教育科諮詢委員會，預計下周中首次開會。據悉委員會成員還包括該科的課程發展議會主席李焯芬。 另外，食物及衞生局前局長周一嶽昨指，本港有需要引入此科，但內容要持平及客觀，同時要維護香港價值觀；他認為要港人接受內地價值觀，仍需一段時間。
