key,date,article_daily_id,title,text
20120907-75,20120907,75,沙膽虹手記：自掌嘴巴定死拖下去？ - 沙膽虹,沙膽虹手記：自掌嘴巴定死拖下去？ - 沙膽虹 梁振英本來已經執好行李準備去俄羅斯出席亞太經合會議，點知突然間話取消行程，留港處理公務，唔使問阿貴，梗係阿爺叫佢唔使去啦！前晚見到佢離開特首辦返家時木無表情，以及翌日上班亦冇嘢講，就知道佢好冇癮。沙膽虹相信他前晚分分鐘失眠，左諗右諗究竟阿爺係咪唔鍾意佢？係咪有Plan B？至於阿爺有乜嘢原因叫佢唔使去，是否因為佢處理國民教育事件搞到一鑊泡？沙膽虹覺得，梁振英最大問題就係漠視民意。超過五成人叫劏房局長陳茂波下台，他不聽；就連九萬人上街、四萬人政府總部集會、馬拉松絕食、晚晚過萬人佔領政府總部反對國民教育，他都執意推行，以為緊跟北京意旨辦事就冇死。如果咁樣都可以做特首，就唔使梁振英，求其喺街搵個都得啦！阿爺叫你做乜就做乜，完全唔識睇形勢執行！肥佬黎叫沙膽虹做乜做物，沙膽虹都唔會百分之百跟足，覺得會引起同事反彈的亦會勸肥佬黎唔好制，難道出咗事時跟肥佬黎講，又係你叫我咁做嘅，唔俾肥佬黎鬧「我叫你去死，你唔好去死」才怪！梁振英日前仲儍更更出嚟講，撤回跟唔撤回中間有好大空間，可以慢慢傾，但唔可以用撤回作為談判起點。首先，A及Not A中間根本冇空間，況且，梁振英把話講死，話不可以撤回作為談判起點，他現在如何收拾殘局呢？自掌嘴巴撤回國民教育？死拖下去讓政府總部長期被佔領？沙膽虹
20120907-76,20120907,76,西環集中營：袁國強為雙非問題收風 - 季陶,西環集中營：袁國強為雙非問題收風 - 季陶 梁班子在過去兩個月被醜聞纏身，能夠置身事外的司、局長不多，但律政司司長袁國強則肯定尚未被波及。有政界中人向季陶報料，別以為袁國強天天坐在辦公室無事忙，原來他在過去一個月，亦先後多次拜會不同商會及組織，為日後工作鋪定好路。 未表立場但不會懶理 據了解，袁國強最近曾與香港總商會高層會面。表面看來，袁國強的工作範疇與香港總商會風馬牛不相及，不明白他為何要與商界中人「打交道」；知情人士卻指，其實商界在內地營商時，也會涉及不少法律問題；而前海的稅務亦涉及法制，換言之與律政司有關，因此袁國強與商會中人交流也不出奇。季陶聽聞，袁國強亦對雙非問題極度上心；與總商會成員會面時，便向曾就解決雙非孕婦來港產子問題、提出私人條例草案的立法會代表林健鋒了解其構想。雖然未有表明政府有何立場，但肯定不會懶理，始終雙非問題是不少市民急欲想解決的問題，作為律政司司長，豈能撒手不管？季陶向林健鋒打聽過，據報政府仍然沒有就解決雙非問題有定案。但無論政府如何處理、又或者有否意志處理，已經循商界自動當選的林健鋒強調，必然會繼續跟進雙非問題，更稱待新一屆立法會復會後，會重提有關私人草案，希望各大黨派也支持，強調功能組別議員，不只關心界內事宜。季陶
20120907-77,20120907,77,「我做爽報」送你一架車,「我做爽報」送你一架車 《爽報》就快一歲喇，我們正籌備9月19日報慶當日出一份特刊，邀請全港讀者做《爽報》。過去一年，你個人最爽或最不爽的經歷，用文字及圖像紀錄下來送交我們，一經刊登，每篇賞你500元；其中一篇被選中為特刊頭條的終極佳作，得獎者更可獲價值逾17萬元的Hyundai Elantra 1.6四門房車一輛。每篇文字上限500字，圖片不限量，附加短片更佳，惟必須未經發表。請附真實姓名及聯絡方法，刊登時可用筆名。截稿日期為9月14日下午5時。爽快行動，一輛汽車等着你。 電郵：mailto:news@sharpdaily.com.hk   傳真：2623  9801
20120907-78,20120907,78,蘋果會客室,蘋果會客室 《蘋果》會客室是本報與讀者及廣告客戶的溝通橋樑，歡迎來函或來電提供意見、或指正錯誤。電話：2929 0000傳真：2370 3283電郵：mailto:adnews@appledaily.com
20120907-79,20120907,79,患病被父趕離家　移植兄長骨髓不足半年復發科學館助理女館長屢戰血癌,患病被父趕離家　移植兄長骨髓不足半年復發 科學館助理女館長屢戰血癌 【本報訊】逆境從未令29歲的梁子茵（阿茵）退縮。在破碎家庭長大的阿茵，半工讀以一級榮譽於中大畢業，任香港科學館助理館長。甫踏上光明路便遇風浪，去年她患上俗稱血癌的急性淋巴性白血病，移植兄長骨髓不足半年便復發。再次與死神交鋒，外表柔弱的阿茵堅強地說：「我當係一個考驗」。 記者：伍雅謙 去年8月阿茵證實患上血癌，最痛心不是肉體受苦，而是被爸爸嫌棄，「阿爸知我有病就唔俾我留喺屋企，好彩社工幫我入住骨髓之家，有乾淨嘅地方養病」。 目標讓母過好生活 阿茵幾歲大父母便離異，她與兄長及妹妹跟父親生活。父親雖取得撫養權，卻未有善待他們，「我哋生活得唔開心，好多時都冇飯食，生活靠媽媽打兩份工接濟，佢為咗我哋捱得好辛苦。我細個已經諗，大個咗一定要好好照顧佢」。 苦難是成長的催化劑。自小懂事的阿茵深信知識可改變命運，努力讀書入讀中大環境科學系，取得一級榮譽學位，「阿爸唔肯畀學費，好彩攞到獎學金同免入息審查貸款，試過一日做七份補習」。 逆境更激起阿茵的鬥心，她熱愛生命，熱衷服務社會，在漁護處擔任義務自然生態導賞員。大學畢業後很快找到工作，後轉到香港科學館擔任助理館長，「最開心喺有穩定收入，照顧到媽咪」。她一邊還政府貸款，一邊努力儲錢，目標是置業讓媽媽遷離公屋，改善生活，「為咗慳錢一直同爸爸住，但冇諗過我一有血癌，佢就換埋門鎖要我走」。 手頭只餘約一千元 阿茵患病後接受化療，今年3月移植哥哥骨髓，病情一度受控，沒料到不足半年便血癌復發。目前她在瑪麗醫院隔離病房留醫，接受化療降低癌指數，並等候脗合骨髓，以再進行移植。 這一年沒收入的阿茵靠積蓄過活，「我以前係家庭經濟支柱，哥哥同妹妹收入唔多，科學館畀我停薪留職，我諗住好番就可以返工，點知咁快翻發」。阿茵每月花數千元購買消毒用品，因怕受感染，覆診需坐的士，開支甚大，手頭只餘一千多元。蘋果日報慈善基金已撥出一萬元給她應急。 面對頑疾和經濟困境，身經百戰的阿茵不輕易屈服：「我當係人生另一個考驗，家唯一做到嘅就係放鬆心情，同呼籲更多人捐骨髓」。她盼望能活下來，照顧在患病期間，一直對她不離不棄的母親。 「梁子茵」捐款編號：C3279 網上捐款： http://charity.appledaily.com.hk/donate  網上捐款 捐款記錄
20120907-80,20120907,80,病情危急　化療無法治癒籲市民積極捐骨髓,病情危急　化療無法治癒 籲市民積極捐骨髓 香港血癌基金會副會長梁憲孫教授表示，急性淋巴性白血病每年不超過100宗新症，成因不明，患者多為兒童，成年人較少；若換骨髓後血癌復發，單靠化療無法治癒，必須再次移植骨髓，否則病情會惡化至死亡，「一般急性白血病都唔會（拖）好長，要把握機會盡快換骨髓」。 復發須移植無血緣骨髓 梁教授指，親屬骨髓配對成功機會為四分之一，無血緣者則為五千分之一。移植親人骨髓，可減低出現併發症的機會，惟若復發，便要移植無血緣骨髓，「冇血緣骨髓免疫抗癌作用好啲，病人唔能夠接受太多次骨髓移植」。本港約一半血癌患者可在港骨髓庫成功尋得合適骨髓。 阿茵第一次移植，由大她三歲的哥哥Sam捐出骨髓。阿Sam坦言，最初對捐骨髓毫無認識，覺得很危險；後來了解清楚後，「其實捐骨髓好似抽血咁，有儀器分開血同骨髓。希望多啲人登記捐骨髓，等我妹妹快啲搵到啱嘅骨髓，唔好耽誤病情」。 目前香港紅十字會轄下的香港骨髓捐贈者資料庫有八萬多個登記。越多人登記，越多病人受惠。 有意捐贈者可到紅十字會捐血站及捐血流動隊登記。詳情可查閱紅會網頁： http://www5.ha.org.hk/rcbts/template?series=44&article=133  《蘋果》記者
20120907-81,20120907,81,平治司機撞的士　借醉發難酒駕、襲警、撻朵,平治司機撞的士　借醉發難 酒駕、襲警、撻朵 【本報訊】一名男子昨天凌晨在灣仔駕駛平治房車涉衝燈與的士相撞，他接受警員酒精測試證實超標逾四倍，事後低聲下氣哀求警員放其一馬，惟見警員「鐵面無私」即變臉咆哮叫囂，事後腳步浮浮由警員攙扶返警署調查。其間事主突發難襲警，最後與兩受傷警員一同送院，但他拒絕提供血液樣本，並爆粗自稱黑社會成員，最終涉三宗罪被捕。 記者：劉雲彪 被捕男子姓周（53歲），報住香港仔華富邨，持有證券交易及期貨合約交易牌照，上月中剛在灣仔港灣道一上市證券公司離職。昨天凌晨2時許，周駕駛平治房車沿軒尼詩道西行，右轉往杜老誌道時，一輛的士從對面線駛至，兩車在路口收掣不及發生相撞，房車餘勢未了，直鏟上行人路撞毀一米鐵欄始告停下。兩車車頭損毀，的士司機和女乘客受傷送院。 警員到場調查，周仍醉意未消，喃喃自語的說：「係我衝動，撞咗㗎車。」被問及有否察看交通燈，他順口答道：「咩燈呀，乜燈都冇睇！」警員即場替他進行酒精呼氣測試，證實事主酒精含量高達116微克，超標逾四倍，達「醉駕罰則三級制」最高的第三級，首次定罪被罰停牌至少兩年，重犯停牌五年。 喝罵醫護人員 事主在證實酒後駕駛後，曾低聲下氣向現場警員求情：「畀次機會吖，我趕住去接老婆，好眼瞓，想返屋企。」警員着他返警署再「吹大機」，他即變臉兼手舞足蹈大叫：「返我屋企吹！」 步履不穩的事主後由警員帶返警署助查，其間他突情緒激動，大叫大嚷，兩警上前制服他時遇襲受傷。他其後被送院檢查，但事主一度拒絕提供血液樣本，並大叫大嚷喝罵醫護人員，更爆粗「撻朵」自稱黑社會成員。警方事後以涉嫌酒後駕駛、拒絕提供血液測試樣本以作化驗及自稱三合會成員三項罪名，將他拘捕。 酒駕男子襲警示意圖
20120907-82,20120907,82,通渠降鏹水雨濺傷三幼童,通渠降鏹水雨濺傷三幼童 【本報訊】油麻地一間天台屋廚房去水渠淤塞，巴籍戶主昨天用五樽通渠水通去水管，疑過量令膠喉破損，腐液沿裂縫如雨滴下，街上三名尼泊爾兒童被濺傷，痛得驚叫救命。附近女報販聞訊後，用水幫他們冲洗，再送院治理，警方將巴漢拘捕帶署。 現場在新填地街180號6樓一間天台屋。昨晨11時許，56歲巴籍租客發現廚房去水管塞了，於是買來五樽通渠水，近大廈門口的膠喉疑不堪腐液灼爛，「鏹水雨」飄灑落街。當時穿着幼稚園校服的兩男一女（3歲）尼泊爾兒童，在樓下嬉戲期間遭通渠水濺中，紛紛受傷慘叫。 女報販取水幫忙冲洗 三童分別手腳和面部受傷，附近一位女報販見狀，連忙取出蒸餾水給他們冲洗，同時聯絡傷者家人。救護員接報趕抵，替他們初步敷治後送院治理，證實為稀釋鏹水，灼傷皮膚應無大礙。警方將現場封鎖，登樓調查，找到倒通渠水的巴漢，將他拘捕。 幫手救人的女報販憶述，當時聽到三名尼泊爾兒童在街上慘叫，連忙走近查看，只見他們皮膚紅腫，懷疑被通渠水濺中，立即用水幫他們清洗傷口。
20120907-83,20120907,83,升學夢碎青年危站,升學夢碎青年危站 【本報訊】青年求學心切，疑未能順利在港升讀心儀學校，又嚮往外國升學，昨天凌晨向母親提出負笈外國要求，惟家庭無法負擔學費，青年願望落空。一時未能接受之下，青年與慈母齟齬後，登上銅鑼灣寓所天台危站壆邊，慈母報警。青年在警員勸喻下返回安全位置，送院檢查。 企圖跳樓青年姓康（19歲），與51歲姓林母親同住銅鑼灣百德新街百德大廈（圖）一個單位。據了解，康一向希望負笈外國留學。昨天凌晨2時許，他向母親提出留學要求，惟林婦坦言家庭無法負擔其學費，勸他打消念頭，康無法釋懷，並與母親發生爭執，其間康向母親表示要上天台「靜一靜」。 林婦擔心兒子，尾隨走上天台查看，赫見康危站天台邊情緒不穩，嚇得連忙報警。警員趕至終勸服康返回安全地方，事後由母親陪同送院檢查。
20120907-84,20120907,84,新零食店遭淋紅油,新零食店遭淋紅油 【本報訊】深水埗黃竹街一間開業一個月的零食店（圖），昨晨遭人向鐵閘淋紅油，店主報警調查。店主報稱並無與人結怨，警方將案列作刑事毀壞案件處理。 現場為黃竹街8號地下一間售賣零食及雜貨的店舖，面積約700平方呎。據姓吳店主稱，上手租戶主原售賣衣服，他與家人一個月前合資租舖經營零食店，一直生意不俗。吳續稱，開業以來無被人滋擾或收保護費，亦無與人結怨。 昨晨9時，附近店舖店員途經上址時，發現店舖鐵閘及地下被人淋紅油，於是通知店主報警。據悉，店主在店內安裝閉路電視，但店外則沒有保安措施，警方稍後會翻查附近大廈及店舖的閉路電視，會否拍下事發經過。店主事後表示，考慮在店外加裝閉路電視。
20120907-85,20120907,85,失聯絡10年　鋪紙皮寫告白老翁尋子盼取妻骨灰,失聯絡10年　鋪紙皮寫告白 老翁尋子盼取妻骨灰 【本報訊】過去兩日，89歲文伯撐着雨傘，天未光便從長沙灣來到天水圍，在西鐵站對開天橋鋪開寫上三子女名字的紙皮尋人。原來他在內地續弦後，與前妻子女已失去聯絡逾10年，最近得知安葬粉嶺和合石墳場的前妻骨灰被搬走；人老念舊，文伯難忘已去世20多年的亡妻，希望取回骨灰帶返內地供奉。 記者：譚健文 來港尋亡妻骨灰的文潤海，早年做小販餬口，他聲稱靠街頭擺賣供三名子女國鴻、秀連及國成讀完碩士，現時子女都出人頭地，分別任職工程師及會計師。20多年前老伴逝世後，文伯在朋友介紹下與一名內地女子結婚，現育有一對子女。 骨灰被遷無山可拜 文伯聲稱與前妻子女已10年沒有聯絡，他則一直在內地生活；對於三名子女，他漸漸已不大在乎；但對相伴數十載的前妻則仍然懷念，每隔一段日子便會返港拜祭。早前文伯發現前妻安放在和合石的骨灰位已被遷走，向職員查詢不得要領，但他懷疑是子女將亡母骨灰搬離和合石。 文伯對「無山可拜」感到不開心，於是往找子女查問，但遭他們拒見，「佢哋話唔識我呢個老竇。」文伯淡淡地說，語氣卻帶點無奈，與子女的恩怨不願細談，只望可以取回亡妻骨灰帶回鄉間供奉。 暫居長沙灣幸福邨親友家中的文伯，早前曾到天水圍找子女，「個仔曾經住嘉湖山莊，最近問過地產經紀，知道個單位早年已經賣咗，可能仲住喺天水圍，希望佢啲朋友見到我提供線索。」 文伯在無計可施下決定擺地攤尋子，過去兩天，他凌晨4時便出門，來到天水圍西鐵站對開的行人天橋，把寫有子女名字及自己聯絡電話的紙皮張開，途人眼見這位瘦削的老翁不是討錢而是尋人，都覺奇怪。文伯撐着雨傘一直等候消息，他說：「我今日頭好痛，如果唔係要帶老婆啲骨灰返鄉下，畀錢我都唔嚟。」但他亦知道是大海撈針，但文伯對一切方法都不放過，更託本報記者協助尋人。
20120907-86,20120907,86,滙豐總行花槽被推倒,滙豐總行花槽被推倒 【本報訊】20歲姓鄧「佔領中環」成員Toto，昨疑不滿銀行職員以美化環境為名搬來花槽，實質欲展開圍堵及阻礙通道，於是上前將花槽推倒，在場保安員即阻止及報警，警方事後將他拘捕帶署。 佔領中環清場限期已過逾10日，惟仍有不少成員留守滙豐銀行總行地下，銀行於前日起開始在上址兩邊大閘架設一米高、裝有沙包的長形花槽，留出通道讓途人通過。 至昨晨11時許，疑鄧不滿有關做法上前推倒花槽，保安員見狀報警，警員到場以涉刑事毀壞罪名將鄧拘捕。有不滿的成員昨在網上指稱：「滙豐的人不斷搬移花槽裝作美化環境，實質是包圍佔領區。」有人笑稱：「整到上頂，到時開番個窗，成間板間房，到時呎價都唔知點計！」
20120907-87,20120907,87,新蒲崗唐樓牆裂三米,新蒲崗唐樓牆裂三米 【本報訊】新蒲崗景福街一間地產公司的後巷廁所外牆，昨晨被途人發現裂開一道三米長裂縫，恐有塌牆危機慌忙報警。警方通知屋宇署派員到場視察，初步認為無即時危險，由業主跟進處理。 昨晨8時許，50歲姓李女子行經景福街67號一幢唐樓後巷，發現建築物牆身出現一道三米長、七厘米闊裂縫，擔心有倒塌危險於是報警。警員接報封鎖現場調查，由於後巷牆身為唐樓地下一間地產公司的廁所外牆，地產公司亦找來工程人員，聯同屋宇署人員在場檢察，發現廁所門的牆腳另有一條約30厘米長的裂痕。 有街坊稱，景福街對面一個屋苑數年前興建進行打樁時，景福街後巷地下亦曾出現裂痕。此外，街坊又稱，約七年前上址曾爆水管導致路陷，大量泥土流失，雖然事後已修復，但未知今次裂牆事件是否地盤打樁及爆水管引發的後遺症。 當局稱樓宇結構安全 屋宇署發言人表示，該唐樓樓齡近50年，裂牆部份並非僭建物，樓宇結構安全，暫時未知外牆出現裂痕原因。業主已自行聘請承建商清拆該幅外牆；稍後路政署人員亦會進行路面修補工程。
20120907-88,20120907,88,三度出走青年又失蹤,三度出走青年又失蹤 【本報訊】五年來有三次出走紀錄的17歲青年林錕，今年7月17日離開葵涌住所後又告失蹤，家人遍尋不果，終於本周二報警求助。警方昨日發相呼籲市民提供消息。 資料顯示，失蹤青年林錕就讀赤柱香港航海學校，本月新學期升讀中六；他於08年、去年及今年1月4日曾三度出走被尋回。及至7月17日，林離開葵涌葵盛圍住所後再次失蹤，消息稱，其家人初時估計他是貪玩離家出走；但至今仍無下落，擔心其安危遂於本周二報警。 林錕身高約1.6米，體重約60公斤，他離家時戴金色框眼鏡，身穿白色衫、綠色短褲、啡色凉鞋，並攜帶一個黑色袋。警方呼籲巿民如有林錕的消息，請致電3661 1172與新界南總區失蹤人口調查組聯絡。
20120907-89,20120907,89,陀槍藝術家有火寧將千金換丹青,陀槍藝術家有火 寧將千金換丹青 鍾建新，49歲，港產藝術家，作品兩度入選香港當代藝術雙年展，前港督彭定康、香港藝術館和香港文化博物館均有收藏他的作品，亦曾為新機場開幕禮設計紀念冊封套。擅長水彩畫的他其實是前PTU警長，當差25年，五年前申請提早退休，耗盡畢生積蓄，以自資方式開設全港首間以自己命名的私人藝術館。4000呎的私人樂園，收藏他過去30年逾百幅作品，本月16日開幕，開放給教育團體參觀。記者：呂麗嬋 「我20歲就當差，做警察係職業；但我嘅事業，我希望係藝術家。自小，好鍾意畫畫，人哋做警察望升職，我都恨，但最享受嘅，係攞晒啲年假，四處去搞畫展。我去過巴塞隆拿搞展覽，當地小鎮有好多畫廊，藝術氣氛一流，回港後，我就夢想，如果有一間鍾建新藝術館，你話幾好？家陣，終於夢想成真。 由零開始自資建藝術館 我退休前駐守新界，屬受保護古蹟嘅粉嶺裁判署係隸屬我哋管轄範圍。嗰時政府話搞保育計劃，我寫咗個萬言計劃書，建議19區搵啲特色建築物，改建成地區藝術館。唔使講，份計劃書最終石沉大海。 政府唔做，就我嚟做。退休前，我已四圍物色地方，五年前，搵到去錦田大江埔。未裝修前，間屋荒廢咗十幾年，爛屋一間，但勝在屋型靚，一入門口，中庭位16呎，天然光透入，一見鍾情。 我哋唔係有錢人，搞呢間藝術館，要傾家蕩產。提早退休攞到嘅60萬退休金係我同太太畢生嘅積蓄，兩邊家庭都有幫手。要成就夢想，唔係我一個人嘅事。好多人話藝術家好清高，但藝術家都要搵食。做多十年，我筆退休金有成200萬，早退，只有60萬。呢筆數，好多人識計，但當你計得太多，就乜都唔會做。 警察工作中尋畫畫樂趣 對錢，我梗有概念。我喺粉嶺鄉村長大，爸爸係雞農。小時候家境好，搞農場、有工人。後來爸爸生意失敗，慘到要去做泥工。我係四兄弟姐妹中嘅大仔，梗要幫手。中五畢業，原本去做廣告設計，嗰時月薪1000蚊，後來朋友話，你會考七科合格，做警察，薪高糧準，如是者，一做就做咗25年。 做警察同做畫家，好似風牛馬不相及，但其實未必。我試過去邊境禁區部署一單掃毒行動，人人要搵地方掩藏，我就大模廝樣攞住畫板扮寫生！行動前去現場踩線，唔方便影相，我就負責重繪通道結構圖！呢啲都係陀槍以外嘅經歷。與其自怨艾乜?都做唔成，不如搵吓當中嘅樂趣，條條大路通羅馬，係咪？
20120907-90,20120907,90,探針：習近平及梁振英的奇怪決定 - 張華,探針：習近平及梁振英的奇怪決定 - 張華 星期三同時發生了兩件奇怪的事，不知是否有關聯。第一件，美國國務院官員周三下午透露，前一晚深夜十一點突然接到中方通知，指習近平因行程安排有變，要臨時取消與希拉莉的會面。這在外交上絕不尋常，更何況中共政治非常僵化，事非迫不得已不會如此。原因不外乎三個。第一，有重大事項要向對方抗議，例如副總理吳儀○五年出訪日本，因日本首相小泉純一郎堅稱會參拜靖國神社，臨時取消與小泉會面，提前回國抗議。不過，今次應可排除此點，因為胡溫也見了希拉莉。第二個可能性是習近平健康出現嚴重問題或已失勢。《華爾街日報》引述消息報道，習近平背部受傷。按中共慣例，除非領導人病重至不能說話、不能走路等，否則絕不會取消會見外賓，以免引起無謂揣測，其健康狀況也會被政敵拿來做文章。若習近平背傷如此嚴重，則牽一髮動全身，勢必影響中共十八大。這將是近二十年來中國政治的最大危機！而且，習近平如何受傷呢？若說他突然失勢，雖不能排除此可能性，但他接任下屆總書記是全黨共識，突然無聲無息拉他下馬，造成的政治震盪將非常大，且誰有此能耐？第三個可能性就是習近平要處理重大危機，無法抽身與希拉莉見面，甚至已離開北京。中國有甚麼危機嚴重到習近平要如此緊急的親自處理呢？中共十八大？若事關十八大，則說明問題非常嚴重，絕非習一人能應付，必須整個領導層集體應對。胡錦濤、溫家寶固然有責，代替他見希拉莉的李克強也是來屆領導層主角，更是責無旁貸。但他們都如常活動，說明事關十八大的可能性不大。較合理的解釋就只有香港反洗腦運動的危機！習是主責香港事務的最高決策官員。但這場危機還不至於大到要他如此緊急的處理吧！難道北京掌握的情況遠比我們知道的嚴重？對習近平而言，左派必須在立法會選舉大勝作為他的政績，若國民教育問題久拖不決，不僅可能影響立法選情，還會令他一個月後接任總書記蒙上陰影。但解決問題的手法，是鎮壓學生還是怒炒梁振英以平息民憤呢？總之，在兩者之間令人有很大的聯想空間。與此同時，梁振英當天下午突然宣佈取消到俄羅斯參加ＡＰＥＣ峯會，他前一晚同菲律賓人質家屬會面，還承諾代向菲國總統阿奎諾反映家屬意見，但臨時更改計劃，必是被北京緊急叫停，要他留港處理危機，從中可見北京是何等重視這場危機！總之，反洗腦運動到了非常關鍵的時刻，必須有更多市民挺身而出，全力支持學生！張華逢周二、五刊出
