key,date,article_daily_id,title,text
20120907-289,20120907,289,投資的天空：大市喘穩靠A股 - 張士佳,投資的天空：大市喘穩靠A股 - 張士佳 昨日港股反彈，但指數升幅不多，或者係因為投資者都在觀望，昨晚歐央行會議，會有甚麼驚喜。不過以個股的氣氛而言，市場是略有改善，這要歸功於內地股市回穩，始終近日外圍股市唔算太差，港股走勢之劣主要由中資股拖累，難得A股回升，有淡倉選擇食糊亦平常。 A股回穩主要因為中央發出放水訊號，先係人民銀行透過逆回購向市場注入950億元人民幣，但是，另一則消息應較令市場振奮，發改委前日公佈25條城市軌道交通建設規劃和可行性研究的核准信息，項目總規模估計逾7000億元人民幣，消息帶動一眾鐵路相關股急升。 大家都知內地若要谷經濟，好多時先由基建着手，今次一口氣批准如此多項目，市場自然聯想中央將進一步泵水。我們沒有水晶球，無法估計會否有下一步政策，但消息為鐵路股製造了炒作空間，才是投資者最關心的事，以昨日表現，急升相信少不免與補空倉的推波助瀾有關，一如以往，要先觀察往後是否有後續力量，才可決定板塊擺脫了弱勢與否。 至於組合方面，聯塑（2128）如跌穿3.5元，會將餘下持股沽出，屬長期指令。 與曾卓鋒（寶來證券業務經理）聯合執筆（逢周三、五刊出） 作者：張士佳、曾卓鋒（寶來證券(香港)業務經理）
20120907-290,20120907,290,港元定期存款息率,港元定期存款息率
20120907-291,20120907,291,外幣兌港元,外幣兌港元
20120907-292,20120907,292,銀行最優惠利率按揭計劃參考,銀行最優惠利率按揭計劃參考
20120907-293,20120907,293,外幣存款息率,外幣存款息率
20120907-294,20120907,294,九九金　港元/両,九九金　港元/両
20120907-295,20120907,295,銀行同業拆息,銀行同業拆息
20120907-296,20120907,296,炒友Blog：大市跌勢成伺機開淡倉 - 邱古奇,炒友Blog：大市跌勢成伺機開淡倉 - 邱古奇 港股急挫一日後，昨日暫時喘定，恒指整日反反覆覆，最終升64點報19209，反彈力度不大，並未扭轉近日跌勢。 昨市交投淡靜，股民都在等歐洲央行開會結果。歐洲央行今次議息，是否減息並非焦點（事實上減亦無用），市場等的是有沒有買債計劃細節。會議未開，前晚已有消息傳出，指歐央行計劃買入歐元成員國的3年期以內債券，不設上限。 本欄提過，對於歐央行計劃買債，市場已作消化，莫說買債計劃泡湯，即使落實買債，若規模未能滿足市場期望，隨時出現「好消息出貨」場面。 假設歐央行真的決定不設上限買債，表面上應可滿足市場期望，但仍有不少問題有待澄清。首先，消息指歐央行不會設定入市買債的目標利率，那麼歐央行會在甚麼情況之下才買債？要把債息壓到多低才收手？ 或曰歐央行會待成員國求助時才買債，那麼成員國求助時，是否要像希臘般接受嚴苛的財政監管？若是，西班牙和意大利這兩隻大歐豬會否拖到最後一刻才求助，錯過最好的挽救時機？ 消息又說歐央行買債後會在市場冲銷，避免資產負債表過度膨脹。小邱相信此說屬實，因為沒有冲銷保證，對通脹有恐懼症的德國肯定不會答應。問題又來了，歐央行買債若是數量極大，要有效冲銷極不容易；即使歐央行真有辦法透過種種方法向市場沽出等量資產，吸回買債所釋出的流動性，成功冲銷以減輕通脹風險，但就失去印銀紙的作用，並非市場預期的QE式放水，市場反應如何，難估。 新世界險守圓頂頸線 以走勢論，恒指跌穿圓頂頸線後弱勢明顯，短期雖有機會再彈一段，但19400之前阻力甚大，上方大約在19600水平更是多條平均線密集之地，更難升越。恒指成份股當中的強勢股紛紛變樣，例如新世界發展（017）昨日就險守圓頂頸線，由於MACD已呈雙熊，最終跌穿頸線跌向8.40元的機會甚大。 本欄會候期指反彈至19300之上開淡倉，目標18600，升破19600止蝕。由於市況太波動，只會以兩張細期出擊。 邱古奇 本欄逢周一、二、四、五刊出
20120907-297,20120907,297,何車500：中化肥PB遠低於同業 - 何車,何車500：中化肥PB遠低於同業 - 何車 08年初，中化化肥（297）最高價8.80元，PE高達80倍，PB 2.6倍。當年PB不算太不合理，但PE則高得離譜，高估值無法長期維持，現價1.42元，較4年前高價瀉84%。同業海油化學（3983）當年高價PE 25倍，現價只較當年下挫35%。 過去3個月，中化肥最低價1.14元，最高價1.65元，昨價在高低價大約中間位置。 ①中化肥業務是在國內產銷氮肥（佔總營業額34%）、鉀肥（佔24%）、磷肥（23%）、複合肥（15%）、其他產品（佔4%）。2012年（12月年結）上半年，集團營業額225.37億元（人民幣．下同），按年上升22%；盈利5.46億元，增長9.9%。去年同期盈利有3.41億元來自「祖國稀釋之聯營公司收益」，今年上半年則無同類項目。不計此一項目，上半年業績頗為理想。現價往績PE 12倍，彭博綜合證券商預測，2012年10.1倍，高過海油化學的8.2倍，低過全球龍頭Potash的12.3倍。Potash市值350億加元，是中化肥第二大股東，持股量22.26%。 ②中化肥今年預期PB 0.59倍，遠低過海油價化學的1.26倍，及Potash的3.47倍。 ③6月底，中化肥手上現金19.71億元，銀行借貸61.87億元，淨借貸42.16億元，淨借貸/股東資金總額比率30%。 ●中化肥炒上落，1.37元可上車，賺8%離場。 何車
20120907-298,20120907,298,異動空間：止賺易因小失大 - 魏力,異動空間：止賺易因小失大 - 魏力 早兩日跟股友吹水，佢話自己重注兩隻股票，目前股票A賺1成，股票B輸緊1成，但睇唔通個市，想減啲貨，問魏力應止賺定止蝕？有錢賺咗先，輸緊就坐多陣，博日後返家鄉，相信係大部份散戶的做法。 止蝕是痛苦的，但試想你買股票，都是覺得佢平先會買，若然入貨後股價好快跌一成，經驗所得，好大機會係睇錯方向，若不及時止蝕，再跌機會將遠高於反彈，溝淡後果更不堪設想。假設股票跌了五成，蟹貨一街都係，要升1倍先返家鄉，談何容易？ 相反，貪小便宜「食糊先講」，便放棄讓利潤滾大機會。以早排分析過的南聯地產（1036）為例，假設戰友10蚊入場，買1萬股，成本10萬銀；昨收16.42元，持股升值至16.42萬，再升10%的話，以本金計就升值16%，賺錢變相容易了。 市況慘淡難揀股，幸運地買中一隻，如本欄4月推介的安東油田（3337），當時才1.20元水平，昨已漲至1.84元，坐貨4個多月利潤五成。試問日日短炒，扣除使費，有誰敢說4個月能賺五成？中資電訊、燃氣及石油設備持續強勢，坐得安心、兼有突破之勢的股份，可留意中國電信（728），穩守250日線之上，近日成交漸增，有蓄勢向上味道。 魏力  http://www.facebook.com/2012jason 
20120907-299,20120907,299,內線王：惠理大手拋售華晨 - 范董,內線王：惠理大手拋售華晨 - 范董 連番減持後，惠理基金終於再掟曾經的愛股華晨中國（1114），於8月31日以7.522元均價再沽124.6萬股。華晨9月5日停牌，母公司以當時市價折讓5%配售1.25億股，昨日復牌後跌6.75%，收報7.04元。 今年2月起，惠理持續大手拋售華晨，已累計沽出2.05億股，持股量由原來的9.08%，跌至如今的4.97%之毋須披露水平。華晨於8月29日公佈上半年業績，純利增長42%，當中寶馬銷量達8萬架，增長47%。內地豪華車市場增長強勁，一旦市場消化配股消息，或有助股價出現反彈， 寶姿績差　富達走貨 富達基金曾於8月10日，以均價8.017元增持時裝股寶姿（589），但寶姿8月30日公佈上半年純利跌27%，業績唔爭氣，富達惟有於8月31日以6.202元均價狠沽843.0萬股，持股量減至4.53%之毋須披露水平。寶姿昨收報6.15元，再跌0.65%。 另外，利豐（494）大股東馮氏家族又再掃貨，主席馮國綸於9月4日以11.912元均價再增持100.5萬股，連同早前在8月10日及13日掃入的2000萬股，8月至今已斥資2.7億元增持，持股量增至30.46%，均價則約為12.75元。該股昨收11.82元，升1.7%。 范董
20120907-300,20120907,300,點股壇：會德豐可分批收集 - 齊明,點股壇：會德豐可分批收集 - 齊明 主席兼大股東吳光正增持會德豐（020），市場跟進，昨一度升2.2%。吳光正增持始自3月底至7月初，已增持554萬股，耗資1.48億元，礙於公佈業績而暫停，放榜後於8月31日再增持55萬股，平均價約29.50元。 會德豐上半年核心盈利跌15%至33.91億元，但較預期為佳，股價曾搶升6.8%，大市不就，終於回落，筆者7月底建議於放榜後或27元吸納，是過於保守，吳光正增持，形勢稍改，應密切留意。 業績下跌在意料中，因並無物業完成出售，但九龍倉（004）貢獻大增，有助收窄跌幅，下半年仍無物業出售，預期今年業績跌逾20%，但未來數年有大量物業完成，短期業績下跌無損評價。 會德豐現有香港地盤6個，應佔面積282萬方呎，據報土儲約600萬方呎，計劃未來每年賣樓100萬方呎，相信仍將增持土儲。該股每股資產淨值（不包括待發展土地升值）67.13元，股價只是28.95元，資產折讓高達56.8%，大股東對資產特別敏感，可以43折買入，何樂而不為！ 中線目標35元 中期息增至25仙，吳光正持股59.88%，下旬可收息3億元，部份用於增持股份，最合理安排，相當於以股代息，但會德豐無以股代息機制，理論上，大股東增持不一定可以推高股價，相信亦避免推高股價而要買貴貨，但觀乎上次增持，股價由5月底的23.15元升至7月初的32.50元，升幅達40%，事實上當時也是大落後，現時相對仍然偏低，但期望再升40%並不實際，中線目標價35元仍合理，短線則可能反覆上升，開始收集已是時機，潛在升幅20%。 以目標價35元計，預期相當於今年核心PE 10.5倍，資產折讓47.8%；現價28.95元，預期PE 8.7倍，資產折讓56.8%，會德豐持有九倉51%，即使計及控股折讓，也是偏低，可分批收集，並留意吳光正是否繼續增持，萬一暫停，或有較大反覆。 齊明
20120907-301,20120907,301,中環迷你裙：罵抽水　先自抽 - Samantha,中環迷你裙：罵抽水　先自抽 - Samantha 國教成全城焦點，一班90後沒有蛇齋餅糭，也能打動逾萬學生哥和打工仔齊集政總，難得後生仔定位清晰兼具政治智慧，由鞠躬取代握手，到民主女神沒停留過夜，姑勿論有冇高人指點，能恰如其份的專注國教議題，教我等成年人汗顏。 國教成立會選舉焦點，不乏網民順便批評政黨的「抽水」，政壇和股壇，選民或股民均痛恨「抽水」二字，績前怕發盈警，績後無論績優或績差股，股民都步步為營，績優如瑞聲科技（2018）出貨套現，另邊廂聯邦制藥（3933）供股集資。 下周美國議息一於炒少陣去集會，國教要反，票還是要投！不少人咬牙切齒狠批政黨「抽水」，如讀書時選學生會，總有人不抽秤自己，選擇站在道德高地指某某是風頭躉。有哪個政黨不抽水？禮義廉嗎？雖然我不認同「覆核王」的黨，他經常九唔搭八出晒位，但他是我尊敬的人。 Samantha 9月9日決不投白票，因只會肥了擅長配票的政黨，站出來，不要浪費手上兩張選票！ Samantha 本欄逢周一、三、五刊出
20120907-302,20120907,302,主要股東股權變動摘要,主要股東股權變動摘要
20120907-303,20120907,303,A、H股差價表,A、H股差價表
20120907-304,20120907,304,2012年9月6日收市指數,2012年9月6日收市指數
20120907-305,20120907,305,20大升幅股票,20大升幅股票
20120907-306,20120907,306,20大跌幅股票,20大跌幅股票
20120907-307,20120907,307,20大成交額股票,20大成交額股票
20120907-308,20120907,308,20大成交量股票,20大成交量股票
20120907-309,20120907,309,智取大市：A50超賣穩陣之選 - 晉佳,智取大市：A50超賣穩陣之選 - 晉佳 國家副主席習近平突然唔見美國國務卿希拉莉，有人估計同政治局常委嘅矛盾有關，消息令晉佳打個冷震，有稍為熟悉內地政局嘅朋友話，今次可能係大驚小怪。晉佳唔係政治專才，無謂亂估，寧願信市場反應，恒指前日跌近300點，噚日略為回穩，唔算恐慌性拋售，睇嚟有可能係虛驚一場。 睇番恒指9RSI已跌到30樓下，短期可能會喘定，暫時只需要提高警覺，未去到政策不明朗令大家要沽貨嘅時候。消息面令人驚青，但簡單比較吓5月同近期嘅跌市，可見呢浸下跌速度比5月慢，暫時唔似好差。 近排好多強勢績優股嘅股東都配股套現，係因為知道後市有問題，要沽？定係覺得後市OK，要套現買低殘股？姑勿論動機如何，今年已經升得多嘅績優股，隨時有配股質低股價嘅風險，短線係唔係都要小心啲。 買股又要避開有配股憂慮嘅股份，又要穩穩陣陣輸唔死，可以留意吓安碩A50中國（2823）。唔經唔覺，A50已經跌到去9蚊邊緣，9RSI曾經喺20水平徘徊幾日，罕有地嚴重超賣，然後RSI開始回升，但股價仲喺度跌，形成咗短線RSI底背馳。另外，A50相對每股資產淨值溢價收窄到2.1%，溢價比之前下降，根據過往經驗，係中線利好因素。基本因素都費事多講，係人都話平，但長期係咁跌，講到尾，都係信圖表好過。 現價可買　睇升一成 由於A50價格表現，理論上同內地A股掛鈎，所以冇乜技術走勢陷阱嘅蠱惑嘢可以出，形成技術嚴重超賣，已經係可靠嘅買入訊號，呢個位買佢最多捱一陣價就見底，所以可以家就買。 如果睇圖，今年3月底至4月頭，A50做過一個短線9RSI底背馳；股價由低位回升到高位，改善超賣，但升幅唔夠一成。不過，A50喺5月頭到家跌幅達到兩成，比起3月跌幅約一成，累積跌幅更大，技術指標更加超賣，相信今轉反彈向上幅度會比4月大，目標至少有一成，去番10蚊實在唔困難，見步行步，市況若轉旺，分分鐘可睇11蚊，至於見有第一棍恐慌性拋售就要止蝕，總括嚟講，A50係近期穩陣嘅選擇之一。 晉佳 本欄逢周一、三及五刊出
20120907-310,20120907,310,魚樂無窮：珍惜周日神聖兩票 - 唐牛,魚樂無窮：珍惜周日神聖兩票 - 唐牛 呢排中港政壇立立亂，習近平突然喺中美高層會議玩失蹤，令人震驚同疑惑；另一邊廂，狼英上任兩個月已經處處火頭，為咗執手尾仲臨時取消出席APEC首腦會議。老實講，國民教育明明係政府霸王硬上弓，家竟然玩扮讓步博同情；白表免補地價買居屋政策，搞到樓市火上加油，佢噚日又嚟一招港人港地政策，非港人港地隨時又炒到飛起，佢一路講，雨就越落越大，證明天怒人怨。狼英政府我哋冇份揀，所以更加要珍惜嚟緊星期日立會選舉兩票，務必踢走保皇黨、建制派呢啲牛鬼蛇神！ 噚日講開智能手機設備股有勢，推介嘅舜宇（2382）進賬2%，另一隻專做手機保護外殼嘅嘉瑞（822）走勢更勁，抽高8.8%並破旗而上，收報0.87元，假設今年末期息有34%增長（參考舊年數據），則2012年股息率將達8.4厘，為股價提供動力，以年度化市盈率11倍作目標，股價可見1.03元，潛在升幅18%。 唐牛
20120907-311,20120907,311,看圖佈陣：今呈現雙熊　形勢難樂觀 - 祝文韜,看圖佈陣：今呈現雙熊　形勢難樂觀 - 祝文韜 市場在歐央行議息前，傳出該行會無限量買債，消息對大市起穩定作用，恒指低開44點後，早段最多跌69點，低見19076，但很快回穩收復失地，並以接近全日高位收市，收報19209，升64點，成交437億元。 恒指連日弱勢後漸現超賣，9RSI跌近超賣區，早已提醒在進一步向下尋底前會有技術反彈，昨日回升屬預期之內。恒指昨低開後以陽燭回升，回補部份7月27日的上升裂口，惟MACD正步入熊區，料今日重現雙熊訊號，10日線（19565）昨一舉跌穿50日線（19627）、100日線（19595）及250日線（19574），保歷加通道已向下撐開，後市凶險形勢盡在不言中，相信19000關難以久守。 發改委批出25個城軌項目，總投資額逾8400億元人民幣，鐵路板塊升到飛起，成為昨日亮點。鐵路孖寶中國鐵建（1186）昨升6.5%，中國中鐵（390）則升7.1%，收報3.17元，成交7252萬股。 中鐵短炒博升一成 中鐵去年10月至今以平行上升通道反覆向上，7月中升近3.60元受阻出現調整，周一回落至上升通道底部2.83元回穩，過去3日以陽燭回升，昨日更一舉升破10日、50日及100日線，暫受制由7月20短期降軌及50日線組成的阻力，MACD重新發出牛差，現價買入，博見3.50元已有一成潛在升幅。 祝文韜
20120907-312,20120907,312,報告王：推介唔升　棄百貨股 - 高明,報告王：推介唔升　棄百貨股 - 高明 梁振英面聖被取消，其主子亦告失蹤，中港股市有可能出現較大的政治風險，之前多間大行說A股票估值便宜，但局勢可能更壞，小心為上。 昨天花旗唱百貨股，提及的4隻股皆升，升最多的金鷹商貿 （3308）收14.50元，升2%。報告指上半年百貨股業績沒有明顯趨勢，銀泰（1833）及利福（1212）在該行調低預測數字後勝預期，金鷹符合預期，百盛（3368）則令人失望，年初至今板塊下跌12%，預測今明兩年的PE分別為14.1倍及12.2倍，預期行業的每股盈利增長會放緩至中單位數，銷售料於今年第一季反彈，明年會有強勁增長。 花旗又指，利福錄得最強勁的同店銷售增長，隨後依次序是銀泰、金鷹及百盛，7至8月同店銷售增長維持低水平，只因高基數效應，相信全年可達標，仍相信第四季會反彈，黃金及珠寶的銷售增長仍較整體百貨業強，儘管按年增長大降，該行維持金鷹中性評級，目標價由17.80元升至18元。 分析員似信心不足 分析員Eddie Lau短線（2天）平均回報2.06%，得勝率53%；中線（20天）平均回報4.6%，得勝率六成，往績尚算可以。惟上調目標價的一隻僅為中性評級，給予買入評級的兩隻，目標價卻紋風不動（見下表），似乎分析員也沒有信心，本欄宣判：唔跟！ 高明
20120907-313,20120907,313,股場放大鏡：農股睇好　短炒一拖 - 歐陽風,股場放大鏡：農股睇好　短炒一拖 - 歐陽風 一早說從政者切忌短視，當CY連標準會面機會都被取消，「腳痛」還會遠嗎？近月某位民主派議員為求博得副局長一官半職，竟然極速向左轉兼反臉不認人，應該是香港人近年所見最醜陋的政客之一。那些急於出頭做局長、副局長的人，即使CY不腳痛，5年後你們還有路可行嗎？學民思潮一班思路清晰、目標明確的中學生，可以說是港人中一道清泉，也是今次反國教運動的成功關鍵，還望政黨們千萬不要插手搞亂檔。 發改委罕見地一口氣向外發佈，已批出25個城市總值8397億元（人民幣．下同）軌道交通項目。據大行研究報告，這些城軌項目80%由中國中鐵（390）及中國鐵建（1186）控制，而且邊際利潤較高，是最大受惠者，但由於項目都是由地方政府出資，在地方政府融資困難情況下，未知是否有其他配套措施推出支援。 中央有機會增補貼 不過此舉可見中央政府意識到經濟唔多對路，急於以最直接手段注入動能，基於以上思維，鐵路配套工業股包括中國自動化（569）、賽晶電子（580）等都可以考慮博一轉反彈。另外官方亦提到加強對節能產品消費的支援，可能亦醞釀其他補貼，惟有關行業盈利透明度太低，還是睇勢決定是否值得炒作。 中央政府都心急刺激經濟，其他可能受惠的行業之一是農業，一來刺激農業生產可以降低糧價紓緩通脹，二來亦可提高農村收入，第一拖拉機（038）股價累積下跌了不少，博一轉反彈亦無不可。 歐陽風
20120907-314,20120907,314,期指戰況：輕微反彈難改弱勢 - 吳六奇,期指戰況：輕微反彈難改弱勢 - 吳六奇 外圍市況回穩，即月期指暫保19000關不失，期指昨高開20點後，早段一度倒跌42點，低見19025後好友即反攻，尾市升勢隨歐股擴大，最多升123點，高見19190，埋單仍升86點，收報19153，低水56點。 期指日線圖昨於前陰燭燭身內收陀螺，具身懷六甲的喘穩意義，但技術指標持續轉弱，10日線（19513）一舉跌穿50日線（19607）、100日線（19540）及250日線（19541）組成的阻力區，MACD重現雙熊訊號，淡友處上風的形勢未變，縱有反彈亦難改弱勢，後市料反覆下試圓頂頸線18649；若失守，將進一步考驗周線圖頭肩頂頸線18000水平。由於向淡形勢明顯，上周在19500建立之淡倉，繼續定止賺位耐心持有，目標仍是18649，收市站穩19300之上止賺。H期昨收9055，升39點，在9000關前收陀螺，危機未除。 吳六奇
20120907-315,20120907,315,昨日20大沽空股份,昨日20大沽空股份 聲明：本版內容來自聯交所，資料整理已力求精準，惟本報對於全部或任何部份內容的準確性或完整性均不會承擔任何責任，資料如有差異或更改，皆以聯交所為準。本版內容不構成任何投資建議，投資者若據本版內容入市買賣而招致任何損失，一概與本報無關。
20120907-316,20120907,316,港股派息過戶備忘,港股派息過戶備忘
20120907-317,20120907,317,上市公司公佈業績預告,上市公司公佈業績預告
20120907-318,20120907,318,中環在線：迎海洗腦大會 - 李華華,中環在線：迎海洗腦大會 - 李華華 大家見到右邊張相萬人空巷咁款，唔係立法會參選人造勢大會，亦唔係反洗腦國民教育集會，而係恒地（012）同新世界發展（017）為六大地產代理搞嘅「迎海洗腦大會」，仲要搵埋藝人做EYT（《歡樂今宵》）式趣劇，教代理推盤，認真啜核！ 馬鞍山迎海同新地（016）屯門瓏門兩個大型新盤短兵相接，一場搶客戰在所難免。迎海發展商輸人唔輸陣，噚日專登喺會展搞個「六千人誓師大會」，搵齊六大地產代理教佢哋點sell盤。 代理個個有教材 誓師大會一開波就係上堂，大會已經預先準備咗份「推銷模式」教材派畀每位代理，大sell「方便、綠化、靚景」等18個賣點，直情勁過「進步、無私、團結」，洗腦洗足大半個鐘。發展商怕代理聽唔入腦，搵鄧梓峰、阮兆祥同江欣燕做趣劇，扮成蟲同北角鄭秀文（唔係天后嗰個）。 恒地一向鐘意搵藝員幫樓盤造勢，但諗出做EYT式趣劇嚟教代理推銷，真係要畀十個like佢。三位藝人一貫專業演出，好似好得意，但講來講去都係個盤幾好，每套短劇一定用「迎海好正，要即刻落定」結尾，真係唔係人人識笑囉。 「洗腦大會」前後搞成兩粒鐘，發展商臨尾仲要嚟個「評核」，睇吓洗腦效果，由輕輕鬆鬆鄧梓峰問番幾條迎海問題，結果洗腦成功，有三位代理答中晒，各得8800大元，成件事真係好EYT！ 李華華 mailto:LiWaWa@AppleDaily.com 
20120907-319,20120907,319,中環在線：李四萬派發正能量 - 李華華,中環在線：李四萬派發正能量 - 李華華 樓價居高不下同政府硬推國民教育，令到香港怨氣越來越濃，恒生銀行（011）一姐李慧敏（Rose姐）唔知係咪見到咁，上場後頻頻帶住正能量出嚟見人，噚日拉埋陳力生同馮孝忠兩位高層介紹「十大再生勇士選舉」，呢次已經係佢上任四個月以來第三個社企責任活動。 唔講唔知，今年5月中返工嘅Rose姐，第一次以恒生一姐身份見人，就係社企責任活動，去咗體育學院送插畫，為一班香港奧運同殘奧運動員打氣。佢7月中再出席「協助警方撲滅青少年罪行比賽2012」，噚日就介紹「十大再生勇士選舉」。數數手指，Rose姐每隔兩個月就有一個社企活動，下次會唔會喺11月再見人呢？ Rose姐噚日喺儀式後又使出無敵「四萬」笑容同一班再生勇士雞啄唔斷，確實為社會帶來多少少正能量。
