key,date,article_daily_id,title,text
20130628-68,20130628,68,醫療新知：抱抱BB助心智成長,醫療新知： 抱抱BB助心智成長 父母與嬰兒多抱抱及嬉戲，不但促進親子關係，還有助子女培養良好的心智及人格。英國普茲茅斯大學研究顯示，嬰兒早於兩個月大時，已懂得觀察大人的動作及環境變化，包括當知道爸媽要抱起自己時，主動轉換身體姿勢，方便對方輕鬆抱抱。 該校邀請了28名、2至4個月大的嬰兒參與上述研究，研究人員透過攝影機，觀察參加嬰兒被大人抱起時的連串反應。結果發現，兩個月大的手抱嬰兒，已可從母親的臉龐移向到大人的雙手，並伸出腳部及出力使身體更穩定，方便對方可輕鬆抱起自己，證實嬰兒比大人想像中聰明。當地的專家指，平日多與嬰兒互動溝通，有助嬰兒長大後培養出良好性格。
20130628-69,20130628,69,Apple Health：10年31人吃河豚中毒,"Apple Health： 10年31人吃河豚中毒 【本報訊】市民亂吃河豚（即雞泡魚）隨時賠上健康。衞生防護中心回顧由03年1月至今年4月的十年間，6,000宗食物中毒個案中，有17宗涉及河豚中毒，佔整體中毒個案0.3%，共有31人中招。中毒人士介乎22至66歲，每年11月至1月為中毒高峯期。70%病人因進食自己或朋友在海中釣出的河豚而中毒，其餘在本港或深圳街市購買後進食出事。 6人須深切治療 多數患者在進食10分鐘至8.5小時後，出現麻痹、無力及頭暈等神經系統中毒症狀。當中6人要入深切治療部，最嚴重患者因心臟停頓及呼吸衰竭，留醫ICU共11日，之後返內地治療。6人中，多數人已康復，但有1人要靠輔助工具協助走路。中心提醒市民河豚體內充滿毒素，稱為河豚毒素，尤其肝臟毒素最多，高溫並不能把毒素殺死，故進食隨時送命。"
20130628-70,20130628,70,動樂天地：「行多幾步」助降血糖,動樂天地： 「行多幾步」助降血糖 運動是自然糖份耗損機制，但卻是不少二型糖尿病患者忽略的健康行為。很多人被運動的形式嚇怕，其實運動不一定要跑、跳及擲。不同身體素質的人可以玩不同的運動。研究證明對於連吃飯休息都沒有時間的糖尿病打工仔來說，吃完飯後，每20分鐘便站起來步行約一、兩分鐘，便可有助減低血糖水平近三成。「行多幾步」其實並非天方夜譚，打個比方我們可以走到附近位置與同事閒聊，甚至邀約同事一起上洗手間，其間大家分享時尚熱門話題，這些都可以成為多活動的好理由。 血糖上升致中風 若辦公時間走不開，我們也有方法做運動去控制血糖。大腿的肌肉量較多，每一次我們在桌子下面伸直雙腿都會用較多的能量，消耗較多的糖份。每隔半個小時在桌下梅花間竹慢慢地左右腿各伸直30次也是一個有效的控糖運動。另外，伸展動作也是辦公室的好運動，例如坐着時可以做擴胸運動，即兩手向後張開，收起下巴，背部靠着椅背慢慢向後仰，維持十秒，並重複做四次；站着時可以兩手伸直向上，全身向左右側彎，重複四次。每天多運動有助控制血糖，千萬不要以為血糖上升影響不大的心態，到醫生診斷身體出現多項致命併發症時，如心臟病及中風等，要控制病情便更難。 撰文：香港運動教學會主席林絢琛、香港運動教學會理事林浩文 電郵：mailto:info@hksed.org 隔周五刊出
20130628-71,20130628,71,複製報告　消防處遭鬧爆　官：查唔到起火原因　點解唔外判？,"複製報告　消防處遭鬧爆　 官：查唔到起火原因　點解唔外判？ 【馬頭圍道三級火死因研訊】 【本報訊】馬頭圍道唐樓奪命三級火死因研訊，死因裁判官陳碧橋繼今年初花園街大火聆訊期間鬧爆消防處高官後，昨天再次炮轟消防處調查報告，同樣將起火原因總結為「原因不明」。陳官更翻舊賬列舉過往四份火災調查報告，指處方疑複製報告結果，更揶揄處方應將調查外判，「點解人哋查到，你哋（消防處）查唔到？」 記者：鍾焯如 消防處消防區長曾偉明，昨天解釋火警調查報告時指，經調查後不排除起火原因為地下梯間店舖有電力故障，或棄置煙頭所引起，故將起火原因列為不明。陳官聽罷即打岔︰「其實消防處冇乜邊次搵到起火原因！」並隨即列舉包括今年2月花園街大火的四次火災調查報告，調查結果均為「unknown（不明）」。陳官質疑︰「咁啱五次都係unknown，仲要copy and paste咁！」他續轟︰「點解人哋查到，你哋就查唔到？完全搵唔到起火原因！」陳官直言︰「其實查唔到，點解唔外判？畀識查嘅人查，或者畀啲肯講原因嘅人查！」 消防區長無補充 曾偉明解釋處方調查皆不偏不倚，盡力找出起火的可能性，惟沒有真憑實據，如將起火原因只指向某一可能性，是不負責任的表現。曾更早有準備提供數據，指去年37,000多宗火警中，僅得212宗被列為起火原因不明，否認不願總結起火因由。曾稱︰「我哋唔係搵唔到，只係排除唔到其他可能性。」陳官即反駁︰「如果unknown係等如搵到，咁你𠵱家話我知起火原因係咩？」曾僅答：「暫時無補充。」 陳官於今年2月花園街大火研訊期間，批評處方花逾一年調查，卻未能找出起火原因，及後更將責任推卸於警方，浪費法庭時間。 另外，專家證人何兆鎏教授供稱，不排除棄置煙頭引致地舖起火，但排除因壞電器漏電引起火災。高級屋宇測量師鄺偉倫則指，屬僭建的肇事地下梯間店舖，事後已被清拆。研訊下周二裁決。 案件編號︰CCD1584,596-598/2011"
20130628-72,20130628,72,足總副主席貝鈞奇告《明報》誹謗,足總副主席貝鈞奇告《明報》誹謗 【本報訊】身兼足球總會副主席及甲組球隊愉園主席的貝鈞奇，控告《明報》4年前刊登一篇有關屯門普高球會涉嫌「打假波」社評文章內容，對他構成誹謗，昨於高院由陪審團參與審理。原告指涉案文章令人感覺他故意隱瞞事實、沽名釣譽、非真心為球圈付出，甚至會害死足總。 被指非管理層適合人選 案中被指誹謗的文章刊於2009年4月10日。代表原告貝鈞奇的資深大律師鮑永年稱，文章的標題和內容用字，均令人感覺貝鈞奇在三日之間，前言不對後語，故意隱瞞屯門普高的「身世」和資金來源，廉署應針對貝作調查，貝亦非足總管理層的適合人選。報道令原告聲譽受損，要求道歉不果，才透過法律求個公道。 三名被告包括明報集團有限公司、出版商明報報業有限公司和該報時任總編輯張健波。被告一方的辯解，包括文章內容有理可依和屬公允評論等。 案件起源自2009年3月31日晚舉行的一場球賽，由屯門普高與愉園對戰，結果愉園以5比1大勝屯門普高。 事後有多位本地球員於個人網誌上撰文，懷疑有隊員未盡全力作賽，傳媒其後廣泛報道，足總遂於4月6日召開特別會議，會後發表聲明，指會向廉署尋求協助，足總並會就事件作內部調查。 案件編號：HCA854/10
20130628-73,20130628,73,訛稱無懷孕　闖關雙非婦判囚,"訛稱無懷孕　闖關雙非婦判囚 【本報訊】懷孕9個月的內地雙非孕婦欲衝關來港分娩，入境處見她腹大便便向她查問，但孕婦多次訛稱沒有懷孕，辯稱「衣服鬆身」，她被揭發後卻在等待遣返其間作動，同日誕下男嬰。孕婦昨天手抱男嬰在犯人欄認罪，裁判官斥責她漠視母子健康，濫用香港醫院資源，判監12個月。 官指案情嚴重 來自湖南的33歲被告舒靈珍，昨天在沙田裁判法院承認向入境事務主任作虛假陳述罪。辯方指出，被告因購買嬰兒用品來港，惟裁判官拒絕接納其辯解，並指出被告腹大便便隨時分娩，可以委託他人代買嬰兒用品。 裁判官參考入境處數字，指內地孕婦被拒來港的數字上升一倍，由前年的1,931宗，上升至去年4,202宗，認為案情嚴重，必須判監。 案情指出，被告今年2月21日與丈夫乘火車來港，經紅磡管制站辦理入境手續，入境處職員四度問被告是否懷孕，被告否認，辯稱穿上鬆身衣服。入境處職員其後作進一步調查，被告承認懷孕37周，預產期是3月7日，入境處於是拒絕二人入境。 等候遣返期間被告身體不適送院，同日誕下男嬰。被告出院後獲准保釋，但她在5月8日到入境處報到時跟職員起爭執，咬傷職員的手，本月24日認襲擊罪，判監14日。 案件編號：STCC1826/13"
20130628-74,20130628,74,案件速遞：74股票戶口　33經紀打理,案件速遞： 74股票戶口　33經紀打理 【楊家誠案】 【本報訊】商人楊家誠涉洗黑錢案昨天於區域法院續審，辯方傳召尼泊爾籍前私人保鑣Shrestha Basanta作供。Shrestha Basanta表示，楊家誠曾經向內地捐款進行慈善項目，他亦曾經隨楊家誠到內地出席慈善活動，又將楊家誠與鄧小平兒子鄧樸方的合照呈堂。 另外，辯方專家證人Ian Robinson稱，楊家誠於2001至2007年，總共開立74個股票投資戶口，由33名經紀打理，其中70個戶口的總投資金額達18億元。 案件編號：DCCC806/11
20130628-75,20130628,75,案件速遞：街頭樂隊撤噪音煩擾罪,案件速遞： 街頭樂隊撤噪音煩擾罪 【本報訊】街頭樂隊EMB及SMS被指在旺角行人專用區違反《噪音管制條例》，使用的擴音器造成噪音煩擾，兩隊樂隊均否認控罪。當中EMB於本年2月6日在旺角街頭表演時，遭警方票控，案件昨天在九龍城裁判法院預審，獲控方以不提證供起訴，撤銷控罪。 EMB的三名成員黃傑文、王家求和李忠源對撤控感到開心，並強調他們的歌聲不是噪音，是娛樂街坊及遊客。旺角John Lennon所屬的SMS，成員之一雷若天亦到埸支持，他並表示希望透過法庭審訊可釐清當局的有關指引，SMS的案件已定於8月22日開審。 案件編號：KCS16005-7/13
20130628-76,20130628,76,馬鞍山成輪椅翻車黑點　路面滿陷阱　政府部門互卸責,馬鞍山成輪椅翻車黑點　 路面滿陷阱　政府部門互卸責 【本報訊】由馬鞍山港鐵站步行至頌安邨，健全人士或許不用十分鐘，對輪椅人士而言卻是陷阱處處的路程。頌安邨居民楊女士脊骨患病須用輪椅代步，因行人路凹凸不平、路邊坑渠沒有渠蓋、行人路路緣太高等，數次翻車跌傷，最嚴重一次連輪椅也跌至螺絲鬆脫。她批評政府漠視殘疾人士需要。 記者：袁樂婷 路面陷阱比比皆是，楊女士坦言翻車是常事，尤其鞍源街與西沙路交界的「L型」急彎更是輪椅黑點。因看不到迎面轉彎的途人，不少輪椅使用者要緊急閃避，加上外斜斜坡很難控制，隨時失控衝落路旁的無蓋坑渠，「好多朋友都試過跌到手腳瘀晒，甚至撞親頭」。 楊女士憶述，最嚴重一次是在新港城巴士總站外翻車，「過完馬路上番行人路個位太斜，再畀行人路條邊棘一棘，平衡唔到就跌低」，不但扭傷腰和右手脫臼，須休息兩個月，輪椅也跌至螺絲和後輪鬆脫。日前她帶記者巡視黑點時，經過鞍祿街公園對開行人路近五厘米高路緣，亦連人帶車向前仆，幸旁人及時扶住才沒有受傷，十分驚險。 「無障礙得個講字」 她說，患病前從不覺得路面充滿陷阱，「（路緣）幾厘米高行路完全冇問題，好似平地一樣，到坐輪椅之後先感受到係好危險，好多（陷阱）都係必經之路」。她曾多次向路政署及房屋署等部門投訴，「個個都話唔係佢負責，叫我搵另一個部門，𠵱家都未改善過」，斥政府沒有照顧殘疾人士需要，「無障礙得個講字」。 立法會議員張超雄批評，《建築物條例》中針對輪椅使用者的安全設計要求，包括路緣不可高於1.5厘米、斜坡斜度不可超過1：12等，當中卻沒有規管公共設施；且各部門分別管轄不同設施，市民無從得知應向哪個部門投訴。他建議由建築署統籌無障礙工作，方便市民反映意見，並督促其他政府部門盡快跟進，人流較多及較危險的公共設施須於兩星期內完成改建工程。 運輸署指已着手改善有關設施，預計年底前完工。
20130628-77,20130628,77,專科門診輪候最長110周,專科門診輪候最長110周 【本報訊】醫院管理局長期面對醫生不足問題，該局行政總裁梁栢賢表示，即使下月有300名新醫科畢業生加入，仍有200多個醫生空缺。人手不足等因素下，部份專科新症例行個案最長輪候時間延長，精神科由2011/12年度的55周延長至2012/13度的70周。 醫管局將專科門診新症分為緊急、半緊急及例行個案。緊急及半緊急個案，分別維持在2周及8周內獲診治。2012/13年度新症例行個案最長輪候時間為外科的110周，輪候時間延長的專科包括精神科、內科及兒科。 跨聯網轉介縮輪候期 為縮短輪候時間，該局去年8月起推行耳鼻喉科跨聯網轉介，至今年3月逾1000名病人參加，部份病人輪候時間由逾100周縮短至12周。今年4月起婦科也推行跨聯網轉介，在新東界輪候多時的病人，獲轉介至港島東聯網。 對於要病人長途跋涉跨聯網，梁栢賢表示這是短期方法，長遠希望人手增加，病人不需跨區求診；聯網內有所需專科，不需病人因沒該專科而跨區求診。 梁又指，精神科輪候時間延長，相信因市民對精神病認知增加；人口老化及人手不足，令內科輪候時間增長。局方會加強公私營合作，研究進一步在普通科門診推行，以騰出診症名額治療病情穩定的專科門診病人。此外，原設於廣華醫院內、援助性暴力受害者的風雨蘭，將搬往威爾斯醫院。
20130628-78,20130628,78,將軍澳擴堆填區明年再試,將軍澳擴堆填區明年再試 【本報訊】將軍澳擴建堆填區撥款項目「觸礁」，當局仍死心不息，環境局副局長陸恭蕙昨透露，擬在明年年中再就此項目到立法會工務小組闖關，希望由改善垃圾車問題入手，力爭將軍澳居民支持。立法會工務小組下周二將表決屯門及打鼓嶺堆填區擴建計劃，料打鼓嶺擴建撥款有望通過。 工務小組下周二復會 陸恭蕙昨在電台節目上被問及將軍澳項目「撻Q」原因時，直認是環境局的責任，稱從無低估游說難度，但變數太多，局方至最後一分鐘才知結果，希望將來游說工作做得更好。 工務小組鐵定下周二上午8時半復會，審議屯門及打鼓嶺建堆填區計劃，小組主席陳鑑林稱，為了在法定時間完成審議，將規定每名議員只可發言一次，限時5分鐘。泛民企硬不支持擴建，部份建制派重申要視乎有否具體的垃圾車除臭及其他改善配套方案，才考慮意向。
20130628-79,20130628,79,蘋果汁：　港鐵車站WiFi免費,蘋果汁：　 港鐵車站WiFi免費 【本報訊】港鐵宣佈由下月8日起，在全線84個車站提供免費WiFi無線上網服務，但服務只限付費區指定地點，月台及車廂均暫未有計劃提供免費WiFi服務。 港鐵公司銷售及市務高級經理陳玉芝昨表示，目前港鐵共有14個車站提供免費WiFi熱點服務，由下月8日起，服務會擴展至全線84個車站。乘客到站內橙色WiFi熱點標誌附近，在手機的WiFi設定中選擇「MTR-FreeWiFi」網絡，就可享用免費WiFi上網服務。服務定有限制，每節可上網15分鐘，之後可再連線，每部手機每天可使用5節免費上網服務。
20130628-80,20130628,80,今日提醒你：　學生搞市集　售有機農耕,今日提醒你：　 學生搞市集　售有機農耕 想身體力行參與綠色生活的市民，明日下午可參加由中小學生出售的有機農作物市集。FedEx與珍古德協會共同籌辦「FedEx綠遞小學堂」教學計劃，明日下午2時至5時於黃金海岸舉辦有機市集，一班中小學生會出售親身種植及收割的有機農作物。該計劃有約200名來自香港4所中、小學，年齡介乎10至15歲的學生參加。今次市集的全數收益將撥歸4所參與學校作環保教育用途。
20130628-81,20130628,81,江湖滾熱辣 - 尊子,江湖滾熱辣 - 尊子 尊子
20130628-82,20130628,82,隔牆有耳：記者追訪到陸羽　肥佬黎請食蝦餃 - 李八方,隔牆有耳： 記者追訪到陸羽　肥佬黎請食蝦餃 - 李八方 雖然呢排針對壹傳媒嘅暴力事件一宗接一宗，但無損老闆黎智英嘅心情，每朝如常去中環陸羽茶室嘆茶，日日都惹嚟傳媒追訪。自稱唔係「神探」嘅肥佬黎，近排冇搞gag，但一樣有驚喜畀記者。 話說噚日朝早約6點15分，肥佬黎由司機載往陸羽飲茶，八方同事同其他傳媒如常喺門口守候，其間陸羽一名點心師傅走出嚟吹水，記者相信係隨口問句：「啲點心好唔好食？」佢即係話：「叫你老細請你哋食啦！」 冇上頭批准 行家唔敢食 點知呢位師傅入番酒樓後、即刻出嚟同記者講：「你老細叫你入去坐低食。」查實在場唔只《蘋果》記者，行家梗係面面相覷唔敢行動，師傅見記者郁都唔郁，咪返入去陸羽囉，一分鐘後又出嚟同記者講：「真係唔係講笑……」 話音未落，肥佬黎親自推門走出來嚟落單：「你哋食乜嘢呀？」太錯愕下，成班記者冇反應，肥佬黎就親自發辦，對酒樓職員話：「蝦餃、燒賣，整多籠叉燒包。」之後女侍應立即遞上兩盒點心，由於未經上頭批准，有行家冇接受肥佬黎好意，八方同事就卻之不恭，仲老實不客氣打包。據知三籠點心約120蚊，當然肥佬黎埋單啦。 mailto:pf_lee@appledaily.com
20130628-83,20130628,83,隔牆有耳：禍港聯盟　銅記橫行 - 李八方,隔牆有耳： 禍港聯盟　銅記橫行 - 李八方 嘩嘩嘩，打到嚟嘞！噚日落過銅鑼灣嘅市民，都會目睹以「呃人MAN」為首領嘅「禍港聯盟」，大模廝樣喺銅記橫行。其實呃人MAN一早抵達香江，早前仲喺港鐵巡遊，慌死人唔知佢已經入侵香港。 噚日佢團隊另外四名成員，終於殺到嚟：公安大隊長禿鷹殺氣騰騰、商膠人張震遠一身慘「綠」、笨忍光攞住碌棍想斬港台、吸血鬼貪湯茅台不離身，個個造型驚嚇。 唔少路過市民將佢哋嘅惡形惡相影低，放上網公諸於世。原來呢班禍港聯盟，7.1會喺白鴿黨攤檔佈陣，同遊行市民正面交鋒，一班白鴿仔號召全港市民7.1上街，齊齊趕走禍港壞蛋。佢哋仲製作咗限量五千份「禍港聯盟」摺紙卡，畀市民將一班壞蛋玩弄於股掌之上，宣洩一番。
20130628-84,20130628,84,隔牆有耳：葉劉教英文　500蚊12堂 - 李八方,隔牆有耳： 葉劉教英文　500蚊12堂 - 李八方 英文講得好，肯定有前途。喺美國浸過鹹水嘅新民黨葉劉淑儀，學成返港出過唔少書教英文，今個暑假更加親身上陣，開班授徒教英文。當然佢唔係去補習社做兼職啦，查實係佢創立嘅匯賢智庫學苑，今年再開暑期班，500蚊12堂，畀高中生報名，賣點係有黨內星級導師教授中、英及時事課等。如果學生嚟自清貧家庭，會獲學費減免。 唔單止葉劉會重點教Critical Reading，佢嘅寶貝女Cynthia亦會上陣教英文。葉劉話呀，時事課都會講公民抗命㗎，但就唔會具體講佔中囉，佢仲賣花讚花香，話上年嘅中文暑期班，貼中過公開試嘅課題㗎。有興趣跟葉劉學雞腸，要去呢個網址報名嘞： http://www.savantas.org/SLAA/。 
20130628-85,20130628,85,隔牆有耳：老董人脈勁　宴請謝長廷 - 李八方,隔牆有耳： 老董人脈勁　宴請謝長廷 - 李八方 董建華卸任特首後仲威過以前，除咗搞中美關係出色，就連台灣嘅人脈網絡亦好勁，連民進黨前主席謝長廷訪港，都應邀同老董開餐。中央社報道，台灣維新基金會29同30號喺香港舉辦「兩岸關係的發展與創新」研討會，協辦單位係大陸嘅中國社會科學院台灣研究所。謝長廷係基金會董事長，所以會同台灣立法委員及學者一齊嚟香港開會；原來老董已經book定今晚宴請謝長廷等貴賓。報道特別提到老董父親董浩雲嘅家族成員，曾高調公開佢哋親台及中國國民黨嘅政治傾向，而且董建華嘅胞妹董小平當時喺台灣住過，力證老董同台灣有淵源。
20130628-86,20130628,86,八方人物：為下一代撒環保種子,八方人物： 為下一代撒環保種子 繁華大都會背後，地球付出很大代價。名導演林超賢、音樂人金培達及陳少琪等八個來自不同領域的本港創作人兼藝術家，下月聯手炮製《生息藝術展》，透過不同形式創作，找出自然與發展的平衡點，希望種下的一粒環保種子。 《生息藝術展》早於北京、上海展出，為何第三站才回歸香港？展覽策劃人、前商台高層楊素珊（Susan）聽罷激動說：「你估我哋唔想（早啲搞）呀？」政府場地少、租場費高，覓地辦展覽有難度；若非有心人免費借出場地，這次亦難成事。 帶梁詠琪「垃圾雞」遊世界 Susan笑言這班「六十後」中年有火，自自然然埋班「做啲嘢」。其中金培達透過攝影與音樂，將時空定格，感受大自然的永恒；陳少琪作品的主角，是歌手梁詠琪多年前從米蘭帶回來的一隻「垃圾雞」，他帶「牠」走遍世界各地留影，證明廢物也很美。另一策展人、畫家陳竹君創作的「尋找方舟」系列，由一棵大樹作主軸連繫，每幅畫都有一隻危種或瀕危動物，「動物嘅生存同我哋息息相關」。攝影師鄧鉅榮在堆填區、回收場整天擺放攝錄機，紀錄垃圾的命運，帶出源頭減廢的重要性，成就《物流．勿流》短片。 Susan指「生息」就是呼吸生命，希望作品能喚起保育的重要，她創作了一系列不同速度看風景的畫作，「80km嘅速度快到睇唔到；50km，事物清楚番啲、色彩亦更多；20、30km就睇得更清。」今次展覽燈箱所需的電力，均來自四部動力發電的健身單車，參觀者欣賞展品之餘，可即場踩單車，身體力行撐環保。記者：陳雪玲 生息藝術展詳情 地點：太古坊ArtisTree 日期：7月5至29日（11am-7pm） 參展藝術家：楊素珊、陳竹君、林超賢、鄧鉅榮、金培達、陳少琪、翁狄森、郭遠堅
20130628-87,20130628,87,沙膽虹手記：站出來再締造歷史 - 沙膽虹,沙膽虹手記： 站出來再締造歷史 - 沙膽虹 二○○三年七．一前夕，正值香港剛經歷沙士和樓市近八年浩劫，董建華仍不顧民意，硬推二十三條立法。肥佬黎當天傍晚從台灣返港，叫了沙膽虹和尊子等一眾，到《飲食男女》介紹的一間在竹園的街邊檔打冷舖晚餐，聲言翌日七．一遊行一定會去，《壹週刊》當期提前出版，以蛋糕擲董建華當封面，還印製海報在維園派發，肥佬黎即時「柯打」加印，更表示如果二十三條通過，《蘋果》和《壹週刊》都由他當總編輯。結果翌日50萬人上街，大家身水身汗在銅鑼灣等進入維園，北京嚇了一大跳，接下來是田北俊轉軚不支持二十三條，董建華兩年後腳痛下台。 今年七．一前夕，梁振英上任特首滿歲，其間施政搖擺，用人唯親，僭建風波致誠信破產，不守承諾和罔顧民意，遲遲不就二○一七年普選展開諮詢，中央官員更不斷放風，對承諾香港人的普選設限。7月1日，請香港人都站出來，再一次嚇北京一跳，叫那些來港收風預告上街人數不多的人大跌眼鏡，再一次締造歷史。 我是香港人，我要真普選！ 沙膽虹 twitter賬號：khcheung1
