key,date,article_daily_id,title,text
20130628-0,20130628,0,演藝畢業禮　學生倒梁,演藝畢業禮　學生倒梁 【本報訊】在台上我覓理想！演藝學院昨舉行畢業禮，畢業生在屬於他們的舞台上，以豎中指、打交叉手勢、大叫689下台等方式招呼梁振英。台下有畢業生一面流淚一面高呼「我要真普選！」贏得全場掌聲。畢業生說：「若為了維穩而向一個失格無恥之徒彎腰，對不起，我們都做不到！」畢業生帶淚示威，梁振英則笑言會與「我哋嘅青年同學們，一齊去達致呢個目標（普選）。」 記者：彭美芳　翁煜雄 梁振英昨首次以校監身份出席院校畢業禮，演藝學院畢業生早在一個多星期前，設立facebook群組「演藝畢業生好好招呼689」，籲以不同方式，表達學生不歡迎梁振英參加畢業禮的信息。 特首辦昨安排約十多名穿黑色西裝、身形魁梧的保鑣把守梁振英入場的紅地毯範圍及玻璃門，又把守記者區，不容記者離開，並不時討論一旦遇上示威者的應變方法，學校範圍也停泊警車戒備。演藝校園保安則沒明顯加強。 戲曲、舞蹈、戲劇、電影、音樂及舞台製作六大學院共約250名學位、碩士、文憑等畢業生出席畢業禮，其中戲劇、電影及舞台製作學院的畢業生最敢作敢為，施以「突襲」，所有學生的抗議行動順利完成，無人干預。 齊心高呼：我要真普選 七名戲劇學院的畢業生先預備好台辭，有人高呼：「搞藝術嘅加油」、「我愛戲劇」、「爹哋媽咪我畢業啦！」代替向梁振英鞠躬。 電影電視學院畢業生最齊心爭普選，36名畢業生中有27人拒絕向梁振英鞠躬。主修導演的畢業生掀開畢業袍，以臀部朝向梁振英；也有碩士畢業生向梁雙手打交叉說不，不歡迎他參加演藝的畢業禮；有畢業生背向梁振英、面向觀眾高呼：「我啲時間係咁用㗎」，然後向台下鞠躬，以表達不應費時向梁鞠躬。當梁宣佈向電影電視學院畢業生頒發學位時，約20多人舉起標語及高呼：「我要真普選！」有學生一面流淚，一面高叫爭取普選的口號，學生的聲音蓋過梁振英的宣佈，也贏得全場掌聲。 音樂學院78名畢業生中，僅6人無向梁振英鞠躬，其中主修小號的畢業生向他行三鞠躬，聲樂的男學生以拉布式步法向老師鞠躬，而主修弦樂的同學向梁高呼：「689下台！」有65名畢業生的「舞台及製作藝術學院」有一半學生向梁振英「說不」，雙手在胸前打交叉作無聲抗議。有同學更在台上豎中指，梁振英仍保持笑容，在旁的老師目瞪口呆。女生向梁遞上「平反六四」標語，她說：「已有同學爭取普選，咁我就負責要求平反六四！」 拒絕向失格之徒彎腰 典禮上總共約60多人以不同方式向梁表達不滿，facebook「演藝畢業生好好招呼689」群組版主吳家進在台上向梁行三鞠躬，吳說：「佢（梁振英）對香港人好唔尊重，因他低票當選，欺騙香港人，做假承諾」。吳在群組重申，「我們因為夢想而加入演藝學院大家庭……為的可能就是在台上得到台下認同掌聲。若是為了維穩而向一個失格無恥之徒彎腰，對不起，我們都做不到！」 吳揭露校方因得知同學自發「招呼」梁振英，多次訂下新規矩，包括要求畢業生在台上向梁振英90度鞠躬，限制在六秒內走過台。吳家進重申：「學生最美好的回憶就是由我們決定誰為畢業生扑頭，而這個人絕對不是梁振英！」 梁振英在會後回答記者四條問題，首先回應演藝畢業生台上表現，他說：「唔同嘅同學有唔同嘅表達，有啲企定定、三鞠躬，有啲行過點頭，亦有一啲表達訴求，要求真普選。」他指日後「一定會同各界人士，包括我哋嘅青年同學們，一齊去達致呢個目標。」校方重申，期望學生珍惜難得讓親朋見證的時刻，尊重隆重的場合，校方並無對示威學生作出任何負面評價。 有料放？想收料？入嚟【蘋果互動】啦！ 【蘋果互動】是蘋果日報與讀者緊密互動、放料及收料的聚腳地。  http://fb.com/AppleDailyExchange 
20130628-1,20130628,1,畢業生抗議梁振英　黃秋生為學弟妹感驕傲,畢業生抗議梁振英　 黃秋生為學弟妹感驕傲 【本報訊】演藝學院畢業生抗議特首，獲校友及文化界力撐。榮譽院士兼校友黃秋生讚揚學弟學妹勇於表達意見，「呢啲（學生）將來做特首㗎。」教職員舒琪認為學生屢向特首示威，顯示民怨瀕臨爆煲。有指學生不尊重典禮，文化界不以為然，「搵個咁嘅特首主禮，都係唔尊重學生喎」。 「一年就搞到咁都幾大鑊」 「幾好吖，後生仔唔做呢啲嘢，唔通幾十歲先做呀？」黃秋生坦言為學弟妹感到驕傲，笑指批評者多是年紀較大，「係老鬼嚟啦，冇幾何（參與典禮），就死喇。」他說年輕人應該勇於表達意見，「中國人講究剛毅木訥，只係要求好似一碌木咁。」 至於有學生疑舉中指，他說是個人修養問題，「但又唔係乜（大問題），好多rocker都咁。」 梁振英上任一年，社會怨氣甚大，黃秋生說：「一年就搞到咁，都幾大鑊。」他又認為特首只聽命中央，像斯諾登事件，「佢（特首）係一個副導演，執行導演都唔係，拍劇改對白要打電話同老闆申請，自己冇權㗎」。 「呢個係學生嘅畢業典禮，佢哋有自由咁做。」演藝學院電影電視學院院長舒琪說，事前不知悉學生行動，但不會阻礙學生。他說近年學生屢向特首示威，顯示社會已有問題：「我都唔係好滿意政府整體表現。」他說7.1會遊行。 「學校搵個咁嘅特首主禮，都係唔尊重學生喎。」新晉導演盧鎮業稱，「當年我哋畢業都想做，但最後都冇做到，好佩服佢哋。」他早前獲藝發局頒發電影新秀獎，上台後讓出得獎發言時間予碼頭工人阿四宣讀工人理念。 盧鎮業指演藝文化界對政府的不滿並非朝夕，政府缺乏持續文化政策，令藝術家難以發揮，藝術家申請資助更是難於登天。 於傑青頒獎典禮向特首送上說謊長鼻木偶的好戲量主席賴恩慈，讚揚學生有藝術家的風骨，不懼強權。她認為尊重是雙方的，若市民訴求不獲重視，盲目尊重強權，只是恐懼、獻媚。
20130628-2,20130628,2,訪大專屢遇示威,訪大專屢遇示威 【本報訊】特首梁振英任內屢遇學生示威，成為學界不受歡迎的人物。上月他到訪明愛白英奇專業學校時，20多名學聯成員靜坐抗議，最後由近百警員暴力清場，有女學生更遭警員「熊抱」。其後出席城市大學新學術樓開幕禮，亦曾被30名城大學生狙擊，最後要經垃圾房逃走。由於下半年是各大學的畢業禮，身為校監的梁振英出席時勢必遇到更多示威。 下半年勢遇更多抗議 梁振英每次到訪學校，幾乎次次也遇上學生請願。去年11月，他出席城大學位頒授儀式，近10名城大學生要求他豁免長者生活津貼的資產審查；梁振英上月再訪城大，城大生要求他介入貨櫃碼頭工潮；梁其後參加明愛白英奇專業學校活動，學聯成員要求他就政改表態：去年仍然肯接收請願信的他，今年卻對示威學生充耳不聞，並且出動警方和保安暴力清場，乘車絕塵而去。 學聯秘書長陳樹暉批評，梁振英對示威學生的態度日趨惡劣，激起更多院校學生自發抗議，陳樹暉說：「佢對學生可以不聞不問、直行直過，任由保安向學生衝撞都唔理。」他估計下半年梁振英以校監身份出席大專院校畢業禮時，勢必面對更多學生巡迴示威。
20130628-3,20130628,3,指大學校長認同不保佔中學生李國章遭港大科大踢爆講大話,指大學校長認同不保佔中學生 李國章遭港大科大踢爆講大話 行政會議成員李國章指稱港大和科大等五間大學校長，均贊同不應用公帑幫助因參與佔領中環行動而被拘捕的學生。港大和科大昨發聲明，重申一直以來當學生有需要時，會提供適當協助，間接否定李國章嚇人傳話，也揭示這位曾出任中大校長和教育統籌局局長的梁粉，也是大話精。 記者：倪清江　蔡建豪 左報《大公報》及《文匯報》昨引述李國章報道，指他早前與港大、科大、浸大、城大和公開大學校長聚餐，席間他問及五人如有學生偷取店舖物品，校長會如何應對，是否會擔保學生，李引述五人均稱不會；他再問五人，「那麼為甚麼（學生參加）佔中，你們又保？還要用公帑來保？」 《大公報》報道稱「幾位校長均認同不應動用公帑擔保以身試法參與佔領中環行動的學生」，《文匯報》則指「（李國章）又透露多位大學校長都同意有責任讓學生了解犯法後果，但倘學生依然執意犯法，校方決不能護短」。李國章未有回覆。 五校龜縮不回應 港大昨重申，大學和徐立之一貫尊重學生參與活動、發表言論等的自由和權利，「當學生有需要時，學校會考慮具體情況，提供輔導與協助」。科大發言人承諾「大學盡力維護師生，按情況提供適時及適當的協助」。浸大稱鼓勵學生以理性態度參與活動。中大發言人昨稱支持大學成員有表達不同意見的自由。 至於「梁粉」城大校長郭位、公大校長梁智仁昨一齊「鵪鶉」，未有任何回應；沒出席的嶺大、理大和教院都不回應。梁粉嶺大候任校長鄭國漢早前曾表示，「對於佔中，唔同人事唔同解釋，現時不應表態」。 佔中發起人之一、港大法律系副教授戴耀廷指出，李國章將佔中違法等同盜竊罪行，講法絕對錯誤，「佔中目標、目的同一般違法行為唔同，有少少常識都知，佔中係公民抗命。」他表示，院校會否為參與佔中而被捕學生，是另一回事，他們正招攬義務律師團，日後為佔中人士提供協助。 另一發起人、社會學系副教授陳健民批評李國章比喻是惡劣攻擊，「盜竊係基於個人利益去損害他人利益，和平佔中係公民抗命，係為香港爭取民主、抗議不公義制度，唔係基於個人利益。佢咁講一係代表無知，一係響應有組織對佔中攻擊。」陳表示若五位校長果真表態認同李國章講法，令人憂慮大學前景，「大學應係鼓勵學生有理想，如果校長都帶住咁嘅層次去睇公民抗命，將佔中等同盜竊，好擔心將來大學裏面，點樣鼓勵學生關心社會。」 有料放？想收料？入嚟【蘋果互動】啦！ 【蘋果互動】是蘋果日報與讀者緊密互動、放料及收料的聚腳地。  http://fb.com/AppleDailyExchange 
20130628-4,20130628,4,學聯前秘書長斥李荒謬,學聯前秘書長斥李荒謬 「李國章為虎作倀，威脅各大校長對為真理、大義、社會付出嘅學生嚴謹懲處，係枉為人師表！」前年因衝擊遞補機制論壇，最終被判刑三周的前學聯秘書長陳倩瑩狠批，李國章將參與佔領中環與店舖盜竊相提並論，是一個荒謬的比喻。陳倩瑩更直言，如果將來有學生因佔領中環被捕，各大學校長應挺身而出，捍衞學生權利。 陳倩瑩今天仍就三周刑期排期上訴，她已有心理準備面臨「留案底」。她昨日知悉李國章的言論後非常氣憤，「好彩佢𠵱家唔係校長」。 陳倩瑩回想當日被捕時，中文大學校長沈祖堯曾經公開表態，願意私下為她提供法律費用等援助，中大校務處也一直跟進協助，了解她是否有足夠金錢打官司及有否生活需要。 倡效蔡元培保護學生 陳倩瑩又反駁李國章，指李將參與社運及偷竊比較，是非常荒謬，連學生站出來是為個人或社會整體也混淆。她批評李國章有政協身份，以接近恐嚇的手段向大學校長施壓。 反觀在民國時代，前北京大學校長蔡元培當年面對北洋政府鎮壓，仍挺身營救學生。陳倩瑩認為，即使將來有學生因佔領中環被捕，各大校長更應以蔡元培為榜樣，挺身捍衞學生的權利。 2000年兩度因參與社運而被捕、前港大學生會會長張韻琪憶述，當年是法律學院的教授及人權律師義務協助學生，如提供法律意見及免收律師費用。 張韻琪強調，大學根本沒有以公帑保釋學生，她表示：「係自己畀錢保釋自己。」
20130628-5,20130628,5,「倒扁」社運領袖：　佔中帶領中國民主發展,「倒扁」社運領袖：　 佔中帶領中國民主發展 【記者林俊謙報道】曾透過非暴力抗爭運動，廢除台灣思想罪惡法及「倒扁」的台灣社運人士簡錫堦，對戴耀廷等人發起的和平佔領中環運動充滿期望，認為香港若能透過和平佔中落實真普選，將對中國民主發展產生指標性作用。簡錫堦又指，台灣人一直關注香港民主發展，若然特區政府暴力鎮壓和平佔中，誓必激起台灣人民反感，「要求台灣獨立聲音就會更強」。 倘鎮壓誓惹台灣人反感 百萬人民倒扁運動執行副總指揮、台灣資深社運人士簡錫堦上周來港，主持「非暴力抗爭訓練」課程，並接受本報訪問。 早年曾採取暴力抗爭，上街投擲氣油彈的簡錫堦，90年代起開始改為奉行「非暴力抗爭」，認為暴力只會帶來社社會恐懼，累積社會仇恨，與社運爭取建構美好社會目標背道而馳。 非暴力抗爭則能透過不傷害他人的手段，如靜坐抗議、癱瘓交通、拒絕交稅等不合作行動，向當權者表達不滿，重創當權者管治合法性。 簡錫堦認為，港人經歷03年七一大遊行社運高潮後，運動因未能爭取07、08年雙普選一直走下坡，佔中運動最重要是重新鼓舞港人，令港人回復爭取普選信心，「佔中要重點這把火」。 佔中運動要成功，簡認為最重要是將非暴力抗爭變成運動信仰，加強落區接觸市民，向市民講解普選權與日常生活的關係，再定出港人相信可以落實的目標，「這樣即使官方不斷醜化運動，亦抵擋不了人民要求改變的聲音」。 對於和平佔中運動，簡錫堦坦言充滿期望，認為香港若能透過運動落實真普選，將對中國民主發展產生指標性作用，「香港是一個指標，可以帶領中國進步，帶領中國社會的穩定，中共用武力方式鎮壓或網絡控制，是不能長久的」。 簡錫堦又指，台灣人一直關注香港民主發展，若然特區政府暴力鎮壓和平佔中，誓必激起台灣人民反感，「只要政府用武力，台灣就更有正當性進行台獨運動，要求台灣獨立聲音就會更強」。
20130628-6,20130628,6,講故事傳授理念,講故事傳授理念 【本報訊】曾經帶領百萬台灣人要求陳水扁下台的簡錫堦，來港期間與香港社運人士分享非暴力抗爭秘訣。簡錫堦認為和平佔中要成功，最重要的是在運動期間，不斷透過故事教育參加者和平抗爭的理念和方法。簡錫堦強調，非暴力抗爭是對針對不公制度，而不是個人，因此不應對警察進行羞辱或挑釁。社運人士在衝破警方無理防線時，要以不傷害對方身體為目的，「這樣人民才會支持，運動才會有感染力」。 「跟當權者沒完沒了」 對於佔中運動期望有至少一萬人佔領中環，簡錫堦認為，必須防止政府派人滲透運動，煽動群眾作出暴力行為，令警方有使用武力的藉口。應對方法是在運動期間，教育參加者化身糾察，「旁邊有這樣的人煽動，就幫手把他鎮壓下來，可以抱住他，把他驅逐出去」。 簡錫堦又表示，佔中運動應保持靈活性，包括警方一旦封鎖中環，不讓佔中參加者進入，運動會有何對策。而非暴力抗爭除了堵路外，亦可有多樣性，包括癱瘓中環的銀行運作，最重要的是不傷害他人身體，令當權者知道運動不會輕易終止。簡錫堦說「非暴力運動最重要，就是跟你（當權者）沒完沒了」。
20130628-7,20130628,7,"賊黨勾結112食肆　干擾煤氣錶一條鐵線呃3,000萬元","賊黨勾結112食肆　干擾煤氣錶 一條鐵線呃3,000萬元 【本報訊】犯罪集團串同百多間食肆干擾電錶及煤氣錶，只用了一條幼電線，便成功令食肆交少3,000萬元電費及煤氣費。犯罪集團每次從慳回的費用抽佣高達三分之一作報酬，食肆以為除笨有精，但犯案兩年後被偵破，有食肆只「慳」了數個月，被揭發後要暫時停業一周拆錶，還要花錢打官司，得不償失。 記者：樊素心　羅日昇 去年一月，中華煤氣收到匿名信，指有集團聯同食肆干擾煤氣錶，煤氣公司於是報警。警方調查下發現原來犯罪集團只用簡單工具犯案，除煤氣錶外亦有改動電錶。警方其後拘捕114人，涉及112間食肆。 本案共牽涉10名被告，集團骨幹丘致中（38歲）、茶餐廳老闆畢偉業（67歲）及火鍋店老闆叢金貴（68歲）昨承認串謀詐騙罪，指他們於2010年中至去年8月中，調低食肆的電錶及煤氣錶讀數，令中華煤氣有限公司及中華電力有限公司少收費用。 慳食肆電費煤氣費 控方指，案中唯一女被告林麗（36歲）、丘致中及第三被告曾重光（60歲）屬主腦，林於2009至2010年間招攬丘犯案，曾則負責「拉客」找食肆落叠，集團每月向每間食肆收費2千至1萬元。丘在去年8月中被捕，他在警誡下稱，林的男友在2010年教他如何干擾煤氣錶。丘先用螺絲批在電錶及煤氣錶鑽出兩個小孔，再透過小孔穿入一條幼身的自製電線，調低錶內讀數。據悉，他會定時到訪食肆，待電錶及煤氣錶跳至某個高讀數時，再用電線將讀數調低，減少食肆須付的電費和煤氣費。 最初他拍住林往食肆改煤氣錶，每次只調低百多度，收取500至800元報酬。9個月後，他與林開始干擾電錶，通常調低約一萬度電，其後他單獨行事。 三人認罪做金手指 由前年9月至去年8月間，他曾更改逾68間食肆的電錶和煤氣錶。他向食肆收取慳回的電費煤氣費的三成作報酬。他靠犯案所得的收入由起初每月7,000至8,000元，升至後期約2萬元。警方在其寓所拘捕他時亦搜獲犯案工具及數簿。 涉案七名被告依次為林麗、曾重光、劉貴福、彭玉華、陳訓揚、李海輝及余金明，除今日認罪的畢經營的旺角豪園和深水埗雅軒，及叢在尖沙嘴的大叢火鍋店，其他食肆包括沙田的顯徑餐廳、深水埗的樂雅園餐廳等。案件下周二再提訊，三名認罪的被告將轉作「金手指」頂證其餘七人，待案件審畢後始判刑。 案件編號：DCCC462/13 部份涉案食肆 有料放？想收料？入嚟【蘋果互動】啦！ 【蘋果互動】是蘋果日報與讀者緊密互動、放料及收料的聚腳地。  http://fb.com/AppleDailyExchange "
20130628-8,20130628,8,犯案手法簡單　需具機械知識,犯案手法簡單　需具機械知識 【專家之言】 理大機械工程學系工程師盧覺強表示，根據案情所述之手法，涉案人士應該是在電錶或煤氣錶外殼鑽孔後，用金屬線撥弄錶內數字盤，令讀數暫停甚至倒轉。盧覺強指出，干擾手法看似簡單，但執行人必須具備相當的機械知識，了解錶內的零件位置。 中電及煤氣均以案件進入司法程序為由，拒絕評論犯罪集團更改報錶讀數的手法，但指破壞報錶可能會導致漏電或漏氣，呼籲市民切勿以身試法。 加強煤氣錶配件 中華電力發言人表示，已經採取措施防止同類事件再發生，包括日常運作中，抄錶員在抄讀電錶時，如發現電錶有異常情況，會立即作出跟進。此外，中電設有電腦程式偵察用電異常的情況，並且定期抽樣檢查電錶。中電亦歡迎各界人士，包括管業處及客戶作出舉報。 中華煤氣發言人則指，餐飲業屬於工商業客戶，抄錶密度高過住宅客戶，公司會敦促抄錶員詳細檢查，以確定煤氣錶有否受破壞。公司亦正研究改良煤氣錶的方法，加強裝置及配件，令器材難以被破壞。 《蘋果》記者
20130628-9,20130628,9,推銷員𠱁茶記老闆落叠,"推銷員𠱁茶記老闆落叠 【得不償失】 有份僱用犯罪集團的茶餐廳老闆畢偉業，昨受訪時坦言衰貪心，他憶述是一名賣米推銷員招攬他落叠，集團後來派人帶齊工具，只花了十數分鐘便成功改動煤氣錶。 「貪得少少，好唔抵」 根據畢今日承認的案情，指他去年3月至8月間干擾他兩間茶餐廳的煤氣錶，慳得47,909元及92,337元。但畢昨日在豪園向本報記者聲稱，只呃了兩個月。 他說犯罪集團在「做手腳」前後拍照對比讀數變化以茲證明。他聲稱只幫襯兩次，指對方幫他減了約200度煤氣，以每度煤氣費13元計，他省卻約2,600元。然後他要給對方一半費用作報酬。「點知慳咗個幾兩個月就俾人拉，衰貪心，貪得少少，只係搞咗兩次（改錶），好唔抵！」 他無奈指餐廳月租廿幾萬，煤氣月費亦要2萬多，餐廳因案需閉門一周讓煤氣公司換新煤氣錶，連同律師費，要花幾十萬元。另一被告叢金貴則在前年11月至去年8月間慳27.8萬元電費及煤氣費，叢每月付3,000元予犯罪集團作報酬。 《蘋果》記者"
20130628-10,20130628,10,蘋果真敢動　新App即時用,蘋果真敢動　新App即時用 《蘋果動新聞》iPhone App新版已經推出，居家遊行上街上網都咁方便，快啲更新，全民動起來！ 立即到App Store下載啦  http://bit.ly/appledailyiPhoneapp  有料放？想收料？入嚟【蘋果互動】啦！ 【蘋果互動】是蘋果日報與讀者緊密互動、放料及收料的聚腳地。  http://fb.com/AppleDailyExchange 
