key,date,article_daily_id,title,text
20130628-286,20130628,286,BIG SPENDER：Barbie芳華傳奇,"BIG SPENDER：Barbie芳華傳奇 2006年英國倫敦的Barbie拍賣會上，於1959年首次推出，當時售價僅3美元（約23.4港元）的Barbie「古董1號」（Barbie No.1）以2,800英鎊（當年約4萬港元）成交；一隻1965年出產的古董Barbie 「Midnight Red」更以破紀錄的高價9,000英鎊（當年約13萬港元）於同一拍賣中成交。古董Barbie收藏家、任職幼稚園校長的吳美嬌15年來花近百萬買下逾1,500隻Barbie收藏，專攻古董版及特別版的她更每年親自到世界各地尋找心頭好。 記者：黃子配　攝影：黃偉傑 自史上第一隻Barbie在1959年於美國紐約國際玩具展面世後，頭紮馬尾，戴上太陽眼鏡，穿上黑白斑馬紋泳衣的「古董1號」，首年推出就賣出了35萬個，54年來全球的Barbie產品售出超過10億盒，世界各地的Barbie收藏家超過十萬個。 任職幼稚園校長的會長吳美嬌自小已開始玩Barbie，1997年適逢Barbie官方網頁招收Barbie Fans Club亞洲會員，從美國邀請了一位Barbie收藏家來香港分享收藏心得，那時她首次見到不同的古董Barbie，復古的外貌和裝束讓她憶起童年時希望成為公主的夢想，於是就開始四處尋找古董版和特別版的Barbie。 古董3號　炒至萬元 凡於1959年至1970年出產的Barbie都可稱為古董，皆由日本製造，當中以首三年出產、實心物料製造，兼且由日本人親自繪畫妝容的「古董1、2、3號」最為珍罕，吳美嬌亦擁有幾隻「古董3號」，也是她收藏中歷史最悠久的，現時動輒都要逾萬元，「2003年美國經濟差，很多人都把珍藏多年的Barbie放到網上劈價出售，棕髮版『古董3號』當時只需400美元（約3,120港元）就買得到，我一共買了幾隻」。 大部份收藏她都會用膠箱收起放好，小部份最喜愛的則會放在學校辦公室或家中的飾櫃，方便隨時欣賞。因為Barbie臉上的妝容會因為長時間接觸燈光而褪色，所以她花2,000多元從美國訂了48個防UV的透明膠盒把這堆珍藏放好，又把它們的金屬耳環脫掉：「一定要除掉，否則會氧化令臉頰染上綠色，到時洗唔甩就大件事！」 美國日本　尋寶熱點 多年來Barbie出過不少特別主題的版本，由著名設計師Bob Mackie設計、一套10隻，每隻千多至四千元不等的「神仙系列」；一套3隻、每隻現值逾萬元的「宮廷系列」，她全都買齊，連1959至1970年出產，合共逾百隻的古董版Barbie，經她多年來在網上尋覓，除「古董1、2號」外，她都已經幾乎集齊了。古董Barbie要保值，包裝最重要，多年來她一直在尋找未被人修補過，狀態良好的原裝版本「古董1號」，「只要不超過5萬元都一定會買！」 1965年，Barbie官方曾推出名為「扭扭舞」版本，新面孔設計的Barbie，大眾只需拿個舊的Barbie就可更換新產品，令到很多早期的古董Barbie消失於市面，所以坊間有售的古董Barbie數量並不多，吳美嬌是透過eBay等拍賣網站或親自到美國、日本等Barbie集中地找到這些珍藏。 早期的Barbie主要在日本生產，日本人又保存良好，每年去兩次日本旅行的吳美嬌，每次都總會抽一至兩天去尋找珍罕的Barbie，東京中野、大阪等地都是她的尋寶熱點。幾年前她試過在北海道找到由日本著名時裝設計師Hiromichi Nakano於1986年設計，只在日本內銷的American Doll系列Barbie。 她又試過在崇光用399元買了一盒由日本設計師tokidoki為品牌LeSportsac設計、限量7,000隻的新款紋身Barbie，之後在網上發現同款產品竟被人炒賣至近400美元，立刻再跑去崇光多買八盒回家。 2009年國際品牌COMME des GARCONS分別在香港、日本及倫敦推出合共300隻、三款髮色不同的限量版玫瑰系列Barbie，每隻售225英鎊（當年約2,700港元），她立刻上網預訂買齊三款，「我立刻打電話叫在英國讀書的姪女坐車到倫敦幫我拿」。她甚至會連同幾個收藏家朋友專程走到內地找裁縫為各人的寶貝縫製合身的中國旗袍；全球首間Barbie旗艦店2009年在上海開幕，她也第一時間到當地朝聖；每逢到外地旅行，她又會四處尋找只在當地出售、服飾富有本土特色的限定版Barbie。 當她雀躍地道出不同年代的Barbie髮型及衣着時，我開始明白這隻僅高11.5吋、風靡全球半世紀的娃娃，最吸引之處未必是華麗的衣服和俏麗的外貌，而是凝望着她時，總教人懷緬起童年時的美好回憶。"
20130628-287,20130628,287,金融雲端：中資企業失落十大 - 丘亦生,金融雲端：中資企業失落十大 - 丘亦生 還不過幾年前，中國企業曾經雄霸全球十大市值企業席位近半。中石油（857）、中移動（941）、工行（1398）等，與微軟、蘋果、巴郡等咁高咁大，不經不覺，原來中資企業已大縮水，最新排名連十大也不入，仿如一個朝代的退潮，這會否預示了中國經濟正由璀璨變得黯然？ 工行市值排名　跌至13位 按照彭博社的最新統計，全球市值十大企業排行榜，中國企業全部出局，是2006年以來首次，其位置全部由美國企業進佔。變化最戲劇性的是中石油（857），它在2010年還是天下第一，但到今年5月時已經跌至第六，再經今個月的股災洗禮，市值再蒸發350億美元，排名急滑至第12名。工商銀行（1398）的市值，亦於今個月內急插水，排名跌至第13名。 這種剎那風光的遭遇，亦曾展現在日本企業身上。在1989年的全球市值十大排行榜上，日本企業同樣包辦了五位，在頭20位中更佔去14家之多。甚至連當年的富豪榜，日本富豪也佔據首十位中的六位。那種霸氣，連美國人也滿不是味兒。 我還記得，賣座系列電影《虎膽龍威》首集，那個假借恐怖份子身份打劫的大反派，目標大廈正是日本企業的總部。日本經濟之後如何，日本企業如何徹底緣盡於市值龍虎榜，相信毋庸我多說。 上榜靠政策　非企業成就 或許基於這個原因，令人不其然把中國與當年的日本作出比較，尤其是中國從超常規增長回歸恬淡的過程，會否出現股神畢菲特的水清才知誰裸泳的狀況，一些在高波踩油時不會浮現的問題，現在統統惡化，正如最近令人憂慮的影子銀行及地方融資平台，甚有當年日本外表無敵但暗病叢生的影子。 再加上，近期中國投資者在外掃貨逐漸心雄，對象由之前的名牌手袋，變成紐約地標商廈、或活化倫敦舊區的百億地產項目，甚至花幾千億元興建一條大運河，也面不改容。中國投資者買得性起，儼然當年日本人那種一擲千金的豪氣。 如果因此認定中國會步日本後塵，當然有點武斷，日本當年的泡沫非比尋常，日圓亦升值得過份，其生產力的高速增長亦走到了盡頭。中國當然也有自身的問題，但起碼經濟發展仍處於不同階段，而內地似乎明白經濟的消化不良問題，正動手合理化產業結構，不再一味追求高增長，GDP見七也可忍受。在這個大前提下，貨幣增長也相應採取較節制的取態，最近的信貸緊縮，雖然叫做由人行自導自演，但也可能預示貨幣政策的新常態。雖然今次中國式退市的後果，仍然頗不明朗。 其實，今次中資股失落市值龍虎榜，未必是壞事，從來這些排名就很飄忽脆弱，上了榜不代表你做得好，可能只是其他企業腳軟。正如曾經入圍的歐美銀行早已縱影全無，況且，之前上榜的國企全都有壟斷成份，上榜只說明市道好與利好政策帶挈，與企業本身的成就沾不上邊。 丘亦生 金融中心fan page:  http://www.facebook.com/hkfincentre 
20130628-288,20130628,288,中門大開：從未逝去的青春 - 添馬男,中門大開：從未逝去的青春 - 添馬男 內地電影《致青春》，故事雖然老土，但是食正懷念成長的感性市場，票房突破7億人仔。香港人在廿多年前，一樣浪漫青春，期望中國一天可以走向民主，故事充滿激情，可惜成長總是充滿荒謬、唏噓！ 八九六四是殖民地土生土長年輕人政治啟蒙，第一次上街呼叫「打倒李鵬」、「建設民主中國」，將香港與中國命運緊纏在一起，真心相信「中國冇民主、香港冇希望」。 內地與香港這股年輕改革力量，最終都沒有開花結果。內地經濟開放，政治封閉，一手軟，一手硬，將改革呼聲消融，九十年代再沒有政治改革爭論，知識分子下海經商，或投身文化產業，在官方框架內賺大錢。 只有香港六四一代緊緊不放，今年六四維園暴雨之下，我見到一張又一張廿多年前的大學同學面孔，大家打個招呼，笑容中充滿了無可奈何，因為我們都想起了89年5月20日晚八號風球在灣仔新華社的情景。 八十年代的年輕人，少年老成，一方面走出上一代六七暴動後對政治的恐懼陰影，我們經歷了港英地方行政改革，第一屆民選的區議會，開始留意論政團體的言論。中國內地走出文革，提出了四個現代化，視香港為改革樣板，當時我們相信香港未來是有希望。 今年7.1 預演佔中 我們的浪漫青春，曾在天安門廣場上張揚，也同時在89年黯然終止。六四之後投身民主派組黨，參與各級選舉的學聯同代青年人，沒有一個能夠在政治上大展拳腳，因為六四後，北京已對香港這「顛覆基地」處處設防，英國又左搖右擺，到92年拆毀直通車，95年才擴大民選，太遲了。 回歸後政制民生化牛步，殺死兩個市政局，政治空間進一步萎縮，更毀掉民主黨中生代出路，演變成黨內鬥爭分裂。 7.1遊行催生了另一個民主派政黨：「公民黨」，他們沒有甚麼支聯會六四包袱，加上大狀、知識分子、專業中產，一度令人寄予厚望，但實際上民主派只是「塘水滾塘魚」。十年間民主派分裂再分裂，支持民主派的群眾，因五區公投造成撕裂，也令他們無所適從。 可以說，廿多年前崛起的泛民政客，其政治熱情已燃燒殆盡，議會工作像返工。 曾支持民主回歸的中年人，也對停滯現狀感到遏抑，「佔領中環」運動出自戴耀廷、陳健民等溫和學者，是可以理解的；加上2009年六四廿周年，本土年輕人又再一次動員起來，去年學民思潮出現，成功領導反國教運動，群眾又再一次站出來，將政客拋到後面。 眾所周知，今年7.1是明年佔中預演，大家拿出年少青春的精神面貌來，維園見！ 青春不止是用來懷念的！ （7．1遊行十周年系列之十‧完） 添馬男
20130628-289,20130628,289,好不主席：甭說．上街 - 盧先亞,好不主席：甭說．上街 - 盧先亞 十年前的7.1，港人集結前所未見的公民力量，喝停惡法，展現了「香港（也有）好聲音」。同時，年輕的一代自六四之後，再一次大規模的參與社會運動，不但接下已然老化的民主棒，且同時踏上維權爭義的漫長鬥爭路。面對荒謬的社會現況及顢頇無能的政府，選擇沉默冷待似乎已不是良計，初生之犢的新生代已然承先，我們既是過來人更不能落後。 尤其今日，我們面對大話連篇且不以為恥的語言偽術當感厭倦；再者對日漸萎縮的新聞自由，以及與日俱增的白色恐怖同樣憤怒；更不用說對文革式批鬥的愛港力量完全發癲。而現有被蓄意扭曲，不公不正的政治制度根本無從反映民意，反之卻能充份下達京意。我們若然錯過了剛剛舉行的演藝學院畢業禮，未能學似畢業同學在台上親自向偽首以交叉手勢，以及倒豎拇指說「不」，那麼7月1日，我們的雙腳就是代表市民發聲的最佳渠道。 爭真民主及堅普選 至於建制派舉辦的「冇卵」音樂節、微恩毫惠購物節，其他大大小小的維穩載歌載舞活動，以至創業講座？！真係無所不用其極，如果以為用這些低智手段，務求分散市民注意，減少遊行人數，那未免太看不起香港人，以及低估了市民遏抑了多年心中的憤怒。 其實對我而言，7.1和六四沒有一樣，現在承載的已經不只是初衷。前者當年反的是廿三條，今天爭的是真民主和堅普選；後者當日反的是屠城政權，今日爭的是歷史公道和嚴拒「河蟹」的城池。所以有人詬病形式化、儀式化，這都不過是一些「具體」的表現，無關痛癢，重點始終在於透過實際行動去維護個人信念。情況猶如基督徒每星期都會番教會作崇拜，回教徒更要每日數次向聖城膜拜，這不是例行公事，而是堅定信仰的過程。 縱使過去十年，我亦有不在遊行隊中的日子；過去廿三年，也有未能手執燭光的晚上；人生這麼多年，更多的是想苟且偷安，得過且過。猶幸每年總有這「大時大節」，一個最好的機會讓人重新「決志」抖擻精神，方能為一些經年飽受恐嚇的「信念」繼續抗爭下去。 據天文台預告，7月1日該是烈日當空，氣溫高至33度，不過仍然無阻我那位既貪靚、且姿整的小秘Joycelyn的一份熱血，她還矢言走足全程，撐到底。她平日行山，都未見如此拼勁。 可見偽首過去一年「不會自滿」的成績表，實在激盪人心。既然小秘也「迎難而上」，我這位主席更是責無旁貸，義不容辭…… 今天除了7.1，沒啥好記，大後天除了上街，沒啥好做。 盧先亞
20130628-290,20130628,290,What we are reading：品牌突圍戰 - 余大千,What we are reading：品牌突圍戰 - 余大千 格蘭仕、Natura、ICICI、Havaianas、Herborist、Zuczug/這些品牌，你識得多少個？如果說這些新興市場正崛起的品牌，當中有些會成為明日的世界名牌，你又會否感到詫異？ 倫敦商學院教授Nirmalya Kumar與北卡羅萊納大學商學院的Jan-Benedict Steenkamp合著的新書《Brand Breakout：How Emerging Market Brands Will Go Global》，嘗試拆解新興市場為何在全球經濟上的重要性已無庸置疑，但說到打造行銷全球的品牌，卻幾乎交白卷，這當中有沒有甚麼必勝方程式。 本書提出了八條登峰之路，用以闡釋新興市場的企業，要突圍可以靠甚麼手段。說穿了其實沒有甚麼新意，但本書可說鮮有把這些途徑有條理地系統化，再加入不少案例，令可觀性大增。 揼石仔闖成功路 傳統上位之道，作者稱之為「亞洲烏龜型」，例子是昔日的日本車廠，以及今日的三星、現代，做法是穩打穩紥由低做起，先主打低檔廉價的出口貨，取得外國市場佔有率後，再慢慢把產業升級，這是「揼石仔」的策略，見效慢但風險相對較低，卻是亞洲不少企業的成功之路。 另一招打天下的法門，則是先B2B再B2C，先搶攻企業客戶再拓零售市場，例子是內地的華為，先以電訊設備起家，成功後再攻零售層面的手機。好處是先在商業世界中建立一定知名度及口碑，然後才殺入人生路不熟的消費市場。 較奇兵突出的是，先鎖定海外僑民作為踏腳石，再慢慢擴大戰線，如菲律賓的快餐連鎖店Jollibee，開始時先針對旅居海外的菲律賓人，利用這些基本客路在海外市場站穩陣腳，再擴大業務。 實力一時未有明顯勝算的，則要借力打力，利用發源地的優勢，如先爭取成為本土No.1（如空中巴士），再借此聲勢遠征；又或者利用本國的文化遺產或天然資源，建立與別不同的特色，增加外闖的勝算。 走捷徑可靠收購 如果甚麼優勢都缺乏，窮得只剩下錢；又或者想走捷徑，當然還有一招，就是收購外國品牌，例子是聯想（992）收購IBM的PC業務，光明食品收購英國早餐麥片生產商Weetabix。這種做法，快就是快，但很犯本，風險又高，而且能否成功融會成自己的品牌，也是未知之數。 創建國際知名的品牌，是否經濟發展的必需品？我認為不是，香港自家打造的國際名牌買少見少，數來數去五隻手指都數得完，但香港的經濟發展依然是國際前列，但一個做不起品牌的地方，至少說明它的產業缺乏某種競爭力，在品質、創意及經營模式方面，沒有突出的地方。 由此看，打造世界品牌，可說是一地產業的考牌試、成人禮。 余大千
20130628-291,20130628,291,毅行出哲學：休息治百痛 - 蔡東豪,毅行出哲學：休息治百痛 - 蔡東豪 一群跑步者聚在一起，談甚麼？不是互相吹噓跑得多快多遠，他們最清楚，一山還有一山高，多數在談受傷。難得遇到知音人，跑步者不會放過這機會，最想交換的資料，是這處痛那處痛應該怎辦，只有過來人才能明白這些痛。 我未遇過從未受傷的跑步者，不受傷通常是指這一刻沒受傷。受傷這件事，對跑步者是一個光譜，兩端是完全沒痛和痛到行路有問題，跑步者受傷狀況在光譜上遊走，分別是在光譜上哪一個位置而已。跑步者須接受，跑步是劇烈運動，受傷只能減少，不能避免。 跑步有一種懾人的魔力，或者是安多酚作崇，或者是跑步可影響性格，跑步者很多時非常投入，投入至偶而喪失理性分析能力。 跑步受傷性質通常是勞損，不像足球，兩個球員以高速相撞，引起即時創傷。跑步的傷，事前通常有徵兆，身體會告訴跑步者，不休息的話，小毛病會變成大問題。跑步者的傷，通常是因為跑步者過份投入，選擇不理會身體訊號。 身體有辦法處理 我是跑步受傷積犯，遇到友好跑步者，不放過機會知道別人處理受傷的方法。這些年，我累積不少心得。我發現共通點是，沒有單一處理方法，跑步者在不同方法中兜兜轉轉，醫心理多過醫腳。我發現真正答案是一個：休息。跑步者肯去求醫的好處是，求醫其間肯休息，真正妙手回春的聖手，通常不是醫生，而是休息。 我相信跑步是令跑步者身體更強壯的循環，跑步時操勞身體，跑完步休息期間，身體其實很忙碌處理跑步引起的一連串問題，但身體很有辦法，可解決大部分甚至全部問題，休息其實是身體自動處理毛病的過程。在這個過程中，跑步者身體變得更強壯。 受傷是因為身體短時間內無能為力，原因可能是問題過大，也可能是身體能力有限，總之，身體一時之間處理不來。 我相信有足夠時間休息，身體多數能找到方法處理，大部分受傷最佳治療方法，是休息。然而，越投入的跑步者，越不相信休息是解決方法，這些人停跑一日，心裏已「囉囉攣」。 跑步者不乏A型人，這些人時間表排得密麻麻，跑步也要事先悉心安排。A型人計劃了今日跑步，但身體感覺到痛，A型人會休息定照跑？今日不跑，擇日再跑的話，打亂計劃。A型人時刻控制自己生命，多數相信決心可戰勝受傷。 越有目的跑步的人，越容易受傷，例如跑步求健康和減肥的人。這些人發現跑步帶來受傷，心中會不忿，做一件令自己健康的事，竟令自己受傷，不信邪，繼續跑，最後越跑越傷。處理受傷，我最欣賞年長跑步者，這些看破世情的智者，只做令自己舒服的事，掌握休息的力量，他們在跑，因為跑得舒服。  http://www.trailwalkerasphilosophy.blogspot.com  蔡東豪
20130628-292,20130628,292,遊搜好行：七月大減價　齋攻東京,遊搜好行：七月大減價　齋攻東京 日圓兌港幣徘徊八算之間，然後港龍航空講明暑假會加開航班飛日本，你，是否已蠢蠢欲動飛身東洋大掃特掃？雖然經濟差，不少品牌早在六月中旬已開始偷步減價，但堅持七月先開始的，單是一間伊勢丹已夠你流血不止！仲等？出發啦！ 記者：陳劭敏　部份攝影：林栢鈞 大阪分佈唔夠集中 近來大阪力追東京成為港人最愛的日本城市，大阪站城、阪急梅田本店及關西巨Mall「Grand Front Osaka」相繼登場，打造超級Shopping地段，但偏偏Velvet主理人Iris還是鍾情東京，每年到大阪只約數次，但東京則每月最少兩次！點解？原來是貪東京夠集中！「喺東京，你去原宿搵唔到可以去新宿，再搵唔到就去池袋，掃貨地點相距唔遠夠就腳！」而且今年大阪大部份Mall六月已經減緊價，好多正貨都所餘無幾，去到可能仲失望！ 睇埋退稅覆蓋率 Iris指出東京店舖九成也有退稅優惠，反之大阪覆蓋率就不及東京多，當然5%不算大數目，但大手入貨的話也慳唔少！Iris大力推薦的東京商場包括丸井百貨，貪它用銀聯卡有額外95折優惠；其次的是原宿laforet、池袋的Parco及新宿的Lumine，皆因這些商場都有不少香港暫無代理的潮牌，由少女至OL都會搵到心水。大減價由各大商場領軍，至於去路面店掃貨，Iris最愛就是裏原宿及竹下通，想要特別的貨色則會轉戰代官山的小店。近年日本經濟差，不少潮牌在全國大減價前，都會率先在六月中舉行Pre-Sale，一般來說約有七至八折，像Iris這些月月到訪的VIP，部份品牌產品更會低至半價！ 至於大阪，Iris則會主力逛阪神及阪急，其中除了日牌以外，也會找到不少歐洲牌子的限定產品。不過她會更推介路面店如堀江橙街、心齋橋及梅田一帶的商店街，因為有較多獨特貨可以選擇！ 心水日牌推介 到日本掃貨當然要集中火力香港未有代理的品牌，以下四個日牌就是Iris的心水推介，她到當地入貨都例必狂掃！ Candy Stripper：在原宿、新宿My Lord及涉谷Parco均設有分店，品牌分可愛及搖滾風，以前者較受歡迎，主打甜美少女風，風格夠晒開心活潑！ 查詢： http://www.candystripper.net/  Franche Lippee：在丸井百貨及原宿laforet都可以找到品牌身影，被稱為Tsumori Chisato妹妹牌子，風格與TC相近，但價錢則平一半有多！ 查詢： http://franchelippee.com/  Fur Fur：屬較貴價的高檔日牌，在日本除了時裝亦有做婚紗，Lace是品牌的撒手鐧！品牌在涉谷Parco及原宿laforet均有分店。 查詢： http://www.furfurfur.jp/  Muchacha：古靈精怪牌子，BB頭、小貓及蘑菇都是品牌標誌，愛玩趣怪插畫及Pattern；早前推出的「頭髮袋」是品牌得意作。於原宿及新宿Lumine有店。 查詢： http://ahcahcum-muchacha.jimdo.com/  攻略貼士 綜合減價網Tokyo Bargain Mania專家意見，近年大公司減價日期走向兩極化，前半組如高島屋的早在六月已開波，而後半組又推遲到七月中才開始，由於近年一開始減幅已達30-50%，要執好嘢（因為貨量有限），一定要減價第一日就去搶，如果現在才計劃出發，齋攻屬後半組的公司如伊勢丹就夠！ 新宿伊勢丹 日期：7月17日起 查詢： http://www.isetan.co.jp/icm2/jsp/store/shinjuku/index.jsp  大丸東京店 日期：今日起至7月2日 查詢： http://www.daimaru.co.jp/tokyo/index.html  原宿laforet 日期：7月25日至29日 查詢： http://www.laforet.ne.jp  丸井百貨 日期：今日起 查詢： http://www.0101.co.jp  新宿Lumine 日期：7月12日至16日 查詢： http://www.lumine.ne.jp/shinjuku  池袋Parco 日期：7月4日至22日 查詢： http://www.parco.co.jp/parco/ 
20130628-293,20130628,293,眼睛想旅行：杜拜全新扭麻花高樓,眼睛想旅行：杜拜全新扭麻花高樓 杜拜又有摩天大廈剛落成，高310米、共75層的卡延塔Cayan Tower，由卡延集團（Cayan Group）耗資達81億美金、花八年興建，特點是90度扭曲旋轉外觀，成世上最高螺旋建築，屹立於杜拜碼頭，鳥瞰人工運河和波斯灣靚景。卡延塔由Skidmore Owings and Merrill美國公司操刀，設計靈感源自人體DNA的雙螺旋結構，每層樓作1.2度旋轉，到頂樓累積90度轉角的扭麻花外形，是杜拜海濱區全新地標。 記者：孔詠詩 網址:  http://cayan.net  
20130628-294,20130628,294,眼睛想旅行：幾米廣場　今日正式開幕,眼睛想旅行：幾米廣場　今日正式開幕 純面積逾四千呎的幾米廣場於今天正式開幕，原址為荒涼的鐵路局舊宿舍，現變革成客運轉運中心；經幾米的魔術手一揮，帶來三套繪本的1：1真實景場，包括《地下鐵》的行李箱、《向左走·向右走》的男女主角及《星空》的飛天公車。消息流出，有不少台妹港女已率先抵達宜蘭，先睹為快，有傳幾米大師亦會現真身，定必讓粉絲興奮不已。 記者：符樂 網址： http://www.jimmyspa.com 
