key,date,article_daily_id,title,text
20140820-159,20140820,159,傳iPhone 6充電線可兩面用,傳iPhone 6充電線可兩面用 新iPhone 6盛傳下月面世，除了採用較大的屏幕外，據說還可能推出新USB充電線，插頭均可正反兩面用。 在澳洲的蘋果線人迪克遜上載一張疑似新iPhone充電線相片（圖），相中的USB插頭中間有一個「懸浮」裝置，充電線兩頭都可以雙面使用。專門報道蘋果最新產品的網站MacRumours指，新充電線將採用USB 3.0技術，支援高清音頻，意味蘋果的耳機將會升級，並會使用iPhone的充電插口連接耳機，取代傳統的耳機槽。 英國《每日郵報》
20140820-160,20140820,160,空中逃脫計漏風勢魔術師燒傷兼甩臼,空中逃脫計漏風勢 魔術師燒傷兼甩臼 英國西約克郡一名穿著約束衣的魔術師，將自己倒吊綁在著火的繩索，表演空中逃脫，豈料強烈風勢，令繩索被預期中燒得更快。幸好最後魔術師成功逃脫，只是被輕微燒傷，以及右手脫臼。 布里頓（Antony Britton）本月初為Escape for Life活動表演，希望為多發性硬化症的慈善組織籌款。他穿著約束衣倒吊在9米半空，火快速燒著繩索。豈料當日非常大風，令原本應該60秒才燒斷的第一條繩索，快了15秒斷，第二條繩索也在10秒後斷掉，而燒斷跌下來的繩索，更燒傷了他。為了表演成功，他不停想擺脫約束衣，豈料弄甩右手的臼，幸好最後有驚無險。 英國《每日郵報》
20140820-161,20140820,161,傷口未埋口就拆線師奶切除子宮變爆肚,傷口未埋口就拆線 師奶切除子宮變爆肚 英國漢普郡一名太太剖腹接受子宮切除手術後，肚皮傷口在10天後拆線，豈料傷口原來未埋口，突然爆開，但救護車服務卻將事件列作非緊急，令她苦等逾5小時才接受治療。 34歲巴特利特（Clair Bartlett）於上月26日接受子宮切除手術，由於她不良於行，若按慣常做法分兩次拆線非常不便，因此10日後醫生建議她將縫合傷口的線一次拆走。 在巴特利特拆線回家後一小時，肚皮上、9吋長的傷口竟然「像拉鍊爆開」，血肉清晰可見。丈夫立刻報警，接線生表示已派出救護車，並叫他先固定傷口。 但由於當局將個案列為非緊急，救護車要一個半小時到達，將巴特利特送到醫院後，又讓她等了四小時才為進行治療。她的傷口因感染無法再縫合，要治療3周才康復。她的丈夫對於妻子經歷不必要的痛和創傷，感到非常憤怒，考慮採取法律行動；而醫院則為雙方溝通出現問題而道歉。 英國《每日郵報》
20140820-162,20140820,162,新婚夜會前度醋男怒燒死新娘,新婚夜會前度 醋男怒燒死新娘 俄羅斯一名新娘，因「爛瞓」新郎在婚宴上睡著，憤然去找舊情郎。新郎還以顏色，當晚淋酒精燒死她。 27歲的菲利波娃（Veronika Filippova），80%皮膚燒傷，送院搶救無效死亡。 30歲新郎庫茲曼（Ivan Kuzmin）承認謀殺，已經被伏爾加格勒警方拘捕，面臨15年監禁。 菲利波娃一時意氣，婚宴後去找舊情郎，「激」庫茲曼，後來良心發現，向庫茲曼招認一切，卻引起庫茲曼不滿，趁菲利波娃熟睡時，向她淋酒精，再點火燒她。 菲利波娃的親友指庫茲曼曾因企圖謀殺和企圖強姦未成年少女入獄，卻一直隱瞞菲利波娃，故燒屋掩飾罪證。 英國《每日郵報》
20140820-163,20140820,163,環現夜空　德州又見UFO？,環現夜空　德州又見UFO？ UFO到訪美國德州？德州侯斯頓 (Houston) 部份居民表示在周一（18日）看見一個光亮的橢圓形在上空盤旋，紛紛把照片上傳到Twitter，專家仍未解開神秘物謎團。 侯斯頓自然科學館天文學副館長薩姆納斯 (Carolyn Sumners) 坦言，不少人第一時間聯想到外星生物，認為各人上傳相片有助解開謎團，她說：「如果那是實體，越多人從不同的方向看到它，越能夠幫助我們解釋那是甚麼。」 雖然她認為，現象或因惡劣天氣引起，不過她也承認：「總有一些東西是我們不能解釋的，所以讓人感刺激。」 英國《每日郵報》
20140820-164,20140820,164,cute爆芝娃娃天生兩腳無有怕,cute爆芝娃娃 天生兩腳無有怕 特貝寶 (Turbo-Roo) 跟其他芝娃娃一樣喜歡玩耍，不同的是，牠天生少了前腿，幸得到好心人收養和為牠度身打造一輛助行四輪車。 由於原本的主人要照顧特貝寶的母親和其他小狗，無法特別照顧牠而被棄養，然而獸醫助理蘆珀 (Ashley Looper) 覺得牠很可愛，於是收養牠，「因為之前曾照顧有特別需要的寵物，所以我知道怎樣照顧牠，我跟牠是完美組合。」 住在美國印第安諾波利斯 (Indianapolis) 的蘆珀用玩具為特貝寶造了助行卡車，但蘆珀亦深明隨著特貝寶日漸長大，牠需要一些較耐用的器材，於是替愛犬在網上籌款。 想不到網民的反應遠比她想像的熱烈，最終籌得3629美元（約2.8萬港元），是原來目標的5倍，更有一名來自立體設計公司的員工迪里克 (Mark Dewrick) 不收分文，為2個月大的特貝寶度身造出一部四輪車，原理是用索帶將車輛固定在牠的身上。 蘆珀表示特貝寶現在變得活躍，「牠現在經常蹦蹦跳跳，可以做很多牠之前做不了的事。」至於籌得的善款將用作特貝寶日後的骨質檢查和注射費。 英國《每日郵報》
20140820-165,20140820,165,打劫打出友情受害人幫劫匪重過新生,打劫打出友情 受害人幫劫匪重過新生 美國密歇根州一名青年，差點被3名劫匪殺死，但他不單只原諒劫匪，還與其中一名劫匪成為好友，引領對方走回正途。 現年24歲的米德爾頓（Brady Middleton），五年前任薄餅速遞員。當年13歲的貝內特（Marcellous Bennett），與兩名哥哥故意叫外賣薄餅，引米德爾頓上門持槍打劫，搶走他身上的錢、手機和車匙，又以手槍柄襲擊他。三兄弟其後押他到荒山野嶺，遺下他後搶了他的送貨車逃走。 事後米德爾頓的傷口要縫70針，並患有創傷後壓力症和腦震盪綜合症。他在法庭再次面對犯人，斥責犯人不只偷走錢和車，更偷走了他對人的信任。不過當他看見未成年的貝內特，開始心軟，疑惑為何對方會打劫。米德爾頓出席貝內特所有審訊，更不時鼓勵對方。 最後貝內特兩名哥哥被判坐監，而貝內特則被判入感化院。當貝內特由感化院出來後，二人成為朋友。米德爾頓理解到，對方因為受到成長環境影響才會打劫，而貝內特也漸漸意識到不一定要走哥哥的路。受米德爾頓鼓勵，現時貝內特學做髮型師，更做廚師打工賺錢，考慮將來讀商業管理。 英國《每日郵報》
20140820-166,20140820,166,全球人道救援者遇襲激增66%,全球人道救援者遇襲激增66% 人道救援顧問組織「人道成果」（Humanitarian Outcomes）昨日（周二）發表最新報告，指人道救援人員的人身安全受到歷來最大挑戰，去年遇襲人數創歷史新高，共155人被殺、171人重傷、134人被綁架，較前年急升66%。 去年救援人員遇襲事件，主要在阿富汗、敍利亞、南蘇丹、巴基斯坦及蘇丹等地發生，佔襲擊總數3/4，當中阿富汗救援人員遇難人數最多，有81人死亡；敍利亞及南蘇丹亦情況堪憂，本月就有6名救援人員在南蘇丹遇襲後死亡。以軍空襲加薩聯合國的避護中心，亦導致11名救援人員死亡。 今年情況亦非常嚴峻，截至8月中已有79名救援人員被殺，較前年全年遇害人數還要多。聯合國安理會在昨日「世界人道日」召開會議，討論人道救援人員的安全問題。 法新社
20140820-167,20140820,167,飛越中國上空　教宗盼立即訪華,飛越中國上空　教宗盼立即訪華 教宗方濟各（Pope Francis）再向中國伸出友誼之手。他前日（周一）結束五日南韓之行，在包機飛越中國上空時開腔表示，希望訪問中國，但同時開出條件，就是中國必須有宗教自由，容許教會自由地履行天職。 教宗表示，若中共同意，他甚至準備好明天就訪問中國。他說，教廷對中梵接觸一直保持開放態度，並強調他非常尊敬中國人。教宗在包機來回兩程飛過中國領空時，都有向中國國家主席習近平發問候電。 77歲的方濟各打破禁忌談自己的死亡，揚言相信天主會多給他兩至三年命。他指自己在全球大受歡迎，是天主子民的濃情厚意：「我試圖想想自己的罪、自己的錯，不要驕傲，因為高民望轉瞬即逝。兩、三年後，我就會回到天父的家。」他承認神經系統有問題，要接受治療。教宗明年計劃出訪美國，但不排除會仿效前任本篤十六世退休。 法新社/路透社
20140820-168,20140820,168,華黑客盜450萬美病人資料,華黑客盜450萬美病人資料 美國大型私立醫院營運商「社區衞生系統」（Community Health Systems，簡稱CYH）的電腦系統，在4月至6月期間遭中國的黑客入侵，450萬病人的個人資料被盜，CYH已通知執法當局和受影響的病人。 先進組織富威脅性 CYH上月得悉事件，前日（周一）才對外公佈，它形容黑客來自中國一個「先進並富有威脅性」的組織，採用「高度複雜的惡意軟件和技術」避開系統保安，再進行襲擊，以複製和傳送資料。 專家相信，黑客目的是偷取資料，而非破壞系統；被盜的資料包括院方具知識產權保護的醫療裝置和設備發展，及病人的姓名、地址、出生日期、電話號碼和社會保障號碼，當中不包括信用卡碼號和病歷，但足以令不法分子盜用身份。CYH指會與聯邦執法和檢察機構緊密合作。 CYH在1985年於美國成立，在29個州分營運206間醫院，擁近3.1萬張床位。CYH連續三年入選財富500大企業，員工人數達7.8萬人，去年的利潤達1.4億美元（10.92億港元）。 德新社/法新社
20140820-169,20140820,169,伊波拉或令非洲大猩猩絕種,伊波拉或令非洲大猩猩絕種 伊波拉病毒不但對人類有極大殺傷力，還可能對非洲大猩猩造成絕種的威脅。英國劍橋大學生態學家沃爾什（Peter Walsh）表示，在研究剛果2000年代爆發的兩次伊波拉疫情時，發現疫情加上民眾獵殺野生動物，導致90%至95%大猩猩死亡。他估計伊波拉可導致整代大猩猩有45%死亡。 雌性轉移往非繁殖族群 法國雷恩大學研究員勒古亞對當年受伊波拉影響的剛果大猩猩進行研究，發現疫情影響牠們的生殖能力、遷徙和社交行為。研究員留意到當疫情爆發後，大猩猩的存活率減少，生殖率也下降，疫情更影響牠們的生活模式，大猩猩會將一個家族分成多個組別，將染病的大猩猩趕走，而部份沒有受感染的成年雌性大猩猩轉移到非繁殖族群，情況罕見。 英國《每日郵報》
20140820-170,20140820,170,捕殺率遠超出生率　大象瀕絕種,捕殺率遠超出生率　大象瀕絕種 儘管國際禁止象牙貿易，但最新一項研究顯示，中國和亞洲各地對象牙的需求大增，導致在2010至12年間，逾10萬隻非洲大象被非法獵殺（圖）割取象牙，遠遠超過出生數量，若問題持續下去，可能造成大象絕種。 研究由世界級的大象專家監察肯雅保護區的大象死亡率，及利用其他公開資料，量化計算而成。結果發現，大象因非法捕獵致死的死亡率，由十年前的25%飆升至現時的65%。非法捕獵大象的高峯期在2011年，推斷該年有約4萬隻大象被殺。大象被獵殺率在非洲並不一樣，當中以中非和東非最嚴重，坦桑尼亞一個保護區，大象數目在三年間由4萬隻銳減至1.3萬隻。 偷獵者除了大量獵殺大象，為了取得更好的象牙，將捕殺焦點集中在壯年雄象，令象群生態失衡。 偷獵大象皆因中國中產階層崛起，2008年中國獲聯合國批准合法進口象牙，令象牙需求激增，導致黑巿價格飆升，加上非洲人民生活貧困，經濟誘因令他們鋌而走險。 美聯社
20140820-171,20140820,171,瑞士明年推廉價零重力飛行,瑞士明年推廉價零重力飛行 在維珍銀河準備明年推出太空旅遊，讓人在太空邊緣感受無重飛行滋味之際，瑞士太空系統公司（S3）搶閘收客，推出廉價零重力飛行之旅（圖），收費低至幾千鎊，明年初在日本出發。 S3舉辦的零重力飛行之旅，乘客並非乘坐太空船，而是坐改裝的空中巴士客機，機師載乘客飛到高空，以陡斜角度攀升，然後平飛再俯衝急墜，即以拋物線飛行製造連串半空急墜，讓人在兩小時航程感受每次長達25秒的無重力飛行。機艙會分成三個區域：可容納40人的派對區、28人的尊貴區及幾個人的貴賓區，尊貴區及貴賓區的乘客會獲贈一隻百年靈特別版手錶。收費由幾千鎊至幾萬鎊不等，比維珍銀河的20萬美元（56萬港元）便宜。 英國《每日電訊報》
20140820-172,20140820,172,擁有好鄰居　減低心臟病機率,"擁有好鄰居　減低心臟病機率 俗語說遠親不如近鄰，最新一項研究顯示，擁有好鄰居（圖）不但可以成為好朋友，更可減低患心臟病機率。 美國密歇根大學在2006年起對5,276位沒有心臟病、平均年齡達70歲的人士進行長達四年的追蹤研究，要他們對鄰居在緊急關頭的倚靠度、信任度及友好程度評分，發現給予七分滿分的人患心臟病機率比只給一分的少67%，而每增加一分，患心臟病機率減少22%。 雖然不知道擁有好鄰居與減少患心臟病有何關聯，研究員認為睦鄰友好的凝聚力可鼓勵大家多做運動，例如散步，保持心臟健康。 法新社"
20140820-173,20140820,173,News Flash最宜居城市　墨爾本四連霸,News Flash 最宜居城市　墨爾本四連霸 經濟學人信息社昨天公佈一年一度宜居城市排名，140個城市中，澳洲墨爾本（圖）連續四年居榜首，其次是奧地利維也納、加拿大溫哥華與多倫多，榜末是敍利亞大馬士革。亞洲區內，「氣候溫和」的大阪和東京排名壓倒「悶熱潮濕」的香港和新加坡；香港排31位。 路透社
20140820-174,20140820,174,News Flash敍已繳化武全部銷毀,News Flash 敍已繳化武全部銷毀 美國總統奧巴馬前天發表聲明，指敍利亞政府申報的約600立方噸化武（圖），已在美軍船隻「開普雷號」上全部銷毀。他讚揚這是國際社會控制大殺傷力武器擴散的「重要成就」，敦促敍方守諾，完成銷毀剩餘的化武生產設施。 新華社
20140820-175,20140820,175,News Flash教宗姪遇車禍妻兒慘死,News Flash 教宗姪遇車禍妻兒慘死 教宗方濟各（Pope Francis）的三名親人昨天凌晨在阿根廷遇上車禍喪命。教宗的姪兒貝爾戈廖奧（Emanuel Bergoglio）駕車載着妻兒回家途中，汽車撞向貨車（圖），貝爾戈廖奧受重傷，妻子和兩名分別兩歲及8個月大兒子慘死。 路透社
20140820-176,20140820,176,六成單位開放式廚房　天晉IIIA奇則罕有包括234伙三房戶,"六成單位開放式廚房　天晉IIIA奇則 罕有包括234伙三房戶 【本報訊】樓價高企，樓市怪象接踵而來，「奇則」新盤一個接一個。將軍澳首個限量地由新地（016）興建的天晉IIIA大玩奇則，960伙之中竟然有570伙（佔總數約60%）為開放式廚房戶，數量在大型屋苑中甚為少見，其中234伙（約佔總數24%）更加是主攻家庭客的600多方呎細三房單位，於市場上可謂極為罕見。 記者：黃嘉銘　陳家雄 聲稱最快下周可以開賣的將軍澳天晉IIIA，樓花期長達28個月，發展商隨即於今日下午開放示範單位予傳媒參觀，預計本周內會上載樓書及開價。集團副董事總經理雷霆昨表示，項目剛取得預售樓花同意書，並聲稱間隔「多元化」，相信可以吸納不同類型的用家。 常見於200呎蚊型戶 的確，雷霆所指的間隔不單是「多元化」，更可以用神奇來形容。據發展商昨日公開予傳媒參考的資料顯示，項目960個單位中，「無飯」（開放式廚房）單位共有570伙，約佔總數近60%。 事實上，採用開放式廚房於近年新盤而言其實不是罕見，但最神奇的是，一般「無飯」單位只是約200、300方呎的蚊型戶，但是次新地竟然將234伙（約佔總數24%），主攻家庭客的606至673方呎的三房單位，亦設計為「無飯」開放式廚房戶，認真神奇。 有區內街坊隨即質疑，既然有空間建三房出來，沒有理由容不下一個正式的廚房，認為是不可接受，又指煮食的油煙會影響小朋友。 亦有市場人士指出，天晉IIIA為區內首個限量住宅項目，但限量的後遺症，往往就是令到發展商在設計單位時，要設計奇則來配合條款。 料為限量項目後遺症 是次新地大玩細則的一房戶，確實是區內罕見，據將軍澳區代理透露，區內可以比較的一房戶二手屋苑就只有位於調景嶺的維景灣畔。現時屋苑只有不足5個一房400多方呎的單位放盤，叫價500萬元起，呎價即大約1.2萬元，業主大多叫價企硬。 此外，同區新都城1期6座高層G室，實用面積363方呎，日前破屋苑呎價新高成交，成交價483萬元，呎價逾1.33萬元，反映區內二手繼續有價有市。 另一方面，新地急急將天晉IIIA推出市場，很大程度上可能是避開與最大對手──奇則先鋒長實（001）的日出康城三期緻藍天正面交鋒，緻藍天提供1,648個單位。 同時，區內申請預售樓花同意書的項目暫已有四個，連同天晉IIIA及緻藍天在內，區內共有4,443伙單位新供應，將掀起一場搶客激戰，預料對區內一、二手樓價都會構成一定壓力。 【條例冇禁止明火煮食】 【話你知】 香港工程師學會消防分部前主席陳炎昌表示，現行消防條例沒有列明開放式廚房不准使用明火煮食，因為設計開放式廚房，須考慮多個火警風險因素，並非單一考慮火種原因。 2011年屋宇署已公佈建築物消防安全守則，就開放式廚房設計提供指引，包括大廈及單位裝置消防設備，如花灑、煙霧頭等，以及大廈管理員須接受消防安全知識培訓等，須跟足指引設計，再交由署方審批，事實上，曾有面積約300平方呎的單位，其開放式廚房獲得批准使用明火的案例。 【將軍澳居民心聲】 廚房很重要 吳小姐：「三房單位僅設開放式廚房，不可以接受，因為廚房很重要，既然有空間建三房，沒理由容不下一個正式的廚房。」 影響小朋友 黃小姐：「334方呎單位只可一至兩人居住，再多位小朋友已不夠住。三房單位只提供開放式廚房不能接受，因煮食油煙大，會影響小朋友。」"
20140820-177,20140820,177,新盤戶型料趨兩極化,新盤戶型料趨兩極化 【專家意見】 樓價越高，市民越住越細。發展商近年推售蚊型單位，當然計過度過，但背後原因，莫過於樓價升幅遠遠拋離市民收入，卻不能賤賣拖冧市場，惟有推售蚊型單位吸引上車客。 兩房戶或不合潮流 有測量師料未來住宅供應趨兩極化，一是針對上車客的蚊型戶，一是針對換樓客的大單位，兩房戶嗎？已不合潮流。 2011年政府推出限呎及限量地皮，三年後出現奇則，業界認為不是單一主要原因。香港測量師學會房屋政策小組主席潘永祥認為，越來越多蚊型戶推出市場，相信發展商是因應市場需要，除了本港人口結構變化，單身人士越來越多，對細單位需求上升。 再者，樓價高令上車難上加難，「現時樓價貴，唔夠錢咪逼住買200零呎囉！」至於大單位供應，主要視乎地區、家庭人數及入息等，以天晉IIIA為例，相信發展商看到該區以上車客及換樓客為主，故集中一房及三房戶，兩房較少。 測量師許偉國指出，未來住宅供應將呈兩極化局面，「一係就一房，有咁細得咁細，吸引首次置業……一係就大單位，吸引換樓客，因為佢哋有足夠負擔能力」。至於兩房單位，他認為這類單位與一房戶的買家沒太大分別，而且涉及稅款，動輒數十萬元，既非首次置業買家可以負擔，而換樓客要換樓亦不會越換越細。他個人認同，「限量」條款令畫則時需要作出遷就。
20140820-178,20140820,178,曉盈快開價　擬下周賣,"曉盈快開價　擬下周賣 【其他新盤】 恒基（012）深水埗福榮街188號曉盈，昨首度開放示範單位，該盤將於日內開價，首批50伙，最快下周開售。項目將提供即供優惠折扣，但詳情將於價單內公布。 曉盈昨日開放的示範單位以32樓A室為藍本，實用面積515方呎，間隔2房2廳連貯物房，露台約22方呎，工作平台約16方呎，樓底高約3.15米。現場所見，兩個面積相同的示範單位，其一連裝修，另一屬交樓標準，前者間隔經過改裝，貯物房與鄰房合併成大房，空間較原則大得多。細房設有衣櫃凹位，餘下空間極之狹小，睡床必須置於窗台上，否則無法容納。 另外，永泰（369）與南豐於2010年以約12億元（人民幣．下同）購入的上海浦東陸家嘴物業，現命名尚濱江，將於今年第四季在港推售。 尚濱江呎價挑戰滬新高 項目提供90個一房至三房標準單位，另有7個特色戶，總樓面近2萬平方米，預期下月底發售，標準單位每平方米12萬元起（約每方呎14,492港元），特色戶將挑戰上海新高，每平方米22萬元以上（約每方呎26,570港元）。全數單位售罄，可套現逾25億元。 尚濱江單位面積由85至336平方米（約915方呎至3,617方呎），銷售對象除用家外，還針對投資者市場，預計租金回報率可達4厘以上。該盤最快下月初開放示範單位，月中開價，月底發售。 "
20140820-179,20140820,179,富榮破頂價635萬沽,"富榮破頂價635萬沽 【本報訊】樓市又再亢奮，居屋造價幾近看齊私樓。市區居屋王之稱的大角嘴富榮花園，12座一個中層B室，剛以635萬元成交，創下屋苑成交價歷史新高。 家天下地產分行經理黎振傑表示，剛沽出的單位為富榮花園12座中層B室，建築面積694方呎，實用面積592方呎，於自由市場以635萬元成交，建築呎價9,150元，實用呎價10,726元。據知，原業主於1998年11月以綠表價181萬元購入，估計補地價大約200萬元。 對上一宗同類單位最高銀碼成交，為今年3月10座高層B室，面積一樣，成交價620萬元，事隔5個月，再創下銀碼新高。 曼克頓山呎售1.5萬 此外，荔枝角曼克頓山兩日兩破頂。代理表示，3座高層H室，建築面積745方呎，實用面積576方呎，日前以845萬元成交，實用呎價1.46萬元新高後，有關紀錄昨日已打破，最新一宗成交為6座高層D室，實用538方呎，成交價衝上至815萬元，實用呎價1.51萬元，原業主2009年底以500萬元買入，賺315萬元，升63%。"
20140820-180,20140820,180,怡峰呎價 4.7萬新高,"怡峰呎價 4.7萬新高 【本報訊】 破頂熱潮停不了，億元豪宅也不例外。歌神張學友現居的淺水灣怡峰，其鄰居業主剛以1.16億元賣出手持單位，實用呎價直逼5萬元，創該廈歷史新高，十年狂賺8,400萬元。 張學友住毗鄰單位 淺水灣道67號怡峰，錄今年首宗成交。美聯蘇偉雄表示，該廈極高層C室，建築面積3,099方呎，實用面積2,463方呎，剛以1.16億元沽出，實用呎價衝上4.7萬元，建築呎價3.7萬元，刷新該廈新紀錄。 該單位原業主2004年透過公司名義以3,200萬元買入，是次轉售，十年勁賺8,400萬元，升價2.6倍。據知，歌手張學友持有該廈兩伙，並居於剛沽出單位毗鄰，張學友分別於1993年及2004年以1,630萬及3,000萬購入單位，市值料升至逾億元。代理指，現時低層C室放盤，索價約9,200至9,300萬元。 據知，剛易手單位由於位處高層，樓底高達26呎，足夠建閣樓，可望高爾夫球場景及深水灣海景，遂能高價獲承接。此外，大潭浪琴園4座中層B室，實用面積1,906方呎，成交價2,850萬元，呎價1.5萬元。"
