key,date,article_daily_id,title,text
20141003-218,20141003,218,炒友Blog：華電福新低吸睇中線 - 邱古奇,"炒友Blog：華電福新低吸睇中線 - 邱古奇 港股這一輪急跌，自然與佔中活動有關，學聯勇字當頭，看來這場運動有排未收得科，現時入市真係要考慮清楚。當然，港股之跌亦與外圍有關，歐洲經濟垂危，美國復蘇步伐減慢，中國亦開始有支撐不住之感。港股早前炒滬港通升了不少，但經濟因素其實不配合，市況回軟亦好應該。 大市跌但個別股份仍有出色表現，華電福新（816）逆市升近4.6%。本欄8月曾推介此股，當時股價3.91元，睇5元，結果上月升至4.94元差6格未達標，就隨市回吐，周二跌至50日線後強力反彈，又可以留意了。 華電福新業務包括風電、水電、火電、光伏甚至投資核電，是典型的環保潔淨能源股，上次推介時仍未公佈中期業績，現在逐一補充。上半年華電福新收入66.97億元（人民幣．下同），純利則增長22.5%至10.47億元，屬同類股業績最好的其中一員。 集團持續發展，期內集團控股裝機容量為10,612兆瓦，增長11.6%，總發電量為17,830,440兆瓦，增長9.4%。以權益裝機容量計，水電增長11%，風電增19.6%，其他清潔能源大增38%，只有煤電零增長。 調高目標價至6元 華電福新合營的新核電機組估計今年底可投產，而集團上半年風電、光伏發電分別增產130及45兆瓦，預計下半年會再分別投產約1.4兆瓦及150兆瓦，煤電佔比將進一步減低。中央大力鼓勵環保清潔能源，最近傳聞發改委將推出可再生能源配額考核辦法，把可再生能源電量與全社會用電總量的佔比，明年在各省佔比基本上會提升至4%以上，幾乎是去年實際數目的2倍，肯定會為集團帶來更大的發展空間。 德銀早前發表報告推介，指華電福新上半年業績表現優於同業，較該行預期高出12%，並上調2014至17年盈利預測5%至12%，預料上述期間的盈利年均複合增長率可達33%，故將其目標價至6元。 市況不佳，宜候至4.20元吸納作中線投資，目標提升至6元，買入後跌破4元止蝕。 邱古奇 本欄逢周二、四、五刊出"
20141003-219,20141003,219,魚樂無窮：三個板塊勿亂博反彈 - 唐牛,魚樂無窮：三個板塊勿亂博反彈 - 唐牛 港股第三季臨尾香，埋單倒跌1.1%，總結首三季恒指暫跌1.6%，如同白做。不過，身邊戰友荷包依然有進賬，何解？懂得炒股不炒市嘅硬道理也！由年初新經濟股喪炒，年中舊經濟股翻生、滬港通概念起飛，到近期殼股異軍突起，相關板塊完全不受大市左右，自動波開行turbo，是但扑中一瓣，依然有利可圖。 展望今季，不明朗指數達十粒星。689政府未肯回應市民訴求，佔中運動隨時要長期作戰；儲局本月完成最後一輪減買債計劃，未來息口走勢成為焦點；滬港通如箭在弦，加上歐央行快將啟動QE，卻有望成為後市𥌓光。情況就好似過年食盤菜咁，一味餸緊扣另一味餸，未食到最後都唔知是龍是蛇。 地產股恐步零售股後塵 前輩教落，要贏錢先要學識唔好輸，點先可以保本？盡量避開令你損手嘅板塊，零售股同濠賭股就係最好例子。兩者嘅處境好相似，股價同早已透支行業好景。 如今天氣不似預期，當然難敵地心吸力。牛氣全消下，加上可見將來都冇回勇催化劑，好聽啲就係有反彈冇升幅，衰啲講句就係博唔到反彈就立即中伏。銀娛（027）、金沙（1928）、周大福（1929）、佐丹奴（709）幅幅圖都係45度角向下，睇見都唔開胃。另一個有機會步兩者後塵嘅板塊就係地產股，有指佔中會拖冧樓價，有利潤在手者當然先沽為敬，強如長實（001）都要下試250日線，樣衰到爆，戰友忍手為上。 唐牛  https://www.facebook.com/tongcow88 
20141003-220,20141003,220,股場放大鏡：偉仕防守性高估值平 - 歐陽風,股場放大鏡：偉仕防守性高估值平 - 歐陽風 中國工信部公佈，指蘋果iPhone 6已滿足進網管理要求，因此批出進網許可，意味已獲開綠燈，短期可在內地開賣。消息對iPhone 6炒家不利，然而卻對一家本港上市公司係好消息，正是蘋果產品在內地的代理商偉仕控股（856），受到iPhone 6內地解禁開售消息支持，偉仕周二股價亦逆市造好。 其實偉仕近期亦不停公佈取得新代理權，包括9月初公佈，取得微軟Xbox One及華為TalkBand B1智能手環中國區代理。公司持股89.09%附屬ECS佳杰中國於9月23日發行首批Xbox One。至於華為「TalkBand B1」智能手環，該產品全面支援IOS/Android系統手機，可追蹤健身數據且有通話功能，據科技雜誌形容試玩結果唔錯。 受惠iPhone 6闖華 偉仕早前公佈中期業績，期內股東應佔純利2.83億元，增長14.2%，不派息。管理層表示，上半年由於蘋果沒有推出新產品，令公司該業務同比下跌了50%，但相信下半年隨着iPhone 6的推出，該業務的營業額將可回升。該公司策略上更專注高毛利的產品，故令整體毛利錄得升幅。 該公司過去幾年業績相當穩定，去年全年純利5.03億元；每股盈利33.77仙；末期息8仙，已是連續三年每股派8仙息。期內營業額402.39億元，按年升8.47%，毛利15.17億元，按年升7.79%。在市場氣氛偏淡之際，偉仕業績穩定並有內地iPhone 6解禁消息支持下更添防守性，應會受到芬佬注視，往績PE 6.9倍及息率3.4厘亦屬便宜。 歐陽風
20141003-221,20141003,221,中環迷你裙：奢侈內衣有盡時 - Samantha,中環迷你裙：奢侈內衣有盡時 - Samantha Alice的男人，總喜愛掛在Alice身上的，由頭到腳，由裡到外，都是自己買，以宣示主權，但總有觸礁的時候。有次，他們行過一間高級內衣舖，男人目光炯炯向Alice問「買畀你好冇？」Alice當然知道男人用意，沒當面拒絕，當男人興高采烈揀了件，看了個價錢，隨即一言不發，放回原位，那是一餐Amber的價錢。 男士們總嘆，女人心海底針，Samantha認為，女人背後的消費才是無底深潭。好消息的是，名牌正回歸合理水平的正軌上，因為奢侈品股已瀉得面色蒼白，Prada（普拉達，1913）中期純利2.5億歐元，倒退兩成，比2012年更低，視為火車頭的亞太區，營業額更開倒車。阿爺打貪無盡時，一個名牌袋，能夠在芥蘭站體現其價值，但奢侈內衣則不能。 阿爺誓將高官同一眾小三、小五的情婦堆一網打盡，邊有閒情消費起這種終極奢侈品？近年頂級內衣品牌易主頻生。去年意大利商人Silvio Scaglia收購陷入財困的高級內衣品牌La Perla。路透引述消息人士指，另一間英國高級內衣品牌Agent Provocateur其控股股東私募基金3i有意賣盤，由高盛接洽有興趣的私募基金和大金主，同時品牌不打算坐以待斃，開設副線L'Agent，價錢是主線的一半，希望能走出困境。 Samantha  https://www.facebook.com/stocksamantha  本欄逢周三、五刊出
20141003-222,20141003,222,輪輪相扣：資金力撐港交所,輪輪相扣：資金力撐港交所 恒指於十一假期前夕跌勢持續，失守250日線及23000關口，14 RSI跌至23，STC亦進入超賣區多時。滬港通快將於10月推出，市場預期一些在內地擁有知名度，而在港上市的股份，或有機會成為滬港通推出後內地股民留意對象。 港交所（388）為滬港通實施下的關鍵股份，其股價近月升至185元無力而回，上周失守50日線支持，多個技術指標均向淡。然而，港交所認股證成交比重於周一及二（9月29及30日）增至一成以上，相關認購證街貨量達21.6億份，創三個月新高。如看好港交所中長線走勢，可低吸港交所認購證11613，行使價188元，2016年7月上旬到期。 騰訊（700）股價調整期已達個多月，上周失守100日線，至本周二止已連挫七個交易日，但其STC已於超賣區發出入貨訊號。如看好騰訊，可留意騰訊認購證29198，行使價128.98元，2015年1月上旬到期。 麥格理資本證券股份有限公司衍生工具部 投資涉及風險，應自行評估，尋求專業意見及查閱上市文件。結構性產品之流通量提供者可能為唯一巿場參與者。價格可能波動，引致全部損失。本產品並無抵押品，如發行人無力償債或違約，投資者可能無法收回部分或全部應收款項。過往表現不反映將來表現。 麥格理資本證券股份有限公司為本文提及上市股份有關結構性產品的流通量供應者。至2014年9月29日止，本集團及/或其聯屬公司沒持有以上股份相等於1%或以上之市場資本值的財務權益。
20141003-223,20141003,223,看圖佈陣：失守牛熊線支持　22750忌再穿 - 祝文韜,看圖佈陣： 失守牛熊線支持　22750忌再穿 - 祝文韜 受佔中影響，投資者在長假期前傾向沽貨離場觀望，大市周二持續受壓，恒指低開92點，以全日高位23137開市後再展開尋底之旅，很快便失守23000關口，最多跌374點，低見22855，收報22932，跌296點，成交847億元。 恒指周二甫開市即失守250日線（23172），失守該線後沽壓進一步湧現，以陰燭跌穿23000關口，10日線（23817）跌至100日線（23817），發出第二個死亡交叉，MACD發出雙熊訊號，技術走勢已由強轉弱。短短三個交易日，恒指先後失守3月升浪的0.382倍及0.5倍黃金比率，現已跌至0.618倍22750支持，大市已呈嚴重超賣，在22750前隨時出現技術反彈。今日是本周最後一個交易日，論形勢，今日再跌機會不低，周線圖本周出現陰燭幾可肯定，中線向好形勢逆轉的風險越來越大，22750支持位相當關鍵，下周用周線圖再作分析。 避險可揀安碩A50 港股短線前景變得不明朗，策略上宜減磅降低持倉以控制風險，入市亦宜避開本地經濟關係度高的股份，地產、零售更不宜估底博反彈。要搵避險股的話，可考慮與A股表現掛鈎的安碩A50（2823），該ETF周二收報9.13元，跌0.5%，成交16.8億元。 滬綜指守穩2300點水平，安碩A50在8元附近成功築底，並營造圓底形態，升抵9.7元水平後營造右柄，並兩度守穩250日線，100日線升近250日線，有望出現黃金交叉，可於8.97元買入，短炒以10元作目標，失守8.7元止蝕。 祝文韜
20141003-224,20141003,224,期指戰況：大跌後嚴重超賣 - 吳六奇,期指戰況：大跌後嚴重超賣 - 吳六奇 淡友在國慶長假期前續處上風，即月期指周二低開209點後，早段跌幅曾收窄至70點，高見23145後再跌過，並失守23000關口，最多跌415點，收報22820點，跌395點，低水112點。 期指日線圖周二以陰燭失守23000及250日線，將保歷加通道向上撐開，10日線今日將跌穿100日線，出現死亡交叉，MACD發出雙熊訊號，熊差距持續擴大，形勢相當不妙。3月升浪的0.618黃金比率處22750附近，如果失守，隨時回試3月低位21102。不過，期指連日急跌後已嚴重超賣，9 RSI已跌至15的超賣水平，有條件技術反彈，但佔中啟動後，現時主導不再只是單純的市場因素，政治形勢發展難料，可以遠超想像，戰友宜有心理準備，後市會大起大落。 吳六奇  https://www.facebook.com/pages/吳六奇/642652085818237 
20141003-225,20141003,225,佔領縱橫：中汽內飾焗住砌 - 古道祥,佔領縱橫：中汽內飾焗住砌 - 古道祥 本欄個名原意純粹抽吓水，本來不想多談政治，但眼見近日坊間對運動有好多迴響，今日都搭兩嘴啦。話說一班較保守嘅家長好反對佔中，認為學生最終會輸晒，但古道祥真係唔係咁睇喎。事實上，由發催淚彈嗰日計，商家佬冇一個真正發表過聲明，好明顯等緊中央真正的表態，所以班學生未必輸晒喎！既然一班最大既得利益者都未出聲，點解唔撐吓班初生之犢呢？ 講完政治，講返股票，其實都可以一齊講，因為而家係政治市，政治市最難估。不過，正所謂時勢做英雄，只要股份基本因素佳，正好喺呢啲亂市中儲平貨，尤其啲大股，例如港交所（388），嘩！170蚊都穿埋，跌市好多人都唔敢撈，但呢啲人多數冇發達，你諗吓你係邊啲人。 不過買大股短期預咗捱價，如果純粹落鑊炒嘢，都有啲細股可以諗吓，好似隻中國汽車內飾（048），佢之前批0.38元嘅新股到咗，佢呢兩日都跌唔落，擺明接咗貨嗰啲焗砌，可偷跳。另外呢幾日做緊旗形嘅實力建業（519）都可以睇睇，佢早輪供完股，主席洪生手貨齊返晒，6億市值，之前又傾過賣，應該都唔使祥仔講佢會再炒乜啦！ 古道祥 本欄逢周五刊出
20141003-226,20141003,226,基金觀點：五大地區今季投資亮點,"基金觀點：五大地區今季投資亮點 近期資金輪轉一直是市場熱話。今年最突出、最獲投資者認同的資產轉移主題，便是資金從發達國家轉到新興市場，特別是亞洲市場。亞洲各國相繼推出不同的改革方案，例如中國、印度及日本等，加上區內股市估值相當具吸引力，經濟環境又明顯優於歐洲。 中資股估值吸引 亞洲開發銀行日前指出，亞洲決策官員應該準備好美國息口向上的風險，避免重演去年縮減量寬時掀起的市場震盪，然而這個畫面再現的機會相信不大。踏入2014年第四季，我們認為有五大國家及地區值得投資者留意。 首先是中國。中資股今年雖然已啟動上升引擎，但估值依然吸引。自去年11月三中全會以來，國企改革步伐加快，國資委早前公佈的四大試點改革方案，相信可助國企改善營運效率、企業管治質素及盈利前景。 其次是台灣。美國經濟復蘇對台股刺激作用龐大，因科網行業佔大市比重高達58%。現時台股估值仍合理，更重要是台股盈利隨美國經濟回穩而上揚。 接着是韓國。今年韓國股市表現較亞洲區其他國家遜色，但情況將有改變。目前韓股估值相當低，而韓國政府已承認會盡所力提振本土經濟。受惠於出口到美國改善，上半年韓國出口總值2,836萬億韓圜，按年增加2.6%。截至6月止，韓國已連續29個月錄得貿易盈餘。經濟環境改善，韓股前景可看高一線。 最後便是雙「印」國，即印度及印尼。雙「印」領袖上場令兩國投資氣氛顯著改善，股市重拾上升動力。油價下跌同時利好印度股市，當地政府又支持商業活動，而且與台灣情況一樣，美國經濟轉好將帶動印度出口金額上升，料可繼續利好當地市場。 富達國際投資"
20141003-227,20141003,227,今日提醒你,今日提醒你 美國 ‧ 晚上8時30分公佈8月貿赤，市場料報408億美元，7月錄405億美元貿赤。 ‧ 晚上8時30分公佈9月非農業職位增長，市場料報21.5萬份，8月錄得14.2萬份；9月失業率料維持於6.1%。 ‧ 晚上9時45分公佈9月PMI服務業指數終值，市場料報58.5。 ‧ 晚上10時公佈ISM非製造業指數，市場料報58.5。
20141003-228,20141003,228,牛熊屠房,牛熊屠房 周二牛證打靶數目︰64隻 街貨重貨區 牛證：  22400-22700點 熊證：  23900-24100點
20141003-229,20141003,229,亞太區股市,亞太區股市
20141003-230,20141003,230,歐美股市及美債,歐美股市及美債
20141003-231,20141003,231,貴金屬及商品,貴金屬及商品
20141003-232,20141003,232,貨幣滙價,貨幣滙價
20141003-233,20141003,233,主要股東股權變動摘要,主要股東股權變動摘要
20141003-234,20141003,234,港股派息過戶備忘,港股派息過戶備忘 聲明：本版內容來自聯交所，資料整理已力求精準，惟本報對於全部或任何部份內容的準確性或完整性均不會承擔任何責任，資料如有差異或更改，皆以聯交所為準。本版內容不構成任何投資建議，投資者若據本版內容入市買賣而招致任何損失，一概與本報無關。
20141003-235,20141003,235,中環在線：佔中啟動後　中環人返工手記 - 李華華,中環在線：佔中啟動後　中環人返工手記 - 李華華 佔中開始後，形勢一直在變，有人支持，有人反對，有人因意見不同開始喺facebook「unfriend」朋友；鬧開嘅繼續鬧，選擇沉默嘅繼續沉默。中環人似乎仲未受到嚴重影響，幾大證券行一切如常，有中資公司要求員工唔好參與佔中亦係意料中事，但係無論如何，大家最希望成件事可以盡快和平收科。 【高盛】提醒員工預早出門 美資大行高盛租用「超人」李嘉誠嘅中環長江中心，據高盛賓架所講，長江中心嘅保安情況，跟舊年有碼頭外判工人喺門外示威時差唔多，保安人員係多咗；加上電梯大堂舊年底加裝咗入閘機，所有喺長江中心返工嘅員工，入閘時都要向保安出示職員證。 高盛內部就冇白紙黑字嘅佔中指引，只係提醒員工，如果擔心佔中活動影響返工時間，就提早出門，或者選擇喺屋企工作。不過佢話，中環市面嘅情況其實相當平靜，「睇電視新聞都知冇可能返唔到工，大家其實冇藉口唔返工。」 【摩通】午夜電郵通知安排 喺中環遮打大廈返工嘅摩根大通賓架透露，由星期日佔中啟動開始，公司每晚12點都會向員工發出訊息或電郵，因應當天示威情況評估翌日狀況，至今每晚都係收到「一切如常，明天準時返工」嘅通知。 唯一唔同，係過去兩日國慶假期，公司呼籲同事冇乜事就唔好返公司，如果要返公司開會或工作，就要事先通知保安部門。公司亦要求佢哋帶手提電腦返歸，萬一翌日返唔到公司都可以如常在家工作。 佢指，好多家住中半山嘅賓架同事往日會坐幾分鐘車返工，𠵱家就預早大約半小時出門口，改為行路返公司，又由於中環多天橋接駁各幢主要寫字樓，所以佔中未有帶來任何不便。 【中銀國際】高層7am開會評估 具有中資背景嘅中銀國際，除咗中環總行，喺上環新紀元廣場亦設有寫字樓。據了解，自佔中運動開始，由中銀國際各部門阿頭組成嘅「應變小組」每朝晨早7點就要開會，主要係評估一下當日市面情況，然後以手機訊息通知所有員工，至今都係話冇乜特別情況，叫大家準時返工之類。 雖然係中資背景，但據講，員工暫時冇收到任何明示或暗示，叫佢哋唔好參與佔中。有員工估計，可能因為中銀國際比較多高層係香港人，所以冇其他中資公司咁有中資特色。 【太平保險】白紙黑字籲勿佔中 中資公司叫員工勿參與佔中活動應該係意料中事，只係估唔到有公司會白紙黑字出通告箒。有中國太平保險員工爆料，指公司嘅香港總經理室日前發出通告，指政府已經宣佈佔中係非法活動，叫全體員工「安心做好本職工作」，唔好參與佔中，仲要「對這一違法活動不圍觀，不傳謠，不信謠」，換言之，就連行過睇吓都唔好咁話。 最離譜係，呢間公司竟然建議公司全部員工「勸告」自己嘅家屬亦都唔好參與佔中活動；喂，打工咋喎，唔係連家屬嘅示威自由都要被人管啩？ 藺常念怨收入減少 佔中啟動多日，財金界都冇乜人發聲，一向敢言又話支持香港有民主嘅股壇「開心果」藺常念（藺Sir）噚日忽然現身金鐘政府總部對出嘅夏愨道，不過佢並唔係參加佔中活動，亦唔係撐學生，竟然係借佔中呢個場景，抱怨佔中活動令佢收入減少，被迫罷課！ 藺Sir噚日係第一次到佔中現場，而且只係為接受BBC記者（圖右）訪問，唔係要參加佔中。佢大呻，佔中拖累股市下跌，搞到佢呢啲靠幫人管理投資為生嘅人，收入減少。而且，佢原本喺銅鑼灣上堂教散戶投資，受佔中影響，近幾日嘅課堂被迫取消，對佢生計有好大影響咁話。 藺Sir強調，佢仍然好支持民主運動，但唔接受佔中呢個方法，認為應該接受行政會議召集人林煥光嘅提議，叫大家去佔領添馬公園，仲話證券業界有95%嘅人都係咁諗喎。唔知有幾多中環人buy佢呢個講法呢？ 蔡東豪潛水　明日現身？ 網媒《主場新聞》創辦人蔡東豪以往積極參與政治運動，但自從佢今年7月底突然喺網站發表一封公開信宣佈結束《主場新聞》後，就幾乎銷聲匿迹，近日嘅佔中活動，當然亦見唔到佢蹤影，多名戰友都好難聯絡到佢。 據聞，一向熱愛跑步嘅蔡東豪一直有練跑，亦有報名參與本周六舉行嘅「康宏圖騰跑」，康宏圖騰跑設有57公里與16公里兩個賽程，分別由西貢北潭涌與城門水塘主壩起步，以大帽山扶輪公園做終點，但係𠵱家咁敏感，唔知蔡東豪會否選擇繼續潛水嘞。 李華華 mailto:LiWaWa@AppleDaily.com
