key,date,article_daily_id,title,text
20141011-134,20141011,134,人妻生侏儒B偷嗒侏儒舞男人人知,人妻生侏儒B 偷嗒侏儒舞男人人知 「偷食要抹嘴」，只是總有些事情是怎樣抹也抹不掉的。西班牙一名準新娘在婚前派對上狂歡，情不自禁下竟然與表演的侏儒脫衣舞男搞上了，後來更加發現懷孕。直至日前終於東窗事發，因為她誕下的嬰兒是患有侏儒症的。 出軌準新娘的名字未有被披露，只知她在巴倫西亞一間醫院分娩。誕下侏儒症嬰後，她哭崩了，並不得不向丈夫承認不忠。事件經由當地一個網站披露後，立即惹來傳媒關注。 據稱，事發在今年初，出軌新娘的丈夫一直堅信，妻子腹中的是其親骨肉。LasCincoDelDia網站爆料稱：「無論是她最親密的女性朋友或家人，都不知道她『偷嗒』侏儒舞男。」 英國《鏡報》
20141011-135,20141011,135,扮畢嫂畫厚個嘴麻甩變索女,扮畢嫂畫厚個嘴 麻甩變索女 31歲菲律賓男藝人保羅，以一雙巧手及超卓的化妝技巧，打扮成外國一些名星名人，為肖為妙，可稱得上百分百A貨藝人，當中包括妮歌潔曼、 珍妮花羅倫絲、 安祖蓮娜祖莉、甚至柯德利夏萍。其才華吸引不少粉絲欣賞，在 instagram已有38萬粉絲追隨。
20141011-136,20141011,136,以為個個係好人小黑熊慘食一棍,以為個個係好人 小黑熊慘食一棍 在俄羅斯西伯利亞西部，兩隻小黑熊因為太信人類，出來覓食時未有提防，被其中一名醉酒男用鐵棍重重擊落頭部，生死未卜。 事發在本月初，兩頭小黑熊出外覓食，遇著兩名酩酊大醉男子。據說兩頭小黑熊是孤兒，一直由附近油田工人餵飼，所以對人類不感陌生，甚至主動接近為求食物，冷不防遇到這惡毒醉酒男，竟拿起一支鐵通擊向小黑熊頭部，跟著更將其拖行到路邊。整個過程由附近油田一名工人拍下，並上載互聯網。警方事後拘捕兩名涉案男子，控以虐待動物罪名。據其中一名被告指，事後已將小黑熊放走，但附近工人稱再沒有看見小黑熊下落，相信已凶多吉少。
20141011-137,20141011,137,失婚喪食婦情陷女教練成功修身,失婚喪食婦 情陷女教練成功修身 英國一名女子，與丈夫離婚後毫無節制地狂食，令體重暴升，她最終抵受不著別人指點，到健身室做運動減肥，結果不單減肥成功，還與女教練另締結另一段情緣。 38歲Tina，2006年與丈夫結束七年婚姻，令她心情跌至谷底，結果將悲憤化為食量，暴升至250磅。身材暴漲後，眼見別人纖瘦時又承受不了壓力，去年6月於是決心減肥，並認識了比她細2歲的Gemma。在Gemma專業指導及悉心照顧下，Tina終於成功減掉60磅，更令她意想不到的是與Gemma發展一段同性情緣，讓她重新感到愛情滋味。 英國《每日郵報》
20141011-138,20141011,138,毒蜘蛛咬到手腳紅腫想抱抱囝囝都唔得,毒蜘蛛咬到手腳紅腫 想抱抱囝囝都唔得 英國北約克郡哈羅蓋特（Harrogate）一名女子被蜘蛛咬傷，令她全身腫痛一年，更患上「蛛網動物恐懼症」（arachnophobia），甚至想在5歲兒子上學前給他一個擁抱也不能。 45歲的維奇（Carol Veitch）一年前打掃房子時，感到腳跟被咬了一下，最初以為只是天氣炎熱導致痕癢。但兩天後，維奇的小腿至腳跟明顯腫起來，更出現咳嗽、呼吸困難的徵狀。醫生指她患胸腔感染（ chest infection）及支氣管炎。其後維奇在家中浴缸發現一隻蜘蛛，經醫生及專家檢驗後，相信她是被「偽寡婦蜘蛛」（False widow spider）所咬。 之後數星期，維奇的情況變差，手臂和臉都腫痛起來，樣子十足痲瘋病人，令她不敢離開家門，怕會嚇壞別人。她更因此患上「蛛網動物恐懼症」，終日擔心蜘蛛會爬進房間，難以入睡；即使在電視畫面看見蜘蛛，也會怕得哭著離去，需要進行心理治療。而兒子亦因她的病變得一驚一乍，但痛症使她難以擁抱兒子安慰，大感無奈。事隔一年，維奇的病仍沒有好，丈夫更辭掉工作來照顧她，真是被毒蜘蛛害慘了！ 英國《每日郵報》
20141011-139,20141011,139,戈爾巴喬夫一度入院傳病危,戈爾巴喬夫一度入院傳病危 前蘇聯總統戈爾巴喬夫（Mikhail Gorbachev）前日（周四）因病情惡化一度入院，他沒有透露在哪間醫院留醫及入院原因，但矢言「會為生命而戰」。 「會為生命而戰」 83歲的戈爾巴喬夫前日受訪時指，他最近一周身體狀況欠佳，周三更明顯惡化，之後要入院治療，「躺在加護室中，插滿喉管」，但他的生存意志強烈，「你知道我的性格。我會為生命而戰」。他昨日已出院，指感覺較前日好，會隨即返回辦公室工作。 患有糖尿病的他近年經常出入德國的醫院接受治療，去年一度誤報他的死訊，他調侃散播謠言的人「願望落空」，並說：「我活得很好。」 戈爾巴喬夫1985年起出任蘇聯共產黨總書記，推行政治及經濟改革，透過推行民主化及現代化重建國家經濟及對外開放，亦因此獲得1990年諾貝爾和平獎，同年成為總統。但諷刺的是他的改革催生多個東歐國家的民主訴求，紛紛要求獨立。1991年12月25日，他宣佈辭職，當晚克里姆林宮頂上的蘇聯國旗被俄羅斯三色旗取代，蘇聯正式解體。 法新社/俄新社
20141011-140,20141011,140,英男疑染伊波拉命喪馬其頓,英男疑染伊波拉命喪馬其頓 伊波拉陰霾籠罩下，馬其頓衞生部門表示，一名英國男子前日（周四）出現疑似伊波拉病徵入院，當日死亡，當局已將死者的血液樣本送到德國檢測，預料今日（周六）有結果，英國外交部現正調查及跟進。 馬其頓指該男子上周四由英國倫敦抵達首都斯科普里（Skojpe），入住當地一間酒店，前日出現胃痛，但拒絕進食和求診，被送往當地一間傳染病醫院，但入院不久後去世。醫生指他出現嘔吐及內出血等病徵，懷疑他感染伊波拉病毒，但他的朋友指死者沒有到訪伊波拉爆發的國家。 當局已將死者的血液及身體組織樣本送到德國法蘭克福化驗，但指死者感染伊波拉「機會不大」，同時封鎖死者入住的酒店，並將35名酒店住客和醫護人員留在酒店及醫院隔離，全部沒有伊波拉病徵。 乘客訛稱染病累客機延誤 此外，一名美國男子周三乘飛機前往多明尼加共和國期間不停打噴嚏，開玩笑大叫「我患了伊波拉」。美國隨即派緊急醫療隊由費城前往多明尼加，四名醫護人員穿上全副保護裝備登機，將他帶到機場醫療中心檢查，其後證實虛驚一場，令機上255人無辜呆等兩小時。 法新社/路透社
20141011-141,20141011,141,沖繩迎本年襲日本最強颱風,沖繩迎本年襲日本最強颱風 日本一周內兩度打風，氣象預測指，威力強勁的颱風「黃蜂」，周末會殺到沖繩，隨後將席捲九州和本州。雖然「黃蜂」已由超級颱風降級為一般颱風，但預計仍然強大，是今年抵日的最勁颱風。當局籲民眾提防強風巨浪和泥石流。 氣象局昨早（周五）指，「黃蜂」以時速10公里移動，持續風力時速185公里，陣風時速更達259公里，預計最快今日傍晚抵達沖繩，後天在九州登陸，下周席捲本州，可能為東京帶來暴雨。「黃蜂」來勢洶洶，沖繩居民已開始做好各樣防風措施。 上一個颱風「巴蓬」周初橫掃日本，造成至少七人死亡，陸空交通大混亂。氣象人員指，兩個颱風相隔如此短時間吹襲日本，相當少見，但認為只是巧合，而且今年來襲的颱風並非特別多。 路透社/法新社
20141011-142,20141011,142,墨國拘4人再揭4亂葬崗,墨國拘4人 再揭4亂葬崗 墨西哥警員被指在上月勾結黑幫殺害示威學生，事後43名學生下落不明，當局早前發現大型亂葬崗，懷疑涉案警員和黑幫虐殺學生後將屍體埋葬，當局前日（周四）再拘捕四人，並發現多四個亂葬崗，惟未知屍體數目。 調查人員帶四名疑犯到墨西哥城以南搜索，新的亂葬崗地點距離上周在格雷羅州（Guerrero）發現28具屍體的地點不遠。當局相信屍體是失蹤學生，部份有燒焦痕迹，料需時至少兩周才能確認身份。上月26日，阿約辛阿帕師範學校一批學生不滿當局給予的資源不足發動示威，怎料警方開槍射殺，造成6死25傷和43人失蹤。當局至今拘捕34人，當中26名警察。 法新社/美聯社
20141011-143,20141011,143,News Flash加州千戶受山火威脅,"News Flash 加州千戶受山火威脅 美國加州薩克拉門托東北部周三起發生嚴重山火（圖），燒毀逾170公頃土地和五間屋，另有逾1,000房屋受威脅，當局出動1,200名消防員、128輛消防車、7架直升機灌救，但截至前日上午只有20%火場受控。 路透社"
20141011-144,20141011,144,News Flash疑歐派奪英國會議席,News Flash 疑歐派奪英國會議席 英國疑歐派英國獨立黨前日在國會英格蘭東部一個議席補選中，取得壓倒性勝利，奪取歷來首個國會議席。成功連任的卡斯韋爾（圖右）本是執政保守黨黨員，今年8月轉投獨立黨，該黨領袖法拉奇形容前夜是「英國獨立黨史上最重要和最美好的一夜」。 路透社
20141011-145,20141011,145,指女性不應要求加薪微軟總裁失言道歉,指女性不應要求加薪 微軟總裁失言道歉 「只要相信公司制度，就不應要求加薪，因為善有善報，只要相信，最終都會來臨。」美國微軟公司行政總裁納德拉（Satya Nadella 圖）前日（周四）在亞利桑那州演講時，揚言女性不應該要求加薪，更將工資與因果報應掛鈎，結果惹來軒然大波，最終要道歉。 電腦科技行業一向男多女少，兩性同工不同酬亦惹來詬病，納德拉前日出席雲集從事電腦行業的女性會議上演講，竟提出若女性欲更上一層樓，但又難於啟齒要求加人工，應該相信「若你繼續向前走，制度會給你加人工」，又指「要相信因果報應的力量，善有善報，最終會來臨」。 在場的另一微軟董事會成員克拉韋（Maria Klawe）即表示不同意，並建議女性要「盡好本份，確保工資與男性看齊」，博得全場掌聲。納德拉事後向員工致歉，稱自己當時「完全錯誤」。 法新社
20141011-146,20141011,146,喝完沒多一對翼　Red Bull賠1億,"喝完沒多一對翼　Red Bull賠1億 「Red Bull送你一對翼」，廣告是這樣說（圖），但美國有市民投訴喝下飲料後沒有「多一對翼」，控告Red Bull失實陳述。Red Bull本周同意向美國顧客賠償1,300萬美元（1.01億港元），但強調廣告沒有誤導。 2002至2014年10月3日期間在美國購買Red Bull的顧客，可在明年3月前到該公司網址填寫索償表格，毋須提供單據證明，公司會在明年5月起向每名顧客賠償10美元（78港元）或價值15美元（117港元）的產品。暫未知若有逾100萬人索償，會否令每名顧客分得的款項減少。 英國《每日郵報》"
20141011-147,20141011,147,最多人分享紐約度假相,最多人分享紐約度假相 不少人喜歡將遊行照片上載到instagram跟好友分享，甚麼地方最多人分享度假照片？最新調查顯示，美國紐約（圖）是全球最多人分享度假照片的城市，曼谷在亞洲稱王，香港排第13位。 酒店格價網站Hotelscombined.com，根據照片分享網站Instagram主題標籤#vacation，檢索全球10萬張度假相片，發現紐約、倫敦及拉斯維加斯是全球最多人分享度假照片的城市，當中時代廣場、中央公園、帝國大廈是最多人分享照片的紐約旅遊景點。 英國《每日郵報》 最多度假照分享城市排名 1.　紐約 2.　倫敦 3.　拉斯維加斯 4.　巴塞隆拿  5.　奧蘭多 6.　巴黎 9.　曼谷 13.　香港 15.　新加坡 16.　東京 資料來源：Hotelscombined.com
20141011-148,20141011,148,6 Plus需求勁　推遲產iPad,"6 Plus需求勁　推遲產iPad 美國《華爾街日報》引述消息報道，蘋果原定12月初起生產新iPad，但巿場對iPhone6 Plus的需求強勁（圖），生產商未來數月仍要集中製作iPhone 6 Plus，因此有意將新iPad推遲至明年初才大規模生產。 主要生產商富士康表示，當務之急是要滿足公眾對iPhone 6 Plus鋪天蓋地的需求，其中鄭州工廠已有逾20萬工人專門生產新iPhone的重要零件，但人手仍然短缺。 iPhone 6和iPhone 6 Plus在推出首個周末已賣出逾1,000萬部。 美國《華爾街日報》"
20141011-149,20141011,149,常踏單車易生腫瘤如第三顆睾丸,常踏單車易生腫瘤 如第三顆睾丸 踏單車是很多人的消閒活動之一，但不宜過量，南非有科學家指長時間踏單車（圖），會令盆骨組織與座墊產生磨擦而長出腫瘤，儼如男性的第三顆睾丸，連女性亦不能倖免。專家建議更換較柔軟的單車座墊。 報告指踏單車時，盆骨中最接近單車座墊的骨頭會與屁股的皮膚組織產生震動及磨擦。若經常長時間踏單車而座墊較硬，股溝附近會長出別名「單車疣」的腫瘤；由於位置接近下體，故被稱為第三顆睾丸。腫瘤受壓會產生刺痛，要入院做手術切除或注射類固醇。 英國《每日鏡報》
20141011-150,20141011,150,巴西大命機師三度遇險　死裏逃生,巴西大命機師三度遇險　死裏逃生 今年先後有多宗大型空難，共造成數百人死亡。巴西阿克裏州63歲機師吉列爾米則在37年的飛行生涯中，經歷三次飛行事故，但都能夠死裏逃生。 1981年，吉列爾米駕駛的小型飛機，因引擎突然停轉被迫折返及急降，機身嚴重受損，他安然無恙。1991年，他駕駛的飛機因螺旋槳突然停轉及冒煙，他在視野受阻下急降，他和機上兩人受傷。在周日，他駕駛的直升機又因引擎故障及大霧墜落亞馬遜森林（圖），受傷的他在沒有食物及水下，在野外求生75小時，最後獲救。 新華社
20141011-151,20141011,151,委內瑞拉選美20歲大學生封后,委內瑞拉選美 20歲大學生封后 「委內瑞拉小姐」前晚（周四）出爐，20歲社會傳播學大學生希門妮斯（Mariana Jimenez圖）擊敗24名對手，戴上后冠，將代表委內瑞拉角逐「環球小姐」寶座。雖然在經濟不景下，選美比賽規模縮水，但觀眾熱情不減，仍是該國數一數二高收視節目。 美聯社
20141011-152,20141011,152,一手搶客　盤源短缺　業主企硬本月首10天二手成交挫39%,"一手搶客　盤源短缺　業主企硬 本月首10天二手成交挫39% 【本報訊】佔中近兩星期，業界預期，除受佔中影響外，二手盤源短缺，業主放盤態度普遍仍企硬，令買賣陷拉鋸局面成交萎縮，反映樓價走勢的中原城市領先指數，則僅港島及大型屋苑領先指數（CCL Mass）創歷史新高；另9月錄得340宗買家印花稅（BSD）個案，較8月份錄得的266宗回升28%，付重稅都要買樓。 記者：蔡家儀　湯家明 中原地產統計十大屋苑10月份首十天錄得約57宗成交，較上月同期94宗，減少三成九，其中鰂魚涌康怡花園更未錄成交，同區龍頭屋苑太古城同期跌幅近五成。 中原曹嘉華表示，受新盤搶客及佔中影響，本月初東涌區二手成交陷停頓狀態，區內大型屋苑映灣園於首星期零成交，至近日才錄得兩宗買賣，較上月同期12宗銳減83%。雖然成交量大減，盤源仍短缺下，業主叫價相當強硬，議價幅度有限，影響成交表現。 康怡10月份未開齋 表現較差的還有紅磡黃埔花園，該屋苑上月初交投尚算暢旺，首十天錄得12宗成交，本月成交淡靜得多，10月上旬只有兩宗買賣，下挫83%。中原黎浩棠表示，多個大型新盤接連推售搶去不少二手客源。加上二手盤源緊絀，業主叫價未回軟，買家惟有放慢入市步伐。 中原侯惠良表示，受佔中影響，部份準買家入市態度較前審慎，加上近日焦點落在新盤，令二手成交下滑。沙田第一城大部份業主看好後市，認為佔中對樓價影響不大，未有擴闊議價空間，屋苑本月首十天錄得5宗成交，對比上月同期跌約五成。 港島區樓價創新高 至於樓價六大指數包括CCL、中小型單位、大型單位，以及九龍區、新界東及新界西，指數創新高後回軟，預期樓價會反覆向上，而9月28日起佔中持續，有關影響將在本月下旬反映出來。而本周僅港島區樓價指數及CCL Mass創新高，港島區最新報130.01點，按周升1.28%。CCL Mass報128.4點，連續4周創歷史新高，按周升0.05%，而CCL則報127.65點，屬歷史次高，按周跌0.39%。 儘管佔中對樓市影響仍有待觀察，惟政府印花稅署則公佈，9月住宅市場錄得340宗BSD個案，較8月份錄得的266宗回升28%，涉及稅額達6.65億元，較8月稅額5.68億元，上升17%，政府於過去7個月來，單是收BSD稅項已累積達89.3億元。 至於，額外印花稅（SSD）同樣錄得升幅，由8月的38宗，上升至9月的55宗，升45%，平均每宗SSD稅項約29萬元，由2011年7月至今，政府累積額外印花稅宗數3,773宗，涉及稅項7.33億元。"
20141011-153,20141011,153,四大困局冰封二手市場,四大困局冰封二手市場 【拆　局】 四大困局纏擾二手市場，包括自本年5月政府放寬雙倍印花稅（DSD）換樓時限，扭轉了業主心態；長期欠缺盤源，樓價在第三季按季升5.74%，為一年半最大；一手樓乘空檔「佔領」樓市，搶佔大批購買力；加上佔中抗爭持續，二手業主「一動不如一靜」，恐怕「胡亂落車，難上返車」，導致買賣陷入閒局。 政府大堆重稅下，市民入市成本大增，業主考慮沽售自住單位時，又要顧慮能否稅務期限內不持有兩個單位，先沽後買，還是先買後沽，避免要付DSD，惟政府放寬DSD計算換樓期限，以售賣轉易契後半年計算，變相有利長樓花物業，換樓客也難免轉投一手市場，令二手樓買賣更形淡靜。 樓價未受佔中影響 中原陳永傑表示，現時買家對住屋需求及入市興趣不減，睇樓氣氛仍算積極，惟近日多個一手新盤以貼市價開售，分散二手注意力，加上大部份業主感佔中事件未會影響樓價，叫價企硬，普遍未有擴大議價空間，令二手交投膠着。 佔中展開至今超過十天，後市尚未明朗，在政局不穩時，準買家作重大投資決定往往會反覆考慮，憂慮假如樓價下跌，應否在跌定才入市，因此絕大部份買家現時對入市抱觀望，希望待事件較為明朗時才作決定。惟賣方普遍認為事件影響只屬短暫，叫價堅挺，只有小部份業主願意擴闊議價空間。
20141011-154,20141011,154,美股冧市　大戶籲沽散戶追貨,美股冧市　大戶籲沽散戶追貨 【本報綜合報道】美股近期走勢波動，繼周四急挫334點後，道指昨日開市首1小時，高低波幅已逾140點。開市後1小時（本港昨晚10時30分），道指跌39點，報16619點；納指跌77點，報4301點；標普500指數跌14點，報1913點。 周四美股全線暴跌，標普500指數重挫逾2%，將周三創下今年最大升幅全數抹去。道指亦創一年以來最大跌幅，下跌超過300點，反映細價股表現的羅素2000指數更創12個月新低。市場普遍擔心美國聯儲局在結束買債之時，歐洲經濟增長放緩會拖累美國經濟。 伊坎揚言正沽空標指 美國著名維權投資者伊坎（Carl Icahn）表示，他正在沽空標普500指數，他認為美國市場調整在所難免，造淡美股只是一種對沖策略。Marketwatch專欄作家Ben Eisen則指出，美股暴跌之際，投行、基金大鱷與普通散戶的分歧相當明顯，頂級投行如高盛已為美股下跌作出預警，認為美國第三季企業營收將不及預期，但散戶卻仍然勇猛，過去一個月的孖展客不升反跌，表明散戶對市場調整仍不太着緊。 聯儲局副主席費希爾（Stanley Fischer）周四出席國際貨幣基金組織（IMF）年會時表示，儲局可能將在明年中期前後首次加息，但具體時間選擇將視經濟數據而定，但聯儲局可能會相對緩慢地加息，言論令市場對提早加息憂慮重燃，令美股周四跌幅擴大。 美國勞工部昨公佈，9月進口物價按月跌0.5%，市場原預期跌0.7%；同月出口物價則按月跌0.2%，市場原預期跌0.1%。進出口數據顯示物價仍未升溫，主要受油價下跌影響，對儲局提早加息憂慮稍舒緩。 歐股已跌至兩個月低位，由於德國經濟部預期未來數月德國出口仍受限制，市場憂慮德國經濟增長停滯，德股一度急挫逾2%，跌穿9000點。早前有消息指，德國對歐洲央行推出量寬政策不太熱衷，未來歐股走勢要視乎歐央行行長德拉吉能否說服德國支持量寬政策。英、法、德股尾段跌1.2%至2.2%。
20141011-155,20141011,155,嵐山2期三房戶減價促銷,"嵐山2期三房戶減價促銷 【本報訊】長實（001）大埔嵐山1期貨尾未清，急急推出2期，昨公佈首張價單共60伙，提供最多14.5%折扣優惠，連折扣平均實用呎價約8,667元。發展商聲言2期較1期貴5%，但實際只有兩房加價，滯銷的三房單位定價更較1期為低。嵐山2期首批60伙，標準單位定價由502.4萬至925.5萬元，首批買家最多可享14.5%折扣，計及最高折扣，售價由429.6萬至791.3萬元，呎價7,518元起。而四伙開放式單位，實用面積196方呎，定價198萬至207.2萬元，買家須同時購毗鄰「主單位」。另一伙兩房特色單位定價745.1萬元，呎價達14,610元。 長實執行董事趙國雄指，嵐山2期定價較1期有5%差距，反映物業本身質素，但仍較同區其他新盤有不少於兩成折讓。項目即日開放示範單位及進行登記，下周四發售。 大埔嵐山1期共1,071伙，開售兩個多月售出約764伙，佔全盤約71%，其中標準兩房戶已沽清。故此，是次2期的兩房戶亦大幅加價，是次推出的25伙兩房單位呎價由10,008至11,739元，較1期首批同類單位呎價8,961至9,797元，調高11.7%至19.8%。以同類的三房單位作比較，享有單邊景觀的第一座單位，呎價竟較1期相同層數的單位低2.9%至3.8%。 傲名首日沽21伙 另外，佔中後首個開價的何文田新盤嘉里（683）傲名，昨日下午發售首批30伙，市傳已有23宗成交，並指發展商會於短期內加推。但據一手住宅物業銷售資訊網顯示，項目昨錄得21宗成交，其中15樓的A、B、C單位由同一買家大手掃入，總成交金額6,565.67萬元，另11樓A、B及C、D室，聯同7樓A、B室亦分別由一組買家連購兩伙。"
20141011-156,20141011,156,往山墳私家路未開放,往山墳私家路未開放 【記者直擊】 長實（001）大埔嵐山銷情較對上同系新盤荃灣環宇海灣弱，當中地理環境負面新聞成為賣樓焦點外，囚室劏房亦變成話題奇則。隨着1期快於下月初開放，記者日前直擊，通往屋苑內山墳予市民拜山的「私家路」仍未開放，入口處被圍欄及水馬擋着，貼有「地盤範圍閒人免進」的字眼，阻止市民進出。 1期接近完工 然而，屋苑工程進度已如火如荼，只差一個月，樓盤外貌原形畢露。上月初，嵐山2期1座頂層特色戶仍然搭起棚架，被藍色帳篷重重包圍，昨日記者故地重遊，該單位已拆棚。另同座部份單位落地玻璃亦已撕去黃色膠紙，惟執修大廈外牆的吊車及繩索仍在高高掛。 至於賣出約750餘伙的嵐山1期，由3座至9座位置，現場所見，工程已接近尾聲，再不見破爛的窗戶，黏貼實用不足200方呎劏房唯一窗戶的保護膠及貼紙都已撕去，其中3座及8座更已拆走吊車及繩索，可說接近完工。根據樓書，1期預計明年3月入伙。長實執行董事趙國雄表示，嵐山1期可望下月初開放現樓單位，而嵐山2期因仍有工程，暫不會對外開放。
