key,date,article_daily_id,title,text
20141011-0,20141011,0,10萬人撐留守共同進退　抗命到底,"10萬人撐留守 共同進退　抗命到底 【雨傘革命　第14天】 【本報訊】傲慢政權掩耳盜鈴，換來人民更嘹亮的呼號。10萬人淹沒金鐘雨傘廣場，與孩子並肩扛起香港。一朵朵傘子落在人海，化成帳篷，遍佈廣場。政務司司長林鄭月娥前晚忽然單方面擱置政改對話，並指佔領人數下降，激發更多群眾昨晚露宿街頭、共同進退。金鐘逾10萬人出席學界「政府封殺對話，人民堅守街頭」集會，群眾呼喊「關鍵時刻，長期留守」。 記者：白琳　王家文 截至昨晚11時半，留守者在晚會後陸續張開帳篷，金鐘一帶築起近300個，數以千計市民鋪墊席地而坐。旺角也有2,000人留守，帳篷約20個，更多市民以天為被，睡在紙皮和帆布上；銅鑼灣晚上11時有約400人。 「守住！守住！」雨傘廣場昨晚7時半開始集會，海富天橋扶手電梯的人龍不絕，林鄭「吹大雞」，十萬人逼爆金鐘，人潮東至灣仔紅十字會對面的告士打道，西至干諾道中紅棉路下，紅棉路行車天橋站滿群眾，橋口豎起集會直播屏幕。大學生Sunny在9.28當晚被催淚彈驅趕至銅鑼灣，一直留守至今，晃眼過了13天。他指政府封殺對話雖令很多市民洩氣，「但係捱到今時今日，我哋更加唔可以氣餒，否則對唔住犧牲嘅市民。大家難得聚首一堂，堅持落去！」 「林鄭月娥，唔好扮儍！」 不少市民因林鄭封殺對話而來。從事資訊科技的Marcus連日「佔鐘」，林鄭的言論令他更堅定要通宵留守，昨晚自備兩帳篷與數名友人睡在街頭，「因為林鄭月娥講嘅說話，直頭直線叫我哋出嚟。佢覺得我哋冇本錢，但我哋個運動就係，政府有乜嘢令我哋不滿，隨時都可以有好多好多市民自發出嚟」。留守銅鑼灣的師奶說，感到很多小市民支持佔中，有送外賣的人，更幫忙「睇水」防黑道及警方突襲清場。 任職編劇的阿芝也不滿林鄭，「佢嘅意思係你哋咁少人，就唔使再同你哋傾啦，之前願意同學聯傾，因為見堵塞條路，先同你傾之嘛」，故決定通宵留守金鐘。佔領者互不相識，卻充滿默契。集會主台擴音器在9時許突失靈，全場一起清唱中英文版生日歌，又唱《海闊天空》。人民力量陳志全問台下群眾為誰而來，台下齊聲喊出四個字：「林！鄭！月！娥！」又多次怒吼：「林鄭月娥，唔好扮儍！」陳笑指今次是林鄭「吹大雞」，號召市民「佔鐘」。 學聯秘書長周永康批評特區政府進退失據，若林鄭真是「好打得」應面對市民，高喊「林鄭，你去咗邊度呀？」群眾回答：「返大陸！」過去兩星期周永康沒有回家，呼籲市民並肩作戰，「每個人付出多啲，市民就會少啲犧牲。」學聯副秘書長岑敖暉凝視眼前人海，說每天睡醒都很累，一時激動得說不出話，群眾高呼加油打氣。他指政府可以靠拖延戰術消耗佔領者的體力，卻消磨不了追求民主的意志，「今次要同政府嚟真、撐到底！一齊撐落去，呢場仗就有機會贏」。 學民思潮黃之鋒估計金鐘昨晚約10萬人出席集會，民意「摑醒」林鄭。佔領者多次退讓，包括讓出海富天橋、特首辦通道及一度開放金鐘道讓電車通過，政府卻一步不讓，港人留守「因為我哋唔服氣」。黃體力已到極限，至今撐下去只因「冇得輸」，「一定要贏落去」，「到下星期一，我生日，都同大家通宵留守！」 戴耀廷指，雨傘廣場會記錄重要歷史，包括記住執垃圾的年輕人、物資站義工、下班倦極也前來急救站當值的醫護人員、縱對真普選有不同看法，最後也達成共識的港人、甘願承擔罪責的抗命者，「我深信好多好多年以後，香港人會見到民主制度已喺香港生根，愛與和平已成香港必不可少嘅價值，已係香港人生活一部份」。 公民黨黨魁梁家傑批評，林鄭突取消與學聯會面，但港人是「嚇大」的。民主黨主席劉慧卿宣佈本月中將赴聯合國向人權事務委員會傳達港人渴望真普選的心聲。她促政府提交政改補充報告，要求人大重新決議。社民連梁國雄表示，現時佔領者力量仍然不足，早上人數太少，港人現除了尊嚴外，沒有甚麼可輸。政府若重開公民廣場，群眾才有可能讓出金鐘道。"
20141011-1,20141011,1,張德江南下　料與梁談佔中,張德江南下　料與梁談佔中 【本報訊】正在德國訪問的國務院總理李克強首次就佔中表態，指特區政府有能力依法維護香港社會穩定及經濟繁榮，並在表示堅持貫徹一國兩制之餘，重提貫徹「港人治港、高度自治」方針；據了解中共中央政治局常委、港澳工作協調小組組長張德江近日抵廣東，有消息稱張會和到廣州出席泛珠三角合作論壇的特首梁振英等香港官員見面，料討論佔中最新局勢。 李克強：高度自治不變 李克強昨與德國總理默克爾會面後共同見記者，首度回應香港佔中運動。李克強指，中國堅定不移貫徹一國兩制、港人治港、高度自治方針，這一方針沒有，亦不會改變。自今年李在人大工作報告中，沒有提及「港人治港、高度自治」後，「港人治港、高度自治」幾乎消失於北京官方立場中。 李克強又稱，香港保持長期繁榮穩定，符合中國及香港居民的利益，他相信港人有智慧，香港特區政府亦有能力，依法維護香港的經濟繁榮及社會穩定，保護外國所有投資者的合法利益，又重申香港屬中國內政，任何國家相互尊重對方的主權，這符合國際準則。佔中受國際社會關注，李克強對佔中的言論相對溫和；德國總理默克爾也提到和平佔中，讚揚香港的示威行動「大都是和平的，希望這情況能夠維持下去」。 本報獲悉，張德江近日南下深圳，親臨「最前線」聽取香港情況最新報告，傳達中央對佔中的最新指令。張德江任廣東省委書記時推動泛珠三角合作，有消息指張德江或會出席在廣州舉行的第十屆泛珠三角區域合作論壇暨經貿洽談會，香港政務司司長林鄭月娥今率多名官員北上出席，特首梁振英明到廣州，消息人士稱張德江很大機會接見梁及港官。消息續稱，北京以「外國勢力介入與我方爭奪香港控制權的社會運動」定性佔中。 在見領導人前，梁振英與林鄭昨深夜與30多名建制派議員會面約兩小時，會後民建聯譚耀宗指，討論佔中、泛民不合作運動等問題。譚指市民不滿佔中情緒很高，甚至會有行動清場，促政府做好準備。據知梁重申獲中央支持，建制派又建議林鄭與學界對話，有指林鄭一臉愁容。
20141011-2,20141011,2,政治局要每日收專題報告,政治局要每日收專題報告 【本報訊】針對佔中運動，有報道指中共成立了一個由人大委員長，港澳工作協調小組組長、國安會副主席張德江領導的特別小組負責搜集情報，每天向政治局至少提供一份專題報告，並執行政治局常委會的決議。 以「不妥協」應對佔中 據明鏡新聞網報道，中共最高領導層已把佔中定性為「外國敵對勢力企圖搞垮香港的顏色革命」，目的是「搞垮香港、威脅中國、動搖中國共產黨執政」，應對佔中的底線是「不妥協、不流血」。 報道指政治局常委會最少就佔中召開了兩次專題會議，定下「絕不妥協，堅定挺梁，支持港府處理方式」三大原則。 由於北京不願佔中流血收場，報道指最高決策者否決反佔中的數個強硬方案，較溫和的方案是發動反佔中的市民包圍佔領人士，切斷其後援。 報道並引述北京政界人士的消息稱，早在今年4、5月，北京已着手派人來港評估形勢，由中央政治局委員、國安委常委孟建柱和軍方將領直接指揮，「收風」人員主要來自公安部、國安部、總參二部和三部以及幾大軍區的情報部，人數達數百。孟建柱本人也曾秘密來港。
20141011-3,20141011,3,「懲罰」師生佔中俊和撤港大　中大獎學金,「懲罰」師生佔中 俊和撤港大　中大獎學金 【本報訊】老牌中小型發展商俊和發展集團，近日去信香港大學、中文大學及理工大學，稱不滿多間大學的學者及學生參與佔中，破壞香港繁榮穩定及造成社會分化，決定終止贊助三間大學的獎學金，又稱要重新考慮日後會否繼續贊助。港大學生會會長梁麗幗斥俊和不尊重大學自主，質疑是向校方政治施壓。 俊和副主席彭一邦前日去信港大校長馬斐森，表明對多間大學的學者與領導參與佔中感失望，指佔中破壞繁榮穩定及令社會分化，又指學生爭取民主時犯法。彭猛轟行動犧牲港人利益，形容是立下壞先例，令人以為可透過不法行為達到目的。 理大同被終止贊助 彭一邦續稱，不相信透過激進的佔中行動可以達成目標，認為維持社會穩定是大學校長與學者的責任，聲稱終止獎學金非該公司所願，但認為他們獎助的師生應該要與該公司有共同信念與價值觀。彭又稱希望撤獎學金的做法能「提醒」大學校長與學者，要保護下一代免受政治角力影響。 據了解，中大及理大亦收到俊和類似的停發獎學金「懲罰」佔中師生信件。港大發言人表示暫不回應，中大發言人稱正了解事件。 港大學生會會長梁麗幗批評俊和不尊重大學自主和學術自由，質疑此舉是向校方政治施壓，「究竟佢想贊助乜嘢嘅教育？」中大學生會會長張秀賢指，獎學金不應有政治附帶條件，否則不要也罷。他認為事件是少數事件，呼籲撤回獎學金的企業好好思考設立獎學金原意。 港大校友、公民黨黨魁梁家傑直言，若俊和因學生參與佔領行動而取消獎學金和贊助，「係貽笑大方」。他稱今次佔領行動獲國際關注及稱讚，若商界希望香港有公平競爭，「應樂見有咁高質素嘅年輕人」。 根據港大網頁，俊和基金獎學金自2007年至2008年學年起，每年向港大兩名分別就讀土木工程學系和房地產及建設系，全日制大學二年級本科學位學生提供各一萬元獎學金。 俊和承接不少政府及港鐵工程，7月已加入反佔中行列，在地盤及辦公室擺放反佔中表格及收集箱，副主席彭一邦是中大工管碩士，曾發電郵呼籲員工響應反佔中。俊和市值約11億元。中國新維投資公司早前以5.6億元，向大股東彭氏家族洽購46.7%股權，成為單一大股東。
20141011-4,20141011,4,文化演藝界　願為學生擋子彈,文化演藝界　願為學生擋子彈 【雨傘革命】 【本報訊】面對政府野蠻管治、警方暴力清場、黑道襲擊和平佔中學生、林鄭月娥以荒謬理由取消對話，文化、藝術、學術界憤怒了，站起來組成跨界別「文化界監察暴力行動組」，走上前線在「雨傘廣場」架起帳篷留守，與學生並肩作戰，甘願為學生擋子彈。召集人之一的音樂人黃耀明說，若學生遭暴力襲擊或清場會上前阻止。太平傘下，一起舉傘，一起的撐，「學生並不孤單」。 記者：蔡朗清　潘柏林　林俊謙 多名文藝界人士約一周前醞釀成立行動組，因目睹警方在旺角涉縱容黑社會襲擊、非禮和平示威學生及巿民，願捨身「為學生擋子彈」，在三天內成立「文化界監察暴力行動組」，逾50人參加，五名召集人分別是港大社會工作及社會行政學系副教授何式凝、演藝學院電影電視學院院長舒琪、作家陳慧、音樂人黃耀明及何韻詩。 號召各界發聲　監察暴力 新成立行動組昨晚響應學聯參與金鐘集會及上台讀出聲明，譴責梁振英管治班子濫用暴力，會走上最前線喝止一切加諸在和平抗爭者身上的暴力行為；與和平抗爭者並肩作戰，直至成功爭取真普選。集會人士報以熱烈歡呼聲。 文化界監察暴力行動組會在集會場地設帳篷，輪流有人留守，與學生同行；召集人何式凝表示，文化界反暴力行動組源起上周六，當時傳言會武力清場，很多人緊張、不安，她聯繫黃耀明、何韻詩等人商討，希望號召不同界別發聲，制止暴力；她強調，每個港人都有責任爭取普選、監察暴力，不讓恐懼阻止市民爭取正義，並指每個人也有道義責任守護學生，「佢要咁（清場），我一定要硬食」。導演舒琪指，見到留守學生、市民連續13日在場，有種孤獨感，他會守在現場，讓學生知道有更多成年人同在，即使真正暴力來臨，他也不會離棄。他慨嘆學生不被成年人所信任，但他想說：「我哋信你。」 明哥親身到場　不怕遇襲 召集人之一黃耀明強調，各個界別只發聲明已不足夠，而演藝界人士有知名度，站出來可令更多人關注事件，「唔係check-in影張相，要行出嚟，要有action，唔可以咁曲線支持，希望可以行多一步」。他相信藝人發聲可讓學生、市民有更多勇氣、力量撐下去。 黃耀明表示會親身到場撐學生，因本身夜瞓，預計凌晨在場；若有暴力襲擊或清場，會留守現場並喝止暴力襲擊平民百姓和同學，「我哋話咗同同學一齊，如果同學唔set底線，我哋唔會set，我哋同佢哋一齊」。被問會否憂慮受到襲擊，他堅定地說：「點解我要考慮（人身安全）呢？佢哋都唔考慮，點解我要考慮？」承諾會與學生同行到最後一刻。 何韻詩則說最關心在場學生，因為他們連續10多日留守，承受與家人爭執壓力，她願意在現場與留守者分享。至於面對暴力，她認為不能硬碰硬，呼籲以軟功回應。
20141011-5,20141011,5,陳慧通宵留守傾談,陳慧通宵留守傾談 【本報訊】文化界監察暴力行動組昨晚9時許在金鐘「雨傘廣場」、中信大廈天橋底設置帳篷，象徵「學生並不孤單」；何韻詩、黃耀明、何式凝、潘達培或席地而坐、或抱手站立，自動分成幾個小組，與身邊現職幼稚園教師、樹仁大學英文系學生談抗爭，談家人對運動立場不同，談通宵留守的辛酸。其中作家陳慧會通宵留守帳篷，學生可隨時入內傾談。 盼改變無立場市民 黃耀明和何韻詩特別關注同學與家庭成員爭執，何韻詩認為要與父母慢慢溝通，又提供最近聽到一個建議答案，去回應父母對長期抗爭的質問，「其實我咁有正義感，咁有良知，係你教出嚟」。 黃耀明建議，利用互聯網上普選懶人包，向父母解釋爭取普選重要性。他又指年輕一輩堅持信念最重要，「你哋keep住諗法，世界就會改變」。 樹仁英文系三年級生Eli指，文化演藝界有號召力，可改變一些無立場或誤解學生的市民看法。  另一位同學Alice指，學生為運動押上自己前途，而演藝界可能面對封殺、不能在內地登台，他們能夠為民發聲，亦是押上自己前途。Alice表示，會嘗試何韻詩建議，認為演藝界在公眾層面發聲最有用，「普通市民講10萬句，唔夠佢哋講幾句」。 第一個通宵留守的陳慧笑言在馬路「瞓唔着」，會守在帳篷直至天光，等候學生到來傾談。她慨嘆學生雖然很堅持，但在傾談間聽得出他們內心有情緒。
20141011-6,20141011,6,無名英雄緊守崗位,"無名英雄緊守崗位 【本報訊】佔領行動持續多日，背後有一班「無名英雄」緊守崗位，無私付出。在昨晚金鐘集會上，多名義工上台發言。由警方發射催淚彈一刻便在金鐘保護學生的物資站義工Yoko說，物資站是市民之間的橋樑，左鄰右里互相幫助；也像古代河流，逐漸有佔領者在附近聚居。她直言，就算政務司長林鄭月娥拒絕與學生對話，也不會退下來：「只要有市民一日，就有我哋物資站。」 百名公院醫生支持 另一批無名英雄是一群清理垃圾的學生和市民。有學生憶述，佔領行動之初，垃圾不斷累積，金鐘廊附近，垃圾堆積一度惡劣至有蛆蟲，在巴士站也有死老鼠，但義工仍願意幫手。 醫療隊也功不可沒。召集人歐耀佳說，罷課之初只有約160名醫護人員義務參與。但經歷學生重奪公民廣場和警方發射催淚彈，醫療隊facebook專頁已有4,500名醫護人員加入，包括100名公立醫院醫生及超過500名護士，也有很多念醫科和護理學的學生，以及大批急救人員。醫療隊其中一名成員阿邦說，佔領行動非常和平，甚少要出動，「雖然成日冇得瞓，但係非常值得」。 佔領行動遍地開花，旺角和銅鑼灣留守人士和義工也上台分享。「師奶撐！」旺角留守者楊湄說，義工當中有大學生、中學生和地盤扎鐵工人，「佢哋朝早返工前路過嚟睇睇，晚黑再嚟現場支持」。義工Sunny在9月28日在灣仔中過催淚彈後，便一直留守銅鑼灣。他說每個佔領人士都是英雄，每個人都是命運自決者。"
20141011-7,20141011,7,學聯暫開金鐘道放行電車,"學聯暫開金鐘道放行電車 【本報訊】談判路上，巿民處處退讓，最新讓出的是金鐘道的電車路段。學聯昨日在社交網站上表示，與留守金鐘道的示威者和電車公司商討後，同意協助暫開金鐘道的電車路段，讓八輛空電車駛回跑馬地，恢復該區電車服務。學聯強調，留守金鐘道是要向政府施壓，並非蓄意阻礙市民日常生活。 警察公共關係科高級警司江敏強昨午批評佔領令維園及西港城電車服務受阻，對跑馬地居民造成不便。 同一時間，學聯在社交網站公佈暫開金鐘道電車路段的消息，指留守金鐘道並非為了抗衡市民及蓄意阻礙市民日常生活，而是希望透過佔領街道向政府施壓，使特區政府及早正視香港人對於真普選的訴求。運輸署助理署長蘇祐安形容示威者與電車公司達成協議，讓八輛電車返回跑馬地是好的開始。 對於學民思潮等組織呼籲更多市民紮營留守，江敏強批評行為不負責任，亦可能要負上法律責任。他希望集會人士尊重他人正常生活權利，又指摘市民將道路當成遊樂場，肆意「打邊爐」，放置「碌架床」、乒乓球桌等，晚上亦不斷叫囂影響當區居民，令旺角成為高風險地區。 政府指佔領令部門缺文具 行政署長蔡潔如在政府跨部門記者會上表示，過去五日政總3,000名員工只能經海富天橋到政總上班，而示威者只讓部份特定車輛如救護車、復康巴士、文件及送水車輛進入政總，令政總車流由每日700架次減至13架次，工作效率大受影響。 蔡潔如又指，部份司局不敢和示威者商討放行特定車輛，令部份部門缺水缺文具，要向行政署借水。 灣仔及中西區全面復課兩日，教育局首席助理秘書長黃淑華表示，今日有三成幼稚園校車不能準時抵達，中小學學生遲到情況減少，平均約遲5至10分鐘。"
20141011-8,20141011,8,倡開公民廣場換開路,倡開公民廣場換開路 【本報訊】「阻人返工」的，是佔領者還是政府？學聯昨提出交換建議，副秘書長岑敖暉稱，若政府願意重開公民廣場給集會人士，學聯願考慮重開金鐘道或其他道路，又指未來三天是迫使政府回應訴求的黃金時期，學聯會因應市民的參與情況調整策略，現階段難籲巿民撤退，「如果連對話呢個咁卑微嘅訴求都達唔到嘅話，係好難向堅持咗咁耐嘅巿民交代」。 「市民已釋出善意」 佔中遍地開花，緣起是警方阻止巿民進入公民廣場，結果巿民人數太多逼出干諾道中。岑敖暉昨日出席電台節目後表示，若政府願意重開公民廣場給集會人士，學聯願意考慮重開金鐘道或其他道路。岑指，當初因為很多市民走上街頭，政府才願意對話，但現在政府出爾反爾，擱置會面。他表示，集會人士多次釋出善意，包括讓出通道予在政府總部上班的人員，但政府卻寸步不讓，如學聯此刻撤退，難向一直堅持的市民交代，「唯一前提係政府必須要作出讓步，或者係展示善意，因為過去呢一星期，巿民已經不斷釋出善意，包括開放特首辦畀警員或者公務員上班」。
20141011-9,20141011,9,"DTZ管理人安永　最大債權人RBS　不知梁收5,000萬資深大律師：或涉受賄","DTZ管理人安永　最大債權人RBS　不知梁收5,000萬 資深大律師：或涉受賄 【梁振英涉貪】 【本報訊】特首梁振英秘密收取澳洲財團UGL的5,000萬元巨款，事件中兩大持份公司安永會計師事務所和蘇格蘭皇家銀行再開腔，重申對梁振英與UGL的協議內容毫不知情；有廉署前人員認為梁振英收取非法回佣的證據越來越充份。醜聞主角梁振英就繼續龜縮不露面，連特首辦亦未有回覆查詢。 記者：林偉聰　梁御和　張婷婷 向梁提供巨款的UGL，前日發聲明指最大債權人蘇格蘭皇家銀行（RBS）是知悉公司有意與梁振英簽訂協議，但RBS前晚就表明，並無參與制訂協議的談判，對協議的條款和梁振英收取的金額均不知情。安永會計師事務所亦發表聲明，重申作為管理人，安永並不知悉UGL與其他人士之間的協議詳情。 收購價扣除　損債權人利益 安永聲明又交代DTZ當年的賣盤過程，指出UGL當年以9,650萬英鎊（約12億港元）提出收購DTZ的業務，是最佳和唯一可行的買家建議，交易促成令DTZ得以繼續業務及保住全球4,700個職位。 UGL早前表明，梁振英收取的400萬鎊報酬在收購價中扣除，安永聲明就指收購價即使全數支付RBS，仍不足以清償1.1億鎊（約13.7億港元）的債務；又指其他債權人合共持有2,000萬鎊（約2.5億港元）債務，同樣不能以賣盤所得償還。 綜合連日回應，DTZ管理人安永、時任主席Tim Melville-Ross、和最大債權人RBS均對梁振英收取巨款表示不知悉；記者以電郵向DTZ當年的幾位董事查詢，但未獲回覆。 民主黨總幹事、廉署前調查主任林卓廷質疑，UGL指RBS知悉協議，是涉嫌「講大話」，掩飾與梁的枱底交易。梁在董事局投票支持賣盤予UGL後收取巨額報酬，UGL亦承認梁的報酬會從收購價中扣除，林認為梁收取非法回佣並出賣股東和債權人利益的證據越來越充份。 資深大律師湯家驊認為，如管理人和債權人不知梁振英收取UGL酬金，安排並不合理。他指普通法地區對董事誠信責任（fiduciary duty）有嚴格要求，梁振英當時作為DTZ董事，根據案例必須經股東一致同意才可收酬金；他指梁取得酬金，全因他是DTZ董事，即受託人（fiduciary）的身份，法律上規定這筆錢須交還公司，亦有責任向管理人和股東披露其與UGL的合約，否則便違反誠信責任。 會計師質疑利益衝突促解釋 湯不同意有人指UGL和梁的安排屬「黃金握手」之類的常見離職安排，因「黃金握手」是由僱主向僱員提供，並非由買家秘密向賣方僱員提供；後者可能涉及行賄。正常做法是買賣雙方商討收購條件時，要求賣方確保某些員工不另起爐灶競爭或挖角，由賣方跟其僱員作安排。 梁振英日前聲稱簽約時已經表明有利益衝突時不會為UGL提供服務，以示自己上任後無為UGL工作。會計師蒲錦文反駁，梁振英作為擁有最大公權力的特首，理應另立合約，列明提供服務的安排在12年7月1日之前終止，甚至索性取消合約，「應解釋清楚，唔係『簽約之前未做特首』就咁一句算數」。 梁振英昨未有露面，記者向特首辦查詢訂立協議有否通知董事局、安永和RBS、當選後為何不取消合約等，一律不獲回覆。"
