key,date,article_daily_id,title,text
20141011-56,20141011,56,隔牆有耳：狼英清場　張建宗孭鑊？ - 李八方,隔牆有耳： 狼英清場　張建宗孭鑊？ - 李八方 呢排市民好關心狼英、奶媽林鄭會唔會借終止談判為清場開路，特區政府噚日宣佈，奶媽帶晒班局長周六出發去廣州，代表特區政府出席「泛珠論壇」歡迎晚宴同開幕禮，而狼英就星期日晚去廣州，會合班官同泛珠不同省區、澳門特首崔世安開聯席會議，而奶媽唔喺香港期間，就由勞工及福利局局長張建宗署理政務司司長。 有泛民知道呢個消息，就好認真同八方講，狼英會唔會趁佢同奶媽唔喺香港，指使禿鷹清場，將隻鑊卸畀張建宗頂？反正如奶媽所講，鎮唔鎮壓佢冇權出聲，只係局外人，咁搵張建宗孭咗佢有乜奇！但有人話張建宗只識講「全方位一條龍服務」，咁點見傳媒解畫！唔通話「全方位一條龍清場」咩？
20141011-57,20141011,57,隔牆有耳：阿人唱生日歌　元秋嬲豬 - 李八方,隔牆有耳： 阿人唱生日歌　元秋嬲豬 - 李八方 佔中市民用生日歌「反擊」反佔中暴民，經網上瘋傳，已經街知巷聞，凡撐佔中者均已運用純熟，好似噚日立法會內務委員會辯論用唔用特權法查佔中，平時逢特權法必反嘅鼠王芬，一時話佔中違法，將啲政治風帶入純樸校園，搞到反佔中嘅同學遭受白色恐怖，一時仲緊跟左報論調，話佔中背後有英美勢力。 相信唔少人聽到都覺得受夠喇，所以工黨主席李卓人突然出「武器」，大聲唱生日歌，「恭祝你福壽與天齊，慶賀你生辰快樂」，點知民建聯元秋姐隨即發難，大大聲問立法會唱得歌㗎？不過生日歌呢招已經打窒鼠王芬度氣，謬論被及時阻止。冇幾耐之後，球證亦吹起完場雞，鼠王芬發言時間夠鐘。
20141011-58,20141011,58,隔牆有耳：內會選主席　大嚿先拉布 - 李八方,隔牆有耳： 內會選主席　大嚿先拉布 - 李八方 泛民話明呢屆立法會玩不合作，噚日內務委員會改選正副主席，立即出現「第一拉」。原本經民聯梁君彥係必定成功連任，不過梁君彥獲提名後，大嚿陳偉業開始玩「拉布」：先擺公民黨湯家驊上枱，推選佢做主席，湯家驊梗係唔接受，跟住大嚿就陸續提名元秋蔣麗芸、工聯會王國興、新民黨田北辰、工業界林大輝，一味拖時間，最好笑係田二少拒絕大嚿好意理由係「第五個先諗起我，唔好喇」。 呢個時候，人力陳志全亦玩埋一份，提名長毛，長毛欣然接受，仲話佢嘅政綱係會做足手續，開會打定電話畀習近平、張德江、狼英同林鄭，總之「上通天庭，下落地獄」，仲話取消㩒制投票，改為人大式鼓掌通過。估唔到最後長毛都有14票支持，而內會副主席無意外地由湯家驊做番。
20141011-59,20141011,59,隔牆有耳：齊昕fb發帖　話要告外媒 - 李八方,隔牆有耳： 齊昕fb發帖　話要告外媒 - 李八方 狼英個女梁齊昕成日喺facebook挑機，慌死冇人關注佢，最新「傑作」係佢發帖，警告包括《The Business Insider》、《每日郵報》（The Daily Mail）、《Huffington Post》等外媒，話要佢哋要移除涉誹謗文章同公開道歉，否則「別無選擇，只能採取法律行動，控告你們誹謗」，並強調「已經警告過你們了」（I shall have no option left other than to take legal action and sue you for libel. I have warned you.），八方相信齊昕係指有關佢買首飾報道，佢又警告埋其他誹謗佢、盜用佢身份嘅網民，「警察會搵你哋，玩得開心啲！」齊昕仲話「慶幸」自己讀過科技法律課程，自己對誹謗法非常熟悉云云，但八方記得佢好似未畢業喎，有讀過係咪就代表識呢？
20141011-60,20141011,60,八方人物：港產戰地女記者：唔見證會後悔,八方人物： 港產戰地女記者：唔見證會後悔 雨傘革命，全球注視，但在國際媒體之中，沒多少人像童𡢞瑩（Nicole Tung）這樣肉緊，在香港土生土長，她是罕有的港產戰地記者，長年派駐敍利亞，見證恐怖組織斬殺記者和平民，也見證穆巴拉克獨裁統治倒台。那管見盡生死，看到熟悉的干諾道中，爆發第一枚催淚彈，還是心生一震，「香港最重要嘅時刻，唔返嚟，我一定會後悔」。今日新聞明日歷史，被譽為最美麗的戰地女記者，溫柔的說。 訪問Nicole，要很機動。約好下午3時金鐘佔領區見面，廣東道突然鬧出有人拆鐵馬，未及聯絡，她已人在現場。過去一星期，她與無數香港人一樣，就像馬達，無法停下來。「只可短留香港一星期，唔想錯過，惟有盡量做」。身形纖瘦，長髮飄逸，儘管疲態畢露，卻禮貌周周，很難想像，眼前的可人兒，是出入戰地的鐵血女記者。 「過去一星期，香港真係好美。」替《時代雜誌》來港拍照，明日又得早機返紐約。已屆午夜，她還在路中。這夜，明月高掛，已是第七個通宵，偌大的告士打道，夜涼如水，紅綿道天橋掛滿橫額，兩邊是席地而坐的學生。由金鐘趕往灣仔的路，邊行邊談，她直言，置身遍佈港九的民主大廣場，讓她想起八九民運，「六四嗰一年，我三歲，那是其他人告訴我嘅歷史畫面」。走在前線，見證明日的歷史，Nicole說，讓她忘我。 「唔好令歷史變成空白」 「今日嘅新聞，係明日嘅歷史，記者嘅責任係：唔好令歷史變成空白」。出生中產家庭，父母是生意人，性格獨立的Nicole卻不甘安逸。09年紐約大學新聞和歷史系畢業，踏上獨立記者之路。探討退伍美軍生活、走進反卡達菲政權武裝大本營；而最凶險一役，要數派駐敍利亞採訪，今年8月，美國記者福利（James Foley）被恐怖組織「伊斯蘭國」（IS）斬首，震驚全球。福利被綁架前，和他並肩採訪六個月的，正是Nicole。 「對比中東國家，香港嘅示威活動，的確和平又有秩序，難怪國際媒體都感到驚訝」。回來了，陪香港人走了一小段路，又得離開，重回中東，風塵僕僕，但她說很值得，「呢個係香港人最重要嘅時刻，我唔可以錯過」。 父母擔心她的生命安全，她就用工作的熱誠，說服父母，「冇佢哋嘅支持，我根本唔可以走咁遠」，她說。　 記者   呂麗嬋
20141011-61,20141011,61,【壹錘】巧手林鄭　推鑊畀狼英,【壹錘】 巧手林鄭　推鑊畀狼英 市民佔領街頭十多日，政府再次放棄與學生談判的機會。對此，有人認為是因為政府旨在拖延學生，讓整個運動自行瓦解。工黨主席李卓人在節目《壹錘定音》中則表示，這次談判拉倒是因為政務司司長林鄭月娥想將責任卸給特首梁振英。 林鄭月娥自稱「局外人」，李卓人指這明顯表示她對現時情況已「撒手不管」，將責任全卸予梁振英。李卓人提到，梁振英之前已經表明，對於林鄭處理佔領運動已感到憤怒和嫉妒，不想林鄭獨領風騷，林鄭眼見如此，反正與學生談判不會有顯著成果，不如讓梁振英自行處理今次危機。
20141011-62,20141011,62,飛常Playgroup：10歲男孩的演講 - 蘇菲,"飛常Playgroup： 10歲男孩的演講 - 蘇菲 報章報道一位年僅10歲的小男孩，晚上站在金鐘的馬路石壆上，拿咪演講兩分鐘。我上YouTube看見他以稚氣的雞仔聲、情緒帶點激動地說：「我雖然只得10歲，係一個小朋友，但我覺得香港市民夠膽企喺度，好勇敢，一齊爭普選……我未見過咁多人咁堅持咁和平進行活動，我覺得香港人好犀利！」 而網友的評論，卻也有不少質疑，他們指10歲不懂事，肯定受人擺佈。這帶出一個問題：10歲孩子的心智，能明白甚麼是真普選嗎？ 我敢說：一定明白！普選的事，莫說10歲，6歲都能明白。 幼園亦一人一票選舉 回想囡囡在幼稚園高班時，學校安排小領袖選舉活動，誰有興趣當小領袖，就自己擬備政綱參選。結果，全班同學都成了候選人、備了政綱，內容不一，有人承諾請求老師給多點玩樂時間、茶點時可吃朱古力和曲奇餅；有人承諾幫缺課同學在功課簿上起字頭等……接下來，老師分三天讓同學輪流講解政綱，最後就是一人一票選出小領袖。 真正的普選，就是這樣簡單。這群6歲幼稚園學生人生第一次的選舉，就是無篩選、一人一票，下次你說要落閘限制候選人，他們一定大叫不公平。 話說回頭，因為我是大人，很明白大人的包袱很難放下，對於學生、孩子，我食鹽多過你食米的基因深植內心。像批評男孩僅10歲未能分辨是非，就和早期指學生是受人煽動的言論一般傲慢。 只有那未被污染的心，才能無視糾纏的利益瓜葛，看見是非。耶穌向門徒說：「是就說是，非就說非。」試問誰比較容易實踐耶穌的教導？是大人、抑或孩子？ 刻下局勢詭異多變，突然想起《小小世界》：It's a world of laughter, and a world of tears. It's a world of hopes and a world of fears. There's so much that we share and it's time we're aware, it's a small world after all。 期望在我們的小小世界裏，食鹽食米者互相補足，團結闢路。 作者蘇菲，有小型飛機師牌的媽媽，拒做直升機家長，讓孩子翱翔。 電郵：mailto:faicosmos@gmail.com 蘇菲"
20141011-63,20141011,63,蘋果會客室,蘋果會客室 《蘋果》會客室是本報與讀者及廣告客戶的溝通橋樑，歡迎來函或來電提供意見、或指正錯誤。 電話：2929 0000     傳真：2370 3283     電郵：mailto:adnews@appledaily.com
20141011-64,20141011,64,家強爆Beyond拆夥內幕阿Paul刻薄：唔想養世榮,家強爆Beyond拆夥內幕 阿Paul刻薄：唔想養世榮 Beyond的《海闊天空》近日猶如「兩傘革命」主題曲，響遍四方，不過海闊天空卻容不下成員黃家強和黃貫中（Paul）。去年被Paul狂數五宗罪的家強，前晚在微博發表逾5千字的文章還擊，狂數Paul的八宗罪同時，更大爆Beyond解散的真正原因，是Paul「不想再養世榮」。 一直有傳黃貫中懷疑黃家強向傳媒爆料，洩露他與朱茵到泰國旅行行蹤，導致兄弟反目。直至去年，Paul在微博爆粗鬧家強將他抹黑，狂數家強五宗罪，二人正式決裂。過去一年，家強一直保持緘默，但卻不停遭Paul的粉絲數臭，指他利用已故胞兄黃家駒賺錢，而Paul助手Sam，近日亦在微博與家強開火，因家強在微博斥警方使用暴力衝擊自由實在可恥，Sam即轉貼並指家強搞港獨，教唆粉絲煽動分裂云云。家強不忿被連番抹黑，前晚11時半，在微博發表一篇逾5千字、題為「真相」的文章，反駁前經理人Leslie（陳健添）的指控外，又力數Paul八宗罪，更大爆Beyond解散真正原因是Paul嫌棄世榮。 為隱瞞多年而道歉 家強謂：「以下內容我對天發誓，以我和家人性命擔保，全部千真萬確，如有謊言我絕子絕孫……去年為了紀念家駒我保持沉默，對於近10年的流言蜚語和無理指控，少發聲希望小事化無，好讓人可以有自我反思的機會，但是清者自清的態度對於一些只求利益不擇手段的人來說便正好是他們乘虛而入的好機會，今次經過一番審慎的考慮，與其要反駁陳健添先生和黃貫中先生的指控，倒不如在此亦向所有歌迷朋友交代一個真實的答案。」 文章中，家強直指Beyond解散是Paul嫌棄世榮，他謂：「99年Beyond和滾石唱片合約完結前，黃貫中親口對我說不想再養世榮了，我好驚訝，何出此言，他說他付出得太多，平均分我們的收入對他不公平，所以他要個人發展；首先，我不認為我和世榮沒有付出，這是他的說法，雖然我對這個解散或分開的理由不認同，但沒有選擇之下只好接受，這些傷透心的話我埋藏了15年，從沒公開這真正的解散原因，只說音樂上有分歧來維護他，亦沒有對世榮說過。對不起，世榮，希望你也寬恕我，一直沒告訴你。」 被指利用家駒做騷 家強指05年Beyond告別演唱會，他告訴Paul想和世榮三人作一首有關Beyond故事歌曲，怎料Paul卻搶在之前完成，不讓家強和世榮參與，家強直斥是不尊重他人。後來世榮和家強拒絕接受Paul這首《故事》，於是Paul在告別騷對他不瞅不睬，家強表示：「去年家駒20周年，他竟然把這首《故事》說成是為紀念家駒而寫，而我不讓他發表，簡直極度扭曲了。」家強又指08年他以家人身份去舉辦紀念家駒的活動，於是主動聯絡Paul演出。家強說：「紀念活動非常成功，歌迷感動，他與我重修舊好，一起巡演一生樂與怒，當一切畫上完美的句號。原來在今天，他的眼裏我是利用家駒來做個人show，他甚麼也沒做，但竟然覺得自己戲份少……由三人Beyond的六年裏到《抗戰二十年》這首歌，我就知道他對家駒的情義不再了……家駒的耕耘得不到收穫，反而我們在家駒的光環下可以繼續追尋理想，他怎可以忘記得一乾二淨。」 另外，家強又提到家駒與林楚麒的一段關係，他謂：「當年家駒和林小姐之所以分手，家駒告訴我是被她欺騙了，非常討厭這個女人，很決絕地與她分手，騙了甚麼是家駒的私隱我不想說。當時和家駒拍拖已有大半年的女朋友是簡小姐，所以林小姐要做未亡人這是不可能成立的。」家強最後並留言從此退出微博。 記者昨致電家強，他說：「冇回應，要講已經喺微博講晒。」而家強所屬的大岳娛樂昨發聲明，指一切誹謗家強言論及證據已交律師處理。至於Paul和世榮亦沒有接聽電話，但據悉世榮早已聽聞Paul嫌棄自己的傳聞，但因與對方從小認識，所以不會怪責對方。 採訪：皓騫
20141011-65,20141011,65,逐一還擊：家強數黃貫中8宗罪,逐一還擊：家強數黃貫中8宗罪 黃家強前晚在微博貼文狂數黃貫中8宗罪，並就黃貫中多年來的指控逐一還擊。 【1】 99年Paul對家強表示不想再養世榮，認為平均分Beyond收入對他不公平，所以要個人發展。 【2】 05年與Paul提議三子合作寫一首關於Beyond故事的歌曲，但Paul不讓他和世榮參與，獨自完成《故事》。家強有感不受尊重而否決該歌曲，其後Paul在Beyond告別演唱會對他不瞅不睬。去年Paul發表《故事》一曲，把這歌說是紀念家駒而寫，更表示家強不讓他發表。 【3】 08年家強舉辦紀念家駒活動，事後Paul指家強利用家駒做個人騷，覺得自己戲份少。曾在Beyond的六年間，Paul一直不批准起用家駒遺作。 【4】 Paul因個唱入座率問題與記者掀罵戰，家強出手勸他冷靜，卻被Paul歌迷反罵他不是兄弟，是一堆屎。 【5】 發短訊問Paul要一張紀念家駒的照片，但不獲回覆，其後Paul說照片一早已給家強。 【6】 Paul跟記者鬧翻，家強與該記者合照，被說成與該記者一夥陷害Paul。 【7】 家強因被助手欺騙而嬲到象徵式打了對方一下，之後因對方工作態度出問題而把他辭掉，並只告訴Paul一人，但最後竟然變了打助手黑材料。 【8】 否認以賠償金為家駒建音樂學校，生活上的消費也被Paul轉發抹黑。
20141011-66,20141011,66,光輝歲月：此情不再,光輝歲月：此情不再 八十年代出道的Beyond原本有5位成員，88年成員劉志遠退出後，Beyond四子合力創造傳奇，將樂隊推進最高峯，更衝出香港，獲封香港最具代表性的殿堂級搖滾樂隊，世界各地只要有華人的地方，就有Beyond的歌曲。惟93年黃家駒離世後，三子反目，此情不再。 推出大碟《亞拉伯跳舞女郎》後，劉志遠宣佈要往外地讀書而退出，直至08年，劉志遠才坦承當年離隊是因為與家強吵大鑊，一時意氣下才決定離隊。 Beyond四子一帆風順，是華語樂壇的殿堂級樂隊。92年簽約日本Amuse積極開拓日本市場，翌年家駒在日本參與綜藝節目時，從2.7米高的舞台墮地死亡。 家駒離世後，其餘三子停工四個月。同年11月商業電台的「創作人音樂會」演唱中，三人表示會繼承家駒的遺志，繼續出版專輯。 2005年Beyond舉行「Beyond The Story Live 2005」世界告別巡迴演唱會，最後一站為新加坡。樂隊解散後，三人繼續以「音樂人」姿態各自發展。 反目多年：積怨甚深 黃家強前晚發長微博，聲討黃貫中及前經理人陳健添（Leslie），其實自從黃家駒離世後，Beyond經常不咬弦，兄弟反目，積怨甚深。 鬧爆前經理人 Leslie於98年推出Beyond未面世的《真的Beyond》大碟，被指發死人財，Paul形容Leslie為「吸屎魚」。03年，Leslie再將家駒作品《原來不可怕》予新組合Bliss主唱，惹來Beyond三子怒轟。 直指家強放料 03年10月，Paul與朱茵到蘇梅島旅行，朱茵被傳媒拍下素顏和三點式照片，朱茵指有人放料，矛頭直指家強。 一開騷又不和 05年Beyond開騷，有傳家強與Paul因選曲而意見不合，互當透明。08年Paul與世榮飛起家強，在北京舉行《Beyond雙傑演唱會》，惹家強不滿，關係再度陷入僵局。翌年家強與Paul關係一度和好合作演唱會，惟完騷後又因出碟問題再度反面。 暗寸普通話差 今年家駒冥壽，家強再與Leslie在微博掀罵戰，Leslie暗寸家強普通話差，將自己的名字講成粗口。
20141011-67,20141011,67,經理人寸爆：我明天再回應,經理人寸爆：我明天再回應 黃家強與Beyond前經理人陳健添（Leslie）積怨多年，前晚家強在微博上載文章「真相」爆內幕，指家駒當年得悉簽下不平等合約時很氣憤，揚言會告Leslie告到底，只是訴訟前家駒發生意外，其後Beyond三子卻被Leslie反告誹謗，公司與他們研究後才決定終止案件。至於Leslie出書寫Beyond，家強指對方與他們只相處幾年，何來歷史故事？又斥家駒離世數年，Leslie突然把寫給黃父的版稅支票，改寫家駒的名字，令支票無法兌現。 家強更回應Leslie的言論，包括惡意誹謗、不平等合約、Leslie出書及指他爭歌唱等，Leslie即留言說文中很多理據令他支持不住，又回應家強說：「細看你的『真相』後，發覺部份內容有不少漏洞，你需不需要先收回去，重新處理好後，再讓我回應？那麼我今晚先看看電視，假如明天沒有收到你新的『真相』，我定會按目前這個版本給你一個公道回應。」 撰文：鑫淼
20141011-68,20141011,68,肥叔叔威震星洲來頭勁傅嘉莉認約會拒斬纜,肥叔叔威震星洲來頭勁 傅嘉莉認約會拒斬纜 現年29歲的混血女模傅嘉莉（Kelly）被本報獨家影到與四眼肥叔叔在的士車廂內又攬又啜，肥叔叔疑是有家室之人，同日晚上相約太太和女兒食飯。 昨日有讀者爆料，指肥叔叔來頭好勁，是新加坡知名人士，名叫Low Check Kian，現年55歲，除開設律師事務所外，更是市值23億坡紙（約140億港元）、船運公司NOL的董事，曾任世界頂尖的財務管理及顧問公司之一的美林證券亞太區主席，退休前是新加坡交易所獨立董事。Kelly昨日接受電話訪問時表示不清楚肥叔叔背景：「係去新加坡旅行，一班朋友聚會時認識，淨係知佢做投資，其他唔係太清楚。」 在朋友聚會認識 報道出街後，兩人仍有聯絡，問Kelly可有向肥叔叔致歉？她說：「大家都好明白當晚唔係報道所講嘅事，所以冇話sorry唔sorry。」會否避見？她說：「如果佢再嚟香港，又或者我再去新加坡，睇大家夾唔夾到時間，順其自然，但唔會單獨見面。」 早知有太太兒女 Kelly昨日返將軍澳開工，再為事件澄清，她說︰「嗰位係我一個外國返嚟香港嘅朋友，嗰日我自己去買嘢，咁啱佢喺附近就見個面。我哋係長輩同世姪女關係，唔係報道所寫咁樣。」但明明有片被影到錫嘴及額頭，Kelly口窒窒死撐說︰「唔係報道所寫親密動作，係角度問題，錯覺啫，冇錫過。」 Kelly又表示知道肥叔叔有太太及小朋友，但始終不是圈中人，不欲多談。她直言為事件感到不開心：「有啲唔開心，所以希望澄清，等家人唔使擔心。」 採訪：嵐山
20141011-69,20141011,69,反佔中藝人愛反口戴志偉稱遭恐嚇　嗌報警,反佔中藝人愛反口 戴志偉稱遭恐嚇　嗌報警 【雨傘革命】演藝界對雨傘革命反應兩極，祖國幫熊黛林、大馬拿督女莊思敏近日言論明顯反佔中，熊黛林早前在微博斥佔中學生行為可恥，莊思敏則於網上貼出學民思潮召集人黃之鋒拼河童照片，以及黃之鋒跟六四學運領袖王丹合照，擺明嘲笑他們殊途同歸。戴志偉亦於日前爆出在微信群組激進呼籲友人向佔中者掟雞蛋，他事後雖否認，但羅生門事件前晚有新發展，網上流出自稱群組中人姜先生貼出跟「Andy Tai」對話截圖，指證戴志偉講大話，截圖中的頭像和英文名跟戴志偉脗合。 死撐被冒名又提告 相中Andy Tai惡言反佔中，力指佔中令港人蒙受沉重經濟損失，群組友人見辣着火頭都留言勸交，姜先生卻覆Andy Tai指：「請你以後不要在公開場合再同我打招呼，因為你會好X瘀。」Andy Tai反擊：「是恐嚇我嗎？」姜先生昨說：「英雄？狗熊？當事人否認有講過，夠膽發放夠膽認！」Andy Tai不忿遭圍攻還拖：「姜XX請尊重自己！兇人只顯示你的EQ低！」 記者昨致電戴志偉，他指跟姜先生沒來往，力斥對方炒新聞，戴志偉表示已退出群組，再重申沒寫過「掟雞蛋」言論，並死撐被冒名：「可能係俾人hack（入侵）。」到底戴志偉支持佔中還是反佔中？他說：「我中立，希望香港和平、安居樂業。」戴志偉又不滿姜先生爆粗：「𠵱家佢恐嚇我呀？我要報警，再咁落去，我唔排除採取法律上行動。」戴志偉自稱昨欲往報案，其後改口說沒空。 莊思敏貼相當講笑 另外，昨日34歲牛一的熊黛林和莊思敏在九龍W酒店出席活動，遭網友圍插反佔中留言，熊黛林刻意漂白說：「識我啲人都知我好簡單，希望每人有工開有學返，可能大家呢幾日對我寫啲嘢特別敏感。我唔識政治，亦唔敢評論，我愛香港，唔想睇到唔開心嘅事發生。」熊黛林昨晚活動獲單身老闆張瀚霖送上過百萬鑽鏈賀壽，她謂是收過最重手禮物，同時避談舊愛郭富城。網友不值莊思敏人身攻擊黃之鋒，她說：「貼相嘅係私人平台，淨係想同朋友開玩笑，諗住無傷大雅，估唔到俾人截圖，令人唔高興，唔好意思，希望朋友唔好再將我私人嘢截圖。」 採訪：陳杰、張俊銘 攝影：陳志嵐
20141011-70,20141011,70,三大電影會撐警,三大電影會撐警 香港影業協會、香港電影商會、香港製片家協會，昨日聯名在報章刊登廣告，向警察致敬，更認同警察近日緊守崗位，令人尊敬。身為「文化監暴」召集人的舒琪，昨日在facebook轉載了該張相片，似乎有點不滿留言說：「難怪很多人都說，電影圈有很多黑社會。他們不代表我和很多人。」 香港影業協會主席為洪祖星，選委會會員約千多人，香港電影商會主席則為林建岳，其後亦有電影人貼上了一封信，指香港影業協會秘書處曾為此事致函會員，稱有關行動是由影協理事會大多數理事通過進行。 撰文：張嘉澄
20141011-71,20141011,71,李心潔選特首　避談梁振英,李心潔選特首　避談梁振英 李心潔、王宗堯和麥子樂等，昨日在銅鑼灣恒隆中心附近為港視劇集《選戰》拍外景，劇情交代扮演2022年特首候選人的心潔到街上拉票，卻遇上高空擲物擊中巿民，她上前為對方洗眼。這場戲跟近日爆出的雨傘革命之初銅鑼灣有人高空擲物何其相似，外景地點更與軒尼詩道的示威區僅一街之隔，吸引約30名途人圍觀，有指該劇可能是港視開台劇。 王宗堯收工去聲援 心潔獲粉絲上前做打氣手勢，問到她可覺特首梁振英合格？心潔笑着避談：「呢啲唔答啦。」助手隨即拉她離開。對於劇集內容貼近現實，佔中支持者王宗堯說：「係巿民關心嘅事，佔中頭一、兩日我好克制，都有去支持。」王宗堯揶揄梁振英：「佢有自己一套，鍾意拍片，聆聽方面差啲，特首應該體察民情。」就梁振英被爆秘密收受澳洲公司UGL巨款一事，王宗堯說：「佢應該正面回答。」麥子樂表示做特首應要有承擔，他和王宗堯有意在收工後到金鐘聲援集會。 採訪、攝影：譚倩宜
