key,date,article_daily_id,title,text
20141003-66,20141003,66,行斜台　上山掃墓　將軍澳墳場新設施　方便孝子賢孫,行斜台　上山掃墓　 將軍澳墳場新設施　方便孝子賢孫 【本報訊】昨日為重陽節，不少孝子賢孫趁假日帶同祭品登高掃墓，各區墳場聚集不少掃墓市民，其中將軍澳墳場的一段四十多級長梯級，已加建鐵製小斜台，方便攜重物手拉車的掃墓人士，不少到場拜祭先人的市民均謂省時方便，部份人認為斜台闊度不足，若擴闊至可讓輪椅人士上落最好。  記者：司徒韋桐 本港昨日天氣除間中有毛毛雨外，整日天色晴朗天氣炎熱，不少父母為延續重陽節傳統，帶同小孩到墳場拜祭先人，教導子女慎終追遠，全港多處墳場包括將軍澳墳場、柴灣華人永遠墳場以及鑽石山墳場，均有不少市民帶備香燭、冥鏹及燒肉水果等祭品進行拜祭。 燒豬貴逾一成 多名掃墓的市民稱今年的祭品較往年貴，尤其是燒豬貴去年逾一成，但為向先人表達孝心，無論祭品多貴都會買。其中在將軍澳墳場，進入墳場的最後一段四十多級長樓梯，有關方面在樓梯中央欄杆位置加建一段低斜度的斜台，以方便拿重物人士。 欄杆上掛有通告指斜台只適合手拉車，輪椅及嬰兒車不適合使用，但不少推着嬰兒車帶同小孩掃墓的市民，見斜台勉強可讓嬰兒車通過，都推着嬰兒車經斜台上山，部份市民落山時貪方便索性行斜台避行樓梯；而由於天氣炎熱，將軍澳區早上11時氣溫達31℃，有關方面為防掃墓人士中暑，沿途搭建數個臨時休息處，不少市民都帶備雨具遮太陽及擋雨，但仍有少數長者在上山時感到不適需要協助。 市民王先生昨偕同家人往將軍澳墳場掃墓，他說斜台設計方便，以前從調景嶺行至墳場需時半句鐘，但有了斜台拖住重物也可行快些，省時10分鐘。林小姐說以前無斜台拖重物祭品很辛苦，要逐級樓梯上，昨上墳場花了45分鐘，較去年少了十多分鐘。張先生指斜台方便好用，但闊度不足，若可加闊一個人位最好。
20141003-67,20141003,67,撬鎖賊連環爆地產舖,"撬鎖賊連環爆地產舖 【本報訊】深水埗發生連環爆竊案，賊人撬毀兩間地產舖玻璃門鎖潛入爆竊，掠去合共約3萬元財物，昨晨兩舖職員回來開工先後揭發報警，警方不排除兩案是同一批賊人所為，暫無人被捕。 為宣傳樓盤未關捲閘 首宗發生於福華街一間地產舖，昨晨11時許，姓文（59歲）女店東回來開舖，赫然發現玻璃門鎖被撬毀，舖內翻箱倒篋，於是報警，經點算後證實損失現金數百元，以及一部約值1,000元的電腦打印機。 文婦事後表示，該店開業兩年多，與丈夫一起經營，之前從沒發生過爆竊案，前晚9時許收舖，門口雖安裝捲閘，但為宣傳樓盤資料，讓途人收舖後仍能看到，只鎖上玻璃門，不關捲閘，懷疑因此令賊人有機可乘。 約一小時後，距離現場50米的長沙灣道一間地產舖，姓黃（29歲）男職員開舖亦發現店舖遇竊，店內凌亂不堪。 黃報稱損失現金1.6萬元，一部手提電腦及電腦屏幕總值1萬元，並指店內安裝了閉路電視，惟僱主現時身在內地，未能取得錄影片段。 警方接報到查，證實賊人手法相似，同樣撬毀玻璃門鎖潛入爆竊，不排除賊人用鐵筆撬鎖，兩宗案疑是同一批賊人所為，警方將合併調查。 其後鑑證科人員在兩店舖掃取指模，追查賊人身份，由於附近鴨竂街多回收二手電器的店舖，估計賊人可能將偷回來的電腦器材變賣套現，稍後會派警員與電器店負責聯絡，從箇中找尋線索。"
20141003-68,20141003,68,男童公園失蹤惹虛驚,男童公園失蹤惹虛驚 【本報訊】上水一名5歲男童昨午由婆婆帶到公園玩耍，其間意外失蹤，婆婆遍尋不獲，驚動大批警員搜索。事件一度惹來拐子疑雲，熱心網民也呼籲網友合力搜尋；幸至晚上警方終尋回男童，證實男童沒有受傷，事件有驚無險。 大批警員搜索 一度失蹤的5歲男童姓康。昨中午時分，66歲婆婆帶着「小康康」到上水清河邨公園玩耍；其間疑小康康四處奔走，婆婆一時分神看漏了眼，回過頭來即發現小康康不知所終，婆婆登時左顧右盼到處找尋，但始終不見小康康蹤影。及至下午近5時，婆婆心亂如麻，擔心小康康被人拐去，惟有報警求助。 警方接報大為緊張，出動大批警員到場搜索，又在現場嗌咪呼籲巿民提供消息，有熱心街坊知道有男童失蹤，亦立即在社區facebook廣傳消息，呼籲網友留意。 警方經過約兩個小時後，終在昨晚約7時於公園內尋回小康康，他並沒有受傷。
20141003-69,20141003,69,綿羊仔撞飛途人數米,綿羊仔撞飛途人數米 【本報訊】一名男子昨晚在尖沙嘴金巴利道橫過馬路時，遭一輛駛經的綿羊仔電單車撞倒，拋前數米墮地受重傷一度昏迷，救護員到場將事主送院搶救，警方正調查車禍起因。 司機連人帶車翻倒 被車撞傷的37歲男子姓江，手腳受傷，送院救治後已蘇醒，肇事綿羊仔電單車司機姓余，49歲，車禍現場為金巴利道28號君怡酒店對開馬路。 事發於昨日晚上7時許，現場消息表示，余駕綿羊仔電單車沿金巴利道向天文台道行駛，江則在行人路同方向行走，當余駕車駛至上址時，據悉江從行人路步出橫過馬路，余姓司機收掣不及將他撞倒，事主被撞飛，昏迷路中，電單車亦都連人帶車翻倒，司機無恙。 途人見發生車禍致電報警求助。救護員到場，替事主初步治療後，再由救護車將他送院救治。警方封鎖一段路面調查車禍起因。
20141003-70,20141003,70,醉酒婦失足墮海獲救,醉酒婦失足墮海獲救 【本報訊】一名43歲姓汪女子，前晚11時許在銅鑼灣怡東酒店對開避風塘墮海，惹跳海自殺驚魂。有熱心途人行經岸邊發現汪在海面載浮載沉，疑她遇溺，立即奮不顧身跳入海中把她救起，並致電報警。消防到場前，汪已獲救回岸上，救護員於是把她送院治理。警員經初步調查後，相信汪飲醉酒，不慎失足跌入海中，案件無可疑。
20141003-71,20141003,71,昨晚六合彩開獎結果,昨晚六合彩開獎結果
20141003-72,20141003,72,免疫力低　缺鐵質　易生痱滋,免疫力低　缺鐵質　易生痱滋 【本報訊】痱滋雖然不是大病，卻會令人疼痛難當，影響進食。醫生指出，痱滋沒有特定成因，但上班族常睡眠不足兼有壓力，會影響免疫力，增加生痱滋風險，使用外用藥物能有效舒緩症狀。惟患處若反覆不癒，則有可能是患上其他疾病的警號，如口腔癌，切勿掉以輕心。 記者：伍雅謙 痱滋屬小型口腔潰瘍，患處小於一厘米，呈圓形或橢圓形狀。聯合醫院高級牙科醫生甘振聲表示，痱滋的傷口甚淺，表面呈平滑或微微凹陷，傷口中央是白色或黃色，周邊則是紅色，一般7至14天會自行痊癒，也有部份痱滋傷口較深，「7、8日都未好唔需要擔心，有時成個月先好番」。 食薯片　刷錯牙　易刮損 甘醫生指出，痱滋沒有特定成因，一般由多重因素引起。當口腔黏膜有破損，身體會有發炎反應，若再感染細菌就會形成痱滋，需待一段時間才會痊癒。口腔黏膜分為兩種，第一種是有角質的黏膜，位於舌面、口腔上顎及牙齒附近的牙肉，這些地方不易破損，故較少出現痱滋。第二種黏膜沒有角質，較易有痱滋形成，如舌底、舌部邊緣、遠離牙齒的牙肉及嘴唇。 部份人如兒童特別容易患有痱滋，他稱可能與免疫力較低有關。兒童免疫力低，成年後因免疫力增強，有機會減少痱滋形成，而睡眠不足及壓力也會導致免疫力降低。部份人則因血液內的鐵質、維他命C及維他命B12不足，令口腔黏膜易受破壞而有痱滋，可透過驗血了解缺失的物質，補充後便會得到改善。另有研究指出，口腔衞生較差人士，痱滋情況也較差。刷牙方法出錯及經常進食熱氣食品如薯片等，也容易刮損黏膜引起痱滋。 芒果　菠蘿　消化口腔黏膜 坊間認為進食芒果、菠蘿及木瓜均易引起痱滋，他表示雖未有相關研究，但曾有發現這些食物內，有消化口腔黏膜的木瓜蛋白酶（Papain），故建議進食後最好立刻用清水漱口。 痱滋不能一時三刻便能解決，他表示藥物只能舒緩症狀，不能加快痊癒，一般使用具殺菌及減痛作用的外用藥物。嚴重者則需使用類固醇，以減低發炎及紅腫情況。他提醒，若使用含Chlorhexidine的殺菌漱口水，建議可用棉花棒蘸上少量，再點在患處，避免使用過多而影響味覺，並不建議使用超逾兩周。 不少人會用鹽治療痱滋，他提醒鹽水雖能殺菌，但過濃會令唾液減少。唾液有殺菌及潤滑作用，太少反會助長痱滋形成，所以如要使用鹽水，一茶匙鹽混合一杯溫水已足夠。
20141003-73,20141003,73,14日未癒　小心口腔癌,14日未癒　小心口腔癌 【本報訊】若口腔潰瘍嚴重，有機會不是痱滋小病，隨時是患上如扁平苔癬，甚至口腔癌等嚴重疾病。聯合醫院高級牙科醫生甘振聲提醒市民，若潰瘍遲遲未癒，用藥後也沒有絲毫改善，便要小心留意，並盡快求診，有機會要切除患處組織化驗，以便確診病症。 或患扁平苔癬 扁平苔癬患者一般是40歲以上中年人士，以女性較多。患者口腔容易受損及流血，傷口較大，呈紅色及有白色網狀紋，一般位於舌、腮及唇部。甘振聲指，此症成因不明，屬自身免疫失調所致，所以無藥物根治，只能用殺菌止痛的外用藥物來減輕不適，大部份患者症狀輕微。若出現嚴重疼痛至影響進食及吞嚥功能，醫生也可用激光為患者減輕患處的症狀。 此外，有部份疑似痱滋的口腔潰瘍，其實是早期口腔癌。 他提醒，若瘍口面積較痱滋大，並且14天後也未有任何改善，傷口凸起成山丘狀，甚至感到有硬塊，則有機會是口腔癌，建議應盡快求診化驗。
20141003-74,20141003,74,豆腐粉葛煲湯清胃熱,豆腐粉葛煲湯清胃熱 【本報訊】在中醫角度，痱滋屬於口瘡、舌瘡，由臟腑失調引起，成因眾多。香港中醫師公會會長關之義表示，舌尖生瘡，主要與長期捱夜及睡眠不足，引致虛火上升有關，市民誤飲涼茶，隨時越飲越虛。口腔內生瘡或「爛口角」多與脾胃積熱有關，飲用豆腐或粉葛煲湯，有清胃熱及預防痱滋作用。 廿四味令虛火變本加厲 關之義表示，平日接獲不少病人因痱滋求診，尤其上班族如OL，常見為舌尖生瘡，主要因長時間工作、睡眠不足引致虛火上升有關。市民可用麥冬煲水飲用，有降虛火作用，可預防舌瘡。 惟部份人誤解飲廿四味等涼茶，有治療口瘡或舌瘡的作用，最後令虛火變本加厲，令人越飲越虛，女性更容易出現頭暈、欠缺精神、經痛甚至月經失調的症狀，故提醒市民切勿胡亂飲用涼茶。 另外經常舌邊（即脷邊）生瘡的人士，多由工作忙碌及勞氣，導致肝火上升引起，需要滋陰降火。例如吃海參、玉竹有滋陰作用；吃雪耳、無花果等食材則可養陰清熱，均有預防作用。礙於市民一般未能分辨患病原因，若受口瘡、舌瘡困擾，最好向註冊中醫師求診，接受適當的中藥治療。 坊間有不少聲稱可治療痱滋的成藥，他表示，其實對口瘡或舌瘡只治標不治本，其主要針對口腔的潰瘍表面，發揮暫時止痛及緩解作用，但無助臟腑平衡，控制及預防痱滋生長。
20141003-75,20141003,75,健康Express醫療新知：舌頭肥大　阻塞氣道致窒息,健康Express醫療新知： 舌頭肥大　阻塞氣道致窒息 肥胖容易出現睡眠窒息，原因與「加大碼」舌頭有關。美國一項研究邀請180名肥胖人士參加，當中一半人患有睡眠窒息症。檢查後發現關鍵在於舌頭的大小與脂肪比率，研究顯示患病的參加者普遍有較大的舌頭，並有大量脂肪積聚在舌頭底部。進一步檢查顯示，舌頭過大不單止阻礙睡眠時的呼吸，其中的脂肪更會影響肌肉與骨骼連接，導致舌頭不能保持在正常位置，阻塞氣道。 研究顯示，癡肥一族出現舌頭肥大的比率較高，故更容易有睡眠窒息問題。研究人員指出需關注肥胖人士的舌頭狀況，並建議前線醫護人員設立相關的檢查項目，以便及早識別高危睡眠窒息患者。
20141003-76,20141003,76,健康Express醫療新知：年輕心臟病患　缺支援易復發,"健康Express醫療新知： 年輕心臟病患　缺支援易復發 年輕心臟病患者缺乏家庭及社交支援，病發後一年內是引發抑鬱等情緒波動的高危時段，康復進度也普遍較差。美國一項研究追蹤逾3,400名18至55歲的心臟病患者，於心臟病發後1至12個月內的健康狀況。結果發現因獨居、失業、酗酒等原因而缺乏家人或朋輩支援的患者，精神健康普遍較差。其中越年輕的患者，出現抑鬱及焦慮等症狀的比率越高。 研究又發現，缺乏支援的病人康復較差，有高血壓、糖尿病、高血脂等高危因素的比率偏高，並預期有較高的復發風險。研究人員建議，需加強缺乏照顧的心臟病患者出院後的醫療支援，因他們再入院所耗用的醫療資源會更高。"
20141003-77,20141003,77,健康Express醫療新知：戒煙做運動　娠糖尿風險減半,"健康Express醫療新知： 戒煙做運動　娠糖尿風險減半 女士們懷孕前若已實踐健康的生活模式，可減低患上妊娠糖尿病風險。美國一項研究跟進逾14,000名婦女產前及懷孕時的健康狀況，結果發現四個與妊娠糖尿有關的因素，包括在懷孕前已保持正常體重、飲食健康、經常運動及不吸煙。 研究顯示，能全部符合以上四個因素的參加者，在懷孕時罹患妊娠糖尿病的風險，較全部因素也不符的婦女低83%，單是運動及不吸煙兩項，已可將風險降低52%。 研究推算，如在懷孕前已實踐健康生活，可將妊娠糖尿病個案減半。研究人員指出，計劃懷孕是女士改變不良生活習慣的理想時機，包括戒煙及戒吃快餐零食等，不但有助減重，更可預防懷孕時血糖飆升。"
20141003-78,20141003,78,生命有價：理解自殺人士的困擾,生命有價：理解自殺人士的困擾 當看到有關自殺的新聞報道，我們或難以理解自殺人士的心情，甚至認為他們愚蠢、懦弱，對他們抱有負面看法。 然而從「生命熱線」預防自殺的服務角度來看，有自殺念頭的人通常面對怎樣的困擾呢？為甚麼要選擇放棄生命呢？ 主要感情經濟出問題 「生命熱線」的「24小時預防自殺熱線服務」的來電者，大部份是因為感情或婚姻問題而致電，另一個較多來電者面對的困擾是經濟及工作問題，例如曾有初出茅廬的大學生因人事問題出現情緒困擾。常言道：「人生不如意事十常八九」，人總會經歷過情緒受困擾的時候，但往往因為種種原因而無法表達。如果未能及時紓緩負面情緒，情緒受困擾的人士的自我形象會變得低落，甚至失去解難的信心。他們或會失眠、食慾不振、甚至變得不願與人接觸、交談等，這些都是有自殺念頭人士所發出的警號。 我們需要社會人士攜手預防自殺，包括關心有自殺念頭的人，有需要時尋求專業人士協助，並去了解及開放地討論自殺的議題等。「生命熱線」將於10月舉辦「死神休假企劃2014」，為機構的青少年生命教育項目籌款，活動將於銅鑼灣、尖沙嘴和中環進行，宣揚珍惜生命的訊息。 除了街頭募捐外，還會進行不同攤位活動，例如手繪、扭蛋機和「死神」放假踏單車活動，希望大眾支持是項活動，一起預防自殺個案，讓死神可以享受一個悠長的假期。如有興趣參與成為是次活動的義工，現尚餘少量名額，查詢及報名請致電2382 3102。 撰文：生命熱線 隔周五刊出
20141003-79,20141003,79,江湖滾熱辣 - 馬龍,江湖滾熱辣 - 馬龍 馬龍
20141003-80,20141003,80,隔牆有耳：催淚彈煙霧中肥佬黎背影登TIME封面 - 李八方,"隔牆有耳：催淚彈煙霧中 肥佬黎背影登TIME封面 - 李八方 身為茄喱啡卻鍊贏主角，肥佬黎唔知會唔會覺得好錯愕？話說《時代雜誌》亞洲版最新一期封面，以""The Umbrella Revolution（雨傘革命）""為題報道和平佔中運動，相中主角係9月28日警方施放催淚彈期間，撐傘企喺催淚彈煙霧間嘅男子，但撐傘男身後只見背影嘅男子，卻更加吸引港人焦點，事關其中一個人，就係壹傳媒老闆黎智英！ 疑似由兩張相合成 雨傘革命成為國際傳媒關注議題，外媒顯著報道當然唔出奇，但最新一期《時代雜誌》亞洲版封面，卻令唔少花生友感覺有啲事有蹺蹊！據知封面大相原來係由兩張相合成，除咗撐傘男主角，仲專登搵咗張有一個着住白色衫襯藍色牛仔褲嘅男子相襯底；相片可見企喺遠處嘅白衣男俾人攙扶住，有啲痛苦咁彎住腰。 唔少人睇多兩眼，從衣飾裝扮發現呢位男士係9.28連中兩彈嘅肥佬黎，當日肥佬黎受到催淚彈攻擊，嗆住彎腰當街流淚兼流鼻涕；估唔到佢呢個背影嘅感染力深獲雜誌「賞識」，以大配角身份化身封面人物！事有湊巧嘅係，肥佬黎不嬲瞓身力撐運動、兼且成日俾人話佢同外國勢力有關，唔知呢張「意外」封面照，會唔會又令佢惹嚟新一輪狙擊？ 李八方 mailto:pf_lee@appledaily.com"
20141003-81,20141003,81,隔牆有耳：抗爭戰場變遊客景點 - 李八方,"隔牆有耳： 抗爭戰場變遊客景點 - 李八方 雖然好多人都喺度抹黑，話佔中令旅客來港意欲大減，實影響香港經濟咁話喎！但八方所見，都唔係吖，唔少旅客反將俾市民佔領緊嘅中環同金鐘，當成最新嘅旅遊景點，反而大增遊港意欲。好似前日咁吖，喺中環寫有""HERE FOR DEMOCRACY""嘅石壆上，就有唔少遊客駐足，幾個外籍小朋友更加跳上石壆擺pose影相，仲讀出呢句英文。八方見到佢哋嘅家長，亦同班小朋友解釋，點解香港會出現呢個奇景；查實呢種旅遊，仲有教育意義啦！"
20141003-82,20141003,82,隔牆有耳：民主牆少女熱褲叫咪 - 李八方,隔牆有耳： 民主牆少女熱褲叫咪 - 李八方 全民大廣場，無數小花大作戰！嚟自大埔孫方中書院嘅中五美少女何諾桐，日前喺政總外將水馬化身民主牆，畀市民寫出普選心聲，成為抗爭市民check-in之處。唔少市民見佢弱質纖纖、但攞住大聲公奮力叫咪都異常感動，大讚小花力量唔可以睇小！原來連日佔鐘市民嘅訴求，已經貼滿咗成30幾隻水馬，何諾桐今日變陣，攞咗啲黑紙鋪喺地下「擴充版圖」，以免市民有訴求而冇位訴，結果又係一朝早就爆晒。 清秀妹何諾桐噚日冇再着校服現身，換咗清爽熱褲look亮相，唔少中外記者見佢咁落力，都不停搵佢做訪問。清秀妹笑言，爸爸見到佢上報，知佢好努力，仲叫佢加油。原來佢已經去咗政總成七日、發起民主牆都三日，話唔攰就呃人，但佢話會撐落去！
20141003-83,20141003,83,隔牆有耳：小忌廉戴黃絲帶打氣 - 李八方,隔牆有耳： 小忌廉戴黃絲帶打氣 - 李八方 香港雨傘革命引起全球關心，黃絲帶幾乎喺全世界主要城市都出現，facebook更加俾黃絲帶洗版，連動畫《我係小忌廉》嘅原作者高田明美都心繫香港，連日喺facebook分享有關香港佔中嘅新聞。噚日佢仲喺fb貼咗張小忌廉戴黃絲帶嘅圖，第一句就係「加油香港」，之後用日文寫出佢對香港民主嘅支持，中文意思係：「祝願香港能平穩地邁向民主化，為參與遊行人士的平安祈禱。」唔知各位小忌廉粉絲，會唔會響應「偶像」創作者嘅呼召呢？
20141003-84,20141003,84,隔牆有耳：劉細良重返舊地佔鐘 - 李八方,隔牆有耳： 劉細良重返舊地佔鐘 - 李八方 狼班子施政不堪，以前嘅政府中人都話冇眼睇；而前煲呔智囊劉細良（圖），連日都有重返以前辦公之地佔「鐘」！八方前日見到細良，見佢精神仲幾好，應該可以持續作戰。呢位前煲呔軍師，話港府出動催淚彈鎮壓係計劃嘅一部份，相信公眾假期結束後，港府會動員市民、商會打輿論戰，令市民同抗爭人士對立。 以前細良坐鎮《主場新聞》時，都不時撰文監督住狼班子施政，前日佢炮轟狼英連日反佔中言論，例如冇譴責硬闖旺角集會嘅司機，明顯有心挑撥市民內部矛盾。
20141003-85,20141003,85,隔牆有耳：審計署長微服佔中？ - 李八方,隔牆有耳： 審計署長微服佔中？ - 李八方 連日嚟究竟有幾多政府中人去咗佔鐘？八方相信為數未必少，但個個靜悄悄出動，似乎都唔多想俾人知。而被認定係梁粉嘅審計署署長孫德基，噚日朝早約11點亦喺佔中現場出現，一身便服嘅佢同身邊女士由中環行去金鐘方向（圖）。但大家咪太高興住，據目擊者話佢似路過多啲，相信唔係變節。審計署署長係中央任命主要官員之一，可能係近日所謂微服出巡嘅最高級官員。
20141003-86,20141003,86,隔牆有耳：李卓人請葉劉食檸檬 - 李八方,隔牆有耳： 李卓人請葉劉食檸檬 - 李八方 早前話「學生都唔係省嘅油燈喎」嘅葉劉淑儀，批評完學生後，竟然又抽水向佢哋招手，話要約學聯、學民、佔中、教協甚至李卓人對話。查實唔少都人都質疑，葉劉有乜資格去做和事佬？噚日八方追問阿人睇唔睇好，佢即刻say no向葉劉派檸檬，點知話口未完，佢嘅電話就響起，正正係葉劉打嚟。由於當時金鐘逼到連轉身都冇位，阿人焗住喺記者前講電話：「當然希望有結果，但同你傾會有乜結果呢？」阿人其後補充，如果想公開對話就直接落金鐘同市民對話好過。
20141003-87,20141003,87,沙膽虹手記：不一樣的香港 - 沙膽虹,沙膽虹手記： 不一樣的香港 - 沙膽虹 行政會議召集人林煥光呼籲佔中團體，由中環、金鐘、銅鑼灣鬧市移入維多利亞公園和添馬公園，以免影響民生。其實，9.28當天，民眾開始走出馬路，就是因為警方將通往添馬公園附近的天橋和道路都封閉，民眾只好在馬路聚集，而民陣早前向政府申請10.1在維園集會，也被拒絕，藉詞已有團體在維園慶祝國慶。政府一貫與持反對聲音的市民為敵，以沒誠意為藉口採取不溝通態度，把市民逼上街，然後又武力鎮壓，就連沉默的一群也忍無可忍，自發性跑出來。如今佔領行動遍地開花，與政府的估計大相逕庭，政府才嘗試懷柔，林煥光出來籲佔領人士移入公園，政府亦透過消息人士開出對話條件。但這樣的價碼，市民又怎麼肯收貨？政府一味說市民沒誠意溝通，其實，政府的誠意又在哪裏呢？態度傲慢，自以為是，剛愎自用，以為武力壓倒一切，無懼佔中，結果激動起數以十萬計的熱血年輕人自發走上街頭，他們人數之多，克制和紀律，就連組織者都嘆為觀止。一直被認為政治冷感的香港人，一鋪覺醒了，香港已經是不一樣的香港了！ 沙膽虹 twitter賬號：khcheung1
20141003-88,20141003,88,壹錘定音：問責高官的人肉盾牌 - 李慧玲,壹錘定音： 問責高官的人肉盾牌 - 李慧玲 每月支薪幾十萬的問責高官去了甚麼地方？ 特區政府昨日就佔中舉行的跨部門記者會，規格之低，嚇人一跳。除了民政事務局副局長許曉暉是問責官員，其他清一色都是公務員。涉及的運輸、教育部門，派出的都是副手的副手，再加個行政署長。 數以十萬計市民走上街頭，分據路道要津，特區政府已面臨回歸以來最大管治危機。這些問責官員，根本早應該站出來面向公眾，但他們統統沒有。迫不得已昨日舉行跨部門記者會，問責高官也要躲在公務員身後，由公務員充當人肉盾牌，為高官擋子彈。這是甚麼道理？這怎能服眾？ 唯一藉口是，這些問責高官表現太不濟，例如教育局局長吳克儉，講多錯多，必須收埋。 P.S.《壹錘定音》早上10點直播，收聽可透過 http://hammerout.hk  烽煙電話 29923333 短片WhatsApp 91323813 李慧玲
