key,date,article_daily_id,title,text
20141003-152,20141003,152,深圳女生遭同學圍毆,深圳女生遭同學圍毆 深圳福田14歲女中學生小希本周二（9月30日）放學時，被同班同學小萍拉住及掌摑，後來還遭3名女同學拳打腳踢。 小希慘遭毆打半小時後，全身染有血迹。家人見小希回家後，神情恍惚和腹部染血，送她到醫院檢查，證實其腰部受傷。 幾經追問下，小希說出事件原因，原來打人同學早前打算毆打另一名同學，未料該名同學沒有現身避過一劫，有人懷疑小希通風報信，遂遷怒於她，小希亦非首次被毆，家人事後報警求助。 深圳電視台
20141003-153,20141003,153,7年前為追星逼死父華仔狂迷流淚道歉,"7年前為追星逼死父 華仔狂迷流淚道歉 被封為劉德華「頭號影迷」的楊麗娟，曾瘋狂迷戀華仔13年，老父為幫她追星不惜賣腎、蹈海自殺，幾乎傾家蕩產。銷聲匿迹七年後，楊首次上電視節目表露心聲，坦言悔不當初。她還聲淚俱下向亡父道歉，及奉勸粉絲們「劉德華不值得你浪費青春」。 上海《東方衞視》周一（9月29日）播出《東方直播室》，楊擔任特別來賓現身說法，奉勸一名迷戀華仔的當事人不要瘋狂追星。楊自2007年後拒絕採訪，目前在甘肅蘭州做義工。她在節目中朗讀一封寫給亡父的信，內容指：「現在女兒已經醒悟了，爸爸我向你保證，我會好好地生活下去。」 曾累父賣腎　自殺 楊麗娟說，這七年內反思很久，造成悲劇自己的固執任性有很大責任，但媒體推波助瀾讓事情惡化。她回憶道：「有媒體答應要帶我見劉德華，但是後來卻安排了一個模仿劉德華的人來到我家，讓我的家人很生氣，太不尊重人了。」但有網民批評：「花七年時間才想通，還把事情都賴給媒體，也太奇葩了吧。」另有人認為她「似乎還要把責任推給劉德華」。 《東方衞視》／網易娛樂 楊麗娟追星事件簿 1994年　夢見劉德華後瘋狂迷戀對方 1997年　花9,900元人民幣參加香港旅遊團，卻未能看見華仔 2003年　父母為滿足女兒心願變賣物業 2004年　得知劉德華在甘肅拍電影《天下無賊》，楊每天站在8樓天台，希望看見偶像 2005年　得知華仔住所，楊麗娟與父親再次赴港，失望而回 03/2006　父親賣腎籌錢助女兒赴港追星 25/03/2007　第三次赴港的楊麗娟終與偶像近距離接觸，還被安排跟華仔談話及拍照 26/03/2007　楊父跳海自殺，留下遺書痛罵華仔 27/03/2007　楊麗娟埋怨劉德華，痛哭失聲連呼後悔 28/03/2007　楊母女返回內地 29/09/2014　楊麗娟擔任內地電視節目嘉賓，勸節目當事人不要迷戀劉德華，直言不值得為劉德華浪費青春 資料來源：《蘋果》資料室"
20141003-154,20141003,154,網傳90後「奶茶妹妹」生日出嫁,網傳90後「奶茶妹妹」生日出嫁 清華大學90後高材生「奶茶妹妹」章澤天，即將與京東商城行政總裁劉強東結婚了？內地娛樂策劃人獨孤意前日透過微博爆料，指劉強東將於下月18日與章澤天21歲生日當日，在巴西里約熱內盧舉行一場「低調的奢華婚禮」。 獨孤意透露，劉將斥資千萬元人民幣舉辦婚禮，既要排場也要低調，屆時只邀請雙方親人及朋友參加，謝絕媒體。他又說，劉強東不但贈送奶茶妹妹象徵愛情的紅色寶馬，還專程在美國訂製逾千萬元的鴿子蛋鑽戒以表愛意。奶茶妹妹發微博否認傳聞：「上學期間翹課去巴西結婚，也是醉了。」更附上大笑表情。有網民稱：「郎才女貌，劉強東有錢有勢，奶茶妹妹的爸爸是董事長，清華的校花級別人物。」 新浪微博
20141003-155,20141003,155,黑裙女夜晚公路企跳嚇窒路過司機,黑裙女夜晚公路企跳 嚇窒路過司機 上月27日晚上7時許，台灣國道5號平原線有司機駕車經過，發現一名黑裙長髮女子坐在護欄的欄杆上企跳，趕緊報案。警察接報後，因天色昏暗一度未能尋獲，報案的民眾懷疑自己遇到靈異事件。其後在羅東交流道前發現女子站在護欄上，勸她返回安全地方。 警方表示，發現該女子時站在外側護欄上，精神不太穩定，由於護欄距離地面有15米高，一不小心就會墮至路面或農田，後果不堪設想。警方擔心女子失足，立即趨前抓緊該女子的手腳，並把其勸到地面。 該名裴姓女子供稱，她隻身嫁到台灣，離婚後領有身份證可在台居留。她剛與新相識的男友發生口角，自己在台又無親友可傾訴，一時情緒失控，才會自尋短見。經安撫後，女子情緒平伏，最後由其友人將她接走。  台灣《蘋果日報》
20141003-156,20141003,156,今日我最靚,今日我最靚 內地藝人　高洋
20141003-157,20141003,157,靠半生熟飯充飢兩女孩遭遺棄險餓死,靠半生熟飯充飢 兩女孩遭遺棄險餓死 廣東惠州市新寮新村一間出租屋，揭發兩名分別8歲和1歲半的表姊妹疑遭家人棄養。她們相依為命十多日，每日表姊自己煮半生熟飯充飢，導致二人營養不良，幾乎餓死屋內。女房東發現後報警，兩名女童已被家人接走。 據廣東媒體昨日報道，女房東上月18日在出租屋發現被棄養的兩女童 ，「看到一個十分瘦小的女孩坐在床上，大點的女孩跪在地上，手裏拿着一碗半生不熟的白米飯給小女孩餵飯」。警察接報到場調查發現，兩名女童是表姊妹關係，原本照顧她們的是1歲半女童的父母，因犯案被警方通緝，早前留下一包大米便亡命天涯。被遺棄的她們每日吃白飯，沒有菜肉，腸胃出現問題。至於因離婚與8歲女兒沒有聯絡的何姓男子，接通知後接回女兒，並安排其到雲南昆明上學，而外甥女則交給他的母親暫時撫養。 廣東南都網
20141003-158,20141003,158,兩幼童爬入壓茶機慘遭壓死,兩幼童爬入壓茶機慘遭壓死 盛產烏龍茶的福建安溪發生恐怖意外，兩名年僅3歲的男童，爬入放置在家中的壓茶機，疑是碰到開關掣後被壓茶機擠壓，雙雙身亡。 安溪的農民家庭幾乎每戶都有壓茶機，用來加工茶葉。周二（上月30日）下午5時許，一對3歲的農村表兄弟在屋內玩耍，家人到屋外工作，沒兩分鐘便發現壓茶機被啟動，這對表兄弟被壓蓋壓住，家人馬上報警，警員趕到現場證實兩名小童已經死亡。 警方調查後證實兩名小童死於意外，疑他們其中一人觸動開關，引發意外，家人對死因沒有異議。家人稱為幫補家計，家中除配備做加工茶葉的機器，而且機器都長期接上電源，警方稱農民應該提高安全意識，每當加工完成後都應截斷電源，同時要照顧年紀小的兒童，阻止他們接近這些機器，避免意外再次發生。 福建閩南網
20141003-159,20141003,159,「她有公主病」　台男捅女友,「她有公主病」　台男捅女友 「女友有公主病，欺人太甚」。台灣屏東一對姊弟戀人前晚在廣場談判時，情況失控，19歲男子竟拿出15厘米長的檳榔刀，從後捅20歲的女友兩刀，當他被警員拘捕時他紅着雙眼，憤慨地說女友有公主病。 這名19歲李姓男子前晚深夜11時，與20歲潘姓女友談判，沒想到會引發血案，潘女肩胛骨及脊椎各有長約30厘米的刀傷，要送到醫院接受手術。李的家人指，李高中二年班便停學，到恆春一間建築商做釘板工，每月將薪金交予祖母，直至一年半前在網上認識潘女。 潘女沒有工作，但卻要與李租房同居，所有開銷由李支付，而且更不准他給錢祖母，而近日潘女疑男結新歡，主動提出分手。前晚李接到十多個來自不同男子的電話恐嚇，於是帶着檳榔刀防身，沒想到潘女竟帶着十多人到場，而且不斷叫囂，令李男情緒失控而揮刀傷人。 台灣《蘋果日報》
20141003-160,20141003,160,台女警扮有錢人誘捕鴛鴦大盜,台女警扮有錢人誘捕鴛鴦大盜 台灣台中出現一對鴛鴦大盜，他們專尾隨到銀行提款的有錢人，趁人停車購物時盜取車上的財物。警方為捉到這對歹徒，派出一名女警假扮成有錢人誘捕，鴛鴦大盜果然上當，當他們準備下手時被捕，警方依竊盜罪將兩人移送法辦。 這對鴛鴦大盜是38歲王姓男子及40歲王姓女友，兩人專門在台中的銀行門前徘徊，尋找下手目標。去年10月兩人跟隨一名在銀行提款35萬元新台幣（下同，約8.93萬港元）的受害人，緊隨其車，並趁他下車買水果時將款項偷走。兩人以同樣手法多次犯案，共偷走130萬元（約33.1萬港元） 為拘捕這對鴛鴦大盜，台中派出一名女刑警，在銀行門外手持佯裝有巨款的牛皮紙袋，引起歹徒注意。女警開車到附近百貨公司購物，歹徒便嘗試爆開車門，這時遭在場埋伏的警員制服。 台灣《蘋果日報》
20141003-161,20141003,161,台團體反法航運實驗猴子,台團體反法航運實驗猴子 台灣多個動物保護團體，昨日前往法國航空台北辦事處，抗議法航是全球唯一運送猴子至歐美實驗室進行動物實驗的航空公司，並要求法航停止運送。僅穿內褲的動物權利促進陣線創辦人羅丹，打扮成猴子關進鐵籠（圖）。他表示，待在籠子裏半小時即全身痠痛，而猴子被關在籠內至少30至40小時，沒水沒食物，痛苦又殘忍。 台灣《蘋果日報》
20141003-162,20141003,162,擦撞勞斯萊斯貨車司機賠105萬,擦撞勞斯萊斯 貨車司機賠105萬 開車記得集中精神，切勿亂撞名車！兩岸分別有兩名黑仔司機，駕車時意外擦撞百萬名車，高雄姓蔡司機被法院判處賠償41萬元新台幣（約10.4萬港幣），廣西的姓陳貨車司機更被判賠償105萬元人民幣。有網民認為：「司機只是想多賺一點養家，卻把一輩子都賠在上面，窮人的悲哀，更是社會的悲哀。」 高雄姓蔡司機去年9月駕貨車送貨，途中與陳姓司機購入3個月的法拉利發生擦撞，名車車尾損毀，維修費達111.9萬元新台幣（約28萬港幣）。高雄地院認定司機負4成責任。廣西桂林市一名姓陳貨車司機，去年12月駕車時與一輛勞斯萊斯擦撞，被判賠償105萬元人民幣。 台灣《蘋果日報》
20141003-163,20141003,163,美伊波拉患者或傳染100人5童留家觀察　學校人人自危,美伊波拉患者或傳染100人 5童留家觀察　學校人人自危 美國首宗本地確診伊波拉病毒患者事件，暴露當地醫院把關出問題。病人現病徵初次入院時已告知護士自己來自非洲疫國，院方卻因溝通失誤打發他走，直至兩日後嘔吐大作再入院才隔離。當局指有100名當地人曾直接或間接接觸病人，包括5名學童，令學童就讀的學校人人自危。 42歲伊波拉病人鄧肯（Thomas Eric Duncan），身份前天（周三）由親友披露。鄧肯是利比里亞人，在首都蒙羅維亞一船運公司工作，在市內租房住，上月初辭工準備赴美探親。鄧肯9月15日協助帶感染了伊波拉的房東懷孕女兒求醫，但醫院爆滿拒收，該孕婦回房東家數小時後就不治。 護士漏報病人來自利國 懷疑當時已感染伊波拉的鄧肯，一直未現病徵，9月19日先後乘三航機，翌日抵達美國達拉斯探親，相信暫住親人在長春藤公寓（Ivy Apartments）家中，四日後開始出現病徵，再過兩日到達拉斯的德州長老會醫院求醫。 院方承認，鄧肯當時回答急症室護士的篩查清單問題時，有說自己從非洲來美，但這重要資料「未有完全傳達給整個醫療團隊知」，醫生見他只有發燒和肚痛，就診斷為「低風險普通病毒性疾病」，給他處方抗生素就打發他回家。 鄧肯兩日後（9月28日）病情惡化，再次送入同一醫院才隔離治療，現時病情嚴重但穩定。有鄰居指鄧肯被送上救護車時，在公寓外嘔吐大作，恐散播病毒：「他全家人都在尖叫，他在屋外嘔到一地都是。」 伊波拉病毒透過體液傳播，潛伏期由兩日至21日不等，要到出現病徵，才有傳染給其他人的風險。美國疾病控制與預防中心（CDC）指伊波拉病人就算開始有發燒等早期病徵，都因為體內病毒數目太少，驗血也驗不出，因此對這些病人一般不作伊波拉血液測試。 不過傳染病專家指出，護士未能傳達鄧肯來自疫國這重要消息給醫生，明顯是失誤。達拉斯衞生官員指當地有可能爆發另一宗相關病例。達拉斯縣衞生部指，100名跟鄧肯直接或間接接觸過的人中，12至18人包括3名救護車人員和5名學童都是直接接觸，其餘的人都曾跟這10多人接觸過。他們全部須留在家接受監察21日，暫沒有人出現病徵，當局稱傳染風險低，5學童就讀的4間中小學毋須停課，但會加派醫護人員監察。不少學生家長前天聞訊都提早到學校接走子女，稱本周都要孩子留在家。 歐美航空酒店股價下跌 事件也令歐美航空和酒店股股價下跌。CDC指鄧肯乘機時無病徵，同機人無受感染風險，因而不公開他所乘航班。比利時官員卻透露鄧肯是在9月19日乘布魯塞爾航空公司客機赴比利時。美國聯合航空公司確認鄧肯在布魯塞爾候機近七小時後，轉乘聯合航空UA951班機到華盛頓杜勒斯國際機場，再候機約三小時後再轉乘UA822班機，9月20日抵達達拉斯─沃思堡國際機場，指同機乘客如有疑問可找CDC。 奧巴馬政府在事件後再次向各邊境、航空和醫療相關人員發出伊波拉防控指引，提醒他們嚴格執行防控措施。夏威夷衞生官員前天指檀香山有一名疑似伊波拉男病人正受隔離治療，暫未明他曾否到過西非。 美聯社/路透社/法新社/CNN
20141003-164,20141003,164,處理醫療廢物草率　危及社區,處理醫療廢物草率　危及社區 美國本土出現首個伊波拉病人，惟美國未有就處理感染者的醫療廢物制訂統一準則，隨時令相關廢物堆積在醫院，增加病毒在社區意外爆發的風險，甚至被人利用作生化武器。 病毒或被用作生化武器 美國疾控中心目前建議，醫院處理床單、注射器、保護衣等曾暴露於伊波拉病毒下的物品時，須將它們丟棄在防漏容器內運走，並列明是「受規管醫療廢物」。惟美國運輸部卻視伊波拉病毒為「甲類傳染性病原體」，而非「受規管醫療廢物」，導致運輸公司無權載走這些廢物。 上述問題早在埃默里大學醫院治療醫生布蘭特利（Kent Brantly）及女傳教士懷特博爾（Nancy Writebol）時，就已經浮現。當時運輸公司Stericycle一直拒絕載走伊波拉醫療廢物，導致這些廢物在醫院不斷堆積，直至疾控中心協助才解決問題。 美國大部份醫院沒有安裝焚化爐及大型消毒櫃處理。專家警告，如沒法妥善處理相關醫療廢物，病毒或會被用作生化武器，或令病毒四處散播。有美國運輸部官員透露，運輸部及疾控中心下周或公佈聯合指引，統一處理伊波拉醫療廢物的準則。 路透社
20141003-165,20141003,165,首位聯國人員疑染伊波拉亡,"首位聯國人員疑染伊波拉亡 伊波拉病毒至今在全球奪去3,338人性命，佔7,178名患者逾半，上周更有首位駐利比里亞的聯合國人員疑染上伊波拉病毒殉職，聯合國駐當地代表蘭格連（Karin Landgren）對此表示傷感，但相信會「警醒人們迫在眉睫的危機及作為聯合國一分子的使命」。 兩疫苗明年初面世 雖然伊波拉病毒的新增感染個案連續兩周下跌，但世衞警告這並不代表疫情出現曙光，因為相信有不少個案都被漏報，「疫症在幾內亞、利比利亞及塞拉利昂持續擴散……伊波拉疫情可能由穩定突然劇變，需要密切關注」。 與此同時，世衞研究抗疫藥物的工作亦不敢怠慢。現時主力研發的疫苗有兩款，分別是英美藥廠研製的「黑猩猩腺病毒疫苗」及加拿大衞生局生產的VSV，前者已有上月開始人體實驗，後者亦會在數日內送到美國進行測試，預計年底就能確認疫苗的安全性、劑量及效用。兩款疫苗最快在明年初正式面世，屈時加拿大當局會將1,500至2,000劑VSV捐贈到西非疫區，供前線醫護人員使用。 路透社/美聯社/法新社"
20141003-166,20141003,166,沙地嚴防麥加朝聖者傳入病毒,沙地嚴防麥加朝聖者傳入病毒 一年一度的麥加朝聖活動，昨天（周四）正式開始，沙地阿拉伯為免前去聖城的300萬回教徒帶來伊波拉病毒，早已制訂應變計劃，執行預防措施，派遣醫護人員在機場及港口嚴格檢疫外，更增設一批隔離病房和相關醫療設施。 不會向三國回教徒發簽證 沙地較早時宣佈，鑑於塞拉利昂、利比里亞和幾內亞三國有伊波拉疫情，今年不會向該三國的回教徒發簽證。而尼日利亞旅客則要接受嚴格檢查。官員指各個國際機場有數以百計醫療人員駐守，已嚴格檢查至少205個到埗航班。 回教徒往聖城，主要取道吉達市。當地國際機場的官員馬勒基說：「我們特別留意尼日利亞、肯雅和剛果等有伊波拉個案國家，航機一降落，專人即會登機查看乘客有否出現症狀。」旅客亦要說明之前21天到過哪個國家。機場人員亦會一再核對文件，確定航機起飛前有兩次噴灑消毒劑。「迄今有11.8萬來自尼日利亞的旅客入境，懷疑個案一個都沒有。」1.5萬坐船到吉達的旅客同樣接受嚴格檢疫。 一旦發現懷疑個案，當局亦有準備，包括設立24個隔離病房，以及加設急症室、手術室等設施，並有超過2.2萬醫生候命，應對緊急情況。 英國《衞報》
20141003-167,20141003,167,連番錯漏　奧巴馬信心盡失美特工處長隱瞞過失請辭,連番錯漏　奧巴馬信心盡失 美特工處長隱瞞過失請辭 肩負保護總統及第一家庭重任的美國特工處，本被譽為精英中的精英，但接連被揭嚴重疏漏，將總統置於險境，並且對白宮隱瞞事件，55歲的特工處處長皮爾森（Julia Pierson）成為眾矢之的，前天（周三）宣佈辭職。 皮爾森是特工處首位女處長，由總統奧巴馬「欽點」，去年3月上任，本來擔負着重要使命：對因為特工集體召妓等醜聞而名譽掃地的特工處，進行徹底整頓。雖然整頓未見效，特工處更一再捅婁子，但奧巴馬和白宮仍表示對特工處有信心──直到皮爾森被揭隱瞞過失。 曾獲欽點上任整頓團隊 據白宮消息人士透露，傳媒周二爆出上月發生持刀男子闖白宮前三天，奧巴馬曾在疾病控制及預防中心總部，跟有槍兼有案底的外判保安人員共處一「𨋢」。但原來奧巴馬和白宮一直被蒙在鼓裏，皮爾森要到知道走漏風聲才上報，奧巴馬只比公眾早一點點知悉事件，因而對皮爾森信心盡失。 這一幕發生在周二皮爾森出席眾議院聽證會之後，她在會上曾矢言，每當發現失誤都「即時百分百」向總統報告，而今年只作過一次這類匯報，是針對上月有人持刀闖白宮事故。 皮爾森的解說和處理手法，令共和民主兩黨議員齊感不滿，紛紛要求她辭職。她前天跟國土安全部長約翰遜會面，經過一輪討論後她提出辭職。白宮消息人士指，皮爾森雖是自動辭職，但未獲任何人挽留；而且奧巴馬之前已向幕僚指出皮爾森需要下台。約翰遜表示，已安排特工處退休高官克蘭西（Joseph Clancy），暫時領導特工處，與此同時，獨立小組將對特工處連串失誤進行徹查，並會提出接任人選的建議。 在特工處任職30年的皮爾森，在辭職消息公佈後接受彭博社訪問，她對於要在特工處發生重大失誤的時候離開，感到「痛苦」，但是「國會已對我失去信心」。 闖白宮刀手拒認罪 另一方面，持刀闖白宮的退伍軍人岡薩雷斯，前天否認持械進入限制區、攜帶危險武器及非法管有彈藥等三項控罪。假如全部罪成，他有機會監禁16年。 美聯社/法新社 特工處失誤連連 12/2013　奧巴馬在南非總統曼德拉悼念儀式上講話，身旁的「手語傳譯員」竟是有精神病兼有案底的冒牌貨 03/2014　赴荷蘭安排奧巴馬到訪事宜的先頭部隊，被揭飲酒作樂 16/09/2014　奧巴馬巡視疾控及預防中心，操作升降機的外判保安竟攜有槍，更是積犯 19/09/2014　退伍軍人岡薩雷斯攜刀翻過圍欄闖入白宮，去到東室才被逮住 資料來源︰《蘋果》資料室
20141003-168,20141003,168,IS殺庫族士兵　3女遭斬首,IS殺庫族士兵　3女遭斬首 「伊斯蘭國」（IS）聖戰分子殘暴不仁，敍利亞人權監察組織（SOHR）發現，他們連婦女都不放過，近日斬首殺害五名庫爾德族士兵中三人是婦女，並將她們的首級示眾，以恫嚇當地市民。 SOHR指近日有至少九人在敍利亞北部科班尼（Kobani）被斬首，其中五人是庫爾德族士兵，包括三名婦女，另外四人是敍利亞阿拉伯人。從社交網站的相片看到，被斬首的三名婦女，頭顱被放在磚頭上，十分嚇人。 敍利亞政府控制的霍姆斯省一間學校，前日（周三）發生連環炸彈襲擊，造成至少48人死亡，包括41名兒童，暫未有組織承認責任。SOHR指兩宗炸彈襲擊均由同一施擊者發動，他先引爆一個裝置再引爆身上的炸彈。 此外，美國總統奧巴馬去年5月宣佈，對抗恐怖分子的空襲要達到「幾乎肯定不波及平民」準則才會授權，但原來本周空襲IS的行動，是沒有達致這項準則。有指連日空襲造成眾多平民傷亡，國防部稱受制於有限情報，難以確定情報真偽，但強調發動空襲會盡可能小心。法國前日就部署多三架戰機和一艘戰艦到中東對抗IS。 英國《每日郵報》/法新社
20141003-169,20141003,169,日火山災場屍體卡巨型岩石,"日火山災場屍體卡巨型岩石 日本搜救人員昨日（周四）繼續在御嶽山爆發災場進行搜索工作，發現不少遠足者的屍體夾在一些巨型岩石之間，也有死者埋在火山灰下。 多名死者遭火山灰活埋 高3,067米的御嶽山上周六突然爆發，至今已造成至少47人死亡，其中46人被火山噴出的石塊擊中而死，一人死於燙傷，為日本近90年來最嚴重的火山爆發。當局已核實所有死者的身份，目前還有24人下落不明，外界預期死亡人數會上升。 由自衞隊、警察及消防員組成的搜救隊昨日繼續搜救生還及失蹤人士，由於災場突然下起暴雨，搜索工作被迫一度暫停。搜救隊之後在高達三米的大石中間，發現五具死者屍體，需要使用特別的岩石爆破工具，才能搬走屍體。 火山噴出大量灰堆積在山頂神社，足足有40至50厘米厚，不少死者慘遭活埋。 東京大學地震研究所火山專家金子孝之指出，不少登山人士在火山爆發時陷入恐慌之中，根本不知應逃到哪裏。 法新社/共同社"
20141003-170,20141003,170,俄實習護士捧病人脾臟拍照,俄實習護士捧病人脾臟拍照 俄羅斯喀山市20歲的三年級護士學生亞拉盧瓦（Gulnaz Yalalova）在醫院實習時，竟在手術進行期間拿着病人的脾臟拍照，並上載到Instagram，她又公開透露病人個人資料，結果被醫院開除。 一名16歲少女企圖自殺，由8樓墮下送院，身穿保護衣的亞拉盧瓦做手術時，竟雙手捧着女病人的脾臟、臉露笑容拍照，她又上載病人的傷口相片，並在給朋友的留言透露病人私隱。 亞拉盧瓦的朋友問她是否很享受，她回應：「當然！我們整晚沒睡。她16歲，由8樓跳下……情況危殆，肋骨骨折、腿和頭部受傷、脾臟撕裂。她是個精神分裂患者，體重逾275磅。」事件曝光後，亞拉盧瓦即被醫院解僱；她就讀的醫學院正考慮將她開除。 英國《每日郵報》
20141003-171,20141003,171,16歲學生玩3P對手竟係佢Miss,16歲學生玩3P 對手竟係佢Miss 美國路易斯安那州一名16歲男生，與兩名年金髮女教師大玩3P性愛，男生事後四出吹噓艷史，警方將兩名女教師拘捕。 事發上月初，24歲的雷斯佩斯（Rachel Respess）以及34歲的迪弗雷納（Shelley Dufresne），與涉事16歲男生發生三人性行為。警方接獲舉報，上星期五（26日）展開調查，兩人各被控與未成年人士發生性關係、猥褻行為等罪行。兩人均已被校方停職。 當地最低合法性交年齡為17歲，雷斯佩斯的代表律師表示，假如等到案發的4日後，亦即該名男生年滿17歲時才與他做愛，就不用弄至如斯田地。 美國《紐約每日新聞》
