key,date,article_daily_id,title,text
20140820-0,20140820,0,房祖名供述　吸毒八年,"房祖名供述　吸毒八年 【本報訊】中共禁毒宣傳形象大使成龍兒子房祖名及台灣藝人柯震東早前涉毒被北京公安拘捕，內地中央電視台昨晚專題播出二人涉毒落網的片段，透露房吸毒已八年，公安並在其豪宅搜出一批毒品。有傳公安押房祖名回住所時，房母林鳳嬌也在場。北京昨早亦公開兩人被拘片段，但明顯厚待房祖名。據悉，成龍連日在京找關係救仔。 中國組 未知是否成功靠父幹或有後台好辦事，中央電視台昨早曝光房祖名、柯震東涉毒被拘的片段，明顯大細超。僅涉嫌吸毒的柯震東，央視放出兩段片段，只見柯被拘受審出鏡時「打薄格」遮眼，不僅形象可辨，還對着鏡頭痛哭流涕、認錯和懺悔；反之，涉吸毒和收容他人吸毒、並在家中被搜出超過100克大麻等毒品的房祖名，雖然罪名較重，但央視僅播放一條片，且「打厚格」，令人難以辨認，而且也沒有房沉痛懺悔的鏡頭。 柯震東：首次吸毒在房家 更可笑的是，央視節目《焦點訪談》昨晚專題報道案件時，透露兩人本月14日晚在北京一家足療店吸毒時被抓，驗尿證實涉毒；之後公安押房祖名回住所搜查，從櫥櫃等處撿獲一批毒品，有塑料袋包裝、有膠樽裝也有木盒裝；有些片（粒）狀，有些卷煙狀，還有些是煙葉狀。房被公安質問時先支吾以應，後承認是大麻。 報道指，房祖名供述自己從2006年開始吸毒，已長達八年，首次吸毒地方是在荷蘭；而柯震東首次吸毒就在房祖名家中，時間是2012年。兩人被抓過程相當平靜，對警方要求也很配合。北京市公安局禁毒總隊副總隊長形容，兩人就像小學生犯錯一樣，尤其是房祖名，副總隊長說：「他有一定的文化素養，從他的眼神看來，他比較後悔。」 柯震東昨在自白影片中，換上印有「東拘（東城拘留所）」二字的黃藍外衣，模樣頗狼狽，面對兩位員警偵訊，他哽咽說：「我做錯事。」在長達2分23秒的影片裏，說話斷斷續續，不斷啜泣，他最後邊吸鼻涕邊痛哭，表示會記取教訓，變成更好的人，「我希望我的家人朋友，甚至是喜歡我的人，同樣可以張開他們的手，給我一點……擁抱」。 傳林鳳嬌見子被押回家 公安在房祖名的住所撿獲大麻超過100多克。房被以「容留他人吸毒」刑拘，未提藏毒罪。根據內地法律，藏毒涉刑事，只要藏毒（指海落英和鴉片等）超過50克，最高可判終身監禁。但大麻屬其他毒品，要達到一定數量才可入罪，以房招認的大麻為例，藏有大麻油5,000克、大麻脂10千克、大麻葉及煙150千克以上，可判監七年至終身監禁；若藏大麻葉、煙30千克以上不滿150千克，也可判監三年至七年。房被指藏大麻110多克，未知會如何裁定。 據透露，柯震東昨已被轉到北京大興區看守所，而房祖名昨仍被關在北京東城區公安局看守所。有消息指，成龍前日下午飛北京後，一直頻撲「走後門」救兒子。公安今次搜出毒品的大宅屬成龍，據知事發當日林鳳嬌在家，目睹愛子被戴上手銬押返家搜查，身為母親的林被嚇呆大受打擊，馬上通知成龍。成龍夫婦連日密謀營救對策。 身為中國官方禁毒宣傳大使，成龍口口聲聲要滅罪，但兒子涉毒被捕，還是愛兒心切，據悉他連日在京四處張羅找律師，並拜託好友關係，希望兒子在拘留所得到好照顧。雖然有不少朋友欲慰問，但成龍只跟少數朋友通了手機訊息。有消息指成龍昨欲往探望房祖名，但因是刑事拘留不能探望。 房祖名、柯震東涉毒被捕引國際媒體關注，美聯社、法新社等紛紛報道。曾任新華社《瞭望東方》周刊，以及央視記者內地資深媒體人樸抱一，昨在微博透露，本案涉四人，另兩人「後台更硬，一個W，一個H」，未知是誰。"
20140820-1,20140820,1,豪宅原址是康有為故居,"豪宅原址是康有為故居 【本報訊】因為涉嫌在家中吸毒，房祖名位於北京東直門內大街9號NAGA上院的住所隨即成為媒體的焦點。它除了是京城頂級豪宅，劉德華、謝霆鋒和吳彥祖都在這裏置產的「港星樓」之外，原來這裏曾是二環內完好保留的四合院遺址，也是清朝戊戌維新派頭目康有為的故居。 成龍5,550萬豪宅送兒 NAGA上院有99個單位，現時樓價每平方米約港幣10萬元，單位由三房至五房不等。 2006年，成龍曾為屋苑代言，更以「優惠價」4,400萬元（約港幣5,550萬元）購入兩個各660平方米的單位，並有專用車位，相當於市價一半。成龍其後於2010年把它作為房祖名28歲生日禮物。 屋苑設有面積9,000平方米、由世界級設計大師Mark Lintott設計的會所，游泳、健身、咖啡廳、雪茄吧、紅酒廊、餐廳等一應俱全，且守衞森嚴，部份保安更來自中央警衞局和三軍儀仗隊。 有小區的居民透露，房祖名經常在屋苑出現，不時有年輕男女出入其單位，估計是開派對。 這幢豪宅以「稀有」著名，曾經是康有為的故居，也是北京保留最好的四合院遺址，據悉有錢還不一定住得到，發展商曾經打出「雖非前無古人，但一定是後無來者」的廣告，並表示入住的住戶必須有四大基本訴求，除了得是成功人士之外，還得要有高質素、有責任心、樂善好施，然而今次卻發生房祖名在屋苑內被抓藏毒，甚為諷刺。"
20140820-2,20140820,2,台斥大陸違協議無通報,台斥大陸違協議無通報 【本報訊】台灣藝人柯震東涉嫌吸毒，上周四被北京拘留，消息至前日才獲證實。台灣陸委會炮轟大陸違反《兩岸共同打擊犯罪及司法互助協議》中，台灣人被公安限制自由，要在24小時內通報的條文。陸委會對事件表示關切，亦要求大陸方面保障當事人相關權益。 台陸委會副主委吳美紅昨在記者會表示，當局已請法務部和刑事局透過《兩岸共同打擊犯罪及司法互助協議》建立的管道向大陸了解案情，並請兩單位轉告大陸要保障當事人權益。 柯反吸毒宣傳片下架 吳美紅亦對柯被限制人身自由後，大陸沒按規定向台方通報感不滿。 此外，台法務部昨隨即將柯震東代言反吸毒的相關宣傳影片下架。法務部長羅瑩雪希望大陸盡量提供（柯涉吸毒）完整資料。台北市警局表示，柯犯罪地雖在大陸，但台司法仍有管轄權，故已報請台北地檢署偵辦，北檢昨午已完成分案，柯返台後恐遭傳訊調查。但羅瑩雪表示，檢方是否會對柯裁定觀察勒戒，則視實際證據資料而定。
20140820-3,20140820,3,點滴：柯同款囚衣淘寶有售,點滴：柯同款囚衣淘寶有售 央視播出柯震東穿着囚衣、接受公安問話，哭着認錯的片段，在電視、網上不停播，有商家隨即在淘寶網上出售與柯震東穿着同款、藍黃色的囚衣，最平只要28元人民幣（圖）不過，商家此舉被網民大罵「無恥」、「缺德」。 TVBuddy變「證人」 北京電視台昨下午播出《法治進行時》節目，有公安搜查房祖名住宅的詳細片段，有眼利的網民在畫面中發現牆架上出現一個類似無綫吉祥物TVBuddy的白色公仔（圖），笑稱公仔要做證人：「TVBuddy ……你要落口供啦！」 成龍抽宋祖英水惹禍？ 成龍今年3月在全國政協會議上公然向中國歌壇天后、軍旅歌星宋祖英「抽水」，不僅當眾與宋親暱地臉貼臉，還從後摟着對方肩膀（圖），令宋十分尷尬。有網民昨戲稱，成龍在太歲頭上動土，結果禍及兒子，令房祖名成為代罪羔羊。
20140820-4,20140820,4,失理事會支持　林新強終辭職　繼續死撐：保留對整件事發表意見嘅權利,失理事會支持　林新強終辭職　 繼續死撐：保留對整件事發表意見嘅權利 【本報訊】「親共愛國」的林新強任律師會會長一年多，為該會寫下不堪回首的一頁歷史，昨終在理事會提出罷免其會長一職前自行請辭。據悉林會上態度強硬，堅持對白皮書的立場。林向傳媒宣佈決定請辭時，仍強調「我保留我對整件事情發表意見的權利」，理事會昨選出原副會長熊運信為會長，熊會後拒回答記者提問。 記者：張婷婷　梁御和 律師會上周召開特別會員大會，以大比數通過對林新強的不信任動議，林當晚拒回應會否請辭，前日接受內地網媒專訪時，仍堅稱「不信任動議的通過，也不意味着我一定要辭職」。律師會理事會昨商討跟進動議，據悉包括考慮如林不辭職，理事會便罷免林並推選新會長。林昨於會前45分鐘到達律師會，與部份已到場的理事傾談約半小時後，主動向在場等候的記者發表「請辭聲明」，估計林在該半小時內，知悉自己失去理事會支持，迫於無奈請辭。 理事會要求撤回白皮書言論 林向記者稱：「為咗維持香港律師會嘅團結，我稍後會向理事會提出請辭，即時生效。」他表明「我保留我對整件事情發表意見嘅權利」。林又似對撐白皮書言論掀風波不服氣，表明將來或會對公眾議題發表意見，「我仍然會以中肯持平同埋公平嘅態度發表意見」。林發言後原擬不回應提問，但當聽到記者以英文提問，他隨即以英文重提5月5日拒以英文回答記者提問一事，並以英文重複一次請辭聲明內容。 理事會昨選出原副會長熊運信為會長，至於其副會長空缺暫懸空；理事會現只有一名副會長，由蘇紹聰出任，林新強留任理事。熊運信會後拒絕回答記者提問，匆匆經後樓梯離開。 其後律師會發出聲明，表示該會於6月25日發出有關白皮書的立場聲明，已達至特別大會第一項動議的要求；理事會亦因應第二項動議，要求前會長撤回其於6月16日就有關白皮書發表的言論，並表示尊重會員的看法，重申該會政治中立，會繼續維護法治及司法獨立，和推動會員及業界的權益。 任建峰望新會長保持政治中立 發起不信任動議的律師會會員任建峰指，林辭職是正確及值得尊敬的決定。至於會前一刻才請辭，任認為：「正常人都需要時間反思同做決定，唔會唔合理。」對於熊運信被指向來挺林，任認為制度比人選重要，寄語新會長捍衞法制中的重要價值，保持政治中立，日後發言也要依足律師會內部程序。又認為熊沒有回答傳媒提問，慎言未必是壞事。 被問到會否堅持要求林撤回有關白皮書的言論，任稱信任律師會及新會長會正視會員主流意見，無意再發起動議。被問到會否競逐理事及會長，任指重視言論自由，「滿腦子是意見想講」，而理事須遵守保密協議，會長要保持政治中立，故暫不考慮角逐。 國務院6月10日發表一國兩制白皮書，林於6月16日理事會議決前發言，指白皮書要求法官愛國沒有問題，翌日又稱自己的言論代表律師會及「共產黨好偉大」，觸發會員倒林，結果創下律師會成立108年以來，首次通過對會長的不信任動議的歷史。
20140820-5,20140820,5,熊運信曾公開撐林　當選後拒絕受訪,熊運信曾公開撐林　當選後拒絕受訪 【本報訊】昨日接替林新強的新任律師會會長熊運信，於會議完結之後只願讓記者拍照，未有回應記者提問。 主攻刑事法 熊運信於1995年取得律師資格，2006年獲選為律師會理事，至2012年擔任副會長，熊也身兼律師會的刑事法律及程序小組主席，主攻刑事法，去年，前廉政專員湯顯明出席立法會政府帳目委員會的聆訊時，亦曾經邀熊運信擔任他的法律顧問。 有不願具名的律師指，熊在理事會多年，為人低調，難評估其任會長表現，而熊上周主持特別會員大會時，由於他早已公開「撐林」，有外籍律師質疑他主持會議的公正性，惟熊的回答差強人意，「好似都聽唔明人哋講乜」。 不過，提出罷免動議的「倒林」核心三人組成員任建峰認為，熊運信於特別會員大會當晚的表現恰當，指熊運信當時首先知道三個議案獲足夠票數通過，「呆咗一呆」便冷靜地坐下，未有向在場的林新強「通水」，是公正的表現。 律師會歷史性會長因不信任動議下台，有大批記者到場採訪，熊運信昨接任會長後，透過律師會職員向記者表明不會接受訪問，要求記者退後讓他可乘𨋢離開，一度惹起在場記者不滿。 由於律師會的電梯大堂塞滿記者，擾攘大約20分鐘後，熊始現身讓記者拍照，不過全程未有回答問題，其後乘混亂在廁所旁的後樓梯迅速離開。 熊運信小檔案 律師年資：19年 職位：彭溫蔡律師行合夥人 律師會資歷 ‧（2006-2012）律師會理事 ‧（2012-2014）律師會副會長 ‧刑事法及刑事程序小組主席 ‧當值律師服務執行委員會委員 資料來源：律師會網頁、《蘋果》資料室
20140820-6,20140820,6,中方發功惹律師反彈,中方發功惹律師反彈 【拆局】 自從特首梁振英上場後，土共、梁粉都以為只要愛國愛出臉，便可天下無敵。律師會林新強事件卻顯示這套只對商賈、市井之徒有用；若用於專業人士身上，他們不但對司法部、中聯辦和中資國企的施壓嗤之以鼻，更會引起反彈。 有理事早已「聞到𤓓味」 特別會員大會前，中方發功施壓收集「代表票」，讓林沉醉於獲中央力撐的美夢；但原來有不少律師行家包括大行合夥人，都對他拒答英文，高呼共產黨偉大已心中不悅，當遇到中資施壓，就陽奉陰違；年輕律師更勇於表態。林只手握逾千代表票，心中不踏實，但當時仍未知水浸眼眉。 不過，理事會中人已「聞到𤓓味」，但礙於林為人剛愎自用，未敢直諫，但暗地已開始物色會長接替人選，希望能在特別會員大會召開前將林勸退，以保律師會團結形象。其實早在7月時，林要求理事發出批評大律師公會的聲明遭否決，當時已有理事對林失去耐性。 但理事們與林共事5至10年，無人肯做醜人。到8月14日，特別會員大會開會前，林仍信心十足，以為大行和理事都會站在他一方。當不信任動議等獲通過，理事本以為林終肯面對現實，自行辭去會長一職以示風度，可惜例會召開前一天林仍不肯請辭。到開會前林終得悉不管他辭不辭職，理事會都會選出新會長。他明白大勢已去，終於請辭。 《蘋果》記者
20140820-7,20140820,7,張曉明：林犯何罪？,張曉明：林犯何罪？ 【本報訊】遭律師會通過不信任動議的林新強，早前盛傳獲中聯辦背後力撐，為其拉票及索取授權票，但最終仍鎩羽而歸。據悉中聯辦主任張曉明昨與公民黨見面談政改時，不知是否保林失敗遷怒法律界，對下台口出怨言：「林新強這個人犯了甚麼罪？出了甚麼問題？要受到社會如此對待？」 死撐根本沒有錯 律師會會長林新強早前回應國務院的一國兩制白皮書時大發謬論，指不覺得一國兩制白皮書要求法官愛國，就會損害司法獨立，他的言論引起律師會部份成員不滿，最終破天荒透過特別會員大會，通過對林新強的不信任動議，成功促使林新強昨日辭職下台。 據悉張曉明昨日與公民黨閉門討論政改時，雙方觸及林新強辭任律師會會長一事，即「撻着」張曉明，他即場反問包括法律界議員在內的公民黨議員：「林新強這個人犯了甚麼罪？出了甚麼問題？要受到社會如此對待？」 張又死撐林新強早前只是發表「支持白皮書」、「共產黨好偉大」等言論，根本沒有錯，張說：「香港號稱是個自由開放社會，他這樣講法有甚麼問題？」 有公民黨議員直言，張曉明的說法全屬「指鹿為馬」，認為張曉明死撐林新強的言論，反映了中聯辦曾經為林新強在幕後拉票的消息，絕非空穴來風。 
20140820-8,20140820,8,任建峰：環境壞也不要失去希望,任建峰：環境壞也不要失去希望 【記者白琳報道】林新強宣佈辭職的一天，是任建峰的38歲生日，喜獲「大禮」，他說願望是兒子在自由、民主和公義的社會長大。回顧過去兩個月的抗爭，任建峰經歷了最難捱的夏天，感激患癌母親與他一同咬緊牙關。今次雖法律界小勝一仗，但戰爭尚未結束，任透露一群年輕律師擬設立關注組，延續捍衞司法獨立的精神。他寄語港人，無論環境有多壞，千萬不要失去希望。 在歪理壓倒一切的時代，任建峰在通過不信任林新強動議後喜極而泣的畫面，格外振奮人心。他笑言當父親後「越老越唔化」，「希望阿仔大個咗明白，老竇出嚟係想做個例子畀佢睇，啱嘅就要做」。 患癌母親毫無怨言支持 當大會上周宣佈不信任林新強的動議「carried」（通過），任建峰才相信奇蹟發生，瘋狂大哭，「隊友喺後面攬過嚟，我都唔知攬過邊個」。法律界選委鄭瑞泰捉着他自拍，把這「歷史一刻」放上facebook，行家看到點票結果都熱淚盈眶。 任建峰說，於事後回想，意外結果其實有迹可尋。曾說「講民主，大陸就閂你水喉」的朋友、遭中資機構施壓的行家，今次都憤怒了，「呢啲就係專業嘅硬骨頭」。 一批年輕律師對上司陽奉陰違，暗自收集授權票；大會現場對罷免動議的正反之聲呈八二比，「諗唔到呢幾樣加埋，威力咁大」。 激動過後，任建峰立即致電母親報喜。任母的肺癌擴散入骨，上月曾放棄治療，又重新化療，直至身體承受不了而停藥。他試過清晨5時上班，晚上探望母親，待4歲的兒子睡了，就寫網上文宣為罷免林新強的動議拉票，還要全天候覆記者查詢。 任母對他經常不在身邊毫無怨言：「阿仔，唔使擔心阿媽咁多，我會支持你。」任2003年7.1獲母親鼓勵上街，她受兒子影響而帶病當佔中義工，也為他勝利感安慰，「聽到消息毛管都戙埋，成個人精神咗！」 任說難料北京會否更嚴厲打壓法律界，「有啲嘢唔驚得咁多，結果唔係完全喺手中，要相信上天安排」。在佔中和東北等戰役，雞蛋不一定成功，但要有明知不可為而為之的精神，「其他情況可能會令人失望，但係唔表示唔值得做，你做未必係為咗個結果，而係為咗良心」。
20140820-9,20140820,9,退保研究倡免審查　加利得稅,"退保研究倡免審查　加利得稅 【記者王家文報道】政府委託港大教授周永新進行的退休保障研究報告今日公佈。據了解，報告建議落實全民退保，不設入息及資產審查，年滿65歲長者每月可領取約3,000元。最受關注的融資問題，報告建議政府、僱主及僱員三方供款，包括將強積金僱主及僱員供款比率0.5%作供款，並增加利得稅不少於1%。報告也建議另增設稅項作供款，料惹起商界及中產強烈反對。 扶貧委員會今午召開特別會議討論退保研究報告，報告同時提交立法會，並於會後上載扶委會網頁，讓公眾閱覽。消息指，報告就坊間六個退保方案作精算研究，包括團隊建議的「老年金方案」。但最終建議內容，則傾向爭取全民退休保障聯席的方案，即免經濟審查，年滿65歲長者每月可領取約3,000元養老金。 建議由三方供款 至於「錢從何來」，報告建議由政府、僱主及僱員三方供款。政府方面，據悉，現時長者綜援、生果金及長者生活津貼每年合共約300億元開支，已足夠向全港65歲以上長者每月派發1,500元，將全數撥作供款；另額外注資約500億元。目前強積金僱主及僱員供款比率為月薪5%，當中0.5%會撥作供款。但據悉，為免影響強積金發揮退休保障作用，報告同時提出另增設稅項作替代方案。 為維持財政穩健，報告也建議向商界「開刀」，提出增加利得稅不少於1%。報告推算若結合三方供款，政府財力承擔最少可應付至2042年。報告分析坊間的六個退保方案，其中四個不設經濟審查方案，料實施後1至15年內會有結構性赤字，即支出多於收入；另兩個設審查的方案，分別在2042年和2050年出現負結餘。但無論有否設經濟審查，退保都會加重公共開支，料政府結構性財赤提早於15年內會出現。 香港總商會總裁袁莎妮憂慮，隨人口老化和勞動人口下降，政府的財政穩定性存疑，屆時供款人少，申領者多，加重下一代財政承擔，「人人老咗都有錢派，有冇咁嘅需要？啲錢喺邊度嚟？」她認為退保是扶貧措施，應針對幫助有需要的長者，需有經濟審查，反對增加利得稅，並告誡政府：「唔好不切實際提升公眾期望」。 研究報告部份建議內容 三方融資： 政府： 將現時長者綜援、生果金及長者生活津貼每年合共約300億元開支撥作供款 額外注資約500億元 僱主： 現時強積金僱主供款比率0.5%撥作供款 僱員： 現時強積金僱員供款比率0.5%撥作供款 加稅： 增加利得稅不少於1% 若不改動強積金比率，則建議另設稅項作退保供款 資產審查：沒有資產審查，年滿65歲長者可申領 退保金額：每月約3,000元"
20140820-10,20140820,10,「示威者」高唱《問誰未發聲》　曾偉雄督師　千警演習對付佔中,「示威者」高唱《問誰未發聲》　 曾偉雄督師　千警演習對付佔中 和平佔中如箭在弦，逾千警力昨雲集黃竹坑警校預演對付佔中6小時。警校內不時傳出《問誰未發聲》等社運歌曲，扮演示威者的警員大叫：「忍夠專制政權、我要真普選！」等口號，讓前線警員提早置身公民抗命現場，大陣仗演習清場拘捕行動，苦練如何加快拆解人鏈及抬人。警隊「一哥」曾偉雄、行動處處長黃志雄等高層下午更到場親自督師。 記者：林社炳　謝明明　馬志剛　袁柏恩 昨日一早，黃竹坑警校氣氛緊張，不時有人在校內走動打點。演習行動原定早上8時開始，惟因突如其來的滂沱大雨，行動延至9時停雨始繼續，軍裝警員開始列隊集結。《蘋果》記者現場所見，警校停車場內泊滿近百架警車，大批機動部隊、水警及全港各警區的軍裝人員陸續到場參與演習。 熟習加快解開人鏈 黃竹坑警校內恍如「兵變」，《問誰未發聲》、《抗戰20年》等抗爭歌聲響徹操場。大批穿着白衫藍褲、相信是由學警扮演的「示威者」全情投入，一邊拍手一邊唱歌。更有疑似高級警官扮演社運領袖，教一眾「示威者」講粗口，高呼「沒有抗爭、哪有勝利」、「忍夠極權專制政權」、「我要真普選」、「和平示威無罪」等口號，更指要讓學警「感受吓真正警察嘅壓力係乜嘢」。 也有人高呼：「我哋每一人都係自願嚟到呢度，唔似得嗰啲團體，有冇人收咗錢㗎？」大批「示威者」齊聲回應「冇！」場內更見最少停泊兩部旅遊巴，相信是用作練習押送佔中人士。 演習直至下午，警務處長曾偉雄穿上警服，乘坐1號車牌處長座駕抵達警校，警校上空剛巧颳起狂風，烏雲蓋頂下起暴雨。 「一哥」曾偉雄、行動處處長黃志雄、助理處長（行動）張德強、機動部隊校長歐陽照剛等一眾警隊高層，在校內逗留約兩小時，其間視察演練及鐵馬陣，又為警員打氣。演習約於下午5時結束，各警區派車隊接載人員離開。 據了解，今次演習主要是讓機動部隊和便衣探員熟習佔中清場及被捕人士的流程，其中前線機動部隊人員按7月初的預演經驗，熟習加快解開靜坐示威者的人鏈，及練習抬人離場的默契。 消息指，為加快清場行動，現場警員日後只會在外圍叫咪，呼籲示威者離開，如不順從就即時行動，不會再如7月初遮打道行動般，逐個示威者作一次口頭警告後才出手解鎖。 聘450助理助押解 至於便衣探員，則要熟習在警校處理示威者被拘捕的事後工作，加快處理流程，避免再發生膳食安排混亂、被捕者無法見律師、電腦系統操作生疏等「甩轆」情況。 此外，警隊原預計聘請500名警署助理，有消息透露警隊高層在上周五開會後，修正為聘請450人已足夠，同時這班助理「好大機會」要在佔中期間，在警校協助押解被捕示威者，與警隊聲稱他們「不行使警權、不接觸市民」的承諾相違背。 據悉，這是由於警方擔心萬一佔中者逾萬人，單計清場已要兩日或更長時間，學警未必能應付龐大警務工作，故希望聘用有資深警務工作經驗的助理從旁協助。
