key,date,article_daily_id,title,text
20141003-0,20141003,0,限期最後一刻梁派林鄭對話,限期最後一刻 梁派林鄭對話 【雨傘革命】 【本報訊】雨傘革命踏入關鍵時刻，特首梁振英連同政務司司長林鄭月娥昨晚深夜終於承諾與學聯對話，討論政改問題。學聯回應稱，期望政府盡快交代會面細節，並呼籲港人繼續佔領行動。佔領現場的群眾仍堅持留守，更一度有人衝出特首辦外的龍和道表示不滿。 記者：蔡元貴　佘錦洪　姚國雄 梁振英昨晚11時40分在禮賓府見記者，表示會委派林鄭及政改三人組短期內用合適方式與學聯見面，傾談香港政改問題。他指政府與社會對話要以符合《基本法》及人大常委決定為前提。但他表明不會辭職，聲言要做好普選工作，並稱一人一票選出下屆特首是他個人政績。 梁振英表明不會辭職 對於學聯一度提出衝擊政府部門，梁振英指出，過去數日公眾以集結方式表達訴求，警方已以最大程度忍讓。但衝擊政府總部及特首辦是嚴重的行為，只要警方防線沒有受衝擊，警方仍會以最大容忍看待。 林鄭月娥補充說，她會跟進與學聯就政改會面事宜，並會盡快接觸學聯商討具體安排，短期內會面。她聲言對話過程仍有空間，具體細節可以再商討。 學聯回應稱，期望政府盡快交代會面細節，並重申香港政制必須確立平等權利。對於梁振英拒絕下台，學聯批評他失信於民，既促成禍港的政改方案，又狂掟催淚彈，問責下台是必然之事。學聯並呼籲，港人必須繼續佔領運動，包括特首辦外添華道，才能繼續向政府施壓，並將港人爭取民主的決心展現給全世界。 學聯等號召市民擴大佔領其他政府機構，昨日外界盛傳警方會提升武力、甚至開槍清場消息，學民思潮召集人黃之鋒凌晨呼籲龍和道集會人士，強調人身安全最重要，如果去衝擊佔領龍和道，而換來無數橡膠子彈，甚至真槍實彈，是不應該，促在場各人體恤身邊戰友。他表示，約見林鄭月娥並非是為與高官握手，而是要去質問林鄭為何要用催淚彈、甚至準備橡膠子彈對付民眾，要負責的官員承擔責任，「當面質林鄭，去質問到佢片甲不留」。 BBC引述前港督彭定康稱，安排對話非常合理，但這次應確保商討民主的對話各方，不再感到受騙，對話不是造假，而是真正的討論，以達致一個香港人認同的自由、公平選舉。 梁振英的深宵發言未能平息眾怒。特首辦外的龍和道，即時有人衝出馬路堵塞行車線。在旺角佔領區，大專三年級生陸同學聽完梁振英講話後，認為梁沒回應市民爭取真普選的訴求，只是想用時間慢慢拖淡事件；在尖沙嘴，示威者繼續留守，他們認為梁的說法並非態度軟化，示威者也絕非階段性勝利，在達到目標前，不會退也不應退。 學聯亦於昨晚向林鄭月娥發出公開信，提出在公共場合與她對話，以讓媒體及港人得悉及參與全程。至於要求梁振英下台的前提，公開信再無提及。 林鄭則於日間與泛民和建制派議員在政務司司長官邸會面，政制及內地事務局局長譚志源和特首辦主任邱騰華亦有出席。據了解，出席與林鄭會面的各黨派一致要求林鄭透過與學生對話，解決目前的局面。惟從林鄭口風所知，似乎問題在於要說服梁振英首肯。有與會者透露，從林鄭的言論中感覺到，中央已經把今次佔領行動視為顏色革命，意圖推翻政府，故絕不會容許要求梁振英下台。此外，中央似乎全權交由港府處理，唯一要求是以最低限度的武力來解決，至於確實的底線為何，如是否可以再出動催淚彈則不得而知。 港大中大校長探望學生 港大校長馬斐森及中大校長沈祖堯也於深夜11時到達特首辦對出，探望示威學生和市民。二人在一條鋁梯上向全場發言，呼籲示威者要保持冷靜，不要衝擊，切勿推撞或使用暴力。 新華社今凌晨發表《人民日報》今日刊登的評論員文章，表示一些人以爭取真普選為名，在香港鬧事，煽動非法集會，試圖以激烈街頭運動方式脅迫中央退讓，改變全國人大常委會有關決定。這種做法公然違反《基本法》和香港法律，違反法治原則，注定是不可能得逞的。
20141003-1,20141003,1,林鄭邀泛民建制　急商對策,林鄭邀泛民建制　急商對策 【本報訊】港府與參加佔領行動的市民劍拔弩張、隨時擦槍走火之際，政務司司長林鄭月娥突然透過身兼立法會內務委員會主席的經民聯梁君彥，邀請立法會數個主要黨派議員到官邸會談。 梁振英被排除在外 政界一直指林鄭欲透過對話化解佔領危機。據了解，林鄭於10月1日透過梁君彥邀請泛民和建制派主要政黨代表昨天會面，管治威信盡失的特首梁振英被排拒談判桌外，只由特首辦主任邱騰華列席。政制及內地事務局局長譚志源也有出席。泛民陣營有民主黨主席劉慧卿、公民黨黨魁梁家傑、工黨副主席何秀蘭及公專聯莫乃光；建制派方面除梁君彥外，還有身兼會成員的經民聯林健鋒，以及民建聯譚耀宗及葉國謙，但工聯會、自由黨和新民黨卻非座上客。 據了解，泛民席間重申要求梁振英下台和人大撤回決定外，亦要求林鄭盡快與學生對話，又指林鄭及一眾問責官員和行會成員都有責任喝止梁振英令情況惡化，有泛民稱林鄭態度未如梁振英惡劣，顯示出希望盡快處理危機的態度，最終林鄭在昨晚11時半在梁振英陪同下見記者宣佈會晤學聯。
20141003-2,20141003,2,學者聯署：佔中非為推翻政府,學者聯署：佔中非為推翻政府 【本報訊】面對佔領中環行動遲遲未解決，十多名大專學者發起聯署聲明，促請政府與學生對話，強調佔領運動由學生推動，絕非推翻政府，促請外界勿再抹黑，據知昨日政圈廣泛流傳，稱北京強硬派要將佔中定性為顏色革命，讓梁政府以強硬手段對付佔中，而民主黨創黨主席李柱銘，直言不信警方用殺傷力武器鎮壓學生，又稱若警方這樣做，會有法律團隊到高等法院申請禁制令。 十多名大專學者昨晚在銅鑼灣中區舉行記者會，宣佈發動聯署行動，目前有逾30名學者聯署聲明，包括中大及港大政政系前系主任關信基及陳祖為。 聲明強調佔領運動由學生推動，目的是爭取民主進展，絕非要推翻政府，促請外界勿再抹黑，又促請政府與學生展開對話，呼籲集會市民和平理性，免受他人挑釁。 關信基稱，民主運動最重要是道德力量，「用道德力量對付物質，縱然我哋輸咗，喺世人眼中都企得住腳」。他希望人大收回決定，但除此以外，中央也可有其他方案開放談判空間。 防北京定性為顏色革命 據知這班學者所以要發表聯署，全因昨日政圈廣泛流傳，北京強硬派要將佔中定性為顏色革命，令梁政府可以「名正言順」以強硬手段對付佔中，所以一班學者希望向中央說清楚，今次佔中「同乜野顏色革命冇關」。 李柱銘昨午在政總外的公民講堂開講時稱，結束佔領責不在參與者，而在政府及中央，因人大就政改落閘，港人就發起雨傘革命，如同進行網球比賽，「the ball is in their court」，如何完結毋須港人傷腦筋，「個波又勁又有犀，分分鐘死角」，應該由中央及政府思考如何拆解，「佢（梁振英）假假哋都叫特首」。 對於有警員運送包括橡膠子彈等裝備入特首辦，李聽罷直言「我就嚇大嘅」，「佢係咪用先？敢唔敢用先？」9.28身處前線的他更稱年屆76歲的他若未試過催淚彈「死唔眼閉」。他指已有法律團隊，預備警方使用殺傷武器時，到高等法院申請禁制令。
20141003-3,20141003,3,警呃人開路　救人變運武器,警呃人開路　救人變運武器 【雨傘革命】 【本報訊】一念之仁隨時是壞事之始，警方和佔領者昨晚凌晨起在特首辦門外對峙，其間警方分別以有警員不適及換班為由，要求示威者開路，其中一次開路後，被發現運送大量裝備運入政府總部，包括橡膠子彈、布袋彈、催淚彈和胡椒噴霧。巿民馬上上前圍堵，警方情緒激動，猛力推開巿民和記者，巿民大罵警方「講大話」。 記者：張嘉雯　姚國雄　謝明明　韓耀庭　鄭啟源 學生團體及巿民前晚凌晨突襲圍堵特首辦，昨上午警方向身在現場的立法會議員梁國雄表示，有警員心臟病發，要求巿民開路讓救護車進入，巿民答允，但同時有兩架消防車尾隨，現場警員拒絕解釋原因。其後警方以運送食物、警員換班等理由，要求示威者開路，示威者照做。 至下午約4時，再有兩架警車想企圖進入特首辦，數十名集會人士以身阻擋警車，要求警方交代警車執行甚麼職務。警方最初解釋是換班及運送物資，為數60名警員與守護防線的集會市民產生口角，原本在添馬公園靜坐市民陸續趕抵添華道增援。 數百警於小路運入 同一時間，警方已在近解放軍總部的小路「螞蟻搬家」，由警員把裝備逐一運入添華道，前後約數百人，巿民發現後舉高雙手以身堵截，有女督察情緒激動，突然衝出大力捉住示威者雙手，約五名警員齊齊撲出捉住該示威者，但因圍堵人士太多，警方未能成功制服該名示威者。 警方一字排開，用手推開鐵馬另一邊的示威者，包括本報記者在內亦被推撞，有外國傳媒大叫「Press」，警方回應「你記者就唔好企到咁前」，記者未有退後。 梁國雄再次呼籲現場巿民開路，以免傷及貼近牆邊的警員，巿民開路後，有警員陸續自添華路走出，但更多警員帶同物資進入，他們分別乘坐警車和旅遊巴到達，像苦力一樣抬入各種「物資」，包括過百袋寫上「SUP TW」的藍色尼龍袋、20支警告旗幟、盾牌、咖啡色圓桶的橡膠子彈、灰色圓桶和鐵箱的催淚彈、寫上5.56mm的彈藥、放置長槍的藍色木箱，和滅火筒裝胡椒噴霧。巿民知道受騙，但無法阻截警方前進，看大批裝備入政府總部。 裝備擬作防守性質 其後警方高層人員向傳媒承認已把橡膠子彈、催淚彈等武器運入特首辦，又強調若示威者衝擊特首辦防線，警方一定使用有關器械應付示威者。據本報取得的相片所見，大批機動部隊在政總大堂位置安放裝備。消息指，警方是作防守性質，一旦示威者攻入政總，必採取執法行動。 當有學生代表緊急呼籲市民要到政府總部門外增援，擋着警方防線時，大部份市民顯得無動於衷，繼續參觀，有年輕人指要「等埋朋友」才會到場支援，更反問：「你又知冇人會過去？」這輕鬆情景與佔領首日極之不同，危機意識大減。當特首門外對峙局面舒緩後，學生代表在台上宣佈，已不需增援。 警方與佔領者衝突時序表 11:00am 向在特首辦外的立法會議員梁國雄表示，有警員心臟病發，需開路讓救護車駛入，示威者讓出通道 4:01pm 兩架警車企圖進入添華道，遭巿民阻止，警方聲稱是運送物資，同一時間警方在近解放軍總部一側不斷運入物資 4:23pm 巿民發現警方在一側運入物資，開始舉高手阻擋 4:25pm 警方和巿民對峙，有女督察衝出大力捉住示威者的雙手，約5名警員撲出企圖制服該示威者，警方其後放開該名示威者 4:26pm 巿民守在鐵馬外，有警員激動推開鐵馬外的示威者，現場多位記者被推開，有警員跳上鐵馬進入特首辦 4:30pm 巿民誤信警方交更，讓出通道讓警員進出，其間發現警方除了運入食物外，亦運入大量裝備，包括胡椒噴霧、橡膠子彈、催淚彈等，大罵警方講大話 5:00pm 警方運完所有物資，示威者架設多重鐵馬阻止警察再進入 5:10pm 現場有示威者及立法會議員梁國雄就誤信警方向巿民致歉
20141003-4,20141003,4,示威者想走被掟彈,示威者想走被掟彈 【本報訊】警方多次強調發射催淚彈是要確保警方與示威者保持距離。但港大學生會校園電視上載一條於9.28警方武力清場拍攝的短片揭示，有和平集會人士向在場警員要求離開，並無發生肢體衝撞，但警方卻向他們發射催淚彈。 「催淚彈與胡椒噴霧相若」 從片段可見，一名集會人士率領背後一批示威者，向戴上防毒面罩的防暴隊表示希望離開現場，「我要求𠵱家喺度離開，嗰度（後方）冇路啊，比警察封咗」，若在場警察未能作出決定，「請搵你哋commander（指揮官）出嚟」，其後再希望警方「搵一個警察協助我哋離開」。警方不但無回應要求，反而施放催淚彈（圖），集會人士隨即四散離開。 此外，警察公共關係科總警司許鎭德昨稱，警方發放催淚彈鎮壓集會，做法符合國際標準，指市民當晚多次在不同地點衝擊防線，警方經充足警告和別無選擇下才發放催淚彈。他指催淚彈的武力程度與胡椒噴霧相若，只會造成幾分鐘灼熱感和流淚，不會成永久受傷。
20141003-5,20141003,5,武器可貫穿及撕裂身體,武器可貫穿及撕裂身體 【本報訊】警方昨藉口換班，將大批防暴武器運入特首辦，當中相信包括強力胡椒噴霧、催淚彈，甚至更具殺傷力的橡膠子彈，及寫上5.56口徑的彈藥。 AR-15自動步槍最具殺傷力 灰色的圓桶是催淚氣體、咖啡色的圓桶內則是橡膠子彈。據了解，警隊目前使用的防暴武器，除了示威者最近領教過的胡椒噴霧及催淚彈，還有更強殺傷力的武器，包括可使用發射催淚彈，俗稱大口仔的法德魯寸半口徑大口槍，發射內含三粒橡膠彈頭的373型橡膠子彈，射程為40至50米。 藍色的木箱是警方裝槍的器材。警方今次配備雷明登870散彈槍，射程為20米，主要用作近距離發射，發射後有12粒圓珠的彈頭，可呈圓椎狀射向目標。假如目標人物逼近，殺傷力足以貫穿人體及撕開肢體。該種長槍同樣可發射警方2004年引入的布袋彈，彈頭由特別製造的布袋載100至120粒鉛粒，射程為5至20米。2005年警方曾承認使用布袋彈，對付反世貿示威韓農。 此外，警方今次還出動最具殺傷力的武器是AR-15自動步槍，相當於美軍越戰常規裝備的M16自動步槍。AR-15自動步槍每次最多可發射20至30發子彈，射程達800米。除非遇到高程度的暴力，否則不會使用。
20141003-6,20141003,6,前線踢爆　消防疑造數兼少派電單車屈佔中,前線踢爆　 消防疑造數兼少派電單車屈佔中 【本報訊】消防處連日宣稱佔中示威已嚴重阻礙緊急救護服務，更展示數據證明緊急救護召達時間未能達標。但有該處前線人員踢爆相關數據只是佔領示威區的緊急救護召達數據，並非整個區域，批評該處以偏概全，甚至有前線人員爆料，指該處連日極少調派救護電單車出勤，拖低救護車召達時間達標比例，營造佔中示威阻礙救護服務，質疑處方有抹黑佔中之嫌。 消防處副消防總長梁偉雄於過去3日在記者會上多次指出，示威人士堵塞道路，嚴重阻礙救護服務，並稱中區救護車召達時間達標率由92.5%跌至60至70%。 召達數據僅反映某一細區 不過，昨有自稱消防處人員踢爆，中區救護車召達時間達標率六成的數據，「只是將中區某一細區某一個時間抽取出來」，並非事實的全部，反指全港其他地區的救護服務召達時間達標率因佔中而提升，質疑處方以偏概全。 日前有傳媒報道，指在金鐘港鐵站一宗救護召喚個案因道路被示威者堵塞，救護車需40分鐘到達現場。這名消防人員道出事件真相，指當日救護車在美國領事館對出上橋時，被一名督察阻截，救護車被迫到中環等候，「其後再接獲指示步行前往，是救護車主管決定乘坐港鐵前往，不是消防處高層安排」。這名消防人員不滿該處抹黑佔中，「負責救火救援的，為甚麼要涉及政治？為甚麼要為政治委任官員收拾殘局呢？」 另有該處前線人員向本報透露，自9.28警方武力清場後，該處連日極少調派救護電單車出勤，改調派救護車，「呢幾日救護電單車出勤次數由平日十幾廿轉急跌只有幾轉，部份地區甚至一連兩日都冇出勤過，從未試過」。 他質疑該處此舉是為營造佔中示威阻礙緊急救援服務而製造假像，抹黑佔中，「電單車比救護車靈活，若調派救護電單車肯定好大機會達到召達時間嘅服務承諾」。 梁偉雄昨承認，並非每宗救護服務阻塞個案均與塞車或示威者阻路有關，強調當局的數字只是參考數字，但否認以偏概全。至於該宗延誤40分鐘個案，他堅持延誤原因是示威者堵塞道路所致，否則警察不會封路。 針對被指近日極少調派救護電單車一事，消防處回應本報稱，9月28日至10月1日期間，該處有調派救護電單車參與緊急救護服務，重申該處因應個別區域的需求或在特別時段作出相應的行動安排。
20141003-7,20141003,7,港鐵抽執法組增援,港鐵抽執法組增援 【本報訊】佔領行動擴至多個地區，本港多條主要道路癱瘓，港鐵成為市民主要代步的交通工具。據悉，港鐵於本周二起，從全線港鐵站抽調人手包括查票組及打擊水貨客的執法組等合共過百人，到中環、金鐘、灣仔、銅鑼灣、旺角及尖沙嘴等發生佔領示威區的港鐵站，協助疏導人流。 到各站疏導人潮 消息指，由於佔中示威或會持續一段時間，意味會有更多市民乘搭港鐵代步，相關受影響的港鐵站包括中環、金鐘、灣仔、銅鑼灣、旺角及尖沙嘴等更成重災區，均須採取人流管制措施，疏導人潮。 因此，港鐵由本周二起，東鐵及馬鐵每個車站每日須調派最少一人到中環、灣仔增援；其他港鐵站派員到旺角、油麻地、尖沙嘴當值，加強人流管制；甚至連俗稱「查票組」的附例執行組，成員以退休警務人員為主的打擊水貨客的執法組，以及客務快速應變小組亦被調派到相關受影響的港鐵站當值。 消息稱，港鐵今次為應付佔中示威，每日需抽調過百人到受影響的港鐵站增援，由於佔中活動或會持續一段時間，港鐵發內部通告，稱上述人力調派措施未有期限，直至另行通告。
20141003-8,20141003,8,央視不尋常　播梁振英講話,央視不尋常　播梁振英講話 【雨傘革命】 【本報訊】連日參與佔中的市民強烈要求特首梁振英辭職，但中央電視台新聞聯播，昨天卻罕有地播出特首梁振英十月一日於中共建政酒會的講話，《人民日報》昨亦在頭版刊登評論員文章指中央信任梁振英，政府消息人士及建制派中人認為，這代表梁得到中央支持，不可能下台；但也有泛民中人認為，不排除北京與當年安排前特首董建華下台一樣，為梁「風光下台」鋪路。 記者：莫劍弦　呂浩然 中央電視台新聞聯播在中共十月一日慶祝建政當日報道了香港慶祝活動，包括升旗禮及慶祝酒會時，更播出梁振英的廣東話講話片段，有關做法以往從未試過。 與此同時，中共喉舌《人民日報》昨日則在內地發行版的頭版刊登評論員文章，除了批評佔領中環公然違法，又指中央對梁振英完全信任，強調特首由中央任命，中央充份信任梁振英，對他的工作十分滿意，會繼續堅定不移，支持他領導的政府依法施政，並支持警隊依法處置非法活動。 須得中央領導人批准 政府消息人士隨後向傳媒放風，稱中央台新聞聯播播放梁的講話，規格相當高，因為要得到中央領導人批准，才有這樣的安排，加上《人民日報》亦在頭版報道中央充份信任梁振英，強調由此可見，梁振英得到中央充份支持。 立法會主席曾鈺成昨天也在一公開場合稱，佔領市民要求梁振英下台是「冇可能」：「就算梁振英先生佢自己主動辭職，中央唔會俾佢辭」，因為中央除了考慮梁下台是否就能平息事件，也要考慮此舉會否令反對力量「步步進逼、得寸進尺」：「（中央擔心）覺得你可以通過一個大規模嘅所謂群眾壓力，可以迫使到政府要倒台，要下台」。問及董建華亦因2003年7.1遊行下台，曾表示「呢個你估嘅啫」。 「搵個位等佢風光下台」 官媒與建制派力挺梁不會重複董建華腳痛下台之時，有泛民中人卻指，2003年7.1遊行後，中央也是全力支持董建華留任特首，但董最終在2005年「腳痛」下台，所以北京現時高調挺梁，不排除與當年處理董下台一樣，「𠵱家梗係全力撐佢，一年半載之後先搵個位等佢風光下台」。 民主黨何俊仁也說，政界廣為流傳北京處理佔中底線是「不妥協，不流血」，因此他認為撤換梁振英的機會，比武力鎮壓的可能性高，始終對中央來說，「一個人係唔重要」。 公民黨主席余若薇昨向梁振英發公開信，題為「解鈴還需繫鈴人，辭職吧！」她批評梁任內兩年「帶來互鬥、互不信任、不公平、不公義，香港人上街多了，笑容少了」，斥梁「對民意無動於衷，對學生毫無惻隱之心，對香港未來毫無承擔，我們不會繼續容忍你管理這個地方」，促梁立即辭職。信件現已獲23位泛民主派議員支持，並邀請市民加入聯署。
20141003-9,20141003,9,董下台前獲北京力撐,董下台前獲北京力撐 【本報訊】2003年7月1日50萬人遊行作為董建華下台的導火線，並非立即見效。由2003年7.1至2005年3月董稱「腳痛」下台的一年多時間內，北京不斷釋出挺董訊息，一直至董下台前數個月才有迹可尋。 同有富豪團訪京 50萬人上街後為穩住局面，北京於該月底趁特別安排董上京述職，安排罕有的高規格接見董，時任國家主席的胡錦濤、總理溫家寶、國家副主席曾慶紅、副總理吳儀等盡出。8月下旬時任統戰部部長的劉延東及港澳辦副主任陳佐洱，亦先後向港區政協和訪京的法律界人士發表挺董言論。9月更安排包括長實李嘉誠、恒地李氏及新地郭氏的超級富豪團訪京，當面傳遞挺董訊息。 到2004年1月董發表在政制問題上行拖字訣的施政報告後，港澳辦又大讚施政報告。然後9月江澤民辭去軍委主任，有指董頓失靠山，時任人大常委的曾憲梓和中聯辦副主任李剛隨即開腔挺董。 直至2004年12月、即董下台前數月，挺董訊息才不復見。當時董到澳門向胡錦濤述職，被胡錦濤當面訓斥要「查找不足」，翌月、即2005年1月傳出京悄悄為下任特首揀蟀，2005年3月董才宣佈腳痛請辭。
20141003-10,20141003,10,曾鈺成指密會無結果,曾鈺成指密會無結果 【本報訊】立法會主席曾鈺成昨證實，前天應民主黨創黨主席李柱銘及壹傳媒集團主席黎智英邀請會面，引述李、黎提出的解決困局建議很難落實，形容會面「冇結果」，又指任何對佔中有影響力的人士，若希望與他商討解決佔中問題，他都樂意幫手。 與李柱銘黎智英見面 曾鈺成昨接受港台《議事論事》訪問時被問及密會一事，笑稱自己不會「講大話」，但由於答應了對方，故不透露會面內容，只證實是李、黎於前天上午致電邀約會面，商討如何解決佔中，故此他樂意出席。最終討論了大半個小時，發覺雙方對解決問題的看法有「比較大分歧」，認為李、黎的建議很難落實，亦正如黎智英所言會面是「冇結果」。 他自己則向李、黎表示，「大家都要以嗰啲示威嘅市民，尤其係青年、學生作為我哋最重要嘅考慮，一定要保護我哋嘅青年學生」，可以的話要避免出現磨擦，否則若有意外令學生受傷，會是最令人痛心的情況，曾指李、黎二人亦同意。 他解釋沒有受委託才與李、黎會面，又指若非有記者拍攝就不會有人知悉事件，「除咗我同佢兩位，我相信都冇人知」。被問到會否與佔中三子商討時，他稱一直有途徑與三子聯繫，相信有需要時雙方之間「可以傾到」，惟現時未想到解決方法，故商討意義不大。 而李柱銘昨只稱，與曾鈺成見面僅是朋友間的聚會，反指是對方在9.28後主動邀請，拒透露會面內容。
