key,date,article_daily_id,title,text
20151023-0,20151023,0,毆斃東北漢案港導遊：死者暴力，所以踢佢,毆斃東北漢案 港導遊：死者暴力，所以踢佢 【本報訊】內地東北遊客苗春起被毆斃案，涉案本地導遊及內地領隊被控一項誤殺罪，昨解九龍城裁判法院提訊，本地導遊被捕後向警方承認曾踢內地遊客，辯方補充稱內地遊客當時很暴力，本地導遊為了制止暴力及調解事件才踢他。此外，死者的妻女等前晚由內地來港，矢言追究到底，「為甚麼會這麼大膽，白天給我們打死了……內地人來香港就這樣的後果？」 記者：戴國輝　詹家志　劉永明 兩名被告依次是本港導遊胡彥南（44歲）及持雙程證來港的內地領導劉洋（32歲），昨晨由警車押解至法庭應訊，傳譯主任分別用廣東話及普通話向兩人宣讀控罪，他們聽過控方詳情後低聲說明白，聆訊期間胡大部份時間低垂着頭，劉則不時望向公眾席，劉的前妻、即旅行團團長鄧海燕則戴上口罩到庭聽審。 控罪指兩被告於本月19日在九龍城民樂街20至28號地下蒂亞鑽有限公司外非法殺死黑龍江男子苗春起（54歲）。控方指店舖的閉路電視拍下死者離開店舖，及被數人拳打腳踢的畫面。警方拘捕兩被告，胡在警誡下承認曾踢死者，劉則否認向死者施襲，僅承認在場曾拉開死者及其他人。 仍有一兩名同黨在逃 兩被告暫時毋須答辯，控方指警方需繼續調查案件，例如進行毒理及鑑證化驗，亦須尋找其他證人，仍有一至兩名同黨在逃，而針對兩人的證供強烈充份。 控方又指，胡在1991年有一個交通案底，劉持有效期七天的雙程證來港，本月25日到期，沒本港住址，缺乏本地連繫，鑑於本案案情嚴重，反對兩人保釋候訊。辯方指胡任職導遊，可以現金及人事各10萬元保釋，每周到警署報到三次，承諾不會接觸任何控方證人，亦可不離開香港。辯方又指，死者當時行事暴力，胡為制止暴力及調解事件，才踢死者。劉則沒有保釋申請。 主任裁判官羅德泉認為本案案情嚴重，而且有疑犯在逃，憂慮如准被告保釋，被告可能會棄保潛逃及妨礙司法公正，故拒絕胡的保釋申請，兩被告還柙監房，押後至12月22日再訊。 死者女兒矢言會追究 昨午1時許，死者苗春起的妻子張月英、女兒及女婿等親友，乘坐由旅遊業議會安排的旅遊巴，由九龍維景酒店往葵涌殮房認屍，逗留50分鐘後離去，各人表現激動，其中張月英淚流滿面，需由女兒及女婿攙扶離開，她說：「我要真相，為甚麼打死，甚麼人？甚麼背景？跟這個旅遊團、珠寶店是甚麼關係？為甚麼會這麼大膽，白天給我們打死了。」 死者女兒亦矢言會追究，「給我們一個合理的說法，我父親怎會這樣就死了？」女婿更指：「內地人來香港就這樣的後果？」另一同行的光頭漢激動地說：「絕對是法西斯，最好看看他死前表情，你們要為我們伸張正義，真的非常之痛苦。」 香港旅遊業議會總幹事董耀中表示，死者家屬昨晨在酒店跟警方錄取口供，他與家屬見過面，家屬情緒仍然激動，未能接受失去親人的事實，要求合理解釋，希望尋求事件真相。 案件編號：KCCC3611/15
20151023-1,20151023,1,疑天馬偽造文件旅議會今報警,疑天馬偽造文件 旅議會今報警 【本報訊】今次內地遊客被毆斃事件，揭露香港旅遊業亂象叢生。香港旅遊業議會總幹事董耀中表示，出事旅遊團的本港接待社天馬國際旅行社報稱由深旅國際接團，但深圳當局調查後證實並沒此事。旅議會已去信警告天馬，同時懷疑天馬涉嫌偽造文件，計劃今天報警。 董耀中稱，給予天馬國際14天的時間解釋事件，倘證實違規，不排除取消會籍及吊銷牌照。根據公司註冊處資料，天馬的股東名字是普通話拼音，董事是一名叫林端虹的港人，他同時持有飛馬旅行社，兩間公司所報地址都是紅磡同一幢大廈。本報曾經致電天馬查詢，職員聲稱負責人不在公司拒絕回應。 工會促加快成立旅監局 香港旅遊業僱員總會、香港專業導遊總工會及香港旅遊業導師協會等三個旅遊業工會指事件令不景氣的香港旅遊業雪上加霜。香港專業導遊總工會主席余莉華批評，旅遊業議會非法定機構，執行力不足，促請政府加快成立旅遊監管局，提高阻嚇性，而旅議會、警方及內地旅遊局應盡快查明真相，並懲處違法人士。 香港旅遊業僱員總會總幹事林志挺表示，近年內地購物團來港時多次發生爭執，主要因為旅行社以低價搶客，而用購物回扣賺錢。由於當局監管不足，令低價團屢禁不絕，形成一條畸形產業鏈，出現不文明行為，逐漸破壞本港旅遊之都的形象，希望政府盡快堵塞亂象以挽本港旅遊業聲譽。 ■記者梁澤岡
20151023-2,20151023,2,女團長：以後不想帶團，害怕了,女團長：以後不想帶團，害怕了 【本報訊】內地遊客苗春起遭毆斃事件震撼中港兩地，案中女團長鄧海燕（32歲）被扣留48小時後獲准保釋候查，她接受《蘋果》專訪時表示，事發前曾勸團友不要在珠寶店抽煙，並承認與另一被告劉洋（32歲）曾是夫妻關係，現已離婚。 鄧海燕稱持有內地領隊牌照，多次帶團來港，從沒遇過被團友打，不過她說：「我以後不想帶團，害怕了。」她指本周日（18日）從皇崗帶團來港，死者苗春起與同事張麗霞報稱是夫妻關係，印象中苗頗疲倦，不時打瞌睡，「一上車已昏昏欲睡，回酒店已經上房」。 承認被捕內地領隊是前夫 翌日，他們吃過早餐後去紅磡民樂街一間珠寶店參觀，其間她曾勸苗與張不要店內抽煙。她說，倘團友抽煙而引致珠寶店火警，自己也有責任。 鄧海燕今天（23日）須返警署報到，暫時不能離境，「心裏很難受，不知道以後怎麼辦」。 鄧海燕又承認劉洋是其前夫，他們育有一名3歲兒子，而帶團賺錢只是想養活兒子，希望能讓他於一個較好的環境中長大。由於兒子有病，她已安排母親代為照顧。對於惹下官非，鄧海燕一時感懷落淚：「不知道怎麼樣解決以後生活。」 《蘋果》記者
20151023-3,20151023,3,黑店劏內地客皇帝果貴逾千倍,"黑店劏內地客 皇帝果貴逾千倍 【本報訊】香港黑店劏客個案持續發生，兩名內地遊客，早前分別在尖沙嘴及銅鑼灣兩間藥坊，購買止咳藥及驅風中藥，疑遭店員以不良營商手法行騙，分別以兩萬元及萬多元的「天價」，購買了約半斤皇帝果及鳳尾草。海關接投訴調查後，昨日掩至銅鑼灣涉案藥坊拘捕一名負責人。 聲稱在尖沙嘴被騙的浙江寧波遊客許先生，昨晚對《蘋果》記者稱，本周二（20日）他與妻兒一家三口墮天價中藥陷阱後，報警及向消委會投訴都無結果，他直斥香港政府監管不力，指所買的中藥比內地貴逾千倍，以後「不會再來香港旅遊」。 許先生所指的藥坊位於加連威老道，他憶述不爽經歷稱，當日打算購買售價126元的止咳藥水及暈浪丸，他交出信用卡付款，店員同時介紹聲稱名為「皇帝果」的中藥，指磨粉服食止咳特別有效，隨後拿出藥粉指可以送給他試食。 許指他沒有收下，但於付款時，店員給他賬單要他簽名，卻出奇地用手指把價碼掩住，本來他不虞有詐，但突然發現本來126元的價碼變成22,800元，震驚下向店員詢問，對方指他買了60錢「皇帝果」，並稱每両售價3,800元，他憤而報警。 警員協調後他只能獲減價至2萬元，並把止咳藥水送給他，由於他要趕飛機，所以只能付款，但離開前再買9顆未磨粉的「皇帝果」，回到寧波發現其中8顆已經發霉，他找中醫查詢，獲告知所謂的「皇帝果」是每両價值2元人民幣的藏青果，他買的貴了超過千倍。 斤變錢　負責人被捕 另外，海關接獲一名內地遊客投訴，指他本年1月在銅鑼灣怡和街1號大藥坊購買驅風袪濕中藥鳳尾草時，遭店員以斤變錢行騙。當時店員拿出一樽寫着鳳尾草中藥，他以為680元一両，買了40錢刷卡時，店員稱折實後收取他14,000元。雖然報警，但警員到場並沒有採取行動。事主今年5月來港協助調查，關員深入調查後，昨午2時許掩至涉事藥坊，以涉嫌違反商品說明條例（不良營商手法）將30歲負責人拘捕。 ■記者黃兆康、溫瑞麟"
20151023-4,20151023,4,梁三天後才回應打死人案,梁三天後才回應打死人案 【本報訊】內地旅客因購物問題，被襲擊後死亡案件，連日未有高官就事件開腔遭立法會議員炮轟；行政長官梁振英昨終開腔，指政府及內地機關高度關注事件；又稱草擬成立旅遊業監管局的工作非常複雜，會盡快完成草案交給立法會。 蘇錦樑：會徹查事件 特首梁振英昨在立法會答問大會被議員問及內地旅客被打死，以及旅監局一直「只聞樓梯響」回應指，政府十分關注事件，而旅監局草擬內容繁多，需時較估計長，會盡快完成交給立法會通過。在成立旅監局前，旅遊業界應高度自律。 商經局局長蘇錦樑昨開腔表示對死者苗春起的家屬致以慰問，又形容事件不幸，旅議會會協助其家屬來港認領遺體。局方會與國家旅遊局聯繫，檢視國家旅遊法，了解有關「零、負團費」旅行團情況。他又強調由於有規定旅行團團費不可低於接待服務成本價格，故會徹底調查事件中是否有違規，亦會了解內地是否有人違規。 ■記者蔡朗清
20151023-5,20151023,5,彭麗媛白粉妝丟臉微博刪相刪留言,彭麗媛白粉妝丟臉 微博刪相刪留言 【本報訊】中國國家主席習近平夫人彭麗媛前晚出席宴會時，臉上驚現白色粉印「一撻撻」。一向優雅得體的彭在如此重要場合妝容失誤，引起熱議。而內地迅速刪除屏蔽相關照片和評論，勢要挽回第一夫人顏面。外間普遍認為，彭的造型比以往中共第一夫人大有進步，成功「搣甩老土」，不料此次在化妝上失手！ 記者：楊 倩 正在英國進行超級國事訪問的習近平夫婦，當地時間21日出席倫敦金融城市長葉雅倫（Alan Yarrow）主持的歡迎宴會時，彭麗媛被拍到額頭、鼻及唇邊有大範圍白色粉印，猶如沾了麵粉。雖然彭很快發現並補救，面目恢復正常，但第一夫人的「白粉照」引起了多家英媒體關注並大篇幅報道。《每日郵報》稱之為：「unfortunate make-up mishap（不幸的化妝災難）」，《每日鏡報》則用「embarrassing make-up fail（尷尬的化妝失手）」以及「mysterious white smear look（神秘的白色污糟樣）」形容。 中國內地的微博昨下午已全面刪除彭麗媛的「白粉囧照」以及相關評論；甚至封鎖網友賬號，只留下第一夫人的靚相和網友的讚美。但其實細看官方新華社拍攝彭麗媛當日早些時候參觀學校的相，雖不是面部特寫，側面遠遠都能見到她臉上不均勻的白色粉印。 化妝師無考慮閃光燈影響 塊面這樣花，難道出門前沒照鏡？估計因含矽的碎粉在常光下透明無色，但閃光燈一打就無所遁形，這類「白粉囧照」過往不少荷李活女星也都遭遇過。本港時尚達人鄧達智認為造成這種尷尬，錯不在彭麗媛：「很尷尬，是化妝師的問題，無計算（強閃光燈）可能性，這樣重要的人物，這樣重要的外訪一定要計算的！」台灣中央社指出事相片中彭的牙齒沾染唇膏也顯得太不專業。重大場合讓第一夫人丟臉，不少網友為彭的化妝師命運擔憂。 習近平辦公室負責化妝 據知情人士向《蘋果》透露，以往國家領導人和夫人外訪時，服飾和化妝都由外交部禮賓司負責。但習上場後，這些工作則由習近平辦公室包攬。藝人出身的彭麗媛，對外形也特別有自己的意見同堅持，例如：頭髮一定要Set高，化舞台厚妝，確保很遠都能看見五官輪廓；出訪時她偏愛配搭企領外套挺身外套或斗篷，既柔中帶剛，又顯瘦。 鄧達智認為，彭麗媛妝容失誤瑕不掩瑜，他讚彭此次外訪是近年打扮最好的一次，成功塑造大方得體的第一夫人形象：「大膽講句，彭身形圓潤即大份啲，但竟能穿出柯德烈夏萍的簡約味道！簡潔衫不易着，很容易沉悶，但彭沒有這個弊端，完全穿出衫最好的味道。當然同凱蒂王妃比首先人家年輕貌美，彭麗媛不但要靚，還要表達現在中國氣氛，老公在肅貪，她一定要被人看到簡約、慳家，不能奢華，顏色很低調。這次頭髮也稍梳低有點波浪在額頭，比較柔和沒那麽兇。惟獨手袋可配得更好。」
20151023-6,20151023,6,疑用礦物粉後出面油,疑用礦物粉後出面油 【本報訊】中國國家主席夫人彭麗媛，臉上驚現「一撻撻」的白色粉，「白面國母」淪為國際大笑話。英國的《每日郵報》指彭麗媛或因塗上很易反光的矽粉（Silica powder），著名化妝師Wayne Goss則拍片示範過度使用HD Powder以致出現白粉面。 專業化妝師Miffy估計彭麗媛面上出油加礦物粉，令可怕白粉妝出現，「天氣凍，可能因為佢年紀大，底妝用咗啲太油潤的護膚油、太厚身的cream foundation，跟住加埋礦物粉，當塊面出咗油，就會變咗白色。」她指不同質料的化妝品亂溝，亦會出現有關情況。 噴水掃開上粉可挽救 她在本報主播阿Gi面上，模擬彭麗媛的出事妝：重複使用強調輪廓的光影液、出事重點的礦物粉，以及亂溝多種質地化妝品。結果，高清妝在正常燈光下，望落妝容正常柔和，但大半小時後，閃光燈的強白光之下，主播的前額位、下巴等，也出現一撻撻的反光白粉（圖），相當嚇人。 其實過往不少國際知名女星及名媛都遇過「白色悲劇」，包括安琪蓮娜祖莉（Angelina Jolie）、妮歌潔曼（Nicole Kidman）、杜莉芭里摩亞（Drew Barrymore）、露美慧柏絲（Noomi Rapace）等。 而今個月初，向來以最美形象示人的美國女歌手Taylor Swift都失手，在紐約街頭被影到臉上出現白色粉末，而眼袋位置成重災區，可能是想遮黑眼圈闖禍。Miffy指有補救方法，「真喺出咗事，入廁所噴一噴保濕水，再用化妝掃掃番開去，再上一層碎粉，可以挽救番少少。」 《蘋果》記者
20151023-7,20151023,7,習褲太長出事,習褲太長出事 不光是夫人彭麗媛妝容出事，英國《每日鏡報》還指另一個宴會場合，國家主席習近平自己也遭遇時尚問題，該報記者拍到習的皮鞋後踭踩住了自己的褲腳，顯然他身上的這條西褲是太長了。其實中國男士穿西褲多數鬆身，可能習總喜歡舒服多過時尚呢？ 英國《每日鏡報》
20151023-8,20151023,8,"習送禮加碼　投資英4,795億與卡梅倫莊園會晤嘆下午茶","習送禮加碼　投資英4,795億 與卡梅倫莊園會晤嘆下午茶 【習近平訪英】 中國國家主席習近平昨繼續訪英行程，繼與卡梅倫會晤共同見證中英簽署總值400億英鎊（約4,795億港元）合作協議、向英方送大禮後，中英昨發聯合聲明，英國公開支持人民幣成為國際貨幣基金組織特別提款權貨幣（SDR），並宣佈放寬對華旅遊簽證。習昨參觀國際海事衞星組織（Immarsat）、出席孔子學院活動，與卡梅倫舉行中英版「莊園會晤」；之後結束在倫敦的訪問，轉飛曼徹斯特。 前日下午習近平與卡梅倫正式會談後，中英簽署多項協議，這些合約絕大部份是中國出錢在英國投資、或者中資佔主要股份的合作項目，合約總金額達400億英鎊，較早前外界估計300億英鎊還要多100億英鎊；項目包括中國參與興建英國欣克利角核電站項目、改造倫敦舊城、研發環保的士等。此被視為習訪英重頭戲，是習帶給英國人的厚禮。 重禮之下英國也識回報。中英兩國昨日發佈「構建面向21世紀全球全面戰略夥伴關係」聯合宣言，稱「雙方認同彼此對自身政治體制、發展道路、核心利益和重大關切的重視」。 英撐人民幣成SDR 英國更公開支持人民幣在國際貨幣基金組織特別提款權審查中，加入特別提款權貨幣（SDR）籃子，「從而進一步提高新興市場和發展中國家的發言權」，為中國在有關問題上助威吶喊。 聯合聲明還表示，支持開展中英兩國股市「滬倫通」可行性研究；並呼籲開展中歐自貿區可行性研究；中英雙方同意不從事或支持網絡商業間諜活動。此外，英國宣佈放寬對中國遊客簽證，將有效期從半年延至兩年允多次入境，並可能放寬為10年內多次往返簽。但與中國媒體大幅報道不同，英媒昨對兩國簽巨額合約鮮有提及。 訪衞星公司　支援中國 昨日上午，習近平參觀國際海事衞星組織。這是全球最前沿的衞星科技公司之一，與中國合作已久，與中方開展全球無線寬帶網絡（Inmarsat Global Xpress）建設，並在中國地震等災害提供人道支持。公司向習贈送最新型衞星的模型，並演示這些衞星如何保證「一帶一路」地區的通訊安全。 隨後習近平又赴倫敦大學孔子學院，參加全英孔子學院和孔子課堂年會開幕式，英國中小學生用普通話為習朗誦中國詩詞、唱中國歌等。儘管中共被質疑透過孔子學院對外輸出意識形態，但目前全球仍有134國建有495間孔子學院，英國有29個孔子學院設在各大學，還有124個孔子課堂設在中學。 昨午，習近平往英國首相別墅契克斯莊園（Chequers），仿去年在美國加州與奧巴馬舉行「莊園會晤」，與卡梅倫舉行中英版「莊園會晤」，卡梅倫請習小酌，品嚐英國傳統的下午茶。有400多年歷史的契克斯莊園從1921年起就是英國首相官方鄉間別墅，卡梅倫曾在此接待過德國總理默克爾、法國總統奧朗德等政要。昨晚，習近平結束在倫敦的訪問，乘專機飛往曼徹斯特。 英國廣播公司/路透社 中英簽署部份項目協議 ‧英國欣克利角核電站項目，中方投資1/3，總值60億英鎊（720億港幣） ‧吉利集團再投入5,000萬英鎊（約6億港幣），在倫敦研發新一代黑色的士 ‧信中利基金向英國跑車品牌Aston Martin投資5,000萬英鎊（約6億港幣）發展電動跑車 ‧中資投17億英鎊（204億港幣）開發倫敦皇家埃爾伯特港口，提供3萬個工作崗位 ‧華人文化產業基金與英國默林娛樂集團合作，投資3億英鎊（36億港幣）在上海建Legoland ‧中英合作投資，創建中英電影投資基金，計劃5年基金規模增至15億英鎊（約180億港幣） ‧中英簽署總價超過120億英鎊（1,440億港幣）油氣合作協議 ‧中船集團、中投公司與嘉年華集團簽署總值26億英鎊（312億港幣）合作協議建新郵輪 ‧海南航空向勞斯萊斯訂購空中巴士發動機總值14億英鎊（168億港幣） 中英此次簽約總值為400億英鎊（約4,795億港幣） 資料來源：路透社"
20151023-9,20151023,9,華崛起美衰落英獻媚夠現實,華崛起美衰落 英獻媚夠現實 【拆局】 今次英國空前隆重地接待中國國家主席習近平，美國和西方有各種批評和質疑，英國《衞報》發表評論文章為英方解辯稱：「中國在崛起，美國在衰落，英國不能忽視這一現實。」 文章指，英國的政策變動始於今年初英國加入中國發起主導的亞洲基礎設施投資銀行（亞投行），成為首個加入亞投行的非亞洲國家。美國反對英國的決定，因其認為亞投行是對美國主導的國際貨幣基金組織和世界銀行的威脅。 英國長期活在美國的陰影中，做出這一決策背後的考量，是因為「鍋裏已經沒肉了」。如果說10年前中國國家主席胡錦濤對英國訪問時，英國的GDP還比中國稍多，但現在即使用最保守的計算方式，中國的GDP也已是英國的三倍，英國已變成一條小魚。報道指，英國落後的基礎設施需要大量英國所沒有的資金。中國意圖投資英國高鐵項目、核電站及所謂「北方經濟增長計劃」，可帶來大量機遇。同時倫敦可以成為人民幣最大的離岸市場，這對中英兩國中的發展都至關重要。 當然，英國開始擁抱中國必然會疏遠美國。但中國正在崛起，美國正在衰落。到2030年，預計中國的經濟體量將會是美國的兩倍。難道英國或任何其他國家要忽略這一現象嗎？轉向中國可為英國提供重要機遇，在未來以中國為中心的世界，英國重新變得繁榮。 英國《衞報》
20151023-10,20151023,10,成龍現身　搶習風頭,成龍現身　搶習風頭 【點滴】 成龍威威！英國時間21日，國家主席習近平與夫人彭麗媛一行到蘭卡斯特宮，與威廉王子及王妃凱蒂一同出席中英創意產業交流活動，其間香港影星成龍現身，頓成焦點。他不僅獲習主動和他握手，中國領導人及英國皇室成員還以他為中心合照留念（圖），認真「巴閉」，但更讓人意想不到的是，見慣大場面的凱蒂見到巨星突然好冧，如含羞答答的少女。
20151023-11,20151023,11,國宴用89年紅酒暗提八九民運？,"國宴用89年紅酒 暗提八九民運？ 【點滴】 白金漢宮為習近平設國宴、準備的紅酒當中，有法國波爾多歐布里雍堡（Chateau Haut-Brion）1989年份的紅酒（圖）。有網民指，英欲以1989年份的紅酒，曲線提及「八九民運」，認真高招。該支紅酒網上售6,000至7,000港元，歐布里雍堡酒莊歷史悠久，於1593年創立，到了17世紀，其所釀造出的葡萄酒驚艷英倫，成為首個成名的波爾多頂級酒莊。"
20151023-12,20151023,12,駕「露筍」載友人　猛撼大樹再墮7米山坡青年飛車入　死亡彎位　喪命,駕「露筍」載友人　猛撼大樹再墮7米山坡 青年飛車入　死亡彎位　喪命 昨日車禍中慘死的青年凌卓偉（Hugo），任職運輸工人，與父母同住元朗橫洲楊屋村。同車的33歲姓羅乘客，身體多處受傷，情況嚴重；據悉，羅做網上買賣生意。昨凌晨時分，凌、羅及另外兩名友人，分乘兩車到新娘潭一帶遊車河，之後將車停在獅子亭閒聊休息，其間有人提議到大埔買飲料，凌於是駕駛其紅色三菱「露筍」第10代（Lancer Evolution X）辣跑，載同羅一同前往。 疑高速入彎失控 他們一車二人沿新娘潭路往汀角路，至水務署抽水站附近一個右彎時，疑高速入彎失控，全車鏟上左邊草地先後猛撼兩棵大樹後，再衝落兩樹之間的7米下山坡，四輪朝天，車身擱在茂密的樹林內，兩人重創被困車內。 至昨凌晨約3時45分，留在獅子亭的兩名友人見凌和羅二人遲遲未回來，於是驅車沿路找尋，至上址路邊發現有一些紅色車身零件殘骸及一個飛脫的車胎，立即落車查看，發現凌的辣跑擱在山坡下，立即致電報警。消防員接報趕至，攀落山坡用繩索固定車身，之後從車內將凌和羅二人救出，再用擔架床將他們抬上路面，凌被送往那打素醫院搶救後傷重不治；羅獲救時滿臉鮮血，經搶救後情況嚴重。 警方事後在現場調查，發現肇事辣跑留下的胎痕，正計算事發時的車速。至昨晨9時45分，一輛吊臂車奉召到場將吊臂降下山坡，由工人攀落斜坡為車身綁好吊索，之後成功將肇事辣跑吊回路面，全車毀爛不堪，車尾被劏開，前座位兩個安全氣袋彈出，袋面染有血迹，警員並在車廂內撿獲一部行車鏡頭，將翻看有關拍攝紀錄，調查事發經過及追查意外原因。 新界北總區交通部特別調查隊高級督察姜國明表示，肇事車輛會被拖往大欖涌汽車扣留中心，並進行機件檢查，以確認意外原因。 至昨傍晚6時許，凌的15名好友帶備香燭冥鏹，返回車禍現場進行路祭，眾人神情哀傷，其間有人激動大叫：「收嘢啦，唔好掛住我哋！」運輸署資料顯示，肇事「露筍」辣跑出廠年份為2008年，登記車主為凌的父親，去年11月以逾21萬元購買。
