key,date,article_daily_id,title,text
20151020-0,20151020,0,七警曾健超　兩案提堂控方證人幾乎全是警察 ,"七警曾健超　兩案提堂 控方證人幾乎全是警察  【本報訊】去年佔領運動期間，在金鐘添馬公園變電站發生的「暗角七警」事件，涉毆打公民黨成員兼註冊社工曾健超的七名警察，與事件中的投訴人曾健超，昨分兩案於東區法院提堂。兩案將傳召59名控方證人，七警案的證人絕大部份是警察，而曾健超襲警案則清一色全是警察。 記者：蘇曉欣　蔡少玲 獲安排昨先行「出場」應訊的七警，現已停職。他們分乘兩架私家車到庭，在法院正門下車步入法庭，其中三人戴口罩和太陽眼鏡遮面。七名被告依序為有組織罪案及三合會調查科總督察黃祖成（48歲）、觀塘區反黑組高級督察劉卓毅（29歲）、觀塘區反黑組警長白榮斌（42歲）、觀塘區反黑組警員劉興沛（38歲）、東九龍總區刑事總部警員陳少丹（31歲）、九龍城區刑事偵緝警員關嘉豪（32歲）及觀塘區反黑組警員黃偉豪（36歲）。 被控兩罪警神情緊張 七警被控有意圖而導致他人身體受嚴重傷害罪，被指於去年10月15日於龍匯道政府大廈變電站外惡意傷害曾健超，其中陳少丹另被加控普通襲擊罪，指他於同日在中區警署接見室內毆打曾建超。庭上面對兩項控罪的陳，狀甚緊張，雙手全程繃直並緊貼大腿兩側；而關亦一直愁眉深鎖，顯得相當擔心。被告毋須答辯，押後至下月17日等候文件轉介區域法院審理。 襲警案押後至12月 控方透露將傳召33名證人，大部份為警察。據知首名證人是曾健超，相關片段亦將呈堂作為證供，另證人亦包括醫生，相信就曾的傷勢作供。七名被告各准以1,000元保釋，其間不得直接或間接與控方證人討論本案案情。 案件編號：ESCC3432、3433/15"
20151020-1,20151020,1,曾健超案押後　與七警未碰面,曾健超案押後　與七警未碰面 七警辦妥保釋手續離開法庭，曾健超幾乎同一時間抵埗，但雙方未有機會碰面。曾甫步入法庭，庭上黃絲拍掌為他加油，曾合十致謝。 曾健超（40歲）被控一項襲警和四項抗拒正當執行職務的警務人員罪。控方透露會有26名控方證人，全部為警務人員。控方原要求曾進行答辯，但辯方大律師麥嘉汶指手上只有控方的簡單案情文件，要求押後答辯；又指得悉另一有關的案件已押後至下月再訊，要求將案押後至12月9日再訊。但是控方認為押後七周太久，辯方反駁指控方在事件上亦拖延一年後才作檢控，警方既有長時間準備，理應也給辯方多些時間，結果法庭接納要求，將案件押後至12月9日先進行預審。 曾健超被指去年10月15日於龍和道隧道西行線東面入口上面的花槽，襲擊正當執行職務的11名警務人員，包括警長黃凱文和張善恒、警員張嘉恒、李俊傑、林展恒、徐康盛、何德章、劉浩明、黃信偉、黃偉諾、周修民；並指他其後在花槽上，四次抗拒制服他的四名警務人員，包括警長畢宏達、程英偉、鄭浩漳和高級督察傅駿業。 曾在庭外向傳媒發表簡短發言，先向香港市民和支持者致謝，再講出16字宣言「尋求公義、勇敢面對、政治打壓、不屈不撓」，之後離開。 案件編號：ESCC3432、3433/15
20151020-2,20151020,2,藍絲黃絲港鐵站打架　四人被捕,藍絲黃絲港鐵站打架　四人被捕 【本報訊】暗角七警案與曾健超疑襲警案昨同庭提堂，黃藍絲陣營各自號召支持者，到東區裁判法院撐場。法院門外壁壘分明，雙方除互相叫罵，警方昨深夜發稿，指4名來自不同陣營人士，因政見問題，下午4時38分左右，在港鐵西灣河站互相推撞打架，全部受傷送院。警方調查後，以涉公眾地方打架，拘捕全部4人。 警方新聞稿指出，4名涉案人士來自兩個陣營，指4人在太安街步行往西灣河站期間，因政見問題爭執，邊行邊推撞，到站外動武互毆，4人在車站月台被截停，全部報稱受傷到東區醫院治理，送院時清醒。其中一邊陣營有3人，包括一名54歲譯音姓高男子，報稱受背傷；其餘同行的66歲姓黃及57歲姓趙女子，則報稱右面龐及左面龐受傷。另一陣營，只有一名37歲姓劉女子，報稱面、右手及左腿受傷。警方拒評涉案人士屬藍、黃絲或所屬團體名稱。 四眼哥哥播七警新聞片 保衞香港運動發起人傅振中及多名撐警藍絲昨一早到法院示威，其間傅播國歌及撐警歌曲以示支持，稍後撐警大聯盟召集人李偲嫣亦到場，藍絲幾近霸佔示威區。 七警在提訊後辦理保釋手續，有「四眼哥哥」之稱的社運人士鄭錦滿故意在各人身後幾個身位，以手機大聲播放有關七警的新聞片段，但各人沒反應。七警離庭時，劉興沛、陳少丹及黃偉豪帶口罩及太陽眼鏡遮臉，黃絲見狀即上前嘲笑三人「唔係好憎人戴口罩㗎咩？唔見得人呀？」反之藍絲等人一看到七警步出法院，隨即拍手，李偲嫣更多次高舉大拇指讚好。 黃絲人數明顯較少，一度被藍絲嘲「得小貓兩三隻」，直至下午有20多名黃絲撐黃傘現身。雙方不斷對罵，並就示威區分配問題起爭執，最後需警方介入調停。 七警與曾健超進出法院時，藍黃絲均情緒高漲。曾離庭時接受記者訪問，藍絲即大聲講話圖蓋過其聲量。曾及後乘的士離開，即被多名黃絲支持者包圍。 ■記者蘇曉欣、陳美莉
20151020-3,20151020,3,李偲嫣擬舉手機遭請離庭,李偲嫣擬舉手機遭請離庭 【本報訊】網上雖早已瘋傳七警之相片，但有傳媒首次看到各人廬山真貌後，竟在法庭內偷拍。就連撐七警的李偲嫣亦「唔執輸」，趁開庭時在公眾席擬舉手機，即時被後座市民舉報，惟李否認，庭警經調查後最後「釋放」她。 now記者偷拍或被控 成功在逼爆的東區法院第一庭霸得一席的李偲嫣，甫開庭即偷偷舉手機圖拍攝七警「背脊」，在其身後的市民即向庭警「通水」，庭警即叫李離開進一步查問，惟李多番解釋並拒絕，直至有市民說「阻差辦公喎」，她方肯離開。李並叫記者幫手證明手機內無庭上拍攝的相片，但遭拒絕。 此外，不少記者昨紛紛用眼及筆記下七人特徵，以核對清楚庭外各拍照片各被告身份。其中now TV高級記者王耀楊（圖）竟在七警入庭後高舉手機拍攝他們容貌，辯方律師發現即向庭警投訴，庭警其後抄下王的個人資料及沒收手機，更表明可能票控他。王在庭外無奈道：「我都知唔可以影，但心態上諗到七警咁難認，所以影低自用，方便工作。」 根據《簡易程序治罪條例》，任何人在法庭內攝影或企圖拍攝，均可被判罰款250元。 ■記者陳美莉、羅日昇
20151020-4,20151020,4,警工會拒資助七警打官司,"警工會拒資助七警打官司 【本報訊】涉於去年佔中期間毆打公民黨成員曾健超的七名警員昨提堂，由警務督察協會和警察員佐級協會成立、援助在佔中執勤的警務人員的「日峰行動兩會支援小組」，早前在警隊內部籌得逾1,000萬元，該小組明言不會出錢協助七警打官司，以免被指涉及包攬訴訟。據悉，七警至今尚未向該小組要求提供協助。 免被指涉及包攬訴訟 警察員佐級協會主席陳祖光接受本報查詢時表示，日峰行動兩會支援小組拒絕資助七警打官司，除為免被指涉及包攬訴訟等違法行為外，另一原因是小組向警隊同袍籌得的1,000萬元，目的是向在佔中期間執勤的警務人員提供適切援助，「並非只為該七名夥計而籌款」。他估計除七警案外，現時最少尚有幾宗個案需要提供援助。但他強調，若七警提出其他求助，如生活經濟出現困難，小組會提供適切援助。 據悉，該小組成員早前曾與七警作非正式會面，向七警表明小組不會資助他們打官司的立場，「小組成員同佢哋講明，唔會出錢資助打官司，除咗包攬訴訟問題外，另一考慮係七個人合共嘅律師費會好龐大，小組籌得嘅1,000萬元根本唔夠畀，佢哋都明白小組嘅難處」。 ■記者謝明明"
20151020-5,20151020,5,出院五日　警署外施襲精神病漢　隨街斬人　警擎槍制服,出院五日　警署外施襲 精神病漢　隨街斬人　警擎槍制服 【本報訊】西區警署對開德輔道西昨晨發生隨機斬人事件，一名在青山醫院出院才5天的精神病男子，昨在覆診前夕疑突然病發，持刀在街頭見人就斬，一名男途人首先遇襲，手腕及腹部被刺輕傷；兇徒繼而追斬一名女途人，女事主身中三刀受傷倒地。大批警員在警署接報跑出包圍持刀漢，其間兩名警署警長拔槍喝令兇徒放下利刀，經一輪對峙後終將疑兇制服送院，行動中另有一名警員受輕傷。 記者：劉柏麟　簡明恩　李家傑　黎志偉 疑兇姓張（43歲），獨居於西環龍華街觀龍樓一單位。鄰居形容他平日見到街坊不打招呼，已有一段時間沒見他出現，最近才見他返回單位居住。 瑪麗醫院證實張自2010年9月起在西區精神科中心接受治療，情況穩定，一直有定期覆診，最近一次覆診為今年6月底。今年8月底，他被安排到青山醫院留醫，至上周三（14日）才出院，由西區精神科中心繼續跟進。個案經理上周五（16日）曾致電他了解情況，當時他的精神狀況穩定，原定今日（20日）覆診。 昨晨7時許，張神色有異，喃喃自語，在西區警署對開的德輔道西近西邊街徘徊，其間65歲的林伯剛飲完早茶由酒樓步出，他行經電車站時，赫見有人衝過來手持切肉刀刺向其腹部。林大驚用手把對方的利刀拍下，肚皮被輕微𠝹傷，另右手被割傷，他脫險後立即逃跑。 女途人遭追斬中三刀 兇徒之後撿回掉在路旁的切肉刀，再從身上亮出另一把利刀，持雙刀奔向對面馬路襲擊45歲的姓陳女途人。陳女邊走邊大呼救命，但被兇徒追上，她肩膊、腰部及手臂中三刀倒地。其他途人四散，有人直跑進西區警署報案室通知當值警員。途人甄先生形容事發時「聽見有人叫救命……見到有個女人俾人斬到流血，斬到佢對手流好多血」。 疑犯攤開雙手投降 10多名警員跑至距離警署約100米的德輔道西255號惠康超級市場外，發現持刀漢語無倫次，情緒激動。警員向他作出口頭警告，喝令他投降，但對方並未有理會。兩名警署警長於是拔出佩槍，大聲喝令疑兇「放低把刀」。雙方對峙逾一分鐘後，疑犯終攤開雙手，呈大字形投降。其他警員立即上前將按在地上制服，其間一名警員手部受輕傷。 事件中被刺三刀的女傷者被送院救治，情況穩定；首先遇襲的林伯送院包紮後無礙出院。疑兇面部受傷同送院被扣查。西區警署署理總督察趙智穎交代案情時表示，疑兇與兩名傷者並不認識。警方初步相信他是病發隨機傷人，並無特定目標。疑兇事後被轉送青山醫院接受進一步治療。 社會福利署則指張不是該署的個案，但他一直由非政府機構營辦的精神健康綜合社區中心跟進，中心人員有定期聯絡或探訪他提供支援，近月亦曾聯絡他。社署指精神健康綜合社區中心已接觸疑兇的家人，跟進其福利需要。
20151020-6,20151020,6,險遭插肚　習武男拍甩刀保命,險遭插肚　習武男拍甩刀保命 【本報訊】在西環街頭遇狂徒被斬輕傷的65歲林伯是附近水電舖老闆，當時他被兇徒用利刀直指肚皮，幸及時側身閃避，並打掉對方的利刀得以保命。他笑言自己「食過夜粥」，曾學習虎鶴雙形拳，但亦頻呼好彩，「如果拮入咗，我就唔會喺度同你（記者）講嘢！」 「疑犯雙眼好似發光」 林老闆指事發時他剛飲完早茶步出酒樓，平日他習慣飲茶後經西邊街返回開舖，但昨晨要買豬肉，所以改行德輔道西往豬肉檔。他指當時自己身處電車路的安全島，只見疑兇衝過來，「佢攞住把刀拮埋嚟」。他形容疑犯目露兇光，雙眼「好似發光咁」，他自然反應是「側一側身」避開，「佢斬向我個肚，我用手拍開佢把刀就走，之後見佢追住兩個女人」。 當時有兩名女子經過，隨即成為兇徒追斬目標。林稱兇徒「執番跌咗嗰把刀，用雙刀追斬女途人，他聽到有人嗌晒救命」。對於自己險被刺中腹部，林伯猶有餘悸對記者說：「如果拮入咗我就唔會喺度同你講嘢！」林伯事後在場協助警員調查，他引述有警員指他「好好彩」，着他要買六合彩。 不少街坊對有狂徒當街斬人均表害怕。梁小姐稱：「遇到咁嘅情況，肯定驚啦！」另一名黃女士則謂她過往在街頭也看到有疑似精神病人在大叫大嚷，「但冇理由唔落街嘛，都要買餸啦，惟有行街時加倍小心」。 ■記者劉柏麟
20151020-7,20151020,7,與逾10警馬路對峙,與逾10警馬路對峙 【本報訊】兩名警署警長雙手握着佩槍，指向手持一呎長切肉刀的狂漢，三人品字形站在西環德輔道西近西邊街的電車站前馬路中心，雙方相距不足兩米，旁邊10多名警員各人手按着槍袋，蓄勢待發。目擊這令人冷汗直冒一剎那的許小姐，當時正在行人路上等巴士準備上班，她舉起手機拍下一張獨家相片後，事情就解決了！ 許小姐表示，她見到持刀漢手持利刀站在馬路中，一名傷者坐在行人路上。兩名警署警長手握佩槍向對方喝令：「警察，放低把刀！」約一分鐘後，持刀漢終攤開雙手呈大字形示意投降，其他警員即撲前奪走手上利刀，再將他按在地上。 另一名目擊事件的保安員吳先生表示：「警員嗌咗成分鐘，佢先放低把刀！」在場其他人終可以抹一額汗！ ■記者簡明恩
20151020-8,20151020,8,夜歸遭訓斥　兒子利剪弒母,夜歸遭訓斥　兒子利剪弒母 【本報訊】沙田沙角邨昨凌晨發生倫常慘案，一名患有精神病的男子，疑不滿母親嘮叨他夜歸，突然發狂以剪刀向母親連插多刀，之後致電報警自首；救護員趕至將女傷者送院，惟終告不治。涉嫌弒母男子被捕帶署，警方列作兇殺案交由重案組接手調查。 女死者余寶宋（67歲），與被捕的39歲姓施幼子同住沙角邨綠鷺樓18樓一單位。余婦育有三名兒子，長子及次子已婚搬出。疑犯身高1.74米，身材魁梧，右手臂有骷髏頭紋身。據稱，施10年前患上思覺失調要入院治理，約5年前出院。他經歷兩段婚姻，俱離婚收場，育有兩名子女均隨前妻生活。他與母親俱無工作，靠綜援過活；上址單位並無房間，近大門邊放有一張碌架床，余婦睡下格，兒子則睡上格。 報警自首　表現冷靜 昨凌晨2時許，施從外回家，大力開關鐵閘聲響驚醒鄰居，有人開門查看，見施又「砰」一聲將大門關上。其間余婦亦被吵醒，並出言責罵兒子夜歸。施疑因不滿母親嘮叨，母子為此激烈爭吵。約一小時後，施突然走入廚房取來剪刀走近母親床邊，向母親連插多刀，余婦胸口、背及頸部分別中刀，有鄰居聽到她五、六聲慘叫後即致電管理處求助。 事發後，施致電999報案中心聲稱以剪刀刺傷母親，警員到場拍門時，施開門表現冷靜，警員入屋後發現余婦倒卧床上血泊中，立即召救護車將余婦送院搶救，證實死亡。警方調查後拘捕帶署。 沙田警區署理助理指揮官（刑事）黃志明表示，警方在廚房撿獲一把18厘米長的染血剪刀。警方指疑犯有精神病紀錄，今年1月及5月，分別因為要求母親買東西及企圖自殺曾報警求助，俱與暴力無關。至昨下午1時許，探員在兇案單位撿走多袋證物，包括床褥及枕頭等，現場解封後，余婦的次子和其他親友返回單位，並在碌架床邊跪地拜祭。 社署表示，涉案男子一直由非政府機構營辦的精神健康綜合社區中心跟進，工作員有定期聯絡或探訪個案提供支援，近月曾作家訪。 ■記者周鴻熙、唐家輝、張培生
20151020-9,20151020,9,社區復康跟進人手嚴重不足,社區復康跟進人手嚴重不足 【本報訊】西環及沙田昨日在4小時內，先後發生精神病人涉嫌隨街斬人及弒母慘劇，令人關注精神病人的社區復康問題。醫管局今年初資料顯示，公立醫院精神病人已突破20萬。政府約4年前起，為跟進精神病康復者重投社區而推出個案經理計劃，由社工或復康護士擔任，跟進病情嚴重者，惟人手比例較外國少逾一半。 避免正面衝突理論 關注病人權益的社區協會組織幹事彭鴻昌表示，醫管局轄下七個聯網推行的個案經理計劃，人手比例為1對50至60名康復者，外國則為1對20至30，資源嚴重不足，「個案經理跟康復者半年至一年就會完結，交番落社區綜合復康中心跟進」，他促請當局增人手，延長個案經理跟進康復者的時間，同時可檢討增加照顧者的支援服務。 中大精神科學系教授李誠（圖）表示，精神病人出現暴力行為，大多數在家居發生，如患者病發隨街斬人，可能受幻聽及被迫害妄想影響，市民如發現有人在街上手持武器，應立即離開，切勿與對方理論或嘗試制止。李稱，精神病人的母親是受傷害的高危對象，因大部份患者都是由母親長期照顧；照顧者可留意病人有否出現失眠，性格變得更加孤僻、脾氣暴躁，甚至懷疑母親所煮的飯菜有毒，又或偷偷收藏武器，應主動求助，醫護人員會判斷高風險復發個案，可安排精神科社康醫療團隊上門評估及提供治療。 精神科專科醫生丁錫全稱，精神病人的精神相對敏感，親友應避免與他們正面衝突、避免歧視和有刺激性的言語，盡量以勸喻的方式，如說夜歸會讓家人擔心。如發現患者的狀況一發不可收拾，應報警求助。 ■記者鄧秋英
20151020-10,20151020,10,揑胸麻醉科名醫脫罪　醫委會：摸乳房屬恰當　摸乳頭「唔知佢有冇做過」,揑胸麻醉科名醫脫罪　 醫委會：摸乳房屬恰當　摸乳頭「唔知佢有冇做過」 【本報訊】資深麻醉科名醫張啟旋被指以測試麻醉感覺為名，涉嫌揑摸兩名產婦的乳房及乳頭案件，醫委會昨裁定8項專業失德罪名全部不成立。醫委會主席劉允怡解釋，根據專家供詞及文獻支持，認同揑摸乳房為其中一個測試麻醉反應方法；但張是否曾觸碰病人乳頭，結論是「唔知佢有冇做過」，只因護士證供前後有出入，疑點利益歸於被告，始裁定無罪。 記者：嚴敏慧 案情指張於2012年2月，分別向半身麻醉及剛剖腹生產的兩名女病人，在手術室內進行麻醉感官測試，不適當揑摸其中一名病人的左胸及左乳頭，又揑摸另一病人的左乳，事後分別被兩名護士投訴及揭發事件，聖保祿醫院調查後轉介醫委會投訴。案件自5月起先後進行6次聆訊，昨日裁定，8項包括不適當揑摸病人乳房及乳頭、無適當為麻醉測試作記錄等指控，全部不成立。 護士供詞有出入 判詞中提及，委員會認同辯方專家證人醫生Russell指，在剖腹後進行麻醉測試為必要之說法；至於張自稱用手揑摸乳房作測試為其慣常做法，由於Russell醫生指不少英國麻醉科醫生仍採用，而文獻亦有記載此測試方法，加上有40年本港婦產科經驗的馮醫生供稱，有其他合作過的醫生用同類手法測試，認同是恰當的醫療程序。 醫委會主席劉允怡聆訊結束後解釋，雖然用手檢查「少人做」，且大多年長醫生才進行，「但唔可以話佢個方法唔啱」。至於有指以手指揑摸胸部為本港社會不被接受，委員會認為醫生很多時候在檢查時有需要觸碰胸部，如將聽診器放在胸腔上便可能有接觸，故認為揑摸胸部在有需要及已知會病人下，為合適的做法。 劉表示，控罪中最大爭議及花最多時間討論，為被告醫生曾否觸摸病人乳頭。他指，在醫生否認曾觸摸病人乳頭下，指控醫生的只有一名護士及相關醫院內部調查會議紀錄，惟護士供詞前後有出入，如其繪畫醫生觸碰病人位置圖，作供時畫的與當初向上司撰寫的報告不一，而她描述醫生進行檢查步驟有錯，委員會認為她記憶出錯，亦可能過於震驚下以為醫生有摸乳頭。至於醫院的調查亦存在不少問題，如相關會議紀錄有錯漏，令證據不可信。 劉引述醫委會的結論說：「唔知佢（張啟旋）有冇做過（揑摸乳頭）。」只是控方的舉證不足以定罪；又稱「以正常人去睇，有幾大可能個醫生預備非禮病人，會叫埋你喺度睇？」疑點利益歸於被告下，最後一致認為相關專業失德罪名不成立。
20151020-11,20151020,11,團體斥忽視病人感受,團體斥忽視病人感受 【本報訊】關注病人權益的社區組織協會幹事彭鴻昌表示，今次裁決罪名雖不成立，但案件已引起各界關注，因為醫生所使用的測試方法實為敏感。他指醫生做法專業上沒有失德，但社會是否能接受、病人是否覺得被尊重，為另一回事。 彭指醫委會的裁決純粹從專業角度去看，但醫生並非只活在專業世界，平常要與病人溝通接觸，亦要在社會道德風氣規範下執業，故裁決有需要顧及社會觀感及病人感受。大眾對判決感譁然，認為醫委會醫醫相衞，實有需要改革醫委會才能扭轉觀感。 而立會議員張宇人擬提出私人條例草案，將醫委會內的非業界委員人數由現時的4人增至8人，醫委會主席劉允怡支持有關草案，認為是好事，因現時醫委會內僅4名非業界委員並不足夠，過去醫委會亦多次向政府要求增加委員數目均無回應。 至於醫生陳以誠涉治療一名男童時有疏忽，高院要求醫委會重新成立初步偵訊委員會處理，劉指已就初級偵訊委員物色人選，並將有關案件資料交予對方，正等候回覆。 ■記者鍾雅宜
20151020-12,20151020,12,聞判後豎拇指露笑容,聞判後豎拇指露笑容 【本報訊】麻醉科名醫張啟旋被醫委會裁定8項專業失德控罪全部不成立，案件主角張啟旋昨日出席醫委會聆訊時神情嚴肅，不時眉頭深鎖，尤其取裁決時更時而以手托腮，時以閉目細心聆聽。 張啟旋至宣判後則似放下心頭大石，與其代表律師交頭接耳，更一度向律師微微豎起拇指讚好，重現笑容。不過張啟旋離開時則顯得木無表情，拒絕回應傳媒提問，其代表律師則指張啟旋不適合作任何回應。 曾上訴脫非禮罪 根據資料，張啟旋於1981年註冊做醫生，1998年獲麻醉專業資格，他2000年曾被控非禮，控罪指他1995年起非禮5名日籍孕婦，其中他替一名事主檢查時，掰開其私處並揑弄其乳頭，結果罪成被判囚半年。 當時案件主管韋茂林披露案件曝光後有10名受害人聯絡警方，揭發最早事發日期追溯至1992年。張於2001年就案件上訴，以裁判官在認人證供上犯了無法挽救的錯誤為由，成功推翻原判，張終無罪釋放。 ■記者鍾雅宜
