key,date,article_daily_id,title,text
20170922-171,20170922,171,老樓周記：新房策明益發展商 - 劉兆昌,老樓周記：新房策明益發展商 - 劉兆昌 特首林鄭月娥暫見到三個房策措施雛形，包括首置上車盤、社會房屋共享計劃及貨櫃組合屋作過渡性房屋，三組協助上車及有需要人士入住。這些地皮及物業皆來自私人發展商，難怪被城中評價林鄭向商界送秋波，用半價補地價來換取他們手上可用的地塊。 老樓奉行自由經濟，但回歸後四代特首，皆用人為因素來推行政策以助私政，董建華的「八萬五房屋政策」、曾蔭權停賣居屋賣地、梁振英管理需求辣招等等，皆令樓市由一個極端走去另一個極端，過去20年由天堂跌落地獄，繼而再破頂，堪如坐過山車，令舊一代被嚇怕了，但一批新富豪從此誕生。反映了不適當時候作出不正確的政策。這些純人為因素令樓市被扭曲，如今全球傾向收水減少買債之時，若然大量增加房屋供應令市民被勉強上車，隨時成為下一代砲灰。 林鄭月娥今年獲得777票當選特首，部份來自商界及發展商，如今實施三項政策，把以前違法的劏房和組合屋變成人為合法，而且土地來源是來自發展商，難免被人批評還發展商人情，讓發展商可以約市值一半地價來興建官私混合房屋，除笨有精，一來可提升原本不值錢的農地價值，即時變成增值的物業，同時政府處理周邊配套，何樂而不為！ 自由經濟原則為「大市場小政府」，過去20年特區政府變相改行大政府角色，令到既有的原則來個大倒轉，看來香港樓市碰上全球收水，離大跌市不遠了！ 劉兆昌 資深地產傳媒人  http://www.HKLau.com  本欄逢周五刊出
20170922-172,20170922,172,投資學堂：單日轉向訊號可靠 - 譚紹興,"投資學堂：單日轉向訊號可靠 - 譚紹興 筆者一向頗留意港股單日轉向上升型態，若出現大都會趁機買貨，即早段股市原本正持續下跌，但突然止跌回穩，最後以上升或輕微下跌收市。上周五，因肥仔金再次發射導彈，港股早段急跌260多點，但在午後卻神奇地止跌回升，更以上升30點收市，呈現單日轉向走勢！ 印象最深刻的單日轉向，當然是10年前8月17日的大奇蹟日，仍記得當日恒指一度急跌1,200多點，但在2時半後突然由低位急速反彈達1,000點，最後只以下跌200多點收市！仍記得該日當恒指反彈，重上20000點時，筆者即時掃入當時認為最安全的股份工行（1398）及建行（939），跟着致電好友Christine入貨，該役最後獲利頗豐！ 單日轉向上升型態，乃一個短期反彈的訊號，但並非每次都有效，根據筆者的研究，若該日下跌及反彈的波幅越大，再有成交配合，例如1,000億元的交投，則可信性更高，尤其是隨後引發的上升幅度及時間亦相對較長。 單日轉向上升型態用於大市的效果不俗，但對個別股份的效用則平平，反而單日轉向下跌型態對個股更具下調威力，尤其是在52周高位出現，乃短期沽貨、快閃訊號，例如高偉電子（1415）在本月5日一度急升12%，高見5.78元，惟高位難以支撐，最後只以微升0.01元收市，而該日的到頂型態威力頗大，至今尚未止跌。近日炒風正擴散至3、4線股，而這型態正好用以短炒的獲利訊號！ 譚紹興 財經評論員 mailto:ricky@rickytam.com 本欄逢周五刊出"
20170922-173,20170922,173,廣告經綸：品牌優越鬼也不怕 - 文廸晞,廣告經綸：品牌優越鬼也不怕 - 文廸晞 本周廣告行的大事件，無疑是奇華廣告的陰魂凶兆、彼岸花、油紙遮、放紙船唔老黎、曾志偉高過劉心悠出了事。同場加映機管局的藍白燈籠，大吉利是。 世間多少事，不是黑就是白。我自己做廣告，很難以廣告人的眼光話自己不偏不倚，倒不如轉個角度看看這件「奇」事。其實，問題不止廣告設計：重要的不是陳雲先生引的經、據的典，他是一個KOL，有強大的Fan base，他的影響力，絕對不容輕視；廣告創作人，出發點也沒有錯，相信絕不可能想倒自己米、玩客戶、玩香港人，但自有更妥善及改進的空間；管理奇華fb的團隊，有初步應變能力，還是欠缺實戰經驗；香港市民大眾，如何反應，當然有各人的自由。 對於奇華，一個廣為港人孰悉的本地品牌，理應一直存在一分特別的感情。何以一個廣告會突然令一個80年老字號變成眾矢之的？今次被人挑出來放大成為詛咒香港，未必與2015年的「暴動」告示所種下的一丁點誘因無關。試想想，海洋公園上周末就有人於哈囉喂遊戲中不幸逝世，除了死者家人及朋友痛心外，客戶、廣告及公關公司一定好頭痕。事隔幾日，單新聞及負皮開始漸漸減弱，你話是由於海洋公園有甚麼善後工作做得特別好嗎？不是啦，奇華及海洋公園都是本地品牌，分別是海洋公園於大多數香港人心中都建立了一分較深厚的感情，也可能有着一些童年回憶，所以，和它的感情連繫比較多一點，就算近年多了大陸遊客令香港人對它的喜愛度有減無增，但仍然是有一些揸拿，不是那麼容易話鬧就鬧，話踩就踩。 一個可以令消費者喜愛的品牌，不是一朝一夕可以建立，同樣，也不是一朝一夕就會輕易被摧毀。發生今次奇華事件，奇華團隊也是時候反思有甚麼辦法可以把香港人對於奇華的感情及品牌價值變得更鞏固，一旦出了錯，也令人更易看得開，甚或隨便替你找個藉口，看成無心之失就原諒了便是。 文廸晞 mailto:heyadmen@gmail.com 本欄逢周五刊出
20170922-174,20170922,174,財經評論：北威州GDP冠德國,"財經評論：北威州GDP冠德國 第一次去德國，抵達法蘭克福機場，坐兩小時火車到西部的杜塞爾多夫做訪問。德國除了柏林、法蘭克福兩個政治、經濟中心外，實際上杜塞爾多夫所處的北萊茵──威斯特法倫州（簡稱北威州，North Rhine-Westphalia），亦為德國經濟最發達的地區之一。  北威州人口約1,768萬，面積3.4萬平方公里，為德國人口密度最高的州份。該區的國內生產總值（GDP）在各州更排名首位，去年達6,697億歐元，遠超柏林和漢堡。 由於歷史緣由，州內魯爾區曾為德國重要工業區，歷經30年變遷，由煤、鋼工業轉向現代化工業、科研和服務性經濟，目前主要產業為機械製造、汽車、化工、能源，新興的新媒體、生物、醫療、物流等亦於歐盟具相當競爭力。 杜塞爾多夫作為北威州首府，消費水平不低。中國駐當地總領事館數據顯示，杜塞爾多夫向外計方圓500公里範圍，約有1.5億人口，已擁有歐盟45%的購買力。 北威州吸引德國不少重要企業進駐，例如德國電信、電力公司E.ON、媒體集團貝塔斯曼、服裝品牌思捷環球（330）等，首府杜塞爾多夫更聚集數百間廣告公司，並舉行一系列會議展覽，包括今年的以數碼經濟為題的G20部長級會議。當地小企業發展同樣蓬勃，除初創企業、酒店搜尋引擎trivago以杜塞爾多夫為總部外，全州共76.5萬家中小企業，佔企業總數逾9成，經濟發展更均衡。 記者：卓茗"
20170922-175,20170922,175,知己知彼：樓市唔跌要偷笑 - 風吹知,"知己知彼：樓市唔跌要偷笑 - 風吹知 美聯儲宣佈在10月開始縮表，不少專家都表示對本港樓市影響輕微。由於縮表將歷時數年，即時影響會比加息較不明顯，市場流動資金仍然充裕，但影響將慢慢顯現。時下股市暢旺，經濟增長速度可持續，政府將全年經濟增長預測上調到3%至4%，樓市暫時沒有下跌的誘因。 即將開賣的將軍澳日出康城晉海近日開放示範單位，由準買家反應來看，樓市仍未見轉勢，就算樓價依然居高不下，仍不乏入市的勇者，而只要發展商開價平少少，積存的購買力就會湧現，為樓價提供承托力。 新地（016）的晉海平均呎價近1.28萬，以將軍澳鄰近堆填區的樓而言，無疑是貴的，貴絕日出康城，反映發展商對銷情的信心。為何如此自信，皆因早前荃灣西全‧城匯為樓市打了支強心針。華懋想試水溫，全‧城匯貴為荃灣西站上蓋物業，部份有海景，首批平均折實呎價只需約1.4萬元，平過海之戀一成，算是近期筍盤，即成為今年票王。不過雖然晉海呎價不算平，但入場費低，最平的單位500萬樓下有交易，正合上車人士胃口，首日暫收1,000票，超額逾3.8倍，成績理想。 正如我早前講過，現時樓市仍不會大跌，大量積存購買力仍未消化，而且股市節節上升，在財富效應底下，樓市會在高位橫行。不過以現時股市的走勢，牛軍又怎會放過攻頂的機會，28588點不遠矣，而一旦破頂成為，將可再創高峯，所以樓市暫時難跌。但說到樓市要進入另一個大時代？是在平行時空嗎？ 風吹知"
20170922-176,20170922,176,專家論勢：美債孳息線大幅拉平 - 潘國光,專家論勢：美債孳息線大幅拉平 - 潘國光 美聯儲前晚議息後，維持今年12月加息1次的中位數預測，2018、2019及2020則分別預測加息3次、2.25次、及0.75次，較長線的目標利率則預計會達到2.75%。央行維持明年加息3次的預測，並預測2019及2020合共加息3次（上次是預測2019會加息3次），較長線的目標利率亦較上次預測低了25點子。 由於此前市場有接近一半人認為今年12月不一定會加息，因此議息結果對他們來說是偏向鷹派。筆者則認為，央行正逐步（及緩步地）向下修訂對長線利率的看法，為可能要提早完結加息周期作兩手準備，估計2019及2020年的加息預測次數在未來一年間將有需要不斷地向下修正，惟市場現時大概只會專注於今年12月的議息決定如何。 聯儲局同時宣佈自10月起縮表，內容與此前放風的大致一樣，並沒有具體說明最終的縮減目標。議息後，美債短息上升，三十年期則先升後跌，三十年與五年期之間的息差於周三晚出現自2016年12月以來的最大幅收窄，暗示債券市場對聯儲局的加息及縮表意圖投下了「不信任」一票。 市場對央行的不信任至少有兩方面： （1）縮表及加息除了是為了政策「正常化」之外，另一目的是要使孳息線稍為傾斜，製造復蘇及通脹回升的印象；但美債孳息線過去近兩年持續拉平，反映市場認為在經濟及通脹回升乏力的情況下，央行有過度收緊政策的風險； （2）聯儲局自去年12月以來三度加息後，股市及債市持續造好、信貸息差收窄、美滙下跌，上述四種情況均導致金融狀況變得更寬鬆，間接增加了資產泡沫風險的形成。 在這情況下，央行不可以過度收緊政策，因為實體經濟復蘇乏力；但另方面央行不敢不收緊政策，因為金融泡沫風險愈益膨脹。且看未來一兩年間，實體經濟與金融市場哪一方面的發展會較先逼使央行最終要把「政策正常化」這項史無前例的實驗剎停。 潘國光 富邦銀行（香港）第一副總裁兼投資策略及研究部主管
20170922-177,20170922,177,基金觀點：經濟穩盈利俏　續看好中資股,基金觀點：經濟穩盈利俏　續看好中資股 儘管環球股市近日因政治風險及貨幣政策的憂慮出現回調，但環球經濟持續轉強，加上次季主要地區的企業盈利增長理想，將繼續為股市帶來支持，預期未來12個月，環球經濟的利好表現可抵銷政治風險的負面因素，當中特別看好中國股市前景。 亞洲股票基金連續兩個月出現走資，涉資37億美元，其中大部份從印度及南韓流出，與環球股市走弱的趨勢一致，惟年初至今亞洲仍吸資225億美元。我們預期，若美股在10月初債務上限到期前更趨波動，資金將進一步從亞洲及新興市場流走，惟有關情況僅屬短暫，因新興市場基本因素仍然強韌。 美元走勢與股市呈反向關係，當環球經濟持續擴張時，美元一般呈現弱勢。由於美國政府有意提高國內生產總值及削減外部赤字，故美元重現強勢並不符合目前的政策取向，相信政府應會歡迎美元扭轉過去5年半升值21%的趨勢。 以聯儲局為首的環球央行逐步退出量化寬鬆計劃，部份投資者憂慮會因此拖累全球經濟及投資市場。不過，我們認為聯儲局以非常緩慢的步伐加息，加上淨息差逐步擴大，美國銀行業的中期前景可望改善。 現時仍有不少人擔心中國經濟前景，但實際上中國經濟增速大幅放慢的風險偏低，8月份經濟數據明顯反彈，反映經濟短線前景亮麗，因此我們繼續看好中國股市，在亞洲股票投資組合中給予「增持」評級。 內地房地產商今年來積極投地以補充土地儲備，同時三線城市的住宅儲備已跌至偏低水平，均顯示樓市不存在崩塌情況。雖然我們較偏好「新中國」行業，但「舊中國」行業在行業重組及併購下，仍具投資價值。舉例說，內地去年經濟回穩，足以提升銀行業盈利，或能改變內銀股長期不獲外資青睞的觀念。 自A股於2015年年中急跌，外資便對中資股予較高的風險溢價，同時中國股票佔新興市場基金的比重自2016年起便沒有增加，這可能與外資擔心內地經濟硬着陸的風險有關。但隨着中國經濟回穩，我們對中資股前景仍然樂觀。 羅卓夫 宏利資產管理亞洲區資本市場高級策略師
20170922-178,20170922,178,港遭標普降級機會大,港遭標普降級機會大 【本報訊】近年中港經濟融合，兩地評級亦互為關連，今年5月穆迪調低中國主權評級後，當晚即再下調香港評級，由「Aa1」下降1級（one notch）至「Aa2」，前景展望由負面轉為穩定，今次標普暫時只宣佈調低中國評級，未涉香港，但分析指本港評級被降仍存很大風險。   被問及會否下調本港評級，標普發言人回覆本報表示不予置評。今年8月，標普確認香港評級維持在「AAA」，展望負面，報告當時指，此負面展望是反映香港背後的中國政府評級，香港的獨立性和效率若不見增強，標普指很可能會在降低中國評級後，將香港下降一級。 渣打香港中國宏觀策略師劉潔認為，各評級機構在考量本港評級時，都會加入中國支持因素及其影響，隨着中港經濟連繫日趨緊密，標普若因內地信貸強勁，所產生的金融及經濟風險而降低中國評級，有關影響亦會延伸至香港，「spillover effect（溢出效應）會好高」，故本港評級被降的風險仍然很大。 惠譽於7月確認中國主權評級為「A+」及展望穩定後，到9月再確認本港評級為「AA+」及展望穩定。
20170922-179,20170922,179,中環在線：一田一姐好hard sell - 李華華,中環在線：一田一姐好hard sell - 李華華 唔夠兩個禮拜就到中秋，一田CEO黃思麗（Susanna）噚日又忍唔住推介各種中秋禮品畀傳媒，十足十個top sales咁。查實每次Susanna出嚟，佢都做足功課，將宣傳單張上嘅大部份產品同價錢都記得好足，但原來咁好記性，都有原因嘅。 Susanna話自己係購物狂，又特別鍾意喺一田買嘢（果然係top sales），試過去日本公幹時，帶一個喼去都買到爆晒，仲要問人借多兩個袋同pack箱先返到香港。至於一田產品，佢就話差不多每日都會去行吓，順便當巡吓舖咁，但就話已經唔想諗每個月份糧有幾多用咗喺一田度喇。 另外，佢噚日推介咗盒熊本熊月餅畀傳媒，佢專程去日本向熊本縣部長sell，解釋畀佢知乜嘢係中秋節、點解中秋要食月餅、對中國人來講有幾重要等，幾經辛苦，最後熊本縣部長先批准佢地聯同鴻星一齊做。 李華華
20170922-180,20170922,180,一田料元朗店三年內賺錢,"一田料元朗店三年內賺錢 【本報訊】一田下月5日將於元朗開設第十間分店，百貨行政總裁黃思麗昨表示，該店投資額為3,900萬元，料三年內將錄盈利，店面面積為2.1萬呎，主打超市。今年一田共開設3間新店，黃思麗坦言，今年利潤或會較去年低，但強調生意額會有所上升。她又指，明年初除了在葵芳開設新店外，亦會最多有兩間新店開幕，另會在現有百貨店注入新元素。 超市生意料受惠黃金周 臨近中秋節，黃思麗提到，一田在中秋前夕的活動首兩天銷情理想，9間分店平均生意額按年升18%，當中旺角及荃灣分店更分別升24%及升16%。她又指，今年黃金周連接中秋節合共有8日假期，受長假期影響，料超市整體生意額會升10%，百貨因受整體市況疲弱，加上沙田分店裝修影響，期望會錄得輕微上升。 黃思麗表示，今年一田超市首八個月生意額按年升5%，而百貨店則由於沙田分店裝修，加上近兩個月受颱風影響，損失兩日生意，故百貨店生意與去年相若。她認為，本港零售未見「V型反彈」，加上在網購及外遊增加的威脅下，一田需要不斷加入新元素及噱頭。"
20170922-181,20170922,181,中環在線：羅康瑞病了 - 李華華,中環在線：羅康瑞病了 - 李華華 貿發局年年都揼本飛去外地為香港招商，貿發局主席羅康瑞亦一直身體力行撐場，但今年英國之行就少咗呢位上海姑爺身影，原來佢病咗，醫生叮囑唔可以舟車勞頓，香港直飛英國成12粒鐘，所以佢就冇隨團啦。希望羅康瑞早日康復啦，否則就擔心死朱玲玲了。 李華華
20170922-182,20170922,182,百度旗下基金籌百億拓無人駕駛,百度旗下基金籌百億拓無人駕駛 【本報訊】繼Tesla積極研發無人駕駛技術，內地科網企業亦都急起直追。百度早前夥拍湖北省政府為背景的長江產業基金，成立專門投資無人駕駛的阿波羅基金，昨日公佈計劃籌集100億元（人民幣．下同），於未來三年投資無人駕駛項目。 彭博引述百度副總裁鄔學斌指出，現時已獲得第一期20億元資金，並完成數個投資項目，希望投資超過100個自動駕駛項目。百度於4月宣佈成立阿波羅自動駕駛開放平台，旨在提供一個「開放、完整、安全」的軟件平台，協助汽車製造商結合車輛和硬件系統，搭建屬於自己的自動駕駛系統。 冀2019年推量產車型 目前，阿波羅平台合作夥伴達70多個，包括多間汽車製造商、零件供應商以及初創科技企業。百度已落實汽車製造計劃，擬與江淮汽車合作，目標為2019年下半年推出自動駕駛量產車型。 百度表示，將為江淮汽車提供旗下高精地圖、自定位、環境感知、決策規劃等關鍵設置的綜合解決方案，屆時若順利通過驗收後，即可大規模量產。阿波羅發展藍圖為，2020年在高速公路、普通城市路況下實現自動駕駛。
20170922-183,20170922,183,滙兌虧損減　玖紙多賺3倍,"滙兌虧損減　玖紙多賺3倍 【本報訊】玖龍紙業（2689）昨日公佈，全年銷售額按年升22%至391.5億元（人民幣．下同），略遜於市場預期的397億元。惟受惠期內經營及融資活動的滙兌虧損（扣除稅項）減少76.3%，純利按年增加2.9倍至43.83億元，每股盈利93.87分，派末期息29.6港仙，派息率為32%。 該股股價在過去三個月，已經累升超過六成，並曾在本月中高見16.8港元，昨日收報15.9港元，跌1.6%。 截至今年6月底止，玖紙毛利潤增加36.1%至79.8億元，毛利率亦增加2.1個百分點至20.4%，主要由於產品售價上升所致。集團提到，雖然主要成本，包括廢紙及煤炭的價格於期內出現波動，但因控制成本得宜及利用市場數據資料，令年內盈利仍然錄得上升。 集團提到，越南基地三號紙機亦已於今年8月投產，預計該新紙機年產能將達35萬噸（卡紙），令集團總設計年產能超過1,400萬噸；至於內地市場方面，集團已共有4個新紙機計劃，設計年產能介乎35萬噸至60萬噸不等。另去年度集團並無投放任何新紙機，總設計年產能維持在1,370萬噸。"
20170922-184,20170922,184,輪輪相扣：趁低部署中移動好倉,"輪輪相扣：趁低部署中移動好倉 中移動（941）昨日股價再次回落，全日表現向下，尾段更一度跌穿近過去三年的長期支持位80元，收市報80.15元，跌0.68%。近日中移動公佈8月份數據，淨上戶達387萬戶，較本年7月的335.1萬戶加快。 近日國家工信部亦公佈8月份數據，內地電信業務總量完成按年增長77.8%達2,375億元人民幣，電信業務收入完成達1,077億元人民幣，按年增長5.8%，較上月低1.9個百分點。近日有券商發表報告，預期中資電訊行業整體增長前景穩固，該行將中移動列入行業首選。 觀察近日個股認股證資金流向，截至本周三的5個交易日計，錄得近500萬元資金流入。 中移動今年表現大幅落後大市，累計跌幅約2.5%，昨日更曾跌穿80元關口。進一步觀察中移動近期表現，可見其股價已整固一段時間。就上述因素，投資者如看好及或計劃以短線部署股價反彈，追回與大市表現的部份差距，宜留意較貼價的產品，不應將目標行使價定得太高。 投資者可留意價外幅度約5%，今年11月到期的短期價外證，該類產品所提供的實際槓桿普遍超過20倍，然而此類條款的產品，當中的街貨量各有不同，投資者宜多加留意。投資者可留意中移購16738，行使價83.555元，2017年11月27日到期，實際槓桿25.2倍，為類近條款產品之中槓桿較高及街貨較低的選擇。 註: 以上數據資料來自高盛認股證牛熊證網站 由高盛（亞洲）有限責任公司發出。c版權所有2017年，高盛（亞洲）有限責任公司。一切權利已被保留。以上資料僅供參考，並不構成對任何投資買賣的要約、招攬或邀請、誘使、申述、建議或推薦。投資前閣下應理解產品特性及風險，考慮該投資是否適合閣下的個別情況，並向有關的專業顧問查詢。認股證及牛熊證乃複雜之產品，除相關資產之價格及其變動外，還有其他因素影響認股證價格。本產品並無抵押品，投資者所依賴的是發行人及擔保人的信譽。如發行人或擔保人無力償債或違約，投資者可能無法收回部份或全部應收款項。認股證及牛熊證的價值可急升亦可急跌，持有人的投資可能會蒙受全盤損失。牛熊證更備強制贖回機制而可能被提早終止，屆時（i）N類牛熊證投資者將不獲發任何金額；而（ii）R類牛熊證之剩餘價值可能為零。過往表現並不預示未來表現。在某些情況下，高盛的流通量提供者可能是港交所上唯一為高盛認股證及高盛牛熊證提供買賣報價者。閣下應詳細閱讀載有認股證及牛熊證條款及風險披露的有關上市文件。有關上市文件可於此網頁下載:  http://www.gswarrants.com.hk "
