key,date,article_daily_id,title,text
20170922-0,20170922,0,圍堵校委會案　與李峰琦判社服令馮敬恩：為世界美好不只是學生責任,圍堵校委會案　與李峰琦判社服令 馮敬恩：為世界美好不只是學生責任 【本報訊】去年1月26日港大生在沙宣道圍堵校委會成員要求對話，時任學生會會長馮敬恩因高叫「唔好畀李國章走！隊冧佢！」被裁定擾亂秩序罪成；時任副會長李峰琦被裁定阻礙救護員罪成。案件昨判刑，兩人稱全盤承認所作所為，深切反省及悔疚，裁判官接納二人有真誠悔意，毋須判阻嚇性刑罰，分別判馮和李接受240和200小時社會服務令。裁判官勸勉稱人若太自以為是便會喪失理智，用暴力強行要求別人接受意見，籲二人謹記社會對大學生有期望，別辜負大學和關心他們的人。 記者：勞東來　歐陽聯發 馮敬恩（23歲）和李峰琦（21歲）昨結上港大校呔抵達西九龍法院聽取判刑，離開時表示不評論案件。馮上庭前在網上發表感言，引用電影《哪一天我們會飛》主題曲歌詞，稱冀「為世界美好多一點，付出所有」，又指這是每一個人的責任，不應只是學生的責任。 律政司則表示，會研究裁判官判刑理據和主控官的報告，再決定是否需要跟進。 李國章稱接受判決 案中主角校委會主席李國章庭上作供時曾質疑馮敬恩人格有問題，他昨接受電視訪問回應判決：「呢方面我係冇意見嘅，件事發生咗，佢犯咗法、佢認咗罪，個官判咗佢，咁我係接受，我哋係尊重我哋法治精神」。港大發言人稱尊重法庭決定。 裁判官高偉雄早前索取被告背景及社服令報告。代表兩人的資深大律師李柱銘昨指報告非常正面，感化官建議判社服令，法庭沒理由拒絕，並呈上近30封求情信，由馮本人、現任或前任港大校委、校友、教授、歷屆學生會幹事等撰寫。撰信者包括同被圍堵的校長馬斐森和遭李峰琦阻延救援的紀文鳳，但沒李國章。 報告指馮努力不倦，馮稱案發時一心想與李國章對話，對衝動和愚蠢行為十分後悔，事與願違地傷害他最愛的大學，現覺得應使用激進和暴力以外的方法，會避免重犯及甘願受罰。高官問李柱銘兩被告不認罪，現時對罪行有何取態，李回答二人現全盤承認罪行，亦不會上訴。 李峰琦報告則指他承認鹵莽犯法，沒考慮法律後果，但他沒意圖傷害人，現深感悔疚並對守法有深刻反思。李柱銘引用英國文豪莎士比亞劇作《威尼斯商人》對白，懇請法庭對兩人施予慈悲，「它（慈悲）不但賜福給施予的人，也賜福給接受的人」。 高官宣判時強調集會示威自由非毫無限制，兩被告身為學生會骨幹應以身作則，惜他們不但沒阻止包圍校委的差劣行為，甚至主動參與，令大學蒙羞之餘亦使公眾對大學生有負面看法。 官接納有真誠悔意 但裁判官表示接納二人沒預謀犯案、毫無保留地承認罪責及致歉，李還承諾專注學業不再參加示威，反映有真誠悔意。 案情方面，高官指馮大叫「隊冧佢」，字面上很嚴重及極具攻擊性，但觀乎前文後理認為馮不是希望群眾傷害李國章，只是要求示威者阻止李離開。馮大叫後雖有人輕微拉扯李，但沒人行使暴力，沒構成身體或心理傷害，也沒證據顯示有職員及保安受傷。至於李峰琦阻礙救護服務，也沒證據顯示紀文鳳因而蒙受傷害。高官指案情不乏加刑因素，但毋須判阻嚇性刑罰。 鑑於二人沒案底、獲家人支持、有真誠悔意，罪成後曾被短暫收柙等，高官接納建議判處社服令，不少旁聽市民聞判後鼓掌。宣判後高官勸勉被告指，明白青年有熱誠和抱負，但一旦認定自己相信的是真理，便會忽略其他人有權持不同意見。高官續指，大學生身份不是光環而是緊箍咒，一言一行都受社會關注，若他們犯法，即使理據再多、信念再正確，所有人都只會聚焦犯法行為，寄語二人日後宣揚守法意識，不要辜負願為他們奔波、擔心及寫求情信的人，以及他們聲稱熱愛的大學。 案件編號：ESCC2357、ESS27186/16
20170922-1,20170922,1,官稱參考雙學三子、東北案例,官稱參考雙學三子、東北案例 【本報訊】早前雙學三子及反東北發展案，遭律政司覆核刑期而被上訴庭改判入獄。裁判官高偉雄昨提及已閱讀兩宗覆核案例，認為若案情嚴重及需收阻嚇作用，即使感化官建議社服令，也要判監。惟李柱銘反駁，上訴庭判詞不應追溯至本案。 李柱銘：指引沒追溯力 高官提及兩宗覆核案，指上訴庭就非法集結罪中使用暴力定下新指引，雖控罪不適用於本案，但一般判處社服令的原則適用。但辯方資深大律師李柱銘指是否適合判處社服令，上訴庭過往有不同演繹。英國案例定出6項判刑條件，香港上訴庭曾指符合全部條件才可判社服令，後來法官司徒冕判刑時提及不一定需全部6項。最近上訴庭卻稱第五項條件「真誠悔意」是判社服令的先決條件，李直言對此原則感奇怪。 李指兩宗覆核案控罪針對非法集結，案情與本案不同，判詞不適用；又稱新指引於兩被告干犯控罪後才頒下，不應追溯至本案，裁判官不受覆核案判詞約束。 上訴庭3法官於反東北案判詞提及「法庭一直認為真誠悔意是接受社會服務令的先決條件」，若被告非真心言悔，一般會拒判社服令。法官又指若被告真誠後悔會適時認罪；若審訊後定罪，法庭須小心考慮悔意。上訴庭定下指引，若被告定罪後堅持「控罪不正當」、「堅持自己清白」或「堅決表示自己沒做錯」，算沒真正悔意。 高官昨問辯方，兩被告是否堅持沒錯，辯方表示兩人承認全部責任並不會上訴。裁判官最終接納兩人真誠悔過。資料顯示，律政司可於判刑日計起14天內向原審裁判官就判刑提出覆核申請，或於21日內直接向上訴庭提出覆核申請。 ■記者歐陽聯發
20170922-2,20170922,2,校委拒對話　觸發圍堵事件,校委拒對話　觸發圍堵事件 【本報訊】去年1月26日港大校委開會，議程之一是討論學生倡改革《香港大學條例》，會議由李國章主持，馮敬恩有份出席，場外大批記者及學生守候會議結果。惟會議結束後校委會取消見記者，保安築起人鏈護送李國章及紀文鳳等校委離開，學生見狀即要求對話，觸發圍堵事件。 馮：唔好畀李國章走 首被告馮敬恩於李國章附近大叫：「唔好畀佢走！唔好畀李國章走！隊冧佢！隊冧佢！」人群擠向李，有人拉扯李的肩膀和手臂一下。李在護送下退回大樓，保安擋在玻璃門前。馮稱取回個人物品，當門稍開時，馮大叫：「有冇人要入去搵李國章呀？」馮說畢即拉扯大門，其他示威者協助，最終導致大門鋁框變形。 紀文鳳被人群推至大樓對開草地，報稱頭暈不適。救護員到場，有示威者阻攔救護員和擔架。次被告李峰琦用雙手及身軀壓着擔架床，紀要步行上救護車。裁判官裁定馮恐嚇罪不成立，因馮使用第三身的「佢」而非「你」，不肯定「隊冧佢」是否說給李聽。馮另被裁定作出擾亂秩序行為罪成；李則被裁定阻礙公職人員執行公務罪成。 ■記者歐陽聯發
20170922-3,20170922,3,馮敬恩判刑前自白全文,馮敬恩判刑前自白全文 我叫馮敬恩，剛從港大畢業，明天就是我在擔任第一百零三屆港大學生會會長期間，因參與圍堵港大校委會，爭取修改大學條例，維護院校自主的事後，被控多條刑事罪行的判刑日。坐在案前，我的心中一片茫然，悵然若失。可能是短時間內最後一次坐在凌亂的案前，好像在快要離開之際，任憑是吉光片羽都是值得眷戀。 我本來以為我會對時局有很多看法，可以洋洋灑灑寫下數千字來。可是，其實我一個字都寫不出來。自七月二十日宣判至今的兩個月來，我對自己的過去都有很多的反思。赴臺註冊期間，我約了為我寫推薦信的老師吃飯。老師說對於我的狀況很同情，也覺得很不開心。說罷，就絮絮談起以前的學生運動云云。忽然，老師打住了，說：敬恩，個人的幸福是社會幸福的前提啊，你現在太年輕了。我莞爾一笑，把話記在心裡。 「為世界美好多一點 付出所有」 ── 《哪一天我們會飛》 在這段日子裡面，我想我對自己的家人、朋友以及愛人是最自私的，最無承擔的。所以我很想對他們說一聲謝謝和對不起。沒有他們的包容和體諒，就沒有一往無前的馮敬恩。如今毀家紓難，受罪的仍是他們。為世界美好多一點，是每一個人的責任，不應該是只有學生的責任。用了一段時間來關心自己所鍾愛的學校，如今我已經畢業，應該展開一個新的旅程了。是時候把餘下的事情處理妥當，然後離開這裡，沈潛內斂，修身養性。以後，我想Make Opinion ，不是Make Noise. 除了很感謝我的家人之外，我也很像感謝港大的老師以及曾經不辭勞苦幫助我和Colman的朋友、上莊以及律師朋友。沒有他們四處為我們奔走，這段時間只會更難熬。他們的努力，令我們走起來並不孤單。可是有時候看著馬丁，想起七年前五區公投時，他在文宣片段中的這句對白「我就黎七十二歲啦，仲鬼咁年輕力壯。就算你拖到二零四六至有普選，我驚你啊？」七年後的今日，還是馬丁這位港大文學院的師兄在這裡，陪一代一代人爭取社會公義。唉，我不知道怎麼講，又溫暖，又諷刺，又絕望，悲矣！ 時間剩下不多了，天色漸漸光，讓我想起《島嶼天光》這首歌，與大家互勉！ 「親愛的媽媽　請你毋通煩惱我 原諒我　行袂開跤　我欲去對抗袂當原諒的人 歹勢啦　愛人啊　袂當陪你去看電影 原諒我　行袂開跤　我欲去對抗欺負咱的人 天色漸漸光　遮有一陣人 為了守護咱的夢　成做更加勇敢的人 天色漸漸光　已經不再驚惶 現在就是彼一工　換阮做守護恁的人」 You and I will never fall for we belong to Hong Kong U ! 最後，請大家為我們禱告吧！
20170922-4,20170922,4,馮敬恩求情信全文,馮敬恩求情信全文 高偉雄裁判官： 二零一六年一月二十六日，在沙宣道圍堵校委會的行動之後，我打開手機，看見一位前港大學生會幹事的短訊： 「剛才在電視上見到你的行動，你這樣把門一拉，就拉倒了你與大學的對話橋樑。 」 當時我站在沙宣道，聽著寒風呼嘯，頓覺惆悵 ──我的行為真的能夠推動大學的進步嗎？被捕至今，相關的法律程序歷時超過一年，於我個人固然感到深度的困擾和苦惱，亦體會到行動對大學絕非好事。 港大是我心之所向，思之所想，皆因大學將我帶進了人生的另一個高度。我出身草根，家住公屋，父母離異，看世界的目光就像一個侏儒看一個巨人，只看到巨人的膝蓋而非全像。自從考進大學，老師和朋友，將一個新的世界帶到我面前，令我受益終生，開闊了我的眼界。身為港大人，我亦體會到厚重的歷史感。走在大學校園裡，想到過去的前輩與我一樣，曾啟蒙於此，盼學成之後貢獻社會。這種傳承的使命感，令我對於這所百年大學，自覺多了一份責任。 因此，香港大學的未來與發展，都是我過去至今一直關切的。是故對於自己本來希望守護港大，但卻出乎意料地損害了大學，我實在感到後悔和遺憾，亦對當日的混亂感到歉疚。當日我無意對任何人和物造成傷害，只是想爭取我們的目標，詎料當日的場面非我力所能控制，更非我所願，我謹此向校務委員會成員說一聲：對不起。 經過一年多的沉潛反省，我漸漸體會到真誠的對話，才是解決問題的起點。我想起林夕先生在《明我以德》一曲中有這麼一句：「用智慧擁抱自由和責任」。大家對大學裡、社會中的不公，可能深感憤慨和不滿，急於求變，我亦曾經有同樣的想法。只是經歷重重波折後，我明白到熱情投入的同時，也應該理解社會大眾對於大學生有所要求──能夠尊重別人，有節有理，並且有禮地表達我們的訴求，才能以道理贏得支持。 我們或許對現況感到挫敗，繼而產生一定程度的無力感，同時亦有種「我們要做點事情」的想法。只是，在躁動和焦慮下，我們往往會訴諸更進取更激進的行動，以期達到果效。我的案件教訓大家，過份進取甚至是激進的行為，不但對自己構成危險，更有可能違反法律，而最重要的是無助即時解決當前的問題。如何有智慧地追求理想，行穩致遠，並以冷靜和可行之途，長遠追求大學以及社會的變革──這就是社會給我們的考驗，也就是時代交給我們的任務。 這年來，同輩同學以至政見不同的朋友，都給我鼓勵和支持，讓我有了多角度的反思。他們都在為我打氣，與我仔細分析。在判決前，我深切感謝各方親友、師長以及社會人士的協助。今後的日子裡面，盼我能以微薄的力量，重新搭建一道橋樑。 馮敬恩 謹呈 二零一七年九月十五日
