key,date,article_daily_id,title,text
20180518-0,20180518,0,港人第一代東瀛偶像西城秀樹病逝,港人第一代東瀛偶像 西城秀樹病逝 【本報訊】在中國，他是象徵中日友好的和平大使；在韓國，他是衝破日韓世仇的第一人；在香港，他是日本「二度侵略」維港兩岸的流行文化先鋒。西城秀樹，曾經紅遍東半球的歌影巨星，前日因心臟衰竭在橫濱醫院病逝，享年63歲。由Young Man到傷痕纍纍，秀樹絢爛一生讓人心折。 記者：吳家偉　張文鈴 日本巨星西城秀樹昨傳出死訊，據日本傳媒透露，西城上月25日與家人享天倫期間因心臟衰竭暈倒，送院後一直昏迷，延至前日在橫濱醫院逝世，終年63歲。 「東條英機已成過去，西城秀樹即將來臨。」在80年代維園一個悼念九一八事變日軍侵華的活動上，曾獲日本京都大學聘任的香港中文學者陳耀南寫過這副對聯，原意是警惕港人提防日本文化侵略，客觀上則反映了以西城秀樹為代表的日本風，對當時香港流行文化的衝擊。 原名木本龍雄的西城秀樹出生於廣島，1972年憑首支單曲《戀愛季節》出道。1979年，他翻唱《YOUNG MAN（Y.M.C.A）》並配以字母舞姿，風靡亞洲。他推出過86張細碟，代表作還有《傷痕纍纍的Laura》及《Blue Sky Blue》等，當年與鄉裕美、野口五郎被稱為新御三家，19歲起多次打入日本《NHK紅白歌合戰》。 紅遍亞洲　多次來港演唱 香港在80年代掀起一片東洋風，由流行曲、電視劇到日用百貨、衣着髮型皆沾染日本氣息。西城秀樹香港歌迷會成員Catherine形容，他是第一批影響香港流行文化的日本人，「佢係頭一批製造呢個boom（潮流）嘅人，令好多香港人開始聽日本歌，留意日本文化」。 1981年西城在伊館開演唱會，掀起一片撲飛熱。一年後，他再訪港舉行多場個唱，影響力媲美當年的本地紅星羅文、許冠傑。其後他亦多次訪港開騷及出席活動，又接拍1987年港產片《天使行動》，最後一次公開來港，是2007年出席《IFPI香港唱片銷量大獎2006頒獎禮》。 西城盛名廣傳於亞洲，在歌樂層面，也在政治層面。1988年，他出席了漢城（現稱首爾）奧運前夕的官方演唱會，成為二戰後首位日本人在南韓演唱日文歌（當時南韓禁止公開演唱日文歌）。1998年，他更獲邀在中國萬里長城表演，慶祝《中日和平友好條約》簽署20周年。 西城先後在2003及2011年兩度中風，他積極接受治療，一度重返舞台開騷，毅力驚人。他曾稱求生動力源於家人及歌迷，也希望憑着自身的不屈不撓，鼓勵患有同類疾病的人。2011年中風入院後40天，他坐着輪椅也要開演唱會。 西城在2001年與圈外人太太結婚，2002年誕下首名千金莉子，其後再誕下兩名兒子慎之介和悠天，目前兩子分別14歲及13歲，女兒下月初才滿16歲。西城生前受訪時指曾向妻許下承諾，要唱到70歲才退休，待子女長大才功成身退，是個好丈夫兼模範爸爸。可惜多年奮戰病魔的西城早已傷痕纍纍，前日不敵頑疾與世長辭，家人將於下周五黃昏為一代巨星設靈，地點是東京青山葬儀所，翌日早上11時出殯。
20180518-1,20180518,1,梅艷芳頭號偶像　曾親撰信悼阿梅,梅艷芳頭號偶像　曾親撰信悼阿梅 【本報訊】日本著名男歌星西城秀樹前日在日本橫濱醫院逝世，終年63歲。西城秀樹不單止風靡萬千少女，更包括已故香港天后梅艷芳。梅艷芳17歲時已迷戀他，曾是西城香港歌迷會副會長。入行後的梅艷芳，曾將他改編自《Careless Whisper》的《擁抱着Jive》改編成歌曲《夢幻的擁抱》，並參照偶像的形象，以中性造型出碟。 稱梅是妹妹 西城秀樹於1981年開始曾5度來港開個唱，曾與梅艷芳一同亮相《歡樂今宵》，西城指梅艷芳是他好友，每次來港梅都會招待他。而西城在香港推出唱片《西城秀樹》，一出已經賣了2萬張，當時梅艷芳即場向偶像頒發金唱片及獻唱《夢幻的擁抱》。 曾任西城歌迷會副會長的梅艷芳生前視他為頭號偶像，曾在訪問時被問到如果西城向她求婚，她會否嫁他？梅艷芳當時點頭稱會，更稱他很完美。梅艷芳曾說：「我覺得佢喺台上，無論你識唔識聽佢唱緊乜嘢，佢嘅每一個動作同台風都好易令你投入喺歌入面，係好吸引，台下嘅西城秀樹係一個和藹可親嘅人。」 西城秀樹與梅艷芳相識多年，梅艷芳離世時，西城秀樹親自寫一封信，表達對阿梅逝世的哀痛，直言一向視阿梅如親妹妹。 西城秀樹遺憾未能來港出席梅艷芳葬禮，對她留下無盡的思念，「我第一次來香港，Anita為我辦歌迷會，身為副會長的她一直為我打氣，看到她正式進入演藝界發展，我充滿喜悅，直到她成為巨星後，每次我到香港必會相見。對我來說，她就像是我的妹妹一樣，祈求她能在九泉下安息」。 ■記者姜樂琳
20180518-2,20180518,2,忠實歌迷：高大靚仔日本少見,忠實歌迷：高大靚仔日本少見 【本報訊】一代偶像辭世，雖然不再是當紅巨星，facebook昨日仍充滿傷感。西城秀樹香港歌迷會成員Catherine表示，「證實呢個消息嘅時候我返緊工，都忍唔住喊，真係喊咗出嚟！」她昨日把fb個人賬戶頭像換上自己與偶像的黑白合照，封面照寫上「秀樹，感激！」字句。 信和唱片店僅有精選碟 就如無數追星少女，當時任職廣告公司的Catherine直言，欣賞秀樹是因為「高大靚仔囉，一米八喎！日本人好少咁高㗎」。至於她與偶像的唯一合照，是八十年代西城秀樹專程出席香港歌迷會的聚會，當晚劉德華也有出現，更即席與秀樹jam歌作樂。 不過像Catherine這樣一直關注秀樹的香港人，現在已不多了。在信和中心經營唱片店30年的吳先生表示，昨日有幾位客人詢問有否西城秀樹的唱片，但店內只有唯一一張香港唱片公司於2010年發行的精選碟，以及2007年在日本發行的當地精選碟，而前者為店內自用，不會出售。 他表示，當紅時西城秀樹約一年發行一隻大碟和兩至三隻單曲碟，都有不少捧場客，每有新碟他必定入貨，即使到近年日本發行精選碟，他亦會返貨，但選購的客人都是「上年紀嘅，50幾歲左右先會買」。 ■記者羅繼盛
20180518-3,20180518,3,對羅文、梅艷芳影響大,對羅文、梅艷芳影響大 【樂評人之言】 日本殿堂級男星西城秀樹昨離世，商台DJ兼樂評人黃志淙昨日接受《蘋果》訪問，他嘆謂：「真係早咗啲！」黃大讚西城很勇猛，中風後仍努力操弗及開音樂會。黃表示：「紅白歌合戰係七十、八十年代農曆新年嘅盛事，年初一起身就睇，我同屋企人都係支持白組，除咗佢仲有澤田研二、鄉裕美，但西城高大英俊、長髮型仔，比起鄉裕美就成熟美啲，全家大細都好鍾意佢。」 提升港演唱會製作水平 談到西城秀樹對香港樂壇有何影響，黃志淙說：「西城秀樹喺舞台同音樂嘅影響力係佢嘅能量，佢跳紮紮好陽光，膚色、打扮日本得嚟又好美國，佢亦好聰明選咗《YMCA》呢首Village People嘅大熱歌改編，加埋動作舞蹈係席捲世界，對梅艷芳、羅文嘅影響都好深遠。」 演唱會文化方面，黃志淙憶述早年做資料搜集的資料，指當年周梁淑怡有一間製作公司，是做由日本引進來港的舞台燈音效果，而他亦是從西城的演唱會得到啟發，所以想請日本的製作人來港，亦因有這些高水準音樂會，令香港有上進心的搞手去日本取經，提升香港製作水平。 ■記者沈寶茜
20180518-4,20180518,4,小丸子姊姊幻想與西城結婚,小丸子姊姊幻想與西城結婚 【本報訊】日本歌手西城秀樹離世不僅令亞洲歌迷大受打擊，他還有一個動畫世界的忠實歌迷，就是小丸子的姊姊櫻幸子！ 作者邀為動畫唱片尾曲 《櫻桃小丸子》故事背景是作者櫻桃子童年的七十年代，當時西城秀樹開始走紅，逐漸成為日本家喻戶曉的偶像歌手，作者本身也是西城秀樹歌迷，因此把動畫角色「櫻幸子」也描繪成西城秀樹的忠實擁躉。動畫中的櫻幸子不時看西城秀樹演出，又會幻想見到西城秀樹，更曾幻想與他結婚。其實聲演櫻幸子的配音員水谷優子於兩年前的昨日因乳癌在醫院病逝，令小丸子迷與西城秀樹歌迷受盡雙重打擊。西城秀樹於1994年獲櫻桃子邀請演唱《櫻桃小丸子》片尾主題曲《跑起來老實人》，當時西城秀樹爽快地答應合作，實現了櫻桃子心願。 本報昨一直嘗試聯絡櫻桃子，但至截稿前未有回覆，據指櫻桃子對於西城秀樹離世十分傷心。至昨晚當地時間7時許，櫻桃子在其LINE BLOG上追悼偶像，貼了西城秀樹在《櫻桃小丸子》中的動畫肖像，並留言：「秀樹先生已經離開了我們。他獻唱的《跑起來老實人》，是一首十分開心的主題曲，在我的世代而言，秀樹先生是個真正的巨星。」 ■記者吳家偉
20180518-5,20180518,5,石棺藏屍案法官急病　陪審團解散排期重審料需時一年,石棺藏屍案法官急病　陪審團解散 排期重審料需時一年 【本報訊】荃灣DAN6工廈石棺藏屍案在高等法院已經審理長達27天，案件昨日有出人意表的發展。由於63歲的主審法官李瀚良因患病需要即時跟進治療，短期內未能復工審理案件，暫代法官與控辯雙方商討後，決定解散全體陪審團，擇日重審。法官提醒陪審員切勿與任何人談論本案案情，強調此乃必須遵守的法律指示。有大狀認為案件已經審理近30天，但司法機構仍然選擇即時解散陪審團，可見李官病況「應該好嚴重」。 記者：楊思雅　伍嘉豪 司法機構回應查詢時指出，由於主審法官因病需要立刻休息和治療，短期內不能聽審，基於司法公正的考慮，有關案件不能繼續，須重新審理，將會根據一貫程序重新排期審訊。律政司發言人表示，檢控程序會繼續進行。 控辯雙方一臉愕然 有大狀接受《蘋果》查詢時解釋，若法官只患普通小病，或復工日期得以預計，法庭大可先將案件押後一至兩周；但石棺案現已審理接近30天，司法機構仍然選擇即時解散陪審團排期重審，可見李官病況「應該好嚴重」，短期內無法復工審案。大狀預計排期需時大約一年，若屆時證人有變卦，如主要證人失去聯絡不能作供，被告可以審訊不公為由，申請永久終止聆訊。 本案控方已完成舉證並開展辯方案情，首被告曾祥欣正接受盤問，但他過去兩天亦因病未能作供，昨更缺席聆訊。根據司法機構前晚更新的案件表顯示，審理法官仍為李官；至昨早法庭書記在庭外張貼更新版案件表，法官一欄已改為正審理梁天琦等暴動案的法官彭寶琴。 昨日早上10時開庭，當彭官從內庭步出法官席時，控辯雙方大律師一臉愕然。彭官透露李官因病需接受治療，短期內未能復工，在諮詢眾人意見後，認為不應將案件押後，並決定解散全體陪審團。由於事出突然，彭官未有為意首被告不在犯人欄內，而辯方大狀亦未有匯報首被告因病缺席一事。 禁與他人談論案情 彭官其後正式宣佈解散陪審團，但提醒他們切勿與任何人談論本案案情，不論透過facebook、WeChat還是其他社交媒體，或用最傳統的面談形式，她強調此乃必須遵守的法律指示，不得披露案件內容。彭官並感謝陪審團盡責付出，理解作為陪審員或多或少阻礙日常生活，感謝他們代表社會履行公共義務。 3名被告曾祥欣（28歲）、劉錫豪（23歲）和張善恒（25歲）否認於前年3月4日在荃灣DAN6工廈一單位謀殺28歲男子張萬里。控方指他們以哥羅芳焗死張萬里後，用水泥建造石棺藏屍，但因石棺太重無法移離單位，惟有棄屍「着草」到台灣。同行者還包括案發時在單位、首被告密友何菱瑜「小草」。小草早前以特赦證人身份出庭指證各人。 案件編號：HCCC459/16
20180518-6,20180518,6,幽默多金句　曾向虐畜被告稱：判你執狗屎,幽默多金句　曾向虐畜被告稱：判你執狗屎 【本報訊】法官李瀚良傳患重病，令石棺藏屍案審訊腰斬，法律界不少人甚表驚訝。不止一名大律師向《蘋果》表示，李官經常打羽毛球鍛煉身體，一向「幾fit」。大狀口中的李瀚良，為官以風趣、脾氣好、甚少罵人見稱，審案不時爆出幽默金句，曾對踢傷緝毒犬鼻子的虐畜被告說：「（緝毒犬）個鼻攞嚟搵食，如果可以判你社會服務令，我就判你執狗屎！」 主動休庭讓年老被告休息 根據多名大狀描述，李瀚良甚少愁眉苦臉，常掛着歡顏，亦「比一般人識得照顧自己身體」，「冇諗過」及「唔相信」李官突然病重。李官審案時表現細心，如審理八旬退休法官李栢儉夫婦呃綜援案時，發現對方面露疲態或坐立不安時，便會主動休庭讓對方休息。 另外，李官亦愛開玩笑，審理一宗勞力士錶劫案時，有被告求情指還柙期間畫畫逗繼妹開心，包括卡通人物蠟筆小新及迷你兵團，李官笑言：「佢哋都係好百厭嘅人物喎。」至於在「再生人」強姦案，被告被指化身「察猜」、「頌猜」等21個神靈與事主溝通，李官向陪審團笑說：「大家都攰喇，今日咁多人物出現。」 不過，李瀚良面對離譜案件也有嚴厲一面，有次審理一名青年非禮及企圖強姦三胞胎親妹時，狠批溺愛及縱容長子的父母連動物也不如：「動物尚懂舐犢情深，文明社會竟有如此不顧親情嘅父母。」該案判詞亦反映李官審案頗上心，他稱被告恃寵而為，令他「掩卷嘆息」、「心情久久未能平復」。 現年63歲的李瀚良於1987年取得大律師資格並加入律政署（今律政司）任助理檢察官，後升任高級檢察官，1993年獲委任做裁判官，僅花7年便「升正」總裁判官，其後任區域法院法官及首席法官，2012年更上一層樓，出任高院原訟庭法官至今。《蘋果》得悉，李加入律政署前，曾短暫做過物理治療師。 ■記者伍嘉豪、梁偉強
20180518-7,20180518,7,政府擬設新制打擊黑的　扣滿15分停牌劏客　拒載　兜路　改錶　扣10分,"政府擬設新制打擊黑的　扣滿15分停牌 劏客　拒載　兜路　改錶　扣10分 【本報訊】運輸及房屋局宣佈雙管齊下打擊「黑的」，濫收車資及拒載罰則將實施兩級制，重犯司機會被加重刑罰，同時引入的士違例扣分制，違例司機除被罰款或監禁外，亦會被扣分，兩年扣滿15分將被停牌，最長停牌半年。有關法例最快明年提交立法會。的士業反對引入扣分制，認為是畫蛇添足。 記者：麥志榮　林社炳 根據《道路交通條例》，的士濫收車資、拒載及兜路，最高罰則為罰款10,000元及監禁六個月。法庭可再加判司機停牌一段時間，但法例無就停牌時間設上限。近年有「劏客黑的」多次被檢控後繼續營業，有意見認為罰則過輕。 議員倡涵蓋駕駛態度 運輸及房屋局表示，檢討的士違規罰則後，計劃採雙管齊下方案，加強對重犯者阻嚇力。對的士司機較嚴重罪行，包括濫收車費、拒載、兜路、兜客、損壞及更改的士咪錶，實施兩級制罰則，訂明重犯者將面對更高罰款上限及最高監禁期。當局又建議參考現行的違例駕駛記分制度，引入的士司機違例扣分制，違例司機除被判罰外，同時會被扣分。方案稍後會諮詢各界，目標是在2019年向立法會提交立法建議。  據了解，當局建議將18項的士違規行為納入的士扣分制，當中較嚴重罪行，包括濫收車資、拒載、兜路及更改咪錶等扣最高的10分。其餘較輕微違規則扣三或五分。在兩年內累積扣滿15分，初犯者停牌三個月，重犯則停牌六個月。的士業均反對引入扣分制。汽車交通運輸業總工會的士司機分會主任杜燊棠指出，目前法庭已有權將違例司機停牌，再加扣分制是畫蛇添足，令人更不願加入的士業，加劇「司機荒」。城市的士車主司機聯會主席莊永德表示，現時不少乘客投訴都屬誤會或一時意氣，例如司機會改變行車路線避開擠塞，但乘客可能因此投訴司機兜路，扣分對司機不公平。 香港的士商會有限公司執委會主席黃保強形容，「黑的」是害群之馬，可加重刑罰即時停牌，不應針對整個的士業。而扣分制涉及的18項違規，當中不少法例條文已不合時宜，應全面檢討。 身兼的士服務質素委員會成員的公民黨立法會議員譚文豪表示，原則上贊成引入扣分制，但部份罰則過重，相信乘客更關注司機駕駛態度，倡政府考慮將駕駛態度納入扣分制。立法會交通事務委員會委員田北辰認為，在加強罰則同時，應立法規定的士加裝攝錄系統，讓司機及乘客更易舉證。 乘客及司機心聲 乘客夏小姐 「的士實行扣分制可以提升業界服務質素，扣分制影響司機生計，司機一定會做好啲，唔會違例。」 司機游先生 「生意又唔好，搞得多（扣分制）好麻煩！扣分制應該只針對『黑的』，唔應該針對成個業界。」"
20180518-8,20180518,8,輔幣不足要扣分　司機：不合理,輔幣不足要扣分　司機：不合理 【本報訊】的士找續問題一直引起不少糾紛，藝人王喜及麥明詩都曾捲入搭的士找續不足風波。政府構思中的扣分制規定，司機未有足夠輔幣找續會被扣五分，衣着不適當及在車上吸煙都會被扣三分。 「唔該運輸署唱散銀」 除濫收車資等嚴重罪行外，政府建議將一些較輕微違規事項納入扣分制。當中無足夠輔幣找續、拒絕發出的士收據、遊蕩或將車停留在的士站以外地方等可被扣五分。司機未有保持個人整潔及衣着不適當、以及在車上吸煙可被扣三分。目前法例規定司機需備有100元輔幣，當中90元為10元鈔票或兩元或以上硬幣，10元為一元或以下硬幣。 的士業強烈反對不夠輔幣找續要扣分，批評相關法例條文過時。汽車交通運輸業總工會的士司機分會主任杜燊棠指司機要準備大量細面額輔幣有困難，五毫或以下硬幣連銀行都換不到，他很早已向運輸署提出將車費跳錶改為整數。「如果無足夠輔幣要扣分，唔該運輸署提供唱散銀服務」。而衣着不適當要扣分亦不合理，法例根本無清晰訂明甚麼衣着才適當。 ■記者麥志榮
20180518-9,20180518,9,粉嶺唔攞攞蚊型地單幢居屋插針都要起,粉嶺唔攞攞蚊型地 單幢居屋插針都要起 土地供應大辯論已展開，社會不少聲音要求發展172公頃粉嶺高球場建屋，但政府一直未表明立場。不過，同屬體育界、位於沙田石門毗連傑志中心僅0.43公頃的「蚊型」地皮，政府就無視反對，堅決改劃建單幢居屋。有議員炮轟，政府做法「大細超」，強調發展高球場能短期內協助基層「上樓」。有前立法會議員批評，高球場所佔的公共資源遠較傑志多，「政府唔係唔敢郁體育用地，而係唔敢郁背後牽涉嘅龐大利益」。 記者 李詠希 沙田石門一幅毗連傑志中心、約0.43公頃原本是休憩用途的土地，將建單棟居屋，涉560個單位。有關土地改劃曾被當區居民及傑志支持者等大力反對，認為當區生活及交通配套不足，加上毗連傑志中心，球場眩光及噪音日後料對居民造成影響，但有關改劃最終仍獲得通過。 團體「撐場大聯盟」陳智聰說，原否決改劃作住宅用途的城規會，半年間立場180度大轉變，疑當中放棄規劃原則，斥政府為求政績，小型地都不放過，擔心新居屋入伙後，球場操練會引致居民投訴，「到時（新）地點差啲都冇得揀」。 他續說，港府應對體育「公道啲」，傑志是全港唯一擁有「自己場」的球會，不但為本地足球提供青少年培訓，亦有逾三成時段供公眾及學校等租用。他又指，傑志中心與粉嶺高球場不同，如只發展部份高球場建屋，料已能容納數千人，「土地係好珍貴，但我哋（傑志中心）只係攞咁細嘅土地去做兩個球場，值得政府花資源落去」。 關注事件的前立法會議員羅冠聰認為，不能從體育層面將傑志中心及高球場劃上等號，高球場所佔的公共資源遠較傑志中心多，「高球場背後係N個幾千萬會籍嘅生意。政府唔係唔敢發展體育用地，而係唔敢郁背後牽涉嘅龐大利益」。立法會房屋事務委員會副主席尹兆堅亦斥，政府做法「大細超」，強調發展高球場可有效紓緩公屋供應大落後情況，如政府有心發展高球場，最快2023至24年度提供首批公屋單位，「直頭係救到命」。 房產發展研究中心創辦人姚松炎指，傑志以短期租約模式租地，理應知道無法在該處作長遠發展，認為體育場地若要與民居共存，可加設隔音設備或緩衝區等，否則在規劃優次上，不論傑志或高球場等體育場地或要搬至交通較不便的地方。 傑志中心回覆《蘋果》指，將向政府力爭保留被改劃建屋的地皮，以供傑志擴建或興建足球學校，並爭取留在原址；又指政府未曾與傑志商討重置事宜，但有限資源下，中心能發展至現時規模是「艱苦經營」，如要重新發展另一個足球中心，「恐怕力有不逮」，又指香港足運目前最重要是培育精英球員，「而不是如何去搬遷一所正在發揮功能的足球訓練中心」。 民政事務局重申，仍在物色合適用地重置傑志中心，現階段未有重置傑志的時間表，在未落實遷置安排前，不會收回傑志現址進行發展。
20180518-10,20180518,10,梁天琦案加時無裁決　陪審團今續商議,梁天琦案加時無裁決　陪審團今續商議 【本報訊】涉及本土民主前線前發言人梁天琦等五名被告的旺角騷亂案，陪審團昨第二天商議，晚上一度向法官要求「加時」討論至9時，最終仍未有結論。法官昨晚下令各人休息，今晨繼續商議。陪審團昨一度就何謂犯罪意圖提問，法官強調「意圖」毋須周詳計劃，可以是一剎那產生。 官：「意圖」可一剎那產生 九人陪審團周三（16日）早上約11時半退庭，昨下午5時首度向法官提問，表示對五名被告分別被控的煽惑暴動或暴動控罪中「意圖」一詞有不清楚的地方，要求法庭解釋，或釐清「意圖」一詞在法律上有否特別定義。 法官彭寶琴指「意圖」屬一般日常用語，沒特定法律定義，陪審團須考慮被告行為及說話，甚至被告沒做過的行為和說話都應一併參考，應細想控罪發生前、進行期間及之後，被告的所作所為。彭官強調，被告的「意圖」毋須周詳計劃，可以是一剎那產生，或被告受情緒影響下作出。 彭官解釋，意圖不等於動機，舉例指若有人因不想見親人受疾病煎熬，遂了結對方生命，雖然其動機是想解除親人病苦，但意圖明顯是殺人。彭官強調，如果陪審團要就被告的意圖作出推論，有關推論必須建基於事實基礎上，並且必須是唯一的合理推論。 陪審團再退庭至昨晚8時原定休息時間，但突然向法官提出再商討多一小時，稱正在商議的事項有連貫性，不過當時已明言不會即晚有全部結果。彭官9時開庭宣佈結束第二天的商議，今早9時半再續。 五名被告為梁天琦、李諾文、盧建民、林傲軒及林倫慶。梁早前承認一項襲警罪被還柙，現仍面對一項煽惑暴動及兩項暴動罪，控罪指他於前年2月8日至9日在旺角砵蘭街和亞皆老街參與暴動，以及連同黃台仰在砵蘭街非法煽惑在場人士參與暴動。李諾文、盧建民各面對一項暴動罪；林傲軒被控非法集結和暴動兩罪；林倫慶被控三項暴動罪。 案件編號：HCCC408/16 ■採訪蘇曉欣、撰文伍嘉豪
