key,date,article_daily_id,title,text
20190111-0,20190111,0,七年前車禍撞至半癱包山王向兩司機　索償逾千萬,七年前車禍撞至半癱 包山王向兩司機　索償逾千萬 【本報訊】曾在亞洲攀石界位列第一、世界排名第八的香港頂尖攀石選手黎志偉，2008年在長洲太平清醮搶包山中以10秒極速攀上包山頂並勇奪冠軍，榮膺「包山王」，但七年前一場發生於屯門公路的車禍導致他下半身癱瘓。意外後，他要靠輪椅代步，任教攀石只可口述，無法親身示範，備受掣肘；而教練續牌條件更指定他要有另一教練在場時方可教授，能力遭質疑，結果三年前無奈放棄港隊教練之職。黎早前入稟高院，向兩名被指肇禍的私家車司機索償，金額逾千萬元，案件昨日開審。 記者：蔡少玲 現年36歲的黎志偉昨出庭作供，談及攀石運動時如數家珍，詳加剖析不同種類的攀石項目，自言當中以用最快速度登上頂端為勝的速度攀登表現較為出眾，但未嘗徒手攀登。 06年世界攀石排名第八 回顧2000年17歲那年，黎初次接觸攀石，半年後已在北京舉行的亞洲青少年攀岩錦標賽中奪冠，此後決心成為專業攀石運動員。他18歲入讀香港體育學院，2002年至2003年於亞洲攀石錦標賽中獲成人組冠軍，之後一直在世界賽事中取得佳績，2006年已是世界攀石排名第八。 雖然如此，黎不認為他於2006年已達到其攀石運動員生涯的頂峰，揚言「只係突破亞洲區嘅開始」，他仍想更創高峰。不過，由於政府自2006起至2010年間，縮減對運動員贊助，故黎亦較少出外參賽。2006年黎考獲攀石教練牌照，可擔任攀石教練。 黎指出，他本來就打算從攀石運動員退役後便從事攀石教練、或者擔任定線員設計攀石比賽路線等工作，甚至想過任教國家隊。不過，2011年12月9日發生的車禍，卻將他的計劃打亂。黎聲稱，當時他駕着電單車沿屯門公路往西行時遇上車禍，先後遭兩部私家車撞傷。 意外後，黎下半身癱瘓，要靠輪椅代步。翌年，他「出山」任教攀石，可是，這位要坐輪椅的攀石教練，續牌時被附加條件，就是上課時必須要有資格教練在旁助教。 任教港隊被質疑能力 2014年，黎志偉任教香港攀石代表隊，可算達成抱負。不過，他2016年離任。黎說：「唔係我自己唔教，係有人問我：仲係咪有能力教？」他說，當時很多家長和教練均對他的能力表示質疑，黎亦知道攀石總會曾多次就他的續牌申請開會，並因為擔心會觸犯歧視條例，才對他這位唯一坐輪椅的攀石教練續發教練牌。 然而，黎亦明白做教練資歷雖重要，但亦要有能力，才可教好年輕人。他自知因為坐輪椅的原故，授課時只可口述言傳，未能身教。任教港隊的首兩年，他已將自己過往的經驗向學員傾囊相授。直至第三年，黎有感學員未能再從他身上獲得任何益處，而且攀石總會當時有更換教練的想法，加上他亦考慮到自己受背痛困擾，以及一旦發生意外時自己未必能及時作出應變，思前想後，終決定放棄任教。 案件編號：HCPI1235/14
20190111-1,20190111,1,輪椅無法進入證人台　作供困難辛苦,輪椅無法進入證人台　作供困難辛苦 【本報訊】政府推動無障礙空間，但處理人身傷亡案件無數的高等法院，在相關設施方面似仍有不足。本案原告黎志偉昨在高院作供期間，便因乘坐輪椅無法進入證人台，要單手挨在輪椅手柄，側着身，才能對着專供法庭錄音的收音器作供，頗為辛苦，就連被告一方的大狀見此情形亦於心不忍，一度問黎需否休息。 黎昨坐電動輪椅到庭，當法庭傳召他作供時，他搖動控制桿操控輪椅，惟因庭內通道狹窄，輪椅只能緩緩移向證人台，而且證人台設計並未預計給坐輪椅人士使用，故黎只能將輪椅泊在證人台旁邊，再將身體挨向右邊靠在椅柄上，才能接近證人台上的收音咪。作供期間，黎要不時用雙手按着兩邊椅柄，撐起身體以便伸展腰背。 稱自行駕車「好攰」 黎在庭上稱，意外後曾於2015年接受兩位康復及職業治療師上門探訪及撰寫報告，當中提及黎當時可在床上獨立轉身，並獨自乘搭交通工具，亦能駕駛並自行上落司機位、摺好輪椅及將之放到車上。但報告亦指出黎曾坐在輪椅上「戥」落樓梯，連法官聞言亦不禁謂：「咪好危險？」黎解釋，他因電梯失靈和維修才會如此做，但他同時指「早嗰幾年仲可以咁，呢兩年做唔到喇，因為身體差咗，冇咁有力」。他現時亦沒再自行駕車，因為「好辛苦，好攰」。 ■記者蔡少玲
20190111-2,20190111,2,兩司機均超速　一人穿拖鞋,"兩司機均超速　一人穿拖鞋 【本報訊】「包山王」黎志偉為了導致他下半身癱瘓的車禍，向兩名被指肇事的司機索償。黎坦言對事發經過已無記憶，不過，靠着現場其他證人口供得知案發經過，指兩部肇事私家車當時均超速行駛，其中一名司機更疑穿拖鞋駕車。 兩名被告分別為案中司機唐洪國與徐紹輝。案發於2011年12月9日，原告黎志偉一方指，黎當時駕電單車沿屯門公路往屯門方向的中線行駛，其間原在快線行走、由唐駕駛的私家車，從後撞到黎的電單車車尾，黎從車上跌到右邊路面，再遭後來駛至徐的私家車撞倒，最後黎倒於中線唐的車前。 稱黎突切線肇禍 黎對事發經過已無記憶，但靠現場獨立證人口供得知事發經過。原告指兩名被告當時正以超越路段規定的80公里時速上限行駛，唐更在撞倒黎後才煞車。據知，有證人目睹唐下車時腳踏拖鞋。 唐承認撞到黎，但稱只因黎當時由中線突然切向他所在的快線才會肇禍；至於徐則全然否認撞到黎。 原告在本案索償逾千萬元，包括收入損失近970萬，惟被告一方對他的收入來源有所質疑。原告一方回應指，黎事發前是全職運動員，亦有從事高空建築工程工作，月入三萬元；黎亦獲獎學金、贊助費及比賽獎金。此外，黎每月亦有兩、三天攀石教練工作，日薪1,500元。 ■記者蔡少玲"
20190111-3,20190111,3,意志不滅　登獅子山創傳奇,意志不滅　登獅子山創傳奇 【本報訊】黎志偉曾被冠以「神奇小子」稱號，意外後，他從高峯墜落地面。雖然半癱，近年身體狀況亦不如前，卻未磨滅其意志，2016年他更趁車禍五周年，由同伴協助登上獅子山再游繩而下，創造傳奇。他去年更接受訓練試穿機械腳協助走路，令他有「變返正常人」的喜悅：「我有返晒信心。」 欲購「機械腳」助走路 被告一方的大狀昨向黎志偉展示一篇剪報，報道有關他攀登獅子山一事，稱讚曾是成功精英運動員的黎，在意外後仍非常堅強，克服困難。黎指當時是趁意外五周年，找來40位朋友、學生及攀石教練，用繩協助他登上獅子山頂，之後他背負沉重輪椅游繩而下。至於報道中提到的「獅子山精神」，黎稱只是記者給他的形容詞。 黎的索償項目亦包括購置俗稱「機械腳」的義肢協助走路。黎作供提到，在港大協助和訓練下，曾試用其研發的機械腳輔助走路，更在去年書展首次對外公開試用這部醫療器材。 他指穿上機械腳後，可在凹凸不平的路面上行走，又能走到海邊和穿過馬路。他形容，穿上機械腳後很開心，「變返正常人，可以企起身，以正常人嘅視線睇事物、同人傾計，我有返晒信心」。 ■記者蔡少玲
20190111-4,20190111,4,長者綜援提高門檻綑綁去年預算案林鄭稱議員支持　泛民轟老屈　建制斥陰濕,長者綜援提高門檻綑綁去年預算案 林鄭稱議員支持　泛民轟老屈　建制斥陰濕 【本報訊】政府下月起將長者綜援申請門檻由60歲提高至65歲，早已遭長者及社福界批評，特首林鄭月娥昨早出席立法會答問大會時，民主、建制議員均要求林鄭收回決定，但她突爆出有關決定早已綑綁去年財政預算案《撥款條例草案》內，更聲稱已獲立會支持，等同批准政府改變政策。去年曾投票支持預算案的建制派發現「中伏」，狠批林鄭「賴皮」、「陰濕」，反對預算案的民主派鬧爆林鄭「老屈」議員。 記者：林俊謙　梁穎妍 林鄭前日回應社署下月1日收緊長者綜援申請門檻時，指很多60歲以上的市民都在工作，又稱自己超過60歲，「仲係每日10多個鐘頭咁做嘢」，已遭各界炮轟涼薄。民主派昨於社福界議員邵家臻號召下，在答問大會前率先「招呼」林鄭，展示「欺貧怕富無天理 林鄭何不食肉糜」標語抗議，林鄭到場時全程「黑面」，在多名保安護送下步入會議廳。 指聽聞撤回政策感驚訝 以往支持政府的建制派，昨日也炮轟有關政策。新民黨議員容海恩發問時開火，指很難將一般綜援長者與特首比較，問特首會否收回安排。民建聯議員柯創盛會上亦指政府有關做法是「全城鬧爆」。不過林鄭回應時未有因建制派提問而留手，反而出招「辣慶」建制派，指有關政策「係各位（議員）批准」，隨即爆出原來有關政策早已寫入《2018年撥款條例草案》中社署開支分目，當中有提到有關政策，議員去年投票通過預算案，等於批准政府把長者綜援申請資格由60歲升至65歲；又稱聽到議員要求撤回政策感到驚訝，強調如今不能剎停。 翻查當日預算案投票，建制派差不多全部支持，民主派大部份投反對票、民主黨投棄權票，而專業議政莫乃光、梁繼昌及李國麟投支持票。曾投票支持預算案、成為林鄭「反嘲」對象的容海恩會後批評，林鄭會上回應是不準確及不負責任，做法「賴皮」、「陰濕」，不滿政府在推出有關修訂前，沒廣泛諮詢和與持份者溝通，也沒提供具體細節和相關執行時間表。 全黨均曾投票支持2018年預算案的民建聯議員，會後對林鄭說法表示非常驚訝和強烈不滿，民建聯黨團召集人陳克勤聲稱，當日支持預算案只因不想政府陷入財政懸崖；該黨議員葛珮帆亦狠批林鄭說法不公平和不公道，「覺得佢屈我哋建制派議員」。 當年無就2018年預算案投票的社福界議員邵家臻和工黨議員張超雄，會後手持「老屈」標語，抗議林鄭說法。張指去年12月12日曾在立法會福利事務委員會提動議，反對社署將會把領取長者綜援的合資格年齡由60歲提高至65歲，並獲委員會通過，所以立法會反對政府收緊長者綜援的立場十分清楚，批評林鄭說法明顯是「老屈」議員。 李國麟：唔係贊成呢樣嘢 邵家臻表明，今日社總、社聯、社協和他辦事處將會去信林鄭，要求林鄭擱置收緊長者綜援申請的建議，周日財政司長諮諮會上，他亦會向財政司司長陳茂波和勞福局局長羅致光提出同樣訴求，下周三更會提動議要求檢討綜援政策，向政府施壓。 當日曾投票2018年預算案的三名民主派議員中，只有衞生服務界李國麟昨早有參與民主派示威，抗議林鄭收緊綜援申請。李昨接受查詢時表示，當日投票支持預算案，是因為預算案的確回應了很多業界訴求，「我唔係贊成佢呢樣嘢（削減長者綜援）」。莫乃光回覆查詢時指，立會各黨派早前已在福利事務委員會表明反對政府收緊長者申請綜援門檻，故林鄭說法明顯是「講大話」，又指「唔可以由件事燒完就算，佢（林鄭）必須出嚟清楚交代同向各黨派承認不實表述」。
20190111-5,20190111,5,政策23字交代　藏於千頁文件中,"政策23字交代　藏於千頁文件中 【本報訊】特首林鄭月娥昨振振有辭地稱，收緊申領長者綜援年齡安排獲立會議員去年審議預算案時一併通過，但事實是有關政策內容遭政府「收藏」於逾1,100多頁部門開支中，並只用23字交代；政府落實前，議員更多次促政府擱置建議，但政府一直不聞不問，難怪民主、建制派均大罵林鄭無賴。 無視立會屢提擱置動議 有關安排最先由前特首梁振英2017年1月在他最後一份施政報告中提出，當時說法是配合延遲退休年齡，但梁同年7月落任，由林鄭上場，而財政司司長陳茂波去年2月公佈林鄭政府首份預算案，於《2018年撥款條例草案》內、分為兩卷連同目錄及附錄逾1,100多頁各部門及基金開支賬目中，在總目170、即社會福利署賬目下，在2018/19年度特別留意事項中有「把領取長者綜援的合資格年齡由60歲提高至65歲」一句，當時陳沒在演辭提及，派發予市民的單張也無提及這新政策。 另不少立會議員自2017年獲悉有關擬議安排後已多次討論，其中工黨張超雄及社福界邵家臻都在當年向梁的施政報告就安排提修訂，可惜遭否決。至去年預算案通過前，福利委員會及財委會都曾多次討論有關安排，跨黨派議員都曾表明反對。福利委員會去年初及去年11月都分別通過擱置相關安排的動議。 工聯會黃國健指，預算案有不同政策範疇，議員一般視乎大方向投票，「唔代表支持每項政策」，直言感到委屈。 ■記者梁穎妍"
20190111-6,20190111,6,學者質疑改門檻違《基本法》,學者質疑改門檻違《基本法》 【本報訊】政府下月起將長者綜援申請門檻由60歲提高至65歲，港大法律學院高級講師江嘉恩（圖）於社交媒體撰文指，政府提高門檻可能違反《基本法》第36條「香港居民有依法享受社會福利的權利」。她援引2013年終院「孔允明案」指，「終審法院已清楚說明，沒有合理原因，政府不能將綜援門檻降至比1997年前差的水平」。 援引孔允明案終院判詞 孔允明案源於政府自2004年起將申請綜援的居港年期限制由原先最少一年，收緊至最少七年。婦人孔允明2005年獲單程證來港，數月後丈夫逝世，孔欲申綜援被拒。孔提司法覆核並上訴至終院。終院2013年頒下判詞，指根據《基本法》第145條「香港特別行政區政府在原有社會福利制度的基礎上，根據經濟條件和社會需要，自行制訂其發展、改進的政策」，認為條文認可了回歸前的社福制度，並默示過往制度才是第36條中所指「香港居民依法享受」的社會福利，因此回歸前申綜援只需居港一年的規定，應受憲法保障。最終孔獲一致裁定上訴得直，相關綜援制度回復至2003年版本。 江嘉恩指當年判詞明言，將不同社福政策門檻統一，並非政策改動的合理理由。她認為是次提高綜援年齡門檻，「並不能為政府削減主要開支，反而對被剝奪長者綜援的人士造成非常嚴重及沉重的負擔，令他們的基本生活需要受不到合理保障」。 不過大律師吳靄儀認為，今次政府更改規定與孔案的背景雖然相似，但就此下結論認為違反《基本法》是言之過早，需問清政府理據，「孔允明嗰個case點解贏，係因為政府講出嚟啲道理全部講唔通」。她稱至今仍未見政府有合理解釋，「如果純粹話特首60歲以上都做夠十個鐘頭，呢啲咪講唔通囉」。 工黨張超雄指認同江的觀點，認為政府須研究，證明60至65歲長者能在市場謀生，為政策改動提理據，「（如果）受法律挑戰，政府又冇呢啲數據，最後個政策係違反第36條，咁就真係搵嚟搞，令社會有無謂爭拗」。 ■記者關冠麒
20190111-7,20190111,7,無助公院分流　促檢討醫療券,"無助公院分流　促檢討醫療券 【本報訊】現時不少長者使用公院服務均要輪候一段長時間，特首林鄭月娥昨於答問大會上承認，雖然長者醫療券使用率達九成，但未能分流入住醫院及急症室的人次，強調不介意再加醫療券金額，但前提是用得其所抑或適得其反，她已要求食衞局全面檢討醫療券效能。 陳凱欣倡加碼 立法會議員陳凱欣昨於答問大會上提出，建議將長者醫療券金額由2,000元增至3,000元，又形容公營醫療面臨崩潰邊緣，強調公營醫療體系重治療、輕預防的做法一定要改變。 林鄭回應指，長者醫療券的金額已從最初650元增至現時2,000元，使用率高達90%，但她直言做不到應有作用，未能分流入住醫院及急症室的人次。她指不介意增加醫療券金額，但要知道醫療券是用得其所抑或適得其反；又引述有業界人士指醫療券計劃令長者並非只向同一名醫生求診，對推動基層健康未必有效。她透露已要求食衞局全面檢討醫療券效能，並會公佈檢討結果。 另外，林鄭稱政府近年已在醫管局投放新資源，但她同意若未能在制度上作重大轉變，改變重醫療、輕預防方針，醫療體系將難以應付人口老化帶來的挑戰，政府將大力投放資源在社區醫療，例如加強疫苗接種和身體檢查，提高市民預防意識。 ■記者莫劍弦"
20190111-8,20190111,8,今日提醒你：隨意穿越紫禁城,今日提醒你：隨意穿越紫禁城 康文署與故宮博物院聯合主辦，透過建築模型、斗拱模型、垂脊裝飾和彩畫複製品等十八套展品，讓觀眾認識紫禁城所蘊藏的深厚文化底蘊和建築智慧。 日期：即日起至4月7日　　 地點：尖沙嘴九龍公園香港文物探知館 門票：免費入場 詳情： http://www.amo.gov.hk/b5/whatsnew_20190108.php  親子幻想遊樂場 遊戲是兒童基本權利，「幻想遊樂場」讓孩子們可在這個充滿想像空間的環境自由探索，父母可透過陪伴孩子遊戲，從而締造優質親子互動及遊樂時間，為兒童早期發展及腦部發展注入重要元素。在遊樂場內，形狀各異的大型藍色組件隨意散落地上，在安全的遊戲空間內讓孩子發揮想像力，運用不同組件拼砌出心目中最有趣的遊樂場。 日期：即日起一連三天 時間：今日3:30pm至7pm；周六及日10:30am至7pm 地點：赤柱佳美道23號赤柱廣場 齊來深水埗垃圾跑 跑步時只可聽歌望街？不！還可以邊跑步邊執垃圾！減廢香港一直有舉辦香港垃圾跑（HK Ploggers），今次就到深水埗垃圾跑，主辦單位還會提供可重用環保袋、垃圾夾及手套，參加者亦可自行準備。 時間：今晚7pm至10pm 地點：深水埗一帶（美孚港鐵站B出口集合）
20190111-9,20190111,9,議員缺席奏唱須解釋　毛孟靜斥政府露馬腳國歌法變DQ武器,議員缺席奏唱須解釋　毛孟靜斥政府露馬腳 國歌法變DQ武器 【本報訊】港府公佈《國歌條例》草案後，始終不肯講清楚在不同場景下，哪些行為才算違法。政制及內地事務局局長聶德權昨再為草案解畫時，竟說以爵士樂形式奏唱國歌也屬違法，又指候任議員缺席宣誓儀式時的奏唱國歌環節需合理解釋，否則有機會犯例。議會陣線毛孟靜斥責港府終露出馬腳，批評《國歌條例》勢成DQ議員武器。 記者：呂浩然 聶德權昨出席電台節目為《國歌條例》解畫，雖指立法目的並非「告人」，而是「想人尊重國歌」，但被問到外國容許以不同形式奏唱國歌，香港的《國歌條例》又是否容許以例如爵士樂等並非貶損國歌的形式奏唱時，聶即搬出案例指，就連在國旗寫上讚美字句都屬玷污國旗，所以不應損害象徵國家的國歌曲譜，表明以非進行曲形式奏唱都不可。 對於外界關注《國歌條例》影響創作問題，聶指李克勤的《球迷奇遇記》、黎明的《全日愛》雖被指有國歌元素，但認為沒有觸犯條例。聶又稱若馬場奏唱國歌時，馬迷專注分析賽事、鑽研馬經而「唔為意」正在奏國歌而沒有肅立，也不構成侮辱。但對於親中團體經常在示威遊行奏唱國歌，他認為不應隨隨便便奏唱國歌，重申「要睇有冇意圖侮辱（國歌）」。 胡志偉：條例涉主觀判斷 此外，《國歌條例》草案把議員宣誓列為必須奏唱國歌場合，聶昨再解釋候任議員缺席宣誓儀式的奏唱國歌環節時表示，「如果喺奏唱國歌嘅環節唔出席嘅時候，係咪有啲乜嘢原因，如果佢係用呢個咁嘅方式嚟去表達一啲睇法、態度嘅時候，讓人去懷疑佢是否真誠去相信佢自己所宣誓嘅內容，咁呢個你咪有機會唔符合宣誓個要求」。而基本法委員會前委員譚惠珠昨接受報章訪問時亦表示，候任議員無合理原因而刻意缺席，例如「拉隊」離場，就有可能違反《宣誓及聲明條例》。 議會陣線毛孟靜形容，聶的說法是「終於露出馬腳」。她批評聶一直聲稱草案的目的是要求大家尊重國歌，但如今草案令奏唱國歌成為宣誓儀式的條件之一，缺席都要有解釋，證明當局正製造白色恐怖，草案亦會成為港府DQ議員武器。民主黨主席胡志偉亦批評，聶的說法更令市民憂慮《國歌條例》，例如市民出席奏唱國歌的場合時，若被人懷疑屬不尊重國歌，即有可能被送交執法單位處置。胡更指出，從聶提到馬迷的例子可見，《國歌條例》根本涉及大量主觀判斷，「正正令國歌法變成放喺巿民頭上的一把刀」。
20190111-10,20190111,10,團體轟做法如將23條斬件,團體轟做法如將23條斬件 【本報訊】多個民間團體及民主派黨派昨發表聯合聲明反對《國歌條例》，指內容明顯牴觸基本法所保障的言論及表達自由，令巿民有相當憂慮。有參與團體批評《國歌條例》猶如將《基本法》23條「斬件過立法會」，政府可利用有關法例作政治檢控手段。 促起碼諮詢公眾半年 參加聯署民主派議員包括陳志全、陳淑莊、邵家臻、范國威和毛孟靜，工黨、香港眾志、社民連以及早前遭DQ的議員青年新政游蕙禎和梁頌恆亦有參與聯署。 聲明指香港人對中國政府的反感源自過往數年一國兩制、司法獨立及核心價值持續受到威脅，若政府霸道地勉強人「愛國」，以立法去強迫人「尊重」國歌，卻不切實回應高度自治訴求，最終只令人更不滿及更想反抗。他們認為條例極具爭議，政府應進行起碼六個月以上的詳盡公眾諮詢，若有關法例內容未能保障香港人的言論及創作自由，就不應倉促立法。 聲明發起人之一的馮智活牧師形容條例「好似23條咁辣，政府唔好夾硬立法」，否則只會激起巿民強烈反抗。香港大學學生會外務副會長彭家浩指，政府做法猶如《基本法》23條「斬件過立法會」，透過《國歌條例》作為政治檢控手段，表明港大學生會和學界將有行動和文宣，希望喚起巿民關注，「希望過去參加過反對23條遊行同反對國民教育集會的巿民，都要關注」。 ■記者林俊謙
20190111-11,20190111,11,放生梁振英　林鄭堅拒促鄭若驊再考慮,"放生梁振英　林鄭堅拒促鄭若驊再考慮 【本報訊】前特首梁振英收受澳洲企業UGL的5,000萬元，律政司司長鄭若驊不按慣例尋求獨立法律意見下「放生」梁振英。民主黨涂謹申昨於特首答問大會質疑鄭做法等同押下特區信譽，促請特首林鄭月娥親自要求鄭重新考慮，但林鄭堅拒，辯稱《基本法》列明律政司獨立處理刑事檢控工作，反指自己參與檢控決定，「咁就係法治淪陷嘅一天」。有出席答問會的鄭若驊拒回應記者提問，會議結束即迅速離開。 稱已給「公關意見」 涂謹申昨在立法會答問會上追問鄭若驊不外判法律意見一事，慨嘆市民只能望着香港法治沉淪，質疑林鄭是否都認為律政司與梁振英兩者的角色沒有利益衝突，或觀感上的利害關係，並促請對方要求鄭重新考慮。林鄭回應時則指，鄭若驊是由她向中央提名任命，每天都有向她提供法律意見，自己不可能不尊重對方的專業意見，又稱明白政府管治上難免觸及外界觀感問題，「但都唔能夠凌駕法治同公眾利益」，強調自己不會干涉律政司的決定，又自言早前已向鄭提出「公關意見」，提醒鄭盡速交代事件。 熱血公民鄭松泰質疑律政司不檢控梁振英的理據中指，梁沒有利益衝突就不用申報，認為是為梁訂新的申報定義，林鄭只重申鄭若驊所作是專業判斷，反駁指鄭松泰說法是「簡單化或扭曲咗」，當局就利益申報有嚴謹指引。 有份出席答問會的鄭若驊離開時被大批傳媒追問UGL案，多名民主派議員亦高舉「追究梁振英、鄭若驊」示威牌上前抗議，但鄭一直封口，在大批保安開路下行到政府總部外試圖上車離開，直至被問到何時才會回應不檢控梁振英一事時，她才說：「喺立法會嘅時候，會再度回應嘅」，隨即上車離去。 ■記者梁穎妍"
