key,date,article_daily_id,title,text
20190122-127,20190122,127,大棋局：中國貨幣政策要爆了 - Mr. Tregunter,"大棋局：中國貨幣政策要爆了 - Mr. Tregunter 有一單重磅新聞，事緣財政部國庫司副主任郭方明表示，準備研究將國債與央行貨幣政策操作銜接起來。乜嘢意思？人民幣的發行，係行結滙制，有幾多外滙入嚟，就印幾多人民幣出街，條數叫外滙佔款。中國加入WTO後不停賺外滙，2002年央行的資產構成，外滙佔款唔到40%，但2014年3月飆到83.32%。即係話人民幣有八成美金含量。 結滙制問題，係當好景時外滙不斷流入侷住印銀紙，唔好景時外滙流出就會通縮。2014年係中國賺外滙的頂峯，之後外滙開始流失，外滙儲備由近4萬億美元跌至現時約3萬億美元。而人民幣發行有增無減，因為由2014年央行開始用MLF、PSL等方式增加貨幣供應避免通縮。這部份2014年佔央行資產構成唔到5%到2018年底佔29.9%。外滙佔款則由佔比83.32%跌到57.1%，即係人民幣被溝淡，美元含量減少。 用MLF、PSL這類放式投放基礎貨幣，頂到一時頂唔到一世。PSL以棚改抵押貸款，2020年後棚改差唔多冇得做；MLF一類貼現其實係以金融機構的信用作抵押，無限擴張等於亂印銀紙，人民幣就會變廁紙。咁就嚟料，貿易戰傳出中國以大手買美國貨作為和談條件，2024年將對美國順差降至0。中美貿易順差約3,300億美元，如果降到0，每年少3,300億美元流入，外滙儲備就難守。 去美元化勢必發生 美元萬劍歸宗，主動權在美國手；中國以降順差為條件，原理一樣但主動權在中國手，起碼可以自己控制流量。但當外滙越來越少，唔印銀紙，會通縮；要印，就要諗用乜嘢去抵押，此為中國即將要面對的最大難題。擴大國債在貨幣政策的運用，其實就係長遠學美國用國債抵押印銀紙。冇幾耐，內地媒體引述接近人民銀行人士反駁，國債唔係準貨幣。 反駁動作一定要做，否則容易讓市場以為要QE而波動。或認為《中國人民銀行法》第二十八條規定，中國人民銀行不得對政府財政透支，不得直接認購、包銷國債和其他政府債券，所以用國債印銀紙方法行唔通。 郭方明所提出的，係要引起市場討論，唔係話今日講完聽日就做。中國外滙儲備收縮會持續多年，大手買美國貨作講和條件為大概率之事。人民幣發行方式要諗出路，去美元化，將必然發生。由過去借助美元信用變為獨立自主，燃起財政部官員心中一團火，感覺在這個moment，要爆了。 Mr. Tregunter 本欄逢周二刊出"
20190122-128,20190122,128,曾淵滄專欄：跟大隊炒5G概念 - 曾淵滄,曾淵滄專欄：跟大隊炒5G概念 - 曾淵滄 5G概念熱炒，開始的時候，我很抗拒其中一隻熱炒股鐵塔（788），理由是鐵塔P/E值100多倍，慢慢地，我後悔了，決定換個角度來看鐵塔，希望鐵塔在5G系統正式推出後會快高長大，成為增長股，因此我也買入了，跟大隊炒一炒5G熱潮。 華為事件使到5G概念炒得更熱，5G概念也使到中移動（941）由收息股轉變成潮流熱炒股。也憧憬在5G系統正式推出後，中移動也成為增長股。中移動以現價計算，P/E值也只是12倍，增長的憧憬應該更濃。 中移動股價的炒作熱度比不上鐵塔，相信其中一個理由是中移動的股價曾經相當高，因此市場中有大量的蟹貨等待清理，要清理完蟹貨之後，股價才能飛升，再創紀錄。第一個目標是破2015年大時代的高位，最終目標當然是突破2007年的歷史高位。 中國經濟增長放緩，再加上打貿易戰，因此，中央救市已經是國策，觀策選股就成了目前的最重要基礎。 一想起救市，人人想起2008年的4萬億基建，但是，相信這一回的救市與上一回有所不同，上一回救市救出一個特大的通脹及胡亂炒作，連蒜頭、鹽都成了炒作對象，香港應該還記得曾經有一天，人人爭着買鹽。 上一回，有一個清楚的指標：4萬億搞基建，10萬億銀行新增貸款。這一回，相信沒有硬指標了，是走一步看一步，逐步逐步的加，逐步逐步的救市。因此，一哄而起的炒作機會小了，大家更應該耐性的等待，過早「食糊」的結果一定是在之後的更高價再入市追貨，風險擴大。 曾淵滄 財經評論員
20190122-129,20190122,129,利字當頭：呢鋪我撐任正非 - 利世民,利字當頭：呢鋪我撐任正非 - 利世民 從新聞見到，華為創辦人任正非說，5G 的發展將沒有預期般順利，企業未來可能要過「苦日子」，並且要削減部份平庸的員工。任正非的反省，也令我想起了許多年前Intel創辦人 Andrew Grove所寫的Only the Paranoid Survive 。 話說當年美國的半導體製造業面對日本的競爭，Intel改變策略，放棄低價的記憶體，專注生意處理器晶片，並與IBM達成協議，促成近幾乎是橫向壟斷，但也開創了1980年代的個人電腦革命。Intel Inside的故事也成為市場學必修課之一。 雖然多數人關注華為，是因為近來鬧得火熱的中美矛盾，但是從企業策略的角度，我覺得更值得思考是華為銳意營造「5G ＝華為」的定位策略。其實幾年前我已經聽過有關5G技術的簡報和示範，數據傳送速度無疑比現在的4G高出許多，嚴格來說也不會出現連接中斷的情況；對於全無人駕駛導航等新的用途，5G是關鍵的技術突破。 不過，5G流動網絡技術亦不是沒有缺點；對於香港這種人口密集地理覆蓋範圍相對較細的市場，5G是非常合適的技術，只要處理好訊號穿透力的技術問題，以及頻譜分配的經濟問題，原則上就可以應市。可是，對於覆蓋範圍更大的市場，我很懷疑是否能夠合乎成本效益地鋪設5G網絡基建。事實上，還未出現近來的連串事件前，已經有人對5G的潛力提出質疑。大膽點推論，其實除了華為，其他與流動通訊相關的企業，也步入一次增長的平台期，任正非也只不過是坦白承認這不方便的真相。 利世民  http://fb.com/leesimon.hk  本欄逢周二、四刊出
20190122-130,20190122,130,何車500：國壽新華跑出，快到人保 - 何車,何車500：國壽新華跑出，快到人保 - 何車 清潔能源股華能新能源（958）2018年預測PE僅5.7倍，3大傳統國內電力股則平均15倍，當中同系的華能國電（902）更接近20倍。如何取捨，已有結論。 1）華能新能源去年首11個月總發電量按年升9.3%，但全年則升11.3%，當中12月份增幅高達29.5%。全年數據於1月10日發出，利好，券商紛紛調高目標價。現價2.24元，較數據見光前升5%，但較去年高位3.5元仍低逾3成半，趁低吸納贏面大。 2）華能新能源主力風電，亦涉小量太陽能業務。2018年上半年營業額63.18億元人幣，按年升12.5%；純利23.49億元人幣，增15.6%。彭博綜合券商預測，全年多賺18%，現價往績PE 6.5倍，預測5.7倍，較8年平均13.5倍低逾5成。3大國內傳統電力股平均15倍，同系的華能國電（992）更達19.9倍，華能新能源便宜得太多。 3）華能新能源2018年預測PB 0.75倍，較8年平均1.15倍折讓3成半，與華能國電的0.74倍相若。 ★華能新能源2018年預測EPS較2011掛牌年高出140%，但現價仍低於當年招股價2.5元。追失地，目標價2.9元，潛在升幅29%。大行平均睇3.19元，最高是瑞信的3.8元，最低是交銀的2.63元。 同場加映：「同場加映」上周二於27.6元薦買新華保險（1336），現價30元，累計升9%（勝H指8個百分點），同期其A股只升4%。年初至今，國壽（2628）H股大升15%，而其A股則只升9%。（另外，恒生A股較H股溢價的指數亦由一年前最高的139跌至現時的118。） 人保與國壽兩隻內險H股跑贏A股，似是資金流向大折讓內險H股。「由此路進」捉路，可吼人保（1339），人保H股較A股折讓高達50%，其他同業平均只19%。上周一於3.12元薦買人保，現價3.16元，累計只升4仙，年初至今亦只微升0.3%，大落後，H股較A折讓最大之外，PE 7.2倍與PB 0.73倍亦最吸引。目標價重溫：4.21元，潛在升幅33%。 何車 本欄逢周一、二、三刊出
20190122-131,20190122,131,Can Bank：買樓創業點樣揀 - 散子,Can Bank：買樓創業點樣揀 - 散子 睇新聞又再有所謂月光族年輕人嘅討論，大概都係話年輕人工資普遍追唔上生活指數，重點係追唔上樓價，儲錢不如及時享樂，日子過得開心就好。 樓價的確係高到一般年輕人難以負擔的階段，有唔少年輕人，即使有本事搵一份相對高薪嘅正職，為咗公屋嘅資格，寧願放棄正職轉做自由工作者，令入息符合申請公屋水平，直至成功申請公屋。 問題係呢批人自願放棄正職究竟係為符合申請公屋資格，抑或係在現有社會觀念下，父母、女朋友，甚至係朋友對你嘅期望？試想像，現今父母希望自己兒女買樓先，抑或創業先？女朋友們希望男朋友買樓先定創業先？ 即使今時今日創業成本遠低於置業，相信唔少人仍會選擇置業，近十年樓市升幅令到唔少人認為置業係零風險投資，創業眾所周知係高風險，置業是首選可以理解。不過，年輕人有的是青春，亦都無咩可以輸，反而係創業好時機，所以，年輕人有好橋嘅，不妨出來創業，始終打份工又好，自由工作者又好，多數都係Multi-tasking，好似友欄高明話齋，multi tasking 即係傭工。 散子  http://fb.com/散子-257101397966975 
20190122-132,20190122,132,魚樂無窮：等足七年大茶飯 - 唐牛,"魚樂無窮：等足七年大茶飯 - 唐牛 遠東環球（830）本月初宣佈，向母公司中國建築（3311）收購Value Idea及富天企業銷售股份及貸款，總代價2.95億元，兩公司分別持有南昌大橋及南昌中海新八一大橋55.24%股權，通告指出，兩項目擁有穩定的現金流及預期整體回報可觀，可為集團拓展新運營類業務奠定良好基礎。 大家還記得中國建築何時入主遠東環球嗎？答案係2012年，即係講緊7年前嘅事，不過，注資活動今回卻竟然是第一次，在在反映今次動作，銀碼雖然不大，但含金量極高。另一個重點是7年之後的今天，遠東環球終於宣佈易名為中國建築興業，是否意味終於坐正？答案已寫在牆上。 中國海外集團一門三傑，中國海外（688）主打內房，中國建築強攻建築，遠東環球則聚焦大橋，各司其職，前兩者市值分別為3,000億及360億元，後者卻只得奀豬18億元，連零頭未都夠，壯大空間無極限。 雖然一直未見注資活動，但遠東環球基本條件也不差，集團主打一站式建築物外牆解決方案，過去三年盈利年年遞增，今次收購平均作價不足15倍PE，更有助拉低估值，昨日股價破旗而上，脫離毫子股身份指日可待！ 唐牛  http://fb.com/tongcow88  本欄逢周二、四刊出"
20190122-133,20190122,133,亮說亮話：空置稅令形勢逆轉 - 湯文亮,"亮說亮話：空置稅令形勢逆轉 - 湯文亮 中原指數連跌兩個星期，總共下跌了2.48%，估計在未來一兩個月仍然會下跌，跌幅可能會收窄，我相信只有一些見樹不見林的評論員才會話樓市已經止跌回升。事實上樓市仍然在下降軌迹，下跌速度時快時慢，一時三刻仍未能止跌回升。 有很多人不明白，利息仍然未加，供應又沒有增多，經濟環境仍然是良好，理論上樓價應該在某一個水平徘徊，究竟是甚麼原因令樓市連續下跌了幾個月，雖然跌幅不大，但這些陰乾式下跌，殺傷力是不容忽視，當大家警覺時，樓價已經下跌了20%。下跌原因很簡單，就是沒有人願意用高價甚至市價買二手樓，打算賣樓的業主要降價才有機會出售。 至於地產商點解要賣樓，理由亦很簡單，就是新樓空置稅。去年還未有新樓空置稅時，地產商採取不到價不賣的策略，所以只能售出一半發售的單位，大約9,000個單位，今年有了新樓空置稅，地產商不但要出售今年新樓盤的單位，還要兼顧以往的空置單位，數量應該是很驚人，所以，地產商才會大減價。由於新樓大幅減價，二手樓業主如果想賣樓的話，必定要減價，結果做成樓價指數拾級而下。這個局面相信還要維持一段長時間，直到地產商結束減價行動，樓價才有望止跌回升。 湯文亮 mailto:jacinto.tong@gmail.com 本欄逢周二刊出"
20190122-134,20190122,134,金手指：俄鋁幾時見4蚊 - 孫柏文,金手指：俄鋁幾時見4蚊 - 孫柏文 呢排孫柏文喺fb收到好多讀者來信問問題，今日解答兩條。第一條「美帝已解除俄鋁（486）制裁，點解都仲未四蚊？正一明燈！」 美帝其實只係宣佈會將俄鋁剔出制裁名單，實際係未做。因美帝多月來都話係對佢大股東唔妥，而唔係想搞俄鋁。佢哋已傾好數，大股東承諾會大幅減持，不過未做股權變動。照計應該會過年前搞掂股權，之後就正式放生俄鋁。一日未正式放生，好多金融機構仲係唔畀客戶買俄鋁。我除四蚊目標價預測外，另一預測則到四蚊時呢個網友會玩消失。 第二條「個5G係為乜？手機睇片再高清都冇point。」 冇錯，由3G起，無線網絡都只係追求希望做到駁線網絡做到嘅。不過當你去到5G，無線網絡速度可以做到由洛杉磯，不斷控制架冇人機飛去拉斯維加斯。每個發射塔成為控制塔，即會做到所有郁得嘅機械，飛機、汽車、巴士全都無人駕駛。 早前話香港巴士司機啲工時及薪水問題。用邏輯推斷，好快就會似以前拗PNET收費一樣，係obsolete嘅問題。巴士司機全收皮。載通（062）既甩人工成本，又可增大資本投資額。當然，喺特首林鄭月娥嘅英明領導下，香港可能成為最後一個有5G，不過都唔淘汰司機嘅地方。因為好打得其實唔打得。 孫柏文 獨立股評人  http://fb.com/shuen  本欄逢周二刊出
20190122-135,20190122,135,操盤手札記：鶴鷹講數再炒上？ - 割柑人,"操盤手札記：鶴鷹講數再炒上？ - 割柑人 豬年想過肥年，要睇月底台戲！1月30日，副總理劉鶴將會出訪華盛頓，同美國「鷹派」貿易代表萊特希澤展開貿易談判。咁啱呢日，亦係美國引渡華為老闆女孟晚舟嘅最後限期。死線臨近，美國兩路追殺華為，又刑事調查，又禁售法案。月底，睇鶴叔點拆彈！ 鶴叔此行，唔係加碼買貨、擴大市場准入就拆得掂，最棘手嘅，係拆解經濟結構問題，包括知識產權、技術轉移等。不過，睇美國總統特朗普連日唱好中美貿易談判，照計點都會傾掂個協議框架。 中國剛公佈嘅上季GDP顯示，受中美貿易戰影響，工業減速、投資不振，增長降至6.4%。數據符合預期，救市憧憬持續。恒指昨日收報27196，一度升穿前浪頂27260，此為雙底頸線阻力，後市若能企穩其上，量度升幅可見29980。 中美貿易談判，預計仍係未來幾周主導股市嘅關鍵。睇返舊年5月中鶴叔訪美前出現升市，估計大市喺佢月底訪美前仍有上升空間。不過，要注意嘅係，就算「鶴」同「鷹」達成協議，貿易戰偃旗，但關稅嘅威脅唔會即刻消失，受影響嘅產業，投資風險亦唔會即刻消散。 阿爺勢將加碼刺激經濟，不妨留意國策股如基建、內房、5G等。講到基建股，習主席近排喺京津冀一帶考察，第一站就係濶別兩年、被佈局為「千年大計」嘅河北雄安新區。隨着雄安規劃落實，市場估計，今年該區固定資產投資可望突破1,000億元。 雄安連同京津冀其他地區嘅基建項目相繼動工，單計高鐵項目，今年就能帶動水泥需求增加1,000萬噸，金隅（2009）同該集團持股嘅冀東水泥（深：000401）最為受惠，皆因兩者喺京津冀嘅產能合計佔比高達六成。金隅現價2.56元，升穿頭肩底頸線。 割柑人 本欄逢周二刊出"
20190122-136,20190122,136,佬訊專欄：建制派的穿搭重點 - 佬訊,佬訊專欄：建制派的穿搭重點 - 佬訊 佬編一向喜歡研究政治人物穿着，尤其是建制派，大約總結出幾個重點。諸君如果有志投身建制陣營，或者正如《蘋果》investMan這個專欄的主旨，想要正確投資在自己行頭上，不妨參考一下，優雅地避開地雷。 建制派穿搭的首個重點，是那接近無限的建制藍，aka藍絲藍。自從佔中以後，藍色就是一種旗幟鮮明的表忠顏色，藍色就是最不會被DQ的顏色之一。但要穿得像個建制派，不是事必要穿到像個任何人，像鄭泳舜、鄧家彪一樣襯條明藍或天藍的領呔，就可以get the job done。 第二個重點，是一副細size幼框眼鏡。一脈相承的西環契仔流派，就execute得最好。無論是衣着品味可以相當非主流的謝偉俊，還是接棒的何君堯，他們臉上的那副幼框眼鏡，都是他們的trademark。佬編私底下其實偏愛幼框眼鏡，但現在只可以嘆聲RIP。 Last but not least，建制派紳士的穿搭美學裏面，反領polo絕對是重中之重。佬編有幸見識王國健、周浩鼎的反領polo，那條奮起的polo領，與大國崛起的自high程度，絕對有着神秘的correlation。佬編借這個機會再向周浩鼎作出呼籲，鼎你收手啦。 建制派的穿搭原則，就是好不好看不重要，最重要的是表達到從身出發，擁抱家國的真摯感情。但有一種建制派，他們的任務是要模糊視線，麻痹警覺，欺騙選票。例如是一些疑似無黨派的獨立區議員，或者是強調不喜歡被分黨分派，競選學生會的大學生。這種類型，恐怕就沒有穿搭的原則可以分辨到了。 佬訊  http://fb.com/loshunhk/ 
20190122-137,20190122,137,【港情講趣】養肥再劏買玩具　經典7吋紅膠豬復刻登場,"【港情講趣】養肥再劏買玩具　經典7吋紅膠豬復刻登場 【港情講趣】 六十年代香港塑膠業蓬勃，不少家品、玩具由銅鐵瓷瓦改以塑膠製造，成本價錢更相宜，有本土塑膠廠開始將瓦錢罌改造成塑膠豬造型，自此每逢新年都見到一隻隻紅色塑膠豬仔錢罌。厚薄不一、人手上色的粗製濫造感，是其特色。 養豬，最期待莫過於年尾豬仔「吃飽」後，「劏豬」點算錢幣金額那一刻，快快樂樂捧着整年儲蓄買玩具，然後再買隻新豬。紅膠豬錢罌陪伴香港人成長，是香港獨有本土情懷。六十年代中，黃氏家庭式塑膠廠原創的紅膠豬錢罌，非常好賣，年屆半百的黃文銳說：「沒想到機器會壞，機器不行我們也沒辦法，就要停止生產，我們計算過，就算重新添置機器，以當時生產量都要十年才能夠回本，但還有幾多個十年可以做下去呢，所以最終選擇停產。」1985年，他接管父親與伯父開設的塑膠廠，至2014年宣佈錢罌停產，兩年後塑膠廠同告結束。 原創廠家：從來唔用佢儲錢 一般來說，每年僅於農曆新年前兩、三個月開機生產紅膠豬錢罌，吹塑機將一隻隻豬在模具中吹出來，再由人手逐隻上色，每年銷量約70,000隻。「過年時，我們亦會生產很多其他產品，但塑膠豬一定最多人要，所以我們家每個成員都要幫手，上色、上金釉、包裝等，以前真的要趕貨至年三十。我都好懷念從前製作豬的時光，因為都是我們幾兄弟一起，就是分工合作吧，這樣的話，家庭會很和睦相處。現在工廠結束了，真的少了很多相處機會，從前都是一家大細一起完成這事。」 對於上一代人，紅膠豬錢罌或多或少會勾起段段美好回憶，黃文銳雖與它密不可分，但他感到的只是食之無味，棄之可惜。決定停產後，也沒為自己或家人多留一隻紀念。「由細至大，我們從來不用這些豬儲錢，有錢都花光了，真的不會用，你可以說真的厭倦了，現在給我見到也沒甚麼感覺。多年來，我們賣豬都只為賺錢，沒想過有收藏價值，現在變得有收藏價值也是開心的，有人替我們將舊貨儲起來。」 黃氏塑膠廠生產紅膠豬50年，舊式雜貨店「朱榮記」也就賣足50年，黃文銳指客戶都只在新年前要貨，只有朱榮記全年都會下定單，朱榮記老闆朱耀昌對紅膠豬錢罌情有獨鍾，總將豬仔排在店舖外展示，成了雜貨店特色。「我的家庭，兄弟姊妹總是每人一隻豬，每年劏豬時大家都很興奮，也就一起數裏面有多少錢鬥多。」 一家大細　買隻靚豬過新年 紅膠豬錢罌本身是以前的生活品，朱耀昌認為後來大家更多是本着緬懷心態來買豬。「我認得有些人，年年都回來買豬甚或會帶子女一起來買，上次買完後，這次回來告訴我那些豬已經劏了，現在要買隻新的。」這個新年，有商場借朱老闆的珍藏紅膠豬來製作模板，再用板模重新復刻7吋紅膠豬，生產過程跟原廠製作一模一樣，供大家換領，重拾舊時回憶。 「《KCP九龍城廣場‧福豬報喜賀新禧》」展覽 日期：即日起至2月20日 記者：蘇敏婷 攝影：張志孟"
