key,date,article_daily_id,title,text
20190111-33,20190111,33,起腳踢警長　17歲女生被摔倒地上制服,起腳踢警長　17歲女生被摔倒地上制服 【本報訊】藍田一男一女中學生，昨在街頭起爭執後大打出手，一名警長及一名警員巡經喝止，兩男女生情緒激動反抗，其中女生更起腳踢警長，被警長當場摔倒地上制服。兩男女生涉嫌公眾地方打架及襲警被捕，他們均有受傷，拒絕送院，兩警分別肩痛及腳受傷送院。 被捕男女生分別18歲及17歲，在藍田一間中學就讀，學校正考試。 與男同學爭吵扭打被捕 現場為安田街啟田商場對開行人路，昨下午約1時，當時已放學，有途人發現兩人在街上爭吵後互相扭打，於是報警。兩名機動部隊（PTU）警長及警員巡經發現上前喝止，男生涉嫌以手推撞警員，女生更情緒激動起腳踢警長右膝，警長隨即捉住女生並將她摔倒地上制服，女生呼痛，並大叫「我冇郁你，你推我咋喎，警察係咪大晒㗎！」 混亂中兩警及兩男女生受傷，其中男生面及頸傷，女生則手及腳傷，但兩人拒絕送院，事後被捕帶署。據該校副校長稱，學校管教甚嚴，聽聞此事都很愕然，要了解有關事件，他說學校正考試，中午12時15分已放學。 ■記者姜偉康
20190111-34,20190111,34,車cam揭衝紅公仔過路男遭校巴撞飛七米亡,車cam揭衝紅公仔 過路男遭校巴撞飛七米亡 【本報訊】荃灣楊屋道市政大廈對開交通燈位昨午發生奪命車禍，一名男子疑衝「紅公仔」跑過馬路時，遭一輛疑「衝黃燈」的校巴撞倒重創昏迷，送院搶救證實不治；警方調查後以涉嫌「危險駕駛導致他人死亡」罪名拘捕肇事司機。 死者姓陳（63歲），肇事校巴司機姓黎（65歲），現場為楊屋道市政大廈對開葵涌方向交通燈位，設有行人輔助線，四線行車，兩行車線之間設有花槽及安全島。昨下午3時許，黎駕校巴載同13名學童沿楊屋道駛向葵涌方向，至上址時，陳突然跑過馬路，校巴收掣不及將他撞倒，陳被撞拋前七米墮地重傷昏迷，救護員到場將他送院搶救，惟已返魂乏術。 據網上流傳一段肇事校巴車cam的錄影片段顯示，陳當時是尾隨一名男子從安全島衝出跑過馬路，當時行車燈號剛由綠燈轉為黃燈，未幾陳被校巴撞倒。校巴車頭損毀及擋風玻璃破裂，車上學童並無受傷，由另一部校巴接走。警方事後取走校巴車cam調查車禍起因。  ■記者溫瑞麟、溫文學
20190111-35,20190111,35,為低息貸款借保證金65歲婦被騙580萬,為低息貸款借保證金 65歲婦被騙580萬 【本報訊】一名65歲女子於去年10月下旬，分別接獲三名假扮銀行職員的騙徒來電，對方聲稱可為她安排低息貸款，但需要事主交出巨額保證金；女事主不虞有詐，竟向三間財務借款580萬元，並將有關款項的支票交予三人作「保證金」。未料騙徒得手後去如黃鶴，女事主前日報案。警方正追緝三名涉案男子下落。 「按揭中心」人去樓空 消息稱，姓賴受害婦人無業，她早前向騙徒交付「保證金」後，一直未獲低息貸款，亦無法與騙徒聯絡，前日到騙徒聲稱的中介公司、位於旺角上海街的辦公室查看，發現並無職員，懷疑受騙報警。《蘋果》昨日亦到涉案的中介公司，發現門口有「按揭中心及律師事務所」的招牌，但已人去樓空，內裏只遺下垃圾及文件夾。據同層單位其他公司的職員表示，涉事按揭中心約在一個月前才開張，平日有數名男職員出入，有人身穿西裝，有人惡形惡相，但近日已搬走。 過往不時發生同類財務中介騙案，騙徒會以Cold Call致電事主，假扮銀行或貸款公司職員，聲稱可協助申請低息貸款，甚至游說事主將物業抵押，之後邀約事主到臨時租用的寫字樓或假律師樓，並要求事主交出貸款保證金，訛稱可有利獲銀行批出更優惠低息貸款，令事主信以為真上當。 ■記者梁澤岡
20190111-36,20190111,36,攞牌五日首駕波音777加航副機師粗猛着陸　機尾撼跑道,攞牌五日首駕波音777 加航副機師粗猛着陸　機尾撼跑道 【本報訊】赤鱲角機場上月發生飛機降落事故，加拿大航空一架飛機降落時機尾磨擦地面。民航意外調查機構發表初步調查報告，涉事飛機當時由僅獲駕駛資格五天的副駕駛員首次控制，由初次營運經驗訓練機長指導，着陸過程中機身先後向左及向右側傾，着地時機身後方下側觸及跑道表面，繼而飛機彈起再重返跑道中心線，報告形容事故為「粗猛着陸」，飛機事後需進行重大維修，至今仍未能復飛。 記者：曾偉龍 報告顯示，加航一架波音777-333ER型飛機從加拿大多倫多皮爾遜國際機場起飛，上月11日下午抵達香港。客機的降落過程由副駕駛員負責，並由身兼機長的初次營運經驗訓練機長則負責監控，在進場過程中提供口頭指導。 該副駕駛員在上月6日才獲簽發駕駛B777飛機型號的資格，即事發時前五天，此前曾接受飛行模擬器訓練，是首次以B777飛機降落及首次以機組操作飛行員身份來港，機長則有逾2.2萬小時飛行經驗。 事發時機上有近400人 在機長監督下，飛機在下降至400英尺時由副駕駛員改用手動控制，至跑道上方約200英尺時，飛機突然出現一連串輕微的左右側傾偏差，副駕駛員使用大幅度操控以制止側傾，但機身先向左再向右明顯側傾，降落前機翼仍未保持水平。 飛機着地時右側主起落架先接觸跑道，在高下降速度加上機頭高俯仰姿態下，機身後方下側觸及跑道表面，飛機繼而彈起，再重返跑道中心線，然後駛往停機位讓乘客下機，事發時機上共有376名乘客及17位機組人員。經檢查後飛機後方底部損毀，受影響的部件需要重大維修或更換，現時不能使用。 報告以「意外」形容事故，並指事件的初級事故類別為「不正常跑道接觸」，次級事故類別為「粗猛着陸」。機構調查組正詳細分析有關數據和資料，以確定意外的情況和因由，並定下進一步調查的範圍和方向，預計調查需時十二個月。  本身是民航客機機師的公民黨立法會議員譚文豪表示，新機師除了有模擬駕駛訓練，亦會在不載客的飛機上訓練，完成後才可駕駛載客飛機。不過他指，機長需要負最終責任，「機長都會掂住控制桿，如果唔對路，要take control（接手掌控）、intervene（介入），隨時都可以」，機長可以介入挽救情況，或決定復飛、重飛。
20190111-37,20190111,37,神學教授：林子健富正義感,神學教授：林子健富正義感 【本報訊】民主黨成員林子健被控誤導警員案，辯方昨傳召中文大學神學院副教授龔立人擔任品格證人。龔形容林富有正義感，是一名忠誠的人。龔又透露林於案發前曾自稱遭國安恐嚇，謂對方着他不要將美斯簽名照交給劉霞；龔坦言當時並不相信，更開玩笑向林稱對方可能想要C朗的簽名。控辯雙方已傳畢證人，案件押後至下月18日陳詞。 林庭後大叫無恥 44歲林子健被控於2017年8月11日明知地向警務人員虛報有人犯罪。林昨散庭後在庭上大叫無恥，語帶不滿地說：「我明明係受害人，𠵱家變被告，咁樣屈我。」及後林步離法庭時又大叫「shame on you」和「ridiculous」，有親友在庭外擁抱他痛哭。 龔立人作供透露，自2007年起認識被告，見證對方在中文大學修讀神學學士、碩士和博士學位，龔並擔任林的博士學位指導教授，兩人關係亦師亦友。 龔立人形容林子健富有正義感，例如獲悉朱凱廸於2016年參選議員期間受到恐嚇，主動與他商量「可以做啲咩去保護朱凱廸同其他參選議員」。至於學業方面，龔亦讚賞被告堅毅不屈，相信他是一個對家人、朋友、社會人和事均忠誠的人。 案件編號：KCCC2556/17 ■記者楊思雅
20190111-38,20190111,38,領都勁加管理費　業主抗議,"領都勁加管理費　業主抗議 【本報訊】將軍澳區大型屋苑日出康城大幅增加管理費，引發小業主不滿，昨日前往屋苑管理公司、港鐵公司位於九龍灣的總部抗議。區議員指，港鐵物業管理質素差劣，又錯誤估算開支，管理費水平不合理。 盈餘超過1,280萬元 協助日出康城領都小業主的將軍澳區議員張美雄指出，港鐵上蓋物業管理費向來偏高，收費亦不透明。領都今年大幅加管理費達9.84%，比同區屋苑天晉的管理費加幅9.1%還要高，以實用面積718呎（建築945呎）單位為例，原本管理費為$1,824，增加費用至$2,004，增幅之大對小業主造成很大負擔。 小業主批評，港鐵物管經常以錯誤估算開支（包括低估收入，高估開支）的方式去誤導小業主加管理費逼切性，以從中獲取經理人酬金等收益。直至2018年9月30日，領都屋苑累積盈餘超過1,280萬元，過去2015年至2017年亦曾連續三年凍結管理費，財政穩健，並無逼切性大幅增加管理費一成。 張美雄續指，過往一直收到大批業主投訴港鐵物管差劣，執修工程緩慢。現時港鐵管轄的屋苑經理人酬金是8%，遠較市場其他物業管理公司的酬金高，連水電費等代支項目也從中抽取酬金，張形容港鐵「食人唔𧄌骨」。再者，港鐵屋苑的外判合約不透明，居民在不知情下被外判商收取額外行政費。 小業主要求港鐵檢討現時管理收費，包括調低經理人酬金至6%，並合理地豁免水電費等代支項目。"
20190111-39,20190111,39,昨晚六合彩開獎結果,昨晚六合彩開獎結果
20190111-40,20190111,40,蘋人誌：乾坤無明性別綑綁世界　束縛不了粵劇　王侯偉,蘋人誌：乾坤無明 性別綑綁世界　束縛不了粵劇　王侯偉 西九文化區戲曲中心啟用，過萬張開放日免費門票迅速派完。戲曲魅力不限於長輩，年輕一代也越來越多習戲之人。80後的王侯偉與90後的蔡蔚珊，均是本地培訓的粵劇演員，一男一女，舞台上卻專攻異性角色。當「乾旦」遇上「坤生」，台燈亮，鑼鼓響，「雄兔腳撲朔，雌兔眼迷離，兩兔傍地走，安能辨我是雄雌？」 撰文：黎家怡 攝影：黃奕聰 演旦角的男人「我最叻係扮女人」 「本是女嬌娥，偏生作男兒漢」。袁富華在電影《翠絲》飾演打鈴哥一角令人驚艷，更贏得第55屆金馬獎最佳男配角。角色以乾旦的行當登台，用「子喉」唱出跨性別心聲。造手背後，聲線原來出於代唱——來自香港現役專攻旦角的粵劇男演員王侯偉（Paris）。 80後的王侯偉，畢業於香港演藝學院，多年來活躍於統籌粵劇戲曲相關的電影拍攝。獲監製舒琪邀請參與《翠絲》製作，他稱讚電影將跨性別人士拍得正面、無挖苦，「性小眾本來就正面，拍得正面亦都係正常，只係好多人都用唔正面的角度去睇，正如我做『男旦』一樣」。 「性小眾本來就正面」 王侯偉走上乾旦之路，可說是受母親啟蒙。其母是粵劇愛好者，家中收藏大量粵曲錄音帶。小時候，他幫忙做家務打掃時，總愛挑一齣劇播着相伴。耳濡目染，年紀輕輕的他已聽過《紫釵記》、《帝女花》、《梁祝》等戲寶，更在不知不覺間倒背如流。相對於粵劇的衣飾華美，最先打動王侯偉的是唱詞，尤其喜歡旦角的部份。隨着高中修讀中國文學，王侯偉對粵劇的興趣有增無減，甚至會看錄影帶跟着學造手。他曾報讀在藝術中心上課的粵曲班，兼習子喉平喉、生角旦角；會考後一度報考演藝學院的粵劇課程，並選擇以「旦角」作為自己的行當，惟當時主教老師擔心男旦無出路，建議轉唱平喉攻生角，乾旦之路未獲青睞。預科畢業後，他再報考演藝，卻選了電影電視學院，其間為自小習旦角的譚詠倫拍攝紀錄片，後來成為紀錄片《乾旦路》的雛形，而自己也成為導演卓翔鏡頭下的一個人物 。 2013年，演藝成立戲曲學院，提供四年制戲曲藝術學士課程，王侯偉再次投考旦角。隨着《乾旦路》發佈和個人技藝成長，今次終於如願。畢業時，老師亦對他甚為滿意，向行家介紹他是「香港唯一演藝出嚟嘅專業男花旦」。雖然如此，王侯偉承認戲行對乾旦需求低，「已經有咁多女花旦可以揀，點解要揀一個男花旦呢？」然而，假聲並非人人皆有，他雖不覺自己矜貴，但承認「通常男旦都容易奪目、容易攞彩，因為好少男扮女」，「我唱平喉大家都欣賞，但可能唔會特別眼前一亮；當我企出嚟，唱子喉，人哋真係會用amazing嘅眼光睇」。 要將旦角演得神似，王侯偉必須越過身體的限制。五呎七吋高的他，腳板也大，走台步時便要壓得再細一點。又如手掌，他會刻意將手指收進掌心，做成蘭花掌，看起來嬌小一些，讓旦角姿態更有說服力。學戲之初，他投入到連拿起杯子喝茶都要勾起尾指，招來母親責備，「仔你做戲還做戲，平日咁樣就會畀人笑」。孩子內心的回應卻是「越唔畀我做，越係要做」。他解釋自己並非刻意叛逆，而是擇善固執，「嗰件事明明係冇錯，點解唔畀我做啫？」 「我唔覺自己好矜貴」 王侯偉現在會清晰劃分身份，舞台即使女兒身，現實世界也要避免娘娘腔。他日常生活上收起蘭花手，反而迫出表演的盡情，肆無忌憚地展現陰柔一面。他深信，生活和舞台應該分開，並以張國榮為例——觀眾喜歡一個演員是欣賞其幕前表現，不會因為他現實中是同性戀而有所減退。 「唔好理佢男旦定女旦，演到好角色就係好的旦角」，王侯偉如此相信這些年一直專攻的行當。他認為，世界應該多元，每一個人都有不同面向，有時粗豪有時陰柔。香港乾旦雖少，但他從不以「唯一」、「最後」自居。 「我唔覺得自己好矜貴，只不過係人表演都會拎自己最叻嘅嘢出嚟，我最叻就係扮女人，so what？」  蘋果日報×立場
20190111-41,20190111,41,演小生的女人蔡蔚珊：性別模糊好吸引,演小生的女人 蔡蔚珊：性別模糊好吸引 《翠絲》中與「打鈴哥」相對的，有惠英紅飾演的安宜。該角色是女性，也是粵劇業餘唱家。她在家練功舞劍有如武生，台上演出又是風姿綽約的花旦，可見表演角色的性別流變。現實中，與「乾旦」相對的，有專攻生角的粵劇女演員，稱為「坤生」，其中最為人識的大概是任劍輝。戲曲學院前院長李小良曾稱許90後的蔡蔚珊（藝名「千珊」），有能力成為任劍輝後的「女小生接班人」。 為探訪老人院習粵劇 與王侯偉的背景迥異，千珊出身富裕，父母創立日本語學校，她自小就讀國際學校，英文、日文程度都比中文好。學藝之前，她對粵劇可謂毫無印象。高小時，她探訪老人院，以才藝表演𠱁長者開心。事後她問駐場姑娘，老人家喜歡看甚麼，好讓她準備下次表演。「老人家喜歡聽粵曲呀！」千珊母親即鼓勵她與妹妹一起上兒童粵劇班。千珊一開始攻旦角，但數月後老師即根據其聲線、樣貌和身高判斷，建議她轉行攻生角，「一開始都唔肯㗎，因為女仔會貪靚，覺得花旦嘅服裝同頭飾都好靚」，在老師推薦下，她看到任劍輝的演出，便覺得生角「好有型」，不妨一試。 第一次上台演出卻不太有型。她仍記得，當時戲服很重，頭髮勒得又緊，還要「揈水髮」。演出開始不過十分鐘，她已經非常不適，勉強繼續唱下去，完場一踏入虎度門立即嘔吐。明明是痛苦經歷，千珊卻帶笑回憶：「係好辛苦，但一上到台就有一種adrenaline（腎上腺素）令你繼續做，嗰種感覺令你好留戀。」直至大學畢業，適逢演藝學院開辦戲曲學院，她獲前輩推薦並獲取錄。隨着演出機會漸多，自信心漸長，她畢業後創辦劇團，全職演戲。 要以女兒身演生角，千珊認為有難處，亦有優勢。女性下半身較重，台上跳躍翻騰的動作，男演員輕而易舉，女生卻不易做到。可是「片腿」本是生角基本功，她只得勤做練習，克服體格限制。同時，她平日看電影時也會格外留意男性角色的演繹，從中了解男性的思想情感世界。 相對「乾旦」受到貶斥，「坤生」在香港戲行卻甚為普遍。這當然跟任白地位有關，任劍輝女文武生形象深入民心，香港觀眾對此有種眷戀情懷，看多了，看慣了，女演員做生角也變成自然事。千珊也欣賞任姐，「她演繹同唱歌都好man，但又帶有啲脂粉味。呢種模糊嘅感覺，好吸引」。成功的坤生，既要帶點脂粉味，同時又保持到英俊瀟灑的感覺。千珊認為坤生最適合扮演癡情、儒雅、風度翩翩的小生角色，「有時男演員未必演繹得咁貼切。女文武生的演繹，觀眾會睇得如癡如醉」。 「落咗妝就做返自己」 說到性別模糊的感覺， 千珊數年前曾與王侯偉同台。當乾旦遇上坤生，兩個演員性別逆轉於舞台交鋒，令她非常難忘。二人共演折子戲《寶蓮燈》，還要談情，她坦言有點尷尬，「大家需要有眼神交流，但又唔知點樣交流」。 她形容，與女花旦合作多，同性談情不成問題；但面對男花旦，反感到迷失，一時分不清對手是男是女，「可能當時我膚淺啲，𠵱家再做可能會好啲，其實當你投入角色之後，你都唔會理個演員係男係女」。千珊相信，舞台歸舞台，生活歸生活，台上的戲演得再逼真神似，「都唔係演緊自己」。舞台訓練雖不可能對生活完全毫無影響，但演員正要懂得抽離。靈活穿梭於舞台現實是必要，反正戲也沒有落幕的一天。 「舞台上，我會盡心盡力演好嗰個角色，但落咗妝，做返自己，又係另一個角色。」 蘋果日報×立場
20190111-42,20190111,42,社會專題：港每年鑄幣　花千萬公帑毫子硬幣　頂心頂肺,社會專題：港每年鑄幣　花千萬公帑 毫子硬幣　頂心頂肺 金管局年花約千萬公帑鑄造新毫子，但《蘋果》測試發現商店拒收毫子情況嚴重，八成商舖拒收一毫或兩毫硬幣，甚至有店舖連五毫亦拒收，市民對手執合法散銀竟遭拒用感不滿，店方卻也滿肚苦水。有學者認為貨幣貶值嚴重，一、兩毫硬幣已失價值，建議停用小額貨幣兼推廣電子貨幣，市民則希望能增派散銀車回收市民手上「神沙」。 記者：金敏琍、徐雲庭、謝頌昕 歐洲多國近年棄用仙幣，意大利本月起亦停鑄一仙歐元，但本港每年仍耗用大量公帑鑄造新幣。在2007至2017年間，本港一毫、二毫及五毫硬幣總數由31.4億枚增加21%至38.1億枚，由於銀行紛紛向存入散銀用戶收手續費，市民慨嘆散銀難以使用。 記者實測八成店拒收 為了解實況，記者近日到九龍城及油尖旺巡視11間店舖，包括麵包店、文具店、茶餐廳及小食店等，發現當中九間（八成）店舖都拒收一毫及兩毫，其中一間連五毫亦拒收，只有美心西餅及另一登山用品店願意收毫子。 拒收毫子店舖中以九龍城德昌魚蛋粉最「決絕」，收銀處貼出通告寫明不收一毫、兩毫及五毫輔幣。記者測試時曾兩度光顧，結賬時女收銀員均拒絕毫子，記者問原因，對方指着通告堅持不收。追問若不夠錢付賬怎辦？收銀阿姐回應指：「咁你咪下次嚟先畀返錢囉，總之毫子我哋唔收好耐喇！」 獅子石道麵包小店W.Bakery女收銀員亦拒收一毫兩毫，寧願不做記者生意也不願收散銀：「你同我講冇用，我要遵從老闆吩咐。」記者追問為何拒收屬合法貨幣的毫子？她答：「你攞去銀行要收手續費呀，好多地方都唔收啦。」 有多間分店的凱施餅店，衙前圍道分店未有貼出拒收毫子告示，但女店員同樣拒收一毫兩毫，指公司約一個月前改政策不再收毫子。測試期間，一名男顧客剛巧聽到女店員不收毫子而顯得極度不滿：「點解你冇貼通告（唔收毫子）？你唔寫低我當你收吖嘛，唔收我告你啊！」尖沙嘴區四間賣珍珠奶茶及小食的店舖同樣不收取一、兩毫。 金管局透露由於日常交易支付需求，加上旅客增長令更多硬幣隨旅客流失海外，單是2017年當局便要鑄造一億枚一毫及四千萬枚五毫新硬幣。局方未有披露鑄幣開支，但據美國及意大利經驗，鑄毫子最少需一至四毫成本，故記者估計金管局每年至少要花費逾千萬公帑去鑄造1.4億個新毫子。 經濟學家倡政府停用 金管局承認過去三年共收到十宗有關商販拒收硬幣的投訴，但指店方有權不收；對於會否考慮停鑄一毫或兩毫，金管局回應說會因應市場需求而調整硬幣發行。但金管局強調2014年起已派出兩輛收銀車巡迴全港18區，免費回收市民手上硬幣。 獨立經濟學家關焯照稱由於通脹，一毫及兩毫已近乎無價值，銀行也對存入零錢存戶收手續費，對消費者不公。他認為政府應考慮停用一毫及兩毫硬幣，因可促進交易效率及推廣電子貨幣，也可減少浪費公帑。關相信一毫硬幣的鑄造成本可能高於其幣值，不符成本效益。立法會議員鄺俊宇則建議當局增加收銀車數目及加強推廣宣傳，助市民回收散銀。
20190111-43,20190111,43,小額硬幣成本比幣值高,"小額硬幣成本比幣值高 香港30年前起停用五仙硬幣，之後沒再淘汰過其他毫子，但其實香港的一毫兩毫早已失去購買力，更被商戶嫌棄拒收。其實歐美國家同樣面對類似困局，並以一仙（one penny）問題最嚴重，因一仙鑄造成本較硬幣本身幣值還要高四成至三倍半，令鑄幣成為蝕本生意，每年浪費大量公帑。 南韓擬全面淘汰硬幣 新西蘭、澳洲、加拿大等國於1987年起，相繼停用一仙硬幣，今年1月連意大利亦停止鑄造新一仙及二仙歐元，有報道更指南韓有意最快於明年開始全面淘汰硬幣，望改用紙幣或電子貨幣，以節省鑄造新幣的公帑開支及促進電子交易。 以意大利為例，有報道指每枚歐元一仙及二仙硬幣的鑄造成本，分別達4.5及5.2歐仙，故鑄造這兩款小額硬幣成本較其幣值更高，有專家曾預料意大利停鑄一、二歐仙後，每年可節省約2,000萬歐元，亦有助改善貨物交易效率。事實上，加拿大繼2013年停用一仙硬幣後正有意進一步停用五仙硬幣，英國亦曾考慮停用英鎊一仙。"
20190111-44,20190111,44,拒收商戶：阻地方又冇用,拒收商戶：阻地方又冇用 銀行相繼對存入大量硬幣的客戶收手續費，令小店直接受害被迫積存大量毫子，記者發現商戶無論是否拒收一毫兩毫，都要面對不同的苦惱。例如願意收毫子的超市每天要花額外人手去點算大量硬幣，拒收毫子的小店亦要面對顧客的怒氣及責難。有荳品店女店主直言希望金管局的收銀車能加密巡迴各區回收硬幣，以解商戶之苦，助小店恢復收取毫子，減少與客人磨擦。 承認曾遭客人責難 現時超市產品為求做到最低定價以及令客人覺得抵買，定價的尾數常包括毫子，造成很多涉毫子的交易。佳寶負責人盧先生指該店專做街坊生意，故承諾必定繼續收客人的一毫兩毫。他笑稱約十年前當電子貨幣仍未盛行時，佳寶因每天收到太多硬幣難以點算，曾經要把硬幣分類後再放上磅去秤，按重量估算其總值，直到近年散銀量才減少。但盧對毫子仍是又愛又恨，因太少則不夠用，太多則要想辦法處理：「確係麻煩咗啲，每晚結算時要花人手去數錢，不過熟手的話十幾分鐘就可以搞掂！」 不少店舖如公和荳品則早已拒收毫子。公和荳品老闆潘小姐稱十年前已拒收一毫兩毫，對此感到無奈：「我寧願收少客人五毫，都唔想收一毫兩毫啊……因會很阻地方，而且毫子其實冇乜用！」她雖然已改變產品定價放棄毫子的價位免生爭拗，但承認亦曾遇上客人責難：「有客人唔開心，會話毫子都係錢，點解唔用得呀？」她只望客人能體諒商戶困境。潘小姐認為最好是金管局出手解決兩難，即是加密收銀車巡迴各區的次數，若政府願這樣做，潘女指會考慮改變政策，重新收取客人的毫子。
