key,date,article_daily_id,title,text
20190111-136,20190111,136,克莉絲汀或罷免八董事,克莉絲汀或罷免八董事 內地麵包店克莉絲汀（1210）指接獲一股東Sino Century Universal Corporation通知，要求召開股東特別大會，罷免董事包括朱永寧、林銘田、詹益昇、徐志明、卓啟明、洪敦清、周美林、陳石，並委任羅田安及秦華，未有提及原因。Sino Century Universal Corporation持有18.26%股權。
20190111-137,20190111,137,"對沖人生：世界首富1萬變1,200萬 - 錢志健","對沖人生：世界首富1萬變1,200萬 - 錢志健 網上購物平台亞馬遜創辦人、世界首富Jeff Bezos和妻子Mackenzie Bezos宣佈離婚，惹起不少人關注。Jeff曾經是D E Shaw量化對沖基金高級副總裁，當時只是30歲，認識了同事Mackenzie Bezos，技術上Jeff是她的上司。 下筆此刻，亞馬遜再次跑贏微軟及蘋果，成為全球市值最大的公司。在股價最「靚位」的時候宣佈離婚，巧合到「冇朋友」。Jeff Bezos 94年創業，97年把亞馬遜上市，你或有興趣知道首富的財產分配有沒有「傾掂數」？華盛頓州的法例，聽聞就是結婚後所賺取的，及擁有的共同資產，就是一人一半擁有。 筆者更關注亞馬遜是如何起家的。那些年的1994，即互聯網剛準備開始的時候，Jeff Bezos向60準位投資者講解亞馬遜的理念，網上送書，每一手投資額5萬美元，理解上是20股為最初發行股數，集資一百萬美元。 Jeff的父母押下約五股，便是亞馬遜最大股東之一。1997年以每股18美元的招股價，亞馬遜股價多次折細。10,000美元價值投放在亞馬遜的IPO，到2018年8月尾，帶來1,200多萬美元的回報，升幅高達120,000%。 建倉要選強勢主力股 同一個10,000美元，你可買一架二手保時捷在公路上「威威」，20多年後保時捷或已成為歷史古董。強勢主力股，絕對是建倉根基。 筆者也說過，量子基金創辦人索羅斯在1969-1999那30年黃金時期的基金表現，同樣驚人。每年平均34%的複式增長，1969年投放100萬美元進入Quantum Fund，1999年的回報為65億美元，這是複式增長的「潛在力量」，而量子基金已變為家族資產多時，不再接受外來投資者了。 筆者欣賞索羅斯，因為錢滾錢的難度相對高：宏觀與微觀世界經濟的脈動，投資決定要「刺中核心」。索羅斯在1992年一役，沽空英鎊可算是「一舉成名」；而更重要的，就是無論是選擇股票作長短交易、衍生工具入市或貨幣投機，做對的時候，他毫不猶豫再加注或槓桿力度。在投資世界，最難的事情就是力保不失。太多投資者選擇容易「蝕本」的策略，何苦？越誠實的說話，通常沒有人願意相信，複雜的結構性產品或可保本，難以增值。令人有相對潛在回報的投資，始終是選擇高潛力的「主力股」。Happy trading！ 錢志健 資深對沖基金經理 mailto:mdehedgecenter@gmail.com 本欄逢周五刊出"
20190111-138,20190111,138,曾淵滄專欄：後市繫於三個因素 - 曾淵滄,"曾淵滄專欄：後市繫於三個因素 - 曾淵滄 恒指4天升1,400點，開始遇上短期超賣壓力是正常的，也是一個機會讓投資者整理一下自己的投資組合。 當前影響港股的力量有三大方向，一是中國中央政府開始救市；二是中美貿易戰；三是加息的預期。 中央救市是肯定的，經過2018年一整年的去槓桿，基本上各式各樣的投機泡沫已消失，反之經濟衰退則已經很明顯，救市是一定要做的事，而且力度不會小，更需要全方位進行，採取類似2008年應付金融海嘯的手段。 除了去槓桿所帶來的打擊之外，中美貿易戰肯定也打擊投資信心及工廠接單的壓力。已經出手的動作有：降準1%、鼓勵國民買車買電器，昨日我提到基建也一定加快加多。此外，我相信另一些事可能做的會是放寬打壓房地產市場，讓樓價再度上升。樓價升，有樓者感到比以前更有錢了，消費就會增加。還有，基建也不一定只是建鐵路，也包括建房屋、環保基建、污水、垃圾處理……大家可以開始留意有關的股份。 中美貿易戰是長期戰爭，但是，絕對不會打到兩敗俱傷，而是打打停停。目前美國已經佔上風，中國會逐步應美國的要求開放。實際上，開放本來就應該是中共最高的大方向，40年前已經在講改革開放。中國越開放，港股越有機會，趁開放進軍內地市場，其中一家百年英資老店太古（019）應該很有潛力。 加息預期是最難預測的，聯儲局的傳統就是不讓你猜得中，因此，聯儲局的官員會長期忽鷹忽鴿。幸好，就算再加，也已經是尾聲了。 曾淵滄 財經評論員"
20190111-139,20190111,139,投資學堂：小米大跌背後陰謀 - 譚紹興,投資學堂：小米大跌背後陰謀 - 譚紹興 近日小米（1810）股價急瀉，相對17元的招股價，累積跌幅令市場嘩然。 仍記得小米上市當日，多位本港財金要員為其站台，氣勢一時無兩，甚至在小米上市首日跌破招股價時，財政司司長陳茂波更表示：「不需要為短期的波動而過份擔心」云云！而近日司長在電子傳媒中，不斷叫大家將波交給他，不知一眾認購了小米的散戶，可否將這個波交給司長代為解決？ 近期小米股價急跌，除了因多大間大行相繼調低評級及目標價外，另一個更重要的原因便是上市時的限售股解禁。過往較少出現大行在股份解禁前，一齊唱淡的情況，而今次這些大行遲唔出、早唔出，偏偏要等到禁售期完結前，才齊齊大合奏唱淡小米，從陰謀論角度猜測，會否是合謀焗機構投資者在年初清貨，跟着換馬其他股份，好讓大行賺佣金？據彭博估計，這批解禁股份數量達30億股，粗略推算，一沽一買，由這換馬而來的佣金真不少！ 另一方面，雖然大行齊齊出報告唱淡小米，但細閱這些研究報告，不難察覺小米已開始跌過龍，投資價值逐漸浮現，正如前幾日類似情況在吉利（175）出現時，筆者亦有趁低吸納搏反彈。 只是這次情況略有不同，因為這兩日小米大跌時的成交只得5、6億股，相對解禁股數量達30億，反映大戶應尚未沽清，小米後市仍有壓力，欲撈底的朋友宜觀望其成交變化！ 筆者持有小米的期權 譚紹興 美國精算師  http://fb.com/tamsiuhing  本欄逢周五刊出
20190111-140,20190111,140,廣告經綸：Burberry切勿火上加油 - 文廸晞,廣告經綸：Burberry切勿火上加油 - 文廸晞 這幾天在國內鬧得火熱的Burberry賀年廣告，越睇就越似TVB四十年前的迷離恐怖系列《幻海奇情》之《死之境界》。 該單元由周潤發主演，講述一個關於鼠疫的故事，成條村的人都死晒，只剩他一人避過此劫，但他不知道身邊的家人和村民原來全部都是鬼魂，直至當他出席一位村民的婚禮，拍攝合照時，才發覺在相機內完全看不到身旁的親友……諗番起都感到毛管戙。那張招牌劇照，恰巧跟這次Burberry的出事照片，無論從佈局、人數、氣氛、男女比例、以至高矮排列，都有八九成相似。說不定，攝影師Ethan James Green在拍攝前也「特地」找來這張劇照來做了個參考，真係大整蠱。 的而且確，文化唔係講玩，就好似最近D&G和今次Burberry以鬼佬眼光看中國人和中國文化，一旦出現嚴重的差距，只會雞同鴨講，甚或唔講好過講，講多就一定錯多。 這張賀年照，相信十個中國人十個也看得出當中出現的問題，看不出的或不願意接受的大概只有那些品牌的歐洲高層罷了。經營那些高級品牌的心態可能皆是：一路以來都銷量不錯、中國市場大、潛力高，加上過新年更是全年的一個高潮位，不是更應該把握這時機？一定要用著名國際攝影師、投放高昂製作費、聘用當時得令的明星作主角……如果唔用一些與別不同的手法，如何可以顯露創意、值回票價呢？仲刻意在過年前足足一個多月就急不及待推出這個廣告，的確「用心良苦」。如今出事了，希望不要好似D&G那樣錯上加錯。 廣告出錯並不是問題的癥結，品牌的錯誤回應，往往才是最致命的一擊。計我話，今次Burberry相比起D&G的愚蠢、自大、侮辱，犯的其實只是Tone&Manner上小錯誤，頂多就是浪費了今次的宣傳費用，最簡單的做法就是不作回應，抽起那個廣告，用social listening監察，讓它靜靜地die down然後消失，以後唔好再犯就是了。 文迪晞
20190111-141,20190111,141,基金觀點：亞太房託見吸引力 - 黃惠敏,基金觀點：亞太房託見吸引力 - 黃惠敏 環球經濟滿佈陰霾，亞太區房地產信託基金（REITs）防守性高，提供穩定及持續現金流，尤其看好擁有新加坡及澳洲寫字樓物業，或持有本港零售物業的房託公司。 新加坡及澳洲寫字樓市場的供求偏緊，特別是出租率偏高的甲級商廈，在供應匱乏及需求殷切兩大因素推動下，寫字樓業主仍能有能力提高租金，故對持有兩地寫字樓物業的房託有正面支持。 本港零售市場方面，隨着港珠澳大橋及高鐵通車，內地遊客來港更加方便及快捷，相信零售市道會繼續蓬勃，增加零售業主的加租能力，故看好相關的房託前景。不過，我們對泰國的房託及澳洲住宅樓市前景看法較審慎。 環球經濟下行風險加劇，加上通脹溫和，未來息率只會緩慢上升，更重要是聯儲局會預先跟市場溝通，故市場均能預期息口將於何時見頂。同時，現時房託平均負債比率都低於危機前，且債務均是長年期定息貸款，這種保守的債務結構可以減低利率上升及市場波動帶來的衝擊。 目前亞太區房託的平均回報率約5至6厘，較其他資產類別更吸引，適合追求高息的投資者及退休人士，預期房託需求會持續高企。具備低風險特色的亞太區房託可為投資者提供一個分散風險的投資選擇。 黃惠敏 宏利資產管理地區房地產投資信託組合專家
20190111-142,20190111,142,異動空間：落後藥股蓄勢彈 - 魏力,異動空間：落後藥股蓄勢彈 - 魏力 個市一星期彈逾千點，除了中美放鬆銀根外，就是憧憬貿易戰談判會有實質成果。結果傾咗三日，商務部只出了一份簡單聲明，比着早兩個月，起碼即日唔見500點。不過，近日低殘股急彈，公用股回軟，反映投資者開始risk-on，結果將中美「無協議」解讀成「有得繼續傾」，加上美滙急跌，人仔抽穿6.8，帶個市低開後又抽上去。 值得留意，周三大批熊仔被殺後，資金繼續推落去買熊，牛熊街貨比例維持四六比，逆向思維下，大戶再推上的機會仍較高。 板塊方面，醫藥股報復式反彈，龍頭中生製藥（1177）、藥明生物（2269）率先彈起，較落後的醫療設備股，可以趁未起動率先進駐。愛康醫療（1789）為中國骨關節植入物龍頭製造商，以銷量計為中國市場第一，市佔率15%，加上為中國唯一一家將3D打印骨科植入物商業化的公司，無論增長及估值均可看高一線。 走勢方面，愛康醫療股價看似仍在尋底，實際上技術走勢已見明顯改善，14 RSI開始出現底背馳，MACD亦將重現牛差，反映上升動力正在累積，一旦股價重上4.2元樓上，將現買入訊號，首個反彈目標為4.5元，反之失守3.75元止蝕。 筆者為證監會持牌人，未持有上述股份權益 魏力  http://fb.com/2012jason  本欄逢周一、五刊出
20190111-143,20190111,143,經濟客飯：唱日圓去旅行攻略 - 曾國平,經濟客飯：唱日圓去旅行攻略 - 曾國平 過去短短5年，港元兌日圓最高試過1兌16，最低大約1兌13，上落波幅超過兩成，不是小數目。看近一點，隨着近期股票市場波幅上升，日圓滙率亦隨之大上大落，就如早前一日內急升幾個百份點。 有異於其他外幣，喜歡去日本的香港人耐不耐就要用日圓，一個非常實際的問題，就是面對日圓長期短期的變化，應該幾時同唱幾多日圓？ 日圓有趣之處在於低息，長期以來都是套息交易的融資貨幣，亦即借來買入其他高息貨幣（如澳元紐元），賺取息差之餘再賺高息貨幣升值，一般情況下回報非常吸引。不過世界好公平，偶一為之之低息貨幣就會急升令套息交易輸到PK。 技術一點講，日圓作為低息貨幣，其變化的偏值（skewness）高，急升比急跌常見。相對來講，高息貨幣急跌比急升機會大。 假設你有一筆後備現金，其中要有幾多港幣幾多日圓？是全揸港幣到旅行前才去唱錢，還是持有一筆日圓以備不時之需？去旅行要一早計劃，為免出發前撞正日圓急升，一個做法是儲定一筆日圓留待旅行時用。由於買賣外滙有交易成本，儲日圓不用太頻密，例如你預一年用大約六十萬日圓到日本玩，每月出糧時買入五萬日圓撥入「日本旅行基金」就可以了。 曾國平 美國維珍尼亞理工大學經濟系副教授  http://fb.com/economics3.0/  本欄逢周五刊出
20190111-144,20190111,144,會師中環：恒大谷大數要過兩關 - 神仙丁,會師中環：恒大谷大數要過兩關 - 神仙丁 早陣子，中國恒大（3333）為谷高灣仔恒大中心的估值，以方便獲取更高融資額，竟然自己加自己租，向自行租用的樓層大幅加租三倍，令整體租金收入增加及估值上升。現時，物業估值的兩個主要方法是「租金折現法」及「市場比較法」，今次恒大就是利用前者作估值基礎，當加租後，大廈的租金收入折現值和物業估值就會上升，更易符合融資的財務指標。 當然要如此「做手腳」谷高估值不是易事，因為恒大至少要過兩關：物業估價公司和核數師。前者不是我的專業，不便評論，但後者我可以講兩句。物業估值之所以要過核數師一關，是因為其價值會反映於財務報表之上，而報表又是銀行信貸風險評估的重要指標，所以若欠核數師首肯，都唔使旨意可以借到錢。一般來說，核數師都會與估價公司事先溝通，決定一個雙方都接受的估價。 今次恒大中心估值的主要問題，是租客皆為恒大或華人置業（127）的公司，這種自己友兼大幅脫離市價的交易，絕對稱不上「市場價格交易」，這亦是估值的大忌，照道理是沒有參值，理應排除在外。不過，這只是理論上的考慮，實際上估價公司和核數師都係恒大請返來，大家坐埋一枱，自然萬事有商量，易搞得多。 神仙丁 《審計搵丁》負責人  http://facebook.com/AuditSlave/  本欄逢周五刊出
20190111-145,20190111,145,一分鐘投資筆記：中美找到妥協時間點 - 徐風,一分鐘投資筆記：中美找到妥協時間點 - 徐風 假如去年的財經主題是中美貿易衝突，今年的主題，隨時是和好如初。 本人在上月一文《美國氣數已盡？》中，已表示去年支撐美國股市及經濟增長的動力，包括連番加息及量化緊縮致美元資金回流，及減稅提高國民及企業消費能力及回購股票等，今年已不復存在。加上去年因為這些因素推高增長率，致今年基數較大，美國繼續維持高速增長甚有難度。 特朗普留了一手的中美貿易戰，前半場「㩒住嚟砌」，希望速戰速決，令美國增加一個新的經濟增長火車頭。但中國則選擇以逸待勞，等到美國經濟放緩，才開始認真談判。然而，幸運之神似乎眷顧中國，貿易戰不到半年，已見美國經濟增長開始放緩，美股急跌，令聯儲局考慮減慢加息速度，讓中國有一口喘息空間。 去年市場還預期人民幣兌美元滙價有機會破「7算」，不過最近幾天，人民幣已升至6.8左右，離7算有近2000點子，可謂基本安全，亦令中國推動經濟或救市有更大的效果。早前央行即使降準放水，未令人民幣滙價有太大變動，以致於市場近日開始傳出利用財政政策救經濟，即減稅或消費補貼等，基於美國收水速度放緩，似乎可避免去年因「放水」致人民幣滙價急跌，市場憂慮資金外流問題，令救市效果事倍功半。 政治沒有永遠的朋友，也沒有永遠的敵人，只有永遠的利益。目前美國經濟增長放緩，需要減少貿易逆差拉高GDP，中國同樣需要美國人為Made in China買單，雙方都有妥協的需要，所以市場普遍預期，雙方能夠在二月底前達成實質協議，成為近日市場氣氛轉旺的原因。不過，假如這個預期有任何三長兩短，市場又會重返去年下半年一樣，死氣沉沉。 徐風  http://facebook.com/followsthewind/  本欄逢周五刊出
20190111-146,20190111,146,八十後投機客：熊二反彈目標29000 - 灝昇,八十後投機客：熊二反彈目標29000 - 灝昇 在中美各自救市的情況下，市場恐慌情緒暫見安定下來，最明顯的是在聯儲局放鴿表明會支持經濟後，一些高危級別的債務指標如S&P/LSTA U.S. Leveraged Loan 100 Index，其ETF BKLN.US及垃圾債ETF JNK.US都迅速回穩，完全回補12月跌幅。 不過情緒好轉不代表資金立即回到市場，美國3大指數距離12月頭仍有8%距離，反觀港股十二月都較美股強，而1月恒指打穿25000殺牛後，市場一面倒加熊，主流意見亦由趁低撈底變為趁高沽。傳統智慧教落，往往跌到你唔信就會反彈，升到你唔信先會回，睇怕一日仲有重熊想逢高造淡，個市都仲會吊吓命。 睇技術分析，之前提過wyckoff對長期收集形態，其中好重要的因素是收集形態會多次觸及甚至跌穿前底後急彈。暫時睇落國指和上證都完全符合這條件，恒指更為強，沒有觸底。分辦收集和再派發的關鍵在於收集形態會再次試底，所以國指和上證為形成收集形態得成形打了支強心針。 看官別心急入市，即使試底完成，在未完成第三段前仍有破壞的可能性。而在wyckoff收集形態中第二階段試底後，往往會先挑戰前阻力（恒指27100，國指10900）後再慢慢回落，進入第三階段再試底部，震走跟風好友，那時更值入市。2008熊二反彈前亦同樣做出wcykoff 收集形態，之後由24000彈上28000點，如果今次重覆這個形態做出反彈，目標可以跌幅50%作目標（歷年熊二反彈皆於50%止步），那麼今次可以把29000作為熊二反彈目標。 灝昇  http://fb.com/speculatorjunior/  本欄逢周五刊出
20190111-147,20190111,147,【菜市場學】閃亮香夠平菊池糖蜜矜貴　教揀當造日本草莓,【菜市場學】閃亮香夠平菊池糖蜜矜貴　教揀當造日本草莓 【菜市場學】 每逢冬季，都是食日本士多啤梨的季節。因應市場需要，越來越多不同產地的日本士多啤梨入口。每年十二月至二月是日本士多啤梨當造月份，在林林總總的產品中，到底如何選擇呢？有請「進濤菓欄」的老闆娘Gigi Lau教路。 首先Gigi講解今年日本士多啤梨主要產地來源，「日本最主要的士多啤梨產地有福岡、靜岡、熊本、奈良、佐賀和德島縣，如大家熟悉的福岡甜王、靜岡的閃亮香、熊本縣的熊香和露之水滴，還有菊池糖蜜士多啤梨、佐賀有穗之香和淡雪、奈良縣古都華及德島縣的佐那河等等。」 甜王不太甜　售價親民 如何選擇心水士多啤梨？Gigi教路要視乎個人口味及售價，「好像是福岡甜王，帶微酸，不要被它的名字騙到，其實它不是很甜，只是它比較普遍，產量多，價錢又大眾化，所以為人喜愛；至於靜岡縣的閃亮香，表面光亮，相對其他平價士多啤梨，它的香味濃郁，亦較甜。」中價之選，代表有佐賀淡雪，它顏色很吸引，是粉紅色，但味道偏淡，不太甜，如果喜歡甜的士多啤梨，這不是最好的選擇。另外，唐津的白寶石，是白色士多啤梨，比較罕有，它的特點是大粒，甜度足，而且飽滿多汁。 另外，特色之選有奈良特產三色士多啤梨，可一次過品嚐三種不同味道，有淡雪、白珍珠和紅色的古都華，其中以紅色的古都華最吸引，它味道濃郁，肉質結實，香甜。老闆娘特別推介熊本菊池糖蜜士多啤梨，「由於培植方法特別，而且所需工夫和時間亦較長，農民特別加了糖入肥料當中，令它帶有蜜糖味，所以菊池十分香甜。它形狀不規則，口感紮實，多汁、香味濃郁屬高甜度，入口有淡淡蜜糖味。」 葉綠為好貨　具保護作用 士多啤梨有很多種類，Gigi有小貼士︰「挑選士多啤梨不要看它的顏色和形狀，不同品種的士多啤梨都會有分別，主要看葉是否呈綠色，這代表士多啤梨是否新鮮。」士多啤梨只要用清水洗就好，揭起葉子清洗入面的泥塵。此外，清洗時不要撕走它的葉子，這會令士多啤梨失去保護，容易變壞。新鮮的士多啤梨一般要放在雪櫃，可存放三至四天，不過Gigi建議買回來後最好盡快食用。 Gigi表示，士多啤梨會因應產量和店舖，價格會有所不同。在眾多士多啤梨當中，她總結：「如果喜歡甜味重的可選古都華紅色士多啤梨，如果想要香味較濃郁但帶微酸的可選淡雪。如果要味道特別的，可選菊池糖蜜。至於稀有及矜貴之選，必試唐津的白寶石。」 進濤菓欄 油麻地新填地街230號 採訪︰鄭紫珊 攝影︰潘志恆
20190111-148,20190111,148,【牙痛唔好喊】淨係刷牙太表面　牙縫清潔最重要,【牙痛唔好喊】淨係刷牙太表面　牙縫清潔最重要 【特約報道】每日刷牙清潔口腔是常識吧！但刷牙真係可以有效預防牙縫藏邋遢嗎？答案是——唔夠囉！刷牙只可以清潔牙齒表面，要對付最容易藏污納垢的牙縫，就要出動埋牙線加漱口水，做齊潔齒三步曲，才可以好好保護一口陪伴你一生一世的牙齒。 口腔大敵牙菌膜 日常潔齒功夫做唔足，便很容易滋生牙菌膜。牙菌膜是由一層薄薄的口腔細菌組成的軟膜，會不斷生長並黏附在牙齒表面、牙齦及假牙上，積聚過多就有機會引致牙周病或蛀牙等口腔問題。隱藏在牙縫中的牙菌膜，單靠刷牙或使用牙籤難以潔淨，最簡單有效的方法，就是刷牙後再用牙線或牙線棒清潔牙縫三角位及鄰面，最後以有預防牙菌膜功效的漱口水漱口，那就最為潔淨了。 牙線棒方便易用　更勝牙籤 美國牙醫學會 (American Dental Association)建議大家進餐後，記得用牙線或牙線棒清潔牙縫三角位及鄰面，否則便有2/5個牙齒表面未能清潔，讓食物殘渣有機會留在牙縫之間。可惜坊間的餐廳一般只會免費提供牙籤於餐枱上，但牙籤始終未能徹底清潔牙縫及牙齒鄰面，而且容易令牙縫愈整愈大，建議自備牙線棒代替牙籤，一樣方便。牙線棒是結合了牙籤及牙線的好發明，一端是尖細的軟膠設計，可代替牙籤清走食物殘渣之餘又不會對牙齦構成壓力；另一端細滑強韌的牙線，有助於通過牙與牙之間的緊密接觸點位置，牙線棒呈弓型的設計可令牙線保持適合的鬆緊程度。 使用牙線棒時，先把牙線部份放在牙縫位置，再用溫柔的力度前後或左右緩緩拉動，把牙線盡量緊貼其中一則的牙齒鄰面，上下拉動把黏在牙齒鄰面的牙菌膜清除，用清水或紙巾清潔細菌後再到下一邊鄰面重複以上動作，直至所有牙縫及牙齒鄰面都清潔為止。牙線棒可說是傳統牙線的改良簡化輕便版，現時市售的牙線棒亦有獨立包裝之選，方便外出用餐後隨時使用。
