key,date,article_daily_id,title,text
20200706-0,20200706,0,港學者受訪　憂自我審查　《科學》：國安法損學術自由,港學者受訪　憂自我審查　 《科學》：國安法損學術自由 【本報訊】特首林鄭月娥聲稱港版國安法可讓香港「重回正軌」，她口中的正軌，可會是與內地的單一思想接軌？美國《科學》雜誌網站日前刊出有關港版國安法報道，受訪學者均憂慮國安法為本港學術界帶來恐慌，擔心人權及學術自由受到侵犯，甚至日後難以從海外聘請或招募到頂尖的教師或學生。大學管理層對國安法的取態，已顯示只有支持北京的人才能擔任大學領導。　 記者：鍾雅宜　張雅婷 港版國安法實施後，當局一直聲稱法律不影響一國兩制及高度自治等，但法例已引起學術界不安。《科學》雜誌引述現時於溫哥華英屬哥倫比亞大學工作的港大理學院前院長郭新稱，因法例條文不清晰，大眾不知道法例如何執行，而且太多不確定因素，令大學界感到憂慮。 擔心招聘人才遇困難 郭新擔心日後進行海外招聘時，難以游說對方稱在港工作可享有完全的學術自由；過去15年，香港的大學日漸獲公認為亞洲主要卓越學府，然而「我們可以保持這種優勢嗎？」 港大理學院院長艾宏思（Professor Matthew Evans）亦以個人身份發表意見，他預計在科學、法律或其他學術範疇中，若研究觸及可能違反港版國安法的情況，或會自我審查。即使科學範疇的招聘亦可能受到影響，日後說服非華裔人士來港亦可能出現問題。他甚至認為美國因應國安法作對香港作出的措施，亦可能影響科研設施的進口。 浸大傳理學院新聞系高級講師呂秉權表示，日後傳媒報道時或會受法例影響，若公佈可能令政府尷尬的數據，如通脹數據等，會否作特別處理。他甚至憂慮，大學管理層早前曾表明對新法例的支持，質疑是否代表日後只有支持北京的人士才能成為大學的領導層。 或影響國際學術合作 中大生命科學學院副教授陳竟明亦稱，法例或影響國際間的學術合作，因法例亦規範海外行為，憂心日後若與北京不歡迎的組織進行涉及環境和食品安全的聯合研究，交流或會受到影響。 報道亦引述了一位不具名的外籍科學家指出，作出一國兩制已死的嚴重及悲觀結論前需要時間觀察，但他同意，港版國安法條文含糊，已引致有能力離開的人移民出香港。 已退休的理大應用社會科學系助理教授兼香港民意研究所副行政總裁鍾劍華接受本報查詢時稱，學術界的憂慮不無道理，他舉例，從近年大學校長任命及教職員升遷的事件可見，高層升遷必定選擇「識做」之人，各間大學校長未必夠「硬淨」捍衞學術自由，敢於批評政府的學者亦會噤聲。 鍾又指港版國安法對學術界影響廣泛，如若有學者欲以港版國安法為研究項目申請撥款，恐怕只有單一研究方向，「如果研究正面影響或者可以審批」；一些邀請國安法關注團體的研討會亦會遭大學拒借出場地，更嚴重者，當大學教職員發表反對港版國安法學術言論，隨時遭內地生舉報。
20200706-1,20200706,1,英譯條文僭建　「universities」被監督,"英譯條文僭建　「universities」被監督 【本報訊】港區國安法草草刊憲立法，完整英文版條文「失蹤」多日，至上周五才出爐，惟中英文版不相符。條文第二章第九條列明須加強宣傳、指導、監督和管理的機構，和展開國家安全教育的媒介，條文的英文版比中文版多了「universities」（大學）一字。法律界人士批評立法態度兒戲；學者則認為事件反映內地針對大學院校的整頓特別關注。 學者：內地盼重點整頓 港區國安法條文第二章第九條列明「對學校、社會團體、媒體、網絡等涉及國家安全的事宜，香港特別行政區政府應當採取必要措施，加強宣傳、指導、監督和管理。」但英文版的同一條文中，須加強宣傳或指導的對象則包括「schools, universities, social organisations, the media, and the internet.」即英文版「僭建」出「universities」一字。 律政司司長鄭若驊早前聲稱，法例以中文版為準，而新華社本月1日發出的英文版本，條文亦有標明「universities」一字，相信港府是跟官媒英譯版繙譯。律政司昨日補充，國安法是全國性法律，由人大常委會制訂，法定語文以中文為主體。政府各政策局或部門執行條文時，若有需要，可向律政司尋求法律意見。 浸大新聞系高級講師呂秉權認為，條文的中英版本不同，是反映內地針對大學院校的「整頓」特別關注。北京當局期望國安法在港可以「無孔不入」，在英文版條文除了「schools」以外，同時列明「universities」，目的為顯示學校、尤其大學可能是內地希望重點整頓的地方，亦不希望讓港人有錯覺，以為被要求加強宣傳及指導的學校並不包括大學。 大律師黃宇逸表示，港區國安法屬全國性法律，英文版本只是譯本，不具法律效力，而中文用字比較簡潔，原文足以解釋英文的意思。資深大律師梁家傑就指，本港解釋法律會「兩害取其輕」，即大學不受第九條所述的宣傳、指導、監督和管理所涵蓋。然而，國安法由內地而立，未必與普通法般規範公權力，反而限制自由為目的，「治人工具，佢話乜就乜」，在此情況下，他認為毋須絞盡腦汁咬文嚼字。他又批評，事件顯示立法態度兒戲，律政司將新華社文本「照抄」，未有為立法把關。"
20200706-2,20200706,2,特朗普日內公佈針對華行動,特朗普日內公佈針對華行動 美國國會參眾兩院上周一致通過《香港自治法案》，但總統特朗普至今仍未簽署相關法案，彭博通訊社引述政府官員透露，特朗普正考慮兩至三項行動對付中國，預計日內公佈。 根據《香港自治法案》，美國將制裁任何協助損害香港自治的個人和公司，並懲罰與他們有業務來往的金融機構。不過法案提交特朗普審議後，他至今仍未就法案表態，根據程序他可簽署法案，或運用權力否決法案。彭博報道，一名政府官員上周末向記者透露，特朗普正考慮兩至三項針對中國的行動，預計很快會公佈詳情，更形容應該是日內而不是數周後才公佈，不過官員無說明相關行動的詳情或行動性質。 兩黨同關注　盼向京施壓 彭博形容，今次法案難得獲美國跨黨派一致支持，反映這問題獲兩黨議員優先關注，希望向北京施壓，改善貿易及人權問題。法案由民主黨籍馬里蘭州參議員范霍倫和共和黨籍賓州參議員圖米共同提出，圖米說：「毫無疑問我認為總統會簽署法案，我有信心可以有效執行。」 根據法案，國務院須每年向國會提交報告，列出「尋求破壞一國兩制」的官員及相關人士名單，總統有權凍結相關人士在美國的資產，並禁止他們入境。法案亦提供一年寬限期讓金融機構中斷與相關人士的商業合作，寬限期過後，若金融機構繼續合作，財政部將處罰該批金融機構，包括禁止相關金融機構高層入境美國，甚至限制他們參與以美元計價的交易。 彭博網站
20200706-3,20200706,3,陳弘毅：條文沒禁藏港獨旗　譚耀宗靠嚇稱聚集嗌口號已違法,陳弘毅：條文沒禁藏港獨旗　 譚耀宗靠嚇稱聚集嗌口號已違法 【兩制蓋棺】 【本報訊】港版國安法一出，警方即於7.1拘捕藏有「光復香港，時代革命」及港獨標語的人士，但藏有有關物品是否違法，連建制陣營也有不同解讀。基本法委員會委員陳弘毅認為港版國安法並無明文禁止市民藏有，但全國人大常委譚耀宗卻指，叫有關口號及舉旗幟已屬有行動，警方不可能置之不理，叫香港人以後「要小心」。有法律界指港版國安法已去到以言入罪地步，過去國際公約保障的人權不再存在。 陳弘毅昨早在電台節目中，被問到藏有「光復香港，時代革命」等標語物品是否違法時，表明看不到港版國安法有條文禁巿民藏有相關物品，即使警方就此拘捕，不反映港版國安法最終如何解釋，因警方無權解釋法律，即使律政司決定檢控，也不代表港版國安法有禁止巿民藏港獨物品，「就算原訟庭認為呢個被告人有罪，佢最終亦可以上訴到終審庭，當然終審庭之上仲有人大釋法呢個制度，所以我哋要全面咁樣睇」。 「冇人驚搞咁多嚟做乜」 但出席同一節目的譚耀宗就有不同看法，直言叫口號或舉相關港獨標語物品也可能違法，「你講港獨仲唔係（犯法）？你打住個旗幟，同埋嗰啲人群聚集一齊嗌口號、有個行動出嚟，我覺得執法嘅警方都唔可以置之不理。」至於特區政府發言人早前嚴正聲明稱「光復香港 時代革命」口號有港獨含意，譚指政府相關聲明只是說出該口號「可能」有港獨含意，只是一個「提示」，「呢個（聲明）唔係一個法院（判決）呀嘛」。 譚直言巿民在港版國安法立法後「要小心」，不能以不清楚條文為由犯法，又指7.1仍有十人因港版國安法被捕，反映有巿民並不害怕相關法例，「我哋花咗咁大氣力立法，然後最後個法冇用、冇人驚，仲做，我搞咁多嚟做乜？」提醒市民，「有啲以前可能做得，可能今天講有問題」，呼籲港人勿挑戰及衝擊國安法。 郭榮鏗：禁得幾多句口號？ 陳弘毅則指，若有香港人如西班牙加泰隆尼亞地區般在港舉行公投，再根據公投結果決定香港是否獨立、又或就自決獨立爭取世界各國支持，都會違反國安法下的分裂國家罪；若有人捐錢或物資推動港獨和自決行動，亦會涉及分裂國家罪，又稱若有人迫使政府回應政治主張，而如去年般組織、策劃癱瘓機場，即有可能犯恐怖活動罪。 公民黨法律界議員郭榮鏗昨於港台節目《城巿論壇》直言，港版國安法已達至以言入罪惡果，反映香港談不上有言論自由，過去國際公約保障的人權亦不再存在，批評港府極為荒謬和「蠢到不堪」，指將個別口號定性為不能講，則口號永遠刻於人心，不會消失，「今日你禁呢句口號，聽日人哋講另一句口號，你又禁埋，你禁得幾多句口號？」香港民研行政副總裁鍾劍華認為，最大問題其實是官員隨意演繹國安法，「呢種隨意性先至最得人驚」，認為連高喊「利物浦萬歲」也被捕，正正反映上述問題。
20200706-4,20200706,4,譚惠珠：國安案非必然港審,譚惠珠：國安案非必然港審 【本報訊】基本法委員會副主任譚惠珠出席一個基本法研討會時指，涉及國家安全的案件，交由香港審訊並非必然，認為中央將大部份案件審訊權交予香港，是尊重兩制的做法，「唔好周圍同人講高度自治受侵蝕，因為唔係咁樣一回事」。 馮華健：警取搜查令是基本 對於港澳辦副主任張曉明指，謠傳8.31太子站警方打死人令社會仇恨政府或違法，出席同一研討會的基本法委員會委員陳弘毅認為，有關行為是否違法，要視乎是否受外國，因港版國安法針對勾結外國勢力罪行涉多種情況，包括「請求佢（外國勢力）做、串謀佢做、三係受指使或資助去做」。 陳弘毅指發佈8.31太子站假消息亦要視乎是否符合因為受外國指使、資助或串謀等條件，才能視作觸犯港區國安法。 至於日前有區議員辦公室掛出反轉「光復香港，時代革命」旗幟，遭警員未持搜查令進入其辦事處，出席研討會的全國政協委員兼資深大律師馮華健認為，取搜查令是基本要求，「我深信我哋會履行呢個制度」。 至於需否透過國安委及特首將措施制度化，馮華健稱：「呢樣嘢要盡量爭取一個平衡，理性咁樣執行國安法」，又稱實施國安法應取中庸之道，有信心可以實施現行國際公約列明人權保障等條文。
20200706-5,20200706,5,陳弘毅師傅：惡法黑箱作業非社會契約,陳弘毅師傅：惡法黑箱作業非社會契約 【本報訊】基本法委員會委員陳弘毅日前形容港版國安法是中央為一國兩制的繼續實施提出的新的社會契約，要求香港市民履行一種最低的義務。其老師孔傑榮發文駁斥，黑箱作業的國安法並非契約，而是即時收窄了香港的自由。 本身是港大法律學院教授的陳弘毅周六在港台節目《香港家書》中撰文，認為港版國安法的條文可以理解是中央為一國兩制的繼續實施提出的新的社會契約，「這契約要求香港市民履行一種最低的義務，就是不要逾越一國的底線」。他認為，「其實這些要求並不太高，也並非過份，願意接受這些行為準則的香港市民，便能繼續在香港安居樂業。」 曾教授陳弘毅的紐約大學法學院資深教授、中國法律體制專家孔傑榮（Jerome A. Cohen）翌日即在其網誌發文駁斥，網誌題為〈新的港區國安法：照我們意思做，你就沒問題，甚至快樂〉。 「即時收窄了香港自由」 孔傑榮指出，正如每位法律教授都會知道，契約是立約各方自願協定的，但新的國安法絕無可能是契約，「它經由秘密草擬，條文含糊，是不容討論的政治及社會苛法，已經即時收窄了香港自由」。孔傑榮指出，反觀《基本法》起草經過英國及香港民意代表在不同階段參與，建立了一條社會契約。 孔傑榮續指，由內地警察及其本地兵團（minions）執行的新「法治」是「照我們意思做，你就沒問題，甚至快樂」，人民會逐漸連保持緘默的自由也失去，「可悲的是，友善樂觀的時間顯然已經逝去。」 孔傑榮已非首次公開評論港版國安法，他在法例全文公開後翌日，已發表網誌分析新法的弊端。他指出，國安法為中央在港設立了保安及司法上的管控，把香港政府牢牢收歸中央國安機關的操控之下。內地國安人員可以把疑犯關押六個月，其間施以酷刑也沒有律師及家屬可以探訪。 國安法第46條規定，律政司長可基於保護國家秘密等理由，指示相關訴訟毋須在有陪審團的情況下審理。孔傑榮質疑國家秘密定義是甚麼，根據內地慣例，警方可以隨意把任何事情都界定為國家秘密。
20200706-6,20200706,6,鄭若驊：警有合理懷疑就可拉人,鄭若驊：警有合理懷疑就可拉人 【本報訊】港版國安法正式實施未夠一周，由法例解釋到執法標準均引來大量問題，且對全香港大多數市民生活造成的影響亦陸續浮現。港府上周四晚漏夜發聲明，指「光復香港，時代革命」口號有港獨含意，意圖一錘定音指其違反國安法。律政司司長鄭若驊昨在電視台新聞節目中明言，市民若藏有港獨旗幟或印刷品，警方執法時可以「合理懷疑」拘捕，重申市民「唔好去以身試法」。 鄭若驊昨在無綫新聞節目《講清講楚》中，回應生效首日有市民因藏有港獨旗幟或印刷品被捕，對於是否違法，她稱要交由法庭判決，「唔單止係口號或旗幟問題，法庭係會考慮相關證據，去睇吓達唔達到分裂國家」，又否認政府發聲明確認「光復香港，時代革命」的含意，是行政機關向司法機關施壓，「政府一定有佢嘅態度，法庭做嘢係按事實、客觀整體去睇……我相信好少會判呢四個字、呢八個字、呢12個字係點樣」，相信法庭裁決時會整體考慮案件、被告人是否有犯罪意圖及行為。 「勿做引起懷疑的事」 鄭若驊又指，條文內容已清楚表明如何才會涉及犯罪，又明言「警方懷疑，佢哋要調查，可能最終未必會起訴」，重申律政司會因應合理定罪機會決定是否起訴，又指公眾應由另一方向思考，既然不是希望分裂國家，就不要做引起懷疑的事，「希望法律生效後，將所有以前可能試緊底線，或者試緊有冇違法，或者違反《基本法》言論，就唔好再做。」 至於參選資格問題，鄭若驊指難以評論去年區議會選舉中有參選人提出相關口號獲准入閘，選舉主任有否做錯，「唔好將選舉主任工作同國家安全法執法工作拉埋一齊，呢個係兩種唔同情況、法例。」她指，惟現實是，港版國安法中有條文作針對及規範。對於國家安全委員會工作不受司法覆核，亦不受特區任何其他機構、組織和個人干涉，鄭以「國家安全係任何國家嘅頭等大事」為由，指保密度非常重要。
20200706-7,20200706,7,烏坎流亡村官憶暴政者一拖二騙三了　「鄭雁雄記恨　勢報復港媒」,烏坎流亡村官憶暴政者一拖二騙三了　 「鄭雁雄記恨　勢報復港媒」 【兩制蓋棺】 【本報訊】「昨日烏坎，今日香港！」中共任命曾鎮壓汕尾烏坎村抗爭的前汕尾市委書記、現廣東省委秘書長鄭雁雄任駐港國安公署署長，現流亡美國的烏坎村前村官莊烈宏，近日在Twitter貼文怒斥鄭雁雄是屠殺烏坎村兇手，是中共流氓集團跟班狗腿子。莊對本報記者指，北京欽點鄭雁雄這樣的暴政者出掌駐港國安公署，「香港未來將如待宰羔羊」，又指鄭記恨港媒，一定會對港媒秋後算賬。 「如果沒有當年烏坎村民抗爭，我可能出不來（美國），只能死在中共的黑牢裏！」流亡美國的莊烈宏越洋透過電話對本報記者表示，「看到香港的今天，就如看到當年烏坎村民的抗爭」。 莊指，當年烏坎村民抗爭的訴求只是要討回土地和民主選舉，卻遭鄭雁雄掌下的汕尾市當局「一拖二騙三了」的流氓手段對付，最終遭軍警武力鎮壓，「他們先用拖字術，把我們拖累，然後騙我們就範，最後對我們秋後算賬。」 「鄭是中共豢養的看家狗」 莊形容，當局騙目不識丁的村婦在紙上簽名，再對村中幾名核心人物扣上勾結境外勢力、打砸搶等罪名拉人。2011年12月3日莊被捕；9日另一位村代表薛錦波等也被捕，薛兩日後死在汕尾看守所，官方用假影片指薛死於心臟病發，但薛的女兒探望父親發現他鼻口有乾血、身上有瘀傷和被毆打痕迹，「他就是被酷刑死的。」莊烈宏憤憤道：「鄭雁雄對烏坎村人民所欠的血債，一定要還！」 莊指鄭是中共豢養的看家狗，動用幾千公安武警包圍、封鎖烏坎村，甚至出動迫擊炮要「屠村」，事後大肆報復拉人。 莊有幸逃過一劫，成功逃美，但烏坎家中的父母家人被國保24小時監視，家裏遭裝竊聽器、閉路電視監控。莊來美後曾到聯合國總部抗議中共，公安又以其父母做人質，打長途電話給莊，警告要他收聲，「中共流氓集團為對付政敵，甚麼下三濫手段都會用」。 留意反送中　籲港人外逃 採訪中莊向記者展示列印的標語「香港獨立，眾望所歸」和「昨日烏坎，今日香港」，戲言已觸犯港版國安法，但稱比起街頭抗爭的港人他所做的微不足道。他一直有留意去年反送中運動，對15歲女生陳彥霖死亡事件，莊直指非常離譜，認為與烏坎村民被鎮壓有相似之處。他指當年香港記者冒險入村採訪，為烏坎抗爭事件對外發聲，惹怒鄭雁雄，「他出掌國安公署，一定會對香港媒體秋後算賬，對他不喜歡者趕盡殺絕」。 港版國安法通過後，莊烈宏認為香港年輕人外逃在所難免，到英美加澳歐等地相對東南亞台灣等地較安全，因中共對東南亞和台灣的滲透難以想像。他建議香港手足們「能離開，盡量離開」。他認為，如果香港真的出現幾十萬人大逃亡，北京可能會出手干預，因香港作為國際金融城市，中共仍對港有所企求。
20200706-8,20200706,8,逃到美國　揸Uber維生,"逃到美國　揸Uber維生 【本報訊】37歲的莊烈宏是當年烏坎村事件組織者之一，與薛錦波、楊色茂、張建城並稱烏坎四君子。鄭雁雄指揮暴力鎮壓烏坎村後，薛錦波在公安看守所被活活打死，楊色茂、張建城及眾多村民，包括年逾70的村委主任林祖戀被控不同罪名判監；惟莊烈宏成功攜家人以旅遊名義赴美，2014年1月滯留紐約，同年3月尋求政治庇護獲批，2015年取得美國綠卡。 怕連累鄉親不敢聯絡 流亡美國近六年的莊烈宏，與妻子和兩名分別三歲和七歲兒子在紐約生活。莊揸Uber維生，他稱月入8,000美元（約6.1萬港元），笑言較美國其他城市開車收入多兩至三倍，但因武漢肺炎疫情關係已停業近四個月，幸美國政府有補貼，一家人生活還算不錯。 莊烈宏不諱言，雖在美國生活安逸，但他常常夢見烏坎村，夢境中突然畫面一轉就是美國街道，那一刻才驚醒過來。逃美後莊烈宏仍想早日回鄉，與父老鄉親會面，但憂連累村民，坦言不敢與原村委會主任林祖戀等人聯絡；孩子年紀還小、不懂事，「日後再跟他們說中國人的身份吧！」"
20200706-9,20200706,9,布里斯本200人上街聲援香港,布里斯本200人上街聲援香港 【本報訊】港版國安法強行生效，引來國際社會譁然，多國呼籲北京撤回法例，亦有不少海外港人關注事件。澳洲布里斯本港人發起遊行表達不滿，亦有人高呼「光復香港，時代革命」口號，甚至手持寫上「制裁中國」的標語牌。 參加者：已取消回流計劃 澳洲布里斯本的反港版國安法遊行在當地時間周日下午2時開始，以布里斯本喬治國王廣場（King George Square）為終點，遊行人士多穿黑色衣服到場，亦有人戴起象徵抗爭運動的黃色安全帽，又展示「Stand with Hong Kong」橫額，並播放抗爭運動歌曲《願榮光歸香港》。 居於當地的港人張先生表示，現場觀察約有逾200人參加，以往反送中遊行的參與者多高呼「光復香港，時代革命」及「五大訴求，缺一不可」等口號，但他昨日首次聽到有人高呼「獨立」口號，反而再沒有集中爭取五大訴求。有現場人士指，相較去年的反送中遊行，昨日的遊行有更多人參加，且「情緒更激烈」。 港版國安法規管範圍廣泛，條例亦不清晰，張先生直言擔心香港前線抗爭者狀況，認為港版國安法徹底摧毀一國兩制，生效後令港人失去言論自由、出版自由、司法獨立。他坦言已因此改變回流香港計劃，如未來政局不變，不打算回港。
20200706-10,20200706,10,紐時：國安高調　港失法治綠洲,紐時：國安高調　港失法治綠洲 北京在香港實施國安法，並設立機構、派員調查案件，收集情報，美國《紐約時報》的評論文章指出，中國國安機構一向隱密地運作，但在香港卻或一改低調形象，讓這些秘密警察不再秘密，香港這個「法治綠洲」也隨之消失。 學者：可收恐嚇之效 文章標題為〈新國安法下，香港從法治綠洲走向「警察國家」〉，指出國安法讓中國國安機構把手伸到香港，可在港公開運作而不受本地法律及法院監督限制，令香港的法治綠洲消失。華府智庫布魯金斯研究所研究員何瑞恩（Ryan Hass）2013年至2017年間，在白宮國家安全委員會當中國事務主管時，曾與中國國安機構人員打交道，他說中國國內發生的情況跟他們強加香港之上的情況有很多相似之處，形容國安「猶如籠罩在社會上空的烏雲」。 華府智庫史汀生中心中國項目主管孫雲表示，「香港被視為整個中國內部安全的薄弱環節，香港人上街抗議馬上令北京感難堪，因為抗議者質疑中國的威權政權」。負責調查重大國家安全案件、在國內外收集情報的國家安全部很少公開表態，國家安全委員會也很少公開露面，有關委員會活動的線索只是零星地出現在地方政府的網站上，這些網站有時會提到該委員會的會議和指示。 不過，北京在港版國安法下在香港設立多個新機構。中文大學中國政治學者林和立說：「這些機構將起到恐嚇非政府組織和其他社會團體活動的效果，只要知道它們存在，就會有影響。」 美國《紐約時報》
